20:04:50.134264 IP 112.26.2.8.33263 > 112.26.2.1.targus-getdata1: Flags [S], seq 2237936794, win 65535, options [mss 1460,sackOK,TS val 783539 ecr 0,nop,wscale 6,mptcp join id 4 token 0x198aa9c8 nonce 0x69a1915], length 0
20:04:50.134606 IP 112.26.2.1.targus-getdata1 > 112.26.2.8.33263: Flags [S.], seq 3175425225, ack 2237936795, win 65535, options [mss 1460,sackOK,TS val 1012983 ecr 783539,nop,wscale 6,mptcp join id 4 hmac 0x65b033119714dfc9 nonce 0xdc37489a], length 0
20:04:50.221375 IP 112.26.2.1.targus-getdata1 > 112.26.2.8.33263: Flags [S.], seq 3175425225, ack 2237936795, win 65535, options [mss 1460,sackOK,TS val 1012983 ecr 783539,nop,wscale 6,mptcp join id 4 hmac 0x65b033119714dfc9 nonce 0xdc37489a], length 0
20:04:50.347620 IP 112.26.2.8.33263 > 112.26.2.1.targus-getdata1: Flags [.], ack 1, win 2738, options [nop,nop,TS val 783641 ecr 1012983,mptcp join hmac 0x85cb2c8386a5b47ba7fe81a41339d17b68f32e60], length 0
20:04:50.347968 IP 112.26.2.1.targus-getdata1 > 112.26.2.8.33263: Flags [.], ack 1, win 4017, options [nop,nop,TS val 1013197 ecr 783641,mptcp dss ack 3165865863], length 0
20:04:50.354412 IP 112.26.2.1.targus-getdata1 > 112.26.2.8.33263: Flags [.], ack 1, win 4017, options [nop,nop,TS val 1013197 ecr 783641,mptcp dss ack 3165865863], length 0
20:04:50.497984 IP 112.26.2.8.33263 > 112.26.2.1.targus-getdata1: Flags [P.], seq 1:84, ack 1, win 4107, options [nop,nop,TS val 783873 ecr 1013197,mptcp dss ack 346306052 seq 3165865867 subseq 1 len 83 csum 0x8e9f], length 83
20:05:32.852469 IP 112.26.2.8.52139 > 112.26.2.1.targus-getdata1: Flags [.], seq 1411220303:1411221731, ack 1694979904, win 4107, options [nop,nop,TS val 825540 ecr 1054265,mptcp dss ack 2724680102 seq 1002454366 subseq 347005 len 1428 csum 0x3cfd], length 1428
20:05:32.852749 IP 112.26.2.1.targus-getdata1 > 112.26.2.8.52139: Flags [.], ack 1428, win 24048, options [nop,nop,TS val 1055702 ecr 825540,mptcp dss ack 1002318706], length 0
20:05:32.959109 IP 112.26.2.1.targus-getdata1 > 112.26.2.8.52139: Flags [.], ack 1428, win 24048, options [nop,nop,TS val 1055702 ecr 825540,mptcp dss ack 1002318706], length 0
20:05:33.042891 IP 112.26.2.8.52139 > 112.26.2.1.targus-getdata1: Flags [.], seq 1428:2856, ack 1, win 4107, options [nop,nop,TS val 825772 ecr 1054428,mptcp dss ack 2724680102 seq 1002462934 subseq 348433 len 1428 csum 0x5a93], length 1428
20:05:33.043174 IP 112.26.2.1.targus-getdata1 > 112.26.2.8.52139: Flags [.], ack 2856, win 24048, options [nop,nop,TS val 1055892 ecr 825772,mptcp dss ack 1002318706], length 0
20:05:33.094348 IP 112.26.2.1.targus-getdata1 > 112.26.2.8.52139: Flags [.], ack 2856, win 24048, options [nop,nop,TS val 1055892 ecr 825772,mptcp dss ack 1002318706], length 0
20:05:33.154252 IP 112.26.2.8.52139 > 112.26.2.1.targus-getdata1: Flags [.], seq 2856:4284, ack 1, win 4107, options [nop,nop,TS val 825882 ecr 1054583,mptcp dss ack 2724680102 seq 1002464362 subseq 349861 len 1428 csum 0x7d40], length 1428
20:05:33.154552 IP 112.26.2.1.targus-getdata1 > 112.26.2.8.52139: Flags [.], ack 4284, win 23781, options [nop,nop,TS val 1056003 ecr 825882,mptcp dss ack 1002335842], length 0
20:05:33.262416 IP 112.26.2.1.targus-getdata1 > 112.26.2.8.52139: Flags [.], ack 4284, win 23781, options [nop,nop,TS val 1056003 ecr 825882,mptcp dss ack 1002335842], length 0
20:05:33.330766 IP 112.26.2.8.52139 > 112.26.2.1.targus-getdata1: Flags [.], seq 4284:5712, ack 1, win 4107, options [nop,nop,TS val 825988 ecr 1054833,mptcp dss ack 2724680102 seq 1002471502 subseq 351289 len 1428 csum 0x7788], length 1428
20:05:33.331097 IP 112.26.2.1.targus-getdata1 > 112.26.2.8.52139: Flags [.], ack 5712, win 23781, options [nop,nop,TS val 1056180 ecr 825988,mptcp dss ack 1002335842], length 0
20:05:33.416992 IP 112.26.2.1.targus-getdata1 > 112.26.2.8.52139: Flags [.], ack 5712, win 23781, options [nop,nop,TS val 1056180 ecr 825988,mptcp dss ack 1002335842], length 0
20:05:33.483486 IP 112.26.2.8.52139 > 112.26.2.1.targus-getdata1: Flags [.], seq 5712:7140, ack 1, win 4107, options [nop,nop,TS val 826242 ecr 1055043,mptcp dss ack 2724680102 seq 1002475786 subseq 352717 len 1428 csum 0x2a17], length 1428
20:05:33.483766 IP 112.26.2.1.targus-getdata1 > 112.26.2.8.52139: Flags [.], ack 7140, win 23781, options [nop,nop,TS val 1056332 ecr 826242,mptcp dss ack 1002335842], length 0
20:05:33.572531 IP 112.26.2.8.52139 > 112.26.2.1.targus-getdata1: Flags [.], seq 7140:8568, ack 1, win 4107, options [nop,nop,TS val 826242 ecr 1055043,mptcp dss ack 2724680102 seq 1002477214 subseq 354145 len 1428 csum 0x59c0], length 1428
20:05:33.572860 IP 112.26.2.1.targus-getdata1 > 112.26.2.8.52139: Flags [.], ack 8568, win 23781, options [nop,nop,TS val 1056421 ecr 826242,mptcp dss ack 1002335842], length 0
20:05:33.629426 IP 112.26.2.1.targus-getdata1 > 112.26.2.8.52139: Flags [.], ack 7140, win 23781, options [nop,nop,TS val 1056332 ecr 826242,mptcp dss ack 1002335842], length 0
20:05:33.704907 IP 112.26.2.1.targus-getdata1 > 112.26.2.8.52139: Flags [.], ack 8568, win 23781, options [nop,nop,TS val 1056421 ecr 826242,mptcp dss ack 1002335842], length 0
20:05:33.791896 IP 112.26.2.8.52139 > 112.26.2.1.targus-getdata1: Flags [.], seq 8568:9996, ack 1, win 4107, options [nop,nop,TS val 826428 ecr 1055216,mptcp dss ack 2724680102 seq 1002484354 subseq 355573 len 1428 csum 0xd244], length 1428
20:05:33.792140 IP 112.26.2.1.targus-getdata1 > 112.26.2.8.52139: Flags [.], ack 9996, win 23781, options [nop,nop,TS val 1056641 ecr 826428,mptcp dss ack 1002335842], length 0
20:05:33.914913 IP 112.26.2.1.targus-getdata1 > 112.26.2.8.52139: Flags [.], ack 9996, win 23781, options [nop,nop,TS val 1056641 ecr 826428,mptcp dss ack 1002335842], length 0
20:05:33.977503 IP 112.26.2.8.52139 > 112.26.2.1.targus-getdata1: Flags [.], seq 9996:11424, ack 1, win 4107, options [nop,nop,TS val 826703 ecr 1055512,mptcp dss ack 2724680102 seq 1002494350 subseq 357001 len 1428 csum 0x55f6], length 1428
20:05:33.977841 IP 112.26.2.1.targus-getdata1 > 112.26.2.8.52139: Flags [.], ack 11424, win 23781, options [nop,nop,TS val 1056826 ecr 826703,mptcp dss ack 1002335842], length 0
20:05:34.086447 IP 112.26.2.1.targus-getdata1 > 112.26.2.8.52139: Flags [.], ack 11424, win 23781, options [nop,nop,TS val 1056826 ecr 826703,mptcp dss ack 1002335842], length 0
20:05:34.137185 IP 112.26.2.8.52139 > 112.26.2.1.targus-getdata1: Flags [.], seq 11424:12852, ack 1, win 4107, options [nop,nop,TS val 826962 ecr 1055702,mptcp dss ack 2724680102 seq 1002501490 subseq 358429 len 1428 csum 0xee2d], length 1428
20:05:34.137563 IP 112.26.2.1.targus-getdata1 > 112.26.2.8.52139: Flags [.], ack 12852, win 23781, options [nop,nop,TS val 1056986 ecr 826962,mptcp dss ack 1002335842], length 0
20:05:34.221765 IP 112.26.2.1.targus-getdata1 > 112.26.2.8.52139: Flags [.], ack 12852, win 23781, options [nop,nop,TS val 1056986 ecr 826962,mptcp dss ack 1002335842], length 0
20:05:34.374205 IP 112.26.2.8.52139 > 112.26.2.1.targus-getdata1: Flags [.], seq 12852:14280, ack 1, win 4107, options [nop,nop,TS val 827136 ecr 1055892,mptcp dss ack 2724680102 seq 1002510058 subseq 359857 len 1428 csum 0x6b4e], length 1428
20:05:34.374483 IP 112.26.2.1.targus-getdata1 > 112.26.2.8.52139: Flags [.], ack 14280, win 23781, options [nop,nop,TS val 1057223 ecr 827136,mptcp dss ack 1002335842], length 0
20:05:34.477668 IP 112.26.2.1.targus-getdata1 > 112.26.2.8.52139: Flags [.], ack 14280, win 23781, options [nop,nop,TS val 1057223 ecr 827136,mptcp dss ack 1002335842], length 0
20:05:34.593464 IP 112.26.2.8.52139 > 112.26.2.1.targus-getdata1: Flags [.], seq 14280:15708, ack 1, win 4107, options [nop,nop,TS val 827202 ecr 1056003,mptcp dss ack 2724680102 seq 1002514342 subseq 361285 len 1428 csum 0xda51], length 1428
20:05:34.593766 IP 112.26.2.1.targus-getdata1 > 112.26.2.8.52139: Flags [.], ack 15708, win 23781, options [nop,nop,TS val 1057443 ecr 827202,mptcp dss ack 1002335842], length 0
20:05:34.633811 IP 112.26.2.1.targus-getdata1 > 112.26.2.8.52139: Flags [.], ack 15708, win 23781, options [nop,nop,TS val 1057443 ecr 827202,mptcp dss ack 1002335842], length 0
20:05:34.702970 IP 112.26.2.8.52139 > 112.26.2.1.targus-getdata1: Flags [.], seq 15708:17136, ack 1, win 4107, options [nop,nop,TS val 827360 ecr 1056180,mptcp dss ack 2724680102 seq 1002522910 subseq 362713 len 1428 csum 0xf3bd], length 1428
20:05:34.743881 IP 112.26.2.1.targus-getdata1 > 112.26.2.8.52139: Flags [.], ack 17136, win 23781, options [nop,nop,TS val 1057593 ecr 827360,mptcp dss ack 1002335842], length 0
20:05:34.812945 IP 112.26.2.1.targus-getdata1 > 112.26.2.8.52139: Flags [.], ack 17136, win 23781, options [nop,nop,TS val 1057593 ecr 827360,mptcp dss ack 1002335842], length 0
20:05:34.868616 IP 112.26.2.8.52139 > 112.26.2.1.targus-getdata1: Flags [.], seq 17136:18564, ack 1, win 4107, options [nop,nop,TS val 827547 ecr 1056332,mptcp dss ack 2724680102 seq 1002528622 subseq 364141 len 1428 csum 0x1e39], length 1428
20:05:34.951047 IP 112.26.2.1.targus-getdata1 > 112.26.2.8.52139: Flags [.], ack 18564, win 23781, options [nop,nop,TS val 1057800 ecr 827547,mptcp dss ack 1002335842], length 0
20:05:34.976246 IP 112.26.2.1.targus-getdata1 > 112.26.2.8.52139: Flags [.], ack 18564, win 23781, options [nop,nop,TS val 1057800 ecr 827547,mptcp dss ack 1002335842], length 0
20:05:35.066342 IP 112.26.2.8.52139 > 112.26.2.1.targus-getdata1: Flags [.], seq 18564:19992, ack 1, win 4107, options [nop,nop,TS val 827727 ecr 1056421,mptcp dss ack 2724680102 seq 1002531478 subseq 365569 len 1428 csum 0xd2a], length 1428
20:05:35.163999 IP 112.26.2.8.52139 > 112.26.2.1.targus-getdata1: Flags [.], seq 19992:21420, ack 1, win 4107, options [nop,nop,TS val 827727 ecr 1056421,mptcp dss ack 2724680102 seq 1002532906 subseq 366997 len 1428 csum 0xf1ab], length 1428
20:05:35.230499 IP 112.26.2.1.targus-getdata1 > 112.26.2.8.52139: Flags [.], ack 21420, win 23781, options [nop,nop,TS val 1058080 ecr 827727,mptcp dss ack 1002335842], length 0
20:05:35.233538 IP 112.26.2.1.targus-getdata1 > 112.26.2.8.52139: Flags [.], ack 21420, win 23781, options [nop,nop,TS val 1058080 ecr 827727,mptcp dss ack 1002335842], length 0
20:05:35.323561 IP 112.26.2.8.52139 > 112.26.2.1.targus-getdata1: Flags [.], seq 21420:22848, ack 1, win 4107, options [nop,nop,TS val 827963 ecr 1056641,mptcp dss ack 2724680102 seq 1002541474 subseq 368425 len 1428 csum 0x796a], length 1428
20:05:35.406416 IP 112.26.2.8.52139 > 112.26.2.1.targus-getdata1: Flags [.], seq 22848:24276, ack 1, win 4107, options [nop,nop,TS val 828160 ecr 1056826,mptcp dss ack 2724680102 seq 1002545758 subseq 369853 len 1428 csum 0x1f82], length 1428
20:05:35.549785 IP 112.26.2.8.52139 > 112.26.2.1.targus-getdata1: Flags [.], seq 24276:25704, ack 1, win 4107, options [nop,nop,TS val 828348 ecr 1056986,mptcp dss ack 2724680102 seq 1002511486 subseq 371281 len 1428 csum 0xda3f], length 1428
20:05:35.550083 IP 112.26.2.1.targus-getdata1 > 112.26.2.8.52139: Flags [.], ack 25704, win 23781, options [nop,nop,TS val 1058399 ecr 827963,mptcp dss ack 1002335842], length 0
20:05:35.626035 IP 112.26.2.1.targus-getdata1 > 112.26.2.8.52139: Flags [.], ack 25704, win 23781, options [nop,nop,TS val 1058399 ecr 827963,mptcp dss ack 1002335842], length 0
20:05:35.720057 IP 112.26.2.8.52139 > 112.26.2.1.targus-getdata1: Flags [.], seq 25704:27132, ack 1, win 4107, options [nop,nop,TS val 828348 ecr 1056986,mptcp dss ack 2724680102 seq 1002512914 subseq 372709 len 1428 csum 0x276b], length 1428
20:05:35.794908 IP 112.26.2.8.52139 > 112.26.2.1.targus-getdata1: Flags [.], seq 27132:28560, ack 1, win 4107, options [nop,nop,TS val 828593 ecr 1057223,mptcp dss ack 2724680102 seq 1002538618 subseq 374137 len 1428 csum 0x4ce8], length 1428
20:05:35.950683 IP 112.26.2.8.52139 > 112.26.2.1.targus-getdata1: Flags [.], seq 28560:29988, ack 1, win 4107, options [nop,nop,TS val 828723 ecr 1057443,mptcp dss ack 2724680102 seq 1002548614 subseq 375565 len 1428 csum 0x14d0], length 1428
20:05:35.950997 IP 112.26.2.1.targus-getdata1 > 112.26.2.8.52139: Flags [.], ack 29988, win 23781, options [nop,nop,TS val 1058800 ecr 828348,mptcp dss ack 1002335842], length 0
20:05:36.024900 IP 112.26.2.1.targus-getdata1 > 112.26.2.8.52139: Flags [.], ack 29988, win 23781, options [nop,nop,TS val 1058800 ecr 828348,mptcp dss ack 1002335842], length 0
20:05:36.114045 IP 112.26.2.8.52139 > 112.26.2.1.targus-getdata1: Flags [.], seq 29988:31416, ack 1, win 4107, options [nop,nop,TS val 828723 ecr 1057443,mptcp dss ack 2724680102 seq 1002550042 subseq 376993 len 1428 csum 0xa099], length 1428
20:05:36.194474 IP 112.26.2.8.52139 > 112.26.2.1.targus-getdata1: Flags [.], seq 31416:32844, ack 1, win 4107, options [nop,nop,TS val 828900 ecr 1057593,mptcp dss ack 2724680102 seq 1002552898 subseq 378421 len 1428 csum 0x87ed], length 1428
20:05:36.297373 IP 112.26.2.8.52139 > 112.26.2.1.targus-getdata1: Flags [.], seq 32844:34272, ack 1, win 4107, options [nop,nop,TS val 829064 ecr 1057800,mptcp dss ack 2724680102 seq 1002560038 subseq 379849 len 1428 csum 0x4c97], length 1428
20:05:36.383677 IP 112.26.2.8.52139 > 112.26.2.1.targus-getdata1: Flags [.], seq 34272:35700, ack 1, win 4107, options [nop,nop,TS val 829064 ecr 1057800,mptcp dss ack 2724680102 seq 1002561466 subseq 381277 len 1428 csum 0x3f1a], length 1428
20:05:36.384013 IP 112.26.2.1.targus-getdata1 > 112.26.2.8.52139: Flags [.], ack 35700, win 23781, options [nop,nop,TS val 1059233 ecr 828723,mptcp dss ack 1002335842], length 0
20:05:36.473836 IP 112.26.2.1.targus-getdata1 > 112.26.2.8.52139: Flags [.], ack 35700, win 23781, options [nop,nop,TS val 1059233 ecr 828723,mptcp dss ack 1002335842], length 0
20:05:36.547235 IP 112.26.2.8.52139 > 112.26.2.1.targus-getdata1: Flags [.], seq 35700:37128, ack 1, win 4107, options [nop,nop,TS val 829319 ecr 1058080,mptcp dss ack 2724680102 seq 1002571462 subseq 382705 len 1428 csum 0xf2ea], length 1428
20:05:36.615497 IP 112.26.2.8.52139 > 112.26.2.1.targus-getdata1: Flags [.], seq 37128:38556, ack 1, win 4107, options [nop,nop,TS val 829319 ecr 1058080,mptcp dss ack 2724680102 seq 1002572890 subseq 384133 len 1428 csum 0x8d40], length 1428
20:05:36.615822 IP 112.26.2.1.targus-getdata1 > 112.26.2.8.52139: Flags [.], ack 38556, win 24411, options [nop,nop,TS val 1059464 ecr 829319,mptcp dss ack 1002551470], length 0
20:05:36.779504 IP 112.26.2.1.targus-getdata1 > 112.26.2.8.52139: Flags [.], ack 38556, win 24411, options [nop,nop,TS val 1059464 ecr 829319,mptcp dss ack 1002551470], length 0
20:05:36.874711 IP 112.26.2.8.52139 > 112.26.2.1.targus-getdata1: Flags [.], seq 38556:39984, ack 1, win 4107, options [nop,nop,TS val 829319 ecr 1058080,mptcp dss ack 2724680102 seq 1002574318 subseq 385561 len 1428 csum 0xe02f], length 1428
20:05:36.939960 IP 112.26.2.8.52139 > 112.26.2.1.targus-getdata1: Flags [.], seq 39984:41412, ack 1, win 4107, options [nop,nop,TS val 829603 ecr 1058399,mptcp dss ack 2724680102 seq 1002584314 subseq 386989 len 1428 csum 0xaa7c], length 1428
20:05:36.940380 IP 112.26.2.1.targus-getdata1 > 112.26.2.8.52139: Flags [.], ack 41412, win 24471, options [nop,nop,TS val 1059789 ecr 829319,mptcp dss ack 1002567178], length 0
20:05:37.013732 IP 112.26.2.8.52139 > 112.26.2.1.targus-getdata1: Flags [.], seq 41412:42840, ack 1, win 4107, options [nop,nop,TS val 829603 ecr 1058399,mptcp dss ack 2724680102 seq 1002585742 subseq 388417 len 1428 csum 0x1485], length 1428
20:05:37.102908 IP 112.26.2.8.52139 > 112.26.2.1.targus-getdata1: Flags [.], seq 42840:44268, ack 1, win 4107, options [nop,nop,TS val 829603 ecr 1058399,mptcp dss ack 2724680102 seq 1002587170 subseq 389845 len 1428 csum 0x79a9], length 1428
20:05:37.174705 IP 112.26.2.1.targus-getdata1 > 112.26.2.8.52139: Flags [.], ack 44268, win 24471, options [nop,nop,TS val 1060024 ecr 829603,mptcp dss ack 1002567178], length 0
20:05:37.185801 IP 112.26.2.1.targus-getdata1 > 112.26.2.8.52139: Flags [.], ack 41412, win 24471, options [nop,nop,TS val 1059789 ecr 829319,mptcp dss ack 1002567178], length 0
20:05:37.250982 IP 112.26.2.8.52139 > 112.26.2.1.targus-getdata1: Flags [.], seq 44268:45696, ack 1, win 4107, options [nop,nop,TS val 829603 ecr 1058399,mptcp dss ack 2724680102 seq 1002588598 subseq 391273 len 1428 csum 0x232e], length 1428
20:05:37.342756 IP 112.26.2.1.targus-getdata1 > 112.26.2.8.52139: Flags [.], ack 44268, win 24471, options [nop,nop,TS val 1060024 ecr 829603,mptcp dss ack 1002567178], length 0
20:05:37.411833 IP 112.26.2.8.52139 > 112.26.2.1.targus-getdata1: Flags [.], seq 45696:47124, ack 1, win 4107, options [nop,nop,TS val 830080 ecr 1058800,mptcp dss ack 2724680102 seq 1002601450 subseq 392701 len 1428 csum 0x3a5b], length 1428
20:05:37.542951 IP 112.26.2.1.targus-getdata1 > 112.26.2.8.52139: Flags [.], ack 47124, win 24471, options [nop,nop,TS val 1060392 ecr 829603,mptcp dss ack 1002567178], length 0
20:05:37.560655 IP 112.26.2.8.52139 > 112.26.2.1.targus-getdata1: Flags [.], seq 47124:48552, ack 1, win 4107, options [nop,nop,TS val 830080 ecr 1058800,mptcp dss ack 2724680102 seq 1002602878 subseq 394129 len 1428 csum 0x138e], length 1428
20:05:37.632840 IP 112.26.2.1.targus-getdata1 > 112.26.2.8.52139: Flags [.], ack 47124, win 24471, options [nop,nop,TS val 1060392 ecr 829603,mptcp dss ack 1002567178], length 0
20:05:37.737136 IP 112.26.2.8.52139 > 112.26.2.1.targus-getdata1: Flags [.], seq 49980:51408, ack 1, win 4107, options [nop,nop,TS val 830080 ecr 1058800,mptcp dss ack 2724680102 seq 1002605734 subseq 396985 len 1428 csum 0x366b], length 1428
20:05:37.737464 IP 112.26.2.1.targus-getdata1 > 112.26.2.8.52139: Flags [.], ack 48552, win 24471, options [nop,nop,TS val 1060586 ecr 830080,nop,nop,sack 1 {49980:51408},mptcp dss ack 1002567178], length 0
20:05:37.868127 IP 112.26.2.1.targus-getdata1 > 112.26.2.8.52139: Flags [.], ack 48552, win 24471, options [nop,nop,TS val 1060586 ecr 830080,nop,nop,sack 1 {49980:51408},mptcp dss ack 1002567178], length 0
20:05:37.958426 IP 112.26.2.8.52139 > 112.26.2.1.targus-getdata1: Flags [.], seq 51408:52836, ack 1, win 4107, options [nop,nop,TS val 830080 ecr 1058800,mptcp dss ack 2724680102 seq 1002607162 subseq 398413 len 1428 csum 0xd38a], length 1428
20:05:37.958792 IP 112.26.2.1.targus-getdata1 > 112.26.2.8.52139: Flags [.], ack 48552, win 24471, options [nop,nop,TS val 1060808 ecr 830080,nop,nop,sack 1 {49980:52836},mptcp dss ack 1002567178], length 0
20:05:38.049696 IP 112.26.2.8.52139 > 112.26.2.1.targus-getdata1: Flags [.], seq 52836:54264, ack 1, win 4107, options [nop,nop,TS val 830454 ecr 1059233,mptcp dss ack 2724680102 seq 1002622870 subseq 399841 len 1428 csum 0xd551], length 1428
20:05:38.050082 IP 112.26.2.1.targus-getdata1 > 112.26.2.8.52139: Flags [.], ack 48552, win 24471, options [nop,nop,TS val 1060899 ecr 830080,nop,nop,sack 1 {49980:54264},mptcp dss ack 1002567178], length 0
20:05:38.146816 IP 112.26.2.1.targus-getdata1 > 112.26.2.8.52139: Flags [.], ack 48552, win 24471, options [nop,nop,TS val 1060808 ecr 830080,nop,nop,sack 1 {49980:52836},mptcp dss ack 1002567178], length 0
20:05:38.227787 IP 112.26.2.8.52139 > 112.26.2.1.targus-getdata1: Flags [.], seq 54264:55692, ack 1, win 4107, options [nop,nop,TS val 830455 ecr 1059233,mptcp dss ack 2724680102 seq 1002624298 subseq 401269 len 1428 csum 0xb9bc], length 1428
20:05:38.228075 IP 112.26.2.1.targus-getdata1 > 112.26.2.8.52139: Flags [.], ack 48552, win 24471, options [nop,nop,TS val 1061077 ecr 830080,nop,nop,sack 1 {49980:55692},mptcp dss ack 1002567178], length 0
20:05:38.339342 IP 112.26.2.1.targus-getdata1 > 112.26.2.8.52139: Flags [.], ack 48552, win 24471, options [nop,nop,TS val 1060899 ecr 830080,nop,nop,sack 1 {49980:54264},mptcp dss ack 1002567178], length 0
20:05:38.400058 IP 112.26.2.8.52139 > 112.26.2.1.targus-getdata1: Flags [.], seq 57120:58548, ack 1, win 4107, options [nop,nop,TS val 830455 ecr 1059233,mptcp dss ack 2724680102 seq 1002627154 subseq 404125 len 1428 csum 0xba4c], length 1428
20:05:38.400339 IP 112.26.2.1.targus-getdata1 > 112.26.2.8.52139: Flags [.], ack 48552, win 24471, options [nop,nop,TS val 1061249 ecr 830080,nop,nop,sack 2 {57120:58548}{49980:55692},mptcp dss ack 1002567178], length 0
20:05:38.512863 IP 112.26.2.8.52139 > 112.26.2.1.targus-getdata1: Flags [.], seq 58548:59976, ack 1, win 4107, options [nop,nop,TS val 830944 ecr 1059464,mptcp dss ack 2724680102 seq 1002654286 subseq 405553 len 1428 csum 0xc206], length 1428
20:05:38.513189 IP 112.26.2.1.targus-getdata1 > 112.26.2.8.52139: Flags [.], ack 48552, win 24471, options [nop,nop,TS val 1061361 ecr 830080,nop,nop,sack 2 {57120:59976}{49980:55692},mptcp dss ack 1002567178], length 0
20:05:38.599869 IP 112.26.2.1.targus-getdata1 > 112.26.2.8.52139: Flags [.], ack 48552, win 24471, options [nop,nop,TS val 1061077 ecr 830080,nop,nop,sack 1 {49980:55692},mptcp dss ack 1002567178], length 0
20:05:38.691980 IP 112.26.2.8.52139 > 112.26.2.1.targus-getdata1: Flags [.], seq 59976:61404, ack 1, win 4107, options [nop,nop,TS val 830944 ecr 1059464,mptcp dss ack 2724680102 seq 1002655714 subseq 406981 len 1428 csum 0xa227], length 1428
20:05:38.692349 IP 112.26.2.1.targus-getdata1 > 112.26.2.8.52139: Flags [.], ack 48552, win 24471, options [nop,nop,TS val 1061541 ecr 830080,nop,nop,sack 2 {57120:61404}{49980:55692},mptcp dss ack 1002567178], length 0
20:05:38.775980 IP 112.26.2.8.52139 > 112.26.2.1.targus-getdata1: Flags [.], seq 61404:62832, ack 1, win 4107, options [nop,nop,TS val 830944 ecr 1059464,mptcp dss ack 2724680102 seq 1002657142 subseq 408409 len 1428 csum 0x126c], length 1428
20:05:38.776278 IP 112.26.2.1.targus-getdata1 > 112.26.2.8.52139: Flags [.], ack 48552, win 24471, options [nop,nop,TS val 1061625 ecr 830080,nop,nop,sack 2 {57120:62832}{49980:55692},mptcp dss ack 1002567178], length 0
20:05:38.866891 IP 112.26.2.1.targus-getdata1 > 112.26.2.8.52139: Flags [.], ack 48552, win 24471, options [nop,nop,TS val 1061249 ecr 830080,nop,nop,sack 2 {57120:58548}{49980:55692},mptcp dss ack 1002567178], length 0
20:05:38.965753 IP 112.26.2.1.targus-getdata1 > 112.26.2.8.52139: Flags [.], ack 48552, win 24471, options [nop,nop,TS val 1061361 ecr 830080,nop,nop,sack 2 {57120:59976}{49980:55692},mptcp dss ack 1002567178], length 0
20:05:39.016809 IP 112.26.2.8.52139 > 112.26.2.1.targus-getdata1: Flags [.], seq 62832:64260, ack 1, win 4107, options [nop,nop,TS val 831308 ecr 1059789,mptcp dss ack 2724680102 seq 1002669994 subseq 409837 len 1428 csum 0xbd93], length 1428
20:05:39.017134 IP 112.26.2.1.targus-getdata1 > 112.26.2.8.52139: Flags [.], ack 48552, win 24471, options [nop,nop,TS val 1061866 ecr 830080,nop,nop,sack 2 {57120:64260}{49980:55692},mptcp dss ack 1002567178], length 0
20:05:39.129334 IP 112.26.2.8.52139 > 112.26.2.1.targus-getdata1: Flags [.], seq 64260:65688, ack 1, win 4107, options [nop,nop,TS val 831308 ecr 1059789,mptcp dss ack 2724680102 seq 1002671422 subseq 411265 len 1428 csum 0xc192], length 1428
20:05:39.129661 IP 112.26.2.1.targus-getdata1 > 112.26.2.8.52139: Flags [.], ack 48552, win 23892, options [nop,nop,TS val 1061978 ecr 830080,nop,nop,sack 2 {57120:65688}{49980:55692},mptcp dss ack 1002604306], length 0
20:05:39.241674 IP 112.26.2.1.targus-getdata1 > 112.26.2.8.52139: Flags [.], ack 48552, win 24471, options [nop,nop,TS val 1061541 ecr 830080,nop,nop,sack 2 {57120:61404}{49980:55692},mptcp dss ack 1002567178], length 0
20:05:39.315823 IP 112.26.2.8.52139 > 112.26.2.1.targus-getdata1: Flags [.], seq 65688:67116, ack 1, win 4107, options [nop,nop,TS val 831308 ecr 1059789,mptcp dss ack 2724680102 seq 1002672850 subseq 412693 len 1428 csum 0xe67d], length 1428
20:05:39.316102 IP 112.26.2.1.targus-getdata1 > 112.26.2.8.52139: Flags [.], ack 48552, win 23892, options [nop,nop,TS val 1062165 ecr 830080,nop,nop,sack 2 {57120:67116}{49980:55692},mptcp dss ack 1002604306], length 0
20:05:39.399562 IP 112.26.2.1.targus-getdata1 > 112.26.2.8.52139: Flags [.], ack 48552, win 24471, options [nop,nop,TS val 1061625 ecr 830080,nop,nop,sack 2 {57120:62832}{49980:55692},mptcp dss ack 1002567178], length 0
20:05:39.437819 IP 112.26.2.8.52139 > 112.26.2.1.targus-getdata1: Flags [.], seq 67116:68544, ack 1, win 4107, options [nop,nop,TS val 831751 ecr 1060392,mptcp dss ack 2724680102 seq 1002684274 subseq 414121 len 1428 csum 0x228], length 1428
20:05:39.438158 IP 112.26.2.1.targus-getdata1 > 112.26.2.8.52139: Flags [.], ack 48552, win 23892, options [nop,nop,TS val 1062287 ecr 830080,nop,nop,sack 2 {57120:68544}{49980:55692},mptcp dss ack 1002604306], length 0
20:05:39.536200 IP 112.26.2.1.targus-getdata1 > 112.26.2.8.52139: Flags [.], ack 48552, win 24471, options [nop,nop,TS val 1061866 ecr 830080,nop,nop,sack 2 {57120:64260}{49980:55692},mptcp dss ack 1002567178], length 0
20:05:39.622910 IP 112.26.2.8.52139 > 112.26.2.1.targus-getdata1: Flags [.], seq 68544:69972, ack 1, win 4107, options [nop,nop,TS val 831751 ecr 1060392,mptcp dss ack 2724680102 seq 1002685702 subseq 415549 len 1428 csum 0x67c7], length 1428
20:05:39.623255 IP 112.26.2.1.targus-getdata1 > 112.26.2.8.52139: Flags [.], ack 48552, win 23892, options [nop,nop,TS val 1062472 ecr 830080,nop,nop,sack 2 {57120:69972}{49980:55692},mptcp dss ack 1002604306], length 0
20:05:39.705779 IP 112.26.2.1.targus-getdata1 > 112.26.2.8.52139: Flags [.], ack 48552, win 23892, options [nop,nop,TS val 1061978 ecr 830080,nop,nop,sack 2 {57120:65688}{49980:55692},mptcp dss ack 1002604306], length 0
20:05:39.873261 IP 112.26.2.8.52139 > 112.26.2.1.targus-getdata1: Flags [.], seq 69972:71400, ack 1, win 4107, options [nop,nop,TS val 831751 ecr 1060392,mptcp dss ack 2724680102 seq 1002687130 subseq 416977 len 1428 csum 0xc407], length 1428
20:05:39.873472 IP 112.26.2.1.targus-getdata1 > 112.26.2.8.52139: Flags [.], ack 48552, win 23892, options [nop,nop,TS val 1062722 ecr 830080,nop,nop,sack 2 {57120:71400}{49980:55692},mptcp dss ack 1002604306], length 0
20:05:39.953598 IP 112.26.2.8.52139 > 112.26.2.1.targus-getdata1: Flags [.], seq 71400:72828, ack 1, win 4107, options [nop,nop,TS val 831751 ecr 1060392,mptcp dss ack 2724680102 seq 1002688558 subseq 418405 len 1428 csum 0xdb4d], length 1428
20:05:39.953936 IP 112.26.2.1.targus-getdata1 > 112.26.2.8.52139: Flags [.], ack 48552, win 23892, options [nop,nop,TS val 1062803 ecr 830080,nop,nop,sack 2 {57120:72828}{49980:55692},mptcp dss ack 1002604306], length 0
20:05:40.027972 IP 112.26.2.1.targus-getdata1 > 112.26.2.8.52139: Flags [.], ack 48552, win 23892, options [nop,nop,TS val 1062165 ecr 830080,nop,nop,sack 2 {57120:67116}{49980:55692},mptcp dss ack 1002604306], length 0
20:05:40.080155 IP 112.26.2.8.52139 > 112.26.2.1.targus-getdata1: Flags [.], seq 72828:74256, ack 1, win 4107, options [nop,nop,TS val 831855 ecr 1060586,mptcp dss ack 2724680102 seq 1002691414 subseq 419833 len 1428 csum 0x9f8a], length 1428
20:05:40.080504 IP 112.26.2.1.targus-getdata1 > 112.26.2.8.52139: Flags [.], ack 48552, win 23892, options [nop,nop,TS val 1062929 ecr 830080,nop,nop,sack 2 {57120:74256}{49980:55692},mptcp dss ack 1002604306], length 0
20:05:40.170903 IP 112.26.2.1.targus-getdata1 > 112.26.2.8.52139: Flags [.], ack 48552, win 23892, options [nop,nop,TS val 1062287 ecr 830080,nop,nop,sack 2 {57120:68544}{49980:55692},mptcp dss ack 1002604306], length 0
20:05:40.223883 IP 112.26.2.8.52139 > 112.26.2.1.targus-getdata1: Flags [.], seq 74256:75684, ack 1, win 4107, options [nop,nop,TS val 831855 ecr 1060586,mptcp dss ack 2724680102 seq 1002692842 subseq 421261 len 1428 csum 0xfb2], length 1428
20:05:40.224189 IP 112.26.2.1.targus-getdata1 > 112.26.2.8.52139: Flags [.], ack 48552, win 23892, options [nop,nop,TS val 1063073 ecr 830080,nop,nop,sack 2 {57120:75684}{49980:55692},mptcp dss ack 1002604306], length 0
20:05:40.313558 IP 112.26.2.8.52139 > 112.26.2.1.targus-getdata1: Flags [.], seq 75684:77112, ack 1, win 4107, options [nop,nop,TS val 831855 ecr 1060586,mptcp dss ack 2724680102 seq 1002694270 subseq 422689 len 1428 csum 0x24f2], length 1428
20:05:40.313887 IP 112.26.2.1.targus-getdata1 > 112.26.2.8.52139: Flags [.], ack 48552, win 23892, options [nop,nop,TS val 1063162 ecr 830080,nop,nop,sack 2 {57120:77112}{49980:55692},mptcp dss ack 1002604306], length 0
20:05:40.390111 IP 112.26.2.1.targus-getdata1 > 112.26.2.8.52139: Flags [.], ack 48552, win 23892, options [nop,nop,TS val 1062472 ecr 830080,nop,nop,sack 2 {57120:69972}{49980:55692},mptcp dss ack 1002604306], length 0
20:05:40.436625 IP 112.26.2.8.52139 > 112.26.2.1.targus-getdata1: Flags [.], seq 77112:78540, ack 1, win 4107, options [nop,nop,TS val 832304 ecr 1060808,mptcp dss ack 2724680102 seq 1002705694 subseq 424117 len 1428 csum 0x6dac], length 1428
20:05:40.436954 IP 112.26.2.1.targus-getdata1 > 112.26.2.8.52139: Flags [.], ack 48552, win 23892, options [nop,nop,TS val 1063285 ecr 830080,nop,nop,sack 2 {57120:78540}{49980:55692},mptcp dss ack 1002604306], length 0
20:05:40.510017 IP 112.26.2.8.52139 > 112.26.2.1.targus-getdata1: Flags [.], seq 48552:49980, ack 1, win 4107, options [nop,nop,TS val 832337 ecr 1060899,mptcp dss ack 2724680102 seq 1002604306 subseq 395557 len 1428 csum 0xcc8], length 1428
20:05:40.510362 IP 112.26.2.1.targus-getdata1 > 112.26.2.8.52139: Flags [.], ack 55692, win 23558, options [nop,nop,TS val 1063359 ecr 832337,nop,nop,sack 1 {57120:78540},mptcp dss ack 1002625726], length 0
20:05:40.567249 IP 112.26.2.1.targus-getdata1 > 112.26.2.8.52139: Flags [.], ack 48552, win 23892, options [nop,nop,TS val 1062722 ecr 830080,nop,nop,sack 2 {57120:71400}{49980:55692},mptcp dss ack 1002604306], length 0
20:05:40.633875 IP 112.26.2.1.targus-getdata1 > 112.26.2.8.52139: Flags [.], ack 48552, win 23892, options [nop,nop,TS val 1062803 ecr 830080,nop,nop,sack 2 {57120:72828}{49980:55692},mptcp dss ack 1002604306], length 0
20:05:40.696339 IP 112.26.2.8.52139 > 112.26.2.1.targus-getdata1: Flags [.], seq 78540:79968, ack 1, win 4107, options [nop,nop,TS val 832790 ecr 1061077,mptcp dss ack 2724680102 seq 1002722830 subseq 425545 len 1428 csum 0x53fe], length 1428
20:05:40.696664 IP 112.26.2.1.targus-getdata1 > 112.26.2.8.52139: Flags [.], ack 55692, win 23636, options [nop,nop,TS val 1063546 ecr 832337,nop,nop,sack 1 {57120:79968},mptcp dss ack 1002625726], length 0
20:05:40.795906 IP 112.26.2.1.targus-getdata1 > 112.26.2.8.52139: Flags [.], ack 48552, win 23892, options [nop,nop,TS val 1062929 ecr 830080,nop,nop,sack 2 {57120:74256}{49980:55692},mptcp dss ack 1002604306], length 0
20:05:40.919151 IP 112.26.2.1.targus-getdata1 > 112.26.2.8.52139: Flags [.], ack 48552, win 23892, options [nop,nop,TS val 1063073 ecr 830080,nop,nop,sack 2 {57120:75684}{49980:55692},mptcp dss ack 1002604306], length 0
20:05:40.989060 IP 112.26.2.8.52139 > 112.26.2.1.targus-getdata1: Flags [.], seq 55692:57120, ack 1, win 4107, options [nop,nop,TS val 832982 ecr 1061249,mptcp dss ack 2724680102 seq 1002625726 subseq 402697 len 1428 csum 0x1ea7], length 1428
20:05:40.989476 IP 112.26.2.1.targus-getdata1 > 112.26.2.8.52139: Flags [.], ack 79968, win 23079, options [nop,nop,TS val 1063838 ecr 832982,mptcp dss ack 1002751390], length 0
20:05:41.075388 IP 112.26.2.1.targus-getdata1 > 112.26.2.8.52139: Flags [.], ack 48552, win 23892, options [nop,nop,TS val 1063162 ecr 830080,nop,nop,sack 2 {57120:77112}{49980:55692},mptcp dss ack 1002604306], length 0
20:05:41.150389 IP 112.26.2.1.targus-getdata1 > 112.26.2.8.52139: Flags [.], ack 48552, win 23892, options [nop,nop,TS val 1063285 ecr 830080,nop,nop,sack 2 {57120:78540}{49980:55692},mptcp dss ack 1002604306], length 0
20:05:41.217828 IP 112.26.2.8.52139 > 112.26.2.1.targus-getdata1: Flags [.], seq 79968:81396, ack 1, win 4107, options [nop,nop,TS val 833379 ecr 1061541,mptcp dss ack 2724680102 seq 1002751390 subseq 426973 len 1428 csum 0x2641], length 1428
20:05:41.218138 IP 112.26.2.1.targus-getdata1 > 112.26.2.8.52139: Flags [.], ack 81396, win 24380, options [nop,nop,TS val 1064067 ecr 833379,mptcp dss ack 1002754246], length 0
20:05:41.328396 IP 112.26.2.1.targus-getdata1 > 112.26.2.8.52139: Flags [.], ack 55692, win 23558, options [nop,nop,TS val 1063359 ecr 832337,nop,nop,sack 1 {57120:78540},mptcp dss ack 1002625726], length 0
20:05:41.376655 IP 112.26.2.1.targus-getdata1 > 112.26.2.8.52139: Flags [.], ack 55692, win 23636, options [nop,nop,TS val 1063546 ecr 832337,nop,nop,sack 1 {57120:79968},mptcp dss ack 1002625726], length 0
20:05:41.421858 IP 112.26.2.8.52139 > 112.26.2.1.targus-getdata1: Flags [.], seq 81396:82824, ack 1, win 4107, options [nop,nop,TS val 833561 ecr 1061625,mptcp dss ack 2724680102 seq 1002754246 subseq 428401 len 1428 csum 0x2cb8], length 1428
20:05:41.422228 IP 112.26.2.1.targus-getdata1 > 112.26.2.8.52139: Flags [.], ack 82824, win 24298, options [nop,nop,TS val 1064271 ecr 833561,mptcp dss ack 1002764242], length 0
20:05:41.487649 IP 112.26.2.8.52139 > 112.26.2.1.targus-getdata1: Flags [.], seq 82824:84252, ack 1, win 4107, options [nop,nop,TS val 833759 ecr 1061978,mptcp dss ack 2724680102 seq 1002764242 subseq 429829 len 1428 csum 0x18f8], length 1428
20:05:41.488031 IP 112.26.2.1.targus-getdata1 > 112.26.2.8.52139: Flags [.], ack 84252, win 24380, options [nop,nop,TS val 1064336 ecr 833759,mptcp dss ack 1002775666], length 0
20:05:41.572032 IP 112.26.2.1.targus-getdata1 > 112.26.2.8.52139: Flags [.], ack 79968, win 23079, options [nop,nop,TS val 1063838 ecr 832982,mptcp dss ack 1002751390], length 0
20:05:41.626151 IP 112.26.2.8.52139 > 112.26.2.1.targus-getdata1: Flags [.], seq 84252:85680, ack 1, win 4107, options [nop,nop,TS val 834021 ecr 1062165,mptcp dss ack 2724680102 seq 1002775666 subseq 431257 len 1428 csum 0x9a9f], length 1428
20:05:41.626492 IP 112.26.2.1.targus-getdata1 > 112.26.2.8.52139: Flags [.], ack 85680, win 24416, options [nop,nop,TS val 1064475 ecr 834021,mptcp dss ack 1002788518], length 0
20:05:41.702535 IP 112.26.2.1.targus-getdata1 > 112.26.2.8.52139: Flags [.], ack 81396, win 24380, options [nop,nop,TS val 1064067 ecr 833379,mptcp dss ack 1002754246], length 0
20:05:41.756178 IP 112.26.2.1.targus-getdata1 > 112.26.2.8.52139: Flags [.], ack 82824, win 24298, options [nop,nop,TS val 1064271 ecr 833561,mptcp dss ack 1002764242], length 0
20:05:41.847153 IP 112.26.2.1.targus-getdata1 > 112.26.2.8.52139: Flags [.], ack 84252, win 24380, options [nop,nop,TS val 1064336 ecr 833759,mptcp dss ack 1002775666], length 0
20:05:41.967389 IP 112.26.2.8.52139 > 112.26.2.1.targus-getdata1: Flags [.], seq 85680:87108, ack 1, win 4107, options [nop,nop,TS val 834376 ecr 1062722,mptcp dss ack 2724680102 seq 1002794230 subseq 432685 len 1428 csum 0x5c6d], length 1428
20:05:41.967688 IP 112.26.2.1.targus-getdata1 > 112.26.2.8.52139: Flags [.], ack 87108, win 24504, options [nop,nop,TS val 1064816 ecr 834376,mptcp dss ack 1002791374], length 0
20:05:42.026870 IP 112.26.2.1.targus-getdata1 > 112.26.2.8.52139: Flags [.], ack 85680, win 24416, options [nop,nop,TS val 1064475 ecr 834021,mptcp dss ack 1002788518], length 0
20:05:42.100174 IP 112.26.2.8.52139 > 112.26.2.1.targus-getdata1: Flags [.], seq 87108:88536, ack 1, win 4107, options [nop,nop,TS val 834580 ecr 1062803,mptcp dss ack 2724680102 seq 1002802798 subseq 434113 len 1428 csum 0x799e], length 1428
20:05:42.100521 IP 112.26.2.1.targus-getdata1 > 112.26.2.8.52139: Flags [.], ack 88536, win 24486, options [nop,nop,TS val 1064949 ecr 834580,mptcp dss ack 1002798514], length 0
20:05:42.173979 IP 112.26.2.8.52139 > 112.26.2.1.targus-getdata1: Flags [.], seq 88536:89964, ack 1, win 4107, options [nop,nop,TS val 834684 ecr 1062929,mptcp dss ack 2724680102 seq 1002809938 subseq 435541 len 1428 csum 0x726], length 1428
20:05:42.174315 IP 112.26.2.1.targus-getdata1 > 112.26.2.8.52139: Flags [.], ack 89964, win 24486, options [nop,nop,TS val 1065023 ecr 834684,mptcp dss ack 1002798514], length 0
20:05:42.220534 IP 112.26.2.1.targus-getdata1 > 112.26.2.8.52139: Flags [.], ack 87108, win 24504, options [nop,nop,TS val 1064816 ecr 834376,mptcp dss ack 1002791374], length 0
20:05:42.307632 IP 112.26.2.8.52139 > 112.26.2.1.targus-getdata1: Flags [.], seq 89964:91392, ack 1, win 4107, options [nop,nop,TS val 834961 ecr 1063073,mptcp dss ack 2724680102 seq 1002819934 subseq 436969 len 1428 csum 0x551c], length 1428
20:05:42.307957 IP 112.26.2.1.targus-getdata1 > 112.26.2.8.52139: Flags [.], ack 91392, win 24453, options [nop,nop,TS val 1065157 ecr 834961,mptcp dss ack 1002805654], length 0
20:05:42.359569 IP 112.26.2.1.targus-getdata1 > 112.26.2.8.52139: Flags [.], ack 88536, win 24486, options [nop,nop,TS val 1064949 ecr 834580,mptcp dss ack 1002798514], length 0
20:05:42.428532 IP 112.26.2.1.targus-getdata1 > 112.26.2.8.52139: Flags [.], ack 89964, win 24486, options [nop,nop,TS val 1065023 ecr 834684,mptcp dss ack 1002798514], length 0
20:05:42.485853 IP 112.26.2.8.52139 > 112.26.2.1.targus-getdata1: Flags [.], seq 91392:92820, ack 1, win 4107, options [nop,nop,TS val 835073 ecr 1063162,mptcp dss ack 2724680102 seq 1002824218 subseq 438397 len 1428 csum 0x4aac], length 1428
20:05:42.486099 IP 112.26.2.1.targus-getdata1 > 112.26.2.8.52139: Flags [.], ack 92820, win 24431, options [nop,nop,TS val 1065335 ecr 835073,mptcp dss ack 1002807082], length 0
20:05:42.580961 IP 112.26.2.1.targus-getdata1 > 112.26.2.8.52139: Flags [.], ack 91392, win 24453, options [nop,nop,TS val 1065157 ecr 834961,mptcp dss ack 1002805654], length 0
20:05:42.638044 IP 112.26.2.1.targus-getdata1 > 112.26.2.8.52139: Flags [.], ack 92820, win 24431, options [nop,nop,TS val 1065335 ecr 835073,mptcp dss ack 1002807082], length 0
20:05:42.714793 IP 112.26.2.8.52139 > 112.26.2.1.targus-getdata1: Flags [.], seq 92820:94248, ack 1, win 4107, options [nop,nop,TS val 835232 ecr 1063285,mptcp dss ack 2724680102 seq 1002832786 subseq 439825 len 1428 csum 0x36fe], length 1428
20:05:42.715166 IP 112.26.2.1.targus-getdata1 > 112.26.2.8.52139: Flags [.], ack 94248, win 24431, options [nop,nop,TS val 1065564 ecr 835232,mptcp dss ack 1002807082], length 0
20:05:42.778241 IP 112.26.2.8.52139 > 112.26.2.1.targus-getdata1: Flags [.], seq 94248:95676, ack 1, win 4107, options [nop,nop,TS val 835337 ecr 1063359,mptcp dss ack 2724680102 seq 1002838498 subseq 441253 len 1428 csum 0x219b], length 1428
20:05:42.778589 IP 112.26.2.1.targus-getdata1 > 112.26.2.8.52139: Flags [.], ack 95676, win 24431, options [nop,nop,TS val 1065627 ecr 835337,mptcp dss ack 1002807082], length 0
20:05:42.856686 IP 112.26.2.1.targus-getdata1 > 112.26.2.8.52139: Flags [.], ack 94248, win 24431, options [nop,nop,TS val 1065564 ecr 835232,mptcp dss ack 1002807082], length 0
20:05:42.923035 IP 112.26.2.1.targus-getdata1 > 112.26.2.8.52139: Flags [.], ack 95676, win 24431, options [nop,nop,TS val 1065627 ecr 835337,mptcp dss ack 1002807082], length 0
20:05:42.971632 IP 112.26.2.8.52139 > 112.26.2.1.targus-getdata1: Flags [.], seq 97104:98532, ack 1, win 4107, options [nop,nop,TS val 835580 ecr 1063838,mptcp dss ack 2724680102 seq 1002855634 subseq 444109 len 1428 csum 0x8370], length 1428
20:05:42.971832 IP 112.26.2.1.targus-getdata1 > 112.26.2.8.52139: Flags [.], ack 95676, win 24431, options [nop,nop,TS val 1065820 ecr 835337,nop,nop,sack 1 {97104:98532},mptcp dss ack 1002807082], length 0
20:05:43.054759 IP 112.26.2.1.targus-getdata1 > 112.26.2.8.52139: Flags [.], ack 95676, win 24431, options [nop,nop,TS val 1065820 ecr 835337,nop,nop,sack 1 {97104:98532},mptcp dss ack 1002807082], length 0
20:05:43.208635 IP 112.26.2.8.52139 > 112.26.2.1.targus-getdata1: Flags [.], seq 98532:99960, ack 1, win 4107, options [nop,nop,TS val 835793 ecr 1064067,mptcp dss ack 2724680102 seq 1002865630 subseq 445537 len 1428 csum 0x4e1d], length 1428
20:05:43.208974 IP 112.26.2.1.targus-getdata1 > 112.26.2.8.52139: Flags [.], ack 95676, win 24431, options [nop,nop,TS val 1066057 ecr 835337,nop,nop,sack 1 {97104:99960},mptcp dss ack 1002807082], length 0
20:05:43.278637 IP 112.26.2.1.targus-getdata1 > 112.26.2.8.52139: Flags [.], ack 95676, win 24431, options [nop,nop,TS val 1066057 ecr 835337,nop,nop,sack 1 {97104:99960},mptcp dss ack 1002807082], length 0
