17:35:05.633319 IP 112.26.3.8.48961 > 112.26.3.1.targus-getdata1: Flags [S], seq 2294405452, win 29200, options [mss 1460,sackOK,TS val 1082531 ecr 0,nop,wscale 7,mptcp join id 5 token 0x3ce29047 nonce 0xb06a5374], length 0
17:35:05.633577 IP 112.26.3.1.targus-getdata1 > 112.26.3.8.48961: Flags [S.], seq 321899000, ack 2294405453, win 65535, options [mss 1460,sackOK,TS val 1315422 ecr 1082531,nop,wscale 6,mptcp join id 6 hmac 0x8cfdf64cb6f8d5ea nonce 0x6b5797cc], length 0
17:35:05.715762 IP 112.26.3.1.targus-getdata1 > 112.26.3.8.48961: Flags [S.], seq 321899000, ack 2294405453, win 65535, options [mss 1460,sackOK,TS val 1315422 ecr 1082531,nop,wscale 6,mptcp join id 6 hmac 0x8cfdf64cb6f8d5ea nonce 0x6b5797cc], length 0
17:35:05.834047 IP 112.26.3.8.48961 > 112.26.3.1.targus-getdata1: Flags [.], ack 1, win 685, options [nop,nop,TS val 1082647 ecr 1315422,mptcp join hmac 0x79c74ad4178f3679645369c2f7def2830e6fe0b7], length 0
17:35:05.834428 IP 112.26.3.1.targus-getdata1 > 112.26.3.8.48961: Flags [.], ack 1, win 4017, options [nop,nop,TS val 1315623 ecr 1082647,mptcp dss ack 1152732528], length 0
17:35:05.838032 IP 112.26.3.1.targus-getdata1 > 112.26.3.8.48961: Flags [.], ack 1, win 4017, options [nop,nop,TS val 1315623 ecr 1082647,mptcp dss ack 1152732528], length 0
17:35:06.530823 IP 112.26.3.8.57629 > 112.26.3.1.targus-getdata1: Flags [S], seq 1483670310, win 29200, options [mss 1460,sackOK,TS val 1083440 ecr 0,nop,wscale 7,mptcp join id 5 token 0x6feafb67 nonce 0x96da546f], length 0
17:35:43.358517 IP 112.26.3.8.57629 > 112.26.3.1.targus-getdata1: Flags [.], seq 1484063011:1484064439, ack 1988910998, win 913, options [nop,nop,TS val 1119598 ecr 1351714,mptcp dss ack 3644063658 seq 3528577058 subseq 392701 len 1428 csum 0xbfba], length 1428
17:35:43.358785 IP 112.26.3.1.targus-getdata1 > 112.26.3.8.57629: Flags [.], ack 1428, win 24558, options [nop,nop,TS val 1353147 ecr 1119598,mptcp dss ack 3528561350], length 0
17:35:43.449983 IP 112.26.3.8.57629 > 112.26.3.1.targus-getdata1: Flags [.], seq 1428:2856, ack 1, win 913, options [nop,nop,TS val 1119699 ecr 1351811,mptcp dss ack 3644063658 seq 3528579914 subseq 394129 len 1428 csum 0x9690], length 1428
17:35:43.450356 IP 112.26.3.1.targus-getdata1 > 112.26.3.8.57629: Flags [.], ack 2856, win 24536, options [nop,nop,TS val 1353239 ecr 1119699,mptcp dss ack 3528562778], length 0
17:35:43.513595 IP 112.26.3.1.targus-getdata1 > 112.26.3.8.57629: Flags [.], ack 4294965868, win 24437, options [nop,nop,TS val 1352630 ecr 1119031,mptcp dss ack 3528534218], length 0
17:35:43.606534 IP 112.26.3.8.57629 > 112.26.3.1.targus-getdata1: Flags [.], seq 2856:4284, ack 1, win 913, options [nop,nop,TS val 1119841 ecr 1351993,mptcp dss ack 3644063658 seq 3528585626 subseq 395557 len 1428 csum 0x5acb], length 1428
17:35:43.606935 IP 112.26.3.1.targus-getdata1 > 112.26.3.8.57629: Flags [.], ack 4284, win 24536, options [nop,nop,TS val 1353396 ecr 1119841,mptcp dss ack 3528562778], length 0
17:35:43.670639 IP 112.26.3.8.57629 > 112.26.3.1.targus-getdata1: Flags [.], seq 4284:5712, ack 1, win 913, options [nop,nop,TS val 1119841 ecr 1351993,mptcp dss ack 3644063658 seq 3528587054 subseq 396985 len 1428 csum 0xdd62], length 1428
17:35:43.671114 IP 112.26.3.1.targus-getdata1 > 112.26.3.8.57629: Flags [.], ack 5712, win 24536, options [nop,nop,TS val 1353460 ecr 1119841,mptcp dss ack 3528562778], length 0
17:35:43.734413 IP 112.26.3.8.57629 > 112.26.3.1.targus-getdata1: Flags [.], seq 5712:7140, ack 1, win 913, options [nop,nop,TS val 1119970 ecr 1352134,mptcp dss ack 3644063658 seq 3528595622 subseq 398413 len 1428 csum 0x7e5a], length 1428
17:35:43.734811 IP 112.26.3.1.targus-getdata1 > 112.26.3.8.57629: Flags [.], ack 7140, win 24536, options [nop,nop,TS val 1353523 ecr 1119970,mptcp dss ack 3528562778], length 0
17:35:43.797633 IP 112.26.3.8.57629 > 112.26.3.1.targus-getdata1: Flags [.], seq 7140:8568, ack 1, win 913, options [nop,nop,TS val 1120083 ecr 1352210,mptcp dss ack 3644063658 seq 3528598478 subseq 399841 len 1428 csum 0x62c4], length 1428
17:35:43.797989 IP 112.26.3.1.targus-getdata1 > 112.26.3.8.57629: Flags [.], ack 8568, win 24536, options [nop,nop,TS val 1353587 ecr 1120083,mptcp dss ack 3528562778], length 0
17:35:43.873985 IP 112.26.3.1.targus-getdata1 > 112.26.3.8.57629: Flags [.], ack 0, win 24558, options [nop,nop,TS val 1353043 ecr 1119497,mptcp dss ack 3528561350], length 0
17:35:43.932896 IP 112.26.3.8.57629 > 112.26.3.1.targus-getdata1: Flags [.], seq 8568:9996, ack 1, win 913, options [nop,nop,TS val 1120182 ecr 1352307,mptcp dss ack 3644063658 seq 3528601334 subseq 401269 len 1428 csum 0xb1b1], length 1428
17:35:43.933266 IP 112.26.3.1.targus-getdata1 > 112.26.3.8.57629: Flags [.], ack 9996, win 24536, options [nop,nop,TS val 1353722 ecr 1120182,mptcp dss ack 3528562778], length 0
17:35:44.012340 IP 112.26.3.1.targus-getdata1 > 112.26.3.8.57629: Flags [.], ack 1428, win 24558, options [nop,nop,TS val 1353147 ecr 1119598,mptcp dss ack 3528561350], length 0
17:35:44.068172 IP 112.26.3.1.targus-getdata1 > 112.26.3.8.57629: Flags [.], ack 2856, win 24536, options [nop,nop,TS val 1353239 ecr 1119699,mptcp dss ack 3528562778], length 0
17:35:44.174603 IP 112.26.3.8.57629 > 112.26.3.1.targus-getdata1: Flags [.], seq 9996:11424, ack 1, win 913, options [nop,nop,TS val 1120436 ecr 1352630,mptcp dss ack 3644063658 seq 3528605618 subseq 402697 len 1428 csum 0x1e95], length 1428
17:35:44.216404 IP 112.26.3.1.targus-getdata1 > 112.26.3.8.57629: Flags [.], ack 11424, win 24536, options [nop,nop,TS val 1354005 ecr 1120436,mptcp dss ack 3528562778], length 0
17:35:44.249949 IP 112.26.3.1.targus-getdata1 > 112.26.3.8.57629: Flags [.], ack 4284, win 24536, options [nop,nop,TS val 1353396 ecr 1119841,mptcp dss ack 3528562778], length 0
17:35:44.334946 IP 112.26.3.1.targus-getdata1 > 112.26.3.8.57629: Flags [.], ack 5712, win 24536, options [nop,nop,TS val 1353460 ecr 1119841,mptcp dss ack 3528562778], length 0
17:35:44.407560 IP 112.26.3.1.targus-getdata1 > 112.26.3.8.57629: Flags [.], ack 7140, win 24536, options [nop,nop,TS val 1353523 ecr 1119970,mptcp dss ack 3528562778], length 0
17:35:44.468670 IP 112.26.3.1.targus-getdata1 > 112.26.3.8.57629: Flags [.], ack 8568, win 24536, options [nop,nop,TS val 1353587 ecr 1120083,mptcp dss ack 3528562778], length 0
17:35:44.532083 IP 112.26.3.1.targus-getdata1 > 112.26.3.8.57629: Flags [.], ack 9996, win 24536, options [nop,nop,TS val 1353722 ecr 1120182,mptcp dss ack 3528562778], length 0
17:35:44.599242 IP 112.26.3.8.57629 > 112.26.3.1.targus-getdata1: Flags [.], seq 12852:14280, ack 1, win 913, options [nop,nop,TS val 1120935 ecr 1353147,mptcp dss ack 3644063658 seq 3528621326 subseq 405553 len 1428 csum 0x4d05], length 1428
17:35:44.599448 IP 112.26.3.1.targus-getdata1 > 112.26.3.8.57629: Flags [.], ack 11424, win 24324, options [nop,nop,TS val 1354388 ecr 1120436,nop,nop,sack 1 {12852:14280},mptcp dss ack 3528597050], length 0
17:35:44.685910 IP 112.26.3.8.57629 > 112.26.3.1.targus-getdata1: Flags [.], seq 14280:15708, ack 1, win 913, options [nop,nop,TS val 1120990 ecr 1353239,mptcp dss ack 3644063658 seq 3528625610 subseq 406981 len 1428 csum 0x21f6], length 1428
17:35:44.686194 IP 112.26.3.1.targus-getdata1 > 112.26.3.8.57629: Flags [.], ack 11424, win 24324, options [nop,nop,TS val 1354475 ecr 1120436,nop,nop,sack 1 {12852:15708},mptcp dss ack 3528597050], length 0
17:35:44.772410 IP 112.26.3.1.targus-getdata1 > 112.26.3.8.57629: Flags [.], ack 11424, win 24536, options [nop,nop,TS val 1354005 ecr 1120436,mptcp dss ack 3528562778], length 0
17:35:44.834751 IP 112.26.3.8.57629 > 112.26.3.1.targus-getdata1: Flags [.], seq 15708:17136, ack 1, win 913, options [nop,nop,TS val 1121172 ecr 1353396,mptcp dss ack 3644063658 seq 3528637034 subseq 408409 len 1428 csum 0xef6b], length 1428
17:35:44.835058 IP 112.26.3.1.targus-getdata1 > 112.26.3.8.57629: Flags [.], ack 11424, win 24324, options [nop,nop,TS val 1354623 ecr 1120436,nop,nop,sack 1 {12852:17136},mptcp dss ack 3528597050], length 0
17:35:44.909760 IP 112.26.3.8.57629 > 112.26.3.1.targus-getdata1: Flags [.], seq 17136:18564, ack 1, win 913, options [nop,nop,TS val 1121258 ecr 1353460,mptcp dss ack 3644063658 seq 3528645602 subseq 409837 len 1428 csum 0x55da], length 1428
17:35:44.910070 IP 112.26.3.1.targus-getdata1 > 112.26.3.8.57629: Flags [.], ack 11424, win 24324, options [nop,nop,TS val 1354698 ecr 1120436,nop,nop,sack 1 {12852:18564},mptcp dss ack 3528597050], length 0
17:35:44.976324 IP 112.26.3.8.57629 > 112.26.3.1.targus-getdata1: Flags [.], seq 18564:19992, ack 1, win 913, options [nop,nop,TS val 1121258 ecr 1353460,mptcp dss ack 3644063658 seq 3528647030 subseq 411265 len 1428 csum 0xdbc4], length 1428
17:35:44.976636 IP 112.26.3.1.targus-getdata1 > 112.26.3.8.57629: Flags [.], ack 11424, win 24324, options [nop,nop,TS val 1354765 ecr 1120436,nop,nop,sack 1 {12852:19992},mptcp dss ack 3528597050], length 0
17:35:45.042115 IP 112.26.3.8.57629 > 112.26.3.1.targus-getdata1: Flags [.], seq 19992:21420, ack 1, win 913, options [nop,nop,TS val 1121364 ecr 1353523,mptcp dss ack 3644063658 seq 3528652742 subseq 412693 len 1428 csum 0xf822], length 1428
17:35:45.042425 IP 112.26.3.1.targus-getdata1 > 112.26.3.8.57629: Flags [.], ack 11424, win 24324, options [nop,nop,TS val 1354831 ecr 1120436,nop,nop,sack 1 {12852:21420},mptcp dss ack 3528597050], length 0
17:35:45.085130 IP 112.26.3.8.57629 > 112.26.3.1.targus-getdata1: Flags [.], seq 21420:22848, ack 1, win 913, options [nop,nop,TS val 1121391 ecr 1353587,mptcp dss ack 3644063658 seq 3528654170 subseq 414121 len 1428 csum 0x414e], length 1428
17:35:45.085447 IP 112.26.3.1.targus-getdata1 > 112.26.3.8.57629: Flags [.], ack 11424, win 24324, options [nop,nop,TS val 1354874 ecr 1120436,nop,nop,sack 1 {12852:22848},mptcp dss ack 3528597050], length 0
17:35:45.119486 IP 112.26.3.1.targus-getdata1 > 112.26.3.8.57629: Flags [.], ack 11424, win 24324, options [nop,nop,TS val 1354388 ecr 1120436,nop,nop,sack 1 {12852:14280},mptcp dss ack 3528597050], length 0
17:35:45.201662 IP 112.26.3.8.57629 > 112.26.3.1.targus-getdata1: Flags [.], seq 22848:24276, ack 1, win 913, options [nop,nop,TS val 1121454 ecr 1353722,mptcp dss ack 3644063658 seq 3528655598 subseq 415549 len 1428 csum 0x2787], length 1428
17:35:45.201973 IP 112.26.3.1.targus-getdata1 > 112.26.3.8.57629: Flags [.], ack 11424, win 24324, options [nop,nop,TS val 1354991 ecr 1120436,nop,nop,sack 1 {12852:24276},mptcp dss ack 3528597050], length 0
17:35:45.300993 IP 112.26.3.1.targus-getdata1 > 112.26.3.8.57629: Flags [.], ack 11424, win 24324, options [nop,nop,TS val 1354475 ecr 1120436,nop,nop,sack 1 {12852:15708},mptcp dss ack 3528597050], length 0
17:35:45.355725 IP 112.26.3.8.57629 > 112.26.3.1.targus-getdata1: Flags [.], seq 24276:25704, ack 1, win 913, options [nop,nop,TS val 1121695 ecr 1354005,mptcp dss ack 3644063658 seq 3528662738 subseq 416977 len 1428 csum 0xc7b3], length 1428
17:35:45.355985 IP 112.26.3.1.targus-getdata1 > 112.26.3.8.57629: Flags [.], ack 11424, win 24324, options [nop,nop,TS val 1355144 ecr 1120436,nop,nop,sack 1 {12852:25704},mptcp dss ack 3528597050], length 0
17:35:45.403391 IP 112.26.3.1.targus-getdata1 > 112.26.3.8.57629: Flags [.], ack 11424, win 24324, options [nop,nop,TS val 1354623 ecr 1120436,nop,nop,sack 1 {12852:17136},mptcp dss ack 3528597050], length 0
17:35:45.453843 IP 112.26.3.1.targus-getdata1 > 112.26.3.8.57629: Flags [.], ack 11424, win 24324, options [nop,nop,TS val 1354698 ecr 1120436,nop,nop,sack 1 {12852:18564},mptcp dss ack 3528597050], length 0
17:35:45.510854 IP 112.26.3.1.targus-getdata1 > 112.26.3.8.57629: Flags [.], ack 11424, win 24324, options [nop,nop,TS val 1354765 ecr 1120436,nop,nop,sack 1 {12852:19992},mptcp dss ack 3528597050], length 0
17:35:45.580014 IP 112.26.3.1.targus-getdata1 > 112.26.3.8.57629: Flags [.], ack 11424, win 24324, options [nop,nop,TS val 1354831 ecr 1120436,nop,nop,sack 1 {12852:21420},mptcp dss ack 3528597050], length 0
17:35:45.607584 IP 112.26.3.1.targus-getdata1 > 112.26.3.8.57629: Flags [.], ack 11424, win 24324, options [nop,nop,TS val 1354874 ecr 1120436,nop,nop,sack 1 {12852:22848},mptcp dss ack 3528597050], length 0
17:35:45.672241 IP 112.26.3.8.57629 > 112.26.3.1.targus-getdata1: Flags [.], seq 25704:27132, ack 1, win 913, options [nop,nop,TS val 1122083 ecr 1354388,mptcp dss ack 3644063658 seq 3528677018 subseq 418405 len 1428 csum 0xf2ae], length 1428
17:35:45.672565 IP 112.26.3.1.targus-getdata1 > 112.26.3.8.57629: Flags [.], ack 11424, win 24324, options [nop,nop,TS val 1355461 ecr 1120436,nop,nop,sack 1 {12852:27132},mptcp dss ack 3528597050], length 0
17:35:45.732575 IP 112.26.3.1.targus-getdata1 > 112.26.3.8.57629: Flags [.], ack 11424, win 24324, options [nop,nop,TS val 1354991 ecr 1120436,nop,nop,sack 1 {12852:24276},mptcp dss ack 3528597050], length 0
17:35:45.772724 IP 112.26.3.8.57629 > 112.26.3.1.targus-getdata1: Flags [.], seq 27132:28560, ack 1, win 913, options [nop,nop,TS val 1122234 ecr 1354475,mptcp dss ack 3644063658 seq 3528688442 subseq 419833 len 1428 csum 0x1aa7], length 1428
17:35:45.773041 IP 112.26.3.1.targus-getdata1 > 112.26.3.8.57629: Flags [.], ack 11424, win 24324, options [nop,nop,TS val 1355561 ecr 1120436,nop,nop,sack 1 {12852:28560},mptcp dss ack 3528597050], length 0
17:35:45.847585 IP 112.26.3.1.targus-getdata1 > 112.26.3.8.57629: Flags [.], ack 11424, win 24324, options [nop,nop,TS val 1355144 ecr 1120436,nop,nop,sack 1 {12852:25704},mptcp dss ack 3528597050], length 0
17:35:45.885888 IP 112.26.3.8.57629 > 112.26.3.1.targus-getdata1: Flags [.], seq 28560:29988, ack 1, win 913, options [nop,nop,TS val 1122360 ecr 1354623,mptcp dss ack 3644063658 seq 3528689870 subseq 421261 len 1428 csum 0x6e74], length 1428
17:35:45.886218 IP 112.26.3.1.targus-getdata1 > 112.26.3.8.57629: Flags [.], ack 11424, win 24324, options [nop,nop,TS val 1355674 ecr 1120436,nop,nop,sack 1 {12852:29988},mptcp dss ack 3528597050], length 0
17:35:45.936246 IP 112.26.3.8.57629 > 112.26.3.1.targus-getdata1: Flags [.], seq 29988:31416, ack 1, win 913, options [nop,nop,TS val 1122415 ecr 1354698,mptcp dss ack 3644063658 seq 3528691298 subseq 422689 len 1428 csum 0x5d01], length 1428
17:35:45.936560 IP 112.26.3.1.targus-getdata1 > 112.26.3.8.57629: Flags [.], ack 11424, win 24324, options [nop,nop,TS val 1355725 ecr 1120436,nop,nop,sack 1 {12852:31416},mptcp dss ack 3528597050], length 0
17:35:45.989708 IP 112.26.3.8.57629 > 112.26.3.1.targus-getdata1: Flags [.], seq 11424:12852, ack 1, win 913, options [nop,nop,TS val 1122434 ecr 1354765,mptcp dss ack 3644063658 seq 3528615614 subseq 404125 len 1428 csum 0xe374], length 1428
17:35:45.990048 IP 112.26.3.1.targus-getdata1 > 112.26.3.8.57629: Flags [.], ack 31416, win 24324, options [nop,nop,TS val 1355778 ecr 1122434,mptcp dss ack 3528597050], length 0
17:35:46.064454 IP 112.26.3.1.targus-getdata1 > 112.26.3.8.57629: Flags [.], ack 11424, win 24324, options [nop,nop,TS val 1355461 ecr 1120436,nop,nop,sack 1 {12852:27132},mptcp dss ack 3528597050], length 0
17:35:46.139207 IP 112.26.3.8.57629 > 112.26.3.1.targus-getdata1: Flags [.], seq 31416:32844, ack 1, win 913, options [nop,nop,TS val 1122530 ecr 1354831,mptcp dss ack 3644063658 seq 3528701294 subseq 424117 len 1428 csum 0xe4d3], length 1428
17:35:46.139559 IP 112.26.3.1.targus-getdata1 > 112.26.3.8.57629: Flags [.], ack 32844, win 24447, options [nop,nop,TS val 1355928 ecr 1122530,mptcp dss ack 3528684158], length 0
17:35:46.187991 IP 112.26.3.1.targus-getdata1 > 112.26.3.8.57629: Flags [.], ack 11424, win 24324, options [nop,nop,TS val 1355561 ecr 1120436,nop,nop,sack 1 {12852:28560},mptcp dss ack 3528597050], length 0
17:35:46.251197 IP 112.26.3.8.57629 > 112.26.3.1.targus-getdata1: Flags [.], seq 32844:34272, ack 1, win 913, options [nop,nop,TS val 1122620 ecr 1354874,mptcp dss ack 3644063658 seq 3528702722 subseq 425545 len 1428 csum 0x7e19], length 1428
17:35:46.251528 IP 112.26.3.1.targus-getdata1 > 112.26.3.8.57629: Flags [.], ack 34272, win 24447, options [nop,nop,TS val 1356040 ecr 1122620,mptcp dss ack 3528684158], length 0
17:35:46.314622 IP 112.26.3.1.targus-getdata1 > 112.26.3.8.57629: Flags [.], ack 11424, win 24324, options [nop,nop,TS val 1355674 ecr 1120436,nop,nop,sack 1 {12852:29988},mptcp dss ack 3528597050], length 0
17:35:46.366327 IP 112.26.3.1.targus-getdata1 > 112.26.3.8.57629: Flags [.], ack 11424, win 24324, options [nop,nop,TS val 1355725 ecr 1120436,nop,nop,sack 1 {12852:31416},mptcp dss ack 3528597050], length 0
17:35:46.417014 IP 112.26.3.1.targus-getdata1 > 112.26.3.8.57629: Flags [.], ack 31416, win 24324, options [nop,nop,TS val 1355778 ecr 1122434,mptcp dss ack 3528597050], length 0
17:35:46.506383 IP 112.26.3.8.57629 > 112.26.3.1.targus-getdata1: Flags [.], seq 34272:35700, ack 1, win 913, options [nop,nop,TS val 1123016 ecr 1355461,mptcp dss ack 3644063658 seq 3528719858 subseq 426973 len 1428 csum 0x8d5e], length 1428
17:35:46.506564 IP 112.26.3.1.targus-getdata1 > 112.26.3.8.57629: Flags [.], ack 35700, win 24447, options [nop,nop,TS val 1356295 ecr 1123016,mptcp dss ack 3528684158], length 0
17:35:46.597695 IP 112.26.3.1.targus-getdata1 > 112.26.3.8.57629: Flags [.], ack 32844, win 24447, options [nop,nop,TS val 1355928 ecr 1122530,mptcp dss ack 3528684158], length 0
17:35:46.665076 IP 112.26.3.8.57629 > 112.26.3.1.targus-getdata1: Flags [.], seq 35700:37128, ack 1, win 913, options [nop,nop,TS val 1123160 ecr 1355561,mptcp dss ack 3644063658 seq 3528726998 subseq 428401 len 1428 csum 0xbe03], length 1428
17:35:46.665488 IP 112.26.3.1.targus-getdata1 > 112.26.3.8.57629: Flags [.], ack 37128, win 24447, options [nop,nop,TS val 1356453 ecr 1123160,mptcp dss ack 3528684158], length 0
17:35:46.744603 IP 112.26.3.1.targus-getdata1 > 112.26.3.8.57629: Flags [.], ack 34272, win 24447, options [nop,nop,TS val 1356040 ecr 1122620,mptcp dss ack 3528684158], length 0
17:35:46.808963 IP 112.26.3.8.57629 > 112.26.3.1.targus-getdata1: Flags [.], seq 37128:38556, ack 1, win 913, options [nop,nop,TS val 1123293 ecr 1355674,mptcp dss ack 3644063658 seq 3528731282 subseq 429829 len 1428 csum 0xa101], length 1428
17:35:46.809311 IP 112.26.3.1.targus-getdata1 > 112.26.3.8.57629: Flags [.], ack 38556, win 24447, options [nop,nop,TS val 1356597 ecr 1123293,mptcp dss ack 3528684158], length 0
17:35:46.905400 IP 112.26.3.8.57629 > 112.26.3.1.targus-getdata1: Flags [.], seq 38556:39984, ack 1, win 913, options [nop,nop,TS val 1123341 ecr 1355725,mptcp dss ack 3644063658 seq 3528735566 subseq 431257 len 1428 csum 0xa987], length 1428
17:35:46.905742 IP 112.26.3.1.targus-getdata1 > 112.26.3.8.57629: Flags [.], ack 39984, win 24447, options [nop,nop,TS val 1356694 ecr 1123341,mptcp dss ack 3528684158], length 0
17:35:46.954169 IP 112.26.3.1.targus-getdata1 > 112.26.3.8.57629: Flags [.], ack 35700, win 24447, options [nop,nop,TS val 1356295 ecr 1123016,mptcp dss ack 3528684158], length 0
17:35:47.030504 IP 112.26.3.8.57629 > 112.26.3.1.targus-getdata1: Flags [.], seq 39984:41412, ack 1, win 913, options [nop,nop,TS val 1123350 ecr 1355778,mptcp dss ack 3644063658 seq 3528738422 subseq 432685 len 1428 csum 0x1572], length 1428
17:35:47.030871 IP 112.26.3.1.targus-getdata1 > 112.26.3.8.57629: Flags [.], ack 41412, win 24558, options [nop,nop,TS val 1356819 ecr 1123350,mptcp dss ack 3528736994], length 0
17:35:47.153016 IP 112.26.3.8.57629 > 112.26.3.1.targus-getdata1: Flags [.], seq 41412:42840, ack 1, win 913, options [nop,nop,TS val 1123523 ecr 1355928,mptcp dss ack 3644063658 seq 3528751274 subseq 434113 len 1428 csum 0x7463], length 1428
17:35:47.153361 IP 112.26.3.1.targus-getdata1 > 112.26.3.8.57629: Flags [.], ack 42840, win 24543, options [nop,nop,TS val 1356941 ecr 1123523,mptcp dss ack 3528742706], length 0
17:35:47.210877 IP 112.26.3.1.targus-getdata1 > 112.26.3.8.57629: Flags [.], ack 37128, win 24447, options [nop,nop,TS val 1356453 ecr 1123160,mptcp dss ack 3528684158], length 0
17:35:47.289417 IP 112.26.3.8.57629 > 112.26.3.1.targus-getdata1: Flags [.], seq 42840:44268, ack 1, win 913, options [nop,nop,TS val 1123667 ecr 1356040,mptcp dss ack 3644063658 seq 3528755558 subseq 435541 len 1428 csum 0xfb47], length 1428
17:35:47.289771 IP 112.26.3.1.targus-getdata1 > 112.26.3.8.57629: Flags [.], ack 44268, win 24521, options [nop,nop,TS val 1357078 ecr 1123667,mptcp dss ack 3528744134], length 0
17:35:47.343010 IP 112.26.3.1.targus-getdata1 > 112.26.3.8.57629: Flags [.], ack 38556, win 24447, options [nop,nop,TS val 1356597 ecr 1123293,mptcp dss ack 3528684158], length 0
17:35:47.415474 IP 112.26.3.8.57629 > 112.26.3.1.targus-getdata1: Flags [.], seq 44268:45696, ack 1, win 913, options [nop,nop,TS val 1123667 ecr 1356040,mptcp dss ack 3644063658 seq 3528756986 subseq 436969 len 1428 csum 0x2c9d], length 1428
17:35:47.415823 IP 112.26.3.1.targus-getdata1 > 112.26.3.8.57629: Flags [.], ack 45696, win 24499, options [nop,nop,TS val 1357204 ecr 1123667,mptcp dss ack 3528745562], length 0
17:35:47.469550 IP 112.26.3.1.targus-getdata1 > 112.26.3.8.57629: Flags [.], ack 39984, win 24447, options [nop,nop,TS val 1356694 ecr 1123341,mptcp dss ack 3528684158], length 0
17:35:47.509212 IP 112.26.3.8.57629 > 112.26.3.1.targus-getdata1: Flags [.], seq 45696:47124, ack 1, win 913, options [nop,nop,TS val 1123876 ecr 1356295,mptcp dss ack 3644063658 seq 3528768410 subseq 438397 len 1428 csum 0xe96f], length 1428
17:35:47.509564 IP 112.26.3.1.targus-getdata1 > 112.26.3.8.57629: Flags [.], ack 47124, win 24499, options [nop,nop,TS val 1357298 ecr 1123876,mptcp dss ack 3528745562], length 0
17:35:47.565706 IP 112.26.3.1.targus-getdata1 > 112.26.3.8.57629: Flags [.], ack 41412, win 24558, options [nop,nop,TS val 1356819 ecr 1123350,mptcp dss ack 3528736994], length 0
17:35:47.636276 IP 112.26.3.1.targus-getdata1 > 112.26.3.8.57629: Flags [.], ack 42840, win 24543, options [nop,nop,TS val 1356941 ecr 1123523,mptcp dss ack 3528742706], length 0
17:35:47.720463 IP 112.26.3.8.57629 > 112.26.3.1.targus-getdata1: Flags [.], seq 47124:48552, ack 1, win 913, options [nop,nop,TS val 1124136 ecr 1356453,mptcp dss ack 3644063658 seq 3528771266 subseq 439825 len 1428 csum 0xd812], length 1428
17:35:47.720820 IP 112.26.3.1.targus-getdata1 > 112.26.3.8.57629: Flags [.], ack 48552, win 24499, options [nop,nop,TS val 1357509 ecr 1124136,mptcp dss ack 3528745562], length 0
17:35:47.788297 IP 112.26.3.1.targus-getdata1 > 112.26.3.8.57629: Flags [.], ack 44268, win 24521, options [nop,nop,TS val 1357078 ecr 1123667,mptcp dss ack 3528744134], length 0
17:35:47.859601 IP 112.26.3.8.57629 > 112.26.3.1.targus-getdata1: Flags [.], seq 48552:49980, ack 1, win 913, options [nop,nop,TS val 1124265 ecr 1356597,mptcp dss ack 3644063658 seq 3528782690 subseq 441253 len 1428 csum 0x4970], length 1428
17:35:47.859954 IP 112.26.3.1.targus-getdata1 > 112.26.3.8.57629: Flags [.], ack 49980, win 24499, options [nop,nop,TS val 1357649 ecr 1124265,mptcp dss ack 3528745562], length 0
17:35:47.915659 IP 112.26.3.1.targus-getdata1 > 112.26.3.8.57629: Flags [.], ack 45696, win 24499, options [nop,nop,TS val 1357204 ecr 1123667,mptcp dss ack 3528745562], length 0
17:35:47.965674 IP 112.26.3.8.57629 > 112.26.3.1.targus-getdata1: Flags [.], seq 49980:51408, ack 1, win 913, options [nop,nop,TS val 1124391 ecr 1356694,mptcp dss ack 3644063658 seq 3528788402 subseq 442681 len 1428 csum 0xb861], length 1428
17:35:47.966020 IP 112.26.3.1.targus-getdata1 > 112.26.3.8.57629: Flags [.], ack 51408, win 24499, options [nop,nop,TS val 1357754 ecr 1124391,mptcp dss ack 3528745562], length 0
17:35:48.027441 IP 112.26.3.1.targus-getdata1 > 112.26.3.8.57629: Flags [.], ack 47124, win 24499, options [nop,nop,TS val 1357298 ecr 1123876,mptcp dss ack 3528745562], length 0
17:35:48.168862 IP 112.26.3.8.57629 > 112.26.3.1.targus-getdata1: Flags [.], seq 51408:52836, ack 1, win 913, options [nop,nop,TS val 1124391 ecr 1356694,mptcp dss ack 3644063658 seq 3528789830 subseq 444109 len 1428 csum 0x6ead], length 1428
17:35:48.169237 IP 112.26.3.1.targus-getdata1 > 112.26.3.8.57629: Flags [.], ack 52836, win 24499, options [nop,nop,TS val 1357958 ecr 1124391,mptcp dss ack 3528745562], length 0
17:35:48.222038 IP 112.26.3.8.57629 > 112.26.3.1.targus-getdata1: Flags [.], seq 52836:54264, ack 1, win 913, options [nop,nop,TS val 1124489 ecr 1356819,mptcp dss ack 3644063658 seq 3528798398 subseq 445537 len 1428 csum 0x77ad], length 1428
17:35:48.262817 IP 112.26.3.1.targus-getdata1 > 112.26.3.8.57629: Flags [.], ack 54264, win 24499, options [nop,nop,TS val 1358052 ecr 1124489,mptcp dss ack 3528745562], length 0
17:35:48.286512 IP 112.26.3.8.57629 > 112.26.3.1.targus-getdata1: Flags [.], seq 54264:55692, ack 1, win 913, options [nop,nop,TS val 1124558 ecr 1356941,mptcp dss ack 3644063658 seq 3528804110 subseq 446965 len 1428 csum 0x92d3], length 1428
17:35:48.334514 IP 112.26.3.1.targus-getdata1 > 112.26.3.8.57629: Flags [.], ack 48552, win 24499, options [nop,nop,TS val 1357509 ecr 1124136,mptcp dss ack 3528745562], length 0
17:35:48.395553 IP 112.26.3.1.targus-getdata1 > 112.26.3.8.57629: Flags [.], ack 55692, win 24499, options [nop,nop,TS val 1358184 ecr 1124558,mptcp dss ack 3528745562], length 0
17:35:48.433867 IP 112.26.3.8.57629 > 112.26.3.1.targus-getdata1: Flags [.], seq 55692:57120, ack 1, win 913, options [nop,nop,TS val 1124711 ecr 1357078,mptcp dss ack 3644063658 seq 3528814106 subseq 448393 len 1428 csum 0xe60f], length 1428
17:35:48.476098 IP 112.26.3.1.targus-getdata1 > 112.26.3.8.57629: Flags [.], ack 49980, win 24499, options [nop,nop,TS val 1357649 ecr 1124265,mptcp dss ack 3528745562], length 0
17:35:48.506051 IP 112.26.3.8.57629 > 112.26.3.1.targus-getdata1: Flags [.], seq 57120:58548, ack 1, win 913, options [nop,nop,TS val 1124838 ecr 1357204,mptcp dss ack 3644063658 seq 3528819818 subseq 449821 len 1428 csum 0x87ae], length 1428
17:35:48.583945 IP 112.26.3.1.targus-getdata1 > 112.26.3.8.57629: Flags [.], ack 51408, win 24499, options [nop,nop,TS val 1357754 ecr 1124391,mptcp dss ack 3528745562], length 0
17:35:48.635221 IP 112.26.3.1.targus-getdata1 > 112.26.3.8.57629: Flags [.], ack 58548, win 24499, options [nop,nop,TS val 1358424 ecr 1124711,mptcp dss ack 3528745562], length 0
17:35:48.662897 IP 112.26.3.8.57629 > 112.26.3.1.targus-getdata1: Flags [.], seq 58548:59976, ack 1, win 913, options [nop,nop,TS val 1124950 ecr 1357298,mptcp dss ack 3644063658 seq 3528825530 subseq 451249 len 1428 csum 0xbbc3], length 1428
17:35:48.743980 IP 112.26.3.1.targus-getdata1 > 112.26.3.8.57629: Flags [.], ack 52836, win 24499, options [nop,nop,TS val 1357958 ecr 1124391,mptcp dss ack 3528745562], length 0
17:35:48.822995 IP 112.26.3.1.targus-getdata1 > 112.26.3.8.57629: Flags [.], ack 54264, win 24499, options [nop,nop,TS val 1358052 ecr 1124489,mptcp dss ack 3528745562], length 0
17:35:48.867427 IP 112.26.3.1.targus-getdata1 > 112.26.3.8.57629: Flags [.], ack 59976, win 24499, options [nop,nop,TS val 1358656 ecr 1124950,mptcp dss ack 3528745562], length 0
17:35:48.890403 IP 112.26.3.8.57629 > 112.26.3.1.targus-getdata1: Flags [.], seq 59976:61404, ack 1, win 913, options [nop,nop,TS val 1125257 ecr 1357509,mptcp dss ack 3644063658 seq 3528834098 subseq 452677 len 1428 csum 0xbe9d], length 1428
17:35:48.955625 IP 112.26.3.1.targus-getdata1 > 112.26.3.8.57629: Flags [.], ack 55692, win 24499, options [nop,nop,TS val 1358184 ecr 1124558,mptcp dss ack 3528745562], length 0
17:35:49.050976 IP 112.26.3.8.57629 > 112.26.3.1.targus-getdata1: Flags [.], seq 61404:62832, ack 1, win 913, options [nop,nop,TS val 1125399 ecr 1357649,mptcp dss ack 3644063658 seq 3528838382 subseq 454105 len 1428 csum 0xd586], length 1428
17:35:49.051255 IP 112.26.3.1.targus-getdata1 > 112.26.3.8.57629: Flags [.], ack 62832, win 24499, options [nop,nop,TS val 1358840 ecr 1125257,mptcp dss ack 3528745562], length 0
17:35:49.113229 IP 112.26.3.8.57629 > 112.26.3.1.targus-getdata1: Flags [.], seq 62832:64260, ack 1, win 913, options [nop,nop,TS val 1125507 ecr 1357754,mptcp dss ack 3644063658 seq 3528844094 subseq 455533 len 1428 csum 0x2ba3], length 1428
17:35:49.183260 IP 112.26.3.1.targus-getdata1 > 112.26.3.8.57629: Flags [.], ack 58548, win 24499, options [nop,nop,TS val 1358424 ecr 1124711,mptcp dss ack 3528745562], length 0
17:35:49.239955 IP 112.26.3.8.57629 > 112.26.3.1.targus-getdata1: Flags [.], seq 64260:65688, ack 1, win 913, options [nop,nop,TS val 1125666 ecr 1357958,mptcp dss ack 3644063658 seq 3528852662 subseq 456961 len 1428 csum 0x2105], length 1428
17:35:49.314865 IP 112.26.3.1.targus-getdata1 > 112.26.3.8.57629: Flags [.], ack 65688, win 24499, options [nop,nop,TS val 1359104 ecr 1125507,mptcp dss ack 3528745562], length 0
17:35:49.339998 IP 112.26.3.8.57629 > 112.26.3.1.targus-getdata1: Flags [.], seq 65688:67116, ack 1, win 913, options [nop,nop,TS val 1125666 ecr 1357958,mptcp dss ack 3644063658 seq 3528854090 subseq 458389 len 1428 csum 0xef40], length 1428
17:35:49.393921 IP 112.26.3.1.targus-getdata1 > 112.26.3.8.57629: Flags [.], ack 59976, win 24499, options [nop,nop,TS val 1358656 ecr 1124950,mptcp dss ack 3528745562], length 0
17:35:49.477725 IP 112.26.3.8.57629 > 112.26.3.1.targus-getdata1: Flags [.], seq 67116:68544, ack 1, win 913, options [nop,nop,TS val 1125746 ecr 1358052,mptcp dss ack 3644063658 seq 3528859802 subseq 459817 len 1428 csum 0xb1a7], length 1428
17:35:49.546917 IP 112.26.3.1.targus-getdata1 > 112.26.3.8.57629: Flags [.], ack 68544, win 24499, options [nop,nop,TS val 1359336 ecr 1125666,mptcp dss ack 3528745562], length 0
17:35:49.563534 IP 112.26.3.1.targus-getdata1 > 112.26.3.8.57629: Flags [.], ack 62832, win 24499, options [nop,nop,TS val 1358840 ecr 1125257,mptcp dss ack 3528745562], length 0
17:35:49.647559 IP 112.26.3.8.57629 > 112.26.3.1.targus-getdata1: Flags [.], seq 68544:69972, ack 1, win 913, options [nop,nop,TS val 1125878 ecr 1358184,mptcp dss ack 3644063658 seq 3528864086 subseq 461245 len 1428 csum 0xdf5c], length 1428
17:35:49.727628 IP 112.26.3.8.57629 > 112.26.3.1.targus-getdata1: Flags [.], seq 69972:71400, ack 1, win 913, options [nop,nop,TS val 1126105 ecr 1358424,mptcp dss ack 3644063658 seq 3528872654 subseq 462673 len 1428 csum 0xa3b7], length 1428
17:35:49.789858 IP 112.26.3.8.57629 > 112.26.3.1.targus-getdata1: Flags [.], seq 71400:72828, ack 1, win 913, options [nop,nop,TS val 1126105 ecr 1358424,mptcp dss ack 3644063658 seq 3528874082 subseq 464101 len 1428 csum 0xf784], length 1428
17:35:49.850783 IP 112.26.3.1.targus-getdata1 > 112.26.3.8.57629: Flags [.], ack 65688, win 24499, options [nop,nop,TS val 1359104 ecr 1125507,mptcp dss ack 3528745562], length 0
17:35:49.850878 IP 112.26.3.1.targus-getdata1 > 112.26.3.8.57629: Flags [.], ack 72828, win 24031, options [nop,nop,TS val 1359640 ecr 1125878,mptcp dss ack 3528775550], length 0
17:35:49.915359 IP 112.26.3.8.57629 > 112.26.3.1.targus-getdata1: Flags [.], seq 72828:74256, ack 1, win 913, options [nop,nop,TS val 1126318 ecr 1358656,mptcp dss ack 3644063658 seq 3528879794 subseq 465529 len 1428 csum 0xc844], length 1428
17:35:49.991230 IP 112.26.3.1.targus-getdata1 > 112.26.3.8.57629: Flags [.], ack 68544, win 24499, options [nop,nop,TS val 1359336 ecr 1125666,mptcp dss ack 3528745562], length 0
17:35:50.033567 IP 112.26.3.8.57629 > 112.26.3.1.targus-getdata1: Flags [.], seq 74256:75684, ack 1, win 913, options [nop,nop,TS val 1126486 ecr 1358840,mptcp dss ack 3644063658 seq 3528888362 subseq 466957 len 1428 csum 0x6c52], length 1428
17:35:50.114904 IP 112.26.3.1.targus-getdata1 > 112.26.3.8.57629: Flags [.], ack 75684, win 23965, options [nop,nop,TS val 1359904 ecr 1126318,mptcp dss ack 3528779834], length 0
17:35:50.140390 IP 112.26.3.8.57629 > 112.26.3.1.targus-getdata1: Flags [.], seq 75684:77112, ack 1, win 913, options [nop,nop,TS val 1126486 ecr 1358840,mptcp dss ack 3644063658 seq 3528889790 subseq 468385 len 1428 csum 0x6164], length 1428
17:35:50.183584 IP 112.26.3.1.targus-getdata1 > 112.26.3.8.57629: Flags [.], ack 72828, win 24031, options [nop,nop,TS val 1359640 ecr 1125878,mptcp dss ack 3528775550], length 0
17:35:50.252670 IP 112.26.3.8.57629 > 112.26.3.1.targus-getdata1: Flags [.], seq 77112:78540, ack 1, win 913, options [nop,nop,TS val 1126774 ecr 1359104,mptcp dss ack 3644063658 seq 3528901214 subseq 469813 len 1428 csum 0x8447], length 1428
17:35:50.319732 IP 112.26.3.8.57629 > 112.26.3.1.targus-getdata1: Flags [.], seq 78540:79968, ack 1, win 913, options [nop,nop,TS val 1126774 ecr 1359104,mptcp dss ack 3644063658 seq 3528902642 subseq 471241 len 1428 csum 0x1837], length 1428
17:35:50.320106 IP 112.26.3.1.targus-getdata1 > 112.26.3.8.57629: Flags [.], ack 79968, win 23852, options [nop,nop,TS val 1360109 ecr 1126486,mptcp dss ack 3528811250], length 0
17:35:50.420656 IP 112.26.3.8.57629 > 112.26.3.1.targus-getdata1: Flags [.], seq 79968:81396, ack 1, win 913, options [nop,nop,TS val 1126914 ecr 1359336,mptcp dss ack 3644063658 seq 3528912638 subseq 472669 len 1428 csum 0x6702], length 1428
17:35:50.483936 IP 112.26.3.8.57629 > 112.26.3.1.targus-getdata1: Flags [.], seq 81396:82824, ack 1, win 913, options [nop,nop,TS val 1126914 ecr 1359336,mptcp dss ack 3644063658 seq 3528914066 subseq 474097 len 1428 csum 0xd8e5], length 1428
17:35:50.521219 IP 112.26.3.1.targus-getdata1 > 112.26.3.8.57629: Flags [.], ack 75684, win 23965, options [nop,nop,TS val 1359904 ecr 1126318,mptcp dss ack 3528779834], length 0
17:35:50.544558 IP 112.26.3.1.targus-getdata1 > 112.26.3.8.57629: Flags [.], ack 82824, win 23803, options [nop,nop,TS val 1360333 ecr 1126914,mptcp dss ack 3528818390], length 0
17:35:50.627984 IP 112.26.3.8.57629 > 112.26.3.1.targus-getdata1: Flags [.], seq 82824:84252, ack 1, win 913, options [nop,nop,TS val 1126914 ecr 1359336,mptcp dss ack 3644063658 seq 3528915494 subseq 475525 len 1428 csum 0x1eea], length 1428
17:35:50.684260 IP 112.26.3.8.57629 > 112.26.3.1.targus-getdata1: Flags [.], seq 84252:85680, ack 1, win 913, options [nop,nop,TS val 1127107 ecr 1359640,mptcp dss ack 3644063658 seq 3528919778 subseq 476953 len 1428 csum 0x2770], length 1428
17:35:50.685695 IP 112.26.3.1.targus-getdata1 > 112.26.3.8.57629: Flags [.], ack 85680, win 23836, options [nop,nop,TS val 1360474 ecr 1126914,mptcp dss ack 3528829814], length 0
17:35:50.752987 IP 112.26.3.1.targus-getdata1 > 112.26.3.8.57629: Flags [.], ack 79968, win 23852, options [nop,nop,TS val 1360109 ecr 1126486,mptcp dss ack 3528811250], length 0
17:35:50.833068 IP 112.26.3.8.57629 > 112.26.3.1.targus-getdata1: Flags [.], seq 85680:87108, ack 1, win 913, options [nop,nop,TS val 1127107 ecr 1359640,mptcp dss ack 3644063658 seq 3528921206 subseq 478381 len 1428 csum 0xedfa], length 1428
17:35:50.917509 IP 112.26.3.8.57629 > 112.26.3.1.targus-getdata1: Flags [.], seq 87108:88536, ack 1, win 913, options [nop,nop,TS val 1127107 ecr 1359640,mptcp dss ack 3644063658 seq 3528922634 subseq 479809 len 1428 csum 0x8dc6], length 1428
17:35:50.958743 IP 112.26.3.1.targus-getdata1 > 112.26.3.8.57629: Flags [.], ack 88536, win 23890, options [nop,nop,TS val 1360747 ecr 1127107,mptcp dss ack 3528842666], length 0
17:35:51.005032 IP 112.26.3.8.57629 > 112.26.3.1.targus-getdata1: Flags [.], seq 88536:89964, ack 1, win 913, options [nop,nop,TS val 1127443 ecr 1359904,mptcp dss ack 3644063658 seq 3528934058 subseq 481237 len 1428 csum 0x8acb], length 1428
17:35:51.063948 IP 112.26.3.1.targus-getdata1 > 112.26.3.8.57629: Flags [.], ack 82824, win 23803, options [nop,nop,TS val 1360333 ecr 1126914,mptcp dss ack 3528818390], length 0
17:35:51.131050 IP 112.26.3.8.57629 > 112.26.3.1.targus-getdata1: Flags [.], seq 89964:91392, ack 1, win 913, options [nop,nop,TS val 1127443 ecr 1359904,mptcp dss ack 3644063658 seq 3528935486 subseq 482665 len 1428 csum 0xe723], length 1428
17:35:51.194876 IP 112.26.3.1.targus-getdata1 > 112.26.3.8.57629: Flags [.], ack 91392, win 23890, options [nop,nop,TS val 1360984 ecr 1127443,mptcp dss ack 3528842666], length 0
17:35:51.222881 IP 112.26.3.1.targus-getdata1 > 112.26.3.8.57629: Flags [.], ack 85680, win 23836, options [nop,nop,TS val 1360474 ecr 1126914,mptcp dss ack 3528829814], length 0
17:35:51.280178 IP 112.26.3.8.57629 > 112.26.3.1.targus-getdata1: Flags [.], seq 91392:92820, ack 1, win 913, options [nop,nop,TS val 1127677 ecr 1360109,mptcp dss ack 3644063658 seq 3528949766 subseq 484093 len 1428 csum 0x4da8], length 1428
17:35:51.394616 IP 112.26.3.8.57629 > 112.26.3.1.targus-getdata1: Flags [.], seq 92820:94248, ack 1, win 913, options [nop,nop,TS val 1127677 ecr 1360109,mptcp dss ack 3644063658 seq 3528951194 subseq 485521 len 1428 csum 0xc33d], length 1428
17:35:51.395010 IP 112.26.3.1.targus-getdata1 > 112.26.3.8.57629: Flags [.], ack 94248, win 24182, options [nop,nop,TS val 1361184 ecr 1127677,mptcp dss ack 3528881222], length 0
17:35:51.524368 IP 112.26.3.1.targus-getdata1 > 112.26.3.8.57629: Flags [.], ack 88536, win 23890, options [nop,nop,TS val 1360747 ecr 1127107,mptcp dss ack 3528842666], length 0
17:35:51.561374 IP 112.26.3.8.57629 > 112.26.3.1.targus-getdata1: Flags [.], seq 94248:95676, ack 1, win 913, options [nop,nop,TS val 1127677 ecr 1360109,mptcp dss ack 3644063658 seq 3528952622 subseq 486949 len 1428 csum 0x5c30], length 1428
17:35:51.620498 IP 112.26.3.8.57629 > 112.26.3.1.targus-getdata1: Flags [.], seq 95676:97104, ack 1, win 913, options [nop,nop,TS val 1127677 ecr 1360109,mptcp dss ack 3644063658 seq 3528954050 subseq 488377 len 1428 csum 0xdec7], length 1428
17:35:51.695783 IP 112.26.3.8.57629 > 112.26.3.1.targus-getdata1: Flags [.], seq 97104:98532, ack 1, win 913, options [nop,nop,TS val 1127677 ecr 1360109,mptcp dss ack 3644063658 seq 3528955478 subseq 489805 len 1428 csum 0x453f], length 1428
17:35:51.762885 IP 112.26.3.1.targus-getdata1 > 112.26.3.8.57629: Flags [.], ack 98532, win 24182, options [nop,nop,TS val 1361552 ecr 1127677,mptcp dss ack 3528881222], length 0
17:35:51.765438 IP 112.26.3.1.targus-getdata1 > 112.26.3.8.57629: Flags [.], ack 91392, win 23890, options [nop,nop,TS val 1360984 ecr 1127443,mptcp dss ack 3528842666], length 0
17:35:51.853986 IP 112.26.3.8.57629 > 112.26.3.1.targus-getdata1: Flags [.], seq 98532:99960, ack 1, win 913, options [nop,nop,TS val 1127986 ecr 1360333,mptcp dss ack 3644063658 seq 3528969758 subseq 491233 len 1428 csum 0xf35], length 1428
17:35:51.923933 IP 112.26.3.8.57629 > 112.26.3.1.targus-getdata1: Flags [.], seq 99960:101388, ack 1, win 913, options [nop,nop,TS val 1127986 ecr 1360333,mptcp dss ack 3644063658 seq 3528971186 subseq 492661 len 1428 csum 0x9519], length 1428
17:35:52.001966 IP 112.26.3.1.targus-getdata1 > 112.26.3.8.57629: Flags [.], ack 94248, win 24182, options [nop,nop,TS val 1361184 ecr 1127677,mptcp dss ack 3528881222], length 0
17:35:52.059303 IP 112.26.3.1.targus-getdata1 > 112.26.3.8.57629: Flags [.], ack 101388, win 24182, options [nop,nop,TS val 1361848 ecr 1127986,mptcp dss ack 3528881222], length 0
17:35:52.106416 IP 112.26.3.8.57629 > 112.26.3.1.targus-getdata1: Flags [.], seq 101388:102816, ack 1, win 913, options [nop,nop,TS val 1128149 ecr 1360474,mptcp dss ack 3644063658 seq 3528975470 subseq 494089 len 1428 csum 0x4d58], length 1428
17:35:52.169377 IP 112.26.3.8.57629 > 112.26.3.1.targus-getdata1: Flags [.], seq 102816:104244, ack 1, win 913, options [nop,nop,TS val 1128149 ecr 1360474,mptcp dss ack 3644063658 seq 3528976898 subseq 495517 len 1428 csum 0x689b], length 1428
17:35:52.244126 IP 112.26.3.8.57629 > 112.26.3.1.targus-getdata1: Flags [.], seq 104244:105672, ack 1, win 913, options [nop,nop,TS val 1128149 ecr 1360474,mptcp dss ack 3644063658 seq 3528978326 subseq 496945 len 1428 csum 0x7fee], length 1428
17:35:52.249837 IP 112.26.3.1.targus-getdata1 > 112.26.3.8.57629: Flags [.], ack 105672, win 24138, options [nop,nop,TS val 1362039 ecr 1128149,mptcp dss ack 3528905498], length 0
