22:17:39.286530 IP 112.26.0.1.targus-getdata1 > 112.26.0.8.51246: Flags [P.], seq 3864783646:3864783647, ack 1797240354, win 4017, options [nop,nop,TS val 2377216 ecr 1899420,mptcp dss ack 2880738355 seq 1070932411 subseq 5 len 1 csum 0x8b91], length 1
22:17:39.366105 IP 112.26.0.1.targus-getdata1 > 112.26.0.8.51246: Flags [P.], seq 0:1, ack 1, win 4017, options [nop,nop,TS val 2377216 ecr 1899420,mptcp dss ack 2880738355 seq 1070932411 subseq 5 len 1 csum 0x8b91], length 1
22:17:43.084474 IP 112.26.0.8.51252 > 112.26.0.1.targus-getdata1: Flags [S], seq 3913780227, win 65535, options [mss 1460,sackOK,TS val 2163127 ecr 0,nop,wscale 6,mptcp capable csum {0xbf5a9f23c2418f79}], length 0
22:17:43.084774 IP 112.26.0.1.targus-getdata1 > 112.26.0.8.51252: Flags [S.], seq 1225206253, ack 3913780228, win 65535, options [mss 1460,sackOK,TS val 2381014 ecr 2163127,nop,wscale 6,mptcp capable csum {0x6a1bf62d517543da}], length 0
22:17:43.109152 IP 112.26.0.1.targus-getdata1 > 112.26.0.8.51252: Flags [S.], seq 1225206253, ack 3913780228, win 65535, options [mss 1460,sackOK,TS val 2381014 ecr 2163127,nop,wscale 6,mptcp capable csum {0x6a1bf62d517543da}], length 0
22:17:43.185485 IP 112.26.0.8.51252 > 112.26.0.1.targus-getdata1: Flags [.], ack 1, win 1369, options [nop,nop,TS val 2163208 ecr 2381014,mptcp capable csum {0xbf5a9f23c2418f79,0x6a1bf62d517543da},mptcp dss ack 1138386316], length 0
22:17:43.185820 IP 112.26.0.1.targus-getdata1 > 112.26.0.8.51252: Flags [.], ack 1, win 1339, options [nop,nop,TS val 2381114 ecr 2163208,mptcp add-addr id 3 112.26.1.1,mptcp dss ack 643515050], length 0
22:18:17.278965 IP 112.26.0.8.51254 > 112.26.0.1.targus-getdata1: Flags [.], seq 3627290778:3627292206, ack 257617193, win 4107, options [nop,nop,TS val 2196790 ecr 2414017,mptcp dss ack 1353584156 seq 4083456442 subseq 329906 len 1428 csum 0xecee], length 1428
22:18:17.279297 IP 112.26.0.1.targus-getdata1 > 112.26.0.8.51254: Flags [.], ack 4294934452, win 24071, options [nop,nop,TS val 2415208 ecr 2195630,nop,nop,sack 2 {0:1428}{4294935880:4294965868},mptcp dss ack 4083325066], length 0
22:18:17.320655 IP 112.26.0.1.targus-getdata1 > 112.26.0.8.51254: Flags [.], ack 4294934452, win 24071, options [nop,nop,TS val 2415208 ecr 2195630,nop,nop,sack 2 {0:1428}{4294935880:4294965868},mptcp dss ack 4083325066], length 0
22:18:17.417398 IP 112.26.0.8.51254 > 112.26.0.1.targus-getdata1: Flags [.], seq 4294965868:0, ack 1, win 4107, options [nop,nop,TS val 2196956 ecr 2414143,mptcp dss ack 1353584156 seq 4083412174 subseq 328478 len 1428 csum 0x68fa], length 1428
22:18:17.417740 IP 112.26.0.1.targus-getdata1 > 112.26.0.8.51254: Flags [.], ack 4294934452, win 24071, options [nop,nop,TS val 2415347 ecr 2195630,nop,nop,sack 1 {4294935880:1428},mptcp dss ack 4083325066], length 0
22:18:17.467750 IP 112.26.0.1.targus-getdata1 > 112.26.0.8.51254: Flags [.], ack 4294934452, win 24071, options [nop,nop,TS val 2415347 ecr 2195630,nop,nop,sack 1 {4294935880:1428},mptcp dss ack 4083325066], length 0
22:18:38.452720 IP 112.26.0.1.targus-getdata1 > 112.26.0.8.51254: Flags [.], ack 217056, win 24053, options [nop,nop,TS val 2436329 ecr 2215396,nop,nop,sack 2 {248472:251328}{241332:247044},mptcp dss ack 4084197574], length 0
22:18:38.537752 IP 112.26.0.8.51254 > 112.26.0.1.targus-getdata1: Flags [.], seq 217056:218484, ack 1, win 4107, options [nop,nop,TS val 2217269 ecr 2435011,mptcp dss ack 1353584156 seq 4084251838 subseq 546962 len 1428 csum 0xa293], length 1428
22:18:38.537966 IP 112.26.0.1.targus-getdata1 > 112.26.0.8.51254: Flags [.], ack 221340, win 24053, options [nop,nop,TS val 2436467 ecr 2217269,nop,nop,sack 2 {248472:251328}{241332:247044},mptcp dss ack 4084197574], length 0
22:18:38.541325 IP 112.26.0.1.targus-getdata1 > 112.26.0.8.51254: Flags [.], ack 221340, win 24053, options [nop,nop,TS val 2436467 ecr 2217269,nop,nop,sack 2 {248472:251328}{241332:247044},mptcp dss ack 4084197574], length 0
22:18:38.620807 IP 112.26.0.8.51254 > 112.26.0.1.targus-getdata1: Flags [.], seq 225624:227052, ack 1, win 4107, options [nop,nop,TS val 2217509 ecr 2435249,mptcp dss ack 1353584156 seq 4084271830 subseq 555530 len 1428 csum 0x5df7], length 1428
22:18:38.621038 IP 112.26.0.1.targus-getdata1 > 112.26.0.8.51254: Flags [.], ack 221340, win 24053, options [nop,nop,TS val 2436550 ecr 2217269,nop,nop,sack 2 {225624:227052}{248472:251328},mptcp dss ack 4084197574], length 0
22:18:38.702905 IP 112.26.0.1.targus-getdata1 > 112.26.0.8.51254: Flags [.], ack 221340, win 24053, options [nop,nop,TS val 2436550 ecr 2217269,nop,nop,sack 2 {225624:227052}{248472:251328},mptcp dss ack 4084197574], length 0
22:18:38.734584 IP 112.26.0.8.51254 > 112.26.0.1.targus-getdata1: Flags [.], seq 234192:235620, ack 1, win 4107, options [nop,nop,TS val 2218035 ecr 2435741,mptcp dss ack 1353584156 seq 4084287538 subseq 564098 len 1428 csum 0x902], length 1428
22:18:38.734803 IP 112.26.0.1.targus-getdata1 > 112.26.0.8.51254: Flags [.], ack 221340, win 24053, options [nop,nop,TS val 2436664 ecr 2217269,nop,nop,sack 2 {234192:239904}{225624:227052},mptcp dss ack 4084197574], length 0
22:18:38.769796 IP 112.26.0.1.targus-getdata1 > 112.26.0.8.51254: Flags [.], ack 221340, win 24053, options [nop,nop,TS val 2436664 ecr 2217269,nop,nop,sack 2 {234192:239904}{225624:227052},mptcp dss ack 4084197574], length 0
22:18:38.867101 IP 112.26.0.8.51254 > 112.26.0.1.targus-getdata1: Flags [.], seq 239904:241332, ack 1, win 4107, options [nop,nop,TS val 2218179 ecr 2435850,mptcp dss ack 1353584156 seq 4084293250 subseq 569810 len 1428 csum 0xd41a], length 1428
22:18:38.867329 IP 112.26.0.1.targus-getdata1 > 112.26.0.8.51254: Flags [.], ack 221340, win 24053, options [nop,nop,TS val 2436796 ecr 2217269,nop,nop,sack 2 {234192:247044}{225624:227052},mptcp dss ack 4084197574], length 0
22:18:38.885154 IP 112.26.0.1.targus-getdata1 > 112.26.0.8.51254: Flags [.], ack 221340, win 24053, options [nop,nop,TS val 2436796 ecr 2217269,nop,nop,sack 2 {234192:247044}{225624:227052},mptcp dss ack 4084197574], length 0
22:18:38.974547 IP 112.26.0.8.51254 > 112.26.0.1.targus-getdata1: Flags [.], seq 251328:252756, ack 1, win 4107, options [nop,nop,TS val 2218338 ecr 2435973,mptcp dss ack 1353584156 seq 4084346086 subseq 581234 len 1428 csum 0xa2e1], length 1428
22:18:38.974846 IP 112.26.0.1.targus-getdata1 > 112.26.0.8.51254: Flags [.], ack 221340, win 24053, options [nop,nop,TS val 2436904 ecr 2217269,nop,nop,sack 2 {248472:252756}{234192:247044},mptcp dss ack 4084197574], length 0
22:18:38.984651 IP 112.26.0.1.targus-getdata1 > 112.26.0.8.51254: Flags [.], ack 221340, win 24053, options [nop,nop,TS val 2436904 ecr 2217269,nop,nop,sack 2 {248472:252756}{234192:247044},mptcp dss ack 4084197574], length 0
22:18:39.107557 IP 112.26.0.8.51254 > 112.26.0.1.targus-getdata1: Flags [.], seq 252756:254184, ack 1, win 4107, options [nop,nop,TS val 2218454 ecr 2436089,mptcp dss ack 1353584156 seq 4084350370 subseq 582662 len 1428 csum 0xa70c], length 1428
22:18:39.107786 IP 112.26.0.1.targus-getdata1 > 112.26.0.8.51254: Flags [.], ack 221340, win 23786, options [nop,nop,TS val 2437037 ecr 2217269,nop,nop,sack 2 {248472:254184}{234192:247044},mptcp dss ack 4084214710], length 0
22:18:39.131288 IP 112.26.0.1.targus-getdata1 > 112.26.0.8.51254: Flags [.], ack 221340, win 23786, options [nop,nop,TS val 2437037 ecr 2217269,nop,nop,sack 2 {248472:254184}{234192:247044},mptcp dss ack 4084214710], length 0
22:18:39.252635 IP 112.26.0.8.51254 > 112.26.0.1.targus-getdata1: Flags [.], seq 247044:248472, ack 1, win 4107, options [nop,nop,TS val 2218515 ecr 2436237,mptcp dss ack 1353584156 seq 4084311814 subseq 576950 len 1428 csum 0xe365], length 1428
22:18:39.252837 IP 112.26.0.1.targus-getdata1 > 112.26.0.8.51254: Flags [.], ack 221340, win 23786, options [nop,nop,TS val 2437181 ecr 2217269,nop,nop,sack 2 {234192:254184}{225624:227052},mptcp dss ack 4084214710], length 0
22:18:39.267509 IP 112.26.0.1.targus-getdata1 > 112.26.0.8.51254: Flags [.], ack 221340, win 23786, options [nop,nop,TS val 2437181 ecr 2217269,nop,nop,sack 2 {234192:254184}{225624:227052},mptcp dss ack 4084214710], length 0
22:18:39.388660 IP 112.26.0.8.51254 > 112.26.0.1.targus-getdata1: Flags [.], seq 254184:255612, ack 1, win 4107, options [nop,nop,TS val 2218614 ecr 2436329,mptcp dss ack 1353584156 seq 4084360366 subseq 584090 len 1428 csum 0x32f4], length 1428
22:18:39.388853 IP 112.26.0.1.targus-getdata1 > 112.26.0.8.51254: Flags [.], ack 221340, win 23786, options [nop,nop,TS val 2437317 ecr 2217269,nop,nop,sack 2 {234192:255612}{225624:227052},mptcp dss ack 4084214710], length 0
22:18:39.393449 IP 112.26.0.1.targus-getdata1 > 112.26.0.8.51254: Flags [.], ack 221340, win 23786, options [nop,nop,TS val 2437317 ecr 2217269,nop,nop,sack 2 {234192:255612}{225624:227052},mptcp dss ack 4084214710], length 0
22:18:39.507729 IP 112.26.0.8.51254 > 112.26.0.1.targus-getdata1: Flags [.], seq 257040:258468, ack 1, win 4107, options [nop,nop,TS val 2218656 ecr 2436467,mptcp dss ack 1353584156 seq 4084366078 subseq 586946 len 1428 csum 0x19f8], length 1428
22:18:39.507928 IP 112.26.0.1.targus-getdata1 > 112.26.0.8.51254: Flags [.], ack 221340, win 23886, options [nop,nop,TS val 2437436 ecr 2217269,nop,nop,sack 2 {257040:258468}{234192:255612},mptcp dss ack 4084263262], length 0
22:18:39.518522 IP 112.26.0.1.targus-getdata1 > 112.26.0.8.51254: Flags [.], ack 221340, win 23886, options [nop,nop,TS val 2437436 ecr 2217269,nop,nop,sack 2 {257040:258468}{234192:255612},mptcp dss ack 4084263262], length 0
22:18:39.626264 IP 112.26.0.8.51254 > 112.26.0.1.targus-getdata1: Flags [.], seq 258468:259896, ack 1, win 4107, options [nop,nop,TS val 2218656 ecr 2436467,mptcp dss ack 1353584156 seq 4084367506 subseq 588374 len 1428 csum 0xa412], length 1428
22:18:39.626587 IP 112.26.0.1.targus-getdata1 > 112.26.0.8.51254: Flags [.], ack 221340, win 23886, options [nop,nop,TS val 2437556 ecr 2217269,nop,nop,sack 2 {257040:259896}{234192:255612},mptcp dss ack 4084263262], length 0
22:18:39.638012 IP 112.26.0.1.targus-getdata1 > 112.26.0.8.51254: Flags [.], ack 221340, win 23886, options [nop,nop,TS val 2437556 ecr 2217269,nop,nop,sack 2 {257040:259896}{234192:255612},mptcp dss ack 4084263262], length 0
22:18:39.742453 IP 112.26.0.8.51254 > 112.26.0.1.targus-getdata1: Flags [.], seq 227052:228480, ack 1, win 4107, options [nop,nop,TS val 2218937 ecr 2436664,mptcp dss ack 1353584156 seq 4084273258 subseq 556958 len 1428 csum 0x4c54], length 1428
22:18:39.742702 IP 112.26.0.1.targus-getdata1 > 112.26.0.8.51254: Flags [.], ack 221340, win 23886, options [nop,nop,TS val 2437672 ecr 2217269,nop,nop,sack 2 {225624:228480}{257040:259896},mptcp dss ack 4084263262], length 0
22:18:39.755078 IP 112.26.0.1.targus-getdata1 > 112.26.0.8.51254: Flags [.], ack 221340, win 23886, options [nop,nop,TS val 2437672 ecr 2217269,nop,nop,sack 2 {225624:228480}{257040:259896},mptcp dss ack 4084263262], length 0
22:18:39.847585 IP 112.26.0.8.51254 > 112.26.0.1.targus-getdata1: Flags [.], seq 259896:261324, ack 1, win 4107, options [nop,nop,TS val 2219079 ecr 2436796,mptcp dss ack 1353584156 seq 4084380358 subseq 589802 len 1428 csum 0x4104], length 1428
22:18:39.847841 IP 112.26.0.1.targus-getdata1 > 112.26.0.8.51254: Flags [.], ack 221340, win 23886, options [nop,nop,TS val 2437777 ecr 2217269,nop,nop,sack 2 {257040:261324}{225624:228480},mptcp dss ack 4084263262], length 0
22:18:39.856028 IP 112.26.0.1.targus-getdata1 > 112.26.0.8.51254: Flags [.], ack 221340, win 23886, options [nop,nop,TS val 2437777 ecr 2217269,nop,nop,sack 2 {257040:261324}{225624:228480},mptcp dss ack 4084263262], length 0
22:18:39.964221 IP 112.26.0.8.51254 > 112.26.0.1.targus-getdata1: Flags [.], seq 261324:262752, ack 1, win 4107, options [nop,nop,TS val 2219157 ecr 2436904,mptcp dss ack 1353584156 seq 4084383214 subseq 591230 len 1428 csum 0xb2dd], length 1428
22:18:39.964445 IP 112.26.0.1.targus-getdata1 > 112.26.0.8.51254: Flags [.], ack 221340, win 23886, options [nop,nop,TS val 2437894 ecr 2217269,nop,nop,sack 2 {257040:262752}{225624:228480},mptcp dss ack 4084263262], length 0
22:18:39.979375 IP 112.26.0.1.targus-getdata1 > 112.26.0.8.51254: Flags [.], ack 221340, win 23886, options [nop,nop,TS val 2437894 ecr 2217269,nop,nop,sack 2 {257040:262752}{225624:228480},mptcp dss ack 4084263262], length 0
22:18:40.071351 IP 112.26.0.8.51254 > 112.26.0.1.targus-getdata1: Flags [.], seq 262752:264180, ack 1, win 4107, options [nop,nop,TS val 2219305 ecr 2437037,mptcp dss ack 1353584156 seq 4084390354 subseq 592658 len 1428 csum 0xddc3], length 1428
22:18:40.071578 IP 112.26.0.1.targus-getdata1 > 112.26.0.8.51254: Flags [.], ack 221340, win 23886, options [nop,nop,TS val 2438001 ecr 2217269,nop,nop,sack 2 {257040:264180}{225624:228480},mptcp dss ack 4084263262], length 0
22:18:40.082077 IP 112.26.0.1.targus-getdata1 > 112.26.0.8.51254: Flags [.], ack 221340, win 23886, options [nop,nop,TS val 2438001 ecr 2217269,nop,nop,sack 2 {257040:264180}{225624:228480},mptcp dss ack 4084263262], length 0
22:18:40.210311 IP 112.26.0.8.51254 > 112.26.0.1.targus-getdata1: Flags [.], seq 264180:265608, ack 1, win 4107, options [nop,nop,TS val 2219460 ecr 2437181,mptcp dss ack 1353584156 seq 4084397494 subseq 594086 len 1428 csum 0x8105], length 1428
22:18:40.210655 IP 112.26.0.1.targus-getdata1 > 112.26.0.8.51254: Flags [.], ack 221340, win 23886, options [nop,nop,TS val 2438140 ecr 2217269,nop,nop,sack 2 {257040:265608}{225624:228480},mptcp dss ack 4084263262], length 0
22:18:40.214718 IP 112.26.0.1.targus-getdata1 > 112.26.0.8.51254: Flags [.], ack 221340, win 23886, options [nop,nop,TS val 2438140 ecr 2217269,nop,nop,sack 2 {257040:265608}{225624:228480},mptcp dss ack 4084263262], length 0
22:18:40.367964 IP 112.26.0.8.51254 > 112.26.0.1.targus-getdata1: Flags [.], seq 265608:267036, ack 1, win 4107, options [nop,nop,TS val 2219610 ecr 2437317,mptcp dss ack 1353584156 seq 4084401778 subseq 595514 len 1428 csum 0x5a3a], length 1428
22:18:40.368181 IP 112.26.0.1.targus-getdata1 > 112.26.0.8.51254: Flags [.], ack 221340, win 23886, options [nop,nop,TS val 2438297 ecr 2217269,nop,nop,sack 2 {257040:267036}{225624:228480},mptcp dss ack 4084263262], length 0
22:18:40.371924 IP 112.26.0.1.targus-getdata1 > 112.26.0.8.51254: Flags [.], ack 221340, win 23886, options [nop,nop,TS val 2438297 ecr 2217269,nop,nop,sack 2 {257040:267036}{225624:228480},mptcp dss ack 4084263262], length 0
22:18:40.485737 IP 112.26.0.8.51254 > 112.26.0.1.targus-getdata1: Flags [.], seq 255612:257040, ack 1, win 4107, options [nop,nop,TS val 2219635 ecr 2437436,mptcp dss ack 1353584156 seq 4084364650 subseq 585518 len 1428 csum 0x8f3a], length 1428
22:18:40.485927 IP 112.26.0.1.targus-getdata1 > 112.26.0.8.51254: Flags [.], ack 221340, win 23886, options [nop,nop,TS val 2438414 ecr 2217269,nop,nop,sack 2 {234192:267036}{225624:228480},mptcp dss ack 4084263262], length 0
22:18:40.490935 IP 112.26.0.1.targus-getdata1 > 112.26.0.8.51254: Flags [.], ack 221340, win 23886, options [nop,nop,TS val 2438414 ecr 2217269,nop,nop,sack 2 {234192:267036}{225624:228480},mptcp dss ack 4084263262], length 0
22:18:40.572702 IP 112.26.0.8.51254 > 112.26.0.1.targus-getdata1: Flags [.], seq 221340:222768, ack 1, win 4107, options [nop,nop,TS val 2219862 ecr 2437672,mptcp dss ack 1353584156 seq 4084263262 subseq 551246 len 1428 csum 0xfc42], length 1428
22:18:40.572953 IP 112.26.0.1.targus-getdata1 > 112.26.0.8.51254: Flags [.], ack 267036, win 23195, options [nop,nop,TS val 2438502 ecr 2219862,mptcp dss ack 4084363222], length 0
22:18:40.633162 IP 112.26.0.1.targus-getdata1 > 112.26.0.8.51254: Flags [.], ack 267036, win 23195, options [nop,nop,TS val 2438502 ecr 2219862,mptcp dss ack 4084363222], length 0
22:18:40.678193 IP 112.26.0.8.51254 > 112.26.0.1.targus-getdata1: Flags [.], seq 268464:269892, ack 1, win 4107, options [nop,nop,TS val 2219990 ecr 2437777,mptcp dss ack 1353584156 seq 4084420342 subseq 598370 len 1428 csum 0x174e], length 1428
22:18:40.678394 IP 112.26.0.1.targus-getdata1 > 112.26.0.8.51254: Flags [.], ack 267036, win 24290, options [nop,nop,TS val 2438607 ecr 2219862,nop,nop,sack 1 {268464:269892},mptcp dss ack 4084363222], length 0
22:18:40.770771 IP 112.26.0.1.targus-getdata1 > 112.26.0.8.51254: Flags [.], ack 267036, win 24290, options [nop,nop,TS val 2438607 ecr 2219862,nop,nop,sack 1 {268464:269892},mptcp dss ack 4084363222], length 0
22:18:40.804138 IP 112.26.0.8.51254 > 112.26.0.1.targus-getdata1: Flags [.], seq 269892:271320, ack 1, win 4107, options [nop,nop,TS val 2220203 ecr 2437894,mptcp dss ack 1353584156 seq 4084426054 subseq 599798 len 1428 csum 0xabce], length 1428
22:18:40.804357 IP 112.26.0.1.targus-getdata1 > 112.26.0.8.51254: Flags [.], ack 267036, win 24290, options [nop,nop,TS val 2438733 ecr 2219862,nop,nop,sack 1 {268464:271320},mptcp dss ack 4084363222], length 0
22:18:40.869469 IP 112.26.0.1.targus-getdata1 > 112.26.0.8.51254: Flags [.], ack 267036, win 24290, options [nop,nop,TS val 2438733 ecr 2219862,nop,nop,sack 1 {268464:271320},mptcp dss ack 4084363222], length 0
22:18:40.915021 IP 112.26.0.8.51254 > 112.26.0.1.targus-getdata1: Flags [.], seq 271320:272748, ack 1, win 4107, options [nop,nop,TS val 2220210 ecr 2438001,mptcp dss ack 1353584156 seq 4084427482 subseq 601226 len 1428 csum 0x4e6], length 1428
22:18:40.915212 IP 112.26.0.1.targus-getdata1 > 112.26.0.8.51254: Flags [.], ack 267036, win 24290, options [nop,nop,TS val 2438844 ecr 2219862,nop,nop,sack 1 {268464:272748},mptcp dss ack 4084363222], length 0
22:18:40.969227 IP 112.26.0.1.targus-getdata1 > 112.26.0.8.51254: Flags [.], ack 267036, win 24290, options [nop,nop,TS val 2438844 ecr 2219862,nop,nop,sack 1 {268464:272748},mptcp dss ack 4084363222], length 0
22:18:41.060574 IP 112.26.0.8.51254 > 112.26.0.1.targus-getdata1: Flags [.], seq 272748:274176, ack 1, win 4107, options [nop,nop,TS val 2220325 ecr 2438140,mptcp dss ack 1353584156 seq 4084431766 subseq 602654 len 1428 csum 0x3d85], length 1428
22:18:41.060806 IP 112.26.0.1.targus-getdata1 > 112.26.0.8.51254: Flags [.], ack 267036, win 24290, options [nop,nop,TS val 2438990 ecr 2219862,nop,nop,sack 1 {268464:274176},mptcp dss ack 4084363222], length 0
22:18:41.065349 IP 112.26.0.1.targus-getdata1 > 112.26.0.8.51254: Flags [.], ack 267036, win 24290, options [nop,nop,TS val 2438990 ecr 2219862,nop,nop,sack 1 {268464:274176},mptcp dss ack 4084363222], length 0
22:18:41.166983 IP 112.26.0.8.51254 > 112.26.0.1.targus-getdata1: Flags [.], seq 274176:275604, ack 1, win 4107, options [nop,nop,TS val 2220499 ecr 2438297,mptcp dss ack 1353584156 seq 4084436050 subseq 604082 len 1428 csum 0xbc23], length 1428
22:18:41.167182 IP 112.26.0.1.targus-getdata1 > 112.26.0.8.51254: Flags [.], ack 267036, win 24373, options [nop,nop,TS val 2439096 ecr 2219862,nop,nop,sack 1 {268464:275604},mptcp dss ack 4084371790], length 0
22:18:41.172953 IP 112.26.0.1.targus-getdata1 > 112.26.0.8.51254: Flags [.], ack 267036, win 24373, options [nop,nop,TS val 2439096 ecr 2219862,nop,nop,sack 1 {268464:275604},mptcp dss ack 4084371790], length 0
22:18:41.298022 IP 112.26.0.8.51254 > 112.26.0.1.targus-getdata1: Flags [.], seq 275604:277032, ack 1, win 4107, options [nop,nop,TS val 2220597 ecr 2438414,mptcp dss ack 1353584156 seq 4084438906 subseq 605510 len 1428 csum 0x1eb9], length 1428
22:18:41.298301 IP 112.26.0.1.targus-getdata1 > 112.26.0.8.51254: Flags [.], ack 267036, win 24440, options [nop,nop,TS val 2439227 ecr 2219862,nop,nop,sack 1 {268464:277032},mptcp dss ack 4084381786], length 0
22:18:41.327531 IP 112.26.0.1.targus-getdata1 > 112.26.0.8.51254: Flags [.], ack 267036, win 24440, options [nop,nop,TS val 2439227 ecr 2219862,nop,nop,sack 1 {268464:277032},mptcp dss ack 4084381786], length 0
22:18:41.432223 IP 112.26.0.8.51254 > 112.26.0.1.targus-getdata1: Flags [.], seq 277032:278460, ack 1, win 4107, options [nop,nop,TS val 2220732 ecr 2438502,mptcp dss ack 1353584156 seq 4084443190 subseq 606938 len 1428 csum 0x6d1b], length 1428
22:18:41.432420 IP 112.26.0.1.targus-getdata1 > 112.26.0.8.51254: Flags [.], ack 267036, win 24491, options [nop,nop,TS val 2439361 ecr 2219862,nop,nop,sack 1 {268464:278460},mptcp dss ack 4084396066], length 0
22:18:41.446073 IP 112.26.0.1.targus-getdata1 > 112.26.0.8.51254: Flags [.], ack 267036, win 24491, options [nop,nop,TS val 2439361 ecr 2219862,nop,nop,sack 1 {268464:278460},mptcp dss ack 4084396066], length 0
22:18:41.571875 IP 112.26.0.8.51254 > 112.26.0.1.targus-getdata1: Flags [.], seq 278460:279888, ack 1, win 4107, options [nop,nop,TS val 2220732 ecr 2438502,mptcp dss ack 1353584156 seq 4084444618 subseq 608366 len 1428 csum 0xbf5b], length 1428
22:18:41.572062 IP 112.26.0.1.targus-getdata1 > 112.26.0.8.51254: Flags [.], ack 267036, win 24491, options [nop,nop,TS val 2439501 ecr 2219862,nop,nop,sack 1 {268464:279888},mptcp dss ack 4084396066], length 0
22:18:41.578148 IP 112.26.0.1.targus-getdata1 > 112.26.0.8.51254: Flags [.], ack 267036, win 24491, options [nop,nop,TS val 2439501 ecr 2219862,nop,nop,sack 1 {268464:279888},mptcp dss ack 4084396066], length 0
22:18:41.719369 IP 112.26.0.8.51254 > 112.26.0.1.targus-getdata1: Flags [.], seq 281316:282744, ack 1, win 4107, options [nop,nop,TS val 2220732 ecr 2438502,mptcp dss ack 1353584156 seq 4084447474 subseq 611222 len 1428 csum 0xfcba], length 1428
22:18:41.719570 IP 112.26.0.1.targus-getdata1 > 112.26.0.8.51254: Flags [.], ack 267036, win 24491, options [nop,nop,TS val 2439649 ecr 2219862,nop,nop,sack 2 {281316:282744}{268464:279888},mptcp dss ack 4084396066], length 0
22:18:41.724765 IP 112.26.0.1.targus-getdata1 > 112.26.0.8.51254: Flags [.], ack 267036, win 24491, options [nop,nop,TS val 2439649 ecr 2219862,nop,nop,sack 2 {281316:282744}{268464:279888},mptcp dss ack 4084396066], length 0
22:18:41.834178 IP 112.26.0.8.51254 > 112.26.0.1.targus-getdata1: Flags [.], seq 282744:284172, ack 1, win 4107, options [nop,nop,TS val 2220732 ecr 2438502,mptcp dss ack 1353584156 seq 4084448902 subseq 612650 len 1428 csum 0xa32c], length 1428
22:18:41.834417 IP 112.26.0.1.targus-getdata1 > 112.26.0.8.51254: Flags [.], ack 267036, win 24491, options [nop,nop,TS val 2439763 ecr 2219862,nop,nop,sack 2 {281316:284172}{268464:279888},mptcp dss ack 4084396066], length 0
22:18:41.838468 IP 112.26.0.1.targus-getdata1 > 112.26.0.8.51254: Flags [.], ack 267036, win 24491, options [nop,nop,TS val 2439763 ecr 2219862,nop,nop,sack 2 {281316:284172}{268464:279888},mptcp dss ack 4084396066], length 0
22:18:41.957918 IP 112.26.0.8.51254 > 112.26.0.1.targus-getdata1: Flags [.], seq 285600:287028, ack 1, win 4107, options [nop,nop,TS val 2220930 ecr 2438607,mptcp dss ack 1353584156 seq 4084457470 subseq 615506 len 1428 csum 0xfe2e], length 1428
22:18:41.958145 IP 112.26.0.1.targus-getdata1 > 112.26.0.8.51254: Flags [.], ack 267036, win 24491, options [nop,nop,TS val 2439887 ecr 2219862,nop,nop,sack 2 {285600:287028}{281316:284172},mptcp dss ack 4084396066], length 0
22:18:41.978105 IP 112.26.0.1.targus-getdata1 > 112.26.0.8.51254: Flags [.], ack 267036, win 24491, options [nop,nop,TS val 2439887 ecr 2219862,nop,nop,sack 2 {285600:287028}{281316:284172},mptcp dss ack 4084396066], length 0
22:18:42.057822 IP 112.26.0.8.51254 > 112.26.0.1.targus-getdata1: Flags [.], seq 287028:288456, ack 1, win 4107, options [nop,nop,TS val 2221086 ecr 2438733,mptcp dss ack 1353584156 seq 4084466038 subseq 616934 len 1428 csum 0x37a], length 1428
22:18:42.058046 IP 112.26.0.1.targus-getdata1 > 112.26.0.8.51254: Flags [.], ack 267036, win 24491, options [nop,nop,TS val 2439987 ecr 2219862,nop,nop,sack 2 {285600:288456}{281316:284172},mptcp dss ack 4084396066], length 0
22:18:42.067028 IP 112.26.0.1.targus-getdata1 > 112.26.0.8.51254: Flags [.], ack 267036, win 24491, options [nop,nop,TS val 2439987 ecr 2219862,nop,nop,sack 2 {285600:288456}{281316:284172},mptcp dss ack 4084396066], length 0
22:18:42.178044 IP 112.26.0.8.51254 > 112.26.0.1.targus-getdata1: Flags [.], seq 288456:289884, ack 1, win 4107, options [nop,nop,TS val 2221086 ecr 2438733,mptcp dss ack 1353584156 seq 4084467466 subseq 618362 len 1428 csum 0xdce9], length 1428
22:18:42.178201 IP 112.26.0.1.targus-getdata1 > 112.26.0.8.51254: Flags [.], ack 267036, win 24491, options [nop,nop,TS val 2440107 ecr 2219862,nop,nop,sack 2 {285600:289884}{281316:284172},mptcp dss ack 4084396066], length 0
22:18:42.232649 IP 112.26.0.1.targus-getdata1 > 112.26.0.8.51254: Flags [.], ack 267036, win 24491, options [nop,nop,TS val 2440107 ecr 2219862,nop,nop,sack 2 {285600:289884}{281316:284172},mptcp dss ack 4084396066], length 0
22:18:42.292788 IP 112.26.0.8.51254 > 112.26.0.1.targus-getdata1: Flags [.], seq 291312:292740, ack 1, win 4107, options [nop,nop,TS val 2221311 ecr 2438990,mptcp dss ack 1353584156 seq 4084474606 subseq 621218 len 1428 csum 0xf51e], length 1428
22:18:42.293007 IP 112.26.0.1.targus-getdata1 > 112.26.0.8.51254: Flags [.], ack 267036, win 24491, options [nop,nop,TS val 2440222 ecr 2219862,nop,nop,sack 2 {291312:292740}{285600:289884},mptcp dss ack 4084396066], length 0
22:18:42.296788 IP 112.26.0.1.targus-getdata1 > 112.26.0.8.51254: Flags [.], ack 267036, win 24491, options [nop,nop,TS val 2440222 ecr 2219862,nop,nop,sack 2 {291312:292740}{285600:289884},mptcp dss ack 4084396066], length 0
22:18:42.398412 IP 112.26.0.8.51254 > 112.26.0.1.targus-getdata1: Flags [.], seq 292740:294168, ack 1, win 4107, options [nop,nop,TS val 2221422 ecr 2439096,mptcp dss ack 1353584156 seq 4084478890 subseq 622646 len 1428 csum 0x7a33], length 1428
22:18:42.398642 IP 112.26.0.1.targus-getdata1 > 112.26.0.8.51254: Flags [.], ack 267036, win 24491, options [nop,nop,TS val 2440327 ecr 2219862,nop,nop,sack 2 {291312:294168}{285600:289884},mptcp dss ack 4084396066], length 0
22:18:42.403840 IP 112.26.0.1.targus-getdata1 > 112.26.0.8.51254: Flags [.], ack 267036, win 24491, options [nop,nop,TS val 2440327 ecr 2219862,nop,nop,sack 2 {291312:294168}{285600:289884},mptcp dss ack 4084396066], length 0
22:18:42.511996 IP 112.26.0.8.51254 > 112.26.0.1.targus-getdata1: Flags [.], seq 294168:295596, ack 1, win 4107, options [nop,nop,TS val 2221422 ecr 2439096,mptcp dss ack 1353584156 seq 4084480318 subseq 624074 len 1428 csum 0x1c2b], length 1428
22:18:42.512210 IP 112.26.0.1.targus-getdata1 > 112.26.0.8.51254: Flags [.], ack 267036, win 24491, options [nop,nop,TS val 2440441 ecr 2219862,nop,nop,sack 2 {291312:295596}{285600:289884},mptcp dss ack 4084396066], length 0
22:18:42.551277 IP 112.26.0.1.targus-getdata1 > 112.26.0.8.51254: Flags [.], ack 267036, win 24491, options [nop,nop,TS val 2440441 ecr 2219862,nop,nop,sack 2 {291312:295596}{285600:289884},mptcp dss ack 4084396066], length 0
22:18:42.610232 IP 112.26.0.8.51254 > 112.26.0.1.targus-getdata1: Flags [.], seq 267036:268464, ack 1, win 4107, options [nop,nop,TS val 2221510 ecr 2439227,mptcp dss ack 1353584156 seq 4084411774 subseq 596942 len 1428 csum 0x4e5a], length 1428
22:18:42.610466 IP 112.26.0.1.targus-getdata1 > 112.26.0.8.51254: Flags [.], ack 279888, win 24491, options [nop,nop,TS val 2440539 ecr 2221510,nop,nop,sack 2 {291312:295596}{285600:289884},mptcp dss ack 4084396066], length 0
22:18:42.621817 IP 112.26.0.1.targus-getdata1 > 112.26.0.8.51254: Flags [.], ack 279888, win 24491, options [nop,nop,TS val 2440539 ecr 2221510,nop,nop,sack 2 {291312:295596}{285600:289884},mptcp dss ack 4084396066], length 0
22:18:42.771132 IP 112.26.0.8.51254 > 112.26.0.1.targus-getdata1: Flags [.], seq 279888:281316, ack 1, win 4107, options [nop,nop,TS val 2221908 ecr 2439649,mptcp dss ack 1353584156 seq 4084446046 subseq 609794 len 1428 csum 0xb2ce], length 1428
22:18:42.771335 IP 112.26.0.1.targus-getdata1 > 112.26.0.8.51254: Flags [.], ack 284172, win 24491, options [nop,nop,TS val 2440700 ecr 2221908,nop,nop,sack 2 {291312:295596}{285600:289884},mptcp dss ack 4084396066], length 0
22:18:42.776823 IP 112.26.0.1.targus-getdata1 > 112.26.0.8.51254: Flags [.], ack 284172, win 24491, options [nop,nop,TS val 2440700 ecr 2221908,nop,nop,sack 2 {291312:295596}{285600:289884},mptcp dss ack 4084396066], length 0
22:18:42.948082 IP 112.26.0.8.51254 > 112.26.0.1.targus-getdata1: Flags [.], seq 297024:298452, ack 1, win 4107, options [nop,nop,TS val 2222039 ecr 2439763,mptcp dss ack 1353584156 seq 4084501738 subseq 626930 len 1428 csum 0xadae], length 1428
22:18:42.948310 IP 112.26.0.1.targus-getdata1 > 112.26.0.8.51254: Flags [.], ack 284172, win 24491, options [nop,nop,TS val 2440877 ecr 2221908,nop,nop,sack 2 {297024:298452}{291312:295596},mptcp dss ack 4084396066], length 0
22:18:42.953157 IP 112.26.0.1.targus-getdata1 > 112.26.0.8.51254: Flags [.], ack 284172, win 24491, options [nop,nop,TS val 2440877 ecr 2221908,nop,nop,sack 2 {297024:298452}{291312:295596},mptcp dss ack 4084396066], length 0
22:18:43.033249 IP 112.26.0.8.51254 > 112.26.0.1.targus-getdata1: Flags [.], seq 284172:285600, ack 1, win 4107, options [nop,nop,TS val 2222329 ecr 2440107,mptcp dss ack 1353584156 seq 4084450330 subseq 614078 len 1428 csum 0x97bb], length 1428
22:18:43.033458 IP 112.26.0.1.targus-getdata1 > 112.26.0.8.51254: Flags [.], ack 289884, win 24491, options [nop,nop,TS val 2440963 ecr 2222329,nop,nop,sack 2 {297024:298452}{291312:295596},mptcp dss ack 4084396066], length 0
22:18:43.070724 IP 112.26.0.1.targus-getdata1 > 112.26.0.8.51254: Flags [.], ack 289884, win 24491, options [nop,nop,TS val 2440963 ecr 2222329,nop,nop,sack 2 {297024:298452}{291312:295596},mptcp dss ack 4084396066], length 0
22:18:43.140140 IP 112.26.0.8.51254 > 112.26.0.1.targus-getdata1: Flags [.], seq 289884:291312, ack 1, win 4107, options [nop,nop,TS val 2222516 ecr 2440222,mptcp dss ack 1353584156 seq 4084470322 subseq 619790 len 1428 csum 0x249d], length 1428
22:18:43.140401 IP 112.26.0.1.targus-getdata1 > 112.26.0.8.51254: Flags [.], ack 295596, win 24491, options [nop,nop,TS val 2441069 ecr 2222516,nop,nop,sack 1 {297024:298452},mptcp dss ack 4084396066], length 0
22:18:43.166734 IP 112.26.0.1.targus-getdata1 > 112.26.0.8.51254: Flags [.], ack 295596, win 24491, options [nop,nop,TS val 2441069 ecr 2222516,nop,nop,sack 1 {297024:298452},mptcp dss ack 4084396066], length 0
22:18:43.224678 IP 112.26.0.8.51254 > 112.26.0.1.targus-getdata1: Flags [.], seq 298452:299880, ack 1, win 4107, options [nop,nop,TS val 2222665 ecr 2440327,mptcp dss ack 1353584156 seq 4084526014 subseq 628358 len 1428 csum 0xa8c9], length 1428
22:18:43.224896 IP 112.26.0.1.targus-getdata1 > 112.26.0.8.51254: Flags [.], ack 295596, win 24491, options [nop,nop,TS val 2441154 ecr 2222516,nop,nop,sack 1 {297024:299880},mptcp dss ack 4084396066], length 0
22:18:43.303510 IP 112.26.0.1.targus-getdata1 > 112.26.0.8.51254: Flags [.], ack 295596, win 24491, options [nop,nop,TS val 2441154 ecr 2222516,nop,nop,sack 1 {297024:299880},mptcp dss ack 4084396066], length 0
22:18:43.373897 IP 112.26.0.8.51254 > 112.26.0.1.targus-getdata1: Flags [.], seq 299880:301308, ack 1, win 4107, options [nop,nop,TS val 2222834 ecr 2440441,mptcp dss ack 1353584156 seq 4084531726 subseq 629786 len 1428 csum 0xf3d2], length 1428
22:18:43.374160 IP 112.26.0.1.targus-getdata1 > 112.26.0.8.51254: Flags [.], ack 295596, win 24491, options [nop,nop,TS val 2441303 ecr 2222516,nop,nop,sack 1 {297024:301308},mptcp dss ack 4084396066], length 0
22:18:43.409629 IP 112.26.0.1.targus-getdata1 > 112.26.0.8.51254: Flags [.], ack 295596, win 24491, options [nop,nop,TS val 2441303 ecr 2222516,nop,nop,sack 1 {297024:301308},mptcp dss ack 4084396066], length 0
22:18:43.454758 IP 112.26.0.8.51254 > 112.26.0.1.targus-getdata1: Flags [.], seq 301308:302736, ack 1, win 4107, options [nop,nop,TS val 2222930 ecr 2440539,mptcp dss ack 1353584156 seq 4084534582 subseq 631214 len 1428 csum 0x74c4], length 1428
22:18:43.455006 IP 112.26.0.1.targus-getdata1 > 112.26.0.8.51254: Flags [.], ack 295596, win 24491, options [nop,nop,TS val 2441384 ecr 2222516,nop,nop,sack 1 {297024:302736},mptcp dss ack 4084396066], length 0
22:18:43.488413 IP 112.26.0.1.targus-getdata1 > 112.26.0.8.51254: Flags [.], ack 295596, win 24491, options [nop,nop,TS val 2441384 ecr 2222516,nop,nop,sack 1 {297024:302736},mptcp dss ack 4084396066], length 0
22:18:43.564959 IP 112.26.0.8.51254 > 112.26.0.1.targus-getdata1: Flags [.], seq 302736:304164, ack 1, win 4107, options [nop,nop,TS val 2222930 ecr 2440539,mptcp dss ack 1353584156 seq 4084536010 subseq 632642 len 1428 csum 0xf04b], length 1428
22:18:43.565195 IP 112.26.0.1.targus-getdata1 > 112.26.0.8.51254: Flags [.], ack 295596, win 24425, options [nop,nop,TS val 2441494 ecr 2222516,nop,nop,sack 1 {297024:304164},mptcp dss ack 4084400350], length 0
22:18:43.590879 IP 112.26.0.1.targus-getdata1 > 112.26.0.8.51254: Flags [.], ack 295596, win 24425, options [nop,nop,TS val 2441494 ecr 2222516,nop,nop,sack 1 {297024:304164},mptcp dss ack 4084400350], length 0
22:18:43.690635 IP 112.26.0.8.51254 > 112.26.0.1.targus-getdata1: Flags [.], seq 304164:305592, ack 1, win 4107, options [nop,nop,TS val 2222930 ecr 2440539,mptcp dss ack 1353584156 seq 4084537438 subseq 634070 len 1428 csum 0x4974], length 1428
22:18:43.690899 IP 112.26.0.1.targus-getdata1 > 112.26.0.8.51254: Flags [.], ack 295596, win 24425, options [nop,nop,TS val 2441620 ecr 2222516,nop,nop,sack 1 {297024:305592},mptcp dss ack 4084400350], length 0
22:18:43.707658 IP 112.26.0.1.targus-getdata1 > 112.26.0.8.51254: Flags [.], ack 295596, win 24425, options [nop,nop,TS val 2441620 ecr 2222516,nop,nop,sack 1 {297024:305592},mptcp dss ack 4084400350], length 0
22:18:43.783053 IP 112.26.0.8.51254 > 112.26.0.1.targus-getdata1: Flags [.], seq 295596:297024, ack 1, win 4107, options [nop,nop,TS val 2222998 ecr 2440700,mptcp dss ack 1353584156 seq 4084488886 subseq 625502 len 1428 csum 0xc2f4], length 1428
22:18:43.783282 IP 112.26.0.1.targus-getdata1 > 112.26.0.8.51254: Flags [.], ack 305592, win 24425, options [nop,nop,TS val 2441712 ecr 2222998,mptcp dss ack 4084400350], length 0
22:18:43.789979 IP 112.26.0.1.targus-getdata1 > 112.26.0.8.51254: Flags [.], ack 305592, win 24425, options [nop,nop,TS val 2441712 ecr 2222998,mptcp dss ack 4084400350], length 0
22:18:43.932129 IP 112.26.0.8.51254 > 112.26.0.1.targus-getdata1: Flags [.], seq 305592:307020, ack 1, win 4107, options [nop,nop,TS val 2222998 ecr 2440700,mptcp dss ack 1353584156 seq 4084540294 subseq 635498 len 1428 csum 0x75b6], length 1428
22:18:43.932369 IP 112.26.0.1.targus-getdata1 > 112.26.0.8.51254: Flags [.], ack 307020, win 24425, options [nop,nop,TS val 2441861 ecr 2222998,mptcp dss ack 4084400350], length 0
22:18:43.945239 IP 112.26.0.1.targus-getdata1 > 112.26.0.8.51254: Flags [.], ack 307020, win 24425, options [nop,nop,TS val 2441861 ecr 2222998,mptcp dss ack 4084400350], length 0
22:18:44.035516 IP 112.26.0.8.51254 > 112.26.0.1.targus-getdata1: Flags [.], seq 307020:308448, ack 1, win 4107, options [nop,nop,TS val 2223161 ecr 2440877,mptcp dss ack 1353584156 seq 4084544578 subseq 636926 len 1428 csum 0x3443], length 1428
22:18:44.035751 IP 112.26.0.1.targus-getdata1 > 112.26.0.8.51254: Flags [.], ack 308448, win 24425, options [nop,nop,TS val 2441965 ecr 2223161,mptcp dss ack 4084400350], length 0
22:18:44.079070 IP 112.26.0.1.targus-getdata1 > 112.26.0.8.51254: Flags [.], ack 308448, win 24425, options [nop,nop,TS val 2441965 ecr 2223161,mptcp dss ack 4084400350], length 0
22:18:44.131554 IP 112.26.0.8.51254 > 112.26.0.1.targus-getdata1: Flags [.], seq 308448:309876, ack 1, win 4107, options [nop,nop,TS val 2223200 ecr 2440963,mptcp dss ack 1353584156 seq 4084548862 subseq 638354 len 1428 csum 0x8088], length 1428
22:18:44.131803 IP 112.26.0.1.targus-getdata1 > 112.26.0.8.51254: Flags [.], ack 309876, win 24425, options [nop,nop,TS val 2442061 ecr 2223200,mptcp dss ack 4084400350], length 0
22:18:44.216825 IP 112.26.0.1.targus-getdata1 > 112.26.0.8.51254: Flags [.], ack 309876, win 24425, options [nop,nop,TS val 2442061 ecr 2223200,mptcp dss ack 4084400350], length 0
22:18:44.275719 IP 112.26.0.8.51254 > 112.26.0.1.targus-getdata1: Flags [.], seq 309876:311304, ack 1, win 4107, options [nop,nop,TS val 2223372 ecr 2441069,mptcp dss ack 1353584156 seq 4084554574 subseq 639782 len 1428 csum 0x33e6], length 1428
22:18:44.275999 IP 112.26.0.1.targus-getdata1 > 112.26.0.8.51254: Flags [.], ack 311304, win 24425, options [nop,nop,TS val 2442205 ecr 2223372,mptcp dss ack 4084400350], length 0
22:18:44.328754 IP 112.26.0.1.targus-getdata1 > 112.26.0.8.51254: Flags [.], ack 311304, win 24425, options [nop,nop,TS val 2442205 ecr 2223372,mptcp dss ack 4084400350], length 0
22:18:44.405547 IP 112.26.0.8.51254 > 112.26.0.1.targus-getdata1: Flags [.], seq 311304:312732, ack 1, win 4107, options [nop,nop,TS val 2223511 ecr 2441154,mptcp dss ack 1353584156 seq 4084557430 subseq 641210 len 1428 csum 0x7e8a], length 1428
22:18:44.405794 IP 112.26.0.1.targus-getdata1 > 112.26.0.8.51254: Flags [.], ack 312732, win 24108, options [nop,nop,TS val 2442334 ecr 2223511,mptcp dss ack 4084491742], length 0
22:18:44.467102 IP 112.26.0.1.targus-getdata1 > 112.26.0.8.51254: Flags [.], ack 312732, win 24108, options [nop,nop,TS val 2442334 ecr 2223511,mptcp dss ack 4084491742], length 0
22:18:44.531219 IP 112.26.0.8.51254 > 112.26.0.1.targus-getdata1: Flags [.], seq 312732:314160, ack 1, win 4107, options [nop,nop,TS val 2223624 ecr 2441303,mptcp dss ack 1353584156 seq 4084560286 subseq 642638 len 1428 csum 0x4066], length 1428
22:18:44.531459 IP 112.26.0.1.targus-getdata1 > 112.26.0.8.51254: Flags [.], ack 314160, win 24108, options [nop,nop,TS val 2442460 ecr 2223624,mptcp dss ack 4084491742], length 0
22:18:44.548223 IP 112.26.0.1.targus-getdata1 > 112.26.0.8.51254: Flags [.], ack 314160, win 24108, options [nop,nop,TS val 2442460 ecr 2223624,mptcp dss ack 4084491742], length 0
22:18:44.644925 IP 112.26.0.8.51254 > 112.26.0.1.targus-getdata1: Flags [.], seq 314160:315588, ack 1, win 4107, options [nop,nop,TS val 2223862 ecr 2441494,mptcp dss ack 1353584156 seq 4084568854 subseq 644066 len 1428 csum 0x4d08], length 1428
22:18:44.645107 IP 112.26.0.1.targus-getdata1 > 112.26.0.8.51254: Flags [.], ack 315588, win 24108, options [nop,nop,TS val 2442574 ecr 2223862,mptcp dss ack 4084491742], length 0
22:18:44.651007 IP 112.26.0.1.targus-getdata1 > 112.26.0.8.51254: Flags [.], ack 315588, win 24108, options [nop,nop,TS val 2442574 ecr 2223862,mptcp dss ack 4084491742], length 0
22:18:44.772033 IP 112.26.0.8.51254 > 112.26.0.1.targus-getdata1: Flags [.], seq 315588:317016, ack 1, win 4107, options [nop,nop,TS val 2223970 ecr 2441620,mptcp dss ack 1353584156 seq 4084574566 subseq 645494 len 1428 csum 0x685e], length 1428
22:18:44.772271 IP 112.26.0.1.targus-getdata1 > 112.26.0.8.51254: Flags [.], ack 317016, win 24108, options [nop,nop,TS val 2442701 ecr 2223970,mptcp dss ack 4084491742], length 0
22:18:44.777945 IP 112.26.0.1.targus-getdata1 > 112.26.0.8.51254: Flags [.], ack 317016, win 24108, options [nop,nop,TS val 2442701 ecr 2223970,mptcp dss ack 4084491742], length 0
22:18:44.875841 IP 112.26.0.8.51254 > 112.26.0.1.targus-getdata1: Flags [.], seq 317016:318444, ack 1, win 4107, options [nop,nop,TS val 2224181 ecr 2441965,mptcp dss ack 1353584156 seq 4084580278 subseq 646922 len 1428 csum 0xae99], length 1428
22:18:44.876117 IP 112.26.0.1.targus-getdata1 > 112.26.0.8.51254: Flags [.], ack 318444, win 24108, options [nop,nop,TS val 2442805 ecr 2224181,mptcp dss ack 4084491742], length 0
22:18:44.913466 IP 112.26.0.1.targus-getdata1 > 112.26.0.8.51254: Flags [.], ack 318444, win 24108, options [nop,nop,TS val 2442805 ecr 2224181,mptcp dss ack 4084491742], length 0
22:18:44.985846 IP 112.26.0.8.51254 > 112.26.0.1.targus-getdata1: Flags [.], seq 318444:319872, ack 1, win 4107, options [nop,nop,TS val 2224317 ecr 2442061,mptcp dss ack 1353584156 seq 4084584562 subseq 648350 len 1428 csum 0x210b], length 1428
22:18:44.986072 IP 112.26.0.1.targus-getdata1 > 112.26.0.8.51254: Flags [.], ack 319872, win 24108, options [nop,nop,TS val 2442915 ecr 2224317,mptcp dss ack 4084491742], length 0
