17:48:13.702007 IP 112.26.0.8.42002 > 112.26.0.1.targus-getdata1: Flags [S], seq 3315743830, win 65535, options [mss 1460,sackOK,TS val 4294824248 ecr 0,nop,wscale 6,mptcp capable csum {0x4b84552d0df3f1e2}], length 0
17:48:13.702386 IP 112.26.0.1.targus-getdata1 > 112.26.0.8.42002: Flags [S.], seq 1017765953, ack 3315743831, win 65535, options [mss 1460,sackOK,TS val 78607 ecr 4294824248,nop,wscale 6,mptcp capable csum {0xaed1cb2ea07f86bb}], length 0
17:48:13.782341 IP 112.26.0.1.targus-getdata1 > 112.26.0.8.42002: Flags [S.], seq 1017765953, ack 3315743831, win 65535, options [mss 1460,sackOK,TS val 78607 ecr 4294824248,nop,wscale 6,mptcp capable csum {0xaed1cb2ea07f86bb}], length 0
17:48:13.886286 IP 112.26.0.8.42002 > 112.26.0.1.targus-getdata1: Flags [.], ack 1, win 1369, options [nop,nop,TS val 4294825451 ecr 78607,mptcp capable csum {0x4b84552d0df3f1e2,0xaed1cb2ea07f86bb},mptcp dss ack 3570653083], length 0
17:48:13.886659 IP 112.26.0.1.targus-getdata1 > 112.26.0.8.42002: Flags [.], ack 1, win 1339, options [nop,nop,TS val 78791 ecr 4294825451,mptcp add-addr id 3 112.26.1.1,mptcp dss ack 3535591454], length 0
17:48:13.886720 IP 112.26.0.1.targus-getdata1 > 112.26.0.8.42002: Flags [.], ack 1, win 1339, options [nop,nop,TS val 78791 ecr 4294825451,mptcp add-addr id 5 112.26.3.1,mptcp dss ack 3535591454], length 0
17:48:13.886755 IP 112.26.0.1.targus-getdata1 > 112.26.0.8.42002: Flags [.], ack 1, win 1339, options [nop,nop,TS val 78791 ecr 4294825451,mptcp add-addr id 6 112.26.2.1,mptcp dss ack 3535591454], length 0
17:48:50.504188 IP 112.26.2.1.targus-getdata1 > 112.26.0.8.35499: Flags [.], ack 1808793129, win 22632, options [nop,nop,TS val 115293 ecr 4294861554,mptcp dss ack 2167116074], length 0
17:48:50.505122 IP 112.26.3.1.targus-getdata1 > 112.26.0.8.36475: Flags [.], ack 3585329838, win 22677, options [nop,nop,TS val 115319 ecr 4294861675,mptcp dss ack 2167116074], length 0
17:48:50.698309 IP 112.26.0.8.36475 > 112.26.3.1.targus-getdata1: Flags [.], seq 1:1429, ack 0, win 4107, options [nop,nop,TS val 4294861885 ecr 115000,mptcp dss ack 2587900740 seq 2167148918 subseq 192781 len 1428 csum 0x5f3e], length 1428
17:48:50.698671 IP 112.26.3.1.targus-getdata1 > 112.26.0.8.36475: Flags [.], ack 1429, win 22723, options [nop,nop,TS val 115603 ecr 4294861885,mptcp dss ack 2167116074], length 0
17:49:12.437806 IP 112.26.1.1.targus-getdata1 > 112.26.0.8.41381: Flags [.], ack 3673465211, win 24380, options [nop,nop,TS val 137146 ecr 4294883314,mptcp dss ack 2167461650], length 0
17:49:34.041059 IP 112.26.0.8.35499 > 112.26.2.1.targus-getdata1: Flags [.], seq 314161:315589, ack 0, win 4107, options [nop,nop,TS val 4294905037 ecr 157867,mptcp dss ack 2587900740 seq 2167877198 subseq 498373 len 1428 csum 0x80a7], length 1428
17:49:55.163001 IP 112.26.1.1.targus-getdata1 > 112.26.0.8.41381: Flags [.], ack 171361, win 24558, options [nop,nop,TS val 179768 ecr 4294925648,mptcp dss ack 2168207066], length 0
17:49:55.183820 IP 112.26.0.8.35499 > 112.26.2.1.targus-getdata1: Flags [.], seq 502657:504085, ack 0, win 4107, options [nop,nop,TS val 4294926147 ecr 178785,mptcp dss ack 2587900740 seq 2168238482 subseq 686869 len 1428 csum 0xa24b], length 1428
17:49:55.184158 IP 112.26.2.1.targus-getdata1 > 112.26.0.8.35499: Flags [.], ack 491233, win 24558, options [nop,nop,TS val 180089 ecr 4294924422,nop,nop,sack 2 {502657:504085}{492661:498373},mptcp dss ack 2168207066], length 0
17:49:55.271129 IP 112.26.1.1.targus-getdata1 > 112.26.0.8.41381: Flags [.], ack 174217, win 24558, options [nop,nop,TS val 179912 ecr 4294925648,mptcp dss ack 2168207066], length 0
17:49:55.285201 IP 112.26.0.8.35499 > 112.26.2.1.targus-getdata1: Flags [.], seq 491233:492661, ack 0, win 4107, options [nop,nop,TS val 4294926335 ecr 179280,mptcp dss ack 2587900740 seq 2168207066 subseq 675445 len 1428 csum 0x6a98], length 1428
17:49:55.285559 IP 112.26.2.1.targus-getdata1 > 112.26.0.8.35499: Flags [.], ack 498373, win 24305, options [nop,nop,TS val 180190 ecr 4294926335,nop,nop,sack 1 {502657:504085},mptcp dss ack 2168224202], length 0
17:49:55.374998 IP 112.26.1.1.targus-getdata1 > 112.26.0.8.41381: Flags [.], ack 175645, win 24494, options [nop,nop,TS val 180280 ecr 4294925673,mptcp dss ack 2168224202], length 0
17:49:55.377712 IP 112.26.0.8.35499 > 112.26.2.1.targus-getdata1: Flags [.], seq 504085:505513, ack 0, win 4107, options [nop,nop,TS val 4294926525 ecr 179483,mptcp dss ack 2587900740 seq 2168239910 subseq 688297 len 1428 csum 0xe561], length 1428
17:49:55.378035 IP 112.26.2.1.targus-getdata1 > 112.26.0.8.35499: Flags [.], ack 498373, win 24494, options [nop,nop,TS val 180283 ecr 4294926335,nop,nop,sack 1 {502657:505513},mptcp dss ack 2168224202], length 0
17:49:55.390382 IP 112.26.0.8.36475 > 112.26.3.1.targus-getdata1: Flags [.], seq 268465:269893, ack 0, win 4107, options [nop,nop,TS val 4294926661 ecr 179875,mptcp dss ack 2587900740 seq 2168224202 subseq 461245 len 1428 csum 0x283], length 1428
17:49:55.390739 IP 112.26.3.1.targus-getdata1 > 112.26.0.8.36475: Flags [.], ack 271321, win 24463, options [nop,nop,TS val 180295 ecr 4294926661,mptcp dss ack 2168231342], length 0
17:49:55.463863 IP 112.26.0.8.41381 > 112.26.1.1.targus-getdata1: Flags [.], seq 175645:177073, ack 0, win 4107, options [nop,nop,TS val 4294926525 ecr 179089,mptcp dss ack 2587900740 seq 2168241338 subseq 298453 len 1428 csum 0x4adc], length 1428
17:49:55.477256 IP 112.26.3.1.targus-getdata1 > 112.26.0.8.36475: Flags [.], ack 271321, win 24463, options [nop,nop,TS val 180295 ecr 4294926661,mptcp dss ack 2168231342], length 0
17:49:55.488999 IP 112.26.2.1.targus-getdata1 > 112.26.0.8.35499: Flags [.], ack 491233, win 24558, options [nop,nop,TS val 180089 ecr 4294924422,nop,nop,sack 2 {502657:504085}{492661:498373},mptcp dss ack 2168207066], length 0
17:49:55.564356 IP 112.26.0.8.36475 > 112.26.3.1.targus-getdata1: Flags [.], seq 271321:272749, ack 0, win 4107, options [nop,nop,TS val 4294926661 ecr 179875,mptcp dss ack 2587900740 seq 2168245622 subseq 464101 len 1428 csum 0x823d], length 1428
17:49:55.564649 IP 112.26.3.1.targus-getdata1 > 112.26.0.8.36475: Flags [.], ack 272749, win 24507, options [nop,nop,TS val 180469 ecr 4294926661,mptcp dss ack 2168231342], length 0
17:49:55.579528 IP 112.26.0.8.41381 > 112.26.1.1.targus-getdata1: Flags [.], seq 177073:178501, ack 0, win 4107, options [nop,nop,TS val 4294926525 ecr 179089,mptcp dss ack 2587900740 seq 2168242766 subseq 299881 len 1428 csum 0x3a01], length 1428
17:49:55.598386 IP 112.26.0.8.41381 > 112.26.1.1.targus-getdata1: Flags [.], seq 178501:179929, ack 0, win 4107, options [nop,nop,TS val 4294926525 ecr 179089,mptcp dss ack 2587900740 seq 2168244194 subseq 301309 len 1428 csum 0x3a1e], length 1428
17:49:55.600873 IP 112.26.3.1.targus-getdata1 > 112.26.0.8.36475: Flags [.], ack 272749, win 24507, options [nop,nop,TS val 180469 ecr 4294926661,mptcp dss ack 2168231342], length 0
17:49:55.669906 IP 112.26.2.1.targus-getdata1 > 112.26.0.8.35499: Flags [.], ack 498373, win 24305, options [nop,nop,TS val 180190 ecr 4294926335,nop,nop,sack 1 {502657:504085},mptcp dss ack 2168224202], length 0
17:49:55.697800 IP 112.26.1.1.targus-getdata1 > 112.26.0.8.41381: Flags [.], ack 175645, win 24494, options [nop,nop,TS val 180280 ecr 4294925673,mptcp dss ack 2168224202], length 0
17:49:55.766782 IP 112.26.2.1.targus-getdata1 > 112.26.0.8.35499: Flags [.], ack 498373, win 24494, options [nop,nop,TS val 180283 ecr 4294926335,nop,nop,sack 1 {502657:505513},mptcp dss ack 2168224202], length 0
17:49:55.782758 IP 112.26.1.1.targus-getdata1 > 112.26.0.8.41381: Flags [.], ack 179929, win 24507, options [nop,nop,TS val 180688 ecr 4294926525,mptcp dss ack 2168231342], length 0
17:49:55.793621 IP 112.26.0.8.41381 > 112.26.1.1.targus-getdata1: Flags [.], seq 179929:181357, ack 0, win 4107, options [nop,nop,TS val 4294926669 ecr 179182,mptcp dss ack 2587900740 seq 2168247050 subseq 302737 len 1428 csum 0xab99], length 1428
17:49:55.881199 IP 112.26.0.8.41381 > 112.26.1.1.targus-getdata1: Flags [.], seq 182785:184213, ack 0, win 4107, options [nop,nop,TS val 4294926754 ecr 179377,mptcp dss ack 2587900740 seq 2168249906 subseq 305593 len 1428 csum 0xa9ef], length 1428
17:49:55.881530 IP 112.26.1.1.targus-getdata1 > 112.26.0.8.41381: Flags [.], ack 181357, win 24507, options [nop,nop,TS val 180786 ecr 4294926669,nop,nop,sack 1 {182785:184213},mptcp dss ack 2168231342], length 0
17:49:55.882107 IP 112.26.0.8.36475 > 112.26.3.1.targus-getdata1: Flags [.], seq 272749:274177, ack 0, win 4107, options [nop,nop,TS val 4294927148 ecr 180295,mptcp dss ack 2587900740 seq 2168252762 subseq 465529 len 1428 csum 0x4f45], length 1428
17:49:55.882425 IP 112.26.3.1.targus-getdata1 > 112.26.0.8.36475: Flags [.], ack 274177, win 24507, options [nop,nop,TS val 180787 ecr 4294927148,mptcp dss ack 2168231342], length 0
17:49:55.968043 IP 112.26.3.1.targus-getdata1 > 112.26.0.8.36475: Flags [.], ack 274177, win 24507, options [nop,nop,TS val 180787 ecr 4294927148,mptcp dss ack 2168231342], length 0
17:49:55.975566 IP 112.26.0.8.41381 > 112.26.1.1.targus-getdata1: Flags [.], seq 184213:185641, ack 0, win 4107, options [nop,nop,TS val 4294927033 ecr 179629,mptcp dss ack 2587900740 seq 2168251334 subseq 307021 len 1428 csum 0xa02d], length 1428
17:49:55.975899 IP 112.26.1.1.targus-getdata1 > 112.26.0.8.41381: Flags [.], ack 181357, win 24507, options [nop,nop,TS val 180880 ecr 4294926669,nop,nop,sack 1 {182785:185641},mptcp dss ack 2168231342], length 0
17:49:56.008664 IP 112.26.1.1.targus-getdata1 > 112.26.0.8.41381: Flags [.], ack 179929, win 24507, options [nop,nop,TS val 180688 ecr 4294926525,mptcp dss ack 2168231342], length 0
17:49:56.088668 IP 112.26.1.1.targus-getdata1 > 112.26.0.8.41381: Flags [.], ack 181357, win 24507, options [nop,nop,TS val 180786 ecr 4294926669,nop,nop,sack 1 {182785:184213},mptcp dss ack 2168231342], length 0
17:49:56.169471 IP 112.26.0.8.35499 > 112.26.2.1.targus-getdata1: Flags [.], seq 498373:499801, ack 0, win 4107, options [nop,nop,TS val 4294927167 ecr 180089,mptcp dss ack 2587900740 seq 2168231342 subseq 682585 len 1428 csum 0xbd1e], length 1428
17:49:56.169860 IP 112.26.2.1.targus-getdata1 > 112.26.0.8.35499: Flags [.], ack 499801, win 24441, options [nop,nop,TS val 181075 ecr 4294927167,nop,nop,sack 1 {502657:505513},mptcp dss ack 2168235626], length 0
17:49:56.188752 IP 112.26.1.1.targus-getdata1 > 112.26.0.8.41381: Flags [.], ack 181357, win 24507, options [nop,nop,TS val 180880 ecr 4294926669,nop,nop,sack 1 {182785:185641},mptcp dss ack 2168231342], length 0
17:49:56.199121 IP 112.26.0.8.41381 > 112.26.1.1.targus-getdata1: Flags [.], seq 185641:187069, ack 0, win 4107, options [nop,nop,TS val 4294927259 ecr 179768,mptcp dss ack 2587900740 seq 2168254190 subseq 308449 len 1428 csum 0x4bc2], length 1428
17:49:56.199399 IP 112.26.1.1.targus-getdata1 > 112.26.0.8.41381: Flags [.], ack 181357, win 24476, options [nop,nop,TS val 181104 ecr 4294926669,nop,nop,sack 1 {182785:187069},mptcp dss ack 2168235626], length 0
17:49:56.269467 IP 112.26.0.8.36475 > 112.26.3.1.targus-getdata1: Flags [.], seq 274177:275605, ack 0, win 4107, options [nop,nop,TS val 4294927272 ecr 180469,mptcp dss ack 2587900740 seq 2168257046 subseq 466957 len 1428 csum 0xc3ea], length 1428
17:49:56.269809 IP 112.26.3.1.targus-getdata1 > 112.26.0.8.36475: Flags [.], ack 275605, win 24476, options [nop,nop,TS val 181175 ecr 4294927272,mptcp dss ack 2168235626], length 0
17:49:56.296601 IP 112.26.0.8.41381 > 112.26.1.1.targus-getdata1: Flags [.], seq 187069:188497, ack 0, win 4107, options [nop,nop,TS val 4294927259 ecr 179768,mptcp dss ack 2587900740 seq 2168255618 subseq 309877 len 1428 csum 0x2ca6], length 1428
17:49:56.296920 IP 112.26.1.1.targus-getdata1 > 112.26.0.8.41381: Flags [.], ack 181357, win 24476, options [nop,nop,TS val 181202 ecr 4294926669,nop,nop,sack 1 {182785:188497},mptcp dss ack 2168235626], length 0
17:49:56.304398 IP 112.26.3.1.targus-getdata1 > 112.26.0.8.36475: Flags [.], ack 275605, win 24476, options [nop,nop,TS val 181175 ecr 4294927272,mptcp dss ack 2168235626], length 0
17:49:56.373046 IP 112.26.2.1.targus-getdata1 > 112.26.0.8.35499: Flags [.], ack 499801, win 24441, options [nop,nop,TS val 181075 ecr 4294927167,nop,nop,sack 1 {502657:505513},mptcp dss ack 2168235626], length 0
17:49:56.386823 IP 112.26.1.1.targus-getdata1 > 112.26.0.8.41381: Flags [.], ack 181357, win 24476, options [nop,nop,TS val 181104 ecr 4294926669,nop,nop,sack 1 {182785:187069},mptcp dss ack 2168235626], length 0
17:49:56.403914 IP 112.26.0.8.35499 > 112.26.2.1.targus-getdata1: Flags [.], seq 501229:502657, ack 0, win 4107, options [nop,nop,TS val 4294927355 ecr 180190,mptcp dss ack 2587900740 seq 2168237054 subseq 685441 len 1428 csum 0xba1a], length 1428
17:49:56.404261 IP 112.26.2.1.targus-getdata1 > 112.26.0.8.35499: Flags [.], ack 499801, win 24476, options [nop,nop,TS val 181309 ecr 4294927167,nop,nop,sack 1 {501229:505513},mptcp dss ack 2168235626], length 0
17:49:56.417464 IP 112.26.1.1.targus-getdata1 > 112.26.0.8.41381: Flags [.], ack 181357, win 24476, options [nop,nop,TS val 181202 ecr 4294926669,nop,nop,sack 1 {182785:188497},mptcp dss ack 2168235626], length 0
17:49:56.476384 IP 112.26.0.8.36475 > 112.26.3.1.targus-getdata1: Flags [.], seq 275605:277033, ack 0, win 4107, options [nop,nop,TS val 4294927637 ecr 180787,mptcp dss ack 2587900740 seq 2168259902 subseq 468385 len 1428 csum 0x6743], length 1428
17:49:56.476731 IP 112.26.3.1.targus-getdata1 > 112.26.0.8.36475: Flags [.], ack 277033, win 24476, options [nop,nop,TS val 181381 ecr 4294927637,mptcp dss ack 2168235626], length 0
17:49:56.496012 IP 112.26.3.1.targus-getdata1 > 112.26.0.8.36475: Flags [.], ack 277033, win 24476, options [nop,nop,TS val 181381 ecr 4294927637,mptcp dss ack 2168235626], length 0
17:49:56.513919 IP 112.26.0.8.35499 > 112.26.2.1.targus-getdata1: Flags [.], seq 505513:506941, ack 0, win 4107, options [nop,nop,TS val 4294927637 ecr 180283,mptcp dss ack 2587900740 seq 2168258474 subseq 689725 len 1428 csum 0xa50b], length 1428
17:49:56.514230 IP 112.26.2.1.targus-getdata1 > 112.26.0.8.35499: Flags [.], ack 499801, win 24476, options [nop,nop,TS val 181419 ecr 4294927167,nop,nop,sack 1 {501229:506941},mptcp dss ack 2168235626], length 0
17:49:56.588102 IP 112.26.2.1.targus-getdata1 > 112.26.0.8.35499: Flags [.], ack 499801, win 24476, options [nop,nop,TS val 181309 ecr 4294927167,nop,nop,sack 1 {501229:505513},mptcp dss ack 2168235626], length 0
17:49:56.606745 IP 112.26.2.1.targus-getdata1 > 112.26.0.8.35499: Flags [.], ack 499801, win 24476, options [nop,nop,TS val 181419 ecr 4294927167,nop,nop,sack 1 {501229:506941},mptcp dss ack 2168235626], length 0
17:49:56.689962 IP 112.26.0.8.41381 > 112.26.1.1.targus-getdata1: Flags [.], seq 188497:189925, ack 0, win 4107, options [nop,nop,TS val 4294927845 ecr 180280,mptcp dss ack 2587900740 seq 2168261330 subseq 311305 len 1428 csum 0x4e30], length 1428
17:49:56.690343 IP 112.26.1.1.targus-getdata1 > 112.26.0.8.41381: Flags [.], ack 181357, win 24476, options [nop,nop,TS val 181595 ecr 4294926669,nop,nop,sack 1 {182785:189925},mptcp dss ack 2168235626], length 0
17:49:56.772880 IP 112.26.1.1.targus-getdata1 > 112.26.0.8.41381: Flags [.], ack 181357, win 24476, options [nop,nop,TS val 181595 ecr 4294926669,nop,nop,sack 1 {182785:189925},mptcp dss ack 2168235626], length 0
17:49:56.787932 IP 112.26.0.8.41381 > 112.26.1.1.targus-getdata1: Flags [.], seq 191353:192781, ack 0, win 4107, options [nop,nop,TS val 4294927845 ecr 180280,mptcp dss ack 2587900740 seq 2168264186 subseq 314161 len 1428 csum 0xc64c], length 1428
17:49:56.788314 IP 112.26.1.1.targus-getdata1 > 112.26.0.8.41381: Flags [.], ack 181357, win 24476, options [nop,nop,TS val 181693 ecr 4294926669,nop,nop,sack 2 {191353:192781}{182785:189925},mptcp dss ack 2168235626], length 0
17:49:56.875157 IP 112.26.0.8.36475 > 112.26.3.1.targus-getdata1: Flags [.], seq 277033:278461, ack 0, win 4107, options [nop,nop,TS val 4294927974 ecr 181175,mptcp dss ack 2587900740 seq 2168267042 subseq 469813 len 1428 csum 0xb217], length 1428
17:49:56.875479 IP 112.26.3.1.targus-getdata1 > 112.26.0.8.36475: Flags [.], ack 278461, win 24476, options [nop,nop,TS val 181780 ecr 4294927974,mptcp dss ack 2168235626], length 0
17:49:56.890997 IP 112.26.0.8.41381 > 112.26.1.1.targus-getdata1: Flags [.], seq 192781:194209, ack 0, win 4107, options [nop,nop,TS val 4294927845 ecr 180280,mptcp dss ack 2587900740 seq 2168265614 subseq 315589 len 1428 csum 0x1e37], length 1428
17:49:56.891296 IP 112.26.1.1.targus-getdata1 > 112.26.0.8.41381: Flags [.], ack 181357, win 24476, options [nop,nop,TS val 181796 ecr 4294926669,nop,nop,sack 2 {191353:194209}{182785:189925},mptcp dss ack 2168235626], length 0
17:49:56.904565 IP 112.26.3.1.targus-getdata1 > 112.26.0.8.36475: Flags [.], ack 278461, win 24476, options [nop,nop,TS val 181780 ecr 4294927974,mptcp dss ack 2168235626], length 0
17:49:56.915031 IP 112.26.1.1.targus-getdata1 > 112.26.0.8.41381: Flags [.], ack 181357, win 24476, options [nop,nop,TS val 181693 ecr 4294926669,nop,nop,sack 2 {191353:192781}{182785:189925},mptcp dss ack 2168235626], length 0
17:49:56.992037 IP 112.26.1.1.targus-getdata1 > 112.26.0.8.41381: Flags [.], ack 181357, win 24476, options [nop,nop,TS val 181796 ecr 4294926669,nop,nop,sack 2 {191353:194209}{182785:189925},mptcp dss ack 2168235626], length 0
17:49:57.005498 IP 112.26.0.8.35499 > 112.26.2.1.targus-getdata1: Flags [.], seq 506941:508369, ack 0, win 4107, options [nop,nop,TS val 4294928061 ecr 181075,mptcp dss ack 2587900740 seq 2168269898 subseq 691153 len 1428 csum 0x903a], length 1428
17:49:57.005822 IP 112.26.2.1.targus-getdata1 > 112.26.0.8.35499: Flags [.], ack 499801, win 24476, options [nop,nop,TS val 181911 ecr 4294927167,nop,nop,sack 1 {501229:508369},mptcp dss ack 2168235626], length 0
17:49:57.105680 IP 112.26.2.1.targus-getdata1 > 112.26.0.8.35499: Flags [.], ack 499801, win 24476, options [nop,nop,TS val 181911 ecr 4294927167,nop,nop,sack 1 {501229:508369},mptcp dss ack 2168235626], length 0
17:49:57.111832 IP 112.26.0.8.36475 > 112.26.3.1.targus-getdata1: Flags [.], seq 278461:279889, ack 0, win 4107, options [nop,nop,TS val 4294927974 ecr 181175,mptcp dss ack 2587900740 seq 2168268470 subseq 471241 len 1428 csum 0x27ce], length 1428
17:49:57.112116 IP 112.26.3.1.targus-getdata1 > 112.26.0.8.36475: Flags [.], ack 279889, win 24476, options [nop,nop,TS val 182017 ecr 4294927974,mptcp dss ack 2168235626], length 0
17:49:57.139183 IP 112.26.0.8.41381 > 112.26.1.1.targus-getdata1: Flags [.], seq 194209:195637, ack 0, win 4107, options [nop,nop,TS val 4294928185 ecr 180786,mptcp dss ack 2587900740 seq 2168272754 subseq 317017 len 1428 csum 0xa96a], length 1428
17:49:57.139503 IP 112.26.1.1.targus-getdata1 > 112.26.0.8.41381: Flags [.], ack 181357, win 24476, options [nop,nop,TS val 182044 ecr 4294926669,nop,nop,sack 2 {191353:195637}{182785:189925},mptcp dss ack 2168235626], length 0
17:49:57.201218 IP 112.26.0.8.41381 > 112.26.1.1.targus-getdata1: Flags [.], seq 195637:197065, ack 0, win 4107, options [nop,nop,TS val 4294928185 ecr 180786,mptcp dss ack 2587900740 seq 2168274182 subseq 318445 len 1428 csum 0x8d1a], length 1428
17:49:57.201502 IP 112.26.1.1.targus-getdata1 > 112.26.0.8.41381: Flags [.], ack 181357, win 24476, options [nop,nop,TS val 182106 ecr 4294926669,nop,nop,sack 2 {191353:197065}{182785:189925},mptcp dss ack 2168235626], length 0
17:49:57.215045 IP 112.26.3.1.targus-getdata1 > 112.26.0.8.36475: Flags [.], ack 279889, win 24476, options [nop,nop,TS val 182017 ecr 4294927974,mptcp dss ack 2168235626], length 0
17:49:57.279776 IP 112.26.1.1.targus-getdata1 > 112.26.0.8.41381: Flags [.], ack 181357, win 24476, options [nop,nop,TS val 182044 ecr 4294926669,nop,nop,sack 2 {191353:195637}{182785:189925},mptcp dss ack 2168235626], length 0
17:49:57.297352 IP 112.26.1.1.targus-getdata1 > 112.26.0.8.41381: Flags [.], ack 181357, win 24476, options [nop,nop,TS val 182106 ecr 4294926669,nop,nop,sack 2 {191353:197065}{182785:189925},mptcp dss ack 2168235626], length 0
17:49:57.306515 IP 112.26.0.8.41381 > 112.26.1.1.targus-getdata1: Flags [.], seq 197065:198493, ack 0, win 4107, options [nop,nop,TS val 4294928185 ecr 180786,mptcp dss ack 2587900740 seq 2168275610 subseq 319873 len 1428 csum 0x15a7], length 1428
17:49:57.306840 IP 112.26.1.1.targus-getdata1 > 112.26.0.8.41381: Flags [.], ack 181357, win 24476, options [nop,nop,TS val 182211 ecr 4294926669,nop,nop,sack 2 {191353:198493}{182785:189925},mptcp dss ack 2168235626], length 0
17:49:57.380961 IP 112.26.1.1.targus-getdata1 > 112.26.0.8.41381: Flags [.], ack 181357, win 24476, options [nop,nop,TS val 182211 ecr 4294926669,nop,nop,sack 2 {191353:198493}{182785:189925},mptcp dss ack 2168235626], length 0
17:49:57.397315 IP 112.26.0.8.41381 > 112.26.1.1.targus-getdata1: Flags [.], seq 199921:201349, ack 0, win 4107, options [nop,nop,TS val 4294928185 ecr 180786,mptcp dss ack 2587900740 seq 2168278466 subseq 322729 len 1428 csum 0xc284], length 1428
17:49:57.397641 IP 112.26.1.1.targus-getdata1 > 112.26.0.8.41381: Flags [.], ack 181357, win 24476, options [nop,nop,TS val 182303 ecr 4294926669,nop,nop,sack 2 {199921:201349}{191353:198493},mptcp dss ack 2168235626], length 0
17:49:57.488041 IP 112.26.0.8.41381 > 112.26.1.1.targus-getdata1: Flags [.], seq 201349:202777, ack 0, win 4107, options [nop,nop,TS val 4294928185 ecr 180786,mptcp dss ack 2587900740 seq 2168279894 subseq 324157 len 1428 csum 0x952e], length 1428
17:49:57.488371 IP 112.26.1.1.targus-getdata1 > 112.26.0.8.41381: Flags [.], ack 181357, win 24476, options [nop,nop,TS val 182394 ecr 4294926669,nop,nop,sack 2 {199921:202777}{191353:198493},mptcp dss ack 2168235626], length 0
17:49:57.509381 IP 112.26.1.1.targus-getdata1 > 112.26.0.8.41381: Flags [.], ack 181357, win 24476, options [nop,nop,TS val 182303 ecr 4294926669,nop,nop,sack 2 {199921:201349}{191353:198493},mptcp dss ack 2168235626], length 0
17:49:57.586198 IP 112.26.0.8.41381 > 112.26.1.1.targus-getdata1: Flags [.], seq 202777:204205, ack 0, win 4107, options [nop,nop,TS val 4294928185 ecr 180786,mptcp dss ack 2587900740 seq 2168281322 subseq 325585 len 1428 csum 0x90a6], length 1428
17:49:57.586447 IP 112.26.1.1.targus-getdata1 > 112.26.0.8.41381: Flags [.], ack 181357, win 24476, options [nop,nop,TS val 182492 ecr 4294926669,nop,nop,sack 2 {199921:204205}{191353:198493},mptcp dss ack 2168235626], length 0
17:49:57.599319 IP 112.26.1.1.targus-getdata1 > 112.26.0.8.41381: Flags [.], ack 181357, win 24476, options [nop,nop,TS val 182394 ecr 4294926669,nop,nop,sack 2 {199921:202777}{191353:198493},mptcp dss ack 2168235626], length 0
17:49:57.687079 IP 112.26.0.8.41381 > 112.26.1.1.targus-getdata1: Flags [.], seq 204205:205633, ack 0, win 4107, options [nop,nop,TS val 4294928185 ecr 180786,mptcp dss ack 2587900740 seq 2168282750 subseq 327013 len 1428 csum 0xda33], length 1428
17:49:57.687370 IP 112.26.1.1.targus-getdata1 > 112.26.0.8.41381: Flags [.], ack 181357, win 24476, options [nop,nop,TS val 182592 ecr 4294926669,nop,nop,sack 2 {199921:205633}{191353:198493},mptcp dss ack 2168235626], length 0
17:49:57.704305 IP 112.26.0.8.35499 > 112.26.2.1.targus-getdata1: Flags [.], seq 508369:509797, ack 0, win 4107, options [nop,nop,TS val 4294928347 ecr 181309,mptcp dss ack 2587900740 seq 2168284178 subseq 692581 len 1428 csum 0x4618], length 1428
17:49:57.704652 IP 112.26.2.1.targus-getdata1 > 112.26.0.8.35499: Flags [.], ack 499801, win 24476, options [nop,nop,TS val 182609 ecr 4294927167,nop,nop,sack 1 {501229:509797},mptcp dss ack 2168235626], length 0
17:49:57.791831 IP 112.26.1.1.targus-getdata1 > 112.26.0.8.41381: Flags [.], ack 181357, win 24476, options [nop,nop,TS val 182492 ecr 4294926669,nop,nop,sack 2 {199921:204205}{191353:198493},mptcp dss ack 2168235626], length 0
17:49:57.799108 IP 112.26.0.8.36475 > 112.26.3.1.targus-getdata1: Flags [.], seq 282745:284173, ack 0, win 4107, options [nop,nop,TS val 4294928574 ecr 181780,mptcp dss ack 2587900740 seq 2168288462 subseq 475525 len 1428 csum 0x5363], length 1428
17:49:57.799410 IP 112.26.3.1.targus-getdata1 > 112.26.0.8.36475: Flags [.], ack 279889, win 24476, options [nop,nop,TS val 182704 ecr 4294927974,nop,nop,sack 1 {282745:284173},mptcp dss ack 2168235626], length 0
17:49:57.877738 IP 112.26.3.1.targus-getdata1 > 112.26.0.8.36475: Flags [.], ack 279889, win 24476, options [nop,nop,TS val 182704 ecr 4294927974,nop,nop,sack 1 {282745:284173},mptcp dss ack 2168235626], length 0
17:49:57.890177 IP 112.26.0.8.35499 > 112.26.2.1.targus-getdata1: Flags [.], seq 499801:501229, ack 0, win 4107, options [nop,nop,TS val 4294928347 ecr 181419,mptcp dss ack 2587900740 seq 2168235626 subseq 684013 len 1428 csum 0x2d9b], length 1428
17:49:57.890598 IP 112.26.2.1.targus-getdata1 > 112.26.0.8.35499: Flags [.], ack 509797, win 24298, options [nop,nop,TS val 182795 ecr 4294928347,mptcp dss ack 2168248478], length 0
17:49:57.911558 IP 112.26.1.1.targus-getdata1 > 112.26.0.8.41381: Flags [.], ack 181357, win 24476, options [nop,nop,TS val 182592 ecr 4294926669,nop,nop,sack 2 {199921:205633}{191353:198493},mptcp dss ack 2168235626], length 0
17:49:57.990801 IP 112.26.0.8.41381 > 112.26.1.1.targus-getdata1: Flags [.], seq 205633:207061, ack 0, win 4107, options [nop,nop,TS val 4294928574 ecr 180880,mptcp dss ack 2587900740 seq 2168285606 subseq 328441 len 1428 csum 0x1fa2], length 1428
17:49:57.991089 IP 112.26.1.1.targus-getdata1 > 112.26.0.8.41381: Flags [.], ack 181357, win 24440, options [nop,nop,TS val 182896 ecr 4294926669,nop,nop,sack 2 {199921:207061}{191353:198493},mptcp dss ack 2168248478], length 0
17:49:58.001247 IP 112.26.2.1.targus-getdata1 > 112.26.0.8.35499: Flags [.], ack 499801, win 24476, options [nop,nop,TS val 182609 ecr 4294927167,nop,nop,sack 1 {501229:509797},mptcp dss ack 2168235626], length 0
17:49:58.091011 IP 112.26.2.1.targus-getdata1 > 112.26.0.8.35499: Flags [.], ack 509797, win 24298, options [nop,nop,TS val 182795 ecr 4294928347,mptcp dss ack 2168248478], length 0
17:49:58.097689 IP 112.26.0.8.36475 > 112.26.3.1.targus-getdata1: Flags [.], seq 284173:285601, ack 0, win 4107, options [nop,nop,TS val 4294928884 ecr 182017,mptcp dss ack 2587900740 seq 2168294174 subseq 476953 len 1428 csum 0x9b9], length 1428
17:49:58.098008 IP 112.26.3.1.targus-getdata1 > 112.26.0.8.36475: Flags [.], ack 279889, win 24440, options [nop,nop,TS val 183003 ecr 4294927974,nop,nop,sack 1 {282745:285601},mptcp dss ack 2168248478], length 0
17:49:58.118829 IP 112.26.0.8.35499 > 112.26.2.1.targus-getdata1: Flags [.], seq 509797:511225, ack 0, win 4107, options [nop,nop,TS val 4294928863 ecr 181911,mptcp dss ack 2587900740 seq 2168289890 subseq 694009 len 1428 csum 0xad48], length 1428
17:49:58.119200 IP 112.26.2.1.targus-getdata1 > 112.26.0.8.35499: Flags [.], ack 511225, win 24440, options [nop,nop,TS val 183024 ecr 4294928863,mptcp dss ack 2168248478], length 0
17:49:58.187829 IP 112.26.3.1.targus-getdata1 > 112.26.0.8.36475: Flags [.], ack 279889, win 24440, options [nop,nop,TS val 183003 ecr 4294927974,nop,nop,sack 1 {282745:285601},mptcp dss ack 2168248478], length 0
17:49:58.199848 IP 112.26.0.8.41381 > 112.26.1.1.targus-getdata1: Flags [.], seq 181357:182785, ack 0, win 4107, options [nop,nop,TS val 4294928863 ecr 181595,mptcp dss ack 2587900740 seq 2168248478 subseq 304165 len 1428 csum 0x3772], length 1428
17:49:58.200281 IP 112.26.1.1.targus-getdata1 > 112.26.0.8.41381: Flags [.], ack 189925, win 24334, options [nop,nop,TS val 183105 ecr 4294928863,nop,nop,sack 2 {199921:207061}{191353:198493},mptcp dss ack 2168262758], length 0
17:49:58.224227 IP 112.26.0.8.41381 > 112.26.1.1.targus-getdata1: Flags [.], seq 207061:208489, ack 0, win 4107, options [nop,nop,TS val 4294928884 ecr 181595,mptcp dss ack 2587900740 seq 2168291318 subseq 329869 len 1428 csum 0x5e9c], length 1428
17:49:58.224553 IP 112.26.1.1.targus-getdata1 > 112.26.0.8.41381: Flags [.], ack 189925, win 24491, options [nop,nop,TS val 183129 ecr 4294928863,nop,nop,sack 2 {199921:208489}{191353:198493},mptcp dss ack 2168262758], length 0
17:49:58.301653 IP 112.26.1.1.targus-getdata1 > 112.26.0.8.41381: Flags [.], ack 181357, win 24440, options [nop,nop,TS val 182896 ecr 4294926669,nop,nop,sack 2 {199921:207061}{191353:198493},mptcp dss ack 2168248478], length 0
17:49:58.312020 IP 112.26.2.1.targus-getdata1 > 112.26.0.8.35499: Flags [.], ack 511225, win 24440, options [nop,nop,TS val 183024 ecr 4294928863,mptcp dss ack 2168248478], length 0
17:49:58.386515 IP 112.26.0.8.41381 > 112.26.1.1.targus-getdata1: Flags [.], seq 189925:191353, ack 0, win 4107, options [nop,nop,TS val 4294929450 ecr 182106,mptcp dss ack 2587900740 seq 2168262758 subseq 312733 len 1428 csum 0x818d], length 1428
17:49:58.386879 IP 112.26.1.1.targus-getdata1 > 112.26.0.8.41381: Flags [.], ack 198493, win 24396, options [nop,nop,TS val 183291 ecr 4294929450,nop,nop,sack 1 {199921:208489},mptcp dss ack 2168271326], length 0
17:49:58.395377 IP 112.26.0.8.36475 > 112.26.3.1.targus-getdata1: Flags [.], seq 285601:287029, ack 0, win 4107, options [nop,nop,TS val 4294929670 ecr 182704,mptcp dss ack 2587900740 seq 2168295602 subseq 478381 len 1428 csum 0x26f2], length 1428
17:49:58.395736 IP 112.26.3.1.targus-getdata1 > 112.26.0.8.36475: Flags [.], ack 279889, win 24491, options [nop,nop,TS val 183300 ecr 4294927974,nop,nop,sack 1 {282745:287029},mptcp dss ack 2168271326], length 0
17:49:58.419455 IP 112.26.3.1.targus-getdata1 > 112.26.0.8.36475: Flags [.], ack 279889, win 24491, options [nop,nop,TS val 183300 ecr 4294927974,nop,nop,sack 1 {282745:287029},mptcp dss ack 2168271326], length 0
17:49:58.431652 IP 112.26.1.1.targus-getdata1 > 112.26.0.8.41381: Flags [.], ack 189925, win 24334, options [nop,nop,TS val 183105 ecr 4294928863,nop,nop,sack 2 {199921:207061}{191353:198493},mptcp dss ack 2168262758], length 0
17:49:58.501576 IP 112.26.1.1.targus-getdata1 > 112.26.0.8.41381: Flags [.], ack 189925, win 24491, options [nop,nop,TS val 183129 ecr 4294928863,nop,nop,sack 2 {199921:208489}{191353:198493},mptcp dss ack 2168262758], length 0
17:49:58.516749 IP 112.26.1.1.targus-getdata1 > 112.26.0.8.41381: Flags [.], ack 198493, win 24396, options [nop,nop,TS val 183291 ecr 4294929450,nop,nop,sack 1 {199921:208489},mptcp dss ack 2168271326], length 0
17:49:58.606505 IP 112.26.0.8.35499 > 112.26.2.1.targus-getdata1: Flags [.], seq 511225:512653, ack 0, win 4107, options [nop,nop,TS val 4294929676 ecr 182609,mptcp dss ack 2587900740 seq 2168297030 subseq 695437 len 1428 csum 0xe466], length 1428
17:49:58.606752 IP 112.26.2.1.targus-getdata1 > 112.26.0.8.35499: Flags [.], ack 512653, win 24491, options [nop,nop,TS val 183512 ecr 4294929676,mptcp dss ack 2168271326], length 0
17:49:58.694205 IP 112.26.0.8.41381 > 112.26.1.1.targus-getdata1: Flags [.], seq 198493:199921, ack 0, win 4107, options [nop,nop,TS val 4294929676 ecr 182303,mptcp dss ack 2587900740 seq 2168277038 subseq 321301 len 1428 csum 0xafcc], length 1428
17:49:58.694507 IP 112.26.1.1.targus-getdata1 > 112.26.0.8.41381: Flags [.], ack 208489, win 24491, options [nop,nop,TS val 183599 ecr 4294929676,mptcp dss ack 2168271326], length 0
17:49:58.708948 IP 112.26.0.8.41381 > 112.26.1.1.targus-getdata1: Flags [.], seq 209917:211345, ack 0, win 4107, options [nop,nop,TS val 4294929774 ecr 182303,mptcp dss ack 2587900740 seq 2168298458 subseq 332725 len 1428 csum 0x1c7b], length 1428
17:49:58.709264 IP 112.26.1.1.targus-getdata1 > 112.26.0.8.41381: Flags [.], ack 208489, win 24491, options [nop,nop,TS val 183614 ecr 4294929676,nop,nop,sack 1 {209917:211345},mptcp dss ack 2168271326], length 0
17:49:58.797432 IP 112.26.2.1.targus-getdata1 > 112.26.0.8.35499: Flags [.], ack 512653, win 24491, options [nop,nop,TS val 183512 ecr 4294929676,mptcp dss ack 2168271326], length 0
17:49:58.809453 IP 112.26.0.8.35499 > 112.26.2.1.targus-getdata1: Flags [.], seq 512653:514081, ack 0, win 4107, options [nop,nop,TS val 4294929774 ecr 182795,mptcp dss ack 2587900740 seq 2168299886 subseq 696865 len 1428 csum 0x202a], length 1428
17:49:58.809763 IP 112.26.2.1.targus-getdata1 > 112.26.0.8.35499: Flags [.], ack 514081, win 24491, options [nop,nop,TS val 183715 ecr 4294929774,mptcp dss ack 2168271326], length 0
17:49:58.891706 IP 112.26.1.1.targus-getdata1 > 112.26.0.8.41381: Flags [.], ack 208489, win 24491, options [nop,nop,TS val 183599 ecr 4294929676,mptcp dss ack 2168271326], length 0
17:49:58.906978 IP 112.26.0.8.35499 > 112.26.2.1.targus-getdata1: Flags [.], seq 514081:515509, ack 0, win 4107, options [nop,nop,TS val 4294929774 ecr 182795,mptcp dss ack 2587900740 seq 2168301314 subseq 698293 len 1428 csum 0xd82e], length 1428
17:49:58.907326 IP 112.26.2.1.targus-getdata1 > 112.26.0.8.35499: Flags [.], ack 515509, win 24491, options [nop,nop,TS val 183812 ecr 4294929774,mptcp dss ack 2168271326], length 0
17:49:58.992768 IP 112.26.1.1.targus-getdata1 > 112.26.0.8.41381: Flags [.], ack 208489, win 24491, options [nop,nop,TS val 183614 ecr 4294929676,nop,nop,sack 1 {209917:211345},mptcp dss ack 2168271326], length 0
17:49:59.012042 IP 112.26.2.1.targus-getdata1 > 112.26.0.8.35499: Flags [.], ack 514081, win 24491, options [nop,nop,TS val 183715 ecr 4294929774,mptcp dss ack 2168271326], length 0
17:49:59.098769 IP 112.26.0.8.41381 > 112.26.1.1.targus-getdata1: Flags [.], seq 211345:212773, ack 0, win 4107, options [nop,nop,TS val 4294929976 ecr 182492,mptcp dss ack 2587900740 seq 2168302742 subseq 334153 len 1428 csum 0x8858], length 1428
17:49:59.099009 IP 112.26.1.1.targus-getdata1 > 112.26.0.8.41381: Flags [.], ack 208489, win 24491, options [nop,nop,TS val 184004 ecr 4294929676,nop,nop,sack 1 {209917:212773},mptcp dss ack 2168271326], length 0
17:49:59.121884 IP 112.26.0.8.41381 > 112.26.1.1.targus-getdata1: Flags [.], seq 212773:214201, ack 0, win 4107, options [nop,nop,TS val 4294929976 ecr 182492,mptcp dss ack 2587900740 seq 2168304170 subseq 335581 len 1428 csum 0x1a3e], length 1428
17:49:59.122240 IP 112.26.1.1.targus-getdata1 > 112.26.0.8.41381: Flags [.], ack 208489, win 24491, options [nop,nop,TS val 184027 ecr 4294929676,nop,nop,sack 1 {209917:214201},mptcp dss ack 2168271326], length 0
17:49:59.200061 IP 112.26.2.1.targus-getdata1 > 112.26.0.8.35499: Flags [.], ack 515509, win 24491, options [nop,nop,TS val 183812 ecr 4294929774,mptcp dss ack 2168271326], length 0
17:49:59.213598 IP 112.26.0.8.41381 > 112.26.1.1.targus-getdata1: Flags [.], seq 215629:217057, ack 0, win 4107, options [nop,nop,TS val 4294930467 ecr 182896,mptcp dss ack 2587900740 seq 2168308454 subseq 338437 len 1428 csum 0x6cf4], length 1428
17:49:59.213882 IP 112.26.1.1.targus-getdata1 > 112.26.0.8.41381: Flags [.], ack 208489, win 24491, options [nop,nop,TS val 184119 ecr 4294929676,nop,nop,sack 2 {215629:217057}{209917:214201},mptcp dss ack 2168271326], length 0
17:49:59.290797 IP 112.26.1.1.targus-getdata1 > 112.26.0.8.41381: Flags [.], ack 208489, win 24491, options [nop,nop,TS val 184004 ecr 4294929676,nop,nop,sack 1 {209917:212773},mptcp dss ack 2168271326], length 0
17:49:59.307331 IP 112.26.0.8.35499 > 112.26.2.1.targus-getdata1: Flags [.], seq 516937:518365, ack 0, win 4107, options [nop,nop,TS val 4294930467 ecr 183512,mptcp dss ack 2587900740 seq 2168309882 subseq 701149 len 1428 csum 0x86f0], length 1428
17:49:59.307663 IP 112.26.2.1.targus-getdata1 > 112.26.0.8.35499: Flags [.], ack 515509, win 24491, options [nop,nop,TS val 184212 ecr 4294929774,nop,nop,sack 1 {516937:518365},mptcp dss ack 2168271326], length 0
17:49:59.319975 IP 112.26.1.1.targus-getdata1 > 112.26.0.8.41381: Flags [.], ack 208489, win 24491, options [nop,nop,TS val 184027 ecr 4294929676,nop,nop,sack 1 {209917:214201},mptcp dss ack 2168271326], length 0
17:49:59.393442 IP 112.26.1.1.targus-getdata1 > 112.26.0.8.41381: Flags [.], ack 208489, win 24491, options [nop,nop,TS val 184119 ecr 4294929676,nop,nop,sack 2 {215629:217057}{209917:214201},mptcp dss ack 2168271326], length 0
17:49:59.408931 IP 112.26.2.1.targus-getdata1 > 112.26.0.8.35499: Flags [.], ack 515509, win 24491, options [nop,nop,TS val 184212 ecr 4294929774,nop,nop,sack 1 {516937:518365},mptcp dss ack 2168271326], length 0
17:49:59.496896 IP 112.26.0.8.41381 > 112.26.1.1.targus-getdata1: Flags [.], seq 217057:218485, ack 0, win 4107, options [nop,nop,TS val 4294930666 ecr 183129,mptcp dss ack 2587900740 seq 2168311310 subseq 339865 len 1428 csum 0x3f30], length 1428
17:49:59.497252 IP 112.26.1.1.targus-getdata1 > 112.26.0.8.41381: Flags [.], ack 208489, win 24491, options [nop,nop,TS val 184402 ecr 4294929676,nop,nop,sack 2 {215629:218485}{209917:214201},mptcp dss ack 2168271326], length 0
17:49:59.589488 IP 112.26.0.8.41381 > 112.26.1.1.targus-getdata1: Flags [.], seq 218485:219913, ack 0, win 4107, options [nop,nop,TS val 4294930666 ecr 183129,mptcp dss ack 2587900740 seq 2168312738 subseq 341293 len 1428 csum 0xda95], length 1428
17:49:59.589784 IP 112.26.1.1.targus-getdata1 > 112.26.0.8.41381: Flags [.], ack 208489, win 24491, options [nop,nop,TS val 184495 ecr 4294929676,nop,nop,sack 2 {215629:219913}{209917:214201},mptcp dss ack 2168271326], length 0
17:49:59.604170 IP 112.26.0.8.41381 > 112.26.1.1.targus-getdata1: Flags [.], seq 219913:221341, ack 0, win 4107, options [nop,nop,TS val 4294930666 ecr 183129,mptcp dss ack 2587900740 seq 2168314166 subseq 342721 len 1428 csum 0x1a9a], length 1428
17:49:59.604516 IP 112.26.1.1.targus-getdata1 > 112.26.0.8.41381: Flags [.], ack 208489, win 24491, options [nop,nop,TS val 184509 ecr 4294929676,nop,nop,sack 2 {215629:221341}{209917:214201},mptcp dss ack 2168271326], length 0
17:49:59.690617 IP 112.26.1.1.targus-getdata1 > 112.26.0.8.41381: Flags [.], ack 208489, win 24491, options [nop,nop,TS val 184402 ecr 4294929676,nop,nop,sack 2 {215629:218485}{209917:214201},mptcp dss ack 2168271326], length 0
17:49:59.701995 IP 112.26.0.8.41381 > 112.26.1.1.targus-getdata1: Flags [.], seq 208489:209917, ack 0, win 4107, options [nop,nop,TS val 4294930676 ecr 183291,mptcp dss ack 2587900740 seq 2168292746 subseq 331297 len 1428 csum 0xb09b], length 1428
17:49:59.702400 IP 112.26.1.1.targus-getdata1 > 112.26.0.8.41381: Flags [.], ack 214201, win 24491, options [nop,nop,TS val 184607 ecr 4294930676,nop,nop,sack 1 {215629:221341},mptcp dss ack 2168271326], length 0
17:49:59.797844 IP 112.26.0.8.41381 > 112.26.1.1.targus-getdata1: Flags [.], seq 221341:222769, ack 0, win 4107, options [nop,nop,TS val 4294930676 ecr 183291,mptcp dss ack 2587900740 seq 2168315594 subseq 344149 len 1428 csum 0xa839], length 1428
17:49:59.798212 IP 112.26.1.1.targus-getdata1 > 112.26.0.8.41381: Flags [.], ack 214201, win 24491, options [nop,nop,TS val 184703 ecr 4294930676,nop,nop,sack 1 {215629:222769},mptcp dss ack 2168271326], length 0
17:49:59.812805 IP 112.26.1.1.targus-getdata1 > 112.26.0.8.41381: Flags [.], ack 208489, win 24491, options [nop,nop,TS val 184495 ecr 4294929676,nop,nop,sack 2 {215629:219913}{209917:214201},mptcp dss ack 2168271326], length 0
17:49:59.892460 IP 112.26.0.8.35499 > 112.26.2.1.targus-getdata1: Flags [.], seq 518365:519793, ack 0, win 4107, options [nop,nop,TS val 4294930681 ecr 183715,mptcp dss ack 2587900740 seq 2168317022 subseq 702577 len 1428 csum 0xca93], length 1428
17:49:59.892756 IP 112.26.2.1.targus-getdata1 > 112.26.0.8.35499: Flags [.], ack 515509, win 24491, options [nop,nop,TS val 184798 ecr 4294929774,nop,nop,sack 1 {516937:519793},mptcp dss ack 2168271326], length 0
17:49:59.911696 IP 112.26.1.1.targus-getdata1 > 112.26.0.8.41381: Flags [.], ack 208489, win 24491, options [nop,nop,TS val 184509 ecr 4294929676,nop,nop,sack 2 {215629:221341}{209917:214201},mptcp dss ack 2168271326], length 0
17:49:59.922466 IP 112.26.0.8.35499 > 112.26.2.1.targus-getdata1: Flags [.], seq 519793:521221, ack 0, win 4107, options [nop,nop,TS val 4294930681 ecr 183715,mptcp dss ack 2587900740 seq 2168318450 subseq 704005 len 1428 csum 0xfd02], length 1428
