20:04:46.294816 IP 112.26.0.8.51812 > 112.26.0.1.targus-getdata1: Flags [S], seq 1078112111, win 65535, options [mss 1460,sackOK,TS val 779685 ecr 0,nop,wscale 6,mptcp capable csum {0x50e7d41c1e586b4d}], length 0
20:04:47.425595 IP 112.26.0.8.51812 > 112.26.0.1.targus-getdata1: Flags [S], seq 1078112111, win 65535, options [mss 1460,sackOK,TS val 780736 ecr 0,nop,wscale 6,mptcp capable csum {0x50e7d41c1e586b4d}], length 0
20:04:49.451724 IP 112.26.0.8.51812 > 112.26.0.1.targus-getdata1: Flags [S], seq 1078112111, win 65535, options [mss 1460,sackOK,TS val 782784 ecr 0,nop,wscale 6,mptcp capable csum {0x50e7d41c1e586b4d}], length 0
20:04:49.452002 IP 112.26.0.1.targus-getdata1 > 112.26.0.8.51812: Flags [S.], seq 2251882633, ack 1078112112, win 65535, options [mss 1460,sackOK,TS val 1012301 ecr 782784,nop,wscale 6,mptcp capable csum {0xd98e4f6179ca72a7}], length 0
20:04:49.532702 IP 112.26.0.1.targus-getdata1 > 112.26.0.8.51812: Flags [S.], seq 2251882633, ack 1078112112, win 65535, options [mss 1460,sackOK,TS val 1012301 ecr 782784,nop,wscale 6,mptcp capable csum {0xd98e4f6179ca72a7}], length 0
20:04:49.616354 IP 112.26.0.8.51812 > 112.26.0.1.targus-getdata1: Flags [.], ack 1, win 1369, options [nop,nop,TS val 782953 ecr 1012301,mptcp capable csum {0x50e7d41c1e586b4d,0xd98e4f6179ca72a7},mptcp dss ack 346306051], length 0
20:04:49.617062 IP 112.26.0.1.targus-getdata1 > 112.26.0.8.51812: Flags [.], ack 1, win 1339, options [nop,nop,TS val 1012466 ecr 782953,mptcp add-addr id 3 112.26.1.1,mptcp dss ack 3165865826], length 0
20:05:32.895075 IP 112.26.0.1.targus-getdata1 > 112.26.0.8.51814: Flags [.], ack 3354355653, win 24048, options [nop,nop,TS val 1055704 ecr 822493,nop,nop,sack 2 {39985:41413}{31417:38557},mptcp dss ack 1002318706], length 0
20:05:32.992310 IP 112.26.0.8.51814 > 112.26.0.1.targus-getdata1: Flags [.], seq 41413:42841, ack 0, win 4107, options [nop,nop,TS val 824777 ecr 1053625,mptcp dss ack 2724680102 seq 1002434374 subseq 479846 len 1428 csum 0xcab7], length 1428
20:05:32.992717 IP 112.26.0.1.targus-getdata1 > 112.26.0.8.51814: Flags [.], ack 1, win 24048, options [nop,nop,TS val 1055841 ecr 822493,nop,nop,sack 2 {39985:42841}{31417:38557},mptcp dss ack 1002318706], length 0
20:05:33.007012 IP 112.26.0.1.targus-getdata1 > 112.26.0.8.51814: Flags [.], ack 1, win 24048, options [nop,nop,TS val 1055841 ecr 822493,nop,nop,sack 2 {39985:42841}{31417:38557},mptcp dss ack 1002318706], length 0
20:05:33.117325 IP 112.26.0.8.51814 > 112.26.0.1.targus-getdata1: Flags [.], seq 1:1429, ack 0, win 4107, options [nop,nop,TS val 824828 ecr 1053739,mptcp dss ack 2724680102 seq 1002318706 subseq 438434 len 1428 csum 0x173b], length 1428
20:05:33.117721 IP 112.26.0.1.targus-getdata1 > 112.26.0.8.51814: Flags [.], ack 5713, win 23781, options [nop,nop,TS val 1055966 ecr 824828,nop,nop,sack 2 {39985:42841}{31417:38557},mptcp dss ack 1002335842], length 0
20:05:57.785457 IP 112.26.0.8.51814 > 112.26.0.1.targus-getdata1: Flags [.], seq 299881:301309, ack 0, win 4107, options [nop,nop,TS val 850554 ecr 1079971,mptcp dss ack 2724680102 seq 1003408270 subseq 738314 len 1428 csum 0x4674], length 1428
20:05:57.785794 IP 112.26.0.1.targus-getdata1 > 112.26.0.8.51814: Flags [.], ack 325585, win 23756, options [nop,nop,TS val 1080635 ecr 850554,mptcp dss ack 1003461106], length 0
20:05:57.817082 IP 112.26.0.1.targus-getdata1 > 112.26.0.8.51814: Flags [.], ack 325585, win 23756, options [nop,nop,TS val 1080635 ecr 850554,mptcp dss ack 1003461106], length 0
20:05:57.953316 IP 112.26.0.8.51814 > 112.26.0.1.targus-getdata1: Flags [.], seq 325585:327013, ack 0, win 4107, options [nop,nop,TS val 850786 ecr 1080104,mptcp dss ack 2724680102 seq 1003505374 subseq 764018 len 1428 csum 0xfa6a], length 1428
20:05:57.953616 IP 112.26.0.1.targus-getdata1 > 112.26.0.8.51814: Flags [.], ack 327013, win 24321, options [nop,nop,TS val 1080802 ecr 850786,mptcp dss ack 1003461106], length 0
20:05:57.962685 IP 112.26.0.1.targus-getdata1 > 112.26.0.8.51814: Flags [.], ack 327013, win 24321, options [nop,nop,TS val 1080802 ecr 850786,mptcp dss ack 1003461106], length 0
20:05:58.077787 IP 112.26.0.8.51814 > 112.26.0.1.targus-getdata1: Flags [.], seq 327013:328441, ack 0, win 4107, options [nop,nop,TS val 850899 ecr 1080187,mptcp dss ack 2724680102 seq 1003511086 subseq 765446 len 1428 csum 0x313f], length 1428
20:05:58.078118 IP 112.26.0.1.targus-getdata1 > 112.26.0.8.51814: Flags [.], ack 328441, win 24321, options [nop,nop,TS val 1080927 ecr 850899,mptcp dss ack 1003461106], length 0
20:05:58.084362 IP 112.26.0.1.targus-getdata1 > 112.26.0.8.51814: Flags [.], ack 328441, win 24321, options [nop,nop,TS val 1080927 ecr 850899,mptcp dss ack 1003461106], length 0
20:05:58.205434 IP 112.26.0.8.51814 > 112.26.0.1.targus-getdata1: Flags [.], seq 328441:329869, ack 0, win 4107, options [nop,nop,TS val 851047 ecr 1080301,mptcp dss ack 2724680102 seq 1003516798 subseq 766874 len 1428 csum 0xbce6], length 1428
20:05:58.205723 IP 112.26.0.1.targus-getdata1 > 112.26.0.8.51814: Flags [.], ack 329869, win 24321, options [nop,nop,TS val 1081054 ecr 851047,mptcp dss ack 1003461106], length 0
20:05:58.245944 IP 112.26.0.1.targus-getdata1 > 112.26.0.8.51814: Flags [.], ack 329869, win 24321, options [nop,nop,TS val 1081054 ecr 851047,mptcp dss ack 1003461106], length 0
20:05:58.305744 IP 112.26.0.8.51814 > 112.26.0.1.targus-getdata1: Flags [.], seq 329869:331297, ack 0, win 4107, options [nop,nop,TS val 851144 ecr 1080393,mptcp dss ack 2724680102 seq 1003522510 subseq 768302 len 1428 csum 0x8c72], length 1428
20:05:58.306083 IP 112.26.0.1.targus-getdata1 > 112.26.0.8.51814: Flags [.], ack 331297, win 24321, options [nop,nop,TS val 1081155 ecr 851144,mptcp dss ack 1003461106], length 0
20:05:58.337681 IP 112.26.0.1.targus-getdata1 > 112.26.0.8.51814: Flags [.], ack 331297, win 24321, options [nop,nop,TS val 1081155 ecr 851144,mptcp dss ack 1003461106], length 0
20:05:58.425667 IP 112.26.0.8.51814 > 112.26.0.1.targus-getdata1: Flags [.], seq 331297:332725, ack 0, win 4107, options [nop,nop,TS val 851238 ecr 1080524,mptcp dss ack 2724680102 seq 1003525366 subseq 769730 len 1428 csum 0xd53b], length 1428
20:05:58.425965 IP 112.26.0.1.targus-getdata1 > 112.26.0.8.51814: Flags [.], ack 332725, win 24321, options [nop,nop,TS val 1081274 ecr 851238,mptcp dss ack 1003461106], length 0
20:05:58.439425 IP 112.26.0.1.targus-getdata1 > 112.26.0.8.51814: Flags [.], ack 332725, win 24321, options [nop,nop,TS val 1081274 ecr 851238,mptcp dss ack 1003461106], length 0
20:05:58.545811 IP 112.26.0.8.51814 > 112.26.0.1.targus-getdata1: Flags [.], seq 332725:334153, ack 0, win 4107, options [nop,nop,TS val 851304 ecr 1080635,mptcp dss ack 2724680102 seq 1003529650 subseq 771158 len 1428 csum 0x5b4a], length 1428
20:05:58.546170 IP 112.26.0.1.targus-getdata1 > 112.26.0.8.51814: Flags [.], ack 334153, win 24321, options [nop,nop,TS val 1081394 ecr 851304,mptcp dss ack 1003461106], length 0
20:05:58.568086 IP 112.26.0.1.targus-getdata1 > 112.26.0.8.51814: Flags [.], ack 334153, win 24321, options [nop,nop,TS val 1081394 ecr 851304,mptcp dss ack 1003461106], length 0
20:05:58.659952 IP 112.26.0.8.51814 > 112.26.0.1.targus-getdata1: Flags [.], seq 334153:335581, ack 0, win 4107, options [nop,nop,TS val 851304 ecr 1080635,mptcp dss ack 2724680102 seq 1003531078 subseq 772586 len 1428 csum 0x69b2], length 1428
20:05:58.660348 IP 112.26.0.1.targus-getdata1 > 112.26.0.8.51814: Flags [.], ack 335581, win 24165, options [nop,nop,TS val 1081509 ecr 851304,mptcp dss ack 1003471102], length 0
20:05:58.664057 IP 112.26.0.1.targus-getdata1 > 112.26.0.8.51814: Flags [.], ack 335581, win 24165, options [nop,nop,TS val 1081509 ecr 851304,mptcp dss ack 1003471102], length 0
20:05:58.801908 IP 112.26.0.8.51814 > 112.26.0.1.targus-getdata1: Flags [.], seq 335581:337009, ack 0, win 4107, options [nop,nop,TS val 851304 ecr 1080635,mptcp dss ack 2724680102 seq 1003532506 subseq 774014 len 1428 csum 0xf754], length 1428
20:05:58.802247 IP 112.26.0.1.targus-getdata1 > 112.26.0.8.51814: Flags [.], ack 337009, win 24165, options [nop,nop,TS val 1081651 ecr 851304,mptcp dss ack 1003471102], length 0
20:05:58.805465 IP 112.26.0.1.targus-getdata1 > 112.26.0.8.51814: Flags [.], ack 337009, win 24165, options [nop,nop,TS val 1081651 ecr 851304,mptcp dss ack 1003471102], length 0
20:05:58.921850 IP 112.26.0.8.51814 > 112.26.0.1.targus-getdata1: Flags [.], seq 337009:338437, ack 0, win 4107, options [nop,nop,TS val 851392 ecr 1080802,mptcp dss ack 2724680102 seq 1003539646 subseq 775442 len 1428 csum 0x2fca], length 1428
20:05:58.922220 IP 112.26.0.1.targus-getdata1 > 112.26.0.8.51814: Flags [.], ack 338437, win 24165, options [nop,nop,TS val 1081771 ecr 851392,mptcp dss ack 1003471102], length 0
20:05:58.924281 IP 112.26.0.1.targus-getdata1 > 112.26.0.8.51814: Flags [.], ack 338437, win 24165, options [nop,nop,TS val 1081771 ecr 851392,mptcp dss ack 1003471102], length 0
20:05:59.032562 IP 112.26.0.8.51814 > 112.26.0.1.targus-getdata1: Flags [.], seq 338437:339865, ack 0, win 4107, options [nop,nop,TS val 851526 ecr 1080927,mptcp dss ack 2724680102 seq 1003542502 subseq 776870 len 1428 csum 0xd16b], length 1428
20:05:59.032863 IP 112.26.0.1.targus-getdata1 > 112.26.0.8.51814: Flags [.], ack 339865, win 24165, options [nop,nop,TS val 1081881 ecr 851526,mptcp dss ack 1003471102], length 0
20:05:59.037243 IP 112.26.0.1.targus-getdata1 > 112.26.0.8.51814: Flags [.], ack 339865, win 24165, options [nop,nop,TS val 1081881 ecr 851526,mptcp dss ack 1003471102], length 0
20:05:59.222793 IP 112.26.0.8.51814 > 112.26.0.1.targus-getdata1: Flags [.], seq 339865:341293, ack 0, win 4107, options [nop,nop,TS val 851526 ecr 1080927,mptcp dss ack 2724680102 seq 1003543930 subseq 778298 len 1428 csum 0x2dac], length 1428
20:05:59.223107 IP 112.26.0.1.targus-getdata1 > 112.26.0.8.51814: Flags [.], ack 341293, win 24165, options [nop,nop,TS val 1082072 ecr 851526,mptcp dss ack 1003471102], length 0
20:05:59.234492 IP 112.26.0.1.targus-getdata1 > 112.26.0.8.51814: Flags [.], ack 341293, win 24165, options [nop,nop,TS val 1082072 ecr 851526,mptcp dss ack 1003471102], length 0
20:05:59.330329 IP 112.26.0.8.51814 > 112.26.0.1.targus-getdata1: Flags [.], seq 341293:342721, ack 0, win 4107, options [nop,nop,TS val 851665 ecr 1081054,mptcp dss ack 2724680102 seq 1003548214 subseq 779726 len 1428 csum 0xec3], length 1428
20:05:59.330667 IP 112.26.0.1.targus-getdata1 > 112.26.0.8.51814: Flags [.], ack 342721, win 23965, options [nop,nop,TS val 1082180 ecr 851665,mptcp dss ack 1003483954], length 0
20:05:59.333425 IP 112.26.0.1.targus-getdata1 > 112.26.0.8.51814: Flags [.], ack 342721, win 23965, options [nop,nop,TS val 1082180 ecr 851665,mptcp dss ack 1003483954], length 0
20:05:59.421675 IP 112.26.0.8.51814 > 112.26.0.1.targus-getdata1: Flags [.], seq 342721:344149, ack 0, win 4107, options [nop,nop,TS val 851804 ecr 1081155,mptcp dss ack 2724680102 seq 1003552498 subseq 781154 len 1428 csum 0x93f8], length 1428
20:05:59.422003 IP 112.26.0.1.targus-getdata1 > 112.26.0.8.51814: Flags [.], ack 344149, win 23965, options [nop,nop,TS val 1082271 ecr 851804,mptcp dss ack 1003483954], length 0
20:05:59.483904 IP 112.26.0.1.targus-getdata1 > 112.26.0.8.51814: Flags [.], ack 344149, win 23965, options [nop,nop,TS val 1082271 ecr 851804,mptcp dss ack 1003483954], length 0
20:05:59.534409 IP 112.26.0.8.51814 > 112.26.0.1.targus-getdata1: Flags [.], seq 344149:345577, ack 0, win 4107, options [nop,nop,TS val 851930 ecr 1081274,mptcp dss ack 2724680102 seq 1003559638 subseq 782582 len 1428 csum 0x6e17], length 1428
20:05:59.534734 IP 112.26.0.1.targus-getdata1 > 112.26.0.8.51814: Flags [.], ack 345577, win 24005, options [nop,nop,TS val 1082384 ecr 851930,mptcp dss ack 1003509658], length 0
20:05:59.593166 IP 112.26.0.8.51814 > 112.26.0.1.targus-getdata1: Flags [.], seq 347005:348433, ack 0, win 4107, options [nop,nop,TS val 852057 ecr 1081394,mptcp dss ack 2724680102 seq 1003562494 subseq 785438 len 1428 csum 0xd750], length 1428
20:05:59.593468 IP 112.26.0.1.targus-getdata1 > 112.26.0.8.51814: Flags [.], ack 345577, win 24005, options [nop,nop,TS val 1082442 ecr 851930,nop,nop,sack 1 {347005:348433},mptcp dss ack 1003509658], length 0
20:05:59.636555 IP 112.26.0.1.targus-getdata1 > 112.26.0.8.51814: Flags [.], ack 345577, win 24005, options [nop,nop,TS val 1082384 ecr 851930,mptcp dss ack 1003509658], length 0
20:05:59.707065 IP 112.26.0.1.targus-getdata1 > 112.26.0.8.51814: Flags [.], ack 345577, win 24005, options [nop,nop,TS val 1082442 ecr 851930,nop,nop,sack 1 {347005:348433},mptcp dss ack 1003509658], length 0
20:05:59.714240 IP 112.26.0.8.51814 > 112.26.0.1.targus-getdata1: Flags [.], seq 348433:349861, ack 0, win 4107, options [nop,nop,TS val 852152 ecr 1081509,mptcp dss ack 2724680102 seq 1003565350 subseq 786866 len 1428 csum 0x5314], length 1428
20:05:59.714579 IP 112.26.0.1.targus-getdata1 > 112.26.0.8.51814: Flags [.], ack 345577, win 24005, options [nop,nop,TS val 1082563 ecr 851930,nop,nop,sack 1 {347005:349861},mptcp dss ack 1003509658], length 0
20:05:59.800062 IP 112.26.0.1.targus-getdata1 > 112.26.0.8.51814: Flags [.], ack 345577, win 24005, options [nop,nop,TS val 1082563 ecr 851930,nop,nop,sack 1 {347005:349861},mptcp dss ack 1003509658], length 0
20:05:59.819947 IP 112.26.0.8.51814 > 112.26.0.1.targus-getdata1: Flags [.], seq 349861:351289, ack 0, win 4107, options [nop,nop,TS val 852247 ecr 1081651,mptcp dss ack 2724680102 seq 1003571062 subseq 788294 len 1428 csum 0x1071], length 1428
20:05:59.820289 IP 112.26.0.1.targus-getdata1 > 112.26.0.8.51814: Flags [.], ack 345577, win 24087, options [nop,nop,TS val 1082669 ecr 851930,nop,nop,sack 1 {347005:351289},mptcp dss ack 1003526794], length 0
20:05:59.870340 IP 112.26.0.1.targus-getdata1 > 112.26.0.8.51814: Flags [.], ack 345577, win 24087, options [nop,nop,TS val 1082669 ecr 851930,nop,nop,sack 1 {347005:351289},mptcp dss ack 1003526794], length 0
20:05:59.958674 IP 112.26.0.8.51814 > 112.26.0.1.targus-getdata1: Flags [.], seq 352717:354145, ack 0, win 4107, options [nop,nop,TS val 852406 ecr 1081771,mptcp dss ack 2724680102 seq 1003576774 subseq 791150 len 1428 csum 0xa090], length 1428
20:05:59.959000 IP 112.26.0.1.targus-getdata1 > 112.26.0.8.51814: Flags [.], ack 345577, win 24087, options [nop,nop,TS val 1082808 ecr 851930,nop,nop,sack 2 {352717:354145}{347005:351289},mptcp dss ack 1003526794], length 0
20:05:59.979087 IP 112.26.0.1.targus-getdata1 > 112.26.0.8.51814: Flags [.], ack 345577, win 24087, options [nop,nop,TS val 1082808 ecr 851930,nop,nop,sack 2 {352717:354145}{347005:351289},mptcp dss ack 1003526794], length 0
20:06:00.090411 IP 112.26.0.8.51814 > 112.26.0.1.targus-getdata1: Flags [.], seq 354145:355573, ack 0, win 4107, options [nop,nop,TS val 852509 ecr 1081881,mptcp dss ack 2724680102 seq 1003578202 subseq 792578 len 1428 csum 0x334a], length 1428
20:06:00.090767 IP 112.26.0.1.targus-getdata1 > 112.26.0.8.51814: Flags [.], ack 345577, win 24087, options [nop,nop,TS val 1082940 ecr 851930,nop,nop,sack 2 {352717:355573}{347005:351289},mptcp dss ack 1003526794], length 0
20:06:00.094278 IP 112.26.0.1.targus-getdata1 > 112.26.0.8.51814: Flags [.], ack 345577, win 24087, options [nop,nop,TS val 1082940 ecr 851930,nop,nop,sack 2 {352717:355573}{347005:351289},mptcp dss ack 1003526794], length 0
20:06:00.185223 IP 112.26.0.8.51814 > 112.26.0.1.targus-getdata1: Flags [.], seq 355573:357001, ack 0, win 4107, options [nop,nop,TS val 852659 ecr 1082072,mptcp dss ack 2724680102 seq 1003582486 subseq 794006 len 1428 csum 0xb899], length 1428
20:06:00.185541 IP 112.26.0.1.targus-getdata1 > 112.26.0.8.51814: Flags [.], ack 345577, win 24090, options [nop,nop,TS val 1083034 ecr 851930,nop,nop,sack 2 {352717:357001}{347005:351289},mptcp dss ack 1003533934], length 0
20:06:00.229120 IP 112.26.0.1.targus-getdata1 > 112.26.0.8.51814: Flags [.], ack 345577, win 24090, options [nop,nop,TS val 1083034 ecr 851930,nop,nop,sack 2 {352717:357001}{347005:351289},mptcp dss ack 1003533934], length 0
20:06:00.272834 IP 112.26.0.8.51814 > 112.26.0.1.targus-getdata1: Flags [.], seq 357001:358429, ack 0, win 4107, options [nop,nop,TS val 852765 ecr 1082180,mptcp dss ack 2724680102 seq 1003585342 subseq 795434 len 1428 csum 0x8b6c], length 1428
20:06:00.273239 IP 112.26.0.1.targus-getdata1 > 112.26.0.8.51814: Flags [.], ack 345577, win 24298, options [nop,nop,TS val 1083122 ecr 851930,nop,nop,sack 2 {352717:358429}{347005:351289},mptcp dss ack 1003561066], length 0
20:06:00.339647 IP 112.26.0.1.targus-getdata1 > 112.26.0.8.51814: Flags [.], ack 345577, win 24298, options [nop,nop,TS val 1083122 ecr 851930,nop,nop,sack 2 {352717:358429}{347005:351289},mptcp dss ack 1003561066], length 0
20:06:00.385186 IP 112.26.0.8.51814 > 112.26.0.1.targus-getdata1: Flags [.], seq 358429:359857, ack 0, win 4107, options [nop,nop,TS val 852904 ecr 1082271,mptcp dss ack 2724680102 seq 1003591054 subseq 796862 len 1428 csum 0x2faf], length 1428
20:06:00.385523 IP 112.26.0.1.targus-getdata1 > 112.26.0.8.51814: Flags [.], ack 345577, win 24298, options [nop,nop,TS val 1083234 ecr 851930,nop,nop,sack 2 {352717:359857}{347005:351289},mptcp dss ack 1003561066], length 0
20:06:00.421849 IP 112.26.0.1.targus-getdata1 > 112.26.0.8.51814: Flags [.], ack 345577, win 24298, options [nop,nop,TS val 1083234 ecr 851930,nop,nop,sack 2 {352717:359857}{347005:351289},mptcp dss ack 1003561066], length 0
20:06:00.508822 IP 112.26.0.8.51814 > 112.26.0.1.targus-getdata1: Flags [.], seq 359857:361285, ack 0, win 4107, options [nop,nop,TS val 853057 ecr 1082384,mptcp dss ack 2724680102 seq 1003598194 subseq 798290 len 1428 csum 0x3ce1], length 1428
20:06:00.509164 IP 112.26.0.1.targus-getdata1 > 112.26.0.8.51814: Flags [.], ack 345577, win 24298, options [nop,nop,TS val 1083358 ecr 851930,nop,nop,sack 2 {352717:361285}{347005:351289},mptcp dss ack 1003561066], length 0
20:06:00.521817 IP 112.26.0.1.targus-getdata1 > 112.26.0.8.51814: Flags [.], ack 345577, win 24298, options [nop,nop,TS val 1083358 ecr 851930,nop,nop,sack 2 {352717:361285}{347005:351289},mptcp dss ack 1003561066], length 0
20:06:00.654633 IP 112.26.0.8.51814 > 112.26.0.1.targus-getdata1: Flags [.], seq 361285:362713, ack 0, win 4107, options [nop,nop,TS val 853156 ecr 1082442,mptcp dss ack 2724680102 seq 1003601050 subseq 799718 len 1428 csum 0x9bf0], length 1428
20:06:00.654979 IP 112.26.0.1.targus-getdata1 > 112.26.0.8.51814: Flags [.], ack 345577, win 24298, options [nop,nop,TS val 1083504 ecr 851930,nop,nop,sack 2 {352717:362713}{347005:351289},mptcp dss ack 1003561066], length 0
20:06:00.662412 IP 112.26.0.1.targus-getdata1 > 112.26.0.8.51814: Flags [.], ack 345577, win 24298, options [nop,nop,TS val 1083504 ecr 851930,nop,nop,sack 2 {352717:362713}{347005:351289},mptcp dss ack 1003561066], length 0
20:06:00.739313 IP 112.26.0.8.51814 > 112.26.0.1.targus-getdata1: Flags [.], seq 362713:364141, ack 0, win 4107, options [nop,nop,TS val 853344 ecr 1082563,mptcp dss ack 2724680102 seq 1003611046 subseq 801146 len 1428 csum 0x69bc], length 1428
20:06:00.739639 IP 112.26.0.1.targus-getdata1 > 112.26.0.8.51814: Flags [.], ack 345577, win 24298, options [nop,nop,TS val 1083588 ecr 851930,nop,nop,sack 2 {352717:364141}{347005:351289},mptcp dss ack 1003561066], length 0
20:06:00.768759 IP 112.26.0.1.targus-getdata1 > 112.26.0.8.51814: Flags [.], ack 345577, win 24298, options [nop,nop,TS val 1083588 ecr 851930,nop,nop,sack 2 {352717:364141}{347005:351289},mptcp dss ack 1003561066], length 0
20:06:00.823996 IP 112.26.0.8.51814 > 112.26.0.1.targus-getdata1: Flags [.], seq 345577:347005, ack 0, win 4107, options [nop,nop,TS val 853385 ecr 1082669,mptcp dss ack 2724680102 seq 1003561066 subseq 784010 len 1428 csum 0xe597], length 1428
20:06:00.824370 IP 112.26.0.1.targus-getdata1 > 112.26.0.8.51814: Flags [.], ack 351289, win 24076, options [nop,nop,TS val 1083673 ecr 853385,nop,nop,sack 1 {352717:364141},mptcp dss ack 1003575346], length 0
20:06:00.889264 IP 112.26.0.1.targus-getdata1 > 112.26.0.8.51814: Flags [.], ack 351289, win 24076, options [nop,nop,TS val 1083673 ecr 853385,nop,nop,sack 1 {352717:364141},mptcp dss ack 1003575346], length 0
20:06:00.932962 IP 112.26.0.8.51814 > 112.26.0.1.targus-getdata1: Flags [.], seq 351289:352717, ack 0, win 4107, options [nop,nop,TS val 853504 ecr 1082808,mptcp dss ack 2724680102 seq 1003575346 subseq 789722 len 1428 csum 0x4ddd], length 1428
20:06:00.933360 IP 112.26.0.1.targus-getdata1 > 112.26.0.8.51814: Flags [.], ack 364141, win 24078, options [nop,nop,TS val 1083782 ecr 853504,mptcp dss ack 1003603906], length 0
20:06:00.984535 IP 112.26.0.1.targus-getdata1 > 112.26.0.8.51814: Flags [.], ack 364141, win 24078, options [nop,nop,TS val 1083782 ecr 853504,mptcp dss ack 1003603906], length 0
20:06:01.095280 IP 112.26.0.8.51814 > 112.26.0.1.targus-getdata1: Flags [.], seq 364141:365569, ack 0, win 4107, options [nop,nop,TS val 853889 ecr 1083122,mptcp dss ack 2724680102 seq 1003629610 subseq 802574 len 1428 csum 0x3ead], length 1428
20:06:01.095617 IP 112.26.0.1.targus-getdata1 > 112.26.0.8.51814: Flags [.], ack 365569, win 24396, options [nop,nop,TS val 1083944 ecr 853889,mptcp dss ack 1003603906], length 0
20:06:01.104100 IP 112.26.0.1.targus-getdata1 > 112.26.0.8.51814: Flags [.], ack 365569, win 24396, options [nop,nop,TS val 1083944 ecr 853889,mptcp dss ack 1003603906], length 0
20:06:01.223102 IP 112.26.0.8.51814 > 112.26.0.1.targus-getdata1: Flags [.], seq 365569:366997, ack 0, win 4107, options [nop,nop,TS val 853990 ecr 1083234,mptcp dss ack 2724680102 seq 1003632466 subseq 804002 len 1428 csum 0xd7a3], length 1428
20:06:01.223435 IP 112.26.0.1.targus-getdata1 > 112.26.0.8.51814: Flags [.], ack 366997, win 24396, options [nop,nop,TS val 1084072 ecr 853990,mptcp dss ack 1003603906], length 0
20:06:01.230519 IP 112.26.0.1.targus-getdata1 > 112.26.0.8.51814: Flags [.], ack 366997, win 24396, options [nop,nop,TS val 1084072 ecr 853990,mptcp dss ack 1003603906], length 0
20:06:01.315945 IP 112.26.0.8.51814 > 112.26.0.1.targus-getdata1: Flags [.], seq 366997:368425, ack 0, win 4107, options [nop,nop,TS val 854114 ecr 1083358,mptcp dss ack 2724680102 seq 1003639606 subseq 805430 len 1428 csum 0x3bfb], length 1428
20:06:01.316338 IP 112.26.0.1.targus-getdata1 > 112.26.0.8.51814: Flags [.], ack 368425, win 24396, options [nop,nop,TS val 1084165 ecr 854114,mptcp dss ack 1003603906], length 0
20:06:01.318522 IP 112.26.0.1.targus-getdata1 > 112.26.0.8.51814: Flags [.], ack 368425, win 24396, options [nop,nop,TS val 1084165 ecr 854114,mptcp dss ack 1003603906], length 0
20:06:01.415721 IP 112.26.0.8.51814 > 112.26.0.1.targus-getdata1: Flags [.], seq 368425:369853, ack 0, win 4107, options [nop,nop,TS val 854158 ecr 1083504,mptcp dss ack 2724680102 seq 1003642462 subseq 806858 len 1428 csum 0xfec4], length 1428
20:06:01.416015 IP 112.26.0.1.targus-getdata1 > 112.26.0.8.51814: Flags [.], ack 369853, win 24396, options [nop,nop,TS val 1084265 ecr 854158,mptcp dss ack 1003603906], length 0
20:06:01.422850 IP 112.26.0.1.targus-getdata1 > 112.26.0.8.51814: Flags [.], ack 369853, win 24396, options [nop,nop,TS val 1084265 ecr 854158,mptcp dss ack 1003603906], length 0
20:06:01.563032 IP 112.26.0.8.51814 > 112.26.0.1.targus-getdata1: Flags [.], seq 369853:371281, ack 0, win 4107, options [nop,nop,TS val 854289 ecr 1083588,mptcp dss ack 2724680102 seq 1003646746 subseq 808286 len 1428 csum 0xf859], length 1428
20:06:01.563365 IP 112.26.0.1.targus-getdata1 > 112.26.0.8.51814: Flags [.], ack 371281, win 24396, options [nop,nop,TS val 1084412 ecr 854289,mptcp dss ack 1003603906], length 0
20:06:01.566324 IP 112.26.0.1.targus-getdata1 > 112.26.0.8.51814: Flags [.], ack 371281, win 24396, options [nop,nop,TS val 1084412 ecr 854289,mptcp dss ack 1003603906], length 0
20:06:01.663118 IP 112.26.0.8.51814 > 112.26.0.1.targus-getdata1: Flags [.], seq 371281:372709, ack 0, win 4107, options [nop,nop,TS val 854412 ecr 1083673,mptcp dss ack 2724680102 seq 1003652458 subseq 809714 len 1428 csum 0x4160], length 1428
20:06:01.663456 IP 112.26.0.1.targus-getdata1 > 112.26.0.8.51814: Flags [.], ack 372709, win 24396, options [nop,nop,TS val 1084512 ecr 854412,mptcp dss ack 1003603906], length 0
20:06:01.704021 IP 112.26.0.1.targus-getdata1 > 112.26.0.8.51814: Flags [.], ack 372709, win 24396, options [nop,nop,TS val 1084512 ecr 854412,mptcp dss ack 1003603906], length 0
20:06:01.766987 IP 112.26.0.8.51814 > 112.26.0.1.targus-getdata1: Flags [.], seq 372709:374137, ack 0, win 4107, options [nop,nop,TS val 854532 ecr 1083782,mptcp dss ack 2724680102 seq 1003656742 subseq 811142 len 1428 csum 0x1613], length 1428
20:06:01.767343 IP 112.26.0.1.targus-getdata1 > 112.26.0.8.51814: Flags [.], ack 374137, win 24396, options [nop,nop,TS val 1084616 ecr 854532,mptcp dss ack 1003603906], length 0
20:06:01.848970 IP 112.26.0.1.targus-getdata1 > 112.26.0.8.51814: Flags [.], ack 374137, win 24396, options [nop,nop,TS val 1084616 ecr 854532,mptcp dss ack 1003603906], length 0
20:06:01.882685 IP 112.26.0.8.51814 > 112.26.0.1.targus-getdata1: Flags [.], seq 374137:375565, ack 0, win 4107, options [nop,nop,TS val 854643 ecr 1083944,mptcp dss ack 2724680102 seq 1003662454 subseq 812570 len 1428 csum 0xb6e4], length 1428
20:06:01.883030 IP 112.26.0.1.targus-getdata1 > 112.26.0.8.51814: Flags [.], ack 375565, win 24396, options [nop,nop,TS val 1084732 ecr 854643,mptcp dss ack 1003603906], length 0
20:06:01.926860 IP 112.26.0.1.targus-getdata1 > 112.26.0.8.51814: Flags [.], ack 375565, win 24396, options [nop,nop,TS val 1084732 ecr 854643,mptcp dss ack 1003603906], length 0
20:06:01.972112 IP 112.26.0.8.51814 > 112.26.0.1.targus-getdata1: Flags [.], seq 375565:376993, ack 0, win 4107, options [nop,nop,TS val 854790 ecr 1084072,mptcp dss ack 2724680102 seq 1003666738 subseq 813998 len 1428 csum 0x2dda], length 1428
20:06:01.972424 IP 112.26.0.1.targus-getdata1 > 112.26.0.8.51814: Flags [.], ack 376993, win 24396, options [nop,nop,TS val 1084821 ecr 854790,mptcp dss ack 1003603906], length 0
20:06:02.041446 IP 112.26.0.8.51814 > 112.26.0.1.targus-getdata1: Flags [.], seq 376993:378421, ack 0, win 4107, options [nop,nop,TS val 854790 ecr 1084072,mptcp dss ack 2724680102 seq 1003668166 subseq 815426 len 1428 csum 0x4b8], length 1428
20:06:02.041683 IP 112.26.0.1.targus-getdata1 > 112.26.0.8.51814: Flags [.], ack 378421, win 24396, options [nop,nop,TS val 1084890 ecr 854790,mptcp dss ack 1003603906], length 0
20:06:02.070717 IP 112.26.0.1.targus-getdata1 > 112.26.0.8.51814: Flags [.], ack 376993, win 24396, options [nop,nop,TS val 1084821 ecr 854790,mptcp dss ack 1003603906], length 0
20:06:02.156501 IP 112.26.0.1.targus-getdata1 > 112.26.0.8.51814: Flags [.], ack 378421, win 24396, options [nop,nop,TS val 1084890 ecr 854790,mptcp dss ack 1003603906], length 0
20:06:02.189450 IP 112.26.0.8.51814 > 112.26.0.1.targus-getdata1: Flags [.], seq 378421:379849, ack 0, win 4107, options [nop,nop,TS val 854875 ecr 1084165,mptcp dss ack 2724680102 seq 1003673878 subseq 816854 len 1428 csum 0xebad], length 1428
20:06:02.189765 IP 112.26.0.1.targus-getdata1 > 112.26.0.8.51814: Flags [.], ack 379849, win 24396, options [nop,nop,TS val 1085038 ecr 854875,mptcp dss ack 1003603906], length 0
20:06:02.236536 IP 112.26.0.1.targus-getdata1 > 112.26.0.8.51814: Flags [.], ack 379849, win 24396, options [nop,nop,TS val 1085038 ecr 854875,mptcp dss ack 1003603906], length 0
20:06:02.290608 IP 112.26.0.8.51814 > 112.26.0.1.targus-getdata1: Flags [.], seq 379849:381277, ack 0, win 4107, options [nop,nop,TS val 855051 ecr 1084265,mptcp dss ack 2724680102 seq 1003683874 subseq 818282 len 1428 csum 0x89c5], length 1428
20:06:02.290887 IP 112.26.0.1.targus-getdata1 > 112.26.0.8.51814: Flags [.], ack 381277, win 24396, options [nop,nop,TS val 1085139 ecr 855051,mptcp dss ack 1003603906], length 0
20:06:02.296527 IP 112.26.0.1.targus-getdata1 > 112.26.0.8.51814: Flags [.], ack 381277, win 24396, options [nop,nop,TS val 1085139 ecr 855051,mptcp dss ack 1003603906], length 0
20:06:02.352456 IP 112.26.0.8.51814 > 112.26.0.1.targus-getdata1: Flags [.], seq 381277:382705, ack 0, win 4107, options [nop,nop,TS val 855194 ecr 1084412,mptcp dss ack 2724680102 seq 1003689586 subseq 819710 len 1428 csum 0x581e], length 1428
20:06:02.352810 IP 112.26.0.1.targus-getdata1 > 112.26.0.8.51814: Flags [.], ack 382705, win 24396, options [nop,nop,TS val 1085201 ecr 855194,mptcp dss ack 1003603906], length 0
20:06:02.438934 IP 112.26.0.1.targus-getdata1 > 112.26.0.8.51814: Flags [.], ack 382705, win 24396, options [nop,nop,TS val 1085201 ecr 855194,mptcp dss ack 1003603906], length 0
20:06:02.451438 IP 112.26.0.8.51814 > 112.26.0.1.targus-getdata1: Flags [.], seq 382705:384133, ack 0, win 4107, options [nop,nop,TS val 855294 ecr 1084512,mptcp dss ack 2724680102 seq 1003693870 subseq 821138 len 1428 csum 0x4db4], length 1428
20:06:02.451798 IP 112.26.0.1.targus-getdata1 > 112.26.0.8.51814: Flags [.], ack 384133, win 24396, options [nop,nop,TS val 1085300 ecr 855294,mptcp dss ack 1003603906], length 0
20:06:02.525640 IP 112.26.0.1.targus-getdata1 > 112.26.0.8.51814: Flags [.], ack 384133, win 24396, options [nop,nop,TS val 1085300 ecr 855294,mptcp dss ack 1003603906], length 0
20:06:02.543243 IP 112.26.0.8.51814 > 112.26.0.1.targus-getdata1: Flags [.], seq 384133:385561, ack 0, win 4107, options [nop,nop,TS val 855363 ecr 1084616,mptcp dss ack 2724680102 seq 1003695298 subseq 822566 len 1428 csum 0x3d27], length 1428
20:06:02.584279 IP 112.26.0.1.targus-getdata1 > 112.26.0.8.51814: Flags [.], ack 385561, win 24396, options [nop,nop,TS val 1085433 ecr 855363,mptcp dss ack 1003603906], length 0
20:06:02.609370 IP 112.26.0.1.targus-getdata1 > 112.26.0.8.51814: Flags [.], ack 385561, win 24396, options [nop,nop,TS val 1085433 ecr 855363,mptcp dss ack 1003603906], length 0
20:06:02.652187 IP 112.26.0.8.51814 > 112.26.0.1.targus-getdata1: Flags [.], seq 385561:386989, ack 0, win 4107, options [nop,nop,TS val 855474 ecr 1084732,mptcp dss ack 2724680102 seq 1003701010 subseq 823994 len 1428 csum 0xe6b8], length 1428
20:06:02.718584 IP 112.26.0.1.targus-getdata1 > 112.26.0.8.51814: Flags [.], ack 386989, win 24396, options [nop,nop,TS val 1085568 ecr 855474,mptcp dss ack 1003603906], length 0
20:06:02.721554 IP 112.26.0.1.targus-getdata1 > 112.26.0.8.51814: Flags [.], ack 386989, win 24396, options [nop,nop,TS val 1085568 ecr 855474,mptcp dss ack 1003603906], length 0
20:06:02.769880 IP 112.26.0.8.51814 > 112.26.0.1.targus-getdata1: Flags [.], seq 386989:388417, ack 0, win 4107, options [nop,nop,TS val 855521 ecr 1084821,mptcp dss ack 2724680102 seq 1003705294 subseq 825422 len 1428 csum 0xce0a], length 1428
20:06:02.838658 IP 112.26.0.1.targus-getdata1 > 112.26.0.8.51814: Flags [.], ack 388417, win 24543, options [nop,nop,TS val 1085688 ecr 855521,mptcp dss ack 1003699582], length 0
20:06:02.841417 IP 112.26.0.1.targus-getdata1 > 112.26.0.8.51814: Flags [.], ack 388417, win 24543, options [nop,nop,TS val 1085688 ecr 855521,mptcp dss ack 1003699582], length 0
20:06:02.881226 IP 112.26.0.8.51814 > 112.26.0.1.targus-getdata1: Flags [.], seq 388417:389845, ack 0, win 4107, options [nop,nop,TS val 855653 ecr 1084890,mptcp dss ack 2724680102 seq 1003709578 subseq 826850 len 1428 csum 0x9d98], length 1428
20:06:02.950863 IP 112.26.0.1.targus-getdata1 > 112.26.0.8.51814: Flags [.], ack 389845, win 24558, options [nop,nop,TS val 1085800 ecr 855653,mptcp dss ack 1003708150], length 0
20:06:02.958547 IP 112.26.0.1.targus-getdata1 > 112.26.0.8.51814: Flags [.], ack 389845, win 24558, options [nop,nop,TS val 1085800 ecr 855653,mptcp dss ack 1003708150], length 0
20:06:03.002743 IP 112.26.0.8.51814 > 112.26.0.1.targus-getdata1: Flags [.], seq 389845:391273, ack 0, win 4107, options [nop,nop,TS val 855653 ecr 1084890,mptcp dss ack 2724680102 seq 1003711006 subseq 828278 len 1428 csum 0xdcec], length 1428
20:06:03.071178 IP 112.26.0.1.targus-getdata1 > 112.26.0.8.51814: Flags [.], ack 391273, win 24558, options [nop,nop,TS val 1085920 ecr 855653,mptcp dss ack 1003713862], length 0
20:06:03.078204 IP 112.26.0.1.targus-getdata1 > 112.26.0.8.51814: Flags [.], ack 391273, win 24558, options [nop,nop,TS val 1085920 ecr 855653,mptcp dss ack 1003713862], length 0
20:06:03.161578 IP 112.26.0.8.51814 > 112.26.0.1.targus-getdata1: Flags [.], seq 391273:392701, ack 0, win 4107, options [nop,nop,TS val 855803 ecr 1085038,mptcp dss ack 2724680102 seq 1003716718 subseq 829706 len 1428 csum 0x5aa0], length 1428
20:06:03.230643 IP 112.26.0.1.targus-getdata1 > 112.26.0.8.51814: Flags [.], ack 392701, win 24558, options [nop,nop,TS val 1086080 ecr 855803,mptcp dss ack 1003719574], length 0
20:06:03.233518 IP 112.26.0.1.targus-getdata1 > 112.26.0.8.51814: Flags [.], ack 392701, win 24558, options [nop,nop,TS val 1086080 ecr 855803,mptcp dss ack 1003719574], length 0
20:06:03.257854 IP 112.26.0.8.51814 > 112.26.0.1.targus-getdata1: Flags [.], seq 392701:394129, ack 0, win 4107, options [nop,nop,TS val 855858 ecr 1085139,mptcp dss ack 2724680102 seq 1003719574 subseq 831134 len 1428 csum 0x5e8f], length 1428
20:06:03.326649 IP 112.26.0.1.targus-getdata1 > 112.26.0.8.51814: Flags [.], ack 394129, win 24540, options [nop,nop,TS val 1086176 ecr 855858,mptcp dss ack 1003722430], length 0
20:06:03.343306 IP 112.26.0.8.51814 > 112.26.0.1.targus-getdata1: Flags [.], seq 394129:395557, ack 0, win 4107, options [nop,nop,TS val 856013 ecr 1085201,mptcp dss ack 2724680102 seq 1003723858 subseq 832562 len 1428 csum 0xa2af], length 1428
20:06:03.344162 IP 112.26.0.1.targus-getdata1 > 112.26.0.8.51814: Flags [.], ack 394129, win 24540, options [nop,nop,TS val 1086176 ecr 855858,mptcp dss ack 1003722430], length 0
20:06:03.414742 IP 112.26.0.1.targus-getdata1 > 112.26.0.8.51814: Flags [.], ack 395557, win 24540, options [nop,nop,TS val 1086264 ecr 856013,mptcp dss ack 1003722430], length 0
20:06:03.438959 IP 112.26.0.1.targus-getdata1 > 112.26.0.8.51814: Flags [.], ack 395557, win 24540, options [nop,nop,TS val 1086264 ecr 856013,mptcp dss ack 1003722430], length 0
20:06:03.460621 IP 112.26.0.8.51814 > 112.26.0.1.targus-getdata1: Flags [.], seq 395557:396985, ack 0, win 4107, options [nop,nop,TS val 856145 ecr 1085300,mptcp dss ack 2724680102 seq 1003729570 subseq 833990 len 1428 csum 0x3e7a], length 1428
20:06:03.526837 IP 112.26.0.1.targus-getdata1 > 112.26.0.8.51814: Flags [.], ack 396985, win 24540, options [nop,nop,TS val 1086376 ecr 856145,mptcp dss ack 1003722430], length 0
20:06:03.535182 IP 112.26.0.1.targus-getdata1 > 112.26.0.8.51814: Flags [.], ack 396985, win 24540, options [nop,nop,TS val 1086376 ecr 856145,mptcp dss ack 1003722430], length 0
20:06:03.595133 IP 112.26.0.8.51814 > 112.26.0.1.targus-getdata1: Flags [.], seq 398413:399841, ack 0, win 4107, options [nop,nop,TS val 856371 ecr 1085568,mptcp dss ack 2724680102 seq 1003745278 subseq 836846 len 1428 csum 0x34f5], length 1428
20:06:03.595442 IP 112.26.0.1.targus-getdata1 > 112.26.0.8.51814: Flags [.], ack 396985, win 24540, options [nop,nop,TS val 1086444 ecr 856145,nop,nop,sack 1 {398413:399841},mptcp dss ack 1003722430], length 0
20:06:03.606543 IP 112.26.0.1.targus-getdata1 > 112.26.0.8.51814: Flags [.], ack 396985, win 24540, options [nop,nop,TS val 1086444 ecr 856145,nop,nop,sack 1 {398413:399841},mptcp dss ack 1003722430], length 0
20:06:03.737965 IP 112.26.0.8.51814 > 112.26.0.1.targus-getdata1: Flags [.], seq 399841:401269, ack 0, win 4107, options [nop,nop,TS val 856469 ecr 1085688,mptcp dss ack 2724680102 seq 1003748134 subseq 838274 len 1428 csum 0x8276], length 1428
20:06:03.738310 IP 112.26.0.1.targus-getdata1 > 112.26.0.8.51814: Flags [.], ack 396985, win 24540, options [nop,nop,TS val 1086587 ecr 856145,nop,nop,sack 1 {398413:401269},mptcp dss ack 1003722430], length 0
20:06:03.742009 IP 112.26.0.1.targus-getdata1 > 112.26.0.8.51814: Flags [.], ack 396985, win 24540, options [nop,nop,TS val 1086587 ecr 856145,nop,nop,sack 1 {398413:401269},mptcp dss ack 1003722430], length 0
20:06:03.876358 IP 112.26.0.8.51814 > 112.26.0.1.targus-getdata1: Flags [.], seq 401269:402697, ack 0, win 4107, options [nop,nop,TS val 856502 ecr 1085800,mptcp dss ack 2724680102 seq 1003749562 subseq 839702 len 1428 csum 0xe2cd], length 1428
20:06:03.876666 IP 112.26.0.1.targus-getdata1 > 112.26.0.8.51814: Flags [.], ack 396985, win 24540, options [nop,nop,TS val 1086726 ecr 856145,nop,nop,sack 1 {398413:402697},mptcp dss ack 1003722430], length 0
20:06:03.883370 IP 112.26.0.1.targus-getdata1 > 112.26.0.8.51814: Flags [.], ack 396985, win 24540, options [nop,nop,TS val 1086726 ecr 856145,nop,nop,sack 1 {398413:402697},mptcp dss ack 1003722430], length 0
20:06:03.959904 IP 112.26.0.8.51814 > 112.26.0.1.targus-getdata1: Flags [.], seq 402697:404125, ack 0, win 4107, options [nop,nop,TS val 856603 ecr 1085920,mptcp dss ack 2724680102 seq 1003759558 subseq 841130 len 1428 csum 0xc3da], length 1428
20:06:03.960281 IP 112.26.0.1.targus-getdata1 > 112.26.0.8.51814: Flags [.], ack 396985, win 24540, options [nop,nop,TS val 1086809 ecr 856145,nop,nop,sack 1 {398413:404125},mptcp dss ack 1003722430], length 0
20:06:04.023608 IP 112.26.0.1.targus-getdata1 > 112.26.0.8.51814: Flags [.], ack 396985, win 24540, options [nop,nop,TS val 1086809 ecr 856145,nop,nop,sack 1 {398413:404125},mptcp dss ack 1003722430], length 0
20:06:04.054751 IP 112.26.0.8.51814 > 112.26.0.1.targus-getdata1: Flags [.], seq 404125:405553, ack 0, win 4107, options [nop,nop,TS val 856691 ecr 1086080,mptcp dss ack 2724680102 seq 1003765270 subseq 842558 len 1428 csum 0x9405], length 1428
20:06:04.055082 IP 112.26.0.1.targus-getdata1 > 112.26.0.8.51814: Flags [.], ack 396985, win 24540, options [nop,nop,TS val 1086903 ecr 856145,nop,nop,sack 1 {398413:405553},mptcp dss ack 1003722430], length 0
20:06:04.093761 IP 112.26.0.1.targus-getdata1 > 112.26.0.8.51814: Flags [.], ack 396985, win 24540, options [nop,nop,TS val 1086903 ecr 856145,nop,nop,sack 1 {398413:405553},mptcp dss ack 1003722430], length 0
20:06:04.166071 IP 112.26.0.8.51814 > 112.26.0.1.targus-getdata1: Flags [.], seq 405553:406981, ack 0, win 4107, options [nop,nop,TS val 856798 ecr 1086176,mptcp dss ack 2724680102 seq 1003769554 subseq 843986 len 1428 csum 0x205], length 1428
20:06:04.166411 IP 112.26.0.1.targus-getdata1 > 112.26.0.8.51814: Flags [.], ack 396985, win 24540, options [nop,nop,TS val 1087015 ecr 856145,nop,nop,sack 1 {398413:406981},mptcp dss ack 1003722430], length 0
20:06:04.215908 IP 112.26.0.1.targus-getdata1 > 112.26.0.8.51814: Flags [.], ack 396985, win 24540, options [nop,nop,TS val 1087015 ecr 856145,nop,nop,sack 1 {398413:406981},mptcp dss ack 1003722430], length 0
20:06:04.291632 IP 112.26.0.8.51814 > 112.26.0.1.targus-getdata1: Flags [.], seq 406981:408409, ack 0, win 4107, options [nop,nop,TS val 856860 ecr 1086264,mptcp dss ack 2724680102 seq 1003770982 subseq 845414 len 1428 csum 0x5963], length 1428
20:06:04.291994 IP 112.26.0.1.targus-getdata1 > 112.26.0.8.51814: Flags [.], ack 396985, win 24540, options [nop,nop,TS val 1087141 ecr 856145,nop,nop,sack 1 {398413:408409},mptcp dss ack 1003722430], length 0
20:06:04.326182 IP 112.26.0.1.targus-getdata1 > 112.26.0.8.51814: Flags [.], ack 396985, win 24540, options [nop,nop,TS val 1087141 ecr 856145,nop,nop,sack 1 {398413:408409},mptcp dss ack 1003722430], length 0
20:06:04.405054 IP 112.26.0.8.51814 > 112.26.0.1.targus-getdata1: Flags [.], seq 408409:409837, ack 0, win 4107, options [nop,nop,TS val 856985 ecr 1086376,mptcp dss ack 2724680102 seq 1003779550 subseq 846842 len 1428 csum 0x293f], length 1428
20:06:04.405445 IP 112.26.0.1.targus-getdata1 > 112.26.0.8.51814: Flags [.], ack 396985, win 24540, options [nop,nop,TS val 1087254 ecr 856145,nop,nop,sack 1 {398413:409837},mptcp dss ack 1003722430], length 0
20:06:04.446178 IP 112.26.0.1.targus-getdata1 > 112.26.0.8.51814: Flags [.], ack 396985, win 24540, options [nop,nop,TS val 1087254 ecr 856145,nop,nop,sack 1 {398413:409837},mptcp dss ack 1003722430], length 0
