17:35:05.629758 IP 112.26.1.8.59957 > 112.26.1.1.targus-getdata1: Flags [S], seq 3042279937, win 29200, options [mss 1460,sackOK,TS val 1082530 ecr 0,nop,wscale 7,mptcp join id 6 token 0x3ce29047 nonce 0xc255c144], length 0
17:35:05.630105 IP 112.26.1.1.targus-getdata1 > 112.26.1.8.59957: Flags [S.], seq 1101047731, ack 3042279938, win 65535, options [mss 1460,sackOK,TS val 1315418 ecr 1082530,nop,wscale 6,mptcp join id 3 hmac 0xbfd8f9d36fb1ac8c nonce 0xe6efa37b], length 0
17:35:05.697127 IP 112.26.1.1.targus-getdata1 > 112.26.1.8.59957: Flags [S.], seq 1101047731, ack 3042279938, win 65535, options [mss 1460,sackOK,TS val 1315418 ecr 1082530,nop,wscale 6,mptcp join id 3 hmac 0xbfd8f9d36fb1ac8c nonce 0xe6efa37b], length 0
17:35:05.814510 IP 112.26.1.8.59957 > 112.26.1.1.targus-getdata1: Flags [.], ack 1, win 457, options [nop,nop,TS val 1082623 ecr 1315418,mptcp join hmac 0xb8b57542b122d1e504abbe29455b46dbb19bf3c4], length 0
17:35:05.814876 IP 112.26.1.1.targus-getdata1 > 112.26.1.8.59957: Flags [.], ack 1, win 2678, options [nop,nop,TS val 1315603 ecr 1082623,mptcp dss ack 1152732528], length 0
17:35:05.819721 IP 112.26.1.1.targus-getdata1 > 112.26.1.8.59957: Flags [.], ack 1, win 2678, options [nop,nop,TS val 1315603 ecr 1082623,mptcp dss ack 1152732528], length 0
17:35:06.027615 IP 112.26.1.8.59957 > 112.26.1.1.targus-getdata1: Flags [P.], seq 1:84, ack 1, win 913, options [nop,nop,TS val 1082927 ecr 1315603,mptcp dss ack 2452462161 seq 1152732532 subseq 1 len 83 csum 0xad4a], length 83
17:35:42.994905 IP 112.26.1.8.44635 > 112.26.1.1.targus-getdata1: Flags [.], seq 76411577:76413005, ack 1100377486, win 913, options [nop,nop,TS val 1118817 ecr 1351680,mptcp dss ack 3644063658 seq 3528558494 subseq 378421 len 1428 csum 0x7dad], length 1428
17:35:42.995232 IP 112.26.1.1.targus-getdata1 > 112.26.1.8.44635: Flags [.], ack 1428, win 24540, options [nop,nop,TS val 1352784 ecr 1118400,mptcp dss ack 3528555638], length 0
17:35:42.999583 IP 112.26.1.1.targus-getdata1 > 112.26.1.8.44635: Flags [.], ack 1428, win 24540, options [nop,nop,TS val 1352784 ecr 1118400,mptcp dss ack 3528555638], length 0
17:35:43.145460 IP 112.26.1.8.44635 > 112.26.1.1.targus-getdata1: Flags [.], seq 2856:4284, ack 1, win 913, options [nop,nop,TS val 1118968 ecr 1351826,mptcp dss ack 3644063658 seq 3528564206 subseq 381277 len 1428 csum 0xde25], length 1428
17:35:43.145795 IP 112.26.1.1.targus-getdata1 > 112.26.1.8.44635: Flags [.], ack 1428, win 24558, options [nop,nop,TS val 1352934 ecr 1118400,nop,nop,sack 1 {2856:4284},mptcp dss ack 3528561350], length 0
17:35:43.220033 IP 112.26.1.1.targus-getdata1 > 112.26.1.8.44635: Flags [.], ack 1428, win 24558, options [nop,nop,TS val 1352934 ecr 1118400,nop,nop,sack 1 {2856:4284},mptcp dss ack 3528561350], length 0
17:35:43.260730 IP 112.26.1.8.44635 > 112.26.1.1.targus-getdata1: Flags [.], seq 4284:5712, ack 1, win 913, options [nop,nop,TS val 1119585 ecr 1352115,mptcp dss ack 3644063658 seq 3528572774 subseq 382705 len 1428 csum 0x93af], length 1428
17:35:43.261003 IP 112.26.1.1.targus-getdata1 > 112.26.1.8.44635: Flags [.], ack 1428, win 24558, options [nop,nop,TS val 1353049 ecr 1118400,nop,nop,sack 1 {2856:5712},mptcp dss ack 3528561350], length 0
17:35:43.336705 IP 112.26.1.1.targus-getdata1 > 112.26.1.8.44635: Flags [.], ack 1428, win 24558, options [nop,nop,TS val 1353049 ecr 1118400,nop,nop,sack 1 {2856:5712},mptcp dss ack 3528561350], length 0
17:35:43.371567 IP 112.26.1.8.44635 > 112.26.1.1.targus-getdata1: Flags [.], seq 5712:7140, ack 1, win 913, options [nop,nop,TS val 1119585 ecr 1352115,mptcp dss ack 3644063658 seq 3528574202 subseq 384133 len 1428 csum 0xc504], length 1428
17:35:43.371812 IP 112.26.1.1.targus-getdata1 > 112.26.1.8.44635: Flags [.], ack 1428, win 24536, options [nop,nop,TS val 1353160 ecr 1118400,nop,nop,sack 1 {2856:7140},mptcp dss ack 3528562778], length 0
17:35:43.429590 IP 112.26.1.1.targus-getdata1 > 112.26.1.8.44635: Flags [.], ack 1428, win 24536, options [nop,nop,TS val 1353160 ecr 1118400,nop,nop,sack 1 {2856:7140},mptcp dss ack 3528562778], length 0
17:35:43.465251 IP 112.26.1.8.44635 > 112.26.1.1.targus-getdata1: Flags [.], seq 7140:8568, ack 1, win 913, options [nop,nop,TS val 1119767 ecr 1352370,mptcp dss ack 3644063658 seq 3528581342 subseq 385561 len 1428 csum 0x3fb3], length 1428
17:35:43.465407 IP 112.26.1.1.targus-getdata1 > 112.26.1.8.44635: Flags [.], ack 1428, win 24536, options [nop,nop,TS val 1353254 ecr 1118400,nop,nop,sack 1 {2856:8568},mptcp dss ack 3528562778], length 0
17:35:43.527520 IP 112.26.1.1.targus-getdata1 > 112.26.1.8.44635: Flags [.], ack 1428, win 24536, options [nop,nop,TS val 1353254 ecr 1118400,nop,nop,sack 1 {2856:8568},mptcp dss ack 3528562778], length 0
17:35:43.554689 IP 112.26.1.8.44635 > 112.26.1.1.targus-getdata1: Flags [.], seq 8568:9996, ack 1, win 913, options [nop,nop,TS val 1119767 ecr 1352370,mptcp dss ack 3644063658 seq 3528582770 subseq 386989 len 1428 csum 0x6293], length 1428
17:35:43.554963 IP 112.26.1.1.targus-getdata1 > 112.26.1.8.44635: Flags [.], ack 1428, win 24536, options [nop,nop,TS val 1353344 ecr 1118400,nop,nop,sack 1 {2856:9996},mptcp dss ack 3528562778], length 0
17:35:43.617692 IP 112.26.1.1.targus-getdata1 > 112.26.1.8.44635: Flags [.], ack 1428, win 24536, options [nop,nop,TS val 1353344 ecr 1118400,nop,nop,sack 1 {2856:9996},mptcp dss ack 3528562778], length 0
17:35:43.743766 IP 112.26.1.8.44635 > 112.26.1.1.targus-getdata1: Flags [.], seq 9996:11424, ack 1, win 913, options [nop,nop,TS val 1119882 ecr 1352598,mptcp dss ack 3644063658 seq 3528588482 subseq 388417 len 1428 csum 0x6ae6], length 1428
17:35:43.744112 IP 112.26.1.1.targus-getdata1 > 112.26.1.8.44635: Flags [.], ack 1428, win 24536, options [nop,nop,TS val 1353533 ecr 1118400,nop,nop,sack 1 {2856:11424},mptcp dss ack 3528562778], length 0
17:35:43.756748 IP 112.26.1.1.targus-getdata1 > 112.26.1.8.44635: Flags [.], ack 1428, win 24536, options [nop,nop,TS val 1353533 ecr 1118400,nop,nop,sack 1 {2856:11424},mptcp dss ack 3528562778], length 0
17:35:43.841117 IP 112.26.1.8.44635 > 112.26.1.1.targus-getdata1: Flags [.], seq 11424:12852, ack 1, win 913, options [nop,nop,TS val 1119882 ecr 1352598,mptcp dss ack 3644063658 seq 3528589910 subseq 389845 len 1428 csum 0x1433], length 1428
17:35:43.841464 IP 112.26.1.1.targus-getdata1 > 112.26.1.8.44635: Flags [.], ack 1428, win 24536, options [nop,nop,TS val 1353629 ecr 1118400,nop,nop,sack 1 {2856:12852},mptcp dss ack 3528562778], length 0
17:35:43.854879 IP 112.26.1.1.targus-getdata1 > 112.26.1.8.44635: Flags [.], ack 1428, win 24536, options [nop,nop,TS val 1353629 ecr 1118400,nop,nop,sack 1 {2856:12852},mptcp dss ack 3528562778], length 0
17:35:44.143478 IP 112.26.1.8.44635 > 112.26.1.1.targus-getdata1: Flags [.], seq 12852:14280, ack 1, win 913, options [nop,nop,TS val 1120549 ecr 1352784,mptcp dss ack 3644063658 seq 3528609902 subseq 391273 len 1428 csum 0x996a], length 1428
17:35:44.143795 IP 112.26.1.1.targus-getdata1 > 112.26.1.8.44635: Flags [.], ack 1428, win 24536, options [nop,nop,TS val 1353932 ecr 1118400,nop,nop,sack 1 {2856:14280},mptcp dss ack 3528562778], length 0
17:35:44.147091 IP 112.26.1.1.targus-getdata1 > 112.26.1.8.44635: Flags [.], ack 1428, win 24536, options [nop,nop,TS val 1353932 ecr 1118400,nop,nop,sack 1 {2856:14280},mptcp dss ack 3528562778], length 0
17:35:44.226428 IP 112.26.1.8.44635 > 112.26.1.1.targus-getdata1: Flags [.], seq 14280:15708, ack 1, win 913, options [nop,nop,TS val 1120549 ecr 1352784,mptcp dss ack 3644063658 seq 3528611330 subseq 392701 len 1428 csum 0xb0bd], length 1428
17:35:44.226744 IP 112.26.1.1.targus-getdata1 > 112.26.1.8.44635: Flags [.], ack 1428, win 24536, options [nop,nop,TS val 1354015 ecr 1118400,nop,nop,sack 1 {2856:15708},mptcp dss ack 3528562778], length 0
17:35:44.274208 IP 112.26.1.1.targus-getdata1 > 112.26.1.8.44635: Flags [.], ack 1428, win 24536, options [nop,nop,TS val 1354015 ecr 1118400,nop,nop,sack 1 {2856:15708},mptcp dss ack 3528562778], length 0
17:35:44.389489 IP 112.26.1.8.44635 > 112.26.1.1.targus-getdata1: Flags [P.], seq 15708:17136, ack 1, win 913, options [nop,nop,TS val 1120873 ecr 1352934,mptcp dss ack 3644063658 seq 3528617042 subseq 394129 len 1428 csum 0xa56], length 1428
17:35:44.389798 IP 112.26.1.1.targus-getdata1 > 112.26.1.8.44635: Flags [.], ack 1428, win 24536, options [nop,nop,TS val 1354178 ecr 1118400,nop,nop,sack 1 {2856:17136},mptcp dss ack 3528562778], length 0
17:35:44.395884 IP 112.26.1.1.targus-getdata1 > 112.26.1.8.44635: Flags [.], ack 1428, win 24536, options [nop,nop,TS val 1354178 ecr 1118400,nop,nop,sack 1 {2856:17136},mptcp dss ack 3528562778], length 0
17:35:44.456599 IP 112.26.1.8.44635 > 112.26.1.1.targus-getdata1: Flags [.], seq 17136:18564, ack 1, win 913, options [nop,nop,TS val 1120887 ecr 1353049,mptcp dss ack 3644063658 seq 3528618470 subseq 395557 len 1428 csum 0x9348], length 1428
17:35:44.456808 IP 112.26.1.1.targus-getdata1 > 112.26.1.8.44635: Flags [.], ack 1428, win 24536, options [nop,nop,TS val 1354245 ecr 1118400,nop,nop,sack 1 {2856:18564},mptcp dss ack 3528562778], length 0
17:35:44.466896 IP 112.26.1.1.targus-getdata1 > 112.26.1.8.44635: Flags [.], ack 1428, win 24536, options [nop,nop,TS val 1354245 ecr 1118400,nop,nop,sack 1 {2856:18564},mptcp dss ack 3528562778], length 0
17:35:44.560910 IP 112.26.1.8.44635 > 112.26.1.1.targus-getdata1: Flags [.], seq 1428:2856, ack 1, win 913, options [nop,nop,TS val 1120929 ecr 1353160,mptcp dss ack 3644063658 seq 3528562778 subseq 379849 len 1428 csum 0x9159], length 1428
17:35:44.561205 IP 112.26.1.1.targus-getdata1 > 112.26.1.8.44635: Flags [.], ack 18564, win 24001, options [nop,nop,TS val 1354349 ecr 1120929,mptcp dss ack 3528597050], length 0
17:35:44.640850 IP 112.26.1.1.targus-getdata1 > 112.26.1.8.44635: Flags [.], ack 18564, win 24001, options [nop,nop,TS val 1354349 ecr 1120929,mptcp dss ack 3528597050], length 0
17:35:44.675018 IP 112.26.1.8.44635 > 112.26.1.1.targus-getdata1: Flags [.], seq 18564:19992, ack 1, win 913, options [nop,nop,TS val 1120990 ecr 1353254,mptcp dss ack 3644063658 seq 3528624182 subseq 396985 len 1428 csum 0x18f7], length 1428
17:35:44.675292 IP 112.26.1.1.targus-getdata1 > 112.26.1.8.44635: Flags [.], ack 19992, win 24324, options [nop,nop,TS val 1354464 ecr 1120990,mptcp dss ack 3528597050], length 0
17:35:44.701505 IP 112.26.1.1.targus-getdata1 > 112.26.1.8.44635: Flags [.], ack 19992, win 24324, options [nop,nop,TS val 1354464 ecr 1120990,mptcp dss ack 3528597050], length 0
17:35:44.808667 IP 112.26.1.8.44635 > 112.26.1.1.targus-getdata1: Flags [.], seq 19992:21420, ack 1, win 913, options [nop,nop,TS val 1121024 ecr 1353344,mptcp dss ack 3644063658 seq 3528627038 subseq 398413 len 1428 csum 0x9cbb], length 1428
17:35:44.808999 IP 112.26.1.1.targus-getdata1 > 112.26.1.8.44635: Flags [.], ack 21420, win 24324, options [nop,nop,TS val 1354597 ecr 1121024,mptcp dss ack 3528597050], length 0
17:35:44.832690 IP 112.26.1.1.targus-getdata1 > 112.26.1.8.44635: Flags [.], ack 21420, win 24324, options [nop,nop,TS val 1354597 ecr 1121024,mptcp dss ack 3528597050], length 0
17:35:45.173333 IP 112.26.1.8.44635 > 112.26.1.1.targus-getdata1: Flags [.], seq 21420:22848, ack 1, win 913, options [nop,nop,TS val 1121695 ecr 1353932,mptcp dss ack 3644063658 seq 3528661310 subseq 399841 len 1428 csum 0xc14f], length 1428
17:35:45.173666 IP 112.26.1.1.targus-getdata1 > 112.26.1.8.44635: Flags [.], ack 22848, win 24324, options [nop,nop,TS val 1354962 ecr 1121695,mptcp dss ack 3528597050], length 0
17:35:45.181575 IP 112.26.1.1.targus-getdata1 > 112.26.1.8.44635: Flags [.], ack 22848, win 24324, options [nop,nop,TS val 1354962 ecr 1121695,mptcp dss ack 3528597050], length 0
17:35:45.359542 IP 112.26.1.8.44635 > 112.26.1.1.targus-getdata1: Flags [.], seq 22848:24276, ack 1, win 913, options [nop,nop,TS val 1121804 ecr 1354015,mptcp dss ack 3644063658 seq 3528664166 subseq 401269 len 1428 csum 0x1b17], length 1428
17:35:45.359908 IP 112.26.1.1.targus-getdata1 > 112.26.1.8.44635: Flags [.], ack 24276, win 24324, options [nop,nop,TS val 1355148 ecr 1121804,mptcp dss ack 3528597050], length 0
17:35:45.363631 IP 112.26.1.1.targus-getdata1 > 112.26.1.8.44635: Flags [.], ack 24276, win 24324, options [nop,nop,TS val 1355148 ecr 1121804,mptcp dss ack 3528597050], length 0
17:35:45.433490 IP 112.26.1.8.44635 > 112.26.1.1.targus-getdata1: Flags [.], seq 24276:25704, ack 1, win 913, options [nop,nop,TS val 1121870 ecr 1354178,mptcp dss ack 3644063658 seq 3528667022 subseq 402697 len 1428 csum 0x18c9], length 1428
17:35:45.433822 IP 112.26.1.1.targus-getdata1 > 112.26.1.8.44635: Flags [.], ack 25704, win 24324, options [nop,nop,TS val 1355222 ecr 1121870,mptcp dss ack 3528597050], length 0
17:35:45.459728 IP 112.26.1.1.targus-getdata1 > 112.26.1.8.44635: Flags [.], ack 25704, win 24324, options [nop,nop,TS val 1355222 ecr 1121870,mptcp dss ack 3528597050], length 0
17:35:45.526353 IP 112.26.1.8.44635 > 112.26.1.1.targus-getdata1: Flags [.], seq 25704:27132, ack 1, win 913, options [nop,nop,TS val 1121989 ecr 1354245,mptcp dss ack 3644063658 seq 3528672734 subseq 404125 len 1428 csum 0xf409], length 1428
17:35:45.526635 IP 112.26.1.1.targus-getdata1 > 112.26.1.8.44635: Flags [.], ack 27132, win 24324, options [nop,nop,TS val 1355315 ecr 1121989,mptcp dss ack 3528597050], length 0
17:35:45.537644 IP 112.26.1.1.targus-getdata1 > 112.26.1.8.44635: Flags [.], ack 27132, win 24324, options [nop,nop,TS val 1355315 ecr 1121989,mptcp dss ack 3528597050], length 0
17:35:45.628208 IP 112.26.1.8.44635 > 112.26.1.1.targus-getdata1: Flags [.], seq 27132:28560, ack 1, win 913, options [nop,nop,TS val 1121989 ecr 1354349,mptcp dss ack 3644063658 seq 3528674162 subseq 405553 len 1428 csum 0x754f], length 1428
17:35:45.628433 IP 112.26.1.1.targus-getdata1 > 112.26.1.8.44635: Flags [.], ack 28560, win 24324, options [nop,nop,TS val 1355417 ecr 1121989,mptcp dss ack 3528597050], length 0
17:35:45.644390 IP 112.26.1.1.targus-getdata1 > 112.26.1.8.44635: Flags [.], ack 28560, win 24324, options [nop,nop,TS val 1355417 ecr 1121989,mptcp dss ack 3528597050], length 0
17:35:45.757850 IP 112.26.1.8.44635 > 112.26.1.1.targus-getdata1: Flags [.], seq 28560:29988, ack 1, win 913, options [nop,nop,TS val 1122019 ecr 1354464,mptcp dss ack 3644063658 seq 3528675590 subseq 406981 len 1428 csum 0x4fa3], length 1428
17:35:45.758161 IP 112.26.1.1.targus-getdata1 > 112.26.1.8.44635: Flags [.], ack 29988, win 24324, options [nop,nop,TS val 1355546 ecr 1122019,mptcp dss ack 3528597050], length 0
17:35:45.763380 IP 112.26.1.1.targus-getdata1 > 112.26.1.8.44635: Flags [.], ack 29988, win 24324, options [nop,nop,TS val 1355546 ecr 1122019,mptcp dss ack 3528597050], length 0
17:35:45.860496 IP 112.26.1.8.44635 > 112.26.1.1.targus-getdata1: Flags [.], seq 29988:31416, ack 1, win 913, options [nop,nop,TS val 1122194 ecr 1354597,mptcp dss ack 3644063658 seq 3528685586 subseq 408409 len 1428 csum 0x4780], length 1428
17:35:45.860814 IP 112.26.1.1.targus-getdata1 > 112.26.1.8.44635: Flags [.], ack 31416, win 24324, options [nop,nop,TS val 1355649 ecr 1122194,mptcp dss ack 3528597050], length 0
17:35:45.893129 IP 112.26.1.1.targus-getdata1 > 112.26.1.8.44635: Flags [.], ack 31416, win 24324, options [nop,nop,TS val 1355649 ecr 1122194,mptcp dss ack 3528597050], length 0
17:35:45.937149 IP 112.26.1.8.44635 > 112.26.1.1.targus-getdata1: Flags [.], seq 31416:32844, ack 1, win 913, options [nop,nop,TS val 1122194 ecr 1354597,mptcp dss ack 3644063658 seq 3528687014 subseq 409837 len 1428 csum 0x886a], length 1428
17:35:45.937488 IP 112.26.1.1.targus-getdata1 > 112.26.1.8.44635: Flags [.], ack 32844, win 24324, options [nop,nop,TS val 1355726 ecr 1122194,mptcp dss ack 3528597050], length 0
17:35:45.999431 IP 112.26.1.1.targus-getdata1 > 112.26.1.8.44635: Flags [.], ack 32844, win 24324, options [nop,nop,TS val 1355726 ecr 1122194,mptcp dss ack 3528597050], length 0
17:35:46.296511 IP 112.26.1.8.44635 > 112.26.1.1.targus-getdata1: Flags [.], seq 32844:34272, ack 1, win 913, options [nop,nop,TS val 1122630 ecr 1354962,mptcp dss ack 3644063658 seq 3528705578 subseq 411265 len 1428 csum 0x101c], length 1428
17:35:46.296795 IP 112.26.1.1.targus-getdata1 > 112.26.1.8.44635: Flags [.], ack 34272, win 24447, options [nop,nop,TS val 1356085 ecr 1122630,mptcp dss ack 3528684158], length 0
17:35:46.301949 IP 112.26.1.1.targus-getdata1 > 112.26.1.8.44635: Flags [.], ack 34272, win 24447, options [nop,nop,TS val 1356085 ecr 1122630,mptcp dss ack 3528684158], length 0
17:35:46.561951 IP 112.26.1.8.44635 > 112.26.1.1.targus-getdata1: Flags [.], seq 34272:35700, ack 1, win 913, options [nop,nop,TS val 1122944 ecr 1355148,mptcp dss ack 3644063658 seq 3528718430 subseq 412693 len 1428 csum 0xcc82], length 1428
17:35:46.562265 IP 112.26.1.1.targus-getdata1 > 112.26.1.8.44635: Flags [.], ack 35700, win 24447, options [nop,nop,TS val 1356351 ecr 1122944,mptcp dss ack 3528684158], length 0
17:35:46.570226 IP 112.26.1.1.targus-getdata1 > 112.26.1.8.44635: Flags [.], ack 35700, win 24447, options [nop,nop,TS val 1356351 ecr 1122944,mptcp dss ack 3528684158], length 0
17:35:46.675751 IP 112.26.1.8.44635 > 112.26.1.1.targus-getdata1: Flags [.], seq 35700:37128, ack 1, win 913, options [nop,nop,TS val 1123016 ecr 1355222,mptcp dss ack 3644063658 seq 3528721286 subseq 414121 len 1428 csum 0x42d8], length 1428
17:35:46.676084 IP 112.26.1.1.targus-getdata1 > 112.26.1.8.44635: Flags [.], ack 37128, win 24447, options [nop,nop,TS val 1356464 ecr 1123016,mptcp dss ack 3528684158], length 0
17:35:46.679099 IP 112.26.1.1.targus-getdata1 > 112.26.1.8.44635: Flags [.], ack 37128, win 24447, options [nop,nop,TS val 1356464 ecr 1123016,mptcp dss ack 3528684158], length 0
17:35:46.770087 IP 112.26.1.8.44635 > 112.26.1.1.targus-getdata1: Flags [.], seq 37128:38556, ack 1, win 913, options [nop,nop,TS val 1123069 ecr 1355315,mptcp dss ack 3644063658 seq 3528724142 subseq 415549 len 1428 csum 0x56e2], length 1428
17:35:46.770432 IP 112.26.1.1.targus-getdata1 > 112.26.1.8.44635: Flags [.], ack 38556, win 24447, options [nop,nop,TS val 1356558 ecr 1123069,mptcp dss ack 3528684158], length 0
17:35:46.779021 IP 112.26.1.1.targus-getdata1 > 112.26.1.8.44635: Flags [.], ack 38556, win 24447, options [nop,nop,TS val 1356558 ecr 1123069,mptcp dss ack 3528684158], length 0
17:35:46.872502 IP 112.26.1.8.44635 > 112.26.1.1.targus-getdata1: Flags [.], seq 38556:39984, ack 1, win 913, options [nop,nop,TS val 1123069 ecr 1355315,mptcp dss ack 3644063658 seq 3528725570 subseq 416977 len 1428 csum 0xea4c], length 1428
17:35:46.872834 IP 112.26.1.1.targus-getdata1 > 112.26.1.8.44635: Flags [.], ack 39984, win 24447, options [nop,nop,TS val 1356661 ecr 1123069,mptcp dss ack 3528684158], length 0
17:35:46.875937 IP 112.26.1.1.targus-getdata1 > 112.26.1.8.44635: Flags [.], ack 39984, win 24447, options [nop,nop,TS val 1356661 ecr 1123069,mptcp dss ack 3528684158], length 0
17:35:46.958033 IP 112.26.1.8.44635 > 112.26.1.1.targus-getdata1: Flags [.], seq 39984:41412, ack 1, win 913, options [nop,nop,TS val 1123160 ecr 1355417,mptcp dss ack 3644063658 seq 3528728426 subseq 418405 len 1428 csum 0xa92], length 1428
17:35:46.998866 IP 112.26.1.1.targus-getdata1 > 112.26.1.8.44635: Flags [.], ack 41412, win 24558, options [nop,nop,TS val 1356788 ecr 1123160,mptcp dss ack 3528734138], length 0
17:35:47.009088 IP 112.26.1.1.targus-getdata1 > 112.26.1.8.44635: Flags [.], ack 41412, win 24558, options [nop,nop,TS val 1356788 ecr 1123160,mptcp dss ack 3528734138], length 0
17:35:47.024066 IP 112.26.1.8.44635 > 112.26.1.1.targus-getdata1: Flags [.], seq 41412:42840, ack 1, win 913, options [nop,nop,TS val 1123299 ecr 1355546,mptcp dss ack 3644063658 seq 3528734138 subseq 419833 len 1428 csum 0xc9b8], length 1428
17:35:47.083569 IP 112.26.1.8.44635 > 112.26.1.1.targus-getdata1: Flags [.], seq 42840:44268, ack 1, win 913, options [nop,nop,TS val 1123363 ecr 1355649,mptcp dss ack 3644063658 seq 3528746990 subseq 421261 len 1428 csum 0x77f2], length 1428
17:35:47.083841 IP 112.26.1.1.targus-getdata1 > 112.26.1.8.44635: Flags [.], ack 44268, win 24558, options [nop,nop,TS val 1356872 ecr 1123299,mptcp dss ack 3528741278], length 0
17:35:47.110914 IP 112.26.1.1.targus-getdata1 > 112.26.1.8.44635: Flags [.], ack 44268, win 24558, options [nop,nop,TS val 1356872 ecr 1123299,mptcp dss ack 3528741278], length 0
17:35:47.178835 IP 112.26.1.8.44635 > 112.26.1.1.targus-getdata1: Flags [.], seq 44268:45696, ack 1, win 913, options [nop,nop,TS val 1123420 ecr 1355726,mptcp dss ack 3644063658 seq 3528749846 subseq 422689 len 1428 csum 0x3f17], length 1428
17:35:47.338927 IP 112.26.1.1.targus-getdata1 > 112.26.1.8.44635: Flags [.], ack 45696, win 24499, options [nop,nop,TS val 1357128 ecr 1123420,mptcp dss ack 3528745562], length 0
17:35:47.342107 IP 112.26.1.1.targus-getdata1 > 112.26.1.8.44635: Flags [.], ack 45696, win 24499, options [nop,nop,TS val 1357128 ecr 1123420,mptcp dss ack 3528745562], length 0
17:35:47.507341 IP 112.26.1.8.44635 > 112.26.1.1.targus-getdata1: Flags [.], seq 45696:47124, ack 1, win 913, options [nop,nop,TS val 1123833 ecr 1356085,mptcp dss ack 3644063658 seq 3528758414 subseq 424117 len 1428 csum 0xa4b1], length 1428
17:35:47.674831 IP 112.26.1.1.targus-getdata1 > 112.26.1.8.44635: Flags [.], ack 47124, win 24499, options [nop,nop,TS val 1357464 ecr 1123833,mptcp dss ack 3528745562], length 0
17:35:47.686938 IP 112.26.1.1.targus-getdata1 > 112.26.1.8.44635: Flags [.], ack 47124, win 24499, options [nop,nop,TS val 1357464 ecr 1123833,mptcp dss ack 3528745562], length 0
17:35:47.722854 IP 112.26.1.8.44635 > 112.26.1.1.targus-getdata1: Flags [.], seq 47124:48552, ack 1, win 913, options [nop,nop,TS val 1124161 ecr 1356351,mptcp dss ack 3644063658 seq 3528772694 subseq 425545 len 1428 csum 0xbebb], length 1428
17:35:47.852348 IP 112.26.1.8.44635 > 112.26.1.1.targus-getdata1: Flags [.], seq 48552:49980, ack 1, win 913, options [nop,nop,TS val 1124222 ecr 1356464,mptcp dss ack 3644063658 seq 3528774122 subseq 426973 len 1428 csum 0x5f5f], length 1428
17:35:47.852692 IP 112.26.1.1.targus-getdata1 > 112.26.1.8.44635: Flags [.], ack 49980, win 24499, options [nop,nop,TS val 1357641 ecr 1124161,mptcp dss ack 3528745562], length 0
17:35:47.858947 IP 112.26.1.1.targus-getdata1 > 112.26.1.8.44635: Flags [.], ack 49980, win 24499, options [nop,nop,TS val 1357641 ecr 1124161,mptcp dss ack 3528745562], length 0
17:35:48.010567 IP 112.26.1.8.44635 > 112.26.1.1.targus-getdata1: Flags [.], seq 49980:51408, ack 1, win 913, options [nop,nop,TS val 1124288 ecr 1356558,mptcp dss ack 3644063658 seq 3528784118 subseq 428401 len 1428 csum 0x7db2], length 1428
17:35:48.091719 IP 112.26.1.8.44635 > 112.26.1.1.targus-getdata1: Flags [.], seq 51408:52836, ack 1, win 913, options [nop,nop,TS val 1124368 ecr 1356661,mptcp dss ack 3644063658 seq 3528785546 subseq 429829 len 1428 csum 0xcea8], length 1428
17:35:48.170831 IP 112.26.1.1.targus-getdata1 > 112.26.1.8.44635: Flags [.], ack 52836, win 24499, options [nop,nop,TS val 1357960 ecr 1124288,mptcp dss ack 3528745562], length 0
17:35:48.175475 IP 112.26.1.1.targus-getdata1 > 112.26.1.8.44635: Flags [.], ack 52836, win 24499, options [nop,nop,TS val 1357960 ecr 1124288,mptcp dss ack 3528745562], length 0
17:35:48.188366 IP 112.26.1.8.44635 > 112.26.1.1.targus-getdata1: Flags [.], seq 52836:54264, ack 1, win 913, options [nop,nop,TS val 1124368 ecr 1356661,mptcp dss ack 3644063658 seq 3528786974 subseq 431257 len 1428 csum 0x548d], length 1428
17:35:48.277828 IP 112.26.1.8.44635 > 112.26.1.1.targus-getdata1: Flags [.], seq 54264:55692, ack 1, win 913, options [nop,nop,TS val 1124498 ecr 1356788,mptcp dss ack 3644063658 seq 3528799826 subseq 432685 len 1428 csum 0xa9b6], length 1428
17:35:48.319126 IP 112.26.1.8.44635 > 112.26.1.1.targus-getdata1: Flags [.], seq 55692:57120, ack 1, win 913, options [nop,nop,TS val 1124564 ecr 1356872,mptcp dss ack 3644063658 seq 3528805538 subseq 434113 len 1428 csum 0xdde], length 1428
17:35:48.319451 IP 112.26.1.1.targus-getdata1 > 112.26.1.8.44635: Flags [.], ack 57120, win 24499, options [nop,nop,TS val 1358108 ecr 1124368,mptcp dss ack 3528745562], length 0
17:35:48.324762 IP 112.26.1.1.targus-getdata1 > 112.26.1.8.44635: Flags [.], ack 57120, win 24499, options [nop,nop,TS val 1358108 ecr 1124368,mptcp dss ack 3528745562], length 0
17:35:48.491789 IP 112.26.1.8.44635 > 112.26.1.1.targus-getdata1: Flags [.], seq 57120:58548, ack 1, win 913, options [nop,nop,TS val 1124564 ecr 1356872,mptcp dss ack 3644063658 seq 3528806966 subseq 435541 len 1428 csum 0xa042], length 1428
17:35:48.612663 IP 112.26.1.8.44635 > 112.26.1.1.targus-getdata1: Flags [.], seq 58548:59976, ack 1, win 913, options [nop,nop,TS val 1124867 ecr 1357128,mptcp dss ack 3644063658 seq 3528821246 subseq 436969 len 1428 csum 0xb044], length 1428
17:35:48.612977 IP 112.26.1.1.targus-getdata1 > 112.26.1.8.44635: Flags [.], ack 59976, win 24499, options [nop,nop,TS val 1358401 ecr 1124564,mptcp dss ack 3528745562], length 0
17:35:48.616725 IP 112.26.1.1.targus-getdata1 > 112.26.1.8.44635: Flags [.], ack 59976, win 24499, options [nop,nop,TS val 1358401 ecr 1124564,mptcp dss ack 3528745562], length 0
17:35:48.865028 IP 112.26.1.8.44635 > 112.26.1.1.targus-getdata1: Flags [.], seq 59976:61404, ack 1, win 913, options [nop,nop,TS val 1125315 ecr 1357464,mptcp dss ack 3644063658 seq 3528836954 subseq 438397 len 1428 csum 0xc423], length 1428
17:35:48.984235 IP 112.26.1.8.44635 > 112.26.1.1.targus-getdata1: Flags [.], seq 61404:62832, ack 1, win 913, options [nop,nop,TS val 1125459 ecr 1357641,mptcp dss ack 3644063658 seq 3528839810 subseq 439825 len 1428 csum 0xf91b], length 1428
17:35:48.984537 IP 112.26.1.1.targus-getdata1 > 112.26.1.8.44635: Flags [.], ack 62832, win 24499, options [nop,nop,TS val 1358773 ecr 1125315,mptcp dss ack 3528745562], length 0
17:35:48.991856 IP 112.26.1.1.targus-getdata1 > 112.26.1.8.44635: Flags [.], ack 62832, win 24499, options [nop,nop,TS val 1358773 ecr 1125315,mptcp dss ack 3528745562], length 0
17:35:49.123728 IP 112.26.1.8.44635 > 112.26.1.1.targus-getdata1: Flags [.], seq 62832:64260, ack 1, win 913, options [nop,nop,TS val 1125459 ecr 1357641,mptcp dss ack 3644063658 seq 3528841238 subseq 441253 len 1428 csum 0x18a0], length 1428
17:35:49.205940 IP 112.26.1.8.44635 > 112.26.1.1.targus-getdata1: Flags [.], seq 64260:65688, ack 1, win 913, options [nop,nop,TS val 1125632 ecr 1357960,mptcp dss ack 3644063658 seq 3528846950 subseq 442681 len 1428 csum 0x93b4], length 1428
17:35:49.289617 IP 112.26.1.8.44635 > 112.26.1.1.targus-getdata1: Flags [.], seq 65688:67116, ack 1, win 913, options [nop,nop,TS val 1125632 ecr 1357960,mptcp dss ack 3644063658 seq 3528848378 subseq 444109 len 1428 csum 0xa427], length 1428
17:35:49.289900 IP 112.26.1.1.targus-getdata1 > 112.26.1.8.44635: Flags [.], ack 67116, win 24499, options [nop,nop,TS val 1359079 ecr 1125459,mptcp dss ack 3528745562], length 0
17:35:49.295278 IP 112.26.1.1.targus-getdata1 > 112.26.1.8.44635: Flags [.], ack 67116, win 24499, options [nop,nop,TS val 1359079 ecr 1125459,mptcp dss ack 3528745562], length 0
17:35:49.362529 IP 112.26.1.8.44635 > 112.26.1.1.targus-getdata1: Flags [.], seq 67116:68544, ack 1, win 913, options [nop,nop,TS val 1125632 ecr 1357960,mptcp dss ack 3644063658 seq 3528849806 subseq 445537 len 1428 csum 0x4dd8], length 1428
17:35:49.426379 IP 112.26.1.8.44635 > 112.26.1.1.targus-getdata1: Flags [.], seq 68544:69972, ack 1, win 913, options [nop,nop,TS val 1125718 ecr 1358108,mptcp dss ack 3644063658 seq 3528855518 subseq 446965 len 1428 csum 0xe1f], length 1428
17:35:49.491843 IP 112.26.1.8.44635 > 112.26.1.1.targus-getdata1: Flags [.], seq 69972:71400, ack 1, win 913, options [nop,nop,TS val 1125718 ecr 1358108,mptcp dss ack 3644063658 seq 3528856946 subseq 448393 len 1428 csum 0x7786], length 1428
17:35:49.492027 IP 112.26.1.1.targus-getdata1 > 112.26.1.8.44635: Flags [.], ack 71400, win 24499, options [nop,nop,TS val 1359280 ecr 1125632,mptcp dss ack 3528745562], length 0
17:35:49.518272 IP 112.26.1.1.targus-getdata1 > 112.26.1.8.44635: Flags [.], ack 71400, win 24499, options [nop,nop,TS val 1359280 ecr 1125632,mptcp dss ack 3528745562], length 0
17:35:49.608436 IP 112.26.1.8.44635 > 112.26.1.1.targus-getdata1: Flags [.], seq 71400:72828, ack 1, win 913, options [nop,nop,TS val 1125718 ecr 1358108,mptcp dss ack 3644063658 seq 3528858374 subseq 449821 len 1428 csum 0xf8cb], length 1428
17:35:49.703945 IP 112.26.1.8.44635 > 112.26.1.1.targus-getdata1: Flags [.], seq 72828:74256, ack 1, win 913, options [nop,nop,TS val 1126004 ecr 1358401,mptcp dss ack 3644063658 seq 3528869798 subseq 451249 len 1428 csum 0xd090], length 1428
17:35:49.714125 IP 112.26.1.1.targus-getdata1 > 112.26.1.8.44635: Flags [.], ack 74256, win 24031, options [nop,nop,TS val 1359503 ecr 1125718,mptcp dss ack 3528775550], length 0
17:35:49.724596 IP 112.26.1.1.targus-getdata1 > 112.26.1.8.44635: Flags [.], ack 74256, win 24031, options [nop,nop,TS val 1359503 ecr 1125718,mptcp dss ack 3528775550], length 0
17:35:49.779926 IP 112.26.1.8.44635 > 112.26.1.1.targus-getdata1: Flags [.], seq 74256:75684, ack 1, win 913, options [nop,nop,TS val 1126004 ecr 1358401,mptcp dss ack 3644063658 seq 3528871226 subseq 452677 len 1428 csum 0x117b], length 1428
17:35:49.946901 IP 112.26.1.1.targus-getdata1 > 112.26.1.8.44635: Flags [.], ack 75684, win 24031, options [nop,nop,TS val 1359736 ecr 1126004,mptcp dss ack 3528775550], length 0
17:35:49.950037 IP 112.26.1.1.targus-getdata1 > 112.26.1.8.44635: Flags [.], ack 75684, win 24031, options [nop,nop,TS val 1359736 ecr 1126004,mptcp dss ack 3528775550], length 0
17:35:49.969218 IP 112.26.1.8.44635 > 112.26.1.1.targus-getdata1: Flags [.], seq 75684:77112, ack 1, win 913, options [nop,nop,TS val 1126405 ecr 1358773,mptcp dss ack 3644063658 seq 3528882650 subseq 454105 len 1428 csum 0x434b], length 1428
17:35:50.071388 IP 112.26.1.8.44635 > 112.26.1.1.targus-getdata1: Flags [.], seq 77112:78540, ack 1, win 913, options [nop,nop,TS val 1126405 ecr 1358773,mptcp dss ack 3644063658 seq 3528884078 subseq 455533 len 1428 csum 0xdb7f], length 1428
17:35:50.130902 IP 112.26.1.1.targus-getdata1 > 112.26.1.8.44635: Flags [.], ack 78540, win 23965, options [nop,nop,TS val 1359920 ecr 1126405,mptcp dss ack 3528779834], length 0
17:35:50.142694 IP 112.26.1.1.targus-getdata1 > 112.26.1.8.44635: Flags [.], ack 78540, win 23965, options [nop,nop,TS val 1359920 ecr 1126405,mptcp dss ack 3528779834], length 0
17:35:50.150502 IP 112.26.1.8.44635 > 112.26.1.1.targus-getdata1: Flags [.], seq 78540:79968, ack 1, win 913, options [nop,nop,TS val 1126405 ecr 1358773,mptcp dss ack 3644063658 seq 3528885506 subseq 456961 len 1428 csum 0x94f0], length 1428
17:35:50.275262 IP 112.26.1.8.44635 > 112.26.1.1.targus-getdata1: Flags [.], seq 79968:81396, ack 1, win 913, options [nop,nop,TS val 1126405 ecr 1358773,mptcp dss ack 3644063658 seq 3528886934 subseq 458389 len 1428 csum 0x2e36], length 1428
17:35:50.275583 IP 112.26.1.1.targus-getdata1 > 112.26.1.8.44635: Flags [.], ack 81396, win 23852, options [nop,nop,TS val 1360064 ecr 1126405,mptcp dss ack 3528811250], length 0
17:35:50.283172 IP 112.26.1.1.targus-getdata1 > 112.26.1.8.44635: Flags [.], ack 81396, win 23852, options [nop,nop,TS val 1360064 ecr 1126405,mptcp dss ack 3528811250], length 0
17:35:50.401979 IP 112.26.1.8.44635 > 112.26.1.1.targus-getdata1: Flags [.], seq 81396:82824, ack 1, win 913, options [nop,nop,TS val 1126759 ecr 1359079,mptcp dss ack 3644063658 seq 3528895502 subseq 459817 len 1428 csum 0xf014], length 1428
17:35:50.489082 IP 112.26.1.8.44635 > 112.26.1.1.targus-getdata1: Flags [.], seq 82824:84252, ack 1, win 913, options [nop,nop,TS val 1126759 ecr 1359079,mptcp dss ack 3644063658 seq 3528896930 subseq 461245 len 1428 csum 0x800a], length 1428
17:35:50.544645 IP 112.26.1.1.targus-getdata1 > 112.26.1.8.44635: Flags [.], ack 84252, win 23803, options [nop,nop,TS val 1360333 ecr 1126759,mptcp dss ack 3528818390], length 0
17:35:50.553898 IP 112.26.1.1.targus-getdata1 > 112.26.1.8.44635: Flags [.], ack 84252, win 23803, options [nop,nop,TS val 1360333 ecr 1126759,mptcp dss ack 3528818390], length 0
17:35:50.661655 IP 112.26.1.8.44635 > 112.26.1.1.targus-getdata1: Flags [.], seq 84252:85680, ack 1, win 913, options [nop,nop,TS val 1126759 ecr 1359079,mptcp dss ack 3644063658 seq 3528898358 subseq 462673 len 1428 csum 0x66f], length 1428
17:35:50.729604 IP 112.26.1.8.44635 > 112.26.1.1.targus-getdata1: Flags [.], seq 85680:87108, ack 1, win 913, options [nop,nop,TS val 1126759 ecr 1359079,mptcp dss ack 3644063658 seq 3528899786 subseq 464101 len 1428 csum 0xce02], length 1428
17:35:50.730031 IP 112.26.1.1.targus-getdata1 > 112.26.1.8.44635: Flags [.], ack 87108, win 23836, options [nop,nop,TS val 1360519 ecr 1126759,mptcp dss ack 3528829814], length 0
17:35:50.747413 IP 112.26.1.1.targus-getdata1 > 112.26.1.8.44635: Flags [.], ack 87108, win 23836, options [nop,nop,TS val 1360519 ecr 1126759,mptcp dss ack 3528829814], length 0
17:35:50.880003 IP 112.26.1.8.44635 > 112.26.1.1.targus-getdata1: Flags [.], seq 88536:89964, ack 1, win 913, options [nop,nop,TS val 1126831 ecr 1359280,mptcp dss ack 3644063658 seq 3528906926 subseq 466957 len 1428 csum 0x4ac1], length 1428
17:35:50.880310 IP 112.26.1.1.targus-getdata1 > 112.26.1.8.44635: Flags [.], ack 87108, win 23836, options [nop,nop,TS val 1360669 ecr 1126759,nop,nop,sack 1 {88536:89964},mptcp dss ack 3528829814], length 0
17:35:50.885636 IP 112.26.1.1.targus-getdata1 > 112.26.1.8.44635: Flags [.], ack 87108, win 23836, options [nop,nop,TS val 1360669 ecr 1126759,nop,nop,sack 1 {88536:89964},mptcp dss ack 3528829814], length 0
17:35:51.052666 IP 112.26.1.8.44635 > 112.26.1.1.targus-getdata1: Flags [.], seq 92820:94248, ack 1, win 913, options [nop,nop,TS val 1126831 ecr 1359280,mptcp dss ack 3644063658 seq 3528911210 subseq 471241 len 1428 csum 0x4714], length 1428
17:35:51.052998 IP 112.26.1.1.targus-getdata1 > 112.26.1.8.44635: Flags [.], ack 87108, win 23890, options [nop,nop,TS val 1360842 ecr 1126759,nop,nop,sack 2 {92820:94248}{88536:89964},mptcp dss ack 3528842666], length 0
17:35:51.067647 IP 112.26.1.1.targus-getdata1 > 112.26.1.8.44635: Flags [.], ack 87108, win 23890, options [nop,nop,TS val 1360842 ecr 1126759,nop,nop,sack 2 {92820:94248}{88536:89964},mptcp dss ack 3528842666], length 0
17:35:51.146859 IP 112.26.1.8.44635 > 112.26.1.1.targus-getdata1: Flags [.], seq 94248:95676, ack 1, win 913, options [nop,nop,TS val 1127150 ecr 1359503,mptcp dss ack 3644063658 seq 3528926918 subseq 472669 len 1428 csum 0xa4d], length 1428
17:35:51.147235 IP 112.26.1.1.targus-getdata1 > 112.26.1.8.44635: Flags [.], ack 87108, win 23890, options [nop,nop,TS val 1360936 ecr 1126759,nop,nop,sack 2 {92820:95676}{88536:89964},mptcp dss ack 3528842666], length 0
17:35:51.168041 IP 112.26.1.1.targus-getdata1 > 112.26.1.8.44635: Flags [.], ack 87108, win 23890, options [nop,nop,TS val 1360936 ecr 1126759,nop,nop,sack 2 {92820:95676}{88536:89964},mptcp dss ack 3528842666], length 0
17:35:51.229740 IP 112.26.1.8.44635 > 112.26.1.1.targus-getdata1: Flags [.], seq 95676:97104, ack 1, win 913, options [nop,nop,TS val 1127150 ecr 1359503,mptcp dss ack 3644063658 seq 3528928346 subseq 474097 len 1428 csum 0x642], length 1428
17:35:51.230028 IP 112.26.1.1.targus-getdata1 > 112.26.1.8.44635: Flags [.], ack 87108, win 23890, options [nop,nop,TS val 1361019 ecr 1126759,nop,nop,sack 2 {92820:97104}{88536:89964},mptcp dss ack 3528842666], length 0
17:35:51.286749 IP 112.26.1.1.targus-getdata1 > 112.26.1.8.44635: Flags [.], ack 87108, win 23890, options [nop,nop,TS val 1361019 ecr 1126759,nop,nop,sack 2 {92820:97104}{88536:89964},mptcp dss ack 3528842666], length 0
17:35:51.311209 IP 112.26.1.8.44635 > 112.26.1.1.targus-getdata1: Flags [.], seq 97104:98532, ack 1, win 913, options [nop,nop,TS val 1127510 ecr 1359736,mptcp dss ack 3644063658 seq 3528942626 subseq 475525 len 1428 csum 0xc4a], length 1428
17:35:51.311525 IP 112.26.1.1.targus-getdata1 > 112.26.1.8.44635: Flags [.], ack 87108, win 24182, options [nop,nop,TS val 1361100 ecr 1126759,nop,nop,sack 2 {92820:98532}{88536:89964},mptcp dss ack 3528881222], length 0
17:35:51.384062 IP 112.26.1.1.targus-getdata1 > 112.26.1.8.44635: Flags [.], ack 87108, win 24182, options [nop,nop,TS val 1361100 ecr 1126759,nop,nop,sack 2 {92820:98532}{88536:89964},mptcp dss ack 3528881222], length 0
17:35:51.451473 IP 112.26.1.8.44635 > 112.26.1.1.targus-getdata1: Flags [.], seq 98532:99960, ack 1, win 913, options [nop,nop,TS val 1127736 ecr 1359920,mptcp dss ack 3644063658 seq 3528958334 subseq 476953 len 1428 csum 0xcc8b], length 1428
17:35:51.451708 IP 112.26.1.1.targus-getdata1 > 112.26.1.8.44635: Flags [.], ack 87108, win 24182, options [nop,nop,TS val 1361240 ecr 1126759,nop,nop,sack 2 {92820:99960}{88536:89964},mptcp dss ack 3528881222], length 0
17:35:51.467139 IP 112.26.1.1.targus-getdata1 > 112.26.1.8.44635: Flags [.], ack 87108, win 24182, options [nop,nop,TS val 1361240 ecr 1126759,nop,nop,sack 2 {92820:99960}{88536:89964},mptcp dss ack 3528881222], length 0
17:35:51.572485 IP 112.26.1.8.44635 > 112.26.1.1.targus-getdata1: Flags [.], seq 99960:101388, ack 1, win 913, options [nop,nop,TS val 1127736 ecr 1359920,mptcp dss ack 3644063658 seq 3528959762 subseq 478381 len 1428 csum 0x6114], length 1428
17:35:51.572805 IP 112.26.1.1.targus-getdata1 > 112.26.1.8.44635: Flags [.], ack 87108, win 24182, options [nop,nop,TS val 1361361 ecr 1126759,nop,nop,sack 2 {92820:101388}{88536:89964},mptcp dss ack 3528881222], length 0
17:35:51.579131 IP 112.26.1.1.targus-getdata1 > 112.26.1.8.44635: Flags [.], ack 87108, win 24182, options [nop,nop,TS val 1361361 ecr 1126759,nop,nop,sack 2 {92820:101388}{88536:89964},mptcp dss ack 3528881222], length 0
17:35:51.733082 IP 112.26.1.8.44635 > 112.26.1.1.targus-getdata1: Flags [.], seq 102816:104244, ack 1, win 913, options [nop,nop,TS val 1127892 ecr 1360064,mptcp dss ack 3644063658 seq 3528964046 subseq 481237 len 1428 csum 0xe83e], length 1428
17:35:51.733465 IP 112.26.1.1.targus-getdata1 > 112.26.1.8.44635: Flags [.], ack 87108, win 24182, options [nop,nop,TS val 1361522 ecr 1126759,nop,nop,sack 2 {102816:104244}{92820:101388},mptcp dss ack 3528881222], length 0
17:35:51.740509 IP 112.26.1.1.targus-getdata1 > 112.26.1.8.44635: Flags [.], ack 87108, win 24182, options [nop,nop,TS val 1361522 ecr 1126759,nop,nop,sack 2 {102816:104244}{92820:101388},mptcp dss ack 3528881222], length 0
17:35:51.972592 IP 112.26.1.8.44635 > 112.26.1.1.targus-getdata1: Flags [P.], seq 107100:108528, ack 1, win 913, options [nop,nop,TS val 1128269 ecr 1360519,mptcp dss ack 3644063658 seq 3528985466 subseq 485521 len 1428 csum 0xe633], length 1428
17:35:51.972915 IP 112.26.1.1.targus-getdata1 > 112.26.1.8.44635: Flags [.], ack 87108, win 24182, options [nop,nop,TS val 1361761 ecr 1126759,nop,nop,sack 2 {107100:108528}{102816:104244},mptcp dss ack 3528881222], length 0
17:35:51.980923 IP 112.26.1.1.targus-getdata1 > 112.26.1.8.44635: Flags [.], ack 87108, win 24182, options [nop,nop,TS val 1361761 ecr 1126759,nop,nop,sack 2 {107100:108528}{102816:104244},mptcp dss ack 3528881222], length 0
17:35:52.199840 IP 112.26.1.8.44635 > 112.26.1.1.targus-getdata1: Flags [.], seq 109956:111384, ack 1, win 913, options [nop,nop,TS val 1128269 ecr 1360519,mptcp dss ack 3644063658 seq 3528988322 subseq 488377 len 1428 csum 0x2178], length 1428
17:35:52.200136 IP 112.26.1.1.targus-getdata1 > 112.26.1.8.44635: Flags [.], ack 87108, win 24182, options [nop,nop,TS val 1361989 ecr 1126759,nop,nop,sack 2 {109956:111384}{107100:108528},mptcp dss ack 3528881222], length 0
17:35:52.205329 IP 112.26.1.1.targus-getdata1 > 112.26.1.8.44635: Flags [.], ack 87108, win 24182, options [nop,nop,TS val 1361989 ecr 1126759,nop,nop,sack 2 {109956:111384}{107100:108528},mptcp dss ack 3528881222], length 0
