22:17:43.746576 IP 112.26.1.8.57695 > 112.26.1.1.targus-getdata1: Flags [S], seq 1509845361, win 65535, options [mss 1460,sackOK,TS val 2163825 ecr 0,nop,wscale 6,mptcp join id 3 token 0x7ffa4513 nonce 0x3ff58da7], length 0
22:17:43.746922 IP 112.26.1.1.targus-getdata1 > 112.26.1.8.57695: Flags [S.], seq 3722104004, ack 1509845362, win 65535, options [mss 1460,sackOK,TS val 2381676 ecr 2163825,nop,wscale 6,mptcp join id 3 hmac 0x50ef7ea63c022f56 nonce 0xaa5a5072], length 0
22:17:43.837915 IP 112.26.1.1.targus-getdata1 > 112.26.1.8.57695: Flags [S.], seq 3722104004, ack 1509845362, win 65535, options [mss 1460,sackOK,TS val 2381676 ecr 2163825,nop,wscale 6,mptcp join id 3 hmac 0x50ef7ea63c022f56 nonce 0xaa5a5072], length 0
22:17:43.931025 IP 112.26.1.8.57695 > 112.26.1.1.targus-getdata1: Flags [.], ack 1, win 2738, options [nop,nop,TS val 2163943 ecr 2381676,mptcp join hmac 0xd27f82a0c17a705e1098911172d9bf5b00635832], length 0
22:17:43.931338 IP 112.26.1.1.targus-getdata1 > 112.26.1.8.57695: Flags [.], ack 1, win 2678, options [nop,nop,TS val 2381860 ecr 2163943,mptcp dss ack 643515087], length 0
22:17:43.933776 IP 112.26.1.1.targus-getdata1 > 112.26.1.8.57695: Flags [.], ack 1, win 2678, options [nop,nop,TS val 2381860 ecr 2163943,mptcp dss ack 643515087], length 0
22:17:44.214628 IP 112.26.1.1.targus-getdata1 > 112.26.1.8.57695: Flags [P.], seq 1:2, ack 1, win 4017, options [nop,nop,TS val 2382144 ecr 2163943,mptcp dss ack 643515087 seq 1138386316 subseq 1 len 1 csum 0x9c6e], length 1
22:18:23.898297 IP 112.26.1.1.targus-getdata1 > 112.26.1.8.44809: Flags [.], ack 1382520770, win 24131, options [nop,nop,TS val 2421132 ecr 2199271,nop,nop,sack 1 {1429:25705},mptcp dss ack 4083559258], length 0
22:18:23.958745 IP 112.26.1.8.44809 > 112.26.1.1.targus-getdata1: Flags [.], seq 1:1429, ack 0, win 4107, options [nop,nop,TS val 2202969 ecr 2419715,mptcp dss ack 1353584156 seq 4083559258 subseq 292741 len 1428 csum 0xec61], length 1428
22:18:23.959179 IP 112.26.1.1.targus-getdata1 > 112.26.1.8.44809: Flags [.], ack 31417, win 23043, options [nop,nop,TS val 2421888 ecr 2202969,mptcp dss ack 4083674926], length 0
22:18:24.021163 IP 112.26.1.8.44809 > 112.26.1.1.targus-getdata1: Flags [.], seq 31417:32845, ack 0, win 4107, options [nop,nop,TS val 2203057 ecr 2419715,mptcp dss ack 1353584156 seq 4083696346 subseq 324157 len 1428 csum 0x8bdb], length 1428
22:18:24.021549 IP 112.26.1.1.targus-getdata1 > 112.26.1.8.44809: Flags [.], ack 32845, win 24293, options [nop,nop,TS val 2421951 ecr 2203057,mptcp dss ack 4083674926], length 0
22:18:24.099130 IP 112.26.1.1.targus-getdata1 > 112.26.1.8.44809: Flags [.], ack 1, win 24131, options [nop,nop,TS val 2421299 ecr 2199271,nop,nop,sack 1 {1429:27133},mptcp dss ack 4083559258], length 0
22:18:24.159361 IP 112.26.1.1.targus-getdata1 > 112.26.1.8.44809: Flags [.], ack 1, win 24131, options [nop,nop,TS val 2421450 ecr 2199271,nop,nop,sack 1 {1429:28561},mptcp dss ack 4083559258], length 0
22:18:24.222482 IP 112.26.1.8.44809 > 112.26.1.1.targus-getdata1: Flags [.], seq 32845:34273, ack 0, win 4107, options [nop,nop,TS val 2203225 ecr 2419972,mptcp dss ack 1353584156 seq 4083703486 subseq 325585 len 1428 csum 0xffc], length 1428
22:18:24.222824 IP 112.26.1.1.targus-getdata1 > 112.26.1.8.44809: Flags [.], ack 34273, win 24293, options [nop,nop,TS val 2422151 ecr 2203225,mptcp dss ack 4083674926], length 0
22:18:24.309530 IP 112.26.1.1.targus-getdata1 > 112.26.1.8.44809: Flags [.], ack 1, win 24131, options [nop,nop,TS val 2421661 ecr 2199271,nop,nop,sack 1 {1429:29989},mptcp dss ack 4083559258], length 0
22:18:24.422881 IP 112.26.1.1.targus-getdata1 > 112.26.1.8.44809: Flags [.], ack 1, win 24131, options [nop,nop,TS val 2421756 ecr 2199271,nop,nop,sack 1 {1429:31417},mptcp dss ack 4083559258], length 0
22:18:24.472016 IP 112.26.1.8.44809 > 112.26.1.1.targus-getdata1: Flags [.], seq 34273:35701, ack 0, win 4107, options [nop,nop,TS val 2203485 ecr 2420128,mptcp dss ack 1353584156 seq 4083710626 subseq 327013 len 1428 csum 0xca36], length 1428
22:18:24.472379 IP 112.26.1.1.targus-getdata1 > 112.26.1.8.44809: Flags [.], ack 35701, win 24293, options [nop,nop,TS val 2422401 ecr 2203485,mptcp dss ack 4083674926], length 0
22:18:24.579376 IP 112.26.1.1.targus-getdata1 > 112.26.1.8.44809: Flags [.], ack 31417, win 23043, options [nop,nop,TS val 2421888 ecr 2202969,mptcp dss ack 4083674926], length 0
22:18:24.645717 IP 112.26.1.8.44809 > 112.26.1.1.targus-getdata1: Flags [.], seq 35701:37129, ack 0, win 4107, options [nop,nop,TS val 2203660 ecr 2420332,mptcp dss ack 1353584156 seq 4083723478 subseq 328441 len 1428 csum 0xb9a], length 1428
22:18:24.645973 IP 112.26.1.1.targus-getdata1 > 112.26.1.8.44809: Flags [.], ack 37129, win 24293, options [nop,nop,TS val 2422575 ecr 2203660,mptcp dss ack 4083674926], length 0
22:18:24.706480 IP 112.26.1.1.targus-getdata1 > 112.26.1.8.44809: Flags [.], ack 32845, win 24293, options [nop,nop,TS val 2421951 ecr 2203057,mptcp dss ack 4083674926], length 0
22:18:24.779225 IP 112.26.1.8.44809 > 112.26.1.1.targus-getdata1: Flags [.], seq 37129:38557, ack 0, win 4107, options [nop,nop,TS val 2203834 ecr 2420471,mptcp dss ack 1353584156 seq 4083736330 subseq 329869 len 1428 csum 0x49a6], length 1428
22:18:24.779601 IP 112.26.1.1.targus-getdata1 > 112.26.1.8.44809: Flags [.], ack 38557, win 24293, options [nop,nop,TS val 2422708 ecr 2203834,mptcp dss ack 4083674926], length 0
22:18:24.871651 IP 112.26.1.1.targus-getdata1 > 112.26.1.8.44809: Flags [.], ack 34273, win 24293, options [nop,nop,TS val 2422151 ecr 2203225,mptcp dss ack 4083674926], length 0
22:18:24.959350 IP 112.26.1.8.44809 > 112.26.1.1.targus-getdata1: Flags [.], seq 38557:39985, ack 0, win 4107, options [nop,nop,TS val 2204218 ecr 2420769,mptcp dss ack 1353584156 seq 4083753466 subseq 331297 len 1428 csum 0xeebc], length 1428
22:18:24.959717 IP 112.26.1.1.targus-getdata1 > 112.26.1.8.44809: Flags [.], ack 39985, win 24293, options [nop,nop,TS val 2422888 ecr 2204218,mptcp dss ack 4083674926], length 0
22:18:25.068310 IP 112.26.1.1.targus-getdata1 > 112.26.1.8.44809: Flags [.], ack 35701, win 24293, options [nop,nop,TS val 2422401 ecr 2203485,mptcp dss ack 4083674926], length 0
22:18:25.107262 IP 112.26.1.8.44809 > 112.26.1.1.targus-getdata1: Flags [.], seq 39985:41413, ack 0, win 4107, options [nop,nop,TS val 2204408 ecr 2421299,mptcp dss ack 1353584156 seq 4083762034 subseq 332725 len 1428 csum 0xfd03], length 1428
22:18:25.107620 IP 112.26.1.1.targus-getdata1 > 112.26.1.8.44809: Flags [.], ack 41413, win 24293, options [nop,nop,TS val 2423037 ecr 2204408,mptcp dss ack 4083674926], length 0
22:18:25.176469 IP 112.26.1.1.targus-getdata1 > 112.26.1.8.44809: Flags [.], ack 37129, win 24293, options [nop,nop,TS val 2422575 ecr 2203660,mptcp dss ack 4083674926], length 0
22:18:25.239213 IP 112.26.1.8.44809 > 112.26.1.1.targus-getdata1: Flags [.], seq 41413:42841, ack 0, win 4107, options [nop,nop,TS val 2204578 ecr 2421450,mptcp dss ack 1353584156 seq 4083774886 subseq 334153 len 1428 csum 0x28ff], length 1428
22:18:25.239595 IP 112.26.1.1.targus-getdata1 > 112.26.1.8.44809: Flags [.], ack 42841, win 24293, options [nop,nop,TS val 2423169 ecr 2204578,mptcp dss ack 4083674926], length 0
22:18:25.323295 IP 112.26.1.1.targus-getdata1 > 112.26.1.8.44809: Flags [.], ack 38557, win 24293, options [nop,nop,TS val 2422708 ecr 2203834,mptcp dss ack 4083674926], length 0
22:18:25.374723 IP 112.26.1.8.44809 > 112.26.1.1.targus-getdata1: Flags [.], seq 42841:44269, ack 0, win 4107, options [nop,nop,TS val 2204665 ecr 2421661,mptcp dss ack 1353584156 seq 4083776314 subseq 335581 len 1428 csum 0xd90], length 1428
22:18:25.375071 IP 112.26.1.1.targus-getdata1 > 112.26.1.8.44809: Flags [.], ack 44269, win 24293, options [nop,nop,TS val 2423304 ecr 2204665,mptcp dss ack 4083674926], length 0
22:18:25.467971 IP 112.26.1.1.targus-getdata1 > 112.26.1.8.44809: Flags [.], ack 39985, win 24293, options [nop,nop,TS val 2422888 ecr 2204218,mptcp dss ack 4083674926], length 0
22:18:25.548889 IP 112.26.1.8.44809 > 112.26.1.1.targus-getdata1: Flags [.], seq 44269:45697, ack 0, win 4107, options [nop,nop,TS val 2204807 ecr 2421756,mptcp dss ack 1353584156 seq 4083780598 subseq 337009 len 1428 csum 0x735e], length 1428
22:18:25.549249 IP 112.26.1.1.targus-getdata1 > 112.26.1.8.44809: Flags [.], ack 45697, win 24182, options [nop,nop,TS val 2423478 ecr 2204807,mptcp dss ack 4083713482], length 0
22:18:25.599852 IP 112.26.1.1.targus-getdata1 > 112.26.1.8.44809: Flags [.], ack 41413, win 24293, options [nop,nop,TS val 2423037 ecr 2204408,mptcp dss ack 4083674926], length 0
22:18:25.677831 IP 112.26.1.8.44809 > 112.26.1.1.targus-getdata1: Flags [.], seq 45697:47125, ack 0, win 4107, options [nop,nop,TS val 2204945 ecr 2421888,mptcp dss ack 1353584156 seq 4083792022 subseq 338437 len 1428 csum 0x3e61], length 1428
22:18:25.678204 IP 112.26.1.1.targus-getdata1 > 112.26.1.8.44809: Flags [.], ack 47125, win 24182, options [nop,nop,TS val 2423607 ecr 2204945,mptcp dss ack 4083713482], length 0
22:18:25.762941 IP 112.26.1.1.targus-getdata1 > 112.26.1.8.44809: Flags [.], ack 42841, win 24293, options [nop,nop,TS val 2423169 ecr 2204578,mptcp dss ack 4083674926], length 0
22:18:25.844528 IP 112.26.1.1.targus-getdata1 > 112.26.1.8.44809: Flags [.], ack 44269, win 24293, options [nop,nop,TS val 2423304 ecr 2204665,mptcp dss ack 4083674926], length 0
22:18:25.912866 IP 112.26.1.8.44809 > 112.26.1.1.targus-getdata1: Flags [.], seq 47125:48553, ack 0, win 4107, options [nop,nop,TS val 2205105 ecr 2421951,mptcp dss ack 1353584156 seq 4083797734 subseq 339865 len 1428 csum 0x2b58], length 1428
22:18:25.913160 IP 112.26.1.1.targus-getdata1 > 112.26.1.8.44809: Flags [.], ack 48553, win 24182, options [nop,nop,TS val 2423842 ecr 2205105,mptcp dss ack 4083713482], length 0
22:18:25.952868 IP 112.26.1.1.targus-getdata1 > 112.26.1.8.44809: Flags [.], ack 45697, win 24182, options [nop,nop,TS val 2423478 ecr 2204807,mptcp dss ack 4083713482], length 0
22:18:26.025580 IP 112.26.1.8.44809 > 112.26.1.1.targus-getdata1: Flags [.], seq 48553:49981, ack 0, win 4107, options [nop,nop,TS val 2205360 ecr 2422151,mptcp dss ack 1353584156 seq 4083807730 subseq 341293 len 1428 csum 0xa5b], length 1428
22:18:26.025867 IP 112.26.1.1.targus-getdata1 > 112.26.1.8.44809: Flags [.], ack 49981, win 24182, options [nop,nop,TS val 2423954 ecr 2205360,mptcp dss ack 4083713482], length 0
22:18:26.135270 IP 112.26.1.1.targus-getdata1 > 112.26.1.8.44809: Flags [.], ack 47125, win 24182, options [nop,nop,TS val 2423607 ecr 2204945,mptcp dss ack 4083713482], length 0
22:18:26.237878 IP 112.26.1.8.44809 > 112.26.1.1.targus-getdata1: Flags [.], seq 49981:51409, ack 0, win 4107, options [nop,nop,TS val 2205360 ecr 2422151,mptcp dss ack 1353584156 seq 4083809158 subseq 342721 len 1428 csum 0x61a1], length 1428
22:18:26.238186 IP 112.26.1.1.targus-getdata1 > 112.26.1.8.44809: Flags [.], ack 51409, win 24182, options [nop,nop,TS val 2424167 ecr 2205360,mptcp dss ack 4083713482], length 0
22:18:26.326443 IP 112.26.1.1.targus-getdata1 > 112.26.1.8.44809: Flags [.], ack 48553, win 24182, options [nop,nop,TS val 2423842 ecr 2205105,mptcp dss ack 4083713482], length 0
22:18:26.426663 IP 112.26.1.8.44809 > 112.26.1.1.targus-getdata1: Flags [.], seq 51409:52837, ack 0, win 4107, options [nop,nop,TS val 2205592 ecr 2422401,mptcp dss ack 1353584156 seq 4083744898 subseq 344149 len 1428 csum 0x1466], length 1428
22:18:26.467818 IP 112.26.1.1.targus-getdata1 > 112.26.1.8.44809: Flags [.], ack 52837, win 24182, options [nop,nop,TS val 2424397 ecr 2205592,mptcp dss ack 4083713482], length 0
22:18:26.476725 IP 112.26.1.1.targus-getdata1 > 112.26.1.8.44809: Flags [.], ack 49981, win 24182, options [nop,nop,TS val 2423954 ecr 2205360,mptcp dss ack 4083713482], length 0
22:18:26.561859 IP 112.26.1.8.44809 > 112.26.1.1.targus-getdata1: Flags [.], seq 52837:54265, ack 0, win 4107, options [nop,nop,TS val 2205647 ecr 2422575,mptcp dss ack 1353584156 seq 4083746326 subseq 345577 len 1428 csum 0xfb15], length 1428
22:18:26.636734 IP 112.26.1.1.targus-getdata1 > 112.26.1.8.44809: Flags [.], ack 51409, win 24182, options [nop,nop,TS val 2424167 ecr 2205360,mptcp dss ack 4083713482], length 0
22:18:26.646870 IP 112.26.1.1.targus-getdata1 > 112.26.1.8.44809: Flags [.], ack 54265, win 24182, options [nop,nop,TS val 2424576 ecr 2205647,mptcp dss ack 4083713482], length 0
22:18:26.706253 IP 112.26.1.8.44809 > 112.26.1.1.targus-getdata1: Flags [.], seq 54265:55693, ack 0, win 4107, options [nop,nop,TS val 2205884 ecr 2422708,mptcp dss ack 1353584156 seq 4083764890 subseq 347005 len 1428 csum 0xccc7], length 1428
22:18:26.778455 IP 112.26.1.8.44809 > 112.26.1.1.targus-getdata1: Flags [.], seq 55693:57121, ack 0, win 4107, options [nop,nop,TS val 2205953 ecr 2422888,mptcp dss ack 1353584156 seq 4083767746 subseq 348433 len 1428 csum 0x7b0c], length 1428
22:18:26.865554 IP 112.26.1.1.targus-getdata1 > 112.26.1.8.44809: Flags [.], ack 52837, win 24182, options [nop,nop,TS val 2424397 ecr 2205592,mptcp dss ack 4083713482], length 0
22:18:26.910928 IP 112.26.1.1.targus-getdata1 > 112.26.1.8.44809: Flags [.], ack 57121, win 24182, options [nop,nop,TS val 2424840 ecr 2205884,mptcp dss ack 4083713482], length 0
22:18:26.919680 IP 112.26.1.8.44809 > 112.26.1.1.targus-getdata1: Flags [.], seq 57121:58549, ack 0, win 4107, options [nop,nop,TS val 2206195 ecr 2423037,mptcp dss ack 1353584156 seq 4083799162 subseq 349861 len 1428 csum 0xc6ba], length 1428
22:18:27.031049 IP 112.26.1.1.targus-getdata1 > 112.26.1.8.44809: Flags [.], ack 54265, win 24182, options [nop,nop,TS val 2424576 ecr 2205647,mptcp dss ack 4083713482], length 0
22:18:27.113207 IP 112.26.1.8.44809 > 112.26.1.1.targus-getdata1: Flags [.], seq 58549:59977, ack 0, win 4107, options [nop,nop,TS val 2206287 ecr 2423169,mptcp dss ack 1353584156 seq 4083806302 subseq 351289 len 1428 csum 0x5efd], length 1428
22:18:27.113455 IP 112.26.1.1.targus-getdata1 > 112.26.1.8.44809: Flags [.], ack 59977, win 23973, options [nop,nop,TS val 2425042 ecr 2206195,mptcp dss ack 4083737758], length 0
22:18:27.191096 IP 112.26.1.8.44809 > 112.26.1.1.targus-getdata1: Flags [.], seq 59977:61405, ack 0, win 4107, options [nop,nop,TS val 2206287 ecr 2423169,mptcp dss ack 1353584156 seq 4083813442 subseq 352717 len 1428 csum 0xa329], length 1428
22:18:27.264374 IP 112.26.1.1.targus-getdata1 > 112.26.1.8.44809: Flags [.], ack 57121, win 24182, options [nop,nop,TS val 2424840 ecr 2205884,mptcp dss ack 4083713482], length 0
22:18:27.315298 IP 112.26.1.8.44809 > 112.26.1.1.targus-getdata1: Flags [.], seq 61405:62833, ack 0, win 4107, options [nop,nop,TS val 2206409 ecr 2423304,mptcp dss ack 1353584156 seq 4083814870 subseq 354145 len 1428 csum 0x1991], length 1428
22:18:27.315620 IP 112.26.1.1.targus-getdata1 > 112.26.1.8.44809: Flags [.], ack 62833, win 24167, options [nop,nop,TS val 2425245 ecr 2206287,mptcp dss ack 4083769174], length 0
22:18:27.365608 IP 112.26.1.1.targus-getdata1 > 112.26.1.8.44809: Flags [.], ack 59977, win 23973, options [nop,nop,TS val 2425042 ecr 2206195,mptcp dss ack 4083737758], length 0
22:18:27.414642 IP 112.26.1.8.44809 > 112.26.1.1.targus-getdata1: Flags [.], seq 62833:64261, ack 0, win 4107, options [nop,nop,TS val 2206589 ecr 2423478,mptcp dss ack 1353584156 seq 4083824866 subseq 355573 len 1428 csum 0x2e6a], length 1428
22:18:27.507853 IP 112.26.1.1.targus-getdata1 > 112.26.1.8.44809: Flags [.], ack 62833, win 24167, options [nop,nop,TS val 2425245 ecr 2206287,mptcp dss ack 4083769174], length 0
22:18:27.598571 IP 112.26.1.8.44809 > 112.26.1.1.targus-getdata1: Flags [.], seq 64261:65689, ack 0, win 4107, options [nop,nop,TS val 2206750 ecr 2423607,mptcp dss ack 1353584156 seq 4083829150 subseq 357001 len 1428 csum 0x5ba6], length 1428
22:18:27.598853 IP 112.26.1.1.targus-getdata1 > 112.26.1.8.44809: Flags [.], ack 65689, win 24540, options [nop,nop,TS val 2425528 ecr 2206589,mptcp dss ack 4083817726], length 0
22:18:27.652305 IP 112.26.1.8.44809 > 112.26.1.1.targus-getdata1: Flags [.], seq 65689:67117, ack 0, win 4107, options [nop,nop,TS val 2207001 ecr 2423842,mptcp dss ack 1353584156 seq 4083839146 subseq 358429 len 1428 csum 0xb293], length 1428
22:18:27.753767 IP 112.26.1.1.targus-getdata1 > 112.26.1.8.44809: Flags [.], ack 65689, win 24540, options [nop,nop,TS val 2425528 ecr 2206589,mptcp dss ack 4083817726], length 0
22:18:27.808635 IP 112.26.1.8.44809 > 112.26.1.1.targus-getdata1: Flags [.], seq 67117:68545, ack 0, win 4107, options [nop,nop,TS val 2207143 ecr 2423954,mptcp dss ack 1353584156 seq 4083843430 subseq 359857 len 1428 csum 0x885a], length 1428
22:18:27.808868 IP 112.26.1.1.targus-getdata1 > 112.26.1.8.44809: Flags [.], ack 68545, win 24540, options [nop,nop,TS val 2425738 ecr 2207001,mptcp dss ack 4083817726], length 0
22:18:27.913885 IP 112.26.1.1.targus-getdata1 > 112.26.1.8.44809: Flags [.], ack 68545, win 24540, options [nop,nop,TS val 2425738 ecr 2207001,mptcp dss ack 4083817726], length 0
22:18:27.977287 IP 112.26.1.8.44809 > 112.26.1.1.targus-getdata1: Flags [.], seq 68545:69973, ack 0, win 4107, options [nop,nop,TS val 2207371 ecr 2424167,mptcp dss ack 1353584156 seq 4083854854 subseq 361285 len 1428 csum 0xfe8b], length 1428
22:18:28.084085 IP 112.26.1.8.44809 > 112.26.1.1.targus-getdata1: Flags [.], seq 69973:71401, ack 0, win 4107, options [nop,nop,TS val 2207559 ecr 2424397,mptcp dss ack 1353584156 seq 4083863422 subseq 362713 len 1428 csum 0x1026], length 1428
22:18:28.183337 IP 112.26.1.1.targus-getdata1 > 112.26.1.8.44809: Flags [.], ack 71401, win 24540, options [nop,nop,TS val 2426112 ecr 2207371,mptcp dss ack 4083817726], length 0
22:18:28.186997 IP 112.26.1.1.targus-getdata1 > 112.26.1.8.44809: Flags [.], ack 71401, win 24540, options [nop,nop,TS val 2426112 ecr 2207371,mptcp dss ack 4083817726], length 0
22:18:28.268489 IP 112.26.1.8.44809 > 112.26.1.1.targus-getdata1: Flags [.], seq 71401:72829, ack 0, win 4107, options [nop,nop,TS val 2207559 ecr 2424397,mptcp dss ack 1353584156 seq 4083864850 subseq 364141 len 1428 csum 0x81ea], length 1428
22:18:28.381698 IP 112.26.1.8.44809 > 112.26.1.1.targus-getdata1: Flags [.], seq 72829:74257, ack 0, win 4107, options [nop,nop,TS val 2207717 ecr 2424576,mptcp dss ack 1353584156 seq 4083870562 subseq 365569 len 1428 csum 0x4a90], length 1428
22:18:28.470417 IP 112.26.1.1.targus-getdata1 > 112.26.1.8.44809: Flags [.], ack 74257, win 24540, options [nop,nop,TS val 2426400 ecr 2207559,mptcp dss ack 4083817726], length 0
22:18:28.496844 IP 112.26.1.1.targus-getdata1 > 112.26.1.8.44809: Flags [.], ack 74257, win 24540, options [nop,nop,TS val 2426400 ecr 2207559,mptcp dss ack 4083817726], length 0
22:18:28.598993 IP 112.26.1.8.44809 > 112.26.1.1.targus-getdata1: Flags [.], seq 74257:75685, ack 0, win 4107, options [nop,nop,TS val 2207864 ecr 2424840,mptcp dss ack 1353584156 seq 4083874846 subseq 366997 len 1428 csum 0x7baa], length 1428
22:18:28.677863 IP 112.26.1.8.44809 > 112.26.1.1.targus-getdata1: Flags [.], seq 75685:77113, ack 0, win 4107, options [nop,nop,TS val 2207864 ecr 2424840,mptcp dss ack 1353584156 seq 4083876274 subseq 368425 len 1428 csum 0x5d06], length 1428
22:18:28.737252 IP 112.26.1.8.44809 > 112.26.1.1.targus-getdata1: Flags [.], seq 77113:78541, ack 0, win 4107, options [nop,nop,TS val 2208049 ecr 2425042,mptcp dss ack 1353584156 seq 4083884842 subseq 369853 len 1428 csum 0x1a38], length 1428
22:18:28.798813 IP 112.26.1.1.targus-getdata1 > 112.26.1.8.44809: Flags [.], ack 78541, win 24540, options [nop,nop,TS val 2426728 ecr 2207864,mptcp dss ack 4083817726], length 0
22:18:28.842667 IP 112.26.1.1.targus-getdata1 > 112.26.1.8.44809: Flags [.], ack 78541, win 24540, options [nop,nop,TS val 2426728 ecr 2207864,mptcp dss ack 4083817726], length 0
22:18:28.915619 IP 112.26.1.8.44809 > 112.26.1.1.targus-getdata1: Flags [.], seq 78541:79969, ack 0, win 4107, options [nop,nop,TS val 2208049 ecr 2425042,mptcp dss ack 1353584156 seq 4083886270 subseq 371281 len 1428 csum 0x300e], length 1428
22:18:29.016888 IP 112.26.1.8.44809 > 112.26.1.1.targus-getdata1: Flags [.], seq 79969:81397, ack 0, win 4107, options [nop,nop,TS val 2208260 ecr 2425245,mptcp dss ack 1353584156 seq 4083891982 subseq 372709 len 1428 csum 0x824b], length 1428
22:18:29.072835 IP 112.26.1.8.44809 > 112.26.1.1.targus-getdata1: Flags [.], seq 81397:82825, ack 0, win 4107, options [nop,nop,TS val 2208260 ecr 2425245,mptcp dss ack 1353584156 seq 4083893410 subseq 374137 len 1428 csum 0xc4a8], length 1428
22:18:29.073125 IP 112.26.1.1.targus-getdata1 > 112.26.1.8.44809: Flags [.], ack 82825, win 24540, options [nop,nop,TS val 2427002 ecr 2208049,mptcp dss ack 4083817726], length 0
22:18:29.134883 IP 112.26.1.1.targus-getdata1 > 112.26.1.8.44809: Flags [.], ack 82825, win 24540, options [nop,nop,TS val 2427002 ecr 2208049,mptcp dss ack 4083817726], length 0
22:18:29.233060 IP 112.26.1.8.44809 > 112.26.1.1.targus-getdata1: Flags [.], seq 82825:84253, ack 0, win 4107, options [nop,nop,TS val 2208260 ecr 2425245,mptcp dss ack 1353584156 seq 4083894838 subseq 375565 len 1428 csum 0x41bf], length 1428
22:18:29.279917 IP 112.26.1.8.44809 > 112.26.1.1.targus-getdata1: Flags [.], seq 84253:85681, ack 0, win 4107, options [nop,nop,TS val 2208532 ecr 2425528,mptcp dss ack 1353584156 seq 4083901978 subseq 376993 len 1428 csum 0x6bc7], length 1428
22:18:29.306398 IP 112.26.1.1.targus-getdata1 > 112.26.1.8.44809: Flags [.], ack 85681, win 24491, options [nop,nop,TS val 2427235 ecr 2208260,mptcp dss ack 4083897694], length 0
22:18:29.378347 IP 112.26.1.1.targus-getdata1 > 112.26.1.8.44809: Flags [.], ack 85681, win 24491, options [nop,nop,TS val 2427235 ecr 2208260,mptcp dss ack 4083897694], length 0
22:18:29.470989 IP 112.26.1.8.44809 > 112.26.1.1.targus-getdata1: Flags [.], seq 85681:87109, ack 0, win 4107, options [nop,nop,TS val 2208532 ecr 2425528,mptcp dss ack 1353584156 seq 4083903406 subseq 378421 len 1428 csum 0xc1db], length 1428
22:18:29.566342 IP 112.26.1.8.44809 > 112.26.1.1.targus-getdata1: Flags [.], seq 87109:88537, ack 0, win 4107, options [nop,nop,TS val 2208532 ecr 2425528,mptcp dss ack 1353584156 seq 4083904834 subseq 379849 len 1428 csum 0x4b57], length 1428
22:18:29.638132 IP 112.26.1.8.44809 > 112.26.1.1.targus-getdata1: Flags [.], seq 88537:89965, ack 0, win 4107, options [nop,nop,TS val 2208753 ecr 2425738,mptcp dss ack 1353584156 seq 4083909118 subseq 381277 len 1428 csum 0x1af2], length 1428
22:18:29.638431 IP 112.26.1.1.targus-getdata1 > 112.26.1.8.44809: Flags [.], ack 89965, win 24491, options [nop,nop,TS val 2427568 ecr 2208532,mptcp dss ack 4083897694], length 0
22:18:29.680578 IP 112.26.1.1.targus-getdata1 > 112.26.1.8.44809: Flags [.], ack 89965, win 24491, options [nop,nop,TS val 2427568 ecr 2208532,mptcp dss ack 4083897694], length 0
22:18:29.815277 IP 112.26.1.8.44809 > 112.26.1.1.targus-getdata1: Flags [.], seq 91393:92821, ack 0, win 4107, options [nop,nop,TS val 2209367 ecr 2426400,mptcp dss ack 1353584156 seq 4083934822 subseq 384133 len 1428 csum 0xd4c5], length 1428
22:18:29.815586 IP 112.26.1.1.targus-getdata1 > 112.26.1.8.44809: Flags [.], ack 89965, win 24491, options [nop,nop,TS val 2427745 ecr 2208532,nop,nop,sack 1 {91393:92821},mptcp dss ack 4083897694], length 0
22:18:29.916351 IP 112.26.1.1.targus-getdata1 > 112.26.1.8.44809: Flags [.], ack 89965, win 24491, options [nop,nop,TS val 2427745 ecr 2208532,nop,nop,sack 1 {91393:92821},mptcp dss ack 4083897694], length 0
22:18:29.998767 IP 112.26.1.8.44809 > 112.26.1.1.targus-getdata1: Flags [.], seq 92821:94249, ack 0, win 4107, options [nop,nop,TS val 2209367 ecr 2426400,mptcp dss ack 1353584156 seq 4083936250 subseq 385561 len 1428 csum 0x623a], length 1428
22:18:29.999065 IP 112.26.1.1.targus-getdata1 > 112.26.1.8.44809: Flags [.], ack 89965, win 24491, options [nop,nop,TS val 2427928 ecr 2208532,nop,nop,sack 1 {91393:94249},mptcp dss ack 4083897694], length 0
22:18:30.070035 IP 112.26.1.1.targus-getdata1 > 112.26.1.8.44809: Flags [.], ack 89965, win 24491, options [nop,nop,TS val 2427928 ecr 2208532,nop,nop,sack 1 {91393:94249},mptcp dss ack 4083897694], length 0
22:18:30.144468 IP 112.26.1.8.44809 > 112.26.1.1.targus-getdata1: Flags [.], seq 94249:95677, ack 0, win 4107, options [nop,nop,TS val 2209367 ecr 2426400,mptcp dss ack 1353584156 seq 4083937678 subseq 386989 len 1428 csum 0x2837], length 1428
22:18:30.144729 IP 112.26.1.1.targus-getdata1 > 112.26.1.8.44809: Flags [.], ack 89965, win 24491, options [nop,nop,TS val 2428073 ecr 2208532,nop,nop,sack 1 {91393:95677},mptcp dss ack 4083897694], length 0
22:18:30.242770 IP 112.26.1.1.targus-getdata1 > 112.26.1.8.44809: Flags [.], ack 89965, win 24491, options [nop,nop,TS val 2428073 ecr 2208532,nop,nop,sack 1 {91393:95677},mptcp dss ack 4083897694], length 0
22:18:30.296679 IP 112.26.1.8.44809 > 112.26.1.1.targus-getdata1: Flags [.], seq 95677:97105, ack 0, win 4107, options [nop,nop,TS val 2209367 ecr 2426400,mptcp dss ack 1353584156 seq 4083939106 subseq 388417 len 1428 csum 0xa8e7], length 1428
22:18:30.296932 IP 112.26.1.1.targus-getdata1 > 112.26.1.8.44809: Flags [.], ack 89965, win 24491, options [nop,nop,TS val 2428226 ecr 2208532,nop,nop,sack 1 {91393:97105},mptcp dss ack 4083897694], length 0
22:18:30.401853 IP 112.26.1.1.targus-getdata1 > 112.26.1.8.44809: Flags [.], ack 89965, win 24491, options [nop,nop,TS val 2428226 ecr 2208532,nop,nop,sack 1 {91393:97105},mptcp dss ack 4083897694], length 0
22:18:30.500792 IP 112.26.1.8.44809 > 112.26.1.1.targus-getdata1: Flags [.], seq 97105:98533, ack 0, win 4107, options [nop,nop,TS val 2209367 ecr 2426400,mptcp dss ack 1353584156 seq 4083940534 subseq 389845 len 1428 csum 0xc4c7], length 1428
22:18:30.501009 IP 112.26.1.1.targus-getdata1 > 112.26.1.8.44809: Flags [.], ack 89965, win 24491, options [nop,nop,TS val 2428430 ecr 2208532,nop,nop,sack 1 {91393:98533},mptcp dss ack 4083897694], length 0
22:18:30.569790 IP 112.26.1.8.44809 > 112.26.1.1.targus-getdata1: Flags [.], seq 98533:99961, ack 0, win 4107, options [nop,nop,TS val 2209367 ecr 2426400,mptcp dss ack 1353584156 seq 4083941962 subseq 391273 len 1428 csum 0x7cf4], length 1428
22:18:30.570118 IP 112.26.1.1.targus-getdata1 > 112.26.1.8.44809: Flags [.], ack 89965, win 24491, options [nop,nop,TS val 2428499 ecr 2208532,nop,nop,sack 1 {91393:99961},mptcp dss ack 4083897694], length 0
22:18:30.651201 IP 112.26.1.1.targus-getdata1 > 112.26.1.8.44809: Flags [.], ack 89965, win 24491, options [nop,nop,TS val 2428430 ecr 2208532,nop,nop,sack 1 {91393:98533},mptcp dss ack 4083897694], length 0
22:18:30.716678 IP 112.26.1.8.44809 > 112.26.1.1.targus-getdata1: Flags [.], seq 99961:101389, ack 0, win 4107, options [nop,nop,TS val 2209690 ecr 2426728,mptcp dss ack 1353584156 seq 4083953386 subseq 392701 len 1428 csum 0x3389], length 1428
22:18:30.716856 IP 112.26.1.1.targus-getdata1 > 112.26.1.8.44809: Flags [.], ack 89965, win 24491, options [nop,nop,TS val 2428645 ecr 2208532,nop,nop,sack 1 {91393:101389},mptcp dss ack 4083897694], length 0
22:18:30.800739 IP 112.26.1.1.targus-getdata1 > 112.26.1.8.44809: Flags [.], ack 89965, win 24491, options [nop,nop,TS val 2428499 ecr 2208532,nop,nop,sack 1 {91393:99961},mptcp dss ack 4083897694], length 0
22:18:30.888662 IP 112.26.1.1.targus-getdata1 > 112.26.1.8.44809: Flags [.], ack 89965, win 24491, options [nop,nop,TS val 2428645 ecr 2208532,nop,nop,sack 1 {91393:101389},mptcp dss ack 4083897694], length 0
22:18:30.999818 IP 112.26.1.8.44809 > 112.26.1.1.targus-getdata1: Flags [.], seq 102817:104245, ack 0, win 4107, options [nop,nop,TS val 2209690 ecr 2426728,mptcp dss ack 1353584156 seq 4083956242 subseq 395557 len 1428 csum 0x6c91], length 1428
22:18:30.999992 IP 112.26.1.1.targus-getdata1 > 112.26.1.8.44809: Flags [.], ack 89965, win 24491, options [nop,nop,TS val 2428928 ecr 2208532,nop,nop,sack 2 {102817:104245}{91393:101389},mptcp dss ack 4083897694], length 0
22:18:31.036918 IP 112.26.1.8.44809 > 112.26.1.1.targus-getdata1: Flags [.], seq 107101:108529, ack 0, win 4107, options [nop,nop,TS val 2209796 ecr 2427002,mptcp dss ack 1353584156 seq 4083961954 subseq 399841 len 1428 csum 0x8940], length 1428
22:18:31.037154 IP 112.26.1.1.targus-getdata1 > 112.26.1.8.44809: Flags [.], ack 89965, win 24491, options [nop,nop,TS val 2428966 ecr 2208532,nop,nop,sack 2 {107101:108529}{102817:104245},mptcp dss ack 4083897694], length 0
22:18:31.162154 IP 112.26.1.1.targus-getdata1 > 112.26.1.8.44809: Flags [.], ack 89965, win 24491, options [nop,nop,TS val 2428928 ecr 2208532,nop,nop,sack 2 {102817:104245}{91393:101389},mptcp dss ack 4083897694], length 0
22:18:31.269813 IP 112.26.1.8.44809 > 112.26.1.1.targus-getdata1: Flags [.], seq 108529:109957, ack 0, win 4107, options [nop,nop,TS val 2209796 ecr 2427002,mptcp dss ack 1353584156 seq 4083963382 subseq 401269 len 1428 csum 0x240d], length 1428
22:18:31.270085 IP 112.26.1.1.targus-getdata1 > 112.26.1.8.44809: Flags [.], ack 89965, win 24291, options [nop,nop,TS val 2429199 ecr 2208532,nop,nop,sack 2 {107101:109957}{102817:104245},mptcp dss ack 4083910546], length 0
22:18:31.348954 IP 112.26.1.1.targus-getdata1 > 112.26.1.8.44809: Flags [.], ack 89965, win 24491, options [nop,nop,TS val 2428966 ecr 2208532,nop,nop,sack 2 {107101:108529}{102817:104245},mptcp dss ack 4083897694], length 0
22:18:31.396239 IP 112.26.1.8.44809 > 112.26.1.1.targus-getdata1: Flags [.], seq 111385:112813, ack 0, win 4107, options [nop,nop,TS val 2209999 ecr 2427235,mptcp dss ack 1353584156 seq 4083970522 subseq 404125 len 1428 csum 0x6cd6], length 1428
22:18:31.396475 IP 112.26.1.1.targus-getdata1 > 112.26.1.8.44809: Flags [.], ack 89965, win 24291, options [nop,nop,TS val 2429325 ecr 2208532,nop,nop,sack 2 {111385:112813}{107101:109957},mptcp dss ack 4083910546], length 0
22:18:31.473419 IP 112.26.1.1.targus-getdata1 > 112.26.1.8.44809: Flags [.], ack 89965, win 24291, options [nop,nop,TS val 2429199 ecr 2208532,nop,nop,sack 2 {107101:109957}{102817:104245},mptcp dss ack 4083910546], length 0
22:18:31.508253 IP 112.26.1.8.44809 > 112.26.1.1.targus-getdata1: Flags [.], seq 112813:114241, ack 0, win 4107, options [nop,nop,TS val 2209999 ecr 2427235,mptcp dss ack 1353584156 seq 4083971950 subseq 405553 len 1428 csum 0x1348], length 1428
22:18:31.508454 IP 112.26.1.1.targus-getdata1 > 112.26.1.8.44809: Flags [.], ack 89965, win 24291, options [nop,nop,TS val 2429437 ecr 2208532,nop,nop,sack 2 {111385:114241}{107101:109957},mptcp dss ack 4083910546], length 0
22:18:31.586575 IP 112.26.1.1.targus-getdata1 > 112.26.1.8.44809: Flags [.], ack 89965, win 24291, options [nop,nop,TS val 2429325 ecr 2208532,nop,nop,sack 2 {111385:112813}{107101:109957},mptcp dss ack 4083910546], length 0
22:18:31.641417 IP 112.26.1.1.targus-getdata1 > 112.26.1.8.44809: Flags [.], ack 89965, win 24291, options [nop,nop,TS val 2429437 ecr 2208532,nop,nop,sack 2 {111385:114241}{107101:109957},mptcp dss ack 4083910546], length 0
22:18:31.732050 IP 112.26.1.8.44809 > 112.26.1.1.targus-getdata1: Flags [.], seq 115669:117097, ack 0, win 4107, options [nop,nop,TS val 2210770 ecr 2427745,mptcp dss ack 1353584156 seq 4083997654 subseq 408409 len 1428 csum 0x6260], length 1428
22:18:31.732278 IP 112.26.1.1.targus-getdata1 > 112.26.1.8.44809: Flags [.], ack 89965, win 24291, options [nop,nop,TS val 2429661 ecr 2208532,nop,nop,sack 2 {115669:117097}{111385:114241},mptcp dss ack 4083910546], length 0
22:18:31.845585 IP 112.26.1.8.44809 > 112.26.1.1.targus-getdata1: Flags [.], seq 117097:118525, ack 0, win 4107, options [nop,nop,TS val 2210770 ecr 2427745,mptcp dss ack 1353584156 seq 4083999082 subseq 409837 len 1428 csum 0x95bf], length 1428
22:18:31.845815 IP 112.26.1.1.targus-getdata1 > 112.26.1.8.44809: Flags [.], ack 89965, win 24291, options [nop,nop,TS val 2429775 ecr 2208532,nop,nop,sack 2 {115669:118525}{111385:114241},mptcp dss ack 4083910546], length 0
22:18:31.907762 IP 112.26.1.1.targus-getdata1 > 112.26.1.8.44809: Flags [.], ack 89965, win 24291, options [nop,nop,TS val 2429661 ecr 2208532,nop,nop,sack 2 {115669:117097}{111385:114241},mptcp dss ack 4083910546], length 0
22:18:31.964085 IP 112.26.1.8.44809 > 112.26.1.1.targus-getdata1: Flags [.], seq 119953:121381, ack 0, win 4107, options [nop,nop,TS val 2210770 ecr 2427745,mptcp dss ack 1353584156 seq 4084001938 subseq 412693 len 1428 csum 0x540b], length 1428
22:18:31.964336 IP 112.26.1.1.targus-getdata1 > 112.26.1.8.44809: Flags [.], ack 89965, win 24291, options [nop,nop,TS val 2429893 ecr 2208532,nop,nop,sack 2 {119953:121381}{115669:118525},mptcp dss ack 4083910546], length 0
22:18:32.025472 IP 112.26.1.8.44809 > 112.26.1.1.targus-getdata1: Flags [.], seq 121381:122809, ack 0, win 4107, options [nop,nop,TS val 2210770 ecr 2427745,mptcp dss ack 1353584156 seq 4084003366 subseq 414121 len 1428 csum 0xc182], length 1428
22:18:32.025689 IP 112.26.1.1.targus-getdata1 > 112.26.1.8.44809: Flags [.], ack 89965, win 24291, options [nop,nop,TS val 2429955 ecr 2208532,nop,nop,sack 2 {119953:122809}{115669:118525},mptcp dss ack 4083910546], length 0
22:18:32.100310 IP 112.26.1.1.targus-getdata1 > 112.26.1.8.44809: Flags [.], ack 89965, win 24291, options [nop,nop,TS val 2429775 ecr 2208532,nop,nop,sack 2 {115669:118525}{111385:114241},mptcp dss ack 4083910546], length 0
22:18:32.172030 IP 112.26.1.8.44809 > 112.26.1.1.targus-getdata1: Flags [.], seq 122809:124237, ack 0, win 4107, options [nop,nop,TS val 2211033 ecr 2427928,mptcp dss ack 1353584156 seq 4084013362 subseq 415549 len 1428 csum 0xe089], length 1428
22:18:32.172193 IP 112.26.1.1.targus-getdata1 > 112.26.1.8.44809: Flags [.], ack 89965, win 24291, options [nop,nop,TS val 2430101 ecr 2208532,nop,nop,sack 2 {119953:124237}{115669:118525},mptcp dss ack 4083910546], length 0
22:18:32.298110 IP 112.26.1.1.targus-getdata1 > 112.26.1.8.44809: Flags [.], ack 89965, win 24291, options [nop,nop,TS val 2429893 ecr 2208532,nop,nop,sack 2 {119953:121381}{115669:118525},mptcp dss ack 4083910546], length 0
22:18:32.353757 IP 112.26.1.8.44809 > 112.26.1.1.targus-getdata1: Flags [.], seq 124237:125665, ack 0, win 4107, options [nop,nop,TS val 2211336 ecr 2428226,mptcp dss ack 1353584156 seq 4084024786 subseq 416977 len 1428 csum 0x944], length 1428
22:18:32.353995 IP 112.26.1.1.targus-getdata1 > 112.26.1.8.44809: Flags [.], ack 89965, win 24291, options [nop,nop,TS val 2430282 ecr 2208532,nop,nop,sack 2 {119953:125665}{115669:118525},mptcp dss ack 4083910546], length 0
22:18:32.455443 IP 112.26.1.1.targus-getdata1 > 112.26.1.8.44809: Flags [.], ack 89965, win 24291, options [nop,nop,TS val 2429955 ecr 2208532,nop,nop,sack 2 {119953:122809}{115669:118525},mptcp dss ack 4083910546], length 0
22:18:32.533848 IP 112.26.1.8.44809 > 112.26.1.1.targus-getdata1: Flags [.], seq 125665:127093, ack 0, win 4107, options [nop,nop,TS val 2211336 ecr 2428226,mptcp dss ack 1353584156 seq 4084026214 subseq 418405 len 1428 csum 0x925a], length 1428
22:18:32.534082 IP 112.26.1.1.targus-getdata1 > 112.26.1.8.44809: Flags [.], ack 89965, win 24291, options [nop,nop,TS val 2430463 ecr 2208532,nop,nop,sack 2 {119953:127093}{115669:118525},mptcp dss ack 4083910546], length 0
22:18:32.601916 IP 112.26.1.1.targus-getdata1 > 112.26.1.8.44809: Flags [.], ack 89965, win 24291, options [nop,nop,TS val 2430101 ecr 2208532,nop,nop,sack 2 {119953:124237}{115669:118525},mptcp dss ack 4083910546], length 0
22:18:32.663817 IP 112.26.1.8.44809 > 112.26.1.1.targus-getdata1: Flags [.], seq 127093:128521, ack 0, win 4107, options [nop,nop,TS val 2211336 ecr 2428226,mptcp dss ack 1353584156 seq 4084027642 subseq 419833 len 1428 csum 0x2e0a], length 1428
22:18:32.664008 IP 112.26.1.1.targus-getdata1 > 112.26.1.8.44809: Flags [.], ack 89965, win 24291, options [nop,nop,TS val 2430593 ecr 2208532,nop,nop,sack 2 {119953:128521}{115669:118525},mptcp dss ack 4083910546], length 0
22:18:32.736909 IP 112.26.1.1.targus-getdata1 > 112.26.1.8.44809: Flags [.], ack 89965, win 24291, options [nop,nop,TS val 2430282 ecr 2208532,nop,nop,sack 2 {119953:125665}{115669:118525},mptcp dss ack 4083910546], length 0
22:18:32.814557 IP 112.26.1.1.targus-getdata1 > 112.26.1.8.44809: Flags [.], ack 89965, win 24291, options [nop,nop,TS val 2430463 ecr 2208532,nop,nop,sack 2 {119953:127093}{115669:118525},mptcp dss ack 4083910546], length 0
22:18:32.901736 IP 112.26.1.8.44809 > 112.26.1.1.targus-getdata1: Flags [.], seq 129949:131377, ack 0, win 4107, options [nop,nop,TS val 2211927 ecr 2428645,mptcp dss ack 1353584156 seq 4084050490 subseq 422689 len 1428 csum 0xe113], length 1428
22:18:32.901938 IP 112.26.1.1.targus-getdata1 > 112.26.1.8.44809: Flags [.], ack 89965, win 24291, options [nop,nop,TS val 2430831 ecr 2208532,nop,nop,sack 2 {129949:131377}{119953:128521},mptcp dss ack 4083910546], length 0
22:18:32.990193 IP 112.26.1.1.targus-getdata1 > 112.26.1.8.44809: Flags [.], ack 89965, win 24291, options [nop,nop,TS val 2430593 ecr 2208532,nop,nop,sack 2 {119953:128521}{115669:118525},mptcp dss ack 4083910546], length 0
22:18:33.050911 IP 112.26.1.8.44809 > 112.26.1.1.targus-getdata1: Flags [.], seq 101389:102817, ack 0, win 4107, options [nop,nop,TS val 2212441 ecr 2429325,mptcp dss ack 1353584156 seq 4083954814 subseq 394129 len 1428 csum 0xb334], length 1428
22:18:33.051136 IP 112.26.1.1.targus-getdata1 > 112.26.1.8.44809: Flags [.], ack 89965, win 24291, options [nop,nop,TS val 2430980 ecr 2208532,nop,nop,sack 2 {101389:102817}{129949:131377},mptcp dss ack 4083910546], length 0
22:18:33.124522 IP 112.26.1.1.targus-getdata1 > 112.26.1.8.44809: Flags [.], ack 89965, win 24291, options [nop,nop,TS val 2430831 ecr 2208532,nop,nop,sack 2 {129949:131377}{119953:128521},mptcp dss ack 4083910546], length 0
22:18:33.149552 IP 112.26.1.8.44809 > 112.26.1.1.targus-getdata1: Flags [.], seq 104245:105673, ack 0, win 4107, options [nop,nop,TS val 2212537 ecr 2429437,mptcp dss ack 1353584156 seq 4083957670 subseq 396985 len 1428 csum 0x6f07], length 1428
22:18:33.149744 IP 112.26.1.1.targus-getdata1 > 112.26.1.8.44809: Flags [.], ack 89965, win 24291, options [nop,nop,TS val 2431079 ecr 2208532,nop,nop,sack 2 {104245:105673}{101389:102817},mptcp dss ack 4083910546], length 0
22:18:33.262642 IP 112.26.1.1.targus-getdata1 > 112.26.1.8.44809: Flags [.], ack 89965, win 24291, options [nop,nop,TS val 2430980 ecr 2208532,nop,nop,sack 2 {101389:102817}{129949:131377},mptcp dss ack 4083910546], length 0
22:18:33.336235 IP 112.26.1.1.targus-getdata1 > 112.26.1.8.44809: Flags [.], ack 89965, win 24291, options [nop,nop,TS val 2431079 ecr 2208532,nop,nop,sack 2 {104245:105673}{101389:102817},mptcp dss ack 4083910546], length 0
22:18:33.415051 IP 112.26.1.8.44809 > 112.26.1.1.targus-getdata1: Flags [.], seq 105673:107101, ack 0, win 4107, options [nop,nop,TS val 2212729 ecr 2429661,mptcp dss ack 1353584156 seq 4083959098 subseq 398413 len 1428 csum 0x26ab], length 1428
22:18:33.415298 IP 112.26.1.1.targus-getdata1 > 112.26.1.8.44809: Flags [.], ack 89965, win 24291, options [nop,nop,TS val 2431344 ecr 2208532,nop,nop,sack 2 {104245:107101}{101389:102817},mptcp dss ack 4083910546], length 0
22:18:33.507938 IP 112.26.1.8.44809 > 112.26.1.1.targus-getdata1: Flags [.], seq 109957:111385, ack 0, win 4107, options [nop,nop,TS val 2212825 ecr 2429775,mptcp dss ack 1353584156 seq 4083964810 subseq 402697 len 1428 csum 0xaf36], length 1428
22:18:33.508119 IP 112.26.1.1.targus-getdata1 > 112.26.1.8.44809: Flags [.], ack 89965, win 24291, options [nop,nop,TS val 2431437 ecr 2208532,nop,nop,sack 2 {109957:111385}{104245:107101},mptcp dss ack 4083910546], length 0
22:18:33.556411 IP 112.26.1.1.targus-getdata1 > 112.26.1.8.44809: Flags [.], ack 89965, win 24291, options [nop,nop,TS val 2431344 ecr 2208532,nop,nop,sack 2 {104245:107101}{101389:102817},mptcp dss ack 4083910546], length 0
22:18:33.611258 IP 112.26.1.8.44809 > 112.26.1.1.targus-getdata1: Flags [.], seq 114241:115669, ack 0, win 4107, options [nop,nop,TS val 2212901 ecr 2429893,mptcp dss ack 1353584156 seq 4083996226 subseq 406981 len 1428 csum 0xfa94], length 1428
