08:46:52.425823 IP 112.26.2.8.55963 > 112.26.2.1.targus-getdata1: Flags [S], seq 324851824, win 65535, options [mss 1460,sackOK,TS val 3818748 ecr 0,nop,wscale 6,mptcp join id 4 token 0x51351df7 nonce 0x7a029ff7], length 0
08:46:52.426226 IP 112.26.2.1.targus-getdata1 > 112.26.2.8.55963: Flags [S.], seq 1327569397, ack 324851825, win 28560, options [mss 1460,sackOK,TS val 4034776 ecr 3818748,nop,wscale 7,mptcp join id 6 hmac 0x8a33a578bf98b616 nonce 0xe017a97c], length 0
08:46:52.493724 IP 112.26.2.1.targus-getdata1 > 112.26.2.8.55963: Flags [S.], seq 1327569397, ack 324851825, win 28560, options [mss 1460,sackOK,TS val 4034776 ecr 3818748,nop,wscale 7,mptcp join id 6 hmac 0x8a33a578bf98b616 nonce 0xe017a97c], length 0
08:46:52.593021 IP 112.26.2.8.55963 > 112.26.2.1.targus-getdata1: Flags [.], ack 1, win 2738, options [nop,nop,TS val 3818846 ecr 4034776,mptcp join hmac 0x418d2969007f33685d14d78026b759aaf8208815], length 0
08:46:52.593460 IP 112.26.2.1.targus-getdata1 > 112.26.2.8.55963: Flags [.], ack 1, win 447, options [nop,nop,TS val 4034943 ecr 3818846,mptcp dss ack 4209528936], length 0
08:46:52.597141 IP 112.26.2.1.targus-getdata1 > 112.26.2.8.55963: Flags [.], ack 1, win 447, options [nop,nop,TS val 4034943 ecr 3818846,mptcp dss ack 4209528936], length 0
08:46:52.840638 IP 112.26.2.8.55963 > 112.26.2.1.targus-getdata1: Flags [P.], seq 1:84, ack 1, win 4107, options [nop,nop,TS val 3819172 ecr 4034943,mptcp dss ack 3819027816 seq 4209528940 subseq 1 len 83 csum 0xf7e7], length 83
08:47:28.990373 IP 112.26.2.8.46719 > 112.26.2.1.targus-getdata1: Flags [.], seq 4084180968:4084182396, ack 3408732519, win 4107, options [nop,nop,TS val 3854488 ecr 4069983,mptcp dss ack 2613390630 seq 2861056078 subseq 375565 len 1428 csum 0x7549], length 1428
08:47:28.990736 IP 112.26.2.1.targus-getdata1 > 112.26.2.8.46719: Flags [.], ack 1428, win 7282, options [nop,nop,TS val 4071341 ecr 3854488,mptcp dss ack 2860963258], length 0
08:47:28.994105 IP 112.26.2.1.targus-getdata1 > 112.26.2.8.46719: Flags [.], ack 1428, win 7282, options [nop,nop,TS val 4071341 ecr 3854488,mptcp dss ack 2860963258], length 0
08:47:29.128412 IP 112.26.2.8.46719 > 112.26.2.1.targus-getdata1: Flags [.], seq 1428:2856, ack 1, win 4107, options [nop,nop,TS val 3854581 ecr 4070155,mptcp dss ack 2613390630 seq 2861060362 subseq 376993 len 1428 csum 0xfdd0], length 1428
08:47:29.128683 IP 112.26.2.1.targus-getdata1 > 112.26.2.8.46719: Flags [.], ack 2856, win 7282, options [nop,nop,TS val 4071479 ecr 3854581,mptcp dss ack 2860963258], length 0
08:47:29.137933 IP 112.26.2.1.targus-getdata1 > 112.26.2.8.46719: Flags [.], ack 2856, win 7282, options [nop,nop,TS val 4071479 ecr 3854581,mptcp dss ack 2860963258], length 0
08:47:29.274364 IP 112.26.2.8.46719 > 112.26.2.1.targus-getdata1: Flags [.], seq 2856:4284, ack 1, win 4107, options [nop,nop,TS val 3854703 ecr 4070294,mptcp dss ack 2613390630 seq 2861066074 subseq 378421 len 1428 csum 0xf4b0], length 1428
08:47:29.274673 IP 112.26.2.1.targus-getdata1 > 112.26.2.8.46719: Flags [.], ack 4284, win 7282, options [nop,nop,TS val 4071625 ecr 3854703,mptcp dss ack 2860963258], length 0
08:47:29.281567 IP 112.26.2.1.targus-getdata1 > 112.26.2.8.46719: Flags [.], ack 4284, win 7282, options [nop,nop,TS val 4071625 ecr 3854703,mptcp dss ack 2860963258], length 0
08:47:29.417207 IP 112.26.2.8.46719 > 112.26.2.1.targus-getdata1: Flags [.], seq 4284:5712, ack 1, win 4107, options [nop,nop,TS val 3854832 ecr 4070434,mptcp dss ack 2613390630 seq 2861073214 subseq 379849 len 1428 csum 0x20ac], length 1428
08:47:29.417518 IP 112.26.2.1.targus-getdata1 > 112.26.2.8.46719: Flags [.], ack 5712, win 7282, options [nop,nop,TS val 4071768 ecr 3854832,mptcp dss ack 2860963258], length 0
08:47:29.421972 IP 112.26.2.1.targus-getdata1 > 112.26.2.8.46719: Flags [.], ack 5712, win 7282, options [nop,nop,TS val 4071768 ecr 3854832,mptcp dss ack 2860963258], length 0
08:47:29.563361 IP 112.26.2.8.46719 > 112.26.2.1.targus-getdata1: Flags [.], seq 5712:7140, ack 1, win 4107, options [nop,nop,TS val 3854832 ecr 4070434,mptcp dss ack 2613390630 seq 2861074642 subseq 381277 len 1428 csum 0xe2d1], length 1428
08:47:29.563716 IP 112.26.2.1.targus-getdata1 > 112.26.2.8.46719: Flags [.], ack 7140, win 7282, options [nop,nop,TS val 4071914 ecr 3854832,mptcp dss ack 2860963258], length 0
08:47:29.574310 IP 112.26.2.1.targus-getdata1 > 112.26.2.8.46719: Flags [.], ack 7140, win 7282, options [nop,nop,TS val 4071914 ecr 3854832,mptcp dss ack 2860963258], length 0
08:47:29.707489 IP 112.26.2.8.46719 > 112.26.2.1.targus-getdata1: Flags [.], seq 7140:8568, ack 1, win 4107, options [nop,nop,TS val 3855004 ecr 4070561,mptcp dss ack 2613390630 seq 2861083210 subseq 382705 len 1428 csum 0xe72f], length 1428
08:47:29.707866 IP 112.26.2.1.targus-getdata1 > 112.26.2.8.46719: Flags [.], ack 8568, win 7282, options [nop,nop,TS val 4072058 ecr 3855004,mptcp dss ack 2860963258], length 0
08:47:29.711365 IP 112.26.2.1.targus-getdata1 > 112.26.2.8.46719: Flags [.], ack 8568, win 7282, options [nop,nop,TS val 4072058 ecr 3855004,mptcp dss ack 2860963258], length 0
08:47:29.818683 IP 112.26.2.8.46719 > 112.26.2.1.targus-getdata1: Flags [.], seq 8568:9996, ack 1, win 4107, options [nop,nop,TS val 3855165 ecr 4070687,mptcp dss ack 2613390630 seq 2861097490 subseq 384133 len 1428 csum 0x9552], length 1428
08:47:29.859394 IP 112.26.2.1.targus-getdata1 > 112.26.2.8.46719: Flags [.], ack 9996, win 7282, options [nop,nop,TS val 4072210 ecr 3855165,mptcp dss ack 2860963258], length 0
08:47:29.870322 IP 112.26.2.1.targus-getdata1 > 112.26.2.8.46719: Flags [.], ack 9996, win 7282, options [nop,nop,TS val 4072210 ecr 3855165,mptcp dss ack 2860963258], length 0
08:47:29.970326 IP 112.26.2.8.46719 > 112.26.2.1.targus-getdata1: Flags [.], seq 9996:11424, ack 1, win 4107, options [nop,nop,TS val 3855395 ecr 4070793,mptcp dss ack 2613390630 seq 2861107486 subseq 385561 len 1428 csum 0xdb51], length 1428
08:47:30.057509 IP 112.26.2.1.targus-getdata1 > 112.26.2.8.46719: Flags [.], ack 11424, win 7282, options [nop,nop,TS val 4072408 ecr 3855395,mptcp dss ack 2860963258], length 0
08:47:30.070025 IP 112.26.2.1.targus-getdata1 > 112.26.2.8.46719: Flags [.], ack 11424, win 7282, options [nop,nop,TS val 4072408 ecr 3855395,mptcp dss ack 2860963258], length 0
08:47:30.116793 IP 112.26.2.8.46719 > 112.26.2.1.targus-getdata1: Flags [.], seq 12852:14280, ack 1, win 4107, options [nop,nop,TS val 3855560 ecr 4070929,mptcp dss ack 2613390630 seq 2861114626 subseq 388417 len 1428 csum 0xf7], length 1428
08:47:30.117131 IP 112.26.2.1.targus-getdata1 > 112.26.2.8.46719: Flags [.], ack 11424, win 7104, options [nop,nop,TS val 4072467 ecr 3855395,nop,nop,sack 1 {12852:14280},mptcp dss ack 2860986106], length 0
08:47:30.172210 IP 112.26.2.1.targus-getdata1 > 112.26.2.8.46719: Flags [.], ack 11424, win 7104, options [nop,nop,TS val 4072467 ecr 3855395,nop,nop,sack 1 {12852:14280},mptcp dss ack 2860986106], length 0
08:47:30.310769 IP 112.26.2.8.46719 > 112.26.2.1.targus-getdata1: Flags [.], seq 14280:15708, ack 1, win 4107, options [nop,nop,TS val 3855719 ecr 4071098,mptcp dss ack 2613390630 seq 2861118910 subseq 389845 len 1428 csum 0x202e], length 1428
08:47:30.311135 IP 112.26.2.1.targus-getdata1 > 112.26.2.8.46719: Flags [.], ack 11424, win 7104, options [nop,nop,TS val 4072661 ecr 3855395,nop,nop,sack 1 {12852:15708},mptcp dss ack 2860986106], length 0
08:47:30.320711 IP 112.26.2.1.targus-getdata1 > 112.26.2.8.46719: Flags [.], ack 11424, win 7104, options [nop,nop,TS val 4072661 ecr 3855395,nop,nop,sack 1 {12852:15708},mptcp dss ack 2860986106], length 0
08:47:30.425574 IP 112.26.2.8.46719 > 112.26.2.1.targus-getdata1: Flags [.], seq 15708:17136, ack 1, win 4107, options [nop,nop,TS val 3855880 ecr 4071256,mptcp dss ack 2613390630 seq 2861124622 subseq 391273 len 1428 csum 0xe614], length 1428
08:47:30.425944 IP 112.26.2.1.targus-getdata1 > 112.26.2.8.46719: Flags [.], ack 11424, win 7104, options [nop,nop,TS val 4072776 ecr 3855395,nop,nop,sack 1 {12852:17136},mptcp dss ack 2860986106], length 0
08:47:30.432417 IP 112.26.2.1.targus-getdata1 > 112.26.2.8.46719: Flags [.], ack 11424, win 7104, options [nop,nop,TS val 4072776 ecr 3855395,nop,nop,sack 1 {12852:17136},mptcp dss ack 2860986106], length 0
08:47:30.564433 IP 112.26.2.8.46719 > 112.26.2.1.targus-getdata1: Flags [.], seq 17136:18564, ack 1, win 4107, options [nop,nop,TS val 3855880 ecr 4071256,mptcp dss ack 2613390630 seq 2861126050 subseq 392701 len 1428 csum 0x9782], length 1428
08:47:30.564771 IP 112.26.2.1.targus-getdata1 > 112.26.2.8.46719: Flags [.], ack 11424, win 7093, options [nop,nop,TS val 4072914 ecr 3855395,nop,nop,sack 1 {12852:18564},mptcp dss ack 2860987534], length 0
08:47:30.570776 IP 112.26.2.1.targus-getdata1 > 112.26.2.8.46719: Flags [.], ack 11424, win 7093, options [nop,nop,TS val 4072914 ecr 3855395,nop,nop,sack 1 {12852:18564},mptcp dss ack 2860987534], length 0
08:47:30.685382 IP 112.26.2.8.46719 > 112.26.2.1.targus-getdata1: Flags [.], seq 18564:19992, ack 1, win 4107, options [nop,nop,TS val 3856069 ecr 4071341,mptcp dss ack 2613390630 seq 2861138902 subseq 394129 len 1428 csum 0x5033], length 1428
08:47:30.685772 IP 112.26.2.1.targus-getdata1 > 112.26.2.8.46719: Flags [.], ack 11424, win 7190, options [nop,nop,TS val 4073036 ecr 3855395,nop,nop,sack 1 {12852:19992},mptcp dss ack 2861030374], length 0
08:47:30.689451 IP 112.26.2.1.targus-getdata1 > 112.26.2.8.46719: Flags [.], ack 11424, win 7190, options [nop,nop,TS val 4073036 ecr 3855395,nop,nop,sack 1 {12852:19992},mptcp dss ack 2861030374], length 0
08:47:30.782507 IP 112.26.2.8.46719 > 112.26.2.1.targus-getdata1: Flags [.], seq 19992:21420, ack 1, win 4107, options [nop,nop,TS val 3856252 ecr 4071479,mptcp dss ack 2613390630 seq 2861146042 subseq 395557 len 1428 csum 0x75a4], length 1428
08:47:30.782892 IP 112.26.2.1.targus-getdata1 > 112.26.2.8.46719: Flags [.], ack 11424, win 7190, options [nop,nop,TS val 4073133 ecr 3855395,nop,nop,sack 1 {12852:21420},mptcp dss ack 2861030374], length 0
08:47:30.786276 IP 112.26.2.1.targus-getdata1 > 112.26.2.8.46719: Flags [.], ack 11424, win 7190, options [nop,nop,TS val 4073133 ecr 3855395,nop,nop,sack 1 {12852:21420},mptcp dss ack 2861030374], length 0
08:47:30.895700 IP 112.26.2.8.46719 > 112.26.2.1.targus-getdata1: Flags [.], seq 21420:22848, ack 1, win 4107, options [nop,nop,TS val 3856379 ecr 4071625,mptcp dss ack 2613390630 seq 2861151754 subseq 396985 len 1428 csum 0xfdb5], length 1428
08:47:30.895993 IP 112.26.2.1.targus-getdata1 > 112.26.2.8.46719: Flags [.], ack 11424, win 7282, options [nop,nop,TS val 4073246 ecr 3855395,nop,nop,sack 1 {12852:22848},mptcp dss ack 2861057506], length 0
08:47:30.900593 IP 112.26.2.1.targus-getdata1 > 112.26.2.8.46719: Flags [.], ack 11424, win 7282, options [nop,nop,TS val 4073246 ecr 3855395,nop,nop,sack 1 {12852:22848},mptcp dss ack 2861057506], length 0
08:47:30.987343 IP 112.26.2.8.46719 > 112.26.2.1.targus-getdata1: Flags [.], seq 22848:24276, ack 1, win 4107, options [nop,nop,TS val 3856514 ecr 4071768,mptcp dss ack 2613390630 seq 2861153182 subseq 398413 len 1428 csum 0x3469], length 1428
08:47:30.987690 IP 112.26.2.1.targus-getdata1 > 112.26.2.8.46719: Flags [.], ack 11424, win 7282, options [nop,nop,TS val 4073338 ecr 3855395,nop,nop,sack 1 {12852:24276},mptcp dss ack 2861057506], length 0
08:47:31.029050 IP 112.26.2.1.targus-getdata1 > 112.26.2.8.46719: Flags [.], ack 11424, win 7282, options [nop,nop,TS val 4073338 ecr 3855395,nop,nop,sack 1 {12852:24276},mptcp dss ack 2861057506], length 0
08:47:31.105239 IP 112.26.2.8.46719 > 112.26.2.1.targus-getdata1: Flags [.], seq 24276:25704, ack 1, win 4107, options [nop,nop,TS val 3856665 ecr 4071914,mptcp dss ack 2613390630 seq 2861161750 subseq 399841 len 1428 csum 0xc932], length 1428
08:47:31.105593 IP 112.26.2.1.targus-getdata1 > 112.26.2.8.46719: Flags [.], ack 11424, win 7282, options [nop,nop,TS val 4073456 ecr 3855395,nop,nop,sack 1 {12852:25704},mptcp dss ack 2861057506], length 0
08:47:31.132697 IP 112.26.2.1.targus-getdata1 > 112.26.2.8.46719: Flags [.], ack 11424, win 7282, options [nop,nop,TS val 4073456 ecr 3855395,nop,nop,sack 1 {12852:25704},mptcp dss ack 2861057506], length 0
08:47:31.208537 IP 112.26.2.8.46719 > 112.26.2.1.targus-getdata1: Flags [.], seq 25704:27132, ack 1, win 4107, options [nop,nop,TS val 3856837 ecr 4072058,mptcp dss ack 2613390630 seq 2861166034 subseq 401269 len 1428 csum 0x82e7], length 1428
08:47:31.208845 IP 112.26.2.1.targus-getdata1 > 112.26.2.8.46719: Flags [.], ack 11424, win 7282, options [nop,nop,TS val 4073559 ecr 3855395,nop,nop,sack 1 {12852:27132},mptcp dss ack 2861057506], length 0
08:47:31.286027 IP 112.26.2.1.targus-getdata1 > 112.26.2.8.46719: Flags [.], ack 11424, win 7282, options [nop,nop,TS val 4073559 ecr 3855395,nop,nop,sack 1 {12852:27132},mptcp dss ack 2861057506], length 0
08:47:31.329412 IP 112.26.2.8.46719 > 112.26.2.1.targus-getdata1: Flags [.], seq 27132:28560, ack 1, win 4107, options [nop,nop,TS val 3856837 ecr 4072058,mptcp dss ack 2613390630 seq 2861167462 subseq 402697 len 1428 csum 0x11ab], length 1428
08:47:31.329772 IP 112.26.2.1.targus-getdata1 > 112.26.2.8.46719: Flags [.], ack 11424, win 7282, options [nop,nop,TS val 4073680 ecr 3855395,nop,nop,sack 1 {12852:28560},mptcp dss ack 2861057506], length 0
08:47:31.389041 IP 112.26.2.1.targus-getdata1 > 112.26.2.8.46719: Flags [.], ack 11424, win 7282, options [nop,nop,TS val 4073680 ecr 3855395,nop,nop,sack 1 {12852:28560},mptcp dss ack 2861057506], length 0
08:47:31.488019 IP 112.26.2.8.46719 > 112.26.2.1.targus-getdata1: Flags [.], seq 28560:29988, ack 1, win 4107, options [nop,nop,TS val 3856947 ecr 4072210,mptcp dss ack 2613390630 seq 2861176030 subseq 404125 len 1428 csum 0xd6dd], length 1428
08:47:31.488363 IP 112.26.2.1.targus-getdata1 > 112.26.2.8.46719: Flags [.], ack 11424, win 7282, options [nop,nop,TS val 4073838 ecr 3855395,nop,nop,sack 1 {12852:29988},mptcp dss ack 2861071786], length 0
08:47:31.494753 IP 112.26.2.1.targus-getdata1 > 112.26.2.8.46719: Flags [.], ack 11424, win 7282, options [nop,nop,TS val 4073838 ecr 3855395,nop,nop,sack 1 {12852:29988},mptcp dss ack 2861071786], length 0
08:47:31.576630 IP 112.26.2.8.46719 > 112.26.2.1.targus-getdata1: Flags [.], seq 29988:31416, ack 1, win 4107, options [nop,nop,TS val 3857108 ecr 4072408,mptcp dss ack 2613390630 seq 2861186026 subseq 405553 len 1428 csum 0xa7e1], length 1428
08:47:31.576992 IP 112.26.2.1.targus-getdata1 > 112.26.2.8.46719: Flags [.], ack 11424, win 7282, options [nop,nop,TS val 4073927 ecr 3855395,nop,nop,sack 1 {12852:31416},mptcp dss ack 2861071786], length 0
08:47:31.632239 IP 112.26.2.1.targus-getdata1 > 112.26.2.8.46719: Flags [.], ack 11424, win 7282, options [nop,nop,TS val 4073927 ecr 3855395,nop,nop,sack 1 {12852:31416},mptcp dss ack 2861071786], length 0
08:47:31.730790 IP 112.26.2.8.46719 > 112.26.2.1.targus-getdata1: Flags [.], seq 31416:32844, ack 1, win 4107, options [nop,nop,TS val 3857331 ecr 4072467,mptcp dss ack 2613390630 seq 2861196022 subseq 406981 len 1428 csum 0xc4ab], length 1428
08:47:31.731148 IP 112.26.2.1.targus-getdata1 > 112.26.2.8.46719: Flags [.], ack 11424, win 7282, options [nop,nop,TS val 4074081 ecr 3855395,nop,nop,sack 1 {12852:32844},mptcp dss ack 2861071786], length 0
08:47:31.738948 IP 112.26.2.1.targus-getdata1 > 112.26.2.8.46719: Flags [.], ack 11424, win 7282, options [nop,nop,TS val 4074081 ecr 3855395,nop,nop,sack 1 {12852:32844},mptcp dss ack 2861071786], length 0
08:47:31.855754 IP 112.26.2.8.46719 > 112.26.2.1.targus-getdata1: Flags [.], seq 32844:34272, ack 1, win 4107, options [nop,nop,TS val 3857505 ecr 4072661,mptcp dss ack 2613390630 seq 2861200306 subseq 408409 len 1428 csum 0xb862], length 1428
08:47:31.856129 IP 112.26.2.1.targus-getdata1 > 112.26.2.8.46719: Flags [.], ack 11424, win 7282, options [nop,nop,TS val 4074206 ecr 3855395,nop,nop,sack 1 {12852:34272},mptcp dss ack 2861071786], length 0
08:47:31.896670 IP 112.26.2.1.targus-getdata1 > 112.26.2.8.46719: Flags [.], ack 11424, win 7282, options [nop,nop,TS val 4074206 ecr 3855395,nop,nop,sack 1 {12852:34272},mptcp dss ack 2861071786], length 0
08:47:31.973715 IP 112.26.2.8.46719 > 112.26.2.1.targus-getdata1: Flags [.], seq 11424:12852, ack 1, win 4107, options [nop,nop,TS val 3857505 ecr 4072776,mptcp dss ack 2613390630 seq 2861108914 subseq 386989 len 1428 csum 0x90e], length 1428
08:47:31.974109 IP 112.26.2.1.targus-getdata1 > 112.26.2.8.46719: Flags [.], ack 34272, win 7282, options [nop,nop,TS val 4074324 ecr 3857505,mptcp dss ack 2861071786], length 0
08:47:32.005701 IP 112.26.2.1.targus-getdata1 > 112.26.2.8.46719: Flags [.], ack 34272, win 7282, options [nop,nop,TS val 4074324 ecr 3857505,mptcp dss ack 2861071786], length 0
08:47:32.077612 IP 112.26.2.8.46719 > 112.26.2.1.targus-getdata1: Flags [.], seq 34272:35700, ack 1, win 4107, options [nop,nop,TS val 3857663 ecr 4072914,mptcp dss ack 2613390630 seq 2861208874 subseq 409837 len 1428 csum 0xca9b], length 1428
08:47:32.077971 IP 112.26.2.1.targus-getdata1 > 112.26.2.8.46719: Flags [.], ack 35700, win 7282, options [nop,nop,TS val 4074428 ecr 3857663,mptcp dss ack 2861071786], length 0
08:47:32.101480 IP 112.26.2.1.targus-getdata1 > 112.26.2.8.46719: Flags [.], ack 35700, win 7282, options [nop,nop,TS val 4074428 ecr 3857663,mptcp dss ack 2861071786], length 0
08:47:32.169057 IP 112.26.2.8.46719 > 112.26.2.1.targus-getdata1: Flags [.], seq 35700:37128, ack 1, win 4107, options [nop,nop,TS val 3857909 ecr 4073133,mptcp dss ack 2613390630 seq 2861218870 subseq 411265 len 1428 csum 0xf84], length 1428
08:47:32.169366 IP 112.26.2.1.targus-getdata1 > 112.26.2.8.46719: Flags [.], ack 37128, win 7282, options [nop,nop,TS val 4074519 ecr 3857909,mptcp dss ack 2861071786], length 0
08:47:32.189429 IP 112.26.2.1.targus-getdata1 > 112.26.2.8.46719: Flags [.], ack 37128, win 7282, options [nop,nop,TS val 4074519 ecr 3857909,mptcp dss ack 2861071786], length 0
08:47:32.329625 IP 112.26.2.8.46719 > 112.26.2.1.targus-getdata1: Flags [.], seq 37128:38556, ack 1, win 4107, options [nop,nop,TS val 3858049 ecr 4073246,mptcp dss ack 2613390630 seq 2861224582 subseq 412693 len 1428 csum 0xd00b], length 1428
08:47:32.329958 IP 112.26.2.1.targus-getdata1 > 112.26.2.8.46719: Flags [.], ack 38556, win 7282, options [nop,nop,TS val 4074680 ecr 3858049,mptcp dss ack 2861071786], length 0
08:47:32.334399 IP 112.26.2.1.targus-getdata1 > 112.26.2.8.46719: Flags [.], ack 38556, win 7282, options [nop,nop,TS val 4074680 ecr 3858049,mptcp dss ack 2861071786], length 0
08:47:32.439622 IP 112.26.2.8.46719 > 112.26.2.1.targus-getdata1: Flags [.], seq 38556:39984, ack 1, win 4107, options [nop,nop,TS val 3858309 ecr 4073456,mptcp dss ack 2613390630 seq 2861230294 subseq 414121 len 1428 csum 0x95c9], length 1428
08:47:32.440050 IP 112.26.2.1.targus-getdata1 > 112.26.2.8.46719: Flags [.], ack 39984, win 7282, options [nop,nop,TS val 4074790 ecr 3858309,mptcp dss ack 2861071786], length 0
08:47:32.475016 IP 112.26.2.1.targus-getdata1 > 112.26.2.8.46719: Flags [.], ack 39984, win 7282, options [nop,nop,TS val 4074790 ecr 3858309,mptcp dss ack 2861071786], length 0
08:47:32.516569 IP 112.26.2.8.46719 > 112.26.2.1.targus-getdata1: Flags [.], seq 39984:41412, ack 1, win 4107, options [nop,nop,TS val 3858589 ecr 4073559,mptcp dss ack 2613390630 seq 2861236006 subseq 415549 len 1428 csum 0x49d8], length 1428
08:47:32.516959 IP 112.26.2.1.targus-getdata1 > 112.26.2.8.46719: Flags [.], ack 41412, win 7282, options [nop,nop,TS val 4074867 ecr 3858589,mptcp dss ack 2861071786], length 0
08:47:32.594315 IP 112.26.2.1.targus-getdata1 > 112.26.2.8.46719: Flags [.], ack 41412, win 7282, options [nop,nop,TS val 4074867 ecr 3858589,mptcp dss ack 2861071786], length 0
08:47:32.610123 IP 112.26.2.8.46719 > 112.26.2.1.targus-getdata1: Flags [.], seq 41412:42840, ack 1, win 4107, options [nop,nop,TS val 3858861 ecr 4073927,mptcp dss ack 2613390630 seq 2861243146 subseq 416977 len 1428 csum 0xc9e4], length 1428
08:47:32.610428 IP 112.26.2.1.targus-getdata1 > 112.26.2.8.46719: Flags [.], ack 42840, win 7282, options [nop,nop,TS val 4074961 ecr 3858861,mptcp dss ack 2861071786], length 0
08:47:32.687325 IP 112.26.2.1.targus-getdata1 > 112.26.2.8.46719: Flags [.], ack 42840, win 7282, options [nop,nop,TS val 4074961 ecr 3858861,mptcp dss ack 2861071786], length 0
08:47:32.744723 IP 112.26.2.8.46719 > 112.26.2.1.targus-getdata1: Flags [.], seq 42840:44268, ack 1, win 4107, options [nop,nop,TS val 3859030 ecr 4074081,mptcp dss ack 2613390630 seq 2861244574 subseq 418405 len 1428 csum 0xf940], length 1428
08:47:32.745100 IP 112.26.2.1.targus-getdata1 > 112.26.2.8.46719: Flags [.], ack 44268, win 7282, options [nop,nop,TS val 4075095 ecr 3859030,mptcp dss ack 2861071786], length 0
08:47:32.788512 IP 112.26.2.1.targus-getdata1 > 112.26.2.8.46719: Flags [.], ack 44268, win 7282, options [nop,nop,TS val 4075095 ecr 3859030,mptcp dss ack 2861071786], length 0
08:47:32.900509 IP 112.26.2.8.46719 > 112.26.2.1.targus-getdata1: Flags [.], seq 44268:45696, ack 1, win 4107, options [nop,nop,TS val 3859231 ecr 4074206,mptcp dss ack 2613390630 seq 2861247430 subseq 419833 len 1428 csum 0x4f1b], length 1428
08:47:32.900891 IP 112.26.2.1.targus-getdata1 > 112.26.2.8.46719: Flags [.], ack 45696, win 7282, options [nop,nop,TS val 4075251 ecr 3859231,mptcp dss ack 2861071786], length 0
08:47:32.908903 IP 112.26.2.1.targus-getdata1 > 112.26.2.8.46719: Flags [.], ack 45696, win 7282, options [nop,nop,TS val 4075251 ecr 3859231,mptcp dss ack 2861071786], length 0
08:47:33.030206 IP 112.26.2.8.46719 > 112.26.2.1.targus-getdata1: Flags [.], seq 45696:47124, ack 1, win 4107, options [nop,nop,TS val 3859283 ecr 4074324,mptcp dss ack 2613390630 seq 2861250286 subseq 421261 len 1428 csum 0x5f6c], length 1428
08:47:33.030564 IP 112.26.2.1.targus-getdata1 > 112.26.2.8.46719: Flags [.], ack 47124, win 7282, options [nop,nop,TS val 4075381 ecr 3859283,mptcp dss ack 2861071786], length 0
08:47:33.050126 IP 112.26.2.1.targus-getdata1 > 112.26.2.8.46719: Flags [.], ack 47124, win 7282, options [nop,nop,TS val 4075381 ecr 3859283,mptcp dss ack 2861071786], length 0
08:47:33.185315 IP 112.26.2.8.46719 > 112.26.2.1.targus-getdata1: Flags [.], seq 47124:48552, ack 1, win 4107, options [nop,nop,TS val 3859436 ecr 4074519,mptcp dss ack 2613390630 seq 2861253142 subseq 422689 len 1428 csum 0xd79a], length 1428
08:47:33.185638 IP 112.26.2.1.targus-getdata1 > 112.26.2.8.46719: Flags [.], ack 48552, win 7282, options [nop,nop,TS val 4075536 ecr 3859436,mptcp dss ack 2861071786], length 0
08:47:33.196563 IP 112.26.2.1.targus-getdata1 > 112.26.2.8.46719: Flags [.], ack 48552, win 7282, options [nop,nop,TS val 4075536 ecr 3859436,mptcp dss ack 2861071786], length 0
08:47:33.310084 IP 112.26.2.8.46719 > 112.26.2.1.targus-getdata1: Flags [.], seq 48552:49980, ack 1, win 4107, options [nop,nop,TS val 3859436 ecr 4074519,mptcp dss ack 2613390630 seq 2861254570 subseq 424117 len 1428 csum 0x13ba], length 1428
08:47:33.310410 IP 112.26.2.1.targus-getdata1 > 112.26.2.8.46719: Flags [.], ack 49980, win 7282, options [nop,nop,TS val 4075660 ecr 3859436,mptcp dss ack 2861071786], length 0
08:47:33.352595 IP 112.26.2.1.targus-getdata1 > 112.26.2.8.46719: Flags [.], ack 49980, win 7282, options [nop,nop,TS val 4075660 ecr 3859436,mptcp dss ack 2861071786], length 0
08:47:33.509373 IP 112.26.2.8.46719 > 112.26.2.1.targus-getdata1: Flags [.], seq 49980:51408, ack 1, win 4107, options [nop,nop,TS val 3859574 ecr 4074680,mptcp dss ack 2613390630 seq 2861260282 subseq 425545 len 1428 csum 0xbdab], length 1428
08:47:33.509720 IP 112.26.2.1.targus-getdata1 > 112.26.2.8.46719: Flags [.], ack 51408, win 7282, options [nop,nop,TS val 4075859 ecr 3859574,mptcp dss ack 2861071786], length 0
08:47:33.515824 IP 112.26.2.1.targus-getdata1 > 112.26.2.8.46719: Flags [.], ack 51408, win 7282, options [nop,nop,TS val 4075859 ecr 3859574,mptcp dss ack 2861071786], length 0
08:47:33.669193 IP 112.26.2.8.46719 > 112.26.2.1.targus-getdata1: Flags [.], seq 51408:52836, ack 1, win 4107, options [nop,nop,TS val 3859574 ecr 4074680,mptcp dss ack 2613390630 seq 2861261710 subseq 426973 len 1428 csum 0xefa3], length 1428
08:47:33.669526 IP 112.26.2.1.targus-getdata1 > 112.26.2.8.46719: Flags [.], ack 52836, win 7282, options [nop,nop,TS val 4076019 ecr 3859574,mptcp dss ack 2861071786], length 0
08:47:33.673591 IP 112.26.2.1.targus-getdata1 > 112.26.2.8.46719: Flags [.], ack 52836, win 7282, options [nop,nop,TS val 4076019 ecr 3859574,mptcp dss ack 2861071786], length 0
08:47:33.795749 IP 112.26.2.8.46719 > 112.26.2.1.targus-getdata1: Flags [.], seq 52836:54264, ack 1, win 4107, options [nop,nop,TS val 3859681 ecr 4074790,mptcp dss ack 2613390630 seq 2861264566 subseq 428401 len 1428 csum 0x204b], length 1428
08:47:33.796138 IP 112.26.2.1.targus-getdata1 > 112.26.2.8.46719: Flags [.], ack 54264, win 7037, options [nop,nop,TS val 4076146 ecr 3859681,mptcp dss ack 2861103202], length 0
08:47:33.801596 IP 112.26.2.1.targus-getdata1 > 112.26.2.8.46719: Flags [.], ack 54264, win 7037, options [nop,nop,TS val 4076146 ecr 3859681,mptcp dss ack 2861103202], length 0
08:47:33.949548 IP 112.26.2.8.46719 > 112.26.2.1.targus-getdata1: Flags [.], seq 54264:55692, ack 1, win 4107, options [nop,nop,TS val 3859804 ecr 4074867,mptcp dss ack 2613390630 seq 2861268850 subseq 429829 len 1428 csum 0x3fdf], length 1428
08:47:33.990266 IP 112.26.2.1.targus-getdata1 > 112.26.2.8.46719: Flags [.], ack 55692, win 7037, options [nop,nop,TS val 4076341 ecr 3859804,mptcp dss ack 2861103202], length 0
08:47:33.993314 IP 112.26.2.1.targus-getdata1 > 112.26.2.8.46719: Flags [.], ack 55692, win 7037, options [nop,nop,TS val 4076341 ecr 3859804,mptcp dss ack 2861103202], length 0
08:47:34.071250 IP 112.26.2.8.46719 > 112.26.2.1.targus-getdata1: Flags [.], seq 55692:57120, ack 1, win 4107, options [nop,nop,TS val 3859855 ecr 4074961,mptcp dss ack 2613390630 seq 2861273134 subseq 431257 len 1428 csum 0x5f4b], length 1428
08:47:34.153365 IP 112.26.2.1.targus-getdata1 > 112.26.2.8.46719: Flags [.], ack 57120, win 7028, options [nop,nop,TS val 4076504 ecr 3859855,mptcp dss ack 2861157466], length 0
08:47:34.154431 IP 112.26.2.8.46719 > 112.26.2.1.targus-getdata1: Flags [.], seq 57120:58548, ack 1, win 4107, options [nop,nop,TS val 3860005 ecr 4075095,mptcp dss ack 2613390630 seq 2861278846 subseq 432685 len 1428 csum 0x3605], length 1428
08:47:34.159753 IP 112.26.2.1.targus-getdata1 > 112.26.2.8.46719: Flags [.], ack 57120, win 7028, options [nop,nop,TS val 4076504 ecr 3859855,mptcp dss ack 2861157466], length 0
08:47:34.311699 IP 112.26.2.8.46719 > 112.26.2.1.targus-getdata1: Flags [.], seq 58548:59976, ack 1, win 4107, options [nop,nop,TS val 3860212 ecr 4075251,mptcp dss ack 2613390630 seq 2861288842 subseq 434113 len 1428 csum 0x4d45], length 1428
08:47:34.312102 IP 112.26.2.1.targus-getdata1 > 112.26.2.8.46719: Flags [.], ack 59976, win 7028, options [nop,nop,TS val 4076662 ecr 3860005,mptcp dss ack 2861157466], length 0
08:47:34.315619 IP 112.26.2.1.targus-getdata1 > 112.26.2.8.46719: Flags [.], ack 59976, win 7028, options [nop,nop,TS val 4076662 ecr 3860005,mptcp dss ack 2861157466], length 0
08:47:34.457922 IP 112.26.2.8.46719 > 112.26.2.1.targus-getdata1: Flags [.], seq 59976:61404, ack 1, win 4107, options [nop,nop,TS val 3860332 ecr 4075381,mptcp dss ack 2613390630 seq 2861293126 subseq 435541 len 1428 csum 0x3736], length 1428
08:47:34.601666 IP 112.26.2.8.46719 > 112.26.2.1.targus-getdata1: Flags [.], seq 61404:62832, ack 1, win 4107, options [nop,nop,TS val 3860459 ecr 4075536,mptcp dss ack 2613390630 seq 2861297410 subseq 436969 len 1428 csum 0xfc85], length 1428
08:47:34.665608 IP 112.26.2.1.targus-getdata1 > 112.26.2.8.46719: Flags [.], ack 62832, win 7028, options [nop,nop,TS val 4077016 ecr 3860332,mptcp dss ack 2861157466], length 0
08:47:34.668786 IP 112.26.2.1.targus-getdata1 > 112.26.2.8.46719: Flags [.], ack 62832, win 7028, options [nop,nop,TS val 4077016 ecr 3860332,mptcp dss ack 2861157466], length 0
08:47:34.745105 IP 112.26.2.8.46719 > 112.26.2.1.targus-getdata1: Flags [.], seq 62832:64260, ack 1, win 4107, options [nop,nop,TS val 3860602 ecr 4075660,mptcp dss ack 2613390630 seq 2861301694 subseq 438397 len 1428 csum 0x7e1a], length 1428
08:47:34.895184 IP 112.26.2.8.46719 > 112.26.2.1.targus-getdata1: Flags [.], seq 64260:65688, ack 1, win 4107, options [nop,nop,TS val 3860735 ecr 4075859,mptcp dss ack 2613390630 seq 2861307406 subseq 439825 len 1428 csum 0x5c60], length 1428
08:47:34.953793 IP 112.26.2.1.targus-getdata1 > 112.26.2.8.46719: Flags [.], ack 65688, win 7028, options [nop,nop,TS val 4077304 ecr 3860602,mptcp dss ack 2861157466], length 0
08:47:34.957715 IP 112.26.2.1.targus-getdata1 > 112.26.2.8.46719: Flags [.], ack 65688, win 7028, options [nop,nop,TS val 4077304 ecr 3860602,mptcp dss ack 2861157466], length 0
08:47:35.067421 IP 112.26.2.8.46719 > 112.26.2.1.targus-getdata1: Flags [.], seq 65688:67116, ack 1, win 4107, options [nop,nop,TS val 3860863 ecr 4076019,mptcp dss ack 2613390630 seq 2861311690 subseq 441253 len 1428 csum 0xc478], length 1428
08:47:35.221364 IP 112.26.2.8.46719 > 112.26.2.1.targus-getdata1: Flags [.], seq 67116:68544, ack 1, win 4107, options [nop,nop,TS val 3860863 ecr 4076019,mptcp dss ack 2613390630 seq 2861313118 subseq 442681 len 1428 csum 0x42d2], length 1428
08:47:35.221659 IP 112.26.2.1.targus-getdata1 > 112.26.2.8.46719: Flags [.], ack 68544, win 6941, options [nop,nop,TS val 4077572 ecr 3860863,mptcp dss ack 2861190310], length 0
08:47:35.226532 IP 112.26.2.1.targus-getdata1 > 112.26.2.8.46719: Flags [.], ack 68544, win 6941, options [nop,nop,TS val 4077572 ecr 3860863,mptcp dss ack 2861190310], length 0
08:47:35.321546 IP 112.26.2.8.46719 > 112.26.2.1.targus-getdata1: Flags [.], seq 68544:69972, ack 1, win 4107, options [nop,nop,TS val 3861002 ecr 4076146,mptcp dss ack 2613390630 seq 2861321686 subseq 444109 len 1428 csum 0xeee1], length 1428
08:47:35.457148 IP 112.26.2.8.46719 > 112.26.2.1.targus-getdata1: Flags [.], seq 69972:71400, ack 1, win 4107, options [nop,nop,TS val 3861106 ecr 4076341,mptcp dss ack 2613390630 seq 2861327398 subseq 445537 len 1428 csum 0xa6a], length 1428
08:47:35.529475 IP 112.26.2.1.targus-getdata1 > 112.26.2.8.46719: Flags [.], ack 71400, win 6941, options [nop,nop,TS val 4077880 ecr 3861002,mptcp dss ack 2861190310], length 0
08:47:35.535899 IP 112.26.2.1.targus-getdata1 > 112.26.2.8.46719: Flags [.], ack 71400, win 6941, options [nop,nop,TS val 4077880 ecr 3861002,mptcp dss ack 2861190310], length 0
08:47:35.593236 IP 112.26.2.8.46719 > 112.26.2.1.targus-getdata1: Flags [.], seq 71400:72828, ack 1, win 4107, options [nop,nop,TS val 3861204 ecr 4076504,mptcp dss ack 2613390630 seq 2861331682 subseq 446965 len 1428 csum 0x7caa], length 1428
08:47:35.707188 IP 112.26.2.8.46719 > 112.26.2.1.targus-getdata1: Flags [.], seq 72828:74256, ack 1, win 4107, options [nop,nop,TS val 3861339 ecr 4076662,mptcp dss ack 2613390630 seq 2861337394 subseq 448393 len 1428 csum 0x8466], length 1428
08:47:35.801494 IP 112.26.2.1.targus-getdata1 > 112.26.2.8.46719: Flags [.], ack 74256, win 6941, options [nop,nop,TS val 4078152 ecr 3861204,mptcp dss ack 2861190310], length 0
08:47:35.804600 IP 112.26.2.1.targus-getdata1 > 112.26.2.8.46719: Flags [.], ack 74256, win 6941, options [nop,nop,TS val 4078152 ecr 3861204,mptcp dss ack 2861190310], length 0
08:47:35.851413 IP 112.26.2.8.46719 > 112.26.2.1.targus-getdata1: Flags [.], seq 74256:75684, ack 1, win 4107, options [nop,nop,TS val 3861339 ecr 4076662,mptcp dss ack 2613390630 seq 2861338822 subseq 449821 len 1428 csum 0xe03f], length 1428
08:47:35.949201 IP 112.26.2.8.46719 > 112.26.2.1.targus-getdata1: Flags [.], seq 75684:77112, ack 1, win 4107, options [nop,nop,TS val 3861491 ecr 4077016,mptcp dss ack 2613390630 seq 2861345962 subseq 451249 len 1428 csum 0x79af], length 1428
08:47:36.057657 IP 112.26.2.1.targus-getdata1 > 112.26.2.8.46719: Flags [.], ack 77112, win 6941, options [nop,nop,TS val 4078408 ecr 3861339,mptcp dss ack 2861190310], length 0
08:47:36.061091 IP 112.26.2.1.targus-getdata1 > 112.26.2.8.46719: Flags [.], ack 77112, win 6941, options [nop,nop,TS val 4078408 ecr 3861339,mptcp dss ack 2861190310], length 0
08:47:36.078397 IP 112.26.2.8.46719 > 112.26.2.1.targus-getdata1: Flags [.], seq 77112:78540, ack 1, win 4107, options [nop,nop,TS val 3861491 ecr 4077016,mptcp dss ack 2613390630 seq 2861347390 subseq 452677 len 1428 csum 0x7563], length 1428
08:47:36.208181 IP 112.26.2.8.46719 > 112.26.2.1.targus-getdata1: Flags [.], seq 78540:79968, ack 1, win 4107, options [nop,nop,TS val 3861700 ecr 4077304,mptcp dss ack 2613390630 seq 2861355958 subseq 454105 len 1428 csum 0xb48f], length 1428
08:47:36.277765 IP 112.26.2.8.46719 > 112.26.2.1.targus-getdata1: Flags [.], seq 79968:81396, ack 1, win 4107, options [nop,nop,TS val 3861700 ecr 4077304,mptcp dss ack 2613390630 seq 2861357386 subseq 455533 len 1428 csum 0xcd88], length 1428
08:47:36.278037 IP 112.26.2.1.targus-getdata1 > 112.26.2.8.46719: Flags [.], ack 81396, win 6941, options [nop,nop,TS val 4078628 ecr 3861491,mptcp dss ack 2861190310], length 0
08:47:36.283075 IP 112.26.2.1.targus-getdata1 > 112.26.2.8.46719: Flags [.], ack 81396, win 6941, options [nop,nop,TS val 4078628 ecr 3861491,mptcp dss ack 2861190310], length 0
08:47:36.401184 IP 112.26.2.8.46719 > 112.26.2.1.targus-getdata1: Flags [.], seq 81396:82824, ack 1, win 4107, options [nop,nop,TS val 3861850 ecr 4077572,mptcp dss ack 2613390630 seq 2861364526 subseq 456961 len 1428 csum 0xfbbd], length 1428
08:47:36.482318 IP 112.26.2.8.46719 > 112.26.2.1.targus-getdata1: Flags [.], seq 82824:84252, ack 1, win 4107, options [nop,nop,TS val 3861850 ecr 4077572,mptcp dss ack 2613390630 seq 2861365954 subseq 458389 len 1428 csum 0x7425], length 1428
08:47:36.591592 IP 112.26.2.1.targus-getdata1 > 112.26.2.8.46719: Flags [.], ack 84252, win 6985, options [nop,nop,TS val 4078942 ecr 3861850,mptcp dss ack 2861267422], length 0
08:47:36.593405 IP 112.26.2.8.46719 > 112.26.2.1.targus-getdata1: Flags [.], seq 84252:85680, ack 1, win 4107, options [nop,nop,TS val 3861986 ecr 4077880,mptcp dss ack 2613390630 seq 2861370238 subseq 459817 len 1428 csum 0x8e41], length 1428
08:47:36.601143 IP 112.26.2.1.targus-getdata1 > 112.26.2.8.46719: Flags [.], ack 84252, win 6985, options [nop,nop,TS val 4078942 ecr 3861850,mptcp dss ack 2861267422], length 0
08:47:36.752583 IP 112.26.2.8.46719 > 112.26.2.1.targus-getdata1: Flags [.], seq 85680:87108, ack 1, win 4107, options [nop,nop,TS val 3861986 ecr 4077880,mptcp dss ack 2613390630 seq 2861371666 subseq 461245 len 1428 csum 0x818f], length 1428
08:47:36.753008 IP 112.26.2.1.targus-getdata1 > 112.26.2.8.46719: Flags [.], ack 87108, win 6985, options [nop,nop,TS val 4079103 ecr 3861986,mptcp dss ack 2861267422], length 0
08:47:36.756743 IP 112.26.2.1.targus-getdata1 > 112.26.2.8.46719: Flags [.], ack 87108, win 6985, options [nop,nop,TS val 4079103 ecr 3861986,mptcp dss ack 2861267422], length 0
08:47:36.853349 IP 112.26.2.8.46719 > 112.26.2.1.targus-getdata1: Flags [.], seq 87108:88536, ack 1, win 4107, options [nop,nop,TS val 3862156 ecr 4078152,mptcp dss ack 2613390630 seq 2861378806 subseq 462673 len 1428 csum 0x388f], length 1428
08:47:36.967912 IP 112.26.2.8.46719 > 112.26.2.1.targus-getdata1: Flags [.], seq 88536:89964, ack 1, win 4107, options [nop,nop,TS val 3862156 ecr 4078152,mptcp dss ack 2613390630 seq 2861380234 subseq 464101 len 1428 csum 0x37d5], length 1428
08:47:36.968275 IP 112.26.2.1.targus-getdata1 > 112.26.2.8.46719: Flags [.], ack 89964, win 7282, options [nop,nop,TS val 4079319 ecr 3862156,mptcp dss ack 2861381662], length 0
08:47:36.977571 IP 112.26.2.1.targus-getdata1 > 112.26.2.8.46719: Flags [.], ack 89964, win 7282, options [nop,nop,TS val 4079319 ecr 3862156,mptcp dss ack 2861381662], length 0
08:47:37.064138 IP 112.26.2.8.46719 > 112.26.2.1.targus-getdata1: Flags [.], seq 89964:91392, ack 1, win 4107, options [nop,nop,TS val 3862156 ecr 4078152,mptcp dss ack 2613390630 seq 2861381662 subseq 465529 len 1428 csum 0xf4e0], length 1428
08:47:37.199943 IP 112.26.2.8.46719 > 112.26.2.1.targus-getdata1: Flags [.], seq 91392:92820, ack 1, win 4107, options [nop,nop,TS val 3862413 ecr 4078408,mptcp dss ack 2613390630 seq 2861393086 subseq 466957 len 1428 csum 0xb009], length 1428
08:47:37.200252 IP 112.26.2.1.targus-getdata1 > 112.26.2.8.46719: Flags [.], ack 92820, win 7282, options [nop,nop,TS val 4079550 ecr 3862156,mptcp dss ack 2861394514], length 0
08:47:37.204889 IP 112.26.2.1.targus-getdata1 > 112.26.2.8.46719: Flags [.], ack 92820, win 7282, options [nop,nop,TS val 4079550 ecr 3862156,mptcp dss ack 2861394514], length 0
08:47:37.337039 IP 112.26.2.8.46719 > 112.26.2.1.targus-getdata1: Flags [.], seq 92820:94248, ack 1, win 4107, options [nop,nop,TS val 3862413 ecr 4078408,mptcp dss ack 2613390630 seq 2861394514 subseq 468385 len 1428 csum 0x2960], length 1428
08:47:37.414947 IP 112.26.2.8.46719 > 112.26.2.1.targus-getdata1: Flags [.], seq 94248:95676, ack 1, win 4107, options [nop,nop,TS val 3862645 ecr 4078628,mptcp dss ack 2613390630 seq 2861405938 subseq 469813 len 1428 csum 0x815a], length 1428
08:47:37.415249 IP 112.26.2.1.targus-getdata1 > 112.26.2.8.46719: Flags [.], ack 95676, win 7282, options [nop,nop,TS val 4079765 ecr 3862413,mptcp dss ack 2861404510], length 0
08:47:37.425070 IP 112.26.2.1.targus-getdata1 > 112.26.2.8.46719: Flags [.], ack 95676, win 7282, options [nop,nop,TS val 4079765 ecr 3862413,mptcp dss ack 2861404510], length 0
08:47:37.590502 IP 112.26.2.8.46719 > 112.26.2.1.targus-getdata1: Flags [.], seq 97104:98532, ack 1, win 4107, options [nop,nop,TS val 3862645 ecr 4078628,mptcp dss ack 2613390630 seq 2861408794 subseq 472669 len 1428 csum 0xe549], length 1428
08:47:37.590867 IP 112.26.2.1.targus-getdata1 > 112.26.2.8.46719: Flags [.], ack 95676, win 7282, options [nop,nop,TS val 4079941 ecr 3862413,nop,nop,sack 1 {97104:98532},mptcp dss ack 2861407366], length 0
08:47:37.595003 IP 112.26.2.1.targus-getdata1 > 112.26.2.8.46719: Flags [.], ack 95676, win 7282, options [nop,nop,TS val 4079941 ecr 3862413,nop,nop,sack 1 {97104:98532},mptcp dss ack 2861407366], length 0
08:47:37.742871 IP 112.26.2.8.46719 > 112.26.2.1.targus-getdata1: Flags [.], seq 99960:101388, ack 1, win 4107, options [nop,nop,TS val 3862978 ecr 4078942,mptcp dss ack 2613390630 seq 2861430214 subseq 475525 len 1428 csum 0xac77], length 1428
08:47:37.743140 IP 112.26.2.1.targus-getdata1 > 112.26.2.8.46719: Flags [.], ack 95676, win 7282, options [nop,nop,TS val 4080093 ecr 3862413,nop,nop,sack 2 {99960:101388}{97104:98532},mptcp dss ack 2861407366], length 0
08:47:37.748679 IP 112.26.2.1.targus-getdata1 > 112.26.2.8.46719: Flags [.], ack 95676, win 7282, options [nop,nop,TS val 4080093 ecr 3862413,nop,nop,sack 2 {99960:101388}{97104:98532},mptcp dss ack 2861407366], length 0
08:47:37.869102 IP 112.26.2.8.46719 > 112.26.2.1.targus-getdata1: Flags [.], seq 101388:102816, ack 1, win 4107, options [nop,nop,TS val 3862978 ecr 4078942,mptcp dss ack 2613390630 seq 2861431642 subseq 476953 len 1428 csum 0x18e5], length 1428
08:47:37.869450 IP 112.26.2.1.targus-getdata1 > 112.26.2.8.46719: Flags [.], ack 95676, win 7282, options [nop,nop,TS val 4080219 ecr 3862413,nop,nop,sack 2 {99960:102816}{97104:98532},mptcp dss ack 2861407366], length 0
08:47:37.877861 IP 112.26.2.1.targus-getdata1 > 112.26.2.8.46719: Flags [.], ack 95676, win 7282, options [nop,nop,TS val 4080219 ecr 3862413,nop,nop,sack 2 {99960:102816}{97104:98532},mptcp dss ack 2861407366], length 0
08:47:37.993134 IP 112.26.2.8.46719 > 112.26.2.1.targus-getdata1: Flags [.], seq 102816:104244, ack 1, win 4107, options [nop,nop,TS val 3863118 ecr 4079103,mptcp dss ack 2613390630 seq 2861440210 subseq 478381 len 1428 csum 0x47f1], length 1428
