08:46:51.682800 IP 112.26.0.8.57088 > 112.26.0.1.targus-getdata1: Flags [S], seq 2113503710, win 65535, options [mss 1460,sackOK,TS val 3817963 ecr 0,nop,wscale 6,mptcp capable csum {0xd796544632994ff}], length 0
08:46:51.683173 IP 112.26.0.1.targus-getdata1 > 112.26.0.8.57088: Flags [S.], seq 485296302, ack 2113503711, win 28560, options [mss 1460,sackOK,TS val 4034034 ecr 3817963,nop,wscale 7,mptcp capable csum {0x4b7d5dd76db2692}], length 0
08:46:51.900297 IP 112.26.0.1.targus-getdata1 > 112.26.0.8.57088: Flags [S.], seq 485296302, ack 2113503711, win 28560, options [mss 1460,sackOK,TS val 4034034 ecr 3817963,nop,wscale 7,mptcp capable csum {0x4b7d5dd76db2692}], length 0
08:46:52.173860 IP 112.26.0.8.57088 > 112.26.0.1.targus-getdata1: Flags [.], ack 1, win 1369, options [nop,nop,TS val 3818435 ecr 4034034,mptcp capable csum {0xd796544632994ff,0x4b7d5dd76db2692},mptcp dss ack 3819027815], length 0
08:46:52.174204 IP 112.26.0.1.targus-getdata1 > 112.26.0.8.57088: Flags [.], ack 1, win 224, options [nop,nop,TS val 4034524 ecr 3818435,mptcp add-addr id 3 112.26.1.1,mptcp dss ack 4209528899], length 0
08:46:52.174265 IP 112.26.0.1.targus-getdata1 > 112.26.0.8.57088: Flags [.], ack 1, win 224, options [nop,nop,TS val 4034524 ecr 3818435,mptcp add-addr id 5 112.26.3.1,mptcp dss ack 4209528899], length 0
08:46:52.174309 IP 112.26.0.1.targus-getdata1 > 112.26.0.8.57088: Flags [.], ack 1, win 224, options [nop,nop,TS val 4034524 ecr 3818435,mptcp add-addr id 6 112.26.2.1,mptcp dss ack 4209528899], length 0
08:47:26.249292 IP 112.26.0.1.targus-getdata1 > 112.26.0.8.57090: Flags [.], ack 2480786280, win 7282, options [nop,nop,TS val 4068600 ecr 3851676,mptcp dss ack 2860877578], length 0
08:47:26.251882 IP 112.26.0.1.targus-getdata1 > 112.26.0.8.57090: Flags [.], ack 1, win 7282, options [nop,nop,TS val 4068600 ecr 3851676,mptcp dss ack 2860877578], length 0
08:47:26.329864 IP 112.26.0.8.57090 > 112.26.0.1.targus-getdata1: Flags [.], seq 1:1429, ack 0, win 4107, options [nop,nop,TS val 3851938 ecr 4067112,mptcp dss ack 2613390630 seq 2860944694 subseq 322766 len 1428 csum 0x75c7], length 1428
08:47:26.425660 IP 112.26.0.1.targus-getdata1 > 112.26.0.8.57090: Flags [.], ack 1429, win 7282, options [nop,nop,TS val 4068776 ecr 3851938,mptcp dss ack 2860877578], length 0
08:47:41.598994 IP 112.26.0.8.57090 > 112.26.0.1.targus-getdata1: Flags [.], seq 175645:177073, ack 0, win 4107, options [nop,nop,TS val 3866242 ecr 4081728,mptcp dss ack 2613390630 seq 2861603002 subseq 498410 len 1428 csum 0x1ffd], length 1428
08:47:53.515779 IP 112.26.0.8.57090 > 112.26.0.1.targus-getdata1: Flags [.], seq 294169:295597, ack 0, win 4107, options [nop,nop,TS val 3878674 ecr 4094400,mptcp dss ack 2613390630 seq 2862151354 subseq 616934 len 1428 csum 0x9255], length 1428
08:48:05.065938 IP 112.26.0.1.targus-getdata1 > 112.26.0.8.57090: Flags [.], ack 411265, win 7282, options [nop,nop,TS val 4107416 ecr 3890603,mptcp dss ack 2862558334], length 0
08:48:05.076185 IP 112.26.0.1.targus-getdata1 > 112.26.0.8.57090: Flags [.], ack 411265, win 7282, options [nop,nop,TS val 4107416 ecr 3890603,mptcp dss ack 2862558334], length 0
08:48:05.102780 IP 112.26.0.8.57090 > 112.26.0.1.targus-getdata1: Flags [.], seq 411265:412693, ack 0, win 4107, options [nop,nop,TS val 3890839 ecr 4106012,mptcp dss ack 2613390630 seq 2862646870 subseq 734030 len 1428 csum 0x4f9], length 1428
08:48:05.193309 IP 112.26.0.1.targus-getdata1 > 112.26.0.8.57090: Flags [.], ack 412693, win 7282, options [nop,nop,TS val 4107544 ecr 3890839,mptcp dss ack 2862558334], length 0
08:48:05.200738 IP 112.26.0.1.targus-getdata1 > 112.26.0.8.57090: Flags [.], ack 412693, win 7282, options [nop,nop,TS val 4107544 ecr 3890839,mptcp dss ack 2862558334], length 0
08:48:05.257977 IP 112.26.0.8.57090 > 112.26.0.1.targus-getdata1: Flags [.], seq 412693:414121, ack 0, win 4107, options [nop,nop,TS val 3890839 ecr 4106012,mptcp dss ack 2613390630 seq 2862648298 subseq 735458 len 1428 csum 0xda5a], length 1428
08:48:05.353482 IP 112.26.0.1.targus-getdata1 > 112.26.0.8.57090: Flags [.], ack 414121, win 7282, options [nop,nop,TS val 4107704 ecr 3890839,mptcp dss ack 2862558334], length 0
08:48:05.416439 IP 112.26.0.8.57090 > 112.26.0.1.targus-getdata1: Flags [.], seq 414121:415549, ack 0, win 4107, options [nop,nop,TS val 3890955 ecr 4106304,mptcp dss ack 2613390630 seq 2862658294 subseq 736886 len 1428 csum 0x198], length 1428
08:48:05.432511 IP 112.26.0.1.targus-getdata1 > 112.26.0.8.57090: Flags [.], ack 414121, win 7282, options [nop,nop,TS val 4107704 ecr 3890839,mptcp dss ack 2862558334], length 0
08:48:05.505668 IP 112.26.0.1.targus-getdata1 > 112.26.0.8.57090: Flags [.], ack 415549, win 7282, options [nop,nop,TS val 4107856 ecr 3890955,mptcp dss ack 2862594034], length 0
08:48:05.547447 IP 112.26.0.1.targus-getdata1 > 112.26.0.8.57090: Flags [.], ack 415549, win 7282, options [nop,nop,TS val 4107856 ecr 3890955,mptcp dss ack 2862594034], length 0
08:48:05.569010 IP 112.26.0.8.57090 > 112.26.0.1.targus-getdata1: Flags [.], seq 415549:416977, ack 0, win 4107, options [nop,nop,TS val 3890955 ecr 4106304,mptcp dss ack 2613390630 seq 2862659722 subseq 738314 len 1428 csum 0xbe23], length 1428
08:48:05.657733 IP 112.26.0.1.targus-getdata1 > 112.26.0.8.57090: Flags [.], ack 416977, win 7282, options [nop,nop,TS val 4108008 ecr 3890955,mptcp dss ack 2862594034], length 0
08:48:05.661701 IP 112.26.0.1.targus-getdata1 > 112.26.0.8.57090: Flags [.], ack 416977, win 7282, options [nop,nop,TS val 4108008 ecr 3890955,mptcp dss ack 2862594034], length 0
08:48:05.711388 IP 112.26.0.8.57090 > 112.26.0.1.targus-getdata1: Flags [.], seq 416977:418405, ack 0, win 4107, options [nop,nop,TS val 3891229 ecr 4106427,mptcp dss ack 2613390630 seq 2862668290 subseq 739742 len 1428 csum 0xa9c], length 1428
08:48:05.801505 IP 112.26.0.1.targus-getdata1 > 112.26.0.8.57090: Flags [.], ack 418405, win 7282, options [nop,nop,TS val 4108152 ecr 3891229,mptcp dss ack 2862604030], length 0
08:48:05.805976 IP 112.26.0.1.targus-getdata1 > 112.26.0.8.57090: Flags [.], ack 418405, win 7282, options [nop,nop,TS val 4108152 ecr 3891229,mptcp dss ack 2862604030], length 0
08:48:05.842864 IP 112.26.0.8.57090 > 112.26.0.1.targus-getdata1: Flags [.], seq 418405:419833, ack 0, win 4107, options [nop,nop,TS val 3891229 ecr 4106427,mptcp dss ack 2613390630 seq 2862669718 subseq 741170 len 1428 csum 0x8508], length 1428
08:48:05.937557 IP 112.26.0.1.targus-getdata1 > 112.26.0.8.57090: Flags [.], ack 419833, win 7282, options [nop,nop,TS val 4108288 ecr 3891229,mptcp dss ack 2862636874], length 0
08:48:05.939944 IP 112.26.0.1.targus-getdata1 > 112.26.0.8.57090: Flags [.], ack 419833, win 7282, options [nop,nop,TS val 4108288 ecr 3891229,mptcp dss ack 2862636874], length 0
08:48:05.987567 IP 112.26.0.8.57090 > 112.26.0.1.targus-getdata1: Flags [.], seq 419833:421261, ack 0, win 4107, options [nop,nop,TS val 3891380 ecr 4106648,mptcp dss ack 2613390630 seq 2862674002 subseq 742598 len 1428 csum 0xe34d], length 1428
08:48:06.081690 IP 112.26.0.1.targus-getdata1 > 112.26.0.8.57090: Flags [.], ack 421261, win 7282, options [nop,nop,TS val 4108432 ecr 3891380,mptcp dss ack 2862636874], length 0
08:48:06.085404 IP 112.26.0.8.57090 > 112.26.0.1.targus-getdata1: Flags [.], seq 421261:422689, ack 0, win 4107, options [nop,nop,TS val 3891540 ecr 4106776,mptcp dss ack 2613390630 seq 2862685426 subseq 744026 len 1428 csum 0x6cc8], length 1428
08:48:06.088173 IP 112.26.0.1.targus-getdata1 > 112.26.0.8.57090: Flags [.], ack 421261, win 7282, options [nop,nop,TS val 4108432 ecr 3891380,mptcp dss ack 2862636874], length 0
08:48:06.177713 IP 112.26.0.1.targus-getdata1 > 112.26.0.8.57090: Flags [.], ack 422689, win 7282, options [nop,nop,TS val 4108528 ecr 3891540,mptcp dss ack 2862636874], length 0
08:48:06.181461 IP 112.26.0.1.targus-getdata1 > 112.26.0.8.57090: Flags [.], ack 422689, win 7282, options [nop,nop,TS val 4108528 ecr 3891540,mptcp dss ack 2862636874], length 0
08:48:06.234279 IP 112.26.0.8.57090 > 112.26.0.1.targus-getdata1: Flags [.], seq 422689:424117, ack 0, win 4107, options [nop,nop,TS val 3891846 ecr 4106920,mptcp dss ack 2613390630 seq 2862698278 subseq 745454 len 1428 csum 0x1454], length 1428
08:48:06.306973 IP 112.26.0.8.57090 > 112.26.0.1.targus-getdata1: Flags [.], seq 424117:425545, ack 0, win 4107, options [nop,nop,TS val 3891952 ecr 4107032,mptcp dss ack 2613390630 seq 2862701134 subseq 746882 len 1428 csum 0x4d6a], length 1428
08:48:06.307421 IP 112.26.0.1.targus-getdata1 > 112.26.0.8.57090: Flags [.], ack 425545, win 7282, options [nop,nop,TS val 4108657 ecr 3891846,mptcp dss ack 2862636874], length 0
08:48:06.313362 IP 112.26.0.1.targus-getdata1 > 112.26.0.8.57090: Flags [.], ack 425545, win 7282, options [nop,nop,TS val 4108657 ecr 3891846,mptcp dss ack 2862636874], length 0
08:48:06.470643 IP 112.26.0.8.57090 > 112.26.0.1.targus-getdata1: Flags [.], seq 425545:426973, ack 0, win 4107, options [nop,nop,TS val 3892123 ecr 4107192,mptcp dss ack 2613390630 seq 2862712558 subseq 748310 len 1428 csum 0x16ed], length 1428
08:48:06.561324 IP 112.26.0.1.targus-getdata1 > 112.26.0.8.57090: Flags [.], ack 426973, win 7282, options [nop,nop,TS val 4108912 ecr 3892123,mptcp dss ack 2862636874], length 0
08:48:06.577577 IP 112.26.0.1.targus-getdata1 > 112.26.0.8.57090: Flags [.], ack 426973, win 7282, options [nop,nop,TS val 4108912 ecr 3892123,mptcp dss ack 2862636874], length 0
08:48:06.607015 IP 112.26.0.8.57090 > 112.26.0.1.targus-getdata1: Flags [.], seq 426973:428401, ack 0, win 4107, options [nop,nop,TS val 3892123 ecr 4107192,mptcp dss ack 2613390630 seq 2862713986 subseq 749738 len 1428 csum 0x12a1], length 1428
08:48:06.676486 IP 112.26.0.8.57090 > 112.26.0.1.targus-getdata1: Flags [.], seq 428401:429829, ack 0, win 4107, options [nop,nop,TS val 3892217 ecr 4107312,mptcp dss ack 2613390630 seq 2862716842 subseq 751166 len 1428 csum 0xad62], length 1428
08:48:06.676763 IP 112.26.0.1.targus-getdata1 > 112.26.0.8.57090: Flags [.], ack 429829, win 7282, options [nop,nop,TS val 4109027 ecr 3892123,mptcp dss ack 2862636874], length 0
08:48:06.716327 IP 112.26.0.1.targus-getdata1 > 112.26.0.8.57090: Flags [.], ack 429829, win 7282, options [nop,nop,TS val 4109027 ecr 3892123,mptcp dss ack 2862636874], length 0
08:48:06.825188 IP 112.26.0.8.57090 > 112.26.0.1.targus-getdata1: Flags [.], seq 429829:431257, ack 0, win 4107, options [nop,nop,TS val 3892340 ecr 4107416,mptcp dss ack 2613390630 seq 2862722554 subseq 752594 len 1428 csum 0x4c39], length 1428
08:48:06.921492 IP 112.26.0.1.targus-getdata1 > 112.26.0.8.57090: Flags [.], ack 431257, win 7282, options [nop,nop,TS val 4109272 ecr 3892340,mptcp dss ack 2862636874], length 0
08:48:06.925475 IP 112.26.0.1.targus-getdata1 > 112.26.0.8.57090: Flags [.], ack 431257, win 7282, options [nop,nop,TS val 4109272 ecr 3892340,mptcp dss ack 2862636874], length 0
08:48:06.994139 IP 112.26.0.8.57090 > 112.26.0.1.targus-getdata1: Flags [.], seq 431257:432685, ack 0, win 4107, options [nop,nop,TS val 3892551 ecr 4107704,mptcp dss ack 2613390630 seq 2862731122 subseq 754022 len 1428 csum 0x98fb], length 1428
08:48:07.089627 IP 112.26.0.1.targus-getdata1 > 112.26.0.8.57090: Flags [.], ack 432685, win 7282, options [nop,nop,TS val 4109440 ecr 3892551,mptcp dss ack 2862636874], length 0
08:48:07.092781 IP 112.26.0.1.targus-getdata1 > 112.26.0.8.57090: Flags [.], ack 432685, win 7282, options [nop,nop,TS val 4109440 ecr 3892551,mptcp dss ack 2862636874], length 0
08:48:07.158208 IP 112.26.0.8.57090 > 112.26.0.1.targus-getdata1: Flags [.], seq 432685:434113, ack 0, win 4107, options [nop,nop,TS val 3892551 ecr 4107704,mptcp dss ack 2613390630 seq 2862732550 subseq 755450 len 1428 csum 0x1163], length 1428
08:48:07.249558 IP 112.26.0.1.targus-getdata1 > 112.26.0.8.57090: Flags [.], ack 434113, win 7282, options [nop,nop,TS val 4109600 ecr 3892551,mptcp dss ack 2862654010], length 0
08:48:07.252739 IP 112.26.0.1.targus-getdata1 > 112.26.0.8.57090: Flags [.], ack 434113, win 7282, options [nop,nop,TS val 4109600 ecr 3892551,mptcp dss ack 2862654010], length 0
08:48:07.290557 IP 112.26.0.8.57090 > 112.26.0.1.targus-getdata1: Flags [.], seq 434113:435541, ack 0, win 4107, options [nop,nop,TS val 3892551 ecr 4107704,mptcp dss ack 2613390630 seq 2862733978 subseq 756878 len 1428 csum 0x8698], length 1428
08:48:07.377203 IP 112.26.0.8.57090 > 112.26.0.1.targus-getdata1: Flags [.], seq 435541:436969, ack 0, win 4107, options [nop,nop,TS val 3892672 ecr 4107856,mptcp dss ack 2613390630 seq 2862736834 subseq 758306 len 1428 csum 0x25eb], length 1428
08:48:07.377430 IP 112.26.0.1.targus-getdata1 > 112.26.0.8.57090: Flags [.], ack 436969, win 7282, options [nop,nop,TS val 4109728 ecr 3892551,mptcp dss ack 2862654010], length 0
08:48:07.381589 IP 112.26.0.1.targus-getdata1 > 112.26.0.8.57090: Flags [.], ack 436969, win 7282, options [nop,nop,TS val 4109728 ecr 3892551,mptcp dss ack 2862654010], length 0
08:48:07.548976 IP 112.26.0.8.57090 > 112.26.0.1.targus-getdata1: Flags [.], seq 436969:438397, ack 0, win 4107, options [nop,nop,TS val 3892857 ecr 4108008,mptcp dss ack 2613390630 seq 2862742546 subseq 759734 len 1428 csum 0x4dc7], length 1428
08:48:07.609630 IP 112.26.0.8.57090 > 112.26.0.1.targus-getdata1: Flags [.], seq 438397:439825, ack 0, win 4107, options [nop,nop,TS val 3892857 ecr 4108008,mptcp dss ack 2613390630 seq 2862743974 subseq 761162 len 1428 csum 0x1509], length 1428
08:48:07.641477 IP 112.26.0.1.targus-getdata1 > 112.26.0.8.57090: Flags [.], ack 439825, win 7282, options [nop,nop,TS val 4109992 ecr 3892857,mptcp dss ack 2862654010], length 0
08:48:07.644016 IP 112.26.0.1.targus-getdata1 > 112.26.0.8.57090: Flags [.], ack 439825, win 7282, options [nop,nop,TS val 4109992 ecr 3892857,mptcp dss ack 2862654010], length 0
08:48:07.719721 IP 112.26.0.8.57090 > 112.26.0.1.targus-getdata1: Flags [.], seq 439825:441253, ack 0, win 4107, options [nop,nop,TS val 3892917 ecr 4108152,mptcp dss ack 2613390630 seq 2862746830 subseq 762590 len 1428 csum 0xcf7e], length 1428
08:48:07.809615 IP 112.26.0.1.targus-getdata1 > 112.26.0.8.57090: Flags [.], ack 441253, win 7282, options [nop,nop,TS val 4110160 ecr 3892917,mptcp dss ack 2862654010], length 0
08:48:07.813227 IP 112.26.0.1.targus-getdata1 > 112.26.0.8.57090: Flags [.], ack 441253, win 7282, options [nop,nop,TS val 4110160 ecr 3892917,mptcp dss ack 2862654010], length 0
08:48:07.833067 IP 112.26.0.8.57090 > 112.26.0.1.targus-getdata1: Flags [.], seq 441253:442681, ack 0, win 4107, options [nop,nop,TS val 3893126 ecr 4108288,mptcp dss ack 2613390630 seq 2862752542 subseq 764018 len 1428 csum 0xf8f8], length 1428
08:48:07.921783 IP 112.26.0.1.targus-getdata1 > 112.26.0.8.57090: Flags [.], ack 442681, win 7282, options [nop,nop,TS val 4110272 ecr 3893126,mptcp dss ack 2862654010], length 0
08:48:07.936247 IP 112.26.0.1.targus-getdata1 > 112.26.0.8.57090: Flags [.], ack 442681, win 7282, options [nop,nop,TS val 4110272 ecr 3893126,mptcp dss ack 2862654010], length 0
08:48:07.942680 IP 112.26.0.8.57090 > 112.26.0.1.targus-getdata1: Flags [.], seq 442681:444109, ack 0, win 4107, options [nop,nop,TS val 3893294 ecr 4108432,mptcp dss ack 2613390630 seq 2862756826 subseq 765446 len 1428 csum 0x8ba5], length 1428
08:48:08.033799 IP 112.26.0.1.targus-getdata1 > 112.26.0.8.57090: Flags [.], ack 444109, win 7282, options [nop,nop,TS val 4110384 ecr 3893294,mptcp dss ack 2862654010], length 0
08:48:08.086981 IP 112.26.0.8.57090 > 112.26.0.1.targus-getdata1: Flags [.], seq 444109:445537, ack 0, win 4107, options [nop,nop,TS val 3893294 ecr 4108432,mptcp dss ack 2613390630 seq 2862758254 subseq 766874 len 1428 csum 0x659c], length 1428
08:48:08.177330 IP 112.26.0.1.targus-getdata1 > 112.26.0.8.57090: Flags [.], ack 445537, win 7282, options [nop,nop,TS val 4110528 ecr 3893294,mptcp dss ack 2862654010], length 0
08:48:08.199052 IP 112.26.0.1.targus-getdata1 > 112.26.0.8.57090: Flags [.], ack 444109, win 7282, options [nop,nop,TS val 4110384 ecr 3893294,mptcp dss ack 2862654010], length 0
08:48:08.249819 IP 112.26.0.8.57090 > 112.26.0.1.targus-getdata1: Flags [.], seq 445537:446965, ack 0, win 4107, options [nop,nop,TS val 3893452 ecr 4108528,mptcp dss ack 2613390630 seq 2862766822 subseq 768302 len 1428 csum 0xf381], length 1428
08:48:08.287201 IP 112.26.0.1.targus-getdata1 > 112.26.0.8.57090: Flags [.], ack 445537, win 7282, options [nop,nop,TS val 4110528 ecr 3893294,mptcp dss ack 2862654010], length 0
08:48:08.345466 IP 112.26.0.1.targus-getdata1 > 112.26.0.8.57090: Flags [.], ack 446965, win 7282, options [nop,nop,TS val 4110696 ecr 3893452,mptcp dss ack 2862654010], length 0
08:48:08.353541 IP 112.26.0.1.targus-getdata1 > 112.26.0.8.57090: Flags [.], ack 446965, win 7282, options [nop,nop,TS val 4110696 ecr 3893452,mptcp dss ack 2862654010], length 0
08:48:08.444067 IP 112.26.0.8.57090 > 112.26.0.1.targus-getdata1: Flags [.], seq 446965:448393, ack 0, win 4107, options [nop,nop,TS val 3893452 ecr 4108528,mptcp dss ack 2613390630 seq 2862768250 subseq 769730 len 1428 csum 0x3e5e], length 1428
08:48:08.537607 IP 112.26.0.1.targus-getdata1 > 112.26.0.8.57090: Flags [.], ack 448393, win 7070, options [nop,nop,TS val 4110888 ecr 3893452,mptcp dss ack 2862682570], length 0
08:48:08.542118 IP 112.26.0.1.targus-getdata1 > 112.26.0.8.57090: Flags [.], ack 448393, win 7070, options [nop,nop,TS val 4110888 ecr 3893452,mptcp dss ack 2862682570], length 0
08:48:08.565781 IP 112.26.0.8.57090 > 112.26.0.1.targus-getdata1: Flags [.], seq 448393:449821, ack 0, win 4107, options [nop,nop,TS val 3893572 ecr 4108657,mptcp dss ack 2613390630 seq 2862771106 subseq 771158 len 1428 csum 0x4328], length 1428
08:48:08.645754 IP 112.26.0.8.57090 > 112.26.0.1.targus-getdata1: Flags [.], seq 449821:451249, ack 0, win 4107, options [nop,nop,TS val 3893572 ecr 4108657,mptcp dss ack 2613390630 seq 2862772534 subseq 772586 len 1428 csum 0x848], length 1428
08:48:08.646045 IP 112.26.0.1.targus-getdata1 > 112.26.0.8.57090: Flags [.], ack 451249, win 7070, options [nop,nop,TS val 4110996 ecr 3893572,mptcp dss ack 2862682570], length 0
08:48:08.650262 IP 112.26.0.1.targus-getdata1 > 112.26.0.8.57090: Flags [.], ack 451249, win 7070, options [nop,nop,TS val 4110996 ecr 3893572,mptcp dss ack 2862682570], length 0
08:48:08.831447 IP 112.26.0.8.57090 > 112.26.0.1.targus-getdata1: Flags [.], seq 451249:452677, ack 0, win 4107, options [nop,nop,TS val 3893572 ecr 4108657,mptcp dss ack 2613390630 seq 2862773962 subseq 774014 len 1428 csum 0xb6c3], length 1428
08:48:08.921941 IP 112.26.0.1.targus-getdata1 > 112.26.0.8.57090: Flags [.], ack 452677, win 7120, options [nop,nop,TS val 4111272 ecr 3893572,mptcp dss ack 2862708274], length 0
08:48:08.931725 IP 112.26.0.1.targus-getdata1 > 112.26.0.8.57090: Flags [.], ack 452677, win 7120, options [nop,nop,TS val 4111272 ecr 3893572,mptcp dss ack 2862708274], length 0
08:48:09.147977 IP 112.26.0.8.57090 > 112.26.0.1.targus-getdata1: Flags [.], seq 454105:455533, ack 0, win 4107, options [nop,nop,TS val 3893863 ecr 4109027,mptcp dss ack 2613390630 seq 2862783958 subseq 776870 len 1428 csum 0xfcd], length 1428
08:48:09.148214 IP 112.26.0.1.targus-getdata1 > 112.26.0.8.57090: Flags [.], ack 452677, win 7120, options [nop,nop,TS val 4111498 ecr 3893572,nop,nop,sack 1 {454105:455533},mptcp dss ack 2862708274], length 0
08:48:09.160011 IP 112.26.0.1.targus-getdata1 > 112.26.0.8.57090: Flags [.], ack 452677, win 7120, options [nop,nop,TS val 4111498 ecr 3893572,nop,nop,sack 1 {454105:455533},mptcp dss ack 2862708274], length 0
08:48:09.230792 IP 112.26.0.8.57090 > 112.26.0.1.targus-getdata1: Flags [.], seq 455533:456961, ack 0, win 4107, options [nop,nop,TS val 3893863 ecr 4109027,mptcp dss ack 2613390630 seq 2862785386 subseq 778298 len 1428 csum 0x69b2], length 1428
08:48:09.230955 IP 112.26.0.1.targus-getdata1 > 112.26.0.8.57090: Flags [.], ack 452677, win 7120, options [nop,nop,TS val 4111581 ecr 3893572,nop,nop,sack 1 {454105:456961},mptcp dss ack 2862708274], length 0
08:48:09.270200 IP 112.26.0.1.targus-getdata1 > 112.26.0.8.57090: Flags [.], ack 452677, win 7120, options [nop,nop,TS val 4111581 ecr 3893572,nop,nop,sack 1 {454105:456961},mptcp dss ack 2862708274], length 0
08:48:09.402616 IP 112.26.0.8.57090 > 112.26.0.1.targus-getdata1: Flags [.], seq 456961:458389, ack 0, win 4107, options [nop,nop,TS val 3893863 ecr 4109027,mptcp dss ack 2613390630 seq 2862786814 subseq 779726 len 1428 csum 0x7e55], length 1428
08:48:09.402891 IP 112.26.0.1.targus-getdata1 > 112.26.0.8.57090: Flags [.], ack 452677, win 7120, options [nop,nop,TS val 4111753 ecr 3893572,nop,nop,sack 1 {454105:458389},mptcp dss ack 2862708274], length 0
08:48:09.406090 IP 112.26.0.1.targus-getdata1 > 112.26.0.8.57090: Flags [.], ack 452677, win 7120, options [nop,nop,TS val 4111753 ecr 3893572,nop,nop,sack 1 {454105:458389},mptcp dss ack 2862708274], length 0
08:48:09.544948 IP 112.26.0.8.57090 > 112.26.0.1.targus-getdata1: Flags [.], seq 459817:461245, ack 0, win 4107, options [nop,nop,TS val 3894232 ecr 4109272,mptcp dss ack 2613390630 seq 2862798238 subseq 782582 len 1428 csum 0x94aa], length 1428
08:48:09.545215 IP 112.26.0.1.targus-getdata1 > 112.26.0.8.57090: Flags [.], ack 452677, win 7120, options [nop,nop,TS val 4111895 ecr 3893572,nop,nop,sack 2 {459817:461245}{454105:458389},mptcp dss ack 2862708274], length 0
08:48:09.555033 IP 112.26.0.1.targus-getdata1 > 112.26.0.8.57090: Flags [.], ack 452677, win 7120, options [nop,nop,TS val 4111895 ecr 3893572,nop,nop,sack 2 {459817:461245}{454105:458389},mptcp dss ack 2862708274], length 0
08:48:09.658956 IP 112.26.0.8.57090 > 112.26.0.1.targus-getdata1: Flags [.], seq 461245:462673, ack 0, win 4107, options [nop,nop,TS val 3894396 ecr 4109440,mptcp dss ack 2613390630 seq 2862802522 subseq 784010 len 1428 csum 0x48bf], length 1428
08:48:09.659157 IP 112.26.0.1.targus-getdata1 > 112.26.0.8.57090: Flags [.], ack 452677, win 7120, options [nop,nop,TS val 4112009 ecr 3893572,nop,nop,sack 2 {459817:462673}{454105:458389},mptcp dss ack 2862708274], length 0
08:48:09.663087 IP 112.26.0.1.targus-getdata1 > 112.26.0.8.57090: Flags [.], ack 452677, win 7120, options [nop,nop,TS val 4112009 ecr 3893572,nop,nop,sack 2 {459817:462673}{454105:458389},mptcp dss ack 2862708274], length 0
08:48:09.843136 IP 112.26.0.8.57090 > 112.26.0.1.targus-getdata1: Flags [.], seq 462673:464101, ack 0, win 4107, options [nop,nop,TS val 3894546 ecr 4109600,mptcp dss ack 2613390630 seq 2862812518 subseq 785438 len 1428 csum 0xf48d], length 1428
08:48:09.843322 IP 112.26.0.1.targus-getdata1 > 112.26.0.8.57090: Flags [.], ack 452677, win 7120, options [nop,nop,TS val 4112194 ecr 3893572,nop,nop,sack 2 {459817:464101}{454105:458389},mptcp dss ack 2862708274], length 0
08:48:09.848306 IP 112.26.0.1.targus-getdata1 > 112.26.0.8.57090: Flags [.], ack 452677, win 7120, options [nop,nop,TS val 4112194 ecr 3893572,nop,nop,sack 2 {459817:464101}{454105:458389},mptcp dss ack 2862708274], length 0
08:48:09.997600 IP 112.26.0.8.57090 > 112.26.0.1.targus-getdata1: Flags [.], seq 464101:465529, ack 0, win 4107, options [nop,nop,TS val 3894546 ecr 4109600,mptcp dss ack 2613390630 seq 2862813946 subseq 786866 len 1428 csum 0x4245], length 1428
08:48:09.997860 IP 112.26.0.1.targus-getdata1 > 112.26.0.8.57090: Flags [.], ack 452677, win 7120, options [nop,nop,TS val 4112348 ecr 3893572,nop,nop,sack 2 {459817:465529}{454105:458389},mptcp dss ack 2862708274], length 0
08:48:10.008787 IP 112.26.0.1.targus-getdata1 > 112.26.0.8.57090: Flags [.], ack 452677, win 7120, options [nop,nop,TS val 4112348 ecr 3893572,nop,nop,sack 2 {459817:465529}{454105:458389},mptcp dss ack 2862708274], length 0
08:48:10.072923 IP 112.26.0.8.57090 > 112.26.0.1.targus-getdata1: Flags [.], seq 465529:466957, ack 0, win 4107, options [nop,nop,TS val 3894671 ecr 4109728,mptcp dss ack 2613390630 seq 2862818230 subseq 788294 len 1428 csum 0x28e3], length 1428
08:48:10.073150 IP 112.26.0.1.targus-getdata1 > 112.26.0.8.57090: Flags [.], ack 452677, win 7120, options [nop,nop,TS val 4112423 ecr 3893572,nop,nop,sack 2 {459817:466957}{454105:458389},mptcp dss ack 2862708274], length 0
08:48:10.130229 IP 112.26.0.1.targus-getdata1 > 112.26.0.8.57090: Flags [.], ack 452677, win 7120, options [nop,nop,TS val 4112423 ecr 3893572,nop,nop,sack 2 {459817:466957}{454105:458389},mptcp dss ack 2862708274], length 0
08:48:10.163632 IP 112.26.0.8.57090 > 112.26.0.1.targus-getdata1: Flags [.], seq 466957:468385, ack 0, win 4107, options [nop,nop,TS val 3894671 ecr 4109728,mptcp dss ack 2613390630 seq 2862819658 subseq 789722 len 1428 csum 0xc61e], length 1428
08:48:10.163882 IP 112.26.0.1.targus-getdata1 > 112.26.0.8.57090: Flags [.], ack 452677, win 7120, options [nop,nop,TS val 4112514 ecr 3893572,nop,nop,sack 2 {459817:468385}{454105:458389},mptcp dss ack 2862708274], length 0
08:48:10.234587 IP 112.26.0.1.targus-getdata1 > 112.26.0.8.57090: Flags [.], ack 452677, win 7120, options [nop,nop,TS val 4112514 ecr 3893572,nop,nop,sack 2 {459817:468385}{454105:458389},mptcp dss ack 2862708274], length 0
08:48:10.283732 IP 112.26.0.8.57090 > 112.26.0.1.targus-getdata1: Flags [.], seq 468385:469813, ack 0, win 4107, options [nop,nop,TS val 3894671 ecr 4109728,mptcp dss ack 2613390630 seq 2862821086 subseq 791150 len 1428 csum 0xe4f4], length 1428
08:48:10.284047 IP 112.26.0.1.targus-getdata1 > 112.26.0.8.57090: Flags [.], ack 452677, win 7120, options [nop,nop,TS val 4112634 ecr 3893572,nop,nop,sack 2 {459817:469813}{454105:458389},mptcp dss ack 2862708274], length 0
08:48:10.362769 IP 112.26.0.1.targus-getdata1 > 112.26.0.8.57090: Flags [.], ack 452677, win 7120, options [nop,nop,TS val 4112634 ecr 3893572,nop,nop,sack 2 {459817:469813}{454105:458389},mptcp dss ack 2862708274], length 0
08:48:10.377206 IP 112.26.0.8.57090 > 112.26.0.1.targus-getdata1: Flags [.], seq 471241:472669, ack 0, win 4107, options [nop,nop,TS val 3894775 ecr 4109992,mptcp dss ack 2613390630 seq 2862826798 subseq 794006 len 1428 csum 0xb5e2], length 1428
08:48:10.377463 IP 112.26.0.1.targus-getdata1 > 112.26.0.8.57090: Flags [.], ack 452677, win 7120, options [nop,nop,TS val 4112728 ecr 3893572,nop,nop,sack 2 {471241:472669}{459817:469813},mptcp dss ack 2862708274], length 0
08:48:10.461915 IP 112.26.0.1.targus-getdata1 > 112.26.0.8.57090: Flags [.], ack 452677, win 7120, options [nop,nop,TS val 4112728 ecr 3893572,nop,nop,sack 2 {471241:472669}{459817:469813},mptcp dss ack 2862708274], length 0
08:48:10.476728 IP 112.26.0.8.57090 > 112.26.0.1.targus-getdata1: Flags [.], seq 472669:474097, ack 0, win 4107, options [nop,nop,TS val 3894775 ecr 4109992,mptcp dss ack 2613390630 seq 2862828226 subseq 795434 len 1428 csum 0xe561], length 1428
08:48:10.476981 IP 112.26.0.1.targus-getdata1 > 112.26.0.8.57090: Flags [.], ack 452677, win 7120, options [nop,nop,TS val 4112827 ecr 3893572,nop,nop,sack 2 {471241:474097}{459817:469813},mptcp dss ack 2862708274], length 0
08:48:10.556407 IP 112.26.0.1.targus-getdata1 > 112.26.0.8.57090: Flags [.], ack 452677, win 7120, options [nop,nop,TS val 4112827 ecr 3893572,nop,nop,sack 2 {471241:474097}{459817:469813},mptcp dss ack 2862708274], length 0
08:48:10.632872 IP 112.26.0.8.57090 > 112.26.0.1.targus-getdata1: Flags [.], seq 474097:475525, ack 0, win 4107, options [nop,nop,TS val 3894969 ecr 4110160,mptcp dss ack 2613390630 seq 2862842506 subseq 796862 len 1428 csum 0x75f6], length 1428
08:48:10.633106 IP 112.26.0.1.targus-getdata1 > 112.26.0.8.57090: Flags [.], ack 452677, win 7120, options [nop,nop,TS val 4112983 ecr 3893572,nop,nop,sack 2 {471241:475525}{459817:469813},mptcp dss ack 2862708274], length 0
08:48:10.671944 IP 112.26.0.1.targus-getdata1 > 112.26.0.8.57090: Flags [.], ack 452677, win 7120, options [nop,nop,TS val 4112983 ecr 3893572,nop,nop,sack 2 {471241:475525}{459817:469813},mptcp dss ack 2862708274], length 0
08:48:10.788303 IP 112.26.0.8.57090 > 112.26.0.1.targus-getdata1: Flags [.], seq 475525:476953, ack 0, win 4107, options [nop,nop,TS val 3895098 ecr 4110272,mptcp dss ack 2613390630 seq 2862848218 subseq 798290 len 1428 csum 0xd26f], length 1428
08:48:10.788576 IP 112.26.0.1.targus-getdata1 > 112.26.0.8.57090: Flags [.], ack 452677, win 7120, options [nop,nop,TS val 4113139 ecr 3893572,nop,nop,sack 2 {471241:476953}{459817:469813},mptcp dss ack 2862708274], length 0
08:48:10.792789 IP 112.26.0.1.targus-getdata1 > 112.26.0.8.57090: Flags [.], ack 452677, win 7120, options [nop,nop,TS val 4113139 ecr 3893572,nop,nop,sack 2 {471241:476953}{459817:469813},mptcp dss ack 2862708274], length 0
08:48:10.962498 IP 112.26.0.8.57090 > 112.26.0.1.targus-getdata1: Flags [.], seq 481237:482665, ack 0, win 4107, options [nop,nop,TS val 3895420 ecr 4110696,mptcp dss ack 2613390630 seq 2862863926 subseq 804002 len 1428 csum 0x1595], length 1428
08:48:10.962740 IP 112.26.0.1.targus-getdata1 > 112.26.0.8.57090: Flags [.], ack 452677, win 7149, options [nop,nop,TS val 4113313 ecr 3893572,nop,nop,sack 2 {481237:482665}{471241:476953},mptcp dss ack 2862779674], length 0
08:48:11.091096 IP 112.26.0.1.targus-getdata1 > 112.26.0.8.57090: Flags [.], ack 452677, win 7149, options [nop,nop,TS val 4113313 ecr 3893572,nop,nop,sack 2 {481237:482665}{471241:476953},mptcp dss ack 2862779674], length 0
08:48:11.122169 IP 112.26.0.8.57090 > 112.26.0.1.targus-getdata1: Flags [.], seq 484093:485521, ack 0, win 4107, options [nop,nop,TS val 3895649 ecr 4110888,mptcp dss ack 2613390630 seq 2862878206 subseq 806858 len 1428 csum 0xed0b], length 1428
08:48:11.122350 IP 112.26.0.1.targus-getdata1 > 112.26.0.8.57090: Flags [.], ack 452677, win 7149, options [nop,nop,TS val 4113473 ecr 3893572,nop,nop,sack 2 {484093:485521}{481237:482665},mptcp dss ack 2862779674], length 0
08:48:11.213147 IP 112.26.0.1.targus-getdata1 > 112.26.0.8.57090: Flags [.], ack 452677, win 7149, options [nop,nop,TS val 4113473 ecr 3893572,nop,nop,sack 2 {484093:485521}{481237:482665},mptcp dss ack 2862779674], length 0
08:48:11.264647 IP 112.26.0.8.57090 > 112.26.0.1.targus-getdata1: Flags [.], seq 485521:486949, ack 0, win 4107, options [nop,nop,TS val 3895865 ecr 4110996,mptcp dss ack 2613390630 seq 2862885346 subseq 808286 len 1428 csum 0xa2dd], length 1428
08:48:11.264824 IP 112.26.0.1.targus-getdata1 > 112.26.0.8.57090: Flags [.], ack 452677, win 7149, options [nop,nop,TS val 4113615 ecr 3893572,nop,nop,sack 2 {484093:486949}{481237:482665},mptcp dss ack 2862779674], length 0
08:48:11.371242 IP 112.26.0.1.targus-getdata1 > 112.26.0.8.57090: Flags [.], ack 452677, win 7149, options [nop,nop,TS val 4113615 ecr 3893572,nop,nop,sack 2 {484093:486949}{481237:482665},mptcp dss ack 2862779674], length 0
08:48:11.383510 IP 112.26.0.8.57090 > 112.26.0.1.targus-getdata1: Flags [.], seq 489805:491233, ack 0, win 4107, options [nop,nop,TS val 3895986 ecr 4111272,mptcp dss ack 2613390630 seq 2862891058 subseq 812570 len 1428 csum 0x582e], length 1428
08:48:11.383754 IP 112.26.0.1.targus-getdata1 > 112.26.0.8.57090: Flags [.], ack 452677, win 7149, options [nop,nop,TS val 4113734 ecr 3893572,nop,nop,sack 2 {489805:491233}{484093:486949},mptcp dss ack 2862779674], length 0
08:48:11.497884 IP 112.26.0.1.targus-getdata1 > 112.26.0.8.57090: Flags [.], ack 452677, win 7149, options [nop,nop,TS val 4113734 ecr 3893572,nop,nop,sack 2 {489805:491233}{484093:486949},mptcp dss ack 2862779674], length 0
08:48:11.534099 IP 112.26.0.8.57090 > 112.26.0.1.targus-getdata1: Flags [.], seq 492661:494089, ack 0, win 4107, options [nop,nop,TS val 3896147 ecr 4111498,mptcp dss ack 2613390630 seq 2862899626 subseq 815426 len 1428 csum 0x47e], length 1428
08:48:11.534302 IP 112.26.0.1.targus-getdata1 > 112.26.0.8.57090: Flags [.], ack 452677, win 7149, options [nop,nop,TS val 4113884 ecr 3893572,nop,nop,sack 2 {492661:494089}{489805:491233},mptcp dss ack 2862779674], length 0
08:48:11.620146 IP 112.26.0.1.targus-getdata1 > 112.26.0.8.57090: Flags [.], ack 452677, win 7149, options [nop,nop,TS val 4113884 ecr 3893572,nop,nop,sack 2 {492661:494089}{489805:491233},mptcp dss ack 2862779674], length 0
08:48:11.674073 IP 112.26.0.8.57090 > 112.26.0.1.targus-getdata1: Flags [.], seq 494089:495517, ack 0, win 4107, options [nop,nop,TS val 3896365 ecr 4111581,mptcp dss ack 2613390630 seq 2862912478 subseq 816854 len 1428 csum 0xda1d], length 1428
08:48:11.674378 IP 112.26.0.1.targus-getdata1 > 112.26.0.8.57090: Flags [.], ack 452677, win 7149, options [nop,nop,TS val 4114024 ecr 3893572,nop,nop,sack 2 {492661:495517}{489805:491233},mptcp dss ack 2862779674], length 0
08:48:11.702019 IP 112.26.0.1.targus-getdata1 > 112.26.0.8.57090: Flags [.], ack 452677, win 7149, options [nop,nop,TS val 4114024 ecr 3893572,nop,nop,sack 2 {492661:495517}{489805:491233},mptcp dss ack 2862779674], length 0
08:48:11.804650 IP 112.26.0.8.57090 > 112.26.0.1.targus-getdata1: Flags [.], seq 452677:454105, ack 0, win 4107, options [nop,nop,TS val 3896457 ecr 4111753,mptcp dss ack 2613390630 seq 2862779674 subseq 775442 len 1428 csum 0x9f33], length 1428
08:48:11.805048 IP 112.26.0.1.targus-getdata1 > 112.26.0.8.57090: Flags [.], ack 458389, win 7016, options [nop,nop,TS val 4114155 ecr 3896457,nop,nop,sack 2 {492661:495517}{489805:491233},mptcp dss ack 2862796810], length 0
08:48:11.852201 IP 112.26.0.1.targus-getdata1 > 112.26.0.8.57090: Flags [.], ack 458389, win 7016, options [nop,nop,TS val 4114155 ecr 3896457,nop,nop,sack 2 {492661:495517}{489805:491233},mptcp dss ack 2862796810], length 0
08:48:11.968182 IP 112.26.0.8.57090 > 112.26.0.1.targus-getdata1: Flags [.], seq 458389:459817, ack 0, win 4107, options [nop,nop,TS val 3896620 ecr 4111895,mptcp dss ack 2613390630 seq 2862796810 subseq 781154 len 1428 csum 0x283d], length 1428
08:48:11.968505 IP 112.26.0.1.targus-getdata1 > 112.26.0.8.57090: Flags [.], ack 469813, win 6967, options [nop,nop,TS val 4114318 ecr 3896620,nop,nop,sack 2 {492661:495517}{489805:491233},mptcp dss ack 2862825370], length 0
08:48:12.035211 IP 112.26.0.1.targus-getdata1 > 112.26.0.8.57090: Flags [.], ack 469813, win 6967, options [nop,nop,TS val 4114318 ecr 3896620,nop,nop,sack 2 {492661:495517}{489805:491233},mptcp dss ack 2862825370], length 0
08:48:12.186466 IP 112.26.0.8.57090 > 112.26.0.1.targus-getdata1: Flags [.], seq 496945:498373, ack 0, win 4107, options [nop,nop,TS val 3897124 ecr 4112348,mptcp dss ack 2613390630 seq 2862933898 subseq 819710 len 1428 csum 0xa98f], length 1428
08:48:12.186798 IP 112.26.0.1.targus-getdata1 > 112.26.0.8.57090: Flags [.], ack 469813, win 7124, options [nop,nop,TS val 4114537 ecr 3896620,nop,nop,sack 2 {496945:498373}{492661:495517},mptcp dss ack 2862825370], length 0
08:48:12.190312 IP 112.26.0.1.targus-getdata1 > 112.26.0.8.57090: Flags [.], ack 469813, win 7124, options [nop,nop,TS val 4114537 ecr 3896620,nop,nop,sack 2 {496945:498373}{492661:495517},mptcp dss ack 2862825370], length 0
08:48:12.321548 IP 112.26.0.8.57090 > 112.26.0.1.targus-getdata1: Flags [.], seq 498373:499801, ack 0, win 4107, options [nop,nop,TS val 3897461 ecr 4112423,mptcp dss ack 2613390630 seq 2862942466 subseq 821138 len 1428 csum 0x209e], length 1428
08:48:12.321871 IP 112.26.0.1.targus-getdata1 > 112.26.0.8.57090: Flags [.], ack 469813, win 7124, options [nop,nop,TS val 4114672 ecr 3896620,nop,nop,sack 2 {496945:499801}{492661:495517},mptcp dss ack 2862825370], length 0
08:48:12.331100 IP 112.26.0.1.targus-getdata1 > 112.26.0.8.57090: Flags [.], ack 469813, win 7124, options [nop,nop,TS val 4114672 ecr 3896620,nop,nop,sack 2 {496945:499801}{492661:495517},mptcp dss ack 2862825370], length 0
08:48:12.448692 IP 112.26.0.8.57090 > 112.26.0.1.targus-getdata1: Flags [.], seq 499801:501229, ack 0, win 4107, options [nop,nop,TS val 3897774 ecr 4112634,mptcp dss ack 2613390630 seq 2862952462 subseq 822566 len 1428 csum 0xe00e], length 1428
08:48:12.449063 IP 112.26.0.1.targus-getdata1 > 112.26.0.8.57090: Flags [.], ack 469813, win 7124, options [nop,nop,TS val 4114799 ecr 3896620,nop,nop,sack 2 {496945:501229}{492661:495517},mptcp dss ack 2862825370], length 0
08:48:12.455441 IP 112.26.0.1.targus-getdata1 > 112.26.0.8.57090: Flags [.], ack 469813, win 7124, options [nop,nop,TS val 4114799 ecr 3896620,nop,nop,sack 2 {496945:501229}{492661:495517},mptcp dss ack 2862825370], length 0
08:48:12.592669 IP 112.26.0.8.57090 > 112.26.0.1.targus-getdata1: Flags [.], seq 469813:471241, ack 0, win 4107, options [nop,nop,TS val 3897814 ecr 4112728,mptcp dss ack 2613390630 seq 2862825370 subseq 792578 len 1428 csum 0xa8c1], length 1428
08:48:12.593053 IP 112.26.0.1.targus-getdata1 > 112.26.0.8.57090: Flags [.], ack 476953, win 6945, options [nop,nop,TS val 4114943 ecr 3897814,nop,nop,sack 2 {496945:501229}{492661:495517},mptcp dss ack 2862851074], length 0
08:48:12.598419 IP 112.26.0.1.targus-getdata1 > 112.26.0.8.57090: Flags [.], ack 476953, win 6945, options [nop,nop,TS val 4114943 ecr 3897814,nop,nop,sack 2 {496945:501229}{492661:495517},mptcp dss ack 2862851074], length 0
08:48:12.743029 IP 112.26.0.8.57090 > 112.26.0.1.targus-getdata1: Flags [.], seq 501229:502657, ack 0, win 4107, options [nop,nop,TS val 3898077 ecr 4112983,mptcp dss ack 2613390630 seq 2862962458 subseq 823994 len 1428 csum 0xd7d], length 1428
08:48:12.743354 IP 112.26.0.1.targus-getdata1 > 112.26.0.8.57090: Flags [.], ack 476953, win 7062, options [nop,nop,TS val 4115093 ecr 3897814,nop,nop,sack 2 {496945:502657}{492661:495517},mptcp dss ack 2862851074], length 0
08:48:12.748927 IP 112.26.0.1.targus-getdata1 > 112.26.0.8.57090: Flags [.], ack 476953, win 7062, options [nop,nop,TS val 4115093 ecr 3897814,nop,nop,sack 2 {496945:502657}{492661:495517},mptcp dss ack 2862851074], length 0
08:48:12.900742 IP 112.26.0.8.57090 > 112.26.0.1.targus-getdata1: Flags [.], seq 502657:504085, ack 0, win 4107, options [nop,nop,TS val 3898193 ecr 4113139,mptcp dss ack 2613390630 seq 2862968170 subseq 825422 len 1428 csum 0x7537], length 1428
08:48:12.901082 IP 112.26.0.1.targus-getdata1 > 112.26.0.8.57090: Flags [.], ack 476953, win 7062, options [nop,nop,TS val 4115251 ecr 3897814,nop,nop,sack 2 {496945:504085}{492661:495517},mptcp dss ack 2862851074], length 0
08:48:13.023744 IP 112.26.0.1.targus-getdata1 > 112.26.0.8.57090: Flags [.], ack 476953, win 7062, options [nop,nop,TS val 4115251 ecr 3897814,nop,nop,sack 2 {496945:504085}{492661:495517},mptcp dss ack 2862851074], length 0
08:48:13.057974 IP 112.26.0.8.57090 > 112.26.0.1.targus-getdata1: Flags [.], seq 478381:479809, ack 0, win 4107, options [nop,nop,TS val 3898587 ecr 4113473,mptcp dss ack 2613390630 seq 2862852502 subseq 801146 len 1428 csum 0xdb36], length 1428
08:48:13.058273 IP 112.26.0.1.targus-getdata1 > 112.26.0.8.57090: Flags [.], ack 476953, win 7062, options [nop,nop,TS val 4115408 ecr 3897814,nop,nop,sack 2 {478381:479809}{496945:504085},mptcp dss ack 2862851074], length 0
08:48:13.101902 IP 112.26.0.1.targus-getdata1 > 112.26.0.8.57090: Flags [.], ack 476953, win 7062, options [nop,nop,TS val 4115408 ecr 3897814,nop,nop,sack 2 {478381:479809}{496945:504085},mptcp dss ack 2862851074], length 0
08:48:13.220800 IP 112.26.0.8.57090 > 112.26.0.1.targus-getdata1: Flags [.], seq 479809:481237, ack 0, win 4107, options [nop,nop,TS val 3898725 ecr 4113615,mptcp dss ack 2613390630 seq 2862858214 subseq 802574 len 1428 csum 0x739c], length 1428
08:48:13.221089 IP 112.26.0.1.targus-getdata1 > 112.26.0.8.57090: Flags [.], ack 476953, win 7062, options [nop,nop,TS val 4115571 ecr 3897814,nop,nop,sack 2 {478381:481237}{496945:504085},mptcp dss ack 2862851074], length 0
08:48:13.226474 IP 112.26.0.1.targus-getdata1 > 112.26.0.8.57090: Flags [.], ack 476953, win 7062, options [nop,nop,TS val 4115571 ecr 3897814,nop,nop,sack 2 {478381:481237}{496945:504085},mptcp dss ack 2862851074], length 0
08:48:13.307439 IP 112.26.0.8.57090 > 112.26.0.1.targus-getdata1: Flags [.], seq 482665:484093, ack 0, win 4107, options [nop,nop,TS val 3898854 ecr 4113734,mptcp dss ack 2613390630 seq 2862865354 subseq 805430 len 1428 csum 0x8768], length 1428
