21:10:58.655522 IP 112.26.2.8.53441 > 112.26.2.1.targus-getdata1: Flags [S], seq 4018496370, win 29200, options [mss 1460,sackOK,TS val 667416 ecr 0,nop,wscale 7,mptcp join id 4 token 0x71e0988d nonce 0xbbee4081], length 0
21:10:58.655839 IP 112.26.2.1.targus-getdata1 > 112.26.2.8.53441: Flags [S.], seq 376162513, ack 4018496371, win 28560, options [mss 1460,sackOK,TS val 888410 ecr 667416,nop,wscale 7,mptcp join id 4 hmac 0xb371f8bfaea20c96 nonce 0xbf67fcbd], length 0
21:10:58.792585 IP 112.26.2.1.targus-getdata1 > 112.26.2.8.53441: Flags [S.], seq 376162513, ack 4018496371, win 28560, options [mss 1460,sackOK,TS val 888410 ecr 667416,nop,wscale 7,mptcp join id 4 hmac 0xb371f8bfaea20c96 nonce 0xbf67fcbd], length 0
21:10:58.902342 IP 112.26.2.8.53441 > 112.26.2.1.targus-getdata1: Flags [.], ack 1, win 685, options [nop,nop,TS val 667742 ecr 888410,mptcp join hmac 0x15544b695b9807a8d9cf29b4dd1b09684ab03426], length 0
21:10:58.902704 IP 112.26.2.1.targus-getdata1 > 112.26.2.8.53441: Flags [.], ack 1, win 670, options [nop,nop,TS val 888656 ecr 667742,mptcp dss ack 394472264], length 0
21:10:59.027245 IP 112.26.2.1.targus-getdata1 > 112.26.2.8.53441: Flags [.], ack 1, win 670, options [nop,nop,TS val 888656 ecr 667742,mptcp dss ack 394472264], length 0
21:10:59.677640 IP 112.26.2.8.52161 > 112.26.2.1.targus-getdata1: Flags [S], seq 405620916, win 29200, options [mss 1460,sackOK,TS val 668612 ecr 0,nop,wscale 7,mptcp join id 4 token 0x7b55582f nonce 0xe220069d], length 0
21:11:44.880333 IP 112.26.2.1.targus-getdata1 > 112.26.2.8.52161: Flags [.], ack 406035037, win 6122, options [nop,nop,TS val 934315 ecr 712873,mptcp dss ack 2226349968], length 0
21:11:44.938031 IP 112.26.2.8.52161 > 112.26.2.1.targus-getdata1: Flags [.], seq 1:1429, ack 0, win 913, options [nop,nop,TS val 713185 ecr 933414,mptcp dss ack 1803767578 seq 2226447072 subseq 414121 len 1428 csum 0x1c72], length 1428
21:11:44.938361 IP 112.26.2.1.targus-getdata1 > 112.26.2.8.52161: Flags [.], ack 1429, win 6122, options [nop,nop,TS val 934692 ecr 713185,mptcp dss ack 2226349968], length 0
21:11:45.013726 IP 112.26.2.8.52161 > 112.26.2.1.targus-getdata1: Flags [.], seq 1429:2857, ack 0, win 913, options [nop,nop,TS val 713185 ecr 933414,mptcp dss ack 1803767578 seq 2226448500 subseq 415549 len 1428 csum 0xd1da], length 1428
21:11:45.014030 IP 112.26.2.1.targus-getdata1 > 112.26.2.8.52161: Flags [.], ack 2857, win 6122, options [nop,nop,TS val 934768 ecr 713185,mptcp dss ack 2226349968], length 0
21:11:45.096541 IP 112.26.2.8.52161 > 112.26.2.1.targus-getdata1: Flags [.], seq 2857:4285, ack 0, win 913, options [nop,nop,TS val 713383 ecr 933512,mptcp dss ack 1803767578 seq 2226457068 subseq 416977 len 1428 csum 0x168c], length 1428
21:11:45.096847 IP 112.26.2.1.targus-getdata1 > 112.26.2.8.52161: Flags [.], ack 4285, win 6122, options [nop,nop,TS val 934850 ecr 713383,mptcp dss ack 2226349968], length 0
21:11:45.166908 IP 112.26.2.8.52161 > 112.26.2.1.targus-getdata1: Flags [.], seq 4285:5713, ack 0, win 913, options [nop,nop,TS val 713452 ecr 933646,mptcp dss ack 1803767578 seq 2226461352 subseq 418405 len 1428 csum 0x536], length 1428
21:11:45.167200 IP 112.26.2.1.targus-getdata1 > 112.26.2.8.52161: Flags [.], ack 5713, win 6122, options [nop,nop,TS val 934921 ecr 713452,mptcp dss ack 2226349968], length 0
21:11:45.227233 IP 112.26.2.1.targus-getdata1 > 112.26.2.8.52161: Flags [.], ack 1429, win 6122, options [nop,nop,TS val 934692 ecr 713185,mptcp dss ack 2226349968], length 0
21:11:45.273046 IP 112.26.2.1.targus-getdata1 > 112.26.2.8.52161: Flags [.], ack 2857, win 6122, options [nop,nop,TS val 934768 ecr 713185,mptcp dss ack 2226349968], length 0
21:11:45.333131 IP 112.26.2.8.52161 > 112.26.2.1.targus-getdata1: Flags [.], seq 5713:7141, ack 0, win 913, options [nop,nop,TS val 713640 ecr 933768,mptcp dss ack 1803767578 seq 2226468492 subseq 419833 len 1428 csum 0x8e12], length 1428
21:11:45.333480 IP 112.26.2.1.targus-getdata1 > 112.26.2.8.52161: Flags [.], ack 7141, win 6122, options [nop,nop,TS val 935087 ecr 713640,mptcp dss ack 2226349968], length 0
21:11:45.433388 IP 112.26.2.1.targus-getdata1 > 112.26.2.8.52161: Flags [.], ack 4285, win 6122, options [nop,nop,TS val 934850 ecr 713383,mptcp dss ack 2226349968], length 0
21:11:45.461033 IP 112.26.2.1.targus-getdata1 > 112.26.2.8.52161: Flags [.], ack 5713, win 6122, options [nop,nop,TS val 934921 ecr 713452,mptcp dss ack 2226349968], length 0
21:11:45.519389 IP 112.26.2.8.52161 > 112.26.2.1.targus-getdata1: Flags [.], seq 7141:8569, ack 0, win 913, options [nop,nop,TS val 713900 ecr 934142,mptcp dss ack 1803767578 seq 2226475632 subseq 421261 len 1428 csum 0x8424], length 1428
21:11:45.519722 IP 112.26.2.1.targus-getdata1 > 112.26.2.8.52161: Flags [.], ack 8569, win 6000, options [nop,nop,TS val 935274 ecr 713900,mptcp dss ack 2226365676], length 0
21:11:45.593563 IP 112.26.2.1.targus-getdata1 > 112.26.2.8.52161: Flags [.], ack 7141, win 6122, options [nop,nop,TS val 935087 ecr 713640,mptcp dss ack 2226349968], length 0
21:11:45.657510 IP 112.26.2.8.52161 > 112.26.2.1.targus-getdata1: Flags [.], seq 8569:9997, ack 0, win 913, options [nop,nop,TS val 714131 ecr 934213,mptcp dss ack 1803767578 seq 2226489912 subseq 422689 len 1428 csum 0xf5f4], length 1428
21:11:45.657833 IP 112.26.2.1.targus-getdata1 > 112.26.2.8.52161: Flags [.], ack 9997, win 5977, options [nop,nop,TS val 935412 ecr 714131,mptcp dss ack 2226404232], length 0
21:11:45.721621 IP 112.26.2.8.52161 > 112.26.2.1.targus-getdata1: Flags [.], seq 9997:11425, ack 0, win 913, options [nop,nop,TS val 714178 ecr 934315,mptcp dss ack 1803767578 seq 2226491340 subseq 424117 len 1428 csum 0xef1f], length 1428
21:11:45.762547 IP 112.26.2.1.targus-getdata1 > 112.26.2.8.52161: Flags [.], ack 11425, win 5977, options [nop,nop,TS val 935517 ecr 714178,mptcp dss ack 2226404232], length 0
21:11:45.800558 IP 112.26.2.1.targus-getdata1 > 112.26.2.8.52161: Flags [.], ack 8569, win 6000, options [nop,nop,TS val 935274 ecr 713900,mptcp dss ack 2226365676], length 0
21:11:45.864258 IP 112.26.2.8.52161 > 112.26.2.1.targus-getdata1: Flags [.], seq 11425:12853, ack 0, win 913, options [nop,nop,TS val 714371 ecr 934692,mptcp dss ack 1803767578 seq 2226504192 subseq 425545 len 1428 csum 0xcfe2], length 1428
21:11:45.915520 IP 112.26.2.1.targus-getdata1 > 112.26.2.8.52161: Flags [.], ack 9997, win 5977, options [nop,nop,TS val 935412 ecr 714131,mptcp dss ack 2226404232], length 0
21:11:45.949679 IP 112.26.2.1.targus-getdata1 > 112.26.2.8.52161: Flags [.], ack 12853, win 5977, options [nop,nop,TS val 935704 ecr 714371,mptcp dss ack 2226404232], length 0
21:11:45.958740 IP 112.26.2.1.targus-getdata1 > 112.26.2.8.52161: Flags [.], ack 11425, win 5977, options [nop,nop,TS val 935517 ecr 714178,mptcp dss ack 2226404232], length 0
21:11:46.006919 IP 112.26.2.1.targus-getdata1 > 112.26.2.8.52161: Flags [.], ack 12853, win 5977, options [nop,nop,TS val 935704 ecr 714371,mptcp dss ack 2226404232], length 0
21:11:46.075121 IP 112.26.2.8.52161 > 112.26.2.1.targus-getdata1: Flags [.], seq 12853:14281, ack 0, win 913, options [nop,nop,TS val 714554 ecr 934768,mptcp dss ack 1803767578 seq 2226508476 subseq 426973 len 1428 csum 0x3705], length 1428
21:11:46.157444 IP 112.26.2.8.52161 > 112.26.2.1.targus-getdata1: Flags [.], seq 14281:15709, ack 0, win 913, options [nop,nop,TS val 714554 ecr 934768,mptcp dss ack 1803767578 seq 2226509904 subseq 428401 len 1428 csum 0xc78e], length 1428
21:11:46.212997 IP 112.26.2.1.targus-getdata1 > 112.26.2.8.52161: Flags [.], ack 15709, win 5966, options [nop,nop,TS val 935967 ecr 714554,mptcp dss ack 2226405660], length 0
21:11:46.241837 IP 112.26.2.8.52161 > 112.26.2.1.targus-getdata1: Flags [.], seq 15709:17137, ack 0, win 913, options [nop,nop,TS val 714694 ecr 934850,mptcp dss ack 1803767578 seq 2226515616 subseq 429829 len 1428 csum 0xf4a1], length 1428
21:11:46.273719 IP 112.26.2.1.targus-getdata1 > 112.26.2.8.52161: Flags [.], ack 15709, win 5966, options [nop,nop,TS val 935967 ecr 714554,mptcp dss ack 2226405660], length 0
21:11:46.336510 IP 112.26.2.8.52161 > 112.26.2.1.targus-getdata1: Flags [.], seq 17137:18565, ack 0, win 913, options [nop,nop,TS val 714794 ecr 934921,mptcp dss ack 1803767578 seq 2226521328 subseq 431257 len 1428 csum 0xdf15], length 1428
21:11:46.413589 IP 112.26.2.1.targus-getdata1 > 112.26.2.8.52161: Flags [.], ack 18565, win 5966, options [nop,nop,TS val 936168 ecr 714694,mptcp dss ack 2226405660], length 0
21:11:46.441447 IP 112.26.2.8.52161 > 112.26.2.1.targus-getdata1: Flags [.], seq 18565:19993, ack 0, win 913, options [nop,nop,TS val 714866 ecr 935087,mptcp dss ack 1803767578 seq 2226525612 subseq 432685 len 1428 csum 0x6e16], length 1428
21:11:46.510111 IP 112.26.2.1.targus-getdata1 > 112.26.2.8.52161: Flags [.], ack 18565, win 5966, options [nop,nop,TS val 936168 ecr 714694,mptcp dss ack 2226405660], length 0
21:11:46.578463 IP 112.26.2.8.52161 > 112.26.2.1.targus-getdata1: Flags [.], seq 19993:21421, ack 0, win 913, options [nop,nop,TS val 715082 ecr 935274,mptcp dss ack 1803767578 seq 2226538464 subseq 434113 len 1428 csum 0xfb6d], length 1428
21:11:46.655748 IP 112.26.2.1.targus-getdata1 > 112.26.2.8.52161: Flags [.], ack 21421, win 6122, options [nop,nop,TS val 936410 ecr 714866,mptcp dss ack 2226514188], length 0
21:11:46.659559 IP 112.26.2.1.targus-getdata1 > 112.26.2.8.52161: Flags [.], ack 21421, win 6122, options [nop,nop,TS val 936410 ecr 714866,mptcp dss ack 2226514188], length 0
21:11:46.745902 IP 112.26.2.8.52161 > 112.26.2.1.targus-getdata1: Flags [.], seq 21421:22849, ack 0, win 913, options [nop,nop,TS val 715243 ecr 935412,mptcp dss ack 1803767578 seq 2226545604 subseq 435541 len 1428 csum 0x4a01], length 1428
21:11:46.803211 IP 112.26.2.8.52161 > 112.26.2.1.targus-getdata1: Flags [.], seq 22849:24277, ack 0, win 913, options [nop,nop,TS val 715363 ecr 935517,mptcp dss ack 1803767578 seq 2226561312 subseq 436969 len 1428 csum 0x2795], length 1428
21:11:46.803511 IP 112.26.2.1.targus-getdata1 > 112.26.2.8.52161: Flags [.], ack 24277, win 6122, options [nop,nop,TS val 936557 ecr 715243,mptcp dss ack 2226522756], length 0
21:11:46.905980 IP 112.26.2.1.targus-getdata1 > 112.26.2.8.52161: Flags [.], ack 24277, win 6122, options [nop,nop,TS val 936557 ecr 715243,mptcp dss ack 2226522756], length 0
21:11:46.963803 IP 112.26.2.8.52161 > 112.26.2.1.targus-getdata1: Flags [.], seq 24277:25705, ack 0, win 913, options [nop,nop,TS val 715363 ecr 935517,mptcp dss ack 1803767578 seq 2226562740 subseq 438397 len 1428 csum 0xa06a], length 1428
21:11:47.045830 IP 112.26.2.8.52161 > 112.26.2.1.targus-getdata1: Flags [.], seq 25705:27133, ack 0, win 913, options [nop,nop,TS val 715413 ecr 935704,mptcp dss ack 1803767578 seq 2226564168 subseq 439825 len 1428 csum 0xb60d], length 1428
21:11:47.046157 IP 112.26.2.1.targus-getdata1 > 112.26.2.8.52161: Flags [.], ack 27133, win 6122, options [nop,nop,TS val 936800 ecr 715363,mptcp dss ack 2226528468], length 0
21:11:47.164445 IP 112.26.2.1.targus-getdata1 > 112.26.2.8.52161: Flags [.], ack 27133, win 6122, options [nop,nop,TS val 936800 ecr 715363,mptcp dss ack 2226528468], length 0
21:11:47.210909 IP 112.26.2.8.52161 > 112.26.2.1.targus-getdata1: Flags [.], seq 27133:28561, ack 0, win 913, options [nop,nop,TS val 715563 ecr 935967,mptcp dss ack 1803767578 seq 2226572736 subseq 441253 len 1428 csum 0xa22], length 1428
21:11:47.298516 IP 112.26.2.8.52161 > 112.26.2.1.targus-getdata1: Flags [.], seq 28561:29989, ack 0, win 913, options [nop,nop,TS val 715563 ecr 935967,mptcp dss ack 1803767578 seq 2226574164 subseq 442681 len 1428 csum 0x726d], length 1428
21:11:47.298863 IP 112.26.2.1.targus-getdata1 > 112.26.2.8.52161: Flags [.], ack 29989, win 6122, options [nop,nop,TS val 937053 ecr 715563,mptcp dss ack 2226528468], length 0
21:11:47.368957 IP 112.26.2.1.targus-getdata1 > 112.26.2.8.52161: Flags [.], ack 29989, win 6122, options [nop,nop,TS val 937053 ecr 715563,mptcp dss ack 2226528468], length 0
21:11:47.449234 IP 112.26.2.8.52161 > 112.26.2.1.targus-getdata1: Flags [.], seq 29989:31417, ack 0, win 913, options [nop,nop,TS val 715889 ecr 936168,mptcp dss ack 1803767578 seq 2226588444 subseq 444109 len 1428 csum 0x6109], length 1428
21:11:47.566617 IP 112.26.2.8.52161 > 112.26.2.1.targus-getdata1: Flags [.], seq 31417:32845, ack 0, win 913, options [nop,nop,TS val 715889 ecr 936168,mptcp dss ack 1803767578 seq 2226589872 subseq 445537 len 1428 csum 0x2d67], length 1428
21:11:47.566917 IP 112.26.2.1.targus-getdata1 > 112.26.2.8.52161: Flags [.], ack 32845, win 6122, options [nop,nop,TS val 937321 ecr 715889,mptcp dss ack 2226528468], length 0
21:11:47.654889 IP 112.26.2.1.targus-getdata1 > 112.26.2.8.52161: Flags [.], ack 32845, win 6122, options [nop,nop,TS val 937321 ecr 715889,mptcp dss ack 2226528468], length 0
21:11:47.689443 IP 112.26.2.8.52161 > 112.26.2.1.targus-getdata1: Flags [.], seq 32845:34273, ack 0, win 913, options [nop,nop,TS val 715889 ecr 936168,mptcp dss ack 1803767578 seq 2226591300 subseq 446965 len 1428 csum 0xc011], length 1428
21:11:47.803133 IP 112.26.2.8.52161 > 112.26.2.1.targus-getdata1: Flags [.], seq 34273:35701, ack 0, win 913, options [nop,nop,TS val 715889 ecr 936168,mptcp dss ack 1803767578 seq 2226592728 subseq 448393 len 1428 csum 0xac41], length 1428
21:11:47.882939 IP 112.26.2.8.52161 > 112.26.2.1.targus-getdata1: Flags [.], seq 35701:37129, ack 0, win 913, options [nop,nop,TS val 716133 ecr 936410,mptcp dss ack 1803767578 seq 2226601296 subseq 449821 len 1428 csum 0x1076], length 1428
21:11:47.883335 IP 112.26.2.1.targus-getdata1 > 112.26.2.8.52161: Flags [.], ack 37129, win 6122, options [nop,nop,TS val 937637 ecr 715889,mptcp dss ack 2226528468], length 0
21:11:47.948485 IP 112.26.2.1.targus-getdata1 > 112.26.2.8.52161: Flags [.], ack 37129, win 6122, options [nop,nop,TS val 937637 ecr 715889,mptcp dss ack 2226528468], length 0
21:11:48.054875 IP 112.26.2.8.52161 > 112.26.2.1.targus-getdata1: Flags [.], seq 37129:38557, ack 0, win 913, options [nop,nop,TS val 716133 ecr 936410,mptcp dss ack 1803767578 seq 2226602724 subseq 451249 len 1428 csum 0xcca1], length 1428
21:11:48.136512 IP 112.26.2.8.52161 > 112.26.2.1.targus-getdata1: Flags [.], seq 38557:39985, ack 0, win 913, options [nop,nop,TS val 716333 ecr 936557,mptcp dss ack 1803767578 seq 2226612720 subseq 452677 len 1428 csum 0xb00e], length 1428
21:11:48.136855 IP 112.26.2.1.targus-getdata1 > 112.26.2.8.52161: Flags [.], ack 39985, win 6122, options [nop,nop,TS val 937891 ecr 716133,mptcp dss ack 2226565596], length 0
21:11:48.229104 IP 112.26.2.1.targus-getdata1 > 112.26.2.8.52161: Flags [.], ack 39985, win 6122, options [nop,nop,TS val 937891 ecr 716133,mptcp dss ack 2226565596], length 0
21:11:48.282892 IP 112.26.2.8.52161 > 112.26.2.1.targus-getdata1: Flags [.], seq 41413:42841, ack 0, win 913, options [nop,nop,TS val 716333 ecr 936557,mptcp dss ack 1803767578 seq 2226615576 subseq 455533 len 1428 csum 0xf59e], length 1428
21:11:48.283163 IP 112.26.2.1.targus-getdata1 > 112.26.2.8.52161: Flags [.], ack 39985, win 6122, options [nop,nop,TS val 938037 ecr 716133,nop,nop,sack 1 {41413:42841},mptcp dss ack 2226565596], length 0
21:11:48.407960 IP 112.26.2.1.targus-getdata1 > 112.26.2.8.52161: Flags [.], ack 39985, win 6122, options [nop,nop,TS val 938037 ecr 716133,nop,nop,sack 1 {41413:42841},mptcp dss ack 2226565596], length 0
21:11:48.477654 IP 112.26.2.8.52161 > 112.26.2.1.targus-getdata1: Flags [.], seq 42841:44269, ack 0, win 913, options [nop,nop,TS val 716333 ecr 936557,mptcp dss ack 1803767578 seq 2226617004 subseq 456961 len 1428 csum 0x29b3], length 1428
21:11:48.477971 IP 112.26.2.1.targus-getdata1 > 112.26.2.8.52161: Flags [.], ack 39985, win 6122, options [nop,nop,TS val 938232 ecr 716133,nop,nop,sack 1 {41413:44269},mptcp dss ack 2226565596], length 0
21:11:48.579378 IP 112.26.2.8.52161 > 112.26.2.1.targus-getdata1: Flags [.], seq 44269:45697, ack 0, win 913, options [nop,nop,TS val 716680 ecr 936800,mptcp dss ack 1803767578 seq 2226631284 subseq 458389 len 1428 csum 0xe465], length 1428
21:11:48.579706 IP 112.26.2.1.targus-getdata1 > 112.26.2.8.52161: Flags [.], ack 39985, win 6122, options [nop,nop,TS val 938334 ecr 716133,nop,nop,sack 1 {41413:45697},mptcp dss ack 2226565596], length 0
21:11:48.645608 IP 112.26.2.1.targus-getdata1 > 112.26.2.8.52161: Flags [.], ack 39985, win 6122, options [nop,nop,TS val 938232 ecr 716133,nop,nop,sack 1 {41413:44269},mptcp dss ack 2226565596], length 0
21:11:48.739852 IP 112.26.2.8.52161 > 112.26.2.1.targus-getdata1: Flags [.], seq 45697:47125, ack 0, win 913, options [nop,nop,TS val 716680 ecr 936800,mptcp dss ack 1803767578 seq 2226632712 subseq 459817 len 1428 csum 0x9b49], length 1428
21:11:48.740123 IP 112.26.2.1.targus-getdata1 > 112.26.2.8.52161: Flags [.], ack 39985, win 6122, options [nop,nop,TS val 938494 ecr 716133,nop,nop,sack 1 {41413:47125},mptcp dss ack 2226565596], length 0
21:11:48.841336 IP 112.26.2.1.targus-getdata1 > 112.26.2.8.52161: Flags [.], ack 39985, win 6122, options [nop,nop,TS val 938334 ecr 716133,nop,nop,sack 1 {41413:45697},mptcp dss ack 2226565596], length 0
21:11:48.887994 IP 112.26.2.8.52161 > 112.26.2.1.targus-getdata1: Flags [.], seq 47125:48553, ack 0, win 913, options [nop,nop,TS val 716681 ecr 936800,mptcp dss ack 1803767578 seq 2226634140 subseq 461245 len 1428 csum 0x1bf0], length 1428
21:11:48.888282 IP 112.26.2.1.targus-getdata1 > 112.26.2.8.52161: Flags [.], ack 39985, win 6122, options [nop,nop,TS val 938642 ecr 716133,nop,nop,sack 1 {41413:48553},mptcp dss ack 2226565596], length 0
21:11:48.999017 IP 112.26.2.1.targus-getdata1 > 112.26.2.8.52161: Flags [.], ack 39985, win 6122, options [nop,nop,TS val 938494 ecr 716133,nop,nop,sack 1 {41413:47125},mptcp dss ack 2226565596], length 0
21:11:49.066156 IP 112.26.2.8.52161 > 112.26.2.1.targus-getdata1: Flags [.], seq 48553:49981, ack 0, win 913, options [nop,nop,TS val 716975 ecr 937053,mptcp dss ack 1803767578 seq 2226648420 subseq 462673 len 1428 csum 0xe7e8], length 1428
21:11:49.066471 IP 112.26.2.1.targus-getdata1 > 112.26.2.8.52161: Flags [.], ack 39985, win 6122, options [nop,nop,TS val 938820 ecr 716133,nop,nop,sack 1 {41413:49981},mptcp dss ack 2226565596], length 0
21:11:49.144762 IP 112.26.2.1.targus-getdata1 > 112.26.2.8.52161: Flags [.], ack 39985, win 6122, options [nop,nop,TS val 938642 ecr 716133,nop,nop,sack 1 {41413:48553},mptcp dss ack 2226565596], length 0
21:11:49.217107 IP 112.26.2.8.52161 > 112.26.2.1.targus-getdata1: Flags [.], seq 51409:52837, ack 0, win 913, options [nop,nop,TS val 716975 ecr 937053,mptcp dss ack 1803767578 seq 2226651276 subseq 465529 len 1428 csum 0x72fc], length 1428
21:11:49.217404 IP 112.26.2.1.targus-getdata1 > 112.26.2.8.52161: Flags [.], ack 39985, win 6122, options [nop,nop,TS val 938971 ecr 716133,nop,nop,sack 2 {51409:52837}{41413:49981},mptcp dss ack 2226565596], length 0
21:11:49.308943 IP 112.26.2.1.targus-getdata1 > 112.26.2.8.52161: Flags [.], ack 39985, win 6122, options [nop,nop,TS val 938820 ecr 716133,nop,nop,sack 1 {41413:49981},mptcp dss ack 2226565596], length 0
21:11:49.380783 IP 112.26.2.8.52161 > 112.26.2.1.targus-getdata1: Flags [.], seq 52837:54265, ack 0, win 913, options [nop,nop,TS val 717312 ecr 937321,mptcp dss ack 1803767578 seq 2226668412 subseq 466957 len 1428 csum 0xafc1], length 1428
21:11:49.381100 IP 112.26.2.1.targus-getdata1 > 112.26.2.8.52161: Flags [.], ack 39985, win 6122, options [nop,nop,TS val 939135 ecr 716133,nop,nop,sack 2 {51409:54265}{41413:49981},mptcp dss ack 2226565596], length 0
21:11:49.445992 IP 112.26.2.1.targus-getdata1 > 112.26.2.8.52161: Flags [.], ack 39985, win 6122, options [nop,nop,TS val 938971 ecr 716133,nop,nop,sack 2 {51409:52837}{41413:49981},mptcp dss ack 2226565596], length 0
21:11:49.545203 IP 112.26.2.8.52161 > 112.26.2.1.targus-getdata1: Flags [.], seq 54265:55693, ack 0, win 913, options [nop,nop,TS val 717312 ecr 937321,mptcp dss ack 1803767578 seq 2226669840 subseq 468385 len 1428 csum 0x76cd], length 1428
21:11:49.545489 IP 112.26.2.1.targus-getdata1 > 112.26.2.8.52161: Flags [.], ack 39985, win 6122, options [nop,nop,TS val 939300 ecr 716133,nop,nop,sack 2 {51409:55693}{41413:49981},mptcp dss ack 2226565596], length 0
21:11:49.608870 IP 112.26.2.1.targus-getdata1 > 112.26.2.8.52161: Flags [.], ack 39985, win 6122, options [nop,nop,TS val 939135 ecr 716133,nop,nop,sack 2 {51409:54265}{41413:49981},mptcp dss ack 2226565596], length 0
21:11:49.747015 IP 112.26.2.8.52161 > 112.26.2.1.targus-getdata1: Flags [.], seq 55693:57121, ack 0, win 913, options [nop,nop,TS val 717667 ecr 937637,mptcp dss ack 1803767578 seq 2226688404 subseq 469813 len 1428 csum 0xa343], length 1428
21:11:49.747300 IP 112.26.2.1.targus-getdata1 > 112.26.2.8.52161: Flags [.], ack 39985, win 6122, options [nop,nop,TS val 939501 ecr 716133,nop,nop,sack 2 {51409:57121}{41413:49981},mptcp dss ack 2226614148], length 0
21:11:49.802135 IP 112.26.2.1.targus-getdata1 > 112.26.2.8.52161: Flags [.], ack 39985, win 6122, options [nop,nop,TS val 939300 ecr 716133,nop,nop,sack 2 {51409:55693}{41413:49981},mptcp dss ack 2226565596], length 0
21:11:49.881632 IP 112.26.2.8.52161 > 112.26.2.1.targus-getdata1: Flags [.], seq 57121:58549, ack 0, win 913, options [nop,nop,TS val 717667 ecr 937637,mptcp dss ack 1803767578 seq 2226689832 subseq 471241 len 1428 csum 0xc98b], length 1428
21:11:49.881953 IP 112.26.2.1.targus-getdata1 > 112.26.2.8.52161: Flags [.], ack 39985, win 6122, options [nop,nop,TS val 939635 ecr 716133,nop,nop,sack 2 {51409:58549}{41413:49981},mptcp dss ack 2226614148], length 0
21:11:49.916489 IP 112.26.2.8.52161 > 112.26.2.1.targus-getdata1: Flags [.], seq 58549:59977, ack 0, win 913, options [nop,nop,TS val 717667 ecr 937637,mptcp dss ack 1803767578 seq 2226691260 subseq 472669 len 1428 csum 0xaf25], length 1428
21:11:49.916767 IP 112.26.2.1.targus-getdata1 > 112.26.2.8.52161: Flags [.], ack 39985, win 6122, options [nop,nop,TS val 939670 ecr 716133,nop,nop,sack 2 {51409:59977}{41413:49981},mptcp dss ack 2226614148], length 0
21:11:50.011926 IP 112.26.2.1.targus-getdata1 > 112.26.2.8.52161: Flags [.], ack 39985, win 6122, options [nop,nop,TS val 939501 ecr 716133,nop,nop,sack 2 {51409:57121}{41413:49981},mptcp dss ack 2226614148], length 0
21:11:50.069306 IP 112.26.2.1.targus-getdata1 > 112.26.2.8.52161: Flags [.], ack 39985, win 6122, options [nop,nop,TS val 939635 ecr 716133,nop,nop,sack 2 {51409:58549}{41413:49981},mptcp dss ack 2226614148], length 0
21:11:50.132923 IP 112.26.2.8.52161 > 112.26.2.1.targus-getdata1: Flags [.], seq 62833:64261, ack 0, win 913, options [nop,nop,TS val 717934 ecr 937891,mptcp dss ack 1803767578 seq 2226699828 subseq 476953 len 1428 csum 0x2746], length 1428
21:11:50.133246 IP 112.26.2.1.targus-getdata1 > 112.26.2.8.52161: Flags [.], ack 39985, win 6122, options [nop,nop,TS val 939887 ecr 716133,nop,nop,sack 2 {62833:64261}{51409:59977},mptcp dss ack 2226614148], length 0
21:11:50.222088 IP 112.26.2.1.targus-getdata1 > 112.26.2.8.52161: Flags [.], ack 39985, win 6122, options [nop,nop,TS val 939670 ecr 716133,nop,nop,sack 2 {51409:59977}{41413:49981},mptcp dss ack 2226614148], length 0
21:11:50.274696 IP 112.26.2.8.52161 > 112.26.2.1.targus-getdata1: Flags [.], seq 65689:67117, ack 0, win 913, options [nop,nop,TS val 718176 ecr 938037,mptcp dss ack 1803767578 seq 2226714108 subseq 479809 len 1428 csum 0x7959], length 1428
21:11:50.275028 IP 112.26.2.1.targus-getdata1 > 112.26.2.8.52161: Flags [.], ack 39985, win 6122, options [nop,nop,TS val 940029 ecr 716133,nop,nop,sack 2 {65689:67117}{62833:64261},mptcp dss ack 2226614148], length 0
21:11:50.316710 IP 112.26.2.1.targus-getdata1 > 112.26.2.8.52161: Flags [.], ack 39985, win 6122, options [nop,nop,TS val 939887 ecr 716133,nop,nop,sack 2 {62833:64261}{51409:59977},mptcp dss ack 2226614148], length 0
21:11:50.388681 IP 112.26.2.1.targus-getdata1 > 112.26.2.8.52161: Flags [.], ack 39985, win 6122, options [nop,nop,TS val 940029 ecr 716133,nop,nop,sack 2 {65689:67117}{62833:64261},mptcp dss ack 2226614148], length 0
21:11:50.460118 IP 112.26.2.8.52161 > 112.26.2.1.targus-getdata1: Flags [.], seq 39985:41413, ack 0, win 913, options [nop,nop,TS val 718675 ecr 938494,mptcp dss ack 1803767578 seq 2226614148 subseq 454105 len 1428 csum 0x754f], length 1428
21:11:50.460409 IP 112.26.2.1.targus-getdata1 > 112.26.2.8.52161: Flags [.], ack 49981, win 6033, options [nop,nop,TS val 940214 ecr 718675,nop,nop,sack 2 {65689:67117}{62833:64261},mptcp dss ack 2226625572], length 0
21:11:50.539908 IP 112.26.2.8.52161 > 112.26.2.1.targus-getdata1: Flags [.], seq 68545:69973, ack 0, win 913, options [nop,nop,TS val 718763 ecr 938494,mptcp dss ack 1803767578 seq 2226729816 subseq 482665 len 1428 csum 0xed26], length 1428
21:11:50.540242 IP 112.26.2.1.targus-getdata1 > 112.26.2.8.52161: Flags [.], ack 49981, win 6072, options [nop,nop,TS val 940294 ecr 718675,nop,nop,sack 2 {68545:69973}{65689:67117},mptcp dss ack 2226628428], length 0
21:11:50.605087 IP 112.26.2.1.targus-getdata1 > 112.26.2.8.52161: Flags [.], ack 49981, win 6033, options [nop,nop,TS val 940214 ecr 718675,nop,nop,sack 2 {65689:67117}{62833:64261},mptcp dss ack 2226625572], length 0
21:11:50.630597 IP 112.26.2.1.targus-getdata1 > 112.26.2.8.52161: Flags [.], ack 49981, win 6072, options [nop,nop,TS val 940294 ecr 718675,nop,nop,sack 2 {68545:69973}{65689:67117},mptcp dss ack 2226628428], length 0
21:11:50.686168 IP 112.26.2.8.52161 > 112.26.2.1.targus-getdata1: Flags [.], seq 69973:71401, ack 0, win 913, options [nop,nop,TS val 718985 ecr 938820,mptcp dss ack 1803767578 seq 2226745524 subseq 484093 len 1428 csum 0x3ecd], length 1428
21:11:50.686352 IP 112.26.2.1.targus-getdata1 > 112.26.2.8.52161: Flags [.], ack 49981, win 6081, options [nop,nop,TS val 940440 ecr 718675,nop,nop,sack 2 {68545:71401}{65689:67117},mptcp dss ack 2226638424], length 0
21:11:50.786897 IP 112.26.2.1.targus-getdata1 > 112.26.2.8.52161: Flags [.], ack 49981, win 6081, options [nop,nop,TS val 940440 ecr 718675,nop,nop,sack 2 {68545:71401}{65689:67117},mptcp dss ack 2226638424], length 0
21:11:50.877067 IP 112.26.2.8.52161 > 112.26.2.1.targus-getdata1: Flags [.], seq 49981:51409, ack 0, win 913, options [nop,nop,TS val 719105 ecr 938971,mptcp dss ack 1803767578 seq 2226649848 subseq 464101 len 1428 csum 0x90a9], length 1428
21:11:50.877363 IP 112.26.2.1.targus-getdata1 > 112.26.2.8.52161: Flags [.], ack 59977, win 6081, options [nop,nop,TS val 940631 ecr 719105,nop,nop,sack 2 {68545:71401}{65689:67117},mptcp dss ack 2226638424], length 0
21:11:50.939170 IP 112.26.2.1.targus-getdata1 > 112.26.2.8.52161: Flags [.], ack 59977, win 6081, options [nop,nop,TS val 940631 ecr 719105,nop,nop,sack 2 {68545:71401}{65689:67117},mptcp dss ack 2226638424], length 0
21:11:50.997076 IP 112.26.2.8.52161 > 112.26.2.1.targus-getdata1: Flags [.], seq 71401:72829, ack 0, win 913, options [nop,nop,TS val 719376 ecr 939300,mptcp dss ack 1803767578 seq 2226768372 subseq 485521 len 1428 csum 0x2692], length 1428
21:11:50.997370 IP 112.26.2.1.targus-getdata1 > 112.26.2.8.52161: Flags [.], ack 59977, win 6081, options [nop,nop,TS val 940751 ecr 719105,nop,nop,sack 2 {68545:72829}{65689:67117},mptcp dss ack 2226638424], length 0
21:11:51.039612 IP 112.26.2.8.52161 > 112.26.2.1.targus-getdata1: Flags [.], seq 72829:74257, ack 0, win 913, options [nop,nop,TS val 719513 ecr 939501,mptcp dss ack 1803767578 seq 2226772656 subseq 486949 len 1428 csum 0x47d], length 1428
21:11:51.039899 IP 112.26.2.1.targus-getdata1 > 112.26.2.8.52161: Flags [.], ack 59977, win 6081, options [nop,nop,TS val 940794 ecr 719105,nop,nop,sack 2 {68545:74257}{65689:67117},mptcp dss ack 2226638424], length 0
21:11:51.105130 IP 112.26.2.1.targus-getdata1 > 112.26.2.8.52161: Flags [.], ack 59977, win 6081, options [nop,nop,TS val 940751 ecr 719105,nop,nop,sack 2 {68545:72829}{65689:67117},mptcp dss ack 2226638424], length 0
21:11:51.160652 IP 112.26.2.1.targus-getdata1 > 112.26.2.8.52161: Flags [.], ack 59977, win 6081, options [nop,nop,TS val 940794 ecr 719105,nop,nop,sack 2 {68545:74257}{65689:67117},mptcp dss ack 2226638424], length 0
21:11:51.206960 IP 112.26.2.8.52161 > 112.26.2.1.targus-getdata1: Flags [.], seq 59977:61405, ack 0, win 913, options [nop,nop,TS val 719708 ecr 939887,mptcp dss ack 1803767578 seq 2226692688 subseq 474097 len 1428 csum 0xb79], length 1428
21:11:51.207353 IP 112.26.2.1.targus-getdata1 > 112.26.2.8.52161: Flags [.], ack 61405, win 6081, options [nop,nop,TS val 940961 ecr 719708,nop,nop,sack 2 {68545:74257}{65689:67117},mptcp dss ack 2226638424], length 0
21:11:51.301234 IP 112.26.2.1.targus-getdata1 > 112.26.2.8.52161: Flags [.], ack 61405, win 6081, options [nop,nop,TS val 940961 ecr 719708,nop,nop,sack 2 {68545:74257}{65689:67117},mptcp dss ack 2226638424], length 0
21:11:51.397471 IP 112.26.2.8.52161 > 112.26.2.1.targus-getdata1: Flags [.], seq 61405:62833, ack 0, win 913, options [nop,nop,TS val 719756 ecr 940029,mptcp dss ack 1803767578 seq 2226698400 subseq 475525 len 1428 csum 0x2942], length 1428
21:11:51.397795 IP 112.26.2.1.targus-getdata1 > 112.26.2.8.52161: Flags [.], ack 64261, win 6081, options [nop,nop,TS val 941152 ecr 719756,nop,nop,sack 2 {68545:74257}{65689:67117},mptcp dss ack 2226638424], length 0
21:11:51.461324 IP 112.26.2.1.targus-getdata1 > 112.26.2.8.52161: Flags [.], ack 64261, win 6081, options [nop,nop,TS val 941152 ecr 719756,nop,nop,sack 2 {68545:74257}{65689:67117},mptcp dss ack 2226638424], length 0
21:11:51.569944 IP 112.26.2.8.52161 > 112.26.2.1.targus-getdata1: Flags [.], seq 64261:65689, ack 0, win 913, options [nop,nop,TS val 719977 ecr 940214,mptcp dss ack 1803767578 seq 2226701256 subseq 478381 len 1428 csum 0xa1c9], length 1428
21:11:51.570243 IP 112.26.2.1.targus-getdata1 > 112.26.2.8.52161: Flags [.], ack 67117, win 6081, options [nop,nop,TS val 941324 ecr 719977,nop,nop,sack 1 {68545:74257},mptcp dss ack 2226638424], length 0
21:11:51.647469 IP 112.26.2.1.targus-getdata1 > 112.26.2.8.52161: Flags [.], ack 67117, win 6081, options [nop,nop,TS val 941324 ecr 719977,nop,nop,sack 1 {68545:74257},mptcp dss ack 2226638424], length 0
21:11:51.705973 IP 112.26.2.8.52161 > 112.26.2.1.targus-getdata1: Flags [.], seq 67117:68545, ack 0, win 913, options [nop,nop,TS val 719977 ecr 940214,mptcp dss ack 1803767578 seq 2226718392 subseq 481237 len 1428 csum 0x4bc1], length 1428
21:11:51.706285 IP 112.26.2.1.targus-getdata1 > 112.26.2.8.52161: Flags [.], ack 74257, win 6081, options [nop,nop,TS val 941460 ecr 719977,mptcp dss ack 2226638424], length 0
21:11:51.781268 IP 112.26.2.1.targus-getdata1 > 112.26.2.8.52161: Flags [.], ack 74257, win 6081, options [nop,nop,TS val 941460 ecr 719977,mptcp dss ack 2226638424], length 0
21:11:51.865014 IP 112.26.2.8.52161 > 112.26.2.1.targus-getdata1: Flags [.], seq 74257:75685, ack 0, win 913, options [nop,nop,TS val 719977 ecr 940214,mptcp dss ack 1803767578 seq 2226785508 subseq 488377 len 1428 csum 0x544c], length 1428
21:11:51.865358 IP 112.26.2.1.targus-getdata1 > 112.26.2.8.52161: Flags [.], ack 75685, win 6081, options [nop,nop,TS val 941619 ecr 719977,mptcp dss ack 2226638424], length 0
21:11:51.923318 IP 112.26.2.1.targus-getdata1 > 112.26.2.8.52161: Flags [.], ack 75685, win 6081, options [nop,nop,TS val 941619 ecr 719977,mptcp dss ack 2226638424], length 0
21:11:51.968788 IP 112.26.2.8.52161 > 112.26.2.1.targus-getdata1: Flags [.], seq 75685:77113, ack 0, win 913, options [nop,nop,TS val 719977 ecr 940214,mptcp dss ack 1803767578 seq 2226786936 subseq 489805 len 1428 csum 0xe93d], length 1428
21:11:51.969076 IP 112.26.2.1.targus-getdata1 > 112.26.2.8.52161: Flags [.], ack 77113, win 6081, options [nop,nop,TS val 941723 ecr 719977,mptcp dss ack 2226638424], length 0
21:11:52.068961 IP 112.26.2.1.targus-getdata1 > 112.26.2.8.52161: Flags [.], ack 77113, win 6081, options [nop,nop,TS val 941723 ecr 719977,mptcp dss ack 2226638424], length 0
21:11:52.114636 IP 112.26.2.8.52161 > 112.26.2.1.targus-getdata1: Flags [.], seq 78541:79969, ack 0, win 913, options [nop,nop,TS val 720088 ecr 940294,mptcp dss ack 1803767578 seq 2226794076 subseq 492661 len 1428 csum 0x44c6], length 1428
21:11:52.115011 IP 112.26.2.1.targus-getdata1 > 112.26.2.8.52161: Flags [.], ack 77113, win 6081, options [nop,nop,TS val 941869 ecr 719977,nop,nop,sack 1 {78541:79969},mptcp dss ack 2226638424], length 0
21:11:52.205997 IP 112.26.2.1.targus-getdata1 > 112.26.2.8.52161: Flags [.], ack 77113, win 6081, options [nop,nop,TS val 941869 ecr 719977,nop,nop,sack 1 {78541:79969},mptcp dss ack 2226638424], length 0
21:11:52.271160 IP 112.26.2.8.52161 > 112.26.2.1.targus-getdata1: Flags [.], seq 81397:82825, ack 0, win 913, options [nop,nop,TS val 720439 ecr 940631,mptcp dss ack 1803767578 seq 2226808356 subseq 495517 len 1428 csum 0xe4fa], length 1428
21:11:52.271490 IP 112.26.2.1.targus-getdata1 > 112.26.2.8.52161: Flags [.], ack 77113, win 6089, options [nop,nop,TS val 942025 ecr 719977,nop,nop,sack 2 {81397:82825}{78541:79969},mptcp dss ack 2226706968], length 0
21:11:52.358698 IP 112.26.2.1.targus-getdata1 > 112.26.2.8.52161: Flags [.], ack 77113, win 6089, options [nop,nop,TS val 942025 ecr 719977,nop,nop,sack 2 {81397:82825}{78541:79969},mptcp dss ack 2226706968], length 0
21:11:52.420947 IP 112.26.2.8.52161 > 112.26.2.1.targus-getdata1: Flags [.], seq 82825:84253, ack 0, win 913, options [nop,nop,TS val 720603 ecr 940751,mptcp dss ack 1803767578 seq 2226811212 subseq 496945 len 1428 csum 0xbcb5], length 1428
21:11:52.421321 IP 112.26.2.1.targus-getdata1 > 112.26.2.8.52161: Flags [.], ack 77113, win 6089, options [nop,nop,TS val 942175 ecr 719977,nop,nop,sack 2 {81397:84253}{78541:79969},mptcp dss ack 2226706968], length 0
21:11:52.495901 IP 112.26.2.1.targus-getdata1 > 112.26.2.8.52161: Flags [.], ack 77113, win 6089, options [nop,nop,TS val 942175 ecr 719977,nop,nop,sack 2 {81397:84253}{78541:79969},mptcp dss ack 2226706968], length 0
21:11:52.546937 IP 112.26.2.8.52161 > 112.26.2.1.targus-getdata1: Flags [.], seq 84253:85681, ack 0, win 913, options [nop,nop,TS val 720815 ecr 940794,mptcp dss ack 1803767578 seq 2226821208 subseq 498373 len 1428 csum 0xd756], length 1428
21:11:52.547218 IP 112.26.2.1.targus-getdata1 > 112.26.2.8.52161: Flags [.], ack 77113, win 6072, options [nop,nop,TS val 942301 ecr 719977,nop,nop,sack 2 {81397:85681}{78541:79969},mptcp dss ack 2226734100], length 0
21:11:52.626890 IP 112.26.2.1.targus-getdata1 > 112.26.2.8.52161: Flags [.], ack 77113, win 6072, options [nop,nop,TS val 942301 ecr 719977,nop,nop,sack 2 {81397:85681}{78541:79969},mptcp dss ack 2226734100], length 0
21:11:52.725179 IP 112.26.2.8.52161 > 112.26.2.1.targus-getdata1: Flags [.], seq 85681:87109, ack 0, win 913, options [nop,nop,TS val 720981 ecr 940961,mptcp dss ack 1803767578 seq 2226825492 subseq 499801 len 1428 csum 0x189e], length 1428
21:11:52.725477 IP 112.26.2.1.targus-getdata1 > 112.26.2.8.52161: Flags [.], ack 77113, win 6072, options [nop,nop,TS val 942479 ecr 719977,nop,nop,sack 2 {81397:87109}{78541:79969},mptcp dss ack 2226734100], length 0
21:11:52.765774 IP 112.26.2.1.targus-getdata1 > 112.26.2.8.52161: Flags [.], ack 77113, win 6072, options [nop,nop,TS val 942479 ecr 719977,nop,nop,sack 2 {81397:87109}{78541:79969},mptcp dss ack 2226734100], length 0
21:11:52.868846 IP 112.26.2.8.52161 > 112.26.2.1.targus-getdata1: Flags [.], seq 87109:88537, ack 0, win 913, options [nop,nop,TS val 721119 ecr 941152,mptcp dss ack 1803767578 seq 2226831204 subseq 501229 len 1428 csum 0xed43], length 1428
21:11:52.869135 IP 112.26.2.1.targus-getdata1 > 112.26.2.8.52161: Flags [.], ack 77113, win 6087, options [nop,nop,TS val 942623 ecr 719977,nop,nop,sack 2 {81397:88537}{78541:79969},mptcp dss ack 2226748380], length 0
21:11:52.979928 IP 112.26.2.1.targus-getdata1 > 112.26.2.8.52161: Flags [.], ack 77113, win 6087, options [nop,nop,TS val 942623 ecr 719977,nop,nop,sack 2 {81397:88537}{78541:79969},mptcp dss ack 2226748380], length 0
21:11:53.044986 IP 112.26.2.8.52161 > 112.26.2.1.targus-getdata1: Flags [.], seq 88537:89965, ack 0, win 913, options [nop,nop,TS val 721240 ecr 941324,mptcp dss ack 1803767578 seq 2226836916 subseq 502657 len 1428 csum 0x73a5], length 1428
21:11:53.045236 IP 112.26.2.1.targus-getdata1 > 112.26.2.8.52161: Flags [.], ack 77113, win 6087, options [nop,nop,TS val 942799 ecr 719977,nop,nop,sack 2 {81397:89965}{78541:79969},mptcp dss ack 2226748380], length 0
21:11:53.166468 IP 112.26.2.1.targus-getdata1 > 112.26.2.8.52161: Flags [.], ack 77113, win 6087, options [nop,nop,TS val 942799 ecr 719977,nop,nop,sack 2 {81397:89965}{78541:79969},mptcp dss ack 2226748380], length 0
21:11:53.235645 IP 112.26.2.8.52161 > 112.26.2.1.targus-getdata1: Flags [.], seq 89965:91393, ack 0, win 913, options [nop,nop,TS val 721354 ecr 941460,mptcp dss ack 1803767578 seq 2226839772 subseq 504085 len 1428 csum 0xa70c], length 1428
21:11:53.235974 IP 112.26.2.1.targus-getdata1 > 112.26.2.8.52161: Flags [.], ack 77113, win 6087, options [nop,nop,TS val 942990 ecr 719977,nop,nop,sack 2 {81397:91393}{78541:79969},mptcp dss ack 2226748380], length 0
21:11:53.311519 IP 112.26.2.1.targus-getdata1 > 112.26.2.8.52161: Flags [.], ack 77113, win 6087, options [nop,nop,TS val 942990 ecr 719977,nop,nop,sack 2 {81397:91393}{78541:79969},mptcp dss ack 2226748380], length 0
21:11:53.398597 IP 112.26.2.8.52161 > 112.26.2.1.targus-getdata1: Flags [.], seq 91393:92821, ack 0, win 913, options [nop,nop,TS val 721535 ecr 941619,mptcp dss ack 1803767578 seq 2226848340 subseq 505513 len 1428 csum 0xe45e], length 1428
21:11:53.398927 IP 112.26.2.1.targus-getdata1 > 112.26.2.8.52161: Flags [.], ack 77113, win 5998, options [nop,nop,TS val 943153 ecr 719977,nop,nop,sack 2 {81397:92821}{78541:79969},mptcp dss ack 2226759804], length 0
21:11:53.589290 IP 112.26.2.1.targus-getdata1 > 112.26.2.8.52161: Flags [.], ack 77113, win 5998, options [nop,nop,TS val 943153 ecr 719977,nop,nop,sack 2 {81397:92821}{78541:79969},mptcp dss ack 2226759804], length 0
21:11:53.650104 IP 112.26.2.8.52161 > 112.26.2.1.targus-getdata1: Flags [.], seq 92821:94249, ack 0, win 913, options [nop,nop,TS val 721535 ecr 941619,mptcp dss ack 1803767578 seq 2226849768 subseq 506941 len 1428 csum 0x4f7e], length 1428
21:11:53.650426 IP 112.26.2.1.targus-getdata1 > 112.26.2.8.52161: Flags [.], ack 77113, win 5998, options [nop,nop,TS val 943404 ecr 719977,nop,nop,sack 2 {81397:94249}{78541:79969},mptcp dss ack 2226759804], length 0
21:11:53.730266 IP 112.26.2.1.targus-getdata1 > 112.26.2.8.52161: Flags [.], ack 77113, win 5998, options [nop,nop,TS val 943404 ecr 719977,nop,nop,sack 2 {81397:94249}{78541:79969},mptcp dss ack 2226759804], length 0
21:11:53.807149 IP 112.26.2.8.52161 > 112.26.2.1.targus-getdata1: Flags [.], seq 95677:97105, ack 0, win 913, options [nop,nop,TS val 721953 ecr 941869,mptcp dss ack 1803767578 seq 2226864048 subseq 509797 len 1428 csum 0x5061], length 1428
21:11:53.807515 IP 112.26.2.1.targus-getdata1 > 112.26.2.8.52161: Flags [.], ack 77113, win 5954, options [nop,nop,TS val 943561 ecr 719977,nop,nop,sack 2 {95677:97105}{81397:94249},mptcp dss ack 2226766944], length 0
21:11:53.867044 IP 112.26.2.8.52161 > 112.26.2.1.targus-getdata1: Flags [.], seq 77113:78541, ack 0, win 913, options [nop,nop,TS val 722084 ecr 942025,mptcp dss ack 1803767578 seq 2226788364 subseq 491233 len 1428 csum 0x9a71], length 1428
21:11:53.867357 IP 112.26.2.1.targus-getdata1 > 112.26.2.8.52161: Flags [.], ack 79969, win 6027, options [nop,nop,TS val 943621 ecr 722084,nop,nop,sack 2 {95677:97105}{81397:94249},mptcp dss ack 2226795504], length 0
21:11:53.982177 IP 112.26.2.1.targus-getdata1 > 112.26.2.8.52161: Flags [.], ack 77113, win 5954, options [nop,nop,TS val 943561 ecr 719977,nop,nop,sack 2 {95677:97105}{81397:94249},mptcp dss ack 2226766944], length 0
21:11:54.081129 IP 112.26.2.1.targus-getdata1 > 112.26.2.8.52161: Flags [.], ack 79969, win 6027, options [nop,nop,TS val 943621 ecr 722084,nop,nop,sack 2 {95677:97105}{81397:94249},mptcp dss ack 2226795504], length 0
