21:10:57.748046 IP 112.26.0.8.50628 > 112.26.0.1.targus-getdata1: Flags [S], seq 2082638886, win 29200, options [mss 1460,sackOK,TS val 666682 ecr 0,nop,wscale 7,mptcp capable csum {0x870e23def0b356e5}], length 0
21:10:57.748309 IP 112.26.0.1.targus-getdata1 > 112.26.0.8.50628: Flags [S.], seq 1409871062, ack 2082638887, win 28560, options [mss 1460,sackOK,TS val 887502 ecr 666682,nop,wscale 7,mptcp capable csum {0xabf26249df8c8f2e}], length 0
21:10:57.854077 IP 112.26.0.1.targus-getdata1 > 112.26.0.8.50628: Flags [S.], seq 1409871062, ack 2082638887, win 28560, options [mss 1460,sackOK,TS val 887502 ecr 666682,nop,wscale 7,mptcp capable csum {0xabf26249df8c8f2e}], length 0
21:10:58.045906 IP 112.26.0.8.50628 > 112.26.0.1.targus-getdata1: Flags [.], ack 1, win 229, options [nop,nop,TS val 666894 ecr 887502,mptcp capable csum {0x870e23def0b356e5,0xabf26249df8c8f2e},mptcp dss ack 2021447403], length 0
21:10:58.046345 IP 112.26.0.1.targus-getdata1 > 112.26.0.8.50628: Flags [.], ack 1, win 224, options [nop,nop,TS val 887800 ecr 666894,mptcp add-addr id 3 112.26.1.1,mptcp dss ack 394472223], length 0
21:10:58.046411 IP 112.26.0.1.targus-getdata1 > 112.26.0.8.50628: Flags [.], ack 1, win 224, options [nop,nop,TS val 887800 ecr 666894,mptcp add-addr id 4 112.26.2.1,mptcp dss ack 394472223], length 0
21:10:58.046447 IP 112.26.0.1.targus-getdata1 > 112.26.0.8.50628: Flags [.], ack 1, win 224, options [nop,nop,TS val 887800 ecr 666894,mptcp add-addr id 6 112.26.3.1,mptcp dss ack 394472223], length 0
21:11:39.392667 IP 112.26.0.8.50630 > 112.26.0.1.targus-getdata1: Flags [.], seq 4189887067:4189888495, ack 353110603, win 913, options [nop,nop,TS val 707727 ecr 927978,mptcp dss ack 1803767578 seq 2226202884 subseq 375602 len 1428 csum 0xd2a7], length 1428
21:11:39.462795 IP 112.26.0.1.targus-getdata1 > 112.26.0.8.50630: Flags [.], ack 4294963012, win 6122, options [nop,nop,TS val 928631 ecr 707208,mptcp dss ack 2226085788], length 0
21:11:39.478133 IP 112.26.0.1.targus-getdata1 > 112.26.0.8.50630: Flags [.], ack 1428, win 6122, options [nop,nop,TS val 929232 ecr 707727,mptcp dss ack 2226157188], length 0
21:11:39.535416 IP 112.26.0.8.50630 > 112.26.0.1.targus-getdata1: Flags [.], seq 1428:2856, ack 1, win 913, options [nop,nop,TS val 707876 ecr 928071,mptcp dss ack 1803767578 seq 2226207168 subseq 377030 len 1428 csum 0x9448], length 1428
21:11:56.900795 IP 112.26.0.8.50630 > 112.26.0.1.targus-getdata1: Flags [.], seq 164220:165648, ack 1, win 913, options [nop,nop,TS val 725284 ecr 945505,mptcp dss ack 1803767578 seq 2226979716 subseq 539822 len 1428 csum 0xacec], length 1428
21:12:11.053455 IP 112.26.0.8.50630 > 112.26.0.1.targus-getdata1: Flags [.], seq 302736:304164, ack 1, win 913, options [nop,nop,TS val 739525 ecr 959843,mptcp dss ack 1803767578 seq 2227610892 subseq 678338 len 1428 csum 0x3b98], length 1428
21:12:29.066414 IP 112.26.0.8.50630 > 112.26.0.1.targus-getdata1: Flags [.], seq 504084:505512, ack 1, win 913, options [nop,nop,TS val 757353 ecr 977504,mptcp dss ack 1803767578 seq 2228451984 subseq 879686 len 1428 csum 0x62d], length 1428
21:12:29.066688 IP 112.26.0.1.targus-getdata1 > 112.26.0.8.50630: Flags [.], ack 495516, win 6122, options [nop,nop,TS val 978820 ecr 756348,nop,nop,sack 1 {496944:505512},mptcp dss ack 2228390580], length 0
21:12:29.146495 IP 112.26.0.1.targus-getdata1 > 112.26.0.8.50630: Flags [.], ack 494088, win 6122, options [nop,nop,TS val 978200 ecr 756348,mptcp dss ack 2228390580], length 0
21:12:29.238941 IP 112.26.0.8.50630 > 112.26.0.1.targus-getdata1: Flags [.], seq 505512:506940, ack 1, win 913, options [nop,nop,TS val 757353 ecr 977504,mptcp dss ack 1803767578 seq 2228453412 subseq 881114 len 1428 csum 0x2060], length 1428
21:12:29.239260 IP 112.26.0.1.targus-getdata1 > 112.26.0.8.50630: Flags [.], ack 495516, win 6122, options [nop,nop,TS val 978993 ecr 756348,nop,nop,sack 1 {496944:506940},mptcp dss ack 2228390580], length 0
21:12:29.339107 IP 112.26.0.8.50630 > 112.26.0.1.targus-getdata1: Flags [.], seq 506940:508368, ack 1, win 913, options [nop,nop,TS val 757353 ecr 977504,mptcp dss ack 1803767578 seq 2228454840 subseq 882542 len 1428 csum 0x74fc], length 1428
21:12:29.339464 IP 112.26.0.1.targus-getdata1 > 112.26.0.8.50630: Flags [.], ack 495516, win 6122, options [nop,nop,TS val 979094 ecr 756348,nop,nop,sack 1 {496944:508368},mptcp dss ack 2228390580], length 0
21:12:29.419096 IP 112.26.0.1.targus-getdata1 > 112.26.0.8.50630: Flags [.], ack 495516, win 6122, options [nop,nop,TS val 978384 ecr 756348,mptcp dss ack 2228390580], length 0
21:12:29.469033 IP 112.26.0.1.targus-getdata1 > 112.26.0.8.50630: Flags [.], ack 495516, win 6122, options [nop,nop,TS val 978409 ecr 756348,nop,nop,sack 1 {496944:498372},mptcp dss ack 2228390580], length 0
21:12:29.559105 IP 112.26.0.1.targus-getdata1 > 112.26.0.8.50630: Flags [.], ack 495516, win 6122, options [nop,nop,TS val 978520 ecr 756348,nop,nop,sack 1 {496944:499800},mptcp dss ack 2228390580], length 0
21:12:29.660804 IP 112.26.0.1.targus-getdata1 > 112.26.0.8.50630: Flags [.], ack 495516, win 6122, options [nop,nop,TS val 978600 ecr 756348,nop,nop,sack 1 {496944:501228},mptcp dss ack 2228390580], length 0
21:12:29.720950 IP 112.26.0.1.targus-getdata1 > 112.26.0.8.50630: Flags [.], ack 495516, win 6122, options [nop,nop,TS val 978638 ecr 756348,nop,nop,sack 1 {496944:502656},mptcp dss ack 2228390580], length 0
21:12:29.817706 IP 112.26.0.1.targus-getdata1 > 112.26.0.8.50630: Flags [.], ack 495516, win 6122, options [nop,nop,TS val 978722 ecr 756348,nop,nop,sack 1 {496944:504084},mptcp dss ack 2228390580], length 0
21:12:29.902171 IP 112.26.0.1.targus-getdata1 > 112.26.0.8.50630: Flags [.], ack 495516, win 6122, options [nop,nop,TS val 978820 ecr 756348,nop,nop,sack 1 {496944:505512},mptcp dss ack 2228390580], length 0
21:12:29.993232 IP 112.26.0.1.targus-getdata1 > 112.26.0.8.50630: Flags [.], ack 495516, win 6122, options [nop,nop,TS val 978993 ecr 756348,nop,nop,sack 1 {496944:506940},mptcp dss ack 2228390580], length 0
21:12:30.063127 IP 112.26.0.8.50630 > 112.26.0.1.targus-getdata1: Flags [.], seq 515508:516936, ack 1, win 913, options [nop,nop,TS val 758095 ecr 978200,mptcp dss ack 1803767578 seq 2228490540 subseq 891110 len 1428 csum 0x4864], length 1428
21:12:30.063461 IP 112.26.0.1.targus-getdata1 > 112.26.0.8.50630: Flags [.], ack 495516, win 6122, options [nop,nop,TS val 979817 ecr 756348,nop,nop,sack 2 {515508:516936}{496944:508368},mptcp dss ack 2228390580], length 0
21:12:30.144648 IP 112.26.0.1.targus-getdata1 > 112.26.0.8.50630: Flags [.], ack 495516, win 6122, options [nop,nop,TS val 979094 ecr 756348,nop,nop,sack 1 {496944:508368},mptcp dss ack 2228390580], length 0
21:12:30.191530 IP 112.26.0.8.50630 > 112.26.0.1.targus-getdata1: Flags [.], seq 516936:518364, ack 1, win 913, options [nop,nop,TS val 758095 ecr 978200,mptcp dss ack 1803767578 seq 2228491968 subseq 892538 len 1428 csum 0x21d5], length 1428
21:12:30.191868 IP 112.26.0.1.targus-getdata1 > 112.26.0.8.50630: Flags [.], ack 495516, win 6100, options [nop,nop,TS val 979945 ecr 756348,nop,nop,sack 2 {515508:518364}{496944:508368},mptcp dss ack 2228393436], length 0
21:12:30.281166 IP 112.26.0.8.50630 > 112.26.0.1.targus-getdata1: Flags [.], seq 518364:519792, ack 1, win 913, options [nop,nop,TS val 758095 ecr 978200,mptcp dss ack 1803767578 seq 2228493396 subseq 893966 len 1428 csum 0x1467], length 1428
21:12:30.281489 IP 112.26.0.1.targus-getdata1 > 112.26.0.8.50630: Flags [.], ack 495516, win 6100, options [nop,nop,TS val 980035 ecr 756348,nop,nop,sack 2 {515508:519792}{496944:508368},mptcp dss ack 2228393436], length 0
21:12:30.359406 IP 112.26.0.8.50630 > 112.26.0.1.targus-getdata1: Flags [.], seq 519792:521220, ack 1, win 913, options [nop,nop,TS val 758095 ecr 978200,mptcp dss ack 1803767578 seq 2228494824 subseq 895394 len 1428 csum 0xa958], length 1428
21:12:30.359725 IP 112.26.0.1.targus-getdata1 > 112.26.0.8.50630: Flags [.], ack 495516, win 6089, options [nop,nop,TS val 980113 ecr 756348,nop,nop,sack 2 {515508:521220}{496944:508368},mptcp dss ack 2228394864], length 0
21:12:30.496985 IP 112.26.0.8.50630 > 112.26.0.1.targus-getdata1: Flags [.], seq 522648:524076, ack 1, win 913, options [nop,nop,TS val 758095 ecr 978200,mptcp dss ack 1803767578 seq 2228497680 subseq 898250 len 1428 csum 0xf70c], length 1428
21:12:30.497311 IP 112.26.0.1.targus-getdata1 > 112.26.0.8.50630: Flags [.], ack 495516, win 6100, options [nop,nop,TS val 980251 ecr 756348,nop,nop,sack 2 {522648:524076}{515508:521220},mptcp dss ack 2228403432], length 0
21:12:30.537966 IP 112.26.0.8.50630 > 112.26.0.1.targus-getdata1: Flags [.], seq 524076:525504, ack 1, win 913, options [nop,nop,TS val 758367 ecr 978384,mptcp dss ack 1803767578 seq 2228504820 subseq 899678 len 1428 csum 0x8995], length 1428
21:12:30.538280 IP 112.26.0.1.targus-getdata1 > 112.26.0.8.50630: Flags [.], ack 495516, win 6100, options [nop,nop,TS val 980292 ecr 756348,nop,nop,sack 2 {522648:525504}{515508:521220},mptcp dss ack 2228403432], length 0
21:12:30.623702 IP 112.26.0.8.50630 > 112.26.0.1.targus-getdata1: Flags [.], seq 525504:526932, ack 1, win 913, options [nop,nop,TS val 758566 ecr 978409,mptcp dss ack 1803767578 seq 2228507676 subseq 901106 len 1428 csum 0x27a1], length 1428
21:12:30.624030 IP 112.26.0.1.targus-getdata1 > 112.26.0.8.50630: Flags [.], ack 495516, win 6100, options [nop,nop,TS val 980378 ecr 756348,nop,nop,sack 2 {522648:526932}{515508:521220},mptcp dss ack 2228403432], length 0
21:12:30.671687 IP 112.26.0.1.targus-getdata1 > 112.26.0.8.50630: Flags [.], ack 495516, win 6122, options [nop,nop,TS val 979817 ecr 756348,nop,nop,sack 2 {515508:516936}{496944:508368},mptcp dss ack 2228390580], length 0
21:12:30.745305 IP 112.26.0.8.50630 > 112.26.0.1.targus-getdata1: Flags [.], seq 526932:528360, ack 1, win 913, options [nop,nop,TS val 758659 ecr 978520,mptcp dss ack 1803767578 seq 2228511960 subseq 902534 len 1428 csum 0x6904], length 1428
21:12:30.745532 IP 112.26.0.1.targus-getdata1 > 112.26.0.8.50630: Flags [.], ack 495516, win 6067, options [nop,nop,TS val 980500 ecr 756348,nop,nop,sack 2 {522648:528360}{515508:521220},mptcp dss ack 2228407716], length 0
21:12:30.796167 IP 112.26.0.8.50630 > 112.26.0.1.targus-getdata1: Flags [.], seq 495516:496944, ack 1, win 913, options [nop,nop,TS val 758674 ecr 978600,mptcp dss ack 1803767578 seq 2228407716 subseq 871118 len 1428 csum 0x1401], length 1428
21:12:30.796589 IP 112.26.0.1.targus-getdata1 > 112.26.0.8.50630: Flags [.], ack 508368, win 5828, options [nop,nop,TS val 980551 ecr 758674,nop,nop,sack 2 {522648:528360}{515508:521220},mptcp dss ack 2228456268], length 0
21:12:30.877849 IP 112.26.0.1.targus-getdata1 > 112.26.0.8.50630: Flags [.], ack 495516, win 6100, options [nop,nop,TS val 979945 ecr 756348,nop,nop,sack 2 {515508:518364}{496944:508368},mptcp dss ack 2228393436], length 0
21:12:30.940502 IP 112.26.0.1.targus-getdata1 > 112.26.0.8.50630: Flags [.], ack 495516, win 6100, options [nop,nop,TS val 980035 ecr 756348,nop,nop,sack 2 {515508:519792}{496944:508368},mptcp dss ack 2228393436], length 0
21:12:30.986578 IP 112.26.0.8.50630 > 112.26.0.1.targus-getdata1: Flags [.], seq 528360:529788, ack 1, win 913, options [nop,nop,TS val 758791 ecr 978638,mptcp dss ack 1803767578 seq 2228514816 subseq 903962 len 1428 csum 0x7090], length 1428
21:12:30.986870 IP 112.26.0.1.targus-getdata1 > 112.26.0.8.50630: Flags [.], ack 508368, win 6094, options [nop,nop,TS val 980741 ecr 758674,nop,nop,sack 2 {522648:529788}{515508:521220},mptcp dss ack 2228456268], length 0
21:12:31.063673 IP 112.26.0.1.targus-getdata1 > 112.26.0.8.50630: Flags [.], ack 495516, win 6089, options [nop,nop,TS val 980113 ecr 756348,nop,nop,sack 2 {515508:521220}{496944:508368},mptcp dss ack 2228394864], length 0
21:12:31.142921 IP 112.26.0.8.50630 > 112.26.0.1.targus-getdata1: Flags [.], seq 529788:531216, ack 1, win 913, options [nop,nop,TS val 759049 ecr 978820,mptcp dss ack 1803767578 seq 2228523384 subseq 905390 len 1428 csum 0x4d5e], length 1428
21:12:31.143239 IP 112.26.0.1.targus-getdata1 > 112.26.0.8.50630: Flags [.], ack 508368, win 6094, options [nop,nop,TS val 980897 ecr 758674,nop,nop,sack 2 {522648:531216}{515508:521220},mptcp dss ack 2228456268], length 0
21:12:31.216127 IP 112.26.0.8.50630 > 112.26.0.1.targus-getdata1: Flags [.], seq 531216:532644, ack 1, win 913, options [nop,nop,TS val 759169 ecr 978993,mptcp dss ack 1803767578 seq 2228529096 subseq 906818 len 1428 csum 0x8c49], length 1428
21:12:31.216406 IP 112.26.0.1.targus-getdata1 > 112.26.0.8.50630: Flags [.], ack 508368, win 6094, options [nop,nop,TS val 980970 ecr 758674,nop,nop,sack 2 {522648:532644}{515508:521220},mptcp dss ack 2228456268], length 0
21:12:31.265836 IP 112.26.0.1.targus-getdata1 > 112.26.0.8.50630: Flags [.], ack 495516, win 6100, options [nop,nop,TS val 980292 ecr 756348,nop,nop,sack 2 {522648:525504}{515508:521220},mptcp dss ack 2228403432], length 0
21:12:31.355211 IP 112.26.0.1.targus-getdata1 > 112.26.0.8.50630: Flags [.], ack 495516, win 6100, options [nop,nop,TS val 980378 ecr 756348,nop,nop,sack 2 {522648:526932}{515508:521220},mptcp dss ack 2228403432], length 0
21:12:31.413836 IP 112.26.0.8.50630 > 112.26.0.1.targus-getdata1: Flags [.], seq 508368:509796, ack 1, win 913, options [nop,nop,TS val 759620 ecr 979817,mptcp dss ack 1803767578 seq 2228456268 subseq 883970 len 1428 csum 0x842a], length 1428
21:12:31.414209 IP 112.26.0.1.targus-getdata1 > 112.26.0.8.50630: Flags [.], ack 509796, win 6083, options [nop,nop,TS val 981168 ecr 759620,nop,nop,sack 2 {522648:532644}{515508:521220},mptcp dss ack 2228457696], length 0
21:12:31.484705 IP 112.26.0.1.targus-getdata1 > 112.26.0.8.50630: Flags [.], ack 495516, win 6067, options [nop,nop,TS val 980500 ecr 756348,nop,nop,sack 2 {522648:528360}{515508:521220},mptcp dss ack 2228407716], length 0
21:12:31.533054 IP 112.26.0.1.targus-getdata1 > 112.26.0.8.50630: Flags [.], ack 508368, win 5828, options [nop,nop,TS val 980551 ecr 758674,nop,nop,sack 2 {522648:528360}{515508:521220},mptcp dss ack 2228456268], length 0
21:12:31.640389 IP 112.26.0.8.50630 > 112.26.0.1.targus-getdata1: Flags [.], seq 509796:511224, ack 1, win 913, options [nop,nop,TS val 759826 ecr 979945,mptcp dss ack 1803767578 seq 2228457696 subseq 885398 len 1428 csum 0xc2f1], length 1428
21:12:31.640754 IP 112.26.0.1.targus-getdata1 > 112.26.0.8.50630: Flags [.], ack 511224, win 6017, options [nop,nop,TS val 981395 ecr 759826,nop,nop,sack 2 {522648:532644}{515508:521220},mptcp dss ack 2228466264], length 0
21:12:31.719436 IP 112.26.0.1.targus-getdata1 > 112.26.0.8.50630: Flags [.], ack 508368, win 6094, options [nop,nop,TS val 980741 ecr 758674,nop,nop,sack 2 {522648:529788}{515508:521220},mptcp dss ack 2228456268], length 0
21:12:31.810755 IP 112.26.0.8.50630 > 112.26.0.1.targus-getdata1: Flags [.], seq 512652:514080, ack 1, win 913, options [nop,nop,TS val 760058 ecr 980113,mptcp dss ack 1803767578 seq 2228467692 subseq 888254 len 1428 csum 0xac96], length 1428
21:12:31.811056 IP 112.26.0.1.targus-getdata1 > 112.26.0.8.50630: Flags [.], ack 511224, win 6044, options [nop,nop,TS val 981565 ecr 759826,nop,nop,sack 2 {512652:514080}{522648:532644},mptcp dss ack 2228466264], length 0
21:12:31.885700 IP 112.26.0.1.targus-getdata1 > 112.26.0.8.50630: Flags [.], ack 508368, win 6094, options [nop,nop,TS val 980970 ecr 758674,nop,nop,sack 2 {522648:532644}{515508:521220},mptcp dss ack 2228456268], length 0
21:12:31.972998 IP 112.26.0.8.50630 > 112.26.0.1.targus-getdata1: Flags [.], seq 514080:515508, ack 1, win 913, options [nop,nop,TS val 760216 ecr 980292,mptcp dss ack 1803767578 seq 2228489112 subseq 889682 len 1428 csum 0x2c0b], length 1428
21:12:31.973266 IP 112.26.0.1.targus-getdata1 > 112.26.0.8.50630: Flags [.], ack 511224, win 6044, options [nop,nop,TS val 981727 ecr 759826,nop,nop,sack 2 {512652:521220}{522648:532644},mptcp dss ack 2228466264], length 0
21:12:32.050449 IP 112.26.0.8.50630 > 112.26.0.1.targus-getdata1: Flags [.], seq 521220:522648, ack 1, win 913, options [nop,nop,TS val 760216 ecr 980292,mptcp dss ack 1803767578 seq 2228496252 subseq 896822 len 1428 csum 0x5a8c], length 1428
21:12:32.050694 IP 112.26.0.1.targus-getdata1 > 112.26.0.8.50630: Flags [.], ack 511224, win 6044, options [nop,nop,TS val 981804 ecr 759826,nop,nop,sack 1 {512652:532644},mptcp dss ack 2228466264], length 0
21:12:32.130661 IP 112.26.0.1.targus-getdata1 > 112.26.0.8.50630: Flags [.], ack 509796, win 6083, options [nop,nop,TS val 981168 ecr 759620,nop,nop,sack 2 {522648:532644}{515508:521220},mptcp dss ack 2228457696], length 0
21:12:32.171742 IP 112.26.0.8.50630 > 112.26.0.1.targus-getdata1: Flags [.], seq 532644:534072, ack 1, win 913, options [nop,nop,TS val 760325 ecr 980378,mptcp dss ack 1803767578 seq 2228569080 subseq 908246 len 1428 csum 0x2563], length 1428
21:12:32.172043 IP 112.26.0.1.targus-getdata1 > 112.26.0.8.50630: Flags [.], ack 511224, win 6044, options [nop,nop,TS val 981926 ecr 759826,nop,nop,sack 1 {512652:534072},mptcp dss ack 2228466264], length 0
21:12:32.260384 IP 112.26.0.8.50630 > 112.26.0.1.targus-getdata1: Flags [.], seq 534072:535500, ack 1, win 913, options [nop,nop,TS val 760451 ecr 980500,mptcp dss ack 1803767578 seq 2228573364 subseq 909674 len 1428 csum 0xad06], length 1428
21:12:32.260702 IP 112.26.0.1.targus-getdata1 > 112.26.0.8.50630: Flags [.], ack 511224, win 6044, options [nop,nop,TS val 982014 ecr 759826,nop,nop,sack 1 {512652:535500},mptcp dss ack 2228466264], length 0
21:12:32.304852 IP 112.26.0.1.targus-getdata1 > 112.26.0.8.50630: Flags [.], ack 511224, win 6017, options [nop,nop,TS val 981395 ecr 759826,nop,nop,sack 2 {522648:532644}{515508:521220},mptcp dss ack 2228466264], length 0
21:12:32.335717 IP 112.26.0.8.50630 > 112.26.0.1.targus-getdata1: Flags [.], seq 535500:536928, ack 1, win 913, options [nop,nop,TS val 760515 ecr 980551,mptcp dss ack 1803767578 seq 2228581932 subseq 911102 len 1428 csum 0x5272], length 1428
21:12:32.336026 IP 112.26.0.1.targus-getdata1 > 112.26.0.8.50630: Flags [.], ack 511224, win 6044, options [nop,nop,TS val 982090 ecr 759826,nop,nop,sack 1 {512652:536928},mptcp dss ack 2228466264], length 0
21:12:32.408575 IP 112.26.0.8.50630 > 112.26.0.1.targus-getdata1: Flags [.], seq 536928:538356, ack 1, win 913, options [nop,nop,TS val 760515 ecr 980551,mptcp dss ack 1803767578 seq 2228583360 subseq 912530 len 1428 csum 0x4858], length 1428
21:12:32.408868 IP 112.26.0.1.targus-getdata1 > 112.26.0.8.50630: Flags [.], ack 511224, win 6044, options [nop,nop,TS val 982162 ecr 759826,nop,nop,sack 1 {512652:538356},mptcp dss ack 2228466264], length 0
21:12:32.476319 IP 112.26.0.1.targus-getdata1 > 112.26.0.8.50630: Flags [.], ack 511224, win 6044, options [nop,nop,TS val 981565 ecr 759826,nop,nop,sack 2 {512652:514080}{522648:532644},mptcp dss ack 2228466264], length 0
21:12:32.527658 IP 112.26.0.8.50630 > 112.26.0.1.targus-getdata1: Flags [.], seq 538356:539784, ack 1, win 913, options [nop,nop,TS val 760515 ecr 980551,mptcp dss ack 1803767578 seq 2228584788 subseq 913958 len 1428 csum 0x78de], length 1428
21:12:32.528066 IP 112.26.0.1.targus-getdata1 > 112.26.0.8.50630: Flags [.], ack 511224, win 6044, options [nop,nop,TS val 982282 ecr 759826,nop,nop,sack 1 {512652:539784},mptcp dss ack 2228466264], length 0
21:12:32.596553 IP 112.26.0.8.50630 > 112.26.0.1.targus-getdata1: Flags [.], seq 539784:541212, ack 1, win 913, options [nop,nop,TS val 760673 ecr 980741,mptcp dss ack 1803767578 seq 2228589072 subseq 915386 len 1428 csum 0x1698], length 1428
21:12:32.596884 IP 112.26.0.1.targus-getdata1 > 112.26.0.8.50630: Flags [.], ack 511224, win 6044, options [nop,nop,TS val 982351 ecr 759826,nop,nop,sack 1 {512652:541212},mptcp dss ack 2228466264], length 0
21:12:32.659231 IP 112.26.0.8.50630 > 112.26.0.1.targus-getdata1: Flags [.], seq 541212:542640, ack 1, win 913, options [nop,nop,TS val 760879 ecr 980970,mptcp dss ack 1803767578 seq 2228596212 subseq 916814 len 1428 csum 0x684f], length 1428
21:12:32.659481 IP 112.26.0.1.targus-getdata1 > 112.26.0.8.50630: Flags [.], ack 511224, win 6044, options [nop,nop,TS val 982413 ecr 759826,nop,nop,sack 1 {512652:542640},mptcp dss ack 2228466264], length 0
21:12:32.728386 IP 112.26.0.1.targus-getdata1 > 112.26.0.8.50630: Flags [.], ack 511224, win 6044, options [nop,nop,TS val 981804 ecr 759826,nop,nop,sack 1 {512652:532644},mptcp dss ack 2228466264], length 0
21:12:32.800142 IP 112.26.0.8.50630 > 112.26.0.1.targus-getdata1: Flags [.], seq 544068:545496, ack 1, win 913, options [nop,nop,TS val 761078 ecr 981168,mptcp dss ack 1803767578 seq 2228606208 subseq 919670 len 1428 csum 0x7b98], length 1428
21:12:32.800505 IP 112.26.0.1.targus-getdata1 > 112.26.0.8.50630: Flags [.], ack 511224, win 6044, options [nop,nop,TS val 982554 ecr 759826,nop,nop,sack 2 {544068:545496}{512652:542640},mptcp dss ack 2228466264], length 0
21:12:32.846170 IP 112.26.0.1.targus-getdata1 > 112.26.0.8.50630: Flags [.], ack 511224, win 6044, options [nop,nop,TS val 981926 ecr 759826,nop,nop,sack 1 {512652:534072},mptcp dss ack 2228466264], length 0
21:12:32.905687 IP 112.26.0.1.targus-getdata1 > 112.26.0.8.50630: Flags [.], ack 511224, win 6044, options [nop,nop,TS val 982014 ecr 759826,nop,nop,sack 1 {512652:535500},mptcp dss ack 2228466264], length 0
21:12:32.960519 IP 112.26.0.8.50630 > 112.26.0.1.targus-getdata1: Flags [.], seq 545496:546924, ack 1, win 913, options [nop,nop,TS val 761253 ecr 981395,mptcp dss ack 1803767578 seq 2228616204 subseq 921098 len 1428 csum 0x46bc], length 1428
21:12:32.960804 IP 112.26.0.1.targus-getdata1 > 112.26.0.8.50630: Flags [.], ack 511224, win 6044, options [nop,nop,TS val 982714 ecr 759826,nop,nop,sack 2 {544068:546924}{512652:542640},mptcp dss ack 2228466264], length 0
21:12:33.056898 IP 112.26.0.1.targus-getdata1 > 112.26.0.8.50630: Flags [.], ack 511224, win 6044, options [nop,nop,TS val 982090 ecr 759826,nop,nop,sack 1 {512652:536928},mptcp dss ack 2228466264], length 0
21:12:33.159781 IP 112.26.0.8.50630 > 112.26.0.1.targus-getdata1: Flags [.], seq 511224:512652, ack 1, win 913, options [nop,nop,TS val 761424 ecr 981565,mptcp dss ack 1803767578 seq 2228466264 subseq 886826 len 1428 csum 0x4eaa], length 1428
21:12:33.160202 IP 112.26.0.1.targus-getdata1 > 112.26.0.8.50630: Flags [.], ack 542640, win 5507, options [nop,nop,TS val 982914 ecr 761424,nop,nop,sack 1 {544068:546924},mptcp dss ack 2228577648], length 0
21:12:33.230343 IP 112.26.0.1.targus-getdata1 > 112.26.0.8.50630: Flags [.], ack 511224, win 6044, options [nop,nop,TS val 982282 ecr 759826,nop,nop,sack 1 {512652:539784},mptcp dss ack 2228466264], length 0
21:12:33.274242 IP 112.26.0.1.targus-getdata1 > 112.26.0.8.50630: Flags [.], ack 511224, win 6044, options [nop,nop,TS val 982351 ecr 759826,nop,nop,sack 1 {512652:541212},mptcp dss ack 2228466264], length 0
21:12:33.328877 IP 112.26.0.1.targus-getdata1 > 112.26.0.8.50630: Flags [.], ack 511224, win 6044, options [nop,nop,TS val 982413 ecr 759826,nop,nop,sack 1 {512652:542640},mptcp dss ack 2228466264], length 0
21:12:33.490184 IP 112.26.0.1.targus-getdata1 > 112.26.0.8.50630: Flags [.], ack 511224, win 6044, options [nop,nop,TS val 982554 ecr 759826,nop,nop,sack 2 {544068:545496}{512652:542640},mptcp dss ack 2228466264], length 0
21:12:33.559753 IP 112.26.0.8.50630 > 112.26.0.1.targus-getdata1: Flags [.], seq 549780:551208, ack 1, win 913, options [nop,nop,TS val 761858 ecr 981926,mptcp dss ack 1803767578 seq 2228644764 subseq 925382 len 1428 csum 0xa20c], length 1428
21:12:33.560052 IP 112.26.0.1.targus-getdata1 > 112.26.0.8.50630: Flags [.], ack 542640, win 6117, options [nop,nop,TS val 983314 ecr 761424,nop,nop,sack 2 {549780:551208}{544068:546924},mptcp dss ack 2228577648], length 0
21:12:33.661333 IP 112.26.0.1.targus-getdata1 > 112.26.0.8.50630: Flags [.], ack 511224, win 6044, options [nop,nop,TS val 982714 ecr 759826,nop,nop,sack 2 {544068:546924}{512652:542640},mptcp dss ack 2228466264], length 0
21:12:33.742212 IP 112.26.0.8.50630 > 112.26.0.1.targus-getdata1: Flags [.], seq 552636:554064, ack 1, win 913, options [nop,nop,TS val 762031 ecr 982090,mptcp dss ack 1803767578 seq 2228657616 subseq 928238 len 1428 csum 0x5f0e], length 1428
21:12:33.742481 IP 112.26.0.1.targus-getdata1 > 112.26.0.8.50630: Flags [.], ack 542640, win 6117, options [nop,nop,TS val 983496 ecr 761424,nop,nop,sack 2 {552636:554064}{549780:551208},mptcp dss ack 2228577648], length 0
21:12:33.816190 IP 112.26.0.1.targus-getdata1 > 112.26.0.8.50630: Flags [.], ack 542640, win 5507, options [nop,nop,TS val 982914 ecr 761424,nop,nop,sack 1 {544068:546924},mptcp dss ack 2228577648], length 0
21:12:33.894827 IP 112.26.0.8.50630 > 112.26.0.1.targus-getdata1: Flags [.], seq 554064:555492, ack 1, win 913, options [nop,nop,TS val 762240 ecr 982282,mptcp dss ack 1803767578 seq 2228666184 subseq 929666 len 1428 csum 0x45b], length 1428
21:12:33.895104 IP 112.26.0.1.targus-getdata1 > 112.26.0.8.50630: Flags [.], ack 542640, win 6117, options [nop,nop,TS val 983649 ecr 761424,nop,nop,sack 2 {552636:555492}{549780:551208},mptcp dss ack 2228577648], length 0
21:12:33.970666 IP 112.26.0.8.50630 > 112.26.0.1.targus-getdata1: Flags [.], seq 555492:556920, ack 1, win 913, options [nop,nop,TS val 762240 ecr 982282,mptcp dss ack 1803767578 seq 2228667612 subseq 931094 len 1428 csum 0xfd85], length 1428
21:12:33.970990 IP 112.26.0.1.targus-getdata1 > 112.26.0.8.50630: Flags [.], ack 542640, win 6117, options [nop,nop,TS val 983725 ecr 761424,nop,nop,sack 2 {552636:556920}{549780:551208},mptcp dss ack 2228577648], length 0
21:12:34.033150 IP 112.26.0.8.50630 > 112.26.0.1.targus-getdata1: Flags [.], seq 556920:558348, ack 1, win 913, options [nop,nop,TS val 762293 ecr 982351,mptcp dss ack 1803767578 seq 2228669040 subseq 932522 len 1428 csum 0xc01a], length 1428
21:12:34.033463 IP 112.26.0.1.targus-getdata1 > 112.26.0.8.50630: Flags [.], ack 542640, win 6117, options [nop,nop,TS val 983788 ecr 761424,nop,nop,sack 2 {552636:558348}{549780:551208},mptcp dss ack 2228577648], length 0
21:12:34.083438 IP 112.26.0.1.targus-getdata1 > 112.26.0.8.50630: Flags [.], ack 542640, win 6117, options [nop,nop,TS val 983314 ecr 761424,nop,nop,sack 2 {549780:551208}{544068:546924},mptcp dss ack 2228577648], length 0
21:12:34.133212 IP 112.26.0.8.50630 > 112.26.0.1.targus-getdata1: Flags [.], seq 558348:559776, ack 1, win 913, options [nop,nop,TS val 762323 ecr 982413,mptcp dss ack 1803767578 seq 2228670468 subseq 933950 len 1428 csum 0x8ecb], length 1428
21:12:34.133526 IP 112.26.0.1.targus-getdata1 > 112.26.0.8.50630: Flags [.], ack 542640, win 6117, options [nop,nop,TS val 983888 ecr 761424,nop,nop,sack 2 {552636:559776}{549780:551208},mptcp dss ack 2228577648], length 0
21:12:34.220307 IP 112.26.0.8.50630 > 112.26.0.1.targus-getdata1: Flags [.], seq 542640:544068, ack 1, win 913, options [nop,nop,TS val 762438 ecr 982554,mptcp dss ack 1803767578 seq 2228597640 subseq 918242 len 1428 csum 0x3824], length 1428
21:12:34.220650 IP 112.26.0.1.targus-getdata1 > 112.26.0.8.50630: Flags [.], ack 546924, win 6077, options [nop,nop,TS val 983975 ecr 762438,nop,nop,sack 2 {552636:559776}{549780:551208},mptcp dss ack 2228630484], length 0
21:12:34.255089 IP 112.26.0.1.targus-getdata1 > 112.26.0.8.50630: Flags [.], ack 542640, win 6117, options [nop,nop,TS val 983496 ecr 761424,nop,nop,sack 2 {552636:554064}{549780:551208},mptcp dss ack 2228577648], length 0
21:12:34.347286 IP 112.26.0.8.50630 > 112.26.0.1.targus-getdata1: Flags [.], seq 559776:561204, ack 1, win 913, options [nop,nop,TS val 762646 ecr 982714,mptcp dss ack 1803767578 seq 2228689032 subseq 935378 len 1428 csum 0x8ea4], length 1428
21:12:34.347612 IP 112.26.0.1.targus-getdata1 > 112.26.0.8.50630: Flags [.], ack 546924, win 6122, options [nop,nop,TS val 984102 ecr 762438,nop,nop,sack 2 {552636:561204}{549780:551208},mptcp dss ack 2228630484], length 0
21:12:34.418879 IP 112.26.0.1.targus-getdata1 > 112.26.0.8.50630: Flags [.], ack 542640, win 6117, options [nop,nop,TS val 983649 ecr 761424,nop,nop,sack 2 {552636:555492}{549780:551208},mptcp dss ack 2228577648], length 0
21:12:34.509409 IP 112.26.0.8.50630 > 112.26.0.1.targus-getdata1: Flags [.], seq 561204:562632, ack 1, win 913, options [nop,nop,TS val 762764 ecr 982914,mptcp dss ack 1803767578 seq 2228694744 subseq 936806 len 1428 csum 0x5c25], length 1428
21:12:34.509723 IP 112.26.0.1.targus-getdata1 > 112.26.0.8.50630: Flags [.], ack 546924, win 6122, options [nop,nop,TS val 984264 ecr 762438,nop,nop,sack 2 {552636:562632}{549780:551208},mptcp dss ack 2228630484], length 0
21:12:34.568471 IP 112.26.0.1.targus-getdata1 > 112.26.0.8.50630: Flags [.], ack 542640, win 6117, options [nop,nop,TS val 983725 ecr 761424,nop,nop,sack 2 {552636:556920}{549780:551208},mptcp dss ack 2228577648], length 0
21:12:34.657154 IP 112.26.0.1.targus-getdata1 > 112.26.0.8.50630: Flags [.], ack 542640, win 6117, options [nop,nop,TS val 983788 ecr 761424,nop,nop,sack 2 {552636:558348}{549780:551208},mptcp dss ack 2228577648], length 0
21:12:34.746255 IP 112.26.0.1.targus-getdata1 > 112.26.0.8.50630: Flags [.], ack 542640, win 6117, options [nop,nop,TS val 983888 ecr 761424,nop,nop,sack 2 {552636:559776}{549780:551208},mptcp dss ack 2228577648], length 0
21:12:34.828865 IP 112.26.0.1.targus-getdata1 > 112.26.0.8.50630: Flags [.], ack 546924, win 6077, options [nop,nop,TS val 983975 ecr 762438,nop,nop,sack 2 {552636:559776}{549780:551208},mptcp dss ack 2228630484], length 0
21:12:34.911910 IP 112.26.0.8.50630 > 112.26.0.1.targus-getdata1: Flags [.], seq 546924:548352, ack 1, win 913, options [nop,nop,TS val 763203 ecr 983496,mptcp dss ack 1803767578 seq 2228636196 subseq 922526 len 1428 csum 0x9de8], length 1428
21:12:34.912252 IP 112.26.0.1.targus-getdata1 > 112.26.0.8.50630: Flags [.], ack 548352, win 6122, options [nop,nop,TS val 984666 ecr 763203,nop,nop,sack 2 {552636:562632}{549780:551208},mptcp dss ack 2228637624], length 0
21:12:34.988279 IP 112.26.0.1.targus-getdata1 > 112.26.0.8.50630: Flags [.], ack 546924, win 6122, options [nop,nop,TS val 984102 ecr 762438,nop,nop,sack 2 {552636:561204}{549780:551208},mptcp dss ack 2228630484], length 0
21:12:35.066521 IP 112.26.0.8.50630 > 112.26.0.1.targus-getdata1: Flags [.], seq 548352:549780, ack 1, win 913, options [nop,nop,TS val 763367 ecr 983649,mptcp dss ack 1803767578 seq 2228637624 subseq 923954 len 1428 csum 0x2da1], length 1428
21:12:35.066879 IP 112.26.0.1.targus-getdata1 > 112.26.0.8.50630: Flags [.], ack 551208, win 6067, options [nop,nop,TS val 984821 ecr 763367,nop,nop,sack 1 {552636:562632},mptcp dss ack 2228646192], length 0
21:12:35.144871 IP 112.26.0.1.targus-getdata1 > 112.26.0.8.50630: Flags [.], ack 546924, win 6122, options [nop,nop,TS val 984264 ecr 762438,nop,nop,sack 2 {552636:562632}{549780:551208},mptcp dss ack 2228630484], length 0
21:12:35.212294 IP 112.26.0.8.50630 > 112.26.0.1.targus-getdata1: Flags [.], seq 551208:552636, ack 1, win 913, options [nop,nop,TS val 763517 ecr 983725,mptcp dss ack 1803767578 seq 2228646192 subseq 926810 len 1428 csum 0x1c90], length 1428
21:12:35.212643 IP 112.26.0.1.targus-getdata1 > 112.26.0.8.50630: Flags [.], ack 562632, win 6082, options [nop,nop,TS val 984967 ecr 763517,mptcp dss ack 2228650476], length 0
21:12:35.279477 IP 112.26.0.8.50630 > 112.26.0.1.targus-getdata1: Flags [.], seq 562632:564060, ack 1, win 913, options [nop,nop,TS val 763660 ecr 983788,mptcp dss ack 1803767578 seq 2228717592 subseq 938234 len 1428 csum 0x741b], length 1428
21:12:35.279758 IP 112.26.0.1.targus-getdata1 > 112.26.0.8.50630: Flags [.], ack 564060, win 6082, options [nop,nop,TS val 985034 ecr 763660,mptcp dss ack 2228650476], length 0
21:12:35.367206 IP 112.26.0.8.50630 > 112.26.0.1.targus-getdata1: Flags [.], seq 564060:565488, ack 1, win 913, options [nop,nop,TS val 763762 ecr 983888,mptcp dss ack 1803767578 seq 2228721876 subseq 939662 len 1428 csum 0x638f], length 1428
21:12:35.367524 IP 112.26.0.1.targus-getdata1 > 112.26.0.8.50630: Flags [.], ack 565488, win 6082, options [nop,nop,TS val 985122 ecr 763762,mptcp dss ack 2228650476], length 0
21:12:35.430471 IP 112.26.0.1.targus-getdata1 > 112.26.0.8.50630: Flags [.], ack 548352, win 6122, options [nop,nop,TS val 984666 ecr 763203,nop,nop,sack 2 {552636:562632}{549780:551208},mptcp dss ack 2228637624], length 0
21:12:35.500305 IP 112.26.0.8.50630 > 112.26.0.1.targus-getdata1: Flags [.], seq 565488:566916, ack 1, win 913, options [nop,nop,TS val 763805 ecr 983975,mptcp dss ack 1803767578 seq 2228724732 subseq 941090 len 1428 csum 0x55b2], length 1428
21:12:35.500632 IP 112.26.0.1.targus-getdata1 > 112.26.0.8.50630: Flags [.], ack 566916, win 6122, options [nop,nop,TS val 985255 ecr 763805,mptcp dss ack 2228704740], length 0
21:12:35.558621 IP 112.26.0.1.targus-getdata1 > 112.26.0.8.50630: Flags [.], ack 551208, win 6067, options [nop,nop,TS val 984821 ecr 763367,nop,nop,sack 1 {552636:562632},mptcp dss ack 2228646192], length 0
21:12:35.627266 IP 112.26.0.8.50630 > 112.26.0.1.targus-getdata1: Flags [.], seq 566916:568344, ack 1, win 913, options [nop,nop,TS val 763805 ecr 983975,mptcp dss ack 1803767578 seq 2228726160 subseq 942518 len 1428 csum 0xbfaa], length 1428
21:12:35.627546 IP 112.26.0.1.targus-getdata1 > 112.26.0.8.50630: Flags [.], ack 568344, win 6122, options [nop,nop,TS val 985381 ecr 763805,mptcp dss ack 2228704740], length 0
21:12:35.714013 IP 112.26.0.8.50630 > 112.26.0.1.targus-getdata1: Flags [.], seq 568344:569772, ack 1, win 913, options [nop,nop,TS val 763973 ecr 984102,mptcp dss ack 1803767578 seq 2228733300 subseq 943946 len 1428 csum 0x47c], length 1428
21:12:35.714348 IP 112.26.0.1.targus-getdata1 > 112.26.0.8.50630: Flags [.], ack 569772, win 6122, options [nop,nop,TS val 985468 ecr 763973,mptcp dss ack 2228704740], length 0
21:12:35.792611 IP 112.26.0.1.targus-getdata1 > 112.26.0.8.50630: Flags [.], ack 562632, win 6082, options [nop,nop,TS val 984967 ecr 763517,mptcp dss ack 2228650476], length 0
21:12:35.886212 IP 112.26.0.8.50630 > 112.26.0.1.targus-getdata1: Flags [.], seq 569772:571200, ack 1, win 913, options [nop,nop,TS val 764110 ecr 984264,mptcp dss ack 1803767578 seq 2228740440 subseq 945374 len 1428 csum 0xca07], length 1428
21:12:35.886562 IP 112.26.0.1.targus-getdata1 > 112.26.0.8.50630: Flags [.], ack 571200, win 6122, options [nop,nop,TS val 985641 ecr 764110,mptcp dss ack 2228704740], length 0
21:12:35.954126 IP 112.26.0.1.targus-getdata1 > 112.26.0.8.50630: Flags [.], ack 564060, win 6082, options [nop,nop,TS val 985034 ecr 763660,mptcp dss ack 2228650476], length 0
21:12:36.036119 IP 112.26.0.1.targus-getdata1 > 112.26.0.8.50630: Flags [.], ack 565488, win 6082, options [nop,nop,TS val 985122 ecr 763762,mptcp dss ack 2228650476], length 0
21:12:36.104806 IP 112.26.0.8.50630 > 112.26.0.1.targus-getdata1: Flags [.], seq 571200:572628, ack 1, win 913, options [nop,nop,TS val 764378 ecr 984666,mptcp dss ack 1803767578 seq 2228750436 subseq 946802 len 1428 csum 0x8bfb], length 1428
21:12:36.105142 IP 112.26.0.1.targus-getdata1 > 112.26.0.8.50630: Flags [.], ack 572628, win 6122, options [nop,nop,TS val 985859 ecr 764378,mptcp dss ack 2228704740], length 0
21:12:36.180573 IP 112.26.0.1.targus-getdata1 > 112.26.0.8.50630: Flags [.], ack 566916, win 6122, options [nop,nop,TS val 985255 ecr 763805,mptcp dss ack 2228704740], length 0
21:12:36.257072 IP 112.26.0.8.50630 > 112.26.0.1.targus-getdata1: Flags [.], seq 572628:574056, ack 1, win 913, options [nop,nop,TS val 764507 ecr 984821,mptcp dss ack 1803767578 seq 2228757576 subseq 948230 len 1428 csum 0xa2bb], length 1428
21:12:36.257397 IP 112.26.0.1.targus-getdata1 > 112.26.0.8.50630: Flags [.], ack 574056, win 6122, options [nop,nop,TS val 986011 ecr 764507,mptcp dss ack 2228704740], length 0
21:12:36.348831 IP 112.26.0.1.targus-getdata1 > 112.26.0.8.50630: Flags [.], ack 568344, win 6122, options [nop,nop,TS val 985381 ecr 763805,mptcp dss ack 2228704740], length 0
21:12:36.416569 IP 112.26.0.1.targus-getdata1 > 112.26.0.8.50630: Flags [.], ack 569772, win 6122, options [nop,nop,TS val 985468 ecr 763973,mptcp dss ack 2228704740], length 0
21:12:36.473970 IP 112.26.0.8.50630 > 112.26.0.1.targus-getdata1: Flags [.], seq 574056:575484, ack 1, win 913, options [nop,nop,TS val 764741 ecr 984967,mptcp dss ack 1803767578 seq 2228766144 subseq 949658 len 1428 csum 0x46f5], length 1428
21:12:36.474302 IP 112.26.0.1.targus-getdata1 > 112.26.0.8.50630: Flags [.], ack 575484, win 6122, options [nop,nop,TS val 986228 ecr 764741,mptcp dss ack 2228760432], length 0
21:12:36.582303 IP 112.26.0.1.targus-getdata1 > 112.26.0.8.50630: Flags [.], ack 571200, win 6122, options [nop,nop,TS val 985641 ecr 764110,mptcp dss ack 2228704740], length 0
21:12:36.658187 IP 112.26.0.8.50630 > 112.26.0.1.targus-getdata1: Flags [.], seq 575484:576912, ack 1, win 913, options [nop,nop,TS val 764903 ecr 985034,mptcp dss ack 1803767578 seq 2228771856 subseq 951086 len 1428 csum 0x9c35], length 1428
21:12:36.658478 IP 112.26.0.1.targus-getdata1 > 112.26.0.8.50630: Flags [.], ack 576912, win 6122, options [nop,nop,TS val 986412 ecr 764903,mptcp dss ack 2228769000], length 0
21:12:36.730283 IP 112.26.0.8.50630 > 112.26.0.1.targus-getdata1: Flags [.], seq 576912:578340, ack 1, win 913, options [nop,nop,TS val 764984 ecr 985122,mptcp dss ack 1803767578 seq 2228776140 subseq 952514 len 1428 csum 0x5ce2], length 1428
21:12:36.730566 IP 112.26.0.1.targus-getdata1 > 112.26.0.8.50630: Flags [.], ack 578340, win 6122, options [nop,nop,TS val 986484 ecr 764984,mptcp dss ack 2228769000], length 0
21:12:36.808764 IP 112.26.0.1.targus-getdata1 > 112.26.0.8.50630: Flags [.], ack 572628, win 6122, options [nop,nop,TS val 985859 ecr 764378,mptcp dss ack 2228704740], length 0
21:12:36.869240 IP 112.26.0.8.50630 > 112.26.0.1.targus-getdata1: Flags [.], seq 578340:579768, ack 1, win 913, options [nop,nop,TS val 765131 ecr 985255,mptcp dss ack 1803767578 seq 2228784708 subseq 953942 len 1428 csum 0x1c3f], length 1428
21:12:36.869575 IP 112.26.0.1.targus-getdata1 > 112.26.0.8.50630: Flags [.], ack 579768, win 6122, options [nop,nop,TS val 986623 ecr 765131,mptcp dss ack 2228780424], length 0
21:12:36.943317 IP 112.26.0.1.targus-getdata1 > 112.26.0.8.50630: Flags [.], ack 574056, win 6122, options [nop,nop,TS val 986011 ecr 764507,mptcp dss ack 2228704740], length 0
21:12:37.032634 IP 112.26.0.8.50630 > 112.26.0.1.targus-getdata1: Flags [.], seq 579768:581196, ack 1, win 913, options [nop,nop,TS val 765131 ecr 985255,mptcp dss ack 1803767578 seq 2228786136 subseq 955370 len 1428 csum 0x9cb7], length 1428
21:12:37.073958 IP 112.26.0.1.targus-getdata1 > 112.26.0.8.50630: Flags [.], ack 581196, win 6122, options [nop,nop,TS val 986828 ecr 765131,mptcp dss ack 2228788992], length 0
21:12:37.075268 IP 112.26.0.8.50630 > 112.26.0.1.targus-getdata1: Flags [.], seq 581196:582624, ack 1, win 913, options [nop,nop,TS val 765298 ecr 985381,mptcp dss ack 1803767578 seq 2228794704 subseq 956798 len 1428 csum 0xc4b0], length 1428
21:12:37.139936 IP 112.26.0.1.targus-getdata1 > 112.26.0.8.50630: Flags [.], ack 575484, win 6122, options [nop,nop,TS val 986228 ecr 764741,mptcp dss ack 2228760432], length 0
21:12:37.157911 IP 112.26.0.1.targus-getdata1 > 112.26.0.8.50630: Flags [.], ack 582624, win 6122, options [nop,nop,TS val 986912 ecr 765298,mptcp dss ack 2228793276], length 0
21:12:37.218056 IP 112.26.0.8.50630 > 112.26.0.1.targus-getdata1: Flags [.], seq 582624:584052, ack 1, win 913, options [nop,nop,TS val 765369 ecr 985468,mptcp dss ack 1803767578 seq 2228797560 subseq 958226 len 1428 csum 0xfd13], length 1428
21:12:37.258731 IP 112.26.0.8.50630 > 112.26.0.1.targus-getdata1: Flags [.], seq 584052:585480, ack 1, win 913, options [nop,nop,TS val 765530 ecr 985641,mptcp dss ack 1803767578 seq 2228804700 subseq 959654 len 1428 csum 0xff98], length 1428
21:12:37.259065 IP 112.26.0.1.targus-getdata1 > 112.26.0.8.50630: Flags [.], ack 585480, win 6122, options [nop,nop,TS val 987013 ecr 765369,mptcp dss ack 2228800416], length 0
