08:46:52.418923 IP 112.26.3.8.40169 > 112.26.3.1.targus-getdata1: Flags [S], seq 1727542878, win 65535, options [mss 1460,sackOK,TS val 3818748 ecr 0,nop,wscale 6,mptcp join id 6 token 0x51351df7 nonce 0xd63b314c], length 0
08:46:52.419355 IP 112.26.3.1.targus-getdata1 > 112.26.3.8.40169: Flags [S.], seq 1570756748, ack 1727542879, win 28560, options [mss 1460,sackOK,TS val 4034770 ecr 3818748,nop,wscale 7,mptcp join id 5 hmac 0x612bb3ed20737396 nonce 0xc5b3d3af], length 0
08:46:52.517128 IP 112.26.3.1.targus-getdata1 > 112.26.3.8.40169: Flags [S.], seq 1570756748, ack 1727542879, win 28560, options [mss 1460,sackOK,TS val 4034770 ecr 3818748,nop,wscale 7,mptcp join id 5 hmac 0x612bb3ed20737396 nonce 0xc5b3d3af], length 0
08:46:52.614181 IP 112.26.3.8.40169 > 112.26.3.1.targus-getdata1: Flags [.], ack 1, win 4107, options [nop,nop,TS val 3818870 ecr 4034770,mptcp join hmac 0xfb0ef1768aba57d7281bd1622b04859eac7edbb2], length 0
08:46:52.614571 IP 112.26.3.1.targus-getdata1 > 112.26.3.8.40169: Flags [.], ack 1, win 893, options [nop,nop,TS val 4034964 ecr 3818870,mptcp dss ack 4209528936], length 0
08:46:52.624310 IP 112.26.3.1.targus-getdata1 > 112.26.3.8.40169: Flags [.], ack 1, win 893, options [nop,nop,TS val 4034964 ecr 3818870,mptcp dss ack 4209528936], length 0
08:46:53.227113 IP 112.26.3.8.36647 > 112.26.3.1.targus-getdata1: Flags [S], seq 2690506009, win 65535, options [mss 1460,sackOK,TS val 3819566 ecr 0,nop,wscale 6,mptcp join id 6 token 0x2d1da5fa nonce 0x6a3f42a], length 0
08:47:23.166820 IP 112.26.3.8.36647 > 112.26.3.1.targus-getdata1: Flags [.], seq 2690813030:2690814458, ack 2347188833, win 4107, options [nop,nop,TS val 3848486 ecr 4064458,mptcp dss ack 2613390630 seq 2860767622 subseq 307021 len 1428 csum 0x882a], length 1428
08:47:23.282689 IP 112.26.3.8.36647 > 112.26.3.1.targus-getdata1: Flags [.], seq 2856:4284, ack 1, win 4107, options [nop,nop,TS val 3848675 ecr 4064659,mptcp dss ack 2613390630 seq 2860776190 subseq 309877 len 1428 csum 0x6c0a], length 1428
08:47:23.282913 IP 112.26.3.1.targus-getdata1 > 112.26.3.8.36647: Flags [.], ack 1428, win 7042, options [nop,nop,TS val 4065633 ecr 3848486,nop,nop,sack 1 {2856:4284},mptcp dss ack 2860694794], length 0
08:47:23.287287 IP 112.26.3.1.targus-getdata1 > 112.26.3.8.36647: Flags [.], ack 1428, win 7042, options [nop,nop,TS val 4065633 ecr 3848486,nop,nop,sack 1 {2856:4284},mptcp dss ack 2860694794], length 0
08:47:23.424981 IP 112.26.3.8.36647 > 112.26.3.1.targus-getdata1: Flags [.], seq 4284:5712, ack 1, win 4107, options [nop,nop,TS val 3848675 ecr 4064659,mptcp dss ack 2613390630 seq 2860777618 subseq 311305 len 1428 csum 0x2074], length 1428
08:47:23.425317 IP 112.26.3.1.targus-getdata1 > 112.26.3.8.36647: Flags [.], ack 1428, win 7282, options [nop,nop,TS val 4065775 ecr 3848486,nop,nop,sack 1 {2856:5712},mptcp dss ack 2860774762], length 0
08:47:23.430458 IP 112.26.3.1.targus-getdata1 > 112.26.3.8.36647: Flags [.], ack 1428, win 7282, options [nop,nop,TS val 4065775 ecr 3848486,nop,nop,sack 1 {2856:5712},mptcp dss ack 2860774762], length 0
08:47:23.588672 IP 112.26.3.8.36647 > 112.26.3.1.targus-getdata1: Flags [.], seq 5712:7140, ack 1, win 4107, options [nop,nop,TS val 3848953 ecr 4064942,mptcp dss ack 2613390630 seq 2860789042 subseq 312733 len 1428 csum 0xb987], length 1428
08:47:23.589045 IP 112.26.3.1.targus-getdata1 > 112.26.3.8.36647: Flags [.], ack 1428, win 7282, options [nop,nop,TS val 4065939 ecr 3848486,nop,nop,sack 1 {2856:7140},mptcp dss ack 2860774762], length 0
08:47:23.592141 IP 112.26.3.1.targus-getdata1 > 112.26.3.8.36647: Flags [.], ack 1428, win 7282, options [nop,nop,TS val 4065939 ecr 3848486,nop,nop,sack 1 {2856:7140},mptcp dss ack 2860774762], length 0
08:47:23.716095 IP 112.26.3.8.36647 > 112.26.3.1.targus-getdata1: Flags [.], seq 7140:8568, ack 1, win 4107, options [nop,nop,TS val 3848953 ecr 4064942,mptcp dss ack 2613390630 seq 2860790470 subseq 314161 len 1428 csum 0x4668], length 1428
08:47:23.716399 IP 112.26.3.1.targus-getdata1 > 112.26.3.8.36647: Flags [.], ack 1428, win 7282, options [nop,nop,TS val 4066067 ecr 3848486,nop,nop,sack 1 {2856:8568},mptcp dss ack 2860774762], length 0
08:47:23.725210 IP 112.26.3.1.targus-getdata1 > 112.26.3.8.36647: Flags [.], ack 1428, win 7282, options [nop,nop,TS val 4066067 ecr 3848486,nop,nop,sack 1 {2856:8568},mptcp dss ack 2860774762], length 0
08:47:23.865791 IP 112.26.3.8.36647 > 112.26.3.1.targus-getdata1: Flags [.], seq 8568:9996, ack 1, win 4107, options [nop,nop,TS val 3849147 ecr 4065129,mptcp dss ack 2613390630 seq 2860804750 subseq 315589 len 1428 csum 0x76db], length 1428
08:47:23.866160 IP 112.26.3.1.targus-getdata1 > 112.26.3.8.36647: Flags [.], ack 1428, win 7282, options [nop,nop,TS val 4066216 ecr 3848486,nop,nop,sack 1 {2856:9996},mptcp dss ack 2860774762], length 0
08:47:23.871161 IP 112.26.3.1.targus-getdata1 > 112.26.3.8.36647: Flags [.], ack 1428, win 7282, options [nop,nop,TS val 4066216 ecr 3848486,nop,nop,sack 1 {2856:9996},mptcp dss ack 2860774762], length 0
08:47:23.963957 IP 112.26.3.8.36647 > 112.26.3.1.targus-getdata1: Flags [.], seq 9996:11424, ack 1, win 4107, options [nop,nop,TS val 3849147 ecr 4065129,mptcp dss ack 2613390630 seq 2860806178 subseq 317017 len 1428 csum 0x7466], length 1428
08:47:23.964322 IP 112.26.3.1.targus-getdata1 > 112.26.3.8.36647: Flags [.], ack 1428, win 7282, options [nop,nop,TS val 4066314 ecr 3848486,nop,nop,sack 1 {2856:11424},mptcp dss ack 2860774762], length 0
08:47:24.058664 IP 112.26.3.1.targus-getdata1 > 112.26.3.8.36647: Flags [.], ack 1428, win 7282, options [nop,nop,TS val 4066314 ecr 3848486,nop,nop,sack 1 {2856:11424},mptcp dss ack 2860774762], length 0
08:47:24.109432 IP 112.26.3.8.36647 > 112.26.3.1.targus-getdata1: Flags [.], seq 11424:12852, ack 1, win 4107, options [nop,nop,TS val 3849147 ecr 4065129,mptcp dss ack 2613390630 seq 2860807606 subseq 318445 len 1428 csum 0x1a96], length 1428
08:47:24.109771 IP 112.26.3.1.targus-getdata1 > 112.26.3.8.36647: Flags [.], ack 1428, win 7282, options [nop,nop,TS val 4066460 ecr 3848486,nop,nop,sack 1 {2856:12852},mptcp dss ack 2860774762], length 0
08:47:24.134984 IP 112.26.3.1.targus-getdata1 > 112.26.3.8.36647: Flags [.], ack 1428, win 7282, options [nop,nop,TS val 4066460 ecr 3848486,nop,nop,sack 1 {2856:12852},mptcp dss ack 2860774762], length 0
08:47:24.205858 IP 112.26.3.8.36647 > 112.26.3.1.targus-getdata1: Flags [.], seq 12852:14280, ack 1, win 4107, options [nop,nop,TS val 3849406 ecr 4065399,mptcp dss ack 2613390630 seq 2860821886 subseq 319873 len 1428 csum 0x2282], length 1428
08:47:24.206204 IP 112.26.3.1.targus-getdata1 > 112.26.3.8.36647: Flags [.], ack 1428, win 7282, options [nop,nop,TS val 4066556 ecr 3848486,nop,nop,sack 1 {2856:14280},mptcp dss ack 2860774762], length 0
08:47:24.281204 IP 112.26.3.1.targus-getdata1 > 112.26.3.8.36647: Flags [.], ack 1428, win 7282, options [nop,nop,TS val 4066556 ecr 3848486,nop,nop,sack 1 {2856:14280},mptcp dss ack 2860774762], length 0
08:47:24.339934 IP 112.26.3.8.36647 > 112.26.3.1.targus-getdata1: Flags [.], seq 15708:17136, ack 1, win 4107, options [nop,nop,TS val 3849655 ecr 4065633,mptcp dss ack 2613390630 seq 2860833310 subseq 322729 len 1428 csum 0x717e], length 1428
08:47:24.340220 IP 112.26.3.1.targus-getdata1 > 112.26.3.8.36647: Flags [.], ack 1428, win 7282, options [nop,nop,TS val 4066690 ecr 3848486,nop,nop,sack 2 {15708:17136}{2856:14280},mptcp dss ack 2860774762], length 0
08:47:24.348303 IP 112.26.3.1.targus-getdata1 > 112.26.3.8.36647: Flags [.], ack 1428, win 7282, options [nop,nop,TS val 4066690 ecr 3848486,nop,nop,sack 2 {15708:17136}{2856:14280},mptcp dss ack 2860774762], length 0
08:47:24.485227 IP 112.26.3.8.36647 > 112.26.3.1.targus-getdata1: Flags [.], seq 17136:18564, ack 1, win 4107, options [nop,nop,TS val 3849655 ecr 4065633,mptcp dss ack 2613390630 seq 2860834738 subseq 324157 len 1428 csum 0x211f], length 1428
08:47:24.485540 IP 112.26.3.1.targus-getdata1 > 112.26.3.8.36647: Flags [.], ack 1428, win 7282, options [nop,nop,TS val 4066836 ecr 3848486,nop,nop,sack 2 {15708:18564}{2856:14280},mptcp dss ack 2860774762], length 0
08:47:24.493655 IP 112.26.3.1.targus-getdata1 > 112.26.3.8.36647: Flags [.], ack 1428, win 7282, options [nop,nop,TS val 4066836 ecr 3848486,nop,nop,sack 2 {15708:18564}{2856:14280},mptcp dss ack 2860774762], length 0
08:47:24.624372 IP 112.26.3.8.36647 > 112.26.3.1.targus-getdata1: Flags [.], seq 18564:19992, ack 1, win 4107, options [nop,nop,TS val 3849655 ecr 4065633,mptcp dss ack 2613390630 seq 2860836166 subseq 325585 len 1428 csum 0xdd81], length 1428
08:47:24.624677 IP 112.26.3.1.targus-getdata1 > 112.26.3.8.36647: Flags [.], ack 1428, win 7282, options [nop,nop,TS val 4066975 ecr 3848486,nop,nop,sack 2 {15708:19992}{2856:14280},mptcp dss ack 2860774762], length 0
08:47:24.629685 IP 112.26.3.1.targus-getdata1 > 112.26.3.8.36647: Flags [.], ack 1428, win 7282, options [nop,nop,TS val 4066975 ecr 3848486,nop,nop,sack 2 {15708:19992}{2856:14280},mptcp dss ack 2860774762], length 0
08:47:24.723885 IP 112.26.3.8.36647 > 112.26.3.1.targus-getdata1: Flags [.], seq 19992:21420, ack 1, win 4107, options [nop,nop,TS val 3849655 ecr 4065633,mptcp dss ack 2613390630 seq 2860837594 subseq 327013 len 1428 csum 0x1584], length 1428
08:47:24.724191 IP 112.26.3.1.targus-getdata1 > 112.26.3.8.36647: Flags [.], ack 1428, win 7282, options [nop,nop,TS val 4067074 ecr 3848486,nop,nop,sack 2 {15708:21420}{2856:14280},mptcp dss ack 2860774762], length 0
08:47:24.744494 IP 112.26.3.1.targus-getdata1 > 112.26.3.8.36647: Flags [.], ack 1428, win 7282, options [nop,nop,TS val 4067074 ecr 3848486,nop,nop,sack 2 {15708:21420}{2856:14280},mptcp dss ack 2860774762], length 0
08:47:24.853913 IP 112.26.3.8.36647 > 112.26.3.1.targus-getdata1: Flags [.], seq 21420:22848, ack 1, win 4107, options [nop,nop,TS val 3849859 ecr 4065775,mptcp dss ack 2613390630 seq 2860844734 subseq 328441 len 1428 csum 0x8cc2], length 1428
08:47:24.854231 IP 112.26.3.1.targus-getdata1 > 112.26.3.8.36647: Flags [.], ack 1428, win 7282, options [nop,nop,TS val 4067204 ecr 3848486,nop,nop,sack 2 {15708:22848}{2856:14280},mptcp dss ack 2860774762], length 0
08:47:24.861474 IP 112.26.3.1.targus-getdata1 > 112.26.3.8.36647: Flags [.], ack 1428, win 7282, options [nop,nop,TS val 4067204 ecr 3848486,nop,nop,sack 2 {15708:22848}{2856:14280},mptcp dss ack 2860774762], length 0
08:47:24.954542 IP 112.26.3.8.36647 > 112.26.3.1.targus-getdata1: Flags [.], seq 1428:2856, ack 1, win 4107, options [nop,nop,TS val 3849965 ecr 4065939,mptcp dss ack 2613390630 seq 2860774762 subseq 308449 len 1428 csum 0x217c], length 1428
08:47:24.954912 IP 112.26.3.1.targus-getdata1 > 112.26.3.8.36647: Flags [.], ack 14280, win 7036, options [nop,nop,TS val 4067305 ecr 3849965,nop,nop,sack 1 {15708:22848},mptcp dss ack 2860823314], length 0
08:47:24.960201 IP 112.26.3.1.targus-getdata1 > 112.26.3.8.36647: Flags [.], ack 14280, win 7036, options [nop,nop,TS val 4067305 ecr 3849965,nop,nop,sack 1 {15708:22848},mptcp dss ack 2860823314], length 0
08:47:25.078534 IP 112.26.3.8.36647 > 112.26.3.1.targus-getdata1: Flags [.], seq 22848:24276, ack 1, win 4107, options [nop,nop,TS val 3850183 ecr 4066067,mptcp dss ack 2613390630 seq 2860856158 subseq 329869 len 1428 csum 0x4116], length 1428
08:47:25.078901 IP 112.26.3.1.targus-getdata1 > 112.26.3.8.36647: Flags [.], ack 14280, win 7282, options [nop,nop,TS val 4067429 ecr 3849965,nop,nop,sack 1 {15708:24276},mptcp dss ack 2860823314], length 0
08:47:25.090783 IP 112.26.3.1.targus-getdata1 > 112.26.3.8.36647: Flags [.], ack 14280, win 7282, options [nop,nop,TS val 4067429 ecr 3849965,nop,nop,sack 1 {15708:24276},mptcp dss ack 2860823314], length 0
08:47:25.213745 IP 112.26.3.8.36647 > 112.26.3.1.targus-getdata1: Flags [.], seq 24276:25704, ack 1, win 4107, options [nop,nop,TS val 3850386 ecr 4066216,mptcp dss ack 2613390630 seq 2860864726 subseq 331297 len 1428 csum 0xa73a], length 1428
08:47:25.214071 IP 112.26.3.1.targus-getdata1 > 112.26.3.8.36647: Flags [.], ack 14280, win 7282, options [nop,nop,TS val 4067564 ecr 3849965,nop,nop,sack 1 {15708:25704},mptcp dss ack 2860823314], length 0
08:47:25.217713 IP 112.26.3.1.targus-getdata1 > 112.26.3.8.36647: Flags [.], ack 14280, win 7282, options [nop,nop,TS val 4067564 ecr 3849965,nop,nop,sack 1 {15708:25704},mptcp dss ack 2860823314], length 0
08:47:25.367326 IP 112.26.3.8.36647 > 112.26.3.1.targus-getdata1: Flags [.], seq 25704:27132, ack 1, win 4107, options [nop,nop,TS val 3850562 ecr 4066460,mptcp dss ack 2613390630 seq 2860870438 subseq 332725 len 1428 csum 0x75a5], length 1428
08:47:25.367724 IP 112.26.3.1.targus-getdata1 > 112.26.3.8.36647: Flags [.], ack 14280, win 7282, options [nop,nop,TS val 4067718 ecr 3849965,nop,nop,sack 1 {15708:27132},mptcp dss ack 2860823314], length 0
08:47:25.372240 IP 112.26.3.1.targus-getdata1 > 112.26.3.8.36647: Flags [.], ack 14280, win 7282, options [nop,nop,TS val 4067718 ecr 3849965,nop,nop,sack 1 {15708:27132},mptcp dss ack 2860823314], length 0
08:47:25.436309 IP 112.26.3.8.36647 > 112.26.3.1.targus-getdata1: Flags [.], seq 27132:28560, ack 1, win 4107, options [nop,nop,TS val 3850774 ecr 4066556,mptcp dss ack 2613390630 seq 2860881862 subseq 334153 len 1428 csum 0x5c4d], length 1428
08:47:25.436660 IP 112.26.3.1.targus-getdata1 > 112.26.3.8.36647: Flags [.], ack 14280, win 7282, options [nop,nop,TS val 4067787 ecr 3849965,nop,nop,sack 1 {15708:28560},mptcp dss ack 2860823314], length 0
08:47:25.495220 IP 112.26.3.1.targus-getdata1 > 112.26.3.8.36647: Flags [.], ack 14280, win 7282, options [nop,nop,TS val 4067787 ecr 3849965,nop,nop,sack 1 {15708:28560},mptcp dss ack 2860823314], length 0
08:47:25.564778 IP 112.26.3.8.36647 > 112.26.3.1.targus-getdata1: Flags [.], seq 14280:15708, ack 1, win 4107, options [nop,nop,TS val 3851027 ecr 4066836,mptcp dss ack 2613390630 seq 2860823314 subseq 321301 len 1428 csum 0x4587], length 1428
08:47:25.565149 IP 112.26.3.1.targus-getdata1 > 112.26.3.8.36647: Flags [.], ack 28560, win 7116, options [nop,nop,TS val 4067915 ecr 3851027,mptcp dss ack 2860877578], length 0
08:47:25.608494 IP 112.26.3.1.targus-getdata1 > 112.26.3.8.36647: Flags [.], ack 28560, win 7116, options [nop,nop,TS val 4067915 ecr 3851027,mptcp dss ack 2860877578], length 0
08:47:25.711480 IP 112.26.3.8.36647 > 112.26.3.1.targus-getdata1: Flags [.], seq 28560:29988, ack 1, win 4107, options [nop,nop,TS val 3851167 ecr 4066975,mptcp dss ack 2613390630 seq 2860896142 subseq 335581 len 1428 csum 0xd88], length 1428
08:47:25.711881 IP 112.26.3.1.targus-getdata1 > 112.26.3.8.36647: Flags [.], ack 29988, win 7282, options [nop,nop,TS val 4068062 ecr 3851167,mptcp dss ack 2860877578], length 0
08:47:25.761881 IP 112.26.3.1.targus-getdata1 > 112.26.3.8.36647: Flags [.], ack 29988, win 7282, options [nop,nop,TS val 4068062 ecr 3851167,mptcp dss ack 2860877578], length 0
08:47:25.834097 IP 112.26.3.8.36647 > 112.26.3.1.targus-getdata1: Flags [.], seq 29988:31416, ack 1, win 4107, options [nop,nop,TS val 3851355 ecr 4067074,mptcp dss ack 2613390630 seq 2860907566 subseq 337009 len 1428 csum 0xd0a1], length 1428
08:47:25.834466 IP 112.26.3.1.targus-getdata1 > 112.26.3.8.36647: Flags [.], ack 31416, win 7282, options [nop,nop,TS val 4068184 ecr 3851355,mptcp dss ack 2860877578], length 0
08:47:25.863611 IP 112.26.3.1.targus-getdata1 > 112.26.3.8.36647: Flags [.], ack 31416, win 7282, options [nop,nop,TS val 4068184 ecr 3851355,mptcp dss ack 2860877578], length 0
08:47:25.952835 IP 112.26.3.8.36647 > 112.26.3.1.targus-getdata1: Flags [.], seq 31416:32844, ack 1, win 4107, options [nop,nop,TS val 3851480 ecr 4067204,mptcp dss ack 2613390630 seq 2860913278 subseq 338437 len 1428 csum 0x3102], length 1428
08:47:25.953138 IP 112.26.3.1.targus-getdata1 > 112.26.3.8.36647: Flags [.], ack 32844, win 7282, options [nop,nop,TS val 4068303 ecr 3851480,mptcp dss ack 2860877578], length 0
08:47:25.973245 IP 112.26.3.1.targus-getdata1 > 112.26.3.8.36647: Flags [.], ack 32844, win 7282, options [nop,nop,TS val 4068303 ecr 3851480,mptcp dss ack 2860877578], length 0
08:47:26.102122 IP 112.26.3.8.36647 > 112.26.3.1.targus-getdata1: Flags [.], seq 32844:34272, ack 1, win 4107, options [nop,nop,TS val 3851583 ecr 4067305,mptcp dss ack 2613390630 seq 2860924702 subseq 339865 len 1428 csum 0x4564], length 1428
08:47:26.102471 IP 112.26.3.1.targus-getdata1 > 112.26.3.8.36647: Flags [.], ack 34272, win 7282, options [nop,nop,TS val 4068452 ecr 3851583,mptcp dss ack 2860877578], length 0
08:47:26.111009 IP 112.26.3.1.targus-getdata1 > 112.26.3.8.36647: Flags [.], ack 34272, win 7282, options [nop,nop,TS val 4068452 ecr 3851583,mptcp dss ack 2860877578], length 0
08:47:26.192949 IP 112.26.3.8.36647 > 112.26.3.1.targus-getdata1: Flags [.], seq 34272:35700, ack 1, win 4107, options [nop,nop,TS val 3851697 ecr 4067429,mptcp dss ack 2613390630 seq 2860933270 subseq 341293 len 1428 csum 0x2ee8], length 1428
08:47:26.193302 IP 112.26.3.1.targus-getdata1 > 112.26.3.8.36647: Flags [.], ack 35700, win 7282, options [nop,nop,TS val 4068543 ecr 3851697,mptcp dss ack 2860877578], length 0
08:47:26.215984 IP 112.26.3.1.targus-getdata1 > 112.26.3.8.36647: Flags [.], ack 35700, win 7282, options [nop,nop,TS val 4068543 ecr 3851697,mptcp dss ack 2860877578], length 0
08:47:26.262627 IP 112.26.3.8.36647 > 112.26.3.1.targus-getdata1: Flags [.], seq 35700:37128, ack 1, win 4107, options [nop,nop,TS val 3851876 ecr 4067564,mptcp dss ack 2613390630 seq 2860940410 subseq 342721 len 1428 csum 0x7da2], length 1428
08:47:26.262859 IP 112.26.3.1.targus-getdata1 > 112.26.3.8.36647: Flags [.], ack 37128, win 7282, options [nop,nop,TS val 4068613 ecr 3851876,mptcp dss ack 2860877578], length 0
08:47:26.328029 IP 112.26.3.1.targus-getdata1 > 112.26.3.8.36647: Flags [.], ack 37128, win 7282, options [nop,nop,TS val 4068613 ecr 3851876,mptcp dss ack 2860877578], length 0
08:47:26.438956 IP 112.26.3.8.36647 > 112.26.3.1.targus-getdata1: Flags [.], seq 37128:38556, ack 1, win 4107, options [nop,nop,TS val 3852006 ecr 4067718,mptcp dss ack 2613390630 seq 2860946122 subseq 344149 len 1428 csum 0x1083], length 1428
08:47:26.439359 IP 112.26.3.1.targus-getdata1 > 112.26.3.8.36647: Flags [.], ack 38556, win 7282, options [nop,nop,TS val 4068789 ecr 3852006,mptcp dss ack 2860877578], length 0
08:47:26.455588 IP 112.26.3.1.targus-getdata1 > 112.26.3.8.36647: Flags [.], ack 38556, win 7282, options [nop,nop,TS val 4068789 ecr 3852006,mptcp dss ack 2860877578], length 0
08:47:26.575509 IP 112.26.3.8.36647 > 112.26.3.1.targus-getdata1: Flags [.], seq 38556:39984, ack 1, win 4107, options [nop,nop,TS val 3852143 ecr 4067787,mptcp dss ack 2613390630 seq 2860950406 subseq 345577 len 1428 csum 0x88c9], length 1428
08:47:26.575888 IP 112.26.3.1.targus-getdata1 > 112.26.3.8.36647: Flags [.], ack 39984, win 7282, options [nop,nop,TS val 4068926 ecr 3852143,mptcp dss ack 2860877578], length 0
08:47:26.580359 IP 112.26.3.1.targus-getdata1 > 112.26.3.8.36647: Flags [.], ack 39984, win 7282, options [nop,nop,TS val 4068926 ecr 3852143,mptcp dss ack 2860877578], length 0
08:47:26.658464 IP 112.26.3.8.36647 > 112.26.3.1.targus-getdata1: Flags [.], seq 39984:41412, ack 1, win 4107, options [nop,nop,TS val 3852274 ecr 4067915,mptcp dss ack 2613390630 seq 2860960402 subseq 347005 len 1428 csum 0xeb72], length 1428
08:47:26.658844 IP 112.26.3.1.targus-getdata1 > 112.26.3.8.36647: Flags [.], ack 41412, win 7282, options [nop,nop,TS val 4069009 ecr 3852274,mptcp dss ack 2860877578], length 0
08:47:26.664121 IP 112.26.3.1.targus-getdata1 > 112.26.3.8.36647: Flags [.], ack 41412, win 7282, options [nop,nop,TS val 4069009 ecr 3852274,mptcp dss ack 2860877578], length 0
08:47:26.814432 IP 112.26.3.8.36647 > 112.26.3.1.targus-getdata1: Flags [.], seq 41412:42840, ack 1, win 4107, options [nop,nop,TS val 3852380 ecr 4068062,mptcp dss ack 2613390630 seq 2860964686 subseq 348433 len 1428 csum 0x5c0c], length 1428
08:47:26.814798 IP 112.26.3.1.targus-getdata1 > 112.26.3.8.36647: Flags [.], ack 42840, win 7282, options [nop,nop,TS val 4069164 ecr 3852380,mptcp dss ack 2860877578], length 0
08:47:26.818693 IP 112.26.3.1.targus-getdata1 > 112.26.3.8.36647: Flags [.], ack 42840, win 7282, options [nop,nop,TS val 4069164 ecr 3852380,mptcp dss ack 2860877578], length 0
08:47:26.939586 IP 112.26.3.8.36647 > 112.26.3.1.targus-getdata1: Flags [.], seq 42840:44268, ack 1, win 4107, options [nop,nop,TS val 3852523 ecr 4068184,mptcp dss ack 2613390630 seq 2860973254 subseq 349861 len 1428 csum 0xbd9a], length 1428
08:47:26.939972 IP 112.26.3.1.targus-getdata1 > 112.26.3.8.36647: Flags [.], ack 44268, win 7282, options [nop,nop,TS val 4069290 ecr 3852523,mptcp dss ack 2860877578], length 0
08:47:26.945185 IP 112.26.3.1.targus-getdata1 > 112.26.3.8.36647: Flags [.], ack 44268, win 7282, options [nop,nop,TS val 4069290 ecr 3852523,mptcp dss ack 2860877578], length 0
08:47:27.116056 IP 112.26.3.8.36647 > 112.26.3.1.targus-getdata1: Flags [.], seq 44268:45696, ack 1, win 4107, options [nop,nop,TS val 3852657 ecr 4068303,mptcp dss ack 2613390630 seq 2860974682 subseq 351289 len 1428 csum 0xa0f], length 1428
08:47:27.116355 IP 112.26.3.1.targus-getdata1 > 112.26.3.8.36647: Flags [.], ack 45696, win 7282, options [nop,nop,TS val 4069466 ecr 3852657,mptcp dss ack 2860877578], length 0
08:47:27.124554 IP 112.26.3.1.targus-getdata1 > 112.26.3.8.36647: Flags [.], ack 45696, win 7282, options [nop,nop,TS val 4069466 ecr 3852657,mptcp dss ack 2860877578], length 0
08:47:27.215696 IP 112.26.3.8.36647 > 112.26.3.1.targus-getdata1: Flags [.], seq 45696:47124, ack 1, win 4107, options [nop,nop,TS val 3852657 ecr 4068303,mptcp dss ack 2613390630 seq 2860976110 subseq 352717 len 1428 csum 0x9d2b], length 1428
08:47:27.216065 IP 112.26.3.1.targus-getdata1 > 112.26.3.8.36647: Flags [.], ack 47124, win 7282, options [nop,nop,TS val 4069566 ecr 3852657,mptcp dss ack 2860877578], length 0
08:47:27.220619 IP 112.26.3.1.targus-getdata1 > 112.26.3.8.36647: Flags [.], ack 47124, win 7282, options [nop,nop,TS val 4069566 ecr 3852657,mptcp dss ack 2860877578], length 0
08:47:27.344985 IP 112.26.3.8.36647 > 112.26.3.1.targus-getdata1: Flags [.], seq 47124:48552, ack 1, win 4107, options [nop,nop,TS val 3852873 ecr 4068452,mptcp dss ack 2613390630 seq 2860983250 subseq 354145 len 1428 csum 0x9a92], length 1428
08:47:27.345350 IP 112.26.3.1.targus-getdata1 > 112.26.3.8.36647: Flags [.], ack 48552, win 7282, options [nop,nop,TS val 4069695 ecr 3852873,mptcp dss ack 2860877578], length 0
08:47:27.363655 IP 112.26.3.1.targus-getdata1 > 112.26.3.8.36647: Flags [.], ack 48552, win 7282, options [nop,nop,TS val 4069695 ecr 3852873,mptcp dss ack 2860877578], length 0
08:47:27.466398 IP 112.26.3.8.36647 > 112.26.3.1.targus-getdata1: Flags [.], seq 48552:49980, ack 1, win 4107, options [nop,nop,TS val 3853058 ecr 4068543,mptcp dss ack 2613390630 seq 2860993246 subseq 355573 len 1428 csum 0x4661], length 1428
08:47:27.507738 IP 112.26.3.1.targus-getdata1 > 112.26.3.8.36647: Flags [.], ack 49980, win 7271, options [nop,nop,TS val 4069858 ecr 3853058,mptcp dss ack 2860879006], length 0
08:47:27.511588 IP 112.26.3.1.targus-getdata1 > 112.26.3.8.36647: Flags [.], ack 49980, win 7271, options [nop,nop,TS val 4069858 ecr 3853058,mptcp dss ack 2860879006], length 0
08:47:27.587794 IP 112.26.3.8.36647 > 112.26.3.1.targus-getdata1: Flags [.], seq 49980:51408, ack 1, win 4107, options [nop,nop,TS val 3853058 ecr 4068543,mptcp dss ack 2613390630 seq 2860994674 subseq 357001 len 1428 csum 0x9418], length 1428
08:47:27.673161 IP 112.26.3.1.targus-getdata1 > 112.26.3.8.36647: Flags [.], ack 51408, win 7118, options [nop,nop,TS val 4070024 ecr 3853058,mptcp dss ack 2860901854], length 0
08:47:27.677136 IP 112.26.3.1.targus-getdata1 > 112.26.3.8.36647: Flags [.], ack 51408, win 7118, options [nop,nop,TS val 4070024 ecr 3853058,mptcp dss ack 2860901854], length 0
08:47:27.719257 IP 112.26.3.8.36647 > 112.26.3.1.targus-getdata1: Flags [.], seq 51408:52836, ack 1, win 4107, options [nop,nop,TS val 3853195 ecr 4068613,mptcp dss ack 2613390630 seq 2860998958 subseq 358429 len 1428 csum 0x7ab6], length 1428
08:47:27.813902 IP 112.26.3.8.36647 > 112.26.3.1.targus-getdata1: Flags [.], seq 52836:54264, ack 1, win 4107, options [nop,nop,TS val 3853380 ecr 4068789,mptcp dss ack 2613390630 seq 2861004670 subseq 359857 len 1428 csum 0x7903], length 1428
08:47:27.814251 IP 112.26.3.1.targus-getdata1 > 112.26.3.8.36647: Flags [.], ack 54264, win 7282, options [nop,nop,TS val 4070164 ecr 3853195,mptcp dss ack 2860963258], length 0
08:47:27.818549 IP 112.26.3.1.targus-getdata1 > 112.26.3.8.36647: Flags [.], ack 54264, win 7282, options [nop,nop,TS val 4070164 ecr 3853195,mptcp dss ack 2860963258], length 0
08:47:27.993872 IP 112.26.3.8.36647 > 112.26.3.1.targus-getdata1: Flags [.], seq 54264:55692, ack 1, win 4107, options [nop,nop,TS val 3853530 ecr 4068926,mptcp dss ack 2613390630 seq 2861011810 subseq 361285 len 1428 csum 0xefbe], length 1428
08:47:28.126452 IP 112.26.3.8.36647 > 112.26.3.1.targus-getdata1: Flags [.], seq 55692:57120, ack 1, win 4107, options [nop,nop,TS val 3853678 ecr 4069009,mptcp dss ack 2613390630 seq 2861017522 subseq 362713 len 1428 csum 0x6d39], length 1428
08:47:28.126799 IP 112.26.3.1.targus-getdata1 > 112.26.3.8.36647: Flags [.], ack 57120, win 7282, options [nop,nop,TS val 4070477 ecr 3853530,mptcp dss ack 2860963258], length 0
08:47:28.132308 IP 112.26.3.1.targus-getdata1 > 112.26.3.8.36647: Flags [.], ack 57120, win 7282, options [nop,nop,TS val 4070477 ecr 3853530,mptcp dss ack 2860963258], length 0
08:47:28.269453 IP 112.26.3.8.36647 > 112.26.3.1.targus-getdata1: Flags [.], seq 57120:58548, ack 1, win 4107, options [nop,nop,TS val 3853806 ecr 4069164,mptcp dss ack 2613390630 seq 2861020378 subseq 364141 len 1428 csum 0x519c], length 1428
08:47:28.394948 IP 112.26.3.8.36647 > 112.26.3.1.targus-getdata1: Flags [.], seq 58548:59976, ack 1, win 4107, options [nop,nop,TS val 3853806 ecr 4069164,mptcp dss ack 2613390630 seq 2861021806 subseq 365569 len 1428 csum 0x65df], length 1428
08:47:28.395280 IP 112.26.3.1.targus-getdata1 > 112.26.3.8.36647: Flags [.], ack 59976, win 7282, options [nop,nop,TS val 4070745 ecr 3853806,mptcp dss ack 2860963258], length 0
08:47:28.401039 IP 112.26.3.1.targus-getdata1 > 112.26.3.8.36647: Flags [.], ack 59976, win 7282, options [nop,nop,TS val 4070745 ecr 3853806,mptcp dss ack 2860963258], length 0
08:47:28.523706 IP 112.26.3.8.36647 > 112.26.3.1.targus-getdata1: Flags [.], seq 59976:61404, ack 1, win 4107, options [nop,nop,TS val 3853959 ecr 4069290,mptcp dss ack 2613390630 seq 2861028946 subseq 366997 len 1428 csum 0x29d7], length 1428
08:47:28.624221 IP 112.26.3.8.36647 > 112.26.3.1.targus-getdata1: Flags [.], seq 61404:62832, ack 1, win 4107, options [nop,nop,TS val 3854135 ecr 4069466,mptcp dss ack 2613390630 seq 2861036086 subseq 368425 len 1428 csum 0xf228], length 1428
08:47:28.673740 IP 112.26.3.1.targus-getdata1 > 112.26.3.8.36647: Flags [.], ack 62832, win 7282, options [nop,nop,TS val 4071024 ecr 3853959,mptcp dss ack 2860963258], length 0
08:47:28.682629 IP 112.26.3.1.targus-getdata1 > 112.26.3.8.36647: Flags [.], ack 62832, win 7282, options [nop,nop,TS val 4071024 ecr 3853959,mptcp dss ack 2860963258], length 0
08:47:28.758412 IP 112.26.3.8.36647 > 112.26.3.1.targus-getdata1: Flags [.], seq 62832:64260, ack 1, win 4107, options [nop,nop,TS val 3854296 ecr 4069566,mptcp dss ack 2613390630 seq 2861043226 subseq 369853 len 1428 csum 0x9f80], length 1428
08:47:28.890777 IP 112.26.3.8.36647 > 112.26.3.1.targus-getdata1: Flags [.], seq 64260:65688, ack 1, win 4107, options [nop,nop,TS val 3854394 ecr 4069695,mptcp dss ack 2613390630 seq 2861050366 subseq 371281 len 1428 csum 0x4a21], length 1428
08:47:28.891134 IP 112.26.3.1.targus-getdata1 > 112.26.3.8.36647: Flags [.], ack 65688, win 7282, options [nop,nop,TS val 4071241 ecr 3854296,mptcp dss ack 2860963258], length 0
08:47:28.899717 IP 112.26.3.1.targus-getdata1 > 112.26.3.8.36647: Flags [.], ack 65688, win 7282, options [nop,nop,TS val 4071241 ecr 3854296,mptcp dss ack 2860963258], length 0
08:47:28.980324 IP 112.26.3.8.36647 > 112.26.3.1.targus-getdata1: Flags [.], seq 65688:67116, ack 1, win 4107, options [nop,nop,TS val 3854517 ecr 4069858,mptcp dss ack 2613390630 seq 2861058934 subseq 372709 len 1428 csum 0x4f9b], length 1428
08:47:29.129145 IP 112.26.3.1.targus-getdata1 > 112.26.3.8.36647: Flags [.], ack 67116, win 7282, options [nop,nop,TS val 4071480 ecr 3854517,mptcp dss ack 2860963258], length 0
08:47:29.133570 IP 112.26.3.8.36647 > 112.26.3.1.targus-getdata1: Flags [.], seq 67116:68544, ack 1, win 4107, options [nop,nop,TS val 3854764 ecr 4070024,mptcp dss ack 2613390630 seq 2861068930 subseq 374137 len 1428 csum 0x1c32], length 1428
08:47:29.142996 IP 112.26.3.1.targus-getdata1 > 112.26.3.8.36647: Flags [.], ack 67116, win 7282, options [nop,nop,TS val 4071480 ecr 3854517,mptcp dss ack 2860963258], length 0
08:47:29.281831 IP 112.26.3.1.targus-getdata1 > 112.26.3.8.36647: Flags [.], ack 68544, win 7282, options [nop,nop,TS val 4071632 ecr 3854764,mptcp dss ack 2860963258], length 0
08:47:29.292066 IP 112.26.3.1.targus-getdata1 > 112.26.3.8.36647: Flags [.], ack 68544, win 7282, options [nop,nop,TS val 4071632 ecr 3854764,mptcp dss ack 2860963258], length 0
08:47:29.303415 IP 112.26.3.8.36647 > 112.26.3.1.targus-getdata1: Flags [.], seq 68544:69972, ack 1, win 4107, options [nop,nop,TS val 3854843 ecr 4070164,mptcp dss ack 2613390630 seq 2861076070 subseq 375565 len 1428 csum 0x57e], length 1428
08:47:29.364869 IP 112.26.3.8.36647 > 112.26.3.1.targus-getdata1: Flags [.], seq 69972:71400, ack 1, win 4107, options [nop,nop,TS val 3854843 ecr 4070164,mptcp dss ack 2613390630 seq 2861077498 subseq 376993 len 1428 csum 0xdfe9], length 1428
08:47:29.432654 IP 112.26.3.8.36647 > 112.26.3.1.targus-getdata1: Flags [.], seq 71400:72828, ack 1, win 4107, options [nop,nop,TS val 3854902 ecr 4070477,mptcp dss ack 2613390630 seq 2861078926 subseq 378421 len 1428 csum 0x34d7], length 1428
08:47:29.433025 IP 112.26.3.1.targus-getdata1 > 112.26.3.8.36647: Flags [.], ack 72828, win 7282, options [nop,nop,TS val 4071783 ecr 3854843,mptcp dss ack 2860963258], length 0
08:47:29.448584 IP 112.26.3.1.targus-getdata1 > 112.26.3.8.36647: Flags [.], ack 72828, win 7282, options [nop,nop,TS val 4071783 ecr 3854843,mptcp dss ack 2860963258], length 0
08:47:29.565881 IP 112.26.3.8.36647 > 112.26.3.1.targus-getdata1: Flags [.], seq 72828:74256, ack 1, win 4107, options [nop,nop,TS val 3854902 ecr 4070477,mptcp dss ack 2613390630 seq 2861080354 subseq 379849 len 1428 csum 0x6ca1], length 1428
08:47:29.690032 IP 112.26.3.8.36647 > 112.26.3.1.targus-getdata1: Flags [.], seq 74256:75684, ack 1, win 4107, options [nop,nop,TS val 3855070 ecr 4070745,mptcp dss ack 2613390630 seq 2861090350 subseq 381277 len 1428 csum 0x2c2b], length 1428
08:47:29.690375 IP 112.26.3.1.targus-getdata1 > 112.26.3.8.36647: Flags [.], ack 75684, win 7282, options [nop,nop,TS val 4072041 ecr 3854902,mptcp dss ack 2860963258], length 0
08:47:29.695575 IP 112.26.3.1.targus-getdata1 > 112.26.3.8.36647: Flags [.], ack 75684, win 7282, options [nop,nop,TS val 4072041 ecr 3854902,mptcp dss ack 2860963258], length 0
08:47:29.827545 IP 112.26.3.8.36647 > 112.26.3.1.targus-getdata1: Flags [.], seq 75684:77112, ack 1, win 4107, options [nop,nop,TS val 3855070 ecr 4070745,mptcp dss ack 2613390630 seq 2861091778 subseq 382705 len 1428 csum 0xa9b2], length 1428
08:47:29.938364 IP 112.26.3.8.36647 > 112.26.3.1.targus-getdata1: Flags [.], seq 77112:78540, ack 1, win 4107, options [nop,nop,TS val 3855070 ecr 4070745,mptcp dss ack 2613390630 seq 2861093206 subseq 384133 len 1428 csum 0x3719], length 1428
08:47:29.938664 IP 112.26.3.1.targus-getdata1 > 112.26.3.8.36647: Flags [.], ack 78540, win 7282, options [nop,nop,TS val 4072289 ecr 3855070,mptcp dss ack 2860963258], length 0
08:47:29.943443 IP 112.26.3.1.targus-getdata1 > 112.26.3.8.36647: Flags [.], ack 78540, win 7282, options [nop,nop,TS val 4072289 ecr 3855070,mptcp dss ack 2860963258], length 0
08:47:30.026065 IP 112.26.3.8.36647 > 112.26.3.1.targus-getdata1: Flags [.], seq 78540:79968, ack 1, win 4107, options [nop,nop,TS val 3855195 ecr 4071024,mptcp dss ack 2613390630 seq 2861098918 subseq 385561 len 1428 csum 0x3520], length 1428
08:47:30.177619 IP 112.26.3.1.targus-getdata1 > 112.26.3.8.36647: Flags [.], ack 79968, win 7104, options [nop,nop,TS val 4072528 ecr 3855195,mptcp dss ack 2860986106], length 0
08:47:30.181510 IP 112.26.3.1.targus-getdata1 > 112.26.3.8.36647: Flags [.], ack 79968, win 7104, options [nop,nop,TS val 4072528 ecr 3855195,mptcp dss ack 2860986106], length 0
08:47:30.190284 IP 112.26.3.8.36647 > 112.26.3.1.targus-getdata1: Flags [.], seq 79968:81396, ack 1, win 4107, options [nop,nop,TS val 3855195 ecr 4071024,mptcp dss ack 2613390630 seq 2861100346 subseq 386989 len 1428 csum 0x9187], length 1428
08:47:30.337743 IP 112.26.3.1.targus-getdata1 > 112.26.3.8.36647: Flags [.], ack 81396, win 7104, options [nop,nop,TS val 4072688 ecr 3855195,mptcp dss ack 2860986106], length 0
08:47:30.338652 IP 112.26.3.8.36647 > 112.26.3.1.targus-getdata1: Flags [.], seq 81396:82824, ack 1, win 4107, options [nop,nop,TS val 3855378 ecr 4071241,mptcp dss ack 2613390630 seq 2861104630 subseq 388417 len 1428 csum 0x8754], length 1428
08:47:30.343826 IP 112.26.3.1.targus-getdata1 > 112.26.3.8.36647: Flags [.], ack 81396, win 7104, options [nop,nop,TS val 4072688 ecr 3855195,mptcp dss ack 2860986106], length 0
08:47:30.489739 IP 112.26.3.1.targus-getdata1 > 112.26.3.8.36647: Flags [.], ack 82824, win 7093, options [nop,nop,TS val 4072840 ecr 3855378,mptcp dss ack 2860987534], length 0
08:47:30.492508 IP 112.26.3.1.targus-getdata1 > 112.26.3.8.36647: Flags [.], ack 82824, win 7093, options [nop,nop,TS val 4072840 ecr 3855378,mptcp dss ack 2860987534], length 0
08:47:30.504737 IP 112.26.3.8.36647 > 112.26.3.1.targus-getdata1: Flags [.], seq 82824:84252, ack 1, win 4107, options [nop,nop,TS val 3855378 ecr 4071241,mptcp dss ack 2613390630 seq 2861106058 subseq 389845 len 1428 csum 0x25ec], length 1428
08:47:30.643237 IP 112.26.3.8.36647 > 112.26.3.1.targus-getdata1: Flags [.], seq 84252:85680, ack 1, win 4107, options [nop,nop,TS val 3855546 ecr 4071480,mptcp dss ack 2613390630 seq 2861110342 subseq 391273 len 1428 csum 0x8a01], length 1428
08:47:30.643606 IP 112.26.3.1.targus-getdata1 > 112.26.3.8.36647: Flags [.], ack 85680, win 7190, options [nop,nop,TS val 4072994 ecr 3855378,mptcp dss ack 2861030374], length 0
08:47:30.648782 IP 112.26.3.1.targus-getdata1 > 112.26.3.8.36647: Flags [.], ack 85680, win 7190, options [nop,nop,TS val 4072994 ecr 3855378,mptcp dss ack 2861030374], length 0
08:47:30.777545 IP 112.26.3.8.36647 > 112.26.3.1.targus-getdata1: Flags [.], seq 85680:87108, ack 1, win 4107, options [nop,nop,TS val 3855733 ecr 4071632,mptcp dss ack 2613390630 seq 2861120338 subseq 392701 len 1428 csum 0x2a03], length 1428
08:47:30.898340 IP 112.26.3.8.36647 > 112.26.3.1.targus-getdata1: Flags [.], seq 87108:88536, ack 1, win 4107, options [nop,nop,TS val 3855894 ecr 4071783,mptcp dss ack 2613390630 seq 2861127478 subseq 394129 len 1428 csum 0x64d], length 1428
08:47:30.898711 IP 112.26.3.1.targus-getdata1 > 112.26.3.8.36647: Flags [.], ack 88536, win 7282, options [nop,nop,TS val 4073249 ecr 3855733,mptcp dss ack 2861057506], length 0
08:47:30.908308 IP 112.26.3.1.targus-getdata1 > 112.26.3.8.36647: Flags [.], ack 88536, win 7282, options [nop,nop,TS val 4073249 ecr 3855733,mptcp dss ack 2861057506], length 0
08:47:31.019724 IP 112.26.3.8.36647 > 112.26.3.1.targus-getdata1: Flags [.], seq 88536:89964, ack 1, win 4107, options [nop,nop,TS val 3855894 ecr 4071783,mptcp dss ack 2613390630 seq 2861128906 subseq 395557 len 1428 csum 0x51da], length 1428
08:47:31.117237 IP 112.26.3.8.36647 > 112.26.3.1.targus-getdata1: Flags [.], seq 89964:91392, ack 1, win 4107, options [nop,nop,TS val 3855894 ecr 4071783,mptcp dss ack 2613390630 seq 2861130334 subseq 396985 len 1428 csum 0xc48e], length 1428
08:47:31.169595 IP 112.26.3.1.targus-getdata1 > 112.26.3.8.36647: Flags [.], ack 91392, win 7282, options [nop,nop,TS val 4073520 ecr 3855894,mptcp dss ack 2861057506], length 0
08:47:31.172374 IP 112.26.3.1.targus-getdata1 > 112.26.3.8.36647: Flags [.], ack 91392, win 7282, options [nop,nop,TS val 4073520 ecr 3855894,mptcp dss ack 2861057506], length 0
08:47:31.242086 IP 112.26.3.8.36647 > 112.26.3.1.targus-getdata1: Flags [.], seq 91392:92820, ack 1, win 4107, options [nop,nop,TS val 3856048 ecr 4072041,mptcp dss ack 2613390630 seq 2861134618 subseq 398413 len 1428 csum 0xa9c6], length 1428
08:47:31.341534 IP 112.26.3.8.36647 > 112.26.3.1.targus-getdata1: Flags [.], seq 92820:94248, ack 1, win 4107, options [nop,nop,TS val 3856048 ecr 4072041,mptcp dss ack 2613390630 seq 2861136046 subseq 399841 len 1428 csum 0xad62], length 1428
08:47:31.392086 IP 112.26.3.1.targus-getdata1 > 112.26.3.8.36647: Flags [.], ack 94248, win 7282, options [nop,nop,TS val 4073742 ecr 3856048,mptcp dss ack 2861071786], length 0
08:47:31.396353 IP 112.26.3.1.targus-getdata1 > 112.26.3.8.36647: Flags [.], ack 94248, win 7282, options [nop,nop,TS val 4073742 ecr 3856048,mptcp dss ack 2861071786], length 0
08:47:31.452765 IP 112.26.3.8.36647 > 112.26.3.1.targus-getdata1: Flags [.], seq 95676:97104, ack 1, win 4107, options [nop,nop,TS val 3856295 ecr 4072289,mptcp dss ack 2613390630 seq 2861147470 subseq 402697 len 1428 csum 0xefea], length 1428
08:47:31.453091 IP 112.26.3.1.targus-getdata1 > 112.26.3.8.36647: Flags [.], ack 94248, win 7282, options [nop,nop,TS val 4073803 ecr 3856048,nop,nop,sack 1 {95676:97104},mptcp dss ack 2861071786], length 0
08:47:31.512516 IP 112.26.3.1.targus-getdata1 > 112.26.3.8.36647: Flags [.], ack 94248, win 7282, options [nop,nop,TS val 4073803 ecr 3856048,nop,nop,sack 1 {95676:97104},mptcp dss ack 2861071786], length 0
08:47:31.582519 IP 112.26.3.8.36647 > 112.26.3.1.targus-getdata1: Flags [.], seq 97104:98532, ack 1, win 4107, options [nop,nop,TS val 3856295 ecr 4072289,mptcp dss ack 2613390630 seq 2861148898 subseq 404125 len 1428 csum 0xa592], length 1428
08:47:31.582888 IP 112.26.3.1.targus-getdata1 > 112.26.3.8.36647: Flags [.], ack 94248, win 7282, options [nop,nop,TS val 4073933 ecr 3856048,nop,nop,sack 1 {95676:98532},mptcp dss ack 2861071786], length 0
08:47:31.588764 IP 112.26.3.1.targus-getdata1 > 112.26.3.8.36647: Flags [.], ack 94248, win 7282, options [nop,nop,TS val 4073933 ecr 3856048,nop,nop,sack 1 {95676:98532},mptcp dss ack 2861071786], length 0
08:47:31.737865 IP 112.26.3.8.36647 > 112.26.3.1.targus-getdata1: Flags [.], seq 99960:101388, ack 1, win 4107, options [nop,nop,TS val 3856544 ecr 4072528,mptcp dss ack 2613390630 seq 2861158894 subseq 406981 len 1428 csum 0x5102], length 1428
08:47:31.738255 IP 112.26.3.1.targus-getdata1 > 112.26.3.8.36647: Flags [.], ack 94248, win 7282, options [nop,nop,TS val 4074088 ecr 3856048,nop,nop,sack 2 {99960:101388}{95676:98532},mptcp dss ack 2861071786], length 0
08:47:31.743951 IP 112.26.3.1.targus-getdata1 > 112.26.3.8.36647: Flags [.], ack 94248, win 7282, options [nop,nop,TS val 4074088 ecr 3856048,nop,nop,sack 2 {99960:101388}{95676:98532},mptcp dss ack 2861071786], length 0
08:47:31.875563 IP 112.26.3.8.36647 > 112.26.3.1.targus-getdata1: Flags [.], seq 101388:102816, ack 1, win 4107, options [nop,nop,TS val 3856712 ecr 4072688,mptcp dss ack 2613390630 seq 2861164606 subseq 408409 len 1428 csum 0xeaed], length 1428
08:47:31.875931 IP 112.26.3.1.targus-getdata1 > 112.26.3.8.36647: Flags [.], ack 94248, win 7282, options [nop,nop,TS val 4074226 ecr 3856048,nop,nop,sack 2 {99960:102816}{95676:98532},mptcp dss ack 2861071786], length 0
08:47:31.880557 IP 112.26.3.1.targus-getdata1 > 112.26.3.8.36647: Flags [.], ack 94248, win 7282, options [nop,nop,TS val 4074226 ecr 3856048,nop,nop,sack 2 {99960:102816}{95676:98532},mptcp dss ack 2861071786], length 0
