21:10:58.637169 IP 112.26.1.8.53821 > 112.26.1.1.targus-getdata1: Flags [S], seq 1598176440, win 29200, options [mss 1460,sackOK,TS val 667415 ecr 0,nop,wscale 7,mptcp join id 3 token 0x71e0988d nonce 0x5feeb534], length 0
21:10:58.637456 IP 112.26.1.1.targus-getdata1 > 112.26.1.8.53821: Flags [S.], seq 3588623224, ack 1598176441, win 28560, options [mss 1460,sackOK,TS val 888391 ecr 667415,nop,wscale 7,mptcp join id 3 hmac 0xd1170a7412643728 nonce 0x5438b120], length 0
21:10:58.816944 IP 112.26.1.1.targus-getdata1 > 112.26.1.8.53821: Flags [S.], seq 3588623224, ack 1598176441, win 28560, options [mss 1460,sackOK,TS val 888391 ecr 667415,nop,wscale 7,mptcp join id 3 hmac 0xd1170a7412643728 nonce 0x5438b120], length 0
21:10:58.907887 IP 112.26.1.8.53821 > 112.26.1.1.targus-getdata1: Flags [.], ack 1, win 913, options [nop,nop,TS val 667808 ecr 888391,mptcp join hmac 0x9aa8bc8ec478e2949a03e6ad5982b61d19a9c929], length 0
21:10:58.908257 IP 112.26.1.1.targus-getdata1 > 112.26.1.8.53821: Flags [.], ack 1, win 893, options [nop,nop,TS val 888662 ecr 667808,mptcp dss ack 394472264], length 0
21:10:58.984011 IP 112.26.1.1.targus-getdata1 > 112.26.1.8.53821: Flags [.], ack 1, win 893, options [nop,nop,TS val 888662 ecr 667808,mptcp dss ack 394472264], length 0
21:10:59.676750 IP 112.26.1.8.42339 > 112.26.1.1.targus-getdata1: Flags [S], seq 3028106711, win 29200, options [mss 1460,sackOK,TS val 668612 ecr 0,nop,wscale 7,mptcp join id 3 token 0x7b55582f nonce 0x1402f71e], length 0
21:11:34.853046 IP 112.26.1.8.42339 > 112.26.1.1.targus-getdata1: Flags [.], seq 3028477992:3028479420, ack 3806534039, win 913, options [nop,nop,TS val 702529 ecr 922904,mptcp dss ack 1803767578 seq 2225987256 subseq 371281 len 1428 csum 0x345c], length 1428
21:11:34.912287 IP 112.26.1.8.42339 > 112.26.1.1.targus-getdata1: Flags [P.], seq 1428:2856, ack 1, win 913, options [nop,nop,TS val 702913 ecr 923184,mptcp dss ack 1803767578 seq 2226007248 subseq 372709 len 1428 csum 0xb1f7], length 1428
21:11:34.983595 IP 112.26.1.8.42339 > 112.26.1.1.targus-getdata1: Flags [.], seq 2856:4284, ack 1, win 913, options [nop,nop,TS val 702913 ecr 923184,mptcp dss ack 1803767578 seq 2226008676 subseq 374137 len 1428 csum 0x3b96], length 1428
21:11:35.053994 IP 112.26.1.1.targus-getdata1 > 112.26.1.8.42339: Flags [.], ack 4284, win 6122, options [nop,nop,TS val 924808 ecr 702529,mptcp dss ack 2225804472], length 0
21:11:35.078473 IP 112.26.1.8.42339 > 112.26.1.1.targus-getdata1: Flags [.], seq 4284:5712, ack 1, win 913, options [nop,nop,TS val 702913 ecr 923184,mptcp dss ack 1803767578 seq 2226010104 subseq 375565 len 1428 csum 0x399a], length 1428
21:11:35.154728 IP 112.26.1.8.42339 > 112.26.1.1.targus-getdata1: Flags [.], seq 5712:7140, ack 1, win 913, options [nop,nop,TS val 703154 ecr 923384,mptcp dss ack 1803767578 seq 2226018672 subseq 376993 len 1428 csum 0x68dd], length 1428
21:11:35.218985 IP 112.26.1.8.42339 > 112.26.1.1.targus-getdata1: Flags [.], seq 7140:8568, ack 1, win 913, options [nop,nop,TS val 703154 ecr 923384,mptcp dss ack 1803767578 seq 2226020100 subseq 378421 len 1428 csum 0x9cb], length 1428
21:11:35.277444 IP 112.26.1.1.targus-getdata1 > 112.26.1.8.42339: Flags [.], ack 8568, win 6089, options [nop,nop,TS val 925032 ecr 702913,mptcp dss ack 2225808756], length 0
21:11:35.306390 IP 112.26.1.1.targus-getdata1 > 112.26.1.8.42339: Flags [.], ack 0, win 6122, options [nop,nop,TS val 924421 ecr 702529,mptcp dss ack 2225804472], length 0
21:11:35.385042 IP 112.26.1.8.42339 > 112.26.1.1.targus-getdata1: Flags [.], seq 9996:11424, ack 1, win 913, options [nop,nop,TS val 703380 ecr 923564,mptcp dss ack 1803767578 seq 2226031524 subseq 381277 len 1428 csum 0x9654], length 1428
21:11:35.385320 IP 112.26.1.1.targus-getdata1 > 112.26.1.8.42339: Flags [.], ack 8568, win 6089, options [nop,nop,TS val 925139 ecr 702913,nop,nop,sack 1 {9996:11424},mptcp dss ack 2225808756], length 0
21:11:35.465044 IP 112.26.1.8.42339 > 112.26.1.1.targus-getdata1: Flags [.], seq 11424:12852, ack 1, win 913, options [nop,nop,TS val 703380 ecr 923564,mptcp dss ack 1803767578 seq 2226032952 subseq 382705 len 1428 csum 0x8f7f], length 1428
21:11:35.465379 IP 112.26.1.1.targus-getdata1 > 112.26.1.8.42339: Flags [.], ack 8568, win 5900, options [nop,nop,TS val 925219 ecr 702913,nop,nop,sack 1 {9996:12852},mptcp dss ack 2225833032], length 0
21:11:35.543550 IP 112.26.1.8.42339 > 112.26.1.1.targus-getdata1: Flags [.], seq 12852:14280, ack 1, win 913, options [nop,nop,TS val 703380 ecr 923564,mptcp dss ack 1803767578 seq 2226034380 subseq 384133 len 1428 csum 0x5214], length 1428
21:11:35.543905 IP 112.26.1.1.targus-getdata1 > 112.26.1.8.42339: Flags [.], ack 8568, win 5900, options [nop,nop,TS val 925298 ecr 702913,nop,nop,sack 1 {9996:14280},mptcp dss ack 2225833032], length 0
21:11:35.625267 IP 112.26.1.8.42339 > 112.26.1.1.targus-getdata1: Flags [.], seq 14280:15708, ack 1, win 913, options [nop,nop,TS val 703696 ecr 923847,mptcp dss ack 1803767578 seq 2226044376 subseq 385561 len 1428 csum 0x9760], length 1428
21:11:35.625612 IP 112.26.1.1.targus-getdata1 > 112.26.1.8.42339: Flags [.], ack 8568, win 5870, options [nop,nop,TS val 925380 ecr 702913,nop,nop,sack 1 {9996:15708},mptcp dss ack 2225927280], length 0
21:11:35.712088 IP 112.26.1.8.42339 > 112.26.1.1.targus-getdata1: Flags [.], seq 15708:17136, ack 1, win 913, options [nop,nop,TS val 703696 ecr 923847,mptcp dss ack 1803767578 seq 2226045804 subseq 386989 len 1428 csum 0x651a], length 1428
21:11:35.712419 IP 112.26.1.1.targus-getdata1 > 112.26.1.8.42339: Flags [.], ack 8568, win 5870, options [nop,nop,TS val 925467 ecr 702913,nop,nop,sack 1 {9996:17136},mptcp dss ack 2225927280], length 0
21:11:35.791754 IP 112.26.1.8.42339 > 112.26.1.1.targus-getdata1: Flags [.], seq 17136:18564, ack 1, win 913, options [nop,nop,TS val 703696 ecr 923847,mptcp dss ack 1803767578 seq 2226047232 subseq 388417 len 1428 csum 0xbe4e], length 1428
21:11:35.792131 IP 112.26.1.1.targus-getdata1 > 112.26.1.8.42339: Flags [.], ack 8568, win 5870, options [nop,nop,TS val 925546 ecr 702913,nop,nop,sack 1 {9996:18564},mptcp dss ack 2225927280], length 0
21:11:35.846185 IP 112.26.1.1.targus-getdata1 > 112.26.1.8.42339: Flags [.], ack 8568, win 6089, options [nop,nop,TS val 925032 ecr 702913,mptcp dss ack 2225808756], length 0
21:11:35.928195 IP 112.26.1.8.42339 > 112.26.1.1.targus-getdata1: Flags [.], seq 18564:19992, ack 1, win 913, options [nop,nop,TS val 704254 ecr 924421,mptcp dss ack 1803767578 seq 2226068652 subseq 389845 len 1428 csum 0x79d7], length 1428
21:11:35.928523 IP 112.26.1.1.targus-getdata1 > 112.26.1.8.42339: Flags [.], ack 8568, win 5870, options [nop,nop,TS val 925683 ecr 702913,nop,nop,sack 1 {9996:19992},mptcp dss ack 2225927280], length 0
21:11:36.012733 IP 112.26.1.1.targus-getdata1 > 112.26.1.8.42339: Flags [.], ack 8568, win 6089, options [nop,nop,TS val 925139 ecr 702913,nop,nop,sack 1 {9996:11424},mptcp dss ack 2225808756], length 0
21:11:36.058619 IP 112.26.1.8.42339 > 112.26.1.1.targus-getdata1: Flags [.], seq 19992:21420, ack 1, win 913, options [nop,nop,TS val 704254 ecr 924421,mptcp dss ack 1803767578 seq 2226070080 subseq 391273 len 1428 csum 0xd7c3], length 1428
21:11:36.058956 IP 112.26.1.1.targus-getdata1 > 112.26.1.8.42339: Flags [.], ack 8568, win 5870, options [nop,nop,TS val 925813 ecr 702913,nop,nop,sack 1 {9996:21420},mptcp dss ack 2225927280], length 0
21:11:36.168705 IP 112.26.1.1.targus-getdata1 > 112.26.1.8.42339: Flags [.], ack 8568, win 5900, options [nop,nop,TS val 925219 ecr 702913,nop,nop,sack 1 {9996:12852},mptcp dss ack 2225833032], length 0
21:11:36.249425 IP 112.26.1.1.targus-getdata1 > 112.26.1.8.42339: Flags [.], ack 8568, win 5900, options [nop,nop,TS val 925298 ecr 702913,nop,nop,sack 1 {9996:14280},mptcp dss ack 2225833032], length 0
21:11:36.325514 IP 112.26.1.1.targus-getdata1 > 112.26.1.8.42339: Flags [.], ack 8568, win 5870, options [nop,nop,TS val 925380 ecr 702913,nop,nop,sack 1 {9996:15708},mptcp dss ack 2225927280], length 0
21:11:36.391611 IP 112.26.1.8.42339 > 112.26.1.1.targus-getdata1: Flags [.], seq 24276:25704, ack 1, win 913, options [nop,nop,TS val 704254 ecr 924421,mptcp dss ack 1803767578 seq 2226074364 subseq 395557 len 1428 csum 0xfb33], length 1428
21:11:36.391920 IP 112.26.1.1.targus-getdata1 > 112.26.1.8.42339: Flags [.], ack 8568, win 5870, options [nop,nop,TS val 926146 ecr 702913,nop,nop,sack 2 {24276:25704}{9996:21420},mptcp dss ack 2225927280], length 0
21:11:36.468458 IP 112.26.1.1.targus-getdata1 > 112.26.1.8.42339: Flags [.], ack 8568, win 5870, options [nop,nop,TS val 925546 ecr 702913,nop,nop,sack 1 {9996:18564},mptcp dss ack 2225927280], length 0
21:11:36.564081 IP 112.26.1.8.42339 > 112.26.1.1.targus-getdata1: Flags [.], seq 25704:27132, ack 1, win 913, options [nop,nop,TS val 704794 ecr 925032,mptcp dss ack 1803767578 seq 2226090072 subseq 396985 len 1428 csum 0xd6ef], length 1428
21:11:36.564351 IP 112.26.1.1.targus-getdata1 > 112.26.1.8.42339: Flags [.], ack 8568, win 5870, options [nop,nop,TS val 926318 ecr 702913,nop,nop,sack 2 {24276:27132}{9996:21420},mptcp dss ack 2225927280], length 0
21:11:36.644076 IP 112.26.1.1.targus-getdata1 > 112.26.1.8.42339: Flags [.], ack 8568, win 5870, options [nop,nop,TS val 925683 ecr 702913,nop,nop,sack 1 {9996:19992},mptcp dss ack 2225927280], length 0
21:11:36.717157 IP 112.26.1.8.42339 > 112.26.1.1.targus-getdata1: Flags [.], seq 27132:28560, ack 1, win 913, options [nop,nop,TS val 704794 ecr 925032,mptcp dss ack 1803767578 seq 2226091500 subseq 398413 len 1428 csum 0x40e8], length 1428
21:11:36.717528 IP 112.26.1.1.targus-getdata1 > 112.26.1.8.42339: Flags [.], ack 8568, win 5870, options [nop,nop,TS val 926472 ecr 702913,nop,nop,sack 2 {24276:28560}{9996:21420},mptcp dss ack 2225927280], length 0
21:11:36.815105 IP 112.26.1.1.targus-getdata1 > 112.26.1.8.42339: Flags [.], ack 8568, win 5870, options [nop,nop,TS val 925813 ecr 702913,nop,nop,sack 1 {9996:21420},mptcp dss ack 2225927280], length 0
21:11:36.901377 IP 112.26.1.8.42339 > 112.26.1.1.targus-getdata1: Flags [.], seq 29988:31416, ack 1, win 913, options [nop,nop,TS val 704794 ecr 925032,mptcp dss ack 1803767578 seq 2226094356 subseq 401269 len 1428 csum 0x36b2], length 1428
21:11:36.901721 IP 112.26.1.1.targus-getdata1 > 112.26.1.8.42339: Flags [.], ack 8568, win 6093, options [nop,nop,TS val 926656 ecr 702913,nop,nop,sack 2 {29988:31416}{24276:28560},mptcp dss ack 2226021528], length 0
21:11:36.977166 IP 112.26.1.8.42339 > 112.26.1.1.targus-getdata1: Flags [.], seq 31416:32844, ack 1, win 913, options [nop,nop,TS val 704794 ecr 925032,mptcp dss ack 1803767578 seq 2226095784 subseq 402697 len 1428 csum 0x2944], length 1428
21:11:36.977537 IP 112.26.1.1.targus-getdata1 > 112.26.1.8.42339: Flags [.], ack 8568, win 6093, options [nop,nop,TS val 926731 ecr 702913,nop,nop,sack 2 {29988:32844}{24276:28560},mptcp dss ack 2226021528], length 0
21:11:37.050494 IP 112.26.1.8.42339 > 112.26.1.1.targus-getdata1: Flags [.], seq 32844:34272, ack 1, win 913, options [nop,nop,TS val 704794 ecr 925032,mptcp dss ack 1803767578 seq 2226097212 subseq 404125 len 1428 csum 0xbe35], length 1428
21:11:37.050712 IP 112.26.1.1.targus-getdata1 > 112.26.1.8.42339: Flags [.], ack 8568, win 6093, options [nop,nop,TS val 926805 ecr 702913,nop,nop,sack 2 {29988:34272}{24276:28560},mptcp dss ack 2226021528], length 0
21:11:37.128712 IP 112.26.1.1.targus-getdata1 > 112.26.1.8.42339: Flags [.], ack 8568, win 5870, options [nop,nop,TS val 926146 ecr 702913,nop,nop,sack 2 {24276:25704}{9996:21420},mptcp dss ack 2225927280], length 0
21:11:37.185390 IP 112.26.1.8.42339 > 112.26.1.1.targus-getdata1: Flags [.], seq 34272:35700, ack 1, win 913, options [nop,nop,TS val 704982 ecr 925139,mptcp dss ack 1803767578 seq 2226105780 subseq 405553 len 1428 csum 0x3a89], length 1428
21:11:37.185708 IP 112.26.1.1.targus-getdata1 > 112.26.1.8.42339: Flags [.], ack 8568, win 6093, options [nop,nop,TS val 926940 ecr 702913,nop,nop,sack 2 {29988:35700}{24276:28560},mptcp dss ack 2226021528], length 0
21:11:37.274113 IP 112.26.1.8.42339 > 112.26.1.1.targus-getdata1: Flags [.], seq 35700:37128, ack 1, win 913, options [nop,nop,TS val 705211 ecr 925219,mptcp dss ack 1803767578 seq 2226118632 subseq 406981 len 1428 csum 0xc51a], length 1428
21:11:37.274392 IP 112.26.1.1.targus-getdata1 > 112.26.1.8.42339: Flags [.], ack 8568, win 6093, options [nop,nop,TS val 927028 ecr 702913,nop,nop,sack 2 {29988:37128}{24276:28560},mptcp dss ack 2226021528], length 0
21:11:37.353037 IP 112.26.1.8.42339 > 112.26.1.1.targus-getdata1: Flags [.], seq 8568:9996, ack 1, win 913, options [nop,nop,TS val 705211 ecr 925298,mptcp dss ack 1803767578 seq 2226021528 subseq 379849 len 1428 csum 0xec42], length 1428
21:11:37.353394 IP 112.26.1.1.targus-getdata1 > 112.26.1.8.42339: Flags [.], ack 21420, win 5962, options [nop,nop,TS val 927107 ecr 705211,nop,nop,sack 2 {29988:37128}{24276:28560},mptcp dss ack 2226064368], length 0
21:11:37.397368 IP 112.26.1.1.targus-getdata1 > 112.26.1.8.42339: Flags [.], ack 8568, win 5870, options [nop,nop,TS val 926472 ecr 702913,nop,nop,sack 2 {24276:28560}{9996:21420},mptcp dss ack 2225927280], length 0
21:11:37.488385 IP 112.26.1.8.42339 > 112.26.1.1.targus-getdata1: Flags [.], seq 37128:38556, ack 1, win 913, options [nop,nop,TS val 705376 ecr 925380,mptcp dss ack 1803767578 seq 2226128628 subseq 408409 len 1428 csum 0xb229], length 1428
21:11:37.488698 IP 112.26.1.1.targus-getdata1 > 112.26.1.8.42339: Flags [.], ack 21420, win 6122, options [nop,nop,TS val 927242 ecr 705211,nop,nop,sack 2 {29988:38556}{24276:28560},mptcp dss ack 2226064368], length 0
21:11:37.537187 IP 112.26.1.8.42339 > 112.26.1.1.targus-getdata1: Flags [.], seq 38556:39984, ack 1, win 913, options [nop,nop,TS val 705448 ecr 925546,mptcp dss ack 1803767578 seq 2226131484 subseq 409837 len 1428 csum 0xb776], length 1428
21:11:37.537513 IP 112.26.1.1.targus-getdata1 > 112.26.1.8.42339: Flags [.], ack 21420, win 6122, options [nop,nop,TS val 927291 ecr 705211,nop,nop,sack 2 {29988:39984}{24276:28560},mptcp dss ack 2226064368], length 0
21:11:37.614837 IP 112.26.1.1.targus-getdata1 > 112.26.1.8.42339: Flags [.], ack 8568, win 6093, options [nop,nop,TS val 926656 ecr 702913,nop,nop,sack 2 {29988:31416}{24276:28560},mptcp dss ack 2226021528], length 0
21:11:37.712377 IP 112.26.1.1.targus-getdata1 > 112.26.1.8.42339: Flags [.], ack 8568, win 6093, options [nop,nop,TS val 926731 ecr 702913,nop,nop,sack 2 {29988:32844}{24276:28560},mptcp dss ack 2226021528], length 0
21:11:37.808248 IP 112.26.1.8.42339 > 112.26.1.1.targus-getdata1: Flags [.], seq 21420:22848, ack 1, win 913, options [nop,nop,TS val 706077 ecr 926146,mptcp dss ack 1803767578 seq 2226071508 subseq 392701 len 1428 csum 0x8b5b], length 1428
21:11:37.808591 IP 112.26.1.1.targus-getdata1 > 112.26.1.8.42339: Flags [.], ack 22848, win 6122, options [nop,nop,TS val 927562 ecr 706077,nop,nop,sack 2 {29988:39984}{24276:28560},mptcp dss ack 2226064368], length 0
21:11:37.906084 IP 112.26.1.1.targus-getdata1 > 112.26.1.8.42339: Flags [.], ack 8568, win 6093, options [nop,nop,TS val 926940 ecr 702913,nop,nop,sack 2 {29988:35700}{24276:28560},mptcp dss ack 2226021528], length 0
21:11:37.992288 IP 112.26.1.1.targus-getdata1 > 112.26.1.8.42339: Flags [.], ack 8568, win 6093, options [nop,nop,TS val 927028 ecr 702913,nop,nop,sack 2 {29988:37128}{24276:28560},mptcp dss ack 2226021528], length 0
21:11:38.092765 IP 112.26.1.1.targus-getdata1 > 112.26.1.8.42339: Flags [.], ack 21420, win 5962, options [nop,nop,TS val 927107 ecr 705211,nop,nop,sack 2 {29988:37128}{24276:28560},mptcp dss ack 2226064368], length 0
21:11:38.138470 IP 112.26.1.8.42339 > 112.26.1.1.targus-getdata1: Flags [.], seq 22848:24276, ack 1, win 913, options [nop,nop,TS val 706346 ecr 926472,mptcp dss ack 1803767578 seq 2226072936 subseq 394129 len 1428 csum 0x4b3f], length 1428
21:11:38.138835 IP 112.26.1.1.targus-getdata1 > 112.26.1.8.42339: Flags [.], ack 28560, win 6122, options [nop,nop,TS val 927892 ecr 706346,nop,nop,sack 1 {29988:39984},mptcp dss ack 2226085788], length 0
21:11:38.199847 IP 112.26.1.1.targus-getdata1 > 112.26.1.8.42339: Flags [.], ack 21420, win 6122, options [nop,nop,TS val 927242 ecr 705211,nop,nop,sack 2 {29988:38556}{24276:28560},mptcp dss ack 2226064368], length 0
21:11:38.272553 IP 112.26.1.1.targus-getdata1 > 112.26.1.8.42339: Flags [.], ack 21420, win 6122, options [nop,nop,TS val 927291 ecr 705211,nop,nop,sack 2 {29988:39984}{24276:28560},mptcp dss ack 2226064368], length 0
21:11:38.367166 IP 112.26.1.8.42339 > 112.26.1.1.targus-getdata1: Flags [.], seq 28560:29988, ack 1, win 913, options [nop,nop,TS val 706563 ecr 926656,mptcp dss ack 1803767578 seq 2226092928 subseq 399841 len 1428 csum 0x5d41], length 1428
21:11:38.367513 IP 112.26.1.1.targus-getdata1 > 112.26.1.8.42339: Flags [.], ack 39984, win 6122, options [nop,nop,TS val 928122 ecr 706563,mptcp dss ack 2226085788], length 0
21:11:38.446162 IP 112.26.1.8.42339 > 112.26.1.1.targus-getdata1: Flags [.], seq 41412:42840, ack 1, win 913, options [nop,nop,TS val 706716 ecr 926731,mptcp dss ack 1803767578 seq 2226165756 subseq 412693 len 1428 csum 0x49d2], length 1428
21:11:38.446443 IP 112.26.1.1.targus-getdata1 > 112.26.1.8.42339: Flags [.], ack 39984, win 6122, options [nop,nop,TS val 928201 ecr 706563,nop,nop,sack 1 {41412:42840},mptcp dss ack 2226085788], length 0
21:11:38.557048 IP 112.26.1.1.targus-getdata1 > 112.26.1.8.42339: Flags [.], ack 22848, win 6122, options [nop,nop,TS val 927562 ecr 706077,nop,nop,sack 2 {29988:39984}{24276:28560},mptcp dss ack 2226064368], length 0
21:11:38.627793 IP 112.26.1.8.42339 > 112.26.1.1.targus-getdata1: Flags [.], seq 42840:44268, ack 1, win 913, options [nop,nop,TS val 706880 ecr 926940,mptcp dss ack 1803767578 seq 2226174324 subseq 414121 len 1428 csum 0x4c65], length 1428
21:11:38.628066 IP 112.26.1.1.targus-getdata1 > 112.26.1.8.42339: Flags [.], ack 39984, win 6122, options [nop,nop,TS val 928382 ecr 706563,nop,nop,sack 1 {41412:44268},mptcp dss ack 2226085788], length 0
21:11:38.749162 IP 112.26.1.8.42339 > 112.26.1.1.targus-getdata1: Flags [.], seq 44268:45696, ack 1, win 913, options [nop,nop,TS val 706880 ecr 926940,mptcp dss ack 1803767578 seq 2226175752 subseq 415549 len 1428 csum 0xcd0b], length 1428
21:11:38.749385 IP 112.26.1.1.targus-getdata1 > 112.26.1.8.42339: Flags [.], ack 39984, win 6122, options [nop,nop,TS val 928503 ecr 706563,nop,nop,sack 1 {41412:45696},mptcp dss ack 2226085788], length 0
21:11:38.814840 IP 112.26.1.1.targus-getdata1 > 112.26.1.8.42339: Flags [.], ack 28560, win 6122, options [nop,nop,TS val 927892 ecr 706346,nop,nop,sack 1 {29988:39984},mptcp dss ack 2226085788], length 0
21:11:38.913529 IP 112.26.1.8.42339 > 112.26.1.1.targus-getdata1: Flags [.], seq 45696:47124, ack 1, win 913, options [nop,nop,TS val 707020 ecr 927028,mptcp dss ack 1803767578 seq 2226180036 subseq 416977 len 1428 csum 0x2616], length 1428
21:11:38.913884 IP 112.26.1.1.targus-getdata1 > 112.26.1.8.42339: Flags [.], ack 39984, win 6054, options [nop,nop,TS val 928668 ecr 706563,nop,nop,sack 1 {41412:47124},mptcp dss ack 2226104352], length 0
21:11:38.975256 IP 112.26.1.8.42339 > 112.26.1.1.targus-getdata1: Flags [.], seq 47124:48552, ack 1, win 913, options [nop,nop,TS val 707064 ecr 927107,mptcp dss ack 1803767578 seq 2226182892 subseq 418405 len 1428 csum 0xaa00], length 1428
21:11:38.975573 IP 112.26.1.1.targus-getdata1 > 112.26.1.8.42339: Flags [.], ack 39984, win 6054, options [nop,nop,TS val 928729 ecr 706563,nop,nop,sack 1 {41412:48552},mptcp dss ack 2226104352], length 0
21:11:39.056231 IP 112.26.1.8.42339 > 112.26.1.1.targus-getdata1: Flags [.], seq 48552:49980, ack 1, win 913, options [nop,nop,TS val 707064 ecr 927107,mptcp dss ack 1803767578 seq 2226184320 subseq 419833 len 1428 csum 0x674f], length 1428
21:11:39.056466 IP 112.26.1.1.targus-getdata1 > 112.26.1.8.42339: Flags [.], ack 39984, win 6093, options [nop,nop,TS val 928810 ecr 706563,nop,nop,sack 1 {41412:49980},mptcp dss ack 2226115776], length 0
21:11:39.096642 IP 112.26.1.1.targus-getdata1 > 112.26.1.8.42339: Flags [.], ack 39984, win 6122, options [nop,nop,TS val 928122 ecr 706563,mptcp dss ack 2226085788], length 0
21:11:39.177636 IP 112.26.1.1.targus-getdata1 > 112.26.1.8.42339: Flags [.], ack 39984, win 6122, options [nop,nop,TS val 928201 ecr 706563,nop,nop,sack 1 {41412:42840},mptcp dss ack 2226085788], length 0
21:11:39.273190 IP 112.26.1.8.42339 > 112.26.1.1.targus-getdata1: Flags [.], seq 51408:52836, ack 1, win 913, options [nop,nop,TS val 707343 ecr 927291,mptcp dss ack 1803767578 seq 2226191460 subseq 422689 len 1428 csum 0x3109], length 1428
21:11:39.273477 IP 112.26.1.1.targus-getdata1 > 112.26.1.8.42339: Flags [.], ack 39984, win 6122, options [nop,nop,TS val 929027 ecr 706563,nop,nop,sack 2 {51408:52836}{41412:49980},mptcp dss ack 2226127200], length 0
21:11:39.367259 IP 112.26.1.1.targus-getdata1 > 112.26.1.8.42339: Flags [.], ack 39984, win 6122, options [nop,nop,TS val 928382 ecr 706563,nop,nop,sack 1 {41412:44268},mptcp dss ack 2226085788], length 0
21:11:39.407014 IP 112.26.1.8.42339 > 112.26.1.1.targus-getdata1: Flags [.], seq 39984:41412, ack 1, win 913, options [nop,nop,TS val 707505 ecr 927562,mptcp dss ack 1803767578 seq 2226137196 subseq 411265 len 1428 csum 0xcb7], length 1428
21:11:39.407397 IP 112.26.1.1.targus-getdata1 > 112.26.1.8.42339: Flags [.], ack 49980, win 6032, options [nop,nop,TS val 929161 ecr 707505,nop,nop,sack 1 {51408:52836},mptcp dss ack 2226157188], length 0
21:11:39.493146 IP 112.26.1.1.targus-getdata1 > 112.26.1.8.42339: Flags [.], ack 39984, win 6122, options [nop,nop,TS val 928503 ecr 706563,nop,nop,sack 1 {41412:45696},mptcp dss ack 2226085788], length 0
21:11:39.567575 IP 112.26.1.8.42339 > 112.26.1.1.targus-getdata1: Flags [.], seq 54264:55692, ack 1, win 913, options [nop,nop,TS val 707763 ecr 927892,mptcp dss ack 1803767578 seq 2226204312 subseq 425545 len 1428 csum 0x70e7], length 1428
21:11:39.567942 IP 112.26.1.1.targus-getdata1 > 112.26.1.8.42339: Flags [.], ack 49980, win 6122, options [nop,nop,TS val 929322 ecr 707505,nop,nop,sack 2 {54264:55692}{51408:52836},mptcp dss ack 2226157188], length 0
21:11:39.665453 IP 112.26.1.1.targus-getdata1 > 112.26.1.8.42339: Flags [.], ack 39984, win 6054, options [nop,nop,TS val 928668 ecr 706563,nop,nop,sack 1 {41412:47124},mptcp dss ack 2226104352], length 0
21:11:39.710555 IP 112.26.1.1.targus-getdata1 > 112.26.1.8.42339: Flags [.], ack 39984, win 6054, options [nop,nop,TS val 928729 ecr 706563,nop,nop,sack 1 {41412:48552},mptcp dss ack 2226104352], length 0
21:11:39.790717 IP 112.26.1.1.targus-getdata1 > 112.26.1.8.42339: Flags [.], ack 39984, win 6093, options [nop,nop,TS val 928810 ecr 706563,nop,nop,sack 1 {41412:49980},mptcp dss ack 2226115776], length 0
21:11:39.833526 IP 112.26.1.8.42339 > 112.26.1.1.targus-getdata1: Flags [.], seq 55692:57120, ack 1, win 913, options [nop,nop,TS val 708045 ecr 928122,mptcp dss ack 1803767578 seq 2226215736 subseq 426973 len 1428 csum 0x133b], length 1428
21:11:39.833838 IP 112.26.1.1.targus-getdata1 > 112.26.1.8.42339: Flags [.], ack 49980, win 6122, options [nop,nop,TS val 929588 ecr 707505,nop,nop,sack 2 {54264:57120}{51408:52836},mptcp dss ack 2226157188], length 0
21:11:39.911742 IP 112.26.1.8.42339 > 112.26.1.1.targus-getdata1: Flags [.], seq 57120:58548, ack 1, win 913, options [nop,nop,TS val 708134 ecr 928201,mptcp dss ack 1803767578 seq 2226217164 subseq 428401 len 1428 csum 0x8632], length 1428
21:11:39.912100 IP 112.26.1.1.targus-getdata1 > 112.26.1.8.42339: Flags [.], ack 49980, win 6122, options [nop,nop,TS val 929666 ecr 707505,nop,nop,sack 2 {54264:58548}{51408:52836},mptcp dss ack 2226157188], length 0
21:11:39.989481 IP 112.26.1.1.targus-getdata1 > 112.26.1.8.42339: Flags [.], ack 39984, win 6122, options [nop,nop,TS val 929027 ecr 706563,nop,nop,sack 2 {51408:52836}{41412:49980},mptcp dss ack 2226127200], length 0
21:11:40.065798 IP 112.26.1.1.targus-getdata1 > 112.26.1.8.42339: Flags [.], ack 49980, win 6032, options [nop,nop,TS val 929161 ecr 707505,nop,nop,sack 1 {51408:52836},mptcp dss ack 2226157188], length 0
21:11:40.156069 IP 112.26.1.8.42339 > 112.26.1.1.targus-getdata1: Flags [.], seq 58548:59976, ack 1, win 913, options [nop,nop,TS val 708466 ecr 928503,mptcp dss ack 1803767578 seq 2226230016 subseq 429829 len 1428 csum 0x3e0f], length 1428
21:11:40.156422 IP 112.26.1.1.targus-getdata1 > 112.26.1.8.42339: Flags [.], ack 49980, win 6122, options [nop,nop,TS val 929910 ecr 707505,nop,nop,sack 2 {54264:59976}{51408:52836},mptcp dss ack 2226187176], length 0
21:11:40.217213 IP 112.26.1.1.targus-getdata1 > 112.26.1.8.42339: Flags [.], ack 49980, win 6122, options [nop,nop,TS val 929322 ecr 707505,nop,nop,sack 2 {54264:55692}{51408:52836},mptcp dss ack 2226157188], length 0
21:11:40.258348 IP 112.26.1.8.42339 > 112.26.1.1.targus-getdata1: Flags [.], seq 59976:61404, ack 1, win 913, options [nop,nop,TS val 708658 ecr 928668,mptcp dss ack 1803767578 seq 2226238584 subseq 431257 len 1428 csum 0xe389], length 1428
21:11:40.258700 IP 112.26.1.1.targus-getdata1 > 112.26.1.8.42339: Flags [.], ack 49980, win 6122, options [nop,nop,TS val 930012 ecr 707505,nop,nop,sack 2 {54264:61404}{51408:52836},mptcp dss ack 2226187176], length 0
21:11:40.339423 IP 112.26.1.1.targus-getdata1 > 112.26.1.8.42339: Flags [.], ack 49980, win 6122, options [nop,nop,TS val 929588 ecr 707505,nop,nop,sack 2 {54264:57120}{51408:52836},mptcp dss ack 2226157188], length 0
21:11:40.438599 IP 112.26.1.8.42339 > 112.26.1.1.targus-getdata1: Flags [.], seq 61404:62832, ack 1, win 913, options [nop,nop,TS val 708796 ecr 928810,mptcp dss ack 1803767578 seq 2226244296 subseq 432685 len 1428 csum 0x76a6], length 1428
21:11:40.438944 IP 112.26.1.1.targus-getdata1 > 112.26.1.8.42339: Flags [.], ack 49980, win 6122, options [nop,nop,TS val 930192 ecr 707505,nop,nop,sack 2 {54264:62832}{51408:52836},mptcp dss ack 2226187176], length 0
21:11:40.502357 IP 112.26.1.1.targus-getdata1 > 112.26.1.8.42339: Flags [.], ack 49980, win 6122, options [nop,nop,TS val 929666 ecr 707505,nop,nop,sack 2 {54264:58548}{51408:52836},mptcp dss ack 2226157188], length 0
21:11:40.603428 IP 112.26.1.8.42339 > 112.26.1.1.targus-getdata1: Flags [.], seq 49980:51408, ack 1, win 913, options [nop,nop,TS val 709015 ecr 929161,mptcp dss ack 1803767578 seq 2226187176 subseq 421261 len 1428 csum 0x934f], length 1428
21:11:40.603782 IP 112.26.1.1.targus-getdata1 > 112.26.1.8.42339: Flags [.], ack 52836, win 6033, options [nop,nop,TS val 930358 ecr 709015,nop,nop,sack 1 {54264:62832},mptcp dss ack 2226198600], length 0
21:11:40.676626 IP 112.26.1.1.targus-getdata1 > 112.26.1.8.42339: Flags [.], ack 49980, win 6122, options [nop,nop,TS val 929910 ecr 707505,nop,nop,sack 2 {54264:59976}{51408:52836},mptcp dss ack 2226187176], length 0
21:11:40.739436 IP 112.26.1.8.42339 > 112.26.1.1.targus-getdata1: Flags [.], seq 52836:54264, ack 1, win 913, options [nop,nop,TS val 709167 ecr 929322,mptcp dss ack 1803767578 seq 2226198600 subseq 424117 len 1428 csum 0x82c0], length 1428
21:11:40.739705 IP 112.26.1.1.targus-getdata1 > 112.26.1.8.42339: Flags [.], ack 62832, win 6026, options [nop,nop,TS val 930494 ecr 709167,mptcp dss ack 2226234300], length 0
21:11:40.796364 IP 112.26.1.1.targus-getdata1 > 112.26.1.8.42339: Flags [.], ack 49980, win 6122, options [nop,nop,TS val 930012 ecr 707505,nop,nop,sack 2 {54264:61404}{51408:52836},mptcp dss ack 2226187176], length 0
21:11:40.841719 IP 112.26.1.8.42339 > 112.26.1.1.targus-getdata1: Flags [.], seq 62832:64260, ack 1, win 913, options [nop,nop,TS val 709318 ecr 929588,mptcp dss ack 1803767578 seq 2226264288 subseq 434113 len 1428 csum 0xe698], length 1428
21:11:40.842039 IP 112.26.1.1.targus-getdata1 > 112.26.1.8.42339: Flags [.], ack 64260, win 6122, options [nop,nop,TS val 930596 ecr 709318,mptcp dss ack 2226234300], length 0
21:11:40.940919 IP 112.26.1.1.targus-getdata1 > 112.26.1.8.42339: Flags [.], ack 49980, win 6122, options [nop,nop,TS val 930192 ecr 707505,nop,nop,sack 2 {54264:62832}{51408:52836},mptcp dss ack 2226187176], length 0
21:11:41.032907 IP 112.26.1.8.42339 > 112.26.1.1.targus-getdata1: Flags [.], seq 64260:65688, ack 1, win 913, options [nop,nop,TS val 709494 ecr 929666,mptcp dss ack 1803767578 seq 2226271428 subseq 435541 len 1428 csum 0x323], length 1428
21:11:41.033243 IP 112.26.1.1.targus-getdata1 > 112.26.1.8.42339: Flags [.], ack 65688, win 6122, options [nop,nop,TS val 930787 ecr 709494,mptcp dss ack 2226234300], length 0
21:11:41.123042 IP 112.26.1.1.targus-getdata1 > 112.26.1.8.42339: Flags [.], ack 52836, win 6033, options [nop,nop,TS val 930358 ecr 709015,nop,nop,sack 1 {54264:62832},mptcp dss ack 2226198600], length 0
21:11:41.225041 IP 112.26.1.8.42339 > 112.26.1.1.targus-getdata1: Flags [.], seq 65688:67116, ack 1, win 913, options [nop,nop,TS val 709648 ecr 929910,mptcp dss ack 1803767578 seq 2226279996 subseq 436969 len 1428 csum 0x282e], length 1428
21:11:41.225333 IP 112.26.1.1.targus-getdata1 > 112.26.1.8.42339: Flags [.], ack 67116, win 6122, options [nop,nop,TS val 930979 ecr 709648,mptcp dss ack 2226234300], length 0
21:11:41.289001 IP 112.26.1.1.targus-getdata1 > 112.26.1.8.42339: Flags [.], ack 62832, win 6026, options [nop,nop,TS val 930494 ecr 709167,mptcp dss ack 2226234300], length 0
21:11:41.356222 IP 112.26.1.8.42339 > 112.26.1.1.targus-getdata1: Flags [.], seq 67116:68544, ack 1, win 913, options [nop,nop,TS val 709762 ecr 930012,mptcp dss ack 1803767578 seq 2226285708 subseq 438397 len 1428 csum 0x5541], length 1428
21:11:41.356574 IP 112.26.1.1.targus-getdata1 > 112.26.1.8.42339: Flags [.], ack 68544, win 6122, options [nop,nop,TS val 931111 ecr 709762,mptcp dss ack 2226234300], length 0
21:11:41.428396 IP 112.26.1.1.targus-getdata1 > 112.26.1.8.42339: Flags [.], ack 64260, win 6122, options [nop,nop,TS val 930596 ecr 709318,mptcp dss ack 2226234300], length 0
21:11:41.472314 IP 112.26.1.8.42339 > 112.26.1.1.targus-getdata1: Flags [.], seq 68544:69972, ack 1, win 913, options [nop,nop,TS val 709914 ecr 930192,mptcp dss ack 1803767578 seq 2226292848 subseq 439825 len 1428 csum 0x3ee1], length 1428
21:11:41.472650 IP 112.26.1.1.targus-getdata1 > 112.26.1.8.42339: Flags [.], ack 69972, win 6122, options [nop,nop,TS val 931226 ecr 709914,mptcp dss ack 2226234300], length 0
21:11:41.530376 IP 112.26.1.1.targus-getdata1 > 112.26.1.8.42339: Flags [.], ack 65688, win 6122, options [nop,nop,TS val 930787 ecr 709494,mptcp dss ack 2226234300], length 0
21:11:41.619017 IP 112.26.1.8.42339 > 112.26.1.1.targus-getdata1: Flags [.], seq 69972:71400, ack 1, win 913, options [nop,nop,TS val 710072 ecr 930358,mptcp dss ack 1803767578 seq 2226302844 subseq 441253 len 1428 csum 0xcc2f], length 1428
21:11:41.619305 IP 112.26.1.1.targus-getdata1 > 112.26.1.8.42339: Flags [.], ack 71400, win 6122, options [nop,nop,TS val 931373 ecr 710072,mptcp dss ack 2226234300], length 0
21:11:41.686338 IP 112.26.1.1.targus-getdata1 > 112.26.1.8.42339: Flags [.], ack 67116, win 6122, options [nop,nop,TS val 930979 ecr 709648,mptcp dss ack 2226234300], length 0
21:11:41.766602 IP 112.26.1.8.42339 > 112.26.1.1.targus-getdata1: Flags [.], seq 71400:72828, ack 1, win 913, options [nop,nop,TS val 710072 ecr 930358,mptcp dss ack 1803767578 seq 2226304272 subseq 442681 len 1428 csum 0xc808], length 1428
21:11:41.766880 IP 112.26.1.1.targus-getdata1 > 112.26.1.8.42339: Flags [.], ack 72828, win 6122, options [nop,nop,TS val 931520 ecr 710072,mptcp dss ack 2226234300], length 0
21:11:41.846514 IP 112.26.1.1.targus-getdata1 > 112.26.1.8.42339: Flags [.], ack 68544, win 6122, options [nop,nop,TS val 931111 ecr 709762,mptcp dss ack 2226234300], length 0
21:11:41.915742 IP 112.26.1.8.42339 > 112.26.1.1.targus-getdata1: Flags [.], seq 72828:74256, ack 1, win 913, options [nop,nop,TS val 710238 ecr 930494,mptcp dss ack 1803767578 seq 2226308556 subseq 444109 len 1428 csum 0x5679], length 1428
21:11:41.916089 IP 112.26.1.1.targus-getdata1 > 112.26.1.8.42339: Flags [.], ack 74256, win 6122, options [nop,nop,TS val 931670 ecr 710238,mptcp dss ack 2226234300], length 0
21:11:42.021085 IP 112.26.1.1.targus-getdata1 > 112.26.1.8.42339: Flags [.], ack 69972, win 6122, options [nop,nop,TS val 931226 ecr 709914,mptcp dss ack 2226234300], length 0
21:11:42.098829 IP 112.26.1.8.42339 > 112.26.1.1.targus-getdata1: Flags [.], seq 74256:75684, ack 1, win 913, options [nop,nop,TS val 710377 ecr 930596,mptcp dss ack 1803767578 seq 2226317124 subseq 445537 len 1428 csum 0x813d], length 1428
21:11:42.099179 IP 112.26.1.1.targus-getdata1 > 112.26.1.8.42339: Flags [.], ack 75684, win 6122, options [nop,nop,TS val 931853 ecr 710377,mptcp dss ack 2226234300], length 0
21:11:42.181565 IP 112.26.1.8.42339 > 112.26.1.1.targus-getdata1: Flags [.], seq 75684:77112, ack 1, win 913, options [nop,nop,TS val 710479 ecr 930787,mptcp dss ack 1803767578 seq 2226318552 subseq 446965 len 1428 csum 0x972f], length 1428
21:11:42.181937 IP 112.26.1.1.targus-getdata1 > 112.26.1.8.42339: Flags [.], ack 77112, win 6122, options [nop,nop,TS val 931936 ecr 710479,mptcp dss ack 2226234300], length 0
21:11:42.217956 IP 112.26.1.1.targus-getdata1 > 112.26.1.8.42339: Flags [.], ack 71400, win 6122, options [nop,nop,TS val 931373 ecr 710072,mptcp dss ack 2226234300], length 0
21:11:42.305178 IP 112.26.1.8.42339 > 112.26.1.1.targus-getdata1: Flags [.], seq 77112:78540, ack 1, win 913, options [nop,nop,TS val 710634 ecr 930979,mptcp dss ack 1803767578 seq 2226324264 subseq 448393 len 1428 csum 0xfa3f], length 1428
21:11:42.305505 IP 112.26.1.1.targus-getdata1 > 112.26.1.8.42339: Flags [.], ack 78540, win 6122, options [nop,nop,TS val 932059 ecr 710634,mptcp dss ack 2226299988], length 0
21:11:42.356453 IP 112.26.1.1.targus-getdata1 > 112.26.1.8.42339: Flags [.], ack 72828, win 6122, options [nop,nop,TS val 931520 ecr 710072,mptcp dss ack 2226234300], length 0
21:11:42.423472 IP 112.26.1.8.42339 > 112.26.1.1.targus-getdata1: Flags [.], seq 78540:79968, ack 1, win 913, options [nop,nop,TS val 710634 ecr 930979,mptcp dss ack 1803767578 seq 2226325692 subseq 449821 len 1428 csum 0x8f31], length 1428
21:11:42.423795 IP 112.26.1.1.targus-getdata1 > 112.26.1.8.42339: Flags [.], ack 79968, win 6122, options [nop,nop,TS val 932178 ecr 710634,mptcp dss ack 2226299988], length 0
21:11:42.488095 IP 112.26.1.8.42339 > 112.26.1.1.targus-getdata1: Flags [.], seq 79968:81396, ack 1, win 913, options [nop,nop,TS val 710797 ecr 931111,mptcp dss ack 1803767578 seq 2226334260 subseq 451249 len 1428 csum 0xb85], length 1428
21:11:42.488383 IP 112.26.1.1.targus-getdata1 > 112.26.1.8.42339: Flags [.], ack 81396, win 6122, options [nop,nop,TS val 932242 ecr 710797,mptcp dss ack 2226299988], length 0
21:11:42.564904 IP 112.26.1.1.targus-getdata1 > 112.26.1.8.42339: Flags [.], ack 74256, win 6122, options [nop,nop,TS val 931670 ecr 710238,mptcp dss ack 2226234300], length 0
21:11:42.647748 IP 112.26.1.8.42339 > 112.26.1.1.targus-getdata1: Flags [.], seq 81396:82824, ack 1, win 913, options [nop,nop,TS val 710969 ecr 931226,mptcp dss ack 1803767578 seq 2226345684 subseq 452677 len 1428 csum 0x6cb9], length 1428
21:11:42.688677 IP 112.26.1.1.targus-getdata1 > 112.26.1.8.42339: Flags [.], ack 82824, win 6122, options [nop,nop,TS val 932443 ecr 710969,mptcp dss ack 2226299988], length 0
21:11:42.698360 IP 112.26.1.1.targus-getdata1 > 112.26.1.8.42339: Flags [.], ack 75684, win 6122, options [nop,nop,TS val 931853 ecr 710377,mptcp dss ack 2226234300], length 0
21:11:42.773372 IP 112.26.1.1.targus-getdata1 > 112.26.1.8.42339: Flags [.], ack 77112, win 6122, options [nop,nop,TS val 931936 ecr 710479,mptcp dss ack 2226234300], length 0
21:11:42.839057 IP 112.26.1.8.42339 > 112.26.1.1.targus-getdata1: Flags [.], seq 82824:84252, ack 1, win 913, options [nop,nop,TS val 711167 ecr 931373,mptcp dss ack 1803767578 seq 2226352824 subseq 454105 len 1428 csum 0x6a5b], length 1428
21:11:42.920064 IP 112.26.1.1.targus-getdata1 > 112.26.1.8.42339: Flags [.], ack 78540, win 6122, options [nop,nop,TS val 932059 ecr 710634,mptcp dss ack 2226299988], length 0
21:11:42.926052 IP 112.26.1.1.targus-getdata1 > 112.26.1.8.42339: Flags [.], ack 84252, win 6122, options [nop,nop,TS val 932680 ecr 711167,mptcp dss ack 2226312840], length 0
21:11:43.009042 IP 112.26.1.1.targus-getdata1 > 112.26.1.8.42339: Flags [.], ack 79968, win 6122, options [nop,nop,TS val 932178 ecr 710634,mptcp dss ack 2226299988], length 0
21:11:43.117251 IP 112.26.1.8.42339 > 112.26.1.1.targus-getdata1: Flags [.], seq 84252:85680, ack 1, win 913, options [nop,nop,TS val 711305 ecr 931520,mptcp dss ack 1803767578 seq 2226355680 subseq 455533 len 1428 csum 0xb041], length 1428
21:11:43.210389 IP 112.26.1.1.targus-getdata1 > 112.26.1.8.42339: Flags [.], ack 81396, win 6122, options [nop,nop,TS val 932242 ecr 710797,mptcp dss ack 2226299988], length 0
21:11:43.280270 IP 112.26.1.8.42339 > 112.26.1.1.targus-getdata1: Flags [.], seq 85680:87108, ack 1, win 913, options [nop,nop,TS val 711513 ecr 931670,mptcp dss ack 1803767578 seq 2226362820 subseq 456961 len 1428 csum 0xce1], length 1428
21:11:43.280591 IP 112.26.1.1.targus-getdata1 > 112.26.1.8.42339: Flags [.], ack 87108, win 6122, options [nop,nop,TS val 933034 ecr 711305,mptcp dss ack 2226312840], length 0
21:11:43.348837 IP 112.26.1.1.targus-getdata1 > 112.26.1.8.42339: Flags [.], ack 82824, win 6122, options [nop,nop,TS val 932443 ecr 710969,mptcp dss ack 2226299988], length 0
21:11:43.456492 IP 112.26.1.8.42339 > 112.26.1.1.targus-getdata1: Flags [.], seq 87108:88536, ack 1, win 913, options [nop,nop,TS val 711647 ecr 931853,mptcp dss ack 1803767578 seq 2226371388 subseq 458389 len 1428 csum 0x7115], length 1428
21:11:43.528346 IP 112.26.1.8.42339 > 112.26.1.1.targus-getdata1: Flags [.], seq 88536:89964, ack 1, win 913, options [nop,nop,TS val 711740 ecr 931936,mptcp dss ack 1803767578 seq 2226374244 subseq 459817 len 1428 csum 0xbb40], length 1428
21:11:43.528680 IP 112.26.1.1.targus-getdata1 > 112.26.1.8.42339: Flags [.], ack 89964, win 6122, options [nop,nop,TS val 933282 ecr 711647,mptcp dss ack 2226349968], length 0
21:11:43.600618 IP 112.26.1.1.targus-getdata1 > 112.26.1.8.42339: Flags [.], ack 84252, win 6122, options [nop,nop,TS val 932680 ecr 711167,mptcp dss ack 2226312840], length 0
21:11:43.681034 IP 112.26.1.8.42339 > 112.26.1.1.targus-getdata1: Flags [.], seq 89964:91392, ack 1, win 913, options [nop,nop,TS val 711868 ecr 932059,mptcp dss ack 1803767578 seq 2226382812 subseq 461245 len 1428 csum 0x10ae], length 1428
21:11:43.752744 IP 112.26.1.8.42339 > 112.26.1.1.targus-getdata1: Flags [.], seq 91392:92820, ack 1, win 913, options [nop,nop,TS val 711957 ecr 932178,mptcp dss ack 1803767578 seq 2226384240 subseq 462673 len 1428 csum 0xd5ee], length 1428
21:11:43.753077 IP 112.26.1.1.targus-getdata1 > 112.26.1.8.42339: Flags [.], ack 92820, win 6122, options [nop,nop,TS val 933507 ecr 711868,mptcp dss ack 2226349968], length 0
21:11:43.813506 IP 112.26.1.8.42339 > 112.26.1.1.targus-getdata1: Flags [.], seq 92820:94248, ack 1, win 913, options [nop,nop,TS val 711957 ecr 932178,mptcp dss ack 1803767578 seq 2226385668 subseq 464101 len 1428 csum 0x563e], length 1428
21:11:43.894980 IP 112.26.1.8.42339 > 112.26.1.1.targus-getdata1: Flags [.], seq 94248:95676, ack 1, win 913, options [nop,nop,TS val 712159 ecr 932242,mptcp dss ack 1803767578 seq 2226397092 subseq 465529 len 1428 csum 0x892b], length 1428
21:11:43.938406 IP 112.26.1.1.targus-getdata1 > 112.26.1.8.42339: Flags [.], ack 87108, win 6122, options [nop,nop,TS val 933034 ecr 711305,mptcp dss ack 2226312840], length 0
21:11:43.949414 IP 112.26.1.1.targus-getdata1 > 112.26.1.8.42339: Flags [.], ack 95676, win 6122, options [nop,nop,TS val 933704 ecr 711957,mptcp dss ack 2226349968], length 0
