17:35:05.631382 IP 112.26.2.8.39247 > 112.26.2.1.targus-getdata1: Flags [S], seq 599983456, win 29200, options [mss 1460,sackOK,TS val 1082530 ecr 0,nop,wscale 7,mptcp join id 4 token 0x3ce29047 nonce 0xfd08f321], length 0
17:35:05.631679 IP 112.26.2.1.targus-getdata1 > 112.26.2.8.39247: Flags [S.], seq 139595118, ack 599983457, win 65535, options [mss 1460,sackOK,TS val 1315420 ecr 1082530,nop,wscale 6,mptcp join id 4 hmac 0x373c895b29a0b58a nonce 0x91b610df], length 0
17:35:05.753464 IP 112.26.2.1.targus-getdata1 > 112.26.2.8.39247: Flags [S.], seq 139595118, ack 599983457, win 65535, options [mss 1460,sackOK,TS val 1315420 ecr 1082530,nop,wscale 6,mptcp join id 4 hmac 0x373c895b29a0b58a nonce 0x91b610df], length 0
17:35:05.859246 IP 112.26.2.8.39247 > 112.26.2.1.targus-getdata1: Flags [.], ack 1, win 913, options [nop,nop,TS val 1082677 ecr 1315420,mptcp join hmac 0x424cafe8c1704b814139742caaf8c72c9a57be64], length 0
17:35:05.859555 IP 112.26.2.1.targus-getdata1 > 112.26.2.8.39247: Flags [.], ack 1, win 4017, options [nop,nop,TS val 1315648 ecr 1082677,mptcp dss ack 1152732528], length 0
17:35:05.947261 IP 112.26.2.1.targus-getdata1 > 112.26.2.8.39247: Flags [.], ack 1, win 4017, options [nop,nop,TS val 1315648 ecr 1082677,mptcp dss ack 1152732528], length 0
17:35:06.528098 IP 112.26.2.8.33185 > 112.26.2.1.targus-getdata1: Flags [S], seq 1285829750, win 29200, options [mss 1460,sackOK,TS val 1083440 ecr 0,nop,wscale 7,mptcp join id 4 token 0x6feafb67 nonce 0x6a593532], length 0
17:35:45.280268 IP 112.26.2.1.targus-getdata1 > 112.26.2.8.33185: Flags [.], ack 1286215311, win 24324, options [nop,nop,TS val 1355005 ecr 1121662,mptcp dss ack 3528597050], length 0
17:35:45.329538 IP 112.26.2.8.33185 > 112.26.2.1.targus-getdata1: Flags [.], seq 1:1429, ack 0, win 913, options [nop,nop,TS val 1121870 ecr 1354350,mptcp dss ack 3644063658 seq 3528668450 subseq 385561 len 1428 csum 0x785], length 1428
17:35:45.385190 IP 112.26.2.8.33185 > 112.26.2.1.targus-getdata1: Flags [.], seq 1429:2857, ack 0, win 913, options [nop,nop,TS val 1121870 ecr 1354350,mptcp dss ack 3644063658 seq 3528669878 subseq 386989 len 1428 csum 0xd5c0], length 1428
17:35:45.442943 IP 112.26.2.8.33185 > 112.26.2.1.targus-getdata1: Flags [.], seq 2857:4285, ack 0, win 913, options [nop,nop,TS val 1121870 ecr 1354350,mptcp dss ack 3644063658 seq 3528671306 subseq 388417 len 1428 csum 0xc26a], length 1428
17:35:45.538870 IP 112.26.2.1.targus-getdata1 > 112.26.2.8.33185: Flags [.], ack 4285, win 24324, options [nop,nop,TS val 1355328 ecr 1121870,mptcp dss ack 3528597050], length 0
17:35:45.541807 IP 112.26.2.1.targus-getdata1 > 112.26.2.8.33185: Flags [.], ack 4285, win 24324, options [nop,nop,TS val 1355328 ecr 1121870,mptcp dss ack 3528597050], length 0
17:35:45.618023 IP 112.26.2.8.33185 > 112.26.2.1.targus-getdata1: Flags [.], seq 4285:5713, ack 0, win 913, options [nop,nop,TS val 1122084 ecr 1354584,mptcp dss ack 3644063658 seq 3528681302 subseq 389845 len 1428 csum 0xdf0b], length 1428
17:35:45.667234 IP 112.26.2.8.33185 > 112.26.2.1.targus-getdata1: Flags [.], seq 5713:7141, ack 0, win 913, options [nop,nop,TS val 1122084 ecr 1354584,mptcp dss ack 3644063658 seq 3528682730 subseq 391273 len 1428 csum 0x7e9a], length 1428
17:35:45.810300 IP 112.26.2.8.33185 > 112.26.2.1.targus-getdata1: Flags [.], seq 7141:8569, ack 0, win 913, options [nop,nop,TS val 1122415 ecr 1354822,mptcp dss ack 3644063658 seq 3528692726 subseq 392701 len 1428 csum 0x16de], length 1428
17:35:45.810628 IP 112.26.2.1.targus-getdata1 > 112.26.2.8.33185: Flags [.], ack 8569, win 24324, options [nop,nop,TS val 1355599 ecr 1122084,mptcp dss ack 3528597050], length 0
17:35:45.907121 IP 112.26.2.1.targus-getdata1 > 112.26.2.8.33185: Flags [.], ack 8569, win 24324, options [nop,nop,TS val 1355599 ecr 1122084,mptcp dss ack 3528597050], length 0
17:35:45.963516 IP 112.26.2.8.33185 > 112.26.2.1.targus-getdata1: Flags [.], seq 8569:9997, ack 0, win 913, options [nop,nop,TS val 1122415 ecr 1354822,mptcp dss ack 3644063658 seq 3528694154 subseq 394129 len 1428 csum 0x515a], length 1428
17:35:46.044167 IP 112.26.2.8.33185 > 112.26.2.1.targus-getdata1: Flags [.], seq 9997:11425, ack 0, win 913, options [nop,nop,TS val 1122415 ecr 1354822,mptcp dss ack 3644063658 seq 3528695582 subseq 395557 len 1428 csum 0xa930], length 1428
17:35:46.052045 IP 112.26.2.1.targus-getdata1 > 112.26.2.8.33185: Flags [.], ack 11425, win 24447, options [nop,nop,TS val 1355841 ecr 1122415,mptcp dss ack 3528684158], length 0
17:35:46.103854 IP 112.26.2.1.targus-getdata1 > 112.26.2.8.33185: Flags [.], ack 11425, win 24447, options [nop,nop,TS val 1355841 ecr 1122415,mptcp dss ack 3528684158], length 0
17:35:46.154356 IP 112.26.2.8.33185 > 112.26.2.1.targus-getdata1: Flags [.], seq 11425:12853, ack 0, win 913, options [nop,nop,TS val 1122415 ecr 1354822,mptcp dss ack 3644063658 seq 3528697010 subseq 396985 len 1428 csum 0x6fae], length 1428
17:35:46.204501 IP 112.26.2.8.33185 > 112.26.2.1.targus-getdata1: Flags [.], seq 12853:14281, ack 0, win 913, options [nop,nop,TS val 1122415 ecr 1354822,mptcp dss ack 3644063658 seq 3528698438 subseq 398413 len 1428 csum 0xec6e], length 1428
17:35:46.269772 IP 112.26.2.8.33185 > 112.26.2.1.targus-getdata1: Flags [.], seq 14281:15709, ack 0, win 913, options [nop,nop,TS val 1122415 ecr 1354822,mptcp dss ack 3644063658 seq 3528699866 subseq 399841 len 1428 csum 0x84a3], length 1428
17:35:46.334638 IP 112.26.2.8.33185 > 112.26.2.1.targus-getdata1: Flags [.], seq 15709:17137, ack 0, win 913, options [nop,nop,TS val 1122647 ecr 1355005,mptcp dss ack 3644063658 seq 3528707006 subseq 401269 len 1428 csum 0x5c45], length 1428
17:35:46.334967 IP 112.26.2.1.targus-getdata1 > 112.26.2.8.33185: Flags [.], ack 17137, win 24447, options [nop,nop,TS val 1356124 ecr 1122415,mptcp dss ack 3528684158], length 0
17:35:46.413105 IP 112.26.2.1.targus-getdata1 > 112.26.2.8.33185: Flags [.], ack 17137, win 24447, options [nop,nop,TS val 1356124 ecr 1122415,mptcp dss ack 3528684158], length 0
17:35:46.487187 IP 112.26.2.8.33185 > 112.26.2.1.targus-getdata1: Flags [.], seq 17137:18565, ack 0, win 913, options [nop,nop,TS val 1122647 ecr 1355005,mptcp dss ack 3644063658 seq 3528708434 subseq 402697 len 1428 csum 0x4fe6], length 1428
17:35:46.533011 IP 112.26.2.8.33185 > 112.26.2.1.targus-getdata1: Flags [.], seq 18565:19993, ack 0, win 913, options [nop,nop,TS val 1122647 ecr 1355005,mptcp dss ack 3644063658 seq 3528709862 subseq 404125 len 1428 csum 0xc284], length 1428
17:35:46.623497 IP 112.26.2.8.33185 > 112.26.2.1.targus-getdata1: Flags [.], seq 19993:21421, ack 0, win 913, options [nop,nop,TS val 1122838 ecr 1355328,mptcp dss ack 3644063658 seq 3528712718 subseq 405553 len 1428 csum 0x292e], length 1428
17:35:46.623783 IP 112.26.2.1.targus-getdata1 > 112.26.2.8.33185: Flags [.], ack 21421, win 24447, options [nop,nop,TS val 1356412 ecr 1122647,mptcp dss ack 3528684158], length 0
17:35:46.657772 IP 112.26.2.1.targus-getdata1 > 112.26.2.8.33185: Flags [.], ack 21421, win 24447, options [nop,nop,TS val 1356412 ecr 1122647,mptcp dss ack 3528684158], length 0
17:35:46.704512 IP 112.26.2.8.33185 > 112.26.2.1.targus-getdata1: Flags [.], seq 21421:22849, ack 0, win 913, options [nop,nop,TS val 1122838 ecr 1355328,mptcp dss ack 3644063658 seq 3528714146 subseq 406981 len 1428 csum 0xaf92], length 1428
17:35:46.802966 IP 112.26.2.8.33185 > 112.26.2.1.targus-getdata1: Flags [.], seq 22849:24277, ack 0, win 913, options [nop,nop,TS val 1122838 ecr 1355328,mptcp dss ack 3644063658 seq 3528715574 subseq 408409 len 1428 csum 0x7726], length 1428
17:35:46.858830 IP 112.26.2.1.targus-getdata1 > 112.26.2.8.33185: Flags [.], ack 24277, win 24447, options [nop,nop,TS val 1356648 ecr 1122838,mptcp dss ack 3528684158], length 0
17:35:46.889208 IP 112.26.2.8.33185 > 112.26.2.1.targus-getdata1: Flags [.], seq 24277:25705, ack 0, win 913, options [nop,nop,TS val 1122838 ecr 1355328,mptcp dss ack 3644063658 seq 3528717002 subseq 409837 len 1428 csum 0x3e27], length 1428
17:35:46.942014 IP 112.26.2.1.targus-getdata1 > 112.26.2.8.33185: Flags [.], ack 24277, win 24447, options [nop,nop,TS val 1356648 ecr 1122838,mptcp dss ack 3528684158], length 0
17:35:47.037238 IP 112.26.2.8.33185 > 112.26.2.1.targus-getdata1: Flags [.], seq 25705:27133, ack 0, win 913, options [nop,nop,TS val 1123351 ecr 1355599,mptcp dss ack 3644063658 seq 3528739850 subseq 411265 len 1428 csum 0x4f7e], length 1428
17:35:47.037516 IP 112.26.2.1.targus-getdata1 > 112.26.2.8.33185: Flags [.], ack 27133, win 24558, options [nop,nop,TS val 1356825 ecr 1122838,mptcp dss ack 3528736994], length 0
17:35:47.113673 IP 112.26.2.8.33185 > 112.26.2.1.targus-getdata1: Flags [.], seq 27133:28561, ack 0, win 913, options [nop,nop,TS val 1123351 ecr 1355599,mptcp dss ack 3644063658 seq 3528741278 subseq 412693 len 1428 csum 0x2dca], length 1428
17:35:47.161401 IP 112.26.2.1.targus-getdata1 > 112.26.2.8.33185: Flags [.], ack 27133, win 24558, options [nop,nop,TS val 1356825 ecr 1122838,mptcp dss ack 3528736994], length 0
17:35:47.196671 IP 112.26.2.8.33185 > 112.26.2.1.targus-getdata1: Flags [.], seq 28561:29989, ack 0, win 913, options [nop,nop,TS val 1123351 ecr 1355599,mptcp dss ack 3644063658 seq 3528742706 subseq 414121 len 1428 csum 0xbe98], length 1428
17:35:47.197084 IP 112.26.2.1.targus-getdata1 > 112.26.2.8.33185: Flags [.], ack 29989, win 24521, options [nop,nop,TS val 1356986 ecr 1123351,mptcp dss ack 3528744134], length 0
17:35:47.267626 IP 112.26.2.1.targus-getdata1 > 112.26.2.8.33185: Flags [.], ack 29989, win 24521, options [nop,nop,TS val 1356986 ecr 1123351,mptcp dss ack 3528744134], length 0
17:35:47.328863 IP 112.26.2.8.33185 > 112.26.2.1.targus-getdata1: Flags [.], seq 29989:31417, ack 0, win 913, options [nop,nop,TS val 1123351 ecr 1355599,mptcp dss ack 3644063658 seq 3528744134 subseq 415549 len 1428 csum 0xba8d], length 1428
17:35:47.423975 IP 112.26.2.8.33185 > 112.26.2.1.targus-getdata1: Flags [.], seq 32845:34273, ack 0, win 913, options [nop,nop,TS val 1123844 ecr 1356124,mptcp dss ack 3644063658 seq 3528759842 subseq 418405 len 1428 csum 0x914f], length 1428
17:35:47.424329 IP 112.26.2.1.targus-getdata1 > 112.26.2.8.33185: Flags [.], ack 31417, win 24499, options [nop,nop,TS val 1357213 ecr 1123351,nop,nop,sack 1 {32845:34273},mptcp dss ack 3528745562], length 0
17:35:47.502572 IP 112.26.2.1.targus-getdata1 > 112.26.2.8.33185: Flags [.], ack 31417, win 24499, options [nop,nop,TS val 1357213 ecr 1123351,nop,nop,sack 1 {32845:34273},mptcp dss ack 3528745562], length 0
17:35:47.579458 IP 112.26.2.8.33185 > 112.26.2.1.targus-getdata1: Flags [.], seq 34273:35701, ack 0, win 913, options [nop,nop,TS val 1123844 ecr 1356124,mptcp dss ack 3644063658 seq 3528761270 subseq 419833 len 1428 csum 0x658f], length 1428
17:35:47.579775 IP 112.26.2.1.targus-getdata1 > 112.26.2.8.33185: Flags [.], ack 31417, win 24499, options [nop,nop,TS val 1357368 ecr 1123351,nop,nop,sack 1 {32845:35701},mptcp dss ack 3528745562], length 0
17:35:47.654157 IP 112.26.2.1.targus-getdata1 > 112.26.2.8.33185: Flags [.], ack 31417, win 24499, options [nop,nop,TS val 1357368 ecr 1123351,nop,nop,sack 1 {32845:35701},mptcp dss ack 3528745562], length 0
17:35:47.751409 IP 112.26.2.8.33185 > 112.26.2.1.targus-getdata1: Flags [.], seq 35701:37129, ack 0, win 913, options [nop,nop,TS val 1123844 ecr 1356124,mptcp dss ack 3644063658 seq 3528762698 subseq 421261 len 1428 csum 0x6291], length 1428
17:35:47.751777 IP 112.26.2.1.targus-getdata1 > 112.26.2.8.33185: Flags [.], ack 31417, win 24499, options [nop,nop,TS val 1357540 ecr 1123351,nop,nop,sack 1 {32845:37129},mptcp dss ack 3528745562], length 0
17:35:47.784700 IP 112.26.2.8.33185 > 112.26.2.1.targus-getdata1: Flags [.], seq 37129:38557, ack 0, win 913, options [nop,nop,TS val 1123844 ecr 1356124,mptcp dss ack 3644063658 seq 3528764126 subseq 422689 len 1428 csum 0xe4a7], length 1428
17:35:47.785010 IP 112.26.2.1.targus-getdata1 > 112.26.2.8.33185: Flags [.], ack 31417, win 24499, options [nop,nop,TS val 1357574 ecr 1123351,nop,nop,sack 1 {32845:38557},mptcp dss ack 3528745562], length 0
17:35:47.838350 IP 112.26.2.1.targus-getdata1 > 112.26.2.8.33185: Flags [.], ack 31417, win 24499, options [nop,nop,TS val 1357540 ecr 1123351,nop,nop,sack 1 {32845:37129},mptcp dss ack 3528745562], length 0
17:35:47.903198 IP 112.26.2.8.33185 > 112.26.2.1.targus-getdata1: Flags [.], seq 38557:39985, ack 0, win 913, options [nop,nop,TS val 1123844 ecr 1356124,mptcp dss ack 3644063658 seq 3528765554 subseq 424117 len 1428 csum 0x788], length 1428
17:35:47.903548 IP 112.26.2.1.targus-getdata1 > 112.26.2.8.33185: Flags [.], ack 31417, win 24499, options [nop,nop,TS val 1357692 ecr 1123351,nop,nop,sack 1 {32845:39985},mptcp dss ack 3528745562], length 0
17:35:47.995481 IP 112.26.2.1.targus-getdata1 > 112.26.2.8.33185: Flags [.], ack 31417, win 24499, options [nop,nop,TS val 1357574 ecr 1123351,nop,nop,sack 1 {32845:38557},mptcp dss ack 3528745562], length 0
17:35:48.023051 IP 112.26.2.1.targus-getdata1 > 112.26.2.8.33185: Flags [.], ack 31417, win 24499, options [nop,nop,TS val 1357692 ecr 1123351,nop,nop,sack 1 {32845:39985},mptcp dss ack 3528745562], length 0
17:35:48.126857 IP 112.26.2.8.33185 > 112.26.2.1.targus-getdata1: Flags [.], seq 39985:41413, ack 0, win 913, options [nop,nop,TS val 1123844 ecr 1356124,mptcp dss ack 3644063658 seq 3528766982 subseq 425545 len 1428 csum 0x7d1d], length 1428
17:35:48.127250 IP 112.26.2.1.targus-getdata1 > 112.26.2.8.33185: Flags [.], ack 31417, win 24499, options [nop,nop,TS val 1357915 ecr 1123351,nop,nop,sack 1 {32845:41413},mptcp dss ack 3528745562], length 0
17:35:48.195347 IP 112.26.2.8.33185 > 112.26.2.1.targus-getdata1: Flags [.], seq 42841:44269, ack 0, win 913, options [nop,nop,TS val 1124229 ecr 1356412,mptcp dss ack 3644063658 seq 3528776978 subseq 428401 len 1428 csum 0x57cc], length 1428
17:35:48.195622 IP 112.26.2.1.targus-getdata1 > 112.26.2.8.33185: Flags [.], ack 31417, win 24499, options [nop,nop,TS val 1357984 ecr 1123351,nop,nop,sack 2 {42841:44269}{32845:41413},mptcp dss ack 3528745562], length 0
17:35:48.296460 IP 112.26.2.1.targus-getdata1 > 112.26.2.8.33185: Flags [.], ack 31417, win 24499, options [nop,nop,TS val 1357915 ecr 1123351,nop,nop,sack 1 {32845:41413},mptcp dss ack 3528745562], length 0
17:35:48.349315 IP 112.26.2.8.33185 > 112.26.2.1.targus-getdata1: Flags [.], seq 44269:45697, ack 0, win 913, options [nop,nop,TS val 1124229 ecr 1356412,mptcp dss ack 3644063658 seq 3528778406 subseq 429829 len 1428 csum 0x399f], length 1428
17:35:48.349598 IP 112.26.2.1.targus-getdata1 > 112.26.2.8.33185: Flags [.], ack 31417, win 24499, options [nop,nop,TS val 1358138 ecr 1123351,nop,nop,sack 2 {42841:45697}{32845:41413},mptcp dss ack 3528745562], length 0
17:35:48.398768 IP 112.26.2.1.targus-getdata1 > 112.26.2.8.33185: Flags [.], ack 31417, win 24499, options [nop,nop,TS val 1357984 ecr 1123351,nop,nop,sack 2 {42841:44269}{32845:41413},mptcp dss ack 3528745562], length 0
17:35:48.518829 IP 112.26.2.8.33185 > 112.26.2.1.targus-getdata1: Flags [.], seq 47125:48553, ack 0, win 913, options [nop,nop,TS val 1124411 ecr 1356648,mptcp dss ack 3644063658 seq 3528792686 subseq 432685 len 1428 csum 0x2da3], length 1428
17:35:48.519180 IP 112.26.2.1.targus-getdata1 > 112.26.2.8.33185: Flags [.], ack 31417, win 24499, options [nop,nop,TS val 1358307 ecr 1123351,nop,nop,sack 2 {47125:48553}{42841:45697},mptcp dss ack 3528745562], length 0
17:35:48.606609 IP 112.26.2.8.33185 > 112.26.2.1.targus-getdata1: Flags [.], seq 48553:49981, ack 0, win 913, options [nop,nop,TS val 1124411 ecr 1356648,mptcp dss ack 3644063658 seq 3528794114 subseq 434113 len 1428 csum 0x44f6], length 1428
17:35:48.606902 IP 112.26.2.1.targus-getdata1 > 112.26.2.8.33185: Flags [.], ack 31417, win 24499, options [nop,nop,TS val 1358395 ecr 1123351,nop,nop,sack 2 {47125:49981}{42841:45697},mptcp dss ack 3528745562], length 0
17:35:48.669955 IP 112.26.2.1.targus-getdata1 > 112.26.2.8.33185: Flags [.], ack 31417, win 24499, options [nop,nop,TS val 1358138 ecr 1123351,nop,nop,sack 2 {42841:45697}{32845:41413},mptcp dss ack 3528745562], length 0
17:35:48.742736 IP 112.26.2.8.33185 > 112.26.2.1.targus-getdata1: Flags [.], seq 49981:51409, ack 0, win 913, options [nop,nop,TS val 1124411 ecr 1356648,mptcp dss ack 3644063658 seq 3528795542 subseq 435541 len 1428 csum 0xc4f3], length 1428
17:35:48.743027 IP 112.26.2.1.targus-getdata1 > 112.26.2.8.33185: Flags [.], ack 31417, win 24499, options [nop,nop,TS val 1358531 ecr 1123351,nop,nop,sack 2 {47125:51409}{42841:45697},mptcp dss ack 3528745562], length 0
17:35:48.819648 IP 112.26.2.8.33185 > 112.26.2.1.targus-getdata1: Flags [.], seq 51409:52837, ack 0, win 913, options [nop,nop,TS val 1124618 ecr 1356825,mptcp dss ack 3644063658 seq 3528809822 subseq 436969 len 1428 csum 0xdd3a], length 1428
17:35:48.819970 IP 112.26.2.1.targus-getdata1 > 112.26.2.8.33185: Flags [.], ack 31417, win 24499, options [nop,nop,TS val 1358608 ecr 1123351,nop,nop,sack 2 {47125:52837}{42841:45697},mptcp dss ack 3528745562], length 0
17:35:48.915015 IP 112.26.2.1.targus-getdata1 > 112.26.2.8.33185: Flags [.], ack 31417, win 24499, options [nop,nop,TS val 1358307 ecr 1123351,nop,nop,sack 2 {47125:48553}{42841:45697},mptcp dss ack 3528745562], length 0
17:35:48.983911 IP 112.26.2.1.targus-getdata1 > 112.26.2.8.33185: Flags [.], ack 31417, win 24499, options [nop,nop,TS val 1358395 ecr 1123351,nop,nop,sack 2 {47125:49981}{42841:45697},mptcp dss ack 3528745562], length 0
17:35:49.039048 IP 112.26.2.1.targus-getdata1 > 112.26.2.8.33185: Flags [.], ack 31417, win 24499, options [nop,nop,TS val 1358531 ecr 1123351,nop,nop,sack 2 {47125:51409}{42841:45697},mptcp dss ack 3528745562], length 0
17:35:49.086316 IP 112.26.2.1.targus-getdata1 > 112.26.2.8.33185: Flags [.], ack 31417, win 24499, options [nop,nop,TS val 1358608 ecr 1123351,nop,nop,sack 2 {47125:52837}{42841:45697},mptcp dss ack 3528745562], length 0
17:35:49.151079 IP 112.26.2.8.33185 > 112.26.2.1.targus-getdata1: Flags [.], seq 55693:57121, ack 0, win 913, options [nop,nop,TS val 1124818 ecr 1356986,mptcp dss ack 3644063658 seq 3528816962 subseq 441253 len 1428 csum 0xe072], length 1428
17:35:49.151387 IP 112.26.2.1.targus-getdata1 > 112.26.2.8.33185: Flags [.], ack 31417, win 24499, options [nop,nop,TS val 1358940 ecr 1123351,nop,nop,sack 2 {55693:57121}{47125:52837},mptcp dss ack 3528745562], length 0
17:35:49.214747 IP 112.26.2.8.33185 > 112.26.2.1.targus-getdata1: Flags [.], seq 58549:59977, ack 0, win 913, options [nop,nop,TS val 1125181 ecr 1357368,mptcp dss ack 3644063658 seq 3528826958 subseq 444109 len 1428 csum 0x738b], length 1428
17:35:49.215069 IP 112.26.2.1.targus-getdata1 > 112.26.2.8.33185: Flags [.], ack 31417, win 24499, options [nop,nop,TS val 1359004 ecr 1123351,nop,nop,sack 2 {58549:59977}{55693:57121},mptcp dss ack 3528745562], length 0
17:35:49.272041 IP 112.26.2.8.33185 > 112.26.2.1.targus-getdata1: Flags [.], seq 59977:61405, ack 0, win 913, options [nop,nop,TS val 1125181 ecr 1357368,mptcp dss ack 3644063658 seq 3528828386 subseq 445537 len 1428 csum 0x17f4], length 1428
17:35:49.272416 IP 112.26.2.1.targus-getdata1 > 112.26.2.8.33185: Flags [.], ack 31417, win 24499, options [nop,nop,TS val 1359061 ecr 1123351,nop,nop,sack 2 {58549:61405}{55693:57121},mptcp dss ack 3528745562], length 0
17:35:49.327562 IP 112.26.2.1.targus-getdata1 > 112.26.2.8.33185: Flags [.], ack 31417, win 24499, options [nop,nop,TS val 1358940 ecr 1123351,nop,nop,sack 2 {55693:57121}{47125:52837},mptcp dss ack 3528745562], length 0
17:35:49.367607 IP 112.26.2.8.33185 > 112.26.2.1.targus-getdata1: Flags [.], seq 62833:64261, ack 0, win 913, options [nop,nop,TS val 1125181 ecr 1357368,mptcp dss ack 3644063658 seq 3528831242 subseq 448393 len 1428 csum 0x7b25], length 1428
17:35:49.367952 IP 112.26.2.1.targus-getdata1 > 112.26.2.8.33185: Flags [.], ack 31417, win 24499, options [nop,nop,TS val 1359157 ecr 1123351,nop,nop,sack 2 {62833:64261}{58549:61405},mptcp dss ack 3528745562], length 0
17:35:49.458910 IP 112.26.2.1.targus-getdata1 > 112.26.2.8.33185: Flags [.], ack 31417, win 24499, options [nop,nop,TS val 1359004 ecr 1123351,nop,nop,sack 2 {58549:59977}{55693:57121},mptcp dss ack 3528745562], length 0
17:35:49.475847 IP 112.26.2.8.33185 > 112.26.2.1.targus-getdata1: Flags [.], seq 64261:65689, ack 0, win 913, options [nop,nop,TS val 1125181 ecr 1357368,mptcp dss ack 3644063658 seq 3528832670 subseq 449821 len 1428 csum 0x6f13], length 1428
17:35:49.476053 IP 112.26.2.1.targus-getdata1 > 112.26.2.8.33185: Flags [.], ack 31417, win 24499, options [nop,nop,TS val 1359265 ecr 1123351,nop,nop,sack 2 {62833:65689}{58549:61405},mptcp dss ack 3528745562], length 0
17:35:49.561137 IP 112.26.2.1.targus-getdata1 > 112.26.2.8.33185: Flags [.], ack 31417, win 24499, options [nop,nop,TS val 1359061 ecr 1123351,nop,nop,sack 2 {58549:61405}{55693:57121},mptcp dss ack 3528745562], length 0
17:35:49.612329 IP 112.26.2.1.targus-getdata1 > 112.26.2.8.33185: Flags [.], ack 31417, win 24499, options [nop,nop,TS val 1359157 ecr 1123351,nop,nop,sack 2 {62833:64261}{58549:61405},mptcp dss ack 3528745562], length 0
17:35:49.676195 IP 112.26.2.8.33185 > 112.26.2.1.targus-getdata1: Flags [.], seq 67117:68545, ack 0, win 913, options [nop,nop,TS val 1125666 ecr 1357574,mptcp dss ack 3644063658 seq 3528851234 subseq 452677 len 1428 csum 0x85f5], length 1428
17:35:49.676572 IP 112.26.2.1.targus-getdata1 > 112.26.2.8.33185: Flags [.], ack 31417, win 24499, options [nop,nop,TS val 1359465 ecr 1123351,nop,nop,sack 2 {67117:68545}{62833:65689},mptcp dss ack 3528745562], length 0
17:35:49.713498 IP 112.26.2.8.33185 > 112.26.2.1.targus-getdata1: Flags [.], seq 31417:32845, ack 0, win 913, options [nop,nop,TS val 1125714 ecr 1357692,mptcp dss ack 3644063658 seq 3528745562 subseq 416977 len 1428 csum 0x364e], length 1428
17:35:49.713851 IP 112.26.2.1.targus-getdata1 > 112.26.2.8.33185: Flags [.], ack 41413, win 24031, options [nop,nop,TS val 1359503 ecr 1125714,nop,nop,sack 2 {67117:68545}{62833:65689},mptcp dss ack 3528775550], length 0
17:35:49.770671 IP 112.26.2.1.targus-getdata1 > 112.26.2.8.33185: Flags [.], ack 31417, win 24499, options [nop,nop,TS val 1359265 ecr 1123351,nop,nop,sack 2 {62833:65689}{58549:61405},mptcp dss ack 3528745562], length 0
17:35:49.827223 IP 112.26.2.1.targus-getdata1 > 112.26.2.8.33185: Flags [.], ack 31417, win 24499, options [nop,nop,TS val 1359465 ecr 1123351,nop,nop,sack 2 {67117:68545}{62833:65689},mptcp dss ack 3528745562], length 0
17:35:49.897159 IP 112.26.2.8.33185 > 112.26.2.1.targus-getdata1: Flags [.], seq 68545:69973, ack 0, win 913, options [nop,nop,TS val 1126004 ecr 1357915,mptcp dss ack 3644063658 seq 3528868370 subseq 454105 len 1428 csum 0x9f27], length 1428
17:35:49.897487 IP 112.26.2.1.targus-getdata1 > 112.26.2.8.33185: Flags [.], ack 41413, win 24031, options [nop,nop,TS val 1359686 ecr 1125714,nop,nop,sack 2 {67117:69973}{62833:65689},mptcp dss ack 3528775550], length 0
17:35:49.968090 IP 112.26.2.1.targus-getdata1 > 112.26.2.8.33185: Flags [.], ack 41413, win 24031, options [nop,nop,TS val 1359503 ecr 1125714,nop,nop,sack 2 {67117:68545}{62833:65689},mptcp dss ack 3528775550], length 0
17:35:50.000447 IP 112.26.2.8.33185 > 112.26.2.1.targus-getdata1: Flags [.], seq 41413:42841, ack 0, win 913, options [nop,nop,TS val 1126049 ecr 1357984,mptcp dss ack 3644063658 seq 3528775550 subseq 426973 len 1428 csum 0xf97b], length 1428
17:35:50.000795 IP 112.26.2.1.targus-getdata1 > 112.26.2.8.33185: Flags [.], ack 45697, win 23965, options [nop,nop,TS val 1359789 ecr 1126049,nop,nop,sack 2 {67117:69973}{62833:65689},mptcp dss ack 3528779834], length 0
17:35:50.087561 IP 112.26.2.1.targus-getdata1 > 112.26.2.8.33185: Flags [.], ack 41413, win 24031, options [nop,nop,TS val 1359686 ecr 1125714,nop,nop,sack 2 {67117:69973}{62833:65689},mptcp dss ack 3528775550], length 0
17:35:50.136982 IP 112.26.2.1.targus-getdata1 > 112.26.2.8.33185: Flags [.], ack 45697, win 23965, options [nop,nop,TS val 1359789 ecr 1126049,nop,nop,sack 2 {67117:69973}{62833:65689},mptcp dss ack 3528779834], length 0
17:35:50.210024 IP 112.26.2.8.33185 > 112.26.2.1.targus-getdata1: Flags [.], seq 45697:47125, ack 0, win 913, options [nop,nop,TS val 1126433 ecr 1358307,mptcp dss ack 3644063658 seq 3528779834 subseq 431257 len 1428 csum 0x7b12], length 1428
17:35:50.210397 IP 112.26.2.1.targus-getdata1 > 112.26.2.8.33185: Flags [.], ack 52837, win 23539, options [nop,nop,TS val 1359999 ecr 1126433,nop,nop,sack 2 {67117:69973}{62833:65689},mptcp dss ack 3528811250], length 0
17:35:50.287635 IP 112.26.2.1.targus-getdata1 > 112.26.2.8.33185: Flags [.], ack 52837, win 23539, options [nop,nop,TS val 1359999 ecr 1126433,nop,nop,sack 2 {67117:69973}{62833:65689},mptcp dss ack 3528811250], length 0
17:35:50.359389 IP 112.26.2.8.33185 > 112.26.2.1.targus-getdata1: Flags [.], seq 69973:71401, ack 0, win 913, options [nop,nop,TS val 1126548 ecr 1358395,mptcp dss ack 3644063658 seq 3528891218 subseq 455533 len 1428 csum 0xb8b5], length 1428
17:35:50.359718 IP 112.26.2.1.targus-getdata1 > 112.26.2.8.33185: Flags [.], ack 52837, win 23852, options [nop,nop,TS val 1360148 ecr 1126433,nop,nop,sack 2 {67117:71401}{62833:65689},mptcp dss ack 3528811250], length 0
17:35:50.427554 IP 112.26.2.1.targus-getdata1 > 112.26.2.8.33185: Flags [.], ack 52837, win 23852, options [nop,nop,TS val 1360148 ecr 1126433,nop,nop,sack 2 {67117:71401}{62833:65689},mptcp dss ack 3528811250], length 0
17:35:50.470922 IP 112.26.2.8.33185 > 112.26.2.1.targus-getdata1: Flags [.], seq 52837:54265, ack 0, win 913, options [nop,nop,TS val 1126761 ecr 1358940,mptcp dss ack 3644063658 seq 3528811250 subseq 438397 len 1428 csum 0x30f4], length 1428
17:35:50.471211 IP 112.26.2.1.targus-getdata1 > 112.26.2.8.33185: Flags [.], ack 54265, win 23830, options [nop,nop,TS val 1360259 ecr 1126761,nop,nop,sack 2 {67117:71401}{62833:65689},mptcp dss ack 3528812678], length 0
17:35:50.544020 IP 112.26.2.8.33185 > 112.26.2.1.targus-getdata1: Flags [.], seq 54265:55693, ack 0, win 913, options [nop,nop,TS val 1126761 ecr 1358940,mptcp dss ack 3644063658 seq 3528812678 subseq 439825 len 1428 csum 0xd601], length 1428
17:35:50.544349 IP 112.26.2.1.targus-getdata1 > 112.26.2.8.33185: Flags [.], ack 57121, win 23741, options [nop,nop,TS val 1360333 ecr 1126761,nop,nop,sack 2 {67117:71401}{62833:65689},mptcp dss ack 3528818390], length 0
17:35:50.633731 IP 112.26.2.1.targus-getdata1 > 112.26.2.8.33185: Flags [.], ack 54265, win 23830, options [nop,nop,TS val 1360259 ecr 1126761,nop,nop,sack 2 {67117:71401}{62833:65689},mptcp dss ack 3528812678], length 0
17:35:50.685123 IP 112.26.2.8.33185 > 112.26.2.1.targus-getdata1: Flags [.], seq 57121:58549, ack 0, win 913, options [nop,nop,TS val 1126875 ecr 1359004,mptcp dss ack 3644063658 seq 3528818390 subseq 442681 len 1428 csum 0xe2df], length 1428
17:35:50.685493 IP 112.26.2.1.targus-getdata1 > 112.26.2.8.33185: Flags [.], ack 61405, win 23710, options [nop,nop,TS val 1360473 ecr 1126875,nop,nop,sack 2 {67117:71401}{62833:65689},mptcp dss ack 3528829814], length 0
17:35:50.786852 IP 112.26.2.1.targus-getdata1 > 112.26.2.8.33185: Flags [.], ack 57121, win 23741, options [nop,nop,TS val 1360333 ecr 1126761,nop,nop,sack 2 {67117:71401}{62833:65689},mptcp dss ack 3528818390], length 0
17:35:50.842263 IP 112.26.2.1.targus-getdata1 > 112.26.2.8.33185: Flags [.], ack 61405, win 23710, options [nop,nop,TS val 1360473 ecr 1126875,nop,nop,sack 2 {67117:71401}{62833:65689},mptcp dss ack 3528829814], length 0
17:35:50.905410 IP 112.26.2.8.33185 > 112.26.2.1.targus-getdata1: Flags [.], seq 71401:72829, ack 0, win 913, options [nop,nop,TS val 1127037 ecr 1359061,mptcp dss ack 3644063658 seq 3528916922 subseq 456961 len 1428 csum 0x5131], length 1428
17:35:50.905699 IP 112.26.2.1.targus-getdata1 > 112.26.2.8.33185: Flags [.], ack 61405, win 23836, options [nop,nop,TS val 1360694 ecr 1126875,nop,nop,sack 2 {67117:72829}{62833:65689},mptcp dss ack 3528829814], length 0
17:35:50.958179 IP 112.26.2.8.33185 > 112.26.2.1.targus-getdata1: Flags [.], seq 61405:62833, ack 0, win 913, options [nop,nop,TS val 1127037 ecr 1359157,mptcp dss ack 3644063658 seq 3528829814 subseq 446965 len 1428 csum 0xf53a], length 1428
17:35:50.958555 IP 112.26.2.1.targus-getdata1 > 112.26.2.8.33185: Flags [.], ack 65689, win 23748, options [nop,nop,TS val 1360747 ecr 1127037,nop,nop,sack 1 {67117:72829},mptcp dss ack 3528842666], length 0
17:35:51.020565 IP 112.26.2.1.targus-getdata1 > 112.26.2.8.33185: Flags [.], ack 61405, win 23836, options [nop,nop,TS val 1360694 ecr 1126875,nop,nop,sack 2 {67117:72829}{62833:65689},mptcp dss ack 3528829814], length 0
17:35:51.114881 IP 112.26.2.1.targus-getdata1 > 112.26.2.8.33185: Flags [.], ack 65689, win 23748, options [nop,nop,TS val 1360747 ecr 1127037,nop,nop,sack 1 {67117:72829},mptcp dss ack 3528842666], length 0
17:35:51.163127 IP 112.26.2.8.33185 > 112.26.2.1.targus-getdata1: Flags [.], seq 72829:74257, ack 0, win 913, options [nop,nop,TS val 1127246 ecr 1359265,mptcp dss ack 3644063658 seq 3528929774 subseq 458389 len 1428 csum 0xc4f2], length 1428
17:35:51.163491 IP 112.26.2.1.targus-getdata1 > 112.26.2.8.33185: Flags [.], ack 65689, win 23890, options [nop,nop,TS val 1360952 ecr 1127037,nop,nop,sack 1 {67117:74257},mptcp dss ack 3528842666], length 0
17:35:51.284891 IP 112.26.2.8.33185 > 112.26.2.1.targus-getdata1: Flags [.], seq 65689:67117, ack 0, win 913, options [nop,nop,TS val 1127246 ecr 1359465,mptcp dss ack 3644063658 seq 3528842666 subseq 451249 len 1428 csum 0x6161], length 1428
17:35:51.285223 IP 112.26.2.1.targus-getdata1 > 112.26.2.8.33185: Flags [.], ack 74257, win 23758, options [nop,nop,TS val 1361074 ecr 1127246,mptcp dss ack 3528881222], length 0
17:35:51.354412 IP 112.26.2.1.targus-getdata1 > 112.26.2.8.33185: Flags [.], ack 65689, win 23890, options [nop,nop,TS val 1360952 ecr 1127037,nop,nop,sack 1 {67117:74257},mptcp dss ack 3528842666], length 0
17:35:51.410155 IP 112.26.2.8.33185 > 112.26.2.1.targus-getdata1: Flags [.], seq 74257:75685, ack 0, win 913, options [nop,nop,TS val 1127476 ecr 1359503,mptcp dss ack 3644063658 seq 3528938342 subseq 459817 len 1428 csum 0x2d53], length 1428
17:35:51.410517 IP 112.26.2.1.targus-getdata1 > 112.26.2.8.33185: Flags [.], ack 75685, win 24182, options [nop,nop,TS val 1361199 ecr 1127476,mptcp dss ack 3528881222], length 0
17:35:51.476635 IP 112.26.2.1.targus-getdata1 > 112.26.2.8.33185: Flags [.], ack 74257, win 23758, options [nop,nop,TS val 1361074 ecr 1127246,mptcp dss ack 3528881222], length 0
17:35:51.544820 IP 112.26.2.8.33185 > 112.26.2.1.targus-getdata1: Flags [.], seq 75685:77113, ack 0, win 913, options [nop,nop,TS val 1127476 ecr 1359503,mptcp dss ack 3644063658 seq 3528939770 subseq 461245 len 1428 csum 0xc748], length 1428
17:35:51.545300 IP 112.26.2.1.targus-getdata1 > 112.26.2.8.33185: Flags [.], ack 77113, win 24182, options [nop,nop,TS val 1361333 ecr 1127476,mptcp dss ack 3528881222], length 0
17:35:51.606288 IP 112.26.2.1.targus-getdata1 > 112.26.2.8.33185: Flags [.], ack 75685, win 24182, options [nop,nop,TS val 1361199 ecr 1127476,mptcp dss ack 3528881222], length 0
17:35:51.647647 IP 112.26.2.8.33185 > 112.26.2.1.targus-getdata1: Flags [.], seq 77113:78541, ack 0, win 913, options [nop,nop,TS val 1127476 ecr 1359503,mptcp dss ack 3644063658 seq 3528941198 subseq 462673 len 1428 csum 0xf89d], length 1428
17:35:51.647894 IP 112.26.2.1.targus-getdata1 > 112.26.2.8.33185: Flags [.], ack 78541, win 24182, options [nop,nop,TS val 1361436 ecr 1127476,mptcp dss ack 3528881222], length 0
17:35:51.716348 IP 112.26.2.1.targus-getdata1 > 112.26.2.8.33185: Flags [.], ack 77113, win 24182, options [nop,nop,TS val 1361333 ecr 1127476,mptcp dss ack 3528881222], length 0
17:35:51.754514 IP 112.26.2.1.targus-getdata1 > 112.26.2.8.33185: Flags [.], ack 78541, win 24182, options [nop,nop,TS val 1361436 ecr 1127476,mptcp dss ack 3528881222], length 0
17:35:51.827232 IP 112.26.2.8.33185 > 112.26.2.1.targus-getdata1: Flags [.], seq 82825:84253, ack 0, win 913, options [nop,nop,TS val 1128065 ecr 1360148,mptcp dss ack 3644063658 seq 3528972614 subseq 468385 len 1428 csum 0x8462], length 1428
17:35:51.827558 IP 112.26.2.1.targus-getdata1 > 112.26.2.8.33185: Flags [.], ack 78541, win 24182, options [nop,nop,TS val 1361616 ecr 1127476,nop,nop,sack 1 {82825:84253},mptcp dss ack 3528881222], length 0
17:35:51.894416 IP 112.26.2.1.targus-getdata1 > 112.26.2.8.33185: Flags [.], ack 78541, win 24182, options [nop,nop,TS val 1361616 ecr 1127476,nop,nop,sack 1 {82825:84253},mptcp dss ack 3528881222], length 0
17:35:51.946332 IP 112.26.2.8.33185 > 112.26.2.1.targus-getdata1: Flags [.], seq 84253:85681, ack 0, win 913, options [nop,nop,TS val 1128188 ecr 1360259,mptcp dss ack 3644063658 seq 3528979754 subseq 469813 len 1428 csum 0x6f7c], length 1428
17:35:51.946652 IP 112.26.2.1.targus-getdata1 > 112.26.2.8.33185: Flags [.], ack 78541, win 24182, options [nop,nop,TS val 1361735 ecr 1127476,nop,nop,sack 1 {82825:85681},mptcp dss ack 3528881222], length 0
17:35:52.019231 IP 112.26.2.1.targus-getdata1 > 112.26.2.8.33185: Flags [.], ack 78541, win 24182, options [nop,nop,TS val 1361735 ecr 1127476,nop,nop,sack 1 {82825:85681},mptcp dss ack 3528881222], length 0
17:35:52.070170 IP 112.26.2.8.33185 > 112.26.2.1.targus-getdata1: Flags [.], seq 85681:87109, ack 0, win 913, options [nop,nop,TS val 1128188 ecr 1360259,mptcp dss ack 3644063658 seq 3528981182 subseq 471241 len 1428 csum 0x2330], length 1428
17:35:52.070529 IP 112.26.2.1.targus-getdata1 > 112.26.2.8.33185: Flags [.], ack 78541, win 24182, options [nop,nop,TS val 1361859 ecr 1127476,nop,nop,sack 1 {82825:87109},mptcp dss ack 3528881222], length 0
17:35:52.137977 IP 112.26.2.1.targus-getdata1 > 112.26.2.8.33185: Flags [.], ack 78541, win 24182, options [nop,nop,TS val 1361859 ecr 1127476,nop,nop,sack 1 {82825:87109},mptcp dss ack 3528881222], length 0
17:35:52.165669 IP 112.26.2.8.33185 > 112.26.2.1.targus-getdata1: Flags [.], seq 87109:88537, ack 0, win 913, options [nop,nop,TS val 1128405 ecr 1360333,mptcp dss ack 3644063658 seq 3528991178 subseq 472669 len 1428 csum 0x3fa3], length 1428
17:35:52.165985 IP 112.26.2.1.targus-getdata1 > 112.26.2.8.33185: Flags [.], ack 78541, win 24182, options [nop,nop,TS val 1361955 ecr 1127476,nop,nop,sack 1 {82825:88537},mptcp dss ack 3528881222], length 0
17:35:52.251035 IP 112.26.2.8.33185 > 112.26.2.1.targus-getdata1: Flags [.], seq 88537:89965, ack 0, win 913, options [nop,nop,TS val 1128483 ecr 1360473,mptcp dss ack 3644063658 seq 3528998318 subseq 474097 len 1428 csum 0xb210], length 1428
17:35:52.251332 IP 112.26.2.1.targus-getdata1 > 112.26.2.8.33185: Flags [.], ack 78541, win 24138, options [nop,nop,TS val 1362040 ecr 1127476,nop,nop,sack 1 {82825:89965},mptcp dss ack 3528905498], length 0
17:35:52.307003 IP 112.26.2.1.targus-getdata1 > 112.26.2.8.33185: Flags [.], ack 78541, win 24182, options [nop,nop,TS val 1361955 ecr 1127476,nop,nop,sack 1 {82825:88537},mptcp dss ack 3528881222], length 0
17:35:52.383403 IP 112.26.2.1.targus-getdata1 > 112.26.2.8.33185: Flags [.], ack 78541, win 24138, options [nop,nop,TS val 1362040 ecr 1127476,nop,nop,sack 1 {82825:89965},mptcp dss ack 3528905498], length 0
17:35:52.452800 IP 112.26.2.8.33185 > 112.26.2.1.targus-getdata1: Flags [.], seq 89965:91393, ack 0, win 913, options [nop,nop,TS val 1128590 ecr 1360694,mptcp dss ack 3644063658 seq 3529001174 subseq 475525 len 1428 csum 0x8afb], length 1428
17:35:52.453093 IP 112.26.2.1.targus-getdata1 > 112.26.2.8.33185: Flags [.], ack 78541, win 24094, options [nop,nop,TS val 1362242 ecr 1127476,nop,nop,sack 1 {82825:91393},mptcp dss ack 3528908354], length 0
17:35:52.543477 IP 112.26.2.8.33185 > 112.26.2.1.targus-getdata1: Flags [.], seq 91393:92821, ack 0, win 913, options [nop,nop,TS val 1128631 ecr 1360747,mptcp dss ack 3644063658 seq 3529004030 subseq 476953 len 1428 csum 0x4e1b], length 1428
17:35:52.543867 IP 112.26.2.1.targus-getdata1 > 112.26.2.8.33185: Flags [.], ack 78541, win 24104, options [nop,nop,TS val 1362332 ecr 1127476,nop,nop,sack 1 {82825:92821},mptcp dss ack 3528908354], length 0
17:35:52.630707 IP 112.26.2.1.targus-getdata1 > 112.26.2.8.33185: Flags [.], ack 78541, win 24094, options [nop,nop,TS val 1362242 ecr 1127476,nop,nop,sack 1 {82825:91393},mptcp dss ack 3528908354], length 0
17:35:52.680458 IP 112.26.2.1.targus-getdata1 > 112.26.2.8.33185: Flags [.], ack 78541, win 24104, options [nop,nop,TS val 1362332 ecr 1127476,nop,nop,sack 1 {82825:92821},mptcp dss ack 3528908354], length 0
17:35:52.753978 IP 112.26.2.8.33185 > 112.26.2.1.targus-getdata1: Flags [.], seq 92821:94249, ack 0, win 913, options [nop,nop,TS val 1128928 ecr 1360952,mptcp dss ack 3644063658 seq 3529008314 subseq 478381 len 1428 csum 0xb0fe], length 1428
17:35:52.754339 IP 112.26.2.1.targus-getdata1 > 112.26.2.8.33185: Flags [.], ack 78541, win 24295, options [nop,nop,TS val 1362543 ecr 1127476,nop,nop,sack 1 {82825:94249},mptcp dss ack 3528945482], length 0
17:35:52.801980 IP 112.26.2.8.33185 > 112.26.2.1.targus-getdata1: Flags [.], seq 94249:95677, ack 0, win 913, options [nop,nop,TS val 1128952 ecr 1361074,mptcp dss ack 3644063658 seq 3529014026 subseq 479809 len 1428 csum 0xa557], length 1428
17:35:52.802293 IP 112.26.2.1.targus-getdata1 > 112.26.2.8.33185: Flags [.], ack 78541, win 24295, options [nop,nop,TS val 1362591 ecr 1127476,nop,nop,sack 1 {82825:95677},mptcp dss ack 3528945482], length 0
17:35:52.862893 IP 112.26.2.1.targus-getdata1 > 112.26.2.8.33185: Flags [.], ack 78541, win 24295, options [nop,nop,TS val 1362543 ecr 1127476,nop,nop,sack 1 {82825:94249},mptcp dss ack 3528945482], length 0
17:35:52.954113 IP 112.26.2.1.targus-getdata1 > 112.26.2.8.33185: Flags [.], ack 78541, win 24295, options [nop,nop,TS val 1362591 ecr 1127476,nop,nop,sack 1 {82825:95677},mptcp dss ack 3528945482], length 0
17:35:52.992950 IP 112.26.2.8.33185 > 112.26.2.1.targus-getdata1: Flags [.], seq 95677:97105, ack 0, win 913, options [nop,nop,TS val 1129147 ecr 1361199,mptcp dss ack 3644063658 seq 3529016882 subseq 481237 len 1428 csum 0x24c4], length 1428
17:35:52.993289 IP 112.26.2.1.targus-getdata1 > 112.26.2.8.33185: Flags [.], ack 78541, win 24295, options [nop,nop,TS val 1362782 ecr 1127476,nop,nop,sack 1 {82825:97105},mptcp dss ack 3528945482], length 0
17:35:53.094629 IP 112.26.2.8.33185 > 112.26.2.1.targus-getdata1: Flags [.], seq 97105:98533, ack 0, win 913, options [nop,nop,TS val 1129285 ecr 1361333,mptcp dss ack 3644063658 seq 3529018310 subseq 482665 len 1428 csum 0x79e2], length 1428
17:35:53.094950 IP 112.26.2.1.targus-getdata1 > 112.26.2.8.33185: Flags [.], ack 78541, win 24295, options [nop,nop,TS val 1362883 ecr 1127476,nop,nop,sack 1 {82825:98533},mptcp dss ack 3528945482], length 0
17:35:53.151397 IP 112.26.2.1.targus-getdata1 > 112.26.2.8.33185: Flags [.], ack 78541, win 24295, options [nop,nop,TS val 1362782 ecr 1127476,nop,nop,sack 1 {82825:97105},mptcp dss ack 3528945482], length 0
17:35:53.220497 IP 112.26.2.8.33185 > 112.26.2.1.targus-getdata1: Flags [.], seq 98533:99961, ack 0, win 913, options [nop,nop,TS val 1129285 ecr 1361333,mptcp dss ack 3644063658 seq 3529019738 subseq 484093 len 1428 csum 0x4fc9], length 1428
17:35:53.220868 IP 112.26.2.1.targus-getdata1 > 112.26.2.8.33185: Flags [.], ack 78541, win 24295, options [nop,nop,TS val 1363010 ecr 1127476,nop,nop,sack 1 {82825:99961},mptcp dss ack 3528945482], length 0
17:35:53.315986 IP 112.26.2.1.targus-getdata1 > 112.26.2.8.33185: Flags [.], ack 78541, win 24295, options [nop,nop,TS val 1362883 ecr 1127476,nop,nop,sack 1 {82825:98533},mptcp dss ack 3528945482], length 0
17:35:53.372195 IP 112.26.2.8.33185 > 112.26.2.1.targus-getdata1: Flags [.], seq 99961:101389, ack 0, win 913, options [nop,nop,TS val 1129431 ecr 1361616,mptcp dss ack 3644063658 seq 3529028306 subseq 485521 len 1428 csum 0xe6e7], length 1428
