20:04:50.130292 IP 112.26.1.8.46587 > 112.26.1.1.targus-getdata1: Flags [S], seq 4131554891, win 65535, options [mss 1460,sackOK,TS val 783539 ecr 0,nop,wscale 6,mptcp join id 3 token 0x198aa9c8 nonce 0x4316b59d], length 0
20:04:50.130671 IP 112.26.1.1.targus-getdata1 > 112.26.1.8.46587: Flags [S.], seq 4286489139, ack 4131554892, win 65535, options [mss 1460,sackOK,TS val 1012979 ecr 783539,nop,wscale 6,mptcp join id 3 hmac 0xd121ea88eee6475 nonce 0x5e699858], length 0
20:04:50.289777 IP 112.26.1.1.targus-getdata1 > 112.26.1.8.46587: Flags [S.], seq 4286489139, ack 4131554892, win 65535, options [mss 1460,sackOK,TS val 1012979 ecr 783539,nop,wscale 6,mptcp join id 3 hmac 0xd121ea88eee6475 nonce 0x5e699858], length 0
20:04:50.421340 IP 112.26.1.8.46587 > 112.26.1.1.targus-getdata1: Flags [.], ack 1, win 4107, options [nop,nop,TS val 783709 ecr 1012979,mptcp join hmac 0x7870410f3519f9d1a3c297fe8c34de0ecc18ac99], length 0
20:04:50.421724 IP 112.26.1.1.targus-getdata1 > 112.26.1.8.46587: Flags [.], ack 1, win 4017, options [nop,nop,TS val 1013270 ecr 783709,mptcp dss ack 3165865867], length 0
20:04:50.488485 IP 112.26.1.1.targus-getdata1 > 112.26.1.8.46587: Flags [.], ack 1, win 4017, options [nop,nop,TS val 1013270 ecr 783709,mptcp dss ack 3165865867], length 0
20:04:50.873295 IP 112.26.1.8.40819 > 112.26.1.1.targus-getdata1: Flags [S], seq 4142462791, win 65535, options [mss 1460,sackOK,TS val 784279 ecr 0,nop,wscale 6,mptcp join id 3 token 0x9dc837c0 nonce 0xf5f9d2f7], length 0
20:05:35.776252 IP 112.26.1.8.40819 > 112.26.1.1.targus-getdata1: Flags [.], seq 4142844068:4142845496, ack 3504367240, win 4107, options [nop,nop,TS val 828549 ecr 1056895,mptcp dss ack 2724680102 seq 1002530050 subseq 381277 len 1428 csum 0x5f2b], length 1428
20:05:35.776532 IP 112.26.1.1.targus-getdata1 > 112.26.1.8.40819: Flags [.], ack 4294931596, win 23781, options [nop,nop,TS val 1058625 ecr 824292,nop,nop,sack 1 {4294933024:1428},mptcp dss ack 1002335842], length 0
20:05:35.852426 IP 112.26.1.1.targus-getdata1 > 112.26.1.8.40819: Flags [.], ack 4294931596, win 23781, options [nop,nop,TS val 1058625 ecr 824292,nop,nop,sack 1 {4294933024:1428},mptcp dss ack 1002335842], length 0
20:05:35.953026 IP 112.26.1.8.40819 > 112.26.1.1.targus-getdata1: Flags [.], seq 1428:2856, ack 1, win 4107, options [nop,nop,TS val 828557 ecr 1057131,mptcp dss ack 2724680102 seq 1002534334 subseq 382705 len 1428 csum 0xd8fc], length 1428
20:05:35.953333 IP 112.26.1.1.targus-getdata1 > 112.26.1.8.40819: Flags [.], ack 4294931596, win 23781, options [nop,nop,TS val 1058802 ecr 824292,nop,nop,sack 1 {4294933024:2856},mptcp dss ack 1002335842], length 0
20:05:36.010768 IP 112.26.1.1.targus-getdata1 > 112.26.1.8.40819: Flags [.], ack 4294931596, win 23781, options [nop,nop,TS val 1058802 ecr 824292,nop,nop,sack 1 {4294933024:2856},mptcp dss ack 1002335842], length 0
20:05:36.136903 IP 112.26.1.8.40819 > 112.26.1.1.targus-getdata1: Flags [.], seq 4294931596:4294933024, ack 1, win 4107, options [nop,nop,TS val 828841 ecr 1057446,mptcp dss ack 2724680102 seq 1002418666 subseq 345577 len 1428 csum 0xceb5], length 1428
20:05:36.137303 IP 112.26.1.1.targus-getdata1 > 112.26.1.8.40819: Flags [.], ack 2856, win 23781, options [nop,nop,TS val 1058986 ecr 828841,mptcp dss ack 1002335842], length 0
20:05:36.229310 IP 112.26.1.1.targus-getdata1 > 112.26.1.8.40819: Flags [.], ack 2856, win 23781, options [nop,nop,TS val 1058986 ecr 828841,mptcp dss ack 1002335842], length 0
20:05:36.261452 IP 112.26.1.8.40819 > 112.26.1.1.targus-getdata1: Flags [.], seq 2856:4284, ack 1, win 4107, options [nop,nop,TS val 828947 ecr 1057503,mptcp dss ack 2724680102 seq 1002554326 subseq 384133 len 1428 csum 0x71b7], length 1428
20:05:36.261780 IP 112.26.1.1.targus-getdata1 > 112.26.1.8.40819: Flags [.], ack 4284, win 23781, options [nop,nop,TS val 1059110 ecr 828947,mptcp dss ack 1002335842], length 0
20:05:36.314011 IP 112.26.1.1.targus-getdata1 > 112.26.1.8.40819: Flags [.], ack 4284, win 23781, options [nop,nop,TS val 1059110 ecr 828947,mptcp dss ack 1002335842], length 0
20:05:36.434087 IP 112.26.1.8.40819 > 112.26.1.1.targus-getdata1: Flags [.], seq 4284:5712, ack 1, win 4107, options [nop,nop,TS val 829115 ecr 1057587,mptcp dss ack 2724680102 seq 1002562894 subseq 385561 len 1428 csum 0x6340], length 1428
20:05:36.434355 IP 112.26.1.1.targus-getdata1 > 112.26.1.8.40819: Flags [.], ack 5712, win 23781, options [nop,nop,TS val 1059283 ecr 829115,mptcp dss ack 1002335842], length 0
20:05:36.524987 IP 112.26.1.1.targus-getdata1 > 112.26.1.8.40819: Flags [.], ack 5712, win 23781, options [nop,nop,TS val 1059283 ecr 829115,mptcp dss ack 1002335842], length 0
20:05:36.575974 IP 112.26.1.8.40819 > 112.26.1.1.targus-getdata1: Flags [.], seq 5712:7140, ack 1, win 4107, options [nop,nop,TS val 829239 ecr 1057810,mptcp dss ack 2724680102 seq 1002565750 subseq 386989 len 1428 csum 0xd0d7], length 1428
20:05:36.576327 IP 112.26.1.1.targus-getdata1 > 112.26.1.8.40819: Flags [.], ack 7140, win 23781, options [nop,nop,TS val 1059425 ecr 829239,mptcp dss ack 1002335842], length 0
20:05:36.648661 IP 112.26.1.1.targus-getdata1 > 112.26.1.8.40819: Flags [.], ack 7140, win 23781, options [nop,nop,TS val 1059425 ecr 829239,mptcp dss ack 1002335842], length 0
20:05:36.814138 IP 112.26.1.8.40819 > 112.26.1.1.targus-getdata1: Flags [.], seq 8568:9996, ack 1, win 4107, options [nop,nop,TS val 829510 ecr 1058133,mptcp dss ack 2724680102 seq 1002578602 subseq 389845 len 1428 csum 0x5ab1], length 1428
20:05:36.814461 IP 112.26.1.1.targus-getdata1 > 112.26.1.8.40819: Flags [.], ack 7140, win 24471, options [nop,nop,TS val 1059663 ecr 829239,nop,nop,sack 1 {8568:9996},mptcp dss ack 1002567178], length 0
20:05:36.916346 IP 112.26.1.1.targus-getdata1 > 112.26.1.8.40819: Flags [.], ack 7140, win 24471, options [nop,nop,TS val 1059663 ecr 829239,nop,nop,sack 1 {8568:9996},mptcp dss ack 1002567178], length 0
20:05:37.085899 IP 112.26.1.8.40819 > 112.26.1.1.targus-getdata1: Flags [.], seq 9996:11424, ack 1, win 4107, options [nop,nop,TS val 829787 ecr 1058454,mptcp dss ack 2724680102 seq 1002591454 subseq 391273 len 1428 csum 0xa47c], length 1428
20:05:37.086266 IP 112.26.1.1.targus-getdata1 > 112.26.1.8.40819: Flags [.], ack 7140, win 24471, options [nop,nop,TS val 1059935 ecr 829239,nop,nop,sack 1 {8568:11424},mptcp dss ack 1002567178], length 0
20:05:37.157750 IP 112.26.1.1.targus-getdata1 > 112.26.1.8.40819: Flags [.], ack 7140, win 24471, options [nop,nop,TS val 1059935 ecr 829239,nop,nop,sack 1 {8568:11424},mptcp dss ack 1002567178], length 0
20:05:37.242569 IP 112.26.1.8.40819 > 112.26.1.1.targus-getdata1: Flags [.], seq 11424:12852, ack 1, win 4107, options [nop,nop,TS val 829787 ecr 1058454,mptcp dss ack 2724680102 seq 1002592882 subseq 392701 len 1428 csum 0x7447], length 1428
20:05:37.242906 IP 112.26.1.1.targus-getdata1 > 112.26.1.8.40819: Flags [.], ack 7140, win 24471, options [nop,nop,TS val 1060092 ecr 829239,nop,nop,sack 1 {8568:12852},mptcp dss ack 1002567178], length 0
20:05:37.345848 IP 112.26.1.1.targus-getdata1 > 112.26.1.8.40819: Flags [.], ack 7140, win 24471, options [nop,nop,TS val 1060092 ecr 829239,nop,nop,sack 1 {8568:12852},mptcp dss ack 1002567178], length 0
20:05:37.424680 IP 112.26.1.8.40819 > 112.26.1.1.targus-getdata1: Flags [P.], seq 12852:14280, ack 1, win 4107, options [nop,nop,TS val 830066 ecr 1058625,mptcp dss ack 2724680102 seq 1002598594 subseq 394129 len 1428 csum 0x6934], length 1428
20:05:37.425029 IP 112.26.1.1.targus-getdata1 > 112.26.1.8.40819: Flags [.], ack 7140, win 24471, options [nop,nop,TS val 1060274 ecr 829239,nop,nop,sack 1 {8568:14280},mptcp dss ack 1002567178], length 0
20:05:37.507091 IP 112.26.1.1.targus-getdata1 > 112.26.1.8.40819: Flags [.], ack 7140, win 24471, options [nop,nop,TS val 1060274 ecr 829239,nop,nop,sack 1 {8568:14280},mptcp dss ack 1002567178], length 0
20:05:37.585434 IP 112.26.1.8.40819 > 112.26.1.1.targus-getdata1: Flags [.], seq 14280:15708, ack 1, win 4107, options [nop,nop,TS val 830181 ecr 1058802,mptcp dss ack 2724680102 seq 1002608590 subseq 395557 len 1428 csum 0xa70c], length 1428
20:05:37.585682 IP 112.26.1.1.targus-getdata1 > 112.26.1.8.40819: Flags [.], ack 7140, win 24471, options [nop,nop,TS val 1060434 ecr 829239,nop,nop,sack 1 {8568:15708},mptcp dss ack 1002567178], length 0
20:05:37.648024 IP 112.26.1.8.40819 > 112.26.1.1.targus-getdata1: Flags [.], seq 15708:17136, ack 1, win 4107, options [nop,nop,TS val 830317 ecr 1058986,mptcp dss ack 2724680102 seq 1002615730 subseq 396985 len 1428 csum 0x2a21], length 1428
20:05:37.648369 IP 112.26.1.1.targus-getdata1 > 112.26.1.8.40819: Flags [.], ack 7140, win 24471, options [nop,nop,TS val 1060497 ecr 829239,nop,nop,sack 1 {8568:17136},mptcp dss ack 1002567178], length 0
20:05:37.753277 IP 112.26.1.1.targus-getdata1 > 112.26.1.8.40819: Flags [.], ack 7140, win 24471, options [nop,nop,TS val 1060434 ecr 829239,nop,nop,sack 1 {8568:15708},mptcp dss ack 1002567178], length 0
20:05:37.871038 IP 112.26.1.1.targus-getdata1 > 112.26.1.8.40819: Flags [.], ack 7140, win 24471, options [nop,nop,TS val 1060497 ecr 829239,nop,nop,sack 1 {8568:17136},mptcp dss ack 1002567178], length 0
20:05:37.914299 IP 112.26.1.8.40819 > 112.26.1.1.targus-getdata1: Flags [.], seq 17136:18564, ack 1, win 4107, options [nop,nop,TS val 830317 ecr 1058986,mptcp dss ack 2724680102 seq 1002617158 subseq 398413 len 1428 csum 0x2f6e], length 1428
20:05:37.914560 IP 112.26.1.1.targus-getdata1 > 112.26.1.8.40819: Flags [.], ack 7140, win 24471, options [nop,nop,TS val 1060763 ecr 829239,nop,nop,sack 1 {8568:18564},mptcp dss ack 1002567178], length 0
20:05:38.003483 IP 112.26.1.8.40819 > 112.26.1.1.targus-getdata1: Flags [.], seq 18564:19992, ack 1, win 4107, options [nop,nop,TS val 830436 ecr 1059110,mptcp dss ack 2724680102 seq 1002620014 subseq 399841 len 1428 csum 0xec89], length 1428
20:05:38.003722 IP 112.26.1.1.targus-getdata1 > 112.26.1.8.40819: Flags [.], ack 7140, win 24471, options [nop,nop,TS val 1060853 ecr 829239,nop,nop,sack 1 {8568:19992},mptcp dss ack 1002567178], length 0
20:05:38.082456 IP 112.26.1.8.40819 > 112.26.1.1.targus-getdata1: Flags [.], seq 19992:21420, ack 1, win 4107, options [nop,nop,TS val 830436 ecr 1059110,mptcp dss ack 2724680102 seq 1002621442 subseq 401269 len 1428 csum 0xc631], length 1428
20:05:38.082772 IP 112.26.1.1.targus-getdata1 > 112.26.1.8.40819: Flags [.], ack 7140, win 24471, options [nop,nop,TS val 1060932 ecr 829239,nop,nop,sack 1 {8568:21420},mptcp dss ack 1002567178], length 0
20:05:38.173590 IP 112.26.1.1.targus-getdata1 > 112.26.1.8.40819: Flags [.], ack 7140, win 24471, options [nop,nop,TS val 1060763 ecr 829239,nop,nop,sack 1 {8568:18564},mptcp dss ack 1002567178], length 0
20:05:38.269052 IP 112.26.1.1.targus-getdata1 > 112.26.1.8.40819: Flags [.], ack 7140, win 24471, options [nop,nop,TS val 1060853 ecr 829239,nop,nop,sack 1 {8568:19992},mptcp dss ack 1002567178], length 0
20:05:38.320804 IP 112.26.1.8.40819 > 112.26.1.1.targus-getdata1: Flags [.], seq 21420:22848, ack 1, win 4107, options [nop,nop,TS val 830672 ecr 1059283,mptcp dss ack 2724680102 seq 1002634294 subseq 402697 len 1428 csum 0x97f6], length 1428
20:05:38.321184 IP 112.26.1.1.targus-getdata1 > 112.26.1.8.40819: Flags [.], ack 7140, win 24471, options [nop,nop,TS val 1061170 ecr 829239,nop,nop,sack 1 {8568:22848},mptcp dss ack 1002567178], length 0
20:05:38.439344 IP 112.26.1.1.targus-getdata1 > 112.26.1.8.40819: Flags [.], ack 7140, win 24471, options [nop,nop,TS val 1060932 ecr 829239,nop,nop,sack 1 {8568:21420},mptcp dss ack 1002567178], length 0
20:05:38.498975 IP 112.26.1.8.40819 > 112.26.1.1.targus-getdata1: Flags [.], seq 22848:24276, ack 1, win 4107, options [nop,nop,TS val 830739 ecr 1059425,mptcp dss ack 2724680102 seq 1002647146 subseq 404125 len 1428 csum 0x10fa], length 1428
20:05:38.499329 IP 112.26.1.1.targus-getdata1 > 112.26.1.8.40819: Flags [.], ack 7140, win 24471, options [nop,nop,TS val 1061348 ecr 829239,nop,nop,sack 1 {8568:24276},mptcp dss ack 1002567178], length 0
20:05:38.564998 IP 112.26.1.8.40819 > 112.26.1.1.targus-getdata1: Flags [.], seq 24276:25704, ack 1, win 4107, options [nop,nop,TS val 830739 ecr 1059425,mptcp dss ack 2724680102 seq 1002648574 subseq 405553 len 1428 csum 0x859e], length 1428
20:05:38.565308 IP 112.26.1.1.targus-getdata1 > 112.26.1.8.40819: Flags [.], ack 7140, win 24471, options [nop,nop,TS val 1061414 ecr 829239,nop,nop,sack 1 {8568:25704},mptcp dss ack 1002567178], length 0
20:05:38.649149 IP 112.26.1.1.targus-getdata1 > 112.26.1.8.40819: Flags [.], ack 7140, win 24471, options [nop,nop,TS val 1061170 ecr 829239,nop,nop,sack 1 {8568:22848},mptcp dss ack 1002567178], length 0
20:05:38.729981 IP 112.26.1.8.40819 > 112.26.1.1.targus-getdata1: Flags [.], seq 25704:27132, ack 1, win 4107, options [nop,nop,TS val 831108 ecr 1059663,mptcp dss ack 2724680102 seq 1002661426 subseq 406981 len 1428 csum 0xb61], length 1428
20:05:38.730329 IP 112.26.1.1.targus-getdata1 > 112.26.1.8.40819: Flags [.], ack 7140, win 24471, options [nop,nop,TS val 1061579 ecr 829239,nop,nop,sack 1 {8568:27132},mptcp dss ack 1002567178], length 0
20:05:38.824670 IP 112.26.1.1.targus-getdata1 > 112.26.1.8.40819: Flags [.], ack 7140, win 24471, options [nop,nop,TS val 1061348 ecr 829239,nop,nop,sack 1 {8568:24276},mptcp dss ack 1002567178], length 0
20:05:38.903383 IP 112.26.1.1.targus-getdata1 > 112.26.1.8.40819: Flags [.], ack 7140, win 24471, options [nop,nop,TS val 1061414 ecr 829239,nop,nop,sack 1 {8568:25704},mptcp dss ack 1002567178], length 0
20:05:38.955806 IP 112.26.1.8.40819 > 112.26.1.1.targus-getdata1: Flags [.], seq 27132:28560, ack 1, win 4107, options [nop,nop,TS val 831410 ecr 1059935,mptcp dss ack 2724680102 seq 1002674278 subseq 408409 len 1428 csum 0xb36], length 1428
20:05:38.956204 IP 112.26.1.1.targus-getdata1 > 112.26.1.8.40819: Flags [.], ack 7140, win 24471, options [nop,nop,TS val 1061805 ecr 829239,nop,nop,sack 1 {8568:28560},mptcp dss ack 1002567178], length 0
20:05:39.054614 IP 112.26.1.1.targus-getdata1 > 112.26.1.8.40819: Flags [.], ack 7140, win 24471, options [nop,nop,TS val 1061579 ecr 829239,nop,nop,sack 1 {8568:27132},mptcp dss ack 1002567178], length 0
20:05:39.087413 IP 112.26.1.8.40819 > 112.26.1.1.targus-getdata1: Flags [.], seq 7140:8568, ack 1, win 4107, options [nop,nop,TS val 831668 ecr 1060274,mptcp dss ack 2724680102 seq 1002570034 subseq 388417 len 1428 csum 0x34f6], length 1428
20:05:39.087741 IP 112.26.1.1.targus-getdata1 > 112.26.1.8.40819: Flags [.], ack 28560, win 23892, options [nop,nop,TS val 1061936 ecr 831668,mptcp dss ack 1002604306], length 0
20:05:39.141966 IP 112.26.1.1.targus-getdata1 > 112.26.1.8.40819: Flags [.], ack 7140, win 24471, options [nop,nop,TS val 1061805 ecr 829239,nop,nop,sack 1 {8568:28560},mptcp dss ack 1002567178], length 0
20:05:39.225618 IP 112.26.1.8.40819 > 112.26.1.1.targus-getdata1: Flags [.], seq 28560:29988, ack 1, win 4107, options [nop,nop,TS val 831751 ecr 1060274,mptcp dss ack 2724680102 seq 1002682846 subseq 409837 len 1428 csum 0xd6e1], length 1428
20:05:39.225954 IP 112.26.1.1.targus-getdata1 > 112.26.1.8.40819: Flags [.], ack 29988, win 23892, options [nop,nop,TS val 1062074 ecr 831751,mptcp dss ack 1002604306], length 0
20:05:39.278074 IP 112.26.1.1.targus-getdata1 > 112.26.1.8.40819: Flags [.], ack 28560, win 23892, options [nop,nop,TS val 1061936 ecr 831668,mptcp dss ack 1002604306], length 0
20:05:39.356587 IP 112.26.1.8.40819 > 112.26.1.1.targus-getdata1: Flags [.], seq 29988:31416, ack 1, win 4107, options [nop,nop,TS val 831897 ecr 1060434,mptcp dss ack 2724680102 seq 1002695698 subseq 411265 len 1428 csum 0x4bcc], length 1428
20:05:39.356941 IP 112.26.1.1.targus-getdata1 > 112.26.1.8.40819: Flags [.], ack 31416, win 23892, options [nop,nop,TS val 1062206 ecr 831897,mptcp dss ack 1002604306], length 0
20:05:39.458598 IP 112.26.1.1.targus-getdata1 > 112.26.1.8.40819: Flags [.], ack 29988, win 23892, options [nop,nop,TS val 1062074 ecr 831751,mptcp dss ack 1002604306], length 0
20:05:39.547079 IP 112.26.1.1.targus-getdata1 > 112.26.1.8.40819: Flags [.], ack 31416, win 23892, options [nop,nop,TS val 1062206 ecr 831897,mptcp dss ack 1002604306], length 0
20:05:39.618220 IP 112.26.1.8.40819 > 112.26.1.1.targus-getdata1: Flags [.], seq 31416:32844, ack 1, win 4107, options [nop,nop,TS val 832211 ecr 1060763,mptcp dss ack 2724680102 seq 1002704266 subseq 412693 len 1428 csum 0xa2ff], length 1428
20:05:39.618523 IP 112.26.1.1.targus-getdata1 > 112.26.1.8.40819: Flags [.], ack 32844, win 23892, options [nop,nop,TS val 1062467 ecr 832211,mptcp dss ack 1002604306], length 0
20:05:39.683084 IP 112.26.1.8.40819 > 112.26.1.1.targus-getdata1: Flags [.], seq 32844:34272, ack 1, win 4107, options [nop,nop,TS val 832310 ecr 1060853,mptcp dss ack 2724680102 seq 1002707122 subseq 414121 len 1428 csum 0xb8b6], length 1428
20:05:39.683457 IP 112.26.1.1.targus-getdata1 > 112.26.1.8.40819: Flags [.], ack 34272, win 23892, options [nop,nop,TS val 1062532 ecr 832310,mptcp dss ack 1002604306], length 0
20:05:39.756177 IP 112.26.1.1.targus-getdata1 > 112.26.1.8.40819: Flags [.], ack 32844, win 23892, options [nop,nop,TS val 1062467 ecr 832211,mptcp dss ack 1002604306], length 0
20:05:39.807961 IP 112.26.1.1.targus-getdata1 > 112.26.1.8.40819: Flags [.], ack 34272, win 23892, options [nop,nop,TS val 1062532 ecr 832310,mptcp dss ack 1002604306], length 0
20:05:39.885882 IP 112.26.1.8.40819 > 112.26.1.1.targus-getdata1: Flags [.], seq 34272:35700, ack 1, win 4107, options [nop,nop,TS val 832867 ecr 1061348,mptcp dss ack 2724680102 seq 1002725686 subseq 415549 len 1428 csum 0x91e5], length 1428
20:05:39.886057 IP 112.26.1.1.targus-getdata1 > 112.26.1.8.40819: Flags [.], ack 35700, win 23892, options [nop,nop,TS val 1062735 ecr 832867,mptcp dss ack 1002604306], length 0
20:05:39.965794 IP 112.26.1.1.targus-getdata1 > 112.26.1.8.40819: Flags [.], ack 35700, win 23892, options [nop,nop,TS val 1062735 ecr 832867,mptcp dss ack 1002604306], length 0
20:05:40.085296 IP 112.26.1.8.40819 > 112.26.1.1.targus-getdata1: Flags [.], seq 35700:37128, ack 1, win 4107, options [nop,nop,TS val 833072 ecr 1061414,mptcp dss ack 2724680102 seq 1002734254 subseq 416977 len 1428 csum 0xe8f], length 1428
20:05:40.085645 IP 112.26.1.1.targus-getdata1 > 112.26.1.8.40819: Flags [.], ack 37128, win 23892, options [nop,nop,TS val 1062934 ecr 833072,mptcp dss ack 1002604306], length 0
20:05:40.205188 IP 112.26.1.1.targus-getdata1 > 112.26.1.8.40819: Flags [.], ack 37128, win 23892, options [nop,nop,TS val 1062934 ecr 833072,mptcp dss ack 1002604306], length 0
20:05:40.301990 IP 112.26.1.8.40819 > 112.26.1.1.targus-getdata1: Flags [.], seq 37128:38556, ack 1, win 4107, options [nop,nop,TS val 833119 ecr 1061579,mptcp dss ack 2724680102 seq 1002737110 subseq 418405 len 1428 csum 0x92e8], length 1428
20:05:40.302377 IP 112.26.1.1.targus-getdata1 > 112.26.1.8.40819: Flags [.], ack 38556, win 23892, options [nop,nop,TS val 1063151 ecr 833119,mptcp dss ack 1002604306], length 0
20:05:40.400737 IP 112.26.1.1.targus-getdata1 > 112.26.1.8.40819: Flags [.], ack 38556, win 23892, options [nop,nop,TS val 1063151 ecr 833119,mptcp dss ack 1002604306], length 0
20:05:40.485643 IP 112.26.1.8.40819 > 112.26.1.1.targus-getdata1: Flags [.], seq 38556:39984, ack 1, win 4107, options [nop,nop,TS val 833246 ecr 1061805,mptcp dss ack 2724680102 seq 1002742822 subseq 419833 len 1428 csum 0x190], length 1428
20:05:40.485967 IP 112.26.1.1.targus-getdata1 > 112.26.1.8.40819: Flags [.], ack 39984, win 23892, options [nop,nop,TS val 1063334 ecr 833246,mptcp dss ack 1002604306], length 0
20:05:40.553883 IP 112.26.1.1.targus-getdata1 > 112.26.1.8.40819: Flags [.], ack 39984, win 23892, options [nop,nop,TS val 1063334 ecr 833246,mptcp dss ack 1002604306], length 0
20:05:40.642918 IP 112.26.1.8.40819 > 112.26.1.1.targus-getdata1: Flags [.], seq 39984:41412, ack 1, win 4107, options [nop,nop,TS val 833246 ecr 1061936,mptcp dss ack 2724680102 seq 1002744250 subseq 421261 len 1428 csum 0x753c], length 1428
20:05:40.643263 IP 112.26.1.1.targus-getdata1 > 112.26.1.8.40819: Flags [.], ack 41412, win 23636, options [nop,nop,TS val 1063492 ecr 833246,mptcp dss ack 1002625726], length 0
20:05:40.710179 IP 112.26.1.1.targus-getdata1 > 112.26.1.8.40819: Flags [.], ack 41412, win 23636, options [nop,nop,TS val 1063492 ecr 833246,mptcp dss ack 1002625726], length 0
20:05:40.810785 IP 112.26.1.8.40819 > 112.26.1.1.targus-getdata1: Flags [.], seq 41412:42840, ack 1, win 4107, options [nop,nop,TS val 833366 ecr 1062074,mptcp dss ack 2724680102 seq 1002749962 subseq 422689 len 1428 csum 0x994e], length 1428
20:05:40.811082 IP 112.26.1.1.targus-getdata1 > 112.26.1.8.40819: Flags [.], ack 42840, win 23636, options [nop,nop,TS val 1063660 ecr 833366,mptcp dss ack 1002625726], length 0
20:05:40.876363 IP 112.26.1.8.40819 > 112.26.1.1.targus-getdata1: Flags [.], seq 42840:44268, ack 1, win 4107, options [nop,nop,TS val 833454 ecr 1062206,mptcp dss ack 2724680102 seq 1002752818 subseq 424117 len 1428 csum 0x42b1], length 1428
20:05:40.876603 IP 112.26.1.1.targus-getdata1 > 112.26.1.8.40819: Flags [.], ack 44268, win 23636, options [nop,nop,TS val 1063725 ecr 833454,mptcp dss ack 1002625726], length 0
20:05:40.987186 IP 112.26.1.1.targus-getdata1 > 112.26.1.8.40819: Flags [.], ack 42840, win 23636, options [nop,nop,TS val 1063660 ecr 833366,mptcp dss ack 1002625726], length 0
20:05:41.051853 IP 112.26.1.1.targus-getdata1 > 112.26.1.8.40819: Flags [.], ack 44268, win 23636, options [nop,nop,TS val 1063725 ecr 833454,mptcp dss ack 1002625726], length 0
20:05:41.082485 IP 112.26.1.8.40819 > 112.26.1.1.targus-getdata1: Flags [.], seq 44268:45696, ack 1, win 4107, options [nop,nop,TS val 833680 ecr 1062467,mptcp dss ack 2724680102 seq 1002761386 subseq 425545 len 1428 csum 0x4337], length 1428
20:05:41.082838 IP 112.26.1.1.targus-getdata1 > 112.26.1.8.40819: Flags [.], ack 45696, win 24424, options [nop,nop,TS val 1063932 ecr 833680,mptcp dss ack 1002751390], length 0
20:05:41.181755 IP 112.26.1.8.40819 > 112.26.1.1.targus-getdata1: Flags [.], seq 45696:47124, ack 1, win 4107, options [nop,nop,TS val 833680 ecr 1062467,mptcp dss ack 2724680102 seq 1002762814 subseq 426973 len 1428 csum 0x7284], length 1428
20:05:41.182038 IP 112.26.1.1.targus-getdata1 > 112.26.1.8.40819: Flags [.], ack 47124, win 24424, options [nop,nop,TS val 1064031 ecr 833680,mptcp dss ack 1002751390], length 0
20:05:41.258259 IP 112.26.1.1.targus-getdata1 > 112.26.1.8.40819: Flags [.], ack 45696, win 24424, options [nop,nop,TS val 1063932 ecr 833680,mptcp dss ack 1002751390], length 0
20:05:41.319412 IP 112.26.1.8.40819 > 112.26.1.1.targus-getdata1: Flags [.], seq 47124:48552, ack 1, win 4107, options [nop,nop,TS val 833798 ecr 1062532,mptcp dss ack 2724680102 seq 1002772810 subseq 428401 len 1428 csum 0x73d], length 1428
20:05:41.319715 IP 112.26.1.1.targus-getdata1 > 112.26.1.8.40819: Flags [.], ack 48552, win 24380, options [nop,nop,TS val 1064168 ecr 833798,mptcp dss ack 1002754246], length 0
20:05:41.385010 IP 112.26.1.1.targus-getdata1 > 112.26.1.8.40819: Flags [.], ack 47124, win 24424, options [nop,nop,TS val 1064031 ecr 833680,mptcp dss ack 1002751390], length 0
20:05:41.426651 IP 112.26.1.1.targus-getdata1 > 112.26.1.8.40819: Flags [.], ack 48552, win 24380, options [nop,nop,TS val 1064168 ecr 833798,mptcp dss ack 1002754246], length 0
20:05:41.494803 IP 112.26.1.8.40819 > 112.26.1.1.targus-getdata1: Flags [.], seq 48552:49980, ack 1, win 4107, options [nop,nop,TS val 834075 ecr 1062735,mptcp dss ack 2724680102 seq 1002781378 subseq 429829 len 1428 csum 0xcc20], length 1428
20:05:41.495166 IP 112.26.1.1.targus-getdata1 > 112.26.1.8.40819: Flags [.], ack 49980, win 24489, options [nop,nop,TS val 1064344 ecr 834075,mptcp dss ack 1002775666], length 0
20:05:41.604421 IP 112.26.1.8.40819 > 112.26.1.1.targus-getdata1: Flags [.], seq 49980:51408, ack 1, win 4107, options [nop,nop,TS val 834262 ecr 1062934,mptcp dss ack 2724680102 seq 1002785662 subseq 431257 len 1428 csum 0xcce8], length 1428
20:05:41.645595 IP 112.26.1.1.targus-getdata1 > 112.26.1.8.40819: Flags [.], ack 51408, win 24548, options [nop,nop,TS val 1064495 ecr 834262,mptcp dss ack 1002788518], length 0
20:05:41.682344 IP 112.26.1.1.targus-getdata1 > 112.26.1.8.40819: Flags [.], ack 49980, win 24489, options [nop,nop,TS val 1064344 ecr 834075,mptcp dss ack 1002775666], length 0
20:05:41.761510 IP 112.26.1.1.targus-getdata1 > 112.26.1.8.40819: Flags [.], ack 51408, win 24548, options [nop,nop,TS val 1064495 ecr 834262,mptcp dss ack 1002788518], length 0
20:05:41.802821 IP 112.26.1.8.40819 > 112.26.1.1.targus-getdata1: Flags [.], seq 51408:52836, ack 1, win 4107, options [nop,nop,TS val 834580 ecr 1063151,mptcp dss ack 2724680102 seq 1002804226 subseq 432685 len 1428 csum 0xdba6], length 1428
20:05:41.885675 IP 112.26.1.8.40819 > 112.26.1.1.targus-getdata1: Flags [.], seq 52836:54264, ack 1, win 4107, options [nop,nop,TS val 834684 ecr 1063334,mptcp dss ack 2724680102 seq 1002811366 subseq 434113 len 1428 csum 0xe92b], length 1428
20:05:41.885816 IP 112.26.1.1.targus-getdata1 > 112.26.1.8.40819: Flags [.], ack 54264, win 24504, options [nop,nop,TS val 1064735 ecr 834580,mptcp dss ack 1002791374], length 0
20:05:41.962911 IP 112.26.1.1.targus-getdata1 > 112.26.1.8.40819: Flags [.], ack 54264, win 24504, options [nop,nop,TS val 1064735 ecr 834580,mptcp dss ack 1002791374], length 0
20:05:42.201066 IP 112.26.1.8.40819 > 112.26.1.1.targus-getdata1: Flags [.], seq 54264:55692, ack 1, win 4107, options [nop,nop,TS val 834836 ecr 1063492,mptcp dss ack 2724680102 seq 1002815650 subseq 435541 len 1428 csum 0xf44], length 1428
20:05:42.286615 IP 112.26.1.1.targus-getdata1 > 112.26.1.8.40819: Flags [.], ack 55692, win 24453, options [nop,nop,TS val 1065136 ecr 834836,mptcp dss ack 1002805654], length 0
20:05:42.314893 IP 112.26.1.8.40819 > 112.26.1.1.targus-getdata1: Flags [.], seq 55692:57120, ack 1, win 4107, options [nop,nop,TS val 834961 ecr 1063660,mptcp dss ack 2724680102 seq 1002821362 subseq 436969 len 1428 csum 0x51ad], length 1428
20:05:42.372536 IP 112.26.1.8.40819 > 112.26.1.1.targus-getdata1: Flags [.], seq 57120:58548, ack 1, win 4107, options [nop,nop,TS val 835073 ecr 1063725,mptcp dss ack 2724680102 seq 1002825646 subseq 438397 len 1428 csum 0x429], length 1428
20:05:42.400186 IP 112.26.1.1.targus-getdata1 > 112.26.1.8.40819: Flags [.], ack 58548, win 24431, options [nop,nop,TS val 1065249 ecr 834961,mptcp dss ack 1002807082], length 0
20:05:42.473857 IP 112.26.1.1.targus-getdata1 > 112.26.1.8.40819: Flags [.], ack 55692, win 24453, options [nop,nop,TS val 1065136 ecr 834836,mptcp dss ack 1002805654], length 0
20:05:42.573604 IP 112.26.1.1.targus-getdata1 > 112.26.1.8.40819: Flags [.], ack 58548, win 24431, options [nop,nop,TS val 1065249 ecr 834961,mptcp dss ack 1002807082], length 0
20:05:42.642502 IP 112.26.1.8.40819 > 112.26.1.1.targus-getdata1: Flags [.], seq 58548:59976, ack 1, win 4107, options [nop,nop,TS val 835240 ecr 1063932,mptcp dss ack 2724680102 seq 1002835642 subseq 439825 len 1428 csum 0xabf3], length 1428
20:05:42.737241 IP 112.26.1.8.40819 > 112.26.1.1.targus-getdata1: Flags [.], seq 59976:61404, ack 1, win 4107, options [nop,nop,TS val 835240 ecr 1063932,mptcp dss ack 2724680102 seq 1002837070 subseq 441253 len 1428 csum 0x2c94], length 1428
20:05:42.799059 IP 112.26.1.1.targus-getdata1 > 112.26.1.8.40819: Flags [.], ack 61404, win 24431, options [nop,nop,TS val 1065648 ecr 835240,mptcp dss ack 1002807082], length 0
20:05:42.869923 IP 112.26.1.8.40819 > 112.26.1.1.targus-getdata1: Flags [.], seq 61404:62832, ack 1, win 4107, options [nop,nop,TS val 835415 ecr 1064031,mptcp dss ack 2724680102 seq 1002845638 subseq 442681 len 1428 csum 0x427f], length 1428
20:05:42.957749 IP 112.26.1.8.40819 > 112.26.1.1.targus-getdata1: Flags [.], seq 62832:64260, ack 1, win 4107, options [nop,nop,TS val 835469 ecr 1064168,mptcp dss ack 2724680102 seq 1002849922 subseq 444109 len 1428 csum 0x7648], length 1428
20:05:43.042402 IP 112.26.1.1.targus-getdata1 > 112.26.1.8.40819: Flags [.], ack 61404, win 24431, options [nop,nop,TS val 1065648 ecr 835240,mptcp dss ack 1002807082], length 0
20:05:43.090115 IP 112.26.1.8.40819 > 112.26.1.1.targus-getdata1: Flags [.], seq 64260:65688, ack 1, win 4107, options [nop,nop,TS val 835755 ecr 1064344,mptcp dss ack 2724680102 seq 1002864202 subseq 445537 len 1428 csum 0xd10a], length 1428
20:05:43.090418 IP 112.26.1.1.targus-getdata1 > 112.26.1.8.40819: Flags [.], ack 65688, win 24431, options [nop,nop,TS val 1065939 ecr 835415,mptcp dss ack 1002807082], length 0
20:05:43.169453 IP 112.26.1.8.40819 > 112.26.1.1.targus-getdata1: Flags [.], seq 65688:67116, ack 1, win 4107, options [nop,nop,TS val 835872 ecr 1064495,mptcp dss ack 2724680102 seq 1002869914 subseq 446965 len 1428 csum 0xa426], length 1428
20:05:43.225173 IP 112.26.1.1.targus-getdata1 > 112.26.1.8.40819: Flags [.], ack 65688, win 24431, options [nop,nop,TS val 1065939 ecr 835415,mptcp dss ack 1002807082], length 0
20:05:43.292620 IP 112.26.1.8.40819 > 112.26.1.1.targus-getdata1: Flags [.], seq 67116:68544, ack 1, win 4107, options [nop,nop,TS val 835872 ecr 1064495,mptcp dss ack 2724680102 seq 1002871342 subseq 448393 len 1428 csum 0xe423], length 1428
20:05:43.370993 IP 112.26.1.8.40819 > 112.26.1.1.targus-getdata1: Flags [.], seq 68544:69972, ack 1, win 4107, options [nop,nop,TS val 836082 ecr 1064735,mptcp dss ack 2724680102 seq 1002884194 subseq 449821 len 1428 csum 0x8485], length 1428
20:05:43.371336 IP 112.26.1.1.targus-getdata1 > 112.26.1.8.40819: Flags [.], ack 69972, win 24431, options [nop,nop,TS val 1066220 ecr 835872,mptcp dss ack 1002807082], length 0
20:05:43.482818 IP 112.26.1.1.targus-getdata1 > 112.26.1.8.40819: Flags [.], ack 69972, win 24431, options [nop,nop,TS val 1066220 ecr 835872,mptcp dss ack 1002807082], length 0
20:05:43.555725 IP 112.26.1.8.40819 > 112.26.1.1.targus-getdata1: Flags [.], seq 69972:71400, ack 1, win 4107, options [nop,nop,TS val 836082 ecr 1064735,mptcp dss ack 2724680102 seq 1002885622 subseq 451249 len 1428 csum 0x5b75], length 1428
20:05:43.670786 IP 112.26.1.8.40819 > 112.26.1.1.targus-getdata1: Flags [.], seq 71400:72828, ack 1, win 4107, options [nop,nop,TS val 836432 ecr 1065136,mptcp dss ack 2724680102 seq 1002895618 subseq 452677 len 1428 csum 0x868d], length 1428
20:05:43.774058 IP 112.26.1.8.40819 > 112.26.1.1.targus-getdata1: Flags [.], seq 72828:74256, ack 1, win 4107, options [nop,nop,TS val 836432 ecr 1065136,mptcp dss ack 2724680102 seq 1002897046 subseq 454105 len 1428 csum 0x4db7], length 1428
20:05:43.838708 IP 112.26.1.1.targus-getdata1 > 112.26.1.8.40819: Flags [.], ack 74256, win 24431, options [nop,nop,TS val 1066688 ecr 836082,mptcp dss ack 1002807082], length 0
20:05:43.846284 IP 112.26.1.1.targus-getdata1 > 112.26.1.8.40819: Flags [.], ack 74256, win 24431, options [nop,nop,TS val 1066688 ecr 836082,mptcp dss ack 1002807082], length 0
20:05:43.917471 IP 112.26.1.8.40819 > 112.26.1.1.targus-getdata1: Flags [.], seq 74256:75684, ack 1, win 4107, options [nop,nop,TS val 836542 ecr 1065249,mptcp dss ack 2724680102 seq 1002902758 subseq 455533 len 1428 csum 0xb90a], length 1428
20:05:44.026968 IP 112.26.1.8.40819 > 112.26.1.1.targus-getdata1: Flags [.], seq 75684:77112, ack 1, win 4107, options [nop,nop,TS val 836542 ecr 1065249,mptcp dss ack 2724680102 seq 1002904186 subseq 456961 len 1428 csum 0x17c2], length 1428
20:05:44.109985 IP 112.26.1.8.40819 > 112.26.1.1.targus-getdata1: Flags [.], seq 77112:78540, ack 1, win 4107, options [nop,nop,TS val 836542 ecr 1065249,mptcp dss ack 2724680102 seq 1002905614 subseq 458389 len 1428 csum 0xcdd2], length 1428
20:05:44.199220 IP 112.26.1.1.targus-getdata1 > 112.26.1.8.40819: Flags [.], ack 78540, win 24431, options [nop,nop,TS val 1067048 ecr 836542,mptcp dss ack 1002807082], length 0
20:05:44.203137 IP 112.26.1.1.targus-getdata1 > 112.26.1.8.40819: Flags [.], ack 78540, win 24431, options [nop,nop,TS val 1067048 ecr 836542,mptcp dss ack 1002807082], length 0
20:05:44.325468 IP 112.26.1.8.40819 > 112.26.1.1.targus-getdata1: Flags [.], seq 78540:79968, ack 1, win 4107, options [nop,nop,TS val 837073 ecr 1065648,mptcp dss ack 2724680102 seq 1002921322 subseq 459817 len 1428 csum 0x1b33], length 1428
20:05:44.426868 IP 112.26.1.8.40819 > 112.26.1.1.targus-getdata1: Flags [.], seq 79968:81396, ack 1, win 4107, options [nop,nop,TS val 837073 ecr 1065648,mptcp dss ack 2724680102 seq 1002922750 subseq 461245 len 1428 csum 0x1e6f], length 1428
20:05:44.532980 IP 112.26.1.8.40819 > 112.26.1.1.targus-getdata1: Flags [.], seq 81396:82824, ack 1, win 4107, options [nop,nop,TS val 837073 ecr 1065648,mptcp dss ack 2724680102 seq 1002924178 subseq 462673 len 1428 csum 0xd050], length 1428
20:05:44.606679 IP 112.26.1.1.targus-getdata1 > 112.26.1.8.40819: Flags [.], ack 82824, win 24431, options [nop,nop,TS val 1067456 ecr 837073,mptcp dss ack 1002807082], length 0
20:05:44.613609 IP 112.26.1.1.targus-getdata1 > 112.26.1.8.40819: Flags [.], ack 82824, win 24431, options [nop,nop,TS val 1067456 ecr 837073,mptcp dss ack 1002807082], length 0
20:05:44.692927 IP 112.26.1.8.40819 > 112.26.1.1.targus-getdata1: Flags [.], seq 82824:84252, ack 1, win 4107, options [nop,nop,TS val 837425 ecr 1065939,mptcp dss ack 2724680102 seq 1002935602 subseq 464101 len 1428 csum 0x93b2], length 1428
20:05:44.811303 IP 112.26.1.8.40819 > 112.26.1.1.targus-getdata1: Flags [.], seq 84252:85680, ack 1, win 4107, options [nop,nop,TS val 837425 ecr 1065939,mptcp dss ack 2724680102 seq 1002937030 subseq 465529 len 1428 csum 0xdcae], length 1428
20:05:44.936674 IP 112.26.1.8.40819 > 112.26.1.1.targus-getdata1: Flags [.], seq 85680:87108, ack 1, win 4107, options [nop,nop,TS val 837425 ecr 1065939,mptcp dss ack 2724680102 seq 1002938458 subseq 466957 len 1428 csum 0x9b95], length 1428
20:05:44.937085 IP 112.26.1.1.targus-getdata1 > 112.26.1.8.40819: Flags [.], ack 87108, win 24431, options [nop,nop,TS val 1067786 ecr 837425,mptcp dss ack 1002807082], length 0
20:05:45.015428 IP 112.26.1.1.targus-getdata1 > 112.26.1.8.40819: Flags [.], ack 87108, win 24431, options [nop,nop,TS val 1067786 ecr 837425,mptcp dss ack 1002807082], length 0
20:05:45.093998 IP 112.26.1.8.40819 > 112.26.1.1.targus-getdata1: Flags [.], seq 87108:88536, ack 1, win 4107, options [nop,nop,TS val 837641 ecr 1066220,mptcp dss ack 2724680102 seq 1002945598 subseq 468385 len 1428 csum 0xa4b], length 1428
20:05:45.166454 IP 112.26.1.8.40819 > 112.26.1.1.targus-getdata1: Flags [.], seq 88536:89964, ack 1, win 4107, options [nop,nop,TS val 837641 ecr 1066220,mptcp dss ack 2724680102 seq 1002947026 subseq 469813 len 1428 csum 0x27de], length 1428
20:05:45.211856 IP 112.26.1.8.40819 > 112.26.1.1.targus-getdata1: Flags [.], seq 89964:91392, ack 1, win 4107, options [nop,nop,TS val 837641 ecr 1066220,mptcp dss ack 2724680102 seq 1002948454 subseq 471241 len 1428 csum 0xeb64], length 1428
20:05:45.288962 IP 112.26.1.8.40819 > 112.26.1.1.targus-getdata1: Flags [.], seq 91392:92820, ack 1, win 4107, options [nop,nop,TS val 837987 ecr 1066688,mptcp dss ack 2724680102 seq 1002962734 subseq 472669 len 1428 csum 0x1b4e], length 1428
20:05:45.375093 IP 112.26.1.1.targus-getdata1 > 112.26.1.8.40819: Flags [.], ack 92820, win 23807, options [nop,nop,TS val 1068224 ecr 837641,mptcp dss ack 1002847066], length 0
20:05:45.379264 IP 112.26.1.1.targus-getdata1 > 112.26.1.8.40819: Flags [.], ack 92820, win 23807, options [nop,nop,TS val 1068224 ecr 837641,mptcp dss ack 1002847066], length 0
20:05:45.466212 IP 112.26.1.8.40819 > 112.26.1.1.targus-getdata1: Flags [.], seq 92820:94248, ack 1, win 4107, options [nop,nop,TS val 837987 ecr 1066688,mptcp dss ack 2724680102 seq 1002964162 subseq 474097 len 1428 csum 0x5428], length 1428
20:05:45.573339 IP 112.26.1.8.40819 > 112.26.1.1.targus-getdata1: Flags [.], seq 94248:95676, ack 1, win 4107, options [nop,nop,TS val 837987 ecr 1066688,mptcp dss ack 2724680102 seq 1002965590 subseq 475525 len 1428 csum 0xc3dc], length 1428
20:05:45.622126 IP 112.26.1.8.40819 > 112.26.1.1.targus-getdata1: Flags [.], seq 95676:97104, ack 1, win 4107, options [nop,nop,TS val 838272 ecr 1067048,mptcp dss ack 2724680102 seq 1002974158 subseq 476953 len 1428 csum 0xbbb3], length 1428
20:05:45.728730 IP 112.26.1.8.40819 > 112.26.1.1.targus-getdata1: Flags [.], seq 97104:98532, ack 1, win 4107, options [nop,nop,TS val 838272 ecr 1067048,mptcp dss ack 2724680102 seq 1002975586 subseq 478381 len 1428 csum 0xcf12], length 1428
20:05:45.729067 IP 112.26.1.1.targus-getdata1 > 112.26.1.8.40819: Flags [.], ack 98532, win 23807, options [nop,nop,TS val 1068578 ecr 837987,mptcp dss ack 1002847066], length 0
20:05:45.812729 IP 112.26.1.8.40819 > 112.26.1.1.targus-getdata1: Flags [.], seq 98532:99960, ack 1, win 4107, options [nop,nop,TS val 838272 ecr 1067048,mptcp dss ack 2724680102 seq 1002977014 subseq 479809 len 1428 csum 0xa9b0], length 1428
20:05:45.906847 IP 112.26.1.1.targus-getdata1 > 112.26.1.8.40819: Flags [.], ack 98532, win 23807, options [nop,nop,TS val 1068578 ecr 837987,mptcp dss ack 1002847066], length 0
20:05:45.950926 IP 112.26.1.8.40819 > 112.26.1.1.targus-getdata1: Flags [.], seq 99960:101388, ack 1, win 4107, options [nop,nop,TS val 838730 ecr 1067456,mptcp dss ack 2724680102 seq 1002989866 subseq 481237 len 1428 csum 0x5e92], length 1428
20:05:45.951287 IP 112.26.1.1.targus-getdata1 > 112.26.1.8.40819: Flags [.], ack 101388, win 23807, options [nop,nop,TS val 1068800 ecr 838272,mptcp dss ack 1002847066], length 0
20:05:46.082352 IP 112.26.1.1.targus-getdata1 > 112.26.1.8.40819: Flags [.], ack 101388, win 23807, options [nop,nop,TS val 1068800 ecr 838272,mptcp dss ack 1002847066], length 0
20:05:46.127801 IP 112.26.1.8.40819 > 112.26.1.1.targus-getdata1: Flags [.], seq 101388:102816, ack 1, win 4107, options [nop,nop,TS val 838730 ecr 1067456,mptcp dss ack 2724680102 seq 1002991294 subseq 482665 len 1428 csum 0x9fa1], length 1428
20:05:46.211805 IP 112.26.1.8.40819 > 112.26.1.1.targus-getdata1: Flags [.], seq 102816:104244, ack 1, win 4107, options [nop,nop,TS val 838730 ecr 1067456,mptcp dss ack 2724680102 seq 1002992722 subseq 484093 len 1428 csum 0x16e1], length 1428
20:05:46.312383 IP 112.26.1.8.40819 > 112.26.1.1.targus-getdata1: Flags [.], seq 104244:105672, ack 1, win 4107, options [nop,nop,TS val 839211 ecr 1067786,mptcp dss ack 2724680102 seq 1003007002 subseq 485521 len 1428 csum 0xd3a7], length 1428
20:05:46.378285 IP 112.26.1.8.40819 > 112.26.1.1.targus-getdata1: Flags [.], seq 105672:107100, ack 1, win 4107, options [nop,nop,TS val 839211 ecr 1067786,mptcp dss ack 2724680102 seq 1003008430 subseq 486949 len 1428 csum 0x39c9], length 1428
20:05:46.378611 IP 112.26.1.1.targus-getdata1 > 112.26.1.8.40819: Flags [.], ack 107100, win 23807, options [nop,nop,TS val 1069227 ecr 838730,mptcp dss ack 1002847066], length 0
20:05:46.477824 IP 112.26.1.1.targus-getdata1 > 112.26.1.8.40819: Flags [.], ack 107100, win 23807, options [nop,nop,TS val 1069227 ecr 838730,mptcp dss ack 1002847066], length 0
20:05:46.515653 IP 112.26.1.8.40819 > 112.26.1.1.targus-getdata1: Flags [.], seq 107100:108528, ack 1, win 4107, options [nop,nop,TS val 839211 ecr 1067786,mptcp dss ack 2724680102 seq 1003009858 subseq 488377 len 1428 csum 0x733c], length 1428
20:05:46.722865 IP 112.26.1.8.40819 > 112.26.1.1.targus-getdata1: Flags [.], seq 108528:109956, ack 1, win 4107, options [nop,nop,TS val 839475 ecr 1068224,mptcp dss ack 2724680102 seq 1003016998 subseq 489805 len 1428 csum 0x2204], length 1428
20:05:46.723215 IP 112.26.1.1.targus-getdata1 > 112.26.1.8.40819: Flags [.], ack 109956, win 23807, options [nop,nop,TS val 1069572 ecr 839211,mptcp dss ack 1002847066], length 0
20:05:46.786759 IP 112.26.1.1.targus-getdata1 > 112.26.1.8.40819: Flags [.], ack 109956, win 23807, options [nop,nop,TS val 1069572 ecr 839211,mptcp dss ack 1002847066], length 0
