17:35:04.903182 IP 112.26.0.8.50820 > 112.26.0.1.targus-getdata1: Flags [S], seq 3783106475, win 29200, options [mss 1460,sackOK,TS val 1081770 ecr 0,nop,wscale 7,mptcp capable csum {0x629ef218f5d558f6}], length 0
17:35:04.903601 IP 112.26.0.1.targus-getdata1 > 112.26.0.8.50820: Flags [S.], seq 3105732311, ack 3783106476, win 65535, options [mss 1460,sackOK,TS val 1314692 ecr 1081770,nop,wscale 6,mptcp capable csum {0x2335d22d21f6ec3e}], length 0
17:35:04.919949 IP 112.26.0.1.targus-getdata1 > 112.26.0.8.50820: Flags [S.], seq 3105732311, ack 3783106476, win 65535, options [mss 1460,sackOK,TS val 1314692 ecr 1081770,nop,wscale 6,mptcp capable csum {0x2335d22d21f6ec3e}], length 0
17:35:04.951941 IP 112.26.0.8.50820 > 112.26.0.1.targus-getdata1: Flags [.], ack 1, win 229, options [nop,nop,TS val 1081842 ecr 1314692,mptcp capable csum {0x629ef218f5d558f6,0x2335d22d21f6ec3e},mptcp dss ack 2452462160], length 0
17:35:04.952369 IP 112.26.0.1.targus-getdata1 > 112.26.0.8.50820: Flags [.], ack 1, win 1339, options [nop,nop,TS val 1314741 ecr 1081842,mptcp add-addr id 3 112.26.1.1,mptcp dss ack 1152732491], length 0
17:35:04.952428 IP 112.26.0.1.targus-getdata1 > 112.26.0.8.50820: Flags [.], ack 1, win 1339, options [nop,nop,TS val 1314741 ecr 1081842,mptcp add-addr id 4 112.26.2.1,mptcp dss ack 1152732491], length 0
17:35:04.952466 IP 112.26.0.1.targus-getdata1 > 112.26.0.8.50820: Flags [.], ack 1, win 1339, options [nop,nop,TS val 1314741 ecr 1081842,mptcp add-addr id 6 112.26.3.1,mptcp dss ack 1152732491], length 0
17:35:37.263585 IP 112.26.0.1.targus-getdata1 > 112.26.0.8.50822: Flags [.], ack 3324094590, win 24333, options [nop,nop,TS val 1346964 ecr 1113464,nop,nop,sack 1 {1429:11425},mptcp dss ack 3528330014], length 0
17:35:37.318258 IP 112.26.0.8.50822 > 112.26.0.1.targus-getdata1: Flags [.], seq 11425:12853, ack 0, win 913, options [nop,nop,TS val 1113921 ecr 1346175,mptcp dss ack 3644063658 seq 3528422834 subseq 289922 len 1428 csum 0x735a], length 1428
17:35:37.318552 IP 112.26.0.1.targus-getdata1 > 112.26.0.8.50822: Flags [.], ack 1, win 24333, options [nop,nop,TS val 1347107 ecr 1113464,nop,nop,sack 1 {1429:12853},mptcp dss ack 3528330014], length 0
17:35:37.384381 IP 112.26.0.8.50822 > 112.26.0.1.targus-getdata1: Flags [.], seq 1:1429, ack 0, win 913, options [nop,nop,TS val 1113531 ecr 1345812,mptcp dss ack 3644063658 seq 3528350006 subseq 278498 len 1428 csum 0xb862], length 1428
17:36:00.752866 IP 112.26.0.8.50822 > 112.26.0.1.targus-getdata1: Flags [.], seq 227053:228481, ack 0, win 913, options [nop,nop,TS val 1137101 ecr 1369324,mptcp dss ack 3644063658 seq 3529313906 subseq 505550 len 1428 csum 0xefdc], length 1428
17:36:25.830679 IP 112.26.0.8.50822 > 112.26.0.1.targus-getdata1: Flags [.], seq 474097:475525, ack 0, win 913, options [nop,nop,TS val 1162255 ecr 1394497,mptcp dss ack 3644063658 seq 3530400614 subseq 752594 len 1428 csum 0x4314], length 1428
17:36:44.740358 IP 112.26.0.8.50822 > 112.26.0.1.targus-getdata1: Flags [.], seq 665449:666877, ack 0, win 913, options [nop,nop,TS val 1181141 ecr 1413418,mptcp dss ack 3644063658 seq 3531233138 subseq 943946 len 1428 csum 0x642e], length 1428
17:36:44.740695 IP 112.26.0.1.targus-getdata1 > 112.26.0.8.50822: Flags [.], ack 666877, win 24097, options [nop,nop,TS val 1414529 ecr 1181141,mptcp dss ack 3531131750], length 0
17:36:44.744887 IP 112.26.0.1.targus-getdata1 > 112.26.0.8.50822: Flags [.], ack 666877, win 24097, options [nop,nop,TS val 1414529 ecr 1181141,mptcp dss ack 3531131750], length 0
17:36:44.938952 IP 112.26.0.8.50822 > 112.26.0.1.targus-getdata1: Flags [.], seq 666877:668305, ack 0, win 913, options [nop,nop,TS val 1181141 ecr 1413418,mptcp dss ack 3644063658 seq 3531234566 subseq 945374 len 1428 csum 0xe0ee], length 1428
17:36:44.939315 IP 112.26.0.1.targus-getdata1 > 112.26.0.8.50822: Flags [.], ack 668305, win 24097, options [nop,nop,TS val 1414727 ecr 1181141,mptcp dss ack 3531131750], length 0
17:36:44.945460 IP 112.26.0.1.targus-getdata1 > 112.26.0.8.50822: Flags [.], ack 668305, win 24097, options [nop,nop,TS val 1414727 ecr 1181141,mptcp dss ack 3531131750], length 0
17:36:45.011050 IP 112.26.0.8.50822 > 112.26.0.1.targus-getdata1: Flags [.], seq 668305:669733, ack 0, win 913, options [nop,nop,TS val 1181264 ecr 1413508,mptcp dss ack 3644063658 seq 3531237422 subseq 946802 len 1428 csum 0x3828], length 1428
17:36:45.050872 IP 112.26.0.1.targus-getdata1 > 112.26.0.8.50822: Flags [.], ack 669733, win 24097, options [nop,nop,TS val 1414840 ecr 1181264,mptcp dss ack 3531131750], length 0
17:36:45.054314 IP 112.26.0.1.targus-getdata1 > 112.26.0.8.50822: Flags [.], ack 669733, win 24097, options [nop,nop,TS val 1414840 ecr 1181264,mptcp dss ack 3531131750], length 0
17:36:45.093398 IP 112.26.0.8.50822 > 112.26.0.1.targus-getdata1: Flags [.], seq 669733:671161, ack 0, win 913, options [nop,nop,TS val 1181318 ecr 1413604,mptcp dss ack 3644063658 seq 3531240278 subseq 948230 len 1428 csum 0x3102], length 1428
17:36:45.133944 IP 112.26.0.1.targus-getdata1 > 112.26.0.8.50822: Flags [.], ack 671161, win 24097, options [nop,nop,TS val 1414923 ecr 1181318,mptcp dss ack 3531131750], length 0
17:36:45.145203 IP 112.26.0.1.targus-getdata1 > 112.26.0.8.50822: Flags [.], ack 671161, win 24097, options [nop,nop,TS val 1414923 ecr 1181318,mptcp dss ack 3531131750], length 0
17:36:45.254112 IP 112.26.0.8.50822 > 112.26.0.1.targus-getdata1: Flags [.], seq 672589:674017, ack 0, win 913, options [nop,nop,TS val 1181488 ecr 1413787,mptcp dss ack 3644063658 seq 3531247418 subseq 951086 len 1428 csum 0x8db8], length 1428
17:36:45.254440 IP 112.26.0.1.targus-getdata1 > 112.26.0.8.50822: Flags [.], ack 671161, win 24097, options [nop,nop,TS val 1415043 ecr 1181318,nop,nop,sack 1 {672589:674017},mptcp dss ack 3531131750], length 0
17:36:45.261676 IP 112.26.0.1.targus-getdata1 > 112.26.0.8.50822: Flags [.], ack 671161, win 24097, options [nop,nop,TS val 1415043 ecr 1181318,nop,nop,sack 1 {672589:674017},mptcp dss ack 3531131750], length 0
17:36:45.355682 IP 112.26.0.8.50822 > 112.26.0.1.targus-getdata1: Flags [.], seq 674017:675445, ack 0, win 913, options [nop,nop,TS val 1181516 ecr 1413873,mptcp dss ack 3644063658 seq 3531248846 subseq 952514 len 1428 csum 0x1dae], length 1428
17:36:45.356130 IP 112.26.0.1.targus-getdata1 > 112.26.0.8.50822: Flags [.], ack 671161, win 24097, options [nop,nop,TS val 1415145 ecr 1181318,nop,nop,sack 1 {672589:675445},mptcp dss ack 3531131750], length 0
17:36:45.364674 IP 112.26.0.1.targus-getdata1 > 112.26.0.8.50822: Flags [.], ack 671161, win 24097, options [nop,nop,TS val 1415145 ecr 1181318,nop,nop,sack 1 {672589:675445},mptcp dss ack 3531131750], length 0
17:36:45.428675 IP 112.26.0.8.50822 > 112.26.0.1.targus-getdata1: Flags [.], seq 675445:676873, ack 0, win 913, options [nop,nop,TS val 1181516 ecr 1413873,mptcp dss ack 3644063658 seq 3531250274 subseq 953942 len 1428 csum 0xa412], length 1428
17:36:45.429043 IP 112.26.0.1.targus-getdata1 > 112.26.0.8.50822: Flags [.], ack 671161, win 24097, options [nop,nop,TS val 1415218 ecr 1181318,nop,nop,sack 1 {672589:676873},mptcp dss ack 3531131750], length 0
17:36:45.461230 IP 112.26.0.1.targus-getdata1 > 112.26.0.8.50822: Flags [.], ack 671161, win 24097, options [nop,nop,TS val 1415218 ecr 1181318,nop,nop,sack 1 {672589:676873},mptcp dss ack 3531131750], length 0
17:36:45.523527 IP 112.26.0.8.50822 > 112.26.0.1.targus-getdata1: Flags [.], seq 678301:679729, ack 0, win 913, options [nop,nop,TS val 1181781 ecr 1414066,mptcp dss ack 3644063658 seq 3531257414 subseq 956798 len 1428 csum 0x4814], length 1428
17:36:45.523814 IP 112.26.0.1.targus-getdata1 > 112.26.0.8.50822: Flags [.], ack 671161, win 24097, options [nop,nop,TS val 1415312 ecr 1181318,nop,nop,sack 2 {678301:679729}{672589:676873},mptcp dss ack 3531131750], length 0
17:36:45.552623 IP 112.26.0.1.targus-getdata1 > 112.26.0.8.50822: Flags [.], ack 671161, win 24097, options [nop,nop,TS val 1415312 ecr 1181318,nop,nop,sack 2 {678301:679729}{672589:676873},mptcp dss ack 3531131750], length 0
17:36:45.790733 IP 112.26.0.8.50822 > 112.26.0.1.targus-getdata1: Flags [.], seq 679729:681157, ack 0, win 913, options [nop,nop,TS val 1182091 ecr 1414269,mptcp dss ack 3644063658 seq 3531270266 subseq 958226 len 1428 csum 0xdfb0], length 1428
17:36:45.791028 IP 112.26.0.1.targus-getdata1 > 112.26.0.8.50822: Flags [.], ack 671161, win 24097, options [nop,nop,TS val 1415579 ecr 1181318,nop,nop,sack 2 {678301:681157}{672589:676873},mptcp dss ack 3531131750], length 0
17:36:45.800921 IP 112.26.0.1.targus-getdata1 > 112.26.0.8.50822: Flags [.], ack 671161, win 24097, options [nop,nop,TS val 1415579 ecr 1181318,nop,nop,sack 2 {678301:681157}{672589:676873},mptcp dss ack 3531131750], length 0
17:36:46.181092 IP 112.26.0.8.50822 > 112.26.0.1.targus-getdata1: Flags [.], seq 681157:682585, ack 0, win 913, options [nop,nop,TS val 1182509 ecr 1414727,mptcp dss ack 3644063658 seq 3531284546 subseq 959654 len 1428 csum 0xa63d], length 1428
17:36:46.181436 IP 112.26.0.1.targus-getdata1 > 112.26.0.8.50822: Flags [.], ack 671161, win 23986, options [nop,nop,TS val 1415970 ecr 1181318,nop,nop,sack 2 {678301:682585}{672589:676873},mptcp dss ack 3531193154], length 0
17:36:46.185680 IP 112.26.0.1.targus-getdata1 > 112.26.0.8.50822: Flags [.], ack 671161, win 23986, options [nop,nop,TS val 1415970 ecr 1181318,nop,nop,sack 2 {678301:682585}{672589:676873},mptcp dss ack 3531193154], length 0
17:36:46.254705 IP 112.26.0.8.50822 > 112.26.0.1.targus-getdata1: Flags [.], seq 682585:684013, ack 0, win 913, options [nop,nop,TS val 1182509 ecr 1414727,mptcp dss ack 3644063658 seq 3531285974 subseq 961082 len 1428 csum 0x550f], length 1428
17:36:46.255035 IP 112.26.0.1.targus-getdata1 > 112.26.0.8.50822: Flags [.], ack 671161, win 23986, options [nop,nop,TS val 1416043 ecr 1181318,nop,nop,sack 2 {678301:684013}{672589:676873},mptcp dss ack 3531193154], length 0
17:36:46.267029 IP 112.26.0.1.targus-getdata1 > 112.26.0.8.50822: Flags [.], ack 671161, win 23986, options [nop,nop,TS val 1416043 ecr 1181318,nop,nop,sack 2 {678301:684013}{672589:676873},mptcp dss ack 3531193154], length 0
17:36:46.370296 IP 112.26.0.8.50822 > 112.26.0.1.targus-getdata1: Flags [.], seq 684013:685441, ack 0, win 913, options [nop,nop,TS val 1182576 ecr 1414840,mptcp dss ack 3644063658 seq 3531288830 subseq 962510 len 1428 csum 0x99ec], length 1428
17:36:46.370622 IP 112.26.0.1.targus-getdata1 > 112.26.0.8.50822: Flags [.], ack 671161, win 23986, options [nop,nop,TS val 1416159 ecr 1181318,nop,nop,sack 2 {678301:685441}{672589:676873},mptcp dss ack 3531193154], length 0
17:36:46.383951 IP 112.26.0.1.targus-getdata1 > 112.26.0.8.50822: Flags [.], ack 671161, win 23986, options [nop,nop,TS val 1416159 ecr 1181318,nop,nop,sack 2 {678301:685441}{672589:676873},mptcp dss ack 3531193154], length 0
17:36:46.418100 IP 112.26.0.8.50822 > 112.26.0.1.targus-getdata1: Flags [.], seq 685441:686869, ack 0, win 913, options [nop,nop,TS val 1182654 ecr 1414923,mptcp dss ack 3644063658 seq 3531293114 subseq 963938 len 1428 csum 0x6f35], length 1428
17:36:46.418447 IP 112.26.0.1.targus-getdata1 > 112.26.0.8.50822: Flags [.], ack 671161, win 23986, options [nop,nop,TS val 1416207 ecr 1181318,nop,nop,sack 2 {678301:686869}{672589:676873},mptcp dss ack 3531193154], length 0
17:36:46.495658 IP 112.26.0.1.targus-getdata1 > 112.26.0.8.50822: Flags [.], ack 671161, win 23986, options [nop,nop,TS val 1416207 ecr 1181318,nop,nop,sack 2 {678301:686869}{672589:676873},mptcp dss ack 3531193154], length 0
17:36:46.529039 IP 112.26.0.8.50822 > 112.26.0.1.targus-getdata1: Flags [.], seq 686869:688297, ack 0, win 913, options [nop,nop,TS val 1182856 ecr 1415043,mptcp dss ack 3644063658 seq 3531297398 subseq 965366 len 1428 csum 0x5fa3], length 1428
17:36:46.529370 IP 112.26.0.1.targus-getdata1 > 112.26.0.8.50822: Flags [.], ack 671161, win 23986, options [nop,nop,TS val 1416317 ecr 1181318,nop,nop,sack 2 {678301:688297}{672589:676873},mptcp dss ack 3531193154], length 0
17:36:46.537068 IP 112.26.0.1.targus-getdata1 > 112.26.0.8.50822: Flags [.], ack 671161, win 23986, options [nop,nop,TS val 1416317 ecr 1181318,nop,nop,sack 2 {678301:688297}{672589:676873},mptcp dss ack 3531193154], length 0
17:36:46.631495 IP 112.26.0.8.50822 > 112.26.0.1.targus-getdata1: Flags [.], seq 688297:689725, ack 0, win 913, options [nop,nop,TS val 1182867 ecr 1415145,mptcp dss ack 3644063658 seq 3531298826 subseq 966794 len 1428 csum 0x5ca5], length 1428
17:36:46.631816 IP 112.26.0.1.targus-getdata1 > 112.26.0.8.50822: Flags [.], ack 671161, win 23986, options [nop,nop,TS val 1416420 ecr 1181318,nop,nop,sack 2 {678301:689725}{672589:676873},mptcp dss ack 3531193154], length 0
17:36:46.635094 IP 112.26.0.1.targus-getdata1 > 112.26.0.8.50822: Flags [.], ack 671161, win 23986, options [nop,nop,TS val 1416420 ecr 1181318,nop,nop,sack 2 {678301:689725}{672589:676873},mptcp dss ack 3531193154], length 0
17:36:46.737772 IP 112.26.0.8.50822 > 112.26.0.1.targus-getdata1: Flags [.], seq 671161:672589, ack 0, win 913, options [nop,nop,TS val 1182933 ecr 1415218,mptcp dss ack 3644063658 seq 3531241706 subseq 949658 len 1428 csum 0x2614], length 1428
17:36:46.738077 IP 112.26.0.1.targus-getdata1 > 112.26.0.8.50822: Flags [.], ack 676873, win 23986, options [nop,nop,TS val 1416526 ecr 1182933,nop,nop,sack 1 {678301:689725},mptcp dss ack 3531193154], length 0
17:36:46.741350 IP 112.26.0.1.targus-getdata1 > 112.26.0.8.50822: Flags [.], ack 676873, win 23986, options [nop,nop,TS val 1416526 ecr 1182933,nop,nop,sack 1 {678301:689725},mptcp dss ack 3531193154], length 0
17:36:46.809485 IP 112.26.0.8.50822 > 112.26.0.1.targus-getdata1: Flags [.], seq 676873:678301, ack 0, win 913, options [nop,nop,TS val 1183008 ecr 1415312,mptcp dss ack 3644063658 seq 3531251702 subseq 955370 len 1428 csum 0x6ba6], length 1428
17:36:46.809854 IP 112.26.0.1.targus-getdata1 > 112.26.0.8.50822: Flags [.], ack 689725, win 23986, options [nop,nop,TS val 1416598 ecr 1183008,mptcp dss ack 3531193154], length 0
17:36:46.856231 IP 112.26.0.1.targus-getdata1 > 112.26.0.8.50822: Flags [.], ack 689725, win 23986, options [nop,nop,TS val 1416598 ecr 1183008,mptcp dss ack 3531193154], length 0
17:36:47.313190 IP 112.26.0.8.50822 > 112.26.0.1.targus-getdata1: Flags [.], seq 689725:691153, ack 0, win 913, options [nop,nop,TS val 1183862 ecr 1416043,mptcp dss ack 3644063658 seq 3531311678 subseq 968222 len 1428 csum 0x44c], length 1428
17:36:47.313534 IP 112.26.0.1.targus-getdata1 > 112.26.0.8.50822: Flags [.], ack 691153, win 23986, options [nop,nop,TS val 1417102 ecr 1183862,mptcp dss ack 3531193154], length 0
17:36:47.320228 IP 112.26.0.1.targus-getdata1 > 112.26.0.8.50822: Flags [.], ack 691153, win 23986, options [nop,nop,TS val 1417102 ecr 1183862,mptcp dss ack 3531193154], length 0
17:36:47.423519 IP 112.26.0.8.50822 > 112.26.0.1.targus-getdata1: Flags [.], seq 691153:692581, ack 0, win 913, options [nop,nop,TS val 1183875 ecr 1416159,mptcp dss ack 3644063658 seq 3531313106 subseq 969650 len 1428 csum 0x629c], length 1428
17:36:47.423836 IP 112.26.0.1.targus-getdata1 > 112.26.0.8.50822: Flags [.], ack 692581, win 24156, options [nop,nop,TS val 1417212 ecr 1183875,mptcp dss ack 3531273122], length 0
17:36:47.436803 IP 112.26.0.1.targus-getdata1 > 112.26.0.8.50822: Flags [.], ack 692581, win 24156, options [nop,nop,TS val 1417212 ecr 1183875,mptcp dss ack 3531273122], length 0
17:36:47.516169 IP 112.26.0.8.50822 > 112.26.0.1.targus-getdata1: Flags [.], seq 692581:694009, ack 0, win 913, options [nop,nop,TS val 1183952 ecr 1416207,mptcp dss ack 3644063658 seq 3531318818 subseq 971078 len 1428 csum 0x80e0], length 1428
17:36:47.516548 IP 112.26.0.1.targus-getdata1 > 112.26.0.8.50822: Flags [.], ack 694009, win 24156, options [nop,nop,TS val 1417305 ecr 1183952,mptcp dss ack 3531273122], length 0
17:36:47.525559 IP 112.26.0.1.targus-getdata1 > 112.26.0.8.50822: Flags [.], ack 694009, win 24156, options [nop,nop,TS val 1417305 ecr 1183952,mptcp dss ack 3531273122], length 0
17:36:47.588249 IP 112.26.0.8.50822 > 112.26.0.1.targus-getdata1: Flags [.], seq 694009:695437, ack 0, win 913, options [nop,nop,TS val 1184034 ecr 1416317,mptcp dss ack 3644063658 seq 3531320246 subseq 972506 len 1428 csum 0x7d5a], length 1428
17:36:47.588585 IP 112.26.0.1.targus-getdata1 > 112.26.0.8.50822: Flags [.], ack 695437, win 24192, options [nop,nop,TS val 1417377 ecr 1184034,mptcp dss ack 3531281690], length 0
17:36:47.606002 IP 112.26.0.1.targus-getdata1 > 112.26.0.8.50822: Flags [.], ack 695437, win 24192, options [nop,nop,TS val 1417377 ecr 1184034,mptcp dss ack 3531281690], length 0
17:36:47.664177 IP 112.26.0.8.50822 > 112.26.0.1.targus-getdata1: Flags [.], seq 695437:696865, ack 0, win 913, options [nop,nop,TS val 1184128 ecr 1416420,mptcp dss ack 3644063658 seq 3531327386 subseq 973934 len 1428 csum 0x179c], length 1428
17:36:47.664438 IP 112.26.0.1.targus-getdata1 > 112.26.0.8.50822: Flags [.], ack 696865, win 24540, options [nop,nop,TS val 1417453 ecr 1184128,mptcp dss ack 3531323102], length 0
17:36:47.688738 IP 112.26.0.1.targus-getdata1 > 112.26.0.8.50822: Flags [.], ack 696865, win 24540, options [nop,nop,TS val 1417453 ecr 1184128,mptcp dss ack 3531323102], length 0
17:36:47.730496 IP 112.26.0.8.50822 > 112.26.0.1.targus-getdata1: Flags [.], seq 696865:698293, ack 0, win 913, options [nop,nop,TS val 1184128 ecr 1416526,mptcp dss ack 3644063658 seq 3531328814 subseq 975362 len 1428 csum 0x32df], length 1428
17:36:47.730845 IP 112.26.0.1.targus-getdata1 > 112.26.0.8.50822: Flags [.], ack 698293, win 24540, options [nop,nop,TS val 1417519 ecr 1184128,mptcp dss ack 3531330242], length 0
17:36:47.769403 IP 112.26.0.1.targus-getdata1 > 112.26.0.8.50822: Flags [.], ack 698293, win 24540, options [nop,nop,TS val 1417519 ecr 1184128,mptcp dss ack 3531330242], length 0
17:36:47.872734 IP 112.26.0.8.50822 > 112.26.0.1.targus-getdata1: Flags [P.], seq 698293:699721, ack 0, win 913, options [nop,nop,TS val 1184185 ecr 1416598,mptcp dss ack 3644063658 seq 3531333098 subseq 976790 len 1428 csum 0x890b], length 1428
17:36:47.873068 IP 112.26.0.1.targus-getdata1 > 112.26.0.8.50822: Flags [.], ack 699721, win 24494, options [nop,nop,TS val 1417661 ecr 1184185,mptcp dss ack 3531337382], length 0
17:36:47.879197 IP 112.26.0.1.targus-getdata1 > 112.26.0.8.50822: Flags [.], ack 699721, win 24494, options [nop,nop,TS val 1417661 ecr 1184185,mptcp dss ack 3531337382], length 0
17:36:48.223382 IP 112.26.0.8.50822 > 112.26.0.1.targus-getdata1: Flags [.], seq 699721:701149, ack 0, win 913, options [nop,nop,TS val 1184721 ecr 1417102,mptcp dss ack 3644063658 seq 3531353090 subseq 978218 len 1428 csum 0xcbd0], length 1428
17:36:48.223658 IP 112.26.0.1.targus-getdata1 > 112.26.0.8.50822: Flags [.], ack 701149, win 24558, options [nop,nop,TS val 1418012 ecr 1184721,mptcp dss ack 3531350234], length 0
17:36:48.242212 IP 112.26.0.1.targus-getdata1 > 112.26.0.8.50822: Flags [.], ack 701149, win 24558, options [nop,nop,TS val 1418012 ecr 1184721,mptcp dss ack 3531350234], length 0
17:36:48.412971 IP 112.26.0.8.50822 > 112.26.0.1.targus-getdata1: Flags [.], seq 701149:702577, ack 0, win 913, options [nop,nop,TS val 1184884 ecr 1417212,mptcp dss ack 3644063658 seq 3531363086 subseq 979646 len 1428 csum 0xbdbd], length 1428
17:36:48.413328 IP 112.26.0.1.targus-getdata1 > 112.26.0.8.50822: Flags [.], ack 702577, win 24558, options [nop,nop,TS val 1418202 ecr 1184884,mptcp dss ack 3531355946], length 0
17:36:48.418240 IP 112.26.0.1.targus-getdata1 > 112.26.0.8.50822: Flags [.], ack 702577, win 24558, options [nop,nop,TS val 1418202 ecr 1184884,mptcp dss ack 3531355946], length 0
17:36:48.530000 IP 112.26.0.8.50822 > 112.26.0.1.targus-getdata1: Flags [.], seq 702577:704005, ack 0, win 913, options [nop,nop,TS val 1184884 ecr 1417212,mptcp dss ack 3644063658 seq 3531364514 subseq 981074 len 1428 csum 0xb1ab], length 1428
17:36:48.530412 IP 112.26.0.1.targus-getdata1 > 112.26.0.8.50822: Flags [.], ack 704005, win 24540, options [nop,nop,TS val 1418319 ecr 1184884,mptcp dss ack 3531358802], length 0
17:36:48.536164 IP 112.26.0.1.targus-getdata1 > 112.26.0.8.50822: Flags [.], ack 704005, win 24540, options [nop,nop,TS val 1418319 ecr 1184884,mptcp dss ack 3531358802], length 0
17:36:48.605678 IP 112.26.0.8.50822 > 112.26.0.1.targus-getdata1: Flags [.], seq 704005:705433, ack 0, win 913, options [nop,nop,TS val 1184947 ecr 1417305,mptcp dss ack 3644063658 seq 3531370226 subseq 982502 len 1428 csum 0x2347], length 1428
17:36:48.605976 IP 112.26.0.1.targus-getdata1 > 112.26.0.8.50822: Flags [.], ack 705433, win 24518, options [nop,nop,TS val 1418395 ecr 1184947,mptcp dss ack 3531360230], length 0
17:36:48.611762 IP 112.26.0.1.targus-getdata1 > 112.26.0.8.50822: Flags [.], ack 705433, win 24518, options [nop,nop,TS val 1418395 ecr 1184947,mptcp dss ack 3531360230], length 0
17:36:48.706370 IP 112.26.0.8.50822 > 112.26.0.1.targus-getdata1: Flags [.], seq 705433:706861, ack 0, win 913, options [nop,nop,TS val 1184971 ecr 1417377,mptcp dss ack 3644063658 seq 3531371654 subseq 983930 len 1428 csum 0x980], length 1428
17:36:48.706736 IP 112.26.0.1.targus-getdata1 > 112.26.0.8.50822: Flags [.], ack 706861, win 24525, options [nop,nop,TS val 1418495 ecr 1184971,mptcp dss ack 3531367370], length 0
17:36:48.724106 IP 112.26.0.1.targus-getdata1 > 112.26.0.8.50822: Flags [.], ack 706861, win 24525, options [nop,nop,TS val 1418495 ecr 1184971,mptcp dss ack 3531367370], length 0
17:36:48.810761 IP 112.26.0.8.50822 > 112.26.0.1.targus-getdata1: Flags [.], seq 706861:708289, ack 0, win 913, options [nop,nop,TS val 1185036 ecr 1417453,mptcp dss ack 3644063658 seq 3531374510 subseq 985358 len 1428 csum 0x98d1], length 1428
17:36:48.811056 IP 112.26.0.1.targus-getdata1 > 112.26.0.8.50822: Flags [.], ack 708289, win 24503, options [nop,nop,TS val 1418600 ecr 1185036,mptcp dss ack 3531368798], length 0
17:36:48.817654 IP 112.26.0.1.targus-getdata1 > 112.26.0.8.50822: Flags [.], ack 708289, win 24503, options [nop,nop,TS val 1418600 ecr 1185036,mptcp dss ack 3531368798], length 0
17:36:48.889368 IP 112.26.0.8.50822 > 112.26.0.1.targus-getdata1: Flags [.], seq 708289:709717, ack 0, win 913, options [nop,nop,TS val 1185067 ecr 1417519,mptcp dss ack 3644063658 seq 3531378794 subseq 986786 len 1428 csum 0xa418], length 1428
17:36:48.889692 IP 112.26.0.1.targus-getdata1 > 112.26.0.8.50822: Flags [.], ack 709717, win 24491, options [nop,nop,TS val 1418678 ecr 1185067,mptcp dss ack 3531377366], length 0
17:36:48.935788 IP 112.26.0.1.targus-getdata1 > 112.26.0.8.50822: Flags [.], ack 709717, win 24491, options [nop,nop,TS val 1418678 ecr 1185067,mptcp dss ack 3531377366], length 0
17:36:48.952651 IP 112.26.0.8.50822 > 112.26.0.1.targus-getdata1: Flags [.], seq 709717:711145, ack 0, win 913, options [nop,nop,TS val 1185273 ecr 1417661,mptcp dss ack 3644063658 seq 3531391646 subseq 988214 len 1428 csum 0xff67], length 1428
17:36:48.994026 IP 112.26.0.1.targus-getdata1 > 112.26.0.8.50822: Flags [.], ack 711145, win 24491, options [nop,nop,TS val 1418783 ecr 1185273,mptcp dss ack 3531377366], length 0
17:36:49.031374 IP 112.26.0.1.targus-getdata1 > 112.26.0.8.50822: Flags [.], ack 711145, win 24491, options [nop,nop,TS val 1418783 ecr 1185273,mptcp dss ack 3531377366], length 0
17:36:49.272792 IP 112.26.0.8.50822 > 112.26.0.1.targus-getdata1: Flags [.], seq 711145:712573, ack 0, win 913, options [nop,nop,TS val 1185671 ecr 1418012,mptcp dss ack 3644063658 seq 3531408782 subseq 989642 len 1428 csum 0x8946], length 1428
17:36:49.313965 IP 112.26.0.1.targus-getdata1 > 112.26.0.8.50822: Flags [.], ack 712573, win 24536, options [nop,nop,TS val 1419103 ecr 1185671,mptcp dss ack 3531398786], length 0
17:36:49.317784 IP 112.26.0.1.targus-getdata1 > 112.26.0.8.50822: Flags [.], ack 712573, win 24536, options [nop,nop,TS val 1419103 ecr 1185671,mptcp dss ack 3531398786], length 0
17:36:49.543852 IP 112.26.0.8.50822 > 112.26.0.1.targus-getdata1: Flags [.], seq 712573:714001, ack 0, win 913, options [nop,nop,TS val 1185962 ecr 1418202,mptcp dss ack 3644063658 seq 3531418778 subseq 991070 len 1428 csum 0x6b3a], length 1428
17:36:49.584973 IP 112.26.0.1.targus-getdata1 > 112.26.0.8.50822: Flags [.], ack 714001, win 24558, options [nop,nop,TS val 1419374 ecr 1185962,mptcp dss ack 3531415922], length 0
17:36:49.587665 IP 112.26.0.1.targus-getdata1 > 112.26.0.8.50822: Flags [.], ack 714001, win 24558, options [nop,nop,TS val 1419374 ecr 1185962,mptcp dss ack 3531415922], length 0
17:36:49.634830 IP 112.26.0.8.50822 > 112.26.0.1.targus-getdata1: Flags [.], seq 714001:715429, ack 0, win 913, options [nop,nop,TS val 1186025 ecr 1418319,mptcp dss ack 3644063658 seq 3531420206 subseq 992498 len 1428 csum 0xc53a], length 1428
17:36:49.675844 IP 112.26.0.1.targus-getdata1 > 112.26.0.8.50822: Flags [.], ack 715429, win 24558, options [nop,nop,TS val 1419465 ecr 1186025,mptcp dss ack 3531421634], length 0
17:36:49.678758 IP 112.26.0.1.targus-getdata1 > 112.26.0.8.50822: Flags [.], ack 715429, win 24558, options [nop,nop,TS val 1419465 ecr 1186025,mptcp dss ack 3531421634], length 0
17:36:49.724236 IP 112.26.0.8.50822 > 112.26.0.1.targus-getdata1: Flags [.], seq 715429:716857, ack 0, win 913, options [nop,nop,TS val 1186025 ecr 1418319,mptcp dss ack 3644063658 seq 3531421634 subseq 993926 len 1428 csum 0xba4c], length 1428
17:36:49.764892 IP 112.26.0.1.targus-getdata1 > 112.26.0.8.50822: Flags [.], ack 716857, win 24558, options [nop,nop,TS val 1419554 ecr 1186025,mptcp dss ack 3531425918], length 0
17:36:49.776218 IP 112.26.0.1.targus-getdata1 > 112.26.0.8.50822: Flags [.], ack 716857, win 24558, options [nop,nop,TS val 1419554 ecr 1186025,mptcp dss ack 3531425918], length 0
17:36:49.797779 IP 112.26.0.8.50822 > 112.26.0.1.targus-getdata1: Flags [.], seq 716857:718285, ack 0, win 913, options [nop,nop,TS val 1186076 ecr 1418395,mptcp dss ack 3644063658 seq 3531425918 subseq 995354 len 1428 csum 0x4b3d], length 1428
17:36:49.839035 IP 112.26.0.1.targus-getdata1 > 112.26.0.8.50822: Flags [.], ack 718285, win 24558, options [nop,nop,TS val 1419628 ecr 1186076,mptcp dss ack 3531428774], length 0
17:36:49.861442 IP 112.26.0.1.targus-getdata1 > 112.26.0.8.50822: Flags [.], ack 718285, win 24558, options [nop,nop,TS val 1419628 ecr 1186076,mptcp dss ack 3531428774], length 0
17:36:49.944640 IP 112.26.0.8.50822 > 112.26.0.1.targus-getdata1: Flags [.], seq 718285:719713, ack 0, win 913, options [nop,nop,TS val 1186140 ecr 1418495,mptcp dss ack 3644063658 seq 3531428774 subseq 996782 len 1428 csum 0xb1e6], length 1428
17:36:49.985218 IP 112.26.0.1.targus-getdata1 > 112.26.0.8.50822: Flags [.], ack 719713, win 24525, options [nop,nop,TS val 1419774 ecr 1186140,mptcp dss ack 3531433058], length 0
17:36:49.990184 IP 112.26.0.1.targus-getdata1 > 112.26.0.8.50822: Flags [.], ack 719713, win 24525, options [nop,nop,TS val 1419774 ecr 1186140,mptcp dss ack 3531433058], length 0
17:36:50.035723 IP 112.26.0.8.50822 > 112.26.0.1.targus-getdata1: Flags [.], seq 719713:721141, ack 0, win 913, options [nop,nop,TS val 1186279 ecr 1418600,mptcp dss ack 3644063658 seq 3531438770 subseq 998210 len 1428 csum 0x8d59], length 1428
17:36:50.076394 IP 112.26.0.1.targus-getdata1 > 112.26.0.8.50822: Flags [.], ack 721141, win 24525, options [nop,nop,TS val 1419865 ecr 1186279,mptcp dss ack 3531434486], length 0
17:36:50.078794 IP 112.26.0.1.targus-getdata1 > 112.26.0.8.50822: Flags [.], ack 721141, win 24525, options [nop,nop,TS val 1419865 ecr 1186279,mptcp dss ack 3531434486], length 0
17:36:50.194770 IP 112.26.0.8.50822 > 112.26.0.1.targus-getdata1: Flags [.], seq 721141:722569, ack 0, win 913, options [nop,nop,TS val 1186341 ecr 1418678,mptcp dss ack 3644063658 seq 3531441626 subseq 999638 len 1428 csum 0x947d], length 1428
17:36:50.235909 IP 112.26.0.1.targus-getdata1 > 112.26.0.8.50822: Flags [.], ack 722569, win 24509, options [nop,nop,TS val 1420025 ecr 1186341,mptcp dss ack 3531443054], length 0
17:36:50.239579 IP 112.26.0.1.targus-getdata1 > 112.26.0.8.50822: Flags [.], ack 722569, win 24509, options [nop,nop,TS val 1420025 ecr 1186341,mptcp dss ack 3531443054], length 0
17:36:50.311609 IP 112.26.0.8.50822 > 112.26.0.1.targus-getdata1: Flags [.], seq 722569:723997, ack 0, win 913, options [nop,nop,TS val 1186409 ecr 1418783,mptcp dss ack 3644063658 seq 3531443054 subseq 1001066 len 1428 csum 0x8f40], length 1428
17:36:50.351906 IP 112.26.0.1.targus-getdata1 > 112.26.0.8.50822: Flags [.], ack 723997, win 24509, options [nop,nop,TS val 1420141 ecr 1186409,mptcp dss ack 3531448766], length 0
17:36:50.357599 IP 112.26.0.1.targus-getdata1 > 112.26.0.8.50822: Flags [.], ack 723997, win 24509, options [nop,nop,TS val 1420141 ecr 1186409,mptcp dss ack 3531448766], length 0
17:36:50.464560 IP 112.26.0.8.50822 > 112.26.0.1.targus-getdata1: Flags [.], seq 723997:725425, ack 0, win 913, options [nop,nop,TS val 1186811 ecr 1419103,mptcp dss ack 3644063658 seq 3531468758 subseq 1002494 len 1428 csum 0x3ee1], length 1428
17:36:50.504954 IP 112.26.0.1.targus-getdata1 > 112.26.0.8.50822: Flags [.], ack 725425, win 24494, options [nop,nop,TS val 1420294 ecr 1186811,mptcp dss ack 3531451622], length 0
17:36:50.507424 IP 112.26.0.1.targus-getdata1 > 112.26.0.8.50822: Flags [.], ack 725425, win 24494, options [nop,nop,TS val 1420294 ecr 1186811,mptcp dss ack 3531451622], length 0
17:36:50.526133 IP 112.26.0.8.50822 > 112.26.0.1.targus-getdata1: Flags [.], seq 725425:726853, ack 0, win 913, options [nop,nop,TS val 1186811 ecr 1419103,mptcp dss ack 3644063658 seq 3531470186 subseq 1003922 len 1428 csum 0x3db7], length 1428
17:36:50.567204 IP 112.26.0.1.targus-getdata1 > 112.26.0.8.50822: Flags [.], ack 726853, win 24476, options [nop,nop,TS val 1420356 ecr 1186811,mptcp dss ack 3531458762], length 0
17:36:50.593807 IP 112.26.0.1.targus-getdata1 > 112.26.0.8.50822: Flags [.], ack 726853, win 24476, options [nop,nop,TS val 1420356 ecr 1186811,mptcp dss ack 3531458762], length 0
17:36:50.724446 IP 112.26.0.8.50822 > 112.26.0.1.targus-getdata1: Flags [.], seq 726853:728281, ack 0, win 913, options [nop,nop,TS val 1187094 ecr 1419374,mptcp dss ack 3644063658 seq 3531488750 subseq 1005350 len 1428 csum 0x7414], length 1428
17:36:50.765351 IP 112.26.0.1.targus-getdata1 > 112.26.0.8.50822: Flags [.], ack 728281, win 24438, options [nop,nop,TS val 1420554 ecr 1187094,mptcp dss ack 3531461618], length 0
17:36:50.768424 IP 112.26.0.1.targus-getdata1 > 112.26.0.8.50822: Flags [.], ack 728281, win 24438, options [nop,nop,TS val 1420554 ecr 1187094,mptcp dss ack 3531461618], length 0
17:36:50.894666 IP 112.26.0.8.50822 > 112.26.0.1.targus-getdata1: Flags [.], seq 728281:729709, ack 0, win 913, options [nop,nop,TS val 1187189 ecr 1419465,mptcp dss ack 3644063658 seq 3531490178 subseq 1006778 len 1428 csum 0x14b8], length 1428
17:36:50.935497 IP 112.26.0.1.targus-getdata1 > 112.26.0.8.50822: Flags [.], ack 729709, win 24503, options [nop,nop,TS val 1420724 ecr 1187189,mptcp dss ack 3531481610], length 0
17:36:50.945663 IP 112.26.0.1.targus-getdata1 > 112.26.0.8.50822: Flags [.], ack 729709, win 24503, options [nop,nop,TS val 1420724 ecr 1187189,mptcp dss ack 3531481610], length 0
17:36:50.985982 IP 112.26.0.8.50822 > 112.26.0.1.targus-getdata1: Flags [.], seq 729709:731137, ack 0, win 913, options [nop,nop,TS val 1187271 ecr 1419554,mptcp dss ack 3644063658 seq 3531498746 subseq 1008206 len 1428 csum 0x30fd], length 1428
17:36:51.026935 IP 112.26.0.1.targus-getdata1 > 112.26.0.8.50822: Flags [.], ack 731137, win 24503, options [nop,nop,TS val 1420816 ecr 1187271,mptcp dss ack 3531481610], length 0
17:36:51.069089 IP 112.26.0.1.targus-getdata1 > 112.26.0.8.50822: Flags [.], ack 731137, win 24503, options [nop,nop,TS val 1420816 ecr 1187271,mptcp dss ack 3531481610], length 0
17:36:51.158197 IP 112.26.0.8.50822 > 112.26.0.1.targus-getdata1: Flags [.], seq 731137:732565, ack 0, win 913, options [nop,nop,TS val 1187271 ecr 1419554,mptcp dss ack 3644063658 seq 3531500174 subseq 1009634 len 1428 csum 0x2d77], length 1428
17:36:51.199035 IP 112.26.0.1.targus-getdata1 > 112.26.0.8.50822: Flags [.], ack 732565, win 24503, options [nop,nop,TS val 1420988 ecr 1187271,mptcp dss ack 3531481610], length 0
17:36:51.209167 IP 112.26.0.1.targus-getdata1 > 112.26.0.8.50822: Flags [.], ack 732565, win 24503, options [nop,nop,TS val 1420988 ecr 1187271,mptcp dss ack 3531481610], length 0
17:36:51.275985 IP 112.26.0.8.50822 > 112.26.0.1.targus-getdata1: Flags [.], seq 732565:733993, ack 0, win 913, options [nop,nop,TS val 1187316 ecr 1419628,mptcp dss ack 3644063658 seq 3531501602 subseq 1011062 len 1428 csum 0x7e6d], length 1428
17:36:51.316871 IP 112.26.0.1.targus-getdata1 > 112.26.0.8.50822: Flags [.], ack 733993, win 24503, options [nop,nop,TS val 1421106 ecr 1187316,mptcp dss ack 3531481610], length 0
17:36:51.318950 IP 112.26.0.1.targus-getdata1 > 112.26.0.8.50822: Flags [.], ack 733993, win 24503, options [nop,nop,TS val 1421106 ecr 1187316,mptcp dss ack 3531481610], length 0
17:36:51.395943 IP 112.26.0.8.50822 > 112.26.0.1.targus-getdata1: Flags [.], seq 735421:736849, ack 0, win 913, options [nop,nop,TS val 1187527 ecr 1419774,mptcp dss ack 3644063658 seq 3531504458 subseq 1013918 len 1428 csum 0x8f32], length 1428
17:36:51.396288 IP 112.26.0.1.targus-getdata1 > 112.26.0.8.50822: Flags [.], ack 733993, win 24503, options [nop,nop,TS val 1421185 ecr 1187316,nop,nop,sack 1 {735421:736849},mptcp dss ack 3531481610], length 0
17:36:51.407678 IP 112.26.0.1.targus-getdata1 > 112.26.0.8.50822: Flags [.], ack 733993, win 24503, options [nop,nop,TS val 1421185 ecr 1187316,nop,nop,sack 1 {735421:736849},mptcp dss ack 3531481610], length 0
17:36:51.507803 IP 112.26.0.8.50822 > 112.26.0.1.targus-getdata1: Flags [.], seq 736849:738277, ack 0, win 913, options [nop,nop,TS val 1187581 ecr 1419865,mptcp dss ack 3644063658 seq 3531508742 subseq 1015346 len 1428 csum 0xd7d3], length 1428
17:36:51.508082 IP 112.26.0.1.targus-getdata1 > 112.26.0.8.50822: Flags [.], ack 733993, win 24503, options [nop,nop,TS val 1421297 ecr 1187316,nop,nop,sack 1 {735421:738277},mptcp dss ack 3531481610], length 0
17:36:51.516309 IP 112.26.0.1.targus-getdata1 > 112.26.0.8.50822: Flags [.], ack 733993, win 24503, options [nop,nop,TS val 1421297 ecr 1187316,nop,nop,sack 1 {735421:738277},mptcp dss ack 3531481610], length 0
17:36:51.600184 IP 112.26.0.8.50822 > 112.26.0.1.targus-getdata1: Flags [.], seq 738277:739705, ack 0, win 913, options [nop,nop,TS val 1187770 ecr 1420025,mptcp dss ack 3644063658 seq 3531524450 subseq 1016774 len 1428 csum 0x9827], length 1428
17:36:51.600463 IP 112.26.0.1.targus-getdata1 > 112.26.0.8.50822: Flags [.], ack 733993, win 24503, options [nop,nop,TS val 1421389 ecr 1187316,nop,nop,sack 1 {735421:739705},mptcp dss ack 3531481610], length 0
17:36:51.610777 IP 112.26.0.1.targus-getdata1 > 112.26.0.8.50822: Flags [.], ack 733993, win 24503, options [nop,nop,TS val 1421389 ecr 1187316,nop,nop,sack 1 {735421:739705},mptcp dss ack 3531481610], length 0
17:36:51.749681 IP 112.26.0.8.50822 > 112.26.0.1.targus-getdata1: Flags [.], seq 739705:741133, ack 0, win 913, options [nop,nop,TS val 1187938 ecr 1420141,mptcp dss ack 3644063658 seq 3531531590 subseq 1018202 len 1428 csum 0xa687], length 1428
17:36:51.750025 IP 112.26.0.1.targus-getdata1 > 112.26.0.8.50822: Flags [.], ack 733993, win 24503, options [nop,nop,TS val 1421539 ecr 1187316,nop,nop,sack 1 {735421:741133},mptcp dss ack 3531481610], length 0
17:36:51.768308 IP 112.26.0.1.targus-getdata1 > 112.26.0.8.50822: Flags [.], ack 733993, win 24503, options [nop,nop,TS val 1421539 ecr 1187316,nop,nop,sack 1 {735421:741133},mptcp dss ack 3531481610], length 0
17:36:51.847238 IP 112.26.0.8.50822 > 112.26.0.1.targus-getdata1: Flags [.], seq 741133:742561, ack 0, win 913, options [nop,nop,TS val 1187938 ecr 1420141,mptcp dss ack 3644063658 seq 3531533018 subseq 1019630 len 1428 csum 0xa8f4], length 1428
17:36:51.847614 IP 112.26.0.1.targus-getdata1 > 112.26.0.8.50822: Flags [.], ack 733993, win 24503, options [nop,nop,TS val 1421636 ecr 1187316,nop,nop,sack 1 {735421:742561},mptcp dss ack 3531481610], length 0
17:36:51.865043 IP 112.26.0.1.targus-getdata1 > 112.26.0.8.50822: Flags [.], ack 733993, win 24503, options [nop,nop,TS val 1421636 ecr 1187316,nop,nop,sack 1 {735421:742561},mptcp dss ack 3531481610], length 0
17:36:52.016715 IP 112.26.0.8.50822 > 112.26.0.1.targus-getdata1: Flags [.], seq 742561:743989, ack 0, win 913, options [nop,nop,TS val 1188211 ecr 1420356,mptcp dss ack 3644063658 seq 3531550154 subseq 1021058 len 1428 csum 0x81a5], length 1428
17:36:52.016997 IP 112.26.0.1.targus-getdata1 > 112.26.0.8.50822: Flags [.], ack 733993, win 24503, options [nop,nop,TS val 1421806 ecr 1187316,nop,nop,sack 1 {735421:743989},mptcp dss ack 3531481610], length 0
17:36:52.024889 IP 112.26.0.1.targus-getdata1 > 112.26.0.8.50822: Flags [.], ack 733993, win 24503, options [nop,nop,TS val 1421806 ecr 1187316,nop,nop,sack 1 {735421:743989},mptcp dss ack 3531481610], length 0
17:36:52.121638 IP 112.26.0.8.50822 > 112.26.0.1.targus-getdata1: Flags [.], seq 743989:745417, ack 0, win 913, options [nop,nop,TS val 1188211 ecr 1420356,mptcp dss ack 3644063658 seq 3531551582 subseq 1022486 len 1428 csum 0x6e54], length 1428
17:36:52.121987 IP 112.26.0.1.targus-getdata1 > 112.26.0.8.50822: Flags [.], ack 733993, win 24503, options [nop,nop,TS val 1421911 ecr 1187316,nop,nop,sack 1 {735421:745417},mptcp dss ack 3531481610], length 0
17:36:52.126952 IP 112.26.0.1.targus-getdata1 > 112.26.0.8.50822: Flags [.], ack 733993, win 24503, options [nop,nop,TS val 1421911 ecr 1187316,nop,nop,sack 1 {735421:745417},mptcp dss ack 3531481610], length 0
17:36:52.225153 IP 112.26.0.8.50822 > 112.26.0.1.targus-getdata1: Flags [.], seq 745417:746845, ack 0, win 913, options [nop,nop,TS val 1188211 ecr 1420356,mptcp dss ack 3644063658 seq 3531553010 subseq 1023914 len 1428 csum 0xb77f], length 1428
17:36:52.225526 IP 112.26.0.1.targus-getdata1 > 112.26.0.8.50822: Flags [.], ack 733993, win 24503, options [nop,nop,TS val 1422014 ecr 1187316,nop,nop,sack 1 {735421:746845},mptcp dss ack 3531481610], length 0
17:36:52.243659 IP 112.26.0.1.targus-getdata1 > 112.26.0.8.50822: Flags [.], ack 733993, win 24503, options [nop,nop,TS val 1422014 ecr 1187316,nop,nop,sack 1 {735421:746845},mptcp dss ack 3531481610], length 0
17:36:52.372363 IP 112.26.0.8.50822 > 112.26.0.1.targus-getdata1: Flags [.], seq 746845:748273, ack 0, win 913, options [nop,nop,TS val 1188598 ecr 1420724,mptcp dss ack 3644063658 seq 3531577286 subseq 1025342 len 1428 csum 0x6e7b], length 1428
17:36:52.372695 IP 112.26.0.1.targus-getdata1 > 112.26.0.8.50822: Flags [.], ack 733993, win 24503, options [nop,nop,TS val 1422161 ecr 1187316,nop,nop,sack 1 {735421:748273},mptcp dss ack 3531481610], length 0
17:36:52.375518 IP 112.26.0.1.targus-getdata1 > 112.26.0.8.50822: Flags [.], ack 733993, win 24503, options [nop,nop,TS val 1422161 ecr 1187316,nop,nop,sack 1 {735421:748273},mptcp dss ack 3531481610], length 0
17:36:52.539298 IP 112.26.0.8.50822 > 112.26.0.1.targus-getdata1: Flags [.], seq 749701:751129, ack 0, win 913, options [nop,nop,TS val 1188598 ecr 1420724,mptcp dss ack 3644063658 seq 3531580142 subseq 1028198 len 1428 csum 0xe5ac], length 1428
17:36:52.539597 IP 112.26.0.1.targus-getdata1 > 112.26.0.8.50822: Flags [.], ack 733993, win 24503, options [nop,nop,TS val 1422327 ecr 1187316,nop,nop,sack 2 {749701:751129}{735421:748273},mptcp dss ack 3531481610], length 0
17:36:52.543109 IP 112.26.0.1.targus-getdata1 > 112.26.0.8.50822: Flags [.], ack 733993, win 24503, options [nop,nop,TS val 1422327 ecr 1187316,nop,nop,sack 2 {749701:751129}{735421:748273},mptcp dss ack 3531481610], length 0
17:36:52.606997 IP 112.26.0.8.50822 > 112.26.0.1.targus-getdata1: Flags [.], seq 751129:752557, ack 0, win 913, options [nop,nop,TS val 1188853 ecr 1420988,mptcp dss ack 3644063658 seq 3531588710 subseq 1029626 len 1428 csum 0xea39], length 1428
