22:17:43.759961 IP 112.26.2.8.34741 > 112.26.2.1.targus-getdata1: Flags [S], seq 3841100679, win 65535, options [mss 1460,sackOK,TS val 2163826 ecr 0,nop,wscale 6,mptcp join id 6 token 0x7ffa4513 nonce 0xafa479d1], length 0
22:17:43.762855 IP 112.26.2.8.34741 > 112.26.2.1.targus-getdata1: Flags [S], seq 3841100679, win 65535, options [mss 1460,sackOK,TS val 2163826 ecr 0,nop,wscale 6,mptcp join id 6 token 0x7ffa4513 nonce 0xafa479d1], length 0
22:17:43.763032 IP 112.26.2.1.targus-getdata1 > 112.26.2.8.34741: Flags [S.], seq 1077833958, ack 3841100680, win 65535, options [mss 1460,sackOK,TS val 2381692 ecr 2163826,nop,wscale 6,mptcp join id 4 hmac 0x724e6ca15e971d8d nonce 0x14dcf487], length 0
22:17:43.899663 IP 112.26.2.1.targus-getdata1 > 112.26.2.8.34741: Flags [S.], seq 1077833958, ack 3841100680, win 65535, options [mss 1460,sackOK,TS val 2381692 ecr 2163826,nop,wscale 6,mptcp join id 4 hmac 0x724e6ca15e971d8d nonce 0x14dcf487], length 0
22:17:44.014621 IP 112.26.2.8.34741 > 112.26.2.1.targus-getdata1: Flags [.], ack 1, win 4107, options [nop,nop,TS val 2164049 ecr 2381692,mptcp join hmac 0x9d01178ff3c33fdc8d253cd00ce41c18d3418271], length 0
22:17:44.017579 IP 112.26.2.8.34741 > 112.26.2.1.targus-getdata1: Flags [.], ack 1, win 4107, options [nop,nop,TS val 2164049 ecr 2381692,mptcp join hmac 0x9d01178ff3c33fdc8d253cd00ce41c18d3418271], length 0
22:17:44.017896 IP 112.26.2.1.targus-getdata1 > 112.26.2.8.34741: Flags [.], ack 1, win 4017, options [nop,nop,TS val 2381947 ecr 2164049,mptcp dss ack 643515087], length 0
22:18:34.379257 IP 112.26.2.1.targus-getdata1 > 112.26.2.8.40313: Flags [.], ack 4181027859, win 24291, options [nop,nop,TS val 2432028 ecr 2212751,nop,nop,sack 1 {1429:7141},mptcp dss ack 4083910546], length 0
22:18:34.452011 IP 112.26.2.8.40313 > 112.26.2.1.targus-getdata1: Flags [.], seq 9997:11425, ack 0, win 4107, options [nop,nop,TS val 2213340 ecr 2430410,mptcp dss ack 1353584156 seq 4084119034 subseq 411265 len 1428 csum 0x51a8], length 1428
22:18:34.452238 IP 112.26.2.1.targus-getdata1 > 112.26.2.8.40313: Flags [.], ack 1, win 24291, options [nop,nop,TS val 2432381 ecr 2212751,nop,nop,sack 2 {8569:11425}{1429:7141},mptcp dss ack 4083910546], length 0
22:18:34.549729 IP 112.26.2.8.40313 > 112.26.2.1.targus-getdata1: Flags [.], seq 11425:12853, ack 0, win 4107, options [nop,nop,TS val 2213340 ecr 2430410,mptcp dss ack 1353584156 seq 4084120462 subseq 412693 len 1428 csum 0xfc1], length 1428
22:18:34.549939 IP 112.26.2.1.targus-getdata1 > 112.26.2.8.40313: Flags [.], ack 1, win 23479, options [nop,nop,TS val 2432479 ecr 2212751,nop,nop,sack 2 {8569:12853}{1429:7141},mptcp dss ack 4084036210], length 0
22:18:34.627285 IP 112.26.2.8.40313 > 112.26.2.1.targus-getdata1: Flags [.], seq 12853:14281, ack 0, win 4107, options [nop,nop,TS val 2213340 ecr 2430410,mptcp dss ack 1353584156 seq 4084121890 subseq 414121 len 1428 csum 0x6b01], length 1428
22:18:34.627492 IP 112.26.2.1.targus-getdata1 > 112.26.2.8.40313: Flags [.], ack 1, win 23479, options [nop,nop,TS val 2432557 ecr 2212751,nop,nop,sack 2 {8569:14281}{1429:7141},mptcp dss ack 4084036210], length 0
22:18:34.724459 IP 112.26.2.1.targus-getdata1 > 112.26.2.8.40313: Flags [.], ack 1, win 24291, options [nop,nop,TS val 2432218 ecr 2212751,nop,nop,sack 2 {8569:9997}{1429:7141},mptcp dss ack 4083910546], length 0
22:18:34.786303 IP 112.26.2.8.40313 > 112.26.2.1.targus-getdata1: Flags [.], seq 14281:15709, ack 0, win 4107, options [nop,nop,TS val 2213584 ecr 2430691,mptcp dss ack 1353584156 seq 4084134742 subseq 415549 len 1428 csum 0x2d1], length 1428
22:18:34.786543 IP 112.26.2.1.targus-getdata1 > 112.26.2.8.40313: Flags [.], ack 1, win 23925, options [nop,nop,TS val 2432716 ecr 2212751,nop,nop,sack 2 {8569:15709}{1429:7141},mptcp dss ack 4084087618], length 0
22:18:34.879778 IP 112.26.2.8.40313 > 112.26.2.1.targus-getdata1: Flags [.], seq 15709:17137, ack 0, win 4107, options [nop,nop,TS val 2213584 ecr 2430691,mptcp dss ack 1353584156 seq 4084136170 subseq 416977 len 1428 csum 0xeb73], length 1428
22:18:34.879993 IP 112.26.2.1.targus-getdata1 > 112.26.2.8.40313: Flags [.], ack 1, win 23925, options [nop,nop,TS val 2432809 ecr 2212751,nop,nop,sack 2 {8569:17137}{1429:7141},mptcp dss ack 4084087618], length 0
22:18:34.949558 IP 112.26.2.1.targus-getdata1 > 112.26.2.8.40313: Flags [.], ack 1, win 24291, options [nop,nop,TS val 2432381 ecr 2212751,nop,nop,sack 2 {8569:11425}{1429:7141},mptcp dss ack 4083910546], length 0
22:18:35.038819 IP 112.26.2.1.targus-getdata1 > 112.26.2.8.40313: Flags [.], ack 1, win 23479, options [nop,nop,TS val 2432479 ecr 2212751,nop,nop,sack 2 {8569:12853}{1429:7141},mptcp dss ack 4084036210], length 0
22:18:35.082194 IP 112.26.2.1.targus-getdata1 > 112.26.2.8.40313: Flags [.], ack 1, win 23479, options [nop,nop,TS val 2432557 ecr 2212751,nop,nop,sack 2 {8569:14281}{1429:7141},mptcp dss ack 4084036210], length 0
22:18:35.158627 IP 112.26.2.1.targus-getdata1 > 112.26.2.8.40313: Flags [.], ack 1, win 23925, options [nop,nop,TS val 2432716 ecr 2212751,nop,nop,sack 2 {8569:15709}{1429:7141},mptcp dss ack 4084087618], length 0
22:18:35.239905 IP 112.26.2.8.40313 > 112.26.2.1.targus-getdata1: Flags [.], seq 18565:19993, ack 0, win 4107, options [nop,nop,TS val 2214599 ecr 2431659,mptcp dss ack 1353584156 seq 4084183294 subseq 419833 len 1428 csum 0x51f1], length 1428
22:18:35.240214 IP 112.26.2.1.targus-getdata1 > 112.26.2.8.40313: Flags [.], ack 1, win 23925, options [nop,nop,TS val 2433169 ecr 2212751,nop,nop,sack 2 {18565:19993}{8569:17137},mptcp dss ack 4084087618], length 0
22:18:35.337095 IP 112.26.2.1.targus-getdata1 > 112.26.2.8.40313: Flags [.], ack 1, win 23925, options [nop,nop,TS val 2432809 ecr 2212751,nop,nop,sack 2 {8569:17137}{1429:7141},mptcp dss ack 4084087618], length 0
22:18:35.393884 IP 112.26.2.8.40313 > 112.26.2.1.targus-getdata1: Flags [.], seq 19993:21421, ack 0, win 4107, options [nop,nop,TS val 2214599 ecr 2431659,mptcp dss ack 1353584156 seq 4084184722 subseq 421261 len 1428 csum 0x9426], length 1428
22:18:35.394112 IP 112.26.2.1.targus-getdata1 > 112.26.2.8.40313: Flags [.], ack 1, win 23925, options [nop,nop,TS val 2433323 ecr 2212751,nop,nop,sack 2 {18565:21421}{8569:17137},mptcp dss ack 4084087618], length 0
22:18:35.490751 IP 112.26.2.8.40313 > 112.26.2.1.targus-getdata1: Flags [.], seq 21421:22849, ack 0, win 4107, options [nop,nop,TS val 2214599 ecr 2431659,mptcp dss ack 1353584156 seq 4084186150 subseq 422689 len 1428 csum 0x50e8], length 1428
22:18:35.490956 IP 112.26.2.1.targus-getdata1 > 112.26.2.8.40313: Flags [.], ack 1, win 23925, options [nop,nop,TS val 2433420 ecr 2212751,nop,nop,sack 2 {18565:22849}{8569:17137},mptcp dss ack 4084087618], length 0
22:18:35.547955 IP 112.26.2.8.40313 > 112.26.2.1.targus-getdata1: Flags [.], seq 22849:24277, ack 0, win 4107, options [nop,nop,TS val 2214599 ecr 2431659,mptcp dss ack 1353584156 seq 4084187578 subseq 424117 len 1428 csum 0x7c6], length 1428
22:18:35.548149 IP 112.26.2.1.targus-getdata1 > 112.26.2.8.40313: Flags [.], ack 1, win 23925, options [nop,nop,TS val 2433477 ecr 2212751,nop,nop,sack 2 {18565:24277}{8569:17137},mptcp dss ack 4084087618], length 0
22:18:35.669259 IP 112.26.2.8.40313 > 112.26.2.1.targus-getdata1: Flags [.], seq 24277:25705, ack 0, win 4107, options [nop,nop,TS val 2214599 ecr 2431659,mptcp dss ack 1353584156 seq 4084189006 subseq 425545 len 1428 csum 0x9d47], length 1428
22:18:35.669454 IP 112.26.2.1.targus-getdata1 > 112.26.2.8.40313: Flags [.], ack 1, win 23925, options [nop,nop,TS val 2433598 ecr 2212751,nop,nop,sack 2 {18565:25705}{8569:17137},mptcp dss ack 4084087618], length 0
22:18:35.738704 IP 112.26.2.1.targus-getdata1 > 112.26.2.8.40313: Flags [.], ack 1, win 23925, options [nop,nop,TS val 2433169 ecr 2212751,nop,nop,sack 2 {18565:19993}{8569:17137},mptcp dss ack 4084087618], length 0
22:18:35.827560 IP 112.26.2.8.40313 > 112.26.2.1.targus-getdata1: Flags [.], seq 25705:27133, ack 0, win 4107, options [nop,nop,TS val 2214599 ecr 2431659,mptcp dss ack 1353584156 seq 4084190434 subseq 426973 len 1428 csum 0xa97c], length 1428
22:18:35.827769 IP 112.26.2.1.targus-getdata1 > 112.26.2.8.40313: Flags [.], ack 1, win 23925, options [nop,nop,TS val 2433757 ecr 2212751,nop,nop,sack 2 {18565:27133}{8569:17137},mptcp dss ack 4084087618], length 0
22:18:35.882076 IP 112.26.2.1.targus-getdata1 > 112.26.2.8.40313: Flags [.], ack 1, win 23925, options [nop,nop,TS val 2433323 ecr 2212751,nop,nop,sack 2 {18565:21421}{8569:17137},mptcp dss ack 4084087618], length 0
22:18:35.932062 IP 112.26.2.8.40313 > 112.26.2.1.targus-getdata1: Flags [.], seq 27133:28561, ack 0, win 4107, options [nop,nop,TS val 2214599 ecr 2431659,mptcp dss ack 1353584156 seq 4084191862 subseq 428401 len 1428 csum 0xe31d], length 1428
22:18:35.932268 IP 112.26.2.1.targus-getdata1 > 112.26.2.8.40313: Flags [.], ack 1, win 23925, options [nop,nop,TS val 2433861 ecr 2212751,nop,nop,sack 2 {18565:28561}{8569:17137},mptcp dss ack 4084087618], length 0
22:18:36.008843 IP 112.26.2.1.targus-getdata1 > 112.26.2.8.40313: Flags [.], ack 1, win 23925, options [nop,nop,TS val 2433420 ecr 2212751,nop,nop,sack 2 {18565:22849}{8569:17137},mptcp dss ack 4084087618], length 0
22:18:36.076042 IP 112.26.2.1.targus-getdata1 > 112.26.2.8.40313: Flags [.], ack 1, win 23925, options [nop,nop,TS val 2433477 ecr 2212751,nop,nop,sack 2 {18565:24277}{8569:17137},mptcp dss ack 4084087618], length 0
22:18:36.142562 IP 112.26.2.8.40313 > 112.26.2.1.targus-getdata1: Flags [.], seq 28561:29989, ack 0, win 4107, options [nop,nop,TS val 2214599 ecr 2431659,mptcp dss ack 1353584156 seq 4084193290 subseq 429829 len 1428 csum 0x751d], length 1428
22:18:36.142706 IP 112.26.2.1.targus-getdata1 > 112.26.2.8.40313: Flags [.], ack 1, win 23925, options [nop,nop,TS val 2434072 ecr 2212751,nop,nop,sack 2 {18565:29989}{8569:17137},mptcp dss ack 4084087618], length 0
22:18:36.265190 IP 112.26.2.1.targus-getdata1 > 112.26.2.8.40313: Flags [.], ack 1, win 23925, options [nop,nop,TS val 2433598 ecr 2212751,nop,nop,sack 2 {18565:25705}{8569:17137},mptcp dss ack 4084087618], length 0
22:18:36.351057 IP 112.26.2.1.targus-getdata1 > 112.26.2.8.40313: Flags [.], ack 1, win 23925, options [nop,nop,TS val 2433757 ecr 2212751,nop,nop,sack 2 {18565:27133}{8569:17137},mptcp dss ack 4084087618], length 0
22:18:36.427850 IP 112.26.2.8.40313 > 112.26.2.1.targus-getdata1: Flags [.], seq 29989:31417, ack 0, win 4107, options [nop,nop,TS val 2214600 ecr 2431659,mptcp dss ack 1353584156 seq 4084194718 subseq 431257 len 1428 csum 0x262a], length 1428
22:18:36.428077 IP 112.26.2.1.targus-getdata1 > 112.26.2.8.40313: Flags [.], ack 1, win 23925, options [nop,nop,TS val 2434357 ecr 2212751,nop,nop,sack 2 {18565:31417}{8569:17137},mptcp dss ack 4084087618], length 0
22:18:36.520076 IP 112.26.2.1.targus-getdata1 > 112.26.2.8.40313: Flags [.], ack 1, win 23925, options [nop,nop,TS val 2433861 ecr 2212751,nop,nop,sack 2 {18565:28561}{8569:17137},mptcp dss ack 4084087618], length 0
22:18:36.557333 IP 112.26.2.8.40313 > 112.26.2.1.targus-getdata1: Flags [.], seq 31417:32845, ack 0, win 4107, options [nop,nop,TS val 2214600 ecr 2431659,mptcp dss ack 1353584156 seq 4084196146 subseq 432685 len 1428 csum 0xc614], length 1428
22:18:36.557596 IP 112.26.2.1.targus-getdata1 > 112.26.2.8.40313: Flags [.], ack 1, win 23925, options [nop,nop,TS val 2434486 ecr 2212751,nop,nop,sack 2 {18565:32845}{8569:17137},mptcp dss ack 4084087618], length 0
22:18:36.668138 IP 112.26.2.8.40313 > 112.26.2.1.targus-getdata1: Flags [.], seq 34273:35701, ack 0, win 4107, options [nop,nop,TS val 2214718 ecr 2431814,mptcp dss ack 1353584156 seq 4084203286 subseq 435541 len 1428 csum 0x4b5], length 1428
22:18:36.668330 IP 112.26.2.1.targus-getdata1 > 112.26.2.8.40313: Flags [.], ack 1, win 23925, options [nop,nop,TS val 2434597 ecr 2212751,nop,nop,sack 2 {34273:35701}{18565:32845},mptcp dss ack 4084087618], length 0
22:18:36.726343 IP 112.26.2.1.targus-getdata1 > 112.26.2.8.40313: Flags [.], ack 1, win 23925, options [nop,nop,TS val 2434072 ecr 2212751,nop,nop,sack 2 {18565:29989}{8569:17137},mptcp dss ack 4084087618], length 0
22:18:36.818877 IP 112.26.2.8.40313 > 112.26.2.1.targus-getdata1: Flags [.], seq 35701:37129, ack 0, win 4107, options [nop,nop,TS val 2214803 ecr 2431897,mptcp dss ack 1353584156 seq 4084207570 subseq 436969 len 1428 csum 0x27e6], length 1428
22:18:36.819092 IP 112.26.2.1.targus-getdata1 > 112.26.2.8.40313: Flags [.], ack 1, win 23925, options [nop,nop,TS val 2434748 ecr 2212751,nop,nop,sack 2 {34273:37129}{18565:32845},mptcp dss ack 4084087618], length 0
22:18:36.931819 IP 112.26.2.8.40313 > 112.26.2.1.targus-getdata1: Flags [.], seq 37129:38557, ack 0, win 4107, options [nop,nop,TS val 2214877 ecr 2432028,mptcp dss ack 1353584156 seq 4084213282 subseq 438397 len 1428 csum 0x5a95], length 1428
22:18:36.932040 IP 112.26.2.1.targus-getdata1 > 112.26.2.8.40313: Flags [.], ack 1, win 23925, options [nop,nop,TS val 2434861 ecr 2212751,nop,nop,sack 2 {34273:38557}{18565:32845},mptcp dss ack 4084087618], length 0
22:18:37.031901 IP 112.26.2.8.40313 > 112.26.2.1.targus-getdata1: Flags [.], seq 39985:41413, ack 0, win 4107, options [nop,nop,TS val 2215160 ecr 2432218,mptcp dss ack 1353584156 seq 4084230418 subseq 441253 len 1428 csum 0xfa17], length 1428
22:18:37.032076 IP 112.26.2.1.targus-getdata1 > 112.26.2.8.40313: Flags [.], ack 1, win 23925, options [nop,nop,TS val 2434961 ecr 2212751,nop,nop,sack 2 {39985:41413}{34273:38557},mptcp dss ack 4084087618], length 0
22:18:37.107074 IP 112.26.2.1.targus-getdata1 > 112.26.2.8.40313: Flags [.], ack 1, win 23925, options [nop,nop,TS val 2434357 ecr 2212751,nop,nop,sack 2 {18565:31417}{8569:17137},mptcp dss ack 4084087618], length 0
22:18:37.175187 IP 112.26.2.8.40313 > 112.26.2.1.targus-getdata1: Flags [.], seq 1:1429, ack 0, win 4107, options [nop,nop,TS val 2215447 ecr 2432381,mptcp dss ack 1353584156 seq 4084087618 subseq 401269 len 1428 csum 0xafd8], length 1428
22:18:37.175472 IP 112.26.2.1.targus-getdata1 > 112.26.2.8.40313: Flags [.], ack 7141, win 23702, options [nop,nop,TS val 2435105 ecr 2215447,nop,nop,sack 2 {39985:41413}{34273:38557},mptcp dss ack 4084101898], length 0
22:18:37.259716 IP 112.26.2.8.40313 > 112.26.2.1.targus-getdata1: Flags [.], seq 7141:8569, ack 0, win 4107, options [nop,nop,TS val 2215656 ecr 2432479,mptcp dss ack 1353584156 seq 4084101898 subseq 408409 len 1428 csum 0x8f57], length 1428
22:18:37.260053 IP 112.26.2.1.targus-getdata1 > 112.26.2.8.40313: Flags [.], ack 17137, win 23519, options [nop,nop,TS val 2435189 ecr 2215656,nop,nop,sack 2 {39985:41413}{34273:38557},mptcp dss ack 4084137598], length 0
22:18:37.368409 IP 112.26.2.1.targus-getdata1 > 112.26.2.8.40313: Flags [.], ack 1, win 23925, options [nop,nop,TS val 2434486 ecr 2212751,nop,nop,sack 2 {18565:32845}{8569:17137},mptcp dss ack 4084087618], length 0
22:18:37.427573 IP 112.26.2.1.targus-getdata1 > 112.26.2.8.40313: Flags [.], ack 1, win 23925, options [nop,nop,TS val 2434597 ecr 2212751,nop,nop,sack 2 {34273:35701}{18565:32845},mptcp dss ack 4084087618], length 0
22:18:37.515231 IP 112.26.2.8.40313 > 112.26.2.1.targus-getdata1: Flags [.], seq 41413:42841, ack 0, win 4107, options [nop,nop,TS val 2216052 ecr 2432716,mptcp dss ack 1353584156 seq 4084274686 subseq 442681 len 1428 csum 0x5297], length 1428
22:18:37.515431 IP 112.26.2.1.targus-getdata1 > 112.26.2.8.40313: Flags [.], ack 17137, win 23912, options [nop,nop,TS val 2435444 ecr 2215656,nop,nop,sack 2 {39985:42841}{34273:38557},mptcp dss ack 4084137598], length 0
22:18:37.608190 IP 112.26.2.1.targus-getdata1 > 112.26.2.8.40313: Flags [.], ack 1, win 23925, options [nop,nop,TS val 2434748 ecr 2212751,nop,nop,sack 2 {34273:37129}{18565:32845},mptcp dss ack 4084087618], length 0
22:18:37.686461 IP 112.26.2.1.targus-getdata1 > 112.26.2.8.40313: Flags [.], ack 1, win 23925, options [nop,nop,TS val 2434861 ecr 2212751,nop,nop,sack 2 {34273:38557}{18565:32845},mptcp dss ack 4084087618], length 0
22:18:37.753776 IP 112.26.2.1.targus-getdata1 > 112.26.2.8.40313: Flags [.], ack 1, win 23925, options [nop,nop,TS val 2434961 ecr 2212751,nop,nop,sack 2 {39985:41413}{34273:38557},mptcp dss ack 4084087618], length 0
22:18:37.828124 IP 112.26.2.8.40313 > 112.26.2.1.targus-getdata1: Flags [.], seq 42841:44269, ack 0, win 4107, options [nop,nop,TS val 2216361 ecr 2432809,mptcp dss ack 1353584156 seq 4084283254 subseq 444109 len 1428 csum 0xad48], length 1428
22:18:37.828358 IP 112.26.2.1.targus-getdata1 > 112.26.2.8.40313: Flags [.], ack 17137, win 23912, options [nop,nop,TS val 2435757 ecr 2215656,nop,nop,sack 2 {39985:44269}{34273:38557},mptcp dss ack 4084137598], length 0
22:18:37.916597 IP 112.26.2.1.targus-getdata1 > 112.26.2.8.40313: Flags [.], ack 7141, win 23702, options [nop,nop,TS val 2435105 ecr 2215447,nop,nop,sack 2 {39985:41413}{34273:38557},mptcp dss ack 4084101898], length 0
22:18:37.986816 IP 112.26.2.8.40313 > 112.26.2.1.targus-getdata1: Flags [.], seq 17137:18565, ack 0, win 4107, options [nop,nop,TS val 2216715 ecr 2433323,mptcp dss ack 1353584156 seq 4084137598 subseq 418405 len 1428 csum 0xe6f6], length 1428
22:18:37.987096 IP 112.26.2.1.targus-getdata1 > 112.26.2.8.40313: Flags [.], ack 32845, win 23395, options [nop,nop,TS val 2435916 ecr 2216715,nop,nop,sack 2 {39985:44269}{34273:38557},mptcp dss ack 4084197574], length 0
22:18:38.069158 IP 112.26.2.1.targus-getdata1 > 112.26.2.8.40313: Flags [.], ack 17137, win 23519, options [nop,nop,TS val 2435189 ecr 2215656,nop,nop,sack 2 {39985:41413}{34273:38557},mptcp dss ack 4084137598], length 0
22:18:38.165854 IP 112.26.2.8.40313 > 112.26.2.1.targus-getdata1: Flags [.], seq 44269:45697, ack 0, win 4107, options [nop,nop,TS val 2216957 ecr 2433420,mptcp dss ack 1353584156 seq 4084308958 subseq 445537 len 1428 csum 0xa946], length 1428
22:18:38.166074 IP 112.26.2.1.targus-getdata1 > 112.26.2.8.40313: Flags [.], ack 32845, win 24053, options [nop,nop,TS val 2436095 ecr 2216715,nop,nop,sack 2 {39985:45697}{34273:38557},mptcp dss ack 4084197574], length 0
22:18:38.235876 IP 112.26.2.8.40313 > 112.26.2.1.targus-getdata1: Flags [.], seq 45697:47125, ack 0, win 4107, options [nop,nop,TS val 2217082 ecr 2433598,mptcp dss ack 1353584156 seq 4084314670 subseq 446965 len 1428 csum 0xc3c1], length 1428
22:18:38.236177 IP 112.26.2.1.targus-getdata1 > 112.26.2.8.40313: Flags [.], ack 32845, win 24053, options [nop,nop,TS val 2436165 ecr 2216715,nop,nop,sack 2 {39985:47125}{34273:38557},mptcp dss ack 4084197574], length 0
22:18:38.319053 IP 112.26.2.1.targus-getdata1 > 112.26.2.8.40313: Flags [.], ack 17137, win 23912, options [nop,nop,TS val 2435444 ecr 2215656,nop,nop,sack 2 {39985:42841}{34273:38557},mptcp dss ack 4084137598], length 0
22:18:38.485954 IP 112.26.2.8.40313 > 112.26.2.1.targus-getdata1: Flags [.], seq 47125:48553, ack 0, win 4107, options [nop,nop,TS val 2217509 ecr 2434072,mptcp dss ack 1353584156 seq 4084324666 subseq 448393 len 1428 csum 0x1da4], length 1428
22:18:38.486205 IP 112.26.2.1.targus-getdata1 > 112.26.2.8.40313: Flags [.], ack 32845, win 24053, options [nop,nop,TS val 2436415 ecr 2216715,nop,nop,sack 2 {39985:48553}{34273:38557},mptcp dss ack 4084197574], length 0
22:18:38.590334 IP 112.26.2.1.targus-getdata1 > 112.26.2.8.40313: Flags [.], ack 17137, win 23912, options [nop,nop,TS val 2435757 ecr 2215656,nop,nop,sack 2 {39985:44269}{34273:38557},mptcp dss ack 4084137598], length 0
22:18:38.672720 IP 112.26.2.8.40313 > 112.26.2.1.targus-getdata1: Flags [.], seq 48553:49981, ack 0, win 4107, options [nop,nop,TS val 2217644 ecr 2434357,mptcp dss ack 1353584156 seq 4084327522 subseq 449821 len 1428 csum 0x419a], length 1428
22:18:38.672953 IP 112.26.2.1.targus-getdata1 > 112.26.2.8.40313: Flags [.], ack 32845, win 24053, options [nop,nop,TS val 2436602 ecr 2216715,nop,nop,sack 2 {39985:49981}{34273:38557},mptcp dss ack 4084197574], length 0
22:18:38.753974 IP 112.26.2.1.targus-getdata1 > 112.26.2.8.40313: Flags [.], ack 32845, win 23395, options [nop,nop,TS val 2435916 ecr 2216715,nop,nop,sack 2 {39985:44269}{34273:38557},mptcp dss ack 4084197574], length 0
22:18:38.829750 IP 112.26.2.8.40313 > 112.26.2.1.targus-getdata1: Flags [.], seq 49981:51409, ack 0, win 4107, options [nop,nop,TS val 2217795 ecr 2434486,mptcp dss ack 1353584156 seq 4084330378 subseq 451249 len 1428 csum 0x4a1], length 1428
22:18:38.829952 IP 112.26.2.1.targus-getdata1 > 112.26.2.8.40313: Flags [.], ack 32845, win 24053, options [nop,nop,TS val 2436759 ecr 2216715,nop,nop,sack 2 {39985:51409}{34273:38557},mptcp dss ack 4084197574], length 0
22:18:38.920463 IP 112.26.2.1.targus-getdata1 > 112.26.2.8.40313: Flags [.], ack 32845, win 24053, options [nop,nop,TS val 2436095 ecr 2216715,nop,nop,sack 2 {39985:45697}{34273:38557},mptcp dss ack 4084197574], length 0
22:18:39.041022 IP 112.26.2.1.targus-getdata1 > 112.26.2.8.40313: Flags [.], ack 32845, win 24053, options [nop,nop,TS val 2436165 ecr 2216715,nop,nop,sack 2 {39985:47125}{34273:38557},mptcp dss ack 4084197574], length 0
22:18:39.071545 IP 112.26.2.8.40313 > 112.26.2.1.targus-getdata1: Flags [.], seq 32845:34273, ack 0, win 4107, options [nop,nop,TS val 2217943 ecr 2434597,mptcp dss ack 1353584156 seq 4084197574 subseq 434113 len 1428 csum 0x3ba2], length 1428
22:18:39.071791 IP 112.26.2.1.targus-getdata1 > 112.26.2.8.40313: Flags [.], ack 38557, win 23786, options [nop,nop,TS val 2437001 ecr 2217943,nop,nop,sack 1 {39985:51409},mptcp dss ack 4084214710], length 0
22:18:39.159376 IP 112.26.2.1.targus-getdata1 > 112.26.2.8.40313: Flags [.], ack 32845, win 24053, options [nop,nop,TS val 2436415 ecr 2216715,nop,nop,sack 2 {39985:48553}{34273:38557},mptcp dss ack 4084197574], length 0
22:18:39.206224 IP 112.26.2.8.40313 > 112.26.2.1.targus-getdata1: Flags [.], seq 51409:52837, ack 0, win 4107, options [nop,nop,TS val 2218100 ecr 2434748,mptcp dss ack 1353584156 seq 4084341802 subseq 452677 len 1428 csum 0xe0f1], length 1428
22:18:39.206462 IP 112.26.2.1.targus-getdata1 > 112.26.2.8.40313: Flags [.], ack 38557, win 23786, options [nop,nop,TS val 2437135 ecr 2217943,nop,nop,sack 1 {39985:52837},mptcp dss ack 4084214710], length 0
22:18:39.268635 IP 112.26.2.1.targus-getdata1 > 112.26.2.8.40313: Flags [.], ack 32845, win 24053, options [nop,nop,TS val 2436602 ecr 2216715,nop,nop,sack 2 {39985:49981}{34273:38557},mptcp dss ack 4084197574], length 0
22:18:39.343078 IP 112.26.2.8.40313 > 112.26.2.1.targus-getdata1: Flags [.], seq 52837:54265, ack 0, win 4107, options [nop,nop,TS val 2218237 ecr 2434861,mptcp dss ack 1353584156 seq 4084343230 subseq 454105 len 1428 csum 0x3fa2], length 1428
22:18:39.343278 IP 112.26.2.1.targus-getdata1 > 112.26.2.8.40313: Flags [.], ack 38557, win 23786, options [nop,nop,TS val 2437272 ecr 2217943,nop,nop,sack 1 {39985:54265},mptcp dss ack 4084214710], length 0
22:18:39.390671 IP 112.26.2.8.40313 > 112.26.2.1.targus-getdata1: Flags [.], seq 38557:39985, ack 0, win 4107, options [nop,nop,TS val 2218380 ecr 2434961,mptcp dss ack 1353584156 seq 4084214710 subseq 439825 len 1428 csum 0x491a], length 1428
22:18:39.390939 IP 112.26.2.1.targus-getdata1 > 112.26.2.8.40313: Flags [.], ack 54265, win 23372, options [nop,nop,TS val 2437319 ecr 2218380,mptcp dss ack 4084263262], length 0
22:18:39.495101 IP 112.26.2.1.targus-getdata1 > 112.26.2.8.40313: Flags [.], ack 32845, win 24053, options [nop,nop,TS val 2436759 ecr 2216715,nop,nop,sack 2 {39985:51409}{34273:38557},mptcp dss ack 4084197574], length 0
22:18:39.579735 IP 112.26.2.8.40313 > 112.26.2.1.targus-getdata1: Flags [.], seq 54265:55693, ack 0, win 4107, options [nop,nop,TS val 2218510 ecr 2435105,mptcp dss ack 1353584156 seq 4084353226 subseq 455533 len 1428 csum 0xc1a1], length 1428
22:18:39.579972 IP 112.26.2.1.targus-getdata1 > 112.26.2.8.40313: Flags [.], ack 55693, win 23886, options [nop,nop,TS val 2437508 ecr 2218510,mptcp dss ack 4084263262], length 0
22:18:39.681838 IP 112.26.2.8.40313 > 112.26.2.1.targus-getdata1: Flags [.], seq 55693:57121, ack 0, win 4107, options [nop,nop,TS val 2218510 ecr 2435105,mptcp dss ack 1353584156 seq 4084354654 subseq 456961 len 1428 csum 0x7c32], length 1428
22:18:39.682071 IP 112.26.2.1.targus-getdata1 > 112.26.2.8.40313: Flags [.], ack 57121, win 23886, options [nop,nop,TS val 2437611 ecr 2218510,mptcp dss ack 4084263262], length 0
22:18:39.731679 IP 112.26.2.1.targus-getdata1 > 112.26.2.8.40313: Flags [.], ack 38557, win 23786, options [nop,nop,TS val 2437001 ecr 2217943,nop,nop,sack 1 {39985:51409},mptcp dss ack 4084214710], length 0
22:18:39.810221 IP 112.26.2.8.40313 > 112.26.2.1.targus-getdata1: Flags [.], seq 57121:58549, ack 0, win 4107, options [nop,nop,TS val 2218510 ecr 2435105,mptcp dss ack 1353584156 seq 4084356082 subseq 458389 len 1428 csum 0x98a6], length 1428
22:18:39.810429 IP 112.26.2.1.targus-getdata1 > 112.26.2.8.40313: Flags [.], ack 58549, win 23886, options [nop,nop,TS val 2437740 ecr 2218510,mptcp dss ack 4084263262], length 0
22:18:39.898172 IP 112.26.2.1.targus-getdata1 > 112.26.2.8.40313: Flags [.], ack 38557, win 23786, options [nop,nop,TS val 2437135 ecr 2217943,nop,nop,sack 1 {39985:52837},mptcp dss ack 4084214710], length 0
22:18:39.977298 IP 112.26.2.8.40313 > 112.26.2.1.targus-getdata1: Flags [.], seq 58549:59977, ack 0, win 4107, options [nop,nop,TS val 2218722 ecr 2435189,mptcp dss ack 1353584156 seq 4084370362 subseq 459817 len 1428 csum 0x2ed8], length 1428
22:18:39.977537 IP 112.26.2.1.targus-getdata1 > 112.26.2.8.40313: Flags [.], ack 59977, win 23886, options [nop,nop,TS val 2437907 ecr 2218722,mptcp dss ack 4084263262], length 0
22:18:40.053469 IP 112.26.2.1.targus-getdata1 > 112.26.2.8.40313: Flags [.], ack 38557, win 23786, options [nop,nop,TS val 2437272 ecr 2217943,nop,nop,sack 1 {39985:54265},mptcp dss ack 4084214710], length 0
22:18:40.130733 IP 112.26.2.1.targus-getdata1 > 112.26.2.8.40313: Flags [.], ack 54265, win 23372, options [nop,nop,TS val 2437319 ecr 2218380,mptcp dss ack 4084263262], length 0
22:18:40.239949 IP 112.26.2.8.40313 > 112.26.2.1.targus-getdata1: Flags [.], seq 59977:61405, ack 0, win 4107, options [nop,nop,TS val 2218997 ecr 2435444,mptcp dss ack 1353584156 seq 4084376074 subseq 461245 len 1428 csum 0xdedf], length 1428
22:18:40.240237 IP 112.26.2.1.targus-getdata1 > 112.26.2.8.40313: Flags [.], ack 61405, win 23886, options [nop,nop,TS val 2438169 ecr 2218997,mptcp dss ack 4084263262], length 0
22:18:40.348775 IP 112.26.2.1.targus-getdata1 > 112.26.2.8.40313: Flags [.], ack 55693, win 23886, options [nop,nop,TS val 2437508 ecr 2218510,mptcp dss ack 4084263262], length 0
22:18:40.428482 IP 112.26.2.1.targus-getdata1 > 112.26.2.8.40313: Flags [.], ack 57121, win 23886, options [nop,nop,TS val 2437611 ecr 2218510,mptcp dss ack 4084263262], length 0
22:18:40.499679 IP 112.26.2.8.40313 > 112.26.2.1.targus-getdata1: Flags [.], seq 61405:62833, ack 0, win 4107, options [nop,nop,TS val 2219280 ecr 2435757,mptcp dss ack 1353584156 seq 4084388926 subseq 462673 len 1428 csum 0xaff], length 1428
22:18:40.499887 IP 112.26.2.1.targus-getdata1 > 112.26.2.8.40313: Flags [.], ack 62833, win 23886, options [nop,nop,TS val 2438428 ecr 2219280,mptcp dss ack 4084263262], length 0
22:18:40.601173 IP 112.26.2.1.targus-getdata1 > 112.26.2.8.40313: Flags [.], ack 58549, win 23886, options [nop,nop,TS val 2437740 ecr 2218510,mptcp dss ack 4084263262], length 0
22:18:40.675114 IP 112.26.2.1.targus-getdata1 > 112.26.2.8.40313: Flags [.], ack 59977, win 23886, options [nop,nop,TS val 2437907 ecr 2218722,mptcp dss ack 4084263262], length 0
22:18:40.722671 IP 112.26.2.8.40313 > 112.26.2.1.targus-getdata1: Flags [.], seq 64261:65689, ack 0, win 4107, options [nop,nop,TS val 2219624 ecr 2436095,mptcp dss ack 1353584156 seq 4084404634 subseq 465529 len 1428 csum 0x785], length 1428
22:18:40.722905 IP 112.26.2.1.targus-getdata1 > 112.26.2.8.40313: Flags [.], ack 62833, win 24290, options [nop,nop,TS val 2438652 ecr 2219280,nop,nop,sack 1 {64261:65689},mptcp dss ack 4084363222], length 0
22:18:40.830729 IP 112.26.2.8.40313 > 112.26.2.1.targus-getdata1: Flags [.], seq 65689:67117, ack 0, win 4107, options [nop,nop,TS val 2219700 ecr 2436165,mptcp dss ack 1353584156 seq 4084408918 subseq 466957 len 1428 csum 0x28d8], length 1428
22:18:40.830980 IP 112.26.2.1.targus-getdata1 > 112.26.2.8.40313: Flags [.], ack 62833, win 24290, options [nop,nop,TS val 2438760 ecr 2219280,nop,nop,sack 1 {64261:67117},mptcp dss ack 4084363222], length 0
22:18:40.917554 IP 112.26.2.1.targus-getdata1 > 112.26.2.8.40313: Flags [.], ack 61405, win 23886, options [nop,nop,TS val 2438169 ecr 2218997,mptcp dss ack 4084263262], length 0
22:18:40.981106 IP 112.26.2.8.40313 > 112.26.2.1.targus-getdata1: Flags [.], seq 67117:68545, ack 0, win 4107, options [nop,nop,TS val 2219747 ecr 2436415,mptcp dss ack 1353584156 seq 4084410346 subseq 468385 len 1428 csum 0x262f], length 1428
22:18:40.981341 IP 112.26.2.1.targus-getdata1 > 112.26.2.8.40313: Flags [.], ack 62833, win 24290, options [nop,nop,TS val 2438910 ecr 2219280,nop,nop,sack 1 {64261:68545},mptcp dss ack 4084363222], length 0
22:18:41.038673 IP 112.26.2.8.40313 > 112.26.2.1.targus-getdata1: Flags [.], seq 68545:69973, ack 0, win 4107, options [nop,nop,TS val 2219874 ecr 2436602,mptcp dss ack 1353584156 seq 4084414630 subseq 469813 len 1428 csum 0x9d8e], length 1428
22:18:41.038894 IP 112.26.2.1.targus-getdata1 > 112.26.2.8.40313: Flags [.], ack 62833, win 24290, options [nop,nop,TS val 2438968 ecr 2219280,nop,nop,sack 1 {64261:69973},mptcp dss ack 4084363222], length 0
22:18:41.138515 IP 112.26.2.1.targus-getdata1 > 112.26.2.8.40313: Flags [.], ack 62833, win 23886, options [nop,nop,TS val 2438428 ecr 2219280,mptcp dss ack 4084263262], length 0
22:18:41.203702 IP 112.26.2.8.40313 > 112.26.2.1.targus-getdata1: Flags [.], seq 69973:71401, ack 0, win 4107, options [nop,nop,TS val 2220093 ecr 2436759,mptcp dss ack 1353584156 seq 4084423198 subseq 471241 len 1428 csum 0x4450], length 1428
22:18:41.203921 IP 112.26.2.1.targus-getdata1 > 112.26.2.8.40313: Flags [.], ack 62833, win 24373, options [nop,nop,TS val 2439133 ecr 2219280,nop,nop,sack 1 {64261:71401},mptcp dss ack 4084371790], length 0
22:18:41.407373 IP 112.26.2.1.targus-getdata1 > 112.26.2.8.40313: Flags [.], ack 62833, win 24290, options [nop,nop,TS val 2438652 ecr 2219280,nop,nop,sack 1 {64261:65689},mptcp dss ack 4084363222], length 0
22:18:41.461119 IP 112.26.2.8.40313 > 112.26.2.1.targus-getdata1: Flags [.], seq 71401:72829, ack 0, win 4107, options [nop,nop,TS val 2220325 ecr 2437001,mptcp dss ack 1353584156 seq 4084433194 subseq 472669 len 1428 csum 0xf838], length 1428
22:18:41.461352 IP 112.26.2.1.targus-getdata1 > 112.26.2.8.40313: Flags [.], ack 62833, win 24491, options [nop,nop,TS val 2439390 ecr 2219280,nop,nop,sack 1 {64261:72829},mptcp dss ack 4084396066], length 0
22:18:41.564372 IP 112.26.2.1.targus-getdata1 > 112.26.2.8.40313: Flags [.], ack 62833, win 24290, options [nop,nop,TS val 2438760 ecr 2219280,nop,nop,sack 1 {64261:67117},mptcp dss ack 4084363222], length 0
22:18:41.634453 IP 112.26.2.1.targus-getdata1 > 112.26.2.8.40313: Flags [.], ack 62833, win 24290, options [nop,nop,TS val 2438910 ecr 2219280,nop,nop,sack 1 {64261:68545},mptcp dss ack 4084363222], length 0
22:18:41.678279 IP 112.26.2.8.40313 > 112.26.2.1.targus-getdata1: Flags [.], seq 72829:74257, ack 0, win 4107, options [nop,nop,TS val 2220587 ecr 2437135,mptcp dss ack 1353584156 seq 4084437478 subseq 474097 len 1428 csum 0xb8da], length 1428
22:18:41.678531 IP 112.26.2.1.targus-getdata1 > 112.26.2.8.40313: Flags [.], ack 62833, win 24491, options [nop,nop,TS val 2439608 ecr 2219280,nop,nop,sack 1 {64261:74257},mptcp dss ack 4084396066], length 0
22:18:41.783218 IP 112.26.2.1.targus-getdata1 > 112.26.2.8.40313: Flags [.], ack 62833, win 24290, options [nop,nop,TS val 2438968 ecr 2219280,nop,nop,sack 1 {64261:69973},mptcp dss ack 4084363222], length 0
22:18:41.859470 IP 112.26.2.1.targus-getdata1 > 112.26.2.8.40313: Flags [.], ack 62833, win 24373, options [nop,nop,TS val 2439133 ecr 2219280,nop,nop,sack 1 {64261:71401},mptcp dss ack 4084371790], length 0
22:18:41.896934 IP 112.26.2.8.40313 > 112.26.2.1.targus-getdata1: Flags [.], seq 74257:75685, ack 0, win 4107, options [nop,nop,TS val 2220732 ecr 2437272,mptcp dss ack 1353584156 seq 4084441762 subseq 475525 len 1428 csum 0x4b9a], length 1428
22:18:41.897157 IP 112.26.2.1.targus-getdata1 > 112.26.2.8.40313: Flags [.], ack 62833, win 24491, options [nop,nop,TS val 2439826 ecr 2219280,nop,nop,sack 1 {64261:75685},mptcp dss ack 4084396066], length 0
22:18:41.985930 IP 112.26.2.8.40313 > 112.26.2.1.targus-getdata1: Flags [.], seq 75685:77113, ack 0, win 4107, options [nop,nop,TS val 2220737 ecr 2437319,mptcp dss ack 1353584156 seq 4084451758 subseq 476953 len 1428 csum 0xa640], length 1428
22:18:41.986186 IP 112.26.2.1.targus-getdata1 > 112.26.2.8.40313: Flags [.], ack 62833, win 24491, options [nop,nop,TS val 2439915 ecr 2219280,nop,nop,sack 1 {64261:77113},mptcp dss ack 4084396066], length 0
22:18:42.069035 IP 112.26.2.1.targus-getdata1 > 112.26.2.8.40313: Flags [.], ack 62833, win 24491, options [nop,nop,TS val 2439390 ecr 2219280,nop,nop,sack 1 {64261:72829},mptcp dss ack 4084396066], length 0
22:18:42.164162 IP 112.26.2.8.40313 > 112.26.2.1.targus-getdata1: Flags [P.], seq 77113:78541, ack 0, win 4107, options [nop,nop,TS val 2220950 ecr 2437508,mptcp dss ack 1353584156 seq 4084461754 subseq 478381 len 1428 csum 0x1b7a], length 1428
22:18:42.164352 IP 112.26.2.1.targus-getdata1 > 112.26.2.8.40313: Flags [.], ack 62833, win 24491, options [nop,nop,TS val 2440093 ecr 2219280,nop,nop,sack 1 {64261:78541},mptcp dss ack 4084396066], length 0
22:18:42.256461 IP 112.26.2.1.targus-getdata1 > 112.26.2.8.40313: Flags [.], ack 62833, win 24491, options [nop,nop,TS val 2439608 ecr 2219280,nop,nop,sack 1 {64261:74257},mptcp dss ack 4084396066], length 0
22:18:42.341691 IP 112.26.2.8.40313 > 112.26.2.1.targus-getdata1: Flags [.], seq 78541:79969, ack 0, win 4107, options [nop,nop,TS val 2221047 ecr 2437611,mptcp dss ack 1353584156 seq 4084463182 subseq 479809 len 1428 csum 0x9f7e], length 1428
22:18:42.341987 IP 112.26.2.1.targus-getdata1 > 112.26.2.8.40313: Flags [.], ack 62833, win 24491, options [nop,nop,TS val 2440271 ecr 2219280,nop,nop,sack 1 {64261:79969},mptcp dss ack 4084396066], length 0
22:18:42.452238 IP 112.26.2.8.40313 > 112.26.2.1.targus-getdata1: Flags [.], seq 79969:81397, ack 0, win 4107, options [nop,nop,TS val 2221047 ecr 2437611,mptcp dss ack 1353584156 seq 4084464610 subseq 481237 len 1428 csum 0x2d15], length 1428
22:18:42.452437 IP 112.26.2.1.targus-getdata1 > 112.26.2.8.40313: Flags [.], ack 62833, win 24491, options [nop,nop,TS val 2440381 ecr 2219280,nop,nop,sack 1 {64261:81397},mptcp dss ack 4084396066], length 0
22:18:42.530191 IP 112.26.2.1.targus-getdata1 > 112.26.2.8.40313: Flags [.], ack 62833, win 24491, options [nop,nop,TS val 2439826 ecr 2219280,nop,nop,sack 1 {64261:75685},mptcp dss ack 4084396066], length 0
22:18:42.580914 IP 112.26.2.8.40313 > 112.26.2.1.targus-getdata1: Flags [.], seq 81397:82825, ack 0, win 4107, options [nop,nop,TS val 2221229 ecr 2437740,mptcp dss ack 1353584156 seq 4084473178 subseq 482665 len 1428 csum 0x6c32], length 1428
22:18:42.581111 IP 112.26.2.1.targus-getdata1 > 112.26.2.8.40313: Flags [.], ack 62833, win 24491, options [nop,nop,TS val 2440510 ecr 2219280,nop,nop,sack 1 {64261:82825},mptcp dss ack 4084396066], length 0
22:18:42.641437 IP 112.26.2.1.targus-getdata1 > 112.26.2.8.40313: Flags [.], ack 62833, win 24491, options [nop,nop,TS val 2439915 ecr 2219280,nop,nop,sack 1 {64261:77113},mptcp dss ack 4084396066], length 0
22:18:42.714533 IP 112.26.2.8.40313 > 112.26.2.1.targus-getdata1: Flags [.], seq 82825:84253, ack 0, win 4107, options [nop,nop,TS val 2221453 ecr 2437907,mptcp dss ack 1353584156 seq 4084486030 subseq 484093 len 1428 csum 0x2123], length 1428
22:18:42.714703 IP 112.26.2.1.targus-getdata1 > 112.26.2.8.40313: Flags [.], ack 62833, win 24491, options [nop,nop,TS val 2440643 ecr 2219280,nop,nop,sack 1 {64261:84253},mptcp dss ack 4084396066], length 0
22:18:42.788127 IP 112.26.2.1.targus-getdata1 > 112.26.2.8.40313: Flags [.], ack 62833, win 24491, options [nop,nop,TS val 2440093 ecr 2219280,nop,nop,sack 1 {64261:78541},mptcp dss ack 4084396066], length 0
22:18:42.835106 IP 112.26.2.8.40313 > 112.26.2.1.targus-getdata1: Flags [.], seq 84253:85681, ack 0, win 4107, options [nop,nop,TS val 2221675 ecr 2438169,mptcp dss ack 1353584156 seq 4084490314 subseq 485521 len 1428 csum 0x7c3e], length 1428
22:18:42.835340 IP 112.26.2.1.targus-getdata1 > 112.26.2.8.40313: Flags [.], ack 62833, win 24491, options [nop,nop,TS val 2440764 ecr 2219280,nop,nop,sack 1 {64261:85681},mptcp dss ack 4084396066], length 0
22:18:42.911189 IP 112.26.2.1.targus-getdata1 > 112.26.2.8.40313: Flags [.], ack 62833, win 24491, options [nop,nop,TS val 2440271 ecr 2219280,nop,nop,sack 1 {64261:79969},mptcp dss ack 4084396066], length 0
22:18:42.978598 IP 112.26.2.1.targus-getdata1 > 112.26.2.8.40313: Flags [.], ack 62833, win 24491, options [nop,nop,TS val 2440381 ecr 2219280,nop,nop,sack 1 {64261:81397},mptcp dss ack 4084396066], length 0
22:18:43.058728 IP 112.26.2.1.targus-getdata1 > 112.26.2.8.40313: Flags [.], ack 62833, win 24491, options [nop,nop,TS val 2440510 ecr 2219280,nop,nop,sack 1 {64261:82825},mptcp dss ack 4084396066], length 0
22:18:43.121852 IP 112.26.2.1.targus-getdata1 > 112.26.2.8.40313: Flags [.], ack 62833, win 24491, options [nop,nop,TS val 2440643 ecr 2219280,nop,nop,sack 1 {64261:84253},mptcp dss ack 4084396066], length 0
22:18:43.203847 IP 112.26.2.1.targus-getdata1 > 112.26.2.8.40313: Flags [.], ack 62833, win 24491, options [nop,nop,TS val 2440764 ecr 2219280,nop,nop,sack 1 {64261:85681},mptcp dss ack 4084396066], length 0
22:18:43.288450 IP 112.26.2.8.40313 > 112.26.2.1.targus-getdata1: Flags [.], seq 88537:89965, ack 0, win 4107, options [nop,nop,TS val 2222213 ecr 2438652,mptcp dss ack 1353584156 seq 4084508878 subseq 489805 len 1428 csum 0xd979], length 1428
22:18:43.288752 IP 112.26.2.1.targus-getdata1 > 112.26.2.8.40313: Flags [.], ack 62833, win 24491, options [nop,nop,TS val 2441218 ecr 2219280,nop,nop,sack 2 {88537:89965}{64261:85681},mptcp dss ack 4084396066], length 0
22:18:43.391544 IP 112.26.2.8.40313 > 112.26.2.1.targus-getdata1: Flags [.], seq 89965:91393, ack 0, win 4107, options [nop,nop,TS val 2222213 ecr 2438652,mptcp dss ack 1353584156 seq 4084510306 subseq 491233 len 1428 csum 0x80ae], length 1428
22:18:43.391769 IP 112.26.2.1.targus-getdata1 > 112.26.2.8.40313: Flags [.], ack 62833, win 24491, options [nop,nop,TS val 2441320 ecr 2219280,nop,nop,sack 2 {88537:91393}{64261:85681},mptcp dss ack 4084396066], length 0
22:18:43.512558 IP 112.26.2.8.40313 > 112.26.2.1.targus-getdata1: Flags [.], seq 91393:92821, ack 0, win 4107, options [nop,nop,TS val 2222329 ecr 2438760,mptcp dss ack 1353584156 seq 4084513162 subseq 492661 len 1428 csum 0x2500], length 1428
22:18:43.512800 IP 112.26.2.1.targus-getdata1 > 112.26.2.8.40313: Flags [.], ack 62833, win 24491, options [nop,nop,TS val 2441442 ecr 2219280,nop,nop,sack 2 {88537:92821}{64261:85681},mptcp dss ack 4084396066], length 0
22:18:43.611613 IP 112.26.2.8.40313 > 112.26.2.1.targus-getdata1: Flags [.], seq 92821:94249, ack 0, win 4107, options [nop,nop,TS val 2222516 ecr 2438910,mptcp dss ack 1353584156 seq 4084521730 subseq 494089 len 1428 csum 0xa81d], length 1428
22:18:43.611821 IP 112.26.2.1.targus-getdata1 > 112.26.2.8.40313: Flags [.], ack 62833, win 24425, options [nop,nop,TS val 2441541 ecr 2219280,nop,nop,sack 2 {88537:94249}{64261:85681},mptcp dss ack 4084400350], length 0
22:18:43.755603 IP 112.26.2.8.40313 > 112.26.2.1.targus-getdata1: Flags [.], seq 94249:95677, ack 0, win 4107, options [nop,nop,TS val 2222649 ecr 2438968,mptcp dss ack 1353584156 seq 4084523158 subseq 495517 len 1428 csum 0xc02d], length 1428
