21:10:58.488779 IP 112.26.3.8.46741 > 112.26.3.1.targus-getdata1: Flags [S], seq 53156089, win 29200, options [mss 1460,sackOK,TS val 667416 ecr 0,nop,wscale 7,mptcp join id 6 token 0x71e0988d nonce 0x5e773d8e], length 0
21:10:58.489177 IP 112.26.3.1.targus-getdata1 > 112.26.3.8.46741: Flags [S.], seq 855111012, ack 53156090, win 28560, options [mss 1460,sackOK,TS val 888243 ecr 667416,nop,wscale 7,mptcp join id 6 hmac 0x65c189eb92206942 nonce 0xc0ba7367], length 0
21:10:58.578459 IP 112.26.3.1.targus-getdata1 > 112.26.3.8.46741: Flags [S.], seq 855111012, ack 53156090, win 28560, options [mss 1460,sackOK,TS val 888243 ecr 667416,nop,wscale 7,mptcp join id 6 hmac 0x65c189eb92206942 nonce 0xc0ba7367], length 0
21:10:58.687632 IP 112.26.3.8.46741 > 112.26.3.1.targus-getdata1: Flags [.], ack 1, win 457, options [nop,nop,TS val 667527 ecr 888243,mptcp join hmac 0xfe2275a20e5c3214ae4b7c4645761b66139e8695], length 0
21:10:58.688122 IP 112.26.3.1.targus-getdata1 > 112.26.3.8.46741: Flags [.], ack 1, win 447, options [nop,nop,TS val 888442 ecr 667527,mptcp dss ack 394472260], length 0
21:10:58.696957 IP 112.26.3.1.targus-getdata1 > 112.26.3.8.46741: Flags [.], ack 1, win 447, options [nop,nop,TS val 888442 ecr 667527,mptcp dss ack 394472260], length 0
21:10:59.049297 IP 112.26.3.8.46741 > 112.26.3.1.targus-getdata1: Flags [P.], seq 1:84, ack 1, win 913, options [nop,nop,TS val 667932 ecr 888442,mptcp dss ack 2021447404 seq 394472264 subseq 1 len 83 csum 0x8a9d], length 83
21:11:40.949218 IP 112.26.3.8.42363 > 112.26.3.1.targus-getdata1: Flags [.], seq 1192160391:1192161819, ack 3365537292, win 913, options [nop,nop,TS val 709088 ecr 929860,mptcp dss ack 1803767578 seq 2226255720 subseq 572629 len 1428 csum 0x5462], length 1428
21:11:40.949548 IP 112.26.3.1.targus-getdata1 > 112.26.3.8.42363: Flags [.], ack 1428, win 6122, options [nop,nop,TS val 930703 ecr 709088,mptcp dss ack 2226234300], length 0
21:11:40.994519 IP 112.26.3.1.targus-getdata1 > 112.26.3.8.42363: Flags [.], ack 1428, win 6122, options [nop,nop,TS val 930703 ecr 709088,mptcp dss ack 2226234300], length 0
21:11:41.076903 IP 112.26.3.8.42363 > 112.26.3.1.targus-getdata1: Flags [.], seq 1428:2856, ack 1, win 913, options [nop,nop,TS val 709212 ecr 929937,mptcp dss ack 1803767578 seq 2226258576 subseq 574057 len 1428 csum 0x5808], length 1428
21:11:41.077160 IP 112.26.3.1.targus-getdata1 > 112.26.3.8.42363: Flags [.], ack 2856, win 6122, options [nop,nop,TS val 930831 ecr 709212,mptcp dss ack 2226234300], length 0
21:11:41.096207 IP 112.26.3.1.targus-getdata1 > 112.26.3.8.42363: Flags [.], ack 2856, win 6122, options [nop,nop,TS val 930831 ecr 709212,mptcp dss ack 2226234300], length 0
21:11:41.179121 IP 112.26.3.8.42363 > 112.26.3.1.targus-getdata1: Flags [.], seq 2856:4284, ack 1, win 913, options [nop,nop,TS val 709266 ecr 930056,mptcp dss ack 1803767578 seq 2226260004 subseq 575485 len 1428 csum 0x232e], length 1428
21:11:41.179417 IP 112.26.3.1.targus-getdata1 > 112.26.3.8.42363: Flags [.], ack 4284, win 6122, options [nop,nop,TS val 930933 ecr 709266,mptcp dss ack 2226234300], length 0
21:11:41.184438 IP 112.26.3.1.targus-getdata1 > 112.26.3.8.42363: Flags [.], ack 4284, win 6122, options [nop,nop,TS val 930933 ecr 709266,mptcp dss ack 2226234300], length 0
21:11:41.256732 IP 112.26.3.8.42363 > 112.26.3.1.targus-getdata1: Flags [.], seq 4284:5712, ack 1, win 913, options [nop,nop,TS val 709412 ecr 930206,mptcp dss ack 1803767578 seq 2226270000 subseq 576913 len 1428 csum 0xed06], length 1428
21:11:41.257019 IP 112.26.3.1.targus-getdata1 > 112.26.3.8.42363: Flags [.], ack 5712, win 6122, options [nop,nop,TS val 931010 ecr 709412,mptcp dss ack 2226234300], length 0
21:11:41.299797 IP 112.26.3.1.targus-getdata1 > 112.26.3.8.42363: Flags [.], ack 5712, win 6122, options [nop,nop,TS val 931010 ecr 709412,mptcp dss ack 2226234300], length 0
21:11:41.345114 IP 112.26.3.8.42363 > 112.26.3.1.targus-getdata1: Flags [.], seq 5712:7140, ack 1, win 913, options [nop,nop,TS val 709530 ecr 930293,mptcp dss ack 1803767578 seq 2226277140 subseq 578341 len 1428 csum 0xdd80], length 1428
21:11:41.386364 IP 112.26.3.1.targus-getdata1 > 112.26.3.8.42363: Flags [.], ack 7140, win 6122, options [nop,nop,TS val 931141 ecr 709530,mptcp dss ack 2226234300], length 0
21:11:41.418507 IP 112.26.3.1.targus-getdata1 > 112.26.3.8.42363: Flags [.], ack 7140, win 6122, options [nop,nop,TS val 931141 ecr 709530,mptcp dss ack 2226234300], length 0
21:11:41.454788 IP 112.26.3.8.42363 > 112.26.3.1.targus-getdata1: Flags [.], seq 7140:8568, ack 1, win 913, options [nop,nop,TS val 709607 ecr 930398,mptcp dss ack 1803767578 seq 2226278568 subseq 579769 len 1428 csum 0x643e], length 1428
21:11:41.542038 IP 112.26.3.1.targus-getdata1 > 112.26.3.8.42363: Flags [.], ack 8568, win 6122, options [nop,nop,TS val 931296 ecr 709607,mptcp dss ack 2226234300], length 0
21:11:41.544447 IP 112.26.3.1.targus-getdata1 > 112.26.3.8.42363: Flags [.], ack 8568, win 6122, options [nop,nop,TS val 931296 ecr 709607,mptcp dss ack 2226234300], length 0
21:11:41.582028 IP 112.26.3.8.42363 > 112.26.3.1.targus-getdata1: Flags [.], seq 8568:9996, ack 1, win 913, options [nop,nop,TS val 709729 ecr 930527,mptcp dss ack 1803767578 seq 2226284280 subseq 581197 len 1428 csum 0xcd3e], length 1428
21:11:41.656693 IP 112.26.3.8.42363 > 112.26.3.1.targus-getdata1: Flags [.], seq 9996:11424, ack 1, win 913, options [nop,nop,TS val 709842 ecr 930636,mptcp dss ack 1803767578 seq 2226289992 subseq 582625 len 1428 csum 0x25cb], length 1428
21:11:41.724144 IP 112.26.3.8.42363 > 112.26.3.1.targus-getdata1: Flags [.], seq 11424:12852, ack 1, win 913, options [nop,nop,TS val 709842 ecr 930636,mptcp dss ack 1803767578 seq 2226291420 subseq 584053 len 1428 csum 0xc4f], length 1428
21:11:41.773932 IP 112.26.3.1.targus-getdata1 > 112.26.3.8.42363: Flags [.], ack 12852, win 6122, options [nop,nop,TS val 931528 ecr 709729,mptcp dss ack 2226234300], length 0
21:11:41.787839 IP 112.26.3.1.targus-getdata1 > 112.26.3.8.42363: Flags [.], ack 12852, win 6122, options [nop,nop,TS val 931528 ecr 709729,mptcp dss ack 2226234300], length 0
21:11:41.845317 IP 112.26.3.8.42363 > 112.26.3.1.targus-getdata1: Flags [.], seq 12852:14280, ack 1, win 913, options [nop,nop,TS val 709942 ecr 930703,mptcp dss ack 1803767578 seq 2226295704 subseq 585481 len 1428 csum 0x9b4f], length 1428
21:11:41.924720 IP 112.26.3.8.42363 > 112.26.3.1.targus-getdata1: Flags [.], seq 15708:17136, ack 1, win 913, options [nop,nop,TS val 710138 ecr 930933,mptcp dss ack 1803767578 seq 2226307128 subseq 588337 len 1428 csum 0x9eb3], length 1428
21:11:41.925038 IP 112.26.3.1.targus-getdata1 > 112.26.3.8.42363: Flags [.], ack 14280, win 6122, options [nop,nop,TS val 931679 ecr 709942,nop,nop,sack 1 {15708:17136},mptcp dss ack 2226234300], length 0
21:11:41.944000 IP 112.26.3.1.targus-getdata1 > 112.26.3.8.42363: Flags [.], ack 14280, win 6122, options [nop,nop,TS val 931679 ecr 709942,nop,nop,sack 1 {15708:17136},mptcp dss ack 2226234300], length 0
21:11:42.043763 IP 112.26.3.8.42363 > 112.26.3.1.targus-getdata1: Flags [.], seq 17136:18564, ack 1, win 913, options [nop,nop,TS val 710248 ecr 931010,mptcp dss ack 1803767578 seq 2226309984 subseq 589765 len 1428 csum 0x14d4], length 1428
21:11:42.044070 IP 112.26.3.1.targus-getdata1 > 112.26.3.8.42363: Flags [.], ack 14280, win 6122, options [nop,nop,TS val 931798 ecr 709942,nop,nop,sack 1 {15708:18564},mptcp dss ack 2226234300], length 0
21:11:42.052025 IP 112.26.3.1.targus-getdata1 > 112.26.3.8.42363: Flags [.], ack 14280, win 6122, options [nop,nop,TS val 931798 ecr 709942,nop,nop,sack 1 {15708:18564},mptcp dss ack 2226234300], length 0
21:11:42.153779 IP 112.26.3.8.42363 > 112.26.3.1.targus-getdata1: Flags [.], seq 18564:19992, ack 1, win 913, options [nop,nop,TS val 710366 ecr 931141,mptcp dss ack 1803767578 seq 2226315696 subseq 591193 len 1428 csum 0x6c12], length 1428
21:11:42.154056 IP 112.26.3.1.targus-getdata1 > 112.26.3.8.42363: Flags [.], ack 14280, win 6122, options [nop,nop,TS val 931908 ecr 709942,nop,nop,sack 1 {15708:19992},mptcp dss ack 2226234300], length 0
21:11:42.158994 IP 112.26.3.1.targus-getdata1 > 112.26.3.8.42363: Flags [.], ack 14280, win 6122, options [nop,nop,TS val 931908 ecr 709942,nop,nop,sack 1 {15708:19992},mptcp dss ack 2226234300], length 0
21:11:42.248958 IP 112.26.3.8.42363 > 112.26.3.1.targus-getdata1: Flags [.], seq 19992:21420, ack 1, win 913, options [nop,nop,TS val 710493 ecr 931296,mptcp dss ack 1803767578 seq 2226322836 subseq 592621 len 1428 csum 0xceb3], length 1428
21:11:42.249307 IP 112.26.3.1.targus-getdata1 > 112.26.3.8.42363: Flags [.], ack 14280, win 6122, options [nop,nop,TS val 932003 ecr 709942,nop,nop,sack 1 {15708:21420},mptcp dss ack 2226234300], length 0
21:11:42.278083 IP 112.26.3.1.targus-getdata1 > 112.26.3.8.42363: Flags [.], ack 14280, win 6122, options [nop,nop,TS val 932003 ecr 709942,nop,nop,sack 1 {15708:21420},mptcp dss ack 2226234300], length 0
21:11:42.347016 IP 112.26.3.8.42363 > 112.26.3.1.targus-getdata1: Flags [.], seq 21420:22848, ack 1, win 913, options [nop,nop,TS val 710736 ecr 931528,mptcp dss ack 1803767578 seq 2226329976 subseq 594049 len 1428 csum 0xb2e8], length 1428
21:11:42.347372 IP 112.26.3.1.targus-getdata1 > 112.26.3.8.42363: Flags [.], ack 14280, win 6122, options [nop,nop,TS val 932101 ecr 709942,nop,nop,sack 1 {15708:22848},mptcp dss ack 2226299988], length 0
21:11:42.360282 IP 112.26.3.1.targus-getdata1 > 112.26.3.8.42363: Flags [.], ack 14280, win 6122, options [nop,nop,TS val 932101 ecr 709942,nop,nop,sack 1 {15708:22848},mptcp dss ack 2226299988], length 0
21:11:42.447458 IP 112.26.3.8.42363 > 112.26.3.1.targus-getdata1: Flags [.], seq 22848:24276, ack 1, win 913, options [nop,nop,TS val 710736 ecr 931528,mptcp dss ack 1803767578 seq 2226331404 subseq 595477 len 1428 csum 0x3e7e], length 1428
21:11:42.447827 IP 112.26.3.1.targus-getdata1 > 112.26.3.8.42363: Flags [.], ack 14280, win 6122, options [nop,nop,TS val 932202 ecr 709942,nop,nop,sack 1 {15708:24276},mptcp dss ack 2226299988], length 0
21:11:42.506793 IP 112.26.3.8.42363 > 112.26.3.1.targus-getdata1: Flags [.], seq 24276:25704, ack 1, win 913, options [nop,nop,TS val 710736 ecr 931528,mptcp dss ack 1803767578 seq 2226332832 subseq 596905 len 1428 csum 0xb753], length 1428
21:11:42.507142 IP 112.26.3.1.targus-getdata1 > 112.26.3.8.42363: Flags [.], ack 14280, win 6122, options [nop,nop,TS val 932261 ecr 709942,nop,nop,sack 1 {15708:25704},mptcp dss ack 2226299988], length 0
21:11:42.516886 IP 112.26.3.1.targus-getdata1 > 112.26.3.8.42363: Flags [.], ack 14280, win 6122, options [nop,nop,TS val 932202 ecr 709942,nop,nop,sack 1 {15708:24276},mptcp dss ack 2226299988], length 0
21:11:42.587508 IP 112.26.3.8.42363 > 112.26.3.1.targus-getdata1: Flags [.], seq 25704:27132, ack 1, win 913, options [nop,nop,TS val 710901 ecr 931679,mptcp dss ack 1803767578 seq 2226342828 subseq 598333 len 1428 csum 0x269f], length 1428
21:11:42.587792 IP 112.26.3.1.targus-getdata1 > 112.26.3.8.42363: Flags [.], ack 14280, win 6122, options [nop,nop,TS val 932342 ecr 709942,nop,nop,sack 1 {15708:27132},mptcp dss ack 2226299988], length 0
21:11:42.614664 IP 112.26.3.1.targus-getdata1 > 112.26.3.8.42363: Flags [.], ack 14280, win 6122, options [nop,nop,TS val 932261 ecr 709942,nop,nop,sack 1 {15708:25704},mptcp dss ack 2226299988], length 0
21:11:42.653689 IP 112.26.3.8.42363 > 112.26.3.1.targus-getdata1: Flags [.], seq 27132:28560, ack 1, win 913, options [nop,nop,TS val 710901 ecr 931679,mptcp dss ack 1803767578 seq 2226344256 subseq 599761 len 1428 csum 0x8eea], length 1428
21:11:42.654004 IP 112.26.3.1.targus-getdata1 > 112.26.3.8.42363: Flags [.], ack 14280, win 6122, options [nop,nop,TS val 932408 ecr 709942,nop,nop,sack 1 {15708:28560},mptcp dss ack 2226299988], length 0
21:11:42.735541 IP 112.26.3.8.42363 > 112.26.3.1.targus-getdata1: Flags [.], seq 28560:29988, ack 1, win 913, options [nop,nop,TS val 711088 ecr 931798,mptcp dss ack 1803767578 seq 2226347112 subseq 601189 len 1428 csum 0x51f4], length 1428
21:11:42.735894 IP 112.26.3.1.targus-getdata1 > 112.26.3.8.42363: Flags [.], ack 14280, win 6122, options [nop,nop,TS val 932490 ecr 709942,nop,nop,sack 1 {15708:29988},mptcp dss ack 2226299988], length 0
21:11:42.768252 IP 112.26.3.1.targus-getdata1 > 112.26.3.8.42363: Flags [.], ack 14280, win 6122, options [nop,nop,TS val 932342 ecr 709942,nop,nop,sack 1 {15708:27132},mptcp dss ack 2226299988], length 0
21:11:42.824250 IP 112.26.3.1.targus-getdata1 > 112.26.3.8.42363: Flags [.], ack 14280, win 6122, options [nop,nop,TS val 932408 ecr 709942,nop,nop,sack 1 {15708:28560},mptcp dss ack 2226299988], length 0
21:11:42.852517 IP 112.26.3.8.42363 > 112.26.3.1.targus-getdata1: Flags [.], seq 14280:15708, ack 1, win 913, options [nop,nop,TS val 711108 ecr 931908,mptcp dss ack 1803767578 seq 2226299988 subseq 586909 len 1428 csum 0x1835], length 1428
21:11:42.852922 IP 112.26.3.1.targus-getdata1 > 112.26.3.8.42363: Flags [.], ack 29988, win 6053, options [nop,nop,TS val 932606 ecr 711108,mptcp dss ack 2226312840], length 0
21:11:42.916773 IP 112.26.3.1.targus-getdata1 > 112.26.3.8.42363: Flags [.], ack 14280, win 6122, options [nop,nop,TS val 932490 ecr 709942,nop,nop,sack 1 {15708:29988},mptcp dss ack 2226299988], length 0
21:11:42.975958 IP 112.26.3.8.42363 > 112.26.3.1.targus-getdata1: Flags [.], seq 29988:31416, ack 1, win 913, options [nop,nop,TS val 711298 ecr 932003,mptcp dss ack 1803767578 seq 2226354252 subseq 602617 len 1428 csum 0x565], length 1428
21:11:42.976295 IP 112.26.3.1.targus-getdata1 > 112.26.3.8.42363: Flags [.], ack 31416, win 6122, options [nop,nop,TS val 932730 ecr 711298,mptcp dss ack 2226312840], length 0
21:11:43.017182 IP 112.26.3.1.targus-getdata1 > 112.26.3.8.42363: Flags [.], ack 29988, win 6053, options [nop,nop,TS val 932606 ecr 711108,mptcp dss ack 2226312840], length 0
21:11:43.078022 IP 112.26.3.8.42363 > 112.26.3.1.targus-getdata1: Flags [.], seq 31416:32844, ack 1, win 913, options [nop,nop,TS val 711647 ecr 932261,mptcp dss ack 1803767578 seq 2226369960 subseq 604045 len 1428 csum 0x6565], length 1428
21:11:43.078293 IP 112.26.3.1.targus-getdata1 > 112.26.3.8.42363: Flags [.], ack 32844, win 6122, options [nop,nop,TS val 932832 ecr 711647,mptcp dss ack 2226312840], length 0
21:11:43.128217 IP 112.26.3.1.targus-getdata1 > 112.26.3.8.42363: Flags [.], ack 31416, win 6122, options [nop,nop,TS val 932730 ecr 711298,mptcp dss ack 2226312840], length 0
21:11:43.175980 IP 112.26.3.8.42363 > 112.26.3.1.targus-getdata1: Flags [.], seq 32844:34272, ack 1, win 913, options [nop,nop,TS val 711740 ecr 932342,mptcp dss ack 1803767578 seq 2226372816 subseq 605473 len 1428 csum 0xf446], length 1428
21:11:43.176302 IP 112.26.3.1.targus-getdata1 > 112.26.3.8.42363: Flags [.], ack 34272, win 6122, options [nop,nop,TS val 932930 ecr 711740,mptcp dss ack 2226312840], length 0
21:11:43.257852 IP 112.26.3.8.42363 > 112.26.3.1.targus-getdata1: Flags [.], seq 34272:35700, ack 1, win 913, options [nop,nop,TS val 711831 ecr 932408,mptcp dss ack 1803767578 seq 2226377100 subseq 606901 len 1428 csum 0x4f91], length 1428
21:11:43.258187 IP 112.26.3.1.targus-getdata1 > 112.26.3.8.42363: Flags [.], ack 35700, win 6122, options [nop,nop,TS val 933012 ecr 711831,mptcp dss ack 2226312840], length 0
21:11:43.300763 IP 112.26.3.1.targus-getdata1 > 112.26.3.8.42363: Flags [.], ack 32844, win 6122, options [nop,nop,TS val 932832 ecr 711647,mptcp dss ack 2226312840], length 0
21:11:43.371532 IP 112.26.3.8.42363 > 112.26.3.1.targus-getdata1: Flags [.], seq 35700:37128, ack 1, win 913, options [nop,nop,TS val 711868 ecr 932490,mptcp dss ack 1803767578 seq 2226381384 subseq 608329 len 1428 csum 0xd367], length 1428
21:11:43.371894 IP 112.26.3.1.targus-getdata1 > 112.26.3.8.42363: Flags [.], ack 37128, win 6122, options [nop,nop,TS val 933126 ecr 711868,mptcp dss ack 2226349968], length 0
21:11:43.376761 IP 112.26.3.1.targus-getdata1 > 112.26.3.8.42363: Flags [.], ack 34272, win 6122, options [nop,nop,TS val 932930 ecr 711740,mptcp dss ack 2226312840], length 0
21:11:43.463444 IP 112.26.3.8.42363 > 112.26.3.1.targus-getdata1: Flags [.], seq 37128:38556, ack 1, win 913, options [nop,nop,TS val 711965 ecr 932606,mptcp dss ack 1803767578 seq 2226387096 subseq 609757 len 1428 csum 0x56ec], length 1428
21:11:43.463725 IP 112.26.3.1.targus-getdata1 > 112.26.3.8.42363: Flags [.], ack 38556, win 6122, options [nop,nop,TS val 933217 ecr 711965,mptcp dss ack 2226349968], length 0
21:11:43.480516 IP 112.26.3.1.targus-getdata1 > 112.26.3.8.42363: Flags [.], ack 35700, win 6122, options [nop,nop,TS val 933012 ecr 711831,mptcp dss ack 2226312840], length 0
21:11:43.569514 IP 112.26.3.1.targus-getdata1 > 112.26.3.8.42363: Flags [.], ack 37128, win 6122, options [nop,nop,TS val 933126 ecr 711868,mptcp dss ack 2226349968], length 0
21:11:43.577041 IP 112.26.3.8.42363 > 112.26.3.1.targus-getdata1: Flags [.], seq 38556:39984, ack 1, win 913, options [nop,nop,TS val 712078 ecr 932730,mptcp dss ack 1803767578 seq 2226394236 subseq 611185 len 1428 csum 0xc5ef], length 1428
21:11:43.577365 IP 112.26.3.1.targus-getdata1 > 112.26.3.8.42363: Flags [.], ack 39984, win 6122, options [nop,nop,TS val 933331 ecr 712078,mptcp dss ack 2226349968], length 0
21:11:43.687032 IP 112.26.3.1.targus-getdata1 > 112.26.3.8.42363: Flags [.], ack 38556, win 6122, options [nop,nop,TS val 933217 ecr 711965,mptcp dss ack 2226349968], length 0
21:11:43.727706 IP 112.26.3.8.42363 > 112.26.3.1.targus-getdata1: Flags [.], seq 39984:41412, ack 1, win 913, options [nop,nop,TS val 712249 ecr 932832,mptcp dss ack 1803767578 seq 2226399948 subseq 612613 len 1428 csum 0xc185], length 1428
21:11:43.728072 IP 112.26.3.1.targus-getdata1 > 112.26.3.8.42363: Flags [.], ack 41412, win 6122, options [nop,nop,TS val 933482 ecr 712249,mptcp dss ack 2226349968], length 0
21:11:43.828225 IP 112.26.3.8.42363 > 112.26.3.1.targus-getdata1: Flags [.], seq 41412:42840, ack 1, win 913, options [nop,nop,TS val 712249 ecr 932832,mptcp dss ack 1803767578 seq 2226401376 subseq 614041 len 1428 csum 0x677], length 1428
21:11:43.828580 IP 112.26.3.1.targus-getdata1 > 112.26.3.8.42363: Flags [.], ack 42840, win 6122, options [nop,nop,TS val 933583 ecr 712249,mptcp dss ack 2226349968], length 0
21:11:43.882056 IP 112.26.3.1.targus-getdata1 > 112.26.3.8.42363: Flags [.], ack 39984, win 6122, options [nop,nop,TS val 933331 ecr 712078,mptcp dss ack 2226349968], length 0
21:11:43.932231 IP 112.26.3.8.42363 > 112.26.3.1.targus-getdata1: Flags [.], seq 42840:44268, ack 1, win 913, options [nop,nop,TS val 712347 ecr 932930,mptcp dss ack 1803767578 seq 2226407088 subseq 615469 len 1428 csum 0x9d2a], length 1428
21:11:43.932535 IP 112.26.3.1.targus-getdata1 > 112.26.3.8.42363: Flags [.], ack 44268, win 6122, options [nop,nop,TS val 933687 ecr 712347,mptcp dss ack 2226349968], length 0
21:11:43.965016 IP 112.26.3.1.targus-getdata1 > 112.26.3.8.42363: Flags [.], ack 41412, win 6122, options [nop,nop,TS val 933482 ecr 712249,mptcp dss ack 2226349968], length 0
21:11:44.051561 IP 112.26.3.8.42363 > 112.26.3.1.targus-getdata1: Flags [.], seq 44268:45696, ack 1, win 913, options [nop,nop,TS val 712439 ecr 933012,mptcp dss ack 1803767578 seq 2226408516 subseq 616897 len 1428 csum 0x9c9f], length 1428
21:11:44.051863 IP 112.26.3.1.targus-getdata1 > 112.26.3.8.42363: Flags [.], ack 45696, win 6122, options [nop,nop,TS val 933806 ecr 712439,mptcp dss ack 2226349968], length 0
21:11:44.095673 IP 112.26.3.1.targus-getdata1 > 112.26.3.8.42363: Flags [.], ack 42840, win 6122, options [nop,nop,TS val 933583 ecr 712249,mptcp dss ack 2226349968], length 0
21:11:44.150755 IP 112.26.3.8.42363 > 112.26.3.1.targus-getdata1: Flags [.], seq 45696:47124, ack 1, win 913, options [nop,nop,TS val 712520 ecr 933126,mptcp dss ack 1803767578 seq 2226411372 subseq 618325 len 1428 csum 0x208a], length 1428
21:11:44.151093 IP 112.26.3.1.targus-getdata1 > 112.26.3.8.42363: Flags [.], ack 47124, win 6122, options [nop,nop,TS val 933905 ecr 712520,mptcp dss ack 2226349968], length 0
21:11:44.176790 IP 112.26.3.1.targus-getdata1 > 112.26.3.8.42363: Flags [.], ack 44268, win 6122, options [nop,nop,TS val 933687 ecr 712347,mptcp dss ack 2226349968], length 0
21:11:44.255103 IP 112.26.3.8.42363 > 112.26.3.1.targus-getdata1: Flags [.], seq 47124:48552, ack 1, win 913, options [nop,nop,TS val 712520 ecr 933126,mptcp dss ack 1803767578 seq 2226412800 subseq 619753 len 1428 csum 0xddd8], length 1428
21:11:44.255440 IP 112.26.3.1.targus-getdata1 > 112.26.3.8.42363: Flags [.], ack 48552, win 6122, options [nop,nop,TS val 934009 ecr 712520,mptcp dss ack 2226349968], length 0
21:11:44.271998 IP 112.26.3.1.targus-getdata1 > 112.26.3.8.42363: Flags [.], ack 45696, win 6122, options [nop,nop,TS val 933806 ecr 712439,mptcp dss ack 2226349968], length 0
21:11:44.330555 IP 112.26.3.1.targus-getdata1 > 112.26.3.8.42363: Flags [.], ack 47124, win 6122, options [nop,nop,TS val 933905 ecr 712520,mptcp dss ack 2226349968], length 0
21:11:44.377511 IP 112.26.3.8.42363 > 112.26.3.1.targus-getdata1: Flags [.], seq 48552:49980, ack 1, win 913, options [nop,nop,TS val 712635 ecr 933217,mptcp dss ack 1803767578 seq 2226419940 subseq 621181 len 1428 csum 0xad26], length 1428
21:11:44.377864 IP 112.26.3.1.targus-getdata1 > 112.26.3.8.42363: Flags [.], ack 49980, win 6122, options [nop,nop,TS val 934131 ecr 712635,mptcp dss ack 2226349968], length 0
21:11:44.427169 IP 112.26.3.1.targus-getdata1 > 112.26.3.8.42363: Flags [.], ack 48552, win 6122, options [nop,nop,TS val 934009 ecr 712520,mptcp dss ack 2226349968], length 0
21:11:44.484654 IP 112.26.3.8.42363 > 112.26.3.1.targus-getdata1: Flags [.], seq 49980:51408, ack 1, win 913, options [nop,nop,TS val 712833 ecr 933331,mptcp dss ack 1803767578 seq 2226428508 subseq 622609 len 1428 csum 0xd446], length 1428
21:11:44.485031 IP 112.26.3.1.targus-getdata1 > 112.26.3.8.42363: Flags [.], ack 51408, win 6122, options [nop,nop,TS val 934239 ecr 712833,mptcp dss ack 2226349968], length 0
21:11:44.524462 IP 112.26.3.1.targus-getdata1 > 112.26.3.8.42363: Flags [.], ack 49980, win 6122, options [nop,nop,TS val 934131 ecr 712635,mptcp dss ack 2226349968], length 0
21:11:44.594757 IP 112.26.3.8.42363 > 112.26.3.1.targus-getdata1: Flags [.], seq 51408:52836, ack 1, win 913, options [nop,nop,TS val 712928 ecr 933482,mptcp dss ack 1803767578 seq 2226434220 subseq 624037 len 1428 csum 0xce5f], length 1428
21:11:44.609686 IP 112.26.3.1.targus-getdata1 > 112.26.3.8.42363: Flags [.], ack 51408, win 6122, options [nop,nop,TS val 934239 ecr 712833,mptcp dss ack 2226349968], length 0
21:11:44.636070 IP 112.26.3.1.targus-getdata1 > 112.26.3.8.42363: Flags [.], ack 52836, win 6122, options [nop,nop,TS val 934390 ecr 712928,mptcp dss ack 2226349968], length 0
21:11:44.698990 IP 112.26.3.1.targus-getdata1 > 112.26.3.8.42363: Flags [.], ack 52836, win 6122, options [nop,nop,TS val 934390 ecr 712928,mptcp dss ack 2226349968], length 0
21:11:44.763376 IP 112.26.3.8.42363 > 112.26.3.1.targus-getdata1: Flags [.], seq 52836:54264, ack 1, win 913, options [nop,nop,TS val 713044 ecr 933583,mptcp dss ack 1803767578 seq 2226437076 subseq 625465 len 1428 csum 0x1227], length 1428
21:11:44.845707 IP 112.26.3.1.targus-getdata1 > 112.26.3.8.42363: Flags [.], ack 54264, win 6122, options [nop,nop,TS val 934600 ecr 713044,mptcp dss ack 2226349968], length 0
21:11:44.852715 IP 112.26.3.1.targus-getdata1 > 112.26.3.8.42363: Flags [.], ack 54264, win 6122, options [nop,nop,TS val 934600 ecr 713044,mptcp dss ack 2226349968], length 0
21:11:44.887753 IP 112.26.3.8.42363 > 112.26.3.1.targus-getdata1: Flags [.], seq 54264:55692, ack 1, win 913, options [nop,nop,TS val 713131 ecr 933687,mptcp dss ack 1803767578 seq 2226442788 subseq 626893 len 1428 csum 0x8e38], length 1428
21:11:44.953839 IP 112.26.3.8.42363 > 112.26.3.1.targus-getdata1: Flags [.], seq 55692:57120, ack 1, win 913, options [nop,nop,TS val 713230 ecr 933806,mptcp dss ack 1803767578 seq 2226449928 subseq 628321 len 1428 csum 0xd7ee], length 1428
21:11:45.036018 IP 112.26.3.8.42363 > 112.26.3.1.targus-getdata1: Flags [.], seq 57120:58548, ack 1, win 913, options [nop,nop,TS val 713323 ecr 933905,mptcp dss ack 1803767578 seq 2226455640 subseq 629749 len 1428 csum 0xa925], length 1428
21:11:45.036382 IP 112.26.3.1.targus-getdata1 > 112.26.3.8.42363: Flags [.], ack 58548, win 6122, options [nop,nop,TS val 934790 ecr 713131,mptcp dss ack 2226349968], length 0
21:11:45.039990 IP 112.26.3.1.targus-getdata1 > 112.26.3.8.42363: Flags [.], ack 58548, win 6122, options [nop,nop,TS val 934790 ecr 713131,mptcp dss ack 2226349968], length 0
21:11:45.146160 IP 112.26.3.8.42363 > 112.26.3.1.targus-getdata1: Flags [.], seq 58548:59976, ack 1, win 913, options [nop,nop,TS val 713399 ecr 934009,mptcp dss ack 1803767578 seq 2226458496 subseq 631177 len 1428 csum 0xaf04], length 1428
21:11:45.243153 IP 112.26.3.8.42363 > 112.26.3.1.targus-getdata1: Flags [.], seq 59976:61404, ack 1, win 913, options [nop,nop,TS val 713399 ecr 934009,mptcp dss ack 1803767578 seq 2226459924 subseq 632605 len 1428 csum 0xd54c], length 1428
21:11:45.318776 IP 112.26.3.8.42363 > 112.26.3.1.targus-getdata1: Flags [.], seq 61404:62832, ack 1, win 913, options [nop,nop,TS val 713485 ecr 934131,mptcp dss ack 1803767578 seq 2226462780 subseq 634033 len 1428 csum 0x1cce], length 1428
21:11:45.319048 IP 112.26.3.1.targus-getdata1 > 112.26.3.8.42363: Flags [.], ack 62832, win 6122, options [nop,nop,TS val 935072 ecr 713399,mptcp dss ack 2226349968], length 0
21:11:45.327342 IP 112.26.3.1.targus-getdata1 > 112.26.3.8.42363: Flags [.], ack 62832, win 6122, options [nop,nop,TS val 935072 ecr 713399,mptcp dss ack 2226349968], length 0
21:11:45.394860 IP 112.26.3.8.42363 > 112.26.3.1.targus-getdata1: Flags [.], seq 62832:64260, ack 1, win 913, options [nop,nop,TS val 713569 ecr 934239,mptcp dss ack 1803767578 seq 2226464208 subseq 635461 len 1428 csum 0xf7e], length 1428
21:11:45.464304 IP 112.26.3.8.42363 > 112.26.3.1.targus-getdata1: Flags [.], seq 64260:65688, ack 1, win 913, options [nop,nop,TS val 713652 ecr 934390,mptcp dss ack 1803767578 seq 2226469920 subseq 636889 len 1428 csum 0xbe46], length 1428
21:11:45.548001 IP 112.26.3.1.targus-getdata1 > 112.26.3.8.42363: Flags [.], ack 65688, win 5977, options [nop,nop,TS val 935302 ecr 713569,mptcp dss ack 2226404232], length 0
21:11:45.556859 IP 112.26.3.1.targus-getdata1 > 112.26.3.8.42363: Flags [.], ack 65688, win 5977, options [nop,nop,TS val 935302 ecr 713569,mptcp dss ack 2226404232], length 0
21:11:45.584844 IP 112.26.3.8.42363 > 112.26.3.1.targus-getdata1: Flags [.], seq 65688:67116, ack 1, win 913, options [nop,nop,TS val 713801 ecr 934600,mptcp dss ack 1803767578 seq 2226472776 subseq 638317 len 1428 csum 0x9497], length 1428
21:11:45.675785 IP 112.26.3.8.42363 > 112.26.3.1.targus-getdata1: Flags [.], seq 67116:68544, ack 1, win 913, options [nop,nop,TS val 713988 ecr 934790,mptcp dss ack 1803767578 seq 2226481344 subseq 639745 len 1428 csum 0xfb30], length 1428
21:11:45.735845 IP 112.26.3.8.42363 > 112.26.3.1.targus-getdata1: Flags [.], seq 68544:69972, ack 1, win 913, options [nop,nop,TS val 713988 ecr 934790,mptcp dss ack 1803767578 seq 2226482772 subseq 641173 len 1428 csum 0x8aae], length 1428
21:11:45.736133 IP 112.26.3.1.targus-getdata1 > 112.26.3.8.42363: Flags [.], ack 69972, win 5977, options [nop,nop,TS val 935490 ecr 713801,mptcp dss ack 2226404232], length 0
21:11:45.746118 IP 112.26.3.1.targus-getdata1 > 112.26.3.8.42363: Flags [.], ack 69972, win 5977, options [nop,nop,TS val 935490 ecr 713801,mptcp dss ack 2226404232], length 0
21:11:45.869345 IP 112.26.3.8.42363 > 112.26.3.1.targus-getdata1: Flags [.], seq 69972:71400, ack 1, win 913, options [nop,nop,TS val 713988 ecr 934790,mptcp dss ack 1803767578 seq 2226484200 subseq 642601 len 1428 csum 0x3b5b], length 1428
21:11:45.977349 IP 112.26.3.8.42363 > 112.26.3.1.targus-getdata1: Flags [.], seq 71400:72828, ack 1, win 913, options [nop,nop,TS val 714270 ecr 935072,mptcp dss ack 1803767578 seq 2226499908 subseq 644029 len 1428 csum 0x64c2], length 1428
21:11:46.050852 IP 112.26.3.8.42363 > 112.26.3.1.targus-getdata1: Flags [.], seq 72828:74256, ack 1, win 913, options [nop,nop,TS val 714270 ecr 935072,mptcp dss ack 1803767578 seq 2226501336 subseq 645457 len 1428 csum 0x4d0c], length 1428
21:11:46.051151 IP 112.26.3.1.targus-getdata1 > 112.26.3.8.42363: Flags [.], ack 74256, win 5977, options [nop,nop,TS val 935805 ecr 713988,mptcp dss ack 2226404232], length 0
21:11:46.053515 IP 112.26.3.1.targus-getdata1 > 112.26.3.8.42363: Flags [.], ack 74256, win 5977, options [nop,nop,TS val 935805 ecr 713988,mptcp dss ack 2226404232], length 0
21:11:46.158864 IP 112.26.3.8.42363 > 112.26.3.1.targus-getdata1: Flags [.], seq 74256:75684, ack 1, win 913, options [nop,nop,TS val 714270 ecr 935072,mptcp dss ack 1803767578 seq 2226502764 subseq 646885 len 1428 csum 0x9bf5], length 1428
21:11:46.243702 IP 112.26.3.8.42363 > 112.26.3.1.targus-getdata1: Flags [.], seq 75684:77112, ack 1, win 913, options [nop,nop,TS val 714505 ecr 935302,mptcp dss ack 1803767578 seq 2226505620 subseq 648313 len 1428 csum 0xc877], length 1428
21:11:46.308828 IP 112.26.3.8.42363 > 112.26.3.1.targus-getdata1: Flags [.], seq 77112:78540, ack 1, win 913, options [nop,nop,TS val 714505 ecr 935302,mptcp dss ack 1803767578 seq 2226507048 subseq 649741 len 1428 csum 0x4480], length 1428
21:11:46.309113 IP 112.26.3.1.targus-getdata1 > 112.26.3.8.42363: Flags [.], ack 78540, win 5966, options [nop,nop,TS val 936063 ecr 714270,mptcp dss ack 2226405660], length 0
21:11:46.313154 IP 112.26.3.1.targus-getdata1 > 112.26.3.8.42363: Flags [.], ack 78540, win 5966, options [nop,nop,TS val 936063 ecr 714270,mptcp dss ack 2226405660], length 0
21:11:46.399232 IP 112.26.3.8.42363 > 112.26.3.1.targus-getdata1: Flags [.], seq 78540:79968, ack 1, win 913, options [nop,nop,TS val 714696 ecr 935490,mptcp dss ack 1803767578 seq 2226517044 subseq 651169 len 1428 csum 0xa8c4], length 1428
21:11:46.479303 IP 112.26.3.8.42363 > 112.26.3.1.targus-getdata1: Flags [.], seq 79968:81396, ack 1, win 913, options [nop,nop,TS val 714696 ecr 935490,mptcp dss ack 1803767578 seq 2226518472 subseq 652597 len 1428 csum 0xe78b], length 1428
21:11:46.554605 IP 112.26.3.1.targus-getdata1 > 112.26.3.8.42363: Flags [.], ack 81396, win 5822, options [nop,nop,TS val 936309 ecr 714696,mptcp dss ack 2226424224], length 0
21:11:46.577610 IP 112.26.3.8.42363 > 112.26.3.1.targus-getdata1: Flags [.], seq 81396:82824, ack 1, win 913, options [nop,nop,TS val 714696 ecr 935490,mptcp dss ack 1803767578 seq 2226519900 subseq 654025 len 1428 csum 0x8cca], length 1428
21:11:46.596042 IP 112.26.3.1.targus-getdata1 > 112.26.3.8.42363: Flags [.], ack 81396, win 5822, options [nop,nop,TS val 936309 ecr 714696,mptcp dss ack 2226424224], length 0
21:11:46.695198 IP 112.26.3.8.42363 > 112.26.3.1.targus-getdata1: Flags [.], seq 84252:85680, ack 1, win 913, options [nop,nop,TS val 715003 ecr 935805,mptcp dss ack 1803767578 seq 2226529896 subseq 656881 len 1428 csum 0x84c8], length 1428
21:11:46.695593 IP 112.26.3.1.targus-getdata1 > 112.26.3.8.42363: Flags [.], ack 82824, win 6122, options [nop,nop,TS val 936449 ecr 714696,nop,nop,sack 1 {84252:85680},mptcp dss ack 2226522756], length 0
21:11:46.723030 IP 112.26.3.1.targus-getdata1 > 112.26.3.8.42363: Flags [.], ack 82824, win 6122, options [nop,nop,TS val 936449 ecr 714696,nop,nop,sack 1 {84252:85680},mptcp dss ack 2226522756], length 0
21:11:46.782351 IP 112.26.3.8.42363 > 112.26.3.1.targus-getdata1: Flags [.], seq 85680:87108, ack 1, win 913, options [nop,nop,TS val 715003 ecr 935805,mptcp dss ack 1803767578 seq 2226531324 subseq 658309 len 1428 csum 0x44ac], length 1428
21:11:46.782618 IP 112.26.3.1.targus-getdata1 > 112.26.3.8.42363: Flags [.], ack 82824, win 6122, options [nop,nop,TS val 936536 ecr 714696,nop,nop,sack 1 {84252:87108},mptcp dss ack 2226522756], length 0
21:11:46.816097 IP 112.26.3.1.targus-getdata1 > 112.26.3.8.42363: Flags [.], ack 82824, win 6122, options [nop,nop,TS val 936536 ecr 714696,nop,nop,sack 1 {84252:87108},mptcp dss ack 2226522756], length 0
21:11:46.888867 IP 112.26.3.8.42363 > 112.26.3.1.targus-getdata1: Flags [.], seq 87108:88536, ack 1, win 913, options [nop,nop,TS val 715266 ecr 936063,mptcp dss ack 1803767578 seq 2226548460 subseq 659737 len 1428 csum 0xd5f0], length 1428
21:11:46.889177 IP 112.26.3.1.targus-getdata1 > 112.26.3.8.42363: Flags [.], ack 82824, win 6122, options [nop,nop,TS val 936643 ecr 714696,nop,nop,sack 1 {84252:88536},mptcp dss ack 2226524184], length 0
21:11:46.945674 IP 112.26.3.1.targus-getdata1 > 112.26.3.8.42363: Flags [.], ack 82824, win 6122, options [nop,nop,TS val 936643 ecr 714696,nop,nop,sack 1 {84252:88536},mptcp dss ack 2226524184], length 0
21:11:46.998697 IP 112.26.3.8.42363 > 112.26.3.1.targus-getdata1: Flags [.], seq 88536:89964, ack 1, win 913, options [nop,nop,TS val 715266 ecr 936063,mptcp dss ack 1803767578 seq 2226549888 subseq 661165 len 1428 csum 0x3fe9], length 1428
21:11:46.999065 IP 112.26.3.1.targus-getdata1 > 112.26.3.8.42363: Flags [.], ack 82824, win 6122, options [nop,nop,TS val 936753 ecr 714696,nop,nop,sack 1 {84252:89964},mptcp dss ack 2226528468], length 0
21:11:47.030683 IP 112.26.3.1.targus-getdata1 > 112.26.3.8.42363: Flags [.], ack 82824, win 6122, options [nop,nop,TS val 936753 ecr 714696,nop,nop,sack 1 {84252:89964},mptcp dss ack 2226528468], length 0
21:11:47.093319 IP 112.26.3.8.42363 > 112.26.3.1.targus-getdata1: Flags [.], seq 89964:91392, ack 1, win 913, options [nop,nop,TS val 715266 ecr 936063,mptcp dss ack 1803767578 seq 2226551316 subseq 662593 len 1428 csum 0x5c42], length 1428
21:11:47.093611 IP 112.26.3.1.targus-getdata1 > 112.26.3.8.42363: Flags [.], ack 82824, win 6122, options [nop,nop,TS val 936847 ecr 714696,nop,nop,sack 1 {84252:91392},mptcp dss ack 2226528468], length 0
21:11:47.121143 IP 112.26.3.1.targus-getdata1 > 112.26.3.8.42363: Flags [.], ack 82824, win 6122, options [nop,nop,TS val 936847 ecr 714696,nop,nop,sack 1 {84252:91392},mptcp dss ack 2226528468], length 0
21:11:47.181625 IP 112.26.3.8.42363 > 112.26.3.1.targus-getdata1: Flags [.], seq 91392:92820, ack 1, win 913, options [nop,nop,TS val 715266 ecr 936063,mptcp dss ack 1803767578 seq 2226552744 subseq 664021 len 1428 csum 0x35b3], length 1428
21:11:47.181961 IP 112.26.3.1.targus-getdata1 > 112.26.3.8.42363: Flags [.], ack 82824, win 6122, options [nop,nop,TS val 936935 ecr 714696,nop,nop,sack 1 {84252:92820},mptcp dss ack 2226528468], length 0
21:11:47.239235 IP 112.26.3.1.targus-getdata1 > 112.26.3.8.42363: Flags [.], ack 82824, win 6122, options [nop,nop,TS val 936935 ecr 714696,nop,nop,sack 1 {84252:92820},mptcp dss ack 2226528468], length 0
21:11:47.269114 IP 112.26.3.8.42363 > 112.26.3.1.targus-getdata1: Flags [.], seq 92820:94248, ack 1, win 913, options [nop,nop,TS val 715548 ecr 936309,mptcp dss ack 1803767578 seq 2226569880 subseq 665449 len 1428 csum 0xa1a6], length 1428
21:11:47.269425 IP 112.26.3.1.targus-getdata1 > 112.26.3.8.42363: Flags [.], ack 82824, win 6122, options [nop,nop,TS val 937023 ecr 714696,nop,nop,sack 1 {84252:94248},mptcp dss ack 2226528468], length 0
21:11:47.335832 IP 112.26.3.1.targus-getdata1 > 112.26.3.8.42363: Flags [.], ack 82824, win 6122, options [nop,nop,TS val 937023 ecr 714696,nop,nop,sack 1 {84252:94248},mptcp dss ack 2226528468], length 0
21:11:47.392994 IP 112.26.3.8.42363 > 112.26.3.1.targus-getdata1: Flags [.], seq 94248:95676, ack 1, win 913, options [nop,nop,TS val 715548 ecr 936309,mptcp dss ack 1803767578 seq 2226571308 subseq 666877 len 1428 csum 0x7f9a], length 1428
21:11:47.393325 IP 112.26.3.1.targus-getdata1 > 112.26.3.8.42363: Flags [.], ack 82824, win 6122, options [nop,nop,TS val 937147 ecr 714696,nop,nop,sack 1 {84252:95676},mptcp dss ack 2226528468], length 0
21:11:47.442081 IP 112.26.3.1.targus-getdata1 > 112.26.3.8.42363: Flags [.], ack 82824, win 6122, options [nop,nop,TS val 937147 ecr 714696,nop,nop,sack 1 {84252:95676},mptcp dss ack 2226528468], length 0
21:11:47.501089 IP 112.26.3.8.42363 > 112.26.3.1.targus-getdata1: Flags [.], seq 95676:97104, ack 1, win 913, options [nop,nop,TS val 715678 ecr 936449,mptcp dss ack 1803767578 seq 2226575592 subseq 668305 len 1428 csum 0xa052], length 1428
21:11:47.501456 IP 112.26.3.1.targus-getdata1 > 112.26.3.8.42363: Flags [.], ack 82824, win 6122, options [nop,nop,TS val 937255 ecr 714696,nop,nop,sack 1 {84252:97104},mptcp dss ack 2226528468], length 0
21:11:47.527117 IP 112.26.3.1.targus-getdata1 > 112.26.3.8.42363: Flags [.], ack 82824, win 6122, options [nop,nop,TS val 937255 ecr 714696,nop,nop,sack 1 {84252:97104},mptcp dss ack 2226528468], length 0
21:11:47.609617 IP 112.26.3.8.42363 > 112.26.3.1.targus-getdata1: Flags [.], seq 97104:98532, ack 1, win 913, options [nop,nop,TS val 715678 ecr 936449,mptcp dss ack 1803767578 seq 2226577020 subseq 669733 len 1428 csum 0xc41b], length 1428
21:11:47.609915 IP 112.26.3.1.targus-getdata1 > 112.26.3.8.42363: Flags [.], ack 82824, win 6122, options [nop,nop,TS val 937364 ecr 714696,nop,nop,sack 1 {84252:98532},mptcp dss ack 2226528468], length 0
21:11:47.639221 IP 112.26.3.1.targus-getdata1 > 112.26.3.8.42363: Flags [.], ack 82824, win 6122, options [nop,nop,TS val 937364 ecr 714696,nop,nop,sack 1 {84252:98532},mptcp dss ack 2226528468], length 0
21:11:47.713027 IP 112.26.3.8.42363 > 112.26.3.1.targus-getdata1: Flags [.], seq 98532:99960, ack 1, win 913, options [nop,nop,TS val 715679 ecr 936449,mptcp dss ack 1803767578 seq 2226578448 subseq 671161 len 1428 csum 0xce8], length 1428
21:11:47.713411 IP 112.26.3.1.targus-getdata1 > 112.26.3.8.42363: Flags [.], ack 82824, win 6122, options [nop,nop,TS val 937468 ecr 714696,nop,nop,sack 1 {84252:99960},mptcp dss ack 2226528468], length 0
21:11:47.716580 IP 112.26.3.1.targus-getdata1 > 112.26.3.8.42363: Flags [.], ack 82824, win 6122, options [nop,nop,TS val 937468 ecr 714696,nop,nop,sack 1 {84252:99960},mptcp dss ack 2226528468], length 0
21:11:47.800101 IP 112.26.3.8.42363 > 112.26.3.1.targus-getdata1: Flags [.], seq 99960:101388, ack 1, win 913, options [nop,nop,TS val 715765 ecr 936536,mptcp dss ack 1803767578 seq 2226579876 subseq 672589 len 1428 csum 0x9642], length 1428
21:11:47.800479 IP 112.26.3.1.targus-getdata1 > 112.26.3.8.42363: Flags [.], ack 82824, win 6122, options [nop,nop,TS val 937554 ecr 714696,nop,nop,sack 1 {84252:101388},mptcp dss ack 2226528468], length 0
21:11:47.808770 IP 112.26.3.1.targus-getdata1 > 112.26.3.8.42363: Flags [.], ack 82824, win 6122, options [nop,nop,TS val 937554 ecr 714696,nop,nop,sack 1 {84252:101388},mptcp dss ack 2226528468], length 0
21:11:47.915781 IP 112.26.3.8.42363 > 112.26.3.1.targus-getdata1: Flags [.], seq 82824:84252, ack 1, win 913, options [nop,nop,TS val 715906 ecr 936643,mptcp dss ack 1803767578 seq 2226528468 subseq 655453 len 1428 csum 0xd130], length 1428
21:11:47.916199 IP 112.26.3.1.targus-getdata1 > 112.26.3.8.42363: Flags [.], ack 101388, win 5982, options [nop,nop,TS val 937670 ecr 715906,mptcp dss ack 2226565596], length 0
21:11:47.918459 IP 112.26.3.1.targus-getdata1 > 112.26.3.8.42363: Flags [.], ack 101388, win 5982, options [nop,nop,TS val 937670 ecr 715906,mptcp dss ack 2226565596], length 0
21:11:47.989195 IP 112.26.3.8.42363 > 112.26.3.1.targus-getdata1: Flags [.], seq 101388:102816, ack 1, win 913, options [nop,nop,TS val 716058 ecr 936753,mptcp dss ack 1803767578 seq 2226598440 subseq 674017 len 1428 csum 0xc581], length 1428
21:11:47.989525 IP 112.26.3.1.targus-getdata1 > 112.26.3.8.42363: Flags [.], ack 102816, win 6122, options [nop,nop,TS val 937743 ecr 716058,mptcp dss ack 2226565596], length 0
21:11:48.022662 IP 112.26.3.1.targus-getdata1 > 112.26.3.8.42363: Flags [.], ack 102816, win 6122, options [nop,nop,TS val 937743 ecr 716058,mptcp dss ack 2226565596], length 0
