22:17:43.757365 IP 112.26.3.8.50707 > 112.26.3.1.targus-getdata1: Flags [S], seq 1412523115, win 65535, options [mss 1460,sackOK,TS val 2163827 ecr 0,nop,wscale 6,mptcp join id 5 token 0x7ffa4513 nonce 0xc19c4219], length 0
22:17:43.757669 IP 112.26.3.1.targus-getdata1 > 112.26.3.8.50707: Flags [S.], seq 176474239, ack 1412523116, win 65535, options [mss 1460,sackOK,TS val 2381687 ecr 2163827,nop,wscale 6,mptcp join id 6 hmac 0x85968ea5a81ce66f nonce 0x3ea51c09], length 0
22:17:43.874242 IP 112.26.3.1.targus-getdata1 > 112.26.3.8.50707: Flags [S.], seq 176474239, ack 1412523116, win 65535, options [mss 1460,sackOK,TS val 2381687 ecr 2163827,nop,wscale 6,mptcp join id 6 hmac 0x85968ea5a81ce66f nonce 0x3ea51c09], length 0
22:17:43.973968 IP 112.26.3.1.targus-getdata1 > 112.26.3.8.50707: Flags [S.], seq 176474239, ack 1412523116, win 65535, options [mss 1460,sackOK,TS val 2381687 ecr 2163827,nop,wscale 6,mptcp join id 6 hmac 0x85968ea5a81ce66f nonce 0x3ea51c09], length 0
22:17:44.055584 IP 112.26.3.8.50707 > 112.26.3.1.targus-getdata1: Flags [.], ack 1, win 4107, options [nop,nop,TS val 2164070 ecr 2381687,mptcp join hmac 0x722d6ff649c4cd0dee074f75891c5ae59479b384], length 0
22:17:44.055875 IP 112.26.3.1.targus-getdata1 > 112.26.3.8.50707: Flags [.], ack 1, win 4017, options [nop,nop,TS val 2381985 ecr 2164070,mptcp dss ack 643515087], length 0
22:17:44.058602 IP 112.26.3.1.targus-getdata1 > 112.26.3.8.50707: Flags [.], ack 1, win 4017, options [nop,nop,TS val 2381985 ecr 2164070,mptcp dss ack 643515087], length 0
22:18:17.521249 IP 112.26.3.8.49727 > 112.26.3.1.targus-getdata1: Flags [.], seq 1461622959:1461624387, ack 2228724048, win 4107, options [nop,nop,TS val 2196882 ecr 2414053,mptcp dss ack 1353584156 seq 4083459298 subseq 349861 len 1428 csum 0xd6d2], length 1428
22:18:17.521620 IP 112.26.3.1.targus-getdata1 > 112.26.3.8.49727: Flags [.], ack 1428, win 24071, options [nop,nop,TS val 2415450 ecr 2196882,mptcp dss ack 4083325066], length 0
22:18:17.583856 IP 112.26.3.8.49727 > 112.26.3.1.targus-getdata1: Flags [.], seq 1428:2856, ack 1, win 4107, options [nop,nop,TS val 2197040 ecr 2414166,mptcp dss ack 1353584156 seq 4083462154 subseq 351289 len 1428 csum 0x1ec7], length 1428
22:18:17.584235 IP 112.26.3.1.targus-getdata1 > 112.26.3.8.49727: Flags [.], ack 2856, win 24071, options [nop,nop,TS val 2415513 ecr 2197040,mptcp dss ack 4083325066], length 0
22:18:17.679257 IP 112.26.3.1.targus-getdata1 > 112.26.3.8.49727: Flags [.], ack 1428, win 24071, options [nop,nop,TS val 2415450 ecr 2196882,mptcp dss ack 4083325066], length 0
22:18:17.765924 IP 112.26.3.1.targus-getdata1 > 112.26.3.8.49727: Flags [.], ack 2856, win 24071, options [nop,nop,TS val 2415513 ecr 2197040,mptcp dss ack 4083325066], length 0
22:18:17.828326 IP 112.26.3.8.49727 > 112.26.3.1.targus-getdata1: Flags [.], seq 2856:4284, ack 1, win 4107, options [nop,nop,TS val 2197040 ecr 2414166,mptcp dss ack 1353584156 seq 4083463582 subseq 352717 len 1428 csum 0x3418], length 1428
22:18:17.828746 IP 112.26.3.1.targus-getdata1 > 112.26.3.8.49727: Flags [.], ack 4284, win 23744, options [nop,nop,TS val 2415757 ecr 2197040,mptcp dss ack 4083365050], length 0
22:18:17.932137 IP 112.26.3.8.49727 > 112.26.3.1.targus-getdata1: Flags [.], seq 4284:5712, ack 1, win 4107, options [nop,nop,TS val 2197156 ecr 2414284,mptcp dss ack 1353584156 seq 4083466438 subseq 354145 len 1428 csum 0x6ad6], length 1428
22:18:17.932442 IP 112.26.3.1.targus-getdata1 > 112.26.3.8.49727: Flags [.], ack 5712, win 23744, options [nop,nop,TS val 2415861 ecr 2197156,mptcp dss ack 4083365050], length 0
22:18:17.972600 IP 112.26.3.1.targus-getdata1 > 112.26.3.8.49727: Flags [.], ack 4284, win 23744, options [nop,nop,TS val 2415757 ecr 2197040,mptcp dss ack 4083365050], length 0
22:18:18.037687 IP 112.26.3.1.targus-getdata1 > 112.26.3.8.49727: Flags [.], ack 5712, win 23744, options [nop,nop,TS val 2415861 ecr 2197156,mptcp dss ack 4083365050], length 0
22:18:18.153885 IP 112.26.3.8.49727 > 112.26.3.1.targus-getdata1: Flags [.], seq 8568:9996, ack 1, win 4107, options [nop,nop,TS val 2197557 ecr 2414612,mptcp dss ack 1353584156 seq 4083485002 subseq 358429 len 1428 csum 0x118], length 1428
22:18:18.154264 IP 112.26.3.1.targus-getdata1 > 112.26.3.8.49727: Flags [.], ack 5712, win 23744, options [nop,nop,TS val 2416083 ecr 2197156,nop,nop,sack 1 {8568:9996},mptcp dss ack 4083365050], length 0
22:18:18.223364 IP 112.26.3.1.targus-getdata1 > 112.26.3.8.49727: Flags [.], ack 5712, win 23744, options [nop,nop,TS val 2416083 ecr 2197156,nop,nop,sack 1 {8568:9996},mptcp dss ack 4083365050], length 0
22:18:18.273760 IP 112.26.3.8.49727 > 112.26.3.1.targus-getdata1: Flags [.], seq 9996:11424, ack 1, win 4107, options [nop,nop,TS val 2197719 ecr 2414702,mptcp dss ack 1353584156 seq 4083489286 subseq 359857 len 1428 csum 0xf9fb], length 1428
22:18:18.274132 IP 112.26.3.1.targus-getdata1 > 112.26.3.8.49727: Flags [.], ack 5712, win 23739, options [nop,nop,TS val 2416203 ecr 2197156,nop,nop,sack 1 {8568:11424},mptcp dss ack 4083379330], length 0
22:18:18.354952 IP 112.26.3.1.targus-getdata1 > 112.26.3.8.49727: Flags [.], ack 5712, win 23739, options [nop,nop,TS val 2416203 ecr 2197156,nop,nop,sack 1 {8568:11424},mptcp dss ack 4083379330], length 0
22:18:18.464560 IP 112.26.3.8.49727 > 112.26.3.1.targus-getdata1: Flags [.], seq 11424:12852, ack 1, win 4107, options [nop,nop,TS val 2197896 ecr 2414843,mptcp dss ack 1353584156 seq 4083490714 subseq 361285 len 1428 csum 0x23e8], length 1428
22:18:18.464917 IP 112.26.3.1.targus-getdata1 > 112.26.3.8.49727: Flags [.], ack 5712, win 23876, options [nop,nop,TS val 2416393 ecr 2197156,nop,nop,sack 1 {8568:12852},mptcp dss ack 4083400750], length 0
22:18:18.547652 IP 112.26.3.8.49727 > 112.26.3.1.targus-getdata1: Flags [.], seq 12852:14280, ack 1, win 4107, options [nop,nop,TS val 2197976 ecr 2414963,mptcp dss ack 1353584156 seq 4083497854 subseq 362713 len 1428 csum 0xadfe], length 1428
22:18:18.547997 IP 112.26.3.1.targus-getdata1 > 112.26.3.8.49727: Flags [.], ack 5712, win 23876, options [nop,nop,TS val 2416476 ecr 2197156,nop,nop,sack 1 {8568:14280},mptcp dss ack 4083400750], length 0
22:18:18.581412 IP 112.26.3.8.49727 > 112.26.3.1.targus-getdata1: Flags [.], seq 21420:22848, ack 1, win 4107, options [nop,nop,TS val 2198659 ecr 2415757,mptcp dss ack 1353584156 seq 4083540694 subseq 371281 len 1428 csum 0x5af6], length 1428
22:18:18.581737 IP 112.26.3.1.targus-getdata1 > 112.26.3.8.49727: Flags [.], ack 5712, win 23876, options [nop,nop,TS val 2416511 ecr 2197156,nop,nop,sack 2 {21420:22848}{8568:14280},mptcp dss ack 4083400750], length 0
22:18:18.683634 IP 112.26.3.1.targus-getdata1 > 112.26.3.8.49727: Flags [.], ack 5712, win 23876, options [nop,nop,TS val 2416393 ecr 2197156,nop,nop,sack 1 {8568:12852},mptcp dss ack 4083400750], length 0
22:18:18.781051 IP 112.26.3.1.targus-getdata1 > 112.26.3.8.49727: Flags [.], ack 5712, win 23876, options [nop,nop,TS val 2416476 ecr 2197156,nop,nop,sack 1 {8568:14280},mptcp dss ack 4083400750], length 0
22:18:18.836484 IP 112.26.3.1.targus-getdata1 > 112.26.3.8.49727: Flags [.], ack 5712, win 23876, options [nop,nop,TS val 2416511 ecr 2197156,nop,nop,sack 2 {21420:22848}{8568:14280},mptcp dss ack 4083400750], length 0
22:18:18.901501 IP 112.26.3.8.49727 > 112.26.3.1.targus-getdata1: Flags [.], seq 22848:24276, ack 1, win 4107, options [nop,nop,TS val 2198984 ecr 2416083,mptcp dss ack 1353584156 seq 4083549262 subseq 372709 len 1428 csum 0x8bfa], length 1428
22:18:18.901859 IP 112.26.3.1.targus-getdata1 > 112.26.3.8.49727: Flags [.], ack 5712, win 24478, options [nop,nop,TS val 2416831 ecr 2197156,nop,nop,sack 2 {21420:24276}{8568:14280},mptcp dss ack 4083472150], length 0
22:18:18.937209 IP 112.26.3.8.49727 > 112.26.3.1.targus-getdata1: Flags [.], seq 14280:15708, ack 1, win 4107, options [nop,nop,TS val 2197976 ecr 2414963,mptcp dss ack 1353584156 seq 4083499282 subseq 364141 len 1428 csum 0x835f], length 1428
22:18:18.937591 IP 112.26.3.1.targus-getdata1 > 112.26.3.8.49727: Flags [.], ack 5712, win 24478, options [nop,nop,TS val 2416867 ecr 2197156,nop,nop,sack 2 {8568:15708}{21420:24276},mptcp dss ack 4083472150], length 0
22:18:19.028398 IP 112.26.3.8.49727 > 112.26.3.1.targus-getdata1: Flags [.], seq 24276:25704, ack 1, win 4107, options [nop,nop,TS val 2198984 ecr 2416083,mptcp dss ack 1353584156 seq 4083550690 subseq 374137 len 1428 csum 0x27aa], length 1428
22:18:19.028812 IP 112.26.3.1.targus-getdata1 > 112.26.3.8.49727: Flags [.], ack 5712, win 24478, options [nop,nop,TS val 2416958 ecr 2197156,nop,nop,sack 2 {21420:25704}{8568:15708},mptcp dss ack 4083472150], length 0
22:18:19.084486 IP 112.26.3.8.49727 > 112.26.3.1.targus-getdata1: Flags [.], seq 17136:18564, ack 1, win 4107, options [nop,nop,TS val 2198191 ecr 2415293,mptcp dss ack 1353584156 seq 4083506422 subseq 366997 len 1428 csum 0x9c1], length 1428
22:18:19.084855 IP 112.26.3.1.targus-getdata1 > 112.26.3.8.49727: Flags [.], ack 5712, win 24478, options [nop,nop,TS val 2417014 ecr 2197156,nop,nop,sack 2 {17136:18564}{21420:25704},mptcp dss ack 4083472150], length 0
22:18:19.182636 IP 112.26.3.8.49727 > 112.26.3.1.targus-getdata1: Flags [.], seq 25704:27132, ack 1, win 4107, options [nop,nop,TS val 2198984 ecr 2416083,mptcp dss ack 1353584156 seq 4083552118 subseq 375565 len 1428 csum 0xc83d], length 1428
22:18:19.182810 IP 112.26.3.1.targus-getdata1 > 112.26.3.8.49727: Flags [.], ack 5712, win 24478, options [nop,nop,TS val 2417112 ecr 2197156,nop,nop,sack 2 {21420:27132}{17136:18564},mptcp dss ack 4083472150], length 0
22:18:19.261159 IP 112.26.3.1.targus-getdata1 > 112.26.3.8.49727: Flags [.], ack 5712, win 24478, options [nop,nop,TS val 2416831 ecr 2197156,nop,nop,sack 2 {21420:24276}{8568:14280},mptcp dss ack 4083472150], length 0
22:18:19.303613 IP 112.26.3.8.49727 > 112.26.3.1.targus-getdata1: Flags [.], seq 27132:28560, ack 1, win 4107, options [nop,nop,TS val 2199336 ecr 2416393,mptcp dss ack 1353584156 seq 4083566398 subseq 376993 len 1428 csum 0xa13b], length 1428
22:18:19.304120 IP 112.26.3.1.targus-getdata1 > 112.26.3.8.49727: Flags [.], ack 5712, win 24478, options [nop,nop,TS val 2417233 ecr 2197156,nop,nop,sack 2 {21420:28560}{17136:18564},mptcp dss ack 4083472150], length 0
22:18:19.445670 IP 112.26.3.1.targus-getdata1 > 112.26.3.8.49727: Flags [.], ack 5712, win 24478, options [nop,nop,TS val 2416867 ecr 2197156,nop,nop,sack 2 {8568:15708}{21420:24276},mptcp dss ack 4083472150], length 0
22:18:19.464639 IP 112.26.3.8.49727 > 112.26.3.1.targus-getdata1: Flags [.], seq 28560:29988, ack 1, win 4107, options [nop,nop,TS val 2199336 ecr 2416393,mptcp dss ack 1353584156 seq 4083567826 subseq 378421 len 1428 csum 0x3222], length 1428
22:18:19.464981 IP 112.26.3.1.targus-getdata1 > 112.26.3.8.49727: Flags [.], ack 5712, win 24478, options [nop,nop,TS val 2417394 ecr 2197156,nop,nop,sack 2 {21420:29988}{17136:18564},mptcp dss ack 4083472150], length 0
22:18:19.564543 IP 112.26.3.8.49727 > 112.26.3.1.targus-getdata1: Flags [.], seq 18564:19992, ack 1, win 4107, options [nop,nop,TS val 2198340 ecr 2415450,mptcp dss ack 1353584156 seq 4083510706 subseq 368425 len 1428 csum 0x8ef0], length 1428
22:18:19.564848 IP 112.26.3.1.targus-getdata1 > 112.26.3.8.49727: Flags [.], ack 5712, win 24478, options [nop,nop,TS val 2417493 ecr 2197156,nop,nop,sack 2 {17136:19992}{21420:29988},mptcp dss ack 4083472150], length 0
22:18:19.613561 IP 112.26.3.8.49727 > 112.26.3.1.targus-getdata1: Flags [.], seq 29988:31416, ack 1, win 4107, options [nop,nop,TS val 2199460 ecr 2416476,mptcp dss ack 1353584156 seq 4083569254 subseq 379849 len 1428 csum 0x76e1], length 1428
22:18:19.613929 IP 112.26.3.1.targus-getdata1 > 112.26.3.8.49727: Flags [.], ack 5712, win 24478, options [nop,nop,TS val 2417542 ecr 2197156,nop,nop,sack 2 {21420:31416}{17136:19992},mptcp dss ack 4083472150], length 0
22:18:19.637805 IP 112.26.3.1.targus-getdata1 > 112.26.3.8.49727: Flags [.], ack 5712, win 24478, options [nop,nop,TS val 2416958 ecr 2197156,nop,nop,sack 2 {21420:25704}{8568:15708},mptcp dss ack 4083472150], length 0
22:18:19.680046 IP 112.26.3.8.49727 > 112.26.3.1.targus-getdata1: Flags [.], seq 31416:32844, ack 1, win 4107, options [nop,nop,TS val 2199590 ecr 2416511,mptcp dss ack 1353584156 seq 4083574966 subseq 381277 len 1428 csum 0x2809], length 1428
22:18:19.680390 IP 112.26.3.1.targus-getdata1 > 112.26.3.8.49727: Flags [.], ack 5712, win 24478, options [nop,nop,TS val 2417609 ecr 2197156,nop,nop,sack 2 {21420:32844}{17136:19992},mptcp dss ack 4083472150], length 0
22:18:19.735512 IP 112.26.3.1.targus-getdata1 > 112.26.3.8.49727: Flags [.], ack 5712, win 24478, options [nop,nop,TS val 2417014 ecr 2197156,nop,nop,sack 2 {17136:18564}{21420:25704},mptcp dss ack 4083472150], length 0
22:18:19.775256 IP 112.26.3.1.targus-getdata1 > 112.26.3.8.49727: Flags [.], ack 5712, win 24478, options [nop,nop,TS val 2417112 ecr 2197156,nop,nop,sack 2 {21420:27132}{17136:18564},mptcp dss ack 4083472150], length 0
22:18:19.841667 IP 112.26.3.8.49727 > 112.26.3.1.targus-getdata1: Flags [.], seq 32844:34272, ack 1, win 4107, options [nop,nop,TS val 2199861 ecr 2416831,mptcp dss ack 1353584156 seq 4083580678 subseq 382705 len 1428 csum 0x15e6], length 1428
22:18:19.842020 IP 112.26.3.1.targus-getdata1 > 112.26.3.8.49727: Flags [.], ack 5712, win 24478, options [nop,nop,TS val 2417770 ecr 2197156,nop,nop,sack 2 {21420:34272}{17136:19992},mptcp dss ack 4083472150], length 0
22:18:19.917804 IP 112.26.3.1.targus-getdata1 > 112.26.3.8.49727: Flags [.], ack 5712, win 24478, options [nop,nop,TS val 2417233 ecr 2197156,nop,nop,sack 2 {21420:28560}{17136:18564},mptcp dss ack 4083472150], length 0
22:18:19.972936 IP 112.26.3.8.49727 > 112.26.3.1.targus-getdata1: Flags [.], seq 34272:35700, ack 1, win 4107, options [nop,nop,TS val 2199918 ecr 2416867,mptcp dss ack 1353584156 seq 4083583534 subseq 384133 len 1428 csum 0x70c6], length 1428
22:18:19.973210 IP 112.26.3.1.targus-getdata1 > 112.26.3.8.49727: Flags [.], ack 5712, win 24478, options [nop,nop,TS val 2417902 ecr 2197156,nop,nop,sack 2 {21420:35700}{17136:19992},mptcp dss ack 4083472150], length 0
22:18:20.004820 IP 112.26.3.1.targus-getdata1 > 112.26.3.8.49727: Flags [.], ack 5712, win 24478, options [nop,nop,TS val 2417394 ecr 2197156,nop,nop,sack 2 {21420:29988}{17136:18564},mptcp dss ack 4083472150], length 0
22:18:20.061303 IP 112.26.3.8.49727 > 112.26.3.1.targus-getdata1: Flags [.], seq 35700:37128, ack 1, win 4107, options [nop,nop,TS val 2200055 ecr 2416958,mptcp dss ack 1353584156 seq 4083587818 subseq 385561 len 1428 csum 0x30fe], length 1428
22:18:20.061670 IP 112.26.3.1.targus-getdata1 > 112.26.3.8.49727: Flags [.], ack 5712, win 24478, options [nop,nop,TS val 2417991 ecr 2197156,nop,nop,sack 2 {21420:37128}{17136:19992},mptcp dss ack 4083472150], length 0
22:18:20.139016 IP 112.26.3.1.targus-getdata1 > 112.26.3.8.49727: Flags [.], ack 5712, win 24478, options [nop,nop,TS val 2417493 ecr 2197156,nop,nop,sack 2 {17136:19992}{21420:29988},mptcp dss ack 4083472150], length 0
22:18:20.165662 IP 112.26.3.8.49727 > 112.26.3.1.targus-getdata1: Flags [.], seq 5712:7140, ack 1, win 4107, options [nop,nop,TS val 2200055 ecr 2417014,mptcp dss ack 1353584156 seq 4083472150 subseq 355573 len 1428 csum 0x2c5b], length 1428
22:18:20.166022 IP 112.26.3.1.targus-getdata1 > 112.26.3.8.49727: Flags [.], ack 7140, win 24456, options [nop,nop,TS val 2418095 ecr 2200055,nop,nop,sack 2 {21420:37128}{17136:19992},mptcp dss ack 4083473578], length 0
22:18:20.228562 IP 112.26.3.1.targus-getdata1 > 112.26.3.8.49727: Flags [.], ack 5712, win 24478, options [nop,nop,TS val 2417542 ecr 2197156,nop,nop,sack 2 {21420:31416}{17136:19992},mptcp dss ack 4083472150], length 0
22:18:20.283691 IP 112.26.3.8.49727 > 112.26.3.1.targus-getdata1: Flags [.], seq 7140:8568, ack 1, win 4107, options [nop,nop,TS val 2200205 ecr 2417112,mptcp dss ack 1353584156 seq 4083473578 subseq 357001 len 1428 csum 0x45df], length 1428
22:18:20.284125 IP 112.26.3.1.targus-getdata1 > 112.26.3.8.49727: Flags [.], ack 15708, win 24300, options [nop,nop,TS val 2418213 ecr 2200205,nop,nop,sack 2 {21420:37128}{17136:19992},mptcp dss ack 4083483574], length 0
22:18:20.343283 IP 112.26.3.1.targus-getdata1 > 112.26.3.8.49727: Flags [.], ack 5712, win 24478, options [nop,nop,TS val 2417609 ecr 2197156,nop,nop,sack 2 {21420:32844}{17136:19992},mptcp dss ack 4083472150], length 0
22:18:20.379916 IP 112.26.3.8.49727 > 112.26.3.1.targus-getdata1: Flags [.], seq 15708:17136, ack 1, win 4107, options [nop,nop,TS val 2200254 ecr 2417233,mptcp dss ack 1353584156 seq 4083504994 subseq 365569 len 1428 csum 0x6771], length 1428
22:18:20.380237 IP 112.26.3.1.targus-getdata1 > 112.26.3.8.49727: Flags [.], ack 19992, win 24339, options [nop,nop,TS val 2418309 ecr 2200254,nop,nop,sack 1 {21420:37128},mptcp dss ack 4083483574], length 0
22:18:20.442947 IP 112.26.3.1.targus-getdata1 > 112.26.3.8.49727: Flags [.], ack 5712, win 24478, options [nop,nop,TS val 2417770 ecr 2197156,nop,nop,sack 2 {21420:34272}{17136:19992},mptcp dss ack 4083472150], length 0
22:18:20.499180 IP 112.26.3.8.49727 > 112.26.3.1.targus-getdata1: Flags [.], seq 18564:19992, ack 1, win 4107, options [nop,nop,TS val 2200363 ecr 2417394,mptcp dss ack 1353584156 seq 4083510706 subseq 368425 len 1428 csum 0x8ef0], length 1428
22:18:20.499455 IP 112.26.3.1.targus-getdata1 > 112.26.3.8.49727: Flags [.], ack 19992, win 24339, options [nop,nop,TS val 2418428 ecr 2200363,nop,nop,sack 2 {18564:19992}{21420:37128},mptcp dss ack 4083483574], length 0
22:18:20.524370 IP 112.26.3.1.targus-getdata1 > 112.26.3.8.49727: Flags [.], ack 5712, win 24478, options [nop,nop,TS val 2417902 ecr 2197156,nop,nop,sack 2 {21420:35700}{17136:19992},mptcp dss ack 4083472150], length 0
22:18:20.605111 IP 112.26.3.1.targus-getdata1 > 112.26.3.8.49727: Flags [.], ack 5712, win 24478, options [nop,nop,TS val 2417991 ecr 2197156,nop,nop,sack 2 {21420:37128}{17136:19992},mptcp dss ack 4083472150], length 0
22:18:20.648639 IP 112.26.3.8.49727 > 112.26.3.1.targus-getdata1: Flags [.], seq 19992:21420, ack 1, win 4107, options [nop,nop,TS val 2200457 ecr 2417493,mptcp dss ack 1353584156 seq 4083516418 subseq 369853 len 1428 csum 0x165a], length 1428
22:18:20.649006 IP 112.26.3.1.targus-getdata1 > 112.26.3.8.49727: Flags [.], ack 37128, win 24339, options [nop,nop,TS val 2418577 ecr 2200457,mptcp dss ack 4083483574], length 0
22:18:20.701914 IP 112.26.3.1.targus-getdata1 > 112.26.3.8.49727: Flags [.], ack 7140, win 24456, options [nop,nop,TS val 2418095 ecr 2200055,nop,nop,sack 2 {21420:37128}{17136:19992},mptcp dss ack 4083473578], length 0
22:18:20.770732 IP 112.26.3.8.49727 > 112.26.3.1.targus-getdata1: Flags [.], seq 37128:38556, ack 1, win 4107, options [nop,nop,TS val 2200597 ecr 2417542,mptcp dss ack 1353584156 seq 4083594958 subseq 386989 len 1428 csum 0x40c7], length 1428
22:18:20.771096 IP 112.26.3.1.targus-getdata1 > 112.26.3.8.49727: Flags [.], ack 38556, win 24295, options [nop,nop,TS val 2418699 ecr 2200597,mptcp dss ack 4083486430], length 0
22:18:20.826956 IP 112.26.3.1.targus-getdata1 > 112.26.3.8.49727: Flags [.], ack 15708, win 24300, options [nop,nop,TS val 2418213 ecr 2200205,nop,nop,sack 2 {21420:37128}{17136:19992},mptcp dss ack 4083483574], length 0
22:18:20.890287 IP 112.26.3.8.49727 > 112.26.3.1.targus-getdata1: Flags [.], seq 38556:39984, ack 1, win 4107, options [nop,nop,TS val 2200687 ecr 2417609,mptcp dss ack 1353584156 seq 4083597814 subseq 388417 len 1428 csum 0x9d8d], length 1428
22:18:20.890588 IP 112.26.3.1.targus-getdata1 > 112.26.3.8.49727: Flags [.], ack 39984, win 24295, options [nop,nop,TS val 2418819 ecr 2200687,mptcp dss ack 4083486430], length 0
22:18:20.901617 IP 112.26.3.1.targus-getdata1 > 112.26.3.8.49727: Flags [.], ack 19992, win 24339, options [nop,nop,TS val 2418309 ecr 2200254,nop,nop,sack 1 {21420:37128},mptcp dss ack 4083483574], length 0
22:18:20.949396 IP 112.26.3.1.targus-getdata1 > 112.26.3.8.49727: Flags [.], ack 19992, win 24339, options [nop,nop,TS val 2418428 ecr 2200363,nop,nop,sack 2 {18564:19992}{21420:37128},mptcp dss ack 4083483574], length 0
22:18:21.030903 IP 112.26.3.1.targus-getdata1 > 112.26.3.8.49727: Flags [.], ack 37128, win 24339, options [nop,nop,TS val 2418577 ecr 2200457,mptcp dss ack 4083483574], length 0
22:18:21.033122 IP 112.26.3.8.49727 > 112.26.3.1.targus-getdata1: Flags [.], seq 39984:41412, ack 1, win 4107, options [nop,nop,TS val 2200780 ecr 2417770,mptcp dss ack 1353584156 seq 4083604954 subseq 389845 len 1428 csum 0xa9b6], length 1428
22:18:21.033472 IP 112.26.3.1.targus-getdata1 > 112.26.3.8.49727: Flags [.], ack 41412, win 24295, options [nop,nop,TS val 2418962 ecr 2200780,mptcp dss ack 4083486430], length 0
22:18:21.117588 IP 112.26.3.1.targus-getdata1 > 112.26.3.8.49727: Flags [.], ack 38556, win 24295, options [nop,nop,TS val 2418699 ecr 2200597,mptcp dss ack 4083486430], length 0
22:18:21.154902 IP 112.26.3.8.49727 > 112.26.3.1.targus-getdata1: Flags [.], seq 41412:42840, ack 1, win 4107, options [nop,nop,TS val 2200925 ecr 2417902,mptcp dss ack 1353584156 seq 4083610666 subseq 391273 len 1428 csum 0x1e04], length 1428
22:18:21.155283 IP 112.26.3.1.targus-getdata1 > 112.26.3.8.49727: Flags [.], ack 42840, win 24295, options [nop,nop,TS val 2419084 ecr 2200925,mptcp dss ack 4083486430], length 0
22:18:21.224174 IP 112.26.3.1.targus-getdata1 > 112.26.3.8.49727: Flags [.], ack 39984, win 24295, options [nop,nop,TS val 2418819 ecr 2200687,mptcp dss ack 4083486430], length 0
22:18:21.311953 IP 112.26.3.8.49727 > 112.26.3.1.targus-getdata1: Flags [.], seq 42840:44268, ack 1, win 4107, options [nop,nop,TS val 2201061 ecr 2417991,mptcp dss ack 1353584156 seq 4083613522 subseq 392701 len 1428 csum 0xad1a], length 1428
22:18:21.312279 IP 112.26.3.1.targus-getdata1 > 112.26.3.8.49727: Flags [.], ack 44268, win 24295, options [nop,nop,TS val 2419241 ecr 2201061,mptcp dss ack 4083486430], length 0
22:18:21.355349 IP 112.26.3.1.targus-getdata1 > 112.26.3.8.49727: Flags [.], ack 41412, win 24295, options [nop,nop,TS val 2418962 ecr 2200780,mptcp dss ack 4083486430], length 0
22:18:21.419484 IP 112.26.3.8.49727 > 112.26.3.1.targus-getdata1: Flags [.], seq 44268:45696, ack 1, win 4107, options [nop,nop,TS val 2201158 ecr 2418095,mptcp dss ack 1353584156 seq 4083620662 subseq 394129 len 1428 csum 0xbab8], length 1428
22:18:21.419802 IP 112.26.3.1.targus-getdata1 > 112.26.3.8.49727: Flags [.], ack 45696, win 24295, options [nop,nop,TS val 2419349 ecr 2201158,mptcp dss ack 4083486430], length 0
22:18:21.473668 IP 112.26.3.1.targus-getdata1 > 112.26.3.8.49727: Flags [.], ack 42840, win 24295, options [nop,nop,TS val 2419084 ecr 2200925,mptcp dss ack 4083486430], length 0
22:18:21.510481 IP 112.26.3.8.49727 > 112.26.3.1.targus-getdata1: Flags [.], seq 45696:47124, ack 1, win 4107, options [nop,nop,TS val 2201288 ecr 2418213,mptcp dss ack 1353584156 seq 4083626374 subseq 395557 len 1428 csum 0x487f], length 1428
22:18:21.510771 IP 112.26.3.1.targus-getdata1 > 112.26.3.8.49727: Flags [.], ack 47124, win 23894, options [nop,nop,TS val 2419440 ecr 2201288,mptcp dss ack 4083512134], length 0
22:18:21.542827 IP 112.26.3.1.targus-getdata1 > 112.26.3.8.49727: Flags [.], ack 44268, win 24295, options [nop,nop,TS val 2419241 ecr 2201061,mptcp dss ack 4083486430], length 0
22:18:21.642754 IP 112.26.3.8.49727 > 112.26.3.1.targus-getdata1: Flags [.], seq 47124:48552, ack 1, win 4107, options [nop,nop,TS val 2201387 ecr 2418309,mptcp dss ack 1353584156 seq 4083630658 subseq 396985 len 1428 csum 0xce8c], length 1428
22:18:21.643096 IP 112.26.3.1.targus-getdata1 > 112.26.3.8.49727: Flags [.], ack 48552, win 24131, options [nop,nop,TS val 2419572 ecr 2201387,mptcp dss ack 4083559258], length 0
22:18:21.731511 IP 112.26.3.1.targus-getdata1 > 112.26.3.8.49727: Flags [.], ack 45696, win 24295, options [nop,nop,TS val 2419349 ecr 2201158,mptcp dss ack 4083486430], length 0
22:18:21.758655 IP 112.26.3.8.49727 > 112.26.3.1.targus-getdata1: Flags [.], seq 48552:49980, ack 1, win 4107, options [nop,nop,TS val 2201648 ecr 2418577,mptcp dss ack 1353584156 seq 4083636370 subseq 398413 len 1428 csum 0x6db9], length 1428
22:18:21.759037 IP 112.26.3.1.targus-getdata1 > 112.26.3.8.49727: Flags [.], ack 49980, win 24131, options [nop,nop,TS val 2419687 ecr 2201648,mptcp dss ack 4083559258], length 0
22:18:21.865905 IP 112.26.3.8.49727 > 112.26.3.1.targus-getdata1: Flags [.], seq 49980:51408, ack 1, win 4107, options [nop,nop,TS val 2201742 ecr 2418699,mptcp dss ack 1353584156 seq 4083643510 subseq 399841 len 1428 csum 0x8914], length 1428
22:18:21.866247 IP 112.26.3.1.targus-getdata1 > 112.26.3.8.49727: Flags [.], ack 51408, win 24131, options [nop,nop,TS val 2419795 ecr 2201742,mptcp dss ack 4083559258], length 0
22:18:21.879186 IP 112.26.3.1.targus-getdata1 > 112.26.3.8.49727: Flags [.], ack 47124, win 23894, options [nop,nop,TS val 2419440 ecr 2201288,mptcp dss ack 4083512134], length 0
22:18:21.976571 IP 112.26.3.1.targus-getdata1 > 112.26.3.8.49727: Flags [.], ack 48552, win 24131, options [nop,nop,TS val 2419572 ecr 2201387,mptcp dss ack 4083559258], length 0
22:18:22.007646 IP 112.26.3.8.49727 > 112.26.3.1.targus-getdata1: Flags [.], seq 51408:52836, ack 1, win 4107, options [nop,nop,TS val 2201843 ecr 2418819,mptcp dss ack 1353584156 seq 4083649222 subseq 401269 len 1428 csum 0xfb02], length 1428
22:18:22.007984 IP 112.26.3.1.targus-getdata1 > 112.26.3.8.49727: Flags [.], ack 52836, win 24131, options [nop,nop,TS val 2419937 ecr 2201843,mptcp dss ack 4083559258], length 0
22:18:22.053971 IP 112.26.3.1.targus-getdata1 > 112.26.3.8.49727: Flags [.], ack 49980, win 24131, options [nop,nop,TS val 2419687 ecr 2201648,mptcp dss ack 4083559258], length 0
22:18:22.099311 IP 112.26.3.1.targus-getdata1 > 112.26.3.8.49727: Flags [.], ack 51408, win 24131, options [nop,nop,TS val 2419795 ecr 2201742,mptcp dss ack 4083559258], length 0
22:18:22.125106 IP 112.26.3.8.49727 > 112.26.3.1.targus-getdata1: Flags [.], seq 52836:54264, ack 1, win 4107, options [nop,nop,TS val 2201990 ecr 2418962,mptcp dss ack 1353584156 seq 4083652078 subseq 402697 len 1428 csum 0x3055], length 1428
22:18:22.125422 IP 112.26.3.1.targus-getdata1 > 112.26.3.8.49727: Flags [.], ack 54264, win 24131, options [nop,nop,TS val 2420054 ecr 2201990,mptcp dss ack 4083559258], length 0
22:18:22.215889 IP 112.26.3.8.49727 > 112.26.3.1.targus-getdata1: Flags [.], seq 54264:55692, ack 1, win 4107, options [nop,nop,TS val 2201990 ecr 2418962,mptcp dss ack 1353584156 seq 4083653506 subseq 404125 len 1428 csum 0xa36c], length 1428
22:18:22.216149 IP 112.26.3.1.targus-getdata1 > 112.26.3.8.49727: Flags [.], ack 55692, win 24131, options [nop,nop,TS val 2420145 ecr 2201990,mptcp dss ack 4083559258], length 0
22:18:22.240046 IP 112.26.3.1.targus-getdata1 > 112.26.3.8.49727: Flags [.], ack 52836, win 24131, options [nop,nop,TS val 2419937 ecr 2201843,mptcp dss ack 4083559258], length 0
22:18:22.317553 IP 112.26.3.1.targus-getdata1 > 112.26.3.8.49727: Flags [.], ack 54264, win 24131, options [nop,nop,TS val 2420054 ecr 2201990,mptcp dss ack 4083559258], length 0
22:18:22.356373 IP 112.26.3.8.49727 > 112.26.3.1.targus-getdata1: Flags [.], seq 55692:57120, ack 1, win 4107, options [nop,nop,TS val 2202057 ecr 2419084,mptcp dss ack 1353584156 seq 4083657790 subseq 405553 len 1428 csum 0x70fc], length 1428
22:18:22.356743 IP 112.26.3.1.targus-getdata1 > 112.26.3.8.49727: Flags [.], ack 57120, win 24131, options [nop,nop,TS val 2420285 ecr 2202057,mptcp dss ack 4083559258], length 0
22:18:22.416004 IP 112.26.3.1.targus-getdata1 > 112.26.3.8.49727: Flags [.], ack 55692, win 24131, options [nop,nop,TS val 2420145 ecr 2201990,mptcp dss ack 4083559258], length 0
22:18:22.495328 IP 112.26.3.1.targus-getdata1 > 112.26.3.8.49727: Flags [.], ack 57120, win 24131, options [nop,nop,TS val 2420285 ecr 2202057,mptcp dss ack 4083559258], length 0
22:18:22.528634 IP 112.26.3.8.49727 > 112.26.3.1.targus-getdata1: Flags [.], seq 57120:58548, ack 1, win 4107, options [nop,nop,TS val 2202163 ecr 2419241,mptcp dss ack 1353584156 seq 4083662074 subseq 406981 len 1428 csum 0xe36d], length 1428
22:18:22.570065 IP 112.26.3.1.targus-getdata1 > 112.26.3.8.49727: Flags [.], ack 58548, win 24131, options [nop,nop,TS val 2420499 ecr 2202163,mptcp dss ack 4083559258], length 0
22:18:22.582966 IP 112.26.3.1.targus-getdata1 > 112.26.3.8.49727: Flags [.], ack 58548, win 24131, options [nop,nop,TS val 2420499 ecr 2202163,mptcp dss ack 4083559258], length 0
22:18:22.653969 IP 112.26.3.8.49727 > 112.26.3.1.targus-getdata1: Flags [.], seq 58548:59976, ack 1, win 4107, options [nop,nop,TS val 2202355 ecr 2419349,mptcp dss ack 1353584156 seq 4083666358 subseq 408409 len 1428 csum 0x7534], length 1428
22:18:22.735098 IP 112.26.3.1.targus-getdata1 > 112.26.3.8.49727: Flags [.], ack 59976, win 24131, options [nop,nop,TS val 2420664 ecr 2202355,mptcp dss ack 4083559258], length 0
22:18:22.741600 IP 112.26.3.1.targus-getdata1 > 112.26.3.8.49727: Flags [.], ack 59976, win 24131, options [nop,nop,TS val 2420664 ecr 2202355,mptcp dss ack 4083559258], length 0
22:18:22.804868 IP 112.26.3.8.49727 > 112.26.3.1.targus-getdata1: Flags [.], seq 59976:61404, ack 1, win 4107, options [nop,nop,TS val 2202437 ecr 2419440,mptcp dss ack 1353584156 seq 4083673498 subseq 409837 len 1428 csum 0x15d1], length 1428
22:18:22.922071 IP 112.26.3.8.49727 > 112.26.3.1.targus-getdata1: Flags [.], seq 61404:62832, ack 1, win 4107, options [nop,nop,TS val 2202544 ecr 2419572,mptcp dss ack 1353584156 seq 4083676354 subseq 411265 len 1428 csum 0x1a34], length 1428
22:18:23.006623 IP 112.26.3.1.targus-getdata1 > 112.26.3.8.49727: Flags [.], ack 62832, win 24131, options [nop,nop,TS val 2420936 ecr 2202437,mptcp dss ack 4083559258], length 0
22:18:23.010136 IP 112.26.3.1.targus-getdata1 > 112.26.3.8.49727: Flags [.], ack 62832, win 24131, options [nop,nop,TS val 2420936 ecr 2202437,mptcp dss ack 4083559258], length 0
22:18:23.053094 IP 112.26.3.8.49727 > 112.26.3.1.targus-getdata1: Flags [.], seq 62832:64260, ack 1, win 4107, options [nop,nop,TS val 2202682 ecr 2419687,mptcp dss ack 1353584156 seq 4083682066 subseq 412693 len 1428 csum 0x5175], length 1428
22:18:23.160759 IP 112.26.3.8.49727 > 112.26.3.1.targus-getdata1: Flags [.], seq 64260:65688, ack 1, win 4107, options [nop,nop,TS val 2202801 ecr 2419795,mptcp dss ack 1353584156 seq 4083686350 subseq 414121 len 1428 csum 0xfa33], length 1428
22:18:23.237864 IP 112.26.3.8.49727 > 112.26.3.1.targus-getdata1: Flags [.], seq 65688:67116, ack 1, win 4107, options [nop,nop,TS val 2202865 ecr 2419937,mptcp dss ack 1353584156 seq 4083690634 subseq 415549 len 1428 csum 0x7629], length 1428
22:18:23.238256 IP 112.26.3.1.targus-getdata1 > 112.26.3.8.49727: Flags [.], ack 67116, win 24131, options [nop,nop,TS val 2421167 ecr 2202682,mptcp dss ack 4083559258], length 0
22:18:23.241396 IP 112.26.3.1.targus-getdata1 > 112.26.3.8.49727: Flags [.], ack 67116, win 24131, options [nop,nop,TS val 2421167 ecr 2202682,mptcp dss ack 4083559258], length 0
22:18:23.351610 IP 112.26.3.8.49727 > 112.26.3.1.targus-getdata1: Flags [.], seq 67116:68544, ack 1, win 4107, options [nop,nop,TS val 2202947 ecr 2420054,mptcp dss ack 1353584156 seq 4083693490 subseq 416977 len 1428 csum 0xe8b2], length 1428
22:18:23.426386 IP 112.26.3.8.49727 > 112.26.3.1.targus-getdata1: Flags [.], seq 68544:69972, ack 1, win 4107, options [nop,nop,TS val 2203057 ecr 2420145,mptcp dss ack 1353584156 seq 4083697774 subseq 418405 len 1428 csum 0x428e], length 1428
22:18:23.525160 IP 112.26.3.8.49727 > 112.26.3.1.targus-getdata1: Flags [.], seq 69972:71400, ack 1, win 4107, options [nop,nop,TS val 2203057 ecr 2420145,mptcp dss ack 1353584156 seq 4083699202 subseq 419833 len 1428 csum 0x2578], length 1428
22:18:23.525544 IP 112.26.3.1.targus-getdata1 > 112.26.3.8.49727: Flags [.], ack 71400, win 24131, options [nop,nop,TS val 2421454 ecr 2202947,mptcp dss ack 4083559258], length 0
22:18:23.529472 IP 112.26.3.1.targus-getdata1 > 112.26.3.8.49727: Flags [.], ack 71400, win 24131, options [nop,nop,TS val 2421454 ecr 2202947,mptcp dss ack 4083559258], length 0
22:18:23.706962 IP 112.26.3.8.49727 > 112.26.3.1.targus-getdata1: Flags [.], seq 71400:72828, ack 1, win 4107, options [nop,nop,TS val 2203225 ecr 2420285,mptcp dss ack 1353584156 seq 4083704914 subseq 421261 len 1428 csum 0xb4e7], length 1428
22:18:23.807079 IP 112.26.3.8.49727 > 112.26.3.1.targus-getdata1: Flags [.], seq 72828:74256, ack 1, win 4107, options [nop,nop,TS val 2203319 ecr 2420499,mptcp dss ack 1353584156 seq 4083707770 subseq 422689 len 1428 csum 0xd5b1], length 1428
22:18:23.891232 IP 112.26.3.8.49727 > 112.26.3.1.targus-getdata1: Flags [.], seq 74256:75684, ack 1, win 4107, options [nop,nop,TS val 2203485 ecr 2420664,mptcp dss ack 1353584156 seq 4083712054 subseq 424117 len 1428 csum 0xe9fa], length 1428
22:18:23.891597 IP 112.26.3.1.targus-getdata1 > 112.26.3.8.49727: Flags [.], ack 75684, win 24131, options [nop,nop,TS val 2421821 ecr 2203225,mptcp dss ack 4083559258], length 0
22:18:23.900313 IP 112.26.3.1.targus-getdata1 > 112.26.3.8.49727: Flags [.], ack 75684, win 24131, options [nop,nop,TS val 2421821 ecr 2203225,mptcp dss ack 4083559258], length 0
22:18:24.031696 IP 112.26.3.8.49727 > 112.26.3.1.targus-getdata1: Flags [.], seq 75684:77112, ack 1, win 4107, options [nop,nop,TS val 2203597 ecr 2420936,mptcp dss ack 1353584156 seq 4083714910 subseq 425545 len 1428 csum 0x3565], length 1428
22:18:24.118009 IP 112.26.3.8.49727 > 112.26.3.1.targus-getdata1: Flags [.], seq 77112:78540, ack 1, win 4107, options [nop,nop,TS val 2203597 ecr 2420936,mptcp dss ack 1353584156 seq 4083716338 subseq 426973 len 1428 csum 0xc764], length 1428
22:18:24.118359 IP 112.26.3.1.targus-getdata1 > 112.26.3.8.49727: Flags [.], ack 78540, win 24293, options [nop,nop,TS val 2422047 ecr 2203597,mptcp dss ack 4083674926], length 0
22:18:24.122144 IP 112.26.3.1.targus-getdata1 > 112.26.3.8.49727: Flags [.], ack 78540, win 24293, options [nop,nop,TS val 2422047 ecr 2203597,mptcp dss ack 4083674926], length 0
22:18:24.210378 IP 112.26.3.8.49727 > 112.26.3.1.targus-getdata1: Flags [.], seq 78540:79968, ack 1, win 4107, options [nop,nop,TS val 2203719 ecr 2421167,mptcp dss ack 1353584156 seq 4083726334 subseq 428401 len 1428 csum 0x67b8], length 1428
22:18:24.324777 IP 112.26.3.8.49727 > 112.26.3.1.targus-getdata1: Flags [.], seq 79968:81396, ack 1, win 4107, options [nop,nop,TS val 2203719 ecr 2421167,mptcp dss ack 1353584156 seq 4083727762 subseq 429829 len 1428 csum 0x434a], length 1428
22:18:24.403701 IP 112.26.3.8.49727 > 112.26.3.1.targus-getdata1: Flags [.], seq 81396:82824, ack 1, win 4107, options [nop,nop,TS val 2203719 ecr 2421167,mptcp dss ack 1353584156 seq 4083729190 subseq 431257 len 1428 csum 0x832a], length 1428
22:18:24.404056 IP 112.26.3.1.targus-getdata1 > 112.26.3.8.49727: Flags [.], ack 82824, win 24293, options [nop,nop,TS val 2422333 ecr 2203719,mptcp dss ack 4083674926], length 0
22:18:24.413512 IP 112.26.3.1.targus-getdata1 > 112.26.3.8.49727: Flags [.], ack 82824, win 24293, options [nop,nop,TS val 2422333 ecr 2203719,mptcp dss ack 4083674926], length 0
22:18:24.503568 IP 112.26.3.8.49727 > 112.26.3.1.targus-getdata1: Flags [.], seq 82824:84252, ack 1, win 4107, options [nop,nop,TS val 2203795 ecr 2421454,mptcp dss ack 1353584156 seq 4083732046 subseq 432685 len 1428 csum 0xaa37], length 1428
22:18:24.606988 IP 112.26.3.8.49727 > 112.26.3.1.targus-getdata1: Flags [.], seq 84252:85680, ack 1, win 4107, options [nop,nop,TS val 2203795 ecr 2421454,mptcp dss ack 1353584156 seq 4083733474 subseq 434113 len 1428 csum 0xd990], length 1428
22:18:24.702839 IP 112.26.3.1.targus-getdata1 > 112.26.3.8.49727: Flags [.], ack 85680, win 24293, options [nop,nop,TS val 2422632 ecr 2203795,mptcp dss ack 4083674926], length 0
22:18:24.706116 IP 112.26.3.1.targus-getdata1 > 112.26.3.8.49727: Flags [.], ack 85680, win 24293, options [nop,nop,TS val 2422632 ecr 2203795,mptcp dss ack 4083674926], length 0
22:18:24.744925 IP 112.26.3.8.49727 > 112.26.3.1.targus-getdata1: Flags [.], seq 87108:88536, ack 1, win 4107, options [nop,nop,TS val 2203996 ecr 2421821,mptcp dss ack 1353584156 seq 4083744898 subseq 436969 len 1428 csum 0xa9d0], length 1428
22:18:24.745273 IP 112.26.3.1.targus-getdata1 > 112.26.3.8.49727: Flags [.], ack 85680, win 24293, options [nop,nop,TS val 2422674 ecr 2203795,nop,nop,sack 1 {87108:88536},mptcp dss ack 4083674926], length 0
22:18:24.792783 IP 112.26.3.1.targus-getdata1 > 112.26.3.8.49727: Flags [.], ack 85680, win 24293, options [nop,nop,TS val 2422674 ecr 2203795,nop,nop,sack 1 {87108:88536},mptcp dss ack 4083674926], length 0
22:18:24.868370 IP 112.26.3.8.49727 > 112.26.3.1.targus-getdata1: Flags [.], seq 88536:89964, ack 1, win 4107, options [nop,nop,TS val 2203996 ecr 2421821,mptcp dss ack 1353584156 seq 4083746326 subseq 438397 len 1428 csum 0x9080], length 1428
22:18:24.868713 IP 112.26.3.1.targus-getdata1 > 112.26.3.8.49727: Flags [.], ack 85680, win 24293, options [nop,nop,TS val 2422797 ecr 2203795,nop,nop,sack 1 {87108:89964},mptcp dss ack 4083674926], length 0
22:18:24.878877 IP 112.26.3.1.targus-getdata1 > 112.26.3.8.49727: Flags [.], ack 85680, win 24293, options [nop,nop,TS val 2422797 ecr 2203795,nop,nop,sack 1 {87108:89964},mptcp dss ack 4083674926], length 0
22:18:24.942298 IP 112.26.3.8.49727 > 112.26.3.1.targus-getdata1: Flags [.], seq 89964:91392, ack 1, win 4107, options [nop,nop,TS val 2203996 ecr 2421821,mptcp dss ack 1353584156 seq 4083747754 subseq 439825 len 1428 csum 0xfba9], length 1428
22:18:24.942671 IP 112.26.3.1.targus-getdata1 > 112.26.3.8.49727: Flags [.], ack 85680, win 24293, options [nop,nop,TS val 2422871 ecr 2203795,nop,nop,sack 1 {87108:91392},mptcp dss ack 4083674926], length 0
22:18:24.953355 IP 112.26.3.1.targus-getdata1 > 112.26.3.8.49727: Flags [.], ack 85680, win 24293, options [nop,nop,TS val 2422871 ecr 2203795,nop,nop,sack 1 {87108:91392},mptcp dss ack 4083674926], length 0
22:18:25.087121 IP 112.26.3.8.49727 > 112.26.3.1.targus-getdata1: Flags [.], seq 91392:92820, ack 1, win 4107, options [nop,nop,TS val 2204218 ecr 2422047,mptcp dss ack 1353584156 seq 4083754894 subseq 441253 len 1428 csum 0x54a5], length 1428
22:18:25.087479 IP 112.26.3.1.targus-getdata1 > 112.26.3.8.49727: Flags [.], ack 85680, win 24293, options [nop,nop,TS val 2423016 ecr 2203795,nop,nop,sack 1 {87108:92820},mptcp dss ack 4083674926], length 0
22:18:25.093934 IP 112.26.3.1.targus-getdata1 > 112.26.3.8.49727: Flags [.], ack 85680, win 24293, options [nop,nop,TS val 2423016 ecr 2203795,nop,nop,sack 1 {87108:92820},mptcp dss ack 4083674926], length 0
22:18:25.203541 IP 112.26.3.8.49727 > 112.26.3.1.targus-getdata1: Flags [.], seq 92820:94248, ack 1, win 4107, options [nop,nop,TS val 2204218 ecr 2422047,mptcp dss ack 1353584156 seq 4083756322 subseq 442681 len 1428 csum 0xd718], length 1428
22:18:25.203785 IP 112.26.3.1.targus-getdata1 > 112.26.3.8.49727: Flags [.], ack 85680, win 24293, options [nop,nop,TS val 2423133 ecr 2203795,nop,nop,sack 1 {87108:94248},mptcp dss ack 4083674926], length 0
22:18:25.209065 IP 112.26.3.1.targus-getdata1 > 112.26.3.8.49727: Flags [.], ack 85680, win 24293, options [nop,nop,TS val 2423133 ecr 2203795,nop,nop,sack 1 {87108:94248},mptcp dss ack 4083674926], length 0
22:18:25.314569 IP 112.26.3.8.49727 > 112.26.3.1.targus-getdata1: Flags [.], seq 94248:95676, ack 1, win 4107, options [nop,nop,TS val 2204513 ecr 2422333,mptcp dss ack 1353584156 seq 4083764890 subseq 444109 len 1428 csum 0x5176], length 1428
22:18:25.314921 IP 112.26.3.1.targus-getdata1 > 112.26.3.8.49727: Flags [.], ack 85680, win 24293, options [nop,nop,TS val 2423244 ecr 2203795,nop,nop,sack 1 {87108:95676},mptcp dss ack 4083674926], length 0
22:18:25.321364 IP 112.26.3.1.targus-getdata1 > 112.26.3.8.49727: Flags [.], ack 85680, win 24293, options [nop,nop,TS val 2423244 ecr 2203795,nop,nop,sack 1 {87108:95676},mptcp dss ack 4083674926], length 0
