20:04:50.132452 IP 112.26.3.8.56055 > 112.26.3.1.targus-getdata1: Flags [S], seq 2351048554, win 65535, options [mss 1460,sackOK,TS val 783539 ecr 0,nop,wscale 6,mptcp join id 6 token 0x198aa9c8 nonce 0x6ff231f8], length 0
20:04:50.132827 IP 112.26.3.1.targus-getdata1 > 112.26.3.8.56055: Flags [S.], seq 3910807082, ack 2351048555, win 65535, options [mss 1460,sackOK,TS val 1012981 ecr 783539,nop,wscale 6,mptcp join id 5 hmac 0x67a6ff0c6cb3fc63 nonce 0xfa86f1e8], length 0
20:04:50.265136 IP 112.26.3.1.targus-getdata1 > 112.26.3.8.56055: Flags [S.], seq 3910807082, ack 2351048555, win 65535, options [mss 1460,sackOK,TS val 1012981 ecr 783539,nop,wscale 6,mptcp join id 5 hmac 0x67a6ff0c6cb3fc63 nonce 0xfa86f1e8], length 0
20:04:50.334001 IP 112.26.3.8.56055 > 112.26.3.1.targus-getdata1: Flags [.], ack 1, win 4107, options [nop,nop,TS val 783684 ecr 1012981,mptcp join hmac 0xa15c91ce1d8535827f495d5ddbc34a9dc1c3e69b], length 0
20:04:50.334475 IP 112.26.3.1.targus-getdata1 > 112.26.3.8.56055: Flags [.], ack 1, win 2678, options [nop,nop,TS val 1013183 ecr 783684,mptcp dss ack 3165865863], length 0
20:04:50.450319 IP 112.26.3.1.targus-getdata1 > 112.26.3.8.56055: Flags [.], ack 1, win 2678, options [nop,nop,TS val 1013183 ecr 783684,mptcp dss ack 3165865863], length 0
20:04:50.871960 IP 112.26.3.8.44999 > 112.26.3.1.targus-getdata1: Flags [S], seq 2541851322, win 65535, options [mss 1460,sackOK,TS val 784279 ecr 0,nop,wscale 6,mptcp join id 6 token 0x9dc837c0 nonce 0x39f19c32], length 0
20:05:40.212256 IP 112.26.3.8.44999 > 112.26.3.1.targus-getdata1: Flags [.], seq 2542449655:2542451083, ack 2952662942, win 4107, options [nop,nop,TS val 833119 ecr 1062544,mptcp dss ack 2724680102 seq 1002738538 subseq 598333 len 1428 csum 0xa4b9], length 1428
20:05:40.318163 IP 112.26.3.8.44999 > 112.26.3.1.targus-getdata1: Flags [.], seq 1428:2856, ack 1, win 4107, options [nop,nop,TS val 833119 ecr 1062544,mptcp dss ack 2724680102 seq 1002739966 subseq 599761 len 1428 csum 0x4dbd], length 1428
20:05:40.367130 IP 112.26.3.1.targus-getdata1 > 112.26.3.8.44999: Flags [.], ack 2856, win 23892, options [nop,nop,TS val 1063216 ecr 833119,mptcp dss ack 1002604306], length 0
20:05:40.371963 IP 112.26.3.1.targus-getdata1 > 112.26.3.8.44999: Flags [.], ack 2856, win 23892, options [nop,nop,TS val 1063216 ecr 833119,mptcp dss ack 1002604306], length 0
20:05:40.477165 IP 112.26.3.8.44999 > 112.26.3.1.targus-getdata1: Flags [.], seq 2856:4284, ack 1, win 4107, options [nop,nop,TS val 833336 ecr 1062760,mptcp dss ack 2724680102 seq 1002745678 subseq 601189 len 1428 csum 0xe06e], length 1428
20:05:40.521792 IP 112.26.3.8.44999 > 112.26.3.1.targus-getdata1: Flags [.], seq 4284:5712, ack 1, win 4107, options [nop,nop,TS val 833336 ecr 1062760,mptcp dss ack 2724680102 seq 1002747106 subseq 602617 len 1428 csum 0xb38a], length 1428
20:05:40.591490 IP 112.26.3.8.44999 > 112.26.3.1.targus-getdata1: Flags [.], seq 5712:7140, ack 1, win 4107, options [nop,nop,TS val 833336 ecr 1062760,mptcp dss ack 2724680102 seq 1002748534 subseq 604045 len 1428 csum 0xa8fe], length 1428
20:05:40.591791 IP 112.26.3.1.targus-getdata1 > 112.26.3.8.44999: Flags [.], ack 7140, win 23636, options [nop,nop,TS val 1063440 ecr 833336,mptcp dss ack 1002625726], length 0
20:05:40.602213 IP 112.26.3.1.targus-getdata1 > 112.26.3.8.44999: Flags [.], ack 7140, win 23636, options [nop,nop,TS val 1063440 ecr 833336,mptcp dss ack 1002625726], length 0
20:05:40.690716 IP 112.26.3.8.44999 > 112.26.3.1.targus-getdata1: Flags [.], seq 7140:8568, ack 1, win 4107, options [nop,nop,TS val 833590 ecr 1063008,mptcp dss ack 2724680102 seq 1002757102 subseq 605473 len 1428 csum 0x54ad], length 1428
20:05:40.792353 IP 112.26.3.8.44999 > 112.26.3.1.targus-getdata1: Flags [.], seq 8568:9996, ack 1, win 4107, options [nop,nop,TS val 833590 ecr 1063008,mptcp dss ack 2724680102 seq 1002758530 subseq 606901 len 1428 csum 0x218d], length 1428
20:05:40.846596 IP 112.26.3.1.targus-getdata1 > 112.26.3.8.44999: Flags [.], ack 9996, win 23636, options [nop,nop,TS val 1063696 ecr 833590,mptcp dss ack 1002625726], length 0
20:05:40.871775 IP 112.26.3.8.44999 > 112.26.3.1.targus-getdata1: Flags [.], seq 9996:11424, ack 1, win 4107, options [nop,nop,TS val 833796 ecr 1063216,mptcp dss ack 2724680102 seq 1002767098 subseq 608329 len 1428 csum 0x53fd], length 1428
20:05:40.888378 IP 112.26.3.1.targus-getdata1 > 112.26.3.8.44999: Flags [.], ack 9996, win 23636, options [nop,nop,TS val 1063696 ecr 833590,mptcp dss ack 1002625726], length 0
20:05:40.987408 IP 112.26.3.8.44999 > 112.26.3.1.targus-getdata1: Flags [.], seq 11424:12852, ack 1, win 4107, options [nop,nop,TS val 833796 ecr 1063216,mptcp dss ack 2724680102 seq 1002768526 subseq 609757 len 1428 csum 0xd490], length 1428
20:05:40.987730 IP 112.26.3.1.targus-getdata1 > 112.26.3.8.44999: Flags [.], ack 12852, win 23636, options [nop,nop,TS val 1063837 ecr 833796,mptcp dss ack 1002625726], length 0
20:05:40.992976 IP 112.26.3.1.targus-getdata1 > 112.26.3.8.44999: Flags [.], ack 12852, win 23636, options [nop,nop,TS val 1063837 ecr 833796,mptcp dss ack 1002625726], length 0
20:05:41.076990 IP 112.26.3.8.44999 > 112.26.3.1.targus-getdata1: Flags [.], seq 12852:14280, ack 1, win 4107, options [nop,nop,TS val 833796 ecr 1063216,mptcp dss ack 2724680102 seq 1002769954 subseq 611185 len 1428 csum 0x2083], length 1428
20:05:41.168977 IP 112.26.3.8.44999 > 112.26.3.1.targus-getdata1: Flags [.], seq 14280:15708, ack 1, win 4107, options [nop,nop,TS val 833796 ecr 1063216,mptcp dss ack 2724680102 seq 1002771382 subseq 612613 len 1428 csum 0x1e8b], length 1428
20:05:41.169303 IP 112.26.3.1.targus-getdata1 > 112.26.3.8.44999: Flags [.], ack 15708, win 24424, options [nop,nop,TS val 1064018 ecr 833796,mptcp dss ack 1002751390], length 0
20:05:41.174049 IP 112.26.3.1.targus-getdata1 > 112.26.3.8.44999: Flags [.], ack 15708, win 24424, options [nop,nop,TS val 1064018 ecr 833796,mptcp dss ack 1002751390], length 0
20:05:41.286378 IP 112.26.3.8.44999 > 112.26.3.1.targus-getdata1: Flags [.], seq 15708:17136, ack 1, win 4107, options [nop,nop,TS val 834021 ecr 1063440,mptcp dss ack 2724680102 seq 1002777094 subseq 614041 len 1428 csum 0xfc43], length 1428
20:05:41.395311 IP 112.26.3.8.44999 > 112.26.3.1.targus-getdata1: Flags [.], seq 17136:18564, ack 1, win 4107, options [nop,nop,TS val 834021 ecr 1063440,mptcp dss ack 2724680102 seq 1002778522 subseq 615469 len 1428 csum 0xddcb], length 1428
20:05:41.422493 IP 112.26.3.1.targus-getdata1 > 112.26.3.8.44999: Flags [.], ack 18564, win 24409, options [nop,nop,TS val 1064271 ecr 834021,mptcp dss ack 1002764242], length 0
20:05:41.428463 IP 112.26.3.1.targus-getdata1 > 112.26.3.8.44999: Flags [.], ack 18564, win 24409, options [nop,nop,TS val 1064271 ecr 834021,mptcp dss ack 1002764242], length 0
20:05:41.518497 IP 112.26.3.8.44999 > 112.26.3.1.targus-getdata1: Flags [.], seq 18564:19992, ack 1, win 4107, options [nop,nop,TS val 834023 ecr 1063440,mptcp dss ack 2724680102 seq 1002779950 subseq 616897 len 1428 csum 0x5492], length 1428
20:05:41.622477 IP 112.26.3.8.44999 > 112.26.3.1.targus-getdata1: Flags [.], seq 19992:21420, ack 1, win 4107, options [nop,nop,TS val 834307 ecr 1063696,mptcp dss ack 2724680102 seq 1002787090 subseq 618325 len 1428 csum 0xf778], length 1428
20:05:41.622823 IP 112.26.3.1.targus-getdata1 > 112.26.3.8.44999: Flags [.], ack 21420, win 24489, options [nop,nop,TS val 1064472 ecr 834023,mptcp dss ack 1002775666], length 0
20:05:41.676724 IP 112.26.3.1.targus-getdata1 > 112.26.3.8.44999: Flags [.], ack 21420, win 24489, options [nop,nop,TS val 1064472 ecr 834023,mptcp dss ack 1002775666], length 0
20:05:41.721637 IP 112.26.3.8.44999 > 112.26.3.1.targus-getdata1: Flags [.], seq 21420:22848, ack 1, win 4107, options [nop,nop,TS val 834307 ecr 1063696,mptcp dss ack 2724680102 seq 1002788518 subseq 619753 len 1428 csum 0x471c], length 1428
20:05:41.824201 IP 112.26.3.8.44999 > 112.26.3.1.targus-getdata1: Flags [.], seq 22848:24276, ack 1, win 4107, options [nop,nop,TS val 834307 ecr 1063696,mptcp dss ack 2724680102 seq 1002789946 subseq 621181 len 1428 csum 0xe62a], length 1428
20:05:41.824651 IP 112.26.3.1.targus-getdata1 > 112.26.3.8.44999: Flags [.], ack 24276, win 24504, options [nop,nop,TS val 1064674 ecr 834307,mptcp dss ack 1002791374], length 0
20:05:41.830535 IP 112.26.3.1.targus-getdata1 > 112.26.3.8.44999: Flags [.], ack 24276, win 24504, options [nop,nop,TS val 1064674 ecr 834307,mptcp dss ack 1002791374], length 0
20:05:41.970218 IP 112.26.3.8.44999 > 112.26.3.1.targus-getdata1: Flags [.], seq 24276:25704, ack 1, win 4107, options [nop,nop,TS val 834307 ecr 1063696,mptcp dss ack 2724680102 seq 1002791374 subseq 622609 len 1428 csum 0xc3ee], length 1428
20:05:42.078913 IP 112.26.3.8.44999 > 112.26.3.1.targus-getdata1: Flags [.], seq 25704:27132, ack 1, win 4107, options [nop,nop,TS val 834413 ecr 1063837,mptcp dss ack 2724680102 seq 1002797086 subseq 624037 len 1428 csum 0x45b], length 1428
20:05:42.079485 IP 112.26.3.1.targus-getdata1 > 112.26.3.8.44999: Flags [.], ack 27132, win 24486, options [nop,nop,TS val 1064928 ecr 834307,mptcp dss ack 1002798514], length 0
20:05:42.086089 IP 112.26.3.1.targus-getdata1 > 112.26.3.8.44999: Flags [.], ack 27132, win 24486, options [nop,nop,TS val 1064928 ecr 834307,mptcp dss ack 1002798514], length 0
20:05:42.199448 IP 112.26.3.8.44999 > 112.26.3.1.targus-getdata1: Flags [.], seq 27132:28560, ack 1, win 4107, options [nop,nop,TS val 834413 ecr 1063837,mptcp dss ack 2724680102 seq 1002798514 subseq 625465 len 1428 csum 0x794f], length 1428
20:05:42.282375 IP 112.26.3.8.44999 > 112.26.3.1.targus-getdata1: Flags [.], seq 28560:29988, ack 1, win 4107, options [nop,nop,TS val 834413 ecr 1063837,mptcp dss ack 2724680102 seq 1002799942 subseq 626893 len 1428 csum 0xf8bb], length 1428
20:05:42.282781 IP 112.26.3.1.targus-getdata1 > 112.26.3.8.44999: Flags [.], ack 29988, win 24453, options [nop,nop,TS val 1065132 ecr 834413,mptcp dss ack 1002805654], length 0
20:05:42.296985 IP 112.26.3.1.targus-getdata1 > 112.26.3.8.44999: Flags [.], ack 29988, win 24453, options [nop,nop,TS val 1065132 ecr 834413,mptcp dss ack 1002805654], length 0
20:05:42.399705 IP 112.26.3.8.44999 > 112.26.3.1.targus-getdata1: Flags [.], seq 29988:31416, ack 1, win 4107, options [nop,nop,TS val 834593 ecr 1064018,mptcp dss ack 2724680102 seq 1002805654 subseq 628321 len 1428 csum 0x998d], length 1428
20:05:42.516699 IP 112.26.3.8.44999 > 112.26.3.1.targus-getdata1: Flags [.], seq 32844:34272, ack 1, win 4107, options [nop,nop,TS val 834593 ecr 1064018,mptcp dss ack 2724680102 seq 1002808510 subseq 631177 len 1428 csum 0x9c1d], length 1428
20:05:42.517043 IP 112.26.3.1.targus-getdata1 > 112.26.3.8.44999: Flags [.], ack 31416, win 24431, options [nop,nop,TS val 1065366 ecr 834593,nop,nop,sack 1 {32844:34272},mptcp dss ack 1002807082], length 0
20:05:42.524629 IP 112.26.3.1.targus-getdata1 > 112.26.3.8.44999: Flags [.], ack 31416, win 24431, options [nop,nop,TS val 1065366 ecr 834593,nop,nop,sack 1 {32844:34272},mptcp dss ack 1002807082], length 0
20:05:42.618529 IP 112.26.3.8.44999 > 112.26.3.1.targus-getdata1: Flags [.], seq 34272:35700, ack 1, win 4107, options [nop,nop,TS val 834849 ecr 1064271,mptcp dss ack 2724680102 seq 1002817078 subseq 632605 len 1428 csum 0xce56], length 1428
20:05:42.618863 IP 112.26.3.1.targus-getdata1 > 112.26.3.8.44999: Flags [.], ack 31416, win 24431, options [nop,nop,TS val 1065467 ecr 834593,nop,nop,sack 1 {32844:35700},mptcp dss ack 1002807082], length 0
20:05:42.633319 IP 112.26.3.1.targus-getdata1 > 112.26.3.8.44999: Flags [.], ack 31416, win 24431, options [nop,nop,TS val 1065467 ecr 834593,nop,nop,sack 1 {32844:35700},mptcp dss ack 1002807082], length 0
20:05:42.742989 IP 112.26.3.8.44999 > 112.26.3.1.targus-getdata1: Flags [.], seq 35700:37128, ack 1, win 4107, options [nop,nop,TS val 834849 ecr 1064271,mptcp dss ack 2724680102 seq 1002818506 subseq 634033 len 1428 csum 0xfc64], length 1428
20:05:42.743344 IP 112.26.3.1.targus-getdata1 > 112.26.3.8.44999: Flags [.], ack 31416, win 24431, options [nop,nop,TS val 1065592 ecr 834593,nop,nop,sack 1 {32844:37128},mptcp dss ack 1002807082], length 0
20:05:42.769512 IP 112.26.3.1.targus-getdata1 > 112.26.3.8.44999: Flags [.], ack 31416, win 24431, options [nop,nop,TS val 1065592 ecr 834593,nop,nop,sack 1 {32844:37128},mptcp dss ack 1002807082], length 0
20:05:42.933707 IP 112.26.3.8.44999 > 112.26.3.1.targus-getdata1: Flags [.], seq 38556:39984, ack 1, win 4107, options [nop,nop,TS val 835113 ecr 1064472,mptcp dss ack 2724680102 seq 1002828502 subseq 636889 len 1428 csum 0x38a6], length 1428
20:05:42.933899 IP 112.26.3.1.targus-getdata1 > 112.26.3.8.44999: Flags [.], ack 31416, win 24431, options [nop,nop,TS val 1065782 ecr 834593,nop,nop,sack 2 {38556:39984}{32844:37128},mptcp dss ack 1002807082], length 0
20:05:42.938867 IP 112.26.3.1.targus-getdata1 > 112.26.3.8.44999: Flags [.], ack 31416, win 24431, options [nop,nop,TS val 1065782 ecr 834593,nop,nop,sack 2 {38556:39984}{32844:37128},mptcp dss ack 1002807082], length 0
20:05:43.035359 IP 112.26.3.8.44999 > 112.26.3.1.targus-getdata1: Flags [.], seq 39984:41412, ack 1, win 4107, options [nop,nop,TS val 835113 ecr 1064472,mptcp dss ack 2724680102 seq 1002829930 subseq 638317 len 1428 csum 0x6c57], length 1428
20:05:43.035701 IP 112.26.3.1.targus-getdata1 > 112.26.3.8.44999: Flags [.], ack 31416, win 24431, options [nop,nop,TS val 1065884 ecr 834593,nop,nop,sack 2 {38556:41412}{32844:37128},mptcp dss ack 1002807082], length 0
20:05:43.039668 IP 112.26.3.1.targus-getdata1 > 112.26.3.8.44999: Flags [.], ack 31416, win 24431, options [nop,nop,TS val 1065884 ecr 834593,nop,nop,sack 2 {38556:41412}{32844:37128},mptcp dss ack 1002807082], length 0
20:05:43.153750 IP 112.26.3.8.44999 > 112.26.3.1.targus-getdata1: Flags [.], seq 41412:42840, ack 1, win 4107, options [nop,nop,TS val 835378 ecr 1064674,mptcp dss ack 2724680102 seq 1002841354 subseq 639745 len 1428 csum 0xc611], length 1428
20:05:43.154109 IP 112.26.3.1.targus-getdata1 > 112.26.3.8.44999: Flags [.], ack 31416, win 24431, options [nop,nop,TS val 1066003 ecr 834593,nop,nop,sack 2 {38556:42840}{32844:37128},mptcp dss ack 1002807082], length 0
20:05:43.184060 IP 112.26.3.1.targus-getdata1 > 112.26.3.8.44999: Flags [.], ack 31416, win 24431, options [nop,nop,TS val 1066003 ecr 834593,nop,nop,sack 2 {38556:42840}{32844:37128},mptcp dss ack 1002807082], length 0
20:05:43.281519 IP 112.26.3.8.44999 > 112.26.3.1.targus-getdata1: Flags [.], seq 42840:44268, ack 1, win 4107, options [nop,nop,TS val 835378 ecr 1064674,mptcp dss ack 2724680102 seq 1002842782 subseq 641173 len 1428 csum 0xa2e7], length 1428
20:05:43.281867 IP 112.26.3.1.targus-getdata1 > 112.26.3.8.44999: Flags [.], ack 31416, win 24431, options [nop,nop,TS val 1066130 ecr 834593,nop,nop,sack 2 {38556:44268}{32844:37128},mptcp dss ack 1002807082], length 0
20:05:43.290929 IP 112.26.3.1.targus-getdata1 > 112.26.3.8.44999: Flags [.], ack 31416, win 24431, options [nop,nop,TS val 1066130 ecr 834593,nop,nop,sack 2 {38556:44268}{32844:37128},mptcp dss ack 1002807082], length 0
20:05:43.362604 IP 112.26.3.8.44999 > 112.26.3.1.targus-getdata1: Flags [.], seq 44268:45696, ack 1, win 4107, options [nop,nop,TS val 835378 ecr 1064674,mptcp dss ack 2724680102 seq 1002844210 subseq 642601 len 1428 csum 0xbe39], length 1428
20:05:43.362950 IP 112.26.3.1.targus-getdata1 > 112.26.3.8.44999: Flags [.], ack 31416, win 24431, options [nop,nop,TS val 1066211 ecr 834593,nop,nop,sack 2 {38556:45696}{32844:37128},mptcp dss ack 1002807082], length 0
20:05:43.392179 IP 112.26.3.1.targus-getdata1 > 112.26.3.8.44999: Flags [.], ack 31416, win 24431, options [nop,nop,TS val 1066211 ecr 834593,nop,nop,sack 2 {38556:45696}{32844:37128},mptcp dss ack 1002807082], length 0
20:05:43.469335 IP 112.26.3.8.44999 > 112.26.3.1.targus-getdata1: Flags [.], seq 47124:48552, ack 1, win 4107, options [nop,nop,TS val 835555 ecr 1064928,mptcp dss ack 2724680102 seq 1002852778 subseq 645457 len 1428 csum 0x7519], length 1428
20:05:43.469697 IP 112.26.3.1.targus-getdata1 > 112.26.3.8.44999: Flags [.], ack 31416, win 24431, options [nop,nop,TS val 1066319 ecr 834593,nop,nop,sack 2 {47124:48552}{38556:45696},mptcp dss ack 1002807082], length 0
20:05:43.502378 IP 112.26.3.1.targus-getdata1 > 112.26.3.8.44999: Flags [.], ack 31416, win 24431, options [nop,nop,TS val 1066319 ecr 834593,nop,nop,sack 2 {47124:48552}{38556:45696},mptcp dss ack 1002807082], length 0
20:05:43.602592 IP 112.26.3.8.44999 > 112.26.3.1.targus-getdata1: Flags [.], seq 48552:49980, ack 1, win 4107, options [nop,nop,TS val 835717 ecr 1065132,mptcp dss ack 2724680102 seq 1002859918 subseq 646885 len 1428 csum 0x37b5], length 1428
20:05:43.602888 IP 112.26.3.1.targus-getdata1 > 112.26.3.8.44999: Flags [.], ack 31416, win 24431, options [nop,nop,TS val 1066452 ecr 834593,nop,nop,sack 2 {47124:49980}{38556:45696},mptcp dss ack 1002807082], length 0
20:05:43.606499 IP 112.26.3.1.targus-getdata1 > 112.26.3.8.44999: Flags [.], ack 31416, win 24431, options [nop,nop,TS val 1066452 ecr 834593,nop,nop,sack 2 {47124:49980}{38556:45696},mptcp dss ack 1002807082], length 0
20:05:43.707248 IP 112.26.3.8.44999 > 112.26.3.1.targus-getdata1: Flags [.], seq 49980:51408, ack 1, win 4107, options [nop,nop,TS val 835717 ecr 1065132,mptcp dss ack 2724680102 seq 1002861346 subseq 648313 len 1428 csum 0x1ce4], length 1428
20:05:43.707584 IP 112.26.3.1.targus-getdata1 > 112.26.3.8.44999: Flags [.], ack 31416, win 24431, options [nop,nop,TS val 1066556 ecr 834593,nop,nop,sack 2 {47124:51408}{38556:45696},mptcp dss ack 1002807082], length 0
20:05:43.725596 IP 112.26.3.1.targus-getdata1 > 112.26.3.8.44999: Flags [.], ack 31416, win 24431, options [nop,nop,TS val 1066556 ecr 834593,nop,nop,sack 2 {47124:51408}{38556:45696},mptcp dss ack 1002807082], length 0
20:05:43.823549 IP 112.26.3.8.44999 > 112.26.3.1.targus-getdata1: Flags [.], seq 51408:52836, ack 1, win 4107, options [nop,nop,TS val 835717 ecr 1065132,mptcp dss ack 2724680102 seq 1002862774 subseq 649741 len 1428 csum 0x3610], length 1428
20:05:43.823890 IP 112.26.3.1.targus-getdata1 > 112.26.3.8.44999: Flags [.], ack 31416, win 24431, options [nop,nop,TS val 1066673 ecr 834593,nop,nop,sack 2 {47124:52836}{38556:45696},mptcp dss ack 1002807082], length 0
20:05:43.827920 IP 112.26.3.1.targus-getdata1 > 112.26.3.8.44999: Flags [.], ack 31416, win 24431, options [nop,nop,TS val 1066673 ecr 834593,nop,nop,sack 2 {47124:52836}{38556:45696},mptcp dss ack 1002807082], length 0
20:05:43.908710 IP 112.26.3.8.44999 > 112.26.3.1.targus-getdata1: Flags [.], seq 54264:55692, ack 1, win 4107, options [nop,nop,TS val 835961 ecr 1065366,mptcp dss ack 2724680102 seq 1002877054 subseq 652597 len 1428 csum 0x9283], length 1428
20:05:43.908923 IP 112.26.3.1.targus-getdata1 > 112.26.3.8.44999: Flags [.], ack 31416, win 24431, options [nop,nop,TS val 1066757 ecr 834593,nop,nop,sack 2 {54264:55692}{47124:52836},mptcp dss ack 1002807082], length 0
20:05:43.938508 IP 112.26.3.1.targus-getdata1 > 112.26.3.8.44999: Flags [.], ack 31416, win 24431, options [nop,nop,TS val 1066757 ecr 834593,nop,nop,sack 2 {54264:55692}{47124:52836},mptcp dss ack 1002807082], length 0
20:05:44.023994 IP 112.26.3.8.44999 > 112.26.3.1.targus-getdata1: Flags [.], seq 55692:57120, ack 1, win 4107, options [nop,nop,TS val 835961 ecr 1065366,mptcp dss ack 2724680102 seq 1002878482 subseq 654025 len 1428 csum 0x2959], length 1428
20:05:44.024247 IP 112.26.3.1.targus-getdata1 > 112.26.3.8.44999: Flags [.], ack 31416, win 24431, options [nop,nop,TS val 1066873 ecr 834593,nop,nop,sack 2 {54264:57120}{47124:52836},mptcp dss ack 1002807082], length 0
20:05:44.030421 IP 112.26.3.1.targus-getdata1 > 112.26.3.8.44999: Flags [.], ack 31416, win 24431, options [nop,nop,TS val 1066873 ecr 834593,nop,nop,sack 2 {54264:57120}{47124:52836},mptcp dss ack 1002807082], length 0
20:05:44.136688 IP 112.26.3.8.44999 > 112.26.3.1.targus-getdata1: Flags [.], seq 57120:58548, ack 1, win 4107, options [nop,nop,TS val 836181 ecr 1065467,mptcp dss ack 2724680102 seq 1002887050 subseq 655453 len 1428 csum 0x9c55], length 1428
20:05:44.137022 IP 112.26.3.1.targus-getdata1 > 112.26.3.8.44999: Flags [.], ack 31416, win 24431, options [nop,nop,TS val 1066985 ecr 834593,nop,nop,sack 2 {54264:58548}{47124:52836},mptcp dss ack 1002807082], length 0
20:05:44.145101 IP 112.26.3.1.targus-getdata1 > 112.26.3.8.44999: Flags [.], ack 31416, win 24431, options [nop,nop,TS val 1066985 ecr 834593,nop,nop,sack 2 {54264:58548}{47124:52836},mptcp dss ack 1002807082], length 0
20:05:44.283287 IP 112.26.3.8.44999 > 112.26.3.1.targus-getdata1: Flags [.], seq 37128:38556, ack 1, win 4107, options [nop,nop,TS val 836363 ecr 1065782,mptcp dss ack 2724680102 seq 1002827074 subseq 635461 len 1428 csum 0x66da], length 1428
20:05:44.283628 IP 112.26.3.1.targus-getdata1 > 112.26.3.8.44999: Flags [.], ack 31416, win 24431, options [nop,nop,TS val 1067132 ecr 834593,nop,nop,sack 2 {32844:45696}{54264:58548},mptcp dss ack 1002807082], length 0
20:05:44.292749 IP 112.26.3.1.targus-getdata1 > 112.26.3.8.44999: Flags [.], ack 31416, win 24431, options [nop,nop,TS val 1067132 ecr 834593,nop,nop,sack 2 {32844:45696}{54264:58548},mptcp dss ack 1002807082], length 0
20:05:44.371884 IP 112.26.3.8.44999 > 112.26.3.1.targus-getdata1: Flags [.], seq 58548:59976, ack 1, win 4107, options [nop,nop,TS val 836677 ecr 1066003,mptcp dss ack 2724680102 seq 1002907042 subseq 656881 len 1428 csum 0x48aa], length 1428
20:05:44.372248 IP 112.26.3.1.targus-getdata1 > 112.26.3.8.44999: Flags [.], ack 31416, win 24431, options [nop,nop,TS val 1067221 ecr 834593,nop,nop,sack 2 {54264:59976}{32844:45696},mptcp dss ack 1002807082], length 0
20:05:44.382091 IP 112.26.3.1.targus-getdata1 > 112.26.3.8.44999: Flags [.], ack 31416, win 24431, options [nop,nop,TS val 1067221 ecr 834593,nop,nop,sack 2 {54264:59976}{32844:45696},mptcp dss ack 1002807082], length 0
20:05:44.533793 IP 112.26.3.8.44999 > 112.26.3.1.targus-getdata1: Flags [.], seq 45696:47124, ack 1, win 4107, options [nop,nop,TS val 837064 ecr 1066319,mptcp dss ack 2724680102 seq 1002851350 subseq 644029 len 1428 csum 0x5a2d], length 1428
20:05:44.534119 IP 112.26.3.1.targus-getdata1 > 112.26.3.8.44999: Flags [.], ack 31416, win 24431, options [nop,nop,TS val 1067383 ecr 834593,nop,nop,sack 2 {32844:52836}{54264:59976},mptcp dss ack 1002807082], length 0
20:05:44.545026 IP 112.26.3.1.targus-getdata1 > 112.26.3.8.44999: Flags [.], ack 31416, win 24431, options [nop,nop,TS val 1067383 ecr 834593,nop,nop,sack 2 {32844:52836}{54264:59976},mptcp dss ack 1002807082], length 0
20:05:44.643279 IP 112.26.3.8.44999 > 112.26.3.1.targus-getdata1: Flags [.], seq 61404:62832, ack 1, win 4107, options [nop,nop,TS val 837382 ecr 1066452,mptcp dss ack 2724680102 seq 1002932746 subseq 659737 len 1428 csum 0xa215], length 1428
20:05:44.643627 IP 112.26.3.1.targus-getdata1 > 112.26.3.8.44999: Flags [.], ack 31416, win 24431, options [nop,nop,TS val 1067492 ecr 834593,nop,nop,sack 2 {61404:62832}{32844:52836},mptcp dss ack 1002807082], length 0
20:05:44.659720 IP 112.26.3.1.targus-getdata1 > 112.26.3.8.44999: Flags [.], ack 31416, win 24431, options [nop,nop,TS val 1067492 ecr 834593,nop,nop,sack 2 {61404:62832}{32844:52836},mptcp dss ack 1002807082], length 0
20:05:44.741675 IP 112.26.3.8.44999 > 112.26.3.1.targus-getdata1: Flags [.], seq 62832:64260, ack 1, win 4107, options [nop,nop,TS val 837536 ecr 1066673,mptcp dss ack 2724680102 seq 1002942742 subseq 661165 len 1428 csum 0xb417], length 1428
20:05:44.742038 IP 112.26.3.1.targus-getdata1 > 112.26.3.8.44999: Flags [.], ack 31416, win 24431, options [nop,nop,TS val 1067591 ecr 834593,nop,nop,sack 2 {61404:64260}{32844:52836},mptcp dss ack 1002807082], length 0
20:05:44.803135 IP 112.26.3.1.targus-getdata1 > 112.26.3.8.44999: Flags [.], ack 31416, win 24431, options [nop,nop,TS val 1067591 ecr 834593,nop,nop,sack 2 {61404:64260}{32844:52836},mptcp dss ack 1002807082], length 0
20:05:44.857579 IP 112.26.3.8.44999 > 112.26.3.1.targus-getdata1: Flags [.], seq 52836:54264, ack 1, win 4107, options [nop,nop,TS val 837582 ecr 1066757,mptcp dss ack 2724680102 seq 1002875626 subseq 651169 len 1428 csum 0x42bd], length 1428
20:05:44.857897 IP 112.26.3.1.targus-getdata1 > 112.26.3.8.44999: Flags [.], ack 31416, win 24431, options [nop,nop,TS val 1067707 ecr 834593,nop,nop,sack 2 {32844:59976}{61404:64260},mptcp dss ack 1002807082], length 0
20:05:44.889852 IP 112.26.3.1.targus-getdata1 > 112.26.3.8.44999: Flags [.], ack 31416, win 24431, options [nop,nop,TS val 1067707 ecr 834593,nop,nop,sack 2 {32844:59976}{61404:64260},mptcp dss ack 1002807082], length 0
20:05:44.974821 IP 112.26.3.8.44999 > 112.26.3.1.targus-getdata1: Flags [.], seq 64260:65688, ack 1, win 4107, options [nop,nop,TS val 837654 ecr 1066873,mptcp dss ack 2724680102 seq 1002949882 subseq 662593 len 1428 csum 0x8881], length 1428
20:05:44.975138 IP 112.26.3.1.targus-getdata1 > 112.26.3.8.44999: Flags [.], ack 31416, win 24431, options [nop,nop,TS val 1067824 ecr 834593,nop,nop,sack 2 {61404:65688}{32844:59976},mptcp dss ack 1002807082], length 0
20:05:45.017926 IP 112.26.3.1.targus-getdata1 > 112.26.3.8.44999: Flags [.], ack 31416, win 24431, options [nop,nop,TS val 1067824 ecr 834593,nop,nop,sack 2 {61404:65688}{32844:59976},mptcp dss ack 1002807082], length 0
20:05:45.094772 IP 112.26.3.8.44999 > 112.26.3.1.targus-getdata1: Flags [.], seq 65688:67116, ack 1, win 4107, options [nop,nop,TS val 837812 ecr 1066985,mptcp dss ack 2724680102 seq 1002954166 subseq 664021 len 1428 csum 0x588e], length 1428
20:05:45.095135 IP 112.26.3.1.targus-getdata1 > 112.26.3.8.44999: Flags [.], ack 31416, win 24431, options [nop,nop,TS val 1067944 ecr 834593,nop,nop,sack 2 {61404:67116}{32844:59976},mptcp dss ack 1002807082], length 0
20:05:45.137349 IP 112.26.3.1.targus-getdata1 > 112.26.3.8.44999: Flags [.], ack 31416, win 24431, options [nop,nop,TS val 1067944 ecr 834593,nop,nop,sack 2 {61404:67116}{32844:59976},mptcp dss ack 1002807082], length 0
20:05:45.164736 IP 112.26.3.8.44999 > 112.26.3.1.targus-getdata1: Flags [.], seq 31416:32844, ack 1, win 4107, options [nop,nop,TS val 837877 ecr 1067132,mptcp dss ack 2724680102 seq 1002807082 subseq 629749 len 1428 csum 0xe8ab], length 1428
20:05:45.165194 IP 112.26.3.1.targus-getdata1 > 112.26.3.8.44999: Flags [.], ack 59976, win 23807, options [nop,nop,TS val 1068014 ecr 837877,nop,nop,sack 1 {61404:67116},mptcp dss ack 1002847066], length 0
20:05:45.249672 IP 112.26.3.8.44999 > 112.26.3.1.targus-getdata1: Flags [.], seq 67116:68544, ack 1, win 4107, options [nop,nop,TS val 837945 ecr 1067221,mptcp dss ack 2724680102 seq 1002959878 subseq 665449 len 1428 csum 0x3042], length 1428
20:05:45.250022 IP 112.26.3.1.targus-getdata1 > 112.26.3.8.44999: Flags [.], ack 59976, win 23807, options [nop,nop,TS val 1068099 ecr 837877,nop,nop,sack 1 {61404:68544},mptcp dss ack 1002847066], length 0
20:05:45.291073 IP 112.26.3.1.targus-getdata1 > 112.26.3.8.44999: Flags [.], ack 59976, win 23807, options [nop,nop,TS val 1068014 ecr 837877,nop,nop,sack 1 {61404:67116},mptcp dss ack 1002847066], length 0
20:05:45.347052 IP 112.26.3.8.44999 > 112.26.3.1.targus-getdata1: Flags [.], seq 59976:61404, ack 1, win 4107, options [nop,nop,TS val 838082 ecr 1067383,mptcp dss ack 2724680102 seq 1002911326 subseq 658309 len 1428 csum 0x50e1], length 1428
20:05:45.347442 IP 112.26.3.1.targus-getdata1 > 112.26.3.8.44999: Flags [.], ack 68544, win 23807, options [nop,nop,TS val 1068196 ecr 838082,mptcp dss ack 1002847066], length 0
20:05:45.372500 IP 112.26.3.1.targus-getdata1 > 112.26.3.8.44999: Flags [.], ack 59976, win 23807, options [nop,nop,TS val 1068099 ecr 837877,nop,nop,sack 1 {61404:68544},mptcp dss ack 1002847066], length 0
20:05:45.435812 IP 112.26.3.8.44999 > 112.26.3.1.targus-getdata1: Flags [.], seq 68544:69972, ack 1, win 4107, options [nop,nop,TS val 838204 ecr 1067492,mptcp dss ack 2724680102 seq 1002969874 subseq 666877 len 1428 csum 0xf247], length 1428
20:05:45.436182 IP 112.26.3.1.targus-getdata1 > 112.26.3.8.44999: Flags [.], ack 69972, win 23807, options [nop,nop,TS val 1068284 ecr 838204,mptcp dss ack 1002847066], length 0
20:05:45.479934 IP 112.26.3.1.targus-getdata1 > 112.26.3.8.44999: Flags [.], ack 68544, win 23807, options [nop,nop,TS val 1068196 ecr 838082,mptcp dss ack 1002847066], length 0
20:05:45.519086 IP 112.26.3.8.44999 > 112.26.3.1.targus-getdata1: Flags [.], seq 69972:71400, ack 1, win 4107, options [nop,nop,TS val 838338 ecr 1067591,mptcp dss ack 2724680102 seq 1002978442 subseq 668305 len 1428 csum 0xe6f8], length 1428
20:05:45.519431 IP 112.26.3.1.targus-getdata1 > 112.26.3.8.44999: Flags [.], ack 71400, win 23807, options [nop,nop,TS val 1068368 ecr 838338,mptcp dss ack 1002847066], length 0
20:05:45.538852 IP 112.26.3.1.targus-getdata1 > 112.26.3.8.44999: Flags [.], ack 69972, win 23807, options [nop,nop,TS val 1068284 ecr 838204,mptcp dss ack 1002847066], length 0
20:05:45.635984 IP 112.26.3.8.44999 > 112.26.3.1.targus-getdata1: Flags [.], seq 71400:72828, ack 1, win 4107, options [nop,nop,TS val 838503 ecr 1067707,mptcp dss ack 2724680102 seq 1002982726 subseq 669733 len 1428 csum 0x86ed], length 1428
20:05:45.636355 IP 112.26.3.1.targus-getdata1 > 112.26.3.8.44999: Flags [.], ack 72828, win 23807, options [nop,nop,TS val 1068485 ecr 838503,mptcp dss ack 1002847066], length 0
20:05:45.693853 IP 112.26.3.1.targus-getdata1 > 112.26.3.8.44999: Flags [.], ack 71400, win 23807, options [nop,nop,TS val 1068368 ecr 838338,mptcp dss ack 1002847066], length 0
20:05:45.742520 IP 112.26.3.8.44999 > 112.26.3.1.targus-getdata1: Flags [.], seq 72828:74256, ack 1, win 4107, options [nop,nop,TS val 838703 ecr 1067824,mptcp dss ack 2724680102 seq 1002987010 subseq 671161 len 1428 csum 0x529e], length 1428
20:05:45.742765 IP 112.26.3.1.targus-getdata1 > 112.26.3.8.44999: Flags [.], ack 74256, win 23807, options [nop,nop,TS val 1068592 ecr 838703,mptcp dss ack 1002847066], length 0
20:05:45.814432 IP 112.26.3.1.targus-getdata1 > 112.26.3.8.44999: Flags [.], ack 72828, win 23807, options [nop,nop,TS val 1068485 ecr 838503,mptcp dss ack 1002847066], length 0
20:05:45.828364 IP 112.26.3.8.44999 > 112.26.3.1.targus-getdata1: Flags [.], seq 74256:75684, ack 1, win 4107, options [nop,nop,TS val 838711 ecr 1067944,mptcp dss ack 2724680102 seq 1002988438 subseq 672589 len 1428 csum 0xf82], length 1428
20:05:45.828738 IP 112.26.3.1.targus-getdata1 > 112.26.3.8.44999: Flags [.], ack 75684, win 23807, options [nop,nop,TS val 1068678 ecr 838711,mptcp dss ack 1002847066], length 0
20:05:45.889568 IP 112.26.3.1.targus-getdata1 > 112.26.3.8.44999: Flags [.], ack 74256, win 23807, options [nop,nop,TS val 1068592 ecr 838703,mptcp dss ack 1002847066], length 0
20:05:45.917635 IP 112.26.3.8.44999 > 112.26.3.1.targus-getdata1: Flags [.], seq 75684:77112, ack 1, win 4107, options [nop,nop,TS val 838836 ecr 1068014,mptcp dss ack 2724680102 seq 1002995578 subseq 674017 len 1428 csum 0x30a1], length 1428
20:05:45.918008 IP 112.26.3.1.targus-getdata1 > 112.26.3.8.44999: Flags [.], ack 77112, win 23807, options [nop,nop,TS val 1068767 ecr 838836,mptcp dss ack 1002847066], length 0
20:05:45.988596 IP 112.26.3.1.targus-getdata1 > 112.26.3.8.44999: Flags [.], ack 75684, win 23807, options [nop,nop,TS val 1068678 ecr 838711,mptcp dss ack 1002847066], length 0
20:05:45.997697 IP 112.26.3.8.44999 > 112.26.3.1.targus-getdata1: Flags [.], seq 77112:78540, ack 1, win 4107, options [nop,nop,TS val 839034 ecr 1068196,mptcp dss ack 2724680102 seq 1003002718 subseq 675445 len 1428 csum 0xdbf7], length 1428
20:05:45.997958 IP 112.26.3.1.targus-getdata1 > 112.26.3.8.44999: Flags [.], ack 78540, win 23807, options [nop,nop,TS val 1068847 ecr 839034,mptcp dss ack 1002847066], length 0
20:05:46.078127 IP 112.26.3.1.targus-getdata1 > 112.26.3.8.44999: Flags [.], ack 77112, win 23807, options [nop,nop,TS val 1068767 ecr 838836,mptcp dss ack 1002847066], length 0
20:05:46.128377 IP 112.26.3.8.44999 > 112.26.3.1.targus-getdata1: Flags [.], seq 78540:79968, ack 1, win 4107, options [nop,nop,TS val 839167 ecr 1068284,mptcp dss ack 2724680102 seq 1003005574 subseq 676873 len 1428 csum 0x44c7], length 1428
20:05:46.128606 IP 112.26.3.1.targus-getdata1 > 112.26.3.8.44999: Flags [.], ack 79968, win 23807, options [nop,nop,TS val 1068977 ecr 839167,mptcp dss ack 1002847066], length 0
20:05:46.156401 IP 112.26.3.1.targus-getdata1 > 112.26.3.8.44999: Flags [.], ack 78540, win 23807, options [nop,nop,TS val 1068847 ecr 839034,mptcp dss ack 1002847066], length 0
20:05:46.248895 IP 112.26.3.8.44999 > 112.26.3.1.targus-getdata1: Flags [.], seq 79968:81396, ack 1, win 4107, options [nop,nop,TS val 839293 ecr 1068368,mptcp dss ack 2724680102 seq 1003012714 subseq 678301 len 1428 csum 0x1c3b], length 1428
20:05:46.249254 IP 112.26.3.1.targus-getdata1 > 112.26.3.8.44999: Flags [.], ack 81396, win 23807, options [nop,nop,TS val 1069098 ecr 839293,mptcp dss ack 1002847066], length 0
20:05:46.293098 IP 112.26.3.1.targus-getdata1 > 112.26.3.8.44999: Flags [.], ack 79968, win 23807, options [nop,nop,TS val 1068977 ecr 839167,mptcp dss ack 1002847066], length 0
20:05:46.332228 IP 112.26.3.8.44999 > 112.26.3.1.targus-getdata1: Flags [.], seq 81396:82824, ack 1, win 4107, options [nop,nop,TS val 839467 ecr 1068485,mptcp dss ack 2724680102 seq 1003015570 subseq 679729 len 1428 csum 0xef21], length 1428
20:05:46.332537 IP 112.26.3.1.targus-getdata1 > 112.26.3.8.44999: Flags [.], ack 82824, win 23807, options [nop,nop,TS val 1069181 ecr 839467,mptcp dss ack 1002847066], length 0
20:05:46.390991 IP 112.26.3.1.targus-getdata1 > 112.26.3.8.44999: Flags [.], ack 81396, win 23807, options [nop,nop,TS val 1069098 ecr 839293,mptcp dss ack 1002847066], length 0
20:05:46.462499 IP 112.26.3.8.44999 > 112.26.3.1.targus-getdata1: Flags [.], seq 82824:84252, ack 1, win 4107, options [nop,nop,TS val 839612 ecr 1068592,mptcp dss ack 2724680102 seq 1003026994 subseq 681157 len 1428 csum 0x84cf], length 1428
20:05:46.462868 IP 112.26.3.1.targus-getdata1 > 112.26.3.8.44999: Flags [.], ack 84252, win 23807, options [nop,nop,TS val 1069312 ecr 839612,mptcp dss ack 1002847066], length 0
20:05:46.505643 IP 112.26.3.1.targus-getdata1 > 112.26.3.8.44999: Flags [.], ack 82824, win 23807, options [nop,nop,TS val 1069181 ecr 839467,mptcp dss ack 1002847066], length 0
20:05:46.567355 IP 112.26.3.8.44999 > 112.26.3.1.targus-getdata1: Flags [.], seq 84252:85680, ack 1, win 4107, options [nop,nop,TS val 839698 ecr 1068678,mptcp dss ack 2724680102 seq 1003031278 subseq 682585 len 1428 csum 0x3ef0], length 1428
20:05:46.567703 IP 112.26.3.1.targus-getdata1 > 112.26.3.8.44999: Flags [.], ack 85680, win 23807, options [nop,nop,TS val 1069417 ecr 839698,mptcp dss ack 1002847066], length 0
20:05:46.593211 IP 112.26.3.1.targus-getdata1 > 112.26.3.8.44999: Flags [.], ack 84252, win 23807, options [nop,nop,TS val 1069312 ecr 839612,mptcp dss ack 1002847066], length 0
20:05:46.655110 IP 112.26.3.1.targus-getdata1 > 112.26.3.8.44999: Flags [.], ack 85680, win 23807, options [nop,nop,TS val 1069417 ecr 839698,mptcp dss ack 1002847066], length 0
20:05:46.675135 IP 112.26.3.8.44999 > 112.26.3.1.targus-getdata1: Flags [.], seq 85680:87108, ack 1, win 4107, options [nop,nop,TS val 839841 ecr 1068767,mptcp dss ack 2724680102 seq 1003044130 subseq 684013 len 1428 csum 0xdc1b], length 1428
20:05:46.675469 IP 112.26.3.1.targus-getdata1 > 112.26.3.8.44999: Flags [.], ack 87108, win 23807, options [nop,nop,TS val 1069524 ecr 839841,mptcp dss ack 1002847066], length 0
20:05:46.750347 IP 112.26.3.1.targus-getdata1 > 112.26.3.8.44999: Flags [.], ack 87108, win 23807, options [nop,nop,TS val 1069524 ecr 839841,mptcp dss ack 1002847066], length 0
20:05:46.782411 IP 112.26.3.8.44999 > 112.26.3.1.targus-getdata1: Flags [.], seq 87108:88536, ack 1, win 4107, options [nop,nop,TS val 839955 ecr 1068847,mptcp dss ack 2724680102 seq 1003048414 subseq 685441 len 1428 csum 0x92fc], length 1428
20:05:46.782702 IP 112.26.3.1.targus-getdata1 > 112.26.3.8.44999: Flags [.], ack 88536, win 23807, options [nop,nop,TS val 1069632 ecr 839955,mptcp dss ack 1002847066], length 0
20:05:46.874576 IP 112.26.3.1.targus-getdata1 > 112.26.3.8.44999: Flags [.], ack 88536, win 23807, options [nop,nop,TS val 1069632 ecr 839955,mptcp dss ack 1002847066], length 0
20:05:46.898017 IP 112.26.3.8.44999 > 112.26.3.1.targus-getdata1: Flags [.], seq 88536:89964, ack 1, win 4107, options [nop,nop,TS val 839955 ecr 1068847,mptcp dss ack 2724680102 seq 1003049842 subseq 686869 len 1428 csum 0xfc46], length 1428
20:05:46.939315 IP 112.26.3.1.targus-getdata1 > 112.26.3.8.44999: Flags [.], ack 89964, win 24319, options [nop,nop,TS val 1069788 ecr 839955,mptcp dss ack 1002994150], length 0
20:05:46.999831 IP 112.26.3.8.44999 > 112.26.3.1.targus-getdata1: Flags [.], seq 89964:91392, ack 1, win 4107, options [nop,nop,TS val 840025 ecr 1068977,mptcp dss ack 2724680102 seq 1003052698 subseq 688297 len 1428 csum 0xdf7a], length 1428
20:05:47.030231 IP 112.26.3.1.targus-getdata1 > 112.26.3.8.44999: Flags [.], ack 89964, win 24319, options [nop,nop,TS val 1069788 ecr 839955,mptcp dss ack 1002994150], length 0
20:05:47.086673 IP 112.26.3.1.targus-getdata1 > 112.26.3.8.44999: Flags [.], ack 91392, win 24319, options [nop,nop,TS val 1069936 ecr 840025,mptcp dss ack 1002994150], length 0
20:05:47.093422 IP 112.26.3.1.targus-getdata1 > 112.26.3.8.44999: Flags [.], ack 91392, win 24319, options [nop,nop,TS val 1069936 ecr 840025,mptcp dss ack 1002994150], length 0
20:05:47.150045 IP 112.26.3.8.44999 > 112.26.3.1.targus-getdata1: Flags [.], seq 91392:92820, ack 1, win 4107, options [nop,nop,TS val 840163 ecr 1069098,mptcp dss ack 2724680102 seq 1003058410 subseq 689725 len 1428 csum 0x4437], length 1428
20:05:47.261404 IP 112.26.3.8.44999 > 112.26.3.1.targus-getdata1: Flags [.], seq 92820:94248, ack 1, win 4107, options [nop,nop,TS val 840255 ecr 1069181,mptcp dss ack 2724680102 seq 1003066978 subseq 691153 len 1428 csum 0x1493], length 1428
20:05:47.302921 IP 112.26.3.1.targus-getdata1 > 112.26.3.8.44999: Flags [.], ack 94248, win 24319, options [nop,nop,TS val 1070152 ecr 840163,mptcp dss ack 1002994150], length 0
20:05:47.311339 IP 112.26.3.1.targus-getdata1 > 112.26.3.8.44999: Flags [.], ack 94248, win 24319, options [nop,nop,TS val 1070152 ecr 840163,mptcp dss ack 1002994150], length 0
20:05:47.314347 IP 112.26.3.8.44999 > 112.26.3.1.targus-getdata1: Flags [.], seq 94248:95676, ack 1, win 4107, options [nop,nop,TS val 840361 ecr 1069312,mptcp dss ack 2724680102 seq 1003068406 subseq 692581 len 1428 csum 0x357], length 1428
20:05:47.402094 IP 112.26.3.8.44999 > 112.26.3.1.targus-getdata1: Flags [.], seq 95676:97104, ack 1, win 4107, options [nop,nop,TS val 840483 ecr 1069417,mptcp dss ack 2724680102 seq 1003072690 subseq 694009 len 1428 csum 0xb96c], length 1428
20:05:47.471062 IP 112.26.3.1.targus-getdata1 > 112.26.3.8.44999: Flags [.], ack 97104, win 24319, options [nop,nop,TS val 1070320 ecr 840361,mptcp dss ack 1002994150], length 0
20:05:47.476196 IP 112.26.3.1.targus-getdata1 > 112.26.3.8.44999: Flags [.], ack 97104, win 24319, options [nop,nop,TS val 1070320 ecr 840361,mptcp dss ack 1002994150], length 0
20:05:47.515440 IP 112.26.3.8.44999 > 112.26.3.1.targus-getdata1: Flags [.], seq 97104:98532, ack 1, win 4107, options [nop,nop,TS val 840579 ecr 1069524,mptcp dss ack 2724680102 seq 1003076974 subseq 695437 len 1428 csum 0xffb], length 1428
20:05:47.602043 IP 112.26.3.8.44999 > 112.26.3.1.targus-getdata1: Flags [.], seq 98532:99960, ack 1, win 4107, options [nop,nop,TS val 840770 ecr 1069632,mptcp dss ack 2724680102 seq 1003086970 subseq 696865 len 1428 csum 0x1c95], length 1428
20:05:47.671186 IP 112.26.3.1.targus-getdata1 > 112.26.3.8.44999: Flags [.], ack 99960, win 24319, options [nop,nop,TS val 1070520 ecr 840579,mptcp dss ack 1002994150], length 0
