08:46:52.416708 IP 112.26.1.8.46631 > 112.26.1.1.targus-getdata1: Flags [S], seq 3797441998, win 65535, options [mss 1460,sackOK,TS val 3818748 ecr 0,nop,wscale 6,mptcp join id 3 token 0x51351df7 nonce 0xf0de682d], length 0
08:46:52.417154 IP 112.26.1.1.targus-getdata1 > 112.26.1.8.46631: Flags [S.], seq 3800158828, ack 3797441999, win 28560, options [mss 1460,sackOK,TS val 4034767 ecr 3818748,nop,wscale 7,mptcp join id 3 hmac 0x551f53558abe4db5 nonce 0xb8b8fbd1], length 0
08:46:52.526151 IP 112.26.1.1.targus-getdata1 > 112.26.1.8.46631: Flags [S.], seq 3800158828, ack 3797441999, win 28560, options [mss 1460,sackOK,TS val 4034767 ecr 3818748,nop,wscale 7,mptcp join id 3 hmac 0x551f53558abe4db5 nonce 0xb8b8fbd1], length 0
08:46:52.605625 IP 112.26.1.8.46631 > 112.26.1.1.targus-getdata1: Flags [.], ack 1, win 4107, options [nop,nop,TS val 3818878 ecr 4034767,mptcp join hmac 0x0827a7d60f98fe76cea0eaebc2d038216a64bedc], length 0
08:46:52.606050 IP 112.26.1.1.targus-getdata1 > 112.26.1.8.46631: Flags [.], ack 1, win 670, options [nop,nop,TS val 4034956 ecr 3818878,mptcp dss ack 4209528936], length 0
08:46:52.611613 IP 112.26.1.1.targus-getdata1 > 112.26.1.8.46631: Flags [.], ack 1, win 670, options [nop,nop,TS val 4034956 ecr 3818878,mptcp dss ack 4209528936], length 0
08:46:53.226712 IP 112.26.1.8.33443 > 112.26.1.1.targus-getdata1: Flags [S], seq 3169892833, win 65535, options [mss 1460,sackOK,TS val 3819566 ecr 0,nop,wscale 6,mptcp join id 3 token 0x2d1da5fa nonce 0x37371b2d], length 0
08:47:30.327845 IP 112.26.1.8.33443 > 112.26.1.1.targus-getdata1: Flags [.], seq 3170291246:3170292674, ack 4039223039, win 4107, options [nop,nop,TS val 3855152 ecr 4070539,mptcp dss ack 2613390630 seq 2861094634 subseq 398413 len 1428 csum 0x1620], length 1428
08:47:30.328245 IP 112.26.1.1.targus-getdata1 > 112.26.1.8.33443: Flags [.], ack 4294940164, win 7104, options [nop,nop,TS val 4072678 ecr 3854909,nop,nop,sack 2 {4294963012:1428}{4294955872:4294961584},mptcp dss ack 2860986106], length 0
08:47:30.332096 IP 112.26.1.1.targus-getdata1 > 112.26.1.8.33443: Flags [.], ack 4294940164, win 7104, options [nop,nop,TS val 4072678 ecr 3854909,nop,nop,sack 2 {4294963012:1428}{4294955872:4294961584},mptcp dss ack 2860986106], length 0
08:47:30.442429 IP 112.26.1.8.33443 > 112.26.1.1.targus-getdata1: Flags [.], seq 4294940164:4294941592, ack 1, win 4107, options [nop,nop,TS val 3855312 ecr 4070809,mptcp dss ack 2613390630 seq 2860986106 subseq 371281 len 1428 csum 0x18e8], length 1428
08:47:30.442851 IP 112.26.1.1.targus-getdata1 > 112.26.1.8.33443: Flags [.], ack 4294941592, win 7093, options [nop,nop,TS val 4072792 ecr 3855312,nop,nop,sack 2 {4294963012:1428}{4294955872:4294961584},mptcp dss ack 2860987534], length 0
08:47:30.447289 IP 112.26.1.1.targus-getdata1 > 112.26.1.8.33443: Flags [.], ack 4294941592, win 7093, options [nop,nop,TS val 4072792 ecr 3855312,nop,nop,sack 2 {4294963012:1428}{4294955872:4294961584},mptcp dss ack 2860987534], length 0
08:47:30.578085 IP 112.26.1.8.33443 > 112.26.1.1.targus-getdata1: Flags [.], seq 4294941592:4294943020, ack 1, win 4107, options [nop,nop,TS val 3855396 ecr 4070966,mptcp dss ack 2613390630 seq 2860987534 subseq 372709 len 1428 csum 0xcd05], length 1428
08:47:30.578477 IP 112.26.1.1.targus-getdata1 > 112.26.1.8.33443: Flags [.], ack 4294954444, win 6964, options [nop,nop,TS val 4072928 ecr 3855396,nop,nop,sack 2 {4294963012:1428}{4294955872:4294961584},mptcp dss ack 2861030374], length 0
08:47:30.582102 IP 112.26.1.1.targus-getdata1 > 112.26.1.8.33443: Flags [.], ack 4294954444, win 6964, options [nop,nop,TS val 4072928 ecr 3855396,nop,nop,sack 2 {4294963012:1428}{4294955872:4294961584},mptcp dss ack 2861030374], length 0
08:47:30.706046 IP 112.26.1.8.33443 > 112.26.1.1.targus-getdata1: Flags [.], seq 1428:2856, ack 1, win 4107, options [nop,nop,TS val 3855719 ecr 4071205,mptcp dss ack 2613390630 seq 2861117482 subseq 399841 len 1428 csum 0x5492], length 1428
08:47:30.706349 IP 112.26.1.1.targus-getdata1 > 112.26.1.8.33443: Flags [.], ack 4294954444, win 7190, options [nop,nop,TS val 4073057 ecr 3855396,nop,nop,sack 2 {4294963012:2856}{4294955872:4294961584},mptcp dss ack 2861030374], length 0
08:47:30.712441 IP 112.26.1.1.targus-getdata1 > 112.26.1.8.33443: Flags [.], ack 4294954444, win 7190, options [nop,nop,TS val 4073057 ecr 3855396,nop,nop,sack 2 {4294963012:2856}{4294955872:4294961584},mptcp dss ack 2861030374], length 0
08:47:30.883620 IP 112.26.1.8.33443 > 112.26.1.1.targus-getdata1: Flags [.], seq 4294954444:4294955872, ack 1, win 4107, options [nop,nop,TS val 3856057 ecr 4071670,mptcp dss ack 2613390630 seq 2861030374 subseq 385561 len 1428 csum 0x98ac], length 1428
08:47:30.883977 IP 112.26.1.1.targus-getdata1 > 112.26.1.8.33443: Flags [.], ack 4294961584, win 7147, options [nop,nop,TS val 4073234 ecr 3856057,nop,nop,sack 1 {4294963012:2856},mptcp dss ack 2861057506], length 0
08:47:30.886608 IP 112.26.1.1.targus-getdata1 > 112.26.1.8.33443: Flags [.], ack 4294961584, win 7147, options [nop,nop,TS val 4073234 ecr 3856057,nop,nop,sack 1 {4294963012:2856},mptcp dss ack 2861057506], length 0
08:47:31.005900 IP 112.26.1.8.33443 > 112.26.1.1.targus-getdata1: Flags [.], seq 4284:5712, ack 1, win 4107, options [nop,nop,TS val 3856252 ecr 4071835,mptcp dss ack 2613390630 seq 2861144614 subseq 402697 len 1428 csum 0xa2f0], length 1428
08:47:31.006278 IP 112.26.1.1.targus-getdata1 > 112.26.1.8.33443: Flags [.], ack 4294961584, win 7282, options [nop,nop,TS val 4073356 ecr 3856057,nop,nop,sack 2 {4284:5712}{4294963012:2856},mptcp dss ack 2861057506], length 0
08:47:31.013248 IP 112.26.1.1.targus-getdata1 > 112.26.1.8.33443: Flags [.], ack 4294961584, win 7282, options [nop,nop,TS val 4073356 ecr 3856057,nop,nop,sack 2 {4284:5712}{4294963012:2856},mptcp dss ack 2861057506], length 0
08:47:31.121066 IP 112.26.1.8.33443 > 112.26.1.1.targus-getdata1: Flags [.], seq 5712:7140, ack 1, win 4107, options [nop,nop,TS val 3856379 ecr 4071935,mptcp dss ack 2613390630 seq 2861150326 subseq 404125 len 1428 csum 0x7896], length 1428
08:47:31.121531 IP 112.26.1.1.targus-getdata1 > 112.26.1.8.33443: Flags [.], ack 4294961584, win 7282, options [nop,nop,TS val 4073472 ecr 3856057,nop,nop,sack 2 {4284:7140}{4294963012:2856},mptcp dss ack 2861057506], length 0
08:47:31.129088 IP 112.26.1.1.targus-getdata1 > 112.26.1.8.33443: Flags [.], ack 4294961584, win 7282, options [nop,nop,TS val 4073472 ecr 3856057,nop,nop,sack 2 {4284:7140}{4294963012:2856},mptcp dss ack 2861057506], length 0
08:47:31.266296 IP 112.26.1.8.33443 > 112.26.1.1.targus-getdata1: Flags [.], seq 7140:8568, ack 1, win 4107, options [nop,nop,TS val 3856665 ecr 4072086,mptcp dss ack 2613390630 seq 2861160322 subseq 405553 len 1428 csum 0x5a4], length 1428
08:47:31.266532 IP 112.26.1.1.targus-getdata1 > 112.26.1.8.33443: Flags [.], ack 4294961584, win 7282, options [nop,nop,TS val 4073617 ecr 3856057,nop,nop,sack 2 {4284:8568}{4294963012:2856},mptcp dss ack 2861057506], length 0
08:47:31.288681 IP 112.26.1.1.targus-getdata1 > 112.26.1.8.33443: Flags [.], ack 4294961584, win 7282, options [nop,nop,TS val 4073617 ecr 3856057,nop,nop,sack 2 {4284:8568}{4294963012:2856},mptcp dss ack 2861057506], length 0
08:47:31.391522 IP 112.26.1.8.33443 > 112.26.1.1.targus-getdata1: Flags [.], seq 4294961584:4294963012, ack 1, win 4107, options [nop,nop,TS val 3856765 ecr 4072220,mptcp dss ack 2613390630 seq 2861057506 subseq 392701 len 1428 csum 0x2e65], length 1428
08:47:31.391795 IP 112.26.1.1.targus-getdata1 > 112.26.1.8.33443: Flags [.], ack 2856, win 7212, options [nop,nop,TS val 4073742 ecr 3856765,nop,nop,sack 1 {4284:8568},mptcp dss ack 2861071786], length 0
08:47:31.413267 IP 112.26.1.1.targus-getdata1 > 112.26.1.8.33443: Flags [.], ack 2856, win 7212, options [nop,nop,TS val 4073742 ecr 3856765,nop,nop,sack 1 {4284:8568},mptcp dss ack 2861071786], length 0
08:47:31.560109 IP 112.26.1.8.33443 > 112.26.1.1.targus-getdata1: Flags [.], seq 8568:9996, ack 1, win 4107, options [nop,nop,TS val 3856881 ecr 4072349,mptcp dss ack 2613390630 seq 2861168890 subseq 406981 len 1428 csum 0x850b], length 1428
08:47:31.560410 IP 112.26.1.1.targus-getdata1 > 112.26.1.8.33443: Flags [.], ack 2856, win 7282, options [nop,nop,TS val 4073910 ecr 3856765,nop,nop,sack 1 {4284:9996},mptcp dss ack 2861071786], length 0
08:47:31.568521 IP 112.26.1.1.targus-getdata1 > 112.26.1.8.33443: Flags [.], ack 2856, win 7282, options [nop,nop,TS val 4073910 ecr 3856765,nop,nop,sack 1 {4284:9996},mptcp dss ack 2861071786], length 0
08:47:31.696647 IP 112.26.1.8.33443 > 112.26.1.1.targus-getdata1: Flags [.], seq 9996:11424, ack 1, win 4107, options [nop,nop,TS val 3857082 ecr 4072445,mptcp dss ack 2613390630 seq 2861181742 subseq 408409 len 1428 csum 0x131a], length 1428
08:47:31.696958 IP 112.26.1.1.targus-getdata1 > 112.26.1.8.33443: Flags [.], ack 2856, win 7282, options [nop,nop,TS val 4074047 ecr 3856765,nop,nop,sack 1 {4284:11424},mptcp dss ack 2861071786], length 0
08:47:31.702460 IP 112.26.1.1.targus-getdata1 > 112.26.1.8.33443: Flags [.], ack 2856, win 7282, options [nop,nop,TS val 4074047 ecr 3856765,nop,nop,sack 1 {4284:11424},mptcp dss ack 2861071786], length 0
08:47:31.807509 IP 112.26.1.8.33443 > 112.26.1.1.targus-getdata1: Flags [.], seq 11424:12852, ack 1, win 4107, options [nop,nop,TS val 3857082 ecr 4072445,mptcp dss ack 2613390630 seq 2861183170 subseq 409837 len 1428 csum 0xd9f7], length 1428
08:47:31.807857 IP 112.26.1.1.targus-getdata1 > 112.26.1.8.33443: Flags [.], ack 2856, win 7282, options [nop,nop,TS val 4074158 ecr 3856765,nop,nop,sack 1 {4284:12852},mptcp dss ack 2861071786], length 0
08:47:31.810604 IP 112.26.1.1.targus-getdata1 > 112.26.1.8.33443: Flags [.], ack 2856, win 7282, options [nop,nop,TS val 4074158 ecr 3856765,nop,nop,sack 1 {4284:12852},mptcp dss ack 2861071786], length 0
08:47:31.934421 IP 112.26.1.8.33443 > 112.26.1.1.targus-getdata1: Flags [.], seq 14280:15708, ack 1, win 4107, options [nop,nop,TS val 3857273 ecr 4072560,mptcp dss ack 2613390630 seq 2861188882 subseq 412693 len 1428 csum 0xa501], length 1428
08:47:31.934735 IP 112.26.1.1.targus-getdata1 > 112.26.1.8.33443: Flags [.], ack 2856, win 7282, options [nop,nop,TS val 4074285 ecr 3856765,nop,nop,sack 2 {14280:15708}{4284:12852},mptcp dss ack 2861071786], length 0
08:47:31.955994 IP 112.26.1.1.targus-getdata1 > 112.26.1.8.33443: Flags [.], ack 2856, win 7282, options [nop,nop,TS val 4074285 ecr 3856765,nop,nop,sack 2 {14280:15708}{4284:12852},mptcp dss ack 2861071786], length 0
08:47:32.153103 IP 112.26.1.8.33443 > 112.26.1.1.targus-getdata1: Flags [.], seq 17136:18564, ack 1, win 4107, options [nop,nop,TS val 3857581 ecr 4072792,mptcp dss ack 2613390630 seq 2861207446 subseq 415549 len 1428 csum 0xad99], length 1428
08:47:32.153449 IP 112.26.1.1.targus-getdata1 > 112.26.1.8.33443: Flags [.], ack 2856, win 7282, options [nop,nop,TS val 4074503 ecr 3856765,nop,nop,sack 2 {17136:18564}{14280:15708},mptcp dss ack 2861071786], length 0
08:47:32.157632 IP 112.26.1.1.targus-getdata1 > 112.26.1.8.33443: Flags [.], ack 2856, win 7282, options [nop,nop,TS val 4074503 ecr 3856765,nop,nop,sack 2 {17136:18564}{14280:15708},mptcp dss ack 2861071786], length 0
08:47:32.277006 IP 112.26.1.8.33443 > 112.26.1.1.targus-getdata1: Flags [.], seq 18564:19992, ack 1, win 4107, options [nop,nop,TS val 3857715 ecr 4072928,mptcp dss ack 2613390630 seq 2861210302 subseq 416977 len 1428 csum 0xb371], length 1428
08:47:32.277153 IP 112.26.1.1.targus-getdata1 > 112.26.1.8.33443: Flags [.], ack 2856, win 7282, options [nop,nop,TS val 4074627 ecr 3856765,nop,nop,sack 2 {17136:19992}{14280:15708},mptcp dss ack 2861071786], length 0
08:47:32.298584 IP 112.26.1.1.targus-getdata1 > 112.26.1.8.33443: Flags [.], ack 2856, win 7282, options [nop,nop,TS val 4074627 ecr 3856765,nop,nop,sack 2 {17136:19992}{14280:15708},mptcp dss ack 2861071786], length 0
08:47:32.403227 IP 112.26.1.8.33443 > 112.26.1.1.targus-getdata1: Flags [.], seq 19992:21420, ack 1, win 4107, options [nop,nop,TS val 3857881 ecr 4073057,mptcp dss ack 2613390630 seq 2861216014 subseq 418405 len 1428 csum 0x1770], length 1428
08:47:32.403479 IP 112.26.1.1.targus-getdata1 > 112.26.1.8.33443: Flags [.], ack 2856, win 7282, options [nop,nop,TS val 4074754 ecr 3856765,nop,nop,sack 2 {17136:21420}{14280:15708},mptcp dss ack 2861071786], length 0
08:47:32.411457 IP 112.26.1.1.targus-getdata1 > 112.26.1.8.33443: Flags [.], ack 2856, win 7282, options [nop,nop,TS val 4074754 ecr 3856765,nop,nop,sack 2 {17136:21420}{14280:15708},mptcp dss ack 2861071786], length 0
08:47:32.506700 IP 112.26.1.8.33443 > 112.26.1.1.targus-getdata1: Flags [.], seq 2856:4284, ack 1, win 4107, options [nop,nop,TS val 3857965 ecr 4073234,mptcp dss ack 2613390630 seq 2861133190 subseq 401269 len 1428 csum 0x106a], length 1428
08:47:32.507085 IP 112.26.1.1.targus-getdata1 > 112.26.1.8.33443: Flags [.], ack 12852, win 7282, options [nop,nop,TS val 4074857 ecr 3857965,nop,nop,sack 2 {17136:21420}{14280:15708},mptcp dss ack 2861071786], length 0
08:47:32.534059 IP 112.26.1.1.targus-getdata1 > 112.26.1.8.33443: Flags [.], ack 12852, win 7282, options [nop,nop,TS val 4074857 ecr 3857965,nop,nop,sack 2 {17136:21420}{14280:15708},mptcp dss ack 2861071786], length 0
08:47:32.644755 IP 112.26.1.8.33443 > 112.26.1.1.targus-getdata1: Flags [.], seq 21420:22848, ack 1, win 4107, options [nop,nop,TS val 3857965 ecr 4073234,mptcp dss ack 2613390630 seq 2861221726 subseq 419833 len 1428 csum 0xeab5], length 1428
08:47:32.645118 IP 112.26.1.1.targus-getdata1 > 112.26.1.8.33443: Flags [.], ack 12852, win 7282, options [nop,nop,TS val 4074995 ecr 3857965,nop,nop,sack 2 {17136:22848}{14280:15708},mptcp dss ack 2861071786], length 0
08:47:32.648906 IP 112.26.1.1.targus-getdata1 > 112.26.1.8.33443: Flags [.], ack 12852, win 7282, options [nop,nop,TS val 4074995 ecr 3857965,nop,nop,sack 2 {17136:22848}{14280:15708},mptcp dss ack 2861071786], length 0
08:47:32.732308 IP 112.26.1.8.33443 > 112.26.1.1.targus-getdata1: Flags [.], seq 22848:24276, ack 1, win 4107, options [nop,nop,TS val 3858086 ecr 4073356,mptcp dss ack 2613390630 seq 2861226010 subseq 421261 len 1428 csum 0x1632], length 1428
08:47:32.732661 IP 112.26.1.1.targus-getdata1 > 112.26.1.8.33443: Flags [.], ack 12852, win 7282, options [nop,nop,TS val 4075083 ecr 3857965,nop,nop,sack 2 {17136:24276}{14280:15708},mptcp dss ack 2861071786], length 0
08:47:32.845642 IP 112.26.1.8.33443 > 112.26.1.1.targus-getdata1: Flags [.], seq 24276:25704, ack 1, win 4107, options [nop,nop,TS val 3858224 ecr 4073472,mptcp dss ack 2613390630 seq 2861228866 subseq 422689 len 1428 csum 0xe1af], length 1428
08:47:32.846009 IP 112.26.1.1.targus-getdata1 > 112.26.1.8.33443: Flags [.], ack 12852, win 7282, options [nop,nop,TS val 4075196 ecr 3857965,nop,nop,sack 2 {17136:25704}{14280:15708},mptcp dss ack 2861071786], length 0
08:47:32.880062 IP 112.26.1.1.targus-getdata1 > 112.26.1.8.33443: Flags [.], ack 12852, win 7282, options [nop,nop,TS val 4075083 ecr 3857965,nop,nop,sack 2 {17136:24276}{14280:15708},mptcp dss ack 2861071786], length 0
08:47:32.971551 IP 112.26.1.1.targus-getdata1 > 112.26.1.8.33443: Flags [.], ack 12852, win 7282, options [nop,nop,TS val 4075196 ecr 3857965,nop,nop,sack 2 {17136:25704}{14280:15708},mptcp dss ack 2861071786], length 0
08:47:33.019327 IP 112.26.1.8.33443 > 112.26.1.1.targus-getdata1: Flags [.], seq 25704:27132, ack 1, win 4107, options [nop,nop,TS val 3858334 ecr 4073617,mptcp dss ack 2613390630 seq 2861231722 subseq 424117 len 1428 csum 0xab26], length 1428
08:47:33.019670 IP 112.26.1.1.targus-getdata1 > 112.26.1.8.33443: Flags [.], ack 12852, win 7282, options [nop,nop,TS val 4075370 ecr 3857965,nop,nop,sack 2 {17136:27132}{14280:15708},mptcp dss ack 2861071786], length 0
08:47:33.065263 IP 112.26.1.1.targus-getdata1 > 112.26.1.8.33443: Flags [.], ack 12852, win 7282, options [nop,nop,TS val 4075370 ecr 3857965,nop,nop,sack 2 {17136:27132}{14280:15708},mptcp dss ack 2861071786], length 0
08:47:33.164897 IP 112.26.1.8.33443 > 112.26.1.1.targus-getdata1: Flags [.], seq 27132:28560, ack 1, win 4107, options [nop,nop,TS val 3858477 ecr 4073742,mptcp dss ack 2613390630 seq 2861234578 subseq 425545 len 1428 csum 0x95c7], length 1428
08:47:33.165251 IP 112.26.1.1.targus-getdata1 > 112.26.1.8.33443: Flags [.], ack 12852, win 7282, options [nop,nop,TS val 4075515 ecr 3857965,nop,nop,sack 2 {17136:28560}{14280:15708},mptcp dss ack 2861071786], length 0
08:47:33.176900 IP 112.26.1.1.targus-getdata1 > 112.26.1.8.33443: Flags [.], ack 12852, win 7282, options [nop,nop,TS val 4075515 ecr 3857965,nop,nop,sack 2 {17136:28560}{14280:15708},mptcp dss ack 2861071786], length 0
08:47:33.279497 IP 112.26.1.8.33443 > 112.26.1.1.targus-getdata1: Flags [.], seq 28560:29988, ack 1, win 4107, options [nop,nop,TS val 3858715 ecr 4073910,mptcp dss ack 2613390630 seq 2861237434 subseq 426973 len 1428 csum 0xd97f], length 1428
08:47:33.279735 IP 112.26.1.1.targus-getdata1 > 112.26.1.8.33443: Flags [.], ack 12852, win 7282, options [nop,nop,TS val 4075630 ecr 3857965,nop,nop,sack 2 {17136:29988}{14280:15708},mptcp dss ack 2861071786], length 0
08:47:33.290941 IP 112.26.1.1.targus-getdata1 > 112.26.1.8.33443: Flags [.], ack 12852, win 7282, options [nop,nop,TS val 4075630 ecr 3857965,nop,nop,sack 2 {17136:29988}{14280:15708},mptcp dss ack 2861071786], length 0
08:47:33.404820 IP 112.26.1.8.33443 > 112.26.1.1.targus-getdata1: Flags [.], seq 29988:31416, ack 1, win 4107, options [nop,nop,TS val 3858845 ecr 4074158,mptcp dss ack 2613390630 seq 2861241718 subseq 428401 len 1428 csum 0x9cf0], length 1428
08:47:33.405116 IP 112.26.1.1.targus-getdata1 > 112.26.1.8.33443: Flags [.], ack 12852, win 7282, options [nop,nop,TS val 4075755 ecr 3857965,nop,nop,sack 2 {17136:31416}{14280:15708},mptcp dss ack 2861071786], length 0
08:47:33.408745 IP 112.26.1.1.targus-getdata1 > 112.26.1.8.33443: Flags [.], ack 12852, win 7282, options [nop,nop,TS val 4075755 ecr 3857965,nop,nop,sack 2 {17136:31416}{14280:15708},mptcp dss ack 2861071786], length 0
08:47:33.549749 IP 112.26.1.8.33443 > 112.26.1.1.targus-getdata1: Flags [.], seq 12852:14280, ack 1, win 4107, options [nop,nop,TS val 3859030 ecr 4074285,mptcp dss ack 2613390630 seq 2861184598 subseq 411265 len 1428 csum 0xea83], length 1428
08:47:33.550078 IP 112.26.1.1.targus-getdata1 > 112.26.1.8.33443: Flags [.], ack 15708, win 7282, options [nop,nop,TS val 4075900 ecr 3859030,nop,nop,sack 1 {17136:31416},mptcp dss ack 2861071786], length 0
08:47:33.557776 IP 112.26.1.1.targus-getdata1 > 112.26.1.8.33443: Flags [.], ack 15708, win 7282, options [nop,nop,TS val 4075900 ecr 3859030,nop,nop,sack 1 {17136:31416},mptcp dss ack 2861071786], length 0
08:47:33.691106 IP 112.26.1.8.33443 > 112.26.1.1.targus-getdata1: Flags [.], seq 15708:17136, ack 1, win 4107, options [nop,nop,TS val 3859428 ecr 4074754,mptcp dss ack 2613390630 seq 2861198878 subseq 414121 len 1428 csum 0x61da], length 1428
08:47:33.691445 IP 112.26.1.1.targus-getdata1 > 112.26.1.8.33443: Flags [.], ack 31416, win 7037, options [nop,nop,TS val 4076041 ecr 3859428,mptcp dss ack 2861103202], length 0
08:47:33.697123 IP 112.26.1.1.targus-getdata1 > 112.26.1.8.33443: Flags [.], ack 31416, win 7037, options [nop,nop,TS val 4076041 ecr 3859428,mptcp dss ack 2861103202], length 0
08:47:33.806739 IP 112.26.1.8.33443 > 112.26.1.1.targus-getdata1: Flags [.], seq 31416:32844, ack 1, win 4107, options [nop,nop,TS val 3859518 ecr 4074857,mptcp dss ack 2613390630 seq 2861257426 subseq 429829 len 1428 csum 0x3783], length 1428
08:47:33.807034 IP 112.26.1.1.targus-getdata1 > 112.26.1.8.33443: Flags [.], ack 32844, win 7037, options [nop,nop,TS val 4076157 ecr 3859518,mptcp dss ack 2861103202], length 0
08:47:33.812416 IP 112.26.1.1.targus-getdata1 > 112.26.1.8.33443: Flags [.], ack 32844, win 7037, options [nop,nop,TS val 4076157 ecr 3859518,mptcp dss ack 2861103202], length 0
08:47:33.916936 IP 112.26.1.8.33443 > 112.26.1.1.targus-getdata1: Flags [.], seq 32844:34272, ack 1, win 4107, options [nop,nop,TS val 3859681 ecr 4074995,mptcp dss ack 2613390630 seq 2861263138 subseq 431257 len 1428 csum 0x9d2e], length 1428
08:47:33.917257 IP 112.26.1.1.targus-getdata1 > 112.26.1.8.33443: Flags [.], ack 34272, win 7037, options [nop,nop,TS val 4076268 ecr 3859681,mptcp dss ack 2861103202], length 0
08:47:33.927661 IP 112.26.1.1.targus-getdata1 > 112.26.1.8.33443: Flags [.], ack 34272, win 7037, options [nop,nop,TS val 4076268 ecr 3859681,mptcp dss ack 2861103202], length 0
08:47:34.010514 IP 112.26.1.8.33443 > 112.26.1.1.targus-getdata1: Flags [.], seq 34272:35700, ack 1, win 4107, options [nop,nop,TS val 3859735 ecr 4075083,mptcp dss ack 2613390630 seq 2861265994 subseq 432685 len 1428 csum 0x8833], length 1428
08:47:34.010912 IP 112.26.1.1.targus-getdata1 > 112.26.1.8.33443: Flags [.], ack 35700, win 7037, options [nop,nop,TS val 4076361 ecr 3859735,mptcp dss ack 2861103202], length 0
08:47:34.053180 IP 112.26.1.1.targus-getdata1 > 112.26.1.8.33443: Flags [.], ack 35700, win 7037, options [nop,nop,TS val 4076361 ecr 3859735,mptcp dss ack 2861103202], length 0
08:47:34.132732 IP 112.26.1.8.33443 > 112.26.1.1.targus-getdata1: Flags [.], seq 35700:37128, ack 1, win 4107, options [nop,nop,TS val 3859853 ecr 4075196,mptcp dss ack 2613390630 seq 2861270278 subseq 434113 len 1428 csum 0xa583], length 1428
08:47:34.133121 IP 112.26.1.1.targus-getdata1 > 112.26.1.8.33443: Flags [.], ack 37128, win 7028, options [nop,nop,TS val 4076483 ecr 3859853,mptcp dss ack 2861157466], length 0
08:47:34.182548 IP 112.26.1.1.targus-getdata1 > 112.26.1.8.33443: Flags [.], ack 37128, win 7028, options [nop,nop,TS val 4076483 ecr 3859853,mptcp dss ack 2861157466], length 0
08:47:34.256134 IP 112.26.1.8.33443 > 112.26.1.1.targus-getdata1: Flags [P.], seq 37128:38556, ack 1, win 4107, options [nop,nop,TS val 3860005 ecr 4075370,mptcp dss ack 2613390630 seq 2861277418 subseq 435541 len 1428 csum 0xe2dc], length 1428
08:47:34.256372 IP 112.26.1.1.targus-getdata1 > 112.26.1.8.33443: Flags [.], ack 38556, win 7028, options [nop,nop,TS val 4076606 ecr 3860005,mptcp dss ack 2861157466], length 0
08:47:34.288113 IP 112.26.1.1.targus-getdata1 > 112.26.1.8.33443: Flags [.], ack 38556, win 7028, options [nop,nop,TS val 4076606 ecr 3860005,mptcp dss ack 2861157466], length 0
08:47:34.409046 IP 112.26.1.8.33443 > 112.26.1.1.targus-getdata1: Flags [.], seq 38556:39984, ack 1, win 4107, options [nop,nop,TS val 3860199 ecr 4075515,mptcp dss ack 2613390630 seq 2861285986 subseq 436969 len 1428 csum 0xcaf1], length 1428
08:47:34.409361 IP 112.26.1.1.targus-getdata1 > 112.26.1.8.33443: Flags [.], ack 39984, win 7028, options [nop,nop,TS val 4076759 ecr 3860199,mptcp dss ack 2861157466], length 0
08:47:34.416770 IP 112.26.1.1.targus-getdata1 > 112.26.1.8.33443: Flags [.], ack 39984, win 7028, options [nop,nop,TS val 4076759 ecr 3860199,mptcp dss ack 2861157466], length 0
08:47:34.474591 IP 112.26.1.8.33443 > 112.26.1.1.targus-getdata1: Flags [.], seq 39984:41412, ack 1, win 4107, options [nop,nop,TS val 3860332 ecr 4075630,mptcp dss ack 2613390630 seq 2861291698 subseq 438397 len 1428 csum 0x69ee], length 1428
08:47:34.474972 IP 112.26.1.1.targus-getdata1 > 112.26.1.8.33443: Flags [.], ack 41412, win 7028, options [nop,nop,TS val 4076825 ecr 3860332,mptcp dss ack 2861157466], length 0
08:47:34.517439 IP 112.26.1.1.targus-getdata1 > 112.26.1.8.33443: Flags [.], ack 41412, win 7028, options [nop,nop,TS val 4076825 ecr 3860332,mptcp dss ack 2861157466], length 0
08:47:34.569753 IP 112.26.1.8.33443 > 112.26.1.1.targus-getdata1: Flags [.], seq 41412:42840, ack 1, win 4107, options [nop,nop,TS val 3860459 ecr 4075755,mptcp dss ack 2613390630 seq 2861295982 subseq 439825 len 1428 csum 0x92bf], length 1428
08:47:34.570156 IP 112.26.1.1.targus-getdata1 > 112.26.1.8.33443: Flags [.], ack 42840, win 7028, options [nop,nop,TS val 4076920 ecr 3860459,mptcp dss ack 2861157466], length 0
08:47:34.574567 IP 112.26.1.1.targus-getdata1 > 112.26.1.8.33443: Flags [.], ack 42840, win 7028, options [nop,nop,TS val 4076920 ecr 3860459,mptcp dss ack 2861157466], length 0
08:47:34.695415 IP 112.26.1.8.33443 > 112.26.1.1.targus-getdata1: Flags [.], seq 42840:44268, ack 1, win 4107, options [nop,nop,TS val 3860588 ecr 4075900,mptcp dss ack 2613390630 seq 2861300266 subseq 441253 len 1428 csum 0x73c2], length 1428
08:47:34.695759 IP 112.26.1.1.targus-getdata1 > 112.26.1.8.33443: Flags [.], ack 44268, win 7028, options [nop,nop,TS val 4077046 ecr 3860588,mptcp dss ack 2861157466], length 0
08:47:34.699515 IP 112.26.1.1.targus-getdata1 > 112.26.1.8.33443: Flags [.], ack 44268, win 7028, options [nop,nop,TS val 4077046 ecr 3860588,mptcp dss ack 2861157466], length 0
08:47:34.827038 IP 112.26.1.8.33443 > 112.26.1.1.targus-getdata1: Flags [.], seq 44268:45696, ack 1, win 4107, options [nop,nop,TS val 3860697 ecr 4076041,mptcp dss ack 2613390630 seq 2861305978 subseq 442681 len 1428 csum 0xe0f], length 1428
08:47:34.827421 IP 112.26.1.1.targus-getdata1 > 112.26.1.8.33443: Flags [.], ack 45696, win 7028, options [nop,nop,TS val 4077177 ecr 3860697,mptcp dss ack 2861157466], length 0
08:47:34.833613 IP 112.26.1.1.targus-getdata1 > 112.26.1.8.33443: Flags [.], ack 45696, win 7028, options [nop,nop,TS val 4077177 ecr 3860697,mptcp dss ack 2861157466], length 0
08:47:34.944060 IP 112.26.1.8.33443 > 112.26.1.1.targus-getdata1: Flags [.], seq 45696:47124, ack 1, win 4107, options [nop,nop,TS val 3860829 ecr 4076157,mptcp dss ack 2613390630 seq 2861310262 subseq 444109 len 1428 csum 0xe844], length 1428
08:47:34.944404 IP 112.26.1.1.targus-getdata1 > 112.26.1.8.33443: Flags [.], ack 47124, win 7028, options [nop,nop,TS val 4077294 ecr 3860829,mptcp dss ack 2861157466], length 0
08:47:34.948687 IP 112.26.1.1.targus-getdata1 > 112.26.1.8.33443: Flags [.], ack 47124, win 7028, options [nop,nop,TS val 4077294 ecr 3860829,mptcp dss ack 2861157466], length 0
08:47:35.063949 IP 112.26.1.8.33443 > 112.26.1.1.targus-getdata1: Flags [.], seq 47124:48552, ack 1, win 4107, options [nop,nop,TS val 3861015 ecr 4076268,mptcp dss ack 2613390630 seq 2861323114 subseq 445537 len 1428 csum 0xd4ac], length 1428
08:47:35.064257 IP 112.26.1.1.targus-getdata1 > 112.26.1.8.33443: Flags [.], ack 48552, win 7028, options [nop,nop,TS val 4077414 ecr 3861015,mptcp dss ack 2861157466], length 0
08:47:35.092064 IP 112.26.1.1.targus-getdata1 > 112.26.1.8.33443: Flags [.], ack 48552, win 7028, options [nop,nop,TS val 4077414 ecr 3861015,mptcp dss ack 2861157466], length 0
08:47:35.187354 IP 112.26.1.8.33443 > 112.26.1.1.targus-getdata1: Flags [.], seq 48552:49980, ack 1, win 4107, options [nop,nop,TS val 3861116 ecr 4076361,mptcp dss ack 2613390630 seq 2861328826 subseq 446965 len 1428 csum 0xc4ca], length 1428
08:47:35.187707 IP 112.26.1.1.targus-getdata1 > 112.26.1.8.33443: Flags [.], ack 49980, win 7028, options [nop,nop,TS val 4077538 ecr 3861116,mptcp dss ack 2861157466], length 0
08:47:35.190220 IP 112.26.1.1.targus-getdata1 > 112.26.1.8.33443: Flags [.], ack 49980, win 7028, options [nop,nop,TS val 4077538 ecr 3861116,mptcp dss ack 2861157466], length 0
08:47:35.308986 IP 112.26.1.8.33443 > 112.26.1.1.targus-getdata1: Flags [.], seq 49980:51408, ack 1, win 4107, options [nop,nop,TS val 3861283 ecr 4076483,mptcp dss ack 2613390630 seq 2861334538 subseq 448393 len 1428 csum 0xb5c0], length 1428
08:47:35.350295 IP 112.26.1.1.targus-getdata1 > 112.26.1.8.33443: Flags [.], ack 51408, win 6941, options [nop,nop,TS val 4077701 ecr 3861283,mptcp dss ack 2861190310], length 0
08:47:35.355001 IP 112.26.1.1.targus-getdata1 > 112.26.1.8.33443: Flags [.], ack 51408, win 6941, options [nop,nop,TS val 4077701 ecr 3861283,mptcp dss ack 2861190310], length 0
08:47:35.444556 IP 112.26.1.8.33443 > 112.26.1.1.targus-getdata1: Flags [.], seq 51408:52836, ack 1, win 4107, options [nop,nop,TS val 3861283 ecr 4076483,mptcp dss ack 2613390630 seq 2861335966 subseq 449821 len 1428 csum 0xeba5], length 1428
08:47:35.524383 IP 112.26.1.8.33443 > 112.26.1.1.targus-getdata1: Flags [.], seq 52836:54264, ack 1, win 4107, options [nop,nop,TS val 3861463 ecr 4076606,mptcp dss ack 2613390630 seq 2861343106 subseq 451249 len 1428 csum 0x671f], length 1428
08:47:35.524768 IP 112.26.1.1.targus-getdata1 > 112.26.1.8.33443: Flags [.], ack 54264, win 6941, options [nop,nop,TS val 4077875 ecr 3861283,mptcp dss ack 2861190310], length 0
08:47:35.553423 IP 112.26.1.1.targus-getdata1 > 112.26.1.8.33443: Flags [.], ack 54264, win 6941, options [nop,nop,TS val 4077875 ecr 3861283,mptcp dss ack 2861190310], length 0
08:47:35.637612 IP 112.26.1.8.33443 > 112.26.1.1.targus-getdata1: Flags [.], seq 54264:55692, ack 1, win 4107, options [nop,nop,TS val 3861646 ecr 4076759,mptcp dss ack 2613390630 seq 2861351674 subseq 452677 len 1428 csum 0xa213], length 1428
08:47:35.721415 IP 112.26.1.1.targus-getdata1 > 112.26.1.8.33443: Flags [.], ack 55692, win 6941, options [nop,nop,TS val 4078072 ecr 3861646,mptcp dss ack 2861190310], length 0
08:47:35.724673 IP 112.26.1.1.targus-getdata1 > 112.26.1.8.33443: Flags [.], ack 55692, win 6941, options [nop,nop,TS val 4078072 ecr 3861646,mptcp dss ack 2861190310], length 0
08:47:35.760479 IP 112.26.1.8.33443 > 112.26.1.1.targus-getdata1: Flags [.], seq 55692:57120, ack 1, win 4107, options [nop,nop,TS val 3861790 ecr 4076825,mptcp dss ack 2613390630 seq 2861363098 subseq 454105 len 1428 csum 0xbdec], length 1428
08:47:35.871108 IP 112.26.1.8.33443 > 112.26.1.1.targus-getdata1: Flags [.], seq 57120:58548, ack 1, win 4107, options [nop,nop,TS val 3861887 ecr 4076920,mptcp dss ack 2613390630 seq 2861367382 subseq 455533 len 1428 csum 0xfa16], length 1428
08:47:35.871433 IP 112.26.1.1.targus-getdata1 > 112.26.1.8.33443: Flags [.], ack 58548, win 6941, options [nop,nop,TS val 4078221 ecr 3861790,mptcp dss ack 2861190310], length 0
08:47:35.875155 IP 112.26.1.1.targus-getdata1 > 112.26.1.8.33443: Flags [.], ack 58548, win 6941, options [nop,nop,TS val 4078221 ecr 3861790,mptcp dss ack 2861190310], length 0
08:47:36.021538 IP 112.26.1.8.33443 > 112.26.1.1.targus-getdata1: Flags [.], seq 58548:59976, ack 1, win 4107, options [nop,nop,TS val 3862025 ecr 4077046,mptcp dss ack 2613390630 seq 2861373094 subseq 456961 len 1428 csum 0xb854], length 1428
08:47:36.129673 IP 112.26.1.1.targus-getdata1 > 112.26.1.8.33443: Flags [.], ack 59976, win 6941, options [nop,nop,TS val 4078480 ecr 3862025,mptcp dss ack 2861190310], length 0
08:47:36.133287 IP 112.26.1.1.targus-getdata1 > 112.26.1.8.33443: Flags [.], ack 59976, win 6941, options [nop,nop,TS val 4078480 ecr 3862025,mptcp dss ack 2861190310], length 0
08:47:36.182460 IP 112.26.1.8.33443 > 112.26.1.1.targus-getdata1: Flags [.], seq 59976:61404, ack 1, win 4107, options [nop,nop,TS val 3862146 ecr 4077177,mptcp dss ack 2613390630 seq 2861377378 subseq 458389 len 1428 csum 0x8e1b], length 1428
08:47:36.252051 IP 112.26.1.8.33443 > 112.26.1.1.targus-getdata1: Flags [.], seq 61404:62832, ack 1, win 4107, options [nop,nop,TS val 3862254 ecr 4077294,mptcp dss ack 2613390630 seq 2861385946 subseq 459817 len 1428 csum 0x779f], length 1428
08:47:36.289164 IP 112.26.1.1.targus-getdata1 > 112.26.1.8.33443: Flags [.], ack 62832, win 6941, options [nop,nop,TS val 4078640 ecr 3862146,mptcp dss ack 2861190310], length 0
08:47:36.292774 IP 112.26.1.1.targus-getdata1 > 112.26.1.8.33443: Flags [.], ack 62832, win 6941, options [nop,nop,TS val 4078640 ecr 3862146,mptcp dss ack 2861190310], length 0
08:47:36.416397 IP 112.26.1.8.33443 > 112.26.1.1.targus-getdata1: Flags [.], seq 62832:64260, ack 1, win 4107, options [nop,nop,TS val 3862344 ecr 4077414,mptcp dss ack 2613390630 seq 2861388802 subseq 461245 len 1428 csum 0xd442], length 1428
08:47:36.529525 IP 112.26.1.1.targus-getdata1 > 112.26.1.8.33443: Flags [.], ack 64260, win 6941, options [nop,nop,TS val 4078880 ecr 3862344,mptcp dss ack 2861190310], length 0
08:47:36.537056 IP 112.26.1.1.targus-getdata1 > 112.26.1.8.33443: Flags [.], ack 64260, win 6941, options [nop,nop,TS val 4078880 ecr 3862344,mptcp dss ack 2861190310], length 0
08:47:36.548888 IP 112.26.1.8.33443 > 112.26.1.1.targus-getdata1: Flags [.], seq 64260:65688, ack 1, win 4107, options [nop,nop,TS val 3862460 ecr 4077538,mptcp dss ack 2613390630 seq 2861395942 subseq 462673 len 1428 csum 0x5103], length 1428
08:47:36.643137 IP 112.26.1.8.33443 > 112.26.1.1.targus-getdata1: Flags [.], seq 65688:67116, ack 1, win 4107, options [nop,nop,TS val 3862620 ecr 4077701,mptcp dss ack 2613390630 seq 2861403082 subseq 464101 len 1428 csum 0xd180], length 1428
08:47:36.643492 IP 112.26.1.1.targus-getdata1 > 112.26.1.8.33443: Flags [.], ack 67116, win 6985, options [nop,nop,TS val 4078993 ecr 3862460,mptcp dss ack 2861267422], length 0
08:47:36.680488 IP 112.26.1.1.targus-getdata1 > 112.26.1.8.33443: Flags [.], ack 67116, win 6985, options [nop,nop,TS val 4078993 ecr 3862460,mptcp dss ack 2861267422], length 0
08:47:36.803569 IP 112.26.1.8.33443 > 112.26.1.1.targus-getdata1: Flags [.], seq 67116:68544, ack 1, win 4107, options [nop,nop,TS val 3862756 ecr 4078072,mptcp dss ack 2613390630 seq 2861411650 subseq 465529 len 1428 csum 0x2a44], length 1428
08:47:36.913994 IP 112.26.1.1.targus-getdata1 > 112.26.1.8.33443: Flags [.], ack 68544, win 7282, options [nop,nop,TS val 4079264 ecr 3862756,mptcp dss ack 2861380234], length 0
08:47:36.917023 IP 112.26.1.1.targus-getdata1 > 112.26.1.8.33443: Flags [.], ack 68544, win 7282, options [nop,nop,TS val 4079264 ecr 3862756,mptcp dss ack 2861380234], length 0
08:47:36.927313 IP 112.26.1.8.33443 > 112.26.1.1.targus-getdata1: Flags [.], seq 68544:69972, ack 1, win 4107, options [nop,nop,TS val 3862756 ecr 4078072,mptcp dss ack 2613390630 seq 2861413078 subseq 466957 len 1428 csum 0x2e96], length 1428
08:47:37.041281 IP 112.26.1.1.targus-getdata1 > 112.26.1.8.33443: Flags [.], ack 69972, win 7282, options [nop,nop,TS val 4079392 ecr 3862756,mptcp dss ack 2861381662], length 0
08:47:37.046521 IP 112.26.1.1.targus-getdata1 > 112.26.1.8.33443: Flags [.], ack 69972, win 7282, options [nop,nop,TS val 4079392 ecr 3862756,mptcp dss ack 2861381662], length 0
08:47:37.103444 IP 112.26.1.8.33443 > 112.26.1.1.targus-getdata1: Flags [.], seq 69972:71400, ack 1, win 4107, options [nop,nop,TS val 3862756 ecr 4078072,mptcp dss ack 2613390630 seq 2861414506 subseq 468385 len 1428 csum 0x7556], length 1428
08:47:37.214804 IP 112.26.1.8.33443 > 112.26.1.1.targus-getdata1: Flags [.], seq 71400:72828, ack 1, win 4107, options [nop,nop,TS val 3862756 ecr 4078072,mptcp dss ack 2613390630 seq 2861415934 subseq 469813 len 1428 csum 0xad07], length 1428
08:47:37.215163 IP 112.26.1.1.targus-getdata1 > 112.26.1.8.33443: Flags [.], ack 72828, win 7282, options [nop,nop,TS val 4079565 ecr 3862756,mptcp dss ack 2861394514], length 0
08:47:37.221691 IP 112.26.1.1.targus-getdata1 > 112.26.1.8.33443: Flags [.], ack 72828, win 7282, options [nop,nop,TS val 4079565 ecr 3862756,mptcp dss ack 2861394514], length 0
08:47:37.326825 IP 112.26.1.8.33443 > 112.26.1.1.targus-getdata1: Flags [.], seq 72828:74256, ack 1, win 4107, options [nop,nop,TS val 3862829 ecr 4078221,mptcp dss ack 2613390630 seq 2861418790 subseq 471241 len 1428 csum 0xf380], length 1428
08:47:37.427654 IP 112.26.1.8.33443 > 112.26.1.1.targus-getdata1: Flags [.], seq 74256:75684, ack 1, win 4107, options [nop,nop,TS val 3862829 ecr 4078221,mptcp dss ack 2613390630 seq 2861420218 subseq 472669 len 1428 csum 0x824], length 1428
08:47:37.428018 IP 112.26.1.1.targus-getdata1 > 112.26.1.8.33443: Flags [.], ack 75684, win 7282, options [nop,nop,TS val 4079778 ecr 3862829,mptcp dss ack 2861407366], length 0
08:47:37.433202 IP 112.26.1.1.targus-getdata1 > 112.26.1.8.33443: Flags [.], ack 75684, win 7282, options [nop,nop,TS val 4079778 ecr 3862829,mptcp dss ack 2861407366], length 0
08:47:37.575532 IP 112.26.1.8.33443 > 112.26.1.1.targus-getdata1: Flags [.], seq 75684:77112, ack 1, win 4107, options [nop,nop,TS val 3862920 ecr 4078480,mptcp dss ack 2613390630 seq 2861425930 subseq 474097 len 1428 csum 0xf001], length 1428
08:47:37.689730 IP 112.26.1.1.targus-getdata1 > 112.26.1.8.33443: Flags [.], ack 77112, win 7282, options [nop,nop,TS val 4080040 ecr 3862920,mptcp dss ack 2861407366], length 0
08:47:37.693906 IP 112.26.1.1.targus-getdata1 > 112.26.1.8.33443: Flags [.], ack 77112, win 7282, options [nop,nop,TS val 4080040 ecr 3862920,mptcp dss ack 2861407366], length 0
08:47:37.724655 IP 112.26.1.8.33443 > 112.26.1.1.targus-getdata1: Flags [.], seq 77112:78540, ack 1, win 4107, options [nop,nop,TS val 3863012 ecr 4078640,mptcp dss ack 2613390630 seq 2861433070 subseq 475525 len 1428 csum 0x5e], length 1428
08:47:37.803347 IP 112.26.1.8.33443 > 112.26.1.1.targus-getdata1: Flags [.], seq 78540:79968, ack 1, win 4107, options [nop,nop,TS val 3863012 ecr 4078640,mptcp dss ack 2613390630 seq 2861434498 subseq 476953 len 1428 csum 0xb09c], length 1428
08:47:37.803710 IP 112.26.1.1.targus-getdata1 > 112.26.1.8.33443: Flags [.], ack 79968, win 7282, options [nop,nop,TS val 4080153 ecr 3863012,mptcp dss ack 2861407366], length 0
08:47:37.841979 IP 112.26.1.1.targus-getdata1 > 112.26.1.8.33443: Flags [.], ack 79968, win 7282, options [nop,nop,TS val 4080153 ecr 3863012,mptcp dss ack 2861407366], length 0
08:47:37.917434 IP 112.26.1.8.33443 > 112.26.1.1.targus-getdata1: Flags [.], seq 79968:81396, ack 1, win 4107, options [nop,nop,TS val 3863080 ecr 4078880,mptcp dss ack 2613390630 seq 2861437354 subseq 478381 len 1428 csum 0x6341], length 1428
08:47:38.025263 IP 112.26.1.1.targus-getdata1 > 112.26.1.8.33443: Flags [.], ack 81396, win 7282, options [nop,nop,TS val 4080376 ecr 3863080,mptcp dss ack 2861407366], length 0
08:47:38.033904 IP 112.26.1.1.targus-getdata1 > 112.26.1.8.33443: Flags [.], ack 81396, win 7282, options [nop,nop,TS val 4080376 ecr 3863080,mptcp dss ack 2861407366], length 0
08:47:38.058736 IP 112.26.1.8.33443 > 112.26.1.1.targus-getdata1: Flags [.], seq 81396:82824, ack 1, win 4107, options [nop,nop,TS val 3863199 ecr 4078993,mptcp dss ack 2613390630 seq 2861445922 subseq 479809 len 1428 csum 0x78c8], length 1428
08:47:38.169148 IP 112.26.1.1.targus-getdata1 > 112.26.1.8.33443: Flags [.], ack 82824, win 7282, options [nop,nop,TS val 4080520 ecr 3863199,mptcp dss ack 2861407366], length 0
08:47:38.172289 IP 112.26.1.1.targus-getdata1 > 112.26.1.8.33443: Flags [.], ack 82824, win 7282, options [nop,nop,TS val 4080520 ecr 3863199,mptcp dss ack 2861407366], length 0
08:47:38.193674 IP 112.26.1.8.33443 > 112.26.1.1.targus-getdata1: Flags [.], seq 82824:84252, ack 1, win 4107, options [nop,nop,TS val 3863199 ecr 4078993,mptcp dss ack 2613390630 seq 2861447350 subseq 481237 len 1428 csum 0xc67f], length 1428
08:47:38.305280 IP 112.26.1.1.targus-getdata1 > 112.26.1.8.33443: Flags [.], ack 84252, win 7282, options [nop,nop,TS val 4080656 ecr 3863199,mptcp dss ack 2861407366], length 0
08:47:38.310612 IP 112.26.1.1.targus-getdata1 > 112.26.1.8.33443: Flags [.], ack 84252, win 7282, options [nop,nop,TS val 4080656 ecr 3863199,mptcp dss ack 2861407366], length 0
08:47:38.347973 IP 112.26.1.8.33443 > 112.26.1.1.targus-getdata1: Flags [.], seq 84252:85680, ack 1, win 4107, options [nop,nop,TS val 3863330 ecr 4079264,mptcp dss ack 2613390630 seq 2861451634 subseq 482665 len 1428 csum 0xad1d], length 1428
08:47:38.412248 IP 112.26.1.8.33443 > 112.26.1.1.targus-getdata1: Flags [.], seq 85680:87108, ack 1, win 4107, options [nop,nop,TS val 3863412 ecr 4079392,mptcp dss ack 2613390630 seq 2861455918 subseq 484093 len 1428 csum 0x8d50], length 1428
08:47:38.457343 IP 112.26.1.1.targus-getdata1 > 112.26.1.8.33443: Flags [.], ack 87108, win 7282, options [nop,nop,TS val 4080808 ecr 3863330,mptcp dss ack 2861407366], length 0
08:47:38.461680 IP 112.26.1.1.targus-getdata1 > 112.26.1.8.33443: Flags [.], ack 87108, win 7282, options [nop,nop,TS val 4080808 ecr 3863330,mptcp dss ack 2861407366], length 0
