10:03:35.357296 IP 112.26.0.8.39832 > 112.26.0.1.44259: Flags [S], seq 320401172, win 65535, options [mss 1460,sackOK,TS val 4294895694 ecr 0,nop,wscale 6,mptcp capable csum {0xf327a5bbfaf142aa}], length 0
10:03:35.367453 IP 112.26.0.8.39832 > 112.26.0.1.44259: Flags [S], seq 320401172, win 65535, options [mss 1460,sackOK,TS val 4294895694 ecr 0,nop,wscale 6,mptcp capable csum {0xf327a5bbfaf142aa}], length 0
10:03:35.376005 IP 112.26.0.1.44259 > 112.26.0.8.39832: Flags [S.], seq 2060943637, ack 320401173, win 65535, options [mss 1460,sackOK,TS val 146370 ecr 4294895694,nop,wscale 6,mptcp capable csum {0x72067753b755f75d}], length 0
10:03:35.464781 IP 112.26.0.1.44259 > 112.26.0.8.39832: Flags [S.], seq 2060943637, ack 320401173, win 65535, options [mss 1460,sackOK,TS val 146370 ecr 4294895694,nop,wscale 6,mptcp capable csum {0x72067753b755f75d}], length 0
10:03:35.479690 IP 112.26.0.1.44259 > 112.26.0.8.39832: Flags [S.], seq 2060943637, ack 320401173, win 65535, options [mss 1460,sackOK,TS val 146370 ecr 4294895694,nop,wscale 6,mptcp capable csum {0x72067753b755f75d}], length 0
10:03:35.561235 IP 112.26.0.8.39832 > 112.26.0.1.44259: Flags [.], ack 1, win 1369, options [nop,nop,TS val 4294895932 ecr 146370,mptcp capable csum {0xf327a5bbfaf142aa,0x72067753b755f75d},mptcp dss ack 908116359], length 0
10:03:35.565444 IP 112.26.0.1.44259 > 112.26.0.8.39832: Flags [.], ack 1, win 1339, options [nop,nop,TS val 146566 ecr 4294895932,mptcp add-addr id 3 112.26.1.1,mptcp dss ack 3516156078], length 0
10:04:14.595244 IP 112.26.0.1.44259 > 112.26.0.8.39832: Flags [.], seq 598145:599573, ack 1, win 4017, options [nop,nop,TS val 185425 ecr 4294934458,mptcp dss ack 3516156078 seq 908745919 subseq 598145 len 1428 csum 0xb9a1], length 1428
10:04:14.595598 IP 112.26.0.1.44259 > 112.26.0.8.39832: Flags [.], seq 598145:599573, ack 1, win 4017, options [nop,nop,TS val 185425 ecr 4294934458,mptcp dss ack 3516156078 seq 908745919 subseq 598145 len 1428 csum 0xb9a1], length 1428
10:04:14.600216 IP 112.26.0.1.44259 > 112.26.0.8.39832: Flags [.], seq 583865:585293, ack 1, win 4017, options [nop,nop,TS val 185024 ecr 4294934036,mptcp dss ack 3516156078 seq 908731639 subseq 583865 len 1428 csum 0x841b], length 1428
10:04:14.608621 IP 112.26.0.1.44259 > 112.26.0.8.39832: Flags [P.], seq 599573:601001, ack 1, win 4017, options [nop,nop,TS val 185425 ecr 4294934458,mptcp dss ack 3516156078 seq 908747347 subseq 599573 len 1428 csum 0x437d], length 1428
10:04:14.608927 IP 112.26.0.1.44259 > 112.26.0.8.39832: Flags [P.], seq 599573:601001, ack 1, win 4017, options [nop,nop,TS val 185425 ecr 4294934458,mptcp dss ack 3516156078 seq 908747347 subseq 599573 len 1428 csum 0x437d], length 1428
10:04:14.679531 IP 112.26.0.8.39832 > 112.26.0.1.44259: Flags [.], ack 573869, win 24410, options [nop,nop,TS val 4294934637 ecr 184604,mptcp dss ack 908721643], length 0
10:04:31.987095 IP 112.26.1.1.44259 > 112.26.0.8.46287: Flags [.], seq 657497571:657498999, ack 2308197351, win 4017, options [nop,nop,TS val 202408 ecr 4294951512,mptcp dss ack 3516156078 seq 908962975 subseq 87109 len 1428 csum 0xd16c], length 1428
10:04:31.995882 IP 112.26.0.1.44259 > 112.26.0.8.39832: Flags [.], seq 755225:756653, ack 1, win 4017, options [nop,nop,TS val 202605 ecr 4294951757,mptcp dss ack 3516156078 seq 908970115 subseq 755225 len 1428 csum 0x1903], length 1428
10:04:31.996166 IP 112.26.0.1.44259 > 112.26.0.8.39832: Flags [.], seq 755225:756653, ack 1, win 4017, options [nop,nop,TS val 202605 ecr 4294951757,mptcp dss ack 3516156078 seq 908970115 subseq 755225 len 1428 csum 0x1903], length 1428
10:04:32.007744 IP 112.26.0.8.39832 > 112.26.0.1.44259: Flags [.], ack 750941, win 24558, options [nop,nop,TS val 4294951980 ecr 201891,mptcp dss ack 908944411], length 0
10:04:32.019790 IP 112.26.0.1.44259 > 112.26.0.8.39832: Flags [.], seq 753797:755225, ack 1, win 4017, options [nop,nop,TS val 202605 ecr 4294951757,mptcp dss ack 3516156078 seq 908968687 subseq 753797 len 1428 csum 0x9048], length 1428
10:04:32.027450 IP 112.26.1.1.44259 > 112.26.0.8.46287: Flags [.], seq 1428:2856, ack 1, win 4017, options [nop,nop,TS val 202700 ecr 4294951758,mptcp dss ack 3516156078 seq 908971543 subseq 88537 len 1428 csum 0x2c62], length 1428
10:04:32.027768 IP 112.26.1.1.44259 > 112.26.0.8.46287: Flags [.], seq 1428:2856, ack 1, win 4017, options [nop,nop,TS val 202700 ecr 4294951758,mptcp dss ack 3516156078 seq 908971543 subseq 88537 len 1428 csum 0x2c62], length 1428
10:04:32.088556 IP 112.26.3.1.44259 > 112.26.0.8.35259: Flags [.], seq 722833140:722834568, ack 1497894051, win 4017, options [nop,nop,TS val 202497 ecr 4294951569,mptcp dss ack 3516156078 seq 908964403 subseq 69973 len 1428 csum 0x94de], length 1428
10:04:32.094443 IP 112.26.1.1.44259 > 112.26.0.8.46287: Flags [.], seq 2856:4284, ack 1, win 4017, options [nop,nop,TS val 202700 ecr 4294951758,mptcp dss ack 3516156078 seq 908972971 subseq 89965 len 1428 csum 0xbf8e], length 1428
10:04:32.094770 IP 112.26.1.1.44259 > 112.26.0.8.46287: Flags [.], seq 2856:4284, ack 1, win 4017, options [nop,nop,TS val 202700 ecr 4294951758,mptcp dss ack 3516156078 seq 908972971 subseq 89965 len 1428 csum 0xbf8e], length 1428
10:04:32.109388 IP 112.26.0.8.46287 > 112.26.1.1.44259: Flags [.], ack 4294955872, win 24558, options [nop,nop,TS val 4294952071 ecr 201497,nop,nop,sack 1 {4294961584:4294963012},mptcp dss ack 908944411], length 0
10:04:32.111061 IP 112.26.0.1.44259 > 112.26.0.8.39832: Flags [.], seq 755225:756653, ack 1, win 4017, options [nop,nop,TS val 202605 ecr 4294951757,mptcp dss ack 3516156078 seq 908970115 subseq 755225 len 1428 csum 0x1903], length 1428
10:04:32.126888 IP 112.26.1.1.44259 > 112.26.0.8.46287: Flags [.], seq 4284:5712, ack 1, win 4017, options [nop,nop,TS val 202700 ecr 4294951758,mptcp dss ack 3516156078 seq 908974399 subseq 91393 len 1428 csum 0x9af4], length 1428
10:04:32.127164 IP 112.26.1.1.44259 > 112.26.0.8.46287: Flags [.], seq 4284:5712, ack 1, win 4017, options [nop,nop,TS val 202700 ecr 4294951758,mptcp dss ack 3516156078 seq 908974399 subseq 91393 len 1428 csum 0x9af4], length 1428
10:04:54.220280 IP 112.26.0.8.46287 > 112.26.1.1.44259: Flags [.], ack 201348, win 24558, options [nop,nop,TS val 7011 ecr 223214,nop,nop,sack 1 {202776:212772},mptcp dss ack 909329971], length 0
10:04:54.229340 IP 112.26.0.8.46287 > 112.26.1.1.44259: Flags [.], ack 201348, win 24558, options [nop,nop,TS val 7011 ecr 223214,nop,nop,sack 1 {202776:212772},mptcp dss ack 909329971], length 0
10:04:54.234084 IP 112.26.0.8.39832 > 112.26.0.1.44259: Flags [.], ack 906593, win 24558, options [nop,nop,TS val 7085 ecr 221234,nop,nop,sack 2 {908021:926585}{928013:929441},mptcp dss ack 909329971], length 0
10:04:54.234394 IP 112.26.0.8.39832 > 112.26.0.1.44259: Flags [.], ack 906593, win 24558, options [nop,nop,TS val 7085 ecr 221234,nop,nop,sack 2 {908021:926585}{928013:929441},mptcp dss ack 909329971], length 0
10:04:54.241836 IP 112.26.1.1.44259 > 112.26.0.8.46287: Flags [.], seq 218484:219912, ack 1, win 4017, options [nop,nop,TS val 225241 ecr 7011,mptcp dss ack 3516156078 seq 909401371 subseq 305593 len 1428 csum 0x32b3], length 1428
10:04:54.242175 IP 112.26.1.1.44259 > 112.26.0.8.46287: Flags [.], seq 218484:219912, ack 1, win 4017, options [nop,nop,TS val 225241 ecr 7011,mptcp dss ack 3516156078 seq 909401371 subseq 305593 len 1428 csum 0x32b3], length 1428
10:04:54.250953 IP 112.26.0.1.44259 > 112.26.0.8.39832: Flags [.], seq 930869:932297, ack 1, win 4017, options [nop,nop,TS val 224430 ecr 5697,mptcp dss ack 3516156078 seq 909394231 subseq 930869 len 1428 csum 0x63a2], length 1428
10:04:54.320670 IP 112.26.0.1.44259 > 112.26.0.8.39832: Flags [.], seq 906593:908021, ack 1, win 4017, options [nop,nop,TS val 225241 ecr 6693,mptcp dss ack 3516156078 seq 909329971 subseq 906593 len 1428 csum 0xee6b], length 1428
10:04:54.320997 IP 112.26.0.1.44259 > 112.26.0.8.39832: Flags [.], seq 906593:908021, ack 1, win 4017, options [nop,nop,TS val 225241 ecr 6693,mptcp dss ack 3516156078 seq 909329971 subseq 906593 len 1428 csum 0xee6b], length 1428
10:04:54.332060 IP 112.26.1.1.44259 > 112.26.0.8.46287: Flags [.], seq 201348:202776, ack 1, win 4017, options [nop,nop,TS val 224731 ecr 6601,mptcp dss ack 3516156078 seq 909379951 subseq 288457 len 1428 csum 0x5ebd], length 1428
10:04:54.340547 IP 112.26.0.8.46287 > 112.26.1.1.44259: Flags [.], ack 201348, win 24558, options [nop,nop,TS val 7192 ecr 223214,nop,nop,sack 2 {214200:215628}{202776:212772},mptcp dss ack 909329971], length 0
10:04:54.341524 IP 112.26.0.8.46287 > 112.26.1.1.44259: Flags [.], ack 201348, win 24558, options [nop,nop,TS val 7192 ecr 223214,nop,nop,sack 2 {214200:215628}{202776:212772},mptcp dss ack 909329971], length 0
10:04:54.350391 IP 112.26.1.1.44259 > 112.26.0.8.46287: Flags [.], seq 212772:214200, ack 1, win 4017, options [nop,nop,TS val 225344 ecr 7192,mptcp dss ack 3516156078 seq 909392803 subseq 299881 len 1428 csum 0x6a8a], length 1428
10:04:54.350731 IP 112.26.1.1.44259 > 112.26.0.8.46287: Flags [.], seq 212772:214200, ack 1, win 4017, options [nop,nop,TS val 225344 ecr 7192,mptcp dss ack 3516156078 seq 909392803 subseq 299881 len 1428 csum 0x6a8a], length 1428
10:04:54.421073 IP 112.26.1.1.44259 > 112.26.0.8.46287: Flags [.], seq 217056:218484, ack 1, win 4017, options [nop,nop,TS val 224926 ecr 6701,mptcp dss ack 3516156078 seq 909399943 subseq 304165 len 1428 csum 0xb0c3], length 1428
10:04:54.433032 IP 112.26.0.8.46287 > 112.26.1.1.44259: Flags [.], ack 201348, win 24558, options [nop,nop,TS val 7280 ecr 223214,nop,nop,sack 2 {214200:217056}{202776:212772},mptcp dss ack 909329971], length 0
10:04:54.434010 IP 112.26.0.8.46287 > 112.26.1.1.44259: Flags [.], ack 201348, win 24558, options [nop,nop,TS val 7280 ecr 223214,nop,nop,sack 2 {214200:217056}{202776:212772},mptcp dss ack 909329971], length 0
10:04:54.451559 IP 112.26.0.1.44259 > 112.26.0.8.39832: Flags [.], seq 932297:933725, ack 1, win 4017, options [nop,nop,TS val 224731 ecr 5892,mptcp dss ack 3516156078 seq 909398515 subseq 932297 len 1428 csum 0x264c], length 1428
10:04:54.522850 IP 112.26.1.1.44259 > 112.26.0.8.46287: Flags [.], seq 219912:221340, ack 1, win 4017, options [nop,nop,TS val 225522 ecr 7280,mptcp dss ack 3516156078 seq 909402799 subseq 307021 len 1428 csum 0x5c0b], length 1428
10:04:54.523191 IP 112.26.1.1.44259 > 112.26.0.8.46287: Flags [.], seq 219912:221340, ack 1, win 4017, options [nop,nop,TS val 225522 ecr 7280,mptcp dss ack 3516156078 seq 909402799 subseq 307021 len 1428 csum 0x5c0b], length 1428
10:04:54.529738 IP 112.26.0.8.39832 > 112.26.0.1.44259: Flags [.], ack 906593, win 24558, options [nop,nop,TS val 7407 ecr 221234,nop,nop,sack 2 {930869:932297}{908021:926585},mptcp dss ack 909329971], length 0
10:04:54.530045 IP 112.26.0.8.39832 > 112.26.0.1.44259: Flags [.], ack 906593, win 24558, options [nop,nop,TS val 7407 ecr 221234,nop,nop,sack 2 {930869:932297}{908021:926585},mptcp dss ack 909329971], length 0
10:04:54.539965 IP 112.26.0.8.46287 > 112.26.1.1.44259: Flags [.], ack 212772, win 24558, options [nop,nop,TS val 7487 ecr 224731,nop,nop,sack 1 {214200:217056},mptcp dss ack 909329971], length 0
10:04:54.540816 IP 112.26.0.8.46287 > 112.26.1.1.44259: Flags [.], ack 212772, win 24558, options [nop,nop,TS val 7487 ecr 224731,nop,nop,sack 1 {214200:217056},mptcp dss ack 909329971], length 0
10:04:54.548331 IP 112.26.0.1.44259 > 112.26.0.8.39832: Flags [.], seq 933725:935153, ack 1, win 4017, options [nop,nop,TS val 225544 ecr 6792,mptcp dss ack 3516156078 seq 909404227 subseq 933725 len 1428 csum 0xbfb7], length 1428
10:04:54.548595 IP 112.26.0.1.44259 > 112.26.0.8.39832: Flags [.], seq 933725:935153, ack 1, win 4017, options [nop,nop,TS val 225544 ecr 6792,mptcp dss ack 3516156078 seq 909404227 subseq 933725 len 1428 csum 0xbfb7], length 1428
10:04:54.556852 IP 112.26.0.8.46287 > 112.26.1.1.44259: Flags [.], ack 212772, win 24558, options [nop,nop,TS val 7578 ecr 224731,nop,nop,sack 1 {214200:218484},mptcp dss ack 909329971], length 0
10:04:54.620803 IP 112.26.1.1.44259 > 112.26.0.8.46287: Flags [.], seq 221340:222768, ack 1, win 4017, options [nop,nop,TS val 225544 ecr 7487,mptcp dss ack 3516156078 seq 909405655 subseq 308449 len 1428 csum 0x4f92], length 1428
10:04:54.621133 IP 112.26.1.1.44259 > 112.26.0.8.46287: Flags [.], seq 221340:222768, ack 1, win 4017, options [nop,nop,TS val 225544 ecr 7487,mptcp dss ack 3516156078 seq 909405655 subseq 308449 len 1428 csum 0x4f92], length 1428
10:04:54.635718 IP 112.26.1.1.44259 > 112.26.0.8.46287: Flags [.], seq 218484:219912, ack 1, win 4017, options [nop,nop,TS val 225241 ecr 7011,mptcp dss ack 3516156078 seq 909401371 subseq 305593 len 1428 csum 0x32b3], length 1428
10:04:54.637040 IP 112.26.0.1.44259 > 112.26.0.8.39832: Flags [.], seq 926585:928013, ack 1, win 4017, options [nop,nop,TS val 224926 ecr 6303,mptcp dss ack 3516156078 seq 909371383 subseq 926585 len 1428 csum 0xc083], length 1428
10:04:54.645389 IP 112.26.0.8.46287 > 112.26.1.1.44259: Flags [.], ack 212772, win 24558, options [nop,nop,TS val 7578 ecr 224731,nop,nop,sack 1 {214200:218484},mptcp dss ack 909329971], length 0
10:04:54.658838 IP 112.26.1.1.44259 > 112.26.0.8.46287: Flags [.], seq 222768:224196, ack 1, win 4017, options [nop,nop,TS val 225544 ecr 7487,mptcp dss ack 3516156078 seq 909407083 subseq 309877 len 1428 csum 0xb495], length 1428
10:04:54.659176 IP 112.26.1.1.44259 > 112.26.0.8.46287: Flags [.], seq 222768:224196, ack 1, win 4017, options [nop,nop,TS val 225544 ecr 7487,mptcp dss ack 3516156078 seq 909407083 subseq 309877 len 1428 csum 0xb495], length 1428
10:04:54.666161 IP 112.26.0.8.39832 > 112.26.0.1.44259: Flags [.], ack 906593, win 24558, options [nop,nop,TS val 7608 ecr 221234,nop,nop,sack 2 {930869:933725}{908021:926585},mptcp dss ack 909329971], length 0
10:04:54.666439 IP 112.26.0.8.39832 > 112.26.0.1.44259: Flags [.], ack 906593, win 24558, options [nop,nop,TS val 7608 ecr 221234,nop,nop,sack 2 {930869:933725}{908021:926585},mptcp dss ack 909329971], length 0
10:04:54.728844 IP 112.26.0.1.44259 > 112.26.0.8.39832: Flags [.], seq 935153:936581, ack 1, win 4017, options [nop,nop,TS val 225648 ecr 7085,mptcp dss ack 3516156078 seq 909408511 subseq 935153 len 1428 csum 0x862], length 1428
10:04:54.729095 IP 112.26.0.1.44259 > 112.26.0.8.39832: Flags [.], seq 935153:936581, ack 1, win 4017, options [nop,nop,TS val 225648 ecr 7085,mptcp dss ack 3516156078 seq 909408511 subseq 935153 len 1428 csum 0x862], length 1428
10:04:54.749521 IP 112.26.1.1.44259 > 112.26.0.8.46287: Flags [.], seq 212772:214200, ack 1, win 4017, options [nop,nop,TS val 225344 ecr 7192,mptcp dss ack 3516156078 seq 909392803 subseq 299881 len 1428 csum 0x6a8a], length 1428
10:04:54.755587 IP 112.26.0.8.46287 > 112.26.1.1.44259: Flags [.], ack 212772, win 24558, options [nop,nop,TS val 7787 ecr 224731,nop,nop,sack 1 {214200:219912},mptcp dss ack 909329971], length 0
10:04:54.756538 IP 112.26.0.8.46287 > 112.26.1.1.44259: Flags [.], ack 212772, win 24558, options [nop,nop,TS val 7787 ecr 224731,nop,nop,sack 1 {214200:219912},mptcp dss ack 909329971], length 0
10:04:54.765318 IP 112.26.1.1.44259 > 112.26.0.8.46287: Flags [.], seq 224196:225624, ack 1, win 4017, options [nop,nop,TS val 225759 ecr 7578,mptcp dss ack 3516156078 seq 909409939 subseq 311305 len 1428 csum 0x1091], length 1428
10:04:54.765703 IP 112.26.1.1.44259 > 112.26.0.8.46287: Flags [.], seq 224196:225624, ack 1, win 4017, options [nop,nop,TS val 225759 ecr 7578,mptcp dss ack 3516156078 seq 909409939 subseq 311305 len 1428 csum 0x1091], length 1428
10:04:54.828783 IP 112.26.0.8.39832 > 112.26.0.1.44259: Flags [.], ack 906593, win 24558, options [nop,nop,TS val 7791 ecr 221234,nop,nop,sack 2 {908021:929441}{930869:933725},mptcp dss ack 909329971], length 0
10:04:54.829052 IP 112.26.0.8.39832 > 112.26.0.1.44259: Flags [.], ack 906593, win 24558, options [nop,nop,TS val 7791 ecr 221234,nop,nop,sack 2 {908021:929441}{930869:933725},mptcp dss ack 909329971], length 0
10:04:54.838144 IP 112.26.1.1.44259 > 112.26.0.8.46287: Flags [.], seq 219912:221340, ack 1, win 4017, options [nop,nop,TS val 225522 ecr 7280,mptcp dss ack 3516156078 seq 909402799 subseq 307021 len 1428 csum 0x5c0b], length 1428
10:04:54.847801 IP 112.26.0.1.44259 > 112.26.0.8.39832: Flags [.], seq 906593:908021, ack 1, win 4017, options [nop,nop,TS val 225241 ecr 6693,mptcp dss ack 3516156078 seq 909329971 subseq 906593 len 1428 csum 0xee6b], length 1428
10:04:54.855475 IP 112.26.0.8.39832 > 112.26.0.1.44259: Flags [.], ack 929441, win 24335, options [nop,nop,TS val 8005 ecr 225241,nop,nop,sack 1 {930869:933725},mptcp dss ack 909344251], length 0
10:04:54.858333 IP 112.26.1.1.44259 > 112.26.0.8.46287: Flags [.], seq 225624:227052, ack 1, win 4017, options [nop,nop,TS val 225858 ecr 7787,mptcp dss ack 3516156078 seq 909411367 subseq 312733 len 1428 csum 0x3c1d], length 1428
10:04:54.858687 IP 112.26.1.1.44259 > 112.26.0.8.46287: Flags [.], seq 225624:227052, ack 1, win 4017, options [nop,nop,TS val 225858 ecr 7787,mptcp dss ack 3516156078 seq 909411367 subseq 312733 len 1428 csum 0x3c1d], length 1428
10:04:54.870912 IP 112.26.0.8.46287 > 112.26.1.1.44259: Flags [.], ack 219912, win 24558, options [nop,nop,TS val 7901 ecr 225344,mptcp dss ack 909329971], length 0
10:04:54.934964 IP 112.26.0.8.46287 > 112.26.1.1.44259: Flags [.], ack 221340, win 24558, options [nop,nop,TS val 7994 ecr 225522,mptcp dss ack 909329971], length 0
10:04:54.935863 IP 112.26.0.1.44259 > 112.26.0.8.39832: Flags [.], seq 936581:938009, ack 1, win 4017, options [nop,nop,TS val 225858 ecr 8005,mptcp dss ack 3516156078 seq 909412795 subseq 936581 len 1428 csum 0xf36d], length 1428
10:04:54.936197 IP 112.26.0.1.44259 > 112.26.0.8.39832: Flags [.], seq 936581:938009, ack 1, win 4017, options [nop,nop,TS val 225858 ecr 8005,mptcp dss ack 3516156078 seq 909412795 subseq 936581 len 1428 csum 0xf36d], length 1428
10:04:54.942201 IP 112.26.0.8.46287 > 112.26.1.1.44259: Flags [.], ack 219912, win 24558, options [nop,nop,TS val 7901 ecr 225344,mptcp dss ack 909329971], length 0
10:04:54.954223 IP 112.26.0.8.46287 > 112.26.1.1.44259: Flags [.], ack 221340, win 24558, options [nop,nop,TS val 7994 ecr 225522,mptcp dss ack 909329971], length 0
10:04:54.957527 IP 112.26.0.1.44259 > 112.26.0.8.39832: Flags [.], seq 933725:935153, ack 1, win 4017, options [nop,nop,TS val 225544 ecr 6792,mptcp dss ack 3516156078 seq 909404227 subseq 933725 len 1428 csum 0xbfb7], length 1428
10:04:55.027035 IP 112.26.0.1.44259 > 112.26.0.8.39832: Flags [.], seq 938009:939437, ack 1, win 4017, options [nop,nop,TS val 225858 ecr 8005,mptcp dss ack 3516156078 seq 909414223 subseq 938009 len 1428 csum 0x78c7], length 1428
10:04:55.027326 IP 112.26.0.1.44259 > 112.26.0.8.39832: Flags [.], seq 938009:939437, ack 1, win 4017, options [nop,nop,TS val 225858 ecr 8005,mptcp dss ack 3516156078 seq 909414223 subseq 938009 len 1428 csum 0x78c7], length 1428
10:04:55.035253 IP 112.26.1.1.44259 > 112.26.0.8.46287: Flags [.], seq 221340:222768, ack 1, win 4017, options [nop,nop,TS val 225544 ecr 7487,mptcp dss ack 3516156078 seq 909405655 subseq 308449 len 1428 csum 0x4f92], length 1428
10:04:55.040180 IP 112.26.0.8.39832 > 112.26.0.1.44259: Flags [.], ack 929441, win 24335, options [nop,nop,TS val 8114 ecr 225241,nop,nop,sack 1 {930869:935153},mptcp dss ack 909344251], length 0
10:04:55.060494 IP 112.26.0.1.44259 > 112.26.0.8.39832: Flags [.], seq 939437:940865, ack 1, win 4017, options [nop,nop,TS val 225858 ecr 8005,mptcp dss ack 3516156078 seq 909415651 subseq 939437 len 1428 csum 0x21e2], length 1428
10:04:55.060791 IP 112.26.0.1.44259 > 112.26.0.8.39832: Flags [.], seq 939437:940865, ack 1, win 4017, options [nop,nop,TS val 225858 ecr 8005,mptcp dss ack 3516156078 seq 909415651 subseq 939437 len 1428 csum 0x21e2], length 1428
10:04:55.119444 IP 112.26.1.1.44259 > 112.26.0.8.46287: Flags [.], seq 222768:224196, ack 1, win 4017, options [nop,nop,TS val 225544 ecr 7487,mptcp dss ack 3516156078 seq 909407083 subseq 309877 len 1428 csum 0xb495], length 1428
10:04:55.134670 IP 112.26.0.8.46287 > 112.26.1.1.44259: Flags [.], ack 222768, win 24335, options [nop,nop,TS val 8191 ecr 225544,mptcp dss ack 909344251], length 0
10:04:55.142776 IP 112.26.0.1.44259 > 112.26.0.8.39832: Flags [.], seq 940865:942293, ack 1, win 4017, options [nop,nop,TS val 225858 ecr 8005,mptcp dss ack 3516156078 seq 909417079 subseq 940865 len 1428 csum 0xd413], length 1428
10:04:55.143058 IP 112.26.0.1.44259 > 112.26.0.8.39832: Flags [.], seq 940865:942293, ack 1, win 4017, options [nop,nop,TS val 225858 ecr 8005,mptcp dss ack 3516156078 seq 909417079 subseq 940865 len 1428 csum 0xd413], length 1428
10:04:55.155767 IP 112.26.0.8.46287 > 112.26.1.1.44259: Flags [.], ack 224196, win 24335, options [nop,nop,TS val 8277 ecr 225544,mptcp dss ack 909344251], length 0
10:04:55.159183 IP 112.26.0.1.44259 > 112.26.0.8.39832: Flags [.], seq 942293:943721, ack 1, win 4017, options [nop,nop,TS val 225858 ecr 8005,mptcp dss ack 3516156078 seq 909418507 subseq 942293 len 1428 csum 0x33c7], length 1428
10:04:55.159513 IP 112.26.0.1.44259 > 112.26.0.8.39832: Flags [.], seq 942293:943721, ack 1, win 4017, options [nop,nop,TS val 225858 ecr 8005,mptcp dss ack 3516156078 seq 909418507 subseq 942293 len 1428 csum 0x33c7], length 1428
10:04:55.234404 IP 112.26.1.1.44259 > 112.26.0.8.46287: Flags [.], seq 224196:225624, ack 1, win 4017, options [nop,nop,TS val 225759 ecr 7578,mptcp dss ack 3516156078 seq 909409939 subseq 311305 len 1428 csum 0x1091], length 1428
10:04:55.243086 IP 112.26.0.1.44259 > 112.26.0.8.39832: Flags [.], seq 943721:945149, ack 1, win 4017, options [nop,nop,TS val 225858 ecr 8005,mptcp dss ack 3516156078 seq 909419935 subseq 943721 len 1428 csum 0xbfda], length 1428
10:04:55.243410 IP 112.26.0.1.44259 > 112.26.0.8.39832: Flags [.], seq 943721:945149, ack 1, win 4017, options [nop,nop,TS val 225858 ecr 8005,mptcp dss ack 3516156078 seq 909419935 subseq 943721 len 1428 csum 0xbfda], length 1428
10:04:55.255950 IP 112.26.0.8.46287 > 112.26.1.1.44259: Flags [.], ack 225624, win 24335, options [nop,nop,TS val 8385 ecr 225759,mptcp dss ack 909344251], length 0
10:04:55.322183 IP 112.26.1.1.44259 > 112.26.0.8.46287: Flags [.], seq 225624:227052, ack 1, win 4017, options [nop,nop,TS val 225858 ecr 7787,mptcp dss ack 3516156078 seq 909411367 subseq 312733 len 1428 csum 0x3c1d], length 1428
10:04:55.335596 IP 112.26.0.1.44259 > 112.26.0.8.39832: Flags [.], seq 945149:946577, ack 1, win 4017, options [nop,nop,TS val 225858 ecr 8005,mptcp dss ack 3516156078 seq 909421363 subseq 945149 len 1428 csum 0x7eef], length 1428
10:04:55.335841 IP 112.26.0.1.44259 > 112.26.0.8.39832: Flags [.], seq 945149:946577, ack 1, win 4017, options [nop,nop,TS val 225858 ecr 8005,mptcp dss ack 3516156078 seq 909421363 subseq 945149 len 1428 csum 0x7eef], length 1428
10:04:55.348341 IP 112.26.0.1.44259 > 112.26.0.8.39832: Flags [.], ack 1, win 4017, options [nop,nop,TS val 225925 ecr 8005,mptcp dss ack 3516156078], length 0
10:04:55.348676 IP 112.26.0.1.44259 > 112.26.0.8.39832: Flags [.], ack 1, win 4017, options [nop,nop,TS val 225925 ecr 8005,mptcp dss ack 3516156078], length 0
10:04:55.353004 IP 112.26.0.8.46287 > 112.26.1.1.44259: Flags [.], ack 227052, win 24335, options [nop,nop,TS val 8479 ecr 225858,mptcp dss ack 909344251], length 0
10:04:55.369182 IP 112.26.1.1.44259 > 112.26.0.8.46287: Flags [.], seq 227052:228480, ack 1, win 4017, options [nop,nop,TS val 225944 ecr 7901,mptcp dss ack 3516156078 seq 909422791 subseq 314161 len 1428 csum 0xb95c], length 1428
10:04:55.369504 IP 112.26.1.1.44259 > 112.26.0.8.46287: Flags [.], seq 227052:228480, ack 1, win 4017, options [nop,nop,TS val 225944 ecr 7901,mptcp dss ack 3516156078 seq 909422791 subseq 314161 len 1428 csum 0xb95c], length 1428
10:04:55.370359 IP 112.26.0.1.44259 > 112.26.0.8.39832: Flags [.], seq 936581:938009, ack 1, win 4017, options [nop,nop,TS val 225858 ecr 8005,mptcp dss ack 3516156078 seq 909412795 subseq 936581 len 1428 csum 0xf36d], length 1428
10:04:55.439732 IP 112.26.0.8.39832 > 112.26.0.1.44259: Flags [.], ack 929441, win 24335, options [nop,nop,TS val 8521 ecr 225241,nop,nop,sack 2 {936581:938009}{930869:935153},mptcp dss ack 909344251], length 0
10:04:55.439999 IP 112.26.0.8.39832 > 112.26.0.1.44259: Flags [.], ack 929441, win 24335, options [nop,nop,TS val 8521 ecr 225241,nop,nop,sack 2 {936581:938009}{930869:935153},mptcp dss ack 909344251], length 0
10:04:55.458581 IP 112.26.0.1.44259 > 112.26.0.8.39832: Flags [.], seq 938009:939437, ack 1, win 4017, options [nop,nop,TS val 225858 ecr 8005,mptcp dss ack 3516156078 seq 909414223 subseq 938009 len 1428 csum 0x78c7], length 1428
10:04:55.523951 IP 112.26.1.1.44259 > 112.26.0.8.46287: Flags [.], seq 228480:229908, ack 1, win 4017, options [nop,nop,TS val 225957 ecr 7994,mptcp dss ack 3516156078 seq 909424219 subseq 315589 len 1428 csum 0x44fa], length 1428
10:04:55.524294 IP 112.26.1.1.44259 > 112.26.0.8.46287: Flags [.], seq 228480:229908, ack 1, win 4017, options [nop,nop,TS val 225957 ecr 7994,mptcp dss ack 3516156078 seq 909424219 subseq 315589 len 1428 csum 0x44fa], length 1428
10:04:55.532466 IP 112.26.0.8.39832 > 112.26.0.1.44259: Flags [.], ack 929441, win 24335, options [nop,nop,TS val 8611 ecr 225241,nop,nop,sack 2 {936581:939437}{930869:935153},mptcp dss ack 909344251], length 0
10:04:55.532764 IP 112.26.0.8.39832 > 112.26.0.1.44259: Flags [.], ack 929441, win 24335, options [nop,nop,TS val 8611 ecr 225241,nop,nop,sack 2 {936581:939437}{930869:935153},mptcp dss ack 909344251], length 0
10:04:55.537430 IP 112.26.0.1.44259 > 112.26.0.8.39832: Flags [.], seq 929441:930869, ack 1, win 4017, options [nop,nop,TS val 226043 ecr 8114,mptcp dss ack 3516156078 seq 909389947 subseq 929441 len 1428 csum 0x53], length 1428
10:04:55.537764 IP 112.26.0.1.44259 > 112.26.0.8.39832: Flags [.], seq 929441:930869, ack 1, win 4017, options [nop,nop,TS val 226043 ecr 8114,mptcp dss ack 3516156078 seq 909389947 subseq 929441 len 1428 csum 0x53], length 1428
10:04:55.547058 IP 112.26.1.1.44259 > 112.26.0.8.46287: Flags [.], seq 229908:231336, ack 1, win 4017, options [nop,nop,TS val 226137 ecr 8191,mptcp dss ack 3516156078 seq 909425647 subseq 317017 len 1428 csum 0xd47], length 1428
10:04:55.547374 IP 112.26.1.1.44259 > 112.26.0.8.46287: Flags [.], seq 229908:231336, ack 1, win 4017, options [nop,nop,TS val 226137 ecr 8191,mptcp dss ack 3516156078 seq 909425647 subseq 317017 len 1428 csum 0xd47], length 1428
10:04:55.552915 IP 112.26.0.1.44259 > 112.26.0.8.39832: Flags [.], seq 939437:940865, ack 1, win 4017, options [nop,nop,TS val 225858 ecr 8005,mptcp dss ack 3516156078 seq 909415651 subseq 939437 len 1428 csum 0x21e2], length 1428
10:04:55.626196 IP 112.26.1.1.44259 > 112.26.0.8.46287: Flags [.], seq 231336:232764, ack 1, win 4017, options [nop,nop,TS val 226158 ecr 8277,mptcp dss ack 3516156078 seq 909427075 subseq 318445 len 1428 csum 0xa1d7], length 1428
10:04:55.626481 IP 112.26.1.1.44259 > 112.26.0.8.46287: Flags [.], seq 231336:232764, ack 1, win 4017, options [nop,nop,TS val 226158 ecr 8277,mptcp dss ack 3516156078 seq 909427075 subseq 318445 len 1428 csum 0xa1d7], length 1428
10:04:55.630807 IP 112.26.0.8.39832 > 112.26.0.1.44259: Flags [.], ack 929441, win 24335, options [nop,nop,TS val 8708 ecr 225241,nop,nop,sack 2 {936581:940865}{930869:935153},mptcp dss ack 909344251], length 0
10:04:55.631161 IP 112.26.0.8.39832 > 112.26.0.1.44259: Flags [.], ack 929441, win 24335, options [nop,nop,TS val 8708 ecr 225241,nop,nop,sack 2 {936581:940865}{930869:935153},mptcp dss ack 909344251], length 0
10:04:55.645340 IP 112.26.0.1.44259 > 112.26.0.8.39832: Flags [.], seq 940865:942293, ack 1, win 4017, options [nop,nop,TS val 225858 ecr 8005,mptcp dss ack 3516156078 seq 909417079 subseq 940865 len 1428 csum 0xd413], length 1428
10:04:55.652636 IP 112.26.1.1.44259 > 112.26.0.8.46287: Flags [.], seq 232764:234192, ack 1, win 4017, options [nop,nop,TS val 226258 ecr 8385,mptcp dss ack 3516156078 seq 909428503 subseq 319873 len 1428 csum 0xf4aa], length 1428
10:04:55.652882 IP 112.26.1.1.44259 > 112.26.0.8.46287: Flags [.], seq 232764:234192, ack 1, win 4017, options [nop,nop,TS val 226258 ecr 8385,mptcp dss ack 3516156078 seq 909428503 subseq 319873 len 1428 csum 0xf4aa], length 1428
10:04:55.726460 IP 112.26.1.1.44259 > 112.26.0.8.46287: Flags [.], seq 234192:235620, ack 1, win 4017, options [nop,nop,TS val 226355 ecr 8479,mptcp dss ack 3516156078 seq 909429931 subseq 321301 len 1428 csum 0xedd2], length 1428
10:04:55.726820 IP 112.26.1.1.44259 > 112.26.0.8.46287: Flags [.], seq 234192:235620, ack 1, win 4017, options [nop,nop,TS val 226355 ecr 8479,mptcp dss ack 3516156078 seq 909429931 subseq 321301 len 1428 csum 0xedd2], length 1428
10:04:55.739658 IP 112.26.0.1.44259 > 112.26.0.8.39832: Flags [.], seq 942293:943721, ack 1, win 4017, options [nop,nop,TS val 225858 ecr 8005,mptcp dss ack 3516156078 seq 909418507 subseq 942293 len 1428 csum 0x33c7], length 1428
10:04:55.747976 IP 112.26.1.1.44259 > 112.26.0.8.46287: Flags [.], seq 235620:237048, ack 1, win 4017, options [nop,nop,TS val 226355 ecr 8479,mptcp dss ack 3516156078 seq 909431359 subseq 322729 len 1428 csum 0xe29b], length 1428
10:04:55.748217 IP 112.26.1.1.44259 > 112.26.0.8.46287: Flags [.], seq 235620:237048, ack 1, win 4017, options [nop,nop,TS val 226355 ecr 8479,mptcp dss ack 3516156078 seq 909431359 subseq 322729 len 1428 csum 0xe29b], length 1428
10:04:55.751151 IP 112.26.0.8.39832 > 112.26.0.1.44259: Flags [.], ack 929441, win 24335, options [nop,nop,TS val 8802 ecr 225241,nop,nop,sack 2 {936581:942293}{930869:935153},mptcp dss ack 909344251], length 0
10:04:55.751417 IP 112.26.0.8.39832 > 112.26.0.1.44259: Flags [.], ack 929441, win 24335, options [nop,nop,TS val 8802 ecr 225241,nop,nop,sack 2 {936581:942293}{930869:935153},mptcp dss ack 909344251], length 0
10:04:55.826970 IP 112.26.0.1.44259 > 112.26.0.8.39832: Flags [.], seq 943721:945149, ack 1, win 4017, options [nop,nop,TS val 225858 ecr 8005,mptcp dss ack 3516156078 seq 909419935 subseq 943721 len 1428 csum 0xbfda], length 1428
10:04:55.845386 IP 112.26.0.8.39832 > 112.26.0.1.44259: Flags [.], ack 929441, win 24335, options [nop,nop,TS val 8896 ecr 225241,nop,nop,sack 2 {936581:943721}{930869:935153},mptcp dss ack 909344251], length 0
10:04:55.845724 IP 112.26.0.8.39832 > 112.26.0.1.44259: Flags [.], ack 929441, win 24335, options [nop,nop,TS val 8896 ecr 225241,nop,nop,sack 2 {936581:943721}{930869:935153},mptcp dss ack 909344251], length 0
10:04:55.856847 IP 112.26.1.1.44259 > 112.26.0.8.46287: Flags [.], seq 227052:228480, ack 1, win 4017, options [nop,nop,TS val 225944 ecr 7901,mptcp dss ack 3516156078 seq 909422791 subseq 314161 len 1428 csum 0xb95c], length 1428
10:04:55.861915 IP 112.26.0.1.44259 > 112.26.0.8.39832: Flags [.], seq 945149:946577, ack 1, win 4017, options [nop,nop,TS val 225858 ecr 8005,mptcp dss ack 3516156078 seq 909421363 subseq 945149 len 1428 csum 0x7eef], length 1428
10:04:55.940669 IP 112.26.0.8.39832 > 112.26.0.1.44259: Flags [.], ack 929441, win 24335, options [nop,nop,TS val 8983 ecr 225241,nop,nop,sack 2 {936581:945149}{930869:935153},mptcp dss ack 909344251], length 0
10:04:55.940935 IP 112.26.0.8.39832 > 112.26.0.1.44259: Flags [.], ack 929441, win 24335, options [nop,nop,TS val 8983 ecr 225241,nop,nop,sack 2 {936581:945149}{930869:935153},mptcp dss ack 909344251], length 0
10:04:55.946965 IP 112.26.1.1.44259 > 112.26.0.8.46287: Flags [.], seq 228480:229908, ack 1, win 4017, options [nop,nop,TS val 225957 ecr 7994,mptcp dss ack 3516156078 seq 909424219 subseq 315589 len 1428 csum 0x44fa], length 1428
10:04:56.025484 IP 112.26.0.1.44259 > 112.26.0.8.39832: Flags [.], seq 935153:936581, ack 1, win 4017, options [nop,nop,TS val 226960 ecr 8611,mptcp dss ack 3516156078 seq 909408511 subseq 935153 len 1428 csum 0x862], length 1428
10:04:56.025815 IP 112.26.0.1.44259 > 112.26.0.8.39832: Flags [.], seq 935153:936581, ack 1, win 4017, options [nop,nop,TS val 226960 ecr 8611,mptcp dss ack 3516156078 seq 909408511 subseq 935153 len 1428 csum 0x862], length 1428
10:04:56.037521 IP 112.26.0.1.44259 > 112.26.0.8.39832: Flags [.], ack 1, win 4017, options [nop,nop,TS val 225925 ecr 8005,mptcp dss ack 3516156078], length 0
10:04:56.048221 IP 112.26.1.1.44259 > 112.26.0.8.46287: Flags [.], seq 229908:231336, ack 1, win 4017, options [nop,nop,TS val 226137 ecr 8191,mptcp dss ack 3516156078 seq 909425647 subseq 317017 len 1428 csum 0xd47], length 1428
10:04:56.060442 IP 112.26.0.8.46287 > 112.26.1.1.44259: Flags [.], ack 228480, win 24335, options [nop,nop,TS val 9013 ecr 225944,mptcp dss ack 909344251], length 0
10:04:56.061395 IP 112.26.0.8.46287 > 112.26.1.1.44259: Flags [.], ack 228480, win 24335, options [nop,nop,TS val 9013 ecr 225944,mptcp dss ack 909344251], length 0
10:04:56.125261 IP 112.26.1.1.44259 > 112.26.0.8.46287: Flags [.], seq 237048:238476, ack 1, win 4017, options [nop,nop,TS val 227063 ecr 9013,mptcp dss ack 3516156078 seq 909432787 subseq 324157 len 1428 csum 0x33b6], length 1428
10:04:56.125506 IP 112.26.1.1.44259 > 112.26.0.8.46287: Flags [.], seq 237048:238476, ack 1, win 4017, options [nop,nop,TS val 227063 ecr 9013,mptcp dss ack 3516156078 seq 909432787 subseq 324157 len 1428 csum 0x33b6], length 1428
10:04:56.133679 IP 112.26.1.1.44259 > 112.26.0.8.46287: Flags [.], seq 232764:234192, ack 1, win 4017, options [nop,nop,TS val 226258 ecr 8385,mptcp dss ack 3516156078 seq 909428503 subseq 319873 len 1428 csum 0xf4aa], length 1428
10:04:56.149448 IP 112.26.0.8.39832 > 112.26.0.1.44259: Flags [.], ack 929441, win 24335, options [nop,nop,TS val 9019 ecr 225241,nop,nop,sack 2 {936581:946577}{930869:935153},mptcp dss ack 909344251], length 0
10:04:56.149729 IP 112.26.0.8.39832 > 112.26.0.1.44259: Flags [.], ack 929441, win 24335, options [nop,nop,TS val 9019 ecr 225241,nop,nop,sack 2 {936581:946577}{930869:935153},mptcp dss ack 909344251], length 0
10:04:56.157940 IP 112.26.1.1.44259 > 112.26.0.8.46287: Flags [.], seq 234192:235620, ack 1, win 4017, options [nop,nop,TS val 226355 ecr 8479,mptcp dss ack 3516156078 seq 909429931 subseq 321301 len 1428 csum 0xedd2], length 1428
10:04:56.236736 IP 112.26.0.8.46287 > 112.26.1.1.44259: Flags [.], ack 229908, win 24335, options [nop,nop,TS val 9103 ecr 225957,mptcp dss ack 909344251], length 0
10:04:56.237922 IP 112.26.0.8.46287 > 112.26.1.1.44259: Flags [.], ack 229908, win 24335, options [nop,nop,TS val 9103 ecr 225957,mptcp dss ack 909344251], length 0
10:04:56.245141 IP 112.26.1.1.44259 > 112.26.0.8.46287: Flags [.], seq 238476:239904, ack 1, win 4017, options [nop,nop,TS val 227240 ecr 9103,mptcp dss ack 3516156078 seq 909434215 subseq 325585 len 1428 csum 0xa626], length 1428
10:04:56.245432 IP 112.26.1.1.44259 > 112.26.0.8.46287: Flags [.], seq 238476:239904, ack 1, win 4017, options [nop,nop,TS val 227240 ecr 9103,mptcp dss ack 3516156078 seq 909434215 subseq 325585 len 1428 csum 0xa626], length 1428
10:04:56.272468 IP 112.26.0.8.46287 > 112.26.1.1.44259: Flags [.], ack 231336, win 24335, options [nop,nop,TS val 9202 ecr 226137,mptcp dss ack 909344251], length 0
10:04:56.273415 IP 112.26.0.8.46287 > 112.26.1.1.44259: Flags [.], ack 231336, win 24335, options [nop,nop,TS val 9202 ecr 226137,mptcp dss ack 909344251], length 0
10:04:56.279244 IP 112.26.1.1.44259 > 112.26.0.8.46287: Flags [.], seq 239904:241332, ack 1, win 4017, options [nop,nop,TS val 227275 ecr 9202,mptcp dss ack 3516156078 seq 909435643 subseq 327013 len 1428 csum 0x80d3], length 1428
10:04:56.279542 IP 112.26.1.1.44259 > 112.26.0.8.46287: Flags [.], seq 239904:241332, ack 1, win 4017, options [nop,nop,TS val 227275 ecr 9202,mptcp dss ack 3516156078 seq 909435643 subseq 327013 len 1428 csum 0x80d3], length 1428
10:04:56.282032 IP 112.26.1.1.44259 > 112.26.0.8.46287: Flags [.], seq 235620:237048, ack 1, win 4017, options [nop,nop,TS val 226355 ecr 8479,mptcp dss ack 3516156078 seq 909431359 subseq 322729 len 1428 csum 0xe29b], length 1428
10:04:56.350022 IP 112.26.0.8.46287 > 112.26.1.1.44259: Flags [.], ack 231336, win 24335, options [nop,nop,TS val 9289 ecr 226137,nop,nop,sack 1 {232764:234192},mptcp dss ack 909344251], length 0
10:04:56.351078 IP 112.26.0.8.46287 > 112.26.1.1.44259: Flags [.], ack 231336, win 24335, options [nop,nop,TS val 9289 ecr 226137,nop,nop,sack 1 {232764:234192},mptcp dss ack 909344251], length 0
10:04:56.355125 IP 112.26.0.1.44259 > 112.26.0.8.39832: Flags [.], seq 946577:948005, ack 1, win 4017, options [nop,nop,TS val 227353 ecr 8896,mptcp dss ack 3516156078 seq 909437071 subseq 946577 len 1428 csum 0x256c], length 1428
10:04:56.355433 IP 112.26.0.1.44259 > 112.26.0.8.39832: Flags [.], seq 946577:948005, ack 1, win 4017, options [nop,nop,TS val 227353 ecr 8896,mptcp dss ack 3516156078 seq 909437071 subseq 946577 len 1428 csum 0x256c], length 1428
10:04:56.432468 IP 112.26.0.8.46287 > 112.26.1.1.44259: Flags [.], ack 231336, win 24335, options [nop,nop,TS val 9314 ecr 226137,nop,nop,sack 1 {232764:235620},mptcp dss ack 909344251], length 0
10:04:56.439266 IP 112.26.0.1.44259 > 112.26.0.8.39832: Flags [.], seq 948005:949433, ack 1, win 4017, options [nop,nop,TS val 227353 ecr 8896,mptcp dss ack 3516156078 seq 909438499 subseq 948005 len 1428 csum 0xc0a4], length 1428
10:04:56.439552 IP 112.26.0.1.44259 > 112.26.0.8.39832: Flags [.], seq 948005:949433, ack 1, win 4017, options [nop,nop,TS val 227353 ecr 8896,mptcp dss ack 3516156078 seq 909438499 subseq 948005 len 1428 csum 0xc0a4], length 1428
10:04:56.451200 IP 112.26.0.8.46287 > 112.26.1.1.44259: Flags [.], ack 231336, win 24335, options [nop,nop,TS val 9439 ecr 226137,nop,nop,sack 1 {232764:237048},mptcp dss ack 909344251], length 0
10:04:56.453836 IP 112.26.0.8.46287 > 112.26.1.1.44259: Flags [.], ack 231336, win 24335, options [nop,nop,TS val 9314 ecr 226137,nop,nop,sack 1 {232764:235620},mptcp dss ack 909344251], length 0
10:04:56.465829 IP 112.26.0.1.44259 > 112.26.0.8.39832: Flags [.], seq 949433:950861, ack 1, win 4017, options [nop,nop,TS val 227353 ecr 8896,mptcp dss ack 3516156078 seq 909439927 subseq 949433 len 1428 csum 0xc2e4], length 1428
10:04:56.466129 IP 112.26.0.1.44259 > 112.26.0.8.39832: Flags [.], seq 949433:950861, ack 1, win 4017, options [nop,nop,TS val 227353 ecr 8896,mptcp dss ack 3516156078 seq 909439927 subseq 949433 len 1428 csum 0xc2e4], length 1428
10:04:56.471767 IP 112.26.0.1.44259 > 112.26.0.8.39832: Flags [.], seq 935153:936581, ack 1, win 4017, options [nop,nop,TS val 226960 ecr 8611,mptcp dss ack 3516156078 seq 909408511 subseq 935153 len 1428 csum 0x862], length 1428
10:04:56.544429 IP 112.26.1.1.44259 > 112.26.0.8.46287: Flags [.], seq 237048:238476, ack 1, win 4017, options [nop,nop,TS val 227063 ecr 9013,mptcp dss ack 3516156078 seq 909432787 subseq 324157 len 1428 csum 0x33b6], length 1428
10:04:56.549829 IP 112.26.0.8.46287 > 112.26.1.1.44259: Flags [.], ack 231336, win 24335, options [nop,nop,TS val 9439 ecr 226137,nop,nop,sack 1 {232764:237048},mptcp dss ack 909344251], length 0
10:04:56.558500 IP 112.26.1.1.44259 > 112.26.0.8.46287: Flags [.], seq 241332:242760, ack 1, win 4017, options [nop,nop,TS val 227353 ecr 9289,mptcp dss ack 3516156078 seq 909441355 subseq 328441 len 1428 csum 0x6a3], length 1428
10:04:56.558747 IP 112.26.1.1.44259 > 112.26.0.8.46287: Flags [.], seq 241332:242760, ack 1, win 4017, options [nop,nop,TS val 227353 ecr 9289,mptcp dss ack 3516156078 seq 909441355 subseq 328441 len 1428 csum 0x6a3], length 1428
10:04:56.575784 IP 112.26.0.8.39832 > 112.26.0.1.44259: Flags [.], ack 929441, win 24335, options [nop,nop,TS val 9627 ecr 225241,nop,nop,sack 1 {930869:946577},mptcp dss ack 909344251], length 0
10:04:56.630193 IP 112.26.0.1.44259 > 112.26.0.8.39832: Flags [.], seq 950861:952289, ack 1, win 4017, options [nop,nop,TS val 227457 ecr 8983,mptcp dss ack 3516156078 seq 909442783 subseq 950861 len 1428 csum 0x7bcd], length 1428
