10:03:35.347083 IP 112.26.0.8.39832 > 112.26.0.1.44259: Flags [S], seq 320401172, win 65535, options [mss 1460,sackOK,TS val 4294895694 ecr 0,nop,wscale 6,mptcp capable csum {0xf327a5bbfaf142aa}], length 0
10:03:35.355519 IP 112.26.0.8.39832 > 112.26.0.1.44259: Flags [S], seq 320401172, win 65535, options [mss 1460,sackOK,TS val 4294895694 ecr 0,nop,wscale 6,mptcp capable csum {0xf327a5bbfaf142aa}], length 0
10:03:35.367905 IP 112.26.0.8.39832 > 112.26.0.1.44259: Flags [S], seq 320401172, win 65535, options [mss 1460,sackOK,TS val 4294895694 ecr 0,nop,wscale 6,mptcp capable csum {0xf327a5bbfaf142aa}], length 0
10:03:35.465100 IP 112.26.0.1.44259 > 112.26.0.8.39832: Flags [S.], seq 2060943637, ack 320401173, win 65535, options [mss 1460,sackOK,TS val 146370 ecr 4294895694,nop,wscale 6,mptcp capable csum {0x72067753b755f75d}], length 0
10:03:35.479358 IP 112.26.0.1.44259 > 112.26.0.8.39832: Flags [S.], seq 2060943637, ack 320401173, win 65535, options [mss 1460,sackOK,TS val 146370 ecr 4294895694,nop,wscale 6,mptcp capable csum {0x72067753b755f75d}], length 0
10:03:35.550322 IP 112.26.0.8.39832 > 112.26.0.1.44259: Flags [.], ack 1, win 1369, options [nop,nop,TS val 4294895932 ecr 146370,mptcp capable csum {0xf327a5bbfaf142aa,0x72067753b755f75d},mptcp dss ack 908116359], length 0
10:03:35.550726 IP 112.26.0.8.39832 > 112.26.0.1.44259: Flags [.], ack 1, win 1369, options [nop,nop,TS val 4294895932 ecr 146370,mptcp capable csum {0xf327a5bbfaf142aa,0x72067753b755f75d},mptcp dss ack 908116359], length 0
10:04:14.577185 IP 112.26.0.1.44259 > 112.26.0.8.39832: Flags [.], seq 583865:585293, ack 1, win 4017, options [nop,nop,TS val 185024 ecr 4294934036,mptcp dss ack 3516156078 seq 908731639 subseq 583865 len 1428 csum 0x841b], length 1428
10:04:14.581163 IP 112.26.0.8.39832 > 112.26.0.1.44259: Flags [.], ack 573869, win 24576, options [nop,nop,TS val 4294935030 ecr 184604,nop,nop,sack 2 {583865:585293}{575297:581009},mptcp dss ack 908721643], length 0
10:04:14.617891 IP 112.26.0.1.44259 > 112.26.0.8.39832: Flags [.], seq 586721:588149, ack 1, win 4017, options [nop,nop,TS val 185024 ecr 4294934036,mptcp dss ack 3516156078 seq 908734495 subseq 586721 len 1428 csum 0x9c06], length 1428
10:04:14.680185 IP 112.26.0.8.39832 > 112.26.0.1.44259: Flags [.], ack 573869, win 24410, options [nop,nop,TS val 4294934637 ecr 184604,mptcp dss ack 908721643], length 0
10:04:14.691477 IP 112.26.0.8.39832 > 112.26.0.1.44259: Flags [.], ack 573869, win 24576, options [nop,nop,TS val 4294935030 ecr 184604,nop,nop,sack 2 {583865:585293}{575297:581009},mptcp dss ack 908721643], length 0
10:04:14.698228 IP 112.26.0.1.44259 > 112.26.0.8.39832: Flags [.], seq 588149:589577, ack 1, win 4017, options [nop,nop,TS val 185024 ecr 4294934036,mptcp dss ack 3516156078 seq 908735923 subseq 588149 len 1428 csum 0xba83], length 1428
10:04:14.707018 IP 112.26.0.8.39832 > 112.26.0.1.44259: Flags [.], ack 573869, win 24455, options [nop,nop,TS val 4294934662 ecr 184604,nop,nop,sack 1 {575297:576725},mptcp dss ack 908721643], length 0
10:04:14.711658 IP 112.26.0.1.44259 > 112.26.0.8.39832: Flags [.], seq 586721:588149, ack 1, win 4017, options [nop,nop,TS val 185024 ecr 4294934036,mptcp dss ack 3516156078 seq 908734495 subseq 586721 len 1428 csum 0x9c06], length 1428
10:04:14.713274 IP 112.26.0.8.39832 > 112.26.0.1.44259: Flags [.], ack 573869, win 24576, options [nop,nop,TS val 4294935165 ecr 184604,nop,nop,sack 2 {586721:588149}{583865:585293},mptcp dss ack 908721643], length 0
10:04:14.792033 IP 112.26.0.1.44259 > 112.26.0.8.39832: Flags [.], seq 591005:592433, ack 1, win 4017, options [nop,nop,TS val 185097 ecr 4294934067,mptcp dss ack 3516156078 seq 908738779 subseq 591005 len 1428 csum 0xe61], length 1428
10:04:14.799891 IP 112.26.0.1.44259 > 112.26.0.8.39832: Flags [.], seq 588149:589577, ack 1, win 4017, options [nop,nop,TS val 185024 ecr 4294934036,mptcp dss ack 3516156078 seq 908735923 subseq 588149 len 1428 csum 0xba83], length 1428
10:04:14.802812 IP 112.26.0.8.39832 > 112.26.0.1.44259: Flags [.], ack 573869, win 24501, options [nop,nop,TS val 4294934745 ecr 184604,nop,nop,sack 1 {575297:578153},mptcp dss ack 908721643], length 0
10:04:14.808446 IP 112.26.0.8.39832 > 112.26.0.1.44259: Flags [.], ack 573869, win 24576, options [nop,nop,TS val 4294935253 ecr 184604,nop,nop,sack 2 {586721:589577}{583865:585293},mptcp dss ack 908721643], length 0
10:04:14.829259 IP 112.26.0.8.39832 > 112.26.0.1.44259: Flags [.], ack 573869, win 24547, options [nop,nop,TS val 4294934771 ecr 184604,nop,nop,sack 1 {575297:579581},mptcp dss ack 908721643], length 0
10:04:14.884445 IP 112.26.0.1.44259 > 112.26.0.8.39832: Flags [.], seq 592433:593861, ack 1, win 4017, options [nop,nop,TS val 185177 ecr 4294934158,mptcp dss ack 3516156078 seq 908740207 subseq 592433 len 1428 csum 0x7de], length 1428
10:04:14.902114 IP 112.26.0.8.39832 > 112.26.0.1.44259: Flags [.], ack 573869, win 24576, options [nop,nop,TS val 4294934858 ecr 184604,nop,nop,sack 1 {575297:581009},mptcp dss ack 908721643], length 0
10:04:14.908910 IP 112.26.0.1.44259 > 112.26.0.8.39832: Flags [.], seq 593861:595289, ack 1, win 4017, options [nop,nop,TS val 185276 ecr 4294934240,mptcp dss ack 3516156078 seq 908741635 subseq 593861 len 1428 csum 0x5df9], length 1428
10:04:14.918460 IP 112.26.0.8.39832 > 112.26.0.1.44259: Flags [.], ack 573869, win 24576, options [nop,nop,TS val 4294935165 ecr 184604,nop,nop,sack 2 {586721:588149}{583865:585293},mptcp dss ack 908721643], length 0
10:04:15.002737 IP 112.26.0.1.44259 > 112.26.0.8.39832: Flags [.], seq 591005:592433, ack 1, win 4017, options [nop,nop,TS val 185097 ecr 4294934067,mptcp dss ack 3516156078 seq 908738779 subseq 591005 len 1428 csum 0xe61], length 1428
10:04:15.005519 IP 112.26.0.8.39832 > 112.26.0.1.44259: Flags [.], ack 573869, win 24576, options [nop,nop,TS val 4294935455 ecr 184604,nop,nop,sack 2 {591005:592433}{586721:589577},mptcp dss ack 908721643], length 0
10:04:15.011301 IP 112.26.0.1.44259 > 112.26.0.8.39832: Flags [.], seq 596717:598145, ack 1, win 4017, options [nop,nop,TS val 185328 ecr 4294934326,mptcp dss ack 3516156078 seq 908744491 subseq 596717 len 1428 csum 0x9825], length 1428
10:04:15.090567 IP 112.26.0.8.39832 > 112.26.0.1.44259: Flags [.], ack 573869, win 24576, options [nop,nop,TS val 4294935253 ecr 184604,nop,nop,sack 2 {586721:589577}{583865:585293},mptcp dss ack 908721643], length 0
10:04:15.096187 IP 112.26.0.1.44259 > 112.26.0.8.39832: Flags [P.], seq 599573:601001, ack 1, win 4017, options [nop,nop,TS val 185425 ecr 4294934458,mptcp dss ack 3516156078 seq 908747347 subseq 599573 len 1428 csum 0x437d], length 1428
10:04:15.116947 IP 112.26.0.1.44259 > 112.26.0.8.39832: Flags [.], seq 592433:593861, ack 1, win 4017, options [nop,nop,TS val 185177 ecr 4294934158,mptcp dss ack 3516156078 seq 908740207 subseq 592433 len 1428 csum 0x7de], length 1428
10:04:15.122258 IP 112.26.0.8.39832 > 112.26.0.1.44259: Flags [.], ack 573869, win 24576, options [nop,nop,TS val 4294935570 ecr 184604,nop,nop,sack 2 {591005:593861}{586721:589577},mptcp dss ack 908721643], length 0
10:04:15.126915 IP 112.26.0.1.44259 > 112.26.0.8.39832: Flags [.], seq 601001:602429, ack 1, win 4017, options [nop,nop,TS val 185425 ecr 4294934458,mptcp dss ack 3516156078 seq 908748775 subseq 601001 len 1428 csum 0x61e], length 1428
10:04:15.191826 IP 112.26.0.1.44259 > 112.26.0.8.39832: Flags [.], seq 593861:595289, ack 1, win 4017, options [nop,nop,TS val 185276 ecr 4294934240,mptcp dss ack 3516156078 seq 908741635 subseq 593861 len 1428 csum 0x5df9], length 1428
10:04:15.195742 IP 112.26.0.8.39832 > 112.26.0.1.44259: Flags [.], ack 573869, win 24576, options [nop,nop,TS val 4294935645 ecr 184604,nop,nop,sack 2 {591005:595289}{586721:589577},mptcp dss ack 908721643], length 0
10:04:15.197256 IP 112.26.0.1.44259 > 112.26.0.8.39832: Flags [.], seq 602429:603857, ack 1, win 4017, options [nop,nop,TS val 185512 ecr 4294934555,mptcp dss ack 3516156078 seq 908750203 subseq 602429 len 1428 csum 0x9db9], length 1428
10:04:15.212046 IP 112.26.0.1.44259 > 112.26.0.8.39832: Flags [.], seq 603857:605285, ack 1, win 4017, options [nop,nop,TS val 185512 ecr 4294934555,mptcp dss ack 3516156078 seq 908751631 subseq 603857 len 1428 csum 0x1e4], length 1428
10:04:15.297405 IP 112.26.0.1.44259 > 112.26.0.8.39832: Flags [.], seq 605285:606713, ack 1, win 4017, options [nop,nop,TS val 185682 ecr 4294934637,mptcp dss ack 3516156078 seq 908753059 subseq 605285 len 1428 csum 0x4342], length 1428
10:04:15.304561 IP 112.26.0.1.44259 > 112.26.0.8.39832: Flags [.], seq 606713:608141, ack 1, win 4017, options [nop,nop,TS val 185805 ecr 4294934662,mptcp dss ack 3516156078 seq 908754487 subseq 606713 len 1428 csum 0xa051], length 1428
10:04:15.310088 IP 112.26.0.8.39832 > 112.26.0.1.44259: Flags [.], ack 573869, win 24576, options [nop,nop,TS val 4294935455 ecr 184604,nop,nop,sack 2 {591005:592433}{586721:589577},mptcp dss ack 908721643], length 0
10:04:15.395331 IP 112.26.0.1.44259 > 112.26.0.8.39832: Flags [.], seq 608141:609569, ack 1, win 4017, options [nop,nop,TS val 185805 ecr 4294934662,mptcp dss ack 3516156078 seq 908755915 subseq 608141 len 1428 csum 0x6f2f], length 1428
10:04:15.400777 IP 112.26.0.1.44259 > 112.26.0.8.39832: Flags [.], seq 596717:598145, ack 1, win 4017, options [nop,nop,TS val 185328 ecr 4294934326,mptcp dss ack 3516156078 seq 908744491 subseq 596717 len 1428 csum 0x9825], length 1428
10:04:15.402837 IP 112.26.0.8.39832 > 112.26.0.1.44259: Flags [.], ack 573869, win 24576, options [nop,nop,TS val 4294935854 ecr 184604,nop,nop,sack 2 {596717:598145}{591005:595289},mptcp dss ack 908721643], length 0
10:04:15.408456 IP 112.26.0.8.39832 > 112.26.0.1.44259: Flags [.], ack 573869, win 24576, options [nop,nop,TS val 4294935165 ecr 184604,nop,nop,sack 2 {586721:588149}{583865:585293},mptcp dss ack 908721643], length 0
10:04:15.422251 IP 112.26.0.1.44259 > 112.26.0.8.39832: Flags [P.], seq 599573:601001, ack 1, win 4017, options [nop,nop,TS val 185425 ecr 4294934458,mptcp dss ack 3516156078 seq 908747347 subseq 599573 len 1428 csum 0x437d], length 1428
10:04:15.484339 IP 112.26.0.8.39832 > 112.26.0.1.44259: Flags [.], ack 573869, win 24576, options [nop,nop,TS val 4294935875 ecr 184604,nop,nop,sack 2 {599573:601001}{596717:598145},mptcp dss ack 908721643], length 0
10:04:15.499300 IP 112.26.0.1.44259 > 112.26.0.8.39832: Flags [.], seq 610997:612425, ack 1, win 4017, options [nop,nop,TS val 185904 ecr 4294934771,mptcp dss ack 3516156078 seq 908758771 subseq 610997 len 1428 csum 0x3e3c], length 1428
10:04:15.506722 IP 112.26.0.8.39832 > 112.26.0.1.44259: Flags [.], ack 573869, win 24576, options [nop,nop,TS val 4294935570 ecr 184604,nop,nop,sack 2 {591005:593861}{586721:589577},mptcp dss ack 908721643], length 0
10:04:15.512416 IP 112.26.0.1.44259 > 112.26.0.8.39832: Flags [.], seq 573869:575297, ack 1, win 4017, options [nop,nop,TS val 186048 ecr 4294934858,mptcp dss ack 3516156078 seq 908721643 subseq 573869 len 1428 csum 0x778d], length 1428
10:04:15.518702 IP 112.26.0.1.44259 > 112.26.0.8.39832: Flags [.], seq 601001:602429, ack 1, win 4017, options [nop,nop,TS val 185425 ecr 4294934458,mptcp dss ack 3516156078 seq 908748775 subseq 601001 len 1428 csum 0x61e], length 1428
10:04:15.583903 IP 112.26.0.8.39832 > 112.26.0.1.44259: Flags [.], ack 573869, win 24576, options [nop,nop,TS val 4294935972 ecr 184604,nop,nop,sack 2 {599573:602429}{596717:598145},mptcp dss ack 908721643], length 0
10:04:15.596136 IP 112.26.0.8.39832 > 112.26.0.1.44259: Flags [.], ack 573869, win 24576, options [nop,nop,TS val 4294935455 ecr 184604,nop,nop,sack 2 {591005:592433}{586721:589577},mptcp dss ack 908721643], length 0
10:04:15.603501 IP 112.26.0.8.39832 > 112.26.0.1.44259: Flags [.], ack 573869, win 24576, options [nop,nop,TS val 4294935645 ecr 184604,nop,nop,sack 2 {591005:595289}{586721:589577},mptcp dss ack 908721643], length 0
10:04:15.685944 IP 112.26.0.1.44259 > 112.26.0.8.39832: Flags [.], seq 602429:603857, ack 1, win 4017, options [nop,nop,TS val 185512 ecr 4294934555,mptcp dss ack 3516156078 seq 908750203 subseq 602429 len 1428 csum 0x9db9], length 1428
10:04:15.689404 IP 112.26.0.8.39832 > 112.26.0.1.44259: Flags [.], ack 573869, win 24576, options [nop,nop,TS val 4294936139 ecr 184604,nop,nop,sack 2 {599573:603857}{596717:598145},mptcp dss ack 908721643], length 0
10:04:15.696952 IP 112.26.0.1.44259 > 112.26.0.8.39832: Flags [.], seq 581009:582437, ack 1, win 4017, options [nop,nop,TS val 186411 ecr 4294935165,mptcp dss ack 3516156078 seq 908728783 subseq 581009 len 1428 csum 0x20dc], length 1428
10:04:15.703428 IP 112.26.0.1.44259 > 112.26.0.8.39832: Flags [.], seq 603857:605285, ack 1, win 4017, options [nop,nop,TS val 185512 ecr 4294934555,mptcp dss ack 3516156078 seq 908751631 subseq 603857 len 1428 csum 0x1e4], length 1428
10:04:15.710613 IP 112.26.0.8.39832 > 112.26.0.1.44259: Flags [.], ack 573869, win 24576, options [nop,nop,TS val 4294936156 ecr 184604,nop,nop,sack 2 {599573:605285}{596717:598145},mptcp dss ack 908721643], length 0
10:04:15.714691 IP 112.26.0.1.44259 > 112.26.0.8.39832: Flags [.], seq 582437:583865, ack 1, win 4017, options [nop,nop,TS val 186411 ecr 4294935165,mptcp dss ack 3516156078 seq 908730211 subseq 582437 len 1428 csum 0x23d5], length 1428
10:04:15.719371 IP 112.26.0.1.44259 > 112.26.0.8.39832: Flags [.], seq 605285:606713, ack 1, win 4017, options [nop,nop,TS val 185682 ecr 4294934637,mptcp dss ack 3516156078 seq 908753059 subseq 605285 len 1428 csum 0x4342], length 1428
10:04:15.789118 IP 112.26.0.8.39832 > 112.26.0.1.44259: Flags [.], ack 573869, win 24576, options [nop,nop,TS val 4294936172 ecr 184604,nop,nop,sack 2 {599573:606713}{596717:598145},mptcp dss ack 908721643], length 0
10:04:15.798048 IP 112.26.0.8.39832 > 112.26.0.1.44259: Flags [.], ack 573869, win 24576, options [nop,nop,TS val 4294935570 ecr 184604,nop,nop,sack 2 {591005:593861}{586721:589577},mptcp dss ack 908721643], length 0
10:04:15.809581 IP 112.26.0.1.44259 > 112.26.0.8.39832: Flags [.], seq 606713:608141, ack 1, win 4017, options [nop,nop,TS val 185805 ecr 4294934662,mptcp dss ack 3516156078 seq 908754487 subseq 606713 len 1428 csum 0xa051], length 1428
10:04:15.811627 IP 112.26.0.8.39832 > 112.26.0.1.44259: Flags [.], ack 573869, win 24576, options [nop,nop,TS val 4294936262 ecr 184604,nop,nop,sack 2 {599573:608141}{596717:598145},mptcp dss ack 908721643], length 0
10:04:15.817713 IP 112.26.0.1.44259 > 112.26.0.8.39832: Flags [.], seq 585293:586721, ack 1, win 4017, options [nop,nop,TS val 186597 ecr 4294935455,mptcp dss ack 3516156078 seq 908733067 subseq 585293 len 1428 csum 0x1e87], length 1428
10:04:15.901743 IP 112.26.0.8.39832 > 112.26.0.1.44259: Flags [.], ack 573869, win 24576, options [nop,nop,TS val 4294935645 ecr 184604,nop,nop,sack 2 {591005:595289}{586721:589577},mptcp dss ack 908721643], length 0
10:04:15.914316 IP 112.26.0.8.39832 > 112.26.0.1.44259: Flags [.], ack 573869, win 24576, options [nop,nop,TS val 4294935875 ecr 184604,nop,nop,sack 2 {599573:601001}{596717:598145},mptcp dss ack 908721643], length 0
10:04:15.917984 IP 112.26.0.1.44259 > 112.26.0.8.39832: Flags [.], seq 589577:591005, ack 1, win 4017, options [nop,nop,TS val 186801 ecr 4294935570,mptcp dss ack 3516156078 seq 908737351 subseq 589577 len 1428 csum 0x1600], length 1428
10:04:15.992596 IP 112.26.0.1.44259 > 112.26.0.8.39832: Flags [.], seq 610997:612425, ack 1, win 4017, options [nop,nop,TS val 185904 ecr 4294934771,mptcp dss ack 3516156078 seq 908758771 subseq 610997 len 1428 csum 0x3e3c], length 1428
10:04:15.995167 IP 112.26.0.8.39832 > 112.26.0.1.44259: Flags [.], ack 573869, win 24576, options [nop,nop,TS val 4294936445 ecr 184604,nop,nop,sack 2 {610997:612425}{599573:608141},mptcp dss ack 908721643], length 0
10:04:16.014026 IP 112.26.0.1.44259 > 112.26.0.8.39832: Flags [.], seq 573869:575297, ack 1, win 4017, options [nop,nop,TS val 186048 ecr 4294934858,mptcp dss ack 3516156078 seq 908721643 subseq 573869 len 1428 csum 0x778d], length 1428
10:04:16.019340 IP 112.26.0.8.39832 > 112.26.0.1.44259: Flags [.], ack 581009, win 24496, options [nop,nop,TS val 4294936467 ecr 186048,nop,nop,sack 2 {610997:612425}{599573:608141},mptcp dss ack 908728783], length 0
10:04:16.026832 IP 112.26.2.1.44259 > 112.26.0.8.41345: Flags [.], seq 2140590676:2140592104, ack 388865366, win 4017, options [nop,nop,TS val 186880 ecr 4294916715,mptcp dss ack 3516156078 seq 908327515 subseq 9997 len 1428 csum 0x70f5], length 1428
10:04:16.027197 IP 112.26.2.1.44259 > 112.26.0.8.41345: Flags [.], seq 0:1428, ack 1, win 4017, options [nop,nop,TS val 186880 ecr 4294916715,mptcp dss ack 3516156078 seq 908327515 subseq 9997 len 1428 csum 0x70f5], length 1428
10:04:16.094908 IP 112.26.0.8.41345 > 112.26.2.1.44259: Flags [.], ack 1428, win 24576, options [nop,nop,TS val 4294936481 ecr 186880,nop,nop,sack 1 {0:1428},mptcp dss ack 908728783], length 0
10:04:16.186674 IP 112.26.0.8.39832 > 112.26.0.1.44259: Flags [.], ack 573869, win 24576, options [nop,nop,TS val 4294936139 ecr 184604,nop,nop,sack 2 {599573:603857}{596717:598145},mptcp dss ack 908721643], length 0
10:04:16.199486 IP 112.26.1.1.44259 > 112.26.0.8.46287: Flags [.], seq 657411891:657413319, ack 2308197351, win 4017, options [nop,nop,TS val 186880 ecr 4294906271,mptcp dss ack 3516156078 seq 908301811 subseq 1429 len 1428 csum 0x3c97], length 1428
10:04:16.199874 IP 112.26.1.1.44259 > 112.26.0.8.46287: Flags [.], seq 0:1428, ack 1, win 4017, options [nop,nop,TS val 186880 ecr 4294906271,mptcp dss ack 3516156078 seq 908301811 subseq 1429 len 1428 csum 0x3c97], length 1428
10:04:16.203129 IP 112.26.0.8.46287 > 112.26.1.1.44259: Flags [.], ack 1428, win 24576, options [nop,nop,TS val 4294936654 ecr 186880,mptcp dss ack 908728783], length 0
10:04:35.313900 IP 112.26.0.1.44259 > 112.26.0.8.39832: Flags [.], seq 778073:779501, ack 1, win 4017, options [nop,nop,TS val 205727 ecr 4294954670,mptcp dss ack 3516156078 seq 909041515 subseq 778073 len 1428 csum 0x25fc], length 1428
10:04:35.315850 IP 112.26.0.1.44259 > 112.26.0.8.39832: Flags [.], seq 778073:779501, ack 1, win 4017, options [nop,nop,TS val 205727 ecr 4294954670,mptcp dss ack 3516156078 seq 909041515 subseq 778073 len 1428 csum 0x25fc], length 1428
10:04:35.318698 IP 112.26.0.8.39832 > 112.26.0.1.44259: Flags [.], ack 779501, win 24378, options [nop,nop,TS val 4294955769 ecr 205727,mptcp dss ack 908967259], length 0
10:04:35.343413 IP 112.26.0.8.46287 > 112.26.1.1.44259: Flags [.], ack 114240, win 24378, options [nop,nop,TS val 4294955382 ecr 205200,mptcp dss ack 908967259], length 0
10:04:53.852842 IP 112.26.1.1.44259 > 112.26.0.8.46287: Flags [.], seq 297024:298452, ack 1, win 4017, options [nop,nop,TS val 224340 ecr 5972,mptcp dss ack 3516156078 seq 909391375 subseq 298453 len 1428 csum 0xce81], length 1428
10:04:53.853188 IP 112.26.1.1.44259 > 112.26.0.8.46287: Flags [.], seq 297024:298452, ack 1, win 4017, options [nop,nop,TS val 224340 ecr 5972,mptcp dss ack 3516156078 seq 909391375 subseq 298453 len 1428 csum 0xce81], length 1428
10:04:53.856052 IP 112.26.0.8.46287 > 112.26.1.1.44259: Flags [.], ack 287028, win 24558, options [nop,nop,TS val 7011 ecr 223214,nop,nop,sack 1 {288456:298452},mptcp dss ack 909329971], length 0
10:04:53.923501 IP 112.26.0.8.39832 > 112.26.0.1.44259: Flags [.], ack 906593, win 24558, options [nop,nop,TS val 6303 ecr 221234,nop,nop,sack 2 {928013:929441}{918017:926585},mptcp dss ack 909329971], length 0
10:04:53.928174 IP 112.26.0.1.44259 > 112.26.0.8.39832: Flags [.], seq 916589:918017, ack 1, win 4017, options [nop,nop,TS val 224112 ecr 5484,mptcp dss ack 3516156078 seq 909341395 subseq 916589 len 1428 csum 0xa4a2], length 1428
10:04:53.938192 IP 112.26.0.8.39832 > 112.26.0.1.44259: Flags [.], ack 906593, win 24558, options [nop,nop,TS val 7085 ecr 221234,nop,nop,sack 2 {908021:926585}{928013:929441},mptcp dss ack 909329971], length 0
10:04:53.943148 IP 112.26.0.8.35259 > 112.26.3.1.44259: Flags [.], ack 722880264, win 24558, options [nop,nop,TS val 6784 ecr 220320,nop,nop,sack 2 {5713:7141}{5713:7141},mptcp dss ack 909329971], length 0
10:04:53.964295 IP 112.26.0.1.44259 > 112.26.0.8.39832: Flags [.], seq 930869:932297, ack 1, win 4017, options [nop,nop,TS val 224430 ecr 5697,mptcp dss ack 3516156078 seq 909394231 subseq 930869 len 1428 csum 0x63a2], length 1428
10:04:54.020280 IP 112.26.0.8.39832 > 112.26.0.1.44259: Flags [.], ack 906593, win 24558, options [nop,nop,TS val 6792 ecr 221234,nop,nop,sack 2 {908021:916589}{928013:929441},mptcp dss ack 909329971], length 0
10:04:54.034045 IP 112.26.1.1.44259 > 112.26.0.8.46287: Flags [.], seq 299880:301308, ack 1, win 4017, options [nop,nop,TS val 224514 ecr 6105,mptcp dss ack 3516156078 seq 909395659 subseq 301309 len 1428 csum 0x28ba], length 1428
10:04:54.034287 IP 112.26.1.1.44259 > 112.26.0.8.46287: Flags [.], seq 299880:301308, ack 1, win 4017, options [nop,nop,TS val 224514 ecr 6105,mptcp dss ack 3516156078 seq 909395659 subseq 301309 len 1428 csum 0x28ba], length 1428
10:04:54.037260 IP 112.26.0.8.46287 > 112.26.1.1.44259: Flags [.], ack 287028, win 24558, options [nop,nop,TS val 7192 ecr 223214,nop,nop,sack 2 {299880:301308}{288456:298452},mptcp dss ack 909329971], length 0
10:04:54.047027 IP 112.26.0.8.46287 > 112.26.1.1.44259: Flags [.], ack 287028, win 24558, options [nop,nop,TS val 6893 ecr 223214,nop,nop,sack 1 {288456:295596},mptcp dss ack 909329971], length 0
10:05:10.132810 IP 112.26.1.1.44259 > 112.26.0.8.46287: Flags [.], seq 454104:455532, ack 1, win 4017, options [nop,nop,TS val 240650 ecr 22196,mptcp dss ack 3516156078 seq 909681259 subseq 455533 len 1428 csum 0x63a1], length 1428
10:05:10.133094 IP 112.26.1.1.44259 > 112.26.0.8.46287: Flags [.], seq 454104:455532, ack 1, win 4017, options [nop,nop,TS val 240650 ecr 22196,mptcp dss ack 3516156078 seq 909681259 subseq 455533 len 1428 csum 0x63a1], length 1428
10:05:10.140560 IP 112.26.0.8.46287 > 112.26.1.1.44259: Flags [.], ack 445536, win 24536, options [nop,nop,TS val 23296 ecr 240026,nop,nop,sack 1 {449820:455532},mptcp dss ack 909649843], length 0
10:05:10.216250 IP 112.26.1.1.44259 > 112.26.0.8.46287: Flags [.], seq 455532:456960, ack 1, win 4017, options [nop,nop,TS val 240650 ecr 22196,mptcp dss ack 3516156078 seq 909682687 subseq 456961 len 1428 csum 0x1db], length 1428
10:05:10.216619 IP 112.26.1.1.44259 > 112.26.0.8.46287: Flags [.], seq 455532:456960, ack 1, win 4017, options [nop,nop,TS val 240650 ecr 22196,mptcp dss ack 3516156078 seq 909682687 subseq 456961 len 1428 csum 0x1db], length 1428
10:05:10.224490 IP 112.26.0.8.46287 > 112.26.1.1.44259: Flags [.], ack 445536, win 24536, options [nop,nop,TS val 23379 ecr 240026,nop,nop,sack 1 {449820:456960},mptcp dss ack 909649843], length 0
10:05:10.241490 IP 112.26.0.8.35259 > 112.26.3.1.44259: Flags [.], ack 22849, win 24536, options [nop,nop,TS val 22876 ecr 239509,nop,nop,sack 1 {24277:27133},mptcp dss ack 909649843], length 0
10:05:10.251495 IP 112.26.0.1.44259 > 112.26.0.8.39832: Flags [.], seq 1055105:1056533, ack 1, win 4017, options [nop,nop,TS val 240915 ecr 22595,mptcp dss ack 3516156078 seq 909684115 subseq 1055105 len 1428 csum 0xf16], length 1428
10:05:10.257079 IP 112.26.0.1.44259 > 112.26.0.8.39832: Flags [.], seq 1055105:1056533, ack 1, win 4017, options [nop,nop,TS val 240915 ecr 22595,mptcp dss ack 3516156078 seq 909684115 subseq 1055105 len 1428 csum 0xf16], length 1428
10:05:10.258295 IP 112.26.0.8.39832 > 112.26.0.1.44259: Flags [.], ack 1052249, win 24536, options [nop,nop,TS val 23414 ecr 239948,nop,nop,sack 1 {1053677:1056533},mptcp dss ack 909649843], length 0
10:05:10.318331 IP 112.26.0.8.35259 > 112.26.3.1.44259: Flags [.], ack 22849, win 24536, options [nop,nop,TS val 22973 ecr 239509,nop,nop,sack 1 {24277:28561},mptcp dss ack 909649843], length 0
10:05:10.335798 IP 112.26.0.1.44259 > 112.26.0.8.39832: Flags [.], seq 1056533:1057961, ack 1, win 4017, options [nop,nop,TS val 240915 ecr 22595,mptcp dss ack 3516156078 seq 909685543 subseq 1056533 len 1428 csum 0x8430], length 1428
10:05:10.345479 IP 112.26.0.1.44259 > 112.26.0.8.39832: Flags [.], seq 1056533:1057961, ack 1, win 4017, options [nop,nop,TS val 240915 ecr 22595,mptcp dss ack 3516156078 seq 909685543 subseq 1056533 len 1428 csum 0x8430], length 1428
10:05:10.346696 IP 112.26.0.8.39832 > 112.26.0.1.44259: Flags [.], ack 1052249, win 24536, options [nop,nop,TS val 23502 ecr 239948,nop,nop,sack 1 {1053677:1057961},mptcp dss ack 909649843], length 0
10:05:10.421406 IP 112.26.1.1.44259 > 112.26.0.8.46287: Flags [.], seq 456960:458388, ack 1, win 4017, options [nop,nop,TS val 240946 ecr 22640,mptcp dss ack 3516156078 seq 909686971 subseq 458389 len 1428 csum 0xecb3], length 1428
10:05:10.421792 IP 112.26.1.1.44259 > 112.26.0.8.46287: Flags [.], seq 456960:458388, ack 1, win 4017, options [nop,nop,TS val 240946 ecr 22640,mptcp dss ack 3516156078 seq 909686971 subseq 458389 len 1428 csum 0xecb3], length 1428
10:05:10.425016 IP 112.26.0.8.46287 > 112.26.1.1.44259: Flags [.], ack 445536, win 24536, options [nop,nop,TS val 23580 ecr 240026,nop,nop,sack 1 {449820:458388},mptcp dss ack 909649843], length 0
10:05:10.438926 IP 112.26.0.8.39832 > 112.26.0.1.44259: Flags [.], ack 1052249, win 24536, options [nop,nop,TS val 22986 ecr 239948,nop,nop,sack 1 {1053677:1055105},mptcp dss ack 909649843], length 0
10:05:10.463314 IP 112.26.0.8.46287 > 112.26.1.1.44259: Flags [.], ack 445536, win 24536, options [nop,nop,TS val 23011 ecr 240026,nop,nop,sack 1 {449820:451248},mptcp dss ack 909649843], length 0
10:05:10.530111 IP 112.26.0.8.46287 > 112.26.1.1.44259: Flags [.], ack 445536, win 24536, options [nop,nop,TS val 23211 ecr 240026,nop,nop,sack 1 {449820:454104},mptcp dss ack 909649843], length 0
10:05:10.538091 IP 112.26.1.1.44259 > 112.26.0.8.46287: Flags [.], seq 458388:459816, ack 1, win 4017, options [nop,nop,TS val 240946 ecr 22640,mptcp dss ack 3516156078 seq 909688399 subseq 459817 len 1428 csum 0xc3e], length 1428
10:05:10.538417 IP 112.26.1.1.44259 > 112.26.0.8.46287: Flags [.], seq 458388:459816, ack 1, win 4017, options [nop,nop,TS val 240946 ecr 22640,mptcp dss ack 3516156078 seq 909688399 subseq 459817 len 1428 csum 0xc3e], length 1428
10:05:10.540853 IP 112.26.0.8.46287 > 112.26.1.1.44259: Flags [.], ack 445536, win 24536, options [nop,nop,TS val 23696 ecr 240026,nop,nop,sack 1 {449820:459816},mptcp dss ack 909649843], length 0
10:05:10.618058 IP 112.26.0.8.46287 > 112.26.1.1.44259: Flags [.], ack 445536, win 24536, options [nop,nop,TS val 23296 ecr 240026,nop,nop,sack 1 {449820:455532},mptcp dss ack 909649843], length 0
10:05:10.625167 IP 112.26.1.1.44259 > 112.26.0.8.46287: Flags [.], seq 459816:461244, ack 1, win 4017, options [nop,nop,TS val 240946 ecr 22640,mptcp dss ack 3516156078 seq 909689827 subseq 461245 len 1428 csum 0x7f16], length 1428
10:05:10.625460 IP 112.26.1.1.44259 > 112.26.0.8.46287: Flags [.], seq 459816:461244, ack 1, win 4017, options [nop,nop,TS val 240946 ecr 22640,mptcp dss ack 3516156078 seq 909689827 subseq 461245 len 1428 csum 0x7f16], length 1428
10:05:10.638013 IP 112.26.0.8.46287 > 112.26.1.1.44259: Flags [.], ack 445536, win 24536, options [nop,nop,TS val 23790 ecr 240026,nop,nop,sack 1 {449820:461244},mptcp dss ack 909649843], length 0
10:05:10.651453 IP 112.26.0.8.46287 > 112.26.1.1.44259: Flags [.], ack 445536, win 24536, options [nop,nop,TS val 23379 ecr 240026,nop,nop,sack 1 {449820:456960},mptcp dss ack 909649843], length 0
10:05:10.716247 IP 112.26.1.1.44259 > 112.26.0.8.46287: Flags [.], seq 461244:462672, ack 1, win 4017, options [nop,nop,TS val 240946 ecr 22640,mptcp dss ack 3516156078 seq 909691255 subseq 462673 len 1428 csum 0xf99a], length 1428
10:05:10.716599 IP 112.26.1.1.44259 > 112.26.0.8.46287: Flags [.], seq 461244:462672, ack 1, win 4017, options [nop,nop,TS val 240946 ecr 22640,mptcp dss ack 3516156078 seq 909691255 subseq 462673 len 1428 csum 0xf99a], length 1428
10:05:10.727236 IP 112.26.0.8.46287 > 112.26.1.1.44259: Flags [.], ack 445536, win 24536, options [nop,nop,TS val 23875 ecr 240026,nop,nop,sack 1 {449820:462672},mptcp dss ack 909649843], length 0
10:05:10.742014 IP 112.26.1.1.44259 > 112.26.0.8.46287: Flags [.], seq 462672:464100, ack 1, win 4017, options [nop,nop,TS val 240946 ecr 22640,mptcp dss ack 3516156078 seq 909692683 subseq 464101 len 1428 csum 0x7060], length 1428
10:05:10.742336 IP 112.26.1.1.44259 > 112.26.0.8.46287: Flags [.], seq 462672:464100, ack 1, win 4017, options [nop,nop,TS val 240946 ecr 22640,mptcp dss ack 3516156078 seq 909692683 subseq 464101 len 1428 csum 0x7060], length 1428
10:05:10.745028 IP 112.26.0.8.46287 > 112.26.1.1.44259: Flags [.], ack 445536, win 24536, options [nop,nop,TS val 23900 ecr 240026,nop,nop,sack 1 {449820:464100},mptcp dss ack 909649843], length 0
10:05:10.752603 IP 112.26.0.8.39832 > 112.26.0.1.44259: Flags [.], ack 1052249, win 24536, options [nop,nop,TS val 23414 ecr 239948,nop,nop,sack 1 {1053677:1056533},mptcp dss ack 909649843], length 0
10:05:10.820929 IP 112.26.1.1.44259 > 112.26.0.8.46287: Flags [.], seq 464100:465528, ack 1, win 4017, options [nop,nop,TS val 240946 ecr 22640,mptcp dss ack 3516156078 seq 909694111 subseq 465529 len 1428 csum 0xb839], length 1428
10:05:10.821198 IP 112.26.1.1.44259 > 112.26.0.8.46287: Flags [.], seq 464100:465528, ack 1, win 4017, options [nop,nop,TS val 240946 ecr 22640,mptcp dss ack 3516156078 seq 909694111 subseq 465529 len 1428 csum 0xb839], length 1428
10:05:10.830153 IP 112.26.0.8.46287 > 112.26.1.1.44259: Flags [.], ack 445536, win 24536, options [nop,nop,TS val 23985 ecr 240026,nop,nop,sack 1 {449820:465528},mptcp dss ack 909649843], length 0
10:05:10.855922 IP 112.26.0.1.44259 > 112.26.0.8.39832: Flags [.], seq 1057961:1059389, ack 1, win 4017, options [nop,nop,TS val 241051 ecr 22768,mptcp dss ack 3516156078 seq 909702679 subseq 1057961 len 1428 csum 0xd9c9], length 1428
10:05:10.858119 IP 112.26.0.1.44259 > 112.26.0.8.39832: Flags [.], seq 1057961:1059389, ack 1, win 4017, options [nop,nop,TS val 241051 ecr 22768,mptcp dss ack 3516156078 seq 909702679 subseq 1057961 len 1428 csum 0xd9c9], length 1428
10:05:10.862198 IP 112.26.0.8.39832 > 112.26.0.1.44259: Flags [.], ack 1052249, win 24536, options [nop,nop,TS val 24015 ecr 239948,nop,nop,sack 1 {1053677:1059389},mptcp dss ack 909649843], length 0
10:05:10.934039 IP 112.26.0.8.46287 > 112.26.1.1.44259: Flags [.], ack 445536, win 24536, options [nop,nop,TS val 23580 ecr 240026,nop,nop,sack 1 {449820:458388},mptcp dss ack 909649843], length 0
10:05:10.937868 IP 112.26.0.1.44259 > 112.26.0.8.39832: Flags [.], seq 1060817:1062245, ack 1, win 4017, options [nop,nop,TS val 241465 ecr 22986,mptcp dss ack 3516156078 seq 909706963 subseq 1060817 len 1428 csum 0x4809], length 1428
10:05:10.946520 IP 112.26.0.1.44259 > 112.26.0.8.39832: Flags [.], seq 1060817:1062245, ack 1, win 4017, options [nop,nop,TS val 241465 ecr 22986,mptcp dss ack 3516156078 seq 909706963 subseq 1060817 len 1428 csum 0x4809], length 1428
10:05:10.947730 IP 112.26.0.8.39832 > 112.26.0.1.44259: Flags [.], ack 1052249, win 24536, options [nop,nop,TS val 24103 ecr 239948,nop,nop,sack 2 {1060817:1062245}{1053677:1059389},mptcp dss ack 909649843], length 0
10:05:10.967914 IP 112.26.0.8.46287 > 112.26.1.1.44259: Flags [.], ack 445536, win 24536, options [nop,nop,TS val 23696 ecr 240026,nop,nop,sack 1 {449820:459816},mptcp dss ack 909649843], length 0
10:05:11.028982 IP 112.26.1.1.44259 > 112.26.0.8.46287: Flags [.], seq 445536:446964, ack 1, win 4017, options [nop,nop,TS val 241465 ecr 23011,mptcp dss ack 3516156078 seq 909671263 subseq 446965 len 1428 csum 0x2f76], length 1428
10:05:11.029307 IP 112.26.1.1.44259 > 112.26.0.8.46287: Flags [.], seq 445536:446964, ack 1, win 4017, options [nop,nop,TS val 241465 ecr 23011,mptcp dss ack 3516156078 seq 909671263 subseq 446965 len 1428 csum 0x2f76], length 1428
10:05:11.035888 IP 112.26.0.8.46287 > 112.26.1.1.44259: Flags [.], ack 446964, win 24536, options [nop,nop,TS val 24187 ecr 241465,nop,nop,sack 1 {449820:465528},mptcp dss ack 909649843], length 0
10:05:11.057645 IP 112.26.3.1.44259 > 112.26.0.8.35259: Flags [.], seq 32845:34273, ack 0, win 4017, options [nop,nop,TS val 241318 ecr 22876,mptcp dss ack 3516156078 seq 909705535 subseq 149941 len 1428 csum 0xdafc], length 1428
10:05:11.060077 IP 112.26.0.8.35259 > 112.26.3.1.44259: Flags [.], ack 22849, win 24536, options [nop,nop,TS val 24216 ecr 239509,nop,nop,sack 2 {32845:34273}{24277:28561},mptcp dss ack 909649843], length 0
10:05:11.127226 IP 112.26.1.1.44259 > 112.26.0.8.46287: Flags [.], seq 446964:448392, ack 1, win 4017, options [nop,nop,TS val 241465 ecr 23011,mptcp dss ack 3516156078 seq 909672691 subseq 448393 len 1428 csum 0xe443], length 1428
10:05:11.127583 IP 112.26.1.1.44259 > 112.26.0.8.46287: Flags [.], seq 446964:448392, ack 1, win 4017, options [nop,nop,TS val 241465 ecr 23011,mptcp dss ack 3516156078 seq 909672691 subseq 448393 len 1428 csum 0xe443], length 1428
10:05:11.142070 IP 112.26.0.8.46287 > 112.26.1.1.44259: Flags [.], ack 448392, win 24536, options [nop,nop,TS val 24286 ecr 241465,nop,nop,sack 1 {449820:465528},mptcp dss ack 909649843], length 0
10:05:11.147889 IP 112.26.3.1.44259 > 112.26.0.8.35259: Flags [.], seq 22849:24277, ack 0, win 4017, options [nop,nop,TS val 241318 ecr 22973,mptcp dss ack 3516156078 seq 909649843 subseq 139945 len 1428 csum 0xad21], length 1428
10:05:11.240830 IP 112.26.0.8.46287 > 112.26.1.1.44259: Flags [.], ack 445536, win 24536, options [nop,nop,TS val 23900 ecr 240026,nop,nop,sack 1 {449820:464100},mptcp dss ack 909649843], length 0
10:05:11.241556 IP 112.26.0.8.35259 > 112.26.3.1.44259: Flags [.], ack 28561, win 24323, options [nop,nop,TS val 24394 ecr 241318,nop,nop,sack 1 {32845:34273},mptcp dss ack 909666979], length 0
10:05:11.247982 IP 112.26.1.1.44259 > 112.26.0.8.46287: Flags [.], seq 448392:449820, ack 1, win 4017, options [nop,nop,TS val 241620 ecr 23296,mptcp dss ack 3516156078 seq 909674119 subseq 449821 len 1428 csum 0xe192], length 1428
10:05:11.248221 IP 112.26.1.1.44259 > 112.26.0.8.46287: Flags [.], seq 448392:449820, ack 1, win 4017, options [nop,nop,TS val 241620 ecr 23296,mptcp dss ack 3516156078 seq 909674119 subseq 449821 len 1428 csum 0xe192], length 1428
10:05:11.267758 IP 112.26.0.8.46287 > 112.26.1.1.44259: Flags [.], ack 465528, win 24323, options [nop,nop,TS val 24406 ecr 241620,mptcp dss ack 909666979], length 0
10:05:11.325863 IP 112.26.0.8.46287 > 112.26.1.1.44259: Flags [.], ack 445536, win 24536, options [nop,nop,TS val 23985 ecr 240026,nop,nop,sack 1 {449820:465528},mptcp dss ack 909649843], length 0
10:05:11.332586 IP 112.26.1.1.44259 > 112.26.0.8.46287: Flags [.], seq 468384:469812, ack 1, win 4017, options [nop,nop,TS val 241755 ecr 23379,mptcp dss ack 3516156078 seq 909708391 subseq 469813 len 1428 csum 0xa5c8], length 1428
10:05:11.332910 IP 112.26.1.1.44259 > 112.26.0.8.46287: Flags [.], seq 468384:469812, ack 1, win 4017, options [nop,nop,TS val 241755 ecr 23379,mptcp dss ack 3516156078 seq 909708391 subseq 469813 len 1428 csum 0xa5c8], length 1428
10:05:11.347144 IP 112.26.0.8.46287 > 112.26.1.1.44259: Flags [.], ack 465528, win 24323, options [nop,nop,TS val 24502 ecr 241620,nop,nop,sack 1 {468384:469812},mptcp dss ack 909666979], length 0
10:05:11.367524 IP 112.26.0.8.39832 > 112.26.0.1.44259: Flags [.], ack 1052249, win 24536, options [nop,nop,TS val 24015 ecr 239948,nop,nop,sack 1 {1053677:1059389},mptcp dss ack 909649843], length 0
10:05:11.425428 IP 112.26.0.1.44259 > 112.26.0.8.39832: Flags [.], seq 1062245:1063673, ack 1, win 4017, options [nop,nop,TS val 241936 ecr 23414,mptcp dss ack 3516156078 seq 909709819 subseq 1062245 len 1428 csum 0xbad7], length 1428
10:05:11.431972 IP 112.26.0.1.44259 > 112.26.0.8.39832: Flags [.], seq 1062245:1063673, ack 1, win 4017, options [nop,nop,TS val 241936 ecr 23414,mptcp dss ack 3516156078 seq 909709819 subseq 1062245 len 1428 csum 0xbad7], length 1428
10:05:11.433295 IP 112.26.0.8.39832 > 112.26.0.1.44259: Flags [.], ack 1052249, win 24323, options [nop,nop,TS val 24584 ecr 239948,nop,nop,sack 2 {1060817:1063673}{1053677:1059389},mptcp dss ack 909666979], length 0
10:05:11.455283 IP 112.26.0.8.39832 > 112.26.0.1.44259: Flags [.], ack 1052249, win 24536, options [nop,nop,TS val 24103 ecr 239948,nop,nop,sack 2 {1060817:1062245}{1053677:1059389},mptcp dss ack 909649843], length 0
10:05:11.459456 IP 112.26.1.1.44259 > 112.26.0.8.46287: Flags [.], seq 469812:471240, ack 1, win 4017, options [nop,nop,TS val 241970 ecr 23580,mptcp dss ack 3516156078 seq 909711247 subseq 471241 len 1428 csum 0x89ae], length 1428
10:05:11.459753 IP 112.26.1.1.44259 > 112.26.0.8.46287: Flags [.], seq 469812:471240, ack 1, win 4017, options [nop,nop,TS val 241970 ecr 23580,mptcp dss ack 3516156078 seq 909711247 subseq 471241 len 1428 csum 0x89ae], length 1428
10:05:11.469938 IP 112.26.0.8.46287 > 112.26.1.1.44259: Flags [.], ack 465528, win 24323, options [nop,nop,TS val 24620 ecr 241620,nop,nop,sack 1 {468384:471240},mptcp dss ack 909666979], length 0
10:05:11.537344 IP 112.26.0.8.46287 > 112.26.1.1.44259: Flags [.], ack 446964, win 24536, options [nop,nop,TS val 24187 ecr 241465,nop,nop,sack 1 {449820:465528},mptcp dss ack 909649843], length 0
10:05:11.548063 IP 112.26.0.1.44259 > 112.26.0.8.39832: Flags [.], seq 1052249:1053677, ack 1, win 4017, options [nop,nop,TS val 242240 ecr 23414,mptcp dss ack 3516156078 seq 909666979 subseq 1052249 len 1428 csum 0xa7f2], length 1428
10:05:11.549779 IP 112.26.0.1.44259 > 112.26.0.8.39832: Flags [.], seq 1052249:1053677, ack 1, win 4017, options [nop,nop,TS val 242240 ecr 23414,mptcp dss ack 3516156078 seq 909666979 subseq 1052249 len 1428 csum 0xa7f2], length 1428
10:05:11.552710 IP 112.26.0.8.39832 > 112.26.0.1.44259: Flags [.], ack 1059389, win 24243, options [nop,nop,TS val 24706 ecr 242240,nop,nop,sack 1 {1060817:1063673},mptcp dss ack 909695539], length 0
10:05:11.568831 IP 112.26.0.8.35259 > 112.26.3.1.44259: Flags [.], ack 22849, win 24536, options [nop,nop,TS val 24216 ecr 239509,nop,nop,sack 2 {32845:34273}{24277:28561},mptcp dss ack 909649843], length 0
10:05:11.627340 IP 112.26.1.1.44259 > 112.26.0.8.46287: Flags [.], seq 471240:472668, ack 1, win 4017, options [nop,nop,TS val 242240 ecr 23696,mptcp dss ack 3516156078 seq 909666979 subseq 472669 len 1428 csum 0x7ff7], length 1428
10:05:11.627729 IP 112.26.1.1.44259 > 112.26.0.8.46287: Flags [.], seq 471240:472668, ack 1, win 4017, options [nop,nop,TS val 242240 ecr 23696,mptcp dss ack 3516156078 seq 909666979 subseq 472669 len 1428 csum 0x7ff7], length 1428
10:05:11.642830 IP 112.26.0.8.46287 > 112.26.1.1.44259: Flags [.], ack 465528, win 24558, options [nop,nop,TS val 24786 ecr 241620,nop,nop,sack 1 {468384:472668},mptcp dss ack 909695539], length 0
10:05:11.648568 IP 112.26.0.8.46287 > 112.26.1.1.44259: Flags [.], ack 448392, win 24536, options [nop,nop,TS val 24286 ecr 241465,nop,nop,sack 1 {449820:465528},mptcp dss ack 909649843], length 0
10:05:11.661845 IP 112.26.1.1.44259 > 112.26.0.8.46287: Flags [.], seq 472668:474096, ack 1, win 4017, options [nop,nop,TS val 242328 ecr 23900,mptcp dss ack 3516156078 seq 909675547 subseq 474097 len 1428 csum 0x3919], length 1428
10:05:11.662193 IP 112.26.1.1.44259 > 112.26.0.8.46287: Flags [.], seq 472668:474096, ack 1, win 4017, options [nop,nop,TS val 242328 ecr 23900,mptcp dss ack 3516156078 seq 909675547 subseq 474097 len 1428 csum 0x3919], length 1428
10:05:11.672199 IP 112.26.0.8.35259 > 112.26.3.1.44259: Flags [.], ack 28561, win 24323, options [nop,nop,TS val 24394 ecr 241318,nop,nop,sack 1 {32845:34273},mptcp dss ack 909666979], length 0
10:05:11.732050 IP 112.26.1.1.44259 > 112.26.0.8.46287: Flags [.], seq 474096:475524, ack 1, win 4017, options [nop,nop,TS val 242328 ecr 23900,mptcp dss ack 3516156078 seq 909684115 subseq 475525 len 1428 csum 0xe71a], length 1428
