10:03:35.367340 IP 112.26.0.8.39832 > 112.26.0.1.44259: Flags [S], seq 320401172, win 65535, options [mss 1460,sackOK,TS val 4294895694 ecr 0,nop,wscale 6,mptcp capable csum {0xf327a5bbfaf142aa}], length 0
10:03:35.375899 IP 112.26.0.1.44259 > 112.26.0.8.39832: Flags [S.], seq 2060943637, ack 320401173, win 65535, options [mss 1460,sackOK,TS val 146370 ecr 4294895694,nop,wscale 6,mptcp capable csum {0x72067753b755f75d}], length 0
10:03:35.464677 IP 112.26.0.1.44259 > 112.26.0.8.39832: Flags [S.], seq 2060943637, ack 320401173, win 65535, options [mss 1460,sackOK,TS val 146370 ecr 4294895694,nop,wscale 6,mptcp capable csum {0x72067753b755f75d}], length 0
10:03:35.479581 IP 112.26.0.1.44259 > 112.26.0.8.39832: Flags [S.], seq 2060943637, ack 320401173, win 65535, options [mss 1460,sackOK,TS val 146370 ecr 4294895694,nop,wscale 6,mptcp capable csum {0x72067753b755f75d}], length 0
10:03:35.562890 IP 112.26.0.8.39832 > 112.26.0.1.44259: Flags [.], ack 1, win 1369, options [nop,nop,TS val 4294895932 ecr 146370,mptcp capable csum {0xf327a5bbfaf142aa,0x72067753b755f75d},mptcp dss ack 908116359], length 0
10:03:35.565338 IP 112.26.0.1.44259 > 112.26.0.8.39832: Flags [.], ack 1, win 1339, options [nop,nop,TS val 146566 ecr 4294895932,mptcp add-addr id 3 112.26.1.1,mptcp dss ack 3516156078], length 0
10:03:35.596135 IP 112.26.0.1.44259 > 112.26.0.8.39832: Flags [.], ack 1, win 1339, options [nop,nop,TS val 146566 ecr 4294895932,mptcp add-addr id 4 112.26.2.1,mptcp dss ack 3516156078], length 0
10:04:14.586698 IP 112.26.0.8.39832 > 112.26.0.1.44259: Flags [.], ack 573869, win 24576, options [nop,nop,TS val 4294935030 ecr 184604,nop,nop,sack 2 {583865:585293}{575297:581009},mptcp dss ack 908721643], length 0
10:04:14.595137 IP 112.26.0.1.44259 > 112.26.0.8.39832: Flags [.], seq 598145:599573, ack 1, win 4017, options [nop,nop,TS val 185425 ecr 4294934458,mptcp dss ack 3516156078 seq 908745919 subseq 598145 len 1428 csum 0xb9a1], length 1428
10:04:14.600110 IP 112.26.0.1.44259 > 112.26.0.8.39832: Flags [.], seq 583865:585293, ack 1, win 4017, options [nop,nop,TS val 185024 ecr 4294934036,mptcp dss ack 3516156078 seq 908731639 subseq 583865 len 1428 csum 0x841b], length 1428
10:04:14.608502 IP 112.26.0.1.44259 > 112.26.0.8.39832: Flags [P.], seq 599573:601001, ack 1, win 4017, options [nop,nop,TS val 185425 ecr 4294934458,mptcp dss ack 3516156078 seq 908747347 subseq 599573 len 1428 csum 0x437d], length 1428
10:04:14.679381 IP 112.26.0.8.39832 > 112.26.0.1.44259: Flags [.], ack 573869, win 24410, options [nop,nop,TS val 4294934637 ecr 184604,mptcp dss ack 908721643], length 0
10:04:31.995764 IP 112.26.0.1.44259 > 112.26.0.8.39832: Flags [.], seq 755225:756653, ack 1, win 4017, options [nop,nop,TS val 202605 ecr 4294951757,mptcp dss ack 3516156078 seq 908970115 subseq 755225 len 1428 csum 0x1903], length 1428
10:04:45.264415 IP 112.26.1.1.44259 > 112.26.0.8.46287: Flags [.], seq 657631803:657633231, ack 2308197351, win 4017, options [nop,nop,TS val 216087 ecr 4294965015,mptcp dss ack 3516156078 seq 909224299 subseq 221341 len 1428 csum 0x7403], length 1428
10:04:45.269011 IP 112.26.0.8.39832 > 112.26.0.1.44259: Flags [.], ack 868037, win 24536, options [nop,nop,TS val 4294965632 ecr 216087,mptcp dss ack 909214303], length 0
10:04:45.276612 IP 112.26.0.8.39832 > 112.26.0.1.44259: Flags [.], ack 862325, win 24458, options [nop,nop,TS val 4294965220 ecr 215686,nop,nop,sack 1 {863753:866609},mptcp dss ack 909201451], length 0
10:04:45.280837 IP 112.26.0.1.44259 > 112.26.0.8.39832: Flags [.], seq 868037:869465, ack 1, win 4017, options [nop,nop,TS val 216087 ecr 4294964944,mptcp dss ack 3516156078 seq 909222871 subseq 868037 len 1428 csum 0x9e76], length 1428
10:04:45.290267 IP 112.26.0.1.44259 > 112.26.0.8.39832: Flags [.], seq 869465:870893, ack 1, win 4017, options [nop,nop,TS val 216279 ecr 4294965220,mptcp dss ack 3516156078 seq 909225727 subseq 869465 len 1428 csum 0xfd14], length 1428
10:04:45.300613 IP 112.26.3.1.44259 > 112.26.0.8.35259: Flags [.], seq 722855988:722857416, ack 1497894051, win 4017, options [nop,nop,TS val 215599 ecr 4294964627,mptcp dss ack 3516156078 seq 909214303 subseq 92821 len 1428 csum 0x48f7], length 1428
10:04:45.378620 IP 112.26.3.1.44259 > 112.26.0.8.35259: Flags [.], seq 1428:2856, ack 1, win 4017, options [nop,nop,TS val 215782 ecr 4294964722,mptcp dss ack 3516156078 seq 909215731 subseq 94249 len 1428 csum 0x3973], length 1428
10:04:45.393815 IP 112.26.0.8.39832 > 112.26.0.1.44259: Flags [.], ack 869465, win 24536, options [nop,nop,TS val 4294965733 ecr 216087,mptcp dss ack 909214303], length 0
10:04:45.414189 IP 112.26.3.1.44259 > 112.26.0.8.35259: Flags [.], seq 1428:2856, ack 1, win 4017, options [nop,nop,TS val 215782 ecr 4294964722,mptcp dss ack 3516156078 seq 909215731 subseq 94249 len 1428 csum 0x3973], length 1428
10:04:45.418504 IP 112.26.0.1.44259 > 112.26.0.8.39832: Flags [.], seq 869465:870893, ack 1, win 4017, options [nop,nop,TS val 216279 ecr 4294965220,mptcp dss ack 3516156078 seq 909225727 subseq 869465 len 1428 csum 0xfd14], length 1428
10:04:45.472028 IP 112.26.0.8.35259 > 112.26.3.1.44259: Flags [.], ack 1428, win 24514, options [nop,nop,TS val 4294965754 ecr 215599,mptcp dss ack 909215731], length 0
10:04:45.478226 IP 112.26.0.8.46287 > 112.26.1.1.44259: Flags [.], ack 4294965868, win 24558, options [nop,nop,TS val 4294965426 ecr 215886,mptcp dss ack 909212875], length 0
10:05:03.176278 IP 112.26.0.8.39832 > 112.26.0.1.44259: Flags [.], ack 992273, win 24514, options [nop,nop,TS val 16236 ecr 231103,nop,nop,sack 2 {1013693:1016549}{993701:1012265},mptcp dss ack 909468487], length 0
10:05:03.194644 IP 112.26.0.8.46287 > 112.26.1.1.44259: Flags [.], ack 144228, win 24514, options [nop,nop,TS val 16248 ecr 232300,nop,nop,sack 2 {151368:155652}{147084:149940},mptcp dss ack 909468487], length 0
10:05:03.195626 IP 112.26.0.8.46287 > 112.26.1.1.44259: Flags [.], ack 144228, win 24514, options [nop,nop,TS val 16248 ecr 232300,nop,nop,sack 2 {151368:155652}{147084:149940},mptcp dss ack 909468487], length 0
10:05:03.198942 IP 112.26.0.1.44259 > 112.26.0.8.39832: Flags [.], seq 1019405:1020833, ack 1, win 4017, options [nop,nop,TS val 234198 ecr 15527,mptcp dss ack 3516156078 seq 909555595 subseq 1019405 len 1428 csum 0x5e9e], length 1428
10:05:03.290342 IP 112.26.0.8.46287 > 112.26.1.1.44259: Flags [.], ack 144228, win 24514, options [nop,nop,TS val 16345 ecr 232300,nop,nop,sack 2 {151368:157080}{147084:149940},mptcp dss ack 909468487], length 0
10:05:03.291306 IP 112.26.0.8.46287 > 112.26.1.1.44259: Flags [.], ack 144228, win 24514, options [nop,nop,TS val 16345 ecr 232300,nop,nop,sack 2 {151368:157080}{147084:149940},mptcp dss ack 909468487], length 0
10:05:03.308009 IP 112.26.0.8.46287 > 112.26.1.1.44259: Flags [.], ack 144228, win 24514, options [nop,nop,TS val 16432 ecr 232300,nop,nop,sack 2 {151368:158508}{147084:149940},mptcp dss ack 909468487], length 0
10:05:03.308974 IP 112.26.0.8.46287 > 112.26.1.1.44259: Flags [.], ack 144228, win 24514, options [nop,nop,TS val 16432 ecr 232300,nop,nop,sack 2 {151368:158508}{147084:149940},mptcp dss ack 909468487], length 0
10:05:03.399182 IP 112.26.0.8.46287 > 112.26.1.1.44259: Flags [.], ack 145656, win 24514, options [nop,nop,TS val 16474 ecr 233878,nop,nop,sack 2 {151368:158508}{147084:149940},mptcp dss ack 909468487], length 0
10:05:03.400164 IP 112.26.0.8.46287 > 112.26.1.1.44259: Flags [.], ack 145656, win 24514, options [nop,nop,TS val 16474 ecr 233878,nop,nop,sack 2 {151368:158508}{147084:149940},mptcp dss ack 909468487], length 0
10:05:03.485991 IP 112.26.0.1.44259 > 112.26.0.8.39832: Flags [.], seq 1016549:1017977, ack 1, win 4017, options [nop,nop,TS val 233900 ecr 15346,mptcp dss ack 3516156078 seq 909552739 subseq 1016549 len 1428 csum 0x6787], length 1428
10:05:03.499632 IP 112.26.0.1.44259 > 112.26.0.8.39832: Flags [.], seq 1017977:1019405, ack 1, win 4017, options [nop,nop,TS val 233916 ecr 15437,mptcp dss ack 3516156078 seq 909554167 subseq 1017977 len 1428 csum 0xbcf4], length 1428
10:05:03.610498 IP 112.26.1.1.44259 > 112.26.0.8.46287: Flags [.], seq 158508:159936, ack 1, win 4017, options [nop,nop,TS val 234610 ecr 16248,mptcp dss ack 3516156078 seq 909557023 subseq 379849 len 1428 csum 0x3b4b], length 1428
10:05:03.681031 IP 112.26.0.1.44259 > 112.26.0.8.39832: Flags [.], seq 992273:993701, ack 1, win 4017, options [nop,nop,TS val 234610 ecr 16236,mptcp dss ack 3516156078 seq 909507043 subseq 992273 len 1428 csum 0xd3f8], length 1428
10:05:03.693741 IP 112.26.0.8.46287 > 112.26.1.1.44259: Flags [.], ack 149940, win 23990, options [nop,nop,TS val 16637 ecr 233916,nop,nop,sack 1 {151368:158508},mptcp dss ack 909507043], length 0
10:05:03.694617 IP 112.26.0.8.46287 > 112.26.1.1.44259: Flags [.], ack 149940, win 23990, options [nop,nop,TS val 16637 ecr 233916,nop,nop,sack 1 {151368:158508},mptcp dss ack 909507043], length 0
10:05:03.700143 IP 112.26.0.1.44259 > 112.26.0.8.39832: Flags [.], seq 1012265:1013693, ack 1, win 4017, options [nop,nop,TS val 234610 ecr 16236,mptcp dss ack 3516156078 seq 909544171 subseq 1012265 len 1428 csum 0x42d3], length 1428
10:05:03.785773 IP 112.26.0.8.46287 > 112.26.1.1.44259: Flags [.], ack 144228, win 24514, options [nop,nop,TS val 16345 ecr 232300,nop,nop,sack 2 {151368:157080}{147084:149940},mptcp dss ack 909468487], length 0
10:05:03.792987 IP 112.26.0.8.39832 > 112.26.0.1.44259: Flags [.], ack 992273, win 24414, options [nop,nop,TS val 16643 ecr 231103,nop,nop,sack 2 {1013693:1017977}{993701:1012265},mptcp dss ack 909507043], length 0
10:05:03.804780 IP 112.26.0.8.46287 > 112.26.1.1.44259: Flags [.], ack 144228, win 24514, options [nop,nop,TS val 16432 ecr 232300,nop,nop,sack 2 {151368:158508}{147084:149940},mptcp dss ack 909468487], length 0
10:05:03.807188 IP 112.26.0.8.39832 > 112.26.0.1.44259: Flags [.], ack 992273, win 24414, options [nop,nop,TS val 16656 ecr 231103,nop,nop,sack 2 {1013693:1019405}{993701:1012265},mptcp dss ack 909507043], length 0
10:05:03.883113 IP 112.26.0.8.46287 > 112.26.1.1.44259: Flags [.], ack 145656, win 24514, options [nop,nop,TS val 16474 ecr 233878,nop,nop,sack 2 {151368:158508}{147084:149940},mptcp dss ack 909468487], length 0
10:05:03.887472 IP 112.26.0.8.46287 > 112.26.1.1.44259: Flags [.], ack 158508, win 24414, options [nop,nop,TS val 16735 ecr 233973,mptcp dss ack 909507043], length 0
10:05:03.904704 IP 112.26.0.1.44259 > 112.26.0.8.39832: Flags [.], seq 1019405:1020833, ack 1, win 4017, options [nop,nop,TS val 234198 ecr 15527,mptcp dss ack 3516156078 seq 909555595 subseq 1019405 len 1428 csum 0x5e9e], length 1428
10:05:03.910628 IP 112.26.0.8.46287 > 112.26.1.1.44259: Flags [.], ack 158508, win 24414, options [nop,nop,TS val 16735 ecr 233973,mptcp dss ack 909507043], length 0
10:05:04.031275 IP 112.26.0.8.39832 > 112.26.0.1.44259: Flags [.], ack 992273, win 24414, options [nop,nop,TS val 17061 ecr 231103,nop,nop,sack 2 {1013693:1020833}{993701:1012265},mptcp dss ack 909507043], length 0
10:05:04.106080 IP 112.26.0.8.46287 > 112.26.1.1.44259: Flags [.], ack 159936, win 24414, options [nop,nop,TS val 17081 ecr 234610,mptcp dss ack 909507043], length 0
10:05:04.127758 IP 112.26.0.8.46287 > 112.26.1.1.44259: Flags [.], ack 149940, win 23990, options [nop,nop,TS val 16637 ecr 233916,nop,nop,sack 1 {151368:158508},mptcp dss ack 909507043], length 0
10:05:04.187518 IP 112.26.0.1.44259 > 112.26.0.8.39832: Flags [.], seq 992273:993701, ack 1, win 4017, options [nop,nop,TS val 234610 ecr 16236,mptcp dss ack 3516156078 seq 909507043 subseq 992273 len 1428 csum 0xd3f8], length 1428
10:05:04.202390 IP 112.26.0.8.46287 > 112.26.1.1.44259: Flags [.], ack 159936, win 24414, options [nop,nop,TS val 17081 ecr 234610,mptcp dss ack 909507043], length 0
10:05:04.216734 IP 112.26.0.1.44259 > 112.26.0.8.39832: Flags [.], seq 1012265:1013693, ack 1, win 4017, options [nop,nop,TS val 234610 ecr 16236,mptcp dss ack 3516156078 seq 909544171 subseq 1012265 len 1428 csum 0x42d3], length 1428
10:05:04.287163 IP 112.26.0.8.46287 > 112.26.1.1.44259: Flags [.], ack 144228, win 24514, options [nop,nop,TS val 16345 ecr 232300,nop,nop,sack 2 {151368:157080}{147084:149940},mptcp dss ack 909468487], length 0
10:05:04.301079 IP 112.26.0.8.39832 > 112.26.0.1.44259: Flags [.], ack 1012265, win 24101, options [nop,nop,TS val 17344 ecr 234610,nop,nop,sack 1 {1013693:1020833},mptcp dss ack 909544171], length 0
10:05:04.305324 IP 112.26.0.8.39832 > 112.26.0.1.44259: Flags [.], ack 992273, win 24414, options [nop,nop,TS val 16643 ecr 231103,nop,nop,sack 2 {1013693:1017977}{993701:1012265},mptcp dss ack 909507043], length 0
10:05:04.308629 IP 112.26.0.1.44259 > 112.26.0.8.39832: Flags [.], seq 1020833:1022261, ack 1, win 4017, options [nop,nop,TS val 235308 ecr 16236,mptcp dss ack 3516156078 seq 909558451 subseq 1020833 len 1428 csum 0xc2b9], length 1428
10:05:04.384131 IP 112.26.0.8.39832 > 112.26.0.1.44259: Flags [.], ack 1020833, win 24419, options [nop,nop,TS val 17373 ecr 234610,mptcp dss ack 909558451], length 0
10:05:04.415673 IP 112.26.0.8.46287 > 112.26.1.1.44259: Flags [.], ack 144228, win 24514, options [nop,nop,TS val 16432 ecr 232300,nop,nop,sack 2 {151368:158508}{147084:149940},mptcp dss ack 909468487], length 0
10:05:04.490797 IP 112.26.0.1.44259 > 112.26.0.8.39832: Flags [.], seq 1022261:1023689, ack 1, win 4017, options [nop,nop,TS val 235418 ecr 16643,mptcp dss ack 3516156078 seq 909559879 subseq 1022261 len 1428 csum 0x3e4a], length 1428
10:05:04.496633 IP 112.26.0.8.39832 > 112.26.0.1.44259: Flags [.], ack 1012265, win 24101, options [nop,nop,TS val 17344 ecr 234610,nop,nop,sack 1 {1013693:1020833},mptcp dss ack 909544171], length 0
10:05:04.509546 IP 112.26.1.1.44259 > 112.26.0.8.46287: Flags [.], seq 159936:161364, ack 1, win 4017, options [nop,nop,TS val 235499 ecr 16432,mptcp dss ack 3516156078 seq 909561307 subseq 381277 len 1428 csum 0xbf6a], length 1428
10:05:04.517506 IP 112.26.0.8.46287 > 112.26.1.1.44259: Flags [.], ack 145656, win 24514, options [nop,nop,TS val 16474 ecr 233878,nop,nop,sack 2 {151368:158508}{147084:149940},mptcp dss ack 909468487], length 0
10:05:04.584869 IP 112.26.1.1.44259 > 112.26.0.8.46287: Flags [.], seq 161364:162792, ack 1, win 4017, options [nop,nop,TS val 235499 ecr 16432,mptcp dss ack 3516156078 seq 909562735 subseq 382705 len 1428 csum 0x236a], length 1428
10:05:04.597594 IP 112.26.0.8.39832 > 112.26.0.1.44259: Flags [.], ack 1020833, win 24419, options [nop,nop,TS val 17373 ecr 234610,mptcp dss ack 909558451], length 0
10:05:04.606744 IP 112.26.0.1.44259 > 112.26.0.8.39832: Flags [.], seq 1023689:1025117, ack 1, win 4017, options [nop,nop,TS val 235499 ecr 17344,mptcp dss ack 3516156078 seq 909564163 subseq 1023689 len 1428 csum 0xb553], length 1428
10:05:04.612757 IP 112.26.0.1.44259 > 112.26.0.8.39832: Flags [.], seq 1020833:1022261, ack 1, win 4017, options [nop,nop,TS val 235308 ecr 16236,mptcp dss ack 3516156078 seq 909558451 subseq 1020833 len 1428 csum 0xc2b9], length 1428
10:05:04.683300 IP 112.26.0.8.46287 > 112.26.1.1.44259: Flags [.], ack 158508, win 24414, options [nop,nop,TS val 16735 ecr 233973,mptcp dss ack 909507043], length 0
10:05:04.702150 IP 112.26.0.8.39832 > 112.26.0.1.44259: Flags [.], ack 1022261, win 24558, options [nop,nop,TS val 17768 ecr 235308,mptcp dss ack 909559879], length 0
10:05:04.705530 IP 112.26.0.8.39832 > 112.26.0.1.44259: Flags [.], ack 992273, win 24414, options [nop,nop,TS val 17061 ecr 231103,nop,nop,sack 2 {1013693:1020833}{993701:1012265},mptcp dss ack 909507043], length 0
10:05:04.708356 IP 112.26.0.1.44259 > 112.26.0.8.39832: Flags [P.], seq 1025117:1026545, ack 1, win 4017, options [nop,nop,TS val 235499 ecr 17344,mptcp dss ack 3516156078 seq 909565591 subseq 1025117 len 1428 csum 0xe221], length 1428
10:05:04.715990 IP 112.26.0.1.44259 > 112.26.0.8.39832: Flags [.], seq 1022261:1023689, ack 1, win 4017, options [nop,nop,TS val 235418 ecr 16643,mptcp dss ack 3516156078 seq 909559879 subseq 1022261 len 1428 csum 0x3e4a], length 1428
10:05:04.783797 IP 112.26.1.1.44259 > 112.26.0.8.46287: Flags [.], seq 162792:164220, ack 1, win 4017, options [nop,nop,TS val 235520 ecr 16474,mptcp dss ack 3516156078 seq 909567019 subseq 384133 len 1428 csum 0x8cc4], length 1428
10:05:04.798018 IP 112.26.0.8.39832 > 112.26.0.1.44259: Flags [.], ack 1023689, win 24558, options [nop,nop,TS val 17873 ecr 235418,mptcp dss ack 909561307], length 0
10:05:04.805068 IP 112.26.0.1.44259 > 112.26.0.8.39832: Flags [.], seq 1026545:1027973, ack 1, win 4017, options [nop,nop,TS val 235600 ecr 17373,mptcp dss ack 3516156078 seq 909568447 subseq 1026545 len 1428 csum 0x6cc1], length 1428
10:05:04.813106 IP 112.26.0.8.46287 > 112.26.1.1.44259: Flags [.], ack 149940, win 23990, options [nop,nop,TS val 16637 ecr 233916,nop,nop,sack 1 {151368:158508},mptcp dss ack 909507043], length 0
10:05:04.825367 IP 112.26.0.8.46287 > 112.26.1.1.44259: Flags [.], ack 161364, win 24558, options [nop,nop,TS val 17950 ecr 235499,mptcp dss ack 909562735], length 0
10:05:04.889389 IP 112.26.1.1.44259 > 112.26.0.8.46287: Flags [.], seq 164220:165648, ack 1, win 4017, options [nop,nop,TS val 235686 ecr 16735,mptcp dss ack 3516156078 seq 909569875 subseq 385561 len 1428 csum 0x785f], length 1428
10:05:04.896303 IP 112.26.0.8.46287 > 112.26.1.1.44259: Flags [.], ack 159936, win 24414, options [nop,nop,TS val 17081 ecr 234610,mptcp dss ack 909507043], length 0
10:05:04.899447 IP 112.26.0.8.46287 > 112.26.1.1.44259: Flags [.], ack 162792, win 24558, options [nop,nop,TS val 17987 ecr 235499,mptcp dss ack 909564163], length 0
10:05:04.916173 IP 112.26.1.1.44259 > 112.26.0.8.46287: Flags [.], seq 165648:167076, ack 1, win 4017, options [nop,nop,TS val 235686 ecr 16735,mptcp dss ack 3516156078 seq 909571303 subseq 386989 len 1428 csum 0x6229], length 1428
10:05:04.918936 IP 112.26.0.1.44259 > 112.26.0.8.39832: Flags [.], seq 1023689:1025117, ack 1, win 4017, options [nop,nop,TS val 235499 ecr 17344,mptcp dss ack 3516156078 seq 909564163 subseq 1023689 len 1428 csum 0xb553], length 1428
10:05:04.930471 IP 112.26.0.8.46287 > 112.26.1.1.44259: Flags [.], ack 144228, win 24514, options [nop,nop,TS val 16345 ecr 232300,nop,nop,sack 2 {151368:157080}{147084:149940},mptcp dss ack 909468487], length 0
10:05:04.989464 IP 112.26.0.1.44259 > 112.26.0.8.39832: Flags [.], ack 1, win 4017, options [nop,nop,TS val 235708 ecr 17373,mptcp dss ack 3516156078], length 0
10:05:05.000530 IP 112.26.0.8.39832 > 112.26.0.1.44259: Flags [.], ack 1025117, win 24558, options [nop,nop,TS val 18076 ecr 235499,mptcp dss ack 909565591], length 0
10:05:05.002361 IP 112.26.0.8.39832 > 112.26.0.1.44259: Flags [.], ack 1022261, win 24558, options [nop,nop,TS val 17768 ecr 235308,mptcp dss ack 909559879], length 0
10:05:05.009324 IP 112.26.3.1.44259 > 112.26.0.8.35259: Flags [.], seq 32844:34272, ack 1, win 4017, options [nop,nop,TS val 235712 ecr 14245,mptcp dss ack 3516156078 seq 909467059 subseq 125665 len 1428 csum 0x2778], length 1428
10:05:05.022451 IP 112.26.0.8.39832 > 112.26.0.1.44259: Flags [.], ack 1023689, win 24558, options [nop,nop,TS val 17873 ecr 235418,mptcp dss ack 909561307], length 0
10:05:05.026578 IP 112.26.0.1.44259 > 112.26.0.8.39832: Flags [P.], seq 1025117:1026545, ack 1, win 4017, options [nop,nop,TS val 235499 ecr 17344,mptcp dss ack 3516156078 seq 909565591 subseq 1025117 len 1428 csum 0xe221], length 1428
10:05:05.094423 IP 112.26.1.1.44259 > 112.26.0.8.46287: Flags [.], ack 1, win 4017, options [nop,nop,TS val 235815 ecr 16735,mptcp dss ack 3516156078], length 0
10:05:05.108981 IP 112.26.1.1.44259 > 112.26.0.8.46287: Flags [.], seq 167076:168504, ack 1, win 4017, options [nop,nop,TS val 235898 ecr 17081,mptcp dss ack 3516156078 seq 909572731 subseq 388417 len 1428 csum 0xdcde], length 1428
10:05:05.116364 IP 112.26.0.8.39832 > 112.26.0.1.44259: Flags [.], ack 1026545, win 24558, options [nop,nop,TS val 18183 ecr 235499,mptcp dss ack 909567019], length 0
10:05:05.120240 IP 112.26.0.8.46287 > 112.26.1.1.44259: Flags [.], ack 161364, win 24558, options [nop,nop,TS val 17950 ecr 235499,mptcp dss ack 909562735], length 0
10:05:05.128632 IP 112.26.1.1.44259 > 112.26.0.8.46287: Flags [.], seq 168504:169932, ack 1, win 4017, options [nop,nop,TS val 235898 ecr 17081,mptcp dss ack 3516156078 seq 909574159 subseq 389845 len 1428 csum 0x5a46], length 1428
10:05:05.203876 IP 112.26.0.8.46287 > 112.26.1.1.44259: Flags [.], ack 162792, win 24558, options [nop,nop,TS val 17987 ecr 235499,mptcp dss ack 909564163], length 0
10:05:05.217624 IP 112.26.0.8.39832 > 112.26.0.1.44259: Flags [.], ack 1025117, win 24558, options [nop,nop,TS val 18076 ecr 235499,mptcp dss ack 909565591], length 0
10:05:05.223372 IP 112.26.0.8.46287 > 112.26.1.1.44259: Flags [.], ack 164220, win 24558, options [nop,nop,TS val 18254 ecr 235520,mptcp dss ack 909568447], length 0
10:05:05.287495 IP 112.26.0.1.44259 > 112.26.0.8.39832: Flags [.], seq 1027973:1029401, ack 1, win 4017, options [nop,nop,TS val 236005 ecr 17768,mptcp dss ack 3516156078 seq 909575587 subseq 1027973 len 1428 csum 0x5525], length 1428
10:05:05.308390 IP 112.26.3.1.44259 > 112.26.0.8.35259: Flags [.], seq 32844:34272, ack 1, win 4017, options [nop,nop,TS val 235712 ecr 14245,mptcp dss ack 3516156078 seq 909467059 subseq 125665 len 1428 csum 0x2778], length 1428
10:05:05.310951 IP 112.26.3.1.44259 > 112.26.0.8.35259: Flags [.], seq 32844:34272, ack 1, win 4017, options [nop,nop,TS val 235712 ecr 14245,mptcp dss ack 3516156078 seq 909467059 subseq 125665 len 1428 csum 0x2778], length 1428
10:05:05.323018 IP 112.26.0.1.44259 > 112.26.0.8.39832: Flags [.], seq 1029401:1030829, ack 1, win 4017, options [nop,nop,TS val 236025 ecr 17873,mptcp dss ack 3516156078 seq 909577015 subseq 1029401 len 1428 csum 0x8a6c], length 1428
10:05:05.324193 IP 112.26.0.1.44259 > 112.26.0.8.39832: Flags [.], seq 1026545:1027973, ack 1, win 4017, options [nop,nop,TS val 235600 ecr 17373,mptcp dss ack 3516156078 seq 909568447 subseq 1026545 len 1428 csum 0x6cc1], length 1428
10:05:05.404752 IP 112.26.0.8.39832 > 112.26.0.1.44259: Flags [.], ack 1026545, win 24558, options [nop,nop,TS val 18183 ecr 235499,mptcp dss ack 909567019], length 0
10:05:05.417731 IP 112.26.0.8.46287 > 112.26.1.1.44259: Flags [.], ack 165648, win 24558, options [nop,nop,TS val 18386 ecr 235686,mptcp dss ack 909568447], length 0
10:05:05.426668 IP 112.26.1.1.44259 > 112.26.0.8.46287: Flags [.], seq 169932:171360, ack 1, win 4017, options [nop,nop,TS val 236123 ecr 17950,mptcp dss ack 3516156078 seq 909578443 subseq 391273 len 1428 csum 0x68ee], length 1428
10:05:05.441385 IP 112.26.1.1.44259 > 112.26.0.8.46287: Flags [.], seq 171360:172788, ack 1, win 4017, options [nop,nop,TS val 236206 ecr 17987,mptcp dss ack 3516156078 seq 909579871 subseq 392701 len 1428 csum 0x2980], length 1428
10:05:05.444385 IP 112.26.0.8.46287 > 112.26.1.1.44259: Flags [.], ack 167076, win 24558, options [nop,nop,TS val 18456 ecr 235686,mptcp dss ack 909568447], length 0
10:05:05.501055 IP 112.26.0.8.46287 > 112.26.1.1.44259: Flags [.], ack 164220, win 24558, options [nop,nop,TS val 18254 ecr 235520,mptcp dss ack 909568447], length 0
10:05:05.509043 IP 112.26.0.1.44259 > 112.26.0.8.39832: Flags [.], ack 1, win 4017, options [nop,nop,TS val 235708 ecr 17373,mptcp dss ack 3516156078], length 0
10:05:05.516887 IP 112.26.1.1.44259 > 112.26.0.8.46287: Flags [P.], seq 172788:174216, ack 1, win 4017, options [nop,nop,TS val 236206 ecr 17987,mptcp dss ack 3516156078 seq 909581299 subseq 394129 len 1428 csum 0xbac1], length 1428
10:05:05.526235 IP 112.26.0.1.44259 > 112.26.0.8.39832: Flags [.], seq 1030829:1032257, ack 1, win 4017, options [nop,nop,TS val 236220 ecr 18076,mptcp dss ack 3516156078 seq 909582727 subseq 1030829 len 1428 csum 0x7de4], length 1428
10:05:05.530259 IP 112.26.0.8.35259 > 112.26.3.1.44259: Flags [.], ack 34272, win 24558, options [nop,nop,TS val 18468 ecr 235712,nop,nop,sack 2 {32844:34272}{35700:38556},mptcp dss ack 909568447], length 0
10:05:05.599922 IP 112.26.0.1.44259 > 112.26.0.8.39832: Flags [.], seq 1032257:1033685, ack 1, win 4017, options [nop,nop,TS val 236407 ecr 18183,mptcp dss ack 3516156078 seq 909584155 subseq 1032257 len 1428 csum 0x11db], length 1428
10:05:05.610302 IP 112.26.0.8.39832 > 112.26.0.1.44259: Flags [.], ack 1027973, win 24527, options [nop,nop,TS val 18477 ecr 235600,mptcp dss ack 909572731], length 0
10:05:05.611306 IP 112.26.0.8.46287 > 112.26.1.1.44259: Flags [.], ack 165648, win 24558, options [nop,nop,TS val 18386 ecr 235686,mptcp dss ack 909568447], length 0
10:05:05.619850 IP 112.26.1.1.44259 > 112.26.0.8.46287: Flags [.], seq 174216:175644, ack 1, win 4017, options [nop,nop,TS val 236503 ecr 18254,mptcp dss ack 3516156078 seq 909585583 subseq 395557 len 1428 csum 0x8127], length 1428
10:05:05.696775 IP 112.26.0.8.46287 > 112.26.1.1.44259: Flags [.], ack 168504, win 24558, options [nop,nop,TS val 18651 ecr 235898,mptcp dss ack 909574159], length 0
10:05:05.704366 IP 112.26.1.1.44259 > 112.26.0.8.46287: Flags [.], seq 175644:177072, ack 1, win 4017, options [nop,nop,TS val 236614 ecr 18386,mptcp dss ack 3516156078 seq 909587011 subseq 396985 len 1428 csum 0x1908], length 1428
10:05:05.712500 IP 112.26.0.8.46287 > 112.26.1.1.44259: Flags [.], ack 169932, win 24558, options [nop,nop,TS val 18696 ecr 235898,mptcp dss ack 909575587], length 0
10:05:05.717604 IP 112.26.0.8.46287 > 112.26.1.1.44259: Flags [.], ack 167076, win 24558, options [nop,nop,TS val 18456 ecr 235686,mptcp dss ack 909568447], length 0
10:05:05.730742 IP 112.26.0.1.44259 > 112.26.0.8.39832: Flags [.], seq 1027973:1029401, ack 1, win 4017, options [nop,nop,TS val 236005 ecr 17768,mptcp dss ack 3516156078 seq 909575587 subseq 1027973 len 1428 csum 0x5525], length 1428
10:05:05.799014 IP 112.26.0.8.35259 > 112.26.3.1.44259: Flags [.], ack 34272, win 24558, options [nop,nop,TS val 18468 ecr 235712,nop,nop,sack 2 {32844:34272}{35700:38556},mptcp dss ack 909568447], length 0
10:05:05.803919 IP 112.26.1.1.44259 > 112.26.0.8.46287: Flags [.], seq 177072:178500, ack 1, win 4017, options [nop,nop,TS val 236720 ecr 18456,mptcp dss ack 3516156078 seq 909588439 subseq 398413 len 1428 csum 0x1f08], length 1428
10:05:05.808366 IP 112.26.0.1.44259 > 112.26.0.8.39832: Flags [.], seq 1029401:1030829, ack 1, win 4017, options [nop,nop,TS val 236025 ecr 17873,mptcp dss ack 3516156078 seq 909577015 subseq 1029401 len 1428 csum 0x8a6c], length 1428
10:05:05.830231 IP 112.26.3.1.44259 > 112.26.0.8.35259: Flags [.], seq 34272:35700, ack 1, win 4017, options [nop,nop,TS val 236801 ecr 18468,mptcp dss ack 3516156078 seq 909468487 subseq 127093 len 1428 csum 0x8b83], length 1428
10:05:05.836085 IP 112.26.0.8.39832 > 112.26.0.1.44259: Flags [.], ack 1027973, win 24527, options [nop,nop,TS val 18477 ecr 235600,mptcp dss ack 909572731], length 0
10:05:05.892899 IP 112.26.0.8.39832 > 112.26.0.1.44259: Flags [.], ack 1029401, win 24558, options [nop,nop,TS val 18883 ecr 236005,mptcp dss ack 909577015], length 0
10:05:05.916371 IP 112.26.0.1.44259 > 112.26.0.8.39832: Flags [.], seq 1033685:1035113, ack 1, win 4017, options [nop,nop,TS val 236839 ecr 18477,mptcp dss ack 3516156078 seq 909589867 subseq 1033685 len 1428 csum 0x2a8e], length 1428
10:05:05.919827 IP 112.26.0.8.39832 > 112.26.0.1.44259: Flags [.], ack 1030829, win 24558, options [nop,nop,TS val 18964 ecr 236025,mptcp dss ack 909578443], length 0
10:05:05.991496 IP 112.26.0.8.46287 > 112.26.1.1.44259: Flags [.], ack 168504, win 24558, options [nop,nop,TS val 18651 ecr 235898,mptcp dss ack 909574159], length 0
10:05:05.996899 IP 112.26.1.1.44259 > 112.26.0.8.46287: Flags [.], seq 178500:179928, ack 1, win 4017, options [nop,nop,TS val 236994 ecr 18651,mptcp dss ack 3516156078 seq 909591295 subseq 399841 len 1428 csum 0xae93], length 1428
10:05:06.001890 IP 112.26.0.8.46287 > 112.26.1.1.44259: Flags [.], ack 171360, win 24558, options [nop,nop,TS val 18972 ecr 236123,mptcp dss ack 909579871], length 0
10:05:06.035635 IP 112.26.0.8.46287 > 112.26.1.1.44259: Flags [.], ack 172788, win 24558, options [nop,nop,TS val 19060 ecr 236206,mptcp dss ack 909581299], length 0
10:05:06.090799 IP 112.26.0.8.46287 > 112.26.1.1.44259: Flags [.], ack 169932, win 24558, options [nop,nop,TS val 18696 ecr 235898,mptcp dss ack 909575587], length 0
10:05:06.093626 IP 112.26.1.1.44259 > 112.26.0.8.46287: Flags [.], seq 179928:181356, ack 1, win 4017, options [nop,nop,TS val 237093 ecr 18696,mptcp dss ack 3516156078 seq 909592723 subseq 401269 len 1428 csum 0x9beb], length 1428
10:05:06.100743 IP 112.26.0.8.46287 > 112.26.1.1.44259: Flags [.], ack 174216, win 24558, options [nop,nop,TS val 19166 ecr 236206,mptcp dss ack 909582727], length 0
10:05:06.123744 IP 112.26.3.1.44259 > 112.26.0.8.35259: Flags [.], seq 34272:35700, ack 1, win 4017, options [nop,nop,TS val 236801 ecr 18468,mptcp dss ack 3516156078 seq 909468487 subseq 127093 len 1428 csum 0x8b83], length 1428
10:05:06.127112 IP 112.26.3.1.44259 > 112.26.0.8.35259: Flags [.], seq 34272:35700, ack 1, win 4017, options [nop,nop,TS val 236801 ecr 18468,mptcp dss ack 3516156078 seq 909468487 subseq 127093 len 1428 csum 0x8b83], length 1428
10:05:06.191135 IP 112.26.0.8.39832 > 112.26.0.1.44259: Flags [.], ack 1029401, win 24558, options [nop,nop,TS val 18883 ecr 236005,mptcp dss ack 909577015], length 0
10:05:06.193811 IP 112.26.0.1.44259 > 112.26.0.8.39832: Flags [.], seq 1035113:1036541, ack 1, win 4017, options [nop,nop,TS val 237193 ecr 18883,mptcp dss ack 3516156078 seq 909594151 subseq 1035113 len 1428 csum 0x80ba], length 1428
10:05:06.206506 IP 112.26.0.1.44259 > 112.26.0.8.39832: Flags [.], seq 1030829:1032257, ack 1, win 4017, options [nop,nop,TS val 236220 ecr 18076,mptcp dss ack 3516156078 seq 909582727 subseq 1030829 len 1428 csum 0x7de4], length 1428
10:05:06.220225 IP 112.26.0.1.44259 > 112.26.0.8.39832: Flags [.], seq 1036541:1037969, ack 1, win 4017, options [nop,nop,TS val 237193 ecr 18883,mptcp dss ack 3516156078 seq 909595579 subseq 1036541 len 1428 csum 0x75e4], length 1428
10:05:06.295277 IP 112.26.0.8.46287 > 112.26.1.1.44259: Flags [.], ack 175644, win 24558, options [nop,nop,TS val 19264 ecr 236503,mptcp dss ack 909582727], length 0
10:05:06.301794 IP 112.26.0.8.39832 > 112.26.0.1.44259: Flags [.], ack 1030829, win 24558, options [nop,nop,TS val 18964 ecr 236025,mptcp dss ack 909578443], length 0
10:05:06.303027 IP 112.26.0.1.44259 > 112.26.0.8.39832: Flags [.], seq 1037969:1039397, ack 1, win 4017, options [nop,nop,TS val 237304 ecr 18964,mptcp dss ack 3516156078 seq 909597007 subseq 1037969 len 1428 csum 0x71ef], length 1428
10:05:06.331413 IP 112.26.0.8.35259 > 112.26.3.1.44259: Flags [.], ack 38556, win 24558, options [nop,nop,TS val 19284 ecr 236801,mptcp dss ack 909582727], length 0
10:05:06.416164 IP 112.26.0.8.46287 > 112.26.1.1.44259: Flags [.], ack 171360, win 24558, options [nop,nop,TS val 18972 ecr 236123,mptcp dss ack 909579871], length 0
10:05:06.417409 IP 112.26.1.1.44259 > 112.26.0.8.46287: Flags [.], seq 181356:182784, ack 1, win 4017, options [nop,nop,TS val 237418 ecr 18972,mptcp dss ack 3516156078 seq 909598435 subseq 402697 len 1428 csum 0x67a8], length 1428
10:05:06.425915 IP 112.26.0.8.39832 > 112.26.0.1.44259: Flags [.], ack 1032257, win 24536, options [nop,nop,TS val 19363 ecr 236220,mptcp dss ack 909584155], length 0
10:05:06.439220 IP 112.26.0.8.46287 > 112.26.1.1.44259: Flags [.], ack 172788, win 24558, options [nop,nop,TS val 19060 ecr 236206,mptcp dss ack 909581299], length 0
10:05:06.440442 IP 112.26.1.1.44259 > 112.26.0.8.46287: Flags [.], seq 182784:184212, ack 1, win 4017, options [nop,nop,TS val 237441 ecr 19060,mptcp dss ack 3516156078 seq 909599863 subseq 404125 len 1428 csum 0x864e], length 1428
10:05:06.505243 IP 112.26.0.1.44259 > 112.26.0.8.39832: Flags [.], seq 1033685:1035113, ack 1, win 4017, options [nop,nop,TS val 236839 ecr 18477,mptcp dss ack 3516156078 seq 909589867 subseq 1033685 len 1428 csum 0x2a8e], length 1428
10:05:06.529309 IP 112.26.0.8.46287 > 112.26.1.1.44259: Flags [.], ack 178500, win 24536, options [nop,nop,TS val 19386 ecr 236614,mptcp dss ack 909584155], length 0
10:05:06.603900 IP 112.26.0.8.46287 > 112.26.1.1.44259: Flags [.], ack 175644, win 24558, options [nop,nop,TS val 19264 ecr 236503,mptcp dss ack 909582727], length 0
10:05:06.607173 IP 112.26.0.8.46287 > 112.26.1.1.44259: Flags [.], ack 179928, win 24536, options [nop,nop,TS val 19530 ecr 236994,mptcp dss ack 909584155], length 0
10:05:06.611746 IP 112.26.1.1.44259 > 112.26.0.8.46287: Flags [.], seq 184212:185640, ack 1, win 4017, options [nop,nop,TS val 237607 ecr 19264,mptcp dss ack 3516156078 seq 909601291 subseq 405553 len 1428 csum 0x90b5], length 1428
10:05:06.629764 IP 112.26.1.1.44259 > 112.26.0.8.46287: Flags [.], seq 185640:187068, ack 1, win 4017, options [nop,nop,TS val 237607 ecr 19264,mptcp dss ack 3516156078 seq 909602719 subseq 406981 len 1428 csum 0x25b0], length 1428
10:05:06.637233 IP 112.26.0.1.44259 > 112.26.0.8.39832: Flags [.], seq 1035113:1036541, ack 1, win 4017, options [nop,nop,TS val 237193 ecr 18883,mptcp dss ack 3516156078 seq 909594151 subseq 1035113 len 1428 csum 0x80ba], length 1428
10:05:06.695447 IP 112.26.0.8.35259 > 112.26.3.1.44259: Flags [.], ack 38556, win 24558, options [nop,nop,TS val 19284 ecr 236801,mptcp dss ack 909582727], length 0
10:05:06.700175 IP 112.26.1.1.44259 > 112.26.0.8.46287: Flags [.], seq 187068:188496, ack 1, win 4017, options [nop,nop,TS val 237607 ecr 19264,mptcp dss ack 3516156078 seq 909604147 subseq 408409 len 1428 csum 0x40ea], length 1428
10:05:06.717773 IP 112.26.0.1.44259 > 112.26.0.8.39832: Flags [.], seq 1036541:1037969, ack 1, win 4017, options [nop,nop,TS val 237193 ecr 18883,mptcp dss ack 3516156078 seq 909595579 subseq 1036541 len 1428 csum 0x75e4], length 1428
10:05:06.729385 IP 112.26.3.1.44259 > 112.26.0.8.35259: Flags [.], seq 38556:39984, ack 1, win 4017, options [nop,nop,TS val 237698 ecr 19284,mptcp dss ack 3516156078 seq 909607003 subseq 131377 len 1428 csum 0x4d12], length 1428
10:05:06.732468 IP 112.26.0.8.39832 > 112.26.0.1.44259: Flags [.], ack 1032257, win 24536, options [nop,nop,TS val 19363 ecr 236220,mptcp dss ack 909584155], length 0
10:05:06.742147 IP 112.26.0.8.39832 > 112.26.0.1.44259: Flags [.], ack 1032257, win 24536, options [nop,nop,TS val 19662 ecr 236220,nop,nop,sack 1 {1033685:1035113},mptcp dss ack 909584155], length 0
10:05:06.797080 IP 112.26.3.1.44259 > 112.26.0.8.35259: Flags [.], seq 39984:41412, ack 1, win 4017, options [nop,nop,TS val 237698 ecr 19284,mptcp dss ack 3516156078 seq 909608431 subseq 132805 len 1428 csum 0xf630], length 1428
10:05:06.808095 IP 112.26.0.8.46287 > 112.26.1.1.44259: Flags [.], ack 178500, win 24536, options [nop,nop,TS val 19386 ecr 236614,mptcp dss ack 909584155], length 0
10:05:06.813938 IP 112.26.0.1.44259 > 112.26.0.8.39832: Flags [.], seq 1037969:1039397, ack 1, win 4017, options [nop,nop,TS val 237304 ecr 18964,mptcp dss ack 3516156078 seq 909597007 subseq 1037969 len 1428 csum 0x71ef], length 1428
10:05:06.826274 IP 112.26.0.8.46287 > 112.26.1.1.44259: Flags [.], ack 179928, win 24536, options [nop,nop,TS val 19530 ecr 236994,mptcp dss ack 909584155], length 0
10:05:06.837795 IP 112.26.0.1.44259 > 112.26.0.8.39832: Flags [.], seq 1039397:1040825, ack 1, win 4017, options [nop,nop,TS val 237735 ecr 19363,mptcp dss ack 3516156078 seq 909609859 subseq 1039397 len 1428 csum 0xbd96], length 1428
10:05:06.895226 IP 112.26.0.8.46287 > 112.26.1.1.44259: Flags [.], ack 181356, win 24536, options [nop,nop,TS val 19696 ecr 237093,mptcp dss ack 909584155], length 0
10:05:06.902645 IP 112.26.3.1.44259 > 112.26.0.8.35259: Flags [.], seq 38556:39984, ack 1, win 4017, options [nop,nop,TS val 237698 ecr 19284,mptcp dss ack 3516156078 seq 909607003 subseq 131377 len 1428 csum 0x4d12], length 1428
10:05:06.906852 IP 112.26.3.1.44259 > 112.26.0.8.35259: Flags [.], seq 38556:39984, ack 1, win 4017, options [nop,nop,TS val 237698 ecr 19284,mptcp dss ack 3516156078 seq 909607003 subseq 131377 len 1428 csum 0x4d12], length 1428
10:05:06.921365 IP 112.26.0.8.39832 > 112.26.0.1.44259: Flags [.], ack 1032257, win 24536, options [nop,nop,TS val 19794 ecr 236220,nop,nop,sack 1 {1033685:1036541},mptcp dss ack 909584155], length 0
10:05:06.934925 IP 112.26.1.1.44259 > 112.26.0.8.46287: Flags [.], seq 188496:189924, ack 1, win 4017, options [nop,nop,TS val 237810 ecr 19386,mptcp dss ack 3516156078 seq 909605575 subseq 409837 len 1428 csum 0xf088], length 1428
10:05:06.997850 IP 112.26.0.8.39832 > 112.26.0.1.44259: Flags [.], ack 1032257, win 24536, options [nop,nop,TS val 19662 ecr 236220,nop,nop,sack 1 {1033685:1035113},mptcp dss ack 909584155], length 0
10:05:07.007522 IP 112.26.0.8.39832 > 112.26.0.1.44259: Flags [.], ack 1032257, win 24536, options [nop,nop,TS val 19875 ecr 236220,nop,nop,sack 1 {1033685:1037969},mptcp dss ack 909584155], length 0
10:05:07.008369 IP 112.26.1.1.44259 > 112.26.0.8.46287: Flags [.], seq 189924:191352, ack 1, win 4017, options [nop,nop,TS val 237810 ecr 19386,mptcp dss ack 3516156078 seq 909611287 subseq 411265 len 1428 csum 0x4c48], length 1428
10:05:07.029706 IP 112.26.0.8.39832 > 112.26.0.1.44259: Flags [.], ack 1032257, win 24536, options [nop,nop,TS val 19971 ecr 236220,nop,nop,sack 1 {1033685:1039397},mptcp dss ack 909584155], length 0
10:05:07.035424 IP 112.26.1.1.44259 > 112.26.0.8.46287: Flags [.], seq 191352:192780, ack 1, win 4017, options [nop,nop,TS val 237828 ecr 19530,mptcp dss ack 3516156078 seq 909612715 subseq 412693 len 1428 csum 0x4752], length 1428
10:05:07.098227 IP 112.26.3.1.44259 > 112.26.0.8.35259: Flags [.], seq 39984:41412, ack 1, win 4017, options [nop,nop,TS val 237698 ecr 19284,mptcp dss ack 3516156078 seq 909608431 subseq 132805 len 1428 csum 0xf630], length 1428
10:05:07.103192 IP 112.26.3.1.44259 > 112.26.0.8.35259: Flags [.], seq 39984:41412, ack 1, win 4017, options [nop,nop,TS val 237698 ecr 19284,mptcp dss ack 3516156078 seq 909608431 subseq 132805 len 1428 csum 0xf630], length 1428
10:05:07.118720 IP 112.26.0.8.35259 > 112.26.3.1.44259: Flags [.], ack 39984, win 24536, options [nop,nop,TS val 20062 ecr 237698,mptcp dss ack 909584155], length 0
10:05:07.206139 IP 112.26.0.8.46287 > 112.26.1.1.44259: Flags [.], ack 187068, win 24536, options [nop,nop,TS val 20088 ecr 237418,mptcp dss ack 909584155], length 0
10:05:07.241912 IP 112.26.0.8.46287 > 112.26.1.1.44259: Flags [.], ack 181356, win 24536, options [nop,nop,TS val 19696 ecr 237093,mptcp dss ack 909584155], length 0
10:05:07.299596 IP 112.26.0.1.44259 > 112.26.0.8.39832: Flags [.], seq 1040825:1042253, ack 1, win 4017, options [nop,nop,TS val 238245 ecr 19662,mptcp dss ack 3516156078 seq 909614143 subseq 1040825 len 1428 csum 0xecae], length 1428
10:05:07.306844 IP 112.26.0.8.35259 > 112.26.3.1.44259: Flags [.], ack 41412, win 24536, options [nop,nop,TS val 20260 ecr 237698,mptcp dss ack 909584155], length 0
10:05:07.324254 IP 112.26.0.8.39832 > 112.26.0.1.44259: Flags [.], ack 1032257, win 24536, options [nop,nop,TS val 19794 ecr 236220,nop,nop,sack 1 {1033685:1036541},mptcp dss ack 909584155], length 0
10:05:07.325932 IP 112.26.1.1.44259 > 112.26.0.8.46287: Flags [.], seq 192780:194208, ack 1, win 4017, options [nop,nop,TS val 238245 ecr 19696,mptcp dss ack 3516156078 seq 909615571 subseq 414121 len 1428 csum 0xe2fb], length 1428
10:05:07.331095 IP 112.26.0.1.44259 > 112.26.0.8.39832: Flags [.], seq 1039397:1040825, ack 1, win 4017, options [nop,nop,TS val 237735 ecr 19363,mptcp dss ack 3516156078 seq 909609859 subseq 1039397 len 1428 csum 0xbd96], length 1428
10:05:07.417853 IP 112.26.0.8.39832 > 112.26.0.1.44259: Flags [.], ack 1032257, win 24536, options [nop,nop,TS val 19875 ecr 236220,nop,nop,sack 1 {1033685:1037969},mptcp dss ack 909584155], length 0
10:05:07.427833 IP 112.26.0.8.46287 > 112.26.1.1.44259: Flags [.], ack 191352, win 24536, options [nop,nop,TS val 20368 ecr 237607,mptcp dss ack 909584155], length 0
