10:03:35.357514 IP 112.26.0.8.39832 > 112.26.0.1.44259: Flags [S], seq 320401172, win 65535, options [mss 1460,sackOK,TS val 4294895694 ecr 0,nop,wscale 6,mptcp capable csum {0xf327a5bbfaf142aa}], length 0
10:03:35.366419 IP 112.26.0.8.39832 > 112.26.0.1.44259: Flags [S], seq 320401172, win 65535, options [mss 1460,sackOK,TS val 4294895694 ecr 0,nop,wscale 6,mptcp capable csum {0xf327a5bbfaf142aa}], length 0
10:03:35.375786 IP 112.26.0.1.44259 > 112.26.0.8.39832: Flags [S.], seq 2060943637, ack 320401173, win 65535, options [mss 1460,sackOK,TS val 146370 ecr 4294895694,nop,wscale 6,mptcp capable csum {0x72067753b755f75d}], length 0
10:03:35.463441 IP 112.26.0.1.44259 > 112.26.0.8.39832: Flags [S.], seq 2060943637, ack 320401173, win 65535, options [mss 1460,sackOK,TS val 146370 ecr 4294895694,nop,wscale 6,mptcp capable csum {0x72067753b755f75d}], length 0
10:03:35.479145 IP 112.26.0.1.44259 > 112.26.0.8.39832: Flags [S.], seq 2060943637, ack 320401173, win 65535, options [mss 1460,sackOK,TS val 146370 ecr 4294895694,nop,wscale 6,mptcp capable csum {0x72067753b755f75d}], length 0
10:03:35.561447 IP 112.26.0.8.39832 > 112.26.0.1.44259: Flags [.], ack 1, win 1369, options [nop,nop,TS val 4294895932 ecr 146370,mptcp capable csum {0xf327a5bbfaf142aa,0x72067753b755f75d},mptcp dss ack 908116359], length 0
10:03:35.561667 IP 112.26.0.8.39832 > 112.26.0.1.44259: Flags [.], ack 1, win 1369, options [nop,nop,TS val 4294895932 ecr 146370,mptcp capable csum {0xf327a5bbfaf142aa,0x72067753b755f75d},mptcp dss ack 908116359], length 0
10:04:14.595022 IP 112.26.0.1.44259 > 112.26.0.8.39832: Flags [.], seq 598145:599573, ack 1, win 4017, options [nop,nop,TS val 185425 ecr 4294934458,mptcp dss ack 3516156078 seq 908745919 subseq 598145 len 1428 csum 0xb9a1], length 1428
10:04:14.596630 IP 112.26.0.8.39832 > 112.26.0.1.44259: Flags [.], ack 573869, win 24576, options [nop,nop,TS val 4294935030 ecr 184604,nop,nop,sack 2 {583865:585293}{575297:581009},mptcp dss ack 908721643], length 0
10:04:14.599844 IP 112.26.0.1.44259 > 112.26.0.8.39832: Flags [.], seq 583865:585293, ack 1, win 4017, options [nop,nop,TS val 185024 ecr 4294934036,mptcp dss ack 3516156078 seq 908731639 subseq 583865 len 1428 csum 0x841b], length 1428
10:04:14.608390 IP 112.26.0.1.44259 > 112.26.0.8.39832: Flags [P.], seq 599573:601001, ack 1, win 4017, options [nop,nop,TS val 185425 ecr 4294934458,mptcp dss ack 3516156078 seq 908747347 subseq 599573 len 1428 csum 0x437d], length 1428
10:04:14.617776 IP 112.26.0.1.44259 > 112.26.0.8.39832: Flags [.], seq 586721:588149, ack 1, win 4017, options [nop,nop,TS val 185024 ecr 4294934036,mptcp dss ack 3516156078 seq 908734495 subseq 586721 len 1428 csum 0x9c06], length 1428
10:04:14.689017 IP 112.26.0.1.44259 > 112.26.0.8.39832: Flags [.], seq 601001:602429, ack 1, win 4017, options [nop,nop,TS val 185425 ecr 4294934458,mptcp dss ack 3516156078 seq 908748775 subseq 601001 len 1428 csum 0x61e], length 1428
10:04:14.693088 IP 112.26.0.8.39832 > 112.26.0.1.44259: Flags [.], ack 573869, win 24576, options [nop,nop,TS val 4294935030 ecr 184604,nop,nop,sack 2 {583865:585293}{575297:581009},mptcp dss ack 908721643], length 0
10:04:14.698083 IP 112.26.0.1.44259 > 112.26.0.8.39832: Flags [.], seq 588149:589577, ack 1, win 4017, options [nop,nop,TS val 185024 ecr 4294934036,mptcp dss ack 3516156078 seq 908735923 subseq 588149 len 1428 csum 0xba83], length 1428
10:04:14.709000 IP 112.26.0.1.44259 > 112.26.0.8.39832: Flags [.], seq 602429:603857, ack 1, win 4017, options [nop,nop,TS val 185512 ecr 4294934555,mptcp dss ack 3516156078 seq 908750203 subseq 602429 len 1428 csum 0x9db9], length 1428
10:04:14.711429 IP 112.26.0.1.44259 > 112.26.0.8.39832: Flags [.], seq 586721:588149, ack 1, win 4017, options [nop,nop,TS val 185024 ecr 4294934036,mptcp dss ack 3516156078 seq 908734495 subseq 586721 len 1428 csum 0x9c06], length 1428
10:04:14.716686 IP 112.26.0.8.39832 > 112.26.0.1.44259: Flags [.], ack 573869, win 24576, options [nop,nop,TS val 4294935165 ecr 184604,nop,nop,sack 2 {586721:588149}{583865:585293},mptcp dss ack 908721643], length 0
10:04:14.782001 IP 112.26.0.1.44259 > 112.26.0.8.39832: Flags [.], seq 603857:605285, ack 1, win 4017, options [nop,nop,TS val 185512 ecr 4294934555,mptcp dss ack 3516156078 seq 908751631 subseq 603857 len 1428 csum 0x1e4], length 1428
10:04:14.791919 IP 112.26.0.1.44259 > 112.26.0.8.39832: Flags [.], seq 591005:592433, ack 1, win 4017, options [nop,nop,TS val 185097 ecr 4294934067,mptcp dss ack 3516156078 seq 908738779 subseq 591005 len 1428 csum 0xe61], length 1428
10:04:14.799672 IP 112.26.0.1.44259 > 112.26.0.8.39832: Flags [.], seq 588149:589577, ack 1, win 4017, options [nop,nop,TS val 185024 ecr 4294934036,mptcp dss ack 3516156078 seq 908735923 subseq 588149 len 1428 csum 0xba83], length 1428
10:04:14.809594 IP 112.26.0.8.39832 > 112.26.0.1.44259: Flags [.], ack 573869, win 24576, options [nop,nop,TS val 4294935253 ecr 184604,nop,nop,sack 2 {586721:589577}{583865:585293},mptcp dss ack 908721643], length 0
10:04:14.821255 IP 112.26.0.1.44259 > 112.26.0.8.39832: Flags [.], seq 605285:606713, ack 1, win 4017, options [nop,nop,TS val 185682 ecr 4294934637,mptcp dss ack 3516156078 seq 908753059 subseq 605285 len 1428 csum 0x4342], length 1428
10:04:14.884253 IP 112.26.0.1.44259 > 112.26.0.8.39832: Flags [.], seq 592433:593861, ack 1, win 4017, options [nop,nop,TS val 185177 ecr 4294934158,mptcp dss ack 3516156078 seq 908740207 subseq 592433 len 1428 csum 0x7de], length 1428
10:04:14.895592 IP 112.26.0.1.44259 > 112.26.0.8.39832: Flags [.], seq 606713:608141, ack 1, win 4017, options [nop,nop,TS val 185805 ecr 4294934662,mptcp dss ack 3516156078 seq 908754487 subseq 606713 len 1428 csum 0xa051], length 1428
10:04:14.908797 IP 112.26.0.1.44259 > 112.26.0.8.39832: Flags [.], seq 593861:595289, ack 1, win 4017, options [nop,nop,TS val 185276 ecr 4294934240,mptcp dss ack 3516156078 seq 908741635 subseq 593861 len 1428 csum 0x5df9], length 1428
10:04:14.913893 IP 112.26.0.1.44259 > 112.26.0.8.39832: Flags [.], seq 608141:609569, ack 1, win 4017, options [nop,nop,TS val 185805 ecr 4294934662,mptcp dss ack 3516156078 seq 908755915 subseq 608141 len 1428 csum 0x6f2f], length 1428
10:04:14.919466 IP 112.26.0.8.39832 > 112.26.0.1.44259: Flags [.], ack 573869, win 24576, options [nop,nop,TS val 4294935165 ecr 184604,nop,nop,sack 2 {586721:588149}{583865:585293},mptcp dss ack 908721643], length 0
10:04:14.984081 IP 112.26.0.1.44259 > 112.26.0.8.39832: Flags [.], seq 609569:610997, ack 1, win 4017, options [nop,nop,TS val 185832 ecr 4294934745,mptcp dss ack 3516156078 seq 908757343 subseq 609569 len 1428 csum 0x6b33], length 1428
10:04:14.999667 IP 112.26.0.1.44259 > 112.26.0.8.39832: Flags [.], seq 610997:612425, ack 1, win 4017, options [nop,nop,TS val 185904 ecr 4294934771,mptcp dss ack 3516156078 seq 908758771 subseq 610997 len 1428 csum 0x3e3c], length 1428
10:04:15.002507 IP 112.26.0.1.44259 > 112.26.0.8.39832: Flags [.], seq 591005:592433, ack 1, win 4017, options [nop,nop,TS val 185097 ecr 4294934067,mptcp dss ack 3516156078 seq 908738779 subseq 591005 len 1428 csum 0xe61], length 1428
10:04:15.006775 IP 112.26.0.8.39832 > 112.26.0.1.44259: Flags [.], ack 573869, win 24576, options [nop,nop,TS val 4294935455 ecr 184604,nop,nop,sack 2 {591005:592433}{586721:589577},mptcp dss ack 908721643], length 0
10:04:15.011187 IP 112.26.0.1.44259 > 112.26.0.8.39832: Flags [.], seq 596717:598145, ack 1, win 4017, options [nop,nop,TS val 185328 ecr 4294934326,mptcp dss ack 3516156078 seq 908744491 subseq 596717 len 1428 csum 0x9825], length 1428
10:04:15.023300 IP 112.26.0.1.44259 > 112.26.0.8.39832: Flags [.], seq 612425:613853, ack 1, win 4017, options [nop,nop,TS val 185904 ecr 4294934771,mptcp dss ack 3516156078 seq 908760199 subseq 612425 len 1428 csum 0xa8a5], length 1428
10:04:15.084010 IP 112.26.0.1.44259 > 112.26.0.8.39832: Flags [.], seq 573869:575297, ack 1, win 4017, options [nop,nop,TS val 186048 ecr 4294934858,mptcp dss ack 3516156078 seq 908721643 subseq 573869 len 1428 csum 0x778d], length 1428
10:04:15.090351 IP 112.26.0.8.39832 > 112.26.0.1.44259: Flags [.], ack 573869, win 24576, options [nop,nop,TS val 4294935253 ecr 184604,nop,nop,sack 2 {586721:589577}{583865:585293},mptcp dss ack 908721643], length 0
10:04:15.096074 IP 112.26.0.1.44259 > 112.26.0.8.39832: Flags [P.], seq 599573:601001, ack 1, win 4017, options [nop,nop,TS val 185425 ecr 4294934458,mptcp dss ack 3516156078 seq 908747347 subseq 599573 len 1428 csum 0x437d], length 1428
10:04:15.116727 IP 112.26.0.1.44259 > 112.26.0.8.39832: Flags [.], seq 592433:593861, ack 1, win 4017, options [nop,nop,TS val 185177 ecr 4294934158,mptcp dss ack 3516156078 seq 908740207 subseq 592433 len 1428 csum 0x7de], length 1428
10:04:15.120652 IP 112.26.0.8.39832 > 112.26.0.1.44259: Flags [.], ack 573869, win 24576, options [nop,nop,TS val 4294935570 ecr 184604,nop,nop,sack 2 {591005:593861}{586721:589577},mptcp dss ack 908721643], length 0
10:04:15.125979 IP 112.26.0.1.44259 > 112.26.0.8.39832: Flags [.], seq 601001:602429, ack 1, win 4017, options [nop,nop,TS val 185425 ecr 4294934458,mptcp dss ack 3516156078 seq 908748775 subseq 601001 len 1428 csum 0x61e], length 1428
10:04:15.191601 IP 112.26.0.1.44259 > 112.26.0.8.39832: Flags [.], seq 593861:595289, ack 1, win 4017, options [nop,nop,TS val 185276 ecr 4294934240,mptcp dss ack 3516156078 seq 908741635 subseq 593861 len 1428 csum 0x5df9], length 1428
10:04:15.201853 IP 112.26.0.1.44259 > 112.26.0.8.39832: Flags [.], seq 602429:603857, ack 1, win 4017, options [nop,nop,TS val 185512 ecr 4294934555,mptcp dss ack 3516156078 seq 908750203 subseq 602429 len 1428 csum 0x9db9], length 1428
10:04:15.206689 IP 112.26.0.8.39832 > 112.26.0.1.44259: Flags [.], ack 573869, win 24576, options [nop,nop,TS val 4294935645 ecr 184604,nop,nop,sack 2 {591005:595289}{586721:589577},mptcp dss ack 908721643], length 0
10:04:15.211933 IP 112.26.0.1.44259 > 112.26.0.8.39832: Flags [.], seq 603857:605285, ack 1, win 4017, options [nop,nop,TS val 185512 ecr 4294934555,mptcp dss ack 3516156078 seq 908751631 subseq 603857 len 1428 csum 0x1e4], length 1428
10:04:15.297237 IP 112.26.0.1.44259 > 112.26.0.8.39832: Flags [.], seq 605285:606713, ack 1, win 4017, options [nop,nop,TS val 185682 ecr 4294934637,mptcp dss ack 3516156078 seq 908753059 subseq 605285 len 1428 csum 0x4342], length 1428
10:04:15.304448 IP 112.26.0.1.44259 > 112.26.0.8.39832: Flags [.], seq 606713:608141, ack 1, win 4017, options [nop,nop,TS val 185805 ecr 4294934662,mptcp dss ack 3516156078 seq 908754487 subseq 606713 len 1428 csum 0xa051], length 1428
10:04:15.309870 IP 112.26.0.8.39832 > 112.26.0.1.44259: Flags [.], ack 573869, win 24576, options [nop,nop,TS val 4294935455 ecr 184604,nop,nop,sack 2 {591005:592433}{586721:589577},mptcp dss ack 908721643], length 0
10:04:15.395218 IP 112.26.0.1.44259 > 112.26.0.8.39832: Flags [.], seq 608141:609569, ack 1, win 4017, options [nop,nop,TS val 185805 ecr 4294934662,mptcp dss ack 3516156078 seq 908755915 subseq 608141 len 1428 csum 0x6f2f], length 1428
10:04:15.400546 IP 112.26.0.1.44259 > 112.26.0.8.39832: Flags [.], seq 596717:598145, ack 1, win 4017, options [nop,nop,TS val 185328 ecr 4294934326,mptcp dss ack 3516156078 seq 908744491 subseq 596717 len 1428 csum 0x9825], length 1428
10:04:15.408342 IP 112.26.0.8.39832 > 112.26.0.1.44259: Flags [.], ack 573869, win 24576, options [nop,nop,TS val 4294935165 ecr 184604,nop,nop,sack 2 {586721:588149}{583865:585293},mptcp dss ack 908721643], length 0
10:04:15.410078 IP 112.26.0.1.44259 > 112.26.0.8.39832: Flags [.], seq 581009:582437, ack 1, win 4017, options [nop,nop,TS val 186411 ecr 4294935165,mptcp dss ack 3516156078 seq 908728783 subseq 581009 len 1428 csum 0x20dc], length 1428
10:04:15.485506 IP 112.26.0.1.44259 > 112.26.0.8.39832: Flags [.], seq 582437:583865, ack 1, win 4017, options [nop,nop,TS val 186411 ecr 4294935165,mptcp dss ack 3516156078 seq 908730211 subseq 582437 len 1428 csum 0x23d5], length 1428
10:04:15.491959 IP 112.26.0.1.44259 > 112.26.0.8.39832: Flags [P.], seq 599573:601001, ack 1, win 4017, options [nop,nop,TS val 185425 ecr 4294934458,mptcp dss ack 3516156078 seq 908747347 subseq 599573 len 1428 csum 0x437d], length 1428
10:04:15.498368 IP 112.26.0.1.44259 > 112.26.0.8.39832: Flags [.], seq 610997:612425, ack 1, win 4017, options [nop,nop,TS val 185904 ecr 4294934771,mptcp dss ack 3516156078 seq 908758771 subseq 610997 len 1428 csum 0x3e3c], length 1428
10:04:15.506491 IP 112.26.0.8.39832 > 112.26.0.1.44259: Flags [.], ack 573869, win 24576, options [nop,nop,TS val 4294935570 ecr 184604,nop,nop,sack 2 {591005:593861}{586721:589577},mptcp dss ack 908721643], length 0
10:04:15.512303 IP 112.26.0.1.44259 > 112.26.0.8.39832: Flags [.], seq 573869:575297, ack 1, win 4017, options [nop,nop,TS val 186048 ecr 4294934858,mptcp dss ack 3516156078 seq 908721643 subseq 573869 len 1428 csum 0x778d], length 1428
10:04:15.518469 IP 112.26.0.1.44259 > 112.26.0.8.39832: Flags [.], seq 601001:602429, ack 1, win 4017, options [nop,nop,TS val 185425 ecr 4294934458,mptcp dss ack 3516156078 seq 908748775 subseq 601001 len 1428 csum 0x61e], length 1428
10:04:15.594556 IP 112.26.0.8.39832 > 112.26.0.1.44259: Flags [.], ack 573869, win 24576, options [nop,nop,TS val 4294935455 ecr 184604,nop,nop,sack 2 {591005:592433}{586721:589577},mptcp dss ack 908721643], length 0
10:04:15.597754 IP 112.26.0.1.44259 > 112.26.0.8.39832: Flags [.], seq 585293:586721, ack 1, win 4017, options [nop,nop,TS val 186597 ecr 4294935455,mptcp dss ack 3516156078 seq 908733067 subseq 585293 len 1428 csum 0x1e87], length 1428
10:04:15.603285 IP 112.26.0.8.39832 > 112.26.0.1.44259: Flags [.], ack 573869, win 24576, options [nop,nop,TS val 4294935645 ecr 184604,nop,nop,sack 2 {591005:595289}{586721:589577},mptcp dss ack 908721643], length 0
10:04:15.685596 IP 112.26.0.1.44259 > 112.26.0.8.39832: Flags [.], seq 602429:603857, ack 1, win 4017, options [nop,nop,TS val 185512 ecr 4294934555,mptcp dss ack 3516156078 seq 908750203 subseq 602429 len 1428 csum 0x9db9], length 1428
10:04:15.696839 IP 112.26.0.1.44259 > 112.26.0.8.39832: Flags [.], seq 581009:582437, ack 1, win 4017, options [nop,nop,TS val 186411 ecr 4294935165,mptcp dss ack 3516156078 seq 908728783 subseq 581009 len 1428 csum 0x20dc], length 1428
10:04:15.703201 IP 112.26.0.1.44259 > 112.26.0.8.39832: Flags [.], seq 603857:605285, ack 1, win 4017, options [nop,nop,TS val 185512 ecr 4294934555,mptcp dss ack 3516156078 seq 908751631 subseq 603857 len 1428 csum 0x1e4], length 1428
10:04:15.714567 IP 112.26.0.1.44259 > 112.26.0.8.39832: Flags [.], seq 582437:583865, ack 1, win 4017, options [nop,nop,TS val 186411 ecr 4294935165,mptcp dss ack 3516156078 seq 908730211 subseq 582437 len 1428 csum 0x23d5], length 1428
10:04:15.719154 IP 112.26.0.1.44259 > 112.26.0.8.39832: Flags [.], seq 605285:606713, ack 1, win 4017, options [nop,nop,TS val 185682 ecr 4294934637,mptcp dss ack 3516156078 seq 908753059 subseq 605285 len 1428 csum 0x4342], length 1428
10:04:15.797884 IP 112.26.0.8.39832 > 112.26.0.1.44259: Flags [.], ack 573869, win 24576, options [nop,nop,TS val 4294935570 ecr 184604,nop,nop,sack 2 {591005:593861}{586721:589577},mptcp dss ack 908721643], length 0
10:04:15.803275 IP 112.26.0.1.44259 > 112.26.0.8.39832: Flags [.], seq 589577:591005, ack 1, win 4017, options [nop,nop,TS val 186801 ecr 4294935570,mptcp dss ack 3516156078 seq 908737351 subseq 589577 len 1428 csum 0x1600], length 1428
10:04:15.810475 IP 112.26.0.1.44259 > 112.26.0.8.39832: Flags [.], seq 606713:608141, ack 1, win 4017, options [nop,nop,TS val 185805 ecr 4294934662,mptcp dss ack 3516156078 seq 908754487 subseq 606713 len 1428 csum 0xa051], length 1428
10:04:15.817599 IP 112.26.0.1.44259 > 112.26.0.8.39832: Flags [.], seq 585293:586721, ack 1, win 4017, options [nop,nop,TS val 186597 ecr 4294935455,mptcp dss ack 3516156078 seq 908733067 subseq 585293 len 1428 csum 0x1e87], length 1428
10:04:15.886995 IP 112.26.2.1.44259 > 112.26.0.8.41345: Flags [.], seq 2140590676:2140592104, ack 388865366, win 4017, options [nop,nop,TS val 186880 ecr 4294916715,mptcp dss ack 3516156078 seq 908327515 subseq 9997 len 1428 csum 0x70f5], length 1428
10:04:15.901635 IP 112.26.0.8.39832 > 112.26.0.1.44259: Flags [.], ack 573869, win 24576, options [nop,nop,TS val 4294935645 ecr 184604,nop,nop,sack 2 {591005:595289}{586721:589577},mptcp dss ack 908721643], length 0
10:04:15.905989 IP 112.26.1.1.44259 > 112.26.0.8.46287: Flags [.], seq 657411891:657413319, ack 2308197351, win 4017, options [nop,nop,TS val 186880 ecr 4294906271,mptcp dss ack 3516156078 seq 908301811 subseq 1429 len 1428 csum 0x3c97], length 1428
10:04:15.914102 IP 112.26.0.8.39832 > 112.26.0.1.44259: Flags [.], ack 573869, win 24576, options [nop,nop,TS val 4294935875 ecr 184604,nop,nop,sack 2 {599573:601001}{596717:598145},mptcp dss ack 908721643], length 0
10:04:15.917875 IP 112.26.0.1.44259 > 112.26.0.8.39832: Flags [.], seq 589577:591005, ack 1, win 4017, options [nop,nop,TS val 186801 ecr 4294935570,mptcp dss ack 3516156078 seq 908737351 subseq 589577 len 1428 csum 0x1600], length 1428
10:04:15.992360 IP 112.26.0.1.44259 > 112.26.0.8.39832: Flags [.], seq 610997:612425, ack 1, win 4017, options [nop,nop,TS val 185904 ecr 4294934771,mptcp dss ack 3516156078 seq 908758771 subseq 610997 len 1428 csum 0x3e3c], length 1428
10:04:16.013814 IP 112.26.0.1.44259 > 112.26.0.8.39832: Flags [.], seq 573869:575297, ack 1, win 4017, options [nop,nop,TS val 186048 ecr 4294934858,mptcp dss ack 3516156078 seq 908721643 subseq 573869 len 1428 csum 0x778d], length 1428
10:04:35.313788 IP 112.26.0.1.44259 > 112.26.0.8.39832: Flags [.], seq 778073:779501, ack 1, win 4017, options [nop,nop,TS val 205727 ecr 4294954670,mptcp dss ack 3516156078 seq 909041515 subseq 778073 len 1428 csum 0x25fc], length 1428
10:04:35.315635 IP 112.26.0.1.44259 > 112.26.0.8.39832: Flags [.], seq 778073:779501, ack 1, win 4017, options [nop,nop,TS val 205727 ecr 4294954670,mptcp dss ack 3516156078 seq 909041515 subseq 778073 len 1428 csum 0x25fc], length 1428
10:04:53.852728 IP 112.26.1.1.44259 > 112.26.0.8.46287: Flags [.], seq 297024:298452, ack 1, win 4017, options [nop,nop,TS val 224340 ecr 5972,mptcp dss ack 3516156078 seq 909391375 subseq 298453 len 1428 csum 0xce81], length 1428
10:04:53.855204 IP 112.26.1.1.44259 > 112.26.0.8.46287: Flags [.], seq 297024:298452, ack 1, win 4017, options [nop,nop,TS val 224340 ecr 5972,mptcp dss ack 3516156078 seq 909391375 subseq 298453 len 1428 csum 0xce81], length 1428
10:04:53.923387 IP 112.26.0.8.39832 > 112.26.0.1.44259: Flags [.], ack 906593, win 24558, options [nop,nop,TS val 6303 ecr 221234,nop,nop,sack 2 {928013:929441}{918017:926585},mptcp dss ack 909329971], length 0
10:04:53.925672 IP 112.26.1.1.44259 > 112.26.0.8.46287: Flags [.], seq 302736:304164, ack 1, win 4017, options [nop,nop,TS val 224926 ecr 6701,mptcp dss ack 3516156078 seq 909399943 subseq 304165 len 1428 csum 0xb0c3], length 1428
10:04:53.927956 IP 112.26.0.1.44259 > 112.26.0.8.39832: Flags [.], seq 916589:918017, ack 1, win 4017, options [nop,nop,TS val 224112 ecr 5484,mptcp dss ack 3516156078 seq 909341395 subseq 916589 len 1428 csum 0xa4a2], length 1428
10:04:53.942931 IP 112.26.0.8.35259 > 112.26.3.1.44259: Flags [.], ack 722880264, win 24558, options [nop,nop,TS val 6784 ecr 220320,nop,nop,sack 2 {5713:7141}{5713:7141},mptcp dss ack 909329971], length 0
10:04:53.952073 IP 112.26.0.1.44259 > 112.26.0.8.39832: Flags [.], seq 926585:928013, ack 1, win 4017, options [nop,nop,TS val 224926 ecr 6303,mptcp dss ack 3516156078 seq 909371383 subseq 926585 len 1428 csum 0xc083], length 1428
10:04:53.964187 IP 112.26.0.1.44259 > 112.26.0.8.39832: Flags [.], seq 930869:932297, ack 1, win 4017, options [nop,nop,TS val 224430 ecr 5697,mptcp dss ack 3516156078 seq 909394231 subseq 930869 len 1428 csum 0x63a2], length 1428
10:04:54.019948 IP 112.26.0.8.39832 > 112.26.0.1.44259: Flags [.], ack 906593, win 24558, options [nop,nop,TS val 6792 ecr 221234,nop,nop,sack 2 {908021:916589}{928013:929441},mptcp dss ack 909329971], length 0
10:04:54.033937 IP 112.26.1.1.44259 > 112.26.0.8.46287: Flags [.], seq 299880:301308, ack 1, win 4017, options [nop,nop,TS val 224514 ecr 6105,mptcp dss ack 3516156078 seq 909395659 subseq 301309 len 1428 csum 0x28ba], length 1428
10:04:54.036427 IP 112.26.1.1.44259 > 112.26.0.8.46287: Flags [.], seq 299880:301308, ack 1, win 4017, options [nop,nop,TS val 224514 ecr 6105,mptcp dss ack 3516156078 seq 909395659 subseq 301309 len 1428 csum 0x28ba], length 1428
10:04:54.046811 IP 112.26.0.8.46287 > 112.26.1.1.44259: Flags [.], ack 287028, win 24558, options [nop,nop,TS val 6893 ecr 223214,nop,nop,sack 1 {288456:295596},mptcp dss ack 909329971], length 0
10:05:10.121532 IP 112.26.0.1.44259 > 112.26.0.8.39832: Flags [.], seq 1056533:1057961, ack 1, win 4017, options [nop,nop,TS val 240915 ecr 22595,mptcp dss ack 3516156078 seq 909685543 subseq 1056533 len 1428 csum 0x8430], length 1428
10:05:10.135027 IP 112.26.1.1.44259 > 112.26.0.8.46287: Flags [.], seq 454104:455532, ack 1, win 4017, options [nop,nop,TS val 240650 ecr 22196,mptcp dss ack 3516156078 seq 909681259 subseq 455533 len 1428 csum 0x63a1], length 1428
10:05:10.138660 IP 112.26.1.1.44259 > 112.26.0.8.46287: Flags [.], seq 454104:455532, ack 1, win 4017, options [nop,nop,TS val 240650 ecr 22196,mptcp dss ack 3516156078 seq 909681259 subseq 455533 len 1428 csum 0x63a1], length 1428
10:05:10.159351 IP 112.26.1.1.44259 > 112.26.0.8.46287: Flags [.], seq 456960:458388, ack 1, win 4017, options [nop,nop,TS val 240946 ecr 22640,mptcp dss ack 3516156078 seq 909686971 subseq 458389 len 1428 csum 0xecb3], length 1428
10:05:10.162245 IP 112.26.0.8.46287 > 112.26.1.1.44259: Flags [.], ack 445536, win 24536, options [nop,nop,TS val 23296 ecr 240026,nop,nop,sack 1 {449820:455532},mptcp dss ack 909649843], length 0
10:05:10.162522 IP 112.26.0.8.46287 > 112.26.1.1.44259: Flags [.], ack 445536, win 24536, options [nop,nop,TS val 23296 ecr 240026,nop,nop,sack 1 {449820:455532},mptcp dss ack 909649843], length 0
10:05:10.216090 IP 112.26.1.1.44259 > 112.26.0.8.46287: Flags [.], seq 455532:456960, ack 1, win 4017, options [nop,nop,TS val 240650 ecr 22196,mptcp dss ack 3516156078 seq 909682687 subseq 456961 len 1428 csum 0x1db], length 1428
10:05:10.222246 IP 112.26.1.1.44259 > 112.26.0.8.46287: Flags [.], seq 455532:456960, ack 1, win 4017, options [nop,nop,TS val 240650 ecr 22196,mptcp dss ack 3516156078 seq 909682687 subseq 456961 len 1428 csum 0x1db], length 1428
10:05:10.236786 IP 112.26.1.1.44259 > 112.26.0.8.46287: Flags [.], seq 458388:459816, ack 1, win 4017, options [nop,nop,TS val 240946 ecr 22640,mptcp dss ack 3516156078 seq 909688399 subseq 459817 len 1428 csum 0xc3e], length 1428
10:05:10.252345 IP 112.26.0.8.46287 > 112.26.1.1.44259: Flags [.], ack 445536, win 24536, options [nop,nop,TS val 23379 ecr 240026,nop,nop,sack 1 {449820:456960},mptcp dss ack 909649843], length 0
10:05:10.252694 IP 112.26.0.8.46287 > 112.26.1.1.44259: Flags [.], ack 445536, win 24536, options [nop,nop,TS val 23379 ecr 240026,nop,nop,sack 1 {449820:456960},mptcp dss ack 909649843], length 0
10:05:10.254988 IP 112.26.0.1.44259 > 112.26.0.8.39832: Flags [.], seq 1055105:1056533, ack 1, win 4017, options [nop,nop,TS val 240915 ecr 22595,mptcp dss ack 3516156078 seq 909684115 subseq 1055105 len 1428 csum 0xf16], length 1428
10:05:10.256857 IP 112.26.0.1.44259 > 112.26.0.8.39832: Flags [.], seq 1055105:1056533, ack 1, win 4017, options [nop,nop,TS val 240915 ecr 22595,mptcp dss ack 3516156078 seq 909684115 subseq 1055105 len 1428 csum 0xf16], length 1428
10:05:10.322556 IP 112.26.1.1.44259 > 112.26.0.8.46287: Flags [.], seq 459816:461244, ack 1, win 4017, options [nop,nop,TS val 240946 ecr 22640,mptcp dss ack 3516156078 seq 909689827 subseq 461245 len 1428 csum 0x7f16], length 1428
10:05:10.335685 IP 112.26.0.1.44259 > 112.26.0.8.39832: Flags [.], seq 1056533:1057961, ack 1, win 4017, options [nop,nop,TS val 240915 ecr 22595,mptcp dss ack 3516156078 seq 909685543 subseq 1056533 len 1428 csum 0x8430], length 1428
10:05:10.340482 IP 112.26.0.8.39832 > 112.26.0.1.44259: Flags [.], ack 1052249, win 24536, options [nop,nop,TS val 23414 ecr 239948,nop,nop,sack 1 {1053677:1056533},mptcp dss ack 909649843], length 0
10:05:10.340786 IP 112.26.0.8.39832 > 112.26.0.1.44259: Flags [.], ack 1052249, win 24536, options [nop,nop,TS val 23414 ecr 239948,nop,nop,sack 1 {1053677:1056533},mptcp dss ack 909649843], length 0
10:05:10.358422 IP 112.26.0.1.44259 > 112.26.0.8.39832: Flags [.], seq 1056533:1057961, ack 1, win 4017, options [nop,nop,TS val 240915 ecr 22595,mptcp dss ack 3516156078 seq 909685543 subseq 1056533 len 1428 csum 0x8430], length 1428
10:05:10.359348 IP 112.26.1.1.44259 > 112.26.0.8.46287: Flags [.], seq 461244:462672, ack 1, win 4017, options [nop,nop,TS val 240946 ecr 22640,mptcp dss ack 3516156078 seq 909691255 subseq 462673 len 1428 csum 0xf99a], length 1428
10:05:10.364943 IP 112.26.1.1.44259 > 112.26.0.8.46287: Flags [.], seq 462672:464100, ack 1, win 4017, options [nop,nop,TS val 240946 ecr 22640,mptcp dss ack 3516156078 seq 909692683 subseq 464101 len 1428 csum 0x7060], length 1428
10:05:10.421251 IP 112.26.1.1.44259 > 112.26.0.8.46287: Flags [.], seq 456960:458388, ack 1, win 4017, options [nop,nop,TS val 240946 ecr 22640,mptcp dss ack 3516156078 seq 909686971 subseq 458389 len 1428 csum 0xecb3], length 1428
10:05:10.429910 IP 112.26.0.8.39832 > 112.26.0.1.44259: Flags [.], ack 1052249, win 24536, options [nop,nop,TS val 23502 ecr 239948,nop,nop,sack 1 {1053677:1057961},mptcp dss ack 909649843], length 0
10:05:10.430256 IP 112.26.0.8.39832 > 112.26.0.1.44259: Flags [.], ack 1052249, win 24536, options [nop,nop,TS val 23502 ecr 239948,nop,nop,sack 1 {1053677:1057961},mptcp dss ack 909649843], length 0
10:05:10.442934 IP 112.26.1.1.44259 > 112.26.0.8.46287: Flags [.], seq 456960:458388, ack 1, win 4017, options [nop,nop,TS val 240946 ecr 22640,mptcp dss ack 3516156078 seq 909686971 subseq 458389 len 1428 csum 0xecb3], length 1428
10:05:10.445641 IP 112.26.1.1.44259 > 112.26.0.8.46287: Flags [.], seq 464100:465528, ack 1, win 4017, options [nop,nop,TS val 240946 ecr 22640,mptcp dss ack 3516156078 seq 909694111 subseq 465529 len 1428 csum 0xb839], length 1428
10:05:10.449314 IP 112.26.0.8.46287 > 112.26.1.1.44259: Flags [.], ack 445536, win 24536, options [nop,nop,TS val 23580 ecr 240026,nop,nop,sack 1 {449820:458388},mptcp dss ack 909649843], length 0
10:05:10.449586 IP 112.26.0.8.46287 > 112.26.1.1.44259: Flags [.], ack 445536, win 24536, options [nop,nop,TS val 23580 ecr 240026,nop,nop,sack 1 {449820:458388},mptcp dss ack 909649843], length 0
10:05:10.459708 IP 112.26.3.1.44259 > 112.26.0.8.35259: Flags [.], seq 28561:29989, ack 0, win 4017, options [nop,nop,TS val 241023 ecr 22695,mptcp dss ack 3516156078 seq 909698395 subseq 145657 len 1428 csum 0x5750], length 1428
10:05:10.460037 IP 112.26.3.1.44259 > 112.26.0.8.35259: Flags [.], seq 28561:29989, ack 0, win 4017, options [nop,nop,TS val 241023 ecr 22695,mptcp dss ack 3516156078 seq 909698395 subseq 145657 len 1428 csum 0x5750], length 1428
10:05:10.535770 IP 112.26.0.1.44259 > 112.26.0.8.39832: Flags [.], seq 1057961:1059389, ack 1, win 4017, options [nop,nop,TS val 241051 ecr 22768,mptcp dss ack 3516156078 seq 909702679 subseq 1057961 len 1428 csum 0xd9c9], length 1428
10:05:10.537977 IP 112.26.1.1.44259 > 112.26.0.8.46287: Flags [.], seq 458388:459816, ack 1, win 4017, options [nop,nop,TS val 240946 ecr 22640,mptcp dss ack 3516156078 seq 909688399 subseq 459817 len 1428 csum 0xc3e], length 1428
10:05:10.547214 IP 112.26.1.1.44259 > 112.26.0.8.46287: Flags [.], seq 458388:459816, ack 1, win 4017, options [nop,nop,TS val 240946 ecr 22640,mptcp dss ack 3516156078 seq 909688399 subseq 459817 len 1428 csum 0xc3e], length 1428
10:05:10.551958 IP 112.26.0.8.46287 > 112.26.1.1.44259: Flags [.], ack 445536, win 24536, options [nop,nop,TS val 23696 ecr 240026,nop,nop,sack 1 {449820:459816},mptcp dss ack 909649843], length 0
10:05:10.552266 IP 112.26.0.8.46287 > 112.26.1.1.44259: Flags [.], ack 445536, win 24536, options [nop,nop,TS val 23696 ecr 240026,nop,nop,sack 1 {449820:459816},mptcp dss ack 909649843], length 0
10:05:10.625014 IP 112.26.1.1.44259 > 112.26.0.8.46287: Flags [.], seq 459816:461244, ack 1, win 4017, options [nop,nop,TS val 240946 ecr 22640,mptcp dss ack 3516156078 seq 909689827 subseq 461245 len 1428 csum 0x7f16], length 1428
10:05:10.630130 IP 112.26.3.1.44259 > 112.26.0.8.35259: Flags [.], seq 32845:34273, ack 0, win 4017, options [nop,nop,TS val 241318 ecr 22876,mptcp dss ack 3516156078 seq 909705535 subseq 149941 len 1428 csum 0xdafc], length 1428
10:05:10.630456 IP 112.26.3.1.44259 > 112.26.0.8.35259: Flags [.], seq 32845:34273, ack 0, win 4017, options [nop,nop,TS val 241318 ecr 22876,mptcp dss ack 3516156078 seq 909705535 subseq 149941 len 1428 csum 0xdafc], length 1428
10:05:10.635861 IP 112.26.0.8.46287 > 112.26.1.1.44259: Flags [.], ack 445536, win 24536, options [nop,nop,TS val 23790 ecr 240026,nop,nop,sack 1 {449820:461244},mptcp dss ack 909649843], length 0
10:05:10.636176 IP 112.26.0.8.46287 > 112.26.1.1.44259: Flags [.], ack 445536, win 24536, options [nop,nop,TS val 23790 ecr 240026,nop,nop,sack 1 {449820:461244},mptcp dss ack 909649843], length 0
10:05:10.639376 IP 112.26.1.1.44259 > 112.26.0.8.46287: Flags [.], seq 459816:461244, ack 1, win 4017, options [nop,nop,TS val 240946 ecr 22640,mptcp dss ack 3516156078 seq 909689827 subseq 461245 len 1428 csum 0x7f16], length 1428
10:05:10.652955 IP 112.26.3.1.44259 > 112.26.0.8.35259: Flags [.], seq 22849:24277, ack 0, win 4017, options [nop,nop,TS val 241318 ecr 22973,mptcp dss ack 3516156078 seq 909649843 subseq 139945 len 1428 csum 0xad21], length 1428
10:05:10.653279 IP 112.26.3.1.44259 > 112.26.0.8.35259: Flags [.], seq 22849:24277, ack 0, win 4017, options [nop,nop,TS val 241318 ecr 22973,mptcp dss ack 3516156078 seq 909649843 subseq 139945 len 1428 csum 0xad21], length 1428
10:05:10.716086 IP 112.26.1.1.44259 > 112.26.0.8.46287: Flags [.], seq 461244:462672, ack 1, win 4017, options [nop,nop,TS val 240946 ecr 22640,mptcp dss ack 3516156078 seq 909691255 subseq 462673 len 1428 csum 0xf99a], length 1428
10:05:10.719933 IP 112.26.1.1.44259 > 112.26.0.8.46287: Flags [.], seq 461244:462672, ack 1, win 4017, options [nop,nop,TS val 240946 ecr 22640,mptcp dss ack 3516156078 seq 909691255 subseq 462673 len 1428 csum 0xf99a], length 1428
10:05:10.721122 IP 112.26.0.8.46287 > 112.26.1.1.44259: Flags [.], ack 445536, win 24536, options [nop,nop,TS val 23875 ecr 240026,nop,nop,sack 1 {449820:462672},mptcp dss ack 909649843], length 0
10:05:10.721395 IP 112.26.0.8.46287 > 112.26.1.1.44259: Flags [.], ack 445536, win 24536, options [nop,nop,TS val 23875 ecr 240026,nop,nop,sack 1 {449820:462672},mptcp dss ack 909649843], length 0
10:05:10.733309 IP 112.26.0.1.44259 > 112.26.0.8.39832: Flags [.], seq 1060817:1062245, ack 1, win 4017, options [nop,nop,TS val 241465 ecr 22986,mptcp dss ack 3516156078 seq 909706963 subseq 1060817 len 1428 csum 0x4809], length 1428
10:05:10.741901 IP 112.26.1.1.44259 > 112.26.0.8.46287: Flags [.], seq 462672:464100, ack 1, win 4017, options [nop,nop,TS val 240946 ecr 22640,mptcp dss ack 3516156078 seq 909692683 subseq 464101 len 1428 csum 0x7060], length 1428
10:05:10.747256 IP 112.26.0.8.46287 > 112.26.1.1.44259: Flags [.], ack 445536, win 24536, options [nop,nop,TS val 23900 ecr 240026,nop,nop,sack 1 {449820:464100},mptcp dss ack 909649843], length 0
10:05:10.747621 IP 112.26.0.8.46287 > 112.26.1.1.44259: Flags [.], ack 445536, win 24536, options [nop,nop,TS val 23900 ecr 240026,nop,nop,sack 1 {449820:464100},mptcp dss ack 909649843], length 0
10:05:10.759778 IP 112.26.1.1.44259 > 112.26.0.8.46287: Flags [.], seq 462672:464100, ack 1, win 4017, options [nop,nop,TS val 240946 ecr 22640,mptcp dss ack 3516156078 seq 909692683 subseq 464101 len 1428 csum 0x7060], length 1428
10:05:10.761546 IP 112.26.1.1.44259 > 112.26.0.8.46287: Flags [.], seq 445536:446964, ack 1, win 4017, options [nop,nop,TS val 241465 ecr 23011,mptcp dss ack 3516156078 seq 909671263 subseq 446965 len 1428 csum 0x2f76], length 1428
10:05:10.820776 IP 112.26.1.1.44259 > 112.26.0.8.46287: Flags [.], seq 464100:465528, ack 1, win 4017, options [nop,nop,TS val 240946 ecr 22640,mptcp dss ack 3516156078 seq 909694111 subseq 465529 len 1428 csum 0xb839], length 1428
10:05:10.827639 IP 112.26.1.1.44259 > 112.26.0.8.46287: Flags [.], seq 464100:465528, ack 1, win 4017, options [nop,nop,TS val 240946 ecr 22640,mptcp dss ack 3516156078 seq 909694111 subseq 465529 len 1428 csum 0xb839], length 1428
10:05:10.830304 IP 112.26.0.8.46287 > 112.26.1.1.44259: Flags [.], ack 445536, win 24536, options [nop,nop,TS val 23985 ecr 240026,nop,nop,sack 1 {449820:465528},mptcp dss ack 909649843], length 0
10:05:10.830633 IP 112.26.0.8.46287 > 112.26.1.1.44259: Flags [.], ack 445536, win 24536, options [nop,nop,TS val 23985 ecr 240026,nop,nop,sack 1 {449820:465528},mptcp dss ack 909649843], length 0
10:05:10.837323 IP 112.26.1.1.44259 > 112.26.0.8.46287: Flags [.], seq 446964:448392, ack 1, win 4017, options [nop,nop,TS val 241465 ecr 23011,mptcp dss ack 3516156078 seq 909672691 subseq 448393 len 1428 csum 0xe443], length 1428
10:05:10.855152 IP 112.26.0.1.44259 > 112.26.0.8.39832: Flags [.], seq 1057961:1059389, ack 1, win 4017, options [nop,nop,TS val 241051 ecr 22768,mptcp dss ack 3516156078 seq 909702679 subseq 1057961 len 1428 csum 0xd9c9], length 1428
10:05:10.859212 IP 112.26.0.1.44259 > 112.26.0.8.39832: Flags [.], seq 1057961:1059389, ack 1, win 4017, options [nop,nop,TS val 241051 ecr 22768,mptcp dss ack 3516156078 seq 909702679 subseq 1057961 len 1428 csum 0xd9c9], length 1428
10:05:10.928969 IP 112.26.0.8.39832 > 112.26.0.1.44259: Flags [.], ack 1052249, win 24536, options [nop,nop,TS val 24015 ecr 239948,nop,nop,sack 1 {1053677:1059389},mptcp dss ack 909649843], length 0
10:05:10.929235 IP 112.26.0.8.39832 > 112.26.0.1.44259: Flags [.], ack 1052249, win 24536, options [nop,nop,TS val 24015 ecr 239948,nop,nop,sack 1 {1053677:1059389},mptcp dss ack 909649843], length 0
10:05:10.937753 IP 112.26.0.1.44259 > 112.26.0.8.39832: Flags [.], seq 1060817:1062245, ack 1, win 4017, options [nop,nop,TS val 241465 ecr 22986,mptcp dss ack 3516156078 seq 909706963 subseq 1060817 len 1428 csum 0x4809], length 1428
10:05:10.946298 IP 112.26.0.1.44259 > 112.26.0.8.39832: Flags [.], seq 1060817:1062245, ack 1, win 4017, options [nop,nop,TS val 241465 ecr 22986,mptcp dss ack 3516156078 seq 909706963 subseq 1060817 len 1428 csum 0x4809], length 1428
10:05:10.952166 IP 112.26.0.8.39832 > 112.26.0.1.44259: Flags [.], ack 1052249, win 24536, options [nop,nop,TS val 24103 ecr 239948,nop,nop,sack 2 {1060817:1062245}{1053677:1059389},mptcp dss ack 909649843], length 0
10:05:10.952486 IP 112.26.0.8.39832 > 112.26.0.1.44259: Flags [.], ack 1052249, win 24536, options [nop,nop,TS val 24103 ecr 239948,nop,nop,sack 2 {1060817:1062245}{1053677:1059389},mptcp dss ack 909649843], length 0
10:05:10.957059 IP 112.26.1.1.44259 > 112.26.0.8.46287: Flags [.], seq 448392:449820, ack 1, win 4017, options [nop,nop,TS val 241620 ecr 23296,mptcp dss ack 3516156078 seq 909674119 subseq 449821 len 1428 csum 0xe192], length 1428
10:05:11.018253 IP 112.26.1.1.44259 > 112.26.0.8.46287: Flags [.], seq 468384:469812, ack 1, win 4017, options [nop,nop,TS val 241755 ecr 23379,mptcp dss ack 3516156078 seq 909708391 subseq 469813 len 1428 csum 0xa5c8], length 1428
10:05:11.028868 IP 112.26.1.1.44259 > 112.26.0.8.46287: Flags [.], seq 445536:446964, ack 1, win 4017, options [nop,nop,TS val 241465 ecr 23011,mptcp dss ack 3516156078 seq 909671263 subseq 446965 len 1428 csum 0x2f76], length 1428
10:05:11.041272 IP 112.26.0.1.44259 > 112.26.0.8.39832: Flags [.], seq 1062245:1063673, ack 1, win 4017, options [nop,nop,TS val 241936 ecr 23414,mptcp dss ack 3516156078 seq 909709819 subseq 1062245 len 1428 csum 0xbad7], length 1428
10:05:11.044067 IP 112.26.0.8.46287 > 112.26.1.1.44259: Flags [.], ack 446964, win 24536, options [nop,nop,TS val 24187 ecr 241465,nop,nop,sack 1 {449820:465528},mptcp dss ack 909649843], length 0
10:05:11.044375 IP 112.26.0.8.46287 > 112.26.1.1.44259: Flags [.], ack 446964, win 24536, options [nop,nop,TS val 24187 ecr 241465,nop,nop,sack 1 {449820:465528},mptcp dss ack 909649843], length 0
10:05:11.046102 IP 112.26.1.1.44259 > 112.26.0.8.46287: Flags [.], seq 445536:446964, ack 1, win 4017, options [nop,nop,TS val 241465 ecr 23011,mptcp dss ack 3516156078 seq 909671263 subseq 446965 len 1428 csum 0x2f76], length 1428
10:05:11.053464 IP 112.26.1.1.44259 > 112.26.0.8.46287: Flags [.], seq 469812:471240, ack 1, win 4017, options [nop,nop,TS val 241970 ecr 23580,mptcp dss ack 3516156078 seq 909711247 subseq 471241 len 1428 csum 0x89ae], length 1428
10:05:11.120149 IP 112.26.3.1.44259 > 112.26.0.8.35259: Flags [.], seq 32845:34273, ack 0, win 4017, options [nop,nop,TS val 241318 ecr 22876,mptcp dss ack 3516156078 seq 909705535 subseq 149941 len 1428 csum 0xdafc], length 1428
10:05:11.126166 IP 112.26.1.1.44259 > 112.26.0.8.46287: Flags [.], seq 446964:448392, ack 1, win 4017, options [nop,nop,TS val 241465 ecr 23011,mptcp dss ack 3516156078 seq 909672691 subseq 448393 len 1428 csum 0xe443], length 1428
10:05:11.129037 IP 112.26.1.1.44259 > 112.26.0.8.46287: Flags [.], seq 446964:448392, ack 1, win 4017, options [nop,nop,TS val 241465 ecr 23011,mptcp dss ack 3516156078 seq 909672691 subseq 448393 len 1428 csum 0xe443], length 1428
10:05:11.137938 IP 112.26.0.8.35259 > 112.26.3.1.44259: Flags [.], ack 22849, win 24536, options [nop,nop,TS val 24216 ecr 239509,nop,nop,sack 2 {32845:34273}{24277:28561},mptcp dss ack 909649843], length 0
10:05:11.138265 IP 112.26.0.8.35259 > 112.26.3.1.44259: Flags [.], ack 22849, win 24536, options [nop,nop,TS val 24216 ecr 239509,nop,nop,sack 2 {32845:34273}{24277:28561},mptcp dss ack 909649843], length 0
10:05:11.225370 IP 112.26.0.8.46287 > 112.26.1.1.44259: Flags [.], ack 448392, win 24536, options [nop,nop,TS val 24286 ecr 241465,nop,nop,sack 1 {449820:465528},mptcp dss ack 909649843], length 0
10:05:11.225674 IP 112.26.0.8.46287 > 112.26.1.1.44259: Flags [.], ack 448392, win 24536, options [nop,nop,TS val 24286 ecr 241465,nop,nop,sack 1 {449820:465528},mptcp dss ack 909649843], length 0
10:05:11.237417 IP 112.26.3.1.44259 > 112.26.0.8.35259: Flags [.], seq 22849:24277, ack 0, win 4017, options [nop,nop,TS val 241318 ecr 22973,mptcp dss ack 3516156078 seq 909649843 subseq 139945 len 1428 csum 0xad21], length 1428
10:05:11.250493 IP 112.26.1.1.44259 > 112.26.0.8.46287: Flags [.], seq 448392:449820, ack 1, win 4017, options [nop,nop,TS val 241620 ecr 23296,mptcp dss ack 3516156078 seq 909674119 subseq 449821 len 1428 csum 0xe192], length 1428
10:05:11.254446 IP 112.26.0.1.44259 > 112.26.0.8.39832: Flags [.], seq 1052249:1053677, ack 1, win 4017, options [nop,nop,TS val 242240 ecr 23414,mptcp dss ack 3516156078 seq 909666979 subseq 1052249 len 1428 csum 0xa7f2], length 1428
10:05:11.255437 IP 112.26.1.1.44259 > 112.26.0.8.46287: Flags [.], seq 448392:449820, ack 1, win 4017, options [nop,nop,TS val 241620 ecr 23296,mptcp dss ack 3516156078 seq 909674119 subseq 449821 len 1428 csum 0xe192], length 1428
10:05:11.264296 IP 112.26.0.8.35259 > 112.26.3.1.44259: Flags [.], ack 28561, win 24323, options [nop,nop,TS val 24394 ecr 241318,nop,nop,sack 1 {32845:34273},mptcp dss ack 909666979], length 0
10:05:11.264519 IP 112.26.0.8.35259 > 112.26.3.1.44259: Flags [.], ack 28561, win 24323, options [nop,nop,TS val 24394 ecr 241318,nop,nop,sack 1 {32845:34273},mptcp dss ack 909666979], length 0
10:05:11.322935 IP 112.26.1.1.44259 > 112.26.0.8.46287: Flags [.], seq 471240:472668, ack 1, win 4017, options [nop,nop,TS val 242240 ecr 23696,mptcp dss ack 3516156078 seq 909666979 subseq 472669 len 1428 csum 0x7ff7], length 1428
