10:03:35.346883 IP 112.26.0.8.39832 > 112.26.0.1.44259: Flags [S], seq 320401172, win 65535, options [mss 1460,sackOK,TS val 4294895694 ecr 0,nop,wscale 6,mptcp capable csum {0xf327a5bbfaf142aa}], length 0
10:03:35.357410 IP 112.26.0.8.39832 > 112.26.0.1.44259: Flags [S], seq 320401172, win 65535, options [mss 1460,sackOK,TS val 4294895694 ecr 0,nop,wscale 6,mptcp capable csum {0xf327a5bbfaf142aa}], length 0
10:03:35.367558 IP 112.26.0.8.39832 > 112.26.0.1.44259: Flags [S], seq 320401172, win 65535, options [mss 1460,sackOK,TS val 4294895694 ecr 0,nop,wscale 6,mptcp capable csum {0xf327a5bbfaf142aa}], length 0
10:03:35.464885 IP 112.26.0.1.44259 > 112.26.0.8.39832: Flags [S.], seq 2060943637, ack 320401173, win 65535, options [mss 1460,sackOK,TS val 146370 ecr 4294895694,nop,wscale 6,mptcp capable csum {0x72067753b755f75d}], length 0
10:03:35.478245 IP 112.26.0.1.44259 > 112.26.0.8.39832: Flags [S.], seq 2060943637, ack 320401173, win 65535, options [mss 1460,sackOK,TS val 146370 ecr 4294895694,nop,wscale 6,mptcp capable csum {0x72067753b755f75d}], length 0
10:03:35.549968 IP 112.26.0.8.39832 > 112.26.0.1.44259: Flags [.], ack 1, win 1369, options [nop,nop,TS val 4294895932 ecr 146370,mptcp capable csum {0xf327a5bbfaf142aa,0x72067753b755f75d},mptcp dss ack 908116359], length 0
10:03:35.561343 IP 112.26.0.8.39832 > 112.26.0.1.44259: Flags [.], ack 1, win 1369, options [nop,nop,TS val 4294895932 ecr 146370,mptcp capable csum {0xf327a5bbfaf142aa,0x72067753b755f75d},mptcp dss ack 908116359], length 0
10:04:14.580862 IP 112.26.0.8.39832 > 112.26.0.1.44259: Flags [.], ack 573869, win 24576, options [nop,nop,TS val 4294935030 ecr 184604,nop,nop,sack 2 {583865:585293}{575297:581009},mptcp dss ack 908721643], length 0
10:04:14.589784 IP 112.26.0.8.39832 > 112.26.0.1.44259: Flags [.], ack 573869, win 24576, options [nop,nop,TS val 4294935030 ecr 184604,nop,nop,sack 2 {583865:585293}{575297:581009},mptcp dss ack 908721643], length 0
10:04:14.590208 IP 112.26.0.8.39832 > 112.26.0.1.44259: Flags [.], ack 573869, win 24576, options [nop,nop,TS val 4294935030 ecr 184604,nop,nop,sack 2 {583865:585293}{575297:581009},mptcp dss ack 908721643], length 0
10:04:14.618110 IP 112.26.0.1.44259 > 112.26.0.8.39832: Flags [.], seq 586721:588149, ack 1, win 4017, options [nop,nop,TS val 185024 ecr 4294934036,mptcp dss ack 3516156078 seq 908734495 subseq 586721 len 1428 csum 0x9c06], length 1428
10:04:14.618442 IP 112.26.0.1.44259 > 112.26.0.8.39832: Flags [.], seq 586721:588149, ack 1, win 4017, options [nop,nop,TS val 185024 ecr 4294934036,mptcp dss ack 3516156078 seq 908734495 subseq 586721 len 1428 csum 0x9c06], length 1428
10:04:14.679699 IP 112.26.0.8.39832 > 112.26.0.1.44259: Flags [.], ack 573869, win 24410, options [nop,nop,TS val 4294934637 ecr 184604,mptcp dss ack 908721643], length 0
10:04:14.698521 IP 112.26.0.1.44259 > 112.26.0.8.39832: Flags [.], seq 588149:589577, ack 1, win 4017, options [nop,nop,TS val 185024 ecr 4294934036,mptcp dss ack 3516156078 seq 908735923 subseq 588149 len 1428 csum 0xba83], length 1428
10:04:14.698839 IP 112.26.0.1.44259 > 112.26.0.8.39832: Flags [.], seq 588149:589577, ack 1, win 4017, options [nop,nop,TS val 185024 ecr 4294934036,mptcp dss ack 3516156078 seq 908735923 subseq 588149 len 1428 csum 0xba83], length 1428
10:04:14.706803 IP 112.26.0.8.39832 > 112.26.0.1.44259: Flags [.], ack 573869, win 24455, options [nop,nop,TS val 4294934662 ecr 184604,nop,nop,sack 1 {575297:576725},mptcp dss ack 908721643], length 0
10:04:14.713048 IP 112.26.0.8.39832 > 112.26.0.1.44259: Flags [.], ack 573869, win 24576, options [nop,nop,TS val 4294935165 ecr 184604,nop,nop,sack 2 {586721:588149}{583865:585293},mptcp dss ack 908721643], length 0
10:04:14.716560 IP 112.26.0.8.39832 > 112.26.0.1.44259: Flags [.], ack 573869, win 24576, options [nop,nop,TS val 4294935165 ecr 184604,nop,nop,sack 2 {586721:588149}{583865:585293},mptcp dss ack 908721643], length 0
10:04:14.716949 IP 112.26.0.8.39832 > 112.26.0.1.44259: Flags [.], ack 573869, win 24576, options [nop,nop,TS val 4294935165 ecr 184604,nop,nop,sack 2 {586721:588149}{583865:585293},mptcp dss ack 908721643], length 0
10:04:14.792249 IP 112.26.0.1.44259 > 112.26.0.8.39832: Flags [.], seq 591005:592433, ack 1, win 4017, options [nop,nop,TS val 185097 ecr 4294934067,mptcp dss ack 3516156078 seq 908738779 subseq 591005 len 1428 csum 0xe61], length 1428
10:04:14.792602 IP 112.26.0.1.44259 > 112.26.0.8.39832: Flags [.], seq 591005:592433, ack 1, win 4017, options [nop,nop,TS val 185097 ecr 4294934067,mptcp dss ack 3516156078 seq 908738779 subseq 591005 len 1428 csum 0xe61], length 1428
10:04:14.802584 IP 112.26.0.8.39832 > 112.26.0.1.44259: Flags [.], ack 573869, win 24501, options [nop,nop,TS val 4294934745 ecr 184604,nop,nop,sack 1 {575297:578153},mptcp dss ack 908721643], length 0
10:04:14.808222 IP 112.26.0.8.39832 > 112.26.0.1.44259: Flags [.], ack 573869, win 24576, options [nop,nop,TS val 4294935253 ecr 184604,nop,nop,sack 2 {586721:589577}{583865:585293},mptcp dss ack 908721643], length 0
10:04:14.809469 IP 112.26.0.8.39832 > 112.26.0.1.44259: Flags [.], ack 573869, win 24576, options [nop,nop,TS val 4294935253 ecr 184604,nop,nop,sack 2 {586721:589577}{583865:585293},mptcp dss ack 908721643], length 0
10:04:14.809777 IP 112.26.0.8.39832 > 112.26.0.1.44259: Flags [.], ack 573869, win 24576, options [nop,nop,TS val 4294935253 ecr 184604,nop,nop,sack 2 {586721:589577}{583865:585293},mptcp dss ack 908721643], length 0
10:04:14.829033 IP 112.26.0.8.39832 > 112.26.0.1.44259: Flags [.], ack 573869, win 24547, options [nop,nop,TS val 4294934771 ecr 184604,nop,nop,sack 1 {575297:579581},mptcp dss ack 908721643], length 0
10:04:14.884751 IP 112.26.0.1.44259 > 112.26.0.8.39832: Flags [.], seq 592433:593861, ack 1, win 4017, options [nop,nop,TS val 185177 ecr 4294934158,mptcp dss ack 3516156078 seq 908740207 subseq 592433 len 1428 csum 0x7de], length 1428
10:04:14.885075 IP 112.26.0.1.44259 > 112.26.0.8.39832: Flags [.], seq 592433:593861, ack 1, win 4017, options [nop,nop,TS val 185177 ecr 4294934158,mptcp dss ack 3516156078 seq 908740207 subseq 592433 len 1428 csum 0x7de], length 1428
10:04:14.901884 IP 112.26.0.8.39832 > 112.26.0.1.44259: Flags [.], ack 573869, win 24576, options [nop,nop,TS val 4294934858 ecr 184604,nop,nop,sack 1 {575297:581009},mptcp dss ack 908721643], length 0
10:04:14.909125 IP 112.26.0.1.44259 > 112.26.0.8.39832: Flags [.], seq 593861:595289, ack 1, win 4017, options [nop,nop,TS val 185276 ecr 4294934240,mptcp dss ack 3516156078 seq 908741635 subseq 593861 len 1428 csum 0x5df9], length 1428
10:04:14.909464 IP 112.26.0.1.44259 > 112.26.0.8.39832: Flags [.], seq 593861:595289, ack 1, win 4017, options [nop,nop,TS val 185276 ecr 4294934240,mptcp dss ack 3516156078 seq 908741635 subseq 593861 len 1428 csum 0x5df9], length 1428
10:04:15.005279 IP 112.26.0.8.39832 > 112.26.0.1.44259: Flags [.], ack 573869, win 24576, options [nop,nop,TS val 4294935455 ecr 184604,nop,nop,sack 2 {591005:592433}{586721:589577},mptcp dss ack 908721643], length 0
10:04:15.008047 IP 112.26.0.8.39832 > 112.26.0.1.44259: Flags [.], ack 573869, win 24576, options [nop,nop,TS val 4294935455 ecr 184604,nop,nop,sack 2 {591005:592433}{586721:589577},mptcp dss ack 908721643], length 0
10:04:15.008383 IP 112.26.0.8.39832 > 112.26.0.1.44259: Flags [.], ack 573869, win 24576, options [nop,nop,TS val 4294935455 ecr 184604,nop,nop,sack 2 {591005:592433}{586721:589577},mptcp dss ack 908721643], length 0
10:04:15.011517 IP 112.26.0.1.44259 > 112.26.0.8.39832: Flags [.], seq 596717:598145, ack 1, win 4017, options [nop,nop,TS val 185328 ecr 4294934326,mptcp dss ack 3516156078 seq 908744491 subseq 596717 len 1428 csum 0x9825], length 1428
10:04:15.011756 IP 112.26.0.1.44259 > 112.26.0.8.39832: Flags [.], seq 596717:598145, ack 1, win 4017, options [nop,nop,TS val 185328 ecr 4294934326,mptcp dss ack 3516156078 seq 908744491 subseq 596717 len 1428 csum 0x9825], length 1428
10:04:15.096403 IP 112.26.0.1.44259 > 112.26.0.8.39832: Flags [P.], seq 599573:601001, ack 1, win 4017, options [nop,nop,TS val 185425 ecr 4294934458,mptcp dss ack 3516156078 seq 908747347 subseq 599573 len 1428 csum 0x437d], length 1428
10:04:15.096705 IP 112.26.0.1.44259 > 112.26.0.8.39832: Flags [P.], seq 599573:601001, ack 1, win 4017, options [nop,nop,TS val 185425 ecr 4294934458,mptcp dss ack 3516156078 seq 908747347 subseq 599573 len 1428 csum 0x437d], length 1428
10:04:15.120523 IP 112.26.0.8.39832 > 112.26.0.1.44259: Flags [.], ack 573869, win 24576, options [nop,nop,TS val 4294935570 ecr 184604,nop,nop,sack 2 {591005:593861}{586721:589577},mptcp dss ack 908721643], length 0
10:04:15.120843 IP 112.26.0.8.39832 > 112.26.0.1.44259: Flags [.], ack 573869, win 24576, options [nop,nop,TS val 4294935570 ecr 184604,nop,nop,sack 2 {591005:593861}{586721:589577},mptcp dss ack 908721643], length 0
10:04:15.122089 IP 112.26.0.8.39832 > 112.26.0.1.44259: Flags [.], ack 573869, win 24576, options [nop,nop,TS val 4294935570 ecr 184604,nop,nop,sack 2 {591005:593861}{586721:589577},mptcp dss ack 908721643], length 0
10:04:15.127078 IP 112.26.0.1.44259 > 112.26.0.8.39832: Flags [.], seq 601001:602429, ack 1, win 4017, options [nop,nop,TS val 185425 ecr 4294934458,mptcp dss ack 3516156078 seq 908748775 subseq 601001 len 1428 csum 0x61e], length 1428
10:04:15.127406 IP 112.26.0.1.44259 > 112.26.0.8.39832: Flags [.], seq 601001:602429, ack 1, win 4017, options [nop,nop,TS val 185425 ecr 4294934458,mptcp dss ack 3516156078 seq 908748775 subseq 601001 len 1428 csum 0x61e], length 1428
10:04:15.206561 IP 112.26.0.8.39832 > 112.26.0.1.44259: Flags [.], ack 573869, win 24576, options [nop,nop,TS val 4294935645 ecr 184604,nop,nop,sack 2 {591005:595289}{586721:589577},mptcp dss ack 908721643], length 0
10:04:15.206892 IP 112.26.0.8.39832 > 112.26.0.1.44259: Flags [.], ack 573869, win 24576, options [nop,nop,TS val 4294935645 ecr 184604,nop,nop,sack 2 {591005:595289}{586721:589577},mptcp dss ack 908721643], length 0
10:04:15.208232 IP 112.26.0.8.39832 > 112.26.0.1.44259: Flags [.], ack 573869, win 24576, options [nop,nop,TS val 4294935645 ecr 184604,nop,nop,sack 2 {591005:595289}{586721:589577},mptcp dss ack 908721643], length 0
10:04:15.209051 IP 112.26.0.1.44259 > 112.26.0.8.39832: Flags [.], seq 602429:603857, ack 1, win 4017, options [nop,nop,TS val 185512 ecr 4294934555,mptcp dss ack 3516156078 seq 908750203 subseq 602429 len 1428 csum 0x9db9], length 1428
10:04:15.209373 IP 112.26.0.1.44259 > 112.26.0.8.39832: Flags [.], seq 602429:603857, ack 1, win 4017, options [nop,nop,TS val 185512 ecr 4294934555,mptcp dss ack 3516156078 seq 908750203 subseq 602429 len 1428 csum 0x9db9], length 1428
10:04:15.212260 IP 112.26.0.1.44259 > 112.26.0.8.39832: Flags [.], seq 603857:605285, ack 1, win 4017, options [nop,nop,TS val 185512 ecr 4294934555,mptcp dss ack 3516156078 seq 908751631 subseq 603857 len 1428 csum 0x1e4], length 1428
10:04:15.212604 IP 112.26.0.1.44259 > 112.26.0.8.39832: Flags [.], seq 603857:605285, ack 1, win 4017, options [nop,nop,TS val 185512 ecr 4294934555,mptcp dss ack 3516156078 seq 908751631 subseq 603857 len 1428 csum 0x1e4], length 1428
10:04:15.297738 IP 112.26.0.1.44259 > 112.26.0.8.39832: Flags [.], seq 605285:606713, ack 1, win 4017, options [nop,nop,TS val 185682 ecr 4294934637,mptcp dss ack 3516156078 seq 908753059 subseq 605285 len 1428 csum 0x4342], length 1428
10:04:15.298068 IP 112.26.0.1.44259 > 112.26.0.8.39832: Flags [.], seq 605285:606713, ack 1, win 4017, options [nop,nop,TS val 185682 ecr 4294934637,mptcp dss ack 3516156078 seq 908753059 subseq 605285 len 1428 csum 0x4342], length 1428
10:04:15.304789 IP 112.26.0.1.44259 > 112.26.0.8.39832: Flags [.], seq 606713:608141, ack 1, win 4017, options [nop,nop,TS val 185805 ecr 4294934662,mptcp dss ack 3516156078 seq 908754487 subseq 606713 len 1428 csum 0xa051], length 1428
10:04:15.305081 IP 112.26.0.1.44259 > 112.26.0.8.39832: Flags [.], seq 606713:608141, ack 1, win 4017, options [nop,nop,TS val 185805 ecr 4294934662,mptcp dss ack 3516156078 seq 908754487 subseq 606713 len 1428 csum 0xa051], length 1428
10:04:15.395546 IP 112.26.0.1.44259 > 112.26.0.8.39832: Flags [.], seq 608141:609569, ack 1, win 4017, options [nop,nop,TS val 185805 ecr 4294934662,mptcp dss ack 3516156078 seq 908755915 subseq 608141 len 1428 csum 0x6f2f], length 1428
10:04:15.395772 IP 112.26.0.1.44259 > 112.26.0.8.39832: Flags [.], seq 608141:609569, ack 1, win 4017, options [nop,nop,TS val 185805 ecr 4294934662,mptcp dss ack 3516156078 seq 908755915 subseq 608141 len 1428 csum 0x6f2f], length 1428
10:04:15.402612 IP 112.26.0.8.39832 > 112.26.0.1.44259: Flags [.], ack 573869, win 24576, options [nop,nop,TS val 4294935854 ecr 184604,nop,nop,sack 2 {596717:598145}{591005:595289},mptcp dss ack 908721643], length 0
10:04:15.402948 IP 112.26.0.8.39832 > 112.26.0.1.44259: Flags [.], ack 573869, win 24576, options [nop,nop,TS val 4294935854 ecr 184604,nop,nop,sack 2 {596717:598145}{591005:595289},mptcp dss ack 908721643], length 0
10:04:15.408689 IP 112.26.0.8.39832 > 112.26.0.1.44259: Flags [.], ack 573869, win 24576, options [nop,nop,TS val 4294935165 ecr 184604,nop,nop,sack 2 {586721:588149}{583865:585293},mptcp dss ack 908721643], length 0
10:04:15.484050 IP 112.26.0.8.39832 > 112.26.0.1.44259: Flags [.], ack 573869, win 24576, options [nop,nop,TS val 4294935875 ecr 184604,nop,nop,sack 2 {599573:601001}{596717:598145},mptcp dss ack 908721643], length 0
10:04:15.484336 IP 112.26.0.8.39832 > 112.26.0.1.44259: Flags [.], ack 573869, win 24576, options [nop,nop,TS val 4294935875 ecr 184604,nop,nop,sack 2 {599573:601001}{596717:598145},mptcp dss ack 908721643], length 0
10:04:15.499465 IP 112.26.0.1.44259 > 112.26.0.8.39832: Flags [.], seq 610997:612425, ack 1, win 4017, options [nop,nop,TS val 185904 ecr 4294934771,mptcp dss ack 3516156078 seq 908758771 subseq 610997 len 1428 csum 0x3e3c], length 1428
10:04:15.499718 IP 112.26.0.1.44259 > 112.26.0.8.39832: Flags [.], seq 610997:612425, ack 1, win 4017, options [nop,nop,TS val 185904 ecr 4294934771,mptcp dss ack 3516156078 seq 908758771 subseq 610997 len 1428 csum 0x3e3c], length 1428
10:04:15.512658 IP 112.26.0.1.44259 > 112.26.0.8.39832: Flags [.], seq 573869:575297, ack 1, win 4017, options [nop,nop,TS val 186048 ecr 4294934858,mptcp dss ack 3516156078 seq 908721643 subseq 573869 len 1428 csum 0x778d], length 1428
10:04:15.512898 IP 112.26.0.1.44259 > 112.26.0.8.39832: Flags [.], seq 573869:575297, ack 1, win 4017, options [nop,nop,TS val 186048 ecr 4294934858,mptcp dss ack 3516156078 seq 908721643 subseq 573869 len 1428 csum 0x778d], length 1428
10:04:15.583592 IP 112.26.0.8.39832 > 112.26.0.1.44259: Flags [.], ack 573869, win 24576, options [nop,nop,TS val 4294935972 ecr 184604,nop,nop,sack 2 {599573:602429}{596717:598145},mptcp dss ack 908721643], length 0
10:04:15.583890 IP 112.26.0.8.39832 > 112.26.0.1.44259: Flags [.], ack 573869, win 24576, options [nop,nop,TS val 4294935972 ecr 184604,nop,nop,sack 2 {599573:602429}{596717:598145},mptcp dss ack 908721643], length 0
10:04:15.596250 IP 112.26.0.8.39832 > 112.26.0.1.44259: Flags [.], ack 573869, win 24576, options [nop,nop,TS val 4294935455 ecr 184604,nop,nop,sack 2 {591005:592433}{586721:589577},mptcp dss ack 908721643], length 0
10:04:15.689162 IP 112.26.0.8.39832 > 112.26.0.1.44259: Flags [.], ack 573869, win 24576, options [nop,nop,TS val 4294936139 ecr 184604,nop,nop,sack 2 {599573:603857}{596717:598145},mptcp dss ack 908721643], length 0
10:04:15.689455 IP 112.26.0.8.39832 > 112.26.0.1.44259: Flags [.], ack 573869, win 24576, options [nop,nop,TS val 4294936139 ecr 184604,nop,nop,sack 2 {599573:603857}{596717:598145},mptcp dss ack 908721643], length 0
10:04:15.697167 IP 112.26.0.1.44259 > 112.26.0.8.39832: Flags [.], seq 581009:582437, ack 1, win 4017, options [nop,nop,TS val 186411 ecr 4294935165,mptcp dss ack 3516156078 seq 908728783 subseq 581009 len 1428 csum 0x20dc], length 1428
10:04:15.697449 IP 112.26.0.1.44259 > 112.26.0.8.39832: Flags [.], seq 581009:582437, ack 1, win 4017, options [nop,nop,TS val 186411 ecr 4294935165,mptcp dss ack 3516156078 seq 908728783 subseq 581009 len 1428 csum 0x20dc], length 1428
10:04:15.710430 IP 112.26.0.8.39832 > 112.26.0.1.44259: Flags [.], ack 573869, win 24576, options [nop,nop,TS val 4294936156 ecr 184604,nop,nop,sack 2 {599573:605285}{596717:598145},mptcp dss ack 908721643], length 0
10:04:15.710720 IP 112.26.0.8.39832 > 112.26.0.1.44259: Flags [.], ack 573869, win 24576, options [nop,nop,TS val 4294936156 ecr 184604,nop,nop,sack 2 {599573:605285}{596717:598145},mptcp dss ack 908721643], length 0
10:04:15.714907 IP 112.26.0.1.44259 > 112.26.0.8.39832: Flags [.], seq 582437:583865, ack 1, win 4017, options [nop,nop,TS val 186411 ecr 4294935165,mptcp dss ack 3516156078 seq 908730211 subseq 582437 len 1428 csum 0x23d5], length 1428
10:04:15.715193 IP 112.26.0.1.44259 > 112.26.0.8.39832: Flags [.], seq 582437:583865, ack 1, win 4017, options [nop,nop,TS val 186411 ecr 4294935165,mptcp dss ack 3516156078 seq 908730211 subseq 582437 len 1428 csum 0x23d5], length 1428
10:04:15.788768 IP 112.26.0.8.39832 > 112.26.0.1.44259: Flags [.], ack 573869, win 24576, options [nop,nop,TS val 4294936172 ecr 184604,nop,nop,sack 2 {599573:606713}{596717:598145},mptcp dss ack 908721643], length 0
10:04:15.789097 IP 112.26.0.8.39832 > 112.26.0.1.44259: Flags [.], ack 573869, win 24576, options [nop,nop,TS val 4294936172 ecr 184604,nop,nop,sack 2 {599573:606713}{596717:598145},mptcp dss ack 908721643], length 0
10:04:15.798282 IP 112.26.0.8.39832 > 112.26.0.1.44259: Flags [.], ack 573869, win 24576, options [nop,nop,TS val 4294935570 ecr 184604,nop,nop,sack 2 {591005:593861}{586721:589577},mptcp dss ack 908721643], length 0
10:04:15.811394 IP 112.26.0.8.39832 > 112.26.0.1.44259: Flags [.], ack 573869, win 24576, options [nop,nop,TS val 4294936262 ecr 184604,nop,nop,sack 2 {599573:608141}{596717:598145},mptcp dss ack 908721643], length 0
10:04:15.811682 IP 112.26.0.8.39832 > 112.26.0.1.44259: Flags [.], ack 573869, win 24576, options [nop,nop,TS val 4294936262 ecr 184604,nop,nop,sack 2 {599573:608141}{596717:598145},mptcp dss ack 908721643], length 0
10:04:15.817929 IP 112.26.0.1.44259 > 112.26.0.8.39832: Flags [.], seq 585293:586721, ack 1, win 4017, options [nop,nop,TS val 186597 ecr 4294935455,mptcp dss ack 3516156078 seq 908733067 subseq 585293 len 1428 csum 0x1e87], length 1428
10:04:15.818225 IP 112.26.0.1.44259 > 112.26.0.8.39832: Flags [.], seq 585293:586721, ack 1, win 4017, options [nop,nop,TS val 186597 ecr 4294935455,mptcp dss ack 3516156078 seq 908733067 subseq 585293 len 1428 csum 0x1e87], length 1428
10:04:15.901968 IP 112.26.0.8.39832 > 112.26.0.1.44259: Flags [.], ack 573869, win 24576, options [nop,nop,TS val 4294935645 ecr 184604,nop,nop,sack 2 {591005:595289}{586721:589577},mptcp dss ack 908721643], length 0
10:04:15.918199 IP 112.26.0.1.44259 > 112.26.0.8.39832: Flags [.], seq 589577:591005, ack 1, win 4017, options [nop,nop,TS val 186801 ecr 4294935570,mptcp dss ack 3516156078 seq 908737351 subseq 589577 len 1428 csum 0x1600], length 1428
10:04:15.918418 IP 112.26.0.1.44259 > 112.26.0.8.39832: Flags [.], seq 589577:591005, ack 1, win 4017, options [nop,nop,TS val 186801 ecr 4294935570,mptcp dss ack 3516156078 seq 908737351 subseq 589577 len 1428 csum 0x1600], length 1428
10:04:15.994798 IP 112.26.0.8.39832 > 112.26.0.1.44259: Flags [.], ack 573869, win 24576, options [nop,nop,TS val 4294936445 ecr 184604,nop,nop,sack 2 {610997:612425}{599573:608141},mptcp dss ack 908721643], length 0
10:04:15.995077 IP 112.26.0.8.39832 > 112.26.0.1.44259: Flags [.], ack 573869, win 24576, options [nop,nop,TS val 4294936445 ecr 184604,nop,nop,sack 2 {610997:612425}{599573:608141},mptcp dss ack 908721643], length 0
10:04:16.019114 IP 112.26.0.8.39832 > 112.26.0.1.44259: Flags [.], ack 581009, win 24496, options [nop,nop,TS val 4294936467 ecr 186048,nop,nop,sack 2 {610997:612425}{599573:608141},mptcp dss ack 908728783], length 0
10:04:16.019429 IP 112.26.0.8.39832 > 112.26.0.1.44259: Flags [.], ack 581009, win 24496, options [nop,nop,TS val 4294936467 ecr 186048,nop,nop,sack 2 {610997:612425}{599573:608141},mptcp dss ack 908728783], length 0
10:04:16.027002 IP 112.26.2.1.44259 > 112.26.0.8.41345: Flags [.], seq 2140590676:2140592104, ack 388865366, win 4017, options [nop,nop,TS val 186880 ecr 4294916715,mptcp dss ack 3516156078 seq 908327515 subseq 9997 len 1428 csum 0x70f5], length 1428
10:04:16.028545 IP 112.26.2.1.44259 > 112.26.0.8.41345: Flags [.], seq 0:1428, ack 1, win 4017, options [nop,nop,TS val 186880 ecr 4294916715,mptcp dss ack 3516156078 seq 908327515 subseq 9997 len 1428 csum 0x70f5], length 1428
10:04:16.094520 IP 112.26.0.8.41345 > 112.26.2.1.44259: Flags [.], ack 1428, win 24576, options [nop,nop,TS val 4294936481 ecr 186880,nop,nop,sack 1 {0:1428},mptcp dss ack 908728783], length 0
10:04:16.094886 IP 112.26.0.8.41345 > 112.26.2.1.44259: Flags [.], ack 1428, win 24576, options [nop,nop,TS val 4294936481 ecr 186880,nop,nop,sack 1 {0:1428},mptcp dss ack 908728783], length 0
10:04:16.199857 IP 112.26.1.1.44259 > 112.26.0.8.46287: Flags [.], seq 657411891:657413319, ack 2308197351, win 4017, options [nop,nop,TS val 186880 ecr 4294906271,mptcp dss ack 3516156078 seq 908301811 subseq 1429 len 1428 csum 0x3c97], length 1428
10:04:16.202192 IP 112.26.1.1.44259 > 112.26.0.8.46287: Flags [.], seq 0:1428, ack 1, win 4017, options [nop,nop,TS val 186880 ecr 4294906271,mptcp dss ack 3516156078 seq 908301811 subseq 1429 len 1428 csum 0x3c97], length 1428
10:04:16.202911 IP 112.26.0.8.46287 > 112.26.1.1.44259: Flags [.], ack 1428, win 24576, options [nop,nop,TS val 4294936654 ecr 186880,mptcp dss ack 908728783], length 0
10:04:35.314111 IP 112.26.0.1.44259 > 112.26.0.8.39832: Flags [.], seq 778073:779501, ack 1, win 4017, options [nop,nop,TS val 205727 ecr 4294954670,mptcp dss ack 3516156078 seq 909041515 subseq 778073 len 1428 csum 0x25fc], length 1428
10:04:35.314441 IP 112.26.0.1.44259 > 112.26.0.8.39832: Flags [.], seq 778073:779501, ack 1, win 4017, options [nop,nop,TS val 205727 ecr 4294954670,mptcp dss ack 3516156078 seq 909041515 subseq 778073 len 1428 csum 0x25fc], length 1428
10:04:35.320472 IP 112.26.0.8.39832 > 112.26.0.1.44259: Flags [.], ack 779501, win 24378, options [nop,nop,TS val 4294955769 ecr 205727,mptcp dss ack 908967259], length 0
10:04:35.324252 IP 112.26.0.8.39832 > 112.26.0.1.44259: Flags [.], ack 779501, win 24378, options [nop,nop,TS val 4294955769 ecr 205727,mptcp dss ack 908967259], length 0
10:04:53.853063 IP 112.26.1.1.44259 > 112.26.0.8.46287: Flags [.], seq 297024:298452, ack 1, win 4017, options [nop,nop,TS val 224340 ecr 5972,mptcp dss ack 3516156078 seq 909391375 subseq 298453 len 1428 csum 0xce81], length 1428
10:04:53.855094 IP 112.26.1.1.44259 > 112.26.0.8.46287: Flags [.], seq 297024:298452, ack 1, win 4017, options [nop,nop,TS val 224340 ecr 5972,mptcp dss ack 3516156078 seq 909391375 subseq 298453 len 1428 csum 0xce81], length 1428
10:04:53.855832 IP 112.26.0.8.46287 > 112.26.1.1.44259: Flags [.], ack 287028, win 24558, options [nop,nop,TS val 7011 ecr 223214,nop,nop,sack 1 {288456:298452},mptcp dss ack 909329971], length 0
10:04:53.856100 IP 112.26.0.8.46287 > 112.26.1.1.44259: Flags [.], ack 287028, win 24558, options [nop,nop,TS val 7011 ecr 223214,nop,nop,sack 1 {288456:298452},mptcp dss ack 909329971], length 0
10:04:53.923737 IP 112.26.0.8.39832 > 112.26.0.1.44259: Flags [.], ack 906593, win 24558, options [nop,nop,TS val 6303 ecr 221234,nop,nop,sack 2 {928013:929441}{918017:926585},mptcp dss ack 909329971], length 0
10:04:53.938024 IP 112.26.0.8.39832 > 112.26.0.1.44259: Flags [.], ack 906593, win 24558, options [nop,nop,TS val 7085 ecr 221234,nop,nop,sack 2 {908021:926585}{928013:929441},mptcp dss ack 909329971], length 0
10:04:53.938251 IP 112.26.0.8.39832 > 112.26.0.1.44259: Flags [.], ack 906593, win 24558, options [nop,nop,TS val 7085 ecr 221234,nop,nop,sack 2 {908021:926585}{928013:929441},mptcp dss ack 909329971], length 0
10:04:53.964505 IP 112.26.0.1.44259 > 112.26.0.8.39832: Flags [.], seq 930869:932297, ack 1, win 4017, options [nop,nop,TS val 224430 ecr 5697,mptcp dss ack 3516156078 seq 909394231 subseq 930869 len 1428 csum 0x63a2], length 1428
10:04:53.964763 IP 112.26.0.1.44259 > 112.26.0.8.39832: Flags [.], seq 930869:932297, ack 1, win 4017, options [nop,nop,TS val 224430 ecr 5697,mptcp dss ack 3516156078 seq 909394231 subseq 930869 len 1428 csum 0x63a2], length 1428
10:04:54.034261 IP 112.26.1.1.44259 > 112.26.0.8.46287: Flags [.], seq 299880:301308, ack 1, win 4017, options [nop,nop,TS val 224514 ecr 6105,mptcp dss ack 3516156078 seq 909395659 subseq 301309 len 1428 csum 0x28ba], length 1428
10:04:54.036316 IP 112.26.1.1.44259 > 112.26.0.8.46287: Flags [.], seq 299880:301308, ack 1, win 4017, options [nop,nop,TS val 224514 ecr 6105,mptcp dss ack 3516156078 seq 909395659 subseq 301309 len 1428 csum 0x28ba], length 1428
10:04:54.037040 IP 112.26.0.8.46287 > 112.26.1.1.44259: Flags [.], ack 287028, win 24558, options [nop,nop,TS val 7192 ecr 223214,nop,nop,sack 2 {299880:301308}{288456:298452},mptcp dss ack 909329971], length 0
10:04:54.037354 IP 112.26.0.8.46287 > 112.26.1.1.44259: Flags [.], ack 287028, win 24558, options [nop,nop,TS val 7192 ecr 223214,nop,nop,sack 2 {299880:301308}{288456:298452},mptcp dss ack 909329971], length 0
10:04:54.049241 IP 112.26.0.8.46287 > 112.26.1.1.44259: Flags [.], ack 287028, win 24558, options [nop,nop,TS val 6893 ecr 223214,nop,nop,sack 1 {288456:295596},mptcp dss ack 909329971], length 0
10:04:54.113690 IP 112.26.1.1.44259 > 112.26.0.8.46287: Flags [.], seq 301308:302736, ack 1, win 4017, options [nop,nop,TS val 224717 ecr 6280,mptcp dss ack 3516156078 seq 909397087 subseq 302737 len 1428 csum 0x2072], length 1428
10:04:54.122538 IP 112.26.1.1.44259 > 112.26.0.8.46287: Flags [.], seq 301308:302736, ack 1, win 4017, options [nop,nop,TS val 224717 ecr 6280,mptcp dss ack 3516156078 seq 909397087 subseq 302737 len 1428 csum 0x2072], length 1428
10:04:54.124854 IP 112.26.0.8.46287 > 112.26.1.1.44259: Flags [.], ack 287028, win 24558, options [nop,nop,TS val 7280 ecr 223214,nop,nop,sack 2 {299880:302736}{288456:298452},mptcp dss ack 909329971], length 0
10:04:54.125168 IP 112.26.0.8.46287 > 112.26.1.1.44259: Flags [.], ack 287028, win 24558, options [nop,nop,TS val 7280 ecr 223214,nop,nop,sack 2 {299880:302736}{288456:298452},mptcp dss ack 909329971], length 0
10:04:54.133487 IP 112.26.0.1.44259 > 112.26.0.8.39832: Flags [.], seq 932297:933725, ack 1, win 4017, options [nop,nop,TS val 224731 ecr 5892,mptcp dss ack 3516156078 seq 909398515 subseq 932297 len 1428 csum 0x264c], length 1428
10:04:54.133829 IP 112.26.0.1.44259 > 112.26.0.8.39832: Flags [.], seq 932297:933725, ack 1, win 4017, options [nop,nop,TS val 224731 ecr 5892,mptcp dss ack 3516156078 seq 909398515 subseq 932297 len 1428 csum 0x264c], length 1428
10:04:54.138007 IP 112.26.0.8.46287 > 112.26.1.1.44259: Flags [.], ack 287028, win 24558, options [nop,nop,TS val 6980 ecr 223214,nop,nop,sack 1 {288456:297024},mptcp dss ack 909329971], length 0
10:04:54.229449 IP 112.26.0.8.46287 > 112.26.1.1.44259: Flags [.], ack 287028, win 24558, options [nop,nop,TS val 7011 ecr 223214,nop,nop,sack 1 {288456:298452},mptcp dss ack 909329971], length 0
10:04:54.239099 IP 112.26.0.8.39832 > 112.26.0.1.44259: Flags [.], ack 906593, win 24558, options [nop,nop,TS val 6693 ecr 221234,nop,nop,sack 2 {908021:915161}{928013:929441},mptcp dss ack 909329971], length 0
10:04:54.252724 IP 112.26.0.8.39832 > 112.26.0.1.44259: Flags [.], ack 906593, win 24558, options [nop,nop,TS val 7407 ecr 221234,nop,nop,sack 2 {930869:932297}{908021:926585},mptcp dss ack 909329971], length 0
10:04:54.253057 IP 112.26.0.8.39832 > 112.26.0.1.44259: Flags [.], ack 906593, win 24558, options [nop,nop,TS val 7407 ecr 221234,nop,nop,sack 2 {930869:932297}{908021:926585},mptcp dss ack 909329971], length 0
10:04:54.328479 IP 112.26.1.1.44259 > 112.26.0.8.46287: Flags [.], seq 287028:288456, ack 1, win 4017, options [nop,nop,TS val 224731 ecr 6601,mptcp dss ack 3516156078 seq 909379951 subseq 288457 len 1428 csum 0x5ebd], length 1428
10:04:54.330354 IP 112.26.1.1.44259 > 112.26.0.8.46287: Flags [.], seq 287028:288456, ack 1, win 4017, options [nop,nop,TS val 224731 ecr 6601,mptcp dss ack 3516156078 seq 909379951 subseq 288457 len 1428 csum 0x5ebd], length 1428
10:04:54.335159 IP 112.26.0.8.46287 > 112.26.1.1.44259: Flags [.], ack 298452, win 24558, options [nop,nop,TS val 7487 ecr 224731,nop,nop,sack 1 {299880:302736},mptcp dss ack 909329971], length 0
10:04:54.335473 IP 112.26.0.8.46287 > 112.26.1.1.44259: Flags [.], ack 298452, win 24558, options [nop,nop,TS val 7487 ecr 224731,nop,nop,sack 1 {299880:302736},mptcp dss ack 909329971], length 0
10:04:54.341645 IP 112.26.0.8.46287 > 112.26.1.1.44259: Flags [.], ack 287028, win 24558, options [nop,nop,TS val 7192 ecr 223214,nop,nop,sack 2 {299880:301308}{288456:298452},mptcp dss ack 909329971], length 0
10:04:54.356285 IP 112.26.1.1.44259 > 112.26.0.8.46287: Flags [.], seq 302736:304164, ack 1, win 4017, options [nop,nop,TS val 224926 ecr 6701,mptcp dss ack 3516156078 seq 909399943 subseq 304165 len 1428 csum 0xb0c3], length 1428
10:04:54.421249 IP 112.26.1.1.44259 > 112.26.0.8.46287: Flags [.], seq 302736:304164, ack 1, win 4017, options [nop,nop,TS val 224926 ecr 6701,mptcp dss ack 3516156078 seq 909399943 subseq 304165 len 1428 csum 0xb0c3], length 1428
10:04:54.424052 IP 112.26.0.8.46287 > 112.26.1.1.44259: Flags [.], ack 298452, win 24558, options [nop,nop,TS val 7578 ecr 224731,nop,nop,sack 1 {299880:304164},mptcp dss ack 909329971], length 0
10:04:54.424424 IP 112.26.0.8.46287 > 112.26.1.1.44259: Flags [.], ack 298452, win 24558, options [nop,nop,TS val 7578 ecr 224731,nop,nop,sack 1 {299880:304164},mptcp dss ack 909329971], length 0
10:04:54.434118 IP 112.26.0.8.46287 > 112.26.1.1.44259: Flags [.], ack 287028, win 24558, options [nop,nop,TS val 7280 ecr 223214,nop,nop,sack 2 {299880:302736}{288456:298452},mptcp dss ack 909329971], length 0
10:04:54.443720 IP 112.26.0.1.44259 > 112.26.0.8.39832: Flags [.], seq 926585:928013, ack 1, win 4017, options [nop,nop,TS val 224926 ecr 6303,mptcp dss ack 3516156078 seq 909371383 subseq 926585 len 1428 csum 0xc083], length 1428
10:04:54.444049 IP 112.26.0.1.44259 > 112.26.0.8.39832: Flags [.], seq 926585:928013, ack 1, win 4017, options [nop,nop,TS val 224926 ecr 6303,mptcp dss ack 3516156078 seq 909371383 subseq 926585 len 1428 csum 0xc083], length 1428
10:04:54.453338 IP 112.26.0.8.39832 > 112.26.0.1.44259: Flags [.], ack 906593, win 24558, options [nop,nop,TS val 7608 ecr 221234,nop,nop,sack 2 {930869:933725}{908021:926585},mptcp dss ack 909329971], length 0
10:04:54.453671 IP 112.26.0.8.39832 > 112.26.0.1.44259: Flags [.], ack 906593, win 24558, options [nop,nop,TS val 7608 ecr 221234,nop,nop,sack 2 {930869:933725}{908021:926585},mptcp dss ack 909329971], length 0
10:04:54.519097 IP 112.26.0.8.39832 > 112.26.0.1.44259: Flags [.], ack 906593, win 24558, options [nop,nop,TS val 6792 ecr 221234,nop,nop,sack 2 {908021:916589}{928013:929441},mptcp dss ack 909329971], length 0
10:04:54.540925 IP 112.26.0.8.46287 > 112.26.1.1.44259: Flags [.], ack 298452, win 24558, options [nop,nop,TS val 7487 ecr 224731,nop,nop,sack 1 {299880:302736},mptcp dss ack 909329971], length 0
10:04:54.544706 IP 112.26.0.8.39832 > 112.26.0.1.44259: Flags [.], ack 906593, win 24558, options [nop,nop,TS val 7085 ecr 221234,nop,nop,sack 2 {908021:926585}{928013:929441},mptcp dss ack 909329971], length 0
10:04:54.629241 IP 112.26.1.1.44259 > 112.26.0.8.46287: Flags [.], seq 304164:305592, ack 1, win 4017, options [nop,nop,TS val 225241 ecr 7011,mptcp dss ack 3516156078 seq 909401371 subseq 305593 len 1428 csum 0x32b3], length 1428
10:04:54.633247 IP 112.26.0.8.46287 > 112.26.1.1.44259: Flags [.], ack 298452, win 24558, options [nop,nop,TS val 7787 ecr 224731,nop,nop,sack 1 {299880:305592},mptcp dss ack 909329971], length 0
10:04:54.633526 IP 112.26.0.8.46287 > 112.26.1.1.44259: Flags [.], ack 298452, win 24558, options [nop,nop,TS val 7787 ecr 224731,nop,nop,sack 1 {299880:305592},mptcp dss ack 909329971], length 0
10:04:54.635833 IP 112.26.1.1.44259 > 112.26.0.8.46287: Flags [.], seq 304164:305592, ack 1, win 4017, options [nop,nop,TS val 225241 ecr 7011,mptcp dss ack 3516156078 seq 909401371 subseq 305593 len 1428 csum 0x32b3], length 1428
10:04:54.645498 IP 112.26.0.8.46287 > 112.26.1.1.44259: Flags [.], ack 298452, win 24558, options [nop,nop,TS val 7578 ecr 224731,nop,nop,sack 1 {299880:304164},mptcp dss ack 909329971], length 0
10:04:54.650734 IP 112.26.0.8.39832 > 112.26.0.1.44259: Flags [.], ack 906593, win 24558, options [nop,nop,TS val 7791 ecr 221234,nop,nop,sack 2 {908021:929441}{930869:933725},mptcp dss ack 909329971], length 0
10:04:54.651059 IP 112.26.0.8.39832 > 112.26.0.1.44259: Flags [.], ack 906593, win 24558, options [nop,nop,TS val 7791 ecr 221234,nop,nop,sack 2 {908021:929441}{930869:933725},mptcp dss ack 909329971], length 0
10:04:54.722254 IP 112.26.0.1.44259 > 112.26.0.8.39832: Flags [.], seq 906593:908021, ack 1, win 4017, options [nop,nop,TS val 225241 ecr 6693,mptcp dss ack 3516156078 seq 909329971 subseq 906593 len 1428 csum 0xee6b], length 1428
10:04:54.722615 IP 112.26.0.1.44259 > 112.26.0.8.39832: Flags [.], seq 906593:908021, ack 1, win 4017, options [nop,nop,TS val 225241 ecr 6693,mptcp dss ack 3516156078 seq 909329971 subseq 906593 len 1428 csum 0xee6b], length 1428
10:04:54.743672 IP 112.26.1.1.44259 > 112.26.0.8.46287: Flags [.], seq 298452:299880, ack 1, win 4017, options [nop,nop,TS val 225344 ecr 7192,mptcp dss ack 3516156078 seq 909392803 subseq 299881 len 1428 csum 0x6a8a], length 1428
10:04:54.746074 IP 112.26.1.1.44259 > 112.26.0.8.46287: Flags [.], seq 298452:299880, ack 1, win 4017, options [nop,nop,TS val 225344 ecr 7192,mptcp dss ack 3516156078 seq 909392803 subseq 299881 len 1428 csum 0x6a8a], length 1428
10:04:54.748082 IP 112.26.0.8.46287 > 112.26.1.1.44259: Flags [.], ack 305592, win 24558, options [nop,nop,TS val 7901 ecr 225344,mptcp dss ack 909329971], length 0
10:04:54.748399 IP 112.26.0.8.46287 > 112.26.1.1.44259: Flags [.], ack 305592, win 24558, options [nop,nop,TS val 7901 ecr 225344,mptcp dss ack 909329971], length 0
10:04:54.756659 IP 112.26.0.8.46287 > 112.26.1.1.44259: Flags [.], ack 298452, win 24558, options [nop,nop,TS val 7787 ecr 224731,nop,nop,sack 1 {299880:305592},mptcp dss ack 909329971], length 0
10:04:54.836190 IP 112.26.1.1.44259 > 112.26.0.8.46287: Flags [.], seq 305592:307020, ack 1, win 4017, options [nop,nop,TS val 225522 ecr 7280,mptcp dss ack 3516156078 seq 909402799 subseq 307021 len 1428 csum 0x5c0b], length 1428
10:04:54.838260 IP 112.26.1.1.44259 > 112.26.0.8.46287: Flags [.], seq 305592:307020, ack 1, win 4017, options [nop,nop,TS val 225522 ecr 7280,mptcp dss ack 3516156078 seq 909402799 subseq 307021 len 1428 csum 0x5c0b], length 1428
10:04:54.839693 IP 112.26.0.8.46287 > 112.26.1.1.44259: Flags [.], ack 307020, win 24558, options [nop,nop,TS val 7994 ecr 225522,mptcp dss ack 909329971], length 0
10:04:54.840012 IP 112.26.0.8.46287 > 112.26.1.1.44259: Flags [.], ack 307020, win 24558, options [nop,nop,TS val 7994 ecr 225522,mptcp dss ack 909329971], length 0
10:04:54.852804 IP 112.26.0.8.39832 > 112.26.0.1.44259: Flags [.], ack 929441, win 24335, options [nop,nop,TS val 8005 ecr 225241,nop,nop,sack 1 {930869:933725},mptcp dss ack 909344251], length 0
10:04:54.857300 IP 112.26.0.8.39832 > 112.26.0.1.44259: Flags [.], ack 929441, win 24335, options [nop,nop,TS val 8005 ecr 225241,nop,nop,sack 1 {930869:933725},mptcp dss ack 909344251], length 0
10:04:54.859308 IP 112.26.0.8.39832 > 112.26.0.1.44259: Flags [.], ack 929441, win 24335, options [nop,nop,TS val 8005 ecr 225241,nop,nop,sack 1 {930869:933725},mptcp dss ack 909344251], length 0
10:04:54.922901 IP 112.26.0.8.39832 > 112.26.0.1.44259: Flags [.], ack 906593, win 24558, options [nop,nop,TS val 7407 ecr 221234,nop,nop,sack 2 {930869:932297}{908021:926585},mptcp dss ack 909329971], length 0
10:04:54.942312 IP 112.26.0.8.46287 > 112.26.1.1.44259: Flags [.], ack 305592, win 24558, options [nop,nop,TS val 7901 ecr 225344,mptcp dss ack 909329971], length 0
10:04:54.948297 IP 112.26.0.1.44259 > 112.26.0.8.39832: Flags [.], seq 933725:935153, ack 1, win 4017, options [nop,nop,TS val 225544 ecr 6792,mptcp dss ack 3516156078 seq 909404227 subseq 933725 len 1428 csum 0xbfb7], length 1428
10:04:54.948546 IP 112.26.0.1.44259 > 112.26.0.8.39832: Flags [.], seq 933725:935153, ack 1, win 4017, options [nop,nop,TS val 225544 ecr 6792,mptcp dss ack 3516156078 seq 909404227 subseq 933725 len 1428 csum 0xbfb7], length 1428
10:04:54.954332 IP 112.26.0.8.46287 > 112.26.1.1.44259: Flags [.], ack 307020, win 24558, options [nop,nop,TS val 7994 ecr 225522,mptcp dss ack 909329971], length 0
10:04:54.961797 IP 112.26.0.8.39832 > 112.26.0.1.44259: Flags [.], ack 929441, win 24335, options [nop,nop,TS val 8114 ecr 225241,nop,nop,sack 1 {930869:935153},mptcp dss ack 909344251], length 0
10:04:55.032899 IP 112.26.1.1.44259 > 112.26.0.8.46287: Flags [.], seq 307020:308448, ack 1, win 4017, options [nop,nop,TS val 225544 ecr 7487,mptcp dss ack 3516156078 seq 909405655 subseq 308449 len 1428 csum 0x4f92], length 1428
10:04:55.036194 IP 112.26.1.1.44259 > 112.26.0.8.46287: Flags [.], seq 307020:308448, ack 1, win 4017, options [nop,nop,TS val 225544 ecr 7487,mptcp dss ack 3516156078 seq 909405655 subseq 308449 len 1428 csum 0x4f92], length 1428
10:04:55.038380 IP 112.26.0.8.39832 > 112.26.0.1.44259: Flags [.], ack 929441, win 24335, options [nop,nop,TS val 8114 ecr 225241,nop,nop,sack 1 {930869:935153},mptcp dss ack 909344251], length 0
10:04:55.040289 IP 112.26.0.8.39832 > 112.26.0.1.44259: Flags [.], ack 929441, win 24335, options [nop,nop,TS val 8114 ecr 225241,nop,nop,sack 1 {930869:935153},mptcp dss ack 909344251], length 0
10:04:55.051486 IP 112.26.0.8.46287 > 112.26.1.1.44259: Flags [.], ack 308448, win 24335, options [nop,nop,TS val 8191 ecr 225544,mptcp dss ack 909344251], length 0
10:04:55.052237 IP 112.26.0.8.46287 > 112.26.1.1.44259: Flags [.], ack 308448, win 24335, options [nop,nop,TS val 8191 ecr 225544,mptcp dss ack 909344251], length 0
10:04:55.117052 IP 112.26.1.1.44259 > 112.26.0.8.46287: Flags [.], seq 308448:309876, ack 1, win 4017, options [nop,nop,TS val 225544 ecr 7487,mptcp dss ack 3516156078 seq 909407083 subseq 309877 len 1428 csum 0xb495], length 1428
10:04:55.119613 IP 112.26.1.1.44259 > 112.26.0.8.46287: Flags [.], seq 308448:309876, ack 1, win 4017, options [nop,nop,TS val 225544 ecr 7487,mptcp dss ack 3516156078 seq 909407083 subseq 309877 len 1428 csum 0xb495], length 1428
10:04:55.122590 IP 112.26.0.8.46287 > 112.26.1.1.44259: Flags [.], ack 309876, win 24335, options [nop,nop,TS val 8277 ecr 225544,mptcp dss ack 909344251], length 0
10:04:55.130258 IP 112.26.0.8.46287 > 112.26.1.1.44259: Flags [.], ack 309876, win 24335, options [nop,nop,TS val 8277 ecr 225544,mptcp dss ack 909344251], length 0
10:04:55.134779 IP 112.26.0.8.46287 > 112.26.1.1.44259: Flags [.], ack 308448, win 24335, options [nop,nop,TS val 8191 ecr 225544,mptcp dss ack 909344251], length 0
10:04:55.149406 IP 112.26.0.8.39832 > 112.26.0.1.44259: Flags [.], ack 906593, win 24558, options [nop,nop,TS val 7608 ecr 221234,nop,nop,sack 2 {930869:933725}{908021:926585},mptcp dss ack 909329971], length 0
10:04:55.155878 IP 112.26.0.8.46287 > 112.26.1.1.44259: Flags [.], ack 309876, win 24335, options [nop,nop,TS val 8277 ecr 225544,mptcp dss ack 909344251], length 0
10:04:55.226714 IP 112.26.1.1.44259 > 112.26.0.8.46287: Flags [.], seq 309876:311304, ack 1, win 4017, options [nop,nop,TS val 225759 ecr 7578,mptcp dss ack 3516156078 seq 909409939 subseq 311305 len 1428 csum 0x1091], length 1428
10:04:55.233180 IP 112.26.0.8.46287 > 112.26.1.1.44259: Flags [.], ack 311304, win 24335, options [nop,nop,TS val 8385 ecr 225759,mptcp dss ack 909344251], length 0
