10:03:35.367221 IP 112.26.0.8.39832 > 112.26.0.1.44259: Flags [S], seq 320401172, win 65535, options [mss 1460,sackOK,TS val 4294895694 ecr 0,nop,wscale 6,mptcp capable csum {0xf327a5bbfaf142aa}], length 0
10:03:35.367504 IP 112.26.0.1.44259 > 112.26.0.8.39832: Flags [S.], seq 2060943637, ack 320401173, win 65535, options [mss 1460,sackOK,TS val 146370 ecr 4294895694,nop,wscale 6,mptcp capable csum {0x72067753b755f75d}], length 0
10:03:35.464557 IP 112.26.0.1.44259 > 112.26.0.8.39832: Flags [S.], seq 2060943637, ack 320401173, win 65535, options [mss 1460,sackOK,TS val 146370 ecr 4294895694,nop,wscale 6,mptcp capable csum {0x72067753b755f75d}], length 0
10:03:35.562774 IP 112.26.0.8.39832 > 112.26.0.1.44259: Flags [.], ack 1, win 1369, options [nop,nop,TS val 4294895932 ecr 146370,mptcp capable csum {0xf327a5bbfaf142aa,0x72067753b755f75d},mptcp dss ack 908116359], length 0
10:03:35.563048 IP 112.26.0.1.44259 > 112.26.0.8.39832: Flags [.], ack 1, win 1339, options [nop,nop,TS val 146566 ecr 4294895932,mptcp add-addr id 3 112.26.1.1,mptcp dss ack 3516156078], length 0
10:03:35.563083 IP 112.26.0.1.44259 > 112.26.0.8.39832: Flags [.], ack 1, win 1339, options [nop,nop,TS val 146566 ecr 4294895932,mptcp add-addr id 4 112.26.2.1,mptcp dss ack 3516156078], length 0
10:03:35.563103 IP 112.26.0.1.44259 > 112.26.0.8.39832: Flags [.], ack 1, win 1339, options [nop,nop,TS val 146566 ecr 4294895932,mptcp add-addr id 6 112.26.3.1,mptcp dss ack 3516156078], length 0
10:04:14.618003 IP 112.26.0.1.44259 > 112.26.0.8.39832: Flags [.], seq 586721:588149, ack 1, win 4017, options [nop,nop,TS val 185024 ecr 4294934036,mptcp dss ack 3516156078 seq 908734495 subseq 586721 len 1428 csum 0x9c06], length 1428
10:04:14.679211 IP 112.26.0.8.39832 > 112.26.0.1.44259: Flags [.], ack 573869, win 24410, options [nop,nop,TS val 4294934637 ecr 184604,mptcp dss ack 908721643], length 0
10:04:14.679605 IP 112.26.0.1.44259 > 112.26.0.8.39832: Flags [.], seq 605285:606713, ack 1, win 4017, options [nop,nop,TS val 185682 ecr 4294934637,mptcp dss ack 3516156078 seq 908753059 subseq 605285 len 1428 csum 0x4342], length 1428
10:04:14.698390 IP 112.26.0.1.44259 > 112.26.0.8.39832: Flags [.], seq 588149:589577, ack 1, win 4017, options [nop,nop,TS val 185024 ecr 4294934036,mptcp dss ack 3516156078 seq 908735923 subseq 588149 len 1428 csum 0xba83], length 1428
10:04:31.981994 IP 112.26.1.1.44259 > 112.26.0.8.46287: Flags [.], seq 657497571:657498999, ack 2308197351, win 4017, options [nop,nop,TS val 202408 ecr 4294951512,mptcp dss ack 3516156078 seq 908962975 subseq 87109 len 1428 csum 0xd16c], length 1428
10:04:45.276486 IP 112.26.0.8.39832 > 112.26.0.1.44259: Flags [.], ack 862325, win 24458, options [nop,nop,TS val 4294965220 ecr 215686,nop,nop,sack 1 {863753:866609},mptcp dss ack 909201451], length 0
10:05:03.184019 IP 112.26.1.1.44259 > 112.26.0.8.46287: Flags [.], seq 289884:291312, ack 1, win 4017, options [nop,nop,TS val 233593 ecr 15520,mptcp dss ack 3516156078 seq 909549883 subseq 376993 len 1428 csum 0x40a1], length 1428
10:05:03.195498 IP 112.26.0.8.46287 > 112.26.1.1.44259: Flags [.], ack 278460, win 24514, options [nop,nop,TS val 16248 ecr 232300,nop,nop,sack 2 {285600:289884}{281316:284172},mptcp dss ack 909468487], length 0
10:05:03.195834 IP 112.26.0.1.44259 > 112.26.0.8.39832: Flags [.], seq 1019405:1020833, ack 1, win 4017, options [nop,nop,TS val 234198 ecr 15527,mptcp dss ack 3516156078 seq 909555595 subseq 1019405 len 1428 csum 0x5e9e], length 1428
10:05:03.273018 IP 112.26.1.1.44259 > 112.26.0.8.46287: Flags [.], seq 291312:292740, ack 1, win 4017, options [nop,nop,TS val 233794 ecr 15626,mptcp dss ack 3516156078 seq 909551311 subseq 378421 len 1428 csum 0xb506], length 1428
10:05:03.291193 IP 112.26.0.8.46287 > 112.26.1.1.44259: Flags [.], ack 278460, win 24514, options [nop,nop,TS val 16345 ecr 232300,nop,nop,sack 2 {285600:291312}{281316:284172},mptcp dss ack 909468487], length 0
10:05:03.303071 IP 112.26.1.1.44259 > 112.26.0.8.46287: Flags [.], seq 278460:279888, ack 1, win 4017, options [nop,nop,TS val 233878 ecr 15731,mptcp dss ack 3516156078 seq 909538459 subseq 365569 len 1428 csum 0x8601], length 1428
10:05:03.308863 IP 112.26.0.8.46287 > 112.26.1.1.44259: Flags [.], ack 278460, win 24514, options [nop,nop,TS val 16432 ecr 232300,nop,nop,sack 2 {285600:292740}{281316:284172},mptcp dss ack 909468487], length 0
10:05:03.378274 IP 112.26.0.1.44259 > 112.26.0.8.39832: Flags [.], seq 1016549:1017977, ack 1, win 4017, options [nop,nop,TS val 233900 ecr 15346,mptcp dss ack 3516156078 seq 909552739 subseq 1016549 len 1428 csum 0x6787], length 1428
10:05:03.400052 IP 112.26.0.8.46287 > 112.26.1.1.44259: Flags [.], ack 279888, win 24514, options [nop,nop,TS val 16474 ecr 233878,nop,nop,sack 2 {285600:292740}{281316:284172},mptcp dss ack 909468487], length 0
10:05:03.402242 IP 112.26.0.1.44259 > 112.26.0.8.39832: Flags [.], seq 1017977:1019405, ack 1, win 4017, options [nop,nop,TS val 233916 ecr 15437,mptcp dss ack 3516156078 seq 909554167 subseq 1017977 len 1428 csum 0xbcf4], length 1428
10:05:03.478134 IP 112.26.1.1.44259 > 112.26.0.8.46287: Flags [.], seq 279888:281316, ack 1, win 4017, options [nop,nop,TS val 233916 ecr 15824,mptcp dss ack 3516156078 seq 909539887 subseq 366997 len 1428 csum 0xf7f3], length 1428
10:05:03.507102 IP 112.26.1.1.44259 > 112.26.0.8.46287: Flags [.], seq 284172:285600, ack 1, win 4017, options [nop,nop,TS val 233973 ecr 15853,mptcp dss ack 3516156078 seq 909514183 subseq 371281 len 1428 csum 0x8cea], length 1428
10:05:03.608148 IP 112.26.0.8.39832 > 112.26.0.1.44259: Flags [.], ack 992273, win 24514, options [nop,nop,TS val 16236 ecr 231103,nop,nop,sack 2 {1013693:1016549}{993701:1012265},mptcp dss ack 909468487], length 0
10:05:03.608485 IP 112.26.1.1.44259 > 112.26.0.8.46287: Flags [.], seq 292740:294168, ack 1, win 4017, options [nop,nop,TS val 234610 ecr 16248,mptcp dss ack 3516156078 seq 909557023 subseq 379849 len 1428 csum 0x3b4b], length 1428
10:05:03.608586 IP 112.26.0.1.44259 > 112.26.0.8.39832: Flags [.], seq 992273:993701, ack 1, win 4017, options [nop,nop,TS val 234610 ecr 16236,mptcp dss ack 3516156078 seq 909507043 subseq 992273 len 1428 csum 0xd3f8], length 1428
10:05:03.608635 IP 112.26.0.1.44259 > 112.26.0.8.39832: Flags [.], seq 1012265:1013693, ack 1, win 4017, options [nop,nop,TS val 234610 ecr 16236,mptcp dss ack 3516156078 seq 909544171 subseq 1012265 len 1428 csum 0x42d3], length 1428
10:05:03.687579 IP 112.26.0.1.44259 > 112.26.0.8.39832: Flags [.], seq 1019405:1020833, ack 1, win 4017, options [nop,nop,TS val 234198 ecr 15527,mptcp dss ack 3516156078 seq 909555595 subseq 1019405 len 1428 csum 0x5e9e], length 1428
10:05:03.694495 IP 112.26.0.8.46287 > 112.26.1.1.44259: Flags [.], ack 284172, win 23990, options [nop,nop,TS val 16637 ecr 233916,nop,nop,sack 1 {285600:292740},mptcp dss ack 909507043], length 0
10:05:03.715748 IP 112.26.0.8.46287 > 112.26.1.1.44259: Flags [.], ack 278460, win 24514, options [nop,nop,TS val 16345 ecr 232300,nop,nop,sack 2 {285600:291312}{281316:284172},mptcp dss ack 909468487], length 0
10:05:03.785660 IP 112.26.0.8.46287 > 112.26.1.1.44259: Flags [.], ack 278460, win 24514, options [nop,nop,TS val 16345 ecr 232300,nop,nop,sack 2 {285600:291312}{281316:284172},mptcp dss ack 909468487], length 0
10:05:03.798010 IP 112.26.0.8.46287 > 112.26.1.1.44259: Flags [.], ack 278460, win 24514, options [nop,nop,TS val 16432 ecr 232300,nop,nop,sack 2 {285600:292740}{281316:284172},mptcp dss ack 909468487], length 0
10:05:03.804668 IP 112.26.0.8.46287 > 112.26.1.1.44259: Flags [.], ack 278460, win 24514, options [nop,nop,TS val 16432 ecr 232300,nop,nop,sack 2 {285600:292740}{281316:284172},mptcp dss ack 909468487], length 0
10:05:03.813832 IP 112.26.0.8.46287 > 112.26.1.1.44259: Flags [.], ack 279888, win 24514, options [nop,nop,TS val 16474 ecr 233878,nop,nop,sack 2 {285600:292740}{281316:284172},mptcp dss ack 909468487], length 0
10:05:03.882939 IP 112.26.0.8.46287 > 112.26.1.1.44259: Flags [.], ack 279888, win 24514, options [nop,nop,TS val 16474 ecr 233878,nop,nop,sack 2 {285600:292740}{281316:284172},mptcp dss ack 909468487], length 0
10:05:03.910505 IP 112.26.0.8.46287 > 112.26.1.1.44259: Flags [.], ack 292740, win 24414, options [nop,nop,TS val 16735 ecr 233973,mptcp dss ack 909507043], length 0
10:05:03.922809 IP 112.26.1.1.44259 > 112.26.0.8.46287: Flags [.], seq 292740:294168, ack 1, win 4017, options [nop,nop,TS val 234610 ecr 16248,mptcp dss ack 3516156078 seq 909557023 subseq 379849 len 1428 csum 0x3b4b], length 1428
10:05:04.015285 IP 112.26.0.1.44259 > 112.26.0.8.39832: Flags [.], seq 992273:993701, ack 1, win 4017, options [nop,nop,TS val 234610 ecr 16236,mptcp dss ack 3516156078 seq 909507043 subseq 992273 len 1428 csum 0xd3f8], length 1428
10:05:04.092335 IP 112.26.0.8.46287 > 112.26.1.1.44259: Flags [.], ack 284172, win 23990, options [nop,nop,TS val 16637 ecr 233916,nop,nop,sack 1 {285600:292740},mptcp dss ack 909507043], length 0
10:05:04.118462 IP 112.26.0.1.44259 > 112.26.0.8.39832: Flags [.], seq 1012265:1013693, ack 1, win 4017, options [nop,nop,TS val 234610 ecr 16236,mptcp dss ack 3516156078 seq 909544171 subseq 1012265 len 1428 csum 0x42d3], length 1428
10:05:04.127646 IP 112.26.0.8.46287 > 112.26.1.1.44259: Flags [.], ack 284172, win 23990, options [nop,nop,TS val 16637 ecr 233916,nop,nop,sack 1 {285600:292740},mptcp dss ack 909507043], length 0
10:05:04.191835 IP 112.26.0.8.46287 > 112.26.1.1.44259: Flags [.], ack 278460, win 24514, options [nop,nop,TS val 16345 ecr 232300,nop,nop,sack 2 {285600:291312}{281316:284172},mptcp dss ack 909468487], length 0
10:05:04.202277 IP 112.26.0.8.46287 > 112.26.1.1.44259: Flags [.], ack 294168, win 24414, options [nop,nop,TS val 17081 ecr 234610,mptcp dss ack 909507043], length 0
10:05:04.210529 IP 112.26.0.8.39832 > 112.26.0.1.44259: Flags [.], ack 992273, win 24414, options [nop,nop,TS val 16643 ecr 231103,nop,nop,sack 2 {1013693:1017977}{993701:1012265},mptcp dss ack 909507043], length 0
10:05:04.287008 IP 112.26.0.8.46287 > 112.26.1.1.44259: Flags [.], ack 278460, win 24514, options [nop,nop,TS val 16345 ecr 232300,nop,nop,sack 2 {285600:291312}{281316:284172},mptcp dss ack 909468487], length 0
10:05:04.290919 IP 112.26.0.8.46287 > 112.26.1.1.44259: Flags [.], ack 278460, win 24514, options [nop,nop,TS val 16432 ecr 232300,nop,nop,sack 2 {285600:292740}{281316:284172},mptcp dss ack 909468487], length 0
10:05:04.305207 IP 112.26.0.8.39832 > 112.26.0.1.44259: Flags [.], ack 992273, win 24414, options [nop,nop,TS val 16643 ecr 231103,nop,nop,sack 2 {1013693:1017977}{993701:1012265},mptcp dss ack 909507043], length 0
10:05:04.305563 IP 112.26.0.1.44259 > 112.26.0.8.39832: Flags [.], seq 1020833:1022261, ack 1, win 4017, options [nop,nop,TS val 235308 ecr 16236,mptcp dss ack 3516156078 seq 909558451 subseq 1020833 len 1428 csum 0xc2b9], length 1428
10:05:04.314221 IP 112.26.0.8.46287 > 112.26.1.1.44259: Flags [.], ack 279888, win 24514, options [nop,nop,TS val 16474 ecr 233878,nop,nop,sack 2 {285600:292740}{281316:284172},mptcp dss ack 909468487], length 0
10:05:04.395000 IP 112.26.0.8.46287 > 112.26.1.1.44259: Flags [.], ack 292740, win 24414, options [nop,nop,TS val 16735 ecr 233973,mptcp dss ack 909507043], length 0
10:05:04.415547 IP 112.26.0.8.46287 > 112.26.1.1.44259: Flags [.], ack 278460, win 24514, options [nop,nop,TS val 16432 ecr 232300,nop,nop,sack 2 {285600:292740}{281316:284172},mptcp dss ack 909468487], length 0
10:05:04.415870 IP 112.26.0.1.44259 > 112.26.0.8.39832: Flags [.], seq 1022261:1023689, ack 1, win 4017, options [nop,nop,TS val 235418 ecr 16643,mptcp dss ack 3516156078 seq 909559879 subseq 1022261 len 1428 csum 0x3e4a], length 1428
10:05:04.486381 IP 112.26.0.8.39832 > 112.26.0.1.44259: Flags [.], ack 992273, win 24414, options [nop,nop,TS val 17061 ecr 231103,nop,nop,sack 2 {1013693:1020833}{993701:1012265},mptcp dss ack 909507043], length 0
10:05:04.496505 IP 112.26.0.8.39832 > 112.26.0.1.44259: Flags [.], ack 1012265, win 24101, options [nop,nop,TS val 17344 ecr 234610,nop,nop,sack 1 {1013693:1020833},mptcp dss ack 909544171], length 0
10:05:04.496880 IP 112.26.1.1.44259 > 112.26.0.8.46287: Flags [.], seq 294168:295596, ack 1, win 4017, options [nop,nop,TS val 235499 ecr 16432,mptcp dss ack 3516156078 seq 909561307 subseq 381277 len 1428 csum 0xbf6a], length 1428
10:05:04.496957 IP 112.26.1.1.44259 > 112.26.0.8.46287: Flags [.], seq 295596:297024, ack 1, win 4017, options [nop,nop,TS val 235499 ecr 16432,mptcp dss ack 3516156078 seq 909562735 subseq 382705 len 1428 csum 0x236a], length 1428
10:05:04.497043 IP 112.26.0.1.44259 > 112.26.0.8.39832: Flags [.], seq 1023689:1025117, ack 1, win 4017, options [nop,nop,TS val 235499 ecr 17344,mptcp dss ack 3516156078 seq 909564163 subseq 1023689 len 1428 csum 0xb553], length 1428
10:05:04.497095 IP 112.26.0.1.44259 > 112.26.0.8.39832: Flags [P.], seq 1025117:1026545, ack 1, win 4017, options [nop,nop,TS val 235499 ecr 17344,mptcp dss ack 3516156078 seq 909565591 subseq 1025117 len 1428 csum 0xe221], length 1428
10:05:04.504826 IP 112.26.0.8.46287 > 112.26.1.1.44259: Flags [.], ack 284172, win 23990, options [nop,nop,TS val 16637 ecr 233916,nop,nop,sack 1 {285600:292740},mptcp dss ack 909507043], length 0
10:05:04.514434 IP 112.26.0.8.46287 > 112.26.1.1.44259: Flags [.], ack 294168, win 24414, options [nop,nop,TS val 17081 ecr 234610,mptcp dss ack 909507043], length 0
10:05:04.517389 IP 112.26.0.8.46287 > 112.26.1.1.44259: Flags [.], ack 279888, win 24514, options [nop,nop,TS val 16474 ecr 233878,nop,nop,sack 2 {285600:292740}{281316:284172},mptcp dss ack 909468487], length 0
10:05:04.517669 IP 112.26.1.1.44259 > 112.26.0.8.46287: Flags [.], seq 297024:298452, ack 1, win 4017, options [nop,nop,TS val 235520 ecr 16474,mptcp dss ack 3516156078 seq 909567019 subseq 384133 len 1428 csum 0x8cc4], length 1428
10:05:04.595137 IP 112.26.0.8.46287 > 112.26.1.1.44259: Flags [.], ack 278460, win 24514, options [nop,nop,TS val 16345 ecr 232300,nop,nop,sack 2 {285600:291312}{281316:284172},mptcp dss ack 909468487], length 0
10:05:04.597468 IP 112.26.0.8.39832 > 112.26.0.1.44259: Flags [.], ack 1020833, win 24419, options [nop,nop,TS val 17373 ecr 234610,mptcp dss ack 909558451], length 0
10:05:04.597813 IP 112.26.0.1.44259 > 112.26.0.8.39832: Flags [.], seq 1026545:1027973, ack 1, win 4017, options [nop,nop,TS val 235600 ecr 17373,mptcp dss ack 3516156078 seq 909568447 subseq 1026545 len 1428 csum 0x6cc1], length 1428
10:05:04.609076 IP 112.26.0.1.44259 > 112.26.0.8.39832: Flags [.], seq 1020833:1022261, ack 1, win 4017, options [nop,nop,TS val 235308 ecr 16236,mptcp dss ack 3516156078 seq 909558451 subseq 1020833 len 1428 csum 0xc2b9], length 1428
10:05:04.683144 IP 112.26.0.8.46287 > 112.26.1.1.44259: Flags [.], ack 292740, win 24414, options [nop,nop,TS val 16735 ecr 233973,mptcp dss ack 909507043], length 0
10:05:04.683504 IP 112.26.1.1.44259 > 112.26.0.8.46287: Flags [.], seq 298452:299880, ack 1, win 4017, options [nop,nop,TS val 235686 ecr 16735,mptcp dss ack 3516156078 seq 909569875 subseq 385561 len 1428 csum 0x785f], length 1428
10:05:04.683596 IP 112.26.1.1.44259 > 112.26.0.8.46287: Flags [.], seq 299880:301308, ack 1, win 4017, options [nop,nop,TS val 235686 ecr 16735,mptcp dss ack 3516156078 seq 909571303 subseq 386989 len 1428 csum 0x6229], length 1428
10:05:04.694183 IP 112.26.0.1.44259 > 112.26.0.8.39832: Flags [.], seq 1022261:1023689, ack 1, win 4017, options [nop,nop,TS val 235418 ecr 16643,mptcp dss ack 3516156078 seq 909559879 subseq 1022261 len 1428 csum 0x3e4a], length 1428
10:05:04.705413 IP 112.26.0.8.39832 > 112.26.0.1.44259: Flags [.], ack 992273, win 24414, options [nop,nop,TS val 17061 ecr 231103,nop,nop,sack 2 {1013693:1020833}{993701:1012265},mptcp dss ack 909507043], length 0
10:05:04.705733 IP 112.26.0.1.44259 > 112.26.0.8.39832: Flags [.], ack 1, win 4017, options [nop,nop,TS val 235708 ecr 17373,mptcp dss ack 3516156078], length 0
10:05:04.709440 IP 112.26.3.1.44259 > 112.26.0.8.35259: Flags [.], seq 722888832:722890260, ack 1497894051, win 4017, options [nop,nop,TS val 235712 ecr 14245,mptcp dss ack 3516156078 seq 909467059 subseq 125665 len 1428 csum 0x2778], length 1428
10:05:04.787736 IP 112.26.1.1.44259 > 112.26.0.8.46287: Flags [.], seq 294168:295596, ack 1, win 4017, options [nop,nop,TS val 235499 ecr 16432,mptcp dss ack 3516156078 seq 909561307 subseq 381277 len 1428 csum 0xbf6a], length 1428
10:05:04.812992 IP 112.26.0.8.46287 > 112.26.1.1.44259: Flags [.], ack 284172, win 23990, options [nop,nop,TS val 16637 ecr 233916,nop,nop,sack 1 {285600:292740},mptcp dss ack 909507043], length 0
10:05:04.813304 IP 112.26.1.1.44259 > 112.26.0.8.46287: Flags [.], ack 1, win 4017, options [nop,nop,TS val 235815 ecr 16735,mptcp dss ack 3516156078], length 0
10:05:04.829152 IP 112.26.1.1.44259 > 112.26.0.8.46287: Flags [.], seq 295596:297024, ack 1, win 4017, options [nop,nop,TS val 235499 ecr 16432,mptcp dss ack 3516156078 seq 909562735 subseq 382705 len 1428 csum 0x236a], length 1428
10:05:04.896186 IP 112.26.0.8.46287 > 112.26.1.1.44259: Flags [.], ack 294168, win 24414, options [nop,nop,TS val 17081 ecr 234610,mptcp dss ack 909507043], length 0
10:05:04.896467 IP 112.26.1.1.44259 > 112.26.0.8.46287: Flags [.], seq 301308:302736, ack 1, win 4017, options [nop,nop,TS val 235898 ecr 17081,mptcp dss ack 3516156078 seq 909572731 subseq 388417 len 1428 csum 0xdcde], length 1428
10:05:04.896540 IP 112.26.1.1.44259 > 112.26.0.8.46287: Flags [.], seq 302736:304164, ack 1, win 4017, options [nop,nop,TS val 235898 ecr 17081,mptcp dss ack 3516156078 seq 909574159 subseq 389845 len 1428 csum 0x5a46], length 1428
10:05:04.911325 IP 112.26.0.1.44259 > 112.26.0.8.39832: Flags [.], seq 1023689:1025117, ack 1, win 4017, options [nop,nop,TS val 235499 ecr 17344,mptcp dss ack 3516156078 seq 909564163 subseq 1023689 len 1428 csum 0xb553], length 1428
10:05:04.930354 IP 112.26.0.8.46287 > 112.26.1.1.44259: Flags [.], ack 278460, win 24514, options [nop,nop,TS val 16345 ecr 232300,nop,nop,sack 2 {285600:291312}{281316:284172},mptcp dss ack 909468487], length 0
10:05:05.002245 IP 112.26.0.8.39832 > 112.26.0.1.44259: Flags [.], ack 1022261, win 24558, options [nop,nop,TS val 17768 ecr 235308,mptcp dss ack 909559879], length 0
10:05:05.002557 IP 112.26.0.1.44259 > 112.26.0.8.39832: Flags [.], seq 1027973:1029401, ack 1, win 4017, options [nop,nop,TS val 236005 ecr 17768,mptcp dss ack 3516156078 seq 909575587 subseq 1027973 len 1428 csum 0x5525], length 1428
10:05:05.011901 IP 112.26.0.1.44259 > 112.26.0.8.39832: Flags [P.], seq 1025117:1026545, ack 1, win 4017, options [nop,nop,TS val 235499 ecr 17344,mptcp dss ack 3516156078 seq 909565591 subseq 1025117 len 1428 csum 0xe221], length 1428
10:05:05.022334 IP 112.26.0.8.39832 > 112.26.0.1.44259: Flags [.], ack 1023689, win 24558, options [nop,nop,TS val 17873 ecr 235418,mptcp dss ack 909561307], length 0
10:05:05.022706 IP 112.26.0.1.44259 > 112.26.0.8.39832: Flags [.], seq 1029401:1030829, ack 1, win 4017, options [nop,nop,TS val 236025 ecr 17873,mptcp dss ack 3516156078 seq 909577015 subseq 1029401 len 1428 csum 0x8a6c], length 1428
10:05:05.095802 IP 112.26.1.1.44259 > 112.26.0.8.46287: Flags [.], seq 297024:298452, ack 1, win 4017, options [nop,nop,TS val 235520 ecr 16474,mptcp dss ack 3516156078 seq 909567019 subseq 384133 len 1428 csum 0x8cc4], length 1428
10:05:05.120124 IP 112.26.0.8.46287 > 112.26.1.1.44259: Flags [.], ack 295596, win 24558, options [nop,nop,TS val 17950 ecr 235499,mptcp dss ack 909562735], length 0
10:05:05.120473 IP 112.26.1.1.44259 > 112.26.0.8.46287: Flags [.], seq 304164:305592, ack 1, win 4017, options [nop,nop,TS val 236123 ecr 17950,mptcp dss ack 3516156078 seq 909578443 subseq 391273 len 1428 csum 0x68ee], length 1428
10:05:05.191904 IP 112.26.0.1.44259 > 112.26.0.8.39832: Flags [.], seq 1026545:1027973, ack 1, win 4017, options [nop,nop,TS val 235600 ecr 17373,mptcp dss ack 3516156078 seq 909568447 subseq 1026545 len 1428 csum 0x6cc1], length 1428
10:05:05.203759 IP 112.26.0.8.46287 > 112.26.1.1.44259: Flags [.], ack 297024, win 24558, options [nop,nop,TS val 17987 ecr 235499,mptcp dss ack 909564163], length 0
10:05:05.204109 IP 112.26.1.1.44259 > 112.26.0.8.46287: Flags [.], seq 305592:307020, ack 1, win 4017, options [nop,nop,TS val 236206 ecr 17987,mptcp dss ack 3516156078 seq 909579871 subseq 392701 len 1428 csum 0x2980], length 1428
10:05:05.204187 IP 112.26.1.1.44259 > 112.26.0.8.46287: Flags [P.], seq 307020:308448, ack 1, win 4017, options [nop,nop,TS val 236206 ecr 17987,mptcp dss ack 3516156078 seq 909581299 subseq 394129 len 1428 csum 0xbac1], length 1428
10:05:05.217493 IP 112.26.0.8.39832 > 112.26.0.1.44259: Flags [.], ack 1025117, win 24558, options [nop,nop,TS val 18076 ecr 235499,mptcp dss ack 909565591], length 0
10:05:05.217840 IP 112.26.0.1.44259 > 112.26.0.8.39832: Flags [.], seq 1030829:1032257, ack 1, win 4017, options [nop,nop,TS val 236220 ecr 18076,mptcp dss ack 3516156078 seq 909582727 subseq 1030829 len 1428 csum 0x7de4], length 1428
10:05:05.228081 IP 112.26.1.1.44259 > 112.26.0.8.46287: Flags [.], seq 298452:299880, ack 1, win 4017, options [nop,nop,TS val 235686 ecr 16735,mptcp dss ack 3516156078 seq 909569875 subseq 385561 len 1428 csum 0x785f], length 1428
10:05:05.297367 IP 112.26.1.1.44259 > 112.26.0.8.46287: Flags [.], seq 299880:301308, ack 1, win 4017, options [nop,nop,TS val 235686 ecr 16735,mptcp dss ack 3516156078 seq 909571303 subseq 386989 len 1428 csum 0x6229], length 1428
10:05:05.308276 IP 112.26.3.1.44259 > 112.26.0.8.35259: Flags [.], seq 0:1428, ack 1, win 4017, options [nop,nop,TS val 235712 ecr 14245,mptcp dss ack 3516156078 seq 909467059 subseq 125665 len 1428 csum 0x2778], length 1428
10:05:05.389015 IP 112.26.0.1.44259 > 112.26.0.8.39832: Flags [.], ack 1, win 4017, options [nop,nop,TS val 235708 ecr 17373,mptcp dss ack 3516156078], length 0
10:05:05.404635 IP 112.26.0.8.39832 > 112.26.0.1.44259: Flags [.], ack 1026545, win 24558, options [nop,nop,TS val 18183 ecr 235499,mptcp dss ack 909567019], length 0
10:05:05.404923 IP 112.26.0.1.44259 > 112.26.0.8.39832: Flags [.], seq 1032257:1033685, ack 1, win 4017, options [nop,nop,TS val 236407 ecr 18183,mptcp dss ack 3516156078 seq 909584155 subseq 1032257 len 1428 csum 0x11db], length 1428
10:05:05.413405 IP 112.26.1.1.44259 > 112.26.0.8.46287: Flags [.], ack 1, win 4017, options [nop,nop,TS val 235815 ecr 16735,mptcp dss ack 3516156078], length 0
10:05:05.492077 IP 112.26.1.1.44259 > 112.26.0.8.46287: Flags [.], seq 301308:302736, ack 1, win 4017, options [nop,nop,TS val 235898 ecr 17081,mptcp dss ack 3516156078 seq 909572731 subseq 388417 len 1428 csum 0xdcde], length 1428
10:05:05.500912 IP 112.26.0.8.46287 > 112.26.1.1.44259: Flags [.], ack 298452, win 24558, options [nop,nop,TS val 18254 ecr 235520,mptcp dss ack 909568447], length 0
10:05:05.501239 IP 112.26.1.1.44259 > 112.26.0.8.46287: Flags [.], seq 308448:309876, ack 1, win 4017, options [nop,nop,TS val 236503 ecr 18254,mptcp dss ack 3516156078 seq 909585583 subseq 395557 len 1428 csum 0x8127], length 1428
10:05:05.537180 IP 112.26.1.1.44259 > 112.26.0.8.46287: Flags [.], seq 302736:304164, ack 1, win 4017, options [nop,nop,TS val 235898 ecr 17081,mptcp dss ack 3516156078 seq 909574159 subseq 389845 len 1428 csum 0x5a46], length 1428
10:05:05.611190 IP 112.26.0.8.46287 > 112.26.1.1.44259: Flags [.], ack 299880, win 24558, options [nop,nop,TS val 18386 ecr 235686,mptcp dss ack 909568447], length 0
10:05:05.611515 IP 112.26.1.1.44259 > 112.26.0.8.46287: Flags [.], seq 309876:311304, ack 1, win 4017, options [nop,nop,TS val 236614 ecr 18386,mptcp dss ack 3516156078 seq 909587011 subseq 396985 len 1428 csum 0x1908], length 1428
10:05:05.630108 IP 112.26.0.1.44259 > 112.26.0.8.39832: Flags [.], seq 1027973:1029401, ack 1, win 4017, options [nop,nop,TS val 236005 ecr 17768,mptcp dss ack 3516156078 seq 909575587 subseq 1027973 len 1428 csum 0x5525], length 1428
10:05:05.708900 IP 112.26.0.1.44259 > 112.26.0.8.39832: Flags [.], seq 1029401:1030829, ack 1, win 4017, options [nop,nop,TS val 236025 ecr 17873,mptcp dss ack 3516156078 seq 909577015 subseq 1029401 len 1428 csum 0x8a6c], length 1428
10:05:05.717470 IP 112.26.0.8.46287 > 112.26.1.1.44259: Flags [.], ack 301308, win 24558, options [nop,nop,TS val 18456 ecr 235686,mptcp dss ack 909568447], length 0
10:05:05.717813 IP 112.26.1.1.44259 > 112.26.0.8.46287: Flags [.], seq 311304:312732, ack 1, win 4017, options [nop,nop,TS val 236720 ecr 18456,mptcp dss ack 3516156078 seq 909588439 subseq 398413 len 1428 csum 0x1f08], length 1428
10:05:05.798895 IP 112.26.0.8.35259 > 112.26.3.1.44259: Flags [.], ack 1428, win 24558, options [nop,nop,TS val 18468 ecr 235712,nop,nop,sack 2 {0:1428}{2856:5712},mptcp dss ack 909568447], length 0
10:05:05.799187 IP 112.26.3.1.44259 > 112.26.0.8.35259: Flags [.], seq 1428:2856, ack 1, win 4017, options [nop,nop,TS val 236801 ecr 18468,mptcp dss ack 3516156078 seq 909468487 subseq 127093 len 1428 csum 0x8b83], length 1428
10:05:05.813095 IP 112.26.1.1.44259 > 112.26.0.8.46287: Flags [.], seq 304164:305592, ack 1, win 4017, options [nop,nop,TS val 236123 ecr 17950,mptcp dss ack 3516156078 seq 909578443 subseq 391273 len 1428 csum 0x68ee], length 1428
10:05:05.835968 IP 112.26.0.8.39832 > 112.26.0.1.44259: Flags [.], ack 1027973, win 24527, options [nop,nop,TS val 18477 ecr 235600,mptcp dss ack 909572731], length 0
10:05:05.836319 IP 112.26.0.1.44259 > 112.26.0.8.39832: Flags [.], seq 1033685:1035113, ack 1, win 4017, options [nop,nop,TS val 236839 ecr 18477,mptcp dss ack 3516156078 seq 909589867 subseq 1033685 len 1428 csum 0x2a8e], length 1428
10:05:05.902090 IP 112.26.1.1.44259 > 112.26.0.8.46287: Flags [.], seq 305592:307020, ack 1, win 4017, options [nop,nop,TS val 236206 ecr 17987,mptcp dss ack 3516156078 seq 909579871 subseq 392701 len 1428 csum 0x2980], length 1428
10:05:05.991336 IP 112.26.0.8.46287 > 112.26.1.1.44259: Flags [.], ack 302736, win 24558, options [nop,nop,TS val 18651 ecr 235898,mptcp dss ack 909574159], length 0
10:05:05.991716 IP 112.26.1.1.44259 > 112.26.0.8.46287: Flags [.], seq 312732:314160, ack 1, win 4017, options [nop,nop,TS val 236994 ecr 18651,mptcp dss ack 3516156078 seq 909591295 subseq 399841 len 1428 csum 0xae93], length 1428
10:05:06.013443 IP 112.26.1.1.44259 > 112.26.0.8.46287: Flags [P.], seq 307020:308448, ack 1, win 4017, options [nop,nop,TS val 236206 ecr 17987,mptcp dss ack 3516156078 seq 909581299 subseq 394129 len 1428 csum 0xbac1], length 1428
10:05:06.026688 IP 112.26.0.1.44259 > 112.26.0.8.39832: Flags [.], seq 1030829:1032257, ack 1, win 4017, options [nop,nop,TS val 236220 ecr 18076,mptcp dss ack 3516156078 seq 909582727 subseq 1030829 len 1428 csum 0x7de4], length 1428
10:05:06.090637 IP 112.26.0.8.46287 > 112.26.1.1.44259: Flags [.], ack 304164, win 24558, options [nop,nop,TS val 18696 ecr 235898,mptcp dss ack 909575587], length 0
10:05:06.090965 IP 112.26.1.1.44259 > 112.26.0.8.46287: Flags [.], seq 314160:315588, ack 1, win 4017, options [nop,nop,TS val 237093 ecr 18696,mptcp dss ack 3516156078 seq 909592723 subseq 401269 len 1428 csum 0x9beb], length 1428
10:05:06.106292 IP 112.26.1.1.44259 > 112.26.0.8.46287: Flags [.], seq 308448:309876, ack 1, win 4017, options [nop,nop,TS val 236503 ecr 18254,mptcp dss ack 3516156078 seq 909585583 subseq 395557 len 1428 csum 0x8127], length 1428
10:05:06.122723 IP 112.26.1.1.44259 > 112.26.0.8.46287: Flags [.], seq 309876:311304, ack 1, win 4017, options [nop,nop,TS val 236614 ecr 18386,mptcp dss ack 3516156078 seq 909587011 subseq 396985 len 1428 csum 0x1908], length 1428
10:05:06.123631 IP 112.26.3.1.44259 > 112.26.0.8.35259: Flags [.], seq 1428:2856, ack 1, win 4017, options [nop,nop,TS val 236801 ecr 18468,mptcp dss ack 3516156078 seq 909468487 subseq 127093 len 1428 csum 0x8b83], length 1428
10:05:06.190976 IP 112.26.0.8.39832 > 112.26.0.1.44259: Flags [.], ack 1029401, win 24558, options [nop,nop,TS val 18883 ecr 236005,mptcp dss ack 909577015], length 0
10:05:06.191389 IP 112.26.0.1.44259 > 112.26.0.8.39832: Flags [.], seq 1035113:1036541, ack 1, win 4017, options [nop,nop,TS val 237193 ecr 18883,mptcp dss ack 3516156078 seq 909594151 subseq 1035113 len 1428 csum 0x80ba], length 1428
10:05:06.191473 IP 112.26.0.1.44259 > 112.26.0.8.39832: Flags [.], seq 1036541:1037969, ack 1, win 4017, options [nop,nop,TS val 237193 ecr 18883,mptcp dss ack 3516156078 seq 909595579 subseq 1036541 len 1428 csum 0x75e4], length 1428
10:05:06.211456 IP 112.26.1.1.44259 > 112.26.0.8.46287: Flags [.], seq 311304:312732, ack 1, win 4017, options [nop,nop,TS val 236720 ecr 18456,mptcp dss ack 3516156078 seq 909588439 subseq 398413 len 1428 csum 0x1f08], length 1428
10:05:06.235325 IP 112.26.0.1.44259 > 112.26.0.8.39832: Flags [.], seq 1033685:1035113, ack 1, win 4017, options [nop,nop,TS val 236839 ecr 18477,mptcp dss ack 3516156078 seq 909589867 subseq 1033685 len 1428 csum 0x2a8e], length 1428
10:05:06.301676 IP 112.26.0.8.39832 > 112.26.0.1.44259: Flags [.], ack 1030829, win 24558, options [nop,nop,TS val 18964 ecr 236025,mptcp dss ack 909578443], length 0
10:05:06.301974 IP 112.26.0.1.44259 > 112.26.0.8.39832: Flags [.], seq 1037969:1039397, ack 1, win 4017, options [nop,nop,TS val 237304 ecr 18964,mptcp dss ack 3516156078 seq 909597007 subseq 1037969 len 1428 csum 0x71ef], length 1428
10:05:06.311338 IP 112.26.1.1.44259 > 112.26.0.8.46287: Flags [.], seq 312732:314160, ack 1, win 4017, options [nop,nop,TS val 236994 ecr 18651,mptcp dss ack 3516156078 seq 909591295 subseq 399841 len 1428 csum 0xae93], length 1428
10:05:06.392828 IP 112.26.1.1.44259 > 112.26.0.8.46287: Flags [.], seq 314160:315588, ack 1, win 4017, options [nop,nop,TS val 237093 ecr 18696,mptcp dss ack 3516156078 seq 909592723 subseq 401269 len 1428 csum 0x9beb], length 1428
10:05:06.416048 IP 112.26.0.8.46287 > 112.26.1.1.44259: Flags [.], ack 305592, win 24558, options [nop,nop,TS val 18972 ecr 236123,mptcp dss ack 909579871], length 0
10:05:06.416333 IP 112.26.1.1.44259 > 112.26.0.8.46287: Flags [.], seq 315588:317016, ack 1, win 4017, options [nop,nop,TS val 237418 ecr 18972,mptcp dss ack 3516156078 seq 909598435 subseq 402697 len 1428 csum 0x67a8], length 1428
10:05:06.429376 IP 112.26.0.1.44259 > 112.26.0.8.39832: Flags [.], seq 1035113:1036541, ack 1, win 4017, options [nop,nop,TS val 237193 ecr 18883,mptcp dss ack 3516156078 seq 909594151 subseq 1035113 len 1428 csum 0x80ba], length 1428
10:05:06.439104 IP 112.26.0.8.46287 > 112.26.1.1.44259: Flags [.], ack 307020, win 24558, options [nop,nop,TS val 19060 ecr 236206,mptcp dss ack 909581299], length 0
10:05:06.439442 IP 112.26.1.1.44259 > 112.26.0.8.46287: Flags [.], seq 317016:318444, ack 1, win 4017, options [nop,nop,TS val 237441 ecr 19060,mptcp dss ack 3516156078 seq 909599863 subseq 404125 len 1428 csum 0x864e], length 1428
10:05:06.499295 IP 112.26.0.1.44259 > 112.26.0.8.39832: Flags [.], seq 1036541:1037969, ack 1, win 4017, options [nop,nop,TS val 237193 ecr 18883,mptcp dss ack 3516156078 seq 909595579 subseq 1036541 len 1428 csum 0x75e4], length 1428
10:05:06.525406 IP 112.26.0.1.44259 > 112.26.0.8.39832: Flags [.], seq 1037969:1039397, ack 1, win 4017, options [nop,nop,TS val 237304 ecr 18964,mptcp dss ack 3516156078 seq 909597007 subseq 1037969 len 1428 csum 0x71ef], length 1428
10:05:06.603784 IP 112.26.0.8.46287 > 112.26.1.1.44259: Flags [.], ack 309876, win 24558, options [nop,nop,TS val 19264 ecr 236503,mptcp dss ack 909582727], length 0
10:05:06.604283 IP 112.26.1.1.44259 > 112.26.0.8.46287: Flags [.], seq 318444:319872, ack 1, win 4017, options [nop,nop,TS val 237607 ecr 19264,mptcp dss ack 3516156078 seq 909601291 subseq 405553 len 1428 csum 0x90b5], length 1428
10:05:06.604362 IP 112.26.1.1.44259 > 112.26.0.8.46287: Flags [.], seq 319872:321300, ack 1, win 4017, options [nop,nop,TS val 237607 ecr 19264,mptcp dss ack 3516156078 seq 909602719 subseq 406981 len 1428 csum 0x25b0], length 1428
10:05:06.604535 IP 112.26.1.1.44259 > 112.26.0.8.46287: Flags [.], seq 321300:322728, ack 1, win 4017, options [nop,nop,TS val 237607 ecr 19264,mptcp dss ack 3516156078 seq 909604147 subseq 408409 len 1428 csum 0x40ea], length 1428
10:05:06.615489 IP 112.26.1.1.44259 > 112.26.0.8.46287: Flags [.], seq 315588:317016, ack 1, win 4017, options [nop,nop,TS val 237418 ecr 18972,mptcp dss ack 3516156078 seq 909598435 subseq 402697 len 1428 csum 0x67a8], length 1428
10:05:06.695287 IP 112.26.0.8.35259 > 112.26.3.1.44259: Flags [.], ack 5712, win 24558, options [nop,nop,TS val 19284 ecr 236801,mptcp dss ack 909582727], length 0
10:05:06.695674 IP 112.26.3.1.44259 > 112.26.0.8.35259: Flags [.], seq 5712:7140, ack 1, win 4017, options [nop,nop,TS val 237698 ecr 19284,mptcp dss ack 3516156078 seq 909607003 subseq 131377 len 1428 csum 0x4d12], length 1428
10:05:06.695758 IP 112.26.3.1.44259 > 112.26.0.8.35259: Flags [.], seq 7140:8568, ack 1, win 4017, options [nop,nop,TS val 237698 ecr 19284,mptcp dss ack 3516156078 seq 909608431 subseq 132805 len 1428 csum 0xf630], length 1428
10:05:06.705357 IP 112.26.1.1.44259 > 112.26.0.8.46287: Flags [.], seq 317016:318444, ack 1, win 4017, options [nop,nop,TS val 237441 ecr 19060,mptcp dss ack 3516156078 seq 909599863 subseq 404125 len 1428 csum 0x864e], length 1428
10:05:06.732352 IP 112.26.0.8.39832 > 112.26.0.1.44259: Flags [.], ack 1032257, win 24536, options [nop,nop,TS val 19363 ecr 236220,mptcp dss ack 909584155], length 0
10:05:06.732718 IP 112.26.0.1.44259 > 112.26.0.8.39832: Flags [.], seq 1039397:1040825, ack 1, win 4017, options [nop,nop,TS val 237735 ecr 19363,mptcp dss ack 3516156078 seq 909609859 subseq 1039397 len 1428 csum 0xbd96], length 1428
10:05:06.807975 IP 112.26.0.8.46287 > 112.26.1.1.44259: Flags [.], ack 312732, win 24536, options [nop,nop,TS val 19386 ecr 236614,mptcp dss ack 909584155], length 0
10:05:06.808304 IP 112.26.1.1.44259 > 112.26.0.8.46287: Flags [.], seq 322728:324156, ack 1, win 4017, options [nop,nop,TS val 237810 ecr 19386,mptcp dss ack 3516156078 seq 909605575 subseq 409837 len 1428 csum 0xf088], length 1428
10:05:06.808377 IP 112.26.1.1.44259 > 112.26.0.8.46287: Flags [.], seq 324156:325584, ack 1, win 4017, options [nop,nop,TS val 237810 ecr 19386,mptcp dss ack 3516156078 seq 909611287 subseq 411265 len 1428 csum 0x4c48], length 1428
10:05:06.826141 IP 112.26.0.8.46287 > 112.26.1.1.44259: Flags [.], ack 314160, win 24536, options [nop,nop,TS val 19530 ecr 236994,mptcp dss ack 909584155], length 0
10:05:06.826486 IP 112.26.1.1.44259 > 112.26.0.8.46287: Flags [.], seq 325584:327012, ack 1, win 4017, options [nop,nop,TS val 237828 ecr 19530,mptcp dss ack 3516156078 seq 909612715 subseq 412693 len 1428 csum 0x4752], length 1428
10:05:06.829999 IP 112.26.1.1.44259 > 112.26.0.8.46287: Flags [.], seq 318444:319872, ack 1, win 4017, options [nop,nop,TS val 237607 ecr 19264,mptcp dss ack 3516156078 seq 909601291 subseq 405553 len 1428 csum 0x90b5], length 1428
10:05:06.902479 IP 112.26.3.1.44259 > 112.26.0.8.35259: Flags [.], seq 5712:7140, ack 1, win 4017, options [nop,nop,TS val 237698 ecr 19284,mptcp dss ack 3516156078 seq 909607003 subseq 131377 len 1428 csum 0x4d12], length 1428
10:05:06.926823 IP 112.26.1.1.44259 > 112.26.0.8.46287: Flags [.], seq 319872:321300, ack 1, win 4017, options [nop,nop,TS val 237607 ecr 19264,mptcp dss ack 3516156078 seq 909602719 subseq 406981 len 1428 csum 0x25b0], length 1428
10:05:06.997693 IP 112.26.0.8.39832 > 112.26.0.1.44259: Flags [.], ack 1032257, win 24536, options [nop,nop,TS val 19662 ecr 236220,nop,nop,sack 1 {1033685:1035113},mptcp dss ack 909584155], length 0
10:05:07.015662 IP 112.26.1.1.44259 > 112.26.0.8.46287: Flags [.], seq 321300:322728, ack 1, win 4017, options [nop,nop,TS val 237607 ecr 19264,mptcp dss ack 3516156078 seq 909604147 subseq 408409 len 1428 csum 0x40ea], length 1428
10:05:07.098075 IP 112.26.3.1.44259 > 112.26.0.8.35259: Flags [.], seq 7140:8568, ack 1, win 4017, options [nop,nop,TS val 237698 ecr 19284,mptcp dss ack 3516156078 seq 909608431 subseq 132805 len 1428 csum 0xf630], length 1428
10:05:07.106539 IP 112.26.0.1.44259 > 112.26.0.8.39832: Flags [.], seq 1039397:1040825, ack 1, win 4017, options [nop,nop,TS val 237735 ecr 19363,mptcp dss ack 3516156078 seq 909609859 subseq 1039397 len 1428 csum 0xbd96], length 1428
10:05:07.129507 IP 112.26.1.1.44259 > 112.26.0.8.46287: Flags [.], seq 322728:324156, ack 1, win 4017, options [nop,nop,TS val 237810 ecr 19386,mptcp dss ack 3516156078 seq 909605575 subseq 409837 len 1428 csum 0xf088], length 1428
10:05:07.200798 IP 112.26.1.1.44259 > 112.26.0.8.46287: Flags [.], seq 324156:325584, ack 1, win 4017, options [nop,nop,TS val 237810 ecr 19386,mptcp dss ack 3516156078 seq 909611287 subseq 411265 len 1428 csum 0x4c48], length 1428
10:05:07.236233 IP 112.26.1.1.44259 > 112.26.0.8.46287: Flags [.], seq 325584:327012, ack 1, win 4017, options [nop,nop,TS val 237828 ecr 19530,mptcp dss ack 3516156078 seq 909612715 subseq 412693 len 1428 csum 0x4752], length 1428
10:05:07.241795 IP 112.26.0.8.46287 > 112.26.1.1.44259: Flags [.], ack 315588, win 24536, options [nop,nop,TS val 19696 ecr 237093,mptcp dss ack 909584155], length 0
10:05:07.242124 IP 112.26.0.1.44259 > 112.26.0.8.39832: Flags [.], seq 1040825:1042253, ack 1, win 4017, options [nop,nop,TS val 238245 ecr 19662,mptcp dss ack 3516156078 seq 909614143 subseq 1040825 len 1428 csum 0xecae], length 1428
10:05:07.242216 IP 112.26.1.1.44259 > 112.26.0.8.46287: Flags [.], seq 327012:328440, ack 1, win 4017, options [nop,nop,TS val 238245 ecr 19696,mptcp dss ack 3516156078 seq 909615571 subseq 414121 len 1428 csum 0xe2fb], length 1428
10:05:07.316720 IP 112.26.0.1.44259 > 112.26.0.8.39832: Flags [.], seq 1040825:1042253, ack 1, win 4017, options [nop,nop,TS val 238245 ecr 19662,mptcp dss ack 3516156078 seq 909614143 subseq 1040825 len 1428 csum 0xecae], length 1428
10:05:07.324137 IP 112.26.0.8.39832 > 112.26.0.1.44259: Flags [.], ack 1032257, win 24536, options [nop,nop,TS val 19794 ecr 236220,nop,nop,sack 1 {1033685:1036541},mptcp dss ack 909584155], length 0
10:05:07.404290 IP 112.26.1.1.44259 > 112.26.0.8.46287: Flags [.], seq 327012:328440, ack 1, win 4017, options [nop,nop,TS val 238245 ecr 19696,mptcp dss ack 3516156078 seq 909615571 subseq 414121 len 1428 csum 0xe2fb], length 1428
10:05:07.417735 IP 112.26.0.8.39832 > 112.26.0.1.44259: Flags [.], ack 1032257, win 24536, options [nop,nop,TS val 19875 ecr 236220,nop,nop,sack 1 {1033685:1037969},mptcp dss ack 909584155], length 0
10:05:07.418053 IP 112.26.0.1.44259 > 112.26.0.8.39832: Flags [.], seq 1042253:1043681, ack 1, win 4017, options [nop,nop,TS val 238421 ecr 19794,mptcp dss ack 3516156078 seq 909616999 subseq 1042253 len 1428 csum 0x8dc2], length 1428
10:05:07.418137 IP 112.26.0.1.44259 > 112.26.0.8.39832: Flags [.], seq 1032257:1033685, ack 1, win 4017, options [nop,nop,TS val 238421 ecr 19875,mptcp dss ack 3516156078 seq 909584155 subseq 1032257 len 1428 csum 0x11db], length 1428
10:05:07.506101 IP 112.26.0.8.39832 > 112.26.0.1.44259: Flags [.], ack 1032257, win 24536, options [nop,nop,TS val 19971 ecr 236220,nop,nop,sack 1 {1033685:1039397},mptcp dss ack 909584155], length 0
10:05:07.507944 IP 112.26.0.1.44259 > 112.26.0.8.39832: Flags [.], seq 1042253:1043681, ack 1, win 4017, options [nop,nop,TS val 238421 ecr 19794,mptcp dss ack 3516156078 seq 909616999 subseq 1042253 len 1428 csum 0x8dc2], length 1428
10:05:07.527267 IP 112.26.0.8.35259 > 112.26.3.1.44259: Flags [.], ack 7140, win 24536, options [nop,nop,TS val 20062 ecr 237698,mptcp dss ack 909584155], length 0
10:05:07.527554 IP 112.26.3.1.44259 > 112.26.0.8.35259: Flags [.], seq 8568:9996, ack 1, win 4017, options [nop,nop,TS val 238530 ecr 20062,mptcp dss ack 3516156078 seq 909618427 subseq 134233 len 1428 csum 0x22c8], length 1428
10:05:07.534038 IP 112.26.0.1.44259 > 112.26.0.8.39832: Flags [.], seq 1032257:1033685, ack 1, win 4017, options [nop,nop,TS val 238421 ecr 19875,mptcp dss ack 3516156078 seq 909584155 subseq 1032257 len 1428 csum 0x11db], length 1428
