10:41:55.129382 IP 112.26.0.8.44380 > 112.26.0.1.44877: Flags [S], seq 231718060, win 65535, options [mss 1460,sackOK,TS val 3909 ecr 0,nop,wscale 6,mptcp capable csum {0x4662d4d2f708162f}], length 0
10:41:55.133006 IP 112.26.0.8.44380 > 112.26.0.1.44877: Flags [S], seq 231718060, win 65535, options [mss 1460,sackOK,TS val 3909 ecr 0,nop,wscale 6,mptcp capable csum {0x4662d4d2f708162f}], length 0
10:41:55.157505 IP 112.26.0.1.44877 > 112.26.0.8.44380: Flags [S.], seq 1060196464, ack 231718061, win 65535, options [mss 1460,sackOK,TS val 217271 ecr 3909,nop,wscale 6,mptcp capable csum {0x38a7cf8d5ca5beb8}], length 0
10:41:55.157765 IP 112.26.0.1.44877 > 112.26.0.8.44380: Flags [S.], seq 1060196464, ack 231718061, win 65535, options [mss 1460,sackOK,TS val 217271 ecr 3909,nop,wscale 6,mptcp capable csum {0x38a7cf8d5ca5beb8}], length 0
10:41:55.233412 IP 112.26.0.8.44380 > 112.26.0.1.44877: Flags [.], ack 1, win 1369, options [nop,nop,TS val 3947 ecr 217271,mptcp capable csum {0x4662d4d2f708162f,0x38a7cf8d5ca5beb8},mptcp dss ack 444111424], length 0
10:41:55.266876 IP 112.26.0.8.44380 > 112.26.0.1.44877: Flags [.], ack 1, win 1369, options [nop,nop,TS val 3947 ecr 217271,mptcp add-addr id 3 112.26.1.8,mptcp dss ack 444111424], length 0
10:41:55.279086 IP 112.26.0.8.44380 > 112.26.0.1.44877: Flags [.], ack 1, win 1369, options [nop,nop,TS val 3947 ecr 217271,mptcp add-addr id 4 112.26.2.8,mptcp dss ack 444111424], length 0
10:42:31.054948 IP 112.26.0.1.44877 > 112.26.0.8.44380: Flags [.], seq 361097:362525, ack 1, win 4017, options [nop,nop,TS val 252608 ecr 38806,mptcp dss ack 3454339951 seq 445365020 subseq 361097 len 1428 csum 0xcb65], length 1428
10:42:31.055287 IP 112.26.0.1.44877 > 112.26.0.8.44380: Flags [.], seq 361097:362525, ack 1, win 4017, options [nop,nop,TS val 252608 ecr 38806,mptcp dss ack 3454339951 seq 445365020 subseq 361097 len 1428 csum 0xcb65], length 1428
10:42:31.059978 IP 112.26.0.8.44380 > 112.26.0.1.44877: Flags [.], ack 362525, win 24161, options [nop,nop,TS val 39846 ecr 252608,mptcp dss ack 445299332], length 0
10:42:31.176934 IP 112.26.0.8.44380 > 112.26.0.1.44877: Flags [.], ack 356813, win 24177, options [nop,nop,TS val 39328 ecr 252217,mptcp dss ack 445269344], length 0
10:42:31.228694 IP 112.26.0.8.44380 > 112.26.0.1.44877: Flags [.], ack 358241, win 24094, options [nop,nop,TS val 39419 ecr 252283,mptcp dss ack 445287908], length 0
10:42:46.811228 IP 112.26.0.8.44380 > 112.26.0.1.44877: Flags [.], ack 521033, win 24391, options [nop,nop,TS val 55597 ecr 268245,mptcp dss ack 445893380], length 0
10:43:06.921673 IP 112.26.0.8.44380 > 112.26.0.1.44877: Flags [.], ack 708101, win 23999, options [nop,nop,TS val 75085 ecr 286633,nop,nop,sack 2 {713813:718097}{709529:712385},mptcp dss ack 446705912], length 0
10:43:06.961122 IP 112.26.0.8.44380 > 112.26.0.1.44877: Flags [.], ack 708101, win 23999, options [nop,nop,TS val 75190 ecr 286633,nop,nop,sack 2 {719525:720953}{713813:718097},mptcp dss ack 446705912], length 0
10:43:07.015923 IP 112.26.0.8.44380 > 112.26.0.1.44877: Flags [.], ack 708101, win 23999, options [nop,nop,TS val 75279 ecr 286633,nop,nop,sack 2 {719525:722381}{713813:718097},mptcp dss ack 446705912], length 0
10:43:07.086444 IP 112.26.0.8.44380 > 112.26.0.1.44877: Flags [.], ack 708101, win 23690, options [nop,nop,TS val 75362 ecr 286633,nop,nop,sack 2 {719525:723809}{713813:718097},mptcp dss ack 446753036], length 0
10:43:07.125772 IP 112.26.0.8.44380 > 112.26.0.1.44877: Flags [.], ack 708101, win 23690, options [nop,nop,TS val 75435 ecr 286633,nop,nop,sack 2 {725237:726665}{719525:723809},mptcp dss ack 446753036], length 0
10:43:07.215698 IP 112.26.0.1.44877 > 112.26.0.8.44380: Flags [.], seq 728093:729521, ack 1, win 4017, options [nop,nop,TS val 288832 ecr 74208,mptcp dss ack 3454339951 seq 446882984 subseq 728093 len 1428 csum 0xb138], length 1428
10:43:07.216034 IP 112.26.0.1.44877 > 112.26.0.8.44380: Flags [.], seq 728093:729521, ack 1, win 4017, options [nop,nop,TS val 288832 ecr 74208,mptcp dss ack 3454339951 seq 446882984 subseq 728093 len 1428 csum 0xb138], length 1428
10:43:07.222446 IP 112.26.0.8.44380 > 112.26.0.1.44877: Flags [.], ack 708101, win 23690, options [nop,nop,TS val 76006 ecr 286633,nop,nop,sack 2 {728093:729521}{728093:729521},mptcp dss ack 446753036], length 0
10:43:07.292477 IP 112.26.0.1.44877 > 112.26.0.8.44380: Flags [.], seq 708101:709529, ack 1, win 4017, options [nop,nop,TS val 288898 ecr 74807,mptcp dss ack 3454339951 seq 446825864 subseq 708101 len 1428 csum 0x9a9b], length 1428
10:43:07.292922 IP 112.26.0.1.44877 > 112.26.0.8.44380: Flags [.], seq 708101:709529, ack 1, win 4017, options [nop,nop,TS val 288898 ecr 74807,mptcp dss ack 3454339951 seq 446825864 subseq 708101 len 1428 csum 0x9a9b], length 1428
10:43:07.296649 IP 112.26.0.8.44380 > 112.26.0.1.44877: Flags [.], ack 712385, win 23690, options [nop,nop,TS val 76083 ecr 288898,nop,nop,sack 2 {728093:729521}{725237:726665},mptcp dss ack 446753036], length 0
10:43:07.369102 IP 112.26.0.1.44877 > 112.26.0.8.44380: Flags [.], seq 712385:713813, ack 1, win 4017, options [nop,nop,TS val 288898 ecr 74807,mptcp dss ack 3454339951 seq 446844428 subseq 712385 len 1428 csum 0x1208], length 1428
10:43:07.369389 IP 112.26.0.1.44877 > 112.26.0.8.44380: Flags [.], seq 712385:713813, ack 1, win 4017, options [nop,nop,TS val 288898 ecr 74807,mptcp dss ack 3454339951 seq 446844428 subseq 712385 len 1428 csum 0x1208], length 1428
10:43:07.391317 IP 112.26.0.8.44380 > 112.26.0.1.44877: Flags [.], ack 718097, win 23690, options [nop,nop,TS val 76178 ecr 288898,nop,nop,sack 2 {728093:729521}{725237:726665},mptcp dss ack 446753036], length 0
10:43:07.430513 IP 112.26.0.8.44380 > 112.26.0.1.44877: Flags [.], ack 708101, win 23690, options [nop,nop,TS val 75615 ecr 286633,nop,nop,sack 2 {728093:729521}{725237:726665},mptcp dss ack 446753036], length 0
10:43:07.490387 IP 112.26.0.1.44877 > 112.26.0.8.44380: Flags [.], seq 718097:719525, ack 1, win 4017, options [nop,nop,TS val 289099 ecr 75190,mptcp dss ack 3454339951 seq 446861564 subseq 718097 len 1428 csum 0x354], length 1428
10:43:07.490791 IP 112.26.0.1.44877 > 112.26.0.8.44380: Flags [.], seq 718097:719525, ack 1, win 4017, options [nop,nop,TS val 289099 ecr 75190,mptcp dss ack 3454339951 seq 446861564 subseq 718097 len 1428 csum 0x354], length 1428
10:43:07.496815 IP 112.26.0.8.44380 > 112.26.0.1.44877: Flags [.], ack 723809, win 23690, options [nop,nop,TS val 76281 ecr 289099,nop,nop,sack 2 {728093:729521}{725237:726665},mptcp dss ack 446753036], length 0
10:43:07.581622 IP 112.26.0.1.44877 > 112.26.0.8.44380: Flags [.], seq 729521:730949, ack 1, win 4017, options [nop,nop,TS val 289178 ecr 75279,mptcp dss ack 3454339951 seq 446914400 subseq 729521 len 1428 csum 0x7ae4], length 1428
10:43:07.581915 IP 112.26.0.1.44877 > 112.26.0.8.44380: Flags [.], seq 729521:730949, ack 1, win 4017, options [nop,nop,TS val 289178 ecr 75279,mptcp dss ack 3454339951 seq 446914400 subseq 729521 len 1428 csum 0x7ae4], length 1428
10:43:07.650300 IP 112.26.0.8.44380 > 112.26.0.1.44877: Flags [.], ack 723809, win 23690, options [nop,nop,TS val 76374 ecr 289099,nop,nop,sack 2 {728093:730949}{725237:726665},mptcp dss ack 446753036], length 0
10:43:07.666349 IP 112.26.0.1.44877 > 112.26.0.8.44380: Flags [.], seq 730949:732377, ack 1, win 4017, options [nop,nop,TS val 289264 ecr 75362,mptcp dss ack 3454339951 seq 446915828 subseq 730949 len 1428 csum 0xab57], length 1428
10:43:07.666604 IP 112.26.0.1.44877 > 112.26.0.8.44380: Flags [.], seq 730949:732377, ack 1, win 4017, options [nop,nop,TS val 289264 ecr 75362,mptcp dss ack 3454339951 seq 446915828 subseq 730949 len 1428 csum 0xab57], length 1428
10:43:07.723055 IP 112.26.0.8.44380 > 112.26.0.1.44877: Flags [.], ack 723809, win 23690, options [nop,nop,TS val 76510 ecr 289099,nop,nop,sack 2 {728093:732377}{725237:726665},mptcp dss ack 446753036], length 0
10:43:07.735537 IP 112.26.0.1.44877 > 112.26.0.8.44380: Flags [.], seq 723809:725237, ack 1, win 4017, options [nop,nop,TS val 289264 ecr 75435,mptcp dss ack 3454339951 seq 446874416 subseq 723809 len 1428 csum 0x400d], length 1428
10:43:07.735838 IP 112.26.0.1.44877 > 112.26.0.8.44380: Flags [.], seq 723809:725237, ack 1, win 4017, options [nop,nop,TS val 289264 ecr 75435,mptcp dss ack 3454339951 seq 446874416 subseq 723809 len 1428 csum 0x400d], length 1428
10:43:07.797226 IP 112.26.0.8.44380 > 112.26.0.1.44877: Flags [.], ack 708101, win 23690, options [nop,nop,TS val 76006 ecr 286633,nop,nop,sack 2 {728093:729521}{728093:729521},mptcp dss ack 446753036], length 0
10:43:07.821402 IP 112.26.0.8.44380 > 112.26.0.1.44877: Flags [.], ack 726665, win 23690, options [nop,nop,TS val 76607 ecr 289264,nop,nop,sack 1 {728093:732377},mptcp dss ack 446753036], length 0
10:43:07.878256 IP 112.26.0.8.44380 > 112.26.0.1.44877: Flags [.], ack 712385, win 23690, options [nop,nop,TS val 76083 ecr 288898,nop,nop,sack 2 {728093:729521}{725237:726665},mptcp dss ack 446753036], length 0
10:43:07.974244 IP 112.26.0.8.44380 > 112.26.0.1.44877: Flags [.], ack 718097, win 23690, options [nop,nop,TS val 76178 ecr 288898,nop,nop,sack 2 {728093:729521}{725237:726665},mptcp dss ack 446753036], length 0
10:43:08.024159 IP 112.26.0.1.44877 > 112.26.0.8.44380: Flags [.], seq 726665:728093, ack 1, win 4017, options [nop,nop,TS val 289569 ecr 75615,mptcp dss ack 3454339951 seq 446881556 subseq 726665 len 1428 csum 0x24e6], length 1428
10:43:08.024496 IP 112.26.0.1.44877 > 112.26.0.8.44380: Flags [.], seq 726665:728093, ack 1, win 4017, options [nop,nop,TS val 289569 ecr 75615,mptcp dss ack 3454339951 seq 446881556 subseq 726665 len 1428 csum 0x24e6], length 1428
10:43:08.106113 IP 112.26.0.8.44380 > 112.26.0.1.44877: Flags [.], ack 723809, win 23690, options [nop,nop,TS val 76281 ecr 289099,nop,nop,sack 2 {728093:729521}{725237:726665},mptcp dss ack 446753036], length 0
10:43:08.109144 IP 112.26.0.8.44380 > 112.26.0.1.44877: Flags [.], ack 732377, win 23690, options [nop,nop,TS val 76821 ecr 289569,mptcp dss ack 446753036], length 0
10:43:08.256882 IP 112.26.0.8.44380 > 112.26.0.1.44877: Flags [.], ack 723809, win 23690, options [nop,nop,TS val 76374 ecr 289099,nop,nop,sack 2 {728093:730949}{725237:726665},mptcp dss ack 446753036], length 0
10:43:08.282414 IP 112.26.0.8.44380 > 112.26.0.1.44877: Flags [.], ack 723809, win 23690, options [nop,nop,TS val 76510 ecr 289099,nop,nop,sack 2 {728093:732377}{725237:726665},mptcp dss ack 446753036], length 0
10:43:08.334487 IP 112.26.0.8.44380 > 112.26.0.1.44877: Flags [.], ack 726665, win 23690, options [nop,nop,TS val 76607 ecr 289264,nop,nop,sack 1 {728093:732377},mptcp dss ack 446753036], length 0
10:43:08.416828 IP 112.26.0.1.44877 > 112.26.0.8.44380: Flags [.], seq 732377:733805, ack 1, win 4017, options [nop,nop,TS val 289988 ecr 76006,mptcp dss ack 3454339951 seq 446934392 subseq 732377 len 1428 csum 0x336], length 1428
10:43:08.417161 IP 112.26.0.1.44877 > 112.26.0.8.44380: Flags [.], seq 732377:733805, ack 1, win 4017, options [nop,nop,TS val 289988 ecr 76006,mptcp dss ack 3454339951 seq 446934392 subseq 732377 len 1428 csum 0x336], length 1428
10:43:08.421854 IP 112.26.0.8.44380 > 112.26.0.1.44877: Flags [.], ack 733805, win 23690, options [nop,nop,TS val 77207 ecr 289988,mptcp dss ack 446753036], length 0
10:43:08.507230 IP 112.26.0.1.44877 > 112.26.0.8.44380: Flags [.], seq 733805:735233, ack 1, win 4017, options [nop,nop,TS val 290016 ecr 76083,mptcp dss ack 3454339951 seq 446937248 subseq 733805 len 1428 csum 0x341e], length 1428
10:43:08.507587 IP 112.26.0.1.44877 > 112.26.0.8.44380: Flags [.], seq 733805:735233, ack 1, win 4017, options [nop,nop,TS val 290016 ecr 76083,mptcp dss ack 3454339951 seq 446937248 subseq 733805 len 1428 csum 0x341e], length 1428
10:43:08.517766 IP 112.26.0.8.44380 > 112.26.0.1.44877: Flags [.], ack 735233, win 23690, options [nop,nop,TS val 77304 ecr 290016,mptcp dss ack 446753036], length 0
10:43:08.577584 IP 112.26.0.1.44877 > 112.26.0.8.44380: Flags [.], seq 735233:736661, ack 1, win 4017, options [nop,nop,TS val 290016 ecr 76083,mptcp dss ack 3454339951 seq 446938676 subseq 735233 len 1428 csum 0xe785], length 1428
10:43:08.577914 IP 112.26.0.1.44877 > 112.26.0.8.44380: Flags [.], seq 735233:736661, ack 1, win 4017, options [nop,nop,TS val 290016 ecr 76083,mptcp dss ack 3454339951 seq 446938676 subseq 735233 len 1428 csum 0xe785], length 1428
10:43:08.609021 IP 112.26.0.8.44380 > 112.26.0.1.44877: Flags [.], ack 736661, win 23690, options [nop,nop,TS val 77394 ecr 290016,mptcp dss ack 446753036], length 0
10:43:08.666125 IP 112.26.0.1.44877 > 112.26.0.8.44380: Flags [.], seq 736661:738089, ack 1, win 4017, options [nop,nop,TS val 290016 ecr 76083,mptcp dss ack 3454339951 seq 446940104 subseq 736661 len 1428 csum 0x737b], length 1428
10:43:08.666447 IP 112.26.0.1.44877 > 112.26.0.8.44380: Flags [.], seq 736661:738089, ack 1, win 4017, options [nop,nop,TS val 290016 ecr 76083,mptcp dss ack 3454339951 seq 446940104 subseq 736661 len 1428 csum 0x737b], length 1428
10:43:08.714824 IP 112.26.0.8.44380 > 112.26.0.1.44877: Flags [.], ack 738089, win 23690, options [nop,nop,TS val 77497 ecr 290016,mptcp dss ack 446753036], length 0
10:43:08.742662 IP 112.26.0.1.44877 > 112.26.0.8.44380: Flags [.], seq 738089:739517, ack 1, win 4017, options [nop,nop,TS val 290112 ecr 76178,mptcp dss ack 3454339951 seq 446944388 subseq 738089 len 1428 csum 0xdc0e], length 1428
10:43:08.742953 IP 112.26.0.1.44877 > 112.26.0.8.44380: Flags [.], seq 738089:739517, ack 1, win 4017, options [nop,nop,TS val 290112 ecr 76178,mptcp dss ack 3454339951 seq 446944388 subseq 738089 len 1428 csum 0xdc0e], length 1428
10:43:08.782938 IP 112.26.0.8.44380 > 112.26.0.1.44877: Flags [.], ack 732377, win 23690, options [nop,nop,TS val 76821 ecr 289569,mptcp dss ack 446753036], length 0
10:43:08.810913 IP 112.26.0.8.44380 > 112.26.0.1.44877: Flags [.], ack 739517, win 23690, options [nop,nop,TS val 77595 ecr 290112,mptcp dss ack 446753036], length 0
10:43:08.860488 IP 112.26.0.1.44877 > 112.26.0.8.44380: Flags [.], seq 739517:740945, ack 1, win 4017, options [nop,nop,TS val 290242 ecr 76281,mptcp dss ack 3454339951 seq 446954384 subseq 739517 len 1428 csum 0x3a6c], length 1428
10:43:08.860838 IP 112.26.0.1.44877 > 112.26.0.8.44380: Flags [.], seq 739517:740945, ack 1, win 4017, options [nop,nop,TS val 290242 ecr 76281,mptcp dss ack 3454339951 seq 446954384 subseq 739517 len 1428 csum 0x3a6c], length 1428
10:43:08.882524 IP 112.26.0.8.44380 > 112.26.0.1.44877: Flags [.], ack 740945, win 24208, options [nop,nop,TS val 77669 ecr 290242,mptcp dss ack 446905832], length 0
10:43:08.928633 IP 112.26.0.1.44877 > 112.26.0.8.44380: Flags [.], seq 740945:742373, ack 1, win 4017, options [nop,nop,TS val 290420 ecr 76374,mptcp dss ack 3454339951 seq 446958668 subseq 740945 len 1428 csum 0xf793], length 1428
10:43:08.928933 IP 112.26.0.1.44877 > 112.26.0.8.44380: Flags [.], seq 740945:742373, ack 1, win 4017, options [nop,nop,TS val 290420 ecr 76374,mptcp dss ack 3454339951 seq 446958668 subseq 740945 len 1428 csum 0xf793], length 1428
10:43:09.000089 IP 112.26.0.8.44380 > 112.26.0.1.44877: Flags [.], ack 742373, win 24208, options [nop,nop,TS val 77787 ecr 290420,mptcp dss ack 446905832], length 0
10:43:09.066227 IP 112.26.0.1.44877 > 112.26.0.8.44380: Flags [.], seq 742373:743801, ack 1, win 4017, options [nop,nop,TS val 290472 ecr 76510,mptcp dss ack 3454339951 seq 446960096 subseq 742373 len 1428 csum 0x142c], length 1428
10:43:09.066555 IP 112.26.0.1.44877 > 112.26.0.8.44380: Flags [.], seq 742373:743801, ack 1, win 4017, options [nop,nop,TS val 290472 ecr 76510,mptcp dss ack 3454339951 seq 446960096 subseq 742373 len 1428 csum 0x142c], length 1428
10:43:09.088188 IP 112.26.0.8.44380 > 112.26.0.1.44877: Flags [.], ack 743801, win 24543, options [nop,nop,TS val 77859 ecr 290472,mptcp dss ack 446957240], length 0
10:43:09.171244 IP 112.26.0.1.44877 > 112.26.0.8.44380: Flags [.], seq 743801:745229, ack 1, win 4017, options [nop,nop,TS val 290472 ecr 76607,mptcp dss ack 3454339951 seq 446961524 subseq 743801 len 1428 csum 0x4698], length 1428
10:43:09.171488 IP 112.26.0.1.44877 > 112.26.0.8.44380: Flags [.], seq 743801:745229, ack 1, win 4017, options [nop,nop,TS val 290472 ecr 76607,mptcp dss ack 3454339951 seq 446961524 subseq 743801 len 1428 csum 0x4698], length 1428
10:43:09.184782 IP 112.26.0.8.44380 > 112.26.0.1.44877: Flags [.], ack 745229, win 24543, options [nop,nop,TS val 77962 ecr 290472,mptcp dss ack 446957240], length 0
10:43:09.232505 IP 112.26.0.8.44380 > 112.26.0.1.44877: Flags [.], ack 735233, win 23690, options [nop,nop,TS val 77304 ecr 290016,mptcp dss ack 446753036], length 0
10:43:09.307900 IP 112.26.0.8.44380 > 112.26.0.1.44877: Flags [.], ack 736661, win 23690, options [nop,nop,TS val 77394 ecr 290016,mptcp dss ack 446753036], length 0
10:43:09.353414 IP 112.26.0.8.44380 > 112.26.0.1.44877: Flags [.], ack 738089, win 23690, options [nop,nop,TS val 77497 ecr 290016,mptcp dss ack 446753036], length 0
10:43:09.417023 IP 112.26.0.1.44877 > 112.26.0.8.44380: Flags [.], seq 745229:746657, ack 1, win 4017, options [nop,nop,TS val 290921 ecr 76821,mptcp dss ack 3454339951 seq 446974376 subseq 745229 len 1428 csum 0x3177], length 1428
10:43:09.417263 IP 112.26.0.1.44877 > 112.26.0.8.44380: Flags [.], seq 745229:746657, ack 1, win 4017, options [nop,nop,TS val 290921 ecr 76821,mptcp dss ack 3454339951 seq 446974376 subseq 745229 len 1428 csum 0x3177], length 1428
10:43:09.429023 IP 112.26.0.8.44380 > 112.26.0.1.44877: Flags [.], ack 746657, win 24543, options [nop,nop,TS val 78209 ecr 290921,mptcp dss ack 446957240], length 0
10:43:09.495064 IP 112.26.0.8.44380 > 112.26.0.1.44877: Flags [.], ack 739517, win 23690, options [nop,nop,TS val 77595 ecr 290112,mptcp dss ack 446753036], length 0
10:43:09.578605 IP 112.26.0.8.44380 > 112.26.0.1.44877: Flags [.], ack 740945, win 24208, options [nop,nop,TS val 77669 ecr 290242,mptcp dss ack 446905832], length 0
10:43:09.701655 IP 112.26.0.8.44380 > 112.26.0.1.44877: Flags [.], ack 742373, win 24208, options [nop,nop,TS val 77787 ecr 290420,mptcp dss ack 446905832], length 0
10:43:09.778098 IP 112.26.0.8.44380 > 112.26.0.1.44877: Flags [.], ack 745229, win 24543, options [nop,nop,TS val 77962 ecr 290472,mptcp dss ack 446957240], length 0
10:43:09.826006 IP 112.26.0.1.44877 > 112.26.0.8.44380: Flags [.], seq 746657:748085, ack 1, win 4017, options [nop,nop,TS val 291371 ecr 77304,mptcp dss ack 3454339951 seq 446987228 subseq 746657 len 1428 csum 0xa8f1], length 1428
10:43:09.826327 IP 112.26.0.1.44877 > 112.26.0.8.44380: Flags [.], seq 746657:748085, ack 1, win 4017, options [nop,nop,TS val 291371 ecr 77304,mptcp dss ack 3454339951 seq 446987228 subseq 746657 len 1428 csum 0xa8f1], length 1428
10:43:09.829043 IP 112.26.0.8.44380 > 112.26.0.1.44877: Flags [.], ack 748085, win 24543, options [nop,nop,TS val 78616 ecr 291371,mptcp dss ack 446957240], length 0
10:43:09.944169 IP 112.26.0.1.44877 > 112.26.0.8.44380: Flags [.], seq 749513:750941, ack 1, win 4017, options [nop,nop,TS val 291371 ecr 77304,mptcp dss ack 3454339951 seq 446990084 subseq 749513 len 1428 csum 0x576e], length 1428
10:43:09.944549 IP 112.26.0.1.44877 > 112.26.0.8.44380: Flags [.], seq 749513:750941, ack 1, win 4017, options [nop,nop,TS val 291371 ecr 77304,mptcp dss ack 3454339951 seq 446990084 subseq 749513 len 1428 csum 0x576e], length 1428
10:43:09.949870 IP 112.26.0.8.44380 > 112.26.0.1.44877: Flags [.], ack 748085, win 24543, options [nop,nop,TS val 78736 ecr 291371,nop,nop,sack 1 {749513:750941},mptcp dss ack 446957240], length 0
10:43:10.033096 IP 112.26.0.1.44877 > 112.26.0.8.44380: Flags [.], seq 750941:752369, ack 1, win 4017, options [nop,nop,TS val 291446 ecr 77394,mptcp dss ack 3454339951 seq 446995796 subseq 750941 len 1428 csum 0x6e3e], length 1428
10:43:10.033420 IP 112.26.0.1.44877 > 112.26.0.8.44380: Flags [.], seq 750941:752369, ack 1, win 4017, options [nop,nop,TS val 291446 ecr 77394,mptcp dss ack 3454339951 seq 446995796 subseq 750941 len 1428 csum 0x6e3e], length 1428
10:43:10.041829 IP 112.26.0.8.44380 > 112.26.0.1.44877: Flags [.], ack 748085, win 24543, options [nop,nop,TS val 78826 ecr 291371,nop,nop,sack 1 {749513:752369},mptcp dss ack 446957240], length 0
10:43:10.125226 IP 112.26.0.1.44877 > 112.26.0.8.44380: Flags [.], seq 753797:755225, ack 1, win 4017, options [nop,nop,TS val 291491 ecr 77497,mptcp dss ack 3454339951 seq 446998652 subseq 753797 len 1428 csum 0xc2fd], length 1428
10:43:10.125588 IP 112.26.0.1.44877 > 112.26.0.8.44380: Flags [.], seq 753797:755225, ack 1, win 4017, options [nop,nop,TS val 291491 ecr 77497,mptcp dss ack 3454339951 seq 446998652 subseq 753797 len 1428 csum 0xc2fd], length 1428
10:43:10.134836 IP 112.26.0.8.44380 > 112.26.0.1.44877: Flags [.], ack 748085, win 24543, options [nop,nop,TS val 78918 ecr 291371,nop,nop,sack 2 {753797:755225}{749513:752369},mptcp dss ack 446957240], length 0
10:43:10.209471 IP 112.26.0.1.44877 > 112.26.0.8.44380: Flags [.], seq 755225:756653, ack 1, win 4017, options [nop,nop,TS val 291633 ecr 77595,mptcp dss ack 3454339951 seq 447010076 subseq 755225 len 1428 csum 0x76c5], length 1428
10:43:10.209837 IP 112.26.0.1.44877 > 112.26.0.8.44380: Flags [.], seq 755225:756653, ack 1, win 4017, options [nop,nop,TS val 291633 ecr 77595,mptcp dss ack 3454339951 seq 447010076 subseq 755225 len 1428 csum 0x76c5], length 1428
10:43:10.228685 IP 112.26.0.8.44380 > 112.26.0.1.44877: Flags [.], ack 748085, win 24543, options [nop,nop,TS val 79008 ecr 291371,nop,nop,sack 2 {753797:756653}{749513:752369},mptcp dss ack 446957240], length 0
10:43:10.289903 IP 112.26.0.1.44877 > 112.26.0.8.44380: Flags [.], seq 756653:758081, ack 1, win 4017, options [nop,nop,TS val 291717 ecr 77669,mptcp dss ack 3454339951 seq 447012932 subseq 756653 len 1428 csum 0xc265], length 1428
10:43:10.290240 IP 112.26.0.1.44877 > 112.26.0.8.44380: Flags [.], seq 756653:758081, ack 1, win 4017, options [nop,nop,TS val 291717 ecr 77669,mptcp dss ack 3454339951 seq 447012932 subseq 756653 len 1428 csum 0xc265], length 1428
10:43:10.296209 IP 112.26.0.8.44380 > 112.26.0.1.44877: Flags [.], ack 748085, win 24543, options [nop,nop,TS val 79081 ecr 291371,nop,nop,sack 2 {753797:758081}{749513:752369},mptcp dss ack 446957240], length 0
10:43:10.369757 IP 112.26.0.1.44877 > 112.26.0.8.44380: Flags [.], seq 759509:760937, ack 1, win 4017, options [nop,nop,TS val 291916 ecr 77962,mptcp dss ack 3454339951 seq 447020072 subseq 759509 len 1428 csum 0x3bea], length 1428
10:43:10.370047 IP 112.26.0.1.44877 > 112.26.0.8.44380: Flags [.], seq 759509:760937, ack 1, win 4017, options [nop,nop,TS val 291916 ecr 77962,mptcp dss ack 3454339951 seq 447020072 subseq 759509 len 1428 csum 0x3bea], length 1428
10:43:10.379256 IP 112.26.0.8.44380 > 112.26.0.1.44877: Flags [.], ack 748085, win 24543, options [nop,nop,TS val 79165 ecr 291371,nop,nop,sack 2 {759509:760937}{753797:758081},mptcp dss ack 446957240], length 0
10:43:10.457942 IP 112.26.0.8.44380 > 112.26.0.1.44877: Flags [.], ack 748085, win 24543, options [nop,nop,TS val 78616 ecr 291371,mptcp dss ack 446957240], length 0
10:43:10.535314 IP 112.26.0.1.44877 > 112.26.0.8.44380: Flags [.], seq 760937:762365, ack 1, win 4017, options [nop,nop,TS val 291916 ecr 77962,mptcp dss ack 3454339951 seq 447021500 subseq 760937 len 1428 csum 0xbc0b], length 1428
10:43:10.535678 IP 112.26.0.1.44877 > 112.26.0.8.44380: Flags [.], seq 760937:762365, ack 1, win 4017, options [nop,nop,TS val 291916 ecr 77962,mptcp dss ack 3454339951 seq 447021500 subseq 760937 len 1428 csum 0xbc0b], length 1428
10:43:10.542399 IP 112.26.0.8.44380 > 112.26.0.1.44877: Flags [.], ack 748085, win 24543, options [nop,nop,TS val 79328 ecr 291371,nop,nop,sack 2 {759509:762365}{753797:758081},mptcp dss ack 446957240], length 0
10:43:10.644018 IP 112.26.0.8.44380 > 112.26.0.1.44877: Flags [.], ack 748085, win 24543, options [nop,nop,TS val 78736 ecr 291371,nop,nop,sack 1 {749513:750941},mptcp dss ack 446957240], length 0
10:43:10.730566 IP 112.26.0.8.44380 > 112.26.0.1.44877: Flags [.], ack 748085, win 24543, options [nop,nop,TS val 78826 ecr 291371,nop,nop,sack 1 {749513:752369},mptcp dss ack 446957240], length 0
10:43:10.787672 IP 112.26.0.8.44380 > 112.26.0.1.44877: Flags [.], ack 748085, win 24543, options [nop,nop,TS val 78918 ecr 291371,nop,nop,sack 2 {753797:755225}{749513:752369},mptcp dss ack 446957240], length 0
10:43:10.835477 IP 112.26.0.8.44380 > 112.26.0.1.44877: Flags [.], ack 748085, win 24543, options [nop,nop,TS val 79008 ecr 291371,nop,nop,sack 2 {753797:756653}{749513:752369},mptcp dss ack 446957240], length 0
10:43:10.876877 IP 112.26.0.8.44380 > 112.26.0.1.44877: Flags [.], ack 748085, win 24543, options [nop,nop,TS val 79081 ecr 291371,nop,nop,sack 2 {753797:758081}{749513:752369},mptcp dss ack 446957240], length 0
10:43:10.934626 IP 112.26.0.8.44380 > 112.26.0.1.44877: Flags [.], ack 748085, win 24543, options [nop,nop,TS val 79165 ecr 291371,nop,nop,sack 2 {759509:760937}{753797:758081},mptcp dss ack 446957240], length 0
10:43:10.986549 IP 112.26.0.1.44877 > 112.26.0.8.44380: Flags [.], seq 763793:765221, ack 1, win 4017, options [nop,nop,TS val 292596 ecr 78616,mptcp dss ack 3454339951 seq 447045776 subseq 763793 len 1428 csum 0x5f29], length 1428
10:43:10.986899 IP 112.26.0.1.44877 > 112.26.0.8.44380: Flags [.], seq 763793:765221, ack 1, win 4017, options [nop,nop,TS val 292596 ecr 78616,mptcp dss ack 3454339951 seq 447045776 subseq 763793 len 1428 csum 0x5f29], length 1428
10:43:10.994241 IP 112.26.0.8.44380 > 112.26.0.1.44877: Flags [.], ack 748085, win 24249, options [nop,nop,TS val 79780 ecr 291371,nop,nop,sack 2 {763793:765221}{759509:762365},mptcp dss ack 446988656], length 0
10:43:11.090703 IP 112.26.0.8.44380 > 112.26.0.1.44877: Flags [.], ack 748085, win 24543, options [nop,nop,TS val 79328 ecr 291371,nop,nop,sack 2 {759509:762365}{753797:758081},mptcp dss ack 446957240], length 0
10:43:11.145015 IP 112.26.0.1.44877 > 112.26.0.8.44380: Flags [.], seq 765221:766649, ack 1, win 4017, options [nop,nop,TS val 292596 ecr 78616,mptcp dss ack 3454339951 seq 447047204 subseq 765221 len 1428 csum 0xd57], length 1428
10:43:11.145317 IP 112.26.0.1.44877 > 112.26.0.8.44380: Flags [.], seq 765221:766649, ack 1, win 4017, options [nop,nop,TS val 292596 ecr 78616,mptcp dss ack 3454339951 seq 447047204 subseq 765221 len 1428 csum 0xd57], length 1428
10:43:11.151366 IP 112.26.0.8.44380 > 112.26.0.1.44877: Flags [.], ack 748085, win 24249, options [nop,nop,TS val 79937 ecr 291371,nop,nop,sack 2 {763793:766649}{759509:762365},mptcp dss ack 446988656], length 0
10:43:11.209912 IP 112.26.0.1.44877 > 112.26.0.8.44380: Flags [.], seq 766649:768077, ack 1, win 4017, options [nop,nop,TS val 292800 ecr 78736,mptcp dss ack 3454339951 seq 447057200 subseq 766649 len 1428 csum 0xf03b], length 1428
10:43:11.210277 IP 112.26.0.1.44877 > 112.26.0.8.44380: Flags [.], seq 766649:768077, ack 1, win 4017, options [nop,nop,TS val 292800 ecr 78736,mptcp dss ack 3454339951 seq 447057200 subseq 766649 len 1428 csum 0xf03b], length 1428
10:43:11.248696 IP 112.26.0.8.44380 > 112.26.0.1.44877: Flags [.], ack 748085, win 24249, options [nop,nop,TS val 80028 ecr 291371,nop,nop,sack 2 {763793:768077}{759509:762365},mptcp dss ack 446988656], length 0
10:43:11.296936 IP 112.26.0.1.44877 > 112.26.0.8.44380: Flags [.], seq 768077:769505, ack 1, win 4017, options [nop,nop,TS val 292911 ecr 78826,mptcp dss ack 3454339951 seq 447060056 subseq 768077 len 1428 csum 0xbf97], length 1428
10:43:11.297261 IP 112.26.0.1.44877 > 112.26.0.8.44380: Flags [.], seq 768077:769505, ack 1, win 4017, options [nop,nop,TS val 292911 ecr 78826,mptcp dss ack 3454339951 seq 447060056 subseq 768077 len 1428 csum 0xbf97], length 1428
10:43:11.334516 IP 112.26.0.1.44877 > 112.26.0.8.44380: Flags [.], seq 748085:749513, ack 1, win 4017, options [nop,nop,TS val 292926 ecr 78918,mptcp dss ack 3454339951 seq 446988656 subseq 748085 len 1428 csum 0xa6c0], length 1428
10:43:11.334856 IP 112.26.0.1.44877 > 112.26.0.8.44380: Flags [.], seq 748085:749513, ack 1, win 4017, options [nop,nop,TS val 292926 ecr 78918,mptcp dss ack 3454339951 seq 446988656 subseq 748085 len 1428 csum 0xa6c0], length 1428
10:43:11.391243 IP 112.26.0.8.44380 > 112.26.0.1.44877: Flags [.], ack 748085, win 24249, options [nop,nop,TS val 80137 ecr 291371,nop,nop,sack 2 {763793:769505}{759509:762365},mptcp dss ack 446988656], length 0
10:43:11.432304 IP 112.26.0.1.44877 > 112.26.0.8.44380: Flags [.], seq 752369:753797, ack 1, win 4017, options [nop,nop,TS val 292974 ecr 79008,mptcp dss ack 3454339951 seq 446997224 subseq 752369 len 1428 csum 0x1921], length 1428
10:43:11.432668 IP 112.26.0.1.44877 > 112.26.0.8.44380: Flags [.], seq 752369:753797, ack 1, win 4017, options [nop,nop,TS val 292974 ecr 79008,mptcp dss ack 3454339951 seq 446997224 subseq 752369 len 1428 csum 0x1921], length 1428
10:43:11.447050 IP 112.26.0.8.44380 > 112.26.0.1.44877: Flags [.], ack 752369, win 24116, options [nop,nop,TS val 80234 ecr 292926,nop,nop,sack 2 {763793:769505}{759509:762365},mptcp dss ack 446997224], length 0
10:43:11.507338 IP 112.26.0.1.44877 > 112.26.0.8.44380: Flags [.], seq 769505:770933, ack 1, win 4017, options [nop,nop,TS val 293043 ecr 79081,mptcp dss ack 3454339951 seq 447064340 subseq 769505 len 1428 csum 0x3fa], length 1428
10:43:11.507704 IP 112.26.0.1.44877 > 112.26.0.8.44380: Flags [.], seq 769505:770933, ack 1, win 4017, options [nop,nop,TS val 293043 ecr 79081,mptcp dss ack 3454339951 seq 447064340 subseq 769505 len 1428 csum 0x3fa], length 1428
10:43:11.511910 IP 112.26.0.8.44380 > 112.26.0.1.44877: Flags [.], ack 758081, win 24081, options [nop,nop,TS val 80285 ecr 292974,nop,nop,sack 2 {763793:769505}{759509:762365},mptcp dss ack 447017216], length 0
10:43:11.557758 IP 112.26.0.8.44380 > 112.26.0.1.44877: Flags [.], ack 748085, win 24249, options [nop,nop,TS val 79780 ecr 291371,nop,nop,sack 2 {763793:765221}{759509:762365},mptcp dss ack 446988656], length 0
10:43:11.601350 IP 112.26.0.8.44380 > 112.26.0.1.44877: Flags [.], ack 758081, win 24301, options [nop,nop,TS val 80388 ecr 292974,nop,nop,sack 2 {763793:770933}{759509:762365},mptcp dss ack 447017216], length 0
10:43:11.653294 IP 112.26.0.1.44877 > 112.26.0.8.44380: Flags [.], seq 758081:759509, ack 1, win 4017, options [nop,nop,TS val 293229 ecr 79328,mptcp dss ack 3454339951 seq 447017216 subseq 758081 len 1428 csum 0xc392], length 1428
10:43:11.653654 IP 112.26.0.1.44877 > 112.26.0.8.44380: Flags [.], seq 758081:759509, ack 1, win 4017, options [nop,nop,TS val 293229 ecr 79328,mptcp dss ack 3454339951 seq 447017216 subseq 758081 len 1428 csum 0xc392], length 1428
10:43:11.670251 IP 112.26.0.8.44380 > 112.26.0.1.44877: Flags [.], ack 762365, win 24221, options [nop,nop,TS val 80455 ecr 293229,nop,nop,sack 1 {763793:770933},mptcp dss ack 447022928], length 0
10:43:11.728090 IP 112.26.0.8.44380 > 112.26.0.1.44877: Flags [.], ack 748085, win 24249, options [nop,nop,TS val 79937 ecr 291371,nop,nop,sack 2 {763793:766649}{759509:762365},mptcp dss ack 446988656], length 0
10:43:11.786954 IP 112.26.0.8.44380 > 112.26.0.1.44877: Flags [.], ack 748085, win 24249, options [nop,nop,TS val 80028 ecr 291371,nop,nop,sack 2 {763793:768077}{759509:762365},mptcp dss ack 446988656], length 0
10:43:11.844830 IP 112.26.0.8.44380 > 112.26.0.1.44877: Flags [.], ack 748085, win 24249, options [nop,nop,TS val 80137 ecr 291371,nop,nop,sack 2 {763793:769505}{759509:762365},mptcp dss ack 446988656], length 0
10:43:11.923660 IP 112.26.0.8.44380 > 112.26.0.1.44877: Flags [.], ack 752369, win 24116, options [nop,nop,TS val 80234 ecr 292926,nop,nop,sack 2 {763793:769505}{759509:762365},mptcp dss ack 446997224], length 0
10:43:11.959265 IP 112.26.0.8.44380 > 112.26.0.1.44877: Flags [.], ack 758081, win 24081, options [nop,nop,TS val 80285 ecr 292974,nop,nop,sack 2 {763793:769505}{759509:762365},mptcp dss ack 447017216], length 0
10:43:12.004368 IP 112.26.0.1.44877 > 112.26.0.8.44380: Flags [.], seq 762365:763793, ack 1, win 4017, options [nop,nop,TS val 293696 ecr 79780,mptcp dss ack 3454339951 seq 447022928 subseq 762365 len 1428 csum 0x752d], length 1428
10:43:12.004663 IP 112.26.0.1.44877 > 112.26.0.8.44380: Flags [.], seq 762365:763793, ack 1, win 4017, options [nop,nop,TS val 293696 ecr 79780,mptcp dss ack 3454339951 seq 447022928 subseq 762365 len 1428 csum 0x752d], length 1428
10:43:12.007975 IP 112.26.0.8.44380 > 112.26.0.1.44877: Flags [.], ack 770933, win 24223, options [nop,nop,TS val 80794 ecr 293696,mptcp dss ack 447025784], length 0
10:43:12.116461 IP 112.26.0.8.44380 > 112.26.0.1.44877: Flags [.], ack 758081, win 24301, options [nop,nop,TS val 80388 ecr 292974,nop,nop,sack 2 {763793:770933}{759509:762365},mptcp dss ack 447017216], length 0
10:43:12.165186 IP 112.26.0.8.44380 > 112.26.0.1.44877: Flags [.], ack 762365, win 24221, options [nop,nop,TS val 80455 ecr 293229,nop,nop,sack 1 {763793:770933},mptcp dss ack 447022928], length 0
10:43:12.209422 IP 112.26.0.1.44877 > 112.26.0.8.44380: Flags [.], seq 770933:772361, ack 1, win 4017, options [nop,nop,TS val 293872 ecr 79937,mptcp dss ack 3454339951 seq 447092900 subseq 770933 len 1428 csum 0xa27f], length 1428
10:43:12.209759 IP 112.26.0.1.44877 > 112.26.0.8.44380: Flags [.], seq 770933:772361, ack 1, win 4017, options [nop,nop,TS val 293872 ecr 79937,mptcp dss ack 3454339951 seq 447092900 subseq 770933 len 1428 csum 0xa27f], length 1428
10:43:12.215824 IP 112.26.0.8.44380 > 112.26.0.1.44877: Flags [.], ack 772361, win 24277, options [nop,nop,TS val 81001 ecr 293872,mptcp dss ack 447052916], length 0
10:43:12.305444 IP 112.26.0.1.44877 > 112.26.0.8.44380: Flags [.], seq 772361:773789, ack 1, win 4017, options [nop,nop,TS val 293935 ecr 80028,mptcp dss ack 3454339951 seq 447095756 subseq 772361 len 1428 csum 0x77e0], length 1428
10:43:12.305772 IP 112.26.0.1.44877 > 112.26.0.8.44380: Flags [.], seq 772361:773789, ack 1, win 4017, options [nop,nop,TS val 293935 ecr 80028,mptcp dss ack 3454339951 seq 447095756 subseq 772361 len 1428 csum 0x77e0], length 1428
10:43:12.313980 IP 112.26.0.8.44380 > 112.26.0.1.44877: Flags [.], ack 773789, win 24277, options [nop,nop,TS val 81101 ecr 293935,mptcp dss ack 447052916], length 0
10:43:12.365747 IP 112.26.0.1.44877 > 112.26.0.8.44380: Flags [.], seq 773789:775217, ack 1, win 4017, options [nop,nop,TS val 293989 ecr 80137,mptcp dss ack 3454339951 seq 447100040 subseq 773789 len 1428 csum 0x495e], length 1428
10:43:12.365985 IP 112.26.0.1.44877 > 112.26.0.8.44380: Flags [.], seq 773789:775217, ack 1, win 4017, options [nop,nop,TS val 293989 ecr 80137,mptcp dss ack 3454339951 seq 447100040 subseq 773789 len 1428 csum 0x495e], length 1428
10:43:12.410928 IP 112.26.0.8.44380 > 112.26.0.1.44877: Flags [.], ack 775217, win 24277, options [nop,nop,TS val 81192 ecr 293989,mptcp dss ack 447052916], length 0
10:43:12.479144 IP 112.26.0.1.44877 > 112.26.0.8.44380: Flags [.], seq 775217:776645, ack 1, win 4017, options [nop,nop,TS val 294062 ecr 80234,mptcp dss ack 3454339951 seq 447102896 subseq 775217 len 1428 csum 0x3d32], length 1428
10:43:12.479480 IP 112.26.0.1.44877 > 112.26.0.8.44380: Flags [.], seq 775217:776645, ack 1, win 4017, options [nop,nop,TS val 294062 ecr 80234,mptcp dss ack 3454339951 seq 447102896 subseq 775217 len 1428 csum 0x3d32], length 1428
10:43:12.484328 IP 112.26.0.8.44380 > 112.26.0.1.44877: Flags [.], ack 776645, win 24277, options [nop,nop,TS val 81269 ecr 294062,mptcp dss ack 447052916], length 0
10:43:12.558084 IP 112.26.0.8.44380 > 112.26.0.1.44877: Flags [.], ack 770933, win 24223, options [nop,nop,TS val 80794 ecr 293696,mptcp dss ack 447025784], length 0
10:43:12.609915 IP 112.26.0.1.44877 > 112.26.0.8.44380: Flags [.], seq 776645:778073, ack 1, win 4017, options [nop,nop,TS val 294062 ecr 80234,mptcp dss ack 3454339951 seq 447104324 subseq 776645 len 1428 csum 0x7db3], length 1428
10:43:12.610244 IP 112.26.0.1.44877 > 112.26.0.8.44380: Flags [.], seq 776645:778073, ack 1, win 4017, options [nop,nop,TS val 294062 ecr 80234,mptcp dss ack 3454339951 seq 447104324 subseq 776645 len 1428 csum 0x7db3], length 1428
10:43:12.632894 IP 112.26.0.8.44380 > 112.26.0.1.44877: Flags [.], ack 778073, win 24540, options [nop,nop,TS val 81402 ecr 294062,mptcp dss ack 447105752], length 0
10:43:12.700125 IP 112.26.0.1.44877 > 112.26.0.8.44380: Flags [.], seq 778073:779501, ack 1, win 4017, options [nop,nop,TS val 294097 ecr 80285,mptcp dss ack 3454339951 seq 447105752 subseq 778073 len 1428 csum 0x79f2], length 1428
10:43:12.700459 IP 112.26.0.1.44877 > 112.26.0.8.44380: Flags [.], seq 778073:779501, ack 1, win 4017, options [nop,nop,TS val 294097 ecr 80285,mptcp dss ack 3454339951 seq 447105752 subseq 778073 len 1428 csum 0x79f2], length 1428
10:43:12.706701 IP 112.26.0.8.44380 > 112.26.0.1.44877: Flags [.], ack 779501, win 24525, options [nop,nop,TS val 81493 ecr 294097,mptcp dss ack 447108608], length 0
10:43:12.775408 IP 112.26.0.1.44877 > 112.26.0.8.44380: Flags [.], seq 779501:780929, ack 1, win 4017, options [nop,nop,TS val 294269 ecr 80388,mptcp dss ack 3454339951 seq 447108608 subseq 779501 len 1428 csum 0xc8ed], length 1428
10:43:12.775750 IP 112.26.0.1.44877 > 112.26.0.8.44380: Flags [.], seq 779501:780929, ack 1, win 4017, options [nop,nop,TS val 294269 ecr 80388,mptcp dss ack 3454339951 seq 447108608 subseq 779501 len 1428 csum 0xc8ed], length 1428
10:43:12.794811 IP 112.26.0.8.44380 > 112.26.0.1.44877: Flags [.], ack 780929, win 24525, options [nop,nop,TS val 81566 ecr 294269,mptcp dss ack 447111464], length 0
10:43:12.850707 IP 112.26.0.8.44380 > 112.26.0.1.44877: Flags [.], ack 772361, win 24277, options [nop,nop,TS val 81001 ecr 293872,mptcp dss ack 447052916], length 0
10:43:12.923895 IP 112.26.0.1.44877 > 112.26.0.8.44380: Flags [.], seq 780929:782357, ack 1, win 4017, options [nop,nop,TS val 294303 ecr 80455,mptcp dss ack 3454339951 seq 447112892 subseq 780929 len 1428 csum 0xdf32], length 1428
10:43:12.924217 IP 112.26.0.1.44877 > 112.26.0.8.44380: Flags [.], seq 780929:782357, ack 1, win 4017, options [nop,nop,TS val 294303 ecr 80455,mptcp dss ack 3454339951 seq 447112892 subseq 780929 len 1428 csum 0xdf32], length 1428
10:43:12.928217 IP 112.26.0.8.44380 > 112.26.0.1.44877: Flags [.], ack 782357, win 24496, options [nop,nop,TS val 81714 ecr 294303,mptcp dss ack 447120032], length 0
10:43:12.981939 IP 112.26.0.8.44380 > 112.26.0.1.44877: Flags [.], ack 773789, win 24277, options [nop,nop,TS val 81101 ecr 293935,mptcp dss ack 447052916], length 0
10:43:13.037493 IP 112.26.0.8.44380 > 112.26.0.1.44877: Flags [.], ack 775217, win 24277, options [nop,nop,TS val 81192 ecr 293989,mptcp dss ack 447052916], length 0
10:43:13.104886 IP 112.26.0.8.44380 > 112.26.0.1.44877: Flags [.], ack 776645, win 24277, options [nop,nop,TS val 81269 ecr 294062,mptcp dss ack 447052916], length 0
10:43:13.167911 IP 112.26.0.1.44877 > 112.26.0.8.44380: Flags [.], seq 782357:783785, ack 1, win 4017, options [nop,nop,TS val 294696 ecr 80794,mptcp dss ack 3454339951 seq 447125744 subseq 782357 len 1428 csum 0x48e], length 1428
10:43:13.168173 IP 112.26.0.1.44877 > 112.26.0.8.44380: Flags [.], seq 782357:783785, ack 1, win 4017, options [nop,nop,TS val 294696 ecr 80794,mptcp dss ack 3454339951 seq 447125744 subseq 782357 len 1428 csum 0x48e], length 1428
10:43:13.173239 IP 112.26.0.8.44380 > 112.26.0.1.44877: Flags [.], ack 783785, win 24525, options [nop,nop,TS val 81958 ecr 294696,mptcp dss ack 447128600], length 0
10:43:13.249345 IP 112.26.0.8.44380 > 112.26.0.1.44877: Flags [.], ack 778073, win 24540, options [nop,nop,TS val 81402 ecr 294062,mptcp dss ack 447105752], length 0
10:43:13.307338 IP 112.26.0.8.44380 > 112.26.0.1.44877: Flags [.], ack 779501, win 24525, options [nop,nop,TS val 81493 ecr 294097,mptcp dss ack 447108608], length 0
10:43:13.374981 IP 112.26.0.8.44380 > 112.26.0.1.44877: Flags [.], ack 780929, win 24525, options [nop,nop,TS val 81566 ecr 294269,mptcp dss ack 447111464], length 0
