10:42:02.409962 IP 112.26.3.8.42387 > 112.26.3.1.44877: Flags [S], seq 3404096348, win 65535, options [mss 1460,sackOK,TS val 11180 ecr 0,nop,wscale 6,mptcp join id 6 token 0x187b1b60 nonce 0x63255531], length 0
10:42:02.476666 IP 112.26.3.8.42387 > 112.26.3.1.44877: Flags [S], seq 3404096348, win 65535, options [mss 1460,sackOK,TS val 11180 ecr 0,nop,wscale 6,mptcp join id 6 token 0x187b1b60 nonce 0x63255531], length 0
10:42:02.529394 IP 112.26.3.8.42387 > 112.26.3.1.44877: Flags [S], seq 3404096348, win 65535, options [mss 1460,sackOK,TS val 11180 ecr 0,nop,wscale 6,mptcp join id 6 token 0x187b1b60 nonce 0x63255531], length 0
10:42:02.679778 IP 112.26.3.1.44877 > 112.26.3.8.42387: Flags [S.], seq 3834564252, ack 3404096349, win 65535, options [mss 1460,sackOK,TS val 224668 ecr 11180,nop,wscale 6,mptcp join id 5 hmac 0xcb2ba0bbb54b93af nonce 0x6a8a083b], length 0
10:42:02.680123 IP 112.26.3.1.44877 > 112.26.3.8.42387: Flags [S.], seq 3834564252, ack 3404096349, win 65535, options [mss 1460,sackOK,TS val 224668 ecr 11180,nop,wscale 6,mptcp join id 5 hmac 0xcb2ba0bbb54b93af nonce 0x6a8a083b], length 0
10:42:02.724473 IP 112.26.3.8.42387 > 112.26.3.1.44877: Flags [.], ack 1, win 7072, options [nop,nop,TS val 11508 ecr 224668,mptcp join hmac 0x6751ff0d8d5836226ca8bca04d26c0f7c656fb92], length 0
10:42:02.724841 IP 112.26.3.8.42387 > 112.26.3.1.44877: Flags [.], ack 1, win 7072, options [nop,nop,TS val 11508 ecr 224668,mptcp join hmac 0x6751ff0d8d5836226ca8bca04d26c0f7c656fb92], length 0
10:42:38.699913 IP 112.26.3.1.44877 > 112.26.3.8.42387: Flags [.], seq 402697:404125, ack 1, win 4017, options [nop,nop,TS val 260509 ecr 46984,mptcp dss ack 3454339951 seq 445710596 subseq 402697 len 1428 csum 0x15a8], length 1428
10:42:38.700232 IP 112.26.3.1.44877 > 112.26.3.8.42387: Flags [.], seq 402697:404125, ack 1, win 4017, options [nop,nop,TS val 260509 ecr 46984,mptcp dss ack 3454339951 seq 445710596 subseq 402697 len 1428 csum 0x15a8], length 1428
10:42:38.777782 IP 112.26.3.8.42387 > 112.26.3.1.44877: Flags [.], ack 396985, win 24540, options [nop,nop,TS val 47328 ecr 260001,mptcp dss ack 445604924], length 0
10:42:38.809779 IP 112.26.3.1.44877 > 112.26.3.8.42387: Flags [.], seq 404125:405553, ack 1, win 4017, options [nop,nop,TS val 260509 ecr 46984,mptcp dss ack 3454339951 seq 445712024 subseq 404125 len 1428 csum 0x562d], length 1428
10:42:38.810106 IP 112.26.3.1.44877 > 112.26.3.8.42387: Flags [.], seq 404125:405553, ack 1, win 4017, options [nop,nop,TS val 260509 ecr 46984,mptcp dss ack 3454339951 seq 445712024 subseq 404125 len 1428 csum 0x562d], length 1428
10:42:38.820253 IP 112.26.3.8.42387 > 112.26.3.1.44877: Flags [.], ack 401269, win 24311, options [nop,nop,TS val 47608 ecr 260422,mptcp dss ack 445659188], length 0
10:42:38.820597 IP 112.26.3.8.42387 > 112.26.3.1.44877: Flags [.], ack 401269, win 24311, options [nop,nop,TS val 47608 ecr 260422,mptcp dss ack 445659188], length 0
10:42:38.912084 IP 112.26.3.1.44877 > 112.26.3.8.42387: Flags [.], seq 405553:406981, ack 1, win 4017, options [nop,nop,TS val 260916 ecr 47328,mptcp dss ack 3454339951 seq 445724876 subseq 405553 len 1428 csum 0x2d07], length 1428
10:42:38.912410 IP 112.26.3.1.44877 > 112.26.3.8.42387: Flags [.], seq 405553:406981, ack 1, win 4017, options [nop,nop,TS val 260916 ecr 47328,mptcp dss ack 3454339951 seq 445724876 subseq 405553 len 1428 csum 0x2d07], length 1428
10:42:38.964551 IP 112.26.3.1.44877 > 112.26.3.8.42387: Flags [.], seq 406981:408409, ack 1, win 4017, options [nop,nop,TS val 260916 ecr 47328,mptcp dss ack 3454339951 seq 445726304 subseq 406981 len 1428 csum 0x9e83], length 1428
10:42:38.964878 IP 112.26.3.1.44877 > 112.26.3.8.42387: Flags [.], seq 406981:408409, ack 1, win 4017, options [nop,nop,TS val 260916 ecr 47328,mptcp dss ack 3454339951 seq 445726304 subseq 406981 len 1428 csum 0x9e83], length 1428
10:42:39.022308 IP 112.26.3.8.42387 > 112.26.3.1.44877: Flags [.], ack 401269, win 24311, options [nop,nop,TS val 47608 ecr 260422,mptcp dss ack 445659188], length 0
10:42:39.063641 IP 112.26.3.1.44877 > 112.26.3.8.42387: Flags [.], seq 408409:409837, ack 1, win 4017, options [nop,nop,TS val 260916 ecr 47328,mptcp dss ack 3454339951 seq 445727732 subseq 408409 len 1428 csum 0x44d9], length 1428
10:42:39.063963 IP 112.26.3.1.44877 > 112.26.3.8.42387: Flags [.], seq 408409:409837, ack 1, win 4017, options [nop,nop,TS val 260916 ecr 47328,mptcp dss ack 3454339951 seq 445727732 subseq 408409 len 1428 csum 0x44d9], length 1428
10:42:39.088356 IP 112.26.3.8.42387 > 112.26.3.1.44877: Flags [.], ack 406981, win 24311, options [nop,nop,TS val 47875 ecr 260422,mptcp dss ack 445659188], length 0
10:42:39.088595 IP 112.26.3.8.42387 > 112.26.3.1.44877: Flags [.], ack 406981, win 24311, options [nop,nop,TS val 47875 ecr 260422,mptcp dss ack 445659188], length 0
10:42:39.169106 IP 112.26.3.1.44877 > 112.26.3.8.42387: Flags [.], seq 409837:411265, ack 1, win 4017, options [nop,nop,TS val 260916 ecr 47328,mptcp dss ack 3454339951 seq 445729160 subseq 409837 len 1428 csum 0x6b51], length 1428
10:42:39.169438 IP 112.26.3.1.44877 > 112.26.3.8.42387: Flags [.], seq 409837:411265, ack 1, win 4017, options [nop,nop,TS val 260916 ecr 47328,mptcp dss ack 3454339951 seq 445729160 subseq 409837 len 1428 csum 0x6b51], length 1428
10:42:39.238779 IP 112.26.3.1.44877 > 112.26.3.8.42387: Flags [.], seq 411265:412693, ack 1, win 4017, options [nop,nop,TS val 260916 ecr 47328,mptcp dss ack 3454339951 seq 445730588 subseq 411265 len 1428 csum 0x88c], length 1428
10:42:39.239070 IP 112.26.3.1.44877 > 112.26.3.8.42387: Flags [.], seq 411265:412693, ack 1, win 4017, options [nop,nop,TS val 260916 ecr 47328,mptcp dss ack 3454339951 seq 445730588 subseq 411265 len 1428 csum 0x88c], length 1428
10:42:39.281913 IP 112.26.3.1.44877 > 112.26.3.8.42387: Flags [.], seq 412693:414121, ack 1, win 4017, options [nop,nop,TS val 261161 ecr 47608,mptcp dss ack 3454339951 seq 445740584 subseq 412693 len 1428 csum 0xb5a], length 1428
10:42:39.282237 IP 112.26.3.1.44877 > 112.26.3.8.42387: Flags [.], seq 412693:414121, ack 1, win 4017, options [nop,nop,TS val 261161 ecr 47608,mptcp dss ack 3454339951 seq 445740584 subseq 412693 len 1428 csum 0xb5a], length 1428
10:42:39.308812 IP 112.26.3.8.42387 > 112.26.3.1.44877: Flags [.], ack 409837, win 24311, options [nop,nop,TS val 48096 ecr 260916,mptcp dss ack 445659188], length 0
10:42:39.309127 IP 112.26.3.8.42387 > 112.26.3.1.44877: Flags [.], ack 409837, win 24311, options [nop,nop,TS val 48096 ecr 260916,mptcp dss ack 445659188], length 0
10:42:39.322553 IP 112.26.3.8.42387 > 112.26.3.1.44877: Flags [.], ack 406981, win 24311, options [nop,nop,TS val 47875 ecr 260422,mptcp dss ack 445659188], length 0
10:42:39.398286 IP 112.26.3.1.44877 > 112.26.3.8.42387: Flags [.], seq 414121:415549, ack 1, win 4017, options [nop,nop,TS val 261161 ecr 47608,mptcp dss ack 3454339951 seq 445742012 subseq 414121 len 1428 csum 0x2196], length 1428
10:42:39.398561 IP 112.26.3.1.44877 > 112.26.3.8.42387: Flags [.], seq 414121:415549, ack 1, win 4017, options [nop,nop,TS val 261161 ecr 47608,mptcp dss ack 3454339951 seq 445742012 subseq 414121 len 1428 csum 0x2196], length 1428
10:42:39.488193 IP 112.26.3.1.44877 > 112.26.3.8.42387: Flags [.], seq 415549:416977, ack 1, win 4017, options [nop,nop,TS val 261161 ecr 47608,mptcp dss ack 3454339951 seq 445743440 subseq 415549 len 1428 csum 0xf46d], length 1428
10:42:39.488544 IP 112.26.3.1.44877 > 112.26.3.8.42387: Flags [.], seq 415549:416977, ack 1, win 4017, options [nop,nop,TS val 261161 ecr 47608,mptcp dss ack 3454339951 seq 445743440 subseq 415549 len 1428 csum 0xf46d], length 1428
10:42:39.560514 IP 112.26.3.1.44877 > 112.26.3.8.42387: Flags [.], seq 416977:418405, ack 1, win 4017, options [nop,nop,TS val 261161 ecr 47608,mptcp dss ack 3454339951 seq 445744868 subseq 416977 len 1428 csum 0xa113], length 1428
10:42:39.560856 IP 112.26.3.1.44877 > 112.26.3.8.42387: Flags [.], seq 416977:418405, ack 1, win 4017, options [nop,nop,TS val 261161 ecr 47608,mptcp dss ack 3454339951 seq 445744868 subseq 416977 len 1428 csum 0xa113], length 1428
10:42:39.621639 IP 112.26.3.1.44877 > 112.26.3.8.42387: Flags [.], seq 418405:419833, ack 1, win 4017, options [nop,nop,TS val 261161 ecr 47608,mptcp dss ack 3454339951 seq 445746296 subseq 418405 len 1428 csum 0xa31b], length 1428
10:42:39.621938 IP 112.26.3.1.44877 > 112.26.3.8.42387: Flags [.], seq 418405:419833, ack 1, win 4017, options [nop,nop,TS val 261161 ecr 47608,mptcp dss ack 3454339951 seq 445746296 subseq 418405 len 1428 csum 0xa31b], length 1428
10:42:39.666099 IP 112.26.3.8.42387 > 112.26.3.1.44877: Flags [.], ack 409837, win 24311, options [nop,nop,TS val 48096 ecr 260916,mptcp dss ack 445659188], length 0
10:42:39.703384 IP 112.26.3.1.44877 > 112.26.3.8.42387: Flags [.], seq 419833:421261, ack 1, win 4017, options [nop,nop,TS val 261461 ecr 47875,mptcp dss ack 3454339951 seq 445756292 subseq 419833 len 1428 csum 0x1790], length 1428
10:42:39.703695 IP 112.26.3.1.44877 > 112.26.3.8.42387: Flags [.], seq 419833:421261, ack 1, win 4017, options [nop,nop,TS val 261461 ecr 47875,mptcp dss ack 3454339951 seq 445756292 subseq 419833 len 1428 csum 0x1790], length 1428
10:42:39.721077 IP 112.26.3.8.42387 > 112.26.3.1.44877: Flags [.], ack 415549, win 24311, options [nop,nop,TS val 48508 ecr 260916,mptcp dss ack 445659188], length 0
10:42:39.721346 IP 112.26.3.8.42387 > 112.26.3.1.44877: Flags [.], ack 415549, win 24311, options [nop,nop,TS val 48508 ecr 260916,mptcp dss ack 445659188], length 0
10:42:39.752683 IP 112.26.3.1.44877 > 112.26.3.8.42387: Flags [.], seq 421261:422689, ack 1, win 4017, options [nop,nop,TS val 261461 ecr 47875,mptcp dss ack 3454339951 seq 445757720 subseq 421261 len 1428 csum 0x49ff], length 1428
10:42:39.752980 IP 112.26.3.1.44877 > 112.26.3.8.42387: Flags [.], seq 421261:422689, ack 1, win 4017, options [nop,nop,TS val 261461 ecr 47875,mptcp dss ack 3454339951 seq 445757720 subseq 421261 len 1428 csum 0x49ff], length 1428
10:42:39.824709 IP 112.26.3.1.44877 > 112.26.3.8.42387: Flags [.], seq 422689:424117, ack 1, win 4017, options [nop,nop,TS val 261461 ecr 47875,mptcp dss ack 3454339951 seq 445759148 subseq 422689 len 1428 csum 0x9714], length 1428
10:42:39.825001 IP 112.26.3.1.44877 > 112.26.3.8.42387: Flags [.], seq 422689:424117, ack 1, win 4017, options [nop,nop,TS val 261461 ecr 47875,mptcp dss ack 3454339951 seq 445759148 subseq 422689 len 1428 csum 0x9714], length 1428
10:42:39.868403 IP 112.26.3.8.42387 > 112.26.3.1.44877: Flags [.], ack 418405, win 23613, options [nop,nop,TS val 48655 ecr 261161,mptcp dss ack 445734872], length 0
10:42:39.868696 IP 112.26.3.8.42387 > 112.26.3.1.44877: Flags [.], ack 418405, win 23613, options [nop,nop,TS val 48655 ecr 261161,mptcp dss ack 445734872], length 0
10:42:39.910355 IP 112.26.3.1.44877 > 112.26.3.8.42387: Flags [.], seq 424117:425545, ack 1, win 4017, options [nop,nop,TS val 261461 ecr 47875,mptcp dss ack 3454339951 seq 445760576 subseq 424117 len 1428 csum 0xd325], length 1428
10:42:39.910662 IP 112.26.3.1.44877 > 112.26.3.8.42387: Flags [.], seq 424117:425545, ack 1, win 4017, options [nop,nop,TS val 261461 ecr 47875,mptcp dss ack 3454339951 seq 445760576 subseq 424117 len 1428 csum 0xd325], length 1428
10:42:39.961727 IP 112.26.3.1.44877 > 112.26.3.8.42387: Flags [.], seq 425545:426973, ack 1, win 4017, options [nop,nop,TS val 261804 ecr 48096,mptcp dss ack 3454339951 seq 445764860 subseq 425545 len 1428 csum 0x54e8], length 1428
10:42:39.962057 IP 112.26.3.1.44877 > 112.26.3.8.42387: Flags [.], seq 425545:426973, ack 1, win 4017, options [nop,nop,TS val 261804 ecr 48096,mptcp dss ack 3454339951 seq 445764860 subseq 425545 len 1428 csum 0x54e8], length 1428
10:42:39.975792 IP 112.26.3.8.42387 > 112.26.3.1.44877: Flags [.], ack 421261, win 24429, options [nop,nop,TS val 48763 ecr 261161,mptcp dss ack 445734872], length 0
10:42:39.976140 IP 112.26.3.8.42387 > 112.26.3.1.44877: Flags [.], ack 421261, win 24429, options [nop,nop,TS val 48763 ecr 261161,mptcp dss ack 445734872], length 0
10:42:40.041789 IP 112.26.3.1.44877 > 112.26.3.8.42387: Flags [.], seq 426973:428401, ack 1, win 4017, options [nop,nop,TS val 261804 ecr 48096,mptcp dss ack 3454339951 seq 445766288 subseq 426973 len 1428 csum 0x658a], length 1428
10:42:40.042081 IP 112.26.3.1.44877 > 112.26.3.8.42387: Flags [.], seq 426973:428401, ack 1, win 4017, options [nop,nop,TS val 261804 ecr 48096,mptcp dss ack 3454339951 seq 445766288 subseq 426973 len 1428 csum 0x658a], length 1428
10:42:40.065359 IP 112.26.3.8.42387 > 112.26.3.1.44877: Flags [.], ack 415549, win 24311, options [nop,nop,TS val 48508 ecr 260916,mptcp dss ack 445659188], length 0
10:42:40.149728 IP 112.26.3.1.44877 > 112.26.3.8.42387: Flags [.], seq 428401:429829, ack 1, win 4017, options [nop,nop,TS val 261804 ecr 48096,mptcp dss ack 3454339951 seq 445767716 subseq 428401 len 1428 csum 0x7aac], length 1428
10:42:40.150049 IP 112.26.3.1.44877 > 112.26.3.8.42387: Flags [.], seq 428401:429829, ack 1, win 4017, options [nop,nop,TS val 261804 ecr 48096,mptcp dss ack 3454339951 seq 445767716 subseq 428401 len 1428 csum 0x7aac], length 1428
10:42:40.261102 IP 112.26.3.1.44877 > 112.26.3.8.42387: Flags [.], seq 429829:431257, ack 1, win 4017, options [nop,nop,TS val 262203 ecr 48508,mptcp dss ack 3454339951 seq 445787708 subseq 429829 len 1428 csum 0xdfd0], length 1428
10:42:40.261432 IP 112.26.3.1.44877 > 112.26.3.8.42387: Flags [.], seq 429829:431257, ack 1, win 4017, options [nop,nop,TS val 262203 ecr 48508,mptcp dss ack 3454339951 seq 445787708 subseq 429829 len 1428 csum 0xdfd0], length 1428
10:42:40.333557 IP 112.26.3.8.42387 > 112.26.3.1.44877: Flags [.], ack 424117, win 24429, options [nop,nop,TS val 49104 ecr 261461,mptcp dss ack 445734872], length 0
10:42:40.333872 IP 112.26.3.8.42387 > 112.26.3.1.44877: Flags [.], ack 424117, win 24429, options [nop,nop,TS val 49104 ecr 261461,mptcp dss ack 445734872], length 0
10:42:40.348615 IP 112.26.3.8.42387 > 112.26.3.1.44877: Flags [.], ack 418405, win 23613, options [nop,nop,TS val 48655 ecr 261161,mptcp dss ack 445734872], length 0
10:42:40.384748 IP 112.26.3.1.44877 > 112.26.3.8.42387: Flags [.], seq 431257:432685, ack 1, win 4017, options [nop,nop,TS val 262203 ecr 48508,mptcp dss ack 3454339951 seq 445789136 subseq 431257 len 1428 csum 0xa12d], length 1428
10:42:40.385054 IP 112.26.3.1.44877 > 112.26.3.8.42387: Flags [.], seq 431257:432685, ack 1, win 4017, options [nop,nop,TS val 262203 ecr 48508,mptcp dss ack 3454339951 seq 445789136 subseq 431257 len 1428 csum 0xa12d], length 1428
10:42:40.470080 IP 112.26.3.1.44877 > 112.26.3.8.42387: Flags [.], seq 432685:434113, ack 1, win 4017, options [nop,nop,TS val 262203 ecr 48508,mptcp dss ack 3454339951 seq 445790564 subseq 432685 len 1428 csum 0x2a3d], length 1428
10:42:40.470431 IP 112.26.3.1.44877 > 112.26.3.8.42387: Flags [.], seq 432685:434113, ack 1, win 4017, options [nop,nop,TS val 262203 ecr 48508,mptcp dss ack 3454339951 seq 445790564 subseq 432685 len 1428 csum 0x2a3d], length 1428
10:42:40.565126 IP 112.26.3.1.44877 > 112.26.3.8.42387: Flags [.], seq 434113:435541, ack 1, win 4017, options [nop,nop,TS val 262203 ecr 48508,mptcp dss ack 3454339951 seq 445791992 subseq 434113 len 1428 csum 0x2b6c], length 1428
10:42:40.565437 IP 112.26.3.1.44877 > 112.26.3.8.42387: Flags [.], seq 434113:435541, ack 1, win 4017, options [nop,nop,TS val 262203 ecr 48508,mptcp dss ack 3454339951 seq 445791992 subseq 434113 len 1428 csum 0x2b6c], length 1428
10:42:40.609796 IP 112.26.3.8.42387 > 112.26.3.1.44877: Flags [.], ack 421261, win 24429, options [nop,nop,TS val 48763 ecr 261161,mptcp dss ack 445734872], length 0
10:42:40.643388 IP 112.26.3.1.44877 > 112.26.3.8.42387: Flags [.], seq 435541:436969, ack 1, win 4017, options [nop,nop,TS val 262203 ecr 48508,mptcp dss ack 3454339951 seq 445793420 subseq 435541 len 1428 csum 0xdc5b], length 1428
10:42:40.643727 IP 112.26.3.1.44877 > 112.26.3.8.42387: Flags [.], seq 435541:436969, ack 1, win 4017, options [nop,nop,TS val 262203 ecr 48508,mptcp dss ack 3454339951 seq 445793420 subseq 435541 len 1428 csum 0xdc5b], length 1428
10:42:40.680533 IP 112.26.3.8.42387 > 112.26.3.1.44877: Flags [.], ack 428401, win 24429, options [nop,nop,TS val 49467 ecr 261461,mptcp dss ack 445734872], length 0
10:42:40.680840 IP 112.26.3.8.42387 > 112.26.3.1.44877: Flags [.], ack 428401, win 24429, options [nop,nop,TS val 49467 ecr 261461,mptcp dss ack 445734872], length 0
10:42:40.720722 IP 112.26.3.1.44877 > 112.26.3.8.42387: Flags [.], seq 436969:438397, ack 1, win 4017, options [nop,nop,TS val 262203 ecr 48508,mptcp dss ack 3454339951 seq 445794848 subseq 436969 len 1428 csum 0xf232], length 1428
10:42:40.721011 IP 112.26.3.1.44877 > 112.26.3.8.42387: Flags [.], seq 436969:438397, ack 1, win 4017, options [nop,nop,TS val 262203 ecr 48508,mptcp dss ack 3454339951 seq 445794848 subseq 436969 len 1428 csum 0xf232], length 1428
10:42:40.800687 IP 112.26.3.1.44877 > 112.26.3.8.42387: Flags [.], seq 438397:439825, ack 1, win 4017, options [nop,nop,TS val 262458 ecr 48655,mptcp dss ack 3454339951 seq 445807700 subseq 438397 len 1428 csum 0x2974], length 1428
10:42:40.800957 IP 112.26.3.1.44877 > 112.26.3.8.42387: Flags [.], seq 438397:439825, ack 1, win 4017, options [nop,nop,TS val 262458 ecr 48655,mptcp dss ack 3454339951 seq 445807700 subseq 438397 len 1428 csum 0x2974], length 1428
10:42:40.848537 IP 112.26.3.1.44877 > 112.26.3.8.42387: Flags [.], seq 439825:441253, ack 1, win 4017, options [nop,nop,TS val 262458 ecr 48655,mptcp dss ack 3454339951 seq 445809128 subseq 439825 len 1428 csum 0xe62d], length 1428
10:42:40.848837 IP 112.26.3.1.44877 > 112.26.3.8.42387: Flags [.], seq 439825:441253, ack 1, win 4017, options [nop,nop,TS val 262458 ecr 48655,mptcp dss ack 3454339951 seq 445809128 subseq 439825 len 1428 csum 0xe62d], length 1428
10:42:40.913526 IP 112.26.3.8.42387 > 112.26.3.1.44877: Flags [.], ack 424117, win 24429, options [nop,nop,TS val 49104 ecr 261461,mptcp dss ack 445734872], length 0
10:42:40.940417 IP 112.26.3.8.42387 > 112.26.3.1.44877: Flags [.], ack 431257, win 24429, options [nop,nop,TS val 49728 ecr 261804,mptcp dss ack 445734872], length 0
10:42:40.940720 IP 112.26.3.8.42387 > 112.26.3.1.44877: Flags [.], ack 431257, win 24429, options [nop,nop,TS val 49728 ecr 261804,mptcp dss ack 445734872], length 0
10:42:40.960785 IP 112.26.3.1.44877 > 112.26.3.8.42387: Flags [.], seq 441253:442681, ack 1, win 4017, options [nop,nop,TS val 262458 ecr 48655,mptcp dss ack 3454339951 seq 445810556 subseq 441253 len 1428 csum 0xdef6], length 1428
10:42:40.961079 IP 112.26.3.1.44877 > 112.26.3.8.42387: Flags [.], seq 441253:442681, ack 1, win 4017, options [nop,nop,TS val 262458 ecr 48655,mptcp dss ack 3454339951 seq 445810556 subseq 441253 len 1428 csum 0xdef6], length 1428
10:42:41.071819 IP 112.26.3.1.44877 > 112.26.3.8.42387: Flags [.], seq 442681:444109, ack 1, win 4017, options [nop,nop,TS val 262748 ecr 48763,mptcp dss ack 3454339951 seq 445813412 subseq 442681 len 1428 csum 0x4d6], length 1428
10:42:41.072152 IP 112.26.3.1.44877 > 112.26.3.8.42387: Flags [.], seq 442681:444109, ack 1, win 4017, options [nop,nop,TS val 262748 ecr 48763,mptcp dss ack 3454339951 seq 445813412 subseq 442681 len 1428 csum 0x4d6], length 1428
10:42:41.170384 IP 112.26.3.1.44877 > 112.26.3.8.42387: Flags [.], seq 444109:445537, ack 1, win 4017, options [nop,nop,TS val 262748 ecr 48763,mptcp dss ack 3454339951 seq 445814840 subseq 444109 len 1428 csum 0x5523], length 1428
10:42:41.170733 IP 112.26.3.1.44877 > 112.26.3.8.42387: Flags [.], seq 444109:445537, ack 1, win 4017, options [nop,nop,TS val 262748 ecr 48763,mptcp dss ack 3454339951 seq 445814840 subseq 444109 len 1428 csum 0x5523], length 1428
10:42:41.223166 IP 112.26.3.1.44877 > 112.26.3.8.42387: Flags [.], seq 445537:446965, ack 1, win 4017, options [nop,nop,TS val 262748 ecr 48763,mptcp dss ack 3454339951 seq 445816268 subseq 445537 len 1428 csum 0x3a18], length 1428
10:42:41.223504 IP 112.26.3.1.44877 > 112.26.3.8.42387: Flags [.], seq 445537:446965, ack 1, win 4017, options [nop,nop,TS val 262748 ecr 48763,mptcp dss ack 3454339951 seq 445816268 subseq 445537 len 1428 csum 0x3a18], length 1428
10:42:41.252569 IP 112.26.3.8.42387 > 112.26.3.1.44877: Flags [.], ack 436969, win 24429, options [nop,nop,TS val 50040 ecr 262203,mptcp dss ack 445734872], length 0
10:42:41.252908 IP 112.26.3.8.42387 > 112.26.3.1.44877: Flags [.], ack 436969, win 24429, options [nop,nop,TS val 50040 ecr 262203,mptcp dss ack 445734872], length 0
10:42:41.270892 IP 112.26.3.8.42387 > 112.26.3.1.44877: Flags [.], ack 428401, win 24429, options [nop,nop,TS val 49467 ecr 261461,mptcp dss ack 445734872], length 0
10:42:41.306630 IP 112.26.3.1.44877 > 112.26.3.8.42387: Flags [.], seq 446965:448393, ack 1, win 4017, options [nop,nop,TS val 263052 ecr 49104,mptcp dss ack 3454339951 seq 445834832 subseq 446965 len 1428 csum 0x7016], length 1428
10:42:41.306882 IP 112.26.3.1.44877 > 112.26.3.8.42387: Flags [.], seq 446965:448393, ack 1, win 4017, options [nop,nop,TS val 263052 ecr 49104,mptcp dss ack 3454339951 seq 445834832 subseq 446965 len 1428 csum 0x7016], length 1428
10:42:41.436604 IP 112.26.3.1.44877 > 112.26.3.8.42387: Flags [.], seq 448393:449821, ack 1, win 4017, options [nop,nop,TS val 263052 ecr 49104,mptcp dss ack 3454339951 seq 445836260 subseq 448393 len 1428 csum 0xc0a0], length 1428
10:42:41.436827 IP 112.26.3.1.44877 > 112.26.3.8.42387: Flags [.], seq 448393:449821, ack 1, win 4017, options [nop,nop,TS val 263052 ecr 49104,mptcp dss ack 3454339951 seq 445836260 subseq 448393 len 1428 csum 0xc0a0], length 1428
10:42:41.507368 IP 112.26.3.8.42387 > 112.26.3.1.44877: Flags [.], ack 431257, win 24429, options [nop,nop,TS val 49728 ecr 261804,mptcp dss ack 445734872], length 0
10:42:41.538489 IP 112.26.3.1.44877 > 112.26.3.8.42387: Flags [.], seq 449821:451249, ack 1, win 4017, options [nop,nop,TS val 263404 ecr 49467,mptcp dss ack 3454339951 seq 445849112 subseq 449821 len 1428 csum 0x7f45], length 1428
10:42:41.538873 IP 112.26.3.1.44877 > 112.26.3.8.42387: Flags [.], seq 449821:451249, ack 1, win 4017, options [nop,nop,TS val 263404 ecr 49467,mptcp dss ack 3454339951 seq 445849112 subseq 449821 len 1428 csum 0x7f45], length 1428
10:42:41.578110 IP 112.26.3.8.42387 > 112.26.3.1.44877: Flags [.], ack 442681, win 24429, options [nop,nop,TS val 50364 ecr 262203,mptcp dss ack 445734872], length 0
10:42:41.578437 IP 112.26.3.8.42387 > 112.26.3.1.44877: Flags [.], ack 442681, win 24429, options [nop,nop,TS val 50364 ecr 262203,mptcp dss ack 445734872], length 0
10:42:41.643836 IP 112.26.3.1.44877 > 112.26.3.8.42387: Flags [.], seq 451249:452677, ack 1, win 4017, options [nop,nop,TS val 263404 ecr 49467,mptcp dss ack 3454339951 seq 445850540 subseq 451249 len 1428 csum 0x6e3a], length 1428
10:42:41.644163 IP 112.26.3.1.44877 > 112.26.3.8.42387: Flags [.], seq 451249:452677, ack 1, win 4017, options [nop,nop,TS val 263404 ecr 49467,mptcp dss ack 3454339951 seq 445850540 subseq 451249 len 1428 csum 0x6e3a], length 1428
10:42:41.709600 IP 112.26.3.1.44877 > 112.26.3.8.42387: Flags [.], seq 452677:454105, ack 1, win 4017, options [nop,nop,TS val 263404 ecr 49467,mptcp dss ack 3454339951 seq 445851968 subseq 452677 len 1428 csum 0xdb7a], length 1428
10:42:41.709938 IP 112.26.3.1.44877 > 112.26.3.8.42387: Flags [.], seq 452677:454105, ack 1, win 4017, options [nop,nop,TS val 263404 ecr 49467,mptcp dss ack 3454339951 seq 445851968 subseq 452677 len 1428 csum 0xdb7a], length 1428
10:42:41.803303 IP 112.26.3.1.44877 > 112.26.3.8.42387: Flags [.], seq 454105:455533, ack 1, win 4017, options [nop,nop,TS val 263404 ecr 49467,mptcp dss ack 3454339951 seq 445853396 subseq 454105 len 1428 csum 0xa96e], length 1428
10:42:41.803662 IP 112.26.3.1.44877 > 112.26.3.8.42387: Flags [.], seq 454105:455533, ack 1, win 4017, options [nop,nop,TS val 263404 ecr 49467,mptcp dss ack 3454339951 seq 445853396 subseq 454105 len 1428 csum 0xa96e], length 1428
10:42:41.853307 IP 112.26.3.1.44877 > 112.26.3.8.42387: Flags [.], seq 455533:456961, ack 1, win 4017, options [nop,nop,TS val 263646 ecr 49728,mptcp dss ack 3454339951 seq 445856252 subseq 455533 len 1428 csum 0xeb4d], length 1428
10:42:41.853601 IP 112.26.3.1.44877 > 112.26.3.8.42387: Flags [.], seq 455533:456961, ack 1, win 4017, options [nop,nop,TS val 263646 ecr 49728,mptcp dss ack 3454339951 seq 445856252 subseq 455533 len 1428 csum 0xeb4d], length 1428
10:42:41.865374 IP 112.26.3.8.42387 > 112.26.3.1.44877: Flags [.], ack 446965, win 23849, options [nop,nop,TS val 50653 ecr 262748,mptcp dss ack 445772000], length 0
10:42:41.865662 IP 112.26.3.8.42387 > 112.26.3.1.44877: Flags [.], ack 446965, win 23849, options [nop,nop,TS val 50653 ecr 262748,mptcp dss ack 445772000], length 0
10:42:41.901513 IP 112.26.3.1.44877 > 112.26.3.8.42387: Flags [.], seq 456961:458389, ack 1, win 4017, options [nop,nop,TS val 263646 ecr 49728,mptcp dss ack 3454339951 seq 445857680 subseq 456961 len 1428 csum 0xe72], length 1428
10:42:41.901850 IP 112.26.3.1.44877 > 112.26.3.8.42387: Flags [.], seq 456961:458389, ack 1, win 4017, options [nop,nop,TS val 263646 ecr 49728,mptcp dss ack 3454339951 seq 445857680 subseq 456961 len 1428 csum 0xe72], length 1428
10:42:41.924481 IP 112.26.3.8.42387 > 112.26.3.1.44877: Flags [.], ack 436969, win 24429, options [nop,nop,TS val 50040 ecr 262203,mptcp dss ack 445734872], length 0
10:42:41.975157 IP 112.26.3.1.44877 > 112.26.3.8.42387: Flags [.], seq 458389:459817, ack 1, win 4017, options [nop,nop,TS val 263646 ecr 49728,mptcp dss ack 3454339951 seq 445859108 subseq 458389 len 1428 csum 0xa0cf], length 1428
10:42:41.975528 IP 112.26.3.1.44877 > 112.26.3.8.42387: Flags [.], seq 458389:459817, ack 1, win 4017, options [nop,nop,TS val 263646 ecr 49728,mptcp dss ack 3454339951 seq 445859108 subseq 458389 len 1428 csum 0xa0cf], length 1428
10:42:42.043222 IP 112.26.3.8.42387 > 112.26.3.1.44877: Flags [.], ack 449821, win 23955, options [nop,nop,TS val 50830 ecr 263052,mptcp dss ack 445772000], length 0
10:42:42.043535 IP 112.26.3.8.42387 > 112.26.3.1.44877: Flags [.], ack 449821, win 23955, options [nop,nop,TS val 50830 ecr 263052,mptcp dss ack 445772000], length 0
10:42:42.066492 IP 112.26.3.1.44877 > 112.26.3.8.42387: Flags [.], seq 459817:461245, ack 1, win 4017, options [nop,nop,TS val 264063 ecr 50040,mptcp dss ack 3454339951 seq 445863392 subseq 459817 len 1428 csum 0xf7d6], length 1428
10:42:42.066845 IP 112.26.3.1.44877 > 112.26.3.8.42387: Flags [.], seq 459817:461245, ack 1, win 4017, options [nop,nop,TS val 264063 ecr 50040,mptcp dss ack 3454339951 seq 445863392 subseq 459817 len 1428 csum 0xf7d6], length 1428
10:42:42.152061 IP 112.26.3.1.44877 > 112.26.3.8.42387: Flags [.], seq 461245:462673, ack 1, win 4017, options [nop,nop,TS val 264063 ecr 50040,mptcp dss ack 3454339951 seq 445864820 subseq 461245 len 1428 csum 0x6e3f], length 1428
10:42:42.152405 IP 112.26.3.1.44877 > 112.26.3.8.42387: Flags [.], seq 461245:462673, ack 1, win 4017, options [nop,nop,TS val 264063 ecr 50040,mptcp dss ack 3454339951 seq 445864820 subseq 461245 len 1428 csum 0x6e3f], length 1428
10:42:42.162477 IP 112.26.3.8.42387 > 112.26.3.1.44877: Flags [.], ack 442681, win 24429, options [nop,nop,TS val 50364 ecr 262203,mptcp dss ack 445734872], length 0
10:42:42.200016 IP 112.26.3.8.42387 > 112.26.3.1.44877: Flags [.], ack 452677, win 23955, options [nop,nop,TS val 50986 ecr 263404,mptcp dss ack 445772000], length 0
10:42:42.200299 IP 112.26.3.8.42387 > 112.26.3.1.44877: Flags [.], ack 452677, win 23955, options [nop,nop,TS val 50986 ecr 263404,mptcp dss ack 445772000], length 0
10:42:42.264122 IP 112.26.3.1.44877 > 112.26.3.8.42387: Flags [.], seq 462673:464101, ack 1, win 4017, options [nop,nop,TS val 264063 ecr 50040,mptcp dss ack 3454339951 seq 445866248 subseq 462673 len 1428 csum 0xe148], length 1428
10:42:42.264363 IP 112.26.3.1.44877 > 112.26.3.8.42387: Flags [.], seq 462673:464101, ack 1, win 4017, options [nop,nop,TS val 264063 ecr 50040,mptcp dss ack 3454339951 seq 445866248 subseq 462673 len 1428 csum 0xe148], length 1428
10:42:42.375440 IP 112.26.3.1.44877 > 112.26.3.8.42387: Flags [.], seq 464101:465529, ack 1, win 4017, options [nop,nop,TS val 264063 ecr 50040,mptcp dss ack 3454339951 seq 445867676 subseq 464101 len 1428 csum 0xddbb], length 1428
10:42:42.375789 IP 112.26.3.1.44877 > 112.26.3.8.42387: Flags [.], seq 464101:465529, ack 1, win 4017, options [nop,nop,TS val 264063 ecr 50040,mptcp dss ack 3454339951 seq 445867676 subseq 464101 len 1428 csum 0xddbb], length 1428
10:42:42.458199 IP 112.26.3.8.42387 > 112.26.3.1.44877: Flags [.], ack 446965, win 23849, options [nop,nop,TS val 50653 ecr 262748,mptcp dss ack 445772000], length 0
10:42:42.464895 IP 112.26.3.8.42387 > 112.26.3.1.44877: Flags [.], ack 456961, win 23955, options [nop,nop,TS val 51248 ecr 263404,mptcp dss ack 445772000], length 0
10:42:42.465219 IP 112.26.3.8.42387 > 112.26.3.1.44877: Flags [.], ack 456961, win 23955, options [nop,nop,TS val 51248 ecr 263404,mptcp dss ack 445772000], length 0
10:42:42.496252 IP 112.26.3.1.44877 > 112.26.3.8.42387: Flags [.], seq 465529:466957, ack 1, win 4017, options [nop,nop,TS val 264063 ecr 50040,mptcp dss ack 3454339951 seq 445869104 subseq 465529 len 1428 csum 0x59e8], length 1428
10:42:42.496640 IP 112.26.3.1.44877 > 112.26.3.8.42387: Flags [.], seq 465529:466957, ack 1, win 4017, options [nop,nop,TS val 264063 ecr 50040,mptcp dss ack 3454339951 seq 445869104 subseq 465529 len 1428 csum 0x59e8], length 1428
10:42:42.560921 IP 112.26.3.1.44877 > 112.26.3.8.42387: Flags [.], seq 466957:468385, ack 1, win 4017, options [nop,nop,TS val 264063 ecr 50040,mptcp dss ack 3454339951 seq 445870532 subseq 466957 len 1428 csum 0xe5c4], length 1428
10:42:42.561299 IP 112.26.3.1.44877 > 112.26.3.8.42387: Flags [.], seq 466957:468385, ack 1, win 4017, options [nop,nop,TS val 264063 ecr 50040,mptcp dss ack 3454339951 seq 445870532 subseq 466957 len 1428 csum 0xe5c4], length 1428
10:42:42.595254 IP 112.26.3.8.42387 > 112.26.3.1.44877: Flags [.], ack 459817, win 24050, options [nop,nop,TS val 51382 ecr 263646,mptcp dss ack 445801988], length 0
10:42:42.595587 IP 112.26.3.8.42387 > 112.26.3.1.44877: Flags [.], ack 459817, win 24050, options [nop,nop,TS val 51382 ecr 263646,mptcp dss ack 445801988], length 0
10:42:42.647783 IP 112.26.3.8.42387 > 112.26.3.1.44877: Flags [.], ack 449821, win 23955, options [nop,nop,TS val 50830 ecr 263052,mptcp dss ack 445772000], length 0
10:42:42.665738 IP 112.26.3.1.44877 > 112.26.3.8.42387: Flags [.], seq 468385:469813, ack 1, win 4017, options [nop,nop,TS val 264300 ecr 50364,mptcp dss ack 3454339951 seq 445893380 subseq 468385 len 1428 csum 0x8463], length 1428
10:42:42.666061 IP 112.26.3.1.44877 > 112.26.3.8.42387: Flags [.], seq 468385:469813, ack 1, win 4017, options [nop,nop,TS val 264300 ecr 50364,mptcp dss ack 3454339951 seq 445893380 subseq 468385 len 1428 csum 0x8463], length 1428
10:42:42.750858 IP 112.26.3.8.42387 > 112.26.3.1.44877: Flags [.], ack 462673, win 24378, options [nop,nop,TS val 51538 ecr 264063,mptcp dss ack 445846256], length 0
10:42:42.751165 IP 112.26.3.8.42387 > 112.26.3.1.44877: Flags [.], ack 462673, win 24378, options [nop,nop,TS val 51538 ecr 264063,mptcp dss ack 445846256], length 0
10:42:42.799623 IP 112.26.3.1.44877 > 112.26.3.8.42387: Flags [.], seq 469813:471241, ack 1, win 4017, options [nop,nop,TS val 264300 ecr 50364,mptcp dss ack 3454339951 seq 445894808 subseq 469813 len 1428 csum 0x77ad], length 1428
10:42:42.799961 IP 112.26.3.1.44877 > 112.26.3.8.42387: Flags [.], seq 469813:471241, ack 1, win 4017, options [nop,nop,TS val 264300 ecr 50364,mptcp dss ack 3454339951 seq 445894808 subseq 469813 len 1428 csum 0x77ad], length 1428
10:42:42.848175 IP 112.26.3.8.42387 > 112.26.3.1.44877: Flags [.], ack 452677, win 23955, options [nop,nop,TS val 50986 ecr 263404,mptcp dss ack 445772000], length 0
10:42:42.895057 IP 112.26.3.1.44877 > 112.26.3.8.42387: Flags [.], seq 471241:472669, ack 1, win 4017, options [nop,nop,TS val 264300 ecr 50364,mptcp dss ack 3454339951 seq 445896236 subseq 471241 len 1428 csum 0x2b31], length 1428
10:42:42.895421 IP 112.26.3.1.44877 > 112.26.3.8.42387: Flags [.], seq 471241:472669, ack 1, win 4017, options [nop,nop,TS val 264300 ecr 50364,mptcp dss ack 3454339951 seq 445896236 subseq 471241 len 1428 csum 0x2b31], length 1428
10:42:43.011876 IP 112.26.3.1.44877 > 112.26.3.8.42387: Flags [P.], seq 472669:474097, ack 1, win 4017, options [nop,nop,TS val 264300 ecr 50364,mptcp dss ack 3454339951 seq 445897664 subseq 472669 len 1428 csum 0xe3bf], length 1428
10:42:43.012193 IP 112.26.3.1.44877 > 112.26.3.8.42387: Flags [P.], seq 472669:474097, ack 1, win 4017, options [nop,nop,TS val 264300 ecr 50364,mptcp dss ack 3454339951 seq 445897664 subseq 472669 len 1428 csum 0xe3bf], length 1428
10:42:43.060256 IP 112.26.3.8.42387 > 112.26.3.1.44877: Flags [.], ack 465529, win 24378, options [nop,nop,TS val 51848 ecr 264063,mptcp dss ack 445846256], length 0
10:42:43.060601 IP 112.26.3.8.42387 > 112.26.3.1.44877: Flags [.], ack 465529, win 24378, options [nop,nop,TS val 51848 ecr 264063,mptcp dss ack 445846256], length 0
10:42:43.070549 IP 112.26.3.8.42387 > 112.26.3.1.44877: Flags [.], ack 456961, win 23955, options [nop,nop,TS val 51248 ecr 263404,mptcp dss ack 445772000], length 0
10:42:43.100755 IP 112.26.3.1.44877 > 112.26.3.8.42387: Flags [.], seq 474097:475525, ack 1, win 4017, options [nop,nop,TS val 264300 ecr 50364,mptcp dss ack 3454339951 seq 445899092 subseq 474097 len 1428 csum 0x7eaa], length 1428
10:42:43.101052 IP 112.26.3.1.44877 > 112.26.3.8.42387: Flags [.], seq 474097:475525, ack 1, win 4017, options [nop,nop,TS val 264300 ecr 50364,mptcp dss ack 3454339951 seq 445899092 subseq 474097 len 1428 csum 0x7eaa], length 1428
10:42:43.218879 IP 112.26.3.1.44877 > 112.26.3.8.42387: Flags [.], seq 475525:476953, ack 1, win 4017, options [nop,nop,TS val 264300 ecr 50364,mptcp dss ack 3454339951 seq 445900520 subseq 475525 len 1428 csum 0xbbdd], length 1428
10:42:43.219145 IP 112.26.3.1.44877 > 112.26.3.8.42387: Flags [.], seq 475525:476953, ack 1, win 4017, options [nop,nop,TS val 264300 ecr 50364,mptcp dss ack 3454339951 seq 445900520 subseq 475525 len 1428 csum 0xbbdd], length 1428
10:42:43.307735 IP 112.26.3.8.42387 > 112.26.3.1.44877: Flags [.], ack 459817, win 24050, options [nop,nop,TS val 51382 ecr 263646,mptcp dss ack 445801988], length 0
10:42:43.313707 IP 112.26.3.8.42387 > 112.26.3.1.44877: Flags [.], ack 468385, win 24245, options [nop,nop,TS val 52100 ecr 264063,mptcp dss ack 445854824], length 0
10:42:43.314040 IP 112.26.3.8.42387 > 112.26.3.1.44877: Flags [.], ack 468385, win 24245, options [nop,nop,TS val 52100 ecr 264063,mptcp dss ack 445854824], length 0
10:42:43.328439 IP 112.26.3.1.44877 > 112.26.3.8.42387: Flags [.], seq 476953:478381, ack 1, win 4017, options [nop,nop,TS val 264597 ecr 50653,mptcp dss ack 3454339951 seq 445919084 subseq 476953 len 1428 csum 0xa380], length 1428
10:42:43.328727 IP 112.26.3.1.44877 > 112.26.3.8.42387: Flags [.], seq 476953:478381, ack 1, win 4017, options [nop,nop,TS val 264597 ecr 50653,mptcp dss ack 3454339951 seq 445919084 subseq 476953 len 1428 csum 0xa380], length 1428
10:42:43.393318 IP 112.26.3.1.44877 > 112.26.3.8.42387: Flags [.], seq 478381:479809, ack 1, win 4017, options [nop,nop,TS val 264597 ecr 50653,mptcp dss ack 3454339951 seq 445920512 subseq 478381 len 1428 csum 0x2530], length 1428
10:42:43.393679 IP 112.26.3.1.44877 > 112.26.3.8.42387: Flags [.], seq 478381:479809, ack 1, win 4017, options [nop,nop,TS val 264597 ecr 50653,mptcp dss ack 3454339951 seq 445920512 subseq 478381 len 1428 csum 0x2530], length 1428
10:42:43.436496 IP 112.26.3.8.42387 > 112.26.3.1.44877: Flags [.], ack 462673, win 24378, options [nop,nop,TS val 51538 ecr 264063,mptcp dss ack 445846256], length 0
10:42:43.479224 IP 112.26.3.1.44877 > 112.26.3.8.42387: Flags [.], seq 479809:481237, ack 1, win 4017, options [nop,nop,TS val 264597 ecr 50653,mptcp dss ack 3454339951 seq 445921940 subseq 479809 len 1428 csum 0x63e7], length 1428
10:42:43.479604 IP 112.26.3.1.44877 > 112.26.3.8.42387: Flags [.], seq 479809:481237, ack 1, win 4017, options [nop,nop,TS val 264597 ecr 50653,mptcp dss ack 3454339951 seq 445921940 subseq 479809 len 1428 csum 0x63e7], length 1428
10:42:43.490607 IP 112.26.3.8.42387 > 112.26.3.1.44877: Flags [.], ack 468385, win 24391, options [nop,nop,TS val 52276 ecr 264063,nop,nop,sack 1 {469813:471241},mptcp dss ack 445893380], length 0
10:42:43.490882 IP 112.26.3.8.42387 > 112.26.3.1.44877: Flags [.], ack 468385, win 24391, options [nop,nop,TS val 52276 ecr 264063,nop,nop,sack 1 {469813:471241},mptcp dss ack 445893380], length 0
10:42:43.548778 IP 112.26.3.8.42387 > 112.26.3.1.44877: Flags [.], ack 468385, win 24391, options [nop,nop,TS val 52336 ecr 264063,nop,nop,sack 1 {469813:472669},mptcp dss ack 445893380], length 0
10:42:43.549044 IP 112.26.3.8.42387 > 112.26.3.1.44877: Flags [.], ack 468385, win 24391, options [nop,nop,TS val 52336 ecr 264063,nop,nop,sack 1 {469813:472669},mptcp dss ack 445893380], length 0
10:42:43.601040 IP 112.26.3.1.44877 > 112.26.3.8.42387: Flags [.], seq 481237:482665, ack 1, win 4017, options [nop,nop,TS val 264597 ecr 50653,mptcp dss ack 3454339951 seq 445923368 subseq 481237 len 1428 csum 0x880], length 1428
10:42:43.601373 IP 112.26.3.1.44877 > 112.26.3.8.42387: Flags [.], seq 481237:482665, ack 1, win 4017, options [nop,nop,TS val 264597 ecr 50653,mptcp dss ack 3454339951 seq 445923368 subseq 481237 len 1428 csum 0x880], length 1428
10:42:43.631128 IP 112.26.3.8.42387 > 112.26.3.1.44877: Flags [.], ack 468385, win 24391, options [nop,nop,TS val 52418 ecr 264063,nop,nop,sack 1 {469813:474097},mptcp dss ack 445893380], length 0
10:42:43.631434 IP 112.26.3.8.42387 > 112.26.3.1.44877: Flags [.], ack 468385, win 24391, options [nop,nop,TS val 52418 ecr 264063,nop,nop,sack 1 {469813:474097},mptcp dss ack 445893380], length 0
10:42:43.659322 IP 112.26.3.1.44877 > 112.26.3.8.42387: Flags [.], seq 482665:484093, ack 1, win 4017, options [nop,nop,TS val 264597 ecr 50653,mptcp dss ack 3454339951 seq 445924796 subseq 482665 len 1428 csum 0x4c42], length 1428
10:42:43.659598 IP 112.26.3.1.44877 > 112.26.3.8.42387: Flags [.], seq 482665:484093, ack 1, win 4017, options [nop,nop,TS val 264597 ecr 50653,mptcp dss ack 3454339951 seq 445924796 subseq 482665 len 1428 csum 0x4c42], length 1428
10:42:43.721089 IP 112.26.3.1.44877 > 112.26.3.8.42387: Flags [.], seq 484093:485521, ack 1, win 4017, options [nop,nop,TS val 264786 ecr 50830,mptcp dss ack 3454339951 seq 445927652 subseq 484093 len 1428 csum 0x7b8], length 1428
10:42:43.721420 IP 112.26.3.1.44877 > 112.26.3.8.42387: Flags [.], seq 484093:485521, ack 1, win 4017, options [nop,nop,TS val 264786 ecr 50830,mptcp dss ack 3454339951 seq 445927652 subseq 484093 len 1428 csum 0x7b8], length 1428
10:42:43.739269 IP 112.26.3.8.42387 > 112.26.3.1.44877: Flags [.], ack 465529, win 24378, options [nop,nop,TS val 51848 ecr 264063,mptcp dss ack 445846256], length 0
10:42:43.763033 IP 112.26.3.8.42387 > 112.26.3.1.44877: Flags [.], ack 468385, win 24391, options [nop,nop,TS val 52549 ecr 264063,nop,nop,sack 1 {469813:475525},mptcp dss ack 445893380], length 0
10:42:43.763337 IP 112.26.3.8.42387 > 112.26.3.1.44877: Flags [.], ack 468385, win 24391, options [nop,nop,TS val 52549 ecr 264063,nop,nop,sack 1 {469813:475525},mptcp dss ack 445893380], length 0
10:42:43.833582 IP 112.26.3.8.42387 > 112.26.3.1.44877: Flags [.], ack 468385, win 24391, options [nop,nop,TS val 52587 ecr 264063,nop,nop,sack 1 {469813:476953},mptcp dss ack 445893380], length 0
10:42:43.833900 IP 112.26.3.8.42387 > 112.26.3.1.44877: Flags [.], ack 468385, win 24391, options [nop,nop,TS val 52587 ecr 264063,nop,nop,sack 1 {469813:476953},mptcp dss ack 445893380], length 0
