10:42:02.477764 IP 112.26.3.8.42387 > 112.26.3.1.44877: Flags [S], seq 3404096348, win 65535, options [mss 1460,sackOK,TS val 11180 ecr 0,nop,wscale 6,mptcp join id 6 token 0x187b1b60 nonce 0x63255531], length 0
10:42:02.527835 IP 112.26.3.8.42387 > 112.26.3.1.44877: Flags [S], seq 3404096348, win 65535, options [mss 1460,sackOK,TS val 11180 ecr 0,nop,wscale 6,mptcp join id 6 token 0x187b1b60 nonce 0x63255531], length 0
10:42:02.563652 IP 112.26.3.1.44877 > 112.26.3.8.42387: Flags [S.], seq 3834564252, ack 3404096349, win 65535, options [mss 1460,sackOK,TS val 224668 ecr 11180,nop,wscale 6,mptcp join id 5 hmac 0xcb2ba0bbb54b93af nonce 0x6a8a083b], length 0
10:42:02.679445 IP 112.26.3.1.44877 > 112.26.3.8.42387: Flags [S.], seq 3834564252, ack 3404096349, win 65535, options [mss 1460,sackOK,TS val 224668 ecr 11180,nop,wscale 6,mptcp join id 5 hmac 0xcb2ba0bbb54b93af nonce 0x6a8a083b], length 0
10:42:02.719334 IP 112.26.3.1.44877 > 112.26.3.8.42387: Flags [S.], seq 3834564252, ack 3404096349, win 65535, options [mss 1460,sackOK,TS val 224668 ecr 11180,nop,wscale 6,mptcp join id 5 hmac 0xcb2ba0bbb54b93af nonce 0x6a8a083b], length 0
10:42:02.795612 IP 112.26.3.8.42387 > 112.26.3.1.44877: Flags [.], ack 1, win 7072, options [nop,nop,TS val 11508 ecr 224668,mptcp join hmac 0x6751ff0d8d5836226ca8bca04d26c0f7c656fb92], length 0
10:42:02.795908 IP 112.26.3.8.42387 > 112.26.3.1.44877: Flags [.], ack 1, win 7072, options [nop,nop,TS val 11508 ecr 224668,mptcp join hmac 0x6751ff0d8d5836226ca8bca04d26c0f7c656fb92], length 0
10:42:38.675292 IP 112.26.3.1.44877 > 112.26.3.8.42387: Flags [.], seq 402697:404125, ack 1, win 4017, options [nop,nop,TS val 260509 ecr 46984,mptcp dss ack 3454339951 seq 445710596 subseq 402697 len 1428 csum 0x15a8], length 1428
10:42:38.699565 IP 112.26.3.1.44877 > 112.26.3.8.42387: Flags [.], seq 402697:404125, ack 1, win 4017, options [nop,nop,TS val 260509 ecr 46984,mptcp dss ack 3454339951 seq 445710596 subseq 402697 len 1428 csum 0x15a8], length 1428
10:42:38.718625 IP 112.26.3.1.44877 > 112.26.3.8.42387: Flags [.], seq 399841:401269, ack 1, win 4017, options [nop,nop,TS val 260422 ecr 46734,mptcp dss ack 3454339951 seq 445697744 subseq 399841 len 1428 csum 0xaae1], length 1428
10:42:38.726045 IP 112.26.3.1.44877 > 112.26.3.8.42387: Flags [.], seq 404125:405553, ack 1, win 4017, options [nop,nop,TS val 260509 ecr 46984,mptcp dss ack 3454339951 seq 445712024 subseq 404125 len 1428 csum 0x562d], length 1428
10:42:38.775288 IP 112.26.3.8.42387 > 112.26.3.1.44877: Flags [.], ack 396985, win 24540, options [nop,nop,TS val 47328 ecr 260001,mptcp dss ack 445604924], length 0
10:42:38.775552 IP 112.26.3.8.42387 > 112.26.3.1.44877: Flags [.], ack 396985, win 24540, options [nop,nop,TS val 47328 ecr 260001,mptcp dss ack 445604924], length 0
10:42:38.809338 IP 112.26.3.1.44877 > 112.26.3.8.42387: Flags [.], seq 404125:405553, ack 1, win 4017, options [nop,nop,TS val 260509 ecr 46984,mptcp dss ack 3454339951 seq 445712024 subseq 404125 len 1428 csum 0x562d], length 1428
10:42:38.826510 IP 112.26.3.1.44877 > 112.26.3.8.42387: Flags [.], seq 405553:406981, ack 1, win 4017, options [nop,nop,TS val 260916 ecr 47328,mptcp dss ack 3454339951 seq 445724876 subseq 405553 len 1428 csum 0x2d07], length 1428
10:42:38.846567 IP 112.26.3.1.44877 > 112.26.3.8.42387: Flags [.], seq 401269:402697, ack 1, win 4017, options [nop,nop,TS val 260422 ecr 46734,mptcp dss ack 3454339951 seq 445699172 subseq 401269 len 1428 csum 0x7762], length 1428
10:42:38.880987 IP 112.26.3.1.44877 > 112.26.3.8.42387: Flags [.], seq 406981:408409, ack 1, win 4017, options [nop,nop,TS val 260916 ecr 47328,mptcp dss ack 3454339951 seq 445726304 subseq 406981 len 1428 csum 0x9e83], length 1428
10:42:38.896983 IP 112.26.3.1.44877 > 112.26.3.8.42387: Flags [.], seq 402697:404125, ack 1, win 4017, options [nop,nop,TS val 260509 ecr 46984,mptcp dss ack 3454339951 seq 445710596 subseq 402697 len 1428 csum 0x15a8], length 1428
10:42:38.911750 IP 112.26.3.1.44877 > 112.26.3.8.42387: Flags [.], seq 405553:406981, ack 1, win 4017, options [nop,nop,TS val 260916 ecr 47328,mptcp dss ack 3454339951 seq 445724876 subseq 405553 len 1428 csum 0x2d07], length 1428
10:42:38.952768 IP 112.26.3.1.44877 > 112.26.3.8.42387: Flags [.], seq 408409:409837, ack 1, win 4017, options [nop,nop,TS val 260916 ecr 47328,mptcp dss ack 3454339951 seq 445727732 subseq 408409 len 1428 csum 0x44d9], length 1428
10:42:38.964209 IP 112.26.3.1.44877 > 112.26.3.8.42387: Flags [.], seq 406981:408409, ack 1, win 4017, options [nop,nop,TS val 260916 ecr 47328,mptcp dss ack 3454339951 seq 445726304 subseq 406981 len 1428 csum 0x9e83], length 1428
10:42:38.969112 IP 112.26.3.1.44877 > 112.26.3.8.42387: Flags [.], seq 404125:405553, ack 1, win 4017, options [nop,nop,TS val 260509 ecr 46984,mptcp dss ack 3454339951 seq 445712024 subseq 404125 len 1428 csum 0x562d], length 1428
10:42:39.010796 IP 112.26.3.1.44877 > 112.26.3.8.42387: Flags [.], seq 409837:411265, ack 1, win 4017, options [nop,nop,TS val 260916 ecr 47328,mptcp dss ack 3454339951 seq 445729160 subseq 409837 len 1428 csum 0x6b51], length 1428
10:42:39.017125 IP 112.26.3.8.42387 > 112.26.3.1.44877: Flags [.], ack 401269, win 24311, options [nop,nop,TS val 47608 ecr 260422,mptcp dss ack 445659188], length 0
10:42:39.017428 IP 112.26.3.8.42387 > 112.26.3.1.44877: Flags [.], ack 401269, win 24311, options [nop,nop,TS val 47608 ecr 260422,mptcp dss ack 445659188], length 0
10:42:39.063294 IP 112.26.3.1.44877 > 112.26.3.8.42387: Flags [.], seq 408409:409837, ack 1, win 4017, options [nop,nop,TS val 260916 ecr 47328,mptcp dss ack 3454339951 seq 445727732 subseq 408409 len 1428 csum 0x44d9], length 1428
10:42:39.090327 IP 112.26.3.1.44877 > 112.26.3.8.42387: Flags [.], seq 405553:406981, ack 1, win 4017, options [nop,nop,TS val 260916 ecr 47328,mptcp dss ack 3454339951 seq 445724876 subseq 405553 len 1428 csum 0x2d07], length 1428
10:42:39.106248 IP 112.26.3.1.44877 > 112.26.3.8.42387: Flags [.], seq 411265:412693, ack 1, win 4017, options [nop,nop,TS val 260916 ecr 47328,mptcp dss ack 3454339951 seq 445730588 subseq 411265 len 1428 csum 0x88c], length 1428
10:42:39.141793 IP 112.26.3.1.44877 > 112.26.3.8.42387: Flags [.], seq 406981:408409, ack 1, win 4017, options [nop,nop,TS val 260916 ecr 47328,mptcp dss ack 3454339951 seq 445726304 subseq 406981 len 1428 csum 0x9e83], length 1428
10:42:39.155830 IP 112.26.3.1.44877 > 112.26.3.8.42387: Flags [.], seq 412693:414121, ack 1, win 4017, options [nop,nop,TS val 261161 ecr 47608,mptcp dss ack 3454339951 seq 445740584 subseq 412693 len 1428 csum 0xb5a], length 1428
10:42:39.168771 IP 112.26.3.1.44877 > 112.26.3.8.42387: Flags [.], seq 409837:411265, ack 1, win 4017, options [nop,nop,TS val 260916 ecr 47328,mptcp dss ack 3454339951 seq 445729160 subseq 409837 len 1428 csum 0x6b51], length 1428
10:42:39.224118 IP 112.26.3.1.44877 > 112.26.3.8.42387: Flags [.], seq 408409:409837, ack 1, win 4017, options [nop,nop,TS val 260916 ecr 47328,mptcp dss ack 3454339951 seq 445727732 subseq 408409 len 1428 csum 0x44d9], length 1428
10:42:39.238433 IP 112.26.3.1.44877 > 112.26.3.8.42387: Flags [.], seq 411265:412693, ack 1, win 4017, options [nop,nop,TS val 260916 ecr 47328,mptcp dss ack 3454339951 seq 445730588 subseq 411265 len 1428 csum 0x88c], length 1428
10:42:39.250180 IP 112.26.3.1.44877 > 112.26.3.8.42387: Flags [.], seq 414121:415549, ack 1, win 4017, options [nop,nop,TS val 261161 ecr 47608,mptcp dss ack 3454339951 seq 445742012 subseq 414121 len 1428 csum 0x2196], length 1428
10:42:39.281565 IP 112.26.3.1.44877 > 112.26.3.8.42387: Flags [.], seq 412693:414121, ack 1, win 4017, options [nop,nop,TS val 261161 ecr 47608,mptcp dss ack 3454339951 seq 445740584 subseq 412693 len 1428 csum 0xb5a], length 1428
10:42:39.318000 IP 112.26.3.8.42387 > 112.26.3.1.44877: Flags [.], ack 406981, win 24311, options [nop,nop,TS val 47875 ecr 260422,mptcp dss ack 445659188], length 0
10:42:39.318311 IP 112.26.3.8.42387 > 112.26.3.1.44877: Flags [.], ack 406981, win 24311, options [nop,nop,TS val 47875 ecr 260422,mptcp dss ack 445659188], length 0
10:42:39.358327 IP 112.26.3.1.44877 > 112.26.3.8.42387: Flags [.], seq 415549:416977, ack 1, win 4017, options [nop,nop,TS val 261161 ecr 47608,mptcp dss ack 3454339951 seq 445743440 subseq 415549 len 1428 csum 0xf46d], length 1428
10:42:39.397803 IP 112.26.3.1.44877 > 112.26.3.8.42387: Flags [.], seq 414121:415549, ack 1, win 4017, options [nop,nop,TS val 261161 ecr 47608,mptcp dss ack 3454339951 seq 445742012 subseq 414121 len 1428 csum 0x2196], length 1428
10:42:39.435029 IP 112.26.3.1.44877 > 112.26.3.8.42387: Flags [.], seq 409837:411265, ack 1, win 4017, options [nop,nop,TS val 260916 ecr 47328,mptcp dss ack 3454339951 seq 445729160 subseq 409837 len 1428 csum 0x6b51], length 1428
10:42:39.454501 IP 112.26.3.1.44877 > 112.26.3.8.42387: Flags [.], seq 416977:418405, ack 1, win 4017, options [nop,nop,TS val 261161 ecr 47608,mptcp dss ack 3454339951 seq 445744868 subseq 416977 len 1428 csum 0xa113], length 1428
10:42:39.487858 IP 112.26.3.1.44877 > 112.26.3.8.42387: Flags [.], seq 415549:416977, ack 1, win 4017, options [nop,nop,TS val 261161 ecr 47608,mptcp dss ack 3454339951 seq 445743440 subseq 415549 len 1428 csum 0xf46d], length 1428
10:42:39.549828 IP 112.26.3.1.44877 > 112.26.3.8.42387: Flags [.], seq 411265:412693, ack 1, win 4017, options [nop,nop,TS val 260916 ecr 47328,mptcp dss ack 3454339951 seq 445730588 subseq 411265 len 1428 csum 0x88c], length 1428
10:42:39.554257 IP 112.26.3.1.44877 > 112.26.3.8.42387: Flags [.], seq 418405:419833, ack 1, win 4017, options [nop,nop,TS val 261161 ecr 47608,mptcp dss ack 3454339951 seq 445746296 subseq 418405 len 1428 csum 0xa31b], length 1428
10:42:39.557512 IP 112.26.3.1.44877 > 112.26.3.8.42387: Flags [.], seq 419833:421261, ack 1, win 4017, options [nop,nop,TS val 261461 ecr 47875,mptcp dss ack 3454339951 seq 445756292 subseq 419833 len 1428 csum 0x1790], length 1428
10:42:39.560177 IP 112.26.3.1.44877 > 112.26.3.8.42387: Flags [.], seq 416977:418405, ack 1, win 4017, options [nop,nop,TS val 261161 ecr 47608,mptcp dss ack 3454339951 seq 445744868 subseq 416977 len 1428 csum 0xa113], length 1428
10:42:39.586021 IP 112.26.3.1.44877 > 112.26.3.8.42387: Flags [.], seq 412693:414121, ack 1, win 4017, options [nop,nop,TS val 261161 ecr 47608,mptcp dss ack 3454339951 seq 445740584 subseq 412693 len 1428 csum 0xb5a], length 1428
10:42:39.621293 IP 112.26.3.1.44877 > 112.26.3.8.42387: Flags [.], seq 418405:419833, ack 1, win 4017, options [nop,nop,TS val 261161 ecr 47608,mptcp dss ack 3454339951 seq 445746296 subseq 418405 len 1428 csum 0xa31b], length 1428
10:42:39.641956 IP 112.26.3.1.44877 > 112.26.3.8.42387: Flags [.], seq 421261:422689, ack 1, win 4017, options [nop,nop,TS val 261461 ecr 47875,mptcp dss ack 3454339951 seq 445757720 subseq 421261 len 1428 csum 0x49ff], length 1428
10:42:39.663959 IP 112.26.3.8.42387 > 112.26.3.1.44877: Flags [.], ack 409837, win 24311, options [nop,nop,TS val 48096 ecr 260916,mptcp dss ack 445659188], length 0
10:42:39.664266 IP 112.26.3.8.42387 > 112.26.3.1.44877: Flags [.], ack 409837, win 24311, options [nop,nop,TS val 48096 ecr 260916,mptcp dss ack 445659188], length 0
10:42:39.703048 IP 112.26.3.1.44877 > 112.26.3.8.42387: Flags [.], seq 419833:421261, ack 1, win 4017, options [nop,nop,TS val 261461 ecr 47875,mptcp dss ack 3454339951 seq 445756292 subseq 419833 len 1428 csum 0x1790], length 1428
10:42:39.719167 IP 112.26.3.1.44877 > 112.26.3.8.42387: Flags [.], seq 414121:415549, ack 1, win 4017, options [nop,nop,TS val 261161 ecr 47608,mptcp dss ack 3454339951 seq 445742012 subseq 414121 len 1428 csum 0x2196], length 1428
10:42:39.729650 IP 112.26.3.1.44877 > 112.26.3.8.42387: Flags [.], seq 422689:424117, ack 1, win 4017, options [nop,nop,TS val 261461 ecr 47875,mptcp dss ack 3454339951 seq 445759148 subseq 422689 len 1428 csum 0x9714], length 1428
10:42:39.752337 IP 112.26.3.1.44877 > 112.26.3.8.42387: Flags [.], seq 421261:422689, ack 1, win 4017, options [nop,nop,TS val 261461 ecr 47875,mptcp dss ack 3454339951 seq 445757720 subseq 421261 len 1428 csum 0x49ff], length 1428
10:42:39.797874 IP 112.26.3.1.44877 > 112.26.3.8.42387: Flags [.], seq 415549:416977, ack 1, win 4017, options [nop,nop,TS val 261161 ecr 47608,mptcp dss ack 3454339951 seq 445743440 subseq 415549 len 1428 csum 0xf46d], length 1428
10:42:39.819517 IP 112.26.3.1.44877 > 112.26.3.8.42387: Flags [.], seq 424117:425545, ack 1, win 4017, options [nop,nop,TS val 261461 ecr 47875,mptcp dss ack 3454339951 seq 445760576 subseq 424117 len 1428 csum 0xd325], length 1428
10:42:39.824362 IP 112.26.3.1.44877 > 112.26.3.8.42387: Flags [.], seq 422689:424117, ack 1, win 4017, options [nop,nop,TS val 261461 ecr 47875,mptcp dss ack 3454339951 seq 445759148 subseq 422689 len 1428 csum 0x9714], length 1428
10:42:39.855444 IP 112.26.3.1.44877 > 112.26.3.8.42387: Flags [.], seq 416977:418405, ack 1, win 4017, options [nop,nop,TS val 261161 ecr 47608,mptcp dss ack 3454339951 seq 445744868 subseq 416977 len 1428 csum 0xa113], length 1428
10:42:39.883719 IP 112.26.3.1.44877 > 112.26.3.8.42387: Flags [.], seq 425545:426973, ack 1, win 4017, options [nop,nop,TS val 261804 ecr 48096,mptcp dss ack 3454339951 seq 445764860 subseq 425545 len 1428 csum 0x54e8], length 1428
10:42:39.910020 IP 112.26.3.1.44877 > 112.26.3.8.42387: Flags [.], seq 424117:425545, ack 1, win 4017, options [nop,nop,TS val 261461 ecr 47875,mptcp dss ack 3454339951 seq 445760576 subseq 424117 len 1428 csum 0xd325], length 1428
10:42:39.915374 IP 112.26.3.1.44877 > 112.26.3.8.42387: Flags [.], seq 418405:419833, ack 1, win 4017, options [nop,nop,TS val 261161 ecr 47608,mptcp dss ack 3454339951 seq 445746296 subseq 418405 len 1428 csum 0xa31b], length 1428
10:42:39.961380 IP 112.26.3.1.44877 > 112.26.3.8.42387: Flags [.], seq 425545:426973, ack 1, win 4017, options [nop,nop,TS val 261804 ecr 48096,mptcp dss ack 3454339951 seq 445764860 subseq 425545 len 1428 csum 0x54e8], length 1428
10:42:39.974389 IP 112.26.3.1.44877 > 112.26.3.8.42387: Flags [.], seq 419833:421261, ack 1, win 4017, options [nop,nop,TS val 261461 ecr 47875,mptcp dss ack 3454339951 seq 445756292 subseq 419833 len 1428 csum 0x1790], length 1428
10:42:39.984279 IP 112.26.3.1.44877 > 112.26.3.8.42387: Flags [.], seq 426973:428401, ack 1, win 4017, options [nop,nop,TS val 261804 ecr 48096,mptcp dss ack 3454339951 seq 445766288 subseq 426973 len 1428 csum 0x658a], length 1428
10:42:40.041441 IP 112.26.3.1.44877 > 112.26.3.8.42387: Flags [.], seq 426973:428401, ack 1, win 4017, options [nop,nop,TS val 261804 ecr 48096,mptcp dss ack 3454339951 seq 445766288 subseq 426973 len 1428 csum 0x658a], length 1428
10:42:40.063339 IP 112.26.3.8.42387 > 112.26.3.1.44877: Flags [.], ack 415549, win 24311, options [nop,nop,TS val 48508 ecr 260916,mptcp dss ack 445659188], length 0
10:42:40.063596 IP 112.26.3.8.42387 > 112.26.3.1.44877: Flags [.], ack 415549, win 24311, options [nop,nop,TS val 48508 ecr 260916,mptcp dss ack 445659188], length 0
10:42:40.083909 IP 112.26.3.1.44877 > 112.26.3.8.42387: Flags [.], seq 428401:429829, ack 1, win 4017, options [nop,nop,TS val 261804 ecr 48096,mptcp dss ack 3454339951 seq 445767716 subseq 428401 len 1428 csum 0x7aac], length 1428
10:42:40.149383 IP 112.26.3.1.44877 > 112.26.3.8.42387: Flags [.], seq 428401:429829, ack 1, win 4017, options [nop,nop,TS val 261804 ecr 48096,mptcp dss ack 3454339951 seq 445767716 subseq 428401 len 1428 csum 0x7aac], length 1428
10:42:40.191700 IP 112.26.3.1.44877 > 112.26.3.8.42387: Flags [.], seq 429829:431257, ack 1, win 4017, options [nop,nop,TS val 262203 ecr 48508,mptcp dss ack 3454339951 seq 445787708 subseq 429829 len 1428 csum 0xdfd0], length 1428
10:42:40.233440 IP 112.26.3.1.44877 > 112.26.3.8.42387: Flags [.], seq 421261:422689, ack 1, win 4017, options [nop,nop,TS val 261461 ecr 47875,mptcp dss ack 3454339951 seq 445757720 subseq 421261 len 1428 csum 0x49ff], length 1428
10:42:40.244059 IP 112.26.3.1.44877 > 112.26.3.8.42387: Flags [.], seq 431257:432685, ack 1, win 4017, options [nop,nop,TS val 262203 ecr 48508,mptcp dss ack 3454339951 seq 445789136 subseq 431257 len 1428 csum 0xa12d], length 1428
10:42:40.260766 IP 112.26.3.1.44877 > 112.26.3.8.42387: Flags [.], seq 429829:431257, ack 1, win 4017, options [nop,nop,TS val 262203 ecr 48508,mptcp dss ack 3454339951 seq 445787708 subseq 429829 len 1428 csum 0xdfd0], length 1428
10:42:40.262889 IP 112.26.3.1.44877 > 112.26.3.8.42387: Flags [.], seq 422689:424117, ack 1, win 4017, options [nop,nop,TS val 261461 ecr 47875,mptcp dss ack 3454339951 seq 445759148 subseq 422689 len 1428 csum 0x9714], length 1428
10:42:40.301799 IP 112.26.3.1.44877 > 112.26.3.8.42387: Flags [.], seq 432685:434113, ack 1, win 4017, options [nop,nop,TS val 262203 ecr 48508,mptcp dss ack 3454339951 seq 445790564 subseq 432685 len 1428 csum 0x2a3d], length 1428
10:42:40.316353 IP 112.26.3.8.42387 > 112.26.3.1.44877: Flags [.], ack 418405, win 23613, options [nop,nop,TS val 48655 ecr 261161,mptcp dss ack 445734872], length 0
10:42:40.316674 IP 112.26.3.8.42387 > 112.26.3.1.44877: Flags [.], ack 418405, win 23613, options [nop,nop,TS val 48655 ecr 261161,mptcp dss ack 445734872], length 0
10:42:40.371210 IP 112.26.3.1.44877 > 112.26.3.8.42387: Flags [.], seq 434113:435541, ack 1, win 4017, options [nop,nop,TS val 262203 ecr 48508,mptcp dss ack 3454339951 seq 445791992 subseq 434113 len 1428 csum 0x2b6c], length 1428
10:42:40.384395 IP 112.26.3.1.44877 > 112.26.3.8.42387: Flags [.], seq 431257:432685, ack 1, win 4017, options [nop,nop,TS val 262203 ecr 48508,mptcp dss ack 3454339951 seq 445789136 subseq 431257 len 1428 csum 0xa12d], length 1428
10:42:40.406921 IP 112.26.3.1.44877 > 112.26.3.8.42387: Flags [.], seq 424117:425545, ack 1, win 4017, options [nop,nop,TS val 261461 ecr 47875,mptcp dss ack 3454339951 seq 445760576 subseq 424117 len 1428 csum 0xd325], length 1428
10:42:40.452124 IP 112.26.3.1.44877 > 112.26.3.8.42387: Flags [.], seq 435541:436969, ack 1, win 4017, options [nop,nop,TS val 262203 ecr 48508,mptcp dss ack 3454339951 seq 445793420 subseq 435541 len 1428 csum 0xdc5b], length 1428
10:42:40.469746 IP 112.26.3.1.44877 > 112.26.3.8.42387: Flags [.], seq 432685:434113, ack 1, win 4017, options [nop,nop,TS val 262203 ecr 48508,mptcp dss ack 3454339951 seq 445790564 subseq 432685 len 1428 csum 0x2a3d], length 1428
10:42:40.511645 IP 112.26.3.1.44877 > 112.26.3.8.42387: Flags [.], seq 436969:438397, ack 1, win 4017, options [nop,nop,TS val 262203 ecr 48508,mptcp dss ack 3454339951 seq 445794848 subseq 436969 len 1428 csum 0xf232], length 1428
10:42:40.524108 IP 112.26.3.1.44877 > 112.26.3.8.42387: Flags [.], seq 425545:426973, ack 1, win 4017, options [nop,nop,TS val 261804 ecr 48096,mptcp dss ack 3454339951 seq 445764860 subseq 425545 len 1428 csum 0x54e8], length 1428
10:42:40.564780 IP 112.26.3.1.44877 > 112.26.3.8.42387: Flags [.], seq 434113:435541, ack 1, win 4017, options [nop,nop,TS val 262203 ecr 48508,mptcp dss ack 3454339951 seq 445791992 subseq 434113 len 1428 csum 0x2b6c], length 1428
10:42:40.584071 IP 112.26.3.1.44877 > 112.26.3.8.42387: Flags [.], seq 438397:439825, ack 1, win 4017, options [nop,nop,TS val 262458 ecr 48655,mptcp dss ack 3454339951 seq 445807700 subseq 438397 len 1428 csum 0x2974], length 1428
10:42:40.608119 IP 112.26.3.8.42387 > 112.26.3.1.44877: Flags [.], ack 421261, win 24429, options [nop,nop,TS val 48763 ecr 261161,mptcp dss ack 445734872], length 0
10:42:40.608430 IP 112.26.3.8.42387 > 112.26.3.1.44877: Flags [.], ack 421261, win 24429, options [nop,nop,TS val 48763 ecr 261161,mptcp dss ack 445734872], length 0
10:42:40.642964 IP 112.26.3.1.44877 > 112.26.3.8.42387: Flags [.], seq 435541:436969, ack 1, win 4017, options [nop,nop,TS val 262203 ecr 48508,mptcp dss ack 3454339951 seq 445793420 subseq 435541 len 1428 csum 0xdc5b], length 1428
10:42:40.663402 IP 112.26.3.1.44877 > 112.26.3.8.42387: Flags [.], seq 439825:441253, ack 1, win 4017, options [nop,nop,TS val 262458 ecr 48655,mptcp dss ack 3454339951 seq 445809128 subseq 439825 len 1428 csum 0xe62d], length 1428
10:42:40.678442 IP 112.26.3.1.44877 > 112.26.3.8.42387: Flags [.], seq 426973:428401, ack 1, win 4017, options [nop,nop,TS val 261804 ecr 48096,mptcp dss ack 3454339951 seq 445766288 subseq 426973 len 1428 csum 0x658a], length 1428
10:42:40.717991 IP 112.26.3.1.44877 > 112.26.3.8.42387: Flags [.], seq 441253:442681, ack 1, win 4017, options [nop,nop,TS val 262458 ecr 48655,mptcp dss ack 3454339951 seq 445810556 subseq 441253 len 1428 csum 0xdef6], length 1428
10:42:40.720375 IP 112.26.3.1.44877 > 112.26.3.8.42387: Flags [.], seq 436969:438397, ack 1, win 4017, options [nop,nop,TS val 262203 ecr 48508,mptcp dss ack 3454339951 seq 445794848 subseq 436969 len 1428 csum 0xf232], length 1428
10:42:40.735417 IP 112.26.3.1.44877 > 112.26.3.8.42387: Flags [.], seq 428401:429829, ack 1, win 4017, options [nop,nop,TS val 261804 ecr 48096,mptcp dss ack 3454339951 seq 445767716 subseq 428401 len 1428 csum 0x7aac], length 1428
10:42:40.800341 IP 112.26.3.1.44877 > 112.26.3.8.42387: Flags [.], seq 438397:439825, ack 1, win 4017, options [nop,nop,TS val 262458 ecr 48655,mptcp dss ack 3454339951 seq 445807700 subseq 438397 len 1428 csum 0x2974], length 1428
10:42:40.835603 IP 112.26.3.1.44877 > 112.26.3.8.42387: Flags [.], seq 442681:444109, ack 1, win 4017, options [nop,nop,TS val 262748 ecr 48763,mptcp dss ack 3454339951 seq 445813412 subseq 442681 len 1428 csum 0x4d6], length 1428
10:42:40.837729 IP 112.26.3.1.44877 > 112.26.3.8.42387: Flags [.], seq 429829:431257, ack 1, win 4017, options [nop,nop,TS val 262203 ecr 48508,mptcp dss ack 3454339951 seq 445787708 subseq 429829 len 1428 csum 0xdfd0], length 1428
10:42:40.848203 IP 112.26.3.1.44877 > 112.26.3.8.42387: Flags [.], seq 439825:441253, ack 1, win 4017, options [nop,nop,TS val 262458 ecr 48655,mptcp dss ack 3454339951 seq 445809128 subseq 439825 len 1428 csum 0xe62d], length 1428
10:42:40.884329 IP 112.26.3.1.44877 > 112.26.3.8.42387: Flags [.], seq 444109:445537, ack 1, win 4017, options [nop,nop,TS val 262748 ecr 48763,mptcp dss ack 3454339951 seq 445814840 subseq 444109 len 1428 csum 0x5523], length 1428
10:42:40.910271 IP 112.26.3.8.42387 > 112.26.3.1.44877: Flags [.], ack 424117, win 24429, options [nop,nop,TS val 49104 ecr 261461,mptcp dss ack 445734872], length 0
10:42:40.910607 IP 112.26.3.8.42387 > 112.26.3.1.44877: Flags [.], ack 424117, win 24429, options [nop,nop,TS val 49104 ecr 261461,mptcp dss ack 445734872], length 0
10:42:40.958436 IP 112.26.3.1.44877 > 112.26.3.8.42387: Flags [.], seq 441253:442681, ack 1, win 4017, options [nop,nop,TS val 262458 ecr 48655,mptcp dss ack 3454339951 seq 445810556 subseq 441253 len 1428 csum 0xdef6], length 1428
10:42:40.968629 IP 112.26.3.1.44877 > 112.26.3.8.42387: Flags [.], seq 445537:446965, ack 1, win 4017, options [nop,nop,TS val 262748 ecr 48763,mptcp dss ack 3454339951 seq 445816268 subseq 445537 len 1428 csum 0x3a18], length 1428
10:42:40.984032 IP 112.26.3.1.44877 > 112.26.3.8.42387: Flags [.], seq 431257:432685, ack 1, win 4017, options [nop,nop,TS val 262203 ecr 48508,mptcp dss ack 3454339951 seq 445789136 subseq 431257 len 1428 csum 0xa12d], length 1428
10:42:41.021711 IP 112.26.3.1.44877 > 112.26.3.8.42387: Flags [.], seq 446965:448393, ack 1, win 4017, options [nop,nop,TS val 263052 ecr 49104,mptcp dss ack 3454339951 seq 445834832 subseq 446965 len 1428 csum 0x7016], length 1428
10:42:41.041538 IP 112.26.3.1.44877 > 112.26.3.8.42387: Flags [.], seq 432685:434113, ack 1, win 4017, options [nop,nop,TS val 262203 ecr 48508,mptcp dss ack 3454339951 seq 445790564 subseq 432685 len 1428 csum 0x2a3d], length 1428
10:42:41.071471 IP 112.26.3.1.44877 > 112.26.3.8.42387: Flags [.], seq 442681:444109, ack 1, win 4017, options [nop,nop,TS val 262748 ecr 48763,mptcp dss ack 3454339951 seq 445813412 subseq 442681 len 1428 csum 0x4d6], length 1428
10:42:41.089244 IP 112.26.3.1.44877 > 112.26.3.8.42387: Flags [.], seq 448393:449821, ack 1, win 4017, options [nop,nop,TS val 263052 ecr 49104,mptcp dss ack 3454339951 seq 445836260 subseq 448393 len 1428 csum 0xc0a0], length 1428
10:42:41.121827 IP 112.26.3.1.44877 > 112.26.3.8.42387: Flags [.], seq 434113:435541, ack 1, win 4017, options [nop,nop,TS val 262203 ecr 48508,mptcp dss ack 3454339951 seq 445791992 subseq 434113 len 1428 csum 0x2b6c], length 1428
10:42:41.169963 IP 112.26.3.1.44877 > 112.26.3.8.42387: Flags [.], seq 444109:445537, ack 1, win 4017, options [nop,nop,TS val 262748 ecr 48763,mptcp dss ack 3454339951 seq 445814840 subseq 444109 len 1428 csum 0x5523], length 1428
10:42:41.184179 IP 112.26.3.1.44877 > 112.26.3.8.42387: Flags [.], seq 435541:436969, ack 1, win 4017, options [nop,nop,TS val 262203 ecr 48508,mptcp dss ack 3454339951 seq 445793420 subseq 435541 len 1428 csum 0xdc5b], length 1428
10:42:41.222826 IP 112.26.3.1.44877 > 112.26.3.8.42387: Flags [.], seq 445537:446965, ack 1, win 4017, options [nop,nop,TS val 262748 ecr 48763,mptcp dss ack 3454339951 seq 445816268 subseq 445537 len 1428 csum 0x3a18], length 1428
10:42:41.262381 IP 112.26.3.8.42387 > 112.26.3.1.44877: Flags [.], ack 428401, win 24429, options [nop,nop,TS val 49467 ecr 261461,mptcp dss ack 445734872], length 0
10:42:41.262716 IP 112.26.3.8.42387 > 112.26.3.1.44877: Flags [.], ack 428401, win 24429, options [nop,nop,TS val 49467 ecr 261461,mptcp dss ack 445734872], length 0
10:42:41.275599 IP 112.26.3.1.44877 > 112.26.3.8.42387: Flags [.], seq 449821:451249, ack 1, win 4017, options [nop,nop,TS val 263404 ecr 49467,mptcp dss ack 3454339951 seq 445849112 subseq 449821 len 1428 csum 0x7f45], length 1428
10:42:41.306183 IP 112.26.3.1.44877 > 112.26.3.8.42387: Flags [.], seq 446965:448393, ack 1, win 4017, options [nop,nop,TS val 263052 ecr 49104,mptcp dss ack 3454339951 seq 445834832 subseq 446965 len 1428 csum 0x7016], length 1428
10:42:41.336222 IP 112.26.3.1.44877 > 112.26.3.8.42387: Flags [.], seq 436969:438397, ack 1, win 4017, options [nop,nop,TS val 262203 ecr 48508,mptcp dss ack 3454339951 seq 445794848 subseq 436969 len 1428 csum 0xf232], length 1428
10:42:41.353195 IP 112.26.3.1.44877 > 112.26.3.8.42387: Flags [.], seq 451249:452677, ack 1, win 4017, options [nop,nop,TS val 263404 ecr 49467,mptcp dss ack 3454339951 seq 445850540 subseq 451249 len 1428 csum 0x6e3a], length 1428
10:42:41.398014 IP 112.26.3.1.44877 > 112.26.3.8.42387: Flags [.], seq 438397:439825, ack 1, win 4017, options [nop,nop,TS val 262458 ecr 48655,mptcp dss ack 3454339951 seq 445807700 subseq 438397 len 1428 csum 0x2974], length 1428
10:42:41.402930 IP 112.26.3.1.44877 > 112.26.3.8.42387: Flags [.], seq 452677:454105, ack 1, win 4017, options [nop,nop,TS val 263404 ecr 49467,mptcp dss ack 3454339951 seq 445851968 subseq 452677 len 1428 csum 0xdb7a], length 1428
10:42:41.432598 IP 112.26.3.1.44877 > 112.26.3.8.42387: Flags [.], seq 439825:441253, ack 1, win 4017, options [nop,nop,TS val 262458 ecr 48655,mptcp dss ack 3454339951 seq 445809128 subseq 439825 len 1428 csum 0xe62d], length 1428
10:42:41.436258 IP 112.26.3.1.44877 > 112.26.3.8.42387: Flags [.], seq 448393:449821, ack 1, win 4017, options [nop,nop,TS val 263052 ecr 49104,mptcp dss ack 3454339951 seq 445836260 subseq 448393 len 1428 csum 0xc0a0], length 1428
10:42:41.477318 IP 112.26.3.1.44877 > 112.26.3.8.42387: Flags [.], seq 454105:455533, ack 1, win 4017, options [nop,nop,TS val 263404 ecr 49467,mptcp dss ack 3454339951 seq 445853396 subseq 454105 len 1428 csum 0xa96e], length 1428
10:42:41.504897 IP 112.26.3.8.42387 > 112.26.3.1.44877: Flags [.], ack 431257, win 24429, options [nop,nop,TS val 49728 ecr 261804,mptcp dss ack 445734872], length 0
10:42:41.505212 IP 112.26.3.8.42387 > 112.26.3.1.44877: Flags [.], ack 431257, win 24429, options [nop,nop,TS val 49728 ecr 261804,mptcp dss ack 445734872], length 0
10:42:41.538147 IP 112.26.3.1.44877 > 112.26.3.8.42387: Flags [.], seq 449821:451249, ack 1, win 4017, options [nop,nop,TS val 263404 ecr 49467,mptcp dss ack 3454339951 seq 445849112 subseq 449821 len 1428 csum 0x7f45], length 1428
10:42:41.562711 IP 112.26.3.1.44877 > 112.26.3.8.42387: Flags [.], seq 455533:456961, ack 1, win 4017, options [nop,nop,TS val 263646 ecr 49728,mptcp dss ack 3454339951 seq 445856252 subseq 455533 len 1428 csum 0xeb4d], length 1428
10:42:41.575717 IP 112.26.3.1.44877 > 112.26.3.8.42387: Flags [.], seq 441253:442681, ack 1, win 4017, options [nop,nop,TS val 262458 ecr 48655,mptcp dss ack 3454339951 seq 445810556 subseq 441253 len 1428 csum 0xdef6], length 1428
10:42:41.643364 IP 112.26.3.1.44877 > 112.26.3.8.42387: Flags [.], seq 451249:452677, ack 1, win 4017, options [nop,nop,TS val 263404 ecr 49467,mptcp dss ack 3454339951 seq 445850540 subseq 451249 len 1428 csum 0x6e3a], length 1428
10:42:41.653778 IP 112.26.3.1.44877 > 112.26.3.8.42387: Flags [.], seq 456961:458389, ack 1, win 4017, options [nop,nop,TS val 263646 ecr 49728,mptcp dss ack 3454339951 seq 445857680 subseq 456961 len 1428 csum 0xe72], length 1428
10:42:41.679624 IP 112.26.3.1.44877 > 112.26.3.8.42387: Flags [.], seq 442681:444109, ack 1, win 4017, options [nop,nop,TS val 262748 ecr 48763,mptcp dss ack 3454339951 seq 445813412 subseq 442681 len 1428 csum 0x4d6], length 1428
10:42:41.709255 IP 112.26.3.1.44877 > 112.26.3.8.42387: Flags [.], seq 452677:454105, ack 1, win 4017, options [nop,nop,TS val 263404 ecr 49467,mptcp dss ack 3454339951 seq 445851968 subseq 452677 len 1428 csum 0xdb7a], length 1428
10:42:41.740833 IP 112.26.3.1.44877 > 112.26.3.8.42387: Flags [.], seq 458389:459817, ack 1, win 4017, options [nop,nop,TS val 263646 ecr 49728,mptcp dss ack 3454339951 seq 445859108 subseq 458389 len 1428 csum 0xa0cf], length 1428
10:42:41.768825 IP 112.26.3.1.44877 > 112.26.3.8.42387: Flags [.], seq 444109:445537, ack 1, win 4017, options [nop,nop,TS val 262748 ecr 48763,mptcp dss ack 3454339951 seq 445814840 subseq 444109 len 1428 csum 0x5523], length 1428
10:42:41.802968 IP 112.26.3.1.44877 > 112.26.3.8.42387: Flags [.], seq 454105:455533, ack 1, win 4017, options [nop,nop,TS val 263404 ecr 49467,mptcp dss ack 3454339951 seq 445853396 subseq 454105 len 1428 csum 0xa96e], length 1428
10:42:41.824793 IP 112.26.3.1.44877 > 112.26.3.8.42387: Flags [.], seq 445537:446965, ack 1, win 4017, options [nop,nop,TS val 262748 ecr 48763,mptcp dss ack 3454339951 seq 445816268 subseq 445537 len 1428 csum 0x3a18], length 1428
10:42:41.852969 IP 112.26.3.1.44877 > 112.26.3.8.42387: Flags [.], seq 455533:456961, ack 1, win 4017, options [nop,nop,TS val 263646 ecr 49728,mptcp dss ack 3454339951 seq 445856252 subseq 455533 len 1428 csum 0xeb4d], length 1428
10:42:41.901169 IP 112.26.3.1.44877 > 112.26.3.8.42387: Flags [.], seq 456961:458389, ack 1, win 4017, options [nop,nop,TS val 263646 ecr 49728,mptcp dss ack 3454339951 seq 445857680 subseq 456961 len 1428 csum 0xe72], length 1428
10:42:41.922287 IP 112.26.3.8.42387 > 112.26.3.1.44877: Flags [.], ack 436969, win 24429, options [nop,nop,TS val 50040 ecr 262203,mptcp dss ack 445734872], length 0
10:42:41.922618 IP 112.26.3.8.42387 > 112.26.3.1.44877: Flags [.], ack 436969, win 24429, options [nop,nop,TS val 50040 ecr 262203,mptcp dss ack 445734872], length 0
10:42:41.941133 IP 112.26.3.1.44877 > 112.26.3.8.42387: Flags [.], seq 459817:461245, ack 1, win 4017, options [nop,nop,TS val 264063 ecr 50040,mptcp dss ack 3454339951 seq 445863392 subseq 459817 len 1428 csum 0xf7d6], length 1428
10:42:41.974818 IP 112.26.3.1.44877 > 112.26.3.8.42387: Flags [.], seq 458389:459817, ack 1, win 4017, options [nop,nop,TS val 263646 ecr 49728,mptcp dss ack 3454339951 seq 445859108 subseq 458389 len 1428 csum 0xa0cf], length 1428
10:42:41.989606 IP 112.26.3.1.44877 > 112.26.3.8.42387: Flags [.], seq 446965:448393, ack 1, win 4017, options [nop,nop,TS val 263052 ecr 49104,mptcp dss ack 3454339951 seq 445834832 subseq 446965 len 1428 csum 0x7016], length 1428
10:42:42.005453 IP 112.26.3.1.44877 > 112.26.3.8.42387: Flags [.], seq 461245:462673, ack 1, win 4017, options [nop,nop,TS val 264063 ecr 50040,mptcp dss ack 3454339951 seq 445864820 subseq 461245 len 1428 csum 0x6e3f], length 1428
10:42:42.041676 IP 112.26.3.1.44877 > 112.26.3.8.42387: Flags [.], seq 448393:449821, ack 1, win 4017, options [nop,nop,TS val 263052 ecr 49104,mptcp dss ack 3454339951 seq 445836260 subseq 448393 len 1428 csum 0xc0a0], length 1428
10:42:42.060400 IP 112.26.3.1.44877 > 112.26.3.8.42387: Flags [.], seq 462673:464101, ack 1, win 4017, options [nop,nop,TS val 264063 ecr 50040,mptcp dss ack 3454339951 seq 445866248 subseq 462673 len 1428 csum 0xe148], length 1428
10:42:42.066156 IP 112.26.3.1.44877 > 112.26.3.8.42387: Flags [.], seq 459817:461245, ack 1, win 4017, options [nop,nop,TS val 264063 ecr 50040,mptcp dss ack 3454339951 seq 445863392 subseq 459817 len 1428 csum 0xf7d6], length 1428
10:42:42.109402 IP 112.26.3.1.44877 > 112.26.3.8.42387: Flags [.], seq 449821:451249, ack 1, win 4017, options [nop,nop,TS val 263404 ecr 49467,mptcp dss ack 3454339951 seq 445849112 subseq 449821 len 1428 csum 0x7f45], length 1428
10:42:42.116013 IP 112.26.3.1.44877 > 112.26.3.8.42387: Flags [.], seq 464101:465529, ack 1, win 4017, options [nop,nop,TS val 264063 ecr 50040,mptcp dss ack 3454339951 seq 445867676 subseq 464101 len 1428 csum 0xddbb], length 1428
10:42:42.151726 IP 112.26.3.1.44877 > 112.26.3.8.42387: Flags [.], seq 461245:462673, ack 1, win 4017, options [nop,nop,TS val 264063 ecr 50040,mptcp dss ack 3454339951 seq 445864820 subseq 461245 len 1428 csum 0x6e3f], length 1428
10:42:42.155819 IP 112.26.3.1.44877 > 112.26.3.8.42387: Flags [.], seq 465529:466957, ack 1, win 4017, options [nop,nop,TS val 264063 ecr 50040,mptcp dss ack 3454339951 seq 445869104 subseq 465529 len 1428 csum 0x59e8], length 1428
10:42:42.160793 IP 112.26.3.8.42387 > 112.26.3.1.44877: Flags [.], ack 442681, win 24429, options [nop,nop,TS val 50364 ecr 262203,mptcp dss ack 445734872], length 0
10:42:42.161112 IP 112.26.3.8.42387 > 112.26.3.1.44877: Flags [.], ack 442681, win 24429, options [nop,nop,TS val 50364 ecr 262203,mptcp dss ack 445734872], length 0
10:42:42.197939 IP 112.26.3.1.44877 > 112.26.3.8.42387: Flags [.], seq 451249:452677, ack 1, win 4017, options [nop,nop,TS val 263404 ecr 49467,mptcp dss ack 3454339951 seq 445850540 subseq 451249 len 1428 csum 0x6e3a], length 1428
10:42:42.224256 IP 112.26.3.1.44877 > 112.26.3.8.42387: Flags [.], seq 466957:468385, ack 1, win 4017, options [nop,nop,TS val 264063 ecr 50040,mptcp dss ack 3454339951 seq 445870532 subseq 466957 len 1428 csum 0xe5c4], length 1428
10:42:42.263777 IP 112.26.3.1.44877 > 112.26.3.8.42387: Flags [.], seq 462673:464101, ack 1, win 4017, options [nop,nop,TS val 264063 ecr 50040,mptcp dss ack 3454339951 seq 445866248 subseq 462673 len 1428 csum 0xe148], length 1428
10:42:42.289395 IP 112.26.3.1.44877 > 112.26.3.8.42387: Flags [.], seq 452677:454105, ack 1, win 4017, options [nop,nop,TS val 263404 ecr 49467,mptcp dss ack 3454339951 seq 445851968 subseq 452677 len 1428 csum 0xdb7a], length 1428
10:42:42.305872 IP 112.26.3.1.44877 > 112.26.3.8.42387: Flags [.], seq 468385:469813, ack 1, win 4017, options [nop,nop,TS val 264300 ecr 50364,mptcp dss ack 3454339951 seq 445893380 subseq 468385 len 1428 csum 0x8463], length 1428
10:42:42.338230 IP 112.26.3.1.44877 > 112.26.3.8.42387: Flags [.], seq 469813:471241, ack 1, win 4017, options [nop,nop,TS val 264300 ecr 50364,mptcp dss ack 3454339951 seq 445894808 subseq 469813 len 1428 csum 0x77ad], length 1428
10:42:42.357899 IP 112.26.3.1.44877 > 112.26.3.8.42387: Flags [.], seq 454105:455533, ack 1, win 4017, options [nop,nop,TS val 263404 ecr 49467,mptcp dss ack 3454339951 seq 445853396 subseq 454105 len 1428 csum 0xa96e], length 1428
10:42:42.375102 IP 112.26.3.1.44877 > 112.26.3.8.42387: Flags [.], seq 464101:465529, ack 1, win 4017, options [nop,nop,TS val 264063 ecr 50040,mptcp dss ack 3454339951 seq 445867676 subseq 464101 len 1428 csum 0xddbb], length 1428
10:42:42.386662 IP 112.26.3.1.44877 > 112.26.3.8.42387: Flags [.], seq 455533:456961, ack 1, win 4017, options [nop,nop,TS val 263646 ecr 49728,mptcp dss ack 3454339951 seq 445856252 subseq 455533 len 1428 csum 0xeb4d], length 1428
10:42:42.423280 IP 112.26.3.1.44877 > 112.26.3.8.42387: Flags [.], seq 471241:472669, ack 1, win 4017, options [nop,nop,TS val 264300 ecr 50364,mptcp dss ack 3454339951 seq 445896236 subseq 471241 len 1428 csum 0x2b31], length 1428
10:42:42.456493 IP 112.26.3.8.42387 > 112.26.3.1.44877: Flags [.], ack 446965, win 23849, options [nop,nop,TS val 50653 ecr 262748,mptcp dss ack 445772000], length 0
10:42:42.456825 IP 112.26.3.8.42387 > 112.26.3.1.44877: Flags [.], ack 446965, win 23849, options [nop,nop,TS val 50653 ecr 262748,mptcp dss ack 445772000], length 0
10:42:42.475795 IP 112.26.3.1.44877 > 112.26.3.8.42387: Flags [P.], seq 472669:474097, ack 1, win 4017, options [nop,nop,TS val 264300 ecr 50364,mptcp dss ack 3454339951 seq 445897664 subseq 472669 len 1428 csum 0xe3bf], length 1428
10:42:42.495915 IP 112.26.3.1.44877 > 112.26.3.8.42387: Flags [.], seq 465529:466957, ack 1, win 4017, options [nop,nop,TS val 264063 ecr 50040,mptcp dss ack 3454339951 seq 445869104 subseq 465529 len 1428 csum 0x59e8], length 1428
10:42:42.531184 IP 112.26.3.1.44877 > 112.26.3.8.42387: Flags [.], seq 456961:458389, ack 1, win 4017, options [nop,nop,TS val 263646 ecr 49728,mptcp dss ack 3454339951 seq 445857680 subseq 456961 len 1428 csum 0xe72], length 1428
10:42:42.560578 IP 112.26.3.1.44877 > 112.26.3.8.42387: Flags [.], seq 466957:468385, ack 1, win 4017, options [nop,nop,TS val 264063 ecr 50040,mptcp dss ack 3454339951 seq 445870532 subseq 466957 len 1428 csum 0xe5c4], length 1428
10:42:42.564907 IP 112.26.3.1.44877 > 112.26.3.8.42387: Flags [.], seq 474097:475525, ack 1, win 4017, options [nop,nop,TS val 264300 ecr 50364,mptcp dss ack 3454339951 seq 445899092 subseq 474097 len 1428 csum 0x7eaa], length 1428
10:42:42.592987 IP 112.26.3.1.44877 > 112.26.3.8.42387: Flags [.], seq 458389:459817, ack 1, win 4017, options [nop,nop,TS val 263646 ecr 49728,mptcp dss ack 3454339951 seq 445859108 subseq 458389 len 1428 csum 0xa0cf], length 1428
10:42:42.644423 IP 112.26.3.8.42387 > 112.26.3.1.44877: Flags [.], ack 449821, win 23955, options [nop,nop,TS val 50830 ecr 263052,mptcp dss ack 445772000], length 0
10:42:42.644756 IP 112.26.3.8.42387 > 112.26.3.1.44877: Flags [.], ack 449821, win 23955, options [nop,nop,TS val 50830 ecr 263052,mptcp dss ack 445772000], length 0
10:42:42.659789 IP 112.26.3.1.44877 > 112.26.3.8.42387: Flags [.], seq 475525:476953, ack 1, win 4017, options [nop,nop,TS val 264300 ecr 50364,mptcp dss ack 3454339951 seq 445900520 subseq 475525 len 1428 csum 0xbbdd], length 1428
10:42:42.665386 IP 112.26.3.1.44877 > 112.26.3.8.42387: Flags [.], seq 468385:469813, ack 1, win 4017, options [nop,nop,TS val 264300 ecr 50364,mptcp dss ack 3454339951 seq 445893380 subseq 468385 len 1428 csum 0x8463], length 1428
10:42:42.717625 IP 112.26.3.1.44877 > 112.26.3.8.42387: Flags [.], seq 459817:461245, ack 1, win 4017, options [nop,nop,TS val 264063 ecr 50040,mptcp dss ack 3454339951 seq 445863392 subseq 459817 len 1428 csum 0xf7d6], length 1428
10:42:42.761723 IP 112.26.3.1.44877 > 112.26.3.8.42387: Flags [.], seq 476953:478381, ack 1, win 4017, options [nop,nop,TS val 264597 ecr 50653,mptcp dss ack 3454339951 seq 445919084 subseq 476953 len 1428 csum 0xa380], length 1428
10:42:42.763685 IP 112.26.3.1.44877 > 112.26.3.8.42387: Flags [.], seq 461245:462673, ack 1, win 4017, options [nop,nop,TS val 264063 ecr 50040,mptcp dss ack 3454339951 seq 445864820 subseq 461245 len 1428 csum 0x6e3f], length 1428
10:42:42.799274 IP 112.26.3.1.44877 > 112.26.3.8.42387: Flags [.], seq 469813:471241, ack 1, win 4017, options [nop,nop,TS val 264300 ecr 50364,mptcp dss ack 3454339951 seq 445894808 subseq 469813 len 1428 csum 0x77ad], length 1428
