10:42:02.541025 IP 112.26.1.8.37753 > 112.26.1.1.44877: Flags [S], seq 1970655950, win 65535, options [mss 1460,sackOK,TS val 11180 ecr 0,nop,wscale 6,mptcp join id 3 token 0x187b1b60 nonce 0xfb6d5719], length 0
10:42:02.541409 IP 112.26.1.1.44877 > 112.26.1.8.37753: Flags [S.], seq 1299931705, ack 1970655951, win 65535, options [mss 1460,sackOK,TS val 224680 ecr 11180,nop,wscale 6,mptcp join id 6 hmac 0x82c07a907f66f8e nonce 0xef87bfe9], length 0
10:42:02.666771 IP 112.26.1.1.44877 > 112.26.1.8.37753: Flags [S.], seq 1299931705, ack 1970655951, win 65535, options [mss 1460,sackOK,TS val 224680 ecr 11180,nop,wscale 6,mptcp join id 6 hmac 0x82c07a907f66f8e nonce 0xef87bfe9], length 0
10:42:02.796043 IP 112.26.1.8.37753 > 112.26.1.1.44877: Flags [.], ack 1, win 5704, options [nop,nop,TS val 11496 ecr 224680,mptcp join hmac 0x5fd65110db8a70be272dbcb0a2a8679f41c73649], length 0
10:42:02.796467 IP 112.26.1.1.44877 > 112.26.1.8.37753: Flags [.], ack 1, win 2678, options [nop,nop,TS val 224935 ecr 11496,mptcp dss ack 3454339951], length 0
10:42:02.796617 IP 112.26.1.1.44877 > 112.26.1.8.37753: Flags [.], seq 1:1429, ack 1, win 2678, options [nop,nop,TS val 224935 ecr 11496,mptcp dss ack 3454339951 seq 444212624 subseq 1 len 1428 csum 0x994c], length 1428
10:42:02.796720 IP 112.26.1.1.44877 > 112.26.1.8.37753: Flags [.], seq 1429:2857, ack 1, win 2678, options [nop,nop,TS val 224935 ecr 11496,mptcp dss ack 3454339951 seq 444214052 subseq 1429 len 1428 csum 0xa6c6], length 1428
10:42:40.387508 IP 112.26.1.1.44877 > 112.26.1.8.37753: Flags [.], seq 385561:386989, ack 1, win 4017, options [nop,nop,TS val 261961 ecr 48082,mptcp dss ack 3454339951 seq 445777712 subseq 385561 len 1428 csum 0x763d], length 1428
10:42:40.574033 IP 112.26.1.8.37753 > 112.26.1.1.44877: Flags [.], ack 379849, win 23613, options [nop,nop,TS val 48655 ecr 261525,mptcp dss ack 445734872], length 0
10:42:40.574397 IP 112.26.1.1.44877 > 112.26.1.8.37753: Flags [.], seq 388417:389845, ack 1, win 4017, options [nop,nop,TS val 262713 ecr 48655,mptcp dss ack 3454339951 seq 445811984 subseq 388417 len 1428 csum 0x6152], length 1428
10:42:40.654215 IP 112.26.1.8.37753 > 112.26.1.1.44877: Flags [.], ack 381277, win 24429, options [nop,nop,TS val 48779 ecr 261753,mptcp dss ack 445734872], length 0
10:42:40.654540 IP 112.26.1.1.44877 > 112.26.1.8.37753: Flags [.], seq 389845:391273, ack 1, win 4017, options [nop,nop,TS val 262793 ecr 48779,mptcp dss ack 3454339951 seq 445821980 subseq 389845 len 1428 csum 0x480d], length 1428
10:42:40.712338 IP 112.26.1.1.44877 > 112.26.1.8.37753: Flags [.], seq 386989:388417, ack 1, win 4017, options [nop,nop,TS val 262173 ecr 48247,mptcp dss ack 3454339951 seq 445784852 subseq 386989 len 1428 csum 0xdbbb], length 1428
10:42:40.779068 IP 112.26.1.8.37753 > 112.26.1.1.44877: Flags [.], ack 382705, win 24429, options [nop,nop,TS val 48887 ecr 261804,mptcp dss ack 445734872], length 0
10:42:40.779502 IP 112.26.1.1.44877 > 112.26.1.8.37753: Flags [.], seq 391273:392701, ack 1, win 4017, options [nop,nop,TS val 262918 ecr 48887,mptcp dss ack 3454339951 seq 445826264 subseq 391273 len 1428 csum 0x4b68], length 1428
10:42:40.779563 IP 112.26.1.1.44877 > 112.26.1.8.37753: Flags [.], seq 392701:394129, ack 1, win 4017, options [nop,nop,TS val 262918 ecr 48887,mptcp dss ack 3454339951 seq 445827692 subseq 392701 len 1428 csum 0x4041], length 1428
10:42:40.820581 IP 112.26.1.8.37753 > 112.26.1.1.44877: Flags [.], ack 384133, win 24429, options [nop,nop,TS val 49008 ecr 261886,mptcp dss ack 445734872], length 0
10:42:40.820912 IP 112.26.1.1.44877 > 112.26.1.8.37753: Flags [.], seq 394129:395557, ack 1, win 4017, options [nop,nop,TS val 262959 ecr 49008,mptcp dss ack 3454339951 seq 445830548 subseq 394129 len 1428 csum 0xf2], length 1428
10:42:40.880138 IP 112.26.1.8.37753 > 112.26.1.1.44877: Flags [.], ack 385561, win 24429, options [nop,nop,TS val 49093 ecr 261943,mptcp dss ack 445734872], length 0
10:42:40.880507 IP 112.26.1.1.44877 > 112.26.1.8.37753: Flags [.], seq 395557:396985, ack 1, win 4017, options [nop,nop,TS val 263019 ecr 49093,mptcp dss ack 3454339951 seq 445831976 subseq 395557 len 1428 csum 0x291c], length 1428
10:42:41.000641 IP 112.26.1.8.37753 > 112.26.1.1.44877: Flags [.], ack 386989, win 24429, options [nop,nop,TS val 49214 ecr 261961,mptcp dss ack 445734872], length 0
10:42:41.000957 IP 112.26.1.1.44877 > 112.26.1.8.37753: Flags [.], seq 396985:398413, ack 1, win 4017, options [nop,nop,TS val 263139 ecr 49214,mptcp dss ack 3454339951 seq 445839116 subseq 396985 len 1428 csum 0xef2e], length 1428
10:42:41.084420 IP 112.26.1.1.44877 > 112.26.1.8.37753: Flags [.], seq 388417:389845, ack 1, win 4017, options [nop,nop,TS val 262713 ecr 48655,mptcp dss ack 3454339951 seq 445811984 subseq 388417 len 1428 csum 0x6152], length 1428
10:42:41.164028 IP 112.26.1.1.44877 > 112.26.1.8.37753: Flags [.], seq 389845:391273, ack 1, win 4017, options [nop,nop,TS val 262793 ecr 48779,mptcp dss ack 3454339951 seq 445821980 subseq 389845 len 1428 csum 0x480d], length 1428
10:42:41.253023 IP 112.26.1.8.37753 > 112.26.1.1.44877: Flags [.], ack 388417, win 24429, options [nop,nop,TS val 49505 ecr 262173,mptcp dss ack 445734872], length 0
10:42:41.253293 IP 112.26.1.1.44877 > 112.26.1.8.37753: Flags [.], seq 398413:399841, ack 1, win 4017, options [nop,nop,TS val 263392 ecr 49505,mptcp dss ack 3454339951 seq 445847684 subseq 398413 len 1428 csum 0xeac], length 1428
10:42:41.318381 IP 112.26.1.1.44877 > 112.26.1.8.37753: Flags [.], seq 391273:392701, ack 1, win 4017, options [nop,nop,TS val 262918 ecr 48887,mptcp dss ack 3454339951 seq 445826264 subseq 391273 len 1428 csum 0x4b68], length 1428
10:42:41.396530 IP 112.26.1.1.44877 > 112.26.1.8.37753: Flags [.], seq 392701:394129, ack 1, win 4017, options [nop,nop,TS val 262918 ecr 48887,mptcp dss ack 3454339951 seq 445827692 subseq 392701 len 1428 csum 0x4041], length 1428
10:42:41.482545 IP 112.26.1.1.44877 > 112.26.1.8.37753: Flags [.], seq 394129:395557, ack 1, win 4017, options [nop,nop,TS val 262959 ecr 49008,mptcp dss ack 3454339951 seq 445830548 subseq 394129 len 1428 csum 0xf2], length 1428
10:42:41.572912 IP 112.26.1.1.44877 > 112.26.1.8.37753: Flags [.], seq 395557:396985, ack 1, win 4017, options [nop,nop,TS val 263019 ecr 49093,mptcp dss ack 3454339951 seq 445831976 subseq 395557 len 1428 csum 0x291c], length 1428
10:42:41.642703 IP 112.26.1.1.44877 > 112.26.1.8.37753: Flags [.], seq 396985:398413, ack 1, win 4017, options [nop,nop,TS val 263139 ecr 49214,mptcp dss ack 3454339951 seq 445839116 subseq 396985 len 1428 csum 0xef2e], length 1428
10:42:41.718433 IP 112.26.1.8.37753 > 112.26.1.1.44877: Flags [.], ack 389845, win 24429, options [nop,nop,TS val 49876 ecr 262713,mptcp dss ack 445734872], length 0
10:42:41.718762 IP 112.26.1.1.44877 > 112.26.1.8.37753: Flags [.], seq 399841:401269, ack 1, win 4017, options [nop,nop,TS val 263857 ecr 49876,mptcp dss ack 3454339951 seq 445860536 subseq 399841 len 1428 csum 0x52e7], length 1428
10:42:41.811343 IP 112.26.1.8.37753 > 112.26.1.1.44877: Flags [.], ack 391273, win 24429, options [nop,nop,TS val 49956 ecr 262793,mptcp dss ack 445734872], length 0
10:42:41.811724 IP 112.26.1.1.44877 > 112.26.1.8.37753: Flags [.], seq 401269:402697, ack 1, win 4017, options [nop,nop,TS val 263950 ecr 49956,mptcp dss ack 3454339951 seq 445861964 subseq 401269 len 1428 csum 0x5030], length 1428
10:42:41.890512 IP 112.26.1.1.44877 > 112.26.1.8.37753: Flags [.], seq 398413:399841, ack 1, win 4017, options [nop,nop,TS val 263392 ecr 49505,mptcp dss ack 3454339951 seq 445847684 subseq 398413 len 1428 csum 0xeac], length 1428
10:42:41.966195 IP 112.26.1.8.37753 > 112.26.1.1.44877: Flags [.], ack 392701, win 24429, options [nop,nop,TS val 50109 ecr 262918,mptcp dss ack 445734872], length 0
10:42:41.966676 IP 112.26.1.1.44877 > 112.26.1.8.37753: Flags [.], seq 402697:404125, ack 1, win 4017, options [nop,nop,TS val 264105 ecr 50109,mptcp dss ack 3454339951 seq 445876244 subseq 402697 len 1428 csum 0x8d99], length 1428
10:42:42.047328 IP 112.26.1.8.37753 > 112.26.1.1.44877: Flags [.], ack 394129, win 24429, options [nop,nop,TS val 50188 ecr 262918,mptcp dss ack 445734872], length 0
10:42:42.047862 IP 112.26.1.1.44877 > 112.26.1.8.37753: Flags [.], seq 404125:405553, ack 1, win 4017, options [nop,nop,TS val 264186 ecr 50188,mptcp dss ack 3454339951 seq 445880528 subseq 404125 len 1428 csum 0x3a3a], length 1428
10:42:42.047949 IP 112.26.1.1.44877 > 112.26.1.8.37753: Flags [.], seq 405553:406981, ack 1, win 4017, options [nop,nop,TS val 264186 ecr 50188,mptcp dss ack 3454339951 seq 445881956 subseq 405553 len 1428 csum 0xd3db], length 1428
10:42:42.096662 IP 112.26.1.8.37753 > 112.26.1.1.44877: Flags [.], ack 395557, win 24429, options [nop,nop,TS val 50280 ecr 262959,mptcp dss ack 445734872], length 0
10:42:42.097146 IP 112.26.1.1.44877 > 112.26.1.8.37753: Flags [.], seq 406981:408409, ack 1, win 4017, options [nop,nop,TS val 264235 ecr 50280,mptcp dss ack 3454339951 seq 445886240 subseq 406981 len 1428 csum 0xf51a], length 1428
10:42:42.154006 IP 112.26.1.8.37753 > 112.26.1.1.44877: Flags [.], ack 396985, win 24429, options [nop,nop,TS val 50364 ecr 263019,mptcp dss ack 445734872], length 0
10:42:42.154496 IP 112.26.1.1.44877 > 112.26.1.8.37753: Flags [.], seq 408409:409837, ack 1, win 4017, options [nop,nop,TS val 264292 ecr 50364,mptcp dss ack 3454339951 seq 445891952 subseq 408409 len 1428 csum 0x3530], length 1428
10:42:42.220212 IP 112.26.1.1.44877 > 112.26.1.8.37753: Flags [.], seq 399841:401269, ack 1, win 4017, options [nop,nop,TS val 263857 ecr 49876,mptcp dss ack 3454339951 seq 445860536 subseq 399841 len 1428 csum 0x52e7], length 1428
10:42:42.313008 IP 112.26.1.8.37753 > 112.26.1.1.44877: Flags [.], ack 398413, win 24429, options [nop,nop,TS val 50478 ecr 263139,mptcp dss ack 445734872], length 0
10:42:42.313355 IP 112.26.1.1.44877 > 112.26.1.8.37753: Flags [.], seq 409837:411265, ack 1, win 4017, options [nop,nop,TS val 264452 ecr 50478,mptcp dss ack 3454339951 seq 445911944 subseq 409837 len 1428 csum 0xd79a], length 1428
10:42:42.342720 IP 112.26.1.1.44877 > 112.26.1.8.37753: Flags [.], seq 401269:402697, ack 1, win 4017, options [nop,nop,TS val 263950 ecr 49956,mptcp dss ack 3454339951 seq 445861964 subseq 401269 len 1428 csum 0x5030], length 1428
10:42:42.426863 IP 112.26.1.8.37753 > 112.26.1.1.44877: Flags [.], ack 399841, win 23955, options [nop,nop,TS val 50681 ecr 263392,mptcp dss ack 445772000], length 0
10:42:42.427335 IP 112.26.1.1.44877 > 112.26.1.8.37753: Flags [.], seq 411265:412693, ack 1, win 4017, options [nop,nop,TS val 264566 ecr 50681,mptcp dss ack 3454339951 seq 445914800 subseq 411265 len 1428 csum 0x6d6d], length 1428
10:42:42.481276 IP 112.26.1.1.44877 > 112.26.1.8.37753: Flags [.], seq 402697:404125, ack 1, win 4017, options [nop,nop,TS val 264105 ecr 50109,mptcp dss ack 3454339951 seq 445876244 subseq 402697 len 1428 csum 0x8d99], length 1428
10:42:42.582191 IP 112.26.1.1.44877 > 112.26.1.8.37753: Flags [.], seq 404125:405553, ack 1, win 4017, options [nop,nop,TS val 264186 ecr 50188,mptcp dss ack 3454339951 seq 445880528 subseq 404125 len 1428 csum 0x3a3a], length 1428
10:42:42.688122 IP 112.26.1.1.44877 > 112.26.1.8.37753: Flags [.], seq 405553:406981, ack 1, win 4017, options [nop,nop,TS val 264186 ecr 50188,mptcp dss ack 3454339951 seq 445881956 subseq 405553 len 1428 csum 0xd3db], length 1428
10:42:42.760593 IP 112.26.1.1.44877 > 112.26.1.8.37753: Flags [.], seq 406981:408409, ack 1, win 4017, options [nop,nop,TS val 264235 ecr 50280,mptcp dss ack 3454339951 seq 445886240 subseq 406981 len 1428 csum 0xf51a], length 1428
10:42:42.794781 IP 112.26.1.8.37753 > 112.26.1.1.44877: Flags [.], ack 401269, win 23955, options [nop,nop,TS val 51012 ecr 263857,mptcp dss ack 445772000], length 0
10:42:42.795134 IP 112.26.1.1.44877 > 112.26.1.8.37753: Flags [.], seq 412693:414121, ack 1, win 4017, options [nop,nop,TS val 264934 ecr 51012,mptcp dss ack 3454339951 seq 445846256 subseq 412693 len 1428 csum 0x572c], length 1428
10:42:42.875306 IP 112.26.1.1.44877 > 112.26.1.8.37753: Flags [.], seq 408409:409837, ack 1, win 4017, options [nop,nop,TS val 264292 ecr 50364,mptcp dss ack 3454339951 seq 445891952 subseq 408409 len 1428 csum 0x3530], length 1428
10:42:42.969710 IP 112.26.1.1.44877 > 112.26.1.8.37753: Flags [.], seq 409837:411265, ack 1, win 4017, options [nop,nop,TS val 264452 ecr 50478,mptcp dss ack 3454339951 seq 445911944 subseq 409837 len 1428 csum 0xd79a], length 1428
10:42:43.039617 IP 112.26.1.8.37753 > 112.26.1.1.44877: Flags [.], ack 402697, win 23955, options [nop,nop,TS val 51175 ecr 263950,mptcp dss ack 445772000], length 0
10:42:43.039967 IP 112.26.1.1.44877 > 112.26.1.8.37753: Flags [.], seq 414121:415549, ack 1, win 4017, options [nop,nop,TS val 265178 ecr 51175,mptcp dss ack 3454339951 seq 445883384 subseq 414121 len 1428 csum 0xbdc], length 1428
10:42:43.125535 IP 112.26.1.1.44877 > 112.26.1.8.37753: Flags [.], seq 411265:412693, ack 1, win 4017, options [nop,nop,TS val 264566 ecr 50681,mptcp dss ack 3454339951 seq 445914800 subseq 411265 len 1428 csum 0x6d6d], length 1428
10:42:43.203596 IP 112.26.1.8.37753 > 112.26.1.1.44877: Flags [.], ack 404125, win 24050, options [nop,nop,TS val 51360 ecr 264105,mptcp dss ack 445801988], length 0
10:42:43.203975 IP 112.26.1.1.44877 > 112.26.1.8.37753: Flags [.], seq 415549:416977, ack 1, win 4017, options [nop,nop,TS val 265342 ecr 51360,mptcp dss ack 3454339951 seq 445906232 subseq 415549 len 1428 csum 0xa4d], length 1428
10:42:43.204046 IP 112.26.1.1.44877 > 112.26.1.8.37753: Flags [.], seq 416977:418405, ack 1, win 4017, options [nop,nop,TS val 265342 ecr 51360,mptcp dss ack 3454339951 seq 445907660 subseq 416977 len 1428 csum 0x2bb9], length 1428
10:42:43.240964 IP 112.26.1.8.37753 > 112.26.1.1.44877: Flags [.], ack 406981, win 24378, options [nop,nop,TS val 51480 ecr 264186,mptcp dss ack 445846256], length 0
10:42:43.241466 IP 112.26.1.1.44877 > 112.26.1.8.37753: Flags [.], seq 418405:419833, ack 1, win 4017, options [nop,nop,TS val 265380 ecr 51480,mptcp dss ack 3454339951 seq 445926224 subseq 418405 len 1428 csum 0x1fe3], length 1428
10:42:43.241658 IP 112.26.1.1.44877 > 112.26.1.8.37753: Flags [.], seq 419833:421261, ack 1, win 4017, options [nop,nop,TS val 265380 ecr 51480,mptcp dss ack 3454339951 seq 445931936 subseq 419833 len 1428 csum 0x1f88], length 1428
10:42:43.304385 IP 112.26.1.1.44877 > 112.26.1.8.37753: Flags [.], seq 412693:414121, ack 1, win 4017, options [nop,nop,TS val 264934 ecr 51012,mptcp dss ack 3454339951 seq 445846256 subseq 412693 len 1428 csum 0x572c], length 1428
10:42:43.381250 IP 112.26.1.8.37753 > 112.26.1.1.44877: Flags [.], ack 409837, win 24378, options [nop,nop,TS val 51728 ecr 264235,mptcp dss ack 445846256], length 0
10:42:43.381643 IP 112.26.1.1.44877 > 112.26.1.8.37753: Flags [.], seq 421261:422689, ack 1, win 4017, options [nop,nop,TS val 265520 ecr 51728,mptcp dss ack 3454339951 seq 445940504 subseq 421261 len 1428 csum 0xcb27], length 1428
10:42:43.381741 IP 112.26.1.1.44877 > 112.26.1.8.37753: Flags [.], seq 422689:424117, ack 1, win 4017, options [nop,nop,TS val 265520 ecr 51728,mptcp dss ack 3454339951 seq 445941932 subseq 422689 len 1428 csum 0xbef1], length 1428
10:42:43.479341 IP 112.26.1.1.44877 > 112.26.1.8.37753: Flags [.], seq 414121:415549, ack 1, win 4017, options [nop,nop,TS val 265178 ecr 51175,mptcp dss ack 3454339951 seq 445883384 subseq 414121 len 1428 csum 0xbdc], length 1428
10:42:43.593342 IP 112.26.1.1.44877 > 112.26.1.8.37753: Flags [.], seq 415549:416977, ack 1, win 4017, options [nop,nop,TS val 265342 ecr 51360,mptcp dss ack 3454339951 seq 445906232 subseq 415549 len 1428 csum 0xa4d], length 1428
10:42:43.657956 IP 112.26.1.1.44877 > 112.26.1.8.37753: Flags [.], seq 416977:418405, ack 1, win 4017, options [nop,nop,TS val 265342 ecr 51360,mptcp dss ack 3454339951 seq 445907660 subseq 416977 len 1428 csum 0x2bb9], length 1428
10:42:43.751303 IP 112.26.1.8.37753 > 112.26.1.1.44877: Flags [.], ack 412693, win 24378, options [nop,nop,TS val 52064 ecr 264452,mptcp dss ack 445846256], length 0
10:42:43.751683 IP 112.26.1.1.44877 > 112.26.1.8.37753: Flags [.], seq 424117:425545, ack 1, win 4017, options [nop,nop,TS val 265890 ecr 52064,mptcp dss ack 3454339951 seq 445967636 subseq 424117 len 1428 csum 0x5aaa], length 1428
10:42:43.751755 IP 112.26.1.1.44877 > 112.26.1.8.37753: Flags [.], seq 425545:426973, ack 1, win 4017, options [nop,nop,TS val 265890 ecr 52064,mptcp dss ack 3454339951 seq 445969064 subseq 425545 len 1428 csum 0x74dd], length 1428
10:42:43.751953 IP 112.26.1.1.44877 > 112.26.1.8.37753: Flags [.], seq 426973:428401, ack 1, win 4017, options [nop,nop,TS val 265890 ecr 52064,mptcp dss ack 3454339951 seq 445970492 subseq 426973 len 1428 csum 0xe269], length 1428
10:42:43.805347 IP 112.26.1.1.44877 > 112.26.1.8.37753: Flags [.], seq 418405:419833, ack 1, win 4017, options [nop,nop,TS val 265380 ecr 51480,mptcp dss ack 3454339951 seq 445926224 subseq 418405 len 1428 csum 0x1fe3], length 1428
10:42:43.866657 IP 112.26.1.1.44877 > 112.26.1.8.37753: Flags [.], seq 419833:421261, ack 1, win 4017, options [nop,nop,TS val 265380 ecr 51480,mptcp dss ack 3454339951 seq 445931936 subseq 419833 len 1428 csum 0x1f88], length 1428
10:42:43.936272 IP 112.26.1.8.37753 > 112.26.1.1.44877: Flags [.], ack 415549, win 24391, options [nop,nop,TS val 52270 ecr 264934,mptcp dss ack 445893380], length 0
10:42:43.936809 IP 112.26.1.1.44877 > 112.26.1.8.37753: Flags [.], seq 428401:429829, ack 1, win 4017, options [nop,nop,TS val 266075 ecr 52270,mptcp dss ack 3454339951 seq 445979060 subseq 428401 len 1428 csum 0x990c], length 1428
10:42:43.936871 IP 112.26.1.1.44877 > 112.26.1.8.37753: Flags [.], seq 429829:431257, ack 1, win 4017, options [nop,nop,TS val 266075 ecr 52270,mptcp dss ack 3454339951 seq 445980488 subseq 429829 len 1428 csum 0xdcbf], length 1428
10:42:43.937130 IP 112.26.1.1.44877 > 112.26.1.8.37753: Flags [.], seq 431257:432685, ack 1, win 4017, options [nop,nop,TS val 266075 ecr 52270,mptcp dss ack 3454339951 seq 445981916 subseq 431257 len 1428 csum 0x25d7], length 1428
10:42:43.937239 IP 112.26.1.1.44877 > 112.26.1.8.37753: Flags [.], seq 432685:434113, ack 1, win 4017, options [nop,nop,TS val 266075 ecr 52270,mptcp dss ack 3454339951 seq 445983344 subseq 432685 len 1428 csum 0xbe97], length 1428
10:42:43.979380 IP 112.26.1.1.44877 > 112.26.1.8.37753: Flags [.], seq 421261:422689, ack 1, win 4017, options [nop,nop,TS val 265520 ecr 51728,mptcp dss ack 3454339951 seq 445940504 subseq 421261 len 1428 csum 0xcb27], length 1428
10:42:44.045961 IP 112.26.1.1.44877 > 112.26.1.8.37753: Flags [.], seq 422689:424117, ack 1, win 4017, options [nop,nop,TS val 265520 ecr 51728,mptcp dss ack 3454339951 seq 445941932 subseq 422689 len 1428 csum 0xbef1], length 1428
10:42:44.153967 IP 112.26.1.8.37753 > 112.26.1.1.44877: Flags [.], ack 418405, win 24391, options [nop,nop,TS val 52450 ecr 265342,mptcp dss ack 445893380], length 0
10:42:44.154306 IP 112.26.1.1.44877 > 112.26.1.8.37753: Flags [.], seq 434113:435541, ack 1, win 4017, options [nop,nop,TS val 266293 ecr 52450,mptcp dss ack 3454339951 seq 445990484 subseq 434113 len 1428 csum 0x486a], length 1428
10:42:44.154380 IP 112.26.1.1.44877 > 112.26.1.8.37753: Flags [.], seq 435541:436969, ack 1, win 4017, options [nop,nop,TS val 266293 ecr 52450,mptcp dss ack 3454339951 seq 445991912 subseq 435541 len 1428 csum 0x2c0c], length 1428
10:42:44.219112 IP 112.26.1.1.44877 > 112.26.1.8.37753: Flags [.], seq 424117:425545, ack 1, win 4017, options [nop,nop,TS val 265890 ecr 52064,mptcp dss ack 3454339951 seq 445967636 subseq 424117 len 1428 csum 0x5aaa], length 1428
10:42:44.310426 IP 112.26.1.1.44877 > 112.26.1.8.37753: Flags [.], seq 425545:426973, ack 1, win 4017, options [nop,nop,TS val 265890 ecr 52064,mptcp dss ack 3454339951 seq 445969064 subseq 425545 len 1428 csum 0x74dd], length 1428
10:42:44.401469 IP 112.26.1.1.44877 > 112.26.1.8.37753: Flags [.], seq 426973:428401, ack 1, win 4017, options [nop,nop,TS val 265890 ecr 52064,mptcp dss ack 3454339951 seq 445970492 subseq 426973 len 1428 csum 0xe269], length 1428
10:42:44.492133 IP 112.26.1.1.44877 > 112.26.1.8.37753: Flags [.], seq 428401:429829, ack 1, win 4017, options [nop,nop,TS val 266075 ecr 52270,mptcp dss ack 3454339951 seq 445979060 subseq 428401 len 1428 csum 0x990c], length 1428
10:42:44.557838 IP 112.26.1.1.44877 > 112.26.1.8.37753: Flags [.], seq 429829:431257, ack 1, win 4017, options [nop,nop,TS val 266075 ecr 52270,mptcp dss ack 3454339951 seq 445980488 subseq 429829 len 1428 csum 0xdcbf], length 1428
10:42:44.612123 IP 112.26.1.8.37753 > 112.26.1.1.44877: Flags [.], ack 422689, win 24391, options [nop,nop,TS val 52864 ecr 265380,mptcp dss ack 445893380], length 0
10:42:44.612608 IP 112.26.1.1.44877 > 112.26.1.8.37753: Flags [.], seq 436969:438397, ack 1, win 4017, options [nop,nop,TS val 266751 ecr 52864,mptcp dss ack 3454339951 seq 446000480 subseq 436969 len 1428 csum 0x6ad3], length 1428
10:42:44.612678 IP 112.26.1.1.44877 > 112.26.1.8.37753: Flags [.], seq 438397:439825, ack 1, win 4017, options [nop,nop,TS val 266751 ecr 52864,mptcp dss ack 3454339951 seq 446001908 subseq 438397 len 1428 csum 0xbbb0], length 1428
10:42:44.612857 IP 112.26.1.1.44877 > 112.26.1.8.37753: Flags [.], seq 439825:441253, ack 1, win 4017, options [nop,nop,TS val 266751 ecr 52864,mptcp dss ack 3454339951 seq 446003336 subseq 439825 len 1428 csum 0x51f9], length 1428
10:42:44.613088 IP 112.26.1.1.44877 > 112.26.1.8.37753: Flags [.], seq 441253:442681, ack 1, win 4017, options [nop,nop,TS val 266752 ecr 52864,mptcp dss ack 3454339951 seq 446004764 subseq 441253 len 1428 csum 0xfcf7], length 1428
10:42:44.613401 IP 112.26.1.1.44877 > 112.26.1.8.37753: Flags [.], seq 442681:444109, ack 1, win 4017, options [nop,nop,TS val 266752 ecr 52864,mptcp dss ack 3454339951 seq 446006192 subseq 442681 len 1428 csum 0xd26e], length 1428
10:42:44.693444 IP 112.26.1.1.44877 > 112.26.1.8.37753: Flags [.], seq 431257:432685, ack 1, win 4017, options [nop,nop,TS val 266075 ecr 52270,mptcp dss ack 3454339951 seq 445981916 subseq 431257 len 1428 csum 0x25d7], length 1428
10:42:44.831251 IP 112.26.1.1.44877 > 112.26.1.8.37753: Flags [.], seq 432685:434113, ack 1, win 4017, options [nop,nop,TS val 266075 ecr 52270,mptcp dss ack 3454339951 seq 445983344 subseq 432685 len 1428 csum 0xbe97], length 1428
10:42:44.887000 IP 112.26.1.1.44877 > 112.26.1.8.37753: Flags [.], seq 434113:435541, ack 1, win 4017, options [nop,nop,TS val 266293 ecr 52450,mptcp dss ack 3454339951 seq 445990484 subseq 434113 len 1428 csum 0x486a], length 1428
10:42:44.958960 IP 112.26.1.1.44877 > 112.26.1.8.37753: Flags [.], seq 435541:436969, ack 1, win 4017, options [nop,nop,TS val 266293 ecr 52450,mptcp dss ack 3454339951 seq 445991912 subseq 435541 len 1428 csum 0x2c0c], length 1428
10:42:45.013777 IP 112.26.1.8.37753 > 112.26.1.1.44877: Flags [.], ack 426973, win 24391, options [nop,nop,TS val 53176 ecr 265520,mptcp dss ack 445893380], length 0
10:42:45.014129 IP 112.26.1.1.44877 > 112.26.1.8.37753: Flags [.], seq 444109:445537, ack 1, win 4017, options [nop,nop,TS val 267152 ecr 53176,mptcp dss ack 3454339951 seq 446020472 subseq 444109 len 1428 csum 0xa2a1], length 1428
10:42:45.014203 IP 112.26.1.1.44877 > 112.26.1.8.37753: Flags [.], seq 445537:446965, ack 1, win 4017, options [nop,nop,TS val 267152 ecr 53176,mptcp dss ack 3454339951 seq 446021900 subseq 445537 len 1428 csum 0xa1fd], length 1428
10:42:45.014358 IP 112.26.1.1.44877 > 112.26.1.8.37753: Flags [.], seq 446965:448393, ack 1, win 4017, options [nop,nop,TS val 267152 ecr 53176,mptcp dss ack 3454339951 seq 446023328 subseq 446965 len 1428 csum 0x7539], length 1428
10:42:45.055914 IP 112.26.1.1.44877 > 112.26.1.8.37753: Flags [.], seq 436969:438397, ack 1, win 4017, options [nop,nop,TS val 266751 ecr 52864,mptcp dss ack 3454339951 seq 446000480 subseq 436969 len 1428 csum 0x6ad3], length 1428
10:42:45.161882 IP 112.26.1.8.37753 > 112.26.1.1.44877: Flags [.], ack 432685, win 24391, options [nop,nop,TS val 53486 ecr 265890,mptcp dss ack 445893380], length 0
10:42:45.162390 IP 112.26.1.1.44877 > 112.26.1.8.37753: Flags [.], seq 448393:449821, ack 1, win 4017, options [nop,nop,TS val 267301 ecr 53486,mptcp dss ack 3454339951 seq 446026184 subseq 448393 len 1428 csum 0xbc37], length 1428
10:42:45.162469 IP 112.26.1.1.44877 > 112.26.1.8.37753: Flags [.], seq 449821:451249, ack 1, win 4017, options [nop,nop,TS val 267301 ecr 53486,mptcp dss ack 3454339951 seq 446027612 subseq 449821 len 1428 csum 0x1b90], length 1428
10:42:45.162713 IP 112.26.1.1.44877 > 112.26.1.8.37753: Flags [.], seq 451249:452677, ack 1, win 4017, options [nop,nop,TS val 267301 ecr 53486,mptcp dss ack 3454339951 seq 446029040 subseq 451249 len 1428 csum 0x7ba9], length 1428
10:42:45.162857 IP 112.26.1.1.44877 > 112.26.1.8.37753: Flags [.], seq 452677:454105, ack 1, win 4017, options [nop,nop,TS val 267301 ecr 53486,mptcp dss ack 3454339951 seq 446030468 subseq 452677 len 1428 csum 0x3c17], length 1428
10:42:45.228835 IP 112.26.1.1.44877 > 112.26.1.8.37753: Flags [.], seq 438397:439825, ack 1, win 4017, options [nop,nop,TS val 266751 ecr 52864,mptcp dss ack 3454339951 seq 446001908 subseq 438397 len 1428 csum 0xbbb0], length 1428
10:42:45.299048 IP 112.26.1.1.44877 > 112.26.1.8.37753: Flags [.], seq 439825:441253, ack 1, win 4017, options [nop,nop,TS val 266751 ecr 52864,mptcp dss ack 3454339951 seq 446003336 subseq 439825 len 1428 csum 0x51f9], length 1428
10:42:45.376203 IP 112.26.1.1.44877 > 112.26.1.8.37753: Flags [.], seq 441253:442681, ack 1, win 4017, options [nop,nop,TS val 266752 ecr 52864,mptcp dss ack 3454339951 seq 446004764 subseq 441253 len 1428 csum 0xfcf7], length 1428
10:42:45.463828 IP 112.26.1.1.44877 > 112.26.1.8.37753: Flags [.], seq 442681:444109, ack 1, win 4017, options [nop,nop,TS val 266752 ecr 52864,mptcp dss ack 3454339951 seq 446006192 subseq 442681 len 1428 csum 0xd26e], length 1428
10:42:45.539278 IP 112.26.1.1.44877 > 112.26.1.8.37753: Flags [.], seq 444109:445537, ack 1, win 4017, options [nop,nop,TS val 267152 ecr 53176,mptcp dss ack 3454339951 seq 446020472 subseq 444109 len 1428 csum 0xa2a1], length 1428
10:42:45.599253 IP 112.26.1.8.37753 > 112.26.1.1.44877: Flags [.], ack 438397, win 24391, options [nop,nop,TS val 53848 ecr 266075,mptcp dss ack 445893380], length 0
10:42:45.599657 IP 112.26.1.1.44877 > 112.26.1.8.37753: Flags [.], seq 454105:455533, ack 1, win 4017, options [nop,nop,TS val 267738 ecr 53848,mptcp dss ack 3454339951 seq 446036180 subseq 454105 len 1428 csum 0xc909], length 1428
10:42:45.599738 IP 112.26.1.1.44877 > 112.26.1.8.37753: Flags [.], seq 455533:456961, ack 1, win 4017, options [nop,nop,TS val 267738 ecr 53848,mptcp dss ack 3454339951 seq 446037608 subseq 455533 len 1428 csum 0xa956], length 1428
10:42:45.599901 IP 112.26.1.1.44877 > 112.26.1.8.37753: Flags [.], seq 456961:458389, ack 1, win 4017, options [nop,nop,TS val 267738 ecr 53848,mptcp dss ack 3454339951 seq 446039036 subseq 456961 len 1428 csum 0x373d], length 1428
10:42:45.600008 IP 112.26.1.1.44877 > 112.26.1.8.37753: Flags [.], seq 458389:459817, ack 1, win 4017, options [nop,nop,TS val 267738 ecr 53848,mptcp dss ack 3454339951 seq 446040464 subseq 458389 len 1428 csum 0xb5e5], length 1428
10:42:45.600158 IP 112.26.1.1.44877 > 112.26.1.8.37753: Flags [.], seq 459817:461245, ack 1, win 4017, options [nop,nop,TS val 267738 ecr 53848,mptcp dss ack 3454339951 seq 446041892 subseq 459817 len 1428 csum 0x9326], length 1428
10:42:45.600263 IP 112.26.1.1.44877 > 112.26.1.8.37753: Flags [.], seq 461245:462673, ack 1, win 4017, options [nop,nop,TS val 267738 ecr 53848,mptcp dss ack 3454339951 seq 446043320 subseq 461245 len 1428 csum 0xa952], length 1428
10:42:45.706818 IP 112.26.1.1.44877 > 112.26.1.8.37753: Flags [.], seq 445537:446965, ack 1, win 4017, options [nop,nop,TS val 267152 ecr 53176,mptcp dss ack 3454339951 seq 446021900 subseq 445537 len 1428 csum 0xa1fd], length 1428
10:42:45.823394 IP 112.26.1.1.44877 > 112.26.1.8.37753: Flags [.], seq 446965:448393, ack 1, win 4017, options [nop,nop,TS val 267152 ecr 53176,mptcp dss ack 3454339951 seq 446023328 subseq 446965 len 1428 csum 0x7539], length 1428
10:42:45.911061 IP 112.26.1.1.44877 > 112.26.1.8.37753: Flags [.], seq 449821:451249, ack 1, win 4017, options [nop,nop,TS val 267301 ecr 53486,mptcp dss ack 3454339951 seq 446027612 subseq 449821 len 1428 csum 0x1b90], length 1428
10:42:46.015354 IP 112.26.1.1.44877 > 112.26.1.8.37753: Flags [.], seq 451249:452677, ack 1, win 4017, options [nop,nop,TS val 267301 ecr 53486,mptcp dss ack 3454339951 seq 446029040 subseq 451249 len 1428 csum 0x7ba9], length 1428
10:42:46.096749 IP 112.26.1.8.37753 > 112.26.1.1.44877: Flags [.], ack 442681, win 24391, options [nop,nop,TS val 54176 ecr 266751,mptcp dss ack 445893380], length 0
10:42:46.097137 IP 112.26.1.1.44877 > 112.26.1.8.37753: Flags [.], seq 462673:464101, ack 1, win 4017, options [nop,nop,TS val 268236 ecr 54176,mptcp dss ack 3454339951 seq 446054744 subseq 462673 len 1428 csum 0x6d62], length 1428
10:42:46.097216 IP 112.26.1.1.44877 > 112.26.1.8.37753: Flags [.], seq 464101:465529, ack 1, win 4017, options [nop,nop,TS val 268236 ecr 54176,mptcp dss ack 3454339951 seq 446056172 subseq 464101 len 1428 csum 0x9cc4], length 1428
10:42:46.097370 IP 112.26.1.1.44877 > 112.26.1.8.37753: Flags [.], seq 465529:466957, ack 1, win 4017, options [nop,nop,TS val 268236 ecr 54176,mptcp dss ack 3454339951 seq 446057600 subseq 465529 len 1428 csum 0x525f], length 1428
10:42:46.097478 IP 112.26.1.1.44877 > 112.26.1.8.37753: Flags [.], seq 466957:468385, ack 1, win 4017, options [nop,nop,TS val 268236 ecr 54176,mptcp dss ack 3454339951 seq 446059028 subseq 466957 len 1428 csum 0x75b3], length 1428
10:42:46.097659 IP 112.26.1.1.44877 > 112.26.1.8.37753: Flags [.], seq 468385:469813, ack 1, win 4017, options [nop,nop,TS val 268236 ecr 54176,mptcp dss ack 3454339951 seq 446060456 subseq 468385 len 1428 csum 0x1434], length 1428
10:42:46.167454 IP 112.26.1.1.44877 > 112.26.1.8.37753: Flags [.], seq 454105:455533, ack 1, win 4017, options [nop,nop,TS val 267738 ecr 53848,mptcp dss ack 3454339951 seq 446036180 subseq 454105 len 1428 csum 0xc909], length 1428
10:42:46.273083 IP 112.26.1.8.37753 > 112.26.1.1.44877: Flags [.], ack 445537, win 24391, options [nop,nop,TS val 54424 ecr 266752,mptcp dss ack 445893380], length 0
10:42:46.273443 IP 112.26.1.1.44877 > 112.26.1.8.37753: Flags [.], seq 469813:471241, ack 1, win 4017, options [nop,nop,TS val 268412 ecr 54424,mptcp dss ack 3454339951 seq 446067596 subseq 469813 len 1428 csum 0x7a0a], length 1428
10:42:46.273527 IP 112.26.1.1.44877 > 112.26.1.8.37753: Flags [.], seq 471241:472669, ack 1, win 4017, options [nop,nop,TS val 268412 ecr 54424,mptcp dss ack 3454339951 seq 446069024 subseq 471241 len 1428 csum 0xa834], length 1428
10:42:46.355522 IP 112.26.1.1.44877 > 112.26.1.8.37753: Flags [.], seq 455533:456961, ack 1, win 4017, options [nop,nop,TS val 267738 ecr 53848,mptcp dss ack 3454339951 seq 446037608 subseq 455533 len 1428 csum 0xa956], length 1428
10:42:46.459340 IP 112.26.1.1.44877 > 112.26.1.8.37753: Flags [.], seq 456961:458389, ack 1, win 4017, options [nop,nop,TS val 267738 ecr 53848,mptcp dss ack 3454339951 seq 446039036 subseq 456961 len 1428 csum 0x373d], length 1428
10:42:46.550194 IP 112.26.1.1.44877 > 112.26.1.8.37753: Flags [.], seq 458389:459817, ack 1, win 4017, options [nop,nop,TS val 267738 ecr 53848,mptcp dss ack 3454339951 seq 446040464 subseq 458389 len 1428 csum 0xb5e5], length 1428
10:42:46.634182 IP 112.26.1.8.37753 > 112.26.1.1.44877: Flags [.], ack 448393, win 24391, options [nop,nop,TS val 54705 ecr 267152,nop,nop,sack 1 {449821:451249},mptcp dss ack 445893380], length 0
10:42:46.634586 IP 112.26.1.1.44877 > 112.26.1.8.37753: Flags [.], seq 472669:474097, ack 1, win 4017, options [nop,nop,TS val 268773 ecr 54705,mptcp dss ack 3454339951 seq 446084732 subseq 472669 len 1428 csum 0x1125], length 1428
10:42:46.634712 IP 112.26.1.1.44877 > 112.26.1.8.37753: Flags [.], seq 474097:475525, ack 1, win 4017, options [nop,nop,TS val 268773 ecr 54705,mptcp dss ack 3454339951 seq 446086160 subseq 474097 len 1428 csum 0x4a09], length 1428
10:42:46.634883 IP 112.26.1.1.44877 > 112.26.1.8.37753: Flags [.], seq 475525:476953, ack 1, win 4017, options [nop,nop,TS val 268773 ecr 54705,mptcp dss ack 3454339951 seq 446087588 subseq 475525 len 1428 csum 0x6723], length 1428
10:42:46.634992 IP 112.26.1.1.44877 > 112.26.1.8.37753: Flags [.], seq 476953:478381, ack 1, win 4017, options [nop,nop,TS val 268773 ecr 54705,mptcp dss ack 3454339951 seq 446089016 subseq 476953 len 1428 csum 0xf54a], length 1428
10:42:46.709675 IP 112.26.1.8.37753 > 112.26.1.1.44877: Flags [.], ack 448393, win 24391, options [nop,nop,TS val 54831 ecr 267152,nop,nop,sack 1 {449821:452677},mptcp dss ack 445893380], length 0
10:42:46.748057 IP 112.26.1.1.44877 > 112.26.1.8.37753: Flags [.], seq 462673:464101, ack 1, win 4017, options [nop,nop,TS val 268236 ecr 54176,mptcp dss ack 3454339951 seq 446054744 subseq 462673 len 1428 csum 0x6d62], length 1428
10:42:46.838309 IP 112.26.1.1.44877 > 112.26.1.8.37753: Flags [.], seq 478381:479809, ack 1, win 4017, options [nop,nop,TS val 268977 ecr 54831,mptcp dss ack 3454339951 seq 446090444 subseq 478381 len 1428 csum 0xf8c7], length 1428
10:42:46.857447 IP 112.26.1.8.37753 > 112.26.1.1.44877: Flags [.], ack 448393, win 24391, options [nop,nop,TS val 54959 ecr 267152,nop,nop,sack 2 {454105:455533}{449821:452677},mptcp dss ack 445893380], length 0
10:42:46.857806 IP 112.26.1.1.44877 > 112.26.1.8.37753: Flags [.], seq 448393:449821, ack 1, win 4017, options [nop,nop,TS val 268996 ecr 54959,mptcp dss ack 3454339951 seq 446026184 subseq 448393 len 1428 csum 0xbc37], length 1428
10:42:46.901160 IP 112.26.1.1.44877 > 112.26.1.8.37753: Flags [.], seq 464101:465529, ack 1, win 4017, options [nop,nop,TS val 268236 ecr 54176,mptcp dss ack 3454339951 seq 446056172 subseq 464101 len 1428 csum 0x9cc4], length 1428
10:42:46.979202 IP 112.26.1.1.44877 > 112.26.1.8.37753: Flags [.], seq 465529:466957, ack 1, win 4017, options [nop,nop,TS val 268236 ecr 54176,mptcp dss ack 3454339951 seq 446057600 subseq 465529 len 1428 csum 0x525f], length 1428
10:42:47.079379 IP 112.26.1.1.44877 > 112.26.1.8.37753: Flags [.], seq 466957:468385, ack 1, win 4017, options [nop,nop,TS val 268236 ecr 54176,mptcp dss ack 3454339951 seq 446059028 subseq 466957 len 1428 csum 0x75b3], length 1428
10:42:47.166463 IP 112.26.1.1.44877 > 112.26.1.8.37753: Flags [.], seq 468385:469813, ack 1, win 4017, options [nop,nop,TS val 268236 ecr 54176,mptcp dss ack 3454339951 seq 446060456 subseq 468385 len 1428 csum 0x1434], length 1428
10:42:47.249169 IP 112.26.1.1.44877 > 112.26.1.8.37753: Flags [.], seq 471241:472669, ack 1, win 4017, options [nop,nop,TS val 268412 ecr 54424,mptcp dss ack 3454339951 seq 446069024 subseq 471241 len 1428 csum 0xa834], length 1428
10:42:47.348551 IP 112.26.1.8.37753 > 112.26.1.1.44877: Flags [.], ack 448393, win 24391, options [nop,nop,TS val 55342 ecr 267152,nop,nop,sack 2 {454105:459817}{449821:452677},mptcp dss ack 445893380], length 0
10:42:47.348858 IP 112.26.1.1.44877 > 112.26.1.8.37753: Flags [.], seq 452677:454105, ack 1, win 4017, options [nop,nop,TS val 269487 ecr 55342,mptcp dss ack 3454339951 seq 446030468 subseq 452677 len 1428 csum 0x3c17], length 1428
10:42:47.355209 IP 112.26.1.1.44877 > 112.26.1.8.37753: Flags [.], seq 479809:481237, ack 1, win 4017, options [nop,nop,TS val 269493 ecr 55342,mptcp dss ack 3454339951 seq 446104724 subseq 479809 len 1428 csum 0x524d], length 1428
10:42:47.462913 IP 112.26.1.1.44877 > 112.26.1.8.37753: Flags [.], seq 474097:475525, ack 1, win 4017, options [nop,nop,TS val 268773 ecr 54705,mptcp dss ack 3454339951 seq 446086160 subseq 474097 len 1428 csum 0x4a09], length 1428
10:42:47.541032 IP 112.26.1.1.44877 > 112.26.1.8.37753: Flags [.], seq 475525:476953, ack 1, win 4017, options [nop,nop,TS val 268773 ecr 54705,mptcp dss ack 3454339951 seq 446087588 subseq 475525 len 1428 csum 0x6723], length 1428
10:42:47.601591 IP 112.26.1.1.44877 > 112.26.1.8.37753: Flags [.], seq 476953:478381, ack 1, win 4017, options [nop,nop,TS val 268773 ecr 54705,mptcp dss ack 3454339951 seq 446089016 subseq 476953 len 1428 csum 0xf54a], length 1428
10:42:47.685557 IP 112.26.1.1.44877 > 112.26.1.8.37753: Flags [.], seq 448393:449821, ack 1, win 4017, options [nop,nop,TS val 268996 ecr 54959,mptcp dss ack 3454339951 seq 446026184 subseq 448393 len 1428 csum 0xbc37], length 1428
10:42:47.737532 IP 112.26.1.8.37753 > 112.26.1.1.44877: Flags [.], ack 448393, win 24391, options [nop,nop,TS val 55825 ecr 267152,nop,nop,sack 2 {462673:466957}{454105:459817},mptcp dss ack 445893380], length 0
10:42:47.738041 IP 112.26.1.1.44877 > 112.26.1.8.37753: Flags [.], seq 459817:461245, ack 1, win 4017, options [nop,nop,TS val 269876 ecr 55825,mptcp dss ack 3454339951 seq 446041892 subseq 459817 len 1428 csum 0x9326], length 1428
10:42:47.738095 IP 112.26.1.1.44877 > 112.26.1.8.37753: Flags [.], seq 461245:462673, ack 1, win 4017, options [nop,nop,TS val 269876 ecr 55825,mptcp dss ack 3454339951 seq 446043320 subseq 461245 len 1428 csum 0xa952], length 1428
10:42:47.811256 IP 112.26.1.8.37753 > 112.26.1.1.44877: Flags [.], ack 448393, win 24391, options [nop,nop,TS val 55922 ecr 267152,nop,nop,sack 2 {462673:468385}{454105:459817},mptcp dss ack 445893380], length 0
10:42:47.850133 IP 112.26.1.1.44877 > 112.26.1.8.37753: Flags [.], seq 481237:482665, ack 1, win 4017, options [nop,nop,TS val 269988 ecr 55922,mptcp dss ack 3454339951 seq 446127572 subseq 481237 len 1428 csum 0xa346], length 1428
10:42:47.872846 IP 112.26.1.8.37753 > 112.26.1.1.44877: Flags [.], ack 448393, win 24391, options [nop,nop,TS val 56000 ecr 267152,nop,nop,sack 2 {462673:469813}{454105:459817},mptcp dss ack 445893380], length 0
10:42:47.914124 IP 112.26.1.8.37753 > 112.26.1.1.44877: Flags [.], ack 448393, win 24391, options [nop,nop,TS val 56116 ecr 267152,nop,nop,sack 2 {471241:472669}{462673:469813},mptcp dss ack 445893380], length 0
10:42:47.914411 IP 112.26.1.1.44877 > 112.26.1.8.37753: Flags [.], seq 482665:484093, ack 1, win 4017, options [nop,nop,TS val 270053 ecr 56000,mptcp dss ack 3454339951 seq 446131856 subseq 482665 len 1428 csum 0x7339], length 1428
10:42:47.914502 IP 112.26.1.1.44877 > 112.26.1.8.37753: Flags [.], seq 469813:471241, ack 1, win 4017, options [nop,nop,TS val 270053 ecr 56116,mptcp dss ack 3454339951 seq 446067596 subseq 469813 len 1428 csum 0x7a0a], length 1428
10:42:47.966175 IP 112.26.1.1.44877 > 112.26.1.8.37753: Flags [.], seq 452677:454105, ack 1, win 4017, options [nop,nop,TS val 269487 ecr 55342,mptcp dss ack 3454339951 seq 446030468 subseq 452677 len 1428 csum 0x3c17], length 1428
10:42:48.082205 IP 112.26.1.1.44877 > 112.26.1.8.37753: Flags [.], seq 479809:481237, ack 1, win 4017, options [nop,nop,TS val 269493 ecr 55342,mptcp dss ack 3454339951 seq 446104724 subseq 479809 len 1428 csum 0x524d], length 1428
10:42:48.151941 IP 112.26.1.8.37753 > 112.26.1.1.44877: Flags [.], ack 448393, win 24391, options [nop,nop,TS val 56254 ecr 267152,nop,nop,sack 2 {474097:475525}{471241:472669},mptcp dss ack 445893380], length 0
10:42:48.152291 IP 112.26.1.1.44877 > 112.26.1.8.37753: Flags [.], seq 472669:474097, ack 1, win 4017, options [nop,nop,TS val 270290 ecr 56254,mptcp dss ack 3454339951 seq 446084732 subseq 472669 len 1428 csum 0x1125], length 1428
10:42:48.225027 IP 112.26.1.8.37753 > 112.26.1.1.44877: Flags [.], ack 448393, win 23968, options [nop,nop,TS val 56357 ecr 267152,nop,nop,sack 2 {474097:476953}{471241:472669},mptcp dss ack 445920512], length 0
10:42:48.300566 IP 112.26.1.1.44877 > 112.26.1.8.37753: Flags [.], seq 459817:461245, ack 1, win 4017, options [nop,nop,TS val 269876 ecr 55825,mptcp dss ack 3454339951 seq 446041892 subseq 459817 len 1428 csum 0x9326], length 1428
