10:42:02.399760 IP 112.26.2.8.43045 > 112.26.2.1.44877: Flags [S], seq 39129149, win 65535, options [mss 1460,sackOK,TS val 11179 ecr 0,nop,wscale 6,mptcp join id 4 token 0x187b1b60 nonce 0xb2f33846], length 0
10:42:02.452566 IP 112.26.2.8.43045 > 112.26.2.1.44877: Flags [S], seq 39129149, win 65535, options [mss 1460,sackOK,TS val 11179 ecr 0,nop,wscale 6,mptcp join id 4 token 0x187b1b60 nonce 0xb2f33846], length 0
10:42:02.715351 IP 112.26.2.1.44877 > 112.26.2.8.43045: Flags [S.], seq 2106607361, ack 39129150, win 65535, options [mss 1460,sackOK,TS val 224662 ecr 11179,nop,wscale 6,mptcp join id 4 hmac 0xc770272aca121974 nonce 0x379bd44b], length 0
10:42:02.715726 IP 112.26.2.8.43045 > 112.26.2.1.44877: Flags [.], ack 1, win 7072, options [nop,nop,TS val 11503 ecr 224662,mptcp join hmac 0x89b69000fc7779dcb2f95862dd28753cd6abd24c], length 0
10:42:02.836174 IP 112.26.2.8.43045 > 112.26.2.1.44877: Flags [.], ack 1, win 7072, options [nop,nop,TS val 11503 ecr 224662,mptcp join hmac 0x89b69000fc7779dcb2f95862dd28753cd6abd24c], length 0
10:42:02.989933 IP 112.26.2.1.44877 > 112.26.2.8.43045: Flags [.], ack 1, win 4017, options [nop,nop,TS val 224976 ecr 11503,mptcp dss ack 3454339951], length 0
10:42:03.114213 IP 112.26.2.1.44877 > 112.26.2.8.43045: Flags [.], seq 1:1429, ack 1, win 4017, options [nop,nop,TS val 225086 ecr 11503,mptcp dss ack 3454339951 seq 444242612 subseq 1 len 1428 csum 0xb67b], length 1428
10:42:31.937981 IP 112.26.2.1.44877 > 112.26.2.8.43045: Flags [.], seq 295597:297025, ack 1, win 4017, options [nop,nop,TS val 253359 ecr 39380,mptcp dss ack 3454339951 seq 445402148 subseq 295597 len 1428 csum 0xb2a3], length 1428
10:42:31.938233 IP 112.26.2.8.43045 > 112.26.2.1.44877: Flags [.], ack 288457, win 24355, options [nop,nop,TS val 40726 ecr 252797,nop,nop,sack 1 {289885:297025},mptcp dss ack 445327892], length 0
10:42:31.942961 IP 112.26.2.8.43045 > 112.26.2.1.44877: Flags [.], ack 288457, win 24355, options [nop,nop,TS val 40726 ecr 252797,nop,nop,sack 1 {289885:297025},mptcp dss ack 445327892], length 0
10:42:32.053022 IP 112.26.2.1.44877 > 112.26.2.8.43045: Flags [.], seq 298453:299881, ack 1, win 4017, options [nop,nop,TS val 253554 ecr 39521,mptcp dss ack 3454339951 seq 445412144 subseq 298453 len 1428 csum 0x67cf], length 1428
10:42:32.053344 IP 112.26.2.8.43045 > 112.26.2.1.44877: Flags [.], ack 288457, win 24355, options [nop,nop,TS val 40841 ecr 252797,nop,nop,sack 2 {298453:299881}{289885:297025},mptcp dss ack 445327892], length 0
10:42:32.061644 IP 112.26.2.8.43045 > 112.26.2.1.44877: Flags [.], ack 288457, win 24355, options [nop,nop,TS val 40841 ecr 252797,nop,nop,sack 2 {298453:299881}{289885:297025},mptcp dss ack 445327892], length 0
10:42:32.275665 IP 112.26.2.1.44877 > 112.26.2.8.43045: Flags [.], seq 299881:301309, ack 1, win 4017, options [nop,nop,TS val 253794 ecr 39750,mptcp dss ack 3454339951 seq 445430708 subseq 299881 len 1428 csum 0xb115], length 1428
10:42:32.276002 IP 112.26.2.8.43045 > 112.26.2.1.44877: Flags [.], ack 288457, win 24355, options [nop,nop,TS val 41064 ecr 252797,nop,nop,sack 2 {298453:301309}{289885:297025},mptcp dss ack 445327892], length 0
10:42:32.291847 IP 112.26.2.8.43045 > 112.26.2.1.44877: Flags [.], ack 288457, win 24355, options [nop,nop,TS val 41064 ecr 252797,nop,nop,sack 2 {298453:301309}{289885:297025},mptcp dss ack 445327892], length 0
10:42:32.458180 IP 112.26.2.1.44877 > 112.26.2.8.43045: Flags [.], seq 301309:302737, ack 1, win 4017, options [nop,nop,TS val 253922 ecr 39901,mptcp dss ack 3454339951 seq 445432136 subseq 301309 len 1428 csum 0xc44f], length 1428
10:42:32.458551 IP 112.26.2.8.43045 > 112.26.2.1.44877: Flags [.], ack 288457, win 24222, options [nop,nop,TS val 41246 ecr 252797,nop,nop,sack 2 {298453:302737}{289885:297025},mptcp dss ack 445336460], length 0
10:42:32.466344 IP 112.26.2.8.43045 > 112.26.2.1.44877: Flags [.], ack 288457, win 24222, options [nop,nop,TS val 41246 ecr 252797,nop,nop,sack 2 {298453:302737}{289885:297025},mptcp dss ack 445336460], length 0
10:42:32.622751 IP 112.26.2.1.44877 > 112.26.2.8.43045: Flags [.], seq 302737:304165, ack 1, win 4017, options [nop,nop,TS val 254128 ecr 40107,mptcp dss ack 3454339951 seq 445436420 subseq 302737 len 1428 csum 0x3151], length 1428
10:42:32.623105 IP 112.26.2.8.43045 > 112.26.2.1.44877: Flags [.], ack 288457, win 24222, options [nop,nop,TS val 41411 ecr 252797,nop,nop,sack 2 {298453:304165}{289885:297025},mptcp dss ack 445336460], length 0
10:42:32.636446 IP 112.26.2.8.43045 > 112.26.2.1.44877: Flags [.], ack 288457, win 24222, options [nop,nop,TS val 41411 ecr 252797,nop,nop,sack 2 {298453:304165}{289885:297025},mptcp dss ack 445336460], length 0
10:42:32.734766 IP 112.26.2.1.44877 > 112.26.2.8.43045: Flags [.], seq 304165:305593, ack 1, win 4017, options [nop,nop,TS val 254128 ecr 40107,mptcp dss ack 3454339951 seq 445437848 subseq 304165 len 1428 csum 0x2045], length 1428
10:42:32.735111 IP 112.26.2.8.43045 > 112.26.2.1.44877: Flags [.], ack 288457, win 24222, options [nop,nop,TS val 41523 ecr 252797,nop,nop,sack 2 {298453:305593}{289885:297025},mptcp dss ack 445336460], length 0
10:42:32.745418 IP 112.26.2.8.43045 > 112.26.2.1.44877: Flags [.], ack 288457, win 24222, options [nop,nop,TS val 41523 ecr 252797,nop,nop,sack 2 {298453:305593}{289885:297025},mptcp dss ack 445336460], length 0
10:42:32.823961 IP 112.26.2.1.44877 > 112.26.2.8.43045: Flags [.], seq 305593:307021, ack 1, win 4017, options [nop,nop,TS val 254340 ecr 40276,mptcp dss ack 3454339951 seq 445446416 subseq 305593 len 1428 csum 0x7f13], length 1428
10:42:32.824324 IP 112.26.2.8.43045 > 112.26.2.1.44877: Flags [.], ack 288457, win 24222, options [nop,nop,TS val 41612 ecr 252797,nop,nop,sack 2 {298453:307021}{289885:297025},mptcp dss ack 445336460], length 0
10:42:32.847299 IP 112.26.2.8.43045 > 112.26.2.1.44877: Flags [.], ack 288457, win 24222, options [nop,nop,TS val 41612 ecr 252797,nop,nop,sack 2 {298453:307021}{289885:297025},mptcp dss ack 445336460], length 0
10:42:32.958857 IP 112.26.2.1.44877 > 112.26.2.8.43045: Flags [.], seq 307021:308449, ack 1, win 4017, options [nop,nop,TS val 254378 ecr 40374,mptcp dss ack 3454339951 seq 445447844 subseq 307021 len 1428 csum 0xf897], length 1428
10:42:32.959243 IP 112.26.2.8.43045 > 112.26.2.1.44877: Flags [.], ack 288457, win 24222, options [nop,nop,TS val 41747 ecr 252797,nop,nop,sack 2 {298453:308449}{289885:297025},mptcp dss ack 445336460], length 0
10:42:32.962435 IP 112.26.2.8.43045 > 112.26.2.1.44877: Flags [.], ack 288457, win 24222, options [nop,nop,TS val 41747 ecr 252797,nop,nop,sack 2 {298453:308449}{289885:297025},mptcp dss ack 445336460], length 0
10:42:33.065829 IP 112.26.2.1.44877 > 112.26.2.8.43045: Flags [.], seq 288457:289885, ack 1, win 4017, options [nop,nop,TS val 254529 ecr 40508,mptcp dss ack 3454339951 seq 445375016 subseq 288457 len 1428 csum 0x2503], length 1428
10:42:33.066198 IP 112.26.2.8.43045 > 112.26.2.1.44877: Flags [.], ack 297025, win 24222, options [nop,nop,TS val 41854 ecr 254529,nop,nop,sack 1 {298453:308449},mptcp dss ack 445336460], length 0
10:42:33.082655 IP 112.26.2.8.43045 > 112.26.2.1.44877: Flags [.], ack 297025, win 24222, options [nop,nop,TS val 41854 ecr 254529,nop,nop,sack 1 {298453:308449},mptcp dss ack 445336460], length 0
10:42:33.169301 IP 112.26.2.1.44877 > 112.26.2.8.43045: Flags [.], seq 308449:309877, ack 1, win 4017, options [nop,nop,TS val 254659 ecr 40632,mptcp dss ack 3454339951 seq 445454984 subseq 308449 len 1428 csum 0x87], length 1428
10:42:33.169620 IP 112.26.2.8.43045 > 112.26.2.1.44877: Flags [.], ack 297025, win 24222, options [nop,nop,TS val 41957 ecr 254529,nop,nop,sack 1 {298453:309877},mptcp dss ack 445336460], length 0
10:42:33.202425 IP 112.26.2.8.43045 > 112.26.2.1.44877: Flags [.], ack 297025, win 24222, options [nop,nop,TS val 41957 ecr 254529,nop,nop,sack 1 {298453:309877},mptcp dss ack 445336460], length 0
10:42:33.482083 IP 112.26.2.1.44877 > 112.26.2.8.43045: Flags [.], seq 297025:298453, ack 1, win 4017, options [nop,nop,TS val 255032 ecr 41064,mptcp dss ack 3454339951 seq 445403576 subseq 297025 len 1428 csum 0x8b61], length 1428
10:42:33.482456 IP 112.26.2.8.43045 > 112.26.2.1.44877: Flags [.], ack 309877, win 24222, options [nop,nop,TS val 42270 ecr 255032,mptcp dss ack 445336460], length 0
10:42:33.488543 IP 112.26.2.8.43045 > 112.26.2.1.44877: Flags [.], ack 309877, win 24222, options [nop,nop,TS val 42270 ecr 255032,mptcp dss ack 445336460], length 0
10:42:33.767462 IP 112.26.2.1.44877 > 112.26.2.8.43045: Flags [.], seq 309877:311305, ack 1, win 4017, options [nop,nop,TS val 255334 ecr 41246,mptcp dss ack 3454339951 seq 445474976 subseq 309877 len 1428 csum 0xf562], length 1428
10:42:33.767831 IP 112.26.2.8.43045 > 112.26.2.1.44877: Flags [.], ack 311305, win 24222, options [nop,nop,TS val 42556 ecr 255334,mptcp dss ack 445336460], length 0
10:42:33.775005 IP 112.26.2.8.43045 > 112.26.2.1.44877: Flags [.], ack 311305, win 24222, options [nop,nop,TS val 42556 ecr 255334,mptcp dss ack 445336460], length 0
10:42:33.839021 IP 112.26.2.1.44877 > 112.26.2.8.43045: Flags [.], seq 311305:312733, ack 1, win 4017, options [nop,nop,TS val 255413 ecr 41411,mptcp dss ack 3454339951 seq 445477832 subseq 311305 len 1428 csum 0xf23d], length 1428
10:42:33.839408 IP 112.26.2.8.43045 > 112.26.2.1.44877: Flags [.], ack 312733, win 24222, options [nop,nop,TS val 42627 ecr 255413,mptcp dss ack 445336460], length 0
10:42:33.848029 IP 112.26.2.8.43045 > 112.26.2.1.44877: Flags [.], ack 312733, win 24222, options [nop,nop,TS val 42627 ecr 255413,mptcp dss ack 445336460], length 0
10:42:33.934193 IP 112.26.2.1.44877 > 112.26.2.8.43045: Flags [.], seq 312733:314161, ack 1, win 4017, options [nop,nop,TS val 255492 ecr 41523,mptcp dss ack 3454339951 seq 445480688 subseq 312733 len 1428 csum 0x837b], length 1428
10:42:33.934543 IP 112.26.2.8.43045 > 112.26.2.1.44877: Flags [.], ack 314161, win 24486, options [nop,nop,TS val 42722 ecr 255492,mptcp dss ack 445453556], length 0
10:42:33.938542 IP 112.26.2.8.43045 > 112.26.2.1.44877: Flags [.], ack 314161, win 24486, options [nop,nop,TS val 42722 ecr 255492,mptcp dss ack 445453556], length 0
10:42:34.003211 IP 112.26.2.1.44877 > 112.26.2.8.43045: Flags [.], seq 314161:315589, ack 1, win 4017, options [nop,nop,TS val 255601 ecr 41612,mptcp dss ack 3454339951 seq 445486400 subseq 314161 len 1428 csum 0xb74c], length 1428
10:42:34.003567 IP 112.26.2.8.43045 > 112.26.2.1.44877: Flags [.], ack 315589, win 24486, options [nop,nop,TS val 42791 ecr 255601,mptcp dss ack 445453556], length 0
10:42:34.022369 IP 112.26.2.8.43045 > 112.26.2.1.44877: Flags [.], ack 315589, win 24486, options [nop,nop,TS val 42791 ecr 255601,mptcp dss ack 445453556], length 0
10:42:34.122403 IP 112.26.2.1.44877 > 112.26.2.8.43045: Flags [.], seq 315589:317017, ack 1, win 4017, options [nop,nop,TS val 255750 ecr 41747,mptcp dss ack 3454339951 seq 445492112 subseq 315589 len 1428 csum 0xfcd9], length 1428
10:42:34.122776 IP 112.26.2.8.43045 > 112.26.2.1.44877: Flags [.], ack 317017, win 24486, options [nop,nop,TS val 42910 ecr 255750,mptcp dss ack 445453556], length 0
10:42:34.134111 IP 112.26.2.8.43045 > 112.26.2.1.44877: Flags [.], ack 317017, win 24486, options [nop,nop,TS val 42910 ecr 255750,mptcp dss ack 445453556], length 0
10:42:34.233599 IP 112.26.2.1.44877 > 112.26.2.8.43045: Flags [.], seq 317017:318445, ack 1, win 4017, options [nop,nop,TS val 255782 ecr 41854,mptcp dss ack 3454339951 seq 445499252 subseq 317017 len 1428 csum 0xdaa6], length 1428
10:42:34.233880 IP 112.26.2.8.43045 > 112.26.2.1.44877: Flags [.], ack 318445, win 24486, options [nop,nop,TS val 43021 ecr 255782,mptcp dss ack 445453556], length 0
10:42:34.242541 IP 112.26.2.8.43045 > 112.26.2.1.44877: Flags [.], ack 318445, win 24486, options [nop,nop,TS val 43021 ecr 255782,mptcp dss ack 445453556], length 0
10:42:34.314383 IP 112.26.2.1.44877 > 112.26.2.8.43045: Flags [.], seq 318445:319873, ack 1, win 4017, options [nop,nop,TS val 255862 ecr 41957,mptcp dss ack 3454339951 seq 445502108 subseq 318445 len 1428 csum 0xe26c], length 1428
10:42:34.314720 IP 112.26.2.8.43045 > 112.26.2.1.44877: Flags [.], ack 319873, win 24486, options [nop,nop,TS val 43102 ecr 255862,mptcp dss ack 445453556], length 0
10:42:34.321790 IP 112.26.2.8.43045 > 112.26.2.1.44877: Flags [.], ack 319873, win 24486, options [nop,nop,TS val 43102 ecr 255862,mptcp dss ack 445453556], length 0
10:42:34.635861 IP 112.26.2.1.44877 > 112.26.2.8.43045: Flags [.], seq 319873:321301, ack 1, win 4017, options [nop,nop,TS val 256177 ecr 42270,mptcp dss ack 3454339951 seq 445514960 subseq 319873 len 1428 csum 0x6f49], length 1428
10:42:34.636153 IP 112.26.2.8.43045 > 112.26.2.1.44877: Flags [.], ack 321301, win 24486, options [nop,nop,TS val 43424 ecr 256177,mptcp dss ack 445453556], length 0
10:42:34.667271 IP 112.26.2.8.43045 > 112.26.2.1.44877: Flags [.], ack 321301, win 24486, options [nop,nop,TS val 43424 ecr 256177,mptcp dss ack 445453556], length 0
10:42:34.907551 IP 112.26.2.1.44877 > 112.26.2.8.43045: Flags [.], seq 321301:322729, ack 1, win 4017, options [nop,nop,TS val 256517 ecr 42556,mptcp dss ack 3454339951 seq 445523528 subseq 321301 len 1428 csum 0xbc7e], length 1428
10:42:34.907906 IP 112.26.2.8.43045 > 112.26.2.1.44877: Flags [.], ack 322729, win 24386, options [nop,nop,TS val 43696 ecr 256517,mptcp dss ack 445487828], length 0
10:42:34.920911 IP 112.26.2.8.43045 > 112.26.2.1.44877: Flags [.], ack 322729, win 24386, options [nop,nop,TS val 43696 ecr 256517,mptcp dss ack 445487828], length 0
10:42:34.991897 IP 112.26.2.1.44877 > 112.26.2.8.43045: Flags [.], seq 322729:324157, ack 1, win 4017, options [nop,nop,TS val 256562 ecr 42627,mptcp dss ack 3454339951 seq 445527812 subseq 322729 len 1428 csum 0xb562], length 1428
10:42:34.992218 IP 112.26.2.8.43045 > 112.26.2.1.44877: Flags [.], ack 324157, win 24386, options [nop,nop,TS val 43780 ecr 256562,mptcp dss ack 445487828], length 0
10:42:34.995121 IP 112.26.2.8.43045 > 112.26.2.1.44877: Flags [.], ack 324157, win 24386, options [nop,nop,TS val 43780 ecr 256562,mptcp dss ack 445487828], length 0
10:42:35.081093 IP 112.26.2.1.44877 > 112.26.2.8.43045: Flags [.], seq 324157:325585, ack 1, win 4017, options [nop,nop,TS val 256644 ecr 42722,mptcp dss ack 3454339951 seq 445532096 subseq 324157 len 1428 csum 0x988b], length 1428
10:42:35.081392 IP 112.26.2.8.43045 > 112.26.2.1.44877: Flags [.], ack 325585, win 24386, options [nop,nop,TS val 43869 ecr 256644,mptcp dss ack 445487828], length 0
10:42:35.088522 IP 112.26.2.8.43045 > 112.26.2.1.44877: Flags [.], ack 325585, win 24386, options [nop,nop,TS val 43869 ecr 256644,mptcp dss ack 445487828], length 0
10:42:35.189634 IP 112.26.2.1.44877 > 112.26.2.8.43045: Flags [.], seq 325585:327013, ack 1, win 4017, options [nop,nop,TS val 256644 ecr 42722,mptcp dss ack 3454339951 seq 445533524 subseq 325585 len 1428 csum 0xe877], length 1428
10:42:35.189999 IP 112.26.2.8.43045 > 112.26.2.1.44877: Flags [.], ack 327013, win 24386, options [nop,nop,TS val 43978 ecr 256644,mptcp dss ack 445487828], length 0
10:42:35.197787 IP 112.26.2.8.43045 > 112.26.2.1.44877: Flags [.], ack 327013, win 24386, options [nop,nop,TS val 43978 ecr 256644,mptcp dss ack 445487828], length 0
10:42:35.277379 IP 112.26.2.1.44877 > 112.26.2.8.43045: Flags [.], seq 327013:328441, ack 1, win 4017, options [nop,nop,TS val 256703 ecr 42791,mptcp dss ack 3454339951 seq 445542092 subseq 327013 len 1428 csum 0xb77a], length 1428
10:42:35.277759 IP 112.26.2.8.43045 > 112.26.2.1.44877: Flags [.], ack 328441, win 24386, options [nop,nop,TS val 44066 ecr 256703,mptcp dss ack 445487828], length 0
10:42:35.295476 IP 112.26.2.8.43045 > 112.26.2.1.44877: Flags [.], ack 328441, win 24386, options [nop,nop,TS val 44066 ecr 256703,mptcp dss ack 445487828], length 0
10:42:35.371835 IP 112.26.2.1.44877 > 112.26.2.8.43045: Flags [.], seq 328441:329869, ack 1, win 4017, options [nop,nop,TS val 256863 ecr 42910,mptcp dss ack 3454339951 seq 445546376 subseq 328441 len 1428 csum 0x3e89], length 1428
10:42:35.372112 IP 112.26.2.8.43045 > 112.26.2.1.44877: Flags [.], ack 329869, win 24386, options [nop,nop,TS val 44160 ecr 256863,mptcp dss ack 445487828], length 0
10:42:35.376614 IP 112.26.2.8.43045 > 112.26.2.1.44877: Flags [.], ack 329869, win 24386, options [nop,nop,TS val 44160 ecr 256863,mptcp dss ack 445487828], length 0
10:42:35.482061 IP 112.26.2.1.44877 > 112.26.2.8.43045: Flags [.], seq 329869:331297, ack 1, win 4017, options [nop,nop,TS val 256924 ecr 43021,mptcp dss ack 3454339951 seq 445549232 subseq 329869 len 1428 csum 0x331], length 1428
10:42:35.522560 IP 112.26.2.8.43045 > 112.26.2.1.44877: Flags [.], ack 331297, win 24386, options [nop,nop,TS val 44311 ecr 256924,mptcp dss ack 445487828], length 0
10:42:35.527099 IP 112.26.2.8.43045 > 112.26.2.1.44877: Flags [.], ack 331297, win 24386, options [nop,nop,TS val 44311 ecr 256924,mptcp dss ack 445487828], length 0
10:42:35.554331 IP 112.26.2.1.44877 > 112.26.2.8.43045: Flags [.], seq 331297:332725, ack 1, win 4017, options [nop,nop,TS val 256993 ecr 43102,mptcp dss ack 3454339951 seq 445550660 subseq 331297 len 1428 csum 0xa4da], length 1428
10:42:35.675611 IP 112.26.2.8.43045 > 112.26.2.1.44877: Flags [.], ack 332725, win 24386, options [nop,nop,TS val 44464 ecr 256993,mptcp dss ack 445487828], length 0
10:42:35.678682 IP 112.26.2.8.43045 > 112.26.2.1.44877: Flags [.], ack 332725, win 24386, options [nop,nop,TS val 44464 ecr 256993,mptcp dss ack 445487828], length 0
10:42:35.805796 IP 112.26.2.1.44877 > 112.26.2.8.43045: Flags [.], seq 332725:334153, ack 1, win 4017, options [nop,nop,TS val 257401 ecr 43424,mptcp dss ack 3454339951 seq 445557800 subseq 332725 len 1428 csum 0xacec], length 1428
10:42:36.035739 IP 112.26.2.8.43045 > 112.26.2.1.44877: Flags [.], ack 334153, win 24386, options [nop,nop,TS val 44824 ecr 257401,mptcp dss ack 445487828], length 0
10:42:36.038155 IP 112.26.2.8.43045 > 112.26.2.1.44877: Flags [.], ack 334153, win 24386, options [nop,nop,TS val 44824 ecr 257401,mptcp dss ack 445487828], length 0
10:42:36.065801 IP 112.26.2.1.44877 > 112.26.2.8.43045: Flags [.], seq 334153:335581, ack 1, win 4017, options [nop,nop,TS val 257786 ecr 43780,mptcp dss ack 3454339951 seq 445574936 subseq 334153 len 1428 csum 0xd47a], length 1428
10:42:36.235060 IP 112.26.2.1.44877 > 112.26.2.8.43045: Flags [P.], seq 335581:337009, ack 1, win 4017, options [nop,nop,TS val 257786 ecr 43780,mptcp dss ack 3454339951 seq 445576364 subseq 335581 len 1428 csum 0x65bc], length 1428
10:42:36.318703 IP 112.26.2.1.44877 > 112.26.2.8.43045: Flags [.], seq 337009:338437, ack 1, win 4017, options [nop,nop,TS val 257846 ecr 43869,mptcp dss ack 3454339951 seq 445579220 subseq 337009 len 1428 csum 0x73fb], length 1428
10:42:36.318971 IP 112.26.2.8.43045 > 112.26.2.1.44877: Flags [.], ack 338437, win 24133, options [nop,nop,TS val 45107 ecr 257786,mptcp dss ack 445512104], length 0
10:42:36.321703 IP 112.26.2.8.43045 > 112.26.2.1.44877: Flags [.], ack 338437, win 24133, options [nop,nop,TS val 45107 ecr 257786,mptcp dss ack 445512104], length 0
10:42:36.396749 IP 112.26.2.1.44877 > 112.26.2.8.43045: Flags [.], seq 338437:339865, ack 1, win 4017, options [nop,nop,TS val 257885 ecr 43978,mptcp dss ack 3454339951 seq 445580648 subseq 338437 len 1428 csum 0x268e], length 1428
10:42:36.481162 IP 112.26.2.1.44877 > 112.26.2.8.43045: Flags [.], seq 339865:341293, ack 1, win 4017, options [nop,nop,TS val 257885 ecr 43978,mptcp dss ack 3454339951 seq 445582076 subseq 339865 len 1428 csum 0xbe6e], length 1428
10:42:36.481442 IP 112.26.2.8.43045 > 112.26.2.1.44877: Flags [.], ack 341293, win 24208, options [nop,nop,TS val 45269 ecr 257885,mptcp dss ack 445536380], length 0
10:42:36.493966 IP 112.26.2.8.43045 > 112.26.2.1.44877: Flags [.], ack 341293, win 24208, options [nop,nop,TS val 45269 ecr 257885,mptcp dss ack 445536380], length 0
10:42:36.573391 IP 112.26.2.1.44877 > 112.26.2.8.43045: Flags [.], seq 341293:342721, ack 1, win 4017, options [nop,nop,TS val 258011 ecr 44066,mptcp dss ack 3454339951 seq 445586360 subseq 341293 len 1428 csum 0x598e], length 1428
10:42:36.647357 IP 112.26.2.1.44877 > 112.26.2.8.43045: Flags [.], seq 342721:344149, ack 1, win 4017, options [nop,nop,TS val 258051 ecr 44160,mptcp dss ack 3454339951 seq 445587788 subseq 342721 len 1428 csum 0x46e6], length 1428
10:42:36.743998 IP 112.26.2.1.44877 > 112.26.2.8.43045: Flags [.], seq 344149:345577, ack 1, win 4017, options [nop,nop,TS val 258125 ecr 44311,mptcp dss ack 3454339951 seq 445592072 subseq 344149 len 1428 csum 0xce7b], length 1428
10:42:36.744230 IP 112.26.2.8.43045 > 112.26.2.1.44877: Flags [.], ack 345577, win 24142, options [nop,nop,TS val 45532 ecr 258011,mptcp dss ack 445540664], length 0
10:42:36.753860 IP 112.26.2.8.43045 > 112.26.2.1.44877: Flags [.], ack 345577, win 24142, options [nop,nop,TS val 45532 ecr 258011,mptcp dss ack 445540664], length 0
10:42:36.819953 IP 112.26.2.1.44877 > 112.26.2.8.43045: Flags [.], seq 345577:347005, ack 1, win 4017, options [nop,nop,TS val 258304 ecr 44464,mptcp dss ack 3454339951 seq 445594928 subseq 345577 len 1428 csum 0x3149], length 1428
10:42:36.985823 IP 112.26.2.1.44877 > 112.26.2.8.43045: Flags [.], seq 347005:348433, ack 1, win 4017, options [nop,nop,TS val 258801 ecr 44824,mptcp dss ack 3454339951 seq 445613492 subseq 347005 len 1428 csum 0xa9e6], length 1428
10:42:36.986029 IP 112.26.2.8.43045 > 112.26.2.1.44877: Flags [.], ack 348433, win 24061, options [nop,nop,TS val 45774 ecr 258304,mptcp dss ack 445547804], length 0
10:42:36.989181 IP 112.26.2.8.43045 > 112.26.2.1.44877: Flags [.], ack 348433, win 24061, options [nop,nop,TS val 45774 ecr 258304,mptcp dss ack 445547804], length 0
10:42:37.128462 IP 112.26.2.1.44877 > 112.26.2.8.43045: Flags [.], seq 348433:349861, ack 1, win 4017, options [nop,nop,TS val 258991 ecr 45107,mptcp dss ack 3454339951 seq 445622060 subseq 348433 len 1428 csum 0xb531], length 1428
10:42:37.203295 IP 112.26.2.1.44877 > 112.26.2.8.43045: Flags [.], seq 349861:351289, ack 1, win 4017, options [nop,nop,TS val 258991 ecr 45107,mptcp dss ack 3454339951 seq 445623488 subseq 349861 len 1428 csum 0xa5c6], length 1428
10:42:37.203589 IP 112.26.2.8.43045 > 112.26.2.1.44877: Flags [.], ack 351289, win 24540, options [nop,nop,TS val 45992 ecr 258991,mptcp dss ack 445604924], length 0
10:42:37.212652 IP 112.26.2.8.43045 > 112.26.2.1.44877: Flags [.], ack 351289, win 24540, options [nop,nop,TS val 45992 ecr 258991,mptcp dss ack 445604924], length 0
10:42:37.385645 IP 112.26.2.1.44877 > 112.26.2.8.43045: Flags [.], seq 351289:352717, ack 1, win 4017, options [nop,nop,TS val 258991 ecr 45107,mptcp dss ack 3454339951 seq 445624916 subseq 351289 len 1428 csum 0x39f2], length 1428
10:42:37.448072 IP 112.26.2.1.44877 > 112.26.2.8.43045: Flags [.], seq 352717:354145, ack 1, win 4017, options [nop,nop,TS val 259079 ecr 45269,mptcp dss ack 3454339951 seq 445627772 subseq 352717 len 1428 csum 0xf532], length 1428
10:42:37.543165 IP 112.26.2.1.44877 > 112.26.2.8.43045: Flags [.], seq 354145:355573, ack 1, win 4017, options [nop,nop,TS val 259079 ecr 45269,mptcp dss ack 3454339951 seq 445629200 subseq 354145 len 1428 csum 0x2763], length 1428
10:42:37.593303 IP 112.26.2.1.44877 > 112.26.2.8.43045: Flags [.], seq 355573:357001, ack 1, win 4017, options [nop,nop,TS val 259079 ecr 45269,mptcp dss ack 3454339951 seq 445630628 subseq 355573 len 1428 csum 0x1fa5], length 1428
10:42:37.651657 IP 112.26.2.8.43045 > 112.26.2.1.44877: Flags [.], ack 357001, win 24540, options [nop,nop,TS val 46440 ecr 258991,mptcp dss ack 445604924], length 0
10:42:37.654674 IP 112.26.2.8.43045 > 112.26.2.1.44877: Flags [.], ack 357001, win 24540, options [nop,nop,TS val 46440 ecr 258991,mptcp dss ack 445604924], length 0
10:42:37.752504 IP 112.26.2.1.44877 > 112.26.2.8.43045: Flags [.], seq 357001:358429, ack 1, win 4017, options [nop,nop,TS val 259214 ecr 45532,mptcp dss ack 3454339951 seq 445634912 subseq 357001 len 1428 csum 0x4f90], length 1428
10:42:37.823896 IP 112.26.2.1.44877 > 112.26.2.8.43045: Flags [.], seq 358429:359857, ack 1, win 4017, options [nop,nop,TS val 259214 ecr 45532,mptcp dss ack 3454339951 seq 445636340 subseq 358429 len 1428 csum 0x3d9f], length 1428
10:42:37.912843 IP 112.26.2.1.44877 > 112.26.2.8.43045: Flags [.], seq 359857:361285, ack 1, win 4017, options [nop,nop,TS val 259214 ecr 45532,mptcp dss ack 3454339951 seq 445637768 subseq 359857 len 1428 csum 0x12a4], length 1428
10:42:37.978870 IP 112.26.2.1.44877 > 112.26.2.8.43045: Flags [.], seq 361285:362713, ack 1, win 4017, options [nop,nop,TS val 259451 ecr 45774,mptcp dss ack 3454339951 seq 445647764 subseq 361285 len 1428 csum 0xe920], length 1428
10:42:38.051832 IP 112.26.2.8.43045 > 112.26.2.1.44877: Flags [.], ack 362713, win 24540, options [nop,nop,TS val 46840 ecr 259214,mptcp dss ack 445604924], length 0
10:42:38.055672 IP 112.26.2.8.43045 > 112.26.2.1.44877: Flags [.], ack 362713, win 24540, options [nop,nop,TS val 46840 ecr 259214,mptcp dss ack 445604924], length 0
10:42:38.064173 IP 112.26.2.1.44877 > 112.26.2.8.43045: Flags [.], seq 362713:364141, ack 1, win 4017, options [nop,nop,TS val 259451 ecr 45774,mptcp dss ack 3454339951 seq 445649192 subseq 362713 len 1428 csum 0x58a0], length 1428
10:42:38.114364 IP 112.26.2.1.44877 > 112.26.2.8.43045: Flags [.], seq 364141:365569, ack 1, win 4017, options [nop,nop,TS val 259767 ecr 45992,mptcp dss ack 3454339951 seq 445663472 subseq 364141 len 1428 csum 0x8688], length 1428
10:42:38.229470 IP 112.26.2.1.44877 > 112.26.2.8.43045: Flags [.], seq 365569:366997, ack 1, win 4017, options [nop,nop,TS val 259767 ecr 45992,mptcp dss ack 3454339951 seq 445664900 subseq 365569 len 1428 csum 0x8995], length 1428
10:42:38.291858 IP 112.26.2.8.43045 > 112.26.2.1.44877: Flags [.], ack 366997, win 24540, options [nop,nop,TS val 47080 ecr 259451,mptcp dss ack 445604924], length 0
10:42:38.295537 IP 112.26.2.8.43045 > 112.26.2.1.44877: Flags [.], ack 366997, win 24540, options [nop,nop,TS val 47080 ecr 259451,mptcp dss ack 445604924], length 0
10:42:38.381022 IP 112.26.2.1.44877 > 112.26.2.8.43045: Flags [.], seq 366997:368425, ack 1, win 4017, options [nop,nop,TS val 260321 ecr 46440,mptcp dss ack 3454339951 seq 445682036 subseq 366997 len 1428 csum 0x17fb], length 1428
10:42:38.462054 IP 112.26.2.1.44877 > 112.26.2.8.43045: Flags [.], seq 368425:369853, ack 1, win 4017, options [nop,nop,TS val 260321 ecr 46440,mptcp dss ack 3454339951 seq 445683464 subseq 368425 len 1428 csum 0x3785], length 1428
10:42:38.548335 IP 112.26.2.8.43045 > 112.26.2.1.44877: Flags [.], ack 369853, win 23763, options [nop,nop,TS val 47336 ecr 260321,mptcp dss ack 445659188], length 0
10:42:38.557016 IP 112.26.2.8.43045 > 112.26.2.1.44877: Flags [.], ack 369853, win 23763, options [nop,nop,TS val 47336 ecr 260321,mptcp dss ack 445659188], length 0
10:42:38.618869 IP 112.26.2.1.44877 > 112.26.2.8.43045: Flags [.], seq 369853:371281, ack 1, win 4017, options [nop,nop,TS val 260321 ecr 46440,mptcp dss ack 3454339951 seq 445684892 subseq 369853 len 1428 csum 0xaa5d], length 1428
10:42:38.696020 IP 112.26.2.1.44877 > 112.26.2.8.43045: Flags [.], seq 371281:372709, ack 1, win 4017, options [nop,nop,TS val 260321 ecr 46440,mptcp dss ack 3454339951 seq 445686320 subseq 371281 len 1428 csum 0x24e2], length 1428
10:42:38.696360 IP 112.26.2.8.43045 > 112.26.2.1.44877: Flags [.], ack 372709, win 24311, options [nop,nop,TS val 47484 ecr 260321,mptcp dss ack 445659188], length 0
10:42:38.699075 IP 112.26.2.8.43045 > 112.26.2.1.44877: Flags [.], ack 372709, win 24311, options [nop,nop,TS val 47484 ecr 260321,mptcp dss ack 445659188], length 0
10:42:38.818712 IP 112.26.2.1.44877 > 112.26.2.8.43045: Flags [.], seq 372709:374137, ack 1, win 4017, options [nop,nop,TS val 260321 ecr 46440,mptcp dss ack 3454339951 seq 445687748 subseq 372709 len 1428 csum 0x9ba7], length 1428
10:42:38.898546 IP 112.26.2.1.44877 > 112.26.2.8.43045: Flags [.], seq 374137:375565, ack 1, win 4017, options [nop,nop,TS val 260321 ecr 46440,mptcp dss ack 3454339951 seq 445689176 subseq 374137 len 1428 csum 0xe380], length 1428
10:42:39.030057 IP 112.26.2.1.44877 > 112.26.2.8.43045: Flags [.], seq 375565:376993, ack 1, win 4017, options [nop,nop,TS val 260321 ecr 46440,mptcp dss ack 3454339951 seq 445690604 subseq 375565 len 1428 csum 0xe448], length 1428
10:42:39.030419 IP 112.26.2.8.43045 > 112.26.2.1.44877: Flags [.], ack 376993, win 24311, options [nop,nop,TS val 47818 ecr 260321,mptcp dss ack 445659188], length 0
10:42:39.033556 IP 112.26.2.8.43045 > 112.26.2.1.44877: Flags [.], ack 376993, win 24311, options [nop,nop,TS val 47818 ecr 260321,mptcp dss ack 445659188], length 0
10:42:39.135636 IP 112.26.2.1.44877 > 112.26.2.8.43045: Flags [.], seq 376993:378421, ack 1, win 4017, options [nop,nop,TS val 260457 ecr 46840,mptcp dss ack 3454339951 seq 445703456 subseq 376993 len 1428 csum 0xd6a3], length 1428
10:42:39.239228 IP 112.26.2.1.44877 > 112.26.2.8.43045: Flags [.], seq 378421:379849, ack 1, win 4017, options [nop,nop,TS val 260457 ecr 46840,mptcp dss ack 3454339951 seq 445704884 subseq 378421 len 1428 csum 0xf057], length 1428
10:42:39.333943 IP 112.26.2.1.44877 > 112.26.2.8.43045: Flags [.], seq 379849:381277, ack 1, win 4017, options [nop,nop,TS val 260457 ecr 46840,mptcp dss ack 3454339951 seq 445706312 subseq 379849 len 1428 csum 0xb4f5], length 1428
10:42:39.334303 IP 112.26.2.8.43045 > 112.26.2.1.44877: Flags [.], ack 381277, win 24311, options [nop,nop,TS val 48122 ecr 260457,mptcp dss ack 445659188], length 0
10:42:39.343531 IP 112.26.2.8.43045 > 112.26.2.1.44877: Flags [.], ack 381277, win 24311, options [nop,nop,TS val 48122 ecr 260457,mptcp dss ack 445659188], length 0
10:42:39.449596 IP 112.26.2.1.44877 > 112.26.2.8.43045: Flags [.], seq 381277:382705, ack 1, win 4017, options [nop,nop,TS val 260457 ecr 46840,mptcp dss ack 3454339951 seq 445707740 subseq 381277 len 1428 csum 0x7519], length 1428
10:42:39.531185 IP 112.26.2.1.44877 > 112.26.2.8.43045: Flags [.], seq 382705:384133, ack 1, win 4017, options [nop,nop,TS val 260689 ecr 47080,mptcp dss ack 3454339951 seq 445714880 subseq 382705 len 1428 csum 0xcf7b], length 1428
10:42:39.601237 IP 112.26.2.1.44877 > 112.26.2.8.43045: Flags [.], seq 384133:385561, ack 1, win 4017, options [nop,nop,TS val 260689 ecr 47080,mptcp dss ack 3454339951 seq 445716308 subseq 384133 len 1428 csum 0xe7d0], length 1428
10:42:39.667320 IP 112.26.2.8.43045 > 112.26.2.1.44877: Flags [.], ack 385561, win 24311, options [nop,nop,TS val 48456 ecr 260457,mptcp dss ack 445659188], length 0
10:42:39.671895 IP 112.26.2.8.43045 > 112.26.2.1.44877: Flags [.], ack 385561, win 24311, options [nop,nop,TS val 48456 ecr 260457,mptcp dss ack 445659188], length 0
10:42:39.786593 IP 112.26.2.1.44877 > 112.26.2.8.43045: Flags [.], seq 385561:386989, ack 1, win 4017, options [nop,nop,TS val 260689 ecr 47080,mptcp dss ack 3454339951 seq 445717736 subseq 385561 len 1428 csum 0xf022], length 1428
10:42:39.850311 IP 112.26.2.1.44877 > 112.26.2.8.43045: Flags [.], seq 386989:388417, ack 1, win 4017, options [nop,nop,TS val 260689 ecr 47080,mptcp dss ack 3454339951 seq 445719164 subseq 386989 len 1428 csum 0xa833], length 1428
10:42:39.866866 IP 112.26.2.8.43045 > 112.26.2.1.44877: Flags [.], ack 388417, win 23613, options [nop,nop,TS val 48655 ecr 260689,mptcp dss ack 445734872], length 0
10:42:39.875579 IP 112.26.2.8.43045 > 112.26.2.1.44877: Flags [.], ack 388417, win 23613, options [nop,nop,TS val 48655 ecr 260689,mptcp dss ack 445734872], length 0
10:42:39.949672 IP 112.26.2.1.44877 > 112.26.2.8.43045: Flags [.], seq 389845:391273, ack 1, win 4017, options [nop,nop,TS val 261106 ecr 47336,mptcp dss ack 3454339951 seq 445736300 subseq 389845 len 1428 csum 0x5a61], length 1428
10:42:39.950047 IP 112.26.2.8.43045 > 112.26.2.1.44877: Flags [.], ack 388417, win 24429, options [nop,nop,TS val 48738 ecr 260689,nop,nop,sack 1 {389845:391273},mptcp dss ack 445734872], length 0
10:42:39.952506 IP 112.26.2.8.43045 > 112.26.2.1.44877: Flags [.], ack 388417, win 24429, options [nop,nop,TS val 48738 ecr 260689,nop,nop,sack 1 {389845:391273},mptcp dss ack 445734872], length 0
10:42:40.047996 IP 112.26.2.1.44877 > 112.26.2.8.43045: Flags [.], seq 391273:392701, ack 1, win 4017, options [nop,nop,TS val 261106 ecr 47336,mptcp dss ack 3454339951 seq 445737728 subseq 391273 len 1428 csum 0x62ca], length 1428
10:42:40.048294 IP 112.26.2.8.43045 > 112.26.2.1.44877: Flags [.], ack 388417, win 24429, options [nop,nop,TS val 48836 ecr 260689,nop,nop,sack 1 {389845:392701},mptcp dss ack 445734872], length 0
10:42:40.053378 IP 112.26.2.8.43045 > 112.26.2.1.44877: Flags [.], ack 388417, win 24429, options [nop,nop,TS val 48836 ecr 260689,nop,nop,sack 1 {389845:392701},mptcp dss ack 445734872], length 0
10:42:40.126963 IP 112.26.2.1.44877 > 112.26.2.8.43045: Flags [.], seq 392701:394129, ack 1, win 4017, options [nop,nop,TS val 261320 ecr 47484,mptcp dss ack 3454339951 seq 445750580 subseq 392701 len 1428 csum 0x85fc], length 1428
10:42:40.127293 IP 112.26.2.8.43045 > 112.26.2.1.44877: Flags [.], ack 388417, win 24429, options [nop,nop,TS val 48915 ecr 260689,nop,nop,sack 1 {389845:394129},mptcp dss ack 445734872], length 0
10:42:40.130485 IP 112.26.2.8.43045 > 112.26.2.1.44877: Flags [.], ack 388417, win 24429, options [nop,nop,TS val 48915 ecr 260689,nop,nop,sack 1 {389845:394129},mptcp dss ack 445734872], length 0
10:42:40.226207 IP 112.26.2.1.44877 > 112.26.2.8.43045: Flags [.], seq 394129:395557, ack 1, win 4017, options [nop,nop,TS val 261320 ecr 47484,mptcp dss ack 3454339951 seq 445752008 subseq 394129 len 1428 csum 0x4d49], length 1428
10:42:40.226543 IP 112.26.2.8.43045 > 112.26.2.1.44877: Flags [.], ack 388417, win 24429, options [nop,nop,TS val 49014 ecr 260689,nop,nop,sack 1 {389845:395557},mptcp dss ack 445734872], length 0
10:42:40.235130 IP 112.26.2.8.43045 > 112.26.2.1.44877: Flags [.], ack 388417, win 24429, options [nop,nop,TS val 49014 ecr 260689,nop,nop,sack 1 {389845:395557},mptcp dss ack 445734872], length 0
10:42:40.280068 IP 112.26.2.1.44877 > 112.26.2.8.43045: Flags [.], seq 395557:396985, ack 1, win 4017, options [nop,nop,TS val 261320 ecr 47484,mptcp dss ack 3454339951 seq 445753436 subseq 395557 len 1428 csum 0xa0eb], length 1428
10:42:40.280404 IP 112.26.2.8.43045 > 112.26.2.1.44877: Flags [.], ack 388417, win 24429, options [nop,nop,TS val 49069 ecr 260689,nop,nop,sack 1 {389845:396985},mptcp dss ack 445734872], length 0
10:42:40.345766 IP 112.26.2.8.43045 > 112.26.2.1.44877: Flags [.], ack 388417, win 24429, options [nop,nop,TS val 49069 ecr 260689,nop,nop,sack 1 {389845:396985},mptcp dss ack 445734872], length 0
10:42:40.388800 IP 112.26.2.1.44877 > 112.26.2.8.43045: Flags [.], seq 396985:398413, ack 1, win 4017, options [nop,nop,TS val 261823 ecr 47818,mptcp dss ack 3454339951 seq 445770572 subseq 396985 len 1428 csum 0xd07a], length 1428
10:42:40.389118 IP 112.26.2.8.43045 > 112.26.2.1.44877: Flags [.], ack 388417, win 24429, options [nop,nop,TS val 49177 ecr 260689,nop,nop,sack 1 {389845:398413},mptcp dss ack 445734872], length 0
10:42:40.429800 IP 112.26.2.8.43045 > 112.26.2.1.44877: Flags [.], ack 388417, win 24429, options [nop,nop,TS val 49177 ecr 260689,nop,nop,sack 1 {389845:398413},mptcp dss ack 445734872], length 0
10:42:40.518711 IP 112.26.2.1.44877 > 112.26.2.8.43045: Flags [.], seq 399841:401269, ack 1, win 4017, options [nop,nop,TS val 261823 ecr 47818,mptcp dss ack 3454339951 seq 445773428 subseq 399841 len 1428 csum 0x6db1], length 1428
10:42:40.519046 IP 112.26.2.8.43045 > 112.26.2.1.44877: Flags [.], ack 388417, win 24429, options [nop,nop,TS val 49307 ecr 260689,nop,nop,sack 2 {399841:401269}{389845:398413},mptcp dss ack 445734872], length 0
10:42:40.529155 IP 112.26.2.8.43045 > 112.26.2.1.44877: Flags [.], ack 388417, win 24429, options [nop,nop,TS val 49307 ecr 260689,nop,nop,sack 2 {399841:401269}{389845:398413},mptcp dss ack 445734872], length 0
10:42:40.870359 IP 112.26.2.1.44877 > 112.26.2.8.43045: Flags [.], seq 399841:401269, ack 1, win 4017, options [nop,nop,TS val 262272 ecr 47818,mptcp dss ack 3454339951 seq 445773428 subseq 399841 len 1428 csum 0x6db1], length 1428
10:42:40.870740 IP 112.26.2.8.43045 > 112.26.2.1.44877: Flags [.], ack 388417, win 24429, options [nop,nop,TS val 49659 ecr 260689,nop,nop,sack 2 {399841:401269}{399841:401269},mptcp dss ack 445734872], length 0
10:42:40.877248 IP 112.26.2.8.43045 > 112.26.2.1.44877: Flags [.], ack 388417, win 24429, options [nop,nop,TS val 49659 ecr 260689,nop,nop,sack 2 {399841:401269}{399841:401269},mptcp dss ack 445734872], length 0
10:42:40.985086 IP 112.26.2.1.44877 > 112.26.2.8.43045: Flags [.], seq 401269:402697, ack 1, win 4017, options [nop,nop,TS val 262449 ecr 48456,mptcp dss ack 3454339951 seq 445799132 subseq 401269 len 1428 csum 0x7280], length 1428
10:42:40.985432 IP 112.26.2.8.43045 > 112.26.2.1.44877: Flags [.], ack 388417, win 24429, options [nop,nop,TS val 49773 ecr 260689,nop,nop,sack 2 {399841:402697}{389845:398413},mptcp dss ack 445734872], length 0
10:42:40.995899 IP 112.26.2.8.43045 > 112.26.2.1.44877: Flags [.], ack 388417, win 24429, options [nop,nop,TS val 49773 ecr 260689,nop,nop,sack 2 {399841:402697}{389845:398413},mptcp dss ack 445734872], length 0
10:42:41.061975 IP 112.26.2.1.44877 > 112.26.2.8.43045: Flags [.], seq 402697:404125, ack 1, win 4017, options [nop,nop,TS val 262449 ecr 48456,mptcp dss ack 3454339951 seq 445800560 subseq 402697 len 1428 csum 0x4dfe], length 1428
10:42:41.062326 IP 112.26.2.8.43045 > 112.26.2.1.44877: Flags [.], ack 388417, win 24429, options [nop,nop,TS val 49850 ecr 260689,nop,nop,sack 2 {399841:404125}{389845:398413},mptcp dss ack 445734872], length 0
10:42:41.076753 IP 112.26.2.8.43045 > 112.26.2.1.44877: Flags [.], ack 388417, win 24429, options [nop,nop,TS val 49850 ecr 260689,nop,nop,sack 2 {399841:404125}{389845:398413},mptcp dss ack 445734872], length 0
10:42:41.200938 IP 112.26.2.1.44877 > 112.26.2.8.43045: Flags [.], seq 405553:406981, ack 1, win 4017, options [nop,nop,TS val 262449 ecr 48456,mptcp dss ack 3454339951 seq 445803416 subseq 405553 len 1428 csum 0x6cb0], length 1428
10:42:41.201288 IP 112.26.2.8.43045 > 112.26.2.1.44877: Flags [.], ack 388417, win 24429, options [nop,nop,TS val 49989 ecr 260689,nop,nop,sack 2 {405553:406981}{399841:404125},mptcp dss ack 445734872], length 0
10:42:41.214504 IP 112.26.2.8.43045 > 112.26.2.1.44877: Flags [.], ack 388417, win 24429, options [nop,nop,TS val 49989 ecr 260689,nop,nop,sack 2 {405553:406981}{399841:404125},mptcp dss ack 445734872], length 0
10:42:41.285326 IP 112.26.2.1.44877 > 112.26.2.8.43045: Flags [.], seq 406981:408409, ack 1, win 4017, options [nop,nop,TS val 262449 ecr 48456,mptcp dss ack 3454339951 seq 445804844 subseq 406981 len 1428 csum 0xf57], length 1428
10:42:41.285708 IP 112.26.2.8.43045 > 112.26.2.1.44877: Flags [.], ack 388417, win 24429, options [nop,nop,TS val 50074 ecr 260689,nop,nop,sack 2 {405553:408409}{399841:404125},mptcp dss ack 445734872], length 0
10:42:41.302201 IP 112.26.2.8.43045 > 112.26.2.1.44877: Flags [.], ack 388417, win 24429, options [nop,nop,TS val 50074 ecr 260689,nop,nop,sack 2 {405553:408409}{399841:404125},mptcp dss ack 445734872], length 0
10:42:41.378116 IP 112.26.2.1.44877 > 112.26.2.8.43045: Flags [.], seq 408409:409837, ack 1, win 4017, options [nop,nop,TS val 262449 ecr 48456,mptcp dss ack 3454339951 seq 445806272 subseq 408409 len 1428 csum 0x1370], length 1428
10:42:41.378468 IP 112.26.2.8.43045 > 112.26.2.1.44877: Flags [.], ack 388417, win 24429, options [nop,nop,TS val 50167 ecr 260689,nop,nop,sack 2 {405553:409837}{399841:404125},mptcp dss ack 445734872], length 0
10:42:41.381888 IP 112.26.2.8.43045 > 112.26.2.1.44877: Flags [.], ack 388417, win 24429, options [nop,nop,TS val 50167 ecr 260689,nop,nop,sack 2 {405553:409837}{399841:404125},mptcp dss ack 445734872], length 0
