10:42:02.410854 IP 112.26.2.8.43045 > 112.26.2.1.44877: Flags [S], seq 39129149, win 65535, options [mss 1460,sackOK,TS val 11179 ecr 0,nop,wscale 6,mptcp join id 4 token 0x187b1b60 nonce 0xb2f33846], length 0
10:42:02.452254 IP 112.26.2.8.43045 > 112.26.2.1.44877: Flags [S], seq 39129149, win 65535, options [mss 1460,sackOK,TS val 11179 ecr 0,nop,wscale 6,mptcp join id 4 token 0x187b1b60 nonce 0xb2f33846], length 0
10:42:02.523220 IP 112.26.2.8.43045 > 112.26.2.1.44877: Flags [S], seq 39129149, win 65535, options [mss 1460,sackOK,TS val 11179 ecr 0,nop,wscale 6,mptcp join id 4 token 0x187b1b60 nonce 0xb2f33846], length 0
10:42:02.652357 IP 112.26.2.1.44877 > 112.26.2.8.43045: Flags [S.], seq 2106607361, ack 39129150, win 65535, options [mss 1460,sackOK,TS val 224662 ecr 11179,nop,wscale 6,mptcp join id 4 hmac 0xc770272aca121974 nonce 0x379bd44b], length 0
10:42:02.715140 IP 112.26.2.1.44877 > 112.26.2.8.43045: Flags [S.], seq 2106607361, ack 39129150, win 65535, options [mss 1460,sackOK,TS val 224662 ecr 11179,nop,wscale 6,mptcp join id 4 hmac 0xc770272aca121974 nonce 0x379bd44b], length 0
10:42:02.765897 IP 112.26.2.8.43045 > 112.26.2.1.44877: Flags [.], ack 1, win 7072, options [nop,nop,TS val 11503 ecr 224662,mptcp join hmac 0x89b69000fc7779dcb2f95862dd28753cd6abd24c], length 0
10:42:02.835957 IP 112.26.2.8.43045 > 112.26.2.1.44877: Flags [.], ack 1, win 7072, options [nop,nop,TS val 11503 ecr 224662,mptcp join hmac 0x89b69000fc7779dcb2f95862dd28753cd6abd24c], length 0
10:42:31.937757 IP 112.26.2.1.44877 > 112.26.2.8.43045: Flags [.], seq 295597:297025, ack 1, win 4017, options [nop,nop,TS val 253359 ecr 39380,mptcp dss ack 3454339951 seq 445402148 subseq 295597 len 1428 csum 0xb2a3], length 1428
10:42:31.940604 IP 112.26.2.8.43045 > 112.26.2.1.44877: Flags [.], ack 288457, win 24355, options [nop,nop,TS val 40726 ecr 252797,nop,nop,sack 1 {289885:297025},mptcp dss ack 445327892], length 0
10:42:31.942735 IP 112.26.2.8.43045 > 112.26.2.1.44877: Flags [.], ack 288457, win 24355, options [nop,nop,TS val 40726 ecr 252797,nop,nop,sack 1 {289885:297025},mptcp dss ack 445327892], length 0
10:42:31.989217 IP 112.26.2.8.43045 > 112.26.2.1.44877: Flags [.], ack 288457, win 24355, options [nop,nop,TS val 40107 ecr 252797,mptcp dss ack 445327892], length 0
10:42:32.050934 IP 112.26.2.1.44877 > 112.26.2.8.43045: Flags [.], seq 298453:299881, ack 1, win 4017, options [nop,nop,TS val 253554 ecr 39521,mptcp dss ack 3454339951 seq 445412144 subseq 298453 len 1428 csum 0x67cf], length 1428
10:42:32.055616 IP 112.26.2.8.43045 > 112.26.2.1.44877: Flags [.], ack 288457, win 24355, options [nop,nop,TS val 40841 ecr 252797,nop,nop,sack 2 {298453:299881}{289885:297025},mptcp dss ack 445327892], length 0
10:42:32.061441 IP 112.26.2.8.43045 > 112.26.2.1.44877: Flags [.], ack 288457, win 24355, options [nop,nop,TS val 40841 ecr 252797,nop,nop,sack 2 {298453:299881}{289885:297025},mptcp dss ack 445327892], length 0
10:42:32.066068 IP 112.26.2.1.44877 > 112.26.2.8.43045: Flags [.], seq 298453:299881, ack 1, win 4017, options [nop,nop,TS val 253554 ecr 39521,mptcp dss ack 3454339951 seq 445412144 subseq 298453 len 1428 csum 0x67cf], length 1428
10:42:32.143920 IP 112.26.2.8.43045 > 112.26.2.1.44877: Flags [.], ack 288457, win 24355, options [nop,nop,TS val 40276 ecr 252797,nop,nop,sack 1 {289885:291313},mptcp dss ack 445327892], length 0
10:42:32.201032 IP 112.26.2.8.43045 > 112.26.2.1.44877: Flags [.], ack 288457, win 24355, options [nop,nop,TS val 40374 ecr 252797,nop,nop,sack 1 {289885:292741},mptcp dss ack 445327892], length 0
10:42:32.272434 IP 112.26.2.1.44877 > 112.26.2.8.43045: Flags [.], seq 299881:301309, ack 1, win 4017, options [nop,nop,TS val 253794 ecr 39750,mptcp dss ack 3454339951 seq 445430708 subseq 299881 len 1428 csum 0xb115], length 1428
10:42:32.275403 IP 112.26.2.1.44877 > 112.26.2.8.43045: Flags [.], seq 299881:301309, ack 1, win 4017, options [nop,nop,TS val 253794 ecr 39750,mptcp dss ack 3454339951 seq 445430708 subseq 299881 len 1428 csum 0xb115], length 1428
10:42:32.283087 IP 112.26.2.8.43045 > 112.26.2.1.44877: Flags [.], ack 288457, win 24355, options [nop,nop,TS val 41064 ecr 252797,nop,nop,sack 2 {298453:301309}{289885:297025},mptcp dss ack 445327892], length 0
10:42:32.291618 IP 112.26.2.8.43045 > 112.26.2.1.44877: Flags [.], ack 288457, win 24355, options [nop,nop,TS val 41064 ecr 252797,nop,nop,sack 2 {298453:301309}{289885:297025},mptcp dss ack 445327892], length 0
10:42:32.390018 IP 112.26.2.8.43045 > 112.26.2.1.44877: Flags [.], ack 288457, win 24355, options [nop,nop,TS val 40508 ecr 252797,nop,nop,sack 1 {289885:294169},mptcp dss ack 445327892], length 0
10:42:32.448760 IP 112.26.2.1.44877 > 112.26.2.8.43045: Flags [.], seq 301309:302737, ack 1, win 4017, options [nop,nop,TS val 253922 ecr 39901,mptcp dss ack 3454339951 seq 445432136 subseq 301309 len 1428 csum 0xc44f], length 1428
10:42:32.457955 IP 112.26.2.1.44877 > 112.26.2.8.43045: Flags [.], seq 301309:302737, ack 1, win 4017, options [nop,nop,TS val 253922 ecr 39901,mptcp dss ack 3454339951 seq 445432136 subseq 301309 len 1428 csum 0xc44f], length 1428
10:42:32.464067 IP 112.26.2.8.43045 > 112.26.2.1.44877: Flags [.], ack 288457, win 24222, options [nop,nop,TS val 41246 ecr 252797,nop,nop,sack 2 {298453:302737}{289885:297025},mptcp dss ack 445336460], length 0
10:42:32.466230 IP 112.26.2.8.43045 > 112.26.2.1.44877: Flags [.], ack 288457, win 24222, options [nop,nop,TS val 41246 ecr 252797,nop,nop,sack 2 {298453:302737}{289885:297025},mptcp dss ack 445336460], length 0
10:42:32.506272 IP 112.26.2.8.43045 > 112.26.2.1.44877: Flags [.], ack 288457, win 24355, options [nop,nop,TS val 40632 ecr 252797,nop,nop,sack 1 {289885:295597},mptcp dss ack 445327892], length 0
10:42:32.551021 IP 112.26.2.8.43045 > 112.26.2.1.44877: Flags [.], ack 288457, win 24355, options [nop,nop,TS val 40726 ecr 252797,nop,nop,sack 1 {289885:297025},mptcp dss ack 445327892], length 0
10:42:32.614305 IP 112.26.2.1.44877 > 112.26.2.8.43045: Flags [.], seq 302737:304165, ack 1, win 4017, options [nop,nop,TS val 254128 ecr 40107,mptcp dss ack 3454339951 seq 445436420 subseq 302737 len 1428 csum 0x3151], length 1428
10:42:32.622390 IP 112.26.2.1.44877 > 112.26.2.8.43045: Flags [.], seq 302737:304165, ack 1, win 4017, options [nop,nop,TS val 254128 ecr 40107,mptcp dss ack 3454339951 seq 445436420 subseq 302737 len 1428 csum 0x3151], length 1428
10:42:32.624528 IP 112.26.2.8.43045 > 112.26.2.1.44877: Flags [.], ack 288457, win 24222, options [nop,nop,TS val 41411 ecr 252797,nop,nop,sack 2 {298453:304165}{289885:297025},mptcp dss ack 445336460], length 0
10:42:32.636220 IP 112.26.2.8.43045 > 112.26.2.1.44877: Flags [.], ack 288457, win 24222, options [nop,nop,TS val 41411 ecr 252797,nop,nop,sack 2 {298453:304165}{289885:297025},mptcp dss ack 445336460], length 0
10:42:32.682314 IP 112.26.2.1.44877 > 112.26.2.8.43045: Flags [.], seq 304165:305593, ack 1, win 4017, options [nop,nop,TS val 254128 ecr 40107,mptcp dss ack 3454339951 seq 445437848 subseq 304165 len 1428 csum 0x2045], length 1428
10:42:32.734529 IP 112.26.2.1.44877 > 112.26.2.8.43045: Flags [.], seq 304165:305593, ack 1, win 4017, options [nop,nop,TS val 254128 ecr 40107,mptcp dss ack 3454339951 seq 445437848 subseq 304165 len 1428 csum 0x2045], length 1428
10:42:32.736521 IP 112.26.2.8.43045 > 112.26.2.1.44877: Flags [.], ack 288457, win 24222, options [nop,nop,TS val 41523 ecr 252797,nop,nop,sack 2 {298453:305593}{289885:297025},mptcp dss ack 445336460], length 0
10:42:32.745192 IP 112.26.2.8.43045 > 112.26.2.1.44877: Flags [.], ack 288457, win 24222, options [nop,nop,TS val 41523 ecr 252797,nop,nop,sack 2 {298453:305593}{289885:297025},mptcp dss ack 445336460], length 0
10:42:32.776015 IP 112.26.2.8.43045 > 112.26.2.1.44877: Flags [.], ack 288457, win 24355, options [nop,nop,TS val 40841 ecr 252797,nop,nop,sack 2 {298453:299881}{289885:297025},mptcp dss ack 445327892], length 0
10:42:32.820099 IP 112.26.2.1.44877 > 112.26.2.8.43045: Flags [.], seq 305593:307021, ack 1, win 4017, options [nop,nop,TS val 254340 ecr 40276,mptcp dss ack 3454339951 seq 445446416 subseq 305593 len 1428 csum 0x7f13], length 1428
10:42:32.823725 IP 112.26.2.1.44877 > 112.26.2.8.43045: Flags [.], seq 305593:307021, ack 1, win 4017, options [nop,nop,TS val 254340 ecr 40276,mptcp dss ack 3454339951 seq 445446416 subseq 305593 len 1428 csum 0x7f13], length 1428
10:42:32.825328 IP 112.26.2.8.43045 > 112.26.2.1.44877: Flags [.], ack 288457, win 24222, options [nop,nop,TS val 41612 ecr 252797,nop,nop,sack 2 {298453:307021}{289885:297025},mptcp dss ack 445336460], length 0
10:42:32.847072 IP 112.26.2.8.43045 > 112.26.2.1.44877: Flags [.], ack 288457, win 24222, options [nop,nop,TS val 41612 ecr 252797,nop,nop,sack 2 {298453:307021}{289885:297025},mptcp dss ack 445336460], length 0
10:42:32.894224 IP 112.26.2.8.43045 > 112.26.2.1.44877: Flags [.], ack 288457, win 24355, options [nop,nop,TS val 41064 ecr 252797,nop,nop,sack 2 {298453:301309}{289885:297025},mptcp dss ack 445327892], length 0
10:42:32.954562 IP 112.26.2.1.44877 > 112.26.2.8.43045: Flags [.], seq 307021:308449, ack 1, win 4017, options [nop,nop,TS val 254378 ecr 40374,mptcp dss ack 3454339951 seq 445447844 subseq 307021 len 1428 csum 0xf897], length 1428
10:42:32.958631 IP 112.26.2.1.44877 > 112.26.2.8.43045: Flags [.], seq 307021:308449, ack 1, win 4017, options [nop,nop,TS val 254378 ecr 40374,mptcp dss ack 3454339951 seq 445447844 subseq 307021 len 1428 csum 0xf897], length 1428
10:42:32.960680 IP 112.26.2.8.43045 > 112.26.2.1.44877: Flags [.], ack 288457, win 24222, options [nop,nop,TS val 41747 ecr 252797,nop,nop,sack 2 {298453:308449}{289885:297025},mptcp dss ack 445336460], length 0
10:42:32.962210 IP 112.26.2.8.43045 > 112.26.2.1.44877: Flags [.], ack 288457, win 24222, options [nop,nop,TS val 41747 ecr 252797,nop,nop,sack 2 {298453:308449}{289885:297025},mptcp dss ack 445336460], length 0
10:42:33.027925 IP 112.26.2.1.44877 > 112.26.2.8.43045: Flags [.], seq 288457:289885, ack 1, win 4017, options [nop,nop,TS val 254529 ecr 40508,mptcp dss ack 3454339951 seq 445375016 subseq 288457 len 1428 csum 0x2503], length 1428
10:42:33.065604 IP 112.26.2.1.44877 > 112.26.2.8.43045: Flags [.], seq 288457:289885, ack 1, win 4017, options [nop,nop,TS val 254529 ecr 40508,mptcp dss ack 3454339951 seq 445375016 subseq 288457 len 1428 csum 0x2503], length 1428
10:42:33.067323 IP 112.26.2.8.43045 > 112.26.2.1.44877: Flags [.], ack 297025, win 24222, options [nop,nop,TS val 41854 ecr 254529,nop,nop,sack 1 {298453:308449},mptcp dss ack 445336460], length 0
10:42:33.082474 IP 112.26.2.8.43045 > 112.26.2.1.44877: Flags [.], ack 297025, win 24222, options [nop,nop,TS val 41854 ecr 254529,nop,nop,sack 1 {298453:308449},mptcp dss ack 445336460], length 0
10:42:33.124006 IP 112.26.2.8.43045 > 112.26.2.1.44877: Flags [.], ack 288457, win 24222, options [nop,nop,TS val 41246 ecr 252797,nop,nop,sack 2 {298453:302737}{289885:297025},mptcp dss ack 445336460], length 0
10:42:33.166673 IP 112.26.2.1.44877 > 112.26.2.8.43045: Flags [.], seq 308449:309877, ack 1, win 4017, options [nop,nop,TS val 254659 ecr 40632,mptcp dss ack 3454339951 seq 445454984 subseq 308449 len 1428 csum 0x87], length 1428
10:42:33.169078 IP 112.26.2.1.44877 > 112.26.2.8.43045: Flags [.], seq 308449:309877, ack 1, win 4017, options [nop,nop,TS val 254659 ecr 40632,mptcp dss ack 3454339951 seq 445454984 subseq 308449 len 1428 csum 0x87], length 1428
10:42:33.199413 IP 112.26.2.8.43045 > 112.26.2.1.44877: Flags [.], ack 297025, win 24222, options [nop,nop,TS val 41957 ecr 254529,nop,nop,sack 1 {298453:309877},mptcp dss ack 445336460], length 0
10:42:33.202235 IP 112.26.2.8.43045 > 112.26.2.1.44877: Flags [.], ack 297025, win 24222, options [nop,nop,TS val 41957 ecr 254529,nop,nop,sack 1 {298453:309877},mptcp dss ack 445336460], length 0
10:42:33.271857 IP 112.26.2.8.43045 > 112.26.2.1.44877: Flags [.], ack 288457, win 24222, options [nop,nop,TS val 41411 ecr 252797,nop,nop,sack 2 {298453:304165}{289885:297025},mptcp dss ack 445336460], length 0
10:42:33.348117 IP 112.26.2.8.43045 > 112.26.2.1.44877: Flags [.], ack 288457, win 24222, options [nop,nop,TS val 41523 ecr 252797,nop,nop,sack 2 {298453:305593}{289885:297025},mptcp dss ack 445336460], length 0
10:42:33.435530 IP 112.26.2.8.43045 > 112.26.2.1.44877: Flags [.], ack 288457, win 24222, options [nop,nop,TS val 41612 ecr 252797,nop,nop,sack 2 {298453:307021}{289885:297025},mptcp dss ack 445336460], length 0
10:42:33.479994 IP 112.26.2.1.44877 > 112.26.2.8.43045: Flags [.], seq 297025:298453, ack 1, win 4017, options [nop,nop,TS val 255032 ecr 41064,mptcp dss ack 3454339951 seq 445403576 subseq 297025 len 1428 csum 0x8b61], length 1428
10:42:33.483407 IP 112.26.2.8.43045 > 112.26.2.1.44877: Flags [.], ack 309877, win 24222, options [nop,nop,TS val 42270 ecr 255032,mptcp dss ack 445336460], length 0
10:42:33.488318 IP 112.26.2.8.43045 > 112.26.2.1.44877: Flags [.], ack 309877, win 24222, options [nop,nop,TS val 42270 ecr 255032,mptcp dss ack 445336460], length 0
10:42:33.505523 IP 112.26.2.1.44877 > 112.26.2.8.43045: Flags [.], seq 297025:298453, ack 1, win 4017, options [nop,nop,TS val 255032 ecr 41064,mptcp dss ack 3454339951 seq 445403576 subseq 297025 len 1428 csum 0x8b61], length 1428
10:42:33.581992 IP 112.26.2.8.43045 > 112.26.2.1.44877: Flags [.], ack 288457, win 24222, options [nop,nop,TS val 41747 ecr 252797,nop,nop,sack 2 {298453:308449}{289885:297025},mptcp dss ack 445336460], length 0
10:42:33.643937 IP 112.26.2.8.43045 > 112.26.2.1.44877: Flags [.], ack 297025, win 24222, options [nop,nop,TS val 41854 ecr 254529,nop,nop,sack 1 {298453:308449},mptcp dss ack 445336460], length 0
10:42:33.718404 IP 112.26.2.8.43045 > 112.26.2.1.44877: Flags [.], ack 297025, win 24222, options [nop,nop,TS val 41957 ecr 254529,nop,nop,sack 1 {298453:309877},mptcp dss ack 445336460], length 0
10:42:33.763239 IP 112.26.2.1.44877 > 112.26.2.8.43045: Flags [.], seq 309877:311305, ack 1, win 4017, options [nop,nop,TS val 255334 ecr 41246,mptcp dss ack 3454339951 seq 445474976 subseq 309877 len 1428 csum 0xf562], length 1428
10:42:33.767237 IP 112.26.2.1.44877 > 112.26.2.8.43045: Flags [.], seq 309877:311305, ack 1, win 4017, options [nop,nop,TS val 255334 ecr 41246,mptcp dss ack 3454339951 seq 445474976 subseq 309877 len 1428 csum 0xf562], length 1428
10:42:33.769239 IP 112.26.2.8.43045 > 112.26.2.1.44877: Flags [.], ack 311305, win 24222, options [nop,nop,TS val 42556 ecr 255334,mptcp dss ack 445336460], length 0
10:42:33.774892 IP 112.26.2.8.43045 > 112.26.2.1.44877: Flags [.], ack 311305, win 24222, options [nop,nop,TS val 42556 ecr 255334,mptcp dss ack 445336460], length 0
10:42:33.836886 IP 112.26.2.1.44877 > 112.26.2.8.43045: Flags [.], seq 311305:312733, ack 1, win 4017, options [nop,nop,TS val 255413 ecr 41411,mptcp dss ack 3454339951 seq 445477832 subseq 311305 len 1428 csum 0xf23d], length 1428
10:42:33.843671 IP 112.26.2.1.44877 > 112.26.2.8.43045: Flags [.], seq 311305:312733, ack 1, win 4017, options [nop,nop,TS val 255413 ecr 41411,mptcp dss ack 3454339951 seq 445477832 subseq 311305 len 1428 csum 0xf23d], length 1428
10:42:33.846732 IP 112.26.2.8.43045 > 112.26.2.1.44877: Flags [.], ack 312733, win 24222, options [nop,nop,TS val 42627 ecr 255413,mptcp dss ack 445336460], length 0
10:42:33.853302 IP 112.26.2.8.43045 > 112.26.2.1.44877: Flags [.], ack 312733, win 24222, options [nop,nop,TS val 42627 ecr 255413,mptcp dss ack 445336460], length 0
10:42:33.895417 IP 112.26.2.1.44877 > 112.26.2.8.43045: Flags [.], seq 312733:314161, ack 1, win 4017, options [nop,nop,TS val 255492 ecr 41523,mptcp dss ack 3454339951 seq 445480688 subseq 312733 len 1428 csum 0x837b], length 1428
10:42:33.933968 IP 112.26.2.1.44877 > 112.26.2.8.43045: Flags [.], seq 312733:314161, ack 1, win 4017, options [nop,nop,TS val 255492 ecr 41523,mptcp dss ack 3454339951 seq 445480688 subseq 312733 len 1428 csum 0x837b], length 1428
10:42:33.935642 IP 112.26.2.8.43045 > 112.26.2.1.44877: Flags [.], ack 314161, win 24486, options [nop,nop,TS val 42722 ecr 255492,mptcp dss ack 445453556], length 0
10:42:33.938317 IP 112.26.2.8.43045 > 112.26.2.1.44877: Flags [.], ack 314161, win 24486, options [nop,nop,TS val 42722 ecr 255492,mptcp dss ack 445453556], length 0
10:42:33.957685 IP 112.26.2.1.44877 > 112.26.2.8.43045: Flags [.], seq 314161:315589, ack 1, win 4017, options [nop,nop,TS val 255601 ecr 41612,mptcp dss ack 3454339951 seq 445486400 subseq 314161 len 1428 csum 0xb74c], length 1428
10:42:34.002987 IP 112.26.2.1.44877 > 112.26.2.8.43045: Flags [.], seq 314161:315589, ack 1, win 4017, options [nop,nop,TS val 255601 ecr 41612,mptcp dss ack 3454339951 seq 445486400 subseq 314161 len 1428 csum 0xb74c], length 1428
10:42:34.005947 IP 112.26.2.8.43045 > 112.26.2.1.44877: Flags [.], ack 315589, win 24486, options [nop,nop,TS val 42791 ecr 255601,mptcp dss ack 445453556], length 0
10:42:34.022142 IP 112.26.2.8.43045 > 112.26.2.1.44877: Flags [.], ack 315589, win 24486, options [nop,nop,TS val 42791 ecr 255601,mptcp dss ack 445453556], length 0
10:42:34.038454 IP 112.26.2.8.43045 > 112.26.2.1.44877: Flags [.], ack 309877, win 24222, options [nop,nop,TS val 42270 ecr 255032,mptcp dss ack 445336460], length 0
10:42:34.119162 IP 112.26.2.1.44877 > 112.26.2.8.43045: Flags [.], seq 315589:317017, ack 1, win 4017, options [nop,nop,TS val 255750 ecr 41747,mptcp dss ack 3454339951 seq 445492112 subseq 315589 len 1428 csum 0xfcd9], length 1428
10:42:34.122179 IP 112.26.2.1.44877 > 112.26.2.8.43045: Flags [.], seq 315589:317017, ack 1, win 4017, options [nop,nop,TS val 255750 ecr 41747,mptcp dss ack 3454339951 seq 445492112 subseq 315589 len 1428 csum 0xfcd9], length 1428
10:42:34.124002 IP 112.26.2.8.43045 > 112.26.2.1.44877: Flags [.], ack 317017, win 24486, options [nop,nop,TS val 42910 ecr 255750,mptcp dss ack 445453556], length 0
10:42:34.133884 IP 112.26.2.8.43045 > 112.26.2.1.44877: Flags [.], ack 317017, win 24486, options [nop,nop,TS val 42910 ecr 255750,mptcp dss ack 445453556], length 0
10:42:34.216087 IP 112.26.2.1.44877 > 112.26.2.8.43045: Flags [.], seq 317017:318445, ack 1, win 4017, options [nop,nop,TS val 255782 ecr 41854,mptcp dss ack 3454339951 seq 445499252 subseq 317017 len 1428 csum 0xdaa6], length 1428
10:42:34.233364 IP 112.26.2.1.44877 > 112.26.2.8.43045: Flags [.], seq 317017:318445, ack 1, win 4017, options [nop,nop,TS val 255782 ecr 41854,mptcp dss ack 3454339951 seq 445499252 subseq 317017 len 1428 csum 0xdaa6], length 1428
10:42:34.234746 IP 112.26.2.8.43045 > 112.26.2.1.44877: Flags [.], ack 318445, win 24486, options [nop,nop,TS val 43021 ecr 255782,mptcp dss ack 445453556], length 0
10:42:34.242315 IP 112.26.2.8.43045 > 112.26.2.1.44877: Flags [.], ack 318445, win 24486, options [nop,nop,TS val 43021 ecr 255782,mptcp dss ack 445453556], length 0
10:42:34.312097 IP 112.26.2.1.44877 > 112.26.2.8.43045: Flags [.], seq 318445:319873, ack 1, win 4017, options [nop,nop,TS val 255862 ecr 41957,mptcp dss ack 3454339951 seq 445502108 subseq 318445 len 1428 csum 0xe26c], length 1428
10:42:34.314158 IP 112.26.2.1.44877 > 112.26.2.8.43045: Flags [.], seq 318445:319873, ack 1, win 4017, options [nop,nop,TS val 255862 ecr 41957,mptcp dss ack 3454339951 seq 445502108 subseq 318445 len 1428 csum 0xe26c], length 1428
10:42:34.315725 IP 112.26.2.8.43045 > 112.26.2.1.44877: Flags [.], ack 319873, win 24486, options [nop,nop,TS val 43102 ecr 255862,mptcp dss ack 445453556], length 0
10:42:34.321554 IP 112.26.2.8.43045 > 112.26.2.1.44877: Flags [.], ack 319873, win 24486, options [nop,nop,TS val 43102 ecr 255862,mptcp dss ack 445453556], length 0
10:42:34.378741 IP 112.26.2.8.43045 > 112.26.2.1.44877: Flags [.], ack 311305, win 24222, options [nop,nop,TS val 42556 ecr 255334,mptcp dss ack 445336460], length 0
10:42:34.423293 IP 112.26.2.8.43045 > 112.26.2.1.44877: Flags [.], ack 312733, win 24222, options [nop,nop,TS val 42627 ecr 255413,mptcp dss ack 445336460], length 0
10:42:34.505606 IP 112.26.2.8.43045 > 112.26.2.1.44877: Flags [.], ack 314161, win 24486, options [nop,nop,TS val 42722 ecr 255492,mptcp dss ack 445453556], length 0
10:42:34.565056 IP 112.26.2.8.43045 > 112.26.2.1.44877: Flags [.], ack 315589, win 24486, options [nop,nop,TS val 42791 ecr 255601,mptcp dss ack 445453556], length 0
10:42:34.630714 IP 112.26.2.1.44877 > 112.26.2.8.43045: Flags [.], seq 319873:321301, ack 1, win 4017, options [nop,nop,TS val 256177 ecr 42270,mptcp dss ack 3454339951 seq 445514960 subseq 319873 len 1428 csum 0x6f49], length 1428
10:42:34.635633 IP 112.26.2.1.44877 > 112.26.2.8.43045: Flags [.], seq 319873:321301, ack 1, win 4017, options [nop,nop,TS val 256177 ecr 42270,mptcp dss ack 3454339951 seq 445514960 subseq 319873 len 1428 csum 0x6f49], length 1428
10:42:34.665511 IP 112.26.2.8.43045 > 112.26.2.1.44877: Flags [.], ack 321301, win 24486, options [nop,nop,TS val 43424 ecr 256177,mptcp dss ack 445453556], length 0
10:42:34.667158 IP 112.26.2.8.43045 > 112.26.2.1.44877: Flags [.], ack 321301, win 24486, options [nop,nop,TS val 43424 ecr 256177,mptcp dss ack 445453556], length 0
10:42:34.724979 IP 112.26.2.8.43045 > 112.26.2.1.44877: Flags [.], ack 317017, win 24486, options [nop,nop,TS val 42910 ecr 255750,mptcp dss ack 445453556], length 0
10:42:34.785534 IP 112.26.2.8.43045 > 112.26.2.1.44877: Flags [.], ack 318445, win 24486, options [nop,nop,TS val 43021 ecr 255782,mptcp dss ack 445453556], length 0
10:42:34.854377 IP 112.26.2.8.43045 > 112.26.2.1.44877: Flags [.], ack 319873, win 24486, options [nop,nop,TS val 43102 ecr 255862,mptcp dss ack 445453556], length 0
10:42:34.904141 IP 112.26.2.1.44877 > 112.26.2.8.43045: Flags [.], seq 321301:322729, ack 1, win 4017, options [nop,nop,TS val 256517 ecr 42556,mptcp dss ack 3454339951 seq 445523528 subseq 321301 len 1428 csum 0xbc7e], length 1428
10:42:34.907429 IP 112.26.2.1.44877 > 112.26.2.8.43045: Flags [.], seq 321301:322729, ack 1, win 4017, options [nop,nop,TS val 256517 ecr 42556,mptcp dss ack 3454339951 seq 445523528 subseq 321301 len 1428 csum 0xbc7e], length 1428
10:42:34.913485 IP 112.26.2.8.43045 > 112.26.2.1.44877: Flags [.], ack 322729, win 24386, options [nop,nop,TS val 43696 ecr 256517,mptcp dss ack 445487828], length 0
10:42:34.920681 IP 112.26.2.8.43045 > 112.26.2.1.44877: Flags [.], ack 322729, win 24386, options [nop,nop,TS val 43696 ecr 256517,mptcp dss ack 445487828], length 0
10:42:34.974501 IP 112.26.2.1.44877 > 112.26.2.8.43045: Flags [.], seq 322729:324157, ack 1, win 4017, options [nop,nop,TS val 256562 ecr 42627,mptcp dss ack 3454339951 seq 445527812 subseq 322729 len 1428 csum 0xb562], length 1428
10:42:34.991675 IP 112.26.2.1.44877 > 112.26.2.8.43045: Flags [.], seq 322729:324157, ack 1, win 4017, options [nop,nop,TS val 256562 ecr 42627,mptcp dss ack 3454339951 seq 445527812 subseq 322729 len 1428 csum 0xb562], length 1428
10:42:34.993348 IP 112.26.2.8.43045 > 112.26.2.1.44877: Flags [.], ack 324157, win 24386, options [nop,nop,TS val 43780 ecr 256562,mptcp dss ack 445487828], length 0
10:42:34.994895 IP 112.26.2.8.43045 > 112.26.2.1.44877: Flags [.], ack 324157, win 24386, options [nop,nop,TS val 43780 ecr 256562,mptcp dss ack 445487828], length 0
10:42:35.078220 IP 112.26.2.1.44877 > 112.26.2.8.43045: Flags [.], seq 324157:325585, ack 1, win 4017, options [nop,nop,TS val 256644 ecr 42722,mptcp dss ack 3454339951 seq 445532096 subseq 324157 len 1428 csum 0x988b], length 1428
10:42:35.080867 IP 112.26.2.1.44877 > 112.26.2.8.43045: Flags [.], seq 324157:325585, ack 1, win 4017, options [nop,nop,TS val 256644 ecr 42722,mptcp dss ack 3454339951 seq 445532096 subseq 324157 len 1428 csum 0x988b], length 1428
10:42:35.082267 IP 112.26.2.8.43045 > 112.26.2.1.44877: Flags [.], ack 325585, win 24386, options [nop,nop,TS val 43869 ecr 256644,mptcp dss ack 445487828], length 0
10:42:35.088296 IP 112.26.2.8.43045 > 112.26.2.1.44877: Flags [.], ack 325585, win 24386, options [nop,nop,TS val 43869 ecr 256644,mptcp dss ack 445487828], length 0
10:42:35.136757 IP 112.26.2.1.44877 > 112.26.2.8.43045: Flags [.], seq 325585:327013, ack 1, win 4017, options [nop,nop,TS val 256644 ecr 42722,mptcp dss ack 3454339951 seq 445533524 subseq 325585 len 1428 csum 0xe877], length 1428
10:42:35.189368 IP 112.26.2.1.44877 > 112.26.2.8.43045: Flags [.], seq 325585:327013, ack 1, win 4017, options [nop,nop,TS val 256644 ecr 42722,mptcp dss ack 3454339951 seq 445533524 subseq 325585 len 1428 csum 0xe877], length 1428
10:42:35.193630 IP 112.26.2.8.43045 > 112.26.2.1.44877: Flags [.], ack 327013, win 24386, options [nop,nop,TS val 43978 ecr 256644,mptcp dss ack 445487828], length 0
10:42:35.197511 IP 112.26.2.8.43045 > 112.26.2.1.44877: Flags [.], ack 327013, win 24386, options [nop,nop,TS val 43978 ecr 256644,mptcp dss ack 445487828], length 0
10:42:35.209607 IP 112.26.2.1.44877 > 112.26.2.8.43045: Flags [.], seq 327013:328441, ack 1, win 4017, options [nop,nop,TS val 256703 ecr 42791,mptcp dss ack 3454339951 seq 445542092 subseq 327013 len 1428 csum 0xb77a], length 1428
10:42:35.263269 IP 112.26.2.8.43045 > 112.26.2.1.44877: Flags [.], ack 321301, win 24486, options [nop,nop,TS val 43424 ecr 256177,mptcp dss ack 445453556], length 0
10:42:35.277259 IP 112.26.2.1.44877 > 112.26.2.8.43045: Flags [.], seq 327013:328441, ack 1, win 4017, options [nop,nop,TS val 256703 ecr 42791,mptcp dss ack 3454339951 seq 445542092 subseq 327013 len 1428 csum 0xb77a], length 1428
10:42:35.293321 IP 112.26.2.8.43045 > 112.26.2.1.44877: Flags [.], ack 328441, win 24386, options [nop,nop,TS val 44066 ecr 256703,mptcp dss ack 445487828], length 0
10:42:35.295251 IP 112.26.2.8.43045 > 112.26.2.1.44877: Flags [.], ack 328441, win 24386, options [nop,nop,TS val 44066 ecr 256703,mptcp dss ack 445487828], length 0
10:42:35.369451 IP 112.26.2.1.44877 > 112.26.2.8.43045: Flags [.], seq 328441:329869, ack 1, win 4017, options [nop,nop,TS val 256863 ecr 42910,mptcp dss ack 3454339951 seq 445546376 subseq 328441 len 1428 csum 0x3e89], length 1428
10:42:35.371608 IP 112.26.2.1.44877 > 112.26.2.8.43045: Flags [.], seq 328441:329869, ack 1, win 4017, options [nop,nop,TS val 256863 ecr 42910,mptcp dss ack 3454339951 seq 445546376 subseq 328441 len 1428 csum 0x3e89], length 1428
10:42:35.383566 IP 112.26.2.8.43045 > 112.26.2.1.44877: Flags [.], ack 329869, win 24386, options [nop,nop,TS val 44160 ecr 256863,mptcp dss ack 445487828], length 0
10:42:35.389120 IP 112.26.2.8.43045 > 112.26.2.1.44877: Flags [.], ack 329869, win 24386, options [nop,nop,TS val 44160 ecr 256863,mptcp dss ack 445487828], length 0
10:42:35.479971 IP 112.26.2.1.44877 > 112.26.2.8.43045: Flags [.], seq 329869:331297, ack 1, win 4017, options [nop,nop,TS val 256924 ecr 43021,mptcp dss ack 3454339951 seq 445549232 subseq 329869 len 1428 csum 0x331], length 1428
10:42:35.481836 IP 112.26.2.1.44877 > 112.26.2.8.43045: Flags [.], seq 329869:331297, ack 1, win 4017, options [nop,nop,TS val 256924 ecr 43021,mptcp dss ack 3454339951 seq 445549232 subseq 329869 len 1428 csum 0x331], length 1428
10:42:35.523935 IP 112.26.2.8.43045 > 112.26.2.1.44877: Flags [.], ack 331297, win 24386, options [nop,nop,TS val 44311 ecr 256924,mptcp dss ack 445487828], length 0
10:42:35.526875 IP 112.26.2.8.43045 > 112.26.2.1.44877: Flags [.], ack 331297, win 24386, options [nop,nop,TS val 44311 ecr 256924,mptcp dss ack 445487828], length 0
10:42:35.547513 IP 112.26.2.1.44877 > 112.26.2.8.43045: Flags [.], seq 331297:332725, ack 1, win 4017, options [nop,nop,TS val 256993 ecr 43102,mptcp dss ack 3454339951 seq 445550660 subseq 331297 len 1428 csum 0xa4da], length 1428
10:42:35.554106 IP 112.26.2.1.44877 > 112.26.2.8.43045: Flags [.], seq 331297:332725, ack 1, win 4017, options [nop,nop,TS val 256993 ecr 43102,mptcp dss ack 3454339951 seq 445550660 subseq 331297 len 1428 csum 0xa4da], length 1428
10:42:35.647863 IP 112.26.2.8.43045 > 112.26.2.1.44877: Flags [.], ack 324157, win 24386, options [nop,nop,TS val 43780 ecr 256562,mptcp dss ack 445487828], length 0
10:42:35.677036 IP 112.26.2.8.43045 > 112.26.2.1.44877: Flags [.], ack 332725, win 24386, options [nop,nop,TS val 44464 ecr 256993,mptcp dss ack 445487828], length 0
10:42:35.678446 IP 112.26.2.8.43045 > 112.26.2.1.44877: Flags [.], ack 332725, win 24386, options [nop,nop,TS val 44464 ecr 256993,mptcp dss ack 445487828], length 0
10:42:35.707648 IP 112.26.2.8.43045 > 112.26.2.1.44877: Flags [.], ack 325585, win 24386, options [nop,nop,TS val 43869 ecr 256644,mptcp dss ack 445487828], length 0
10:42:35.746273 IP 112.26.2.8.43045 > 112.26.2.1.44877: Flags [.], ack 327013, win 24386, options [nop,nop,TS val 43978 ecr 256644,mptcp dss ack 445487828], length 0
10:42:35.803417 IP 112.26.2.1.44877 > 112.26.2.8.43045: Flags [.], seq 332725:334153, ack 1, win 4017, options [nop,nop,TS val 257401 ecr 43424,mptcp dss ack 3454339951 seq 445557800 subseq 332725 len 1428 csum 0xacec], length 1428
10:42:35.805559 IP 112.26.2.1.44877 > 112.26.2.8.43045: Flags [.], seq 332725:334153, ack 1, win 4017, options [nop,nop,TS val 257401 ecr 43424,mptcp dss ack 3454339951 seq 445557800 subseq 332725 len 1428 csum 0xacec], length 1428
10:42:35.872886 IP 112.26.2.8.43045 > 112.26.2.1.44877: Flags [.], ack 328441, win 24386, options [nop,nop,TS val 44066 ecr 256703,mptcp dss ack 445487828], length 0
10:42:35.912703 IP 112.26.2.8.43045 > 112.26.2.1.44877: Flags [.], ack 329869, win 24386, options [nop,nop,TS val 44160 ecr 256863,mptcp dss ack 445487828], length 0
10:42:35.987039 IP 112.26.2.8.43045 > 112.26.2.1.44877: Flags [.], ack 331297, win 24386, options [nop,nop,TS val 44311 ecr 256924,mptcp dss ack 445487828], length 0
10:42:36.036503 IP 112.26.2.8.43045 > 112.26.2.1.44877: Flags [.], ack 334153, win 24386, options [nop,nop,TS val 44824 ecr 257401,mptcp dss ack 445487828], length 0
10:42:36.037929 IP 112.26.2.8.43045 > 112.26.2.1.44877: Flags [.], ack 334153, win 24386, options [nop,nop,TS val 44824 ecr 257401,mptcp dss ack 445487828], length 0
10:42:36.049359 IP 112.26.2.1.44877 > 112.26.2.8.43045: Flags [.], seq 334153:335581, ack 1, win 4017, options [nop,nop,TS val 257786 ecr 43780,mptcp dss ack 3454339951 seq 445574936 subseq 334153 len 1428 csum 0xd47a], length 1428
10:42:36.065561 IP 112.26.2.1.44877 > 112.26.2.8.43045: Flags [.], seq 334153:335581, ack 1, win 4017, options [nop,nop,TS val 257786 ecr 43780,mptcp dss ack 3454339951 seq 445574936 subseq 334153 len 1428 csum 0xd47a], length 1428
10:42:36.166204 IP 112.26.2.8.43045 > 112.26.2.1.44877: Flags [.], ack 332725, win 24386, options [nop,nop,TS val 44464 ecr 256993,mptcp dss ack 445487828], length 0
10:42:36.230709 IP 112.26.2.1.44877 > 112.26.2.8.43045: Flags [P.], seq 335581:337009, ack 1, win 4017, options [nop,nop,TS val 257786 ecr 43780,mptcp dss ack 3454339951 seq 445576364 subseq 335581 len 1428 csum 0x65bc], length 1428
10:42:36.234836 IP 112.26.2.1.44877 > 112.26.2.8.43045: Flags [P.], seq 335581:337009, ack 1, win 4017, options [nop,nop,TS val 257786 ecr 43780,mptcp dss ack 3454339951 seq 445576364 subseq 335581 len 1428 csum 0x65bc], length 1428
10:42:36.316622 IP 112.26.2.1.44877 > 112.26.2.8.43045: Flags [.], seq 337009:338437, ack 1, win 4017, options [nop,nop,TS val 257846 ecr 43869,mptcp dss ack 3454339951 seq 445579220 subseq 337009 len 1428 csum 0x73fb], length 1428
10:42:36.321468 IP 112.26.2.8.43045 > 112.26.2.1.44877: Flags [.], ack 338437, win 24133, options [nop,nop,TS val 45107 ecr 257786,mptcp dss ack 445512104], length 0
10:42:36.332935 IP 112.26.2.8.43045 > 112.26.2.1.44877: Flags [.], ack 338437, win 24133, options [nop,nop,TS val 45107 ecr 257786,mptcp dss ack 445512104], length 0
10:42:36.359148 IP 112.26.2.1.44877 > 112.26.2.8.43045: Flags [.], seq 337009:338437, ack 1, win 4017, options [nop,nop,TS val 257846 ecr 43869,mptcp dss ack 3454339951 seq 445579220 subseq 337009 len 1428 csum 0x73fb], length 1428
10:42:36.384564 IP 112.26.2.1.44877 > 112.26.2.8.43045: Flags [.], seq 338437:339865, ack 1, win 4017, options [nop,nop,TS val 257885 ecr 43978,mptcp dss ack 3454339951 seq 445580648 subseq 338437 len 1428 csum 0x268e], length 1428
10:42:36.396512 IP 112.26.2.1.44877 > 112.26.2.8.43045: Flags [.], seq 338437:339865, ack 1, win 4017, options [nop,nop,TS val 257885 ecr 43978,mptcp dss ack 3454339951 seq 445580648 subseq 338437 len 1428 csum 0x268e], length 1428
10:42:36.460934 IP 112.26.2.1.44877 > 112.26.2.8.43045: Flags [.], seq 339865:341293, ack 1, win 4017, options [nop,nop,TS val 257885 ecr 43978,mptcp dss ack 3454339951 seq 445582076 subseq 339865 len 1428 csum 0xbe6e], length 1428
10:42:36.480942 IP 112.26.2.1.44877 > 112.26.2.8.43045: Flags [.], seq 339865:341293, ack 1, win 4017, options [nop,nop,TS val 257885 ecr 43978,mptcp dss ack 3454339951 seq 445582076 subseq 339865 len 1428 csum 0xbe6e], length 1428
10:42:36.482860 IP 112.26.2.8.43045 > 112.26.2.1.44877: Flags [.], ack 341293, win 24208, options [nop,nop,TS val 45269 ecr 257885,mptcp dss ack 445536380], length 0
10:42:36.493802 IP 112.26.2.8.43045 > 112.26.2.1.44877: Flags [.], ack 341293, win 24208, options [nop,nop,TS val 45269 ecr 257885,mptcp dss ack 445536380], length 0
10:42:36.527928 IP 112.26.2.1.44877 > 112.26.2.8.43045: Flags [.], seq 341293:342721, ack 1, win 4017, options [nop,nop,TS val 258011 ecr 44066,mptcp dss ack 3454339951 seq 445586360 subseq 341293 len 1428 csum 0x598e], length 1428
10:42:36.573113 IP 112.26.2.1.44877 > 112.26.2.8.43045: Flags [.], seq 341293:342721, ack 1, win 4017, options [nop,nop,TS val 258011 ecr 44066,mptcp dss ack 3454339951 seq 445586360 subseq 341293 len 1428 csum 0x598e], length 1428
10:42:36.591102 IP 112.26.2.1.44877 > 112.26.2.8.43045: Flags [.], seq 342721:344149, ack 1, win 4017, options [nop,nop,TS val 258051 ecr 44160,mptcp dss ack 3454339951 seq 445587788 subseq 342721 len 1428 csum 0x46e6], length 1428
10:42:36.647134 IP 112.26.2.1.44877 > 112.26.2.8.43045: Flags [.], seq 342721:344149, ack 1, win 4017, options [nop,nop,TS val 258051 ecr 44160,mptcp dss ack 3454339951 seq 445587788 subseq 342721 len 1428 csum 0x46e6], length 1428
10:42:36.662617 IP 112.26.2.8.43045 > 112.26.2.1.44877: Flags [.], ack 334153, win 24386, options [nop,nop,TS val 44824 ecr 257401,mptcp dss ack 445487828], length 0
10:42:36.741989 IP 112.26.2.1.44877 > 112.26.2.8.43045: Flags [.], seq 344149:345577, ack 1, win 4017, options [nop,nop,TS val 258125 ecr 44311,mptcp dss ack 3454339951 seq 445592072 subseq 344149 len 1428 csum 0xce7b], length 1428
10:42:36.743774 IP 112.26.2.1.44877 > 112.26.2.8.43045: Flags [.], seq 344149:345577, ack 1, win 4017, options [nop,nop,TS val 258125 ecr 44311,mptcp dss ack 3454339951 seq 445592072 subseq 344149 len 1428 csum 0xce7b], length 1428
10:42:36.745289 IP 112.26.2.8.43045 > 112.26.2.1.44877: Flags [.], ack 345577, win 24142, options [nop,nop,TS val 45532 ecr 258011,mptcp dss ack 445540664], length 0
10:42:36.753633 IP 112.26.2.8.43045 > 112.26.2.1.44877: Flags [.], ack 345577, win 24142, options [nop,nop,TS val 45532 ecr 258011,mptcp dss ack 445540664], length 0
10:42:36.785450 IP 112.26.2.1.44877 > 112.26.2.8.43045: Flags [.], seq 345577:347005, ack 1, win 4017, options [nop,nop,TS val 258304 ecr 44464,mptcp dss ack 3454339951 seq 445594928 subseq 345577 len 1428 csum 0x3149], length 1428
10:42:36.819731 IP 112.26.2.1.44877 > 112.26.2.8.43045: Flags [.], seq 345577:347005, ack 1, win 4017, options [nop,nop,TS val 258304 ecr 44464,mptcp dss ack 3454339951 seq 445594928 subseq 345577 len 1428 csum 0x3149], length 1428
10:42:36.853004 IP 112.26.2.8.43045 > 112.26.2.1.44877: Flags [.], ack 338437, win 24133, options [nop,nop,TS val 45107 ecr 257786,mptcp dss ack 445512104], length 0
10:42:36.940816 IP 112.26.2.8.43045 > 112.26.2.1.44877: Flags [.], ack 341293, win 24208, options [nop,nop,TS val 45269 ecr 257885,mptcp dss ack 445536380], length 0
10:42:36.982888 IP 112.26.2.1.44877 > 112.26.2.8.43045: Flags [.], seq 347005:348433, ack 1, win 4017, options [nop,nop,TS val 258801 ecr 44824,mptcp dss ack 3454339951 seq 445613492 subseq 347005 len 1428 csum 0xa9e6], length 1428
10:42:36.985618 IP 112.26.2.1.44877 > 112.26.2.8.43045: Flags [.], seq 347005:348433, ack 1, win 4017, options [nop,nop,TS val 258801 ecr 44824,mptcp dss ack 3454339951 seq 445613492 subseq 347005 len 1428 csum 0xa9e6], length 1428
10:42:36.987495 IP 112.26.2.8.43045 > 112.26.2.1.44877: Flags [.], ack 348433, win 24061, options [nop,nop,TS val 45774 ecr 258304,mptcp dss ack 445547804], length 0
10:42:36.988957 IP 112.26.2.8.43045 > 112.26.2.1.44877: Flags [.], ack 348433, win 24061, options [nop,nop,TS val 45774 ecr 258304,mptcp dss ack 445547804], length 0
10:42:37.075965 IP 112.26.2.8.43045 > 112.26.2.1.44877: Flags [.], ack 345577, win 24142, options [nop,nop,TS val 45532 ecr 258011,mptcp dss ack 445540664], length 0
10:42:37.124727 IP 112.26.2.1.44877 > 112.26.2.8.43045: Flags [.], seq 348433:349861, ack 1, win 4017, options [nop,nop,TS val 258991 ecr 45107,mptcp dss ack 3454339951 seq 445622060 subseq 348433 len 1428 csum 0xb531], length 1428
10:42:37.128237 IP 112.26.2.1.44877 > 112.26.2.8.43045: Flags [.], seq 348433:349861, ack 1, win 4017, options [nop,nop,TS val 258991 ecr 45107,mptcp dss ack 3454339951 seq 445622060 subseq 348433 len 1428 csum 0xb531], length 1428
10:42:37.199728 IP 112.26.2.1.44877 > 112.26.2.8.43045: Flags [.], seq 349861:351289, ack 1, win 4017, options [nop,nop,TS val 258991 ecr 45107,mptcp dss ack 3454339951 seq 445623488 subseq 349861 len 1428 csum 0xa5c6], length 1428
10:42:37.203104 IP 112.26.2.1.44877 > 112.26.2.8.43045: Flags [.], seq 349861:351289, ack 1, win 4017, options [nop,nop,TS val 258991 ecr 45107,mptcp dss ack 3454339951 seq 445623488 subseq 349861 len 1428 csum 0xa5c6], length 1428
10:42:37.204685 IP 112.26.2.8.43045 > 112.26.2.1.44877: Flags [.], ack 351289, win 24540, options [nop,nop,TS val 45992 ecr 258991,mptcp dss ack 445604924], length 0
10:42:37.212414 IP 112.26.2.8.43045 > 112.26.2.1.44877: Flags [.], ack 351289, win 24540, options [nop,nop,TS val 45992 ecr 258991,mptcp dss ack 445604924], length 0
10:42:37.312409 IP 112.26.2.8.43045 > 112.26.2.1.44877: Flags [.], ack 348433, win 24061, options [nop,nop,TS val 45774 ecr 258304,mptcp dss ack 445547804], length 0
10:42:37.381151 IP 112.26.2.1.44877 > 112.26.2.8.43045: Flags [.], seq 351289:352717, ack 1, win 4017, options [nop,nop,TS val 258991 ecr 45107,mptcp dss ack 3454339951 seq 445624916 subseq 351289 len 1428 csum 0x39f2], length 1428
10:42:37.385410 IP 112.26.2.1.44877 > 112.26.2.8.43045: Flags [.], seq 351289:352717, ack 1, win 4017, options [nop,nop,TS val 258991 ecr 45107,mptcp dss ack 3454339951 seq 445624916 subseq 351289 len 1428 csum 0x39f2], length 1428
10:42:37.445365 IP 112.26.2.1.44877 > 112.26.2.8.43045: Flags [.], seq 352717:354145, ack 1, win 4017, options [nop,nop,TS val 259079 ecr 45269,mptcp dss ack 3454339951 seq 445627772 subseq 352717 len 1428 csum 0xf532], length 1428
10:42:37.447851 IP 112.26.2.1.44877 > 112.26.2.8.43045: Flags [.], seq 352717:354145, ack 1, win 4017, options [nop,nop,TS val 259079 ecr 45269,mptcp dss ack 3454339951 seq 445627772 subseq 352717 len 1428 csum 0xf532], length 1428
10:42:37.527431 IP 112.26.2.1.44877 > 112.26.2.8.43045: Flags [.], seq 354145:355573, ack 1, win 4017, options [nop,nop,TS val 259079 ecr 45269,mptcp dss ack 3454339951 seq 445629200 subseq 354145 len 1428 csum 0x2763], length 1428
10:42:37.542963 IP 112.26.2.1.44877 > 112.26.2.8.43045: Flags [.], seq 354145:355573, ack 1, win 4017, options [nop,nop,TS val 259079 ecr 45269,mptcp dss ack 3454339951 seq 445629200 subseq 354145 len 1428 csum 0x2763], length 1428
10:42:37.567456 IP 112.26.2.1.44877 > 112.26.2.8.43045: Flags [.], seq 355573:357001, ack 1, win 4017, options [nop,nop,TS val 259079 ecr 45269,mptcp dss ack 3454339951 seq 445630628 subseq 355573 len 1428 csum 0x1fa5], length 1428
10:42:37.592934 IP 112.26.2.1.44877 > 112.26.2.8.43045: Flags [.], seq 355573:357001, ack 1, win 4017, options [nop,nop,TS val 259079 ecr 45269,mptcp dss ack 3454339951 seq 445630628 subseq 355573 len 1428 csum 0x1fa5], length 1428
