10:41:55.131163 IP 112.26.0.8.44380 > 112.26.0.1.44877: Flags [S], seq 231718060, win 65535, options [mss 1460,sackOK,TS val 3909 ecr 0,nop,wscale 6,mptcp capable csum {0x4662d4d2f708162f}], length 0
10:41:55.131382 IP 112.26.0.8.44380 > 112.26.0.1.44877: Flags [S], seq 231718060, win 65535, options [mss 1460,sackOK,TS val 3909 ecr 0,nop,wscale 6,mptcp capable csum {0x4662d4d2f708162f}], length 0
10:41:55.133732 IP 112.26.0.1.44877 > 112.26.0.8.44380: Flags [S.], seq 1060196464, ack 231718061, win 65535, options [mss 1460,sackOK,TS val 217271 ecr 3909,nop,wscale 6,mptcp capable csum {0x38a7cf8d5ca5beb8}], length 0
10:41:55.133975 IP 112.26.0.1.44877 > 112.26.0.8.44380: Flags [S.], seq 1060196464, ack 231718061, win 65535, options [mss 1460,sackOK,TS val 217271 ecr 3909,nop,wscale 6,mptcp capable csum {0x38a7cf8d5ca5beb8}], length 0
10:41:55.160226 IP 112.26.0.1.44877 > 112.26.0.8.44380: Flags [S.], seq 1060196464, ack 231718061, win 65535, options [mss 1460,sackOK,TS val 217271 ecr 3909,nop,wscale 6,mptcp capable csum {0x38a7cf8d5ca5beb8}], length 0
10:41:55.271773 IP 112.26.0.8.44380 > 112.26.0.1.44877: Flags [.], ack 1, win 1369, options [nop,nop,TS val 3947 ecr 217271,mptcp capable csum {0x4662d4d2f708162f,0x38a7cf8d5ca5beb8},mptcp dss ack 444111424], length 0
10:41:55.271938 IP 112.26.0.8.44380 > 112.26.0.1.44877: Flags [.], ack 1, win 1369, options [nop,nop,TS val 3947 ecr 217271,mptcp capable csum {0x4662d4d2f708162f,0x38a7cf8d5ca5beb8},mptcp dss ack 444111424], length 0
10:42:31.058015 IP 112.26.0.1.44877 > 112.26.0.8.44380: Flags [.], seq 361097:362525, ack 1, win 4017, options [nop,nop,TS val 252608 ecr 38806,mptcp dss ack 3454339951 seq 445365020 subseq 361097 len 1428 csum 0xcb65], length 1428
10:42:31.075811 IP 112.26.0.8.44380 > 112.26.0.1.44877: Flags [.], ack 362525, win 24161, options [nop,nop,TS val 39846 ecr 252608,mptcp dss ack 445299332], length 0
10:42:31.076195 IP 112.26.0.8.44380 > 112.26.0.1.44877: Flags [.], ack 362525, win 24161, options [nop,nop,TS val 39846 ecr 252608,mptcp dss ack 445299332], length 0
10:42:31.180936 IP 112.26.0.1.44877 > 112.26.0.8.44380: Flags [.], seq 366809:368237, ack 1, win 4017, options [nop,nop,TS val 253315 ecr 39328,mptcp dss ack 3454339951 seq 445399292 subseq 366809 len 1428 csum 0x2c8a], length 1428
10:42:31.181257 IP 112.26.0.1.44877 > 112.26.0.8.44380: Flags [.], seq 366809:368237, ack 1, win 4017, options [nop,nop,TS val 253315 ecr 39328,mptcp dss ack 3454339951 seq 445399292 subseq 366809 len 1428 csum 0x2c8a], length 1428
10:42:31.240588 IP 112.26.0.1.44877 > 112.26.0.8.44380: Flags [.], seq 368237:369665, ack 1, win 4017, options [nop,nop,TS val 253367 ecr 39419,mptcp dss ack 3454339951 seq 445405004 subseq 368237 len 1428 csum 0xf871], length 1428
10:42:31.240919 IP 112.26.0.1.44877 > 112.26.0.8.44380: Flags [.], seq 368237:369665, ack 1, win 4017, options [nop,nop,TS val 253367 ecr 39419,mptcp dss ack 3454339951 seq 445405004 subseq 368237 len 1428 csum 0xf871], length 1428
10:42:31.280624 IP 112.26.0.1.44877 > 112.26.0.8.44380: Flags [.], seq 362525:363953, ack 1, win 4017, options [nop,nop,TS val 252833 ecr 38996,mptcp dss ack 3454339951 seq 445376444 subseq 362525 len 1428 csum 0xafc], length 1428
10:42:31.342272 IP 112.26.0.8.44380 > 112.26.0.1.44877: Flags [.], ack 363953, win 24355, options [nop,nop,TS val 40069 ecr 252833,mptcp dss ack 445327892], length 0
10:42:31.342664 IP 112.26.0.8.44380 > 112.26.0.1.44877: Flags [.], ack 363953, win 24355, options [nop,nop,TS val 40069 ecr 252833,mptcp dss ack 445327892], length 0
10:42:31.383216 IP 112.26.0.1.44877 > 112.26.0.8.44380: Flags [.], seq 369665:371093, ack 1, win 4017, options [nop,nop,TS val 253509 ecr 39557,mptcp dss ack 3454339951 seq 445409288 subseq 369665 len 1428 csum 0xeb2d], length 1428
10:42:31.383498 IP 112.26.0.1.44877 > 112.26.0.8.44380: Flags [.], seq 369665:371093, ack 1, win 4017, options [nop,nop,TS val 253509 ecr 39557,mptcp dss ack 3454339951 seq 445409288 subseq 369665 len 1428 csum 0xeb2d], length 1428
10:42:31.430062 IP 112.26.0.1.44877 > 112.26.0.8.44380: Flags [.], seq 371093:372521, ack 1, win 4017, options [nop,nop,TS val 253509 ecr 39557,mptcp dss ack 3454339951 seq 445410716 subseq 371093 len 1428 csum 0x9448], length 1428
10:42:31.430397 IP 112.26.0.1.44877 > 112.26.0.8.44380: Flags [.], seq 371093:372521, ack 1, win 4017, options [nop,nop,TS val 253509 ecr 39557,mptcp dss ack 3454339951 seq 445410716 subseq 371093 len 1428 csum 0x9448], length 1428
10:42:31.488162 IP 112.26.0.1.44877 > 112.26.0.8.44380: Flags [.], seq 363953:365381, ack 1, win 4017, options [nop,nop,TS val 253053 ecr 39102,mptcp dss ack 3454339951 seq 445380728 subseq 363953 len 1428 csum 0x99c2], length 1428
10:42:31.498696 IP 112.26.0.8.44380 > 112.26.0.1.44877: Flags [.], ack 365381, win 24355, options [nop,nop,TS val 40277 ecr 253053,mptcp dss ack 445327892], length 0
10:42:31.498932 IP 112.26.0.8.44380 > 112.26.0.1.44877: Flags [.], ack 365381, win 24355, options [nop,nop,TS val 40277 ecr 253053,mptcp dss ack 445327892], length 0
10:42:31.510650 IP 112.26.0.1.44877 > 112.26.0.8.44380: Flags [.], seq 372521:373949, ack 1, win 4017, options [nop,nop,TS val 253554 ecr 39629,mptcp dss ack 3454339951 seq 445413572 subseq 372521 len 1428 csum 0xabc1], length 1428
10:42:31.510975 IP 112.26.0.1.44877 > 112.26.0.8.44380: Flags [.], seq 372521:373949, ack 1, win 4017, options [nop,nop,TS val 253554 ecr 39629,mptcp dss ack 3454339951 seq 445413572 subseq 372521 len 1428 csum 0xabc1], length 1428
10:42:31.561937 IP 112.26.0.1.44877 > 112.26.0.8.44380: Flags [.], seq 365381:366809, ack 1, win 4017, options [nop,nop,TS val 253118 ecr 39176,mptcp dss ack 3454339951 seq 445386440 subseq 365381 len 1428 csum 0x8f56], length 1428
10:42:31.567965 IP 112.26.0.8.44380 > 112.26.0.1.44877: Flags [.], ack 366809, win 24355, options [nop,nop,TS val 40350 ecr 253118,mptcp dss ack 445327892], length 0
10:42:31.568306 IP 112.26.0.8.44380 > 112.26.0.1.44877: Flags [.], ack 366809, win 24355, options [nop,nop,TS val 40350 ecr 253118,mptcp dss ack 445327892], length 0
10:42:31.636955 IP 112.26.0.1.44877 > 112.26.0.8.44380: Flags [.], seq 373949:375377, ack 1, win 4017, options [nop,nop,TS val 253772 ecr 39846,mptcp dss ack 3454339951 seq 445429280 subseq 373949 len 1428 csum 0xaf7f], length 1428
10:42:31.637281 IP 112.26.0.1.44877 > 112.26.0.8.44380: Flags [.], seq 373949:375377, ack 1, win 4017, options [nop,nop,TS val 253772 ecr 39846,mptcp dss ack 3454339951 seq 445429280 subseq 373949 len 1428 csum 0xaf7f], length 1428
10:42:31.682319 IP 112.26.0.1.44877 > 112.26.0.8.44380: Flags [.], seq 366809:368237, ack 1, win 4017, options [nop,nop,TS val 253315 ecr 39328,mptcp dss ack 3454339951 seq 445399292 subseq 366809 len 1428 csum 0x2c8a], length 1428
10:42:31.743804 IP 112.26.0.8.44380 > 112.26.0.1.44877: Flags [.], ack 368237, win 24355, options [nop,nop,TS val 40512 ecr 253315,mptcp dss ack 445327892], length 0
10:42:31.744072 IP 112.26.0.8.44380 > 112.26.0.1.44877: Flags [.], ack 368237, win 24355, options [nop,nop,TS val 40512 ecr 253315,mptcp dss ack 445327892], length 0
10:42:31.791474 IP 112.26.0.1.44877 > 112.26.0.8.44380: Flags [.], seq 368237:369665, ack 1, win 4017, options [nop,nop,TS val 253367 ecr 39419,mptcp dss ack 3454339951 seq 445405004 subseq 368237 len 1428 csum 0xf871], length 1428
10:42:31.828511 IP 112.26.0.1.44877 > 112.26.0.8.44380: Flags [.], seq 375377:376805, ack 1, win 4017, options [nop,nop,TS val 253964 ecr 40069,mptcp dss ack 3454339951 seq 445433564 subseq 375377 len 1428 csum 0x43c7], length 1428
10:42:31.828816 IP 112.26.0.1.44877 > 112.26.0.8.44380: Flags [.], seq 375377:376805, ack 1, win 4017, options [nop,nop,TS val 253964 ecr 40069,mptcp dss ack 3454339951 seq 445433564 subseq 375377 len 1428 csum 0x43c7], length 1428
10:42:31.846813 IP 112.26.0.8.44380 > 112.26.0.1.44877: Flags [.], ack 369665, win 24355, options [nop,nop,TS val 40621 ecr 253367,mptcp dss ack 445327892], length 0
10:42:31.847083 IP 112.26.0.8.44380 > 112.26.0.1.44877: Flags [.], ack 369665, win 24355, options [nop,nop,TS val 40621 ecr 253367,mptcp dss ack 445327892], length 0
10:42:31.920080 IP 112.26.0.1.44877 > 112.26.0.8.44380: Flags [.], seq 369665:371093, ack 1, win 4017, options [nop,nop,TS val 253509 ecr 39557,mptcp dss ack 3454339951 seq 445409288 subseq 369665 len 1428 csum 0xeb2d], length 1428
10:42:31.963652 IP 112.26.0.8.44380 > 112.26.0.1.44877: Flags [.], ack 371093, win 24355, options [nop,nop,TS val 40749 ecr 253509,mptcp dss ack 445327892], length 0
10:42:31.963933 IP 112.26.0.8.44380 > 112.26.0.1.44877: Flags [.], ack 371093, win 24355, options [nop,nop,TS val 40749 ecr 253509,mptcp dss ack 445327892], length 0
10:42:32.034353 IP 112.26.0.1.44877 > 112.26.0.8.44380: Flags [.], seq 371093:372521, ack 1, win 4017, options [nop,nop,TS val 253509 ecr 39557,mptcp dss ack 3454339951 seq 445410716 subseq 371093 len 1428 csum 0x9448], length 1428
10:42:32.087964 IP 112.26.0.8.44380 > 112.26.0.1.44877: Flags [.], ack 372521, win 24355, options [nop,nop,TS val 40862 ecr 253509,mptcp dss ack 445327892], length 0
10:42:32.088276 IP 112.26.0.8.44380 > 112.26.0.1.44877: Flags [.], ack 372521, win 24355, options [nop,nop,TS val 40862 ecr 253509,mptcp dss ack 445327892], length 0
10:42:32.089439 IP 112.26.0.1.44877 > 112.26.0.8.44380: Flags [.], seq 376805:378233, ack 1, win 4017, options [nop,nop,TS val 254210 ecr 40277,mptcp dss ack 3454339951 seq 445443560 subseq 376805 len 1428 csum 0xacb5], length 1428
10:42:32.089776 IP 112.26.0.1.44877 > 112.26.0.8.44380: Flags [.], seq 376805:378233, ack 1, win 4017, options [nop,nop,TS val 254210 ecr 40277,mptcp dss ack 3454339951 seq 445443560 subseq 376805 len 1428 csum 0xacb5], length 1428
10:42:32.178070 IP 112.26.0.1.44877 > 112.26.0.8.44380: Flags [.], seq 372521:373949, ack 1, win 4017, options [nop,nop,TS val 253554 ecr 39629,mptcp dss ack 3454339951 seq 445413572 subseq 372521 len 1428 csum 0xabc1], length 1428
10:42:32.224996 IP 112.26.0.8.44380 > 112.26.0.1.44877: Flags [.], ack 373949, win 24355, options [nop,nop,TS val 41008 ecr 253554,mptcp dss ack 445327892], length 0
10:42:32.225304 IP 112.26.0.8.44380 > 112.26.0.1.44877: Flags [.], ack 373949, win 24355, options [nop,nop,TS val 41008 ecr 253554,mptcp dss ack 445327892], length 0
10:42:32.274995 IP 112.26.0.1.44877 > 112.26.0.8.44380: Flags [.], seq 373949:375377, ack 1, win 4017, options [nop,nop,TS val 253772 ecr 39846,mptcp dss ack 3454339951 seq 445429280 subseq 373949 len 1428 csum 0xaf7f], length 1428
10:42:32.319381 IP 112.26.0.8.44380 > 112.26.0.1.44877: Flags [.], ack 375377, win 24355, options [nop,nop,TS val 41105 ecr 253772,mptcp dss ack 445327892], length 0
10:42:32.319785 IP 112.26.0.8.44380 > 112.26.0.1.44877: Flags [.], ack 375377, win 24355, options [nop,nop,TS val 41105 ecr 253772,mptcp dss ack 445327892], length 0
10:42:32.341586 IP 112.26.0.1.44877 > 112.26.0.8.44380: Flags [.], seq 378233:379661, ack 1, win 4017, options [nop,nop,TS val 254477 ecr 40512,mptcp dss ack 3454339951 seq 445450700 subseq 378233 len 1428 csum 0xc39b], length 1428
10:42:32.341905 IP 112.26.0.1.44877 > 112.26.0.8.44380: Flags [.], seq 378233:379661, ack 1, win 4017, options [nop,nop,TS val 254477 ecr 40512,mptcp dss ack 3454339951 seq 445450700 subseq 378233 len 1428 csum 0xc39b], length 1428
10:42:32.402137 IP 112.26.0.1.44877 > 112.26.0.8.44380: Flags [.], seq 375377:376805, ack 1, win 4017, options [nop,nop,TS val 253964 ecr 40069,mptcp dss ack 3454339951 seq 445433564 subseq 375377 len 1428 csum 0x43c7], length 1428
10:42:32.408985 IP 112.26.0.1.44877 > 112.26.0.8.44380: Flags [.], seq 379661:381089, ack 1, win 4017, options [nop,nop,TS val 254477 ecr 40512,mptcp dss ack 3454339951 seq 445452128 subseq 379661 len 1428 csum 0x46f3], length 1428
10:42:32.409327 IP 112.26.0.1.44877 > 112.26.0.8.44380: Flags [.], seq 379661:381089, ack 1, win 4017, options [nop,nop,TS val 254477 ecr 40512,mptcp dss ack 3454339951 seq 445452128 subseq 379661 len 1428 csum 0x46f3], length 1428
10:42:32.446916 IP 112.26.0.8.44380 > 112.26.0.1.44877: Flags [.], ack 376805, win 24222, options [nop,nop,TS val 41232 ecr 253964,mptcp dss ack 445336460], length 0
10:42:32.447229 IP 112.26.0.8.44380 > 112.26.0.1.44877: Flags [.], ack 376805, win 24222, options [nop,nop,TS val 41232 ecr 253964,mptcp dss ack 445336460], length 0
10:42:32.524278 IP 112.26.0.1.44877 > 112.26.0.8.44380: Flags [.], seq 381089:382517, ack 1, win 4017, options [nop,nop,TS val 254659 ecr 40621,mptcp dss ack 3454339951 seq 445456412 subseq 381089 len 1428 csum 0x7942], length 1428
10:42:32.524622 IP 112.26.0.1.44877 > 112.26.0.8.44380: Flags [.], seq 381089:382517, ack 1, win 4017, options [nop,nop,TS val 254659 ecr 40621,mptcp dss ack 3454339951 seq 445456412 subseq 381089 len 1428 csum 0x7942], length 1428
10:42:32.575091 IP 112.26.0.1.44877 > 112.26.0.8.44380: Flags [.], seq 382517:383945, ack 1, win 4017, options [nop,nop,TS val 254713 ecr 40749,mptcp dss ack 3454339951 seq 445457840 subseq 382517 len 1428 csum 0xf5f2], length 1428
10:42:32.575371 IP 112.26.0.1.44877 > 112.26.0.8.44380: Flags [.], seq 382517:383945, ack 1, win 4017, options [nop,nop,TS val 254713 ecr 40749,mptcp dss ack 3454339951 seq 445457840 subseq 382517 len 1428 csum 0xf5f2], length 1428
10:42:32.627180 IP 112.26.0.1.44877 > 112.26.0.8.44380: Flags [.], seq 383945:385373, ack 1, win 4017, options [nop,nop,TS val 254760 ecr 40862,mptcp dss ack 3454339951 seq 445459268 subseq 383945 len 1428 csum 0x3246], length 1428
10:42:32.627506 IP 112.26.0.1.44877 > 112.26.0.8.44380: Flags [.], seq 383945:385373, ack 1, win 4017, options [nop,nop,TS val 254760 ecr 40862,mptcp dss ack 3454339951 seq 445459268 subseq 383945 len 1428 csum 0x3246], length 1428
10:42:32.665148 IP 112.26.0.1.44877 > 112.26.0.8.44380: Flags [.], seq 385373:386801, ack 1, win 4017, options [nop,nop,TS val 254760 ecr 40862,mptcp dss ack 3454339951 seq 445460696 subseq 385373 len 1428 csum 0xe531], length 1428
10:42:32.665449 IP 112.26.0.1.44877 > 112.26.0.8.44380: Flags [.], seq 385373:386801, ack 1, win 4017, options [nop,nop,TS val 254760 ecr 40862,mptcp dss ack 3454339951 seq 445460696 subseq 385373 len 1428 csum 0xe531], length 1428
10:42:32.725009 IP 112.26.0.1.44877 > 112.26.0.8.44380: Flags [.], seq 376805:378233, ack 1, win 4017, options [nop,nop,TS val 254210 ecr 40277,mptcp dss ack 3454339951 seq 445443560 subseq 376805 len 1428 csum 0xacb5], length 1428
10:42:32.742651 IP 112.26.0.8.44380 > 112.26.0.1.44877: Flags [.], ack 378233, win 24222, options [nop,nop,TS val 41513 ecr 254210,mptcp dss ack 445336460], length 0
10:42:32.742930 IP 112.26.0.8.44380 > 112.26.0.1.44877: Flags [.], ack 378233, win 24222, options [nop,nop,TS val 41513 ecr 254210,mptcp dss ack 445336460], length 0
10:42:32.810372 IP 112.26.0.1.44877 > 112.26.0.8.44380: Flags [.], seq 386801:388229, ack 1, win 4017, options [nop,nop,TS val 254946 ecr 41008,mptcp dss ack 3454339951 seq 445464980 subseq 386801 len 1428 csum 0x9afd], length 1428
10:42:32.810733 IP 112.26.0.1.44877 > 112.26.0.8.44380: Flags [.], seq 386801:388229, ack 1, win 4017, options [nop,nop,TS val 254946 ecr 41008,mptcp dss ack 3454339951 seq 445464980 subseq 386801 len 1428 csum 0x9afd], length 1428
10:42:32.887231 IP 112.26.0.1.44877 > 112.26.0.8.44380: Flags [.], seq 388229:389657, ack 1, win 4017, options [nop,nop,TS val 255023 ecr 41105,mptcp dss ack 3454339951 seq 445467836 subseq 388229 len 1428 csum 0x8a97], length 1428
10:42:32.887561 IP 112.26.0.1.44877 > 112.26.0.8.44380: Flags [.], seq 388229:389657, ack 1, win 4017, options [nop,nop,TS val 255023 ecr 41105,mptcp dss ack 3454339951 seq 445467836 subseq 388229 len 1428 csum 0x8a97], length 1428
10:42:32.948823 IP 112.26.0.1.44877 > 112.26.0.8.44380: Flags [.], seq 378233:379661, ack 1, win 4017, options [nop,nop,TS val 254477 ecr 40512,mptcp dss ack 3454339951 seq 445450700 subseq 378233 len 1428 csum 0xc39b], length 1428
10:42:32.980543 IP 112.26.0.8.44380 > 112.26.0.1.44877: Flags [.], ack 379661, win 24222, options [nop,nop,TS val 41737 ecr 254477,mptcp dss ack 445336460], length 0
10:42:32.980828 IP 112.26.0.8.44380 > 112.26.0.1.44877: Flags [.], ack 379661, win 24222, options [nop,nop,TS val 41737 ecr 254477,mptcp dss ack 445336460], length 0
10:42:33.040083 IP 112.26.0.1.44877 > 112.26.0.8.44380: Flags [.], seq 379661:381089, ack 1, win 4017, options [nop,nop,TS val 254477 ecr 40512,mptcp dss ack 3454339951 seq 445452128 subseq 379661 len 1428 csum 0x46f3], length 1428
10:42:33.053856 IP 112.26.0.8.44380 > 112.26.0.1.44877: Flags [.], ack 381089, win 24222, options [nop,nop,TS val 41828 ecr 254477,mptcp dss ack 445336460], length 0
10:42:33.054163 IP 112.26.0.8.44380 > 112.26.0.1.44877: Flags [.], ack 381089, win 24222, options [nop,nop,TS val 41828 ecr 254477,mptcp dss ack 445336460], length 0
10:42:33.101222 IP 112.26.0.1.44877 > 112.26.0.8.44380: Flags [.], seq 389657:391085, ack 1, win 4017, options [nop,nop,TS val 255238 ecr 41232,mptcp dss ack 3454339951 seq 445472120 subseq 389657 len 1428 csum 0xe9de], length 1428
10:42:33.101550 IP 112.26.0.1.44877 > 112.26.0.8.44380: Flags [.], seq 389657:391085, ack 1, win 4017, options [nop,nop,TS val 255238 ecr 41232,mptcp dss ack 3454339951 seq 445472120 subseq 389657 len 1428 csum 0xe9de], length 1428
10:42:33.184969 IP 112.26.0.1.44877 > 112.26.0.8.44380: Flags [.], seq 381089:382517, ack 1, win 4017, options [nop,nop,TS val 254659 ecr 40621,mptcp dss ack 3454339951 seq 445456412 subseq 381089 len 1428 csum 0x7942], length 1428
10:42:33.202761 IP 112.26.0.8.44380 > 112.26.0.1.44877: Flags [.], ack 382517, win 24222, options [nop,nop,TS val 41973 ecr 254659,mptcp dss ack 445336460], length 0
10:42:33.203067 IP 112.26.0.8.44380 > 112.26.0.1.44877: Flags [.], ack 382517, win 24222, options [nop,nop,TS val 41973 ecr 254659,mptcp dss ack 445336460], length 0
10:42:33.285902 IP 112.26.0.1.44877 > 112.26.0.8.44380: Flags [.], seq 383945:385373, ack 1, win 4017, options [nop,nop,TS val 254760 ecr 40862,mptcp dss ack 3454339951 seq 445459268 subseq 383945 len 1428 csum 0x3246], length 1428
10:42:33.289450 IP 112.26.0.8.44380 > 112.26.0.1.44877: Flags [.], ack 382517, win 24222, options [nop,nop,TS val 42074 ecr 254659,nop,nop,sack 1 {383945:385373},mptcp dss ack 445336460], length 0
10:42:33.289762 IP 112.26.0.8.44380 > 112.26.0.1.44877: Flags [.], ack 382517, win 24222, options [nop,nop,TS val 42074 ecr 254659,nop,nop,sack 1 {383945:385373},mptcp dss ack 445336460], length 0
10:42:33.375999 IP 112.26.0.1.44877 > 112.26.0.8.44380: Flags [.], seq 385373:386801, ack 1, win 4017, options [nop,nop,TS val 254760 ecr 40862,mptcp dss ack 3454339951 seq 445460696 subseq 385373 len 1428 csum 0xe531], length 1428
10:42:33.391068 IP 112.26.0.8.44380 > 112.26.0.1.44877: Flags [.], ack 382517, win 24222, options [nop,nop,TS val 42164 ecr 254659,nop,nop,sack 1 {383945:386801},mptcp dss ack 445336460], length 0
10:42:33.391383 IP 112.26.0.8.44380 > 112.26.0.1.44877: Flags [.], ack 382517, win 24222, options [nop,nop,TS val 42164 ecr 254659,nop,nop,sack 1 {383945:386801},mptcp dss ack 445336460], length 0
10:42:33.451408 IP 112.26.0.1.44877 > 112.26.0.8.44380: Flags [.], seq 386801:388229, ack 1, win 4017, options [nop,nop,TS val 254946 ecr 41008,mptcp dss ack 3454339951 seq 445464980 subseq 386801 len 1428 csum 0x9afd], length 1428
10:42:33.458453 IP 112.26.0.8.44380 > 112.26.0.1.44877: Flags [.], ack 382517, win 24222, options [nop,nop,TS val 42240 ecr 254659,nop,nop,sack 1 {383945:388229},mptcp dss ack 445336460], length 0
10:42:33.458777 IP 112.26.0.8.44380 > 112.26.0.1.44877: Flags [.], ack 382517, win 24222, options [nop,nop,TS val 42240 ecr 254659,nop,nop,sack 1 {383945:388229},mptcp dss ack 445336460], length 0
10:42:33.540748 IP 112.26.0.1.44877 > 112.26.0.8.44380: Flags [.], seq 388229:389657, ack 1, win 4017, options [nop,nop,TS val 255023 ecr 41105,mptcp dss ack 3454339951 seq 445467836 subseq 388229 len 1428 csum 0x8a97], length 1428
10:42:33.574870 IP 112.26.0.8.44380 > 112.26.0.1.44877: Flags [.], ack 382517, win 24222, options [nop,nop,TS val 42329 ecr 254659,nop,nop,sack 1 {383945:389657},mptcp dss ack 445336460], length 0
10:42:33.575209 IP 112.26.0.8.44380 > 112.26.0.1.44877: Flags [.], ack 382517, win 24222, options [nop,nop,TS val 42329 ecr 254659,nop,nop,sack 1 {383945:389657},mptcp dss ack 445336460], length 0
10:42:33.615983 IP 112.26.0.1.44877 > 112.26.0.8.44380: Flags [.], seq 391085:392513, ack 1, win 4017, options [nop,nop,TS val 255750 ecr 41737,mptcp dss ack 3454339951 seq 445493540 subseq 391085 len 1428 csum 0x1336], length 1428
10:42:33.616310 IP 112.26.0.1.44877 > 112.26.0.8.44380: Flags [.], seq 391085:392513, ack 1, win 4017, options [nop,nop,TS val 255750 ecr 41737,mptcp dss ack 3454339951 seq 445493540 subseq 391085 len 1428 csum 0x1336], length 1428
10:42:33.683055 IP 112.26.0.1.44877 > 112.26.0.8.44380: Flags [.], seq 392513:393941, ack 1, win 4017, options [nop,nop,TS val 255750 ecr 41737,mptcp dss ack 3454339951 seq 445494968 subseq 392513 len 1428 csum 0x90eb], length 1428
10:42:33.683391 IP 112.26.0.1.44877 > 112.26.0.8.44380: Flags [.], seq 392513:393941, ack 1, win 4017, options [nop,nop,TS val 255750 ecr 41737,mptcp dss ack 3454339951 seq 445494968 subseq 392513 len 1428 csum 0x90eb], length 1428
10:42:33.733660 IP 112.26.0.1.44877 > 112.26.0.8.44380: Flags [.], seq 389657:391085, ack 1, win 4017, options [nop,nop,TS val 255238 ecr 41232,mptcp dss ack 3454339951 seq 445472120 subseq 389657 len 1428 csum 0xe9de], length 1428
10:42:33.736695 IP 112.26.0.8.44380 > 112.26.0.1.44877: Flags [.], ack 382517, win 24222, options [nop,nop,TS val 42522 ecr 254659,nop,nop,sack 1 {383945:391085},mptcp dss ack 445336460], length 0
10:42:33.737008 IP 112.26.0.8.44380 > 112.26.0.1.44877: Flags [.], ack 382517, win 24222, options [nop,nop,TS val 42522 ecr 254659,nop,nop,sack 1 {383945:391085},mptcp dss ack 445336460], length 0
10:42:33.757437 IP 112.26.0.1.44877 > 112.26.0.8.44380: Flags [.], seq 393941:395369, ack 1, win 4017, options [nop,nop,TS val 255750 ecr 41737,mptcp dss ack 3454339951 seq 445496396 subseq 393941 len 1428 csum 0x6336], length 1428
10:42:33.757730 IP 112.26.0.1.44877 > 112.26.0.8.44380: Flags [.], seq 393941:395369, ack 1, win 4017, options [nop,nop,TS val 255750 ecr 41737,mptcp dss ack 3454339951 seq 445496396 subseq 393941 len 1428 csum 0x6336], length 1428
10:42:33.844989 IP 112.26.0.1.44877 > 112.26.0.8.44380: Flags [.], seq 395369:396797, ack 1, win 4017, options [nop,nop,TS val 255750 ecr 41737,mptcp dss ack 3454339951 seq 445497824 subseq 395369 len 1428 csum 0xfc3f], length 1428
10:42:33.845321 IP 112.26.0.1.44877 > 112.26.0.8.44380: Flags [.], seq 395369:396797, ack 1, win 4017, options [nop,nop,TS val 255750 ecr 41737,mptcp dss ack 3454339951 seq 445497824 subseq 395369 len 1428 csum 0xfc3f], length 1428
10:42:33.906515 IP 112.26.0.1.44877 > 112.26.0.8.44380: Flags [.], seq 396797:398225, ack 1, win 4017, options [nop,nop,TS val 255827 ecr 41828,mptcp dss ack 3454339951 seq 445500680 subseq 396797 len 1428 csum 0x6d23], length 1428
10:42:33.906821 IP 112.26.0.1.44877 > 112.26.0.8.44380: Flags [.], seq 396797:398225, ack 1, win 4017, options [nop,nop,TS val 255827 ecr 41828,mptcp dss ack 3454339951 seq 445500680 subseq 396797 len 1428 csum 0x6d23], length 1428
10:42:33.976373 IP 112.26.0.1.44877 > 112.26.0.8.44380: Flags [.], seq 398225:399653, ack 1, win 4017, options [nop,nop,TS val 255957 ecr 41973,mptcp dss ack 3454339951 seq 445504964 subseq 398225 len 1428 csum 0x503a], length 1428
10:42:33.976681 IP 112.26.0.1.44877 > 112.26.0.8.44380: Flags [.], seq 398225:399653, ack 1, win 4017, options [nop,nop,TS val 255957 ecr 41973,mptcp dss ack 3454339951 seq 445504964 subseq 398225 len 1428 csum 0x503a], length 1428
10:42:34.046998 IP 112.26.0.1.44877 > 112.26.0.8.44380: Flags [.], seq 399653:401081, ack 1, win 4017, options [nop,nop,TS val 255957 ecr 41973,mptcp dss ack 3454339951 seq 445506392 subseq 399653 len 1428 csum 0x9599], length 1428
10:42:34.047326 IP 112.26.0.1.44877 > 112.26.0.8.44380: Flags [.], seq 399653:401081, ack 1, win 4017, options [nop,nop,TS val 255957 ecr 41973,mptcp dss ack 3454339951 seq 445506392 subseq 399653 len 1428 csum 0x9599], length 1428
10:42:34.088863 IP 112.26.0.1.44877 > 112.26.0.8.44380: Flags [.], seq 401081:402509, ack 1, win 4017, options [nop,nop,TS val 256063 ecr 42074,mptcp dss ack 3454339951 seq 445507820 subseq 401081 len 1428 csum 0x38eb], length 1428
10:42:34.089185 IP 112.26.0.1.44877 > 112.26.0.8.44380: Flags [.], seq 401081:402509, ack 1, win 4017, options [nop,nop,TS val 256063 ecr 42074,mptcp dss ack 3454339951 seq 445507820 subseq 401081 len 1428 csum 0x38eb], length 1428
10:42:34.130255 IP 112.26.0.1.44877 > 112.26.0.8.44380: Flags [.], seq 402509:403937, ack 1, win 4017, options [nop,nop,TS val 256142 ecr 42164,mptcp dss ack 3454339951 seq 445512104 subseq 402509 len 1428 csum 0xf179], length 1428
10:42:34.130598 IP 112.26.0.1.44877 > 112.26.0.8.44380: Flags [.], seq 402509:403937, ack 1, win 4017, options [nop,nop,TS val 256142 ecr 42164,mptcp dss ack 3454339951 seq 445512104 subseq 402509 len 1428 csum 0xf179], length 1428
10:42:34.179242 IP 112.26.0.1.44877 > 112.26.0.8.44380: Flags [.], seq 391085:392513, ack 1, win 4017, options [nop,nop,TS val 255750 ecr 41737,mptcp dss ack 3454339951 seq 445493540 subseq 391085 len 1428 csum 0x1336], length 1428
10:42:34.184293 IP 112.26.0.8.44380 > 112.26.0.1.44877: Flags [.], ack 382517, win 24486, options [nop,nop,TS val 42967 ecr 254659,nop,nop,sack 1 {383945:392513},mptcp dss ack 445453556], length 0
10:42:34.184642 IP 112.26.0.8.44380 > 112.26.0.1.44877: Flags [.], ack 382517, win 24486, options [nop,nop,TS val 42967 ecr 254659,nop,nop,sack 1 {383945:392513},mptcp dss ack 445453556], length 0
10:42:34.214051 IP 112.26.0.1.44877 > 112.26.0.8.44380: Flags [.], seq 382517:383945, ack 1, win 4017, options [nop,nop,TS val 256142 ecr 42240,mptcp dss ack 3454339951 seq 445457840 subseq 382517 len 1428 csum 0xf5f2], length 1428
10:42:34.214382 IP 112.26.0.1.44877 > 112.26.0.8.44380: Flags [.], seq 382517:383945, ack 1, win 4017, options [nop,nop,TS val 256142 ecr 42240,mptcp dss ack 3454339951 seq 445457840 subseq 382517 len 1428 csum 0xf5f2], length 1428
10:42:34.292580 IP 112.26.0.1.44877 > 112.26.0.8.44380: Flags [.], seq 403937:405365, ack 1, win 4017, options [nop,nop,TS val 256251 ecr 42329,mptcp dss ack 3454339951 seq 445516388 subseq 403937 len 1428 csum 0xbdda], length 1428
10:42:34.292863 IP 112.26.0.1.44877 > 112.26.0.8.44380: Flags [.], seq 403937:405365, ack 1, win 4017, options [nop,nop,TS val 256251 ecr 42329,mptcp dss ack 3454339951 seq 445516388 subseq 403937 len 1428 csum 0xbdda], length 1428
10:42:34.299809 IP 112.26.0.1.44877 > 112.26.0.8.44380: Flags [.], seq 392513:393941, ack 1, win 4017, options [nop,nop,TS val 255750 ecr 41737,mptcp dss ack 3454339951 seq 445494968 subseq 392513 len 1428 csum 0x90eb], length 1428
10:42:34.356373 IP 112.26.0.8.44380 > 112.26.0.1.44877: Flags [.], ack 382517, win 24486, options [nop,nop,TS val 43079 ecr 254659,nop,nop,sack 1 {383945:393941},mptcp dss ack 445453556], length 0
10:42:34.356708 IP 112.26.0.8.44380 > 112.26.0.1.44877: Flags [.], ack 382517, win 24486, options [nop,nop,TS val 43079 ecr 254659,nop,nop,sack 1 {383945:393941},mptcp dss ack 445453556], length 0
10:42:34.430702 IP 112.26.0.1.44877 > 112.26.0.8.44380: Flags [.], seq 405365:406793, ack 1, win 4017, options [nop,nop,TS val 256562 ecr 42522,mptcp dss ack 3454339951 seq 445526384 subseq 405365 len 1428 csum 0x7c2a], length 1428
10:42:34.431031 IP 112.26.0.1.44877 > 112.26.0.8.44380: Flags [.], seq 405365:406793, ack 1, win 4017, options [nop,nop,TS val 256562 ecr 42522,mptcp dss ack 3454339951 seq 445526384 subseq 405365 len 1428 csum 0x7c2a], length 1428
10:42:34.481970 IP 112.26.0.1.44877 > 112.26.0.8.44380: Flags [.], seq 395369:396797, ack 1, win 4017, options [nop,nop,TS val 255750 ecr 41737,mptcp dss ack 3454339951 seq 445497824 subseq 395369 len 1428 csum 0xfc3f], length 1428
10:42:34.487434 IP 112.26.0.8.44380 > 112.26.0.1.44877: Flags [.], ack 382517, win 24486, options [nop,nop,TS val 43270 ecr 254659,nop,nop,sack 2 {395369:396797}{383945:393941},mptcp dss ack 445453556], length 0
10:42:34.487729 IP 112.26.0.8.44380 > 112.26.0.1.44877: Flags [.], ack 382517, win 24486, options [nop,nop,TS val 43270 ecr 254659,nop,nop,sack 2 {395369:396797}{383945:393941},mptcp dss ack 445453556], length 0
10:42:34.563791 IP 112.26.0.1.44877 > 112.26.0.8.44380: Flags [.], seq 396797:398225, ack 1, win 4017, options [nop,nop,TS val 255827 ecr 41828,mptcp dss ack 3454339951 seq 445500680 subseq 396797 len 1428 csum 0x6d23], length 1428
10:42:34.578590 IP 112.26.0.8.44380 > 112.26.0.1.44877: Flags [.], ack 382517, win 24486, options [nop,nop,TS val 43352 ecr 254659,nop,nop,sack 2 {395369:398225}{383945:393941},mptcp dss ack 445453556], length 0
10:42:34.578821 IP 112.26.0.8.44380 > 112.26.0.1.44877: Flags [.], ack 382517, win 24486, options [nop,nop,TS val 43352 ecr 254659,nop,nop,sack 2 {395369:398225}{383945:393941},mptcp dss ack 445453556], length 0
10:42:34.653941 IP 112.26.0.1.44877 > 112.26.0.8.44380: Flags [.], seq 398225:399653, ack 1, win 4017, options [nop,nop,TS val 255957 ecr 41973,mptcp dss ack 3454339951 seq 445504964 subseq 398225 len 1428 csum 0x503a], length 1428
10:42:34.660461 IP 112.26.0.8.44380 > 112.26.0.1.44877: Flags [.], ack 382517, win 24486, options [nop,nop,TS val 43442 ecr 254659,nop,nop,sack 2 {395369:399653}{383945:393941},mptcp dss ack 445453556], length 0
10:42:34.660757 IP 112.26.0.8.44380 > 112.26.0.1.44877: Flags [.], ack 382517, win 24486, options [nop,nop,TS val 43442 ecr 254659,nop,nop,sack 2 {395369:399653}{383945:393941},mptcp dss ack 445453556], length 0
10:42:34.706081 IP 112.26.0.1.44877 > 112.26.0.8.44380: Flags [.], seq 399653:401081, ack 1, win 4017, options [nop,nop,TS val 255957 ecr 41973,mptcp dss ack 3454339951 seq 445506392 subseq 399653 len 1428 csum 0x9599], length 1428
10:42:34.777410 IP 112.26.0.8.44380 > 112.26.0.1.44877: Flags [.], ack 382517, win 24486, options [nop,nop,TS val 43495 ecr 254659,nop,nop,sack 2 {395369:401081}{383945:393941},mptcp dss ack 445453556], length 0
10:42:34.777759 IP 112.26.0.8.44380 > 112.26.0.1.44877: Flags [.], ack 382517, win 24486, options [nop,nop,TS val 43495 ecr 254659,nop,nop,sack 2 {395369:401081}{383945:393941},mptcp dss ack 445453556], length 0
10:42:34.790530 IP 112.26.0.1.44877 > 112.26.0.8.44380: Flags [.], seq 401081:402509, ack 1, win 4017, options [nop,nop,TS val 256063 ecr 42074,mptcp dss ack 3454339951 seq 445507820 subseq 401081 len 1428 csum 0x38eb], length 1428
10:42:34.836362 IP 112.26.0.8.44380 > 112.26.0.1.44877: Flags [.], ack 382517, win 24420, options [nop,nop,TS val 43579 ecr 254659,nop,nop,sack 2 {395369:402509}{383945:393941},mptcp dss ack 445457840], length 0
10:42:34.836698 IP 112.26.0.8.44380 > 112.26.0.1.44877: Flags [.], ack 382517, win 24420, options [nop,nop,TS val 43579 ecr 254659,nop,nop,sack 2 {395369:402509}{383945:393941},mptcp dss ack 445457840], length 0
10:42:34.896338 IP 112.26.0.8.44380 > 112.26.0.1.44877: Flags [.], ack 393941, win 24073, options [nop,nop,TS val 43668 ecr 256142,nop,nop,sack 1 {395369:402509},mptcp dss ack 445487828], length 0
10:42:34.896674 IP 112.26.0.8.44380 > 112.26.0.1.44877: Flags [.], ack 393941, win 24073, options [nop,nop,TS val 43668 ecr 256142,nop,nop,sack 1 {395369:402509},mptcp dss ack 445487828], length 0
10:42:34.898192 IP 112.26.0.1.44877 > 112.26.0.8.44380: Flags [.], seq 382517:383945, ack 1, win 4017, options [nop,nop,TS val 256142 ecr 42240,mptcp dss ack 3454339951 seq 445457840 subseq 382517 len 1428 csum 0xf5f2], length 1428
10:42:34.986614 IP 112.26.0.1.44877 > 112.26.0.8.44380: Flags [.], seq 403937:405365, ack 1, win 4017, options [nop,nop,TS val 256251 ecr 42329,mptcp dss ack 3454339951 seq 445516388 subseq 403937 len 1428 csum 0xbdda], length 1428
10:42:35.003537 IP 112.26.0.8.44380 > 112.26.0.1.44877: Flags [.], ack 393941, win 24386, options [nop,nop,TS val 43775 ecr 256142,nop,nop,sack 2 {403937:405365}{395369:402509},mptcp dss ack 445487828], length 0
10:42:35.003769 IP 112.26.0.8.44380 > 112.26.0.1.44877: Flags [.], ack 393941, win 24386, options [nop,nop,TS val 43775 ecr 256142,nop,nop,sack 2 {403937:405365}{395369:402509},mptcp dss ack 445487828], length 0
10:42:35.086134 IP 112.26.0.1.44877 > 112.26.0.8.44380: Flags [.], seq 405365:406793, ack 1, win 4017, options [nop,nop,TS val 256562 ecr 42522,mptcp dss ack 3454339951 seq 445526384 subseq 405365 len 1428 csum 0x7c2a], length 1428
10:42:35.094121 IP 112.26.0.8.44380 > 112.26.0.1.44877: Flags [.], ack 393941, win 24386, options [nop,nop,TS val 43875 ecr 256142,nop,nop,sack 2 {403937:406793}{395369:402509},mptcp dss ack 445487828], length 0
10:42:35.094443 IP 112.26.0.8.44380 > 112.26.0.1.44877: Flags [.], ack 393941, win 24386, options [nop,nop,TS val 43875 ecr 256142,nop,nop,sack 2 {403937:406793}{395369:402509},mptcp dss ack 445487828], length 0
10:42:35.218452 IP 112.26.0.1.44877 > 112.26.0.8.44380: Flags [.], seq 393941:395369, ack 1, win 4017, options [nop,nop,TS val 257354 ecr 43352,mptcp dss ack 3454339951 seq 445496396 subseq 393941 len 1428 csum 0x6336], length 1428
10:42:35.218786 IP 112.26.0.1.44877 > 112.26.0.8.44380: Flags [.], seq 393941:395369, ack 1, win 4017, options [nop,nop,TS val 257354 ecr 43352,mptcp dss ack 3454339951 seq 445496396 subseq 393941 len 1428 csum 0x6336], length 1428
10:42:35.323004 IP 112.26.0.1.44877 > 112.26.0.8.44380: Flags [.], seq 406793:408221, ack 1, win 4017, options [nop,nop,TS val 257458 ecr 43442,mptcp dss ack 3454339951 seq 445559228 subseq 406793 len 1428 csum 0xe562], length 1428
10:42:35.323340 IP 112.26.0.1.44877 > 112.26.0.8.44380: Flags [.], seq 406793:408221, ack 1, win 4017, options [nop,nop,TS val 257458 ecr 43442,mptcp dss ack 3454339951 seq 445559228 subseq 406793 len 1428 csum 0xe562], length 1428
10:42:35.494582 IP 112.26.0.1.44877 > 112.26.0.8.44380: Flags [.], seq 408221:409649, ack 1, win 4017, options [nop,nop,TS val 257631 ecr 43495,mptcp dss ack 3454339951 seq 445563512 subseq 408221 len 1428 csum 0xa264], length 1428
10:42:35.494948 IP 112.26.0.1.44877 > 112.26.0.8.44380: Flags [.], seq 408221:409649, ack 1, win 4017, options [nop,nop,TS val 257631 ecr 43495,mptcp dss ack 3454339951 seq 445563512 subseq 408221 len 1428 csum 0xa264], length 1428
10:42:35.579081 IP 112.26.0.1.44877 > 112.26.0.8.44380: Flags [.], seq 409649:411077, ack 1, win 4017, options [nop,nop,TS val 257714 ecr 43579,mptcp dss ack 3454339951 seq 445569224 subseq 409649 len 1428 csum 0xd32f], length 1428
10:42:35.579413 IP 112.26.0.1.44877 > 112.26.0.8.44380: Flags [.], seq 409649:411077, ack 1, win 4017, options [nop,nop,TS val 257714 ecr 43579,mptcp dss ack 3454339951 seq 445569224 subseq 409649 len 1428 csum 0xd32f], length 1428
10:42:35.661208 IP 112.26.0.1.44877 > 112.26.0.8.44380: Flags [.], seq 411077:412505, ack 1, win 4017, options [nop,nop,TS val 257714 ecr 43668,mptcp dss ack 3454339951 seq 445570652 subseq 411077 len 1428 csum 0x8534], length 1428
10:42:35.661491 IP 112.26.0.1.44877 > 112.26.0.8.44380: Flags [.], seq 411077:412505, ack 1, win 4017, options [nop,nop,TS val 257714 ecr 43668,mptcp dss ack 3454339951 seq 445570652 subseq 411077 len 1428 csum 0x8534], length 1428
10:42:35.728784 IP 112.26.0.1.44877 > 112.26.0.8.44380: Flags [.], seq 412505:413933, ack 1, win 4017, options [nop,nop,TS val 257714 ecr 43668,mptcp dss ack 3454339951 seq 445572080 subseq 412505 len 1428 csum 0xba7b], length 1428
10:42:35.729030 IP 112.26.0.1.44877 > 112.26.0.8.44380: Flags [.], seq 412505:413933, ack 1, win 4017, options [nop,nop,TS val 257714 ecr 43668,mptcp dss ack 3454339951 seq 445572080 subseq 412505 len 1428 csum 0xba7b], length 1428
10:42:35.764834 IP 112.26.0.1.44877 > 112.26.0.8.44380: Flags [.], seq 393941:395369, ack 1, win 4017, options [nop,nop,TS val 257354 ecr 43352,mptcp dss ack 3454339951 seq 445496396 subseq 393941 len 1428 csum 0x6336], length 1428
10:42:35.769374 IP 112.26.0.8.44380 > 112.26.0.1.44877: Flags [.], ack 402509, win 24386, options [nop,nop,TS val 44553 ecr 257354,nop,nop,sack 1 {403937:406793},mptcp dss ack 445487828], length 0
10:42:35.769683 IP 112.26.0.8.44380 > 112.26.0.1.44877: Flags [.], ack 402509, win 24386, options [nop,nop,TS val 44553 ecr 257354,nop,nop,sack 1 {403937:406793},mptcp dss ack 445487828], length 0
10:42:35.792767 IP 112.26.0.1.44877 > 112.26.0.8.44380: Flags [.], seq 402509:403937, ack 1, win 4017, options [nop,nop,TS val 257767 ecr 43775,mptcp dss ack 3454339951 seq 445512104 subseq 402509 len 1428 csum 0xf179], length 1428
10:42:35.793101 IP 112.26.0.1.44877 > 112.26.0.8.44380: Flags [.], seq 402509:403937, ack 1, win 4017, options [nop,nop,TS val 257767 ecr 43775,mptcp dss ack 3454339951 seq 445512104 subseq 402509 len 1428 csum 0xf179], length 1428
10:42:35.847734 IP 112.26.0.1.44877 > 112.26.0.8.44380: Flags [.], seq 413933:415361, ack 1, win 4017, options [nop,nop,TS val 257846 ecr 43875,mptcp dss ack 3454339951 seq 445577792 subseq 413933 len 1428 csum 0xadf3], length 1428
10:42:35.848073 IP 112.26.0.1.44877 > 112.26.0.8.44380: Flags [.], seq 413933:415361, ack 1, win 4017, options [nop,nop,TS val 257846 ecr 43875,mptcp dss ack 3454339951 seq 445577792 subseq 413933 len 1428 csum 0xadf3], length 1428
10:42:35.876835 IP 112.26.0.8.44380 > 112.26.0.1.44877: Flags [.], ack 402509, win 24386, options [nop,nop,TS val 44656 ecr 257354,nop,nop,sack 1 {403937:408221},mptcp dss ack 445487828], length 0
10:42:35.877148 IP 112.26.0.8.44380 > 112.26.0.1.44877: Flags [.], ack 402509, win 24386, options [nop,nop,TS val 44656 ecr 257354,nop,nop,sack 1 {403937:408221},mptcp dss ack 445487828], length 0
10:42:35.903378 IP 112.26.0.1.44877 > 112.26.0.8.44380: Flags [.], seq 406793:408221, ack 1, win 4017, options [nop,nop,TS val 257458 ecr 43442,mptcp dss ack 3454339951 seq 445559228 subseq 406793 len 1428 csum 0xe562], length 1428
10:42:35.953014 IP 112.26.0.1.44877 > 112.26.0.8.44380: Flags [.], seq 408221:409649, ack 1, win 4017, options [nop,nop,TS val 257631 ecr 43495,mptcp dss ack 3454339951 seq 445563512 subseq 408221 len 1428 csum 0xa264], length 1428
10:42:35.959268 IP 112.26.0.8.44380 > 112.26.0.1.44877: Flags [.], ack 402509, win 24386, options [nop,nop,TS val 44741 ecr 257354,nop,nop,sack 1 {403937:409649},mptcp dss ack 445487828], length 0
10:42:35.959612 IP 112.26.0.8.44380 > 112.26.0.1.44877: Flags [.], ack 402509, win 24386, options [nop,nop,TS val 44741 ecr 257354,nop,nop,sack 1 {403937:409649},mptcp dss ack 445487828], length 0
10:42:36.045278 IP 112.26.0.1.44877 > 112.26.0.8.44380: Flags [.], seq 409649:411077, ack 1, win 4017, options [nop,nop,TS val 257714 ecr 43579,mptcp dss ack 3454339951 seq 445569224 subseq 409649 len 1428 csum 0xd32f], length 1428
10:42:36.063163 IP 112.26.0.8.44380 > 112.26.0.1.44877: Flags [.], ack 402509, win 24386, options [nop,nop,TS val 44833 ecr 257354,nop,nop,sack 1 {403937:411077},mptcp dss ack 445487828], length 0
10:42:36.063452 IP 112.26.0.8.44380 > 112.26.0.1.44877: Flags [.], ack 402509, win 24386, options [nop,nop,TS val 44833 ecr 257354,nop,nop,sack 1 {403937:411077},mptcp dss ack 445487828], length 0
10:42:36.109813 IP 112.26.0.1.44877 > 112.26.0.8.44380: Flags [.], seq 411077:412505, ack 1, win 4017, options [nop,nop,TS val 257714 ecr 43668,mptcp dss ack 3454339951 seq 445570652 subseq 411077 len 1428 csum 0x8534], length 1428
10:42:36.125892 IP 112.26.0.8.44380 > 112.26.0.1.44877: Flags [.], ack 402509, win 24133, options [nop,nop,TS val 44898 ecr 257354,nop,nop,sack 1 {403937:412505},mptcp dss ack 445512104], length 0
10:42:36.126189 IP 112.26.0.8.44380 > 112.26.0.1.44877: Flags [.], ack 402509, win 24133, options [nop,nop,TS val 44898 ecr 257354,nop,nop,sack 1 {403937:412505},mptcp dss ack 445512104], length 0
