10:41:55.132749 IP 112.26.0.8.44380 > 112.26.0.1.44877: Flags [S], seq 231718060, win 65535, options [mss 1460,sackOK,TS val 3909 ecr 0,nop,wscale 6,mptcp capable csum {0x4662d4d2f708162f}], length 0
10:41:55.133865 IP 112.26.0.1.44877 > 112.26.0.8.44380: Flags [S.], seq 1060196464, ack 231718061, win 65535, options [mss 1460,sackOK,TS val 217271 ecr 3909,nop,wscale 6,mptcp capable csum {0x38a7cf8d5ca5beb8}], length 0
10:41:55.157188 IP 112.26.0.1.44877 > 112.26.0.8.44380: Flags [S.], seq 1060196464, ack 231718061, win 65535, options [mss 1460,sackOK,TS val 217271 ecr 3909,nop,wscale 6,mptcp capable csum {0x38a7cf8d5ca5beb8}], length 0
10:41:55.160005 IP 112.26.0.1.44877 > 112.26.0.8.44380: Flags [S.], seq 1060196464, ack 231718061, win 65535, options [mss 1460,sackOK,TS val 217271 ecr 3909,nop,wscale 6,mptcp capable csum {0x38a7cf8d5ca5beb8}], length 0
10:41:55.288092 IP 112.26.0.8.44380 > 112.26.0.1.44877: Flags [.], ack 1, win 1369, options [nop,nop,TS val 3947 ecr 217271,mptcp capable csum {0x4662d4d2f708162f,0x38a7cf8d5ca5beb8},mptcp dss ack 444111424], length 0
10:41:55.290204 IP 112.26.0.1.44877 > 112.26.0.8.44380: Flags [.], ack 1, win 1339, options [nop,nop,TS val 217427 ecr 3947,mptcp add-addr id 4 112.26.2.1,mptcp dss ack 3454339951], length 0
10:41:55.359628 IP 112.26.0.1.44877 > 112.26.0.8.44380: Flags [.], ack 1, win 1339, options [nop,nop,TS val 217427 ecr 3947,mptcp add-addr id 5 112.26.3.1,mptcp dss ack 3454339951], length 0
10:42:31.054626 IP 112.26.0.1.44877 > 112.26.0.8.44380: Flags [.], seq 361097:362525, ack 1, win 4017, options [nop,nop,TS val 252608 ecr 38806,mptcp dss ack 3454339951 seq 445365020 subseq 361097 len 1428 csum 0xcb65], length 1428
10:42:31.057800 IP 112.26.0.1.44877 > 112.26.0.8.44380: Flags [.], seq 361097:362525, ack 1, win 4017, options [nop,nop,TS val 252608 ecr 38806,mptcp dss ack 3454339951 seq 445365020 subseq 361097 len 1428 csum 0xcb65], length 1428
10:42:31.176615 IP 112.26.0.8.44380 > 112.26.0.1.44877: Flags [.], ack 356813, win 24177, options [nop,nop,TS val 39328 ecr 252217,mptcp dss ack 445269344], length 0
10:42:31.181052 IP 112.26.0.1.44877 > 112.26.0.8.44380: Flags [.], seq 366809:368237, ack 1, win 4017, options [nop,nop,TS val 253315 ecr 39328,mptcp dss ack 3454339951 seq 445399292 subseq 366809 len 1428 csum 0x2c8a], length 1428
10:42:31.228362 IP 112.26.0.8.44380 > 112.26.0.1.44877: Flags [.], ack 358241, win 24094, options [nop,nop,TS val 39419 ecr 252283,mptcp dss ack 445287908], length 0
10:42:44.249060 IP 112.26.0.1.44877 > 112.26.0.8.44380: Flags [.], seq 492473:493901, ack 1, win 4017, options [nop,nop,TS val 265684 ecr 51641,mptcp dss ack 3454339951 seq 445953356 subseq 492473 len 1428 csum 0x49a], length 1428
10:42:54.187347 IP 112.26.0.1.44877 > 112.26.0.8.44380: Flags [.], seq 598145:599573, ack 1, win 4017, options [nop,nop,TS val 276213 ecr 62317,mptcp dss ack 3454339951 seq 446368904 subseq 598145 len 1428 csum 0xa19b], length 1428
10:42:54.252020 IP 112.26.0.8.44380 > 112.26.0.1.44877: Flags [.], ack 588149, win 24576, options [nop,nop,TS val 62424 ecr 275224,mptcp dss ack 446264660], length 0
10:42:54.256239 IP 112.26.0.1.44877 > 112.26.0.8.44380: Flags [.], seq 599573:601001, ack 1, win 4017, options [nop,nop,TS val 276391 ecr 62424,mptcp dss ack 3454339951 seq 446376044 subseq 599573 len 1428 csum 0xe3e7], length 1428
10:42:54.338015 IP 112.26.0.8.44380 > 112.26.0.1.44877: Flags [.], ack 589577, win 24576, options [nop,nop,TS val 62518 ecr 275279,mptcp dss ack 446264660], length 0
10:42:54.340771 IP 112.26.0.1.44877 > 112.26.0.8.44380: Flags [.], seq 601001:602429, ack 1, win 4017, options [nop,nop,TS val 276476 ecr 62518,mptcp dss ack 3454339951 seq 446383184 subseq 601001 len 1428 csum 0x2fad], length 1428
10:42:54.379056 IP 112.26.0.8.44380 > 112.26.0.1.44877: Flags [.], ack 591005, win 24576, options [nop,nop,TS val 62615 ecr 275350,mptcp dss ack 446264660], length 0
10:42:54.430173 IP 112.26.0.1.44877 > 112.26.0.8.44380: Flags [.], seq 602429:603857, ack 1, win 4017, options [nop,nop,TS val 276517 ecr 62615,mptcp dss ack 3454339951 seq 446386040 subseq 602429 len 1428 csum 0x4b32], length 1428
10:42:54.454818 IP 112.26.0.8.44380 > 112.26.0.1.44877: Flags [.], ack 592433, win 24424, options [nop,nop,TS val 62697 ecr 275410,mptcp dss ack 446321780], length 0
10:42:54.508197 IP 112.26.0.1.44877 > 112.26.0.8.44380: Flags [.], seq 603857:605285, ack 1, win 4017, options [nop,nop,TS val 276593 ecr 62697,mptcp dss ack 3454339951 seq 446387468 subseq 603857 len 1428 csum 0xc2a2], length 1428
10:42:54.514177 IP 112.26.0.1.44877 > 112.26.0.8.44380: Flags [.], seq 593861:595289, ack 1, win 4017, options [nop,nop,TS val 276084 ecr 62154,mptcp dss ack 3454339951 seq 446360336 subseq 593861 len 1428 csum 0x9bc2], length 1428
10:42:54.536526 IP 112.26.0.1.44877 > 112.26.0.8.44380: Flags [.], seq 593861:595289, ack 1, win 4017, options [nop,nop,TS val 276084 ecr 62154,mptcp dss ack 3454339951 seq 446360336 subseq 593861 len 1428 csum 0x9bc2], length 1428
10:42:54.621948 IP 112.26.0.1.44877 > 112.26.0.8.44380: Flags [.], seq 595289:596717, ack 1, win 4017, options [nop,nop,TS val 276181 ecr 62228,mptcp dss ack 3454339951 seq 446361764 subseq 595289 len 1428 csum 0xe9c2], length 1428
10:42:54.624758 IP 112.26.0.1.44877 > 112.26.0.8.44380: Flags [.], seq 595289:596717, ack 1, win 4017, options [nop,nop,TS val 276181 ecr 62228,mptcp dss ack 3454339951 seq 446361764 subseq 595289 len 1428 csum 0xe9c2], length 1428
10:42:54.683954 IP 112.26.0.1.44877 > 112.26.0.8.44380: Flags [.], seq 596717:598145, ack 1, win 4017, options [nop,nop,TS val 276181 ecr 62228,mptcp dss ack 3454339951 seq 446363192 subseq 596717 len 1428 csum 0x786e], length 1428
10:42:54.704586 IP 112.26.0.1.44877 > 112.26.0.8.44380: Flags [.], seq 596717:598145, ack 1, win 4017, options [nop,nop,TS val 276181 ecr 62228,mptcp dss ack 3454339951 seq 446363192 subseq 596717 len 1428 csum 0x786e], length 1428
10:42:54.734558 IP 112.26.0.8.44380 > 112.26.0.1.44877: Flags [.], ack 593861, win 24424, options [nop,nop,TS val 62937 ecr 275721,mptcp dss ack 446321780], length 0
10:42:54.744766 IP 112.26.0.1.44877 > 112.26.0.8.44380: Flags [.], seq 605285:606713, ack 1, win 4017, options [nop,nop,TS val 276873 ecr 62937,mptcp dss ack 3454339951 seq 446401748 subseq 605285 len 1428 csum 0xf303], length 1428
10:42:54.798515 IP 112.26.0.1.44877 > 112.26.0.8.44380: Flags [.], seq 598145:599573, ack 1, win 4017, options [nop,nop,TS val 276213 ecr 62317,mptcp dss ack 3454339951 seq 446368904 subseq 598145 len 1428 csum 0xa19b], length 1428
10:42:54.817602 IP 112.26.0.1.44877 > 112.26.0.8.44380: Flags [.], seq 606713:608141, ack 1, win 4017, options [nop,nop,TS val 276873 ecr 62937,mptcp dss ack 3454339951 seq 446403176 subseq 606713 len 1428 csum 0xd00c], length 1428
10:42:54.846131 IP 112.26.0.1.44877 > 112.26.0.8.44380: Flags [.], seq 598145:599573, ack 1, win 4017, options [nop,nop,TS val 276213 ecr 62317,mptcp dss ack 3454339951 seq 446368904 subseq 598145 len 1428 csum 0xa19b], length 1428
10:42:54.894905 IP 112.26.0.1.44877 > 112.26.0.8.44380: Flags [.], seq 599573:601001, ack 1, win 4017, options [nop,nop,TS val 276391 ecr 62424,mptcp dss ack 3454339951 seq 446376044 subseq 599573 len 1428 csum 0xe3e7], length 1428
10:42:54.909184 IP 112.26.0.1.44877 > 112.26.0.8.44380: Flags [.], seq 599573:601001, ack 1, win 4017, options [nop,nop,TS val 276391 ecr 62424,mptcp dss ack 3454339951 seq 446376044 subseq 599573 len 1428 csum 0xe3e7], length 1428
10:42:54.961538 IP 112.26.0.1.44877 > 112.26.0.8.44380: Flags [.], seq 601001:602429, ack 1, win 4017, options [nop,nop,TS val 276476 ecr 62518,mptcp dss ack 3454339951 seq 446383184 subseq 601001 len 1428 csum 0x2fad], length 1428
10:42:54.982351 IP 112.26.0.1.44877 > 112.26.0.8.44380: Flags [.], seq 601001:602429, ack 1, win 4017, options [nop,nop,TS val 276476 ecr 62518,mptcp dss ack 3454339951 seq 446383184 subseq 601001 len 1428 csum 0x2fad], length 1428
10:42:55.045822 IP 112.26.0.1.44877 > 112.26.0.8.44380: Flags [.], seq 602429:603857, ack 1, win 4017, options [nop,nop,TS val 276517 ecr 62615,mptcp dss ack 3454339951 seq 446386040 subseq 602429 len 1428 csum 0x4b32], length 1428
10:42:55.063452 IP 112.26.0.1.44877 > 112.26.0.8.44380: Flags [.], seq 602429:603857, ack 1, win 4017, options [nop,nop,TS val 276517 ecr 62615,mptcp dss ack 3454339951 seq 446386040 subseq 602429 len 1428 csum 0x4b32], length 1428
10:42:55.107443 IP 112.26.0.1.44877 > 112.26.0.8.44380: Flags [.], seq 603857:605285, ack 1, win 4017, options [nop,nop,TS val 276593 ecr 62697,mptcp dss ack 3454339951 seq 446387468 subseq 603857 len 1428 csum 0xc2a2], length 1428
10:42:55.146316 IP 112.26.0.1.44877 > 112.26.0.8.44380: Flags [.], seq 603857:605285, ack 1, win 4017, options [nop,nop,TS val 276593 ecr 62697,mptcp dss ack 3454339951 seq 446387468 subseq 603857 len 1428 csum 0xc2a2], length 1428
10:42:55.202956 IP 112.26.0.8.44380 > 112.26.0.1.44877: Flags [.], ack 595289, win 24424, options [nop,nop,TS val 63307 ecr 276084,mptcp dss ack 446321780], length 0
10:42:55.210051 IP 112.26.0.1.44877 > 112.26.0.8.44380: Flags [.], seq 608141:609569, ack 1, win 4017, options [nop,nop,TS val 277342 ecr 63307,mptcp dss ack 3454339951 seq 446371760 subseq 608141 len 1428 csum 0x7115], length 1428
10:42:55.266225 IP 112.26.0.1.44877 > 112.26.0.8.44380: Flags [.], seq 609569:610997, ack 1, win 4017, options [nop,nop,TS val 277342 ecr 63307,mptcp dss ack 3454339951 seq 446393180 subseq 609569 len 1428 csum 0x94f8], length 1428
10:42:55.294713 IP 112.26.0.8.44380 > 112.26.0.1.44877: Flags [.], ack 596717, win 24424, options [nop,nop,TS val 63413 ecr 276181,mptcp dss ack 446321780], length 0
10:42:55.336610 IP 112.26.0.1.44877 > 112.26.0.8.44380: Flags [.], seq 610997:612425, ack 1, win 4017, options [nop,nop,TS val 277433 ecr 63413,mptcp dss ack 3454339951 seq 446406032 subseq 610997 len 1428 csum 0xaa12], length 1428
10:42:55.346980 IP 112.26.0.1.44877 > 112.26.0.8.44380: Flags [.], seq 605285:606713, ack 1, win 4017, options [nop,nop,TS val 276873 ecr 62937,mptcp dss ack 3454339951 seq 446401748 subseq 605285 len 1428 csum 0xf303], length 1428
10:42:55.358189 IP 112.26.0.1.44877 > 112.26.0.8.44380: Flags [.], seq 605285:606713, ack 1, win 4017, options [nop,nop,TS val 276873 ecr 62937,mptcp dss ack 3454339951 seq 446401748 subseq 605285 len 1428 csum 0xf303], length 1428
10:42:55.417683 IP 112.26.0.8.44380 > 112.26.0.1.44877: Flags [.], ack 598145, win 24424, options [nop,nop,TS val 63493 ecr 276181,mptcp dss ack 446321780], length 0
10:42:55.444868 IP 112.26.0.1.44877 > 112.26.0.8.44380: Flags [.], seq 612425:613853, ack 1, win 4017, options [nop,nop,TS val 277556 ecr 63493,mptcp dss ack 3454339951 seq 446414600 subseq 612425 len 1428 csum 0xac81], length 1428
10:42:55.475664 IP 112.26.0.1.44877 > 112.26.0.8.44380: Flags [.], seq 606713:608141, ack 1, win 4017, options [nop,nop,TS val 276873 ecr 62937,mptcp dss ack 3454339951 seq 446403176 subseq 606713 len 1428 csum 0xd00c], length 1428
10:42:55.478200 IP 112.26.0.1.44877 > 112.26.0.8.44380: Flags [.], seq 606713:608141, ack 1, win 4017, options [nop,nop,TS val 276873 ecr 62937,mptcp dss ack 3454339951 seq 446403176 subseq 606713 len 1428 csum 0xd00c], length 1428
10:42:55.519531 IP 112.26.0.1.44877 > 112.26.0.8.44380: Flags [.], seq 613853:615281, ack 1, win 4017, options [nop,nop,TS val 277556 ecr 63493,mptcp dss ack 3454339951 seq 446416028 subseq 613853 len 1428 csum 0x290a], length 1428
10:42:55.543990 IP 112.26.0.8.44380 > 112.26.0.1.44877: Flags [.], ack 601001, win 24424, options [nop,nop,TS val 63697 ecr 276391,mptcp dss ack 446321780], length 0
10:42:55.598528 IP 112.26.0.8.44380 > 112.26.0.1.44877: Flags [.], ack 602429, win 24424, options [nop,nop,TS val 63770 ecr 276476,mptcp dss ack 446321780], length 0
10:42:55.607111 IP 112.26.0.1.44877 > 112.26.0.8.44380: Flags [.], seq 615281:616709, ack 1, win 4017, options [nop,nop,TS val 277683 ecr 63697,mptcp dss ack 3454339951 seq 446418884 subseq 615281 len 1428 csum 0x1c98], length 1428
10:42:55.644587 IP 112.26.0.1.44877 > 112.26.0.8.44380: Flags [.], seq 616709:618137, ack 1, win 4017, options [nop,nop,TS val 277683 ecr 63697,mptcp dss ack 3454339951 seq 446420312 subseq 616709 len 1428 csum 0xabcb], length 1428
10:42:55.646484 IP 112.26.0.8.44380 > 112.26.0.1.44877: Flags [.], ack 603857, win 24424, options [nop,nop,TS val 63852 ecr 276517,mptcp dss ack 446321780], length 0
10:42:55.687282 IP 112.26.0.8.44380 > 112.26.0.1.44877: Flags [.], ack 605285, win 24424, options [nop,nop,TS val 63940 ecr 276593,mptcp dss ack 446321780], length 0
10:42:55.731191 IP 112.26.0.1.44877 > 112.26.0.8.44380: Flags [.], seq 618137:619565, ack 1, win 4017, options [nop,nop,TS val 277737 ecr 63770,mptcp dss ack 3454339951 seq 446421740 subseq 618137 len 1428 csum 0x46e6], length 1428
10:42:55.754807 IP 112.26.0.1.44877 > 112.26.0.8.44380: Flags [.], seq 608141:609569, ack 1, win 4017, options [nop,nop,TS val 277342 ecr 63307,mptcp dss ack 3454339951 seq 446371760 subseq 608141 len 1428 csum 0x7115], length 1428
10:42:55.758956 IP 112.26.0.1.44877 > 112.26.0.8.44380: Flags [.], seq 608141:609569, ack 1, win 4017, options [nop,nop,TS val 277342 ecr 63307,mptcp dss ack 3454339951 seq 446371760 subseq 608141 len 1428 csum 0x7115], length 1428
10:42:55.820862 IP 112.26.0.1.44877 > 112.26.0.8.44380: Flags [.], seq 619565:620993, ack 1, win 4017, options [nop,nop,TS val 277737 ecr 63770,mptcp dss ack 3454339951 seq 446423168 subseq 619565 len 1428 csum 0xc2bf], length 1428
10:42:55.871403 IP 112.26.0.1.44877 > 112.26.0.8.44380: Flags [.], seq 609569:610997, ack 1, win 4017, options [nop,nop,TS val 277342 ecr 63307,mptcp dss ack 3454339951 seq 446393180 subseq 609569 len 1428 csum 0x94f8], length 1428
10:42:55.882856 IP 112.26.0.1.44877 > 112.26.0.8.44380: Flags [.], seq 620993:622421, ack 1, win 4017, options [nop,nop,TS val 277785 ecr 63852,mptcp dss ack 3454339951 seq 446434592 subseq 620993 len 1428 csum 0x7ddf], length 1428
10:42:55.896679 IP 112.26.0.1.44877 > 112.26.0.8.44380: Flags [.], seq 609569:610997, ack 1, win 4017, options [nop,nop,TS val 277342 ecr 63307,mptcp dss ack 3454339951 seq 446393180 subseq 609569 len 1428 csum 0x94f8], length 1428
10:42:55.960712 IP 112.26.0.1.44877 > 112.26.0.8.44380: Flags [.], seq 622421:623849, ack 1, win 4017, options [nop,nop,TS val 277826 ecr 63940,mptcp dss ack 3454339951 seq 446436020 subseq 622421 len 1428 csum 0x43d2], length 1428
10:42:55.977415 IP 112.26.0.1.44877 > 112.26.0.8.44380: Flags [.], seq 610997:612425, ack 1, win 4017, options [nop,nop,TS val 277433 ecr 63413,mptcp dss ack 3454339951 seq 446406032 subseq 610997 len 1428 csum 0xaa12], length 1428
10:42:55.981683 IP 112.26.0.1.44877 > 112.26.0.8.44380: Flags [.], seq 610997:612425, ack 1, win 4017, options [nop,nop,TS val 277433 ecr 63413,mptcp dss ack 3454339951 seq 446406032 subseq 610997 len 1428 csum 0xaa12], length 1428
10:42:56.038633 IP 112.26.0.1.44877 > 112.26.0.8.44380: Flags [.], seq 623849:625277, ack 1, win 4017, options [nop,nop,TS val 277826 ecr 63940,mptcp dss ack 3454339951 seq 446437448 subseq 623849 len 1428 csum 0x4e08], length 1428
10:42:56.111069 IP 112.26.0.1.44877 > 112.26.0.8.44380: Flags [.], seq 612425:613853, ack 1, win 4017, options [nop,nop,TS val 277556 ecr 63493,mptcp dss ack 3454339951 seq 446414600 subseq 612425 len 1428 csum 0xac81], length 1428
10:42:56.113558 IP 112.26.0.1.44877 > 112.26.0.8.44380: Flags [.], seq 612425:613853, ack 1, win 4017, options [nop,nop,TS val 277556 ecr 63493,mptcp dss ack 3454339951 seq 446414600 subseq 612425 len 1428 csum 0xac81], length 1428
10:42:56.187159 IP 112.26.0.8.44380 > 112.26.0.1.44877: Flags [.], ack 608141, win 24543, options [nop,nop,TS val 64267 ecr 276873,mptcp dss ack 446397464], length 0
10:42:56.190189 IP 112.26.0.1.44877 > 112.26.0.8.44380: Flags [.], seq 625277:626705, ack 1, win 4017, options [nop,nop,TS val 278326 ecr 64267,mptcp dss ack 3454339951 seq 446454584 subseq 625277 len 1428 csum 0xdf97], length 1428
10:42:56.242483 IP 112.26.0.1.44877 > 112.26.0.8.44380: Flags [.], seq 626705:628133, ack 1, win 4017, options [nop,nop,TS val 278326 ecr 64267,mptcp dss ack 3454339951 seq 446456012 subseq 626705 len 1428 csum 0xe9cd], length 1428
10:42:56.260857 IP 112.26.0.1.44877 > 112.26.0.8.44380: Flags [.], seq 615281:616709, ack 1, win 4017, options [nop,nop,TS val 277683 ecr 63697,mptcp dss ack 3454339951 seq 446418884 subseq 615281 len 1428 csum 0x1c98], length 1428
10:42:56.263623 IP 112.26.0.1.44877 > 112.26.0.8.44380: Flags [.], seq 615281:616709, ack 1, win 4017, options [nop,nop,TS val 277683 ecr 63697,mptcp dss ack 3454339951 seq 446418884 subseq 615281 len 1428 csum 0x1c98], length 1428
10:42:56.306561 IP 112.26.0.1.44877 > 112.26.0.8.44380: Flags [.], seq 628133:629561, ack 1, win 4017, options [nop,nop,TS val 278326 ecr 64267,mptcp dss ack 3454339951 seq 446457440 subseq 628133 len 1428 csum 0x4855], length 1428
10:42:56.346222 IP 112.26.0.1.44877 > 112.26.0.8.44380: Flags [.], seq 618137:619565, ack 1, win 4017, options [nop,nop,TS val 277737 ecr 63770,mptcp dss ack 3454339951 seq 446421740 subseq 618137 len 1428 csum 0x46e6], length 1428
10:42:56.365103 IP 112.26.0.1.44877 > 112.26.0.8.44380: Flags [.], seq 618137:619565, ack 1, win 4017, options [nop,nop,TS val 277737 ecr 63770,mptcp dss ack 3454339951 seq 446421740 subseq 618137 len 1428 csum 0x46e6], length 1428
10:42:56.439913 IP 112.26.0.8.44380 > 112.26.0.1.44877: Flags [.], ack 609569, win 24543, options [nop,nop,TS val 64547 ecr 277342,mptcp dss ack 446397464], length 0
10:42:56.445353 IP 112.26.0.1.44877 > 112.26.0.8.44380: Flags [.], seq 629561:630989, ack 1, win 4017, options [nop,nop,TS val 278578 ecr 64547,mptcp dss ack 3454339951 seq 446471720 subseq 629561 len 1428 csum 0x943a], length 1428
10:42:56.496321 IP 112.26.0.1.44877 > 112.26.0.8.44380: Flags [.], seq 630989:632417, ack 1, win 4017, options [nop,nop,TS val 278578 ecr 64547,mptcp dss ack 3454339951 seq 446473148 subseq 630989 len 1428 csum 0x46b7], length 1428
10:42:56.523639 IP 112.26.0.1.44877 > 112.26.0.8.44380: Flags [.], seq 620993:622421, ack 1, win 4017, options [nop,nop,TS val 277785 ecr 63852,mptcp dss ack 3454339951 seq 446434592 subseq 620993 len 1428 csum 0x7ddf], length 1428
10:42:56.535726 IP 112.26.0.1.44877 > 112.26.0.8.44380: Flags [.], seq 620993:622421, ack 1, win 4017, options [nop,nop,TS val 277785 ecr 63852,mptcp dss ack 3454339951 seq 446434592 subseq 620993 len 1428 csum 0x7ddf], length 1428
10:42:56.578501 IP 112.26.0.1.44877 > 112.26.0.8.44380: Flags [.], seq 622421:623849, ack 1, win 4017, options [nop,nop,TS val 277826 ecr 63940,mptcp dss ack 3454339951 seq 446436020 subseq 622421 len 1428 csum 0x43d2], length 1428
10:42:56.600102 IP 112.26.0.1.44877 > 112.26.0.8.44380: Flags [.], seq 622421:623849, ack 1, win 4017, options [nop,nop,TS val 277826 ecr 63940,mptcp dss ack 3454339951 seq 446436020 subseq 622421 len 1428 csum 0x43d2], length 1428
10:42:56.660041 IP 112.26.0.8.44380 > 112.26.0.1.44877: Flags [.], ack 612425, win 24543, options [nop,nop,TS val 64770 ecr 277433,mptcp dss ack 446397464], length 0
10:42:56.669686 IP 112.26.0.1.44877 > 112.26.0.8.44380: Flags [.], seq 632417:633845, ack 1, win 4017, options [nop,nop,TS val 278799 ecr 64770,mptcp dss ack 3454339951 seq 446477432 subseq 632417 len 1428 csum 0xa668], length 1428
10:42:56.713679 IP 112.26.0.1.44877 > 112.26.0.8.44380: Flags [.], seq 633845:635273, ack 1, win 4017, options [nop,nop,TS val 278799 ecr 64770,mptcp dss ack 3454339951 seq 446478860 subseq 633845 len 1428 csum 0x34cc], length 1428
10:42:56.737612 IP 112.26.0.8.44380 > 112.26.0.1.44877: Flags [.], ack 613853, win 24543, options [nop,nop,TS val 64902 ecr 277556,mptcp dss ack 446397464], length 0
10:42:56.782992 IP 112.26.0.1.44877 > 112.26.0.8.44380: Flags [.], seq 625277:626705, ack 1, win 4017, options [nop,nop,TS val 278326 ecr 64267,mptcp dss ack 3454339951 seq 446454584 subseq 625277 len 1428 csum 0xdf97], length 1428
10:42:56.785129 IP 112.26.0.1.44877 > 112.26.0.8.44380: Flags [.], seq 625277:626705, ack 1, win 4017, options [nop,nop,TS val 278326 ecr 64267,mptcp dss ack 3454339951 seq 446454584 subseq 625277 len 1428 csum 0xdf97], length 1428
10:42:56.815344 IP 112.26.0.1.44877 > 112.26.0.8.44380: Flags [.], seq 635273:636701, ack 1, win 4017, options [nop,nop,TS val 278799 ecr 64770,mptcp dss ack 3454339951 seq 446480288 subseq 635273 len 1428 csum 0x14da], length 1428
10:42:56.872384 IP 112.26.0.1.44877 > 112.26.0.8.44380: Flags [.], seq 626705:628133, ack 1, win 4017, options [nop,nop,TS val 278326 ecr 64267,mptcp dss ack 3454339951 seq 446456012 subseq 626705 len 1428 csum 0xe9cd], length 1428
10:42:56.903197 IP 112.26.0.1.44877 > 112.26.0.8.44380: Flags [.], seq 636701:638129, ack 1, win 4017, options [nop,nop,TS val 278876 ecr 64902,mptcp dss ack 3454339951 seq 446483144 subseq 636701 len 1428 csum 0x1896], length 1428
10:42:56.914875 IP 112.26.0.1.44877 > 112.26.0.8.44380: Flags [.], seq 626705:628133, ack 1, win 4017, options [nop,nop,TS val 278326 ecr 64267,mptcp dss ack 3454339951 seq 446456012 subseq 626705 len 1428 csum 0xe9cd], length 1428
10:42:56.966437 IP 112.26.0.8.44380 > 112.26.0.1.44877: Flags [.], ack 613853, win 24543, options [nop,nop,TS val 65052 ecr 277556,nop,nop,sack 1 {615281:616709},mptcp dss ack 446397464], length 0
10:42:56.973385 IP 112.26.0.1.44877 > 112.26.0.8.44380: Flags [.], seq 638129:639557, ack 1, win 4017, options [nop,nop,TS val 279109 ecr 65052,mptcp dss ack 3454339951 seq 446487428 subseq 638129 len 1428 csum 0x6450], length 1428
10:42:57.046750 IP 112.26.0.8.44380 > 112.26.0.1.44877: Flags [.], ack 613853, win 24543, options [nop,nop,TS val 65154 ecr 277556,nop,nop,sack 2 {618137:619565}{615281:616709},mptcp dss ack 446397464], length 0
10:42:57.053359 IP 112.26.0.1.44877 > 112.26.0.8.44380: Flags [.], seq 613853:615281, ack 1, win 4017, options [nop,nop,TS val 279185 ecr 65154,mptcp dss ack 3454339951 seq 446416028 subseq 613853 len 1428 csum 0x290a], length 1428
10:42:57.100545 IP 112.26.0.1.44877 > 112.26.0.8.44380: Flags [.], seq 629561:630989, ack 1, win 4017, options [nop,nop,TS val 278578 ecr 64547,mptcp dss ack 3454339951 seq 446471720 subseq 629561 len 1428 csum 0x943a], length 1428
10:42:57.105321 IP 112.26.0.1.44877 > 112.26.0.8.44380: Flags [.], seq 629561:630989, ack 1, win 4017, options [nop,nop,TS val 278578 ecr 64547,mptcp dss ack 3454339951 seq 446471720 subseq 629561 len 1428 csum 0x943a], length 1428
10:42:57.200598 IP 112.26.0.1.44877 > 112.26.0.8.44380: Flags [.], seq 630989:632417, ack 1, win 4017, options [nop,nop,TS val 278578 ecr 64547,mptcp dss ack 3454339951 seq 446473148 subseq 630989 len 1428 csum 0x46b7], length 1428
10:42:57.203468 IP 112.26.0.1.44877 > 112.26.0.8.44380: Flags [.], seq 630989:632417, ack 1, win 4017, options [nop,nop,TS val 278578 ecr 64547,mptcp dss ack 3454339951 seq 446473148 subseq 630989 len 1428 csum 0x46b7], length 1428
10:42:57.297790 IP 112.26.0.8.44380 > 112.26.0.1.44877: Flags [.], ack 613853, win 24543, options [nop,nop,TS val 65389 ecr 277556,nop,nop,sack 2 {620993:623849}{618137:619565},mptcp dss ack 446397464], length 0
10:42:57.301099 IP 112.26.0.1.44877 > 112.26.0.8.44380: Flags [.], seq 616709:618137, ack 1, win 4017, options [nop,nop,TS val 279436 ecr 65389,mptcp dss ack 3454339951 seq 446420312 subseq 616709 len 1428 csum 0xabcb], length 1428
10:42:57.332742 IP 112.26.0.1.44877 > 112.26.0.8.44380: Flags [.], seq 632417:633845, ack 1, win 4017, options [nop,nop,TS val 278799 ecr 64770,mptcp dss ack 3454339951 seq 446477432 subseq 632417 len 1428 csum 0xa668], length 1428
10:42:57.335864 IP 112.26.0.1.44877 > 112.26.0.8.44380: Flags [.], seq 632417:633845, ack 1, win 4017, options [nop,nop,TS val 278799 ecr 64770,mptcp dss ack 3454339951 seq 446477432 subseq 632417 len 1428 csum 0xa668], length 1428
10:42:57.403490 IP 112.26.0.1.44877 > 112.26.0.8.44380: Flags [.], seq 633845:635273, ack 1, win 4017, options [nop,nop,TS val 278799 ecr 64770,mptcp dss ack 3454339951 seq 446478860 subseq 633845 len 1428 csum 0x34cc], length 1428
10:42:57.406524 IP 112.26.0.1.44877 > 112.26.0.8.44380: Flags [.], seq 633845:635273, ack 1, win 4017, options [nop,nop,TS val 278799 ecr 64770,mptcp dss ack 3454339951 seq 446478860 subseq 633845 len 1428 csum 0x34cc], length 1428
10:42:57.500510 IP 112.26.0.8.44380 > 112.26.0.1.44877: Flags [.], ack 613853, win 24543, options [nop,nop,TS val 65574 ecr 277556,nop,nop,sack 2 {625277:626705}{620993:623849},mptcp dss ack 446397464], length 0
10:42:57.527669 IP 112.26.0.1.44877 > 112.26.0.8.44380: Flags [.], seq 635273:636701, ack 1, win 4017, options [nop,nop,TS val 278799 ecr 64770,mptcp dss ack 3454339951 seq 446480288 subseq 635273 len 1428 csum 0x14da], length 1428
10:42:57.529522 IP 112.26.0.1.44877 > 112.26.0.8.44380: Flags [.], seq 635273:636701, ack 1, win 4017, options [nop,nop,TS val 278799 ecr 64770,mptcp dss ack 3454339951 seq 446480288 subseq 635273 len 1428 csum 0x14da], length 1428
10:42:57.605846 IP 112.26.0.1.44877 > 112.26.0.8.44380: Flags [.], seq 636701:638129, ack 1, win 4017, options [nop,nop,TS val 278876 ecr 64902,mptcp dss ack 3454339951 seq 446483144 subseq 636701 len 1428 csum 0x1896], length 1428
10:42:57.609101 IP 112.26.0.1.44877 > 112.26.0.8.44380: Flags [.], seq 636701:638129, ack 1, win 4017, options [nop,nop,TS val 278876 ecr 64902,mptcp dss ack 3454339951 seq 446483144 subseq 636701 len 1428 csum 0x1896], length 1428
10:42:57.674157 IP 112.26.0.1.44877 > 112.26.0.8.44380: Flags [.], seq 638129:639557, ack 1, win 4017, options [nop,nop,TS val 279109 ecr 65052,mptcp dss ack 3454339951 seq 446487428 subseq 638129 len 1428 csum 0x6450], length 1428
10:42:57.685495 IP 112.26.0.1.44877 > 112.26.0.8.44380: Flags [.], seq 638129:639557, ack 1, win 4017, options [nop,nop,TS val 279109 ecr 65052,mptcp dss ack 3454339951 seq 446487428 subseq 638129 len 1428 csum 0x6450], length 1428
10:42:57.746691 IP 112.26.0.1.44877 > 112.26.0.8.44380: Flags [.], seq 613853:615281, ack 1, win 4017, options [nop,nop,TS val 279185 ecr 65154,mptcp dss ack 3454339951 seq 446416028 subseq 613853 len 1428 csum 0x290a], length 1428
10:42:57.787969 IP 112.26.0.1.44877 > 112.26.0.8.44380: Flags [.], seq 613853:615281, ack 1, win 4017, options [nop,nop,TS val 279185 ecr 65154,mptcp dss ack 3454339951 seq 446416028 subseq 613853 len 1428 csum 0x290a], length 1428
10:42:57.831534 IP 112.26.0.8.44380 > 112.26.0.1.44877: Flags [.], ack 613853, win 24543, options [nop,nop,TS val 65892 ecr 277556,nop,nop,sack 2 {629561:630989}{625277:628133},mptcp dss ack 446397464], length 0
10:42:57.838529 IP 112.26.0.1.44877 > 112.26.0.8.44380: Flags [.], seq 619565:620993, ack 1, win 4017, options [nop,nop,TS val 279970 ecr 65892,mptcp dss ack 3454339951 seq 446423168 subseq 619565 len 1428 csum 0xc2bf], length 1428
10:42:57.899985 IP 112.26.0.8.44380 > 112.26.0.1.44877: Flags [.], ack 613853, win 24543, options [nop,nop,TS val 65992 ecr 277556,nop,nop,sack 2 {629561:632417}{625277:628133},mptcp dss ack 446397464], length 0
10:42:57.921627 IP 112.26.0.1.44877 > 112.26.0.8.44380: Flags [.], seq 623849:625277, ack 1, win 4017, options [nop,nop,TS val 279970 ecr 65892,mptcp dss ack 3454339951 seq 446437448 subseq 623849 len 1428 csum 0x4e08], length 1428
10:42:57.956943 IP 112.26.0.1.44877 > 112.26.0.8.44380: Flags [.], seq 616709:618137, ack 1, win 4017, options [nop,nop,TS val 279436 ecr 65389,mptcp dss ack 3454339951 seq 446420312 subseq 616709 len 1428 csum 0xabcb], length 1428
10:42:57.962841 IP 112.26.0.1.44877 > 112.26.0.8.44380: Flags [.], seq 616709:618137, ack 1, win 4017, options [nop,nop,TS val 279436 ecr 65389,mptcp dss ack 3454339951 seq 446420312 subseq 616709 len 1428 csum 0xabcb], length 1428
10:42:57.999102 IP 112.26.0.1.44877 > 112.26.0.8.44380: Flags [.], seq 628133:629561, ack 1, win 4017, options [nop,nop,TS val 280039 ecr 65992,mptcp dss ack 3454339951 seq 446457440 subseq 628133 len 1428 csum 0x4855], length 1428
10:42:58.057593 IP 112.26.0.8.44380 > 112.26.0.1.44877: Flags [.], ack 613853, win 24387, options [nop,nop,TS val 66122 ecr 277556,nop,nop,sack 2 {629561:633845}{625277:628133},mptcp dss ack 446407460], length 0
10:42:58.094019 IP 112.26.0.8.44380 > 112.26.0.1.44877: Flags [.], ack 613853, win 24387, options [nop,nop,TS val 66195 ecr 277556,nop,nop,sack 2 {629561:635273}{625277:628133},mptcp dss ack 446407460], length 0
10:42:58.096071 IP 112.26.0.1.44877 > 112.26.0.8.44380: Flags [.], seq 639557:640985, ack 1, win 4017, options [nop,nop,TS val 280233 ecr 66122,mptcp dss ack 3454339951 seq 446528840 subseq 639557 len 1428 csum 0xc46], length 1428
10:42:58.169480 IP 112.26.0.8.44380 > 112.26.0.1.44877: Flags [.], ack 613853, win 24254, options [nop,nop,TS val 66318 ecr 277556,nop,nop,sack 2 {629561:636701}{625277:628133},mptcp dss ack 446416028], length 0
10:42:58.186729 IP 112.26.0.1.44877 > 112.26.0.8.44380: Flags [.], seq 640985:642413, ack 1, win 4017, options [nop,nop,TS val 280243 ecr 66195,mptcp dss ack 3454339951 seq 446530268 subseq 640985 len 1428 csum 0x5b83], length 1428
10:42:58.223041 IP 112.26.0.8.44380 > 112.26.0.1.44877: Flags [.], ack 613853, win 24254, options [nop,nop,TS val 66398 ecr 277556,nop,nop,sack 2 {629561:638129}{625277:628133},mptcp dss ack 446416028], length 0
10:42:58.240056 IP 112.26.0.1.44877 > 112.26.0.8.44380: Flags [.], seq 642413:643841, ack 1, win 4017, options [nop,nop,TS val 280362 ecr 66318,mptcp dss ack 3454339951 seq 446538836 subseq 642413 len 1428 csum 0xe0], length 1428
10:42:58.284673 IP 112.26.0.8.44380 > 112.26.0.1.44877: Flags [.], ack 613853, win 24254, options [nop,nop,TS val 66474 ecr 277556,nop,nop,sack 2 {629561:639557}{625277:628133},mptcp dss ack 446416028], length 0
10:42:58.303928 IP 112.26.0.1.44877 > 112.26.0.8.44380: Flags [.], seq 643841:645269, ack 1, win 4017, options [nop,nop,TS val 280384 ecr 66398,mptcp dss ack 3454339951 seq 446540264 subseq 643841 len 1428 csum 0x5e06], length 1428
10:42:58.359343 IP 112.26.0.8.44380 > 112.26.0.1.44877: Flags [.], ack 616709, win 24188, options [nop,nop,TS val 66577 ecr 279185,nop,nop,sack 2 {629561:639557}{625277:628133},mptcp dss ack 446420312], length 0
10:42:58.376649 IP 112.26.0.1.44877 > 112.26.0.8.44380: Flags [.], seq 645269:646697, ack 1, win 4017, options [nop,nop,TS val 280449 ecr 66474,mptcp dss ack 3454339951 seq 446548832 subseq 645269 len 1428 csum 0x3590], length 1428
10:42:58.403460 IP 112.26.0.1.44877 > 112.26.0.8.44380: Flags [.], seq 619565:620993, ack 1, win 4017, options [nop,nop,TS val 279970 ecr 65892,mptcp dss ack 3454339951 seq 446423168 subseq 619565 len 1428 csum 0xc2bf], length 1428
10:42:58.406239 IP 112.26.0.1.44877 > 112.26.0.8.44380: Flags [.], seq 619565:620993, ack 1, win 4017, options [nop,nop,TS val 279970 ecr 65892,mptcp dss ack 3454339951 seq 446423168 subseq 619565 len 1428 csum 0xc2bf], length 1428
10:42:58.462435 IP 112.26.0.1.44877 > 112.26.0.8.44380: Flags [.], seq 646697:648125, ack 1, win 4017, options [nop,nop,TS val 280498 ecr 66577,mptcp dss ack 3454339951 seq 446551688 subseq 646697 len 1428 csum 0x4a53], length 1428
10:42:58.498551 IP 112.26.0.1.44877 > 112.26.0.8.44380: Flags [.], seq 623849:625277, ack 1, win 4017, options [nop,nop,TS val 279970 ecr 65892,mptcp dss ack 3454339951 seq 446437448 subseq 623849 len 1428 csum 0x4e08], length 1428
10:42:58.500991 IP 112.26.0.1.44877 > 112.26.0.8.44380: Flags [.], seq 623849:625277, ack 1, win 4017, options [nop,nop,TS val 279970 ecr 65892,mptcp dss ack 3454339951 seq 446437448 subseq 623849 len 1428 csum 0x4e08], length 1428
10:42:58.527579 IP 112.26.0.1.44877 > 112.26.0.8.44380: Flags [.], seq 648125:649553, ack 1, win 4017, options [nop,nop,TS val 280498 ecr 66577,mptcp dss ack 3454339951 seq 446553116 subseq 648125 len 1428 csum 0xe053], length 1428
10:42:58.613931 IP 112.26.0.8.44380 > 112.26.0.1.44877: Flags [.], ack 619565, win 24144, options [nop,nop,TS val 66752 ecr 279436,nop,nop,sack 2 {629561:639557}{625277:628133},mptcp dss ack 446423168], length 0
10:42:58.616851 IP 112.26.0.1.44877 > 112.26.0.8.44380: Flags [.], seq 649553:650981, ack 1, win 4017, options [nop,nop,TS val 280752 ecr 66752,mptcp dss ack 3454339951 seq 446560256 subseq 649553 len 1428 csum 0xbf67], length 1428
10:42:58.681844 IP 112.26.0.1.44877 > 112.26.0.8.44380: Flags [.], seq 628133:629561, ack 1, win 4017, options [nop,nop,TS val 280039 ecr 65992,mptcp dss ack 3454339951 seq 446457440 subseq 628133 len 1428 csum 0x4855], length 1428
10:42:58.684699 IP 112.26.0.1.44877 > 112.26.0.8.44380: Flags [.], seq 628133:629561, ack 1, win 4017, options [nop,nop,TS val 280039 ecr 65992,mptcp dss ack 3454339951 seq 446457440 subseq 628133 len 1428 csum 0x4855], length 1428
10:42:58.787245 IP 112.26.0.1.44877 > 112.26.0.8.44380: Flags [.], seq 639557:640985, ack 1, win 4017, options [nop,nop,TS val 280233 ecr 66122,mptcp dss ack 3454339951 seq 446528840 subseq 639557 len 1428 csum 0xc46], length 1428
10:42:58.790266 IP 112.26.0.1.44877 > 112.26.0.8.44380: Flags [.], seq 639557:640985, ack 1, win 4017, options [nop,nop,TS val 280233 ecr 66122,mptcp dss ack 3454339951 seq 446528840 subseq 639557 len 1428 csum 0xc46], length 1428
10:42:58.859668 IP 112.26.0.1.44877 > 112.26.0.8.44380: Flags [.], seq 640985:642413, ack 1, win 4017, options [nop,nop,TS val 280243 ecr 66195,mptcp dss ack 3454339951 seq 446530268 subseq 640985 len 1428 csum 0x5b83], length 1428
10:42:58.891316 IP 112.26.0.1.44877 > 112.26.0.8.44380: Flags [.], seq 640985:642413, ack 1, win 4017, options [nop,nop,TS val 280243 ecr 66195,mptcp dss ack 3454339951 seq 446530268 subseq 640985 len 1428 csum 0x5b83], length 1428
10:42:58.968516 IP 112.26.0.1.44877 > 112.26.0.8.44380: Flags [.], seq 643841:645269, ack 1, win 4017, options [nop,nop,TS val 280384 ecr 66398,mptcp dss ack 3454339951 seq 446540264 subseq 643841 len 1428 csum 0x5e06], length 1428
10:42:58.970769 IP 112.26.0.1.44877 > 112.26.0.8.44380: Flags [.], seq 643841:645269, ack 1, win 4017, options [nop,nop,TS val 280384 ecr 66398,mptcp dss ack 3454339951 seq 446540264 subseq 643841 len 1428 csum 0x5e06], length 1428
10:42:59.045872 IP 112.26.0.1.44877 > 112.26.0.8.44380: Flags [.], seq 645269:646697, ack 1, win 4017, options [nop,nop,TS val 280449 ecr 66474,mptcp dss ack 3454339951 seq 446548832 subseq 645269 len 1428 csum 0x3590], length 1428
10:42:59.050969 IP 112.26.0.1.44877 > 112.26.0.8.44380: Flags [.], seq 645269:646697, ack 1, win 4017, options [nop,nop,TS val 280449 ecr 66474,mptcp dss ack 3454339951 seq 446548832 subseq 645269 len 1428 csum 0x3590], length 1428
10:42:59.110452 IP 112.26.0.8.44380 > 112.26.0.1.44877: Flags [.], ack 623849, win 23921, options [nop,nop,TS val 67194 ecr 279970,nop,nop,sack 2 {629561:639557}{625277:628133},mptcp dss ack 446437448], length 0
10:42:59.116340 IP 112.26.0.1.44877 > 112.26.0.8.44380: Flags [.], seq 650981:652409, ack 1, win 4017, options [nop,nop,TS val 281249 ecr 67194,mptcp dss ack 3454339951 seq 446593100 subseq 650981 len 1428 csum 0x2ae2], length 1428
10:42:59.167302 IP 112.26.0.1.44877 > 112.26.0.8.44380: Flags [.], seq 648125:649553, ack 1, win 4017, options [nop,nop,TS val 280498 ecr 66577,mptcp dss ack 3454339951 seq 446553116 subseq 648125 len 1428 csum 0xe053], length 1428
10:42:59.177635 IP 112.26.0.1.44877 > 112.26.0.8.44380: Flags [.], seq 648125:649553, ack 1, win 4017, options [nop,nop,TS val 280498 ecr 66577,mptcp dss ack 3454339951 seq 446553116 subseq 648125 len 1428 csum 0xe053], length 1428
10:42:59.269931 IP 112.26.0.1.44877 > 112.26.0.8.44380: Flags [.], seq 649553:650981, ack 1, win 4017, options [nop,nop,TS val 280752 ecr 66752,mptcp dss ack 3454339951 seq 446560256 subseq 649553 len 1428 csum 0xbf67], length 1428
10:42:59.272347 IP 112.26.0.1.44877 > 112.26.0.8.44380: Flags [.], seq 649553:650981, ack 1, win 4017, options [nop,nop,TS val 280752 ecr 66752,mptcp dss ack 3454339951 seq 446560256 subseq 649553 len 1428 csum 0xbf67], length 1428
10:42:59.327074 IP 112.26.0.8.44380 > 112.26.0.1.44877: Flags [.], ack 639557, win 23802, options [nop,nop,TS val 67473 ecr 280039,mptcp dss ack 446515988], length 0
10:42:59.329430 IP 112.26.0.1.44877 > 112.26.0.8.44380: Flags [.], seq 652409:653837, ack 1, win 4017, options [nop,nop,TS val 281465 ecr 67473,mptcp dss ack 3454339951 seq 446603096 subseq 652409 len 1428 csum 0x2ae7], length 1428
10:42:59.365145 IP 112.26.0.8.44380 > 112.26.0.1.44877: Flags [.], ack 640985, win 24429, options [nop,nop,TS val 67579 ecr 280233,mptcp dss ack 446515988], length 0
10:42:59.396164 IP 112.26.0.1.44877 > 112.26.0.8.44380: Flags [.], seq 653837:655265, ack 1, win 4017, options [nop,nop,TS val 281465 ecr 67473,mptcp dss ack 3454339951 seq 446604524 subseq 653837 len 1428 csum 0xff79], length 1428
10:42:59.423455 IP 112.26.0.8.44380 > 112.26.0.1.44877: Flags [.], ack 642413, win 24429, options [nop,nop,TS val 67680 ecr 280243,mptcp dss ack 446515988], length 0
10:42:59.458950 IP 112.26.0.1.44877 > 112.26.0.8.44380: Flags [.], seq 655265:656693, ack 1, win 4017, options [nop,nop,TS val 281465 ecr 67473,mptcp dss ack 3454339951 seq 446605952 subseq 655265 len 1428 csum 0xc84c], length 1428
10:42:59.482020 IP 112.26.0.8.44380 > 112.26.0.1.44877: Flags [.], ack 642413, win 24429, options [nop,nop,TS val 67759 ecr 280243,nop,nop,sack 1 {643841:645269},mptcp dss ack 446515988], length 0
10:42:59.516355 IP 112.26.0.1.44877 > 112.26.0.8.44380: Flags [.], seq 656693:658121, ack 1, win 4017, options [nop,nop,TS val 281503 ecr 67579,mptcp dss ack 3454339951 seq 446608808 subseq 656693 len 1428 csum 0xe2c8], length 1428
10:42:59.563327 IP 112.26.0.8.44380 > 112.26.0.1.44877: Flags [.], ack 642413, win 24429, options [nop,nop,TS val 67837 ecr 280243,nop,nop,sack 1 {643841:646697},mptcp dss ack 446515988], length 0
10:42:59.573674 IP 112.26.0.1.44877 > 112.26.0.8.44380: Flags [.], seq 658121:659549, ack 1, win 4017, options [nop,nop,TS val 281562 ecr 67680,mptcp dss ack 3454339951 seq 446614520 subseq 658121 len 1428 csum 0x149d], length 1428
10:42:59.612784 IP 112.26.0.1.44877 > 112.26.0.8.44380: Flags [.], seq 650981:652409, ack 1, win 4017, options [nop,nop,TS val 281249 ecr 67194,mptcp dss ack 3454339951 seq 446593100 subseq 650981 len 1428 csum 0x2ae2], length 1428
10:42:59.616959 IP 112.26.0.1.44877 > 112.26.0.8.44380: Flags [.], seq 650981:652409, ack 1, win 4017, options [nop,nop,TS val 281249 ecr 67194,mptcp dss ack 3454339951 seq 446593100 subseq 650981 len 1428 csum 0x2ae2], length 1428
10:42:59.667319 IP 112.26.0.1.44877 > 112.26.0.8.44380: Flags [.], seq 659549:660977, ack 1, win 4017, options [nop,nop,TS val 281562 ecr 67680,mptcp dss ack 3454339951 seq 446615948 subseq 659549 len 1428 csum 0x1f1d], length 1428
10:42:59.694957 IP 112.26.0.8.44380 > 112.26.0.1.44877: Flags [.], ack 642413, win 24429, options [nop,nop,TS val 67959 ecr 280243,nop,nop,sack 2 {648125:649553}{643841:646697},mptcp dss ack 446515988], length 0
10:42:59.723925 IP 112.26.0.1.44877 > 112.26.0.8.44380: Flags [.], seq 660977:662405, ack 1, win 4017, options [nop,nop,TS val 281701 ecr 67759,mptcp dss ack 3454339951 seq 446617376 subseq 660977 len 1428 csum 0xe1c4], length 1428
10:42:59.752187 IP 112.26.0.8.44380 > 112.26.0.1.44877: Flags [.], ack 642413, win 24429, options [nop,nop,TS val 68061 ecr 280243,nop,nop,sack 2 {648125:650981}{643841:646697},mptcp dss ack 446515988], length 0
10:42:59.816934 IP 112.26.0.1.44877 > 112.26.0.8.44380: Flags [.], seq 662405:663833, ack 1, win 4017, options [nop,nop,TS val 281725 ecr 67837,mptcp dss ack 3454339951 seq 446618804 subseq 662405 len 1428 csum 0xfe2f], length 1428
10:42:59.831093 IP 112.26.0.1.44877 > 112.26.0.8.44380: Flags [.], seq 652409:653837, ack 1, win 4017, options [nop,nop,TS val 281465 ecr 67473,mptcp dss ack 3454339951 seq 446603096 subseq 652409 len 1428 csum 0x2ae7], length 1428
