10:42:02.478201 IP 112.26.3.8.42387 > 112.26.3.1.44877: Flags [S], seq 3404096348, win 65535, options [mss 1460,sackOK,TS val 11180 ecr 0,nop,wscale 6,mptcp join id 6 token 0x187b1b60 nonce 0x63255531], length 0
10:42:02.529183 IP 112.26.3.8.42387 > 112.26.3.1.44877: Flags [S], seq 3404096348, win 65535, options [mss 1460,sackOK,TS val 11180 ecr 0,nop,wscale 6,mptcp join id 6 token 0x187b1b60 nonce 0x63255531], length 0
10:42:02.563762 IP 112.26.3.1.44877 > 112.26.3.8.42387: Flags [S.], seq 3834564252, ack 3404096349, win 65535, options [mss 1460,sackOK,TS val 224668 ecr 11180,nop,wscale 6,mptcp join id 5 hmac 0xcb2ba0bbb54b93af nonce 0x6a8a083b], length 0
10:42:02.678502 IP 112.26.3.1.44877 > 112.26.3.8.42387: Flags [S.], seq 3834564252, ack 3404096349, win 65535, options [mss 1460,sackOK,TS val 224668 ecr 11180,nop,wscale 6,mptcp join id 5 hmac 0xcb2ba0bbb54b93af nonce 0x6a8a083b], length 0
10:42:02.719776 IP 112.26.3.1.44877 > 112.26.3.8.42387: Flags [S.], seq 3834564252, ack 3404096349, win 65535, options [mss 1460,sackOK,TS val 224668 ecr 11180,nop,wscale 6,mptcp join id 5 hmac 0xcb2ba0bbb54b93af nonce 0x6a8a083b], length 0
10:42:02.796604 IP 112.26.3.8.42387 > 112.26.3.1.44877: Flags [.], ack 1, win 7072, options [nop,nop,TS val 11508 ecr 224668,mptcp join hmac 0x6751ff0d8d5836226ca8bca04d26c0f7c656fb92], length 0
10:42:02.800080 IP 112.26.3.8.42387 > 112.26.3.1.44877: Flags [.], ack 1, win 7072, options [nop,nop,TS val 11508 ecr 224668,mptcp join hmac 0x6751ff0d8d5836226ca8bca04d26c0f7c656fb92], length 0
10:42:38.675409 IP 112.26.3.1.44877 > 112.26.3.8.42387: Flags [.], seq 402697:404125, ack 1, win 4017, options [nop,nop,TS val 260509 ecr 46984,mptcp dss ack 3454339951 seq 445710596 subseq 402697 len 1428 csum 0x15a8], length 1428
10:42:38.675716 IP 112.26.3.1.44877 > 112.26.3.8.42387: Flags [.], seq 402697:404125, ack 1, win 4017, options [nop,nop,TS val 260509 ecr 46984,mptcp dss ack 3454339951 seq 445710596 subseq 402697 len 1428 csum 0x15a8], length 1428
10:42:38.719050 IP 112.26.3.1.44877 > 112.26.3.8.42387: Flags [.], seq 399841:401269, ack 1, win 4017, options [nop,nop,TS val 260422 ecr 46734,mptcp dss ack 3454339951 seq 445697744 subseq 399841 len 1428 csum 0xaae1], length 1428
10:42:38.726159 IP 112.26.3.1.44877 > 112.26.3.8.42387: Flags [.], seq 404125:405553, ack 1, win 4017, options [nop,nop,TS val 260509 ecr 46984,mptcp dss ack 3454339951 seq 445712024 subseq 404125 len 1428 csum 0x562d], length 1428
10:42:38.726451 IP 112.26.3.1.44877 > 112.26.3.8.42387: Flags [.], seq 404125:405553, ack 1, win 4017, options [nop,nop,TS val 260509 ecr 46984,mptcp dss ack 3454339951 seq 445712024 subseq 404125 len 1428 csum 0x562d], length 1428
10:42:38.775869 IP 112.26.3.8.42387 > 112.26.3.1.44877: Flags [.], ack 396985, win 24540, options [nop,nop,TS val 47328 ecr 260001,mptcp dss ack 445604924], length 0
10:42:38.777550 IP 112.26.3.8.42387 > 112.26.3.1.44877: Flags [.], ack 396985, win 24540, options [nop,nop,TS val 47328 ecr 260001,mptcp dss ack 445604924], length 0
10:42:38.826642 IP 112.26.3.1.44877 > 112.26.3.8.42387: Flags [.], seq 405553:406981, ack 1, win 4017, options [nop,nop,TS val 260916 ecr 47328,mptcp dss ack 3454339951 seq 445724876 subseq 405553 len 1428 csum 0x2d07], length 1428
10:42:38.826928 IP 112.26.3.1.44877 > 112.26.3.8.42387: Flags [.], seq 405553:406981, ack 1, win 4017, options [nop,nop,TS val 260916 ecr 47328,mptcp dss ack 3454339951 seq 445724876 subseq 405553 len 1428 csum 0x2d07], length 1428
10:42:38.847028 IP 112.26.3.1.44877 > 112.26.3.8.42387: Flags [.], seq 401269:402697, ack 1, win 4017, options [nop,nop,TS val 260422 ecr 46734,mptcp dss ack 3454339951 seq 445699172 subseq 401269 len 1428 csum 0x7762], length 1428
10:42:38.881102 IP 112.26.3.1.44877 > 112.26.3.8.42387: Flags [.], seq 406981:408409, ack 1, win 4017, options [nop,nop,TS val 260916 ecr 47328,mptcp dss ack 3454339951 seq 445726304 subseq 406981 len 1428 csum 0x9e83], length 1428
10:42:38.881398 IP 112.26.3.1.44877 > 112.26.3.8.42387: Flags [.], seq 406981:408409, ack 1, win 4017, options [nop,nop,TS val 260916 ecr 47328,mptcp dss ack 3454339951 seq 445726304 subseq 406981 len 1428 csum 0x9e83], length 1428
10:42:38.897249 IP 112.26.3.1.44877 > 112.26.3.8.42387: Flags [.], seq 402697:404125, ack 1, win 4017, options [nop,nop,TS val 260509 ecr 46984,mptcp dss ack 3454339951 seq 445710596 subseq 402697 len 1428 csum 0x15a8], length 1428
10:42:38.952882 IP 112.26.3.1.44877 > 112.26.3.8.42387: Flags [.], seq 408409:409837, ack 1, win 4017, options [nop,nop,TS val 260916 ecr 47328,mptcp dss ack 3454339951 seq 445727732 subseq 408409 len 1428 csum 0x44d9], length 1428
10:42:38.953132 IP 112.26.3.1.44877 > 112.26.3.8.42387: Flags [.], seq 408409:409837, ack 1, win 4017, options [nop,nop,TS val 260916 ecr 47328,mptcp dss ack 3454339951 seq 445727732 subseq 408409 len 1428 csum 0x44d9], length 1428
10:42:38.969379 IP 112.26.3.1.44877 > 112.26.3.8.42387: Flags [.], seq 404125:405553, ack 1, win 4017, options [nop,nop,TS val 260509 ecr 46984,mptcp dss ack 3454339951 seq 445712024 subseq 404125 len 1428 csum 0x562d], length 1428
10:42:39.010912 IP 112.26.3.1.44877 > 112.26.3.8.42387: Flags [.], seq 409837:411265, ack 1, win 4017, options [nop,nop,TS val 260916 ecr 47328,mptcp dss ack 3454339951 seq 445729160 subseq 409837 len 1428 csum 0x6b51], length 1428
10:42:39.011203 IP 112.26.3.1.44877 > 112.26.3.8.42387: Flags [.], seq 409837:411265, ack 1, win 4017, options [nop,nop,TS val 260916 ecr 47328,mptcp dss ack 3454339951 seq 445729160 subseq 409837 len 1428 csum 0x6b51], length 1428
10:42:39.017590 IP 112.26.3.8.42387 > 112.26.3.1.44877: Flags [.], ack 401269, win 24311, options [nop,nop,TS val 47608 ecr 260422,mptcp dss ack 445659188], length 0
10:42:39.022086 IP 112.26.3.8.42387 > 112.26.3.1.44877: Flags [.], ack 401269, win 24311, options [nop,nop,TS val 47608 ecr 260422,mptcp dss ack 445659188], length 0
10:42:39.090604 IP 112.26.3.1.44877 > 112.26.3.8.42387: Flags [.], seq 405553:406981, ack 1, win 4017, options [nop,nop,TS val 260916 ecr 47328,mptcp dss ack 3454339951 seq 445724876 subseq 405553 len 1428 csum 0x2d07], length 1428
10:42:39.106362 IP 112.26.3.1.44877 > 112.26.3.8.42387: Flags [.], seq 411265:412693, ack 1, win 4017, options [nop,nop,TS val 260916 ecr 47328,mptcp dss ack 3454339951 seq 445730588 subseq 411265 len 1428 csum 0x88c], length 1428
10:42:39.106623 IP 112.26.3.1.44877 > 112.26.3.8.42387: Flags [.], seq 411265:412693, ack 1, win 4017, options [nop,nop,TS val 260916 ecr 47328,mptcp dss ack 3454339951 seq 445730588 subseq 411265 len 1428 csum 0x88c], length 1428
10:42:39.142241 IP 112.26.3.1.44877 > 112.26.3.8.42387: Flags [.], seq 406981:408409, ack 1, win 4017, options [nop,nop,TS val 260916 ecr 47328,mptcp dss ack 3454339951 seq 445726304 subseq 406981 len 1428 csum 0x9e83], length 1428
10:42:39.155944 IP 112.26.3.1.44877 > 112.26.3.8.42387: Flags [.], seq 412693:414121, ack 1, win 4017, options [nop,nop,TS val 261161 ecr 47608,mptcp dss ack 3454339951 seq 445740584 subseq 412693 len 1428 csum 0xb5a], length 1428
10:42:39.156232 IP 112.26.3.1.44877 > 112.26.3.8.42387: Flags [.], seq 412693:414121, ack 1, win 4017, options [nop,nop,TS val 261161 ecr 47608,mptcp dss ack 3454339951 seq 445740584 subseq 412693 len 1428 csum 0xb5a], length 1428
10:42:39.224568 IP 112.26.3.1.44877 > 112.26.3.8.42387: Flags [.], seq 408409:409837, ack 1, win 4017, options [nop,nop,TS val 260916 ecr 47328,mptcp dss ack 3454339951 seq 445727732 subseq 408409 len 1428 csum 0x44d9], length 1428
10:42:39.250295 IP 112.26.3.1.44877 > 112.26.3.8.42387: Flags [.], seq 414121:415549, ack 1, win 4017, options [nop,nop,TS val 261161 ecr 47608,mptcp dss ack 3454339951 seq 445742012 subseq 414121 len 1428 csum 0x2196], length 1428
10:42:39.250596 IP 112.26.3.1.44877 > 112.26.3.8.42387: Flags [.], seq 414121:415549, ack 1, win 4017, options [nop,nop,TS val 261161 ecr 47608,mptcp dss ack 3454339951 seq 445742012 subseq 414121 len 1428 csum 0x2196], length 1428
10:42:39.318445 IP 112.26.3.8.42387 > 112.26.3.1.44877: Flags [.], ack 406981, win 24311, options [nop,nop,TS val 47875 ecr 260422,mptcp dss ack 445659188], length 0
10:42:39.322331 IP 112.26.3.8.42387 > 112.26.3.1.44877: Flags [.], ack 406981, win 24311, options [nop,nop,TS val 47875 ecr 260422,mptcp dss ack 445659188], length 0
10:42:39.358443 IP 112.26.3.1.44877 > 112.26.3.8.42387: Flags [.], seq 415549:416977, ack 1, win 4017, options [nop,nop,TS val 261161 ecr 47608,mptcp dss ack 3454339951 seq 445743440 subseq 415549 len 1428 csum 0xf46d], length 1428
10:42:39.358760 IP 112.26.3.1.44877 > 112.26.3.8.42387: Flags [.], seq 415549:416977, ack 1, win 4017, options [nop,nop,TS val 261161 ecr 47608,mptcp dss ack 3454339951 seq 445743440 subseq 415549 len 1428 csum 0xf46d], length 1428
10:42:39.435480 IP 112.26.3.1.44877 > 112.26.3.8.42387: Flags [.], seq 409837:411265, ack 1, win 4017, options [nop,nop,TS val 260916 ecr 47328,mptcp dss ack 3454339951 seq 445729160 subseq 409837 len 1428 csum 0x6b51], length 1428
10:42:39.454626 IP 112.26.3.1.44877 > 112.26.3.8.42387: Flags [.], seq 416977:418405, ack 1, win 4017, options [nop,nop,TS val 261161 ecr 47608,mptcp dss ack 3454339951 seq 445744868 subseq 416977 len 1428 csum 0xa113], length 1428
10:42:39.454915 IP 112.26.3.1.44877 > 112.26.3.8.42387: Flags [.], seq 416977:418405, ack 1, win 4017, options [nop,nop,TS val 261161 ecr 47608,mptcp dss ack 3454339951 seq 445744868 subseq 416977 len 1428 csum 0xa113], length 1428
10:42:39.550096 IP 112.26.3.1.44877 > 112.26.3.8.42387: Flags [.], seq 411265:412693, ack 1, win 4017, options [nop,nop,TS val 260916 ecr 47328,mptcp dss ack 3454339951 seq 445730588 subseq 411265 len 1428 csum 0x88c], length 1428
10:42:39.554367 IP 112.26.3.1.44877 > 112.26.3.8.42387: Flags [.], seq 418405:419833, ack 1, win 4017, options [nop,nop,TS val 261161 ecr 47608,mptcp dss ack 3454339951 seq 445746296 subseq 418405 len 1428 csum 0xa31b], length 1428
10:42:39.554635 IP 112.26.3.1.44877 > 112.26.3.8.42387: Flags [.], seq 418405:419833, ack 1, win 4017, options [nop,nop,TS val 261161 ecr 47608,mptcp dss ack 3454339951 seq 445746296 subseq 418405 len 1428 csum 0xa31b], length 1428
10:42:39.557637 IP 112.26.3.1.44877 > 112.26.3.8.42387: Flags [.], seq 419833:421261, ack 1, win 4017, options [nop,nop,TS val 261461 ecr 47875,mptcp dss ack 3454339951 seq 445756292 subseq 419833 len 1428 csum 0x1790], length 1428
10:42:39.557927 IP 112.26.3.1.44877 > 112.26.3.8.42387: Flags [.], seq 419833:421261, ack 1, win 4017, options [nop,nop,TS val 261461 ecr 47875,mptcp dss ack 3454339951 seq 445756292 subseq 419833 len 1428 csum 0x1790], length 1428
10:42:39.586287 IP 112.26.3.1.44877 > 112.26.3.8.42387: Flags [.], seq 412693:414121, ack 1, win 4017, options [nop,nop,TS val 261161 ecr 47608,mptcp dss ack 3454339951 seq 445740584 subseq 412693 len 1428 csum 0xb5a], length 1428
10:42:39.642094 IP 112.26.3.1.44877 > 112.26.3.8.42387: Flags [.], seq 421261:422689, ack 1, win 4017, options [nop,nop,TS val 261461 ecr 47875,mptcp dss ack 3454339951 seq 445757720 subseq 421261 len 1428 csum 0x49ff], length 1428
10:42:39.642388 IP 112.26.3.1.44877 > 112.26.3.8.42387: Flags [.], seq 421261:422689, ack 1, win 4017, options [nop,nop,TS val 261461 ecr 47875,mptcp dss ack 3454339951 seq 445757720 subseq 421261 len 1428 csum 0x49ff], length 1428
10:42:39.664231 IP 112.26.3.8.42387 > 112.26.3.1.44877: Flags [.], ack 409837, win 24311, options [nop,nop,TS val 48096 ecr 260916,mptcp dss ack 445659188], length 0
10:42:39.665877 IP 112.26.3.8.42387 > 112.26.3.1.44877: Flags [.], ack 409837, win 24311, options [nop,nop,TS val 48096 ecr 260916,mptcp dss ack 445659188], length 0
10:42:39.719629 IP 112.26.3.1.44877 > 112.26.3.8.42387: Flags [.], seq 414121:415549, ack 1, win 4017, options [nop,nop,TS val 261161 ecr 47608,mptcp dss ack 3454339951 seq 445742012 subseq 414121 len 1428 csum 0x2196], length 1428
10:42:39.729772 IP 112.26.3.1.44877 > 112.26.3.8.42387: Flags [.], seq 422689:424117, ack 1, win 4017, options [nop,nop,TS val 261461 ecr 47875,mptcp dss ack 3454339951 seq 445759148 subseq 422689 len 1428 csum 0x9714], length 1428
10:42:39.730062 IP 112.26.3.1.44877 > 112.26.3.8.42387: Flags [.], seq 422689:424117, ack 1, win 4017, options [nop,nop,TS val 261461 ecr 47875,mptcp dss ack 3454339951 seq 445759148 subseq 422689 len 1428 csum 0x9714], length 1428
10:42:39.798320 IP 112.26.3.1.44877 > 112.26.3.8.42387: Flags [.], seq 415549:416977, ack 1, win 4017, options [nop,nop,TS val 261161 ecr 47608,mptcp dss ack 3454339951 seq 445743440 subseq 415549 len 1428 csum 0xf46d], length 1428
10:42:39.819644 IP 112.26.3.1.44877 > 112.26.3.8.42387: Flags [.], seq 424117:425545, ack 1, win 4017, options [nop,nop,TS val 261461 ecr 47875,mptcp dss ack 3454339951 seq 445760576 subseq 424117 len 1428 csum 0xd325], length 1428
10:42:39.819938 IP 112.26.3.1.44877 > 112.26.3.8.42387: Flags [.], seq 424117:425545, ack 1, win 4017, options [nop,nop,TS val 261461 ecr 47875,mptcp dss ack 3454339951 seq 445760576 subseq 424117 len 1428 csum 0xd325], length 1428
10:42:39.855900 IP 112.26.3.1.44877 > 112.26.3.8.42387: Flags [.], seq 416977:418405, ack 1, win 4017, options [nop,nop,TS val 261161 ecr 47608,mptcp dss ack 3454339951 seq 445744868 subseq 416977 len 1428 csum 0xa113], length 1428
10:42:39.883840 IP 112.26.3.1.44877 > 112.26.3.8.42387: Flags [.], seq 425545:426973, ack 1, win 4017, options [nop,nop,TS val 261804 ecr 48096,mptcp dss ack 3454339951 seq 445764860 subseq 425545 len 1428 csum 0x54e8], length 1428
10:42:39.884123 IP 112.26.3.1.44877 > 112.26.3.8.42387: Flags [.], seq 425545:426973, ack 1, win 4017, options [nop,nop,TS val 261804 ecr 48096,mptcp dss ack 3454339951 seq 445764860 subseq 425545 len 1428 csum 0x54e8], length 1428
10:42:39.915982 IP 112.26.3.1.44877 > 112.26.3.8.42387: Flags [.], seq 418405:419833, ack 1, win 4017, options [nop,nop,TS val 261161 ecr 47608,mptcp dss ack 3454339951 seq 445746296 subseq 418405 len 1428 csum 0xa31b], length 1428
10:42:39.974851 IP 112.26.3.1.44877 > 112.26.3.8.42387: Flags [.], seq 419833:421261, ack 1, win 4017, options [nop,nop,TS val 261461 ecr 47875,mptcp dss ack 3454339951 seq 445756292 subseq 419833 len 1428 csum 0x1790], length 1428
10:42:39.984412 IP 112.26.3.1.44877 > 112.26.3.8.42387: Flags [.], seq 426973:428401, ack 1, win 4017, options [nop,nop,TS val 261804 ecr 48096,mptcp dss ack 3454339951 seq 445766288 subseq 426973 len 1428 csum 0x658a], length 1428
10:42:39.984719 IP 112.26.3.1.44877 > 112.26.3.8.42387: Flags [.], seq 426973:428401, ack 1, win 4017, options [nop,nop,TS val 261804 ecr 48096,mptcp dss ack 3454339951 seq 445766288 subseq 426973 len 1428 csum 0x658a], length 1428
10:42:40.063924 IP 112.26.3.8.42387 > 112.26.3.1.44877: Flags [.], ack 415549, win 24311, options [nop,nop,TS val 48508 ecr 260916,mptcp dss ack 445659188], length 0
10:42:40.065138 IP 112.26.3.8.42387 > 112.26.3.1.44877: Flags [.], ack 415549, win 24311, options [nop,nop,TS val 48508 ecr 260916,mptcp dss ack 445659188], length 0
10:42:40.084024 IP 112.26.3.1.44877 > 112.26.3.8.42387: Flags [.], seq 428401:429829, ack 1, win 4017, options [nop,nop,TS val 261804 ecr 48096,mptcp dss ack 3454339951 seq 445767716 subseq 428401 len 1428 csum 0x7aac], length 1428
10:42:40.084322 IP 112.26.3.1.44877 > 112.26.3.8.42387: Flags [.], seq 428401:429829, ack 1, win 4017, options [nop,nop,TS val 261804 ecr 48096,mptcp dss ack 3454339951 seq 445767716 subseq 428401 len 1428 csum 0x7aac], length 1428
10:42:40.191814 IP 112.26.3.1.44877 > 112.26.3.8.42387: Flags [.], seq 429829:431257, ack 1, win 4017, options [nop,nop,TS val 262203 ecr 48508,mptcp dss ack 3454339951 seq 445787708 subseq 429829 len 1428 csum 0xdfd0], length 1428
10:42:40.192117 IP 112.26.3.1.44877 > 112.26.3.8.42387: Flags [.], seq 429829:431257, ack 1, win 4017, options [nop,nop,TS val 262203 ecr 48508,mptcp dss ack 3454339951 seq 445787708 subseq 429829 len 1428 csum 0xdfd0], length 1428
10:42:40.233733 IP 112.26.3.1.44877 > 112.26.3.8.42387: Flags [.], seq 421261:422689, ack 1, win 4017, options [nop,nop,TS val 261461 ecr 47875,mptcp dss ack 3454339951 seq 445757720 subseq 421261 len 1428 csum 0x49ff], length 1428
10:42:40.244173 IP 112.26.3.1.44877 > 112.26.3.8.42387: Flags [.], seq 431257:432685, ack 1, win 4017, options [nop,nop,TS val 262203 ecr 48508,mptcp dss ack 3454339951 seq 445789136 subseq 431257 len 1428 csum 0xa12d], length 1428
10:42:40.244459 IP 112.26.3.1.44877 > 112.26.3.8.42387: Flags [.], seq 431257:432685, ack 1, win 4017, options [nop,nop,TS val 262203 ecr 48508,mptcp dss ack 3454339951 seq 445789136 subseq 431257 len 1428 csum 0xa12d], length 1428
10:42:40.263339 IP 112.26.3.1.44877 > 112.26.3.8.42387: Flags [.], seq 422689:424117, ack 1, win 4017, options [nop,nop,TS val 261461 ecr 47875,mptcp dss ack 3454339951 seq 445759148 subseq 422689 len 1428 csum 0x9714], length 1428
10:42:40.301911 IP 112.26.3.1.44877 > 112.26.3.8.42387: Flags [.], seq 432685:434113, ack 1, win 4017, options [nop,nop,TS val 262203 ecr 48508,mptcp dss ack 3454339951 seq 445790564 subseq 432685 len 1428 csum 0x2a3d], length 1428
10:42:40.302198 IP 112.26.3.1.44877 > 112.26.3.8.42387: Flags [.], seq 432685:434113, ack 1, win 4017, options [nop,nop,TS val 262203 ecr 48508,mptcp dss ack 3454339951 seq 445790564 subseq 432685 len 1428 csum 0x2a3d], length 1428
10:42:40.316641 IP 112.26.3.8.42387 > 112.26.3.1.44877: Flags [.], ack 418405, win 23613, options [nop,nop,TS val 48655 ecr 261161,mptcp dss ack 445734872], length 0
10:42:40.319792 IP 112.26.3.8.42387 > 112.26.3.1.44877: Flags [.], ack 418405, win 23613, options [nop,nop,TS val 48655 ecr 261161,mptcp dss ack 445734872], length 0
10:42:40.371339 IP 112.26.3.1.44877 > 112.26.3.8.42387: Flags [.], seq 434113:435541, ack 1, win 4017, options [nop,nop,TS val 262203 ecr 48508,mptcp dss ack 3454339951 seq 445791992 subseq 434113 len 1428 csum 0x2b6c], length 1428
10:42:40.371664 IP 112.26.3.1.44877 > 112.26.3.8.42387: Flags [.], seq 434113:435541, ack 1, win 4017, options [nop,nop,TS val 262203 ecr 48508,mptcp dss ack 3454339951 seq 445791992 subseq 434113 len 1428 csum 0x2b6c], length 1428
10:42:40.407373 IP 112.26.3.1.44877 > 112.26.3.8.42387: Flags [.], seq 424117:425545, ack 1, win 4017, options [nop,nop,TS val 261461 ecr 47875,mptcp dss ack 3454339951 seq 445760576 subseq 424117 len 1428 csum 0xd325], length 1428
10:42:40.452238 IP 112.26.3.1.44877 > 112.26.3.8.42387: Flags [.], seq 435541:436969, ack 1, win 4017, options [nop,nop,TS val 262203 ecr 48508,mptcp dss ack 3454339951 seq 445793420 subseq 435541 len 1428 csum 0xdc5b], length 1428
10:42:40.452548 IP 112.26.3.1.44877 > 112.26.3.8.42387: Flags [.], seq 435541:436969, ack 1, win 4017, options [nop,nop,TS val 262203 ecr 48508,mptcp dss ack 3454339951 seq 445793420 subseq 435541 len 1428 csum 0xdc5b], length 1428
10:42:40.511764 IP 112.26.3.1.44877 > 112.26.3.8.42387: Flags [.], seq 436969:438397, ack 1, win 4017, options [nop,nop,TS val 262203 ecr 48508,mptcp dss ack 3454339951 seq 445794848 subseq 436969 len 1428 csum 0xf232], length 1428
10:42:40.512005 IP 112.26.3.1.44877 > 112.26.3.8.42387: Flags [.], seq 436969:438397, ack 1, win 4017, options [nop,nop,TS val 262203 ecr 48508,mptcp dss ack 3454339951 seq 445794848 subseq 436969 len 1428 csum 0xf232], length 1428
10:42:40.524588 IP 112.26.3.1.44877 > 112.26.3.8.42387: Flags [.], seq 425545:426973, ack 1, win 4017, options [nop,nop,TS val 261804 ecr 48096,mptcp dss ack 3454339951 seq 445764860 subseq 425545 len 1428 csum 0x54e8], length 1428
10:42:40.584185 IP 112.26.3.1.44877 > 112.26.3.8.42387: Flags [.], seq 438397:439825, ack 1, win 4017, options [nop,nop,TS val 262458 ecr 48655,mptcp dss ack 3454339951 seq 445807700 subseq 438397 len 1428 csum 0x2974], length 1428
10:42:40.584518 IP 112.26.3.1.44877 > 112.26.3.8.42387: Flags [.], seq 438397:439825, ack 1, win 4017, options [nop,nop,TS val 262458 ecr 48655,mptcp dss ack 3454339951 seq 445807700 subseq 438397 len 1428 csum 0x2974], length 1428
10:42:40.608567 IP 112.26.3.8.42387 > 112.26.3.1.44877: Flags [.], ack 421261, win 24429, options [nop,nop,TS val 48763 ecr 261161,mptcp dss ack 445734872], length 0
10:42:40.609564 IP 112.26.3.8.42387 > 112.26.3.1.44877: Flags [.], ack 421261, win 24429, options [nop,nop,TS val 48763 ecr 261161,mptcp dss ack 445734872], length 0
10:42:40.663514 IP 112.26.3.1.44877 > 112.26.3.8.42387: Flags [.], seq 439825:441253, ack 1, win 4017, options [nop,nop,TS val 262458 ecr 48655,mptcp dss ack 3454339951 seq 445809128 subseq 439825 len 1428 csum 0xe62d], length 1428
10:42:40.663864 IP 112.26.3.1.44877 > 112.26.3.8.42387: Flags [.], seq 439825:441253, ack 1, win 4017, options [nop,nop,TS val 262458 ecr 48655,mptcp dss ack 3454339951 seq 445809128 subseq 439825 len 1428 csum 0xe62d], length 1428
10:42:40.678901 IP 112.26.3.1.44877 > 112.26.3.8.42387: Flags [.], seq 426973:428401, ack 1, win 4017, options [nop,nop,TS val 261804 ecr 48096,mptcp dss ack 3454339951 seq 445766288 subseq 426973 len 1428 csum 0x658a], length 1428
10:42:40.718106 IP 112.26.3.1.44877 > 112.26.3.8.42387: Flags [.], seq 441253:442681, ack 1, win 4017, options [nop,nop,TS val 262458 ecr 48655,mptcp dss ack 3454339951 seq 445810556 subseq 441253 len 1428 csum 0xdef6], length 1428
10:42:40.718342 IP 112.26.3.1.44877 > 112.26.3.8.42387: Flags [.], seq 441253:442681, ack 1, win 4017, options [nop,nop,TS val 262458 ecr 48655,mptcp dss ack 3454339951 seq 445810556 subseq 441253 len 1428 csum 0xdef6], length 1428
10:42:40.735879 IP 112.26.3.1.44877 > 112.26.3.8.42387: Flags [.], seq 428401:429829, ack 1, win 4017, options [nop,nop,TS val 261804 ecr 48096,mptcp dss ack 3454339951 seq 445767716 subseq 428401 len 1428 csum 0x7aac], length 1428
10:42:40.835719 IP 112.26.3.1.44877 > 112.26.3.8.42387: Flags [.], seq 442681:444109, ack 1, win 4017, options [nop,nop,TS val 262748 ecr 48763,mptcp dss ack 3454339951 seq 445813412 subseq 442681 len 1428 csum 0x4d6], length 1428
10:42:40.836037 IP 112.26.3.1.44877 > 112.26.3.8.42387: Flags [.], seq 442681:444109, ack 1, win 4017, options [nop,nop,TS val 262748 ecr 48763,mptcp dss ack 3454339951 seq 445813412 subseq 442681 len 1428 csum 0x4d6], length 1428
10:42:40.837997 IP 112.26.3.1.44877 > 112.26.3.8.42387: Flags [.], seq 429829:431257, ack 1, win 4017, options [nop,nop,TS val 262203 ecr 48508,mptcp dss ack 3454339951 seq 445787708 subseq 429829 len 1428 csum 0xdfd0], length 1428
10:42:40.884443 IP 112.26.3.1.44877 > 112.26.3.8.42387: Flags [.], seq 444109:445537, ack 1, win 4017, options [nop,nop,TS val 262748 ecr 48763,mptcp dss ack 3454339951 seq 445814840 subseq 444109 len 1428 csum 0x5523], length 1428
10:42:40.884765 IP 112.26.3.1.44877 > 112.26.3.8.42387: Flags [.], seq 444109:445537, ack 1, win 4017, options [nop,nop,TS val 262748 ecr 48763,mptcp dss ack 3454339951 seq 445814840 subseq 444109 len 1428 csum 0x5523], length 1428
10:42:40.910936 IP 112.26.3.8.42387 > 112.26.3.1.44877: Flags [.], ack 424117, win 24429, options [nop,nop,TS val 49104 ecr 261461,mptcp dss ack 445734872], length 0
10:42:40.913281 IP 112.26.3.8.42387 > 112.26.3.1.44877: Flags [.], ack 424117, win 24429, options [nop,nop,TS val 49104 ecr 261461,mptcp dss ack 445734872], length 0
10:42:40.968744 IP 112.26.3.1.44877 > 112.26.3.8.42387: Flags [.], seq 445537:446965, ack 1, win 4017, options [nop,nop,TS val 262748 ecr 48763,mptcp dss ack 3454339951 seq 445816268 subseq 445537 len 1428 csum 0x3a18], length 1428
10:42:40.969061 IP 112.26.3.1.44877 > 112.26.3.8.42387: Flags [.], seq 445537:446965, ack 1, win 4017, options [nop,nop,TS val 262748 ecr 48763,mptcp dss ack 3454339951 seq 445816268 subseq 445537 len 1428 csum 0x3a18], length 1428
10:42:40.984488 IP 112.26.3.1.44877 > 112.26.3.8.42387: Flags [.], seq 431257:432685, ack 1, win 4017, options [nop,nop,TS val 262203 ecr 48508,mptcp dss ack 3454339951 seq 445789136 subseq 431257 len 1428 csum 0xa12d], length 1428
10:42:41.021826 IP 112.26.3.1.44877 > 112.26.3.8.42387: Flags [.], seq 446965:448393, ack 1, win 4017, options [nop,nop,TS val 263052 ecr 49104,mptcp dss ack 3454339951 seq 445834832 subseq 446965 len 1428 csum 0x7016], length 1428
10:42:41.022162 IP 112.26.3.1.44877 > 112.26.3.8.42387: Flags [.], seq 446965:448393, ack 1, win 4017, options [nop,nop,TS val 263052 ecr 49104,mptcp dss ack 3454339951 seq 445834832 subseq 446965 len 1428 csum 0x7016], length 1428
10:42:41.041851 IP 112.26.3.1.44877 > 112.26.3.8.42387: Flags [.], seq 432685:434113, ack 1, win 4017, options [nop,nop,TS val 262203 ecr 48508,mptcp dss ack 3454339951 seq 445790564 subseq 432685 len 1428 csum 0x2a3d], length 1428
10:42:41.089357 IP 112.26.3.1.44877 > 112.26.3.8.42387: Flags [.], seq 448393:449821, ack 1, win 4017, options [nop,nop,TS val 263052 ecr 49104,mptcp dss ack 3454339951 seq 445836260 subseq 448393 len 1428 csum 0xc0a0], length 1428
10:42:41.089717 IP 112.26.3.1.44877 > 112.26.3.8.42387: Flags [.], seq 448393:449821, ack 1, win 4017, options [nop,nop,TS val 263052 ecr 49104,mptcp dss ack 3454339951 seq 445836260 subseq 448393 len 1428 csum 0xc0a0], length 1428
10:42:41.122280 IP 112.26.3.1.44877 > 112.26.3.8.42387: Flags [.], seq 434113:435541, ack 1, win 4017, options [nop,nop,TS val 262203 ecr 48508,mptcp dss ack 3454339951 seq 445791992 subseq 434113 len 1428 csum 0x2b6c], length 1428
10:42:41.184639 IP 112.26.3.1.44877 > 112.26.3.8.42387: Flags [.], seq 435541:436969, ack 1, win 4017, options [nop,nop,TS val 262203 ecr 48508,mptcp dss ack 3454339951 seq 445793420 subseq 435541 len 1428 csum 0xdc5b], length 1428
10:42:41.262847 IP 112.26.3.8.42387 > 112.26.3.1.44877: Flags [.], ack 428401, win 24429, options [nop,nop,TS val 49467 ecr 261461,mptcp dss ack 445734872], length 0
10:42:41.265568 IP 112.26.3.8.42387 > 112.26.3.1.44877: Flags [.], ack 428401, win 24429, options [nop,nop,TS val 49467 ecr 261461,mptcp dss ack 445734872], length 0
10:42:41.275716 IP 112.26.3.1.44877 > 112.26.3.8.42387: Flags [.], seq 449821:451249, ack 1, win 4017, options [nop,nop,TS val 263404 ecr 49467,mptcp dss ack 3454339951 seq 445849112 subseq 449821 len 1428 csum 0x7f45], length 1428
10:42:41.276054 IP 112.26.3.1.44877 > 112.26.3.8.42387: Flags [.], seq 449821:451249, ack 1, win 4017, options [nop,nop,TS val 263404 ecr 49467,mptcp dss ack 3454339951 seq 445849112 subseq 449821 len 1428 csum 0x7f45], length 1428
10:42:41.336490 IP 112.26.3.1.44877 > 112.26.3.8.42387: Flags [.], seq 436969:438397, ack 1, win 4017, options [nop,nop,TS val 262203 ecr 48508,mptcp dss ack 3454339951 seq 445794848 subseq 436969 len 1428 csum 0xf232], length 1428
10:42:41.353309 IP 112.26.3.1.44877 > 112.26.3.8.42387: Flags [.], seq 451249:452677, ack 1, win 4017, options [nop,nop,TS val 263404 ecr 49467,mptcp dss ack 3454339951 seq 445850540 subseq 451249 len 1428 csum 0x6e3a], length 1428
10:42:41.353662 IP 112.26.3.1.44877 > 112.26.3.8.42387: Flags [.], seq 451249:452677, ack 1, win 4017, options [nop,nop,TS val 263404 ecr 49467,mptcp dss ack 3454339951 seq 445850540 subseq 451249 len 1428 csum 0x6e3a], length 1428
10:42:41.398284 IP 112.26.3.1.44877 > 112.26.3.8.42387: Flags [.], seq 438397:439825, ack 1, win 4017, options [nop,nop,TS val 262458 ecr 48655,mptcp dss ack 3454339951 seq 445807700 subseq 438397 len 1428 csum 0x2974], length 1428
10:42:41.403040 IP 112.26.3.1.44877 > 112.26.3.8.42387: Flags [.], seq 452677:454105, ack 1, win 4017, options [nop,nop,TS val 263404 ecr 49467,mptcp dss ack 3454339951 seq 445851968 subseq 452677 len 1428 csum 0xdb7a], length 1428
10:42:41.403361 IP 112.26.3.1.44877 > 112.26.3.8.42387: Flags [.], seq 452677:454105, ack 1, win 4017, options [nop,nop,TS val 263404 ecr 49467,mptcp dss ack 3454339951 seq 445851968 subseq 452677 len 1428 csum 0xdb7a], length 1428
10:42:41.433163 IP 112.26.3.1.44877 > 112.26.3.8.42387: Flags [.], seq 439825:441253, ack 1, win 4017, options [nop,nop,TS val 262458 ecr 48655,mptcp dss ack 3454339951 seq 445809128 subseq 439825 len 1428 csum 0xe62d], length 1428
10:42:41.477432 IP 112.26.3.1.44877 > 112.26.3.8.42387: Flags [.], seq 454105:455533, ack 1, win 4017, options [nop,nop,TS val 263404 ecr 49467,mptcp dss ack 3454339951 seq 445853396 subseq 454105 len 1428 csum 0xa96e], length 1428
10:42:41.477684 IP 112.26.3.1.44877 > 112.26.3.8.42387: Flags [.], seq 454105:455533, ack 1, win 4017, options [nop,nop,TS val 263404 ecr 49467,mptcp dss ack 3454339951 seq 445853396 subseq 454105 len 1428 csum 0xa96e], length 1428
10:42:41.505349 IP 112.26.3.8.42387 > 112.26.3.1.44877: Flags [.], ack 431257, win 24429, options [nop,nop,TS val 49728 ecr 261804,mptcp dss ack 445734872], length 0
10:42:41.507149 IP 112.26.3.8.42387 > 112.26.3.1.44877: Flags [.], ack 431257, win 24429, options [nop,nop,TS val 49728 ecr 261804,mptcp dss ack 445734872], length 0
10:42:41.562826 IP 112.26.3.1.44877 > 112.26.3.8.42387: Flags [.], seq 455533:456961, ack 1, win 4017, options [nop,nop,TS val 263646 ecr 49728,mptcp dss ack 3454339951 seq 445856252 subseq 455533 len 1428 csum 0xeb4d], length 1428
10:42:41.563161 IP 112.26.3.1.44877 > 112.26.3.8.42387: Flags [.], seq 455533:456961, ack 1, win 4017, options [nop,nop,TS val 263646 ecr 49728,mptcp dss ack 3454339951 seq 445856252 subseq 455533 len 1428 csum 0xeb4d], length 1428
10:42:41.576291 IP 112.26.3.1.44877 > 112.26.3.8.42387: Flags [.], seq 441253:442681, ack 1, win 4017, options [nop,nop,TS val 262458 ecr 48655,mptcp dss ack 3454339951 seq 445810556 subseq 441253 len 1428 csum 0xdef6], length 1428
10:42:41.653893 IP 112.26.3.1.44877 > 112.26.3.8.42387: Flags [.], seq 456961:458389, ack 1, win 4017, options [nop,nop,TS val 263646 ecr 49728,mptcp dss ack 3454339951 seq 445857680 subseq 456961 len 1428 csum 0xe72], length 1428
10:42:41.654232 IP 112.26.3.1.44877 > 112.26.3.8.42387: Flags [.], seq 456961:458389, ack 1, win 4017, options [nop,nop,TS val 263646 ecr 49728,mptcp dss ack 3454339951 seq 445857680 subseq 456961 len 1428 csum 0xe72], length 1428
10:42:41.679892 IP 112.26.3.1.44877 > 112.26.3.8.42387: Flags [.], seq 442681:444109, ack 1, win 4017, options [nop,nop,TS val 262748 ecr 48763,mptcp dss ack 3454339951 seq 445813412 subseq 442681 len 1428 csum 0x4d6], length 1428
10:42:41.740950 IP 112.26.3.1.44877 > 112.26.3.8.42387: Flags [.], seq 458389:459817, ack 1, win 4017, options [nop,nop,TS val 263646 ecr 49728,mptcp dss ack 3454339951 seq 445859108 subseq 458389 len 1428 csum 0xa0cf], length 1428
10:42:41.741192 IP 112.26.3.1.44877 > 112.26.3.8.42387: Flags [.], seq 458389:459817, ack 1, win 4017, options [nop,nop,TS val 263646 ecr 49728,mptcp dss ack 3454339951 seq 445859108 subseq 458389 len 1428 csum 0xa0cf], length 1428
10:42:41.769091 IP 112.26.3.1.44877 > 112.26.3.8.42387: Flags [.], seq 444109:445537, ack 1, win 4017, options [nop,nop,TS val 262748 ecr 48763,mptcp dss ack 3454339951 seq 445814840 subseq 444109 len 1428 csum 0x5523], length 1428
10:42:41.825245 IP 112.26.3.1.44877 > 112.26.3.8.42387: Flags [.], seq 445537:446965, ack 1, win 4017, options [nop,nop,TS val 262748 ecr 48763,mptcp dss ack 3454339951 seq 445816268 subseq 445537 len 1428 csum 0x3a18], length 1428
10:42:41.922756 IP 112.26.3.8.42387 > 112.26.3.1.44877: Flags [.], ack 436969, win 24429, options [nop,nop,TS val 50040 ecr 262203,mptcp dss ack 445734872], length 0
10:42:41.924262 IP 112.26.3.8.42387 > 112.26.3.1.44877: Flags [.], ack 436969, win 24429, options [nop,nop,TS val 50040 ecr 262203,mptcp dss ack 445734872], length 0
10:42:41.941249 IP 112.26.3.1.44877 > 112.26.3.8.42387: Flags [.], seq 459817:461245, ack 1, win 4017, options [nop,nop,TS val 264063 ecr 50040,mptcp dss ack 3454339951 seq 445863392 subseq 459817 len 1428 csum 0xf7d6], length 1428
10:42:41.941599 IP 112.26.3.1.44877 > 112.26.3.8.42387: Flags [.], seq 459817:461245, ack 1, win 4017, options [nop,nop,TS val 264063 ecr 50040,mptcp dss ack 3454339951 seq 445863392 subseq 459817 len 1428 csum 0xf7d6], length 1428
10:42:41.990059 IP 112.26.3.1.44877 > 112.26.3.8.42387: Flags [.], seq 446965:448393, ack 1, win 4017, options [nop,nop,TS val 263052 ecr 49104,mptcp dss ack 3454339951 seq 445834832 subseq 446965 len 1428 csum 0x7016], length 1428
10:42:42.005566 IP 112.26.3.1.44877 > 112.26.3.8.42387: Flags [.], seq 461245:462673, ack 1, win 4017, options [nop,nop,TS val 264063 ecr 50040,mptcp dss ack 3454339951 seq 445864820 subseq 461245 len 1428 csum 0x6e3f], length 1428
10:42:42.005900 IP 112.26.3.1.44877 > 112.26.3.8.42387: Flags [.], seq 461245:462673, ack 1, win 4017, options [nop,nop,TS val 264063 ecr 50040,mptcp dss ack 3454339951 seq 445864820 subseq 461245 len 1428 csum 0x6e3f], length 1428
10:42:42.042129 IP 112.26.3.1.44877 > 112.26.3.8.42387: Flags [.], seq 448393:449821, ack 1, win 4017, options [nop,nop,TS val 263052 ecr 49104,mptcp dss ack 3454339951 seq 445836260 subseq 448393 len 1428 csum 0xc0a0], length 1428
10:42:42.060514 IP 112.26.3.1.44877 > 112.26.3.8.42387: Flags [.], seq 462673:464101, ack 1, win 4017, options [nop,nop,TS val 264063 ecr 50040,mptcp dss ack 3454339951 seq 445866248 subseq 462673 len 1428 csum 0xe148], length 1428
10:42:42.060852 IP 112.26.3.1.44877 > 112.26.3.8.42387: Flags [.], seq 462673:464101, ack 1, win 4017, options [nop,nop,TS val 264063 ecr 50040,mptcp dss ack 3454339951 seq 445866248 subseq 462673 len 1428 csum 0xe148], length 1428
10:42:42.109687 IP 112.26.3.1.44877 > 112.26.3.8.42387: Flags [.], seq 449821:451249, ack 1, win 4017, options [nop,nop,TS val 263404 ecr 49467,mptcp dss ack 3454339951 seq 445849112 subseq 449821 len 1428 csum 0x7f45], length 1428
10:42:42.116126 IP 112.26.3.1.44877 > 112.26.3.8.42387: Flags [.], seq 464101:465529, ack 1, win 4017, options [nop,nop,TS val 264063 ecr 50040,mptcp dss ack 3454339951 seq 445867676 subseq 464101 len 1428 csum 0xddbb], length 1428
10:42:42.116439 IP 112.26.3.1.44877 > 112.26.3.8.42387: Flags [.], seq 464101:465529, ack 1, win 4017, options [nop,nop,TS val 264063 ecr 50040,mptcp dss ack 3454339951 seq 445867676 subseq 464101 len 1428 csum 0xddbb], length 1428
10:42:42.155933 IP 112.26.3.1.44877 > 112.26.3.8.42387: Flags [.], seq 465529:466957, ack 1, win 4017, options [nop,nop,TS val 264063 ecr 50040,mptcp dss ack 3454339951 seq 445869104 subseq 465529 len 1428 csum 0x59e8], length 1428
10:42:42.156213 IP 112.26.3.1.44877 > 112.26.3.8.42387: Flags [.], seq 465529:466957, ack 1, win 4017, options [nop,nop,TS val 264063 ecr 50040,mptcp dss ack 3454339951 seq 445869104 subseq 465529 len 1428 csum 0x59e8], length 1428
10:42:42.161244 IP 112.26.3.8.42387 > 112.26.3.1.44877: Flags [.], ack 442681, win 24429, options [nop,nop,TS val 50364 ecr 262203,mptcp dss ack 445734872], length 0
10:42:42.162257 IP 112.26.3.8.42387 > 112.26.3.1.44877: Flags [.], ack 442681, win 24429, options [nop,nop,TS val 50364 ecr 262203,mptcp dss ack 445734872], length 0
10:42:42.198533 IP 112.26.3.1.44877 > 112.26.3.8.42387: Flags [.], seq 451249:452677, ack 1, win 4017, options [nop,nop,TS val 263404 ecr 49467,mptcp dss ack 3454339951 seq 445850540 subseq 451249 len 1428 csum 0x6e3a], length 1428
10:42:42.224369 IP 112.26.3.1.44877 > 112.26.3.8.42387: Flags [.], seq 466957:468385, ack 1, win 4017, options [nop,nop,TS val 264063 ecr 50040,mptcp dss ack 3454339951 seq 445870532 subseq 466957 len 1428 csum 0xe5c4], length 1428
10:42:42.224724 IP 112.26.3.1.44877 > 112.26.3.8.42387: Flags [.], seq 466957:468385, ack 1, win 4017, options [nop,nop,TS val 264063 ecr 50040,mptcp dss ack 3454339951 seq 445870532 subseq 466957 len 1428 csum 0xe5c4], length 1428
10:42:42.289679 IP 112.26.3.1.44877 > 112.26.3.8.42387: Flags [.], seq 452677:454105, ack 1, win 4017, options [nop,nop,TS val 263404 ecr 49467,mptcp dss ack 3454339951 seq 445851968 subseq 452677 len 1428 csum 0xdb7a], length 1428
10:42:42.305986 IP 112.26.3.1.44877 > 112.26.3.8.42387: Flags [.], seq 468385:469813, ack 1, win 4017, options [nop,nop,TS val 264300 ecr 50364,mptcp dss ack 3454339951 seq 445893380 subseq 468385 len 1428 csum 0x8463], length 1428
10:42:42.306355 IP 112.26.3.1.44877 > 112.26.3.8.42387: Flags [.], seq 468385:469813, ack 1, win 4017, options [nop,nop,TS val 264300 ecr 50364,mptcp dss ack 3454339951 seq 445893380 subseq 468385 len 1428 csum 0x8463], length 1428
10:42:42.338343 IP 112.26.3.1.44877 > 112.26.3.8.42387: Flags [.], seq 469813:471241, ack 1, win 4017, options [nop,nop,TS val 264300 ecr 50364,mptcp dss ack 3454339951 seq 445894808 subseq 469813 len 1428 csum 0x77ad], length 1428
10:42:42.338697 IP 112.26.3.1.44877 > 112.26.3.8.42387: Flags [.], seq 469813:471241, ack 1, win 4017, options [nop,nop,TS val 264300 ecr 50364,mptcp dss ack 3454339951 seq 445894808 subseq 469813 len 1428 csum 0x77ad], length 1428
10:42:42.358167 IP 112.26.3.1.44877 > 112.26.3.8.42387: Flags [.], seq 454105:455533, ack 1, win 4017, options [nop,nop,TS val 263404 ecr 49467,mptcp dss ack 3454339951 seq 445853396 subseq 454105 len 1428 csum 0xa96e], length 1428
10:42:42.386929 IP 112.26.3.1.44877 > 112.26.3.8.42387: Flags [.], seq 455533:456961, ack 1, win 4017, options [nop,nop,TS val 263646 ecr 49728,mptcp dss ack 3454339951 seq 445856252 subseq 455533 len 1428 csum 0xeb4d], length 1428
10:42:42.423394 IP 112.26.3.1.44877 > 112.26.3.8.42387: Flags [.], seq 471241:472669, ack 1, win 4017, options [nop,nop,TS val 264300 ecr 50364,mptcp dss ack 3454339951 seq 445896236 subseq 471241 len 1428 csum 0x2b31], length 1428
10:42:42.423733 IP 112.26.3.1.44877 > 112.26.3.8.42387: Flags [.], seq 471241:472669, ack 1, win 4017, options [nop,nop,TS val 264300 ecr 50364,mptcp dss ack 3454339951 seq 445896236 subseq 471241 len 1428 csum 0x2b31], length 1428
10:42:42.456954 IP 112.26.3.8.42387 > 112.26.3.1.44877: Flags [.], ack 446965, win 23849, options [nop,nop,TS val 50653 ecr 262748,mptcp dss ack 445772000], length 0
10:42:42.457978 IP 112.26.3.8.42387 > 112.26.3.1.44877: Flags [.], ack 446965, win 23849, options [nop,nop,TS val 50653 ecr 262748,mptcp dss ack 445772000], length 0
10:42:42.475911 IP 112.26.3.1.44877 > 112.26.3.8.42387: Flags [P.], seq 472669:474097, ack 1, win 4017, options [nop,nop,TS val 264300 ecr 50364,mptcp dss ack 3454339951 seq 445897664 subseq 472669 len 1428 csum 0xe3bf], length 1428
10:42:42.476232 IP 112.26.3.1.44877 > 112.26.3.8.42387: Flags [P.], seq 472669:474097, ack 1, win 4017, options [nop,nop,TS val 264300 ecr 50364,mptcp dss ack 3454339951 seq 445897664 subseq 472669 len 1428 csum 0xe3bf], length 1428
10:42:42.531452 IP 112.26.3.1.44877 > 112.26.3.8.42387: Flags [.], seq 456961:458389, ack 1, win 4017, options [nop,nop,TS val 263646 ecr 49728,mptcp dss ack 3454339951 seq 445857680 subseq 456961 len 1428 csum 0xe72], length 1428
10:42:42.565034 IP 112.26.3.1.44877 > 112.26.3.8.42387: Flags [.], seq 474097:475525, ack 1, win 4017, options [nop,nop,TS val 264300 ecr 50364,mptcp dss ack 3454339951 seq 445899092 subseq 474097 len 1428 csum 0x7eaa], length 1428
10:42:42.565369 IP 112.26.3.1.44877 > 112.26.3.8.42387: Flags [.], seq 474097:475525, ack 1, win 4017, options [nop,nop,TS val 264300 ecr 50364,mptcp dss ack 3454339951 seq 445899092 subseq 474097 len 1428 csum 0x7eaa], length 1428
10:42:42.593437 IP 112.26.3.1.44877 > 112.26.3.8.42387: Flags [.], seq 458389:459817, ack 1, win 4017, options [nop,nop,TS val 263646 ecr 49728,mptcp dss ack 3454339951 seq 445859108 subseq 458389 len 1428 csum 0xa0cf], length 1428
10:42:42.644889 IP 112.26.3.8.42387 > 112.26.3.1.44877: Flags [.], ack 449821, win 23955, options [nop,nop,TS val 50830 ecr 263052,mptcp dss ack 445772000], length 0
10:42:42.647554 IP 112.26.3.8.42387 > 112.26.3.1.44877: Flags [.], ack 449821, win 23955, options [nop,nop,TS val 50830 ecr 263052,mptcp dss ack 445772000], length 0
10:42:42.659906 IP 112.26.3.1.44877 > 112.26.3.8.42387: Flags [.], seq 475525:476953, ack 1, win 4017, options [nop,nop,TS val 264300 ecr 50364,mptcp dss ack 3454339951 seq 445900520 subseq 475525 len 1428 csum 0xbbdd], length 1428
