10:41:55.132586 IP 112.26.0.8.44380 > 112.26.0.1.44877: Flags [S], seq 231718060, win 65535, options [mss 1460,sackOK,TS val 3909 ecr 0,nop,wscale 6,mptcp capable csum {0x4662d4d2f708162f}], length 0
10:41:55.133004 IP 112.26.0.1.44877 > 112.26.0.8.44380: Flags [S.], seq 1060196464, ack 231718061, win 65535, options [mss 1460,sackOK,TS val 217271 ecr 3909,nop,wscale 6,mptcp capable csum {0x38a7cf8d5ca5beb8}], length 0
10:41:55.157079 IP 112.26.0.1.44877 > 112.26.0.8.44380: Flags [S.], seq 1060196464, ack 231718061, win 65535, options [mss 1460,sackOK,TS val 217271 ecr 3909,nop,wscale 6,mptcp capable csum {0x38a7cf8d5ca5beb8}], length 0
10:41:55.287977 IP 112.26.0.8.44380 > 112.26.0.1.44877: Flags [.], ack 1, win 1369, options [nop,nop,TS val 3947 ecr 217271,mptcp capable csum {0x4662d4d2f708162f,0x38a7cf8d5ca5beb8},mptcp dss ack 444111424], length 0
10:41:55.288197 IP 112.26.0.1.44877 > 112.26.0.8.44380: Flags [.], ack 1, win 1339, options [nop,nop,TS val 217427 ecr 3947,mptcp add-addr id 4 112.26.2.1,mptcp dss ack 3454339951], length 0
10:41:55.288233 IP 112.26.0.1.44877 > 112.26.0.8.44380: Flags [.], ack 1, win 1339, options [nop,nop,TS val 217427 ecr 3947,mptcp add-addr id 5 112.26.3.1,mptcp dss ack 3454339951], length 0
10:41:55.288265 IP 112.26.0.1.44877 > 112.26.0.8.44380: Flags [.], ack 1, win 1339, options [nop,nop,TS val 217427 ecr 3947,mptcp add-addr id 6 112.26.1.1,mptcp dss ack 3454339951], length 0
10:42:31.054503 IP 112.26.0.1.44877 > 112.26.0.8.44380: Flags [.], seq 361097:362525, ack 1, win 4017, options [nop,nop,TS val 252608 ecr 38806,mptcp dss ack 3454339951 seq 445365020 subseq 361097 len 1428 csum 0xcb65], length 1428
10:42:31.176490 IP 112.26.0.8.44380 > 112.26.0.1.44877: Flags [.], ack 356813, win 24177, options [nop,nop,TS val 39328 ecr 252217,mptcp dss ack 445269344], length 0
10:42:31.176866 IP 112.26.0.1.44877 > 112.26.0.8.44380: Flags [.], seq 366809:368237, ack 1, win 4017, options [nop,nop,TS val 253315 ecr 39328,mptcp dss ack 3454339951 seq 445399292 subseq 366809 len 1428 csum 0x2c8a], length 1428
10:42:31.228248 IP 112.26.0.8.44380 > 112.26.0.1.44877: Flags [.], ack 358241, win 24094, options [nop,nop,TS val 39419 ecr 252283,mptcp dss ack 445287908], length 0
10:42:44.248954 IP 112.26.0.1.44877 > 112.26.0.8.44380: Flags [.], seq 492473:493901, ack 1, win 4017, options [nop,nop,TS val 265684 ecr 51641,mptcp dss ack 3454339951 seq 445953356 subseq 492473 len 1428 csum 0x49a], length 1428
10:42:54.251904 IP 112.26.0.8.44380 > 112.26.0.1.44877: Flags [.], ack 588149, win 24576, options [nop,nop,TS val 62424 ecr 275224,mptcp dss ack 446264660], length 0
10:43:14.479720 IP 112.26.0.8.44380 > 112.26.0.1.44877: Flags [.], ack 789497, win 24536, options [nop,nop,TS val 82543 ecr 295176,mptcp dss ack 447152876], length 0
10:43:14.480087 IP 112.26.0.1.44877 > 112.26.0.8.44380: Flags [.], seq 802349:803777, ack 1, win 4017, options [nop,nop,TS val 296619 ecr 82543,mptcp dss ack 3454339951 seq 447219992 subseq 802349 len 1428 csum 0xc626], length 1428
10:43:14.480166 IP 112.26.0.1.44877 > 112.26.0.8.44380: Flags [.], seq 803777:805205, ack 1, win 4017, options [nop,nop,TS val 296619 ecr 82543,mptcp dss ack 3454339951 seq 447221420 subseq 803777 len 1428 csum 0x5f2e], length 1428
10:43:14.526633 IP 112.26.0.8.44380 > 112.26.0.1.44877: Flags [.], ack 790925, win 24536, options [nop,nop,TS val 82633 ecr 295243,mptcp dss ack 447152876], length 0
10:43:14.526988 IP 112.26.0.1.44877 > 112.26.0.8.44380: Flags [.], seq 805205:806633, ack 1, win 4017, options [nop,nop,TS val 296665 ecr 82633,mptcp dss ack 3454339951 seq 447228560 subseq 805205 len 1428 csum 0x2d11], length 1428
10:43:14.590500 IP 112.26.0.8.44380 > 112.26.0.1.44877: Flags [.], ack 792353, win 24536, options [nop,nop,TS val 82733 ecr 295388,mptcp dss ack 447152876], length 0
10:43:14.590930 IP 112.26.0.1.44877 > 112.26.0.8.44380: Flags [.], seq 806633:808061, ack 1, win 4017, options [nop,nop,TS val 296729 ecr 82733,mptcp dss ack 3454339951 seq 447232844 subseq 806633 len 1428 csum 0x32ed], length 1428
10:43:14.655812 IP 112.26.0.8.44380 > 112.26.0.1.44877: Flags [.], ack 793781, win 24536, options [nop,nop,TS val 82844 ecr 295446,mptcp dss ack 447152876], length 0
10:43:14.656242 IP 112.26.0.1.44877 > 112.26.0.8.44380: Flags [.], seq 808061:809489, ack 1, win 4017, options [nop,nop,TS val 296795 ecr 82844,mptcp dss ack 3454339951 seq 447234272 subseq 808061 len 1428 csum 0x8ecc], length 1428
10:43:14.714917 IP 112.26.0.1.44877 > 112.26.0.8.44380: Flags [.], seq 796637:798065, ack 1, win 4017, options [nop,nop,TS val 296261 ecr 82215,mptcp dss ack 3454339951 seq 447209996 subseq 796637 len 1428 csum 0xc590], length 1428
10:43:14.812753 IP 112.26.0.8.44380 > 112.26.0.1.44877: Flags [.], ack 795209, win 24536, options [nop,nop,TS val 82932 ecr 295513,mptcp dss ack 447152876], length 0
10:43:14.813113 IP 112.26.0.1.44877 > 112.26.0.8.44380: Flags [.], seq 809489:810917, ack 1, win 4017, options [nop,nop,TS val 296951 ecr 82932,mptcp dss ack 3454339951 seq 447238556 subseq 809489 len 1428 csum 0xedb7], length 1428
10:43:14.842460 IP 112.26.0.1.44877 > 112.26.0.8.44380: Flags [.], seq 798065:799493, ack 1, win 4017, options [nop,nop,TS val 296261 ecr 82215,mptcp dss ack 3454339951 seq 447211424 subseq 798065 len 1428 csum 0xf670], length 1428
10:43:14.951147 IP 112.26.0.1.44877 > 112.26.0.8.44380: Flags [.], seq 799493:800921, ack 1, win 4017, options [nop,nop,TS val 296484 ecr 82357,mptcp dss ack 3454339951 seq 447215708 subseq 799493 len 1428 csum 0x5e17], length 1428
10:43:15.016848 IP 112.26.0.1.44877 > 112.26.0.8.44380: Flags [.], seq 800921:802349, ack 1, win 4017, options [nop,nop,TS val 296559 ecr 82441,mptcp dss ack 3454339951 seq 447218564 subseq 800921 len 1428 csum 0xe144], length 1428
10:43:15.094597 IP 112.26.0.1.44877 > 112.26.0.8.44380: Flags [.], seq 802349:803777, ack 1, win 4017, options [nop,nop,TS val 296619 ecr 82543,mptcp dss ack 3454339951 seq 447219992 subseq 802349 len 1428 csum 0xc626], length 1428
10:43:15.168871 IP 112.26.0.1.44877 > 112.26.0.8.44380: Flags [.], seq 803777:805205, ack 1, win 4017, options [nop,nop,TS val 296619 ecr 82543,mptcp dss ack 3454339951 seq 447221420 subseq 803777 len 1428 csum 0x5f2e], length 1428
10:43:15.241590 IP 112.26.0.1.44877 > 112.26.0.8.44380: Flags [.], seq 805205:806633, ack 1, win 4017, options [nop,nop,TS val 296665 ecr 82633,mptcp dss ack 3454339951 seq 447228560 subseq 805205 len 1428 csum 0x2d11], length 1428
10:43:15.347207 IP 112.26.0.1.44877 > 112.26.0.8.44380: Flags [.], seq 806633:808061, ack 1, win 4017, options [nop,nop,TS val 296729 ecr 82733,mptcp dss ack 3454339951 seq 447232844 subseq 806633 len 1428 csum 0x32ed], length 1428
10:43:15.420684 IP 112.26.0.8.44380 > 112.26.0.1.44877: Flags [.], ack 798065, win 24536, options [nop,nop,TS val 83508 ecr 296261,mptcp dss ack 447152876], length 0
10:43:15.420991 IP 112.26.0.1.44877 > 112.26.0.8.44380: Flags [.], seq 810917:812345, ack 1, win 4017, options [nop,nop,TS val 297559 ecr 83508,mptcp dss ack 3454339951 seq 447254264 subseq 810917 len 1428 csum 0xe593], length 1428
10:43:15.421067 IP 112.26.0.1.44877 > 112.26.0.8.44380: Flags [.], seq 812345:813773, ack 1, win 4017, options [nop,nop,TS val 297559 ecr 83508,mptcp dss ack 3454339951 seq 447255692 subseq 812345 len 1428 csum 0x4789], length 1428
10:43:15.421219 IP 112.26.0.1.44877 > 112.26.0.8.44380: Flags [.], seq 813773:815201, ack 1, win 4017, options [nop,nop,TS val 297559 ecr 83508,mptcp dss ack 3454339951 seq 447257120 subseq 813773 len 1428 csum 0x2803], length 1428
10:43:15.421323 IP 112.26.0.1.44877 > 112.26.0.8.44380: Flags [.], seq 815201:816629, ack 1, win 4017, options [nop,nop,TS val 297559 ecr 83508,mptcp dss ack 3454339951 seq 447258548 subseq 815201 len 1428 csum 0x7834], length 1428
10:43:15.492784 IP 112.26.0.1.44877 > 112.26.0.8.44380: Flags [.], seq 809489:810917, ack 1, win 4017, options [nop,nop,TS val 296951 ecr 82932,mptcp dss ack 3454339951 seq 447238556 subseq 809489 len 1428 csum 0xedb7], length 1428
10:43:15.561852 IP 112.26.0.8.44380 > 112.26.0.1.44877: Flags [.], ack 799493, win 24536, options [nop,nop,TS val 83635 ecr 296261,mptcp dss ack 447152876], length 0
10:43:15.562216 IP 112.26.0.1.44877 > 112.26.0.8.44380: Flags [.], seq 816629:818057, ack 1, win 4017, options [nop,nop,TS val 297700 ecr 83635,mptcp dss ack 3454339951 seq 447262832 subseq 816629 len 1428 csum 0xae8b], length 1428
10:43:15.602192 IP 112.26.0.8.44380 > 112.26.0.1.44877: Flags [.], ack 800921, win 24536, options [nop,nop,TS val 83743 ecr 296484,mptcp dss ack 447152876], length 0
10:43:15.602553 IP 112.26.0.1.44877 > 112.26.0.8.44380: Flags [.], seq 818057:819485, ack 1, win 4017, options [nop,nop,TS val 297740 ecr 83743,mptcp dss ack 3454339951 seq 447268544 subseq 818057 len 1428 csum 0xbebb], length 1428
10:43:15.637642 IP 112.26.0.8.44380 > 112.26.0.1.44877: Flags [.], ack 802349, win 24536, options [nop,nop,TS val 83834 ecr 296559,mptcp dss ack 447152876], length 0
10:43:15.638141 IP 112.26.0.1.44877 > 112.26.0.8.44380: Flags [.], seq 819485:820913, ack 1, win 4017, options [nop,nop,TS val 297776 ecr 83834,mptcp dss ack 3454339951 seq 447271400 subseq 819485 len 1428 csum 0xe57d], length 1428
10:43:15.706167 IP 112.26.0.8.44380 > 112.26.0.1.44877: Flags [.], ack 803777, win 24536, options [nop,nop,TS val 83893 ecr 296619,mptcp dss ack 447152876], length 0
10:43:15.706517 IP 112.26.0.1.44877 > 112.26.0.8.44380: Flags [.], seq 820913:822341, ack 1, win 4017, options [nop,nop,TS val 297844 ecr 83893,mptcp dss ack 3454339951 seq 447272828 subseq 820913 len 1428 csum 0x9caa], length 1428
10:43:15.706618 IP 112.26.0.1.44877 > 112.26.0.8.44380: Flags [.], seq 822341:823769, ack 1, win 4017, options [nop,nop,TS val 297844 ecr 83893,mptcp dss ack 3454339951 seq 447274256 subseq 822341 len 1428 csum 0x6435], length 1428
10:43:15.784186 IP 112.26.0.8.44380 > 112.26.0.1.44877: Flags [.], ack 805205, win 24536, options [nop,nop,TS val 83975 ecr 296619,mptcp dss ack 447152876], length 0
10:43:15.784475 IP 112.26.0.1.44877 > 112.26.0.8.44380: Flags [.], seq 823769:825197, ack 1, win 4017, options [nop,nop,TS val 297923 ecr 83975,mptcp dss ack 3454339951 seq 447275684 subseq 823769 len 1428 csum 0xb37], length 1428
10:43:15.834072 IP 112.26.0.8.44380 > 112.26.0.1.44877: Flags [.], ack 806633, win 24536, options [nop,nop,TS val 84047 ecr 296665,mptcp dss ack 447152876], length 0
10:43:15.834432 IP 112.26.0.1.44877 > 112.26.0.8.44380: Flags [.], seq 825197:826625, ack 1, win 4017, options [nop,nop,TS val 297973 ecr 84047,mptcp dss ack 3454339951 seq 447278540 subseq 825197 len 1428 csum 0x8f5d], length 1428
10:43:15.834507 IP 112.26.0.1.44877 > 112.26.0.8.44380: Flags [.], seq 826625:828053, ack 1, win 4017, options [nop,nop,TS val 297973 ecr 84047,mptcp dss ack 3454339951 seq 447279968 subseq 826625 len 1428 csum 0xe74c], length 1428
10:43:15.905789 IP 112.26.0.8.44380 > 112.26.0.1.44877: Flags [.], ack 808061, win 24536, options [nop,nop,TS val 84139 ecr 296729,mptcp dss ack 447152876], length 0
10:43:15.906158 IP 112.26.0.1.44877 > 112.26.0.8.44380: Flags [.], seq 828053:829481, ack 1, win 4017, options [nop,nop,TS val 298045 ecr 84139,mptcp dss ack 3454339951 seq 447287108 subseq 828053 len 1428 csum 0xf644], length 1428
10:43:15.946692 IP 112.26.0.1.44877 > 112.26.0.8.44380: Flags [.], seq 810917:812345, ack 1, win 4017, options [nop,nop,TS val 297559 ecr 83508,mptcp dss ack 3454339951 seq 447254264 subseq 810917 len 1428 csum 0xe593], length 1428
10:43:16.067925 IP 112.26.0.8.44380 > 112.26.0.1.44877: Flags [.], ack 808061, win 24536, options [nop,nop,TS val 84284 ecr 296729,nop,nop,sack 1 {809489:810917},mptcp dss ack 447152876], length 0
10:43:16.091655 IP 112.26.0.1.44877 > 112.26.0.8.44380: Flags [.], seq 829481:830909, ack 1, win 4017, options [nop,nop,TS val 298230 ecr 84284,mptcp dss ack 3454339951 seq 447289964 subseq 829481 len 1428 csum 0xde64], length 1428
10:43:16.152489 IP 112.26.0.1.44877 > 112.26.0.8.44380: Flags [.], seq 812345:813773, ack 1, win 4017, options [nop,nop,TS val 297559 ecr 83508,mptcp dss ack 3454339951 seq 447255692 subseq 812345 len 1428 csum 0x4789], length 1428
10:43:16.274024 IP 112.26.0.1.44877 > 112.26.0.8.44380: Flags [.], seq 815201:816629, ack 1, win 4017, options [nop,nop,TS val 297559 ecr 83508,mptcp dss ack 3454339951 seq 447258548 subseq 815201 len 1428 csum 0x7834], length 1428
10:43:16.361036 IP 112.26.0.1.44877 > 112.26.0.8.44380: Flags [.], seq 816629:818057, ack 1, win 4017, options [nop,nop,TS val 297700 ecr 83635,mptcp dss ack 3454339951 seq 447262832 subseq 816629 len 1428 csum 0xae8b], length 1428
10:43:16.443028 IP 112.26.0.1.44877 > 112.26.0.8.44380: Flags [.], seq 819485:820913, ack 1, win 4017, options [nop,nop,TS val 297776 ecr 83834,mptcp dss ack 3454339951 seq 447271400 subseq 819485 len 1428 csum 0xe57d], length 1428
10:43:16.507290 IP 112.26.0.1.44877 > 112.26.0.8.44380: Flags [.], seq 820913:822341, ack 1, win 4017, options [nop,nop,TS val 297844 ecr 83893,mptcp dss ack 3454339951 seq 447272828 subseq 820913 len 1428 csum 0x9caa], length 1428
10:43:16.606142 IP 112.26.0.1.44877 > 112.26.0.8.44380: Flags [.], seq 822341:823769, ack 1, win 4017, options [nop,nop,TS val 297844 ecr 83893,mptcp dss ack 3454339951 seq 447274256 subseq 822341 len 1428 csum 0x6435], length 1428
10:43:16.649667 IP 112.26.0.8.44380 > 112.26.0.1.44877: Flags [.], ack 808061, win 24536, options [nop,nop,TS val 84743 ecr 296729,nop,nop,sack 1 {809489:812345},mptcp dss ack 447152876], length 0
10:43:16.660412 IP 112.26.0.1.44877 > 112.26.0.8.44380: Flags [.], seq 830909:832337, ack 1, win 4017, options [nop,nop,TS val 298799 ecr 84743,mptcp dss ack 3454339951 seq 447304244 subseq 830909 len 1428 csum 0xa2e3], length 1428
10:43:16.708925 IP 112.26.0.1.44877 > 112.26.0.8.44380: Flags [.], seq 823769:825197, ack 1, win 4017, options [nop,nop,TS val 297923 ecr 83975,mptcp dss ack 3454339951 seq 447275684 subseq 823769 len 1428 csum 0xb37], length 1428
10:43:16.773250 IP 112.26.0.1.44877 > 112.26.0.8.44380: Flags [.], seq 825197:826625, ack 1, win 4017, options [nop,nop,TS val 297973 ecr 84047,mptcp dss ack 3454339951 seq 447278540 subseq 825197 len 1428 csum 0x8f5d], length 1428
10:43:16.805390 IP 112.26.0.1.44877 > 112.26.0.8.44380: Flags [.], seq 808061:809489, ack 1, win 4017, options [nop,nop,TS val 298944 ecr 84743,mptcp dss ack 3454339951 seq 447234272 subseq 808061 len 1428 csum 0x8ecc], length 1428
10:43:16.863897 IP 112.26.0.1.44877 > 112.26.0.8.44380: Flags [.], seq 826625:828053, ack 1, win 4017, options [nop,nop,TS val 297973 ecr 84047,mptcp dss ack 3454339951 seq 447279968 subseq 826625 len 1428 csum 0xe74c], length 1428
10:43:16.951459 IP 112.26.0.1.44877 > 112.26.0.8.44380: Flags [.], seq 829481:830909, ack 1, win 4017, options [nop,nop,TS val 298230 ecr 84284,mptcp dss ack 3454339951 seq 447289964 subseq 829481 len 1428 csum 0xde64], length 1428
10:43:17.028242 IP 112.26.0.8.44380 > 112.26.0.1.44877: Flags [.], ack 808061, win 24536, options [nop,nop,TS val 85155 ecr 296729,nop,nop,sack 2 {815201:818057}{809489:813773},mptcp dss ack 447152876], length 0
10:43:17.028701 IP 112.26.0.1.44877 > 112.26.0.8.44380: Flags [.], seq 813773:815201, ack 1, win 4017, options [nop,nop,TS val 299167 ecr 85155,mptcp dss ack 3454339951 seq 447257120 subseq 813773 len 1428 csum 0x2803], length 1428
10:43:17.087757 IP 112.26.0.1.44877 > 112.26.0.8.44380: Flags [.], seq 832337:833765, ack 1, win 4017, options [nop,nop,TS val 299226 ecr 85155,mptcp dss ack 3454339951 seq 447268544 subseq 832337 len 1428 csum 0x86f3], length 1428
10:43:17.111091 IP 112.26.0.8.44380 > 112.26.0.1.44877: Flags [.], ack 808061, win 24536, options [nop,nop,TS val 85234 ecr 296729,nop,nop,sack 2 {819485:820913}{815201:818057},mptcp dss ack 447152876], length 0
10:43:17.111537 IP 112.26.0.1.44877 > 112.26.0.8.44380: Flags [.], seq 818057:819485, ack 1, win 4017, options [nop,nop,TS val 299249 ecr 85234,mptcp dss ack 3454339951 seq 447268544 subseq 818057 len 1428 csum 0xbebb], length 1428
10:43:17.162720 IP 112.26.0.8.44380 > 112.26.0.1.44877: Flags [.], ack 808061, win 24536, options [nop,nop,TS val 85344 ecr 296729,nop,nop,sack 2 {819485:822341}{815201:818057},mptcp dss ack 447152876], length 0
10:43:17.189068 IP 112.26.0.8.44380 > 112.26.0.1.44877: Flags [.], ack 808061, win 24536, options [nop,nop,TS val 85409 ecr 296729,nop,nop,sack 2 {819485:823769}{815201:818057},mptcp dss ack 447152876], length 0
10:43:17.223180 IP 112.26.0.1.44877 > 112.26.0.8.44380: Flags [.], seq 830909:832337, ack 1, win 4017, options [nop,nop,TS val 298799 ecr 84743,mptcp dss ack 3454339951 seq 447304244 subseq 830909 len 1428 csum 0xa2e3], length 1428
10:43:17.309196 IP 112.26.0.8.44380 > 112.26.0.1.44877: Flags [.], ack 808061, win 24536, options [nop,nop,TS val 85500 ecr 296729,nop,nop,sack 2 {819485:825197}{815201:818057},mptcp dss ack 447152876], length 0
10:43:17.321749 IP 112.26.0.1.44877 > 112.26.0.8.44380: Flags [.], seq 833765:835193, ack 1, win 4017, options [nop,nop,TS val 299459 ecr 85500,mptcp dss ack 3454339951 seq 447311384 subseq 833765 len 1428 csum 0x37bb], length 1428
10:43:17.387581 IP 112.26.0.8.44380 > 112.26.0.1.44877: Flags [.], ack 808061, win 24536, options [nop,nop,TS val 85569 ecr 296729,nop,nop,sack 2 {819485:826625}{815201:818057},mptcp dss ack 447152876], length 0
10:43:17.424384 IP 112.26.0.1.44877 > 112.26.0.8.44380: Flags [.], seq 808061:809489, ack 1, win 4017, options [nop,nop,TS val 298944 ecr 84743,mptcp dss ack 3454339951 seq 447234272 subseq 808061 len 1428 csum 0x8ecc], length 1428
10:43:17.507067 IP 112.26.0.8.44380 > 112.26.0.1.44877: Flags [.], ack 808061, win 24136, options [nop,nop,TS val 85683 ecr 296729,nop,nop,sack 2 {819485:828053}{815201:818057},mptcp dss ack 447234272], length 0
10:43:17.507363 IP 112.26.0.1.44877 > 112.26.0.8.44380: Flags [.], seq 835193:836621, ack 1, win 4017, options [nop,nop,TS val 299645 ecr 85569,mptcp dss ack 3454339951 seq 447317096 subseq 835193 len 1428 csum 0xb444], length 1428
10:43:17.509165 IP 112.26.0.1.44877 > 112.26.0.8.44380: Flags [.], seq 836621:838049, ack 1, win 4017, options [nop,nop,TS val 299647 ecr 85683,mptcp dss ack 3454339951 seq 447318524 subseq 836621 len 1428 csum 0xe5a2], length 1428
10:43:17.584508 IP 112.26.0.8.44380 > 112.26.0.1.44877: Flags [.], ack 808061, win 24136, options [nop,nop,TS val 85769 ecr 296729,nop,nop,sack 2 {829481:830909}{819485:828053},mptcp dss ack 447234272], length 0
10:43:17.584921 IP 112.26.0.1.44877 > 112.26.0.8.44380: Flags [.], seq 828053:829481, ack 1, win 4017, options [nop,nop,TS val 299723 ecr 85769,mptcp dss ack 3454339951 seq 447287108 subseq 828053 len 1428 csum 0xf644], length 1428
10:43:17.629453 IP 112.26.0.1.44877 > 112.26.0.8.44380: Flags [.], seq 813773:815201, ack 1, win 4017, options [nop,nop,TS val 299167 ecr 85155,mptcp dss ack 3454339951 seq 447257120 subseq 813773 len 1428 csum 0x2803], length 1428
10:43:17.732802 IP 112.26.0.1.44877 > 112.26.0.8.44380: Flags [.], seq 832337:833765, ack 1, win 4017, options [nop,nop,TS val 299226 ecr 85155,mptcp dss ack 3454339951 seq 447268544 subseq 832337 len 1428 csum 0x86f3], length 1428
10:43:17.822940 IP 112.26.0.1.44877 > 112.26.0.8.44380: Flags [.], seq 818057:819485, ack 1, win 4017, options [nop,nop,TS val 299249 ecr 85234,mptcp dss ack 3454339951 seq 447268544 subseq 818057 len 1428 csum 0xbebb], length 1428
10:43:17.912745 IP 112.26.0.8.44380 > 112.26.0.1.44877: Flags [.], ack 808061, win 24136, options [nop,nop,TS val 86015 ecr 296729,nop,nop,sack 2 {829481:832337}{819485:828053},mptcp dss ack 447234272], length 0
10:43:17.951528 IP 112.26.0.1.44877 > 112.26.0.8.44380: Flags [.], seq 833765:835193, ack 1, win 4017, options [nop,nop,TS val 299459 ecr 85500,mptcp dss ack 3454339951 seq 447311384 subseq 833765 len 1428 csum 0x37bb], length 1428
10:43:17.953287 IP 112.26.0.1.44877 > 112.26.0.8.44380: Flags [.], seq 838049:839477, ack 1, win 4017, options [nop,nop,TS val 300092 ecr 86015,mptcp dss ack 3454339951 seq 447334232 subseq 838049 len 1428 csum 0xc342], length 1428
10:43:18.069007 IP 112.26.0.8.44380 > 112.26.0.1.44877: Flags [.], ack 813773, win 23968, options [nop,nop,TS val 86216 ecr 298944,nop,nop,sack 2 {829481:832337}{819485:828053},mptcp dss ack 447257120], length 0
10:43:18.069293 IP 112.26.0.1.44877 > 112.26.0.8.44380: Flags [.], seq 839477:840905, ack 1, win 4017, options [nop,nop,TS val 300208 ecr 86216,mptcp dss ack 3454339951 seq 447339944 subseq 839477 len 1428 csum 0xfa5c], length 1428
10:43:18.069369 IP 112.26.0.1.44877 > 112.26.0.8.44380: Flags [.], seq 840905:842333, ack 1, win 4017, options [nop,nop,TS val 300208 ecr 86216,mptcp dss ack 3454339951 seq 447341372 subseq 840905 len 1428 csum 0xed66], length 1428
10:43:18.143002 IP 112.26.0.1.44877 > 112.26.0.8.44380: Flags [.], seq 835193:836621, ack 1, win 4017, options [nop,nop,TS val 299645 ecr 85569,mptcp dss ack 3454339951 seq 447317096 subseq 835193 len 1428 csum 0xb444], length 1428
10:43:18.262157 IP 112.26.0.1.44877 > 112.26.0.8.44380: Flags [.], seq 836621:838049, ack 1, win 4017, options [nop,nop,TS val 299647 ecr 85683,mptcp dss ack 3454339951 seq 447318524 subseq 836621 len 1428 csum 0xe5a2], length 1428
10:43:18.352375 IP 112.26.0.1.44877 > 112.26.0.8.44380: Flags [.], seq 828053:829481, ack 1, win 4017, options [nop,nop,TS val 299723 ecr 85769,mptcp dss ack 3454339951 seq 447287108 subseq 828053 len 1428 csum 0xf644], length 1428
10:43:18.452385 IP 112.26.0.8.44380 > 112.26.0.1.44877: Flags [.], ack 818057, win 24241, options [nop,nop,TS val 86524 ecr 299167,nop,nop,sack 2 {829481:833765}{819485:828053},mptcp dss ack 447268544], length 0
10:43:18.452778 IP 112.26.0.1.44877 > 112.26.0.8.44380: Flags [.], seq 842333:843761, ack 1, win 4017, options [nop,nop,TS val 300591 ecr 86524,mptcp dss ack 3454339951 seq 447355652 subseq 842333 len 1428 csum 0x7257], length 1428
10:43:18.452895 IP 112.26.0.1.44877 > 112.26.0.8.44380: Flags [.], seq 843761:845189, ack 1, win 4017, options [nop,nop,TS val 300591 ecr 86524,mptcp dss ack 3454339951 seq 447357080 subseq 843761 len 1428 csum 0xb0ed], length 1428
10:43:18.516250 IP 112.26.0.8.44380 > 112.26.0.1.44877: Flags [.], ack 828053, win 24140, options [nop,nop,TS val 86622 ecr 299249,nop,nop,sack 1 {829481:833765},mptcp dss ack 447287108], length 0
10:43:18.516751 IP 112.26.0.1.44877 > 112.26.0.8.44380: Flags [.], seq 845189:846617, ack 1, win 4017, options [nop,nop,TS val 300655 ecr 86622,mptcp dss ack 3454339951 seq 447364220 subseq 845189 len 1428 csum 0x37f8], length 1428
10:43:18.576879 IP 112.26.0.1.44877 > 112.26.0.8.44380: Flags [.], seq 838049:839477, ack 1, win 4017, options [nop,nop,TS val 300092 ecr 86015,mptcp dss ack 3454339951 seq 447334232 subseq 838049 len 1428 csum 0xc342], length 1428
10:43:18.650442 IP 112.26.0.8.44380 > 112.26.0.1.44877: Flags [.], ack 828053, win 24362, options [nop,nop,TS val 86744 ecr 299249,nop,nop,sack 1 {829481:835193},mptcp dss ack 447289964], length 0
10:43:18.672402 IP 112.26.0.1.44877 > 112.26.0.8.44380: Flags [.], seq 846617:848045, ack 1, win 4017, options [nop,nop,TS val 300811 ecr 86744,mptcp dss ack 3454339951 seq 447369932 subseq 846617 len 1428 csum 0x6fce], length 1428
10:43:18.694724 IP 112.26.0.1.44877 > 112.26.0.8.44380: Flags [.], seq 839477:840905, ack 1, win 4017, options [nop,nop,TS val 300208 ecr 86216,mptcp dss ack 3454339951 seq 447339944 subseq 839477 len 1428 csum 0xfa5c], length 1428
10:43:18.775357 IP 112.26.0.1.44877 > 112.26.0.8.44380: Flags [.], seq 840905:842333, ack 1, win 4017, options [nop,nop,TS val 300208 ecr 86216,mptcp dss ack 3454339951 seq 447341372 subseq 840905 len 1428 csum 0xed66], length 1428
10:43:18.836909 IP 112.26.0.8.44380 > 112.26.0.1.44877: Flags [.], ack 828053, win 24540, options [nop,nop,TS val 86937 ecr 299249,nop,nop,sack 1 {829481:836621},mptcp dss ack 447311384], length 0
10:43:18.843970 IP 112.26.0.1.44877 > 112.26.0.8.44380: Flags [.], seq 848045:849473, ack 1, win 4017, options [nop,nop,TS val 300982 ecr 86937,mptcp dss ack 3454339951 seq 447374216 subseq 848045 len 1428 csum 0x7613], length 1428
10:43:18.897516 IP 112.26.0.8.44380 > 112.26.0.1.44877: Flags [.], ack 828053, win 24540, options [nop,nop,TS val 87056 ecr 299249,nop,nop,sack 1 {829481:838049},mptcp dss ack 447311384], length 0
10:43:18.902038 IP 112.26.0.1.44877 > 112.26.0.8.44380: Flags [.], seq 849473:850901, ack 1, win 4017, options [nop,nop,TS val 301040 ecr 87056,mptcp dss ack 3454339951 seq 447322808 subseq 849473 len 1428 csum 0xecc], length 1428
10:43:18.954524 IP 112.26.0.8.44380 > 112.26.0.1.44877: Flags [.], ack 838049, win 24445, options [nop,nop,TS val 87150 ecr 299723,mptcp dss ack 447319952], length 0
10:43:18.955011 IP 112.26.0.1.44877 > 112.26.0.8.44380: Flags [.], seq 850901:852329, ack 1, win 4017, options [nop,nop,TS val 301093 ecr 87150,mptcp dss ack 3454339951 seq 447335660 subseq 850901 len 1428 csum 0x7a46], length 1428
10:43:18.976025 IP 112.26.0.1.44877 > 112.26.0.8.44380: Flags [.], seq 842333:843761, ack 1, win 4017, options [nop,nop,TS val 300591 ecr 86524,mptcp dss ack 3454339951 seq 447355652 subseq 842333 len 1428 csum 0x7257], length 1428
10:43:19.093854 IP 112.26.0.1.44877 > 112.26.0.8.44380: Flags [.], seq 843761:845189, ack 1, win 4017, options [nop,nop,TS val 300591 ecr 86524,mptcp dss ack 3454339951 seq 447357080 subseq 843761 len 1428 csum 0xb0ed], length 1428
10:43:19.157204 IP 112.26.0.1.44877 > 112.26.0.8.44380: Flags [.], seq 845189:846617, ack 1, win 4017, options [nop,nop,TS val 300655 ecr 86622,mptcp dss ack 3454339951 seq 447364220 subseq 845189 len 1428 csum 0x37f8], length 1428
10:43:19.235633 IP 112.26.0.8.44380 > 112.26.0.1.44877: Flags [.], ack 839477, win 24525, options [nop,nop,TS val 87368 ecr 300092,mptcp dss ack 447319952], length 0
10:43:19.236141 IP 112.26.0.1.44877 > 112.26.0.8.44380: Flags [.], seq 852329:853757, ack 1, win 4017, options [nop,nop,TS val 301374 ecr 87368,mptcp dss ack 3454339951 seq 447379928 subseq 852329 len 1428 csum 0xf80d], length 1428
10:43:19.236203 IP 112.26.0.1.44877 > 112.26.0.8.44380: Flags [.], seq 853757:855185, ack 1, win 4017, options [nop,nop,TS val 301374 ecr 87368,mptcp dss ack 3454339951 seq 447381356 subseq 853757 len 1428 csum 0x8dbc], length 1428
10:43:19.319422 IP 112.26.0.1.44877 > 112.26.0.8.44380: Flags [.], seq 846617:848045, ack 1, win 4017, options [nop,nop,TS val 300811 ecr 86744,mptcp dss ack 3454339951 seq 447369932 subseq 846617 len 1428 csum 0x6fce], length 1428
10:43:19.380626 IP 112.26.0.8.44380 > 112.26.0.1.44877: Flags [.], ack 840905, win 24525, options [nop,nop,TS val 87489 ecr 300208,mptcp dss ack 447319952], length 0
10:43:19.381165 IP 112.26.0.1.44877 > 112.26.0.8.44380: Flags [.], seq 855185:856613, ack 1, win 4017, options [nop,nop,TS val 301519 ecr 87489,mptcp dss ack 3454339951 seq 447385640 subseq 855185 len 1428 csum 0xcdd6], length 1428
10:43:19.460081 IP 112.26.0.8.44380 > 112.26.0.1.44877: Flags [.], ack 842333, win 24525, options [nop,nop,TS val 87601 ecr 300208,mptcp dss ack 447319952], length 0
10:43:19.460442 IP 112.26.0.1.44877 > 112.26.0.8.44380: Flags [.], seq 856613:858041, ack 1, win 4017, options [nop,nop,TS val 301599 ecr 87601,mptcp dss ack 3454339951 seq 447388496 subseq 856613 len 1428 csum 0x2779], length 1428
10:43:19.460549 IP 112.26.0.1.44877 > 112.26.0.8.44380: Flags [.], seq 858041:859469, ack 1, win 4017, options [nop,nop,TS val 301599 ecr 87601,mptcp dss ack 3454339951 seq 447389924 subseq 858041 len 1428 csum 0x948], length 1428
10:43:19.533731 IP 112.26.0.1.44877 > 112.26.0.8.44380: Flags [.], seq 848045:849473, ack 1, win 4017, options [nop,nop,TS val 300982 ecr 86937,mptcp dss ack 3454339951 seq 447374216 subseq 848045 len 1428 csum 0x7613], length 1428
10:43:19.643848 IP 112.26.0.1.44877 > 112.26.0.8.44380: Flags [.], seq 850901:852329, ack 1, win 4017, options [nop,nop,TS val 301093 ecr 87150,mptcp dss ack 3454339951 seq 447335660 subseq 850901 len 1428 csum 0x7a46], length 1428
10:43:19.730250 IP 112.26.0.8.44380 > 112.26.0.1.44877: Flags [.], ack 843761, win 24525, options [nop,nop,TS val 87775 ecr 300591,mptcp dss ack 447319952], length 0
10:43:19.730586 IP 112.26.0.1.44877 > 112.26.0.8.44380: Flags [.], seq 859469:860897, ack 1, win 4017, options [nop,nop,TS val 301869 ecr 87775,mptcp dss ack 3454339951 seq 447397064 subseq 859469 len 1428 csum 0xac4b], length 1428
10:43:19.790356 IP 112.26.0.8.44380 > 112.26.0.1.44877: Flags [.], ack 845189, win 24525, options [nop,nop,TS val 87885 ecr 300591,mptcp dss ack 447319952], length 0
10:43:19.790684 IP 112.26.0.1.44877 > 112.26.0.8.44380: Flags [.], seq 860897:862325, ack 1, win 4017, options [nop,nop,TS val 301929 ecr 87885,mptcp dss ack 3454339951 seq 447401348 subseq 860897 len 1428 csum 0x866d], length 1428
10:43:19.844900 IP 112.26.0.8.44380 > 112.26.0.1.44877: Flags [.], ack 846617, win 24525, options [nop,nop,TS val 87954 ecr 300655,mptcp dss ack 447319952], length 0
10:43:19.845410 IP 112.26.0.1.44877 > 112.26.0.8.44380: Flags [.], seq 862325:863753, ack 1, win 4017, options [nop,nop,TS val 301984 ecr 87954,mptcp dss ack 3454339951 seq 447404204 subseq 862325 len 1428 csum 0x17f7], length 1428
10:43:19.918462 IP 112.26.0.1.44877 > 112.26.0.8.44380: Flags [.], seq 852329:853757, ack 1, win 4017, options [nop,nop,TS val 301374 ecr 87368,mptcp dss ack 3454339951 seq 447379928 subseq 852329 len 1428 csum 0xf80d], length 1428
10:43:20.006141 IP 112.26.0.8.44380 > 112.26.0.1.44877: Flags [.], ack 848045, win 24525, options [nop,nop,TS val 88111 ecr 300811,mptcp dss ack 447319952], length 0
10:43:20.006489 IP 112.26.0.1.44877 > 112.26.0.8.44380: Flags [.], seq 863753:865181, ack 1, win 4017, options [nop,nop,TS val 302145 ecr 88111,mptcp dss ack 3454339951 seq 447407060 subseq 863753 len 1428 csum 0xb3b3], length 1428
10:43:20.006566 IP 112.26.0.1.44877 > 112.26.0.8.44380: Flags [.], seq 865181:866609, ack 1, win 4017, options [nop,nop,TS val 302145 ecr 88111,mptcp dss ack 3454339951 seq 447408488 subseq 865181 len 1428 csum 0xd56b], length 1428
10:43:20.067207 IP 112.26.0.1.44877 > 112.26.0.8.44380: Flags [.], seq 855185:856613, ack 1, win 4017, options [nop,nop,TS val 301519 ecr 87489,mptcp dss ack 3454339951 seq 447385640 subseq 855185 len 1428 csum 0xcdd6], length 1428
10:43:20.167138 IP 112.26.0.1.44877 > 112.26.0.8.44380: Flags [.], seq 856613:858041, ack 1, win 4017, options [nop,nop,TS val 301599 ecr 87601,mptcp dss ack 3454339951 seq 447388496 subseq 856613 len 1428 csum 0x2779], length 1428
10:43:20.232889 IP 112.26.0.8.44380 > 112.26.0.1.44877: Flags [.], ack 849473, win 24415, options [nop,nop,TS val 88324 ecr 300982,mptcp dss ack 447327092], length 0
10:43:20.233251 IP 112.26.0.1.44877 > 112.26.0.8.44380: Flags [.], seq 866609:868037, ack 1, win 4017, options [nop,nop,TS val 302372 ecr 88324,mptcp dss ack 3454339951 seq 447417056 subseq 866609 len 1428 csum 0x5f01], length 1428
10:43:20.296497 IP 112.26.0.8.44380 > 112.26.0.1.44877: Flags [.], ack 849473, win 24415, options [nop,nop,TS val 88437 ecr 300982,nop,nop,sack 1 {850901:852329},mptcp dss ack 447327092], length 0
10:43:20.318055 IP 112.26.0.1.44877 > 112.26.0.8.44380: Flags [.], seq 868037:869465, ack 1, win 4017, options [nop,nop,TS val 302456 ecr 88437,mptcp dss ack 3454339951 seq 447421340 subseq 868037 len 1428 csum 0x8b8a], length 1428
10:43:20.331959 IP 112.26.0.1.44877 > 112.26.0.8.44380: Flags [.], seq 859469:860897, ack 1, win 4017, options [nop,nop,TS val 301869 ecr 87775,mptcp dss ack 3454339951 seq 447397064 subseq 859469 len 1428 csum 0xac4b], length 1428
10:43:20.387463 IP 112.26.0.1.44877 > 112.26.0.8.44380: Flags [.], seq 860897:862325, ack 1, win 4017, options [nop,nop,TS val 301929 ecr 87885,mptcp dss ack 3454339951 seq 447401348 subseq 860897 len 1428 csum 0x866d], length 1428
10:43:20.480523 IP 112.26.0.1.44877 > 112.26.0.8.44380: Flags [.], seq 862325:863753, ack 1, win 4017, options [nop,nop,TS val 301984 ecr 87954,mptcp dss ack 3454339951 seq 447404204 subseq 862325 len 1428 csum 0x17f7], length 1428
10:43:20.549935 IP 112.26.0.8.44380 > 112.26.0.1.44877: Flags [.], ack 849473, win 24415, options [nop,nop,TS val 88712 ecr 300982,nop,nop,sack 1 {850901:853757},mptcp dss ack 447327092], length 0
10:43:20.589752 IP 112.26.0.1.44877 > 112.26.0.8.44380: Flags [.], seq 863753:865181, ack 1, win 4017, options [nop,nop,TS val 302145 ecr 88111,mptcp dss ack 3454339951 seq 447407060 subseq 863753 len 1428 csum 0xb3b3], length 1428
10:43:20.650434 IP 112.26.0.1.44877 > 112.26.0.8.44380: Flags [.], seq 869465:870893, ack 1, win 4017, options [nop,nop,TS val 302788 ecr 88712,mptcp dss ack 3454339951 seq 447432764 subseq 869465 len 1428 csum 0x3604], length 1428
10:43:20.676590 IP 112.26.0.1.44877 > 112.26.0.8.44380: Flags [.], seq 865181:866609, ack 1, win 4017, options [nop,nop,TS val 302145 ecr 88111,mptcp dss ack 3454339951 seq 447408488 subseq 865181 len 1428 csum 0xd56b], length 1428
10:43:20.756987 IP 112.26.0.8.44380 > 112.26.0.1.44877: Flags [.], ack 849473, win 24415, options [nop,nop,TS val 88858 ecr 300982,nop,nop,sack 2 {855185:856613}{850901:853757},mptcp dss ack 447327092], length 0
10:43:20.757325 IP 112.26.0.1.44877 > 112.26.0.8.44380: Flags [.], seq 849473:850901, ack 1, win 4017, options [nop,nop,TS val 302895 ecr 88858,mptcp dss ack 3454339951 seq 447322808 subseq 849473 len 1428 csum 0xecc], length 1428
10:43:20.799112 IP 112.26.0.1.44877 > 112.26.0.8.44380: Flags [.], seq 866609:868037, ack 1, win 4017, options [nop,nop,TS val 302372 ecr 88324,mptcp dss ack 3454339951 seq 447417056 subseq 866609 len 1428 csum 0x5f01], length 1428
10:43:20.882834 IP 112.26.0.8.44380 > 112.26.0.1.44877: Flags [.], ack 849473, win 24339, options [nop,nop,TS val 89000 ecr 300982,nop,nop,sack 2 {855185:858041}{850901:853757},mptcp dss ack 447358508], length 0
10:43:20.883184 IP 112.26.0.1.44877 > 112.26.0.8.44380: Flags [.], seq 853757:855185, ack 1, win 4017, options [nop,nop,TS val 303021 ecr 89000,mptcp dss ack 3454339951 seq 447381356 subseq 853757 len 1428 csum 0x8dbc], length 1428
10:43:20.949138 IP 112.26.0.1.44877 > 112.26.0.8.44380: Flags [.], seq 868037:869465, ack 1, win 4017, options [nop,nop,TS val 302456 ecr 88437,mptcp dss ack 3454339951 seq 447421340 subseq 868037 len 1428 csum 0x8b8a], length 1428
10:43:21.054359 IP 112.26.0.8.44380 > 112.26.0.1.44877: Flags [.], ack 849473, win 24339, options [nop,nop,TS val 89124 ecr 300982,nop,nop,sack 2 {859469:860897}{855185:858041},mptcp dss ack 447358508], length 0
10:43:21.124229 IP 112.26.0.8.44380 > 112.26.0.1.44877: Flags [.], ack 849473, win 24339, options [nop,nop,TS val 89190 ecr 300982,nop,nop,sack 2 {859469:862325}{855185:858041},mptcp dss ack 447358508], length 0
10:43:21.124530 IP 112.26.0.1.44877 > 112.26.0.8.44380: Flags [.], seq 858041:859469, ack 1, win 4017, options [nop,nop,TS val 303262 ecr 89190,mptcp dss ack 3454339951 seq 447389924 subseq 858041 len 1428 csum 0x948], length 1428
10:43:21.169875 IP 112.26.0.8.44380 > 112.26.0.1.44877: Flags [.], ack 849473, win 24339, options [nop,nop,TS val 89285 ecr 300982,nop,nop,sack 2 {859469:863753}{855185:858041},mptcp dss ack 447358508], length 0
10:43:21.183225 IP 112.26.0.1.44877 > 112.26.0.8.44380: Flags [.], seq 870893:872321, ack 1, win 4017, options [nop,nop,TS val 303321 ecr 89285,mptcp dss ack 3454339951 seq 447455612 subseq 870893 len 1428 csum 0xb9f7], length 1428
10:43:21.207888 IP 112.26.0.8.44380 > 112.26.0.1.44877: Flags [.], ack 849473, win 24321, options [nop,nop,TS val 89383 ecr 300982,nop,nop,sack 2 {859469:865181}{855185:858041},mptcp dss ack 447371360], length 0
10:43:21.223422 IP 112.26.0.1.44877 > 112.26.0.8.44380: Flags [.], seq 872321:873749, ack 1, win 4017, options [nop,nop,TS val 303361 ecr 89383,mptcp dss ack 3454339951 seq 447458468 subseq 872321 len 1428 csum 0xdfdb], length 1428
10:43:21.263596 IP 112.26.0.1.44877 > 112.26.0.8.44380: Flags [.], seq 869465:870893, ack 1, win 4017, options [nop,nop,TS val 302788 ecr 88712,mptcp dss ack 3454339951 seq 447432764 subseq 869465 len 1428 csum 0x3604], length 1428
10:43:21.387922 IP 112.26.0.8.44380 > 112.26.0.1.44877: Flags [.], ack 849473, win 24321, options [nop,nop,TS val 89469 ecr 300982,nop,nop,sack 2 {859469:866609}{855185:858041},mptcp dss ack 447371360], length 0
10:43:21.405972 IP 112.26.0.1.44877 > 112.26.0.8.44380: Flags [.], seq 849473:850901, ack 1, win 4017, options [nop,nop,TS val 302895 ecr 88858,mptcp dss ack 3454339951 seq 447322808 subseq 849473 len 1428 csum 0xecc], length 1428
10:43:21.471928 IP 112.26.0.8.44380 > 112.26.0.1.44877: Flags [.], ack 849473, win 24324, options [nop,nop,TS val 89600 ecr 300982,nop,nop,sack 2 {859469:868037}{855185:858041},mptcp dss ack 447379928], length 0
10:43:21.472271 IP 112.26.0.1.44877 > 112.26.0.8.44380: Flags [.], seq 873749:875177, ack 1, win 4017, options [nop,nop,TS val 303611 ecr 89469,mptcp dss ack 3454339951 seq 447467036 subseq 873749 len 1428 csum 0xe181], length 1428
10:43:21.493873 IP 112.26.0.1.44877 > 112.26.0.8.44380: Flags [.], seq 875177:876605, ack 1, win 4017, options [nop,nop,TS val 303632 ecr 89600,mptcp dss ack 3454339951 seq 447468464 subseq 875177 len 1428 csum 0x8a8a], length 1428
10:43:21.534147 IP 112.26.0.1.44877 > 112.26.0.8.44380: Flags [.], seq 853757:855185, ack 1, win 4017, options [nop,nop,TS val 303021 ecr 89000,mptcp dss ack 3454339951 seq 447381356 subseq 853757 len 1428 csum 0x8dbc], length 1428
10:43:21.605082 IP 112.26.0.8.44380 > 112.26.0.1.44877: Flags [.], ack 849473, win 24324, options [nop,nop,TS val 89742 ecr 300982,nop,nop,sack 2 {859469:869465}{855185:858041},mptcp dss ack 447379928], length 0
10:43:21.611362 IP 112.26.0.1.44877 > 112.26.0.8.44380: Flags [.], seq 876605:878033, ack 1, win 4017, options [nop,nop,TS val 303750 ecr 89742,mptcp dss ack 3454339951 seq 447479888 subseq 876605 len 1428 csum 0x69f1], length 1428
10:43:21.671898 IP 112.26.0.1.44877 > 112.26.0.8.44380: Flags [.], seq 858041:859469, ack 1, win 4017, options [nop,nop,TS val 303262 ecr 89190,mptcp dss ack 3454339951 seq 447389924 subseq 858041 len 1428 csum 0x948], length 1428
10:43:21.770803 IP 112.26.0.1.44877 > 112.26.0.8.44380: Flags [.], seq 870893:872321, ack 1, win 4017, options [nop,nop,TS val 303321 ecr 89285,mptcp dss ack 3454339951 seq 447455612 subseq 870893 len 1428 csum 0xb9f7], length 1428
10:43:21.851070 IP 112.26.0.1.44877 > 112.26.0.8.44380: Flags [.], seq 872321:873749, ack 1, win 4017, options [nop,nop,TS val 303361 ecr 89383,mptcp dss ack 3454339951 seq 447458468 subseq 872321 len 1428 csum 0xdfdb], length 1428
10:43:21.917953 IP 112.26.0.8.44380 > 112.26.0.1.44877: Flags [.], ack 849473, win 24324, options [nop,nop,TS val 90054 ecr 300982,nop,nop,sack 2 {859469:870893}{855185:858041},mptcp dss ack 447379928], length 0
10:43:21.942471 IP 112.26.0.1.44877 > 112.26.0.8.44380: Flags [.], seq 878033:879461, ack 1, win 4017, options [nop,nop,TS val 304081 ecr 90054,mptcp dss ack 3454339951 seq 447494168 subseq 878033 len 1428 csum 0x60b1], length 1428
10:43:22.028989 IP 112.26.0.8.44380 > 112.26.0.1.44877: Flags [.], ack 853757, win 24302, options [nop,nop,TS val 90197 ecr 302895,nop,nop,sack 2 {859469:870893}{855185:858041},mptcp dss ack 447381356], length 0
10:43:22.029302 IP 112.26.0.1.44877 > 112.26.0.8.44380: Flags [.], seq 879461:880889, ack 1, win 4017, options [nop,nop,TS val 304167 ecr 90197,mptcp dss ack 3454339951 seq 447498452 subseq 879461 len 1428 csum 0xd062], length 1428
10:43:22.100861 IP 112.26.0.1.44877 > 112.26.0.8.44380: Flags [.], seq 873749:875177, ack 1, win 4017, options [nop,nop,TS val 303611 ecr 89469,mptcp dss ack 3454339951 seq 447467036 subseq 873749 len 1428 csum 0xe181], length 1428
10:43:22.179006 IP 112.26.0.8.44380 > 112.26.0.1.44877: Flags [.], ack 858041, win 24169, options [nop,nop,TS val 90325 ecr 303021,nop,nop,sack 1 {859469:870893},mptcp dss ack 447389924], length 0
10:43:22.179330 IP 112.26.0.1.44877 > 112.26.0.8.44380: Flags [.], seq 880889:882317, ack 1, win 4017, options [nop,nop,TS val 304317 ecr 90325,mptcp dss ack 3454339951 seq 447509876 subseq 880889 len 1428 csum 0xb552], length 1428
10:43:22.250554 IP 112.26.0.1.44877 > 112.26.0.8.44380: Flags [.], seq 876605:878033, ack 1, win 4017, options [nop,nop,TS val 303750 ecr 89742,mptcp dss ack 3454339951 seq 447479888 subseq 876605 len 1428 csum 0x69f1], length 1428
10:43:22.358493 IP 112.26.0.8.44380 > 112.26.0.1.44877: Flags [.], ack 870893, win 23918, options [nop,nop,TS val 90464 ecr 303262,mptcp dss ack 447449900], length 0
10:43:22.358885 IP 112.26.0.1.44877 > 112.26.0.8.44380: Flags [.], seq 882317:883745, ack 1, win 4017, options [nop,nop,TS val 304497 ecr 90464,mptcp dss ack 3454339951 seq 447517016 subseq 882317 len 1428 csum 0xc1da], length 1428
10:43:22.416065 IP 112.26.0.8.44380 > 112.26.0.1.44877: Flags [.], ack 872321, win 24558, options [nop,nop,TS val 90566 ecr 303321,mptcp dss ack 447457040], length 0
10:43:22.416417 IP 112.26.0.1.44877 > 112.26.0.8.44380: Flags [.], seq 883745:885173, ack 1, win 4017, options [nop,nop,TS val 304554 ecr 90566,mptcp dss ack 3454339951 seq 447525584 subseq 883745 len 1428 csum 0xd181], length 1428
10:43:22.480129 IP 112.26.0.8.44380 > 112.26.0.1.44877: Flags [.], ack 873749, win 24558, options [nop,nop,TS val 90652 ecr 303361,mptcp dss ack 447459896], length 0
10:43:22.480486 IP 112.26.0.1.44877 > 112.26.0.8.44380: Flags [.], seq 885173:886601, ack 1, win 4017, options [nop,nop,TS val 304618 ecr 90652,mptcp dss ack 3454339951 seq 447527012 subseq 885173 len 1428 csum 0xa9d4], length 1428
10:43:22.509773 IP 112.26.0.1.44877 > 112.26.0.8.44380: Flags [.], seq 878033:879461, ack 1, win 4017, options [nop,nop,TS val 304081 ecr 90054,mptcp dss ack 3454339951 seq 447494168 subseq 878033 len 1428 csum 0x60b1], length 1428
10:43:22.562117 IP 112.26.0.8.44380 > 112.26.0.1.44877: Flags [.], ack 875177, win 24558, options [nop,nop,TS val 90893 ecr 303611,mptcp dss ack 447468464], length 0
10:43:22.562441 IP 112.26.0.1.44877 > 112.26.0.8.44380: Flags [.], seq 886601:888029, ack 1, win 4017, options [nop,nop,TS val 304700 ecr 90893,mptcp dss ack 3454339951 seq 447532724 subseq 886601 len 1428 csum 0xa568], length 1428
10:43:22.562517 IP 112.26.0.1.44877 > 112.26.0.8.44380: Flags [.], seq 888029:889457, ack 1, win 4017, options [nop,nop,TS val 304700 ecr 90893,mptcp dss ack 3454339951 seq 447534152 subseq 888029 len 1428 csum 0xac53], length 1428
10:43:22.648697 IP 112.26.0.1.44877 > 112.26.0.8.44380: Flags [.], seq 879461:880889, ack 1, win 4017, options [nop,nop,TS val 304167 ecr 90197,mptcp dss ack 3454339951 seq 447498452 subseq 879461 len 1428 csum 0xd062], length 1428
10:43:22.721546 IP 112.26.0.1.44877 > 112.26.0.8.44380: Flags [.], seq 880889:882317, ack 1, win 4017, options [nop,nop,TS val 304317 ecr 90325,mptcp dss ack 3454339951 seq 447509876 subseq 880889 len 1428 csum 0xb552], length 1428
10:43:22.813843 IP 112.26.0.8.44380 > 112.26.0.1.44877: Flags [.], ack 875177, win 24558, options [nop,nop,TS val 91042 ecr 303611,nop,nop,sack 1 {876605:878033},mptcp dss ack 447468464], length 0
10:43:22.818478 IP 112.26.0.1.44877 > 112.26.0.8.44380: Flags [.], seq 889457:890885, ack 1, win 4017, options [nop,nop,TS val 304957 ecr 91042,mptcp dss ack 3454339951 seq 447545576 subseq 889457 len 1428 csum 0x17a], length 1428
10:43:22.880140 IP 112.26.0.1.44877 > 112.26.0.8.44380: Flags [.], seq 882317:883745, ack 1, win 4017, options [nop,nop,TS val 304497 ecr 90464,mptcp dss ack 3454339951 seq 447517016 subseq 882317 len 1428 csum 0xc1da], length 1428
10:43:22.959432 IP 112.26.0.1.44877 > 112.26.0.8.44380: Flags [.], seq 883745:885173, ack 1, win 4017, options [nop,nop,TS val 304554 ecr 90566,mptcp dss ack 3454339951 seq 447525584 subseq 883745 len 1428 csum 0xd181], length 1428
10:43:23.047781 IP 112.26.0.1.44877 > 112.26.0.8.44380: Flags [.], seq 885173:886601, ack 1, win 4017, options [nop,nop,TS val 304618 ecr 90652,mptcp dss ack 3454339951 seq 447527012 subseq 885173 len 1428 csum 0xa9d4], length 1428
10:43:23.126464 IP 112.26.0.8.44380 > 112.26.0.1.44877: Flags [.], ack 875177, win 24558, options [nop,nop,TS val 91300 ecr 303611,nop,nop,sack 1 {876605:879461},mptcp dss ack 447468464], length 0
10:43:23.156560 IP 112.26.0.1.44877 > 112.26.0.8.44380: Flags [.], seq 890885:892313, ack 1, win 4017, options [nop,nop,TS val 305295 ecr 91300,mptcp dss ack 3454339951 seq 447564140 subseq 890885 len 1428 csum 0xb138], length 1428
10:43:23.165498 IP 112.26.0.1.44877 > 112.26.0.8.44380: Flags [.], seq 886601:888029, ack 1, win 4017, options [nop,nop,TS val 304700 ecr 90893,mptcp dss ack 3454339951 seq 447532724 subseq 886601 len 1428 csum 0xa568], length 1428
10:43:23.276763 IP 112.26.0.1.44877 > 112.26.0.8.44380: Flags [.], seq 888029:889457, ack 1, win 4017, options [nop,nop,TS val 304700 ecr 90893,mptcp dss ack 3454339951 seq 447534152 subseq 888029 len 1428 csum 0xac53], length 1428
10:43:23.332402 IP 112.26.0.8.44380 > 112.26.0.1.44877: Flags [.], ack 875177, win 24558, options [nop,nop,TS val 91440 ecr 303611,nop,nop,sack 1 {876605:880889},mptcp dss ack 447468464], length 0
10:43:23.332770 IP 112.26.0.1.44877 > 112.26.0.8.44380: Flags [.], seq 875177:876605, ack 1, win 4017, options [nop,nop,TS val 305471 ecr 91440,mptcp dss ack 3454339951 seq 447468464 subseq 875177 len 1428 csum 0x8a8a], length 1428
10:43:23.378117 IP 112.26.0.8.44380 > 112.26.0.1.44877: Flags [.], ack 875177, win 24558, options [nop,nop,TS val 91518 ecr 303611,nop,nop,sack 1 {876605:882317},mptcp dss ack 447468464], length 0
10:43:23.381344 IP 112.26.0.1.44877 > 112.26.0.8.44380: Flags [.], seq 892313:893741, ack 1, win 4017, options [nop,nop,TS val 305520 ecr 91518,mptcp dss ack 3454339951 seq 447575564 subseq 892313 len 1428 csum 0x497c], length 1428
10:43:23.456800 IP 112.26.0.1.44877 > 112.26.0.8.44380: Flags [.], seq 889457:890885, ack 1, win 4017, options [nop,nop,TS val 304957 ecr 91042,mptcp dss ack 3454339951 seq 447545576 subseq 889457 len 1428 csum 0x17a], length 1428
10:43:23.544325 IP 112.26.0.8.44380 > 112.26.0.1.44877: Flags [.], ack 875177, win 24558, options [nop,nop,TS val 91671 ecr 303611,nop,nop,sack 1 {876605:883745},mptcp dss ack 447468464], length 0
10:43:23.589250 IP 112.26.0.8.44380 > 112.26.0.1.44877: Flags [.], ack 875177, win 24558, options [nop,nop,TS val 91750 ecr 303611,nop,nop,sack 1 {876605:885173},mptcp dss ack 447468464], length 0
10:43:23.589592 IP 112.26.0.1.44877 > 112.26.0.8.44380: Flags [.], seq 893741:895169, ack 1, win 4017, options [nop,nop,TS val 305728 ecr 91671,mptcp dss ack 3454339951 seq 447584132 subseq 893741 len 1428 csum 0x7e90], length 1428
10:43:23.619070 IP 112.26.0.8.44380 > 112.26.0.1.44877: Flags [.], ack 875177, win 24558, options [nop,nop,TS val 91848 ecr 303611,nop,nop,sack 1 {876605:886601},mptcp dss ack 447468464], length 0
10:43:23.673348 IP 112.26.0.1.44877 > 112.26.0.8.44380: Flags [.], seq 890885:892313, ack 1, win 4017, options [nop,nop,TS val 305295 ecr 91300,mptcp dss ack 3454339951 seq 447564140 subseq 890885 len 1428 csum 0xb138], length 1428
10:43:23.753286 IP 112.26.0.8.44380 > 112.26.0.1.44877: Flags [.], ack 875177, win 24558, options [nop,nop,TS val 91958 ecr 303611,nop,nop,sack 1 {876605:888029},mptcp dss ack 447468464], length 0
10:43:23.807831 IP 112.26.0.8.44380 > 112.26.0.1.44877: Flags [.], ack 875177, win 24558, options [nop,nop,TS val 92068 ecr 303611,nop,nop,sack 1 {876605:889457},mptcp dss ack 447468464], length 0
10:43:23.808156 IP 112.26.0.1.44877 > 112.26.0.8.44380: Flags [.], seq 895169:896597, ack 1, win 4017, options [nop,nop,TS val 305946 ecr 91958,mptcp dss ack 3454339951 seq 447589844 subseq 895169 len 1428 csum 0x7a6b], length 1428
10:43:23.817373 IP 112.26.0.1.44877 > 112.26.0.8.44380: Flags [.], seq 896597:898025, ack 1, win 4017, options [nop,nop,TS val 305955 ecr 92068,mptcp dss ack 3454339951 seq 447591272 subseq 896597 len 1428 csum 0x3398], length 1428
10:43:23.862222 IP 112.26.0.1.44877 > 112.26.0.8.44380: Flags [.], seq 875177:876605, ack 1, win 4017, options [nop,nop,TS val 305471 ecr 91440,mptcp dss ack 3454339951 seq 447468464 subseq 875177 len 1428 csum 0x8a8a], length 1428
10:43:23.978502 IP 112.26.0.1.44877 > 112.26.0.8.44380: Flags [.], seq 892313:893741, ack 1, win 4017, options [nop,nop,TS val 305520 ecr 91518,mptcp dss ack 3454339951 seq 447575564 subseq 892313 len 1428 csum 0x497c], length 1428
10:43:24.056222 IP 112.26.0.8.44380 > 112.26.0.1.44877: Flags [.], ack 875177, win 24558, options [nop,nop,TS val 92248 ecr 303611,nop,nop,sack 1 {876605:890885},mptcp dss ack 447468464], length 0
10:43:24.090947 IP 112.26.0.1.44877 > 112.26.0.8.44380: Flags [.], seq 898025:899453, ack 1, win 4017, options [nop,nop,TS val 306229 ecr 92248,mptcp dss ack 3454339951 seq 447609836 subseq 898025 len 1428 csum 0xb5be], length 1428
10:43:24.129449 IP 112.26.0.1.44877 > 112.26.0.8.44380: Flags [.], seq 893741:895169, ack 1, win 4017, options [nop,nop,TS val 305728 ecr 91671,mptcp dss ack 3454339951 seq 447584132 subseq 893741 len 1428 csum 0x7e90], length 1428
10:43:24.208624 IP 112.26.0.8.44380 > 112.26.0.1.44877: Flags [.], ack 875177, win 24558, options [nop,nop,TS val 92465 ecr 303611,nop,nop,sack 1 {876605:892313},mptcp dss ack 447468464], length 0
10:43:24.241118 IP 112.26.0.1.44877 > 112.26.0.8.44380: Flags [.], seq 899453:900881, ack 1, win 4017, options [nop,nop,TS val 306379 ecr 92465,mptcp dss ack 3454339951 seq 447621260 subseq 899453 len 1428 csum 0x1594], length 1428
10:43:24.266456 IP 112.26.0.1.44877 > 112.26.0.8.44380: Flags [.], seq 895169:896597, ack 1, win 4017, options [nop,nop,TS val 305946 ecr 91958,mptcp dss ack 3454339951 seq 447589844 subseq 895169 len 1428 csum 0x7a6b], length 1428
10:43:24.336483 IP 112.26.0.8.44380 > 112.26.0.1.44877: Flags [.], ack 892313, win 24068, options [nop,nop,TS val 92653 ecr 305471,mptcp dss ack 447499880], length 0
10:43:24.336895 IP 112.26.0.1.44877 > 112.26.0.8.44380: Flags [.], seq 900881:902309, ack 1, win 4017, options [nop,nop,TS val 306475 ecr 92653,mptcp dss ack 3454339951 seq 447629828 subseq 900881 len 1428 csum 0x7c44], length 1428
10:43:24.399688 IP 112.26.0.1.44877 > 112.26.0.8.44380: Flags [.], seq 896597:898025, ack 1, win 4017, options [nop,nop,TS val 305955 ecr 92068,mptcp dss ack 3454339951 seq 447591272 subseq 896597 len 1428 csum 0x3398], length 1428
10:43:24.547132 IP 112.26.0.8.44380 > 112.26.0.1.44877: Flags [.], ack 893741, win 24068, options [nop,nop,TS val 92773 ecr 305520,mptcp dss ack 447499880], length 0
10:43:24.547486 IP 112.26.0.1.44877 > 112.26.0.8.44380: Flags [.], seq 902309:903737, ack 1, win 4017, options [nop,nop,TS val 306685 ecr 92773,mptcp dss ack 3454339951 seq 447641252 subseq 902309 len 1428 csum 0xe6f7], length 1428
10:43:24.596350 IP 112.26.0.1.44877 > 112.26.0.8.44380: Flags [.], seq 898025:899453, ack 1, win 4017, options [nop,nop,TS val 306229 ecr 92248,mptcp dss ack 3454339951 seq 447609836 subseq 898025 len 1428 csum 0xb5be], length 1428
10:43:24.673209 IP 112.26.0.8.44380 > 112.26.0.1.44877: Flags [.], ack 895169, win 24068, options [nop,nop,TS val 92924 ecr 305728,mptcp dss ack 447499880], length 0
10:43:24.673567 IP 112.26.0.1.44877 > 112.26.0.8.44380: Flags [.], seq 903737:905165, ack 1, win 4017, options [nop,nop,TS val 306811 ecr 92924,mptcp dss ack 3454339951 seq 447642680 subseq 903737 len 1428 csum 0x8cf7], length 1428
10:43:24.728735 IP 112.26.0.1.44877 > 112.26.0.8.44380: Flags [.], seq 899453:900881, ack 1, win 4017, options [nop,nop,TS val 306379 ecr 92465,mptcp dss ack 3454339951 seq 447621260 subseq 899453 len 1428 csum 0x1594], length 1428
10:43:24.818731 IP 112.26.0.8.44380 > 112.26.0.1.44877: Flags [.], ack 896597, win 24068, options [nop,nop,TS val 93061 ecr 305946,mptcp dss ack 447499880], length 0
10:43:24.819075 IP 112.26.0.1.44877 > 112.26.0.8.44380: Flags [.], seq 905165:906593, ack 1, win 4017, options [nop,nop,TS val 306957 ecr 93061,mptcp dss ack 3454339951 seq 447654104 subseq 905165 len 1428 csum 0xfd46], length 1428
10:43:24.866887 IP 112.26.0.1.44877 > 112.26.0.8.44380: Flags [.], seq 900881:902309, ack 1, win 4017, options [nop,nop,TS val 306475 ecr 92653,mptcp dss ack 3454339951 seq 447629828 subseq 900881 len 1428 csum 0x7c44], length 1428
10:43:24.957256 IP 112.26.0.8.44380 > 112.26.0.1.44877: Flags [.], ack 898025, win 24068, options [nop,nop,TS val 93192 ecr 305955,mptcp dss ack 447499880], length 0
10:43:24.957869 IP 112.26.0.1.44877 > 112.26.0.8.44380: Flags [.], seq 906593:908021, ack 1, win 4017, options [nop,nop,TS val 307096 ecr 93192,mptcp dss ack 3454339951 seq 447658388 subseq 906593 len 1428 csum 0x74eb], length 1428
10:43:25.012115 IP 112.26.0.1.44877 > 112.26.0.8.44380: Flags [.], seq 902309:903737, ack 1, win 4017, options [nop,nop,TS val 306685 ecr 92773,mptcp dss ack 3454339951 seq 447641252 subseq 902309 len 1428 csum 0xe6f7], length 1428
10:43:25.098772 IP 112.26.0.8.44380 > 112.26.0.1.44877: Flags [.], ack 899453, win 24357, options [nop,nop,TS val 93388 ecr 306229,mptcp dss ack 447574136], length 0
10:43:25.099043 IP 112.26.0.1.44877 > 112.26.0.8.44380: Flags [.], seq 908021:909449, ack 1, win 4017, options [nop,nop,TS val 307237 ecr 93388,mptcp dss ack 3454339951 seq 447668384 subseq 908021 len 1428 csum 0xc47], length 1428
10:43:25.135569 IP 112.26.0.1.44877 > 112.26.0.8.44380: Flags [.], seq 903737:905165, ack 1, win 4017, options [nop,nop,TS val 306811 ecr 92924,mptcp dss ack 3454339951 seq 447642680 subseq 903737 len 1428 csum 0x8cf7], length 1428
10:43:25.206548 IP 112.26.0.8.44380 > 112.26.0.1.44877: Flags [.], ack 900881, win 24339, options [nop,nop,TS val 93521 ecr 306379,mptcp dss ack 447578420], length 0
10:43:25.206916 IP 112.26.0.1.44877 > 112.26.0.8.44380: Flags [.], seq 909449:910877, ack 1, win 4017, options [nop,nop,TS val 307345 ecr 93521,mptcp dss ack 3454339951 seq 447675524 subseq 909449 len 1428 csum 0xb84a], length 1428
10:43:25.207054 IP 112.26.0.1.44877 > 112.26.0.8.44380: Flags [.], seq 910877:912305, ack 1, win 4017, options [nop,nop,TS val 307345 ecr 93521,mptcp dss ack 3454339951 seq 447676952 subseq 910877 len 1428 csum 0x221e], length 1428
10:43:25.273053 IP 112.26.0.1.44877 > 112.26.0.8.44380: Flags [.], seq 905165:906593, ack 1, win 4017, options [nop,nop,TS val 306957 ecr 93061,mptcp dss ack 3454339951 seq 447654104 subseq 905165 len 1428 csum 0xfd46], length 1428
10:43:25.388513 IP 112.26.0.8.44380 > 112.26.0.1.44877: Flags [.], ack 902309, win 24317, options [nop,nop,TS val 93657 ecr 306475,mptcp dss ack 447579848], length 0
10:43:25.388875 IP 112.26.0.1.44877 > 112.26.0.8.44380: Flags [.], seq 912305:913733, ack 1, win 4017, options [nop,nop,TS val 307527 ecr 93657,mptcp dss ack 3454339951 seq 447686948 subseq 912305 len 1428 csum 0x2f95], length 1428
10:43:25.450157 IP 112.26.0.1.44877 > 112.26.0.8.44380: Flags [.], seq 906593:908021, ack 1, win 4017, options [nop,nop,TS val 307096 ecr 93192,mptcp dss ack 3454339951 seq 447658388 subseq 906593 len 1428 csum 0x74eb], length 1428
10:43:25.547870 IP 112.26.0.8.44380 > 112.26.0.1.44877: Flags [.], ack 903737, win 24344, options [nop,nop,TS val 93804 ecr 306685,mptcp dss ack 447592700], length 0
10:43:25.548214 IP 112.26.0.1.44877 > 112.26.0.8.44380: Flags [.], seq 913733:915161, ack 1, win 4017, options [nop,nop,TS val 307687 ecr 93804,mptcp dss ack 3454339951 seq 447695516 subseq 913733 len 1428 csum 0xe626], length 1428
10:43:25.632978 IP 112.26.0.1.44877 > 112.26.0.8.44380: Flags [.], seq 908021:909449, ack 1, win 4017, options [nop,nop,TS val 307237 ecr 93388,mptcp dss ack 3454339951 seq 447668384 subseq 908021 len 1428 csum 0xc47], length 1428
10:43:25.706192 IP 112.26.0.8.44380 > 112.26.0.1.44877: Flags [.], ack 905165, win 24322, options [nop,nop,TS val 93926 ecr 306811,mptcp dss ack 447594128], length 0
10:43:25.706541 IP 112.26.0.1.44877 > 112.26.0.8.44380: Flags [.], seq 915161:916589, ack 1, win 4017, options [nop,nop,TS val 307845 ecr 93926,mptcp dss ack 3454339951 seq 447708368 subseq 915161 len 1428 csum 0x1725], length 1428
10:43:25.777881 IP 112.26.0.1.44877 > 112.26.0.8.44380: Flags [.], seq 909449:910877, ack 1, win 4017, options [nop,nop,TS val 307345 ecr 93521,mptcp dss ack 3454339951 seq 447675524 subseq 909449 len 1428 csum 0xb84a], length 1428
10:43:25.875989 IP 112.26.0.8.44380 > 112.26.0.1.44877: Flags [.], ack 906593, win 24300, options [nop,nop,TS val 94064 ecr 306957,mptcp dss ack 447595556], length 0
10:43:25.876289 IP 112.26.0.1.44877 > 112.26.0.8.44380: Flags [.], seq 916589:918017, ack 1, win 4017, options [nop,nop,TS val 308015 ecr 94064,mptcp dss ack 3454339951 seq 447711224 subseq 916589 len 1428 csum 0xe54f], length 1428
10:43:25.956020 IP 112.26.0.1.44877 > 112.26.0.8.44380: Flags [.], seq 910877:912305, ack 1, win 4017, options [nop,nop,TS val 307345 ecr 93521,mptcp dss ack 3454339951 seq 447676952 subseq 910877 len 1428 csum 0x221e], length 1428
10:43:26.024964 IP 112.26.0.1.44877 > 112.26.0.8.44380: Flags [.], seq 912305:913733, ack 1, win 4017, options [nop,nop,TS val 307527 ecr 93657,mptcp dss ack 3454339951 seq 447686948 subseq 912305 len 1428 csum 0x2f95], length 1428
10:43:26.105088 IP 112.26.0.8.44380 > 112.26.0.1.44877: Flags [.], ack 908021, win 24300, options [nop,nop,TS val 94253 ecr 307096,mptcp dss ack 447595556], length 0
10:43:26.105435 IP 112.26.0.1.44877 > 112.26.0.8.44380: Flags [.], seq 918017:919445, ack 1, win 4017, options [nop,nop,TS val 308244 ecr 94253,mptcp dss ack 3454339951 seq 447724076 subseq 918017 len 1428 csum 0x3fed], length 1428
10:43:26.168625 IP 112.26.0.1.44877 > 112.26.0.8.44380: Flags [.], seq 913733:915161, ack 1, win 4017, options [nop,nop,TS val 307687 ecr 93804,mptcp dss ack 3454339951 seq 447695516 subseq 913733 len 1428 csum 0xe626], length 1428
10:43:26.244476 IP 112.26.0.8.44380 > 112.26.0.1.44877: Flags [.], ack 909449, win 24300, options [nop,nop,TS val 94424 ecr 307237,mptcp dss ack 447595556], length 0
10:43:26.244839 IP 112.26.0.1.44877 > 112.26.0.8.44380: Flags [.], seq 919445:920873, ack 1, win 4017, options [nop,nop,TS val 308383 ecr 94424,mptcp dss ack 3454339951 seq 447726932 subseq 919445 len 1428 csum 0xeca6], length 1428
10:43:26.295766 IP 112.26.0.1.44877 > 112.26.0.8.44380: Flags [.], seq 915161:916589, ack 1, win 4017, options [nop,nop,TS val 307845 ecr 93926,mptcp dss ack 3454339951 seq 447708368 subseq 915161 len 1428 csum 0x1725], length 1428
10:43:26.366867 IP 112.26.0.8.44380 > 112.26.0.1.44877: Flags [.], ack 910877, win 24300, options [nop,nop,TS val 94569 ecr 307345,mptcp dss ack 447595556], length 0
10:43:26.367379 IP 112.26.0.1.44877 > 112.26.0.8.44380: Flags [.], seq 920873:922301, ack 1, win 4017, options [nop,nop,TS val 308505 ecr 94569,mptcp dss ack 3454339951 seq 447734072 subseq 920873 len 1428 csum 0x4e5b], length 1428
10:43:26.445469 IP 112.26.0.1.44877 > 112.26.0.8.44380: Flags [.], seq 916589:918017, ack 1, win 4017, options [nop,nop,TS val 308015 ecr 94064,mptcp dss ack 3454339951 seq 447711224 subseq 916589 len 1428 csum 0xe54f], length 1428
10:43:26.521111 IP 112.26.0.8.44380 > 112.26.0.1.44877: Flags [.], ack 912305, win 24300, options [nop,nop,TS val 94747 ecr 307345,mptcp dss ack 447595556], length 0
10:43:26.521460 IP 112.26.0.1.44877 > 112.26.0.8.44380: Flags [.], seq 922301:923729, ack 1, win 4017, options [nop,nop,TS val 308660 ecr 94747,mptcp dss ack 3454339951 seq 447736928 subseq 922301 len 1428 csum 0xdb1a], length 1428
10:43:26.521536 IP 112.26.0.1.44877 > 112.26.0.8.44380: Flags [.], seq 923729:925157, ack 1, win 4017, options [nop,nop,TS val 308660 ecr 94747,mptcp dss ack 3454339951 seq 447738356 subseq 923729 len 1428 csum 0x3e0], length 1428
10:43:26.576698 IP 112.26.0.8.44380 > 112.26.0.1.44877: Flags [.], ack 913733, win 24300, options [nop,nop,TS val 94822 ecr 307527,mptcp dss ack 447595556], length 0
10:43:26.577122 IP 112.26.0.1.44877 > 112.26.0.8.44380: Flags [.], seq 925157:926585, ack 1, win 4017, options [nop,nop,TS val 308715 ecr 94822,mptcp dss ack 3454339951 seq 447741212 subseq 925157 len 1428 csum 0xd563], length 1428
10:43:26.674401 IP 112.26.0.1.44877 > 112.26.0.8.44380: Flags [.], seq 918017:919445, ack 1, win 4017, options [nop,nop,TS val 308244 ecr 94253,mptcp dss ack 3454339951 seq 447724076 subseq 918017 len 1428 csum 0x3fed], length 1428
10:43:26.717547 IP 112.26.0.8.44380 > 112.26.0.1.44877: Flags [.], ack 915161, win 24300, options [nop,nop,TS val 95002 ecr 307687,mptcp dss ack 447595556], length 0
10:43:26.717910 IP 112.26.0.1.44877 > 112.26.0.8.44380: Flags [.], seq 926585:928013, ack 1, win 4017, options [nop,nop,TS val 308856 ecr 95002,mptcp dss ack 3454339951 seq 447744068 subseq 926585 len 1428 csum 0xb2bc], length 1428
10:43:26.826140 IP 112.26.0.1.44877 > 112.26.0.8.44380: Flags [.], seq 919445:920873, ack 1, win 4017, options [nop,nop,TS val 308383 ecr 94424,mptcp dss ack 3454339951 seq 447726932 subseq 919445 len 1428 csum 0xeca6], length 1428
10:43:26.903087 IP 112.26.0.8.44380 > 112.26.0.1.44877: Flags [.], ack 916589, win 24300, options [nop,nop,TS val 95128 ecr 307845,mptcp dss ack 447595556], length 0
10:43:26.903452 IP 112.26.0.1.44877 > 112.26.0.8.44380: Flags [.], seq 928013:929441, ack 1, win 4017, options [nop,nop,TS val 309042 ecr 95128,mptcp dss ack 3454339951 seq 447746924 subseq 928013 len 1428 csum 0x7d5c], length 1428
10:43:26.903529 IP 112.26.0.1.44877 > 112.26.0.8.44380: Flags [.], seq 929441:930869, ack 1, win 4017, options [nop,nop,TS val 309042 ecr 95128,mptcp dss ack 3454339951 seq 447748352 subseq 929441 len 1428 csum 0x5335], length 1428
10:43:26.999014 IP 112.26.0.1.44877 > 112.26.0.8.44380: Flags [.], seq 920873:922301, ack 1, win 4017, options [nop,nop,TS val 308505 ecr 94569,mptcp dss ack 3454339951 seq 447734072 subseq 920873 len 1428 csum 0x4e5b], length 1428
10:43:27.078239 IP 112.26.0.8.44380 > 112.26.0.1.44877: Flags [.], ack 918017, win 24300, options [nop,nop,TS val 95278 ecr 308015,mptcp dss ack 447595556], length 0
10:43:27.078613 IP 112.26.0.1.44877 > 112.26.0.8.44380: Flags [.], seq 930869:932297, ack 1, win 4017, options [nop,nop,TS val 309217 ecr 95278,mptcp dss ack 3454339951 seq 447749780 subseq 930869 len 1428 csum 0xc308], length 1428
10:43:27.142922 IP 112.26.0.1.44877 > 112.26.0.8.44380: Flags [.], seq 922301:923729, ack 1, win 4017, options [nop,nop,TS val 308660 ecr 94747,mptcp dss ack 3454339951 seq 447736928 subseq 922301 len 1428 csum 0xdb1a], length 1428
10:43:27.209809 IP 112.26.0.1.44877 > 112.26.0.8.44380: Flags [.], seq 923729:925157, ack 1, win 4017, options [nop,nop,TS val 308660 ecr 94747,mptcp dss ack 3454339951 seq 447738356 subseq 923729 len 1428 csum 0x3e0], length 1428
10:43:27.281832 IP 112.26.0.1.44877 > 112.26.0.8.44380: Flags [.], seq 925157:926585, ack 1, win 4017, options [nop,nop,TS val 308715 ecr 94822,mptcp dss ack 3454339951 seq 447741212 subseq 925157 len 1428 csum 0xd563], length 1428
10:43:27.371840 IP 112.26.0.8.44380 > 112.26.0.1.44877: Flags [.], ack 919445, win 24300, options [nop,nop,TS val 95511 ecr 308244,mptcp dss ack 447595556], length 0
10:43:27.372199 IP 112.26.0.1.44877 > 112.26.0.8.44380: Flags [.], seq 932297:933725, ack 1, win 4017, options [nop,nop,TS val 309510 ecr 95511,mptcp dss ack 3454339951 seq 447754064 subseq 932297 len 1428 csum 0xee3], length 1428
10:43:27.372275 IP 112.26.0.1.44877 > 112.26.0.8.44380: Flags [.], seq 933725:935153, ack 1, win 4017, options [nop,nop,TS val 309510 ecr 95511,mptcp dss ack 3454339951 seq 447755492 subseq 933725 len 1428 csum 0xcee9], length 1428
10:43:27.435342 IP 112.26.0.1.44877 > 112.26.0.8.44380: Flags [.], seq 926585:928013, ack 1, win 4017, options [nop,nop,TS val 308856 ecr 95002,mptcp dss ack 3454339951 seq 447744068 subseq 926585 len 1428 csum 0xb2bc], length 1428
10:43:27.539609 IP 112.26.0.8.44380 > 112.26.0.1.44877: Flags [.], ack 920873, win 24300, options [nop,nop,TS val 95659 ecr 308383,mptcp dss ack 447595556], length 0
10:43:27.540024 IP 112.26.0.1.44877 > 112.26.0.8.44380: Flags [.], seq 935153:936581, ack 1, win 4017, options [nop,nop,TS val 309678 ecr 95659,mptcp dss ack 3454339951 seq 447761204 subseq 935153 len 1428 csum 0xaccc], length 1428
10:43:27.540086 IP 112.26.0.1.44877 > 112.26.0.8.44380: Flags [.], seq 936581:938009, ack 1, win 4017, options [nop,nop,TS val 309678 ecr 95659,mptcp dss ack 3454339951 seq 447762632 subseq 936581 len 1428 csum 0x1a9f], length 1428
10:43:27.594973 IP 112.26.0.1.44877 > 112.26.0.8.44380: Flags [.], seq 929441:930869, ack 1, win 4017, options [nop,nop,TS val 309042 ecr 95128,mptcp dss ack 3454339951 seq 447748352 subseq 929441 len 1428 csum 0x5335], length 1428
10:43:27.694732 IP 112.26.0.8.44380 > 112.26.0.1.44877: Flags [.], ack 922301, win 24300, options [nop,nop,TS val 95830 ecr 308505,mptcp dss ack 447595556], length 0
10:43:27.695004 IP 112.26.0.1.44877 > 112.26.0.8.44380: Flags [.], seq 938009:939437, ack 1, win 4017, options [nop,nop,TS val 309833 ecr 95830,mptcp dss ack 3454339951 seq 447769772 subseq 938009 len 1428 csum 0x3359], length 1428
10:43:27.726676 IP 112.26.0.1.44877 > 112.26.0.8.44380: Flags [.], seq 930869:932297, ack 1, win 4017, options [nop,nop,TS val 309217 ecr 95278,mptcp dss ack 3454339951 seq 447749780 subseq 930869 len 1428 csum 0xc308], length 1428
10:43:27.821352 IP 112.26.0.8.44380 > 112.26.0.1.44877: Flags [.], ack 923729, win 24300, options [nop,nop,TS val 95974 ecr 308660,mptcp dss ack 447595556], length 0
10:43:27.821681 IP 112.26.0.1.44877 > 112.26.0.8.44380: Flags [.], seq 939437:940865, ack 1, win 4017, options [nop,nop,TS val 309960 ecr 95974,mptcp dss ack 3454339951 seq 447776912 subseq 939437 len 1428 csum 0x78d], length 1428
10:43:27.821757 IP 112.26.0.1.44877 > 112.26.0.8.44380: Flags [.], seq 940865:942293, ack 1, win 4017, options [nop,nop,TS val 309960 ecr 95974,mptcp dss ack 3454339951 seq 447778340 subseq 940865 len 1428 csum 0x7a9d], length 1428
10:43:27.879118 IP 112.26.0.8.44380 > 112.26.0.1.44877: Flags [.], ack 925157, win 24300, options [nop,nop,TS val 96048 ecr 308660,mptcp dss ack 447595556], length 0
10:43:27.879455 IP 112.26.0.1.44877 > 112.26.0.8.44380: Flags [.], seq 942293:943721, ack 1, win 4017, options [nop,nop,TS val 310018 ecr 96048,mptcp dss ack 3454339951 seq 447779768 subseq 942293 len 1428 csum 0x73ac], length 1428
10:43:27.942425 IP 112.26.0.8.44380 > 112.26.0.1.44877: Flags [.], ack 926585, win 24300, options [nop,nop,TS val 96116 ecr 308715,mptcp dss ack 447595556], length 0
10:43:27.942896 IP 112.26.0.1.44877 > 112.26.0.8.44380: Flags [.], seq 943721:945149, ack 1, win 4017, options [nop,nop,TS val 310081 ecr 96116,mptcp dss ack 3454339951 seq 447785480 subseq 943721 len 1428 csum 0xec], length 1428
10:43:27.942959 IP 112.26.0.1.44877 > 112.26.0.8.44380: Flags [.], seq 945149:946577, ack 1, win 4017, options [nop,nop,TS val 310081 ecr 96116,mptcp dss ack 3454339951 seq 447786908 subseq 945149 len 1428 csum 0xb9f6], length 1428
10:43:28.006343 IP 112.26.0.1.44877 > 112.26.0.8.44380: Flags [.], seq 932297:933725, ack 1, win 4017, options [nop,nop,TS val 309510 ecr 95511,mptcp dss ack 3454339951 seq 447754064 subseq 932297 len 1428 csum 0xee3], length 1428
10:43:28.102735 IP 112.26.0.1.44877 > 112.26.0.8.44380: Flags [.], seq 933725:935153, ack 1, win 4017, options [nop,nop,TS val 309510 ecr 95511,mptcp dss ack 3454339951 seq 447755492 subseq 933725 len 1428 csum 0xcee9], length 1428
10:43:28.201735 IP 112.26.0.1.44877 > 112.26.0.8.44380: Flags [.], seq 935153:936581, ack 1, win 4017, options [nop,nop,TS val 309678 ecr 95659,mptcp dss ack 3454339951 seq 447761204 subseq 935153 len 1428 csum 0xaccc], length 1428
10:43:28.291949 IP 112.26.0.8.44380 > 112.26.0.1.44877: Flags [.], ack 928013, win 24300, options [nop,nop,TS val 96395 ecr 308856,nop,nop,sack 1 {929441:930869},mptcp dss ack 447595556], length 0
10:43:28.292450 IP 112.26.0.1.44877 > 112.26.0.8.44380: Flags [.], seq 946577:948005, ack 1, win 4017, options [nop,nop,TS val 310430 ecr 96395,mptcp dss ack 3454339951 seq 447791192 subseq 946577 len 1428 csum 0x7873], length 1428
10:43:28.292509 IP 112.26.0.1.44877 > 112.26.0.8.44380: Flags [.], seq 948005:949433, ack 1, win 4017, options [nop,nop,TS val 310430 ecr 96395,mptcp dss ack 3454339951 seq 447792620 subseq 948005 len 1428 csum 0x8ad1], length 1428
10:43:28.292708 IP 112.26.0.1.44877 > 112.26.0.8.44380: Flags [.], seq 949433:950861, ack 1, win 4017, options [nop,nop,TS val 310430 ecr 96395,mptcp dss ack 3454339951 seq 447794048 subseq 949433 len 1428 csum 0x69a6], length 1428
10:43:28.385136 IP 112.26.0.1.44877 > 112.26.0.8.44380: Flags [.], seq 938009:939437, ack 1, win 4017, options [nop,nop,TS val 309833 ecr 95830,mptcp dss ack 3454339951 seq 447769772 subseq 938009 len 1428 csum 0x3359], length 1428
10:43:28.508869 IP 112.26.0.1.44877 > 112.26.0.8.44380: Flags [.], seq 939437:940865, ack 1, win 4017, options [nop,nop,TS val 309960 ecr 95974,mptcp dss ack 3454339951 seq 447776912 subseq 939437 len 1428 csum 0x78d], length 1428
10:43:28.589907 IP 112.26.0.1.44877 > 112.26.0.8.44380: Flags [.], seq 940865:942293, ack 1, win 4017, options [nop,nop,TS val 309960 ecr 95974,mptcp dss ack 3454339951 seq 447778340 subseq 940865 len 1428 csum 0x7a9d], length 1428
10:43:28.698112 IP 112.26.0.1.44877 > 112.26.0.8.44380: Flags [.], seq 943721:945149, ack 1, win 4017, options [nop,nop,TS val 310081 ecr 96116,mptcp dss ack 3454339951 seq 447785480 subseq 943721 len 1428 csum 0xec], length 1428
10:43:28.793511 IP 112.26.0.1.44877 > 112.26.0.8.44380: Flags [.], seq 945149:946577, ack 1, win 4017, options [nop,nop,TS val 310081 ecr 96116,mptcp dss ack 3454339951 seq 447786908 subseq 945149 len 1428 csum 0xb9f6], length 1428
10:43:28.895026 IP 112.26.0.8.44380 > 112.26.0.1.44877: Flags [.], ack 928013, win 24300, options [nop,nop,TS val 96994 ecr 308856,nop,nop,sack 1 {929441:936581},mptcp dss ack 447595556], length 0
10:43:28.895388 IP 112.26.0.1.44877 > 112.26.0.8.44380: Flags [.], seq 928013:929441, ack 1, win 4017, options [nop,nop,TS val 311033 ecr 96994,mptcp dss ack 3454339951 seq 447746924 subseq 928013 len 1428 csum 0x7d5c], length 1428
10:43:28.949916 IP 112.26.0.1.44877 > 112.26.0.8.44380: Flags [.], seq 946577:948005, ack 1, win 4017, options [nop,nop,TS val 310430 ecr 96395,mptcp dss ack 3454339951 seq 447791192 subseq 946577 len 1428 csum 0x7873], length 1428
10:43:29.015008 IP 112.26.0.1.44877 > 112.26.0.8.44380: Flags [.], seq 948005:949433, ack 1, win 4017, options [nop,nop,TS val 310430 ecr 96395,mptcp dss ack 3454339951 seq 447792620 subseq 948005 len 1428 csum 0x8ad1], length 1428
10:43:29.086401 IP 112.26.0.8.44380 > 112.26.0.1.44877: Flags [.], ack 928013, win 24300, options [nop,nop,TS val 97302 ecr 308856,nop,nop,sack 2 {938009:940865}{929441:936581},mptcp dss ack 447595556], length 0
10:43:29.086775 IP 112.26.0.1.44877 > 112.26.0.8.44380: Flags [.], seq 936581:938009, ack 1, win 4017, options [nop,nop,TS val 311225 ecr 97302,mptcp dss ack 3454339951 seq 447762632 subseq 936581 len 1428 csum 0x1a9f], length 1428
10:43:29.153151 IP 112.26.0.8.44380 > 112.26.0.1.44877: Flags [.], ack 928013, win 24300, options [nop,nop,TS val 97381 ecr 308856,nop,nop,sack 2 {938009:942293}{929441:936581},mptcp dss ack 447595556], length 0
10:43:29.198478 IP 112.26.0.8.44380 > 112.26.0.1.44877: Flags [.], ack 928013, win 24300, options [nop,nop,TS val 97501 ecr 308856,nop,nop,sack 2 {943721:945149}{938009:942293},mptcp dss ack 447595556], length 0
10:43:29.198819 IP 112.26.0.1.44877 > 112.26.0.8.44380: Flags [.], seq 942293:943721, ack 1, win 4017, options [nop,nop,TS val 311337 ecr 97501,mptcp dss ack 3454339951 seq 447779768 subseq 942293 len 1428 csum 0x73ac], length 1428
10:43:29.241088 IP 112.26.0.8.44380 > 112.26.0.1.44877: Flags [.], ack 928013, win 24300, options [nop,nop,TS val 97594 ecr 308856,nop,nop,sack 2 {943721:946577}{938009:942293},mptcp dss ack 447595556], length 0
10:43:29.292049 IP 112.26.0.1.44877 > 112.26.0.8.44380: Flags [.], seq 928013:929441, ack 1, win 4017, options [nop,nop,TS val 311033 ecr 96994,mptcp dss ack 3454339951 seq 447746924 subseq 928013 len 1428 csum 0x7d5c], length 1428
10:43:29.340922 IP 112.26.0.8.44380 > 112.26.0.1.44877: Flags [.], ack 928013, win 24300, options [nop,nop,TS val 97741 ecr 308856,nop,nop,sack 2 {943721:948005}{938009:942293},mptcp dss ack 447595556], length 0
10:43:29.400644 IP 112.26.0.8.44380 > 112.26.0.1.44877: Flags [.], ack 928013, win 24300, options [nop,nop,TS val 97819 ecr 308856,nop,nop,sack 2 {943721:949433}{938009:942293},mptcp dss ack 447595556], length 0
10:43:29.428919 IP 112.26.0.1.44877 > 112.26.0.8.44380: Flags [.], seq 936581:938009, ack 1, win 4017, options [nop,nop,TS val 311225 ecr 97302,mptcp dss ack 3454339951 seq 447762632 subseq 936581 len 1428 csum 0x1a9f], length 1428
10:43:29.492295 IP 112.26.0.1.44877 > 112.26.0.8.44380: Flags [.], seq 942293:943721, ack 1, win 4017, options [nop,nop,TS val 311337 ecr 97501,mptcp dss ack 3454339951 seq 447779768 subseq 942293 len 1428 csum 0x73ac], length 1428
10:43:29.537038 IP 112.26.0.8.44380 > 112.26.0.1.44877: Flags [.], ack 936581, win 24256, options [nop,nop,TS val 98085 ecr 311033,nop,nop,sack 2 {943721:949433}{938009:942293},mptcp dss ack 447598412], length 0
10:43:29.537350 IP 112.26.0.1.44877 > 112.26.0.8.44380: Flags [.], seq 949433:950861, ack 1, win 4017, options [nop,nop,TS val 311676 ecr 98085,mptcp dss ack 3454339951 seq 447794048 subseq 949433 len 1428 csum 0x69a6], length 1428
10:43:29.582076 IP 112.26.0.8.44380 > 112.26.0.1.44877: Flags [.], ack 942293, win 23922, options [nop,nop,TS val 98220 ecr 311225,nop,nop,sack 1 {943721:949433},mptcp dss ack 447619832], length 0
10:43:29.596201 IP 112.26.0.8.44380 > 112.26.0.1.44877: Flags [.], ack 949433, win 23476, options [nop,nop,TS val 98283 ecr 311337,mptcp dss ack 447648392], length 0
10:43:29.610411 IP 112.26.0.1.44877 > 112.26.0.8.44380: Flags [.], seq 949433:950861, ack 1, win 4017, options [nop,nop,TS val 311676 ecr 98085,mptcp dss ack 3454339951 seq 447794048 subseq 949433 len 1428 csum 0x69a6], length 1428
10:43:29.688796 IP 112.26.0.8.44380 > 112.26.0.1.44877: Flags [.], ack 950861, win 23671, options [nop,nop,TS val 98400 ecr 311676,mptcp dss ack 447712652], length 0
10:43:29.782920 IP 112.26.0.1.44877 > 112.26.0.8.44380: Flags [F.], seq 950861, ack 1, win 4017, options [nop,nop,TS val 311921 ecr 98400,mptcp dss ack 3454339951], length 0
10:43:29.787682 IP 112.26.0.1.44877 > 112.26.0.8.44380: Flags [F.], seq 950861, ack 1, win 4017, options [nop,nop,TS val 311921 ecr 98400,mptcp dss ack 3454339951], length 0
10:43:29.870890 IP 112.26.0.8.44380 > 112.26.0.1.44877: Flags [.], ack 950862, win 24576, options [nop,nop,TS val 98623 ecr 311921,mptcp dss ack 447806065], length 0
10:43:29.945299 IP 112.26.0.8.44380 > 112.26.0.1.44877: Flags [F.], seq 1, ack 950862, win 24576, options [nop,nop,TS val 98726 ecr 311921,mptcp dss ack 447806065], length 0
10:43:29.945672 IP 112.26.0.1.44877 > 112.26.0.8.44380: Flags [.], ack 2, win 4017, options [nop,nop,TS val 312084 ecr 98726,mptcp dss ack 3454339952], length 0
10:43:30.016947 IP 112.26.0.1.44877 > 112.26.0.8.44380: Flags [.], ack 2, win 4017, options [nop,nop,TS val 312084 ecr 98726,mptcp dss ack 3454339952], length 0

