10:42:02.410199 IP 112.26.3.8.42387 > 112.26.3.1.44877: Flags [S], seq 3404096348, win 65535, options [mss 1460,sackOK,TS val 11180 ecr 0,nop,wscale 6,mptcp join id 6 token 0x187b1b60 nonce 0x63255531], length 0
10:42:02.477990 IP 112.26.3.8.42387 > 112.26.3.1.44877: Flags [S], seq 3404096348, win 65535, options [mss 1460,sackOK,TS val 11180 ecr 0,nop,wscale 6,mptcp join id 6 token 0x187b1b60 nonce 0x63255531], length 0
10:42:02.529618 IP 112.26.3.8.42387 > 112.26.3.1.44877: Flags [S], seq 3404096348, win 65535, options [mss 1460,sackOK,TS val 11180 ecr 0,nop,wscale 6,mptcp join id 6 token 0x187b1b60 nonce 0x63255531], length 0
10:42:02.719545 IP 112.26.3.1.44877 > 112.26.3.8.42387: Flags [S.], seq 3834564252, ack 3404096349, win 65535, options [mss 1460,sackOK,TS val 224668 ecr 11180,nop,wscale 6,mptcp join id 5 hmac 0xcb2ba0bbb54b93af nonce 0x6a8a083b], length 0
10:42:02.724703 IP 112.26.3.8.42387 > 112.26.3.1.44877: Flags [.], ack 1, win 7072, options [nop,nop,TS val 11508 ecr 224668,mptcp join hmac 0x6751ff0d8d5836226ca8bca04d26c0f7c656fb92], length 0
10:42:02.795832 IP 112.26.3.8.42387 > 112.26.3.1.44877: Flags [.], ack 1, win 7072, options [nop,nop,TS val 11508 ecr 224668,mptcp join hmac 0x6751ff0d8d5836226ca8bca04d26c0f7c656fb92], length 0
10:42:02.800921 IP 112.26.3.8.42387 > 112.26.3.1.44877: Flags [.], ack 1, win 7072, options [nop,nop,TS val 11508 ecr 224668,mptcp join hmac 0x6751ff0d8d5836226ca8bca04d26c0f7c656fb92], length 0
10:42:38.716273 IP 112.26.3.1.44877 > 112.26.3.8.42387: Flags [.], seq 399841:401269, ack 1, win 4017, options [nop,nop,TS val 260422 ecr 46734,mptcp dss ack 3454339951 seq 445697744 subseq 399841 len 1428 csum 0xaae1], length 1428
10:42:38.775515 IP 112.26.3.8.42387 > 112.26.3.1.44877: Flags [.], ack 396985, win 24540, options [nop,nop,TS val 47328 ecr 260001,mptcp dss ack 445604924], length 0
10:42:38.778012 IP 112.26.3.8.42387 > 112.26.3.1.44877: Flags [.], ack 396985, win 24540, options [nop,nop,TS val 47328 ecr 260001,mptcp dss ack 445604924], length 0
10:42:38.820480 IP 112.26.3.8.42387 > 112.26.3.1.44877: Flags [.], ack 401269, win 24311, options [nop,nop,TS val 47608 ecr 260422,mptcp dss ack 445659188], length 0
10:42:38.846802 IP 112.26.3.1.44877 > 112.26.3.8.42387: Flags [.], seq 401269:402697, ack 1, win 4017, options [nop,nop,TS val 260422 ecr 46734,mptcp dss ack 3454339951 seq 445699172 subseq 401269 len 1428 csum 0x7762], length 1428
10:42:38.893179 IP 112.26.3.1.44877 > 112.26.3.8.42387: Flags [.], seq 402697:404125, ack 1, win 4017, options [nop,nop,TS val 260509 ecr 46984,mptcp dss ack 3454339951 seq 445710596 subseq 402697 len 1428 csum 0x15a8], length 1428
10:42:38.959924 IP 112.26.3.1.44877 > 112.26.3.8.42387: Flags [.], seq 404125:405553, ack 1, win 4017, options [nop,nop,TS val 260509 ecr 46984,mptcp dss ack 3454339951 seq 445712024 subseq 404125 len 1428 csum 0x562d], length 1428
10:42:39.017357 IP 112.26.3.8.42387 > 112.26.3.1.44877: Flags [.], ack 401269, win 24311, options [nop,nop,TS val 47608 ecr 260422,mptcp dss ack 445659188], length 0
10:42:39.022538 IP 112.26.3.8.42387 > 112.26.3.1.44877: Flags [.], ack 401269, win 24311, options [nop,nop,TS val 47608 ecr 260422,mptcp dss ack 445659188], length 0
10:42:39.087030 IP 112.26.3.1.44877 > 112.26.3.8.42387: Flags [.], seq 405553:406981, ack 1, win 4017, options [nop,nop,TS val 260916 ecr 47328,mptcp dss ack 3454339951 seq 445724876 subseq 405553 len 1428 csum 0x2d07], length 1428
10:42:39.088592 IP 112.26.3.8.42387 > 112.26.3.1.44877: Flags [.], ack 406981, win 24311, options [nop,nop,TS val 47875 ecr 260422,mptcp dss ack 445659188], length 0
10:42:39.142017 IP 112.26.3.1.44877 > 112.26.3.8.42387: Flags [.], seq 406981:408409, ack 1, win 4017, options [nop,nop,TS val 260916 ecr 47328,mptcp dss ack 3454339951 seq 445726304 subseq 406981 len 1428 csum 0x9e83], length 1428
10:42:39.224343 IP 112.26.3.1.44877 > 112.26.3.8.42387: Flags [.], seq 408409:409837, ack 1, win 4017, options [nop,nop,TS val 260916 ecr 47328,mptcp dss ack 3454339951 seq 445727732 subseq 408409 len 1428 csum 0x44d9], length 1428
10:42:39.309038 IP 112.26.3.8.42387 > 112.26.3.1.44877: Flags [.], ack 409837, win 24311, options [nop,nop,TS val 48096 ecr 260916,mptcp dss ack 445659188], length 0
10:42:39.318227 IP 112.26.3.8.42387 > 112.26.3.1.44877: Flags [.], ack 406981, win 24311, options [nop,nop,TS val 47875 ecr 260422,mptcp dss ack 445659188], length 0
10:42:39.322796 IP 112.26.3.8.42387 > 112.26.3.1.44877: Flags [.], ack 406981, win 24311, options [nop,nop,TS val 47875 ecr 260422,mptcp dss ack 445659188], length 0
10:42:39.435254 IP 112.26.3.1.44877 > 112.26.3.8.42387: Flags [.], seq 409837:411265, ack 1, win 4017, options [nop,nop,TS val 260916 ecr 47328,mptcp dss ack 3454339951 seq 445729160 subseq 409837 len 1428 csum 0x6b51], length 1428
10:42:39.522904 IP 112.26.3.1.44877 > 112.26.3.8.42387: Flags [.], seq 411265:412693, ack 1, win 4017, options [nop,nop,TS val 260916 ecr 47328,mptcp dss ack 3454339951 seq 445730588 subseq 411265 len 1428 csum 0x88c], length 1428
10:42:39.582480 IP 112.26.3.1.44877 > 112.26.3.8.42387: Flags [.], seq 412693:414121, ack 1, win 4017, options [nop,nop,TS val 261161 ecr 47608,mptcp dss ack 3454339951 seq 445740584 subseq 412693 len 1428 csum 0xb5a], length 1428
10:42:39.659694 IP 112.26.3.8.42387 > 112.26.3.1.44877: Flags [.], ack 409837, win 24311, options [nop,nop,TS val 48096 ecr 260916,mptcp dss ack 445659188], length 0
10:42:39.666328 IP 112.26.3.8.42387 > 112.26.3.1.44877: Flags [.], ack 409837, win 24311, options [nop,nop,TS val 48096 ecr 260916,mptcp dss ack 445659188], length 0
10:42:39.719392 IP 112.26.3.1.44877 > 112.26.3.8.42387: Flags [.], seq 414121:415549, ack 1, win 4017, options [nop,nop,TS val 261161 ecr 47608,mptcp dss ack 3454339951 seq 445742012 subseq 414121 len 1428 csum 0x2196], length 1428
10:42:39.721303 IP 112.26.3.8.42387 > 112.26.3.1.44877: Flags [.], ack 415549, win 24311, options [nop,nop,TS val 48508 ecr 260916,mptcp dss ack 445659188], length 0
10:42:39.798096 IP 112.26.3.1.44877 > 112.26.3.8.42387: Flags [.], seq 415549:416977, ack 1, win 4017, options [nop,nop,TS val 261161 ecr 47608,mptcp dss ack 3454339951 seq 445743440 subseq 415549 len 1428 csum 0xf46d], length 1428
10:42:39.855677 IP 112.26.3.1.44877 > 112.26.3.8.42387: Flags [.], seq 416977:418405, ack 1, win 4017, options [nop,nop,TS val 261161 ecr 47608,mptcp dss ack 3454339951 seq 445744868 subseq 416977 len 1428 csum 0xa113], length 1428
10:42:39.868869 IP 112.26.3.8.42387 > 112.26.3.1.44877: Flags [.], ack 418405, win 23613, options [nop,nop,TS val 48655 ecr 261161,mptcp dss ack 445734872], length 0
10:42:39.915691 IP 112.26.3.1.44877 > 112.26.3.8.42387: Flags [.], seq 418405:419833, ack 1, win 4017, options [nop,nop,TS val 261161 ecr 47608,mptcp dss ack 3454339951 seq 445746296 subseq 418405 len 1428 csum 0xa31b], length 1428
10:42:39.974625 IP 112.26.3.1.44877 > 112.26.3.8.42387: Flags [.], seq 419833:421261, ack 1, win 4017, options [nop,nop,TS val 261461 ecr 47875,mptcp dss ack 3454339951 seq 445756292 subseq 419833 len 1428 csum 0x1790], length 1428
10:42:39.976018 IP 112.26.3.8.42387 > 112.26.3.1.44877: Flags [.], ack 421261, win 24429, options [nop,nop,TS val 48763 ecr 261161,mptcp dss ack 445734872], length 0
10:42:40.063568 IP 112.26.3.8.42387 > 112.26.3.1.44877: Flags [.], ack 415549, win 24311, options [nop,nop,TS val 48508 ecr 260916,mptcp dss ack 445659188], length 0
10:42:40.065599 IP 112.26.3.8.42387 > 112.26.3.1.44877: Flags [.], ack 415549, win 24311, options [nop,nop,TS val 48508 ecr 260916,mptcp dss ack 445659188], length 0
10:42:40.180892 IP 112.26.3.1.44877 > 112.26.3.8.42387: Flags [.], seq 421261:422689, ack 1, win 4017, options [nop,nop,TS val 261461 ecr 47875,mptcp dss ack 3454339951 seq 445757720 subseq 421261 len 1428 csum 0x49ff], length 1428
10:42:40.263113 IP 112.26.3.1.44877 > 112.26.3.8.42387: Flags [.], seq 422689:424117, ack 1, win 4017, options [nop,nop,TS val 261461 ecr 47875,mptcp dss ack 3454339951 seq 445759148 subseq 422689 len 1428 csum 0x9714], length 1428
10:42:40.309066 IP 112.26.3.8.42387 > 112.26.3.1.44877: Flags [.], ack 418405, win 23613, options [nop,nop,TS val 48655 ecr 261161,mptcp dss ack 445734872], length 0
10:42:40.333843 IP 112.26.3.8.42387 > 112.26.3.1.44877: Flags [.], ack 424117, win 24429, options [nop,nop,TS val 49104 ecr 261461,mptcp dss ack 445734872], length 0
10:42:40.348836 IP 112.26.3.8.42387 > 112.26.3.1.44877: Flags [.], ack 418405, win 23613, options [nop,nop,TS val 48655 ecr 261161,mptcp dss ack 445734872], length 0
10:42:40.407145 IP 112.26.3.1.44877 > 112.26.3.8.42387: Flags [.], seq 424117:425545, ack 1, win 4017, options [nop,nop,TS val 261461 ecr 47875,mptcp dss ack 3454339951 seq 445760576 subseq 424117 len 1428 csum 0xd325], length 1428
10:42:40.524344 IP 112.26.3.1.44877 > 112.26.3.8.42387: Flags [.], seq 425545:426973, ack 1, win 4017, options [nop,nop,TS val 261804 ecr 48096,mptcp dss ack 3454339951 seq 445764860 subseq 425545 len 1428 csum 0x54e8], length 1428
10:42:40.608348 IP 112.26.3.8.42387 > 112.26.3.1.44877: Flags [.], ack 421261, win 24429, options [nop,nop,TS val 48763 ecr 261161,mptcp dss ack 445734872], length 0
10:42:40.610026 IP 112.26.3.8.42387 > 112.26.3.1.44877: Flags [.], ack 421261, win 24429, options [nop,nop,TS val 48763 ecr 261161,mptcp dss ack 445734872], length 0
10:42:40.678677 IP 112.26.3.1.44877 > 112.26.3.8.42387: Flags [.], seq 426973:428401, ack 1, win 4017, options [nop,nop,TS val 261804 ecr 48096,mptcp dss ack 3454339951 seq 445766288 subseq 426973 len 1428 csum 0x658a], length 1428
10:42:40.680772 IP 112.26.3.8.42387 > 112.26.3.1.44877: Flags [.], ack 428401, win 24429, options [nop,nop,TS val 49467 ecr 261461,mptcp dss ack 445734872], length 0
10:42:40.735654 IP 112.26.3.1.44877 > 112.26.3.8.42387: Flags [.], seq 428401:429829, ack 1, win 4017, options [nop,nop,TS val 261804 ecr 48096,mptcp dss ack 3454339951 seq 445767716 subseq 428401 len 1428 csum 0x7aac], length 1428
10:42:40.830060 IP 112.26.3.1.44877 > 112.26.3.8.42387: Flags [.], seq 429829:431257, ack 1, win 4017, options [nop,nop,TS val 262203 ecr 48508,mptcp dss ack 3454339951 seq 445787708 subseq 429829 len 1428 csum 0xdfd0], length 1428
10:42:40.910532 IP 112.26.3.8.42387 > 112.26.3.1.44877: Flags [.], ack 424117, win 24429, options [nop,nop,TS val 49104 ecr 261461,mptcp dss ack 445734872], length 0
10:42:40.913800 IP 112.26.3.8.42387 > 112.26.3.1.44877: Flags [.], ack 424117, win 24429, options [nop,nop,TS val 49104 ecr 261461,mptcp dss ack 445734872], length 0
10:42:40.940658 IP 112.26.3.8.42387 > 112.26.3.1.44877: Flags [.], ack 431257, win 24429, options [nop,nop,TS val 49728 ecr 261804,mptcp dss ack 445734872], length 0
10:42:40.984257 IP 112.26.3.1.44877 > 112.26.3.8.42387: Flags [.], seq 431257:432685, ack 1, win 4017, options [nop,nop,TS val 262203 ecr 48508,mptcp dss ack 3454339951 seq 445789136 subseq 431257 len 1428 csum 0xa12d], length 1428
10:42:41.028472 IP 112.26.3.1.44877 > 112.26.3.8.42387: Flags [.], seq 432685:434113, ack 1, win 4017, options [nop,nop,TS val 262203 ecr 48508,mptcp dss ack 3454339951 seq 445790564 subseq 432685 len 1428 csum 0x2a3d], length 1428
10:42:41.122053 IP 112.26.3.1.44877 > 112.26.3.8.42387: Flags [.], seq 434113:435541, ack 1, win 4017, options [nop,nop,TS val 262203 ecr 48508,mptcp dss ack 3454339951 seq 445791992 subseq 434113 len 1428 csum 0x2b6c], length 1428
10:42:41.184401 IP 112.26.3.1.44877 > 112.26.3.8.42387: Flags [.], seq 435541:436969, ack 1, win 4017, options [nop,nop,TS val 262203 ecr 48508,mptcp dss ack 3454339951 seq 445793420 subseq 435541 len 1428 csum 0xdc5b], length 1428
10:42:41.252811 IP 112.26.3.8.42387 > 112.26.3.1.44877: Flags [.], ack 436969, win 24429, options [nop,nop,TS val 50040 ecr 262203,mptcp dss ack 445734872], length 0
10:42:41.262620 IP 112.26.3.8.42387 > 112.26.3.1.44877: Flags [.], ack 428401, win 24429, options [nop,nop,TS val 49467 ecr 261461,mptcp dss ack 445734872], length 0
10:42:41.271116 IP 112.26.3.8.42387 > 112.26.3.1.44877: Flags [.], ack 428401, win 24429, options [nop,nop,TS val 49467 ecr 261461,mptcp dss ack 445734872], length 0
10:42:41.333431 IP 112.26.3.1.44877 > 112.26.3.8.42387: Flags [.], seq 436969:438397, ack 1, win 4017, options [nop,nop,TS val 262203 ecr 48508,mptcp dss ack 3454339951 seq 445794848 subseq 436969 len 1428 csum 0xf232], length 1428
10:42:41.382689 IP 112.26.3.1.44877 > 112.26.3.8.42387: Flags [.], seq 438397:439825, ack 1, win 4017, options [nop,nop,TS val 262458 ecr 48655,mptcp dss ack 3454339951 seq 445807700 subseq 438397 len 1428 csum 0x2974], length 1428
10:42:41.430039 IP 112.26.3.1.44877 > 112.26.3.8.42387: Flags [.], seq 439825:441253, ack 1, win 4017, options [nop,nop,TS val 262458 ecr 48655,mptcp dss ack 3454339951 seq 445809128 subseq 439825 len 1428 csum 0xe62d], length 1428
10:42:41.505127 IP 112.26.3.8.42387 > 112.26.3.1.44877: Flags [.], ack 431257, win 24429, options [nop,nop,TS val 49728 ecr 261804,mptcp dss ack 445734872], length 0
10:42:41.507613 IP 112.26.3.8.42387 > 112.26.3.1.44877: Flags [.], ack 431257, win 24429, options [nop,nop,TS val 49728 ecr 261804,mptcp dss ack 445734872], length 0
10:42:41.575949 IP 112.26.3.1.44877 > 112.26.3.8.42387: Flags [.], seq 441253:442681, ack 1, win 4017, options [nop,nop,TS val 262458 ecr 48655,mptcp dss ack 3454339951 seq 445810556 subseq 441253 len 1428 csum 0xdef6], length 1428
10:42:41.578338 IP 112.26.3.8.42387 > 112.26.3.1.44877: Flags [.], ack 442681, win 24429, options [nop,nop,TS val 50364 ecr 262203,mptcp dss ack 445734872], length 0
10:42:41.675510 IP 112.26.3.1.44877 > 112.26.3.8.42387: Flags [.], seq 442681:444109, ack 1, win 4017, options [nop,nop,TS val 262748 ecr 48763,mptcp dss ack 3454339951 seq 445813412 subseq 442681 len 1428 csum 0x4d6], length 1428
10:42:41.763522 IP 112.26.3.1.44877 > 112.26.3.8.42387: Flags [.], seq 444109:445537, ack 1, win 4017, options [nop,nop,TS val 262748 ecr 48763,mptcp dss ack 3454339951 seq 445814840 subseq 444109 len 1428 csum 0x5523], length 1428
10:42:41.825018 IP 112.26.3.1.44877 > 112.26.3.8.42387: Flags [.], seq 445537:446965, ack 1, win 4017, options [nop,nop,TS val 262748 ecr 48763,mptcp dss ack 3454339951 seq 445816268 subseq 445537 len 1428 csum 0x3a18], length 1428
10:42:41.865616 IP 112.26.3.8.42387 > 112.26.3.1.44877: Flags [.], ack 446965, win 23849, options [nop,nop,TS val 50653 ecr 262748,mptcp dss ack 445772000], length 0
10:42:41.922517 IP 112.26.3.8.42387 > 112.26.3.1.44877: Flags [.], ack 436969, win 24429, options [nop,nop,TS val 50040 ecr 262203,mptcp dss ack 445734872], length 0
10:42:41.924726 IP 112.26.3.8.42387 > 112.26.3.1.44877: Flags [.], ack 436969, win 24429, options [nop,nop,TS val 50040 ecr 262203,mptcp dss ack 445734872], length 0
10:42:41.989832 IP 112.26.3.1.44877 > 112.26.3.8.42387: Flags [.], seq 446965:448393, ack 1, win 4017, options [nop,nop,TS val 263052 ecr 49104,mptcp dss ack 3454339951 seq 445834832 subseq 446965 len 1428 csum 0x7016], length 1428
10:42:42.041901 IP 112.26.3.1.44877 > 112.26.3.8.42387: Flags [.], seq 448393:449821, ack 1, win 4017, options [nop,nop,TS val 263052 ecr 49104,mptcp dss ack 3454339951 seq 445836260 subseq 448393 len 1428 csum 0xc0a0], length 1428
10:42:42.043453 IP 112.26.3.8.42387 > 112.26.3.1.44877: Flags [.], ack 449821, win 23955, options [nop,nop,TS val 50830 ecr 263052,mptcp dss ack 445772000], length 0
10:42:42.105121 IP 112.26.3.1.44877 > 112.26.3.8.42387: Flags [.], seq 449821:451249, ack 1, win 4017, options [nop,nop,TS val 263404 ecr 49467,mptcp dss ack 3454339951 seq 445849112 subseq 449821 len 1428 csum 0x7f45], length 1428
10:42:42.161022 IP 112.26.3.8.42387 > 112.26.3.1.44877: Flags [.], ack 442681, win 24429, options [nop,nop,TS val 50364 ecr 262203,mptcp dss ack 445734872], length 0
10:42:42.162720 IP 112.26.3.8.42387 > 112.26.3.1.44877: Flags [.], ack 442681, win 24429, options [nop,nop,TS val 50364 ecr 262203,mptcp dss ack 445734872], length 0
10:42:42.198262 IP 112.26.3.1.44877 > 112.26.3.8.42387: Flags [.], seq 451249:452677, ack 1, win 4017, options [nop,nop,TS val 263404 ecr 49467,mptcp dss ack 3454339951 seq 445850540 subseq 451249 len 1428 csum 0x6e3a], length 1428
10:42:42.200246 IP 112.26.3.8.42387 > 112.26.3.1.44877: Flags [.], ack 452677, win 23955, options [nop,nop,TS val 50986 ecr 263404,mptcp dss ack 445772000], length 0
10:42:42.286502 IP 112.26.3.1.44877 > 112.26.3.8.42387: Flags [.], seq 452677:454105, ack 1, win 4017, options [nop,nop,TS val 263404 ecr 49467,mptcp dss ack 3454339951 seq 445851968 subseq 452677 len 1428 csum 0xdb7a], length 1428
10:42:42.345044 IP 112.26.3.1.44877 > 112.26.3.8.42387: Flags [.], seq 454105:455533, ack 1, win 4017, options [nop,nop,TS val 263404 ecr 49467,mptcp dss ack 3454339951 seq 445853396 subseq 454105 len 1428 csum 0xa96e], length 1428
10:42:42.382251 IP 112.26.3.1.44877 > 112.26.3.8.42387: Flags [.], seq 455533:456961, ack 1, win 4017, options [nop,nop,TS val 263646 ecr 49728,mptcp dss ack 3454339951 seq 445856252 subseq 455533 len 1428 csum 0xeb4d], length 1428
10:42:42.456733 IP 112.26.3.8.42387 > 112.26.3.1.44877: Flags [.], ack 446965, win 23849, options [nop,nop,TS val 50653 ecr 262748,mptcp dss ack 445772000], length 0
10:42:42.458433 IP 112.26.3.8.42387 > 112.26.3.1.44877: Flags [.], ack 446965, win 23849, options [nop,nop,TS val 50653 ecr 262748,mptcp dss ack 445772000], length 0
10:42:42.465125 IP 112.26.3.8.42387 > 112.26.3.1.44877: Flags [.], ack 456961, win 23955, options [nop,nop,TS val 51248 ecr 263404,mptcp dss ack 445772000], length 0
10:42:42.530138 IP 112.26.3.1.44877 > 112.26.3.8.42387: Flags [.], seq 456961:458389, ack 1, win 4017, options [nop,nop,TS val 263646 ecr 49728,mptcp dss ack 3454339951 seq 445857680 subseq 456961 len 1428 csum 0xe72], length 1428
10:42:42.593211 IP 112.26.3.1.44877 > 112.26.3.8.42387: Flags [.], seq 458389:459817, ack 1, win 4017, options [nop,nop,TS val 263646 ecr 49728,mptcp dss ack 3454339951 seq 445859108 subseq 458389 len 1428 csum 0xa0cf], length 1428
10:42:42.595485 IP 112.26.3.8.42387 > 112.26.3.1.44877: Flags [.], ack 459817, win 24050, options [nop,nop,TS val 51382 ecr 263646,mptcp dss ack 445801988], length 0
10:42:42.644663 IP 112.26.3.8.42387 > 112.26.3.1.44877: Flags [.], ack 449821, win 23955, options [nop,nop,TS val 50830 ecr 263052,mptcp dss ack 445772000], length 0
10:42:42.648014 IP 112.26.3.8.42387 > 112.26.3.1.44877: Flags [.], ack 449821, win 23955, options [nop,nop,TS val 50830 ecr 263052,mptcp dss ack 445772000], length 0
10:42:42.717860 IP 112.26.3.1.44877 > 112.26.3.8.42387: Flags [.], seq 459817:461245, ack 1, win 4017, options [nop,nop,TS val 264063 ecr 50040,mptcp dss ack 3454339951 seq 445863392 subseq 459817 len 1428 csum 0xf7d6], length 1428
10:42:42.749640 IP 112.26.3.1.44877 > 112.26.3.8.42387: Flags [.], seq 461245:462673, ack 1, win 4017, options [nop,nop,TS val 264063 ecr 50040,mptcp dss ack 3454339951 seq 445864820 subseq 461245 len 1428 csum 0x6e3f], length 1428
10:42:42.751089 IP 112.26.3.8.42387 > 112.26.3.1.44877: Flags [.], ack 462673, win 24378, options [nop,nop,TS val 51538 ecr 264063,mptcp dss ack 445846256], length 0
10:42:42.843618 IP 112.26.3.8.42387 > 112.26.3.1.44877: Flags [.], ack 452677, win 23955, options [nop,nop,TS val 50986 ecr 263404,mptcp dss ack 445772000], length 0
10:42:42.848409 IP 112.26.3.8.42387 > 112.26.3.1.44877: Flags [.], ack 452677, win 23955, options [nop,nop,TS val 50986 ecr 263404,mptcp dss ack 445772000], length 0
10:42:42.916654 IP 112.26.3.1.44877 > 112.26.3.8.42387: Flags [.], seq 462673:464101, ack 1, win 4017, options [nop,nop,TS val 264063 ecr 50040,mptcp dss ack 3454339951 seq 445866248 subseq 462673 len 1428 csum 0xe148], length 1428
10:42:42.989077 IP 112.26.3.1.44877 > 112.26.3.8.42387: Flags [.], seq 464101:465529, ack 1, win 4017, options [nop,nop,TS val 264063 ecr 50040,mptcp dss ack 3454339951 seq 445867676 subseq 464101 len 1428 csum 0xddbb], length 1428
10:42:43.060488 IP 112.26.3.8.42387 > 112.26.3.1.44877: Flags [.], ack 465529, win 24378, options [nop,nop,TS val 51848 ecr 264063,mptcp dss ack 445846256], length 0
10:42:43.065119 IP 112.26.3.8.42387 > 112.26.3.1.44877: Flags [.], ack 456961, win 23955, options [nop,nop,TS val 51248 ecr 263404,mptcp dss ack 445772000], length 0
10:42:43.070784 IP 112.26.3.8.42387 > 112.26.3.1.44877: Flags [.], ack 456961, win 23955, options [nop,nop,TS val 51248 ecr 263404,mptcp dss ack 445772000], length 0
10:42:43.147336 IP 112.26.3.1.44877 > 112.26.3.8.42387: Flags [.], seq 465529:466957, ack 1, win 4017, options [nop,nop,TS val 264063 ecr 50040,mptcp dss ack 3454339951 seq 445869104 subseq 465529 len 1428 csum 0x59e8], length 1428
10:42:43.198730 IP 112.26.3.1.44877 > 112.26.3.8.42387: Flags [.], seq 466957:468385, ack 1, win 4017, options [nop,nop,TS val 264063 ecr 50040,mptcp dss ack 3454339951 seq 445870532 subseq 466957 len 1428 csum 0xe5c4], length 1428
10:42:43.305299 IP 112.26.3.8.42387 > 112.26.3.1.44877: Flags [.], ack 459817, win 24050, options [nop,nop,TS val 51382 ecr 263646,mptcp dss ack 445801988], length 0
10:42:43.307970 IP 112.26.3.8.42387 > 112.26.3.1.44877: Flags [.], ack 459817, win 24050, options [nop,nop,TS val 51382 ecr 263646,mptcp dss ack 445801988], length 0
10:42:43.313935 IP 112.26.3.8.42387 > 112.26.3.1.44877: Flags [.], ack 468385, win 24245, options [nop,nop,TS val 52100 ecr 264063,mptcp dss ack 445854824], length 0
10:42:43.430927 IP 112.26.3.8.42387 > 112.26.3.1.44877: Flags [.], ack 462673, win 24378, options [nop,nop,TS val 51538 ecr 264063,mptcp dss ack 445846256], length 0
10:42:43.436805 IP 112.26.3.8.42387 > 112.26.3.1.44877: Flags [.], ack 462673, win 24378, options [nop,nop,TS val 51538 ecr 264063,mptcp dss ack 445846256], length 0
10:42:43.488314 IP 112.26.3.1.44877 > 112.26.3.8.42387: Flags [.], seq 469813:471241, ack 1, win 4017, options [nop,nop,TS val 264300 ecr 50364,mptcp dss ack 3454339951 seq 445894808 subseq 469813 len 1428 csum 0x77ad], length 1428
10:42:43.490839 IP 112.26.3.8.42387 > 112.26.3.1.44877: Flags [.], ack 468385, win 24391, options [nop,nop,TS val 52276 ecr 264063,nop,nop,sack 1 {469813:471241},mptcp dss ack 445893380], length 0
10:42:43.547446 IP 112.26.3.1.44877 > 112.26.3.8.42387: Flags [.], seq 471241:472669, ack 1, win 4017, options [nop,nop,TS val 264300 ecr 50364,mptcp dss ack 3454339951 seq 445896236 subseq 471241 len 1428 csum 0x2b31], length 1428
10:42:43.549010 IP 112.26.3.8.42387 > 112.26.3.1.44877: Flags [.], ack 468385, win 24391, options [nop,nop,TS val 52336 ecr 264063,nop,nop,sack 1 {469813:472669},mptcp dss ack 445893380], length 0
10:42:43.629316 IP 112.26.3.1.44877 > 112.26.3.8.42387: Flags [P.], seq 472669:474097, ack 1, win 4017, options [nop,nop,TS val 264300 ecr 50364,mptcp dss ack 3454339951 seq 445897664 subseq 472669 len 1428 csum 0xe3bf], length 1428
10:42:43.631357 IP 112.26.3.8.42387 > 112.26.3.1.44877: Flags [.], ack 468385, win 24391, options [nop,nop,TS val 52418 ecr 264063,nop,nop,sack 1 {469813:474097},mptcp dss ack 445893380], length 0
10:42:43.706472 IP 112.26.3.8.42387 > 112.26.3.1.44877: Flags [.], ack 465529, win 24378, options [nop,nop,TS val 51848 ecr 264063,mptcp dss ack 445846256], length 0
10:42:43.739501 IP 112.26.3.8.42387 > 112.26.3.1.44877: Flags [.], ack 465529, win 24378, options [nop,nop,TS val 51848 ecr 264063,mptcp dss ack 445846256], length 0
10:42:43.759999 IP 112.26.3.1.44877 > 112.26.3.8.42387: Flags [.], seq 474097:475525, ack 1, win 4017, options [nop,nop,TS val 264300 ecr 50364,mptcp dss ack 3454339951 seq 445899092 subseq 474097 len 1428 csum 0x7eaa], length 1428
10:42:43.763260 IP 112.26.3.8.42387 > 112.26.3.1.44877: Flags [.], ack 468385, win 24391, options [nop,nop,TS val 52549 ecr 264063,nop,nop,sack 1 {469813:475525},mptcp dss ack 445893380], length 0
10:42:43.798477 IP 112.26.3.1.44877 > 112.26.3.8.42387: Flags [.], seq 475525:476953, ack 1, win 4017, options [nop,nop,TS val 264300 ecr 50364,mptcp dss ack 3454339951 seq 445900520 subseq 475525 len 1428 csum 0xbbdd], length 1428
10:42:43.832314 IP 112.26.3.8.42387 > 112.26.3.1.44877: Flags [.], ack 468385, win 24391, options [nop,nop,TS val 52587 ecr 264063,nop,nop,sack 1 {469813:476953},mptcp dss ack 445893380], length 0
10:42:43.867528 IP 112.26.3.8.42387 > 112.26.3.1.44877: Flags [.], ack 468385, win 24245, options [nop,nop,TS val 52100 ecr 264063,mptcp dss ack 445854824], length 0
10:42:43.874766 IP 112.26.3.8.42387 > 112.26.3.1.44877: Flags [.], ack 468385, win 24245, options [nop,nop,TS val 52100 ecr 264063,mptcp dss ack 445854824], length 0
10:42:43.945178 IP 112.26.3.1.44877 > 112.26.3.8.42387: Flags [.], seq 476953:478381, ack 1, win 4017, options [nop,nop,TS val 264597 ecr 50653,mptcp dss ack 3454339951 seq 445919084 subseq 476953 len 1428 csum 0xa380], length 1428
10:42:43.947286 IP 112.26.3.8.42387 > 112.26.3.1.44877: Flags [.], ack 468385, win 24391, options [nop,nop,TS val 52734 ecr 264063,nop,nop,sack 1 {469813:478381},mptcp dss ack 445893380], length 0
10:42:44.038874 IP 112.26.3.1.44877 > 112.26.3.8.42387: Flags [.], seq 479809:481237, ack 1, win 4017, options [nop,nop,TS val 264597 ecr 50653,mptcp dss ack 3454339951 seq 445921940 subseq 479809 len 1428 csum 0x63e7], length 1428
10:42:44.040544 IP 112.26.3.8.42387 > 112.26.3.1.44877: Flags [.], ack 468385, win 24391, options [nop,nop,TS val 52827 ecr 264063,nop,nop,sack 2 {479809:481237}{469813:478381},mptcp dss ack 445893380], length 0
10:42:44.097936 IP 112.26.3.8.42387 > 112.26.3.1.44877: Flags [.], ack 468385, win 24391, options [nop,nop,TS val 52276 ecr 264063,nop,nop,sack 1 {469813:471241},mptcp dss ack 445893380], length 0
10:42:44.101513 IP 112.26.3.8.42387 > 112.26.3.1.44877: Flags [.], ack 468385, win 24391, options [nop,nop,TS val 52276 ecr 264063,nop,nop,sack 1 {469813:471241},mptcp dss ack 445893380], length 0
10:42:44.144627 IP 112.26.3.8.42387 > 112.26.3.1.44877: Flags [.], ack 468385, win 24391, options [nop,nop,TS val 52336 ecr 264063,nop,nop,sack 1 {469813:472669},mptcp dss ack 445893380], length 0
10:42:44.190865 IP 112.26.3.8.42387 > 112.26.3.1.44877: Flags [.], ack 468385, win 24391, options [nop,nop,TS val 52336 ecr 264063,nop,nop,sack 1 {469813:472669},mptcp dss ack 445893380], length 0
10:42:44.248488 IP 112.26.3.1.44877 > 112.26.3.8.42387: Flags [.], seq 481237:482665, ack 1, win 4017, options [nop,nop,TS val 264597 ecr 50653,mptcp dss ack 3454339951 seq 445923368 subseq 481237 len 1428 csum 0x880], length 1428
10:42:44.250950 IP 112.26.3.8.42387 > 112.26.3.1.44877: Flags [.], ack 468385, win 24391, options [nop,nop,TS val 53036 ecr 264063,nop,nop,sack 2 {479809:482665}{469813:478381},mptcp dss ack 445893380], length 0
10:42:44.369149 IP 112.26.3.1.44877 > 112.26.3.8.42387: Flags [.], seq 484093:485521, ack 1, win 4017, options [nop,nop,TS val 264786 ecr 50830,mptcp dss ack 3454339951 seq 445927652 subseq 484093 len 1428 csum 0x7b8], length 1428
10:42:44.370314 IP 112.26.3.8.42387 > 112.26.3.1.44877: Flags [.], ack 468385, win 24391, options [nop,nop,TS val 53157 ecr 264063,nop,nop,sack 2 {484093:485521}{479809:482665},mptcp dss ack 445893380], length 0
10:42:44.457120 IP 112.26.3.8.42387 > 112.26.3.1.44877: Flags [.], ack 468385, win 24391, options [nop,nop,TS val 52549 ecr 264063,nop,nop,sack 1 {469813:475525},mptcp dss ack 445893380], length 0
10:42:44.459134 IP 112.26.3.8.42387 > 112.26.3.1.44877: Flags [.], ack 468385, win 24391, options [nop,nop,TS val 52549 ecr 264063,nop,nop,sack 1 {469813:475525},mptcp dss ack 445893380], length 0
10:42:44.540157 IP 112.26.3.8.42387 > 112.26.3.1.44877: Flags [.], ack 468385, win 24391, options [nop,nop,TS val 52587 ecr 264063,nop,nop,sack 1 {469813:476953},mptcp dss ack 445893380], length 0
10:42:44.546616 IP 112.26.3.8.42387 > 112.26.3.1.44877: Flags [.], ack 468385, win 24391, options [nop,nop,TS val 52587 ecr 264063,nop,nop,sack 1 {469813:476953},mptcp dss ack 445893380], length 0
10:42:44.590324 IP 112.26.3.8.42387 > 112.26.3.1.44877: Flags [.], ack 468385, win 24391, options [nop,nop,TS val 52734 ecr 264063,nop,nop,sack 1 {469813:478381},mptcp dss ack 445893380], length 0
10:42:44.647343 IP 112.26.3.1.44877 > 112.26.3.8.42387: Flags [.], seq 486949:488377, ack 1, win 4017, options [nop,nop,TS val 264987 ecr 50986,mptcp dss ack 3454339951 seq 445854824 subseq 486949 len 1428 csum 0xe204], length 1428
10:42:44.662754 IP 112.26.3.8.42387 > 112.26.3.1.44877: Flags [.], ack 468385, win 24391, options [nop,nop,TS val 53436 ecr 264063,nop,nop,sack 2 {486949:488377}{484093:485521},mptcp dss ack 445893380], length 0
10:42:44.699266 IP 112.26.3.8.42387 > 112.26.3.1.44877: Flags [.], ack 468385, win 24391, options [nop,nop,TS val 52734 ecr 264063,nop,nop,sack 1 {469813:478381},mptcp dss ack 445893380], length 0
10:42:44.736811 IP 112.26.3.8.42387 > 112.26.3.1.44877: Flags [.], ack 468385, win 24391, options [nop,nop,TS val 52827 ecr 264063,nop,nop,sack 2 {479809:481237}{469813:478381},mptcp dss ack 445893380], length 0
10:42:44.781907 IP 112.26.3.8.42387 > 112.26.3.1.44877: Flags [.], ack 468385, win 24391, options [nop,nop,TS val 52827 ecr 264063,nop,nop,sack 2 {479809:481237}{469813:478381},mptcp dss ack 445893380], length 0
10:42:44.800487 IP 112.26.3.1.44877 > 112.26.3.8.42387: Flags [.], seq 489805:491233, ack 1, win 4017, options [nop,nop,TS val 264987 ecr 50986,mptcp dss ack 3454339951 seq 445873388 subseq 489805 len 1428 csum 0x40f8], length 1428
10:42:44.804685 IP 112.26.3.8.42387 > 112.26.3.1.44877: Flags [.], ack 468385, win 24391, options [nop,nop,TS val 53589 ecr 264063,nop,nop,sack 2 {489805:491233}{486949:488377},mptcp dss ack 445893380], length 0
10:42:44.893784 IP 112.26.3.1.44877 > 112.26.3.8.42387: Flags [.], seq 491233:492661, ack 1, win 4017, options [nop,nop,TS val 265206 ecr 51248,mptcp dss ack 3454339951 seq 445887668 subseq 491233 len 1428 csum 0x2e12], length 1428
10:42:44.896201 IP 112.26.3.8.42387 > 112.26.3.1.44877: Flags [.], ack 468385, win 24391, options [nop,nop,TS val 53682 ecr 264063,nop,nop,sack 2 {489805:492661}{486949:488377},mptcp dss ack 445893380], length 0
10:42:44.969143 IP 112.26.3.8.42387 > 112.26.3.1.44877: Flags [.], ack 468385, win 24391, options [nop,nop,TS val 53036 ecr 264063,nop,nop,sack 2 {479809:482665}{469813:478381},mptcp dss ack 445893380], length 0
10:42:44.971379 IP 112.26.3.8.42387 > 112.26.3.1.44877: Flags [.], ack 468385, win 24391, options [nop,nop,TS val 53036 ecr 264063,nop,nop,sack 2 {479809:482665}{469813:478381},mptcp dss ack 445893380], length 0
10:42:45.045065 IP 112.26.3.8.42387 > 112.26.3.1.44877: Flags [.], ack 468385, win 24391, options [nop,nop,TS val 53157 ecr 264063,nop,nop,sack 2 {484093:485521}{479809:482665},mptcp dss ack 445893380], length 0
10:42:45.047548 IP 112.26.3.8.42387 > 112.26.3.1.44877: Flags [.], ack 468385, win 24391, options [nop,nop,TS val 53157 ecr 264063,nop,nop,sack 2 {484093:485521}{479809:482665},mptcp dss ack 445893380], length 0
10:42:45.143629 IP 112.26.3.1.44877 > 112.26.3.8.42387: Flags [.], seq 498373:499801, ack 1, win 4017, options [nop,nop,TS val 265446 ecr 51382,mptcp dss ack 3454339951 seq 445937648 subseq 498373 len 1428 csum 0x3ab3], length 1428
10:42:45.145475 IP 112.26.3.8.42387 > 112.26.3.1.44877: Flags [.], ack 468385, win 24391, options [nop,nop,TS val 53932 ecr 264063,nop,nop,sack 2 {498373:499801}{489805:492661},mptcp dss ack 445893380], length 0
10:42:45.217492 IP 112.26.3.1.44877 > 112.26.3.8.42387: Flags [.], seq 499801:501229, ack 1, win 4017, options [nop,nop,TS val 265446 ecr 51382,mptcp dss ack 3454339951 seq 445939076 subseq 499801 len 1428 csum 0x43c9], length 1428
10:42:45.239022 IP 112.26.3.8.42387 > 112.26.3.1.44877: Flags [.], ack 468385, win 24391, options [nop,nop,TS val 54006 ecr 264063,nop,nop,sack 2 {498373:501229}{489805:492661},mptcp dss ack 445893380], length 0
10:42:45.292277 IP 112.26.3.8.42387 > 112.26.3.1.44877: Flags [.], ack 468385, win 24391, options [nop,nop,TS val 53436 ecr 264063,nop,nop,sack 2 {486949:488377}{484093:485521},mptcp dss ack 445893380], length 0
10:42:45.296143 IP 112.26.3.8.42387 > 112.26.3.1.44877: Flags [.], ack 468385, win 24391, options [nop,nop,TS val 53436 ecr 264063,nop,nop,sack 2 {486949:488377}{484093:485521},mptcp dss ack 445893380], length 0
10:42:45.360439 IP 112.26.3.1.44877 > 112.26.3.8.42387: Flags [.], seq 505513:506941, ack 1, win 4017, options [nop,nop,TS val 265877 ecr 51848,mptcp dss ack 3454339951 seq 445964780 subseq 505513 len 1428 csum 0xe862], length 1428
10:42:45.363060 IP 112.26.3.8.42387 > 112.26.3.1.44877: Flags [.], ack 468385, win 24391, options [nop,nop,TS val 54149 ecr 264063,nop,nop,sack 2 {505513:506941}{498373:501229},mptcp dss ack 445893380], length 0
10:42:45.457545 IP 112.26.3.1.44877 > 112.26.3.8.42387: Flags [.], seq 506941:508369, ack 1, win 4017, options [nop,nop,TS val 265877 ecr 51848,mptcp dss ack 3454339951 seq 445966208 subseq 506941 len 1428 csum 0x4fcb], length 1428
10:42:45.459534 IP 112.26.3.8.42387 > 112.26.3.1.44877: Flags [.], ack 468385, win 24391, options [nop,nop,TS val 54246 ecr 264063,nop,nop,sack 2 {505513:508369}{498373:501229},mptcp dss ack 445893380], length 0
10:42:45.532997 IP 112.26.3.1.44877 > 112.26.3.8.42387: Flags [.], seq 508369:509797, ack 1, win 4017, options [nop,nop,TS val 266012 ecr 52100,mptcp dss ack 3454339951 seq 445973348 subseq 508369 len 1428 csum 0x303c], length 1428
10:42:45.550767 IP 112.26.3.8.42387 > 112.26.3.1.44877: Flags [.], ack 468385, win 24391, options [nop,nop,TS val 54321 ecr 264063,nop,nop,sack 2 {505513:509797}{498373:501229},mptcp dss ack 445893380], length 0
10:42:45.629868 IP 112.26.3.1.44877 > 112.26.3.8.42387: Flags [.], seq 509797:511225, ack 1, win 4017, options [nop,nop,TS val 266012 ecr 52100,mptcp dss ack 3454339951 seq 445974776 subseq 509797 len 1428 csum 0xa904], length 1428
10:42:45.632870 IP 112.26.3.8.42387 > 112.26.3.1.44877: Flags [.], ack 468385, win 24391, options [nop,nop,TS val 54418 ecr 264063,nop,nop,sack 2 {505513:511225}{498373:501229},mptcp dss ack 445893380], length 0
10:42:45.701268 IP 112.26.3.1.44877 > 112.26.3.8.42387: Flags [.], seq 511225:512653, ack 1, win 4017, options [nop,nop,TS val 266012 ecr 52100,mptcp dss ack 3454339951 seq 445976204 subseq 511225 len 1428 csum 0xcd84], length 1428
10:42:45.703598 IP 112.26.3.8.42387 > 112.26.3.1.44877: Flags [.], ack 468385, win 24391, options [nop,nop,TS val 54490 ecr 264063,nop,nop,sack 2 {505513:512653}{498373:501229},mptcp dss ack 445893380], length 0
10:42:45.747848 IP 112.26.3.1.44877 > 112.26.3.8.42387: Flags [.], seq 512653:514081, ack 1, win 4017, options [nop,nop,TS val 266243 ecr 52276,mptcp dss ack 3454339951 seq 445987628 subseq 512653 len 1428 csum 0x2461], length 1428
10:42:45.790224 IP 112.26.3.8.42387 > 112.26.3.1.44877: Flags [.], ack 468385, win 24391, options [nop,nop,TS val 54536 ecr 264063,nop,nop,sack 2 {505513:514081}{498373:501229},mptcp dss ack 445893380], length 0
10:42:45.796034 IP 112.26.3.8.42387 > 112.26.3.1.44877: Flags [.], ack 468385, win 24391, options [nop,nop,TS val 53932 ecr 264063,nop,nop,sack 2 {498373:499801}{489805:492661},mptcp dss ack 445893380], length 0
10:42:45.798245 IP 112.26.3.8.42387 > 112.26.3.1.44877: Flags [.], ack 468385, win 24391, options [nop,nop,TS val 53932 ecr 264063,nop,nop,sack 2 {498373:499801}{489805:492661},mptcp dss ack 445893380], length 0
10:42:45.815299 IP 112.26.3.1.44877 > 112.26.3.8.42387: Flags [.], seq 514081:515509, ack 1, win 4017, options [nop,nop,TS val 266597 ecr 52336,mptcp dss ack 3454339951 seq 445993340 subseq 514081 len 1428 csum 0x9562], length 1428
10:42:45.870182 IP 112.26.3.8.42387 > 112.26.3.1.44877: Flags [.], ack 468385, win 24391, options [nop,nop,TS val 54604 ecr 264063,nop,nop,sack 2 {505513:515509}{498373:501229},mptcp dss ack 445893380], length 0
10:42:45.919685 IP 112.26.3.8.42387 > 112.26.3.1.44877: Flags [.], ack 468385, win 24391, options [nop,nop,TS val 54006 ecr 264063,nop,nop,sack 2 {498373:501229}{489805:492661},mptcp dss ack 445893380], length 0
10:42:45.922914 IP 112.26.3.8.42387 > 112.26.3.1.44877: Flags [.], ack 468385, win 24391, options [nop,nop,TS val 54006 ecr 264063,nop,nop,sack 2 {498373:501229}{489805:492661},mptcp dss ack 445893380], length 0
10:42:45.988844 IP 112.26.3.1.44877 > 112.26.3.8.42387: Flags [.], seq 515509:516937, ack 1, win 4017, options [nop,nop,TS val 266625 ecr 52549,mptcp dss ack 3454339951 seq 445994768 subseq 515509 len 1428 csum 0xc97b], length 1428
10:42:45.991355 IP 112.26.3.8.42387 > 112.26.3.1.44877: Flags [.], ack 468385, win 24391, options [nop,nop,TS val 54777 ecr 264063,nop,nop,sack 2 {505513:516937}{498373:501229},mptcp dss ack 445893380], length 0
10:42:46.084562 IP 112.26.3.8.42387 > 112.26.3.1.44877: Flags [.], ack 468385, win 24391, options [nop,nop,TS val 54149 ecr 264063,nop,nop,sack 2 {505513:506941}{498373:501229},mptcp dss ack 445893380], length 0
10:42:46.086379 IP 112.26.3.8.42387 > 112.26.3.1.44877: Flags [.], ack 468385, win 24391, options [nop,nop,TS val 54149 ecr 264063,nop,nop,sack 2 {505513:506941}{498373:501229},mptcp dss ack 445893380], length 0
10:42:46.137089 IP 112.26.3.1.44877 > 112.26.3.8.42387: Flags [.], seq 516937:518365, ack 1, win 4017, options [nop,nop,TS val 266751 ecr 52587,mptcp dss ack 3454339951 seq 445999052 subseq 516937 len 1428 csum 0x417a], length 1428
10:42:46.139306 IP 112.26.3.8.42387 > 112.26.3.1.44877: Flags [.], ack 468385, win 24391, options [nop,nop,TS val 54925 ecr 264063,nop,nop,sack 2 {505513:518365}{498373:501229},mptcp dss ack 445893380], length 0
10:42:46.217654 IP 112.26.3.8.42387 > 112.26.3.1.44877: Flags [.], ack 468385, win 24391, options [nop,nop,TS val 54321 ecr 264063,nop,nop,sack 2 {505513:509797}{498373:501229},mptcp dss ack 445893380], length 0
10:42:46.219305 IP 112.26.3.8.42387 > 112.26.3.1.44877: Flags [.], ack 468385, win 24391, options [nop,nop,TS val 54321 ecr 264063,nop,nop,sack 2 {505513:509797}{498373:501229},mptcp dss ack 445893380], length 0
10:42:46.258717 IP 112.26.3.1.44877 > 112.26.3.8.42387: Flags [.], seq 518365:519793, ack 1, win 4017, options [nop,nop,TS val 267128 ecr 53036,mptcp dss ack 3454339951 seq 446017616 subseq 518365 len 1428 csum 0x9fdb], length 1428
10:42:46.261004 IP 112.26.3.8.42387 > 112.26.3.1.44877: Flags [.], ack 468385, win 24391, options [nop,nop,TS val 55047 ecr 264063,nop,nop,sack 2 {505513:519793}{498373:501229},mptcp dss ack 445893380], length 0
10:42:46.346800 IP 112.26.3.8.42387 > 112.26.3.1.44877: Flags [.], ack 468385, win 24391, options [nop,nop,TS val 54418 ecr 264063,nop,nop,sack 2 {505513:511225}{498373:501229},mptcp dss ack 445893380], length 0
10:42:46.349923 IP 112.26.3.8.42387 > 112.26.3.1.44877: Flags [.], ack 468385, win 24391, options [nop,nop,TS val 54418 ecr 264063,nop,nop,sack 2 {505513:511225}{498373:501229},mptcp dss ack 445893380], length 0
10:42:46.407553 IP 112.26.3.8.42387 > 112.26.3.1.44877: Flags [.], ack 468385, win 24391, options [nop,nop,TS val 54490 ecr 264063,nop,nop,sack 2 {505513:512653}{498373:501229},mptcp dss ack 445893380], length 0
10:42:46.413724 IP 112.26.3.8.42387 > 112.26.3.1.44877: Flags [.], ack 468385, win 24391, options [nop,nop,TS val 54490 ecr 264063,nop,nop,sack 2 {505513:512653}{498373:501229},mptcp dss ack 445893380], length 0
10:42:46.475455 IP 112.26.3.8.42387 > 112.26.3.1.44877: Flags [.], ack 468385, win 24391, options [nop,nop,TS val 54536 ecr 264063,nop,nop,sack 2 {505513:514081}{498373:501229},mptcp dss ack 445893380], length 0
10:42:46.552502 IP 112.26.3.1.44877 > 112.26.3.8.42387: Flags [.], seq 485521:486949, ack 1, win 4017, options [nop,nop,TS val 267935 ecr 53932,mptcp dss ack 3454339951 seq 445929080 subseq 485521 len 1428 csum 0x488c], length 1428
10:42:46.558483 IP 112.26.3.8.42387 > 112.26.3.1.44877: Flags [.], ack 468385, win 24391, options [nop,nop,TS val 55341 ecr 264063,nop,nop,sack 2 {485521:488377}{505513:519793},mptcp dss ack 445893380], length 0
