10:42:02.529064 IP 112.26.3.8.42387 > 112.26.3.1.44877: Flags [S], seq 3404096348, win 65535, options [mss 1460,sackOK,TS val 11180 ecr 0,nop,wscale 6,mptcp join id 6 token 0x187b1b60 nonce 0x63255531], length 0
10:42:02.562342 IP 112.26.3.1.44877 > 112.26.3.8.42387: Flags [S.], seq 3834564252, ack 3404096349, win 65535, options [mss 1460,sackOK,TS val 224668 ecr 11180,nop,wscale 6,mptcp join id 5 hmac 0xcb2ba0bbb54b93af nonce 0x6a8a083b], length 0
10:42:02.679671 IP 112.26.3.1.44877 > 112.26.3.8.42387: Flags [S.], seq 3834564252, ack 3404096349, win 65535, options [mss 1460,sackOK,TS val 224668 ecr 11180,nop,wscale 6,mptcp join id 5 hmac 0xcb2ba0bbb54b93af nonce 0x6a8a083b], length 0
10:42:02.799953 IP 112.26.3.8.42387 > 112.26.3.1.44877: Flags [.], ack 1, win 7072, options [nop,nop,TS val 11508 ecr 224668,mptcp join hmac 0x6751ff0d8d5836226ca8bca04d26c0f7c656fb92], length 0
10:42:02.800330 IP 112.26.3.1.44877 > 112.26.3.8.42387: Flags [.], ack 1, win 4017, options [nop,nop,TS val 224938 ecr 11508,mptcp dss ack 3454339951], length 0
10:42:02.807373 IP 112.26.3.1.44877 > 112.26.3.8.42387: Flags [.], ack 1, win 4017, options [nop,nop,TS val 224938 ecr 11508,mptcp dss ack 3454339951], length 0
10:42:02.818515 IP 112.26.3.1.44877 > 112.26.3.8.42387: Flags [.], seq 1:1429, ack 1, win 4017, options [nop,nop,TS val 224957 ecr 11508,mptcp dss ack 3454339951 seq 444228332 subseq 1 len 1428 csum 0xdf54], length 1428
10:42:38.699800 IP 112.26.3.1.44877 > 112.26.3.8.42387: Flags [.], seq 402697:404125, ack 1, win 4017, options [nop,nop,TS val 260509 ecr 46984,mptcp dss ack 3454339951 seq 445710596 subseq 402697 len 1428 csum 0x15a8], length 1428
10:42:38.777428 IP 112.26.3.8.42387 > 112.26.3.1.44877: Flags [.], ack 396985, win 24540, options [nop,nop,TS val 47328 ecr 260001,mptcp dss ack 445604924], length 0
10:42:38.777940 IP 112.26.3.1.44877 > 112.26.3.8.42387: Flags [.], seq 405553:406981, ack 1, win 4017, options [nop,nop,TS val 260916 ecr 47328,mptcp dss ack 3454339951 seq 445724876 subseq 405553 len 1428 csum 0x2d07], length 1428
10:42:38.778069 IP 112.26.3.1.44877 > 112.26.3.8.42387: Flags [.], seq 406981:408409, ack 1, win 4017, options [nop,nop,TS val 260916 ecr 47328,mptcp dss ack 3454339951 seq 445726304 subseq 406981 len 1428 csum 0x9e83], length 1428
10:42:38.778252 IP 112.26.3.1.44877 > 112.26.3.8.42387: Flags [.], seq 408409:409837, ack 1, win 4017, options [nop,nop,TS val 260916 ecr 47328,mptcp dss ack 3454339951 seq 445727732 subseq 408409 len 1428 csum 0x44d9], length 1428
10:42:38.778356 IP 112.26.3.1.44877 > 112.26.3.8.42387: Flags [.], seq 409837:411265, ack 1, win 4017, options [nop,nop,TS val 260916 ecr 47328,mptcp dss ack 3454339951 seq 445729160 subseq 409837 len 1428 csum 0x6b51], length 1428
10:42:38.778503 IP 112.26.3.1.44877 > 112.26.3.8.42387: Flags [.], seq 411265:412693, ack 1, win 4017, options [nop,nop,TS val 260916 ecr 47328,mptcp dss ack 3454339951 seq 445730588 subseq 411265 len 1428 csum 0x88c], length 1428
10:42:38.809640 IP 112.26.3.1.44877 > 112.26.3.8.42387: Flags [.], seq 404125:405553, ack 1, win 4017, options [nop,nop,TS val 260509 ecr 46984,mptcp dss ack 3454339951 seq 445712024 subseq 404125 len 1428 csum 0x562d], length 1428
10:42:38.911975 IP 112.26.3.1.44877 > 112.26.3.8.42387: Flags [.], seq 405553:406981, ack 1, win 4017, options [nop,nop,TS val 260916 ecr 47328,mptcp dss ack 3454339951 seq 445724876 subseq 405553 len 1428 csum 0x2d07], length 1428
10:42:38.964433 IP 112.26.3.1.44877 > 112.26.3.8.42387: Flags [.], seq 406981:408409, ack 1, win 4017, options [nop,nop,TS val 260916 ecr 47328,mptcp dss ack 3454339951 seq 445726304 subseq 406981 len 1428 csum 0x9e83], length 1428
10:42:39.021967 IP 112.26.3.8.42387 > 112.26.3.1.44877: Flags [.], ack 401269, win 24311, options [nop,nop,TS val 47608 ecr 260422,mptcp dss ack 445659188], length 0
10:42:39.022432 IP 112.26.3.1.44877 > 112.26.3.8.42387: Flags [.], seq 412693:414121, ack 1, win 4017, options [nop,nop,TS val 261161 ecr 47608,mptcp dss ack 3454339951 seq 445740584 subseq 412693 len 1428 csum 0xb5a], length 1428
10:42:39.022494 IP 112.26.3.1.44877 > 112.26.3.8.42387: Flags [.], seq 414121:415549, ack 1, win 4017, options [nop,nop,TS val 261161 ecr 47608,mptcp dss ack 3454339951 seq 445742012 subseq 414121 len 1428 csum 0x2196], length 1428
10:42:39.022691 IP 112.26.3.1.44877 > 112.26.3.8.42387: Flags [.], seq 415549:416977, ack 1, win 4017, options [nop,nop,TS val 261161 ecr 47608,mptcp dss ack 3454339951 seq 445743440 subseq 415549 len 1428 csum 0xf46d], length 1428
10:42:39.022796 IP 112.26.3.1.44877 > 112.26.3.8.42387: Flags [.], seq 416977:418405, ack 1, win 4017, options [nop,nop,TS val 261161 ecr 47608,mptcp dss ack 3454339951 seq 445744868 subseq 416977 len 1428 csum 0xa113], length 1428
10:42:39.023009 IP 112.26.3.1.44877 > 112.26.3.8.42387: Flags [.], seq 418405:419833, ack 1, win 4017, options [nop,nop,TS val 261161 ecr 47608,mptcp dss ack 3454339951 seq 445746296 subseq 418405 len 1428 csum 0xa31b], length 1428
10:42:39.063520 IP 112.26.3.1.44877 > 112.26.3.8.42387: Flags [.], seq 408409:409837, ack 1, win 4017, options [nop,nop,TS val 260916 ecr 47328,mptcp dss ack 3454339951 seq 445727732 subseq 408409 len 1428 csum 0x44d9], length 1428
10:42:39.168996 IP 112.26.3.1.44877 > 112.26.3.8.42387: Flags [.], seq 409837:411265, ack 1, win 4017, options [nop,nop,TS val 260916 ecr 47328,mptcp dss ack 3454339951 seq 445729160 subseq 409837 len 1428 csum 0x6b51], length 1428
10:42:39.238669 IP 112.26.3.1.44877 > 112.26.3.8.42387: Flags [.], seq 411265:412693, ack 1, win 4017, options [nop,nop,TS val 260916 ecr 47328,mptcp dss ack 3454339951 seq 445730588 subseq 411265 len 1428 csum 0x88c], length 1428
10:42:39.281803 IP 112.26.3.1.44877 > 112.26.3.8.42387: Flags [.], seq 412693:414121, ack 1, win 4017, options [nop,nop,TS val 261161 ecr 47608,mptcp dss ack 3454339951 seq 445740584 subseq 412693 len 1428 csum 0xb5a], length 1428
10:42:39.322213 IP 112.26.3.8.42387 > 112.26.3.1.44877: Flags [.], ack 406981, win 24311, options [nop,nop,TS val 47875 ecr 260422,mptcp dss ack 445659188], length 0
10:42:39.322551 IP 112.26.3.1.44877 > 112.26.3.8.42387: Flags [.], seq 419833:421261, ack 1, win 4017, options [nop,nop,TS val 261461 ecr 47875,mptcp dss ack 3454339951 seq 445756292 subseq 419833 len 1428 csum 0x1790], length 1428
10:42:39.322645 IP 112.26.3.1.44877 > 112.26.3.8.42387: Flags [.], seq 421261:422689, ack 1, win 4017, options [nop,nop,TS val 261461 ecr 47875,mptcp dss ack 3454339951 seq 445757720 subseq 421261 len 1428 csum 0x49ff], length 1428
10:42:39.322808 IP 112.26.3.1.44877 > 112.26.3.8.42387: Flags [.], seq 422689:424117, ack 1, win 4017, options [nop,nop,TS val 261461 ecr 47875,mptcp dss ack 3454339951 seq 445759148 subseq 422689 len 1428 csum 0x9714], length 1428
10:42:39.322913 IP 112.26.3.1.44877 > 112.26.3.8.42387: Flags [.], seq 424117:425545, ack 1, win 4017, options [nop,nop,TS val 261461 ecr 47875,mptcp dss ack 3454339951 seq 445760576 subseq 424117 len 1428 csum 0xd325], length 1428
10:42:39.398127 IP 112.26.3.1.44877 > 112.26.3.8.42387: Flags [.], seq 414121:415549, ack 1, win 4017, options [nop,nop,TS val 261161 ecr 47608,mptcp dss ack 3454339951 seq 445742012 subseq 414121 len 1428 csum 0x2196], length 1428
10:42:39.488083 IP 112.26.3.1.44877 > 112.26.3.8.42387: Flags [.], seq 415549:416977, ack 1, win 4017, options [nop,nop,TS val 261161 ecr 47608,mptcp dss ack 3454339951 seq 445743440 subseq 415549 len 1428 csum 0xf46d], length 1428
10:42:39.560405 IP 112.26.3.1.44877 > 112.26.3.8.42387: Flags [.], seq 416977:418405, ack 1, win 4017, options [nop,nop,TS val 261161 ecr 47608,mptcp dss ack 3454339951 seq 445744868 subseq 416977 len 1428 csum 0xa113], length 1428
10:42:39.621518 IP 112.26.3.1.44877 > 112.26.3.8.42387: Flags [.], seq 418405:419833, ack 1, win 4017, options [nop,nop,TS val 261161 ecr 47608,mptcp dss ack 3454339951 seq 445746296 subseq 418405 len 1428 csum 0xa31b], length 1428
10:42:39.665759 IP 112.26.3.8.42387 > 112.26.3.1.44877: Flags [.], ack 409837, win 24311, options [nop,nop,TS val 48096 ecr 260916,mptcp dss ack 445659188], length 0
10:42:39.666294 IP 112.26.3.1.44877 > 112.26.3.8.42387: Flags [.], seq 425545:426973, ack 1, win 4017, options [nop,nop,TS val 261804 ecr 48096,mptcp dss ack 3454339951 seq 445764860 subseq 425545 len 1428 csum 0x54e8], length 1428
10:42:39.666360 IP 112.26.3.1.44877 > 112.26.3.8.42387: Flags [.], seq 426973:428401, ack 1, win 4017, options [nop,nop,TS val 261804 ecr 48096,mptcp dss ack 3454339951 seq 445766288 subseq 426973 len 1428 csum 0x658a], length 1428
10:42:39.666529 IP 112.26.3.1.44877 > 112.26.3.8.42387: Flags [.], seq 428401:429829, ack 1, win 4017, options [nop,nop,TS val 261804 ecr 48096,mptcp dss ack 3454339951 seq 445767716 subseq 428401 len 1428 csum 0x7aac], length 1428
10:42:39.703275 IP 112.26.3.1.44877 > 112.26.3.8.42387: Flags [.], seq 419833:421261, ack 1, win 4017, options [nop,nop,TS val 261461 ecr 47875,mptcp dss ack 3454339951 seq 445756292 subseq 419833 len 1428 csum 0x1790], length 1428
10:42:39.752563 IP 112.26.3.1.44877 > 112.26.3.8.42387: Flags [.], seq 421261:422689, ack 1, win 4017, options [nop,nop,TS val 261461 ecr 47875,mptcp dss ack 3454339951 seq 445757720 subseq 421261 len 1428 csum 0x49ff], length 1428
10:42:39.824598 IP 112.26.3.1.44877 > 112.26.3.8.42387: Flags [.], seq 422689:424117, ack 1, win 4017, options [nop,nop,TS val 261461 ecr 47875,mptcp dss ack 3454339951 seq 445759148 subseq 422689 len 1428 csum 0x9714], length 1428
10:42:39.910246 IP 112.26.3.1.44877 > 112.26.3.8.42387: Flags [.], seq 424117:425545, ack 1, win 4017, options [nop,nop,TS val 261461 ecr 47875,mptcp dss ack 3454339951 seq 445760576 subseq 424117 len 1428 csum 0xd325], length 1428
10:42:39.961615 IP 112.26.3.1.44877 > 112.26.3.8.42387: Flags [.], seq 425545:426973, ack 1, win 4017, options [nop,nop,TS val 261804 ecr 48096,mptcp dss ack 3454339951 seq 445764860 subseq 425545 len 1428 csum 0x54e8], length 1428
10:42:40.041679 IP 112.26.3.1.44877 > 112.26.3.8.42387: Flags [.], seq 426973:428401, ack 1, win 4017, options [nop,nop,TS val 261804 ecr 48096,mptcp dss ack 3454339951 seq 445766288 subseq 426973 len 1428 csum 0x658a], length 1428
10:42:40.065021 IP 112.26.3.8.42387 > 112.26.3.1.44877: Flags [.], ack 415549, win 24311, options [nop,nop,TS val 48508 ecr 260916,mptcp dss ack 445659188], length 0
10:42:40.065328 IP 112.26.3.1.44877 > 112.26.3.8.42387: Flags [.], seq 429829:431257, ack 1, win 4017, options [nop,nop,TS val 262203 ecr 48508,mptcp dss ack 3454339951 seq 445787708 subseq 429829 len 1428 csum 0xdfd0], length 1428
10:42:40.065425 IP 112.26.3.1.44877 > 112.26.3.8.42387: Flags [.], seq 431257:432685, ack 1, win 4017, options [nop,nop,TS val 262203 ecr 48508,mptcp dss ack 3454339951 seq 445789136 subseq 431257 len 1428 csum 0xa12d], length 1428
10:42:40.065635 IP 112.26.3.1.44877 > 112.26.3.8.42387: Flags [.], seq 432685:434113, ack 1, win 4017, options [nop,nop,TS val 262203 ecr 48508,mptcp dss ack 3454339951 seq 445790564 subseq 432685 len 1428 csum 0x2a3d], length 1428
10:42:40.065770 IP 112.26.3.1.44877 > 112.26.3.8.42387: Flags [.], seq 434113:435541, ack 1, win 4017, options [nop,nop,TS val 262203 ecr 48508,mptcp dss ack 3454339951 seq 445791992 subseq 434113 len 1428 csum 0x2b6c], length 1428
10:42:40.065948 IP 112.26.3.1.44877 > 112.26.3.8.42387: Flags [.], seq 435541:436969, ack 1, win 4017, options [nop,nop,TS val 262203 ecr 48508,mptcp dss ack 3454339951 seq 445793420 subseq 435541 len 1428 csum 0xdc5b], length 1428
10:42:40.066077 IP 112.26.3.1.44877 > 112.26.3.8.42387: Flags [.], seq 436969:438397, ack 1, win 4017, options [nop,nop,TS val 262203 ecr 48508,mptcp dss ack 3454339951 seq 445794848 subseq 436969 len 1428 csum 0xf232], length 1428
10:42:40.149616 IP 112.26.3.1.44877 > 112.26.3.8.42387: Flags [.], seq 428401:429829, ack 1, win 4017, options [nop,nop,TS val 261804 ecr 48096,mptcp dss ack 3454339951 seq 445767716 subseq 428401 len 1428 csum 0x7aac], length 1428
10:42:40.260992 IP 112.26.3.1.44877 > 112.26.3.8.42387: Flags [.], seq 429829:431257, ack 1, win 4017, options [nop,nop,TS val 262203 ecr 48508,mptcp dss ack 3454339951 seq 445787708 subseq 429829 len 1428 csum 0xdfd0], length 1428
10:42:40.319672 IP 112.26.3.8.42387 > 112.26.3.1.44877: Flags [.], ack 418405, win 23613, options [nop,nop,TS val 48655 ecr 261161,mptcp dss ack 445734872], length 0
10:42:40.320045 IP 112.26.3.1.44877 > 112.26.3.8.42387: Flags [.], seq 438397:439825, ack 1, win 4017, options [nop,nop,TS val 262458 ecr 48655,mptcp dss ack 3454339951 seq 445807700 subseq 438397 len 1428 csum 0x2974], length 1428
10:42:40.320116 IP 112.26.3.1.44877 > 112.26.3.8.42387: Flags [.], seq 439825:441253, ack 1, win 4017, options [nop,nop,TS val 262458 ecr 48655,mptcp dss ack 3454339951 seq 445809128 subseq 439825 len 1428 csum 0xe62d], length 1428
10:42:40.320273 IP 112.26.3.1.44877 > 112.26.3.8.42387: Flags [.], seq 441253:442681, ack 1, win 4017, options [nop,nop,TS val 262458 ecr 48655,mptcp dss ack 3454339951 seq 445810556 subseq 441253 len 1428 csum 0xdef6], length 1428
10:42:40.384632 IP 112.26.3.1.44877 > 112.26.3.8.42387: Flags [.], seq 431257:432685, ack 1, win 4017, options [nop,nop,TS val 262203 ecr 48508,mptcp dss ack 3454339951 seq 445789136 subseq 431257 len 1428 csum 0xa12d], length 1428
10:42:40.469969 IP 112.26.3.1.44877 > 112.26.3.8.42387: Flags [.], seq 432685:434113, ack 1, win 4017, options [nop,nop,TS val 262203 ecr 48508,mptcp dss ack 3454339951 seq 445790564 subseq 432685 len 1428 csum 0x2a3d], length 1428
10:42:40.565011 IP 112.26.3.1.44877 > 112.26.3.8.42387: Flags [.], seq 434113:435541, ack 1, win 4017, options [nop,nop,TS val 262203 ecr 48508,mptcp dss ack 3454339951 seq 445791992 subseq 434113 len 1428 csum 0x2b6c], length 1428
10:42:40.609445 IP 112.26.3.8.42387 > 112.26.3.1.44877: Flags [.], ack 421261, win 24429, options [nop,nop,TS val 48763 ecr 261161,mptcp dss ack 445734872], length 0
10:42:40.609820 IP 112.26.3.1.44877 > 112.26.3.8.42387: Flags [.], seq 442681:444109, ack 1, win 4017, options [nop,nop,TS val 262748 ecr 48763,mptcp dss ack 3454339951 seq 445813412 subseq 442681 len 1428 csum 0x4d6], length 1428
10:42:40.609897 IP 112.26.3.1.44877 > 112.26.3.8.42387: Flags [.], seq 444109:445537, ack 1, win 4017, options [nop,nop,TS val 262748 ecr 48763,mptcp dss ack 3454339951 seq 445814840 subseq 444109 len 1428 csum 0x5523], length 1428
10:42:40.610052 IP 112.26.3.1.44877 > 112.26.3.8.42387: Flags [.], seq 445537:446965, ack 1, win 4017, options [nop,nop,TS val 262748 ecr 48763,mptcp dss ack 3454339951 seq 445816268 subseq 445537 len 1428 csum 0x3a18], length 1428
10:42:40.643247 IP 112.26.3.1.44877 > 112.26.3.8.42387: Flags [.], seq 435541:436969, ack 1, win 4017, options [nop,nop,TS val 262203 ecr 48508,mptcp dss ack 3454339951 seq 445793420 subseq 435541 len 1428 csum 0xdc5b], length 1428
10:42:40.720610 IP 112.26.3.1.44877 > 112.26.3.8.42387: Flags [.], seq 436969:438397, ack 1, win 4017, options [nop,nop,TS val 262203 ecr 48508,mptcp dss ack 3454339951 seq 445794848 subseq 436969 len 1428 csum 0xf232], length 1428
10:42:40.800566 IP 112.26.3.1.44877 > 112.26.3.8.42387: Flags [.], seq 438397:439825, ack 1, win 4017, options [nop,nop,TS val 262458 ecr 48655,mptcp dss ack 3454339951 seq 445807700 subseq 438397 len 1428 csum 0x2974], length 1428
10:42:40.848427 IP 112.26.3.1.44877 > 112.26.3.8.42387: Flags [.], seq 439825:441253, ack 1, win 4017, options [nop,nop,TS val 262458 ecr 48655,mptcp dss ack 3454339951 seq 445809128 subseq 439825 len 1428 csum 0xe62d], length 1428
10:42:40.913150 IP 112.26.3.8.42387 > 112.26.3.1.44877: Flags [.], ack 424117, win 24429, options [nop,nop,TS val 49104 ecr 261461,mptcp dss ack 445734872], length 0
10:42:40.913491 IP 112.26.3.1.44877 > 112.26.3.8.42387: Flags [.], seq 446965:448393, ack 1, win 4017, options [nop,nop,TS val 263052 ecr 49104,mptcp dss ack 3454339951 seq 445834832 subseq 446965 len 1428 csum 0x7016], length 1428
10:42:40.913567 IP 112.26.3.1.44877 > 112.26.3.8.42387: Flags [.], seq 448393:449821, ack 1, win 4017, options [nop,nop,TS val 263052 ecr 49104,mptcp dss ack 3454339951 seq 445836260 subseq 448393 len 1428 csum 0xc0a0], length 1428
10:42:40.958664 IP 112.26.3.1.44877 > 112.26.3.8.42387: Flags [.], seq 441253:442681, ack 1, win 4017, options [nop,nop,TS val 262458 ecr 48655,mptcp dss ack 3454339951 seq 445810556 subseq 441253 len 1428 csum 0xdef6], length 1428
10:42:41.071707 IP 112.26.3.1.44877 > 112.26.3.8.42387: Flags [.], seq 442681:444109, ack 1, win 4017, options [nop,nop,TS val 262748 ecr 48763,mptcp dss ack 3454339951 seq 445813412 subseq 442681 len 1428 csum 0x4d6], length 1428
10:42:41.170244 IP 112.26.3.1.44877 > 112.26.3.8.42387: Flags [.], seq 444109:445537, ack 1, win 4017, options [nop,nop,TS val 262748 ecr 48763,mptcp dss ack 3454339951 seq 445814840 subseq 444109 len 1428 csum 0x5523], length 1428
10:42:41.223053 IP 112.26.3.1.44877 > 112.26.3.8.42387: Flags [.], seq 445537:446965, ack 1, win 4017, options [nop,nop,TS val 262748 ecr 48763,mptcp dss ack 3454339951 seq 445816268 subseq 445537 len 1428 csum 0x3a18], length 1428
10:42:41.265448 IP 112.26.3.8.42387 > 112.26.3.1.44877: Flags [.], ack 428401, win 24429, options [nop,nop,TS val 49467 ecr 261461,mptcp dss ack 445734872], length 0
10:42:41.265777 IP 112.26.3.1.44877 > 112.26.3.8.42387: Flags [.], seq 449821:451249, ack 1, win 4017, options [nop,nop,TS val 263404 ecr 49467,mptcp dss ack 3454339951 seq 445849112 subseq 449821 len 1428 csum 0x7f45], length 1428
10:42:41.265851 IP 112.26.3.1.44877 > 112.26.3.8.42387: Flags [.], seq 451249:452677, ack 1, win 4017, options [nop,nop,TS val 263404 ecr 49467,mptcp dss ack 3454339951 seq 445850540 subseq 451249 len 1428 csum 0x6e3a], length 1428
10:42:41.266001 IP 112.26.3.1.44877 > 112.26.3.8.42387: Flags [.], seq 452677:454105, ack 1, win 4017, options [nop,nop,TS val 263404 ecr 49467,mptcp dss ack 3454339951 seq 445851968 subseq 452677 len 1428 csum 0xdb7a], length 1428
10:42:41.266106 IP 112.26.3.1.44877 > 112.26.3.8.42387: Flags [.], seq 454105:455533, ack 1, win 4017, options [nop,nop,TS val 263404 ecr 49467,mptcp dss ack 3454339951 seq 445853396 subseq 454105 len 1428 csum 0xa96e], length 1428
10:42:41.306471 IP 112.26.3.1.44877 > 112.26.3.8.42387: Flags [.], seq 446965:448393, ack 1, win 4017, options [nop,nop,TS val 263052 ecr 49104,mptcp dss ack 3454339951 seq 445834832 subseq 446965 len 1428 csum 0x7016], length 1428
10:42:41.436482 IP 112.26.3.1.44877 > 112.26.3.8.42387: Flags [.], seq 448393:449821, ack 1, win 4017, options [nop,nop,TS val 263052 ecr 49104,mptcp dss ack 3454339951 seq 445836260 subseq 448393 len 1428 csum 0xc0a0], length 1428
10:42:41.507028 IP 112.26.3.8.42387 > 112.26.3.1.44877: Flags [.], ack 431257, win 24429, options [nop,nop,TS val 49728 ecr 261804,mptcp dss ack 445734872], length 0
10:42:41.507294 IP 112.26.3.1.44877 > 112.26.3.8.42387: Flags [.], seq 455533:456961, ack 1, win 4017, options [nop,nop,TS val 263646 ecr 49728,mptcp dss ack 3454339951 seq 445856252 subseq 455533 len 1428 csum 0xeb4d], length 1428
10:42:41.507367 IP 112.26.3.1.44877 > 112.26.3.8.42387: Flags [.], seq 456961:458389, ack 1, win 4017, options [nop,nop,TS val 263646 ecr 49728,mptcp dss ack 3454339951 seq 445857680 subseq 456961 len 1428 csum 0xe72], length 1428
10:42:41.507519 IP 112.26.3.1.44877 > 112.26.3.8.42387: Flags [.], seq 458389:459817, ack 1, win 4017, options [nop,nop,TS val 263646 ecr 49728,mptcp dss ack 3454339951 seq 445859108 subseq 458389 len 1428 csum 0xa0cf], length 1428
10:42:41.538376 IP 112.26.3.1.44877 > 112.26.3.8.42387: Flags [.], seq 449821:451249, ack 1, win 4017, options [nop,nop,TS val 263404 ecr 49467,mptcp dss ack 3454339951 seq 445849112 subseq 449821 len 1428 csum 0x7f45], length 1428
10:42:41.643722 IP 112.26.3.1.44877 > 112.26.3.8.42387: Flags [.], seq 451249:452677, ack 1, win 4017, options [nop,nop,TS val 263404 ecr 49467,mptcp dss ack 3454339951 seq 445850540 subseq 451249 len 1428 csum 0x6e3a], length 1428
10:42:41.709480 IP 112.26.3.1.44877 > 112.26.3.8.42387: Flags [.], seq 452677:454105, ack 1, win 4017, options [nop,nop,TS val 263404 ecr 49467,mptcp dss ack 3454339951 seq 445851968 subseq 452677 len 1428 csum 0xdb7a], length 1428
10:42:41.803193 IP 112.26.3.1.44877 > 112.26.3.8.42387: Flags [.], seq 454105:455533, ack 1, win 4017, options [nop,nop,TS val 263404 ecr 49467,mptcp dss ack 3454339951 seq 445853396 subseq 454105 len 1428 csum 0xa96e], length 1428
10:42:41.853195 IP 112.26.3.1.44877 > 112.26.3.8.42387: Flags [.], seq 455533:456961, ack 1, win 4017, options [nop,nop,TS val 263646 ecr 49728,mptcp dss ack 3454339951 seq 445856252 subseq 455533 len 1428 csum 0xeb4d], length 1428
10:42:41.901392 IP 112.26.3.1.44877 > 112.26.3.8.42387: Flags [.], seq 456961:458389, ack 1, win 4017, options [nop,nop,TS val 263646 ecr 49728,mptcp dss ack 3454339951 seq 445857680 subseq 456961 len 1428 csum 0xe72], length 1428
10:42:41.924144 IP 112.26.3.8.42387 > 112.26.3.1.44877: Flags [.], ack 436969, win 24429, options [nop,nop,TS val 50040 ecr 262203,mptcp dss ack 445734872], length 0
10:42:41.924497 IP 112.26.3.1.44877 > 112.26.3.8.42387: Flags [.], seq 459817:461245, ack 1, win 4017, options [nop,nop,TS val 264063 ecr 50040,mptcp dss ack 3454339951 seq 445863392 subseq 459817 len 1428 csum 0xf7d6], length 1428
10:42:41.924600 IP 112.26.3.1.44877 > 112.26.3.8.42387: Flags [.], seq 461245:462673, ack 1, win 4017, options [nop,nop,TS val 264063 ecr 50040,mptcp dss ack 3454339951 seq 445864820 subseq 461245 len 1428 csum 0x6e3f], length 1428
10:42:41.924767 IP 112.26.3.1.44877 > 112.26.3.8.42387: Flags [.], seq 462673:464101, ack 1, win 4017, options [nop,nop,TS val 264063 ecr 50040,mptcp dss ack 3454339951 seq 445866248 subseq 462673 len 1428 csum 0xe148], length 1428
10:42:41.924872 IP 112.26.3.1.44877 > 112.26.3.8.42387: Flags [.], seq 464101:465529, ack 1, win 4017, options [nop,nop,TS val 264063 ecr 50040,mptcp dss ack 3454339951 seq 445867676 subseq 464101 len 1428 csum 0xddbb], length 1428
10:42:41.925054 IP 112.26.3.1.44877 > 112.26.3.8.42387: Flags [.], seq 465529:466957, ack 1, win 4017, options [nop,nop,TS val 264063 ecr 50040,mptcp dss ack 3454339951 seq 445869104 subseq 465529 len 1428 csum 0x59e8], length 1428
10:42:41.925158 IP 112.26.3.1.44877 > 112.26.3.8.42387: Flags [.], seq 466957:468385, ack 1, win 4017, options [nop,nop,TS val 264063 ecr 50040,mptcp dss ack 3454339951 seq 445870532 subseq 466957 len 1428 csum 0xe5c4], length 1428
10:42:41.975044 IP 112.26.3.1.44877 > 112.26.3.8.42387: Flags [.], seq 458389:459817, ack 1, win 4017, options [nop,nop,TS val 263646 ecr 49728,mptcp dss ack 3454339951 seq 445859108 subseq 458389 len 1428 csum 0xa0cf], length 1428
10:42:42.066381 IP 112.26.3.1.44877 > 112.26.3.8.42387: Flags [.], seq 459817:461245, ack 1, win 4017, options [nop,nop,TS val 264063 ecr 50040,mptcp dss ack 3454339951 seq 445863392 subseq 459817 len 1428 csum 0xf7d6], length 1428
10:42:42.151950 IP 112.26.3.1.44877 > 112.26.3.8.42387: Flags [.], seq 461245:462673, ack 1, win 4017, options [nop,nop,TS val 264063 ecr 50040,mptcp dss ack 3454339951 seq 445864820 subseq 461245 len 1428 csum 0x6e3f], length 1428
10:42:42.162138 IP 112.26.3.8.42387 > 112.26.3.1.44877: Flags [.], ack 442681, win 24429, options [nop,nop,TS val 50364 ecr 262203,mptcp dss ack 445734872], length 0
10:42:42.162486 IP 112.26.3.1.44877 > 112.26.3.8.42387: Flags [.], seq 468385:469813, ack 1, win 4017, options [nop,nop,TS val 264300 ecr 50364,mptcp dss ack 3454339951 seq 445893380 subseq 468385 len 1428 csum 0x8463], length 1428
10:42:42.162561 IP 112.26.3.1.44877 > 112.26.3.8.42387: Flags [.], seq 469813:471241, ack 1, win 4017, options [nop,nop,TS val 264300 ecr 50364,mptcp dss ack 3454339951 seq 445894808 subseq 469813 len 1428 csum 0x77ad], length 1428
10:42:42.162738 IP 112.26.3.1.44877 > 112.26.3.8.42387: Flags [.], seq 471241:472669, ack 1, win 4017, options [nop,nop,TS val 264300 ecr 50364,mptcp dss ack 3454339951 seq 445896236 subseq 471241 len 1428 csum 0x2b31], length 1428
10:42:42.162849 IP 112.26.3.1.44877 > 112.26.3.8.42387: Flags [P.], seq 472669:474097, ack 1, win 4017, options [nop,nop,TS val 264300 ecr 50364,mptcp dss ack 3454339951 seq 445897664 subseq 472669 len 1428 csum 0xe3bf], length 1428
10:42:42.162995 IP 112.26.3.1.44877 > 112.26.3.8.42387: Flags [.], seq 474097:475525, ack 1, win 4017, options [nop,nop,TS val 264300 ecr 50364,mptcp dss ack 3454339951 seq 445899092 subseq 474097 len 1428 csum 0x7eaa], length 1428
10:42:42.163097 IP 112.26.3.1.44877 > 112.26.3.8.42387: Flags [.], seq 475525:476953, ack 1, win 4017, options [nop,nop,TS val 264300 ecr 50364,mptcp dss ack 3454339951 seq 445900520 subseq 475525 len 1428 csum 0xbbdd], length 1428
10:42:42.264009 IP 112.26.3.1.44877 > 112.26.3.8.42387: Flags [.], seq 462673:464101, ack 1, win 4017, options [nop,nop,TS val 264063 ecr 50040,mptcp dss ack 3454339951 seq 445866248 subseq 462673 len 1428 csum 0xe148], length 1428
10:42:42.375327 IP 112.26.3.1.44877 > 112.26.3.8.42387: Flags [.], seq 464101:465529, ack 1, win 4017, options [nop,nop,TS val 264063 ecr 50040,mptcp dss ack 3454339951 seq 445867676 subseq 464101 len 1428 csum 0xddbb], length 1428
10:42:42.457858 IP 112.26.3.8.42387 > 112.26.3.1.44877: Flags [.], ack 446965, win 23849, options [nop,nop,TS val 50653 ecr 262748,mptcp dss ack 445772000], length 0
10:42:42.458215 IP 112.26.3.1.44877 > 112.26.3.8.42387: Flags [.], seq 476953:478381, ack 1, win 4017, options [nop,nop,TS val 264597 ecr 50653,mptcp dss ack 3454339951 seq 445919084 subseq 476953 len 1428 csum 0xa380], length 1428
10:42:42.458315 IP 112.26.3.1.44877 > 112.26.3.8.42387: Flags [.], seq 478381:479809, ack 1, win 4017, options [nop,nop,TS val 264597 ecr 50653,mptcp dss ack 3454339951 seq 445920512 subseq 478381 len 1428 csum 0x2530], length 1428
10:42:42.458506 IP 112.26.3.1.44877 > 112.26.3.8.42387: Flags [.], seq 479809:481237, ack 1, win 4017, options [nop,nop,TS val 264597 ecr 50653,mptcp dss ack 3454339951 seq 445921940 subseq 479809 len 1428 csum 0x63e7], length 1428
10:42:42.458666 IP 112.26.3.1.44877 > 112.26.3.8.42387: Flags [.], seq 481237:482665, ack 1, win 4017, options [nop,nop,TS val 264597 ecr 50653,mptcp dss ack 3454339951 seq 445923368 subseq 481237 len 1428 csum 0x880], length 1428
10:42:42.458881 IP 112.26.3.1.44877 > 112.26.3.8.42387: Flags [.], seq 482665:484093, ack 1, win 4017, options [nop,nop,TS val 264597 ecr 50653,mptcp dss ack 3454339951 seq 445924796 subseq 482665 len 1428 csum 0x4c42], length 1428
10:42:42.496139 IP 112.26.3.1.44877 > 112.26.3.8.42387: Flags [.], seq 465529:466957, ack 1, win 4017, options [nop,nop,TS val 264063 ecr 50040,mptcp dss ack 3454339951 seq 445869104 subseq 465529 len 1428 csum 0x59e8], length 1428
10:42:42.560810 IP 112.26.3.1.44877 > 112.26.3.8.42387: Flags [.], seq 466957:468385, ack 1, win 4017, options [nop,nop,TS val 264063 ecr 50040,mptcp dss ack 3454339951 seq 445870532 subseq 466957 len 1428 csum 0xe5c4], length 1428
10:42:42.647436 IP 112.26.3.8.42387 > 112.26.3.1.44877: Flags [.], ack 449821, win 23955, options [nop,nop,TS val 50830 ecr 263052,mptcp dss ack 445772000], length 0
10:42:42.647929 IP 112.26.3.1.44877 > 112.26.3.8.42387: Flags [.], seq 484093:485521, ack 1, win 4017, options [nop,nop,TS val 264786 ecr 50830,mptcp dss ack 3454339951 seq 445927652 subseq 484093 len 1428 csum 0x7b8], length 1428
10:42:42.647993 IP 112.26.3.1.44877 > 112.26.3.8.42387: Flags [.], seq 485521:486949, ack 1, win 4017, options [nop,nop,TS val 264786 ecr 50830,mptcp dss ack 3454339951 seq 445929080 subseq 485521 len 1428 csum 0x488c], length 1428
10:42:42.665624 IP 112.26.3.1.44877 > 112.26.3.8.42387: Flags [.], seq 468385:469813, ack 1, win 4017, options [nop,nop,TS val 264300 ecr 50364,mptcp dss ack 3454339951 seq 445893380 subseq 468385 len 1428 csum 0x8463], length 1428
10:42:42.799500 IP 112.26.3.1.44877 > 112.26.3.8.42387: Flags [.], seq 469813:471241, ack 1, win 4017, options [nop,nop,TS val 264300 ecr 50364,mptcp dss ack 3454339951 seq 445894808 subseq 469813 len 1428 csum 0x77ad], length 1428
10:42:42.847836 IP 112.26.3.8.42387 > 112.26.3.1.44877: Flags [.], ack 452677, win 23955, options [nop,nop,TS val 50986 ecr 263404,mptcp dss ack 445772000], length 0
10:42:42.848143 IP 112.26.3.1.44877 > 112.26.3.8.42387: Flags [.], seq 486949:488377, ack 1, win 4017, options [nop,nop,TS val 264987 ecr 50986,mptcp dss ack 3454339951 seq 445854824 subseq 486949 len 1428 csum 0xe204], length 1428
10:42:42.848216 IP 112.26.3.1.44877 > 112.26.3.8.42387: Flags [.], seq 488377:489805, ack 1, win 4017, options [nop,nop,TS val 264987 ecr 50986,mptcp dss ack 3454339951 seq 445871960 subseq 488377 len 1428 csum 0xa995], length 1428
10:42:42.848374 IP 112.26.3.1.44877 > 112.26.3.8.42387: Flags [.], seq 489805:491233, ack 1, win 4017, options [nop,nop,TS val 264987 ecr 50986,mptcp dss ack 3454339951 seq 445873388 subseq 489805 len 1428 csum 0x40f8], length 1428
10:42:42.894944 IP 112.26.3.1.44877 > 112.26.3.8.42387: Flags [.], seq 471241:472669, ack 1, win 4017, options [nop,nop,TS val 264300 ecr 50364,mptcp dss ack 3454339951 seq 445896236 subseq 471241 len 1428 csum 0x2b31], length 1428
10:42:43.011765 IP 112.26.3.1.44877 > 112.26.3.8.42387: Flags [P.], seq 472669:474097, ack 1, win 4017, options [nop,nop,TS val 264300 ecr 50364,mptcp dss ack 3454339951 seq 445897664 subseq 472669 len 1428 csum 0xe3bf], length 1428
10:42:43.066978 IP 112.26.3.8.42387 > 112.26.3.1.44877: Flags [.], ack 456961, win 23955, options [nop,nop,TS val 51248 ecr 263404,mptcp dss ack 445772000], length 0
10:42:43.067306 IP 112.26.3.1.44877 > 112.26.3.8.42387: Flags [.], seq 491233:492661, ack 1, win 4017, options [nop,nop,TS val 265206 ecr 51248,mptcp dss ack 3454339951 seq 445887668 subseq 491233 len 1428 csum 0x2e12], length 1428
10:42:43.067380 IP 112.26.3.1.44877 > 112.26.3.8.42387: Flags [.], seq 492661:494089, ack 1, win 4017, options [nop,nop,TS val 265206 ecr 51248,mptcp dss ack 3454339951 seq 445889096 subseq 492661 len 1428 csum 0xe393], length 1428
10:42:43.067530 IP 112.26.3.1.44877 > 112.26.3.8.42387: Flags [.], seq 494089:495517, ack 1, win 4017, options [nop,nop,TS val 265206 ecr 51248,mptcp dss ack 3454339951 seq 445901948 subseq 494089 len 1428 csum 0x96cf], length 1428
10:42:43.067665 IP 112.26.3.1.44877 > 112.26.3.8.42387: Flags [.], seq 495517:496945, ack 1, win 4017, options [nop,nop,TS val 265206 ecr 51248,mptcp dss ack 3454339951 seq 445904804 subseq 495517 len 1428 csum 0x4924], length 1428
10:42:43.100641 IP 112.26.3.1.44877 > 112.26.3.8.42387: Flags [.], seq 474097:475525, ack 1, win 4017, options [nop,nop,TS val 264300 ecr 50364,mptcp dss ack 3454339951 seq 445899092 subseq 474097 len 1428 csum 0x7eaa], length 1428
10:42:43.218767 IP 112.26.3.1.44877 > 112.26.3.8.42387: Flags [.], seq 475525:476953, ack 1, win 4017, options [nop,nop,TS val 264300 ecr 50364,mptcp dss ack 3454339951 seq 445900520 subseq 475525 len 1428 csum 0xbbdd], length 1428
10:42:43.307382 IP 112.26.3.8.42387 > 112.26.3.1.44877: Flags [.], ack 459817, win 24050, options [nop,nop,TS val 51382 ecr 263646,mptcp dss ack 445801988], length 0
10:42:43.307704 IP 112.26.3.1.44877 > 112.26.3.8.42387: Flags [.], seq 496945:498373, ack 1, win 4017, options [nop,nop,TS val 265446 ecr 51382,mptcp dss ack 3454339951 seq 445936220 subseq 496945 len 1428 csum 0xebe7], length 1428
10:42:43.307780 IP 112.26.3.1.44877 > 112.26.3.8.42387: Flags [.], seq 498373:499801, ack 1, win 4017, options [nop,nop,TS val 265446 ecr 51382,mptcp dss ack 3454339951 seq 445937648 subseq 498373 len 1428 csum 0x3ab3], length 1428
10:42:43.307937 IP 112.26.3.1.44877 > 112.26.3.8.42387: Flags [.], seq 499801:501229, ack 1, win 4017, options [nop,nop,TS val 265446 ecr 51382,mptcp dss ack 3454339951 seq 445939076 subseq 499801 len 1428 csum 0x43c9], length 1428
10:42:43.328326 IP 112.26.3.1.44877 > 112.26.3.8.42387: Flags [.], seq 476953:478381, ack 1, win 4017, options [nop,nop,TS val 264597 ecr 50653,mptcp dss ack 3454339951 seq 445919084 subseq 476953 len 1428 csum 0xa380], length 1428
10:42:43.393207 IP 112.26.3.1.44877 > 112.26.3.8.42387: Flags [.], seq 478381:479809, ack 1, win 4017, options [nop,nop,TS val 264597 ecr 50653,mptcp dss ack 3454339951 seq 445920512 subseq 478381 len 1428 csum 0x2530], length 1428
10:42:43.436071 IP 112.26.3.8.42387 > 112.26.3.1.44877: Flags [.], ack 462673, win 24378, options [nop,nop,TS val 51538 ecr 264063,mptcp dss ack 445846256], length 0
10:42:43.436428 IP 112.26.3.1.44877 > 112.26.3.8.42387: Flags [.], seq 501229:502657, ack 1, win 4017, options [nop,nop,TS val 265575 ecr 51538,mptcp dss ack 3454339951 seq 445943360 subseq 501229 len 1428 csum 0x4d33], length 1428
10:42:43.436503 IP 112.26.3.1.44877 > 112.26.3.8.42387: Flags [.], seq 502657:504085, ack 1, win 4017, options [nop,nop,TS val 265575 ecr 51538,mptcp dss ack 3454339951 seq 445944788 subseq 502657 len 1428 csum 0xf576], length 1428
10:42:43.436683 IP 112.26.3.1.44877 > 112.26.3.8.42387: Flags [.], seq 504085:505513, ack 1, win 4017, options [nop,nop,TS val 265575 ecr 51538,mptcp dss ack 3454339951 seq 445946216 subseq 504085 len 1428 csum 0x75b1], length 1428
10:42:43.479112 IP 112.26.3.1.44877 > 112.26.3.8.42387: Flags [.], seq 479809:481237, ack 1, win 4017, options [nop,nop,TS val 264597 ecr 50653,mptcp dss ack 3454339951 seq 445921940 subseq 479809 len 1428 csum 0x63e7], length 1428
10:42:43.600929 IP 112.26.3.1.44877 > 112.26.3.8.42387: Flags [.], seq 481237:482665, ack 1, win 4017, options [nop,nop,TS val 264597 ecr 50653,mptcp dss ack 3454339951 seq 445923368 subseq 481237 len 1428 csum 0x880], length 1428
10:42:43.659209 IP 112.26.3.1.44877 > 112.26.3.8.42387: Flags [.], seq 482665:484093, ack 1, win 4017, options [nop,nop,TS val 264597 ecr 50653,mptcp dss ack 3454339951 seq 445924796 subseq 482665 len 1428 csum 0x4c42], length 1428
10:42:43.720978 IP 112.26.3.1.44877 > 112.26.3.8.42387: Flags [.], seq 484093:485521, ack 1, win 4017, options [nop,nop,TS val 264786 ecr 50830,mptcp dss ack 3454339951 seq 445927652 subseq 484093 len 1428 csum 0x7b8], length 1428
10:42:43.738932 IP 112.26.3.8.42387 > 112.26.3.1.44877: Flags [.], ack 465529, win 24378, options [nop,nop,TS val 51848 ecr 264063,mptcp dss ack 445846256], length 0
10:42:43.739271 IP 112.26.3.1.44877 > 112.26.3.8.42387: Flags [.], seq 505513:506941, ack 1, win 4017, options [nop,nop,TS val 265877 ecr 51848,mptcp dss ack 3454339951 seq 445964780 subseq 505513 len 1428 csum 0xe862], length 1428
10:42:43.739374 IP 112.26.3.1.44877 > 112.26.3.8.42387: Flags [.], seq 506941:508369, ack 1, win 4017, options [nop,nop,TS val 265877 ecr 51848,mptcp dss ack 3454339951 seq 445966208 subseq 506941 len 1428 csum 0x4fcb], length 1428
10:42:43.832739 IP 112.26.3.1.44877 > 112.26.3.8.42387: Flags [.], seq 485521:486949, ack 1, win 4017, options [nop,nop,TS val 264786 ecr 50830,mptcp dss ack 3454339951 seq 445929080 subseq 485521 len 1428 csum 0x488c], length 1428
10:42:43.874181 IP 112.26.3.8.42387 > 112.26.3.1.44877: Flags [.], ack 468385, win 24245, options [nop,nop,TS val 52100 ecr 264063,mptcp dss ack 445854824], length 0
10:42:43.874535 IP 112.26.3.1.44877 > 112.26.3.8.42387: Flags [.], seq 508369:509797, ack 1, win 4017, options [nop,nop,TS val 266012 ecr 52100,mptcp dss ack 3454339951 seq 445973348 subseq 508369 len 1428 csum 0x303c], length 1428
10:42:43.874661 IP 112.26.3.1.44877 > 112.26.3.8.42387: Flags [.], seq 509797:511225, ack 1, win 4017, options [nop,nop,TS val 266012 ecr 52100,mptcp dss ack 3454339951 seq 445974776 subseq 509797 len 1428 csum 0xa904], length 1428
10:42:43.874854 IP 112.26.3.1.44877 > 112.26.3.8.42387: Flags [.], seq 511225:512653, ack 1, win 4017, options [nop,nop,TS val 266012 ecr 52100,mptcp dss ack 3454339951 seq 445976204 subseq 511225 len 1428 csum 0xcd84], length 1428
10:42:43.956279 IP 112.26.3.1.44877 > 112.26.3.8.42387: Flags [.], seq 486949:488377, ack 1, win 4017, options [nop,nop,TS val 264987 ecr 50986,mptcp dss ack 3454339951 seq 445854824 subseq 486949 len 1428 csum 0xe204], length 1428
10:42:44.061978 IP 112.26.3.1.44877 > 112.26.3.8.42387: Flags [.], seq 489805:491233, ack 1, win 4017, options [nop,nop,TS val 264987 ecr 50986,mptcp dss ack 3454339951 seq 445873388 subseq 489805 len 1428 csum 0x40f8], length 1428
10:42:44.100952 IP 112.26.3.8.42387 > 112.26.3.1.44877: Flags [.], ack 468385, win 24391, options [nop,nop,TS val 52276 ecr 264063,nop,nop,sack 1 {469813:471241},mptcp dss ack 445893380], length 0
10:42:44.104013 IP 112.26.3.1.44877 > 112.26.3.8.42387: Flags [.], seq 512653:514081, ack 1, win 4017, options [nop,nop,TS val 266243 ecr 52276,mptcp dss ack 3454339951 seq 445987628 subseq 512653 len 1428 csum 0x2461], length 1428
10:42:44.181497 IP 112.26.3.1.44877 > 112.26.3.8.42387: Flags [.], seq 491233:492661, ack 1, win 4017, options [nop,nop,TS val 265206 ecr 51248,mptcp dss ack 3454339951 seq 445887668 subseq 491233 len 1428 csum 0x2e12], length 1428
10:42:44.190291 IP 112.26.3.8.42387 > 112.26.3.1.44877: Flags [.], ack 468385, win 24391, options [nop,nop,TS val 52336 ecr 264063,nop,nop,sack 1 {469813:472669},mptcp dss ack 445893380], length 0
10:42:44.238538 IP 112.26.3.1.44877 > 112.26.3.8.42387: Flags [.], seq 492661:494089, ack 1, win 4017, options [nop,nop,TS val 265206 ecr 51248,mptcp dss ack 3454339951 seq 445889096 subseq 492661 len 1428 csum 0xe393], length 1428
10:42:44.301317 IP 112.26.3.1.44877 > 112.26.3.8.42387: Flags [.], seq 494089:495517, ack 1, win 4017, options [nop,nop,TS val 265206 ecr 51248,mptcp dss ack 3454339951 seq 445901948 subseq 494089 len 1428 csum 0x96cf], length 1428
10:42:44.371069 IP 112.26.3.1.44877 > 112.26.3.8.42387: Flags [.], seq 496945:498373, ack 1, win 4017, options [nop,nop,TS val 265446 ecr 51382,mptcp dss ack 3454339951 seq 445936220 subseq 496945 len 1428 csum 0xebe7], length 1428
10:42:44.458547 IP 112.26.3.8.42387 > 112.26.3.1.44877: Flags [.], ack 468385, win 24391, options [nop,nop,TS val 52549 ecr 264063,nop,nop,sack 1 {469813:475525},mptcp dss ack 445893380], length 0
10:42:44.458873 IP 112.26.3.1.44877 > 112.26.3.8.42387: Flags [.], seq 514081:515509, ack 1, win 4017, options [nop,nop,TS val 266597 ecr 52336,mptcp dss ack 3454339951 seq 445993340 subseq 514081 len 1428 csum 0x9562], length 1428
10:42:44.458982 IP 112.26.3.1.44877 > 112.26.3.8.42387: Flags [.], seq 468385:469813, ack 1, win 4017, options [nop,nop,TS val 266597 ecr 52549,mptcp dss ack 3454339951 seq 445893380 subseq 468385 len 1428 csum 0x8463], length 1428
10:42:44.486260 IP 112.26.3.1.44877 > 112.26.3.8.42387: Flags [.], seq 515509:516937, ack 1, win 4017, options [nop,nop,TS val 266625 ecr 52549,mptcp dss ack 3454339951 seq 445994768 subseq 515509 len 1428 csum 0xc97b], length 1428
10:42:44.503689 IP 112.26.3.1.44877 > 112.26.3.8.42387: Flags [.], seq 498373:499801, ack 1, win 4017, options [nop,nop,TS val 265446 ecr 51382,mptcp dss ack 3454339951 seq 445937648 subseq 498373 len 1428 csum 0x3ab3], length 1428
10:42:44.546043 IP 112.26.3.8.42387 > 112.26.3.1.44877: Flags [.], ack 468385, win 24391, options [nop,nop,TS val 52587 ecr 264063,nop,nop,sack 1 {469813:476953},mptcp dss ack 445893380], length 0
10:42:44.612430 IP 112.26.3.1.44877 > 112.26.3.8.42387: Flags [.], seq 516937:518365, ack 1, win 4017, options [nop,nop,TS val 266751 ecr 52587,mptcp dss ack 3454339951 seq 445999052 subseq 516937 len 1428 csum 0x417a], length 1428
10:42:44.629103 IP 112.26.3.1.44877 > 112.26.3.8.42387: Flags [.], seq 499801:501229, ack 1, win 4017, options [nop,nop,TS val 265446 ecr 51382,mptcp dss ack 3454339951 seq 445939076 subseq 499801 len 1428 csum 0x43c9], length 1428
10:42:44.698702 IP 112.26.3.8.42387 > 112.26.3.1.44877: Flags [.], ack 468385, win 24391, options [nop,nop,TS val 52734 ecr 264063,nop,nop,sack 1 {469813:478381},mptcp dss ack 445893380], length 0
