10:29:33.147162 IP 112.26.1.8.39947 > 112.26.1.1.46615: Flags [S], seq 2081378494, win 65535, options [mss 1460,sackOK,TS val 4294857065 ecr 0,nop,wscale 6,mptcp join id 3 token 0x9485611f nonce 0x1afdb74], length 0
10:29:33.182752 IP 112.26.1.8.39947 > 112.26.1.1.46615: Flags [S], seq 2081378494, win 65535, options [mss 1460,sackOK,TS val 4294857065 ecr 0,nop,wscale 6,mptcp join id 3 token 0x9485611f nonce 0x1afdb74], length 0
10:29:33.266377 IP 112.26.1.8.39947 > 112.26.1.1.46615: Flags [S], seq 2081378494, win 65535, options [mss 1460,sackOK,TS val 4294857065 ecr 0,nop,wscale 6,mptcp join id 3 token 0x9485611f nonce 0x1afdb74], length 0
10:29:33.403700 IP 112.26.1.1.46615 > 112.26.1.8.39947: Flags [S.], seq 2068020644, ack 2081378495, win 65535, options [mss 1460,sackOK,TS val 103384 ecr 4294857065,nop,wscale 6,mptcp join id 3 hmac 0xfcb6205695ecb3b0 nonce 0x59a1037b], length 0
10:29:33.403930 IP 112.26.1.1.46615 > 112.26.1.8.39947: Flags [S.], seq 2068020644, ack 2081378495, win 65535, options [mss 1460,sackOK,TS val 103384 ecr 4294857065,nop,wscale 6,mptcp join id 3 hmac 0xfcb6205695ecb3b0 nonce 0x59a1037b], length 0
10:29:33.451732 IP 112.26.1.8.39947 > 112.26.1.1.46615: Flags [.], ack 1, win 7437, options [nop,nop,TS val 4294857392 ecr 103384,mptcp join hmac 0x9287e5d5fe7fddc14c54652063e8d530afbdb977], length 0
10:29:33.452036 IP 112.26.1.8.39947 > 112.26.1.1.46615: Flags [.], ack 1, win 7437, options [nop,nop,TS val 4294857392 ecr 103384,mptcp join hmac 0x9287e5d5fe7fddc14c54652063e8d530afbdb977], length 0
10:30:00.129217 IP 112.26.1.8.39947 > 112.26.1.1.46615: Flags [.], ack 234193, win 24092, options [nop,nop,TS val 4294883435 ecr 128249,nop,nop,sack 2 {238477:245617}{235621:237049},mptcp dss ack 3759156897], length 0
10:30:00.188324 IP 112.26.1.1.46615 > 112.26.1.8.39947: Flags [.], seq 249901:251329, ack 1, win 4017, options [nop,nop,TS val 129750 ecr 4294882926,mptcp dss ack 2843715367 seq 3759266853 subseq 249901 len 1428 csum 0x2198], length 1428
10:30:00.188628 IP 112.26.1.1.46615 > 112.26.1.8.39947: Flags [.], seq 249901:251329, ack 1, win 4017, options [nop,nop,TS val 129750 ecr 4294882926,mptcp dss ack 2843715367 seq 3759266853 subseq 249901 len 1428 csum 0x2198], length 1428
10:30:00.278289 IP 112.26.1.1.46615 > 112.26.1.8.39947: Flags [.], seq 251329:252757, ack 1, win 4017, options [nop,nop,TS val 129750 ecr 4294882926,mptcp dss ack 2843715367 seq 3759268281 subseq 251329 len 1428 csum 0x7bd5], length 1428
10:30:00.278565 IP 112.26.1.1.46615 > 112.26.1.8.39947: Flags [.], seq 251329:252757, ack 1, win 4017, options [nop,nop,TS val 129750 ecr 4294882926,mptcp dss ack 2843715367 seq 3759268281 subseq 251329 len 1428 csum 0x7bd5], length 1428
10:30:00.298097 IP 112.26.1.8.39947 > 112.26.1.1.46615: Flags [.], ack 249901, win 23937, options [nop,nop,TS val 4294884241 ecr 129750,mptcp dss ack 3759185457], length 0
10:30:00.298393 IP 112.26.1.8.39947 > 112.26.1.1.46615: Flags [.], ack 249901, win 23937, options [nop,nop,TS val 4294884241 ecr 129750,mptcp dss ack 3759185457], length 0
10:30:00.367185 IP 112.26.1.8.39947 > 112.26.1.1.46615: Flags [.], ack 251329, win 23937, options [nop,nop,TS val 4294884298 ecr 129750,mptcp dss ack 3759185457], length 0
10:30:00.367490 IP 112.26.1.8.39947 > 112.26.1.1.46615: Flags [.], ack 251329, win 23937, options [nop,nop,TS val 4294884298 ecr 129750,mptcp dss ack 3759185457], length 0
10:30:00.368045 IP 112.26.1.8.39947 > 112.26.1.1.46615: Flags [.], ack 234193, win 24092, options [nop,nop,TS val 4294883584 ecr 128249,nop,nop,sack 2 {238477:247045}{235621:237049},mptcp dss ack 3759156897], length 0
10:30:00.455697 IP 112.26.1.8.39947 > 112.26.1.1.46615: Flags [.], ack 252757, win 23937, options [nop,nop,TS val 4294884342 ecr 129750,mptcp dss ack 3759185457], length 0
10:30:00.455996 IP 112.26.1.8.39947 > 112.26.1.1.46615: Flags [.], ack 252757, win 23937, options [nop,nop,TS val 4294884342 ecr 129750,mptcp dss ack 3759185457], length 0
10:30:00.465465 IP 112.26.1.8.39947 > 112.26.1.1.46615: Flags [.], ack 237049, win 24092, options [nop,nop,TS val 4294883707 ecr 129308,nop,nop,sack 1 {238477:247045},mptcp dss ack 3759156897], length 0
10:30:00.536277 IP 112.26.1.1.46615 > 112.26.1.8.39947: Flags [.], seq 252757:254185, ack 1, win 4017, options [nop,nop,TS val 129831 ecr 4294883064,mptcp dss ack 2843715367 seq 3759269709 subseq 252757 len 1428 csum 0xa107], length 1428
10:30:00.536601 IP 112.26.1.1.46615 > 112.26.1.8.39947: Flags [.], seq 252757:254185, ack 1, win 4017, options [nop,nop,TS val 129831 ecr 4294883064,mptcp dss ack 2843715367 seq 3759269709 subseq 252757 len 1428 csum 0xa107], length 1428
10:30:00.598406 IP 112.26.1.1.46615 > 112.26.1.8.39947: Flags [.], seq 254185:255613, ack 1, win 4017, options [nop,nop,TS val 129983 ecr 4294883145,mptcp dss ack 2843715367 seq 3759276849 subseq 254185 len 1428 csum 0xd8f7], length 1428
10:30:00.598734 IP 112.26.1.1.46615 > 112.26.1.8.39947: Flags [.], seq 254185:255613, ack 1, win 4017, options [nop,nop,TS val 129983 ecr 4294883145,mptcp dss ack 2843715367 seq 3759276849 subseq 254185 len 1428 csum 0xd8f7], length 1428
10:30:00.650401 IP 112.26.1.8.39947 > 112.26.1.1.46615: Flags [.], ack 254185, win 23937, options [nop,nop,TS val 4294884595 ecr 129831,mptcp dss ack 3759185457], length 0
10:30:00.650664 IP 112.26.1.8.39947 > 112.26.1.1.46615: Flags [.], ack 254185, win 23937, options [nop,nop,TS val 4294884595 ecr 129831,mptcp dss ack 3759185457], length 0
10:30:00.703886 IP 112.26.1.8.39947 > 112.26.1.1.46615: Flags [.], ack 247045, win 23646, options [nop,nop,TS val 4294883848 ecr 129544,mptcp dss ack 3759185457], length 0
10:30:00.780089 IP 112.26.1.8.39947 > 112.26.1.1.46615: Flags [.], ack 255613, win 24362, options [nop,nop,TS val 4294884647 ecr 129983,mptcp dss ack 3759252573], length 0
10:30:00.780342 IP 112.26.1.8.39947 > 112.26.1.1.46615: Flags [.], ack 255613, win 24362, options [nop,nop,TS val 4294884647 ecr 129983,mptcp dss ack 3759252573], length 0
10:30:00.794252 IP 112.26.1.1.46615 > 112.26.1.8.39947: Flags [.], seq 255613:257041, ack 1, win 4017, options [nop,nop,TS val 130169 ecr 4294883264,mptcp dss ack 2843715367 seq 3759281133 subseq 255613 len 1428 csum 0x2603], length 1428
10:30:00.794529 IP 112.26.1.1.46615 > 112.26.1.8.39947: Flags [.], seq 255613:257041, ack 1, win 4017, options [nop,nop,TS val 130169 ecr 4294883264,mptcp dss ack 2843715367 seq 3759281133 subseq 255613 len 1428 csum 0x2603], length 1428
10:30:00.893362 IP 112.26.1.1.46615 > 112.26.1.8.39947: Flags [.], seq 257041:258469, ack 1, win 4017, options [nop,nop,TS val 130259 ecr 4294883435,mptcp dss ack 2843715367 seq 3759291129 subseq 257041 len 1428 csum 0x5db0], length 1428
10:30:00.893696 IP 112.26.1.1.46615 > 112.26.1.8.39947: Flags [.], seq 257041:258469, ack 1, win 4017, options [nop,nop,TS val 130259 ecr 4294883435,mptcp dss ack 2843715367 seq 3759291129 subseq 257041 len 1428 csum 0x5db0], length 1428
10:30:00.963188 IP 112.26.1.8.39947 > 112.26.1.1.46615: Flags [.], ack 257041, win 24362, options [nop,nop,TS val 4294884905 ecr 130169,mptcp dss ack 3759252573], length 0
10:30:00.963458 IP 112.26.1.8.39947 > 112.26.1.1.46615: Flags [.], ack 257041, win 24362, options [nop,nop,TS val 4294884905 ecr 130169,mptcp dss ack 3759252573], length 0
10:30:01.053916 IP 112.26.1.1.46615 > 112.26.1.8.39947: Flags [.], seq 258469:259897, ack 1, win 4017, options [nop,nop,TS val 130494 ecr 4294883584,mptcp dss ack 2843715367 seq 3759302553 subseq 258469 len 1428 csum 0x5122], length 1428
10:30:01.054144 IP 112.26.1.1.46615 > 112.26.1.8.39947: Flags [.], seq 258469:259897, ack 1, win 4017, options [nop,nop,TS val 130494 ecr 4294883584,mptcp dss ack 2843715367 seq 3759302553 subseq 258469 len 1428 csum 0x5122], length 1428
10:30:01.060002 IP 112.26.1.8.39947 > 112.26.1.1.46615: Flags [.], ack 258469, win 24540, options [nop,nop,TS val 4294884976 ecr 130259,mptcp dss ack 3759289701], length 0
10:30:01.060257 IP 112.26.1.8.39947 > 112.26.1.1.46615: Flags [.], ack 258469, win 24540, options [nop,nop,TS val 4294884976 ecr 130259,mptcp dss ack 3759289701], length 0
10:30:01.119556 IP 112.26.1.1.46615 > 112.26.1.8.39947: Flags [.], seq 259897:261325, ack 1, win 4017, options [nop,nop,TS val 130572 ecr 4294883707,mptcp dss ack 2843715367 seq 3759303981 subseq 259897 len 1428 csum 0x52f7], length 1428
10:30:01.119844 IP 112.26.1.1.46615 > 112.26.1.8.39947: Flags [.], seq 259897:261325, ack 1, win 4017, options [nop,nop,TS val 130572 ecr 4294883707,mptcp dss ack 2843715367 seq 3759303981 subseq 259897 len 1428 csum 0x52f7], length 1428
10:30:01.201802 IP 112.26.1.8.39947 > 112.26.1.1.46615: Flags [.], ack 249901, win 23937, options [nop,nop,TS val 4294884241 ecr 129750,mptcp dss ack 3759185457], length 0
10:30:01.223498 IP 112.26.1.8.39947 > 112.26.1.1.46615: Flags [.], ack 259897, win 24543, options [nop,nop,TS val 4294885167 ecr 130494,mptcp dss ack 3759295413], length 0
10:30:01.223743 IP 112.26.1.8.39947 > 112.26.1.1.46615: Flags [.], ack 259897, win 24543, options [nop,nop,TS val 4294885167 ecr 130494,mptcp dss ack 3759295413], length 0
10:30:01.343547 IP 112.26.1.8.39947 > 112.26.1.1.46615: Flags [.], ack 252757, win 23937, options [nop,nop,TS val 4294884342 ecr 129750,mptcp dss ack 3759185457], length 0
10:30:01.362883 IP 112.26.1.8.39947 > 112.26.1.1.46615: Flags [.], ack 261325, win 24521, options [nop,nop,TS val 4294885302 ecr 130572,mptcp dss ack 3759296841], length 0
10:30:01.363252 IP 112.26.1.8.39947 > 112.26.1.1.46615: Flags [.], ack 261325, win 24521, options [nop,nop,TS val 4294885302 ecr 130572,mptcp dss ack 3759296841], length 0
10:30:01.447580 IP 112.26.1.1.46615 > 112.26.1.8.39947: Flags [.], seq 261325:262753, ack 1, win 4017, options [nop,nop,TS val 130822 ecr 4294883848,mptcp dss ack 2843715367 seq 3759313977 subseq 261325 len 1428 csum 0xeb24], length 1428
10:30:01.447922 IP 112.26.1.1.46615 > 112.26.1.8.39947: Flags [.], seq 261325:262753, ack 1, win 4017, options [nop,nop,TS val 130822 ecr 4294883848,mptcp dss ack 2843715367 seq 3759313977 subseq 261325 len 1428 csum 0xeb24], length 1428
10:30:01.538588 IP 112.26.1.8.39947 > 112.26.1.1.46615: Flags [.], ack 262753, win 24499, options [nop,nop,TS val 4294885481 ecr 130822,mptcp dss ack 3759298269], length 0
10:30:01.538905 IP 112.26.1.8.39947 > 112.26.1.1.46615: Flags [.], ack 262753, win 24499, options [nop,nop,TS val 4294885481 ecr 130822,mptcp dss ack 3759298269], length 0
10:30:01.564118 IP 112.26.1.8.39947 > 112.26.1.1.46615: Flags [.], ack 255613, win 24362, options [nop,nop,TS val 4294884647 ecr 129983,mptcp dss ack 3759252573], length 0
10:30:01.656159 IP 112.26.1.8.39947 > 112.26.1.1.46615: Flags [.], ack 257041, win 24362, options [nop,nop,TS val 4294884905 ecr 130169,mptcp dss ack 3759252573], length 0
10:30:01.721918 IP 112.26.1.1.46615 > 112.26.1.8.39947: Flags [.], seq 262753:264181, ack 1, win 4017, options [nop,nop,TS val 131321 ecr 4294884241,mptcp dss ack 2843715367 seq 3759335397 subseq 262753 len 1428 csum 0x79c5], length 1428
10:30:01.722256 IP 112.26.1.1.46615 > 112.26.1.8.39947: Flags [.], seq 262753:264181, ack 1, win 4017, options [nop,nop,TS val 131321 ecr 4294884241,mptcp dss ack 2843715367 seq 3759335397 subseq 262753 len 1428 csum 0x79c5], length 1428
10:30:01.739259 IP 112.26.1.8.39947 > 112.26.1.1.46615: Flags [.], ack 264181, win 24455, options [nop,nop,TS val 4294885674 ecr 131321,mptcp dss ack 3759301125], length 0
10:30:01.739480 IP 112.26.1.8.39947 > 112.26.1.1.46615: Flags [.], ack 264181, win 24455, options [nop,nop,TS val 4294885674 ecr 131321,mptcp dss ack 3759301125], length 0
10:30:01.859729 IP 112.26.1.1.46615 > 112.26.1.8.39947: Flags [.], seq 264181:265609, ack 1, win 4017, options [nop,nop,TS val 131321 ecr 4294884241,mptcp dss ack 2843715367 seq 3759336825 subseq 264181 len 1428 csum 0x8de0], length 1428
10:30:01.860035 IP 112.26.1.1.46615 > 112.26.1.8.39947: Flags [.], seq 264181:265609, ack 1, win 4017, options [nop,nop,TS val 131321 ecr 4294884241,mptcp dss ack 2843715367 seq 3759336825 subseq 264181 len 1428 csum 0x8de0], length 1428
10:30:01.866314 IP 112.26.1.8.39947 > 112.26.1.1.46615: Flags [.], ack 265609, win 24360, options [nop,nop,TS val 4294885809 ecr 131321,mptcp dss ack 3759308265], length 0
10:30:01.866628 IP 112.26.1.8.39947 > 112.26.1.1.46615: Flags [.], ack 265609, win 24360, options [nop,nop,TS val 4294885809 ecr 131321,mptcp dss ack 3759308265], length 0
10:30:01.910363 IP 112.26.1.8.39947 > 112.26.1.1.46615: Flags [.], ack 258469, win 24540, options [nop,nop,TS val 4294884976 ecr 130259,mptcp dss ack 3759289701], length 0
10:30:02.005943 IP 112.26.1.1.46615 > 112.26.1.8.39947: Flags [.], seq 265609:267037, ack 1, win 4017, options [nop,nop,TS val 131462 ecr 4294884342,mptcp dss ack 2843715367 seq 3759343965 subseq 265609 len 1428 csum 0x9488], length 1428
10:30:02.006231 IP 112.26.1.1.46615 > 112.26.1.8.39947: Flags [.], seq 265609:267037, ack 1, win 4017, options [nop,nop,TS val 131462 ecr 4294884342,mptcp dss ack 2843715367 seq 3759343965 subseq 265609 len 1428 csum 0x9488], length 1428
10:30:02.011283 IP 112.26.1.8.39947 > 112.26.1.1.46615: Flags [.], ack 267037, win 24316, options [nop,nop,TS val 4294885955 ecr 131462,mptcp dss ack 3759311121], length 0
10:30:02.011551 IP 112.26.1.8.39947 > 112.26.1.1.46615: Flags [.], ack 267037, win 24316, options [nop,nop,TS val 4294885955 ecr 131462,mptcp dss ack 3759311121], length 0
10:30:02.094783 IP 112.26.1.8.39947 > 112.26.1.1.46615: Flags [.], ack 259897, win 24543, options [nop,nop,TS val 4294885167 ecr 130494,mptcp dss ack 3759295413], length 0
10:30:02.145185 IP 112.26.1.1.46615 > 112.26.1.8.39947: Flags [.], seq 267037:268465, ack 1, win 4017, options [nop,nop,TS val 131462 ecr 4294884342,mptcp dss ack 2843715367 seq 3759345393 subseq 267037 len 1428 csum 0xe92d], length 1428
10:30:02.145496 IP 112.26.1.1.46615 > 112.26.1.8.39947: Flags [.], seq 267037:268465, ack 1, win 4017, options [nop,nop,TS val 131462 ecr 4294884342,mptcp dss ack 2843715367 seq 3759345393 subseq 267037 len 1428 csum 0xe92d], length 1428
10:30:02.218592 IP 112.26.1.8.39947 > 112.26.1.1.46615: Flags [.], ack 261325, win 24521, options [nop,nop,TS val 4294885302 ecr 130572,mptcp dss ack 3759296841], length 0
10:30:02.229715 IP 112.26.1.8.39947 > 112.26.1.1.46615: Flags [.], ack 268465, win 24316, options [nop,nop,TS val 4294886170 ecr 131462,mptcp dss ack 3759311121], length 0
10:30:02.230009 IP 112.26.1.8.39947 > 112.26.1.1.46615: Flags [.], ack 268465, win 24316, options [nop,nop,TS val 4294886170 ecr 131462,mptcp dss ack 3759311121], length 0
10:30:02.319287 IP 112.26.1.1.46615 > 112.26.1.8.39947: Flags [.], seq 268465:269893, ack 1, win 4017, options [nop,nop,TS val 131683 ecr 4294884647,mptcp dss ack 2843715367 seq 3759352533 subseq 268465 len 1428 csum 0x4c8f], length 1428
10:30:02.319608 IP 112.26.1.1.46615 > 112.26.1.8.39947: Flags [.], seq 268465:269893, ack 1, win 4017, options [nop,nop,TS val 131683 ecr 4294884647,mptcp dss ack 2843715367 seq 3759352533 subseq 268465 len 1428 csum 0x4c8f], length 1428
10:30:02.401584 IP 112.26.1.1.46615 > 112.26.1.8.39947: Flags [.], seq 271321:272749, ack 1, win 4017, options [nop,nop,TS val 131775 ecr 4294884905,mptcp dss ack 2843715367 seq 3759359673 subseq 271321 len 1428 csum 0x4926], length 1428
10:30:02.401889 IP 112.26.1.1.46615 > 112.26.1.8.39947: Flags [.], seq 271321:272749, ack 1, win 4017, options [nop,nop,TS val 131775 ecr 4294884905,mptcp dss ack 2843715367 seq 3759359673 subseq 271321 len 1428 csum 0x4926], length 1428
10:30:02.408331 IP 112.26.1.8.39947 > 112.26.1.1.46615: Flags [.], ack 269893, win 24316, options [nop,nop,TS val 4294886352 ecr 131683,mptcp dss ack 3759311121], length 0
10:30:02.408648 IP 112.26.1.8.39947 > 112.26.1.1.46615: Flags [.], ack 269893, win 24316, options [nop,nop,TS val 4294886352 ecr 131683,mptcp dss ack 3759311121], length 0
10:30:02.457801 IP 112.26.1.8.39947 > 112.26.1.1.46615: Flags [.], ack 269893, win 24316, options [nop,nop,TS val 4294886363 ecr 131683,nop,nop,sack 1 {271321:272749},mptcp dss ack 3759311121], length 0
10:30:02.458113 IP 112.26.1.8.39947 > 112.26.1.1.46615: Flags [.], ack 269893, win 24316, options [nop,nop,TS val 4294886363 ecr 131683,nop,nop,sack 1 {271321:272749},mptcp dss ack 3759311121], length 0
10:30:02.459386 IP 112.26.1.8.39947 > 112.26.1.1.46615: Flags [.], ack 264181, win 24455, options [nop,nop,TS val 4294885674 ecr 131321,mptcp dss ack 3759301125], length 0
10:30:02.566464 IP 112.26.1.1.46615 > 112.26.1.8.39947: Flags [.], seq 272749:274177, ack 1, win 4017, options [nop,nop,TS val 132029 ecr 4294884976,mptcp dss ack 2843715367 seq 3759366813 subseq 272749 len 1428 csum 0x302f], length 1428
10:30:02.566756 IP 112.26.1.1.46615 > 112.26.1.8.39947: Flags [.], seq 272749:274177, ack 1, win 4017, options [nop,nop,TS val 132029 ecr 4294884976,mptcp dss ack 2843715367 seq 3759366813 subseq 272749 len 1428 csum 0x302f], length 1428
10:30:02.599127 IP 112.26.1.8.39947 > 112.26.1.1.46615: Flags [.], ack 269893, win 24316, options [nop,nop,TS val 4294886542 ecr 131683,nop,nop,sack 1 {271321:274177},mptcp dss ack 3759311121], length 0
10:30:02.599383 IP 112.26.1.8.39947 > 112.26.1.1.46615: Flags [.], ack 269893, win 24316, options [nop,nop,TS val 4294886542 ecr 131683,nop,nop,sack 1 {271321:274177},mptcp dss ack 3759311121], length 0
10:30:02.653943 IP 112.26.1.8.39947 > 112.26.1.1.46615: Flags [.], ack 265609, win 24360, options [nop,nop,TS val 4294885809 ecr 131321,mptcp dss ack 3759308265], length 0
10:30:02.711303 IP 112.26.1.1.46615 > 112.26.1.8.39947: Flags [.], seq 274177:275605, ack 1, win 4017, options [nop,nop,TS val 132213 ecr 4294885167,mptcp dss ack 2843715367 seq 3759372525 subseq 274177 len 1428 csum 0x589f], length 1428
10:30:02.711563 IP 112.26.1.1.46615 > 112.26.1.8.39947: Flags [.], seq 274177:275605, ack 1, win 4017, options [nop,nop,TS val 132213 ecr 4294885167,mptcp dss ack 2843715367 seq 3759372525 subseq 274177 len 1428 csum 0x589f], length 1428
10:30:02.756085 IP 112.26.1.8.39947 > 112.26.1.1.46615: Flags [.], ack 267037, win 24316, options [nop,nop,TS val 4294885955 ecr 131462,mptcp dss ack 3759311121], length 0
10:30:02.763220 IP 112.26.1.8.39947 > 112.26.1.1.46615: Flags [.], ack 269893, win 24316, options [nop,nop,TS val 4294886706 ecr 131683,nop,nop,sack 1 {271321:275605},mptcp dss ack 3759311121], length 0
10:30:02.763513 IP 112.26.1.8.39947 > 112.26.1.1.46615: Flags [.], ack 269893, win 24316, options [nop,nop,TS val 4294886706 ecr 131683,nop,nop,sack 1 {271321:275605},mptcp dss ack 3759311121], length 0
10:30:02.838516 IP 112.26.1.1.46615 > 112.26.1.8.39947: Flags [.], seq 275605:277033, ack 1, win 4017, options [nop,nop,TS val 132213 ecr 4294885167,mptcp dss ack 2843715367 seq 3759373953 subseq 275605 len 1428 csum 0xb592], length 1428
10:30:02.838788 IP 112.26.1.1.46615 > 112.26.1.8.39947: Flags [.], seq 275605:277033, ack 1, win 4017, options [nop,nop,TS val 132213 ecr 4294885167,mptcp dss ack 2843715367 seq 3759373953 subseq 275605 len 1428 csum 0xb592], length 1428
10:30:02.899098 IP 112.26.1.8.39947 > 112.26.1.1.46615: Flags [.], ack 269893, win 24316, options [nop,nop,TS val 4294886843 ecr 131683,nop,nop,sack 1 {271321:277033},mptcp dss ack 3759311121], length 0
10:30:02.899353 IP 112.26.1.8.39947 > 112.26.1.1.46615: Flags [.], ack 269893, win 24316, options [nop,nop,TS val 4294886843 ecr 131683,nop,nop,sack 1 {271321:277033},mptcp dss ack 3759311121], length 0
10:30:02.905932 IP 112.26.1.8.39947 > 112.26.1.1.46615: Flags [.], ack 268465, win 24316, options [nop,nop,TS val 4294886170 ecr 131462,mptcp dss ack 3759311121], length 0
10:30:02.987298 IP 112.26.1.1.46615 > 112.26.1.8.39947: Flags [.], seq 278461:279889, ack 1, win 4017, options [nop,nop,TS val 132578 ecr 4294885674,mptcp dss ack 2843715367 seq 3759399657 subseq 278461 len 1428 csum 0x4af6], length 1428
10:30:02.987611 IP 112.26.1.1.46615 > 112.26.1.8.39947: Flags [.], seq 278461:279889, ack 1, win 4017, options [nop,nop,TS val 132578 ecr 4294885674,mptcp dss ack 2843715367 seq 3759399657 subseq 278461 len 1428 csum 0x4af6], length 1428
10:30:03.039117 IP 112.26.1.8.39947 > 112.26.1.1.46615: Flags [.], ack 269893, win 24316, options [nop,nop,TS val 4294886982 ecr 131683,nop,nop,sack 2 {278461:279889}{271321:277033},mptcp dss ack 3759311121], length 0
10:30:03.039407 IP 112.26.1.8.39947 > 112.26.1.1.46615: Flags [.], ack 269893, win 24316, options [nop,nop,TS val 4294886982 ecr 131683,nop,nop,sack 2 {278461:279889}{271321:277033},mptcp dss ack 3759311121], length 0
10:30:03.063161 IP 112.26.1.8.39947 > 112.26.1.1.46615: Flags [.], ack 269893, win 24316, options [nop,nop,TS val 4294886352 ecr 131683,mptcp dss ack 3759311121], length 0
10:30:03.150879 IP 112.26.1.1.46615 > 112.26.1.8.39947: Flags [.], seq 279889:281317, ack 1, win 4017, options [nop,nop,TS val 132578 ecr 4294885674,mptcp dss ack 2843715367 seq 3759401085 subseq 279889 len 1428 csum 0x81a4], length 1428
10:30:03.151176 IP 112.26.1.1.46615 > 112.26.1.8.39947: Flags [.], seq 279889:281317, ack 1, win 4017, options [nop,nop,TS val 132578 ecr 4294885674,mptcp dss ack 2843715367 seq 3759401085 subseq 279889 len 1428 csum 0x81a4], length 1428
10:30:03.190261 IP 112.26.1.8.39947 > 112.26.1.1.46615: Flags [.], ack 269893, win 24316, options [nop,nop,TS val 4294887134 ecr 131683,nop,nop,sack 2 {278461:281317}{271321:277033},mptcp dss ack 3759311121], length 0
10:30:03.190563 IP 112.26.1.8.39947 > 112.26.1.1.46615: Flags [.], ack 269893, win 24316, options [nop,nop,TS val 4294887134 ecr 131683,nop,nop,sack 2 {278461:281317}{271321:277033},mptcp dss ack 3759311121], length 0
10:30:03.212763 IP 112.26.1.8.39947 > 112.26.1.1.46615: Flags [.], ack 269893, win 24316, options [nop,nop,TS val 4294886363 ecr 131683,nop,nop,sack 1 {271321:272749},mptcp dss ack 3759311121], length 0
10:30:03.312454 IP 112.26.1.1.46615 > 112.26.1.8.39947: Flags [.], seq 281317:282745, ack 1, win 4017, options [nop,nop,TS val 132772 ecr 4294885809,mptcp dss ack 2843715367 seq 3759409653 subseq 281317 len 1428 csum 0x290a], length 1428
10:30:03.312777 IP 112.26.1.1.46615 > 112.26.1.8.39947: Flags [.], seq 281317:282745, ack 1, win 4017, options [nop,nop,TS val 132772 ecr 4294885809,mptcp dss ack 2843715367 seq 3759409653 subseq 281317 len 1428 csum 0x290a], length 1428
10:30:03.352098 IP 112.26.1.8.39947 > 112.26.1.1.46615: Flags [.], ack 269893, win 24316, options [nop,nop,TS val 4294887296 ecr 131683,nop,nop,sack 2 {278461:282745}{271321:277033},mptcp dss ack 3759311121], length 0
10:30:03.352341 IP 112.26.1.8.39947 > 112.26.1.1.46615: Flags [.], ack 269893, win 24316, options [nop,nop,TS val 4294887296 ecr 131683,nop,nop,sack 2 {278461:282745}{271321:277033},mptcp dss ack 3759311121], length 0
10:30:03.372389 IP 112.26.1.8.39947 > 112.26.1.1.46615: Flags [.], ack 269893, win 24316, options [nop,nop,TS val 4294886542 ecr 131683,nop,nop,sack 1 {271321:274177},mptcp dss ack 3759311121], length 0
10:30:03.437717 IP 112.26.1.1.46615 > 112.26.1.8.39947: Flags [.], seq 282745:284173, ack 1, win 4017, options [nop,nop,TS val 132874 ecr 4294885955,mptcp dss ack 2843715367 seq 3759411081 subseq 282745 len 1428 csum 0xbd0d], length 1428
10:30:03.437969 IP 112.26.1.1.46615 > 112.26.1.8.39947: Flags [.], seq 282745:284173, ack 1, win 4017, options [nop,nop,TS val 132874 ecr 4294885955,mptcp dss ack 2843715367 seq 3759411081 subseq 282745 len 1428 csum 0xbd0d], length 1428
10:30:03.467297 IP 112.26.1.8.39947 > 112.26.1.1.46615: Flags [.], ack 269893, win 24316, options [nop,nop,TS val 4294887410 ecr 131683,nop,nop,sack 2 {278461:284173}{271321:277033},mptcp dss ack 3759311121], length 0
10:30:03.467606 IP 112.26.1.8.39947 > 112.26.1.1.46615: Flags [.], ack 269893, win 24316, options [nop,nop,TS val 4294887410 ecr 131683,nop,nop,sack 2 {278461:284173}{271321:277033},mptcp dss ack 3759311121], length 0
10:30:03.492017 IP 112.26.1.8.39947 > 112.26.1.1.46615: Flags [.], ack 269893, win 24316, options [nop,nop,TS val 4294886706 ecr 131683,nop,nop,sack 1 {271321:275605},mptcp dss ack 3759311121], length 0
10:30:03.533923 IP 112.26.1.1.46615 > 112.26.1.8.39947: Flags [.], seq 284173:285601, ack 1, win 4017, options [nop,nop,TS val 132874 ecr 4294885955,mptcp dss ack 2843715367 seq 3759412509 subseq 284173 len 1428 csum 0x48ab], length 1428
10:30:03.534198 IP 112.26.1.1.46615 > 112.26.1.8.39947: Flags [.], seq 284173:285601, ack 1, win 4017, options [nop,nop,TS val 132874 ecr 4294885955,mptcp dss ack 2843715367 seq 3759412509 subseq 284173 len 1428 csum 0x48ab], length 1428
10:30:03.565591 IP 112.26.1.8.39947 > 112.26.1.1.46615: Flags [.], ack 269893, win 24316, options [nop,nop,TS val 4294887504 ecr 131683,nop,nop,sack 2 {278461:285601}{271321:277033},mptcp dss ack 3759311121], length 0
10:30:03.565860 IP 112.26.1.8.39947 > 112.26.1.1.46615: Flags [.], ack 269893, win 24316, options [nop,nop,TS val 4294887504 ecr 131683,nop,nop,sack 2 {278461:285601}{271321:277033},mptcp dss ack 3759311121], length 0
10:30:03.613073 IP 112.26.1.1.46615 > 112.26.1.8.39947: Flags [.], seq 285601:287029, ack 1, win 4017, options [nop,nop,TS val 133024 ecr 4294886170,mptcp dss ack 2843715367 seq 3759429645 subseq 285601 len 1428 csum 0x36f4], length 1428
10:30:03.613326 IP 112.26.1.1.46615 > 112.26.1.8.39947: Flags [.], seq 285601:287029, ack 1, win 4017, options [nop,nop,TS val 133024 ecr 4294886170,mptcp dss ack 2843715367 seq 3759429645 subseq 285601 len 1428 csum 0x36f4], length 1428
10:30:03.667300 IP 112.26.1.8.39947 > 112.26.1.1.46615: Flags [.], ack 269893, win 24316, options [nop,nop,TS val 4294886843 ecr 131683,nop,nop,sack 1 {271321:277033},mptcp dss ack 3759311121], length 0
10:30:03.683046 IP 112.26.1.8.39947 > 112.26.1.1.46615: Flags [.], ack 269893, win 24316, options [nop,nop,TS val 4294887626 ecr 131683,nop,nop,sack 2 {278461:287029}{271321:277033},mptcp dss ack 3759311121], length 0
10:30:03.683346 IP 112.26.1.8.39947 > 112.26.1.1.46615: Flags [.], ack 269893, win 24316, options [nop,nop,TS val 4294887626 ecr 131683,nop,nop,sack 2 {278461:287029}{271321:277033},mptcp dss ack 3759311121], length 0
10:30:03.708128 IP 112.26.1.1.46615 > 112.26.1.8.39947: Flags [.], seq 287029:288457, ack 1, win 4017, options [nop,nop,TS val 133182 ecr 4294886352,mptcp dss ack 2843715367 seq 3759438213 subseq 287029 len 1428 csum 0xa2a6], length 1428
10:30:03.708450 IP 112.26.1.1.46615 > 112.26.1.8.39947: Flags [.], seq 287029:288457, ack 1, win 4017, options [nop,nop,TS val 133182 ecr 4294886352,mptcp dss ack 2843715367 seq 3759438213 subseq 287029 len 1428 csum 0xa2a6], length 1428
10:30:03.738182 IP 112.26.1.8.39947 > 112.26.1.1.46615: Flags [.], ack 269893, win 24316, options [nop,nop,TS val 4294886982 ecr 131683,nop,nop,sack 2 {278461:279889}{271321:277033},mptcp dss ack 3759311121], length 0
10:30:03.802168 IP 112.26.1.1.46615 > 112.26.1.8.39947: Flags [.], seq 288457:289885, ack 1, win 4017, options [nop,nop,TS val 133337 ecr 4294886363,mptcp dss ack 2843715367 seq 3759441069 subseq 288457 len 1428 csum 0x3cf], length 1428
10:30:03.802485 IP 112.26.1.1.46615 > 112.26.1.8.39947: Flags [.], seq 288457:289885, ack 1, win 4017, options [nop,nop,TS val 133337 ecr 4294886363,mptcp dss ack 2843715367 seq 3759441069 subseq 288457 len 1428 csum 0x3cf], length 1428
10:30:03.833378 IP 112.26.1.8.39947 > 112.26.1.1.46615: Flags [.], ack 269893, win 24316, options [nop,nop,TS val 4294887768 ecr 131683,nop,nop,sack 2 {278461:288457}{271321:277033},mptcp dss ack 3759311121], length 0
10:30:03.833696 IP 112.26.1.8.39947 > 112.26.1.1.46615: Flags [.], ack 269893, win 24316, options [nop,nop,TS val 4294887768 ecr 131683,nop,nop,sack 2 {278461:288457}{271321:277033},mptcp dss ack 3759311121], length 0
10:30:03.899003 IP 112.26.1.8.39947 > 112.26.1.1.46615: Flags [.], ack 269893, win 24316, options [nop,nop,TS val 4294887821 ecr 131683,nop,nop,sack 2 {278461:289885}{271321:277033},mptcp dss ack 3759311121], length 0
10:30:03.899265 IP 112.26.1.8.39947 > 112.26.1.1.46615: Flags [.], ack 269893, win 24316, options [nop,nop,TS val 4294887821 ecr 131683,nop,nop,sack 2 {278461:289885}{271321:277033},mptcp dss ack 3759311121], length 0
10:30:03.916085 IP 112.26.1.8.39947 > 112.26.1.1.46615: Flags [.], ack 269893, win 24316, options [nop,nop,TS val 4294887134 ecr 131683,nop,nop,sack 2 {278461:281317}{271321:277033},mptcp dss ack 3759311121], length 0
10:30:03.964787 IP 112.26.1.1.46615 > 112.26.1.8.39947: Flags [.], seq 289885:291313, ack 1, win 4017, options [nop,nop,TS val 133517 ecr 4294886542,mptcp dss ack 2843715367 seq 3759449637 subseq 289885 len 1428 csum 0xa03a], length 1428
10:30:03.965083 IP 112.26.1.1.46615 > 112.26.1.8.39947: Flags [.], seq 289885:291313, ack 1, win 4017, options [nop,nop,TS val 133517 ecr 4294886542,mptcp dss ack 2843715367 seq 3759449637 subseq 289885 len 1428 csum 0xa03a], length 1428
10:30:04.002107 IP 112.26.1.8.39947 > 112.26.1.1.46615: Flags [.], ack 269893, win 24316, options [nop,nop,TS val 4294887296 ecr 131683,nop,nop,sack 2 {278461:282745}{271321:277033},mptcp dss ack 3759311121], length 0
10:30:04.053350 IP 112.26.1.1.46615 > 112.26.1.8.39947: Flags [.], seq 269893:271321, ack 1, win 4017, options [nop,nop,TS val 133611 ecr 4294886706,mptcp dss ack 2843715367 seq 3759353961 subseq 269893 len 1428 csum 0xf6f5], length 1428
10:30:04.053679 IP 112.26.1.1.46615 > 112.26.1.8.39947: Flags [.], seq 269893:271321, ack 1, win 4017, options [nop,nop,TS val 133611 ecr 4294886706,mptcp dss ack 2843715367 seq 3759353961 subseq 269893 len 1428 csum 0xf6f5], length 1428
10:30:04.075092 IP 112.26.1.8.39947 > 112.26.1.1.46615: Flags [.], ack 269893, win 24160, options [nop,nop,TS val 4294888019 ecr 131683,nop,nop,sack 2 {278461:291313}{271321:277033},mptcp dss ack 3759321117], length 0
10:30:04.075380 IP 112.26.1.8.39947 > 112.26.1.1.46615: Flags [.], ack 269893, win 24160, options [nop,nop,TS val 4294888019 ecr 131683,nop,nop,sack 2 {278461:291313}{271321:277033},mptcp dss ack 3759321117], length 0
10:30:04.161088 IP 112.26.1.8.39947 > 112.26.1.1.46615: Flags [.], ack 269893, win 24316, options [nop,nop,TS val 4294887410 ecr 131683,nop,nop,sack 2 {278461:284173}{271321:277033},mptcp dss ack 3759311121], length 0
10:30:04.181176 IP 112.26.1.8.39947 > 112.26.1.1.46615: Flags [.], ack 277033, win 24116, options [nop,nop,TS val 4294888083 ecr 133611,nop,nop,sack 1 {278461:291313},mptcp dss ack 3759323973], length 0
10:30:04.181465 IP 112.26.1.8.39947 > 112.26.1.1.46615: Flags [.], ack 277033, win 24116, options [nop,nop,TS val 4294888083 ecr 133611,nop,nop,sack 1 {278461:291313},mptcp dss ack 3759323973], length 0
10:30:04.212683 IP 112.26.1.8.39947 > 112.26.1.1.46615: Flags [.], ack 269893, win 24316, options [nop,nop,TS val 4294887504 ecr 131683,nop,nop,sack 2 {278461:285601}{271321:277033},mptcp dss ack 3759311121], length 0
10:30:04.318286 IP 112.26.1.1.46615 > 112.26.1.8.39947: Flags [.], seq 291313:292741, ack 1, win 4017, options [nop,nop,TS val 133857 ecr 4294886843,mptcp dss ack 2843715367 seq 3759458205 subseq 291313 len 1428 csum 0xd2b1], length 1428
10:30:04.318604 IP 112.26.1.1.46615 > 112.26.1.8.39947: Flags [.], seq 291313:292741, ack 1, win 4017, options [nop,nop,TS val 133857 ecr 4294886843,mptcp dss ack 2843715367 seq 3759458205 subseq 291313 len 1428 csum 0xd2b1], length 1428
10:30:04.347223 IP 112.26.1.8.39947 > 112.26.1.1.46615: Flags [.], ack 277033, win 23826, options [nop,nop,TS val 4294888291 ecr 133611,nop,nop,sack 1 {278461:292741},mptcp dss ack 3759342537], length 0
10:30:04.347513 IP 112.26.1.8.39947 > 112.26.1.1.46615: Flags [.], ack 277033, win 23826, options [nop,nop,TS val 4294888291 ecr 133611,nop,nop,sack 1 {278461:292741},mptcp dss ack 3759342537], length 0
10:30:04.383403 IP 112.26.1.8.39947 > 112.26.1.1.46615: Flags [.], ack 269893, win 24316, options [nop,nop,TS val 4294887626 ecr 131683,nop,nop,sack 2 {278461:287029}{271321:277033},mptcp dss ack 3759311121], length 0
10:30:04.461244 IP 112.26.1.8.39947 > 112.26.1.1.46615: Flags [.], ack 269893, win 24316, options [nop,nop,TS val 4294887768 ecr 131683,nop,nop,sack 2 {278461:288457}{271321:277033},mptcp dss ack 3759311121], length 0
10:30:04.518656 IP 112.26.1.8.39947 > 112.26.1.1.46615: Flags [.], ack 269893, win 24316, options [nop,nop,TS val 4294887821 ecr 131683,nop,nop,sack 2 {278461:289885}{271321:277033},mptcp dss ack 3759311121], length 0
10:30:04.571697 IP 112.26.1.1.46615 > 112.26.1.8.39947: Flags [.], seq 292741:294169, ack 1, win 4017, options [nop,nop,TS val 134282 ecr 4294887410,mptcp dss ack 2843715367 seq 3759473913 subseq 292741 len 1428 csum 0x9446], length 1428
10:30:04.572013 IP 112.26.1.1.46615 > 112.26.1.8.39947: Flags [.], seq 292741:294169, ack 1, win 4017, options [nop,nop,TS val 134282 ecr 4294887410,mptcp dss ack 2843715367 seq 3759473913 subseq 292741 len 1428 csum 0x9446], length 1428
10:30:04.575960 IP 112.26.1.8.39947 > 112.26.1.1.46615: Flags [.], ack 277033, win 23787, options [nop,nop,TS val 4294888519 ecr 133611,nop,nop,sack 1 {278461:294169},mptcp dss ack 3759355389], length 0
10:30:04.576286 IP 112.26.1.8.39947 > 112.26.1.1.46615: Flags [.], ack 277033, win 23787, options [nop,nop,TS val 4294888519 ecr 133611,nop,nop,sack 1 {278461:294169},mptcp dss ack 3759355389], length 0
10:30:04.626678 IP 112.26.1.8.39947 > 112.26.1.1.46615: Flags [.], ack 269893, win 24160, options [nop,nop,TS val 4294888019 ecr 131683,nop,nop,sack 2 {278461:291313}{271321:277033},mptcp dss ack 3759321117], length 0
10:30:04.717050 IP 112.26.1.1.46615 > 112.26.1.8.39947: Flags [.], seq 294169:295597, ack 1, win 4017, options [nop,nop,TS val 134353 ecr 4294887504,mptcp dss ack 2843715367 seq 3759475341 subseq 294169 len 1428 csum 0x8a18], length 1428
10:30:04.717354 IP 112.26.1.1.46615 > 112.26.1.8.39947: Flags [.], seq 294169:295597, ack 1, win 4017, options [nop,nop,TS val 134353 ecr 4294887504,mptcp dss ack 2843715367 seq 3759475341 subseq 294169 len 1428 csum 0x8a18], length 1428
10:30:04.729611 IP 112.26.1.8.39947 > 112.26.1.1.46615: Flags [.], ack 277033, win 23973, options [nop,nop,TS val 4294888669 ecr 133611,nop,nop,sack 1 {278461:295597},mptcp dss ack 3759382521], length 0
10:30:04.729915 IP 112.26.1.8.39947 > 112.26.1.1.46615: Flags [.], ack 277033, win 23973, options [nop,nop,TS val 4294888669 ecr 133611,nop,nop,sack 1 {278461:295597},mptcp dss ack 3759382521], length 0
10:30:04.761464 IP 112.26.1.8.39947 > 112.26.1.1.46615: Flags [.], ack 277033, win 24116, options [nop,nop,TS val 4294888083 ecr 133611,nop,nop,sack 1 {278461:291313},mptcp dss ack 3759323973], length 0
10:30:04.848667 IP 112.26.1.8.39947 > 112.26.1.1.46615: Flags [.], ack 277033, win 23826, options [nop,nop,TS val 4294888291 ecr 133611,nop,nop,sack 1 {278461:292741},mptcp dss ack 3759342537], length 0
10:30:04.895318 IP 112.26.1.1.46615 > 112.26.1.8.39947: Flags [.], seq 295597:297025, ack 1, win 4017, options [nop,nop,TS val 134530 ecr 4294887626,mptcp dss ack 2843715367 seq 3759481053 subseq 295597 len 1428 csum 0x22a1], length 1428
10:30:04.895562 IP 112.26.1.1.46615 > 112.26.1.8.39947: Flags [.], seq 295597:297025, ack 1, win 4017, options [nop,nop,TS val 134530 ecr 4294887626,mptcp dss ack 2843715367 seq 3759481053 subseq 295597 len 1428 csum 0x22a1], length 1428
10:30:04.913854 IP 112.26.1.8.39947 > 112.26.1.1.46615: Flags [.], ack 277033, win 23929, options [nop,nop,TS val 4294888845 ecr 133611,nop,nop,sack 1 {278461:297025},mptcp dss ack 3759385377], length 0
10:30:04.914105 IP 112.26.1.8.39947 > 112.26.1.1.46615: Flags [.], ack 277033, win 23929, options [nop,nop,TS val 4294888845 ecr 133611,nop,nop,sack 1 {278461:297025},mptcp dss ack 3759385377], length 0
10:30:04.944119 IP 112.26.1.1.46615 > 112.26.1.8.39947: Flags [.], seq 297025:298453, ack 1, win 4017, options [nop,nop,TS val 134598 ecr 4294887768,mptcp dss ack 2843715367 seq 3759486765 subseq 297025 len 1428 csum 0x4556], length 1428
10:30:04.944452 IP 112.26.1.1.46615 > 112.26.1.8.39947: Flags [.], seq 297025:298453, ack 1, win 4017, options [nop,nop,TS val 134598 ecr 4294887768,mptcp dss ack 2843715367 seq 3759486765 subseq 297025 len 1428 csum 0x4556], length 1428
10:30:05.028939 IP 112.26.1.8.39947 > 112.26.1.1.46615: Flags [.], ack 277033, win 23907, options [nop,nop,TS val 4294888960 ecr 133611,nop,nop,sack 1 {278461:298453},mptcp dss ack 3759386805], length 0
10:30:05.029229 IP 112.26.1.8.39947 > 112.26.1.1.46615: Flags [.], ack 277033, win 23907, options [nop,nop,TS val 4294888960 ecr 133611,nop,nop,sack 1 {278461:298453},mptcp dss ack 3759386805], length 0
10:30:05.070677 IP 112.26.1.1.46615 > 112.26.1.8.39947: Flags [.], seq 298453:299881, ack 1, win 4017, options [nop,nop,TS val 134665 ecr 4294887821,mptcp dss ack 2843715367 seq 3759491049 subseq 298453 len 1428 csum 0x3988], length 1428
10:30:05.070938 IP 112.26.1.1.46615 > 112.26.1.8.39947: Flags [.], seq 298453:299881, ack 1, win 4017, options [nop,nop,TS val 134665 ecr 4294887821,mptcp dss ack 2843715367 seq 3759491049 subseq 298453 len 1428 csum 0x3988], length 1428
10:30:05.140340 IP 112.26.1.8.39947 > 112.26.1.1.46615: Flags [.], ack 277033, win 23885, options [nop,nop,TS val 4294889084 ecr 133611,nop,nop,sack 1 {278461:299881},mptcp dss ack 3759388233], length 0
10:30:05.140675 IP 112.26.1.8.39947 > 112.26.1.1.46615: Flags [.], ack 277033, win 23885, options [nop,nop,TS val 4294889084 ecr 133611,nop,nop,sack 1 {278461:299881},mptcp dss ack 3759388233], length 0
10:30:05.150145 IP 112.26.1.8.39947 > 112.26.1.1.46615: Flags [.], ack 277033, win 23787, options [nop,nop,TS val 4294888519 ecr 133611,nop,nop,sack 1 {278461:294169},mptcp dss ack 3759355389], length 0
10:30:05.234337 IP 112.26.1.1.46615 > 112.26.1.8.39947: Flags [.], seq 299881:301309, ack 1, win 4017, options [nop,nop,TS val 134747 ecr 4294888019,mptcp dss ack 2843715367 seq 3759492477 subseq 299881 len 1428 csum 0xe049], length 1428
10:30:05.234666 IP 112.26.1.1.46615 > 112.26.1.8.39947: Flags [.], seq 299881:301309, ack 1, win 4017, options [nop,nop,TS val 134747 ecr 4294888019,mptcp dss ack 2843715367 seq 3759492477 subseq 299881 len 1428 csum 0xe049], length 1428
10:30:05.249298 IP 112.26.1.8.39947 > 112.26.1.1.46615: Flags [.], ack 277033, win 23885, options [nop,nop,TS val 4294889193 ecr 133611,nop,nop,sack 1 {278461:301309},mptcp dss ack 3759388233], length 0
10:30:05.249618 IP 112.26.1.8.39947 > 112.26.1.1.46615: Flags [.], ack 277033, win 23885, options [nop,nop,TS val 4294889193 ecr 133611,nop,nop,sack 1 {278461:301309},mptcp dss ack 3759388233], length 0
10:30:05.309947 IP 112.26.1.1.46615 > 112.26.1.8.39947: Flags [.], seq 301309:302737, ack 1, win 4017, options [nop,nop,TS val 134880 ecr 4294888083,mptcp dss ack 2843715367 seq 3759501045 subseq 301309 len 1428 csum 0x815b], length 1428
10:30:05.310220 IP 112.26.1.1.46615 > 112.26.1.8.39947: Flags [.], seq 301309:302737, ack 1, win 4017, options [nop,nop,TS val 134880 ecr 4294888083,mptcp dss ack 2843715367 seq 3759501045 subseq 301309 len 1428 csum 0x815b], length 1428
10:30:05.374596 IP 112.26.1.8.39947 > 112.26.1.1.46615: Flags [.], ack 277033, win 23973, options [nop,nop,TS val 4294888669 ecr 133611,nop,nop,sack 1 {278461:295597},mptcp dss ack 3759382521], length 0
10:30:05.387200 IP 112.26.1.8.39947 > 112.26.1.1.46615: Flags [.], ack 277033, win 23885, options [nop,nop,TS val 4294889331 ecr 133611,nop,nop,sack 1 {278461:302737},mptcp dss ack 3759388233], length 0
10:30:05.387501 IP 112.26.1.8.39947 > 112.26.1.1.46615: Flags [.], ack 277033, win 23885, options [nop,nop,TS val 4294889331 ecr 133611,nop,nop,sack 1 {278461:302737},mptcp dss ack 3759388233], length 0
10:30:05.411942 IP 112.26.1.1.46615 > 112.26.1.8.39947: Flags [.], seq 302737:304165, ack 1, win 4017, options [nop,nop,TS val 135075 ecr 4294888291,mptcp dss ack 2843715367 seq 3759513897 subseq 302737 len 1428 csum 0x606a], length 1428
10:30:05.412242 IP 112.26.1.1.46615 > 112.26.1.8.39947: Flags [.], seq 302737:304165, ack 1, win 4017, options [nop,nop,TS val 135075 ecr 4294888291,mptcp dss ack 2843715367 seq 3759513897 subseq 302737 len 1428 csum 0x606a], length 1428
