10:29:33.184904 IP 112.26.1.8.39947 > 112.26.1.1.46615: Flags [S], seq 2081378494, win 65535, options [mss 1460,sackOK,TS val 4294857065 ecr 0,nop,wscale 6,mptcp join id 3 token 0x9485611f nonce 0x1afdb74], length 0
10:29:33.265932 IP 112.26.1.8.39947 > 112.26.1.1.46615: Flags [S], seq 2081378494, win 65535, options [mss 1460,sackOK,TS val 4294857065 ecr 0,nop,wscale 6,mptcp join id 3 token 0x9485611f nonce 0x1afdb74], length 0
10:29:33.304123 IP 112.26.1.1.46615 > 112.26.1.8.39947: Flags [S.], seq 2068020644, ack 2081378495, win 65535, options [mss 1460,sackOK,TS val 103384 ecr 4294857065,nop,wscale 6,mptcp join id 3 hmac 0xfcb6205695ecb3b0 nonce 0x59a1037b], length 0
10:29:33.401809 IP 112.26.1.1.46615 > 112.26.1.8.39947: Flags [S.], seq 2068020644, ack 2081378495, win 65535, options [mss 1460,sackOK,TS val 103384 ecr 4294857065,nop,wscale 6,mptcp join id 3 hmac 0xfcb6205695ecb3b0 nonce 0x59a1037b], length 0
10:29:33.446027 IP 112.26.1.1.46615 > 112.26.1.8.39947: Flags [S.], seq 2068020644, ack 2081378495, win 65535, options [mss 1460,sackOK,TS val 103384 ecr 4294857065,nop,wscale 6,mptcp join id 3 hmac 0xfcb6205695ecb3b0 nonce 0x59a1037b], length 0
10:29:33.544675 IP 112.26.1.8.39947 > 112.26.1.1.46615: Flags [.], ack 1, win 7437, options [nop,nop,TS val 4294857392 ecr 103384,mptcp join hmac 0x9287e5d5fe7fddc14c54652063e8d530afbdb977], length 0
10:29:33.546269 IP 112.26.1.8.39947 > 112.26.1.1.46615: Flags [.], ack 1, win 7437, options [nop,nop,TS val 4294857392 ecr 103384,mptcp join hmac 0x9287e5d5fe7fddc14c54652063e8d530afbdb977], length 0
10:30:00.064200 IP 112.26.1.1.46615 > 112.26.1.8.39947: Flags [.], seq 255613:257041, ack 1, win 4017, options [nop,nop,TS val 130169 ecr 4294883264,mptcp dss ack 2843715367 seq 3759281133 subseq 255613 len 1428 csum 0x2603], length 1428
10:30:00.064542 IP 112.26.1.1.46615 > 112.26.1.8.39947: Flags [.], seq 255613:257041, ack 1, win 4017, options [nop,nop,TS val 130169 ecr 4294883264,mptcp dss ack 2843715367 seq 3759281133 subseq 255613 len 1428 csum 0x2603], length 1428
10:30:00.101833 IP 112.26.1.8.39947 > 112.26.1.1.46615: Flags [.], ack 248473, win 23937, options [nop,nop,TS val 4294883915 ecr 129678,mptcp dss ack 3759185457], length 0
10:30:00.102139 IP 112.26.1.8.39947 > 112.26.1.1.46615: Flags [.], ack 248473, win 23937, options [nop,nop,TS val 4294883915 ecr 129678,mptcp dss ack 3759185457], length 0
10:30:00.142982 IP 112.26.1.1.46615 > 112.26.1.8.39947: Flags [.], seq 257041:258469, ack 1, win 4017, options [nop,nop,TS val 130259 ecr 4294883435,mptcp dss ack 2843715367 seq 3759291129 subseq 257041 len 1428 csum 0x5db0], length 1428
10:30:00.143322 IP 112.26.1.1.46615 > 112.26.1.8.39947: Flags [.], seq 257041:258469, ack 1, win 4017, options [nop,nop,TS val 130259 ecr 4294883435,mptcp dss ack 2843715367 seq 3759291129 subseq 257041 len 1428 csum 0x5db0], length 1428
10:30:00.296541 IP 112.26.1.1.46615 > 112.26.1.8.39947: Flags [.], seq 248473:249901, ack 1, win 4017, options [nop,nop,TS val 129750 ecr 4294882926,mptcp dss ack 2843715367 seq 3759265425 subseq 248473 len 1428 csum 0xfae2], length 1428
10:30:00.352613 IP 112.26.1.1.46615 > 112.26.1.8.39947: Flags [.], seq 249901:251329, ack 1, win 4017, options [nop,nop,TS val 129750 ecr 4294882926,mptcp dss ack 2843715367 seq 3759266853 subseq 249901 len 1428 csum 0x2198], length 1428
10:30:00.378467 IP 112.26.1.1.46615 > 112.26.1.8.39947: Flags [.], seq 258469:259897, ack 1, win 4017, options [nop,nop,TS val 130494 ecr 4294883584,mptcp dss ack 2843715367 seq 3759302553 subseq 258469 len 1428 csum 0x5122], length 1428
10:30:00.378800 IP 112.26.1.1.46615 > 112.26.1.8.39947: Flags [.], seq 258469:259897, ack 1, win 4017, options [nop,nop,TS val 130494 ecr 4294883584,mptcp dss ack 2843715367 seq 3759302553 subseq 258469 len 1428 csum 0x5122], length 1428
10:30:00.399166 IP 112.26.1.1.46615 > 112.26.1.8.39947: Flags [.], seq 251329:252757, ack 1, win 4017, options [nop,nop,TS val 129750 ecr 4294882926,mptcp dss ack 2843715367 seq 3759268281 subseq 251329 len 1428 csum 0x7bd5], length 1428
10:30:00.457881 IP 112.26.1.1.46615 > 112.26.1.8.39947: Flags [.], seq 259897:261325, ack 1, win 4017, options [nop,nop,TS val 130572 ecr 4294883707,mptcp dss ack 2843715367 seq 3759303981 subseq 259897 len 1428 csum 0x52f7], length 1428
10:30:00.458254 IP 112.26.1.1.46615 > 112.26.1.8.39947: Flags [.], seq 259897:261325, ack 1, win 4017, options [nop,nop,TS val 130572 ecr 4294883707,mptcp dss ack 2843715367 seq 3759303981 subseq 259897 len 1428 csum 0x52f7], length 1428
10:30:00.485497 IP 112.26.1.8.39947 > 112.26.1.1.46615: Flags [.], ack 249901, win 23937, options [nop,nop,TS val 4294884241 ecr 129750,mptcp dss ack 3759185457], length 0
10:30:00.485838 IP 112.26.1.8.39947 > 112.26.1.1.46615: Flags [.], ack 249901, win 23937, options [nop,nop,TS val 4294884241 ecr 129750,mptcp dss ack 3759185457], length 0
10:30:00.548010 IP 112.26.1.8.39947 > 112.26.1.1.46615: Flags [.], ack 251329, win 23937, options [nop,nop,TS val 4294884298 ecr 129750,mptcp dss ack 3759185457], length 0
10:30:00.548276 IP 112.26.1.8.39947 > 112.26.1.1.46615: Flags [.], ack 251329, win 23937, options [nop,nop,TS val 4294884298 ecr 129750,mptcp dss ack 3759185457], length 0
10:30:00.621679 IP 112.26.1.8.39947 > 112.26.1.1.46615: Flags [.], ack 252757, win 23937, options [nop,nop,TS val 4294884342 ecr 129750,mptcp dss ack 3759185457], length 0
10:30:00.621986 IP 112.26.1.8.39947 > 112.26.1.1.46615: Flags [.], ack 252757, win 23937, options [nop,nop,TS val 4294884342 ecr 129750,mptcp dss ack 3759185457], length 0
10:30:00.648906 IP 112.26.1.1.46615 > 112.26.1.8.39947: Flags [.], seq 252757:254185, ack 1, win 4017, options [nop,nop,TS val 129831 ecr 4294883064,mptcp dss ack 2843715367 seq 3759269709 subseq 252757 len 1428 csum 0xa107], length 1428
10:30:00.701563 IP 112.26.1.1.46615 > 112.26.1.8.39947: Flags [.], seq 254185:255613, ack 1, win 4017, options [nop,nop,TS val 129983 ecr 4294883145,mptcp dss ack 2843715367 seq 3759276849 subseq 254185 len 1428 csum 0xd8f7], length 1428
10:30:00.713971 IP 112.26.1.1.46615 > 112.26.1.8.39947: Flags [.], seq 261325:262753, ack 1, win 4017, options [nop,nop,TS val 130822 ecr 4294883848,mptcp dss ack 2843715367 seq 3759313977 subseq 261325 len 1428 csum 0xeb24], length 1428
10:30:00.714305 IP 112.26.1.1.46615 > 112.26.1.8.39947: Flags [.], seq 261325:262753, ack 1, win 4017, options [nop,nop,TS val 130822 ecr 4294883848,mptcp dss ack 2843715367 seq 3759313977 subseq 261325 len 1428 csum 0xeb24], length 1428
10:30:00.812102 IP 112.26.1.8.39947 > 112.26.1.1.46615: Flags [.], ack 254185, win 23937, options [nop,nop,TS val 4294884595 ecr 129831,mptcp dss ack 3759185457], length 0
10:30:00.812405 IP 112.26.1.8.39947 > 112.26.1.1.46615: Flags [.], ack 254185, win 23937, options [nop,nop,TS val 4294884595 ecr 129831,mptcp dss ack 3759185457], length 0
10:30:00.856246 IP 112.26.1.8.39947 > 112.26.1.1.46615: Flags [.], ack 255613, win 24362, options [nop,nop,TS val 4294884647 ecr 129983,mptcp dss ack 3759252573], length 0
10:30:00.856512 IP 112.26.1.8.39947 > 112.26.1.1.46615: Flags [.], ack 255613, win 24362, options [nop,nop,TS val 4294884647 ecr 129983,mptcp dss ack 3759252573], length 0
10:30:00.959187 IP 112.26.1.1.46615 > 112.26.1.8.39947: Flags [.], seq 255613:257041, ack 1, win 4017, options [nop,nop,TS val 130169 ecr 4294883264,mptcp dss ack 2843715367 seq 3759281133 subseq 255613 len 1428 csum 0x2603], length 1428
10:30:01.031017 IP 112.26.1.1.46615 > 112.26.1.8.39947: Flags [.], seq 257041:258469, ack 1, win 4017, options [nop,nop,TS val 130259 ecr 4294883435,mptcp dss ack 2843715367 seq 3759291129 subseq 257041 len 1428 csum 0x5db0], length 1428
10:30:01.097270 IP 112.26.1.8.39947 > 112.26.1.1.46615: Flags [.], ack 257041, win 24362, options [nop,nop,TS val 4294884905 ecr 130169,mptcp dss ack 3759252573], length 0
10:30:01.097601 IP 112.26.1.8.39947 > 112.26.1.1.46615: Flags [.], ack 257041, win 24362, options [nop,nop,TS val 4294884905 ecr 130169,mptcp dss ack 3759252573], length 0
10:30:01.204613 IP 112.26.1.1.46615 > 112.26.1.8.39947: Flags [.], seq 262753:264181, ack 1, win 4017, options [nop,nop,TS val 131321 ecr 4294884241,mptcp dss ack 2843715367 seq 3759335397 subseq 262753 len 1428 csum 0x79c5], length 1428
10:30:01.204952 IP 112.26.1.1.46615 > 112.26.1.8.39947: Flags [.], seq 262753:264181, ack 1, win 4017, options [nop,nop,TS val 131321 ecr 4294884241,mptcp dss ack 2843715367 seq 3759335397 subseq 262753 len 1428 csum 0x79c5], length 1428
10:30:01.221909 IP 112.26.1.1.46615 > 112.26.1.8.39947: Flags [.], seq 258469:259897, ack 1, win 4017, options [nop,nop,TS val 130494 ecr 4294883584,mptcp dss ack 2843715367 seq 3759302553 subseq 258469 len 1428 csum 0x5122], length 1428
10:30:01.282976 IP 112.26.1.1.46615 > 112.26.1.8.39947: Flags [.], seq 264181:265609, ack 1, win 4017, options [nop,nop,TS val 131321 ecr 4294884241,mptcp dss ack 2843715367 seq 3759336825 subseq 264181 len 1428 csum 0x8de0], length 1428
10:30:01.283186 IP 112.26.1.1.46615 > 112.26.1.8.39947: Flags [.], seq 264181:265609, ack 1, win 4017, options [nop,nop,TS val 131321 ecr 4294884241,mptcp dss ack 2843715367 seq 3759336825 subseq 264181 len 1428 csum 0x8de0], length 1428
10:30:01.301554 IP 112.26.1.8.39947 > 112.26.1.1.46615: Flags [.], ack 258469, win 24540, options [nop,nop,TS val 4294884976 ecr 130259,mptcp dss ack 3759289701], length 0
10:30:01.301844 IP 112.26.1.8.39947 > 112.26.1.1.46615: Flags [.], ack 258469, win 24540, options [nop,nop,TS val 4294884976 ecr 130259,mptcp dss ack 3759289701], length 0
10:30:01.367020 IP 112.26.1.1.46615 > 112.26.1.8.39947: Flags [.], seq 265609:267037, ack 1, win 4017, options [nop,nop,TS val 131462 ecr 4294884342,mptcp dss ack 2843715367 seq 3759343965 subseq 265609 len 1428 csum 0x9488], length 1428
10:30:01.367180 IP 112.26.1.1.46615 > 112.26.1.8.39947: Flags [.], seq 265609:267037, ack 1, win 4017, options [nop,nop,TS val 131462 ecr 4294884342,mptcp dss ack 2843715367 seq 3759343965 subseq 265609 len 1428 csum 0x9488], length 1428
10:30:01.386306 IP 112.26.1.1.46615 > 112.26.1.8.39947: Flags [.], seq 259897:261325, ack 1, win 4017, options [nop,nop,TS val 130572 ecr 4294883707,mptcp dss ack 2843715367 seq 3759303981 subseq 259897 len 1428 csum 0x52f7], length 1428
10:30:01.411062 IP 112.26.1.8.39947 > 112.26.1.1.46615: Flags [.], ack 259897, win 24543, options [nop,nop,TS val 4294885167 ecr 130494,mptcp dss ack 3759295413], length 0
10:30:01.411376 IP 112.26.1.8.39947 > 112.26.1.1.46615: Flags [.], ack 259897, win 24543, options [nop,nop,TS val 4294885167 ecr 130494,mptcp dss ack 3759295413], length 0
10:30:01.437163 IP 112.26.1.1.46615 > 112.26.1.8.39947: Flags [.], seq 267037:268465, ack 1, win 4017, options [nop,nop,TS val 131462 ecr 4294884342,mptcp dss ack 2843715367 seq 3759345393 subseq 267037 len 1428 csum 0xe92d], length 1428
10:30:01.437411 IP 112.26.1.1.46615 > 112.26.1.8.39947: Flags [.], seq 267037:268465, ack 1, win 4017, options [nop,nop,TS val 131462 ecr 4294884342,mptcp dss ack 2843715367 seq 3759345393 subseq 267037 len 1428 csum 0xe92d], length 1428
10:30:01.507585 IP 112.26.1.8.39947 > 112.26.1.1.46615: Flags [.], ack 261325, win 24521, options [nop,nop,TS val 4294885302 ecr 130572,mptcp dss ack 3759296841], length 0
10:30:01.507889 IP 112.26.1.8.39947 > 112.26.1.1.46615: Flags [.], ack 261325, win 24521, options [nop,nop,TS val 4294885302 ecr 130572,mptcp dss ack 3759296841], length 0
10:30:01.536404 IP 112.26.1.1.46615 > 112.26.1.8.39947: Flags [.], seq 261325:262753, ack 1, win 4017, options [nop,nop,TS val 130822 ecr 4294883848,mptcp dss ack 2843715367 seq 3759313977 subseq 261325 len 1428 csum 0xeb24], length 1428
10:30:01.566401 IP 112.26.1.1.46615 > 112.26.1.8.39947: Flags [.], seq 268465:269893, ack 1, win 4017, options [nop,nop,TS val 131683 ecr 4294884647,mptcp dss ack 2843715367 seq 3759352533 subseq 268465 len 1428 csum 0x4c8f], length 1428
10:30:01.566740 IP 112.26.1.1.46615 > 112.26.1.8.39947: Flags [.], seq 268465:269893, ack 1, win 4017, options [nop,nop,TS val 131683 ecr 4294884647,mptcp dss ack 2843715367 seq 3759352533 subseq 268465 len 1428 csum 0x4c8f], length 1428
10:30:01.633255 IP 112.26.1.8.39947 > 112.26.1.1.46615: Flags [.], ack 262753, win 24499, options [nop,nop,TS val 4294885481 ecr 130822,mptcp dss ack 3759298269], length 0
10:30:01.633609 IP 112.26.1.8.39947 > 112.26.1.1.46615: Flags [.], ack 262753, win 24499, options [nop,nop,TS val 4294885481 ecr 130822,mptcp dss ack 3759298269], length 0
10:30:01.636527 IP 112.26.1.1.46615 > 112.26.1.8.39947: Flags [.], seq 269893:271321, ack 1, win 4017, options [nop,nop,TS val 131683 ecr 4294884647,mptcp dss ack 2843715367 seq 3759353961 subseq 269893 len 1428 csum 0xf6f5], length 1428
10:30:01.636795 IP 112.26.1.1.46615 > 112.26.1.8.39947: Flags [.], seq 269893:271321, ack 1, win 4017, options [nop,nop,TS val 131683 ecr 4294884647,mptcp dss ack 2843715367 seq 3759353961 subseq 269893 len 1428 csum 0xf6f5], length 1428
10:30:01.689520 IP 112.26.1.1.46615 > 112.26.1.8.39947: Flags [.], seq 271321:272749, ack 1, win 4017, options [nop,nop,TS val 131775 ecr 4294884905,mptcp dss ack 2843715367 seq 3759359673 subseq 271321 len 1428 csum 0x4926], length 1428
10:30:01.689823 IP 112.26.1.1.46615 > 112.26.1.8.39947: Flags [.], seq 271321:272749, ack 1, win 4017, options [nop,nop,TS val 131775 ecr 4294884905,mptcp dss ack 2843715367 seq 3759359673 subseq 271321 len 1428 csum 0x4926], length 1428
10:30:01.728691 IP 112.26.1.1.46615 > 112.26.1.8.39947: Flags [.], seq 262753:264181, ack 1, win 4017, options [nop,nop,TS val 131321 ecr 4294884241,mptcp dss ack 2843715367 seq 3759335397 subseq 262753 len 1428 csum 0x79c5], length 1428
10:30:01.813850 IP 112.26.1.8.39947 > 112.26.1.1.46615: Flags [.], ack 264181, win 24455, options [nop,nop,TS val 4294885674 ecr 131321,mptcp dss ack 3759301125], length 0
10:30:01.814154 IP 112.26.1.8.39947 > 112.26.1.1.46615: Flags [.], ack 264181, win 24455, options [nop,nop,TS val 4294885674 ecr 131321,mptcp dss ack 3759301125], length 0
10:30:01.864053 IP 112.26.1.1.46615 > 112.26.1.8.39947: Flags [.], seq 264181:265609, ack 1, win 4017, options [nop,nop,TS val 131321 ecr 4294884241,mptcp dss ack 2843715367 seq 3759336825 subseq 264181 len 1428 csum 0x8de0], length 1428
10:30:01.913519 IP 112.26.1.1.46615 > 112.26.1.8.39947: Flags [.], seq 272749:274177, ack 1, win 4017, options [nop,nop,TS val 132029 ecr 4294884976,mptcp dss ack 2843715367 seq 3759366813 subseq 272749 len 1428 csum 0x302f], length 1428
10:30:01.913877 IP 112.26.1.1.46615 > 112.26.1.8.39947: Flags [.], seq 272749:274177, ack 1, win 4017, options [nop,nop,TS val 132029 ecr 4294884976,mptcp dss ack 2843715367 seq 3759366813 subseq 272749 len 1428 csum 0x302f], length 1428
10:30:01.965557 IP 112.26.1.8.39947 > 112.26.1.1.46615: Flags [.], ack 265609, win 24360, options [nop,nop,TS val 4294885809 ecr 131321,mptcp dss ack 3759308265], length 0
10:30:01.965826 IP 112.26.1.8.39947 > 112.26.1.1.46615: Flags [.], ack 265609, win 24360, options [nop,nop,TS val 4294885809 ecr 131321,mptcp dss ack 3759308265], length 0
10:30:02.009475 IP 112.26.1.1.46615 > 112.26.1.8.39947: Flags [.], seq 265609:267037, ack 1, win 4017, options [nop,nop,TS val 131462 ecr 4294884342,mptcp dss ack 2843715367 seq 3759343965 subseq 265609 len 1428 csum 0x9488], length 1428
10:30:02.098898 IP 112.26.1.1.46615 > 112.26.1.8.39947: Flags [.], seq 274177:275605, ack 1, win 4017, options [nop,nop,TS val 132213 ecr 4294885167,mptcp dss ack 2843715367 seq 3759372525 subseq 274177 len 1428 csum 0x589f], length 1428
10:30:02.099251 IP 112.26.1.1.46615 > 112.26.1.8.39947: Flags [.], seq 274177:275605, ack 1, win 4017, options [nop,nop,TS val 132213 ecr 4294885167,mptcp dss ack 2843715367 seq 3759372525 subseq 274177 len 1428 csum 0x589f], length 1428
10:30:02.114152 IP 112.26.1.8.39947 > 112.26.1.1.46615: Flags [.], ack 267037, win 24316, options [nop,nop,TS val 4294885955 ecr 131462,mptcp dss ack 3759311121], length 0
10:30:02.114399 IP 112.26.1.8.39947 > 112.26.1.1.46615: Flags [.], ack 267037, win 24316, options [nop,nop,TS val 4294885955 ecr 131462,mptcp dss ack 3759311121], length 0
10:30:02.166910 IP 112.26.1.1.46615 > 112.26.1.8.39947: Flags [.], seq 275605:277033, ack 1, win 4017, options [nop,nop,TS val 132213 ecr 4294885167,mptcp dss ack 2843715367 seq 3759373953 subseq 275605 len 1428 csum 0xb592], length 1428
10:30:02.167127 IP 112.26.1.1.46615 > 112.26.1.8.39947: Flags [.], seq 275605:277033, ack 1, win 4017, options [nop,nop,TS val 132213 ecr 4294885167,mptcp dss ack 2843715367 seq 3759373953 subseq 275605 len 1428 csum 0xb592], length 1428
10:30:02.183500 IP 112.26.1.1.46615 > 112.26.1.8.39947: Flags [.], seq 267037:268465, ack 1, win 4017, options [nop,nop,TS val 131462 ecr 4294884342,mptcp dss ack 2843715367 seq 3759345393 subseq 267037 len 1428 csum 0xe92d], length 1428
10:30:02.258596 IP 112.26.1.8.39947 > 112.26.1.1.46615: Flags [.], ack 268465, win 24316, options [nop,nop,TS val 4294886170 ecr 131462,mptcp dss ack 3759311121], length 0
10:30:02.258882 IP 112.26.1.8.39947 > 112.26.1.1.46615: Flags [.], ack 268465, win 24316, options [nop,nop,TS val 4294886170 ecr 131462,mptcp dss ack 3759311121], length 0
10:30:02.268097 IP 112.26.1.1.46615 > 112.26.1.8.39947: Flags [.], seq 277033:278461, ack 1, win 4017, options [nop,nop,TS val 132337 ecr 4294885302,mptcp dss ack 2843715367 seq 3759388233 subseq 277033 len 1428 csum 0xa3b8], length 1428
10:30:02.268368 IP 112.26.1.1.46615 > 112.26.1.8.39947: Flags [.], seq 277033:278461, ack 1, win 4017, options [nop,nop,TS val 132337 ecr 4294885302,mptcp dss ack 2843715367 seq 3759388233 subseq 277033 len 1428 csum 0xa3b8], length 1428
10:30:02.322615 IP 112.26.1.1.46615 > 112.26.1.8.39947: Flags [.], seq 268465:269893, ack 1, win 4017, options [nop,nop,TS val 131683 ecr 4294884647,mptcp dss ack 2843715367 seq 3759352533 subseq 268465 len 1428 csum 0x4c8f], length 1428
10:30:02.418252 IP 112.26.1.1.46615 > 112.26.1.8.39947: Flags [.], seq 271321:272749, ack 1, win 4017, options [nop,nop,TS val 131775 ecr 4294884905,mptcp dss ack 2843715367 seq 3759359673 subseq 271321 len 1428 csum 0x4926], length 1428
10:30:02.463298 IP 112.26.1.1.46615 > 112.26.1.8.39947: Flags [.], seq 278461:279889, ack 1, win 4017, options [nop,nop,TS val 132578 ecr 4294885674,mptcp dss ack 2843715367 seq 3759399657 subseq 278461 len 1428 csum 0x4af6], length 1428
10:30:02.463542 IP 112.26.1.1.46615 > 112.26.1.8.39947: Flags [.], seq 278461:279889, ack 1, win 4017, options [nop,nop,TS val 132578 ecr 4294885674,mptcp dss ack 2843715367 seq 3759399657 subseq 278461 len 1428 csum 0x4af6], length 1428
10:30:02.478403 IP 112.26.1.8.39947 > 112.26.1.1.46615: Flags [.], ack 269893, win 24316, options [nop,nop,TS val 4294886352 ecr 131683,mptcp dss ack 3759311121], length 0
10:30:02.478643 IP 112.26.1.8.39947 > 112.26.1.1.46615: Flags [.], ack 269893, win 24316, options [nop,nop,TS val 4294886352 ecr 131683,mptcp dss ack 3759311121], length 0
10:30:02.538599 IP 112.26.1.1.46615 > 112.26.1.8.39947: Flags [.], seq 279889:281317, ack 1, win 4017, options [nop,nop,TS val 132578 ecr 4294885674,mptcp dss ack 2843715367 seq 3759401085 subseq 279889 len 1428 csum 0x81a4], length 1428
10:30:02.538853 IP 112.26.1.1.46615 > 112.26.1.8.39947: Flags [.], seq 279889:281317, ack 1, win 4017, options [nop,nop,TS val 132578 ecr 4294885674,mptcp dss ack 2843715367 seq 3759401085 subseq 279889 len 1428 csum 0x81a4], length 1428
10:30:02.548438 IP 112.26.1.8.39947 > 112.26.1.1.46615: Flags [.], ack 269893, win 24316, options [nop,nop,TS val 4294886363 ecr 131683,nop,nop,sack 1 {271321:272749},mptcp dss ack 3759311121], length 0
10:30:02.548687 IP 112.26.1.8.39947 > 112.26.1.1.46615: Flags [.], ack 269893, win 24316, options [nop,nop,TS val 4294886363 ecr 131683,nop,nop,sack 1 {271321:272749},mptcp dss ack 3759311121], length 0
10:30:02.596750 IP 112.26.1.1.46615 > 112.26.1.8.39947: Flags [.], seq 272749:274177, ack 1, win 4017, options [nop,nop,TS val 132029 ecr 4294884976,mptcp dss ack 2843715367 seq 3759366813 subseq 272749 len 1428 csum 0x302f], length 1428
10:30:02.656933 IP 112.26.1.1.46615 > 112.26.1.8.39947: Flags [.], seq 281317:282745, ack 1, win 4017, options [nop,nop,TS val 132772 ecr 4294885809,mptcp dss ack 2843715367 seq 3759409653 subseq 281317 len 1428 csum 0x290a], length 1428
10:30:02.657139 IP 112.26.1.1.46615 > 112.26.1.8.39947: Flags [.], seq 281317:282745, ack 1, win 4017, options [nop,nop,TS val 132772 ecr 4294885809,mptcp dss ack 2843715367 seq 3759409653 subseq 281317 len 1428 csum 0x290a], length 1428
10:30:02.678918 IP 112.26.1.8.39947 > 112.26.1.1.46615: Flags [.], ack 269893, win 24316, options [nop,nop,TS val 4294886542 ecr 131683,nop,nop,sack 1 {271321:274177},mptcp dss ack 3759311121], length 0
10:30:02.679166 IP 112.26.1.8.39947 > 112.26.1.1.46615: Flags [.], ack 269893, win 24316, options [nop,nop,TS val 4294886542 ecr 131683,nop,nop,sack 1 {271321:274177},mptcp dss ack 3759311121], length 0
10:30:02.765549 IP 112.26.1.1.46615 > 112.26.1.8.39947: Flags [.], seq 274177:275605, ack 1, win 4017, options [nop,nop,TS val 132213 ecr 4294885167,mptcp dss ack 2843715367 seq 3759372525 subseq 274177 len 1428 csum 0x589f], length 1428
10:30:02.767444 IP 112.26.1.1.46615 > 112.26.1.8.39947: Flags [.], seq 282745:284173, ack 1, win 4017, options [nop,nop,TS val 132874 ecr 4294885955,mptcp dss ack 2843715367 seq 3759411081 subseq 282745 len 1428 csum 0xbd0d], length 1428
10:30:02.767690 IP 112.26.1.1.46615 > 112.26.1.8.39947: Flags [.], seq 282745:284173, ack 1, win 4017, options [nop,nop,TS val 132874 ecr 4294885955,mptcp dss ack 2843715367 seq 3759411081 subseq 282745 len 1428 csum 0xbd0d], length 1428
10:30:02.860375 IP 112.26.1.8.39947 > 112.26.1.1.46615: Flags [.], ack 269893, win 24316, options [nop,nop,TS val 4294886706 ecr 131683,nop,nop,sack 1 {271321:275605},mptcp dss ack 3759311121], length 0
10:30:02.860615 IP 112.26.1.8.39947 > 112.26.1.1.46615: Flags [.], ack 269893, win 24316, options [nop,nop,TS val 4294886706 ecr 131683,nop,nop,sack 1 {271321:275605},mptcp dss ack 3759311121], length 0
10:30:02.871629 IP 112.26.1.1.46615 > 112.26.1.8.39947: Flags [.], seq 284173:285601, ack 1, win 4017, options [nop,nop,TS val 132874 ecr 4294885955,mptcp dss ack 2843715367 seq 3759412509 subseq 284173 len 1428 csum 0x48ab], length 1428
10:30:02.871861 IP 112.26.1.1.46615 > 112.26.1.8.39947: Flags [.], seq 284173:285601, ack 1, win 4017, options [nop,nop,TS val 132874 ecr 4294885955,mptcp dss ack 2843715367 seq 3759412509 subseq 284173 len 1428 csum 0x48ab], length 1428
10:30:02.901003 IP 112.26.1.1.46615 > 112.26.1.8.39947: Flags [.], seq 275605:277033, ack 1, win 4017, options [nop,nop,TS val 132213 ecr 4294885167,mptcp dss ack 2843715367 seq 3759373953 subseq 275605 len 1428 csum 0xb592], length 1428
10:30:02.927810 IP 112.26.1.1.46615 > 112.26.1.8.39947: Flags [.], seq 285601:287029, ack 1, win 4017, options [nop,nop,TS val 133024 ecr 4294886170,mptcp dss ack 2843715367 seq 3759429645 subseq 285601 len 1428 csum 0x36f4], length 1428
10:30:02.928048 IP 112.26.1.1.46615 > 112.26.1.8.39947: Flags [.], seq 285601:287029, ack 1, win 4017, options [nop,nop,TS val 133024 ecr 4294886170,mptcp dss ack 2843715367 seq 3759429645 subseq 285601 len 1428 csum 0x36f4], length 1428
10:30:02.975824 IP 112.26.1.8.39947 > 112.26.1.1.46615: Flags [.], ack 269893, win 24316, options [nop,nop,TS val 4294886843 ecr 131683,nop,nop,sack 1 {271321:277033},mptcp dss ack 3759311121], length 0
10:30:02.976052 IP 112.26.1.8.39947 > 112.26.1.1.46615: Flags [.], ack 269893, win 24316, options [nop,nop,TS val 4294886843 ecr 131683,nop,nop,sack 1 {271321:277033},mptcp dss ack 3759311121], length 0
10:30:03.036716 IP 112.26.1.1.46615 > 112.26.1.8.39947: Flags [.], seq 278461:279889, ack 1, win 4017, options [nop,nop,TS val 132578 ecr 4294885674,mptcp dss ack 2843715367 seq 3759399657 subseq 278461 len 1428 csum 0x4af6], length 1428
10:30:03.072703 IP 112.26.1.1.46615 > 112.26.1.8.39947: Flags [.], seq 287029:288457, ack 1, win 4017, options [nop,nop,TS val 133182 ecr 4294886352,mptcp dss ack 2843715367 seq 3759438213 subseq 287029 len 1428 csum 0xa2a6], length 1428
10:30:03.072892 IP 112.26.1.1.46615 > 112.26.1.8.39947: Flags [.], seq 287029:288457, ack 1, win 4017, options [nop,nop,TS val 133182 ecr 4294886352,mptcp dss ack 2843715367 seq 3759438213 subseq 287029 len 1428 csum 0xa2a6], length 1428
10:30:03.139614 IP 112.26.1.8.39947 > 112.26.1.1.46615: Flags [.], ack 269893, win 24316, options [nop,nop,TS val 4294886982 ecr 131683,nop,nop,sack 2 {278461:279889}{271321:277033},mptcp dss ack 3759311121], length 0
10:30:03.139798 IP 112.26.1.8.39947 > 112.26.1.1.46615: Flags [.], ack 269893, win 24316, options [nop,nop,TS val 4294886982 ecr 131683,nop,nop,sack 2 {278461:279889}{271321:277033},mptcp dss ack 3759311121], length 0
10:30:03.188763 IP 112.26.1.1.46615 > 112.26.1.8.39947: Flags [.], seq 279889:281317, ack 1, win 4017, options [nop,nop,TS val 132578 ecr 4294885674,mptcp dss ack 2843715367 seq 3759401085 subseq 279889 len 1428 csum 0x81a4], length 1428
10:30:03.222311 IP 112.26.1.1.46615 > 112.26.1.8.39947: Flags [.], seq 288457:289885, ack 1, win 4017, options [nop,nop,TS val 133337 ecr 4294886363,mptcp dss ack 2843715367 seq 3759441069 subseq 288457 len 1428 csum 0x3cf], length 1428
10:30:03.222608 IP 112.26.1.1.46615 > 112.26.1.8.39947: Flags [.], seq 288457:289885, ack 1, win 4017, options [nop,nop,TS val 133337 ecr 4294886363,mptcp dss ack 2843715367 seq 3759441069 subseq 288457 len 1428 csum 0x3cf], length 1428
10:30:03.290076 IP 112.26.1.8.39947 > 112.26.1.1.46615: Flags [.], ack 269893, win 24316, options [nop,nop,TS val 4294887134 ecr 131683,nop,nop,sack 2 {278461:281317}{271321:277033},mptcp dss ack 3759311121], length 0
10:30:03.290322 IP 112.26.1.8.39947 > 112.26.1.1.46615: Flags [.], ack 269893, win 24316, options [nop,nop,TS val 4294887134 ecr 131683,nop,nop,sack 2 {278461:281317}{271321:277033},mptcp dss ack 3759311121], length 0
10:30:03.350469 IP 112.26.1.1.46615 > 112.26.1.8.39947: Flags [.], seq 281317:282745, ack 1, win 4017, options [nop,nop,TS val 132772 ecr 4294885809,mptcp dss ack 2843715367 seq 3759409653 subseq 281317 len 1428 csum 0x290a], length 1428
10:30:03.405119 IP 112.26.1.1.46615 > 112.26.1.8.39947: Flags [.], seq 289885:291313, ack 1, win 4017, options [nop,nop,TS val 133517 ecr 4294886542,mptcp dss ack 2843715367 seq 3759449637 subseq 289885 len 1428 csum 0xa03a], length 1428
10:30:03.405372 IP 112.26.1.1.46615 > 112.26.1.8.39947: Flags [.], seq 289885:291313, ack 1, win 4017, options [nop,nop,TS val 133517 ecr 4294886542,mptcp dss ack 2843715367 seq 3759449637 subseq 289885 len 1428 csum 0xa03a], length 1428
10:30:03.413100 IP 112.26.1.8.39947 > 112.26.1.1.46615: Flags [.], ack 269893, win 24316, options [nop,nop,TS val 4294887296 ecr 131683,nop,nop,sack 2 {278461:282745}{271321:277033},mptcp dss ack 3759311121], length 0
10:30:03.413313 IP 112.26.1.8.39947 > 112.26.1.1.46615: Flags [.], ack 269893, win 24316, options [nop,nop,TS val 4294887296 ecr 131683,nop,nop,sack 2 {278461:282745}{271321:277033},mptcp dss ack 3759311121], length 0
10:30:03.470333 IP 112.26.1.1.46615 > 112.26.1.8.39947: Flags [.], seq 282745:284173, ack 1, win 4017, options [nop,nop,TS val 132874 ecr 4294885955,mptcp dss ack 2843715367 seq 3759411081 subseq 282745 len 1428 csum 0xbd0d], length 1428
10:30:03.493433 IP 112.26.1.1.46615 > 112.26.1.8.39947: Flags [.], seq 269893:271321, ack 1, win 4017, options [nop,nop,TS val 133611 ecr 4294886706,mptcp dss ack 2843715367 seq 3759353961 subseq 269893 len 1428 csum 0xf6f5], length 1428
10:30:03.493702 IP 112.26.1.1.46615 > 112.26.1.8.39947: Flags [.], seq 269893:271321, ack 1, win 4017, options [nop,nop,TS val 133611 ecr 4294886706,mptcp dss ack 2843715367 seq 3759353961 subseq 269893 len 1428 csum 0xf6f5], length 1428
10:30:03.515457 IP 112.26.1.8.39947 > 112.26.1.1.46615: Flags [.], ack 269893, win 24316, options [nop,nop,TS val 4294887410 ecr 131683,nop,nop,sack 2 {278461:284173}{271321:277033},mptcp dss ack 3759311121], length 0
10:30:03.515703 IP 112.26.1.8.39947 > 112.26.1.1.46615: Flags [.], ack 269893, win 24316, options [nop,nop,TS val 4294887410 ecr 131683,nop,nop,sack 2 {278461:284173}{271321:277033},mptcp dss ack 3759311121], length 0
10:30:03.563295 IP 112.26.1.1.46615 > 112.26.1.8.39947: Flags [.], seq 284173:285601, ack 1, win 4017, options [nop,nop,TS val 132874 ecr 4294885955,mptcp dss ack 2843715367 seq 3759412509 subseq 284173 len 1428 csum 0x48ab], length 1428
10:30:03.631154 IP 112.26.1.8.39947 > 112.26.1.1.46615: Flags [.], ack 269893, win 24316, options [nop,nop,TS val 4294887504 ecr 131683,nop,nop,sack 2 {278461:285601}{271321:277033},mptcp dss ack 3759311121], length 0
10:30:03.631396 IP 112.26.1.8.39947 > 112.26.1.1.46615: Flags [.], ack 269893, win 24316, options [nop,nop,TS val 4294887504 ecr 131683,nop,nop,sack 2 {278461:285601}{271321:277033},mptcp dss ack 3759311121], length 0
10:30:03.681411 IP 112.26.1.1.46615 > 112.26.1.8.39947: Flags [.], seq 285601:287029, ack 1, win 4017, options [nop,nop,TS val 133024 ecr 4294886170,mptcp dss ack 2843715367 seq 3759429645 subseq 285601 len 1428 csum 0x36f4], length 1428
10:30:03.740693 IP 112.26.1.1.46615 > 112.26.1.8.39947: Flags [.], seq 291313:292741, ack 1, win 4017, options [nop,nop,TS val 133857 ecr 4294886843,mptcp dss ack 2843715367 seq 3759458205 subseq 291313 len 1428 csum 0xd2b1], length 1428
10:30:03.740929 IP 112.26.1.1.46615 > 112.26.1.8.39947: Flags [.], seq 291313:292741, ack 1, win 4017, options [nop,nop,TS val 133857 ecr 4294886843,mptcp dss ack 2843715367 seq 3759458205 subseq 291313 len 1428 csum 0xd2b1], length 1428
10:30:03.761332 IP 112.26.1.8.39947 > 112.26.1.1.46615: Flags [.], ack 269893, win 24316, options [nop,nop,TS val 4294887626 ecr 131683,nop,nop,sack 2 {278461:287029}{271321:277033},mptcp dss ack 3759311121], length 0
10:30:03.761540 IP 112.26.1.8.39947 > 112.26.1.1.46615: Flags [.], ack 269893, win 24316, options [nop,nop,TS val 4294887626 ecr 131683,nop,nop,sack 2 {278461:287029}{271321:277033},mptcp dss ack 3759311121], length 0
10:30:03.788723 IP 112.26.1.1.46615 > 112.26.1.8.39947: Flags [.], seq 277033:278461, ack 1, win 4017, options [nop,nop,TS val 133857 ecr 4294886982,mptcp dss ack 2843715367 seq 3759388233 subseq 277033 len 1428 csum 0xa3b8], length 1428
10:30:03.788964 IP 112.26.1.1.46615 > 112.26.1.8.39947: Flags [.], seq 277033:278461, ack 1, win 4017, options [nop,nop,TS val 133857 ecr 4294886982,mptcp dss ack 2843715367 seq 3759388233 subseq 277033 len 1428 csum 0xa3b8], length 1428
10:30:03.829616 IP 112.26.1.1.46615 > 112.26.1.8.39947: Flags [.], seq 287029:288457, ack 1, win 4017, options [nop,nop,TS val 133182 ecr 4294886352,mptcp dss ack 2843715367 seq 3759438213 subseq 287029 len 1428 csum 0xa2a6], length 1428
10:30:03.875366 IP 112.26.1.1.46615 > 112.26.1.8.39947: Flags [.], seq 288457:289885, ack 1, win 4017, options [nop,nop,TS val 133337 ecr 4294886363,mptcp dss ack 2843715367 seq 3759441069 subseq 288457 len 1428 csum 0x3cf], length 1428
10:30:03.942334 IP 112.26.1.8.39947 > 112.26.1.1.46615: Flags [.], ack 269893, win 24316, options [nop,nop,TS val 4294887768 ecr 131683,nop,nop,sack 2 {278461:288457}{271321:277033},mptcp dss ack 3759311121], length 0
10:30:03.942605 IP 112.26.1.8.39947 > 112.26.1.1.46615: Flags [.], ack 269893, win 24316, options [nop,nop,TS val 4294887768 ecr 131683,nop,nop,sack 2 {278461:288457}{271321:277033},mptcp dss ack 3759311121], length 0
10:30:04.010954 IP 112.26.1.8.39947 > 112.26.1.1.46615: Flags [.], ack 269893, win 24316, options [nop,nop,TS val 4294887821 ecr 131683,nop,nop,sack 2 {278461:289885}{271321:277033},mptcp dss ack 3759311121], length 0
10:30:04.011184 IP 112.26.1.8.39947 > 112.26.1.1.46615: Flags [.], ack 269893, win 24316, options [nop,nop,TS val 4294887821 ecr 131683,nop,nop,sack 2 {278461:289885}{271321:277033},mptcp dss ack 3759311121], length 0
10:30:04.073156 IP 112.26.1.1.46615 > 112.26.1.8.39947: Flags [.], seq 289885:291313, ack 1, win 4017, options [nop,nop,TS val 133517 ecr 4294886542,mptcp dss ack 2843715367 seq 3759449637 subseq 289885 len 1428 csum 0xa03a], length 1428
10:30:04.137722 IP 112.26.1.1.46615 > 112.26.1.8.39947: Flags [.], seq 269893:271321, ack 1, win 4017, options [nop,nop,TS val 133611 ecr 4294886706,mptcp dss ack 2843715367 seq 3759353961 subseq 269893 len 1428 csum 0xf6f5], length 1428
10:30:04.169136 IP 112.26.1.1.46615 > 112.26.1.8.39947: Flags [.], seq 292741:294169, ack 1, win 4017, options [nop,nop,TS val 134282 ecr 4294887410,mptcp dss ack 2843715367 seq 3759473913 subseq 292741 len 1428 csum 0x9446], length 1428
10:30:04.169387 IP 112.26.1.1.46615 > 112.26.1.8.39947: Flags [.], seq 292741:294169, ack 1, win 4017, options [nop,nop,TS val 134282 ecr 4294887410,mptcp dss ack 2843715367 seq 3759473913 subseq 292741 len 1428 csum 0x9446], length 1428
10:30:04.228661 IP 112.26.1.8.39947 > 112.26.1.1.46615: Flags [.], ack 269893, win 24160, options [nop,nop,TS val 4294888019 ecr 131683,nop,nop,sack 2 {278461:291313}{271321:277033},mptcp dss ack 3759321117], length 0
10:30:04.228883 IP 112.26.1.8.39947 > 112.26.1.1.46615: Flags [.], ack 269893, win 24160, options [nop,nop,TS val 4294888019 ecr 131683,nop,nop,sack 2 {278461:291313}{271321:277033},mptcp dss ack 3759321117], length 0
10:30:04.245587 IP 112.26.1.1.46615 > 112.26.1.8.39947: Flags [.], seq 294169:295597, ack 1, win 4017, options [nop,nop,TS val 134353 ecr 4294887504,mptcp dss ack 2843715367 seq 3759475341 subseq 294169 len 1428 csum 0x8a18], length 1428
10:30:04.245808 IP 112.26.1.1.46615 > 112.26.1.8.39947: Flags [.], seq 294169:295597, ack 1, win 4017, options [nop,nop,TS val 134353 ecr 4294887504,mptcp dss ack 2843715367 seq 3759475341 subseq 294169 len 1428 csum 0x8a18], length 1428
10:30:04.281594 IP 112.26.1.8.39947 > 112.26.1.1.46615: Flags [.], ack 277033, win 24116, options [nop,nop,TS val 4294888083 ecr 133611,nop,nop,sack 1 {278461:291313},mptcp dss ack 3759323973], length 0
10:30:04.281827 IP 112.26.1.8.39947 > 112.26.1.1.46615: Flags [.], ack 277033, win 24116, options [nop,nop,TS val 4294888083 ecr 133611,nop,nop,sack 1 {278461:291313},mptcp dss ack 3759323973], length 0
10:30:04.345526 IP 112.26.1.1.46615 > 112.26.1.8.39947: Flags [.], seq 291313:292741, ack 1, win 4017, options [nop,nop,TS val 133857 ecr 4294886843,mptcp dss ack 2843715367 seq 3759458205 subseq 291313 len 1428 csum 0xd2b1], length 1428
10:30:04.391660 IP 112.26.1.8.39947 > 112.26.1.1.46615: Flags [.], ack 277033, win 23826, options [nop,nop,TS val 4294888291 ecr 133611,nop,nop,sack 1 {278461:292741},mptcp dss ack 3759342537], length 0
10:30:04.391917 IP 112.26.1.8.39947 > 112.26.1.1.46615: Flags [.], ack 277033, win 23826, options [nop,nop,TS val 4294888291 ecr 133611,nop,nop,sack 1 {278461:292741},mptcp dss ack 3759342537], length 0
10:30:04.415327 IP 112.26.1.1.46615 > 112.26.1.8.39947: Flags [.], seq 295597:297025, ack 1, win 4017, options [nop,nop,TS val 134530 ecr 4294887626,mptcp dss ack 2843715367 seq 3759481053 subseq 295597 len 1428 csum 0x22a1], length 1428
10:30:04.415608 IP 112.26.1.1.46615 > 112.26.1.8.39947: Flags [.], seq 295597:297025, ack 1, win 4017, options [nop,nop,TS val 134530 ecr 4294887626,mptcp dss ack 2843715367 seq 3759481053 subseq 295597 len 1428 csum 0x22a1], length 1428
10:30:04.484343 IP 112.26.1.1.46615 > 112.26.1.8.39947: Flags [.], seq 297025:298453, ack 1, win 4017, options [nop,nop,TS val 134598 ecr 4294887768,mptcp dss ack 2843715367 seq 3759486765 subseq 297025 len 1428 csum 0x4556], length 1428
10:30:04.484561 IP 112.26.1.1.46615 > 112.26.1.8.39947: Flags [.], seq 297025:298453, ack 1, win 4017, options [nop,nop,TS val 134598 ecr 4294887768,mptcp dss ack 2843715367 seq 3759486765 subseq 297025 len 1428 csum 0x4556], length 1428
10:30:04.549424 IP 112.26.1.1.46615 > 112.26.1.8.39947: Flags [.], seq 298453:299881, ack 1, win 4017, options [nop,nop,TS val 134665 ecr 4294887821,mptcp dss ack 2843715367 seq 3759491049 subseq 298453 len 1428 csum 0x3988], length 1428
10:30:04.549683 IP 112.26.1.1.46615 > 112.26.1.8.39947: Flags [.], seq 298453:299881, ack 1, win 4017, options [nop,nop,TS val 134665 ecr 4294887821,mptcp dss ack 2843715367 seq 3759491049 subseq 298453 len 1428 csum 0x3988], length 1428
10:30:04.578831 IP 112.26.1.1.46615 > 112.26.1.8.39947: Flags [.], seq 292741:294169, ack 1, win 4017, options [nop,nop,TS val 134282 ecr 4294887410,mptcp dss ack 2843715367 seq 3759473913 subseq 292741 len 1428 csum 0x9446], length 1428
10:30:04.643226 IP 112.26.1.8.39947 > 112.26.1.1.46615: Flags [.], ack 277033, win 23787, options [nop,nop,TS val 4294888519 ecr 133611,nop,nop,sack 1 {278461:294169},mptcp dss ack 3759355389], length 0
10:30:04.643458 IP 112.26.1.8.39947 > 112.26.1.1.46615: Flags [.], ack 277033, win 23787, options [nop,nop,TS val 4294888519 ecr 133611,nop,nop,sack 1 {278461:294169},mptcp dss ack 3759355389], length 0
10:30:04.662064 IP 112.26.1.1.46615 > 112.26.1.8.39947: Flags [.], seq 299881:301309, ack 1, win 4017, options [nop,nop,TS val 134747 ecr 4294888019,mptcp dss ack 2843715367 seq 3759492477 subseq 299881 len 1428 csum 0xe049], length 1428
10:30:04.662320 IP 112.26.1.1.46615 > 112.26.1.8.39947: Flags [.], seq 299881:301309, ack 1, win 4017, options [nop,nop,TS val 134747 ecr 4294888019,mptcp dss ack 2843715367 seq 3759492477 subseq 299881 len 1428 csum 0xe049], length 1428
10:30:04.723540 IP 112.26.1.1.46615 > 112.26.1.8.39947: Flags [.], seq 294169:295597, ack 1, win 4017, options [nop,nop,TS val 134353 ecr 4294887504,mptcp dss ack 2843715367 seq 3759475341 subseq 294169 len 1428 csum 0x8a18], length 1428
10:30:04.772655 IP 112.26.1.1.46615 > 112.26.1.8.39947: Flags [.], seq 301309:302737, ack 1, win 4017, options [nop,nop,TS val 134880 ecr 4294888083,mptcp dss ack 2843715367 seq 3759501045 subseq 301309 len 1428 csum 0x815b], length 1428
10:30:04.772894 IP 112.26.1.1.46615 > 112.26.1.8.39947: Flags [.], seq 301309:302737, ack 1, win 4017, options [nop,nop,TS val 134880 ecr 4294888083,mptcp dss ack 2843715367 seq 3759501045 subseq 301309 len 1428 csum 0x815b], length 1428
10:30:04.789341 IP 112.26.1.8.39947 > 112.26.1.1.46615: Flags [.], ack 277033, win 23973, options [nop,nop,TS val 4294888669 ecr 133611,nop,nop,sack 1 {278461:295597},mptcp dss ack 3759382521], length 0
10:30:04.789596 IP 112.26.1.8.39947 > 112.26.1.1.46615: Flags [.], ack 277033, win 23973, options [nop,nop,TS val 4294888669 ecr 133611,nop,nop,sack 1 {278461:295597},mptcp dss ack 3759382521], length 0
10:30:04.899605 IP 112.26.1.1.46615 > 112.26.1.8.39947: Flags [.], seq 295597:297025, ack 1, win 4017, options [nop,nop,TS val 134530 ecr 4294887626,mptcp dss ack 2843715367 seq 3759481053 subseq 295597 len 1428 csum 0x22a1], length 1428
10:30:04.959043 IP 112.26.1.1.46615 > 112.26.1.8.39947: Flags [.], seq 302737:304165, ack 1, win 4017, options [nop,nop,TS val 135075 ecr 4294888291,mptcp dss ack 2843715367 seq 3759513897 subseq 302737 len 1428 csum 0x606a], length 1428
10:30:04.959281 IP 112.26.1.1.46615 > 112.26.1.8.39947: Flags [.], seq 302737:304165, ack 1, win 4017, options [nop,nop,TS val 135075 ecr 4294888291,mptcp dss ack 2843715367 seq 3759513897 subseq 302737 len 1428 csum 0x606a], length 1428
10:30:04.987475 IP 112.26.1.8.39947 > 112.26.1.1.46615: Flags [.], ack 277033, win 23929, options [nop,nop,TS val 4294888845 ecr 133611,nop,nop,sack 1 {278461:297025},mptcp dss ack 3759385377], length 0
10:30:04.987775 IP 112.26.1.8.39947 > 112.26.1.1.46615: Flags [.], ack 277033, win 23929, options [nop,nop,TS val 4294888845 ecr 133611,nop,nop,sack 1 {278461:297025},mptcp dss ack 3759385377], length 0
10:30:05.014333 IP 112.26.1.1.46615 > 112.26.1.8.39947: Flags [.], seq 297025:298453, ack 1, win 4017, options [nop,nop,TS val 134598 ecr 4294887768,mptcp dss ack 2843715367 seq 3759486765 subseq 297025 len 1428 csum 0x4556], length 1428
