10:29:33.145544 IP 112.26.2.8.43407 > 112.26.2.1.46615: Flags [S], seq 1007811304, win 65535, options [mss 1460,sackOK,TS val 4294857066 ecr 0,nop,wscale 6,mptcp join id 4 token 0x9485611f nonce 0xdb53f955], length 0
10:29:33.207016 IP 112.26.2.8.43407 > 112.26.2.1.46615: Flags [S], seq 1007811304, win 65535, options [mss 1460,sackOK,TS val 4294857066 ecr 0,nop,wscale 6,mptcp join id 4 token 0x9485611f nonce 0xdb53f955], length 0
10:29:33.278367 IP 112.26.2.8.43407 > 112.26.2.1.46615: Flags [S], seq 1007811304, win 65535, options [mss 1460,sackOK,TS val 4294857066 ecr 0,nop,wscale 6,mptcp join id 4 token 0x9485611f nonce 0xdb53f955], length 0
10:29:33.376895 IP 112.26.2.1.46615 > 112.26.2.8.43407: Flags [S.], seq 2180547765, ack 1007811305, win 65535, options [mss 1460,sackOK,TS val 103396 ecr 4294857066,nop,wscale 6,mptcp join id 6 hmac 0x9c349290b4de3414 nonce 0x7aa66214], length 0
10:29:33.377143 IP 112.26.2.1.46615 > 112.26.2.8.43407: Flags [S.], seq 2180547765, ack 1007811305, win 65535, options [mss 1460,sackOK,TS val 103396 ecr 4294857066,nop,wscale 6,mptcp join id 6 hmac 0x9c349290b4de3414 nonce 0x7aa66214], length 0
10:29:33.380394 IP 112.26.2.8.43407 > 112.26.2.1.46615: Flags [.], ack 1, win 6023, options [nop,nop,TS val 4294857324 ecr 103396,mptcp join hmac 0xe88f19a8618c43065376f6b8139f816ffacca173], length 0
10:29:33.380675 IP 112.26.2.8.43407 > 112.26.2.1.46615: Flags [.], ack 1, win 6023, options [nop,nop,TS val 4294857324 ecr 103396,mptcp join hmac 0xe88f19a8618c43065376f6b8139f816ffacca173], length 0
10:30:09.444943 IP 112.26.2.8.43407 > 112.26.2.1.46615: Flags [.], ack 342721, win 24125, options [nop,nop,TS val 4294893388 ecr 138930,mptcp dss ack 3759630993], length 0
10:30:09.445166 IP 112.26.2.8.43407 > 112.26.2.1.46615: Flags [.], ack 342721, win 24125, options [nop,nop,TS val 4294893388 ecr 138930,mptcp dss ack 3759630993], length 0
10:30:09.469727 IP 112.26.2.8.43407 > 112.26.2.1.46615: Flags [.], ack 311305, win 23921, options [nop,nop,TS val 4294892703 ecr 136763,nop,nop,sack 1 {314161:337009},mptcp dss ack 3759515325], length 0
10:30:09.505639 IP 112.26.2.1.46615 > 112.26.2.8.43407: Flags [.], seq 342721:344149, ack 1, win 4017, options [nop,nop,TS val 139077 ecr 4294892118,mptcp dss ack 2843715367 seq 3759692397 subseq 342721 len 1428 csum 0x1eca], length 1428
10:30:09.505824 IP 112.26.2.1.46615 > 112.26.2.8.43407: Flags [.], seq 342721:344149, ack 1, win 4017, options [nop,nop,TS val 139077 ecr 4294892118,mptcp dss ack 2843715367 seq 3759692397 subseq 342721 len 1428 csum 0x1eca], length 1428
10:30:09.578027 IP 112.26.2.8.43407 > 112.26.2.1.46615: Flags [.], ack 344149, win 24125, options [nop,nop,TS val 4294893520 ecr 139077,mptcp dss ack 3759630993], length 0
10:30:09.578230 IP 112.26.2.8.43407 > 112.26.2.1.46615: Flags [.], ack 344149, win 24125, options [nop,nop,TS val 4294893520 ecr 139077,mptcp dss ack 3759630993], length 0
10:30:09.601662 IP 112.26.2.8.43407 > 112.26.2.1.46615: Flags [.], ack 311305, win 23921, options [nop,nop,TS val 4294892850 ecr 136763,nop,nop,sack 1 {314161:338437},mptcp dss ack 3759515325], length 0
10:30:09.676536 IP 112.26.2.1.46615 > 112.26.2.8.43407: Flags [.], seq 344149:345577, ack 1, win 4017, options [nop,nop,TS val 139233 ecr 4294892253,mptcp dss ack 2843715367 seq 3759700965 subseq 344149 len 1428 csum 0xc8d4], length 1428
10:30:09.676717 IP 112.26.2.1.46615 > 112.26.2.8.43407: Flags [.], seq 344149:345577, ack 1, win 4017, options [nop,nop,TS val 139233 ecr 4294892253,mptcp dss ack 2843715367 seq 3759700965 subseq 344149 len 1428 csum 0xc8d4], length 1428
10:30:09.700513 IP 112.26.2.8.43407 > 112.26.2.1.46615: Flags [.], ack 345577, win 24125, options [nop,nop,TS val 4294893644 ecr 139233,mptcp dss ack 3759630993], length 0
10:30:09.700721 IP 112.26.2.8.43407 > 112.26.2.1.46615: Flags [.], ack 345577, win 24125, options [nop,nop,TS val 4294893644 ecr 139233,mptcp dss ack 3759630993], length 0
10:30:09.743137 IP 112.26.2.8.43407 > 112.26.2.1.46615: Flags [.], ack 338437, win 23155, options [nop,nop,TS val 4294893007 ecr 138462,mptcp dss ack 3759579585], length 0
10:30:09.810475 IP 112.26.2.1.46615 > 112.26.2.8.43407: Flags [.], seq 345577:347005, ack 1, win 4017, options [nop,nop,TS val 139346 ecr 4294892413,mptcp dss ack 2843715367 seq 3759705249 subseq 345577 len 1428 csum 0xfd94], length 1428
10:30:09.810733 IP 112.26.2.1.46615 > 112.26.2.8.43407: Flags [.], seq 345577:347005, ack 1, win 4017, options [nop,nop,TS val 139346 ecr 4294892413,mptcp dss ack 2843715367 seq 3759705249 subseq 345577 len 1428 csum 0xfd94], length 1428
10:30:09.822096 IP 112.26.2.8.43407 > 112.26.2.1.46615: Flags [.], ack 347005, win 24125, options [nop,nop,TS val 4294893765 ecr 139346,mptcp dss ack 3759630993], length 0
10:30:09.822305 IP 112.26.2.8.43407 > 112.26.2.1.46615: Flags [.], ack 347005, win 24125, options [nop,nop,TS val 4294893765 ecr 139346,mptcp dss ack 3759630993], length 0
10:30:09.865813 IP 112.26.2.8.43407 > 112.26.2.1.46615: Flags [.], ack 339865, win 23860, options [nop,nop,TS val 4294893140 ecr 138641,mptcp dss ack 3759591009], length 0
10:30:09.947820 IP 112.26.2.1.46615 > 112.26.2.8.43407: Flags [.], seq 347005:348433, ack 1, win 4017, options [nop,nop,TS val 139457 ecr 4294892588,mptcp dss ack 2843715367 seq 3759710961 subseq 347005 len 1428 csum 0x4972], length 1428
10:30:09.948024 IP 112.26.2.1.46615 > 112.26.2.8.43407: Flags [.], seq 347005:348433, ack 1, win 4017, options [nop,nop,TS val 139457 ecr 4294892588,mptcp dss ack 2843715367 seq 3759710961 subseq 347005 len 1428 csum 0x4972], length 1428
10:30:09.951808 IP 112.26.2.8.43407 > 112.26.2.1.46615: Flags [.], ack 348433, win 24125, options [nop,nop,TS val 4294893895 ecr 139457,mptcp dss ack 3759630993], length 0
10:30:09.952019 IP 112.26.2.8.43407 > 112.26.2.1.46615: Flags [.], ack 348433, win 24125, options [nop,nop,TS val 4294893895 ecr 139457,mptcp dss ack 3759630993], length 0
10:30:10.007846 IP 112.26.2.8.43407 > 112.26.2.1.46615: Flags [.], ack 341293, win 24125, options [nop,nop,TS val 4294893261 ecr 138752,mptcp dss ack 3759630993], length 0
10:30:10.056290 IP 112.26.2.8.43407 > 112.26.2.1.46615: Flags [.], ack 342721, win 24125, options [nop,nop,TS val 4294893388 ecr 138930,mptcp dss ack 3759630993], length 0
10:30:10.114452 IP 112.26.2.1.46615 > 112.26.2.8.43407: Flags [.], seq 348433:349861, ack 1, win 4017, options [nop,nop,TS val 139635 ecr 4294892703,mptcp dss ack 2843715367 seq 3759715245 subseq 348433 len 1428 csum 0x5b2f], length 1428
10:30:10.114662 IP 112.26.2.1.46615 > 112.26.2.8.43407: Flags [.], seq 348433:349861, ack 1, win 4017, options [nop,nop,TS val 139635 ecr 4294892703,mptcp dss ack 2843715367 seq 3759715245 subseq 348433 len 1428 csum 0x5b2f], length 1428
10:30:10.126064 IP 112.26.2.8.43407 > 112.26.2.1.46615: Flags [.], ack 349861, win 24059, options [nop,nop,TS val 4294894066 ecr 139635,mptcp dss ack 3759635277], length 0
10:30:10.126279 IP 112.26.2.8.43407 > 112.26.2.1.46615: Flags [.], ack 349861, win 24059, options [nop,nop,TS val 4294894066 ecr 139635,mptcp dss ack 3759635277], length 0
10:30:10.233771 IP 112.26.2.8.43407 > 112.26.2.1.46615: Flags [.], ack 344149, win 24125, options [nop,nop,TS val 4294893520 ecr 139077,mptcp dss ack 3759630993], length 0
10:30:10.295663 IP 112.26.2.1.46615 > 112.26.2.8.43407: Flags [.], seq 349861:351289, ack 1, win 4017, options [nop,nop,TS val 139739 ecr 4294892850,mptcp dss ack 2843715367 seq 3759725241 subseq 349861 len 1428 csum 0xfb83], length 1428
10:30:10.295839 IP 112.26.2.1.46615 > 112.26.2.8.43407: Flags [.], seq 349861:351289, ack 1, win 4017, options [nop,nop,TS val 139739 ecr 4294892850,mptcp dss ack 2843715367 seq 3759725241 subseq 349861 len 1428 csum 0xfb83], length 1428
10:30:10.307995 IP 112.26.2.8.43407 > 112.26.2.1.46615: Flags [.], ack 351289, win 23993, options [nop,nop,TS val 4294894244 ecr 139739,mptcp dss ack 3759639561], length 0
10:30:10.308198 IP 112.26.2.8.43407 > 112.26.2.1.46615: Flags [.], ack 351289, win 23993, options [nop,nop,TS val 4294894244 ecr 139739,mptcp dss ack 3759639561], length 0
10:30:10.392956 IP 112.26.2.1.46615 > 112.26.2.8.43407: Flags [.], seq 351289:352717, ack 1, win 4017, options [nop,nop,TS val 139862 ecr 4294893007,mptcp dss ack 2843715367 seq 3759738093 subseq 351289 len 1428 csum 0x645f], length 1428
10:30:10.393155 IP 112.26.2.1.46615 > 112.26.2.8.43407: Flags [.], seq 351289:352717, ack 1, win 4017, options [nop,nop,TS val 139862 ecr 4294893007,mptcp dss ack 2843715367 seq 3759738093 subseq 351289 len 1428 csum 0x645f], length 1428
10:30:10.414624 IP 112.26.2.8.43407 > 112.26.2.1.46615: Flags [.], ack 352717, win 23971, options [nop,nop,TS val 4294894358 ecr 139862,mptcp dss ack 3759640989], length 0
10:30:10.414827 IP 112.26.2.8.43407 > 112.26.2.1.46615: Flags [.], ack 352717, win 23971, options [nop,nop,TS val 4294894358 ecr 139862,mptcp dss ack 3759640989], length 0
10:30:10.459883 IP 112.26.2.1.46615 > 112.26.2.8.43407: Flags [.], seq 352717:354145, ack 1, win 4017, options [nop,nop,TS val 139862 ecr 4294893007,mptcp dss ack 2843715367 seq 3759739521 subseq 352717 len 1428 csum 0x6667], length 1428
10:30:10.460071 IP 112.26.2.1.46615 > 112.26.2.8.43407: Flags [.], seq 352717:354145, ack 1, win 4017, options [nop,nop,TS val 139862 ecr 4294893007,mptcp dss ack 2843715367 seq 3759739521 subseq 352717 len 1428 csum 0x6667], length 1428
10:30:10.518743 IP 112.26.2.8.43407 > 112.26.2.1.46615: Flags [.], ack 354145, win 23949, options [nop,nop,TS val 4294894461 ecr 139862,mptcp dss ack 3759642417], length 0
10:30:10.518961 IP 112.26.2.8.43407 > 112.26.2.1.46615: Flags [.], ack 354145, win 23949, options [nop,nop,TS val 4294894461 ecr 139862,mptcp dss ack 3759642417], length 0
10:30:10.546671 IP 112.26.2.1.46615 > 112.26.2.8.43407: Flags [.], seq 354145:355573, ack 1, win 4017, options [nop,nop,TS val 139984 ecr 4294893140,mptcp dss ack 2843715367 seq 3759746661 subseq 354145 len 1428 csum 0x563], length 1428
10:30:10.546855 IP 112.26.2.1.46615 > 112.26.2.8.43407: Flags [.], seq 354145:355573, ack 1, win 4017, options [nop,nop,TS val 139984 ecr 4294893140,mptcp dss ack 2843715367 seq 3759746661 subseq 354145 len 1428 csum 0x563], length 1428
10:30:10.618330 IP 112.26.2.8.43407 > 112.26.2.1.46615: Flags [.], ack 348433, win 24125, options [nop,nop,TS val 4294893895 ecr 139457,mptcp dss ack 3759630993], length 0
10:30:10.684288 IP 112.26.2.8.43407 > 112.26.2.1.46615: Flags [.], ack 355573, win 24383, options [nop,nop,TS val 4294894628 ecr 139984,mptcp dss ack 3759712389], length 0
10:30:10.684494 IP 112.26.2.8.43407 > 112.26.2.1.46615: Flags [.], ack 355573, win 24383, options [nop,nop,TS val 4294894628 ecr 139984,mptcp dss ack 3759712389], length 0
10:30:10.705868 IP 112.26.2.1.46615 > 112.26.2.8.43407: Flags [.], seq 355573:357001, ack 1, win 4017, options [nop,nop,TS val 140126 ecr 4294893261,mptcp dss ack 2843715367 seq 3759756657 subseq 355573 len 1428 csum 0x4244], length 1428
10:30:10.706057 IP 112.26.2.1.46615 > 112.26.2.8.43407: Flags [.], seq 355573:357001, ack 1, win 4017, options [nop,nop,TS val 140126 ecr 4294893261,mptcp dss ack 2843715367 seq 3759756657 subseq 355573 len 1428 csum 0x4244], length 1428
10:30:10.778725 IP 112.26.2.1.46615 > 112.26.2.8.43407: Flags [.], seq 357001:358429, ack 1, win 4017, options [nop,nop,TS val 140126 ecr 4294893261,mptcp dss ack 2843715367 seq 3759758085 subseq 357001 len 1428 csum 0x235c], length 1428
10:30:10.778915 IP 112.26.2.1.46615 > 112.26.2.8.43407: Flags [.], seq 357001:358429, ack 1, win 4017, options [nop,nop,TS val 140126 ecr 4294893261,mptcp dss ack 2843715367 seq 3759758085 subseq 357001 len 1428 csum 0x235c], length 1428
10:30:10.826495 IP 112.26.2.8.43407 > 112.26.2.1.46615: Flags [.], ack 357001, win 24383, options [nop,nop,TS val 4294894767 ecr 140126,mptcp dss ack 3759712389], length 0
10:30:10.826723 IP 112.26.2.8.43407 > 112.26.2.1.46615: Flags [.], ack 357001, win 24383, options [nop,nop,TS val 4294894767 ecr 140126,mptcp dss ack 3759712389], length 0
10:30:10.904819 IP 112.26.2.8.43407 > 112.26.2.1.46615: Flags [.], ack 358429, win 24383, options [nop,nop,TS val 4294894841 ecr 140126,mptcp dss ack 3759712389], length 0
10:30:10.905022 IP 112.26.2.8.43407 > 112.26.2.1.46615: Flags [.], ack 358429, win 24383, options [nop,nop,TS val 4294894841 ecr 140126,mptcp dss ack 3759712389], length 0
10:30:10.911774 IP 112.26.2.8.43407 > 112.26.2.1.46615: Flags [.], ack 349861, win 24059, options [nop,nop,TS val 4294894066 ecr 139635,mptcp dss ack 3759635277], length 0
10:30:11.000146 IP 112.26.2.1.46615 > 112.26.2.8.43407: Flags [.], seq 359857:361285, ack 1, win 4017, options [nop,nop,TS val 140352 ecr 4294893520,mptcp dss ack 2843715367 seq 3759768081 subseq 359857 len 1428 csum 0xf944], length 1428
10:30:11.000341 IP 112.26.2.1.46615 > 112.26.2.8.43407: Flags [.], seq 359857:361285, ack 1, win 4017, options [nop,nop,TS val 140352 ecr 4294893520,mptcp dss ack 2843715367 seq 3759768081 subseq 359857 len 1428 csum 0xf944], length 1428
10:30:11.103413 IP 112.26.2.8.43407 > 112.26.2.1.46615: Flags [.], ack 351289, win 23993, options [nop,nop,TS val 4294894244 ecr 139739,mptcp dss ack 3759639561], length 0
10:30:11.163971 IP 112.26.2.8.43407 > 112.26.2.1.46615: Flags [.], ack 358429, win 24383, options [nop,nop,TS val 4294895105 ecr 140126,nop,nop,sack 1 {359857:361285},mptcp dss ack 3759712389], length 0
10:30:11.164172 IP 112.26.2.8.43407 > 112.26.2.1.46615: Flags [.], ack 358429, win 24383, options [nop,nop,TS val 4294895105 ecr 140126,nop,nop,sack 1 {359857:361285},mptcp dss ack 3759712389], length 0
10:30:11.194280 IP 112.26.2.8.43407 > 112.26.2.1.46615: Flags [.], ack 352717, win 23971, options [nop,nop,TS val 4294894358 ecr 139862,mptcp dss ack 3759640989], length 0
10:30:11.268861 IP 112.26.2.8.43407 > 112.26.2.1.46615: Flags [.], ack 354145, win 23949, options [nop,nop,TS val 4294894461 ecr 139862,mptcp dss ack 3759642417], length 0
10:30:11.359338 IP 112.26.2.1.46615 > 112.26.2.8.43407: Flags [.], seq 361285:362713, ack 1, win 4017, options [nop,nop,TS val 140736 ecr 4294893895,mptcp dss ack 2843715367 seq 3759780933 subseq 361285 len 1428 csum 0xae44], length 1428
10:30:11.359537 IP 112.26.2.1.46615 > 112.26.2.8.43407: Flags [.], seq 361285:362713, ack 1, win 4017, options [nop,nop,TS val 140736 ecr 4294893895,mptcp dss ack 2843715367 seq 3759780933 subseq 361285 len 1428 csum 0xae44], length 1428
10:30:11.366366 IP 112.26.2.8.43407 > 112.26.2.1.46615: Flags [.], ack 358429, win 24383, options [nop,nop,TS val 4294895307 ecr 140126,nop,nop,sack 1 {359857:362713},mptcp dss ack 3759712389], length 0
10:30:11.366561 IP 112.26.2.8.43407 > 112.26.2.1.46615: Flags [.], ack 358429, win 24383, options [nop,nop,TS val 4294895307 ecr 140126,nop,nop,sack 1 {359857:362713},mptcp dss ack 3759712389], length 0
10:30:11.433587 IP 112.26.2.1.46615 > 112.26.2.8.43407: Flags [.], seq 362713:364141, ack 1, win 4017, options [nop,nop,TS val 140736 ecr 4294893895,mptcp dss ack 2843715367 seq 3759782361 subseq 362713 len 1428 csum 0x6fa1], length 1428
10:30:11.433792 IP 112.26.2.1.46615 > 112.26.2.8.43407: Flags [.], seq 362713:364141, ack 1, win 4017, options [nop,nop,TS val 140736 ecr 4294893895,mptcp dss ack 2843715367 seq 3759782361 subseq 362713 len 1428 csum 0x6fa1], length 1428
10:30:11.507284 IP 112.26.2.1.46615 > 112.26.2.8.43407: Flags [.], seq 364141:365569, ack 1, win 4017, options [nop,nop,TS val 140736 ecr 4294893895,mptcp dss ack 2843715367 seq 3759783789 subseq 364141 len 1428 csum 0xf8b0], length 1428
10:30:11.507466 IP 112.26.2.1.46615 > 112.26.2.8.43407: Flags [.], seq 364141:365569, ack 1, win 4017, options [nop,nop,TS val 140736 ecr 4294893895,mptcp dss ack 2843715367 seq 3759783789 subseq 364141 len 1428 csum 0xf8b0], length 1428
10:30:11.525921 IP 112.26.2.8.43407 > 112.26.2.1.46615: Flags [.], ack 358429, win 24331, options [nop,nop,TS val 4294895467 ecr 140126,nop,nop,sack 1 {359857:364141},mptcp dss ack 3759730953], length 0
10:30:11.526108 IP 112.26.2.8.43407 > 112.26.2.1.46615: Flags [.], ack 358429, win 24331, options [nop,nop,TS val 4294895467 ecr 140126,nop,nop,sack 1 {359857:364141},mptcp dss ack 3759730953], length 0
10:30:11.604507 IP 112.26.2.1.46615 > 112.26.2.8.43407: Flags [.], seq 365569:366997, ack 1, win 4017, options [nop,nop,TS val 141030 ecr 4294894066,mptcp dss ack 2843715367 seq 3759788073 subseq 365569 len 1428 csum 0xcbce], length 1428
10:30:11.604727 IP 112.26.2.1.46615 > 112.26.2.8.43407: Flags [.], seq 365569:366997, ack 1, win 4017, options [nop,nop,TS val 141030 ecr 4294894066,mptcp dss ack 2843715367 seq 3759788073 subseq 365569 len 1428 csum 0xcbce], length 1428
10:30:11.629631 IP 112.26.2.8.43407 > 112.26.2.1.46615: Flags [.], ack 358429, win 24331, options [nop,nop,TS val 4294895507 ecr 140126,nop,nop,sack 1 {359857:365569},mptcp dss ack 3759730953], length 0
10:30:11.629838 IP 112.26.2.8.43407 > 112.26.2.1.46615: Flags [.], ack 358429, win 24331, options [nop,nop,TS val 4294895507 ecr 140126,nop,nop,sack 1 {359857:365569},mptcp dss ack 3759730953], length 0
10:30:11.658531 IP 112.26.2.8.43407 > 112.26.2.1.46615: Flags [.], ack 357001, win 24383, options [nop,nop,TS val 4294894767 ecr 140126,mptcp dss ack 3759712389], length 0
10:30:11.739393 IP 112.26.2.8.43407 > 112.26.2.1.46615: Flags [.], ack 358429, win 24331, options [nop,nop,TS val 4294895683 ecr 140126,nop,nop,sack 1 {359857:366997},mptcp dss ack 3759730953], length 0
10:30:11.739613 IP 112.26.2.8.43407 > 112.26.2.1.46615: Flags [.], ack 358429, win 24331, options [nop,nop,TS val 4294895683 ecr 140126,nop,nop,sack 1 {359857:366997},mptcp dss ack 3759730953], length 0
10:30:11.758952 IP 112.26.2.8.43407 > 112.26.2.1.46615: Flags [.], ack 358429, win 24383, options [nop,nop,TS val 4294894841 ecr 140126,mptcp dss ack 3759712389], length 0
10:30:11.831793 IP 112.26.2.1.46615 > 112.26.2.8.43407: Flags [.], seq 368425:369853, ack 1, win 4017, options [nop,nop,TS val 141221 ecr 4294894244,mptcp dss ack 2843715367 seq 3759800925 subseq 368425 len 1428 csum 0xfd7b], length 1428
10:30:11.831977 IP 112.26.2.1.46615 > 112.26.2.8.43407: Flags [.], seq 368425:369853, ack 1, win 4017, options [nop,nop,TS val 141221 ecr 4294894244,mptcp dss ack 2843715367 seq 3759800925 subseq 368425 len 1428 csum 0xfd7b], length 1428
10:30:11.913216 IP 112.26.2.1.46615 > 112.26.2.8.43407: Flags [.], seq 369853:371281, ack 1, win 4017, options [nop,nop,TS val 141312 ecr 4294894358,mptcp dss ack 2843715367 seq 3759802353 subseq 369853 len 1428 csum 0xba35], length 1428
10:30:11.913410 IP 112.26.2.1.46615 > 112.26.2.8.43407: Flags [.], seq 369853:371281, ack 1, win 4017, options [nop,nop,TS val 141312 ecr 4294894358,mptcp dss ack 2843715367 seq 3759802353 subseq 369853 len 1428 csum 0xba35], length 1428
10:30:11.960686 IP 112.26.2.8.43407 > 112.26.2.1.46615: Flags [.], ack 358429, win 24331, options [nop,nop,TS val 4294895904 ecr 140126,nop,nop,sack 2 {368425:369853}{359857:366997},mptcp dss ack 3759730953], length 0
10:30:11.960892 IP 112.26.2.8.43407 > 112.26.2.1.46615: Flags [.], ack 358429, win 24331, options [nop,nop,TS val 4294895904 ecr 140126,nop,nop,sack 2 {368425:369853}{359857:366997},mptcp dss ack 3759730953], length 0
10:30:11.981410 IP 112.26.2.8.43407 > 112.26.2.1.46615: Flags [.], ack 358429, win 24383, options [nop,nop,TS val 4294895105 ecr 140126,nop,nop,sack 1 {359857:361285},mptcp dss ack 3759712389], length 0
10:30:12.061640 IP 112.26.2.8.43407 > 112.26.2.1.46615: Flags [.], ack 358429, win 24331, options [nop,nop,TS val 4294896004 ecr 140126,nop,nop,sack 2 {368425:371281}{359857:366997},mptcp dss ack 3759730953], length 0
10:30:12.061850 IP 112.26.2.8.43407 > 112.26.2.1.46615: Flags [.], ack 358429, win 24331, options [nop,nop,TS val 4294896004 ecr 140126,nop,nop,sack 2 {368425:371281}{359857:366997},mptcp dss ack 3759730953], length 0
10:30:12.083587 IP 112.26.2.8.43407 > 112.26.2.1.46615: Flags [.], ack 358429, win 24383, options [nop,nop,TS val 4294895307 ecr 140126,nop,nop,sack 1 {359857:362713},mptcp dss ack 3759712389], length 0
10:30:12.153271 IP 112.26.2.1.46615 > 112.26.2.8.43407: Flags [.], seq 372709:374137, ack 1, win 4017, options [nop,nop,TS val 141777 ecr 4294894767,mptcp dss ack 2843715367 seq 3759832341 subseq 372709 len 1428 csum 0x10b6], length 1428
10:30:12.153452 IP 112.26.2.1.46615 > 112.26.2.8.43407: Flags [.], seq 372709:374137, ack 1, win 4017, options [nop,nop,TS val 141777 ecr 4294894767,mptcp dss ack 2843715367 seq 3759832341 subseq 372709 len 1428 csum 0x10b6], length 1428
10:30:12.219017 IP 112.26.2.8.43407 > 112.26.2.1.46615: Flags [.], ack 358429, win 24331, options [nop,nop,TS val 4294895467 ecr 140126,nop,nop,sack 1 {359857:364141},mptcp dss ack 3759730953], length 0
10:30:12.312446 IP 112.26.2.8.43407 > 112.26.2.1.46615: Flags [.], ack 358429, win 24190, options [nop,nop,TS val 4294896256 ecr 140126,nop,nop,sack 2 {372709:374137}{368425:371281},mptcp dss ack 3759745233], length 0
10:30:12.312672 IP 112.26.2.8.43407 > 112.26.2.1.46615: Flags [.], ack 358429, win 24190, options [nop,nop,TS val 4294896256 ecr 140126,nop,nop,sack 2 {372709:374137}{368425:371281},mptcp dss ack 3759745233], length 0
10:30:12.335472 IP 112.26.2.1.46615 > 112.26.2.8.43407: Flags [.], seq 374137:375565, ack 1, win 4017, options [nop,nop,TS val 141777 ecr 4294894767,mptcp dss ack 2843715367 seq 3759833769 subseq 374137 len 1428 csum 0x75a5], length 1428
10:30:12.335667 IP 112.26.2.1.46615 > 112.26.2.8.43407: Flags [.], seq 374137:375565, ack 1, win 4017, options [nop,nop,TS val 141777 ecr 4294894767,mptcp dss ack 2843715367 seq 3759833769 subseq 374137 len 1428 csum 0x75a5], length 1428
10:30:12.416242 IP 112.26.2.8.43407 > 112.26.2.1.46615: Flags [.], ack 358429, win 24331, options [nop,nop,TS val 4294895507 ecr 140126,nop,nop,sack 1 {359857:365569},mptcp dss ack 3759730953], length 0
10:30:12.495528 IP 112.26.2.1.46615 > 112.26.2.8.43407: Flags [.], seq 375565:376993, ack 1, win 4017, options [nop,nop,TS val 141877 ecr 4294894841,mptcp dss ack 2843715367 seq 3759838053 subseq 375565 len 1428 csum 0x197c], length 1428
10:30:12.495728 IP 112.26.2.1.46615 > 112.26.2.8.43407: Flags [.], seq 375565:376993, ack 1, win 4017, options [nop,nop,TS val 141877 ecr 4294894841,mptcp dss ack 2843715367 seq 3759838053 subseq 375565 len 1428 csum 0x197c], length 1428
10:30:12.556130 IP 112.26.2.8.43407 > 112.26.2.1.46615: Flags [.], ack 358429, win 24190, options [nop,nop,TS val 4294896500 ecr 140126,nop,nop,sack 2 {372709:375565}{368425:371281},mptcp dss ack 3759745233], length 0
10:30:12.556269 IP 112.26.2.8.43407 > 112.26.2.1.46615: Flags [.], ack 358429, win 24190, options [nop,nop,TS val 4294896500 ecr 140126,nop,nop,sack 2 {372709:375565}{368425:371281},mptcp dss ack 3759745233], length 0
10:30:12.584319 IP 112.26.2.8.43407 > 112.26.2.1.46615: Flags [.], ack 358429, win 24331, options [nop,nop,TS val 4294895683 ecr 140126,nop,nop,sack 1 {359857:366997},mptcp dss ack 3759730953], length 0
10:30:12.633318 IP 112.26.2.1.46615 > 112.26.2.8.43407: Flags [.], seq 376993:378421, ack 1, win 4017, options [nop,nop,TS val 142109 ecr 4294895105,mptcp dss ack 2843715367 seq 3759846621 subseq 376993 len 1428 csum 0x995a], length 1428
10:30:12.633459 IP 112.26.2.1.46615 > 112.26.2.8.43407: Flags [.], seq 376993:378421, ack 1, win 4017, options [nop,nop,TS val 142109 ecr 4294895105,mptcp dss ack 2843715367 seq 3759846621 subseq 376993 len 1428 csum 0x995a], length 1428
10:30:12.662617 IP 112.26.2.8.43407 > 112.26.2.1.46615: Flags [.], ack 358429, win 24190, options [nop,nop,TS val 4294896606 ecr 140126,nop,nop,sack 2 {372709:376993}{368425:371281},mptcp dss ack 3759745233], length 0
10:30:12.662776 IP 112.26.2.8.43407 > 112.26.2.1.46615: Flags [.], ack 358429, win 24190, options [nop,nop,TS val 4294896606 ecr 140126,nop,nop,sack 2 {372709:376993}{368425:371281},mptcp dss ack 3759745233], length 0
10:30:12.715845 IP 112.26.2.8.43407 > 112.26.2.1.46615: Flags [.], ack 358429, win 24331, options [nop,nop,TS val 4294895904 ecr 140126,nop,nop,sack 2 {368425:369853}{359857:366997},mptcp dss ack 3759730953], length 0
10:30:12.766582 IP 112.26.2.1.46615 > 112.26.2.8.43407: Flags [.], seq 378421:379849, ack 1, win 4017, options [nop,nop,TS val 142264 ecr 4294895307,mptcp dss ack 2843715367 seq 3759849477 subseq 378421 len 1428 csum 0xdb39], length 1428
10:30:12.766752 IP 112.26.2.1.46615 > 112.26.2.8.43407: Flags [.], seq 378421:379849, ack 1, win 4017, options [nop,nop,TS val 142264 ecr 4294895307,mptcp dss ack 2843715367 seq 3759849477 subseq 378421 len 1428 csum 0xdb39], length 1428
10:30:12.795108 IP 112.26.2.8.43407 > 112.26.2.1.46615: Flags [.], ack 358429, win 24190, options [nop,nop,TS val 4294896738 ecr 140126,nop,nop,sack 2 {372709:378421}{368425:371281},mptcp dss ack 3759745233], length 0
10:30:12.795345 IP 112.26.2.8.43407 > 112.26.2.1.46615: Flags [.], ack 358429, win 24190, options [nop,nop,TS val 4294896738 ecr 140126,nop,nop,sack 2 {372709:378421}{368425:371281},mptcp dss ack 3759745233], length 0
10:30:12.821256 IP 112.26.2.8.43407 > 112.26.2.1.46615: Flags [.], ack 358429, win 24331, options [nop,nop,TS val 4294896004 ecr 140126,nop,nop,sack 2 {368425:371281}{359857:366997},mptcp dss ack 3759730953], length 0
10:30:12.898298 IP 112.26.2.1.46615 > 112.26.2.8.43407: Flags [.], seq 358429:359857, ack 1, win 4017, options [nop,nop,TS val 142337 ecr 4294895467,mptcp dss ack 2843715367 seq 3759762369 subseq 358429 len 1428 csum 0x887e], length 1428
10:30:12.898482 IP 112.26.2.1.46615 > 112.26.2.8.43407: Flags [.], seq 358429:359857, ack 1, win 4017, options [nop,nop,TS val 142337 ecr 4294895467,mptcp dss ack 2843715367 seq 3759762369 subseq 358429 len 1428 csum 0x887e], length 1428
10:30:12.935629 IP 112.26.2.8.43407 > 112.26.2.1.46615: Flags [.], ack 358429, win 24190, options [nop,nop,TS val 4294896879 ecr 140126,nop,nop,sack 2 {372709:379849}{368425:371281},mptcp dss ack 3759745233], length 0
10:30:12.935844 IP 112.26.2.8.43407 > 112.26.2.1.46615: Flags [.], ack 358429, win 24190, options [nop,nop,TS val 4294896879 ecr 140126,nop,nop,sack 2 {372709:379849}{368425:371281},mptcp dss ack 3759745233], length 0
10:30:13.030166 IP 112.26.2.8.43407 > 112.26.2.1.46615: Flags [.], ack 358429, win 24190, options [nop,nop,TS val 4294896256 ecr 140126,nop,nop,sack 2 {372709:374137}{368425:371281},mptcp dss ack 3759745233], length 0
10:30:13.072093 IP 112.26.2.8.43407 > 112.26.2.1.46615: Flags [.], ack 366997, win 24107, options [nop,nop,TS val 4294897016 ecr 142337,nop,nop,sack 2 {372709:379849}{368425:371281},mptcp dss ack 3759776649], length 0
10:30:13.072304 IP 112.26.2.8.43407 > 112.26.2.1.46615: Flags [.], ack 366997, win 24107, options [nop,nop,TS val 4294897016 ecr 142337,nop,nop,sack 2 {372709:379849}{368425:371281},mptcp dss ack 3759776649], length 0
10:30:13.144108 IP 112.26.2.1.46615 > 112.26.2.8.43407: Flags [.], seq 379849:381277, ack 1, win 4017, options [nop,nop,TS val 142587 ecr 4294895507,mptcp dss ack 2843715367 seq 3759859473 subseq 379849 len 1428 csum 0xe784], length 1428
10:30:13.144388 IP 112.26.2.1.46615 > 112.26.2.8.43407: Flags [.], seq 379849:381277, ack 1, win 4017, options [nop,nop,TS val 142587 ecr 4294895507,mptcp dss ack 2843715367 seq 3759859473 subseq 379849 len 1428 csum 0xe784], length 1428
10:30:13.208716 IP 112.26.2.1.46615 > 112.26.2.8.43407: Flags [.], seq 381277:382705, ack 1, win 4017, options [nop,nop,TS val 142769 ecr 4294895683,mptcp dss ack 2843715367 seq 3759863757 subseq 381277 len 1428 csum 0xf728], length 1428
10:30:13.208932 IP 112.26.2.1.46615 > 112.26.2.8.43407: Flags [.], seq 381277:382705, ack 1, win 4017, options [nop,nop,TS val 142769 ecr 4294895683,mptcp dss ack 2843715367 seq 3759863757 subseq 381277 len 1428 csum 0xf728], length 1428
10:30:13.301432 IP 112.26.2.8.43407 > 112.26.2.1.46615: Flags [.], ack 358429, win 24190, options [nop,nop,TS val 4294896500 ecr 140126,nop,nop,sack 2 {372709:375565}{368425:371281},mptcp dss ack 3759745233], length 0
10:30:13.325995 IP 112.26.2.8.43407 > 112.26.2.1.46615: Flags [.], ack 366997, win 24265, options [nop,nop,TS val 4294897267 ecr 142337,nop,nop,sack 2 {372709:381277}{368425:371281},mptcp dss ack 3759776649], length 0
10:30:13.326215 IP 112.26.2.8.43407 > 112.26.2.1.46615: Flags [.], ack 366997, win 24265, options [nop,nop,TS val 4294897267 ecr 142337,nop,nop,sack 2 {372709:381277}{368425:371281},mptcp dss ack 3759776649], length 0
10:30:13.390604 IP 112.26.2.8.43407 > 112.26.2.1.46615: Flags [.], ack 358429, win 24190, options [nop,nop,TS val 4294896606 ecr 140126,nop,nop,sack 2 {372709:376993}{368425:371281},mptcp dss ack 3759745233], length 0
10:30:13.407376 IP 112.26.2.8.43407 > 112.26.2.1.46615: Flags [.], ack 366997, win 24265, options [nop,nop,TS val 4294897319 ecr 142337,nop,nop,sack 2 {372709:382705}{368425:371281},mptcp dss ack 3759776649], length 0
10:30:13.407601 IP 112.26.2.8.43407 > 112.26.2.1.46615: Flags [.], ack 366997, win 24265, options [nop,nop,TS val 4294897319 ecr 142337,nop,nop,sack 2 {372709:382705}{368425:371281},mptcp dss ack 3759776649], length 0
10:30:13.462986 IP 112.26.2.8.43407 > 112.26.2.1.46615: Flags [.], ack 358429, win 24190, options [nop,nop,TS val 4294896738 ecr 140126,nop,nop,sack 2 {372709:378421}{368425:371281},mptcp dss ack 3759745233], length 0
10:30:13.509521 IP 112.26.2.1.46615 > 112.26.2.8.43407: Flags [.], seq 366997:368425, ack 1, win 4017, options [nop,nop,TS val 143148 ecr 4294896256,mptcp dss ack 2843715367 seq 3759789501 subseq 366997 len 1428 csum 0xe869], length 1428
10:30:13.509679 IP 112.26.2.1.46615 > 112.26.2.8.43407: Flags [.], seq 366997:368425, ack 1, win 4017, options [nop,nop,TS val 143148 ecr 4294896256,mptcp dss ack 2843715367 seq 3759789501 subseq 366997 len 1428 csum 0xe869], length 1428
10:30:13.556454 IP 112.26.2.8.43407 > 112.26.2.1.46615: Flags [.], ack 371281, win 24265, options [nop,nop,TS val 4294897500 ecr 143148,nop,nop,sack 1 {372709:382705},mptcp dss ack 3759776649], length 0
10:30:13.556606 IP 112.26.2.8.43407 > 112.26.2.1.46615: Flags [.], ack 371281, win 24265, options [nop,nop,TS val 4294897500 ecr 143148,nop,nop,sack 1 {372709:382705},mptcp dss ack 3759776649], length 0
10:30:13.570366 IP 112.26.2.8.43407 > 112.26.2.1.46615: Flags [.], ack 358429, win 24190, options [nop,nop,TS val 4294896879 ecr 140126,nop,nop,sack 2 {372709:379849}{368425:371281},mptcp dss ack 3759745233], length 0
10:30:13.672579 IP 112.26.2.8.43407 > 112.26.2.1.46615: Flags [.], ack 366997, win 24107, options [nop,nop,TS val 4294897016 ecr 142337,nop,nop,sack 2 {372709:379849}{368425:371281},mptcp dss ack 3759776649], length 0
10:30:13.705401 IP 112.26.2.1.46615 > 112.26.2.8.43407: Flags [.], seq 371281:372709, ack 1, win 4017, options [nop,nop,TS val 143419 ecr 4294896500,mptcp dss ack 2843715367 seq 3759808065 subseq 371281 len 1428 csum 0x3453], length 1428
10:30:13.705608 IP 112.26.2.1.46615 > 112.26.2.8.43407: Flags [.], seq 371281:372709, ack 1, win 4017, options [nop,nop,TS val 143419 ecr 4294896500,mptcp dss ack 2843715367 seq 3759808065 subseq 371281 len 1428 csum 0x3453], length 1428
10:30:13.736277 IP 112.26.2.8.43407 > 112.26.2.1.46615: Flags [.], ack 382705, win 24161, options [nop,nop,TS val 4294897679 ecr 143419,mptcp dss ack 3759822345], length 0
10:30:13.736480 IP 112.26.2.8.43407 > 112.26.2.1.46615: Flags [.], ack 382705, win 24161, options [nop,nop,TS val 4294897679 ecr 143419,mptcp dss ack 3759822345], length 0
10:30:13.844871 IP 112.26.2.1.46615 > 112.26.2.8.43407: Flags [.], seq 382705:384133, ack 1, win 4017, options [nop,nop,TS val 143531 ecr 4294896606,mptcp dss ack 2843715367 seq 3759888033 subseq 382705 len 1428 csum 0x8ea5], length 1428
10:30:13.845093 IP 112.26.2.1.46615 > 112.26.2.8.43407: Flags [.], seq 382705:384133, ack 1, win 4017, options [nop,nop,TS val 143531 ecr 4294896606,mptcp dss ack 2843715367 seq 3759888033 subseq 382705 len 1428 csum 0x8ea5], length 1428
10:30:13.876727 IP 112.26.2.8.43407 > 112.26.2.1.46615: Flags [.], ack 384133, win 24239, options [nop,nop,TS val 4294897819 ecr 143531,mptcp dss ack 3759825201], length 0
10:30:13.876927 IP 112.26.2.8.43407 > 112.26.2.1.46615: Flags [.], ack 384133, win 24239, options [nop,nop,TS val 4294897819 ecr 143531,mptcp dss ack 3759825201], length 0
10:30:13.931126 IP 112.26.2.8.43407 > 112.26.2.1.46615: Flags [.], ack 366997, win 24265, options [nop,nop,TS val 4294897267 ecr 142337,nop,nop,sack 2 {372709:381277}{368425:371281},mptcp dss ack 3759776649], length 0
10:30:13.973791 IP 112.26.2.1.46615 > 112.26.2.8.43407: Flags [.], seq 384133:385561, ack 1, win 4017, options [nop,nop,TS val 143624 ecr 4294896738,mptcp dss ack 2843715367 seq 3759892317 subseq 384133 len 1428 csum 0xa0ca], length 1428
10:30:13.973984 IP 112.26.2.1.46615 > 112.26.2.8.43407: Flags [.], seq 384133:385561, ack 1, win 4017, options [nop,nop,TS val 143624 ecr 4294896738,mptcp dss ack 2843715367 seq 3759892317 subseq 384133 len 1428 csum 0xa0ca], length 1428
10:30:14.006871 IP 112.26.2.8.43407 > 112.26.2.1.46615: Flags [.], ack 385561, win 24239, options [nop,nop,TS val 4294897945 ecr 143624,mptcp dss ack 3759825201], length 0
10:30:14.007082 IP 112.26.2.8.43407 > 112.26.2.1.46615: Flags [.], ack 385561, win 24239, options [nop,nop,TS val 4294897945 ecr 143624,mptcp dss ack 3759825201], length 0
10:30:14.092117 IP 112.26.2.8.43407 > 112.26.2.1.46615: Flags [.], ack 366997, win 24265, options [nop,nop,TS val 4294897319 ecr 142337,nop,nop,sack 2 {372709:382705}{368425:371281},mptcp dss ack 3759776649], length 0
10:30:14.131691 IP 112.26.2.1.46615 > 112.26.2.8.43407: Flags [.], seq 385561:386989, ack 1, win 4017, options [nop,nop,TS val 143736 ecr 4294896879,mptcp dss ack 2843715367 seq 3759893745 subseq 385561 len 1428 csum 0xddfd], length 1428
10:30:14.131847 IP 112.26.2.1.46615 > 112.26.2.8.43407: Flags [.], seq 385561:386989, ack 1, win 4017, options [nop,nop,TS val 143736 ecr 4294896879,mptcp dss ack 2843715367 seq 3759893745 subseq 385561 len 1428 csum 0xddfd], length 1428
10:30:14.138452 IP 112.26.2.8.43407 > 112.26.2.1.46615: Flags [.], ack 386989, win 24239, options [nop,nop,TS val 4294898081 ecr 143736,mptcp dss ack 3759825201], length 0
10:30:14.138597 IP 112.26.2.8.43407 > 112.26.2.1.46615: Flags [.], ack 386989, win 24239, options [nop,nop,TS val 4294898081 ecr 143736,mptcp dss ack 3759825201], length 0
10:30:14.244771 IP 112.26.2.8.43407 > 112.26.2.1.46615: Flags [.], ack 371281, win 24265, options [nop,nop,TS val 4294897500 ecr 143148,nop,nop,sack 1 {372709:382705},mptcp dss ack 3759776649], length 0
10:30:14.326550 IP 112.26.2.1.46615 > 112.26.2.8.43407: Flags [.], seq 386989:388417, ack 1, win 4017, options [nop,nop,TS val 143791 ecr 4294897016,mptcp dss ack 2843715367 seq 3759898029 subseq 386989 len 1428 csum 0xb3c8], length 1428
10:30:14.326752 IP 112.26.2.1.46615 > 112.26.2.8.43407: Flags [.], seq 386989:388417, ack 1, win 4017, options [nop,nop,TS val 143791 ecr 4294897016,mptcp dss ack 2843715367 seq 3759898029 subseq 386989 len 1428 csum 0xb3c8], length 1428
10:30:14.336318 IP 112.26.2.8.43407 > 112.26.2.1.46615: Flags [.], ack 388417, win 24239, options [nop,nop,TS val 4294898280 ecr 143791,mptcp dss ack 3759825201], length 0
10:30:14.336508 IP 112.26.2.8.43407 > 112.26.2.1.46615: Flags [.], ack 388417, win 24239, options [nop,nop,TS val 4294898280 ecr 143791,mptcp dss ack 3759825201], length 0
10:30:14.417129 IP 112.26.2.1.46615 > 112.26.2.8.43407: Flags [.], seq 388417:389845, ack 1, win 4017, options [nop,nop,TS val 143791 ecr 4294897016,mptcp dss ack 2843715367 seq 3759899457 subseq 388417 len 1428 csum 0x36fc], length 1428
10:30:14.417350 IP 112.26.2.1.46615 > 112.26.2.8.43407: Flags [.], seq 388417:389845, ack 1, win 4017, options [nop,nop,TS val 143791 ecr 4294897016,mptcp dss ack 2843715367 seq 3759899457 subseq 388417 len 1428 csum 0x36fc], length 1428
10:30:14.482143 IP 112.26.2.8.43407 > 112.26.2.1.46615: Flags [.], ack 382705, win 24161, options [nop,nop,TS val 4294897679 ecr 143419,mptcp dss ack 3759822345], length 0
10:30:14.503343 IP 112.26.2.8.43407 > 112.26.2.1.46615: Flags [.], ack 389845, win 24048, options [nop,nop,TS val 4294898446 ecr 143791,mptcp dss ack 3759853761], length 0
10:30:14.503524 IP 112.26.2.8.43407 > 112.26.2.1.46615: Flags [.], ack 389845, win 24048, options [nop,nop,TS val 4294898446 ecr 143791,mptcp dss ack 3759853761], length 0
10:30:14.576783 IP 112.26.2.8.43407 > 112.26.2.1.46615: Flags [.], ack 384133, win 24239, options [nop,nop,TS val 4294897819 ecr 143531,mptcp dss ack 3759825201], length 0
10:30:14.615387 IP 112.26.2.1.46615 > 112.26.2.8.43407: Flags [.], seq 389845:391273, ack 1, win 4017, options [nop,nop,TS val 144109 ecr 4294897267,mptcp dss ack 2843715367 seq 3759903741 subseq 389845 len 1428 csum 0x6044], length 1428
10:30:14.615620 IP 112.26.2.1.46615 > 112.26.2.8.43407: Flags [.], seq 389845:391273, ack 1, win 4017, options [nop,nop,TS val 144109 ecr 4294897267,mptcp dss ack 2843715367 seq 3759903741 subseq 389845 len 1428 csum 0x6044], length 1428
10:30:14.648385 IP 112.26.2.8.43407 > 112.26.2.1.46615: Flags [.], ack 391273, win 24048, options [nop,nop,TS val 4294898592 ecr 144109,mptcp dss ack 3759853761], length 0
10:30:14.648608 IP 112.26.2.8.43407 > 112.26.2.1.46615: Flags [.], ack 391273, win 24048, options [nop,nop,TS val 4294898592 ecr 144109,mptcp dss ack 3759853761], length 0
10:30:14.714350 IP 112.26.2.8.43407 > 112.26.2.1.46615: Flags [.], ack 385561, win 24239, options [nop,nop,TS val 4294897945 ecr 143624,mptcp dss ack 3759825201], length 0
10:30:14.795269 IP 112.26.2.1.46615 > 112.26.2.8.43407: Flags [.], seq 391273:392701, ack 1, win 4017, options [nop,nop,TS val 144237 ecr 4294897319,mptcp dss ack 2843715367 seq 3759910881 subseq 391273 len 1428 csum 0xa269], length 1428
10:30:14.795481 IP 112.26.2.1.46615 > 112.26.2.8.43407: Flags [.], seq 391273:392701, ack 1, win 4017, options [nop,nop,TS val 144237 ecr 4294897319,mptcp dss ack 2843715367 seq 3759910881 subseq 391273 len 1428 csum 0xa269], length 1428
10:30:14.858956 IP 112.26.2.8.43407 > 112.26.2.1.46615: Flags [.], ack 392701, win 24048, options [nop,nop,TS val 4294898756 ecr 144237,mptcp dss ack 3759853761], length 0
10:30:14.859172 IP 112.26.2.8.43407 > 112.26.2.1.46615: Flags [.], ack 392701, win 24048, options [nop,nop,TS val 4294898756 ecr 144237,mptcp dss ack 3759853761], length 0
10:30:14.868276 IP 112.26.2.8.43407 > 112.26.2.1.46615: Flags [.], ack 386989, win 24239, options [nop,nop,TS val 4294898081 ecr 143736,mptcp dss ack 3759825201], length 0
10:30:14.962812 IP 112.26.2.1.46615 > 112.26.2.8.43407: Flags [.], seq 392701:394129, ack 1, win 4017, options [nop,nop,TS val 144363 ecr 4294897500,mptcp dss ack 2843715367 seq 3759920877 subseq 392701 len 1428 csum 0x2f6c], length 1428
10:30:14.963026 IP 112.26.2.1.46615 > 112.26.2.8.43407: Flags [.], seq 392701:394129, ack 1, win 4017, options [nop,nop,TS val 144363 ecr 4294897500,mptcp dss ack 2843715367 seq 3759920877 subseq 392701 len 1428 csum 0x2f6c], length 1428
10:30:14.968363 IP 112.26.2.8.43407 > 112.26.2.1.46615: Flags [.], ack 394129, win 24048, options [nop,nop,TS val 4294898912 ecr 144363,mptcp dss ack 3759853761], length 0
10:30:14.968586 IP 112.26.2.8.43407 > 112.26.2.1.46615: Flags [.], ack 394129, win 24048, options [nop,nop,TS val 4294898912 ecr 144363,mptcp dss ack 3759853761], length 0
10:30:15.026189 IP 112.26.2.8.43407 > 112.26.2.1.46615: Flags [.], ack 388417, win 24239, options [nop,nop,TS val 4294898280 ecr 143791,mptcp dss ack 3759825201], length 0
10:30:15.107011 IP 112.26.2.1.46615 > 112.26.2.8.43407: Flags [.], seq 394129:395557, ack 1, win 4017, options [nop,nop,TS val 144600 ecr 4294897679,mptcp dss ack 2843715367 seq 3759929445 subseq 394129 len 1428 csum 0x403c], length 1428
10:30:15.107187 IP 112.26.2.1.46615 > 112.26.2.8.43407: Flags [.], seq 394129:395557, ack 1, win 4017, options [nop,nop,TS val 144600 ecr 4294897679,mptcp dss ack 2843715367 seq 3759929445 subseq 394129 len 1428 csum 0x403c], length 1428
