10:29:33.259126 IP 112.26.3.8.40113 > 112.26.3.1.46615: Flags [S], seq 2110223229, win 65535, options [mss 1460,sackOK,TS val 4294857066 ecr 0,nop,wscale 6,mptcp join id 6 token 0x9485611f nonce 0xe9dd8d1b], length 0
10:29:33.312507 IP 112.26.3.1.46615 > 112.26.3.8.40113: Flags [S.], seq 149559822, ack 2110223230, win 65535, options [mss 1460,sackOK,TS val 103377 ecr 4294857066,nop,wscale 6,mptcp join id 5 hmac 0x89c8395052e86075 nonce 0x2b29489b], length 0
10:29:33.495885 IP 112.26.3.1.46615 > 112.26.3.8.40113: Flags [S.], seq 149559822, ack 2110223230, win 65535, options [mss 1460,sackOK,TS val 103377 ecr 4294857066,nop,wscale 6,mptcp join id 5 hmac 0x89c8395052e86075 nonce 0x2b29489b], length 0
10:29:33.607461 IP 112.26.3.8.40113 > 112.26.3.1.46615: Flags [.], ack 1, win 7437, options [nop,nop,TS val 4294857441 ecr 103377,mptcp join hmac 0xe1569dd3d789e0842eb4539998398e150a4080a7], length 0
10:29:33.610116 IP 112.26.3.1.46615 > 112.26.3.8.40113: Flags [.], ack 1, win 4017, options [nop,nop,TS val 103725 ecr 4294857441,mptcp dss ack 2843715367], length 0
10:29:33.626352 IP 112.26.3.1.46615 > 112.26.3.8.40113: Flags [.], ack 1, win 4017, options [nop,nop,TS val 103725 ecr 4294857441,mptcp dss ack 2843715367], length 0
10:29:33.700152 IP 112.26.3.1.46615 > 112.26.3.8.40113: Flags [.], seq 1:1429, ack 1, win 4017, options [nop,nop,TS val 103753 ecr 4294857441,mptcp dss ack 2843715367 seq 3758242977 subseq 1 len 1428 csum 0xaf48], length 1428
10:30:05.177558 IP 112.26.3.1.46615 > 112.26.3.8.40113: Flags [.], seq 435541:436969, ack 1, win 4017, options [nop,nop,TS val 135194 ecr 4294889014,mptcp dss ack 2843715367 seq 3759522465 subseq 435541 len 1428 csum 0xd638], length 1428
10:30:05.191933 IP 112.26.3.1.46615 > 112.26.3.8.40113: Flags [.], seq 422689:424117, ack 1, win 4017, options [nop,nop,TS val 134377 ecr 4294888193,mptcp dss ack 2843715367 seq 3759479625 subseq 422689 len 1428 csum 0xd20d], length 1428
10:30:05.235502 IP 112.26.3.1.46615 > 112.26.3.8.40113: Flags [.], seq 436969:438397, ack 1, win 4017, options [nop,nop,TS val 135194 ecr 4294889014,mptcp dss ack 2843715367 seq 3759523893 subseq 436969 len 1428 csum 0x13a3], length 1428
10:30:05.254395 IP 112.26.3.1.46615 > 112.26.3.8.40113: Flags [.], seq 424117:425545, ack 1, win 4017, options [nop,nop,TS val 134598 ecr 4294888418,mptcp dss ack 2843715367 seq 3759488193 subseq 424117 len 1428 csum 0xd829], length 1428
10:30:05.291248 IP 112.26.3.1.46615 > 112.26.3.8.40113: Flags [.], seq 438397:439825, ack 1, win 4017, options [nop,nop,TS val 135194 ecr 4294889014,mptcp dss ack 2843715367 seq 3759525321 subseq 438397 len 1428 csum 0x9cfc], length 1428
10:30:05.333678 IP 112.26.3.1.46615 > 112.26.3.8.40113: Flags [.], seq 426973:428401, ack 1, win 4017, options [nop,nop,TS val 134747 ecr 4294888558,mptcp dss ack 2843715367 seq 3759493905 subseq 426973 len 1428 csum 0xb9f5], length 1428
10:30:05.355886 IP 112.26.3.8.40113 > 112.26.3.1.46615: Flags [.], ack 425545, win 23885, options [nop,nop,TS val 4294889279 ecr 134377,nop,nop,sack 1 {426973:428401},mptcp dss ack 3759388233], length 0
10:30:05.360598 IP 112.26.3.1.46615 > 112.26.3.8.40113: Flags [.], seq 439825:441253, ack 1, win 4017, options [nop,nop,TS val 135474 ecr 4294889279,mptcp dss ack 2843715367 seq 3759533889 subseq 439825 len 1428 csum 0x78e], length 1428
10:30:05.420180 IP 112.26.3.1.46615 > 112.26.3.8.40113: Flags [.], seq 441253:442681, ack 1, win 4017, options [nop,nop,TS val 135474 ecr 4294889279,mptcp dss ack 2843715367 seq 3759535317 subseq 441253 len 1428 csum 0xbbeb], length 1428
10:30:05.450878 IP 112.26.3.1.46615 > 112.26.3.8.40113: Flags [.], seq 428401:429829, ack 1, win 4017, options [nop,nop,TS val 134747 ecr 4294888558,mptcp dss ack 2843715367 seq 3759495333 subseq 428401 len 1428 csum 0xf799], length 1428
10:30:05.492886 IP 112.26.3.8.40113 > 112.26.3.1.46615: Flags [.], ack 425545, win 23885, options [nop,nop,TS val 4294889396 ecr 134377,nop,nop,sack 1 {426973:429829},mptcp dss ack 3759388233], length 0
10:30:05.511121 IP 112.26.3.1.46615 > 112.26.3.8.40113: Flags [.], seq 442681:444109, ack 1, win 4017, options [nop,nop,TS val 135474 ecr 4294889279,mptcp dss ack 2843715367 seq 3759536745 subseq 442681 len 1428 csum 0x5aad], length 1428
10:30:05.545207 IP 112.26.3.1.46615 > 112.26.3.8.40113: Flags [.], seq 431257:432685, ack 1, win 4017, options [nop,nop,TS val 134909 ecr 4294888727,mptcp dss ack 2843715367 seq 3759508185 subseq 431257 len 1428 csum 0x7ee2], length 1428
10:30:05.592636 IP 112.26.3.8.40113 > 112.26.3.1.46615: Flags [.], ack 425545, win 23885, options [nop,nop,TS val 4294889490 ecr 134377,nop,nop,sack 2 {431257:432685}{426973:429829},mptcp dss ack 3759388233], length 0
10:30:05.613870 IP 112.26.3.1.46615 > 112.26.3.8.40113: Flags [.], seq 444109:445537, ack 1, win 4017, options [nop,nop,TS val 135640 ecr 4294889396,mptcp dss ack 2843715367 seq 3759545313 subseq 444109 len 1428 csum 0xc93e], length 1428
10:30:05.641673 IP 112.26.3.1.46615 > 112.26.3.8.40113: Flags [.], seq 432685:434113, ack 1, win 4017, options [nop,nop,TS val 134909 ecr 4294888727,mptcp dss ack 2843715367 seq 3759509613 subseq 432685 len 1428 csum 0x1041], length 1428
10:30:05.678020 IP 112.26.3.8.40113 > 112.26.3.1.46615: Flags [.], ack 425545, win 23885, options [nop,nop,TS val 4294889586 ecr 134377,nop,nop,sack 2 {431257:434113}{426973:429829},mptcp dss ack 3759388233], length 0
10:30:05.737771 IP 112.26.3.1.46615 > 112.26.3.8.40113: Flags [.], seq 425545:426973, ack 1, win 4017, options [nop,nop,TS val 135711 ecr 4294889490,mptcp dss ack 2843715367 seq 3759489621 subseq 425545 len 1428 csum 0xaa74], length 1428
10:30:05.764743 IP 112.26.3.1.46615 > 112.26.3.8.40113: Flags [.], seq 434113:435541, ack 1, win 4017, options [nop,nop,TS val 135194 ecr 4294889014,mptcp dss ack 2843715367 seq 3759521037 subseq 434113 len 1428 csum 0xc4fb], length 1428
10:30:05.790329 IP 112.26.3.8.40113 > 112.26.3.1.46615: Flags [.], ack 425545, win 23712, options [nop,nop,TS val 4294889709 ecr 134377,nop,nop,sack 2 {431257:435541}{426973:429829},mptcp dss ack 3759422505], length 0
10:30:05.807999 IP 112.26.3.1.46615 > 112.26.3.8.40113: Flags [.], seq 429829:431257, ack 1, win 4017, options [nop,nop,TS val 135796 ecr 4294889586,mptcp dss ack 2843715367 seq 3759506757 subseq 429829 len 1428 csum 0xa03], length 1428
10:30:05.834413 IP 112.26.3.1.46615 > 112.26.3.8.40113: Flags [.], seq 435541:436969, ack 1, win 4017, options [nop,nop,TS val 135194 ecr 4294889014,mptcp dss ack 2843715367 seq 3759522465 subseq 435541 len 1428 csum 0xd638], length 1428
10:30:05.893777 IP 112.26.3.8.40113 > 112.26.3.1.46615: Flags [.], ack 425545, win 23712, options [nop,nop,TS val 4294889779 ecr 134377,nop,nop,sack 2 {431257:436969}{426973:429829},mptcp dss ack 3759422505], length 0
10:30:05.942074 IP 112.26.3.1.46615 > 112.26.3.8.40113: Flags [.], seq 436969:438397, ack 1, win 4017, options [nop,nop,TS val 135194 ecr 4294889014,mptcp dss ack 2843715367 seq 3759523893 subseq 436969 len 1428 csum 0x13a3], length 1428
10:30:05.993748 IP 112.26.3.8.40113 > 112.26.3.1.46615: Flags [.], ack 425545, win 23712, options [nop,nop,TS val 4294889887 ecr 134377,nop,nop,sack 2 {431257:438397}{426973:429829},mptcp dss ack 3759422505], length 0
10:30:05.999510 IP 112.26.3.1.46615 > 112.26.3.8.40113: Flags [.], seq 445537:446965, ack 1, win 4017, options [nop,nop,TS val 136116 ecr 4294889887,mptcp dss ack 2843715367 seq 3759566733 subseq 445537 len 1428 csum 0x1dee], length 1428
10:30:06.049821 IP 112.26.3.1.46615 > 112.26.3.8.40113: Flags [.], seq 438397:439825, ack 1, win 4017, options [nop,nop,TS val 135194 ecr 4294889014,mptcp dss ack 2843715367 seq 3759525321 subseq 438397 len 1428 csum 0x9cfc], length 1428
10:30:06.085527 IP 112.26.3.8.40113 > 112.26.3.1.46615: Flags [.], ack 425545, win 23712, options [nop,nop,TS val 4294889994 ecr 134377,nop,nop,sack 2 {431257:439825}{426973:429829},mptcp dss ack 3759422505], length 0
10:30:06.120269 IP 112.26.3.1.46615 > 112.26.3.8.40113: Flags [P.], seq 446965:448393, ack 1, win 4017, options [nop,nop,TS val 136228 ecr 4294889994,mptcp dss ack 2843715367 seq 3759569589 subseq 446965 len 1428 csum 0x7555], length 1428
10:30:06.152901 IP 112.26.3.1.46615 > 112.26.3.8.40113: Flags [.], seq 439825:441253, ack 1, win 4017, options [nop,nop,TS val 135474 ecr 4294889279,mptcp dss ack 2843715367 seq 3759533889 subseq 439825 len 1428 csum 0x78e], length 1428
10:30:06.214150 IP 112.26.3.8.40113 > 112.26.3.1.46615: Flags [.], ack 425545, win 23712, options [nop,nop,TS val 4294890098 ecr 134377,nop,nop,sack 2 {431257:441253}{426973:429829},mptcp dss ack 3759422505], length 0
10:30:06.253500 IP 112.26.3.1.46615 > 112.26.3.8.40113: Flags [.], seq 442681:444109, ack 1, win 4017, options [nop,nop,TS val 135474 ecr 4294889279,mptcp dss ack 2843715367 seq 3759536745 subseq 442681 len 1428 csum 0x5aad], length 1428
10:30:06.263018 IP 112.26.3.1.46615 > 112.26.3.8.40113: Flags [.], seq 448393:449821, ack 1, win 4017, options [nop,nop,TS val 136373 ecr 4294890098,mptcp dss ack 2843715367 seq 3759573873 subseq 448393 len 1428 csum 0x3bbb], length 1428
10:30:06.316556 IP 112.26.3.8.40113 > 112.26.3.1.46615: Flags [.], ack 425545, win 23712, options [nop,nop,TS val 4294890199 ecr 134377,nop,nop,sack 2 {442681:444109}{431257:441253},mptcp dss ack 3759422505], length 0
10:30:06.319464 IP 112.26.3.1.46615 > 112.26.3.8.40113: Flags [.], seq 441253:442681, ack 1, win 4017, options [nop,nop,TS val 136435 ecr 4294890199,mptcp dss ack 2843715367 seq 3759535317 subseq 441253 len 1428 csum 0xbbeb], length 1428
10:30:06.362239 IP 112.26.3.1.46615 > 112.26.3.8.40113: Flags [.], seq 444109:445537, ack 1, win 4017, options [nop,nop,TS val 135640 ecr 4294889396,mptcp dss ack 2843715367 seq 3759545313 subseq 444109 len 1428 csum 0xc93e], length 1428
10:30:06.411846 IP 112.26.3.1.46615 > 112.26.3.8.40113: Flags [.], seq 425545:426973, ack 1, win 4017, options [nop,nop,TS val 135711 ecr 4294889490,mptcp dss ack 2843715367 seq 3759489621 subseq 425545 len 1428 csum 0xaa74], length 1428
10:30:06.445448 IP 112.26.3.8.40113 > 112.26.3.1.46615: Flags [.], ack 425545, win 23712, options [nop,nop,TS val 4294890293 ecr 134377,nop,nop,sack 2 {442681:445537}{431257:441253},mptcp dss ack 3759422505], length 0
10:30:06.485602 IP 112.26.3.1.46615 > 112.26.3.8.40113: Flags [.], seq 449821:451249, ack 1, win 4017, options [nop,nop,TS val 136581 ecr 4294890293,mptcp dss ack 2843715367 seq 3759585297 subseq 449821 len 1428 csum 0xf464], length 1428
10:30:06.523390 IP 112.26.3.1.46615 > 112.26.3.8.40113: Flags [.], seq 429829:431257, ack 1, win 4017, options [nop,nop,TS val 135796 ecr 4294889586,mptcp dss ack 2843715367 seq 3759506757 subseq 429829 len 1428 csum 0xa03], length 1428
10:30:06.560667 IP 112.26.3.8.40113 > 112.26.3.1.46615: Flags [.], ack 429829, win 23712, options [nop,nop,TS val 4294890357 ecr 135711,nop,nop,sack 2 {442681:445537}{431257:441253},mptcp dss ack 3759422505], length 0
10:30:06.563625 IP 112.26.3.1.46615 > 112.26.3.8.40113: Flags [.], seq 451249:452677, ack 1, win 4017, options [nop,nop,TS val 136679 ecr 4294890357,mptcp dss ack 2843715367 seq 3759592437 subseq 451249 len 1428 csum 0x228a], length 1428
10:30:06.621590 IP 112.26.3.1.46615 > 112.26.3.8.40113: Flags [.], seq 445537:446965, ack 1, win 4017, options [nop,nop,TS val 136116 ecr 4294889887,mptcp dss ack 2843715367 seq 3759566733 subseq 445537 len 1428 csum 0x1dee], length 1428
10:30:06.687427 IP 112.26.3.8.40113 > 112.26.3.1.46615: Flags [.], ack 441253, win 23712, options [nop,nop,TS val 4294890468 ecr 135796,nop,nop,sack 1 {442681:445537},mptcp dss ack 3759422505], length 0
10:30:06.690646 IP 112.26.3.1.46615 > 112.26.3.8.40113: Flags [.], seq 452677:454105, ack 1, win 4017, options [nop,nop,TS val 136806 ecr 4294890468,mptcp dss ack 2843715367 seq 3759595293 subseq 452677 len 1428 csum 0xeef1], length 1428
10:30:06.740720 IP 112.26.3.1.46615 > 112.26.3.8.40113: Flags [P.], seq 446965:448393, ack 1, win 4017, options [nop,nop,TS val 136228 ecr 4294889994,mptcp dss ack 2843715367 seq 3759569589 subseq 446965 len 1428 csum 0x7555], length 1428
10:30:06.807066 IP 112.26.3.8.40113 > 112.26.3.1.46615: Flags [.], ack 441253, win 23712, options [nop,nop,TS val 4294890563 ecr 135796,nop,nop,sack 1 {442681:446965},mptcp dss ack 3759422505], length 0
10:30:06.837507 IP 112.26.3.1.46615 > 112.26.3.8.40113: Flags [.], seq 454105:455533, ack 1, win 4017, options [nop,nop,TS val 136950 ecr 4294890563,mptcp dss ack 2843715367 seq 3759596721 subseq 454105 len 1428 csum 0x9810], length 1428
10:30:06.867546 IP 112.26.3.1.46615 > 112.26.3.8.40113: Flags [.], seq 448393:449821, ack 1, win 4017, options [nop,nop,TS val 136373 ecr 4294890098,mptcp dss ack 2843715367 seq 3759573873 subseq 448393 len 1428 csum 0x3bbb], length 1428
10:30:06.913312 IP 112.26.3.8.40113 > 112.26.3.1.46615: Flags [.], ack 441253, win 23712, options [nop,nop,TS val 4294890686 ecr 135796,nop,nop,sack 1 {442681:448393},mptcp dss ack 3759422505], length 0
10:30:06.950964 IP 112.26.3.1.46615 > 112.26.3.8.40113: Flags [.], seq 455533:456961, ack 1, win 4017, options [nop,nop,TS val 137066 ecr 4294890686,mptcp dss ack 2843715367 seq 3759601005 subseq 455533 len 1428 csum 0x28f2], length 1428
10:30:06.967580 IP 112.26.3.1.46615 > 112.26.3.8.40113: Flags [.], seq 441253:442681, ack 1, win 4017, options [nop,nop,TS val 136435 ecr 4294890199,mptcp dss ack 2843715367 seq 3759535317 subseq 441253 len 1428 csum 0xbbeb], length 1428
10:30:06.998200 IP 112.26.3.8.40113 > 112.26.3.1.46615: Flags [.], ack 441253, win 24099, options [nop,nop,TS val 4294890812 ecr 135796,nop,nop,sack 1 {442681:449821},mptcp dss ack 3759503901], length 0
10:30:07.068907 IP 112.26.3.1.46615 > 112.26.3.8.40113: Flags [.], seq 456961:458389, ack 1, win 4017, options [nop,nop,TS val 137180 ecr 4294890812,mptcp dss ack 2843715367 seq 3759603861 subseq 456961 len 1428 csum 0xc49b], length 1428
10:30:07.094762 IP 112.26.3.1.46615 > 112.26.3.8.40113: Flags [.], seq 449821:451249, ack 1, win 4017, options [nop,nop,TS val 136581 ecr 4294890293,mptcp dss ack 2843715367 seq 3759585297 subseq 449821 len 1428 csum 0xf464], length 1428
10:30:07.098384 IP 112.26.3.8.40113 > 112.26.3.1.46615: Flags [.], ack 449821, win 24099, options [nop,nop,TS val 4294890912 ecr 136435,mptcp dss ack 3759503901], length 0
10:30:07.171867 IP 112.26.3.8.40113 > 112.26.3.1.46615: Flags [.], ack 451249, win 24099, options [nop,nop,TS val 4294891040 ecr 136581,mptcp dss ack 3759503901], length 0
10:30:07.190049 IP 112.26.3.1.46615 > 112.26.3.8.40113: Flags [.], seq 458389:459817, ack 1, win 4017, options [nop,nop,TS val 137217 ecr 4294890912,mptcp dss ack 2843715367 seq 3759605289 subseq 458389 len 1428 csum 0xff7b], length 1428
10:30:07.207697 IP 112.26.3.1.46615 > 112.26.3.8.40113: Flags [.], seq 451249:452677, ack 1, win 4017, options [nop,nop,TS val 136679 ecr 4294890357,mptcp dss ack 2843715367 seq 3759592437 subseq 451249 len 1428 csum 0x228a], length 1428
10:30:07.262993 IP 112.26.3.1.46615 > 112.26.3.8.40113: Flags [.], seq 459817:461245, ack 1, win 4017, options [nop,nop,TS val 137217 ecr 4294890912,mptcp dss ack 2843715367 seq 3759606717 subseq 459817 len 1428 csum 0xb3eb], length 1428
10:30:07.283594 IP 112.26.3.1.46615 > 112.26.3.8.40113: Flags [.], seq 452677:454105, ack 1, win 4017, options [nop,nop,TS val 136806 ecr 4294890468,mptcp dss ack 2843715367 seq 3759595293 subseq 452677 len 1428 csum 0xeef1], length 1428
10:30:07.293972 IP 112.26.3.8.40113 > 112.26.3.1.46615: Flags [.], ack 452677, win 24099, options [nop,nop,TS val 4294891149 ecr 136679,mptcp dss ack 3759503901], length 0
10:30:07.329990 IP 112.26.3.1.46615 > 112.26.3.8.40113: Flags [.], seq 461245:462673, ack 1, win 4017, options [nop,nop,TS val 137290 ecr 4294891040,mptcp dss ack 2843715367 seq 3759609573 subseq 461245 len 1428 csum 0x8cdf], length 1428
10:30:07.351471 IP 112.26.3.8.40113 > 112.26.3.1.46615: Flags [.], ack 454105, win 24099, options [nop,nop,TS val 4294891228 ecr 136806,mptcp dss ack 3759503901], length 0
10:30:07.408770 IP 112.26.3.1.46615 > 112.26.3.8.40113: Flags [.], seq 454105:455533, ack 1, win 4017, options [nop,nop,TS val 136950 ecr 4294890563,mptcp dss ack 2843715367 seq 3759596721 subseq 454105 len 1428 csum 0x9810], length 1428
10:30:07.434731 IP 112.26.3.1.46615 > 112.26.3.8.40113: Flags [.], seq 462673:464101, ack 1, win 4017, options [nop,nop,TS val 137412 ecr 4294891149,mptcp dss ack 2843715367 seq 3759612429 subseq 462673 len 1428 csum 0x571f], length 1428
10:30:07.463947 IP 112.26.3.1.46615 > 112.26.3.8.40113: Flags [.], seq 455533:456961, ack 1, win 4017, options [nop,nop,TS val 137066 ecr 4294890686,mptcp dss ack 2843715367 seq 3759601005 subseq 455533 len 1428 csum 0x28f2], length 1428
10:30:07.489130 IP 112.26.3.8.40113 > 112.26.3.1.46615: Flags [.], ack 455533, win 23921, options [nop,nop,TS val 4294891347 ecr 136950,mptcp dss ack 3759515325], length 0
10:30:07.544847 IP 112.26.3.1.46615 > 112.26.3.8.40113: Flags [.], seq 456961:458389, ack 1, win 4017, options [nop,nop,TS val 137180 ecr 4294890812,mptcp dss ack 2843715367 seq 3759603861 subseq 456961 len 1428 csum 0xc49b], length 1428
10:30:07.567446 IP 112.26.3.1.46615 > 112.26.3.8.40113: Flags [.], seq 464101:465529, ack 1, win 4017, options [nop,nop,TS val 137470 ecr 4294891228,mptcp dss ack 2843715367 seq 3759615285 subseq 464101 len 1428 csum 0xb40e], length 1428
10:30:07.582038 IP 112.26.3.1.46615 > 112.26.3.8.40113: Flags [.], seq 465529:466957, ack 1, win 4017, options [nop,nop,TS val 137470 ecr 4294891228,mptcp dss ack 2843715367 seq 3759616713 subseq 465529 len 1428 csum 0xa4a3], length 1428
10:30:07.623402 IP 112.26.3.8.40113 > 112.26.3.1.46615: Flags [.], ack 456961, win 23921, options [nop,nop,TS val 4294891408 ecr 137066,mptcp dss ack 3759515325], length 0
10:30:07.643918 IP 112.26.3.1.46615 > 112.26.3.8.40113: Flags [.], seq 458389:459817, ack 1, win 4017, options [nop,nop,TS val 137217 ecr 4294890912,mptcp dss ack 2843715367 seq 3759605289 subseq 458389 len 1428 csum 0xff7b], length 1428
10:30:07.671081 IP 112.26.3.1.46615 > 112.26.3.8.40113: Flags [.], seq 466957:468385, ack 1, win 4017, options [nop,nop,TS val 137608 ecr 4294891347,mptcp dss ack 2843715367 seq 3759633849 subseq 466957 len 1428 csum 0x897], length 1428
10:30:07.722352 IP 112.26.3.8.40113 > 112.26.3.1.46615: Flags [.], ack 458389, win 23921, options [nop,nop,TS val 4294891475 ecr 137180,mptcp dss ack 3759515325], length 0
10:30:07.737323 IP 112.26.3.1.46615 > 112.26.3.8.40113: Flags [.], seq 468385:469813, ack 1, win 4017, options [nop,nop,TS val 137742 ecr 4294891408,mptcp dss ack 2843715367 seq 3759646701 subseq 468385 len 1428 csum 0xf027], length 1428
10:30:07.762197 IP 112.26.3.1.46615 > 112.26.3.8.40113: Flags [.], seq 459817:461245, ack 1, win 4017, options [nop,nop,TS val 137217 ecr 4294890912,mptcp dss ack 2843715367 seq 3759606717 subseq 459817 len 1428 csum 0xb3eb], length 1428
10:30:07.799075 IP 112.26.3.1.46615 > 112.26.3.8.40113: Flags [.], seq 469813:471241, ack 1, win 4017, options [nop,nop,TS val 137841 ecr 4294891475,mptcp dss ack 2843715367 seq 3759649557 subseq 469813 len 1428 csum 0xf82b], length 1428
10:30:07.828441 IP 112.26.3.8.40113 > 112.26.3.1.46615: Flags [.], ack 459817, win 23921, options [nop,nop,TS val 4294891588 ecr 137217,mptcp dss ack 3759515325], length 0
10:30:07.866867 IP 112.26.3.1.46615 > 112.26.3.8.40113: Flags [.], seq 471241:472669, ack 1, win 4017, options [nop,nop,TS val 137947 ecr 4294891588,mptcp dss ack 2843715367 seq 3759650985 subseq 471241 len 1428 csum 0x8985], length 1428
10:30:07.914382 IP 112.26.3.1.46615 > 112.26.3.8.40113: Flags [.], seq 461245:462673, ack 1, win 4017, options [nop,nop,TS val 137290 ecr 4294891040,mptcp dss ack 2843715367 seq 3759609573 subseq 461245 len 1428 csum 0x8cdf], length 1428
10:30:07.925582 IP 112.26.3.8.40113 > 112.26.3.1.46615: Flags [.], ack 461245, win 23921, options [nop,nop,TS val 4294891701 ecr 137217,mptcp dss ack 3759515325], length 0
10:30:07.987360 IP 112.26.3.1.46615 > 112.26.3.8.40113: Flags [.], seq 462673:464101, ack 1, win 4017, options [nop,nop,TS val 137412 ecr 4294891149,mptcp dss ack 2843715367 seq 3759612429 subseq 462673 len 1428 csum 0x571f], length 1428
10:30:07.992480 IP 112.26.3.1.46615 > 112.26.3.8.40113: Flags [.], seq 472669:474097, ack 1, win 4017, options [nop,nop,TS val 137947 ecr 4294891588,mptcp dss ack 2843715367 seq 3759652413 subseq 472669 len 1428 csum 0xfa2e], length 1428
10:30:08.057176 IP 112.26.3.1.46615 > 112.26.3.8.40113: Flags [.], seq 464101:465529, ack 1, win 4017, options [nop,nop,TS val 137470 ecr 4294891228,mptcp dss ack 2843715367 seq 3759615285 subseq 464101 len 1428 csum 0xb40e], length 1428
10:30:08.066093 IP 112.26.3.8.40113 > 112.26.3.1.46615: Flags [.], ack 462673, win 23921, options [nop,nop,TS val 4294891807 ecr 137290,mptcp dss ack 3759515325], length 0
10:30:08.116266 IP 112.26.3.1.46615 > 112.26.3.8.40113: Flags [.], seq 465529:466957, ack 1, win 4017, options [nop,nop,TS val 137470 ecr 4294891228,mptcp dss ack 2843715367 seq 3759616713 subseq 465529 len 1428 csum 0xa4a3], length 1428
10:30:08.149298 IP 112.26.3.1.46615 > 112.26.3.8.40113: Flags [.], seq 474097:475525, ack 1, win 4017, options [nop,nop,TS val 138044 ecr 4294891701,mptcp dss ack 2843715367 seq 3759656697 subseq 474097 len 1428 csum 0x9bb5], length 1428
10:30:08.158352 IP 112.26.3.1.46615 > 112.26.3.8.40113: Flags [.], seq 475525:476953, ack 1, win 4017, options [nop,nop,TS val 138184 ecr 4294891807,mptcp dss ack 2843715367 seq 3759663837 subseq 475525 len 1428 csum 0xbc7d], length 1428
10:30:08.212083 IP 112.26.3.1.46615 > 112.26.3.8.40113: Flags [.], seq 466957:468385, ack 1, win 4017, options [nop,nop,TS val 137608 ecr 4294891347,mptcp dss ack 2843715367 seq 3759633849 subseq 466957 len 1428 csum 0x897], length 1428
10:30:08.249628 IP 112.26.3.8.40113 > 112.26.3.1.46615: Flags [.], ack 464101, win 23921, options [nop,nop,TS val 4294891914 ecr 137412,mptcp dss ack 3759515325], length 0
10:30:08.258203 IP 112.26.3.1.46615 > 112.26.3.8.40113: Flags [.], seq 476953:478381, ack 1, win 4017, options [nop,nop,TS val 138368 ecr 4294891914,mptcp dss ack 2843715367 seq 3759666693 subseq 476953 len 1428 csum 0x684e], length 1428
10:30:08.328312 IP 112.26.3.1.46615 > 112.26.3.8.40113: Flags [.], seq 468385:469813, ack 1, win 4017, options [nop,nop,TS val 137742 ecr 4294891408,mptcp dss ack 2843715367 seq 3759646701 subseq 468385 len 1428 csum 0xf027], length 1428
10:30:08.354122 IP 112.26.3.8.40113 > 112.26.3.1.46615: Flags [.], ack 465529, win 23921, options [nop,nop,TS val 4294892002 ecr 137470,mptcp dss ack 3759515325], length 0
10:30:08.386315 IP 112.26.3.1.46615 > 112.26.3.8.40113: Flags [.], seq 478381:479809, ack 1, win 4017, options [nop,nop,TS val 138472 ecr 4294892002,mptcp dss ack 2843715367 seq 3759668121 subseq 478381 len 1428 csum 0xa0ef], length 1428
10:30:08.412742 IP 112.26.3.1.46615 > 112.26.3.8.40113: Flags [.], seq 469813:471241, ack 1, win 4017, options [nop,nop,TS val 137841 ecr 4294891475,mptcp dss ack 2843715367 seq 3759649557 subseq 469813 len 1428 csum 0xf82b], length 1428
10:30:08.430071 IP 112.26.3.1.46615 > 112.26.3.8.40113: Flags [.], seq 479809:481237, ack 1, win 4017, options [nop,nop,TS val 138472 ecr 4294892002,mptcp dss ack 2843715367 seq 3759669549 subseq 479809 len 1428 csum 0x8dc5], length 1428
10:30:08.502803 IP 112.26.3.1.46615 > 112.26.3.8.40113: Flags [.], seq 471241:472669, ack 1, win 4017, options [nop,nop,TS val 137947 ecr 4294891588,mptcp dss ack 2843715367 seq 3759650985 subseq 471241 len 1428 csum 0x8985], length 1428
10:30:08.522793 IP 112.26.3.8.40113 > 112.26.3.1.46615: Flags [.], ack 466957, win 23921, options [nop,nop,TS val 4294892061 ecr 137470,mptcp dss ack 3759515325], length 0
10:30:08.536496 IP 112.26.3.1.46615 > 112.26.3.8.40113: Flags [.], seq 481237:482665, ack 1, win 4017, options [nop,nop,TS val 138641 ecr 4294892061,mptcp dss ack 2843715367 seq 3759676689 subseq 481237 len 1428 csum 0x418a], length 1428
10:30:08.584865 IP 112.26.3.1.46615 > 112.26.3.8.40113: Flags [.], seq 472669:474097, ack 1, win 4017, options [nop,nop,TS val 137947 ecr 4294891588,mptcp dss ack 2843715367 seq 3759652413 subseq 472669 len 1428 csum 0xfa2e], length 1428
10:30:08.633487 IP 112.26.3.8.40113 > 112.26.3.1.46615: Flags [.], ack 468385, win 23921, options [nop,nop,TS val 4294892149 ecr 137608,mptcp dss ack 3759515325], length 0
10:30:08.639388 IP 112.26.3.1.46615 > 112.26.3.8.40113: Flags [.], seq 482665:484093, ack 1, win 4017, options [nop,nop,TS val 138752 ecr 4294892149,mptcp dss ack 2843715367 seq 3759679545 subseq 482665 len 1428 csum 0x347b], length 1428
10:30:08.696481 IP 112.26.3.1.46615 > 112.26.3.8.40113: Flags [.], seq 474097:475525, ack 1, win 4017, options [nop,nop,TS val 138044 ecr 4294891701,mptcp dss ack 2843715367 seq 3759656697 subseq 474097 len 1428 csum 0x9bb5], length 1428
10:30:08.712401 IP 112.26.3.8.40113 > 112.26.3.1.46615: Flags [.], ack 469813, win 23921, options [nop,nop,TS val 4294892261 ecr 137742,mptcp dss ack 3759515325], length 0
10:30:08.718059 IP 112.26.3.1.46615 > 112.26.3.8.40113: Flags [.], seq 484093:485521, ack 1, win 4017, options [nop,nop,TS val 138831 ecr 4294892261,mptcp dss ack 2843715367 seq 3759682401 subseq 484093 len 1428 csum 0xf8ad], length 1428
10:30:08.776212 IP 112.26.3.1.46615 > 112.26.3.8.40113: Flags [.], seq 475525:476953, ack 1, win 4017, options [nop,nop,TS val 138184 ecr 4294891807,mptcp dss ack 2843715367 seq 3759663837 subseq 475525 len 1428 csum 0xbc7d], length 1428
10:30:08.827826 IP 112.26.3.8.40113 > 112.26.3.1.46615: Flags [.], ack 471241, win 23921, options [nop,nop,TS val 4294892399 ecr 137841,mptcp dss ack 3759515325], length 0
10:30:08.836305 IP 112.26.3.1.46615 > 112.26.3.8.40113: Flags [.], seq 485521:486949, ack 1, win 4017, options [nop,nop,TS val 138946 ecr 4294892399,mptcp dss ack 2843715367 seq 3759688113 subseq 485521 len 1428 csum 0xdf48], length 1428
10:30:08.855676 IP 112.26.3.1.46615 > 112.26.3.8.40113: Flags [.], seq 476953:478381, ack 1, win 4017, options [nop,nop,TS val 138368 ecr 4294891914,mptcp dss ack 2843715367 seq 3759666693 subseq 476953 len 1428 csum 0x684e], length 1428
10:30:08.910363 IP 112.26.3.8.40113 > 112.26.3.1.46615: Flags [.], ack 474097, win 23921, options [nop,nop,TS val 4294892530 ecr 137947,mptcp dss ack 3759515325], length 0
10:30:08.915909 IP 112.26.3.1.46615 > 112.26.3.8.40113: Flags [.], seq 486949:488377, ack 1, win 4017, options [nop,nop,TS val 139029 ecr 4294892530,mptcp dss ack 2843715367 seq 3759689541 subseq 486949 len 1428 csum 0x9ec9], length 1428
10:30:08.940140 IP 112.26.3.1.46615 > 112.26.3.8.40113: Flags [.], seq 478381:479809, ack 1, win 4017, options [nop,nop,TS val 138472 ecr 4294892002,mptcp dss ack 2843715367 seq 3759668121 subseq 478381 len 1428 csum 0xa0ef], length 1428
10:30:08.997363 IP 112.26.3.8.40113 > 112.26.3.1.46615: Flags [.], ack 476953, win 23921, options [nop,nop,TS val 4294892717 ecr 138044,mptcp dss ack 3759515325], length 0
10:30:09.005763 IP 112.26.3.1.46615 > 112.26.3.8.40113: Flags [.], seq 488377:489805, ack 1, win 4017, options [nop,nop,TS val 139029 ecr 4294892530,mptcp dss ack 2843715367 seq 3759690969 subseq 488377 len 1428 csum 0x13bb], length 1428
10:30:09.027694 IP 112.26.3.1.46615 > 112.26.3.8.40113: Flags [.], seq 479809:481237, ack 1, win 4017, options [nop,nop,TS val 138472 ecr 4294892002,mptcp dss ack 2843715367 seq 3759669549 subseq 479809 len 1428 csum 0x8dc5], length 1428
10:30:09.076286 IP 112.26.3.1.46615 > 112.26.3.8.40113: Flags [.], seq 489805:491233, ack 1, win 4017, options [nop,nop,TS val 139116 ecr 4294892717,mptcp dss ack 2843715367 seq 3759698109 subseq 489805 len 1428 csum 0xfff0], length 1428
10:30:09.088225 IP 112.26.3.1.46615 > 112.26.3.8.40113: Flags [.], seq 481237:482665, ack 1, win 4017, options [nop,nop,TS val 138641 ecr 4294892061,mptcp dss ack 2843715367 seq 3759676689 subseq 481237 len 1428 csum 0x418a], length 1428
10:30:09.116267 IP 112.26.3.8.40113 > 112.26.3.1.46615: Flags [.], ack 479809, win 23921, options [nop,nop,TS val 4294892944 ecr 138368,mptcp dss ack 3759515325], length 0
10:30:09.131087 IP 112.26.3.1.46615 > 112.26.3.8.40113: Flags [.], seq 491233:492661, ack 1, win 4017, options [nop,nop,TS val 139116 ecr 4294892717,mptcp dss ack 2843715367 seq 3759699537 subseq 491233 len 1428 csum 0xc48e], length 1428
10:30:09.205544 IP 112.26.3.1.46615 > 112.26.3.8.40113: Flags [.], seq 482665:484093, ack 1, win 4017, options [nop,nop,TS val 138752 ecr 4294892149,mptcp dss ack 2843715367 seq 3759679545 subseq 482665 len 1428 csum 0x347b], length 1428
10:30:09.215676 IP 112.26.3.1.46615 > 112.26.3.8.40113: Flags [.], seq 492661:494089, ack 1, win 4017, options [nop,nop,TS val 139235 ecr 4294892944,mptcp dss ack 2843715367 seq 3759702393 subseq 492661 len 1428 csum 0xcb8e], length 1428
10:30:09.227377 IP 112.26.3.8.40113 > 112.26.3.1.46615: Flags [.], ack 482665, win 23751, options [nop,nop,TS val 4294893112 ecr 138472,mptcp dss ack 3759591009], length 0
10:30:09.273271 IP 112.26.3.1.46615 > 112.26.3.8.40113: Flags [.], seq 494089:495517, ack 1, win 4017, options [nop,nop,TS val 139235 ecr 4294892944,mptcp dss ack 2843715367 seq 3759703821 subseq 494089 len 1428 csum 0x7359], length 1428
10:30:09.307509 IP 112.26.3.1.46615 > 112.26.3.8.40113: Flags [.], seq 495517:496945, ack 1, win 4017, options [nop,nop,TS val 139346 ecr 4294893112,mptcp dss ack 2843715367 seq 3759706677 subseq 495517 len 1428 csum 0x803e], length 1428
10:30:09.330799 IP 112.26.3.1.46615 > 112.26.3.8.40113: Flags [.], seq 484093:485521, ack 1, win 4017, options [nop,nop,TS val 138831 ecr 4294892261,mptcp dss ack 2843715367 seq 3759682401 subseq 484093 len 1428 csum 0xf8ad], length 1428
10:30:09.339148 IP 112.26.3.8.40113 > 112.26.3.1.46615: Flags [.], ack 485521, win 24125, options [nop,nop,TS val 4294893269 ecr 138752,mptcp dss ack 3759630993], length 0
10:30:09.418275 IP 112.26.3.1.46615 > 112.26.3.8.40113: Flags [.], seq 485521:486949, ack 1, win 4017, options [nop,nop,TS val 138946 ecr 4294892399,mptcp dss ack 2843715367 seq 3759688113 subseq 485521 len 1428 csum 0xdf48], length 1428
10:30:09.430131 IP 112.26.3.1.46615 > 112.26.3.8.40113: Flags [.], seq 496945:498373, ack 1, win 4017, options [nop,nop,TS val 139346 ecr 4294893112,mptcp dss ack 2843715367 seq 3759708105 subseq 496945 len 1428 csum 0xd3ec], length 1428
10:30:09.475868 IP 112.26.3.1.46615 > 112.26.3.8.40113: Flags [.], seq 486949:488377, ack 1, win 4017, options [nop,nop,TS val 139029 ecr 4294892530,mptcp dss ack 2843715367 seq 3759689541 subseq 486949 len 1428 csum 0x9ec9], length 1428
10:30:09.485409 IP 112.26.3.1.46615 > 112.26.3.8.40113: Flags [.], seq 498373:499801, ack 1, win 4017, options [nop,nop,TS val 139348 ecr 4294893112,mptcp dss ack 2843715367 seq 3759709533 subseq 498373 len 1428 csum 0xec41], length 1428
10:30:09.542643 IP 112.26.3.1.46615 > 112.26.3.8.40113: Flags [.], seq 499801:501229, ack 1, win 4017, options [nop,nop,TS val 139457 ecr 4294893269,mptcp dss ack 2843715367 seq 3759712389 subseq 499801 len 1428 csum 0xb238], length 1428
10:30:09.568293 IP 112.26.3.1.46615 > 112.26.3.8.40113: Flags [.], seq 488377:489805, ack 1, win 4017, options [nop,nop,TS val 139029 ecr 4294892530,mptcp dss ack 2843715367 seq 3759690969 subseq 488377 len 1428 csum 0x13bb], length 1428
10:30:09.588866 IP 112.26.3.1.46615 > 112.26.3.8.40113: Flags [.], seq 501229:502657, ack 1, win 4017, options [nop,nop,TS val 139457 ecr 4294893269,mptcp dss ack 2843715367 seq 3759713817 subseq 501229 len 1428 csum 0x515f], length 1428
10:30:09.632015 IP 112.26.3.8.40113 > 112.26.3.1.46615: Flags [.], ack 489805, win 24125, options [nop,nop,TS val 4294893568 ecr 138946,mptcp dss ack 3759630993], length 0
10:30:09.656683 IP 112.26.3.1.46615 > 112.26.3.8.40113: Flags [.], seq 489805:491233, ack 1, win 4017, options [nop,nop,TS val 139116 ecr 4294892717,mptcp dss ack 2843715367 seq 3759698109 subseq 489805 len 1428 csum 0xfff0], length 1428
10:30:09.669786 IP 112.26.3.1.46615 > 112.26.3.8.40113: Flags [.], seq 502657:504085, ack 1, win 4017, options [nop,nop,TS val 139750 ecr 4294893568,mptcp dss ack 2843715367 seq 3759729525 subseq 502657 len 1428 csum 0x6466], length 1428
10:30:09.744367 IP 112.26.3.1.46615 > 112.26.3.8.40113: Flags [.], seq 491233:492661, ack 1, win 4017, options [nop,nop,TS val 139116 ecr 4294892717,mptcp dss ack 2843715367 seq 3759699537 subseq 491233 len 1428 csum 0xc48e], length 1428
10:30:09.756111 IP 112.26.3.1.46615 > 112.26.3.8.40113: Flags [.], seq 504085:505513, ack 1, win 4017, options [nop,nop,TS val 139750 ecr 4294893568,mptcp dss ack 2843715367 seq 3759730953 subseq 504085 len 1428 csum 0x6ccf], length 1428
10:30:09.795640 IP 112.26.3.1.46615 > 112.26.3.8.40113: Flags [.], seq 505513:506941, ack 1, win 4017, options [nop,nop,TS val 139750 ecr 4294893568,mptcp dss ack 2843715367 seq 3759732381 subseq 505513 len 1428 csum 0x1bc2], length 1428
10:30:09.819034 IP 112.26.3.1.46615 > 112.26.3.8.40113: Flags [.], seq 492661:494089, ack 1, win 4017, options [nop,nop,TS val 139235 ecr 4294892944,mptcp dss ack 2843715367 seq 3759702393 subseq 492661 len 1428 csum 0xcb8e], length 1428
10:30:09.895910 IP 112.26.3.1.46615 > 112.26.3.8.40113: Flags [.], seq 494089:495517, ack 1, win 4017, options [nop,nop,TS val 139235 ecr 4294892944,mptcp dss ack 2843715367 seq 3759703821 subseq 494089 len 1428 csum 0x7359], length 1428
10:30:09.905174 IP 112.26.3.8.40113 > 112.26.3.1.46615: Flags [.], ack 495517, win 24125, options [nop,nop,TS val 4294893841 ecr 139116,mptcp dss ack 3759630993], length 0
10:30:09.909280 IP 112.26.3.1.46615 > 112.26.3.8.40113: Flags [.], seq 506941:508369, ack 1, win 4017, options [nop,nop,TS val 140024 ecr 4294893841,mptcp dss ack 2843715367 seq 3759748089 subseq 506941 len 1428 csum 0xb65a], length 1428
10:30:09.982821 IP 112.26.3.1.46615 > 112.26.3.8.40113: Flags [.], seq 495517:496945, ack 1, win 4017, options [nop,nop,TS val 139346 ecr 4294893112,mptcp dss ack 2843715367 seq 3759706677 subseq 495517 len 1428 csum 0x803e], length 1428
10:30:09.989472 IP 112.26.3.1.46615 > 112.26.3.8.40113: Flags [.], seq 508369:509797, ack 1, win 4017, options [nop,nop,TS val 140024 ecr 4294893841,mptcp dss ack 2843715367 seq 3759749517 subseq 508369 len 1428 csum 0x8069], length 1428
10:30:10.072985 IP 112.26.3.1.46615 > 112.26.3.8.40113: Flags [.], seq 496945:498373, ack 1, win 4017, options [nop,nop,TS val 139346 ecr 4294893112,mptcp dss ack 2843715367 seq 3759708105 subseq 496945 len 1428 csum 0xd3ec], length 1428
10:30:10.088363 IP 112.26.3.1.46615 > 112.26.3.8.40113: Flags [.], seq 509797:511225, ack 1, win 4017, options [nop,nop,TS val 140024 ecr 4294893841,mptcp dss ack 2843715367 seq 3759750945 subseq 509797 len 1428 csum 0xb2d8], length 1428
10:30:10.120817 IP 112.26.3.1.46615 > 112.26.3.8.40113: Flags [.], seq 498373:499801, ack 1, win 4017, options [nop,nop,TS val 139348 ecr 4294893112,mptcp dss ack 2843715367 seq 3759709533 subseq 498373 len 1428 csum 0xec41], length 1428
10:30:10.132400 IP 112.26.3.8.40113 > 112.26.3.1.46615: Flags [.], ack 499801, win 24059, options [nop,nop,TS val 4294894066 ecr 139346,mptcp dss ack 3759635277], length 0
10:30:10.144266 IP 112.26.3.1.46615 > 112.26.3.8.40113: Flags [.], seq 511225:512653, ack 1, win 4017, options [nop,nop,TS val 140024 ecr 4294893841,mptcp dss ack 2843715367 seq 3759752373 subseq 511225 len 1428 csum 0xffed], length 1428
10:30:10.203289 IP 112.26.3.1.46615 > 112.26.3.8.40113: Flags [.], seq 512653:514081, ack 1, win 4017, options [nop,nop,TS val 140251 ecr 4294894066,mptcp dss ack 2843715367 seq 3759763797 subseq 512653 len 1428 csum 0xcf57], length 1428
10:30:10.251521 IP 112.26.3.1.46615 > 112.26.3.8.40113: Flags [.], seq 501229:502657, ack 1, win 4017, options [nop,nop,TS val 139457 ecr 4294893269,mptcp dss ack 2843715367 seq 3759713817 subseq 501229 len 1428 csum 0x515f], length 1428
10:30:10.256417 IP 112.26.3.8.40113 > 112.26.3.1.46615: Flags [.], ack 499801, win 23993, options [nop,nop,TS val 4294894182 ecr 139346,nop,nop,sack 1 {501229:502657},mptcp dss ack 3759639561], length 0
10:30:10.284439 IP 112.26.3.1.46615 > 112.26.3.8.40113: Flags [.], seq 514081:515509, ack 1, win 4017, options [nop,nop,TS val 140251 ecr 4294894066,mptcp dss ack 2843715367 seq 3759765225 subseq 514081 len 1428 csum 0xad02], length 1428
10:30:10.333836 IP 112.26.3.1.46615 > 112.26.3.8.40113: Flags [.], seq 502657:504085, ack 1, win 4017, options [nop,nop,TS val 139750 ecr 4294893568,mptcp dss ack 2843715367 seq 3759729525 subseq 502657 len 1428 csum 0x6466], length 1428
10:30:10.348101 IP 112.26.3.1.46615 > 112.26.3.8.40113: Flags [.], seq 515509:516937, ack 1, win 4017, options [nop,nop,TS val 140251 ecr 4294894066,mptcp dss ack 2843715367 seq 3759766653 subseq 515509 len 1428 csum 0x6c8e], length 1428
10:30:10.380062 IP 112.26.3.8.40113 > 112.26.3.1.46615: Flags [.], ack 499801, win 23971, options [nop,nop,TS val 4294894278 ecr 139346,nop,nop,sack 1 {501229:504085},mptcp dss ack 3759640989], length 0
10:30:10.426196 IP 112.26.3.1.46615 > 112.26.3.8.40113: Flags [.], seq 516937:518365, ack 1, win 4017, options [nop,nop,TS val 140376 ecr 4294894182,mptcp dss ack 2843715367 seq 3759769509 subseq 516937 len 1428 csum 0x5ac0], length 1428
10:30:10.473494 IP 112.26.3.1.46615 > 112.26.3.8.40113: Flags [.], seq 505513:506941, ack 1, win 4017, options [nop,nop,TS val 139750 ecr 4294893568,mptcp dss ack 2843715367 seq 3759732381 subseq 505513 len 1428 csum 0x1bc2], length 1428
10:30:10.485078 IP 112.26.3.8.40113 > 112.26.3.1.46615: Flags [.], ack 499801, win 23949, options [nop,nop,TS val 4294894418 ecr 139346,nop,nop,sack 2 {505513:506941}{501229:504085},mptcp dss ack 3759642417], length 0
10:30:10.488783 IP 112.26.3.1.46615 > 112.26.3.8.40113: Flags [.], seq 518365:519793, ack 1, win 4017, options [nop,nop,TS val 140600 ecr 4294894278,mptcp dss ack 2843715367 seq 3759772365 subseq 518365 len 1428 csum 0x1358], length 1428
10:30:10.548103 IP 112.26.3.1.46615 > 112.26.3.8.40113: Flags [.], seq 499801:501229, ack 1, win 4017, options [nop,nop,TS val 140603 ecr 4294894418,mptcp dss ack 2843715367 seq 3759712389 subseq 499801 len 1428 csum 0xb238], length 1428
10:30:10.590759 IP 112.26.3.1.46615 > 112.26.3.8.40113: Flags [.], seq 506941:508369, ack 1, win 4017, options [nop,nop,TS val 140024 ecr 4294893841,mptcp dss ack 2843715367 seq 3759748089 subseq 506941 len 1428 csum 0xb65a], length 1428
10:30:10.599524 IP 112.26.3.8.40113 > 112.26.3.1.46615: Flags [.], ack 499801, win 24383, options [nop,nop,TS val 4294894535 ecr 139346,nop,nop,sack 2 {505513:508369}{501229:504085},mptcp dss ack 3759712389], length 0
10:30:10.642057 IP 112.26.3.1.46615 > 112.26.3.8.40113: Flags [.], seq 504085:505513, ack 1, win 4017, options [nop,nop,TS val 140718 ecr 4294894535,mptcp dss ack 2843715367 seq 3759730953 subseq 504085 len 1428 csum 0x6ccf], length 1428
10:30:10.707448 IP 112.26.3.1.46615 > 112.26.3.8.40113: Flags [.], seq 508369:509797, ack 1, win 4017, options [nop,nop,TS val 140024 ecr 4294893841,mptcp dss ack 2843715367 seq 3759749517 subseq 508369 len 1428 csum 0x8069], length 1428
10:30:10.731886 IP 112.26.3.8.40113 > 112.26.3.1.46615: Flags [.], ack 499801, win 24383, options [nop,nop,TS val 4294894652 ecr 139346,nop,nop,sack 2 {505513:509797}{501229:504085},mptcp dss ack 3759712389], length 0
10:30:10.802905 IP 112.26.3.1.46615 > 112.26.3.8.40113: Flags [.], seq 509797:511225, ack 1, win 4017, options [nop,nop,TS val 140024 ecr 4294893841,mptcp dss ack 2843715367 seq 3759750945 subseq 509797 len 1428 csum 0xb2d8], length 1428
10:30:10.832781 IP 112.26.3.8.40113 > 112.26.3.1.46615: Flags [.], ack 499801, win 24383, options [nop,nop,TS val 4294894748 ecr 139346,nop,nop,sack 2 {505513:511225}{501229:504085},mptcp dss ack 3759712389], length 0
