10:29:33.135621 IP 112.26.3.8.40113 > 112.26.3.1.46615: Flags [S], seq 2110223229, win 65535, options [mss 1460,sackOK,TS val 4294857066 ecr 0,nop,wscale 6,mptcp join id 6 token 0x9485611f nonce 0xe9dd8d1b], length 0
10:29:33.180003 IP 112.26.3.8.40113 > 112.26.3.1.46615: Flags [S], seq 2110223229, win 65535, options [mss 1460,sackOK,TS val 4294857066 ecr 0,nop,wscale 6,mptcp join id 6 token 0x9485611f nonce 0xe9dd8d1b], length 0
10:29:33.495772 IP 112.26.3.1.46615 > 112.26.3.8.40113: Flags [S.], seq 149559822, ack 2110223230, win 65535, options [mss 1460,sackOK,TS val 103377 ecr 4294857066,nop,wscale 6,mptcp join id 5 hmac 0x89c8395052e86075 nonce 0x2b29489b], length 0
10:29:33.495968 IP 112.26.3.8.40113 > 112.26.3.1.46615: Flags [.], ack 1, win 7437, options [nop,nop,TS val 4294857441 ecr 103377,mptcp join hmac 0xe1569dd3d789e0842eb4539998398e150a4080a7], length 0
10:29:33.604737 IP 112.26.3.8.40113 > 112.26.3.1.46615: Flags [.], ack 1, win 7437, options [nop,nop,TS val 4294857441 ecr 103377,mptcp join hmac 0xe1569dd3d789e0842eb4539998398e150a4080a7], length 0
10:29:33.626224 IP 112.26.3.1.46615 > 112.26.3.8.40113: Flags [.], ack 1, win 4017, options [nop,nop,TS val 103725 ecr 4294857441,mptcp dss ack 2843715367], length 0
10:29:33.708200 IP 112.26.3.1.46615 > 112.26.3.8.40113: Flags [.], seq 1:1429, ack 1, win 4017, options [nop,nop,TS val 103753 ecr 4294857441,mptcp dss ack 2843715367 seq 3758242977 subseq 1 len 1428 csum 0xaf48], length 1428
10:30:05.191816 IP 112.26.3.1.46615 > 112.26.3.8.40113: Flags [.], seq 422689:424117, ack 1, win 4017, options [nop,nop,TS val 134377 ecr 4294888193,mptcp dss ack 2843715367 seq 3759479625 subseq 422689 len 1428 csum 0xd20d], length 1428
10:30:05.254279 IP 112.26.3.1.46615 > 112.26.3.8.40113: Flags [.], seq 424117:425545, ack 1, win 4017, options [nop,nop,TS val 134598 ecr 4294888418,mptcp dss ack 2843715367 seq 3759488193 subseq 424117 len 1428 csum 0xd829], length 1428
10:30:05.333553 IP 112.26.3.1.46615 > 112.26.3.8.40113: Flags [.], seq 426973:428401, ack 1, win 4017, options [nop,nop,TS val 134747 ecr 4294888558,mptcp dss ack 2843715367 seq 3759493905 subseq 426973 len 1428 csum 0xb9f5], length 1428
10:30:05.333939 IP 112.26.3.8.40113 > 112.26.3.1.46615: Flags [.], ack 425545, win 23885, options [nop,nop,TS val 4294889279 ecr 134377,nop,nop,sack 1 {426973:428401},mptcp dss ack 3759388233], length 0
10:30:05.342717 IP 112.26.3.8.40113 > 112.26.3.1.46615: Flags [.], ack 425545, win 23885, options [nop,nop,TS val 4294889279 ecr 134377,nop,nop,sack 1 {426973:428401},mptcp dss ack 3759388233], length 0
10:30:05.450763 IP 112.26.3.1.46615 > 112.26.3.8.40113: Flags [.], seq 428401:429829, ack 1, win 4017, options [nop,nop,TS val 134747 ecr 4294888558,mptcp dss ack 2843715367 seq 3759495333 subseq 428401 len 1428 csum 0xf799], length 1428
10:30:05.451112 IP 112.26.3.8.40113 > 112.26.3.1.46615: Flags [.], ack 425545, win 23885, options [nop,nop,TS val 4294889396 ecr 134377,nop,nop,sack 1 {426973:429829},mptcp dss ack 3759388233], length 0
10:30:05.455293 IP 112.26.3.8.40113 > 112.26.3.1.46615: Flags [.], ack 425545, win 23885, options [nop,nop,TS val 4294889396 ecr 134377,nop,nop,sack 1 {426973:429829},mptcp dss ack 3759388233], length 0
10:30:05.545094 IP 112.26.3.1.46615 > 112.26.3.8.40113: Flags [.], seq 431257:432685, ack 1, win 4017, options [nop,nop,TS val 134909 ecr 4294888727,mptcp dss ack 2843715367 seq 3759508185 subseq 431257 len 1428 csum 0x7ee2], length 1428
10:30:05.545480 IP 112.26.3.8.40113 > 112.26.3.1.46615: Flags [.], ack 425545, win 23885, options [nop,nop,TS val 4294889490 ecr 134377,nop,nop,sack 2 {431257:432685}{426973:429829},mptcp dss ack 3759388233], length 0
10:30:05.550689 IP 112.26.3.8.40113 > 112.26.3.1.46615: Flags [.], ack 425545, win 23885, options [nop,nop,TS val 4294889490 ecr 134377,nop,nop,sack 2 {431257:432685}{426973:429829},mptcp dss ack 3759388233], length 0
10:30:05.641549 IP 112.26.3.1.46615 > 112.26.3.8.40113: Flags [.], seq 432685:434113, ack 1, win 4017, options [nop,nop,TS val 134909 ecr 4294888727,mptcp dss ack 2843715367 seq 3759509613 subseq 432685 len 1428 csum 0x1041], length 1428
10:30:05.641889 IP 112.26.3.8.40113 > 112.26.3.1.46615: Flags [.], ack 425545, win 23885, options [nop,nop,TS val 4294889586 ecr 134377,nop,nop,sack 2 {431257:434113}{426973:429829},mptcp dss ack 3759388233], length 0
10:30:05.675392 IP 112.26.3.8.40113 > 112.26.3.1.46615: Flags [.], ack 425545, win 23885, options [nop,nop,TS val 4294889586 ecr 134377,nop,nop,sack 2 {431257:434113}{426973:429829},mptcp dss ack 3759388233], length 0
10:30:05.764626 IP 112.26.3.1.46615 > 112.26.3.8.40113: Flags [.], seq 434113:435541, ack 1, win 4017, options [nop,nop,TS val 135194 ecr 4294889014,mptcp dss ack 2843715367 seq 3759521037 subseq 434113 len 1428 csum 0xc4fb], length 1428
10:30:05.764979 IP 112.26.3.8.40113 > 112.26.3.1.46615: Flags [.], ack 425545, win 23712, options [nop,nop,TS val 4294889709 ecr 134377,nop,nop,sack 2 {431257:435541}{426973:429829},mptcp dss ack 3759422505], length 0
10:30:05.780433 IP 112.26.3.8.40113 > 112.26.3.1.46615: Flags [.], ack 425545, win 23712, options [nop,nop,TS val 4294889709 ecr 134377,nop,nop,sack 2 {431257:435541}{426973:429829},mptcp dss ack 3759422505], length 0
10:30:05.834298 IP 112.26.3.1.46615 > 112.26.3.8.40113: Flags [.], seq 435541:436969, ack 1, win 4017, options [nop,nop,TS val 135194 ecr 4294889014,mptcp dss ack 2843715367 seq 3759522465 subseq 435541 len 1428 csum 0xd638], length 1428
10:30:05.834670 IP 112.26.3.8.40113 > 112.26.3.1.46615: Flags [.], ack 425545, win 23712, options [nop,nop,TS val 4294889779 ecr 134377,nop,nop,sack 2 {431257:436969}{426973:429829},mptcp dss ack 3759422505], length 0
10:30:05.892133 IP 112.26.3.8.40113 > 112.26.3.1.46615: Flags [.], ack 425545, win 23712, options [nop,nop,TS val 4294889779 ecr 134377,nop,nop,sack 2 {431257:436969}{426973:429829},mptcp dss ack 3759422505], length 0
10:30:05.941959 IP 112.26.3.1.46615 > 112.26.3.8.40113: Flags [.], seq 436969:438397, ack 1, win 4017, options [nop,nop,TS val 135194 ecr 4294889014,mptcp dss ack 2843715367 seq 3759523893 subseq 436969 len 1428 csum 0x13a3], length 1428
10:30:05.942261 IP 112.26.3.8.40113 > 112.26.3.1.46615: Flags [.], ack 425545, win 23712, options [nop,nop,TS val 4294889887 ecr 134377,nop,nop,sack 2 {431257:438397}{426973:429829},mptcp dss ack 3759422505], length 0
10:30:05.957796 IP 112.26.3.8.40113 > 112.26.3.1.46615: Flags [.], ack 425545, win 23712, options [nop,nop,TS val 4294889887 ecr 134377,nop,nop,sack 2 {431257:438397}{426973:429829},mptcp dss ack 3759422505], length 0
10:30:06.049704 IP 112.26.3.1.46615 > 112.26.3.8.40113: Flags [.], seq 438397:439825, ack 1, win 4017, options [nop,nop,TS val 135194 ecr 4294889014,mptcp dss ack 2843715367 seq 3759525321 subseq 438397 len 1428 csum 0x9cfc], length 1428
10:30:06.050098 IP 112.26.3.8.40113 > 112.26.3.1.46615: Flags [.], ack 425545, win 23712, options [nop,nop,TS val 4294889994 ecr 134377,nop,nop,sack 2 {431257:439825}{426973:429829},mptcp dss ack 3759422505], length 0
10:30:06.074811 IP 112.26.3.8.40113 > 112.26.3.1.46615: Flags [.], ack 425545, win 23712, options [nop,nop,TS val 4294889994 ecr 134377,nop,nop,sack 2 {431257:439825}{426973:429829},mptcp dss ack 3759422505], length 0
10:30:06.152785 IP 112.26.3.1.46615 > 112.26.3.8.40113: Flags [.], seq 439825:441253, ack 1, win 4017, options [nop,nop,TS val 135474 ecr 4294889279,mptcp dss ack 2843715367 seq 3759533889 subseq 439825 len 1428 csum 0x78e], length 1428
10:30:06.153148 IP 112.26.3.8.40113 > 112.26.3.1.46615: Flags [.], ack 425545, win 23712, options [nop,nop,TS val 4294890098 ecr 134377,nop,nop,sack 2 {431257:441253}{426973:429829},mptcp dss ack 3759422505], length 0
10:30:06.212851 IP 112.26.3.8.40113 > 112.26.3.1.46615: Flags [.], ack 425545, win 23712, options [nop,nop,TS val 4294890098 ecr 134377,nop,nop,sack 2 {431257:441253}{426973:429829},mptcp dss ack 3759422505], length 0
10:30:06.253386 IP 112.26.3.1.46615 > 112.26.3.8.40113: Flags [.], seq 442681:444109, ack 1, win 4017, options [nop,nop,TS val 135474 ecr 4294889279,mptcp dss ack 2843715367 seq 3759536745 subseq 442681 len 1428 csum 0x5aad], length 1428
10:30:06.253756 IP 112.26.3.8.40113 > 112.26.3.1.46615: Flags [.], ack 425545, win 23712, options [nop,nop,TS val 4294890199 ecr 134377,nop,nop,sack 2 {442681:444109}{431257:441253},mptcp dss ack 3759422505], length 0
10:30:06.313521 IP 112.26.3.8.40113 > 112.26.3.1.46615: Flags [.], ack 425545, win 23712, options [nop,nop,TS val 4294890199 ecr 134377,nop,nop,sack 2 {442681:444109}{431257:441253},mptcp dss ack 3759422505], length 0
10:30:06.348095 IP 112.26.3.1.46615 > 112.26.3.8.40113: Flags [.], seq 444109:445537, ack 1, win 4017, options [nop,nop,TS val 135640 ecr 4294889396,mptcp dss ack 2843715367 seq 3759545313 subseq 444109 len 1428 csum 0xc93e], length 1428
10:30:06.348441 IP 112.26.3.8.40113 > 112.26.3.1.46615: Flags [.], ack 425545, win 23712, options [nop,nop,TS val 4294890293 ecr 134377,nop,nop,sack 2 {442681:445537}{431257:441253},mptcp dss ack 3759422505], length 0
10:30:06.411727 IP 112.26.3.1.46615 > 112.26.3.8.40113: Flags [.], seq 425545:426973, ack 1, win 4017, options [nop,nop,TS val 135711 ecr 4294889490,mptcp dss ack 2843715367 seq 3759489621 subseq 425545 len 1428 csum 0xaa74], length 1428
10:30:06.412041 IP 112.26.3.8.40113 > 112.26.3.1.46615: Flags [.], ack 429829, win 23712, options [nop,nop,TS val 4294890357 ecr 135711,nop,nop,sack 2 {442681:445537}{431257:441253},mptcp dss ack 3759422505], length 0
10:30:06.441728 IP 112.26.3.8.40113 > 112.26.3.1.46615: Flags [.], ack 425545, win 23712, options [nop,nop,TS val 4294890293 ecr 134377,nop,nop,sack 2 {442681:445537}{431257:441253},mptcp dss ack 3759422505], length 0
10:30:06.523273 IP 112.26.3.1.46615 > 112.26.3.8.40113: Flags [.], seq 429829:431257, ack 1, win 4017, options [nop,nop,TS val 135796 ecr 4294889586,mptcp dss ack 2843715367 seq 3759506757 subseq 429829 len 1428 csum 0xa03], length 1428
10:30:06.523668 IP 112.26.3.8.40113 > 112.26.3.1.46615: Flags [.], ack 441253, win 23712, options [nop,nop,TS val 4294890468 ecr 135796,nop,nop,sack 1 {442681:445537},mptcp dss ack 3759422505], length 0
10:30:06.549195 IP 112.26.3.8.40113 > 112.26.3.1.46615: Flags [.], ack 429829, win 23712, options [nop,nop,TS val 4294890357 ecr 135711,nop,nop,sack 2 {442681:445537}{431257:441253},mptcp dss ack 3759422505], length 0
10:30:06.617854 IP 112.26.3.1.46615 > 112.26.3.8.40113: Flags [.], seq 445537:446965, ack 1, win 4017, options [nop,nop,TS val 136116 ecr 4294889887,mptcp dss ack 2843715367 seq 3759566733 subseq 445537 len 1428 csum 0x1dee], length 1428
10:30:06.618153 IP 112.26.3.8.40113 > 112.26.3.1.46615: Flags [.], ack 441253, win 23712, options [nop,nop,TS val 4294890563 ecr 135796,nop,nop,sack 1 {442681:446965},mptcp dss ack 3759422505], length 0
10:30:06.685901 IP 112.26.3.8.40113 > 112.26.3.1.46615: Flags [.], ack 441253, win 23712, options [nop,nop,TS val 4294890468 ecr 135796,nop,nop,sack 1 {442681:445537},mptcp dss ack 3759422505], length 0
10:30:06.740604 IP 112.26.3.1.46615 > 112.26.3.8.40113: Flags [P.], seq 446965:448393, ack 1, win 4017, options [nop,nop,TS val 136228 ecr 4294889994,mptcp dss ack 2843715367 seq 3759569589 subseq 446965 len 1428 csum 0x7555], length 1428
10:30:06.740901 IP 112.26.3.8.40113 > 112.26.3.1.46615: Flags [.], ack 441253, win 23712, options [nop,nop,TS val 4294890686 ecr 135796,nop,nop,sack 1 {442681:448393},mptcp dss ack 3759422505], length 0
10:30:06.805502 IP 112.26.3.8.40113 > 112.26.3.1.46615: Flags [.], ack 441253, win 23712, options [nop,nop,TS val 4294890563 ecr 135796,nop,nop,sack 1 {442681:446965},mptcp dss ack 3759422505], length 0
10:30:06.847032 IP 112.26.3.8.40113 > 112.26.3.1.46615: Flags [.], ack 441253, win 23712, options [nop,nop,TS val 4294890686 ecr 135796,nop,nop,sack 1 {442681:448393},mptcp dss ack 3759422505], length 0
10:30:06.867431 IP 112.26.3.1.46615 > 112.26.3.8.40113: Flags [.], seq 448393:449821, ack 1, win 4017, options [nop,nop,TS val 136373 ecr 4294890098,mptcp dss ack 2843715367 seq 3759573873 subseq 448393 len 1428 csum 0x3bbb], length 1428
10:30:06.867787 IP 112.26.3.8.40113 > 112.26.3.1.46615: Flags [.], ack 441253, win 24099, options [nop,nop,TS val 4294890812 ecr 135796,nop,nop,sack 1 {442681:449821},mptcp dss ack 3759503901], length 0
10:30:06.942615 IP 112.26.3.8.40113 > 112.26.3.1.46615: Flags [.], ack 441253, win 24099, options [nop,nop,TS val 4294890812 ecr 135796,nop,nop,sack 1 {442681:449821},mptcp dss ack 3759503901], length 0
10:30:06.967457 IP 112.26.3.1.46615 > 112.26.3.8.40113: Flags [.], seq 441253:442681, ack 1, win 4017, options [nop,nop,TS val 136435 ecr 4294890199,mptcp dss ack 2843715367 seq 3759535317 subseq 441253 len 1428 csum 0xbbeb], length 1428
10:30:06.967848 IP 112.26.3.8.40113 > 112.26.3.1.46615: Flags [.], ack 449821, win 24099, options [nop,nop,TS val 4294890912 ecr 136435,mptcp dss ack 3759503901], length 0
10:30:07.036643 IP 112.26.3.8.40113 > 112.26.3.1.46615: Flags [.], ack 449821, win 24099, options [nop,nop,TS val 4294890912 ecr 136435,mptcp dss ack 3759503901], length 0
10:30:07.094645 IP 112.26.3.1.46615 > 112.26.3.8.40113: Flags [.], seq 449821:451249, ack 1, win 4017, options [nop,nop,TS val 136581 ecr 4294890293,mptcp dss ack 2843715367 seq 3759585297 subseq 449821 len 1428 csum 0xf464], length 1428
10:30:07.094983 IP 112.26.3.8.40113 > 112.26.3.1.46615: Flags [.], ack 451249, win 24099, options [nop,nop,TS val 4294891040 ecr 136581,mptcp dss ack 3759503901], length 0
10:30:07.138968 IP 112.26.3.8.40113 > 112.26.3.1.46615: Flags [.], ack 451249, win 24099, options [nop,nop,TS val 4294891040 ecr 136581,mptcp dss ack 3759503901], length 0
10:30:07.203920 IP 112.26.3.1.46615 > 112.26.3.8.40113: Flags [.], seq 451249:452677, ack 1, win 4017, options [nop,nop,TS val 136679 ecr 4294890357,mptcp dss ack 2843715367 seq 3759592437 subseq 451249 len 1428 csum 0x228a], length 1428
10:30:07.204239 IP 112.26.3.8.40113 > 112.26.3.1.46615: Flags [.], ack 452677, win 24099, options [nop,nop,TS val 4294891149 ecr 136679,mptcp dss ack 3759503901], length 0
10:30:07.258499 IP 112.26.3.8.40113 > 112.26.3.1.46615: Flags [.], ack 452677, win 24099, options [nop,nop,TS val 4294891149 ecr 136679,mptcp dss ack 3759503901], length 0
10:30:07.283470 IP 112.26.3.1.46615 > 112.26.3.8.40113: Flags [.], seq 452677:454105, ack 1, win 4017, options [nop,nop,TS val 136806 ecr 4294890468,mptcp dss ack 2843715367 seq 3759595293 subseq 452677 len 1428 csum 0xeef1], length 1428
10:30:07.283844 IP 112.26.3.8.40113 > 112.26.3.1.46615: Flags [.], ack 454105, win 24099, options [nop,nop,TS val 4294891228 ecr 136806,mptcp dss ack 3759503901], length 0
10:30:07.349774 IP 112.26.3.8.40113 > 112.26.3.1.46615: Flags [.], ack 454105, win 24099, options [nop,nop,TS val 4294891228 ecr 136806,mptcp dss ack 3759503901], length 0
10:30:07.402673 IP 112.26.3.1.46615 > 112.26.3.8.40113: Flags [.], seq 454105:455533, ack 1, win 4017, options [nop,nop,TS val 136950 ecr 4294890563,mptcp dss ack 2843715367 seq 3759596721 subseq 454105 len 1428 csum 0x9810], length 1428
10:30:07.403035 IP 112.26.3.8.40113 > 112.26.3.1.46615: Flags [.], ack 455533, win 23921, options [nop,nop,TS val 4294891347 ecr 136950,mptcp dss ack 3759515325], length 0
10:30:07.436529 IP 112.26.3.8.40113 > 112.26.3.1.46615: Flags [.], ack 455533, win 23921, options [nop,nop,TS val 4294891347 ecr 136950,mptcp dss ack 3759515325], length 0
10:30:07.463776 IP 112.26.3.1.46615 > 112.26.3.8.40113: Flags [.], seq 455533:456961, ack 1, win 4017, options [nop,nop,TS val 137066 ecr 4294890686,mptcp dss ack 2843715367 seq 3759601005 subseq 455533 len 1428 csum 0x28f2], length 1428
10:30:07.464124 IP 112.26.3.8.40113 > 112.26.3.1.46615: Flags [.], ack 456961, win 23921, options [nop,nop,TS val 4294891408 ecr 137066,mptcp dss ack 3759515325], length 0
10:30:07.530096 IP 112.26.3.1.46615 > 112.26.3.8.40113: Flags [.], seq 456961:458389, ack 1, win 4017, options [nop,nop,TS val 137180 ecr 4294890812,mptcp dss ack 2843715367 seq 3759603861 subseq 456961 len 1428 csum 0xc49b], length 1428
10:30:07.530449 IP 112.26.3.8.40113 > 112.26.3.1.46615: Flags [.], ack 458389, win 23921, options [nop,nop,TS val 4294891475 ecr 137180,mptcp dss ack 3759515325], length 0
10:30:07.565047 IP 112.26.3.8.40113 > 112.26.3.1.46615: Flags [.], ack 456961, win 23921, options [nop,nop,TS val 4294891408 ecr 137066,mptcp dss ack 3759515325], length 0
10:30:07.643802 IP 112.26.3.1.46615 > 112.26.3.8.40113: Flags [.], seq 458389:459817, ack 1, win 4017, options [nop,nop,TS val 137217 ecr 4294890912,mptcp dss ack 2843715367 seq 3759605289 subseq 458389 len 1428 csum 0xff7b], length 1428
10:30:07.644149 IP 112.26.3.8.40113 > 112.26.3.1.46615: Flags [.], ack 459817, win 23921, options [nop,nop,TS val 4294891588 ecr 137217,mptcp dss ack 3759515325], length 0
10:30:07.666692 IP 112.26.3.8.40113 > 112.26.3.1.46615: Flags [.], ack 458389, win 23921, options [nop,nop,TS val 4294891475 ecr 137180,mptcp dss ack 3759515325], length 0
10:30:07.755660 IP 112.26.3.1.46615 > 112.26.3.8.40113: Flags [.], seq 459817:461245, ack 1, win 4017, options [nop,nop,TS val 137217 ecr 4294890912,mptcp dss ack 2843715367 seq 3759606717 subseq 459817 len 1428 csum 0xb3eb], length 1428
10:30:07.755969 IP 112.26.3.8.40113 > 112.26.3.1.46615: Flags [.], ack 461245, win 23921, options [nop,nop,TS val 4294891701 ecr 137217,mptcp dss ack 3759515325], length 0
10:30:07.774178 IP 112.26.3.8.40113 > 112.26.3.1.46615: Flags [.], ack 459817, win 23921, options [nop,nop,TS val 4294891588 ecr 137217,mptcp dss ack 3759515325], length 0
10:30:07.848772 IP 112.26.3.8.40113 > 112.26.3.1.46615: Flags [.], ack 461245, win 23921, options [nop,nop,TS val 4294891701 ecr 137217,mptcp dss ack 3759515325], length 0
10:30:07.861917 IP 112.26.3.1.46615 > 112.26.3.8.40113: Flags [.], seq 461245:462673, ack 1, win 4017, options [nop,nop,TS val 137290 ecr 4294891040,mptcp dss ack 2843715367 seq 3759609573 subseq 461245 len 1428 csum 0x8cdf], length 1428
10:30:07.862177 IP 112.26.3.8.40113 > 112.26.3.1.46615: Flags [.], ack 462673, win 23921, options [nop,nop,TS val 4294891807 ecr 137290,mptcp dss ack 3759515325], length 0
10:30:07.968345 IP 112.26.3.1.46615 > 112.26.3.8.40113: Flags [.], seq 462673:464101, ack 1, win 4017, options [nop,nop,TS val 137412 ecr 4294891149,mptcp dss ack 2843715367 seq 3759612429 subseq 462673 len 1428 csum 0x571f], length 1428
10:30:07.968675 IP 112.26.3.8.40113 > 112.26.3.1.46615: Flags [.], ack 464101, win 23921, options [nop,nop,TS val 4294891914 ecr 137412,mptcp dss ack 3759515325], length 0
10:30:07.998391 IP 112.26.3.8.40113 > 112.26.3.1.46615: Flags [.], ack 462673, win 23921, options [nop,nop,TS val 4294891807 ecr 137290,mptcp dss ack 3759515325], length 0
10:30:08.056766 IP 112.26.3.1.46615 > 112.26.3.8.40113: Flags [.], seq 464101:465529, ack 1, win 4017, options [nop,nop,TS val 137470 ecr 4294891228,mptcp dss ack 2843715367 seq 3759615285 subseq 464101 len 1428 csum 0xb40e], length 1428
10:30:08.056990 IP 112.26.3.8.40113 > 112.26.3.1.46615: Flags [.], ack 465529, win 23921, options [nop,nop,TS val 4294892002 ecr 137470,mptcp dss ack 3759515325], length 0
10:30:08.101861 IP 112.26.3.8.40113 > 112.26.3.1.46615: Flags [.], ack 464101, win 23921, options [nop,nop,TS val 4294891914 ecr 137412,mptcp dss ack 3759515325], length 0
10:30:08.116039 IP 112.26.3.1.46615 > 112.26.3.8.40113: Flags [.], seq 465529:466957, ack 1, win 4017, options [nop,nop,TS val 137470 ecr 4294891228,mptcp dss ack 2843715367 seq 3759616713 subseq 465529 len 1428 csum 0xa4a3], length 1428
10:30:08.116377 IP 112.26.3.8.40113 > 112.26.3.1.46615: Flags [.], ack 466957, win 23921, options [nop,nop,TS val 4294892061 ecr 137470,mptcp dss ack 3759515325], length 0
10:30:08.164017 IP 112.26.3.8.40113 > 112.26.3.1.46615: Flags [.], ack 465529, win 23921, options [nop,nop,TS val 4294892002 ecr 137470,mptcp dss ack 3759515325], length 0
10:30:08.203932 IP 112.26.3.1.46615 > 112.26.3.8.40113: Flags [.], seq 466957:468385, ack 1, win 4017, options [nop,nop,TS val 137608 ecr 4294891347,mptcp dss ack 2843715367 seq 3759633849 subseq 466957 len 1428 csum 0x897], length 1428
10:30:08.204278 IP 112.26.3.8.40113 > 112.26.3.1.46615: Flags [.], ack 468385, win 23921, options [nop,nop,TS val 4294892149 ecr 137608,mptcp dss ack 3759515325], length 0
10:30:08.278947 IP 112.26.3.8.40113 > 112.26.3.1.46615: Flags [.], ack 466957, win 23921, options [nop,nop,TS val 4294892061 ecr 137470,mptcp dss ack 3759515325], length 0
10:30:08.315885 IP 112.26.3.1.46615 > 112.26.3.8.40113: Flags [.], seq 468385:469813, ack 1, win 4017, options [nop,nop,TS val 137742 ecr 4294891408,mptcp dss ack 2843715367 seq 3759646701 subseq 468385 len 1428 csum 0xf027], length 1428
10:30:08.316227 IP 112.26.3.8.40113 > 112.26.3.1.46615: Flags [.], ack 469813, win 23921, options [nop,nop,TS val 4294892261 ecr 137742,mptcp dss ack 3759515325], length 0
10:30:08.390358 IP 112.26.3.8.40113 > 112.26.3.1.46615: Flags [.], ack 468385, win 23921, options [nop,nop,TS val 4294892149 ecr 137608,mptcp dss ack 3759515325], length 0
10:30:08.412627 IP 112.26.3.1.46615 > 112.26.3.8.40113: Flags [.], seq 469813:471241, ack 1, win 4017, options [nop,nop,TS val 137841 ecr 4294891475,mptcp dss ack 2843715367 seq 3759649557 subseq 469813 len 1428 csum 0xf82b], length 1428
10:30:08.453753 IP 112.26.3.8.40113 > 112.26.3.1.46615: Flags [.], ack 471241, win 23921, options [nop,nop,TS val 4294892399 ecr 137841,mptcp dss ack 3759515325], length 0
10:30:08.454119 IP 112.26.3.8.40113 > 112.26.3.1.46615: Flags [.], ack 469813, win 23921, options [nop,nop,TS val 4294892261 ecr 137742,mptcp dss ack 3759515325], length 0
10:30:08.502687 IP 112.26.3.1.46615 > 112.26.3.8.40113: Flags [.], seq 471241:472669, ack 1, win 4017, options [nop,nop,TS val 137947 ecr 4294891588,mptcp dss ack 2843715367 seq 3759650985 subseq 471241 len 1428 csum 0x8985], length 1428
10:30:08.566676 IP 112.26.3.8.40113 > 112.26.3.1.46615: Flags [.], ack 471241, win 23921, options [nop,nop,TS val 4294892399 ecr 137841,mptcp dss ack 3759515325], length 0
10:30:08.584750 IP 112.26.3.1.46615 > 112.26.3.8.40113: Flags [.], seq 472669:474097, ack 1, win 4017, options [nop,nop,TS val 137947 ecr 4294891588,mptcp dss ack 2843715367 seq 3759652413 subseq 472669 len 1428 csum 0xfa2e], length 1428
10:30:08.585092 IP 112.26.3.8.40113 > 112.26.3.1.46615: Flags [.], ack 474097, win 23921, options [nop,nop,TS val 4294892530 ecr 137947,mptcp dss ack 3759515325], length 0
10:30:08.660338 IP 112.26.3.8.40113 > 112.26.3.1.46615: Flags [.], ack 474097, win 23921, options [nop,nop,TS val 4294892530 ecr 137947,mptcp dss ack 3759515325], length 0
10:30:08.696367 IP 112.26.3.1.46615 > 112.26.3.8.40113: Flags [.], seq 474097:475525, ack 1, win 4017, options [nop,nop,TS val 138044 ecr 4294891701,mptcp dss ack 2843715367 seq 3759656697 subseq 474097 len 1428 csum 0x9bb5], length 1428
10:30:08.772358 IP 112.26.3.1.46615 > 112.26.3.8.40113: Flags [.], seq 475525:476953, ack 1, win 4017, options [nop,nop,TS val 138184 ecr 4294891807,mptcp dss ack 2843715367 seq 3759663837 subseq 475525 len 1428 csum 0xbc7d], length 1428
10:30:08.772736 IP 112.26.3.8.40113 > 112.26.3.1.46615: Flags [.], ack 476953, win 23921, options [nop,nop,TS val 4294892717 ecr 138044,mptcp dss ack 3759515325], length 0
10:30:08.779555 IP 112.26.3.8.40113 > 112.26.3.1.46615: Flags [.], ack 476953, win 23921, options [nop,nop,TS val 4294892717 ecr 138044,mptcp dss ack 3759515325], length 0
10:30:08.854723 IP 112.26.3.1.46615 > 112.26.3.8.40113: Flags [.], seq 476953:478381, ack 1, win 4017, options [nop,nop,TS val 138368 ecr 4294891914,mptcp dss ack 2843715367 seq 3759666693 subseq 476953 len 1428 csum 0x684e], length 1428
10:30:08.940025 IP 112.26.3.1.46615 > 112.26.3.8.40113: Flags [.], seq 478381:479809, ack 1, win 4017, options [nop,nop,TS val 138472 ecr 4294892002,mptcp dss ack 2843715367 seq 3759668121 subseq 478381 len 1428 csum 0xa0ef], length 1428
10:30:08.999066 IP 112.26.3.8.40113 > 112.26.3.1.46615: Flags [.], ack 479809, win 23921, options [nop,nop,TS val 4294892944 ecr 138368,mptcp dss ack 3759515325], length 0
10:30:09.002168 IP 112.26.3.8.40113 > 112.26.3.1.46615: Flags [.], ack 479809, win 23921, options [nop,nop,TS val 4294892944 ecr 138368,mptcp dss ack 3759515325], length 0
10:30:09.027569 IP 112.26.3.1.46615 > 112.26.3.8.40113: Flags [.], seq 479809:481237, ack 1, win 4017, options [nop,nop,TS val 138472 ecr 4294892002,mptcp dss ack 2843715367 seq 3759669549 subseq 479809 len 1428 csum 0x8dc5], length 1428
10:30:09.087999 IP 112.26.3.1.46615 > 112.26.3.8.40113: Flags [.], seq 481237:482665, ack 1, win 4017, options [nop,nop,TS val 138641 ecr 4294892061,mptcp dss ack 2843715367 seq 3759676689 subseq 481237 len 1428 csum 0x418a], length 1428
10:30:09.167717 IP 112.26.3.8.40113 > 112.26.3.1.46615: Flags [.], ack 482665, win 23751, options [nop,nop,TS val 4294893112 ecr 138472,mptcp dss ack 3759591009], length 0
10:30:09.171549 IP 112.26.3.8.40113 > 112.26.3.1.46615: Flags [.], ack 482665, win 23751, options [nop,nop,TS val 4294893112 ecr 138472,mptcp dss ack 3759591009], length 0
10:30:09.210756 IP 112.26.3.1.46615 > 112.26.3.8.40113: Flags [.], seq 482665:484093, ack 1, win 4017, options [nop,nop,TS val 138752 ecr 4294892149,mptcp dss ack 2843715367 seq 3759679545 subseq 482665 len 1428 csum 0x347b], length 1428
10:30:09.324323 IP 112.26.3.1.46615 > 112.26.3.8.40113: Flags [.], seq 484093:485521, ack 1, win 4017, options [nop,nop,TS val 138831 ecr 4294892261,mptcp dss ack 2843715367 seq 3759682401 subseq 484093 len 1428 csum 0xf8ad], length 1428
10:30:09.324686 IP 112.26.3.8.40113 > 112.26.3.1.46615: Flags [.], ack 485521, win 24125, options [nop,nop,TS val 4294893269 ecr 138752,mptcp dss ack 3759630993], length 0
10:30:09.327971 IP 112.26.3.8.40113 > 112.26.3.1.46615: Flags [.], ack 485521, win 24125, options [nop,nop,TS val 4294893269 ecr 138752,mptcp dss ack 3759630993], length 0
10:30:09.416501 IP 112.26.3.1.46615 > 112.26.3.8.40113: Flags [.], seq 485521:486949, ack 1, win 4017, options [nop,nop,TS val 138946 ecr 4294892399,mptcp dss ack 2843715367 seq 3759688113 subseq 485521 len 1428 csum 0xdf48], length 1428
10:30:09.475744 IP 112.26.3.1.46615 > 112.26.3.8.40113: Flags [.], seq 486949:488377, ack 1, win 4017, options [nop,nop,TS val 139029 ecr 4294892530,mptcp dss ack 2843715367 seq 3759689541 subseq 486949 len 1428 csum 0x9ec9], length 1428
10:30:09.553294 IP 112.26.3.1.46615 > 112.26.3.8.40113: Flags [.], seq 488377:489805, ack 1, win 4017, options [nop,nop,TS val 139029 ecr 4294892530,mptcp dss ack 2843715367 seq 3759690969 subseq 488377 len 1428 csum 0x13bb], length 1428
10:30:09.622831 IP 112.26.3.8.40113 > 112.26.3.1.46615: Flags [.], ack 489805, win 24125, options [nop,nop,TS val 4294893568 ecr 138946,mptcp dss ack 3759630993], length 0
10:30:09.630767 IP 112.26.3.8.40113 > 112.26.3.1.46615: Flags [.], ack 489805, win 24125, options [nop,nop,TS val 4294893568 ecr 138946,mptcp dss ack 3759630993], length 0
10:30:09.656558 IP 112.26.3.1.46615 > 112.26.3.8.40113: Flags [.], seq 489805:491233, ack 1, win 4017, options [nop,nop,TS val 139116 ecr 4294892717,mptcp dss ack 2843715367 seq 3759698109 subseq 489805 len 1428 csum 0xfff0], length 1428
10:30:09.737857 IP 112.26.3.1.46615 > 112.26.3.8.40113: Flags [.], seq 491233:492661, ack 1, win 4017, options [nop,nop,TS val 139116 ecr 4294892717,mptcp dss ack 2843715367 seq 3759699537 subseq 491233 len 1428 csum 0xc48e], length 1428
10:30:09.818919 IP 112.26.3.1.46615 > 112.26.3.8.40113: Flags [.], seq 492661:494089, ack 1, win 4017, options [nop,nop,TS val 139235 ecr 4294892944,mptcp dss ack 2843715367 seq 3759702393 subseq 492661 len 1428 csum 0xcb8e], length 1428
10:30:09.895795 IP 112.26.3.1.46615 > 112.26.3.8.40113: Flags [.], seq 494089:495517, ack 1, win 4017, options [nop,nop,TS val 139235 ecr 4294892944,mptcp dss ack 2843715367 seq 3759703821 subseq 494089 len 1428 csum 0x7359], length 1428
10:30:09.896157 IP 112.26.3.8.40113 > 112.26.3.1.46615: Flags [.], ack 495517, win 24125, options [nop,nop,TS val 4294893841 ecr 139116,mptcp dss ack 3759630993], length 0
10:30:09.902525 IP 112.26.3.8.40113 > 112.26.3.1.46615: Flags [.], ack 495517, win 24125, options [nop,nop,TS val 4294893841 ecr 139116,mptcp dss ack 3759630993], length 0
10:30:09.982705 IP 112.26.3.1.46615 > 112.26.3.8.40113: Flags [.], seq 495517:496945, ack 1, win 4017, options [nop,nop,TS val 139346 ecr 4294893112,mptcp dss ack 2843715367 seq 3759706677 subseq 495517 len 1428 csum 0x803e], length 1428
10:30:10.061149 IP 112.26.3.1.46615 > 112.26.3.8.40113: Flags [.], seq 496945:498373, ack 1, win 4017, options [nop,nop,TS val 139346 ecr 4294893112,mptcp dss ack 2843715367 seq 3759708105 subseq 496945 len 1428 csum 0xd3ec], length 1428
10:30:10.120701 IP 112.26.3.1.46615 > 112.26.3.8.40113: Flags [.], seq 498373:499801, ack 1, win 4017, options [nop,nop,TS val 139348 ecr 4294893112,mptcp dss ack 2843715367 seq 3759709533 subseq 498373 len 1428 csum 0xec41], length 1428
10:30:10.121058 IP 112.26.3.8.40113 > 112.26.3.1.46615: Flags [.], ack 499801, win 24059, options [nop,nop,TS val 4294894066 ecr 139346,mptcp dss ack 3759635277], length 0
10:30:10.126963 IP 112.26.3.8.40113 > 112.26.3.1.46615: Flags [.], ack 499801, win 24059, options [nop,nop,TS val 4294894066 ecr 139346,mptcp dss ack 3759635277], length 0
10:30:10.237098 IP 112.26.3.1.46615 > 112.26.3.8.40113: Flags [.], seq 501229:502657, ack 1, win 4017, options [nop,nop,TS val 139457 ecr 4294893269,mptcp dss ack 2843715367 seq 3759713817 subseq 501229 len 1428 csum 0x515f], length 1428
10:30:10.237437 IP 112.26.3.8.40113 > 112.26.3.1.46615: Flags [.], ack 499801, win 23993, options [nop,nop,TS val 4294894182 ecr 139346,nop,nop,sack 1 {501229:502657},mptcp dss ack 3759639561], length 0
10:30:10.245249 IP 112.26.3.8.40113 > 112.26.3.1.46615: Flags [.], ack 499801, win 23993, options [nop,nop,TS val 4294894182 ecr 139346,nop,nop,sack 1 {501229:502657},mptcp dss ack 3759639561], length 0
10:30:10.333721 IP 112.26.3.1.46615 > 112.26.3.8.40113: Flags [.], seq 502657:504085, ack 1, win 4017, options [nop,nop,TS val 139750 ecr 4294893568,mptcp dss ack 2843715367 seq 3759729525 subseq 502657 len 1428 csum 0x6466], length 1428
10:30:10.334028 IP 112.26.3.8.40113 > 112.26.3.1.46615: Flags [.], ack 499801, win 23971, options [nop,nop,TS val 4294894278 ecr 139346,nop,nop,sack 1 {501229:504085},mptcp dss ack 3759640989], length 0
10:30:10.337499 IP 112.26.3.8.40113 > 112.26.3.1.46615: Flags [.], ack 499801, win 23971, options [nop,nop,TS val 4294894278 ecr 139346,nop,nop,sack 1 {501229:504085},mptcp dss ack 3759640989], length 0
10:30:10.473379 IP 112.26.3.1.46615 > 112.26.3.8.40113: Flags [.], seq 505513:506941, ack 1, win 4017, options [nop,nop,TS val 139750 ecr 4294893568,mptcp dss ack 2843715367 seq 3759732381 subseq 505513 len 1428 csum 0x1bc2], length 1428
10:30:10.473750 IP 112.26.3.8.40113 > 112.26.3.1.46615: Flags [.], ack 499801, win 23949, options [nop,nop,TS val 4294894418 ecr 139346,nop,nop,sack 2 {505513:506941}{501229:504085},mptcp dss ack 3759642417], length 0
10:30:10.480471 IP 112.26.3.8.40113 > 112.26.3.1.46615: Flags [.], ack 499801, win 23949, options [nop,nop,TS val 4294894418 ecr 139346,nop,nop,sack 2 {505513:506941}{501229:504085},mptcp dss ack 3759642417], length 0
10:30:10.590644 IP 112.26.3.1.46615 > 112.26.3.8.40113: Flags [.], seq 506941:508369, ack 1, win 4017, options [nop,nop,TS val 140024 ecr 4294893841,mptcp dss ack 2843715367 seq 3759748089 subseq 506941 len 1428 csum 0xb65a], length 1428
10:30:10.590948 IP 112.26.3.8.40113 > 112.26.3.1.46615: Flags [.], ack 499801, win 24383, options [nop,nop,TS val 4294894535 ecr 139346,nop,nop,sack 2 {505513:508369}{501229:504085},mptcp dss ack 3759712389], length 0
10:30:10.594701 IP 112.26.3.8.40113 > 112.26.3.1.46615: Flags [.], ack 499801, win 24383, options [nop,nop,TS val 4294894535 ecr 139346,nop,nop,sack 2 {505513:508369}{501229:504085},mptcp dss ack 3759712389], length 0
10:30:10.707331 IP 112.26.3.1.46615 > 112.26.3.8.40113: Flags [.], seq 508369:509797, ack 1, win 4017, options [nop,nop,TS val 140024 ecr 4294893841,mptcp dss ack 2843715367 seq 3759749517 subseq 508369 len 1428 csum 0x8069], length 1428
10:30:10.707653 IP 112.26.3.8.40113 > 112.26.3.1.46615: Flags [.], ack 499801, win 24383, options [nop,nop,TS val 4294894652 ecr 139346,nop,nop,sack 2 {505513:509797}{501229:504085},mptcp dss ack 3759712389], length 0
10:30:10.728210 IP 112.26.3.8.40113 > 112.26.3.1.46615: Flags [.], ack 499801, win 24383, options [nop,nop,TS val 4294894652 ecr 139346,nop,nop,sack 2 {505513:509797}{501229:504085},mptcp dss ack 3759712389], length 0
10:30:10.802790 IP 112.26.3.1.46615 > 112.26.3.8.40113: Flags [.], seq 509797:511225, ack 1, win 4017, options [nop,nop,TS val 140024 ecr 4294893841,mptcp dss ack 2843715367 seq 3759750945 subseq 509797 len 1428 csum 0xb2d8], length 1428
10:30:10.803122 IP 112.26.3.8.40113 > 112.26.3.1.46615: Flags [.], ack 499801, win 24383, options [nop,nop,TS val 4294894748 ecr 139346,nop,nop,sack 2 {505513:511225}{501229:504085},mptcp dss ack 3759712389], length 0
10:30:10.831054 IP 112.26.3.8.40113 > 112.26.3.1.46615: Flags [.], ack 499801, win 24383, options [nop,nop,TS val 4294894748 ecr 139346,nop,nop,sack 2 {505513:511225}{501229:504085},mptcp dss ack 3759712389], length 0
10:30:10.922925 IP 112.26.3.1.46615 > 112.26.3.8.40113: Flags [.], seq 511225:512653, ack 1, win 4017, options [nop,nop,TS val 140024 ecr 4294893841,mptcp dss ack 2843715367 seq 3759752373 subseq 511225 len 1428 csum 0xffed], length 1428
10:30:10.923279 IP 112.26.3.8.40113 > 112.26.3.1.46615: Flags [.], ack 499801, win 24383, options [nop,nop,TS val 4294894868 ecr 139346,nop,nop,sack 2 {505513:512653}{501229:504085},mptcp dss ack 3759712389], length 0
10:30:10.944038 IP 112.26.3.8.40113 > 112.26.3.1.46615: Flags [.], ack 499801, win 24383, options [nop,nop,TS val 4294894868 ecr 139346,nop,nop,sack 2 {505513:512653}{501229:504085},mptcp dss ack 3759712389], length 0
10:30:11.012793 IP 112.26.3.1.46615 > 112.26.3.8.40113: Flags [.], seq 512653:514081, ack 1, win 4017, options [nop,nop,TS val 140251 ecr 4294894066,mptcp dss ack 2843715367 seq 3759763797 subseq 512653 len 1428 csum 0xcf57], length 1428
10:30:11.013158 IP 112.26.3.8.40113 > 112.26.3.1.46615: Flags [.], ack 499801, win 24383, options [nop,nop,TS val 4294894958 ecr 139346,nop,nop,sack 2 {505513:514081}{501229:504085},mptcp dss ack 3759712389], length 0
10:30:11.063767 IP 112.26.3.1.46615 > 112.26.3.8.40113: Flags [.], seq 514081:515509, ack 1, win 4017, options [nop,nop,TS val 140251 ecr 4294894066,mptcp dss ack 2843715367 seq 3759765225 subseq 514081 len 1428 csum 0xad02], length 1428
10:30:11.064122 IP 112.26.3.8.40113 > 112.26.3.1.46615: Flags [.], ack 499801, win 24383, options [nop,nop,TS val 4294895009 ecr 139346,nop,nop,sack 2 {505513:515509}{501229:504085},mptcp dss ack 3759712389], length 0
10:30:11.076568 IP 112.26.3.8.40113 > 112.26.3.1.46615: Flags [.], ack 499801, win 24383, options [nop,nop,TS val 4294894958 ecr 139346,nop,nop,sack 2 {505513:514081}{501229:504085},mptcp dss ack 3759712389], length 0
10:30:11.165715 IP 112.26.3.8.40113 > 112.26.3.1.46615: Flags [.], ack 499801, win 24383, options [nop,nop,TS val 4294895009 ecr 139346,nop,nop,sack 2 {505513:515509}{501229:504085},mptcp dss ack 3759712389], length 0
10:30:11.177807 IP 112.26.3.1.46615 > 112.26.3.8.40113: Flags [.], seq 515509:516937, ack 1, win 4017, options [nop,nop,TS val 140251 ecr 4294894066,mptcp dss ack 2843715367 seq 3759766653 subseq 515509 len 1428 csum 0x6c8e], length 1428
10:30:11.178136 IP 112.26.3.8.40113 > 112.26.3.1.46615: Flags [.], ack 499801, win 24383, options [nop,nop,TS val 4294895123 ecr 139346,nop,nop,sack 2 {505513:516937}{501229:504085},mptcp dss ack 3759712389], length 0
10:30:11.242508 IP 112.26.3.8.40113 > 112.26.3.1.46615: Flags [.], ack 499801, win 24383, options [nop,nop,TS val 4294895123 ecr 139346,nop,nop,sack 2 {505513:516937}{501229:504085},mptcp dss ack 3759712389], length 0
10:30:11.272914 IP 112.26.3.1.46615 > 112.26.3.8.40113: Flags [.], seq 518365:519793, ack 1, win 4017, options [nop,nop,TS val 140600 ecr 4294894278,mptcp dss ack 2843715367 seq 3759772365 subseq 518365 len 1428 csum 0x1358], length 1428
10:30:11.273272 IP 112.26.3.8.40113 > 112.26.3.1.46615: Flags [.], ack 499801, win 24383, options [nop,nop,TS val 4294895218 ecr 139346,nop,nop,sack 2 {518365:519793}{505513:516937},mptcp dss ack 3759712389], length 0
10:30:11.322674 IP 112.26.3.8.40113 > 112.26.3.1.46615: Flags [.], ack 499801, win 24383, options [nop,nop,TS val 4294895218 ecr 139346,nop,nop,sack 2 {518365:519793}{505513:516937},mptcp dss ack 3759712389], length 0
10:30:11.362648 IP 112.26.3.1.46615 > 112.26.3.8.40113: Flags [.], seq 499801:501229, ack 1, win 4017, options [nop,nop,TS val 140603 ecr 4294894418,mptcp dss ack 2843715367 seq 3759712389 subseq 499801 len 1428 csum 0xb238], length 1428
10:30:11.363012 IP 112.26.3.8.40113 > 112.26.3.1.46615: Flags [.], ack 504085, win 24127, options [nop,nop,TS val 4294895308 ecr 140603,nop,nop,sack 2 {518365:519793}{505513:516937},mptcp dss ack 3759730953], length 0
10:30:11.402517 IP 112.26.3.8.40113 > 112.26.3.1.46615: Flags [.], ack 504085, win 24127, options [nop,nop,TS val 4294895308 ecr 140603,nop,nop,sack 2 {518365:519793}{505513:516937},mptcp dss ack 3759730953], length 0
10:30:11.483312 IP 112.26.3.1.46615 > 112.26.3.8.40113: Flags [.], seq 519793:521221, ack 1, win 4017, options [nop,nop,TS val 141140 ecr 4294894868,mptcp dss ack 2843715367 seq 3759790929 subseq 519793 len 1428 csum 0x3a73], length 1428
10:30:11.483684 IP 112.26.3.8.40113 > 112.26.3.1.46615: Flags [.], ack 504085, win 24331, options [nop,nop,TS val 4294895429 ecr 140603,nop,nop,sack 2 {518365:521221}{505513:516937},mptcp dss ack 3759730953], length 0
10:30:11.495061 IP 112.26.3.8.40113 > 112.26.3.1.46615: Flags [.], ack 504085, win 24331, options [nop,nop,TS val 4294895429 ecr 140603,nop,nop,sack 2 {518365:521221}{505513:516937},mptcp dss ack 3759730953], length 0
10:30:11.591363 IP 112.26.3.1.46615 > 112.26.3.8.40113: Flags [.], seq 521221:522649, ack 1, win 4017, options [nop,nop,TS val 141221 ecr 4294894958,mptcp dss ack 2843715367 seq 3759799497 subseq 521221 len 1428 csum 0x1d75], length 1428
10:30:11.591725 IP 112.26.3.8.40113 > 112.26.3.1.46615: Flags [.], ack 504085, win 24331, options [nop,nop,TS val 4294895537 ecr 140603,nop,nop,sack 2 {518365:522649}{505513:516937},mptcp dss ack 3759730953], length 0
10:30:11.617635 IP 112.26.3.8.40113 > 112.26.3.1.46615: Flags [.], ack 504085, win 24331, options [nop,nop,TS val 4294895537 ecr 140603,nop,nop,sack 2 {518365:522649}{505513:516937},mptcp dss ack 3759730953], length 0
10:30:11.683255 IP 112.26.3.1.46615 > 112.26.3.8.40113: Flags [.], seq 522649:524077, ack 1, win 4017, options [nop,nop,TS val 141384 ecr 4294895009,mptcp dss ack 2843715367 seq 3759805209 subseq 522649 len 1428 csum 0x17ab], length 1428
10:30:11.683620 IP 112.26.3.8.40113 > 112.26.3.1.46615: Flags [.], ack 504085, win 24331, options [nop,nop,TS val 4294895628 ecr 140603,nop,nop,sack 2 {518365:524077}{505513:516937},mptcp dss ack 3759730953], length 0
10:30:11.700815 IP 112.26.3.8.40113 > 112.26.3.1.46615: Flags [.], ack 504085, win 24331, options [nop,nop,TS val 4294895628 ecr 140603,nop,nop,sack 2 {518365:524077}{505513:516937},mptcp dss ack 3759730953], length 0
10:30:11.741215 IP 112.26.3.1.46615 > 112.26.3.8.40113: Flags [.], seq 524077:525505, ack 1, win 4017, options [nop,nop,TS val 141510 ecr 4294895123,mptcp dss ack 2843715367 seq 3759815205 subseq 524077 len 1428 csum 0xfe65], length 1428
10:30:11.741435 IP 112.26.3.8.40113 > 112.26.3.1.46615: Flags [.], ack 504085, win 24331, options [nop,nop,TS val 4294895686 ecr 140603,nop,nop,sack 2 {518365:525505}{505513:516937},mptcp dss ack 3759730953], length 0
