10:29:33.141305 IP 112.26.2.8.43407 > 112.26.2.1.46615: Flags [S], seq 1007811304, win 65535, options [mss 1460,sackOK,TS val 4294857066 ecr 0,nop,wscale 6,mptcp join id 4 token 0x9485611f nonce 0xdb53f955], length 0
10:29:33.210088 IP 112.26.2.8.43407 > 112.26.2.1.46615: Flags [S], seq 1007811304, win 65535, options [mss 1460,sackOK,TS val 4294857066 ecr 0,nop,wscale 6,mptcp join id 4 token 0x9485611f nonce 0xdb53f955], length 0
10:29:33.378552 IP 112.26.2.1.46615 > 112.26.2.8.43407: Flags [S.], seq 2180547765, ack 1007811305, win 65535, options [mss 1460,sackOK,TS val 103396 ecr 4294857066,nop,wscale 6,mptcp join id 6 hmac 0x9c349290b4de3414 nonce 0x7aa66214], length 0
10:29:33.378845 IP 112.26.2.8.43407 > 112.26.2.1.46615: Flags [.], ack 1, win 6023, options [nop,nop,TS val 4294857324 ecr 103396,mptcp join hmac 0xe88f19a8618c43065376f6b8139f816ffacca173], length 0
10:29:33.451139 IP 112.26.2.8.43407 > 112.26.2.1.46615: Flags [.], ack 1, win 6023, options [nop,nop,TS val 4294857324 ecr 103396,mptcp join hmac 0xe88f19a8618c43065376f6b8139f816ffacca173], length 0
10:29:33.565534 IP 112.26.2.1.46615 > 112.26.2.8.43407: Flags [.], ack 1, win 2678, options [nop,nop,TS val 103571 ecr 4294857324,mptcp dss ack 2843715367], length 0
10:29:33.655890 IP 112.26.2.1.46615 > 112.26.2.8.43407: Flags [.], seq 1:1429, ack 1, win 2678, options [nop,nop,TS val 103572 ecr 4294857324,mptcp dss ack 2843715367 seq 3758211561 subseq 1 len 1428 csum 0xdb44], length 1428
10:30:09.443377 IP 112.26.2.1.46615 > 112.26.2.8.43407: Flags [.], seq 341293:342721, ack 1, win 4017, options [nop,nop,TS val 138930 ecr 4294891962,mptcp dss ack 2843715367 seq 3759685257 subseq 341293 len 1428 csum 0x8c1e], length 1428
10:30:09.443689 IP 112.26.2.8.43407 > 112.26.2.1.46615: Flags [.], ack 342721, win 24125, options [nop,nop,TS val 4294893388 ecr 138930,mptcp dss ack 3759630993], length 0
10:30:09.512407 IP 112.26.2.8.43407 > 112.26.2.1.46615: Flags [.], ack 342721, win 24125, options [nop,nop,TS val 4294893388 ecr 138930,mptcp dss ack 3759630993], length 0
10:30:09.575233 IP 112.26.2.1.46615 > 112.26.2.8.43407: Flags [.], seq 342721:344149, ack 1, win 4017, options [nop,nop,TS val 139077 ecr 4294892118,mptcp dss ack 2843715367 seq 3759692397 subseq 342721 len 1428 csum 0x1eca], length 1428
10:30:09.575596 IP 112.26.2.8.43407 > 112.26.2.1.46615: Flags [.], ack 344149, win 24125, options [nop,nop,TS val 4294893520 ecr 139077,mptcp dss ack 3759630993], length 0
10:30:09.625695 IP 112.26.2.8.43407 > 112.26.2.1.46615: Flags [.], ack 344149, win 24125, options [nop,nop,TS val 4294893520 ecr 139077,mptcp dss ack 3759630993], length 0
10:30:09.698946 IP 112.26.2.1.46615 > 112.26.2.8.43407: Flags [.], seq 344149:345577, ack 1, win 4017, options [nop,nop,TS val 139233 ecr 4294892253,mptcp dss ack 2843715367 seq 3759700965 subseq 344149 len 1428 csum 0xc8d4], length 1428
10:30:09.699277 IP 112.26.2.8.43407 > 112.26.2.1.46615: Flags [.], ack 345577, win 24125, options [nop,nop,TS val 4294893644 ecr 139233,mptcp dss ack 3759630993], length 0
10:30:09.761824 IP 112.26.2.8.43407 > 112.26.2.1.46615: Flags [.], ack 345577, win 24125, options [nop,nop,TS val 4294893644 ecr 139233,mptcp dss ack 3759630993], length 0
10:30:09.820643 IP 112.26.2.1.46615 > 112.26.2.8.43407: Flags [.], seq 345577:347005, ack 1, win 4017, options [nop,nop,TS val 139346 ecr 4294892413,mptcp dss ack 2843715367 seq 3759705249 subseq 345577 len 1428 csum 0xfd94], length 1428
10:30:09.820931 IP 112.26.2.8.43407 > 112.26.2.1.46615: Flags [.], ack 347005, win 24125, options [nop,nop,TS val 4294893765 ecr 139346,mptcp dss ack 3759630993], length 0
10:30:09.886658 IP 112.26.2.8.43407 > 112.26.2.1.46615: Flags [.], ack 347005, win 24125, options [nop,nop,TS val 4294893765 ecr 139346,mptcp dss ack 3759630993], length 0
10:30:09.950474 IP 112.26.2.1.46615 > 112.26.2.8.43407: Flags [.], seq 347005:348433, ack 1, win 4017, options [nop,nop,TS val 139457 ecr 4294892588,mptcp dss ack 2843715367 seq 3759710961 subseq 347005 len 1428 csum 0x4972], length 1428
10:30:09.950819 IP 112.26.2.8.43407 > 112.26.2.1.46615: Flags [.], ack 348433, win 24125, options [nop,nop,TS val 4294893895 ecr 139457,mptcp dss ack 3759630993], length 0
10:30:10.002868 IP 112.26.2.8.43407 > 112.26.2.1.46615: Flags [.], ack 348433, win 24125, options [nop,nop,TS val 4294893895 ecr 139457,mptcp dss ack 3759630993], length 0
10:30:10.121388 IP 112.26.2.1.46615 > 112.26.2.8.43407: Flags [.], seq 348433:349861, ack 1, win 4017, options [nop,nop,TS val 139635 ecr 4294892703,mptcp dss ack 2843715367 seq 3759715245 subseq 348433 len 1428 csum 0x5b2f], length 1428
10:30:10.121618 IP 112.26.2.8.43407 > 112.26.2.1.46615: Flags [.], ack 349861, win 24059, options [nop,nop,TS val 4294894066 ecr 139635,mptcp dss ack 3759635277], length 0
10:30:10.176909 IP 112.26.2.8.43407 > 112.26.2.1.46615: Flags [.], ack 349861, win 24059, options [nop,nop,TS val 4294894066 ecr 139635,mptcp dss ack 3759635277], length 0
10:30:10.298907 IP 112.26.2.1.46615 > 112.26.2.8.43407: Flags [.], seq 349861:351289, ack 1, win 4017, options [nop,nop,TS val 139739 ecr 4294892850,mptcp dss ack 2843715367 seq 3759725241 subseq 349861 len 1428 csum 0xfb83], length 1428
10:30:10.299154 IP 112.26.2.8.43407 > 112.26.2.1.46615: Flags [.], ack 351289, win 23993, options [nop,nop,TS val 4294894244 ecr 139739,mptcp dss ack 3759639561], length 0
10:30:10.352275 IP 112.26.2.8.43407 > 112.26.2.1.46615: Flags [.], ack 351289, win 23993, options [nop,nop,TS val 4294894244 ecr 139739,mptcp dss ack 3759639561], length 0
10:30:10.413182 IP 112.26.2.1.46615 > 112.26.2.8.43407: Flags [.], seq 351289:352717, ack 1, win 4017, options [nop,nop,TS val 139862 ecr 4294893007,mptcp dss ack 2843715367 seq 3759738093 subseq 351289 len 1428 csum 0x645f], length 1428
10:30:10.413483 IP 112.26.2.8.43407 > 112.26.2.1.46615: Flags [.], ack 352717, win 23971, options [nop,nop,TS val 4294894358 ecr 139862,mptcp dss ack 3759640989], length 0
10:30:10.447633 IP 112.26.2.8.43407 > 112.26.2.1.46615: Flags [.], ack 352717, win 23971, options [nop,nop,TS val 4294894358 ecr 139862,mptcp dss ack 3759640989], length 0
10:30:10.516611 IP 112.26.2.1.46615 > 112.26.2.8.43407: Flags [.], seq 352717:354145, ack 1, win 4017, options [nop,nop,TS val 139862 ecr 4294893007,mptcp dss ack 2843715367 seq 3759739521 subseq 352717 len 1428 csum 0x6667], length 1428
10:30:10.516968 IP 112.26.2.8.43407 > 112.26.2.1.46615: Flags [.], ack 354145, win 23949, options [nop,nop,TS val 4294894461 ecr 139862,mptcp dss ack 3759642417], length 0
10:30:10.607068 IP 112.26.2.8.43407 > 112.26.2.1.46615: Flags [.], ack 354145, win 23949, options [nop,nop,TS val 4294894461 ecr 139862,mptcp dss ack 3759642417], length 0
10:30:10.683023 IP 112.26.2.1.46615 > 112.26.2.8.43407: Flags [.], seq 354145:355573, ack 1, win 4017, options [nop,nop,TS val 139984 ecr 4294893140,mptcp dss ack 2843715367 seq 3759746661 subseq 354145 len 1428 csum 0x563], length 1428
10:30:10.683367 IP 112.26.2.8.43407 > 112.26.2.1.46615: Flags [.], ack 355573, win 24383, options [nop,nop,TS val 4294894628 ecr 139984,mptcp dss ack 3759712389], length 0
10:30:10.746550 IP 112.26.2.8.43407 > 112.26.2.1.46615: Flags [.], ack 355573, win 24383, options [nop,nop,TS val 4294894628 ecr 139984,mptcp dss ack 3759712389], length 0
10:30:10.821475 IP 112.26.2.1.46615 > 112.26.2.8.43407: Flags [.], seq 355573:357001, ack 1, win 4017, options [nop,nop,TS val 140126 ecr 4294893261,mptcp dss ack 2843715367 seq 3759756657 subseq 355573 len 1428 csum 0x4244], length 1428
10:30:10.821824 IP 112.26.2.8.43407 > 112.26.2.1.46615: Flags [.], ack 357001, win 24383, options [nop,nop,TS val 4294894767 ecr 140126,mptcp dss ack 3759712389], length 0
10:30:10.895920 IP 112.26.2.1.46615 > 112.26.2.8.43407: Flags [.], seq 357001:358429, ack 1, win 4017, options [nop,nop,TS val 140126 ecr 4294893261,mptcp dss ack 2843715367 seq 3759758085 subseq 357001 len 1428 csum 0x235c], length 1428
10:30:10.896206 IP 112.26.2.8.43407 > 112.26.2.1.46615: Flags [.], ack 358429, win 24383, options [nop,nop,TS val 4294894841 ecr 140126,mptcp dss ack 3759712389], length 0
10:30:10.967255 IP 112.26.2.8.43407 > 112.26.2.1.46615: Flags [.], ack 357001, win 24383, options [nop,nop,TS val 4294894767 ecr 140126,mptcp dss ack 3759712389], length 0
10:30:11.069178 IP 112.26.2.8.43407 > 112.26.2.1.46615: Flags [.], ack 358429, win 24383, options [nop,nop,TS val 4294894841 ecr 140126,mptcp dss ack 3759712389], length 0
10:30:11.159488 IP 112.26.2.1.46615 > 112.26.2.8.43407: Flags [.], seq 359857:361285, ack 1, win 4017, options [nop,nop,TS val 140352 ecr 4294893520,mptcp dss ack 2843715367 seq 3759768081 subseq 359857 len 1428 csum 0xf944], length 1428
10:30:11.159859 IP 112.26.2.8.43407 > 112.26.2.1.46615: Flags [.], ack 358429, win 24383, options [nop,nop,TS val 4294895105 ecr 140126,nop,nop,sack 1 {359857:361285},mptcp dss ack 3759712389], length 0
10:30:11.243656 IP 112.26.2.8.43407 > 112.26.2.1.46615: Flags [.], ack 358429, win 24383, options [nop,nop,TS val 4294895105 ecr 140126,nop,nop,sack 1 {359857:361285},mptcp dss ack 3759712389], length 0
10:30:11.361959 IP 112.26.2.1.46615 > 112.26.2.8.43407: Flags [.], seq 361285:362713, ack 1, win 4017, options [nop,nop,TS val 140736 ecr 4294893895,mptcp dss ack 2843715367 seq 3759780933 subseq 361285 len 1428 csum 0xae44], length 1428
10:30:11.362290 IP 112.26.2.8.43407 > 112.26.2.1.46615: Flags [.], ack 358429, win 24383, options [nop,nop,TS val 4294895307 ecr 140126,nop,nop,sack 1 {359857:362713},mptcp dss ack 3759712389], length 0
10:30:11.441788 IP 112.26.2.8.43407 > 112.26.2.1.46615: Flags [.], ack 358429, win 24383, options [nop,nop,TS val 4294895307 ecr 140126,nop,nop,sack 1 {359857:362713},mptcp dss ack 3759712389], length 0
10:30:11.521239 IP 112.26.2.1.46615 > 112.26.2.8.43407: Flags [.], seq 362713:364141, ack 1, win 4017, options [nop,nop,TS val 140736 ecr 4294893895,mptcp dss ack 2843715367 seq 3759782361 subseq 362713 len 1428 csum 0x6fa1], length 1428
10:30:11.521559 IP 112.26.2.8.43407 > 112.26.2.1.46615: Flags [.], ack 358429, win 24331, options [nop,nop,TS val 4294895467 ecr 140126,nop,nop,sack 1 {359857:364141},mptcp dss ack 3759730953], length 0
10:30:11.562104 IP 112.26.2.1.46615 > 112.26.2.8.43407: Flags [.], seq 364141:365569, ack 1, win 4017, options [nop,nop,TS val 140736 ecr 4294893895,mptcp dss ack 2843715367 seq 3759783789 subseq 364141 len 1428 csum 0xf8b0], length 1428
10:30:11.562427 IP 112.26.2.8.43407 > 112.26.2.1.46615: Flags [.], ack 358429, win 24331, options [nop,nop,TS val 4294895507 ecr 140126,nop,nop,sack 1 {359857:365569},mptcp dss ack 3759730953], length 0
10:30:11.678602 IP 112.26.2.8.43407 > 112.26.2.1.46615: Flags [.], ack 358429, win 24331, options [nop,nop,TS val 4294895467 ecr 140126,nop,nop,sack 1 {359857:364141},mptcp dss ack 3759730953], length 0
10:30:11.737491 IP 112.26.2.1.46615 > 112.26.2.8.43407: Flags [.], seq 365569:366997, ack 1, win 4017, options [nop,nop,TS val 141030 ecr 4294894066,mptcp dss ack 2843715367 seq 3759788073 subseq 365569 len 1428 csum 0xcbce], length 1428
10:30:11.737837 IP 112.26.2.8.43407 > 112.26.2.1.46615: Flags [.], ack 358429, win 24331, options [nop,nop,TS val 4294895683 ecr 140126,nop,nop,sack 1 {359857:366997},mptcp dss ack 3759730953], length 0
10:30:11.803504 IP 112.26.2.8.43407 > 112.26.2.1.46615: Flags [.], ack 358429, win 24331, options [nop,nop,TS val 4294895507 ecr 140126,nop,nop,sack 1 {359857:365569},mptcp dss ack 3759730953], length 0
10:30:11.869779 IP 112.26.2.8.43407 > 112.26.2.1.46615: Flags [.], ack 358429, win 24331, options [nop,nop,TS val 4294895683 ecr 140126,nop,nop,sack 1 {359857:366997},mptcp dss ack 3759730953], length 0
10:30:11.958544 IP 112.26.2.1.46615 > 112.26.2.8.43407: Flags [.], seq 368425:369853, ack 1, win 4017, options [nop,nop,TS val 141221 ecr 4294894244,mptcp dss ack 2843715367 seq 3759800925 subseq 368425 len 1428 csum 0xfd7b], length 1428
10:30:11.958873 IP 112.26.2.8.43407 > 112.26.2.1.46615: Flags [.], ack 358429, win 24331, options [nop,nop,TS val 4294895904 ecr 140126,nop,nop,sack 2 {368425:369853}{359857:366997},mptcp dss ack 3759730953], length 0
10:30:12.059321 IP 112.26.2.1.46615 > 112.26.2.8.43407: Flags [.], seq 369853:371281, ack 1, win 4017, options [nop,nop,TS val 141312 ecr 4294894358,mptcp dss ack 2843715367 seq 3759802353 subseq 369853 len 1428 csum 0xba35], length 1428
10:30:12.059675 IP 112.26.2.8.43407 > 112.26.2.1.46615: Flags [.], ack 358429, win 24331, options [nop,nop,TS val 4294896004 ecr 140126,nop,nop,sack 2 {368425:371281}{359857:366997},mptcp dss ack 3759730953], length 0
10:30:12.124000 IP 112.26.2.8.43407 > 112.26.2.1.46615: Flags [.], ack 358429, win 24331, options [nop,nop,TS val 4294895904 ecr 140126,nop,nop,sack 2 {368425:369853}{359857:366997},mptcp dss ack 3759730953], length 0
10:30:12.237491 IP 112.26.2.8.43407 > 112.26.2.1.46615: Flags [.], ack 358429, win 24331, options [nop,nop,TS val 4294896004 ecr 140126,nop,nop,sack 2 {368425:371281}{359857:366997},mptcp dss ack 3759730953], length 0
10:30:12.311177 IP 112.26.2.1.46615 > 112.26.2.8.43407: Flags [.], seq 372709:374137, ack 1, win 4017, options [nop,nop,TS val 141777 ecr 4294894767,mptcp dss ack 2843715367 seq 3759832341 subseq 372709 len 1428 csum 0x10b6], length 1428
10:30:12.311499 IP 112.26.2.8.43407 > 112.26.2.1.46615: Flags [.], ack 358429, win 24190, options [nop,nop,TS val 4294896256 ecr 140126,nop,nop,sack 2 {372709:374137}{368425:371281},mptcp dss ack 3759745233], length 0
10:30:12.473651 IP 112.26.2.8.43407 > 112.26.2.1.46615: Flags [.], ack 358429, win 24190, options [nop,nop,TS val 4294896256 ecr 140126,nop,nop,sack 2 {372709:374137}{368425:371281},mptcp dss ack 3759745233], length 0
10:30:12.555051 IP 112.26.2.1.46615 > 112.26.2.8.43407: Flags [.], seq 374137:375565, ack 1, win 4017, options [nop,nop,TS val 141777 ecr 4294894767,mptcp dss ack 2843715367 seq 3759833769 subseq 374137 len 1428 csum 0x75a5], length 1428
10:30:12.555349 IP 112.26.2.8.43407 > 112.26.2.1.46615: Flags [.], ack 358429, win 24190, options [nop,nop,TS val 4294896500 ecr 140126,nop,nop,sack 2 {372709:375565}{368425:371281},mptcp dss ack 3759745233], length 0
10:30:12.661469 IP 112.26.2.1.46615 > 112.26.2.8.43407: Flags [.], seq 375565:376993, ack 1, win 4017, options [nop,nop,TS val 141877 ecr 4294894841,mptcp dss ack 2843715367 seq 3759838053 subseq 375565 len 1428 csum 0x197c], length 1428
10:30:12.661805 IP 112.26.2.8.43407 > 112.26.2.1.46615: Flags [.], ack 358429, win 24190, options [nop,nop,TS val 4294896606 ecr 140126,nop,nop,sack 2 {372709:376993}{368425:371281},mptcp dss ack 3759745233], length 0
10:30:12.728245 IP 112.26.2.8.43407 > 112.26.2.1.46615: Flags [.], ack 358429, win 24190, options [nop,nop,TS val 4294896500 ecr 140126,nop,nop,sack 2 {372709:375565}{368425:371281},mptcp dss ack 3759745233], length 0
10:30:12.792928 IP 112.26.2.1.46615 > 112.26.2.8.43407: Flags [.], seq 376993:378421, ack 1, win 4017, options [nop,nop,TS val 142109 ecr 4294895105,mptcp dss ack 2843715367 seq 3759846621 subseq 376993 len 1428 csum 0x995a], length 1428
10:30:12.793264 IP 112.26.2.8.43407 > 112.26.2.1.46615: Flags [.], ack 358429, win 24190, options [nop,nop,TS val 4294896738 ecr 140126,nop,nop,sack 2 {372709:378421}{368425:371281},mptcp dss ack 3759745233], length 0
10:30:12.872859 IP 112.26.2.8.43407 > 112.26.2.1.46615: Flags [.], ack 358429, win 24190, options [nop,nop,TS val 4294896606 ecr 140126,nop,nop,sack 2 {372709:376993}{368425:371281},mptcp dss ack 3759745233], length 0
10:30:12.934198 IP 112.26.2.1.46615 > 112.26.2.8.43407: Flags [.], seq 378421:379849, ack 1, win 4017, options [nop,nop,TS val 142264 ecr 4294895307,mptcp dss ack 2843715367 seq 3759849477 subseq 378421 len 1428 csum 0xdb39], length 1428
10:30:12.934510 IP 112.26.2.8.43407 > 112.26.2.1.46615: Flags [.], ack 358429, win 24190, options [nop,nop,TS val 4294896879 ecr 140126,nop,nop,sack 2 {372709:379849}{368425:371281},mptcp dss ack 3759745233], length 0
10:30:13.018726 IP 112.26.2.8.43407 > 112.26.2.1.46615: Flags [.], ack 358429, win 24190, options [nop,nop,TS val 4294896738 ecr 140126,nop,nop,sack 2 {372709:378421}{368425:371281},mptcp dss ack 3759745233], length 0
10:30:13.070450 IP 112.26.2.1.46615 > 112.26.2.8.43407: Flags [.], seq 358429:359857, ack 1, win 4017, options [nop,nop,TS val 142337 ecr 4294895467,mptcp dss ack 2843715367 seq 3759762369 subseq 358429 len 1428 csum 0x887e], length 1428
10:30:13.070831 IP 112.26.2.8.43407 > 112.26.2.1.46615: Flags [.], ack 366997, win 24107, options [nop,nop,TS val 4294897016 ecr 142337,nop,nop,sack 2 {372709:379849}{368425:371281},mptcp dss ack 3759776649], length 0
10:30:13.165112 IP 112.26.2.8.43407 > 112.26.2.1.46615: Flags [.], ack 358429, win 24190, options [nop,nop,TS val 4294896879 ecr 140126,nop,nop,sack 2 {372709:379849}{368425:371281},mptcp dss ack 3759745233], length 0
10:30:13.240991 IP 112.26.2.8.43407 > 112.26.2.1.46615: Flags [.], ack 366997, win 24107, options [nop,nop,TS val 4294897016 ecr 142337,nop,nop,sack 2 {372709:379849}{368425:371281},mptcp dss ack 3759776649], length 0
10:30:13.322248 IP 112.26.2.1.46615 > 112.26.2.8.43407: Flags [.], seq 379849:381277, ack 1, win 4017, options [nop,nop,TS val 142587 ecr 4294895507,mptcp dss ack 2843715367 seq 3759859473 subseq 379849 len 1428 csum 0xe784], length 1428
10:30:13.322477 IP 112.26.2.8.43407 > 112.26.2.1.46615: Flags [.], ack 366997, win 24265, options [nop,nop,TS val 4294897267 ecr 142337,nop,nop,sack 2 {372709:381277}{368425:371281},mptcp dss ack 3759776649], length 0
10:30:13.373523 IP 112.26.2.1.46615 > 112.26.2.8.43407: Flags [.], seq 381277:382705, ack 1, win 4017, options [nop,nop,TS val 142769 ecr 4294895683,mptcp dss ack 2843715367 seq 3759863757 subseq 381277 len 1428 csum 0xf728], length 1428
10:30:13.373862 IP 112.26.2.8.43407 > 112.26.2.1.46615: Flags [.], ack 366997, win 24265, options [nop,nop,TS val 4294897319 ecr 142337,nop,nop,sack 2 {372709:382705}{368425:371281},mptcp dss ack 3759776649], length 0
10:30:13.473501 IP 112.26.2.8.43407 > 112.26.2.1.46615: Flags [.], ack 366997, win 24265, options [nop,nop,TS val 4294897267 ecr 142337,nop,nop,sack 2 {372709:381277}{368425:371281},mptcp dss ack 3759776649], length 0
10:30:13.528511 IP 112.26.2.8.43407 > 112.26.2.1.46615: Flags [.], ack 366997, win 24265, options [nop,nop,TS val 4294897319 ecr 142337,nop,nop,sack 2 {372709:382705}{368425:371281},mptcp dss ack 3759776649], length 0
10:30:13.554817 IP 112.26.2.1.46615 > 112.26.2.8.43407: Flags [.], seq 366997:368425, ack 1, win 4017, options [nop,nop,TS val 143148 ecr 4294896256,mptcp dss ack 2843715367 seq 3759789501 subseq 366997 len 1428 csum 0xe869], length 1428
10:30:13.555116 IP 112.26.2.8.43407 > 112.26.2.1.46615: Flags [.], ack 371281, win 24265, options [nop,nop,TS val 4294897500 ecr 143148,nop,nop,sack 1 {372709:382705},mptcp dss ack 3759776649], length 0
10:30:13.654791 IP 112.26.2.8.43407 > 112.26.2.1.46615: Flags [.], ack 371281, win 24265, options [nop,nop,TS val 4294897500 ecr 143148,nop,nop,sack 1 {372709:382705},mptcp dss ack 3759776649], length 0
10:30:13.734290 IP 112.26.2.1.46615 > 112.26.2.8.43407: Flags [.], seq 371281:372709, ack 1, win 4017, options [nop,nop,TS val 143419 ecr 4294896500,mptcp dss ack 2843715367 seq 3759808065 subseq 371281 len 1428 csum 0x3453], length 1428
10:30:13.734624 IP 112.26.2.8.43407 > 112.26.2.1.46615: Flags [.], ack 382705, win 24161, options [nop,nop,TS val 4294897679 ecr 143419,mptcp dss ack 3759822345], length 0
10:30:13.812344 IP 112.26.2.8.43407 > 112.26.2.1.46615: Flags [.], ack 382705, win 24161, options [nop,nop,TS val 4294897679 ecr 143419,mptcp dss ack 3759822345], length 0
10:30:13.874397 IP 112.26.2.1.46615 > 112.26.2.8.43407: Flags [.], seq 382705:384133, ack 1, win 4017, options [nop,nop,TS val 143531 ecr 4294896606,mptcp dss ack 2843715367 seq 3759888033 subseq 382705 len 1428 csum 0x8ea5], length 1428
10:30:13.874778 IP 112.26.2.8.43407 > 112.26.2.1.46615: Flags [.], ack 384133, win 24239, options [nop,nop,TS val 4294897819 ecr 143531,mptcp dss ack 3759825201], length 0
10:30:13.939983 IP 112.26.2.8.43407 > 112.26.2.1.46615: Flags [.], ack 384133, win 24239, options [nop,nop,TS val 4294897819 ecr 143531,mptcp dss ack 3759825201], length 0
10:30:14.000130 IP 112.26.2.1.46615 > 112.26.2.8.43407: Flags [.], seq 384133:385561, ack 1, win 4017, options [nop,nop,TS val 143624 ecr 4294896738,mptcp dss ack 2843715367 seq 3759892317 subseq 384133 len 1428 csum 0xa0ca], length 1428
10:30:14.000464 IP 112.26.2.8.43407 > 112.26.2.1.46615: Flags [.], ack 385561, win 24239, options [nop,nop,TS val 4294897945 ecr 143624,mptcp dss ack 3759825201], length 0
10:30:14.069472 IP 112.26.2.8.43407 > 112.26.2.1.46615: Flags [.], ack 385561, win 24239, options [nop,nop,TS val 4294897945 ecr 143624,mptcp dss ack 3759825201], length 0
10:30:14.136773 IP 112.26.2.1.46615 > 112.26.2.8.43407: Flags [.], seq 385561:386989, ack 1, win 4017, options [nop,nop,TS val 143736 ecr 4294896879,mptcp dss ack 2843715367 seq 3759893745 subseq 385561 len 1428 csum 0xddfd], length 1428
10:30:14.137050 IP 112.26.2.8.43407 > 112.26.2.1.46615: Flags [.], ack 386989, win 24239, options [nop,nop,TS val 4294898081 ecr 143736,mptcp dss ack 3759825201], length 0
10:30:14.213817 IP 112.26.2.8.43407 > 112.26.2.1.46615: Flags [.], ack 386989, win 24239, options [nop,nop,TS val 4294898081 ecr 143736,mptcp dss ack 3759825201], length 0
10:30:14.335227 IP 112.26.2.1.46615 > 112.26.2.8.43407: Flags [.], seq 386989:388417, ack 1, win 4017, options [nop,nop,TS val 143791 ecr 4294897016,mptcp dss ack 2843715367 seq 3759898029 subseq 386989 len 1428 csum 0xb3c8], length 1428
10:30:14.335596 IP 112.26.2.8.43407 > 112.26.2.1.46615: Flags [.], ack 388417, win 24239, options [nop,nop,TS val 4294898280 ecr 143791,mptcp dss ack 3759825201], length 0
10:30:14.433503 IP 112.26.2.8.43407 > 112.26.2.1.46615: Flags [.], ack 388417, win 24239, options [nop,nop,TS val 4294898280 ecr 143791,mptcp dss ack 3759825201], length 0
10:30:14.501225 IP 112.26.2.1.46615 > 112.26.2.8.43407: Flags [.], seq 388417:389845, ack 1, win 4017, options [nop,nop,TS val 143791 ecr 4294897016,mptcp dss ack 2843715367 seq 3759899457 subseq 388417 len 1428 csum 0x36fc], length 1428
10:30:14.501519 IP 112.26.2.8.43407 > 112.26.2.1.46615: Flags [.], ack 389845, win 24048, options [nop,nop,TS val 4294898446 ecr 143791,mptcp dss ack 3759853761], length 0
10:30:14.564608 IP 112.26.2.8.43407 > 112.26.2.1.46615: Flags [.], ack 389845, win 24048, options [nop,nop,TS val 4294898446 ecr 143791,mptcp dss ack 3759853761], length 0
10:30:14.646581 IP 112.26.2.1.46615 > 112.26.2.8.43407: Flags [.], seq 389845:391273, ack 1, win 4017, options [nop,nop,TS val 144109 ecr 4294897267,mptcp dss ack 2843715367 seq 3759903741 subseq 389845 len 1428 csum 0x6044], length 1428
10:30:14.646968 IP 112.26.2.8.43407 > 112.26.2.1.46615: Flags [.], ack 391273, win 24048, options [nop,nop,TS val 4294898592 ecr 144109,mptcp dss ack 3759853761], length 0
10:30:14.701990 IP 112.26.2.8.43407 > 112.26.2.1.46615: Flags [.], ack 391273, win 24048, options [nop,nop,TS val 4294898592 ecr 144109,mptcp dss ack 3759853761], length 0
10:30:14.810735 IP 112.26.2.1.46615 > 112.26.2.8.43407: Flags [.], seq 391273:392701, ack 1, win 4017, options [nop,nop,TS val 144237 ecr 4294897319,mptcp dss ack 2843715367 seq 3759910881 subseq 391273 len 1428 csum 0xa269], length 1428
10:30:14.811084 IP 112.26.2.8.43407 > 112.26.2.1.46615: Flags [.], ack 392701, win 24048, options [nop,nop,TS val 4294898756 ecr 144237,mptcp dss ack 3759853761], length 0
10:30:14.893540 IP 112.26.2.8.43407 > 112.26.2.1.46615: Flags [.], ack 392701, win 24048, options [nop,nop,TS val 4294898756 ecr 144237,mptcp dss ack 3759853761], length 0
10:30:14.966463 IP 112.26.2.1.46615 > 112.26.2.8.43407: Flags [.], seq 392701:394129, ack 1, win 4017, options [nop,nop,TS val 144363 ecr 4294897500,mptcp dss ack 2843715367 seq 3759920877 subseq 392701 len 1428 csum 0x2f6c], length 1428
10:30:14.966805 IP 112.26.2.8.43407 > 112.26.2.1.46615: Flags [.], ack 394129, win 24048, options [nop,nop,TS val 4294898912 ecr 144363,mptcp dss ack 3759853761], length 0
10:30:15.064542 IP 112.26.2.8.43407 > 112.26.2.1.46615: Flags [.], ack 394129, win 24048, options [nop,nop,TS val 4294898912 ecr 144363,mptcp dss ack 3759853761], length 0
10:30:15.109649 IP 112.26.2.1.46615 > 112.26.2.8.43407: Flags [.], seq 394129:395557, ack 1, win 4017, options [nop,nop,TS val 144600 ecr 4294897679,mptcp dss ack 2843715367 seq 3759929445 subseq 394129 len 1428 csum 0x403c], length 1428
10:30:15.110008 IP 112.26.2.8.43407 > 112.26.2.1.46615: Flags [.], ack 395557, win 24048, options [nop,nop,TS val 4294899055 ecr 144600,mptcp dss ack 3759853761], length 0
10:30:15.194824 IP 112.26.2.8.43407 > 112.26.2.1.46615: Flags [.], ack 395557, win 24048, options [nop,nop,TS val 4294899055 ecr 144600,mptcp dss ack 3759853761], length 0
10:30:15.291964 IP 112.26.2.1.46615 > 112.26.2.8.43407: Flags [.], seq 395557:396985, ack 1, win 4017, options [nop,nop,TS val 144695 ecr 4294897819,mptcp dss ack 2843715367 seq 3759935157 subseq 395557 len 1428 csum 0xeba0], length 1428
10:30:15.292246 IP 112.26.2.8.43407 > 112.26.2.1.46615: Flags [.], ack 396985, win 24048, options [nop,nop,TS val 4294899237 ecr 144695,mptcp dss ack 3759853761], length 0
10:30:15.370149 IP 112.26.2.8.43407 > 112.26.2.1.46615: Flags [.], ack 396985, win 24048, options [nop,nop,TS val 4294899237 ecr 144695,mptcp dss ack 3759853761], length 0
10:30:15.486882 IP 112.26.2.1.46615 > 112.26.2.8.43407: Flags [.], seq 396985:398413, ack 1, win 4017, options [nop,nop,TS val 144832 ecr 4294897945,mptcp dss ack 2843715367 seq 3759940869 subseq 396985 len 1428 csum 0x6c4e], length 1428
10:30:15.487214 IP 112.26.2.8.43407 > 112.26.2.1.46615: Flags [.], ack 398413, win 24486, options [nop,nop,TS val 4294899432 ecr 144832,mptcp dss ack 3759938013], length 0
10:30:15.541314 IP 112.26.2.8.43407 > 112.26.2.1.46615: Flags [.], ack 398413, win 24486, options [nop,nop,TS val 4294899432 ecr 144832,mptcp dss ack 3759938013], length 0
10:30:15.627846 IP 112.26.2.1.46615 > 112.26.2.8.43407: Flags [.], seq 398413:399841, ack 1, win 4017, options [nop,nop,TS val 144986 ecr 4294898081,mptcp dss ack 2843715367 seq 3759943725 subseq 398413 len 1428 csum 0x282f], length 1428
10:30:15.628193 IP 112.26.2.8.43407 > 112.26.2.1.46615: Flags [.], ack 399841, win 24489, options [nop,nop,TS val 4294899573 ecr 144986,mptcp dss ack 3759945153], length 0
10:30:15.725028 IP 112.26.2.8.43407 > 112.26.2.1.46615: Flags [.], ack 399841, win 24489, options [nop,nop,TS val 4294899573 ecr 144986,mptcp dss ack 3759945153], length 0
10:30:15.763013 IP 112.26.2.1.46615 > 112.26.2.8.43407: Flags [.], seq 399841:401269, ack 1, win 4017, options [nop,nop,TS val 144986 ecr 4294898081,mptcp dss ack 2843715367 seq 3759945153 subseq 399841 len 1428 csum 0xe28d], length 1428
10:30:15.763359 IP 112.26.2.8.43407 > 112.26.2.1.46615: Flags [.], ack 401269, win 24467, options [nop,nop,TS val 4294899708 ecr 144986,mptcp dss ack 3759946581], length 0
10:30:15.831493 IP 112.26.2.1.46615 > 112.26.2.8.43407: Flags [.], seq 401269:402697, ack 1, win 4017, options [nop,nop,TS val 145145 ecr 4294898280,mptcp dss ack 2843715367 seq 3759953721 subseq 401269 len 1428 csum 0x63c2], length 1428
10:30:15.871532 IP 112.26.2.8.43407 > 112.26.2.1.46615: Flags [.], ack 402697, win 24455, options [nop,nop,TS val 4294899817 ecr 145145,mptcp dss ack 3759949437], length 0
10:30:15.906165 IP 112.26.2.8.43407 > 112.26.2.1.46615: Flags [.], ack 401269, win 24467, options [nop,nop,TS val 4294899708 ecr 144986,mptcp dss ack 3759946581], length 0
10:30:15.951155 IP 112.26.2.8.43407 > 112.26.2.1.46615: Flags [.], ack 402697, win 24455, options [nop,nop,TS val 4294899817 ecr 145145,mptcp dss ack 3759949437], length 0
10:30:16.061479 IP 112.26.2.1.46615 > 112.26.2.8.43407: Flags [.], seq 404125:405553, ack 1, win 4017, options [nop,nop,TS val 145503 ecr 4294898592,mptcp dss ack 2843715367 seq 3759969429 subseq 404125 len 1428 csum 0x3295], length 1428
10:30:16.061848 IP 112.26.2.8.43407 > 112.26.2.1.46615: Flags [.], ack 402697, win 24509, options [nop,nop,TS val 4294900007 ecr 145145,nop,nop,sack 1 {404125:405553},mptcp dss ack 3759958005], length 0
10:30:16.131195 IP 112.26.2.8.43407 > 112.26.2.1.46615: Flags [.], ack 402697, win 24509, options [nop,nop,TS val 4294900007 ecr 145145,nop,nop,sack 1 {404125:405553},mptcp dss ack 3759958005], length 0
10:30:16.257738 IP 112.26.2.1.46615 > 112.26.2.8.43407: Flags [.], seq 405553:406981, ack 1, win 4017, options [nop,nop,TS val 145894 ecr 4294898912,mptcp dss ack 2843715367 seq 3759985137 subseq 405553 len 1428 csum 0x63e3], length 1428
10:30:16.258084 IP 112.26.2.8.43407 > 112.26.2.1.46615: Flags [.], ack 402697, win 24487, options [nop,nop,TS val 4294900203 ecr 145145,nop,nop,sack 1 {404125:406981},mptcp dss ack 3759959433], length 0
10:30:16.334906 IP 112.26.2.8.43407 > 112.26.2.1.46615: Flags [.], ack 402697, win 24487, options [nop,nop,TS val 4294900203 ecr 145145,nop,nop,sack 1 {404125:406981},mptcp dss ack 3759959433], length 0
10:30:16.386778 IP 112.26.2.1.46615 > 112.26.2.8.43407: Flags [.], seq 406981:408409, ack 1, win 4017, options [nop,nop,TS val 145894 ecr 4294898912,mptcp dss ack 2843715367 seq 3759986565 subseq 406981 len 1428 csum 0xfa72], length 1428
10:30:16.387098 IP 112.26.2.8.43407 > 112.26.2.1.46615: Flags [.], ack 402697, win 24487, options [nop,nop,TS val 4294900332 ecr 145145,nop,nop,sack 1 {404125:408409},mptcp dss ack 3759959433], length 0
10:30:16.483909 IP 112.26.2.8.43407 > 112.26.2.1.46615: Flags [.], ack 402697, win 24487, options [nop,nop,TS val 4294900332 ecr 145145,nop,nop,sack 1 {404125:408409},mptcp dss ack 3759959433], length 0
10:30:16.542113 IP 112.26.2.1.46615 > 112.26.2.8.43407: Flags [.], seq 408409:409837, ack 1, win 4017, options [nop,nop,TS val 146007 ecr 4294899055,mptcp dss ack 2843715367 seq 3759993705 subseq 408409 len 1428 csum 0x9d16], length 1428
10:30:16.542412 IP 112.26.2.8.43407 > 112.26.2.1.46615: Flags [.], ack 402697, win 24487, options [nop,nop,TS val 4294900487 ecr 145145,nop,nop,sack 1 {404125:409837},mptcp dss ack 3759959433], length 0
10:30:16.608591 IP 112.26.2.8.43407 > 112.26.2.1.46615: Flags [.], ack 402697, win 24487, options [nop,nop,TS val 4294900487 ecr 145145,nop,nop,sack 1 {404125:409837},mptcp dss ack 3759959433], length 0
10:30:16.658838 IP 112.26.2.1.46615 > 112.26.2.8.43407: Flags [.], seq 409837:411265, ack 1, win 4017, options [nop,nop,TS val 146095 ecr 4294899237,mptcp dss ack 2843715367 seq 3759997989 subseq 409837 len 1428 csum 0x3a63], length 1428
10:30:16.659164 IP 112.26.2.8.43407 > 112.26.2.1.46615: Flags [.], ack 402697, win 24487, options [nop,nop,TS val 4294900604 ecr 145145,nop,nop,sack 1 {404125:411265},mptcp dss ack 3759959433], length 0
10:30:16.726563 IP 112.26.2.1.46615 > 112.26.2.8.43407: Flags [.], seq 411265:412693, ack 1, win 4017, options [nop,nop,TS val 146240 ecr 4294899432,mptcp dss ack 2843715367 seq 3760003701 subseq 411265 len 1428 csum 0xda90], length 1428
10:30:16.726854 IP 112.26.2.8.43407 > 112.26.2.1.46615: Flags [.], ack 402697, win 24487, options [nop,nop,TS val 4294900671 ecr 145145,nop,nop,sack 1 {404125:412693},mptcp dss ack 3759959433], length 0
10:30:16.796435 IP 112.26.2.8.43407 > 112.26.2.1.46615: Flags [.], ack 402697, win 24487, options [nop,nop,TS val 4294900604 ecr 145145,nop,nop,sack 1 {404125:411265},mptcp dss ack 3759959433], length 0
10:30:16.884221 IP 112.26.2.8.43407 > 112.26.2.1.46615: Flags [.], ack 402697, win 24487, options [nop,nop,TS val 4294900671 ecr 145145,nop,nop,sack 1 {404125:412693},mptcp dss ack 3759959433], length 0
10:30:16.928109 IP 112.26.2.1.46615 > 112.26.2.8.43407: Flags [.], seq 412693:414121, ack 1, win 4017, options [nop,nop,TS val 146325 ecr 4294899573,mptcp dss ack 2843715367 seq 3760006557 subseq 412693 len 1428 csum 0xa4d5], length 1428
10:30:16.928442 IP 112.26.2.8.43407 > 112.26.2.1.46615: Flags [.], ack 402697, win 24487, options [nop,nop,TS val 4294900873 ecr 145145,nop,nop,sack 1 {404125:414121},mptcp dss ack 3759959433], length 0
10:30:17.020989 IP 112.26.2.8.43407 > 112.26.2.1.46615: Flags [.], ack 402697, win 24487, options [nop,nop,TS val 4294900873 ecr 145145,nop,nop,sack 1 {404125:414121},mptcp dss ack 3759959433], length 0
10:30:17.095239 IP 112.26.2.1.46615 > 112.26.2.8.43407: Flags [.], seq 414121:415549, ack 1, win 4017, options [nop,nop,TS val 146495 ecr 4294899708,mptcp dss ack 2843715367 seq 3760015125 subseq 414121 len 1428 csum 0xdf68], length 1428
10:30:17.095505 IP 112.26.2.8.43407 > 112.26.2.1.46615: Flags [.], ack 402697, win 24487, options [nop,nop,TS val 4294901040 ecr 145145,nop,nop,sack 1 {404125:415549},mptcp dss ack 3759959433], length 0
10:30:17.197662 IP 112.26.2.1.46615 > 112.26.2.8.43407: Flags [.], seq 415549:416977, ack 1, win 4017, options [nop,nop,TS val 146495 ecr 4294899708,mptcp dss ack 2843715367 seq 3760016553 subseq 415549 len 1428 csum 0xb2a4], length 1428
10:30:17.197997 IP 112.26.2.8.43407 > 112.26.2.1.46615: Flags [.], ack 402697, win 24487, options [nop,nop,TS val 4294901142 ecr 145145,nop,nop,sack 1 {404125:416977},mptcp dss ack 3759959433], length 0
10:30:17.286844 IP 112.26.2.8.43407 > 112.26.2.1.46615: Flags [.], ack 402697, win 24487, options [nop,nop,TS val 4294901040 ecr 145145,nop,nop,sack 1 {404125:415549},mptcp dss ack 3759959433], length 0
10:30:17.353265 IP 112.26.2.1.46615 > 112.26.2.8.43407: Flags [.], seq 416977:418405, ack 1, win 4017, options [nop,nop,TS val 146638 ecr 4294899817,mptcp dss ack 2843715367 seq 3760026549 subseq 416977 len 1428 csum 0x8267], length 1428
10:30:17.353511 IP 112.26.2.8.43407 > 112.26.2.1.46615: Flags [.], ack 402697, win 24487, options [nop,nop,TS val 4294901298 ecr 145145,nop,nop,sack 1 {404125:418405},mptcp dss ack 3759959433], length 0
10:30:17.423595 IP 112.26.2.8.43407 > 112.26.2.1.46615: Flags [.], ack 402697, win 24487, options [nop,nop,TS val 4294901142 ecr 145145,nop,nop,sack 1 {404125:416977},mptcp dss ack 3759959433], length 0
10:30:17.472569 IP 112.26.2.1.46615 > 112.26.2.8.43407: Flags [.], seq 418405:419833, ack 1, win 4017, options [nop,nop,TS val 146852 ecr 4294900007,mptcp dss ack 2843715367 seq 3760033689 subseq 418405 len 1428 csum 0x14c9], length 1428
10:30:17.472870 IP 112.26.2.8.43407 > 112.26.2.1.46615: Flags [.], ack 402697, win 24487, options [nop,nop,TS val 4294901418 ecr 145145,nop,nop,sack 1 {404125:419833},mptcp dss ack 3759959433], length 0
10:30:17.540612 IP 112.26.2.8.43407 > 112.26.2.1.46615: Flags [.], ack 402697, win 24487, options [nop,nop,TS val 4294901298 ecr 145145,nop,nop,sack 1 {404125:418405},mptcp dss ack 3759959433], length 0
10:30:17.605887 IP 112.26.2.8.43407 > 112.26.2.1.46615: Flags [.], ack 402697, win 24487, options [nop,nop,TS val 4294901418 ecr 145145,nop,nop,sack 1 {404125:419833},mptcp dss ack 3759959433], length 0
10:30:17.657288 IP 112.26.2.1.46615 > 112.26.2.8.43407: Flags [.], seq 419833:421261, ack 1, win 4017, options [nop,nop,TS val 147067 ecr 4294900203,mptcp dss ack 2843715367 seq 3760047969 subseq 419833 len 1428 csum 0xd76d], length 1428
10:30:17.657640 IP 112.26.2.8.43407 > 112.26.2.1.46615: Flags [.], ack 402697, win 24487, options [nop,nop,TS val 4294901602 ecr 145145,nop,nop,sack 1 {404125:421261},mptcp dss ack 3759959433], length 0
10:30:17.731050 IP 112.26.2.8.43407 > 112.26.2.1.46615: Flags [.], ack 402697, win 24487, options [nop,nop,TS val 4294901602 ecr 145145,nop,nop,sack 1 {404125:421261},mptcp dss ack 3759959433], length 0
10:30:17.771435 IP 112.26.2.1.46615 > 112.26.2.8.43407: Flags [.], seq 402697:404125, ack 1, win 4017, options [nop,nop,TS val 147195 ecr 4294900332,mptcp dss ack 2843715367 seq 3759959433 subseq 402697 len 1428 csum 0xa9b3], length 1428
10:30:17.771790 IP 112.26.2.8.43407 > 112.26.2.1.46615: Flags [.], ack 421261, win 24019, options [nop,nop,TS val 4294901716 ecr 147195,mptcp dss ack 3759989421], length 0
10:30:17.826741 IP 112.26.2.8.43407 > 112.26.2.1.46615: Flags [.], ack 421261, win 24019, options [nop,nop,TS val 4294901716 ecr 147195,mptcp dss ack 3759989421], length 0
10:30:17.889091 IP 112.26.2.1.46615 > 112.26.2.8.43407: Flags [.], seq 421261:422689, ack 1, win 4017, options [nop,nop,TS val 147487 ecr 4294900487,mptcp dss ack 2843715367 seq 3760063677 subseq 421261 len 1428 csum 0xe3cc], length 1428
10:30:17.889378 IP 112.26.2.8.43407 > 112.26.2.1.46615: Flags [.], ack 422689, win 24019, options [nop,nop,TS val 4294901834 ecr 147487,mptcp dss ack 3759989421], length 0
10:30:17.958116 IP 112.26.2.8.43407 > 112.26.2.1.46615: Flags [.], ack 422689, win 24019, options [nop,nop,TS val 4294901834 ecr 147487,mptcp dss ack 3759989421], length 0
10:30:18.035349 IP 112.26.2.1.46615 > 112.26.2.8.43407: Flags [.], seq 422689:424117, ack 1, win 4017, options [nop,nop,TS val 147629 ecr 4294900671,mptcp dss ack 2843715367 seq 3760066533 subseq 422689 len 1428 csum 0xe627], length 1428
10:30:18.035700 IP 112.26.2.8.43407 > 112.26.2.1.46615: Flags [.], ack 424117, win 24476, options [nop,nop,TS val 4294901980 ecr 147629,mptcp dss ack 3760055109], length 0
10:30:18.141096 IP 112.26.2.8.43407 > 112.26.2.1.46615: Flags [.], ack 424117, win 24476, options [nop,nop,TS val 4294901980 ecr 147629,mptcp dss ack 3760055109], length 0
10:30:18.234389 IP 112.26.2.1.46615 > 112.26.2.8.43407: Flags [.], seq 424117:425545, ack 1, win 4017, options [nop,nop,TS val 147833 ecr 4294900873,mptcp dss ack 2843715367 seq 3760075101 subseq 424117 len 1428 csum 0xa231], length 1428
10:30:18.234714 IP 112.26.2.8.43407 > 112.26.2.1.46615: Flags [.], ack 425545, win 24522, options [nop,nop,TS val 4294902179 ecr 147833,mptcp dss ack 3760062249], length 0
10:30:18.321542 IP 112.26.2.8.43407 > 112.26.2.1.46615: Flags [.], ack 425545, win 24522, options [nop,nop,TS val 4294902179 ecr 147833,mptcp dss ack 3760062249], length 0
10:30:18.501116 IP 112.26.2.1.46615 > 112.26.2.8.43407: Flags [.], seq 425545:426973, ack 1, win 4017, options [nop,nop,TS val 148209 ecr 4294901298,mptcp dss ack 2843715367 seq 3760096521 subseq 425545 len 1428 csum 0x8397], length 1428
10:30:18.501416 IP 112.26.2.8.43407 > 112.26.2.1.46615: Flags [.], ack 426973, win 24525, options [nop,nop,TS val 4294902446 ecr 148209,mptcp dss ack 3760082241], length 0
10:30:18.602426 IP 112.26.2.8.43407 > 112.26.2.1.46615: Flags [.], ack 426973, win 24525, options [nop,nop,TS val 4294902446 ecr 148209,mptcp dss ack 3760082241], length 0
10:30:18.689103 IP 112.26.2.1.46615 > 112.26.2.8.43407: Flags [.], seq 426973:428401, ack 1, win 4017, options [nop,nop,TS val 148293 ecr 4294901418,mptcp dss ack 2843715367 seq 3760105089 subseq 426973 len 1428 csum 0x894], length 1428
10:30:18.689397 IP 112.26.2.8.43407 > 112.26.2.1.46615: Flags [.], ack 428401, win 24507, options [nop,nop,TS val 4294902634 ecr 148293,mptcp dss ack 3760086525], length 0
10:30:18.757919 IP 112.26.2.8.43407 > 112.26.2.1.46615: Flags [.], ack 428401, win 24507, options [nop,nop,TS val 4294902634 ecr 148293,mptcp dss ack 3760086525], length 0
10:30:18.834159 IP 112.26.2.1.46615 > 112.26.2.8.43407: Flags [.], seq 428401:429829, ack 1, win 4017, options [nop,nop,TS val 148458 ecr 4294901602,mptcp dss ack 2843715367 seq 3760109373 subseq 428401 len 1428 csum 0x5e09], length 1428
10:30:18.834486 IP 112.26.2.8.43407 > 112.26.2.1.46615: Flags [.], ack 429829, win 24471, options [nop,nop,TS val 4294902779 ecr 148458,mptcp dss ack 3760092237], length 0
10:30:18.924378 IP 112.26.2.8.43407 > 112.26.2.1.46615: Flags [.], ack 429829, win 24471, options [nop,nop,TS val 4294902779 ecr 148458,mptcp dss ack 3760092237], length 0
10:30:18.992329 IP 112.26.2.1.46615 > 112.26.2.8.43407: Flags [.], seq 429829:431257, ack 1, win 4017, options [nop,nop,TS val 148458 ecr 4294901716,mptcp dss ack 2843715367 seq 3760110801 subseq 429829 len 1428 csum 0xb235], length 1428
10:30:18.992591 IP 112.26.2.8.43407 > 112.26.2.1.46615: Flags [.], ack 431257, win 24460, options [nop,nop,TS val 4294902937 ecr 148458,mptcp dss ack 3760097949], length 0
