10:29:33.265812 IP 112.26.1.8.39947 > 112.26.1.1.46615: Flags [S], seq 2081378494, win 65535, options [mss 1460,sackOK,TS val 4294857065 ecr 0,nop,wscale 6,mptcp join id 3 token 0x9485611f nonce 0x1afdb74], length 0
10:29:33.303056 IP 112.26.1.1.46615 > 112.26.1.8.39947: Flags [S.], seq 2068020644, ack 2081378495, win 65535, options [mss 1460,sackOK,TS val 103384 ecr 4294857065,nop,wscale 6,mptcp join id 3 hmac 0xfcb6205695ecb3b0 nonce 0x59a1037b], length 0
10:29:33.403816 IP 112.26.1.1.46615 > 112.26.1.8.39947: Flags [S.], seq 2068020644, ack 2081378495, win 65535, options [mss 1460,sackOK,TS val 103384 ecr 4294857065,nop,wscale 6,mptcp join id 3 hmac 0xfcb6205695ecb3b0 nonce 0x59a1037b], length 0
10:29:33.546134 IP 112.26.1.8.39947 > 112.26.1.1.46615: Flags [.], ack 1, win 7437, options [nop,nop,TS val 4294857392 ecr 103384,mptcp join hmac 0x9287e5d5fe7fddc14c54652063e8d530afbdb977], length 0
10:29:33.546402 IP 112.26.1.1.46615 > 112.26.1.8.39947: Flags [.], ack 1, win 4017, options [nop,nop,TS val 103664 ecr 4294857392,mptcp dss ack 2843715367], length 0
10:29:33.546633 IP 112.26.1.1.46615 > 112.26.1.8.39947: Flags [.], seq 1:1429, ack 1, win 4017, options [nop,nop,TS val 103665 ecr 4294857392,mptcp dss ack 2843715367 seq 3758228697 subseq 1 len 1428 csum 0x7be3], length 1428
10:29:33.546719 IP 112.26.1.1.46615 > 112.26.1.8.39947: Flags [.], seq 1429:2857, ack 1, win 4017, options [nop,nop,TS val 103665 ecr 4294857392,mptcp dss ack 2843715367 seq 3758230125 subseq 1429 len 1428 csum 0x370b], length 1428
10:30:00.365479 IP 112.26.1.8.39947 > 112.26.1.1.46615: Flags [.], ack 234193, win 24092, options [nop,nop,TS val 4294883584 ecr 128249,nop,nop,sack 2 {238477:247045}{235621:237049},mptcp dss ack 3759156897], length 0
10:30:00.376232 IP 112.26.1.1.46615 > 112.26.1.8.39947: Flags [.], seq 258469:259897, ack 1, win 4017, options [nop,nop,TS val 130494 ecr 4294883584,mptcp dss ack 2843715367 seq 3759302553 subseq 258469 len 1428 csum 0x5122], length 1428
10:30:00.453363 IP 112.26.1.8.39947 > 112.26.1.1.46615: Flags [.], ack 237049, win 24092, options [nop,nop,TS val 4294883707 ecr 129308,nop,nop,sack 1 {238477:247045},mptcp dss ack 3759156897], length 0
10:30:00.453625 IP 112.26.1.1.46615 > 112.26.1.8.39947: Flags [.], seq 259897:261325, ack 1, win 4017, options [nop,nop,TS val 130572 ecr 4294883707,mptcp dss ack 2843715367 seq 3759303981 subseq 259897 len 1428 csum 0x52f7], length 1428
10:30:00.536394 IP 112.26.1.1.46615 > 112.26.1.8.39947: Flags [.], seq 252757:254185, ack 1, win 4017, options [nop,nop,TS val 129831 ecr 4294883064,mptcp dss ack 2843715367 seq 3759269709 subseq 252757 len 1428 csum 0xa107], length 1428
10:30:00.598521 IP 112.26.1.1.46615 > 112.26.1.8.39947: Flags [.], seq 254185:255613, ack 1, win 4017, options [nop,nop,TS val 129983 ecr 4294883145,mptcp dss ack 2843715367 seq 3759276849 subseq 254185 len 1428 csum 0xd8f7], length 1428
10:30:00.703998 IP 112.26.1.8.39947 > 112.26.1.1.46615: Flags [.], ack 247045, win 23646, options [nop,nop,TS val 4294883848 ecr 129544,mptcp dss ack 3759185457], length 0
10:30:00.704509 IP 112.26.1.1.46615 > 112.26.1.8.39947: Flags [.], seq 261325:262753, ack 1, win 4017, options [nop,nop,TS val 130822 ecr 4294883848,mptcp dss ack 2843715367 seq 3759313977 subseq 261325 len 1428 csum 0xeb24], length 1428
10:30:00.794371 IP 112.26.1.1.46615 > 112.26.1.8.39947: Flags [.], seq 255613:257041, ack 1, win 4017, options [nop,nop,TS val 130169 ecr 4294883264,mptcp dss ack 2843715367 seq 3759281133 subseq 255613 len 1428 csum 0x2603], length 1428
10:30:00.893479 IP 112.26.1.1.46615 > 112.26.1.8.39947: Flags [.], seq 257041:258469, ack 1, win 4017, options [nop,nop,TS val 130259 ecr 4294883435,mptcp dss ack 2843715367 seq 3759291129 subseq 257041 len 1428 csum 0x5db0], length 1428
10:30:01.054033 IP 112.26.1.1.46615 > 112.26.1.8.39947: Flags [.], seq 258469:259897, ack 1, win 4017, options [nop,nop,TS val 130494 ecr 4294883584,mptcp dss ack 2843715367 seq 3759302553 subseq 258469 len 1428 csum 0x5122], length 1428
10:30:01.119695 IP 112.26.1.1.46615 > 112.26.1.8.39947: Flags [.], seq 259897:261325, ack 1, win 4017, options [nop,nop,TS val 130572 ecr 4294883707,mptcp dss ack 2843715367 seq 3759303981 subseq 259897 len 1428 csum 0x52f7], length 1428
10:30:01.201915 IP 112.26.1.8.39947 > 112.26.1.1.46615: Flags [.], ack 249901, win 23937, options [nop,nop,TS val 4294884241 ecr 129750,mptcp dss ack 3759185457], length 0
10:30:01.202301 IP 112.26.1.1.46615 > 112.26.1.8.39947: Flags [.], seq 262753:264181, ack 1, win 4017, options [nop,nop,TS val 131321 ecr 4294884241,mptcp dss ack 2843715367 seq 3759335397 subseq 262753 len 1428 csum 0x79c5], length 1428
10:30:01.202379 IP 112.26.1.1.46615 > 112.26.1.8.39947: Flags [.], seq 264181:265609, ack 1, win 4017, options [nop,nop,TS val 131321 ecr 4294884241,mptcp dss ack 2843715367 seq 3759336825 subseq 264181 len 1428 csum 0x8de0], length 1428
10:30:01.343677 IP 112.26.1.8.39947 > 112.26.1.1.46615: Flags [.], ack 252757, win 23937, options [nop,nop,TS val 4294884342 ecr 129750,mptcp dss ack 3759185457], length 0
10:30:01.344032 IP 112.26.1.1.46615 > 112.26.1.8.39947: Flags [.], seq 265609:267037, ack 1, win 4017, options [nop,nop,TS val 131462 ecr 4294884342,mptcp dss ack 2843715367 seq 3759343965 subseq 265609 len 1428 csum 0x9488], length 1428
10:30:01.344106 IP 112.26.1.1.46615 > 112.26.1.8.39947: Flags [.], seq 267037:268465, ack 1, win 4017, options [nop,nop,TS val 131462 ecr 4294884342,mptcp dss ack 2843715367 seq 3759345393 subseq 267037 len 1428 csum 0xe92d], length 1428
10:30:01.447706 IP 112.26.1.1.46615 > 112.26.1.8.39947: Flags [.], seq 261325:262753, ack 1, win 4017, options [nop,nop,TS val 130822 ecr 4294883848,mptcp dss ack 2843715367 seq 3759313977 subseq 261325 len 1428 csum 0xeb24], length 1428
10:30:01.564231 IP 112.26.1.8.39947 > 112.26.1.1.46615: Flags [.], ack 255613, win 24362, options [nop,nop,TS val 4294884647 ecr 129983,mptcp dss ack 3759252573], length 0
10:30:01.564640 IP 112.26.1.1.46615 > 112.26.1.8.39947: Flags [.], seq 268465:269893, ack 1, win 4017, options [nop,nop,TS val 131683 ecr 4294884647,mptcp dss ack 2843715367 seq 3759352533 subseq 268465 len 1428 csum 0x4c8f], length 1428
10:30:01.564722 IP 112.26.1.1.46615 > 112.26.1.8.39947: Flags [.], seq 269893:271321, ack 1, win 4017, options [nop,nop,TS val 131683 ecr 4294884647,mptcp dss ack 2843715367 seq 3759353961 subseq 269893 len 1428 csum 0xf6f5], length 1428
10:30:01.656269 IP 112.26.1.8.39947 > 112.26.1.1.46615: Flags [.], ack 257041, win 24362, options [nop,nop,TS val 4294884905 ecr 130169,mptcp dss ack 3759252573], length 0
10:30:01.656644 IP 112.26.1.1.46615 > 112.26.1.8.39947: Flags [.], seq 271321:272749, ack 1, win 4017, options [nop,nop,TS val 131775 ecr 4294884905,mptcp dss ack 2843715367 seq 3759359673 subseq 271321 len 1428 csum 0x4926], length 1428
10:30:01.722040 IP 112.26.1.1.46615 > 112.26.1.8.39947: Flags [.], seq 262753:264181, ack 1, win 4017, options [nop,nop,TS val 131321 ecr 4294884241,mptcp dss ack 2843715367 seq 3759335397 subseq 262753 len 1428 csum 0x79c5], length 1428
10:30:01.859846 IP 112.26.1.1.46615 > 112.26.1.8.39947: Flags [.], seq 264181:265609, ack 1, win 4017, options [nop,nop,TS val 131321 ecr 4294884241,mptcp dss ack 2843715367 seq 3759336825 subseq 264181 len 1428 csum 0x8de0], length 1428
10:30:01.910475 IP 112.26.1.8.39947 > 112.26.1.1.46615: Flags [.], ack 258469, win 24540, options [nop,nop,TS val 4294884976 ecr 130259,mptcp dss ack 3759289701], length 0
10:30:01.910876 IP 112.26.1.1.46615 > 112.26.1.8.39947: Flags [.], seq 272749:274177, ack 1, win 4017, options [nop,nop,TS val 132029 ecr 4294884976,mptcp dss ack 2843715367 seq 3759366813 subseq 272749 len 1428 csum 0x302f], length 1428
10:30:02.006065 IP 112.26.1.1.46615 > 112.26.1.8.39947: Flags [.], seq 265609:267037, ack 1, win 4017, options [nop,nop,TS val 131462 ecr 4294884342,mptcp dss ack 2843715367 seq 3759343965 subseq 265609 len 1428 csum 0x9488], length 1428
10:30:02.094924 IP 112.26.1.8.39947 > 112.26.1.1.46615: Flags [.], ack 259897, win 24543, options [nop,nop,TS val 4294885167 ecr 130494,mptcp dss ack 3759295413], length 0
10:30:02.095285 IP 112.26.1.1.46615 > 112.26.1.8.39947: Flags [.], seq 274177:275605, ack 1, win 4017, options [nop,nop,TS val 132213 ecr 4294885167,mptcp dss ack 2843715367 seq 3759372525 subseq 274177 len 1428 csum 0x589f], length 1428
10:30:02.095422 IP 112.26.1.1.46615 > 112.26.1.8.39947: Flags [.], seq 275605:277033, ack 1, win 4017, options [nop,nop,TS val 132213 ecr 4294885167,mptcp dss ack 2843715367 seq 3759373953 subseq 275605 len 1428 csum 0xb592], length 1428
10:30:02.145302 IP 112.26.1.1.46615 > 112.26.1.8.39947: Flags [.], seq 267037:268465, ack 1, win 4017, options [nop,nop,TS val 131462 ecr 4294884342,mptcp dss ack 2843715367 seq 3759345393 subseq 267037 len 1428 csum 0xe92d], length 1428
10:30:02.218706 IP 112.26.1.8.39947 > 112.26.1.1.46615: Flags [.], ack 261325, win 24521, options [nop,nop,TS val 4294885302 ecr 130572,mptcp dss ack 3759296841], length 0
10:30:02.219063 IP 112.26.1.1.46615 > 112.26.1.8.39947: Flags [.], seq 277033:278461, ack 1, win 4017, options [nop,nop,TS val 132337 ecr 4294885302,mptcp dss ack 2843715367 seq 3759388233 subseq 277033 len 1428 csum 0xa3b8], length 1428
10:30:02.319406 IP 112.26.1.1.46615 > 112.26.1.8.39947: Flags [.], seq 268465:269893, ack 1, win 4017, options [nop,nop,TS val 131683 ecr 4294884647,mptcp dss ack 2843715367 seq 3759352533 subseq 268465 len 1428 csum 0x4c8f], length 1428
10:30:02.401703 IP 112.26.1.1.46615 > 112.26.1.8.39947: Flags [.], seq 271321:272749, ack 1, win 4017, options [nop,nop,TS val 131775 ecr 4294884905,mptcp dss ack 2843715367 seq 3759359673 subseq 271321 len 1428 csum 0x4926], length 1428
10:30:02.459497 IP 112.26.1.8.39947 > 112.26.1.1.46615: Flags [.], ack 264181, win 24455, options [nop,nop,TS val 4294885674 ecr 131321,mptcp dss ack 3759301125], length 0
10:30:02.459866 IP 112.26.1.1.46615 > 112.26.1.8.39947: Flags [.], seq 278461:279889, ack 1, win 4017, options [nop,nop,TS val 132578 ecr 4294885674,mptcp dss ack 2843715367 seq 3759399657 subseq 278461 len 1428 csum 0x4af6], length 1428
10:30:02.459942 IP 112.26.1.1.46615 > 112.26.1.8.39947: Flags [.], seq 279889:281317, ack 1, win 4017, options [nop,nop,TS val 132578 ecr 4294885674,mptcp dss ack 2843715367 seq 3759401085 subseq 279889 len 1428 csum 0x81a4], length 1428
10:30:02.566590 IP 112.26.1.1.46615 > 112.26.1.8.39947: Flags [.], seq 272749:274177, ack 1, win 4017, options [nop,nop,TS val 132029 ecr 4294884976,mptcp dss ack 2843715367 seq 3759366813 subseq 272749 len 1428 csum 0x302f], length 1428
10:30:02.654055 IP 112.26.1.8.39947 > 112.26.1.1.46615: Flags [.], ack 265609, win 24360, options [nop,nop,TS val 4294885809 ecr 131321,mptcp dss ack 3759308265], length 0
10:30:02.654395 IP 112.26.1.1.46615 > 112.26.1.8.39947: Flags [.], seq 281317:282745, ack 1, win 4017, options [nop,nop,TS val 132772 ecr 4294885809,mptcp dss ack 2843715367 seq 3759409653 subseq 281317 len 1428 csum 0x290a], length 1428
10:30:02.711418 IP 112.26.1.1.46615 > 112.26.1.8.39947: Flags [.], seq 274177:275605, ack 1, win 4017, options [nop,nop,TS val 132213 ecr 4294885167,mptcp dss ack 2843715367 seq 3759372525 subseq 274177 len 1428 csum 0x589f], length 1428
10:30:02.756197 IP 112.26.1.8.39947 > 112.26.1.1.46615: Flags [.], ack 267037, win 24316, options [nop,nop,TS val 4294885955 ecr 131462,mptcp dss ack 3759311121], length 0
10:30:02.756604 IP 112.26.1.1.46615 > 112.26.1.8.39947: Flags [.], seq 282745:284173, ack 1, win 4017, options [nop,nop,TS val 132874 ecr 4294885955,mptcp dss ack 2843715367 seq 3759411081 subseq 282745 len 1428 csum 0xbd0d], length 1428
10:30:02.756725 IP 112.26.1.1.46615 > 112.26.1.8.39947: Flags [.], seq 284173:285601, ack 1, win 4017, options [nop,nop,TS val 132874 ecr 4294885955,mptcp dss ack 2843715367 seq 3759412509 subseq 284173 len 1428 csum 0x48ab], length 1428
10:30:02.838645 IP 112.26.1.1.46615 > 112.26.1.8.39947: Flags [.], seq 275605:277033, ack 1, win 4017, options [nop,nop,TS val 132213 ecr 4294885167,mptcp dss ack 2843715367 seq 3759373953 subseq 275605 len 1428 csum 0xb592], length 1428
10:30:02.906043 IP 112.26.1.8.39947 > 112.26.1.1.46615: Flags [.], ack 268465, win 24316, options [nop,nop,TS val 4294886170 ecr 131462,mptcp dss ack 3759311121], length 0
10:30:02.906406 IP 112.26.1.1.46615 > 112.26.1.8.39947: Flags [.], seq 285601:287029, ack 1, win 4017, options [nop,nop,TS val 133024 ecr 4294886170,mptcp dss ack 2843715367 seq 3759429645 subseq 285601 len 1428 csum 0x36f4], length 1428
10:30:02.987412 IP 112.26.1.1.46615 > 112.26.1.8.39947: Flags [.], seq 278461:279889, ack 1, win 4017, options [nop,nop,TS val 132578 ecr 4294885674,mptcp dss ack 2843715367 seq 3759399657 subseq 278461 len 1428 csum 0x4af6], length 1428
10:30:03.063273 IP 112.26.1.8.39947 > 112.26.1.1.46615: Flags [.], ack 269893, win 24316, options [nop,nop,TS val 4294886352 ecr 131683,mptcp dss ack 3759311121], length 0
10:30:03.063657 IP 112.26.1.1.46615 > 112.26.1.8.39947: Flags [.], seq 287029:288457, ack 1, win 4017, options [nop,nop,TS val 133182 ecr 4294886352,mptcp dss ack 2843715367 seq 3759438213 subseq 287029 len 1428 csum 0xa2a6], length 1428
10:30:03.150995 IP 112.26.1.1.46615 > 112.26.1.8.39947: Flags [.], seq 279889:281317, ack 1, win 4017, options [nop,nop,TS val 132578 ecr 4294885674,mptcp dss ack 2843715367 seq 3759401085 subseq 279889 len 1428 csum 0x81a4], length 1428
10:30:03.211507 IP 112.26.1.8.39947 > 112.26.1.1.46615: Flags [.], ack 269893, win 24316, options [nop,nop,TS val 4294886363 ecr 131683,nop,nop,sack 1 {271321:272749},mptcp dss ack 3759311121], length 0
10:30:03.218680 IP 112.26.1.1.46615 > 112.26.1.8.39947: Flags [.], seq 288457:289885, ack 1, win 4017, options [nop,nop,TS val 133337 ecr 4294886363,mptcp dss ack 2843715367 seq 3759441069 subseq 288457 len 1428 csum 0x3cf], length 1428
10:30:03.312708 IP 112.26.1.1.46615 > 112.26.1.8.39947: Flags [.], seq 281317:282745, ack 1, win 4017, options [nop,nop,TS val 132772 ecr 4294885809,mptcp dss ack 2843715367 seq 3759409653 subseq 281317 len 1428 csum 0x290a], length 1428
10:30:03.372500 IP 112.26.1.8.39947 > 112.26.1.1.46615: Flags [.], ack 269893, win 24316, options [nop,nop,TS val 4294886542 ecr 131683,nop,nop,sack 1 {271321:274177},mptcp dss ack 3759311121], length 0
10:30:03.399167 IP 112.26.1.1.46615 > 112.26.1.8.39947: Flags [.], seq 289885:291313, ack 1, win 4017, options [nop,nop,TS val 133517 ecr 4294886542,mptcp dss ack 2843715367 seq 3759449637 subseq 289885 len 1428 csum 0xa03a], length 1428
10:30:03.437833 IP 112.26.1.1.46615 > 112.26.1.8.39947: Flags [.], seq 282745:284173, ack 1, win 4017, options [nop,nop,TS val 132874 ecr 4294885955,mptcp dss ack 2843715367 seq 3759411081 subseq 282745 len 1428 csum 0xbd0d], length 1428
10:30:03.492129 IP 112.26.1.8.39947 > 112.26.1.1.46615: Flags [.], ack 269893, win 24316, options [nop,nop,TS val 4294886706 ecr 131683,nop,nop,sack 1 {271321:275605},mptcp dss ack 3759311121], length 0
10:30:03.492382 IP 112.26.1.1.46615 > 112.26.1.8.39947: Flags [.], seq 269893:271321, ack 1, win 4017, options [nop,nop,TS val 133611 ecr 4294886706,mptcp dss ack 2843715367 seq 3759353961 subseq 269893 len 1428 csum 0xf6f5], length 1428
10:30:03.534039 IP 112.26.1.1.46615 > 112.26.1.8.39947: Flags [.], seq 284173:285601, ack 1, win 4017, options [nop,nop,TS val 132874 ecr 4294885955,mptcp dss ack 2843715367 seq 3759412509 subseq 284173 len 1428 csum 0x48ab], length 1428
10:30:03.613189 IP 112.26.1.1.46615 > 112.26.1.8.39947: Flags [.], seq 285601:287029, ack 1, win 4017, options [nop,nop,TS val 133024 ecr 4294886170,mptcp dss ack 2843715367 seq 3759429645 subseq 285601 len 1428 csum 0x36f4], length 1428
10:30:03.667412 IP 112.26.1.8.39947 > 112.26.1.1.46615: Flags [.], ack 269893, win 24316, options [nop,nop,TS val 4294886843 ecr 131683,nop,nop,sack 1 {271321:277033},mptcp dss ack 3759311121], length 0
10:30:03.699912 IP 112.26.1.1.46615 > 112.26.1.8.39947: Flags [.], seq 287029:288457, ack 1, win 4017, options [nop,nop,TS val 133182 ecr 4294886352,mptcp dss ack 2843715367 seq 3759438213 subseq 287029 len 1428 csum 0xa2a6], length 1428
10:30:03.738293 IP 112.26.1.8.39947 > 112.26.1.1.46615: Flags [.], ack 269893, win 24316, options [nop,nop,TS val 4294886982 ecr 131683,nop,nop,sack 2 {278461:279889}{271321:277033},mptcp dss ack 3759311121], length 0
10:30:03.738643 IP 112.26.1.1.46615 > 112.26.1.8.39947: Flags [.], seq 291313:292741, ack 1, win 4017, options [nop,nop,TS val 133857 ecr 4294886843,mptcp dss ack 2843715367 seq 3759458205 subseq 291313 len 1428 csum 0xd2b1], length 1428
10:30:03.738767 IP 112.26.1.1.46615 > 112.26.1.8.39947: Flags [.], seq 277033:278461, ack 1, win 4017, options [nop,nop,TS val 133857 ecr 4294886982,mptcp dss ack 2843715367 seq 3759388233 subseq 277033 len 1428 csum 0xa3b8], length 1428
10:30:03.802283 IP 112.26.1.1.46615 > 112.26.1.8.39947: Flags [.], seq 288457:289885, ack 1, win 4017, options [nop,nop,TS val 133337 ecr 4294886363,mptcp dss ack 2843715367 seq 3759441069 subseq 288457 len 1428 csum 0x3cf], length 1428
10:30:03.916196 IP 112.26.1.8.39947 > 112.26.1.1.46615: Flags [.], ack 269893, win 24316, options [nop,nop,TS val 4294887134 ecr 131683,nop,nop,sack 2 {278461:281317}{271321:277033},mptcp dss ack 3759311121], length 0
10:30:03.964903 IP 112.26.1.1.46615 > 112.26.1.8.39947: Flags [.], seq 289885:291313, ack 1, win 4017, options [nop,nop,TS val 133517 ecr 4294886542,mptcp dss ack 2843715367 seq 3759449637 subseq 289885 len 1428 csum 0xa03a], length 1428
10:30:04.002219 IP 112.26.1.8.39947 > 112.26.1.1.46615: Flags [.], ack 269893, win 24316, options [nop,nop,TS val 4294887296 ecr 131683,nop,nop,sack 2 {278461:282745}{271321:277033},mptcp dss ack 3759311121], length 0
10:30:04.053465 IP 112.26.1.1.46615 > 112.26.1.8.39947: Flags [.], seq 269893:271321, ack 1, win 4017, options [nop,nop,TS val 133611 ecr 4294886706,mptcp dss ack 2843715367 seq 3759353961 subseq 269893 len 1428 csum 0xf6f5], length 1428
10:30:04.161199 IP 112.26.1.8.39947 > 112.26.1.1.46615: Flags [.], ack 269893, win 24316, options [nop,nop,TS val 4294887410 ecr 131683,nop,nop,sack 2 {278461:284173}{271321:277033},mptcp dss ack 3759311121], length 0
10:30:04.163965 IP 112.26.1.1.46615 > 112.26.1.8.39947: Flags [.], seq 292741:294169, ack 1, win 4017, options [nop,nop,TS val 134282 ecr 4294887410,mptcp dss ack 2843715367 seq 3759473913 subseq 292741 len 1428 csum 0x9446], length 1428
10:30:04.212795 IP 112.26.1.8.39947 > 112.26.1.1.46615: Flags [.], ack 269893, win 24316, options [nop,nop,TS val 4294887504 ecr 131683,nop,nop,sack 2 {278461:285601}{271321:277033},mptcp dss ack 3759311121], length 0
10:30:04.234658 IP 112.26.1.1.46615 > 112.26.1.8.39947: Flags [.], seq 294169:295597, ack 1, win 4017, options [nop,nop,TS val 134353 ecr 4294887504,mptcp dss ack 2843715367 seq 3759475341 subseq 294169 len 1428 csum 0x8a18], length 1428
10:30:04.318402 IP 112.26.1.1.46615 > 112.26.1.8.39947: Flags [.], seq 291313:292741, ack 1, win 4017, options [nop,nop,TS val 133857 ecr 4294886843,mptcp dss ack 2843715367 seq 3759458205 subseq 291313 len 1428 csum 0xd2b1], length 1428
10:30:04.383514 IP 112.26.1.8.39947 > 112.26.1.1.46615: Flags [.], ack 269893, win 24316, options [nop,nop,TS val 4294887626 ecr 131683,nop,nop,sack 2 {278461:287029}{271321:277033},mptcp dss ack 3759311121], length 0
10:30:04.412385 IP 112.26.1.1.46615 > 112.26.1.8.39947: Flags [.], seq 295597:297025, ack 1, win 4017, options [nop,nop,TS val 134530 ecr 4294887626,mptcp dss ack 2843715367 seq 3759481053 subseq 295597 len 1428 csum 0x22a1], length 1428
10:30:04.461353 IP 112.26.1.8.39947 > 112.26.1.1.46615: Flags [.], ack 269893, win 24316, options [nop,nop,TS val 4294887768 ecr 131683,nop,nop,sack 2 {278461:288457}{271321:277033},mptcp dss ack 3759311121], length 0
10:30:04.479669 IP 112.26.1.1.46615 > 112.26.1.8.39947: Flags [.], seq 297025:298453, ack 1, win 4017, options [nop,nop,TS val 134598 ecr 4294887768,mptcp dss ack 2843715367 seq 3759486765 subseq 297025 len 1428 csum 0x4556], length 1428
10:30:04.518767 IP 112.26.1.8.39947 > 112.26.1.1.46615: Flags [.], ack 269893, win 24316, options [nop,nop,TS val 4294887821 ecr 131683,nop,nop,sack 2 {278461:289885}{271321:277033},mptcp dss ack 3759311121], length 0
10:30:04.546738 IP 112.26.1.1.46615 > 112.26.1.8.39947: Flags [.], seq 298453:299881, ack 1, win 4017, options [nop,nop,TS val 134665 ecr 4294887821,mptcp dss ack 2843715367 seq 3759491049 subseq 298453 len 1428 csum 0x3988], length 1428
10:30:04.571815 IP 112.26.1.1.46615 > 112.26.1.8.39947: Flags [.], seq 292741:294169, ack 1, win 4017, options [nop,nop,TS val 134282 ecr 4294887410,mptcp dss ack 2843715367 seq 3759473913 subseq 292741 len 1428 csum 0x9446], length 1428
10:30:04.622960 IP 112.26.1.8.39947 > 112.26.1.1.46615: Flags [.], ack 269893, win 24160, options [nop,nop,TS val 4294888019 ecr 131683,nop,nop,sack 2 {278461:291313}{271321:277033},mptcp dss ack 3759321117], length 0
10:30:04.629249 IP 112.26.1.1.46615 > 112.26.1.8.39947: Flags [.], seq 299881:301309, ack 1, win 4017, options [nop,nop,TS val 134747 ecr 4294888019,mptcp dss ack 2843715367 seq 3759492477 subseq 299881 len 1428 csum 0xe049], length 1428
10:30:04.717187 IP 112.26.1.1.46615 > 112.26.1.8.39947: Flags [.], seq 294169:295597, ack 1, win 4017, options [nop,nop,TS val 134353 ecr 4294887504,mptcp dss ack 2843715367 seq 3759475341 subseq 294169 len 1428 csum 0x8a18], length 1428
10:30:04.761584 IP 112.26.1.8.39947 > 112.26.1.1.46615: Flags [.], ack 277033, win 24116, options [nop,nop,TS val 4294888083 ecr 133611,nop,nop,sack 1 {278461:291313},mptcp dss ack 3759323973], length 0
10:30:04.761948 IP 112.26.1.1.46615 > 112.26.1.8.39947: Flags [.], seq 301309:302737, ack 1, win 4017, options [nop,nop,TS val 134880 ecr 4294888083,mptcp dss ack 2843715367 seq 3759501045 subseq 301309 len 1428 csum 0x815b], length 1428
10:30:04.848777 IP 112.26.1.8.39947 > 112.26.1.1.46615: Flags [.], ack 277033, win 23826, options [nop,nop,TS val 4294888291 ecr 133611,nop,nop,sack 1 {278461:292741},mptcp dss ack 3759342537], length 0
10:30:04.895433 IP 112.26.1.1.46615 > 112.26.1.8.39947: Flags [.], seq 295597:297025, ack 1, win 4017, options [nop,nop,TS val 134530 ecr 4294887626,mptcp dss ack 2843715367 seq 3759481053 subseq 295597 len 1428 csum 0x22a1], length 1428
10:30:04.944252 IP 112.26.1.1.46615 > 112.26.1.8.39947: Flags [.], seq 297025:298453, ack 1, win 4017, options [nop,nop,TS val 134598 ecr 4294887768,mptcp dss ack 2843715367 seq 3759486765 subseq 297025 len 1428 csum 0x4556], length 1428
10:30:04.956914 IP 112.26.1.1.46615 > 112.26.1.8.39947: Flags [.], seq 302737:304165, ack 1, win 4017, options [nop,nop,TS val 135075 ecr 4294888291,mptcp dss ack 2843715367 seq 3759513897 subseq 302737 len 1428 csum 0x606a], length 1428
10:30:05.070910 IP 112.26.1.1.46615 > 112.26.1.8.39947: Flags [.], seq 298453:299881, ack 1, win 4017, options [nop,nop,TS val 134665 ecr 4294887821,mptcp dss ack 2843715367 seq 3759491049 subseq 298453 len 1428 csum 0x3988], length 1428
10:30:05.150259 IP 112.26.1.8.39947 > 112.26.1.1.46615: Flags [.], ack 277033, win 23787, options [nop,nop,TS val 4294888519 ecr 133611,nop,nop,sack 1 {278461:294169},mptcp dss ack 3759355389], length 0
10:30:05.150557 IP 112.26.1.1.46615 > 112.26.1.8.39947: Flags [.], seq 277033:278461, ack 1, win 4017, options [nop,nop,TS val 135269 ecr 4294888519,mptcp dss ack 2843715367 seq 3759388233 subseq 277033 len 1428 csum 0xa3b8], length 1428
10:30:05.234567 IP 112.26.1.1.46615 > 112.26.1.8.39947: Flags [.], seq 299881:301309, ack 1, win 4017, options [nop,nop,TS val 134747 ecr 4294888019,mptcp dss ack 2843715367 seq 3759492477 subseq 299881 len 1428 csum 0xe049], length 1428
10:30:05.310065 IP 112.26.1.1.46615 > 112.26.1.8.39947: Flags [.], seq 301309:302737, ack 1, win 4017, options [nop,nop,TS val 134880 ecr 4294888083,mptcp dss ack 2843715367 seq 3759501045 subseq 301309 len 1428 csum 0x815b], length 1428
10:30:05.374709 IP 112.26.1.8.39947 > 112.26.1.1.46615: Flags [.], ack 277033, win 23973, options [nop,nop,TS val 4294888669 ecr 133611,nop,nop,sack 1 {278461:295597},mptcp dss ack 3759382521], length 0
10:30:05.412060 IP 112.26.1.1.46615 > 112.26.1.8.39947: Flags [.], seq 302737:304165, ack 1, win 4017, options [nop,nop,TS val 135075 ecr 4294888291,mptcp dss ack 2843715367 seq 3759513897 subseq 302737 len 1428 csum 0x606a], length 1428
10:30:05.421495 IP 112.26.1.1.46615 > 112.26.1.8.39947: Flags [.], seq 304165:305593, ack 1, win 4017, options [nop,nop,TS val 135540 ecr 4294888669,mptcp dss ack 2843715367 seq 3759538173 subseq 304165 len 1428 csum 0xe616], length 1428
10:30:05.520927 IP 112.26.1.8.39947 > 112.26.1.1.46615: Flags [.], ack 277033, win 23929, options [nop,nop,TS val 4294888845 ecr 133611,nop,nop,sack 1 {278461:297025},mptcp dss ack 3759385377], length 0
10:30:05.560547 IP 112.26.1.1.46615 > 112.26.1.8.39947: Flags [.], seq 305593:307021, ack 1, win 4017, options [nop,nop,TS val 135679 ecr 4294888845,mptcp dss ack 2843715367 seq 3759546741 subseq 305593 len 1428 csum 0x35a5], length 1428
10:30:05.623756 IP 112.26.1.8.39947 > 112.26.1.1.46615: Flags [.], ack 277033, win 23907, options [nop,nop,TS val 4294888960 ecr 133611,nop,nop,sack 1 {278461:298453},mptcp dss ack 3759386805], length 0
10:30:05.666260 IP 112.26.1.1.46615 > 112.26.1.8.39947: Flags [.], seq 277033:278461, ack 1, win 4017, options [nop,nop,TS val 135269 ecr 4294888519,mptcp dss ack 2843715367 seq 3759388233 subseq 277033 len 1428 csum 0xa3b8], length 1428
10:30:05.678170 IP 112.26.1.1.46615 > 112.26.1.8.39947: Flags [.], seq 307021:308449, ack 1, win 4017, options [nop,nop,TS val 135796 ecr 4294888960,mptcp dss ack 2843715367 seq 3759549597 subseq 307021 len 1428 csum 0x6a74], length 1428
10:30:05.760319 IP 112.26.1.8.39947 > 112.26.1.1.46615: Flags [.], ack 277033, win 23885, options [nop,nop,TS val 4294889084 ecr 133611,nop,nop,sack 1 {278461:299881},mptcp dss ack 3759388233], length 0
10:30:05.786428 IP 112.26.1.1.46615 > 112.26.1.8.39947: Flags [.], seq 308449:309877, ack 1, win 4017, options [nop,nop,TS val 135905 ecr 4294889084,mptcp dss ack 2843715367 seq 3759552453 subseq 308449 len 1428 csum 0x283f], length 1428
10:30:05.805196 IP 112.26.1.8.39947 > 112.26.1.1.46615: Flags [.], ack 277033, win 23885, options [nop,nop,TS val 4294889193 ecr 133611,nop,nop,sack 1 {278461:301309},mptcp dss ack 3759388233], length 0
10:30:05.849620 IP 112.26.1.1.46615 > 112.26.1.8.39947: Flags [.], seq 309877:311305, ack 1, win 4017, options [nop,nop,TS val 135968 ecr 4294889193,mptcp dss ack 2843715367 seq 3759562449 subseq 309877 len 1428 csum 0x1ba0], length 1428
10:30:05.862204 IP 112.26.1.1.46615 > 112.26.1.8.39947: Flags [.], seq 304165:305593, ack 1, win 4017, options [nop,nop,TS val 135540 ecr 4294888669,mptcp dss ack 2843715367 seq 3759538173 subseq 304165 len 1428 csum 0xe616], length 1428
10:30:05.936372 IP 112.26.1.8.39947 > 112.26.1.1.46615: Flags [.], ack 277033, win 23885, options [nop,nop,TS val 4294889331 ecr 133611,nop,nop,sack 1 {278461:302737},mptcp dss ack 3759388233], length 0
10:30:05.993954 IP 112.26.1.1.46615 > 112.26.1.8.39947: Flags [.], seq 311305:312733, ack 1, win 4017, options [nop,nop,TS val 136112 ecr 4294889331,mptcp dss ack 2843715367 seq 3759565305 subseq 311305 len 1428 csum 0x880], length 1428
10:30:05.996325 IP 112.26.1.1.46615 > 112.26.1.8.39947: Flags [.], seq 305593:307021, ack 1, win 4017, options [nop,nop,TS val 135679 ecr 4294888845,mptcp dss ack 2843715367 seq 3759546741 subseq 305593 len 1428 csum 0x35a5], length 1428
10:30:06.109559 IP 112.26.1.8.39947 > 112.26.1.1.46615: Flags [.], ack 277033, win 23885, options [nop,nop,TS val 4294889462 ecr 133611,nop,nop,sack 1 {278461:304165},mptcp dss ack 3759388233], length 0
10:30:06.118133 IP 112.26.1.1.46615 > 112.26.1.8.39947: Flags [.], seq 312733:314161, ack 1, win 4017, options [nop,nop,TS val 136236 ecr 4294889462,mptcp dss ack 2843715367 seq 3759571017 subseq 312733 len 1428 csum 0xfbf7], length 1428
10:30:06.168800 IP 112.26.1.1.46615 > 112.26.1.8.39947: Flags [.], seq 307021:308449, ack 1, win 4017, options [nop,nop,TS val 135796 ecr 4294888960,mptcp dss ack 2843715367 seq 3759549597 subseq 307021 len 1428 csum 0x6a74], length 1428
10:30:06.254913 IP 112.26.1.8.39947 > 112.26.1.1.46615: Flags [.], ack 304165, win 23351, options [nop,nop,TS val 4294889614 ecr 135269,mptcp dss ack 3759422505], length 0
10:30:06.255417 IP 112.26.1.1.46615 > 112.26.1.8.39947: Flags [.], seq 314161:315589, ack 1, win 4017, options [nop,nop,TS val 136373 ecr 4294889614,mptcp dss ack 2843715367 seq 3759575301 subseq 314161 len 1428 csum 0xe589], length 1428
10:30:06.255479 IP 112.26.1.1.46615 > 112.26.1.8.39947: Flags [.], seq 315589:317017, ack 1, win 4017, options [nop,nop,TS val 136373 ecr 4294889614,mptcp dss ack 2843715367 seq 3759576729 subseq 315589 len 1428 csum 0xeb89], length 1428
10:30:06.344758 IP 112.26.1.1.46615 > 112.26.1.8.39947: Flags [.], seq 308449:309877, ack 1, win 4017, options [nop,nop,TS val 135905 ecr 4294889084,mptcp dss ack 2843715367 seq 3759552453 subseq 308449 len 1428 csum 0x283f], length 1428
10:30:06.406418 IP 112.26.1.1.46615 > 112.26.1.8.39947: Flags [.], seq 309877:311305, ack 1, win 4017, options [nop,nop,TS val 135968 ecr 4294889193,mptcp dss ack 2843715367 seq 3759562449 subseq 309877 len 1428 csum 0x1ba0], length 1428
10:30:06.463419 IP 112.26.1.8.39947 > 112.26.1.1.46615: Flags [.], ack 305593, win 23712, options [nop,nop,TS val 4294889811 ecr 135540,mptcp dss ack 3759422505], length 0
10:30:06.463826 IP 112.26.1.1.46615 > 112.26.1.8.39947: Flags [.], seq 317017:318445, ack 1, win 4017, options [nop,nop,TS val 136581 ecr 4294889811,mptcp dss ack 2843715367 seq 3759586725 subseq 317017 len 1428 csum 0x3f52], length 1428
10:30:06.561724 IP 112.26.1.1.46615 > 112.26.1.8.39947: Flags [.], seq 311305:312733, ack 1, win 4017, options [nop,nop,TS val 136112 ecr 4294889331,mptcp dss ack 2843715367 seq 3759565305 subseq 311305 len 1428 csum 0x880], length 1428
10:30:06.624176 IP 112.26.1.8.39947 > 112.26.1.1.46615: Flags [.], ack 307021, win 23712, options [nop,nop,TS val 4294889954 ecr 135679,mptcp dss ack 3759422505], length 0
10:30:06.624534 IP 112.26.1.1.46615 > 112.26.1.8.39947: Flags [.], seq 318445:319873, ack 1, win 4017, options [nop,nop,TS val 136742 ecr 4294889954,mptcp dss ack 2843715367 seq 3759593865 subseq 318445 len 1428 csum 0xde82], length 1428
10:30:06.699615 IP 112.26.1.1.46615 > 112.26.1.8.39947: Flags [.], seq 312733:314161, ack 1, win 4017, options [nop,nop,TS val 136236 ecr 4294889462,mptcp dss ack 2843715367 seq 3759571017 subseq 312733 len 1428 csum 0xfbf7], length 1428
10:30:06.774172 IP 112.26.1.1.46615 > 112.26.1.8.39947: Flags [.], seq 314161:315589, ack 1, win 4017, options [nop,nop,TS val 136373 ecr 4294889614,mptcp dss ack 2843715367 seq 3759575301 subseq 314161 len 1428 csum 0xe589], length 1428
10:30:06.831408 IP 112.26.1.8.39947 > 112.26.1.1.46615: Flags [.], ack 308449, win 23712, options [nop,nop,TS val 4294890118 ecr 135796,mptcp dss ack 3759422505], length 0
10:30:06.831928 IP 112.26.1.1.46615 > 112.26.1.8.39947: Flags [.], seq 319873:321301, ack 1, win 4017, options [nop,nop,TS val 136950 ecr 4294890118,mptcp dss ack 2843715367 seq 3759598149 subseq 319873 len 1428 csum 0x413e], length 1428
10:30:06.832078 IP 112.26.1.1.46615 > 112.26.1.8.39947: Flags [.], seq 321301:322729, ack 1, win 4017, options [nop,nop,TS val 136950 ecr 4294890118,mptcp dss ack 2843715367 seq 3759599577 subseq 321301 len 1428 csum 0x34ae], length 1428
10:30:06.903538 IP 112.26.1.1.46615 > 112.26.1.8.39947: Flags [.], seq 315589:317017, ack 1, win 4017, options [nop,nop,TS val 136373 ecr 4294889614,mptcp dss ack 2843715367 seq 3759576729 subseq 315589 len 1428 csum 0xeb89], length 1428
10:30:06.959844 IP 112.26.1.8.39947 > 112.26.1.1.46615: Flags [.], ack 309877, win 23712, options [nop,nop,TS val 4294890294 ecr 135905,mptcp dss ack 3759422505], length 0
10:30:06.960200 IP 112.26.1.1.46615 > 112.26.1.8.39947: Flags [.], seq 322729:324157, ack 1, win 4017, options [nop,nop,TS val 137079 ecr 4294890294,mptcp dss ack 2843715367 seq 3759602433 subseq 322729 len 1428 csum 0x6ac2], length 1428
10:30:07.029542 IP 112.26.1.1.46615 > 112.26.1.8.39947: Flags [.], seq 317017:318445, ack 1, win 4017, options [nop,nop,TS val 136581 ecr 4294889811,mptcp dss ack 2843715367 seq 3759586725 subseq 317017 len 1428 csum 0x3f52], length 1428
10:30:07.116941 IP 112.26.1.8.39947 > 112.26.1.1.46615: Flags [.], ack 311305, win 23712, options [nop,nop,TS val 4294890444 ecr 135968,mptcp dss ack 3759422505], length 0
10:30:07.117274 IP 112.26.1.1.46615 > 112.26.1.8.39947: Flags [.], seq 324157:325585, ack 1, win 4017, options [nop,nop,TS val 137236 ecr 4294890444,mptcp dss ack 2843715367 seq 3759608145 subseq 324157 len 1428 csum 0xd87c], length 1428
10:30:07.191499 IP 112.26.1.1.46615 > 112.26.1.8.39947: Flags [.], seq 318445:319873, ack 1, win 4017, options [nop,nop,TS val 136742 ecr 4294889954,mptcp dss ack 2843715367 seq 3759593865 subseq 318445 len 1428 csum 0xde82], length 1428
10:30:07.280597 IP 112.26.1.8.39947 > 112.26.1.1.46615: Flags [.], ack 312733, win 23712, options [nop,nop,TS val 4294890598 ecr 136112,mptcp dss ack 3759422505], length 0
10:30:07.280954 IP 112.26.1.1.46615 > 112.26.1.8.39947: Flags [.], seq 325585:327013, ack 1, win 4017, options [nop,nop,TS val 137399 ecr 4294890598,mptcp dss ack 2843715367 seq 3759611001 subseq 325585 len 1428 csum 0x88f9], length 1428
10:30:07.345977 IP 112.26.1.1.46615 > 112.26.1.8.39947: Flags [.], seq 319873:321301, ack 1, win 4017, options [nop,nop,TS val 136950 ecr 4294890118,mptcp dss ack 2843715367 seq 3759598149 subseq 319873 len 1428 csum 0x413e], length 1428
10:30:07.456297 IP 112.26.1.8.39947 > 112.26.1.1.46615: Flags [.], ack 314161, win 23712, options [nop,nop,TS val 4294890723 ecr 136236,mptcp dss ack 3759422505], length 0
10:30:07.456634 IP 112.26.1.1.46615 > 112.26.1.8.39947: Flags [.], seq 327013:328441, ack 1, win 4017, options [nop,nop,TS val 137575 ecr 4294890723,mptcp dss ack 2843715367 seq 3759626709 subseq 327013 len 1428 csum 0x5420], length 1428
10:30:07.553463 IP 112.26.1.1.46615 > 112.26.1.8.39947: Flags [.], seq 321301:322729, ack 1, win 4017, options [nop,nop,TS val 136950 ecr 4294890118,mptcp dss ack 2843715367 seq 3759599577 subseq 321301 len 1428 csum 0x34ae], length 1428
10:30:07.620962 IP 112.26.1.8.39947 > 112.26.1.1.46615: Flags [.], ack 315589, win 24099, options [nop,nop,TS val 4294890795 ecr 136373,mptcp dss ack 3759503901], length 0
10:30:07.621323 IP 112.26.1.1.46615 > 112.26.1.8.39947: Flags [.], seq 328441:329869, ack 1, win 4017, options [nop,nop,TS val 137739 ecr 4294890795,mptcp dss ack 2843715367 seq 3759645273 subseq 328441 len 1428 csum 0xdcf2], length 1428
10:30:07.717590 IP 112.26.1.1.46615 > 112.26.1.8.39947: Flags [.], seq 322729:324157, ack 1, win 4017, options [nop,nop,TS val 137079 ecr 4294890294,mptcp dss ack 2843715367 seq 3759602433 subseq 322729 len 1428 csum 0x6ac2], length 1428
10:30:07.802194 IP 112.26.1.1.46615 > 112.26.1.8.39947: Flags [.], seq 324157:325585, ack 1, win 4017, options [nop,nop,TS val 137236 ecr 4294890444,mptcp dss ack 2843715367 seq 3759608145 subseq 324157 len 1428 csum 0xd87c], length 1428
10:30:07.844265 IP 112.26.1.8.39947 > 112.26.1.1.46615: Flags [.], ack 317017, win 24099, options [nop,nop,TS val 4294890989 ecr 136373,mptcp dss ack 3759503901], length 0
10:30:07.844628 IP 112.26.1.1.46615 > 112.26.1.8.39947: Flags [.], seq 329869:331297, ack 1, win 4017, options [nop,nop,TS val 137963 ecr 4294890989,mptcp dss ack 2843715367 seq 3759653841 subseq 329869 len 1428 csum 0xff7d], length 1428
10:30:07.916041 IP 112.26.1.1.46615 > 112.26.1.8.39947: Flags [.], seq 325585:327013, ack 1, win 4017, options [nop,nop,TS val 137399 ecr 4294890598,mptcp dss ack 2843715367 seq 3759611001 subseq 325585 len 1428 csum 0x88f9], length 1428
10:30:07.964466 IP 112.26.1.8.39947 > 112.26.1.1.46615: Flags [.], ack 318445, win 24099, options [nop,nop,TS val 4294891088 ecr 136581,mptcp dss ack 3759503901], length 0
10:30:07.964839 IP 112.26.1.1.46615 > 112.26.1.8.39947: Flags [.], seq 331297:332725, ack 1, win 4017, options [nop,nop,TS val 138083 ecr 4294891088,mptcp dss ack 2843715367 seq 3759658125 subseq 331297 len 1428 csum 0xd228], length 1428
10:30:08.031115 IP 112.26.1.8.39947 > 112.26.1.1.46615: Flags [.], ack 319873, win 24099, options [nop,nop,TS val 4294891288 ecr 136742,mptcp dss ack 3759503901], length 0
10:30:08.031437 IP 112.26.1.1.46615 > 112.26.1.8.39947: Flags [.], seq 332725:334153, ack 1, win 4017, options [nop,nop,TS val 138149 ecr 4294891288,mptcp dss ack 2843715367 seq 3759659553 subseq 332725 len 1428 csum 0x76b0], length 1428
10:30:08.115455 IP 112.26.1.1.46615 > 112.26.1.8.39947: Flags [.], seq 327013:328441, ack 1, win 4017, options [nop,nop,TS val 137575 ecr 4294890723,mptcp dss ack 2843715367 seq 3759626709 subseq 327013 len 1428 csum 0x5420], length 1428
10:30:08.203175 IP 112.26.1.8.39947 > 112.26.1.1.46615: Flags [.], ack 321301, win 23921, options [nop,nop,TS val 4294891426 ecr 136950,mptcp dss ack 3759515325], length 0
10:30:08.203526 IP 112.26.1.1.46615 > 112.26.1.8.39947: Flags [.], seq 334153:335581, ack 1, win 4017, options [nop,nop,TS val 138321 ecr 4294891426,mptcp dss ack 2843715367 seq 3759665265 subseq 334153 len 1428 csum 0x57b4], length 1428
10:30:08.293513 IP 112.26.1.1.46615 > 112.26.1.8.39947: Flags [.], seq 328441:329869, ack 1, win 4017, options [nop,nop,TS val 137739 ecr 4294890795,mptcp dss ack 2843715367 seq 3759645273 subseq 328441 len 1428 csum 0xdcf2], length 1428
10:30:08.384228 IP 112.26.1.8.39947 > 112.26.1.1.46615: Flags [.], ack 322729, win 23921, options [nop,nop,TS val 4294891548 ecr 136950,mptcp dss ack 3759515325], length 0
10:30:08.384539 IP 112.26.1.1.46615 > 112.26.1.8.39947: Flags [.], seq 335581:337009, ack 1, win 4017, options [nop,nop,TS val 138502 ecr 4294891548,mptcp dss ack 2843715367 seq 3759670977 subseq 335581 len 1428 csum 0x64f9], length 1428
10:30:08.384638 IP 112.26.1.1.46615 > 112.26.1.8.39947: Flags [.], seq 337009:338437, ack 1, win 4017, options [nop,nop,TS val 138502 ecr 4294891548,mptcp dss ack 2843715367 seq 3759672405 subseq 337009 len 1428 csum 0x8d29], length 1428
10:30:08.472752 IP 112.26.1.8.39947 > 112.26.1.1.46615: Flags [.], ack 324157, win 23921, options [nop,nop,TS val 4294891670 ecr 137079,mptcp dss ack 3759515325], length 0
10:30:08.473067 IP 112.26.1.1.46615 > 112.26.1.8.39947: Flags [.], seq 338437:339865, ack 1, win 4017, options [nop,nop,TS val 138591 ecr 4294891670,mptcp dss ack 2843715367 seq 3759673833 subseq 338437 len 1428 csum 0x244], length 1428
10:30:08.519268 IP 112.26.1.1.46615 > 112.26.1.8.39947: Flags [.], seq 329869:331297, ack 1, win 4017, options [nop,nop,TS val 137963 ecr 4294890989,mptcp dss ack 2843715367 seq 3759653841 subseq 329869 len 1428 csum 0xff7d], length 1428
10:30:08.647176 IP 112.26.1.8.39947 > 112.26.1.1.46615: Flags [.], ack 325585, win 23921, options [nop,nop,TS val 4294891816 ecr 137236,mptcp dss ack 3759515325], length 0
10:30:08.647625 IP 112.26.1.1.46615 > 112.26.1.8.39947: Flags [.], seq 339865:341293, ack 1, win 4017, options [nop,nop,TS val 138766 ecr 4294891816,mptcp dss ack 2843715367 seq 3759680973 subseq 339865 len 1428 csum 0xdea6], length 1428
10:30:08.707619 IP 112.26.1.1.46615 > 112.26.1.8.39947: Flags [.], seq 331297:332725, ack 1, win 4017, options [nop,nop,TS val 138083 ecr 4294891088,mptcp dss ack 2843715367 seq 3759658125 subseq 331297 len 1428 csum 0xd228], length 1428
10:30:08.765649 IP 112.26.1.1.46615 > 112.26.1.8.39947: Flags [.], seq 332725:334153, ack 1, win 4017, options [nop,nop,TS val 138149 ecr 4294891288,mptcp dss ack 2843715367 seq 3759659553 subseq 332725 len 1428 csum 0x76b0], length 1428
10:30:08.811361 IP 112.26.1.8.39947 > 112.26.1.1.46615: Flags [.], ack 327013, win 23921, options [nop,nop,TS val 4294892002 ecr 137399,mptcp dss ack 3759515325], length 0
