10:29:25.679600 IP 112.26.0.8.54050 > 112.26.0.1.46615: Flags [S], seq 3691055875, win 65535, options [mss 1460,sackOK,TS val 4294849452 ecr 0,nop,wscale 6,mptcp capable csum {0xf3f641e5c9e720a6}], length 0
10:29:25.778467 IP 112.26.0.8.54050 > 112.26.0.1.46615: Flags [S], seq 3691055875, win 65535, options [mss 1460,sackOK,TS val 4294849452 ecr 0,nop,wscale 6,mptcp capable csum {0xf3f641e5c9e720a6}], length 0
10:29:25.793719 IP 112.26.0.1.46615 > 112.26.0.8.54050: Flags [S.], seq 406276099, ack 3691055876, win 65535, options [mss 1460,sackOK,TS val 95900 ecr 4294849452,nop,wscale 6,mptcp capable csum {0x6a6e46fcfc41c11a}], length 0
10:29:25.971088 IP 112.26.0.1.46615 > 112.26.0.8.54050: Flags [S.], seq 406276099, ack 3691055876, win 65535, options [mss 1460,sackOK,TS val 95900 ecr 4294849452,nop,wscale 6,mptcp capable csum {0x6a6e46fcfc41c11a}], length 0
10:29:25.987213 IP 112.26.0.1.46615 > 112.26.0.8.54050: Flags [S.], seq 406276099, ack 3691055876, win 65535, options [mss 1460,sackOK,TS val 95900 ecr 4294849452,nop,wscale 6,mptcp capable csum {0x6a6e46fcfc41c11a}], length 0
10:29:25.996264 IP 112.26.0.8.54050 > 112.26.0.1.46615: Flags [.], ack 1, win 1369, options [nop,nop,TS val 4294849933 ecr 95900,mptcp capable csum {0xf3f641e5c9e720a6,0x6a6e46fcfc41c11a},mptcp dss ack 3758104649], length 0
10:29:25.996433 IP 112.26.0.8.54050 > 112.26.0.1.46615: Flags [.], ack 1, win 1369, options [nop,nop,TS val 4294849933 ecr 95900,mptcp capable csum {0xf3f641e5c9e720a6,0x6a6e46fcfc41c11a},mptcp dss ack 3758104649], length 0
10:30:16.904969 IP 112.26.0.1.46615 > 112.26.0.8.54050: Flags [.], seq 505325:506753, ack 1, win 4017, options [nop,nop,TS val 146896 ecr 4294900197,mptcp dss ack 2843715367 seq 3759965145 subseq 505325 len 1428 csum 0x1ebd], length 1428
10:30:16.905180 IP 112.26.0.1.46615 > 112.26.0.8.54050: Flags [.], seq 505325:506753, ack 1, win 4017, options [nop,nop,TS val 146896 ecr 4294900197,mptcp dss ack 2843715367 seq 3759965145 subseq 505325 len 1428 csum 0x1ebd], length 1428
10:30:16.943451 IP 112.26.0.1.46615 > 112.26.0.8.54050: Flags [.], seq 516749:518177, ack 1, win 4017, options [nop,nop,TS val 146456 ecr 4294899605,mptcp dss ack 2843715367 seq 3760012269 subseq 516749 len 1428 csum 0x78da], length 1428
10:30:16.951753 IP 112.26.0.8.54050 > 112.26.0.1.46615: Flags [.], ack 505325, win 24487, options [nop,nop,TS val 4294900888 ecr 145445,nop,nop,sack 2 {513893:518177}{509609:512465},mptcp dss ack 3759959433], length 0
10:30:16.951960 IP 112.26.0.8.54050 > 112.26.0.1.46615: Flags [.], ack 505325, win 24487, options [nop,nop,TS val 4294900888 ecr 145445,nop,nop,sack 2 {513893:518177}{509609:512465},mptcp dss ack 3759959433], length 0
10:30:17.058090 IP 112.26.0.1.46615 > 112.26.0.8.54050: Flags [.], seq 508181:509609, ack 1, win 4017, options [nop,nop,TS val 147175 ecr 4294900373,mptcp dss ack 2843715367 seq 3759975141 subseq 508181 len 1428 csum 0xbc0c], length 1428
10:30:17.058301 IP 112.26.0.1.46615 > 112.26.0.8.54050: Flags [.], seq 508181:509609, ack 1, win 4017, options [nop,nop,TS val 147175 ecr 4294900373,mptcp dss ack 2843715367 seq 3759975141 subseq 508181 len 1428 csum 0xbc0c], length 1428
10:30:17.156748 IP 112.26.0.1.46615 > 112.26.0.8.54050: Flags [.], seq 518177:519605, ack 1, win 4017, options [nop,nop,TS val 146747 ecr 4294899877,mptcp dss ack 2843715367 seq 3760029405 subseq 518177 len 1428 csum 0x9173], length 1428
10:30:17.161233 IP 112.26.0.8.54050 > 112.26.0.1.46615: Flags [.], ack 505325, win 24487, options [nop,nop,TS val 4294901102 ecr 145445,nop,nop,sack 2 {513893:519605}{509609:512465},mptcp dss ack 3759959433], length 0
10:30:17.161433 IP 112.26.0.8.54050 > 112.26.0.1.46615: Flags [.], ack 505325, win 24487, options [nop,nop,TS val 4294901102 ecr 145445,nop,nop,sack 2 {513893:519605}{509609:512465},mptcp dss ack 3759959433], length 0
10:30:17.253191 IP 112.26.0.1.46615 > 112.26.0.8.54050: Flags [.], seq 519605:521033, ack 1, win 4017, options [nop,nop,TS val 146801 ecr 4294899973,mptcp dss ack 2843715367 seq 3760030833 subseq 519605 len 1428 csum 0x71c0], length 1428
10:30:17.258864 IP 112.26.0.8.54050 > 112.26.0.1.46615: Flags [.], ack 505325, win 24487, options [nop,nop,TS val 4294901199 ecr 145445,nop,nop,sack 2 {513893:521033}{509609:512465},mptcp dss ack 3759959433], length 0
10:30:17.259069 IP 112.26.0.8.54050 > 112.26.0.1.46615: Flags [.], ack 505325, win 24487, options [nop,nop,TS val 4294901199 ecr 145445,nop,nop,sack 2 {513893:521033}{509609:512465},mptcp dss ack 3759959433], length 0
10:30:17.313982 IP 112.26.0.1.46615 > 112.26.0.8.54050: Flags [.], seq 521033:522461, ack 1, win 4017, options [nop,nop,TS val 146801 ecr 4294899973,mptcp dss ack 2843715367 seq 3760032261 subseq 521033 len 1428 csum 0xffa6], length 1428
10:30:17.339906 IP 112.26.0.8.54050 > 112.26.0.1.46615: Flags [.], ack 505325, win 24487, options [nop,nop,TS val 4294901259 ecr 145445,nop,nop,sack 2 {513893:522461}{509609:512465},mptcp dss ack 3759959433], length 0
10:30:17.340107 IP 112.26.0.8.54050 > 112.26.0.1.46615: Flags [.], ack 505325, win 24487, options [nop,nop,TS val 4294901259 ecr 145445,nop,nop,sack 2 {513893:522461}{509609:512465},mptcp dss ack 3759959433], length 0
10:30:17.407763 IP 112.26.0.1.46615 > 112.26.0.8.54050: Flags [.], seq 522461:523889, ack 1, win 4017, options [nop,nop,TS val 146896 ecr 4294900110,mptcp dss ack 2843715367 seq 3760035117 subseq 522461 len 1428 csum 0x6124], length 1428
10:30:17.419028 IP 112.26.0.8.54050 > 112.26.0.1.46615: Flags [.], ack 505325, win 24487, options [nop,nop,TS val 4294901353 ecr 145445,nop,nop,sack 2 {513893:523889}{509609:512465},mptcp dss ack 3759959433], length 0
10:30:17.419227 IP 112.26.0.8.54050 > 112.26.0.1.46615: Flags [.], ack 505325, win 24487, options [nop,nop,TS val 4294901353 ecr 145445,nop,nop,sack 2 {513893:523889}{509609:512465},mptcp dss ack 3759959433], length 0
10:30:17.460683 IP 112.26.0.1.46615 > 112.26.0.8.54050: Flags [.], seq 512465:513893, ack 1, win 4017, options [nop,nop,TS val 147576 ecr 4294900808,mptcp dss ack 2843715367 seq 3759989421 subseq 512465 len 1428 csum 0x49ab], length 1428
10:30:17.460897 IP 112.26.0.1.46615 > 112.26.0.8.54050: Flags [.], seq 512465:513893, ack 1, win 4017, options [nop,nop,TS val 147576 ecr 4294900808,mptcp dss ack 2843715367 seq 3759989421 subseq 512465 len 1428 csum 0x49ab], length 1428
10:30:17.525662 IP 112.26.0.8.54050 > 112.26.0.1.46615: Flags [.], ack 508181, win 24487, options [nop,nop,TS val 4294901463 ecr 146896,nop,nop,sack 2 {513893:523889}{509609:512465},mptcp dss ack 3759959433], length 0
10:30:17.525867 IP 112.26.0.8.54050 > 112.26.0.1.46615: Flags [.], ack 508181, win 24487, options [nop,nop,TS val 4294901463 ecr 146896,nop,nop,sack 2 {513893:523889}{509609:512465},mptcp dss ack 3759959433], length 0
10:30:17.565881 IP 112.26.0.1.46615 > 112.26.0.8.54050: Flags [.], seq 505325:506753, ack 1, win 4017, options [nop,nop,TS val 146896 ecr 4294900197,mptcp dss ack 2843715367 seq 3759965145 subseq 505325 len 1428 csum 0x1ebd], length 1428
10:30:17.610544 IP 112.26.0.1.46615 > 112.26.0.8.54050: Flags [.], seq 523889:525317, ack 1, win 4017, options [nop,nop,TS val 147726 ecr 4294900888,mptcp dss ack 2843715367 seq 3760072245 subseq 523889 len 1428 csum 0xe9a7], length 1428
10:30:17.610773 IP 112.26.0.1.46615 > 112.26.0.8.54050: Flags [.], seq 523889:525317, ack 1, win 4017, options [nop,nop,TS val 147726 ecr 4294900888,mptcp dss ack 2843715367 seq 3760072245 subseq 523889 len 1428 csum 0xe9a7], length 1428
10:30:17.662254 IP 112.26.0.1.46615 > 112.26.0.8.54050: Flags [.], seq 508181:509609, ack 1, win 4017, options [nop,nop,TS val 147175 ecr 4294900373,mptcp dss ack 2843715367 seq 3759975141 subseq 508181 len 1428 csum 0xbc0c], length 1428
10:30:17.672779 IP 112.26.0.8.54050 > 112.26.0.1.46615: Flags [.], ack 512465, win 24487, options [nop,nop,TS val 4294901607 ecr 147175,nop,nop,sack 1 {513893:523889},mptcp dss ack 3759959433], length 0
10:30:17.672944 IP 112.26.0.8.54050 > 112.26.0.1.46615: Flags [.], ack 512465, win 24487, options [nop,nop,TS val 4294901607 ecr 147175,nop,nop,sack 1 {513893:523889},mptcp dss ack 3759959433], length 0
10:30:17.754672 IP 112.26.0.1.46615 > 112.26.0.8.54050: Flags [.], seq 525317:526745, ack 1, win 4017, options [nop,nop,TS val 147870 ecr 4294901102,mptcp dss ack 2843715367 seq 3760076529 subseq 525317 len 1428 csum 0x9ef], length 1428
10:30:17.754899 IP 112.26.0.1.46615 > 112.26.0.8.54050: Flags [.], seq 525317:526745, ack 1, win 4017, options [nop,nop,TS val 147870 ecr 4294901102,mptcp dss ack 2843715367 seq 3760076529 subseq 525317 len 1428 csum 0x9ef], length 1428
10:30:17.823538 IP 112.26.0.1.46615 > 112.26.0.8.54050: Flags [.], seq 526745:528173, ack 1, win 4017, options [nop,nop,TS val 147872 ecr 4294901199,mptcp dss ack 2843715367 seq 3760077957 subseq 526745 len 1428 csum 0x9b], length 1428
10:30:17.823750 IP 112.26.0.1.46615 > 112.26.0.8.54050: Flags [.], seq 526745:528173, ack 1, win 4017, options [nop,nop,TS val 147872 ecr 4294901199,mptcp dss ack 2843715367 seq 3760077957 subseq 526745 len 1428 csum 0x9b], length 1428
10:30:17.880874 IP 112.26.0.1.46615 > 112.26.0.8.54050: Flags [.], seq 528173:529601, ack 1, win 4017, options [nop,nop,TS val 147995 ecr 4294901259,mptcp dss ack 2843715367 seq 3760087953 subseq 528173 len 1428 csum 0x6e3c], length 1428
10:30:17.881066 IP 112.26.0.1.46615 > 112.26.0.8.54050: Flags [.], seq 528173:529601, ack 1, win 4017, options [nop,nop,TS val 147995 ecr 4294901259,mptcp dss ack 2843715367 seq 3760087953 subseq 528173 len 1428 csum 0x6e3c], length 1428
10:30:17.924504 IP 112.26.0.1.46615 > 112.26.0.8.54050: Flags [.], seq 529601:531029, ack 1, win 4017, options [nop,nop,TS val 148040 ecr 4294901353,mptcp dss ack 2843715367 seq 3760089381 subseq 529601 len 1428 csum 0xe9b2], length 1428
10:30:17.924701 IP 112.26.0.1.46615 > 112.26.0.8.54050: Flags [.], seq 529601:531029, ack 1, win 4017, options [nop,nop,TS val 148040 ecr 4294901353,mptcp dss ack 2843715367 seq 3760089381 subseq 529601 len 1428 csum 0xe9b2], length 1428
10:30:18.004632 IP 112.26.0.8.54050 > 112.26.0.1.46615: Flags [.], ack 523889, win 23789, options [nop,nop,TS val 4294901904 ecr 147576,mptcp dss ack 3760055109], length 0
10:30:18.004837 IP 112.26.0.8.54050 > 112.26.0.1.46615: Flags [.], ack 523889, win 23789, options [nop,nop,TS val 4294901904 ecr 147576,mptcp dss ack 3760055109], length 0
10:30:18.012279 IP 112.26.0.1.46615 > 112.26.0.8.54050: Flags [.], seq 512465:513893, ack 1, win 4017, options [nop,nop,TS val 147576 ecr 4294900808,mptcp dss ack 2843715367 seq 3759989421 subseq 512465 len 1428 csum 0x49ab], length 1428
10:30:18.026001 IP 112.26.0.1.46615 > 112.26.0.8.54050: Flags [.], seq 531029:532457, ack 1, win 4017, options [nop,nop,TS val 148143 ecr 4294901463,mptcp dss ack 2843715367 seq 3760095093 subseq 531029 len 1428 csum 0x3645], length 1428
10:30:18.026217 IP 112.26.0.1.46615 > 112.26.0.8.54050: Flags [.], seq 531029:532457, ack 1, win 4017, options [nop,nop,TS val 148143 ecr 4294901463,mptcp dss ack 2843715367 seq 3760095093 subseq 531029 len 1428 csum 0x3645], length 1428
10:30:18.068265 IP 112.26.0.1.46615 > 112.26.0.8.54050: Flags [.], seq 523889:525317, ack 1, win 4017, options [nop,nop,TS val 147726 ecr 4294900888,mptcp dss ack 2843715367 seq 3760072245 subseq 523889 len 1428 csum 0xe9a7], length 1428
10:30:18.071440 IP 112.26.0.8.54050 > 112.26.0.1.46615: Flags [.], ack 525317, win 24522, options [nop,nop,TS val 4294902013 ecr 147726,mptcp dss ack 3760062249], length 0
10:30:18.071649 IP 112.26.0.8.54050 > 112.26.0.1.46615: Flags [.], ack 525317, win 24522, options [nop,nop,TS val 4294902013 ecr 147726,mptcp dss ack 3760062249], length 0
10:30:18.177605 IP 112.26.0.1.46615 > 112.26.0.8.54050: Flags [.], seq 532457:533885, ack 1, win 4017, options [nop,nop,TS val 148293 ecr 4294901607,mptcp dss ack 2843715367 seq 3760106517 subseq 532457 len 1428 csum 0xb0ea], length 1428
10:30:18.177763 IP 112.26.0.1.46615 > 112.26.0.8.54050: Flags [.], seq 532457:533885, ack 1, win 4017, options [nop,nop,TS val 148293 ecr 4294901607,mptcp dss ack 2843715367 seq 3760106517 subseq 532457 len 1428 csum 0xb0ea], length 1428
10:30:18.212105 IP 112.26.0.1.46615 > 112.26.0.8.54050: Flags [.], seq 525317:526745, ack 1, win 4017, options [nop,nop,TS val 147870 ecr 4294901102,mptcp dss ack 2843715367 seq 3760076529 subseq 525317 len 1428 csum 0x9ef], length 1428
10:30:18.227207 IP 112.26.0.8.54050 > 112.26.0.1.46615: Flags [.], ack 526745, win 24522, options [nop,nop,TS val 4294902157 ecr 147870,mptcp dss ack 3760062249], length 0
10:30:18.227414 IP 112.26.0.8.54050 > 112.26.0.1.46615: Flags [.], ack 526745, win 24522, options [nop,nop,TS val 4294902157 ecr 147870,mptcp dss ack 3760062249], length 0
10:30:18.305302 IP 112.26.0.1.46615 > 112.26.0.8.54050: Flags [.], seq 526745:528173, ack 1, win 4017, options [nop,nop,TS val 147872 ecr 4294901199,mptcp dss ack 2843715367 seq 3760077957 subseq 526745 len 1428 csum 0x9b], length 1428
10:30:18.313901 IP 112.26.0.8.54050 > 112.26.0.1.46615: Flags [.], ack 528173, win 24478, options [nop,nop,TS val 4294902250 ecr 147872,mptcp dss ack 3760065105], length 0
10:30:18.314106 IP 112.26.0.8.54050 > 112.26.0.1.46615: Flags [.], ack 528173, win 24478, options [nop,nop,TS val 4294902250 ecr 147872,mptcp dss ack 3760065105], length 0
10:30:18.392632 IP 112.26.0.1.46615 > 112.26.0.8.54050: Flags [.], seq 528173:529601, ack 1, win 4017, options [nop,nop,TS val 147995 ecr 4294901259,mptcp dss ack 2843715367 seq 3760087953 subseq 528173 len 1428 csum 0x6e3c], length 1428
10:30:18.426038 IP 112.26.0.8.54050 > 112.26.0.1.46615: Flags [.], ack 529601, win 24507, options [nop,nop,TS val 4294902324 ecr 147995,mptcp dss ack 3760073673], length 0
10:30:18.426211 IP 112.26.0.8.54050 > 112.26.0.1.46615: Flags [.], ack 529601, win 24507, options [nop,nop,TS val 4294902324 ecr 147995,mptcp dss ack 3760073673], length 0
10:30:18.459774 IP 112.26.0.1.46615 > 112.26.0.8.54050: Flags [.], seq 529601:531029, ack 1, win 4017, options [nop,nop,TS val 148040 ecr 4294901353,mptcp dss ack 2843715367 seq 3760089381 subseq 529601 len 1428 csum 0xe9b2], length 1428
10:30:18.488459 IP 112.26.0.8.54050 > 112.26.0.1.46615: Flags [.], ack 531029, win 24543, options [nop,nop,TS val 4294902405 ecr 148040,mptcp dss ack 3760080813], length 0
10:30:18.488680 IP 112.26.0.8.54050 > 112.26.0.1.46615: Flags [.], ack 531029, win 24543, options [nop,nop,TS val 4294902405 ecr 148040,mptcp dss ack 3760080813], length 0
10:30:18.530768 IP 112.26.0.1.46615 > 112.26.0.8.54050: Flags [.], seq 533885:535313, ack 1, win 4017, options [nop,nop,TS val 148645 ecr 4294901904,mptcp dss ack 2843715367 seq 3760125081 subseq 533885 len 1428 csum 0x6dd7], length 1428
10:30:18.530932 IP 112.26.0.1.46615 > 112.26.0.8.54050: Flags [.], seq 533885:535313, ack 1, win 4017, options [nop,nop,TS val 148645 ecr 4294901904,mptcp dss ack 2843715367 seq 3760125081 subseq 533885 len 1428 csum 0x6dd7], length 1428
10:30:18.584203 IP 112.26.0.1.46615 > 112.26.0.8.54050: Flags [.], seq 531029:532457, ack 1, win 4017, options [nop,nop,TS val 148143 ecr 4294901463,mptcp dss ack 2843715367 seq 3760095093 subseq 531029 len 1428 csum 0x3645], length 1428
10:30:18.595044 IP 112.26.0.8.54050 > 112.26.0.1.46615: Flags [.], ack 532457, win 24507, options [nop,nop,TS val 4294902529 ecr 148143,mptcp dss ack 3760083669], length 0
10:30:18.595244 IP 112.26.0.8.54050 > 112.26.0.1.46615: Flags [.], ack 532457, win 24507, options [nop,nop,TS val 4294902529 ecr 148143,mptcp dss ack 3760083669], length 0
10:30:18.637486 IP 112.26.0.1.46615 > 112.26.0.8.54050: Flags [.], seq 535313:536741, ack 1, win 4017, options [nop,nop,TS val 148753 ecr 4294902013,mptcp dss ack 2843715367 seq 3760132221 subseq 535313 len 1428 csum 0x9aa4], length 1428
10:30:18.637703 IP 112.26.0.1.46615 > 112.26.0.8.54050: Flags [.], seq 535313:536741, ack 1, win 4017, options [nop,nop,TS val 148753 ecr 4294902013,mptcp dss ack 2843715367 seq 3760132221 subseq 535313 len 1428 csum 0x9aa4], length 1428
10:30:18.690395 IP 112.26.0.1.46615 > 112.26.0.8.54050: Flags [.], seq 532457:533885, ack 1, win 4017, options [nop,nop,TS val 148293 ecr 4294901607,mptcp dss ack 2843715367 seq 3760106517 subseq 532457 len 1428 csum 0xb0ea], length 1428
10:30:18.714112 IP 112.26.0.1.46615 > 112.26.0.8.54050: Flags [.], seq 536741:538169, ack 1, win 4017, options [nop,nop,TS val 148753 ecr 4294902013,mptcp dss ack 2843715367 seq 3760133649 subseq 536741 len 1428 csum 0xd2bd], length 1428
10:30:18.714322 IP 112.26.0.1.46615 > 112.26.0.8.54050: Flags [.], seq 536741:538169, ack 1, win 4017, options [nop,nop,TS val 148753 ecr 4294902013,mptcp dss ack 2843715367 seq 3760133649 subseq 536741 len 1428 csum 0xd2bd], length 1428
10:30:18.715882 IP 112.26.0.8.54050 > 112.26.0.1.46615: Flags [.], ack 533885, win 24507, options [nop,nop,TS val 4294902636 ecr 148293,mptcp dss ack 3760086525], length 0
10:30:18.716083 IP 112.26.0.8.54050 > 112.26.0.1.46615: Flags [.], ack 533885, win 24507, options [nop,nop,TS val 4294902636 ecr 148293,mptcp dss ack 3760086525], length 0
10:30:18.793470 IP 112.26.0.1.46615 > 112.26.0.8.54050: Flags [.], seq 538169:539597, ack 1, win 4017, options [nop,nop,TS val 148887 ecr 4294902157,mptcp dss ack 2843715367 seq 3760140789 subseq 538169 len 1428 csum 0xd8df], length 1428
10:30:18.793690 IP 112.26.0.1.46615 > 112.26.0.8.54050: Flags [.], seq 538169:539597, ack 1, win 4017, options [nop,nop,TS val 148887 ecr 4294902157,mptcp dss ack 2843715367 seq 3760140789 subseq 538169 len 1428 csum 0xd8df], length 1428
10:30:18.849782 IP 112.26.0.1.46615 > 112.26.0.8.54050: Flags [.], seq 539597:541025, ack 1, win 4017, options [nop,nop,TS val 148966 ecr 4294902250,mptcp dss ack 2843715367 seq 3760145073 subseq 539597 len 1428 csum 0x7f04], length 1428
10:30:18.849996 IP 112.26.0.1.46615 > 112.26.0.8.54050: Flags [.], seq 539597:541025, ack 1, win 4017, options [nop,nop,TS val 148966 ecr 4294902250,mptcp dss ack 2843715367 seq 3760145073 subseq 539597 len 1428 csum 0x7f04], length 1428
10:30:18.914929 IP 112.26.0.1.46615 > 112.26.0.8.54050: Flags [.], seq 541025:542453, ack 1, win 4017, options [nop,nop,TS val 149030 ecr 4294902324,mptcp dss ack 2843715367 seq 3760152213 subseq 541025 len 1428 csum 0x7743], length 1428
10:30:18.915140 IP 112.26.0.1.46615 > 112.26.0.8.54050: Flags [.], seq 541025:542453, ack 1, win 4017, options [nop,nop,TS val 149030 ecr 4294902324,mptcp dss ack 2843715367 seq 3760152213 subseq 541025 len 1428 csum 0x7743], length 1428
10:30:18.959793 IP 112.26.0.1.46615 > 112.26.0.8.54050: Flags [.], seq 542453:543881, ack 1, win 4017, options [nop,nop,TS val 149030 ecr 4294902324,mptcp dss ack 2843715367 seq 3760153641 subseq 542453 len 1428 csum 0x3c], length 1428
10:30:18.960057 IP 112.26.0.1.46615 > 112.26.0.8.54050: Flags [.], seq 542453:543881, ack 1, win 4017, options [nop,nop,TS val 149030 ecr 4294902324,mptcp dss ack 2843715367 seq 3760153641 subseq 542453 len 1428 csum 0x3c], length 1428
10:30:19.022761 IP 112.26.0.1.46615 > 112.26.0.8.54050: Flags [.], seq 543881:545309, ack 1, win 4017, options [nop,nop,TS val 149119 ecr 4294902405,mptcp dss ack 2843715367 seq 3760155069 subseq 543881 len 1428 csum 0x98d9], length 1428
10:30:19.022932 IP 112.26.0.1.46615 > 112.26.0.8.54050: Flags [.], seq 543881:545309, ack 1, win 4017, options [nop,nop,TS val 149119 ecr 4294902405,mptcp dss ack 2843715367 seq 3760155069 subseq 543881 len 1428 csum 0x98d9], length 1428
10:30:19.069343 IP 112.26.0.8.54050 > 112.26.0.1.46615: Flags [.], ack 535313, win 24460, options [nop,nop,TS val 4294903001 ecr 148645,mptcp dss ack 3760099377], length 0
10:30:19.069512 IP 112.26.0.8.54050 > 112.26.0.1.46615: Flags [.], ack 535313, win 24460, options [nop,nop,TS val 4294903001 ecr 148645,mptcp dss ack 3760099377], length 0
10:30:19.072538 IP 112.26.0.1.46615 > 112.26.0.8.54050: Flags [.], seq 533885:535313, ack 1, win 4017, options [nop,nop,TS val 148645 ecr 4294901904,mptcp dss ack 2843715367 seq 3760125081 subseq 533885 len 1428 csum 0x6dd7], length 1428
10:30:19.142892 IP 112.26.0.1.46615 > 112.26.0.8.54050: Flags [.], seq 545309:546737, ack 1, win 4017, options [nop,nop,TS val 149252 ecr 4294902529,mptcp dss ack 2843715367 seq 3760165065 subseq 545309 len 1428 csum 0x76f], length 1428
10:30:19.143078 IP 112.26.0.1.46615 > 112.26.0.8.54050: Flags [.], seq 545309:546737, ack 1, win 4017, options [nop,nop,TS val 149252 ecr 4294902529,mptcp dss ack 2843715367 seq 3760165065 subseq 545309 len 1428 csum 0x76f], length 1428
10:30:19.199938 IP 112.26.0.1.46615 > 112.26.0.8.54050: Flags [.], seq 535313:536741, ack 1, win 4017, options [nop,nop,TS val 148753 ecr 4294902013,mptcp dss ack 2843715367 seq 3760132221 subseq 535313 len 1428 csum 0x9aa4], length 1428
10:30:19.232275 IP 112.26.0.8.54050 > 112.26.0.1.46615: Flags [.], ack 536741, win 24507, options [nop,nop,TS val 4294903145 ecr 148753,mptcp dss ack 3760112229], length 0
10:30:19.232449 IP 112.26.0.8.54050 > 112.26.0.1.46615: Flags [.], ack 536741, win 24507, options [nop,nop,TS val 4294903145 ecr 148753,mptcp dss ack 3760112229], length 0
10:30:19.305221 IP 112.26.0.1.46615 > 112.26.0.8.54050: Flags [.], seq 536741:538169, ack 1, win 4017, options [nop,nop,TS val 148753 ecr 4294902013,mptcp dss ack 2843715367 seq 3760133649 subseq 536741 len 1428 csum 0xd2bd], length 1428
10:30:19.324157 IP 112.26.0.1.46615 > 112.26.0.8.54050: Flags [.], seq 546737:548165, ack 1, win 4017, options [nop,nop,TS val 149437 ecr 4294902636,mptcp dss ack 2843715367 seq 3760173633 subseq 546737 len 1428 csum 0x38fe], length 1428
10:30:19.324374 IP 112.26.0.1.46615 > 112.26.0.8.54050: Flags [.], seq 546737:548165, ack 1, win 4017, options [nop,nop,TS val 149437 ecr 4294902636,mptcp dss ack 2843715367 seq 3760173633 subseq 546737 len 1428 csum 0x38fe], length 1428
10:30:19.336609 IP 112.26.0.8.54050 > 112.26.0.1.46615: Flags [.], ack 538169, win 24485, options [nop,nop,TS val 4294903250 ecr 148753,mptcp dss ack 3760113657], length 0
10:30:19.336760 IP 112.26.0.8.54050 > 112.26.0.1.46615: Flags [.], ack 538169, win 24485, options [nop,nop,TS val 4294903250 ecr 148753,mptcp dss ack 3760113657], length 0
10:30:19.385377 IP 112.26.0.1.46615 > 112.26.0.8.54050: Flags [.], seq 538169:539597, ack 1, win 4017, options [nop,nop,TS val 148887 ecr 4294902157,mptcp dss ack 2843715367 seq 3760140789 subseq 538169 len 1428 csum 0xd8df], length 1428
10:30:19.407305 IP 112.26.0.8.54050 > 112.26.0.1.46615: Flags [.], ack 539597, win 24485, options [nop,nop,TS val 4294903330 ecr 148887,mptcp dss ack 3760113657], length 0
10:30:19.407476 IP 112.26.0.8.54050 > 112.26.0.1.46615: Flags [.], ack 539597, win 24485, options [nop,nop,TS val 4294903330 ecr 148887,mptcp dss ack 3760113657], length 0
10:30:19.471247 IP 112.26.0.1.46615 > 112.26.0.8.54050: Flags [.], seq 539597:541025, ack 1, win 4017, options [nop,nop,TS val 148966 ecr 4294902250,mptcp dss ack 2843715367 seq 3760145073 subseq 539597 len 1428 csum 0x7f04], length 1428
10:30:19.486552 IP 112.26.0.8.54050 > 112.26.0.1.46615: Flags [.], ack 541025, win 24485, options [nop,nop,TS val 4294903416 ecr 148966,mptcp dss ack 3760113657], length 0
10:30:19.486752 IP 112.26.0.8.54050 > 112.26.0.1.46615: Flags [.], ack 541025, win 24485, options [nop,nop,TS val 4294903416 ecr 148966,mptcp dss ack 3760113657], length 0
10:30:19.606795 IP 112.26.0.1.46615 > 112.26.0.8.54050: Flags [.], seq 541025:542453, ack 1, win 4017, options [nop,nop,TS val 149030 ecr 4294902324,mptcp dss ack 2843715367 seq 3760152213 subseq 541025 len 1428 csum 0x7743], length 1428
10:30:19.644186 IP 112.26.0.8.54050 > 112.26.0.1.46615: Flags [.], ack 542453, win 24485, options [nop,nop,TS val 4294903552 ecr 149030,mptcp dss ack 3760113657], length 0
10:30:19.644389 IP 112.26.0.8.54050 > 112.26.0.1.46615: Flags [.], ack 542453, win 24485, options [nop,nop,TS val 4294903552 ecr 149030,mptcp dss ack 3760113657], length 0
10:30:19.693834 IP 112.26.0.1.46615 > 112.26.0.8.54050: Flags [.], seq 542453:543881, ack 1, win 4017, options [nop,nop,TS val 149030 ecr 4294902324,mptcp dss ack 2843715367 seq 3760153641 subseq 542453 len 1428 csum 0x3c], length 1428
10:30:19.729483 IP 112.26.0.1.46615 > 112.26.0.8.54050: Flags [.], seq 543881:545309, ack 1, win 4017, options [nop,nop,TS val 149119 ecr 4294902405,mptcp dss ack 2843715367 seq 3760155069 subseq 543881 len 1428 csum 0x98d9], length 1428
10:30:19.732549 IP 112.26.0.8.54050 > 112.26.0.1.46615: Flags [.], ack 545309, win 24485, options [nop,nop,TS val 4294903674 ecr 149030,mptcp dss ack 3760113657], length 0
10:30:19.732724 IP 112.26.0.8.54050 > 112.26.0.1.46615: Flags [.], ack 545309, win 24485, options [nop,nop,TS val 4294903674 ecr 149030,mptcp dss ack 3760113657], length 0
10:30:19.794629 IP 112.26.0.1.46615 > 112.26.0.8.54050: Flags [.], seq 548165:549593, ack 1, win 4017, options [nop,nop,TS val 149910 ecr 4294903001,mptcp dss ack 2843715367 seq 3760189341 subseq 548165 len 1428 csum 0xd4c5], length 1428
10:30:19.794845 IP 112.26.0.1.46615 > 112.26.0.8.54050: Flags [.], seq 548165:549593, ack 1, win 4017, options [nop,nop,TS val 149910 ecr 4294903001,mptcp dss ack 2843715367 seq 3760189341 subseq 548165 len 1428 csum 0xd4c5], length 1428
10:30:19.842237 IP 112.26.0.1.46615 > 112.26.0.8.54050: Flags [.], seq 545309:546737, ack 1, win 4017, options [nop,nop,TS val 149252 ecr 4294902529,mptcp dss ack 2843715367 seq 3760165065 subseq 545309 len 1428 csum 0x76f], length 1428
10:30:19.902066 IP 112.26.0.8.54050 > 112.26.0.1.46615: Flags [.], ack 546737, win 24485, options [nop,nop,TS val 4294903844 ecr 149252,mptcp dss ack 3760113657], length 0
10:30:19.902267 IP 112.26.0.8.54050 > 112.26.0.1.46615: Flags [.], ack 546737, win 24485, options [nop,nop,TS val 4294903844 ecr 149252,mptcp dss ack 3760113657], length 0
10:30:19.918285 IP 112.26.0.1.46615 > 112.26.0.8.54050: Flags [.], seq 549593:551021, ack 1, win 4017, options [nop,nop,TS val 150032 ecr 4294903145,mptcp dss ack 2843715367 seq 3760192197 subseq 549593 len 1428 csum 0x321c], length 1428
10:30:19.918505 IP 112.26.0.1.46615 > 112.26.0.8.54050: Flags [.], seq 549593:551021, ack 1, win 4017, options [nop,nop,TS val 150032 ecr 4294903145,mptcp dss ack 2843715367 seq 3760192197 subseq 549593 len 1428 csum 0x321c], length 1428
10:30:19.976204 IP 112.26.0.1.46615 > 112.26.0.8.54050: Flags [.], seq 551021:552449, ack 1, win 4017, options [nop,nop,TS val 150032 ecr 4294903145,mptcp dss ack 2843715367 seq 3760193625 subseq 551021 len 1428 csum 0x36c6], length 1428
10:30:19.976383 IP 112.26.0.1.46615 > 112.26.0.8.54050: Flags [.], seq 551021:552449, ack 1, win 4017, options [nop,nop,TS val 150032 ecr 4294903145,mptcp dss ack 2843715367 seq 3760193625 subseq 551021 len 1428 csum 0x36c6], length 1428
10:30:20.025694 IP 112.26.0.1.46615 > 112.26.0.8.54050: Flags [.], seq 546737:548165, ack 1, win 4017, options [nop,nop,TS val 149437 ecr 4294902636,mptcp dss ack 2843715367 seq 3760173633 subseq 546737 len 1428 csum 0x38fe], length 1428
10:30:20.112308 IP 112.26.0.1.46615 > 112.26.0.8.54050: Flags [.], seq 552449:553877, ack 1, win 4017, options [nop,nop,TS val 150226 ecr 4294903330,mptcp dss ack 2843715367 seq 3760212189 subseq 552449 len 1428 csum 0x4f35], length 1428
10:30:20.112518 IP 112.26.0.1.46615 > 112.26.0.8.54050: Flags [.], seq 552449:553877, ack 1, win 4017, options [nop,nop,TS val 150226 ecr 4294903330,mptcp dss ack 2843715367 seq 3760212189 subseq 552449 len 1428 csum 0x4f35], length 1428
10:30:20.147917 IP 112.26.0.8.54050 > 112.26.0.1.46615: Flags [.], ack 548165, win 24485, options [nop,nop,TS val 4294904088 ecr 149437,mptcp dss ack 3760113657], length 0
10:30:20.148083 IP 112.26.0.8.54050 > 112.26.0.1.46615: Flags [.], ack 548165, win 24485, options [nop,nop,TS val 4294904088 ecr 149437,mptcp dss ack 3760113657], length 0
10:30:20.163218 IP 112.26.0.1.46615 > 112.26.0.8.54050: Flags [.], seq 553877:555305, ack 1, win 4017, options [nop,nop,TS val 150226 ecr 4294903330,mptcp dss ack 2843715367 seq 3760213617 subseq 553877 len 1428 csum 0xe6b6], length 1428
10:30:20.163430 IP 112.26.0.1.46615 > 112.26.0.8.54050: Flags [.], seq 553877:555305, ack 1, win 4017, options [nop,nop,TS val 150226 ecr 4294903330,mptcp dss ack 2843715367 seq 3760213617 subseq 553877 len 1428 csum 0xe6b6], length 1428
10:30:20.230506 IP 112.26.0.1.46615 > 112.26.0.8.54050: Flags [.], seq 555305:556733, ack 1, win 4017, options [nop,nop,TS val 150300 ecr 4294903416,mptcp dss ack 2843715367 seq 3760215045 subseq 555305 len 1428 csum 0xcd15], length 1428
10:30:20.230802 IP 112.26.0.1.46615 > 112.26.0.8.54050: Flags [.], seq 555305:556733, ack 1, win 4017, options [nop,nop,TS val 150300 ecr 4294903416,mptcp dss ack 2843715367 seq 3760215045 subseq 555305 len 1428 csum 0xcd15], length 1428
10:30:20.296808 IP 112.26.0.1.46615 > 112.26.0.8.54050: Flags [.], seq 556733:558161, ack 1, win 4017, options [nop,nop,TS val 150387 ecr 4294903552,mptcp dss ack 2843715367 seq 3760217901 subseq 556733 len 1428 csum 0xa58c], length 1428
10:30:20.296977 IP 112.26.0.1.46615 > 112.26.0.8.54050: Flags [.], seq 556733:558161, ack 1, win 4017, options [nop,nop,TS val 150387 ecr 4294903552,mptcp dss ack 2843715367 seq 3760217901 subseq 556733 len 1428 csum 0xa58c], length 1428
10:30:20.366148 IP 112.26.0.1.46615 > 112.26.0.8.54050: Flags [.], seq 558161:559589, ack 1, win 4017, options [nop,nop,TS val 150436 ecr 4294903674,mptcp dss ack 2843715367 seq 3760219329 subseq 558161 len 1428 csum 0x39a6], length 1428
10:30:20.366382 IP 112.26.0.1.46615 > 112.26.0.8.54050: Flags [.], seq 558161:559589, ack 1, win 4017, options [nop,nop,TS val 150436 ecr 4294903674,mptcp dss ack 2843715367 seq 3760219329 subseq 558161 len 1428 csum 0x39a6], length 1428
10:30:20.398782 IP 112.26.0.1.46615 > 112.26.0.8.54050: Flags [.], seq 548165:549593, ack 1, win 4017, options [nop,nop,TS val 149910 ecr 4294903001,mptcp dss ack 2843715367 seq 3760189341 subseq 548165 len 1428 csum 0xd4c5], length 1428
10:30:20.434040 IP 112.26.0.1.46615 > 112.26.0.8.54050: Flags [.], seq 559589:561017, ack 1, win 4017, options [nop,nop,TS val 150436 ecr 4294903674,mptcp dss ack 2843715367 seq 3760220757 subseq 559589 len 1428 csum 0xf3], length 1428
10:30:20.434271 IP 112.26.0.1.46615 > 112.26.0.8.54050: Flags [.], seq 559589:561017, ack 1, win 4017, options [nop,nop,TS val 150436 ecr 4294903674,mptcp dss ack 2843715367 seq 3760220757 subseq 559589 len 1428 csum 0xf3], length 1428
10:30:20.507148 IP 112.26.0.1.46615 > 112.26.0.8.54050: Flags [.], seq 561017:562445, ack 1, win 4017, options [nop,nop,TS val 150591 ecr 4294903844,mptcp dss ack 2843715367 seq 3760227897 subseq 561017 len 1428 csum 0xbbbb], length 1428
10:30:20.507356 IP 112.26.0.1.46615 > 112.26.0.8.54050: Flags [.], seq 561017:562445, ack 1, win 4017, options [nop,nop,TS val 150591 ecr 4294903844,mptcp dss ack 2843715367 seq 3760227897 subseq 561017 len 1428 csum 0xbbbb], length 1428
10:30:20.560684 IP 112.26.0.1.46615 > 112.26.0.8.54050: Flags [.], seq 549593:551021, ack 1, win 4017, options [nop,nop,TS val 150032 ecr 4294903145,mptcp dss ack 2843715367 seq 3760192197 subseq 549593 len 1428 csum 0x321c], length 1428
10:30:20.567778 IP 112.26.0.8.54050 > 112.26.0.1.46615: Flags [.], ack 551021, win 24485, options [nop,nop,TS val 4294904506 ecr 149910,mptcp dss ack 3760113657], length 0
10:30:20.567978 IP 112.26.0.8.54050 > 112.26.0.1.46615: Flags [.], ack 551021, win 24485, options [nop,nop,TS val 4294904506 ecr 149910,mptcp dss ack 3760113657], length 0
10:30:20.671525 IP 112.26.0.1.46615 > 112.26.0.8.54050: Flags [.], seq 551021:552449, ack 1, win 4017, options [nop,nop,TS val 150032 ecr 4294903145,mptcp dss ack 2843715367 seq 3760193625 subseq 551021 len 1428 csum 0x36c6], length 1428
10:30:20.737268 IP 112.26.0.1.46615 > 112.26.0.8.54050: Flags [.], seq 552449:553877, ack 1, win 4017, options [nop,nop,TS val 150226 ecr 4294903330,mptcp dss ack 2843715367 seq 3760212189 subseq 552449 len 1428 csum 0x4f35], length 1428
10:30:20.766468 IP 112.26.0.1.46615 > 112.26.0.8.54050: Flags [.], seq 562445:563873, ack 1, win 4017, options [nop,nop,TS val 150876 ecr 4294904088,mptcp dss ack 2843715367 seq 3760233609 subseq 562445 len 1428 csum 0x2fc], length 1428
10:30:20.766691 IP 112.26.0.1.46615 > 112.26.0.8.54050: Flags [.], seq 562445:563873, ack 1, win 4017, options [nop,nop,TS val 150876 ecr 4294904088,mptcp dss ack 2843715367 seq 3760233609 subseq 562445 len 1428 csum 0x2fc], length 1428
10:30:20.839323 IP 112.26.0.8.54050 > 112.26.0.1.46615: Flags [.], ack 553877, win 24129, options [nop,nop,TS val 4294904770 ecr 150032,mptcp dss ack 3760136505], length 0
10:30:20.839526 IP 112.26.0.8.54050 > 112.26.0.1.46615: Flags [.], ack 553877, win 24129, options [nop,nop,TS val 4294904770 ecr 150032,mptcp dss ack 3760136505], length 0
10:30:20.879247 IP 112.26.0.1.46615 > 112.26.0.8.54050: Flags [.], seq 555305:556733, ack 1, win 4017, options [nop,nop,TS val 150300 ecr 4294903416,mptcp dss ack 2843715367 seq 3760215045 subseq 555305 len 1428 csum 0xcd15], length 1428
10:30:20.922890 IP 112.26.0.8.54050 > 112.26.0.1.46615: Flags [.], ack 553877, win 24129, options [nop,nop,TS val 4294904819 ecr 150032,nop,nop,sack 1 {555305:556733},mptcp dss ack 3760136505], length 0
10:30:20.923134 IP 112.26.0.8.54050 > 112.26.0.1.46615: Flags [.], ack 553877, win 24129, options [nop,nop,TS val 4294904819 ecr 150032,nop,nop,sack 1 {555305:556733},mptcp dss ack 3760136505], length 0
10:30:20.949762 IP 112.26.0.1.46615 > 112.26.0.8.54050: Flags [.], seq 556733:558161, ack 1, win 4017, options [nop,nop,TS val 150387 ecr 4294903552,mptcp dss ack 2843715367 seq 3760217901 subseq 556733 len 1428 csum 0xa58c], length 1428
10:30:21.008965 IP 112.26.0.8.54050 > 112.26.0.1.46615: Flags [.], ack 553877, win 24085, options [nop,nop,TS val 4294904894 ecr 150032,nop,nop,sack 1 {555305:558161},mptcp dss ack 3760139361], length 0
10:30:21.009164 IP 112.26.0.8.54050 > 112.26.0.1.46615: Flags [.], ack 553877, win 24085, options [nop,nop,TS val 4294904894 ecr 150032,nop,nop,sack 1 {555305:558161},mptcp dss ack 3760139361], length 0
10:30:21.051151 IP 112.26.0.1.46615 > 112.26.0.8.54050: Flags [.], seq 558161:559589, ack 1, win 4017, options [nop,nop,TS val 150436 ecr 4294903674,mptcp dss ack 2843715367 seq 3760219329 subseq 558161 len 1428 csum 0x39a6], length 1428
10:30:21.114059 IP 112.26.0.8.54050 > 112.26.0.1.46615: Flags [.], ack 553877, win 24085, options [nop,nop,TS val 4294904997 ecr 150032,nop,nop,sack 1 {555305:559589},mptcp dss ack 3760139361], length 0
10:30:21.114263 IP 112.26.0.8.54050 > 112.26.0.1.46615: Flags [.], ack 553877, win 24085, options [nop,nop,TS val 4294904997 ecr 150032,nop,nop,sack 1 {555305:559589},mptcp dss ack 3760139361], length 0
10:30:21.150164 IP 112.26.0.1.46615 > 112.26.0.8.54050: Flags [.], seq 559589:561017, ack 1, win 4017, options [nop,nop,TS val 150436 ecr 4294903674,mptcp dss ack 2843715367 seq 3760220757 subseq 559589 len 1428 csum 0xf3], length 1428
10:30:21.177976 IP 112.26.0.8.54050 > 112.26.0.1.46615: Flags [.], ack 553877, win 24085, options [nop,nop,TS val 4294905096 ecr 150032,nop,nop,sack 1 {555305:561017},mptcp dss ack 3760139361], length 0
10:30:21.178181 IP 112.26.0.8.54050 > 112.26.0.1.46615: Flags [.], ack 553877, win 24085, options [nop,nop,TS val 4294905096 ecr 150032,nop,nop,sack 1 {555305:561017},mptcp dss ack 3760139361], length 0
10:30:21.257489 IP 112.26.0.1.46615 > 112.26.0.8.54050: Flags [.], seq 561017:562445, ack 1, win 4017, options [nop,nop,TS val 150591 ecr 4294903844,mptcp dss ack 2843715367 seq 3760227897 subseq 561017 len 1428 csum 0xbbbb], length 1428
10:30:21.280995 IP 112.26.0.8.54050 > 112.26.0.1.46615: Flags [.], ack 553877, win 24085, options [nop,nop,TS val 4294905203 ecr 150032,nop,nop,sack 1 {555305:562445},mptcp dss ack 3760139361], length 0
10:30:21.281201 IP 112.26.0.8.54050 > 112.26.0.1.46615: Flags [.], ack 553877, win 24085, options [nop,nop,TS val 4294905203 ecr 150032,nop,nop,sack 1 {555305:562445},mptcp dss ack 3760139361], length 0
10:30:21.322856 IP 112.26.0.1.46615 > 112.26.0.8.54050: Flags [.], seq 563873:565301, ack 1, win 4017, options [nop,nop,TS val 151437 ecr 4294904506,mptcp dss ack 2843715367 seq 3760266453 subseq 563873 len 1428 csum 0xca00], length 1428
10:30:21.323044 IP 112.26.0.1.46615 > 112.26.0.8.54050: Flags [.], seq 563873:565301, ack 1, win 4017, options [nop,nop,TS val 151437 ecr 4294904506,mptcp dss ack 2843715367 seq 3760266453 subseq 563873 len 1428 csum 0xca00], length 1428
10:30:21.365528 IP 112.26.0.1.46615 > 112.26.0.8.54050: Flags [.], seq 565301:566729, ack 1, win 4017, options [nop,nop,TS val 151437 ecr 4294904506,mptcp dss ack 2843715367 seq 3760267881 subseq 565301 len 1428 csum 0xa5cc], length 1428
10:30:21.365720 IP 112.26.0.1.46615 > 112.26.0.8.54050: Flags [.], seq 565301:566729, ack 1, win 4017, options [nop,nop,TS val 151437 ecr 4294904506,mptcp dss ack 2843715367 seq 3760267881 subseq 565301 len 1428 csum 0xa5cc], length 1428
10:30:21.425069 IP 112.26.0.8.54050 > 112.26.0.1.46615: Flags [.], ack 553877, win 24085, options [nop,nop,TS val 4294905363 ecr 150032,nop,nop,sack 1 {555305:563873},mptcp dss ack 3760139361], length 0
10:30:21.425248 IP 112.26.0.8.54050 > 112.26.0.1.46615: Flags [.], ack 553877, win 24085, options [nop,nop,TS val 4294905363 ecr 150032,nop,nop,sack 1 {555305:563873},mptcp dss ack 3760139361], length 0
10:30:21.430314 IP 112.26.0.1.46615 > 112.26.0.8.54050: Flags [.], seq 566729:568157, ack 1, win 4017, options [nop,nop,TS val 151437 ecr 4294904506,mptcp dss ack 2843715367 seq 3760269309 subseq 566729 len 1428 csum 0xd87b], length 1428
10:30:21.430495 IP 112.26.0.1.46615 > 112.26.0.8.54050: Flags [.], seq 566729:568157, ack 1, win 4017, options [nop,nop,TS val 151437 ecr 4294904506,mptcp dss ack 2843715367 seq 3760269309 subseq 566729 len 1428 csum 0xd87b], length 1428
10:30:21.462248 IP 112.26.0.1.46615 > 112.26.0.8.54050: Flags [.], seq 562445:563873, ack 1, win 4017, options [nop,nop,TS val 150876 ecr 4294904088,mptcp dss ack 2843715367 seq 3760233609 subseq 562445 len 1428 csum 0x2fc], length 1428
10:30:21.519933 IP 112.26.0.1.46615 > 112.26.0.8.54050: Flags [.], seq 568157:569585, ack 1, win 4017, options [nop,nop,TS val 151614 ecr 4294904770,mptcp dss ack 2843715367 seq 3760275021 subseq 568157 len 1428 csum 0x94a4], length 1428
10:30:21.520076 IP 112.26.0.1.46615 > 112.26.0.8.54050: Flags [.], seq 568157:569585, ack 1, win 4017, options [nop,nop,TS val 151614 ecr 4294904770,mptcp dss ack 2843715367 seq 3760275021 subseq 568157 len 1428 csum 0x94a4], length 1428
10:30:21.568607 IP 112.26.0.1.46615 > 112.26.0.8.54050: Flags [.], seq 569585:571013, ack 1, win 4017, options [nop,nop,TS val 151614 ecr 4294904770,mptcp dss ack 2843715367 seq 3760276449 subseq 569585 len 1428 csum 0x23c3], length 1428
10:30:21.568922 IP 112.26.0.1.46615 > 112.26.0.8.54050: Flags [.], seq 569585:571013, ack 1, win 4017, options [nop,nop,TS val 151614 ecr 4294904770,mptcp dss ack 2843715367 seq 3760276449 subseq 569585 len 1428 csum 0x23c3], length 1428
10:30:21.643684 IP 112.26.0.1.46615 > 112.26.0.8.54050: Flags [.], seq 571013:572441, ack 1, win 4017, options [nop,nop,TS val 151743 ecr 4294904819,mptcp dss ack 2843715367 seq 3760279305 subseq 571013 len 1428 csum 0xa9c1], length 1428
10:30:21.643998 IP 112.26.0.1.46615 > 112.26.0.8.54050: Flags [.], seq 571013:572441, ack 1, win 4017, options [nop,nop,TS val 151743 ecr 4294904819,mptcp dss ack 2843715367 seq 3760279305 subseq 571013 len 1428 csum 0xa9c1], length 1428
10:30:21.732583 IP 112.26.0.1.46615 > 112.26.0.8.54050: Flags [.], seq 572441:573869, ack 1, win 4017, options [nop,nop,TS val 151785 ecr 4294904894,mptcp dss ack 2843715367 seq 3760280733 subseq 572441 len 1428 csum 0x1e8], length 1428
10:30:21.732854 IP 112.26.0.1.46615 > 112.26.0.8.54050: Flags [.], seq 572441:573869, ack 1, win 4017, options [nop,nop,TS val 151785 ecr 4294904894,mptcp dss ack 2843715367 seq 3760280733 subseq 572441 len 1428 csum 0x1e8], length 1428
