10:29:25.569188 IP 112.26.0.8.54050 > 112.26.0.1.46615: Flags [S], seq 3691055875, win 65535, options [mss 1460,sackOK,TS val 4294849452 ecr 0,nop,wscale 6,mptcp capable csum {0xf3f641e5c9e720a6}], length 0
10:29:25.782386 IP 112.26.0.8.54050 > 112.26.0.1.46615: Flags [S], seq 3691055875, win 65535, options [mss 1460,sackOK,TS val 4294849452 ecr 0,nop,wscale 6,mptcp capable csum {0xf3f641e5c9e720a6}], length 0
10:29:25.975119 IP 112.26.0.1.46615 > 112.26.0.8.54050: Flags [S.], seq 406276099, ack 3691055876, win 65535, options [mss 1460,sackOK,TS val 95900 ecr 4294849452,nop,wscale 6,mptcp capable csum {0x6a6e46fcfc41c11a}], length 0
10:29:25.986188 IP 112.26.0.1.46615 > 112.26.0.8.54050: Flags [S.], seq 406276099, ack 3691055876, win 65535, options [mss 1460,sackOK,TS val 95900 ecr 4294849452,nop,wscale 6,mptcp capable csum {0x6a6e46fcfc41c11a}], length 0
10:29:25.994767 IP 112.26.0.8.54050 > 112.26.0.1.46615: Flags [.], ack 1, win 1369, options [nop,nop,TS val 4294849933 ecr 95900,mptcp capable csum {0xf3f641e5c9e720a6,0x6a6e46fcfc41c11a},mptcp dss ack 3758104649], length 0
10:29:25.995051 IP 112.26.0.8.54050 > 112.26.0.1.46615: Flags [.], ack 1, win 1369, options [nop,nop,TS val 4294849933 ecr 95900,mptcp capable csum {0xf3f641e5c9e720a6,0x6a6e46fcfc41c11a},mptcp dss ack 3758104649], length 0
10:29:26.002567 IP 112.26.0.8.54050 > 112.26.0.1.46615: Flags [.], ack 1, win 1369, options [nop,nop,TS val 4294849933 ecr 95900,mptcp capable csum {0xf3f641e5c9e720a6,0x6a6e46fcfc41c11a},mptcp dss ack 3758104649], length 0
10:30:16.939418 IP 112.26.0.1.46615 > 112.26.0.8.54050: Flags [.], seq 516749:518177, ack 1, win 4017, options [nop,nop,TS val 146456 ecr 4294899605,mptcp dss ack 2843715367 seq 3760012269 subseq 516749 len 1428 csum 0x78da], length 1428
10:30:16.939684 IP 112.26.0.1.46615 > 112.26.0.8.54050: Flags [.], seq 516749:518177, ack 1, win 4017, options [nop,nop,TS val 146456 ecr 4294899605,mptcp dss ack 2843715367 seq 3760012269 subseq 516749 len 1428 csum 0x78da], length 1428
10:30:16.950117 IP 112.26.0.8.54050 > 112.26.0.1.46615: Flags [.], ack 505325, win 24487, options [nop,nop,TS val 4294900888 ecr 145445,nop,nop,sack 2 {513893:518177}{509609:512465},mptcp dss ack 3759959433], length 0
10:30:17.057006 IP 112.26.0.8.54050 > 112.26.0.1.46615: Flags [.], ack 505325, win 24487, options [nop,nop,TS val 4294900373 ecr 145445,nop,nop,sack 2 {509609:512465}{506753:508181},mptcp dss ack 3759959433], length 0
10:30:17.133457 IP 112.26.0.8.54050 > 112.26.0.1.46615: Flags [.], ack 505325, win 24487, options [nop,nop,TS val 4294900481 ecr 145445,nop,nop,sack 2 {513893:515321}{509609:512465},mptcp dss ack 3759959433], length 0
10:30:17.155281 IP 112.26.0.1.46615 > 112.26.0.8.54050: Flags [.], seq 518177:519605, ack 1, win 4017, options [nop,nop,TS val 146747 ecr 4294899877,mptcp dss ack 2843715367 seq 3760029405 subseq 518177 len 1428 csum 0x9173], length 1428
10:30:17.155610 IP 112.26.0.1.46615 > 112.26.0.8.54050: Flags [.], seq 518177:519605, ack 1, win 4017, options [nop,nop,TS val 146747 ecr 4294899877,mptcp dss ack 2843715367 seq 3760029405 subseq 518177 len 1428 csum 0x9173], length 1428
10:30:17.159929 IP 112.26.0.8.54050 > 112.26.0.1.46615: Flags [.], ack 505325, win 24487, options [nop,nop,TS val 4294901102 ecr 145445,nop,nop,sack 2 {513893:519605}{509609:512465},mptcp dss ack 3759959433], length 0
10:30:17.212841 IP 112.26.0.1.46615 > 112.26.0.8.54050: Flags [.], seq 519605:521033, ack 1, win 4017, options [nop,nop,TS val 146801 ecr 4294899973,mptcp dss ack 2843715367 seq 3760030833 subseq 519605 len 1428 csum 0x71c0], length 1428
10:30:17.213160 IP 112.26.0.1.46615 > 112.26.0.8.54050: Flags [.], seq 519605:521033, ack 1, win 4017, options [nop,nop,TS val 146801 ecr 4294899973,mptcp dss ack 2843715367 seq 3760030833 subseq 519605 len 1428 csum 0x71c0], length 1428
10:30:17.256890 IP 112.26.0.8.54050 > 112.26.0.1.46615: Flags [.], ack 505325, win 24487, options [nop,nop,TS val 4294901199 ecr 145445,nop,nop,sack 2 {513893:521033}{509609:512465},mptcp dss ack 3759959433], length 0
10:30:17.307191 IP 112.26.0.1.46615 > 112.26.0.8.54050: Flags [.], seq 521033:522461, ack 1, win 4017, options [nop,nop,TS val 146801 ecr 4294899973,mptcp dss ack 2843715367 seq 3760032261 subseq 521033 len 1428 csum 0xffa6], length 1428
10:30:17.307451 IP 112.26.0.1.46615 > 112.26.0.8.54050: Flags [.], seq 521033:522461, ack 1, win 4017, options [nop,nop,TS val 146801 ecr 4294899973,mptcp dss ack 2843715367 seq 3760032261 subseq 521033 len 1428 csum 0xffa6], length 1428
10:30:17.325821 IP 112.26.0.8.54050 > 112.26.0.1.46615: Flags [.], ack 505325, win 24487, options [nop,nop,TS val 4294901259 ecr 145445,nop,nop,sack 2 {513893:522461}{509609:512465},mptcp dss ack 3759959433], length 0
10:30:17.405400 IP 112.26.0.1.46615 > 112.26.0.8.54050: Flags [.], seq 522461:523889, ack 1, win 4017, options [nop,nop,TS val 146896 ecr 4294900110,mptcp dss ack 2843715367 seq 3760035117 subseq 522461 len 1428 csum 0x6124], length 1428
10:30:17.405706 IP 112.26.0.1.46615 > 112.26.0.8.54050: Flags [.], seq 522461:523889, ack 1, win 4017, options [nop,nop,TS val 146896 ecr 4294900110,mptcp dss ack 2843715367 seq 3760035117 subseq 522461 len 1428 csum 0x6124], length 1428
10:30:17.410894 IP 112.26.0.8.54050 > 112.26.0.1.46615: Flags [.], ack 505325, win 24487, options [nop,nop,TS val 4294901353 ecr 145445,nop,nop,sack 2 {513893:523889}{509609:512465},mptcp dss ack 3759959433], length 0
10:30:17.458535 IP 112.26.0.8.54050 > 112.26.0.1.46615: Flags [.], ack 505325, win 24487, options [nop,nop,TS val 4294900808 ecr 145445,nop,nop,sack 2 {513893:516749}{509609:512465},mptcp dss ack 3759959433], length 0
10:30:17.513899 IP 112.26.0.1.46615 > 112.26.0.8.54050: Flags [.], seq 505325:506753, ack 1, win 4017, options [nop,nop,TS val 146896 ecr 4294900197,mptcp dss ack 2843715367 seq 3759965145 subseq 505325 len 1428 csum 0x1ebd], length 1428
10:30:17.514209 IP 112.26.0.1.46615 > 112.26.0.8.54050: Flags [.], seq 505325:506753, ack 1, win 4017, options [nop,nop,TS val 146896 ecr 4294900197,mptcp dss ack 2843715367 seq 3759965145 subseq 505325 len 1428 csum 0x1ebd], length 1428
10:30:17.520912 IP 112.26.0.8.54050 > 112.26.0.1.46615: Flags [.], ack 508181, win 24487, options [nop,nop,TS val 4294901463 ecr 146896,nop,nop,sack 2 {513893:523889}{509609:512465},mptcp dss ack 3759959433], length 0
10:30:17.596941 IP 112.26.0.8.54050 > 112.26.0.1.46615: Flags [.], ack 505325, win 24487, options [nop,nop,TS val 4294900888 ecr 145445,nop,nop,sack 2 {513893:518177}{509609:512465},mptcp dss ack 3759959433], length 0
10:30:17.655558 IP 112.26.0.1.46615 > 112.26.0.8.54050: Flags [.], seq 508181:509609, ack 1, win 4017, options [nop,nop,TS val 147175 ecr 4294900373,mptcp dss ack 2843715367 seq 3759975141 subseq 508181 len 1428 csum 0xbc0c], length 1428
10:30:17.655812 IP 112.26.0.1.46615 > 112.26.0.8.54050: Flags [.], seq 508181:509609, ack 1, win 4017, options [nop,nop,TS val 147175 ecr 4294900373,mptcp dss ack 2843715367 seq 3759975141 subseq 508181 len 1428 csum 0xbc0c], length 1428
10:30:17.664040 IP 112.26.0.8.54050 > 112.26.0.1.46615: Flags [.], ack 512465, win 24487, options [nop,nop,TS val 4294901607 ecr 147175,nop,nop,sack 1 {513893:523889},mptcp dss ack 3759959433], length 0
10:30:17.715649 IP 112.26.0.8.54050 > 112.26.0.1.46615: Flags [.], ack 505325, win 24487, options [nop,nop,TS val 4294901102 ecr 145445,nop,nop,sack 2 {513893:519605}{509609:512465},mptcp dss ack 3759959433], length 0
10:30:17.751981 IP 112.26.0.8.54050 > 112.26.0.1.46615: Flags [.], ack 505325, win 24487, options [nop,nop,TS val 4294901199 ecr 145445,nop,nop,sack 2 {513893:521033}{509609:512465},mptcp dss ack 3759959433], length 0
10:30:17.843001 IP 112.26.0.8.54050 > 112.26.0.1.46615: Flags [.], ack 505325, win 24487, options [nop,nop,TS val 4294901259 ecr 145445,nop,nop,sack 2 {513893:522461}{509609:512465},mptcp dss ack 3759959433], length 0
10:30:17.877429 IP 112.26.0.8.54050 > 112.26.0.1.46615: Flags [.], ack 505325, win 24487, options [nop,nop,TS val 4294901353 ecr 145445,nop,nop,sack 2 {513893:523889}{509609:512465},mptcp dss ack 3759959433], length 0
10:30:17.952331 IP 112.26.0.1.46615 > 112.26.0.8.54050: Flags [.], seq 512465:513893, ack 1, win 4017, options [nop,nop,TS val 147576 ecr 4294900808,mptcp dss ack 2843715367 seq 3759989421 subseq 512465 len 1428 csum 0x49ab], length 1428
10:30:17.952635 IP 112.26.0.1.46615 > 112.26.0.8.54050: Flags [.], seq 512465:513893, ack 1, win 4017, options [nop,nop,TS val 147576 ecr 4294900808,mptcp dss ack 2843715367 seq 3759989421 subseq 512465 len 1428 csum 0x49ab], length 1428
10:30:17.962046 IP 112.26.0.8.54050 > 112.26.0.1.46615: Flags [.], ack 523889, win 23789, options [nop,nop,TS val 4294901904 ecr 147576,mptcp dss ack 3760055109], length 0
10:30:18.024329 IP 112.26.0.8.54050 > 112.26.0.1.46615: Flags [.], ack 508181, win 24487, options [nop,nop,TS val 4294901463 ecr 146896,nop,nop,sack 2 {513893:523889}{509609:512465},mptcp dss ack 3759959433], length 0
10:30:18.065908 IP 112.26.0.1.46615 > 112.26.0.8.54050: Flags [.], seq 523889:525317, ack 1, win 4017, options [nop,nop,TS val 147726 ecr 4294900888,mptcp dss ack 2843715367 seq 3760072245 subseq 523889 len 1428 csum 0xe9a7], length 1428
10:30:18.066167 IP 112.26.0.1.46615 > 112.26.0.8.54050: Flags [.], seq 523889:525317, ack 1, win 4017, options [nop,nop,TS val 147726 ecr 4294900888,mptcp dss ack 2843715367 seq 3760072245 subseq 523889 len 1428 csum 0xe9a7], length 1428
10:30:18.069740 IP 112.26.0.8.54050 > 112.26.0.1.46615: Flags [.], ack 525317, win 24522, options [nop,nop,TS val 4294902013 ecr 147726,mptcp dss ack 3760062249], length 0
10:30:18.174623 IP 112.26.0.8.54050 > 112.26.0.1.46615: Flags [.], ack 512465, win 24487, options [nop,nop,TS val 4294901607 ecr 147175,nop,nop,sack 1 {513893:523889},mptcp dss ack 3759959433], length 0
10:30:18.210543 IP 112.26.0.1.46615 > 112.26.0.8.54050: Flags [.], seq 525317:526745, ack 1, win 4017, options [nop,nop,TS val 147870 ecr 4294901102,mptcp dss ack 2843715367 seq 3760076529 subseq 525317 len 1428 csum 0x9ef], length 1428
10:30:18.210881 IP 112.26.0.1.46615 > 112.26.0.8.54050: Flags [.], seq 525317:526745, ack 1, win 4017, options [nop,nop,TS val 147870 ecr 4294901102,mptcp dss ack 2843715367 seq 3760076529 subseq 525317 len 1428 csum 0x9ef], length 1428
10:30:18.220618 IP 112.26.0.8.54050 > 112.26.0.1.46615: Flags [.], ack 526745, win 24522, options [nop,nop,TS val 4294902157 ecr 147870,mptcp dss ack 3760062249], length 0
10:30:18.290459 IP 112.26.0.1.46615 > 112.26.0.8.54050: Flags [.], seq 526745:528173, ack 1, win 4017, options [nop,nop,TS val 147872 ecr 4294901199,mptcp dss ack 2843715367 seq 3760077957 subseq 526745 len 1428 csum 0x9b], length 1428
10:30:18.290745 IP 112.26.0.1.46615 > 112.26.0.8.54050: Flags [.], seq 526745:528173, ack 1, win 4017, options [nop,nop,TS val 147872 ecr 4294901199,mptcp dss ack 2843715367 seq 3760077957 subseq 526745 len 1428 csum 0x9b], length 1428
10:30:18.307044 IP 112.26.0.8.54050 > 112.26.0.1.46615: Flags [.], ack 528173, win 24478, options [nop,nop,TS val 4294902250 ecr 147872,mptcp dss ack 3760065105], length 0
10:30:18.377533 IP 112.26.0.1.46615 > 112.26.0.8.54050: Flags [.], seq 528173:529601, ack 1, win 4017, options [nop,nop,TS val 147995 ecr 4294901259,mptcp dss ack 2843715367 seq 3760087953 subseq 528173 len 1428 csum 0x6e3c], length 1428
10:30:18.377796 IP 112.26.0.1.46615 > 112.26.0.8.54050: Flags [.], seq 528173:529601, ack 1, win 4017, options [nop,nop,TS val 147995 ecr 4294901259,mptcp dss ack 2843715367 seq 3760087953 subseq 528173 len 1428 csum 0x6e3c], length 1428
10:30:18.424208 IP 112.26.0.8.54050 > 112.26.0.1.46615: Flags [.], ack 529601, win 24507, options [nop,nop,TS val 4294902324 ecr 147995,mptcp dss ack 3760073673], length 0
10:30:18.454413 IP 112.26.0.1.46615 > 112.26.0.8.54050: Flags [.], seq 529601:531029, ack 1, win 4017, options [nop,nop,TS val 148040 ecr 4294901353,mptcp dss ack 2843715367 seq 3760089381 subseq 529601 len 1428 csum 0xe9b2], length 1428
10:30:18.454699 IP 112.26.0.1.46615 > 112.26.0.8.54050: Flags [.], seq 529601:531029, ack 1, win 4017, options [nop,nop,TS val 148040 ecr 4294901353,mptcp dss ack 2843715367 seq 3760089381 subseq 529601 len 1428 csum 0xe9b2], length 1428
10:30:18.472799 IP 112.26.0.8.54050 > 112.26.0.1.46615: Flags [.], ack 531029, win 24543, options [nop,nop,TS val 4294902405 ecr 148040,mptcp dss ack 3760080813], length 0
10:30:18.526958 IP 112.26.0.8.54050 > 112.26.0.1.46615: Flags [.], ack 523889, win 23789, options [nop,nop,TS val 4294901904 ecr 147576,mptcp dss ack 3760055109], length 0
10:30:18.572710 IP 112.26.0.1.46615 > 112.26.0.8.54050: Flags [.], seq 531029:532457, ack 1, win 4017, options [nop,nop,TS val 148143 ecr 4294901463,mptcp dss ack 2843715367 seq 3760095093 subseq 531029 len 1428 csum 0x3645], length 1428
10:30:18.573025 IP 112.26.0.1.46615 > 112.26.0.8.54050: Flags [.], seq 531029:532457, ack 1, win 4017, options [nop,nop,TS val 148143 ecr 4294901463,mptcp dss ack 2843715367 seq 3760095093 subseq 531029 len 1428 csum 0x3645], length 1428
10:30:18.592790 IP 112.26.0.8.54050 > 112.26.0.1.46615: Flags [.], ack 532457, win 24507, options [nop,nop,TS val 4294902529 ecr 148143,mptcp dss ack 3760083669], length 0
10:30:18.635288 IP 112.26.0.8.54050 > 112.26.0.1.46615: Flags [.], ack 525317, win 24522, options [nop,nop,TS val 4294902013 ecr 147726,mptcp dss ack 3760062249], length 0
10:30:18.685262 IP 112.26.0.1.46615 > 112.26.0.8.54050: Flags [.], seq 532457:533885, ack 1, win 4017, options [nop,nop,TS val 148293 ecr 4294901607,mptcp dss ack 2843715367 seq 3760106517 subseq 532457 len 1428 csum 0xb0ea], length 1428
10:30:18.685565 IP 112.26.0.1.46615 > 112.26.0.8.54050: Flags [.], seq 532457:533885, ack 1, win 4017, options [nop,nop,TS val 148293 ecr 4294901607,mptcp dss ack 2843715367 seq 3760106517 subseq 532457 len 1428 csum 0xb0ea], length 1428
10:30:18.697496 IP 112.26.0.8.54050 > 112.26.0.1.46615: Flags [.], ack 533885, win 24507, options [nop,nop,TS val 4294902636 ecr 148293,mptcp dss ack 3760086525], length 0
10:30:18.769342 IP 112.26.0.8.54050 > 112.26.0.1.46615: Flags [.], ack 526745, win 24522, options [nop,nop,TS val 4294902157 ecr 147870,mptcp dss ack 3760062249], length 0
10:30:18.848079 IP 112.26.0.8.54050 > 112.26.0.1.46615: Flags [.], ack 528173, win 24478, options [nop,nop,TS val 4294902250 ecr 147872,mptcp dss ack 3760065105], length 0
10:30:18.912663 IP 112.26.0.8.54050 > 112.26.0.1.46615: Flags [.], ack 529601, win 24507, options [nop,nop,TS val 4294902324 ecr 147995,mptcp dss ack 3760073673], length 0
10:30:19.001265 IP 112.26.0.8.54050 > 112.26.0.1.46615: Flags [.], ack 531029, win 24543, options [nop,nop,TS val 4294902405 ecr 148040,mptcp dss ack 3760080813], length 0
10:30:19.051863 IP 112.26.0.1.46615 > 112.26.0.8.54050: Flags [.], seq 533885:535313, ack 1, win 4017, options [nop,nop,TS val 148645 ecr 4294901904,mptcp dss ack 2843715367 seq 3760125081 subseq 533885 len 1428 csum 0x6dd7], length 1428
10:30:19.052163 IP 112.26.0.1.46615 > 112.26.0.8.54050: Flags [.], seq 533885:535313, ack 1, win 4017, options [nop,nop,TS val 148645 ecr 4294901904,mptcp dss ack 2843715367 seq 3760125081 subseq 533885 len 1428 csum 0x6dd7], length 1428
10:30:19.057694 IP 112.26.0.8.54050 > 112.26.0.1.46615: Flags [.], ack 535313, win 24460, options [nop,nop,TS val 4294903001 ecr 148645,mptcp dss ack 3760099377], length 0
10:30:19.141090 IP 112.26.0.8.54050 > 112.26.0.1.46615: Flags [.], ack 532457, win 24507, options [nop,nop,TS val 4294902529 ecr 148143,mptcp dss ack 3760083669], length 0
10:30:19.197302 IP 112.26.0.1.46615 > 112.26.0.8.54050: Flags [.], seq 535313:536741, ack 1, win 4017, options [nop,nop,TS val 148753 ecr 4294902013,mptcp dss ack 2843715367 seq 3760132221 subseq 535313 len 1428 csum 0x9aa4], length 1428
10:30:19.197592 IP 112.26.0.1.46615 > 112.26.0.8.54050: Flags [.], seq 535313:536741, ack 1, win 4017, options [nop,nop,TS val 148753 ecr 4294902013,mptcp dss ack 2843715367 seq 3760132221 subseq 535313 len 1428 csum 0x9aa4], length 1428
10:30:19.203543 IP 112.26.0.8.54050 > 112.26.0.1.46615: Flags [.], ack 536741, win 24507, options [nop,nop,TS val 4294903145 ecr 148753,mptcp dss ack 3760112229], length 0
10:30:19.270707 IP 112.26.0.1.46615 > 112.26.0.8.54050: Flags [.], seq 536741:538169, ack 1, win 4017, options [nop,nop,TS val 148753 ecr 4294902013,mptcp dss ack 2843715367 seq 3760133649 subseq 536741 len 1428 csum 0xd2bd], length 1428
10:30:19.271002 IP 112.26.0.1.46615 > 112.26.0.8.54050: Flags [.], seq 536741:538169, ack 1, win 4017, options [nop,nop,TS val 148753 ecr 4294902013,mptcp dss ack 2843715367 seq 3760133649 subseq 536741 len 1428 csum 0xd2bd], length 1428
10:30:19.322729 IP 112.26.0.8.54050 > 112.26.0.1.46615: Flags [.], ack 533885, win 24507, options [nop,nop,TS val 4294902636 ecr 148293,mptcp dss ack 3760086525], length 0
10:30:19.330456 IP 112.26.0.8.54050 > 112.26.0.1.46615: Flags [.], ack 538169, win 24485, options [nop,nop,TS val 4294903250 ecr 148753,mptcp dss ack 3760113657], length 0
10:30:19.380314 IP 112.26.0.1.46615 > 112.26.0.8.54050: Flags [.], seq 538169:539597, ack 1, win 4017, options [nop,nop,TS val 148887 ecr 4294902157,mptcp dss ack 2843715367 seq 3760140789 subseq 538169 len 1428 csum 0xd8df], length 1428
10:30:19.380567 IP 112.26.0.1.46615 > 112.26.0.8.54050: Flags [.], seq 538169:539597, ack 1, win 4017, options [nop,nop,TS val 148887 ecr 4294902157,mptcp dss ack 2843715367 seq 3760140789 subseq 538169 len 1428 csum 0xd8df], length 1428
10:30:19.388115 IP 112.26.0.8.54050 > 112.26.0.1.46615: Flags [.], ack 539597, win 24485, options [nop,nop,TS val 4294903330 ecr 148887,mptcp dss ack 3760113657], length 0
10:30:19.464044 IP 112.26.0.1.46615 > 112.26.0.8.54050: Flags [.], seq 539597:541025, ack 1, win 4017, options [nop,nop,TS val 148966 ecr 4294902250,mptcp dss ack 2843715367 seq 3760145073 subseq 539597 len 1428 csum 0x7f04], length 1428
10:30:19.464354 IP 112.26.0.1.46615 > 112.26.0.8.54050: Flags [.], seq 539597:541025, ack 1, win 4017, options [nop,nop,TS val 148966 ecr 4294902250,mptcp dss ack 2843715367 seq 3760145073 subseq 539597 len 1428 csum 0x7f04], length 1428
10:30:19.473994 IP 112.26.0.8.54050 > 112.26.0.1.46615: Flags [.], ack 541025, win 24485, options [nop,nop,TS val 4294903416 ecr 148966,mptcp dss ack 3760113657], length 0
10:30:19.564505 IP 112.26.0.1.46615 > 112.26.0.8.54050: Flags [.], seq 541025:542453, ack 1, win 4017, options [nop,nop,TS val 149030 ecr 4294902324,mptcp dss ack 2843715367 seq 3760152213 subseq 541025 len 1428 csum 0x7743], length 1428
10:30:19.564826 IP 112.26.0.1.46615 > 112.26.0.8.54050: Flags [.], seq 541025:542453, ack 1, win 4017, options [nop,nop,TS val 149030 ecr 4294902324,mptcp dss ack 2843715367 seq 3760152213 subseq 541025 len 1428 csum 0x7743], length 1428
10:30:19.603387 IP 112.26.0.1.46615 > 112.26.0.8.54050: Flags [.], seq 542453:543881, ack 1, win 4017, options [nop,nop,TS val 149030 ecr 4294902324,mptcp dss ack 2843715367 seq 3760153641 subseq 542453 len 1428 csum 0x3c], length 1428
10:30:19.603631 IP 112.26.0.1.46615 > 112.26.0.8.54050: Flags [.], seq 542453:543881, ack 1, win 4017, options [nop,nop,TS val 149030 ecr 4294902324,mptcp dss ack 2843715367 seq 3760153641 subseq 542453 len 1428 csum 0x3c], length 1428
10:30:19.609207 IP 112.26.0.8.54050 > 112.26.0.1.46615: Flags [.], ack 542453, win 24485, options [nop,nop,TS val 4294903552 ecr 149030,mptcp dss ack 3760113657], length 0
10:30:19.682329 IP 112.26.0.1.46615 > 112.26.0.8.54050: Flags [.], seq 543881:545309, ack 1, win 4017, options [nop,nop,TS val 149119 ecr 4294902405,mptcp dss ack 2843715367 seq 3760155069 subseq 543881 len 1428 csum 0x98d9], length 1428
10:30:19.682650 IP 112.26.0.1.46615 > 112.26.0.8.54050: Flags [.], seq 543881:545309, ack 1, win 4017, options [nop,nop,TS val 149119 ecr 4294902405,mptcp dss ack 2843715367 seq 3760155069 subseq 543881 len 1428 csum 0x98d9], length 1428
10:30:19.731179 IP 112.26.0.8.54050 > 112.26.0.1.46615: Flags [.], ack 545309, win 24485, options [nop,nop,TS val 4294903674 ecr 149030,mptcp dss ack 3760113657], length 0
10:30:19.792289 IP 112.26.0.8.54050 > 112.26.0.1.46615: Flags [.], ack 535313, win 24460, options [nop,nop,TS val 4294903001 ecr 148645,mptcp dss ack 3760099377], length 0
10:30:19.838240 IP 112.26.0.1.46615 > 112.26.0.8.54050: Flags [.], seq 545309:546737, ack 1, win 4017, options [nop,nop,TS val 149252 ecr 4294902529,mptcp dss ack 2843715367 seq 3760165065 subseq 545309 len 1428 csum 0x76f], length 1428
10:30:19.838532 IP 112.26.0.1.46615 > 112.26.0.8.54050: Flags [.], seq 545309:546737, ack 1, win 4017, options [nop,nop,TS val 149252 ecr 4294902529,mptcp dss ack 2843715367 seq 3760165065 subseq 545309 len 1428 csum 0x76f], length 1428
10:30:19.899642 IP 112.26.0.8.54050 > 112.26.0.1.46615: Flags [.], ack 546737, win 24485, options [nop,nop,TS val 4294903844 ecr 149252,mptcp dss ack 3760113657], length 0
10:30:19.921213 IP 112.26.0.8.54050 > 112.26.0.1.46615: Flags [.], ack 536741, win 24507, options [nop,nop,TS val 4294903145 ecr 148753,mptcp dss ack 3760112229], length 0
10:30:20.022857 IP 112.26.0.1.46615 > 112.26.0.8.54050: Flags [.], seq 546737:548165, ack 1, win 4017, options [nop,nop,TS val 149437 ecr 4294902636,mptcp dss ack 2843715367 seq 3760173633 subseq 546737 len 1428 csum 0x38fe], length 1428
10:30:20.023157 IP 112.26.0.1.46615 > 112.26.0.8.54050: Flags [.], seq 546737:548165, ack 1, win 4017, options [nop,nop,TS val 149437 ecr 4294902636,mptcp dss ack 2843715367 seq 3760173633 subseq 546737 len 1428 csum 0x38fe], length 1428
10:30:20.108796 IP 112.26.0.8.54050 > 112.26.0.1.46615: Flags [.], ack 539597, win 24485, options [nop,nop,TS val 4294903330 ecr 148887,mptcp dss ack 3760113657], length 0
10:30:20.143929 IP 112.26.0.8.54050 > 112.26.0.1.46615: Flags [.], ack 548165, win 24485, options [nop,nop,TS val 4294904088 ecr 149437,mptcp dss ack 3760113657], length 0
10:30:20.182462 IP 112.26.0.8.54050 > 112.26.0.1.46615: Flags [.], ack 541025, win 24485, options [nop,nop,TS val 4294903416 ecr 148966,mptcp dss ack 3760113657], length 0
10:30:20.268593 IP 112.26.0.8.54050 > 112.26.0.1.46615: Flags [.], ack 542453, win 24485, options [nop,nop,TS val 4294903552 ecr 149030,mptcp dss ack 3760113657], length 0
10:30:20.317788 IP 112.26.0.8.54050 > 112.26.0.1.46615: Flags [.], ack 545309, win 24485, options [nop,nop,TS val 4294903674 ecr 149030,mptcp dss ack 3760113657], length 0
10:30:20.391929 IP 112.26.0.1.46615 > 112.26.0.8.54050: Flags [.], seq 548165:549593, ack 1, win 4017, options [nop,nop,TS val 149910 ecr 4294903001,mptcp dss ack 2843715367 seq 3760189341 subseq 548165 len 1428 csum 0xd4c5], length 1428
10:30:20.392234 IP 112.26.0.1.46615 > 112.26.0.8.54050: Flags [.], seq 548165:549593, ack 1, win 4017, options [nop,nop,TS val 149910 ecr 4294903001,mptcp dss ack 2843715367 seq 3760189341 subseq 548165 len 1428 csum 0xd4c5], length 1428
10:30:20.472371 IP 112.26.0.8.54050 > 112.26.0.1.46615: Flags [.], ack 546737, win 24485, options [nop,nop,TS val 4294903844 ecr 149252,mptcp dss ack 3760113657], length 0
10:30:20.556851 IP 112.26.0.1.46615 > 112.26.0.8.54050: Flags [.], seq 549593:551021, ack 1, win 4017, options [nop,nop,TS val 150032 ecr 4294903145,mptcp dss ack 2843715367 seq 3760192197 subseq 549593 len 1428 csum 0x321c], length 1428
10:30:20.557110 IP 112.26.0.1.46615 > 112.26.0.8.54050: Flags [.], seq 549593:551021, ack 1, win 4017, options [nop,nop,TS val 150032 ecr 4294903145,mptcp dss ack 2843715367 seq 3760192197 subseq 549593 len 1428 csum 0x321c], length 1428
10:30:20.566138 IP 112.26.0.8.54050 > 112.26.0.1.46615: Flags [.], ack 551021, win 24485, options [nop,nop,TS val 4294904506 ecr 149910,mptcp dss ack 3760113657], length 0
10:30:20.620368 IP 112.26.0.1.46615 > 112.26.0.8.54050: Flags [.], seq 551021:552449, ack 1, win 4017, options [nop,nop,TS val 150032 ecr 4294903145,mptcp dss ack 2843715367 seq 3760193625 subseq 551021 len 1428 csum 0x36c6], length 1428
10:30:20.620647 IP 112.26.0.1.46615 > 112.26.0.8.54050: Flags [.], seq 551021:552449, ack 1, win 4017, options [nop,nop,TS val 150032 ecr 4294903145,mptcp dss ack 2843715367 seq 3760193625 subseq 551021 len 1428 csum 0x36c6], length 1428
10:30:20.678863 IP 112.26.0.1.46615 > 112.26.0.8.54050: Flags [.], seq 552449:553877, ack 1, win 4017, options [nop,nop,TS val 150226 ecr 4294903330,mptcp dss ack 2843715367 seq 3760212189 subseq 552449 len 1428 csum 0x4f35], length 1428
10:30:20.679164 IP 112.26.0.1.46615 > 112.26.0.8.54050: Flags [.], seq 552449:553877, ack 1, win 4017, options [nop,nop,TS val 150226 ecr 4294903330,mptcp dss ack 2843715367 seq 3760212189 subseq 552449 len 1428 csum 0x4f35], length 1428
10:30:20.757719 IP 112.26.0.8.54050 > 112.26.0.1.46615: Flags [.], ack 548165, win 24485, options [nop,nop,TS val 4294904088 ecr 149437,mptcp dss ack 3760113657], length 0
10:30:20.826472 IP 112.26.0.8.54050 > 112.26.0.1.46615: Flags [.], ack 553877, win 24129, options [nop,nop,TS val 4294904770 ecr 150032,mptcp dss ack 3760136505], length 0
10:30:20.871229 IP 112.26.0.1.46615 > 112.26.0.8.54050: Flags [.], seq 555305:556733, ack 1, win 4017, options [nop,nop,TS val 150300 ecr 4294903416,mptcp dss ack 2843715367 seq 3760215045 subseq 555305 len 1428 csum 0xcd15], length 1428
10:30:20.871490 IP 112.26.0.1.46615 > 112.26.0.8.54050: Flags [.], seq 555305:556733, ack 1, win 4017, options [nop,nop,TS val 150300 ecr 4294903416,mptcp dss ack 2843715367 seq 3760215045 subseq 555305 len 1428 csum 0xcd15], length 1428
10:30:20.902648 IP 112.26.0.8.54050 > 112.26.0.1.46615: Flags [.], ack 553877, win 24129, options [nop,nop,TS val 4294904819 ecr 150032,nop,nop,sack 1 {555305:556733},mptcp dss ack 3760136505], length 0
10:30:20.947605 IP 112.26.0.1.46615 > 112.26.0.8.54050: Flags [.], seq 556733:558161, ack 1, win 4017, options [nop,nop,TS val 150387 ecr 4294903552,mptcp dss ack 2843715367 seq 3760217901 subseq 556733 len 1428 csum 0xa58c], length 1428
10:30:20.947854 IP 112.26.0.1.46615 > 112.26.0.8.54050: Flags [.], seq 556733:558161, ack 1, win 4017, options [nop,nop,TS val 150387 ecr 4294903552,mptcp dss ack 2843715367 seq 3760217901 subseq 556733 len 1428 csum 0xa58c], length 1428
10:30:21.005618 IP 112.26.0.8.54050 > 112.26.0.1.46615: Flags [.], ack 553877, win 24085, options [nop,nop,TS val 4294904894 ecr 150032,nop,nop,sack 1 {555305:558161},mptcp dss ack 3760139361], length 0
10:30:21.047760 IP 112.26.0.1.46615 > 112.26.0.8.54050: Flags [.], seq 558161:559589, ack 1, win 4017, options [nop,nop,TS val 150436 ecr 4294903674,mptcp dss ack 2843715367 seq 3760219329 subseq 558161 len 1428 csum 0x39a6], length 1428
10:30:21.048067 IP 112.26.0.1.46615 > 112.26.0.8.54050: Flags [.], seq 558161:559589, ack 1, win 4017, options [nop,nop,TS val 150436 ecr 4294903674,mptcp dss ack 2843715367 seq 3760219329 subseq 558161 len 1428 csum 0x39a6], length 1428
10:30:21.053509 IP 112.26.0.8.54050 > 112.26.0.1.46615: Flags [.], ack 553877, win 24085, options [nop,nop,TS val 4294904997 ecr 150032,nop,nop,sack 1 {555305:559589},mptcp dss ack 3760139361], length 0
10:30:21.144079 IP 112.26.0.1.46615 > 112.26.0.8.54050: Flags [.], seq 559589:561017, ack 1, win 4017, options [nop,nop,TS val 150436 ecr 4294903674,mptcp dss ack 2843715367 seq 3760220757 subseq 559589 len 1428 csum 0xf3], length 1428
10:30:21.144328 IP 112.26.0.1.46615 > 112.26.0.8.54050: Flags [.], seq 559589:561017, ack 1, win 4017, options [nop,nop,TS val 150436 ecr 4294903674,mptcp dss ack 2843715367 seq 3760220757 subseq 559589 len 1428 csum 0xf3], length 1428
10:30:21.152248 IP 112.26.0.8.54050 > 112.26.0.1.46615: Flags [.], ack 553877, win 24085, options [nop,nop,TS val 4294905096 ecr 150032,nop,nop,sack 1 {555305:561017},mptcp dss ack 3760139361], length 0
10:30:21.236900 IP 112.26.0.1.46615 > 112.26.0.8.54050: Flags [.], seq 561017:562445, ack 1, win 4017, options [nop,nop,TS val 150591 ecr 4294903844,mptcp dss ack 2843715367 seq 3760227897 subseq 561017 len 1428 csum 0xbbbb], length 1428
10:30:21.237234 IP 112.26.0.1.46615 > 112.26.0.8.54050: Flags [.], seq 561017:562445, ack 1, win 4017, options [nop,nop,TS val 150591 ecr 4294903844,mptcp dss ack 2843715367 seq 3760227897 subseq 561017 len 1428 csum 0xbbbb], length 1428
10:30:21.258896 IP 112.26.0.8.54050 > 112.26.0.1.46615: Flags [.], ack 553877, win 24085, options [nop,nop,TS val 4294905203 ecr 150032,nop,nop,sack 1 {555305:562445},mptcp dss ack 3760139361], length 0
10:30:21.318939 IP 112.26.0.8.54050 > 112.26.0.1.46615: Flags [.], ack 551021, win 24485, options [nop,nop,TS val 4294904506 ecr 149910,mptcp dss ack 3760113657], length 0
10:30:21.412828 IP 112.26.0.1.46615 > 112.26.0.8.54050: Flags [.], seq 562445:563873, ack 1, win 4017, options [nop,nop,TS val 150876 ecr 4294904088,mptcp dss ack 2843715367 seq 3760233609 subseq 562445 len 1428 csum 0x2fc], length 1428
10:30:21.413146 IP 112.26.0.1.46615 > 112.26.0.8.54050: Flags [.], seq 562445:563873, ack 1, win 4017, options [nop,nop,TS val 150876 ecr 4294904088,mptcp dss ack 2843715367 seq 3760233609 subseq 562445 len 1428 csum 0x2fc], length 1428
10:30:21.420587 IP 112.26.0.8.54050 > 112.26.0.1.46615: Flags [.], ack 553877, win 24085, options [nop,nop,TS val 4294905363 ecr 150032,nop,nop,sack 1 {555305:563873},mptcp dss ack 3760139361], length 0
10:30:21.496908 IP 112.26.0.8.54050 > 112.26.0.1.46615: Flags [.], ack 553877, win 24129, options [nop,nop,TS val 4294904770 ecr 150032,mptcp dss ack 3760136505], length 0
10:30:21.577513 IP 112.26.0.8.54050 > 112.26.0.1.46615: Flags [.], ack 553877, win 24129, options [nop,nop,TS val 4294904819 ecr 150032,nop,nop,sack 1 {555305:556733},mptcp dss ack 3760136505], length 0
10:30:21.626001 IP 112.26.0.8.54050 > 112.26.0.1.46615: Flags [.], ack 553877, win 24085, options [nop,nop,TS val 4294904894 ecr 150032,nop,nop,sack 1 {555305:558161},mptcp dss ack 3760139361], length 0
10:30:21.713514 IP 112.26.0.8.54050 > 112.26.0.1.46615: Flags [.], ack 553877, win 24085, options [nop,nop,TS val 4294904997 ecr 150032,nop,nop,sack 1 {555305:559589},mptcp dss ack 3760139361], length 0
10:30:21.771009 IP 112.26.0.8.54050 > 112.26.0.1.46615: Flags [.], ack 553877, win 24085, options [nop,nop,TS val 4294905096 ecr 150032,nop,nop,sack 1 {555305:561017},mptcp dss ack 3760139361], length 0
10:30:21.853211 IP 112.26.0.8.54050 > 112.26.0.1.46615: Flags [.], ack 553877, win 24085, options [nop,nop,TS val 4294905203 ecr 150032,nop,nop,sack 1 {555305:562445},mptcp dss ack 3760139361], length 0
10:30:21.915203 IP 112.26.0.1.46615 > 112.26.0.8.54050: Flags [.], seq 563873:565301, ack 1, win 4017, options [nop,nop,TS val 151437 ecr 4294904506,mptcp dss ack 2843715367 seq 3760266453 subseq 563873 len 1428 csum 0xca00], length 1428
10:30:21.915503 IP 112.26.0.1.46615 > 112.26.0.8.54050: Flags [.], seq 563873:565301, ack 1, win 4017, options [nop,nop,TS val 151437 ecr 4294904506,mptcp dss ack 2843715367 seq 3760266453 subseq 563873 len 1428 csum 0xca00], length 1428
10:30:21.921072 IP 112.26.0.8.54050 > 112.26.0.1.46615: Flags [.], ack 553877, win 24085, options [nop,nop,TS val 4294905864 ecr 150032,nop,nop,sack 1 {555305:565301},mptcp dss ack 3760139361], length 0
10:30:21.986494 IP 112.26.0.1.46615 > 112.26.0.8.54050: Flags [.], seq 565301:566729, ack 1, win 4017, options [nop,nop,TS val 151437 ecr 4294904506,mptcp dss ack 2843715367 seq 3760267881 subseq 565301 len 1428 csum 0xa5cc], length 1428
10:30:21.986789 IP 112.26.0.1.46615 > 112.26.0.8.54050: Flags [.], seq 565301:566729, ack 1, win 4017, options [nop,nop,TS val 151437 ecr 4294904506,mptcp dss ack 2843715367 seq 3760267881 subseq 565301 len 1428 csum 0xa5cc], length 1428
10:30:22.013504 IP 112.26.0.8.54050 > 112.26.0.1.46615: Flags [.], ack 553877, win 24085, options [nop,nop,TS val 4294905957 ecr 150032,nop,nop,sack 1 {555305:566729},mptcp dss ack 3760139361], length 0
10:30:22.069958 IP 112.26.0.8.54050 > 112.26.0.1.46615: Flags [.], ack 553877, win 24085, options [nop,nop,TS val 4294905363 ecr 150032,nop,nop,sack 1 {555305:563873},mptcp dss ack 3760139361], length 0
10:30:22.126769 IP 112.26.0.1.46615 > 112.26.0.8.54050: Flags [.], seq 566729:568157, ack 1, win 4017, options [nop,nop,TS val 151437 ecr 4294904506,mptcp dss ack 2843715367 seq 3760269309 subseq 566729 len 1428 csum 0xd87b], length 1428
10:30:22.127085 IP 112.26.0.1.46615 > 112.26.0.8.54050: Flags [.], seq 566729:568157, ack 1, win 4017, options [nop,nop,TS val 151437 ecr 4294904506,mptcp dss ack 2843715367 seq 3760269309 subseq 566729 len 1428 csum 0xd87b], length 1428
10:30:22.141001 IP 112.26.0.8.54050 > 112.26.0.1.46615: Flags [.], ack 553877, win 24429, options [nop,nop,TS val 4294906074 ecr 150032,nop,nop,sack 1 {555305:568157},mptcp dss ack 3760190769], length 0
10:30:22.212816 IP 112.26.0.1.46615 > 112.26.0.8.54050: Flags [.], seq 568157:569585, ack 1, win 4017, options [nop,nop,TS val 151614 ecr 4294904770,mptcp dss ack 2843715367 seq 3760275021 subseq 568157 len 1428 csum 0x94a4], length 1428
10:30:22.213038 IP 112.26.0.1.46615 > 112.26.0.8.54050: Flags [.], seq 568157:569585, ack 1, win 4017, options [nop,nop,TS val 151614 ecr 4294904770,mptcp dss ack 2843715367 seq 3760275021 subseq 568157 len 1428 csum 0x94a4], length 1428
10:30:22.242666 IP 112.26.0.8.54050 > 112.26.0.1.46615: Flags [.], ack 553877, win 24429, options [nop,nop,TS val 4294906160 ecr 150032,nop,nop,sack 1 {555305:569585},mptcp dss ack 3760190769], length 0
10:30:22.324892 IP 112.26.0.1.46615 > 112.26.0.8.54050: Flags [.], seq 571013:572441, ack 1, win 4017, options [nop,nop,TS val 151743 ecr 4294904819,mptcp dss ack 2843715367 seq 3760279305 subseq 571013 len 1428 csum 0xa9c1], length 1428
10:30:22.325202 IP 112.26.0.1.46615 > 112.26.0.8.54050: Flags [.], seq 571013:572441, ack 1, win 4017, options [nop,nop,TS val 151743 ecr 4294904819,mptcp dss ack 2843715367 seq 3760279305 subseq 571013 len 1428 csum 0xa9c1], length 1428
10:30:22.332423 IP 112.26.0.8.54050 > 112.26.0.1.46615: Flags [.], ack 553877, win 24239, options [nop,nop,TS val 4294906272 ecr 150032,nop,nop,sack 2 {571013:572441}{555305:569585},mptcp dss ack 3760205049], length 0
10:30:22.399757 IP 112.26.0.1.46615 > 112.26.0.8.54050: Flags [.], seq 572441:573869, ack 1, win 4017, options [nop,nop,TS val 151785 ecr 4294904894,mptcp dss ack 2843715367 seq 3760280733 subseq 572441 len 1428 csum 0x1e8], length 1428
10:30:22.400067 IP 112.26.0.1.46615 > 112.26.0.8.54050: Flags [.], seq 572441:573869, ack 1, win 4017, options [nop,nop,TS val 151785 ecr 4294904894,mptcp dss ack 2843715367 seq 3760280733 subseq 572441 len 1428 csum 0x1e8], length 1428
10:30:22.430271 IP 112.26.0.8.54050 > 112.26.0.1.46615: Flags [.], ack 553877, win 24239, options [nop,nop,TS val 4294906370 ecr 150032,nop,nop,sack 2 {571013:573869}{555305:569585},mptcp dss ack 3760205049], length 0
10:30:22.472997 IP 112.26.0.1.46615 > 112.26.0.8.54050: Flags [.], seq 553877:555305, ack 1, win 4017, options [nop,nop,TS val 151831 ecr 4294904997,mptcp dss ack 2843715367 seq 3760213617 subseq 553877 len 1428 csum 0xe6b6], length 1428
10:30:22.473255 IP 112.26.0.1.46615 > 112.26.0.8.54050: Flags [.], seq 553877:555305, ack 1, win 4017, options [nop,nop,TS val 151831 ecr 4294904997,mptcp dss ack 2843715367 seq 3760213617 subseq 553877 len 1428 csum 0xe6b6], length 1428
10:30:22.505745 IP 112.26.0.8.54050 > 112.26.0.1.46615: Flags [.], ack 569585, win 24239, options [nop,nop,TS val 4294906446 ecr 151831,nop,nop,sack 1 {571013:573869},mptcp dss ack 3760205049], length 0
10:30:22.542140 IP 112.26.0.1.46615 > 112.26.0.8.54050: Flags [.], seq 573869:575297, ack 1, win 4017, options [nop,nop,TS val 151896 ecr 4294905096,mptcp dss ack 2843715367 seq 3760285017 subseq 573869 len 1428 csum 0x5676], length 1428
10:30:22.542439 IP 112.26.0.1.46615 > 112.26.0.8.54050: Flags [.], seq 573869:575297, ack 1, win 4017, options [nop,nop,TS val 151896 ecr 4294905096,mptcp dss ack 2843715367 seq 3760285017 subseq 573869 len 1428 csum 0x5676], length 1428
10:30:22.601784 IP 112.26.0.8.54050 > 112.26.0.1.46615: Flags [.], ack 569585, win 24239, options [nop,nop,TS val 4294906544 ecr 151831,nop,nop,sack 1 {571013:575297},mptcp dss ack 3760205049], length 0
10:30:22.685957 IP 112.26.0.8.54050 > 112.26.0.1.46615: Flags [.], ack 553877, win 24085, options [nop,nop,TS val 4294905957 ecr 150032,nop,nop,sack 1 {555305:566729},mptcp dss ack 3760139361], length 0
10:30:22.734231 IP 112.26.0.8.54050 > 112.26.0.1.46615: Flags [.], ack 553877, win 24429, options [nop,nop,TS val 4294906074 ecr 150032,nop,nop,sack 1 {555305:568157},mptcp dss ack 3760190769], length 0
10:30:22.785305 IP 112.26.0.1.46615 > 112.26.0.8.54050: Flags [.], seq 575297:576725, ack 1, win 4017, options [nop,nop,TS val 152252 ecr 4294905363,mptcp dss ack 2843715367 seq 3760299297 subseq 575297 len 1428 csum 0x1aa6], length 1428
10:30:22.785560 IP 112.26.0.1.46615 > 112.26.0.8.54050: Flags [.], seq 575297:576725, ack 1, win 4017, options [nop,nop,TS val 152252 ecr 4294905363,mptcp dss ack 2843715367 seq 3760299297 subseq 575297 len 1428 csum 0x1aa6], length 1428
10:30:22.790134 IP 112.26.0.8.54050 > 112.26.0.1.46615: Flags [.], ack 569585, win 24239, options [nop,nop,TS val 4294906734 ecr 151831,nop,nop,sack 1 {571013:576725},mptcp dss ack 3760205049], length 0
10:30:22.874797 IP 112.26.0.8.54050 > 112.26.0.1.46615: Flags [.], ack 553877, win 24429, options [nop,nop,TS val 4294906160 ecr 150032,nop,nop,sack 1 {555305:569585},mptcp dss ack 3760190769], length 0
10:30:22.950180 IP 112.26.0.8.54050 > 112.26.0.1.46615: Flags [.], ack 553877, win 24239, options [nop,nop,TS val 4294906272 ecr 150032,nop,nop,sack 2 {571013:572441}{555305:569585},mptcp dss ack 3760205049], length 0
10:30:23.019380 IP 112.26.0.8.54050 > 112.26.0.1.46615: Flags [.], ack 553877, win 24239, options [nop,nop,TS val 4294906370 ecr 150032,nop,nop,sack 2 {571013:573869}{555305:569585},mptcp dss ack 3760205049], length 0
10:30:23.066960 IP 112.26.0.8.54050 > 112.26.0.1.46615: Flags [.], ack 569585, win 24239, options [nop,nop,TS val 4294906446 ecr 151831,nop,nop,sack 1 {571013:573869},mptcp dss ack 3760205049], length 0
10:30:23.158233 IP 112.26.0.8.54050 > 112.26.0.1.46615: Flags [.], ack 569585, win 24239, options [nop,nop,TS val 4294906544 ecr 151831,nop,nop,sack 1 {571013:575297},mptcp dss ack 3760205049], length 0
10:30:23.216788 IP 112.26.0.1.46615 > 112.26.0.8.54050: Flags [.], seq 576725:578153, ack 1, win 4017, options [nop,nop,TS val 152871 ecr 4294906074,mptcp dss ack 2843715367 seq 3760310721 subseq 576725 len 1428 csum 0x7a52], length 1428
10:30:23.217098 IP 112.26.0.1.46615 > 112.26.0.8.54050: Flags [.], seq 576725:578153, ack 1, win 4017, options [nop,nop,TS val 152871 ecr 4294906074,mptcp dss ack 2843715367 seq 3760310721 subseq 576725 len 1428 csum 0x7a52], length 1428
10:30:23.228976 IP 112.26.0.8.54050 > 112.26.0.1.46615: Flags [.], ack 569585, win 23968, options [nop,nop,TS val 4294907164 ecr 151831,nop,nop,sack 1 {571013:578153},mptcp dss ack 3760226469], length 0
10:30:23.326486 IP 112.26.0.8.54050 > 112.26.0.1.46615: Flags [.], ack 569585, win 24239, options [nop,nop,TS val 4294906734 ecr 151831,nop,nop,sack 1 {571013:576725},mptcp dss ack 3760205049], length 0
10:30:23.377641 IP 112.26.0.1.46615 > 112.26.0.8.54050: Flags [.], seq 578153:579581, ack 1, win 4017, options [nop,nop,TS val 153005 ecr 4294906160,mptcp dss ack 2843715367 seq 3760315005 subseq 578153 len 1428 csum 0x7871], length 1428
10:30:23.377971 IP 112.26.0.1.46615 > 112.26.0.8.54050: Flags [.], seq 578153:579581, ack 1, win 4017, options [nop,nop,TS val 153005 ecr 4294906160,mptcp dss ack 2843715367 seq 3760315005 subseq 578153 len 1428 csum 0x7871], length 1428
10:30:23.405673 IP 112.26.0.8.54050 > 112.26.0.1.46615: Flags [.], ack 569585, win 24118, options [nop,nop,TS val 4294907326 ecr 151831,nop,nop,sack 1 {571013:579581},mptcp dss ack 3760246461], length 0
