10:29:33.259004 IP 112.26.3.8.40113 > 112.26.3.1.46615: Flags [S], seq 2110223229, win 65535, options [mss 1460,sackOK,TS val 4294857066 ecr 0,nop,wscale 6,mptcp join id 6 token 0x9485611f nonce 0xe9dd8d1b], length 0
10:29:33.311404 IP 112.26.3.1.46615 > 112.26.3.8.40113: Flags [S.], seq 149559822, ack 2110223230, win 65535, options [mss 1460,sackOK,TS val 103377 ecr 4294857066,nop,wscale 6,mptcp join id 5 hmac 0x89c8395052e86075 nonce 0x2b29489b], length 0
10:29:33.414632 IP 112.26.3.1.46615 > 112.26.3.8.40113: Flags [S.], seq 149559822, ack 2110223230, win 65535, options [mss 1460,sackOK,TS val 103377 ecr 4294857066,nop,wscale 6,mptcp join id 5 hmac 0x89c8395052e86075 nonce 0x2b29489b], length 0
10:29:33.607310 IP 112.26.3.8.40113 > 112.26.3.1.46615: Flags [.], ack 1, win 7437, options [nop,nop,TS val 4294857441 ecr 103377,mptcp join hmac 0xe1569dd3d789e0842eb4539998398e150a4080a7], length 0
10:29:33.607629 IP 112.26.3.1.46615 > 112.26.3.8.40113: Flags [.], ack 1, win 4017, options [nop,nop,TS val 103725 ecr 4294857441,mptcp dss ack 2843715367], length 0
10:29:33.622303 IP 112.26.3.1.46615 > 112.26.3.8.40113: Flags [.], ack 1, win 4017, options [nop,nop,TS val 103725 ecr 4294857441,mptcp dss ack 2843715367], length 0
10:29:33.634807 IP 112.26.3.1.46615 > 112.26.3.8.40113: Flags [.], seq 1:1429, ack 1, win 4017, options [nop,nop,TS val 103753 ecr 4294857441,mptcp dss ack 2843715367 seq 3758242977 subseq 1 len 1428 csum 0xaf48], length 1428
10:30:05.217445 IP 112.26.3.1.46615 > 112.26.3.8.40113: Flags [.], seq 424117:425545, ack 1, win 4017, options [nop,nop,TS val 134598 ecr 4294888418,mptcp dss ack 2843715367 seq 3759488193 subseq 424117 len 1428 csum 0xd829], length 1428
10:30:05.330859 IP 112.26.3.1.46615 > 112.26.3.8.40113: Flags [.], seq 426973:428401, ack 1, win 4017, options [nop,nop,TS val 134747 ecr 4294888558,mptcp dss ack 2843715367 seq 3759493905 subseq 426973 len 1428 csum 0xb9f5], length 1428
10:30:05.355767 IP 112.26.3.8.40113 > 112.26.3.1.46615: Flags [.], ack 425545, win 23885, options [nop,nop,TS val 4294889279 ecr 134377,nop,nop,sack 1 {426973:428401},mptcp dss ack 3759388233], length 0
10:30:05.356099 IP 112.26.3.1.46615 > 112.26.3.8.40113: Flags [.], seq 439825:441253, ack 1, win 4017, options [nop,nop,TS val 135474 ecr 4294889279,mptcp dss ack 2843715367 seq 3759533889 subseq 439825 len 1428 csum 0x78e], length 1428
10:30:05.356172 IP 112.26.3.1.46615 > 112.26.3.8.40113: Flags [.], seq 441253:442681, ack 1, win 4017, options [nop,nop,TS val 135474 ecr 4294889279,mptcp dss ack 2843715367 seq 3759535317 subseq 441253 len 1428 csum 0xbbeb], length 1428
10:30:05.356361 IP 112.26.3.1.46615 > 112.26.3.8.40113: Flags [.], seq 442681:444109, ack 1, win 4017, options [nop,nop,TS val 135474 ecr 4294889279,mptcp dss ack 2843715367 seq 3759536745 subseq 442681 len 1428 csum 0x5aad], length 1428
10:30:05.447614 IP 112.26.3.1.46615 > 112.26.3.8.40113: Flags [.], seq 428401:429829, ack 1, win 4017, options [nop,nop,TS val 134747 ecr 4294888558,mptcp dss ack 2843715367 seq 3759495333 subseq 428401 len 1428 csum 0xf799], length 1428
10:30:05.492766 IP 112.26.3.8.40113 > 112.26.3.1.46615: Flags [.], ack 425545, win 23885, options [nop,nop,TS val 4294889396 ecr 134377,nop,nop,sack 1 {426973:429829},mptcp dss ack 3759388233], length 0
10:30:05.521273 IP 112.26.3.1.46615 > 112.26.3.8.40113: Flags [.], seq 444109:445537, ack 1, win 4017, options [nop,nop,TS val 135640 ecr 4294889396,mptcp dss ack 2843715367 seq 3759545313 subseq 444109 len 1428 csum 0xc93e], length 1428
10:30:05.541774 IP 112.26.3.1.46615 > 112.26.3.8.40113: Flags [.], seq 431257:432685, ack 1, win 4017, options [nop,nop,TS val 134909 ecr 4294888727,mptcp dss ack 2843715367 seq 3759508185 subseq 431257 len 1428 csum 0x7ee2], length 1428
10:30:05.592469 IP 112.26.3.8.40113 > 112.26.3.1.46615: Flags [.], ack 425545, win 23885, options [nop,nop,TS val 4294889490 ecr 134377,nop,nop,sack 2 {431257:432685}{426973:429829},mptcp dss ack 3759388233], length 0
10:30:05.592793 IP 112.26.3.1.46615 > 112.26.3.8.40113: Flags [.], seq 425545:426973, ack 1, win 4017, options [nop,nop,TS val 135711 ecr 4294889490,mptcp dss ack 2843715367 seq 3759489621 subseq 425545 len 1428 csum 0xaa74], length 1428
10:30:05.639350 IP 112.26.3.1.46615 > 112.26.3.8.40113: Flags [.], seq 432685:434113, ack 1, win 4017, options [nop,nop,TS val 134909 ecr 4294888727,mptcp dss ack 2843715367 seq 3759509613 subseq 432685 len 1428 csum 0x1041], length 1428
10:30:05.677894 IP 112.26.3.8.40113 > 112.26.3.1.46615: Flags [.], ack 425545, win 23885, options [nop,nop,TS val 4294889586 ecr 134377,nop,nop,sack 2 {431257:434113}{426973:429829},mptcp dss ack 3759388233], length 0
10:30:05.678341 IP 112.26.3.1.46615 > 112.26.3.8.40113: Flags [.], seq 429829:431257, ack 1, win 4017, options [nop,nop,TS val 135796 ecr 4294889586,mptcp dss ack 2843715367 seq 3759506757 subseq 429829 len 1428 csum 0xa03], length 1428
10:30:05.716160 IP 112.26.3.1.46615 > 112.26.3.8.40113: Flags [.], seq 434113:435541, ack 1, win 4017, options [nop,nop,TS val 135194 ecr 4294889014,mptcp dss ack 2843715367 seq 3759521037 subseq 434113 len 1428 csum 0xc4fb], length 1428
10:30:05.790210 IP 112.26.3.8.40113 > 112.26.3.1.46615: Flags [.], ack 425545, win 23712, options [nop,nop,TS val 4294889709 ecr 134377,nop,nop,sack 2 {431257:435541}{426973:429829},mptcp dss ack 3759422505], length 0
10:30:05.831189 IP 112.26.3.1.46615 > 112.26.3.8.40113: Flags [.], seq 435541:436969, ack 1, win 4017, options [nop,nop,TS val 135194 ecr 4294889014,mptcp dss ack 2843715367 seq 3759522465 subseq 435541 len 1428 csum 0xd638], length 1428
10:30:05.893660 IP 112.26.3.8.40113 > 112.26.3.1.46615: Flags [.], ack 425545, win 23712, options [nop,nop,TS val 4294889779 ecr 134377,nop,nop,sack 2 {431257:436969}{426973:429829},mptcp dss ack 3759422505], length 0
10:30:05.919000 IP 112.26.3.1.46615 > 112.26.3.8.40113: Flags [.], seq 436969:438397, ack 1, win 4017, options [nop,nop,TS val 135194 ecr 4294889014,mptcp dss ack 2843715367 seq 3759523893 subseq 436969 len 1428 csum 0x13a3], length 1428
10:30:05.978876 IP 112.26.3.1.46615 > 112.26.3.8.40113: Flags [.], seq 438397:439825, ack 1, win 4017, options [nop,nop,TS val 135194 ecr 4294889014,mptcp dss ack 2843715367 seq 3759525321 subseq 438397 len 1428 csum 0x9cfc], length 1428
10:30:05.993632 IP 112.26.3.8.40113 > 112.26.3.1.46615: Flags [.], ack 425545, win 23712, options [nop,nop,TS val 4294889887 ecr 134377,nop,nop,sack 2 {431257:438397}{426973:429829},mptcp dss ack 3759422505], length 0
10:30:05.997564 IP 112.26.3.1.46615 > 112.26.3.8.40113: Flags [.], seq 445537:446965, ack 1, win 4017, options [nop,nop,TS val 136116 ecr 4294889887,mptcp dss ack 2843715367 seq 3759566733 subseq 445537 len 1428 csum 0x1dee], length 1428
10:30:06.085405 IP 112.26.3.8.40113 > 112.26.3.1.46615: Flags [.], ack 425545, win 23712, options [nop,nop,TS val 4294889994 ecr 134377,nop,nop,sack 2 {431257:439825}{426973:429829},mptcp dss ack 3759422505], length 0
10:30:06.098936 IP 112.26.3.1.46615 > 112.26.3.8.40113: Flags [.], seq 439825:441253, ack 1, win 4017, options [nop,nop,TS val 135474 ecr 4294889279,mptcp dss ack 2843715367 seq 3759533889 subseq 439825 len 1428 csum 0x78e], length 1428
10:30:06.109849 IP 112.26.3.1.46615 > 112.26.3.8.40113: Flags [P.], seq 446965:448393, ack 1, win 4017, options [nop,nop,TS val 136228 ecr 4294889994,mptcp dss ack 2843715367 seq 3759569589 subseq 446965 len 1428 csum 0x7555], length 1428
10:30:06.214029 IP 112.26.3.8.40113 > 112.26.3.1.46615: Flags [.], ack 425545, win 23712, options [nop,nop,TS val 4294890098 ecr 134377,nop,nop,sack 2 {431257:441253}{426973:429829},mptcp dss ack 3759422505], length 0
10:30:06.229598 IP 112.26.3.1.46615 > 112.26.3.8.40113: Flags [.], seq 442681:444109, ack 1, win 4017, options [nop,nop,TS val 135474 ecr 4294889279,mptcp dss ack 2843715367 seq 3759536745 subseq 442681 len 1428 csum 0x5aad], length 1428
10:30:06.255248 IP 112.26.3.1.46615 > 112.26.3.8.40113: Flags [.], seq 448393:449821, ack 1, win 4017, options [nop,nop,TS val 136373 ecr 4294890098,mptcp dss ack 2843715367 seq 3759573873 subseq 448393 len 1428 csum 0x3bbb], length 1428
10:30:06.292617 IP 112.26.3.1.46615 > 112.26.3.8.40113: Flags [.], seq 444109:445537, ack 1, win 4017, options [nop,nop,TS val 135640 ecr 4294889396,mptcp dss ack 2843715367 seq 3759545313 subseq 444109 len 1428 csum 0xc93e], length 1428
10:30:06.316436 IP 112.26.3.8.40113 > 112.26.3.1.46615: Flags [.], ack 425545, win 23712, options [nop,nop,TS val 4294890199 ecr 134377,nop,nop,sack 2 {442681:444109}{431257:441253},mptcp dss ack 3759422505], length 0
10:30:06.316782 IP 112.26.3.1.46615 > 112.26.3.8.40113: Flags [.], seq 441253:442681, ack 1, win 4017, options [nop,nop,TS val 136435 ecr 4294890199,mptcp dss ack 2843715367 seq 3759535317 subseq 441253 len 1428 csum 0xbbeb], length 1428
10:30:06.394669 IP 112.26.3.1.46615 > 112.26.3.8.40113: Flags [.], seq 425545:426973, ack 1, win 4017, options [nop,nop,TS val 135711 ecr 4294889490,mptcp dss ack 2843715367 seq 3759489621 subseq 425545 len 1428 csum 0xaa74], length 1428
10:30:06.445320 IP 112.26.3.8.40113 > 112.26.3.1.46615: Flags [.], ack 425545, win 23712, options [nop,nop,TS val 4294890293 ecr 134377,nop,nop,sack 2 {442681:445537}{431257:441253},mptcp dss ack 3759422505], length 0
10:30:06.463676 IP 112.26.3.1.46615 > 112.26.3.8.40113: Flags [.], seq 449821:451249, ack 1, win 4017, options [nop,nop,TS val 136581 ecr 4294890293,mptcp dss ack 2843715367 seq 3759585297 subseq 449821 len 1428 csum 0xf464], length 1428
10:30:06.481039 IP 112.26.3.1.46615 > 112.26.3.8.40113: Flags [.], seq 429829:431257, ack 1, win 4017, options [nop,nop,TS val 135796 ecr 4294889586,mptcp dss ack 2843715367 seq 3759506757 subseq 429829 len 1428 csum 0xa03], length 1428
10:30:06.560538 IP 112.26.3.8.40113 > 112.26.3.1.46615: Flags [.], ack 429829, win 23712, options [nop,nop,TS val 4294890357 ecr 135711,nop,nop,sack 2 {442681:445537}{431257:441253},mptcp dss ack 3759422505], length 0
10:30:06.560835 IP 112.26.3.1.46615 > 112.26.3.8.40113: Flags [.], seq 451249:452677, ack 1, win 4017, options [nop,nop,TS val 136679 ecr 4294890357,mptcp dss ack 2843715367 seq 3759592437 subseq 451249 len 1428 csum 0x228a], length 1428
10:30:06.591459 IP 112.26.3.1.46615 > 112.26.3.8.40113: Flags [.], seq 445537:446965, ack 1, win 4017, options [nop,nop,TS val 136116 ecr 4294889887,mptcp dss ack 2843715367 seq 3759566733 subseq 445537 len 1428 csum 0x1dee], length 1428
10:30:06.641404 IP 112.26.3.1.46615 > 112.26.3.8.40113: Flags [P.], seq 446965:448393, ack 1, win 4017, options [nop,nop,TS val 136228 ecr 4294889994,mptcp dss ack 2843715367 seq 3759569589 subseq 446965 len 1428 csum 0x7555], length 1428
10:30:06.687309 IP 112.26.3.8.40113 > 112.26.3.1.46615: Flags [.], ack 441253, win 23712, options [nop,nop,TS val 4294890468 ecr 135796,nop,nop,sack 1 {442681:445537},mptcp dss ack 3759422505], length 0
10:30:06.687679 IP 112.26.3.1.46615 > 112.26.3.8.40113: Flags [.], seq 452677:454105, ack 1, win 4017, options [nop,nop,TS val 136806 ecr 4294890468,mptcp dss ack 2843715367 seq 3759595293 subseq 452677 len 1428 csum 0xeef1], length 1428
10:30:06.724929 IP 112.26.3.1.46615 > 112.26.3.8.40113: Flags [.], seq 448393:449821, ack 1, win 4017, options [nop,nop,TS val 136373 ecr 4294890098,mptcp dss ack 2843715367 seq 3759573873 subseq 448393 len 1428 csum 0x3bbb], length 1428
10:30:06.787005 IP 112.26.3.1.46615 > 112.26.3.8.40113: Flags [.], seq 441253:442681, ack 1, win 4017, options [nop,nop,TS val 136435 ecr 4294890199,mptcp dss ack 2843715367 seq 3759535317 subseq 441253 len 1428 csum 0xbbeb], length 1428
10:30:06.806949 IP 112.26.3.8.40113 > 112.26.3.1.46615: Flags [.], ack 441253, win 23712, options [nop,nop,TS val 4294890563 ecr 135796,nop,nop,sack 1 {442681:446965},mptcp dss ack 3759422505], length 0
10:30:06.831758 IP 112.26.3.1.46615 > 112.26.3.8.40113: Flags [.], seq 454105:455533, ack 1, win 4017, options [nop,nop,TS val 136950 ecr 4294890563,mptcp dss ack 2843715367 seq 3759596721 subseq 454105 len 1428 csum 0x9810], length 1428
10:30:06.889359 IP 112.26.3.1.46615 > 112.26.3.8.40113: Flags [.], seq 449821:451249, ack 1, win 4017, options [nop,nop,TS val 136581 ecr 4294890293,mptcp dss ack 2843715367 seq 3759585297 subseq 449821 len 1428 csum 0xf464], length 1428
10:30:06.913193 IP 112.26.3.8.40113 > 112.26.3.1.46615: Flags [.], ack 441253, win 23712, options [nop,nop,TS val 4294890686 ecr 135796,nop,nop,sack 1 {442681:448393},mptcp dss ack 3759422505], length 0
10:30:06.947748 IP 112.26.3.1.46615 > 112.26.3.8.40113: Flags [.], seq 455533:456961, ack 1, win 4017, options [nop,nop,TS val 137066 ecr 4294890686,mptcp dss ack 2843715367 seq 3759601005 subseq 455533 len 1428 csum 0x28f2], length 1428
10:30:06.998080 IP 112.26.3.8.40113 > 112.26.3.1.46615: Flags [.], ack 441253, win 24099, options [nop,nop,TS val 4294890812 ecr 135796,nop,nop,sack 1 {442681:449821},mptcp dss ack 3759503901], length 0
10:30:07.014601 IP 112.26.3.1.46615 > 112.26.3.8.40113: Flags [.], seq 451249:452677, ack 1, win 4017, options [nop,nop,TS val 136679 ecr 4294890357,mptcp dss ack 2843715367 seq 3759592437 subseq 451249 len 1428 csum 0x228a], length 1428
10:30:07.061371 IP 112.26.3.1.46615 > 112.26.3.8.40113: Flags [.], seq 456961:458389, ack 1, win 4017, options [nop,nop,TS val 137180 ecr 4294890812,mptcp dss ack 2843715367 seq 3759603861 subseq 456961 len 1428 csum 0xc49b], length 1428
10:30:07.098262 IP 112.26.3.8.40113 > 112.26.3.1.46615: Flags [.], ack 449821, win 24099, options [nop,nop,TS val 4294890912 ecr 136435,mptcp dss ack 3759503901], length 0
10:30:07.098566 IP 112.26.3.1.46615 > 112.26.3.8.40113: Flags [.], seq 458389:459817, ack 1, win 4017, options [nop,nop,TS val 137217 ecr 4294890912,mptcp dss ack 2843715367 seq 3759605289 subseq 458389 len 1428 csum 0xff7b], length 1428
10:30:07.098656 IP 112.26.3.1.46615 > 112.26.3.8.40113: Flags [.], seq 459817:461245, ack 1, win 4017, options [nop,nop,TS val 137217 ecr 4294890912,mptcp dss ack 2843715367 seq 3759606717 subseq 459817 len 1428 csum 0xb3eb], length 1428
10:30:07.163349 IP 112.26.3.1.46615 > 112.26.3.8.40113: Flags [.], seq 452677:454105, ack 1, win 4017, options [nop,nop,TS val 136806 ecr 4294890468,mptcp dss ack 2843715367 seq 3759595293 subseq 452677 len 1428 csum 0xeef1], length 1428
10:30:07.171748 IP 112.26.3.8.40113 > 112.26.3.1.46615: Flags [.], ack 451249, win 24099, options [nop,nop,TS val 4294891040 ecr 136581,mptcp dss ack 3759503901], length 0
10:30:07.172032 IP 112.26.3.1.46615 > 112.26.3.8.40113: Flags [.], seq 461245:462673, ack 1, win 4017, options [nop,nop,TS val 137290 ecr 4294891040,mptcp dss ack 2843715367 seq 3759609573 subseq 461245 len 1428 csum 0x8cdf], length 1428
10:30:07.293853 IP 112.26.3.8.40113 > 112.26.3.1.46615: Flags [.], ack 452677, win 24099, options [nop,nop,TS val 4294891149 ecr 136679,mptcp dss ack 3759503901], length 0
10:30:07.294223 IP 112.26.3.1.46615 > 112.26.3.8.40113: Flags [.], seq 462673:464101, ack 1, win 4017, options [nop,nop,TS val 137412 ecr 4294891149,mptcp dss ack 2843715367 seq 3759612429 subseq 462673 len 1428 csum 0x571f], length 1428
10:30:07.337822 IP 112.26.3.1.46615 > 112.26.3.8.40113: Flags [.], seq 454105:455533, ack 1, win 4017, options [nop,nop,TS val 136950 ecr 4294890563,mptcp dss ack 2843715367 seq 3759596721 subseq 454105 len 1428 csum 0x9810], length 1428
10:30:07.351356 IP 112.26.3.8.40113 > 112.26.3.1.46615: Flags [.], ack 454105, win 24099, options [nop,nop,TS val 4294891228 ecr 136806,mptcp dss ack 3759503901], length 0
10:30:07.351832 IP 112.26.3.1.46615 > 112.26.3.8.40113: Flags [.], seq 464101:465529, ack 1, win 4017, options [nop,nop,TS val 137470 ecr 4294891228,mptcp dss ack 2843715367 seq 3759615285 subseq 464101 len 1428 csum 0xb40e], length 1428
10:30:07.351894 IP 112.26.3.1.46615 > 112.26.3.8.40113: Flags [.], seq 465529:466957, ack 1, win 4017, options [nop,nop,TS val 137470 ecr 4294891228,mptcp dss ack 2843715367 seq 3759616713 subseq 465529 len 1428 csum 0xa4a3], length 1428
10:30:07.461725 IP 112.26.3.1.46615 > 112.26.3.8.40113: Flags [.], seq 455533:456961, ack 1, win 4017, options [nop,nop,TS val 137066 ecr 4294890686,mptcp dss ack 2843715367 seq 3759601005 subseq 455533 len 1428 csum 0x28f2], length 1428
10:30:07.489013 IP 112.26.3.8.40113 > 112.26.3.1.46615: Flags [.], ack 455533, win 23921, options [nop,nop,TS val 4294891347 ecr 136950,mptcp dss ack 3759515325], length 0
10:30:07.489481 IP 112.26.3.1.46615 > 112.26.3.8.40113: Flags [.], seq 466957:468385, ack 1, win 4017, options [nop,nop,TS val 137608 ecr 4294891347,mptcp dss ack 2843715367 seq 3759633849 subseq 466957 len 1428 csum 0x897], length 1428
10:30:07.514173 IP 112.26.3.1.46615 > 112.26.3.8.40113: Flags [.], seq 456961:458389, ack 1, win 4017, options [nop,nop,TS val 137180 ecr 4294890812,mptcp dss ack 2843715367 seq 3759603861 subseq 456961 len 1428 csum 0xc49b], length 1428
10:30:07.601002 IP 112.26.3.1.46615 > 112.26.3.8.40113: Flags [.], seq 458389:459817, ack 1, win 4017, options [nop,nop,TS val 137217 ecr 4294890912,mptcp dss ack 2843715367 seq 3759605289 subseq 458389 len 1428 csum 0xff7b], length 1428
10:30:07.623284 IP 112.26.3.8.40113 > 112.26.3.1.46615: Flags [.], ack 456961, win 23921, options [nop,nop,TS val 4294891408 ecr 137066,mptcp dss ack 3759515325], length 0
10:30:07.623643 IP 112.26.3.1.46615 > 112.26.3.8.40113: Flags [.], seq 468385:469813, ack 1, win 4017, options [nop,nop,TS val 137742 ecr 4294891408,mptcp dss ack 2843715367 seq 3759646701 subseq 468385 len 1428 csum 0xf027], length 1428
10:30:07.647960 IP 112.26.3.1.46615 > 112.26.3.8.40113: Flags [.], seq 459817:461245, ack 1, win 4017, options [nop,nop,TS val 137217 ecr 4294890912,mptcp dss ack 2843715367 seq 3759606717 subseq 459817 len 1428 csum 0xb3eb], length 1428
10:30:07.722235 IP 112.26.3.8.40113 > 112.26.3.1.46615: Flags [.], ack 458389, win 23921, options [nop,nop,TS val 4294891475 ecr 137180,mptcp dss ack 3759515325], length 0
10:30:07.722706 IP 112.26.3.1.46615 > 112.26.3.8.40113: Flags [.], seq 469813:471241, ack 1, win 4017, options [nop,nop,TS val 137841 ecr 4294891475,mptcp dss ack 2843715367 seq 3759649557 subseq 469813 len 1428 csum 0xf82b], length 1428
10:30:07.748076 IP 112.26.3.1.46615 > 112.26.3.8.40113: Flags [.], seq 461245:462673, ack 1, win 4017, options [nop,nop,TS val 137290 ecr 4294891040,mptcp dss ack 2843715367 seq 3759609573 subseq 461245 len 1428 csum 0x8cdf], length 1428
10:30:07.828322 IP 112.26.3.8.40113 > 112.26.3.1.46615: Flags [.], ack 459817, win 23921, options [nop,nop,TS val 4294891588 ecr 137217,mptcp dss ack 3759515325], length 0
10:30:07.828682 IP 112.26.3.1.46615 > 112.26.3.8.40113: Flags [.], seq 471241:472669, ack 1, win 4017, options [nop,nop,TS val 137947 ecr 4294891588,mptcp dss ack 2843715367 seq 3759650985 subseq 471241 len 1428 csum 0x8985], length 1428
10:30:07.828758 IP 112.26.3.1.46615 > 112.26.3.8.40113: Flags [.], seq 472669:474097, ack 1, win 4017, options [nop,nop,TS val 137947 ecr 4294891588,mptcp dss ack 2843715367 seq 3759652413 subseq 472669 len 1428 csum 0xfa2e], length 1428
10:30:07.835190 IP 112.26.3.1.46615 > 112.26.3.8.40113: Flags [.], seq 462673:464101, ack 1, win 4017, options [nop,nop,TS val 137412 ecr 4294891149,mptcp dss ack 2843715367 seq 3759612429 subseq 462673 len 1428 csum 0x571f], length 1428
10:30:07.925456 IP 112.26.3.8.40113 > 112.26.3.1.46615: Flags [.], ack 461245, win 23921, options [nop,nop,TS val 4294891701 ecr 137217,mptcp dss ack 3759515325], length 0
10:30:07.925945 IP 112.26.3.1.46615 > 112.26.3.8.40113: Flags [.], seq 474097:475525, ack 1, win 4017, options [nop,nop,TS val 138044 ecr 4294891701,mptcp dss ack 2843715367 seq 3759656697 subseq 474097 len 1428 csum 0x9bb5], length 1428
10:30:07.940453 IP 112.26.3.1.46615 > 112.26.3.8.40113: Flags [.], seq 464101:465529, ack 1, win 4017, options [nop,nop,TS val 137470 ecr 4294891228,mptcp dss ack 2843715367 seq 3759615285 subseq 464101 len 1428 csum 0xb40e], length 1428
10:30:08.041998 IP 112.26.3.1.46615 > 112.26.3.8.40113: Flags [.], seq 465529:466957, ack 1, win 4017, options [nop,nop,TS val 137470 ecr 4294891228,mptcp dss ack 2843715367 seq 3759616713 subseq 465529 len 1428 csum 0xa4a3], length 1428
10:30:08.065977 IP 112.26.3.8.40113 > 112.26.3.1.46615: Flags [.], ack 462673, win 23921, options [nop,nop,TS val 4294891807 ecr 137290,mptcp dss ack 3759515325], length 0
10:30:08.066319 IP 112.26.3.1.46615 > 112.26.3.8.40113: Flags [.], seq 475525:476953, ack 1, win 4017, options [nop,nop,TS val 138184 ecr 4294891807,mptcp dss ack 2843715367 seq 3759663837 subseq 475525 len 1428 csum 0xbc7d], length 1428
10:30:08.178486 IP 112.26.3.1.46615 > 112.26.3.8.40113: Flags [.], seq 466957:468385, ack 1, win 4017, options [nop,nop,TS val 137608 ecr 4294891347,mptcp dss ack 2843715367 seq 3759633849 subseq 466957 len 1428 csum 0x897], length 1428
10:30:08.249497 IP 112.26.3.8.40113 > 112.26.3.1.46615: Flags [.], ack 464101, win 23921, options [nop,nop,TS val 4294891914 ecr 137412,mptcp dss ack 3759515325], length 0
10:30:08.249841 IP 112.26.3.1.46615 > 112.26.3.8.40113: Flags [.], seq 476953:478381, ack 1, win 4017, options [nop,nop,TS val 138368 ecr 4294891914,mptcp dss ack 2843715367 seq 3759666693 subseq 476953 len 1428 csum 0x684e], length 1428
10:30:08.273249 IP 112.26.3.1.46615 > 112.26.3.8.40113: Flags [.], seq 468385:469813, ack 1, win 4017, options [nop,nop,TS val 137742 ecr 4294891408,mptcp dss ack 2843715367 seq 3759646701 subseq 468385 len 1428 csum 0xf027], length 1428
10:30:08.354003 IP 112.26.3.8.40113 > 112.26.3.1.46615: Flags [.], ack 465529, win 23921, options [nop,nop,TS val 4294892002 ecr 137470,mptcp dss ack 3759515325], length 0
10:30:08.354342 IP 112.26.3.1.46615 > 112.26.3.8.40113: Flags [.], seq 478381:479809, ack 1, win 4017, options [nop,nop,TS val 138472 ecr 4294892002,mptcp dss ack 2843715367 seq 3759668121 subseq 478381 len 1428 csum 0xa0ef], length 1428
10:30:08.354415 IP 112.26.3.1.46615 > 112.26.3.8.40113: Flags [.], seq 479809:481237, ack 1, win 4017, options [nop,nop,TS val 138472 ecr 4294892002,mptcp dss ack 2843715367 seq 3759669549 subseq 479809 len 1428 csum 0x8dc5], length 1428
10:30:08.366199 IP 112.26.3.1.46615 > 112.26.3.8.40113: Flags [.], seq 469813:471241, ack 1, win 4017, options [nop,nop,TS val 137841 ecr 4294891475,mptcp dss ack 2843715367 seq 3759649557 subseq 469813 len 1428 csum 0xf82b], length 1428
10:30:08.476496 IP 112.26.3.1.46615 > 112.26.3.8.40113: Flags [.], seq 471241:472669, ack 1, win 4017, options [nop,nop,TS val 137947 ecr 4294891588,mptcp dss ack 2843715367 seq 3759650985 subseq 471241 len 1428 csum 0x8985], length 1428
10:30:08.522673 IP 112.26.3.8.40113 > 112.26.3.1.46615: Flags [.], ack 466957, win 23921, options [nop,nop,TS val 4294892061 ecr 137470,mptcp dss ack 3759515325], length 0
10:30:08.523146 IP 112.26.3.1.46615 > 112.26.3.8.40113: Flags [.], seq 481237:482665, ack 1, win 4017, options [nop,nop,TS val 138641 ecr 4294892061,mptcp dss ack 2843715367 seq 3759676689 subseq 481237 len 1428 csum 0x418a], length 1428
10:30:08.582365 IP 112.26.3.1.46615 > 112.26.3.8.40113: Flags [.], seq 472669:474097, ack 1, win 4017, options [nop,nop,TS val 137947 ecr 4294891588,mptcp dss ack 2843715367 seq 3759652413 subseq 472669 len 1428 csum 0xfa2e], length 1428
10:30:08.633369 IP 112.26.3.8.40113 > 112.26.3.1.46615: Flags [.], ack 468385, win 23921, options [nop,nop,TS val 4294892149 ecr 137608,mptcp dss ack 3759515325], length 0
10:30:08.633797 IP 112.26.3.1.46615 > 112.26.3.8.40113: Flags [.], seq 482665:484093, ack 1, win 4017, options [nop,nop,TS val 138752 ecr 4294892149,mptcp dss ack 2843715367 seq 3759679545 subseq 482665 len 1428 csum 0x347b], length 1428
10:30:08.694593 IP 112.26.3.1.46615 > 112.26.3.8.40113: Flags [.], seq 474097:475525, ack 1, win 4017, options [nop,nop,TS val 138044 ecr 4294891701,mptcp dss ack 2843715367 seq 3759656697 subseq 474097 len 1428 csum 0x9bb5], length 1428
10:30:08.712283 IP 112.26.3.8.40113 > 112.26.3.1.46615: Flags [.], ack 469813, win 23921, options [nop,nop,TS val 4294892261 ecr 137742,mptcp dss ack 3759515325], length 0
10:30:08.712646 IP 112.26.3.1.46615 > 112.26.3.8.40113: Flags [.], seq 484093:485521, ack 1, win 4017, options [nop,nop,TS val 138831 ecr 4294892261,mptcp dss ack 2843715367 seq 3759682401 subseq 484093 len 1428 csum 0xf8ad], length 1428
10:30:08.757832 IP 112.26.3.1.46615 > 112.26.3.8.40113: Flags [.], seq 475525:476953, ack 1, win 4017, options [nop,nop,TS val 138184 ecr 4294891807,mptcp dss ack 2843715367 seq 3759663837 subseq 475525 len 1428 csum 0xbc7d], length 1428
10:30:08.792314 IP 112.26.3.1.46615 > 112.26.3.8.40113: Flags [.], seq 476953:478381, ack 1, win 4017, options [nop,nop,TS val 138368 ecr 4294891914,mptcp dss ack 2843715367 seq 3759666693 subseq 476953 len 1428 csum 0x684e], length 1428
10:30:08.827708 IP 112.26.3.8.40113 > 112.26.3.1.46615: Flags [.], ack 471241, win 23921, options [nop,nop,TS val 4294892399 ecr 137841,mptcp dss ack 3759515325], length 0
10:30:08.828059 IP 112.26.3.1.46615 > 112.26.3.8.40113: Flags [.], seq 485521:486949, ack 1, win 4017, options [nop,nop,TS val 138946 ecr 4294892399,mptcp dss ack 2843715367 seq 3759688113 subseq 485521 len 1428 csum 0xdf48], length 1428
10:30:08.896389 IP 112.26.3.1.46615 > 112.26.3.8.40113: Flags [.], seq 478381:479809, ack 1, win 4017, options [nop,nop,TS val 138472 ecr 4294892002,mptcp dss ack 2843715367 seq 3759668121 subseq 478381 len 1428 csum 0xa0ef], length 1428
10:30:08.910246 IP 112.26.3.8.40113 > 112.26.3.1.46615: Flags [.], ack 474097, win 23921, options [nop,nop,TS val 4294892530 ecr 137947,mptcp dss ack 3759515325], length 0
10:30:08.910636 IP 112.26.3.1.46615 > 112.26.3.8.40113: Flags [.], seq 486949:488377, ack 1, win 4017, options [nop,nop,TS val 139029 ecr 4294892530,mptcp dss ack 2843715367 seq 3759689541 subseq 486949 len 1428 csum 0x9ec9], length 1428
10:30:08.910714 IP 112.26.3.1.46615 > 112.26.3.8.40113: Flags [.], seq 488377:489805, ack 1, win 4017, options [nop,nop,TS val 139029 ecr 4294892530,mptcp dss ack 2843715367 seq 3759690969 subseq 488377 len 1428 csum 0x13bb], length 1428
10:30:08.960106 IP 112.26.3.1.46615 > 112.26.3.8.40113: Flags [.], seq 479809:481237, ack 1, win 4017, options [nop,nop,TS val 138472 ecr 4294892002,mptcp dss ack 2843715367 seq 3759669549 subseq 479809 len 1428 csum 0x8dc5], length 1428
10:30:08.997201 IP 112.26.3.8.40113 > 112.26.3.1.46615: Flags [.], ack 476953, win 23921, options [nop,nop,TS val 4294892717 ecr 138044,mptcp dss ack 3759515325], length 0
10:30:08.997721 IP 112.26.3.1.46615 > 112.26.3.8.40113: Flags [.], seq 489805:491233, ack 1, win 4017, options [nop,nop,TS val 139116 ecr 4294892717,mptcp dss ack 2843715367 seq 3759698109 subseq 489805 len 1428 csum 0xfff0], length 1428
10:30:08.997783 IP 112.26.3.1.46615 > 112.26.3.8.40113: Flags [.], seq 491233:492661, ack 1, win 4017, options [nop,nop,TS val 139116 ecr 4294892717,mptcp dss ack 2843715367 seq 3759699537 subseq 491233 len 1428 csum 0xc48e], length 1428
10:30:09.085999 IP 112.26.3.1.46615 > 112.26.3.8.40113: Flags [.], seq 481237:482665, ack 1, win 4017, options [nop,nop,TS val 138641 ecr 4294892061,mptcp dss ack 2843715367 seq 3759676689 subseq 481237 len 1428 csum 0x418a], length 1428
10:30:09.116149 IP 112.26.3.8.40113 > 112.26.3.1.46615: Flags [.], ack 479809, win 23921, options [nop,nop,TS val 4294892944 ecr 138368,mptcp dss ack 3759515325], length 0
10:30:09.116482 IP 112.26.3.1.46615 > 112.26.3.8.40113: Flags [.], seq 492661:494089, ack 1, win 4017, options [nop,nop,TS val 139235 ecr 4294892944,mptcp dss ack 2843715367 seq 3759702393 subseq 492661 len 1428 csum 0xcb8e], length 1428
10:30:09.116557 IP 112.26.3.1.46615 > 112.26.3.8.40113: Flags [.], seq 494089:495517, ack 1, win 4017, options [nop,nop,TS val 139235 ecr 4294892944,mptcp dss ack 2843715367 seq 3759703821 subseq 494089 len 1428 csum 0x7359], length 1428
10:30:09.202721 IP 112.26.3.1.46615 > 112.26.3.8.40113: Flags [.], seq 482665:484093, ack 1, win 4017, options [nop,nop,TS val 138752 ecr 4294892149,mptcp dss ack 2843715367 seq 3759679545 subseq 482665 len 1428 csum 0x347b], length 1428
10:30:09.227258 IP 112.26.3.8.40113 > 112.26.3.1.46615: Flags [.], ack 482665, win 23751, options [nop,nop,TS val 4294893112 ecr 138472,mptcp dss ack 3759591009], length 0
10:30:09.227791 IP 112.26.3.1.46615 > 112.26.3.8.40113: Flags [.], seq 495517:496945, ack 1, win 4017, options [nop,nop,TS val 139346 ecr 4294893112,mptcp dss ack 2843715367 seq 3759706677 subseq 495517 len 1428 csum 0x803e], length 1428
10:30:09.227856 IP 112.26.3.1.46615 > 112.26.3.8.40113: Flags [.], seq 496945:498373, ack 1, win 4017, options [nop,nop,TS val 139346 ecr 4294893112,mptcp dss ack 2843715367 seq 3759708105 subseq 496945 len 1428 csum 0xd3ec], length 1428
10:30:09.229421 IP 112.26.3.1.46615 > 112.26.3.8.40113: Flags [.], seq 498373:499801, ack 1, win 4017, options [nop,nop,TS val 139348 ecr 4294893112,mptcp dss ack 2843715367 seq 3759709533 subseq 498373 len 1428 csum 0xec41], length 1428
10:30:09.317137 IP 112.26.3.1.46615 > 112.26.3.8.40113: Flags [.], seq 484093:485521, ack 1, win 4017, options [nop,nop,TS val 138831 ecr 4294892261,mptcp dss ack 2843715367 seq 3759682401 subseq 484093 len 1428 csum 0xf8ad], length 1428
10:30:09.339031 IP 112.26.3.8.40113 > 112.26.3.1.46615: Flags [.], ack 485521, win 24125, options [nop,nop,TS val 4294893269 ecr 138752,mptcp dss ack 3759630993], length 0
10:30:09.339534 IP 112.26.3.1.46615 > 112.26.3.8.40113: Flags [.], seq 499801:501229, ack 1, win 4017, options [nop,nop,TS val 139457 ecr 4294893269,mptcp dss ack 2843715367 seq 3759712389 subseq 499801 len 1428 csum 0xb238], length 1428
10:30:09.339627 IP 112.26.3.1.46615 > 112.26.3.8.40113: Flags [.], seq 501229:502657, ack 1, win 4017, options [nop,nop,TS val 139457 ecr 4294893269,mptcp dss ack 2843715367 seq 3759713817 subseq 501229 len 1428 csum 0x515f], length 1428
10:30:09.381836 IP 112.26.3.1.46615 > 112.26.3.8.40113: Flags [.], seq 485521:486949, ack 1, win 4017, options [nop,nop,TS val 138946 ecr 4294892399,mptcp dss ack 2843715367 seq 3759688113 subseq 485521 len 1428 csum 0xdf48], length 1428
10:30:09.473379 IP 112.26.3.1.46615 > 112.26.3.8.40113: Flags [.], seq 486949:488377, ack 1, win 4017, options [nop,nop,TS val 139029 ecr 4294892530,mptcp dss ack 2843715367 seq 3759689541 subseq 486949 len 1428 csum 0x9ec9], length 1428
10:30:09.548952 IP 112.26.3.1.46615 > 112.26.3.8.40113: Flags [.], seq 488377:489805, ack 1, win 4017, options [nop,nop,TS val 139029 ecr 4294892530,mptcp dss ack 2843715367 seq 3759690969 subseq 488377 len 1428 csum 0x13bb], length 1428
10:30:09.631893 IP 112.26.3.8.40113 > 112.26.3.1.46615: Flags [.], ack 489805, win 24125, options [nop,nop,TS val 4294893568 ecr 138946,mptcp dss ack 3759630993], length 0
10:30:09.632233 IP 112.26.3.1.46615 > 112.26.3.8.40113: Flags [.], seq 502657:504085, ack 1, win 4017, options [nop,nop,TS val 139750 ecr 4294893568,mptcp dss ack 2843715367 seq 3759729525 subseq 502657 len 1428 csum 0x6466], length 1428
10:30:09.632310 IP 112.26.3.1.46615 > 112.26.3.8.40113: Flags [.], seq 504085:505513, ack 1, win 4017, options [nop,nop,TS val 139750 ecr 4294893568,mptcp dss ack 2843715367 seq 3759730953 subseq 504085 len 1428 csum 0x6ccf], length 1428
10:30:09.632469 IP 112.26.3.1.46615 > 112.26.3.8.40113: Flags [.], seq 505513:506941, ack 1, win 4017, options [nop,nop,TS val 139750 ecr 4294893568,mptcp dss ack 2843715367 seq 3759732381 subseq 505513 len 1428 csum 0x1bc2], length 1428
10:30:09.654104 IP 112.26.3.1.46615 > 112.26.3.8.40113: Flags [.], seq 489805:491233, ack 1, win 4017, options [nop,nop,TS val 139116 ecr 4294892717,mptcp dss ack 2843715367 seq 3759698109 subseq 489805 len 1428 csum 0xfff0], length 1428
10:30:09.733843 IP 112.26.3.1.46615 > 112.26.3.8.40113: Flags [.], seq 491233:492661, ack 1, win 4017, options [nop,nop,TS val 139116 ecr 4294892717,mptcp dss ack 2843715367 seq 3759699537 subseq 491233 len 1428 csum 0xc48e], length 1428
10:30:09.814841 IP 112.26.3.1.46615 > 112.26.3.8.40113: Flags [.], seq 492661:494089, ack 1, win 4017, options [nop,nop,TS val 139235 ecr 4294892944,mptcp dss ack 2843715367 seq 3759702393 subseq 492661 len 1428 csum 0xcb8e], length 1428
10:30:09.860791 IP 112.26.3.1.46615 > 112.26.3.8.40113: Flags [.], seq 494089:495517, ack 1, win 4017, options [nop,nop,TS val 139235 ecr 4294892944,mptcp dss ack 2843715367 seq 3759703821 subseq 494089 len 1428 csum 0x7359], length 1428
10:30:09.905054 IP 112.26.3.8.40113 > 112.26.3.1.46615: Flags [.], ack 495517, win 24125, options [nop,nop,TS val 4294893841 ecr 139116,mptcp dss ack 3759630993], length 0
10:30:09.905403 IP 112.26.3.1.46615 > 112.26.3.8.40113: Flags [.], seq 506941:508369, ack 1, win 4017, options [nop,nop,TS val 140024 ecr 4294893841,mptcp dss ack 2843715367 seq 3759748089 subseq 506941 len 1428 csum 0xb65a], length 1428
10:30:09.905477 IP 112.26.3.1.46615 > 112.26.3.8.40113: Flags [.], seq 508369:509797, ack 1, win 4017, options [nop,nop,TS val 140024 ecr 4294893841,mptcp dss ack 2843715367 seq 3759749517 subseq 508369 len 1428 csum 0x8069], length 1428
10:30:09.905700 IP 112.26.3.1.46615 > 112.26.3.8.40113: Flags [.], seq 509797:511225, ack 1, win 4017, options [nop,nop,TS val 140024 ecr 4294893841,mptcp dss ack 2843715367 seq 3759750945 subseq 509797 len 1428 csum 0xb2d8], length 1428
10:30:09.905807 IP 112.26.3.1.46615 > 112.26.3.8.40113: Flags [.], seq 511225:512653, ack 1, win 4017, options [nop,nop,TS val 140024 ecr 4294893841,mptcp dss ack 2843715367 seq 3759752373 subseq 511225 len 1428 csum 0xffed], length 1428
10:30:09.953647 IP 112.26.3.1.46615 > 112.26.3.8.40113: Flags [.], seq 495517:496945, ack 1, win 4017, options [nop,nop,TS val 139346 ecr 4294893112,mptcp dss ack 2843715367 seq 3759706677 subseq 495517 len 1428 csum 0x803e], length 1428
10:30:10.020418 IP 112.26.3.1.46615 > 112.26.3.8.40113: Flags [.], seq 496945:498373, ack 1, win 4017, options [nop,nop,TS val 139346 ecr 4294893112,mptcp dss ack 2843715367 seq 3759708105 subseq 496945 len 1428 csum 0xd3ec], length 1428
10:30:10.107799 IP 112.26.3.1.46615 > 112.26.3.8.40113: Flags [.], seq 498373:499801, ack 1, win 4017, options [nop,nop,TS val 139348 ecr 4294893112,mptcp dss ack 2843715367 seq 3759709533 subseq 498373 len 1428 csum 0xec41], length 1428
10:30:10.132279 IP 112.26.3.8.40113 > 112.26.3.1.46615: Flags [.], ack 499801, win 24059, options [nop,nop,TS val 4294894066 ecr 139346,mptcp dss ack 3759635277], length 0
10:30:10.132664 IP 112.26.3.1.46615 > 112.26.3.8.40113: Flags [.], seq 512653:514081, ack 1, win 4017, options [nop,nop,TS val 140251 ecr 4294894066,mptcp dss ack 2843715367 seq 3759763797 subseq 512653 len 1428 csum 0xcf57], length 1428
10:30:10.132738 IP 112.26.3.1.46615 > 112.26.3.8.40113: Flags [.], seq 514081:515509, ack 1, win 4017, options [nop,nop,TS val 140251 ecr 4294894066,mptcp dss ack 2843715367 seq 3759765225 subseq 514081 len 1428 csum 0xad02], length 1428
10:30:10.132888 IP 112.26.3.1.46615 > 112.26.3.8.40113: Flags [.], seq 515509:516937, ack 1, win 4017, options [nop,nop,TS val 140251 ecr 4294894066,mptcp dss ack 2843715367 seq 3759766653 subseq 515509 len 1428 csum 0x6c8e], length 1428
10:30:10.232102 IP 112.26.3.1.46615 > 112.26.3.8.40113: Flags [.], seq 501229:502657, ack 1, win 4017, options [nop,nop,TS val 139457 ecr 4294893269,mptcp dss ack 2843715367 seq 3759713817 subseq 501229 len 1428 csum 0x515f], length 1428
10:30:10.256300 IP 112.26.3.8.40113 > 112.26.3.1.46615: Flags [.], ack 499801, win 23993, options [nop,nop,TS val 4294894182 ecr 139346,nop,nop,sack 1 {501229:502657},mptcp dss ack 3759639561], length 0
10:30:10.257355 IP 112.26.3.1.46615 > 112.26.3.8.40113: Flags [.], seq 516937:518365, ack 1, win 4017, options [nop,nop,TS val 140376 ecr 4294894182,mptcp dss ack 2843715367 seq 3759769509 subseq 516937 len 1428 csum 0x5ac0], length 1428
10:30:10.311707 IP 112.26.3.1.46615 > 112.26.3.8.40113: Flags [.], seq 502657:504085, ack 1, win 4017, options [nop,nop,TS val 139750 ecr 4294893568,mptcp dss ack 2843715367 seq 3759729525 subseq 502657 len 1428 csum 0x6466], length 1428
10:30:10.379941 IP 112.26.3.8.40113 > 112.26.3.1.46615: Flags [.], ack 499801, win 23971, options [nop,nop,TS val 4294894278 ecr 139346,nop,nop,sack 1 {501229:504085},mptcp dss ack 3759640989], length 0
10:30:10.471305 IP 112.26.3.1.46615 > 112.26.3.8.40113: Flags [.], seq 505513:506941, ack 1, win 4017, options [nop,nop,TS val 139750 ecr 4294893568,mptcp dss ack 2843715367 seq 3759732381 subseq 505513 len 1428 csum 0x1bc2], length 1428
10:30:10.482156 IP 112.26.3.1.46615 > 112.26.3.8.40113: Flags [.], seq 518365:519793, ack 1, win 4017, options [nop,nop,TS val 140600 ecr 4294894278,mptcp dss ack 2843715367 seq 3759772365 subseq 518365 len 1428 csum 0x1358], length 1428
10:30:10.484961 IP 112.26.3.8.40113 > 112.26.3.1.46615: Flags [.], ack 499801, win 23949, options [nop,nop,TS val 4294894418 ecr 139346,nop,nop,sack 2 {505513:506941}{501229:504085},mptcp dss ack 3759642417], length 0
10:30:10.485297 IP 112.26.3.1.46615 > 112.26.3.8.40113: Flags [.], seq 499801:501229, ack 1, win 4017, options [nop,nop,TS val 140603 ecr 4294894418,mptcp dss ack 2843715367 seq 3759712389 subseq 499801 len 1428 csum 0xb238], length 1428
10:30:10.588136 IP 112.26.3.1.46615 > 112.26.3.8.40113: Flags [.], seq 506941:508369, ack 1, win 4017, options [nop,nop,TS val 140024 ecr 4294893841,mptcp dss ack 2843715367 seq 3759748089 subseq 506941 len 1428 csum 0xb65a], length 1428
10:30:10.599407 IP 112.26.3.8.40113 > 112.26.3.1.46615: Flags [.], ack 499801, win 24383, options [nop,nop,TS val 4294894535 ecr 139346,nop,nop,sack 2 {505513:508369}{501229:504085},mptcp dss ack 3759712389], length 0
10:30:10.599782 IP 112.26.3.1.46615 > 112.26.3.8.40113: Flags [.], seq 504085:505513, ack 1, win 4017, options [nop,nop,TS val 140718 ecr 4294894535,mptcp dss ack 2843715367 seq 3759730953 subseq 504085 len 1428 csum 0x6ccf], length 1428
10:30:10.649001 IP 112.26.3.1.46615 > 112.26.3.8.40113: Flags [.], seq 508369:509797, ack 1, win 4017, options [nop,nop,TS val 140024 ecr 4294893841,mptcp dss ack 2843715367 seq 3759749517 subseq 508369 len 1428 csum 0x8069], length 1428
10:30:10.731767 IP 112.26.3.8.40113 > 112.26.3.1.46615: Flags [.], ack 499801, win 24383, options [nop,nop,TS val 4294894652 ecr 139346,nop,nop,sack 2 {505513:509797}{501229:504085},mptcp dss ack 3759712389], length 0
10:30:10.757008 IP 112.26.3.1.46615 > 112.26.3.8.40113: Flags [.], seq 509797:511225, ack 1, win 4017, options [nop,nop,TS val 140024 ecr 4294893841,mptcp dss ack 2843715367 seq 3759750945 subseq 509797 len 1428 csum 0xb2d8], length 1428
10:30:10.832664 IP 112.26.3.8.40113 > 112.26.3.1.46615: Flags [.], ack 499801, win 24383, options [nop,nop,TS val 4294894748 ecr 139346,nop,nop,sack 2 {505513:511225}{501229:504085},mptcp dss ack 3759712389], length 0
10:30:10.858657 IP 112.26.3.1.46615 > 112.26.3.8.40113: Flags [.], seq 511225:512653, ack 1, win 4017, options [nop,nop,TS val 140024 ecr 4294893841,mptcp dss ack 2843715367 seq 3759752373 subseq 511225 len 1428 csum 0xffed], length 1428
10:30:10.899460 IP 112.26.3.1.46615 > 112.26.3.8.40113: Flags [.], seq 512653:514081, ack 1, win 4017, options [nop,nop,TS val 140251 ecr 4294894066,mptcp dss ack 2843715367 seq 3759763797 subseq 512653 len 1428 csum 0xcf57], length 1428
10:30:10.945925 IP 112.26.3.8.40113 > 112.26.3.1.46615: Flags [.], ack 499801, win 24383, options [nop,nop,TS val 4294894868 ecr 139346,nop,nop,sack 2 {505513:512653}{501229:504085},mptcp dss ack 3759712389], length 0
10:30:10.995990 IP 112.26.3.1.46615 > 112.26.3.8.40113: Flags [.], seq 514081:515509, ack 1, win 4017, options [nop,nop,TS val 140251 ecr 4294894066,mptcp dss ack 2843715367 seq 3759765225 subseq 514081 len 1428 csum 0xad02], length 1428
10:30:11.021709 IP 112.26.3.1.46615 > 112.26.3.8.40113: Flags [.], seq 519793:521221, ack 1, win 4017, options [nop,nop,TS val 141140 ecr 4294894868,mptcp dss ack 2843715367 seq 3759790929 subseq 519793 len 1428 csum 0x3a73], length 1428
