10:29:25.781828 IP 112.26.0.8.54050 > 112.26.0.1.46615: Flags [S], seq 3691055875, win 65535, options [mss 1460,sackOK,TS val 4294849452 ecr 0,nop,wscale 6,mptcp capable csum {0xf3f641e5c9e720a6}], length 0
10:29:25.793941 IP 112.26.0.1.46615 > 112.26.0.8.54050: Flags [S.], seq 406276099, ack 3691055876, win 65535, options [mss 1460,sackOK,TS val 95900 ecr 4294849452,nop,wscale 6,mptcp capable csum {0x6a6e46fcfc41c11a}], length 0
10:29:25.974683 IP 112.26.0.1.46615 > 112.26.0.8.54050: Flags [S.], seq 406276099, ack 3691055876, win 65535, options [mss 1460,sackOK,TS val 95900 ecr 4294849452,nop,wscale 6,mptcp capable csum {0x6a6e46fcfc41c11a}], length 0
10:29:25.987098 IP 112.26.0.1.46615 > 112.26.0.8.54050: Flags [S.], seq 406276099, ack 3691055876, win 65535, options [mss 1460,sackOK,TS val 95900 ecr 4294849452,nop,wscale 6,mptcp capable csum {0x6a6e46fcfc41c11a}], length 0
10:29:25.996053 IP 112.26.0.8.54050 > 112.26.0.1.46615: Flags [.], ack 1, win 1369, options [nop,nop,TS val 4294849933 ecr 95900,mptcp capable csum {0xf3f641e5c9e720a6,0x6a6e46fcfc41c11a},mptcp dss ack 3758104649], length 0
10:29:25.997717 IP 112.26.0.8.54050 > 112.26.0.1.46615: Flags [.], ack 1, win 1369, options [nop,nop,TS val 4294849933 ecr 95900,mptcp capable csum {0xf3f641e5c9e720a6,0x6a6e46fcfc41c11a},mptcp dss ack 3758104649], length 0
10:29:25.998942 IP 112.26.0.1.46615 > 112.26.0.8.54050: Flags [.], ack 1, win 1339, options [nop,nop,TS val 96116 ecr 4294849933,mptcp add-addr id 3 112.26.1.1,mptcp dss ack 2843715367], length 0
10:30:16.905220 IP 112.26.0.1.46615 > 112.26.0.8.54050: Flags [.], seq 505325:506753, ack 1, win 4017, options [nop,nop,TS val 146896 ecr 4294900197,mptcp dss ack 2843715367 seq 3759965145 subseq 505325 len 1428 csum 0x1ebd], length 1428
10:30:16.939093 IP 112.26.0.1.46615 > 112.26.0.8.54050: Flags [.], seq 516749:518177, ack 1, win 4017, options [nop,nop,TS val 146456 ecr 4294899605,mptcp dss ack 2843715367 seq 3760012269 subseq 516749 len 1428 csum 0x78da], length 1428
10:30:16.943231 IP 112.26.0.1.46615 > 112.26.0.8.54050: Flags [.], seq 516749:518177, ack 1, win 4017, options [nop,nop,TS val 146456 ecr 4294899605,mptcp dss ack 2843715367 seq 3760012269 subseq 516749 len 1428 csum 0x78da], length 1428
10:30:17.056676 IP 112.26.0.8.54050 > 112.26.0.1.46615: Flags [.], ack 505325, win 24487, options [nop,nop,TS val 4294900373 ecr 145445,nop,nop,sack 2 {509609:512465}{506753:508181},mptcp dss ack 3759959433], length 0
10:30:17.058339 IP 112.26.0.1.46615 > 112.26.0.8.54050: Flags [.], seq 508181:509609, ack 1, win 4017, options [nop,nop,TS val 147175 ecr 4294900373,mptcp dss ack 2843715367 seq 3759975141 subseq 508181 len 1428 csum 0xbc0c], length 1428
10:30:17.133140 IP 112.26.0.8.54050 > 112.26.0.1.46615: Flags [.], ack 505325, win 24487, options [nop,nop,TS val 4294900481 ecr 145445,nop,nop,sack 2 {513893:515321}{509609:512465},mptcp dss ack 3759959433], length 0
10:30:43.850372 IP 112.26.0.8.54050 > 112.26.0.1.46615: Flags [.], ack 768077, win 23957, options [nop,nop,TS val 4294927122 ecr 172715,mptcp dss ack 3761036145], length 0
10:30:43.852583 IP 112.26.0.1.46615 > 112.26.0.8.54050: Flags [.], seq 780929:782357, ack 1, win 4017, options [nop,nop,TS val 173969 ecr 4294927122,mptcp dss ack 2843715367 seq 3761150385 subseq 780929 len 1428 csum 0xd523], length 1428
10:30:43.918036 IP 112.26.0.1.46615 > 112.26.0.8.54050: Flags [.], seq 775217:776645, ack 1, win 4017, options [nop,nop,TS val 173406 ecr 4294926605,mptcp dss ack 2843715367 seq 3761130393 subseq 775217 len 1428 csum 0xd669], length 1428
10:30:43.919888 IP 112.26.0.1.46615 > 112.26.0.8.54050: Flags [.], seq 775217:776645, ack 1, win 4017, options [nop,nop,TS val 173406 ecr 4294926605,mptcp dss ack 2843715367 seq 3761130393 subseq 775217 len 1428 csum 0xd669], length 1428
10:30:44.024973 IP 112.26.0.1.46615 > 112.26.0.8.54050: Flags [.], seq 776645:778073, ack 1, win 4017, options [nop,nop,TS val 173406 ecr 4294926605,mptcp dss ack 2843715367 seq 3761131821 subseq 776645 len 1428 csum 0xd825], length 1428
10:30:44.027507 IP 112.26.0.1.46615 > 112.26.0.8.54050: Flags [.], seq 776645:778073, ack 1, win 4017, options [nop,nop,TS val 173406 ecr 4294926605,mptcp dss ack 2843715367 seq 3761131821 subseq 776645 len 1428 csum 0xd825], length 1428
10:30:44.077795 IP 112.26.0.8.54050 > 112.26.0.1.46615: Flags [.], ack 768077, win 24208, options [nop,nop,TS val 4294927348 ecr 172715,nop,nop,sack 1 {769505:770933},mptcp dss ack 3761036145], length 0
10:30:44.095558 IP 112.26.0.1.46615 > 112.26.0.8.54050: Flags [.], seq 782357:783785, ack 1, win 4017, options [nop,nop,TS val 174208 ecr 4294927348,mptcp dss ack 2843715367 seq 3761160381 subseq 782357 len 1428 csum 0xc1dd], length 1428
10:30:44.179309 IP 112.26.0.1.46615 > 112.26.0.8.54050: Flags [.], seq 768077:769505, ack 1, win 4017, options [nop,nop,TS val 173462 ecr 4294926728,mptcp dss ack 2843715367 seq 3761071845 subseq 768077 len 1428 csum 0x3535], length 1428
10:30:44.181999 IP 112.26.0.1.46615 > 112.26.0.8.54050: Flags [.], seq 768077:769505, ack 1, win 4017, options [nop,nop,TS val 173462 ecr 4294926728,mptcp dss ack 2843715367 seq 3761071845 subseq 768077 len 1428 csum 0x3535], length 1428
10:30:44.280425 IP 112.26.0.8.54050 > 112.26.0.1.46615: Flags [.], ack 768077, win 24208, options [nop,nop,TS val 4294927465 ecr 172715,nop,nop,sack 1 {769505:772361},mptcp dss ack 3761036145], length 0
10:30:44.310338 IP 112.26.0.1.46615 > 112.26.0.8.54050: Flags [.], seq 783785:785213, ack 1, win 4017, options [nop,nop,TS val 174424 ecr 4294927465,mptcp dss ack 2843715367 seq 3761166093 subseq 783785 len 1428 csum 0x41e8], length 1428
10:30:44.359653 IP 112.26.0.1.46615 > 112.26.0.8.54050: Flags [.], seq 779501:780929, ack 1, win 4017, options [nop,nop,TS val 173733 ecr 4294926930,mptcp dss ack 2843715367 seq 3761141817 subseq 779501 len 1428 csum 0x9c7a], length 1428
10:30:44.361825 IP 112.26.0.1.46615 > 112.26.0.8.54050: Flags [.], seq 779501:780929, ack 1, win 4017, options [nop,nop,TS val 173733 ecr 4294926930,mptcp dss ack 2843715367 seq 3761141817 subseq 779501 len 1428 csum 0x9c7a], length 1428
10:30:44.431043 IP 112.26.0.8.54050 > 112.26.0.1.46615: Flags [.], ack 768077, win 24308, options [nop,nop,TS val 4294927624 ecr 172715,nop,nop,sack 1 {769505:773789},mptcp dss ack 3761071845], length 0
10:30:44.491173 IP 112.26.0.8.54050 > 112.26.0.1.46615: Flags [.], ack 768077, win 24308, options [nop,nop,TS val 4294927722 ecr 172715,nop,nop,sack 1 {769505:775217},mptcp dss ack 3761071845], length 0
10:30:44.493503 IP 112.26.0.1.46615 > 112.26.0.8.54050: Flags [.], seq 785213:786641, ack 1, win 4017, options [nop,nop,TS val 174609 ecr 4294927624,mptcp dss ack 2843715367 seq 3761188941 subseq 785213 len 1428 csum 0x6ea5], length 1428
10:30:44.526194 IP 112.26.0.1.46615 > 112.26.0.8.54050: Flags [.], seq 786641:788069, ack 1, win 4017, options [nop,nop,TS val 174622 ecr 4294927722,mptcp dss ack 2843715367 seq 3761190369 subseq 786641 len 1428 csum 0xa677], length 1428
10:30:44.556902 IP 112.26.0.1.46615 > 112.26.0.8.54050: Flags [.], seq 780929:782357, ack 1, win 4017, options [nop,nop,TS val 173969 ecr 4294927122,mptcp dss ack 2843715367 seq 3761150385 subseq 780929 len 1428 csum 0xd523], length 1428
10:30:44.560924 IP 112.26.0.1.46615 > 112.26.0.8.54050: Flags [.], seq 780929:782357, ack 1, win 4017, options [nop,nop,TS val 173969 ecr 4294927122,mptcp dss ack 2843715367 seq 3761150385 subseq 780929 len 1428 csum 0xd523], length 1428
10:30:44.668282 IP 112.26.0.8.54050 > 112.26.0.1.46615: Flags [.], ack 768077, win 24308, options [nop,nop,TS val 4294927865 ecr 172715,nop,nop,sack 1 {769505:776645},mptcp dss ack 3761071845], length 0
10:30:44.700072 IP 112.26.0.1.46615 > 112.26.0.8.54050: Flags [.], seq 788069:789497, ack 1, win 4017, options [nop,nop,TS val 174815 ecr 4294927865,mptcp dss ack 2843715367 seq 3761197509 subseq 788069 len 1428 csum 0xd644], length 1428
10:30:44.806345 IP 112.26.0.1.46615 > 112.26.0.8.54050: Flags [.], seq 782357:783785, ack 1, win 4017, options [nop,nop,TS val 174208 ecr 4294927348,mptcp dss ack 2843715367 seq 3761160381 subseq 782357 len 1428 csum 0xc1dd], length 1428
10:30:44.808525 IP 112.26.0.1.46615 > 112.26.0.8.54050: Flags [.], seq 782357:783785, ack 1, win 4017, options [nop,nop,TS val 174208 ecr 4294927348,mptcp dss ack 2843715367 seq 3761160381 subseq 782357 len 1428 csum 0xc1dd], length 1428
10:30:44.904524 IP 112.26.0.8.54050 > 112.26.0.1.46615: Flags [.], ack 778073, win 24024, options [nop,nop,TS val 4294928128 ecr 173462,mptcp dss ack 3761101833], length 0
10:30:44.906613 IP 112.26.0.1.46615 > 112.26.0.8.54050: Flags [.], seq 789497:790925, ack 1, win 4017, options [nop,nop,TS val 175023 ecr 4294928128,mptcp dss ack 2843715367 seq 3761204649 subseq 789497 len 1428 csum 0xda9b], length 1428
10:30:44.966803 IP 112.26.0.1.46615 > 112.26.0.8.54050: Flags [.], seq 790925:792353, ack 1, win 4017, options [nop,nop,TS val 175023 ecr 4294928128,mptcp dss ack 2843715367 seq 3761206077 subseq 790925 len 1428 csum 0xa4b], length 1428
10:30:44.996009 IP 112.26.0.1.46615 > 112.26.0.8.54050: Flags [.], seq 783785:785213, ack 1, win 4017, options [nop,nop,TS val 174424 ecr 4294927465,mptcp dss ack 2843715367 seq 3761166093 subseq 783785 len 1428 csum 0x41e8], length 1428
10:30:44.998585 IP 112.26.0.1.46615 > 112.26.0.8.54050: Flags [.], seq 783785:785213, ack 1, win 4017, options [nop,nop,TS val 174424 ecr 4294927465,mptcp dss ack 2843715367 seq 3761166093 subseq 783785 len 1428 csum 0x41e8], length 1428
10:30:45.051816 IP 112.26.0.1.46615 > 112.26.0.8.54050: Flags [.], seq 792353:793781, ack 1, win 4017, options [nop,nop,TS val 175023 ecr 4294928128,mptcp dss ack 2843715367 seq 3761207505 subseq 792353 len 1428 csum 0x1509], length 1428
10:30:45.099833 IP 112.26.0.8.54050 > 112.26.0.1.46615: Flags [.], ack 778073, win 24355, options [nop,nop,TS val 4294928307 ecr 173462,nop,nop,sack 1 {779501:780929},mptcp dss ack 3761101833], length 0
10:30:45.147256 IP 112.26.0.1.46615 > 112.26.0.8.54050: Flags [.], seq 793781:795209, ack 1, win 4017, options [nop,nop,TS val 175228 ecr 4294928307,mptcp dss ack 2843715367 seq 3761213217 subseq 793781 len 1428 csum 0xaa51], length 1428
10:30:45.201308 IP 112.26.0.1.46615 > 112.26.0.8.54050: Flags [.], seq 785213:786641, ack 1, win 4017, options [nop,nop,TS val 174609 ecr 4294927624,mptcp dss ack 2843715367 seq 3761188941 subseq 785213 len 1428 csum 0x6ea5], length 1428
10:30:45.214704 IP 112.26.0.1.46615 > 112.26.0.8.54050: Flags [.], seq 785213:786641, ack 1, win 4017, options [nop,nop,TS val 174609 ecr 4294927624,mptcp dss ack 2843715367 seq 3761188941 subseq 785213 len 1428 csum 0x6ea5], length 1428
10:30:45.297710 IP 112.26.0.8.54050 > 112.26.0.1.46615: Flags [.], ack 778073, win 24355, options [nop,nop,TS val 4294928506 ecr 173462,nop,nop,sack 1 {779501:782357},mptcp dss ack 3761101833], length 0
10:30:45.334361 IP 112.26.0.1.46615 > 112.26.0.8.54050: Flags [.], seq 795209:796637, ack 1, win 4017, options [nop,nop,TS val 175450 ecr 4294928506,mptcp dss ack 2843715367 seq 3761217501 subseq 795209 len 1428 csum 0xfa7e], length 1428
10:30:45.365438 IP 112.26.0.1.46615 > 112.26.0.8.54050: Flags [.], seq 788069:789497, ack 1, win 4017, options [nop,nop,TS val 174815 ecr 4294927865,mptcp dss ack 2843715367 seq 3761197509 subseq 788069 len 1428 csum 0xd644], length 1428
10:30:45.383136 IP 112.26.0.1.46615 > 112.26.0.8.54050: Flags [.], seq 788069:789497, ack 1, win 4017, options [nop,nop,TS val 174815 ecr 4294927865,mptcp dss ack 2843715367 seq 3761197509 subseq 788069 len 1428 csum 0xd644], length 1428
10:30:45.452215 IP 112.26.0.8.54050 > 112.26.0.1.46615: Flags [.], ack 778073, win 24289, options [nop,nop,TS val 4294928754 ecr 173462,nop,nop,sack 1 {779501:783785},mptcp dss ack 3761106117], length 0
10:30:45.493817 IP 112.26.0.1.46615 > 112.26.0.8.54050: Flags [.], seq 789497:790925, ack 1, win 4017, options [nop,nop,TS val 175023 ecr 4294928128,mptcp dss ack 2843715367 seq 3761204649 subseq 789497 len 1428 csum 0xda9b], length 1428
10:30:45.496544 IP 112.26.0.1.46615 > 112.26.0.8.54050: Flags [.], seq 789497:790925, ack 1, win 4017, options [nop,nop,TS val 175023 ecr 4294928128,mptcp dss ack 2843715367 seq 3761204649 subseq 789497 len 1428 csum 0xda9b], length 1428
10:30:45.554990 IP 112.26.0.1.46615 > 112.26.0.8.54050: Flags [.], seq 796637:798065, ack 1, win 4017, options [nop,nop,TS val 175670 ecr 4294928754,mptcp dss ack 2843715367 seq 3761226069 subseq 796637 len 1428 csum 0x1cac], length 1428
10:30:45.617499 IP 112.26.0.1.46615 > 112.26.0.8.54050: Flags [.], seq 790925:792353, ack 1, win 4017, options [nop,nop,TS val 175023 ecr 4294928128,mptcp dss ack 2843715367 seq 3761206077 subseq 790925 len 1428 csum 0xa4b], length 1428
10:30:45.628228 IP 112.26.0.1.46615 > 112.26.0.8.54050: Flags [.], seq 790925:792353, ack 1, win 4017, options [nop,nop,TS val 175023 ecr 4294928128,mptcp dss ack 2843715367 seq 3761206077 subseq 790925 len 1428 csum 0xa4b], length 1428
10:30:45.637330 IP 112.26.0.1.46615 > 112.26.0.8.54050: Flags [.], seq 798065:799493, ack 1, win 4017, options [nop,nop,TS val 175670 ecr 4294928754,mptcp dss ack 2843715367 seq 3761227497 subseq 798065 len 1428 csum 0x788b], length 1428
10:30:45.726563 IP 112.26.0.8.54050 > 112.26.0.1.46615: Flags [.], ack 778073, win 24289, options [nop,nop,TS val 4294928944 ecr 173462,nop,nop,sack 1 {779501:785213},mptcp dss ack 3761106117], length 0
10:30:45.731755 IP 112.26.0.1.46615 > 112.26.0.8.54050: Flags [.], seq 799493:800921, ack 1, win 4017, options [nop,nop,TS val 175848 ecr 4294928944,mptcp dss ack 2843715367 seq 3761234637 subseq 799493 len 1428 csum 0x8548], length 1428
10:30:45.777449 IP 112.26.0.1.46615 > 112.26.0.8.54050: Flags [.], seq 792353:793781, ack 1, win 4017, options [nop,nop,TS val 175023 ecr 4294928128,mptcp dss ack 2843715367 seq 3761207505 subseq 792353 len 1428 csum 0x1509], length 1428
10:30:45.780009 IP 112.26.0.1.46615 > 112.26.0.8.54050: Flags [.], seq 792353:793781, ack 1, win 4017, options [nop,nop,TS val 175023 ecr 4294928128,mptcp dss ack 2843715367 seq 3761207505 subseq 792353 len 1428 csum 0x1509], length 1428
10:30:45.831034 IP 112.26.0.1.46615 > 112.26.0.8.54050: Flags [.], seq 778073:779501, ack 1, win 4017, options [nop,nop,TS val 175936 ecr 4294928944,mptcp dss ack 2843715367 seq 3761133249 subseq 778073 len 1428 csum 0xaeea], length 1428
10:30:45.863593 IP 112.26.0.1.46615 > 112.26.0.8.54050: Flags [.], seq 793781:795209, ack 1, win 4017, options [nop,nop,TS val 175228 ecr 4294928307,mptcp dss ack 2843715367 seq 3761213217 subseq 793781 len 1428 csum 0xaa51], length 1428
10:30:45.865659 IP 112.26.0.1.46615 > 112.26.0.8.54050: Flags [.], seq 793781:795209, ack 1, win 4017, options [nop,nop,TS val 175228 ecr 4294928307,mptcp dss ack 2843715367 seq 3761213217 subseq 793781 len 1428 csum 0xaa51], length 1428
10:30:45.964224 IP 112.26.0.1.46615 > 112.26.0.8.54050: Flags [.], seq 795209:796637, ack 1, win 4017, options [nop,nop,TS val 175450 ecr 4294928506,mptcp dss ack 2843715367 seq 3761217501 subseq 795209 len 1428 csum 0xfa7e], length 1428
10:30:45.967032 IP 112.26.0.1.46615 > 112.26.0.8.54050: Flags [.], seq 795209:796637, ack 1, win 4017, options [nop,nop,TS val 175450 ecr 4294928506,mptcp dss ack 2843715367 seq 3761217501 subseq 795209 len 1428 csum 0xfa7e], length 1428
10:30:46.040724 IP 112.26.0.8.54050 > 112.26.0.1.46615: Flags [.], ack 778073, win 24289, options [nop,nop,TS val 4294929317 ecr 173462,nop,nop,sack 2 {788069:789497}{779501:786641},mptcp dss ack 3761106117], length 0
10:30:46.043557 IP 112.26.0.1.46615 > 112.26.0.8.54050: Flags [.], seq 786641:788069, ack 1, win 4017, options [nop,nop,TS val 176159 ecr 4294929317,mptcp dss ack 2843715367 seq 3761190369 subseq 786641 len 1428 csum 0xa677], length 1428
10:30:46.112460 IP 112.26.0.8.54050 > 112.26.0.1.46615: Flags [.], ack 778073, win 24289, options [nop,nop,TS val 4294929442 ecr 173462,nop,nop,sack 2 {788069:790925}{779501:786641},mptcp dss ack 3761106117], length 0
10:30:46.124757 IP 112.26.0.1.46615 > 112.26.0.8.54050: Flags [.], seq 800921:802349, ack 1, win 4017, options [nop,nop,TS val 176241 ecr 4294929442,mptcp dss ack 2843715367 seq 3761204649 subseq 800921 len 1428 csum 0xadfb], length 1428
10:30:46.158171 IP 112.26.0.1.46615 > 112.26.0.8.54050: Flags [.], seq 796637:798065, ack 1, win 4017, options [nop,nop,TS val 175670 ecr 4294928754,mptcp dss ack 2843715367 seq 3761226069 subseq 796637 len 1428 csum 0x1cac], length 1428
10:30:46.161078 IP 112.26.0.1.46615 > 112.26.0.8.54050: Flags [.], seq 796637:798065, ack 1, win 4017, options [nop,nop,TS val 175670 ecr 4294928754,mptcp dss ack 2843715367 seq 3761226069 subseq 796637 len 1428 csum 0x1cac], length 1428
10:30:46.255362 IP 112.26.0.1.46615 > 112.26.0.8.54050: Flags [.], seq 798065:799493, ack 1, win 4017, options [nop,nop,TS val 175670 ecr 4294928754,mptcp dss ack 2843715367 seq 3761227497 subseq 798065 len 1428 csum 0x788b], length 1428
10:30:46.258008 IP 112.26.0.1.46615 > 112.26.0.8.54050: Flags [.], seq 798065:799493, ack 1, win 4017, options [nop,nop,TS val 175670 ecr 4294928754,mptcp dss ack 2843715367 seq 3761227497 subseq 798065 len 1428 csum 0x788b], length 1428
10:30:46.321252 IP 112.26.0.8.54050 > 112.26.0.1.46615: Flags [.], ack 778073, win 24289, options [nop,nop,TS val 4294929566 ecr 173462,nop,nop,sack 2 {788069:792353}{779501:786641},mptcp dss ack 3761106117], length 0
10:30:46.362279 IP 112.26.0.1.46615 > 112.26.0.8.54050: Flags [.], seq 802349:803777, ack 1, win 4017, options [nop,nop,TS val 176477 ecr 4294929566,mptcp dss ack 2843715367 seq 3761241777 subseq 802349 len 1428 csum 0x1868], length 1428
10:30:46.373195 IP 112.26.0.1.46615 > 112.26.0.8.54050: Flags [.], seq 799493:800921, ack 1, win 4017, options [nop,nop,TS val 175848 ecr 4294928944,mptcp dss ack 2843715367 seq 3761234637 subseq 799493 len 1428 csum 0x8548], length 1428
10:30:46.376614 IP 112.26.0.1.46615 > 112.26.0.8.54050: Flags [.], seq 799493:800921, ack 1, win 4017, options [nop,nop,TS val 175848 ecr 4294928944,mptcp dss ack 2843715367 seq 3761234637 subseq 799493 len 1428 csum 0x8548], length 1428
10:30:46.458033 IP 112.26.0.8.54050 > 112.26.0.1.46615: Flags [.], ack 778073, win 24289, options [nop,nop,TS val 4294929725 ecr 173462,nop,nop,sack 2 {788069:793781}{779501:786641},mptcp dss ack 3761106117], length 0
10:30:46.498512 IP 112.26.0.1.46615 > 112.26.0.8.54050: Flags [.], seq 778073:779501, ack 1, win 4017, options [nop,nop,TS val 175936 ecr 4294928944,mptcp dss ack 2843715367 seq 3761133249 subseq 778073 len 1428 csum 0xaeea], length 1428
10:30:46.536151 IP 112.26.0.1.46615 > 112.26.0.8.54050: Flags [.], seq 803777:805205, ack 1, win 4017, options [nop,nop,TS val 176620 ecr 4294929725,mptcp dss ack 2843715367 seq 3761251773 subseq 803777 len 1428 csum 0x6787], length 1428
10:30:46.538916 IP 112.26.0.1.46615 > 112.26.0.8.54050: Flags [.], seq 778073:779501, ack 1, win 4017, options [nop,nop,TS val 175936 ecr 4294928944,mptcp dss ack 2843715367 seq 3761133249 subseq 778073 len 1428 csum 0xaeea], length 1428
10:30:46.602742 IP 112.26.0.8.54050 > 112.26.0.1.46615: Flags [.], ack 778073, win 24289, options [nop,nop,TS val 4294929811 ecr 173462,nop,nop,sack 2 {788069:795209}{779501:786641},mptcp dss ack 3761106117], length 0
10:30:46.644274 IP 112.26.0.8.54050 > 112.26.0.1.46615: Flags [.], ack 778073, win 24289, options [nop,nop,TS val 4294929912 ecr 173462,nop,nop,sack 2 {788069:796637}{779501:786641},mptcp dss ack 3761106117], length 0
10:30:46.690716 IP 112.26.0.1.46615 > 112.26.0.8.54050: Flags [.], seq 786641:788069, ack 1, win 4017, options [nop,nop,TS val 176159 ecr 4294929317,mptcp dss ack 2843715367 seq 3761190369 subseq 786641 len 1428 csum 0xa677], length 1428
10:30:46.693229 IP 112.26.0.1.46615 > 112.26.0.8.54050: Flags [.], seq 786641:788069, ack 1, win 4017, options [nop,nop,TS val 176159 ecr 4294929317,mptcp dss ack 2843715367 seq 3761190369 subseq 786641 len 1428 csum 0xa677], length 1428
10:30:46.774925 IP 112.26.0.1.46615 > 112.26.0.8.54050: Flags [.], seq 800921:802349, ack 1, win 4017, options [nop,nop,TS val 176241 ecr 4294929442,mptcp dss ack 2843715367 seq 3761204649 subseq 800921 len 1428 csum 0xadfb], length 1428
10:30:46.780632 IP 112.26.0.1.46615 > 112.26.0.8.54050: Flags [.], seq 800921:802349, ack 1, win 4017, options [nop,nop,TS val 176241 ecr 4294929442,mptcp dss ack 2843715367 seq 3761204649 subseq 800921 len 1428 csum 0xadfb], length 1428
10:30:46.858871 IP 112.26.0.8.54050 > 112.26.0.1.46615: Flags [.], ack 778073, win 24289, options [nop,nop,TS val 4294930106 ecr 173462,nop,nop,sack 2 {788069:798065}{779501:786641},mptcp dss ack 3761106117], length 0
10:30:46.894075 IP 112.26.0.8.54050 > 112.26.0.1.46615: Flags [.], ack 778073, win 24289, options [nop,nop,TS val 4294930203 ecr 173462,nop,nop,sack 2 {788069:799493}{779501:786641},mptcp dss ack 3761106117], length 0
10:30:46.897225 IP 112.26.0.1.46615 > 112.26.0.8.54050: Flags [.], seq 805205:806633, ack 1, win 4017, options [nop,nop,TS val 177012 ecr 4294930106,mptcp dss ack 2843715367 seq 3761266053 subseq 805205 len 1428 csum 0x9cb9], length 1428
10:30:46.947782 IP 112.26.0.1.46615 > 112.26.0.8.54050: Flags [.], seq 802349:803777, ack 1, win 4017, options [nop,nop,TS val 176477 ecr 4294929566,mptcp dss ack 2843715367 seq 3761241777 subseq 802349 len 1428 csum 0x1868], length 1428
10:30:46.950296 IP 112.26.0.1.46615 > 112.26.0.8.54050: Flags [.], seq 802349:803777, ack 1, win 4017, options [nop,nop,TS val 176477 ecr 4294929566,mptcp dss ack 2843715367 seq 3761241777 subseq 802349 len 1428 csum 0x1868], length 1428
10:30:47.003774 IP 112.26.0.1.46615 > 112.26.0.8.54050: Flags [.], seq 806633:808061, ack 1, win 4017, options [nop,nop,TS val 177030 ecr 4294930203,mptcp dss ack 2843715367 seq 3761267481 subseq 806633 len 1428 csum 0x6444], length 1428
10:30:47.007557 IP 112.26.0.8.54050 > 112.26.0.1.46615: Flags [.], ack 778073, win 24223, options [nop,nop,TS val 4294930322 ecr 173462,nop,nop,sack 2 {788069:800921}{779501:786641},mptcp dss ack 3761110401], length 0
10:30:47.074379 IP 112.26.0.8.54050 > 112.26.0.1.46615: Flags [.], ack 786641, win 24223, options [nop,nop,TS val 4294930448 ecr 175936,nop,nop,sack 1 {788069:800921},mptcp dss ack 3761110401], length 0
10:30:47.077415 IP 112.26.0.1.46615 > 112.26.0.8.54050: Flags [.], seq 808061:809489, ack 1, win 4017, options [nop,nop,TS val 177192 ecr 4294930322,mptcp dss ack 2843715367 seq 3761273193 subseq 808061 len 1428 csum 0xf283], length 1428
10:30:47.137342 IP 112.26.0.1.46615 > 112.26.0.8.54050: Flags [.], seq 809489:810917, ack 1, win 4017, options [nop,nop,TS val 177192 ecr 4294930448,mptcp dss ack 2843715367 seq 3761274621 subseq 809489 len 1428 csum 0xaf01], length 1428
10:30:47.153053 IP 112.26.0.1.46615 > 112.26.0.8.54050: Flags [.], seq 803777:805205, ack 1, win 4017, options [nop,nop,TS val 176620 ecr 4294929725,mptcp dss ack 2843715367 seq 3761251773 subseq 803777 len 1428 csum 0x6787], length 1428
10:30:47.171329 IP 112.26.0.1.46615 > 112.26.0.8.54050: Flags [.], seq 803777:805205, ack 1, win 4017, options [nop,nop,TS val 176620 ecr 4294929725,mptcp dss ack 2843715367 seq 3761251773 subseq 803777 len 1428 csum 0x6787], length 1428
10:30:47.224583 IP 112.26.0.8.54050 > 112.26.0.1.46615: Flags [.], ack 800921, win 24223, options [nop,nop,TS val 4294930639 ecr 176159,mptcp dss ack 3761110401], length 0
10:30:47.228339 IP 112.26.0.1.46615 > 112.26.0.8.54050: Flags [.], seq 810917:812345, ack 1, win 4017, options [nop,nop,TS val 177343 ecr 4294930639,mptcp dss ack 2843715367 seq 3761283189 subseq 810917 len 1428 csum 0xe99b], length 1428
10:30:47.285746 IP 112.26.0.8.54050 > 112.26.0.1.46615: Flags [.], ack 802349, win 24223, options [nop,nop,TS val 4294930726 ecr 176241,mptcp dss ack 3761110401], length 0
10:30:47.288873 IP 112.26.0.1.46615 > 112.26.0.8.54050: Flags [.], seq 812345:813773, ack 1, win 4017, options [nop,nop,TS val 177404 ecr 4294930726,mptcp dss ack 2843715367 seq 3761284617 subseq 812345 len 1428 csum 0x6666], length 1428
10:30:47.356534 IP 112.26.0.1.46615 > 112.26.0.8.54050: Flags [.], seq 805205:806633, ack 1, win 4017, options [nop,nop,TS val 177012 ecr 4294930106,mptcp dss ack 2843715367 seq 3761266053 subseq 805205 len 1428 csum 0x9cb9], length 1428
10:30:47.359660 IP 112.26.0.1.46615 > 112.26.0.8.54050: Flags [.], seq 805205:806633, ack 1, win 4017, options [nop,nop,TS val 177012 ecr 4294930106,mptcp dss ack 2843715367 seq 3761266053 subseq 805205 len 1428 csum 0x9cb9], length 1428
10:30:47.379282 IP 112.26.0.1.46615 > 112.26.0.8.54050: Flags [.], seq 813773:815201, ack 1, win 4017, options [nop,nop,TS val 177404 ecr 4294930726,mptcp dss ack 2843715367 seq 3761286045 subseq 813773 len 1428 csum 0x51c0], length 1428
10:30:47.449180 IP 112.26.0.8.54050 > 112.26.0.1.46615: Flags [.], ack 803777, win 24223, options [nop,nop,TS val 4294930896 ecr 176477,mptcp dss ack 3761110401], length 0
10:30:47.455689 IP 112.26.0.1.46615 > 112.26.0.8.54050: Flags [.], seq 815201:816629, ack 1, win 4017, options [nop,nop,TS val 177567 ecr 4294930896,mptcp dss ack 2843715367 seq 3761300325 subseq 815201 len 1428 csum 0xa0f], length 1428
10:30:47.528063 IP 112.26.0.1.46615 > 112.26.0.8.54050: Flags [.], seq 806633:808061, ack 1, win 4017, options [nop,nop,TS val 177030 ecr 4294930203,mptcp dss ack 2843715367 seq 3761267481 subseq 806633 len 1428 csum 0x6444], length 1428
10:30:47.536994 IP 112.26.0.1.46615 > 112.26.0.8.54050: Flags [.], seq 806633:808061, ack 1, win 4017, options [nop,nop,TS val 177030 ecr 4294930203,mptcp dss ack 2843715367 seq 3761267481 subseq 806633 len 1428 csum 0x6444], length 1428
10:30:47.593192 IP 112.26.0.1.46615 > 112.26.0.8.54050: Flags [.], seq 808061:809489, ack 1, win 4017, options [nop,nop,TS val 177192 ecr 4294930322,mptcp dss ack 2843715367 seq 3761273193 subseq 808061 len 1428 csum 0xf283], length 1428
10:30:47.629624 IP 112.26.0.1.46615 > 112.26.0.8.54050: Flags [.], seq 808061:809489, ack 1, win 4017, options [nop,nop,TS val 177192 ecr 4294930322,mptcp dss ack 2843715367 seq 3761273193 subseq 808061 len 1428 csum 0xf283], length 1428
10:30:47.699542 IP 112.26.0.1.46615 > 112.26.0.8.54050: Flags [.], seq 809489:810917, ack 1, win 4017, options [nop,nop,TS val 177192 ecr 4294930448,mptcp dss ack 2843715367 seq 3761274621 subseq 809489 len 1428 csum 0xaf01], length 1428
10:30:47.720036 IP 112.26.0.1.46615 > 112.26.0.8.54050: Flags [.], seq 809489:810917, ack 1, win 4017, options [nop,nop,TS val 177192 ecr 4294930448,mptcp dss ack 2843715367 seq 3761274621 subseq 809489 len 1428 csum 0xaf01], length 1428
10:30:47.785393 IP 112.26.0.8.54050 > 112.26.0.1.46615: Flags [.], ack 805205, win 24223, options [nop,nop,TS val 4294931101 ecr 176620,mptcp dss ack 3761110401], length 0
10:30:47.788525 IP 112.26.0.1.46615 > 112.26.0.8.54050: Flags [.], seq 816629:818057, ack 1, win 4017, options [nop,nop,TS val 177903 ecr 4294931101,mptcp dss ack 2843715367 seq 3761314605 subseq 816629 len 1428 csum 0x7f5c], length 1428
10:30:47.827651 IP 112.26.0.1.46615 > 112.26.0.8.54050: Flags [.], seq 810917:812345, ack 1, win 4017, options [nop,nop,TS val 177343 ecr 4294930639,mptcp dss ack 2843715367 seq 3761283189 subseq 810917 len 1428 csum 0xe99b], length 1428
10:30:47.830557 IP 112.26.0.1.46615 > 112.26.0.8.54050: Flags [.], seq 810917:812345, ack 1, win 4017, options [nop,nop,TS val 177343 ecr 4294930639,mptcp dss ack 2843715367 seq 3761283189 subseq 810917 len 1428 csum 0xe99b], length 1428
10:30:47.914110 IP 112.26.0.1.46615 > 112.26.0.8.54050: Flags [.], seq 812345:813773, ack 1, win 4017, options [nop,nop,TS val 177404 ecr 4294930726,mptcp dss ack 2843715367 seq 3761284617 subseq 812345 len 1428 csum 0x6666], length 1428
10:30:47.930358 IP 112.26.0.1.46615 > 112.26.0.8.54050: Flags [.], seq 812345:813773, ack 1, win 4017, options [nop,nop,TS val 177404 ecr 4294930726,mptcp dss ack 2843715367 seq 3761284617 subseq 812345 len 1428 csum 0x6666], length 1428
10:30:47.971826 IP 112.26.0.1.46615 > 112.26.0.8.54050: Flags [.], seq 813773:815201, ack 1, win 4017, options [nop,nop,TS val 177404 ecr 4294930726,mptcp dss ack 2843715367 seq 3761286045 subseq 813773 len 1428 csum 0x51c0], length 1428
10:30:48.004017 IP 112.26.0.1.46615 > 112.26.0.8.54050: Flags [.], seq 813773:815201, ack 1, win 4017, options [nop,nop,TS val 177404 ecr 4294930726,mptcp dss ack 2843715367 seq 3761286045 subseq 813773 len 1428 csum 0x51c0], length 1428
10:30:48.074031 IP 112.26.0.1.46615 > 112.26.0.8.54050: Flags [.], seq 815201:816629, ack 1, win 4017, options [nop,nop,TS val 177567 ecr 4294930896,mptcp dss ack 2843715367 seq 3761300325 subseq 815201 len 1428 csum 0xa0f], length 1428
10:30:48.111613 IP 112.26.0.1.46615 > 112.26.0.8.54050: Flags [.], seq 815201:816629, ack 1, win 4017, options [nop,nop,TS val 177567 ecr 4294930896,mptcp dss ack 2843715367 seq 3761300325 subseq 815201 len 1428 csum 0xa0f], length 1428
10:30:48.128651 IP 112.26.0.8.54050 > 112.26.0.1.46615: Flags [.], ack 808061, win 24223, options [nop,nop,TS val 4294931475 ecr 177030,mptcp dss ack 3761110401], length 0
10:30:48.130547 IP 112.26.0.1.46615 > 112.26.0.8.54050: Flags [.], seq 818057:819485, ack 1, win 4017, options [nop,nop,TS val 178246 ecr 4294931475,mptcp dss ack 2843715367 seq 3761334597 subseq 818057 len 1428 csum 0x95a], length 1428
10:30:48.187960 IP 112.26.0.1.46615 > 112.26.0.8.54050: Flags [.], seq 819485:820913, ack 1, win 4017, options [nop,nop,TS val 178246 ecr 4294931475,mptcp dss ack 2843715367 seq 3761336025 subseq 819485 len 1428 csum 0x4311], length 1428
10:30:48.225671 IP 112.26.0.8.54050 > 112.26.0.1.46615: Flags [.], ack 809489, win 24223, options [nop,nop,TS val 4294931575 ecr 177192,mptcp dss ack 3761110401], length 0
10:30:48.258312 IP 112.26.0.1.46615 > 112.26.0.8.54050: Flags [.], seq 820913:822341, ack 1, win 4017, options [nop,nop,TS val 178246 ecr 4294931475,mptcp dss ack 2843715367 seq 3761337453 subseq 820913 len 1428 csum 0x5fe6], length 1428
10:30:48.304542 IP 112.26.0.8.54050 > 112.26.0.1.46615: Flags [.], ack 810917, win 24223, options [nop,nop,TS val 4294931666 ecr 177192,mptcp dss ack 3761110401], length 0
10:30:48.344600 IP 112.26.0.1.46615 > 112.26.0.8.54050: Flags [.], seq 822341:823769, ack 1, win 4017, options [nop,nop,TS val 178344 ecr 4294931575,mptcp dss ack 2843715367 seq 3761341737 subseq 822341 len 1428 csum 0x9d90], length 1428
10:30:48.371108 IP 112.26.0.1.46615 > 112.26.0.8.54050: Flags [.], seq 816629:818057, ack 1, win 4017, options [nop,nop,TS val 177903 ecr 4294931101,mptcp dss ack 2843715367 seq 3761314605 subseq 816629 len 1428 csum 0x7f5c], length 1428
10:30:48.372916 IP 112.26.0.1.46615 > 112.26.0.8.54050: Flags [.], seq 816629:818057, ack 1, win 4017, options [nop,nop,TS val 177903 ecr 4294931101,mptcp dss ack 2843715367 seq 3761314605 subseq 816629 len 1428 csum 0x7f5c], length 1428
10:30:48.405093 IP 112.26.0.1.46615 > 112.26.0.8.54050: Flags [.], seq 823769:825197, ack 1, win 4017, options [nop,nop,TS val 178423 ecr 4294931666,mptcp dss ack 2843715367 seq 3761347449 subseq 823769 len 1428 csum 0xf9b0], length 1428
10:30:48.450154 IP 112.26.0.8.54050 > 112.26.0.1.46615: Flags [.], ack 812345, win 24223, options [nop,nop,TS val 4294931776 ecr 177343,mptcp dss ack 3761110401], length 0
10:30:48.452952 IP 112.26.0.1.46615 > 112.26.0.8.54050: Flags [.], seq 825197:826625, ack 1, win 4017, options [nop,nop,TS val 178568 ecr 4294931776,mptcp dss ack 2843715367 seq 3761351733 subseq 825197 len 1428 csum 0x4941], length 1428
10:30:48.490267 IP 112.26.0.8.54050 > 112.26.0.1.46615: Flags [.], ack 813773, win 24223, options [nop,nop,TS val 4294931876 ecr 177404,mptcp dss ack 3761110401], length 0
10:30:48.511343 IP 112.26.0.1.46615 > 112.26.0.8.54050: Flags [.], seq 826625:828053, ack 1, win 4017, options [nop,nop,TS val 178609 ecr 4294931876,mptcp dss ack 2843715367 seq 3761354589 subseq 826625 len 1428 csum 0xd7e8], length 1428
10:30:48.548321 IP 112.26.0.8.54050 > 112.26.0.1.46615: Flags [.], ack 815201, win 24223, options [nop,nop,TS val 4294931949 ecr 177404,mptcp dss ack 3761110401], length 0
10:30:48.582647 IP 112.26.0.1.46615 > 112.26.0.8.54050: Flags [.], seq 828053:829481, ack 1, win 4017, options [nop,nop,TS val 178609 ecr 4294931876,mptcp dss ack 2843715367 seq 3761356017 subseq 828053 len 1428 csum 0x1999], length 1428
10:30:48.607178 IP 112.26.0.1.46615 > 112.26.0.8.54050: Flags [.], seq 818057:819485, ack 1, win 4017, options [nop,nop,TS val 178246 ecr 4294931475,mptcp dss ack 2843715367 seq 3761334597 subseq 818057 len 1428 csum 0x95a], length 1428
10:30:48.648296 IP 112.26.0.1.46615 > 112.26.0.8.54050: Flags [.], seq 829481:830909, ack 1, win 4017, options [nop,nop,TS val 178667 ecr 4294931949,mptcp dss ack 2843715367 seq 3761357445 subseq 829481 len 1428 csum 0x3807], length 1428
10:30:48.658031 IP 112.26.0.1.46615 > 112.26.0.8.54050: Flags [.], seq 818057:819485, ack 1, win 4017, options [nop,nop,TS val 178246 ecr 4294931475,mptcp dss ack 2843715367 seq 3761334597 subseq 818057 len 1428 csum 0x95a], length 1428
10:30:48.735826 IP 112.26.0.1.46615 > 112.26.0.8.54050: Flags [.], seq 819485:820913, ack 1, win 4017, options [nop,nop,TS val 178246 ecr 4294931475,mptcp dss ack 2843715367 seq 3761336025 subseq 819485 len 1428 csum 0x4311], length 1428
10:30:48.754164 IP 112.26.0.1.46615 > 112.26.0.8.54050: Flags [.], seq 819485:820913, ack 1, win 4017, options [nop,nop,TS val 178246 ecr 4294931475,mptcp dss ack 2843715367 seq 3761336025 subseq 819485 len 1428 csum 0x4311], length 1428
10:30:48.789780 IP 112.26.0.8.54050 > 112.26.0.1.46615: Flags [.], ack 816629, win 24223, options [nop,nop,TS val 4294932065 ecr 177567,mptcp dss ack 3761110401], length 0
10:30:48.794832 IP 112.26.0.1.46615 > 112.26.0.8.54050: Flags [.], seq 830909:832337, ack 1, win 4017, options [nop,nop,TS val 178908 ecr 4294932065,mptcp dss ack 2843715367 seq 3761374581 subseq 830909 len 1428 csum 0xa9af], length 1428
10:30:48.870377 IP 112.26.0.1.46615 > 112.26.0.8.54050: Flags [.], seq 820913:822341, ack 1, win 4017, options [nop,nop,TS val 178246 ecr 4294931475,mptcp dss ack 2843715367 seq 3761337453 subseq 820913 len 1428 csum 0x5fe6], length 1428
10:30:48.877021 IP 112.26.0.1.46615 > 112.26.0.8.54050: Flags [.], seq 820913:822341, ack 1, win 4017, options [nop,nop,TS val 178246 ecr 4294931475,mptcp dss ack 2843715367 seq 3761337453 subseq 820913 len 1428 csum 0x5fe6], length 1428
10:30:48.944606 IP 112.26.0.1.46615 > 112.26.0.8.54050: Flags [.], seq 822341:823769, ack 1, win 4017, options [nop,nop,TS val 178344 ecr 4294931575,mptcp dss ack 2843715367 seq 3761341737 subseq 822341 len 1428 csum 0x9d90], length 1428
10:30:48.950713 IP 112.26.0.1.46615 > 112.26.0.8.54050: Flags [.], seq 822341:823769, ack 1, win 4017, options [nop,nop,TS val 178344 ecr 4294931575,mptcp dss ack 2843715367 seq 3761341737 subseq 822341 len 1428 csum 0x9d90], length 1428
10:30:49.060678 IP 112.26.0.8.54050 > 112.26.0.1.46615: Flags [.], ack 818057, win 24117, options [nop,nop,TS val 4294932319 ecr 177903,mptcp dss ack 3761248917], length 0
10:30:49.064439 IP 112.26.0.1.46615 > 112.26.0.8.54050: Flags [.], seq 832337:833765, ack 1, win 4017, options [nop,nop,TS val 179179 ecr 4294932319,mptcp dss ack 2843715367 seq 3761388861 subseq 832337 len 1428 csum 0x3fd1], length 1428
10:30:49.147621 IP 112.26.0.1.46615 > 112.26.0.8.54050: Flags [.], seq 825197:826625, ack 1, win 4017, options [nop,nop,TS val 178568 ecr 4294931776,mptcp dss ack 2843715367 seq 3761351733 subseq 825197 len 1428 csum 0x4941], length 1428
10:30:49.151836 IP 112.26.0.1.46615 > 112.26.0.8.54050: Flags [.], seq 825197:826625, ack 1, win 4017, options [nop,nop,TS val 178568 ecr 4294931776,mptcp dss ack 2843715367 seq 3761351733 subseq 825197 len 1428 csum 0x4941], length 1428
10:30:49.189742 IP 112.26.0.1.46615 > 112.26.0.8.54050: Flags [.], seq 826625:828053, ack 1, win 4017, options [nop,nop,TS val 178609 ecr 4294931876,mptcp dss ack 2843715367 seq 3761354589 subseq 826625 len 1428 csum 0xd7e8], length 1428
10:30:49.216914 IP 112.26.0.1.46615 > 112.26.0.8.54050: Flags [.], seq 826625:828053, ack 1, win 4017, options [nop,nop,TS val 178609 ecr 4294931876,mptcp dss ack 2843715367 seq 3761354589 subseq 826625 len 1428 csum 0xd7e8], length 1428
10:30:49.308708 IP 112.26.0.1.46615 > 112.26.0.8.54050: Flags [.], seq 828053:829481, ack 1, win 4017, options [nop,nop,TS val 178609 ecr 4294931876,mptcp dss ack 2843715367 seq 3761356017 subseq 828053 len 1428 csum 0x1999], length 1428
10:30:49.341733 IP 112.26.0.1.46615 > 112.26.0.8.54050: Flags [.], seq 828053:829481, ack 1, win 4017, options [nop,nop,TS val 178609 ecr 4294931876,mptcp dss ack 2843715367 seq 3761356017 subseq 828053 len 1428 csum 0x1999], length 1428
10:30:49.365155 IP 112.26.0.1.46615 > 112.26.0.8.54050: Flags [.], seq 829481:830909, ack 1, win 4017, options [nop,nop,TS val 178667 ecr 4294931949,mptcp dss ack 2843715367 seq 3761357445 subseq 829481 len 1428 csum 0x3807], length 1428
10:30:49.435743 IP 112.26.0.8.54050 > 112.26.0.1.46615: Flags [.], ack 820913, win 24117, options [nop,nop,TS val 4294932684 ecr 178246,mptcp dss ack 3761248917], length 0
10:30:49.439947 IP 112.26.0.1.46615 > 112.26.0.8.54050: Flags [.], seq 833765:835193, ack 1, win 4017, options [nop,nop,TS val 179554 ecr 4294932684,mptcp dss ack 2843715367 seq 3761398857 subseq 833765 len 1428 csum 0x1fc9], length 1428
10:30:49.457000 IP 112.26.0.1.46615 > 112.26.0.8.54050: Flags [.], seq 829481:830909, ack 1, win 4017, options [nop,nop,TS val 178667 ecr 4294931949,mptcp dss ack 2843715367 seq 3761357445 subseq 829481 len 1428 csum 0x3807], length 1428
10:30:49.491008 IP 112.26.0.1.46615 > 112.26.0.8.54050: Flags [.], seq 835193:836621, ack 1, win 4017, options [nop,nop,TS val 179554 ecr 4294932684,mptcp dss ack 2843715367 seq 3761400285 subseq 835193 len 1428 csum 0xe5f6], length 1428
10:30:49.515802 IP 112.26.0.1.46615 > 112.26.0.8.54050: Flags [.], seq 830909:832337, ack 1, win 4017, options [nop,nop,TS val 178908 ecr 4294932065,mptcp dss ack 2843715367 seq 3761374581 subseq 830909 len 1428 csum 0xa9af], length 1428
10:30:49.519453 IP 112.26.0.1.46615 > 112.26.0.8.54050: Flags [.], seq 830909:832337, ack 1, win 4017, options [nop,nop,TS val 178908 ecr 4294932065,mptcp dss ack 2843715367 seq 3761374581 subseq 830909 len 1428 csum 0xa9af], length 1428
10:30:49.603220 IP 112.26.0.8.54050 > 112.26.0.1.46615: Flags [.], ack 822341, win 24117, options [nop,nop,TS val 4294932861 ecr 178246,mptcp dss ack 3761248917], length 0
10:30:49.623200 IP 112.26.0.1.46615 > 112.26.0.8.54050: Flags [.], seq 836621:838049, ack 1, win 4017, options [nop,nop,TS val 179721 ecr 4294932861,mptcp dss ack 2843715367 seq 3761411709 subseq 836621 len 1428 csum 0x4727], length 1428
10:30:49.675083 IP 112.26.0.1.46615 > 112.26.0.8.54050: Flags [.], seq 838049:839477, ack 1, win 4017, options [nop,nop,TS val 179721 ecr 4294932861,mptcp dss ack 2843715367 seq 3761413137 subseq 838049 len 1428 csum 0x3f79], length 1428
10:30:49.799997 IP 112.26.0.8.54050 > 112.26.0.1.46615: Flags [.], ack 823769, win 24117, options [nop,nop,TS val 4294933097 ecr 178344,nop,nop,sack 1 {825197:826625},mptcp dss ack 3761248917], length 0
10:30:49.804552 IP 112.26.0.1.46615 > 112.26.0.8.54050: Flags [.], seq 839477:840905, ack 1, win 4017, options [nop,nop,TS val 179918 ecr 4294933097,mptcp dss ack 2843715367 seq 3761417421 subseq 839477 len 1428 csum 0xb8d8], length 1428
10:30:49.873665 IP 112.26.0.8.54050 > 112.26.0.1.46615: Flags [.], ack 823769, win 24117, options [nop,nop,TS val 4294933162 ecr 178344,nop,nop,sack 1 {825197:828053},mptcp dss ack 3761248917], length 0
10:30:49.905018 IP 112.26.0.8.54050 > 112.26.0.1.46615: Flags [.], ack 823769, win 24117, options [nop,nop,TS val 4294933287 ecr 178344,nop,nop,sack 1 {825197:829481},mptcp dss ack 3761248917], length 0
