10:29:25.567833 IP 112.26.0.8.54050 > 112.26.0.1.46615: Flags [S], seq 3691055875, win 65535, options [mss 1460,sackOK,TS val 4294849452 ecr 0,nop,wscale 6,mptcp capable csum {0xf3f641e5c9e720a6}], length 0
10:29:25.679776 IP 112.26.0.8.54050 > 112.26.0.1.46615: Flags [S], seq 3691055875, win 65535, options [mss 1460,sackOK,TS val 4294849452 ecr 0,nop,wscale 6,mptcp capable csum {0xf3f641e5c9e720a6}], length 0
10:29:25.988002 IP 112.26.0.1.46615 > 112.26.0.8.54050: Flags [S.], seq 406276099, ack 3691055876, win 65535, options [mss 1460,sackOK,TS val 95900 ecr 4294849452,nop,wscale 6,mptcp capable csum {0x6a6e46fcfc41c11a}], length 0
10:29:25.988275 IP 112.26.0.8.54050 > 112.26.0.1.46615: Flags [.], ack 1, win 1369, options [nop,nop,TS val 4294849933 ecr 95900,mptcp capable csum {0xf3f641e5c9e720a6,0x6a6e46fcfc41c11a},mptcp dss ack 3758104649], length 0
10:29:25.988329 IP 112.26.0.8.54050 > 112.26.0.1.46615: Flags [.], ack 1, win 1369, options [nop,nop,TS val 4294849933 ecr 95900,mptcp add-addr id 3 112.26.1.8,mptcp dss ack 3758104649], length 0
10:29:25.988372 IP 112.26.0.8.54050 > 112.26.0.1.46615: Flags [.], ack 1, win 1369, options [nop,nop,TS val 4294849933 ecr 95900,mptcp add-addr id 4 112.26.2.8,mptcp dss ack 3758104649], length 0
10:29:25.988410 IP 112.26.0.8.54050 > 112.26.0.1.46615: Flags [.], ack 1, win 1369, options [nop,nop,TS val 4294849933 ecr 95900,mptcp add-addr id 6 112.26.3.8,mptcp dss ack 3758104649], length 0
10:30:16.943587 IP 112.26.0.1.46615 > 112.26.0.8.54050: Flags [.], seq 516749:518177, ack 1, win 4017, options [nop,nop,TS val 146456 ecr 4294899605,mptcp dss ack 2843715367 seq 3760012269 subseq 516749 len 1428 csum 0x78da], length 1428
10:30:16.943943 IP 112.26.0.8.54050 > 112.26.0.1.46615: Flags [.], ack 505325, win 24487, options [nop,nop,TS val 4294900888 ecr 145445,nop,nop,sack 2 {513893:518177}{509609:512465},mptcp dss ack 3759959433], length 0
10:30:16.951883 IP 112.26.0.8.54050 > 112.26.0.1.46615: Flags [.], ack 505325, win 24487, options [nop,nop,TS val 4294900888 ecr 145445,nop,nop,sack 2 {513893:518177}{509609:512465},mptcp dss ack 3759959433], length 0
10:30:17.156876 IP 112.26.0.1.46615 > 112.26.0.8.54050: Flags [.], seq 518177:519605, ack 1, win 4017, options [nop,nop,TS val 146747 ecr 4294899877,mptcp dss ack 2843715367 seq 3760029405 subseq 518177 len 1428 csum 0x9173], length 1428
10:30:39.753212 IP 112.26.0.1.46615 > 112.26.0.8.54050: Flags [.], seq 736661:738089, ack 1, win 4017, options [nop,nop,TS val 169061 ecr 4294922271,mptcp dss ack 2843715367 seq 3760866213 subseq 736661 len 1428 csum 0x9f23], length 1428
10:30:59.192536 IP 112.26.0.1.46615 > 112.26.0.8.54050: Flags [.], seq 919445:920873, ack 1, win 4017, options [nop,nop,TS val 188398 ecr 4294941604,mptcp dss ack 2843715367 seq 3761777277 subseq 919445 len 1428 csum 0x7cf5], length 1428
