10:29:33.145989 IP 112.26.3.8.40113 > 112.26.3.1.46615: Flags [S], seq 2110223229, win 65535, options [mss 1460,sackOK,TS val 4294857066 ecr 0,nop,wscale 6,mptcp join id 6 token 0x9485611f nonce 0xe9dd8d1b], length 0
10:29:33.179758 IP 112.26.3.8.40113 > 112.26.3.1.46615: Flags [S], seq 2110223229, win 65535, options [mss 1460,sackOK,TS val 4294857066 ecr 0,nop,wscale 6,mptcp join id 6 token 0x9485611f nonce 0xe9dd8d1b], length 0
10:29:33.259346 IP 112.26.3.8.40113 > 112.26.3.1.46615: Flags [S], seq 2110223229, win 65535, options [mss 1460,sackOK,TS val 4294857066 ecr 0,nop,wscale 6,mptcp join id 6 token 0x9485611f nonce 0xe9dd8d1b], length 0
10:29:33.414744 IP 112.26.3.1.46615 > 112.26.3.8.40113: Flags [S.], seq 149559822, ack 2110223230, win 65535, options [mss 1460,sackOK,TS val 103377 ecr 4294857066,nop,wscale 6,mptcp join id 5 hmac 0x89c8395052e86075 nonce 0x2b29489b], length 0
10:29:33.493216 IP 112.26.3.1.46615 > 112.26.3.8.40113: Flags [S.], seq 149559822, ack 2110223230, win 65535, options [mss 1460,sackOK,TS val 103377 ecr 4294857066,nop,wscale 6,mptcp join id 5 hmac 0x89c8395052e86075 nonce 0x2b29489b], length 0
10:29:33.526203 IP 112.26.3.8.40113 > 112.26.3.1.46615: Flags [.], ack 1, win 7437, options [nop,nop,TS val 4294857441 ecr 103377,mptcp join hmac 0xe1569dd3d789e0842eb4539998398e150a4080a7], length 0
10:29:33.604431 IP 112.26.3.8.40113 > 112.26.3.1.46615: Flags [.], ack 1, win 7437, options [nop,nop,TS val 4294857441 ecr 103377,mptcp join hmac 0xe1569dd3d789e0842eb4539998398e150a4080a7], length 0
10:30:05.217559 IP 112.26.3.1.46615 > 112.26.3.8.40113: Flags [.], seq 424117:425545, ack 1, win 4017, options [nop,nop,TS val 134598 ecr 4294888418,mptcp dss ack 2843715367 seq 3759488193 subseq 424117 len 1428 csum 0xd829], length 1428
10:30:05.217724 IP 112.26.3.1.46615 > 112.26.3.8.40113: Flags [.], seq 424117:425545, ack 1, win 4017, options [nop,nop,TS val 134598 ecr 4294888418,mptcp dss ack 2843715367 seq 3759488193 subseq 424117 len 1428 csum 0xd829], length 1428
10:30:05.330969 IP 112.26.3.1.46615 > 112.26.3.8.40113: Flags [.], seq 426973:428401, ack 1, win 4017, options [nop,nop,TS val 134747 ecr 4294888558,mptcp dss ack 2843715367 seq 3759493905 subseq 426973 len 1428 csum 0xb9f5], length 1428
10:30:05.331120 IP 112.26.3.1.46615 > 112.26.3.8.40113: Flags [.], seq 426973:428401, ack 1, win 4017, options [nop,nop,TS val 134747 ecr 4294888558,mptcp dss ack 2843715367 seq 3759493905 subseq 426973 len 1428 csum 0xb9f5], length 1428
10:30:05.337306 IP 112.26.3.8.40113 > 112.26.3.1.46615: Flags [.], ack 425545, win 23885, options [nop,nop,TS val 4294889279 ecr 134377,nop,nop,sack 1 {426973:428401},mptcp dss ack 3759388233], length 0
10:30:05.342480 IP 112.26.3.8.40113 > 112.26.3.1.46615: Flags [.], ack 425545, win 23885, options [nop,nop,TS val 4294889279 ecr 134377,nop,nop,sack 1 {426973:428401},mptcp dss ack 3759388233], length 0
10:30:05.356106 IP 112.26.3.8.40113 > 112.26.3.1.46615: Flags [.], ack 425545, win 23885, options [nop,nop,TS val 4294889279 ecr 134377,nop,nop,sack 1 {426973:428401},mptcp dss ack 3759388233], length 0
10:30:05.447728 IP 112.26.3.1.46615 > 112.26.3.8.40113: Flags [.], seq 428401:429829, ack 1, win 4017, options [nop,nop,TS val 134747 ecr 4294888558,mptcp dss ack 2843715367 seq 3759495333 subseq 428401 len 1428 csum 0xf799], length 1428
10:30:05.447908 IP 112.26.3.1.46615 > 112.26.3.8.40113: Flags [.], seq 428401:429829, ack 1, win 4017, options [nop,nop,TS val 134747 ecr 4294888558,mptcp dss ack 2843715367 seq 3759495333 subseq 428401 len 1428 csum 0xf799], length 1428
10:30:05.453120 IP 112.26.3.8.40113 > 112.26.3.1.46615: Flags [.], ack 425545, win 23885, options [nop,nop,TS val 4294889396 ecr 134377,nop,nop,sack 1 {426973:429829},mptcp dss ack 3759388233], length 0
10:30:05.455180 IP 112.26.3.8.40113 > 112.26.3.1.46615: Flags [.], ack 425545, win 23885, options [nop,nop,TS val 4294889396 ecr 134377,nop,nop,sack 1 {426973:429829},mptcp dss ack 3759388233], length 0
10:30:05.494329 IP 112.26.3.8.40113 > 112.26.3.1.46615: Flags [.], ack 425545, win 23885, options [nop,nop,TS val 4294889396 ecr 134377,nop,nop,sack 1 {426973:429829},mptcp dss ack 3759388233], length 0
10:30:05.541887 IP 112.26.3.1.46615 > 112.26.3.8.40113: Flags [.], seq 431257:432685, ack 1, win 4017, options [nop,nop,TS val 134909 ecr 4294888727,mptcp dss ack 2843715367 seq 3759508185 subseq 431257 len 1428 csum 0x7ee2], length 1428
10:30:05.542070 IP 112.26.3.1.46615 > 112.26.3.8.40113: Flags [.], seq 431257:432685, ack 1, win 4017, options [nop,nop,TS val 134909 ecr 4294888727,mptcp dss ack 2843715367 seq 3759508185 subseq 431257 len 1428 csum 0x7ee2], length 1428
10:30:05.546741 IP 112.26.3.8.40113 > 112.26.3.1.46615: Flags [.], ack 425545, win 23885, options [nop,nop,TS val 4294889490 ecr 134377,nop,nop,sack 2 {431257:432685}{426973:429829},mptcp dss ack 3759388233], length 0
10:30:05.550451 IP 112.26.3.8.40113 > 112.26.3.1.46615: Flags [.], ack 425545, win 23885, options [nop,nop,TS val 4294889490 ecr 134377,nop,nop,sack 2 {431257:432685}{426973:429829},mptcp dss ack 3759388233], length 0
10:30:05.592912 IP 112.26.3.8.40113 > 112.26.3.1.46615: Flags [.], ack 425545, win 23885, options [nop,nop,TS val 4294889490 ecr 134377,nop,nop,sack 2 {431257:432685}{426973:429829},mptcp dss ack 3759388233], length 0
10:30:05.639461 IP 112.26.3.1.46615 > 112.26.3.8.40113: Flags [.], seq 432685:434113, ack 1, win 4017, options [nop,nop,TS val 134909 ecr 4294888727,mptcp dss ack 2843715367 seq 3759509613 subseq 432685 len 1428 csum 0x1041], length 1428
10:30:05.639673 IP 112.26.3.1.46615 > 112.26.3.8.40113: Flags [.], seq 432685:434113, ack 1, win 4017, options [nop,nop,TS val 134909 ecr 4294888727,mptcp dss ack 2843715367 seq 3759509613 subseq 432685 len 1428 csum 0x1041], length 1428
10:30:05.646204 IP 112.26.3.8.40113 > 112.26.3.1.46615: Flags [.], ack 425545, win 23885, options [nop,nop,TS val 4294889586 ecr 134377,nop,nop,sack 2 {431257:434113}{426973:429829},mptcp dss ack 3759388233], length 0
10:30:05.675170 IP 112.26.3.8.40113 > 112.26.3.1.46615: Flags [.], ack 425545, win 23885, options [nop,nop,TS val 4294889586 ecr 134377,nop,nop,sack 2 {431257:434113}{426973:429829},mptcp dss ack 3759388233], length 0
10:30:05.678238 IP 112.26.3.8.40113 > 112.26.3.1.46615: Flags [.], ack 425545, win 23885, options [nop,nop,TS val 4294889586 ecr 134377,nop,nop,sack 2 {431257:434113}{426973:429829},mptcp dss ack 3759388233], length 0
10:30:05.716271 IP 112.26.3.1.46615 > 112.26.3.8.40113: Flags [.], seq 434113:435541, ack 1, win 4017, options [nop,nop,TS val 135194 ecr 4294889014,mptcp dss ack 2843715367 seq 3759521037 subseq 434113 len 1428 csum 0xc4fb], length 1428
10:30:05.716444 IP 112.26.3.1.46615 > 112.26.3.8.40113: Flags [.], seq 434113:435541, ack 1, win 4017, options [nop,nop,TS val 135194 ecr 4294889014,mptcp dss ack 2843715367 seq 3759521037 subseq 434113 len 1428 csum 0xc4fb], length 1428
10:30:05.765864 IP 112.26.3.8.40113 > 112.26.3.1.46615: Flags [.], ack 425545, win 23712, options [nop,nop,TS val 4294889709 ecr 134377,nop,nop,sack 2 {431257:435541}{426973:429829},mptcp dss ack 3759422505], length 0
10:30:05.780207 IP 112.26.3.8.40113 > 112.26.3.1.46615: Flags [.], ack 425545, win 23712, options [nop,nop,TS val 4294889709 ecr 134377,nop,nop,sack 2 {431257:435541}{426973:429829},mptcp dss ack 3759422505], length 0
10:30:05.790548 IP 112.26.3.8.40113 > 112.26.3.1.46615: Flags [.], ack 425545, win 23712, options [nop,nop,TS val 4294889709 ecr 134377,nop,nop,sack 2 {431257:435541}{426973:429829},mptcp dss ack 3759422505], length 0
10:30:05.832868 IP 112.26.3.1.46615 > 112.26.3.8.40113: Flags [.], seq 435541:436969, ack 1, win 4017, options [nop,nop,TS val 135194 ecr 4294889014,mptcp dss ack 2843715367 seq 3759522465 subseq 435541 len 1428 csum 0xd638], length 1428
10:30:05.833069 IP 112.26.3.1.46615 > 112.26.3.8.40113: Flags [.], seq 435541:436969, ack 1, win 4017, options [nop,nop,TS val 135194 ecr 4294889014,mptcp dss ack 2843715367 seq 3759522465 subseq 435541 len 1428 csum 0xd638], length 1428
10:30:05.842936 IP 112.26.3.8.40113 > 112.26.3.1.46615: Flags [.], ack 425545, win 23712, options [nop,nop,TS val 4294889779 ecr 134377,nop,nop,sack 2 {431257:436969}{426973:429829},mptcp dss ack 3759422505], length 0
10:30:05.891907 IP 112.26.3.8.40113 > 112.26.3.1.46615: Flags [.], ack 425545, win 23712, options [nop,nop,TS val 4294889779 ecr 134377,nop,nop,sack 2 {431257:436969}{426973:429829},mptcp dss ack 3759422505], length 0
10:30:05.893997 IP 112.26.3.8.40113 > 112.26.3.1.46615: Flags [.], ack 425545, win 23712, options [nop,nop,TS val 4294889779 ecr 134377,nop,nop,sack 2 {431257:436969}{426973:429829},mptcp dss ack 3759422505], length 0
10:30:05.921470 IP 112.26.3.1.46615 > 112.26.3.8.40113: Flags [.], seq 436969:438397, ack 1, win 4017, options [nop,nop,TS val 135194 ecr 4294889014,mptcp dss ack 2843715367 seq 3759523893 subseq 436969 len 1428 csum 0x13a3], length 1428
10:30:05.921669 IP 112.26.3.1.46615 > 112.26.3.8.40113: Flags [.], seq 436969:438397, ack 1, win 4017, options [nop,nop,TS val 135194 ecr 4294889014,mptcp dss ack 2843715367 seq 3759523893 subseq 436969 len 1428 csum 0x13a3], length 1428
10:30:05.943408 IP 112.26.3.8.40113 > 112.26.3.1.46615: Flags [.], ack 425545, win 23712, options [nop,nop,TS val 4294889887 ecr 134377,nop,nop,sack 2 {431257:438397}{426973:429829},mptcp dss ack 3759422505], length 0
10:30:05.957560 IP 112.26.3.8.40113 > 112.26.3.1.46615: Flags [.], ack 425545, win 23712, options [nop,nop,TS val 4294889887 ecr 134377,nop,nop,sack 2 {431257:438397}{426973:429829},mptcp dss ack 3759422505], length 0
10:30:05.982389 IP 112.26.3.1.46615 > 112.26.3.8.40113: Flags [.], seq 438397:439825, ack 1, win 4017, options [nop,nop,TS val 135194 ecr 4294889014,mptcp dss ack 2843715367 seq 3759525321 subseq 438397 len 1428 csum 0x9cfc], length 1428
10:30:05.982590 IP 112.26.3.1.46615 > 112.26.3.8.40113: Flags [.], seq 438397:439825, ack 1, win 4017, options [nop,nop,TS val 135194 ecr 4294889014,mptcp dss ack 2843715367 seq 3759525321 subseq 438397 len 1428 csum 0x9cfc], length 1428
10:30:05.993968 IP 112.26.3.8.40113 > 112.26.3.1.46615: Flags [.], ack 425545, win 23712, options [nop,nop,TS val 4294889887 ecr 134377,nop,nop,sack 2 {431257:438397}{426973:429829},mptcp dss ack 3759422505], length 0
10:30:06.070068 IP 112.26.3.8.40113 > 112.26.3.1.46615: Flags [.], ack 425545, win 23712, options [nop,nop,TS val 4294889994 ecr 134377,nop,nop,sack 2 {431257:439825}{426973:429829},mptcp dss ack 3759422505], length 0
10:30:06.074583 IP 112.26.3.8.40113 > 112.26.3.1.46615: Flags [.], ack 425545, win 23712, options [nop,nop,TS val 4294889994 ecr 134377,nop,nop,sack 2 {431257:439825}{426973:429829},mptcp dss ack 3759422505], length 0
10:30:06.085759 IP 112.26.3.8.40113 > 112.26.3.1.46615: Flags [.], ack 425545, win 23712, options [nop,nop,TS val 4294889994 ecr 134377,nop,nop,sack 2 {431257:439825}{426973:429829},mptcp dss ack 3759422505], length 0
10:30:06.099046 IP 112.26.3.1.46615 > 112.26.3.8.40113: Flags [.], seq 439825:441253, ack 1, win 4017, options [nop,nop,TS val 135474 ecr 4294889279,mptcp dss ack 2843715367 seq 3759533889 subseq 439825 len 1428 csum 0x78e], length 1428
10:30:06.099229 IP 112.26.3.1.46615 > 112.26.3.8.40113: Flags [.], seq 439825:441253, ack 1, win 4017, options [nop,nop,TS val 135474 ecr 4294889279,mptcp dss ack 2843715367 seq 3759533889 subseq 439825 len 1428 csum 0x78e], length 1428
10:30:06.153817 IP 112.26.3.8.40113 > 112.26.3.1.46615: Flags [.], ack 425545, win 23712, options [nop,nop,TS val 4294890098 ecr 134377,nop,nop,sack 2 {431257:441253}{426973:429829},mptcp dss ack 3759422505], length 0
10:30:06.212624 IP 112.26.3.8.40113 > 112.26.3.1.46615: Flags [.], ack 425545, win 23712, options [nop,nop,TS val 4294890098 ecr 134377,nop,nop,sack 2 {431257:441253}{426973:429829},mptcp dss ack 3759422505], length 0
10:30:06.214369 IP 112.26.3.8.40113 > 112.26.3.1.46615: Flags [.], ack 425545, win 23712, options [nop,nop,TS val 4294890098 ecr 134377,nop,nop,sack 2 {431257:441253}{426973:429829},mptcp dss ack 3759422505], length 0
10:30:06.230518 IP 112.26.3.1.46615 > 112.26.3.8.40113: Flags [.], seq 442681:444109, ack 1, win 4017, options [nop,nop,TS val 135474 ecr 4294889279,mptcp dss ack 2843715367 seq 3759536745 subseq 442681 len 1428 csum 0x5aad], length 1428
10:30:06.230716 IP 112.26.3.1.46615 > 112.26.3.8.40113: Flags [.], seq 442681:444109, ack 1, win 4017, options [nop,nop,TS val 135474 ecr 4294889279,mptcp dss ack 2843715367 seq 3759536745 subseq 442681 len 1428 csum 0x5aad], length 1428
10:30:06.260438 IP 112.26.3.8.40113 > 112.26.3.1.46615: Flags [.], ack 425545, win 23712, options [nop,nop,TS val 4294890199 ecr 134377,nop,nop,sack 2 {442681:444109}{431257:441253},mptcp dss ack 3759422505], length 0
10:30:06.294404 IP 112.26.3.1.46615 > 112.26.3.8.40113: Flags [.], seq 444109:445537, ack 1, win 4017, options [nop,nop,TS val 135640 ecr 4294889396,mptcp dss ack 2843715367 seq 3759545313 subseq 444109 len 1428 csum 0xc93e], length 1428
10:30:06.294596 IP 112.26.3.1.46615 > 112.26.3.8.40113: Flags [.], seq 444109:445537, ack 1, win 4017, options [nop,nop,TS val 135640 ecr 4294889396,mptcp dss ack 2843715367 seq 3759545313 subseq 444109 len 1428 csum 0xc93e], length 1428
10:30:06.313298 IP 112.26.3.8.40113 > 112.26.3.1.46615: Flags [.], ack 425545, win 23712, options [nop,nop,TS val 4294890199 ecr 134377,nop,nop,sack 2 {442681:444109}{431257:441253},mptcp dss ack 3759422505], length 0
10:30:06.322552 IP 112.26.3.8.40113 > 112.26.3.1.46615: Flags [.], ack 425545, win 23712, options [nop,nop,TS val 4294890199 ecr 134377,nop,nop,sack 2 {442681:444109}{431257:441253},mptcp dss ack 3759422505], length 0
10:30:06.354132 IP 112.26.3.8.40113 > 112.26.3.1.46615: Flags [.], ack 425545, win 23712, options [nop,nop,TS val 4294890293 ecr 134377,nop,nop,sack 2 {442681:445537}{431257:441253},mptcp dss ack 3759422505], length 0
10:30:06.394780 IP 112.26.3.1.46615 > 112.26.3.8.40113: Flags [.], seq 425545:426973, ack 1, win 4017, options [nop,nop,TS val 135711 ecr 4294889490,mptcp dss ack 2843715367 seq 3759489621 subseq 425545 len 1428 csum 0xaa74], length 1428
10:30:06.394992 IP 112.26.3.1.46615 > 112.26.3.8.40113: Flags [.], seq 425545:426973, ack 1, win 4017, options [nop,nop,TS val 135711 ecr 4294889490,mptcp dss ack 2843715367 seq 3759489621 subseq 425545 len 1428 csum 0xaa74], length 1428
10:30:06.413496 IP 112.26.3.8.40113 > 112.26.3.1.46615: Flags [.], ack 429829, win 23712, options [nop,nop,TS val 4294890357 ecr 135711,nop,nop,sack 2 {442681:445537}{431257:441253},mptcp dss ack 3759422505], length 0
10:30:06.441491 IP 112.26.3.8.40113 > 112.26.3.1.46615: Flags [.], ack 425545, win 23712, options [nop,nop,TS val 4294890293 ecr 134377,nop,nop,sack 2 {442681:445537}{431257:441253},mptcp dss ack 3759422505], length 0
10:30:06.445684 IP 112.26.3.8.40113 > 112.26.3.1.46615: Flags [.], ack 425545, win 23712, options [nop,nop,TS val 4294890293 ecr 134377,nop,nop,sack 2 {442681:445537}{431257:441253},mptcp dss ack 3759422505], length 0
10:30:06.489117 IP 112.26.3.1.46615 > 112.26.3.8.40113: Flags [.], seq 429829:431257, ack 1, win 4017, options [nop,nop,TS val 135796 ecr 4294889586,mptcp dss ack 2843715367 seq 3759506757 subseq 429829 len 1428 csum 0xa03], length 1428
10:30:06.489334 IP 112.26.3.1.46615 > 112.26.3.8.40113: Flags [.], seq 429829:431257, ack 1, win 4017, options [nop,nop,TS val 135796 ecr 4294889586,mptcp dss ack 2843715367 seq 3759506757 subseq 429829 len 1428 csum 0xa03], length 1428
10:30:06.524893 IP 112.26.3.8.40113 > 112.26.3.1.46615: Flags [.], ack 441253, win 23712, options [nop,nop,TS val 4294890468 ecr 135796,nop,nop,sack 1 {442681:445537},mptcp dss ack 3759422505], length 0
10:30:06.548970 IP 112.26.3.8.40113 > 112.26.3.1.46615: Flags [.], ack 429829, win 23712, options [nop,nop,TS val 4294890357 ecr 135711,nop,nop,sack 2 {442681:445537}{431257:441253},mptcp dss ack 3759422505], length 0
10:30:06.560886 IP 112.26.3.8.40113 > 112.26.3.1.46615: Flags [.], ack 429829, win 23712, options [nop,nop,TS val 4294890357 ecr 135711,nop,nop,sack 2 {442681:445537}{431257:441253},mptcp dss ack 3759422505], length 0
10:30:06.591579 IP 112.26.3.1.46615 > 112.26.3.8.40113: Flags [.], seq 445537:446965, ack 1, win 4017, options [nop,nop,TS val 136116 ecr 4294889887,mptcp dss ack 2843715367 seq 3759566733 subseq 445537 len 1428 csum 0x1dee], length 1428
10:30:06.591772 IP 112.26.3.1.46615 > 112.26.3.8.40113: Flags [.], seq 445537:446965, ack 1, win 4017, options [nop,nop,TS val 136116 ecr 4294889887,mptcp dss ack 2843715367 seq 3759566733 subseq 445537 len 1428 csum 0x1dee], length 1428
10:30:06.619605 IP 112.26.3.8.40113 > 112.26.3.1.46615: Flags [.], ack 441253, win 23712, options [nop,nop,TS val 4294890563 ecr 135796,nop,nop,sack 1 {442681:446965},mptcp dss ack 3759422505], length 0
10:30:06.641515 IP 112.26.3.1.46615 > 112.26.3.8.40113: Flags [P.], seq 446965:448393, ack 1, win 4017, options [nop,nop,TS val 136228 ecr 4294889994,mptcp dss ack 2843715367 seq 3759569589 subseq 446965 len 1428 csum 0x7555], length 1428
10:30:06.641716 IP 112.26.3.1.46615 > 112.26.3.8.40113: Flags [P.], seq 446965:448393, ack 1, win 4017, options [nop,nop,TS val 136228 ecr 4294889994,mptcp dss ack 2843715367 seq 3759569589 subseq 446965 len 1428 csum 0x7555], length 1428
10:30:06.685677 IP 112.26.3.8.40113 > 112.26.3.1.46615: Flags [.], ack 441253, win 23712, options [nop,nop,TS val 4294890468 ecr 135796,nop,nop,sack 1 {442681:445537},mptcp dss ack 3759422505], length 0
10:30:06.687657 IP 112.26.3.8.40113 > 112.26.3.1.46615: Flags [.], ack 441253, win 23712, options [nop,nop,TS val 4294890468 ecr 135796,nop,nop,sack 1 {442681:445537},mptcp dss ack 3759422505], length 0
10:30:06.725041 IP 112.26.3.1.46615 > 112.26.3.8.40113: Flags [.], seq 448393:449821, ack 1, win 4017, options [nop,nop,TS val 136373 ecr 4294890098,mptcp dss ack 2843715367 seq 3759573873 subseq 448393 len 1428 csum 0x3bbb], length 1428
10:30:06.725257 IP 112.26.3.1.46615 > 112.26.3.8.40113: Flags [.], seq 448393:449821, ack 1, win 4017, options [nop,nop,TS val 136373 ecr 4294890098,mptcp dss ack 2843715367 seq 3759573873 subseq 448393 len 1428 csum 0x3bbb], length 1428
10:30:06.742073 IP 112.26.3.8.40113 > 112.26.3.1.46615: Flags [.], ack 441253, win 23712, options [nop,nop,TS val 4294890686 ecr 135796,nop,nop,sack 1 {442681:448393},mptcp dss ack 3759422505], length 0
10:30:06.787116 IP 112.26.3.1.46615 > 112.26.3.8.40113: Flags [.], seq 441253:442681, ack 1, win 4017, options [nop,nop,TS val 136435 ecr 4294890199,mptcp dss ack 2843715367 seq 3759535317 subseq 441253 len 1428 csum 0xbbeb], length 1428
10:30:06.787302 IP 112.26.3.1.46615 > 112.26.3.8.40113: Flags [.], seq 441253:442681, ack 1, win 4017, options [nop,nop,TS val 136435 ecr 4294890199,mptcp dss ack 2843715367 seq 3759535317 subseq 441253 len 1428 csum 0xbbeb], length 1428
10:30:06.805161 IP 112.26.3.8.40113 > 112.26.3.1.46615: Flags [.], ack 441253, win 23712, options [nop,nop,TS val 4294890563 ecr 135796,nop,nop,sack 1 {442681:446965},mptcp dss ack 3759422505], length 0
10:30:06.807285 IP 112.26.3.8.40113 > 112.26.3.1.46615: Flags [.], ack 441253, win 23712, options [nop,nop,TS val 4294890563 ecr 135796,nop,nop,sack 1 {442681:446965},mptcp dss ack 3759422505], length 0
10:30:06.846806 IP 112.26.3.8.40113 > 112.26.3.1.46615: Flags [.], ack 441253, win 23712, options [nop,nop,TS val 4294890686 ecr 135796,nop,nop,sack 1 {442681:448393},mptcp dss ack 3759422505], length 0
10:30:06.869311 IP 112.26.3.8.40113 > 112.26.3.1.46615: Flags [.], ack 441253, win 24099, options [nop,nop,TS val 4294890812 ecr 135796,nop,nop,sack 1 {442681:449821},mptcp dss ack 3759503901], length 0
10:30:06.889471 IP 112.26.3.1.46615 > 112.26.3.8.40113: Flags [.], seq 449821:451249, ack 1, win 4017, options [nop,nop,TS val 136581 ecr 4294890293,mptcp dss ack 2843715367 seq 3759585297 subseq 449821 len 1428 csum 0xf464], length 1428
10:30:06.889672 IP 112.26.3.1.46615 > 112.26.3.8.40113: Flags [.], seq 449821:451249, ack 1, win 4017, options [nop,nop,TS val 136581 ecr 4294890293,mptcp dss ack 2843715367 seq 3759585297 subseq 449821 len 1428 csum 0xf464], length 1428
10:30:06.913533 IP 112.26.3.8.40113 > 112.26.3.1.46615: Flags [.], ack 441253, win 23712, options [nop,nop,TS val 4294890686 ecr 135796,nop,nop,sack 1 {442681:448393},mptcp dss ack 3759422505], length 0
10:30:06.942378 IP 112.26.3.8.40113 > 112.26.3.1.46615: Flags [.], ack 441253, win 24099, options [nop,nop,TS val 4294890812 ecr 135796,nop,nop,sack 1 {442681:449821},mptcp dss ack 3759503901], length 0
10:30:06.968816 IP 112.26.3.8.40113 > 112.26.3.1.46615: Flags [.], ack 449821, win 24099, options [nop,nop,TS val 4294890912 ecr 136435,mptcp dss ack 3759503901], length 0
10:30:06.998421 IP 112.26.3.8.40113 > 112.26.3.1.46615: Flags [.], ack 441253, win 24099, options [nop,nop,TS val 4294890812 ecr 135796,nop,nop,sack 1 {442681:449821},mptcp dss ack 3759503901], length 0
10:30:07.014713 IP 112.26.3.1.46615 > 112.26.3.8.40113: Flags [.], seq 451249:452677, ack 1, win 4017, options [nop,nop,TS val 136679 ecr 4294890357,mptcp dss ack 2843715367 seq 3759592437 subseq 451249 len 1428 csum 0x228a], length 1428
10:30:07.014889 IP 112.26.3.1.46615 > 112.26.3.8.40113: Flags [.], seq 451249:452677, ack 1, win 4017, options [nop,nop,TS val 136679 ecr 4294890357,mptcp dss ack 2843715367 seq 3759592437 subseq 451249 len 1428 csum 0x228a], length 1428
10:30:07.036407 IP 112.26.3.8.40113 > 112.26.3.1.46615: Flags [.], ack 449821, win 24099, options [nop,nop,TS val 4294890912 ecr 136435,mptcp dss ack 3759503901], length 0
10:30:07.104217 IP 112.26.3.8.40113 > 112.26.3.1.46615: Flags [.], ack 451249, win 24099, options [nop,nop,TS val 4294891040 ecr 136581,mptcp dss ack 3759503901], length 0
10:30:07.107335 IP 112.26.3.8.40113 > 112.26.3.1.46615: Flags [.], ack 449821, win 24099, options [nop,nop,TS val 4294890912 ecr 136435,mptcp dss ack 3759503901], length 0
10:30:07.138742 IP 112.26.3.8.40113 > 112.26.3.1.46615: Flags [.], ack 451249, win 24099, options [nop,nop,TS val 4294891040 ecr 136581,mptcp dss ack 3759503901], length 0
10:30:07.163463 IP 112.26.3.1.46615 > 112.26.3.8.40113: Flags [.], seq 452677:454105, ack 1, win 4017, options [nop,nop,TS val 136806 ecr 4294890468,mptcp dss ack 2843715367 seq 3759595293 subseq 452677 len 1428 csum 0xeef1], length 1428
10:30:07.163672 IP 112.26.3.1.46615 > 112.26.3.8.40113: Flags [.], seq 452677:454105, ack 1, win 4017, options [nop,nop,TS val 136806 ecr 4294890468,mptcp dss ack 2843715367 seq 3759595293 subseq 452677 len 1428 csum 0xeef1], length 1428
10:30:07.172087 IP 112.26.3.8.40113 > 112.26.3.1.46615: Flags [.], ack 451249, win 24099, options [nop,nop,TS val 4294891040 ecr 136581,mptcp dss ack 3759503901], length 0
10:30:07.205474 IP 112.26.3.8.40113 > 112.26.3.1.46615: Flags [.], ack 452677, win 24099, options [nop,nop,TS val 4294891149 ecr 136679,mptcp dss ack 3759503901], length 0
10:30:07.258385 IP 112.26.3.8.40113 > 112.26.3.1.46615: Flags [.], ack 452677, win 24099, options [nop,nop,TS val 4294891149 ecr 136679,mptcp dss ack 3759503901], length 0
10:30:07.284825 IP 112.26.3.8.40113 > 112.26.3.1.46615: Flags [.], ack 454105, win 24099, options [nop,nop,TS val 4294891228 ecr 136806,mptcp dss ack 3759503901], length 0
10:30:07.294192 IP 112.26.3.8.40113 > 112.26.3.1.46615: Flags [.], ack 452677, win 24099, options [nop,nop,TS val 4294891149 ecr 136679,mptcp dss ack 3759503901], length 0
10:30:07.337935 IP 112.26.3.1.46615 > 112.26.3.8.40113: Flags [.], seq 454105:455533, ack 1, win 4017, options [nop,nop,TS val 136950 ecr 4294890563,mptcp dss ack 2843715367 seq 3759596721 subseq 454105 len 1428 csum 0x9810], length 1428
10:30:07.338177 IP 112.26.3.1.46615 > 112.26.3.8.40113: Flags [.], seq 454105:455533, ack 1, win 4017, options [nop,nop,TS val 136950 ecr 4294890563,mptcp dss ack 2843715367 seq 3759596721 subseq 454105 len 1428 csum 0x9810], length 1428
10:30:07.349527 IP 112.26.3.8.40113 > 112.26.3.1.46615: Flags [.], ack 454105, win 24099, options [nop,nop,TS val 4294891228 ecr 136806,mptcp dss ack 3759503901], length 0
10:30:07.351713 IP 112.26.3.8.40113 > 112.26.3.1.46615: Flags [.], ack 454105, win 24099, options [nop,nop,TS val 4294891228 ecr 136806,mptcp dss ack 3759503901], length 0
10:30:07.404524 IP 112.26.3.8.40113 > 112.26.3.1.46615: Flags [.], ack 455533, win 23921, options [nop,nop,TS val 4294891347 ecr 136950,mptcp dss ack 3759515325], length 0
10:30:07.436306 IP 112.26.3.8.40113 > 112.26.3.1.46615: Flags [.], ack 455533, win 23921, options [nop,nop,TS val 4294891347 ecr 136950,mptcp dss ack 3759515325], length 0
10:30:07.461837 IP 112.26.3.1.46615 > 112.26.3.8.40113: Flags [.], seq 455533:456961, ack 1, win 4017, options [nop,nop,TS val 137066 ecr 4294890686,mptcp dss ack 2843715367 seq 3759601005 subseq 455533 len 1428 csum 0x28f2], length 1428
10:30:07.462058 IP 112.26.3.1.46615 > 112.26.3.8.40113: Flags [.], seq 455533:456961, ack 1, win 4017, options [nop,nop,TS val 137066 ecr 4294890686,mptcp dss ack 2843715367 seq 3759601005 subseq 455533 len 1428 csum 0x28f2], length 1428
10:30:07.489349 IP 112.26.3.8.40113 > 112.26.3.1.46615: Flags [.], ack 455533, win 23921, options [nop,nop,TS val 4294891347 ecr 136950,mptcp dss ack 3759515325], length 0
10:30:07.516563 IP 112.26.3.1.46615 > 112.26.3.8.40113: Flags [.], seq 456961:458389, ack 1, win 4017, options [nop,nop,TS val 137180 ecr 4294890812,mptcp dss ack 2843715367 seq 3759603861 subseq 456961 len 1428 csum 0xc49b], length 1428
10:30:07.516750 IP 112.26.3.1.46615 > 112.26.3.8.40113: Flags [.], seq 456961:458389, ack 1, win 4017, options [nop,nop,TS val 137180 ecr 4294890812,mptcp dss ack 2843715367 seq 3759603861 subseq 456961 len 1428 csum 0xc49b], length 1428
10:30:07.562899 IP 112.26.3.8.40113 > 112.26.3.1.46615: Flags [.], ack 456961, win 23921, options [nop,nop,TS val 4294891408 ecr 137066,mptcp dss ack 3759515325], length 0
10:30:07.564707 IP 112.26.3.8.40113 > 112.26.3.1.46615: Flags [.], ack 456961, win 23921, options [nop,nop,TS val 4294891408 ecr 137066,mptcp dss ack 3759515325], length 0
10:30:07.578963 IP 112.26.3.8.40113 > 112.26.3.1.46615: Flags [.], ack 458389, win 23921, options [nop,nop,TS val 4294891475 ecr 137180,mptcp dss ack 3759515325], length 0
10:30:07.601173 IP 112.26.3.1.46615 > 112.26.3.8.40113: Flags [.], seq 458389:459817, ack 1, win 4017, options [nop,nop,TS val 137217 ecr 4294890912,mptcp dss ack 2843715367 seq 3759605289 subseq 458389 len 1428 csum 0xff7b], length 1428
10:30:07.601378 IP 112.26.3.1.46615 > 112.26.3.8.40113: Flags [.], seq 458389:459817, ack 1, win 4017, options [nop,nop,TS val 137217 ecr 4294890912,mptcp dss ack 2843715367 seq 3759605289 subseq 458389 len 1428 csum 0xff7b], length 1428
10:30:07.623634 IP 112.26.3.8.40113 > 112.26.3.1.46615: Flags [.], ack 456961, win 23921, options [nop,nop,TS val 4294891408 ecr 137066,mptcp dss ack 3759515325], length 0
10:30:07.644879 IP 112.26.3.8.40113 > 112.26.3.1.46615: Flags [.], ack 459817, win 23921, options [nop,nop,TS val 4294891588 ecr 137217,mptcp dss ack 3759515325], length 0
10:30:07.657965 IP 112.26.3.1.46615 > 112.26.3.8.40113: Flags [.], seq 459817:461245, ack 1, win 4017, options [nop,nop,TS val 137217 ecr 4294890912,mptcp dss ack 2843715367 seq 3759606717 subseq 459817 len 1428 csum 0xb3eb], length 1428
10:30:07.658196 IP 112.26.3.1.46615 > 112.26.3.8.40113: Flags [.], seq 459817:461245, ack 1, win 4017, options [nop,nop,TS val 137217 ecr 4294890912,mptcp dss ack 2843715367 seq 3759606717 subseq 459817 len 1428 csum 0xb3eb], length 1428
10:30:07.666559 IP 112.26.3.8.40113 > 112.26.3.1.46615: Flags [.], ack 458389, win 23921, options [nop,nop,TS val 4294891475 ecr 137180,mptcp dss ack 3759515325], length 0
10:30:07.722582 IP 112.26.3.8.40113 > 112.26.3.1.46615: Flags [.], ack 458389, win 23921, options [nop,nop,TS val 4294891475 ecr 137180,mptcp dss ack 3759515325], length 0
10:30:07.748188 IP 112.26.3.1.46615 > 112.26.3.8.40113: Flags [.], seq 461245:462673, ack 1, win 4017, options [nop,nop,TS val 137290 ecr 4294891040,mptcp dss ack 2843715367 seq 3759609573 subseq 461245 len 1428 csum 0x8cdf], length 1428
10:30:07.748415 IP 112.26.3.1.46615 > 112.26.3.8.40113: Flags [.], seq 461245:462673, ack 1, win 4017, options [nop,nop,TS val 137290 ecr 4294891040,mptcp dss ack 2843715367 seq 3759609573 subseq 461245 len 1428 csum 0x8cdf], length 1428
10:30:07.758171 IP 112.26.3.8.40113 > 112.26.3.1.46615: Flags [.], ack 461245, win 23921, options [nop,nop,TS val 4294891701 ecr 137217,mptcp dss ack 3759515325], length 0
10:30:07.773991 IP 112.26.3.8.40113 > 112.26.3.1.46615: Flags [.], ack 459817, win 23921, options [nop,nop,TS val 4294891588 ecr 137217,mptcp dss ack 3759515325], length 0
10:30:07.828675 IP 112.26.3.8.40113 > 112.26.3.1.46615: Flags [.], ack 459817, win 23921, options [nop,nop,TS val 4294891588 ecr 137217,mptcp dss ack 3759515325], length 0
10:30:07.835302 IP 112.26.3.1.46615 > 112.26.3.8.40113: Flags [.], seq 462673:464101, ack 1, win 4017, options [nop,nop,TS val 137412 ecr 4294891149,mptcp dss ack 2843715367 seq 3759612429 subseq 462673 len 1428 csum 0x571f], length 1428
10:30:07.835514 IP 112.26.3.1.46615 > 112.26.3.8.40113: Flags [.], seq 462673:464101, ack 1, win 4017, options [nop,nop,TS val 137412 ecr 4294891149,mptcp dss ack 2843715367 seq 3759612429 subseq 462673 len 1428 csum 0x571f], length 1428
10:30:07.848536 IP 112.26.3.8.40113 > 112.26.3.1.46615: Flags [.], ack 461245, win 23921, options [nop,nop,TS val 4294891701 ecr 137217,mptcp dss ack 3759515325], length 0
10:30:07.863411 IP 112.26.3.8.40113 > 112.26.3.1.46615: Flags [.], ack 462673, win 23921, options [nop,nop,TS val 4294891807 ecr 137290,mptcp dss ack 3759515325], length 0
10:30:07.925807 IP 112.26.3.8.40113 > 112.26.3.1.46615: Flags [.], ack 461245, win 23921, options [nop,nop,TS val 4294891701 ecr 137217,mptcp dss ack 3759515325], length 0
10:30:07.940565 IP 112.26.3.1.46615 > 112.26.3.8.40113: Flags [.], seq 464101:465529, ack 1, win 4017, options [nop,nop,TS val 137470 ecr 4294891228,mptcp dss ack 2843715367 seq 3759615285 subseq 464101 len 1428 csum 0xb40e], length 1428
10:30:07.940767 IP 112.26.3.1.46615 > 112.26.3.8.40113: Flags [.], seq 464101:465529, ack 1, win 4017, options [nop,nop,TS val 137470 ecr 4294891228,mptcp dss ack 2843715367 seq 3759615285 subseq 464101 len 1428 csum 0xb40e], length 1428
10:30:07.970919 IP 112.26.3.8.40113 > 112.26.3.1.46615: Flags [.], ack 464101, win 23921, options [nop,nop,TS val 4294891914 ecr 137412,mptcp dss ack 3759515325], length 0
10:30:07.998167 IP 112.26.3.8.40113 > 112.26.3.1.46615: Flags [.], ack 462673, win 23921, options [nop,nop,TS val 4294891807 ecr 137290,mptcp dss ack 3759515325], length 0
10:30:08.042108 IP 112.26.3.1.46615 > 112.26.3.8.40113: Flags [.], seq 465529:466957, ack 1, win 4017, options [nop,nop,TS val 137470 ecr 4294891228,mptcp dss ack 2843715367 seq 3759616713 subseq 465529 len 1428 csum 0xa4a3], length 1428
10:30:08.042289 IP 112.26.3.1.46615 > 112.26.3.8.40113: Flags [.], seq 465529:466957, ack 1, win 4017, options [nop,nop,TS val 137470 ecr 4294891228,mptcp dss ack 2843715367 seq 3759616713 subseq 465529 len 1428 csum 0xa4a3], length 1428
10:30:08.059350 IP 112.26.3.8.40113 > 112.26.3.1.46615: Flags [.], ack 465529, win 23921, options [nop,nop,TS val 4294892002 ecr 137470,mptcp dss ack 3759515325], length 0
10:30:08.066312 IP 112.26.3.8.40113 > 112.26.3.1.46615: Flags [.], ack 462673, win 23921, options [nop,nop,TS val 4294891807 ecr 137290,mptcp dss ack 3759515325], length 0
10:30:08.101635 IP 112.26.3.8.40113 > 112.26.3.1.46615: Flags [.], ack 464101, win 23921, options [nop,nop,TS val 4294891914 ecr 137412,mptcp dss ack 3759515325], length 0
10:30:08.160325 IP 112.26.3.8.40113 > 112.26.3.1.46615: Flags [.], ack 466957, win 23921, options [nop,nop,TS val 4294892061 ecr 137470,mptcp dss ack 3759515325], length 0
10:30:08.163903 IP 112.26.3.8.40113 > 112.26.3.1.46615: Flags [.], ack 465529, win 23921, options [nop,nop,TS val 4294892002 ecr 137470,mptcp dss ack 3759515325], length 0
10:30:08.181924 IP 112.26.3.1.46615 > 112.26.3.8.40113: Flags [.], seq 466957:468385, ack 1, win 4017, options [nop,nop,TS val 137608 ecr 4294891347,mptcp dss ack 2843715367 seq 3759633849 subseq 466957 len 1428 csum 0x897], length 1428
10:30:08.182134 IP 112.26.3.1.46615 > 112.26.3.8.40113: Flags [.], seq 466957:468385, ack 1, win 4017, options [nop,nop,TS val 137608 ecr 4294891347,mptcp dss ack 2843715367 seq 3759633849 subseq 466957 len 1428 csum 0x897], length 1428
10:30:08.235021 IP 112.26.3.8.40113 > 112.26.3.1.46615: Flags [.], ack 468385, win 23921, options [nop,nop,TS val 4294892149 ecr 137608,mptcp dss ack 3759515325], length 0
10:30:08.249849 IP 112.26.3.8.40113 > 112.26.3.1.46615: Flags [.], ack 464101, win 23921, options [nop,nop,TS val 4294891914 ecr 137412,mptcp dss ack 3759515325], length 0
10:30:08.273362 IP 112.26.3.1.46615 > 112.26.3.8.40113: Flags [.], seq 468385:469813, ack 1, win 4017, options [nop,nop,TS val 137742 ecr 4294891408,mptcp dss ack 2843715367 seq 3759646701 subseq 468385 len 1428 csum 0xf027], length 1428
10:30:08.273591 IP 112.26.3.1.46615 > 112.26.3.8.40113: Flags [.], seq 468385:469813, ack 1, win 4017, options [nop,nop,TS val 137742 ecr 4294891408,mptcp dss ack 2843715367 seq 3759646701 subseq 468385 len 1428 csum 0xf027], length 1428
10:30:08.278722 IP 112.26.3.8.40113 > 112.26.3.1.46615: Flags [.], ack 466957, win 23921, options [nop,nop,TS val 4294892061 ecr 137470,mptcp dss ack 3759515325], length 0
10:30:08.317533 IP 112.26.3.8.40113 > 112.26.3.1.46615: Flags [.], ack 469813, win 23921, options [nop,nop,TS val 4294892261 ecr 137742,mptcp dss ack 3759515325], length 0
10:30:08.354340 IP 112.26.3.8.40113 > 112.26.3.1.46615: Flags [.], ack 465529, win 23921, options [nop,nop,TS val 4294892002 ecr 137470,mptcp dss ack 3759515325], length 0
10:30:08.366311 IP 112.26.3.1.46615 > 112.26.3.8.40113: Flags [.], seq 469813:471241, ack 1, win 4017, options [nop,nop,TS val 137841 ecr 4294891475,mptcp dss ack 2843715367 seq 3759649557 subseq 469813 len 1428 csum 0xf82b], length 1428
10:30:08.366518 IP 112.26.3.1.46615 > 112.26.3.8.40113: Flags [.], seq 469813:471241, ack 1, win 4017, options [nop,nop,TS val 137841 ecr 4294891475,mptcp dss ack 2843715367 seq 3759649557 subseq 469813 len 1428 csum 0xf82b], length 1428
10:30:08.390132 IP 112.26.3.8.40113 > 112.26.3.1.46615: Flags [.], ack 468385, win 23921, options [nop,nop,TS val 4294892149 ecr 137608,mptcp dss ack 3759515325], length 0
10:30:08.453876 IP 112.26.3.8.40113 > 112.26.3.1.46615: Flags [.], ack 469813, win 23921, options [nop,nop,TS val 4294892261 ecr 137742,mptcp dss ack 3759515325], length 0
10:30:08.458946 IP 112.26.3.8.40113 > 112.26.3.1.46615: Flags [.], ack 471241, win 23921, options [nop,nop,TS val 4294892399 ecr 137841,mptcp dss ack 3759515325], length 0
10:30:08.476617 IP 112.26.3.1.46615 > 112.26.3.8.40113: Flags [.], seq 471241:472669, ack 1, win 4017, options [nop,nop,TS val 137947 ecr 4294891588,mptcp dss ack 2843715367 seq 3759650985 subseq 471241 len 1428 csum 0x8985], length 1428
10:30:08.476832 IP 112.26.3.1.46615 > 112.26.3.8.40113: Flags [.], seq 471241:472669, ack 1, win 4017, options [nop,nop,TS val 137947 ecr 4294891588,mptcp dss ack 2843715367 seq 3759650985 subseq 471241 len 1428 csum 0x8985], length 1428
10:30:08.523013 IP 112.26.3.8.40113 > 112.26.3.1.46615: Flags [.], ack 466957, win 23921, options [nop,nop,TS val 4294892061 ecr 137470,mptcp dss ack 3759515325], length 0
10:30:08.566441 IP 112.26.3.8.40113 > 112.26.3.1.46615: Flags [.], ack 471241, win 23921, options [nop,nop,TS val 4294892399 ecr 137841,mptcp dss ack 3759515325], length 0
10:30:08.582477 IP 112.26.3.1.46615 > 112.26.3.8.40113: Flags [.], seq 472669:474097, ack 1, win 4017, options [nop,nop,TS val 137947 ecr 4294891588,mptcp dss ack 2843715367 seq 3759652413 subseq 472669 len 1428 csum 0xfa2e], length 1428
10:30:08.582664 IP 112.26.3.1.46615 > 112.26.3.8.40113: Flags [.], seq 472669:474097, ack 1, win 4017, options [nop,nop,TS val 137947 ecr 4294891588,mptcp dss ack 2843715367 seq 3759652413 subseq 472669 len 1428 csum 0xfa2e], length 1428
10:30:08.589862 IP 112.26.3.8.40113 > 112.26.3.1.46615: Flags [.], ack 474097, win 23921, options [nop,nop,TS val 4294892530 ecr 137947,mptcp dss ack 3759515325], length 0
10:30:08.633720 IP 112.26.3.8.40113 > 112.26.3.1.46615: Flags [.], ack 468385, win 23921, options [nop,nop,TS val 4294892149 ecr 137608,mptcp dss ack 3759515325], length 0
10:30:08.660112 IP 112.26.3.8.40113 > 112.26.3.1.46615: Flags [.], ack 474097, win 23921, options [nop,nop,TS val 4294892530 ecr 137947,mptcp dss ack 3759515325], length 0
10:30:08.694706 IP 112.26.3.1.46615 > 112.26.3.8.40113: Flags [.], seq 474097:475525, ack 1, win 4017, options [nop,nop,TS val 138044 ecr 4294891701,mptcp dss ack 2843715367 seq 3759656697 subseq 474097 len 1428 csum 0x9bb5], length 1428
10:30:08.694921 IP 112.26.3.1.46615 > 112.26.3.8.40113: Flags [.], seq 474097:475525, ack 1, win 4017, options [nop,nop,TS val 138044 ecr 4294891701,mptcp dss ack 2843715367 seq 3759656697 subseq 474097 len 1428 csum 0x9bb5], length 1428
10:30:08.712631 IP 112.26.3.8.40113 > 112.26.3.1.46615: Flags [.], ack 469813, win 23921, options [nop,nop,TS val 4294892261 ecr 137742,mptcp dss ack 3759515325], length 0
10:30:08.757945 IP 112.26.3.1.46615 > 112.26.3.8.40113: Flags [.], seq 475525:476953, ack 1, win 4017, options [nop,nop,TS val 138184 ecr 4294891807,mptcp dss ack 2843715367 seq 3759663837 subseq 475525 len 1428 csum 0xbc7d], length 1428
10:30:08.758166 IP 112.26.3.1.46615 > 112.26.3.8.40113: Flags [.], seq 475525:476953, ack 1, win 4017, options [nop,nop,TS val 138184 ecr 4294891807,mptcp dss ack 2843715367 seq 3759663837 subseq 475525 len 1428 csum 0xbc7d], length 1428
10:30:08.778085 IP 112.26.3.8.40113 > 112.26.3.1.46615: Flags [.], ack 476953, win 23921, options [nop,nop,TS val 4294892717 ecr 138044,mptcp dss ack 3759515325], length 0
10:30:08.781095 IP 112.26.3.8.40113 > 112.26.3.1.46615: Flags [.], ack 476953, win 23921, options [nop,nop,TS val 4294892717 ecr 138044,mptcp dss ack 3759515325], length 0
10:30:08.798720 IP 112.26.3.1.46615 > 112.26.3.8.40113: Flags [.], seq 476953:478381, ack 1, win 4017, options [nop,nop,TS val 138368 ecr 4294891914,mptcp dss ack 2843715367 seq 3759666693 subseq 476953 len 1428 csum 0x684e], length 1428
10:30:08.798865 IP 112.26.3.1.46615 > 112.26.3.8.40113: Flags [.], seq 476953:478381, ack 1, win 4017, options [nop,nop,TS val 138368 ecr 4294891914,mptcp dss ack 2843715367 seq 3759666693 subseq 476953 len 1428 csum 0x684e], length 1428
10:30:08.828045 IP 112.26.3.8.40113 > 112.26.3.1.46615: Flags [.], ack 471241, win 23921, options [nop,nop,TS val 4294892399 ecr 137841,mptcp dss ack 3759515325], length 0
10:30:08.896503 IP 112.26.3.1.46615 > 112.26.3.8.40113: Flags [.], seq 478381:479809, ack 1, win 4017, options [nop,nop,TS val 138472 ecr 4294892002,mptcp dss ack 2843715367 seq 3759668121 subseq 478381 len 1428 csum 0xa0ef], length 1428
10:30:08.896694 IP 112.26.3.1.46615 > 112.26.3.8.40113: Flags [.], seq 478381:479809, ack 1, win 4017, options [nop,nop,TS val 138472 ecr 4294892002,mptcp dss ack 2843715367 seq 3759668121 subseq 478381 len 1428 csum 0xa0ef], length 1428
10:30:08.910589 IP 112.26.3.8.40113 > 112.26.3.1.46615: Flags [.], ack 474097, win 23921, options [nop,nop,TS val 4294892530 ecr 137947,mptcp dss ack 3759515325], length 0
10:30:08.960218 IP 112.26.3.1.46615 > 112.26.3.8.40113: Flags [.], seq 479809:481237, ack 1, win 4017, options [nop,nop,TS val 138472 ecr 4294892002,mptcp dss ack 2843715367 seq 3759669549 subseq 479809 len 1428 csum 0x8dc5], length 1428
10:30:08.960399 IP 112.26.3.1.46615 > 112.26.3.8.40113: Flags [.], seq 479809:481237, ack 1, win 4017, options [nop,nop,TS val 138472 ecr 4294892002,mptcp dss ack 2843715367 seq 3759669549 subseq 479809 len 1428 csum 0x8dc5], length 1428
