10:17:24.039266 IP 112.26.3.8.34701 > 112.26.3.1.43445: Flags [S], seq 1370810105, win 65535, options [mss 1460,sackOK,TS val 4294872456 ecr 0,nop,wscale 6,mptcp join id 5 token 0x1271d1f5 nonce 0x25c1fb65], length 0
10:17:24.077045 IP 112.26.3.1.43445 > 112.26.3.8.34701: Flags [S.], seq 3026531369, ack 1370810106, win 65535, options [mss 1460,sackOK,TS val 118416 ecr 4294872456,nop,wscale 6,mptcp join id 5 hmac 0xd0dcf5de2e2332d4 nonce 0xa09f8924], length 0
10:17:24.168599 IP 112.26.3.1.43445 > 112.26.3.8.34701: Flags [S.], seq 3026531369, ack 1370810106, win 65535, options [mss 1460,sackOK,TS val 118416 ecr 4294872456,nop,wscale 6,mptcp join id 5 hmac 0xd0dcf5de2e2332d4 nonce 0xa09f8924], length 0
10:17:24.309051 IP 112.26.3.8.34701 > 112.26.3.1.43445: Flags [.], ack 1, win 7848, options [nop,nop,TS val 4294872867 ecr 118416,mptcp join hmac 0x791756dfc3e442c8c54dbd511ad3c1190c151802], length 0
10:17:24.309408 IP 112.26.3.1.43445 > 112.26.3.8.34701: Flags [.], ack 1, win 4017, options [nop,nop,TS val 118685 ecr 4294872867,mptcp dss ack 1720219151], length 0
10:17:24.309729 IP 112.26.3.1.43445 > 112.26.3.8.34701: Flags [.], seq 1:1429, ack 1, win 4017, options [nop,nop,TS val 118686 ecr 4294872867,mptcp dss ack 1720219151 seq 3866561295 subseq 1 len 1428 csum 0x9fd8], length 1428
10:17:24.309796 IP 112.26.3.1.43445 > 112.26.3.8.34701: Flags [.], seq 1429:2857, ack 1, win 4017, options [nop,nop,TS val 118686 ecr 4294872867,mptcp dss ack 1720219151 seq 3866562723 subseq 1429 len 1428 csum 0xe045], length 1428
10:18:04.105997 IP 112.26.3.8.34701 > 112.26.3.1.43445: Flags [.], ack 539785, win 24231, options [nop,nop,TS val 4294912302 ecr 157399,mptcp dss ack 3868160655], length 0
10:18:04.106323 IP 112.26.3.1.43445 > 112.26.3.8.34701: Flags [.], seq 552637:554065, ack 1, win 4017, options [nop,nop,TS val 158482 ecr 4294912302,mptcp dss ack 1720219151 seq 3868316307 subseq 552637 len 1428 csum 0x8dca], length 1428
10:18:04.106363 IP 112.26.3.1.43445 > 112.26.3.8.34701: Flags [.], seq 554065:555493, ack 1, win 4017, options [nop,nop,TS val 158482 ecr 4294912302,mptcp dss ack 1720219151 seq 3868317735 subseq 554065 len 1428 csum 0xd5f3], length 1428
10:18:04.205143 IP 112.26.3.1.43445 > 112.26.3.8.34701: Flags [.], seq 549781:551209, ack 1, win 4017, options [nop,nop,TS val 158262 ecr 4294912137,mptcp dss ack 1720219151 seq 3868309167 subseq 549781 len 1428 csum 0xfe62], length 1428
10:18:04.243117 IP 112.26.3.8.34701 > 112.26.3.1.43445: Flags [.], ack 541213, win 24231, options [nop,nop,TS val 4294912462 ecr 157517,mptcp dss ack 3868160655], length 0
10:18:04.243440 IP 112.26.3.1.43445 > 112.26.3.8.34701: Flags [.], seq 555493:556921, ack 1, win 4017, options [nop,nop,TS val 158619 ecr 4294912462,mptcp dss ack 1720219151 seq 3868332015 subseq 555493 len 1428 csum 0xb2c5], length 1428
10:18:04.278223 IP 112.26.3.1.43445 > 112.26.3.8.34701: Flags [.], seq 551209:552637, ack 1, win 4017, options [nop,nop,TS val 158397 ecr 4294912211,mptcp dss ack 1720219151 seq 3868312023 subseq 551209 len 1428 csum 0xf605], length 1428
10:18:04.300636 IP 112.26.3.8.34701 > 112.26.3.1.43445: Flags [.], ack 544069, win 24231, options [nop,nop,TS val 4294912576 ecr 157597,mptcp dss ack 3868160655], length 0
10:18:04.300865 IP 112.26.3.1.43445 > 112.26.3.8.34701: Flags [.], seq 556921:558349, ack 1, win 4017, options [nop,nop,TS val 158677 ecr 4294912576,mptcp dss ack 1720219151 seq 3868333443 subseq 556921 len 1428 csum 0x7333], length 1428
10:18:04.300912 IP 112.26.3.1.43445 > 112.26.3.8.34701: Flags [.], seq 558349:559777, ack 1, win 4017, options [nop,nop,TS val 158677 ecr 4294912576,mptcp dss ack 1720219151 seq 3868334871 subseq 558349 len 1428 csum 0xb06], length 1428
10:18:04.382069 IP 112.26.3.1.43445 > 112.26.3.8.34701: Flags [.], seq 552637:554065, ack 1, win 4017, options [nop,nop,TS val 158482 ecr 4294912302,mptcp dss ack 1720219151 seq 3868316307 subseq 552637 len 1428 csum 0x8dca], length 1428
10:18:04.387391 IP 112.26.3.8.34701 > 112.26.3.1.43445: Flags [.], ack 546925, win 24231, options [nop,nop,TS val 4294912784 ecr 157823,mptcp dss ack 3868160655], length 0
10:18:04.387591 IP 112.26.3.1.43445 > 112.26.3.8.34701: Flags [.], seq 559777:561205, ack 1, win 4017, options [nop,nop,TS val 158764 ecr 4294912784,mptcp dss ack 1720219151 seq 3868336299 subseq 559777 len 1428 csum 0x6034], length 1428
10:18:04.387638 IP 112.26.3.1.43445 > 112.26.3.8.34701: Flags [.], seq 561205:562633, ack 1, win 4017, options [nop,nop,TS val 158764 ecr 4294912784,mptcp dss ack 1720219151 seq 3868337727 subseq 561205 len 1428 csum 0x99f5], length 1428
10:18:04.455023 IP 112.26.3.1.43445 > 112.26.3.8.34701: Flags [.], seq 554065:555493, ack 1, win 4017, options [nop,nop,TS val 158482 ecr 4294912302,mptcp dss ack 1720219151 seq 3868317735 subseq 554065 len 1428 csum 0xd5f3], length 1428
10:18:04.497345 IP 112.26.3.8.34701 > 112.26.3.1.43445: Flags [.], ack 551209, win 24231, options [nop,nop,TS val 4294913016 ecr 158060,mptcp dss ack 3868160655], length 0
10:18:04.497598 IP 112.26.3.1.43445 > 112.26.3.8.34701: Flags [.], seq 562633:564061, ack 1, win 4017, options [nop,nop,TS val 158874 ecr 4294913016,mptcp dss ack 1720219151 seq 3868257759 subseq 562633 len 1428 csum 0xbd01], length 1428
10:18:04.497644 IP 112.26.3.1.43445 > 112.26.3.8.34701: Flags [.], seq 564061:565489, ack 1, win 4017, options [nop,nop,TS val 158874 ecr 4294913016,mptcp dss ack 1720219151 seq 3868259187 subseq 564061 len 1428 csum 0xcd44], length 1428
10:18:04.497744 IP 112.26.3.1.43445 > 112.26.3.8.34701: Flags [.], seq 565489:566917, ack 1, win 4017, options [nop,nop,TS val 158874 ecr 4294913016,mptcp dss ack 1720219151 seq 3868263471 subseq 565489 len 1428 csum 0xede2], length 1428
10:18:04.555682 IP 112.26.3.1.43445 > 112.26.3.8.34701: Flags [.], seq 555493:556921, ack 1, win 4017, options [nop,nop,TS val 158619 ecr 4294912462,mptcp dss ack 1720219151 seq 3868332015 subseq 555493 len 1428 csum 0xb2c5], length 1428
10:18:04.664156 IP 112.26.3.8.34701 > 112.26.3.1.43445: Flags [.], ack 556921, win 24231, options [nop,nop,TS val 4294913305 ecr 158397,mptcp dss ack 3868160655], length 0
10:18:04.664381 IP 112.26.3.1.43445 > 112.26.3.8.34701: Flags [.], seq 566917:568345, ack 1, win 4017, options [nop,nop,TS val 159040 ecr 4294913305,mptcp dss ack 1720219151 seq 3868310595 subseq 566917 len 1428 csum 0x2020], length 1428
10:18:04.664427 IP 112.26.3.1.43445 > 112.26.3.8.34701: Flags [.], seq 568345:569773, ack 1, win 4017, options [nop,nop,TS val 159040 ecr 4294913305,mptcp dss ack 1720219151 seq 3868314879 subseq 568345 len 1428 csum 0x79d6], length 1428
10:18:04.664523 IP 112.26.3.1.43445 > 112.26.3.8.34701: Flags [.], seq 569773:571201, ack 1, win 4017, options [nop,nop,TS val 159040 ecr 4294913305,mptcp dss ack 1720219151 seq 3868330587 subseq 569773 len 1428 csum 0x1550], length 1428
10:18:04.664600 IP 112.26.3.1.43445 > 112.26.3.8.34701: Flags [.], seq 571201:572629, ack 1, win 4017, options [nop,nop,TS val 159040 ecr 4294913305,mptcp dss ack 1720219151 seq 3868339155 subseq 571201 len 1428 csum 0xcdf1], length 1428
10:18:04.686042 IP 112.26.3.1.43445 > 112.26.3.8.34701: Flags [.], seq 556921:558349, ack 1, win 4017, options [nop,nop,TS val 158677 ecr 4294912576,mptcp dss ack 1720219151 seq 3868333443 subseq 556921 len 1428 csum 0x7333], length 1428
10:18:04.807615 IP 112.26.3.1.43445 > 112.26.3.8.34701: Flags [.], seq 558349:559777, ack 1, win 4017, options [nop,nop,TS val 158677 ecr 4294912576,mptcp dss ack 1720219151 seq 3868334871 subseq 558349 len 1428 csum 0xb06], length 1428
10:18:04.857815 IP 112.26.3.8.34701 > 112.26.3.1.43445: Flags [.], ack 559777, win 24209, options [nop,nop,TS val 4294913508 ecr 158677,mptcp dss ack 3868162083], length 0
10:18:04.858052 IP 112.26.3.1.43445 > 112.26.3.8.34701: Flags [.], seq 572629:574057, ack 1, win 4017, options [nop,nop,TS val 159234 ecr 4294913508,mptcp dss ack 1720219151 seq 3868340583 subseq 572629 len 1428 csum 0xae3e], length 1428
10:18:04.858120 IP 112.26.3.1.43445 > 112.26.3.8.34701: Flags [.], seq 574057:575485, ack 1, win 4017, options [nop,nop,TS val 159234 ecr 4294913508,mptcp dss ack 1720219151 seq 3868342011 subseq 574057 len 1428 csum 0x3c25], length 1428
10:18:04.893498 IP 112.26.3.1.43445 > 112.26.3.8.34701: Flags [.], seq 559777:561205, ack 1, win 4017, options [nop,nop,TS val 158764 ecr 4294912784,mptcp dss ack 1720219151 seq 3868336299 subseq 559777 len 1428 csum 0x6034], length 1428
10:18:04.978997 IP 112.26.3.1.43445 > 112.26.3.8.34701: Flags [.], seq 561205:562633, ack 1, win 4017, options [nop,nop,TS val 158764 ecr 4294912784,mptcp dss ack 1720219151 seq 3868337727 subseq 561205 len 1428 csum 0x99f5], length 1428
10:18:05.079430 IP 112.26.3.8.34701 > 112.26.3.1.43445: Flags [.], ack 562633, win 24209, options [nop,nop,TS val 4294913728 ecr 158764,mptcp dss ack 3868162083], length 0
10:18:05.079666 IP 112.26.3.1.43445 > 112.26.3.8.34701: Flags [.], seq 575485:576913, ack 1, win 4017, options [nop,nop,TS val 159456 ecr 4294913728,mptcp dss ack 1720219151 seq 3868352007 subseq 575485 len 1428 csum 0x35d3], length 1428
10:18:05.079711 IP 112.26.3.1.43445 > 112.26.3.8.34701: Flags [.], seq 576913:578341, ack 1, win 4017, options [nop,nop,TS val 159456 ecr 4294913728,mptcp dss ack 1720219151 seq 3868353435 subseq 576913 len 1428 csum 0x4225], length 1428
10:18:05.116054 IP 112.26.3.1.43445 > 112.26.3.8.34701: Flags [.], seq 562633:564061, ack 1, win 4017, options [nop,nop,TS val 158874 ecr 4294913016,mptcp dss ack 1720219151 seq 3868257759 subseq 562633 len 1428 csum 0xbd01], length 1428
10:18:05.184517 IP 112.26.3.1.43445 > 112.26.3.8.34701: Flags [.], seq 564061:565489, ack 1, win 4017, options [nop,nop,TS val 158874 ecr 4294913016,mptcp dss ack 1720219151 seq 3868259187 subseq 564061 len 1428 csum 0xcd44], length 1428
10:18:05.299907 IP 112.26.3.1.43445 > 112.26.3.8.34701: Flags [.], seq 565489:566917, ack 1, win 4017, options [nop,nop,TS val 158874 ecr 4294913016,mptcp dss ack 1720219151 seq 3868263471 subseq 565489 len 1428 csum 0xede2], length 1428
10:18:05.397337 IP 112.26.3.1.43445 > 112.26.3.8.34701: Flags [.], seq 566917:568345, ack 1, win 4017, options [nop,nop,TS val 159040 ecr 4294913305,mptcp dss ack 1720219151 seq 3868310595 subseq 566917 len 1428 csum 0x2020], length 1428
10:18:05.416350 IP 112.26.3.8.34701 > 112.26.3.1.43445: Flags [.], ack 568345, win 24209, options [nop,nop,TS val 4294914056 ecr 158874,mptcp dss ack 3868162083], length 0
10:18:05.416645 IP 112.26.3.1.43445 > 112.26.3.8.34701: Flags [.], seq 578341:579769, ack 1, win 4017, options [nop,nop,TS val 159793 ecr 4294914056,mptcp dss ack 1720219151 seq 3868364859 subseq 578341 len 1428 csum 0xabfd], length 1428
10:18:05.416685 IP 112.26.3.1.43445 > 112.26.3.8.34701: Flags [.], seq 579769:581197, ack 1, win 4017, options [nop,nop,TS val 159793 ecr 4294914056,mptcp dss ack 1720219151 seq 3868366287 subseq 579769 len 1428 csum 0x7cc4], length 1428
10:18:05.416788 IP 112.26.3.1.43445 > 112.26.3.8.34701: Flags [.], seq 581197:582625, ack 1, win 4017, options [nop,nop,TS val 159793 ecr 4294914056,mptcp dss ack 1720219151 seq 3868367715 subseq 581197 len 1428 csum 0x4f63], length 1428
10:18:05.416851 IP 112.26.3.1.43445 > 112.26.3.8.34701: Flags [.], seq 582625:584053, ack 1, win 4017, options [nop,nop,TS val 159793 ecr 4294914056,mptcp dss ack 1720219151 seq 3868369143 subseq 582625 len 1428 csum 0x8c71], length 1428
10:18:05.465946 IP 112.26.3.1.43445 > 112.26.3.8.34701: Flags [.], seq 568345:569773, ack 1, win 4017, options [nop,nop,TS val 159040 ecr 4294913305,mptcp dss ack 1720219151 seq 3868314879 subseq 568345 len 1428 csum 0x79d6], length 1428
10:18:05.591655 IP 112.26.3.1.43445 > 112.26.3.8.34701: Flags [.], seq 569773:571201, ack 1, win 4017, options [nop,nop,TS val 159040 ecr 4294913305,mptcp dss ack 1720219151 seq 3868330587 subseq 569773 len 1428 csum 0x1550], length 1428
10:18:05.692541 IP 112.26.3.1.43445 > 112.26.3.8.34701: Flags [.], seq 571201:572629, ack 1, win 4017, options [nop,nop,TS val 159040 ecr 4294913305,mptcp dss ack 1720219151 seq 3868339155 subseq 571201 len 1428 csum 0xcdf1], length 1428
10:18:05.725410 IP 112.26.3.8.34701 > 112.26.3.1.43445: Flags [.], ack 571201, win 24209, options [nop,nop,TS val 4294914352 ecr 159040,mptcp dss ack 3868162083], length 0
10:18:05.725611 IP 112.26.3.1.43445 > 112.26.3.8.34701: Flags [.], seq 584053:585481, ack 1, win 4017, options [nop,nop,TS val 160102 ecr 4294914352,mptcp dss ack 1720219151 seq 3868389135 subseq 584053 len 1428 csum 0x6ad5], length 1428
10:18:05.725654 IP 112.26.3.1.43445 > 112.26.3.8.34701: Flags [.], seq 585481:586909, ack 1, win 4017, options [nop,nop,TS val 160102 ecr 4294914352,mptcp dss ack 1720219151 seq 3868390563 subseq 585481 len 1428 csum 0x87ef], length 1428
10:18:05.725751 IP 112.26.3.1.43445 > 112.26.3.8.34701: Flags [.], seq 586909:588337, ack 1, win 4017, options [nop,nop,TS val 160102 ecr 4294914352,mptcp dss ack 1720219151 seq 3868391991 subseq 586909 len 1428 csum 0x1617], length 1428
10:18:05.792217 IP 112.26.3.1.43445 > 112.26.3.8.34701: Flags [.], seq 572629:574057, ack 1, win 4017, options [nop,nop,TS val 159234 ecr 4294913508,mptcp dss ack 1720219151 seq 3868340583 subseq 572629 len 1428 csum 0xae3e], length 1428
10:18:05.886688 IP 112.26.3.1.43445 > 112.26.3.8.34701: Flags [.], seq 574057:575485, ack 1, win 4017, options [nop,nop,TS val 159234 ecr 4294913508,mptcp dss ack 1720219151 seq 3868342011 subseq 574057 len 1428 csum 0x3c25], length 1428
10:18:05.974820 IP 112.26.3.1.43445 > 112.26.3.8.34701: Flags [.], seq 575485:576913, ack 1, win 4017, options [nop,nop,TS val 159456 ecr 4294913728,mptcp dss ack 1720219151 seq 3868352007 subseq 575485 len 1428 csum 0x35d3], length 1428
10:18:05.997608 IP 112.26.3.8.34701 > 112.26.3.1.43445: Flags [.], ack 576913, win 24209, options [nop,nop,TS val 4294914646 ecr 159040,mptcp dss ack 3868162083], length 0
10:18:05.997913 IP 112.26.3.1.43445 > 112.26.3.8.34701: Flags [.], seq 588337:589765, ack 1, win 4017, options [nop,nop,TS val 160374 ecr 4294914646,mptcp dss ack 1720219151 seq 3868397703 subseq 588337 len 1428 csum 0x8ed6], length 1428
10:18:05.997951 IP 112.26.3.1.43445 > 112.26.3.8.34701: Flags [.], seq 589765:591193, ack 1, win 4017, options [nop,nop,TS val 160374 ecr 4294914646,mptcp dss ack 1720219151 seq 3868399131 subseq 589765 len 1428 csum 0xa4d], length 1428
10:18:05.998078 IP 112.26.3.1.43445 > 112.26.3.8.34701: Flags [.], seq 591193:592621, ack 1, win 4017, options [nop,nop,TS val 160374 ecr 4294914646,mptcp dss ack 1720219151 seq 3868400559 subseq 591193 len 1428 csum 0xe32], length 1428
10:18:05.998144 IP 112.26.3.1.43445 > 112.26.3.8.34701: Flags [.], seq 592621:594049, ack 1, win 4017, options [nop,nop,TS val 160374 ecr 4294914646,mptcp dss ack 1720219151 seq 3868401987 subseq 592621 len 1428 csum 0xa14], length 1428
10:18:06.101318 IP 112.26.3.1.43445 > 112.26.3.8.34701: Flags [.], seq 578341:579769, ack 1, win 4017, options [nop,nop,TS val 159793 ecr 4294914056,mptcp dss ack 1720219151 seq 3868364859 subseq 578341 len 1428 csum 0xabfd], length 1428
10:18:06.149217 IP 112.26.3.8.34701 > 112.26.3.1.43445: Flags [.], ack 576913, win 24209, options [nop,nop,TS val 4294914766 ecr 159040,nop,nop,sack 1 {578341:579769},mptcp dss ack 3868162083], length 0
10:18:06.179058 IP 112.26.3.1.43445 > 112.26.3.8.34701: Flags [.], seq 579769:581197, ack 1, win 4017, options [nop,nop,TS val 159793 ecr 4294914056,mptcp dss ack 1720219151 seq 3868366287 subseq 579769 len 1428 csum 0x7cc4], length 1428
10:18:06.267091 IP 112.26.3.8.34701 > 112.26.3.1.43445: Flags [.], ack 576913, win 24209, options [nop,nop,TS val 4294914869 ecr 159040,nop,nop,sack 1 {578341:581197},mptcp dss ack 3868162083], length 0
10:18:06.267399 IP 112.26.3.1.43445 > 112.26.3.8.34701: Flags [.], seq 594049:595477, ack 1, win 4017, options [nop,nop,TS val 160643 ecr 4294914766,mptcp dss ack 1720219151 seq 3868414839 subseq 594049 len 1428 csum 0x878c], length 1428
10:18:06.279046 IP 112.26.3.1.43445 > 112.26.3.8.34701: Flags [.], seq 595477:596905, ack 1, win 4017, options [nop,nop,TS val 160655 ecr 4294914869,mptcp dss ack 1720219151 seq 3868416267 subseq 595477 len 1428 csum 0xc65c], length 1428
10:18:06.301902 IP 112.26.3.1.43445 > 112.26.3.8.34701: Flags [.], seq 581197:582625, ack 1, win 4017, options [nop,nop,TS val 159793 ecr 4294914056,mptcp dss ack 1720219151 seq 3868367715 subseq 581197 len 1428 csum 0x4f63], length 1428
10:18:06.425780 IP 112.26.3.8.34701 > 112.26.3.1.43445: Flags [.], ack 576913, win 24209, options [nop,nop,TS val 4294914984 ecr 159040,nop,nop,sack 1 {578341:582625},mptcp dss ack 3868162083], length 0
10:18:06.426206 IP 112.26.3.1.43445 > 112.26.3.8.34701: Flags [.], seq 576913:578341, ack 1, win 4017, options [nop,nop,TS val 160802 ecr 4294914984,mptcp dss ack 1720219151 seq 3868353435 subseq 576913 len 1428 csum 0x4225], length 1428
10:18:06.450264 IP 112.26.3.1.43445 > 112.26.3.8.34701: Flags [.], seq 584053:585481, ack 1, win 4017, options [nop,nop,TS val 160102 ecr 4294914352,mptcp dss ack 1720219151 seq 3868389135 subseq 584053 len 1428 csum 0x6ad5], length 1428
10:18:06.507808 IP 112.26.3.1.43445 > 112.26.3.8.34701: Flags [.], seq 585481:586909, ack 1, win 4017, options [nop,nop,TS val 160102 ecr 4294914352,mptcp dss ack 1720219151 seq 3868390563 subseq 585481 len 1428 csum 0x87ef], length 1428
10:18:06.518977 IP 112.26.3.8.34701 > 112.26.3.1.43445: Flags [.], ack 576913, win 24209, options [nop,nop,TS val 4294915109 ecr 159040,nop,nop,sack 2 {584053:585481}{578341:582625},mptcp dss ack 3868162083], length 0
10:18:06.519258 IP 112.26.3.1.43445 > 112.26.3.8.34701: Flags [.], seq 582625:584053, ack 1, win 4017, options [nop,nop,TS val 160895 ecr 4294915109,mptcp dss ack 1720219151 seq 3868369143 subseq 582625 len 1428 csum 0x8c71], length 1428
10:18:06.595505 IP 112.26.3.8.34701 > 112.26.3.1.43445: Flags [.], ack 576913, win 24209, options [nop,nop,TS val 4294915208 ecr 159040,nop,nop,sack 2 {584053:586909}{578341:582625},mptcp dss ack 3868162083], length 0
10:18:06.605295 IP 112.26.3.1.43445 > 112.26.3.8.34701: Flags [.], seq 586909:588337, ack 1, win 4017, options [nop,nop,TS val 160102 ecr 4294914352,mptcp dss ack 1720219151 seq 3868391991 subseq 586909 len 1428 csum 0x1617], length 1428
10:18:06.692140 IP 112.26.3.1.43445 > 112.26.3.8.34701: Flags [.], seq 588337:589765, ack 1, win 4017, options [nop,nop,TS val 160374 ecr 4294914646,mptcp dss ack 1720219151 seq 3868397703 subseq 588337 len 1428 csum 0x8ed6], length 1428
10:18:06.712115 IP 112.26.3.8.34701 > 112.26.3.1.43445: Flags [.], ack 576913, win 24209, options [nop,nop,TS val 4294915294 ecr 159040,nop,nop,sack 2 {584053:588337}{578341:582625},mptcp dss ack 3868162083], length 0
10:18:06.775833 IP 112.26.3.1.43445 > 112.26.3.8.34701: Flags [.], seq 589765:591193, ack 1, win 4017, options [nop,nop,TS val 160374 ecr 4294914646,mptcp dss ack 1720219151 seq 3868399131 subseq 589765 len 1428 csum 0xa4d], length 1428
10:18:06.819596 IP 112.26.3.8.34701 > 112.26.3.1.43445: Flags [.], ack 576913, win 24209, options [nop,nop,TS val 4294915365 ecr 159040,nop,nop,sack 2 {584053:589765}{578341:582625},mptcp dss ack 3868162083], length 0
10:18:06.856399 IP 112.26.3.8.34701 > 112.26.3.1.43445: Flags [.], ack 576913, win 24209, options [nop,nop,TS val 4294915441 ecr 159040,nop,nop,sack 2 {584053:591193}{578341:582625},mptcp dss ack 3868162083], length 0
10:18:06.856604 IP 112.26.3.1.43445 > 112.26.3.8.34701: Flags [.], seq 596905:598333, ack 1, win 4017, options [nop,nop,TS val 161232 ecr 4294915365,mptcp dss ack 1720219151 seq 3868436259 subseq 596905 len 1428 csum 0xeac7], length 1428
10:18:06.877310 IP 112.26.3.1.43445 > 112.26.3.8.34701: Flags [.], seq 591193:592621, ack 1, win 4017, options [nop,nop,TS val 160374 ecr 4294914646,mptcp dss ack 1720219151 seq 3868400559 subseq 591193 len 1428 csum 0xe32], length 1428
10:18:06.898506 IP 112.26.3.1.43445 > 112.26.3.8.34701: Flags [.], seq 598333:599761, ack 1, win 4017, options [nop,nop,TS val 161274 ecr 4294915441,mptcp dss ack 1720219151 seq 3868437687 subseq 598333 len 1428 csum 0x4fea], length 1428
10:18:06.937388 IP 112.26.3.1.43445 > 112.26.3.8.34701: Flags [.], seq 592621:594049, ack 1, win 4017, options [nop,nop,TS val 160374 ecr 4294914646,mptcp dss ack 1720219151 seq 3868401987 subseq 592621 len 1428 csum 0xa14], length 1428
10:18:07.030216 IP 112.26.3.8.34701 > 112.26.3.1.43445: Flags [.], ack 576913, win 24209, options [nop,nop,TS val 4294915538 ecr 159040,nop,nop,sack 2 {584053:592621}{578341:582625},mptcp dss ack 3868162083], length 0
10:18:07.042603 IP 112.26.3.1.43445 > 112.26.3.8.34701: Flags [.], seq 594049:595477, ack 1, win 4017, options [nop,nop,TS val 160643 ecr 4294914766,mptcp dss ack 1720219151 seq 3868414839 subseq 594049 len 1428 csum 0x878c], length 1428
10:18:07.108241 IP 112.26.3.1.43445 > 112.26.3.8.34701: Flags [.], seq 595477:596905, ack 1, win 4017, options [nop,nop,TS val 160655 ecr 4294914869,mptcp dss ack 1720219151 seq 3868416267 subseq 595477 len 1428 csum 0xc65c], length 1428
10:18:07.111409 IP 112.26.3.8.34701 > 112.26.3.1.43445: Flags [.], ack 576913, win 24209, options [nop,nop,TS val 4294915634 ecr 159040,nop,nop,sack 2 {584053:594049}{578341:582625},mptcp dss ack 3868162083], length 0
10:18:07.111633 IP 112.26.3.1.43445 > 112.26.3.8.34701: Flags [.], seq 599761:601189, ack 1, win 4017, options [nop,nop,TS val 161488 ecr 4294915538,mptcp dss ack 1720219151 seq 3868447683 subseq 599761 len 1428 csum 0x1239], length 1428
10:18:07.173213 IP 112.26.3.1.43445 > 112.26.3.8.34701: Flags [.], seq 601189:602617, ack 1, win 4017, options [nop,nop,TS val 161550 ecr 4294915634,mptcp dss ack 1720219151 seq 3868449111 subseq 601189 len 1428 csum 0xe49f], length 1428
10:18:07.226428 IP 112.26.3.8.34701 > 112.26.3.1.43445: Flags [.], ack 576913, win 24209, options [nop,nop,TS val 4294915701 ecr 159040,nop,nop,sack 2 {584053:595477}{578341:582625},mptcp dss ack 3868162083], length 0
10:18:07.233418 IP 112.26.3.1.43445 > 112.26.3.8.34701: Flags [.], seq 602617:604045, ack 1, win 4017, options [nop,nop,TS val 161610 ecr 4294915701,mptcp dss ack 1720219151 seq 3868451967 subseq 602617 len 1428 csum 0x9a2], length 1428
10:18:07.240870 IP 112.26.3.1.43445 > 112.26.3.8.34701: Flags [.], seq 576913:578341, ack 1, win 4017, options [nop,nop,TS val 160802 ecr 4294914984,mptcp dss ack 1720219151 seq 3868353435 subseq 576913 len 1428 csum 0x4225], length 1428
10:18:07.335668 IP 112.26.3.1.43445 > 112.26.3.8.34701: Flags [.], seq 582625:584053, ack 1, win 4017, options [nop,nop,TS val 160895 ecr 4294915109,mptcp dss ack 1720219151 seq 3868369143 subseq 582625 len 1428 csum 0x8c71], length 1428
10:18:07.382664 IP 112.26.3.1.43445 > 112.26.3.8.34701: Flags [.], seq 596905:598333, ack 1, win 4017, options [nop,nop,TS val 161232 ecr 4294915365,mptcp dss ack 1720219151 seq 3868436259 subseq 596905 len 1428 csum 0xeac7], length 1428
10:18:07.393453 IP 112.26.3.8.34701 > 112.26.3.1.43445: Flags [.], ack 576913, win 24209, options [nop,nop,TS val 4294915801 ecr 159040,nop,nop,sack 2 {584053:596905}{578341:582625},mptcp dss ack 3868162083], length 0
10:18:07.460742 IP 112.26.3.8.34701 > 112.26.3.1.43445: Flags [.], ack 582625, win 24209, options [nop,nop,TS val 4294915902 ecr 160802,nop,nop,sack 1 {584053:596905},mptcp dss ack 3868162083], length 0
10:18:07.460958 IP 112.26.3.1.43445 > 112.26.3.8.34701: Flags [.], seq 604045:605473, ack 1, win 4017, options [nop,nop,TS val 161837 ecr 4294915801,mptcp dss ack 1720219151 seq 3868467675 subseq 604045 len 1428 csum 0xff13], length 1428
10:18:07.461018 IP 112.26.3.1.43445 > 112.26.3.8.34701: Flags [.], seq 605473:606901, ack 1, win 4017, options [nop,nop,TS val 161837 ecr 4294915902,mptcp dss ack 1720219151 seq 3868469103 subseq 605473 len 1428 csum 0xb590], length 1428
10:18:07.506302 IP 112.26.3.1.43445 > 112.26.3.8.34701: Flags [.], seq 598333:599761, ack 1, win 4017, options [nop,nop,TS val 161274 ecr 4294915441,mptcp dss ack 1720219151 seq 3868437687 subseq 598333 len 1428 csum 0x4fea], length 1428
10:18:07.568205 IP 112.26.3.1.43445 > 112.26.3.8.34701: Flags [.], seq 599761:601189, ack 1, win 4017, options [nop,nop,TS val 161488 ecr 4294915538,mptcp dss ack 1720219151 seq 3868447683 subseq 599761 len 1428 csum 0x1239], length 1428
10:18:07.629016 IP 112.26.3.8.34701 > 112.26.3.1.43445: Flags [.], ack 596905, win 24209, options [nop,nop,TS val 4294916031 ecr 160895,mptcp dss ack 3868162083], length 0
10:18:07.629251 IP 112.26.3.1.43445 > 112.26.3.8.34701: Flags [.], seq 606901:608329, ack 1, win 4017, options [nop,nop,TS val 162005 ecr 4294916031,mptcp dss ack 1720219151 seq 3868479099 subseq 606901 len 1428 csum 0xd18], length 1428
10:18:07.659227 IP 112.26.3.1.43445 > 112.26.3.8.34701: Flags [.], seq 601189:602617, ack 1, win 4017, options [nop,nop,TS val 161550 ecr 4294915634,mptcp dss ack 1720219151 seq 3868449111 subseq 601189 len 1428 csum 0xe49f], length 1428
10:18:07.720559 IP 112.26.3.8.34701 > 112.26.3.1.43445: Flags [.], ack 598333, win 24209, options [nop,nop,TS val 4294916106 ecr 161232,mptcp dss ack 3868162083], length 0
10:18:07.720785 IP 112.26.3.1.43445 > 112.26.3.8.34701: Flags [.], seq 608329:609757, ack 1, win 4017, options [nop,nop,TS val 162097 ecr 4294916106,mptcp dss ack 1720219151 seq 3868480527 subseq 608329 len 1428 csum 0x17d], length 1428
10:18:07.754392 IP 112.26.3.1.43445 > 112.26.3.8.34701: Flags [.], seq 602617:604045, ack 1, win 4017, options [nop,nop,TS val 161610 ecr 4294915701,mptcp dss ack 1720219151 seq 3868451967 subseq 602617 len 1428 csum 0x9a2], length 1428
10:18:07.835619 IP 112.26.3.8.34701 > 112.26.3.1.43445: Flags [.], ack 599761, win 24209, options [nop,nop,TS val 4294916244 ecr 161274,mptcp dss ack 3868162083], length 0
10:18:07.835960 IP 112.26.3.1.43445 > 112.26.3.8.34701: Flags [.], seq 609757:611185, ack 1, win 4017, options [nop,nop,TS val 162212 ecr 4294916244,mptcp dss ack 1720219151 seq 3868486239 subseq 609757 len 1428 csum 0xb1bd], length 1428
10:18:07.854900 IP 112.26.3.1.43445 > 112.26.3.8.34701: Flags [.], seq 604045:605473, ack 1, win 4017, options [nop,nop,TS val 161837 ecr 4294915801,mptcp dss ack 1720219151 seq 3868467675 subseq 604045 len 1428 csum 0xff13], length 1428
10:18:07.925159 IP 112.26.3.8.34701 > 112.26.3.1.43445: Flags [.], ack 601189, win 24209, options [nop,nop,TS val 4294916343 ecr 161488,mptcp dss ack 3868162083], length 0
10:18:07.925390 IP 112.26.3.1.43445 > 112.26.3.8.34701: Flags [.], seq 611185:612613, ack 1, win 4017, options [nop,nop,TS val 162302 ecr 4294916343,mptcp dss ack 1720219151 seq 3868487667 subseq 611185 len 1428 csum 0x54ab], length 1428
10:18:07.925436 IP 112.26.3.1.43445 > 112.26.3.8.34701: Flags [.], seq 612613:614041, ack 1, win 4017, options [nop,nop,TS val 162302 ecr 4294916343,mptcp dss ack 1720219151 seq 3868489095 subseq 612613 len 1428 csum 0x5d99], length 1428
10:18:07.948495 IP 112.26.3.1.43445 > 112.26.3.8.34701: Flags [.], seq 605473:606901, ack 1, win 4017, options [nop,nop,TS val 161837 ecr 4294915902,mptcp dss ack 1720219151 seq 3868469103 subseq 605473 len 1428 csum 0xb590], length 1428
10:18:08.040033 IP 112.26.3.8.34701 > 112.26.3.1.43445: Flags [.], ack 602617, win 24209, options [nop,nop,TS val 4294916435 ecr 161550,mptcp dss ack 3868162083], length 0
10:18:08.040302 IP 112.26.3.1.43445 > 112.26.3.8.34701: Flags [.], seq 614041:615469, ack 1, win 4017, options [nop,nop,TS val 162416 ecr 4294916435,mptcp dss ack 1720219151 seq 3868493379 subseq 614041 len 1428 csum 0x61cb], length 1428
10:18:08.060979 IP 112.26.3.1.43445 > 112.26.3.8.34701: Flags [.], seq 606901:608329, ack 1, win 4017, options [nop,nop,TS val 162005 ecr 4294916031,mptcp dss ack 1720219151 seq 3868479099 subseq 606901 len 1428 csum 0xd18], length 1428
10:18:08.185172 IP 112.26.3.1.43445 > 112.26.3.8.34701: Flags [.], seq 608329:609757, ack 1, win 4017, options [nop,nop,TS val 162097 ecr 4294916106,mptcp dss ack 1720219151 seq 3868480527 subseq 608329 len 1428 csum 0x17d], length 1428
10:18:08.217071 IP 112.26.3.8.34701 > 112.26.3.1.43445: Flags [.], ack 604045, win 24209, options [nop,nop,TS val 4294916518 ecr 161610,mptcp dss ack 3868162083], length 0
10:18:08.217404 IP 112.26.3.1.43445 > 112.26.3.8.34701: Flags [.], seq 615469:616897, ack 1, win 4017, options [nop,nop,TS val 162593 ecr 4294916518,mptcp dss ack 1720219151 seq 3868500519 subseq 615469 len 1428 csum 0x9357], length 1428
10:18:08.217442 IP 112.26.3.1.43445 > 112.26.3.8.34701: Flags [.], seq 616897:618325, ack 1, win 4017, options [nop,nop,TS val 162593 ecr 4294916518,mptcp dss ack 1720219151 seq 3868501947 subseq 616897 len 1428 csum 0x36d2], length 1428
10:18:08.285604 IP 112.26.3.1.43445 > 112.26.3.8.34701: Flags [.], seq 609757:611185, ack 1, win 4017, options [nop,nop,TS val 162212 ecr 4294916244,mptcp dss ack 1720219151 seq 3868486239 subseq 609757 len 1428 csum 0xb1bd], length 1428
10:18:08.343323 IP 112.26.3.8.34701 > 112.26.3.1.43445: Flags [.], ack 605473, win 24209, options [nop,nop,TS val 4294916636 ecr 161837,mptcp dss ack 3868162083], length 0
10:18:08.343544 IP 112.26.3.1.43445 > 112.26.3.8.34701: Flags [.], seq 618325:619753, ack 1, win 4017, options [nop,nop,TS val 162720 ecr 4294916636,mptcp dss ack 1720219151 seq 3868506231 subseq 618325 len 1428 csum 0x25d4], length 1428
10:18:08.409131 IP 112.26.3.1.43445 > 112.26.3.8.34701: Flags [.], seq 611185:612613, ack 1, win 4017, options [nop,nop,TS val 162302 ecr 4294916343,mptcp dss ack 1720219151 seq 3868487667 subseq 611185 len 1428 csum 0x54ab], length 1428
10:18:08.470206 IP 112.26.3.8.34701 > 112.26.3.1.43445: Flags [.], ack 606901, win 24209, options [nop,nop,TS val 4294916707 ecr 161837,mptcp dss ack 3868162083], length 0
10:18:08.470467 IP 112.26.3.1.43445 > 112.26.3.8.34701: Flags [.], seq 619753:621181, ack 1, win 4017, options [nop,nop,TS val 162846 ecr 4294916707,mptcp dss ack 1720219151 seq 3868513371 subseq 619753 len 1428 csum 0x271d], length 1428
10:18:08.527033 IP 112.26.3.1.43445 > 112.26.3.8.34701: Flags [.], seq 612613:614041, ack 1, win 4017, options [nop,nop,TS val 162302 ecr 4294916343,mptcp dss ack 1720219151 seq 3868489095 subseq 612613 len 1428 csum 0x5d99], length 1428
10:18:08.584193 IP 112.26.3.8.34701 > 112.26.3.1.43445: Flags [.], ack 608329, win 24209, options [nop,nop,TS val 4294916781 ecr 162005,mptcp dss ack 3868162083], length 0
10:18:08.584488 IP 112.26.3.1.43445 > 112.26.3.8.34701: Flags [.], seq 621181:622609, ack 1, win 4017, options [nop,nop,TS val 162960 ecr 4294916781,mptcp dss ack 1720219151 seq 3868517655 subseq 621181 len 1428 csum 0x1345], length 1428
10:18:08.606362 IP 112.26.3.1.43445 > 112.26.3.8.34701: Flags [.], seq 614041:615469, ack 1, win 4017, options [nop,nop,TS val 162416 ecr 4294916435,mptcp dss ack 1720219151 seq 3868493379 subseq 614041 len 1428 csum 0x61cb], length 1428
10:18:08.722425 IP 112.26.3.8.34701 > 112.26.3.1.43445: Flags [.], ack 609757, win 24209, options [nop,nop,TS val 4294916899 ecr 162097,mptcp dss ack 3868162083], length 0
10:18:08.722670 IP 112.26.3.1.43445 > 112.26.3.8.34701: Flags [.], seq 622609:624037, ack 1, win 4017, options [nop,nop,TS val 163099 ecr 4294916899,mptcp dss ack 1720219151 seq 3868521939 subseq 622609 len 1428 csum 0x48c3], length 1428
10:18:08.744247 IP 112.26.3.1.43445 > 112.26.3.8.34701: Flags [.], seq 615469:616897, ack 1, win 4017, options [nop,nop,TS val 162593 ecr 4294916518,mptcp dss ack 1720219151 seq 3868500519 subseq 615469 len 1428 csum 0x9357], length 1428
10:18:08.859666 IP 112.26.3.1.43445 > 112.26.3.8.34701: Flags [.], seq 616897:618325, ack 1, win 4017, options [nop,nop,TS val 162593 ecr 4294916518,mptcp dss ack 1720219151 seq 3868501947 subseq 616897 len 1428 csum 0x36d2], length 1428
10:18:08.899152 IP 112.26.3.1.43445 > 112.26.3.8.34701: Flags [.], seq 621181:622609, ack 1, win 4017, options [nop,nop,TS val 162960 ecr 4294916781,mptcp dss ack 1720219151 seq 3868517655 subseq 621181 len 1428 csum 0x1345], length 1428
10:18:08.984062 IP 112.26.3.1.43445 > 112.26.3.8.34701: Flags [.], seq 618325:619753, ack 1, win 4017, options [nop,nop,TS val 162720 ecr 4294916636,mptcp dss ack 1720219151 seq 3868506231 subseq 618325 len 1428 csum 0x25d4], length 1428
10:18:09.128811 IP 112.26.3.1.43445 > 112.26.3.8.34701: Flags [.], seq 619753:621181, ack 1, win 4017, options [nop,nop,TS val 162846 ecr 4294916707,mptcp dss ack 1720219151 seq 3868513371 subseq 619753 len 1428 csum 0x271d], length 1428
10:18:09.153335 IP 112.26.3.1.43445 > 112.26.3.8.34701: Flags [.], seq 622609:624037, ack 1, win 4017, options [nop,nop,TS val 163099 ecr 4294916899,mptcp dss ack 1720219151 seq 3868521939 subseq 622609 len 1428 csum 0x48c3], length 1428
10:18:19.703480 IP 112.26.3.1.43445 > 112.26.3.8.34701: Flags [.], seq 609757:611185, ack 1, win 4017, options [nop,nop,TS val 174080 ecr 4294916899,mptcp dss ack 1720219151 seq 3868486239 subseq 609757 len 1428 csum 0xb1bd], length 1428
10:18:19.709672 IP 112.26.3.1.43445 > 112.26.3.8.34701: Flags [.], seq 609757:611185, ack 1, win 4017, options [nop,nop,TS val 174080 ecr 4294916899,mptcp dss ack 1720219151 seq 3868486239 subseq 609757 len 1428 csum 0xb1bd], length 1428
10:18:19.816129 IP 112.26.3.8.34701 > 112.26.3.1.43445: Flags [.], ack 611185, win 24393, options [nop,nop,TS val 4294928373 ecr 174080,mptcp dss ack 3868446255], length 0
10:18:19.816285 IP 112.26.3.1.43445 > 112.26.3.8.34701: Flags [.], seq 611185:612613, ack 1, win 4017, options [nop,nop,TS val 174192 ecr 4294928373,mptcp dss ack 1720219151 seq 3868487667 subseq 611185 len 1428 csum 0x54ab], length 1428
10:18:19.816324 IP 112.26.3.1.43445 > 112.26.3.8.34701: Flags [.], seq 612613:614041, ack 1, win 4017, options [nop,nop,TS val 174192 ecr 4294928373,mptcp dss ack 1720219151 seq 3868489095 subseq 612613 len 1428 csum 0x5d99], length 1428
10:18:19.841061 IP 112.26.3.1.43445 > 112.26.3.8.34701: Flags [.], seq 611185:612613, ack 1, win 4017, options [nop,nop,TS val 174192 ecr 4294928373,mptcp dss ack 1720219151 seq 3868487667 subseq 611185 len 1428 csum 0x54ab], length 1428
10:18:19.902422 IP 112.26.3.8.34701 > 112.26.3.1.43445: Flags [.], ack 612613, win 24393, options [nop,nop,TS val 4294928500 ecr 174192,mptcp dss ack 3868446255], length 0
10:18:19.902713 IP 112.26.3.1.43445 > 112.26.3.8.34701: Flags [.], seq 614041:615469, ack 1, win 4017, options [nop,nop,TS val 174279 ecr 4294928500,mptcp dss ack 1720219151 seq 3868493379 subseq 614041 len 1428 csum 0x61cb], length 1428
10:18:19.902746 IP 112.26.3.1.43445 > 112.26.3.8.34701: Flags [.], seq 615469:616897, ack 1, win 4017, options [nop,nop,TS val 174279 ecr 4294928500,mptcp dss ack 1720219151 seq 3868500519 subseq 615469 len 1428 csum 0x9357], length 1428
10:18:19.943062 IP 112.26.3.1.43445 > 112.26.3.8.34701: Flags [.], seq 612613:614041, ack 1, win 4017, options [nop,nop,TS val 174192 ecr 4294928373,mptcp dss ack 1720219151 seq 3868489095 subseq 612613 len 1428 csum 0x5d99], length 1428
10:18:19.961791 IP 112.26.3.8.34701 > 112.26.3.1.43445: Flags [.], ack 614041, win 24321, options [nop,nop,TS val 4294928602 ecr 174192,mptcp dss ack 3868464819], length 0
10:18:19.962151 IP 112.26.3.1.43445 > 112.26.3.8.34701: Flags [.], seq 616897:618325, ack 1, win 4017, options [nop,nop,TS val 174338 ecr 4294928602,mptcp dss ack 1720219151 seq 3868501947 subseq 616897 len 1428 csum 0x36d2], length 1428
10:18:19.962181 IP 112.26.3.1.43445 > 112.26.3.8.34701: Flags [.], seq 618325:619753, ack 1, win 4017, options [nop,nop,TS val 174338 ecr 4294928602,mptcp dss ack 1720219151 seq 3868506231 subseq 618325 len 1428 csum 0x25d4], length 1428
10:18:20.017526 IP 112.26.3.1.43445 > 112.26.3.8.34701: Flags [.], seq 614041:615469, ack 1, win 4017, options [nop,nop,TS val 174279 ecr 4294928500,mptcp dss ack 1720219151 seq 3868493379 subseq 614041 len 1428 csum 0x61cb], length 1428
10:18:20.037563 IP 112.26.3.8.34701 > 112.26.3.1.43445: Flags [.], ack 615469, win 24321, options [nop,nop,TS val 4294928689 ecr 174279,mptcp dss ack 3868464819], length 0
10:18:20.037877 IP 112.26.3.1.43445 > 112.26.3.8.34701: Flags [.], seq 619753:621181, ack 1, win 4017, options [nop,nop,TS val 174414 ecr 4294928689,mptcp dss ack 1720219151 seq 3868513371 subseq 619753 len 1428 csum 0x271d], length 1428
10:18:20.037907 IP 112.26.3.1.43445 > 112.26.3.8.34701: Flags [.], seq 621181:622609, ack 1, win 4017, options [nop,nop,TS val 174414 ecr 4294928689,mptcp dss ack 1720219151 seq 3868517655 subseq 621181 len 1428 csum 0x1345], length 1428
10:18:20.063803 IP 112.26.3.1.43445 > 112.26.3.8.34701: Flags [.], seq 615469:616897, ack 1, win 4017, options [nop,nop,TS val 174279 ecr 4294928500,mptcp dss ack 1720219151 seq 3868500519 subseq 615469 len 1428 csum 0x9357], length 1428
10:18:20.119500 IP 112.26.3.8.34701 > 112.26.3.1.43445: Flags [.], ack 616897, win 24321, options [nop,nop,TS val 4294928768 ecr 174279,mptcp dss ack 3868464819], length 0
10:18:20.119703 IP 112.26.3.1.43445 > 112.26.3.8.34701: Flags [.], seq 622609:624037, ack 1, win 4017, options [nop,nop,TS val 174496 ecr 4294928768,mptcp dss ack 1720219151 seq 3868521939 subseq 622609 len 1428 csum 0x48c3], length 1428
10:18:20.164152 IP 112.26.3.1.43445 > 112.26.3.8.34701: Flags [.], seq 616897:618325, ack 1, win 4017, options [nop,nop,TS val 174338 ecr 4294928602,mptcp dss ack 1720219151 seq 3868501947 subseq 616897 len 1428 csum 0x36d2], length 1428
10:18:20.189898 IP 112.26.3.8.34701 > 112.26.3.1.43445: Flags [.], ack 618325, win 24299, options [nop,nop,TS val 4294928823 ecr 174338,mptcp dss ack 3868466247], length 0
10:18:20.249969 IP 112.26.3.1.43445 > 112.26.3.8.34701: Flags [.], seq 618325:619753, ack 1, win 4017, options [nop,nop,TS val 174338 ecr 4294928602,mptcp dss ack 1720219151 seq 3868506231 subseq 618325 len 1428 csum 0x25d4], length 1428
10:18:20.266523 IP 112.26.3.8.34701 > 112.26.3.1.43445: Flags [.], ack 619753, win 24303, options [nop,nop,TS val 4294928916 ecr 174338,mptcp dss ack 3868471959], length 0
10:18:20.317281 IP 112.26.3.1.43445 > 112.26.3.8.34701: Flags [.], seq 619753:621181, ack 1, win 4017, options [nop,nop,TS val 174414 ecr 4294928689,mptcp dss ack 1720219151 seq 3868513371 subseq 619753 len 1428 csum 0x271d], length 1428
10:18:20.346831 IP 112.26.3.8.34701 > 112.26.3.1.43445: Flags [.], ack 621181, win 24303, options [nop,nop,TS val 4294928979 ecr 174414,mptcp dss ack 3868471959], length 0
10:18:20.407061 IP 112.26.3.1.43445 > 112.26.3.8.34701: Flags [.], seq 621181:622609, ack 1, win 4017, options [nop,nop,TS val 174414 ecr 4294928689,mptcp dss ack 1720219151 seq 3868517655 subseq 621181 len 1428 csum 0x1345], length 1428
10:18:20.417194 IP 112.26.3.8.34701 > 112.26.3.1.43445: Flags [.], ack 622609, win 24303, options [nop,nop,TS val 4294929065 ecr 174414,mptcp dss ack 3868471959], length 0
10:18:20.476811 IP 112.26.3.1.43445 > 112.26.3.8.34701: Flags [.], seq 622609:624037, ack 1, win 4017, options [nop,nop,TS val 174496 ecr 4294928768,mptcp dss ack 1720219151 seq 3868521939 subseq 622609 len 1428 csum 0x48c3], length 1428
10:18:20.487374 IP 112.26.3.8.34701 > 112.26.3.1.43445: Flags [.], ack 624037, win 24303, options [nop,nop,TS val 4294929135 ecr 174496,mptcp dss ack 3868471959], length 0
10:18:20.561688 IP 112.26.3.1.43445 > 112.26.3.8.34701: Flags [.], seq 624037:625465, ack 1, win 4017, options [nop,nop,TS val 174938 ecr 4294929135,mptcp dss ack 1720219151 seq 3868500519 subseq 624037 len 1428 csum 0x71df], length 1428
10:18:20.561781 IP 112.26.3.1.43445 > 112.26.3.8.34701: Flags [.], seq 625465:626893, ack 1, win 4017, options [nop,nop,TS val 174938 ecr 4294929135,mptcp dss ack 1720219151 seq 3868501947 subseq 625465 len 1428 csum 0x155a], length 1428
10:18:20.562020 IP 112.26.3.1.43445 > 112.26.3.8.34701: Flags [.], seq 626893:628321, ack 1, win 4017, options [nop,nop,TS val 174938 ecr 4294929135,mptcp dss ack 1720219151 seq 3868503375 subseq 626893 len 1428 csum 0x1a04], length 1428
