10:17:23.895942 IP 112.26.2.8.39903 > 112.26.2.1.43445: Flags [S], seq 672498423, win 65535, options [mss 1460,sackOK,TS val 4294872457 ecr 0,nop,wscale 6,mptcp join id 4 token 0x1271d1f5 nonce 0xad08927e], length 0
10:17:24.003828 IP 112.26.2.8.39903 > 112.26.2.1.43445: Flags [S], seq 672498423, win 65535, options [mss 1460,sackOK,TS val 4294872457 ecr 0,nop,wscale 6,mptcp join id 4 token 0x1271d1f5 nonce 0xad08927e], length 0
10:17:24.124568 IP 112.26.2.1.43445 > 112.26.2.8.39903: Flags [S.], seq 1340884807, ack 672498424, win 65535, options [mss 1460,sackOK,TS val 118380 ecr 4294872457,nop,wscale 6,mptcp join id 6 hmac 0xdf78a7e315d0df0 nonce 0x6a59e05e], length 0
10:17:24.178325 IP 112.26.2.1.43445 > 112.26.2.8.39903: Flags [S.], seq 1340884807, ack 672498424, win 65535, options [mss 1460,sackOK,TS val 118380 ecr 4294872457,nop,wscale 6,mptcp join id 6 hmac 0xdf78a7e315d0df0 nonce 0x6a59e05e], length 0
10:17:24.226001 IP 112.26.2.8.39903 > 112.26.2.1.43445: Flags [.], ack 1, win 6479, options [nop,nop,TS val 4294872838 ecr 118380,mptcp join hmac 0x06c6c92732455c5a9bc8c60b0e48efa7c6236428], length 0
10:17:24.254589 IP 112.26.2.8.39903 > 112.26.2.1.43445: Flags [.], ack 1, win 6479, options [nop,nop,TS val 4294872838 ecr 118380,mptcp join hmac 0x06c6c92732455c5a9bc8c60b0e48efa7c6236428], length 0
10:17:24.394289 IP 112.26.2.1.43445 > 112.26.2.8.39903: Flags [.], ack 1, win 2678, options [nop,nop,TS val 118629 ecr 4294872838,mptcp dss ack 1720219151], length 0
10:17:58.491140 IP 112.26.2.8.39903 > 112.26.2.1.43445: Flags [.], ack 307021, win 24409, options [nop,nop,TS val 4294907144 ecr 152146,mptcp dss ack 3867986439], length 0
10:17:58.529604 IP 112.26.2.1.43445 > 112.26.2.8.39903: Flags [.], seq 307021:308449, ack 1, win 4017, options [nop,nop,TS val 152146 ecr 4294905727,mptcp dss ack 1720219151 seq 3868005003 subseq 307021 len 1428 csum 0x5d30], length 1428
10:17:58.529789 IP 112.26.2.1.43445 > 112.26.2.8.39903: Flags [.], seq 307021:308449, ack 1, win 4017, options [nop,nop,TS val 152146 ecr 4294905727,mptcp dss ack 1720219151 seq 3868005003 subseq 307021 len 1428 csum 0x5d30], length 1428
10:17:58.610618 IP 112.26.2.1.43445 > 112.26.2.8.39903: Flags [.], seq 309877:311305, ack 1, win 4017, options [nop,nop,TS val 152376 ecr 4294905914,mptcp dss ack 1720219151 seq 3868014999 subseq 309877 len 1428 csum 0x94a8], length 1428
10:17:58.610794 IP 112.26.2.1.43445 > 112.26.2.8.39903: Flags [.], seq 309877:311305, ack 1, win 4017, options [nop,nop,TS val 152376 ecr 4294905914,mptcp dss ack 1720219151 seq 3868014999 subseq 309877 len 1428 csum 0x94a8], length 1428
10:17:58.668676 IP 112.26.2.8.39903 > 112.26.2.1.43445: Flags [.], ack 308449, win 24409, options [nop,nop,TS val 4294907269 ecr 152146,nop,nop,sack 1 {309877:311305},mptcp dss ack 3867986439], length 0
10:17:58.720490 IP 112.26.2.8.39903 > 112.26.2.1.43445: Flags [.], ack 305593, win 24210, options [nop,nop,TS val 4294906663 ecr 151499,mptcp dss ack 3867935031], length 0
10:17:58.792783 IP 112.26.2.1.43445 > 112.26.2.8.39903: Flags [.], seq 311305:312733, ack 1, win 4017, options [nop,nop,TS val 152439 ecr 4294906088,mptcp dss ack 1720219151 seq 3868017855 subseq 311305 len 1428 csum 0xb4b6], length 1428
10:17:58.792975 IP 112.26.2.1.43445 > 112.26.2.8.39903: Flags [.], seq 311305:312733, ack 1, win 4017, options [nop,nop,TS val 152439 ecr 4294906088,mptcp dss ack 1720219151 seq 3868017855 subseq 311305 len 1428 csum 0xb4b6], length 1428
10:17:58.798983 IP 112.26.2.8.39903 > 112.26.2.1.43445: Flags [.], ack 308449, win 24409, options [nop,nop,TS val 4294907451 ecr 152146,nop,nop,sack 1 {309877:312733},mptcp dss ack 3867986439], length 0
10:17:58.897933 IP 112.26.2.1.43445 > 112.26.2.8.39903: Flags [.], seq 312733:314161, ack 1, win 4017, options [nop,nop,TS val 152439 ecr 4294906088,mptcp dss ack 1720219151 seq 3868019283 subseq 312733 len 1428 csum 0xcd0b], length 1428
10:17:58.898090 IP 112.26.2.1.43445 > 112.26.2.8.39903: Flags [.], seq 312733:314161, ack 1, win 4017, options [nop,nop,TS val 152439 ecr 4294906088,mptcp dss ack 1720219151 seq 3868019283 subseq 312733 len 1428 csum 0xcd0b], length 1428
10:17:58.903286 IP 112.26.2.8.39903 > 112.26.2.1.43445: Flags [.], ack 308449, win 24409, options [nop,nop,TS val 4294907556 ecr 152146,nop,nop,sack 1 {309877:314161},mptcp dss ack 3867986439], length 0
10:17:58.988429 IP 112.26.2.1.43445 > 112.26.2.8.39903: Flags [.], seq 314161:315589, ack 1, win 4017, options [nop,nop,TS val 152439 ecr 4294906088,mptcp dss ack 1720219151 seq 3868020711 subseq 314161 len 1428 csum 0xd55d], length 1428
10:17:58.988664 IP 112.26.2.1.43445 > 112.26.2.8.39903: Flags [.], seq 314161:315589, ack 1, win 4017, options [nop,nop,TS val 152439 ecr 4294906088,mptcp dss ack 1720219151 seq 3868020711 subseq 314161 len 1428 csum 0xd55d], length 1428
10:17:58.997368 IP 112.26.2.8.39903 > 112.26.2.1.43445: Flags [.], ack 308449, win 24409, options [nop,nop,TS val 4294907648 ecr 152146,nop,nop,sack 1 {309877:315589},mptcp dss ack 3867986439], length 0
10:17:59.070801 IP 112.26.2.1.43445 > 112.26.2.8.39903: Flags [.], seq 315589:317017, ack 1, win 4017, options [nop,nop,TS val 152543 ecr 4294906190,mptcp dss ack 1720219151 seq 3868034991 subseq 315589 len 1428 csum 0x8d03], length 1428
10:17:59.070985 IP 112.26.2.1.43445 > 112.26.2.8.39903: Flags [.], seq 315589:317017, ack 1, win 4017, options [nop,nop,TS val 152543 ecr 4294906190,mptcp dss ack 1720219151 seq 3868034991 subseq 315589 len 1428 csum 0x8d03], length 1428
10:17:59.082966 IP 112.26.2.8.39903 > 112.26.2.1.43445: Flags [.], ack 308449, win 24409, options [nop,nop,TS val 4294907730 ecr 152146,nop,nop,sack 1 {309877:317017},mptcp dss ack 3867986439], length 0
10:17:59.173194 IP 112.26.2.1.43445 > 112.26.2.8.39903: Flags [.], seq 317017:318445, ack 1, win 4017, options [nop,nop,TS val 152648 ecr 4294906287,mptcp dss ack 1720219151 seq 3868039275 subseq 317017 len 1428 csum 0x4530], length 1428
10:17:59.173373 IP 112.26.2.1.43445 > 112.26.2.8.39903: Flags [.], seq 317017:318445, ack 1, win 4017, options [nop,nop,TS val 152648 ecr 4294906287,mptcp dss ack 1720219151 seq 3868039275 subseq 317017 len 1428 csum 0x4530], length 1428
10:17:59.180244 IP 112.26.2.8.39903 > 112.26.2.1.43445: Flags [.], ack 308449, win 24409, options [nop,nop,TS val 4294907835 ecr 152146,nop,nop,sack 1 {309877:318445},mptcp dss ack 3867986439], length 0
10:17:59.242724 IP 112.26.2.1.43445 > 112.26.2.8.39903: Flags [.], seq 318445:319873, ack 1, win 4017, options [nop,nop,TS val 152705 ecr 4294906361,mptcp dss ack 1720219151 seq 3868040703 subseq 318445 len 1428 csum 0x4d99], length 1428
10:17:59.242899 IP 112.26.2.1.43445 > 112.26.2.8.39903: Flags [.], seq 318445:319873, ack 1, win 4017, options [nop,nop,TS val 152705 ecr 4294906361,mptcp dss ack 1720219151 seq 3868040703 subseq 318445 len 1428 csum 0x4d99], length 1428
10:17:59.282596 IP 112.26.2.8.39903 > 112.26.2.1.43445: Flags [.], ack 308449, win 24409, options [nop,nop,TS val 4294907901 ecr 152146,nop,nop,sack 1 {309877:319873},mptcp dss ack 3867986439], length 0
10:17:59.337633 IP 112.26.2.8.39903 > 112.26.2.1.43445: Flags [.], ack 308449, win 24409, options [nop,nop,TS val 4294907269 ecr 152146,nop,nop,sack 1 {309877:311305},mptcp dss ack 3867986439], length 0
10:17:59.386150 IP 112.26.2.1.43445 > 112.26.2.8.39903: Flags [.], seq 319873:321301, ack 1, win 4017, options [nop,nop,TS val 153096 ecr 4294906663,mptcp dss ack 1720219151 seq 3868063551 subseq 319873 len 1428 csum 0x38ad], length 1428
10:17:59.386333 IP 112.26.2.1.43445 > 112.26.2.8.39903: Flags [.], seq 319873:321301, ack 1, win 4017, options [nop,nop,TS val 153096 ecr 4294906663,mptcp dss ack 1720219151 seq 3868063551 subseq 319873 len 1428 csum 0x38ad], length 1428
10:17:59.389443 IP 112.26.2.8.39903 > 112.26.2.1.43445: Flags [.], ack 308449, win 24409, options [nop,nop,TS val 4294908044 ecr 152146,nop,nop,sack 1 {309877:321301},mptcp dss ack 3867986439], length 0
10:17:59.521197 IP 112.26.2.1.43445 > 112.26.2.8.39903: Flags [.], seq 321301:322729, ack 1, win 4017, options [nop,nop,TS val 153096 ecr 4294906663,mptcp dss ack 1720219151 seq 3868064979 subseq 321301 len 1428 csum 0xe372], length 1428
10:17:59.521379 IP 112.26.2.1.43445 > 112.26.2.8.39903: Flags [.], seq 321301:322729, ack 1, win 4017, options [nop,nop,TS val 153096 ecr 4294906663,mptcp dss ack 1720219151 seq 3868064979 subseq 321301 len 1428 csum 0xe372], length 1428
10:17:59.528365 IP 112.26.2.8.39903 > 112.26.2.1.43445: Flags [.], ack 308449, win 24409, options [nop,nop,TS val 4294908182 ecr 152146,nop,nop,sack 1 {309877:322729},mptcp dss ack 3867986439], length 0
10:17:59.645255 IP 112.26.2.8.39903 > 112.26.2.1.43445: Flags [.], ack 308449, win 24409, options [nop,nop,TS val 4294907556 ecr 152146,nop,nop,sack 1 {309877:314161},mptcp dss ack 3867986439], length 0
10:17:59.693451 IP 112.26.2.8.39903 > 112.26.2.1.43445: Flags [.], ack 308449, win 24409, options [nop,nop,TS val 4294907648 ecr 152146,nop,nop,sack 1 {309877:315589},mptcp dss ack 3867986439], length 0
10:17:59.782016 IP 112.26.2.8.39903 > 112.26.2.1.43445: Flags [.], ack 308449, win 24409, options [nop,nop,TS val 4294907730 ecr 152146,nop,nop,sack 1 {309877:317017},mptcp dss ack 3867986439], length 0
10:17:59.842724 IP 112.26.2.8.39903 > 112.26.2.1.43445: Flags [.], ack 308449, win 24409, options [nop,nop,TS val 4294907835 ecr 152146,nop,nop,sack 1 {309877:318445},mptcp dss ack 3867986439], length 0
10:17:59.872054 IP 112.26.2.8.39903 > 112.26.2.1.43445: Flags [.], ack 308449, win 24409, options [nop,nop,TS val 4294907901 ecr 152146,nop,nop,sack 1 {309877:319873},mptcp dss ack 3867986439], length 0
10:17:59.950658 IP 112.26.2.1.43445 > 112.26.2.8.39903: Flags [.], seq 322729:324157, ack 1, win 4017, options [nop,nop,TS val 153713 ecr 4294907269,mptcp dss ack 1720219151 seq 3868083543 subseq 322729 len 1428 csum 0xc864], length 1428
10:17:59.950972 IP 112.26.2.1.43445 > 112.26.2.8.39903: Flags [.], seq 322729:324157, ack 1, win 4017, options [nop,nop,TS val 153713 ecr 4294907269,mptcp dss ack 1720219151 seq 3868083543 subseq 322729 len 1428 csum 0xc864], length 1428
10:17:59.963996 IP 112.26.2.8.39903 > 112.26.2.1.43445: Flags [.], ack 308449, win 24409, options [nop,nop,TS val 4294908609 ecr 152146,nop,nop,sack 1 {309877:324157},mptcp dss ack 3867986439], length 0
10:18:00.025849 IP 112.26.2.1.43445 > 112.26.2.8.39903: Flags [.], seq 324157:325585, ack 1, win 4017, options [nop,nop,TS val 153713 ecr 4294907269,mptcp dss ack 1720219151 seq 3868084971 subseq 324157 len 1428 csum 0x77f4], length 1428
10:18:00.026147 IP 112.26.2.1.43445 > 112.26.2.8.39903: Flags [.], seq 324157:325585, ack 1, win 4017, options [nop,nop,TS val 153713 ecr 4294907269,mptcp dss ack 1720219151 seq 3868084971 subseq 324157 len 1428 csum 0x77f4], length 1428
10:18:00.072548 IP 112.26.2.8.39903 > 112.26.2.1.43445: Flags [.], ack 308449, win 24276, options [nop,nop,TS val 4294908728 ecr 152146,nop,nop,sack 1 {309877:325585},mptcp dss ack 3867995007], length 0
10:18:00.105597 IP 112.26.2.8.39903 > 112.26.2.1.43445: Flags [.], ack 308449, win 24409, options [nop,nop,TS val 4294908044 ecr 152146,nop,nop,sack 1 {309877:321301},mptcp dss ack 3867986439], length 0
10:18:00.167907 IP 112.26.2.1.43445 > 112.26.2.8.39903: Flags [.], seq 325585:327013, ack 1, win 4017, options [nop,nop,TS val 153713 ecr 4294907269,mptcp dss ack 1720219151 seq 3868086399 subseq 325585 len 1428 csum 0x423f], length 1428
10:18:00.168143 IP 112.26.2.1.43445 > 112.26.2.8.39903: Flags [.], seq 325585:327013, ack 1, win 4017, options [nop,nop,TS val 153713 ecr 4294907269,mptcp dss ack 1720219151 seq 3868086399 subseq 325585 len 1428 csum 0x423f], length 1428
10:18:00.173204 IP 112.26.2.8.39903 > 112.26.2.1.43445: Flags [.], ack 308449, win 24098, options [nop,nop,TS val 4294908828 ecr 152146,nop,nop,sack 1 {309877:327013},mptcp dss ack 3868006431], length 0
10:18:00.259090 IP 112.26.2.8.39903 > 112.26.2.1.43445: Flags [.], ack 308449, win 24409, options [nop,nop,TS val 4294908182 ecr 152146,nop,nop,sack 1 {309877:322729},mptcp dss ack 3867986439], length 0
10:18:00.328965 IP 112.26.2.1.43445 > 112.26.2.8.39903: Flags [.], seq 308449:309877, ack 1, win 4017, options [nop,nop,TS val 154021 ecr 4294907556,mptcp dss ack 1720219151 seq 3868006431 subseq 308449 len 1428 csum 0xb0b6], length 1428
10:18:00.329268 IP 112.26.2.1.43445 > 112.26.2.8.39903: Flags [.], seq 308449:309877, ack 1, win 4017, options [nop,nop,TS val 154021 ecr 4294907556,mptcp dss ack 1720219151 seq 3868006431 subseq 308449 len 1428 csum 0xb0b6], length 1428
10:18:00.334877 IP 112.26.2.8.39903 > 112.26.2.1.43445: Flags [.], ack 327013, win 23764, options [nop,nop,TS val 4294908989 ecr 154021,mptcp dss ack 3868032135], length 0
10:18:00.431405 IP 112.26.2.1.43445 > 112.26.2.8.39903: Flags [.], seq 328441:329869, ack 1, win 4017, options [nop,nop,TS val 154069 ecr 4294907556,mptcp dss ack 1720219151 seq 3868099251 subseq 328441 len 1428 csum 0x8aa5], length 1428
10:18:00.431728 IP 112.26.2.1.43445 > 112.26.2.8.39903: Flags [.], seq 328441:329869, ack 1, win 4017, options [nop,nop,TS val 154069 ecr 4294907556,mptcp dss ack 1720219151 seq 3868099251 subseq 328441 len 1428 csum 0x8aa5], length 1428
10:18:00.435677 IP 112.26.2.8.39903 > 112.26.2.1.43445: Flags [.], ack 327013, win 24030, options [nop,nop,TS val 4294909090 ecr 154021,nop,nop,sack 1 {328441:329869},mptcp dss ack 3868032135], length 0
10:18:00.544039 IP 112.26.2.1.43445 > 112.26.2.8.39903: Flags [.], seq 329869:331297, ack 1, win 4017, options [nop,nop,TS val 154078 ecr 4294907648,mptcp dss ack 1720219151 seq 3868100679 subseq 329869 len 1428 csum 0x2bf9], length 1428
10:18:00.544384 IP 112.26.2.1.43445 > 112.26.2.8.39903: Flags [.], seq 329869:331297, ack 1, win 4017, options [nop,nop,TS val 154078 ecr 4294907648,mptcp dss ack 1720219151 seq 3868100679 subseq 329869 len 1428 csum 0x2bf9], length 1428
10:18:00.550133 IP 112.26.2.8.39903 > 112.26.2.1.43445: Flags [.], ack 327013, win 24030, options [nop,nop,TS val 4294909204 ecr 154021,nop,nop,sack 1 {328441:331297},mptcp dss ack 3868032135], length 0
10:18:00.632542 IP 112.26.2.1.43445 > 112.26.2.8.39903: Flags [.], seq 331297:332725, ack 1, win 4017, options [nop,nop,TS val 154248 ecr 4294907835,mptcp dss ack 1720219151 seq 3868106391 subseq 331297 len 1428 csum 0x5d13], length 1428
10:18:00.632866 IP 112.26.2.1.43445 > 112.26.2.8.39903: Flags [.], seq 331297:332725, ack 1, win 4017, options [nop,nop,TS val 154248 ecr 4294907835,mptcp dss ack 1720219151 seq 3868106391 subseq 331297 len 1428 csum 0x5d13], length 1428
10:18:00.640286 IP 112.26.2.8.39903 > 112.26.2.1.43445: Flags [.], ack 327013, win 24030, options [nop,nop,TS val 4294909293 ecr 154021,nop,nop,sack 1 {328441:332725},mptcp dss ack 3868032135], length 0
10:18:00.715316 IP 112.26.2.1.43445 > 112.26.2.8.39903: Flags [.], seq 332725:334153, ack 1, win 4017, options [nop,nop,TS val 154289 ecr 4294907901,mptcp dss ack 1720219151 seq 3868107819 subseq 332725 len 1428 csum 0xffb9], length 1428
10:18:00.715661 IP 112.26.2.1.43445 > 112.26.2.8.39903: Flags [.], seq 332725:334153, ack 1, win 4017, options [nop,nop,TS val 154289 ecr 4294907901,mptcp dss ack 1720219151 seq 3868107819 subseq 332725 len 1428 csum 0xffb9], length 1428
10:18:00.752495 IP 112.26.2.8.39903 > 112.26.2.1.43445: Flags [.], ack 327013, win 24009, options [nop,nop,TS val 4294909407 ecr 154021,nop,nop,sack 1 {328441:334153},mptcp dss ack 3868047843], length 0
10:18:00.785075 IP 112.26.2.8.39903 > 112.26.2.1.43445: Flags [.], ack 308449, win 24276, options [nop,nop,TS val 4294908728 ecr 152146,nop,nop,sack 1 {309877:325585},mptcp dss ack 3867995007], length 0
10:18:00.838110 IP 112.26.2.8.39903 > 112.26.2.1.43445: Flags [.], ack 308449, win 24098, options [nop,nop,TS val 4294908828 ecr 152146,nop,nop,sack 1 {309877:327013},mptcp dss ack 3868006431], length 0
10:18:00.933053 IP 112.26.2.8.39903 > 112.26.2.1.43445: Flags [.], ack 327013, win 23764, options [nop,nop,TS val 4294908989 ecr 154021,mptcp dss ack 3868032135], length 0
10:18:01.013179 IP 112.26.2.8.39903 > 112.26.2.1.43445: Flags [.], ack 327013, win 24030, options [nop,nop,TS val 4294909090 ecr 154021,nop,nop,sack 1 {328441:329869},mptcp dss ack 3868032135], length 0
10:18:01.038293 IP 112.26.2.8.39903 > 112.26.2.1.43445: Flags [.], ack 327013, win 24030, options [nop,nop,TS val 4294909204 ecr 154021,nop,nop,sack 1 {328441:331297},mptcp dss ack 3868032135], length 0
10:18:01.098746 IP 112.26.2.8.39903 > 112.26.2.1.43445: Flags [.], ack 327013, win 24030, options [nop,nop,TS val 4294909293 ecr 154021,nop,nop,sack 1 {328441:332725},mptcp dss ack 3868032135], length 0
10:18:01.188552 IP 112.26.2.8.39903 > 112.26.2.1.43445: Flags [.], ack 327013, win 24009, options [nop,nop,TS val 4294909407 ecr 154021,nop,nop,sack 1 {328441:334153},mptcp dss ack 3868047843], length 0
10:18:01.234356 IP 112.26.2.1.43445 > 112.26.2.8.39903: Flags [.], seq 334153:335581, ack 1, win 4017, options [nop,nop,TS val 155172 ecr 4294908728,mptcp dss ack 1720219151 seq 3868152087 subseq 334153 len 1428 csum 0x116d], length 1428
10:18:01.234806 IP 112.26.2.1.43445 > 112.26.2.8.39903: Flags [.], seq 334153:335581, ack 1, win 4017, options [nop,nop,TS val 155172 ecr 4294908728,mptcp dss ack 1720219151 seq 3868152087 subseq 334153 len 1428 csum 0x116d], length 1428
10:18:01.249500 IP 112.26.2.8.39903 > 112.26.2.1.43445: Flags [.], ack 327013, win 24107, options [nop,nop,TS val 4294909893 ecr 154021,nop,nop,sack 1 {328441:335581},mptcp dss ack 3868073547], length 0
10:18:01.346433 IP 112.26.2.1.43445 > 112.26.2.8.39903: Flags [.], seq 335581:337009, ack 1, win 4017, options [nop,nop,TS val 155172 ecr 4294908728,mptcp dss ack 1720219151 seq 3868153515 subseq 335581 len 1428 csum 0x62], length 1428
10:18:01.346848 IP 112.26.2.1.43445 > 112.26.2.8.39903: Flags [.], seq 335581:337009, ack 1, win 4017, options [nop,nop,TS val 155172 ecr 4294908728,mptcp dss ack 1720219151 seq 3868153515 subseq 335581 len 1428 csum 0x62], length 1428
10:18:01.351416 IP 112.26.2.8.39903 > 112.26.2.1.43445: Flags [.], ack 327013, win 24107, options [nop,nop,TS val 4294910006 ecr 154021,nop,nop,sack 1 {328441:337009},mptcp dss ack 3868073547], length 0
10:18:01.435172 IP 112.26.2.1.43445 > 112.26.2.8.39903: Flags [.], seq 337009:338437, ack 1, win 4017, options [nop,nop,TS val 155278 ecr 4294908828,mptcp dss ack 1720219151 seq 3868166367 subseq 337009 len 1428 csum 0xa5e2], length 1428
10:18:01.435438 IP 112.26.2.1.43445 > 112.26.2.8.39903: Flags [.], seq 337009:338437, ack 1, win 4017, options [nop,nop,TS val 155278 ecr 4294908828,mptcp dss ack 1720219151 seq 3868166367 subseq 337009 len 1428 csum 0xa5e2], length 1428
10:18:01.457288 IP 112.26.2.8.39903 > 112.26.2.1.43445: Flags [.], ack 327013, win 24110, options [nop,nop,TS val 4294910111 ecr 154021,nop,nop,sack 1 {328441:338437},mptcp dss ack 3868087827], length 0
10:18:01.513533 IP 112.26.2.1.43445 > 112.26.2.8.39903: Flags [.], seq 327013:328441, ack 1, win 4017, options [nop,nop,TS val 155309 ecr 4294908989,mptcp dss ack 1720219151 seq 3868087827 subseq 327013 len 1428 csum 0x9456], length 1428
10:18:01.513803 IP 112.26.2.1.43445 > 112.26.2.8.39903: Flags [.], seq 327013:328441, ack 1, win 4017, options [nop,nop,TS val 155309 ecr 4294908989,mptcp dss ack 1720219151 seq 3868087827 subseq 327013 len 1428 csum 0x9456], length 1428
10:18:01.567356 IP 112.26.2.8.39903 > 112.26.2.1.43445: Flags [.], ack 338437, win 23972, options [nop,nop,TS val 4294910221 ecr 155309,mptcp dss ack 3868133523], length 0
10:18:01.622873 IP 112.26.2.1.43445 > 112.26.2.8.39903: Flags [.], seq 338437:339865, ack 1, win 4017, options [nop,nop,TS val 155309 ecr 4294908989,mptcp dss ack 1720219151 seq 3868169223 subseq 338437 len 1428 csum 0x94e8], length 1428
10:18:01.623173 IP 112.26.2.1.43445 > 112.26.2.8.39903: Flags [.], seq 338437:339865, ack 1, win 4017, options [nop,nop,TS val 155309 ecr 4294908989,mptcp dss ack 1720219151 seq 3868169223 subseq 338437 len 1428 csum 0x94e8], length 1428
10:18:01.664750 IP 112.26.2.8.39903 > 112.26.2.1.43445: Flags [.], ack 339865, win 24455, options [nop,nop,TS val 4294910320 ecr 155309,mptcp dss ack 3868134951], length 0
10:18:01.692561 IP 112.26.2.1.43445 > 112.26.2.8.39903: Flags [.], seq 339865:341293, ack 1, win 4017, options [nop,nop,TS val 155414 ecr 4294909090,mptcp dss ack 1720219151 seq 3868172079 subseq 339865 len 1428 csum 0x131c], length 1428
10:18:01.692979 IP 112.26.2.1.43445 > 112.26.2.8.39903: Flags [.], seq 339865:341293, ack 1, win 4017, options [nop,nop,TS val 155414 ecr 4294909090,mptcp dss ack 1720219151 seq 3868172079 subseq 339865 len 1428 csum 0x131c], length 1428
10:18:01.771492 IP 112.26.2.1.43445 > 112.26.2.8.39903: Flags [.], seq 341293:342721, ack 1, win 4017, options [nop,nop,TS val 155438 ecr 4294909204,mptcp dss ack 1720219151 seq 3868173507 subseq 341293 len 1428 csum 0x9ef8], length 1428
10:18:01.771861 IP 112.26.2.1.43445 > 112.26.2.8.39903: Flags [.], seq 341293:342721, ack 1, win 4017, options [nop,nop,TS val 155438 ecr 4294909204,mptcp dss ack 1720219151 seq 3868173507 subseq 341293 len 1428 csum 0x9ef8], length 1428
10:18:01.783459 IP 112.26.2.8.39903 > 112.26.2.1.43445: Flags [.], ack 341293, win 24455, options [nop,nop,TS val 4294910388 ecr 155414,mptcp dss ack 3868134951], length 0
10:18:01.861383 IP 112.26.2.1.43445 > 112.26.2.8.39903: Flags [.], seq 342721:344149, ack 1, win 4017, options [nop,nop,TS val 155484 ecr 4294909293,mptcp dss ack 1720219151 seq 3868182075 subseq 342721 len 1428 csum 0x2b14], length 1428
10:18:01.861658 IP 112.26.2.1.43445 > 112.26.2.8.39903: Flags [.], seq 342721:344149, ack 1, win 4017, options [nop,nop,TS val 155484 ecr 4294909293,mptcp dss ack 1720219151 seq 3868182075 subseq 342721 len 1428 csum 0x2b14], length 1428
10:18:01.889080 IP 112.26.2.8.39903 > 112.26.2.1.43445: Flags [.], ack 342721, win 24455, options [nop,nop,TS val 4294910491 ecr 155438,mptcp dss ack 3868134951], length 0
10:18:01.908158 IP 112.26.2.8.39903 > 112.26.2.1.43445: Flags [.], ack 327013, win 24107, options [nop,nop,TS val 4294909893 ecr 154021,nop,nop,sack 1 {328441:335581},mptcp dss ack 3868073547], length 0
10:18:01.961500 IP 112.26.2.8.39903 > 112.26.2.1.43445: Flags [.], ack 344149, win 24455, options [nop,nop,TS val 4294910594 ecr 155484,mptcp dss ack 3868134951], length 0
10:18:02.010985 IP 112.26.2.1.43445 > 112.26.2.8.39903: Flags [.], seq 344149:345577, ack 1, win 4017, options [nop,nop,TS val 155571 ecr 4294909407,mptcp dss ack 1720219151 seq 3868186359 subseq 344149 len 1428 csum 0xeb82], length 1428
10:18:02.011365 IP 112.26.2.1.43445 > 112.26.2.8.39903: Flags [.], seq 344149:345577, ack 1, win 4017, options [nop,nop,TS val 155571 ecr 4294909407,mptcp dss ack 1720219151 seq 3868186359 subseq 344149 len 1428 csum 0xeb82], length 1428
10:18:02.022938 IP 112.26.2.8.39903 > 112.26.2.1.43445: Flags [.], ack 345577, win 24455, options [nop,nop,TS val 4294910678 ecr 155571,mptcp dss ack 3868134951], length 0
10:18:02.145933 IP 112.26.2.8.39903 > 112.26.2.1.43445: Flags [.], ack 327013, win 24107, options [nop,nop,TS val 4294910006 ecr 154021,nop,nop,sack 1 {328441:337009},mptcp dss ack 3868073547], length 0
10:18:02.198072 IP 112.26.2.8.39903 > 112.26.2.1.43445: Flags [.], ack 327013, win 24110, options [nop,nop,TS val 4294910111 ecr 154021,nop,nop,sack 1 {328441:338437},mptcp dss ack 3868087827], length 0
10:18:02.271973 IP 112.26.2.8.39903 > 112.26.2.1.43445: Flags [.], ack 338437, win 23972, options [nop,nop,TS val 4294910221 ecr 155309,mptcp dss ack 3868133523], length 0
10:18:02.376007 IP 112.26.2.8.39903 > 112.26.2.1.43445: Flags [.], ack 339865, win 24455, options [nop,nop,TS val 4294910320 ecr 155309,mptcp dss ack 3868134951], length 0
10:18:02.451039 IP 112.26.2.8.39903 > 112.26.2.1.43445: Flags [.], ack 341293, win 24455, options [nop,nop,TS val 4294910388 ecr 155414,mptcp dss ack 3868134951], length 0
10:18:02.493678 IP 112.26.2.8.39903 > 112.26.2.1.43445: Flags [.], ack 342721, win 24455, options [nop,nop,TS val 4294910491 ecr 155438,mptcp dss ack 3868134951], length 0
10:18:02.580909 IP 112.26.2.1.43445 > 112.26.2.8.39903: Flags [.], seq 345577:347005, ack 1, win 4017, options [nop,nop,TS val 156322 ecr 4294909893,mptcp dss ack 1720219151 seq 3868209207 subseq 345577 len 1428 csum 0xe9f3], length 1428
10:18:02.581227 IP 112.26.2.1.43445 > 112.26.2.8.39903: Flags [.], seq 345577:347005, ack 1, win 4017, options [nop,nop,TS val 156322 ecr 4294909893,mptcp dss ack 1720219151 seq 3868209207 subseq 345577 len 1428 csum 0xe9f3], length 1428
10:18:02.613967 IP 112.26.2.8.39903 > 112.26.2.1.43445: Flags [.], ack 347005, win 24231, options [nop,nop,TS val 4294911241 ecr 156322,mptcp dss ack 3868160655], length 0
10:18:02.675580 IP 112.26.2.8.39903 > 112.26.2.1.43445: Flags [.], ack 344149, win 24455, options [nop,nop,TS val 4294910594 ecr 155484,mptcp dss ack 3868134951], length 0
10:18:02.764549 IP 112.26.2.8.39903 > 112.26.2.1.43445: Flags [.], ack 345577, win 24455, options [nop,nop,TS val 4294910678 ecr 155571,mptcp dss ack 3868134951], length 0
10:18:02.822672 IP 112.26.2.1.43445 > 112.26.2.8.39903: Flags [.], seq 347005:348433, ack 1, win 4017, options [nop,nop,TS val 156553 ecr 4294910006,mptcp dss ack 1720219151 seq 3868222059 subseq 347005 len 1428 csum 0x6d70], length 1428
10:18:02.822933 IP 112.26.2.1.43445 > 112.26.2.8.39903: Flags [.], seq 347005:348433, ack 1, win 4017, options [nop,nop,TS val 156553 ecr 4294910006,mptcp dss ack 1720219151 seq 3868222059 subseq 347005 len 1428 csum 0x6d70], length 1428
10:18:02.827303 IP 112.26.2.8.39903 > 112.26.2.1.43445: Flags [.], ack 348433, win 24231, options [nop,nop,TS val 4294911482 ecr 156553,mptcp dss ack 3868160655], length 0
10:18:02.938207 IP 112.26.2.1.43445 > 112.26.2.8.39903: Flags [.], seq 348433:349861, ack 1, win 4017, options [nop,nop,TS val 156648 ecr 4294910111,mptcp dss ack 1720219151 seq 3868224915 subseq 348433 len 1428 csum 0x336b], length 1428
10:18:02.938546 IP 112.26.2.1.43445 > 112.26.2.8.39903: Flags [.], seq 348433:349861, ack 1, win 4017, options [nop,nop,TS val 156648 ecr 4294910111,mptcp dss ack 1720219151 seq 3868224915 subseq 348433 len 1428 csum 0x336b], length 1428
10:18:02.949245 IP 112.26.2.8.39903 > 112.26.2.1.43445: Flags [.], ack 349861, win 24231, options [nop,nop,TS val 4294911598 ecr 156648,mptcp dss ack 3868160655], length 0
10:18:03.017151 IP 112.26.2.1.43445 > 112.26.2.8.39903: Flags [.], seq 349861:351289, ack 1, win 4017, options [nop,nop,TS val 156648 ecr 4294910221,mptcp dss ack 1720219151 seq 3868226343 subseq 349861 len 1428 csum 0xd803], length 1428
10:18:03.017460 IP 112.26.2.1.43445 > 112.26.2.8.39903: Flags [.], seq 349861:351289, ack 1, win 4017, options [nop,nop,TS val 156648 ecr 4294910221,mptcp dss ack 1720219151 seq 3868226343 subseq 349861 len 1428 csum 0xd803], length 1428
10:18:03.049995 IP 112.26.2.8.39903 > 112.26.2.1.43445: Flags [.], ack 351289, win 24231, options [nop,nop,TS val 4294911701 ecr 156648,mptcp dss ack 3868160655], length 0
10:18:03.110266 IP 112.26.2.1.43445 > 112.26.2.8.39903: Flags [.], seq 351289:352717, ack 1, win 4017, options [nop,nop,TS val 156752 ecr 4294910320,mptcp dss ack 1720219151 seq 3868239195 subseq 351289 len 1428 csum 0xf333], length 1428
10:18:03.110586 IP 112.26.2.1.43445 > 112.26.2.8.39903: Flags [.], seq 351289:352717, ack 1, win 4017, options [nop,nop,TS val 156752 ecr 4294910320,mptcp dss ack 1720219151 seq 3868239195 subseq 351289 len 1428 csum 0xf333], length 1428
10:18:03.146565 IP 112.26.2.8.39903 > 112.26.2.1.43445: Flags [.], ack 352717, win 24231, options [nop,nop,TS val 4294911771 ecr 156752,mptcp dss ack 3868160655], length 0
10:18:03.218331 IP 112.26.2.1.43445 > 112.26.2.8.39903: Flags [.], seq 352717:354145, ack 1, win 4017, options [nop,nop,TS val 156752 ecr 4294910320,mptcp dss ack 1720219151 seq 3868240623 subseq 352717 len 1428 csum 0x41ff], length 1428
10:18:03.218654 IP 112.26.2.1.43445 > 112.26.2.8.39903: Flags [.], seq 352717:354145, ack 1, win 4017, options [nop,nop,TS val 156752 ecr 4294910320,mptcp dss ack 1720219151 seq 3868240623 subseq 352717 len 1428 csum 0x41ff], length 1428
10:18:03.245606 IP 112.26.2.8.39903 > 112.26.2.1.43445: Flags [.], ack 354145, win 24231, options [nop,nop,TS val 4294911880 ecr 156752,mptcp dss ack 3868160655], length 0
10:18:03.278384 IP 112.26.2.8.39903 > 112.26.2.1.43445: Flags [.], ack 347005, win 24231, options [nop,nop,TS val 4294911241 ecr 156322,mptcp dss ack 3868160655], length 0
10:18:03.374217 IP 112.26.2.1.43445 > 112.26.2.8.39903: Flags [.], seq 354145:355573, ack 1, win 4017, options [nop,nop,TS val 156827 ecr 4294910388,mptcp dss ack 1720219151 seq 3868243479 subseq 354145 len 1428 csum 0x9fa6], length 1428
10:18:03.374528 IP 112.26.2.1.43445 > 112.26.2.8.39903: Flags [.], seq 354145:355573, ack 1, win 4017, options [nop,nop,TS val 156827 ecr 4294910388,mptcp dss ack 1720219151 seq 3868243479 subseq 354145 len 1428 csum 0x9fa6], length 1428
10:18:03.381422 IP 112.26.2.8.39903 > 112.26.2.1.43445: Flags [.], ack 355573, win 24231, options [nop,nop,TS val 4294912034 ecr 156827,mptcp dss ack 3868160655], length 0
10:18:03.460734 IP 112.26.2.1.43445 > 112.26.2.8.39903: Flags [.], seq 357001:358429, ack 1, win 4017, options [nop,nop,TS val 157051 ecr 4294910594,mptcp dss ack 1720219151 seq 3868257759 subseq 357001 len 1428 csum 0xe044], length 1428
10:18:03.460933 IP 112.26.2.1.43445 > 112.26.2.8.39903: Flags [.], seq 357001:358429, ack 1, win 4017, options [nop,nop,TS val 157051 ecr 4294910594,mptcp dss ack 1720219151 seq 3868257759 subseq 357001 len 1428 csum 0xe044], length 1428
10:18:03.468183 IP 112.26.2.8.39903 > 112.26.2.1.43445: Flags [.], ack 355573, win 24231, options [nop,nop,TS val 4294912122 ecr 156827,nop,nop,sack 1 {357001:358429},mptcp dss ack 3868160655], length 0
10:18:03.563193 IP 112.26.2.1.43445 > 112.26.2.8.39903: Flags [.], seq 358429:359857, ack 1, win 4017, options [nop,nop,TS val 157051 ecr 4294910594,mptcp dss ack 1720219151 seq 3868259187 subseq 358429 len 1428 csum 0xf087], length 1428
10:18:03.563403 IP 112.26.2.1.43445 > 112.26.2.8.39903: Flags [.], seq 358429:359857, ack 1, win 4017, options [nop,nop,TS val 157051 ecr 4294910594,mptcp dss ack 1720219151 seq 3868259187 subseq 358429 len 1428 csum 0xf087], length 1428
10:18:03.584934 IP 112.26.2.8.39903 > 112.26.2.1.43445: Flags [.], ack 355573, win 24231, options [nop,nop,TS val 4294912222 ecr 156827,nop,nop,sack 1 {357001:359857},mptcp dss ack 3868160655], length 0
10:18:03.634651 IP 112.26.2.8.39903 > 112.26.2.1.43445: Flags [.], ack 348433, win 24231, options [nop,nop,TS val 4294911482 ecr 156553,mptcp dss ack 3868160655], length 0
10:18:03.695894 IP 112.26.2.8.39903 > 112.26.2.1.43445: Flags [.], ack 349861, win 24231, options [nop,nop,TS val 4294911598 ecr 156648,mptcp dss ack 3868160655], length 0
10:18:03.734656 IP 112.26.2.8.39903 > 112.26.2.1.43445: Flags [.], ack 351289, win 24231, options [nop,nop,TS val 4294911701 ecr 156648,mptcp dss ack 3868160655], length 0
10:18:03.777840 IP 112.26.2.8.39903 > 112.26.2.1.43445: Flags [.], ack 352717, win 24231, options [nop,nop,TS val 4294911771 ecr 156752,mptcp dss ack 3868160655], length 0
10:18:03.832225 IP 112.26.2.8.39903 > 112.26.2.1.43445: Flags [.], ack 354145, win 24231, options [nop,nop,TS val 4294911880 ecr 156752,mptcp dss ack 3868160655], length 0
10:18:03.909237 IP 112.26.2.1.43445 > 112.26.2.8.39903: Flags [.], seq 361285:362713, ack 1, win 4017, options [nop,nop,TS val 157654 ecr 4294911241,mptcp dss ack 1720219151 seq 3868286319 subseq 361285 len 1428 csum 0xa3d2], length 1428
10:18:03.909547 IP 112.26.2.1.43445 > 112.26.2.8.39903: Flags [.], seq 361285:362713, ack 1, win 4017, options [nop,nop,TS val 157654 ecr 4294911241,mptcp dss ack 1720219151 seq 3868286319 subseq 361285 len 1428 csum 0xa3d2], length 1428
10:18:03.927613 IP 112.26.2.8.39903 > 112.26.2.1.43445: Flags [.], ack 355573, win 24231, options [nop,nop,TS val 4294912581 ecr 156827,nop,nop,sack 2 {361285:362713}{357001:359857},mptcp dss ack 3868160655], length 0
10:18:04.014870 IP 112.26.2.8.39903 > 112.26.2.1.43445: Flags [.], ack 355573, win 24231, options [nop,nop,TS val 4294912034 ecr 156827,mptcp dss ack 3868160655], length 0
10:18:04.069803 IP 112.26.2.8.39903 > 112.26.2.1.43445: Flags [.], ack 355573, win 24231, options [nop,nop,TS val 4294912122 ecr 156827,nop,nop,sack 1 {357001:358429},mptcp dss ack 3868160655], length 0
10:18:04.170876 IP 112.26.2.8.39903 > 112.26.2.1.43445: Flags [.], ack 355573, win 24231, options [nop,nop,TS val 4294912222 ecr 156827,nop,nop,sack 1 {357001:359857},mptcp dss ack 3868160655], length 0
10:18:04.206531 IP 112.26.2.1.43445 > 112.26.2.8.39903: Flags [.], seq 362713:364141, ack 1, win 4017, options [nop,nop,TS val 158010 ecr 4294911482,mptcp dss ack 1720219151 seq 3868292031 subseq 362713 len 1428 csum 0xe8a8], length 1428
10:18:04.206828 IP 112.26.2.1.43445 > 112.26.2.8.39903: Flags [.], seq 362713:364141, ack 1, win 4017, options [nop,nop,TS val 158010 ecr 4294911482,mptcp dss ack 1720219151 seq 3868292031 subseq 362713 len 1428 csum 0xe8a8], length 1428
10:18:04.212805 IP 112.26.2.8.39903 > 112.26.2.1.43445: Flags [.], ack 355573, win 24231, options [nop,nop,TS val 4294912865 ecr 156827,nop,nop,sack 2 {361285:364141}{357001:359857},mptcp dss ack 3868160655], length 0
10:18:04.319308 IP 112.26.2.1.43445 > 112.26.2.8.39903: Flags [.], seq 364141:365569, ack 1, win 4017, options [nop,nop,TS val 158071 ecr 4294911598,mptcp dss ack 1720219151 seq 3868294887 subseq 364141 len 1428 csum 0x1147], length 1428
10:18:04.319667 IP 112.26.2.1.43445 > 112.26.2.8.39903: Flags [.], seq 364141:365569, ack 1, win 4017, options [nop,nop,TS val 158071 ecr 4294911598,mptcp dss ack 1720219151 seq 3868294887 subseq 364141 len 1428 csum 0x1147], length 1428
10:18:04.325454 IP 112.26.2.8.39903 > 112.26.2.1.43445: Flags [.], ack 355573, win 24231, options [nop,nop,TS val 4294912979 ecr 156827,nop,nop,sack 2 {361285:365569}{357001:359857},mptcp dss ack 3868160655], length 0
10:18:04.412275 IP 112.26.2.1.43445 > 112.26.2.8.39903: Flags [.], seq 365569:366997, ack 1, win 4017, options [nop,nop,TS val 158110 ecr 4294911701,mptcp dss ack 1720219151 seq 3868302027 subseq 365569 len 1428 csum 0x5f16], length 1428
10:18:04.412635 IP 112.26.2.1.43445 > 112.26.2.8.39903: Flags [.], seq 365569:366997, ack 1, win 4017, options [nop,nop,TS val 158110 ecr 4294911701,mptcp dss ack 1720219151 seq 3868302027 subseq 365569 len 1428 csum 0x5f16], length 1428
10:18:04.439387 IP 112.26.2.8.39903 > 112.26.2.1.43445: Flags [.], ack 355573, win 24231, options [nop,nop,TS val 4294913088 ecr 156827,nop,nop,sack 2 {361285:366997}{357001:359857},mptcp dss ack 3868160655], length 0
10:18:04.502355 IP 112.26.2.1.43445 > 112.26.2.8.39903: Flags [.], seq 366997:368425, ack 1, win 4017, options [nop,nop,TS val 158110 ecr 4294911701,mptcp dss ack 1720219151 seq 3868303455 subseq 366997 len 1428 csum 0x4a7a], length 1428
10:18:04.502637 IP 112.26.2.1.43445 > 112.26.2.8.39903: Flags [.], seq 366997:368425, ack 1, win 4017, options [nop,nop,TS val 158110 ecr 4294911701,mptcp dss ack 1720219151 seq 3868303455 subseq 366997 len 1428 csum 0x4a7a], length 1428
10:18:04.512979 IP 112.26.2.8.39903 > 112.26.2.1.43445: Flags [.], ack 355573, win 24231, options [nop,nop,TS val 4294913168 ecr 156827,nop,nop,sack 2 {361285:368425}{357001:359857},mptcp dss ack 3868160655], length 0
10:18:04.580587 IP 112.26.2.8.39903 > 112.26.2.1.43445: Flags [.], ack 355573, win 24231, options [nop,nop,TS val 4294912581 ecr 156827,nop,nop,sack 2 {361285:362713}{357001:359857},mptcp dss ack 3868160655], length 0
10:18:04.614448 IP 112.26.2.1.43445 > 112.26.2.8.39903: Flags [.], seq 368425:369853, ack 1, win 4017, options [nop,nop,TS val 158153 ecr 4294911771,mptcp dss ack 1720219151 seq 3868306311 subseq 368425 len 1428 csum 0x3734], length 1428
10:18:04.614689 IP 112.26.2.1.43445 > 112.26.2.8.39903: Flags [.], seq 368425:369853, ack 1, win 4017, options [nop,nop,TS val 158153 ecr 4294911771,mptcp dss ack 1720219151 seq 3868306311 subseq 368425 len 1428 csum 0x3734], length 1428
10:18:04.632444 IP 112.26.2.8.39903 > 112.26.2.1.43445: Flags [.], ack 355573, win 24231, options [nop,nop,TS val 4294913273 ecr 156827,nop,nop,sack 2 {361285:369853}{357001:359857},mptcp dss ack 3868160655], length 0
10:18:04.726316 IP 112.26.2.1.43445 > 112.26.2.8.39903: Flags [.], seq 369853:371281, ack 1, win 4017, options [nop,nop,TS val 158208 ecr 4294911880,mptcp dss ack 1720219151 seq 3868307739 subseq 369853 len 1428 csum 0xe232], length 1428
10:18:04.726650 IP 112.26.2.1.43445 > 112.26.2.8.39903: Flags [.], seq 369853:371281, ack 1, win 4017, options [nop,nop,TS val 158208 ecr 4294911880,mptcp dss ack 1720219151 seq 3868307739 subseq 369853 len 1428 csum 0xe232], length 1428
10:18:04.730719 IP 112.26.2.8.39903 > 112.26.2.1.43445: Flags [.], ack 355573, win 24231, options [nop,nop,TS val 4294913385 ecr 156827,nop,nop,sack 2 {361285:371281}{357001:359857},mptcp dss ack 3868160655], length 0
10:18:04.777973 IP 112.26.2.1.43445 > 112.26.2.8.39903: Flags [.], seq 371281:372709, ack 1, win 4017, options [nop,nop,TS val 158390 ecr 4294912034,mptcp dss ack 1720219151 seq 3868310595 subseq 371281 len 1428 csum 0x1c57], length 1428
10:18:04.778299 IP 112.26.2.1.43445 > 112.26.2.8.39903: Flags [.], seq 371281:372709, ack 1, win 4017, options [nop,nop,TS val 158390 ecr 4294912034,mptcp dss ack 1720219151 seq 3868310595 subseq 371281 len 1428 csum 0x1c57], length 1428
10:18:04.805316 IP 112.26.2.8.39903 > 112.26.2.1.43445: Flags [.], ack 355573, win 24231, options [nop,nop,TS val 4294913446 ecr 156827,nop,nop,sack 2 {361285:372709}{357001:359857},mptcp dss ack 3868160655], length 0
10:18:04.882733 IP 112.26.2.8.39903 > 112.26.2.1.43445: Flags [.], ack 355573, win 24231, options [nop,nop,TS val 4294912865 ecr 156827,nop,nop,sack 2 {361285:364141}{357001:359857},mptcp dss ack 3868160655], length 0
10:18:04.951791 IP 112.26.2.1.43445 > 112.26.2.8.39903: Flags [.], seq 374137:375565, ack 1, win 4017, options [nop,nop,TS val 158619 ecr 4294912222,mptcp dss ack 1720219151 seq 3868330587 subseq 374137 len 1428 csum 0x1187], length 1428
10:18:04.952067 IP 112.26.2.1.43445 > 112.26.2.8.39903: Flags [.], seq 374137:375565, ack 1, win 4017, options [nop,nop,TS val 158619 ecr 4294912222,mptcp dss ack 1720219151 seq 3868330587 subseq 374137 len 1428 csum 0x1187], length 1428
10:18:04.959080 IP 112.26.2.8.39903 > 112.26.2.1.43445: Flags [.], ack 355573, win 24209, options [nop,nop,TS val 4294913611 ecr 156827,nop,nop,sack 2 {374137:375565}{361285:372709},mptcp dss ack 3868162083], length 0
10:18:05.021111 IP 112.26.2.8.39903 > 112.26.2.1.43445: Flags [.], ack 355573, win 24231, options [nop,nop,TS val 4294912979 ecr 156827,nop,nop,sack 2 {361285:365569}{357001:359857},mptcp dss ack 3868160655], length 0
10:18:05.089808 IP 112.26.2.8.39903 > 112.26.2.1.43445: Flags [.], ack 355573, win 24231, options [nop,nop,TS val 4294913088 ecr 156827,nop,nop,sack 2 {361285:366997}{357001:359857},mptcp dss ack 3868160655], length 0
10:18:05.142602 IP 112.26.2.1.43445 > 112.26.2.8.39903: Flags [.], seq 355573:357001, ack 1, win 4017, options [nop,nop,TS val 158840 ecr 4294912222,mptcp dss ack 1720219151 seq 3868244907 subseq 355573 len 1428 csum 0x9370], length 1428
10:18:05.142921 IP 112.26.2.1.43445 > 112.26.2.8.39903: Flags [.], seq 355573:357001, ack 1, win 4017, options [nop,nop,TS val 158840 ecr 4294912222,mptcp dss ack 1720219151 seq 3868244907 subseq 355573 len 1428 csum 0x9370], length 1428
10:18:05.146950 IP 112.26.2.8.39903 > 112.26.2.1.43445: Flags [.], ack 359857, win 24209, options [nop,nop,TS val 4294913802 ecr 158840,nop,nop,sack 2 {374137:375565}{361285:372709},mptcp dss ack 3868162083], length 0
10:18:05.213524 IP 112.26.2.8.39903 > 112.26.2.1.43445: Flags [.], ack 355573, win 24231, options [nop,nop,TS val 4294913168 ecr 156827,nop,nop,sack 2 {361285:368425}{357001:359857},mptcp dss ack 3868160655], length 0
