10:17:24.039502 IP 112.26.3.8.34701 > 112.26.3.1.43445: Flags [S], seq 1370810105, win 65535, options [mss 1460,sackOK,TS val 4294872456 ecr 0,nop,wscale 6,mptcp join id 5 token 0x1271d1f5 nonce 0x25c1fb65], length 0
10:17:24.078046 IP 112.26.3.1.43445 > 112.26.3.8.34701: Flags [S.], seq 3026531369, ack 1370810106, win 65535, options [mss 1460,sackOK,TS val 118416 ecr 4294872456,nop,wscale 6,mptcp join id 5 hmac 0xd0dcf5de2e2332d4 nonce 0xa09f8924], length 0
10:17:24.167547 IP 112.26.3.1.43445 > 112.26.3.8.34701: Flags [S.], seq 3026531369, ack 1370810106, win 65535, options [mss 1460,sackOK,TS val 118416 ecr 4294872456,nop,wscale 6,mptcp join id 5 hmac 0xd0dcf5de2e2332d4 nonce 0xa09f8924], length 0
10:17:24.208029 IP 112.26.3.1.43445 > 112.26.3.8.34701: Flags [S.], seq 3026531369, ack 1370810106, win 65535, options [mss 1460,sackOK,TS val 118416 ecr 4294872456,nop,wscale 6,mptcp join id 5 hmac 0xd0dcf5de2e2332d4 nonce 0xa09f8924], length 0
10:17:24.309275 IP 112.26.3.8.34701 > 112.26.3.1.43445: Flags [.], ack 1, win 7848, options [nop,nop,TS val 4294872867 ecr 118416,mptcp join hmac 0x791756dfc3e442c8c54dbd511ad3c1190c151802], length 0
10:17:24.316011 IP 112.26.3.1.43445 > 112.26.3.8.34701: Flags [.], ack 1, win 4017, options [nop,nop,TS val 118685 ecr 4294872867,mptcp dss ack 1720219151], length 0
10:17:24.316280 IP 112.26.3.1.43445 > 112.26.3.8.34701: Flags [.], ack 1, win 4017, options [nop,nop,TS val 118685 ecr 4294872867,mptcp dss ack 1720219151], length 0
10:18:04.106228 IP 112.26.3.8.34701 > 112.26.3.1.43445: Flags [.], ack 539785, win 24231, options [nop,nop,TS val 4294912302 ecr 157399,mptcp dss ack 3868160655], length 0
10:18:04.109792 IP 112.26.3.1.43445 > 112.26.3.8.34701: Flags [.], seq 552637:554065, ack 1, win 4017, options [nop,nop,TS val 158482 ecr 4294912302,mptcp dss ack 1720219151 seq 3868316307 subseq 552637 len 1428 csum 0x8dca], length 1428
10:18:04.110008 IP 112.26.3.1.43445 > 112.26.3.8.34701: Flags [.], seq 552637:554065, ack 1, win 4017, options [nop,nop,TS val 158482 ecr 4294912302,mptcp dss ack 1720219151 seq 3868316307 subseq 552637 len 1428 csum 0x8dca], length 1428
10:18:04.140141 IP 112.26.3.1.43445 > 112.26.3.8.34701: Flags [.], seq 546925:548353, ack 1, win 4017, options [nop,nop,TS val 158060 ecr 4294911975,mptcp dss ack 1720219151 seq 3868293459 subseq 546925 len 1428 csum 0x5e0e], length 1428
10:18:04.169346 IP 112.26.3.1.43445 > 112.26.3.8.34701: Flags [.], seq 554065:555493, ack 1, win 4017, options [nop,nop,TS val 158482 ecr 4294912302,mptcp dss ack 1720219151 seq 3868317735 subseq 554065 len 1428 csum 0xd5f3], length 1428
10:18:04.169540 IP 112.26.3.1.43445 > 112.26.3.8.34701: Flags [.], seq 554065:555493, ack 1, win 4017, options [nop,nop,TS val 158482 ecr 4294912302,mptcp dss ack 1720219151 seq 3868317735 subseq 554065 len 1428 csum 0xd5f3], length 1428
10:18:04.201259 IP 112.26.3.1.43445 > 112.26.3.8.34701: Flags [.], seq 548353:549781, ack 1, win 4017, options [nop,nop,TS val 158134 ecr 4294912058,mptcp dss ack 1720219151 seq 3868304883 subseq 548353 len 1428 csum 0xdc7c], length 1428
10:18:04.243345 IP 112.26.3.8.34701 > 112.26.3.1.43445: Flags [.], ack 541213, win 24231, options [nop,nop,TS val 4294912462 ecr 157517,mptcp dss ack 3868160655], length 0
10:18:04.246474 IP 112.26.3.1.43445 > 112.26.3.8.34701: Flags [.], seq 555493:556921, ack 1, win 4017, options [nop,nop,TS val 158619 ecr 4294912462,mptcp dss ack 1720219151 seq 3868332015 subseq 555493 len 1428 csum 0xb2c5], length 1428
10:18:04.246685 IP 112.26.3.1.43445 > 112.26.3.8.34701: Flags [.], seq 555493:556921, ack 1, win 4017, options [nop,nop,TS val 158619 ecr 4294912462,mptcp dss ack 1720219151 seq 3868332015 subseq 555493 len 1428 csum 0xb2c5], length 1428
10:18:04.289399 IP 112.26.3.1.43445 > 112.26.3.8.34701: Flags [.], seq 549781:551209, ack 1, win 4017, options [nop,nop,TS val 158262 ecr 4294912137,mptcp dss ack 1720219151 seq 3868309167 subseq 549781 len 1428 csum 0xfe62], length 1428
10:18:04.300865 IP 112.26.3.8.34701 > 112.26.3.1.43445: Flags [.], ack 544069, win 24231, options [nop,nop,TS val 4294912576 ecr 157597,mptcp dss ack 3868160655], length 0
10:18:04.306175 IP 112.26.3.1.43445 > 112.26.3.8.34701: Flags [.], seq 556921:558349, ack 1, win 4017, options [nop,nop,TS val 158677 ecr 4294912576,mptcp dss ack 1720219151 seq 3868333443 subseq 556921 len 1428 csum 0x7333], length 1428
10:18:04.306384 IP 112.26.3.1.43445 > 112.26.3.8.34701: Flags [.], seq 556921:558349, ack 1, win 4017, options [nop,nop,TS val 158677 ecr 4294912576,mptcp dss ack 1720219151 seq 3868333443 subseq 556921 len 1428 csum 0x7333], length 1428
10:18:04.387631 IP 112.26.3.8.34701 > 112.26.3.1.43445: Flags [.], ack 546925, win 24231, options [nop,nop,TS val 4294912784 ecr 157823,mptcp dss ack 3868160655], length 0
10:18:04.399698 IP 112.26.3.1.43445 > 112.26.3.8.34701: Flags [.], seq 558349:559777, ack 1, win 4017, options [nop,nop,TS val 158677 ecr 4294912576,mptcp dss ack 1720219151 seq 3868334871 subseq 558349 len 1428 csum 0xb06], length 1428
10:18:04.399912 IP 112.26.3.1.43445 > 112.26.3.8.34701: Flags [.], seq 558349:559777, ack 1, win 4017, options [nop,nop,TS val 158677 ecr 4294912576,mptcp dss ack 1720219151 seq 3868334871 subseq 558349 len 1428 csum 0xb06], length 1428
10:18:04.419801 IP 112.26.3.1.43445 > 112.26.3.8.34701: Flags [.], seq 551209:552637, ack 1, win 4017, options [nop,nop,TS val 158397 ecr 4294912211,mptcp dss ack 1720219151 seq 3868312023 subseq 551209 len 1428 csum 0xf605], length 1428
10:18:04.480708 IP 112.26.3.1.43445 > 112.26.3.8.34701: Flags [.], seq 559777:561205, ack 1, win 4017, options [nop,nop,TS val 158764 ecr 4294912784,mptcp dss ack 1720219151 seq 3868336299 subseq 559777 len 1428 csum 0x6034], length 1428
10:18:04.480920 IP 112.26.3.1.43445 > 112.26.3.8.34701: Flags [.], seq 559777:561205, ack 1, win 4017, options [nop,nop,TS val 158764 ecr 4294912784,mptcp dss ack 1720219151 seq 3868336299 subseq 559777 len 1428 csum 0x6034], length 1428
10:18:04.490481 IP 112.26.3.1.43445 > 112.26.3.8.34701: Flags [.], seq 552637:554065, ack 1, win 4017, options [nop,nop,TS val 158482 ecr 4294912302,mptcp dss ack 1720219151 seq 3868316307 subseq 552637 len 1428 csum 0x8dca], length 1428
10:18:04.497583 IP 112.26.3.8.34701 > 112.26.3.1.43445: Flags [.], ack 551209, win 24231, options [nop,nop,TS val 4294913016 ecr 158060,mptcp dss ack 3868160655], length 0
10:18:04.576159 IP 112.26.3.1.43445 > 112.26.3.8.34701: Flags [.], seq 554065:555493, ack 1, win 4017, options [nop,nop,TS val 158482 ecr 4294912302,mptcp dss ack 1720219151 seq 3868317735 subseq 554065 len 1428 csum 0xd5f3], length 1428
10:18:04.593292 IP 112.26.3.1.43445 > 112.26.3.8.34701: Flags [.], seq 561205:562633, ack 1, win 4017, options [nop,nop,TS val 158764 ecr 4294912784,mptcp dss ack 1720219151 seq 3868337727 subseq 561205 len 1428 csum 0x99f5], length 1428
10:18:04.593478 IP 112.26.3.1.43445 > 112.26.3.8.34701: Flags [.], seq 561205:562633, ack 1, win 4017, options [nop,nop,TS val 158764 ecr 4294912784,mptcp dss ack 1720219151 seq 3868337727 subseq 561205 len 1428 csum 0x99f5], length 1428
10:18:04.661081 IP 112.26.3.1.43445 > 112.26.3.8.34701: Flags [.], seq 555493:556921, ack 1, win 4017, options [nop,nop,TS val 158619 ecr 4294912462,mptcp dss ack 1720219151 seq 3868332015 subseq 555493 len 1428 csum 0xb2c5], length 1428
10:18:04.664388 IP 112.26.3.8.34701 > 112.26.3.1.43445: Flags [.], ack 556921, win 24231, options [nop,nop,TS val 4294913305 ecr 158397,mptcp dss ack 3868160655], length 0
10:18:04.670519 IP 112.26.3.1.43445 > 112.26.3.8.34701: Flags [.], seq 562633:564061, ack 1, win 4017, options [nop,nop,TS val 158874 ecr 4294913016,mptcp dss ack 1720219151 seq 3868257759 subseq 562633 len 1428 csum 0xbd01], length 1428
10:18:04.670717 IP 112.26.3.1.43445 > 112.26.3.8.34701: Flags [.], seq 562633:564061, ack 1, win 4017, options [nop,nop,TS val 158874 ecr 4294913016,mptcp dss ack 1720219151 seq 3868257759 subseq 562633 len 1428 csum 0xbd01], length 1428
10:18:04.756443 IP 112.26.3.1.43445 > 112.26.3.8.34701: Flags [.], seq 556921:558349, ack 1, win 4017, options [nop,nop,TS val 158677 ecr 4294912576,mptcp dss ack 1720219151 seq 3868333443 subseq 556921 len 1428 csum 0x7333], length 1428
10:18:04.758912 IP 112.26.3.1.43445 > 112.26.3.8.34701: Flags [.], seq 564061:565489, ack 1, win 4017, options [nop,nop,TS val 158874 ecr 4294913016,mptcp dss ack 1720219151 seq 3868259187 subseq 564061 len 1428 csum 0xcd44], length 1428
10:18:04.759091 IP 112.26.3.1.43445 > 112.26.3.8.34701: Flags [.], seq 564061:565489, ack 1, win 4017, options [nop,nop,TS val 158874 ecr 4294913016,mptcp dss ack 1720219151 seq 3868259187 subseq 564061 len 1428 csum 0xcd44], length 1428
10:18:04.794720 IP 112.26.3.1.43445 > 112.26.3.8.34701: Flags [.], seq 565489:566917, ack 1, win 4017, options [nop,nop,TS val 158874 ecr 4294913016,mptcp dss ack 1720219151 seq 3868263471 subseq 565489 len 1428 csum 0xede2], length 1428
10:18:04.794901 IP 112.26.3.1.43445 > 112.26.3.8.34701: Flags [.], seq 565489:566917, ack 1, win 4017, options [nop,nop,TS val 158874 ecr 4294913016,mptcp dss ack 1720219151 seq 3868263471 subseq 565489 len 1428 csum 0xede2], length 1428
10:18:04.809923 IP 112.26.3.1.43445 > 112.26.3.8.34701: Flags [.], seq 558349:559777, ack 1, win 4017, options [nop,nop,TS val 158677 ecr 4294912576,mptcp dss ack 1720219151 seq 3868334871 subseq 558349 len 1428 csum 0xb06], length 1428
10:18:04.858046 IP 112.26.3.8.34701 > 112.26.3.1.43445: Flags [.], ack 559777, win 24209, options [nop,nop,TS val 4294913508 ecr 158677,mptcp dss ack 3868162083], length 0
10:18:04.883067 IP 112.26.3.1.43445 > 112.26.3.8.34701: Flags [.], seq 566917:568345, ack 1, win 4017, options [nop,nop,TS val 159040 ecr 4294913305,mptcp dss ack 1720219151 seq 3868310595 subseq 566917 len 1428 csum 0x2020], length 1428
10:18:04.883226 IP 112.26.3.1.43445 > 112.26.3.8.34701: Flags [.], seq 566917:568345, ack 1, win 4017, options [nop,nop,TS val 159040 ecr 4294913305,mptcp dss ack 1720219151 seq 3868310595 subseq 566917 len 1428 csum 0x2020], length 1428
10:18:04.902950 IP 112.26.3.1.43445 > 112.26.3.8.34701: Flags [.], seq 559777:561205, ack 1, win 4017, options [nop,nop,TS val 158764 ecr 4294912784,mptcp dss ack 1720219151 seq 3868336299 subseq 559777 len 1428 csum 0x6034], length 1428
10:18:04.967065 IP 112.26.3.1.43445 > 112.26.3.8.34701: Flags [.], seq 568345:569773, ack 1, win 4017, options [nop,nop,TS val 159040 ecr 4294913305,mptcp dss ack 1720219151 seq 3868314879 subseq 568345 len 1428 csum 0x79d6], length 1428
10:18:04.967250 IP 112.26.3.1.43445 > 112.26.3.8.34701: Flags [.], seq 568345:569773, ack 1, win 4017, options [nop,nop,TS val 159040 ecr 4294913305,mptcp dss ack 1720219151 seq 3868314879 subseq 568345 len 1428 csum 0x79d6], length 1428
10:18:05.000825 IP 112.26.3.1.43445 > 112.26.3.8.34701: Flags [.], seq 561205:562633, ack 1, win 4017, options [nop,nop,TS val 158764 ecr 4294912784,mptcp dss ack 1720219151 seq 3868337727 subseq 561205 len 1428 csum 0x99f5], length 1428
10:18:05.052808 IP 112.26.3.1.43445 > 112.26.3.8.34701: Flags [.], seq 569773:571201, ack 1, win 4017, options [nop,nop,TS val 159040 ecr 4294913305,mptcp dss ack 1720219151 seq 3868330587 subseq 569773 len 1428 csum 0x1550], length 1428
10:18:05.053017 IP 112.26.3.1.43445 > 112.26.3.8.34701: Flags [.], seq 569773:571201, ack 1, win 4017, options [nop,nop,TS val 159040 ecr 4294913305,mptcp dss ack 1720219151 seq 3868330587 subseq 569773 len 1428 csum 0x1550], length 1428
10:18:05.079671 IP 112.26.3.8.34701 > 112.26.3.1.43445: Flags [.], ack 562633, win 24209, options [nop,nop,TS val 4294913728 ecr 158764,mptcp dss ack 3868162083], length 0
10:18:05.108716 IP 112.26.3.1.43445 > 112.26.3.8.34701: Flags [.], seq 571201:572629, ack 1, win 4017, options [nop,nop,TS val 159040 ecr 4294913305,mptcp dss ack 1720219151 seq 3868339155 subseq 571201 len 1428 csum 0xcdf1], length 1428
10:18:05.108924 IP 112.26.3.1.43445 > 112.26.3.8.34701: Flags [.], seq 571201:572629, ack 1, win 4017, options [nop,nop,TS val 159040 ecr 4294913305,mptcp dss ack 1720219151 seq 3868339155 subseq 571201 len 1428 csum 0xcdf1], length 1428
10:18:05.121367 IP 112.26.3.1.43445 > 112.26.3.8.34701: Flags [.], seq 562633:564061, ack 1, win 4017, options [nop,nop,TS val 158874 ecr 4294913016,mptcp dss ack 1720219151 seq 3868257759 subseq 562633 len 1428 csum 0xbd01], length 1428
10:18:05.187955 IP 112.26.3.1.43445 > 112.26.3.8.34701: Flags [.], seq 564061:565489, ack 1, win 4017, options [nop,nop,TS val 158874 ecr 4294913016,mptcp dss ack 1720219151 seq 3868259187 subseq 564061 len 1428 csum 0xcd44], length 1428
10:18:05.201779 IP 112.26.3.1.43445 > 112.26.3.8.34701: Flags [.], seq 572629:574057, ack 1, win 4017, options [nop,nop,TS val 159234 ecr 4294913508,mptcp dss ack 1720219151 seq 3868340583 subseq 572629 len 1428 csum 0xae3e], length 1428
10:18:05.201991 IP 112.26.3.1.43445 > 112.26.3.8.34701: Flags [.], seq 572629:574057, ack 1, win 4017, options [nop,nop,TS val 159234 ecr 4294913508,mptcp dss ack 1720219151 seq 3868340583 subseq 572629 len 1428 csum 0xae3e], length 1428
10:18:05.232563 IP 112.26.3.1.43445 > 112.26.3.8.34701: Flags [.], seq 574057:575485, ack 1, win 4017, options [nop,nop,TS val 159234 ecr 4294913508,mptcp dss ack 1720219151 seq 3868342011 subseq 574057 len 1428 csum 0x3c25], length 1428
10:18:05.232713 IP 112.26.3.1.43445 > 112.26.3.8.34701: Flags [.], seq 574057:575485, ack 1, win 4017, options [nop,nop,TS val 159234 ecr 4294913508,mptcp dss ack 1720219151 seq 3868342011 subseq 574057 len 1428 csum 0x3c25], length 1428
10:18:05.279639 IP 112.26.3.1.43445 > 112.26.3.8.34701: Flags [.], seq 575485:576913, ack 1, win 4017, options [nop,nop,TS val 159456 ecr 4294913728,mptcp dss ack 1720219151 seq 3868352007 subseq 575485 len 1428 csum 0x35d3], length 1428
10:18:05.279848 IP 112.26.3.1.43445 > 112.26.3.8.34701: Flags [.], seq 575485:576913, ack 1, win 4017, options [nop,nop,TS val 159456 ecr 4294913728,mptcp dss ack 1720219151 seq 3868352007 subseq 575485 len 1428 csum 0x35d3], length 1428
10:18:05.302483 IP 112.26.3.1.43445 > 112.26.3.8.34701: Flags [.], seq 565489:566917, ack 1, win 4017, options [nop,nop,TS val 158874 ecr 4294913016,mptcp dss ack 1720219151 seq 3868263471 subseq 565489 len 1428 csum 0xede2], length 1428
10:18:05.354405 IP 112.26.3.1.43445 > 112.26.3.8.34701: Flags [.], seq 576913:578341, ack 1, win 4017, options [nop,nop,TS val 159456 ecr 4294913728,mptcp dss ack 1720219151 seq 3868353435 subseq 576913 len 1428 csum 0x4225], length 1428
10:18:05.354602 IP 112.26.3.1.43445 > 112.26.3.8.34701: Flags [.], seq 576913:578341, ack 1, win 4017, options [nop,nop,TS val 159456 ecr 4294913728,mptcp dss ack 1720219151 seq 3868353435 subseq 576913 len 1428 csum 0x4225], length 1428
10:18:05.399350 IP 112.26.3.1.43445 > 112.26.3.8.34701: Flags [.], seq 566917:568345, ack 1, win 4017, options [nop,nop,TS val 159040 ecr 4294913305,mptcp dss ack 1720219151 seq 3868310595 subseq 566917 len 1428 csum 0x2020], length 1428
10:18:05.416589 IP 112.26.3.8.34701 > 112.26.3.1.43445: Flags [.], ack 568345, win 24209, options [nop,nop,TS val 4294914056 ecr 158874,mptcp dss ack 3868162083], length 0
10:18:05.460262 IP 112.26.3.1.43445 > 112.26.3.8.34701: Flags [.], seq 578341:579769, ack 1, win 4017, options [nop,nop,TS val 159793 ecr 4294914056,mptcp dss ack 1720219151 seq 3868364859 subseq 578341 len 1428 csum 0xabfd], length 1428
10:18:05.460449 IP 112.26.3.1.43445 > 112.26.3.8.34701: Flags [.], seq 578341:579769, ack 1, win 4017, options [nop,nop,TS val 159793 ecr 4294914056,mptcp dss ack 1720219151 seq 3868364859 subseq 578341 len 1428 csum 0xabfd], length 1428
10:18:05.491246 IP 112.26.3.1.43445 > 112.26.3.8.34701: Flags [.], seq 568345:569773, ack 1, win 4017, options [nop,nop,TS val 159040 ecr 4294913305,mptcp dss ack 1720219151 seq 3868314879 subseq 568345 len 1428 csum 0x79d6], length 1428
10:18:05.530906 IP 112.26.3.1.43445 > 112.26.3.8.34701: Flags [.], seq 579769:581197, ack 1, win 4017, options [nop,nop,TS val 159793 ecr 4294914056,mptcp dss ack 1720219151 seq 3868366287 subseq 579769 len 1428 csum 0x7cc4], length 1428
10:18:05.531088 IP 112.26.3.1.43445 > 112.26.3.8.34701: Flags [.], seq 579769:581197, ack 1, win 4017, options [nop,nop,TS val 159793 ecr 4294914056,mptcp dss ack 1720219151 seq 3868366287 subseq 579769 len 1428 csum 0x7cc4], length 1428
10:18:05.580286 IP 112.26.3.1.43445 > 112.26.3.8.34701: Flags [.], seq 581197:582625, ack 1, win 4017, options [nop,nop,TS val 159793 ecr 4294914056,mptcp dss ack 1720219151 seq 3868367715 subseq 581197 len 1428 csum 0x4f63], length 1428
10:18:05.580434 IP 112.26.3.1.43445 > 112.26.3.8.34701: Flags [.], seq 581197:582625, ack 1, win 4017, options [nop,nop,TS val 159793 ecr 4294914056,mptcp dss ack 1720219151 seq 3868367715 subseq 581197 len 1428 csum 0x4f63], length 1428
10:18:05.594422 IP 112.26.3.1.43445 > 112.26.3.8.34701: Flags [.], seq 569773:571201, ack 1, win 4017, options [nop,nop,TS val 159040 ecr 4294913305,mptcp dss ack 1720219151 seq 3868330587 subseq 569773 len 1428 csum 0x1550], length 1428
10:18:05.658091 IP 112.26.3.1.43445 > 112.26.3.8.34701: Flags [.], seq 582625:584053, ack 1, win 4017, options [nop,nop,TS val 159793 ecr 4294914056,mptcp dss ack 1720219151 seq 3868369143 subseq 582625 len 1428 csum 0x8c71], length 1428
10:18:05.658270 IP 112.26.3.1.43445 > 112.26.3.8.34701: Flags [.], seq 582625:584053, ack 1, win 4017, options [nop,nop,TS val 159793 ecr 4294914056,mptcp dss ack 1720219151 seq 3868369143 subseq 582625 len 1428 csum 0x8c71], length 1428
10:18:05.695957 IP 112.26.3.1.43445 > 112.26.3.8.34701: Flags [.], seq 571201:572629, ack 1, win 4017, options [nop,nop,TS val 159040 ecr 4294913305,mptcp dss ack 1720219151 seq 3868339155 subseq 571201 len 1428 csum 0xcdf1], length 1428
10:18:05.725650 IP 112.26.3.8.34701 > 112.26.3.1.43445: Flags [.], ack 571201, win 24209, options [nop,nop,TS val 4294914352 ecr 159040,mptcp dss ack 3868162083], length 0
10:18:05.758279 IP 112.26.3.1.43445 > 112.26.3.8.34701: Flags [.], seq 584053:585481, ack 1, win 4017, options [nop,nop,TS val 160102 ecr 4294914352,mptcp dss ack 1720219151 seq 3868389135 subseq 584053 len 1428 csum 0x6ad5], length 1428
10:18:05.758469 IP 112.26.3.1.43445 > 112.26.3.8.34701: Flags [.], seq 584053:585481, ack 1, win 4017, options [nop,nop,TS val 160102 ecr 4294914352,mptcp dss ack 1720219151 seq 3868389135 subseq 584053 len 1428 csum 0x6ad5], length 1428
10:18:05.803915 IP 112.26.3.1.43445 > 112.26.3.8.34701: Flags [.], seq 572629:574057, ack 1, win 4017, options [nop,nop,TS val 159234 ecr 4294913508,mptcp dss ack 1720219151 seq 3868340583 subseq 572629 len 1428 csum 0xae3e], length 1428
10:18:05.855402 IP 112.26.3.1.43445 > 112.26.3.8.34701: Flags [.], seq 585481:586909, ack 1, win 4017, options [nop,nop,TS val 160102 ecr 4294914352,mptcp dss ack 1720219151 seq 3868390563 subseq 585481 len 1428 csum 0x87ef], length 1428
10:18:05.855600 IP 112.26.3.1.43445 > 112.26.3.8.34701: Flags [.], seq 585481:586909, ack 1, win 4017, options [nop,nop,TS val 160102 ecr 4294914352,mptcp dss ack 1720219151 seq 3868390563 subseq 585481 len 1428 csum 0x87ef], length 1428
10:18:05.935229 IP 112.26.3.1.43445 > 112.26.3.8.34701: Flags [.], seq 586909:588337, ack 1, win 4017, options [nop,nop,TS val 160102 ecr 4294914352,mptcp dss ack 1720219151 seq 3868391991 subseq 586909 len 1428 csum 0x1617], length 1428
10:18:05.935436 IP 112.26.3.1.43445 > 112.26.3.8.34701: Flags [.], seq 586909:588337, ack 1, win 4017, options [nop,nop,TS val 160102 ecr 4294914352,mptcp dss ack 1720219151 seq 3868391991 subseq 586909 len 1428 csum 0x1617], length 1428
10:18:05.986386 IP 112.26.3.1.43445 > 112.26.3.8.34701: Flags [.], seq 574057:575485, ack 1, win 4017, options [nop,nop,TS val 159234 ecr 4294913508,mptcp dss ack 1720219151 seq 3868342011 subseq 574057 len 1428 csum 0x3c25], length 1428
10:18:05.989584 IP 112.26.3.1.43445 > 112.26.3.8.34701: Flags [.], seq 575485:576913, ack 1, win 4017, options [nop,nop,TS val 159456 ecr 4294913728,mptcp dss ack 1720219151 seq 3868352007 subseq 575485 len 1428 csum 0x35d3], length 1428
10:18:05.997841 IP 112.26.3.8.34701 > 112.26.3.1.43445: Flags [.], ack 576913, win 24209, options [nop,nop,TS val 4294914646 ecr 159040,mptcp dss ack 3868162083], length 0
10:18:06.007826 IP 112.26.3.1.43445 > 112.26.3.8.34701: Flags [.], seq 588337:589765, ack 1, win 4017, options [nop,nop,TS val 160374 ecr 4294914646,mptcp dss ack 1720219151 seq 3868397703 subseq 588337 len 1428 csum 0x8ed6], length 1428
10:18:06.007975 IP 112.26.3.1.43445 > 112.26.3.8.34701: Flags [.], seq 588337:589765, ack 1, win 4017, options [nop,nop,TS val 160374 ecr 4294914646,mptcp dss ack 1720219151 seq 3868397703 subseq 588337 len 1428 csum 0x8ed6], length 1428
10:18:06.065292 IP 112.26.3.1.43445 > 112.26.3.8.34701: Flags [.], seq 589765:591193, ack 1, win 4017, options [nop,nop,TS val 160374 ecr 4294914646,mptcp dss ack 1720219151 seq 3868399131 subseq 589765 len 1428 csum 0xa4d], length 1428
10:18:06.065493 IP 112.26.3.1.43445 > 112.26.3.8.34701: Flags [.], seq 589765:591193, ack 1, win 4017, options [nop,nop,TS val 160374 ecr 4294914646,mptcp dss ack 1720219151 seq 3868399131 subseq 589765 len 1428 csum 0xa4d], length 1428
10:18:06.109222 IP 112.26.3.1.43445 > 112.26.3.8.34701: Flags [.], seq 578341:579769, ack 1, win 4017, options [nop,nop,TS val 159793 ecr 4294914056,mptcp dss ack 1720219151 seq 3868364859 subseq 578341 len 1428 csum 0xabfd], length 1428
10:18:06.149445 IP 112.26.3.8.34701 > 112.26.3.1.43445: Flags [.], ack 576913, win 24209, options [nop,nop,TS val 4294914766 ecr 159040,nop,nop,sack 1 {578341:579769},mptcp dss ack 3868162083], length 0
10:18:06.205093 IP 112.26.3.1.43445 > 112.26.3.8.34701: Flags [.], seq 591193:592621, ack 1, win 4017, options [nop,nop,TS val 160374 ecr 4294914646,mptcp dss ack 1720219151 seq 3868400559 subseq 591193 len 1428 csum 0xe32], length 1428
10:18:06.205270 IP 112.26.3.1.43445 > 112.26.3.8.34701: Flags [.], seq 591193:592621, ack 1, win 4017, options [nop,nop,TS val 160374 ecr 4294914646,mptcp dss ack 1720219151 seq 3868400559 subseq 591193 len 1428 csum 0xe32], length 1428
10:18:06.212834 IP 112.26.3.1.43445 > 112.26.3.8.34701: Flags [.], seq 579769:581197, ack 1, win 4017, options [nop,nop,TS val 159793 ecr 4294914056,mptcp dss ack 1720219151 seq 3868366287 subseq 579769 len 1428 csum 0x7cc4], length 1428
10:18:06.267399 IP 112.26.3.8.34701 > 112.26.3.1.43445: Flags [.], ack 576913, win 24209, options [nop,nop,TS val 4294914869 ecr 159040,nop,nop,sack 1 {578341:581197},mptcp dss ack 3868162083], length 0
10:18:06.285348 IP 112.26.3.1.43445 > 112.26.3.8.34701: Flags [.], seq 592621:594049, ack 1, win 4017, options [nop,nop,TS val 160374 ecr 4294914646,mptcp dss ack 1720219151 seq 3868401987 subseq 592621 len 1428 csum 0xa14], length 1428
10:18:06.285725 IP 112.26.3.1.43445 > 112.26.3.8.34701: Flags [.], seq 592621:594049, ack 1, win 4017, options [nop,nop,TS val 160374 ecr 4294914646,mptcp dss ack 1720219151 seq 3868401987 subseq 592621 len 1428 csum 0xa14], length 1428
10:18:06.332662 IP 112.26.3.1.43445 > 112.26.3.8.34701: Flags [.], seq 581197:582625, ack 1, win 4017, options [nop,nop,TS val 159793 ecr 4294914056,mptcp dss ack 1720219151 seq 3868367715 subseq 581197 len 1428 csum 0x4f63], length 1428
10:18:06.356579 IP 112.26.3.1.43445 > 112.26.3.8.34701: Flags [.], seq 594049:595477, ack 1, win 4017, options [nop,nop,TS val 160643 ecr 4294914766,mptcp dss ack 1720219151 seq 3868414839 subseq 594049 len 1428 csum 0x878c], length 1428
10:18:06.356841 IP 112.26.3.1.43445 > 112.26.3.8.34701: Flags [.], seq 594049:595477, ack 1, win 4017, options [nop,nop,TS val 160643 ecr 4294914766,mptcp dss ack 1720219151 seq 3868414839 subseq 594049 len 1428 csum 0x878c], length 1428
10:18:06.426094 IP 112.26.3.8.34701 > 112.26.3.1.43445: Flags [.], ack 576913, win 24209, options [nop,nop,TS val 4294914984 ecr 159040,nop,nop,sack 1 {578341:582625},mptcp dss ack 3868162083], length 0
10:18:06.477893 IP 112.26.3.1.43445 > 112.26.3.8.34701: Flags [.], seq 595477:596905, ack 1, win 4017, options [nop,nop,TS val 160655 ecr 4294914869,mptcp dss ack 1720219151 seq 3868416267 subseq 595477 len 1428 csum 0xc65c], length 1428
10:18:06.478216 IP 112.26.3.1.43445 > 112.26.3.8.34701: Flags [.], seq 595477:596905, ack 1, win 4017, options [nop,nop,TS val 160655 ecr 4294914869,mptcp dss ack 1720219151 seq 3868416267 subseq 595477 len 1428 csum 0xc65c], length 1428
10:18:06.492474 IP 112.26.3.1.43445 > 112.26.3.8.34701: Flags [.], seq 584053:585481, ack 1, win 4017, options [nop,nop,TS val 160102 ecr 4294914352,mptcp dss ack 1720219151 seq 3868389135 subseq 584053 len 1428 csum 0x6ad5], length 1428
10:18:06.519204 IP 112.26.3.8.34701 > 112.26.3.1.43445: Flags [.], ack 576913, win 24209, options [nop,nop,TS val 4294915109 ecr 159040,nop,nop,sack 2 {584053:585481}{578341:582625},mptcp dss ack 3868162083], length 0
10:18:06.551666 IP 112.26.3.1.43445 > 112.26.3.8.34701: Flags [.], seq 585481:586909, ack 1, win 4017, options [nop,nop,TS val 160102 ecr 4294914352,mptcp dss ack 1720219151 seq 3868390563 subseq 585481 len 1428 csum 0x87ef], length 1428
10:18:06.591081 IP 112.26.3.1.43445 > 112.26.3.8.34701: Flags [.], seq 576913:578341, ack 1, win 4017, options [nop,nop,TS val 160802 ecr 4294914984,mptcp dss ack 1720219151 seq 3868353435 subseq 576913 len 1428 csum 0x4225], length 1428
10:18:06.591300 IP 112.26.3.1.43445 > 112.26.3.8.34701: Flags [.], seq 576913:578341, ack 1, win 4017, options [nop,nop,TS val 160802 ecr 4294914984,mptcp dss ack 1720219151 seq 3868353435 subseq 576913 len 1428 csum 0x4225], length 1428
10:18:06.595744 IP 112.26.3.8.34701 > 112.26.3.1.43445: Flags [.], ack 576913, win 24209, options [nop,nop,TS val 4294915208 ecr 159040,nop,nop,sack 2 {584053:586909}{578341:582625},mptcp dss ack 3868162083], length 0
10:18:06.637772 IP 112.26.3.1.43445 > 112.26.3.8.34701: Flags [.], seq 586909:588337, ack 1, win 4017, options [nop,nop,TS val 160102 ecr 4294914352,mptcp dss ack 1720219151 seq 3868391991 subseq 586909 len 1428 csum 0x1617], length 1428
10:18:06.661075 IP 112.26.3.1.43445 > 112.26.3.8.34701: Flags [.], seq 582625:584053, ack 1, win 4017, options [nop,nop,TS val 160895 ecr 4294915109,mptcp dss ack 1720219151 seq 3868369143 subseq 582625 len 1428 csum 0x8c71], length 1428
10:18:06.661324 IP 112.26.3.1.43445 > 112.26.3.8.34701: Flags [.], seq 582625:584053, ack 1, win 4017, options [nop,nop,TS val 160895 ecr 4294915109,mptcp dss ack 1720219151 seq 3868369143 subseq 582625 len 1428 csum 0x8c71], length 1428
10:18:06.708252 IP 112.26.3.1.43445 > 112.26.3.8.34701: Flags [.], seq 588337:589765, ack 1, win 4017, options [nop,nop,TS val 160374 ecr 4294914646,mptcp dss ack 1720219151 seq 3868397703 subseq 588337 len 1428 csum 0x8ed6], length 1428
10:18:06.712346 IP 112.26.3.8.34701 > 112.26.3.1.43445: Flags [.], ack 576913, win 24209, options [nop,nop,TS val 4294915294 ecr 159040,nop,nop,sack 2 {584053:588337}{578341:582625},mptcp dss ack 3868162083], length 0
10:18:06.784838 IP 112.26.3.1.43445 > 112.26.3.8.34701: Flags [.], seq 589765:591193, ack 1, win 4017, options [nop,nop,TS val 160374 ecr 4294914646,mptcp dss ack 1720219151 seq 3868399131 subseq 589765 len 1428 csum 0xa4d], length 1428
10:18:06.819828 IP 112.26.3.8.34701 > 112.26.3.1.43445: Flags [.], ack 576913, win 24209, options [nop,nop,TS val 4294915365 ecr 159040,nop,nop,sack 2 {584053:589765}{578341:582625},mptcp dss ack 3868162083], length 0
10:18:06.856641 IP 112.26.3.8.34701 > 112.26.3.1.43445: Flags [.], ack 576913, win 24209, options [nop,nop,TS val 4294915441 ecr 159040,nop,nop,sack 2 {584053:591193}{578341:582625},mptcp dss ack 3868162083], length 0
10:18:06.858604 IP 112.26.3.1.43445 > 112.26.3.8.34701: Flags [.], seq 596905:598333, ack 1, win 4017, options [nop,nop,TS val 161232 ecr 4294915365,mptcp dss ack 1720219151 seq 3868436259 subseq 596905 len 1428 csum 0xeac7], length 1428
10:18:06.858919 IP 112.26.3.1.43445 > 112.26.3.8.34701: Flags [.], seq 596905:598333, ack 1, win 4017, options [nop,nop,TS val 161232 ecr 4294915365,mptcp dss ack 1720219151 seq 3868436259 subseq 596905 len 1428 csum 0xeac7], length 1428
10:18:06.881154 IP 112.26.3.1.43445 > 112.26.3.8.34701: Flags [.], seq 591193:592621, ack 1, win 4017, options [nop,nop,TS val 160374 ecr 4294914646,mptcp dss ack 1720219151 seq 3868400559 subseq 591193 len 1428 csum 0xe32], length 1428
10:18:06.977449 IP 112.26.3.1.43445 > 112.26.3.8.34701: Flags [.], seq 592621:594049, ack 1, win 4017, options [nop,nop,TS val 160374 ecr 4294914646,mptcp dss ack 1720219151 seq 3868401987 subseq 592621 len 1428 csum 0xa14], length 1428
10:18:06.987083 IP 112.26.3.1.43445 > 112.26.3.8.34701: Flags [.], seq 598333:599761, ack 1, win 4017, options [nop,nop,TS val 161274 ecr 4294915441,mptcp dss ack 1720219151 seq 3868437687 subseq 598333 len 1428 csum 0x4fea], length 1428
10:18:06.987413 IP 112.26.3.1.43445 > 112.26.3.8.34701: Flags [.], seq 598333:599761, ack 1, win 4017, options [nop,nop,TS val 161274 ecr 4294915441,mptcp dss ack 1720219151 seq 3868437687 subseq 598333 len 1428 csum 0x4fea], length 1428
10:18:07.030507 IP 112.26.3.8.34701 > 112.26.3.1.43445: Flags [.], ack 576913, win 24209, options [nop,nop,TS val 4294915538 ecr 159040,nop,nop,sack 2 {584053:592621}{578341:582625},mptcp dss ack 3868162083], length 0
10:18:07.044531 IP 112.26.3.1.43445 > 112.26.3.8.34701: Flags [.], seq 594049:595477, ack 1, win 4017, options [nop,nop,TS val 160643 ecr 4294914766,mptcp dss ack 1720219151 seq 3868414839 subseq 594049 len 1428 csum 0x878c], length 1428
10:18:07.111652 IP 112.26.3.8.34701 > 112.26.3.1.43445: Flags [.], ack 576913, win 24209, options [nop,nop,TS val 4294915634 ecr 159040,nop,nop,sack 2 {584053:594049}{578341:582625},mptcp dss ack 3868162083], length 0
10:18:07.117839 IP 112.26.3.1.43445 > 112.26.3.8.34701: Flags [.], seq 599761:601189, ack 1, win 4017, options [nop,nop,TS val 161488 ecr 4294915538,mptcp dss ack 1720219151 seq 3868447683 subseq 599761 len 1428 csum 0x1239], length 1428
10:18:07.118120 IP 112.26.3.1.43445 > 112.26.3.8.34701: Flags [.], seq 599761:601189, ack 1, win 4017, options [nop,nop,TS val 161488 ecr 4294915538,mptcp dss ack 1720219151 seq 3868447683 subseq 599761 len 1428 csum 0x1239], length 1428
10:18:07.147057 IP 112.26.3.1.43445 > 112.26.3.8.34701: Flags [.], seq 595477:596905, ack 1, win 4017, options [nop,nop,TS val 160655 ecr 4294914869,mptcp dss ack 1720219151 seq 3868416267 subseq 595477 len 1428 csum 0xc65c], length 1428
10:18:07.199385 IP 112.26.3.1.43445 > 112.26.3.8.34701: Flags [.], seq 601189:602617, ack 1, win 4017, options [nop,nop,TS val 161550 ecr 4294915634,mptcp dss ack 1720219151 seq 3868449111 subseq 601189 len 1428 csum 0xe49f], length 1428
10:18:07.199693 IP 112.26.3.1.43445 > 112.26.3.8.34701: Flags [.], seq 601189:602617, ack 1, win 4017, options [nop,nop,TS val 161550 ecr 4294915634,mptcp dss ack 1720219151 seq 3868449111 subseq 601189 len 1428 csum 0xe49f], length 1428
10:18:07.226671 IP 112.26.3.8.34701 > 112.26.3.1.43445: Flags [.], ack 576913, win 24209, options [nop,nop,TS val 4294915701 ecr 159040,nop,nop,sack 2 {584053:595477}{578341:582625},mptcp dss ack 3868162083], length 0
10:18:07.244843 IP 112.26.3.1.43445 > 112.26.3.8.34701: Flags [.], seq 576913:578341, ack 1, win 4017, options [nop,nop,TS val 160802 ecr 4294914984,mptcp dss ack 1720219151 seq 3868353435 subseq 576913 len 1428 csum 0x4225], length 1428
10:18:07.273727 IP 112.26.3.1.43445 > 112.26.3.8.34701: Flags [.], seq 602617:604045, ack 1, win 4017, options [nop,nop,TS val 161610 ecr 4294915701,mptcp dss ack 1720219151 seq 3868451967 subseq 602617 len 1428 csum 0x9a2], length 1428
10:18:07.274015 IP 112.26.3.1.43445 > 112.26.3.8.34701: Flags [.], seq 602617:604045, ack 1, win 4017, options [nop,nop,TS val 161610 ecr 4294915701,mptcp dss ack 1720219151 seq 3868451967 subseq 602617 len 1428 csum 0x9a2], length 1428
10:18:07.373892 IP 112.26.3.1.43445 > 112.26.3.8.34701: Flags [.], seq 582625:584053, ack 1, win 4017, options [nop,nop,TS val 160895 ecr 4294915109,mptcp dss ack 1720219151 seq 3868369143 subseq 582625 len 1428 csum 0x8c71], length 1428
10:18:07.393693 IP 112.26.3.8.34701 > 112.26.3.1.43445: Flags [.], ack 576913, win 24209, options [nop,nop,TS val 4294915801 ecr 159040,nop,nop,sack 2 {584053:596905}{578341:582625},mptcp dss ack 3868162083], length 0
10:18:07.449009 IP 112.26.3.1.43445 > 112.26.3.8.34701: Flags [.], seq 596905:598333, ack 1, win 4017, options [nop,nop,TS val 161232 ecr 4294915365,mptcp dss ack 1720219151 seq 3868436259 subseq 596905 len 1428 csum 0xeac7], length 1428
10:18:07.460972 IP 112.26.3.8.34701 > 112.26.3.1.43445: Flags [.], ack 582625, win 24209, options [nop,nop,TS val 4294915902 ecr 160802,nop,nop,sack 1 {584053:596905},mptcp dss ack 3868162083], length 0
10:18:07.479239 IP 112.26.3.1.43445 > 112.26.3.8.34701: Flags [.], seq 604045:605473, ack 1, win 4017, options [nop,nop,TS val 161837 ecr 4294915801,mptcp dss ack 1720219151 seq 3868467675 subseq 604045 len 1428 csum 0xff13], length 1428
10:18:07.479499 IP 112.26.3.1.43445 > 112.26.3.8.34701: Flags [.], seq 604045:605473, ack 1, win 4017, options [nop,nop,TS val 161837 ecr 4294915801,mptcp dss ack 1720219151 seq 3868467675 subseq 604045 len 1428 csum 0xff13], length 1428
10:18:07.554076 IP 112.26.3.1.43445 > 112.26.3.8.34701: Flags [.], seq 605473:606901, ack 1, win 4017, options [nop,nop,TS val 161837 ecr 4294915902,mptcp dss ack 1720219151 seq 3868469103 subseq 605473 len 1428 csum 0xb590], length 1428
10:18:07.554336 IP 112.26.3.1.43445 > 112.26.3.8.34701: Flags [.], seq 605473:606901, ack 1, win 4017, options [nop,nop,TS val 161837 ecr 4294915902,mptcp dss ack 1720219151 seq 3868469103 subseq 605473 len 1428 csum 0xb590], length 1428
10:18:07.591492 IP 112.26.3.1.43445 > 112.26.3.8.34701: Flags [.], seq 598333:599761, ack 1, win 4017, options [nop,nop,TS val 161274 ecr 4294915441,mptcp dss ack 1720219151 seq 3868437687 subseq 598333 len 1428 csum 0x4fea], length 1428
10:18:07.629245 IP 112.26.3.8.34701 > 112.26.3.1.43445: Flags [.], ack 596905, win 24209, options [nop,nop,TS val 4294916031 ecr 160895,mptcp dss ack 3868162083], length 0
10:18:07.632614 IP 112.26.3.1.43445 > 112.26.3.8.34701: Flags [.], seq 606901:608329, ack 1, win 4017, options [nop,nop,TS val 162005 ecr 4294916031,mptcp dss ack 1720219151 seq 3868479099 subseq 606901 len 1428 csum 0xd18], length 1428
10:18:07.632872 IP 112.26.3.1.43445 > 112.26.3.8.34701: Flags [.], seq 606901:608329, ack 1, win 4017, options [nop,nop,TS val 162005 ecr 4294916031,mptcp dss ack 1720219151 seq 3868479099 subseq 606901 len 1428 csum 0xd18], length 1428
10:18:07.692181 IP 112.26.3.1.43445 > 112.26.3.8.34701: Flags [.], seq 599761:601189, ack 1, win 4017, options [nop,nop,TS val 161488 ecr 4294915538,mptcp dss ack 1720219151 seq 3868447683 subseq 599761 len 1428 csum 0x1239], length 1428
10:18:07.720800 IP 112.26.3.8.34701 > 112.26.3.1.43445: Flags [.], ack 598333, win 24209, options [nop,nop,TS val 4294916106 ecr 161232,mptcp dss ack 3868162083], length 0
10:18:07.724303 IP 112.26.3.1.43445 > 112.26.3.8.34701: Flags [.], seq 608329:609757, ack 1, win 4017, options [nop,nop,TS val 162097 ecr 4294916106,mptcp dss ack 1720219151 seq 3868480527 subseq 608329 len 1428 csum 0x17d], length 1428
10:18:07.724645 IP 112.26.3.1.43445 > 112.26.3.8.34701: Flags [.], seq 608329:609757, ack 1, win 4017, options [nop,nop,TS val 162097 ecr 4294916106,mptcp dss ack 1720219151 seq 3868480527 subseq 608329 len 1428 csum 0x17d], length 1428
10:18:07.778263 IP 112.26.3.1.43445 > 112.26.3.8.34701: Flags [.], seq 601189:602617, ack 1, win 4017, options [nop,nop,TS val 161550 ecr 4294915634,mptcp dss ack 1720219151 seq 3868449111 subseq 601189 len 1428 csum 0xe49f], length 1428
10:18:07.835849 IP 112.26.3.8.34701 > 112.26.3.1.43445: Flags [.], ack 599761, win 24209, options [nop,nop,TS val 4294916244 ecr 161274,mptcp dss ack 3868162083], length 0
10:18:07.848039 IP 112.26.3.1.43445 > 112.26.3.8.34701: Flags [.], seq 602617:604045, ack 1, win 4017, options [nop,nop,TS val 161610 ecr 4294915701,mptcp dss ack 1720219151 seq 3868451967 subseq 602617 len 1428 csum 0x9a2], length 1428
10:18:07.879626 IP 112.26.3.1.43445 > 112.26.3.8.34701: Flags [.], seq 609757:611185, ack 1, win 4017, options [nop,nop,TS val 162212 ecr 4294916244,mptcp dss ack 1720219151 seq 3868486239 subseq 609757 len 1428 csum 0xb1bd], length 1428
10:18:07.879943 IP 112.26.3.1.43445 > 112.26.3.8.34701: Flags [.], seq 609757:611185, ack 1, win 4017, options [nop,nop,TS val 162212 ecr 4294916244,mptcp dss ack 1720219151 seq 3868486239 subseq 609757 len 1428 csum 0xb1bd], length 1428
10:18:07.925392 IP 112.26.3.8.34701 > 112.26.3.1.43445: Flags [.], ack 601189, win 24209, options [nop,nop,TS val 4294916343 ecr 161488,mptcp dss ack 3868162083], length 0
10:18:07.928704 IP 112.26.3.1.43445 > 112.26.3.8.34701: Flags [.], seq 611185:612613, ack 1, win 4017, options [nop,nop,TS val 162302 ecr 4294916343,mptcp dss ack 1720219151 seq 3868487667 subseq 611185 len 1428 csum 0x54ab], length 1428
10:18:07.929017 IP 112.26.3.1.43445 > 112.26.3.8.34701: Flags [.], seq 611185:612613, ack 1, win 4017, options [nop,nop,TS val 162302 ecr 4294916343,mptcp dss ack 1720219151 seq 3868487667 subseq 611185 len 1428 csum 0x54ab], length 1428
10:18:07.978812 IP 112.26.3.1.43445 > 112.26.3.8.34701: Flags [.], seq 604045:605473, ack 1, win 4017, options [nop,nop,TS val 161837 ecr 4294915801,mptcp dss ack 1720219151 seq 3868467675 subseq 604045 len 1428 csum 0xff13], length 1428
10:18:08.026811 IP 112.26.3.1.43445 > 112.26.3.8.34701: Flags [.], seq 612613:614041, ack 1, win 4017, options [nop,nop,TS val 162302 ecr 4294916343,mptcp dss ack 1720219151 seq 3868489095 subseq 612613 len 1428 csum 0x5d99], length 1428
10:18:08.027080 IP 112.26.3.1.43445 > 112.26.3.8.34701: Flags [.], seq 612613:614041, ack 1, win 4017, options [nop,nop,TS val 162302 ecr 4294916343,mptcp dss ack 1720219151 seq 3868489095 subseq 612613 len 1428 csum 0x5d99], length 1428
10:18:08.040263 IP 112.26.3.8.34701 > 112.26.3.1.43445: Flags [.], ack 602617, win 24209, options [nop,nop,TS val 4294916435 ecr 161550,mptcp dss ack 3868162083], length 0
10:18:08.050963 IP 112.26.3.1.43445 > 112.26.3.8.34701: Flags [.], seq 605473:606901, ack 1, win 4017, options [nop,nop,TS val 161837 ecr 4294915902,mptcp dss ack 1720219151 seq 3868469103 subseq 605473 len 1428 csum 0xb590], length 1428
10:18:08.117239 IP 112.26.3.1.43445 > 112.26.3.8.34701: Flags [.], seq 614041:615469, ack 1, win 4017, options [nop,nop,TS val 162416 ecr 4294916435,mptcp dss ack 1720219151 seq 3868493379 subseq 614041 len 1428 csum 0x61cb], length 1428
10:18:08.117542 IP 112.26.3.1.43445 > 112.26.3.8.34701: Flags [.], seq 614041:615469, ack 1, win 4017, options [nop,nop,TS val 162416 ecr 4294916435,mptcp dss ack 1720219151 seq 3868493379 subseq 614041 len 1428 csum 0x61cb], length 1428
10:18:08.130305 IP 112.26.3.1.43445 > 112.26.3.8.34701: Flags [.], seq 606901:608329, ack 1, win 4017, options [nop,nop,TS val 162005 ecr 4294916031,mptcp dss ack 1720219151 seq 3868479099 subseq 606901 len 1428 csum 0xd18], length 1428
10:18:08.217302 IP 112.26.3.8.34701 > 112.26.3.1.43445: Flags [.], ack 604045, win 24209, options [nop,nop,TS val 4294916518 ecr 161610,mptcp dss ack 3868162083], length 0
10:18:08.236861 IP 112.26.3.1.43445 > 112.26.3.8.34701: Flags [.], seq 615469:616897, ack 1, win 4017, options [nop,nop,TS val 162593 ecr 4294916518,mptcp dss ack 1720219151 seq 3868500519 subseq 615469 len 1428 csum 0x9357], length 1428
10:18:08.237201 IP 112.26.3.1.43445 > 112.26.3.8.34701: Flags [.], seq 615469:616897, ack 1, win 4017, options [nop,nop,TS val 162593 ecr 4294916518,mptcp dss ack 1720219151 seq 3868500519 subseq 615469 len 1428 csum 0x9357], length 1428
