10:17:05.153320 IP 112.26.0.8.36004 > 112.26.0.1.43445: Flags [S], seq 604036043, win 65535, options [mss 1460,sackOK,TS val 4294851649 ecr 0,nop,wscale 6,mptcp capable csum {0x5fe731cb2a0ffaa8}], length 0
10:17:05.167091 IP 112.26.0.8.36004 > 112.26.0.1.43445: Flags [S], seq 604036043, win 65535, options [mss 1460,sackOK,TS val 4294851649 ecr 0,nop,wscale 6,mptcp capable csum {0x5fe731cb2a0ffaa8}], length 0
10:17:05.176283 IP 112.26.0.1.43445 > 112.26.0.8.36004: Flags [S.], seq 3411350881, ack 604036044, win 65535, options [mss 1460,sackOK,TS val 99544 ecr 4294851649,nop,wscale 6,mptcp capable csum {0x95b44a60aabf03a2}], length 0
10:17:05.351766 IP 112.26.0.1.43445 > 112.26.0.8.36004: Flags [S.], seq 3411350881, ack 604036044, win 65535, options [mss 1460,sackOK,TS val 99544 ecr 4294851649,nop,wscale 6,mptcp capable csum {0x95b44a60aabf03a2}], length 0
10:17:05.459352 IP 112.26.0.1.43445 > 112.26.0.8.36004: Flags [S.], seq 3411350881, ack 604036044, win 65535, options [mss 1460,sackOK,TS val 99544 ecr 4294851649,nop,wscale 6,mptcp capable csum {0x95b44a60aabf03a2}], length 0
10:17:05.471093 IP 112.26.0.8.36004 > 112.26.0.1.43445: Flags [.], ack 1, win 1369, options [nop,nop,TS val 4294854113 ecr 99544,mptcp capable csum {0x5fe731cb2a0ffaa8,0x95b44a60aabf03a2},mptcp dss ack 3866414399], length 0
10:17:05.471285 IP 112.26.0.8.36004 > 112.26.0.1.43445: Flags [.], ack 1, win 1369, options [nop,nop,TS val 4294854113 ecr 99544,mptcp capable csum {0x5fe731cb2a0ffaa8,0x95b44a60aabf03a2},mptcp dss ack 3866414399], length 0
10:17:35.658753 IP 112.26.0.8.36004 > 112.26.0.1.43445: Flags [.], ack 216869, win 21353, options [nop,nop,TS val 4294883551 ecr 128567,mptcp dss ack 3866908299], length 0
10:17:35.680749 IP 112.26.0.8.36004 > 112.26.0.1.43445: Flags [.], ack 216869, win 21353, options [nop,nop,TS val 4294883551 ecr 128567,mptcp dss ack 3866908299], length 0
10:17:35.684784 IP 112.26.0.1.43445 > 112.26.0.8.36004: Flags [.], seq 235433:236861, ack 1, win 4017, options [nop,nop,TS val 130057 ecr 4294883551,mptcp dss ack 1720219151 seq 3867013971 subseq 235433 len 1428 csum 0x1672], length 1428
10:17:35.685116 IP 112.26.0.1.43445 > 112.26.0.8.36004: Flags [.], seq 235433:236861, ack 1, win 4017, options [nop,nop,TS val 130057 ecr 4294883551,mptcp dss ack 1720219151 seq 3867013971 subseq 235433 len 1428 csum 0x1672], length 1428
10:17:35.738007 IP 112.26.0.1.43445 > 112.26.0.8.36004: Flags [.], seq 222581:224009, ack 1, win 4017, options [nop,nop,TS val 129118 ecr 4294882651,mptcp dss ack 1720219151 seq 3866973987 subseq 222581 len 1428 csum 0x1eb0], length 1428
10:17:35.833345 IP 112.26.0.1.43445 > 112.26.0.8.36004: Flags [.], seq 224009:225437, ack 1, win 4017, options [nop,nop,TS val 129211 ecr 4294882736,mptcp dss ack 1720219151 seq 3866979699 subseq 224009 len 1428 csum 0x3a9], length 1428
10:17:35.919859 IP 112.26.0.1.43445 > 112.26.0.8.36004: Flags [.], seq 225437:226865, ack 1, win 4017, options [nop,nop,TS val 129398 ecr 4294882887,mptcp dss ack 1720219151 seq 3866985411 subseq 225437 len 1428 csum 0x2896], length 1428
10:17:35.985926 IP 112.26.0.1.43445 > 112.26.0.8.36004: Flags [.], seq 226865:228293, ack 1, win 4017, options [nop,nop,TS val 129398 ecr 4294882887,mptcp dss ack 1720219151 seq 3866986839 subseq 226865 len 1428 csum 0xb4a8], length 1428
10:17:36.079605 IP 112.26.0.8.36004 > 112.26.0.1.43445: Flags [.], ack 216869, win 21718, options [nop,nop,TS val 4294883936 ecr 128567,nop,nop,sack 1 {218297:219725},mptcp dss ack 3866908299], length 0
10:17:36.080653 IP 112.26.0.8.36004 > 112.26.0.1.43445: Flags [.], ack 216869, win 21718, options [nop,nop,TS val 4294883936 ecr 128567,nop,nop,sack 1 {218297:219725},mptcp dss ack 3866908299], length 0
10:17:36.098494 IP 112.26.0.1.43445 > 112.26.0.8.36004: Flags [.], seq 236861:238289, ack 1, win 4017, options [nop,nop,TS val 130471 ecr 4294883936,mptcp dss ack 1720219151 seq 3867029679 subseq 236861 len 1428 csum 0x6434], length 1428
10:17:36.098807 IP 112.26.0.1.43445 > 112.26.0.8.36004: Flags [.], seq 236861:238289, ack 1, win 4017, options [nop,nop,TS val 130471 ecr 4294883936,mptcp dss ack 1720219151 seq 3867029679 subseq 236861 len 1428 csum 0x6434], length 1428
10:17:36.135032 IP 112.26.0.1.43445 > 112.26.0.8.36004: Flags [.], seq 229721:231149, ack 1, win 4017, options [nop,nop,TS val 129609 ecr 4294883116,mptcp dss ack 1720219151 seq 3866996835 subseq 229721 len 1428 csum 0x56dd], length 1428
10:17:36.203042 IP 112.26.0.8.36004 > 112.26.0.1.43445: Flags [.], ack 216869, win 22083, options [nop,nop,TS val 4294884159 ecr 128567,nop,nop,sack 1 {218297:221153},mptcp dss ack 3866952567], length 0
10:17:36.204399 IP 112.26.0.8.36004 > 112.26.0.1.43445: Flags [.], ack 216869, win 22083, options [nop,nop,TS val 4294884159 ecr 128567,nop,nop,sack 1 {218297:221153},mptcp dss ack 3866952567], length 0
10:17:36.222494 IP 112.26.0.1.43445 > 112.26.0.8.36004: Flags [.], seq 238289:239717, ack 1, win 4017, options [nop,nop,TS val 130596 ecr 4294884159,mptcp dss ack 1720219151 seq 3867038247 subseq 238289 len 1428 csum 0x3db], length 1428
10:17:36.222809 IP 112.26.0.1.43445 > 112.26.0.8.36004: Flags [.], seq 238289:239717, ack 1, win 4017, options [nop,nop,TS val 130596 ecr 4294884159,mptcp dss ack 1720219151 seq 3867038247 subseq 238289 len 1428 csum 0x3db], length 1428
10:17:36.260348 IP 112.26.0.1.43445 > 112.26.0.8.36004: Flags [.], seq 231149:232577, ack 1, win 4017, options [nop,nop,TS val 129609 ecr 4294883116,mptcp dss ack 1720219151 seq 3866998263 subseq 231149 len 1428 csum 0xea39], length 1428
10:17:36.347913 IP 112.26.0.8.36004 > 112.26.0.1.43445: Flags [.], ack 216869, win 22174, options [nop,nop,TS val 4294884264 ecr 128567,nop,nop,sack 1 {218297:222581},mptcp dss ack 3866952567], length 0
10:17:36.349114 IP 112.26.0.8.36004 > 112.26.0.1.43445: Flags [.], ack 216869, win 22174, options [nop,nop,TS val 4294884264 ecr 128567,nop,nop,sack 1 {218297:222581},mptcp dss ack 3866952567], length 0
10:17:36.372294 IP 112.26.0.1.43445 > 112.26.0.8.36004: Flags [.], seq 216869:218297, ack 1, win 4017, options [nop,nop,TS val 130725 ecr 4294884264,mptcp dss ack 1720219151 seq 3866952567 subseq 216869 len 1428 csum 0xf797], length 1428
10:17:36.372565 IP 112.26.0.1.43445 > 112.26.0.8.36004: Flags [.], seq 216869:218297, ack 1, win 4017, options [nop,nop,TS val 130725 ecr 4294884264,mptcp dss ack 1720219151 seq 3866952567 subseq 216869 len 1428 csum 0xf797], length 1428
10:17:36.432225 IP 112.26.0.1.43445 > 112.26.0.8.36004: Flags [.], seq 232577:234005, ack 1, win 4017, options [nop,nop,TS val 129786 ecr 4294883227,mptcp dss ack 1720219151 seq 3867001119 subseq 232577 len 1428 csum 0x9fb2], length 1428
10:17:36.503785 IP 112.26.0.1.43445 > 112.26.0.8.36004: Flags [.], seq 234005:235433, ack 1, win 4017, options [nop,nop,TS val 129963 ecr 4294883307,mptcp dss ack 1720219151 seq 3867008259 subseq 234005 len 1428 csum 0x918d], length 1428
10:17:36.579958 IP 112.26.0.1.43445 > 112.26.0.8.36004: Flags [.], seq 235433:236861, ack 1, win 4017, options [nop,nop,TS val 130057 ecr 4294883551,mptcp dss ack 1720219151 seq 3867013971 subseq 235433 len 1428 csum 0x1672], length 1428
10:17:36.654671 IP 112.26.0.8.36004 > 112.26.0.1.43445: Flags [.], ack 216869, win 22585, options [nop,nop,TS val 4294884576 ecr 128567,nop,nop,sack 1 {218297:226865},mptcp dss ack 3866952567], length 0
10:17:36.656075 IP 112.26.0.8.36004 > 112.26.0.1.43445: Flags [.], ack 216869, win 22585, options [nop,nop,TS val 4294884576 ecr 128567,nop,nop,sack 1 {218297:226865},mptcp dss ack 3866952567], length 0
10:17:36.702360 IP 112.26.0.1.43445 > 112.26.0.8.36004: Flags [.], seq 239717:241145, ack 1, win 4017, options [nop,nop,TS val 131074 ecr 4294884576,mptcp dss ack 1720219151 seq 3867055383 subseq 239717 len 1428 csum 0xa48c], length 1428
10:17:36.702686 IP 112.26.0.1.43445 > 112.26.0.8.36004: Flags [.], seq 239717:241145, ack 1, win 4017, options [nop,nop,TS val 131074 ecr 4294884576,mptcp dss ack 1720219151 seq 3867055383 subseq 239717 len 1428 csum 0xa48c], length 1428
10:17:36.707062 IP 112.26.0.8.36004 > 112.26.0.1.43445: Flags [.], ack 216869, win 22767, options [nop,nop,TS val 4294884642 ecr 128567,nop,nop,sack 1 {218297:228293},mptcp dss ack 3866952567], length 0
10:17:36.708832 IP 112.26.0.8.36004 > 112.26.0.1.43445: Flags [.], ack 216869, win 22767, options [nop,nop,TS val 4294884642 ecr 128567,nop,nop,sack 1 {218297:228293},mptcp dss ack 3866952567], length 0
10:17:36.781648 IP 112.26.0.1.43445 > 112.26.0.8.36004: Flags [.], seq 241145:242573, ack 1, win 4017, options [nop,nop,TS val 131074 ecr 4294884576,mptcp dss ack 1720219151 seq 3867056811 subseq 241145 len 1428 csum 0x7795], length 1428
10:17:36.781906 IP 112.26.0.1.43445 > 112.26.0.8.36004: Flags [.], seq 241145:242573, ack 1, win 4017, options [nop,nop,TS val 131074 ecr 4294884576,mptcp dss ack 1720219151 seq 3867056811 subseq 241145 len 1428 csum 0x7795], length 1428
10:17:36.810985 IP 112.26.0.1.43445 > 112.26.0.8.36004: Flags [.], seq 236861:238289, ack 1, win 4017, options [nop,nop,TS val 130471 ecr 4294883936,mptcp dss ack 1720219151 seq 3867029679 subseq 236861 len 1428 csum 0x6434], length 1428
10:17:36.826304 IP 112.26.0.1.43445 > 112.26.0.8.36004: Flags [.], seq 242573:244001, ack 1, win 4017, options [nop,nop,TS val 131152 ecr 4294884642,mptcp dss ack 1720219151 seq 3867061095 subseq 242573 len 1428 csum 0x3c9a], length 1428
10:17:36.826549 IP 112.26.0.1.43445 > 112.26.0.8.36004: Flags [.], seq 242573:244001, ack 1, win 4017, options [nop,nop,TS val 131152 ecr 4294884642,mptcp dss ack 1720219151 seq 3867061095 subseq 242573 len 1428 csum 0x3c9a], length 1428
10:17:36.891873 IP 112.26.0.1.43445 > 112.26.0.8.36004: Flags [.], seq 238289:239717, ack 1, win 4017, options [nop,nop,TS val 130596 ecr 4294884159,mptcp dss ack 1720219151 seq 3867038247 subseq 238289 len 1428 csum 0x3db], length 1428
10:17:37.003792 IP 112.26.0.1.43445 > 112.26.0.8.36004: Flags [.], seq 216869:218297, ack 1, win 4017, options [nop,nop,TS val 130725 ecr 4294884264,mptcp dss ack 1720219151 seq 3866952567 subseq 216869 len 1428 csum 0xf797], length 1428
10:17:37.052986 IP 112.26.0.8.36004 > 112.26.0.1.43445: Flags [.], ack 216869, win 23315, options [nop,nop,TS val 4294885089 ecr 128567,nop,nop,sack 2 {229721:234005}{218297:228293},mptcp dss ack 3866952567], length 0
10:17:37.054521 IP 112.26.0.8.36004 > 112.26.0.1.43445: Flags [.], ack 216869, win 23315, options [nop,nop,TS val 4294885089 ecr 128567,nop,nop,sack 2 {229721:234005}{218297:228293},mptcp dss ack 3866952567], length 0
10:17:37.070495 IP 112.26.0.1.43445 > 112.26.0.8.36004: Flags [.], seq 228293:229721, ack 1, win 4017, options [nop,nop,TS val 131431 ecr 4294885089,mptcp dss ack 1720219151 seq 3866989695 subseq 228293 len 1428 csum 0x7ab1], length 1428
10:17:37.070835 IP 112.26.0.1.43445 > 112.26.0.8.36004: Flags [.], seq 228293:229721, ack 1, win 4017, options [nop,nop,TS val 131431 ecr 4294885089,mptcp dss ack 1720219151 seq 3866989695 subseq 228293 len 1428 csum 0x7ab1], length 1428
10:17:37.136646 IP 112.26.0.8.36004 > 112.26.0.1.43445: Flags [.], ack 216869, win 23497, options [nop,nop,TS val 4294885160 ecr 128567,nop,nop,sack 2 {229721:235433}{218297:228293},mptcp dss ack 3866952567], length 0
10:17:37.151752 IP 112.26.0.8.36004 > 112.26.0.1.43445: Flags [.], ack 216869, win 23497, options [nop,nop,TS val 4294885160 ecr 128567,nop,nop,sack 2 {229721:235433}{218297:228293},mptcp dss ack 3866952567], length 0
10:17:37.188834 IP 112.26.0.1.43445 > 112.26.0.8.36004: Flags [.], seq 244001:245429, ack 1, win 4017, options [nop,nop,TS val 131563 ecr 4294885160,mptcp dss ack 1720219151 seq 3867081087 subseq 244001 len 1428 csum 0x9dcb], length 1428
10:17:37.189111 IP 112.26.0.1.43445 > 112.26.0.8.36004: Flags [.], seq 244001:245429, ack 1, win 4017, options [nop,nop,TS val 131563 ecr 4294885160,mptcp dss ack 1720219151 seq 3867081087 subseq 244001 len 1428 csum 0x9dcb], length 1428
10:17:37.219226 IP 112.26.0.8.36004 > 112.26.0.1.43445: Flags [.], ack 216869, win 23634, options [nop,nop,TS val 4294885236 ecr 128567,nop,nop,sack 2 {229721:236861}{218297:228293},mptcp dss ack 3866952567], length 0
10:17:37.225320 IP 112.26.0.8.36004 > 112.26.0.1.43445: Flags [.], ack 216869, win 23634, options [nop,nop,TS val 4294885236 ecr 128567,nop,nop,sack 2 {229721:236861}{218297:228293},mptcp dss ack 3866952567], length 0
10:17:37.345841 IP 112.26.0.1.43445 > 112.26.0.8.36004: Flags [.], seq 239717:241145, ack 1, win 4017, options [nop,nop,TS val 131074 ecr 4294884576,mptcp dss ack 1720219151 seq 3867055383 subseq 239717 len 1428 csum 0xa48c], length 1428
10:17:37.357837 IP 112.26.0.1.43445 > 112.26.0.8.36004: Flags [.], seq 245429:246857, ack 1, win 4017, options [nop,nop,TS val 131657 ecr 4294885236,mptcp dss ack 1720219151 seq 3867083943 subseq 245429 len 1428 csum 0x1406], length 1428
10:17:37.358142 IP 112.26.0.1.43445 > 112.26.0.8.36004: Flags [.], seq 245429:246857, ack 1, win 4017, options [nop,nop,TS val 131657 ecr 4294885236,mptcp dss ack 1720219151 seq 3867083943 subseq 245429 len 1428 csum 0x1406], length 1428
10:17:37.378814 IP 112.26.0.8.36004 > 112.26.0.1.43445: Flags [.], ack 216869, win 23883, options [nop,nop,TS val 4294885454 ecr 128567,nop,nop,sack 2 {229721:238289}{218297:228293},mptcp dss ack 3866952567], length 0
10:17:37.379596 IP 112.26.0.8.36004 > 112.26.0.1.43445: Flags [.], ack 216869, win 23883, options [nop,nop,TS val 4294885454 ecr 128567,nop,nop,sack 2 {229721:238289}{218297:228293},mptcp dss ack 3866952567], length 0
10:17:37.403982 IP 112.26.0.1.43445 > 112.26.0.8.36004: Flags [.], seq 246857:248285, ack 1, win 4017, options [nop,nop,TS val 131778 ecr 4294885454,mptcp dss ack 1720219151 seq 3867089655 subseq 246857 len 1428 csum 0x6baf], length 1428
10:17:37.404239 IP 112.26.0.1.43445 > 112.26.0.8.36004: Flags [.], seq 246857:248285, ack 1, win 4017, options [nop,nop,TS val 131778 ecr 4294885454,mptcp dss ack 1720219151 seq 3867089655 subseq 246857 len 1428 csum 0x6baf], length 1428
10:17:37.542083 IP 112.26.0.8.36004 > 112.26.0.1.43445: Flags [.], ack 216869, win 23883, options [nop,nop,TS val 4294885549 ecr 128567,nop,nop,sack 2 {229721:239717}{218297:228293},mptcp dss ack 3866952567], length 0
10:17:37.545286 IP 112.26.0.8.36004 > 112.26.0.1.43445: Flags [.], ack 216869, win 23883, options [nop,nop,TS val 4294885549 ecr 128567,nop,nop,sack 2 {229721:239717}{218297:228293},mptcp dss ack 3866952567], length 0
10:17:37.557861 IP 112.26.0.1.43445 > 112.26.0.8.36004: Flags [.], seq 248285:249713, ack 1, win 4017, options [nop,nop,TS val 131932 ecr 4294885549,mptcp dss ack 1720219151 seq 3867096795 subseq 248285 len 1428 csum 0x620f], length 1428
10:17:37.558031 IP 112.26.0.1.43445 > 112.26.0.8.36004: Flags [.], seq 248285:249713, ack 1, win 4017, options [nop,nop,TS val 131932 ecr 4294885549,mptcp dss ack 1720219151 seq 3867096795 subseq 248285 len 1428 csum 0x620f], length 1428
10:17:37.614787 IP 112.26.0.1.43445 > 112.26.0.8.36004: Flags [.], seq 241145:242573, ack 1, win 4017, options [nop,nop,TS val 131074 ecr 4294884576,mptcp dss ack 1720219151 seq 3867056811 subseq 241145 len 1428 csum 0x7795], length 1428
10:17:37.680024 IP 112.26.0.1.43445 > 112.26.0.8.36004: Flags [.], seq 242573:244001, ack 1, win 4017, options [nop,nop,TS val 131152 ecr 4294884642,mptcp dss ack 1720219151 seq 3867061095 subseq 242573 len 1428 csum 0x3c9a], length 1428
10:17:37.758754 IP 112.26.0.8.36004 > 112.26.0.1.43445: Flags [.], ack 228293, win 23720, options [nop,nop,TS val 4294885661 ecr 130725,nop,nop,sack 1 {229721:239717},mptcp dss ack 3866989695], length 0
10:17:37.761296 IP 112.26.0.8.36004 > 112.26.0.1.43445: Flags [.], ack 228293, win 23720, options [nop,nop,TS val 4294885661 ecr 130725,nop,nop,sack 1 {229721:239717},mptcp dss ack 3866989695], length 0
10:17:37.777312 IP 112.26.0.1.43445 > 112.26.0.8.36004: Flags [.], seq 249713:251141, ack 1, win 4017, options [nop,nop,TS val 132138 ecr 4294885661,mptcp dss ack 1720219151 seq 3867102507 subseq 249713 len 1428 csum 0x6828], length 1428
10:17:37.777645 IP 112.26.0.1.43445 > 112.26.0.8.36004: Flags [.], seq 249713:251141, ack 1, win 4017, options [nop,nop,TS val 132138 ecr 4294885661,mptcp dss ack 1720219151 seq 3867102507 subseq 249713 len 1428 csum 0x6828], length 1428
10:17:37.807634 IP 112.26.0.1.43445 > 112.26.0.8.36004: Flags [.], seq 228293:229721, ack 1, win 4017, options [nop,nop,TS val 131431 ecr 4294885089,mptcp dss ack 1720219151 seq 3866989695 subseq 228293 len 1428 csum 0x7ab1], length 1428
10:17:37.877838 IP 112.26.0.1.43445 > 112.26.0.8.36004: Flags [.], seq 244001:245429, ack 1, win 4017, options [nop,nop,TS val 131563 ecr 4294885160,mptcp dss ack 1720219151 seq 3867081087 subseq 244001 len 1428 csum 0x9dcb], length 1428
10:17:38.007076 IP 112.26.0.8.36004 > 112.26.0.1.43445: Flags [.], ack 228293, win 24079, options [nop,nop,TS val 4294885965 ecr 130725,nop,nop,sack 1 {229721:241145},mptcp dss ack 3866989695], length 0
10:17:38.009238 IP 112.26.0.8.36004 > 112.26.0.1.43445: Flags [.], ack 228293, win 24079, options [nop,nop,TS val 4294885965 ecr 130725,nop,nop,sack 1 {229721:241145},mptcp dss ack 3866989695], length 0
10:17:38.043717 IP 112.26.0.1.43445 > 112.26.0.8.36004: Flags [.], seq 251141:252569, ack 1, win 4017, options [nop,nop,TS val 132415 ecr 4294885965,mptcp dss ack 1720219151 seq 3867109647 subseq 251141 len 1428 csum 0xb1cf], length 1428
10:17:38.044034 IP 112.26.0.1.43445 > 112.26.0.8.36004: Flags [.], seq 251141:252569, ack 1, win 4017, options [nop,nop,TS val 132415 ecr 4294885965,mptcp dss ack 1720219151 seq 3867109647 subseq 251141 len 1428 csum 0xb1cf], length 1428
10:17:38.053222 IP 112.26.0.1.43445 > 112.26.0.8.36004: Flags [.], seq 245429:246857, ack 1, win 4017, options [nop,nop,TS val 131657 ecr 4294885236,mptcp dss ack 1720219151 seq 3867083943 subseq 245429 len 1428 csum 0x1406], length 1428
10:17:38.118703 IP 112.26.0.1.43445 > 112.26.0.8.36004: Flags [.], seq 246857:248285, ack 1, win 4017, options [nop,nop,TS val 131778 ecr 4294885454,mptcp dss ack 1720219151 seq 3867089655 subseq 246857 len 1428 csum 0x6baf], length 1428
10:17:38.189716 IP 112.26.0.1.43445 > 112.26.0.8.36004: Flags [.], seq 248285:249713, ack 1, win 4017, options [nop,nop,TS val 131932 ecr 4294885549,mptcp dss ack 1720219151 seq 3867096795 subseq 248285 len 1428 csum 0x620f], length 1428
10:17:38.333750 IP 112.26.0.8.36004 > 112.26.0.1.43445: Flags [.], ack 228293, win 24079, options [nop,nop,TS val 4294886272 ecr 130725,nop,nop,sack 1 {229721:242573},mptcp dss ack 3866989695], length 0
10:17:38.343740 IP 112.26.0.8.36004 > 112.26.0.1.43445: Flags [.], ack 228293, win 24079, options [nop,nop,TS val 4294886272 ecr 130725,nop,nop,sack 1 {229721:242573},mptcp dss ack 3866989695], length 0
10:17:38.380170 IP 112.26.0.1.43445 > 112.26.0.8.36004: Flags [.], seq 252569:253997, ack 1, win 4017, options [nop,nop,TS val 132753 ecr 4294886272,mptcp dss ack 1720219151 seq 3867123927 subseq 252569 len 1428 csum 0x987d], length 1428
10:17:38.380432 IP 112.26.0.1.43445 > 112.26.0.8.36004: Flags [.], seq 252569:253997, ack 1, win 4017, options [nop,nop,TS val 132753 ecr 4294886272,mptcp dss ack 1720219151 seq 3867123927 subseq 252569 len 1428 csum 0x987d], length 1428
10:17:38.397682 IP 112.26.0.8.36004 > 112.26.0.1.43445: Flags [.], ack 228293, win 24079, options [nop,nop,TS val 4294886337 ecr 130725,nop,nop,sack 1 {229721:244001},mptcp dss ack 3866989695], length 0
10:17:38.408618 IP 112.26.0.8.36004 > 112.26.0.1.43445: Flags [.], ack 228293, win 24079, options [nop,nop,TS val 4294886337 ecr 130725,nop,nop,sack 1 {229721:244001},mptcp dss ack 3866989695], length 0
10:17:38.477098 IP 112.26.0.1.43445 > 112.26.0.8.36004: Flags [.], seq 249713:251141, ack 1, win 4017, options [nop,nop,TS val 132138 ecr 4294885661,mptcp dss ack 1720219151 seq 3867102507 subseq 249713 len 1428 csum 0x6828], length 1428
10:17:38.514269 IP 112.26.0.1.43445 > 112.26.0.8.36004: Flags [.], seq 253997:255425, ack 1, win 4017, options [nop,nop,TS val 132804 ecr 4294886337,mptcp dss ack 1720219151 seq 3867129639 subseq 253997 len 1428 csum 0x6ae1], length 1428
10:17:38.514538 IP 112.26.0.1.43445 > 112.26.0.8.36004: Flags [.], seq 253997:255425, ack 1, win 4017, options [nop,nop,TS val 132804 ecr 4294886337,mptcp dss ack 1720219151 seq 3867129639 subseq 253997 len 1428 csum 0x6ae1], length 1428
10:17:38.558722 IP 112.26.0.8.36004 > 112.26.0.1.43445: Flags [.], ack 245429, win 23879, options [nop,nop,TS val 4294886535 ecr 131563,mptcp dss ack 3867002547], length 0
10:17:38.559884 IP 112.26.0.8.36004 > 112.26.0.1.43445: Flags [.], ack 245429, win 23879, options [nop,nop,TS val 4294886535 ecr 131563,mptcp dss ack 3867002547], length 0
10:17:38.608079 IP 112.26.0.1.43445 > 112.26.0.8.36004: Flags [.], seq 255425:256853, ack 1, win 4017, options [nop,nop,TS val 132937 ecr 4294886535,mptcp dss ack 1720219151 seq 3867138207 subseq 255425 len 1428 csum 0x556d], length 1428
10:17:38.608408 IP 112.26.0.1.43445 > 112.26.0.8.36004: Flags [.], seq 255425:256853, ack 1, win 4017, options [nop,nop,TS val 132937 ecr 4294886535,mptcp dss ack 1720219151 seq 3867138207 subseq 255425 len 1428 csum 0x556d], length 1428
10:17:38.636074 IP 112.26.0.8.36004 > 112.26.0.1.43445: Flags [.], ack 246857, win 23879, options [nop,nop,TS val 4294886710 ecr 131657,mptcp dss ack 3867002547], length 0
10:17:38.663580 IP 112.26.0.8.36004 > 112.26.0.1.43445: Flags [.], ack 246857, win 23879, options [nop,nop,TS val 4294886710 ecr 131657,mptcp dss ack 3867002547], length 0
10:17:38.693621 IP 112.26.0.1.43445 > 112.26.0.8.36004: Flags [.], seq 256853:258281, ack 1, win 4017, options [nop,nop,TS val 132937 ecr 4294886535,mptcp dss ack 1720219151 seq 3867139635 subseq 256853 len 1428 csum 0x8051], length 1428
10:17:38.693930 IP 112.26.0.1.43445 > 112.26.0.8.36004: Flags [.], seq 256853:258281, ack 1, win 4017, options [nop,nop,TS val 132937 ecr 4294886535,mptcp dss ack 1720219151 seq 3867139635 subseq 256853 len 1428 csum 0x8051], length 1428
10:17:38.704233 IP 112.26.0.1.43445 > 112.26.0.8.36004: Flags [.], seq 251141:252569, ack 1, win 4017, options [nop,nop,TS val 132415 ecr 4294885965,mptcp dss ack 1720219151 seq 3867109647 subseq 251141 len 1428 csum 0xb1cf], length 1428
10:17:38.785745 IP 112.26.0.1.43445 > 112.26.0.8.36004: Flags [.], seq 258281:259709, ack 1, win 4017, options [nop,nop,TS val 133040 ecr 4294886710,mptcp dss ack 1720219151 seq 3867145347 subseq 258281 len 1428 csum 0x171f], length 1428
10:17:38.786069 IP 112.26.0.1.43445 > 112.26.0.8.36004: Flags [.], seq 258281:259709, ack 1, win 4017, options [nop,nop,TS val 133040 ecr 4294886710,mptcp dss ack 1720219151 seq 3867145347 subseq 258281 len 1428 csum 0x171f], length 1428
10:17:38.792436 IP 112.26.0.8.36004 > 112.26.0.1.43445: Flags [.], ack 248285, win 24136, options [nop,nop,TS val 4294886775 ecr 131778,mptcp dss ack 3867048243], length 0
10:17:38.794050 IP 112.26.0.8.36004 > 112.26.0.1.43445: Flags [.], ack 248285, win 24136, options [nop,nop,TS val 4294886775 ecr 131778,mptcp dss ack 3867048243], length 0
10:17:38.858591 IP 112.26.0.8.36004 > 112.26.0.1.43445: Flags [.], ack 249713, win 24164, options [nop,nop,TS val 4294886846 ecr 131932,mptcp dss ack 3867048243], length 0
10:17:38.874749 IP 112.26.0.1.43445 > 112.26.0.8.36004: Flags [.], seq 259709:261137, ack 1, win 4017, options [nop,nop,TS val 133171 ecr 4294886775,mptcp dss ack 1720219151 seq 3867149631 subseq 259709 len 1428 csum 0x48f5], length 1428
10:17:38.875078 IP 112.26.0.1.43445 > 112.26.0.8.36004: Flags [.], seq 259709:261137, ack 1, win 4017, options [nop,nop,TS val 133171 ecr 4294886775,mptcp dss ack 1720219151 seq 3867149631 subseq 259709 len 1428 csum 0x48f5], length 1428
10:17:38.931187 IP 112.26.0.8.36004 > 112.26.0.1.43445: Flags [.], ack 249713, win 24164, options [nop,nop,TS val 4294886846 ecr 131932,mptcp dss ack 3867048243], length 0
10:17:38.950456 IP 112.26.0.1.43445 > 112.26.0.8.36004: Flags [.], seq 252569:253997, ack 1, win 4017, options [nop,nop,TS val 132753 ecr 4294886272,mptcp dss ack 1720219151 seq 3867123927 subseq 252569 len 1428 csum 0x987d], length 1428
10:17:38.979224 IP 112.26.0.1.43445 > 112.26.0.8.36004: Flags [.], seq 261137:262565, ack 1, win 4017, options [nop,nop,TS val 133171 ecr 4294886775,mptcp dss ack 1720219151 seq 3867151059 subseq 261137 len 1428 csum 0x8d5], length 1428
10:17:38.979531 IP 112.26.0.1.43445 > 112.26.0.8.36004: Flags [.], seq 261137:262565, ack 1, win 4017, options [nop,nop,TS val 133171 ecr 4294886775,mptcp dss ack 1720219151 seq 3867151059 subseq 261137 len 1428 csum 0x8d5], length 1428
10:17:39.043147 IP 112.26.0.1.43445 > 112.26.0.8.36004: Flags [.], seq 262565:263993, ack 1, win 4017, options [nop,nop,TS val 133308 ecr 4294886846,mptcp dss ack 1720219151 seq 3867156771 subseq 262565 len 1428 csum 0x66e1], length 1428
10:17:39.043468 IP 112.26.0.1.43445 > 112.26.0.8.36004: Flags [.], seq 262565:263993, ack 1, win 4017, options [nop,nop,TS val 133308 ecr 4294886846,mptcp dss ack 1720219151 seq 3867156771 subseq 262565 len 1428 csum 0x66e1], length 1428
10:17:39.062493 IP 112.26.0.8.36004 > 112.26.0.1.43445: Flags [.], ack 251141, win 24164, options [nop,nop,TS val 4294887133 ecr 132138,mptcp dss ack 3867048243], length 0
10:17:39.064167 IP 112.26.0.8.36004 > 112.26.0.1.43445: Flags [.], ack 251141, win 24164, options [nop,nop,TS val 4294887133 ecr 132138,mptcp dss ack 3867048243], length 0
10:17:39.134809 IP 112.26.0.1.43445 > 112.26.0.8.36004: Flags [.], seq 263993:265421, ack 1, win 4017, options [nop,nop,TS val 133441 ecr 4294887133,mptcp dss ack 1720219151 seq 3867162483 subseq 263993 len 1428 csum 0xfc4], length 1428
10:17:39.135136 IP 112.26.0.1.43445 > 112.26.0.8.36004: Flags [.], seq 263993:265421, ack 1, win 4017, options [nop,nop,TS val 133441 ecr 4294887133,mptcp dss ack 1720219151 seq 3867162483 subseq 263993 len 1428 csum 0xfc4], length 1428
10:17:39.152460 IP 112.26.0.1.43445 > 112.26.0.8.36004: Flags [.], seq 253997:255425, ack 1, win 4017, options [nop,nop,TS val 132804 ecr 4294886337,mptcp dss ack 1720219151 seq 3867129639 subseq 253997 len 1428 csum 0x6ae1], length 1428
10:17:39.178777 IP 112.26.0.1.43445 > 112.26.0.8.36004: Flags [.], seq 255425:256853, ack 1, win 4017, options [nop,nop,TS val 132937 ecr 4294886535,mptcp dss ack 1720219151 seq 3867138207 subseq 255425 len 1428 csum 0x556d], length 1428
10:17:39.283060 IP 112.26.0.8.36004 > 112.26.0.1.43445: Flags [.], ack 252569, win 24164, options [nop,nop,TS val 4294887341 ecr 132415,mptcp dss ack 3867048243], length 0
10:17:39.284629 IP 112.26.0.8.36004 > 112.26.0.1.43445: Flags [.], ack 252569, win 24164, options [nop,nop,TS val 4294887341 ecr 132415,mptcp dss ack 3867048243], length 0
10:17:39.290256 IP 112.26.0.1.43445 > 112.26.0.8.36004: Flags [.], seq 265421:266849, ack 1, win 4017, options [nop,nop,TS val 133661 ecr 4294887341,mptcp dss ack 1720219151 seq 3867175335 subseq 265421 len 1428 csum 0x9509], length 1428
10:17:39.290485 IP 112.26.0.1.43445 > 112.26.0.8.36004: Flags [.], seq 265421:266849, ack 1, win 4017, options [nop,nop,TS val 133661 ecr 4294887341,mptcp dss ack 1720219151 seq 3867175335 subseq 265421 len 1428 csum 0x9509], length 1428
10:17:39.353341 IP 112.26.0.1.43445 > 112.26.0.8.36004: Flags [.], seq 256853:258281, ack 1, win 4017, options [nop,nop,TS val 132937 ecr 4294886535,mptcp dss ack 1720219151 seq 3867139635 subseq 256853 len 1428 csum 0x8051], length 1428
10:17:39.424152 IP 112.26.0.1.43445 > 112.26.0.8.36004: Flags [.], seq 258281:259709, ack 1, win 4017, options [nop,nop,TS val 133040 ecr 4294886710,mptcp dss ack 1720219151 seq 3867145347 subseq 258281 len 1428 csum 0x171f], length 1428
10:17:39.473496 IP 112.26.0.1.43445 > 112.26.0.8.36004: Flags [.], seq 259709:261137, ack 1, win 4017, options [nop,nop,TS val 133171 ecr 4294886775,mptcp dss ack 1720219151 seq 3867149631 subseq 259709 len 1428 csum 0x48f5], length 1428
10:17:39.563775 IP 112.26.0.8.36004 > 112.26.0.1.43445: Flags [.], ack 253997, win 24193, options [nop,nop,TS val 4294887607 ecr 132753,mptcp dss ack 3867078231], length 0
10:17:39.565787 IP 112.26.0.8.36004 > 112.26.0.1.43445: Flags [.], ack 253997, win 24193, options [nop,nop,TS val 4294887607 ecr 132753,mptcp dss ack 3867078231], length 0
10:17:39.569980 IP 112.26.0.1.43445 > 112.26.0.8.36004: Flags [.], seq 266849:268277, ack 1, win 4017, options [nop,nop,TS val 133942 ecr 4294887607,mptcp dss ack 1720219151 seq 3867185331 subseq 266849 len 1428 csum 0x8062], length 1428
10:17:39.570318 IP 112.26.0.1.43445 > 112.26.0.8.36004: Flags [.], seq 266849:268277, ack 1, win 4017, options [nop,nop,TS val 133942 ecr 4294887607,mptcp dss ack 1720219151 seq 3867185331 subseq 266849 len 1428 csum 0x8062], length 1428
10:17:39.628726 IP 112.26.0.1.43445 > 112.26.0.8.36004: Flags [.], seq 261137:262565, ack 1, win 4017, options [nop,nop,TS val 133171 ecr 4294886775,mptcp dss ack 1720219151 seq 3867151059 subseq 261137 len 1428 csum 0x8d5], length 1428
10:17:39.698659 IP 112.26.0.1.43445 > 112.26.0.8.36004: Flags [.], seq 262565:263993, ack 1, win 4017, options [nop,nop,TS val 133308 ecr 4294886846,mptcp dss ack 1720219151 seq 3867156771 subseq 262565 len 1428 csum 0x66e1], length 1428
10:17:39.764740 IP 112.26.0.8.36004 > 112.26.0.1.43445: Flags [.], ack 255425, win 24193, options [nop,nop,TS val 4294887794 ecr 132804,mptcp dss ack 3867078231], length 0
10:17:39.766666 IP 112.26.0.8.36004 > 112.26.0.1.43445: Flags [.], ack 255425, win 24193, options [nop,nop,TS val 4294887794 ecr 132804,mptcp dss ack 3867078231], length 0
10:17:39.774786 IP 112.26.0.1.43445 > 112.26.0.8.36004: Flags [.], seq 268277:269705, ack 1, win 4017, options [nop,nop,TS val 134143 ecr 4294887794,mptcp dss ack 1720219151 seq 3867191043 subseq 268277 len 1428 csum 0xc5e0], length 1428
10:17:39.775109 IP 112.26.0.1.43445 > 112.26.0.8.36004: Flags [.], seq 268277:269705, ack 1, win 4017, options [nop,nop,TS val 134143 ecr 4294887794,mptcp dss ack 1720219151 seq 3867191043 subseq 268277 len 1428 csum 0xc5e0], length 1428
10:17:39.865728 IP 112.26.0.8.36004 > 112.26.0.1.43445: Flags [.], ack 256853, win 24193, options [nop,nop,TS val 4294887835 ecr 132937,mptcp dss ack 3867078231], length 0
10:17:39.867851 IP 112.26.0.8.36004 > 112.26.0.1.43445: Flags [.], ack 256853, win 24193, options [nop,nop,TS val 4294887835 ecr 132937,mptcp dss ack 3867078231], length 0
10:17:39.871852 IP 112.26.0.1.43445 > 112.26.0.8.36004: Flags [.], seq 269705:271133, ack 1, win 4017, options [nop,nop,TS val 134245 ecr 4294887835,mptcp dss ack 1720219151 seq 3867198183 subseq 269705 len 1428 csum 0xc9d7], length 1428
10:17:39.872179 IP 112.26.0.1.43445 > 112.26.0.8.36004: Flags [.], seq 269705:271133, ack 1, win 4017, options [nop,nop,TS val 134245 ecr 4294887835,mptcp dss ack 1720219151 seq 3867198183 subseq 269705 len 1428 csum 0xc9d7], length 1428
10:17:39.956036 IP 112.26.0.1.43445 > 112.26.0.8.36004: Flags [.], seq 263993:265421, ack 1, win 4017, options [nop,nop,TS val 133441 ecr 4294887133,mptcp dss ack 1720219151 seq 3867162483 subseq 263993 len 1428 csum 0xfc4], length 1428
10:17:40.010509 IP 112.26.0.1.43445 > 112.26.0.8.36004: Flags [.], seq 265421:266849, ack 1, win 4017, options [nop,nop,TS val 133661 ecr 4294887341,mptcp dss ack 1720219151 seq 3867175335 subseq 265421 len 1428 csum 0x9509], length 1428
10:17:40.048144 IP 112.26.0.8.36004 > 112.26.0.1.43445: Flags [.], ack 258281, win 24193, options [nop,nop,TS val 4294888010 ecr 132937,mptcp dss ack 3867078231], length 0
10:17:40.049372 IP 112.26.0.8.36004 > 112.26.0.1.43445: Flags [.], ack 258281, win 24193, options [nop,nop,TS val 4294888010 ecr 132937,mptcp dss ack 3867078231], length 0
10:17:40.074945 IP 112.26.0.1.43445 > 112.26.0.8.36004: Flags [.], seq 271133:272561, ack 1, win 4017, options [nop,nop,TS val 134426 ecr 4294888010,mptcp dss ack 1720219151 seq 3867205323 subseq 271133 len 1428 csum 0xb40d], length 1428
10:17:40.075189 IP 112.26.0.1.43445 > 112.26.0.8.36004: Flags [.], seq 271133:272561, ack 1, win 4017, options [nop,nop,TS val 134426 ecr 4294888010,mptcp dss ack 1720219151 seq 3867205323 subseq 271133 len 1428 csum 0xb40d], length 1428
10:17:40.119073 IP 112.26.0.8.36004 > 112.26.0.1.43445: Flags [.], ack 259709, win 24193, options [nop,nop,TS val 4294888081 ecr 133040,mptcp dss ack 3867078231], length 0
10:17:40.135337 IP 112.26.0.8.36004 > 112.26.0.1.43445: Flags [.], ack 259709, win 24193, options [nop,nop,TS val 4294888081 ecr 133040,mptcp dss ack 3867078231], length 0
10:17:40.158094 IP 112.26.0.8.36004 > 112.26.0.1.43445: Flags [.], ack 261137, win 24193, options [nop,nop,TS val 4294888130 ecr 133171,mptcp dss ack 3867078231], length 0
10:17:40.171338 IP 112.26.0.1.43445 > 112.26.0.8.36004: Flags [.], seq 272561:273989, ack 1, win 4017, options [nop,nop,TS val 134512 ecr 4294888081,mptcp dss ack 1720219151 seq 3867212463 subseq 272561 len 1428 csum 0x802], length 1428
10:17:40.171668 IP 112.26.0.1.43445 > 112.26.0.8.36004: Flags [.], seq 272561:273989, ack 1, win 4017, options [nop,nop,TS val 134512 ecr 4294888081,mptcp dss ack 1720219151 seq 3867212463 subseq 272561 len 1428 csum 0x802], length 1428
10:17:40.223066 IP 112.26.0.1.43445 > 112.26.0.8.36004: Flags [.], seq 266849:268277, ack 1, win 4017, options [nop,nop,TS val 133942 ecr 4294887607,mptcp dss ack 1720219151 seq 3867185331 subseq 266849 len 1428 csum 0x8062], length 1428
10:17:40.228449 IP 112.26.0.8.36004 > 112.26.0.1.43445: Flags [.], ack 261137, win 24193, options [nop,nop,TS val 4294888130 ecr 133171,mptcp dss ack 3867078231], length 0
10:17:40.252463 IP 112.26.0.1.43445 > 112.26.0.8.36004: Flags [.], seq 273989:275417, ack 1, win 4017, options [nop,nop,TS val 134605 ecr 4294888130,mptcp dss ack 1720219151 seq 3867216747 subseq 273989 len 1428 csum 0xddeb], length 1428
10:17:40.252742 IP 112.26.0.1.43445 > 112.26.0.8.36004: Flags [.], seq 273989:275417, ack 1, win 4017, options [nop,nop,TS val 134605 ecr 4294888130,mptcp dss ack 1720219151 seq 3867216747 subseq 273989 len 1428 csum 0xddeb], length 1428
10:17:40.275318 IP 112.26.0.8.36004 > 112.26.0.1.43445: Flags [.], ack 262565, win 24193, options [nop,nop,TS val 4294888285 ecr 133171,mptcp dss ack 3867078231], length 0
10:17:40.323186 IP 112.26.0.8.36004 > 112.26.0.1.43445: Flags [.], ack 262565, win 24193, options [nop,nop,TS val 4294888285 ecr 133171,mptcp dss ack 3867078231], length 0
10:17:40.325872 IP 112.26.0.1.43445 > 112.26.0.8.36004: Flags [.], seq 275417:276845, ack 1, win 4017, options [nop,nop,TS val 134700 ecr 4294888285,mptcp dss ack 1720219151 seq 3867219603 subseq 275417 len 1428 csum 0x5596], length 1428
10:17:40.326162 IP 112.26.0.1.43445 > 112.26.0.8.36004: Flags [.], seq 275417:276845, ack 1, win 4017, options [nop,nop,TS val 134700 ecr 4294888285,mptcp dss ack 1720219151 seq 3867219603 subseq 275417 len 1428 csum 0x5596], length 1428
10:17:40.364077 IP 112.26.0.8.36004 > 112.26.0.1.43445: Flags [.], ack 263993, win 24193, options [nop,nop,TS val 4294888355 ecr 133308,mptcp dss ack 3867078231], length 0
10:17:40.422120 IP 112.26.0.8.36004 > 112.26.0.1.43445: Flags [.], ack 263993, win 24193, options [nop,nop,TS val 4294888355 ecr 133308,mptcp dss ack 3867078231], length 0
10:17:40.446800 IP 112.26.0.1.43445 > 112.26.0.8.36004: Flags [.], seq 268277:269705, ack 1, win 4017, options [nop,nop,TS val 134143 ecr 4294887794,mptcp dss ack 1720219151 seq 3867191043 subseq 268277 len 1428 csum 0xc5e0], length 1428
10:17:40.463267 IP 112.26.0.1.43445 > 112.26.0.8.36004: Flags [.], seq 276845:278273, ack 1, win 4017, options [nop,nop,TS val 134700 ecr 4294888285,mptcp dss ack 1720219151 seq 3867221031 subseq 276845 len 1428 csum 0x3f78], length 1428
10:17:40.463600 IP 112.26.0.1.43445 > 112.26.0.8.36004: Flags [.], seq 276845:278273, ack 1, win 4017, options [nop,nop,TS val 134700 ecr 4294888285,mptcp dss ack 1720219151 seq 3867221031 subseq 276845 len 1428 csum 0x3f78], length 1428
10:17:40.499796 IP 112.26.0.1.43445 > 112.26.0.8.36004: Flags [.], seq 269705:271133, ack 1, win 4017, options [nop,nop,TS val 134245 ecr 4294887835,mptcp dss ack 1720219151 seq 3867198183 subseq 269705 len 1428 csum 0xc9d7], length 1428
10:17:40.541284 IP 112.26.0.1.43445 > 112.26.0.8.36004: Flags [.], seq 278273:279701, ack 1, win 4017, options [nop,nop,TS val 134799 ecr 4294888355,mptcp dss ack 1720219151 seq 3867228171 subseq 278273 len 1428 csum 0x9ab5], length 1428
10:17:40.541631 IP 112.26.0.1.43445 > 112.26.0.8.36004: Flags [.], seq 278273:279701, ack 1, win 4017, options [nop,nop,TS val 134799 ecr 4294888355,mptcp dss ack 1720219151 seq 3867228171 subseq 278273 len 1428 csum 0x9ab5], length 1428
10:17:40.563114 IP 112.26.0.8.36004 > 112.26.0.1.43445: Flags [.], ack 265421, win 24193, options [nop,nop,TS val 4294888594 ecr 133441,mptcp dss ack 3867078231], length 0
10:17:40.564811 IP 112.26.0.8.36004 > 112.26.0.1.43445: Flags [.], ack 265421, win 24193, options [nop,nop,TS val 4294888594 ecr 133441,mptcp dss ack 3867078231], length 0
10:17:40.594174 IP 112.26.0.1.43445 > 112.26.0.8.36004: Flags [.], seq 279701:281129, ack 1, win 4017, options [nop,nop,TS val 134942 ecr 4294888594,mptcp dss ack 1720219151 seq 3867231027 subseq 279701 len 1428 csum 0x99f8], length 1428
10:17:40.594486 IP 112.26.0.1.43445 > 112.26.0.8.36004: Flags [.], seq 279701:281129, ack 1, win 4017, options [nop,nop,TS val 134942 ecr 4294888594,mptcp dss ack 1720219151 seq 3867231027 subseq 279701 len 1428 csum 0x99f8], length 1428
10:17:40.630921 IP 112.26.0.8.36004 > 112.26.0.1.43445: Flags [.], ack 266849, win 24193, options [nop,nop,TS val 4294888708 ecr 133661,mptcp dss ack 3867078231], length 0
10:17:40.673519 IP 112.26.0.8.36004 > 112.26.0.1.43445: Flags [.], ack 266849, win 24193, options [nop,nop,TS val 4294888708 ecr 133661,mptcp dss ack 3867078231], length 0
10:17:40.678750 IP 112.26.0.1.43445 > 112.26.0.8.36004: Flags [.], seq 281129:282557, ack 1, win 4017, options [nop,nop,TS val 135050 ecr 4294888708,mptcp dss ack 1720219151 seq 3867233883 subseq 281129 len 1428 csum 0xcdbc], length 1428
10:17:40.678942 IP 112.26.0.1.43445 > 112.26.0.8.36004: Flags [.], seq 281129:282557, ack 1, win 4017, options [nop,nop,TS val 135050 ecr 4294888708,mptcp dss ack 1720219151 seq 3867233883 subseq 281129 len 1428 csum 0xcdbc], length 1428
10:17:40.716786 IP 112.26.0.1.43445 > 112.26.0.8.36004: Flags [.], seq 271133:272561, ack 1, win 4017, options [nop,nop,TS val 134426 ecr 4294888010,mptcp dss ack 1720219151 seq 3867205323 subseq 271133 len 1428 csum 0xb40d], length 1428
10:17:40.780808 IP 112.26.0.1.43445 > 112.26.0.8.36004: Flags [.], seq 272561:273989, ack 1, win 4017, options [nop,nop,TS val 134512 ecr 4294888081,mptcp dss ack 1720219151 seq 3867212463 subseq 272561 len 1428 csum 0x802], length 1428
10:17:40.883458 IP 112.26.0.1.43445 > 112.26.0.8.36004: Flags [.], seq 273989:275417, ack 1, win 4017, options [nop,nop,TS val 134605 ecr 4294888130,mptcp dss ack 1720219151 seq 3867216747 subseq 273989 len 1428 csum 0xddeb], length 1428
10:17:40.914984 IP 112.26.0.8.36004 > 112.26.0.1.43445: Flags [.], ack 268277, win 24193, options [nop,nop,TS val 4294888968 ecr 133942,mptcp dss ack 3867078231], length 0
10:17:40.916854 IP 112.26.0.8.36004 > 112.26.0.1.43445: Flags [.], ack 268277, win 24193, options [nop,nop,TS val 4294888968 ecr 133942,mptcp dss ack 3867078231], length 0
10:17:40.921264 IP 112.26.0.1.43445 > 112.26.0.8.36004: Flags [.], seq 282557:283985, ack 1, win 4017, options [nop,nop,TS val 135293 ecr 4294888968,mptcp dss ack 1720219151 seq 3867246735 subseq 282557 len 1428 csum 0x3f2b], length 1428
10:17:40.921596 IP 112.26.0.1.43445 > 112.26.0.8.36004: Flags [.], seq 282557:283985, ack 1, win 4017, options [nop,nop,TS val 135293 ecr 4294888968,mptcp dss ack 1720219151 seq 3867246735 subseq 282557 len 1428 csum 0x3f2b], length 1428
10:17:41.029040 IP 112.26.0.1.43445 > 112.26.0.8.36004: Flags [.], seq 275417:276845, ack 1, win 4017, options [nop,nop,TS val 134700 ecr 4294888285,mptcp dss ack 1720219151 seq 3867219603 subseq 275417 len 1428 csum 0x5596], length 1428
