10:17:23.900123 IP 112.26.3.8.34701 > 112.26.3.1.43445: Flags [S], seq 1370810105, win 65535, options [mss 1460,sackOK,TS val 4294872456 ecr 0,nop,wscale 6,mptcp join id 5 token 0x1271d1f5 nonce 0x25c1fb65], length 0
10:17:23.979060 IP 112.26.3.8.34701 > 112.26.3.1.43445: Flags [S], seq 1370810105, win 65535, options [mss 1460,sackOK,TS val 4294872456 ecr 0,nop,wscale 6,mptcp join id 5 token 0x1271d1f5 nonce 0x25c1fb65], length 0
10:17:24.039636 IP 112.26.3.8.34701 > 112.26.3.1.43445: Flags [S], seq 1370810105, win 65535, options [mss 1460,sackOK,TS val 4294872456 ecr 0,nop,wscale 6,mptcp join id 5 token 0x1271d1f5 nonce 0x25c1fb65], length 0
10:17:24.168706 IP 112.26.3.1.43445 > 112.26.3.8.34701: Flags [S.], seq 3026531369, ack 1370810106, win 65535, options [mss 1460,sackOK,TS val 118416 ecr 4294872456,nop,wscale 6,mptcp join id 5 hmac 0xd0dcf5de2e2332d4 nonce 0xa09f8924], length 0
10:17:24.209777 IP 112.26.3.1.43445 > 112.26.3.8.34701: Flags [S.], seq 3026531369, ack 1370810106, win 65535, options [mss 1460,sackOK,TS val 118416 ecr 4294872456,nop,wscale 6,mptcp join id 5 hmac 0xd0dcf5de2e2332d4 nonce 0xa09f8924], length 0
10:17:24.239568 IP 112.26.3.8.34701 > 112.26.3.1.43445: Flags [.], ack 1, win 7848, options [nop,nop,TS val 4294872867 ecr 118416,mptcp join hmac 0x791756dfc3e442c8c54dbd511ad3c1190c151802], length 0
10:17:24.306223 IP 112.26.3.8.34701 > 112.26.3.1.43445: Flags [.], ack 1, win 7848, options [nop,nop,TS val 4294872867 ecr 118416,mptcp join hmac 0x791756dfc3e442c8c54dbd511ad3c1190c151802], length 0
10:18:04.106339 IP 112.26.3.8.34701 > 112.26.3.1.43445: Flags [.], ack 539785, win 24231, options [nop,nop,TS val 4294912302 ecr 157399,mptcp dss ack 3868160655], length 0
10:18:04.130520 IP 112.26.3.8.34701 > 112.26.3.1.43445: Flags [.], ack 546925, win 24231, options [nop,nop,TS val 4294912784 ecr 157823,mptcp dss ack 3868160655], length 0
10:18:04.136799 IP 112.26.3.8.34701 > 112.26.3.1.43445: Flags [.], ack 546925, win 24231, options [nop,nop,TS val 4294912784 ecr 157823,mptcp dss ack 3868160655], length 0
10:18:04.143621 IP 112.26.3.1.43445 > 112.26.3.8.34701: Flags [.], seq 546925:548353, ack 1, win 4017, options [nop,nop,TS val 158060 ecr 4294911975,mptcp dss ack 1720219151 seq 3868293459 subseq 546925 len 1428 csum 0x5e0e], length 1428
10:18:04.201372 IP 112.26.3.1.43445 > 112.26.3.8.34701: Flags [.], seq 548353:549781, ack 1, win 4017, options [nop,nop,TS val 158134 ecr 4294912058,mptcp dss ack 1720219151 seq 3868304883 subseq 548353 len 1428 csum 0xdc7c], length 1428
10:18:04.205254 IP 112.26.3.1.43445 > 112.26.3.8.34701: Flags [.], seq 549781:551209, ack 1, win 4017, options [nop,nop,TS val 158262 ecr 4294912137,mptcp dss ack 1720219151 seq 3868309167 subseq 549781 len 1428 csum 0xfe62], length 1428
10:18:04.243454 IP 112.26.3.8.34701 > 112.26.3.1.43445: Flags [.], ack 541213, win 24231, options [nop,nop,TS val 4294912462 ecr 157517,mptcp dss ack 3868160655], length 0
10:18:04.278333 IP 112.26.3.1.43445 > 112.26.3.8.34701: Flags [.], seq 551209:552637, ack 1, win 4017, options [nop,nop,TS val 158397 ecr 4294912211,mptcp dss ack 1720219151 seq 3868312023 subseq 551209 len 1428 csum 0xf605], length 1428
10:18:04.289514 IP 112.26.3.1.43445 > 112.26.3.8.34701: Flags [.], seq 549781:551209, ack 1, win 4017, options [nop,nop,TS val 158262 ecr 4294912137,mptcp dss ack 1720219151 seq 3868309167 subseq 549781 len 1428 csum 0xfe62], length 1428
10:18:04.300976 IP 112.26.3.8.34701 > 112.26.3.1.43445: Flags [.], ack 544069, win 24231, options [nop,nop,TS val 4294912576 ecr 157597,mptcp dss ack 3868160655], length 0
10:18:04.369047 IP 112.26.3.8.34701 > 112.26.3.1.43445: Flags [.], ack 551209, win 24231, options [nop,nop,TS val 4294913016 ecr 158060,mptcp dss ack 3868160655], length 0
10:18:04.371259 IP 112.26.3.8.34701 > 112.26.3.1.43445: Flags [.], ack 551209, win 24231, options [nop,nop,TS val 4294913016 ecr 158060,mptcp dss ack 3868160655], length 0
10:18:04.387752 IP 112.26.3.8.34701 > 112.26.3.1.43445: Flags [.], ack 546925, win 24231, options [nop,nop,TS val 4294912784 ecr 157823,mptcp dss ack 3868160655], length 0
10:18:04.389468 IP 112.26.3.1.43445 > 112.26.3.8.34701: Flags [.], seq 552637:554065, ack 1, win 4017, options [nop,nop,TS val 158482 ecr 4294912302,mptcp dss ack 1720219151 seq 3868316307 subseq 552637 len 1428 csum 0x8dca], length 1428
10:18:04.397503 IP 112.26.3.1.43445 > 112.26.3.8.34701: Flags [.], seq 551209:552637, ack 1, win 4017, options [nop,nop,TS val 158397 ecr 4294912211,mptcp dss ack 1720219151 seq 3868312023 subseq 551209 len 1428 csum 0xf605], length 1428
10:18:04.455136 IP 112.26.3.1.43445 > 112.26.3.8.34701: Flags [.], seq 554065:555493, ack 1, win 4017, options [nop,nop,TS val 158482 ecr 4294912302,mptcp dss ack 1720219151 seq 3868317735 subseq 554065 len 1428 csum 0xd5f3], length 1428
10:18:04.487330 IP 112.26.3.1.43445 > 112.26.3.8.34701: Flags [.], seq 552637:554065, ack 1, win 4017, options [nop,nop,TS val 158482 ecr 4294912302,mptcp dss ack 1720219151 seq 3868316307 subseq 552637 len 1428 csum 0x8dca], length 1428
10:18:04.497696 IP 112.26.3.8.34701 > 112.26.3.1.43445: Flags [.], ack 551209, win 24231, options [nop,nop,TS val 4294913016 ecr 158060,mptcp dss ack 3868160655], length 0
10:18:04.555797 IP 112.26.3.1.43445 > 112.26.3.8.34701: Flags [.], seq 555493:556921, ack 1, win 4017, options [nop,nop,TS val 158619 ecr 4294912462,mptcp dss ack 1720219151 seq 3868332015 subseq 555493 len 1428 csum 0xb2c5], length 1428
10:18:04.576274 IP 112.26.3.1.43445 > 112.26.3.8.34701: Flags [.], seq 554065:555493, ack 1, win 4017, options [nop,nop,TS val 158482 ecr 4294912302,mptcp dss ack 1720219151 seq 3868317735 subseq 554065 len 1428 csum 0xd5f3], length 1428
10:18:04.648686 IP 112.26.3.1.43445 > 112.26.3.8.34701: Flags [.], seq 555493:556921, ack 1, win 4017, options [nop,nop,TS val 158619 ecr 4294912462,mptcp dss ack 1720219151 seq 3868332015 subseq 555493 len 1428 csum 0xb2c5], length 1428
10:18:04.650363 IP 112.26.3.8.34701 > 112.26.3.1.43445: Flags [.], ack 556921, win 24231, options [nop,nop,TS val 4294913305 ecr 158397,mptcp dss ack 3868160655], length 0
10:18:04.654455 IP 112.26.3.8.34701 > 112.26.3.1.43445: Flags [.], ack 556921, win 24231, options [nop,nop,TS val 4294913305 ecr 158397,mptcp dss ack 3868160655], length 0
10:18:04.664497 IP 112.26.3.8.34701 > 112.26.3.1.43445: Flags [.], ack 556921, win 24231, options [nop,nop,TS val 4294913305 ecr 158397,mptcp dss ack 3868160655], length 0
10:18:04.686153 IP 112.26.3.1.43445 > 112.26.3.8.34701: Flags [.], seq 556921:558349, ack 1, win 4017, options [nop,nop,TS val 158677 ecr 4294912576,mptcp dss ack 1720219151 seq 3868333443 subseq 556921 len 1428 csum 0x7333], length 1428
10:18:04.746285 IP 112.26.3.1.43445 > 112.26.3.8.34701: Flags [.], seq 556921:558349, ack 1, win 4017, options [nop,nop,TS val 158677 ecr 4294912576,mptcp dss ack 1720219151 seq 3868333443 subseq 556921 len 1428 csum 0x7333], length 1428
10:18:04.807732 IP 112.26.3.1.43445 > 112.26.3.8.34701: Flags [.], seq 558349:559777, ack 1, win 4017, options [nop,nop,TS val 158677 ecr 4294912576,mptcp dss ack 1720219151 seq 3868334871 subseq 558349 len 1428 csum 0xb06], length 1428
10:18:04.810039 IP 112.26.3.1.43445 > 112.26.3.8.34701: Flags [.], seq 558349:559777, ack 1, win 4017, options [nop,nop,TS val 158677 ecr 4294912576,mptcp dss ack 1720219151 seq 3868334871 subseq 558349 len 1428 csum 0xb06], length 1428
10:18:04.853480 IP 112.26.3.8.34701 > 112.26.3.1.43445: Flags [.], ack 559777, win 24209, options [nop,nop,TS val 4294913508 ecr 158677,mptcp dss ack 3868162083], length 0
10:18:04.855017 IP 112.26.3.8.34701 > 112.26.3.1.43445: Flags [.], ack 559777, win 24209, options [nop,nop,TS val 4294913508 ecr 158677,mptcp dss ack 3868162083], length 0
10:18:04.858156 IP 112.26.3.8.34701 > 112.26.3.1.43445: Flags [.], ack 559777, win 24209, options [nop,nop,TS val 4294913508 ecr 158677,mptcp dss ack 3868162083], length 0
10:18:04.893623 IP 112.26.3.1.43445 > 112.26.3.8.34701: Flags [.], seq 559777:561205, ack 1, win 4017, options [nop,nop,TS val 158764 ecr 4294912784,mptcp dss ack 1720219151 seq 3868336299 subseq 559777 len 1428 csum 0x6034], length 1428
10:18:04.900350 IP 112.26.3.1.43445 > 112.26.3.8.34701: Flags [.], seq 559777:561205, ack 1, win 4017, options [nop,nop,TS val 158764 ecr 4294912784,mptcp dss ack 1720219151 seq 3868336299 subseq 559777 len 1428 csum 0x6034], length 1428
10:18:04.979110 IP 112.26.3.1.43445 > 112.26.3.8.34701: Flags [.], seq 561205:562633, ack 1, win 4017, options [nop,nop,TS val 158764 ecr 4294912784,mptcp dss ack 1720219151 seq 3868337727 subseq 561205 len 1428 csum 0x99f5], length 1428
10:18:04.993719 IP 112.26.3.1.43445 > 112.26.3.8.34701: Flags [.], seq 561205:562633, ack 1, win 4017, options [nop,nop,TS val 158764 ecr 4294912784,mptcp dss ack 1720219151 seq 3868337727 subseq 561205 len 1428 csum 0x99f5], length 1428
10:18:05.072088 IP 112.26.3.8.34701 > 112.26.3.1.43445: Flags [.], ack 562633, win 24209, options [nop,nop,TS val 4294913728 ecr 158764,mptcp dss ack 3868162083], length 0
10:18:05.074216 IP 112.26.3.8.34701 > 112.26.3.1.43445: Flags [.], ack 562633, win 24209, options [nop,nop,TS val 4294913728 ecr 158764,mptcp dss ack 3868162083], length 0
10:18:05.079782 IP 112.26.3.8.34701 > 112.26.3.1.43445: Flags [.], ack 562633, win 24209, options [nop,nop,TS val 4294913728 ecr 158764,mptcp dss ack 3868162083], length 0
10:18:05.116164 IP 112.26.3.1.43445 > 112.26.3.8.34701: Flags [.], seq 562633:564061, ack 1, win 4017, options [nop,nop,TS val 158874 ecr 4294913016,mptcp dss ack 1720219151 seq 3868257759 subseq 562633 len 1428 csum 0xbd01], length 1428
10:18:05.121480 IP 112.26.3.1.43445 > 112.26.3.8.34701: Flags [.], seq 562633:564061, ack 1, win 4017, options [nop,nop,TS val 158874 ecr 4294913016,mptcp dss ack 1720219151 seq 3868257759 subseq 562633 len 1428 csum 0xbd01], length 1428
10:18:05.184641 IP 112.26.3.1.43445 > 112.26.3.8.34701: Flags [.], seq 564061:565489, ack 1, win 4017, options [nop,nop,TS val 158874 ecr 4294913016,mptcp dss ack 1720219151 seq 3868259187 subseq 564061 len 1428 csum 0xcd44], length 1428
10:18:05.188068 IP 112.26.3.1.43445 > 112.26.3.8.34701: Flags [.], seq 564061:565489, ack 1, win 4017, options [nop,nop,TS val 158874 ecr 4294913016,mptcp dss ack 1720219151 seq 3868259187 subseq 564061 len 1428 csum 0xcd44], length 1428
10:18:05.300018 IP 112.26.3.1.43445 > 112.26.3.8.34701: Flags [.], seq 565489:566917, ack 1, win 4017, options [nop,nop,TS val 158874 ecr 4294913016,mptcp dss ack 1720219151 seq 3868263471 subseq 565489 len 1428 csum 0xede2], length 1428
10:18:05.302607 IP 112.26.3.1.43445 > 112.26.3.8.34701: Flags [.], seq 565489:566917, ack 1, win 4017, options [nop,nop,TS val 158874 ecr 4294913016,mptcp dss ack 1720219151 seq 3868263471 subseq 565489 len 1428 csum 0xede2], length 1428
10:18:05.397450 IP 112.26.3.1.43445 > 112.26.3.8.34701: Flags [.], seq 566917:568345, ack 1, win 4017, options [nop,nop,TS val 159040 ecr 4294913305,mptcp dss ack 1720219151 seq 3868310595 subseq 566917 len 1428 csum 0x2020], length 1428
10:18:05.399464 IP 112.26.3.1.43445 > 112.26.3.8.34701: Flags [.], seq 566917:568345, ack 1, win 4017, options [nop,nop,TS val 159040 ecr 4294913305,mptcp dss ack 1720219151 seq 3868310595 subseq 566917 len 1428 csum 0x2020], length 1428
10:18:05.401951 IP 112.26.3.8.34701 > 112.26.3.1.43445: Flags [.], ack 568345, win 24209, options [nop,nop,TS val 4294914056 ecr 158874,mptcp dss ack 3868162083], length 0
10:18:05.404377 IP 112.26.3.8.34701 > 112.26.3.1.43445: Flags [.], ack 568345, win 24209, options [nop,nop,TS val 4294914056 ecr 158874,mptcp dss ack 3868162083], length 0
10:18:05.416712 IP 112.26.3.8.34701 > 112.26.3.1.43445: Flags [.], ack 568345, win 24209, options [nop,nop,TS val 4294914056 ecr 158874,mptcp dss ack 3868162083], length 0
10:18:05.466057 IP 112.26.3.1.43445 > 112.26.3.8.34701: Flags [.], seq 568345:569773, ack 1, win 4017, options [nop,nop,TS val 159040 ecr 4294913305,mptcp dss ack 1720219151 seq 3868314879 subseq 568345 len 1428 csum 0x79d6], length 1428
10:18:05.491359 IP 112.26.3.1.43445 > 112.26.3.8.34701: Flags [.], seq 568345:569773, ack 1, win 4017, options [nop,nop,TS val 159040 ecr 4294913305,mptcp dss ack 1720219151 seq 3868314879 subseq 568345 len 1428 csum 0x79d6], length 1428
10:18:05.591766 IP 112.26.3.1.43445 > 112.26.3.8.34701: Flags [.], seq 569773:571201, ack 1, win 4017, options [nop,nop,TS val 159040 ecr 4294913305,mptcp dss ack 1720219151 seq 3868330587 subseq 569773 len 1428 csum 0x1550], length 1428
10:18:05.594536 IP 112.26.3.1.43445 > 112.26.3.8.34701: Flags [.], seq 569773:571201, ack 1, win 4017, options [nop,nop,TS val 159040 ecr 4294913305,mptcp dss ack 1720219151 seq 3868330587 subseq 569773 len 1428 csum 0x1550], length 1428
10:18:05.692665 IP 112.26.3.1.43445 > 112.26.3.8.34701: Flags [.], seq 571201:572629, ack 1, win 4017, options [nop,nop,TS val 159040 ecr 4294913305,mptcp dss ack 1720219151 seq 3868339155 subseq 571201 len 1428 csum 0xcdf1], length 1428
10:18:05.696070 IP 112.26.3.1.43445 > 112.26.3.8.34701: Flags [.], seq 571201:572629, ack 1, win 4017, options [nop,nop,TS val 159040 ecr 4294913305,mptcp dss ack 1720219151 seq 3868339155 subseq 571201 len 1428 csum 0xcdf1], length 1428
10:18:05.701934 IP 112.26.3.8.34701 > 112.26.3.1.43445: Flags [.], ack 571201, win 24209, options [nop,nop,TS val 4294914352 ecr 159040,mptcp dss ack 3868162083], length 0
10:18:05.721017 IP 112.26.3.8.34701 > 112.26.3.1.43445: Flags [.], ack 571201, win 24209, options [nop,nop,TS val 4294914352 ecr 159040,mptcp dss ack 3868162083], length 0
10:18:05.725775 IP 112.26.3.8.34701 > 112.26.3.1.43445: Flags [.], ack 571201, win 24209, options [nop,nop,TS val 4294914352 ecr 159040,mptcp dss ack 3868162083], length 0
10:18:05.792329 IP 112.26.3.1.43445 > 112.26.3.8.34701: Flags [.], seq 572629:574057, ack 1, win 4017, options [nop,nop,TS val 159234 ecr 4294913508,mptcp dss ack 1720219151 seq 3868340583 subseq 572629 len 1428 csum 0xae3e], length 1428
10:18:05.804049 IP 112.26.3.1.43445 > 112.26.3.8.34701: Flags [.], seq 572629:574057, ack 1, win 4017, options [nop,nop,TS val 159234 ecr 4294913508,mptcp dss ack 1720219151 seq 3868340583 subseq 572629 len 1428 csum 0xae3e], length 1428
10:18:05.886800 IP 112.26.3.1.43445 > 112.26.3.8.34701: Flags [.], seq 574057:575485, ack 1, win 4017, options [nop,nop,TS val 159234 ecr 4294913508,mptcp dss ack 1720219151 seq 3868342011 subseq 574057 len 1428 csum 0x3c25], length 1428
10:18:05.889336 IP 112.26.3.1.43445 > 112.26.3.8.34701: Flags [.], seq 574057:575485, ack 1, win 4017, options [nop,nop,TS val 159234 ecr 4294913508,mptcp dss ack 1720219151 seq 3868342011 subseq 574057 len 1428 csum 0x3c25], length 1428
10:18:05.974933 IP 112.26.3.1.43445 > 112.26.3.8.34701: Flags [.], seq 575485:576913, ack 1, win 4017, options [nop,nop,TS val 159456 ecr 4294913728,mptcp dss ack 1720219151 seq 3868352007 subseq 575485 len 1428 csum 0x35d3], length 1428
10:18:05.989698 IP 112.26.3.1.43445 > 112.26.3.8.34701: Flags [.], seq 575485:576913, ack 1, win 4017, options [nop,nop,TS val 159456 ecr 4294913728,mptcp dss ack 1720219151 seq 3868352007 subseq 575485 len 1428 csum 0x35d3], length 1428
10:18:05.990990 IP 112.26.3.8.34701 > 112.26.3.1.43445: Flags [.], ack 576913, win 24209, options [nop,nop,TS val 4294914646 ecr 159040,mptcp dss ack 3868162083], length 0
10:18:05.995525 IP 112.26.3.8.34701 > 112.26.3.1.43445: Flags [.], ack 576913, win 24209, options [nop,nop,TS val 4294914646 ecr 159040,mptcp dss ack 3868162083], length 0
10:18:05.997954 IP 112.26.3.8.34701 > 112.26.3.1.43445: Flags [.], ack 576913, win 24209, options [nop,nop,TS val 4294914646 ecr 159040,mptcp dss ack 3868162083], length 0
10:18:06.101430 IP 112.26.3.1.43445 > 112.26.3.8.34701: Flags [.], seq 578341:579769, ack 1, win 4017, options [nop,nop,TS val 159793 ecr 4294914056,mptcp dss ack 1720219151 seq 3868364859 subseq 578341 len 1428 csum 0xabfd], length 1428
10:18:06.109338 IP 112.26.3.1.43445 > 112.26.3.8.34701: Flags [.], seq 578341:579769, ack 1, win 4017, options [nop,nop,TS val 159793 ecr 4294914056,mptcp dss ack 1720219151 seq 3868364859 subseq 578341 len 1428 csum 0xabfd], length 1428
10:18:06.111301 IP 112.26.3.8.34701 > 112.26.3.1.43445: Flags [.], ack 576913, win 24209, options [nop,nop,TS val 4294914766 ecr 159040,nop,nop,sack 1 {578341:579769},mptcp dss ack 3868162083], length 0
10:18:06.144549 IP 112.26.3.8.34701 > 112.26.3.1.43445: Flags [.], ack 576913, win 24209, options [nop,nop,TS val 4294914766 ecr 159040,nop,nop,sack 1 {578341:579769},mptcp dss ack 3868162083], length 0
10:18:06.149556 IP 112.26.3.8.34701 > 112.26.3.1.43445: Flags [.], ack 576913, win 24209, options [nop,nop,TS val 4294914766 ecr 159040,nop,nop,sack 1 {578341:579769},mptcp dss ack 3868162083], length 0
10:18:06.179169 IP 112.26.3.1.43445 > 112.26.3.8.34701: Flags [.], seq 579769:581197, ack 1, win 4017, options [nop,nop,TS val 159793 ecr 4294914056,mptcp dss ack 1720219151 seq 3868366287 subseq 579769 len 1428 csum 0x7cc4], length 1428
10:18:06.212948 IP 112.26.3.1.43445 > 112.26.3.8.34701: Flags [.], seq 579769:581197, ack 1, win 4017, options [nop,nop,TS val 159793 ecr 4294914056,mptcp dss ack 1720219151 seq 3868366287 subseq 579769 len 1428 csum 0x7cc4], length 1428
10:18:06.214485 IP 112.26.3.8.34701 > 112.26.3.1.43445: Flags [.], ack 576913, win 24209, options [nop,nop,TS val 4294914869 ecr 159040,nop,nop,sack 1 {578341:581197},mptcp dss ack 3868162083], length 0
10:18:06.218956 IP 112.26.3.8.34701 > 112.26.3.1.43445: Flags [.], ack 576913, win 24209, options [nop,nop,TS val 4294914869 ecr 159040,nop,nop,sack 1 {578341:581197},mptcp dss ack 3868162083], length 0
10:18:06.267557 IP 112.26.3.8.34701 > 112.26.3.1.43445: Flags [.], ack 576913, win 24209, options [nop,nop,TS val 4294914869 ecr 159040,nop,nop,sack 1 {578341:581197},mptcp dss ack 3868162083], length 0
10:18:06.302013 IP 112.26.3.1.43445 > 112.26.3.8.34701: Flags [.], seq 581197:582625, ack 1, win 4017, options [nop,nop,TS val 159793 ecr 4294914056,mptcp dss ack 1720219151 seq 3868367715 subseq 581197 len 1428 csum 0x4f63], length 1428
10:18:06.327338 IP 112.26.3.1.43445 > 112.26.3.8.34701: Flags [.], seq 581197:582625, ack 1, win 4017, options [nop,nop,TS val 159793 ecr 4294914056,mptcp dss ack 1720219151 seq 3868367715 subseq 581197 len 1428 csum 0x4f63], length 1428
10:18:06.329634 IP 112.26.3.8.34701 > 112.26.3.1.43445: Flags [.], ack 576913, win 24209, options [nop,nop,TS val 4294914984 ecr 159040,nop,nop,sack 1 {578341:582625},mptcp dss ack 3868162083], length 0
10:18:06.357791 IP 112.26.3.8.34701 > 112.26.3.1.43445: Flags [.], ack 576913, win 24209, options [nop,nop,TS val 4294914984 ecr 159040,nop,nop,sack 1 {578341:582625},mptcp dss ack 3868162083], length 0
10:18:06.426235 IP 112.26.3.8.34701 > 112.26.3.1.43445: Flags [.], ack 576913, win 24209, options [nop,nop,TS val 4294914984 ecr 159040,nop,nop,sack 1 {578341:582625},mptcp dss ack 3868162083], length 0
10:18:06.450374 IP 112.26.3.1.43445 > 112.26.3.8.34701: Flags [.], seq 584053:585481, ack 1, win 4017, options [nop,nop,TS val 160102 ecr 4294914352,mptcp dss ack 1720219151 seq 3868389135 subseq 584053 len 1428 csum 0x6ad5], length 1428
10:18:06.453070 IP 112.26.3.1.43445 > 112.26.3.8.34701: Flags [.], seq 584053:585481, ack 1, win 4017, options [nop,nop,TS val 160102 ecr 4294914352,mptcp dss ack 1720219151 seq 3868389135 subseq 584053 len 1428 csum 0x6ad5], length 1428
10:18:06.455798 IP 112.26.3.8.34701 > 112.26.3.1.43445: Flags [.], ack 576913, win 24209, options [nop,nop,TS val 4294915109 ecr 159040,nop,nop,sack 2 {584053:585481}{578341:582625},mptcp dss ack 3868162083], length 0
10:18:06.475981 IP 112.26.3.8.34701 > 112.26.3.1.43445: Flags [.], ack 576913, win 24209, options [nop,nop,TS val 4294915109 ecr 159040,nop,nop,sack 2 {584053:585481}{578341:582625},mptcp dss ack 3868162083], length 0
10:18:06.507919 IP 112.26.3.1.43445 > 112.26.3.8.34701: Flags [.], seq 585481:586909, ack 1, win 4017, options [nop,nop,TS val 160102 ecr 4294914352,mptcp dss ack 1720219151 seq 3868390563 subseq 585481 len 1428 csum 0x87ef], length 1428
10:18:06.519325 IP 112.26.3.8.34701 > 112.26.3.1.43445: Flags [.], ack 576913, win 24209, options [nop,nop,TS val 4294915109 ecr 159040,nop,nop,sack 2 {584053:585481}{578341:582625},mptcp dss ack 3868162083], length 0
10:18:06.551781 IP 112.26.3.1.43445 > 112.26.3.8.34701: Flags [.], seq 585481:586909, ack 1, win 4017, options [nop,nop,TS val 160102 ecr 4294914352,mptcp dss ack 1720219151 seq 3868390563 subseq 585481 len 1428 csum 0x87ef], length 1428
10:18:06.553880 IP 112.26.3.8.34701 > 112.26.3.1.43445: Flags [.], ack 576913, win 24209, options [nop,nop,TS val 4294915208 ecr 159040,nop,nop,sack 2 {584053:586909}{578341:582625},mptcp dss ack 3868162083], length 0
10:18:06.558508 IP 112.26.3.8.34701 > 112.26.3.1.43445: Flags [.], ack 576913, win 24209, options [nop,nop,TS val 4294915208 ecr 159040,nop,nop,sack 2 {584053:586909}{578341:582625},mptcp dss ack 3868162083], length 0
10:18:06.595858 IP 112.26.3.8.34701 > 112.26.3.1.43445: Flags [.], ack 576913, win 24209, options [nop,nop,TS val 4294915208 ecr 159040,nop,nop,sack 2 {584053:586909}{578341:582625},mptcp dss ack 3868162083], length 0
10:18:06.605405 IP 112.26.3.1.43445 > 112.26.3.8.34701: Flags [.], seq 586909:588337, ack 1, win 4017, options [nop,nop,TS val 160102 ecr 4294914352,mptcp dss ack 1720219151 seq 3868391991 subseq 586909 len 1428 csum 0x1617], length 1428
10:18:06.637886 IP 112.26.3.1.43445 > 112.26.3.8.34701: Flags [.], seq 586909:588337, ack 1, win 4017, options [nop,nop,TS val 160102 ecr 4294914352,mptcp dss ack 1720219151 seq 3868391991 subseq 586909 len 1428 csum 0x1617], length 1428
10:18:06.642411 IP 112.26.3.8.34701 > 112.26.3.1.43445: Flags [.], ack 576913, win 24209, options [nop,nop,TS val 4294915294 ecr 159040,nop,nop,sack 2 {584053:588337}{578341:582625},mptcp dss ack 3868162083], length 0
10:18:06.644024 IP 112.26.3.8.34701 > 112.26.3.1.43445: Flags [.], ack 576913, win 24209, options [nop,nop,TS val 4294915294 ecr 159040,nop,nop,sack 2 {584053:588337}{578341:582625},mptcp dss ack 3868162083], length 0
10:18:06.692251 IP 112.26.3.1.43445 > 112.26.3.8.34701: Flags [.], seq 588337:589765, ack 1, win 4017, options [nop,nop,TS val 160374 ecr 4294914646,mptcp dss ack 1720219151 seq 3868397703 subseq 588337 len 1428 csum 0x8ed6], length 1428
10:18:06.708367 IP 112.26.3.1.43445 > 112.26.3.8.34701: Flags [.], seq 588337:589765, ack 1, win 4017, options [nop,nop,TS val 160374 ecr 4294914646,mptcp dss ack 1720219151 seq 3868397703 subseq 588337 len 1428 csum 0x8ed6], length 1428
10:18:06.712457 IP 112.26.3.8.34701 > 112.26.3.1.43445: Flags [.], ack 576913, win 24209, options [nop,nop,TS val 4294915294 ecr 159040,nop,nop,sack 2 {584053:588337}{578341:582625},mptcp dss ack 3868162083], length 0
10:18:06.741784 IP 112.26.3.8.34701 > 112.26.3.1.43445: Flags [.], ack 576913, win 24209, options [nop,nop,TS val 4294915365 ecr 159040,nop,nop,sack 2 {584053:589765}{578341:582625},mptcp dss ack 3868162083], length 0
10:18:06.743486 IP 112.26.3.8.34701 > 112.26.3.1.43445: Flags [.], ack 576913, win 24209, options [nop,nop,TS val 4294915365 ecr 159040,nop,nop,sack 2 {584053:589765}{578341:582625},mptcp dss ack 3868162083], length 0
10:18:06.784953 IP 112.26.3.1.43445 > 112.26.3.8.34701: Flags [.], seq 589765:591193, ack 1, win 4017, options [nop,nop,TS val 160374 ecr 4294914646,mptcp dss ack 1720219151 seq 3868399131 subseq 589765 len 1428 csum 0xa4d], length 1428
10:18:06.790438 IP 112.26.3.8.34701 > 112.26.3.1.43445: Flags [.], ack 576913, win 24209, options [nop,nop,TS val 4294915441 ecr 159040,nop,nop,sack 2 {584053:591193}{578341:582625},mptcp dss ack 3868162083], length 0
10:18:06.793868 IP 112.26.3.8.34701 > 112.26.3.1.43445: Flags [.], ack 576913, win 24209, options [nop,nop,TS val 4294915441 ecr 159040,nop,nop,sack 2 {584053:591193}{578341:582625},mptcp dss ack 3868162083], length 0
10:18:06.795605 IP 112.26.3.1.43445 > 112.26.3.8.34701: Flags [.], seq 589765:591193, ack 1, win 4017, options [nop,nop,TS val 160374 ecr 4294914646,mptcp dss ack 1720219151 seq 3868399131 subseq 589765 len 1428 csum 0xa4d], length 1428
10:18:06.819939 IP 112.26.3.8.34701 > 112.26.3.1.43445: Flags [.], ack 576913, win 24209, options [nop,nop,TS val 4294915365 ecr 159040,nop,nop,sack 2 {584053:589765}{578341:582625},mptcp dss ack 3868162083], length 0
10:18:06.856763 IP 112.26.3.8.34701 > 112.26.3.1.43445: Flags [.], ack 576913, win 24209, options [nop,nop,TS val 4294915441 ecr 159040,nop,nop,sack 2 {584053:591193}{578341:582625},mptcp dss ack 3868162083], length 0
10:18:06.877450 IP 112.26.3.1.43445 > 112.26.3.8.34701: Flags [.], seq 591193:592621, ack 1, win 4017, options [nop,nop,TS val 160374 ecr 4294914646,mptcp dss ack 1720219151 seq 3868400559 subseq 591193 len 1428 csum 0xe32], length 1428
10:18:06.881270 IP 112.26.3.1.43445 > 112.26.3.8.34701: Flags [.], seq 591193:592621, ack 1, win 4017, options [nop,nop,TS val 160374 ecr 4294914646,mptcp dss ack 1720219151 seq 3868400559 subseq 591193 len 1428 csum 0xe32], length 1428
10:18:06.882781 IP 112.26.3.8.34701 > 112.26.3.1.43445: Flags [.], ack 576913, win 24209, options [nop,nop,TS val 4294915538 ecr 159040,nop,nop,sack 2 {584053:592621}{578341:582625},mptcp dss ack 3868162083], length 0
10:18:06.884556 IP 112.26.3.8.34701 > 112.26.3.1.43445: Flags [.], ack 576913, win 24209, options [nop,nop,TS val 4294915538 ecr 159040,nop,nop,sack 2 {584053:592621}{578341:582625},mptcp dss ack 3868162083], length 0
10:18:06.937499 IP 112.26.3.1.43445 > 112.26.3.8.34701: Flags [.], seq 592621:594049, ack 1, win 4017, options [nop,nop,TS val 160374 ecr 4294914646,mptcp dss ack 1720219151 seq 3868401987 subseq 592621 len 1428 csum 0xa14], length 1428
10:18:06.977563 IP 112.26.3.1.43445 > 112.26.3.8.34701: Flags [.], seq 592621:594049, ack 1, win 4017, options [nop,nop,TS val 160374 ecr 4294914646,mptcp dss ack 1720219151 seq 3868401987 subseq 592621 len 1428 csum 0xa14], length 1428
10:18:06.982133 IP 112.26.3.8.34701 > 112.26.3.1.43445: Flags [.], ack 576913, win 24209, options [nop,nop,TS val 4294915634 ecr 159040,nop,nop,sack 2 {584053:594049}{578341:582625},mptcp dss ack 3868162083], length 0
10:18:06.985241 IP 112.26.3.8.34701 > 112.26.3.1.43445: Flags [.], ack 576913, win 24209, options [nop,nop,TS val 4294915634 ecr 159040,nop,nop,sack 2 {584053:594049}{578341:582625},mptcp dss ack 3868162083], length 0
10:18:07.030667 IP 112.26.3.8.34701 > 112.26.3.1.43445: Flags [.], ack 576913, win 24209, options [nop,nop,TS val 4294915538 ecr 159040,nop,nop,sack 2 {584053:592621}{578341:582625},mptcp dss ack 3868162083], length 0
10:18:07.042717 IP 112.26.3.1.43445 > 112.26.3.8.34701: Flags [.], seq 594049:595477, ack 1, win 4017, options [nop,nop,TS val 160643 ecr 4294914766,mptcp dss ack 1720219151 seq 3868414839 subseq 594049 len 1428 csum 0x878c], length 1428
10:18:07.044657 IP 112.26.3.1.43445 > 112.26.3.8.34701: Flags [.], seq 594049:595477, ack 1, win 4017, options [nop,nop,TS val 160643 ecr 4294914766,mptcp dss ack 1720219151 seq 3868414839 subseq 594049 len 1428 csum 0x878c], length 1428
10:18:07.072898 IP 112.26.3.8.34701 > 112.26.3.1.43445: Flags [.], ack 576913, win 24209, options [nop,nop,TS val 4294915701 ecr 159040,nop,nop,sack 2 {584053:595477}{578341:582625},mptcp dss ack 3868162083], length 0
10:18:07.074999 IP 112.26.3.8.34701 > 112.26.3.1.43445: Flags [.], ack 576913, win 24209, options [nop,nop,TS val 4294915701 ecr 159040,nop,nop,sack 2 {584053:595477}{578341:582625},mptcp dss ack 3868162083], length 0
10:18:07.111764 IP 112.26.3.8.34701 > 112.26.3.1.43445: Flags [.], ack 576913, win 24209, options [nop,nop,TS val 4294915634 ecr 159040,nop,nop,sack 2 {584053:594049}{578341:582625},mptcp dss ack 3868162083], length 0
10:18:07.115701 IP 112.26.3.1.43445 > 112.26.3.8.34701: Flags [.], seq 595477:596905, ack 1, win 4017, options [nop,nop,TS val 160655 ecr 4294914869,mptcp dss ack 1720219151 seq 3868416267 subseq 595477 len 1428 csum 0xc65c], length 1428
10:18:07.144879 IP 112.26.3.1.43445 > 112.26.3.8.34701: Flags [.], seq 595477:596905, ack 1, win 4017, options [nop,nop,TS val 160655 ecr 4294914869,mptcp dss ack 1720219151 seq 3868416267 subseq 595477 len 1428 csum 0xc65c], length 1428
10:18:07.161365 IP 112.26.3.8.34701 > 112.26.3.1.43445: Flags [.], ack 576913, win 24209, options [nop,nop,TS val 4294915801 ecr 159040,nop,nop,sack 2 {584053:596905}{578341:582625},mptcp dss ack 3868162083], length 0
10:18:07.163707 IP 112.26.3.8.34701 > 112.26.3.1.43445: Flags [.], ack 576913, win 24209, options [nop,nop,TS val 4294915801 ecr 159040,nop,nop,sack 2 {584053:596905}{578341:582625},mptcp dss ack 3868162083], length 0
10:18:07.226786 IP 112.26.3.8.34701 > 112.26.3.1.43445: Flags [.], ack 576913, win 24209, options [nop,nop,TS val 4294915701 ecr 159040,nop,nop,sack 2 {584053:595477}{578341:582625},mptcp dss ack 3868162083], length 0
10:18:07.240980 IP 112.26.3.1.43445 > 112.26.3.8.34701: Flags [.], seq 576913:578341, ack 1, win 4017, options [nop,nop,TS val 160802 ecr 4294914984,mptcp dss ack 1720219151 seq 3868353435 subseq 576913 len 1428 csum 0x4225], length 1428
10:18:07.244957 IP 112.26.3.1.43445 > 112.26.3.8.34701: Flags [.], seq 576913:578341, ack 1, win 4017, options [nop,nop,TS val 160802 ecr 4294914984,mptcp dss ack 1720219151 seq 3868353435 subseq 576913 len 1428 csum 0x4225], length 1428
10:18:07.246911 IP 112.26.3.8.34701 > 112.26.3.1.43445: Flags [.], ack 582625, win 24209, options [nop,nop,TS val 4294915902 ecr 160802,nop,nop,sack 1 {584053:596905},mptcp dss ack 3868162083], length 0
10:18:07.254960 IP 112.26.3.8.34701 > 112.26.3.1.43445: Flags [.], ack 582625, win 24209, options [nop,nop,TS val 4294915902 ecr 160802,nop,nop,sack 1 {584053:596905},mptcp dss ack 3868162083], length 0
10:18:07.335818 IP 112.26.3.1.43445 > 112.26.3.8.34701: Flags [.], seq 582625:584053, ack 1, win 4017, options [nop,nop,TS val 160895 ecr 4294915109,mptcp dss ack 1720219151 seq 3868369143 subseq 582625 len 1428 csum 0x8c71], length 1428
10:18:07.374008 IP 112.26.3.1.43445 > 112.26.3.8.34701: Flags [.], seq 582625:584053, ack 1, win 4017, options [nop,nop,TS val 160895 ecr 4294915109,mptcp dss ack 1720219151 seq 3868369143 subseq 582625 len 1428 csum 0x8c71], length 1428
10:18:07.381244 IP 112.26.3.8.34701 > 112.26.3.1.43445: Flags [.], ack 596905, win 24209, options [nop,nop,TS val 4294916031 ecr 160895,mptcp dss ack 3868162083], length 0
10:18:07.382777 IP 112.26.3.1.43445 > 112.26.3.8.34701: Flags [.], seq 596905:598333, ack 1, win 4017, options [nop,nop,TS val 161232 ecr 4294915365,mptcp dss ack 1720219151 seq 3868436259 subseq 596905 len 1428 csum 0xeac7], length 1428
10:18:07.383958 IP 112.26.3.8.34701 > 112.26.3.1.43445: Flags [.], ack 596905, win 24209, options [nop,nop,TS val 4294916031 ecr 160895,mptcp dss ack 3868162083], length 0
10:18:07.393802 IP 112.26.3.8.34701 > 112.26.3.1.43445: Flags [.], ack 576913, win 24209, options [nop,nop,TS val 4294915801 ecr 159040,nop,nop,sack 2 {584053:596905}{578341:582625},mptcp dss ack 3868162083], length 0
10:18:07.449122 IP 112.26.3.1.43445 > 112.26.3.8.34701: Flags [.], seq 596905:598333, ack 1, win 4017, options [nop,nop,TS val 161232 ecr 4294915365,mptcp dss ack 1720219151 seq 3868436259 subseq 596905 len 1428 csum 0xeac7], length 1428
10:18:07.451911 IP 112.26.3.8.34701 > 112.26.3.1.43445: Flags [.], ack 598333, win 24209, options [nop,nop,TS val 4294916106 ecr 161232,mptcp dss ack 3868162083], length 0
10:18:07.461083 IP 112.26.3.8.34701 > 112.26.3.1.43445: Flags [.], ack 582625, win 24209, options [nop,nop,TS val 4294915902 ecr 160802,nop,nop,sack 1 {584053:596905},mptcp dss ack 3868162083], length 0
10:18:07.469940 IP 112.26.3.8.34701 > 112.26.3.1.43445: Flags [.], ack 598333, win 24209, options [nop,nop,TS val 4294916106 ecr 161232,mptcp dss ack 3868162083], length 0
10:18:07.506414 IP 112.26.3.1.43445 > 112.26.3.8.34701: Flags [.], seq 598333:599761, ack 1, win 4017, options [nop,nop,TS val 161274 ecr 4294915441,mptcp dss ack 1720219151 seq 3868437687 subseq 598333 len 1428 csum 0x4fea], length 1428
10:18:07.568326 IP 112.26.3.1.43445 > 112.26.3.8.34701: Flags [.], seq 599761:601189, ack 1, win 4017, options [nop,nop,TS val 161488 ecr 4294915538,mptcp dss ack 1720219151 seq 3868447683 subseq 599761 len 1428 csum 0x1239], length 1428
10:18:07.587181 IP 112.26.3.1.43445 > 112.26.3.8.34701: Flags [.], seq 598333:599761, ack 1, win 4017, options [nop,nop,TS val 161274 ecr 4294915441,mptcp dss ack 1720219151 seq 3868437687 subseq 598333 len 1428 csum 0x4fea], length 1428
10:18:07.588855 IP 112.26.3.8.34701 > 112.26.3.1.43445: Flags [.], ack 599761, win 24209, options [nop,nop,TS val 4294916244 ecr 161274,mptcp dss ack 3868162083], length 0
10:18:07.598785 IP 112.26.3.8.34701 > 112.26.3.1.43445: Flags [.], ack 599761, win 24209, options [nop,nop,TS val 4294916244 ecr 161274,mptcp dss ack 3868162083], length 0
10:18:07.629355 IP 112.26.3.8.34701 > 112.26.3.1.43445: Flags [.], ack 596905, win 24209, options [nop,nop,TS val 4294916031 ecr 160895,mptcp dss ack 3868162083], length 0
10:18:07.659374 IP 112.26.3.1.43445 > 112.26.3.8.34701: Flags [.], seq 601189:602617, ack 1, win 4017, options [nop,nop,TS val 161550 ecr 4294915634,mptcp dss ack 1720219151 seq 3868449111 subseq 601189 len 1428 csum 0xe49f], length 1428
10:18:07.686208 IP 112.26.3.1.43445 > 112.26.3.8.34701: Flags [.], seq 599761:601189, ack 1, win 4017, options [nop,nop,TS val 161488 ecr 4294915538,mptcp dss ack 1720219151 seq 3868447683 subseq 599761 len 1428 csum 0x1239], length 1428
10:18:07.687981 IP 112.26.3.8.34701 > 112.26.3.1.43445: Flags [.], ack 601189, win 24209, options [nop,nop,TS val 4294916343 ecr 161488,mptcp dss ack 3868162083], length 0
10:18:07.694045 IP 112.26.3.8.34701 > 112.26.3.1.43445: Flags [.], ack 601189, win 24209, options [nop,nop,TS val 4294916343 ecr 161488,mptcp dss ack 3868162083], length 0
10:18:07.720910 IP 112.26.3.8.34701 > 112.26.3.1.43445: Flags [.], ack 598333, win 24209, options [nop,nop,TS val 4294916106 ecr 161232,mptcp dss ack 3868162083], length 0
10:18:07.754506 IP 112.26.3.1.43445 > 112.26.3.8.34701: Flags [.], seq 602617:604045, ack 1, win 4017, options [nop,nop,TS val 161610 ecr 4294915701,mptcp dss ack 1720219151 seq 3868451967 subseq 602617 len 1428 csum 0x9a2], length 1428
10:18:07.778380 IP 112.26.3.1.43445 > 112.26.3.8.34701: Flags [.], seq 601189:602617, ack 1, win 4017, options [nop,nop,TS val 161550 ecr 4294915634,mptcp dss ack 1720219151 seq 3868449111 subseq 601189 len 1428 csum 0xe49f], length 1428
10:18:07.779664 IP 112.26.3.8.34701 > 112.26.3.1.43445: Flags [.], ack 602617, win 24209, options [nop,nop,TS val 4294916435 ecr 161550,mptcp dss ack 3868162083], length 0
10:18:07.781710 IP 112.26.3.8.34701 > 112.26.3.1.43445: Flags [.], ack 602617, win 24209, options [nop,nop,TS val 4294916435 ecr 161550,mptcp dss ack 3868162083], length 0
10:18:07.835961 IP 112.26.3.8.34701 > 112.26.3.1.43445: Flags [.], ack 599761, win 24209, options [nop,nop,TS val 4294916244 ecr 161274,mptcp dss ack 3868162083], length 0
10:18:07.855014 IP 112.26.3.1.43445 > 112.26.3.8.34701: Flags [.], seq 604045:605473, ack 1, win 4017, options [nop,nop,TS val 161837 ecr 4294915801,mptcp dss ack 1720219151 seq 3868467675 subseq 604045 len 1428 csum 0xff13], length 1428
10:18:07.861353 IP 112.26.3.1.43445 > 112.26.3.8.34701: Flags [.], seq 602617:604045, ack 1, win 4017, options [nop,nop,TS val 161610 ecr 4294915701,mptcp dss ack 1720219151 seq 3868451967 subseq 602617 len 1428 csum 0x9a2], length 1428
10:18:07.888711 IP 112.26.3.8.34701 > 112.26.3.1.43445: Flags [.], ack 604045, win 24209, options [nop,nop,TS val 4294916518 ecr 161610,mptcp dss ack 3868162083], length 0
10:18:07.890259 IP 112.26.3.8.34701 > 112.26.3.1.43445: Flags [.], ack 604045, win 24209, options [nop,nop,TS val 4294916518 ecr 161610,mptcp dss ack 3868162083], length 0
10:18:07.925504 IP 112.26.3.8.34701 > 112.26.3.1.43445: Flags [.], ack 601189, win 24209, options [nop,nop,TS val 4294916343 ecr 161488,mptcp dss ack 3868162083], length 0
10:18:07.948618 IP 112.26.3.1.43445 > 112.26.3.8.34701: Flags [.], seq 605473:606901, ack 1, win 4017, options [nop,nop,TS val 161837 ecr 4294915902,mptcp dss ack 1720219151 seq 3868469103 subseq 605473 len 1428 csum 0xb590], length 1428
10:18:07.978969 IP 112.26.3.1.43445 > 112.26.3.8.34701: Flags [.], seq 604045:605473, ack 1, win 4017, options [nop,nop,TS val 161837 ecr 4294915801,mptcp dss ack 1720219151 seq 3868467675 subseq 604045 len 1428 csum 0xff13], length 1428
10:18:07.986082 IP 112.26.3.8.34701 > 112.26.3.1.43445: Flags [.], ack 605473, win 24209, options [nop,nop,TS val 4294916636 ecr 161837,mptcp dss ack 3868162083], length 0
10:18:07.993443 IP 112.26.3.8.34701 > 112.26.3.1.43445: Flags [.], ack 605473, win 24209, options [nop,nop,TS val 4294916636 ecr 161837,mptcp dss ack 3868162083], length 0
10:18:08.040385 IP 112.26.3.8.34701 > 112.26.3.1.43445: Flags [.], ack 602617, win 24209, options [nop,nop,TS val 4294916435 ecr 161550,mptcp dss ack 3868162083], length 0
10:18:08.051074 IP 112.26.3.1.43445 > 112.26.3.8.34701: Flags [.], seq 605473:606901, ack 1, win 4017, options [nop,nop,TS val 161837 ecr 4294915902,mptcp dss ack 1720219151 seq 3868469103 subseq 605473 len 1428 csum 0xb590], length 1428
10:18:08.061090 IP 112.26.3.1.43445 > 112.26.3.8.34701: Flags [.], seq 606901:608329, ack 1, win 4017, options [nop,nop,TS val 162005 ecr 4294916031,mptcp dss ack 1720219151 seq 3868479099 subseq 606901 len 1428 csum 0xd18], length 1428
10:18:08.075553 IP 112.26.3.8.34701 > 112.26.3.1.43445: Flags [.], ack 606901, win 24209, options [nop,nop,TS val 4294916707 ecr 161837,mptcp dss ack 3868162083], length 0
10:18:08.080092 IP 112.26.3.8.34701 > 112.26.3.1.43445: Flags [.], ack 606901, win 24209, options [nop,nop,TS val 4294916707 ecr 161837,mptcp dss ack 3868162083], length 0
10:18:08.124551 IP 112.26.3.1.43445 > 112.26.3.8.34701: Flags [.], seq 606901:608329, ack 1, win 4017, options [nop,nop,TS val 162005 ecr 4294916031,mptcp dss ack 1720219151 seq 3868479099 subseq 606901 len 1428 csum 0xd18], length 1428
10:18:08.159148 IP 112.26.3.8.34701 > 112.26.3.1.43445: Flags [.], ack 608329, win 24209, options [nop,nop,TS val 4294916781 ecr 162005,mptcp dss ack 3868162083], length 0
10:18:08.161170 IP 112.26.3.8.34701 > 112.26.3.1.43445: Flags [.], ack 608329, win 24209, options [nop,nop,TS val 4294916781 ecr 162005,mptcp dss ack 3868162083], length 0
10:18:08.188747 IP 112.26.3.1.43445 > 112.26.3.8.34701: Flags [.], seq 608329:609757, ack 1, win 4017, options [nop,nop,TS val 162097 ecr 4294916106,mptcp dss ack 1720219151 seq 3868480527 subseq 608329 len 1428 csum 0x17d], length 1428
10:18:08.217412 IP 112.26.3.8.34701 > 112.26.3.1.43445: Flags [.], ack 604045, win 24209, options [nop,nop,TS val 4294916518 ecr 161610,mptcp dss ack 3868162083], length 0
10:18:08.242715 IP 112.26.3.1.43445 > 112.26.3.8.34701: Flags [.], seq 608329:609757, ack 1, win 4017, options [nop,nop,TS val 162097 ecr 4294916106,mptcp dss ack 1720219151 seq 3868480527 subseq 608329 len 1428 csum 0x17d], length 1428
10:18:08.244695 IP 112.26.3.8.34701 > 112.26.3.1.43445: Flags [.], ack 609757, win 24209, options [nop,nop,TS val 4294916899 ecr 162097,mptcp dss ack 3868162083], length 0
10:18:08.247913 IP 112.26.3.8.34701 > 112.26.3.1.43445: Flags [.], ack 609757, win 24209, options [nop,nop,TS val 4294916899 ecr 162097,mptcp dss ack 3868162083], length 0
10:18:08.285716 IP 112.26.3.1.43445 > 112.26.3.8.34701: Flags [.], seq 609757:611185, ack 1, win 4017, options [nop,nop,TS val 162212 ecr 4294916244,mptcp dss ack 1720219151 seq 3868486239 subseq 609757 len 1428 csum 0xb1bd], length 1428
10:18:08.343676 IP 112.26.3.8.34701 > 112.26.3.1.43445: Flags [.], ack 605473, win 24209, options [nop,nop,TS val 4294916636 ecr 161837,mptcp dss ack 3868162083], length 0
