10:17:23.957239 IP 112.26.1.8.46387 > 112.26.1.1.43445: Flags [S], seq 3182393828, win 65535, options [mss 1460,sackOK,TS val 4294872454 ecr 0,nop,wscale 6,mptcp join id 3 token 0x1271d1f5 nonce 0xab278870], length 0
10:17:24.032998 IP 112.26.1.8.46387 > 112.26.1.1.43445: Flags [S], seq 3182393828, win 65535, options [mss 1460,sackOK,TS val 4294872454 ecr 0,nop,wscale 6,mptcp join id 3 token 0x1271d1f5 nonce 0xab278870], length 0
10:17:24.065068 IP 112.26.1.1.43445 > 112.26.1.8.46387: Flags [S.], seq 600515713, ack 3182393829, win 65535, options [mss 1460,sackOK,TS val 118409 ecr 4294872454,nop,wscale 6,mptcp join id 3 hmac 0x5c100e5fd49aba7d nonce 0x69eaa99a], length 0
10:17:24.138136 IP 112.26.1.1.43445 > 112.26.1.8.46387: Flags [S.], seq 600515713, ack 3182393829, win 65535, options [mss 1460,sackOK,TS val 118409 ecr 4294872454,nop,wscale 6,mptcp join id 3 hmac 0x5c100e5fd49aba7d nonce 0x69eaa99a], length 0
10:17:24.190273 IP 112.26.1.1.43445 > 112.26.1.8.46387: Flags [S.], seq 600515713, ack 3182393829, win 65535, options [mss 1460,sackOK,TS val 118409 ecr 4294872454,nop,wscale 6,mptcp join id 3 hmac 0x5c100e5fd49aba7d nonce 0x69eaa99a], length 0
10:17:24.292565 IP 112.26.1.8.46387 > 112.26.1.1.43445: Flags [.], ack 1, win 7848, options [nop,nop,TS val 4294872847 ecr 118409,mptcp join hmac 0x8ee39ac72f51bb5ae0b3cb1d1a8f01338aaca337], length 0
10:17:24.293927 IP 112.26.1.8.46387 > 112.26.1.1.43445: Flags [.], ack 1, win 7848, options [nop,nop,TS val 4294872847 ecr 118409,mptcp join hmac 0x8ee39ac72f51bb5ae0b3cb1d1a8f01338aaca337], length 0
10:18:04.719551 IP 112.26.1.1.43445 > 112.26.1.8.46387: Flags [.], seq 438397:439825, ack 1, win 4017, options [nop,nop,TS val 157584 ecr 4294911268,mptcp dss ack 1720219151 seq 3868282035 subseq 438397 len 1428 csum 0x4052], length 1428
10:18:04.774434 IP 112.26.1.1.43445 > 112.26.1.8.46387: Flags [.], seq 439825:441253, ack 1, win 4017, options [nop,nop,TS val 157584 ecr 4294911268,mptcp dss ack 1720219151 seq 3868283463 subseq 439825 len 1428 csum 0x8405], length 1428
10:18:04.851440 IP 112.26.1.1.43445 > 112.26.1.8.46387: Flags [.], seq 405553:406981, ack 1, win 4017, options [nop,nop,TS val 157807 ecr 4294911360,mptcp dss ack 1720219151 seq 3868160655 subseq 405553 len 1428 csum 0xa594], length 1428
10:18:04.908687 IP 112.26.1.8.46387 > 112.26.1.1.43445: Flags [.], ack 405553, win 24231, options [nop,nop,TS val 4294912828 ecr 155172,nop,nop,sack 2 {428401:431257}{421261:425545},mptcp dss ack 3868160655], length 0
10:18:04.910805 IP 112.26.1.8.46387 > 112.26.1.1.43445: Flags [.], ack 405553, win 24231, options [nop,nop,TS val 4294912828 ecr 155172,nop,nop,sack 2 {428401:431257}{421261:425545},mptcp dss ack 3868160655], length 0
10:18:04.917530 IP 112.26.1.1.43445 > 112.26.1.8.46387: Flags [.], seq 425545:426973, ack 1, win 4017, options [nop,nop,TS val 159287 ecr 4294912828,mptcp dss ack 1720219151 seq 3868227771 subseq 425545 len 1428 csum 0xf9b4], length 1428
10:18:04.917753 IP 112.26.1.1.43445 > 112.26.1.8.46387: Flags [.], seq 425545:426973, ack 1, win 4017, options [nop,nop,TS val 159287 ecr 4294912828,mptcp dss ack 1720219151 seq 3868227771 subseq 425545 len 1428 csum 0xf9b4], length 1428
10:18:05.020107 IP 112.26.1.1.43445 > 112.26.1.8.46387: Flags [.], seq 426973:428401, ack 1, win 4017, options [nop,nop,TS val 159287 ecr 4294912828,mptcp dss ack 1720219151 seq 3868229199 subseq 426973 len 1428 csum 0xccbc], length 1428
10:18:05.020248 IP 112.26.1.1.43445 > 112.26.1.8.46387: Flags [.], seq 426973:428401, ack 1, win 4017, options [nop,nop,TS val 159287 ecr 4294912828,mptcp dss ack 1720219151 seq 3868229199 subseq 426973 len 1428 csum 0xccbc], length 1428
10:18:05.024928 IP 112.26.1.8.46387 > 112.26.1.1.43445: Flags [.], ack 405553, win 24231, options [nop,nop,TS val 4294912928 ecr 155172,nop,nop,sack 2 {428401:432685}{421261:425545},mptcp dss ack 3868160655], length 0
10:18:05.026519 IP 112.26.1.8.46387 > 112.26.1.1.43445: Flags [.], ack 405553, win 24231, options [nop,nop,TS val 4294912928 ecr 155172,nop,nop,sack 2 {428401:432685}{421261:425545},mptcp dss ack 3868160655], length 0
10:18:05.098122 IP 112.26.1.1.43445 > 112.26.1.8.46387: Flags [.], seq 444109:445537, ack 1, win 4017, options [nop,nop,TS val 159410 ecr 4294912928,mptcp dss ack 1720219151 seq 3868344867 subseq 444109 len 1428 csum 0x9ed4], length 1428
10:18:05.098293 IP 112.26.1.1.43445 > 112.26.1.8.46387: Flags [.], seq 444109:445537, ack 1, win 4017, options [nop,nop,TS val 159410 ecr 4294912928,mptcp dss ack 1720219151 seq 3868344867 subseq 444109 len 1428 csum 0x9ed4], length 1428
10:18:05.103027 IP 112.26.1.1.43445 > 112.26.1.8.46387: Flags [.], seq 412693:414121, ack 1, win 4017, options [nop,nop,TS val 158218 ecr 4294911740,mptcp dss ack 1720219151 seq 3868179219 subseq 412693 len 1428 csum 0x34df], length 1428
10:18:05.190839 IP 112.26.1.1.43445 > 112.26.1.8.46387: Flags [.], seq 441253:442681, ack 1, win 4017, options [nop,nop,TS val 158445 ecr 4294911979,mptcp dss ack 1720219151 seq 3868313451 subseq 441253 len 1428 csum 0x710b], length 1428
10:18:05.259413 IP 112.26.1.1.43445 > 112.26.1.8.46387: Flags [.], seq 419833:421261, ack 1, win 4017, options [nop,nop,TS val 158697 ecr 4294912301,mptcp dss ack 1720219151 seq 3868199211 subseq 419833 len 1428 csum 0xc253], length 1428
10:18:05.313824 IP 112.26.1.1.43445 > 112.26.1.8.46387: Flags [.], seq 442681:444109, ack 1, win 4017, options [nop,nop,TS val 158840 ecr 4294912407,mptcp dss ack 1720219151 seq 3868244907 subseq 442681 len 1428 csum 0x3f2b], length 1428
10:18:05.374918 IP 112.26.1.8.46387 > 112.26.1.1.43445: Flags [.], ack 405553, win 24231, options [nop,nop,TS val 4294913376 ecr 155172,nop,nop,sack 2 {438397:439825}{434113:436969},mptcp dss ack 3868160655], length 0
10:18:05.377483 IP 112.26.1.8.46387 > 112.26.1.1.43445: Flags [.], ack 405553, win 24231, options [nop,nop,TS val 4294913376 ecr 155172,nop,nop,sack 2 {438397:439825}{434113:436969},mptcp dss ack 3868160655], length 0
10:18:05.385666 IP 112.26.1.1.43445 > 112.26.1.8.46387: Flags [.], seq 432685:434113, ack 1, win 4017, options [nop,nop,TS val 159754 ecr 4294913376,mptcp dss ack 1720219151 seq 3868249191 subseq 432685 len 1428 csum 0x5aec], length 1428
10:18:05.385852 IP 112.26.1.1.43445 > 112.26.1.8.46387: Flags [.], seq 432685:434113, ack 1, win 4017, options [nop,nop,TS val 159754 ecr 4294913376,mptcp dss ack 1720219151 seq 3868249191 subseq 432685 len 1428 csum 0x5aec], length 1428
10:18:05.452556 IP 112.26.1.8.46387 > 112.26.1.1.43445: Flags [.], ack 406981, win 24209, options [nop,nop,TS val 4294913508 ecr 157807,nop,nop,sack 2 {438397:441253}{434113:436969},mptcp dss ack 3868162083], length 0
10:18:05.456790 IP 112.26.1.8.46387 > 112.26.1.1.43445: Flags [.], ack 406981, win 24209, options [nop,nop,TS val 4294913508 ecr 157807,nop,nop,sack 2 {438397:441253}{434113:436969},mptcp dss ack 3868162083], length 0
10:18:05.482482 IP 112.26.1.1.43445 > 112.26.1.8.46387: Flags [.], seq 436969:438397, ack 1, win 4017, options [nop,nop,TS val 159754 ecr 4294913376,mptcp dss ack 1720219151 seq 3868270611 subseq 436969 len 1428 csum 0xf6c7], length 1428
10:18:05.482683 IP 112.26.1.1.43445 > 112.26.1.8.46387: Flags [.], seq 436969:438397, ack 1, win 4017, options [nop,nop,TS val 159754 ecr 4294913376,mptcp dss ack 1720219151 seq 3868270611 subseq 436969 len 1428 csum 0xf6c7], length 1428
10:18:05.537856 IP 112.26.1.1.43445 > 112.26.1.8.46387: Flags [.], seq 425545:426973, ack 1, win 4017, options [nop,nop,TS val 159287 ecr 4294912828,mptcp dss ack 1720219151 seq 3868227771 subseq 425545 len 1428 csum 0xf9b4], length 1428
10:18:05.547205 IP 112.26.1.1.43445 > 112.26.1.8.46387: Flags [.], seq 445537:446965, ack 1, win 4017, options [nop,nop,TS val 159782 ecr 4294913376,mptcp dss ack 1720219151 seq 3868362003 subseq 445537 len 1428 csum 0x97b1], length 1428
10:18:05.547407 IP 112.26.1.1.43445 > 112.26.1.8.46387: Flags [.], seq 445537:446965, ack 1, win 4017, options [nop,nop,TS val 159782 ecr 4294913376,mptcp dss ack 1720219151 seq 3868362003 subseq 445537 len 1428 csum 0x97b1], length 1428
10:18:05.605782 IP 112.26.1.1.43445 > 112.26.1.8.46387: Flags [.], seq 446965:448393, ack 1, win 4017, options [nop,nop,TS val 159831 ecr 4294913508,mptcp dss ack 1720219151 seq 3868370571 subseq 446965 len 1428 csum 0xa19c], length 1428
10:18:05.605989 IP 112.26.1.1.43445 > 112.26.1.8.46387: Flags [.], seq 446965:448393, ack 1, win 4017, options [nop,nop,TS val 159831 ecr 4294913508,mptcp dss ack 1720219151 seq 3868370571 subseq 446965 len 1428 csum 0xa19c], length 1428
10:18:05.621558 IP 112.26.1.1.43445 > 112.26.1.8.46387: Flags [.], seq 426973:428401, ack 1, win 4017, options [nop,nop,TS val 159287 ecr 4294912828,mptcp dss ack 1720219151 seq 3868229199 subseq 426973 len 1428 csum 0xccbc], length 1428
10:18:05.671616 IP 112.26.1.1.43445 > 112.26.1.8.46387: Flags [.], seq 448393:449821, ack 1, win 4017, options [nop,nop,TS val 159831 ecr 4294913508,mptcp dss ack 1720219151 seq 3868371999 subseq 448393 len 1428 csum 0xcfc6], length 1428
10:18:05.671824 IP 112.26.1.1.43445 > 112.26.1.8.46387: Flags [.], seq 448393:449821, ack 1, win 4017, options [nop,nop,TS val 159831 ecr 4294913508,mptcp dss ack 1720219151 seq 3868371999 subseq 448393 len 1428 csum 0xcfc6], length 1428
10:18:05.684668 IP 112.26.1.8.46387 > 112.26.1.1.43445: Flags [.], ack 406981, win 24209, options [nop,nop,TS val 4294913733 ecr 157807,nop,nop,sack 2 {412693:414121}{438397:441253},mptcp dss ack 3868162083], length 0
10:18:05.687755 IP 112.26.1.8.46387 > 112.26.1.1.43445: Flags [.], ack 406981, win 24209, options [nop,nop,TS val 4294913733 ecr 157807,nop,nop,sack 2 {412693:414121}{438397:441253},mptcp dss ack 3868162083], length 0
10:18:05.735192 IP 112.26.1.1.43445 > 112.26.1.8.46387: Flags [.], seq 449821:451249, ack 1, win 4017, options [nop,nop,TS val 159831 ecr 4294913508,mptcp dss ack 1720219151 seq 3868373427 subseq 449821 len 1428 csum 0x7fdb], length 1428
10:18:05.735396 IP 112.26.1.1.43445 > 112.26.1.8.46387: Flags [.], seq 449821:451249, ack 1, win 4017, options [nop,nop,TS val 159831 ecr 4294913508,mptcp dss ack 1720219151 seq 3868373427 subseq 449821 len 1428 csum 0x7fdb], length 1428
10:18:05.764750 IP 112.26.1.1.43445 > 112.26.1.8.46387: Flags [.], seq 444109:445537, ack 1, win 4017, options [nop,nop,TS val 159410 ecr 4294912928,mptcp dss ack 1720219151 seq 3868344867 subseq 444109 len 1428 csum 0x9ed4], length 1428
10:18:05.813619 IP 112.26.1.1.43445 > 112.26.1.8.46387: Flags [.], seq 451249:452677, ack 1, win 4017, options [nop,nop,TS val 159831 ecr 4294913508,mptcp dss ack 1720219151 seq 3868374855 subseq 451249 len 1428 csum 0x2671], length 1428
10:18:05.813823 IP 112.26.1.1.43445 > 112.26.1.8.46387: Flags [.], seq 451249:452677, ack 1, win 4017, options [nop,nop,TS val 159831 ecr 4294913508,mptcp dss ack 1720219151 seq 3868374855 subseq 451249 len 1428 csum 0x2671], length 1428
10:18:05.829343 IP 112.26.1.8.46387 > 112.26.1.1.43445: Flags [.], ack 406981, win 24209, options [nop,nop,TS val 4294913848 ecr 157807,nop,nop,sack 2 {438397:442681}{412693:414121},mptcp dss ack 3868162083], length 0
10:18:05.833559 IP 112.26.1.8.46387 > 112.26.1.1.43445: Flags [.], ack 406981, win 24209, options [nop,nop,TS val 4294913848 ecr 157807,nop,nop,sack 2 {438397:442681}{412693:414121},mptcp dss ack 3868162083], length 0
10:18:05.862327 IP 112.26.1.8.46387 > 112.26.1.1.43445: Flags [.], ack 406981, win 24209, options [nop,nop,TS val 4294913916 ecr 157807,nop,nop,sack 2 {419833:421261}{438397:442681},mptcp dss ack 3868162083], length 0
10:18:05.908419 IP 112.26.1.1.43445 > 112.26.1.8.46387: Flags [.], seq 452677:454105, ack 1, win 4017, options [nop,nop,TS val 159831 ecr 4294913508,mptcp dss ack 1720219151 seq 3868376283 subseq 452677 len 1428 csum 0x7ca2], length 1428
10:18:05.908613 IP 112.26.1.1.43445 > 112.26.1.8.46387: Flags [.], seq 452677:454105, ack 1, win 4017, options [nop,nop,TS val 159831 ecr 4294913508,mptcp dss ack 1720219151 seq 3868376283 subseq 452677 len 1428 csum 0x7ca2], length 1428
10:18:05.920472 IP 112.26.1.8.46387 > 112.26.1.1.43445: Flags [.], ack 406981, win 24209, options [nop,nop,TS val 4294913916 ecr 157807,nop,nop,sack 2 {419833:421261}{438397:442681},mptcp dss ack 3868162083], length 0
10:18:05.940705 IP 112.26.1.8.46387 > 112.26.1.1.43445: Flags [.], ack 406981, win 24209, options [nop,nop,TS val 4294913971 ecr 157807,nop,nop,sack 2 {438397:444109}{419833:421261},mptcp dss ack 3868162083], length 0
10:18:05.973765 IP 112.26.1.1.43445 > 112.26.1.8.46387: Flags [.], seq 406981:408409, ack 1, win 4017, options [nop,nop,TS val 160064 ecr 4294913733,mptcp dss ack 1720219151 seq 3868162083 subseq 406981 len 1428 csum 0x37f2], length 1428
10:18:05.973915 IP 112.26.1.1.43445 > 112.26.1.8.46387: Flags [.], seq 406981:408409, ack 1, win 4017, options [nop,nop,TS val 160064 ecr 4294913733,mptcp dss ack 1720219151 seq 3868162083 subseq 406981 len 1428 csum 0x37f2], length 1428
10:18:06.018032 IP 112.26.1.1.43445 > 112.26.1.8.46387: Flags [.], seq 432685:434113, ack 1, win 4017, options [nop,nop,TS val 159754 ecr 4294913376,mptcp dss ack 1720219151 seq 3868249191 subseq 432685 len 1428 csum 0x5aec], length 1428
10:18:06.020176 IP 112.26.1.8.46387 > 112.26.1.1.43445: Flags [.], ack 406981, win 24209, options [nop,nop,TS val 4294913971 ecr 157807,nop,nop,sack 2 {438397:444109}{419833:421261},mptcp dss ack 3868162083], length 0
10:18:06.082316 IP 112.26.1.1.43445 > 112.26.1.8.46387: Flags [.], seq 454105:455533, ack 1, win 4017, options [nop,nop,TS val 160297 ecr 4294913848,mptcp dss ack 1720219151 seq 3868394847 subseq 454105 len 1428 csum 0x79a7], length 1428
10:18:06.082495 IP 112.26.1.1.43445 > 112.26.1.8.46387: Flags [.], seq 454105:455533, ack 1, win 4017, options [nop,nop,TS val 160297 ecr 4294913848,mptcp dss ack 1720219151 seq 3868394847 subseq 454105 len 1428 csum 0x79a7], length 1428
10:18:06.084555 IP 112.26.1.1.43445 > 112.26.1.8.46387: Flags [.], seq 436969:438397, ack 1, win 4017, options [nop,nop,TS val 159754 ecr 4294913376,mptcp dss ack 1720219151 seq 3868270611 subseq 436969 len 1428 csum 0xf6c7], length 1428
10:18:06.112617 IP 112.26.1.8.46387 > 112.26.1.1.43445: Flags [.], ack 406981, win 24209, options [nop,nop,TS val 4294914195 ecr 157807,nop,nop,sack 2 {425545:426973}{438397:444109},mptcp dss ack 3868162083], length 0
10:18:06.117033 IP 112.26.1.8.46387 > 112.26.1.1.43445: Flags [.], ack 406981, win 24209, options [nop,nop,TS val 4294914195 ecr 157807,nop,nop,sack 2 {425545:426973}{438397:444109},mptcp dss ack 3868162083], length 0
10:18:06.168317 IP 112.26.1.1.43445 > 112.26.1.8.46387: Flags [.], seq 455533:456961, ack 1, win 4017, options [nop,nop,TS val 160374 ecr 4294913916,mptcp dss ack 1720219151 seq 3868396275 subseq 455533 len 1428 csum 0x4f6a], length 1428
10:18:06.168534 IP 112.26.1.1.43445 > 112.26.1.8.46387: Flags [.], seq 455533:456961, ack 1, win 4017, options [nop,nop,TS val 160374 ecr 4294913916,mptcp dss ack 1720219151 seq 3868396275 subseq 455533 len 1428 csum 0x4f6a], length 1428
10:18:06.184358 IP 112.26.1.1.43445 > 112.26.1.8.46387: Flags [.], seq 445537:446965, ack 1, win 4017, options [nop,nop,TS val 159782 ecr 4294913376,mptcp dss ack 1720219151 seq 3868362003 subseq 445537 len 1428 csum 0x97b1], length 1428
10:18:06.272907 IP 112.26.1.8.46387 > 112.26.1.1.43445: Flags [.], ack 406981, win 24209, options [nop,nop,TS val 4294914270 ecr 157807,nop,nop,sack 2 {425545:428401}{438397:444109},mptcp dss ack 3868162083], length 0
10:18:06.278945 IP 112.26.1.8.46387 > 112.26.1.1.43445: Flags [.], ack 406981, win 24209, options [nop,nop,TS val 4294914270 ecr 157807,nop,nop,sack 2 {425545:428401}{438397:444109},mptcp dss ack 3868162083], length 0
10:18:06.290029 IP 112.26.1.1.43445 > 112.26.1.8.46387: Flags [.], seq 456961:458389, ack 1, win 4017, options [nop,nop,TS val 160416 ecr 4294913971,mptcp dss ack 1720219151 seq 3868410555 subseq 456961 len 1428 csum 0x90a9], length 1428
10:18:06.290209 IP 112.26.1.1.43445 > 112.26.1.8.46387: Flags [.], seq 456961:458389, ack 1, win 4017, options [nop,nop,TS val 160416 ecr 4294913971,mptcp dss ack 1720219151 seq 3868410555 subseq 456961 len 1428 csum 0x90a9], length 1428
10:18:06.366529 IP 112.26.1.1.43445 > 112.26.1.8.46387: Flags [.], seq 458389:459817, ack 1, win 4017, options [nop,nop,TS val 160525 ecr 4294914195,mptcp dss ack 1720219151 seq 3868413411 subseq 458389 len 1428 csum 0x9483], length 1428
10:18:06.366672 IP 112.26.1.1.43445 > 112.26.1.8.46387: Flags [.], seq 458389:459817, ack 1, win 4017, options [nop,nop,TS val 160525 ecr 4294914195,mptcp dss ack 1720219151 seq 3868413411 subseq 458389 len 1428 csum 0x9483], length 1428
10:18:06.397486 IP 112.26.1.1.43445 > 112.26.1.8.46387: Flags [.], seq 446965:448393, ack 1, win 4017, options [nop,nop,TS val 159831 ecr 4294913508,mptcp dss ack 1720219151 seq 3868370571 subseq 446965 len 1428 csum 0xa19c], length 1428
10:18:06.431152 IP 112.26.1.1.43445 > 112.26.1.8.46387: Flags [.], seq 459817:461245, ack 1, win 4017, options [nop,nop,TS val 160689 ecr 4294914270,mptcp dss ack 1720219151 seq 3868417695 subseq 459817 len 1428 csum 0xd48a], length 1428
10:18:06.431353 IP 112.26.1.1.43445 > 112.26.1.8.46387: Flags [.], seq 459817:461245, ack 1, win 4017, options [nop,nop,TS val 160689 ecr 4294914270,mptcp dss ack 1720219151 seq 3868417695 subseq 459817 len 1428 csum 0xd48a], length 1428
10:18:06.474046 IP 112.26.1.8.46387 > 112.26.1.1.43445: Flags [.], ack 406981, win 24209, options [nop,nop,TS val 4294914414 ecr 157807,nop,nop,sack 2 {438397:445537}{425545:428401},mptcp dss ack 3868162083], length 0
10:18:06.476689 IP 112.26.1.8.46387 > 112.26.1.1.43445: Flags [.], ack 406981, win 24209, options [nop,nop,TS val 4294914414 ecr 157807,nop,nop,sack 2 {438397:445537}{425545:428401},mptcp dss ack 3868162083], length 0
10:18:06.521660 IP 112.26.1.1.43445 > 112.26.1.8.46387: Flags [.], seq 461245:462673, ack 1, win 4017, options [nop,nop,TS val 160895 ecr 4294914414,mptcp dss ack 1720219151 seq 3868424835 subseq 461245 len 1428 csum 0xf894], length 1428
10:18:06.521878 IP 112.26.1.1.43445 > 112.26.1.8.46387: Flags [.], seq 461245:462673, ack 1, win 4017, options [nop,nop,TS val 160895 ecr 4294914414,mptcp dss ack 1720219151 seq 3868424835 subseq 461245 len 1428 csum 0xf894], length 1428
10:18:06.539010 IP 112.26.1.1.43445 > 112.26.1.8.46387: Flags [.], seq 448393:449821, ack 1, win 4017, options [nop,nop,TS val 159831 ecr 4294913508,mptcp dss ack 1720219151 seq 3868371999 subseq 448393 len 1428 csum 0xcfc6], length 1428
10:18:06.645305 IP 112.26.1.1.43445 > 112.26.1.8.46387: Flags [.], seq 449821:451249, ack 1, win 4017, options [nop,nop,TS val 159831 ecr 4294913508,mptcp dss ack 1720219151 seq 3868373427 subseq 449821 len 1428 csum 0x7fdb], length 1428
10:18:06.742338 IP 112.26.1.1.43445 > 112.26.1.8.46387: Flags [.], seq 451249:452677, ack 1, win 4017, options [nop,nop,TS val 159831 ecr 4294913508,mptcp dss ack 1720219151 seq 3868374855 subseq 451249 len 1428 csum 0x2671], length 1428
10:18:06.796568 IP 112.26.1.8.46387 > 112.26.1.1.43445: Flags [.], ack 406981, win 24209, options [nop,nop,TS val 4294914675 ecr 157807,nop,nop,sack 2 {432685:434113}{438397:445537},mptcp dss ack 3868162083], length 0
10:18:06.802394 IP 112.26.1.8.46387 > 112.26.1.1.43445: Flags [.], ack 406981, win 24209, options [nop,nop,TS val 4294914675 ecr 157807,nop,nop,sack 2 {432685:434113}{438397:445537},mptcp dss ack 3868162083], length 0
10:18:06.825130 IP 112.26.1.1.43445 > 112.26.1.8.46387: Flags [.], seq 462673:464101, ack 1, win 4017, options [nop,nop,TS val 161196 ecr 4294914675,mptcp dss ack 1720219151 seq 3868434831 subseq 462673 len 1428 csum 0x8fa3], length 1428
10:18:06.825345 IP 112.26.1.1.43445 > 112.26.1.8.46387: Flags [.], seq 462673:464101, ack 1, win 4017, options [nop,nop,TS val 161196 ecr 4294914675,mptcp dss ack 1720219151 seq 3868434831 subseq 462673 len 1428 csum 0x8fa3], length 1428
10:18:06.896208 IP 112.26.1.8.46387 > 112.26.1.1.43445: Flags [.], ack 406981, win 24209, options [nop,nop,TS val 4294914725 ecr 157807,nop,nop,sack 2 {436969:445537}{432685:434113},mptcp dss ack 3868162083], length 0
10:18:06.898401 IP 112.26.1.8.46387 > 112.26.1.1.43445: Flags [.], ack 406981, win 24209, options [nop,nop,TS val 4294914725 ecr 157807,nop,nop,sack 2 {436969:445537}{432685:434113},mptcp dss ack 3868162083], length 0
10:18:06.923309 IP 112.26.1.1.43445 > 112.26.1.8.46387: Flags [.], seq 464101:465529, ack 1, win 4017, options [nop,nop,TS val 161295 ecr 4294914725,mptcp dss ack 1720219151 seq 3868439115 subseq 464101 len 1428 csum 0x8896], length 1428
10:18:06.923489 IP 112.26.1.1.43445 > 112.26.1.8.46387: Flags [.], seq 464101:465529, ack 1, win 4017, options [nop,nop,TS val 161295 ecr 4294914725,mptcp dss ack 1720219151 seq 3868439115 subseq 464101 len 1428 csum 0x8896], length 1428
10:18:06.961683 IP 112.26.1.8.46387 > 112.26.1.1.43445: Flags [.], ack 406981, win 24209, options [nop,nop,TS val 4294914838 ecr 157807,nop,nop,sack 2 {436969:446965}{432685:434113},mptcp dss ack 3868162083], length 0
10:18:06.985895 IP 112.26.1.8.46387 > 112.26.1.1.43445: Flags [.], ack 406981, win 24209, options [nop,nop,TS val 4294914838 ecr 157807,nop,nop,sack 2 {436969:446965}{432685:434113},mptcp dss ack 3868162083], length 0
10:18:07.035082 IP 112.26.1.1.43445 > 112.26.1.8.46387: Flags [.], seq 465529:466957, ack 1, win 4017, options [nop,nop,TS val 161407 ecr 4294914838,mptcp dss ack 1720219151 seq 3868446255 subseq 465529 len 1428 csum 0xeab8], length 1428
10:18:07.035295 IP 112.26.1.1.43445 > 112.26.1.8.46387: Flags [.], seq 465529:466957, ack 1, win 4017, options [nop,nop,TS val 161407 ecr 4294914838,mptcp dss ack 1720219151 seq 3868446255 subseq 465529 len 1428 csum 0xeab8], length 1428
10:18:07.067265 IP 112.26.1.1.43445 > 112.26.1.8.46387: Flags [.], seq 454105:455533, ack 1, win 4017, options [nop,nop,TS val 160297 ecr 4294913848,mptcp dss ack 1720219151 seq 3868394847 subseq 454105 len 1428 csum 0x79a7], length 1428
10:18:07.154896 IP 112.26.1.1.43445 > 112.26.1.8.46387: Flags [.], seq 455533:456961, ack 1, win 4017, options [nop,nop,TS val 160374 ecr 4294913916,mptcp dss ack 1720219151 seq 3868396275 subseq 455533 len 1428 csum 0x4f6a], length 1428
10:18:07.219664 IP 112.26.1.1.43445 > 112.26.1.8.46387: Flags [.], seq 456961:458389, ack 1, win 4017, options [nop,nop,TS val 160416 ecr 4294913971,mptcp dss ack 1720219151 seq 3868410555 subseq 456961 len 1428 csum 0x90a9], length 1428
10:18:07.280915 IP 112.26.1.8.46387 > 112.26.1.1.43445: Flags [.], ack 406981, win 24209, options [nop,nop,TS val 4294915196 ecr 157807,nop,nop,sack 2 {436969:449821}{432685:434113},mptcp dss ack 3868162083], length 0
10:18:07.282791 IP 112.26.1.8.46387 > 112.26.1.1.43445: Flags [.], ack 406981, win 24209, options [nop,nop,TS val 4294915196 ecr 157807,nop,nop,sack 2 {436969:449821}{432685:434113},mptcp dss ack 3868162083], length 0
10:18:07.362651 IP 112.26.1.1.43445 > 112.26.1.8.46387: Flags [.], seq 458389:459817, ack 1, win 4017, options [nop,nop,TS val 160525 ecr 4294914195,mptcp dss ack 1720219151 seq 3868413411 subseq 458389 len 1428 csum 0x9483], length 1428
10:18:07.397240 IP 112.26.1.1.43445 > 112.26.1.8.46387: Flags [.], seq 466957:468385, ack 1, win 4017, options [nop,nop,TS val 161770 ecr 4294915196,mptcp dss ack 1720219151 seq 3868464819 subseq 466957 len 1428 csum 0xd0f5], length 1428
10:18:07.397415 IP 112.26.1.1.43445 > 112.26.1.8.46387: Flags [.], seq 466957:468385, ack 1, win 4017, options [nop,nop,TS val 161770 ecr 4294915196,mptcp dss ack 1720219151 seq 3868464819 subseq 466957 len 1428 csum 0xd0f5], length 1428
10:18:07.446974 IP 112.26.1.1.43445 > 112.26.1.8.46387: Flags [.], seq 468385:469813, ack 1, win 4017, options [nop,nop,TS val 161770 ecr 4294915196,mptcp dss ack 1720219151 seq 3868466247 subseq 468385 len 1428 csum 0x157a], length 1428
10:18:07.447161 IP 112.26.1.1.43445 > 112.26.1.8.46387: Flags [.], seq 468385:469813, ack 1, win 4017, options [nop,nop,TS val 161770 ecr 4294915196,mptcp dss ack 1720219151 seq 3868466247 subseq 468385 len 1428 csum 0x157a], length 1428
10:18:07.455517 IP 112.26.1.1.43445 > 112.26.1.8.46387: Flags [.], seq 459817:461245, ack 1, win 4017, options [nop,nop,TS val 160689 ecr 4294914270,mptcp dss ack 1720219151 seq 3868417695 subseq 459817 len 1428 csum 0xd48a], length 1428
10:18:07.567517 IP 112.26.1.1.43445 > 112.26.1.8.46387: Flags [.], seq 461245:462673, ack 1, win 4017, options [nop,nop,TS val 160895 ecr 4294914414,mptcp dss ack 1720219151 seq 3868424835 subseq 461245 len 1428 csum 0xf894], length 1428
10:18:07.637421 IP 112.26.1.1.43445 > 112.26.1.8.46387: Flags [.], seq 462673:464101, ack 1, win 4017, options [nop,nop,TS val 161196 ecr 4294914675,mptcp dss ack 1720219151 seq 3868434831 subseq 462673 len 1428 csum 0x8fa3], length 1428
10:18:07.743973 IP 112.26.1.1.43445 > 112.26.1.8.46387: Flags [.], seq 464101:465529, ack 1, win 4017, options [nop,nop,TS val 161295 ecr 4294914725,mptcp dss ack 1720219151 seq 3868439115 subseq 464101 len 1428 csum 0x8896], length 1428
10:18:07.821312 IP 112.26.1.8.46387 > 112.26.1.1.43445: Flags [.], ack 406981, win 24209, options [nop,nop,TS val 4294915720 ecr 157807,nop,nop,sack 2 {454105:455533}{436969:452677},mptcp dss ack 3868162083], length 0
10:18:07.823919 IP 112.26.1.8.46387 > 112.26.1.1.43445: Flags [.], ack 406981, win 24209, options [nop,nop,TS val 4294915720 ecr 157807,nop,nop,sack 2 {454105:455533}{436969:452677},mptcp dss ack 3868162083], length 0
10:18:07.839921 IP 112.26.1.1.43445 > 112.26.1.8.46387: Flags [.], seq 406981:408409, ack 1, win 4017, options [nop,nop,TS val 162200 ecr 4294915720,mptcp dss ack 1720219151 seq 3868162083 subseq 406981 len 1428 csum 0x37f2], length 1428
10:18:07.840115 IP 112.26.1.1.43445 > 112.26.1.8.46387: Flags [.], seq 406981:408409, ack 1, win 4017, options [nop,nop,TS val 162200 ecr 4294915720,mptcp dss ack 1720219151 seq 3868162083 subseq 406981 len 1428 csum 0x37f2], length 1428
10:18:07.910207 IP 112.26.1.1.43445 > 112.26.1.8.46387: Flags [.], seq 452677:454105, ack 1, win 4017, options [nop,nop,TS val 162200 ecr 4294915720,mptcp dss ack 1720219151 seq 3868376283 subseq 452677 len 1428 csum 0x7ca2], length 1428
10:18:07.910393 IP 112.26.1.1.43445 > 112.26.1.8.46387: Flags [.], seq 452677:454105, ack 1, win 4017, options [nop,nop,TS val 162200 ecr 4294915720,mptcp dss ack 1720219151 seq 3868376283 subseq 452677 len 1428 csum 0x7ca2], length 1428
10:18:07.933989 IP 112.26.1.8.46387 > 112.26.1.1.43445: Flags [.], ack 406981, win 24209, options [nop,nop,TS val 4294915812 ecr 157807,nop,nop,sack 2 {454105:456961}{436969:452677},mptcp dss ack 3868162083], length 0
10:18:07.941057 IP 112.26.1.8.46387 > 112.26.1.1.43445: Flags [.], ack 406981, win 24209, options [nop,nop,TS val 4294915812 ecr 157807,nop,nop,sack 2 {454105:456961}{436969:452677},mptcp dss ack 3868162083], length 0
10:18:07.986542 IP 112.26.1.1.43445 > 112.26.1.8.46387: Flags [.], seq 469813:471241, ack 1, win 4017, options [nop,nop,TS val 162212 ecr 4294915720,mptcp dss ack 1720219151 seq 3868484811 subseq 469813 len 1428 csum 0xd4f1], length 1428
10:18:07.986751 IP 112.26.1.1.43445 > 112.26.1.8.46387: Flags [.], seq 469813:471241, ack 1, win 4017, options [nop,nop,TS val 162212 ecr 4294915720,mptcp dss ack 1720219151 seq 3868484811 subseq 469813 len 1428 csum 0xd4f1], length 1428
10:18:07.995278 IP 112.26.1.8.46387 > 112.26.1.1.43445: Flags [.], ack 406981, win 24209, options [nop,nop,TS val 4294915876 ecr 157807,nop,nop,sack 2 {454105:458389}{436969:452677},mptcp dss ack 3868162083], length 0
10:18:08.050501 IP 112.26.1.8.46387 > 112.26.1.1.43445: Flags [.], ack 406981, win 24209, options [nop,nop,TS val 4294916019 ecr 157807,nop,nop,sack 2 {454105:459817}{436969:452677},mptcp dss ack 3868162083], length 0
10:18:08.058746 IP 112.26.1.8.46387 > 112.26.1.1.43445: Flags [.], ack 406981, win 24209, options [nop,nop,TS val 4294915876 ecr 157807,nop,nop,sack 2 {454105:458389}{436969:452677},mptcp dss ack 3868162083], length 0
10:18:08.092183 IP 112.26.1.1.43445 > 112.26.1.8.46387: Flags [.], seq 471241:472669, ack 1, win 4017, options [nop,nop,TS val 162377 ecr 4294915812,mptcp dss ack 1720219151 seq 3868490523 subseq 471241 len 1428 csum 0xa46b], length 1428
10:18:08.092369 IP 112.26.1.1.43445 > 112.26.1.8.46387: Flags [.], seq 471241:472669, ack 1, win 4017, options [nop,nop,TS val 162377 ecr 4294915812,mptcp dss ack 1720219151 seq 3868490523 subseq 471241 len 1428 csum 0xa46b], length 1428
10:18:08.113843 IP 112.26.1.1.43445 > 112.26.1.8.46387: Flags [.], seq 466957:468385, ack 1, win 4017, options [nop,nop,TS val 161770 ecr 4294915196,mptcp dss ack 1720219151 seq 3868464819 subseq 466957 len 1428 csum 0xd0f5], length 1428
10:18:08.181864 IP 112.26.1.8.46387 > 112.26.1.1.43445: Flags [.], ack 406981, win 24209, options [nop,nop,TS val 4294916019 ecr 157807,nop,nop,sack 2 {454105:459817}{436969:452677},mptcp dss ack 3868162083], length 0
10:18:08.203814 IP 112.26.1.1.43445 > 112.26.1.8.46387: Flags [.], seq 472669:474097, ack 1, win 4017, options [nop,nop,TS val 162460 ecr 4294915876,mptcp dss ack 1720219151 seq 3868494807 subseq 472669 len 1428 csum 0x21ef], length 1428
10:18:08.203998 IP 112.26.1.1.43445 > 112.26.1.8.46387: Flags [.], seq 472669:474097, ack 1, win 4017, options [nop,nop,TS val 162460 ecr 4294915876,mptcp dss ack 1720219151 seq 3868494807 subseq 472669 len 1428 csum 0x21ef], length 1428
10:18:08.226106 IP 112.26.1.8.46387 > 112.26.1.1.43445: Flags [.], ack 406981, win 24209, options [nop,nop,TS val 4294916112 ecr 157807,nop,nop,sack 2 {454105:461245}{436969:452677},mptcp dss ack 3868162083], length 0
10:18:08.266714 IP 112.26.1.8.46387 > 112.26.1.1.43445: Flags [.], ack 406981, win 24209, options [nop,nop,TS val 4294916112 ecr 157807,nop,nop,sack 2 {454105:461245}{436969:452677},mptcp dss ack 3868162083], length 0
10:18:08.330776 IP 112.26.1.1.43445 > 112.26.1.8.46387: Flags [.], seq 474097:475525, ack 1, win 4017, options [nop,nop,TS val 162593 ecr 4294916019,mptcp dss ack 1720219151 seq 3868499091 subseq 474097 len 1428 csum 0x1ba], length 1428
10:18:08.330959 IP 112.26.1.1.43445 > 112.26.1.8.46387: Flags [.], seq 474097:475525, ack 1, win 4017, options [nop,nop,TS val 162593 ecr 4294916019,mptcp dss ack 1720219151 seq 3868499091 subseq 474097 len 1428 csum 0x1ba], length 1428
10:18:08.340688 IP 112.26.1.1.43445 > 112.26.1.8.46387: Flags [.], seq 468385:469813, ack 1, win 4017, options [nop,nop,TS val 161770 ecr 4294915196,mptcp dss ack 1720219151 seq 3868466247 subseq 468385 len 1428 csum 0x157a], length 1428
10:18:08.382088 IP 112.26.1.8.46387 > 112.26.1.1.43445: Flags [.], ack 406981, win 24209, options [nop,nop,TS val 4294916224 ecr 157807,nop,nop,sack 2 {454105:462673}{436969:452677},mptcp dss ack 3868162083], length 0
10:18:08.383872 IP 112.26.1.8.46387 > 112.26.1.1.43445: Flags [.], ack 406981, win 24209, options [nop,nop,TS val 4294916224 ecr 157807,nop,nop,sack 2 {454105:462673}{436969:452677},mptcp dss ack 3868162083], length 0
10:18:08.413163 IP 112.26.1.1.43445 > 112.26.1.8.46387: Flags [.], seq 475525:476953, ack 1, win 4017, options [nop,nop,TS val 162711 ecr 4294916112,mptcp dss ack 1720219151 seq 3868503375 subseq 475525 len 1428 csum 0x694e], length 1428
10:18:08.413316 IP 112.26.1.1.43445 > 112.26.1.8.46387: Flags [.], seq 475525:476953, ack 1, win 4017, options [nop,nop,TS val 162711 ecr 4294916112,mptcp dss ack 1720219151 seq 3868503375 subseq 475525 len 1428 csum 0x694e], length 1428
10:18:08.439706 IP 112.26.1.8.46387 > 112.26.1.1.43445: Flags [.], ack 406981, win 24209, options [nop,nop,TS val 4294916294 ecr 157807,nop,nop,sack 2 {454105:464101}{436969:452677},mptcp dss ack 3868162083], length 0
10:18:08.508505 IP 112.26.1.8.46387 > 112.26.1.1.43445: Flags [.], ack 406981, win 24209, options [nop,nop,TS val 4294916294 ecr 157807,nop,nop,sack 2 {454105:464101}{436969:452677},mptcp dss ack 3868162083], length 0
10:18:08.523819 IP 112.26.1.1.43445 > 112.26.1.8.46387: Flags [.], seq 476953:478381, ack 1, win 4017, options [nop,nop,TS val 162770 ecr 4294916224,mptcp dss ack 1720219151 seq 3868507659 subseq 476953 len 1428 csum 0xdc60], length 1428
10:18:08.524013 IP 112.26.1.1.43445 > 112.26.1.8.46387: Flags [.], seq 476953:478381, ack 1, win 4017, options [nop,nop,TS val 162770 ecr 4294916224,mptcp dss ack 1720219151 seq 3868507659 subseq 476953 len 1428 csum 0xdc60], length 1428
10:18:08.545059 IP 112.26.1.8.46387 > 112.26.1.1.43445: Flags [.], ack 406981, win 24209, options [nop,nop,TS val 4294916401 ecr 157807,nop,nop,sack 2 {454105:465529}{436969:452677},mptcp dss ack 3868162083], length 0
10:18:08.563443 IP 112.26.1.8.46387 > 112.26.1.1.43445: Flags [.], ack 406981, win 24209, options [nop,nop,TS val 4294916401 ecr 157807,nop,nop,sack 2 {454105:465529}{436969:452677},mptcp dss ack 3868162083], length 0
10:18:08.590612 IP 112.26.1.1.43445 > 112.26.1.8.46387: Flags [.], seq 478381:479809, ack 1, win 4017, options [nop,nop,TS val 162916 ecr 4294916294,mptcp dss ack 1720219151 seq 3868514799 subseq 478381 len 1428 csum 0x50fa], length 1428
10:18:08.590797 IP 112.26.1.1.43445 > 112.26.1.8.46387: Flags [.], seq 478381:479809, ack 1, win 4017, options [nop,nop,TS val 162916 ecr 4294916294,mptcp dss ack 1720219151 seq 3868514799 subseq 478381 len 1428 csum 0x50fa], length 1428
10:18:08.615661 IP 112.26.1.1.43445 > 112.26.1.8.46387: Flags [.], seq 406981:408409, ack 1, win 4017, options [nop,nop,TS val 162200 ecr 4294915720,mptcp dss ack 1720219151 seq 3868162083 subseq 406981 len 1428 csum 0x37f2], length 1428
10:18:08.683415 IP 112.26.1.1.43445 > 112.26.1.8.46387: Flags [.], seq 479809:481237, ack 1, win 4017, options [nop,nop,TS val 162960 ecr 4294916401,mptcp dss ack 1720219151 seq 3868516227 subseq 479809 len 1428 csum 0x26c], length 1428
10:18:08.683613 IP 112.26.1.1.43445 > 112.26.1.8.46387: Flags [.], seq 479809:481237, ack 1, win 4017, options [nop,nop,TS val 162960 ecr 4294916401,mptcp dss ack 1720219151 seq 3868516227 subseq 479809 len 1428 csum 0x26c], length 1428
10:18:08.690251 IP 112.26.1.1.43445 > 112.26.1.8.46387: Flags [.], seq 452677:454105, ack 1, win 4017, options [nop,nop,TS val 162200 ecr 4294915720,mptcp dss ack 1720219151 seq 3868376283 subseq 452677 len 1428 csum 0x7ca2], length 1428
10:18:08.793340 IP 112.26.1.1.43445 > 112.26.1.8.46387: Flags [.], seq 469813:471241, ack 1, win 4017, options [nop,nop,TS val 162212 ecr 4294915720,mptcp dss ack 1720219151 seq 3868484811 subseq 469813 len 1428 csum 0xd4f1], length 1428
10:18:08.854456 IP 112.26.1.8.46387 > 112.26.1.1.43445: Flags [.], ack 406981, win 24209, options [nop,nop,TS val 4294916770 ecr 157807,nop,nop,sack 2 {466957:468385}{454105:465529},mptcp dss ack 3868162083], length 0
10:18:08.856118 IP 112.26.1.8.46387 > 112.26.1.1.43445: Flags [.], ack 406981, win 24209, options [nop,nop,TS val 4294916770 ecr 157807,nop,nop,sack 2 {466957:468385}{454105:465529},mptcp dss ack 3868162083], length 0
10:18:08.867650 IP 112.26.1.1.43445 > 112.26.1.8.46387: Flags [.], seq 465529:466957, ack 1, win 4017, options [nop,nop,TS val 163232 ecr 4294916770,mptcp dss ack 1720219151 seq 3868446255 subseq 465529 len 1428 csum 0xeab8], length 1428
10:18:08.867842 IP 112.26.1.1.43445 > 112.26.1.8.46387: Flags [.], seq 465529:466957, ack 1, win 4017, options [nop,nop,TS val 163232 ecr 4294916770,mptcp dss ack 1720219151 seq 3868446255 subseq 465529 len 1428 csum 0xeab8], length 1428
10:18:08.909418 IP 112.26.1.1.43445 > 112.26.1.8.46387: Flags [.], seq 471241:472669, ack 1, win 4017, options [nop,nop,TS val 162377 ecr 4294915812,mptcp dss ack 1720219151 seq 3868490523 subseq 471241 len 1428 csum 0xa46b], length 1428
10:18:08.985646 IP 112.26.1.8.46387 > 112.26.1.1.43445: Flags [.], ack 406981, win 24209, options [nop,nop,TS val 4294916968 ecr 157807,nop,nop,sack 2 {466957:469813}{454105:465529},mptcp dss ack 3868162083], length 0
10:18:08.988290 IP 112.26.1.8.46387 > 112.26.1.1.43445: Flags [.], ack 406981, win 24209, options [nop,nop,TS val 4294916968 ecr 157807,nop,nop,sack 2 {466957:469813}{454105:465529},mptcp dss ack 3868162083], length 0
10:18:09.075959 IP 112.26.1.8.46387 > 112.26.1.1.43445: Flags [.], ack 452677, win 21693, options [nop,nop,TS val 4294917273 ecr 162200,nop,nop,sack 2 {466957:469813}{454105:465529},mptcp dss ack 3868376283], length 0
10:18:09.078757 IP 112.26.1.8.46387 > 112.26.1.1.43445: Flags [.], ack 452677, win 21693, options [nop,nop,TS val 4294917273 ecr 162200,nop,nop,sack 2 {466957:469813}{454105:465529},mptcp dss ack 3868376283], length 0
10:18:09.090580 IP 112.26.1.1.43445 > 112.26.1.8.46387: Flags [.], seq 481237:482665, ack 1, win 4017, options [nop,nop,TS val 163455 ecr 4294916968,mptcp dss ack 1720219151 seq 3868524795 subseq 481237 len 1428 csum 0xfa09], length 1428
10:18:09.090778 IP 112.26.1.1.43445 > 112.26.1.8.46387: Flags [.], seq 481237:482665, ack 1, win 4017, options [nop,nop,TS val 163455 ecr 4294916968,mptcp dss ack 1720219151 seq 3868524795 subseq 481237 len 1428 csum 0xfa09], length 1428
10:18:09.158441 IP 112.26.1.8.46387 > 112.26.1.1.43445: Flags [.], ack 465529, win 23901, options [nop,nop,TS val 4294917347 ecr 162200,nop,nop,sack 1 {466957:469813},mptcp dss ack 3868381995], length 0
10:18:09.184705 IP 112.26.1.1.43445 > 112.26.1.8.46387: Flags [.], seq 482665:484093, ack 1, win 4017, options [nop,nop,TS val 163455 ecr 4294917273,mptcp dss ack 1720219151 seq 3868526223 subseq 482665 len 1428 csum 0xb4f9], length 1428
10:18:09.184894 IP 112.26.1.1.43445 > 112.26.1.8.46387: Flags [.], seq 482665:484093, ack 1, win 4017, options [nop,nop,TS val 163455 ecr 4294917273,mptcp dss ack 1720219151 seq 3868526223 subseq 482665 len 1428 csum 0xb4f9], length 1428
10:18:09.213299 IP 112.26.1.8.46387 > 112.26.1.1.43445: Flags [.], ack 465529, win 23901, options [nop,nop,TS val 4294917347 ecr 162200,nop,nop,sack 1 {466957:469813},mptcp dss ack 3868381995], length 0
10:18:09.305182 IP 112.26.1.8.46387 > 112.26.1.1.43445: Flags [.], ack 465529, win 23965, options [nop,nop,TS val 4294917450 ecr 162200,nop,nop,sack 1 {466957:471241},mptcp dss ack 3868381995], length 0
10:18:09.328289 IP 112.26.1.8.46387 > 112.26.1.1.43445: Flags [.], ack 465529, win 23965, options [nop,nop,TS val 4294917450 ecr 162200,nop,nop,sack 1 {466957:471241},mptcp dss ack 3868381995], length 0
10:18:09.427274 IP 112.26.1.8.46387 > 112.26.1.1.43445: Flags [.], ack 465529, win 23965, options [nop,nop,TS val 4294917566 ecr 162200,nop,nop,sack 1 {466957:472669},mptcp dss ack 3868381995], length 0
10:18:09.431088 IP 112.26.1.8.46387 > 112.26.1.1.43445: Flags [.], ack 465529, win 23965, options [nop,nop,TS val 4294917566 ecr 162200,nop,nop,sack 1 {466957:472669},mptcp dss ack 3868381995], length 0
10:18:09.459685 IP 112.26.1.1.43445 > 112.26.1.8.46387: Flags [.], seq 472669:474097, ack 1, win 4017, options [nop,nop,TS val 162460 ecr 4294915876,mptcp dss ack 1720219151 seq 3868494807 subseq 472669 len 1428 csum 0x21ef], length 1428
10:18:09.485511 IP 112.26.1.1.43445 > 112.26.1.8.46387: Flags [.], seq 474097:475525, ack 1, win 4017, options [nop,nop,TS val 162593 ecr 4294916019,mptcp dss ack 1720219151 seq 3868499091 subseq 474097 len 1428 csum 0x1ba], length 1428
10:18:09.552241 IP 112.26.1.1.43445 > 112.26.1.8.46387: Flags [.], seq 475525:476953, ack 1, win 4017, options [nop,nop,TS val 162711 ecr 4294916112,mptcp dss ack 1720219151 seq 3868503375 subseq 475525 len 1428 csum 0x694e], length 1428
10:18:09.595429 IP 112.26.1.1.43445 > 112.26.1.8.46387: Flags [.], seq 476953:478381, ack 1, win 4017, options [nop,nop,TS val 162770 ecr 4294916224,mptcp dss ack 1720219151 seq 3868507659 subseq 476953 len 1428 csum 0xdc60], length 1428
10:18:23.290410 IP 112.26.1.1.43445 > 112.26.1.8.46387: Flags [.], seq 465529:466957, ack 1, win 4017, options [nop,nop,TS val 177664 ecr 4294917566,mptcp dss ack 1720219151 seq 3868446255 subseq 465529 len 1428 csum 0xeab8], length 1428
