10:17:24.003164 IP 112.26.2.8.39903 > 112.26.2.1.43445: Flags [S], seq 672498423, win 65535, options [mss 1460,sackOK,TS val 4294872457 ecr 0,nop,wscale 6,mptcp join id 4 token 0x1271d1f5 nonce 0xad08927e], length 0
10:17:24.003443 IP 112.26.2.1.43445 > 112.26.2.8.39903: Flags [S.], seq 1340884807, ack 672498424, win 65535, options [mss 1460,sackOK,TS val 118380 ecr 4294872457,nop,wscale 6,mptcp join id 6 hmac 0xdf78a7e315d0df0 nonce 0x6a59e05e], length 0
10:17:24.124040 IP 112.26.2.1.43445 > 112.26.2.8.39903: Flags [S.], seq 1340884807, ack 672498424, win 65535, options [mss 1460,sackOK,TS val 118380 ecr 4294872457,nop,wscale 6,mptcp join id 6 hmac 0xdf78a7e315d0df0 nonce 0x6a59e05e], length 0
10:17:24.252406 IP 112.26.2.8.39903 > 112.26.2.1.43445: Flags [.], ack 1, win 6479, options [nop,nop,TS val 4294872838 ecr 118380,mptcp join hmac 0x06c6c92732455c5a9bc8c60b0e48efa7c6236428], length 0
10:17:24.252793 IP 112.26.2.1.43445 > 112.26.2.8.39903: Flags [.], ack 1, win 2678, options [nop,nop,TS val 118629 ecr 4294872838,mptcp dss ack 1720219151], length 0
10:17:24.252902 IP 112.26.2.1.43445 > 112.26.2.8.39903: Flags [.], seq 1:1429, ack 1, win 2678, options [nop,nop,TS val 118629 ecr 4294872838,mptcp dss ack 1720219151 seq 3866539875 subseq 1 len 1428 csum 0x483e], length 1428
10:17:24.252969 IP 112.26.2.1.43445 > 112.26.2.8.39903: Flags [.], seq 1429:2857, ack 1, win 2678, options [nop,nop,TS val 118629 ecr 4294872838,mptcp dss ack 1720219151 seq 3866541303 subseq 1429 len 1428 csum 0xc207], length 1428
10:17:58.524067 IP 112.26.2.1.43445 > 112.26.2.8.39903: Flags [.], seq 307021:308449, ack 1, win 4017, options [nop,nop,TS val 152146 ecr 4294905727,mptcp dss ack 1720219151 seq 3868005003 subseq 307021 len 1428 csum 0x5d30], length 1428
10:17:58.610045 IP 112.26.2.1.43445 > 112.26.2.8.39903: Flags [.], seq 309877:311305, ack 1, win 4017, options [nop,nop,TS val 152376 ecr 4294905914,mptcp dss ack 1720219151 seq 3868014999 subseq 309877 len 1428 csum 0x94a8], length 1428
10:17:58.719664 IP 112.26.2.8.39903 > 112.26.2.1.43445: Flags [.], ack 305593, win 24210, options [nop,nop,TS val 4294906663 ecr 151499,mptcp dss ack 3867935031], length 0
10:17:58.719870 IP 112.26.2.1.43445 > 112.26.2.8.39903: Flags [.], seq 319873:321301, ack 1, win 4017, options [nop,nop,TS val 153096 ecr 4294906663,mptcp dss ack 1720219151 seq 3868063551 subseq 319873 len 1428 csum 0x38ad], length 1428
10:17:58.719915 IP 112.26.2.1.43445 > 112.26.2.8.39903: Flags [.], seq 321301:322729, ack 1, win 4017, options [nop,nop,TS val 153096 ecr 4294906663,mptcp dss ack 1720219151 seq 3868064979 subseq 321301 len 1428 csum 0xe372], length 1428
10:17:58.792212 IP 112.26.2.1.43445 > 112.26.2.8.39903: Flags [.], seq 311305:312733, ack 1, win 4017, options [nop,nop,TS val 152439 ecr 4294906088,mptcp dss ack 1720219151 seq 3868017855 subseq 311305 len 1428 csum 0xb4b6], length 1428
10:17:58.897356 IP 112.26.2.1.43445 > 112.26.2.8.39903: Flags [.], seq 312733:314161, ack 1, win 4017, options [nop,nop,TS val 152439 ecr 4294906088,mptcp dss ack 1720219151 seq 3868019283 subseq 312733 len 1428 csum 0xcd0b], length 1428
10:17:58.987674 IP 112.26.2.1.43445 > 112.26.2.8.39903: Flags [.], seq 314161:315589, ack 1, win 4017, options [nop,nop,TS val 152439 ecr 4294906088,mptcp dss ack 1720219151 seq 3868020711 subseq 314161 len 1428 csum 0xd55d], length 1428
10:17:59.070221 IP 112.26.2.1.43445 > 112.26.2.8.39903: Flags [.], seq 315589:317017, ack 1, win 4017, options [nop,nop,TS val 152543 ecr 4294906190,mptcp dss ack 1720219151 seq 3868034991 subseq 315589 len 1428 csum 0x8d03], length 1428
10:17:59.172631 IP 112.26.2.1.43445 > 112.26.2.8.39903: Flags [.], seq 317017:318445, ack 1, win 4017, options [nop,nop,TS val 152648 ecr 4294906287,mptcp dss ack 1720219151 seq 3868039275 subseq 317017 len 1428 csum 0x4530], length 1428
10:17:59.242151 IP 112.26.2.1.43445 > 112.26.2.8.39903: Flags [.], seq 318445:319873, ack 1, win 4017, options [nop,nop,TS val 152705 ecr 4294906361,mptcp dss ack 1720219151 seq 3868040703 subseq 318445 len 1428 csum 0x4d99], length 1428
10:17:59.336610 IP 112.26.2.8.39903 > 112.26.2.1.43445: Flags [.], ack 308449, win 24409, options [nop,nop,TS val 4294907269 ecr 152146,nop,nop,sack 1 {309877:311305},mptcp dss ack 3867986439], length 0
10:17:59.336840 IP 112.26.2.1.43445 > 112.26.2.8.39903: Flags [.], seq 322729:324157, ack 1, win 4017, options [nop,nop,TS val 153713 ecr 4294907269,mptcp dss ack 1720219151 seq 3868083543 subseq 322729 len 1428 csum 0xc864], length 1428
10:17:59.336883 IP 112.26.2.1.43445 > 112.26.2.8.39903: Flags [.], seq 324157:325585, ack 1, win 4017, options [nop,nop,TS val 153713 ecr 4294907269,mptcp dss ack 1720219151 seq 3868084971 subseq 324157 len 1428 csum 0x77f4], length 1428
10:17:59.336983 IP 112.26.2.1.43445 > 112.26.2.8.39903: Flags [.], seq 325585:327013, ack 1, win 4017, options [nop,nop,TS val 153713 ecr 4294907269,mptcp dss ack 1720219151 seq 3868086399 subseq 325585 len 1428 csum 0x423f], length 1428
10:17:59.337048 IP 112.26.2.1.43445 > 112.26.2.8.39903: Flags [.], seq 327013:328441, ack 1, win 4017, options [nop,nop,TS val 153713 ecr 4294907269,mptcp dss ack 1720219151 seq 3868087827 subseq 327013 len 1428 csum 0x9456], length 1428
10:17:59.385599 IP 112.26.2.1.43445 > 112.26.2.8.39903: Flags [.], seq 319873:321301, ack 1, win 4017, options [nop,nop,TS val 153096 ecr 4294906663,mptcp dss ack 1720219151 seq 3868063551 subseq 319873 len 1428 csum 0x38ad], length 1428
10:17:59.520636 IP 112.26.2.1.43445 > 112.26.2.8.39903: Flags [.], seq 321301:322729, ack 1, win 4017, options [nop,nop,TS val 153096 ecr 4294906663,mptcp dss ack 1720219151 seq 3868064979 subseq 321301 len 1428 csum 0xe372], length 1428
10:17:59.644532 IP 112.26.2.8.39903 > 112.26.2.1.43445: Flags [.], ack 308449, win 24409, options [nop,nop,TS val 4294907556 ecr 152146,nop,nop,sack 1 {309877:314161},mptcp dss ack 3867986439], length 0
10:17:59.644735 IP 112.26.2.1.43445 > 112.26.2.8.39903: Flags [.], seq 308449:309877, ack 1, win 4017, options [nop,nop,TS val 154021 ecr 4294907556,mptcp dss ack 1720219151 seq 3868006431 subseq 308449 len 1428 csum 0xb0b6], length 1428
10:17:59.692764 IP 112.26.2.8.39903 > 112.26.2.1.43445: Flags [.], ack 308449, win 24409, options [nop,nop,TS val 4294907648 ecr 152146,nop,nop,sack 1 {309877:315589},mptcp dss ack 3867986439], length 0
10:17:59.692962 IP 112.26.2.1.43445 > 112.26.2.8.39903: Flags [.], seq 328441:329869, ack 1, win 4017, options [nop,nop,TS val 154069 ecr 4294907556,mptcp dss ack 1720219151 seq 3868099251 subseq 328441 len 1428 csum 0x8aa5], length 1428
10:17:59.701789 IP 112.26.2.1.43445 > 112.26.2.8.39903: Flags [.], seq 329869:331297, ack 1, win 4017, options [nop,nop,TS val 154078 ecr 4294907648,mptcp dss ack 1720219151 seq 3868100679 subseq 329869 len 1428 csum 0x2bf9], length 1428
10:17:59.781446 IP 112.26.2.8.39903 > 112.26.2.1.43445: Flags [.], ack 308449, win 24409, options [nop,nop,TS val 4294907730 ecr 152146,nop,nop,sack 1 {309877:317017},mptcp dss ack 3867986439], length 0
10:17:59.842033 IP 112.26.2.8.39903 > 112.26.2.1.43445: Flags [.], ack 308449, win 24409, options [nop,nop,TS val 4294907835 ecr 152146,nop,nop,sack 1 {309877:318445},mptcp dss ack 3867986439], length 0
10:17:59.871331 IP 112.26.2.8.39903 > 112.26.2.1.43445: Flags [.], ack 308449, win 24409, options [nop,nop,TS val 4294907901 ecr 152146,nop,nop,sack 1 {309877:319873},mptcp dss ack 3867986439], length 0
10:17:59.871509 IP 112.26.2.1.43445 > 112.26.2.8.39903: Flags [.], seq 331297:332725, ack 1, win 4017, options [nop,nop,TS val 154248 ecr 4294907835,mptcp dss ack 1720219151 seq 3868106391 subseq 331297 len 1428 csum 0x5d13], length 1428
10:17:59.912443 IP 112.26.2.1.43445 > 112.26.2.8.39903: Flags [.], seq 332725:334153, ack 1, win 4017, options [nop,nop,TS val 154289 ecr 4294907901,mptcp dss ack 1720219151 seq 3868107819 subseq 332725 len 1428 csum 0xffb9], length 1428
10:17:59.950087 IP 112.26.2.1.43445 > 112.26.2.8.39903: Flags [.], seq 322729:324157, ack 1, win 4017, options [nop,nop,TS val 153713 ecr 4294907269,mptcp dss ack 1720219151 seq 3868083543 subseq 322729 len 1428 csum 0xc864], length 1428
10:18:00.025275 IP 112.26.2.1.43445 > 112.26.2.8.39903: Flags [.], seq 324157:325585, ack 1, win 4017, options [nop,nop,TS val 153713 ecr 4294907269,mptcp dss ack 1720219151 seq 3868084971 subseq 324157 len 1428 csum 0x77f4], length 1428
10:18:00.105028 IP 112.26.2.8.39903 > 112.26.2.1.43445: Flags [.], ack 308449, win 24409, options [nop,nop,TS val 4294908044 ecr 152146,nop,nop,sack 1 {309877:321301},mptcp dss ack 3867986439], length 0
10:18:00.167340 IP 112.26.2.1.43445 > 112.26.2.8.39903: Flags [.], seq 325585:327013, ack 1, win 4017, options [nop,nop,TS val 153713 ecr 4294907269,mptcp dss ack 1720219151 seq 3868086399 subseq 325585 len 1428 csum 0x423f], length 1428
10:18:00.258512 IP 112.26.2.8.39903 > 112.26.2.1.43445: Flags [.], ack 308449, win 24409, options [nop,nop,TS val 4294908182 ecr 152146,nop,nop,sack 1 {309877:322729},mptcp dss ack 3867986439], length 0
10:18:00.328392 IP 112.26.2.1.43445 > 112.26.2.8.39903: Flags [.], seq 308449:309877, ack 1, win 4017, options [nop,nop,TS val 154021 ecr 4294907556,mptcp dss ack 1720219151 seq 3868006431 subseq 308449 len 1428 csum 0xb0b6], length 1428
10:18:00.430847 IP 112.26.2.1.43445 > 112.26.2.8.39903: Flags [.], seq 328441:329869, ack 1, win 4017, options [nop,nop,TS val 154069 ecr 4294907556,mptcp dss ack 1720219151 seq 3868099251 subseq 328441 len 1428 csum 0x8aa5], length 1428
10:18:00.543473 IP 112.26.2.1.43445 > 112.26.2.8.39903: Flags [.], seq 329869:331297, ack 1, win 4017, options [nop,nop,TS val 154078 ecr 4294907648,mptcp dss ack 1720219151 seq 3868100679 subseq 329869 len 1428 csum 0x2bf9], length 1428
10:18:00.631979 IP 112.26.2.1.43445 > 112.26.2.8.39903: Flags [.], seq 331297:332725, ack 1, win 4017, options [nop,nop,TS val 154248 ecr 4294907835,mptcp dss ack 1720219151 seq 3868106391 subseq 331297 len 1428 csum 0x5d13], length 1428
10:18:00.714627 IP 112.26.2.1.43445 > 112.26.2.8.39903: Flags [.], seq 332725:334153, ack 1, win 4017, options [nop,nop,TS val 154289 ecr 4294907901,mptcp dss ack 1720219151 seq 3868107819 subseq 332725 len 1428 csum 0xffb9], length 1428
10:18:00.784495 IP 112.26.2.8.39903 > 112.26.2.1.43445: Flags [.], ack 308449, win 24276, options [nop,nop,TS val 4294908728 ecr 152146,nop,nop,sack 1 {309877:325585},mptcp dss ack 3867995007], length 0
10:18:00.795831 IP 112.26.2.1.43445 > 112.26.2.8.39903: Flags [.], seq 334153:335581, ack 1, win 4017, options [nop,nop,TS val 155172 ecr 4294908728,mptcp dss ack 1720219151 seq 3868152087 subseq 334153 len 1428 csum 0x116d], length 1428
10:18:00.795913 IP 112.26.2.1.43445 > 112.26.2.8.39903: Flags [.], seq 335581:337009, ack 1, win 4017, options [nop,nop,TS val 155172 ecr 4294908728,mptcp dss ack 1720219151 seq 3868153515 subseq 335581 len 1428 csum 0x62], length 1428
10:18:00.837540 IP 112.26.2.8.39903 > 112.26.2.1.43445: Flags [.], ack 308449, win 24098, options [nop,nop,TS val 4294908828 ecr 152146,nop,nop,sack 1 {309877:327013},mptcp dss ack 3868006431], length 0
10:18:00.901772 IP 112.26.2.1.43445 > 112.26.2.8.39903: Flags [.], seq 337009:338437, ack 1, win 4017, options [nop,nop,TS val 155278 ecr 4294908828,mptcp dss ack 1720219151 seq 3868166367 subseq 337009 len 1428 csum 0xa5e2], length 1428
10:18:00.932248 IP 112.26.2.8.39903 > 112.26.2.1.43445: Flags [.], ack 327013, win 23764, options [nop,nop,TS val 4294908989 ecr 154021,mptcp dss ack 3868032135], length 0
10:18:00.932450 IP 112.26.2.1.43445 > 112.26.2.8.39903: Flags [.], seq 327013:328441, ack 1, win 4017, options [nop,nop,TS val 155309 ecr 4294908989,mptcp dss ack 1720219151 seq 3868087827 subseq 327013 len 1428 csum 0x9456], length 1428
10:18:00.932495 IP 112.26.2.1.43445 > 112.26.2.8.39903: Flags [.], seq 338437:339865, ack 1, win 4017, options [nop,nop,TS val 155309 ecr 4294908989,mptcp dss ack 1720219151 seq 3868169223 subseq 338437 len 1428 csum 0x94e8], length 1428
10:18:01.012478 IP 112.26.2.8.39903 > 112.26.2.1.43445: Flags [.], ack 327013, win 24030, options [nop,nop,TS val 4294909090 ecr 154021,nop,nop,sack 1 {328441:329869},mptcp dss ack 3868032135], length 0
10:18:01.037607 IP 112.26.2.8.39903 > 112.26.2.1.43445: Flags [.], ack 327013, win 24030, options [nop,nop,TS val 4294909204 ecr 154021,nop,nop,sack 1 {328441:331297},mptcp dss ack 3868032135], length 0
10:18:01.037818 IP 112.26.2.1.43445 > 112.26.2.8.39903: Flags [.], seq 339865:341293, ack 1, win 4017, options [nop,nop,TS val 155414 ecr 4294909090,mptcp dss ack 1720219151 seq 3868172079 subseq 339865 len 1428 csum 0x131c], length 1428
10:18:01.062284 IP 112.26.2.1.43445 > 112.26.2.8.39903: Flags [.], seq 341293:342721, ack 1, win 4017, options [nop,nop,TS val 155438 ecr 4294909204,mptcp dss ack 1720219151 seq 3868173507 subseq 341293 len 1428 csum 0x9ef8], length 1428
10:18:01.098046 IP 112.26.2.8.39903 > 112.26.2.1.43445: Flags [.], ack 327013, win 24030, options [nop,nop,TS val 4294909293 ecr 154021,nop,nop,sack 1 {328441:332725},mptcp dss ack 3868032135], length 0
10:18:01.107967 IP 112.26.2.1.43445 > 112.26.2.8.39903: Flags [.], seq 342721:344149, ack 1, win 4017, options [nop,nop,TS val 155484 ecr 4294909293,mptcp dss ack 1720219151 seq 3868182075 subseq 342721 len 1428 csum 0x2b14], length 1428
10:18:01.187843 IP 112.26.2.8.39903 > 112.26.2.1.43445: Flags [.], ack 327013, win 24009, options [nop,nop,TS val 4294909407 ecr 154021,nop,nop,sack 1 {328441:334153},mptcp dss ack 3868047843], length 0
10:18:01.194718 IP 112.26.2.1.43445 > 112.26.2.8.39903: Flags [.], seq 344149:345577, ack 1, win 4017, options [nop,nop,TS val 155571 ecr 4294909407,mptcp dss ack 1720219151 seq 3868186359 subseq 344149 len 1428 csum 0xeb82], length 1428
10:18:01.233732 IP 112.26.2.1.43445 > 112.26.2.8.39903: Flags [.], seq 334153:335581, ack 1, win 4017, options [nop,nop,TS val 155172 ecr 4294908728,mptcp dss ack 1720219151 seq 3868152087 subseq 334153 len 1428 csum 0x116d], length 1428
10:18:01.345865 IP 112.26.2.1.43445 > 112.26.2.8.39903: Flags [.], seq 335581:337009, ack 1, win 4017, options [nop,nop,TS val 155172 ecr 4294908728,mptcp dss ack 1720219151 seq 3868153515 subseq 335581 len 1428 csum 0x62], length 1428
10:18:01.434287 IP 112.26.2.1.43445 > 112.26.2.8.39903: Flags [.], seq 337009:338437, ack 1, win 4017, options [nop,nop,TS val 155278 ecr 4294908828,mptcp dss ack 1720219151 seq 3868166367 subseq 337009 len 1428 csum 0xa5e2], length 1428
10:18:01.512969 IP 112.26.2.1.43445 > 112.26.2.8.39903: Flags [.], seq 327013:328441, ack 1, win 4017, options [nop,nop,TS val 155309 ecr 4294908989,mptcp dss ack 1720219151 seq 3868087827 subseq 327013 len 1428 csum 0x9456], length 1428
10:18:01.622301 IP 112.26.2.1.43445 > 112.26.2.8.39903: Flags [.], seq 338437:339865, ack 1, win 4017, options [nop,nop,TS val 155309 ecr 4294908989,mptcp dss ack 1720219151 seq 3868169223 subseq 338437 len 1428 csum 0x94e8], length 1428
10:18:01.691986 IP 112.26.2.1.43445 > 112.26.2.8.39903: Flags [.], seq 339865:341293, ack 1, win 4017, options [nop,nop,TS val 155414 ecr 4294909090,mptcp dss ack 1720219151 seq 3868172079 subseq 339865 len 1428 csum 0x131c], length 1428
10:18:01.770931 IP 112.26.2.1.43445 > 112.26.2.8.39903: Flags [.], seq 341293:342721, ack 1, win 4017, options [nop,nop,TS val 155438 ecr 4294909204,mptcp dss ack 1720219151 seq 3868173507 subseq 341293 len 1428 csum 0x9ef8], length 1428
10:18:01.860821 IP 112.26.2.1.43445 > 112.26.2.8.39903: Flags [.], seq 342721:344149, ack 1, win 4017, options [nop,nop,TS val 155484 ecr 4294909293,mptcp dss ack 1720219151 seq 3868182075 subseq 342721 len 1428 csum 0x2b14], length 1428
10:18:01.907349 IP 112.26.2.8.39903 > 112.26.2.1.43445: Flags [.], ack 327013, win 24107, options [nop,nop,TS val 4294909893 ecr 154021,nop,nop,sack 1 {328441:335581},mptcp dss ack 3868073547], length 0
10:18:01.945904 IP 112.26.2.1.43445 > 112.26.2.8.39903: Flags [.], seq 345577:347005, ack 1, win 4017, options [nop,nop,TS val 156322 ecr 4294909893,mptcp dss ack 1720219151 seq 3868209207 subseq 345577 len 1428 csum 0xe9f3], length 1428
10:18:02.010401 IP 112.26.2.1.43445 > 112.26.2.8.39903: Flags [.], seq 344149:345577, ack 1, win 4017, options [nop,nop,TS val 155571 ecr 4294909407,mptcp dss ack 1720219151 seq 3868186359 subseq 344149 len 1428 csum 0xeb82], length 1428
10:18:02.145339 IP 112.26.2.8.39903 > 112.26.2.1.43445: Flags [.], ack 327013, win 24107, options [nop,nop,TS val 4294910006 ecr 154021,nop,nop,sack 1 {328441:337009},mptcp dss ack 3868073547], length 0
10:18:02.176702 IP 112.26.2.1.43445 > 112.26.2.8.39903: Flags [.], seq 347005:348433, ack 1, win 4017, options [nop,nop,TS val 156553 ecr 4294910006,mptcp dss ack 1720219151 seq 3868222059 subseq 347005 len 1428 csum 0x6d70], length 1428
10:18:02.197373 IP 112.26.2.8.39903 > 112.26.2.1.43445: Flags [.], ack 327013, win 24110, options [nop,nop,TS val 4294910111 ecr 154021,nop,nop,sack 1 {328441:338437},mptcp dss ack 3868087827], length 0
10:18:02.271133 IP 112.26.2.8.39903 > 112.26.2.1.43445: Flags [.], ack 338437, win 23972, options [nop,nop,TS val 4294910221 ecr 155309,mptcp dss ack 3868133523], length 0
10:18:02.271331 IP 112.26.2.1.43445 > 112.26.2.8.39903: Flags [.], seq 348433:349861, ack 1, win 4017, options [nop,nop,TS val 156648 ecr 4294910111,mptcp dss ack 1720219151 seq 3868224915 subseq 348433 len 1428 csum 0x336b], length 1428
10:18:02.271394 IP 112.26.2.1.43445 > 112.26.2.8.39903: Flags [.], seq 349861:351289, ack 1, win 4017, options [nop,nop,TS val 156648 ecr 4294910221,mptcp dss ack 1720219151 seq 3868226343 subseq 349861 len 1428 csum 0xd803], length 1428
10:18:02.375208 IP 112.26.2.8.39903 > 112.26.2.1.43445: Flags [.], ack 339865, win 24455, options [nop,nop,TS val 4294910320 ecr 155309,mptcp dss ack 3868134951], length 0
10:18:02.375459 IP 112.26.2.1.43445 > 112.26.2.8.39903: Flags [.], seq 351289:352717, ack 1, win 4017, options [nop,nop,TS val 156752 ecr 4294910320,mptcp dss ack 1720219151 seq 3868239195 subseq 351289 len 1428 csum 0xf333], length 1428
10:18:02.375505 IP 112.26.2.1.43445 > 112.26.2.8.39903: Flags [.], seq 352717:354145, ack 1, win 4017, options [nop,nop,TS val 156752 ecr 4294910320,mptcp dss ack 1720219151 seq 3868240623 subseq 352717 len 1428 csum 0x41ff], length 1428
10:18:02.450232 IP 112.26.2.8.39903 > 112.26.2.1.43445: Flags [.], ack 341293, win 24455, options [nop,nop,TS val 4294910388 ecr 155414,mptcp dss ack 3868134951], length 0
10:18:02.450561 IP 112.26.2.1.43445 > 112.26.2.8.39903: Flags [.], seq 354145:355573, ack 1, win 4017, options [nop,nop,TS val 156827 ecr 4294910388,mptcp dss ack 1720219151 seq 3868243479 subseq 354145 len 1428 csum 0x9fa6], length 1428
10:18:02.492982 IP 112.26.2.8.39903 > 112.26.2.1.43445: Flags [.], ack 342721, win 24455, options [nop,nop,TS val 4294910491 ecr 155438,mptcp dss ack 3868134951], length 0
10:18:02.493195 IP 112.26.2.1.43445 > 112.26.2.8.39903: Flags [.], seq 355573:357001, ack 1, win 4017, options [nop,nop,TS val 156869 ecr 4294910491,mptcp dss ack 1720219151 seq 3868244907 subseq 355573 len 1428 csum 0x9370], length 1428
10:18:02.580337 IP 112.26.2.1.43445 > 112.26.2.8.39903: Flags [.], seq 345577:347005, ack 1, win 4017, options [nop,nop,TS val 156322 ecr 4294909893,mptcp dss ack 1720219151 seq 3868209207 subseq 345577 len 1428 csum 0xe9f3], length 1428
10:18:02.674786 IP 112.26.2.8.39903 > 112.26.2.1.43445: Flags [.], ack 344149, win 24455, options [nop,nop,TS val 4294910594 ecr 155484,mptcp dss ack 3868134951], length 0
10:18:02.675028 IP 112.26.2.1.43445 > 112.26.2.8.39903: Flags [.], seq 357001:358429, ack 1, win 4017, options [nop,nop,TS val 157051 ecr 4294910594,mptcp dss ack 1720219151 seq 3868257759 subseq 357001 len 1428 csum 0xe044], length 1428
10:18:02.675075 IP 112.26.2.1.43445 > 112.26.2.8.39903: Flags [.], seq 358429:359857, ack 1, win 4017, options [nop,nop,TS val 157051 ecr 4294910594,mptcp dss ack 1720219151 seq 3868259187 subseq 358429 len 1428 csum 0xf087], length 1428
10:18:02.763738 IP 112.26.2.8.39903 > 112.26.2.1.43445: Flags [.], ack 345577, win 24455, options [nop,nop,TS val 4294910678 ecr 155571,mptcp dss ack 3868134951], length 0
10:18:02.763964 IP 112.26.2.1.43445 > 112.26.2.8.39903: Flags [.], seq 359857:361285, ack 1, win 4017, options [nop,nop,TS val 157140 ecr 4294910678,mptcp dss ack 1720219151 seq 3868263471 subseq 359857 len 1428 csum 0x1126], length 1428
10:18:02.822101 IP 112.26.2.1.43445 > 112.26.2.8.39903: Flags [.], seq 347005:348433, ack 1, win 4017, options [nop,nop,TS val 156553 ecr 4294910006,mptcp dss ack 1720219151 seq 3868222059 subseq 347005 len 1428 csum 0x6d70], length 1428
10:18:02.937645 IP 112.26.2.1.43445 > 112.26.2.8.39903: Flags [.], seq 348433:349861, ack 1, win 4017, options [nop,nop,TS val 156648 ecr 4294910111,mptcp dss ack 1720219151 seq 3868224915 subseq 348433 len 1428 csum 0x336b], length 1428
10:18:03.011733 IP 112.26.2.1.43445 > 112.26.2.8.39903: Flags [.], seq 349861:351289, ack 1, win 4017, options [nop,nop,TS val 156648 ecr 4294910221,mptcp dss ack 1720219151 seq 3868226343 subseq 349861 len 1428 csum 0xd803], length 1428
10:18:03.109705 IP 112.26.2.1.43445 > 112.26.2.8.39903: Flags [.], seq 351289:352717, ack 1, win 4017, options [nop,nop,TS val 156752 ecr 4294910320,mptcp dss ack 1720219151 seq 3868239195 subseq 351289 len 1428 csum 0xf333], length 1428
10:18:03.217667 IP 112.26.2.1.43445 > 112.26.2.8.39903: Flags [.], seq 352717:354145, ack 1, win 4017, options [nop,nop,TS val 156752 ecr 4294910320,mptcp dss ack 1720219151 seq 3868240623 subseq 352717 len 1428 csum 0x41ff], length 1428
10:18:03.277672 IP 112.26.2.8.39903 > 112.26.2.1.43445: Flags [.], ack 347005, win 24231, options [nop,nop,TS val 4294911241 ecr 156322,mptcp dss ack 3868160655], length 0
10:18:03.277888 IP 112.26.2.1.43445 > 112.26.2.8.39903: Flags [.], seq 361285:362713, ack 1, win 4017, options [nop,nop,TS val 157654 ecr 4294911241,mptcp dss ack 1720219151 seq 3868286319 subseq 361285 len 1428 csum 0xa3d2], length 1428
10:18:03.373647 IP 112.26.2.1.43445 > 112.26.2.8.39903: Flags [.], seq 354145:355573, ack 1, win 4017, options [nop,nop,TS val 156827 ecr 4294910388,mptcp dss ack 1720219151 seq 3868243479 subseq 354145 len 1428 csum 0x9fa6], length 1428
10:18:03.460159 IP 112.26.2.1.43445 > 112.26.2.8.39903: Flags [.], seq 357001:358429, ack 1, win 4017, options [nop,nop,TS val 157051 ecr 4294910594,mptcp dss ack 1720219151 seq 3868257759 subseq 357001 len 1428 csum 0xe044], length 1428
10:18:03.562634 IP 112.26.2.1.43445 > 112.26.2.8.39903: Flags [.], seq 358429:359857, ack 1, win 4017, options [nop,nop,TS val 157051 ecr 4294910594,mptcp dss ack 1720219151 seq 3868259187 subseq 358429 len 1428 csum 0xf087], length 1428
10:18:03.633908 IP 112.26.2.8.39903 > 112.26.2.1.43445: Flags [.], ack 348433, win 24231, options [nop,nop,TS val 4294911482 ecr 156553,mptcp dss ack 3868160655], length 0
10:18:03.634117 IP 112.26.2.1.43445 > 112.26.2.8.39903: Flags [.], seq 362713:364141, ack 1, win 4017, options [nop,nop,TS val 158010 ecr 4294911482,mptcp dss ack 1720219151 seq 3868292031 subseq 362713 len 1428 csum 0xe8a8], length 1428
10:18:03.694893 IP 112.26.2.8.39903 > 112.26.2.1.43445: Flags [.], ack 349861, win 24231, options [nop,nop,TS val 4294911598 ecr 156648,mptcp dss ack 3868160655], length 0
10:18:03.695121 IP 112.26.2.1.43445 > 112.26.2.8.39903: Flags [.], seq 364141:365569, ack 1, win 4017, options [nop,nop,TS val 158071 ecr 4294911598,mptcp dss ack 1720219151 seq 3868294887 subseq 364141 len 1428 csum 0x1147], length 1428
10:18:03.733846 IP 112.26.2.8.39903 > 112.26.2.1.43445: Flags [.], ack 351289, win 24231, options [nop,nop,TS val 4294911701 ecr 156648,mptcp dss ack 3868160655], length 0
10:18:03.734079 IP 112.26.2.1.43445 > 112.26.2.8.39903: Flags [.], seq 365569:366997, ack 1, win 4017, options [nop,nop,TS val 158110 ecr 4294911701,mptcp dss ack 1720219151 seq 3868302027 subseq 365569 len 1428 csum 0x5f16], length 1428
10:18:03.734125 IP 112.26.2.1.43445 > 112.26.2.8.39903: Flags [.], seq 366997:368425, ack 1, win 4017, options [nop,nop,TS val 158110 ecr 4294911701,mptcp dss ack 1720219151 seq 3868303455 subseq 366997 len 1428 csum 0x4a7a], length 1428
10:18:03.777145 IP 112.26.2.8.39903 > 112.26.2.1.43445: Flags [.], ack 352717, win 24231, options [nop,nop,TS val 4294911771 ecr 156752,mptcp dss ack 3868160655], length 0
10:18:03.777370 IP 112.26.2.1.43445 > 112.26.2.8.39903: Flags [.], seq 368425:369853, ack 1, win 4017, options [nop,nop,TS val 158153 ecr 4294911771,mptcp dss ack 1720219151 seq 3868306311 subseq 368425 len 1428 csum 0x3734], length 1428
10:18:03.831527 IP 112.26.2.8.39903 > 112.26.2.1.43445: Flags [.], ack 354145, win 24231, options [nop,nop,TS val 4294911880 ecr 156752,mptcp dss ack 3868160655], length 0
10:18:03.831762 IP 112.26.2.1.43445 > 112.26.2.8.39903: Flags [.], seq 369853:371281, ack 1, win 4017, options [nop,nop,TS val 158208 ecr 4294911880,mptcp dss ack 1720219151 seq 3868307739 subseq 369853 len 1428 csum 0xe232], length 1428
10:18:03.908672 IP 112.26.2.1.43445 > 112.26.2.8.39903: Flags [.], seq 361285:362713, ack 1, win 4017, options [nop,nop,TS val 157654 ecr 4294911241,mptcp dss ack 1720219151 seq 3868286319 subseq 361285 len 1428 csum 0xa3d2], length 1428
10:18:04.014167 IP 112.26.2.8.39903 > 112.26.2.1.43445: Flags [.], ack 355573, win 24231, options [nop,nop,TS val 4294912034 ecr 156827,mptcp dss ack 3868160655], length 0
10:18:04.014413 IP 112.26.2.1.43445 > 112.26.2.8.39903: Flags [.], seq 371281:372709, ack 1, win 4017, options [nop,nop,TS val 158390 ecr 4294912034,mptcp dss ack 1720219151 seq 3868310595 subseq 371281 len 1428 csum 0x1c57], length 1428
10:18:04.068908 IP 112.26.2.8.39903 > 112.26.2.1.43445: Flags [.], ack 355573, win 24231, options [nop,nop,TS val 4294912122 ecr 156827,nop,nop,sack 1 {357001:358429},mptcp dss ack 3868160655], length 0
10:18:04.106224 IP 112.26.2.1.43445 > 112.26.2.8.39903: Flags [.], seq 372709:374137, ack 1, win 4017, options [nop,nop,TS val 158482 ecr 4294912122,mptcp dss ack 1720219151 seq 3868314879 subseq 372709 len 1428 csum 0x760d], length 1428
10:18:04.170179 IP 112.26.2.8.39903 > 112.26.2.1.43445: Flags [.], ack 355573, win 24231, options [nop,nop,TS val 4294912222 ecr 156827,nop,nop,sack 1 {357001:359857},mptcp dss ack 3868160655], length 0
10:18:04.205971 IP 112.26.2.1.43445 > 112.26.2.8.39903: Flags [.], seq 362713:364141, ack 1, win 4017, options [nop,nop,TS val 158010 ecr 4294911482,mptcp dss ack 1720219151 seq 3868292031 subseq 362713 len 1428 csum 0xe8a8], length 1428
10:18:04.243330 IP 112.26.2.1.43445 > 112.26.2.8.39903: Flags [.], seq 374137:375565, ack 1, win 4017, options [nop,nop,TS val 158619 ecr 4294912222,mptcp dss ack 1720219151 seq 3868330587 subseq 374137 len 1428 csum 0x1187], length 1428
10:18:04.318619 IP 112.26.2.1.43445 > 112.26.2.8.39903: Flags [.], seq 364141:365569, ack 1, win 4017, options [nop,nop,TS val 158071 ecr 4294911598,mptcp dss ack 1720219151 seq 3868294887 subseq 364141 len 1428 csum 0x1147], length 1428
10:18:04.411717 IP 112.26.2.1.43445 > 112.26.2.8.39903: Flags [.], seq 365569:366997, ack 1, win 4017, options [nop,nop,TS val 158110 ecr 4294911701,mptcp dss ack 1720219151 seq 3868302027 subseq 365569 len 1428 csum 0x5f16], length 1428
10:18:04.463551 IP 112.26.2.1.43445 > 112.26.2.8.39903: Flags [.], seq 355573:357001, ack 1, win 4017, options [nop,nop,TS val 158840 ecr 4294912222,mptcp dss ack 1720219151 seq 3868244907 subseq 355573 len 1428 csum 0x9370], length 1428
10:18:04.501793 IP 112.26.2.1.43445 > 112.26.2.8.39903: Flags [.], seq 366997:368425, ack 1, win 4017, options [nop,nop,TS val 158110 ecr 4294911701,mptcp dss ack 1720219151 seq 3868303455 subseq 366997 len 1428 csum 0x4a7a], length 1428
10:18:04.579884 IP 112.26.2.8.39903 > 112.26.2.1.43445: Flags [.], ack 355573, win 24231, options [nop,nop,TS val 4294912581 ecr 156827,nop,nop,sack 2 {361285:362713}{357001:359857},mptcp dss ack 3868160655], length 0
10:18:04.580088 IP 112.26.2.1.43445 > 112.26.2.8.39903: Flags [.], seq 359857:361285, ack 1, win 4017, options [nop,nop,TS val 158956 ecr 4294912581,mptcp dss ack 1720219151 seq 3868263471 subseq 359857 len 1428 csum 0x1126], length 1428
10:18:04.613874 IP 112.26.2.1.43445 > 112.26.2.8.39903: Flags [.], seq 368425:369853, ack 1, win 4017, options [nop,nop,TS val 158153 ecr 4294911771,mptcp dss ack 1720219151 seq 3868306311 subseq 368425 len 1428 csum 0x3734], length 1428
10:18:04.725753 IP 112.26.2.1.43445 > 112.26.2.8.39903: Flags [.], seq 369853:371281, ack 1, win 4017, options [nop,nop,TS val 158208 ecr 4294911880,mptcp dss ack 1720219151 seq 3868307739 subseq 369853 len 1428 csum 0xe232], length 1428
10:18:04.777399 IP 112.26.2.1.43445 > 112.26.2.8.39903: Flags [.], seq 371281:372709, ack 1, win 4017, options [nop,nop,TS val 158390 ecr 4294912034,mptcp dss ack 1720219151 seq 3868310595 subseq 371281 len 1428 csum 0x1c57], length 1428
10:18:04.882157 IP 112.26.2.8.39903 > 112.26.2.1.43445: Flags [.], ack 355573, win 24231, options [nop,nop,TS val 4294912865 ecr 156827,nop,nop,sack 2 {361285:364141}{357001:359857},mptcp dss ack 3868160655], length 0
10:18:04.910874 IP 112.26.2.1.43445 > 112.26.2.8.39903: Flags [.], seq 375565:376993, ack 1, win 4017, options [nop,nop,TS val 159287 ecr 4294912865,mptcp dss ack 1720219151 seq 3868343439 subseq 375565 len 1428 csum 0xc7c0], length 1428
10:18:04.951224 IP 112.26.2.1.43445 > 112.26.2.8.39903: Flags [.], seq 374137:375565, ack 1, win 4017, options [nop,nop,TS val 158619 ecr 4294912222,mptcp dss ack 1720219151 seq 3868330587 subseq 374137 len 1428 csum 0x1187], length 1428
10:18:05.020532 IP 112.26.2.8.39903 > 112.26.2.1.43445: Flags [.], ack 355573, win 24231, options [nop,nop,TS val 4294912979 ecr 156827,nop,nop,sack 2 {361285:365569}{357001:359857},mptcp dss ack 3868160655], length 0
10:18:05.089236 IP 112.26.2.8.39903 > 112.26.2.1.43445: Flags [.], ack 355573, win 24231, options [nop,nop,TS val 4294913088 ecr 156827,nop,nop,sack 2 {361285:366997}{357001:359857},mptcp dss ack 3868160655], length 0
10:18:05.142030 IP 112.26.2.1.43445 > 112.26.2.8.39903: Flags [.], seq 355573:357001, ack 1, win 4017, options [nop,nop,TS val 158840 ecr 4294912222,mptcp dss ack 1720219151 seq 3868244907 subseq 355573 len 1428 csum 0x9370], length 1428
10:18:05.212811 IP 112.26.2.8.39903 > 112.26.2.1.43445: Flags [.], ack 355573, win 24231, options [nop,nop,TS val 4294913168 ecr 156827,nop,nop,sack 2 {361285:368425}{357001:359857},mptcp dss ack 3868160655], length 0
10:18:05.213039 IP 112.26.2.1.43445 > 112.26.2.8.39903: Flags [.], seq 376993:378421, ack 1, win 4017, options [nop,nop,TS val 159589 ecr 4294913088,mptcp dss ack 1720219151 seq 3868354863 subseq 376993 len 1428 csum 0xdbe6], length 1428
10:18:05.267629 IP 112.26.2.1.43445 > 112.26.2.8.39903: Flags [.], seq 359857:361285, ack 1, win 4017, options [nop,nop,TS val 158956 ecr 4294912581,mptcp dss ack 1720219151 seq 3868263471 subseq 359857 len 1428 csum 0x1126], length 1428
10:18:05.297788 IP 112.26.2.1.43445 > 112.26.2.8.39903: Flags [.], seq 378421:379849, ack 1, win 4017, options [nop,nop,TS val 159674 ecr 4294913168,mptcp dss ack 1720219151 seq 3868356291 subseq 378421 len 1428 csum 0xd148], length 1428
10:18:05.342021 IP 112.26.2.8.39903 > 112.26.2.1.43445: Flags [.], ack 355573, win 24231, options [nop,nop,TS val 4294913385 ecr 156827,nop,nop,sack 2 {361285:371281}{357001:359857},mptcp dss ack 3868160655], length 0
10:18:05.405699 IP 112.26.2.8.39903 > 112.26.2.1.43445: Flags [.], ack 355573, win 24231, options [nop,nop,TS val 4294913446 ecr 156827,nop,nop,sack 2 {361285:372709}{357001:359857},mptcp dss ack 3868160655], length 0
10:18:05.416538 IP 112.26.2.1.43445 > 112.26.2.8.39903: Flags [.], seq 379849:381277, ack 1, win 4017, options [nop,nop,TS val 159793 ecr 4294913446,mptcp dss ack 1720219151 seq 3868363431 subseq 379849 len 1428 csum 0x3c5f], length 1428
10:18:05.501908 IP 112.26.2.1.43445 > 112.26.2.8.39903: Flags [.], seq 375565:376993, ack 1, win 4017, options [nop,nop,TS val 159287 ecr 4294912865,mptcp dss ack 1720219151 seq 3868343439 subseq 375565 len 1428 csum 0xc7c0], length 1428
10:18:05.573786 IP 112.26.2.8.39903 > 112.26.2.1.43445: Flags [.], ack 355573, win 24209, options [nop,nop,TS val 4294913611 ecr 156827,nop,nop,sack 2 {374137:375565}{361285:372709},mptcp dss ack 3868162083], length 0
10:18:05.574009 IP 112.26.2.1.43445 > 112.26.2.8.39903: Flags [.], seq 372709:374137, ack 1, win 4017, options [nop,nop,TS val 159950 ecr 4294913611,mptcp dss ack 1720219151 seq 3868314879 subseq 372709 len 1428 csum 0x760d], length 1428
10:18:05.652612 IP 112.26.2.8.39903 > 112.26.2.1.43445: Flags [.], ack 359857, win 24209, options [nop,nop,TS val 4294913802 ecr 158840,nop,nop,sack 2 {374137:375565}{361285:372709},mptcp dss ack 3868162083], length 0
10:18:05.652922 IP 112.26.2.1.43445 > 112.26.2.8.39903: Flags [.], seq 381277:382705, ack 1, win 4017, options [nop,nop,TS val 160029 ecr 4294913802,mptcp dss ack 1720219151 seq 3868377711 subseq 381277 len 1428 csum 0xf506], length 1428
10:18:05.652977 IP 112.26.2.1.43445 > 112.26.2.8.39903: Flags [.], seq 382705:384133, ack 1, win 4017, options [nop,nop,TS val 160029 ecr 4294913802,mptcp dss ack 1720219151 seq 3868379139 subseq 382705 len 1428 csum 0x9eba], length 1428
10:18:05.698140 IP 112.26.2.1.43445 > 112.26.2.8.39903: Flags [.], seq 376993:378421, ack 1, win 4017, options [nop,nop,TS val 159589 ecr 4294913088,mptcp dss ack 1720219151 seq 3868354863 subseq 376993 len 1428 csum 0xdbe6], length 1428
10:18:05.816537 IP 112.26.2.8.39903 > 112.26.2.1.43445: Flags [.], ack 372709, win 24209, options [nop,nop,TS val 4294913927 ecr 158956,nop,nop,sack 1 {374137:375565},mptcp dss ack 3868162083], length 0
10:18:05.816750 IP 112.26.2.1.43445 > 112.26.2.8.39903: Flags [.], seq 384133:385561, ack 1, win 4017, options [nop,nop,TS val 160193 ecr 4294913927,mptcp dss ack 1720219151 seq 3868393419 subseq 384133 len 1428 csum 0x3743], length 1428
10:18:05.856610 IP 112.26.2.1.43445 > 112.26.2.8.39903: Flags [.], seq 378421:379849, ack 1, win 4017, options [nop,nop,TS val 159674 ecr 4294913168,mptcp dss ack 1720219151 seq 3868356291 subseq 378421 len 1428 csum 0xd148], length 1428
10:18:05.945322 IP 112.26.2.1.43445 > 112.26.2.8.39903: Flags [.], seq 379849:381277, ack 1, win 4017, options [nop,nop,TS val 159793 ecr 4294913446,mptcp dss ack 1720219151 seq 3868363431 subseq 379849 len 1428 csum 0x3c5f], length 1428
10:18:06.039873 IP 112.26.2.8.39903 > 112.26.2.1.43445: Flags [.], ack 372709, win 24209, options [nop,nop,TS val 4294914215 ecr 158956,nop,nop,sack 1 {374137:376993},mptcp dss ack 3868162083], length 0
10:18:06.092782 IP 112.26.2.1.43445 > 112.26.2.8.39903: Flags [.], seq 372709:374137, ack 1, win 4017, options [nop,nop,TS val 159950 ecr 4294913611,mptcp dss ack 1720219151 seq 3868314879 subseq 372709 len 1428 csum 0x760d], length 1428
10:18:06.117101 IP 112.26.2.1.43445 > 112.26.2.8.39903: Flags [.], seq 385561:386989, ack 1, win 4017, options [nop,nop,TS val 160493 ecr 4294914215,mptcp dss ack 1720219151 seq 3868411983 subseq 385561 len 1428 csum 0xb807], length 1428
10:18:06.230267 IP 112.26.2.1.43445 > 112.26.2.8.39903: Flags [.], seq 381277:382705, ack 1, win 4017, options [nop,nop,TS val 160029 ecr 4294913802,mptcp dss ack 1720219151 seq 3868377711 subseq 381277 len 1428 csum 0xf506], length 1428
10:18:06.339026 IP 112.26.2.8.39903 > 112.26.2.1.43445: Flags [.], ack 372709, win 24209, options [nop,nop,TS val 4294914359 ecr 158956,nop,nop,sack 1 {374137:378421},mptcp dss ack 3868162083], length 0
10:18:06.394960 IP 112.26.2.1.43445 > 112.26.2.8.39903: Flags [.], seq 382705:384133, ack 1, win 4017, options [nop,nop,TS val 160029 ecr 4294913802,mptcp dss ack 1720219151 seq 3868379139 subseq 382705 len 1428 csum 0x9eba], length 1428
10:18:06.426067 IP 112.26.2.1.43445 > 112.26.2.8.39903: Flags [.], seq 386989:388417, ack 1, win 4017, options [nop,nop,TS val 160802 ecr 4294914359,mptcp dss ack 1720219151 seq 3868423407 subseq 386989 len 1428 csum 0x99f7], length 1428
10:18:06.516506 IP 112.26.2.1.43445 > 112.26.2.8.39903: Flags [.], seq 384133:385561, ack 1, win 4017, options [nop,nop,TS val 160193 ecr 4294913927,mptcp dss ack 1720219151 seq 3868393419 subseq 384133 len 1428 csum 0x3743], length 1428
10:18:06.609849 IP 112.26.2.8.39903 > 112.26.2.1.43445: Flags [.], ack 372709, win 24209, options [nop,nop,TS val 4294914517 ecr 158956,nop,nop,sack 1 {374137:379849},mptcp dss ack 3868162083], length 0
10:18:06.654767 IP 112.26.2.8.39903 > 112.26.2.1.43445: Flags [.], ack 372709, win 24209, options [nop,nop,TS val 4294914605 ecr 158956,nop,nop,sack 1 {374137:381277},mptcp dss ack 3868162083], length 0
10:18:06.654998 IP 112.26.2.1.43445 > 112.26.2.8.39903: Flags [.], seq 388417:389845, ack 1, win 4017, options [nop,nop,TS val 161031 ecr 4294914517,mptcp dss ack 1720219151 seq 3868426263 subseq 388417 len 1428 csum 0x4643], length 1428
10:18:06.694316 IP 112.26.2.1.43445 > 112.26.2.8.39903: Flags [.], seq 389845:391273, ack 1, win 4017, options [nop,nop,TS val 161070 ecr 4294914605,mptcp dss ack 1720219151 seq 3868427691 subseq 389845 len 1428 csum 0xb0d5], length 1428
10:18:06.760932 IP 112.26.2.8.39903 > 112.26.2.1.43445: Flags [.], ack 381277, win 24209, options [nop,nop,TS val 4294914752 ecr 159950,mptcp dss ack 3868162083], length 0
10:18:06.761160 IP 112.26.2.1.43445 > 112.26.2.8.39903: Flags [.], seq 391273:392701, ack 1, win 4017, options [nop,nop,TS val 161137 ecr 4294914752,mptcp dss ack 1720219151 seq 3868433403 subseq 391273 len 1428 csum 0xb392], length 1428
10:18:06.829154 IP 112.26.2.1.43445 > 112.26.2.8.39903: Flags [.], seq 385561:386989, ack 1, win 4017, options [nop,nop,TS val 160493 ecr 4294914215,mptcp dss ack 1720219151 seq 3868411983 subseq 385561 len 1428 csum 0xb807], length 1428
10:18:06.918725 IP 112.26.2.8.39903 > 112.26.2.1.43445: Flags [.], ack 382705, win 24209, options [nop,nop,TS val 4294914889 ecr 160029,mptcp dss ack 3868162083], length 0
10:18:06.919035 IP 112.26.2.1.43445 > 112.26.2.8.39903: Flags [.], seq 392701:394129, ack 1, win 4017, options [nop,nop,TS val 161295 ecr 4294914889,mptcp dss ack 1720219151 seq 3868440543 subseq 392701 len 1428 csum 0xc634], length 1428
10:18:06.919072 IP 112.26.2.1.43445 > 112.26.2.8.39903: Flags [.], seq 394129:395557, ack 1, win 4017, options [nop,nop,TS val 161295 ecr 4294914889,mptcp dss ack 1720219151 seq 3868441971 subseq 394129 len 1428 csum 0xcdc5], length 1428
10:18:07.086439 IP 112.26.2.1.43445 > 112.26.2.8.39903: Flags [.], seq 386989:388417, ack 1, win 4017, options [nop,nop,TS val 160802 ecr 4294914359,mptcp dss ack 1720219151 seq 3868423407 subseq 386989 len 1428 csum 0x99f7], length 1428
10:18:07.173010 IP 112.26.2.8.39903 > 112.26.2.1.43445: Flags [.], ack 384133, win 24209, options [nop,nop,TS val 4294915054 ecr 160029,mptcp dss ack 3868162083], length 0
10:18:07.173305 IP 112.26.2.1.43445 > 112.26.2.8.39903: Flags [.], seq 395557:396985, ack 1, win 4017, options [nop,nop,TS val 161550 ecr 4294915054,mptcp dss ack 1720219151 seq 3868450539 subseq 395557 len 1428 csum 0x1195], length 1428
10:18:07.233257 IP 112.26.2.8.39903 > 112.26.2.1.43445: Flags [.], ack 385561, win 24209, options [nop,nop,TS val 4294915180 ecr 160193,mptcp dss ack 3868162083], length 0
10:18:07.233519 IP 112.26.2.1.43445 > 112.26.2.8.39903: Flags [.], seq 396985:398413, ack 1, win 4017, options [nop,nop,TS val 161610 ecr 4294915180,mptcp dss ack 1720219151 seq 3868453395 subseq 396985 len 1428 csum 0xaa53], length 1428
10:18:07.290702 IP 112.26.2.1.43445 > 112.26.2.8.39903: Flags [.], seq 388417:389845, ack 1, win 4017, options [nop,nop,TS val 161031 ecr 4294914517,mptcp dss ack 1720219151 seq 3868426263 subseq 388417 len 1428 csum 0x4643], length 1428
10:18:07.349554 IP 112.26.2.1.43445 > 112.26.2.8.39903: Flags [.], seq 389845:391273, ack 1, win 4017, options [nop,nop,TS val 161070 ecr 4294914605,mptcp dss ack 1720219151 seq 3868427691 subseq 389845 len 1428 csum 0xb0d5], length 1428
