10:17:23.895804 IP 112.26.2.8.39903 > 112.26.2.1.43445: Flags [S], seq 672498423, win 65535, options [mss 1460,sackOK,TS val 4294872457 ecr 0,nop,wscale 6,mptcp join id 4 token 0x1271d1f5 nonce 0xad08927e], length 0
10:17:23.934119 IP 112.26.2.8.39903 > 112.26.2.1.43445: Flags [S], seq 672498423, win 65535, options [mss 1460,sackOK,TS val 4294872457 ecr 0,nop,wscale 6,mptcp join id 4 token 0x1271d1f5 nonce 0xad08927e], length 0
10:17:24.003720 IP 112.26.2.8.39903 > 112.26.2.1.43445: Flags [S], seq 672498423, win 65535, options [mss 1460,sackOK,TS val 4294872457 ecr 0,nop,wscale 6,mptcp join id 4 token 0x1271d1f5 nonce 0xad08927e], length 0
10:17:24.124463 IP 112.26.2.1.43445 > 112.26.2.8.39903: Flags [S.], seq 1340884807, ack 672498424, win 65535, options [mss 1460,sackOK,TS val 118380 ecr 4294872457,nop,wscale 6,mptcp join id 6 hmac 0xdf78a7e315d0df0 nonce 0x6a59e05e], length 0
10:17:24.225889 IP 112.26.2.8.39903 > 112.26.2.1.43445: Flags [.], ack 1, win 6479, options [nop,nop,TS val 4294872838 ecr 118380,mptcp join hmac 0x06c6c92732455c5a9bc8c60b0e48efa7c6236428], length 0
10:17:24.226139 IP 112.26.2.8.39903 > 112.26.2.1.43445: Flags [.], ack 1, win 6479, options [nop,nop,TS val 4294872838 ecr 118380,mptcp join hmac 0x06c6c92732455c5a9bc8c60b0e48efa7c6236428], length 0
10:17:24.254473 IP 112.26.2.8.39903 > 112.26.2.1.43445: Flags [.], ack 1, win 6479, options [nop,nop,TS val 4294872838 ecr 118380,mptcp join hmac 0x06c6c92732455c5a9bc8c60b0e48efa7c6236428], length 0
10:17:58.490993 IP 112.26.2.8.39903 > 112.26.2.1.43445: Flags [.], ack 307021, win 24409, options [nop,nop,TS val 4294907144 ecr 152146,mptcp dss ack 3867986439], length 0
10:17:58.491349 IP 112.26.2.8.39903 > 112.26.2.1.43445: Flags [.], ack 307021, win 24409, options [nop,nop,TS val 4294907144 ecr 152146,mptcp dss ack 3867986439], length 0
10:17:58.529479 IP 112.26.2.1.43445 > 112.26.2.8.39903: Flags [.], seq 307021:308449, ack 1, win 4017, options [nop,nop,TS val 152146 ecr 4294905727,mptcp dss ack 1720219151 seq 3868005003 subseq 307021 len 1428 csum 0x5d30], length 1428
10:17:58.610493 IP 112.26.2.1.43445 > 112.26.2.8.39903: Flags [.], seq 309877:311305, ack 1, win 4017, options [nop,nop,TS val 152376 ecr 4294905914,mptcp dss ack 1720219151 seq 3868014999 subseq 309877 len 1428 csum 0x94a8], length 1428
10:17:58.614129 IP 112.26.2.8.39903 > 112.26.2.1.43445: Flags [.], ack 308449, win 24409, options [nop,nop,TS val 4294907269 ecr 152146,nop,nop,sack 1 {309877:311305},mptcp dss ack 3867986439], length 0
10:17:58.614383 IP 112.26.2.8.39903 > 112.26.2.1.43445: Flags [.], ack 308449, win 24409, options [nop,nop,TS val 4294907269 ecr 152146,nop,nop,sack 1 {309877:311305},mptcp dss ack 3867986439], length 0
10:17:58.720376 IP 112.26.2.8.39903 > 112.26.2.1.43445: Flags [.], ack 305593, win 24210, options [nop,nop,TS val 4294906663 ecr 151499,mptcp dss ack 3867935031], length 0
10:17:58.792673 IP 112.26.2.1.43445 > 112.26.2.8.39903: Flags [.], seq 311305:312733, ack 1, win 4017, options [nop,nop,TS val 152439 ecr 4294906088,mptcp dss ack 1720219151 seq 3868017855 subseq 311305 len 1428 csum 0xb4b6], length 1428
10:17:58.798868 IP 112.26.2.8.39903 > 112.26.2.1.43445: Flags [.], ack 308449, win 24409, options [nop,nop,TS val 4294907451 ecr 152146,nop,nop,sack 1 {309877:312733},mptcp dss ack 3867986439], length 0
10:17:58.799167 IP 112.26.2.8.39903 > 112.26.2.1.43445: Flags [.], ack 308449, win 24409, options [nop,nop,TS val 4294907451 ecr 152146,nop,nop,sack 1 {309877:312733},mptcp dss ack 3867986439], length 0
10:17:58.897820 IP 112.26.2.1.43445 > 112.26.2.8.39903: Flags [.], seq 312733:314161, ack 1, win 4017, options [nop,nop,TS val 152439 ecr 4294906088,mptcp dss ack 1720219151 seq 3868019283 subseq 312733 len 1428 csum 0xcd0b], length 1428
10:17:58.903173 IP 112.26.2.8.39903 > 112.26.2.1.43445: Flags [.], ack 308449, win 24409, options [nop,nop,TS val 4294907556 ecr 152146,nop,nop,sack 1 {309877:314161},mptcp dss ack 3867986439], length 0
10:17:58.903472 IP 112.26.2.8.39903 > 112.26.2.1.43445: Flags [.], ack 308449, win 24409, options [nop,nop,TS val 4294907556 ecr 152146,nop,nop,sack 1 {309877:314161},mptcp dss ack 3867986439], length 0
10:17:58.988289 IP 112.26.2.1.43445 > 112.26.2.8.39903: Flags [.], seq 314161:315589, ack 1, win 4017, options [nop,nop,TS val 152439 ecr 4294906088,mptcp dss ack 1720219151 seq 3868020711 subseq 314161 len 1428 csum 0xd55d], length 1428
10:17:58.997251 IP 112.26.2.8.39903 > 112.26.2.1.43445: Flags [.], ack 308449, win 24409, options [nop,nop,TS val 4294907648 ecr 152146,nop,nop,sack 1 {309877:315589},mptcp dss ack 3867986439], length 0
10:17:58.997546 IP 112.26.2.8.39903 > 112.26.2.1.43445: Flags [.], ack 308449, win 24409, options [nop,nop,TS val 4294907648 ecr 152146,nop,nop,sack 1 {309877:315589},mptcp dss ack 3867986439], length 0
10:17:59.070685 IP 112.26.2.1.43445 > 112.26.2.8.39903: Flags [.], seq 315589:317017, ack 1, win 4017, options [nop,nop,TS val 152543 ecr 4294906190,mptcp dss ack 1720219151 seq 3868034991 subseq 315589 len 1428 csum 0x8d03], length 1428
10:17:59.082850 IP 112.26.2.8.39903 > 112.26.2.1.43445: Flags [.], ack 308449, win 24409, options [nop,nop,TS val 4294907730 ecr 152146,nop,nop,sack 1 {309877:317017},mptcp dss ack 3867986439], length 0
10:17:59.083132 IP 112.26.2.8.39903 > 112.26.2.1.43445: Flags [.], ack 308449, win 24409, options [nop,nop,TS val 4294907730 ecr 152146,nop,nop,sack 1 {309877:317017},mptcp dss ack 3867986439], length 0
10:17:59.173081 IP 112.26.2.1.43445 > 112.26.2.8.39903: Flags [.], seq 317017:318445, ack 1, win 4017, options [nop,nop,TS val 152648 ecr 4294906287,mptcp dss ack 1720219151 seq 3868039275 subseq 317017 len 1428 csum 0x4530], length 1428
10:17:59.180129 IP 112.26.2.8.39903 > 112.26.2.1.43445: Flags [.], ack 308449, win 24409, options [nop,nop,TS val 4294907835 ecr 152146,nop,nop,sack 1 {309877:318445},mptcp dss ack 3867986439], length 0
10:17:59.180373 IP 112.26.2.8.39903 > 112.26.2.1.43445: Flags [.], ack 308449, win 24409, options [nop,nop,TS val 4294907835 ecr 152146,nop,nop,sack 1 {309877:318445},mptcp dss ack 3867986439], length 0
10:17:59.242611 IP 112.26.2.1.43445 > 112.26.2.8.39903: Flags [.], seq 318445:319873, ack 1, win 4017, options [nop,nop,TS val 152705 ecr 4294906361,mptcp dss ack 1720219151 seq 3868040703 subseq 318445 len 1428 csum 0x4d99], length 1428
10:17:59.282472 IP 112.26.2.8.39903 > 112.26.2.1.43445: Flags [.], ack 308449, win 24409, options [nop,nop,TS val 4294907901 ecr 152146,nop,nop,sack 1 {309877:319873},mptcp dss ack 3867986439], length 0
10:17:59.282775 IP 112.26.2.8.39903 > 112.26.2.1.43445: Flags [.], ack 308449, win 24409, options [nop,nop,TS val 4294907901 ecr 152146,nop,nop,sack 1 {309877:319873},mptcp dss ack 3867986439], length 0
10:17:59.337506 IP 112.26.2.8.39903 > 112.26.2.1.43445: Flags [.], ack 308449, win 24409, options [nop,nop,TS val 4294907269 ecr 152146,nop,nop,sack 1 {309877:311305},mptcp dss ack 3867986439], length 0
10:17:59.386042 IP 112.26.2.1.43445 > 112.26.2.8.39903: Flags [.], seq 319873:321301, ack 1, win 4017, options [nop,nop,TS val 153096 ecr 4294906663,mptcp dss ack 1720219151 seq 3868063551 subseq 319873 len 1428 csum 0x38ad], length 1428
10:17:59.389328 IP 112.26.2.8.39903 > 112.26.2.1.43445: Flags [.], ack 308449, win 24409, options [nop,nop,TS val 4294908044 ecr 152146,nop,nop,sack 1 {309877:321301},mptcp dss ack 3867986439], length 0
10:17:59.389656 IP 112.26.2.8.39903 > 112.26.2.1.43445: Flags [.], ack 308449, win 24409, options [nop,nop,TS val 4294908044 ecr 152146,nop,nop,sack 1 {309877:321301},mptcp dss ack 3867986439], length 0
10:17:59.521086 IP 112.26.2.1.43445 > 112.26.2.8.39903: Flags [.], seq 321301:322729, ack 1, win 4017, options [nop,nop,TS val 153096 ecr 4294906663,mptcp dss ack 1720219151 seq 3868064979 subseq 321301 len 1428 csum 0xe372], length 1428
10:17:59.528247 IP 112.26.2.8.39903 > 112.26.2.1.43445: Flags [.], ack 308449, win 24409, options [nop,nop,TS val 4294908182 ecr 152146,nop,nop,sack 1 {309877:322729},mptcp dss ack 3867986439], length 0
10:17:59.528424 IP 112.26.2.8.39903 > 112.26.2.1.43445: Flags [.], ack 308449, win 24409, options [nop,nop,TS val 4294908182 ecr 152146,nop,nop,sack 1 {309877:322729},mptcp dss ack 3867986439], length 0
10:17:59.645141 IP 112.26.2.8.39903 > 112.26.2.1.43445: Flags [.], ack 308449, win 24409, options [nop,nop,TS val 4294907556 ecr 152146,nop,nop,sack 1 {309877:314161},mptcp dss ack 3867986439], length 0
10:17:59.693339 IP 112.26.2.8.39903 > 112.26.2.1.43445: Flags [.], ack 308449, win 24409, options [nop,nop,TS val 4294907648 ecr 152146,nop,nop,sack 1 {309877:315589},mptcp dss ack 3867986439], length 0
10:17:59.781907 IP 112.26.2.8.39903 > 112.26.2.1.43445: Flags [.], ack 308449, win 24409, options [nop,nop,TS val 4294907730 ecr 152146,nop,nop,sack 1 {309877:317017},mptcp dss ack 3867986439], length 0
10:17:59.842611 IP 112.26.2.8.39903 > 112.26.2.1.43445: Flags [.], ack 308449, win 24409, options [nop,nop,TS val 4294907835 ecr 152146,nop,nop,sack 1 {309877:318445},mptcp dss ack 3867986439], length 0
10:17:59.871942 IP 112.26.2.8.39903 > 112.26.2.1.43445: Flags [.], ack 308449, win 24409, options [nop,nop,TS val 4294907901 ecr 152146,nop,nop,sack 1 {309877:319873},mptcp dss ack 3867986439], length 0
10:17:59.950535 IP 112.26.2.1.43445 > 112.26.2.8.39903: Flags [.], seq 322729:324157, ack 1, win 4017, options [nop,nop,TS val 153713 ecr 4294907269,mptcp dss ack 1720219151 seq 3868083543 subseq 322729 len 1428 csum 0xc864], length 1428
10:17:59.963880 IP 112.26.2.8.39903 > 112.26.2.1.43445: Flags [.], ack 308449, win 24409, options [nop,nop,TS val 4294908609 ecr 152146,nop,nop,sack 1 {309877:324157},mptcp dss ack 3867986439], length 0
10:17:59.964093 IP 112.26.2.8.39903 > 112.26.2.1.43445: Flags [.], ack 308449, win 24409, options [nop,nop,TS val 4294908609 ecr 152146,nop,nop,sack 1 {309877:324157},mptcp dss ack 3867986439], length 0
10:18:00.025737 IP 112.26.2.1.43445 > 112.26.2.8.39903: Flags [.], seq 324157:325585, ack 1, win 4017, options [nop,nop,TS val 153713 ecr 4294907269,mptcp dss ack 1720219151 seq 3868084971 subseq 324157 len 1428 csum 0x77f4], length 1428
10:18:00.072432 IP 112.26.2.8.39903 > 112.26.2.1.43445: Flags [.], ack 308449, win 24276, options [nop,nop,TS val 4294908728 ecr 152146,nop,nop,sack 1 {309877:325585},mptcp dss ack 3867995007], length 0
10:18:00.072746 IP 112.26.2.8.39903 > 112.26.2.1.43445: Flags [.], ack 308449, win 24276, options [nop,nop,TS val 4294908728 ecr 152146,nop,nop,sack 1 {309877:325585},mptcp dss ack 3867995007], length 0
10:18:00.105476 IP 112.26.2.8.39903 > 112.26.2.1.43445: Flags [.], ack 308449, win 24409, options [nop,nop,TS val 4294908044 ecr 152146,nop,nop,sack 1 {309877:321301},mptcp dss ack 3867986439], length 0
10:18:00.167798 IP 112.26.2.1.43445 > 112.26.2.8.39903: Flags [.], seq 325585:327013, ack 1, win 4017, options [nop,nop,TS val 153713 ecr 4294907269,mptcp dss ack 1720219151 seq 3868086399 subseq 325585 len 1428 csum 0x423f], length 1428
10:18:00.173086 IP 112.26.2.8.39903 > 112.26.2.1.43445: Flags [.], ack 308449, win 24098, options [nop,nop,TS val 4294908828 ecr 152146,nop,nop,sack 1 {309877:327013},mptcp dss ack 3868006431], length 0
10:18:00.173398 IP 112.26.2.8.39903 > 112.26.2.1.43445: Flags [.], ack 308449, win 24098, options [nop,nop,TS val 4294908828 ecr 152146,nop,nop,sack 1 {309877:327013},mptcp dss ack 3868006431], length 0
10:18:00.258979 IP 112.26.2.8.39903 > 112.26.2.1.43445: Flags [.], ack 308449, win 24409, options [nop,nop,TS val 4294908182 ecr 152146,nop,nop,sack 1 {309877:322729},mptcp dss ack 3867986439], length 0
10:18:00.328854 IP 112.26.2.1.43445 > 112.26.2.8.39903: Flags [.], seq 308449:309877, ack 1, win 4017, options [nop,nop,TS val 154021 ecr 4294907556,mptcp dss ack 1720219151 seq 3868006431 subseq 308449 len 1428 csum 0xb0b6], length 1428
10:18:00.334759 IP 112.26.2.8.39903 > 112.26.2.1.43445: Flags [.], ack 327013, win 23764, options [nop,nop,TS val 4294908989 ecr 154021,mptcp dss ack 3868032135], length 0
10:18:00.335071 IP 112.26.2.8.39903 > 112.26.2.1.43445: Flags [.], ack 327013, win 23764, options [nop,nop,TS val 4294908989 ecr 154021,mptcp dss ack 3868032135], length 0
10:18:00.431292 IP 112.26.2.1.43445 > 112.26.2.8.39903: Flags [.], seq 328441:329869, ack 1, win 4017, options [nop,nop,TS val 154069 ecr 4294907556,mptcp dss ack 1720219151 seq 3868099251 subseq 328441 len 1428 csum 0x8aa5], length 1428
10:18:00.435552 IP 112.26.2.8.39903 > 112.26.2.1.43445: Flags [.], ack 327013, win 24030, options [nop,nop,TS val 4294909090 ecr 154021,nop,nop,sack 1 {328441:329869},mptcp dss ack 3868032135], length 0
10:18:00.435845 IP 112.26.2.8.39903 > 112.26.2.1.43445: Flags [.], ack 327013, win 24030, options [nop,nop,TS val 4294909090 ecr 154021,nop,nop,sack 1 {328441:329869},mptcp dss ack 3868032135], length 0
10:18:00.543927 IP 112.26.2.1.43445 > 112.26.2.8.39903: Flags [.], seq 329869:331297, ack 1, win 4017, options [nop,nop,TS val 154078 ecr 4294907648,mptcp dss ack 1720219151 seq 3868100679 subseq 329869 len 1428 csum 0x2bf9], length 1428
10:18:00.550016 IP 112.26.2.8.39903 > 112.26.2.1.43445: Flags [.], ack 327013, win 24030, options [nop,nop,TS val 4294909204 ecr 154021,nop,nop,sack 1 {328441:331297},mptcp dss ack 3868032135], length 0
10:18:00.550333 IP 112.26.2.8.39903 > 112.26.2.1.43445: Flags [.], ack 327013, win 24030, options [nop,nop,TS val 4294909204 ecr 154021,nop,nop,sack 1 {328441:331297},mptcp dss ack 3868032135], length 0
10:18:00.632429 IP 112.26.2.1.43445 > 112.26.2.8.39903: Flags [.], seq 331297:332725, ack 1, win 4017, options [nop,nop,TS val 154248 ecr 4294907835,mptcp dss ack 1720219151 seq 3868106391 subseq 331297 len 1428 csum 0x5d13], length 1428
10:18:00.640168 IP 112.26.2.8.39903 > 112.26.2.1.43445: Flags [.], ack 327013, win 24030, options [nop,nop,TS val 4294909293 ecr 154021,nop,nop,sack 1 {328441:332725},mptcp dss ack 3868032135], length 0
10:18:00.640425 IP 112.26.2.8.39903 > 112.26.2.1.43445: Flags [.], ack 327013, win 24030, options [nop,nop,TS val 4294909293 ecr 154021,nop,nop,sack 1 {328441:332725},mptcp dss ack 3868032135], length 0
10:18:00.715201 IP 112.26.2.1.43445 > 112.26.2.8.39903: Flags [.], seq 332725:334153, ack 1, win 4017, options [nop,nop,TS val 154289 ecr 4294907901,mptcp dss ack 1720219151 seq 3868107819 subseq 332725 len 1428 csum 0xffb9], length 1428
10:18:00.752378 IP 112.26.2.8.39903 > 112.26.2.1.43445: Flags [.], ack 327013, win 24009, options [nop,nop,TS val 4294909407 ecr 154021,nop,nop,sack 1 {328441:334153},mptcp dss ack 3868047843], length 0
10:18:00.752646 IP 112.26.2.8.39903 > 112.26.2.1.43445: Flags [.], ack 327013, win 24009, options [nop,nop,TS val 4294909407 ecr 154021,nop,nop,sack 1 {328441:334153},mptcp dss ack 3868047843], length 0
10:18:00.784961 IP 112.26.2.8.39903 > 112.26.2.1.43445: Flags [.], ack 308449, win 24276, options [nop,nop,TS val 4294908728 ecr 152146,nop,nop,sack 1 {309877:325585},mptcp dss ack 3867995007], length 0
10:18:00.838000 IP 112.26.2.8.39903 > 112.26.2.1.43445: Flags [.], ack 308449, win 24098, options [nop,nop,TS val 4294908828 ecr 152146,nop,nop,sack 1 {309877:327013},mptcp dss ack 3868006431], length 0
10:18:00.932939 IP 112.26.2.8.39903 > 112.26.2.1.43445: Flags [.], ack 327013, win 23764, options [nop,nop,TS val 4294908989 ecr 154021,mptcp dss ack 3868032135], length 0
10:18:01.013066 IP 112.26.2.8.39903 > 112.26.2.1.43445: Flags [.], ack 327013, win 24030, options [nop,nop,TS val 4294909090 ecr 154021,nop,nop,sack 1 {328441:329869},mptcp dss ack 3868032135], length 0
10:18:01.038179 IP 112.26.2.8.39903 > 112.26.2.1.43445: Flags [.], ack 327013, win 24030, options [nop,nop,TS val 4294909204 ecr 154021,nop,nop,sack 1 {328441:331297},mptcp dss ack 3868032135], length 0
10:18:01.098631 IP 112.26.2.8.39903 > 112.26.2.1.43445: Flags [.], ack 327013, win 24030, options [nop,nop,TS val 4294909293 ecr 154021,nop,nop,sack 1 {328441:332725},mptcp dss ack 3868032135], length 0
10:18:01.188437 IP 112.26.2.8.39903 > 112.26.2.1.43445: Flags [.], ack 327013, win 24009, options [nop,nop,TS val 4294909407 ecr 154021,nop,nop,sack 1 {328441:334153},mptcp dss ack 3868047843], length 0
10:18:01.234230 IP 112.26.2.1.43445 > 112.26.2.8.39903: Flags [.], seq 334153:335581, ack 1, win 4017, options [nop,nop,TS val 155172 ecr 4294908728,mptcp dss ack 1720219151 seq 3868152087 subseq 334153 len 1428 csum 0x116d], length 1428
10:18:01.249382 IP 112.26.2.8.39903 > 112.26.2.1.43445: Flags [.], ack 327013, win 24107, options [nop,nop,TS val 4294909893 ecr 154021,nop,nop,sack 1 {328441:335581},mptcp dss ack 3868073547], length 0
10:18:01.249665 IP 112.26.2.8.39903 > 112.26.2.1.43445: Flags [.], ack 327013, win 24107, options [nop,nop,TS val 4294909893 ecr 154021,nop,nop,sack 1 {328441:335581},mptcp dss ack 3868073547], length 0
10:18:01.346317 IP 112.26.2.1.43445 > 112.26.2.8.39903: Flags [.], seq 335581:337009, ack 1, win 4017, options [nop,nop,TS val 155172 ecr 4294908728,mptcp dss ack 1720219151 seq 3868153515 subseq 335581 len 1428 csum 0x62], length 1428
10:18:01.351300 IP 112.26.2.8.39903 > 112.26.2.1.43445: Flags [.], ack 327013, win 24107, options [nop,nop,TS val 4294910006 ecr 154021,nop,nop,sack 1 {328441:337009},mptcp dss ack 3868073547], length 0
10:18:01.351632 IP 112.26.2.8.39903 > 112.26.2.1.43445: Flags [.], ack 327013, win 24107, options [nop,nop,TS val 4294910006 ecr 154021,nop,nop,sack 1 {328441:337009},mptcp dss ack 3868073547], length 0
10:18:01.435027 IP 112.26.2.1.43445 > 112.26.2.8.39903: Flags [.], seq 337009:338437, ack 1, win 4017, options [nop,nop,TS val 155278 ecr 4294908828,mptcp dss ack 1720219151 seq 3868166367 subseq 337009 len 1428 csum 0xa5e2], length 1428
10:18:01.457168 IP 112.26.2.8.39903 > 112.26.2.1.43445: Flags [.], ack 327013, win 24110, options [nop,nop,TS val 4294910111 ecr 154021,nop,nop,sack 1 {328441:338437},mptcp dss ack 3868087827], length 0
10:18:01.457455 IP 112.26.2.8.39903 > 112.26.2.1.43445: Flags [.], ack 327013, win 24110, options [nop,nop,TS val 4294910111 ecr 154021,nop,nop,sack 1 {328441:338437},mptcp dss ack 3868087827], length 0
10:18:01.513419 IP 112.26.2.1.43445 > 112.26.2.8.39903: Flags [.], seq 327013:328441, ack 1, win 4017, options [nop,nop,TS val 155309 ecr 4294908989,mptcp dss ack 1720219151 seq 3868087827 subseq 327013 len 1428 csum 0x9456], length 1428
10:18:01.567239 IP 112.26.2.8.39903 > 112.26.2.1.43445: Flags [.], ack 338437, win 23972, options [nop,nop,TS val 4294910221 ecr 155309,mptcp dss ack 3868133523], length 0
10:18:01.567517 IP 112.26.2.8.39903 > 112.26.2.1.43445: Flags [.], ack 338437, win 23972, options [nop,nop,TS val 4294910221 ecr 155309,mptcp dss ack 3868133523], length 0
10:18:01.622760 IP 112.26.2.1.43445 > 112.26.2.8.39903: Flags [.], seq 338437:339865, ack 1, win 4017, options [nop,nop,TS val 155309 ecr 4294908989,mptcp dss ack 1720219151 seq 3868169223 subseq 338437 len 1428 csum 0x94e8], length 1428
10:18:01.664633 IP 112.26.2.8.39903 > 112.26.2.1.43445: Flags [.], ack 339865, win 24455, options [nop,nop,TS val 4294910320 ecr 155309,mptcp dss ack 3868134951], length 0
10:18:01.664977 IP 112.26.2.8.39903 > 112.26.2.1.43445: Flags [.], ack 339865, win 24455, options [nop,nop,TS val 4294910320 ecr 155309,mptcp dss ack 3868134951], length 0
10:18:01.692446 IP 112.26.2.1.43445 > 112.26.2.8.39903: Flags [.], seq 339865:341293, ack 1, win 4017, options [nop,nop,TS val 155414 ecr 4294909090,mptcp dss ack 1720219151 seq 3868172079 subseq 339865 len 1428 csum 0x131c], length 1428
10:18:01.771381 IP 112.26.2.1.43445 > 112.26.2.8.39903: Flags [.], seq 341293:342721, ack 1, win 4017, options [nop,nop,TS val 155438 ecr 4294909204,mptcp dss ack 1720219151 seq 3868173507 subseq 341293 len 1428 csum 0x9ef8], length 1428
10:18:01.783343 IP 112.26.2.8.39903 > 112.26.2.1.43445: Flags [.], ack 341293, win 24455, options [nop,nop,TS val 4294910388 ecr 155414,mptcp dss ack 3868134951], length 0
10:18:01.783705 IP 112.26.2.8.39903 > 112.26.2.1.43445: Flags [.], ack 341293, win 24455, options [nop,nop,TS val 4294910388 ecr 155414,mptcp dss ack 3868134951], length 0
10:18:01.861270 IP 112.26.2.1.43445 > 112.26.2.8.39903: Flags [.], seq 342721:344149, ack 1, win 4017, options [nop,nop,TS val 155484 ecr 4294909293,mptcp dss ack 1720219151 seq 3868182075 subseq 342721 len 1428 csum 0x2b14], length 1428
10:18:01.888964 IP 112.26.2.8.39903 > 112.26.2.1.43445: Flags [.], ack 342721, win 24455, options [nop,nop,TS val 4294910491 ecr 155438,mptcp dss ack 3868134951], length 0
10:18:01.889271 IP 112.26.2.8.39903 > 112.26.2.1.43445: Flags [.], ack 342721, win 24455, options [nop,nop,TS val 4294910491 ecr 155438,mptcp dss ack 3868134951], length 0
10:18:01.908044 IP 112.26.2.8.39903 > 112.26.2.1.43445: Flags [.], ack 327013, win 24107, options [nop,nop,TS val 4294909893 ecr 154021,nop,nop,sack 1 {328441:335581},mptcp dss ack 3868073547], length 0
10:18:01.961378 IP 112.26.2.8.39903 > 112.26.2.1.43445: Flags [.], ack 344149, win 24455, options [nop,nop,TS val 4294910594 ecr 155484,mptcp dss ack 3868134951], length 0
10:18:01.961727 IP 112.26.2.8.39903 > 112.26.2.1.43445: Flags [.], ack 344149, win 24455, options [nop,nop,TS val 4294910594 ecr 155484,mptcp dss ack 3868134951], length 0
10:18:02.010871 IP 112.26.2.1.43445 > 112.26.2.8.39903: Flags [.], seq 344149:345577, ack 1, win 4017, options [nop,nop,TS val 155571 ecr 4294909407,mptcp dss ack 1720219151 seq 3868186359 subseq 344149 len 1428 csum 0xeb82], length 1428
10:18:02.022821 IP 112.26.2.8.39903 > 112.26.2.1.43445: Flags [.], ack 345577, win 24455, options [nop,nop,TS val 4294910678 ecr 155571,mptcp dss ack 3868134951], length 0
10:18:02.023072 IP 112.26.2.8.39903 > 112.26.2.1.43445: Flags [.], ack 345577, win 24455, options [nop,nop,TS val 4294910678 ecr 155571,mptcp dss ack 3868134951], length 0
10:18:02.145816 IP 112.26.2.8.39903 > 112.26.2.1.43445: Flags [.], ack 327013, win 24107, options [nop,nop,TS val 4294910006 ecr 154021,nop,nop,sack 1 {328441:337009},mptcp dss ack 3868073547], length 0
10:18:02.197959 IP 112.26.2.8.39903 > 112.26.2.1.43445: Flags [.], ack 327013, win 24110, options [nop,nop,TS val 4294910111 ecr 154021,nop,nop,sack 1 {328441:338437},mptcp dss ack 3868087827], length 0
10:18:02.271859 IP 112.26.2.8.39903 > 112.26.2.1.43445: Flags [.], ack 338437, win 23972, options [nop,nop,TS val 4294910221 ecr 155309,mptcp dss ack 3868133523], length 0
10:18:02.375892 IP 112.26.2.8.39903 > 112.26.2.1.43445: Flags [.], ack 339865, win 24455, options [nop,nop,TS val 4294910320 ecr 155309,mptcp dss ack 3868134951], length 0
10:18:02.450926 IP 112.26.2.8.39903 > 112.26.2.1.43445: Flags [.], ack 341293, win 24455, options [nop,nop,TS val 4294910388 ecr 155414,mptcp dss ack 3868134951], length 0
10:18:02.493555 IP 112.26.2.8.39903 > 112.26.2.1.43445: Flags [.], ack 342721, win 24455, options [nop,nop,TS val 4294910491 ecr 155438,mptcp dss ack 3868134951], length 0
10:18:02.580799 IP 112.26.2.1.43445 > 112.26.2.8.39903: Flags [.], seq 345577:347005, ack 1, win 4017, options [nop,nop,TS val 156322 ecr 4294909893,mptcp dss ack 1720219151 seq 3868209207 subseq 345577 len 1428 csum 0xe9f3], length 1428
10:18:02.586251 IP 112.26.2.8.39903 > 112.26.2.1.43445: Flags [.], ack 347005, win 24231, options [nop,nop,TS val 4294911241 ecr 156322,mptcp dss ack 3868160655], length 0
10:18:02.586541 IP 112.26.2.8.39903 > 112.26.2.1.43445: Flags [.], ack 347005, win 24231, options [nop,nop,TS val 4294911241 ecr 156322,mptcp dss ack 3868160655], length 0
10:18:02.675456 IP 112.26.2.8.39903 > 112.26.2.1.43445: Flags [.], ack 344149, win 24455, options [nop,nop,TS val 4294910594 ecr 155484,mptcp dss ack 3868134951], length 0
10:18:02.764437 IP 112.26.2.8.39903 > 112.26.2.1.43445: Flags [.], ack 345577, win 24455, options [nop,nop,TS val 4294910678 ecr 155571,mptcp dss ack 3868134951], length 0
10:18:02.822551 IP 112.26.2.1.43445 > 112.26.2.8.39903: Flags [.], seq 347005:348433, ack 1, win 4017, options [nop,nop,TS val 156553 ecr 4294910006,mptcp dss ack 1720219151 seq 3868222059 subseq 347005 len 1428 csum 0x6d70], length 1428
10:18:02.827188 IP 112.26.2.8.39903 > 112.26.2.1.43445: Flags [.], ack 348433, win 24231, options [nop,nop,TS val 4294911482 ecr 156553,mptcp dss ack 3868160655], length 0
10:18:02.827459 IP 112.26.2.8.39903 > 112.26.2.1.43445: Flags [.], ack 348433, win 24231, options [nop,nop,TS val 4294911482 ecr 156553,mptcp dss ack 3868160655], length 0
10:18:02.938094 IP 112.26.2.1.43445 > 112.26.2.8.39903: Flags [.], seq 348433:349861, ack 1, win 4017, options [nop,nop,TS val 156648 ecr 4294910111,mptcp dss ack 1720219151 seq 3868224915 subseq 348433 len 1428 csum 0x336b], length 1428
10:18:02.949127 IP 112.26.2.8.39903 > 112.26.2.1.43445: Flags [.], ack 349861, win 24231, options [nop,nop,TS val 4294911598 ecr 156648,mptcp dss ack 3868160655], length 0
10:18:02.949408 IP 112.26.2.8.39903 > 112.26.2.1.43445: Flags [.], ack 349861, win 24231, options [nop,nop,TS val 4294911598 ecr 156648,mptcp dss ack 3868160655], length 0
10:18:03.017038 IP 112.26.2.1.43445 > 112.26.2.8.39903: Flags [.], seq 349861:351289, ack 1, win 4017, options [nop,nop,TS val 156648 ecr 4294910221,mptcp dss ack 1720219151 seq 3868226343 subseq 349861 len 1428 csum 0xd803], length 1428
10:18:03.045891 IP 112.26.2.8.39903 > 112.26.2.1.43445: Flags [.], ack 351289, win 24231, options [nop,nop,TS val 4294911701 ecr 156648,mptcp dss ack 3868160655], length 0
10:18:03.046179 IP 112.26.2.8.39903 > 112.26.2.1.43445: Flags [.], ack 351289, win 24231, options [nop,nop,TS val 4294911701 ecr 156648,mptcp dss ack 3868160655], length 0
10:18:03.110153 IP 112.26.2.1.43445 > 112.26.2.8.39903: Flags [.], seq 351289:352717, ack 1, win 4017, options [nop,nop,TS val 156752 ecr 4294910320,mptcp dss ack 1720219151 seq 3868239195 subseq 351289 len 1428 csum 0xf333], length 1428
10:18:03.146447 IP 112.26.2.8.39903 > 112.26.2.1.43445: Flags [.], ack 352717, win 24231, options [nop,nop,TS val 4294911771 ecr 156752,mptcp dss ack 3868160655], length 0
10:18:03.146775 IP 112.26.2.8.39903 > 112.26.2.1.43445: Flags [.], ack 352717, win 24231, options [nop,nop,TS val 4294911771 ecr 156752,mptcp dss ack 3868160655], length 0
10:18:03.218198 IP 112.26.2.1.43445 > 112.26.2.8.39903: Flags [.], seq 352717:354145, ack 1, win 4017, options [nop,nop,TS val 156752 ecr 4294910320,mptcp dss ack 1720219151 seq 3868240623 subseq 352717 len 1428 csum 0x41ff], length 1428
10:18:03.245477 IP 112.26.2.8.39903 > 112.26.2.1.43445: Flags [.], ack 354145, win 24231, options [nop,nop,TS val 4294911880 ecr 156752,mptcp dss ack 3868160655], length 0
10:18:03.245766 IP 112.26.2.8.39903 > 112.26.2.1.43445: Flags [.], ack 354145, win 24231, options [nop,nop,TS val 4294911880 ecr 156752,mptcp dss ack 3868160655], length 0
10:18:03.278269 IP 112.26.2.8.39903 > 112.26.2.1.43445: Flags [.], ack 347005, win 24231, options [nop,nop,TS val 4294911241 ecr 156322,mptcp dss ack 3868160655], length 0
10:18:03.374096 IP 112.26.2.1.43445 > 112.26.2.8.39903: Flags [.], seq 354145:355573, ack 1, win 4017, options [nop,nop,TS val 156827 ecr 4294910388,mptcp dss ack 1720219151 seq 3868243479 subseq 354145 len 1428 csum 0x9fa6], length 1428
10:18:03.381305 IP 112.26.2.8.39903 > 112.26.2.1.43445: Flags [.], ack 355573, win 24231, options [nop,nop,TS val 4294912034 ecr 156827,mptcp dss ack 3868160655], length 0
10:18:03.381534 IP 112.26.2.8.39903 > 112.26.2.1.43445: Flags [.], ack 355573, win 24231, options [nop,nop,TS val 4294912034 ecr 156827,mptcp dss ack 3868160655], length 0
10:18:03.460621 IP 112.26.2.1.43445 > 112.26.2.8.39903: Flags [.], seq 357001:358429, ack 1, win 4017, options [nop,nop,TS val 157051 ecr 4294910594,mptcp dss ack 1720219151 seq 3868257759 subseq 357001 len 1428 csum 0xe044], length 1428
10:18:03.468066 IP 112.26.2.8.39903 > 112.26.2.1.43445: Flags [.], ack 355573, win 24231, options [nop,nop,TS val 4294912122 ecr 156827,nop,nop,sack 1 {357001:358429},mptcp dss ack 3868160655], length 0
10:18:03.468260 IP 112.26.2.8.39903 > 112.26.2.1.43445: Flags [.], ack 355573, win 24231, options [nop,nop,TS val 4294912122 ecr 156827,nop,nop,sack 1 {357001:358429},mptcp dss ack 3868160655], length 0
10:18:03.563080 IP 112.26.2.1.43445 > 112.26.2.8.39903: Flags [.], seq 358429:359857, ack 1, win 4017, options [nop,nop,TS val 157051 ecr 4294910594,mptcp dss ack 1720219151 seq 3868259187 subseq 358429 len 1428 csum 0xf087], length 1428
10:18:03.567114 IP 112.26.2.8.39903 > 112.26.2.1.43445: Flags [.], ack 355573, win 24231, options [nop,nop,TS val 4294912222 ecr 156827,nop,nop,sack 1 {357001:359857},mptcp dss ack 3868160655], length 0
10:18:03.567365 IP 112.26.2.8.39903 > 112.26.2.1.43445: Flags [.], ack 355573, win 24231, options [nop,nop,TS val 4294912222 ecr 156827,nop,nop,sack 1 {357001:359857},mptcp dss ack 3868160655], length 0
10:18:03.634524 IP 112.26.2.8.39903 > 112.26.2.1.43445: Flags [.], ack 348433, win 24231, options [nop,nop,TS val 4294911482 ecr 156553,mptcp dss ack 3868160655], length 0
10:18:03.695780 IP 112.26.2.8.39903 > 112.26.2.1.43445: Flags [.], ack 349861, win 24231, options [nop,nop,TS val 4294911598 ecr 156648,mptcp dss ack 3868160655], length 0
10:18:03.734531 IP 112.26.2.8.39903 > 112.26.2.1.43445: Flags [.], ack 351289, win 24231, options [nop,nop,TS val 4294911701 ecr 156648,mptcp dss ack 3868160655], length 0
10:18:03.777727 IP 112.26.2.8.39903 > 112.26.2.1.43445: Flags [.], ack 352717, win 24231, options [nop,nop,TS val 4294911771 ecr 156752,mptcp dss ack 3868160655], length 0
10:18:03.832113 IP 112.26.2.8.39903 > 112.26.2.1.43445: Flags [.], ack 354145, win 24231, options [nop,nop,TS val 4294911880 ecr 156752,mptcp dss ack 3868160655], length 0
10:18:03.909125 IP 112.26.2.1.43445 > 112.26.2.8.39903: Flags [.], seq 361285:362713, ack 1, win 4017, options [nop,nop,TS val 157654 ecr 4294911241,mptcp dss ack 1720219151 seq 3868286319 subseq 361285 len 1428 csum 0xa3d2], length 1428
10:18:03.927485 IP 112.26.2.8.39903 > 112.26.2.1.43445: Flags [.], ack 355573, win 24231, options [nop,nop,TS val 4294912581 ecr 156827,nop,nop,sack 2 {361285:362713}{357001:359857},mptcp dss ack 3868160655], length 0
10:18:03.927807 IP 112.26.2.8.39903 > 112.26.2.1.43445: Flags [.], ack 355573, win 24231, options [nop,nop,TS val 4294912581 ecr 156827,nop,nop,sack 2 {361285:362713}{357001:359857},mptcp dss ack 3868160655], length 0
10:18:04.014756 IP 112.26.2.8.39903 > 112.26.2.1.43445: Flags [.], ack 355573, win 24231, options [nop,nop,TS val 4294912034 ecr 156827,mptcp dss ack 3868160655], length 0
10:18:04.069690 IP 112.26.2.8.39903 > 112.26.2.1.43445: Flags [.], ack 355573, win 24231, options [nop,nop,TS val 4294912122 ecr 156827,nop,nop,sack 1 {357001:358429},mptcp dss ack 3868160655], length 0
10:18:04.170762 IP 112.26.2.8.39903 > 112.26.2.1.43445: Flags [.], ack 355573, win 24231, options [nop,nop,TS val 4294912222 ecr 156827,nop,nop,sack 1 {357001:359857},mptcp dss ack 3868160655], length 0
10:18:04.206419 IP 112.26.2.1.43445 > 112.26.2.8.39903: Flags [.], seq 362713:364141, ack 1, win 4017, options [nop,nop,TS val 158010 ecr 4294911482,mptcp dss ack 1720219151 seq 3868292031 subseq 362713 len 1428 csum 0xe8a8], length 1428
10:18:04.212687 IP 112.26.2.8.39903 > 112.26.2.1.43445: Flags [.], ack 355573, win 24231, options [nop,nop,TS val 4294912865 ecr 156827,nop,nop,sack 2 {361285:364141}{357001:359857},mptcp dss ack 3868160655], length 0
10:18:04.213159 IP 112.26.2.8.39903 > 112.26.2.1.43445: Flags [.], ack 355573, win 24231, options [nop,nop,TS val 4294912865 ecr 156827,nop,nop,sack 2 {361285:364141}{357001:359857},mptcp dss ack 3868160655], length 0
10:18:04.319191 IP 112.26.2.1.43445 > 112.26.2.8.39903: Flags [.], seq 364141:365569, ack 1, win 4017, options [nop,nop,TS val 158071 ecr 4294911598,mptcp dss ack 1720219151 seq 3868294887 subseq 364141 len 1428 csum 0x1147], length 1428
10:18:04.325335 IP 112.26.2.8.39903 > 112.26.2.1.43445: Flags [.], ack 355573, win 24231, options [nop,nop,TS val 4294912979 ecr 156827,nop,nop,sack 2 {361285:365569}{357001:359857},mptcp dss ack 3868160655], length 0
10:18:04.325621 IP 112.26.2.8.39903 > 112.26.2.1.43445: Flags [.], ack 355573, win 24231, options [nop,nop,TS val 4294912979 ecr 156827,nop,nop,sack 2 {361285:365569}{357001:359857},mptcp dss ack 3868160655], length 0
10:18:04.412163 IP 112.26.2.1.43445 > 112.26.2.8.39903: Flags [.], seq 365569:366997, ack 1, win 4017, options [nop,nop,TS val 158110 ecr 4294911701,mptcp dss ack 1720219151 seq 3868302027 subseq 365569 len 1428 csum 0x5f16], length 1428
10:18:04.433267 IP 112.26.2.8.39903 > 112.26.2.1.43445: Flags [.], ack 355573, win 24231, options [nop,nop,TS val 4294913088 ecr 156827,nop,nop,sack 2 {361285:366997}{357001:359857},mptcp dss ack 3868160655], length 0
10:18:04.433605 IP 112.26.2.8.39903 > 112.26.2.1.43445: Flags [.], ack 355573, win 24231, options [nop,nop,TS val 4294913088 ecr 156827,nop,nop,sack 2 {361285:366997}{357001:359857},mptcp dss ack 3868160655], length 0
10:18:04.502240 IP 112.26.2.1.43445 > 112.26.2.8.39903: Flags [.], seq 366997:368425, ack 1, win 4017, options [nop,nop,TS val 158110 ecr 4294911701,mptcp dss ack 1720219151 seq 3868303455 subseq 366997 len 1428 csum 0x4a7a], length 1428
10:18:04.512864 IP 112.26.2.8.39903 > 112.26.2.1.43445: Flags [.], ack 355573, win 24231, options [nop,nop,TS val 4294913168 ecr 156827,nop,nop,sack 2 {361285:368425}{357001:359857},mptcp dss ack 3868160655], length 0
10:18:04.513151 IP 112.26.2.8.39903 > 112.26.2.1.43445: Flags [.], ack 355573, win 24231, options [nop,nop,TS val 4294913168 ecr 156827,nop,nop,sack 2 {361285:368425}{357001:359857},mptcp dss ack 3868160655], length 0
10:18:04.580461 IP 112.26.2.8.39903 > 112.26.2.1.43445: Flags [.], ack 355573, win 24231, options [nop,nop,TS val 4294912581 ecr 156827,nop,nop,sack 2 {361285:362713}{357001:359857},mptcp dss ack 3868160655], length 0
10:18:04.614336 IP 112.26.2.1.43445 > 112.26.2.8.39903: Flags [.], seq 368425:369853, ack 1, win 4017, options [nop,nop,TS val 158153 ecr 4294911771,mptcp dss ack 1720219151 seq 3868306311 subseq 368425 len 1428 csum 0x3734], length 1428
10:18:04.617786 IP 112.26.2.8.39903 > 112.26.2.1.43445: Flags [.], ack 355573, win 24231, options [nop,nop,TS val 4294913273 ecr 156827,nop,nop,sack 2 {361285:369853}{357001:359857},mptcp dss ack 3868160655], length 0
10:18:04.618085 IP 112.26.2.8.39903 > 112.26.2.1.43445: Flags [.], ack 355573, win 24231, options [nop,nop,TS val 4294913273 ecr 156827,nop,nop,sack 2 {361285:369853}{357001:359857},mptcp dss ack 3868160655], length 0
10:18:04.726203 IP 112.26.2.1.43445 > 112.26.2.8.39903: Flags [.], seq 369853:371281, ack 1, win 4017, options [nop,nop,TS val 158208 ecr 4294911880,mptcp dss ack 1720219151 seq 3868307739 subseq 369853 len 1428 csum 0xe232], length 1428
10:18:04.730601 IP 112.26.2.8.39903 > 112.26.2.1.43445: Flags [.], ack 355573, win 24231, options [nop,nop,TS val 4294913385 ecr 156827,nop,nop,sack 2 {361285:371281}{357001:359857},mptcp dss ack 3868160655], length 0
10:18:04.730874 IP 112.26.2.8.39903 > 112.26.2.1.43445: Flags [.], ack 355573, win 24231, options [nop,nop,TS val 4294913385 ecr 156827,nop,nop,sack 2 {361285:371281}{357001:359857},mptcp dss ack 3868160655], length 0
10:18:04.777859 IP 112.26.2.1.43445 > 112.26.2.8.39903: Flags [.], seq 371281:372709, ack 1, win 4017, options [nop,nop,TS val 158390 ecr 4294912034,mptcp dss ack 1720219151 seq 3868310595 subseq 371281 len 1428 csum 0x1c57], length 1428
10:18:04.805199 IP 112.26.2.8.39903 > 112.26.2.1.43445: Flags [.], ack 355573, win 24231, options [nop,nop,TS val 4294913446 ecr 156827,nop,nop,sack 2 {361285:372709}{357001:359857},mptcp dss ack 3868160655], length 0
10:18:04.805476 IP 112.26.2.8.39903 > 112.26.2.1.43445: Flags [.], ack 355573, win 24231, options [nop,nop,TS val 4294913446 ecr 156827,nop,nop,sack 2 {361285:372709}{357001:359857},mptcp dss ack 3868160655], length 0
10:18:04.882620 IP 112.26.2.8.39903 > 112.26.2.1.43445: Flags [.], ack 355573, win 24231, options [nop,nop,TS val 4294912865 ecr 156827,nop,nop,sack 2 {361285:364141}{357001:359857},mptcp dss ack 3868160655], length 0
10:18:04.951679 IP 112.26.2.1.43445 > 112.26.2.8.39903: Flags [.], seq 374137:375565, ack 1, win 4017, options [nop,nop,TS val 158619 ecr 4294912222,mptcp dss ack 1720219151 seq 3868330587 subseq 374137 len 1428 csum 0x1187], length 1428
10:18:04.958965 IP 112.26.2.8.39903 > 112.26.2.1.43445: Flags [.], ack 355573, win 24209, options [nop,nop,TS val 4294913611 ecr 156827,nop,nop,sack 2 {374137:375565}{361285:372709},mptcp dss ack 3868162083], length 0
10:18:04.959291 IP 112.26.2.8.39903 > 112.26.2.1.43445: Flags [.], ack 355573, win 24209, options [nop,nop,TS val 4294913611 ecr 156827,nop,nop,sack 2 {374137:375565}{361285:372709},mptcp dss ack 3868162083], length 0
10:18:05.020998 IP 112.26.2.8.39903 > 112.26.2.1.43445: Flags [.], ack 355573, win 24231, options [nop,nop,TS val 4294912979 ecr 156827,nop,nop,sack 2 {361285:365569}{357001:359857},mptcp dss ack 3868160655], length 0
10:18:05.089697 IP 112.26.2.8.39903 > 112.26.2.1.43445: Flags [.], ack 355573, win 24231, options [nop,nop,TS val 4294913088 ecr 156827,nop,nop,sack 2 {361285:366997}{357001:359857},mptcp dss ack 3868160655], length 0
10:18:05.142480 IP 112.26.2.1.43445 > 112.26.2.8.39903: Flags [.], seq 355573:357001, ack 1, win 4017, options [nop,nop,TS val 158840 ecr 4294912222,mptcp dss ack 1720219151 seq 3868244907 subseq 355573 len 1428 csum 0x9370], length 1428
10:18:05.146832 IP 112.26.2.8.39903 > 112.26.2.1.43445: Flags [.], ack 359857, win 24209, options [nop,nop,TS val 4294913802 ecr 158840,nop,nop,sack 2 {374137:375565}{361285:372709},mptcp dss ack 3868162083], length 0
10:18:05.147101 IP 112.26.2.8.39903 > 112.26.2.1.43445: Flags [.], ack 359857, win 24209, options [nop,nop,TS val 4294913802 ecr 158840,nop,nop,sack 2 {374137:375565}{361285:372709},mptcp dss ack 3868162083], length 0
10:18:05.213407 IP 112.26.2.8.39903 > 112.26.2.1.43445: Flags [.], ack 355573, win 24231, options [nop,nop,TS val 4294913168 ecr 156827,nop,nop,sack 2 {361285:368425}{357001:359857},mptcp dss ack 3868160655], length 0
10:18:05.268076 IP 112.26.2.1.43445 > 112.26.2.8.39903: Flags [.], seq 359857:361285, ack 1, win 4017, options [nop,nop,TS val 158956 ecr 4294912581,mptcp dss ack 1720219151 seq 3868263471 subseq 359857 len 1428 csum 0x1126], length 1428
10:18:05.273184 IP 112.26.2.8.39903 > 112.26.2.1.43445: Flags [.], ack 372709, win 24209, options [nop,nop,TS val 4294913927 ecr 158956,nop,nop,sack 1 {374137:375565},mptcp dss ack 3868162083], length 0
10:18:05.273482 IP 112.26.2.8.39903 > 112.26.2.1.43445: Flags [.], ack 372709, win 24209, options [nop,nop,TS val 4294913927 ecr 158956,nop,nop,sack 1 {374137:375565},mptcp dss ack 3868162083], length 0
10:18:05.342468 IP 112.26.2.8.39903 > 112.26.2.1.43445: Flags [.], ack 355573, win 24231, options [nop,nop,TS val 4294913385 ecr 156827,nop,nop,sack 2 {361285:371281}{357001:359857},mptcp dss ack 3868160655], length 0
10:18:05.406274 IP 112.26.2.8.39903 > 112.26.2.1.43445: Flags [.], ack 355573, win 24231, options [nop,nop,TS val 4294913446 ecr 156827,nop,nop,sack 2 {361285:372709}{357001:359857},mptcp dss ack 3868160655], length 0
10:18:05.502360 IP 112.26.2.1.43445 > 112.26.2.8.39903: Flags [.], seq 375565:376993, ack 1, win 4017, options [nop,nop,TS val 159287 ecr 4294912865,mptcp dss ack 1720219151 seq 3868343439 subseq 375565 len 1428 csum 0xc7c0], length 1428
10:18:05.559697 IP 112.26.2.8.39903 > 112.26.2.1.43445: Flags [.], ack 372709, win 24209, options [nop,nop,TS val 4294914215 ecr 158956,nop,nop,sack 1 {374137:376993},mptcp dss ack 3868162083], length 0
10:18:05.559908 IP 112.26.2.8.39903 > 112.26.2.1.43445: Flags [.], ack 372709, win 24209, options [nop,nop,TS val 4294914215 ecr 158956,nop,nop,sack 1 {374137:376993},mptcp dss ack 3868162083], length 0
10:18:05.574392 IP 112.26.2.8.39903 > 112.26.2.1.43445: Flags [.], ack 355573, win 24209, options [nop,nop,TS val 4294913611 ecr 156827,nop,nop,sack 2 {374137:375565}{361285:372709},mptcp dss ack 3868162083], length 0
