10:17:23.888225 IP 112.26.1.8.46387 > 112.26.1.1.43445: Flags [S], seq 3182393828, win 65535, options [mss 1460,sackOK,TS val 4294872454 ecr 0,nop,wscale 6,mptcp join id 3 token 0x1271d1f5 nonce 0xab278870], length 0
10:17:23.957587 IP 112.26.1.8.46387 > 112.26.1.1.43445: Flags [S], seq 3182393828, win 65535, options [mss 1460,sackOK,TS val 4294872454 ecr 0,nop,wscale 6,mptcp join id 3 token 0x1271d1f5 nonce 0xab278870], length 0
10:17:24.190620 IP 112.26.1.1.43445 > 112.26.1.8.46387: Flags [S.], seq 600515713, ack 3182393829, win 65535, options [mss 1460,sackOK,TS val 118409 ecr 4294872454,nop,wscale 6,mptcp join id 3 hmac 0x5c100e5fd49aba7d nonce 0x69eaa99a], length 0
10:17:24.190835 IP 112.26.1.8.46387 > 112.26.1.1.43445: Flags [.], ack 1, win 7848, options [nop,nop,TS val 4294872847 ecr 118409,mptcp join hmac 0x8ee39ac72f51bb5ae0b3cb1d1a8f01338aaca337], length 0
10:17:24.292920 IP 112.26.1.8.46387 > 112.26.1.1.43445: Flags [.], ack 1, win 7848, options [nop,nop,TS val 4294872847 ecr 118409,mptcp join hmac 0x8ee39ac72f51bb5ae0b3cb1d1a8f01338aaca337], length 0
10:17:24.381482 IP 112.26.1.1.43445 > 112.26.1.8.46387: Flags [.], ack 1, win 4017, options [nop,nop,TS val 118670 ecr 4294872847,mptcp dss ack 1720219151], length 0
10:17:24.452782 IP 112.26.1.1.43445 > 112.26.1.8.46387: Flags [.], seq 1:1429, ack 1, win 4017, options [nop,nop,TS val 118685 ecr 4294872847,mptcp dss ack 1720219151 seq 3866554155 subseq 1 len 1428 csum 0x3f5a], length 1428
10:18:04.719906 IP 112.26.1.1.43445 > 112.26.1.8.46387: Flags [.], seq 438397:439825, ack 1, win 4017, options [nop,nop,TS val 157584 ecr 4294911268,mptcp dss ack 1720219151 seq 3868282035 subseq 438397 len 1428 csum 0x4052], length 1428
10:18:04.720147 IP 112.26.1.8.46387 > 112.26.1.1.43445: Flags [.], ack 405553, win 24231, options [nop,nop,TS val 4294913376 ecr 155172,nop,nop,sack 2 {438397:439825}{434113:436969},mptcp dss ack 3868160655], length 0
10:18:04.774781 IP 112.26.1.1.43445 > 112.26.1.8.46387: Flags [.], seq 439825:441253, ack 1, win 4017, options [nop,nop,TS val 157584 ecr 4294911268,mptcp dss ack 1720219151 seq 3868283463 subseq 439825 len 1428 csum 0x8405], length 1428
10:18:04.775063 IP 112.26.1.8.46387 > 112.26.1.1.43445: Flags [.], ack 405553, win 24231, options [nop,nop,TS val 4294913431 ecr 155172,nop,nop,sack 2 {438397:441253}{434113:436969},mptcp dss ack 3868160655], length 0
10:18:04.851895 IP 112.26.1.1.43445 > 112.26.1.8.46387: Flags [.], seq 405553:406981, ack 1, win 4017, options [nop,nop,TS val 157807 ecr 4294911360,mptcp dss ack 1720219151 seq 3868160655 subseq 405553 len 1428 csum 0xa594], length 1428
10:18:04.852184 IP 112.26.1.8.46387 > 112.26.1.1.43445: Flags [.], ack 406981, win 24209, options [nop,nop,TS val 4294913508 ecr 157807,nop,nop,sack 2 {438397:441253}{434113:436969},mptcp dss ack 3868162083], length 0
10:18:04.909026 IP 112.26.1.8.46387 > 112.26.1.1.43445: Flags [.], ack 405553, win 24231, options [nop,nop,TS val 4294912828 ecr 155172,nop,nop,sack 2 {428401:431257}{421261:425545},mptcp dss ack 3868160655], length 0
10:18:05.025268 IP 112.26.1.8.46387 > 112.26.1.1.43445: Flags [.], ack 405553, win 24231, options [nop,nop,TS val 4294912928 ecr 155172,nop,nop,sack 2 {428401:432685}{421261:425545},mptcp dss ack 3868160655], length 0
10:18:05.076348 IP 112.26.1.1.43445 > 112.26.1.8.46387: Flags [.], seq 412693:414121, ack 1, win 4017, options [nop,nop,TS val 158218 ecr 4294911740,mptcp dss ack 1720219151 seq 3868179219 subseq 412693 len 1428 csum 0x34df], length 1428
10:18:05.076610 IP 112.26.1.8.46387 > 112.26.1.1.43445: Flags [.], ack 406981, win 24209, options [nop,nop,TS val 4294913733 ecr 157807,nop,nop,sack 2 {412693:414121}{438397:441253},mptcp dss ack 3868162083], length 0
10:18:05.191172 IP 112.26.1.1.43445 > 112.26.1.8.46387: Flags [.], seq 441253:442681, ack 1, win 4017, options [nop,nop,TS val 158445 ecr 4294911979,mptcp dss ack 1720219151 seq 3868313451 subseq 441253 len 1428 csum 0x710b], length 1428
10:18:05.191429 IP 112.26.1.8.46387 > 112.26.1.1.43445: Flags [.], ack 406981, win 24209, options [nop,nop,TS val 4294913848 ecr 157807,nop,nop,sack 2 {438397:442681}{412693:414121},mptcp dss ack 3868162083], length 0
10:18:05.259827 IP 112.26.1.1.43445 > 112.26.1.8.46387: Flags [.], seq 419833:421261, ack 1, win 4017, options [nop,nop,TS val 158697 ecr 4294912301,mptcp dss ack 1720219151 seq 3868199211 subseq 419833 len 1428 csum 0xc253], length 1428
10:18:05.260109 IP 112.26.1.8.46387 > 112.26.1.1.43445: Flags [.], ack 406981, win 24209, options [nop,nop,TS val 4294913916 ecr 157807,nop,nop,sack 2 {419833:421261}{438397:442681},mptcp dss ack 3868162083], length 0
10:18:05.314174 IP 112.26.1.1.43445 > 112.26.1.8.46387: Flags [.], seq 442681:444109, ack 1, win 4017, options [nop,nop,TS val 158840 ecr 4294912407,mptcp dss ack 1720219151 seq 3868244907 subseq 442681 len 1428 csum 0x3f2b], length 1428
10:18:05.314469 IP 112.26.1.8.46387 > 112.26.1.1.43445: Flags [.], ack 406981, win 24209, options [nop,nop,TS val 4294913971 ecr 157807,nop,nop,sack 2 {438397:444109}{419833:421261},mptcp dss ack 3868162083], length 0
10:18:05.375348 IP 112.26.1.8.46387 > 112.26.1.1.43445: Flags [.], ack 405553, win 24231, options [nop,nop,TS val 4294913376 ecr 155172,nop,nop,sack 2 {438397:439825}{434113:436969},mptcp dss ack 3868160655], length 0
10:18:05.452905 IP 112.26.1.8.46387 > 112.26.1.1.43445: Flags [.], ack 406981, win 24209, options [nop,nop,TS val 4294913508 ecr 157807,nop,nop,sack 2 {438397:441253}{434113:436969},mptcp dss ack 3868162083], length 0
10:18:05.538191 IP 112.26.1.1.43445 > 112.26.1.8.46387: Flags [.], seq 425545:426973, ack 1, win 4017, options [nop,nop,TS val 159287 ecr 4294912828,mptcp dss ack 1720219151 seq 3868227771 subseq 425545 len 1428 csum 0xf9b4], length 1428
10:18:05.538445 IP 112.26.1.8.46387 > 112.26.1.1.43445: Flags [.], ack 406981, win 24209, options [nop,nop,TS val 4294914195 ecr 157807,nop,nop,sack 2 {425545:426973}{438397:444109},mptcp dss ack 3868162083], length 0
10:18:05.613889 IP 112.26.1.1.43445 > 112.26.1.8.46387: Flags [.], seq 426973:428401, ack 1, win 4017, options [nop,nop,TS val 159287 ecr 4294912828,mptcp dss ack 1720219151 seq 3868229199 subseq 426973 len 1428 csum 0xccbc], length 1428
10:18:05.614120 IP 112.26.1.8.46387 > 112.26.1.1.43445: Flags [.], ack 406981, win 24209, options [nop,nop,TS val 4294914270 ecr 157807,nop,nop,sack 2 {425545:428401}{438397:444109},mptcp dss ack 3868162083], length 0
10:18:05.665611 IP 112.26.1.8.46387 > 112.26.1.1.43445: Flags [.], ack 406981, win 24209, options [nop,nop,TS val 4294913733 ecr 157807,nop,nop,sack 2 {412693:414121}{438397:441253},mptcp dss ack 3868162083], length 0
10:18:05.757998 IP 112.26.1.1.43445 > 112.26.1.8.46387: Flags [.], seq 444109:445537, ack 1, win 4017, options [nop,nop,TS val 159410 ecr 4294912928,mptcp dss ack 1720219151 seq 3868344867 subseq 444109 len 1428 csum 0x9ed4], length 1428
10:18:05.758278 IP 112.26.1.8.46387 > 112.26.1.1.43445: Flags [.], ack 406981, win 24209, options [nop,nop,TS val 4294914414 ecr 157807,nop,nop,sack 2 {438397:445537}{425545:428401},mptcp dss ack 3868162083], length 0
10:18:05.829693 IP 112.26.1.8.46387 > 112.26.1.1.43445: Flags [.], ack 406981, win 24209, options [nop,nop,TS val 4294913848 ecr 157807,nop,nop,sack 2 {438397:442681}{412693:414121},mptcp dss ack 3868162083], length 0
10:18:05.862680 IP 112.26.1.8.46387 > 112.26.1.1.43445: Flags [.], ack 406981, win 24209, options [nop,nop,TS val 4294913916 ecr 157807,nop,nop,sack 2 {419833:421261}{438397:442681},mptcp dss ack 3868162083], length 0
10:18:05.941045 IP 112.26.1.8.46387 > 112.26.1.1.43445: Flags [.], ack 406981, win 24209, options [nop,nop,TS val 4294913971 ecr 157807,nop,nop,sack 2 {438397:444109}{419833:421261},mptcp dss ack 3868162083], length 0
10:18:06.018490 IP 112.26.1.1.43445 > 112.26.1.8.46387: Flags [.], seq 432685:434113, ack 1, win 4017, options [nop,nop,TS val 159754 ecr 4294913376,mptcp dss ack 1720219151 seq 3868249191 subseq 432685 len 1428 csum 0x5aec], length 1428
10:18:06.018785 IP 112.26.1.8.46387 > 112.26.1.1.43445: Flags [.], ack 406981, win 24209, options [nop,nop,TS val 4294914675 ecr 157807,nop,nop,sack 2 {432685:434113}{438397:445537},mptcp dss ack 3868162083], length 0
10:18:06.068314 IP 112.26.1.1.43445 > 112.26.1.8.46387: Flags [.], seq 436969:438397, ack 1, win 4017, options [nop,nop,TS val 159754 ecr 4294913376,mptcp dss ack 1720219151 seq 3868270611 subseq 436969 len 1428 csum 0xf6c7], length 1428
10:18:06.068594 IP 112.26.1.8.46387 > 112.26.1.1.43445: Flags [.], ack 406981, win 24209, options [nop,nop,TS val 4294914725 ecr 157807,nop,nop,sack 2 {436969:445537}{432685:434113},mptcp dss ack 3868162083], length 0
10:18:06.112957 IP 112.26.1.8.46387 > 112.26.1.1.43445: Flags [.], ack 406981, win 24209, options [nop,nop,TS val 4294914195 ecr 157807,nop,nop,sack 2 {425545:426973}{438397:444109},mptcp dss ack 3868162083], length 0
10:18:06.181603 IP 112.26.1.1.43445 > 112.26.1.8.46387: Flags [.], seq 445537:446965, ack 1, win 4017, options [nop,nop,TS val 159782 ecr 4294913376,mptcp dss ack 1720219151 seq 3868362003 subseq 445537 len 1428 csum 0x97b1], length 1428
10:18:06.181847 IP 112.26.1.8.46387 > 112.26.1.1.43445: Flags [.], ack 406981, win 24209, options [nop,nop,TS val 4294914838 ecr 157807,nop,nop,sack 2 {436969:446965}{432685:434113},mptcp dss ack 3868162083], length 0
10:18:06.273248 IP 112.26.1.8.46387 > 112.26.1.1.43445: Flags [.], ack 406981, win 24209, options [nop,nop,TS val 4294914270 ecr 157807,nop,nop,sack 2 {425545:428401}{438397:444109},mptcp dss ack 3868162083], length 0
10:18:06.378025 IP 112.26.1.1.43445 > 112.26.1.8.46387: Flags [.], seq 446965:448393, ack 1, win 4017, options [nop,nop,TS val 159831 ecr 4294913508,mptcp dss ack 1720219151 seq 3868370571 subseq 446965 len 1428 csum 0xa19c], length 1428
10:18:06.378298 IP 112.26.1.8.46387 > 112.26.1.1.43445: Flags [.], ack 406981, win 24209, options [nop,nop,TS val 4294915034 ecr 157807,nop,nop,sack 2 {436969:448393}{432685:434113},mptcp dss ack 3868162083], length 0
10:18:06.474399 IP 112.26.1.8.46387 > 112.26.1.1.43445: Flags [.], ack 406981, win 24209, options [nop,nop,TS val 4294914414 ecr 157807,nop,nop,sack 2 {438397:445537}{425545:428401},mptcp dss ack 3868162083], length 0
10:18:06.539345 IP 112.26.1.1.43445 > 112.26.1.8.46387: Flags [.], seq 448393:449821, ack 1, win 4017, options [nop,nop,TS val 159831 ecr 4294913508,mptcp dss ack 1720219151 seq 3868371999 subseq 448393 len 1428 csum 0xcfc6], length 1428
10:18:06.539629 IP 112.26.1.8.46387 > 112.26.1.1.43445: Flags [.], ack 406981, win 24209, options [nop,nop,TS val 4294915196 ecr 157807,nop,nop,sack 2 {436969:449821}{432685:434113},mptcp dss ack 3868162083], length 0
10:18:06.645653 IP 112.26.1.1.43445 > 112.26.1.8.46387: Flags [.], seq 449821:451249, ack 1, win 4017, options [nop,nop,TS val 159831 ecr 4294913508,mptcp dss ack 1720219151 seq 3868373427 subseq 449821 len 1428 csum 0x7fdb], length 1428
10:18:06.645921 IP 112.26.1.8.46387 > 112.26.1.1.43445: Flags [.], ack 406981, win 24209, options [nop,nop,TS val 4294915302 ecr 157807,nop,nop,sack 2 {436969:451249}{432685:434113},mptcp dss ack 3868162083], length 0
10:18:06.742998 IP 112.26.1.1.43445 > 112.26.1.8.46387: Flags [.], seq 451249:452677, ack 1, win 4017, options [nop,nop,TS val 159831 ecr 4294913508,mptcp dss ack 1720219151 seq 3868374855 subseq 451249 len 1428 csum 0x2671], length 1428
10:18:06.743304 IP 112.26.1.8.46387 > 112.26.1.1.43445: Flags [.], ack 406981, win 24209, options [nop,nop,TS val 4294915399 ecr 157807,nop,nop,sack 2 {436969:452677}{432685:434113},mptcp dss ack 3868162083], length 0
10:18:06.796920 IP 112.26.1.8.46387 > 112.26.1.1.43445: Flags [.], ack 406981, win 24209, options [nop,nop,TS val 4294914675 ecr 157807,nop,nop,sack 2 {432685:434113}{438397:445537},mptcp dss ack 3868162083], length 0
10:18:06.896548 IP 112.26.1.8.46387 > 112.26.1.1.43445: Flags [.], ack 406981, win 24209, options [nop,nop,TS val 4294914725 ecr 157807,nop,nop,sack 2 {436969:445537}{432685:434113},mptcp dss ack 3868162083], length 0
10:18:06.962024 IP 112.26.1.8.46387 > 112.26.1.1.43445: Flags [.], ack 406981, win 24209, options [nop,nop,TS val 4294914838 ecr 157807,nop,nop,sack 2 {436969:446965}{432685:434113},mptcp dss ack 3868162083], length 0
10:18:07.063399 IP 112.26.1.1.43445 > 112.26.1.8.46387: Flags [.], seq 454105:455533, ack 1, win 4017, options [nop,nop,TS val 160297 ecr 4294913848,mptcp dss ack 1720219151 seq 3868394847 subseq 454105 len 1428 csum 0x79a7], length 1428
10:18:07.063680 IP 112.26.1.8.46387 > 112.26.1.1.43445: Flags [.], ack 406981, win 24209, options [nop,nop,TS val 4294915720 ecr 157807,nop,nop,sack 2 {454105:455533}{436969:452677},mptcp dss ack 3868162083], length 0
10:18:07.155520 IP 112.26.1.1.43445 > 112.26.1.8.46387: Flags [.], seq 455533:456961, ack 1, win 4017, options [nop,nop,TS val 160374 ecr 4294913916,mptcp dss ack 1720219151 seq 3868396275 subseq 455533 len 1428 csum 0x4f6a], length 1428
10:18:07.155807 IP 112.26.1.8.46387 > 112.26.1.1.43445: Flags [.], ack 406981, win 24209, options [nop,nop,TS val 4294915812 ecr 157807,nop,nop,sack 2 {454105:456961}{436969:452677},mptcp dss ack 3868162083], length 0
10:18:07.220007 IP 112.26.1.1.43445 > 112.26.1.8.46387: Flags [.], seq 456961:458389, ack 1, win 4017, options [nop,nop,TS val 160416 ecr 4294913971,mptcp dss ack 1720219151 seq 3868410555 subseq 456961 len 1428 csum 0x90a9], length 1428
10:18:07.220293 IP 112.26.1.8.46387 > 112.26.1.1.43445: Flags [.], ack 406981, win 24209, options [nop,nop,TS val 4294915876 ecr 157807,nop,nop,sack 2 {454105:458389}{436969:452677},mptcp dss ack 3868162083], length 0
10:18:07.281258 IP 112.26.1.8.46387 > 112.26.1.1.43445: Flags [.], ack 406981, win 24209, options [nop,nop,TS val 4294915196 ecr 157807,nop,nop,sack 2 {436969:449821}{432685:434113},mptcp dss ack 3868162083], length 0
10:18:07.362991 IP 112.26.1.1.43445 > 112.26.1.8.46387: Flags [.], seq 458389:459817, ack 1, win 4017, options [nop,nop,TS val 160525 ecr 4294914195,mptcp dss ack 1720219151 seq 3868413411 subseq 458389 len 1428 csum 0x9483], length 1428
10:18:07.363232 IP 112.26.1.8.46387 > 112.26.1.1.43445: Flags [.], ack 406981, win 24209, options [nop,nop,TS val 4294916019 ecr 157807,nop,nop,sack 2 {454105:459817}{436969:452677},mptcp dss ack 3868162083], length 0
10:18:07.455865 IP 112.26.1.1.43445 > 112.26.1.8.46387: Flags [.], seq 459817:461245, ack 1, win 4017, options [nop,nop,TS val 160689 ecr 4294914270,mptcp dss ack 1720219151 seq 3868417695 subseq 459817 len 1428 csum 0xd48a], length 1428
10:18:07.456133 IP 112.26.1.8.46387 > 112.26.1.1.43445: Flags [.], ack 406981, win 24209, options [nop,nop,TS val 4294916112 ecr 157807,nop,nop,sack 2 {454105:461245}{436969:452677},mptcp dss ack 3868162083], length 0
10:18:07.567864 IP 112.26.1.1.43445 > 112.26.1.8.46387: Flags [.], seq 461245:462673, ack 1, win 4017, options [nop,nop,TS val 160895 ecr 4294914414,mptcp dss ack 1720219151 seq 3868424835 subseq 461245 len 1428 csum 0xf894], length 1428
10:18:07.568110 IP 112.26.1.8.46387 > 112.26.1.1.43445: Flags [.], ack 406981, win 24209, options [nop,nop,TS val 4294916224 ecr 157807,nop,nop,sack 2 {454105:462673}{436969:452677},mptcp dss ack 3868162083], length 0
10:18:07.637893 IP 112.26.1.1.43445 > 112.26.1.8.46387: Flags [.], seq 462673:464101, ack 1, win 4017, options [nop,nop,TS val 161196 ecr 4294914675,mptcp dss ack 1720219151 seq 3868434831 subseq 462673 len 1428 csum 0x8fa3], length 1428
10:18:07.638136 IP 112.26.1.8.46387 > 112.26.1.1.43445: Flags [.], ack 406981, win 24209, options [nop,nop,TS val 4294916294 ecr 157807,nop,nop,sack 2 {454105:464101}{436969:452677},mptcp dss ack 3868162083], length 0
10:18:07.744343 IP 112.26.1.1.43445 > 112.26.1.8.46387: Flags [.], seq 464101:465529, ack 1, win 4017, options [nop,nop,TS val 161295 ecr 4294914725,mptcp dss ack 1720219151 seq 3868439115 subseq 464101 len 1428 csum 0x8896], length 1428
10:18:07.744567 IP 112.26.1.8.46387 > 112.26.1.1.43445: Flags [.], ack 406981, win 24209, options [nop,nop,TS val 4294916401 ecr 157807,nop,nop,sack 2 {454105:465529}{436969:452677},mptcp dss ack 3868162083], length 0
10:18:07.821663 IP 112.26.1.8.46387 > 112.26.1.1.43445: Flags [.], ack 406981, win 24209, options [nop,nop,TS val 4294915720 ecr 157807,nop,nop,sack 2 {454105:455533}{436969:452677},mptcp dss ack 3868162083], length 0
10:18:07.934339 IP 112.26.1.8.46387 > 112.26.1.1.43445: Flags [.], ack 406981, win 24209, options [nop,nop,TS val 4294915812 ecr 157807,nop,nop,sack 2 {454105:456961}{436969:452677},mptcp dss ack 3868162083], length 0
10:18:07.992744 IP 112.26.1.8.46387 > 112.26.1.1.43445: Flags [.], ack 406981, win 24209, options [nop,nop,TS val 4294915876 ecr 157807,nop,nop,sack 2 {454105:458389}{436969:452677},mptcp dss ack 3868162083], length 0
10:18:08.050851 IP 112.26.1.8.46387 > 112.26.1.1.43445: Flags [.], ack 406981, win 24209, options [nop,nop,TS val 4294916019 ecr 157807,nop,nop,sack 2 {454105:459817}{436969:452677},mptcp dss ack 3868162083], length 0
10:18:08.114193 IP 112.26.1.1.43445 > 112.26.1.8.46387: Flags [.], seq 466957:468385, ack 1, win 4017, options [nop,nop,TS val 161770 ecr 4294915196,mptcp dss ack 1720219151 seq 3868464819 subseq 466957 len 1428 csum 0xd0f5], length 1428
10:18:08.114409 IP 112.26.1.8.46387 > 112.26.1.1.43445: Flags [.], ack 406981, win 24209, options [nop,nop,TS val 4294916770 ecr 157807,nop,nop,sack 2 {466957:468385}{454105:465529},mptcp dss ack 3868162083], length 0
10:18:08.223616 IP 112.26.1.8.46387 > 112.26.1.1.43445: Flags [.], ack 406981, win 24209, options [nop,nop,TS val 4294916112 ecr 157807,nop,nop,sack 2 {454105:461245}{436969:452677},mptcp dss ack 3868162083], length 0
10:18:08.311745 IP 112.26.1.1.43445 > 112.26.1.8.46387: Flags [.], seq 468385:469813, ack 1, win 4017, options [nop,nop,TS val 161770 ecr 4294915196,mptcp dss ack 1720219151 seq 3868466247 subseq 468385 len 1428 csum 0x157a], length 1428
10:18:08.312108 IP 112.26.1.8.46387 > 112.26.1.1.43445: Flags [.], ack 406981, win 24209, options [nop,nop,TS val 4294916968 ecr 157807,nop,nop,sack 2 {466957:469813}{454105:465529},mptcp dss ack 3868162083], length 0
10:18:08.382429 IP 112.26.1.8.46387 > 112.26.1.1.43445: Flags [.], ack 406981, win 24209, options [nop,nop,TS val 4294916224 ecr 157807,nop,nop,sack 2 {454105:462673}{436969:452677},mptcp dss ack 3868162083], length 0
10:18:08.429954 IP 112.26.1.8.46387 > 112.26.1.1.43445: Flags [.], ack 406981, win 24209, options [nop,nop,TS val 4294916294 ecr 157807,nop,nop,sack 2 {454105:464101}{436969:452677},mptcp dss ack 3868162083], length 0
10:18:08.545396 IP 112.26.1.8.46387 > 112.26.1.1.43445: Flags [.], ack 406981, win 24209, options [nop,nop,TS val 4294916401 ecr 157807,nop,nop,sack 2 {454105:465529}{436969:452677},mptcp dss ack 3868162083], length 0
10:18:08.615997 IP 112.26.1.1.43445 > 112.26.1.8.46387: Flags [.], seq 406981:408409, ack 1, win 4017, options [nop,nop,TS val 162200 ecr 4294915720,mptcp dss ack 1720219151 seq 3868162083 subseq 406981 len 1428 csum 0x37f2], length 1428
10:18:08.616428 IP 112.26.1.8.46387 > 112.26.1.1.43445: Flags [.], ack 452677, win 21693, options [nop,nop,TS val 4294917273 ecr 162200,nop,nop,sack 2 {466957:469813}{454105:465529},mptcp dss ack 3868376283], length 0
10:18:08.690598 IP 112.26.1.1.43445 > 112.26.1.8.46387: Flags [.], seq 452677:454105, ack 1, win 4017, options [nop,nop,TS val 162200 ecr 4294915720,mptcp dss ack 1720219151 seq 3868376283 subseq 452677 len 1428 csum 0x7ca2], length 1428
10:18:08.690886 IP 112.26.1.8.46387 > 112.26.1.1.43445: Flags [.], ack 465529, win 23901, options [nop,nop,TS val 4294917347 ecr 162200,nop,nop,sack 1 {466957:469813},mptcp dss ack 3868381995], length 0
10:18:08.793831 IP 112.26.1.1.43445 > 112.26.1.8.46387: Flags [.], seq 469813:471241, ack 1, win 4017, options [nop,nop,TS val 162212 ecr 4294915720,mptcp dss ack 1720219151 seq 3868484811 subseq 469813 len 1428 csum 0xd4f1], length 1428
10:18:08.794171 IP 112.26.1.8.46387 > 112.26.1.1.43445: Flags [.], ack 465529, win 23965, options [nop,nop,TS val 4294917450 ecr 162200,nop,nop,sack 1 {466957:471241},mptcp dss ack 3868381995], length 0
10:18:08.854806 IP 112.26.1.8.46387 > 112.26.1.1.43445: Flags [.], ack 406981, win 24209, options [nop,nop,TS val 4294916770 ecr 157807,nop,nop,sack 2 {466957:468385}{454105:465529},mptcp dss ack 3868162083], length 0
10:18:08.909770 IP 112.26.1.1.43445 > 112.26.1.8.46387: Flags [.], seq 471241:472669, ack 1, win 4017, options [nop,nop,TS val 162377 ecr 4294915812,mptcp dss ack 1720219151 seq 3868490523 subseq 471241 len 1428 csum 0xa46b], length 1428
10:18:08.910054 IP 112.26.1.8.46387 > 112.26.1.1.43445: Flags [.], ack 465529, win 23965, options [nop,nop,TS val 4294917566 ecr 162200,nop,nop,sack 1 {466957:472669},mptcp dss ack 3868381995], length 0
10:18:08.985987 IP 112.26.1.8.46387 > 112.26.1.1.43445: Flags [.], ack 406981, win 24209, options [nop,nop,TS val 4294916968 ecr 157807,nop,nop,sack 2 {466957:469813}{454105:465529},mptcp dss ack 3868162083], length 0
10:18:09.076300 IP 112.26.1.8.46387 > 112.26.1.1.43445: Flags [.], ack 452677, win 21693, options [nop,nop,TS val 4294917273 ecr 162200,nop,nop,sack 2 {466957:469813}{454105:465529},mptcp dss ack 3868376283], length 0
10:18:09.158800 IP 112.26.1.8.46387 > 112.26.1.1.43445: Flags [.], ack 465529, win 23901, options [nop,nop,TS val 4294917347 ecr 162200,nop,nop,sack 1 {466957:469813},mptcp dss ack 3868381995], length 0
10:18:09.305521 IP 112.26.1.8.46387 > 112.26.1.1.43445: Flags [.], ack 465529, win 23965, options [nop,nop,TS val 4294917450 ecr 162200,nop,nop,sack 1 {466957:471241},mptcp dss ack 3868381995], length 0
10:18:09.427627 IP 112.26.1.8.46387 > 112.26.1.1.43445: Flags [.], ack 465529, win 23965, options [nop,nop,TS val 4294917566 ecr 162200,nop,nop,sack 1 {466957:472669},mptcp dss ack 3868381995], length 0
10:18:09.460030 IP 112.26.1.1.43445 > 112.26.1.8.46387: Flags [.], seq 472669:474097, ack 1, win 4017, options [nop,nop,TS val 162460 ecr 4294915876,mptcp dss ack 1720219151 seq 3868494807 subseq 472669 len 1428 csum 0x21ef], length 1428
10:18:09.485819 IP 112.26.1.1.43445 > 112.26.1.8.46387: Flags [.], seq 474097:475525, ack 1, win 4017, options [nop,nop,TS val 162593 ecr 4294916019,mptcp dss ack 1720219151 seq 3868499091 subseq 474097 len 1428 csum 0x1ba], length 1428
10:18:09.552593 IP 112.26.1.1.43445 > 112.26.1.8.46387: Flags [.], seq 475525:476953, ack 1, win 4017, options [nop,nop,TS val 162711 ecr 4294916112,mptcp dss ack 1720219151 seq 3868503375 subseq 475525 len 1428 csum 0x694e], length 1428
10:18:09.595784 IP 112.26.1.1.43445 > 112.26.1.8.46387: Flags [.], seq 476953:478381, ack 1, win 4017, options [nop,nop,TS val 162770 ecr 4294916224,mptcp dss ack 1720219151 seq 3868507659 subseq 476953 len 1428 csum 0xdc60], length 1428
10:18:23.436327 IP 112.26.1.1.43445 > 112.26.1.8.46387: Flags [.], seq 465529:466957, ack 1, win 4017, options [nop,nop,TS val 177664 ecr 4294917566,mptcp dss ack 1720219151 seq 3868446255 subseq 465529 len 1428 csum 0xeab8], length 1428
10:18:23.436622 IP 112.26.1.8.46387 > 112.26.1.1.43445: Flags [.], ack 472669, win 24224, options [nop,nop,TS val 4294932092 ecr 177664,mptcp dss ack 3868499091], length 0
10:18:23.507344 IP 112.26.1.8.46387 > 112.26.1.1.43445: Flags [.], ack 472669, win 24224, options [nop,nop,TS val 4294932092 ecr 177664,mptcp dss ack 3868499091], length 0
10:18:23.670160 IP 112.26.1.1.43445 > 112.26.1.8.46387: Flags [.], seq 484093:485521, ack 1, win 4017, options [nop,nop,TS val 177889 ecr 4294932092,mptcp dss ack 1720219151 seq 3868470531 subseq 484093 len 1428 csum 0x9114], length 1428
10:18:23.670489 IP 112.26.1.8.46387 > 112.26.1.1.43445: Flags [.], ack 472669, win 24224, options [nop,nop,TS val 4294932326 ecr 177664,nop,nop,sack 1 {484093:485521},mptcp dss ack 3868499091], length 0
10:18:23.683065 IP 112.26.1.8.46387 > 112.26.1.1.43445: Flags [.], ack 472669, win 24224, options [nop,nop,TS val 4294932326 ecr 177664,nop,nop,sack 1 {484093:485521},mptcp dss ack 3868499091], length 0
10:18:23.768489 IP 112.26.1.1.43445 > 112.26.1.8.46387: Flags [.], seq 485521:486949, ack 1, win 4017, options [nop,nop,TS val 177889 ecr 4294932092,mptcp dss ack 1720219151 seq 3868471959 subseq 485521 len 1428 csum 0x8d20], length 1428
10:18:23.768777 IP 112.26.1.8.46387 > 112.26.1.1.43445: Flags [.], ack 472669, win 24224, options [nop,nop,TS val 4294932425 ecr 177664,nop,nop,sack 1 {484093:486949},mptcp dss ack 3868499091], length 0
10:18:23.772934 IP 112.26.1.8.46387 > 112.26.1.1.43445: Flags [.], ack 472669, win 24224, options [nop,nop,TS val 4294932425 ecr 177664,nop,nop,sack 1 {484093:486949},mptcp dss ack 3868499091], length 0
10:18:23.873856 IP 112.26.1.1.43445 > 112.26.1.8.46387: Flags [.], seq 472669:474097, ack 1, win 4017, options [nop,nop,TS val 178225 ecr 4294932326,mptcp dss ack 1720219151 seq 3868494807 subseq 472669 len 1428 csum 0x21ef], length 1428
10:18:23.874147 IP 112.26.1.8.46387 > 112.26.1.1.43445: Flags [.], ack 474097, win 24224, options [nop,nop,TS val 4294932530 ecr 178225,nop,nop,sack 1 {484093:486949},mptcp dss ack 3868499091], length 0
10:18:23.925393 IP 112.26.1.8.46387 > 112.26.1.1.43445: Flags [.], ack 474097, win 24224, options [nop,nop,TS val 4294932530 ecr 178225,nop,nop,sack 1 {484093:486949},mptcp dss ack 3868499091], length 0
10:18:23.980255 IP 112.26.1.1.43445 > 112.26.1.8.46387: Flags [.], seq 474097:475525, ack 1, win 4017, options [nop,nop,TS val 178321 ecr 4294932425,mptcp dss ack 1720219151 seq 3868499091 subseq 474097 len 1428 csum 0x1ba], length 1428
10:18:23.980538 IP 112.26.1.8.46387 > 112.26.1.1.43445: Flags [.], ack 475525, win 23979, options [nop,nop,TS val 4294932637 ecr 178321,nop,nop,sack 1 {484093:486949},mptcp dss ack 3868514799], length 0
10:18:24.076775 IP 112.26.1.8.46387 > 112.26.1.1.43445: Flags [.], ack 475525, win 23979, options [nop,nop,TS val 4294932637 ecr 178321,nop,nop,sack 1 {484093:486949},mptcp dss ack 3868514799], length 0
10:18:24.161954 IP 112.26.1.1.43445 > 112.26.1.8.46387: Flags [.], seq 475525:476953, ack 1, win 4017, options [nop,nop,TS val 178474 ecr 4294932530,mptcp dss ack 1720219151 seq 3868503375 subseq 475525 len 1428 csum 0x694e], length 1428
10:18:24.162184 IP 112.26.1.8.46387 > 112.26.1.1.43445: Flags [.], ack 476953, win 23979, options [nop,nop,TS val 4294932818 ecr 178474,nop,nop,sack 1 {484093:486949},mptcp dss ack 3868514799], length 0
10:18:24.264567 IP 112.26.1.8.46387 > 112.26.1.1.43445: Flags [.], ack 476953, win 23979, options [nop,nop,TS val 4294932818 ecr 178474,nop,nop,sack 1 {484093:486949},mptcp dss ack 3868514799], length 0
10:18:24.347226 IP 112.26.1.1.43445 > 112.26.1.8.46387: Flags [.], seq 476953:478381, ack 1, win 4017, options [nop,nop,TS val 178474 ecr 4294932530,mptcp dss ack 1720219151 seq 3868507659 subseq 476953 len 1428 csum 0xdc60], length 1428
10:18:24.347486 IP 112.26.1.8.46387 > 112.26.1.1.43445: Flags [.], ack 478381, win 23979, options [nop,nop,TS val 4294933003 ecr 178474,nop,nop,sack 1 {484093:486949},mptcp dss ack 3868514799], length 0
10:18:24.450830 IP 112.26.1.8.46387 > 112.26.1.1.43445: Flags [.], ack 478381, win 23979, options [nop,nop,TS val 4294933003 ecr 178474,nop,nop,sack 1 {484093:486949},mptcp dss ack 3868514799], length 0
10:18:24.505876 IP 112.26.1.1.43445 > 112.26.1.8.46387: Flags [.], seq 478381:479809, ack 1, win 4017, options [nop,nop,TS val 178586 ecr 4294932637,mptcp dss ack 1720219151 seq 3868514799 subseq 478381 len 1428 csum 0x50fa], length 1428
10:18:24.506088 IP 112.26.1.8.46387 > 112.26.1.1.43445: Flags [.], ack 479809, win 23957, options [nop,nop,TS val 4294933162 ecr 178586,nop,nop,sack 1 {484093:486949},mptcp dss ack 3868516227], length 0
10:18:24.626200 IP 112.26.1.8.46387 > 112.26.1.1.43445: Flags [.], ack 479809, win 23957, options [nop,nop,TS val 4294933162 ecr 178586,nop,nop,sack 1 {484093:486949},mptcp dss ack 3868516227], length 0
10:18:24.715900 IP 112.26.1.1.43445 > 112.26.1.8.46387: Flags [.], seq 479809:481237, ack 1, win 4017, options [nop,nop,TS val 178586 ecr 4294932637,mptcp dss ack 1720219151 seq 3868516227 subseq 479809 len 1428 csum 0x26c], length 1428
10:18:24.716160 IP 112.26.1.8.46387 > 112.26.1.1.43445: Flags [.], ack 481237, win 23801, options [nop,nop,TS val 4294933372 ecr 178586,nop,nop,sack 1 {484093:486949},mptcp dss ack 3868526223], length 0
10:18:24.834376 IP 112.26.1.1.43445 > 112.26.1.8.46387: Flags [.], seq 481237:482665, ack 1, win 4017, options [nop,nop,TS val 178664 ecr 4294932818,mptcp dss ack 1720219151 seq 3868524795 subseq 481237 len 1428 csum 0xfa09], length 1428
10:18:24.834673 IP 112.26.1.8.46387 > 112.26.1.1.43445: Flags [.], ack 482665, win 24478, options [nop,nop,TS val 4294933491 ecr 178664,nop,nop,sack 1 {484093:486949},mptcp dss ack 3868620471], length 0
10:18:24.917207 IP 112.26.1.8.46387 > 112.26.1.1.43445: Flags [.], ack 481237, win 23801, options [nop,nop,TS val 4294933372 ecr 178586,nop,nop,sack 1 {484093:486949},mptcp dss ack 3868526223], length 0
10:18:24.996378 IP 112.26.1.1.43445 > 112.26.1.8.46387: Flags [.], seq 482665:484093, ack 1, win 4017, options [nop,nop,TS val 178664 ecr 4294932818,mptcp dss ack 1720219151 seq 3868526223 subseq 482665 len 1428 csum 0xb4f9], length 1428
10:18:24.996727 IP 112.26.1.8.46387 > 112.26.1.1.43445: Flags [.], ack 486949, win 24478, options [nop,nop,TS val 4294933653 ecr 178664,mptcp dss ack 3868620471], length 0
10:18:25.054456 IP 112.26.1.8.46387 > 112.26.1.1.43445: Flags [.], ack 482665, win 24478, options [nop,nop,TS val 4294933491 ecr 178664,nop,nop,sack 1 {484093:486949},mptcp dss ack 3868620471], length 0
10:18:25.102306 IP 112.26.1.8.46387 > 112.26.1.1.43445: Flags [.], ack 486949, win 24478, options [nop,nop,TS val 4294933653 ecr 178664,mptcp dss ack 3868620471], length 0
10:18:25.178645 IP 112.26.1.1.43445 > 112.26.1.8.46387: Flags [.], seq 486949:488377, ack 1, win 4017, options [nop,nop,TS val 179531 ecr 4294933653,mptcp dss ack 1720219151 seq 3868674735 subseq 486949 len 1428 csum 0x18d1], length 1428
10:18:25.178935 IP 112.26.1.8.46387 > 112.26.1.1.43445: Flags [.], ack 488377, win 24478, options [nop,nop,TS val 4294933835 ecr 179531,mptcp dss ack 3868620471], length 0
10:18:25.266204 IP 112.26.1.8.46387 > 112.26.1.1.43445: Flags [.], ack 488377, win 24478, options [nop,nop,TS val 4294933835 ecr 179531,mptcp dss ack 3868620471], length 0
10:18:25.380343 IP 112.26.1.1.43445 > 112.26.1.8.46387: Flags [.], seq 488377:489805, ack 1, win 4017, options [nop,nop,TS val 179531 ecr 4294933653,mptcp dss ack 1720219151 seq 3868676163 subseq 488377 len 1428 csum 0xab2e], length 1428
10:18:25.380652 IP 112.26.1.8.46387 > 112.26.1.1.43445: Flags [.], ack 489805, win 24478, options [nop,nop,TS val 4294934036 ecr 179531,mptcp dss ack 3868620471], length 0
10:18:25.453903 IP 112.26.1.8.46387 > 112.26.1.1.43445: Flags [.], ack 489805, win 24478, options [nop,nop,TS val 4294934036 ecr 179531,mptcp dss ack 3868620471], length 0
10:18:25.521636 IP 112.26.1.1.43445 > 112.26.1.8.46387: Flags [.], seq 489805:491233, ack 1, win 4017, options [nop,nop,TS val 179531 ecr 4294933653,mptcp dss ack 1720219151 seq 3868677591 subseq 489805 len 1428 csum 0x2f61], length 1428
10:18:25.521959 IP 112.26.1.8.46387 > 112.26.1.1.43445: Flags [.], ack 491233, win 24478, options [nop,nop,TS val 4294934178 ecr 179531,mptcp dss ack 3868620471], length 0
10:18:25.601174 IP 112.26.1.8.46387 > 112.26.1.1.43445: Flags [.], ack 491233, win 24478, options [nop,nop,TS val 4294934178 ecr 179531,mptcp dss ack 3868620471], length 0
10:18:25.690206 IP 112.26.1.1.43445 > 112.26.1.8.46387: Flags [.], seq 491233:492661, ack 1, win 4017, options [nop,nop,TS val 179531 ecr 4294933653,mptcp dss ack 1720219151 seq 3868679019 subseq 491233 len 1428 csum 0x596f], length 1428
10:18:25.690510 IP 112.26.1.8.46387 > 112.26.1.1.43445: Flags [.], ack 492661, win 24478, options [nop,nop,TS val 4294934346 ecr 179531,mptcp dss ack 3868620471], length 0
10:18:25.760828 IP 112.26.1.1.43445 > 112.26.1.8.46387: Flags [.], seq 492661:494089, ack 1, win 4017, options [nop,nop,TS val 179531 ecr 4294933653,mptcp dss ack 1720219151 seq 3868680447 subseq 492661 len 1428 csum 0x96cf], length 1428
10:18:25.761111 IP 112.26.1.8.46387 > 112.26.1.1.43445: Flags [.], ack 494089, win 24478, options [nop,nop,TS val 4294934417 ecr 179531,mptcp dss ack 3868620471], length 0
10:18:25.859425 IP 112.26.1.8.46387 > 112.26.1.1.43445: Flags [.], ack 492661, win 24478, options [nop,nop,TS val 4294934346 ecr 179531,mptcp dss ack 3868620471], length 0
10:18:25.930407 IP 112.26.1.1.43445 > 112.26.1.8.46387: Flags [.], seq 494089:495517, ack 1, win 4017, options [nop,nop,TS val 179531 ecr 4294933653,mptcp dss ack 1720219151 seq 3868681875 subseq 494089 len 1428 csum 0x5d21], length 1428
10:18:25.930700 IP 112.26.1.8.46387 > 112.26.1.1.43445: Flags [.], ack 495517, win 24478, options [nop,nop,TS val 4294934586 ecr 179531,mptcp dss ack 3868620471], length 0
10:18:25.976305 IP 112.26.1.8.46387 > 112.26.1.1.43445: Flags [.], ack 494089, win 24478, options [nop,nop,TS val 4294934417 ecr 179531,mptcp dss ack 3868620471], length 0
10:18:26.053639 IP 112.26.1.1.43445 > 112.26.1.8.46387: Flags [.], seq 495517:496945, ack 1, win 4017, options [nop,nop,TS val 179531 ecr 4294933653,mptcp dss ack 1720219151 seq 3868683303 subseq 495517 len 1428 csum 0x194a], length 1428
10:18:26.053924 IP 112.26.1.8.46387 > 112.26.1.1.43445: Flags [.], ack 496945, win 24478, options [nop,nop,TS val 4294934710 ecr 179531,mptcp dss ack 3868620471], length 0
10:18:26.134917 IP 112.26.1.8.46387 > 112.26.1.1.43445: Flags [.], ack 495517, win 24478, options [nop,nop,TS val 4294934586 ecr 179531,mptcp dss ack 3868620471], length 0
10:18:26.248447 IP 112.26.1.8.46387 > 112.26.1.1.43445: Flags [.], ack 496945, win 24478, options [nop,nop,TS val 4294934710 ecr 179531,mptcp dss ack 3868620471], length 0
10:18:26.304178 IP 112.26.1.1.43445 > 112.26.1.8.46387: Flags [.], seq 496945:498373, ack 1, win 4017, options [nop,nop,TS val 179531 ecr 4294933653,mptcp dss ack 1720219151 seq 3868684731 subseq 496945 len 1428 csum 0xfbd6], length 1428
10:18:26.345326 IP 112.26.1.8.46387 > 112.26.1.1.43445: Flags [.], ack 498373, win 24478, options [nop,nop,TS val 4294935002 ecr 179531,mptcp dss ack 3868620471], length 0
10:18:26.346913 IP 112.26.1.1.43445 > 112.26.1.8.46387: Flags [.], seq 498373:499801, ack 1, win 4017, options [nop,nop,TS val 179532 ecr 4294933653,mptcp dss ack 1720219151 seq 3868686159 subseq 498373 len 1428 csum 0x8ee4], length 1428
10:18:26.420965 IP 112.26.1.1.43445 > 112.26.1.8.46387: Flags [.], seq 501229:502657, ack 1, win 4017, options [nop,nop,TS val 179653 ecr 4294933835,mptcp dss ack 1720219151 seq 3868697583 subseq 501229 len 1428 csum 0x90ff], length 1428
10:18:26.421351 IP 112.26.1.8.46387 > 112.26.1.1.43445: Flags [.], ack 499801, win 24478, options [nop,nop,TS val 4294935077 ecr 179532,nop,nop,sack 1 {501229:502657},mptcp dss ack 3868620471], length 0
10:18:26.513252 IP 112.26.1.8.46387 > 112.26.1.1.43445: Flags [.], ack 498373, win 24478, options [nop,nop,TS val 4294935002 ecr 179531,mptcp dss ack 3868620471], length 0
10:18:26.596478 IP 112.26.1.8.46387 > 112.26.1.1.43445: Flags [.], ack 499801, win 24478, options [nop,nop,TS val 4294935077 ecr 179532,nop,nop,sack 1 {501229:502657},mptcp dss ack 3868620471], length 0
10:18:26.649968 IP 112.26.1.1.43445 > 112.26.1.8.46387: Flags [.], seq 504085:505513, ack 1, win 4017, options [nop,nop,TS val 179833 ecr 4294934036,mptcp dss ack 1720219151 seq 3868711863 subseq 504085 len 1428 csum 0xf146], length 1428
10:18:26.650271 IP 112.26.1.8.46387 > 112.26.1.1.43445: Flags [.], ack 499801, win 24255, options [nop,nop,TS val 4294935306 ecr 179532,nop,nop,sack 2 {504085:505513}{501229:502657},mptcp dss ack 3868634751], length 0
10:18:26.739270 IP 112.26.1.1.43445 > 112.26.1.8.46387: Flags [.], seq 505513:506941, ack 1, win 4017, options [nop,nop,TS val 179983 ecr 4294934178,mptcp dss ack 1720219151 seq 3868713291 subseq 505513 len 1428 csum 0xb546], length 1428
10:18:26.739634 IP 112.26.1.8.46387 > 112.26.1.1.43445: Flags [.], ack 499801, win 24255, options [nop,nop,TS val 4294935395 ecr 179532,nop,nop,sack 2 {504085:506941}{501229:502657},mptcp dss ack 3868634751], length 0
10:18:26.839603 IP 112.26.1.8.46387 > 112.26.1.1.43445: Flags [.], ack 499801, win 24255, options [nop,nop,TS val 4294935306 ecr 179532,nop,nop,sack 2 {504085:505513}{501229:502657},mptcp dss ack 3868634751], length 0
10:18:26.916445 IP 112.26.1.1.43445 > 112.26.1.8.46387: Flags [.], seq 506941:508369, ack 1, win 4017, options [nop,nop,TS val 180237 ecr 4294934346,mptcp dss ack 1720219151 seq 3868724715 subseq 506941 len 1428 csum 0xc795], length 1428
10:18:26.916750 IP 112.26.1.8.46387 > 112.26.1.1.43445: Flags [.], ack 499801, win 24272, options [nop,nop,TS val 4294935572 ecr 179532,nop,nop,sack 2 {504085:508369}{501229:502657},mptcp dss ack 3868654743], length 0
10:18:26.979369 IP 112.26.1.8.46387 > 112.26.1.1.43445: Flags [.], ack 499801, win 24255, options [nop,nop,TS val 4294935395 ecr 179532,nop,nop,sack 2 {504085:506941}{501229:502657},mptcp dss ack 3868634751], length 0
10:18:27.038512 IP 112.26.1.1.43445 > 112.26.1.8.46387: Flags [.], seq 508369:509797, ack 1, win 4017, options [nop,nop,TS val 180377 ecr 4294934417,mptcp dss ack 1720219151 seq 3868731855 subseq 508369 len 1428 csum 0xe41d], length 1428
10:18:27.038829 IP 112.26.1.8.46387 > 112.26.1.1.43445: Flags [.], ack 499801, win 24272, options [nop,nop,TS val 4294935695 ecr 179532,nop,nop,sack 2 {504085:509797}{501229:502657},mptcp dss ack 3868654743], length 0
10:18:27.156028 IP 112.26.1.8.46387 > 112.26.1.1.43445: Flags [.], ack 499801, win 24272, options [nop,nop,TS val 4294935572 ecr 179532,nop,nop,sack 2 {504085:508369}{501229:502657},mptcp dss ack 3868654743], length 0
10:18:27.238712 IP 112.26.1.1.43445 > 112.26.1.8.46387: Flags [.], seq 509797:511225, ack 1, win 4017, options [nop,nop,TS val 180521 ecr 4294934586,mptcp dss ack 1720219151 seq 3868736139 subseq 509797 len 1428 csum 0xd6e], length 1428
10:18:27.238921 IP 112.26.1.8.46387 > 112.26.1.1.43445: Flags [.], ack 499801, win 24254, options [nop,nop,TS val 4294935895 ecr 179532,nop,nop,sack 2 {504085:511225}{501229:502657},mptcp dss ack 3868661883], length 0
10:18:27.315307 IP 112.26.1.8.46387 > 112.26.1.1.43445: Flags [.], ack 499801, win 24272, options [nop,nop,TS val 4294935695 ecr 179532,nop,nop,sack 2 {504085:509797}{501229:502657},mptcp dss ack 3868654743], length 0
10:18:27.434684 IP 112.26.1.1.43445 > 112.26.1.8.46387: Flags [.], seq 511225:512653, ack 1, win 4017, options [nop,nop,TS val 180627 ecr 4294934710,mptcp dss ack 1720219151 seq 3868737567 subseq 511225 len 1428 csum 0xf8fa], length 1428
10:18:27.435068 IP 112.26.1.8.46387 > 112.26.1.1.43445: Flags [.], ack 499801, win 24414, options [nop,nop,TS val 4294936091 ecr 179532,nop,nop,sack 2 {504085:512653}{501229:502657},mptcp dss ack 3868687587], length 0
10:18:27.479199 IP 112.26.1.1.43445 > 112.26.1.8.46387: Flags [.], seq 512653:514081, ack 1, win 4017, options [nop,nop,TS val 180895 ecr 4294935002,mptcp dss ack 1720219151 seq 3868741851 subseq 512653 len 1428 csum 0x94c0], length 1428
10:18:27.479546 IP 112.26.1.8.46387 > 112.26.1.1.43445: Flags [.], ack 499801, win 24414, options [nop,nop,TS val 4294936135 ecr 179532,nop,nop,sack 2 {504085:514081}{501229:502657},mptcp dss ack 3868687587], length 0
10:18:27.553059 IP 112.26.1.1.43445 > 112.26.1.8.46387: Flags [.], seq 514081:515509, ack 1, win 4017, options [nop,nop,TS val 180987 ecr 4294935077,mptcp dss ack 1720219151 seq 3868743279 subseq 514081 len 1428 csum 0x984b], length 1428
10:18:27.553399 IP 112.26.1.8.46387 > 112.26.1.1.43445: Flags [.], ack 499801, win 24414, options [nop,nop,TS val 4294936209 ecr 179532,nop,nop,sack 2 {504085:515509}{501229:502657},mptcp dss ack 3868687587], length 0
