10:17:24.032836 IP 112.26.1.8.46387 > 112.26.1.1.43445: Flags [S], seq 3182393828, win 65535, options [mss 1460,sackOK,TS val 4294872454 ecr 0,nop,wscale 6,mptcp join id 3 token 0x1271d1f5 nonce 0xab278870], length 0
10:17:24.063107 IP 112.26.1.1.43445 > 112.26.1.8.46387: Flags [S.], seq 600515713, ack 3182393829, win 65535, options [mss 1460,sackOK,TS val 118409 ecr 4294872454,nop,wscale 6,mptcp join id 3 hmac 0x5c100e5fd49aba7d nonce 0x69eaa99a], length 0
10:17:24.152999 IP 112.26.1.1.43445 > 112.26.1.8.46387: Flags [S.], seq 600515713, ack 3182393829, win 65535, options [mss 1460,sackOK,TS val 118409 ecr 4294872454,nop,wscale 6,mptcp join id 3 hmac 0x5c100e5fd49aba7d nonce 0x69eaa99a], length 0
10:17:24.293809 IP 112.26.1.8.46387 > 112.26.1.1.43445: Flags [.], ack 1, win 7848, options [nop,nop,TS val 4294872847 ecr 118409,mptcp join hmac 0x8ee39ac72f51bb5ae0b3cb1d1a8f01338aaca337], length 0
10:17:24.293978 IP 112.26.1.1.43445 > 112.26.1.8.46387: Flags [.], ack 1, win 4017, options [nop,nop,TS val 118670 ecr 4294872847,mptcp dss ack 1720219151], length 0
10:17:24.299071 IP 112.26.1.1.43445 > 112.26.1.8.46387: Flags [.], ack 1, win 4017, options [nop,nop,TS val 118670 ecr 4294872847,mptcp dss ack 1720219151], length 0
10:17:24.309286 IP 112.26.1.1.43445 > 112.26.1.8.46387: Flags [.], seq 1:1429, ack 1, win 4017, options [nop,nop,TS val 118685 ecr 4294872847,mptcp dss ack 1720219151 seq 3866554155 subseq 1 len 1428 csum 0x3f5a], length 1428
10:18:04.652628 IP 112.26.1.1.43445 > 112.26.1.8.46387: Flags [.], seq 442681:444109, ack 1, win 4017, options [nop,nop,TS val 158840 ecr 4294912407,mptcp dss ack 1720219151 seq 3868244907 subseq 442681 len 1428 csum 0x3f2b], length 1428
10:18:04.910684 IP 112.26.1.8.46387 > 112.26.1.1.43445: Flags [.], ack 405553, win 24231, options [nop,nop,TS val 4294912828 ecr 155172,nop,nop,sack 2 {428401:431257}{421261:425545},mptcp dss ack 3868160655], length 0
10:18:04.910964 IP 112.26.1.1.43445 > 112.26.1.8.46387: Flags [.], seq 425545:426973, ack 1, win 4017, options [nop,nop,TS val 159287 ecr 4294912828,mptcp dss ack 1720219151 seq 3868227771 subseq 425545 len 1428 csum 0xf9b4], length 1428
10:18:04.910996 IP 112.26.1.1.43445 > 112.26.1.8.46387: Flags [.], seq 426973:428401, ack 1, win 4017, options [nop,nop,TS val 159287 ecr 4294912828,mptcp dss ack 1720219151 seq 3868229199 subseq 426973 len 1428 csum 0xccbc], length 1428
10:18:04.919377 IP 112.26.1.1.43445 > 112.26.1.8.46387: Flags [.], seq 425545:426973, ack 1, win 4017, options [nop,nop,TS val 159287 ecr 4294912828,mptcp dss ack 1720219151 seq 3868227771 subseq 425545 len 1428 csum 0xf9b4], length 1428
10:18:05.026400 IP 112.26.1.8.46387 > 112.26.1.1.43445: Flags [.], ack 405553, win 24231, options [nop,nop,TS val 4294912928 ecr 155172,nop,nop,sack 2 {428401:432685}{421261:425545},mptcp dss ack 3868160655], length 0
10:18:05.034093 IP 112.26.1.1.43445 > 112.26.1.8.46387: Flags [.], seq 444109:445537, ack 1, win 4017, options [nop,nop,TS val 159410 ecr 4294912928,mptcp dss ack 1720219151 seq 3868344867 subseq 444109 len 1428 csum 0x9ed4], length 1428
10:18:05.044594 IP 112.26.1.1.43445 > 112.26.1.8.46387: Flags [.], seq 426973:428401, ack 1, win 4017, options [nop,nop,TS val 159287 ecr 4294912828,mptcp dss ack 1720219151 seq 3868229199 subseq 426973 len 1428 csum 0xccbc], length 1428
10:18:05.157359 IP 112.26.1.1.43445 > 112.26.1.8.46387: Flags [.], seq 444109:445537, ack 1, win 4017, options [nop,nop,TS val 159410 ecr 4294912928,mptcp dss ack 1720219151 seq 3868344867 subseq 444109 len 1428 csum 0x9ed4], length 1428
10:18:05.377335 IP 112.26.1.8.46387 > 112.26.1.1.43445: Flags [.], ack 405553, win 24231, options [nop,nop,TS val 4294913376 ecr 155172,nop,nop,sack 2 {438397:439825}{434113:436969},mptcp dss ack 3868160655], length 0
10:18:05.377618 IP 112.26.1.1.43445 > 112.26.1.8.46387: Flags [.], seq 432685:434113, ack 1, win 4017, options [nop,nop,TS val 159754 ecr 4294913376,mptcp dss ack 1720219151 seq 3868249191 subseq 432685 len 1428 csum 0x5aec], length 1428
10:18:05.377672 IP 112.26.1.1.43445 > 112.26.1.8.46387: Flags [.], seq 436969:438397, ack 1, win 4017, options [nop,nop,TS val 159754 ecr 4294913376,mptcp dss ack 1720219151 seq 3868270611 subseq 436969 len 1428 csum 0xf6c7], length 1428
10:18:05.390649 IP 112.26.1.1.43445 > 112.26.1.8.46387: Flags [.], seq 432685:434113, ack 1, win 4017, options [nop,nop,TS val 159754 ecr 4294913376,mptcp dss ack 1720219151 seq 3868249191 subseq 432685 len 1428 csum 0x5aec], length 1428
10:18:05.405917 IP 112.26.1.1.43445 > 112.26.1.8.46387: Flags [.], seq 445537:446965, ack 1, win 4017, options [nop,nop,TS val 159782 ecr 4294913376,mptcp dss ack 1720219151 seq 3868362003 subseq 445537 len 1428 csum 0x97b1], length 1428
10:18:05.454349 IP 112.26.1.8.46387 > 112.26.1.1.43445: Flags [.], ack 406981, win 24209, options [nop,nop,TS val 4294913508 ecr 157807,nop,nop,sack 2 {438397:441253}{434113:436969},mptcp dss ack 3868162083], length 0
10:18:05.454596 IP 112.26.1.1.43445 > 112.26.1.8.46387: Flags [.], seq 446965:448393, ack 1, win 4017, options [nop,nop,TS val 159831 ecr 4294913508,mptcp dss ack 1720219151 seq 3868370571 subseq 446965 len 1428 csum 0xa19c], length 1428
10:18:05.454640 IP 112.26.1.1.43445 > 112.26.1.8.46387: Flags [.], seq 448393:449821, ack 1, win 4017, options [nop,nop,TS val 159831 ecr 4294913508,mptcp dss ack 1720219151 seq 3868371999 subseq 448393 len 1428 csum 0xcfc6], length 1428
10:18:05.454739 IP 112.26.1.1.43445 > 112.26.1.8.46387: Flags [.], seq 449821:451249, ack 1, win 4017, options [nop,nop,TS val 159831 ecr 4294913508,mptcp dss ack 1720219151 seq 3868373427 subseq 449821 len 1428 csum 0x7fdb], length 1428
10:18:05.454805 IP 112.26.1.1.43445 > 112.26.1.8.46387: Flags [.], seq 451249:452677, ack 1, win 4017, options [nop,nop,TS val 159831 ecr 4294913508,mptcp dss ack 1720219151 seq 3868374855 subseq 451249 len 1428 csum 0x2671], length 1428
10:18:05.454892 IP 112.26.1.1.43445 > 112.26.1.8.46387: Flags [.], seq 452677:454105, ack 1, win 4017, options [nop,nop,TS val 159831 ecr 4294913508,mptcp dss ack 1720219151 seq 3868376283 subseq 452677 len 1428 csum 0x7ca2], length 1428
10:18:05.485640 IP 112.26.1.1.43445 > 112.26.1.8.46387: Flags [.], seq 436969:438397, ack 1, win 4017, options [nop,nop,TS val 159754 ecr 4294913376,mptcp dss ack 1720219151 seq 3868270611 subseq 436969 len 1428 csum 0xf6c7], length 1428
10:18:05.549037 IP 112.26.1.1.43445 > 112.26.1.8.46387: Flags [.], seq 445537:446965, ack 1, win 4017, options [nop,nop,TS val 159782 ecr 4294913376,mptcp dss ack 1720219151 seq 3868362003 subseq 445537 len 1428 csum 0x97b1], length 1428
10:18:05.682297 IP 112.26.1.1.43445 > 112.26.1.8.46387: Flags [.], seq 446965:448393, ack 1, win 4017, options [nop,nop,TS val 159831 ecr 4294913508,mptcp dss ack 1720219151 seq 3868370571 subseq 446965 len 1428 csum 0xa19c], length 1428
10:18:05.687636 IP 112.26.1.8.46387 > 112.26.1.1.43445: Flags [.], ack 406981, win 24209, options [nop,nop,TS val 4294913733 ecr 157807,nop,nop,sack 2 {412693:414121}{438397:441253},mptcp dss ack 3868162083], length 0
10:18:05.687884 IP 112.26.1.1.43445 > 112.26.1.8.46387: Flags [.], seq 406981:408409, ack 1, win 4017, options [nop,nop,TS val 160064 ecr 4294913733,mptcp dss ack 1720219151 seq 3868162083 subseq 406981 len 1428 csum 0x37f2], length 1428
10:18:05.801885 IP 112.26.1.1.43445 > 112.26.1.8.46387: Flags [.], seq 448393:449821, ack 1, win 4017, options [nop,nop,TS val 159831 ecr 4294913508,mptcp dss ack 1720219151 seq 3868371999 subseq 448393 len 1428 csum 0xcfc6], length 1428
10:18:05.833440 IP 112.26.1.8.46387 > 112.26.1.1.43445: Flags [.], ack 406981, win 24209, options [nop,nop,TS val 4294913848 ecr 157807,nop,nop,sack 2 {438397:442681}{412693:414121},mptcp dss ack 3868162083], length 0
10:18:05.876460 IP 112.26.1.1.43445 > 112.26.1.8.46387: Flags [.], seq 449821:451249, ack 1, win 4017, options [nop,nop,TS val 159831 ecr 4294913508,mptcp dss ack 1720219151 seq 3868373427 subseq 449821 len 1428 csum 0x7fdb], length 1428
10:18:05.920339 IP 112.26.1.8.46387 > 112.26.1.1.43445: Flags [.], ack 406981, win 24209, options [nop,nop,TS val 4294913916 ecr 157807,nop,nop,sack 2 {419833:421261}{438397:442681},mptcp dss ack 3868162083], length 0
10:18:05.920553 IP 112.26.1.1.43445 > 112.26.1.8.46387: Flags [.], seq 454105:455533, ack 1, win 4017, options [nop,nop,TS val 160297 ecr 4294913848,mptcp dss ack 1720219151 seq 3868394847 subseq 454105 len 1428 csum 0x79a7], length 1428
10:18:05.968375 IP 112.26.1.1.43445 > 112.26.1.8.46387: Flags [.], seq 451249:452677, ack 1, win 4017, options [nop,nop,TS val 159831 ecr 4294913508,mptcp dss ack 1720219151 seq 3868374855 subseq 451249 len 1428 csum 0x2671], length 1428
10:18:05.997822 IP 112.26.1.1.43445 > 112.26.1.8.46387: Flags [.], seq 455533:456961, ack 1, win 4017, options [nop,nop,TS val 160374 ecr 4294913916,mptcp dss ack 1720219151 seq 3868396275 subseq 455533 len 1428 csum 0x4f6a], length 1428
10:18:06.020058 IP 112.26.1.8.46387 > 112.26.1.1.43445: Flags [.], ack 406981, win 24209, options [nop,nop,TS val 4294913971 ecr 157807,nop,nop,sack 2 {438397:444109}{419833:421261},mptcp dss ack 3868162083], length 0
10:18:06.040070 IP 112.26.1.1.43445 > 112.26.1.8.46387: Flags [.], seq 456961:458389, ack 1, win 4017, options [nop,nop,TS val 160416 ecr 4294913971,mptcp dss ack 1720219151 seq 3868410555 subseq 456961 len 1428 csum 0x90a9], length 1428
10:18:06.116916 IP 112.26.1.8.46387 > 112.26.1.1.43445: Flags [.], ack 406981, win 24209, options [nop,nop,TS val 4294914195 ecr 157807,nop,nop,sack 2 {425545:426973}{438397:444109},mptcp dss ack 3868162083], length 0
10:18:06.138261 IP 112.26.1.1.43445 > 112.26.1.8.46387: Flags [.], seq 452677:454105, ack 1, win 4017, options [nop,nop,TS val 159831 ecr 4294913508,mptcp dss ack 1720219151 seq 3868376283 subseq 452677 len 1428 csum 0x7ca2], length 1428
10:18:06.149438 IP 112.26.1.1.43445 > 112.26.1.8.46387: Flags [.], seq 458389:459817, ack 1, win 4017, options [nop,nop,TS val 160525 ecr 4294914195,mptcp dss ack 1720219151 seq 3868413411 subseq 458389 len 1428 csum 0x9483], length 1428
10:18:06.221863 IP 112.26.1.1.43445 > 112.26.1.8.46387: Flags [.], seq 406981:408409, ack 1, win 4017, options [nop,nop,TS val 160064 ecr 4294913733,mptcp dss ack 1720219151 seq 3868162083 subseq 406981 len 1428 csum 0x37f2], length 1428
10:18:06.278827 IP 112.26.1.8.46387 > 112.26.1.1.43445: Flags [.], ack 406981, win 24209, options [nop,nop,TS val 4294914270 ecr 157807,nop,nop,sack 2 {425545:428401}{438397:444109},mptcp dss ack 3868162083], length 0
10:18:06.313283 IP 112.26.1.1.43445 > 112.26.1.8.46387: Flags [.], seq 459817:461245, ack 1, win 4017, options [nop,nop,TS val 160689 ecr 4294914270,mptcp dss ack 1720219151 seq 3868417695 subseq 459817 len 1428 csum 0xd48a], length 1428
10:18:06.316523 IP 112.26.1.1.43445 > 112.26.1.8.46387: Flags [.], seq 454105:455533, ack 1, win 4017, options [nop,nop,TS val 160297 ecr 4294913848,mptcp dss ack 1720219151 seq 3868394847 subseq 454105 len 1428 csum 0x79a7], length 1428
10:18:06.460457 IP 112.26.1.1.43445 > 112.26.1.8.46387: Flags [.], seq 455533:456961, ack 1, win 4017, options [nop,nop,TS val 160374 ecr 4294913916,mptcp dss ack 1720219151 seq 3868396275 subseq 455533 len 1428 csum 0x4f6a], length 1428
10:18:06.476561 IP 112.26.1.8.46387 > 112.26.1.1.43445: Flags [.], ack 406981, win 24209, options [nop,nop,TS val 4294914414 ecr 157807,nop,nop,sack 2 {438397:445537}{425545:428401},mptcp dss ack 3868162083], length 0
10:18:06.519170 IP 112.26.1.1.43445 > 112.26.1.8.46387: Flags [.], seq 461245:462673, ack 1, win 4017, options [nop,nop,TS val 160895 ecr 4294914414,mptcp dss ack 1720219151 seq 3868424835 subseq 461245 len 1428 csum 0xf894], length 1428
10:18:06.534308 IP 112.26.1.1.43445 > 112.26.1.8.46387: Flags [.], seq 456961:458389, ack 1, win 4017, options [nop,nop,TS val 160416 ecr 4294913971,mptcp dss ack 1720219151 seq 3868410555 subseq 456961 len 1428 csum 0x90a9], length 1428
10:18:06.633127 IP 112.26.1.1.43445 > 112.26.1.8.46387: Flags [.], seq 458389:459817, ack 1, win 4017, options [nop,nop,TS val 160525 ecr 4294914195,mptcp dss ack 1720219151 seq 3868413411 subseq 458389 len 1428 csum 0x9483], length 1428
10:18:06.707257 IP 112.26.1.1.43445 > 112.26.1.8.46387: Flags [.], seq 459817:461245, ack 1, win 4017, options [nop,nop,TS val 160689 ecr 4294914270,mptcp dss ack 1720219151 seq 3868417695 subseq 459817 len 1428 csum 0xd48a], length 1428
10:18:06.802265 IP 112.26.1.8.46387 > 112.26.1.1.43445: Flags [.], ack 406981, win 24209, options [nop,nop,TS val 4294914675 ecr 157807,nop,nop,sack 2 {432685:434113}{438397:445537},mptcp dss ack 3868162083], length 0
10:18:06.804797 IP 112.26.1.1.43445 > 112.26.1.8.46387: Flags [.], seq 461245:462673, ack 1, win 4017, options [nop,nop,TS val 160895 ecr 4294914414,mptcp dss ack 1720219151 seq 3868424835 subseq 461245 len 1428 csum 0xf894], length 1428
10:18:06.819815 IP 112.26.1.1.43445 > 112.26.1.8.46387: Flags [.], seq 462673:464101, ack 1, win 4017, options [nop,nop,TS val 161196 ecr 4294914675,mptcp dss ack 1720219151 seq 3868434831 subseq 462673 len 1428 csum 0x8fa3], length 1428
10:18:06.898283 IP 112.26.1.8.46387 > 112.26.1.1.43445: Flags [.], ack 406981, win 24209, options [nop,nop,TS val 4294914725 ecr 157807,nop,nop,sack 2 {436969:445537}{432685:434113},mptcp dss ack 3868162083], length 0
10:18:06.911282 IP 112.26.1.1.43445 > 112.26.1.8.46387: Flags [.], seq 462673:464101, ack 1, win 4017, options [nop,nop,TS val 161196 ecr 4294914675,mptcp dss ack 1720219151 seq 3868434831 subseq 462673 len 1428 csum 0x8fa3], length 1428
10:18:06.918944 IP 112.26.1.1.43445 > 112.26.1.8.46387: Flags [.], seq 464101:465529, ack 1, win 4017, options [nop,nop,TS val 161295 ecr 4294914725,mptcp dss ack 1720219151 seq 3868439115 subseq 464101 len 1428 csum 0x8896], length 1428
10:18:06.985780 IP 112.26.1.8.46387 > 112.26.1.1.43445: Flags [.], ack 406981, win 24209, options [nop,nop,TS val 4294914838 ecr 157807,nop,nop,sack 2 {436969:446965}{432685:434113},mptcp dss ack 3868162083], length 0
10:18:06.996671 IP 112.26.1.1.43445 > 112.26.1.8.46387: Flags [.], seq 464101:465529, ack 1, win 4017, options [nop,nop,TS val 161295 ecr 4294914725,mptcp dss ack 1720219151 seq 3868439115 subseq 464101 len 1428 csum 0x8896], length 1428
10:18:07.030483 IP 112.26.1.1.43445 > 112.26.1.8.46387: Flags [.], seq 465529:466957, ack 1, win 4017, options [nop,nop,TS val 161407 ecr 4294914838,mptcp dss ack 1720219151 seq 3868446255 subseq 465529 len 1428 csum 0xeab8], length 1428
10:18:07.103939 IP 112.26.1.1.43445 > 112.26.1.8.46387: Flags [.], seq 465529:466957, ack 1, win 4017, options [nop,nop,TS val 161407 ecr 4294914838,mptcp dss ack 1720219151 seq 3868446255 subseq 465529 len 1428 csum 0xeab8], length 1428
10:18:07.282672 IP 112.26.1.8.46387 > 112.26.1.1.43445: Flags [.], ack 406981, win 24209, options [nop,nop,TS val 4294915196 ecr 157807,nop,nop,sack 2 {436969:449821}{432685:434113},mptcp dss ack 3868162083], length 0
10:18:07.393681 IP 112.26.1.1.43445 > 112.26.1.8.46387: Flags [.], seq 466957:468385, ack 1, win 4017, options [nop,nop,TS val 161770 ecr 4294915196,mptcp dss ack 1720219151 seq 3868464819 subseq 466957 len 1428 csum 0xd0f5], length 1428
10:18:07.393783 IP 112.26.1.1.43445 > 112.26.1.8.46387: Flags [.], seq 468385:469813, ack 1, win 4017, options [nop,nop,TS val 161770 ecr 4294915196,mptcp dss ack 1720219151 seq 3868466247 subseq 468385 len 1428 csum 0x157a], length 1428
10:18:07.400161 IP 112.26.1.1.43445 > 112.26.1.8.46387: Flags [.], seq 466957:468385, ack 1, win 4017, options [nop,nop,TS val 161770 ecr 4294915196,mptcp dss ack 1720219151 seq 3868464819 subseq 466957 len 1428 csum 0xd0f5], length 1428
10:18:07.536018 IP 112.26.1.1.43445 > 112.26.1.8.46387: Flags [.], seq 468385:469813, ack 1, win 4017, options [nop,nop,TS val 161770 ecr 4294915196,mptcp dss ack 1720219151 seq 3868466247 subseq 468385 len 1428 csum 0x157a], length 1428
10:18:07.823800 IP 112.26.1.8.46387 > 112.26.1.1.43445: Flags [.], ack 406981, win 24209, options [nop,nop,TS val 4294915720 ecr 157807,nop,nop,sack 2 {454105:455533}{436969:452677},mptcp dss ack 3868162083], length 0
10:18:07.824107 IP 112.26.1.1.43445 > 112.26.1.8.46387: Flags [.], seq 406981:408409, ack 1, win 4017, options [nop,nop,TS val 162200 ecr 4294915720,mptcp dss ack 1720219151 seq 3868162083 subseq 406981 len 1428 csum 0x37f2], length 1428
10:18:07.824153 IP 112.26.1.1.43445 > 112.26.1.8.46387: Flags [.], seq 452677:454105, ack 1, win 4017, options [nop,nop,TS val 162200 ecr 4294915720,mptcp dss ack 1720219151 seq 3868376283 subseq 452677 len 1428 csum 0x7ca2], length 1428
10:18:07.835851 IP 112.26.1.1.43445 > 112.26.1.8.46387: Flags [.], seq 469813:471241, ack 1, win 4017, options [nop,nop,TS val 162212 ecr 4294915720,mptcp dss ack 1720219151 seq 3868484811 subseq 469813 len 1428 csum 0xd4f1], length 1428
10:18:07.841887 IP 112.26.1.1.43445 > 112.26.1.8.46387: Flags [.], seq 406981:408409, ack 1, win 4017, options [nop,nop,TS val 162200 ecr 4294915720,mptcp dss ack 1720219151 seq 3868162083 subseq 406981 len 1428 csum 0x37f2], length 1428
10:18:07.912800 IP 112.26.1.1.43445 > 112.26.1.8.46387: Flags [.], seq 452677:454105, ack 1, win 4017, options [nop,nop,TS val 162200 ecr 4294915720,mptcp dss ack 1720219151 seq 3868376283 subseq 452677 len 1428 csum 0x7ca2], length 1428
10:18:07.940938 IP 112.26.1.8.46387 > 112.26.1.1.43445: Flags [.], ack 406981, win 24209, options [nop,nop,TS val 4294915812 ecr 157807,nop,nop,sack 2 {454105:456961}{436969:452677},mptcp dss ack 3868162083], length 0
10:18:08.000819 IP 112.26.1.1.43445 > 112.26.1.8.46387: Flags [.], seq 471241:472669, ack 1, win 4017, options [nop,nop,TS val 162377 ecr 4294915812,mptcp dss ack 1720219151 seq 3868490523 subseq 471241 len 1428 csum 0xa46b], length 1428
10:18:08.022973 IP 112.26.1.1.43445 > 112.26.1.8.46387: Flags [.], seq 469813:471241, ack 1, win 4017, options [nop,nop,TS val 162212 ecr 4294915720,mptcp dss ack 1720219151 seq 3868484811 subseq 469813 len 1428 csum 0xd4f1], length 1428
10:18:08.058628 IP 112.26.1.8.46387 > 112.26.1.1.43445: Flags [.], ack 406981, win 24209, options [nop,nop,TS val 4294915876 ecr 157807,nop,nop,sack 2 {454105:458389}{436969:452677},mptcp dss ack 3868162083], length 0
10:18:08.083926 IP 112.26.1.1.43445 > 112.26.1.8.46387: Flags [.], seq 472669:474097, ack 1, win 4017, options [nop,nop,TS val 162460 ecr 4294915876,mptcp dss ack 1720219151 seq 3868494807 subseq 472669 len 1428 csum 0x21ef], length 1428
10:18:08.161636 IP 112.26.1.1.43445 > 112.26.1.8.46387: Flags [.], seq 471241:472669, ack 1, win 4017, options [nop,nop,TS val 162377 ecr 4294915812,mptcp dss ack 1720219151 seq 3868490523 subseq 471241 len 1428 csum 0xa46b], length 1428
10:18:08.181745 IP 112.26.1.8.46387 > 112.26.1.1.43445: Flags [.], ack 406981, win 24209, options [nop,nop,TS val 4294916019 ecr 157807,nop,nop,sack 2 {454105:459817}{436969:452677},mptcp dss ack 3868162083], length 0
10:18:08.217292 IP 112.26.1.1.43445 > 112.26.1.8.46387: Flags [.], seq 474097:475525, ack 1, win 4017, options [nop,nop,TS val 162593 ecr 4294916019,mptcp dss ack 1720219151 seq 3868499091 subseq 474097 len 1428 csum 0x1ba], length 1428
10:18:08.245932 IP 112.26.1.1.43445 > 112.26.1.8.46387: Flags [.], seq 472669:474097, ack 1, win 4017, options [nop,nop,TS val 162460 ecr 4294915876,mptcp dss ack 1720219151 seq 3868494807 subseq 472669 len 1428 csum 0x21ef], length 1428
10:18:08.266593 IP 112.26.1.8.46387 > 112.26.1.1.43445: Flags [.], ack 406981, win 24209, options [nop,nop,TS val 4294916112 ecr 157807,nop,nop,sack 2 {454105:461245}{436969:452677},mptcp dss ack 3868162083], length 0
10:18:08.334431 IP 112.26.1.1.43445 > 112.26.1.8.46387: Flags [.], seq 475525:476953, ack 1, win 4017, options [nop,nop,TS val 162711 ecr 4294916112,mptcp dss ack 1720219151 seq 3868503375 subseq 475525 len 1428 csum 0x694e], length 1428
10:18:08.338967 IP 112.26.1.1.43445 > 112.26.1.8.46387: Flags [.], seq 474097:475525, ack 1, win 4017, options [nop,nop,TS val 162593 ecr 4294916019,mptcp dss ack 1720219151 seq 3868499091 subseq 474097 len 1428 csum 0x1ba], length 1428
10:18:08.383754 IP 112.26.1.8.46387 > 112.26.1.1.43445: Flags [.], ack 406981, win 24209, options [nop,nop,TS val 4294916224 ecr 157807,nop,nop,sack 2 {454105:462673}{436969:452677},mptcp dss ack 3868162083], length 0
10:18:08.393918 IP 112.26.1.1.43445 > 112.26.1.8.46387: Flags [.], seq 476953:478381, ack 1, win 4017, options [nop,nop,TS val 162770 ecr 4294916224,mptcp dss ack 1720219151 seq 3868507659 subseq 476953 len 1428 csum 0xdc60], length 1428
10:18:08.425027 IP 112.26.1.1.43445 > 112.26.1.8.46387: Flags [.], seq 475525:476953, ack 1, win 4017, options [nop,nop,TS val 162711 ecr 4294916112,mptcp dss ack 1720219151 seq 3868503375 subseq 475525 len 1428 csum 0x694e], length 1428
10:18:08.508383 IP 112.26.1.8.46387 > 112.26.1.1.43445: Flags [.], ack 406981, win 24209, options [nop,nop,TS val 4294916294 ecr 157807,nop,nop,sack 2 {454105:464101}{436969:452677},mptcp dss ack 3868162083], length 0
10:18:08.526068 IP 112.26.1.1.43445 > 112.26.1.8.46387: Flags [.], seq 476953:478381, ack 1, win 4017, options [nop,nop,TS val 162770 ecr 4294916224,mptcp dss ack 1720219151 seq 3868507659 subseq 476953 len 1428 csum 0xdc60], length 1428
10:18:08.539501 IP 112.26.1.1.43445 > 112.26.1.8.46387: Flags [.], seq 478381:479809, ack 1, win 4017, options [nop,nop,TS val 162916 ecr 4294916294,mptcp dss ack 1720219151 seq 3868514799 subseq 478381 len 1428 csum 0x50fa], length 1428
10:18:08.563326 IP 112.26.1.8.46387 > 112.26.1.1.43445: Flags [.], ack 406981, win 24209, options [nop,nop,TS val 4294916401 ecr 157807,nop,nop,sack 2 {454105:465529}{436969:452677},mptcp dss ack 3868162083], length 0
10:18:08.584389 IP 112.26.1.1.43445 > 112.26.1.8.46387: Flags [.], seq 479809:481237, ack 1, win 4017, options [nop,nop,TS val 162960 ecr 4294916401,mptcp dss ack 1720219151 seq 3868516227 subseq 479809 len 1428 csum 0x26c], length 1428
10:18:08.661357 IP 112.26.1.1.43445 > 112.26.1.8.46387: Flags [.], seq 478381:479809, ack 1, win 4017, options [nop,nop,TS val 162916 ecr 4294916294,mptcp dss ack 1720219151 seq 3868514799 subseq 478381 len 1428 csum 0x50fa], length 1428
10:18:08.737622 IP 112.26.1.1.43445 > 112.26.1.8.46387: Flags [.], seq 479809:481237, ack 1, win 4017, options [nop,nop,TS val 162960 ecr 4294916401,mptcp dss ack 1720219151 seq 3868516227 subseq 479809 len 1428 csum 0x26c], length 1428
10:18:08.856002 IP 112.26.1.8.46387 > 112.26.1.1.43445: Flags [.], ack 406981, win 24209, options [nop,nop,TS val 4294916770 ecr 157807,nop,nop,sack 2 {466957:468385}{454105:465529},mptcp dss ack 3868162083], length 0
10:18:08.856219 IP 112.26.1.1.43445 > 112.26.1.8.46387: Flags [.], seq 465529:466957, ack 1, win 4017, options [nop,nop,TS val 163232 ecr 4294916770,mptcp dss ack 1720219151 seq 3868446255 subseq 465529 len 1428 csum 0xeab8], length 1428
10:18:08.877744 IP 112.26.1.1.43445 > 112.26.1.8.46387: Flags [.], seq 465529:466957, ack 1, win 4017, options [nop,nop,TS val 163232 ecr 4294916770,mptcp dss ack 1720219151 seq 3868446255 subseq 465529 len 1428 csum 0xeab8], length 1428
10:18:08.988172 IP 112.26.1.8.46387 > 112.26.1.1.43445: Flags [.], ack 406981, win 24209, options [nop,nop,TS val 4294916968 ecr 157807,nop,nop,sack 2 {466957:469813}{454105:465529},mptcp dss ack 3868162083], length 0
10:18:09.078640 IP 112.26.1.8.46387 > 112.26.1.1.43445: Flags [.], ack 452677, win 21693, options [nop,nop,TS val 4294917273 ecr 162200,nop,nop,sack 2 {466957:469813}{454105:465529},mptcp dss ack 3868376283], length 0
10:18:09.078965 IP 112.26.1.1.43445 > 112.26.1.8.46387: Flags [.], seq 481237:482665, ack 1, win 4017, options [nop,nop,TS val 163455 ecr 4294916968,mptcp dss ack 1720219151 seq 3868524795 subseq 481237 len 1428 csum 0xfa09], length 1428
10:18:09.079081 IP 112.26.1.1.43445 > 112.26.1.8.46387: Flags [.], seq 482665:484093, ack 1, win 4017, options [nop,nop,TS val 163455 ecr 4294917273,mptcp dss ack 1720219151 seq 3868526223 subseq 482665 len 1428 csum 0xb4f9], length 1428
10:18:09.093829 IP 112.26.1.1.43445 > 112.26.1.8.46387: Flags [.], seq 481237:482665, ack 1, win 4017, options [nop,nop,TS val 163455 ecr 4294916968,mptcp dss ack 1720219151 seq 3868524795 subseq 481237 len 1428 csum 0xfa09], length 1428
10:18:09.198919 IP 112.26.1.1.43445 > 112.26.1.8.46387: Flags [.], seq 482665:484093, ack 1, win 4017, options [nop,nop,TS val 163455 ecr 4294917273,mptcp dss ack 1720219151 seq 3868526223 subseq 482665 len 1428 csum 0xb4f9], length 1428
10:18:09.213181 IP 112.26.1.8.46387 > 112.26.1.1.43445: Flags [.], ack 465529, win 23901, options [nop,nop,TS val 4294917347 ecr 162200,nop,nop,sack 1 {466957:469813},mptcp dss ack 3868381995], length 0
10:18:09.328173 IP 112.26.1.8.46387 > 112.26.1.1.43445: Flags [.], ack 465529, win 23965, options [nop,nop,TS val 4294917450 ecr 162200,nop,nop,sack 1 {466957:471241},mptcp dss ack 3868381995], length 0
10:18:09.430971 IP 112.26.1.8.46387 > 112.26.1.1.43445: Flags [.], ack 465529, win 23965, options [nop,nop,TS val 4294917566 ecr 162200,nop,nop,sack 1 {466957:472669},mptcp dss ack 3868381995], length 0
10:18:23.287493 IP 112.26.1.1.43445 > 112.26.1.8.46387: Flags [.], seq 465529:466957, ack 1, win 4017, options [nop,nop,TS val 177664 ecr 4294917566,mptcp dss ack 1720219151 seq 3868446255 subseq 465529 len 1428 csum 0xeab8], length 1428
10:18:23.380151 IP 112.26.1.1.43445 > 112.26.1.8.46387: Flags [.], seq 465529:466957, ack 1, win 4017, options [nop,nop,TS val 177664 ecr 4294917566,mptcp dss ack 1720219151 seq 3868446255 subseq 465529 len 1428 csum 0xeab8], length 1428
10:18:23.512092 IP 112.26.1.8.46387 > 112.26.1.1.43445: Flags [.], ack 472669, win 24224, options [nop,nop,TS val 4294932092 ecr 177664,mptcp dss ack 3868499091], length 0
10:18:23.512334 IP 112.26.1.1.43445 > 112.26.1.8.46387: Flags [.], seq 484093:485521, ack 1, win 4017, options [nop,nop,TS val 177889 ecr 4294932092,mptcp dss ack 1720219151 seq 3868470531 subseq 484093 len 1428 csum 0x9114], length 1428
10:18:23.512397 IP 112.26.1.1.43445 > 112.26.1.8.46387: Flags [.], seq 485521:486949, ack 1, win 4017, options [nop,nop,TS val 177889 ecr 4294932092,mptcp dss ack 1720219151 seq 3868471959 subseq 485521 len 1428 csum 0x8d20], length 1428
10:18:23.666182 IP 112.26.1.1.43445 > 112.26.1.8.46387: Flags [.], seq 484093:485521, ack 1, win 4017, options [nop,nop,TS val 177889 ecr 4294932092,mptcp dss ack 1720219151 seq 3868470531 subseq 484093 len 1428 csum 0x9114], length 1428
10:18:23.717014 IP 112.26.1.1.43445 > 112.26.1.8.46387: Flags [.], seq 485521:486949, ack 1, win 4017, options [nop,nop,TS val 177889 ecr 4294932092,mptcp dss ack 1720219151 seq 3868471959 subseq 485521 len 1428 csum 0x8d20], length 1428
10:18:23.848616 IP 112.26.1.8.46387 > 112.26.1.1.43445: Flags [.], ack 472669, win 24224, options [nop,nop,TS val 4294932326 ecr 177664,nop,nop,sack 1 {484093:485521},mptcp dss ack 3868499091], length 0
10:18:23.848892 IP 112.26.1.1.43445 > 112.26.1.8.46387: Flags [.], seq 472669:474097, ack 1, win 4017, options [nop,nop,TS val 178225 ecr 4294932326,mptcp dss ack 1720219151 seq 3868494807 subseq 472669 len 1428 csum 0x21ef], length 1428
10:18:23.863462 IP 112.26.1.1.43445 > 112.26.1.8.46387: Flags [.], seq 472669:474097, ack 1, win 4017, options [nop,nop,TS val 178225 ecr 4294932326,mptcp dss ack 1720219151 seq 3868494807 subseq 472669 len 1428 csum 0x21ef], length 1428
10:18:23.945104 IP 112.26.1.8.46387 > 112.26.1.1.43445: Flags [.], ack 472669, win 24224, options [nop,nop,TS val 4294932425 ecr 177664,nop,nop,sack 1 {484093:486949},mptcp dss ack 3868499091], length 0
10:18:23.945321 IP 112.26.1.1.43445 > 112.26.1.8.46387: Flags [.], seq 474097:475525, ack 1, win 4017, options [nop,nop,TS val 178321 ecr 4294932425,mptcp dss ack 1720219151 seq 3868499091 subseq 474097 len 1428 csum 0x1ba], length 1428
10:18:23.975903 IP 112.26.1.1.43445 > 112.26.1.8.46387: Flags [.], seq 474097:475525, ack 1, win 4017, options [nop,nop,TS val 178321 ecr 4294932425,mptcp dss ack 1720219151 seq 3868499091 subseq 474097 len 1428 csum 0x1ba], length 1428
10:18:24.097784 IP 112.26.1.8.46387 > 112.26.1.1.43445: Flags [.], ack 474097, win 24224, options [nop,nop,TS val 4294932530 ecr 178225,nop,nop,sack 1 {484093:486949},mptcp dss ack 3868499091], length 0
10:18:24.098010 IP 112.26.1.1.43445 > 112.26.1.8.46387: Flags [.], seq 475525:476953, ack 1, win 4017, options [nop,nop,TS val 178474 ecr 4294932530,mptcp dss ack 1720219151 seq 3868503375 subseq 475525 len 1428 csum 0x694e], length 1428
10:18:24.098049 IP 112.26.1.1.43445 > 112.26.1.8.46387: Flags [.], seq 476953:478381, ack 1, win 4017, options [nop,nop,TS val 178474 ecr 4294932530,mptcp dss ack 1720219151 seq 3868507659 subseq 476953 len 1428 csum 0xdc60], length 1428
10:18:24.115685 IP 112.26.1.1.43445 > 112.26.1.8.46387: Flags [.], seq 475525:476953, ack 1, win 4017, options [nop,nop,TS val 178474 ecr 4294932530,mptcp dss ack 1720219151 seq 3868503375 subseq 475525 len 1428 csum 0x694e], length 1428
10:18:24.209337 IP 112.26.1.8.46387 > 112.26.1.1.43445: Flags [.], ack 475525, win 23979, options [nop,nop,TS val 4294932637 ecr 178321,nop,nop,sack 1 {484093:486949},mptcp dss ack 3868514799], length 0
10:18:24.209566 IP 112.26.1.1.43445 > 112.26.1.8.46387: Flags [.], seq 478381:479809, ack 1, win 4017, options [nop,nop,TS val 178586 ecr 4294932637,mptcp dss ack 1720219151 seq 3868514799 subseq 478381 len 1428 csum 0x50fa], length 1428
10:18:24.209616 IP 112.26.1.1.43445 > 112.26.1.8.46387: Flags [.], seq 479809:481237, ack 1, win 4017, options [nop,nop,TS val 178586 ecr 4294932637,mptcp dss ack 1720219151 seq 3868516227 subseq 479809 len 1428 csum 0x26c], length 1428
10:18:24.221097 IP 112.26.1.1.43445 > 112.26.1.8.46387: Flags [.], seq 476953:478381, ack 1, win 4017, options [nop,nop,TS val 178474 ecr 4294932530,mptcp dss ack 1720219151 seq 3868507659 subseq 476953 len 1428 csum 0xdc60], length 1428
10:18:24.287928 IP 112.26.1.8.46387 > 112.26.1.1.43445: Flags [.], ack 476953, win 23979, options [nop,nop,TS val 4294932818 ecr 178474,nop,nop,sack 1 {484093:486949},mptcp dss ack 3868514799], length 0
10:18:24.288098 IP 112.26.1.1.43445 > 112.26.1.8.46387: Flags [.], seq 481237:482665, ack 1, win 4017, options [nop,nop,TS val 178664 ecr 4294932818,mptcp dss ack 1720219151 seq 3868524795 subseq 481237 len 1428 csum 0xfa09], length 1428
10:18:24.288138 IP 112.26.1.1.43445 > 112.26.1.8.46387: Flags [.], seq 482665:484093, ack 1, win 4017, options [nop,nop,TS val 178664 ecr 4294932818,mptcp dss ack 1720219151 seq 3868526223 subseq 482665 len 1428 csum 0xb4f9], length 1428
10:18:24.405807 IP 112.26.1.1.43445 > 112.26.1.8.46387: Flags [.], seq 478381:479809, ack 1, win 4017, options [nop,nop,TS val 178586 ecr 4294932637,mptcp dss ack 1720219151 seq 3868514799 subseq 478381 len 1428 csum 0x50fa], length 1428
10:18:24.452758 IP 112.26.1.8.46387 > 112.26.1.1.43445: Flags [.], ack 478381, win 23979, options [nop,nop,TS val 4294933003 ecr 178474,nop,nop,sack 1 {484093:486949},mptcp dss ack 3868514799], length 0
10:18:24.568158 IP 112.26.1.1.43445 > 112.26.1.8.46387: Flags [.], seq 479809:481237, ack 1, win 4017, options [nop,nop,TS val 178586 ecr 4294932637,mptcp dss ack 1720219151 seq 3868516227 subseq 479809 len 1428 csum 0x26c], length 1428
10:18:24.628019 IP 112.26.1.8.46387 > 112.26.1.1.43445: Flags [.], ack 479809, win 23957, options [nop,nop,TS val 4294933162 ecr 178586,nop,nop,sack 1 {484093:486949},mptcp dss ack 3868516227], length 0
10:18:24.710049 IP 112.26.1.1.43445 > 112.26.1.8.46387: Flags [.], seq 481237:482665, ack 1, win 4017, options [nop,nop,TS val 178664 ecr 4294932818,mptcp dss ack 1720219151 seq 3868524795 subseq 481237 len 1428 csum 0xfa09], length 1428
10:18:24.793467 IP 112.26.1.1.43445 > 112.26.1.8.46387: Flags [.], seq 482665:484093, ack 1, win 4017, options [nop,nop,TS val 178664 ecr 4294932818,mptcp dss ack 1720219151 seq 3868526223 subseq 482665 len 1428 csum 0xb4f9], length 1428
10:18:24.918995 IP 112.26.1.8.46387 > 112.26.1.1.43445: Flags [.], ack 481237, win 23801, options [nop,nop,TS val 4294933372 ecr 178586,nop,nop,sack 1 {484093:486949},mptcp dss ack 3868526223], length 0
10:18:25.056118 IP 112.26.1.8.46387 > 112.26.1.1.43445: Flags [.], ack 482665, win 24478, options [nop,nop,TS val 4294933491 ecr 178664,nop,nop,sack 1 {484093:486949},mptcp dss ack 3868620471], length 0
10:18:25.154297 IP 112.26.1.8.46387 > 112.26.1.1.43445: Flags [.], ack 486949, win 24478, options [nop,nop,TS val 4294933653 ecr 178664,mptcp dss ack 3868620471], length 0
10:18:25.154512 IP 112.26.1.1.43445 > 112.26.1.8.46387: Flags [.], seq 486949:488377, ack 1, win 4017, options [nop,nop,TS val 179531 ecr 4294933653,mptcp dss ack 1720219151 seq 3868674735 subseq 486949 len 1428 csum 0x18d1], length 1428
10:18:25.154627 IP 112.26.1.1.43445 > 112.26.1.8.46387: Flags [.], seq 488377:489805, ack 1, win 4017, options [nop,nop,TS val 179531 ecr 4294933653,mptcp dss ack 1720219151 seq 3868676163 subseq 488377 len 1428 csum 0xab2e], length 1428
10:18:25.154733 IP 112.26.1.1.43445 > 112.26.1.8.46387: Flags [.], seq 489805:491233, ack 1, win 4017, options [nop,nop,TS val 179531 ecr 4294933653,mptcp dss ack 1720219151 seq 3868677591 subseq 489805 len 1428 csum 0x2f61], length 1428
10:18:25.154800 IP 112.26.1.1.43445 > 112.26.1.8.46387: Flags [.], seq 491233:492661, ack 1, win 4017, options [nop,nop,TS val 179531 ecr 4294933653,mptcp dss ack 1720219151 seq 3868679019 subseq 491233 len 1428 csum 0x596f], length 1428
10:18:25.154890 IP 112.26.1.1.43445 > 112.26.1.8.46387: Flags [.], seq 492661:494089, ack 1, win 4017, options [nop,nop,TS val 179531 ecr 4294933653,mptcp dss ack 1720219151 seq 3868680447 subseq 492661 len 1428 csum 0x96cf], length 1428
10:18:25.154954 IP 112.26.1.1.43445 > 112.26.1.8.46387: Flags [.], seq 494089:495517, ack 1, win 4017, options [nop,nop,TS val 179531 ecr 4294933653,mptcp dss ack 1720219151 seq 3868681875 subseq 494089 len 1428 csum 0x5d21], length 1428
10:18:25.155046 IP 112.26.1.1.43445 > 112.26.1.8.46387: Flags [.], seq 495517:496945, ack 1, win 4017, options [nop,nop,TS val 179531 ecr 4294933653,mptcp dss ack 1720219151 seq 3868683303 subseq 495517 len 1428 csum 0x194a], length 1428
10:18:25.155108 IP 112.26.1.1.43445 > 112.26.1.8.46387: Flags [.], seq 496945:498373, ack 1, win 4017, options [nop,nop,TS val 179531 ecr 4294933653,mptcp dss ack 1720219151 seq 3868684731 subseq 496945 len 1428 csum 0xfbd6], length 1428
10:18:25.155228 IP 112.26.1.1.43445 > 112.26.1.8.46387: Flags [.], seq 498373:499801, ack 1, win 4017, options [nop,nop,TS val 179532 ecr 4294933653,mptcp dss ack 1720219151 seq 3868686159 subseq 498373 len 1428 csum 0x8ee4], length 1428
10:18:25.155293 IP 112.26.1.1.43445 > 112.26.1.8.46387: Flags [.], seq 499801:501229, ack 1, win 4017, options [nop,nop,TS val 179532 ecr 4294933653,mptcp dss ack 1720219151 seq 3868687587 subseq 499801 len 1428 csum 0xe00a], length 1428
10:18:25.161460 IP 112.26.1.1.43445 > 112.26.1.8.46387: Flags [.], seq 486949:488377, ack 1, win 4017, options [nop,nop,TS val 179531 ecr 4294933653,mptcp dss ack 1720219151 seq 3868674735 subseq 486949 len 1428 csum 0x18d1], length 1428
10:18:25.276930 IP 112.26.1.8.46387 > 112.26.1.1.43445: Flags [.], ack 488377, win 24478, options [nop,nop,TS val 4294933835 ecr 179531,mptcp dss ack 3868620471], length 0
10:18:25.277130 IP 112.26.1.1.43445 > 112.26.1.8.46387: Flags [.], seq 501229:502657, ack 1, win 4017, options [nop,nop,TS val 179653 ecr 4294933835,mptcp dss ack 1720219151 seq 3868697583 subseq 501229 len 1428 csum 0x90ff], length 1428
10:18:25.277174 IP 112.26.1.1.43445 > 112.26.1.8.46387: Flags [.], seq 502657:504085, ack 1, win 4017, options [nop,nop,TS val 179653 ecr 4294933835,mptcp dss ack 1720219151 seq 3868699011 subseq 502657 len 1428 csum 0xd36c], length 1428
10:18:25.293023 IP 112.26.1.1.43445 > 112.26.1.8.46387: Flags [.], seq 488377:489805, ack 1, win 4017, options [nop,nop,TS val 179531 ecr 4294933653,mptcp dss ack 1720219151 seq 3868676163 subseq 488377 len 1428 csum 0xab2e], length 1428
10:18:25.432027 IP 112.26.1.1.43445 > 112.26.1.8.46387: Flags [.], seq 489805:491233, ack 1, win 4017, options [nop,nop,TS val 179531 ecr 4294933653,mptcp dss ack 1720219151 seq 3868677591 subseq 489805 len 1428 csum 0x2f61], length 1428
10:18:25.456030 IP 112.26.1.8.46387 > 112.26.1.1.43445: Flags [.], ack 489805, win 24478, options [nop,nop,TS val 4294934036 ecr 179531,mptcp dss ack 3868620471], length 0
10:18:25.456292 IP 112.26.1.1.43445 > 112.26.1.8.46387: Flags [.], seq 504085:505513, ack 1, win 4017, options [nop,nop,TS val 179833 ecr 4294934036,mptcp dss ack 1720219151 seq 3868711863 subseq 504085 len 1428 csum 0xf146], length 1428
10:18:25.551817 IP 112.26.1.1.43445 > 112.26.1.8.46387: Flags [.], seq 491233:492661, ack 1, win 4017, options [nop,nop,TS val 179531 ecr 4294933653,mptcp dss ack 1720219151 seq 3868679019 subseq 491233 len 1428 csum 0x596f], length 1428
10:18:25.606395 IP 112.26.1.8.46387 > 112.26.1.1.43445: Flags [.], ack 491233, win 24478, options [nop,nop,TS val 4294934178 ecr 179531,mptcp dss ack 3868620471], length 0
10:18:25.606547 IP 112.26.1.1.43445 > 112.26.1.8.46387: Flags [.], seq 505513:506941, ack 1, win 4017, options [nop,nop,TS val 179983 ecr 4294934178,mptcp dss ack 1720219151 seq 3868713291 subseq 505513 len 1428 csum 0xb546], length 1428
10:18:25.649041 IP 112.26.1.1.43445 > 112.26.1.8.46387: Flags [.], seq 492661:494089, ack 1, win 4017, options [nop,nop,TS val 179531 ecr 4294933653,mptcp dss ack 1720219151 seq 3868680447 subseq 492661 len 1428 csum 0x96cf], length 1428
10:18:25.769663 IP 112.26.1.1.43445 > 112.26.1.8.46387: Flags [.], seq 494089:495517, ack 1, win 4017, options [nop,nop,TS val 179531 ecr 4294933653,mptcp dss ack 1720219151 seq 3868681875 subseq 494089 len 1428 csum 0x5d21], length 1428
10:18:25.860843 IP 112.26.1.8.46387 > 112.26.1.1.43445: Flags [.], ack 492661, win 24478, options [nop,nop,TS val 4294934346 ecr 179531,mptcp dss ack 3868620471], length 0
10:18:25.861094 IP 112.26.1.1.43445 > 112.26.1.8.46387: Flags [.], seq 506941:508369, ack 1, win 4017, options [nop,nop,TS val 180237 ecr 4294934346,mptcp dss ack 1720219151 seq 3868724715 subseq 506941 len 1428 csum 0xc795], length 1428
10:18:25.884422 IP 112.26.1.1.43445 > 112.26.1.8.46387: Flags [.], seq 495517:496945, ack 1, win 4017, options [nop,nop,TS val 179531 ecr 4294933653,mptcp dss ack 1720219151 seq 3868683303 subseq 495517 len 1428 csum 0x194a], length 1428
10:18:26.001253 IP 112.26.1.8.46387 > 112.26.1.1.43445: Flags [.], ack 494089, win 24478, options [nop,nop,TS val 4294934417 ecr 179531,mptcp dss ack 3868620471], length 0
10:18:26.001560 IP 112.26.1.1.43445 > 112.26.1.8.46387: Flags [.], seq 508369:509797, ack 1, win 4017, options [nop,nop,TS val 180377 ecr 4294934417,mptcp dss ack 1720219151 seq 3868731855 subseq 508369 len 1428 csum 0xe41d], length 1428
10:18:26.068409 IP 112.26.1.1.43445 > 112.26.1.8.46387: Flags [.], seq 496945:498373, ack 1, win 4017, options [nop,nop,TS val 179531 ecr 4294933653,mptcp dss ack 1720219151 seq 3868684731 subseq 496945 len 1428 csum 0xfbd6], length 1428
10:18:26.145190 IP 112.26.1.8.46387 > 112.26.1.1.43445: Flags [.], ack 495517, win 24478, options [nop,nop,TS val 4294934586 ecr 179531,mptcp dss ack 3868620471], length 0
10:18:26.145522 IP 112.26.1.1.43445 > 112.26.1.8.46387: Flags [.], seq 509797:511225, ack 1, win 4017, options [nop,nop,TS val 180521 ecr 4294934586,mptcp dss ack 1720219151 seq 3868736139 subseq 509797 len 1428 csum 0xd6e], length 1428
10:18:26.182229 IP 112.26.1.1.43445 > 112.26.1.8.46387: Flags [.], seq 498373:499801, ack 1, win 4017, options [nop,nop,TS val 179532 ecr 4294933653,mptcp dss ack 1720219151 seq 3868686159 subseq 498373 len 1428 csum 0x8ee4], length 1428
10:18:26.250289 IP 112.26.1.8.46387 > 112.26.1.1.43445: Flags [.], ack 496945, win 24478, options [nop,nop,TS val 4294934710 ecr 179531,mptcp dss ack 3868620471], length 0
