10:17:05.167254 IP 112.26.0.8.36004 > 112.26.0.1.43445: Flags [S], seq 604036043, win 65535, options [mss 1460,sackOK,TS val 4294851649 ecr 0,nop,wscale 6,mptcp capable csum {0x5fe731cb2a0ffaa8}], length 0
10:17:05.175323 IP 112.26.0.1.43445 > 112.26.0.8.36004: Flags [S.], seq 3411350881, ack 604036044, win 65535, options [mss 1460,sackOK,TS val 99544 ecr 4294851649,nop,wscale 6,mptcp capable csum {0x95b44a60aabf03a2}], length 0
10:17:05.353804 IP 112.26.0.1.43445 > 112.26.0.8.36004: Flags [S.], seq 3411350881, ack 604036044, win 65535, options [mss 1460,sackOK,TS val 99544 ecr 4294851649,nop,wscale 6,mptcp capable csum {0x95b44a60aabf03a2}], length 0
10:17:05.472426 IP 112.26.0.8.36004 > 112.26.0.1.43445: Flags [.], ack 1, win 1369, options [nop,nop,TS val 4294854113 ecr 99544,mptcp capable csum {0x5fe731cb2a0ffaa8,0x95b44a60aabf03a2},mptcp dss ack 3866414399], length 0
10:17:05.472752 IP 112.26.0.1.43445 > 112.26.0.8.36004: Flags [.], ack 1, win 1339, options [nop,nop,TS val 99849 ecr 4294854113,mptcp add-addr id 3 112.26.1.1,mptcp dss ack 1720219151], length 0
10:17:05.472788 IP 112.26.0.1.43445 > 112.26.0.8.36004: Flags [.], ack 1, win 1339, options [nop,nop,TS val 99849 ecr 4294854113,mptcp add-addr id 5 112.26.3.1,mptcp dss ack 1720219151], length 0
10:17:05.472815 IP 112.26.0.1.43445 > 112.26.0.8.36004: Flags [.], ack 1, win 1339, options [nop,nop,TS val 99849 ecr 4294854113,mptcp add-addr id 6 112.26.2.1,mptcp dss ack 1720219151], length 0
10:17:35.680975 IP 112.26.0.8.36004 > 112.26.0.1.43445: Flags [.], ack 216869, win 21353, options [nop,nop,TS val 4294883551 ecr 128567,mptcp dss ack 3866908299], length 0
10:17:35.681273 IP 112.26.0.1.43445 > 112.26.0.8.36004: Flags [.], seq 235433:236861, ack 1, win 4017, options [nop,nop,TS val 130057 ecr 4294883551,mptcp dss ack 1720219151 seq 3867013971 subseq 235433 len 1428 csum 0x1672], length 1428
10:17:35.706374 IP 112.26.0.1.43445 > 112.26.0.8.36004: Flags [.], seq 232577:234005, ack 1, win 4017, options [nop,nop,TS val 129786 ecr 4294883227,mptcp dss ack 1720219151 seq 3867001119 subseq 232577 len 1428 csum 0x9fb2], length 1428
10:17:35.788960 IP 112.26.0.1.43445 > 112.26.0.8.36004: Flags [.], seq 234005:235433, ack 1, win 4017, options [nop,nop,TS val 129963 ecr 4294883307,mptcp dss ack 1720219151 seq 3867008259 subseq 234005 len 1428 csum 0x918d], length 1428
10:17:56.226907 IP 112.26.0.1.43445 > 112.26.0.8.36004: Flags [.], seq 448205:449633, ack 1, win 4017, options [nop,nop,TS val 150473 ecr 4294903964,mptcp dss ack 1720219151 seq 3867933603 subseq 448205 len 1428 csum 0x841d], length 1428
10:18:18.359224 IP 112.26.0.1.43445 > 112.26.0.8.36004: Flags [.], seq 586721:588149, ack 1, win 4017, options [nop,nop,TS val 172736 ecr 4294918589,mptcp dss ack 1720219151 seq 3868431975 subseq 586721 len 1428 csum 0x59f0], length 1428
10:18:31.247127 IP 112.26.0.1.43445 > 112.26.0.8.36004: Flags [.], seq 738089:739517, ack 1, win 4017, options [nop,nop,TS val 185222 ecr 4294938815,mptcp dss ack 1720219151 seq 3868913211 subseq 738089 len 1428 csum 0x62da], length 1428
10:18:31.271914 IP 112.26.0.8.36004 > 112.26.0.1.43445: Flags [.], ack 718097, win 23991, options [nop,nop,TS val 4294939239 ecr 183985,nop,nop,sack 1 {719525:729521},mptcp dss ack 3868793259], length 0
10:18:31.305129 IP 112.26.0.1.43445 > 112.26.0.8.36004: Flags [.], seq 742373:743801, ack 1, win 4017, options [nop,nop,TS val 185681 ecr 4294939239,mptcp dss ack 1720219151 seq 3868927491 subseq 742373 len 1428 csum 0x6765], length 1428
10:18:31.342478 IP 112.26.0.1.43445 > 112.26.0.8.36004: Flags [.], seq 739517:740945, ack 1, win 4017, options [nop,nop,TS val 185292 ecr 4294938884,mptcp dss ack 1720219151 seq 3868916067 subseq 739517 len 1428 csum 0x88d8], length 1428
10:18:31.459468 IP 112.26.0.1.43445 > 112.26.0.8.36004: Flags [.], seq 740945:742373, ack 1, win 4017, options [nop,nop,TS val 185469 ecr 4294939001,mptcp dss ack 1720219151 seq 3868921779 subseq 740945 len 1428 csum 0x99b4], length 1428
10:18:31.576303 IP 112.26.0.1.43445 > 112.26.0.8.36004: Flags [.], seq 742373:743801, ack 1, win 4017, options [nop,nop,TS val 185681 ecr 4294939239,mptcp dss ack 1720219151 seq 3868927491 subseq 742373 len 1428 csum 0x6765], length 1428
10:18:31.587914 IP 112.26.0.8.36004 > 112.26.0.1.43445: Flags [.], ack 729521, win 23704, options [nop,nop,TS val 4294939665 ecr 184807,mptcp dss ack 3868863231], length 0
10:18:31.588123 IP 112.26.0.1.43445 > 112.26.0.8.36004: Flags [.], seq 743801:745229, ack 1, win 4017, options [nop,nop,TS val 185964 ecr 4294939665,mptcp dss ack 1720219151 seq 3868940343 subseq 743801 len 1428 csum 0x4a72], length 1428
10:18:31.643766 IP 112.26.0.8.36004 > 112.26.0.1.43445: Flags [.], ack 730949, win 24442, options [nop,nop,TS val 4294939810 ecr 184838,mptcp dss ack 3868863231], length 0
10:18:31.644032 IP 112.26.0.1.43445 > 112.26.0.8.36004: Flags [.], seq 745229:746657, ack 1, win 4017, options [nop,nop,TS val 186020 ecr 4294939810,mptcp dss ack 1720219151 seq 3868944627 subseq 745229 len 1428 csum 0xf6f], length 1428
10:18:31.698938 IP 112.26.0.1.43445 > 112.26.0.8.36004: Flags [.], seq 743801:745229, ack 1, win 4017, options [nop,nop,TS val 185964 ecr 4294939665,mptcp dss ack 1720219151 seq 3868940343 subseq 743801 len 1428 csum 0x4a72], length 1428
10:18:31.803121 IP 112.26.0.1.43445 > 112.26.0.8.36004: Flags [.], seq 745229:746657, ack 1, win 4017, options [nop,nop,TS val 186020 ecr 4294939810,mptcp dss ack 1720219151 seq 3868944627 subseq 745229 len 1428 csum 0xf6f], length 1428
10:18:31.826585 IP 112.26.0.8.36004 > 112.26.0.1.43445: Flags [.], ack 732377, win 24442, options [nop,nop,TS val 4294939983 ecr 185064,mptcp dss ack 3868863231], length 0
10:18:31.826976 IP 112.26.0.1.43445 > 112.26.0.8.36004: Flags [.], seq 746657:748085, ack 1, win 4017, options [nop,nop,TS val 186203 ecr 4294939983,mptcp dss ack 1720219151 seq 3868954623 subseq 746657 len 1428 csum 0xba46], length 1428
10:18:31.919821 IP 112.26.0.1.43445 > 112.26.0.8.36004: Flags [.], seq 746657:748085, ack 1, win 4017, options [nop,nop,TS val 186203 ecr 4294939983,mptcp dss ack 1720219151 seq 3868954623 subseq 746657 len 1428 csum 0xba46], length 1428
10:18:32.050115 IP 112.26.0.8.36004 > 112.26.0.1.43445: Flags [.], ack 733805, win 24442, options [nop,nop,TS val 4294940064 ecr 185064,mptcp dss ack 3868863231], length 0
10:18:32.050307 IP 112.26.0.1.43445 > 112.26.0.8.36004: Flags [.], seq 748085:749513, ack 1, win 4017, options [nop,nop,TS val 186426 ecr 4294940064,mptcp dss ack 1720219151 seq 3868961763 subseq 748085 len 1428 csum 0xe162], length 1428
10:18:32.050352 IP 112.26.0.1.43445 > 112.26.0.8.36004: Flags [.], seq 749513:750941, ack 1, win 4017, options [nop,nop,TS val 186426 ecr 4294940064,mptcp dss ack 1720219151 seq 3868963191 subseq 749513 len 1428 csum 0x43ef], length 1428
10:18:32.074167 IP 112.26.0.1.43445 > 112.26.0.8.36004: Flags [.], seq 748085:749513, ack 1, win 4017, options [nop,nop,TS val 186426 ecr 4294940064,mptcp dss ack 1720219151 seq 3868961763 subseq 748085 len 1428 csum 0xe162], length 1428
10:18:32.165520 IP 112.26.0.1.43445 > 112.26.0.8.36004: Flags [.], seq 749513:750941, ack 1, win 4017, options [nop,nop,TS val 186426 ecr 4294940064,mptcp dss ack 1720219151 seq 3868963191 subseq 749513 len 1428 csum 0x43ef], length 1428
10:18:32.230587 IP 112.26.0.8.36004 > 112.26.0.1.43445: Flags [.], ack 736661, win 24442, options [nop,nop,TS val 4294940162 ecr 185222,mptcp dss ack 3868863231], length 0
10:18:32.230811 IP 112.26.0.1.43445 > 112.26.0.8.36004: Flags [.], seq 750941:752369, ack 1, win 4017, options [nop,nop,TS val 186607 ecr 4294940162,mptcp dss ack 1720219151 seq 3868970331 subseq 750941 len 1428 csum 0x8861], length 1428
10:18:32.230857 IP 112.26.0.1.43445 > 112.26.0.8.36004: Flags [.], seq 752369:753797, ack 1, win 4017, options [nop,nop,TS val 186607 ecr 4294940162,mptcp dss ack 1720219151 seq 3868971759 subseq 752369 len 1428 csum 0x3157], length 1428
10:18:32.267465 IP 112.26.0.1.43445 > 112.26.0.8.36004: Flags [.], seq 750941:752369, ack 1, win 4017, options [nop,nop,TS val 186607 ecr 4294940162,mptcp dss ack 1720219151 seq 3868970331 subseq 750941 len 1428 csum 0x8861], length 1428
10:18:32.363514 IP 112.26.0.8.36004 > 112.26.0.1.43445: Flags [.], ack 738089, win 24442, options [nop,nop,TS val 4294940341 ecr 185222,mptcp dss ack 3868863231], length 0
10:18:32.363832 IP 112.26.0.1.43445 > 112.26.0.8.36004: Flags [.], seq 753797:755225, ack 1, win 4017, options [nop,nop,TS val 186740 ecr 4294940341,mptcp dss ack 1720219151 seq 3868974615 subseq 753797 len 1428 csum 0x9954], length 1428
10:18:32.379841 IP 112.26.0.1.43445 > 112.26.0.8.36004: Flags [.], seq 752369:753797, ack 1, win 4017, options [nop,nop,TS val 186607 ecr 4294940162,mptcp dss ack 1720219151 seq 3868971759 subseq 752369 len 1428 csum 0x3157], length 1428
10:18:32.478705 IP 112.26.0.1.43445 > 112.26.0.8.36004: Flags [.], seq 753797:755225, ack 1, win 4017, options [nop,nop,TS val 186740 ecr 4294940341,mptcp dss ack 1720219151 seq 3868974615 subseq 753797 len 1428 csum 0x9954], length 1428
10:18:32.506902 IP 112.26.0.8.36004 > 112.26.0.1.43445: Flags [.], ack 739517, win 24442, options [nop,nop,TS val 4294940397 ecr 185222,mptcp dss ack 3868863231], length 0
10:18:32.507173 IP 112.26.0.1.43445 > 112.26.0.8.36004: Flags [.], seq 755225:756653, ack 1, win 4017, options [nop,nop,TS val 186883 ecr 4294940397,mptcp dss ack 1720219151 seq 3868978899 subseq 755225 len 1428 csum 0xb978], length 1428
10:18:32.595880 IP 112.26.0.8.36004 > 112.26.0.1.43445: Flags [.], ack 740945, win 24442, options [nop,nop,TS val 4294940563 ecr 185292,mptcp dss ack 3868863231], length 0
10:18:32.596125 IP 112.26.0.1.43445 > 112.26.0.8.36004: Flags [.], seq 756653:758081, ack 1, win 4017, options [nop,nop,TS val 186972 ecr 4294940563,mptcp dss ack 1720219151 seq 3868981755 subseq 756653 len 1428 csum 0x306d], length 1428
10:18:32.596171 IP 112.26.0.1.43445 > 112.26.0.8.36004: Flags [.], seq 758081:759509, ack 1, win 4017, options [nop,nop,TS val 186972 ecr 4294940563,mptcp dss ack 1720219151 seq 3868983183 subseq 758081 len 1428 csum 0xc905], length 1428
10:18:32.624606 IP 112.26.0.1.43445 > 112.26.0.8.36004: Flags [.], seq 755225:756653, ack 1, win 4017, options [nop,nop,TS val 186883 ecr 4294940397,mptcp dss ack 1720219151 seq 3868978899 subseq 755225 len 1428 csum 0xb978], length 1428
10:18:32.745913 IP 112.26.0.1.43445 > 112.26.0.8.36004: Flags [.], seq 756653:758081, ack 1, win 4017, options [nop,nop,TS val 186972 ecr 4294940563,mptcp dss ack 1720219151 seq 3868981755 subseq 756653 len 1428 csum 0x306d], length 1428
10:18:32.803449 IP 112.26.0.1.43445 > 112.26.0.8.36004: Flags [.], seq 758081:759509, ack 1, win 4017, options [nop,nop,TS val 186972 ecr 4294940563,mptcp dss ack 1720219151 seq 3868983183 subseq 758081 len 1428 csum 0xc905], length 1428
10:18:33.120963 IP 112.26.0.8.36004 > 112.26.0.1.43445: Flags [.], ack 742373, win 24442, options [nop,nop,TS val 4294941042 ecr 185469,nop,nop,sack 1 {743801:745229},mptcp dss ack 3868863231], length 0
10:18:33.121270 IP 112.26.0.1.43445 > 112.26.0.8.36004: Flags [.], seq 759509:760937, ack 1, win 4017, options [nop,nop,TS val 187497 ecr 4294941042,mptcp dss ack 1720219151 seq 3869013171 subseq 759509 len 1428 csum 0xe65e], length 1428
10:18:33.121307 IP 112.26.0.1.43445 > 112.26.0.8.36004: Flags [.], seq 760937:762365, ack 1, win 4017, options [nop,nop,TS val 187497 ecr 4294941042,mptcp dss ack 1720219151 seq 3869014599 subseq 760937 len 1428 csum 0x99f3], length 1428
10:18:33.136688 IP 112.26.0.1.43445 > 112.26.0.8.36004: Flags [.], seq 759509:760937, ack 1, win 4017, options [nop,nop,TS val 187497 ecr 4294941042,mptcp dss ack 1720219151 seq 3869013171 subseq 759509 len 1428 csum 0xe65e], length 1428
10:18:33.215760 IP 112.26.0.8.36004 > 112.26.0.1.43445: Flags [.], ack 742373, win 24442, options [nop,nop,TS val 4294941198 ecr 185469,nop,nop,sack 1 {743801:746657},mptcp dss ack 3868863231], length 0
10:18:33.235324 IP 112.26.0.1.43445 > 112.26.0.8.36004: Flags [.], seq 762365:763793, ack 1, win 4017, options [nop,nop,TS val 187611 ecr 4294941198,mptcp dss ack 1720219151 seq 3869021739 subseq 762365 len 1428 csum 0x461b], length 1428
10:18:33.242982 IP 112.26.0.1.43445 > 112.26.0.8.36004: Flags [.], seq 760937:762365, ack 1, win 4017, options [nop,nop,TS val 187497 ecr 4294941042,mptcp dss ack 1720219151 seq 3869014599 subseq 760937 len 1428 csum 0x99f3], length 1428
10:18:33.354645 IP 112.26.0.1.43445 > 112.26.0.8.36004: Flags [.], seq 762365:763793, ack 1, win 4017, options [nop,nop,TS val 187611 ecr 4294941198,mptcp dss ack 1720219151 seq 3869021739 subseq 762365 len 1428 csum 0x461b], length 1428
10:18:33.444353 IP 112.26.0.8.36004 > 112.26.0.1.43445: Flags [.], ack 742373, win 24442, options [nop,nop,TS val 4294941322 ecr 185469,nop,nop,sack 1 {743801:748085},mptcp dss ack 3868863231], length 0
10:18:33.526836 IP 112.26.0.1.43445 > 112.26.0.8.36004: Flags [.], seq 763793:765221, ack 1, win 4017, options [nop,nop,TS val 187903 ecr 4294941322,mptcp dss ack 1720219151 seq 3869031735 subseq 763793 len 1428 csum 0xa524], length 1428
10:18:33.538878 IP 112.26.0.1.43445 > 112.26.0.8.36004: Flags [.], seq 763793:765221, ack 1, win 4017, options [nop,nop,TS val 187903 ecr 4294941322,mptcp dss ack 1720219151 seq 3869031735 subseq 763793 len 1428 csum 0xa524], length 1428
10:18:33.603229 IP 112.26.0.8.36004 > 112.26.0.1.43445: Flags [.], ack 742373, win 24056, options [nop,nop,TS val 4294941581 ecr 185469,nop,nop,sack 1 {743801:750941},mptcp dss ack 3868907499], length 0
10:18:33.618873 IP 112.26.0.1.43445 > 112.26.0.8.36004: Flags [.], seq 765221:766649, ack 1, win 4017, options [nop,nop,TS val 187995 ecr 4294941581,mptcp dss ack 1720219151 seq 3869037447 subseq 765221 len 1428 csum 0x3544], length 1428
10:18:33.618960 IP 112.26.0.1.43445 > 112.26.0.8.36004: Flags [.], seq 766649:768077, ack 1, win 4017, options [nop,nop,TS val 187995 ecr 4294941581,mptcp dss ack 1720219151 seq 3869038875 subseq 766649 len 1428 csum 0x3e25], length 1428
10:18:33.642253 IP 112.26.0.1.43445 > 112.26.0.8.36004: Flags [.], seq 765221:766649, ack 1, win 4017, options [nop,nop,TS val 187995 ecr 4294941581,mptcp dss ack 1720219151 seq 3869037447 subseq 765221 len 1428 csum 0x3544], length 1428
10:18:33.736773 IP 112.26.0.8.36004 > 112.26.0.1.43445: Flags [.], ack 742373, win 24056, options [nop,nop,TS val 4294941648 ecr 185469,nop,nop,sack 1 {743801:752369},mptcp dss ack 3868907499], length 0
10:18:33.742660 IP 112.26.0.1.43445 > 112.26.0.8.36004: Flags [.], seq 766649:768077, ack 1, win 4017, options [nop,nop,TS val 187995 ecr 4294941581,mptcp dss ack 1720219151 seq 3869038875 subseq 766649 len 1428 csum 0x3e25], length 1428
10:18:33.808964 IP 112.26.0.1.43445 > 112.26.0.8.36004: Flags [.], seq 768077:769505, ack 1, win 4017, options [nop,nop,TS val 188185 ecr 4294941648,mptcp dss ack 1720219151 seq 3869048871 subseq 768077 len 1428 csum 0x3c1a], length 1428
10:18:33.851396 IP 112.26.0.1.43445 > 112.26.0.8.36004: Flags [.], seq 768077:769505, ack 1, win 4017, options [nop,nop,TS val 188185 ecr 4294941648,mptcp dss ack 1720219151 seq 3869048871 subseq 768077 len 1428 csum 0x3c1a], length 1428
10:18:33.856702 IP 112.26.0.8.36004 > 112.26.0.1.43445: Flags [.], ack 742373, win 24056, options [nop,nop,TS val 4294941725 ecr 185469,nop,nop,sack 1 {743801:753797},mptcp dss ack 3868907499], length 0
10:18:33.941557 IP 112.26.0.1.43445 > 112.26.0.8.36004: Flags [.], seq 769505:770933, ack 1, win 4017, options [nop,nop,TS val 188318 ecr 4294941725,mptcp dss ack 1720219151 seq 3869056011 subseq 769505 len 1428 csum 0xc242], length 1428
10:18:33.946475 IP 112.26.0.1.43445 > 112.26.0.8.36004: Flags [.], seq 769505:770933, ack 1, win 4017, options [nop,nop,TS val 188318 ecr 4294941725,mptcp dss ack 1720219151 seq 3869056011 subseq 769505 len 1428 csum 0xc242], length 1428
10:18:34.038785 IP 112.26.0.8.36004 > 112.26.0.1.43445: Flags [.], ack 742373, win 24056, options [nop,nop,TS val 4294941955 ecr 185469,nop,nop,sack 2 {755225:756653}{743801:753797},mptcp dss ack 3868907499], length 0
10:18:34.072782 IP 112.26.0.1.43445 > 112.26.0.8.36004: Flags [.], seq 770933:772361, ack 1, win 4017, options [nop,nop,TS val 188449 ecr 4294941955,mptcp dss ack 1720219151 seq 3869060295 subseq 770933 len 1428 csum 0x6a28], length 1428
10:18:34.100358 IP 112.26.0.1.43445 > 112.26.0.8.36004: Flags [.], seq 770933:772361, ack 1, win 4017, options [nop,nop,TS val 188449 ecr 4294941955,mptcp dss ack 1720219151 seq 3869060295 subseq 770933 len 1428 csum 0x6a28], length 1428
10:18:34.148892 IP 112.26.0.8.36004 > 112.26.0.1.43445: Flags [.], ack 742373, win 23981, options [nop,nop,TS val 4294942151 ecr 185469,nop,nop,sack 2 {758081:759509}{755225:756653},mptcp dss ack 3868927491], length 0
10:18:34.149229 IP 112.26.0.1.43445 > 112.26.0.8.36004: Flags [.], seq 742373:743801, ack 1, win 4017, options [nop,nop,TS val 188526 ecr 4294942151,mptcp dss ack 1720219151 seq 3868927491 subseq 742373 len 1428 csum 0x6765], length 1428
10:18:34.204323 IP 112.26.0.1.43445 > 112.26.0.8.36004: Flags [.], seq 742373:743801, ack 1, win 4017, options [nop,nop,TS val 188526 ecr 4294942151,mptcp dss ack 1720219151 seq 3868927491 subseq 742373 len 1428 csum 0x6765], length 1428
10:18:34.425196 IP 112.26.0.8.36004 > 112.26.0.1.43445: Flags [.], ack 742373, win 23981, options [nop,nop,TS val 4294942567 ecr 185469,nop,nop,sack 2 {758081:760937}{755225:756653},mptcp dss ack 3868927491], length 0
10:18:34.541912 IP 112.26.0.8.36004 > 112.26.0.1.43445: Flags [.], ack 742373, win 23981, options [nop,nop,TS val 4294942651 ecr 185469,nop,nop,sack 2 {758081:762365}{755225:756653},mptcp dss ack 3868927491], length 0
10:18:34.542263 IP 112.26.0.1.43445 > 112.26.0.8.36004: Flags [.], seq 753797:755225, ack 1, win 4017, options [nop,nop,TS val 188918 ecr 4294942651,mptcp dss ack 1720219151 seq 3868974615 subseq 753797 len 1428 csum 0x9954], length 1428
10:18:34.558421 IP 112.26.0.1.43445 > 112.26.0.8.36004: Flags [.], seq 753797:755225, ack 1, win 4017, options [nop,nop,TS val 188918 ecr 4294942651,mptcp dss ack 1720219151 seq 3868974615 subseq 753797 len 1428 csum 0x9954], length 1428
10:18:34.616285 IP 112.26.0.8.36004 > 112.26.0.1.43445: Flags [.], ack 742373, win 23981, options [nop,nop,TS val 4294942731 ecr 185469,nop,nop,sack 2 {758081:763793}{755225:756653},mptcp dss ack 3868927491], length 0
10:18:34.616653 IP 112.26.0.1.43445 > 112.26.0.8.36004: Flags [.], seq 756653:758081, ack 1, win 4017, options [nop,nop,TS val 188993 ecr 4294942731,mptcp dss ack 1720219151 seq 3868981755 subseq 756653 len 1428 csum 0x306d], length 1428
10:18:34.654103 IP 112.26.0.1.43445 > 112.26.0.8.36004: Flags [.], seq 756653:758081, ack 1, win 4017, options [nop,nop,TS val 188993 ecr 4294942731,mptcp dss ack 1720219151 seq 3868981755 subseq 756653 len 1428 csum 0x306d], length 1428
10:18:34.825462 IP 112.26.0.8.36004 > 112.26.0.1.43445: Flags [.], ack 742373, win 23981, options [nop,nop,TS val 4294942849 ecr 185469,nop,nop,sack 2 {758081:765221}{755225:756653},mptcp dss ack 3868927491], length 0
10:18:34.889059 IP 112.26.0.8.36004 > 112.26.0.1.43445: Flags [.], ack 742373, win 23981, options [nop,nop,TS val 4294942922 ecr 185469,nop,nop,sack 2 {758081:766649}{755225:756653},mptcp dss ack 3868927491], length 0
10:18:34.889397 IP 112.26.0.1.43445 > 112.26.0.8.36004: Flags [.], seq 772361:773789, ack 1, win 4017, options [nop,nop,TS val 189266 ecr 4294942849,mptcp dss ack 1720219151 seq 3869111703 subseq 772361 len 1428 csum 0xe82], length 1428
10:18:34.903633 IP 112.26.0.1.43445 > 112.26.0.8.36004: Flags [.], seq 772361:773789, ack 1, win 4017, options [nop,nop,TS val 189266 ecr 4294942849,mptcp dss ack 1720219151 seq 3869111703 subseq 772361 len 1428 csum 0xe82], length 1428
10:18:34.949180 IP 112.26.0.1.43445 > 112.26.0.8.36004: Flags [.], seq 773789:775217, ack 1, win 4017, options [nop,nop,TS val 189325 ecr 4294942922,mptcp dss ack 1720219151 seq 3869113131 subseq 773789 len 1428 csum 0x1aeb], length 1428
10:18:34.967083 IP 112.26.0.8.36004 > 112.26.0.1.43445: Flags [.], ack 742373, win 23981, options [nop,nop,TS val 4294942962 ecr 185469,nop,nop,sack 2 {758081:768077}{755225:756653},mptcp dss ack 3868927491], length 0
10:18:35.017027 IP 112.26.0.1.43445 > 112.26.0.8.36004: Flags [.], seq 773789:775217, ack 1, win 4017, options [nop,nop,TS val 189325 ecr 4294942922,mptcp dss ack 1720219151 seq 3869113131 subseq 773789 len 1428 csum 0x1aeb], length 1428
10:18:35.038084 IP 112.26.0.8.36004 > 112.26.0.1.43445: Flags [.], ack 742373, win 23981, options [nop,nop,TS val 4294943027 ecr 185469,nop,nop,sack 2 {758081:769505}{755225:756653},mptcp dss ack 3868927491], length 0
10:18:35.038426 IP 112.26.0.1.43445 > 112.26.0.8.36004: Flags [.], seq 775217:776645, ack 1, win 4017, options [nop,nop,TS val 189415 ecr 4294942962,mptcp dss ack 1720219151 seq 3869118843 subseq 775217 len 1428 csum 0x6f0e], length 1428
10:18:35.078736 IP 112.26.0.1.43445 > 112.26.0.8.36004: Flags [.], seq 776645:778073, ack 1, win 4017, options [nop,nop,TS val 189455 ecr 4294943027,mptcp dss ack 1720219151 seq 3869120271 subseq 776645 len 1428 csum 0xb0c3], length 1428
10:18:35.090278 IP 112.26.0.1.43445 > 112.26.0.8.36004: Flags [.], seq 775217:776645, ack 1, win 4017, options [nop,nop,TS val 189415 ecr 4294942962,mptcp dss ack 1720219151 seq 3869118843 subseq 775217 len 1428 csum 0x6f0e], length 1428
10:18:35.135834 IP 112.26.0.8.36004 > 112.26.0.1.43445: Flags [.], ack 742373, win 23981, options [nop,nop,TS val 4294943126 ecr 185469,nop,nop,sack 2 {758081:770933}{755225:756653},mptcp dss ack 3868927491], length 0
10:18:35.255428 IP 112.26.0.1.43445 > 112.26.0.8.36004: Flags [.], seq 776645:778073, ack 1, win 4017, options [nop,nop,TS val 189455 ecr 4294943027,mptcp dss ack 1720219151 seq 3869120271 subseq 776645 len 1428 csum 0xb0c3], length 1428
10:18:35.261412 IP 112.26.0.1.43445 > 112.26.0.8.36004: Flags [.], seq 778073:779501, ack 1, win 4017, options [nop,nop,TS val 189638 ecr 4294943126,mptcp dss ack 1720219151 seq 3869133123 subseq 778073 len 1428 csum 0xc27a], length 1428
10:18:35.368204 IP 112.26.0.8.36004 > 112.26.0.1.43445: Flags [.], ack 742373, win 23981, options [nop,nop,TS val 4294943347 ecr 185469,nop,nop,sack 2 {758081:772361}{755225:756653},mptcp dss ack 3868927491], length 0
10:18:35.387228 IP 112.26.0.1.43445 > 112.26.0.8.36004: Flags [.], seq 778073:779501, ack 1, win 4017, options [nop,nop,TS val 189638 ecr 4294943126,mptcp dss ack 1720219151 seq 3869133123 subseq 778073 len 1428 csum 0xc27a], length 1428
10:18:35.402913 IP 112.26.0.1.43445 > 112.26.0.8.36004: Flags [P.], seq 779501:780929, ack 1, win 4017, options [nop,nop,TS val 189779 ecr 4294943347,mptcp dss ack 1720219151 seq 3869135979 subseq 779501 len 1428 csum 0x49a0], length 1428
10:18:35.449355 IP 112.26.0.1.43445 > 112.26.0.8.36004: Flags [P.], seq 779501:780929, ack 1, win 4017, options [nop,nop,TS val 189779 ecr 4294943347,mptcp dss ack 1720219151 seq 3869135979 subseq 779501 len 1428 csum 0x49a0], length 1428
10:18:35.483783 IP 112.26.0.8.36004 > 112.26.0.1.43445: Flags [.], ack 753797, win 23284, options [nop,nop,TS val 4294943406 ecr 188526,nop,nop,sack 2 {758081:772361}{755225:756653},mptcp dss ack 3868974615], length 0
10:18:35.484154 IP 112.26.0.1.43445 > 112.26.0.8.36004: Flags [.], seq 780929:782357, ack 1, win 4017, options [nop,nop,TS val 189860 ecr 4294943406,mptcp dss ack 1720219151 seq 3869140263 subseq 780929 len 1428 csum 0xe41b], length 1428
10:18:35.548953 IP 112.26.0.1.43445 > 112.26.0.8.36004: Flags [.], seq 780929:782357, ack 1, win 4017, options [nop,nop,TS val 189860 ecr 4294943406,mptcp dss ack 1720219151 seq 3869140263 subseq 780929 len 1428 csum 0xe41b], length 1428
10:18:35.769342 IP 112.26.0.8.36004 > 112.26.0.1.43445: Flags [.], ack 756653, win 23656, options [nop,nop,TS val 4294943890 ecr 188918,nop,nop,sack 1 {758081:772361},mptcp dss ack 3868981755], length 0
10:18:35.769711 IP 112.26.0.1.43445 > 112.26.0.8.36004: Flags [.], seq 782357:783785, ack 1, win 4017, options [nop,nop,TS val 190146 ecr 4294943890,mptcp dss ack 1720219151 seq 3869163111 subseq 782357 len 1428 csum 0x9f7e], length 1428
10:18:35.777383 IP 112.26.0.1.43445 > 112.26.0.8.36004: Flags [.], seq 782357:783785, ack 1, win 4017, options [nop,nop,TS val 190146 ecr 4294943890,mptcp dss ack 1720219151 seq 3869163111 subseq 782357 len 1428 csum 0x9f7e], length 1428
10:18:35.896827 IP 112.26.0.8.36004 > 112.26.0.1.43445: Flags [.], ack 772361, win 23420, options [nop,nop,TS val 4294943957 ecr 188993,mptcp dss ack 3869067435], length 0
10:18:35.897174 IP 112.26.0.1.43445 > 112.26.0.8.36004: Flags [.], seq 783785:785213, ack 1, win 4017, options [nop,nop,TS val 190273 ecr 4294943957,mptcp dss ack 1720219151 seq 3869174535 subseq 783785 len 1428 csum 0xb664], length 1428
10:18:35.925167 IP 112.26.0.1.43445 > 112.26.0.8.36004: Flags [.], seq 783785:785213, ack 1, win 4017, options [nop,nop,TS val 190273 ecr 4294943957,mptcp dss ack 1720219151 seq 3869174535 subseq 783785 len 1428 csum 0xb664], length 1428
10:18:36.118264 IP 112.26.0.8.36004 > 112.26.0.1.43445: Flags [.], ack 773789, win 24445, options [nop,nop,TS val 4294944183 ecr 189266,mptcp dss ack 3869083143], length 0
10:18:36.118643 IP 112.26.0.1.43445 > 112.26.0.8.36004: Flags [.], seq 785213:786641, ack 1, win 4017, options [nop,nop,TS val 190495 ecr 4294944183,mptcp dss ack 1720219151 seq 3869177391 subseq 785213 len 1428 csum 0x1e82], length 1428
10:18:36.132063 IP 112.26.0.1.43445 > 112.26.0.8.36004: Flags [.], seq 785213:786641, ack 1, win 4017, options [nop,nop,TS val 190495 ecr 4294944183,mptcp dss ack 1720219151 seq 3869177391 subseq 785213 len 1428 csum 0x1e82], length 1428
10:18:36.260029 IP 112.26.0.8.36004 > 112.26.0.1.43445: Flags [.], ack 775217, win 24423, options [nop,nop,TS val 4294944287 ecr 189325,mptcp dss ack 3869084571], length 0
10:18:36.260294 IP 112.26.0.1.43445 > 112.26.0.8.36004: Flags [.], seq 786641:788069, ack 1, win 4017, options [nop,nop,TS val 190636 ecr 4294944287,mptcp dss ack 1720219151 seq 3869180247 subseq 786641 len 1428 csum 0x7c51], length 1428
10:18:36.276393 IP 112.26.0.1.43445 > 112.26.0.8.36004: Flags [.], seq 786641:788069, ack 1, win 4017, options [nop,nop,TS val 190636 ecr 4294944287,mptcp dss ack 1720219151 seq 3869180247 subseq 786641 len 1428 csum 0x7c51], length 1428
10:18:36.337631 IP 112.26.0.8.36004 > 112.26.0.1.43445: Flags [.], ack 776645, win 24423, options [nop,nop,TS val 4294944352 ecr 189415,mptcp dss ack 3869084571], length 0
10:18:36.337975 IP 112.26.0.1.43445 > 112.26.0.8.36004: Flags [.], seq 788069:789497, ack 1, win 4017, options [nop,nop,TS val 190714 ecr 4294944352,mptcp dss ack 1720219151 seq 3869183103 subseq 788069 len 1428 csum 0xfd41], length 1428
10:18:36.338048 IP 112.26.0.1.43445 > 112.26.0.8.36004: Flags [.], seq 789497:790925, ack 1, win 4017, options [nop,nop,TS val 190714 ecr 4294944352,mptcp dss ack 1720219151 seq 3869184531 subseq 789497 len 1428 csum 0xfdc6], length 1428
10:18:36.416187 IP 112.26.0.1.43445 > 112.26.0.8.36004: Flags [.], seq 788069:789497, ack 1, win 4017, options [nop,nop,TS val 190714 ecr 4294944352,mptcp dss ack 1720219151 seq 3869183103 subseq 788069 len 1428 csum 0xfd41], length 1428
10:18:36.504687 IP 112.26.0.8.36004 > 112.26.0.1.43445: Flags [.], ack 778073, win 24423, options [nop,nop,TS val 4294944486 ecr 189455,mptcp dss ack 3869084571], length 0
10:18:36.505174 IP 112.26.0.1.43445 > 112.26.0.8.36004: Flags [.], seq 790925:792353, ack 1, win 4017, options [nop,nop,TS val 190881 ecr 4294944486,mptcp dss ack 1720219151 seq 3869187387 subseq 790925 len 1428 csum 0x7ade], length 1428
10:18:36.512526 IP 112.26.0.1.43445 > 112.26.0.8.36004: Flags [.], seq 789497:790925, ack 1, win 4017, options [nop,nop,TS val 190714 ecr 4294944352,mptcp dss ack 1720219151 seq 3869184531 subseq 789497 len 1428 csum 0xfdc6], length 1428
10:18:36.620100 IP 112.26.0.1.43445 > 112.26.0.8.36004: Flags [.], seq 790925:792353, ack 1, win 4017, options [nop,nop,TS val 190881 ecr 4294944486,mptcp dss ack 1720219151 seq 3869187387 subseq 790925 len 1428 csum 0x7ade], length 1428
10:18:36.677883 IP 112.26.0.8.36004 > 112.26.0.1.43445: Flags [.], ack 779501, win 24423, options [nop,nop,TS val 4294944625 ecr 189638,mptcp dss ack 3869084571], length 0
10:18:36.678332 IP 112.26.0.1.43445 > 112.26.0.8.36004: Flags [.], seq 792353:793781, ack 1, win 4017, options [nop,nop,TS val 191055 ecr 4294944625,mptcp dss ack 1720219151 seq 3869193099 subseq 792353 len 1428 csum 0x4dfe], length 1428
10:18:36.722542 IP 112.26.0.1.43445 > 112.26.0.8.36004: Flags [.], seq 792353:793781, ack 1, win 4017, options [nop,nop,TS val 191055 ecr 4294944625,mptcp dss ack 1720219151 seq 3869193099 subseq 792353 len 1428 csum 0x4dfe], length 1428
10:18:36.773064 IP 112.26.0.8.36004 > 112.26.0.1.43445: Flags [.], ack 780929, win 24423, options [nop,nop,TS val 4294944688 ecr 189779,mptcp dss ack 3869084571], length 0
10:18:36.773560 IP 112.26.0.1.43445 > 112.26.0.8.36004: Flags [.], seq 793781:795209, ack 1, win 4017, options [nop,nop,TS val 191150 ecr 4294944688,mptcp dss ack 1720219151 seq 3869203095 subseq 793781 len 1428 csum 0x2e71], length 1428
10:18:36.847473 IP 112.26.0.1.43445 > 112.26.0.8.36004: Flags [.], seq 793781:795209, ack 1, win 4017, options [nop,nop,TS val 191150 ecr 4294944688,mptcp dss ack 1720219151 seq 3869203095 subseq 793781 len 1428 csum 0x2e71], length 1428
10:18:36.951233 IP 112.26.0.8.36004 > 112.26.0.1.43445: Flags [.], ack 782357, win 24423, options [nop,nop,TS val 4294944837 ecr 189860,mptcp dss ack 3869084571], length 0
10:18:36.951633 IP 112.26.0.1.43445 > 112.26.0.8.36004: Flags [.], seq 795209:796637, ack 1, win 4017, options [nop,nop,TS val 191328 ecr 4294944837,mptcp dss ack 1720219151 seq 3869210235 subseq 795209 len 1428 csum 0x816f], length 1428
10:18:36.979490 IP 112.26.0.1.43445 > 112.26.0.8.36004: Flags [.], seq 795209:796637, ack 1, win 4017, options [nop,nop,TS val 191328 ecr 4294944837,mptcp dss ack 1720219151 seq 3869210235 subseq 795209 len 1428 csum 0x816f], length 1428
10:18:37.094640 IP 112.26.0.8.36004 > 112.26.0.1.43445: Flags [.], ack 783785, win 24423, options [nop,nop,TS val 4294945029 ecr 190146,mptcp dss ack 3869084571], length 0
10:18:37.094956 IP 112.26.0.1.43445 > 112.26.0.8.36004: Flags [.], seq 796637:798065, ack 1, win 4017, options [nop,nop,TS val 191471 ecr 4294945029,mptcp dss ack 1720219151 seq 3869221659 subseq 796637 len 1428 csum 0xa45b], length 1428
10:18:37.110853 IP 112.26.0.1.43445 > 112.26.0.8.36004: Flags [.], seq 796637:798065, ack 1, win 4017, options [nop,nop,TS val 191471 ecr 4294945029,mptcp dss ack 1720219151 seq 3869221659 subseq 796637 len 1428 csum 0xa45b], length 1428
10:18:37.305042 IP 112.26.0.8.36004 > 112.26.0.1.43445: Flags [.], ack 785213, win 24423, options [nop,nop,TS val 4294945246 ecr 190273,mptcp dss ack 3869084571], length 0
10:18:37.305537 IP 112.26.0.1.43445 > 112.26.0.8.36004: Flags [.], seq 798065:799493, ack 1, win 4017, options [nop,nop,TS val 191682 ecr 4294945246,mptcp dss ack 1720219151 seq 3869227371 subseq 798065 len 1428 csum 0x20d5], length 1428
10:18:37.330083 IP 112.26.0.1.43445 > 112.26.0.8.36004: Flags [.], seq 798065:799493, ack 1, win 4017, options [nop,nop,TS val 191682 ecr 4294945246,mptcp dss ack 1720219151 seq 3869227371 subseq 798065 len 1428 csum 0x20d5], length 1428
10:18:37.565467 IP 112.26.0.8.36004 > 112.26.0.1.43445: Flags [.], ack 786641, win 24423, options [nop,nop,TS val 4294945525 ecr 190495,mptcp dss ack 3869084571], length 0
10:18:37.565843 IP 112.26.0.1.43445 > 112.26.0.8.36004: Flags [.], seq 799493:800921, ack 1, win 4017, options [nop,nop,TS val 191942 ecr 4294945525,mptcp dss ack 1720219151 seq 3869237367 subseq 799493 len 1428 csum 0xcb5a], length 1428
10:18:37.580459 IP 112.26.0.1.43445 > 112.26.0.8.36004: Flags [.], seq 799493:800921, ack 1, win 4017, options [nop,nop,TS val 191942 ecr 4294945525,mptcp dss ack 1720219151 seq 3869237367 subseq 799493 len 1428 csum 0xcb5a], length 1428
10:18:37.696752 IP 112.26.0.8.36004 > 112.26.0.1.43445: Flags [.], ack 788069, win 24423, options [nop,nop,TS val 4294945709 ecr 190636,mptcp dss ack 3869084571], length 0
10:18:37.697054 IP 112.26.0.1.43445 > 112.26.0.8.36004: Flags [.], seq 800921:802349, ack 1, win 4017, options [nop,nop,TS val 192073 ecr 4294945709,mptcp dss ack 1720219151 seq 3869240223 subseq 800921 len 1428 csum 0xfc42], length 1428
10:18:37.714039 IP 112.26.0.1.43445 > 112.26.0.8.36004: Flags [.], seq 800921:802349, ack 1, win 4017, options [nop,nop,TS val 192073 ecr 4294945709,mptcp dss ack 1720219151 seq 3869240223 subseq 800921 len 1428 csum 0xfc42], length 1428
10:18:37.805872 IP 112.26.0.8.36004 > 112.26.0.1.43445: Flags [.], ack 789497, win 24423, options [nop,nop,TS val 4294945823 ecr 190714,mptcp dss ack 3869084571], length 0
10:18:37.806228 IP 112.26.0.1.43445 > 112.26.0.8.36004: Flags [.], seq 802349:803777, ack 1, win 4017, options [nop,nop,TS val 192182 ecr 4294945823,mptcp dss ack 1720219151 seq 3869243079 subseq 802349 len 1428 csum 0x4134], length 1428
10:18:37.832300 IP 112.26.0.1.43445 > 112.26.0.8.36004: Flags [.], seq 802349:803777, ack 1, win 4017, options [nop,nop,TS val 192182 ecr 4294945823,mptcp dss ack 1720219151 seq 3869243079 subseq 802349 len 1428 csum 0x4134], length 1428
10:18:37.913868 IP 112.26.0.8.36004 > 112.26.0.1.43445: Flags [.], ack 790925, win 24423, options [nop,nop,TS val 4294945927 ecr 190714,mptcp dss ack 3869084571], length 0
10:18:37.914225 IP 112.26.0.1.43445 > 112.26.0.8.36004: Flags [.], seq 803777:805205, ack 1, win 4017, options [nop,nop,TS val 192290 ecr 4294945927,mptcp dss ack 1720219151 seq 3869245935 subseq 803777 len 1428 csum 0xebad], length 1428
10:18:37.914299 IP 112.26.0.1.43445 > 112.26.0.8.36004: Flags [.], seq 805205:806633, ack 1, win 4017, options [nop,nop,TS val 192290 ecr 4294945927,mptcp dss ack 1720219151 seq 3869247363 subseq 805205 len 1428 csum 0xa433], length 1428
10:18:37.947792 IP 112.26.0.1.43445 > 112.26.0.8.36004: Flags [.], seq 803777:805205, ack 1, win 4017, options [nop,nop,TS val 192290 ecr 4294945927,mptcp dss ack 1720219151 seq 3869245935 subseq 803777 len 1428 csum 0xebad], length 1428
10:18:38.039913 IP 112.26.0.1.43445 > 112.26.0.8.36004: Flags [.], seq 805205:806633, ack 1, win 4017, options [nop,nop,TS val 192290 ecr 4294945927,mptcp dss ack 1720219151 seq 3869247363 subseq 805205 len 1428 csum 0xa433], length 1428
10:18:38.046065 IP 112.26.0.8.36004 > 112.26.0.1.43445: Flags [.], ack 793781, win 24423, options [nop,nop,TS val 4294946124 ecr 190881,mptcp dss ack 3869084571], length 0
10:18:38.046370 IP 112.26.0.1.43445 > 112.26.0.8.36004: Flags [.], seq 806633:808061, ack 1, win 4017, options [nop,nop,TS val 192422 ecr 4294946124,mptcp dss ack 1720219151 seq 3869257359 subseq 806633 len 1428 csum 0x291], length 1428
10:18:38.046442 IP 112.26.0.1.43445 > 112.26.0.8.36004: Flags [.], seq 808061:809489, ack 1, win 4017, options [nop,nop,TS val 192422 ecr 4294946124,mptcp dss ack 1720219151 seq 3869258787 subseq 808061 len 1428 csum 0xb92f], length 1428
10:18:38.150605 IP 112.26.0.1.43445 > 112.26.0.8.36004: Flags [.], seq 806633:808061, ack 1, win 4017, options [nop,nop,TS val 192422 ecr 4294946124,mptcp dss ack 1720219151 seq 3869257359 subseq 806633 len 1428 csum 0x291], length 1428
10:18:38.197057 IP 112.26.0.8.36004 > 112.26.0.1.43445: Flags [.], ack 796637, win 24423, options [nop,nop,TS val 4294946320 ecr 191150,mptcp dss ack 3869084571], length 0
10:18:38.197363 IP 112.26.0.1.43445 > 112.26.0.8.36004: Flags [.], seq 809489:810917, ack 1, win 4017, options [nop,nop,TS val 192573 ecr 4294946320,mptcp dss ack 1720219151 seq 3869261643 subseq 809489 len 1428 csum 0xba24], length 1428
10:18:38.197439 IP 112.26.0.1.43445 > 112.26.0.8.36004: Flags [.], seq 810917:812345, ack 1, win 4017, options [nop,nop,TS val 192573 ecr 4294946320,mptcp dss ack 1720219151 seq 3869263071 subseq 810917 len 1428 csum 0xd6bc], length 1428
10:18:38.263445 IP 112.26.0.1.43445 > 112.26.0.8.36004: Flags [.], seq 808061:809489, ack 1, win 4017, options [nop,nop,TS val 192422 ecr 4294946124,mptcp dss ack 1720219151 seq 3869258787 subseq 808061 len 1428 csum 0xb92f], length 1428
10:18:38.371020 IP 112.26.0.1.43445 > 112.26.0.8.36004: Flags [.], seq 809489:810917, ack 1, win 4017, options [nop,nop,TS val 192573 ecr 4294946320,mptcp dss ack 1720219151 seq 3869261643 subseq 809489 len 1428 csum 0xba24], length 1428
10:18:38.457036 IP 112.26.0.1.43445 > 112.26.0.8.36004: Flags [.], seq 810917:812345, ack 1, win 4017, options [nop,nop,TS val 192573 ecr 4294946320,mptcp dss ack 1720219151 seq 3869263071 subseq 810917 len 1428 csum 0xd6bc], length 1428
10:18:38.487081 IP 112.26.0.8.36004 > 112.26.0.1.43445: Flags [.], ack 799493, win 24423, options [nop,nop,TS val 4294946752 ecr 191471,mptcp dss ack 3869084571], length 0
10:18:38.487346 IP 112.26.0.1.43445 > 112.26.0.8.36004: Flags [.], seq 812345:813773, ack 1, win 4017, options [nop,nop,TS val 192863 ecr 4294946752,mptcp dss ack 1720219151 seq 3869280207 subseq 812345 len 1428 csum 0xc2db], length 1428
10:18:38.487423 IP 112.26.0.1.43445 > 112.26.0.8.36004: Flags [.], seq 813773:815201, ack 1, win 4017, options [nop,nop,TS val 192863 ecr 4294946752,mptcp dss ack 1720219151 seq 3869281635 subseq 813773 len 1428 csum 0x7ba3], length 1428
10:18:38.568237 IP 112.26.0.1.43445 > 112.26.0.8.36004: Flags [.], seq 812345:813773, ack 1, win 4017, options [nop,nop,TS val 192863 ecr 4294946752,mptcp dss ack 1720219151 seq 3869280207 subseq 812345 len 1428 csum 0xc2db], length 1428
10:18:38.705027 IP 112.26.0.1.43445 > 112.26.0.8.36004: Flags [.], seq 813773:815201, ack 1, win 4017, options [nop,nop,TS val 192863 ecr 4294946752,mptcp dss ack 1720219151 seq 3869281635 subseq 813773 len 1428 csum 0x7ba3], length 1428
10:18:38.831060 IP 112.26.0.8.36004 > 112.26.0.1.43445: Flags [.], ack 806633, win 23910, options [nop,nop,TS val 4294947192 ecr 191942,mptcp dss ack 3869117415], length 0
10:18:38.831409 IP 112.26.0.1.43445 > 112.26.0.8.36004: Flags [.], seq 815201:816629, ack 1, win 4017, options [nop,nop,TS val 193208 ecr 4294947192,mptcp dss ack 1720219151 seq 3869300199 subseq 815201 len 1428 csum 0xf201], length 1428
10:18:38.831485 IP 112.26.0.1.43445 > 112.26.0.8.36004: Flags [.], seq 816629:818057, ack 1, win 4017, options [nop,nop,TS val 193208 ecr 4294947192,mptcp dss ack 1720219151 seq 3869301627 subseq 816629 len 1428 csum 0x9bde], length 1428
10:18:38.831700 IP 112.26.0.1.43445 > 112.26.0.8.36004: Flags [.], seq 818057:819485, ack 1, win 4017, options [nop,nop,TS val 193208 ecr 4294947192,mptcp dss ack 1720219151 seq 3869303055 subseq 818057 len 1428 csum 0xea63], length 1428
10:18:38.831815 IP 112.26.0.1.43445 > 112.26.0.8.36004: Flags [.], seq 819485:820913, ack 1, win 4017, options [nop,nop,TS val 193208 ecr 4294947192,mptcp dss ack 1720219151 seq 3869304483 subseq 819485 len 1428 csum 0x5b66], length 1428
10:18:38.832003 IP 112.26.0.1.43445 > 112.26.0.8.36004: Flags [.], seq 820913:822341, ack 1, win 4017, options [nop,nop,TS val 193208 ecr 4294947192,mptcp dss ack 1720219151 seq 3869305911 subseq 820913 len 1428 csum 0xbecf], length 1428
10:18:38.832111 IP 112.26.0.1.43445 > 112.26.0.8.36004: Flags [.], seq 822341:823769, ack 1, win 4017, options [nop,nop,TS val 193208 ecr 4294947192,mptcp dss ack 1720219151 seq 3869307339 subseq 822341 len 1428 csum 0xb0e6], length 1428
10:18:38.847839 IP 112.26.0.1.43445 > 112.26.0.8.36004: Flags [.], seq 815201:816629, ack 1, win 4017, options [nop,nop,TS val 193208 ecr 4294947192,mptcp dss ack 1720219151 seq 3869300199 subseq 815201 len 1428 csum 0xf201], length 1428
10:18:38.954653 IP 112.26.0.1.43445 > 112.26.0.8.36004: Flags [.], seq 816629:818057, ack 1, win 4017, options [nop,nop,TS val 193208 ecr 4294947192,mptcp dss ack 1720219151 seq 3869301627 subseq 816629 len 1428 csum 0x9bde], length 1428
