10:17:23.935443 IP 112.26.2.8.39903 > 112.26.2.1.43445: Flags [S], seq 672498423, win 65535, options [mss 1460,sackOK,TS val 4294872457 ecr 0,nop,wscale 6,mptcp join id 4 token 0x1271d1f5 nonce 0xad08927e], length 0
10:17:24.000423 IP 112.26.2.8.39903 > 112.26.2.1.43445: Flags [S], seq 672498423, win 65535, options [mss 1460,sackOK,TS val 4294872457 ecr 0,nop,wscale 6,mptcp join id 4 token 0x1271d1f5 nonce 0xad08927e], length 0
10:17:24.070208 IP 112.26.2.1.43445 > 112.26.2.8.39903: Flags [S.], seq 1340884807, ack 672498424, win 65535, options [mss 1460,sackOK,TS val 118380 ecr 4294872457,nop,wscale 6,mptcp join id 6 hmac 0xdf78a7e315d0df0 nonce 0x6a59e05e], length 0
10:17:24.122597 IP 112.26.2.1.43445 > 112.26.2.8.39903: Flags [S.], seq 1340884807, ack 672498424, win 65535, options [mss 1460,sackOK,TS val 118380 ecr 4294872457,nop,wscale 6,mptcp join id 6 hmac 0xdf78a7e315d0df0 nonce 0x6a59e05e], length 0
10:17:24.181201 IP 112.26.2.1.43445 > 112.26.2.8.39903: Flags [S.], seq 1340884807, ack 672498424, win 65535, options [mss 1460,sackOK,TS val 118380 ecr 4294872457,nop,wscale 6,mptcp join id 6 hmac 0xdf78a7e315d0df0 nonce 0x6a59e05e], length 0
10:17:24.250984 IP 112.26.2.8.39903 > 112.26.2.1.43445: Flags [.], ack 1, win 6479, options [nop,nop,TS val 4294872838 ecr 118380,mptcp join hmac 0x06c6c92732455c5a9bc8c60b0e48efa7c6236428], length 0
10:17:24.251258 IP 112.26.2.8.39903 > 112.26.2.1.43445: Flags [.], ack 1, win 6479, options [nop,nop,TS val 4294872838 ecr 118380,mptcp join hmac 0x06c6c92732455c5a9bc8c60b0e48efa7c6236428], length 0
10:17:58.493297 IP 112.26.2.8.39903 > 112.26.2.1.43445: Flags [.], ack 307021, win 24409, options [nop,nop,TS val 4294907144 ecr 152146,mptcp dss ack 3867986439], length 0
10:17:58.493560 IP 112.26.2.8.39903 > 112.26.2.1.43445: Flags [.], ack 307021, win 24409, options [nop,nop,TS val 4294907144 ecr 152146,mptcp dss ack 3867986439], length 0
10:17:58.532362 IP 112.26.2.1.43445 > 112.26.2.8.39903: Flags [.], seq 307021:308449, ack 1, win 4017, options [nop,nop,TS val 152146 ecr 4294905727,mptcp dss ack 1720219151 seq 3868005003 subseq 307021 len 1428 csum 0x5d30], length 1428
10:17:58.612459 IP 112.26.2.1.43445 > 112.26.2.8.39903: Flags [.], seq 309877:311305, ack 1, win 4017, options [nop,nop,TS val 152376 ecr 4294905914,mptcp dss ack 1720219151 seq 3868014999 subseq 309877 len 1428 csum 0x94a8], length 1428
10:17:58.618077 IP 112.26.2.8.39903 > 112.26.2.1.43445: Flags [.], ack 308449, win 24409, options [nop,nop,TS val 4294907269 ecr 152146,nop,nop,sack 1 {309877:311305},mptcp dss ack 3867986439], length 0
10:17:58.618356 IP 112.26.2.8.39903 > 112.26.2.1.43445: Flags [.], ack 308449, win 24409, options [nop,nop,TS val 4294907269 ecr 152146,nop,nop,sack 1 {309877:311305},mptcp dss ack 3867986439], length 0
10:17:58.723249 IP 112.26.2.1.43445 > 112.26.2.8.39903: Flags [.], seq 319873:321301, ack 1, win 4017, options [nop,nop,TS val 153096 ecr 4294906663,mptcp dss ack 1720219151 seq 3868063551 subseq 319873 len 1428 csum 0x38ad], length 1428
10:17:58.723616 IP 112.26.2.1.43445 > 112.26.2.8.39903: Flags [.], seq 319873:321301, ack 1, win 4017, options [nop,nop,TS val 153096 ecr 4294906663,mptcp dss ack 1720219151 seq 3868063551 subseq 319873 len 1428 csum 0x38ad], length 1428
10:17:58.770751 IP 112.26.2.1.43445 > 112.26.2.8.39903: Flags [.], seq 321301:322729, ack 1, win 4017, options [nop,nop,TS val 153096 ecr 4294906663,mptcp dss ack 1720219151 seq 3868064979 subseq 321301 len 1428 csum 0xe372], length 1428
10:17:58.771094 IP 112.26.2.1.43445 > 112.26.2.8.39903: Flags [.], seq 321301:322729, ack 1, win 4017, options [nop,nop,TS val 153096 ecr 4294906663,mptcp dss ack 1720219151 seq 3868064979 subseq 321301 len 1428 csum 0xe372], length 1428
10:17:58.794876 IP 112.26.2.1.43445 > 112.26.2.8.39903: Flags [.], seq 311305:312733, ack 1, win 4017, options [nop,nop,TS val 152439 ecr 4294906088,mptcp dss ack 1720219151 seq 3868017855 subseq 311305 len 1428 csum 0xb4b6], length 1428
10:17:58.823702 IP 112.26.2.8.39903 > 112.26.2.1.43445: Flags [.], ack 308449, win 24409, options [nop,nop,TS val 4294907451 ecr 152146,nop,nop,sack 1 {309877:312733},mptcp dss ack 3867986439], length 0
10:17:58.823991 IP 112.26.2.8.39903 > 112.26.2.1.43445: Flags [.], ack 308449, win 24409, options [nop,nop,TS val 4294907451 ecr 152146,nop,nop,sack 1 {309877:312733},mptcp dss ack 3867986439], length 0
10:17:58.900011 IP 112.26.2.1.43445 > 112.26.2.8.39903: Flags [.], seq 312733:314161, ack 1, win 4017, options [nop,nop,TS val 152439 ecr 4294906088,mptcp dss ack 1720219151 seq 3868019283 subseq 312733 len 1428 csum 0xcd0b], length 1428
10:17:58.925153 IP 112.26.2.8.39903 > 112.26.2.1.43445: Flags [.], ack 308449, win 24409, options [nop,nop,TS val 4294907556 ecr 152146,nop,nop,sack 1 {309877:314161},mptcp dss ack 3867986439], length 0
10:17:58.925485 IP 112.26.2.8.39903 > 112.26.2.1.43445: Flags [.], ack 308449, win 24409, options [nop,nop,TS val 4294907556 ecr 152146,nop,nop,sack 1 {309877:314161},mptcp dss ack 3867986439], length 0
10:17:58.992235 IP 112.26.2.1.43445 > 112.26.2.8.39903: Flags [.], seq 314161:315589, ack 1, win 4017, options [nop,nop,TS val 152439 ecr 4294906088,mptcp dss ack 1720219151 seq 3868020711 subseq 314161 len 1428 csum 0xd55d], length 1428
10:17:59.009637 IP 112.26.2.8.39903 > 112.26.2.1.43445: Flags [.], ack 308449, win 24409, options [nop,nop,TS val 4294907648 ecr 152146,nop,nop,sack 1 {309877:315589},mptcp dss ack 3867986439], length 0
10:17:59.009933 IP 112.26.2.8.39903 > 112.26.2.1.43445: Flags [.], ack 308449, win 24409, options [nop,nop,TS val 4294907648 ecr 152146,nop,nop,sack 1 {309877:315589},mptcp dss ack 3867986439], length 0
10:17:59.073774 IP 112.26.2.1.43445 > 112.26.2.8.39903: Flags [.], seq 315589:317017, ack 1, win 4017, options [nop,nop,TS val 152543 ecr 4294906190,mptcp dss ack 1720219151 seq 3868034991 subseq 315589 len 1428 csum 0x8d03], length 1428
10:17:59.086111 IP 112.26.2.8.39903 > 112.26.2.1.43445: Flags [.], ack 308449, win 24409, options [nop,nop,TS val 4294907730 ecr 152146,nop,nop,sack 1 {309877:317017},mptcp dss ack 3867986439], length 0
10:17:59.086396 IP 112.26.2.8.39903 > 112.26.2.1.43445: Flags [.], ack 308449, win 24409, options [nop,nop,TS val 4294907730 ecr 152146,nop,nop,sack 1 {309877:317017},mptcp dss ack 3867986439], length 0
10:17:59.178600 IP 112.26.2.1.43445 > 112.26.2.8.39903: Flags [.], seq 317017:318445, ack 1, win 4017, options [nop,nop,TS val 152648 ecr 4294906287,mptcp dss ack 1720219151 seq 3868039275 subseq 317017 len 1428 csum 0x4530], length 1428
10:17:59.200556 IP 112.26.2.8.39903 > 112.26.2.1.43445: Flags [.], ack 308449, win 24409, options [nop,nop,TS val 4294907835 ecr 152146,nop,nop,sack 1 {309877:318445},mptcp dss ack 3867986439], length 0
10:17:59.200825 IP 112.26.2.8.39903 > 112.26.2.1.43445: Flags [.], ack 308449, win 24409, options [nop,nop,TS val 4294907835 ecr 152146,nop,nop,sack 1 {309877:318445},mptcp dss ack 3867986439], length 0
10:17:59.245003 IP 112.26.2.1.43445 > 112.26.2.8.39903: Flags [.], seq 318445:319873, ack 1, win 4017, options [nop,nop,TS val 152705 ecr 4294906361,mptcp dss ack 1720219151 seq 3868040703 subseq 318445 len 1428 csum 0x4d99], length 1428
10:17:59.284815 IP 112.26.2.8.39903 > 112.26.2.1.43445: Flags [.], ack 308449, win 24409, options [nop,nop,TS val 4294907901 ecr 152146,nop,nop,sack 1 {309877:319873},mptcp dss ack 3867986439], length 0
10:17:59.285067 IP 112.26.2.8.39903 > 112.26.2.1.43445: Flags [.], ack 308449, win 24409, options [nop,nop,TS val 4294907901 ecr 152146,nop,nop,sack 1 {309877:319873},mptcp dss ack 3867986439], length 0
10:17:59.339695 IP 112.26.2.1.43445 > 112.26.2.8.39903: Flags [.], seq 322729:324157, ack 1, win 4017, options [nop,nop,TS val 153713 ecr 4294907269,mptcp dss ack 1720219151 seq 3868083543 subseq 322729 len 1428 csum 0xc864], length 1428
10:17:59.339982 IP 112.26.2.1.43445 > 112.26.2.8.39903: Flags [.], seq 322729:324157, ack 1, win 4017, options [nop,nop,TS val 153713 ecr 4294907269,mptcp dss ack 1720219151 seq 3868083543 subseq 322729 len 1428 csum 0xc864], length 1428
10:17:59.383248 IP 112.26.2.1.43445 > 112.26.2.8.39903: Flags [.], seq 324157:325585, ack 1, win 4017, options [nop,nop,TS val 153713 ecr 4294907269,mptcp dss ack 1720219151 seq 3868084971 subseq 324157 len 1428 csum 0x77f4], length 1428
10:17:59.383636 IP 112.26.2.1.43445 > 112.26.2.8.39903: Flags [.], seq 324157:325585, ack 1, win 4017, options [nop,nop,TS val 153713 ecr 4294907269,mptcp dss ack 1720219151 seq 3868084971 subseq 324157 len 1428 csum 0x77f4], length 1428
10:17:59.390657 IP 112.26.2.8.39903 > 112.26.2.1.43445: Flags [.], ack 308449, win 24409, options [nop,nop,TS val 4294908044 ecr 152146,nop,nop,sack 1 {309877:321301},mptcp dss ack 3867986439], length 0
10:17:59.390923 IP 112.26.2.8.39903 > 112.26.2.1.43445: Flags [.], ack 308449, win 24409, options [nop,nop,TS val 4294908044 ecr 152146,nop,nop,sack 1 {309877:321301},mptcp dss ack 3867986439], length 0
10:17:59.418908 IP 112.26.2.1.43445 > 112.26.2.8.39903: Flags [.], seq 319873:321301, ack 1, win 4017, options [nop,nop,TS val 153096 ecr 4294906663,mptcp dss ack 1720219151 seq 3868063551 subseq 319873 len 1428 csum 0x38ad], length 1428
10:17:59.439888 IP 112.26.2.1.43445 > 112.26.2.8.39903: Flags [.], seq 325585:327013, ack 1, win 4017, options [nop,nop,TS val 153713 ecr 4294907269,mptcp dss ack 1720219151 seq 3868086399 subseq 325585 len 1428 csum 0x423f], length 1428
10:17:59.440211 IP 112.26.2.1.43445 > 112.26.2.8.39903: Flags [.], seq 325585:327013, ack 1, win 4017, options [nop,nop,TS val 153713 ecr 4294907269,mptcp dss ack 1720219151 seq 3868086399 subseq 325585 len 1428 csum 0x423f], length 1428
10:17:59.497405 IP 112.26.2.1.43445 > 112.26.2.8.39903: Flags [.], seq 327013:328441, ack 1, win 4017, options [nop,nop,TS val 153713 ecr 4294907269,mptcp dss ack 1720219151 seq 3868087827 subseq 327013 len 1428 csum 0x9456], length 1428
10:17:59.497567 IP 112.26.2.1.43445 > 112.26.2.8.39903: Flags [.], seq 327013:328441, ack 1, win 4017, options [nop,nop,TS val 153713 ecr 4294907269,mptcp dss ack 1720219151 seq 3868087827 subseq 327013 len 1428 csum 0x9456], length 1428
10:17:59.530587 IP 112.26.2.8.39903 > 112.26.2.1.43445: Flags [.], ack 308449, win 24409, options [nop,nop,TS val 4294908182 ecr 152146,nop,nop,sack 1 {309877:322729},mptcp dss ack 3867986439], length 0
10:17:59.530806 IP 112.26.2.8.39903 > 112.26.2.1.43445: Flags [.], ack 308449, win 24409, options [nop,nop,TS val 4294908182 ecr 152146,nop,nop,sack 1 {309877:322729},mptcp dss ack 3867986439], length 0
10:17:59.545445 IP 112.26.2.1.43445 > 112.26.2.8.39903: Flags [.], seq 321301:322729, ack 1, win 4017, options [nop,nop,TS val 153096 ecr 4294906663,mptcp dss ack 1720219151 seq 3868064979 subseq 321301 len 1428 csum 0xe372], length 1428
10:17:59.647161 IP 112.26.2.1.43445 > 112.26.2.8.39903: Flags [.], seq 308449:309877, ack 1, win 4017, options [nop,nop,TS val 154021 ecr 4294907556,mptcp dss ack 1720219151 seq 3868006431 subseq 308449 len 1428 csum 0xb0b6], length 1428
10:17:59.647376 IP 112.26.2.1.43445 > 112.26.2.8.39903: Flags [.], seq 308449:309877, ack 1, win 4017, options [nop,nop,TS val 154021 ecr 4294907556,mptcp dss ack 1720219151 seq 3868006431 subseq 308449 len 1428 csum 0xb0b6], length 1428
10:17:59.708204 IP 112.26.2.1.43445 > 112.26.2.8.39903: Flags [.], seq 328441:329869, ack 1, win 4017, options [nop,nop,TS val 154069 ecr 4294907556,mptcp dss ack 1720219151 seq 3868099251 subseq 328441 len 1428 csum 0x8aa5], length 1428
10:17:59.708449 IP 112.26.2.1.43445 > 112.26.2.8.39903: Flags [.], seq 328441:329869, ack 1, win 4017, options [nop,nop,TS val 154069 ecr 4294907556,mptcp dss ack 1720219151 seq 3868099251 subseq 328441 len 1428 csum 0x8aa5], length 1428
10:17:59.793293 IP 112.26.2.1.43445 > 112.26.2.8.39903: Flags [.], seq 329869:331297, ack 1, win 4017, options [nop,nop,TS val 154078 ecr 4294907648,mptcp dss ack 1720219151 seq 3868100679 subseq 329869 len 1428 csum 0x2bf9], length 1428
10:17:59.793555 IP 112.26.2.1.43445 > 112.26.2.8.39903: Flags [.], seq 329869:331297, ack 1, win 4017, options [nop,nop,TS val 154078 ecr 4294907648,mptcp dss ack 1720219151 seq 3868100679 subseq 329869 len 1428 csum 0x2bf9], length 1428
10:17:59.885723 IP 112.26.2.1.43445 > 112.26.2.8.39903: Flags [.], seq 331297:332725, ack 1, win 4017, options [nop,nop,TS val 154248 ecr 4294907835,mptcp dss ack 1720219151 seq 3868106391 subseq 331297 len 1428 csum 0x5d13], length 1428
10:17:59.885988 IP 112.26.2.1.43445 > 112.26.2.8.39903: Flags [.], seq 331297:332725, ack 1, win 4017, options [nop,nop,TS val 154248 ecr 4294907835,mptcp dss ack 1720219151 seq 3868106391 subseq 331297 len 1428 csum 0x5d13], length 1428
10:17:59.932442 IP 112.26.2.1.43445 > 112.26.2.8.39903: Flags [.], seq 332725:334153, ack 1, win 4017, options [nop,nop,TS val 154289 ecr 4294907901,mptcp dss ack 1720219151 seq 3868107819 subseq 332725 len 1428 csum 0xffb9], length 1428
10:17:59.932753 IP 112.26.2.1.43445 > 112.26.2.8.39903: Flags [.], seq 332725:334153, ack 1, win 4017, options [nop,nop,TS val 154289 ecr 4294907901,mptcp dss ack 1720219151 seq 3868107819 subseq 332725 len 1428 csum 0xffb9], length 1428
10:17:59.952404 IP 112.26.2.1.43445 > 112.26.2.8.39903: Flags [.], seq 322729:324157, ack 1, win 4017, options [nop,nop,TS val 153713 ecr 4294907269,mptcp dss ack 1720219151 seq 3868083543 subseq 322729 len 1428 csum 0xc864], length 1428
10:17:59.965816 IP 112.26.2.8.39903 > 112.26.2.1.43445: Flags [.], ack 308449, win 24409, options [nop,nop,TS val 4294908609 ecr 152146,nop,nop,sack 1 {309877:324157},mptcp dss ack 3867986439], length 0
10:17:59.966105 IP 112.26.2.8.39903 > 112.26.2.1.43445: Flags [.], ack 308449, win 24409, options [nop,nop,TS val 4294908609 ecr 152146,nop,nop,sack 1 {309877:324157},mptcp dss ack 3867986439], length 0
10:18:00.071121 IP 112.26.2.1.43445 > 112.26.2.8.39903: Flags [.], seq 324157:325585, ack 1, win 4017, options [nop,nop,TS val 153713 ecr 4294907269,mptcp dss ack 1720219151 seq 3868084971 subseq 324157 len 1428 csum 0x77f4], length 1428
10:18:00.074396 IP 112.26.2.8.39903 > 112.26.2.1.43445: Flags [.], ack 308449, win 24276, options [nop,nop,TS val 4294908728 ecr 152146,nop,nop,sack 1 {309877:325585},mptcp dss ack 3867995007], length 0
10:18:00.074689 IP 112.26.2.8.39903 > 112.26.2.1.43445: Flags [.], ack 308449, win 24276, options [nop,nop,TS val 4294908728 ecr 152146,nop,nop,sack 1 {309877:325585},mptcp dss ack 3867995007], length 0
10:18:00.171389 IP 112.26.2.1.43445 > 112.26.2.8.39903: Flags [.], seq 325585:327013, ack 1, win 4017, options [nop,nop,TS val 153713 ecr 4294907269,mptcp dss ack 1720219151 seq 3868086399 subseq 325585 len 1428 csum 0x423f], length 1428
10:18:00.183235 IP 112.26.2.8.39903 > 112.26.2.1.43445: Flags [.], ack 308449, win 24098, options [nop,nop,TS val 4294908828 ecr 152146,nop,nop,sack 1 {309877:327013},mptcp dss ack 3868006431], length 0
10:18:00.183535 IP 112.26.2.8.39903 > 112.26.2.1.43445: Flags [.], ack 308449, win 24098, options [nop,nop,TS val 4294908828 ecr 152146,nop,nop,sack 1 {309877:327013},mptcp dss ack 3868006431], length 0
10:18:00.333086 IP 112.26.2.1.43445 > 112.26.2.8.39903: Flags [.], seq 308449:309877, ack 1, win 4017, options [nop,nop,TS val 154021 ecr 4294907556,mptcp dss ack 1720219151 seq 3868006431 subseq 308449 len 1428 csum 0xb0b6], length 1428
10:18:00.339951 IP 112.26.2.8.39903 > 112.26.2.1.43445: Flags [.], ack 327013, win 23764, options [nop,nop,TS val 4294908989 ecr 154021,mptcp dss ack 3868032135], length 0
10:18:00.340292 IP 112.26.2.8.39903 > 112.26.2.1.43445: Flags [.], ack 327013, win 23764, options [nop,nop,TS val 4294908989 ecr 154021,mptcp dss ack 3868032135], length 0
10:18:00.433548 IP 112.26.2.1.43445 > 112.26.2.8.39903: Flags [.], seq 328441:329869, ack 1, win 4017, options [nop,nop,TS val 154069 ecr 4294907556,mptcp dss ack 1720219151 seq 3868099251 subseq 328441 len 1428 csum 0x8aa5], length 1428
10:18:00.443517 IP 112.26.2.8.39903 > 112.26.2.1.43445: Flags [.], ack 327013, win 24030, options [nop,nop,TS val 4294909090 ecr 154021,nop,nop,sack 1 {328441:329869},mptcp dss ack 3868032135], length 0
10:18:00.443856 IP 112.26.2.8.39903 > 112.26.2.1.43445: Flags [.], ack 327013, win 24030, options [nop,nop,TS val 4294909090 ecr 154021,nop,nop,sack 1 {328441:329869},mptcp dss ack 3868032135], length 0
10:18:00.547781 IP 112.26.2.1.43445 > 112.26.2.8.39903: Flags [.], seq 329869:331297, ack 1, win 4017, options [nop,nop,TS val 154078 ecr 4294907648,mptcp dss ack 1720219151 seq 3868100679 subseq 329869 len 1428 csum 0x2bf9], length 1428
10:18:00.559248 IP 112.26.2.8.39903 > 112.26.2.1.43445: Flags [.], ack 327013, win 24030, options [nop,nop,TS val 4294909204 ecr 154021,nop,nop,sack 1 {328441:331297},mptcp dss ack 3868032135], length 0
10:18:00.559596 IP 112.26.2.8.39903 > 112.26.2.1.43445: Flags [.], ack 327013, win 24030, options [nop,nop,TS val 4294909204 ecr 154021,nop,nop,sack 1 {328441:331297},mptcp dss ack 3868032135], length 0
10:18:00.636378 IP 112.26.2.1.43445 > 112.26.2.8.39903: Flags [.], seq 331297:332725, ack 1, win 4017, options [nop,nop,TS val 154248 ecr 4294907835,mptcp dss ack 1720219151 seq 3868106391 subseq 331297 len 1428 csum 0x5d13], length 1428
10:18:00.646920 IP 112.26.2.8.39903 > 112.26.2.1.43445: Flags [.], ack 327013, win 24030, options [nop,nop,TS val 4294909293 ecr 154021,nop,nop,sack 1 {328441:332725},mptcp dss ack 3868032135], length 0
10:18:00.647245 IP 112.26.2.8.39903 > 112.26.2.1.43445: Flags [.], ack 327013, win 24030, options [nop,nop,TS val 4294909293 ecr 154021,nop,nop,sack 1 {328441:332725},mptcp dss ack 3868032135], length 0
10:18:00.750595 IP 112.26.2.1.43445 > 112.26.2.8.39903: Flags [.], seq 332725:334153, ack 1, win 4017, options [nop,nop,TS val 154289 ecr 4294907901,mptcp dss ack 1720219151 seq 3868107819 subseq 332725 len 1428 csum 0xffb9], length 1428
10:18:00.765402 IP 112.26.2.8.39903 > 112.26.2.1.43445: Flags [.], ack 327013, win 24009, options [nop,nop,TS val 4294909407 ecr 154021,nop,nop,sack 1 {328441:334153},mptcp dss ack 3868047843], length 0
10:18:00.765735 IP 112.26.2.8.39903 > 112.26.2.1.43445: Flags [.], ack 327013, win 24009, options [nop,nop,TS val 4294909407 ecr 154021,nop,nop,sack 1 {328441:334153},mptcp dss ack 3868047843], length 0
10:18:00.800450 IP 112.26.2.1.43445 > 112.26.2.8.39903: Flags [.], seq 334153:335581, ack 1, win 4017, options [nop,nop,TS val 155172 ecr 4294908728,mptcp dss ack 1720219151 seq 3868152087 subseq 334153 len 1428 csum 0x116d], length 1428
10:18:00.800766 IP 112.26.2.1.43445 > 112.26.2.8.39903: Flags [.], seq 334153:335581, ack 1, win 4017, options [nop,nop,TS val 155172 ecr 4294908728,mptcp dss ack 1720219151 seq 3868152087 subseq 334153 len 1428 csum 0x116d], length 1428
10:18:00.869829 IP 112.26.2.1.43445 > 112.26.2.8.39903: Flags [.], seq 335581:337009, ack 1, win 4017, options [nop,nop,TS val 155172 ecr 4294908728,mptcp dss ack 1720219151 seq 3868153515 subseq 335581 len 1428 csum 0x62], length 1428
10:18:00.870087 IP 112.26.2.1.43445 > 112.26.2.8.39903: Flags [.], seq 335581:337009, ack 1, win 4017, options [nop,nop,TS val 155172 ecr 4294908728,mptcp dss ack 1720219151 seq 3868153515 subseq 335581 len 1428 csum 0x62], length 1428
10:18:00.934196 IP 112.26.2.1.43445 > 112.26.2.8.39903: Flags [.], seq 337009:338437, ack 1, win 4017, options [nop,nop,TS val 155278 ecr 4294908828,mptcp dss ack 1720219151 seq 3868166367 subseq 337009 len 1428 csum 0xa5e2], length 1428
10:18:00.934505 IP 112.26.2.1.43445 > 112.26.2.8.39903: Flags [.], seq 337009:338437, ack 1, win 4017, options [nop,nop,TS val 155278 ecr 4294908828,mptcp dss ack 1720219151 seq 3868166367 subseq 337009 len 1428 csum 0xa5e2], length 1428
10:18:00.983893 IP 112.26.2.1.43445 > 112.26.2.8.39903: Flags [.], seq 327013:328441, ack 1, win 4017, options [nop,nop,TS val 155309 ecr 4294908989,mptcp dss ack 1720219151 seq 3868087827 subseq 327013 len 1428 csum 0x9456], length 1428
10:18:00.984220 IP 112.26.2.1.43445 > 112.26.2.8.39903: Flags [.], seq 327013:328441, ack 1, win 4017, options [nop,nop,TS val 155309 ecr 4294908989,mptcp dss ack 1720219151 seq 3868087827 subseq 327013 len 1428 csum 0x9456], length 1428
10:18:01.081481 IP 112.26.2.1.43445 > 112.26.2.8.39903: Flags [.], seq 338437:339865, ack 1, win 4017, options [nop,nop,TS val 155309 ecr 4294908989,mptcp dss ack 1720219151 seq 3868169223 subseq 338437 len 1428 csum 0x94e8], length 1428
10:18:01.081793 IP 112.26.2.1.43445 > 112.26.2.8.39903: Flags [.], seq 338437:339865, ack 1, win 4017, options [nop,nop,TS val 155309 ecr 4294908989,mptcp dss ack 1720219151 seq 3868169223 subseq 338437 len 1428 csum 0x94e8], length 1428
10:18:01.118897 IP 112.26.2.1.43445 > 112.26.2.8.39903: Flags [.], seq 339865:341293, ack 1, win 4017, options [nop,nop,TS val 155414 ecr 4294909090,mptcp dss ack 1720219151 seq 3868172079 subseq 339865 len 1428 csum 0x131c], length 1428
10:18:01.119191 IP 112.26.2.1.43445 > 112.26.2.8.39903: Flags [.], seq 339865:341293, ack 1, win 4017, options [nop,nop,TS val 155414 ecr 4294909090,mptcp dss ack 1720219151 seq 3868172079 subseq 339865 len 1428 csum 0x131c], length 1428
10:18:01.172283 IP 112.26.2.1.43445 > 112.26.2.8.39903: Flags [.], seq 341293:342721, ack 1, win 4017, options [nop,nop,TS val 155438 ecr 4294909204,mptcp dss ack 1720219151 seq 3868173507 subseq 341293 len 1428 csum 0x9ef8], length 1428
10:18:01.172631 IP 112.26.2.1.43445 > 112.26.2.8.39903: Flags [.], seq 341293:342721, ack 1, win 4017, options [nop,nop,TS val 155438 ecr 4294909204,mptcp dss ack 1720219151 seq 3868173507 subseq 341293 len 1428 csum 0x9ef8], length 1428
10:18:01.237373 IP 112.26.2.1.43445 > 112.26.2.8.39903: Flags [.], seq 334153:335581, ack 1, win 4017, options [nop,nop,TS val 155172 ecr 4294908728,mptcp dss ack 1720219151 seq 3868152087 subseq 334153 len 1428 csum 0x116d], length 1428
10:18:01.250895 IP 112.26.2.1.43445 > 112.26.2.8.39903: Flags [.], seq 342721:344149, ack 1, win 4017, options [nop,nop,TS val 155484 ecr 4294909293,mptcp dss ack 1720219151 seq 3868182075 subseq 342721 len 1428 csum 0x2b14], length 1428
10:18:01.251349 IP 112.26.2.1.43445 > 112.26.2.8.39903: Flags [.], seq 342721:344149, ack 1, win 4017, options [nop,nop,TS val 155484 ecr 4294909293,mptcp dss ack 1720219151 seq 3868182075 subseq 342721 len 1428 csum 0x2b14], length 1428
10:18:01.252764 IP 112.26.2.8.39903 > 112.26.2.1.43445: Flags [.], ack 327013, win 24107, options [nop,nop,TS val 4294909893 ecr 154021,nop,nop,sack 1 {328441:335581},mptcp dss ack 3868073547], length 0
10:18:01.253070 IP 112.26.2.8.39903 > 112.26.2.1.43445: Flags [.], ack 327013, win 24107, options [nop,nop,TS val 4294909893 ecr 154021,nop,nop,sack 1 {328441:335581},mptcp dss ack 3868073547], length 0
10:18:01.323396 IP 112.26.2.1.43445 > 112.26.2.8.39903: Flags [.], seq 344149:345577, ack 1, win 4017, options [nop,nop,TS val 155571 ecr 4294909407,mptcp dss ack 1720219151 seq 3868186359 subseq 344149 len 1428 csum 0xeb82], length 1428
10:18:01.323726 IP 112.26.2.1.43445 > 112.26.2.8.39903: Flags [.], seq 344149:345577, ack 1, win 4017, options [nop,nop,TS val 155571 ecr 4294909407,mptcp dss ack 1720219151 seq 3868186359 subseq 344149 len 1428 csum 0xeb82], length 1428
10:18:01.349624 IP 112.26.2.1.43445 > 112.26.2.8.39903: Flags [.], seq 335581:337009, ack 1, win 4017, options [nop,nop,TS val 155172 ecr 4294908728,mptcp dss ack 1720219151 seq 3868153515 subseq 335581 len 1428 csum 0x62], length 1428
10:18:01.390920 IP 112.26.2.8.39903 > 112.26.2.1.43445: Flags [.], ack 327013, win 24107, options [nop,nop,TS val 4294910006 ecr 154021,nop,nop,sack 1 {328441:337009},mptcp dss ack 3868073547], length 0
10:18:01.391259 IP 112.26.2.8.39903 > 112.26.2.1.43445: Flags [.], ack 327013, win 24107, options [nop,nop,TS val 4294910006 ecr 154021,nop,nop,sack 1 {328441:337009},mptcp dss ack 3868073547], length 0
10:18:01.454783 IP 112.26.2.1.43445 > 112.26.2.8.39903: Flags [.], seq 337009:338437, ack 1, win 4017, options [nop,nop,TS val 155278 ecr 4294908828,mptcp dss ack 1720219151 seq 3868166367 subseq 337009 len 1428 csum 0xa5e2], length 1428
10:18:01.467154 IP 112.26.2.8.39903 > 112.26.2.1.43445: Flags [.], ack 327013, win 24110, options [nop,nop,TS val 4294910111 ecr 154021,nop,nop,sack 1 {328441:338437},mptcp dss ack 3868087827], length 0
10:18:01.467461 IP 112.26.2.8.39903 > 112.26.2.1.43445: Flags [.], ack 327013, win 24110, options [nop,nop,TS val 4294910111 ecr 154021,nop,nop,sack 1 {328441:338437},mptcp dss ack 3868087827], length 0
10:18:01.564781 IP 112.26.2.1.43445 > 112.26.2.8.39903: Flags [.], seq 327013:328441, ack 1, win 4017, options [nop,nop,TS val 155309 ecr 4294908989,mptcp dss ack 1720219151 seq 3868087827 subseq 327013 len 1428 csum 0x9456], length 1428
10:18:01.571633 IP 112.26.2.8.39903 > 112.26.2.1.43445: Flags [.], ack 338437, win 23972, options [nop,nop,TS val 4294910221 ecr 155309,mptcp dss ack 3868133523], length 0
10:18:01.571888 IP 112.26.2.8.39903 > 112.26.2.1.43445: Flags [.], ack 338437, win 23972, options [nop,nop,TS val 4294910221 ecr 155309,mptcp dss ack 3868133523], length 0
10:18:01.663088 IP 112.26.2.1.43445 > 112.26.2.8.39903: Flags [.], seq 338437:339865, ack 1, win 4017, options [nop,nop,TS val 155309 ecr 4294908989,mptcp dss ack 1720219151 seq 3868169223 subseq 338437 len 1428 csum 0x94e8], length 1428
10:18:01.671064 IP 112.26.2.8.39903 > 112.26.2.1.43445: Flags [.], ack 339865, win 24455, options [nop,nop,TS val 4294910320 ecr 155309,mptcp dss ack 3868134951], length 0
10:18:01.671367 IP 112.26.2.8.39903 > 112.26.2.1.43445: Flags [.], ack 339865, win 24455, options [nop,nop,TS val 4294910320 ecr 155309,mptcp dss ack 3868134951], length 0
10:18:01.732031 IP 112.26.2.1.43445 > 112.26.2.8.39903: Flags [.], seq 339865:341293, ack 1, win 4017, options [nop,nop,TS val 155414 ecr 4294909090,mptcp dss ack 1720219151 seq 3868172079 subseq 339865 len 1428 csum 0x131c], length 1428
10:18:01.785162 IP 112.26.2.8.39903 > 112.26.2.1.43445: Flags [.], ack 341293, win 24455, options [nop,nop,TS val 4294910388 ecr 155414,mptcp dss ack 3868134951], length 0
10:18:01.785469 IP 112.26.2.8.39903 > 112.26.2.1.43445: Flags [.], ack 341293, win 24455, options [nop,nop,TS val 4294910388 ecr 155414,mptcp dss ack 3868134951], length 0
10:18:01.834443 IP 112.26.2.1.43445 > 112.26.2.8.39903: Flags [.], seq 341293:342721, ack 1, win 4017, options [nop,nop,TS val 155438 ecr 4294909204,mptcp dss ack 1720219151 seq 3868173507 subseq 341293 len 1428 csum 0x9ef8], length 1428
10:18:01.890689 IP 112.26.2.8.39903 > 112.26.2.1.43445: Flags [.], ack 342721, win 24455, options [nop,nop,TS val 4294910491 ecr 155438,mptcp dss ack 3868134951], length 0
10:18:01.891012 IP 112.26.2.8.39903 > 112.26.2.1.43445: Flags [.], ack 342721, win 24455, options [nop,nop,TS val 4294910491 ecr 155438,mptcp dss ack 3868134951], length 0
10:18:01.937666 IP 112.26.2.1.43445 > 112.26.2.8.39903: Flags [.], seq 342721:344149, ack 1, win 4017, options [nop,nop,TS val 155484 ecr 4294909293,mptcp dss ack 1720219151 seq 3868182075 subseq 342721 len 1428 csum 0x2b14], length 1428
10:18:01.955354 IP 112.26.2.1.43445 > 112.26.2.8.39903: Flags [.], seq 345577:347005, ack 1, win 4017, options [nop,nop,TS val 156322 ecr 4294909893,mptcp dss ack 1720219151 seq 3868209207 subseq 345577 len 1428 csum 0xe9f3], length 1428
10:18:01.955660 IP 112.26.2.1.43445 > 112.26.2.8.39903: Flags [.], seq 345577:347005, ack 1, win 4017, options [nop,nop,TS val 156322 ecr 4294909893,mptcp dss ack 1720219151 seq 3868209207 subseq 345577 len 1428 csum 0xe9f3], length 1428
10:18:01.967564 IP 112.26.2.8.39903 > 112.26.2.1.43445: Flags [.], ack 344149, win 24455, options [nop,nop,TS val 4294910594 ecr 155484,mptcp dss ack 3868134951], length 0
10:18:01.967844 IP 112.26.2.8.39903 > 112.26.2.1.43445: Flags [.], ack 344149, win 24455, options [nop,nop,TS val 4294910594 ecr 155484,mptcp dss ack 3868134951], length 0
10:18:02.020962 IP 112.26.2.1.43445 > 112.26.2.8.39903: Flags [.], seq 344149:345577, ack 1, win 4017, options [nop,nop,TS val 155571 ecr 4294909407,mptcp dss ack 1720219151 seq 3868186359 subseq 344149 len 1428 csum 0xeb82], length 1428
10:18:02.058870 IP 112.26.2.8.39903 > 112.26.2.1.43445: Flags [.], ack 345577, win 24455, options [nop,nop,TS val 4294910678 ecr 155571,mptcp dss ack 3868134951], length 0
10:18:02.059196 IP 112.26.2.8.39903 > 112.26.2.1.43445: Flags [.], ack 345577, win 24455, options [nop,nop,TS val 4294910678 ecr 155571,mptcp dss ack 3868134951], length 0
10:18:02.178464 IP 112.26.2.1.43445 > 112.26.2.8.39903: Flags [.], seq 347005:348433, ack 1, win 4017, options [nop,nop,TS val 156553 ecr 4294910006,mptcp dss ack 1720219151 seq 3868222059 subseq 347005 len 1428 csum 0x6d70], length 1428
10:18:02.178776 IP 112.26.2.1.43445 > 112.26.2.8.39903: Flags [.], seq 347005:348433, ack 1, win 4017, options [nop,nop,TS val 156553 ecr 4294910006,mptcp dss ack 1720219151 seq 3868222059 subseq 347005 len 1428 csum 0x6d70], length 1428
10:18:02.275369 IP 112.26.2.1.43445 > 112.26.2.8.39903: Flags [.], seq 348433:349861, ack 1, win 4017, options [nop,nop,TS val 156648 ecr 4294910111,mptcp dss ack 1720219151 seq 3868224915 subseq 348433 len 1428 csum 0x336b], length 1428
10:18:02.275722 IP 112.26.2.1.43445 > 112.26.2.8.39903: Flags [.], seq 348433:349861, ack 1, win 4017, options [nop,nop,TS val 156648 ecr 4294910111,mptcp dss ack 1720219151 seq 3868224915 subseq 348433 len 1428 csum 0x336b], length 1428
10:18:02.341170 IP 112.26.2.1.43445 > 112.26.2.8.39903: Flags [.], seq 349861:351289, ack 1, win 4017, options [nop,nop,TS val 156648 ecr 4294910221,mptcp dss ack 1720219151 seq 3868226343 subseq 349861 len 1428 csum 0xd803], length 1428
10:18:02.341541 IP 112.26.2.1.43445 > 112.26.2.8.39903: Flags [.], seq 349861:351289, ack 1, win 4017, options [nop,nop,TS val 156648 ecr 4294910221,mptcp dss ack 1720219151 seq 3868226343 subseq 349861 len 1428 csum 0xd803], length 1428
10:18:02.423531 IP 112.26.2.1.43445 > 112.26.2.8.39903: Flags [.], seq 351289:352717, ack 1, win 4017, options [nop,nop,TS val 156752 ecr 4294910320,mptcp dss ack 1720219151 seq 3868239195 subseq 351289 len 1428 csum 0xf333], length 1428
10:18:02.423798 IP 112.26.2.1.43445 > 112.26.2.8.39903: Flags [.], seq 351289:352717, ack 1, win 4017, options [nop,nop,TS val 156752 ecr 4294910320,mptcp dss ack 1720219151 seq 3868239195 subseq 351289 len 1428 csum 0xf333], length 1428
10:18:02.499408 IP 112.26.2.1.43445 > 112.26.2.8.39903: Flags [.], seq 352717:354145, ack 1, win 4017, options [nop,nop,TS val 156752 ecr 4294910320,mptcp dss ack 1720219151 seq 3868240623 subseq 352717 len 1428 csum 0x41ff], length 1428
10:18:02.499658 IP 112.26.2.1.43445 > 112.26.2.8.39903: Flags [.], seq 352717:354145, ack 1, win 4017, options [nop,nop,TS val 156752 ecr 4294910320,mptcp dss ack 1720219151 seq 3868240623 subseq 352717 len 1428 csum 0x41ff], length 1428
10:18:02.584824 IP 112.26.2.1.43445 > 112.26.2.8.39903: Flags [.], seq 345577:347005, ack 1, win 4017, options [nop,nop,TS val 156322 ecr 4294909893,mptcp dss ack 1720219151 seq 3868209207 subseq 345577 len 1428 csum 0xe9f3], length 1428
10:18:02.593757 IP 112.26.2.8.39903 > 112.26.2.1.43445: Flags [.], ack 347005, win 24231, options [nop,nop,TS val 4294911241 ecr 156322,mptcp dss ack 3868160655], length 0
10:18:02.594044 IP 112.26.2.8.39903 > 112.26.2.1.43445: Flags [.], ack 347005, win 24231, options [nop,nop,TS val 4294911241 ecr 156322,mptcp dss ack 3868160655], length 0
10:18:02.605692 IP 112.26.2.1.43445 > 112.26.2.8.39903: Flags [.], seq 354145:355573, ack 1, win 4017, options [nop,nop,TS val 156827 ecr 4294910388,mptcp dss ack 1720219151 seq 3868243479 subseq 354145 len 1428 csum 0x9fa6], length 1428
10:18:02.605940 IP 112.26.2.1.43445 > 112.26.2.8.39903: Flags [.], seq 354145:355573, ack 1, win 4017, options [nop,nop,TS val 156827 ecr 4294910388,mptcp dss ack 1720219151 seq 3868243479 subseq 354145 len 1428 csum 0x9fa6], length 1428
10:18:02.660040 IP 112.26.2.1.43445 > 112.26.2.8.39903: Flags [.], seq 355573:357001, ack 1, win 4017, options [nop,nop,TS val 156869 ecr 4294910491,mptcp dss ack 1720219151 seq 3868244907 subseq 355573 len 1428 csum 0x9370], length 1428
10:18:02.660381 IP 112.26.2.1.43445 > 112.26.2.8.39903: Flags [.], seq 355573:357001, ack 1, win 4017, options [nop,nop,TS val 156869 ecr 4294910491,mptcp dss ack 1720219151 seq 3868244907 subseq 355573 len 1428 csum 0x9370], length 1428
10:18:02.750447 IP 112.26.2.1.43445 > 112.26.2.8.39903: Flags [.], seq 357001:358429, ack 1, win 4017, options [nop,nop,TS val 157051 ecr 4294910594,mptcp dss ack 1720219151 seq 3868257759 subseq 357001 len 1428 csum 0xe044], length 1428
10:18:02.750716 IP 112.26.2.1.43445 > 112.26.2.8.39903: Flags [.], seq 357001:358429, ack 1, win 4017, options [nop,nop,TS val 157051 ecr 4294910594,mptcp dss ack 1720219151 seq 3868257759 subseq 357001 len 1428 csum 0xe044], length 1428
10:18:02.841734 IP 112.26.2.1.43445 > 112.26.2.8.39903: Flags [.], seq 347005:348433, ack 1, win 4017, options [nop,nop,TS val 156553 ecr 4294910006,mptcp dss ack 1720219151 seq 3868222059 subseq 347005 len 1428 csum 0x6d70], length 1428
10:18:02.848737 IP 112.26.2.1.43445 > 112.26.2.8.39903: Flags [.], seq 358429:359857, ack 1, win 4017, options [nop,nop,TS val 157051 ecr 4294910594,mptcp dss ack 1720219151 seq 3868259187 subseq 358429 len 1428 csum 0xf087], length 1428
10:18:02.849035 IP 112.26.2.1.43445 > 112.26.2.8.39903: Flags [.], seq 358429:359857, ack 1, win 4017, options [nop,nop,TS val 157051 ecr 4294910594,mptcp dss ack 1720219151 seq 3868259187 subseq 358429 len 1428 csum 0xf087], length 1428
10:18:02.860139 IP 112.26.2.8.39903 > 112.26.2.1.43445: Flags [.], ack 348433, win 24231, options [nop,nop,TS val 4294911482 ecr 156553,mptcp dss ack 3868160655], length 0
10:18:02.860421 IP 112.26.2.8.39903 > 112.26.2.1.43445: Flags [.], ack 348433, win 24231, options [nop,nop,TS val 4294911482 ecr 156553,mptcp dss ack 3868160655], length 0
10:18:02.897222 IP 112.26.2.1.43445 > 112.26.2.8.39903: Flags [.], seq 359857:361285, ack 1, win 4017, options [nop,nop,TS val 157140 ecr 4294910678,mptcp dss ack 1720219151 seq 3868263471 subseq 359857 len 1428 csum 0x1126], length 1428
10:18:02.897539 IP 112.26.2.1.43445 > 112.26.2.8.39903: Flags [.], seq 359857:361285, ack 1, win 4017, options [nop,nop,TS val 157140 ecr 4294910678,mptcp dss ack 1720219151 seq 3868263471 subseq 359857 len 1428 csum 0x1126], length 1428
10:18:02.941797 IP 112.26.2.1.43445 > 112.26.2.8.39903: Flags [.], seq 348433:349861, ack 1, win 4017, options [nop,nop,TS val 156648 ecr 4294910111,mptcp dss ack 1720219151 seq 3868224915 subseq 348433 len 1428 csum 0x336b], length 1428
10:18:02.950924 IP 112.26.2.8.39903 > 112.26.2.1.43445: Flags [.], ack 349861, win 24231, options [nop,nop,TS val 4294911598 ecr 156648,mptcp dss ack 3868160655], length 0
10:18:02.951199 IP 112.26.2.8.39903 > 112.26.2.1.43445: Flags [.], ack 349861, win 24231, options [nop,nop,TS val 4294911598 ecr 156648,mptcp dss ack 3868160655], length 0
10:18:03.044347 IP 112.26.2.1.43445 > 112.26.2.8.39903: Flags [.], seq 349861:351289, ack 1, win 4017, options [nop,nop,TS val 156648 ecr 4294910221,mptcp dss ack 1720219151 seq 3868226343 subseq 349861 len 1428 csum 0xd803], length 1428
10:18:03.051040 IP 112.26.2.8.39903 > 112.26.2.1.43445: Flags [.], ack 351289, win 24231, options [nop,nop,TS val 4294911701 ecr 156648,mptcp dss ack 3868160655], length 0
10:18:03.051355 IP 112.26.2.8.39903 > 112.26.2.1.43445: Flags [.], ack 351289, win 24231, options [nop,nop,TS val 4294911701 ecr 156648,mptcp dss ack 3868160655], length 0
10:18:03.114340 IP 112.26.2.1.43445 > 112.26.2.8.39903: Flags [.], seq 351289:352717, ack 1, win 4017, options [nop,nop,TS val 156752 ecr 4294910320,mptcp dss ack 1720219151 seq 3868239195 subseq 351289 len 1428 csum 0xf333], length 1428
10:18:03.148923 IP 112.26.2.8.39903 > 112.26.2.1.43445: Flags [.], ack 352717, win 24231, options [nop,nop,TS val 4294911771 ecr 156752,mptcp dss ack 3868160655], length 0
10:18:03.149185 IP 112.26.2.8.39903 > 112.26.2.1.43445: Flags [.], ack 352717, win 24231, options [nop,nop,TS val 4294911771 ecr 156752,mptcp dss ack 3868160655], length 0
10:18:03.223859 IP 112.26.2.1.43445 > 112.26.2.8.39903: Flags [.], seq 352717:354145, ack 1, win 4017, options [nop,nop,TS val 156752 ecr 4294910320,mptcp dss ack 1720219151 seq 3868240623 subseq 352717 len 1428 csum 0x41ff], length 1428
10:18:03.247277 IP 112.26.2.8.39903 > 112.26.2.1.43445: Flags [.], ack 354145, win 24231, options [nop,nop,TS val 4294911880 ecr 156752,mptcp dss ack 3868160655], length 0
10:18:03.247624 IP 112.26.2.8.39903 > 112.26.2.1.43445: Flags [.], ack 354145, win 24231, options [nop,nop,TS val 4294911880 ecr 156752,mptcp dss ack 3868160655], length 0
10:18:03.281836 IP 112.26.2.1.43445 > 112.26.2.8.39903: Flags [.], seq 361285:362713, ack 1, win 4017, options [nop,nop,TS val 157654 ecr 4294911241,mptcp dss ack 1720219151 seq 3868286319 subseq 361285 len 1428 csum 0xa3d2], length 1428
10:18:03.282157 IP 112.26.2.1.43445 > 112.26.2.8.39903: Flags [.], seq 361285:362713, ack 1, win 4017, options [nop,nop,TS val 157654 ecr 4294911241,mptcp dss ack 1720219151 seq 3868286319 subseq 361285 len 1428 csum 0xa3d2], length 1428
10:18:03.377393 IP 112.26.2.1.43445 > 112.26.2.8.39903: Flags [.], seq 354145:355573, ack 1, win 4017, options [nop,nop,TS val 156827 ecr 4294910388,mptcp dss ack 1720219151 seq 3868243479 subseq 354145 len 1428 csum 0x9fa6], length 1428
10:18:03.389933 IP 112.26.2.8.39903 > 112.26.2.1.43445: Flags [.], ack 355573, win 24231, options [nop,nop,TS val 4294912034 ecr 156827,mptcp dss ack 3868160655], length 0
10:18:03.390196 IP 112.26.2.8.39903 > 112.26.2.1.43445: Flags [.], ack 355573, win 24231, options [nop,nop,TS val 4294912034 ecr 156827,mptcp dss ack 3868160655], length 0
10:18:03.465259 IP 112.26.2.1.43445 > 112.26.2.8.39903: Flags [.], seq 357001:358429, ack 1, win 4017, options [nop,nop,TS val 157051 ecr 4294910594,mptcp dss ack 1720219151 seq 3868257759 subseq 357001 len 1428 csum 0xe044], length 1428
10:18:03.472198 IP 112.26.2.8.39903 > 112.26.2.1.43445: Flags [.], ack 355573, win 24231, options [nop,nop,TS val 4294912122 ecr 156827,nop,nop,sack 1 {357001:358429},mptcp dss ack 3868160655], length 0
10:18:03.472403 IP 112.26.2.8.39903 > 112.26.2.1.43445: Flags [.], ack 355573, win 24231, options [nop,nop,TS val 4294912122 ecr 156827,nop,nop,sack 1 {357001:358429},mptcp dss ack 3868160655], length 0
10:18:03.565219 IP 112.26.2.1.43445 > 112.26.2.8.39903: Flags [.], seq 358429:359857, ack 1, win 4017, options [nop,nop,TS val 157051 ecr 4294910594,mptcp dss ack 1720219151 seq 3868259187 subseq 358429 len 1428 csum 0xf087], length 1428
10:18:03.573134 IP 112.26.2.8.39903 > 112.26.2.1.43445: Flags [.], ack 355573, win 24231, options [nop,nop,TS val 4294912222 ecr 156827,nop,nop,sack 1 {357001:359857},mptcp dss ack 3868160655], length 0
10:18:03.573349 IP 112.26.2.8.39903 > 112.26.2.1.43445: Flags [.], ack 355573, win 24231, options [nop,nop,TS val 4294912222 ecr 156827,nop,nop,sack 1 {357001:359857},mptcp dss ack 3868160655], length 0
10:18:03.639938 IP 112.26.2.1.43445 > 112.26.2.8.39903: Flags [.], seq 362713:364141, ack 1, win 4017, options [nop,nop,TS val 158010 ecr 4294911482,mptcp dss ack 1720219151 seq 3868292031 subseq 362713 len 1428 csum 0xe8a8], length 1428
10:18:03.640166 IP 112.26.2.1.43445 > 112.26.2.8.39903: Flags [.], seq 362713:364141, ack 1, win 4017, options [nop,nop,TS val 158010 ecr 4294911482,mptcp dss ack 1720219151 seq 3868292031 subseq 362713 len 1428 csum 0xe8a8], length 1428
10:18:03.742671 IP 112.26.2.1.43445 > 112.26.2.8.39903: Flags [.], seq 364141:365569, ack 1, win 4017, options [nop,nop,TS val 158071 ecr 4294911598,mptcp dss ack 1720219151 seq 3868294887 subseq 364141 len 1428 csum 0x1147], length 1428
10:18:03.743032 IP 112.26.2.1.43445 > 112.26.2.8.39903: Flags [.], seq 364141:365569, ack 1, win 4017, options [nop,nop,TS val 158071 ecr 4294911598,mptcp dss ack 1720219151 seq 3868294887 subseq 364141 len 1428 csum 0x1147], length 1428
