10:17:05.051112 IP 112.26.0.8.36004 > 112.26.0.1.43445: Flags [S], seq 604036043, win 65535, options [mss 1460,sackOK,TS val 4294851649 ecr 0,nop,wscale 6,mptcp capable csum {0x5fe731cb2a0ffaa8}], length 0
10:17:05.151914 IP 112.26.0.8.36004 > 112.26.0.1.43445: Flags [S], seq 604036043, win 65535, options [mss 1460,sackOK,TS val 4294851649 ecr 0,nop,wscale 6,mptcp capable csum {0x5fe731cb2a0ffaa8}], length 0
10:17:05.456418 IP 112.26.0.1.43445 > 112.26.0.8.36004: Flags [S.], seq 3411350881, ack 604036044, win 65535, options [mss 1460,sackOK,TS val 99544 ecr 4294851649,nop,wscale 6,mptcp capable csum {0x95b44a60aabf03a2}], length 0
10:17:05.456835 IP 112.26.0.8.36004 > 112.26.0.1.43445: Flags [.], ack 1, win 1369, options [nop,nop,TS val 4294854113 ecr 99544,mptcp capable csum {0x5fe731cb2a0ffaa8,0x95b44a60aabf03a2},mptcp dss ack 3866414399], length 0
10:17:05.456904 IP 112.26.0.8.36004 > 112.26.0.1.43445: Flags [.], ack 1, win 1369, options [nop,nop,TS val 4294854113 ecr 99544,mptcp add-addr id 3 112.26.1.8,mptcp dss ack 3866414399], length 0
10:17:05.456944 IP 112.26.0.8.36004 > 112.26.0.1.43445: Flags [.], ack 1, win 1369, options [nop,nop,TS val 4294854113 ecr 99544,mptcp add-addr id 4 112.26.2.8,mptcp dss ack 3866414399], length 0
10:17:05.456985 IP 112.26.0.8.36004 > 112.26.0.1.43445: Flags [.], ack 1, win 1369, options [nop,nop,TS val 4294854113 ecr 99544,mptcp add-addr id 5 112.26.3.8,mptcp dss ack 3866414399], length 0
10:17:35.658876 IP 112.26.0.8.36004 > 112.26.0.1.43445: Flags [.], ack 216869, win 21353, options [nop,nop,TS val 4294883551 ecr 128567,mptcp dss ack 3866908299], length 0
10:17:35.738120 IP 112.26.0.1.43445 > 112.26.0.8.36004: Flags [.], seq 222581:224009, ack 1, win 4017, options [nop,nop,TS val 129118 ecr 4294882651,mptcp dss ack 1720219151 seq 3866973987 subseq 222581 len 1428 csum 0x1eb0], length 1428
10:17:35.738333 IP 112.26.0.8.36004 > 112.26.0.1.43445: Flags [.], ack 216869, win 22357, options [nop,nop,TS val 4294884394 ecr 128567,nop,nop,sack 1 {218297:224009},mptcp dss ack 3866952567], length 0
10:17:35.833458 IP 112.26.0.1.43445 > 112.26.0.8.36004: Flags [.], seq 224009:225437, ack 1, win 4017, options [nop,nop,TS val 129211 ecr 4294882736,mptcp dss ack 1720219151 seq 3866979699 subseq 224009 len 1428 csum 0x3a9], length 1428
10:17:54.625021 IP 112.26.0.8.36004 > 112.26.0.1.43445: Flags [.], ack 403937, win 23973, options [nop,nop,TS val 4294902578 ecr 146902,nop,nop,sack 1 {405365:419645},mptcp dss ack 3867707979], length 0
10:18:18.400060 IP 112.26.0.1.43445 > 112.26.0.8.36004: Flags [.], seq 586721:588149, ack 1, win 4017, options [nop,nop,TS val 172736 ecr 4294918589,mptcp dss ack 1720219151 seq 3868431975 subseq 586721 len 1428 csum 0x59f0], length 1428
10:18:26.156140 IP 112.26.0.1.43445 > 112.26.0.8.36004: Flags [.], seq 682397:683825, ack 1, win 4017, options [nop,nop,TS val 179246 ecr 4294932875,mptcp dss ack 1720219151 seq 3868667595 subseq 682397 len 1428 csum 0xc383], length 1428
10:18:26.156342 IP 112.26.0.8.36004 > 112.26.0.1.43445: Flags [.], ack 683825, win 24478, options [nop,nop,TS val 4294934812 ecr 179246,mptcp dss ack 3868620471], length 0
10:18:26.253758 IP 112.26.0.1.43445 > 112.26.0.8.36004: Flags [.], seq 683825:685253, ack 1, win 4017, options [nop,nop,TS val 179432 ecr 4294932941,mptcp dss ack 1720219151 seq 3868670451 subseq 683825 len 1428 csum 0x6323], length 1428
10:18:26.254075 IP 112.26.0.8.36004 > 112.26.0.1.43445: Flags [.], ack 685253, win 24478, options [nop,nop,TS val 4294934910 ecr 179432,mptcp dss ack 3868620471], length 0
10:18:26.337298 IP 112.26.0.1.43445 > 112.26.0.8.36004: Flags [.], seq 685253:686681, ack 1, win 4017, options [nop,nop,TS val 179619 ecr 4294933181,mptcp dss ack 1720219151 seq 3868694727 subseq 685253 len 1428 csum 0xbaab], length 1428
10:18:26.337651 IP 112.26.0.8.36004 > 112.26.0.1.43445: Flags [.], ack 686681, win 24478, options [nop,nop,TS val 4294934994 ecr 179619,mptcp dss ack 3868620471], length 0
10:18:26.410857 IP 112.26.0.1.43445 > 112.26.0.8.36004: Flags [.], seq 686681:688109, ack 1, win 4017, options [nop,nop,TS val 179619 ecr 4294933181,mptcp dss ack 1720219151 seq 3868696155 subseq 686681 len 1428 csum 0x3611], length 1428
10:18:26.411180 IP 112.26.0.8.36004 > 112.26.0.1.43445: Flags [.], ack 688109, win 24478, options [nop,nop,TS val 4294935067 ecr 179619,mptcp dss ack 3868620471], length 0
10:18:26.497391 IP 112.26.0.8.36004 > 112.26.0.1.43445: Flags [.], ack 683825, win 24478, options [nop,nop,TS val 4294934812 ecr 179246,mptcp dss ack 3868620471], length 0
10:18:26.587611 IP 112.26.0.1.43445 > 112.26.0.8.36004: Flags [.], seq 688109:689537, ack 1, win 4017, options [nop,nop,TS val 179694 ecr 4294933431,mptcp dss ack 1720219151 seq 3868700439 subseq 688109 len 1428 csum 0x6796], length 1428
10:18:26.587825 IP 112.26.0.8.36004 > 112.26.0.1.43445: Flags [.], ack 689537, win 24255, options [nop,nop,TS val 4294935243 ecr 179694,mptcp dss ack 3868634751], length 0
10:18:26.844550 IP 112.26.0.8.36004 > 112.26.0.1.43445: Flags [.], ack 685253, win 24478, options [nop,nop,TS val 4294934910 ecr 179432,mptcp dss ack 3868620471], length 0
10:18:26.916169 IP 112.26.0.1.43445 > 112.26.0.8.36004: Flags [.], seq 689537:690965, ack 1, win 4017, options [nop,nop,TS val 179694 ecr 4294933431,mptcp dss ack 1720219151 seq 3868701867 subseq 689537 len 1428 csum 0x8ebf], length 1428
10:18:26.916444 IP 112.26.0.8.36004 > 112.26.0.1.43445: Flags [.], ack 690965, win 24272, options [nop,nop,TS val 4294935572 ecr 179694,mptcp dss ack 3868654743], length 0
10:18:27.029517 IP 112.26.0.8.36004 > 112.26.0.1.43445: Flags [.], ack 686681, win 24478, options [nop,nop,TS val 4294934994 ecr 179619,mptcp dss ack 3868620471], length 0
10:18:27.123613 IP 112.26.0.1.43445 > 112.26.0.8.36004: Flags [.], seq 690965:692393, ack 1, win 4017, options [nop,nop,TS val 179694 ecr 4294933431,mptcp dss ack 1720219151 seq 3868703295 subseq 690965 len 1428 csum 0x1295], length 1428
10:18:27.123915 IP 112.26.0.8.36004 > 112.26.0.1.43445: Flags [.], ack 692393, win 24254, options [nop,nop,TS val 4294935780 ecr 179694,mptcp dss ack 3868659027], length 0
10:18:27.175475 IP 112.26.0.8.36004 > 112.26.0.1.43445: Flags [.], ack 688109, win 24478, options [nop,nop,TS val 4294935067 ecr 179619,mptcp dss ack 3868620471], length 0
10:18:27.272540 IP 112.26.0.1.43445 > 112.26.0.8.36004: Flags [.], seq 692393:693821, ack 1, win 4017, options [nop,nop,TS val 179694 ecr 4294933431,mptcp dss ack 1720219151 seq 3868704723 subseq 692393 len 1428 csum 0x6d10], length 1428
10:18:27.272816 IP 112.26.0.8.36004 > 112.26.0.1.43445: Flags [.], ack 693821, win 24254, options [nop,nop,TS val 4294935929 ecr 179694,mptcp dss ack 3868661883], length 0
10:18:27.327927 IP 112.26.0.1.43445 > 112.26.0.8.36004: Flags [.], seq 695249:696677, ack 1, win 4017, options [nop,nop,TS val 180078 ecr 4294933999,mptcp dss ack 1720219151 seq 3868716147 subseq 695249 len 1428 csum 0x19d9], length 1428
10:18:27.328191 IP 112.26.0.8.36004 > 112.26.0.1.43445: Flags [.], ack 693821, win 24414, options [nop,nop,TS val 4294935984 ecr 179694,nop,nop,sack 1 {695249:696677},mptcp dss ack 3868687587], length 0
10:18:27.529667 IP 112.26.0.1.43445 > 112.26.0.8.36004: Flags [.], seq 698105:699533, ack 1, win 4017, options [nop,nop,TS val 180200 ecr 4294934073,mptcp dss ack 1720219151 seq 3868723287 subseq 698105 len 1428 csum 0x3c28], length 1428
10:18:27.529880 IP 112.26.0.8.36004 > 112.26.0.1.43445: Flags [.], ack 693821, win 24414, options [nop,nop,TS val 4294936186 ecr 179694,nop,nop,sack 2 {698105:699533}{695249:696677},mptcp dss ack 3868687587], length 0
10:18:27.586498 IP 112.26.0.1.43445 > 112.26.0.8.36004: Flags [.], seq 699533:700961, ack 1, win 4017, options [nop,nop,TS val 180273 ecr 4294934187,mptcp dss ack 1720219151 seq 3868726143 subseq 699533 len 1428 csum 0x58b0], length 1428
10:18:27.586764 IP 112.26.0.8.36004 > 112.26.0.1.43445: Flags [.], ack 693821, win 24414, options [nop,nop,TS val 4294936242 ecr 179694,nop,nop,sack 2 {698105:700961}{695249:696677},mptcp dss ack 3868687587], length 0
10:18:27.632381 IP 112.26.0.8.36004 > 112.26.0.1.43445: Flags [.], ack 690965, win 24272, options [nop,nop,TS val 4294935572 ecr 179694,mptcp dss ack 3868654743], length 0
10:18:27.711873 IP 112.26.0.1.43445 > 112.26.0.8.36004: Flags [.], seq 700961:702389, ack 1, win 4017, options [nop,nop,TS val 180351 ecr 4294934261,mptcp dss ack 1720219151 seq 3868727571 subseq 700961 len 1428 csum 0xaac8], length 1428
10:18:27.712142 IP 112.26.0.8.36004 > 112.26.0.1.43445: Flags [.], ack 693821, win 24414, options [nop,nop,TS val 4294936368 ecr 179694,nop,nop,sack 2 {698105:702389}{695249:696677},mptcp dss ack 3868687587], length 0
10:18:27.831645 IP 112.26.0.1.43445 > 112.26.0.8.36004: Flags [.], seq 702389:703817, ack 1, win 4017, options [nop,nop,TS val 180876 ecr 4294934812,mptcp dss ack 1720219151 seq 3868738995 subseq 702389 len 1428 csum 0xd9c2], length 1428
10:18:27.831882 IP 112.26.0.8.36004 > 112.26.0.1.43445: Flags [.], ack 693821, win 24414, options [nop,nop,TS val 4294936487 ecr 179694,nop,nop,sack 2 {698105:703817}{695249:696677},mptcp dss ack 3868687587], length 0
10:18:27.930493 IP 112.26.0.1.43445 > 112.26.0.8.36004: Flags [.], seq 703817:705245, ack 1, win 4017, options [nop,nop,TS val 180876 ecr 4294934812,mptcp dss ack 1720219151 seq 3868740423 subseq 703817 len 1428 csum 0xe3f8], length 1428
10:18:27.930808 IP 112.26.0.8.36004 > 112.26.0.1.43445: Flags [.], ack 693821, win 24399, options [nop,nop,TS val 4294936587 ecr 179694,nop,nop,sack 2 {698105:705245}{695249:696677},mptcp dss ack 3868689015], length 0
10:18:28.016265 IP 112.26.0.1.43445 > 112.26.0.8.36004: Flags [.], seq 705245:706673, ack 1, win 4017, options [nop,nop,TS val 181224 ecr 4294934910,mptcp dss ack 1720219151 seq 3868751847 subseq 705245 len 1428 csum 0x6841], length 1428
10:18:28.016542 IP 112.26.0.8.36004 > 112.26.0.1.43445: Flags [.], ack 693821, win 24399, options [nop,nop,TS val 4294936673 ecr 179694,nop,nop,sack 2 {698105:706673}{695249:696677},mptcp dss ack 3868689015], length 0
10:18:28.126071 IP 112.26.0.8.36004 > 112.26.0.1.43445: Flags [.], ack 693821, win 24414, options [nop,nop,TS val 4294935984 ecr 179694,nop,nop,sack 1 {695249:696677},mptcp dss ack 3868687587], length 0
10:18:28.284675 IP 112.26.0.8.36004 > 112.26.0.1.43445: Flags [.], ack 693821, win 24414, options [nop,nop,TS val 4294936186 ecr 179694,nop,nop,sack 2 {698105:699533}{695249:696677},mptcp dss ack 3868687587], length 0
10:18:28.418569 IP 112.26.0.1.43445 > 112.26.0.8.36004: Flags [.], seq 706673:708101, ack 1, win 4017, options [nop,nop,TS val 181409 ecr 4294934994,mptcp dss ack 1720219151 seq 3868760415 subseq 706673 len 1428 csum 0xe3d9], length 1428
10:18:28.418889 IP 112.26.0.8.36004 > 112.26.0.1.43445: Flags [.], ack 693821, win 24151, options [nop,nop,TS val 4294937074 ecr 179694,nop,nop,sack 2 {698105:708101}{695249:696677},mptcp dss ack 3868706151], length 0
10:18:28.529419 IP 112.26.0.8.36004 > 112.26.0.1.43445: Flags [.], ack 693821, win 24414, options [nop,nop,TS val 4294936368 ecr 179694,nop,nop,sack 2 {698105:702389}{695249:696677},mptcp dss ack 3868687587], length 0
10:18:28.585487 IP 112.26.0.1.43445 > 112.26.0.8.36004: Flags [.], seq 708101:709529, ack 1, win 4017, options [nop,nop,TS val 181409 ecr 4294934994,mptcp dss ack 1720219151 seq 3868761843 subseq 708101 len 1428 csum 0x3277], length 1428
10:18:28.585775 IP 112.26.0.8.36004 > 112.26.0.1.43445: Flags [.], ack 693821, win 24151, options [nop,nop,TS val 4294937241 ecr 179694,nop,nop,sack 2 {698105:709529}{695249:696677},mptcp dss ack 3868706151], length 0
10:18:28.675432 IP 112.26.0.1.43445 > 112.26.0.8.36004: Flags [.], seq 709529:710957, ack 1, win 4017, options [nop,nop,TS val 181554 ecr 4294935067,mptcp dss ack 1720219151 seq 3868767555 subseq 709529 len 1428 csum 0x19da], length 1428
10:18:28.675789 IP 112.26.0.8.36004 > 112.26.0.1.43445: Flags [.], ack 693821, win 24151, options [nop,nop,TS val 4294937332 ecr 179694,nop,nop,sack 2 {698105:710957}{695249:696677},mptcp dss ack 3868706151], length 0
10:18:28.748148 IP 112.26.0.8.36004 > 112.26.0.1.43445: Flags [.], ack 693821, win 24399, options [nop,nop,TS val 4294936587 ecr 179694,nop,nop,sack 2 {698105:705245}{695249:696677},mptcp dss ack 3868689015], length 0
10:18:28.853329 IP 112.26.0.8.36004 > 112.26.0.1.43445: Flags [.], ack 693821, win 24399, options [nop,nop,TS val 4294936673 ecr 179694,nop,nop,sack 2 {698105:706673}{695249:696677},mptcp dss ack 3868689015], length 0
10:18:28.910584 IP 112.26.0.1.43445 > 112.26.0.8.36004: Flags [.], seq 712385:713813, ack 1, win 4017, options [nop,nop,TS val 182011 ecr 4294935572,mptcp dss ack 1720219151 seq 3868778979 subseq 712385 len 1428 csum 0xafff], length 1428
10:18:28.910904 IP 112.26.0.8.36004 > 112.26.0.1.43445: Flags [.], ack 693821, win 24151, options [nop,nop,TS val 4294937567 ecr 179694,nop,nop,sack 2 {712385:713813}{698105:710957},mptcp dss ack 3868706151], length 0
10:18:29.034582 IP 112.26.0.1.43445 > 112.26.0.8.36004: Flags [.], seq 713813:715241, ack 1, win 4017, options [nop,nop,TS val 182504 ecr 4294935984,mptcp dss ack 1720219151 seq 3868788975 subseq 713813 len 1428 csum 0x10c4], length 1428
10:18:29.034895 IP 112.26.0.8.36004 > 112.26.0.1.43445: Flags [.], ack 693821, win 24151, options [nop,nop,TS val 4294937691 ecr 179694,nop,nop,sack 2 {712385:715241}{698105:710957},mptcp dss ack 3868706151], length 0
10:18:29.171325 IP 112.26.0.1.43445 > 112.26.0.8.36004: Flags [.], seq 715241:716669, ack 1, win 4017, options [nop,nop,TS val 182504 ecr 4294935984,mptcp dss ack 1720219151 seq 3868790403 subseq 715241 len 1428 csum 0x569], length 1428
10:18:29.171654 IP 112.26.0.8.36004 > 112.26.0.1.43445: Flags [.], ack 693821, win 24151, options [nop,nop,TS val 4294937827 ecr 179694,nop,nop,sack 2 {712385:716669}{698105:710957},mptcp dss ack 3868706151], length 0
10:18:29.258623 IP 112.26.0.1.43445 > 112.26.0.8.36004: Flags [.], seq 716669:718097, ack 1, win 4017, options [nop,nop,TS val 182504 ecr 4294935984,mptcp dss ack 1720219151 seq 3868791831 subseq 716669 len 1428 csum 0x9ebf], length 1428
10:18:29.258924 IP 112.26.0.8.36004 > 112.26.0.1.43445: Flags [.], ack 693821, win 24151, options [nop,nop,TS val 4294937915 ecr 179694,nop,nop,sack 2 {712385:718097}{698105:710957},mptcp dss ack 3868706151], length 0
10:18:29.343469 IP 112.26.0.8.36004 > 112.26.0.1.43445: Flags [.], ack 693821, win 24151, options [nop,nop,TS val 4294937241 ecr 179694,nop,nop,sack 2 {698105:709529}{695249:696677},mptcp dss ack 3868706151], length 0
10:18:29.420389 IP 112.26.0.8.36004 > 112.26.0.1.43445: Flags [.], ack 693821, win 24151, options [nop,nop,TS val 4294937332 ecr 179694,nop,nop,sack 2 {698105:710957}{695249:696677},mptcp dss ack 3868706151], length 0
10:18:29.514504 IP 112.26.0.1.43445 > 112.26.0.8.36004: Flags [.], seq 719525:720953, ack 1, win 4017, options [nop,nop,TS val 182740 ecr 4294936186,mptcp dss ack 1720219151 seq 3868798971 subseq 719525 len 1428 csum 0x3429], length 1428
10:18:29.514756 IP 112.26.0.8.36004 > 112.26.0.1.43445: Flags [.], ack 693821, win 24151, options [nop,nop,TS val 4294938171 ecr 179694,nop,nop,sack 2 {719525:720953}{712385:718097},mptcp dss ack 3868706151], length 0
10:18:29.607381 IP 112.26.0.8.36004 > 112.26.0.1.43445: Flags [.], ack 693821, win 24151, options [nop,nop,TS val 4294937567 ecr 179694,nop,nop,sack 2 {712385:713813}{698105:710957},mptcp dss ack 3868706151], length 0
10:18:29.696034 IP 112.26.0.1.43445 > 112.26.0.8.36004: Flags [.], seq 720953:722381, ack 1, win 4017, options [nop,nop,TS val 182934 ecr 4294936368,mptcp dss ack 1720219151 seq 3868804683 subseq 720953 len 1428 csum 0x6754], length 1428
10:18:29.696334 IP 112.26.0.8.36004 > 112.26.0.1.43445: Flags [.], ack 693821, win 24151, options [nop,nop,TS val 4294938352 ecr 179694,nop,nop,sack 2 {719525:722381}{712385:718097},mptcp dss ack 3868706151], length 0
10:18:29.754567 IP 112.26.0.8.36004 > 112.26.0.1.43445: Flags [.], ack 693821, win 24151, options [nop,nop,TS val 4294937691 ecr 179694,nop,nop,sack 2 {712385:715241}{698105:710957},mptcp dss ack 3868706151], length 0
10:18:29.816023 IP 112.26.0.1.43445 > 112.26.0.8.36004: Flags [.], seq 722381:723809, ack 1, win 4017, options [nop,nop,TS val 182934 ecr 4294936368,mptcp dss ack 1720219151 seq 3868806111 subseq 722381 len 1428 csum 0x3641], length 1428
10:18:29.816323 IP 112.26.0.8.36004 > 112.26.0.1.43445: Flags [.], ack 693821, win 24151, options [nop,nop,TS val 4294938472 ecr 179694,nop,nop,sack 2 {719525:723809}{712385:718097},mptcp dss ack 3868706151], length 0
10:18:29.877833 IP 112.26.0.1.43445 > 112.26.0.8.36004: Flags [.], seq 723809:725237, ack 1, win 4017, options [nop,nop,TS val 183164 ecr 4294936587,mptcp dss ack 1720219151 seq 3868816107 subseq 723809 len 1428 csum 0x3d95], length 1428
10:18:29.878086 IP 112.26.0.8.36004 > 112.26.0.1.43445: Flags [.], ack 693821, win 24151, options [nop,nop,TS val 4294938534 ecr 179694,nop,nop,sack 2 {719525:725237}{712385:718097},mptcp dss ack 3868706151], length 0
10:18:29.967938 IP 112.26.0.1.43445 > 112.26.0.8.36004: Flags [.], seq 725237:726665, ack 1, win 4017, options [nop,nop,TS val 183164 ecr 4294936587,mptcp dss ack 1720219151 seq 3868817535 subseq 725237 len 1428 csum 0xafdf], length 1428
10:18:29.969038 IP 112.26.0.8.36004 > 112.26.0.1.43445: Flags [.], ack 693821, win 24151, options [nop,nop,TS val 4294938625 ecr 179694,nop,nop,sack 2 {719525:726665}{712385:718097},mptcp dss ack 3868706151], length 0
10:18:30.110053 IP 112.26.0.1.43445 > 112.26.0.8.36004: Flags [.], seq 726665:728093, ack 1, win 4017, options [nop,nop,TS val 183260 ecr 4294936673,mptcp dss ack 1720219151 seq 3868821819 subseq 726665 len 1428 csum 0x3a1], length 1428
10:18:30.110369 IP 112.26.0.8.36004 > 112.26.0.1.43445: Flags [.], ack 693821, win 24151, options [nop,nop,TS val 4294938766 ecr 179694,nop,nop,sack 2 {719525:728093}{712385:718097},mptcp dss ack 3868706151], length 0
10:18:30.158453 IP 112.26.0.1.43445 > 112.26.0.8.36004: Flags [.], seq 693821:695249, ack 1, win 4017, options [nop,nop,TS val 183721 ecr 4294937241,mptcp dss ack 1720219151 seq 3868706151 subseq 693821 len 1428 csum 0x4a19], length 1428
10:18:30.158810 IP 112.26.0.8.36004 > 112.26.0.1.43445: Flags [.], ack 696677, win 23906, options [nop,nop,TS val 4294938815 ecr 183721,nop,nop,sack 2 {719525:728093}{712385:718097},mptcp dss ack 3868721859], length 0
10:18:30.228071 IP 112.26.0.1.43445 > 112.26.0.8.36004: Flags [.], seq 696677:698105, ack 1, win 4017, options [nop,nop,TS val 183721 ecr 4294937241,mptcp dss ack 1720219151 seq 3868721859 subseq 696677 len 1428 csum 0xacf4], length 1428
10:18:30.228416 IP 112.26.0.8.36004 > 112.26.0.1.43445: Flags [.], ack 710957, win 23328, options [nop,nop,TS val 4294938884 ecr 183721,nop,nop,sack 2 {719525:728093}{712385:718097},mptcp dss ack 3868777551], length 0
10:18:30.344378 IP 112.26.0.1.43445 > 112.26.0.8.36004: Flags [.], seq 710957:712385, ack 1, win 4017, options [nop,nop,TS val 183985 ecr 4294937567,mptcp dss ack 1720219151 seq 3868777551 subseq 710957 len 1428 csum 0xec2c], length 1428
10:18:30.344743 IP 112.26.0.8.36004 > 112.26.0.1.43445: Flags [.], ack 718097, win 23834, options [nop,nop,TS val 4294939001 ecr 183985,nop,nop,sack 1 {719525:728093},mptcp dss ack 3868793259], length 0
10:18:30.428747 IP 112.26.0.8.36004 > 112.26.0.1.43445: Flags [.], ack 693821, win 24151, options [nop,nop,TS val 4294938352 ecr 179694,nop,nop,sack 2 {719525:722381}{712385:718097},mptcp dss ack 3868706151], length 0
10:18:30.582808 IP 112.26.0.1.43445 > 112.26.0.8.36004: Flags [.], seq 728093:729521, ack 1, win 4017, options [nop,nop,TS val 184213 ecr 4294937691,mptcp dss ack 1720219151 seq 3868853235 subseq 728093 len 1428 csum 0x9c99], length 1428
10:18:30.583114 IP 112.26.0.8.36004 > 112.26.0.1.43445: Flags [.], ack 718097, win 23991, options [nop,nop,TS val 4294939239 ecr 183985,nop,nop,sack 1 {719525:729521},mptcp dss ack 3868793259], length 0
10:18:30.635509 IP 112.26.0.8.36004 > 112.26.0.1.43445: Flags [.], ack 693821, win 24151, options [nop,nop,TS val 4294938625 ecr 179694,nop,nop,sack 2 {719525:726665}{712385:718097},mptcp dss ack 3868706151], length 0
10:18:30.698731 IP 112.26.0.8.36004 > 112.26.0.1.43445: Flags [.], ack 693821, win 24151, options [nop,nop,TS val 4294938766 ecr 179694,nop,nop,sack 2 {719525:728093}{712385:718097},mptcp dss ack 3868706151], length 0
10:18:30.788050 IP 112.26.0.8.36004 > 112.26.0.1.43445: Flags [.], ack 696677, win 23906, options [nop,nop,TS val 4294938815 ecr 183721,nop,nop,sack 2 {719525:728093}{712385:718097},mptcp dss ack 3868721859], length 0
10:18:30.886777 IP 112.26.0.8.36004 > 112.26.0.1.43445: Flags [.], ack 710957, win 23328, options [nop,nop,TS val 4294938884 ecr 183721,nop,nop,sack 2 {719525:728093}{712385:718097},mptcp dss ack 3868777551], length 0
10:18:30.929512 IP 112.26.0.8.36004 > 112.26.0.1.43445: Flags [.], ack 718097, win 23834, options [nop,nop,TS val 4294939001 ecr 183985,nop,nop,sack 1 {719525:728093},mptcp dss ack 3868793259], length 0
10:18:31.008814 IP 112.26.0.1.43445 > 112.26.0.8.36004: Flags [.], seq 718097:719525, ack 1, win 4017, options [nop,nop,TS val 184807 ecr 4294938352,mptcp dss ack 1720219151 seq 3868793259 subseq 718097 len 1428 csum 0xc79e], length 1428
10:18:31.009119 IP 112.26.0.8.36004 > 112.26.0.1.43445: Flags [.], ack 729521, win 23704, options [nop,nop,TS val 4294939665 ecr 184807,mptcp dss ack 3868863231], length 0
10:18:31.153238 IP 112.26.0.1.43445 > 112.26.0.8.36004: Flags [.], seq 729521:730949, ack 1, win 4017, options [nop,nop,TS val 184838 ecr 4294938352,mptcp dss ack 1720219151 seq 3868881795 subseq 729521 len 1428 csum 0xa4fa], length 1428
10:18:31.153605 IP 112.26.0.8.36004 > 112.26.0.1.43445: Flags [.], ack 730949, win 24442, options [nop,nop,TS val 4294939810 ecr 184838,mptcp dss ack 3868863231], length 0
10:18:31.235225 IP 112.26.0.8.36004 > 112.26.0.1.43445: Flags [.], ack 718097, win 23991, options [nop,nop,TS val 4294939239 ecr 183985,nop,nop,sack 1 {719525:729521},mptcp dss ack 3868793259], length 0
10:18:31.327009 IP 112.26.0.1.43445 > 112.26.0.8.36004: Flags [.], seq 730949:732377, ack 1, win 4017, options [nop,nop,TS val 185064 ecr 4294938625,mptcp dss ack 1720219151 seq 3868897503 subseq 730949 len 1428 csum 0x4de0], length 1428
10:18:31.327371 IP 112.26.0.8.36004 > 112.26.0.1.43445: Flags [.], ack 732377, win 24442, options [nop,nop,TS val 4294939983 ecr 185064,mptcp dss ack 3868863231], length 0
10:18:31.407728 IP 112.26.0.1.43445 > 112.26.0.8.36004: Flags [.], seq 732377:733805, ack 1, win 4017, options [nop,nop,TS val 185064 ecr 4294938625,mptcp dss ack 1720219151 seq 3868898931 subseq 732377 len 1428 csum 0xf232], length 1428
10:18:31.408064 IP 112.26.0.8.36004 > 112.26.0.1.43445: Flags [.], ack 733805, win 24442, options [nop,nop,TS val 4294940064 ecr 185064,mptcp dss ack 3868863231], length 0
10:18:31.465148 IP 112.26.0.1.43445 > 112.26.0.8.36004: Flags [.], seq 733805:735233, ack 1, win 4017, options [nop,nop,TS val 185064 ecr 4294938625,mptcp dss ack 1720219151 seq 3868900359 subseq 733805 len 1428 csum 0xa775], length 1428
10:18:31.465466 IP 112.26.0.8.36004 > 112.26.0.1.43445: Flags [.], ack 735233, win 24442, options [nop,nop,TS val 4294940122 ecr 185064,mptcp dss ack 3868863231], length 0
10:18:31.505767 IP 112.26.0.1.43445 > 112.26.0.8.36004: Flags [.], seq 735233:736661, ack 1, win 4017, options [nop,nop,TS val 185222 ecr 4294938766,mptcp dss ack 1720219151 seq 3868910355 subseq 735233 len 1428 csum 0x2ea6], length 1428
10:18:31.506057 IP 112.26.0.8.36004 > 112.26.0.1.43445: Flags [.], ack 736661, win 24442, options [nop,nop,TS val 4294940162 ecr 185222,mptcp dss ack 3868863231], length 0
10:18:31.586740 IP 112.26.0.8.36004 > 112.26.0.1.43445: Flags [.], ack 729521, win 23704, options [nop,nop,TS val 4294939665 ecr 184807,mptcp dss ack 3868863231], length 0
10:18:31.621753 IP 112.26.0.8.36004 > 112.26.0.1.43445: Flags [.], ack 730949, win 24442, options [nop,nop,TS val 4294939810 ecr 184838,mptcp dss ack 3868863231], length 0
10:18:31.684363 IP 112.26.0.1.43445 > 112.26.0.8.36004: Flags [.], seq 736661:738089, ack 1, win 4017, options [nop,nop,TS val 185222 ecr 4294938815,mptcp dss ack 1720219151 seq 3868911783 subseq 736661 len 1428 csum 0x78b9], length 1428
10:18:31.684730 IP 112.26.0.8.36004 > 112.26.0.1.43445: Flags [.], ack 738089, win 24442, options [nop,nop,TS val 4294940341 ecr 185222,mptcp dss ack 3868863231], length 0
10:18:31.740587 IP 112.26.0.1.43445 > 112.26.0.8.36004: Flags [.], seq 738089:739517, ack 1, win 4017, options [nop,nop,TS val 185222 ecr 4294938815,mptcp dss ack 1720219151 seq 3868913211 subseq 738089 len 1428 csum 0x62da], length 1428
10:18:31.740906 IP 112.26.0.8.36004 > 112.26.0.1.43445: Flags [.], ack 739517, win 24442, options [nop,nop,TS val 4294940397 ecr 185222,mptcp dss ack 3868863231], length 0
10:18:31.823153 IP 112.26.0.8.36004 > 112.26.0.1.43445: Flags [.], ack 732377, win 24442, options [nop,nop,TS val 4294939983 ecr 185064,mptcp dss ack 3868863231], length 0
10:18:31.906958 IP 112.26.0.1.43445 > 112.26.0.8.36004: Flags [.], seq 739517:740945, ack 1, win 4017, options [nop,nop,TS val 185292 ecr 4294938884,mptcp dss ack 1720219151 seq 3868916067 subseq 739517 len 1428 csum 0x88d8], length 1428
10:18:31.907217 IP 112.26.0.8.36004 > 112.26.0.1.43445: Flags [.], ack 740945, win 24442, options [nop,nop,TS val 4294940563 ecr 185292,mptcp dss ack 3868863231], length 0
10:18:32.049027 IP 112.26.0.8.36004 > 112.26.0.1.43445: Flags [.], ack 733805, win 24442, options [nop,nop,TS val 4294940064 ecr 185064,mptcp dss ack 3868863231], length 0
10:18:32.150742 IP 112.26.0.1.43445 > 112.26.0.8.36004: Flags [.], seq 740945:742373, ack 1, win 4017, options [nop,nop,TS val 185469 ecr 4294939001,mptcp dss ack 1720219151 seq 3868921779 subseq 740945 len 1428 csum 0x99b4], length 1428
10:18:32.151055 IP 112.26.0.8.36004 > 112.26.0.1.43445: Flags [.], ack 742373, win 24442, options [nop,nop,TS val 4294940807 ecr 185469,mptcp dss ack 3868863231], length 0
10:18:32.228597 IP 112.26.0.8.36004 > 112.26.0.1.43445: Flags [.], ack 736661, win 24442, options [nop,nop,TS val 4294940162 ecr 185222,mptcp dss ack 3868863231], length 0
10:18:32.305123 IP 112.26.0.8.36004 > 112.26.0.1.43445: Flags [.], ack 738089, win 24442, options [nop,nop,TS val 4294940341 ecr 185222,mptcp dss ack 3868863231], length 0
10:18:32.385672 IP 112.26.0.1.43445 > 112.26.0.8.36004: Flags [.], seq 743801:745229, ack 1, win 4017, options [nop,nop,TS val 185964 ecr 4294939665,mptcp dss ack 1720219151 seq 3868940343 subseq 743801 len 1428 csum 0x4a72], length 1428
10:18:32.385925 IP 112.26.0.8.36004 > 112.26.0.1.43445: Flags [.], ack 742373, win 24442, options [nop,nop,TS val 4294941042 ecr 185469,nop,nop,sack 1 {743801:745229},mptcp dss ack 3868863231], length 0
10:18:32.461447 IP 112.26.0.8.36004 > 112.26.0.1.43445: Flags [.], ack 739517, win 24442, options [nop,nop,TS val 4294940397 ecr 185222,mptcp dss ack 3868863231], length 0
10:18:32.542355 IP 112.26.0.1.43445 > 112.26.0.8.36004: Flags [.], seq 745229:746657, ack 1, win 4017, options [nop,nop,TS val 186020 ecr 4294939810,mptcp dss ack 1720219151 seq 3868944627 subseq 745229 len 1428 csum 0xf6f], length 1428
10:18:32.542612 IP 112.26.0.8.36004 > 112.26.0.1.43445: Flags [.], ack 742373, win 24442, options [nop,nop,TS val 4294941198 ecr 185469,nop,nop,sack 1 {743801:746657},mptcp dss ack 3868863231], length 0
10:18:32.593313 IP 112.26.0.8.36004 > 112.26.0.1.43445: Flags [.], ack 740945, win 24442, options [nop,nop,TS val 4294940563 ecr 185292,mptcp dss ack 3868863231], length 0
10:18:32.666363 IP 112.26.0.1.43445 > 112.26.0.8.36004: Flags [.], seq 746657:748085, ack 1, win 4017, options [nop,nop,TS val 186203 ecr 4294939983,mptcp dss ack 1720219151 seq 3868954623 subseq 746657 len 1428 csum 0xba46], length 1428
10:18:32.666598 IP 112.26.0.8.36004 > 112.26.0.1.43445: Flags [.], ack 742373, win 24442, options [nop,nop,TS val 4294941322 ecr 185469,nop,nop,sack 1 {743801:748085},mptcp dss ack 3868863231], length 0
10:18:32.839662 IP 112.26.0.1.43445 > 112.26.0.8.36004: Flags [.], seq 748085:749513, ack 1, win 4017, options [nop,nop,TS val 186426 ecr 4294940064,mptcp dss ack 1720219151 seq 3868961763 subseq 748085 len 1428 csum 0xe162], length 1428
10:18:32.839910 IP 112.26.0.8.36004 > 112.26.0.1.43445: Flags [.], ack 742373, win 24056, options [nop,nop,TS val 4294941496 ecr 185469,nop,nop,sack 1 {743801:749513},mptcp dss ack 3868907499], length 0
10:18:32.924898 IP 112.26.0.1.43445 > 112.26.0.8.36004: Flags [.], seq 749513:750941, ack 1, win 4017, options [nop,nop,TS val 186426 ecr 4294940064,mptcp dss ack 1720219151 seq 3868963191 subseq 749513 len 1428 csum 0x43ef], length 1428
10:18:32.925203 IP 112.26.0.8.36004 > 112.26.0.1.43445: Flags [.], ack 742373, win 24056, options [nop,nop,TS val 4294941581 ecr 185469,nop,nop,sack 1 {743801:750941},mptcp dss ack 3868907499], length 0
10:18:32.991932 IP 112.26.0.1.43445 > 112.26.0.8.36004: Flags [.], seq 750941:752369, ack 1, win 4017, options [nop,nop,TS val 186607 ecr 4294940162,mptcp dss ack 1720219151 seq 3868970331 subseq 750941 len 1428 csum 0x8861], length 1428
10:18:32.992259 IP 112.26.0.8.36004 > 112.26.0.1.43445: Flags [.], ack 742373, win 24056, options [nop,nop,TS val 4294941648 ecr 185469,nop,nop,sack 1 {743801:752369},mptcp dss ack 3868907499], length 0
10:18:33.069137 IP 112.26.0.1.43445 > 112.26.0.8.36004: Flags [.], seq 752369:753797, ack 1, win 4017, options [nop,nop,TS val 186607 ecr 4294940162,mptcp dss ack 1720219151 seq 3868971759 subseq 752369 len 1428 csum 0x3157], length 1428
10:18:33.069508 IP 112.26.0.8.36004 > 112.26.0.1.43445: Flags [.], ack 742373, win 24056, options [nop,nop,TS val 4294941725 ecr 185469,nop,nop,sack 1 {743801:753797},mptcp dss ack 3868907499], length 0
10:18:33.119126 IP 112.26.0.8.36004 > 112.26.0.1.43445: Flags [.], ack 742373, win 24442, options [nop,nop,TS val 4294941042 ecr 185469,nop,nop,sack 1 {743801:745229},mptcp dss ack 3868863231], length 0
10:18:33.214931 IP 112.26.0.8.36004 > 112.26.0.1.43445: Flags [.], ack 742373, win 24442, options [nop,nop,TS val 4294941198 ecr 185469,nop,nop,sack 1 {743801:746657},mptcp dss ack 3868863231], length 0
10:18:33.298186 IP 112.26.0.1.43445 > 112.26.0.8.36004: Flags [.], seq 755225:756653, ack 1, win 4017, options [nop,nop,TS val 186883 ecr 4294940397,mptcp dss ack 1720219151 seq 3868978899 subseq 755225 len 1428 csum 0xb978], length 1428
10:18:33.298485 IP 112.26.0.8.36004 > 112.26.0.1.43445: Flags [.], ack 742373, win 24056, options [nop,nop,TS val 4294941955 ecr 185469,nop,nop,sack 2 {755225:756653}{743801:753797},mptcp dss ack 3868907499], length 0
10:18:33.376860 IP 112.26.0.8.36004 > 112.26.0.1.43445: Flags [.], ack 742373, win 24442, options [nop,nop,TS val 4294941322 ecr 185469,nop,nop,sack 1 {743801:748085},mptcp dss ack 3868863231], length 0
10:18:33.494260 IP 112.26.0.1.43445 > 112.26.0.8.36004: Flags [.], seq 758081:759509, ack 1, win 4017, options [nop,nop,TS val 186972 ecr 4294940563,mptcp dss ack 1720219151 seq 3868983183 subseq 758081 len 1428 csum 0xc905], length 1428
10:18:33.494586 IP 112.26.0.8.36004 > 112.26.0.1.43445: Flags [.], ack 742373, win 23981, options [nop,nop,TS val 4294942151 ecr 185469,nop,nop,sack 2 {758081:759509}{755225:756653},mptcp dss ack 3868927491], length 0
10:18:33.599955 IP 112.26.0.8.36004 > 112.26.0.1.43445: Flags [.], ack 742373, win 24056, options [nop,nop,TS val 4294941581 ecr 185469,nop,nop,sack 1 {743801:750941},mptcp dss ack 3868907499], length 0
10:18:33.721447 IP 112.26.0.8.36004 > 112.26.0.1.43445: Flags [.], ack 742373, win 24056, options [nop,nop,TS val 4294941648 ecr 185469,nop,nop,sack 1 {743801:752369},mptcp dss ack 3868907499], length 0
10:18:33.813775 IP 112.26.0.8.36004 > 112.26.0.1.43445: Flags [.], ack 742373, win 24056, options [nop,nop,TS val 4294941725 ecr 185469,nop,nop,sack 1 {743801:753797},mptcp dss ack 3868907499], length 0
10:18:33.910544 IP 112.26.0.1.43445 > 112.26.0.8.36004: Flags [.], seq 759509:760937, ack 1, win 4017, options [nop,nop,TS val 187497 ecr 4294941042,mptcp dss ack 1720219151 seq 3869013171 subseq 759509 len 1428 csum 0xe65e], length 1428
10:18:33.910851 IP 112.26.0.8.36004 > 112.26.0.1.43445: Flags [.], ack 742373, win 23981, options [nop,nop,TS val 4294942567 ecr 185469,nop,nop,sack 2 {758081:760937}{755225:756653},mptcp dss ack 3868927491], length 0
10:18:33.994502 IP 112.26.0.1.43445 > 112.26.0.8.36004: Flags [.], seq 760937:762365, ack 1, win 4017, options [nop,nop,TS val 187497 ecr 4294941042,mptcp dss ack 1720219151 seq 3869014599 subseq 760937 len 1428 csum 0x99f3], length 1428
10:18:33.994794 IP 112.26.0.8.36004 > 112.26.0.1.43445: Flags [.], ack 742373, win 23981, options [nop,nop,TS val 4294942651 ecr 185469,nop,nop,sack 2 {758081:762365}{755225:756653},mptcp dss ack 3868927491], length 0
10:18:34.037614 IP 112.26.0.8.36004 > 112.26.0.1.43445: Flags [.], ack 742373, win 24056, options [nop,nop,TS val 4294941955 ecr 185469,nop,nop,sack 2 {755225:756653}{743801:753797},mptcp dss ack 3868907499], length 0
10:18:34.074907 IP 112.26.0.1.43445 > 112.26.0.8.36004: Flags [.], seq 762365:763793, ack 1, win 4017, options [nop,nop,TS val 187611 ecr 4294941198,mptcp dss ack 1720219151 seq 3869021739 subseq 762365 len 1428 csum 0x461b], length 1428
10:18:34.075219 IP 112.26.0.8.36004 > 112.26.0.1.43445: Flags [.], ack 742373, win 23981, options [nop,nop,TS val 4294942731 ecr 185469,nop,nop,sack 2 {758081:763793}{755225:756653},mptcp dss ack 3868927491], length 0
10:18:34.147974 IP 112.26.0.8.36004 > 112.26.0.1.43445: Flags [.], ack 742373, win 23981, options [nop,nop,TS val 4294942151 ecr 185469,nop,nop,sack 2 {758081:759509}{755225:756653},mptcp dss ack 3868927491], length 0
10:18:34.192671 IP 112.26.0.1.43445 > 112.26.0.8.36004: Flags [.], seq 763793:765221, ack 1, win 4017, options [nop,nop,TS val 187903 ecr 4294941322,mptcp dss ack 1720219151 seq 3869031735 subseq 763793 len 1428 csum 0xa524], length 1428
10:18:34.192874 IP 112.26.0.8.36004 > 112.26.0.1.43445: Flags [.], ack 742373, win 23981, options [nop,nop,TS val 4294942849 ecr 185469,nop,nop,sack 2 {758081:765221}{755225:756653},mptcp dss ack 3868927491], length 0
10:18:34.265553 IP 112.26.0.1.43445 > 112.26.0.8.36004: Flags [.], seq 765221:766649, ack 1, win 4017, options [nop,nop,TS val 187995 ecr 4294941581,mptcp dss ack 1720219151 seq 3869037447 subseq 765221 len 1428 csum 0x3544], length 1428
10:18:34.265806 IP 112.26.0.8.36004 > 112.26.0.1.43445: Flags [.], ack 742373, win 23981, options [nop,nop,TS val 4294942922 ecr 185469,nop,nop,sack 2 {758081:766649}{755225:756653},mptcp dss ack 3868927491], length 0
10:18:34.306363 IP 112.26.0.1.43445 > 112.26.0.8.36004: Flags [.], seq 766649:768077, ack 1, win 4017, options [nop,nop,TS val 187995 ecr 4294941581,mptcp dss ack 1720219151 seq 3869038875 subseq 766649 len 1428 csum 0x3e25], length 1428
10:18:34.306607 IP 112.26.0.8.36004 > 112.26.0.1.43445: Flags [.], ack 742373, win 23981, options [nop,nop,TS val 4294942962 ecr 185469,nop,nop,sack 2 {758081:768077}{755225:756653},mptcp dss ack 3868927491], length 0
10:18:34.370483 IP 112.26.0.1.43445 > 112.26.0.8.36004: Flags [.], seq 768077:769505, ack 1, win 4017, options [nop,nop,TS val 188185 ecr 4294941648,mptcp dss ack 1720219151 seq 3869048871 subseq 768077 len 1428 csum 0x3c1a], length 1428
10:18:34.370782 IP 112.26.0.8.36004 > 112.26.0.1.43445: Flags [.], ack 742373, win 23981, options [nop,nop,TS val 4294943027 ecr 185469,nop,nop,sack 2 {758081:769505}{755225:756653},mptcp dss ack 3868927491], length 0
10:18:34.423766 IP 112.26.0.8.36004 > 112.26.0.1.43445: Flags [.], ack 742373, win 23981, options [nop,nop,TS val 4294942567 ecr 185469,nop,nop,sack 2 {758081:760937}{755225:756653},mptcp dss ack 3868927491], length 0
10:18:34.469478 IP 112.26.0.1.43445 > 112.26.0.8.36004: Flags [.], seq 769505:770933, ack 1, win 4017, options [nop,nop,TS val 188318 ecr 4294941725,mptcp dss ack 1720219151 seq 3869056011 subseq 769505 len 1428 csum 0xc242], length 1428
10:18:34.469784 IP 112.26.0.8.36004 > 112.26.0.1.43445: Flags [.], ack 742373, win 23981, options [nop,nop,TS val 4294943126 ecr 185469,nop,nop,sack 2 {758081:770933}{755225:756653},mptcp dss ack 3868927491], length 0
10:18:34.538331 IP 112.26.0.8.36004 > 112.26.0.1.43445: Flags [.], ack 742373, win 23981, options [nop,nop,TS val 4294942651 ecr 185469,nop,nop,sack 2 {758081:762365}{755225:756653},mptcp dss ack 3868927491], length 0
10:18:34.587687 IP 112.26.0.8.36004 > 112.26.0.1.43445: Flags [.], ack 742373, win 23981, options [nop,nop,TS val 4294942731 ecr 185469,nop,nop,sack 2 {758081:763793}{755225:756653},mptcp dss ack 3868927491], length 0
10:18:34.690680 IP 112.26.0.1.43445 > 112.26.0.8.36004: Flags [.], seq 770933:772361, ack 1, win 4017, options [nop,nop,TS val 188449 ecr 4294941955,mptcp dss ack 1720219151 seq 3869060295 subseq 770933 len 1428 csum 0x6a28], length 1428
10:18:34.690994 IP 112.26.0.8.36004 > 112.26.0.1.43445: Flags [.], ack 742373, win 23981, options [nop,nop,TS val 4294943347 ecr 185469,nop,nop,sack 2 {758081:772361}{755225:756653},mptcp dss ack 3868927491], length 0
10:18:34.750142 IP 112.26.0.1.43445 > 112.26.0.8.36004: Flags [.], seq 742373:743801, ack 1, win 4017, options [nop,nop,TS val 188526 ecr 4294942151,mptcp dss ack 1720219151 seq 3868927491 subseq 742373 len 1428 csum 0x6765], length 1428
10:18:34.750468 IP 112.26.0.8.36004 > 112.26.0.1.43445: Flags [.], ack 753797, win 23284, options [nop,nop,TS val 4294943406 ecr 188526,nop,nop,sack 2 {758081:772361}{755225:756653},mptcp dss ack 3868974615], length 0
10:18:34.823748 IP 112.26.0.8.36004 > 112.26.0.1.43445: Flags [.], ack 742373, win 23981, options [nop,nop,TS val 4294942849 ecr 185469,nop,nop,sack 2 {758081:765221}{755225:756653},mptcp dss ack 3868927491], length 0
10:18:34.887437 IP 112.26.0.8.36004 > 112.26.0.1.43445: Flags [.], ack 742373, win 23981, options [nop,nop,TS val 4294942922 ecr 185469,nop,nop,sack 2 {758081:766649}{755225:756653},mptcp dss ack 3868927491], length 0
10:18:34.937149 IP 112.26.0.8.36004 > 112.26.0.1.43445: Flags [.], ack 742373, win 23981, options [nop,nop,TS val 4294942962 ecr 185469,nop,nop,sack 2 {758081:768077}{755225:756653},mptcp dss ack 3868927491], length 0
10:18:34.989226 IP 112.26.0.8.36004 > 112.26.0.1.43445: Flags [.], ack 742373, win 23981, options [nop,nop,TS val 4294943027 ecr 185469,nop,nop,sack 2 {758081:769505}{755225:756653},mptcp dss ack 3868927491], length 0
10:18:35.130665 IP 112.26.0.8.36004 > 112.26.0.1.43445: Flags [.], ack 742373, win 23981, options [nop,nop,TS val 4294943126 ecr 185469,nop,nop,sack 2 {758081:770933}{755225:756653},mptcp dss ack 3868927491], length 0
10:18:35.233674 IP 112.26.0.1.43445 > 112.26.0.8.36004: Flags [.], seq 753797:755225, ack 1, win 4017, options [nop,nop,TS val 188918 ecr 4294942651,mptcp dss ack 1720219151 seq 3868974615 subseq 753797 len 1428 csum 0x9954], length 1428
10:18:35.233986 IP 112.26.0.8.36004 > 112.26.0.1.43445: Flags [.], ack 756653, win 23656, options [nop,nop,TS val 4294943890 ecr 188918,nop,nop,sack 1 {758081:772361},mptcp dss ack 3868981755], length 0
10:18:35.300249 IP 112.26.0.1.43445 > 112.26.0.8.36004: Flags [.], seq 756653:758081, ack 1, win 4017, options [nop,nop,TS val 188993 ecr 4294942731,mptcp dss ack 1720219151 seq 3868981755 subseq 756653 len 1428 csum 0x306d], length 1428
10:18:35.300527 IP 112.26.0.8.36004 > 112.26.0.1.43445: Flags [.], ack 772361, win 23420, options [nop,nop,TS val 4294943957 ecr 188993,mptcp dss ack 3869067435], length 0
10:18:35.365158 IP 112.26.0.8.36004 > 112.26.0.1.43445: Flags [.], ack 742373, win 23981, options [nop,nop,TS val 4294943347 ecr 185469,nop,nop,sack 2 {758081:772361}{755225:756653},mptcp dss ack 3868927491], length 0
10:18:35.460646 IP 112.26.0.8.36004 > 112.26.0.1.43445: Flags [.], ack 753797, win 23284, options [nop,nop,TS val 4294943406 ecr 188526,nop,nop,sack 2 {758081:772361}{755225:756653},mptcp dss ack 3868974615], length 0
