10:17:23.897366 IP 112.26.1.8.46387 > 112.26.1.1.43445: Flags [S], seq 3182393828, win 65535, options [mss 1460,sackOK,TS val 4294872454 ecr 0,nop,wscale 6,mptcp join id 3 token 0x1271d1f5 nonce 0xab278870], length 0
10:17:23.957352 IP 112.26.1.8.46387 > 112.26.1.1.43445: Flags [S], seq 3182393828, win 65535, options [mss 1460,sackOK,TS val 4294872454 ecr 0,nop,wscale 6,mptcp join id 3 token 0x1271d1f5 nonce 0xab278870], length 0
10:17:24.033301 IP 112.26.1.8.46387 > 112.26.1.1.43445: Flags [S], seq 3182393828, win 65535, options [mss 1460,sackOK,TS val 4294872454 ecr 0,nop,wscale 6,mptcp join id 3 token 0x1271d1f5 nonce 0xab278870], length 0
10:17:24.153140 IP 112.26.1.1.43445 > 112.26.1.8.46387: Flags [S.], seq 600515713, ack 3182393829, win 65535, options [mss 1460,sackOK,TS val 118409 ecr 4294872454,nop,wscale 6,mptcp join id 3 hmac 0x5c100e5fd49aba7d nonce 0x69eaa99a], length 0
10:17:24.190380 IP 112.26.1.1.43445 > 112.26.1.8.46387: Flags [S.], seq 600515713, ack 3182393829, win 65535, options [mss 1460,sackOK,TS val 118409 ecr 4294872454,nop,wscale 6,mptcp join id 3 hmac 0x5c100e5fd49aba7d nonce 0x69eaa99a], length 0
10:17:24.191674 IP 112.26.1.8.46387 > 112.26.1.1.43445: Flags [.], ack 1, win 7848, options [nop,nop,TS val 4294872847 ecr 118409,mptcp join hmac 0x8ee39ac72f51bb5ae0b3cb1d1a8f01338aaca337], length 0
10:17:24.292683 IP 112.26.1.8.46387 > 112.26.1.1.43445: Flags [.], ack 1, win 7848, options [nop,nop,TS val 4294872847 ecr 118409,mptcp join hmac 0x8ee39ac72f51bb5ae0b3cb1d1a8f01338aaca337], length 0
10:18:04.652741 IP 112.26.1.1.43445 > 112.26.1.8.46387: Flags [.], seq 442681:444109, ack 1, win 4017, options [nop,nop,TS val 158840 ecr 4294912407,mptcp dss ack 1720219151 seq 3868244907 subseq 442681 len 1428 csum 0x3f2b], length 1428
10:18:04.719683 IP 112.26.1.1.43445 > 112.26.1.8.46387: Flags [.], seq 438397:439825, ack 1, win 4017, options [nop,nop,TS val 157584 ecr 4294911268,mptcp dss ack 1720219151 seq 3868282035 subseq 438397 len 1428 csum 0x4052], length 1428
10:18:04.721449 IP 112.26.1.8.46387 > 112.26.1.1.43445: Flags [.], ack 405553, win 24231, options [nop,nop,TS val 4294913376 ecr 155172,nop,nop,sack 2 {438397:439825}{434113:436969},mptcp dss ack 3868160655], length 0
10:18:04.774548 IP 112.26.1.1.43445 > 112.26.1.8.46387: Flags [.], seq 439825:441253, ack 1, win 4017, options [nop,nop,TS val 157584 ecr 4294911268,mptcp dss ack 1720219151 seq 3868283463 subseq 439825 len 1428 csum 0x8405], length 1428
10:18:04.775906 IP 112.26.1.8.46387 > 112.26.1.1.43445: Flags [.], ack 405553, win 24231, options [nop,nop,TS val 4294913431 ecr 155172,nop,nop,sack 2 {438397:441253}{434113:436969},mptcp dss ack 3868160655], length 0
10:18:04.851615 IP 112.26.1.1.43445 > 112.26.1.8.46387: Flags [.], seq 405553:406981, ack 1, win 4017, options [nop,nop,TS val 157807 ecr 4294911360,mptcp dss ack 1720219151 seq 3868160655 subseq 405553 len 1428 csum 0xa594], length 1428
10:18:04.855352 IP 112.26.1.8.46387 > 112.26.1.1.43445: Flags [.], ack 406981, win 24209, options [nop,nop,TS val 4294913508 ecr 157807,nop,nop,sack 2 {438397:441253}{434113:436969},mptcp dss ack 3868162083], length 0
10:18:04.908800 IP 112.26.1.8.46387 > 112.26.1.1.43445: Flags [.], ack 405553, win 24231, options [nop,nop,TS val 4294912828 ecr 155172,nop,nop,sack 2 {428401:431257}{421261:425545},mptcp dss ack 3868160655], length 0
10:18:04.911027 IP 112.26.1.8.46387 > 112.26.1.1.43445: Flags [.], ack 405553, win 24231, options [nop,nop,TS val 4294912828 ecr 155172,nop,nop,sack 2 {428401:431257}{421261:425545},mptcp dss ack 3868160655], length 0
10:18:04.919488 IP 112.26.1.1.43445 > 112.26.1.8.46387: Flags [.], seq 425545:426973, ack 1, win 4017, options [nop,nop,TS val 159287 ecr 4294912828,mptcp dss ack 1720219151 seq 3868227771 subseq 425545 len 1428 csum 0xf9b4], length 1428
10:18:05.025041 IP 112.26.1.8.46387 > 112.26.1.1.43445: Flags [.], ack 405553, win 24231, options [nop,nop,TS val 4294912928 ecr 155172,nop,nop,sack 2 {428401:432685}{421261:425545},mptcp dss ack 3868160655], length 0
10:18:05.026754 IP 112.26.1.8.46387 > 112.26.1.1.43445: Flags [.], ack 405553, win 24231, options [nop,nop,TS val 4294912928 ecr 155172,nop,nop,sack 2 {428401:432685}{421261:425545},mptcp dss ack 3868160655], length 0
10:18:05.044706 IP 112.26.1.1.43445 > 112.26.1.8.46387: Flags [.], seq 426973:428401, ack 1, win 4017, options [nop,nop,TS val 159287 ecr 4294912828,mptcp dss ack 1720219151 seq 3868229199 subseq 426973 len 1428 csum 0xccbc], length 1428
10:18:05.076146 IP 112.26.1.1.43445 > 112.26.1.8.46387: Flags [.], seq 412693:414121, ack 1, win 4017, options [nop,nop,TS val 158218 ecr 4294911740,mptcp dss ack 1720219151 seq 3868179219 subseq 412693 len 1428 csum 0x34df], length 1428
10:18:05.077916 IP 112.26.1.8.46387 > 112.26.1.1.43445: Flags [.], ack 406981, win 24209, options [nop,nop,TS val 4294913733 ecr 157807,nop,nop,sack 2 {412693:414121}{438397:441253},mptcp dss ack 3868162083], length 0
10:18:05.157470 IP 112.26.1.1.43445 > 112.26.1.8.46387: Flags [.], seq 444109:445537, ack 1, win 4017, options [nop,nop,TS val 159410 ecr 4294912928,mptcp dss ack 1720219151 seq 3868344867 subseq 444109 len 1428 csum 0x9ed4], length 1428
10:18:05.190952 IP 112.26.1.1.43445 > 112.26.1.8.46387: Flags [.], seq 441253:442681, ack 1, win 4017, options [nop,nop,TS val 158445 ecr 4294911979,mptcp dss ack 1720219151 seq 3868313451 subseq 441253 len 1428 csum 0x710b], length 1428
10:18:05.192289 IP 112.26.1.8.46387 > 112.26.1.1.43445: Flags [.], ack 406981, win 24209, options [nop,nop,TS val 4294913848 ecr 157807,nop,nop,sack 2 {438397:442681}{412693:414121},mptcp dss ack 3868162083], length 0
10:18:05.259585 IP 112.26.1.1.43445 > 112.26.1.8.46387: Flags [.], seq 419833:421261, ack 1, win 4017, options [nop,nop,TS val 158697 ecr 4294912301,mptcp dss ack 1720219151 seq 3868199211 subseq 419833 len 1428 csum 0xc253], length 1428
10:18:05.261062 IP 112.26.1.8.46387 > 112.26.1.1.43445: Flags [.], ack 406981, win 24209, options [nop,nop,TS val 4294913916 ecr 157807,nop,nop,sack 2 {419833:421261}{438397:442681},mptcp dss ack 3868162083], length 0
10:18:05.313940 IP 112.26.1.1.43445 > 112.26.1.8.46387: Flags [.], seq 442681:444109, ack 1, win 4017, options [nop,nop,TS val 158840 ecr 4294912407,mptcp dss ack 1720219151 seq 3868244907 subseq 442681 len 1428 csum 0x3f2b], length 1428
10:18:05.328878 IP 112.26.1.8.46387 > 112.26.1.1.43445: Flags [.], ack 406981, win 24209, options [nop,nop,TS val 4294913971 ecr 157807,nop,nop,sack 2 {438397:444109}{419833:421261},mptcp dss ack 3868162083], length 0
10:18:05.375066 IP 112.26.1.8.46387 > 112.26.1.1.43445: Flags [.], ack 405553, win 24231, options [nop,nop,TS val 4294913376 ecr 155172,nop,nop,sack 2 {438397:439825}{434113:436969},mptcp dss ack 3868160655], length 0
10:18:05.377763 IP 112.26.1.8.46387 > 112.26.1.1.43445: Flags [.], ack 405553, win 24231, options [nop,nop,TS val 4294913376 ecr 155172,nop,nop,sack 2 {438397:439825}{434113:436969},mptcp dss ack 3868160655], length 0
10:18:05.390762 IP 112.26.1.1.43445 > 112.26.1.8.46387: Flags [.], seq 432685:434113, ack 1, win 4017, options [nop,nop,TS val 159754 ecr 4294913376,mptcp dss ack 1720219151 seq 3868249191 subseq 432685 len 1428 csum 0x5aec], length 1428
10:18:05.452680 IP 112.26.1.8.46387 > 112.26.1.1.43445: Flags [.], ack 406981, win 24209, options [nop,nop,TS val 4294913508 ecr 157807,nop,nop,sack 2 {438397:441253}{434113:436969},mptcp dss ack 3868162083], length 0
10:18:05.456956 IP 112.26.1.8.46387 > 112.26.1.1.43445: Flags [.], ack 406981, win 24209, options [nop,nop,TS val 4294913508 ecr 157807,nop,nop,sack 2 {438397:441253}{434113:436969},mptcp dss ack 3868162083], length 0
10:18:05.485754 IP 112.26.1.1.43445 > 112.26.1.8.46387: Flags [.], seq 436969:438397, ack 1, win 4017, options [nop,nop,TS val 159754 ecr 4294913376,mptcp dss ack 1720219151 seq 3868270611 subseq 436969 len 1428 csum 0xf6c7], length 1428
10:18:05.537970 IP 112.26.1.1.43445 > 112.26.1.8.46387: Flags [.], seq 425545:426973, ack 1, win 4017, options [nop,nop,TS val 159287 ecr 4294912828,mptcp dss ack 1720219151 seq 3868227771 subseq 425545 len 1428 csum 0xf9b4], length 1428
10:18:05.539421 IP 112.26.1.8.46387 > 112.26.1.1.43445: Flags [.], ack 406981, win 24209, options [nop,nop,TS val 4294914195 ecr 157807,nop,nop,sack 2 {425545:426973}{438397:444109},mptcp dss ack 3868162083], length 0
10:18:05.549148 IP 112.26.1.1.43445 > 112.26.1.8.46387: Flags [.], seq 445537:446965, ack 1, win 4017, options [nop,nop,TS val 159782 ecr 4294913376,mptcp dss ack 1720219151 seq 3868362003 subseq 445537 len 1428 csum 0x97b1], length 1428
10:18:05.613686 IP 112.26.1.1.43445 > 112.26.1.8.46387: Flags [.], seq 426973:428401, ack 1, win 4017, options [nop,nop,TS val 159287 ecr 4294912828,mptcp dss ack 1720219151 seq 3868229199 subseq 426973 len 1428 csum 0xccbc], length 1428
10:18:05.615687 IP 112.26.1.8.46387 > 112.26.1.1.43445: Flags [.], ack 406981, win 24209, options [nop,nop,TS val 4294914270 ecr 157807,nop,nop,sack 2 {425545:428401}{438397:444109},mptcp dss ack 3868162083], length 0
10:18:05.665485 IP 112.26.1.8.46387 > 112.26.1.1.43445: Flags [.], ack 406981, win 24209, options [nop,nop,TS val 4294913733 ecr 157807,nop,nop,sack 2 {412693:414121}{438397:441253},mptcp dss ack 3868162083], length 0
10:18:05.682408 IP 112.26.1.1.43445 > 112.26.1.8.46387: Flags [.], seq 446965:448393, ack 1, win 4017, options [nop,nop,TS val 159831 ecr 4294913508,mptcp dss ack 1720219151 seq 3868370571 subseq 446965 len 1428 csum 0xa19c], length 1428
10:18:05.687977 IP 112.26.1.8.46387 > 112.26.1.1.43445: Flags [.], ack 406981, win 24209, options [nop,nop,TS val 4294913733 ecr 157807,nop,nop,sack 2 {412693:414121}{438397:441253},mptcp dss ack 3868162083], length 0
10:18:05.757877 IP 112.26.1.1.43445 > 112.26.1.8.46387: Flags [.], seq 444109:445537, ack 1, win 4017, options [nop,nop,TS val 159410 ecr 4294912928,mptcp dss ack 1720219151 seq 3868344867 subseq 444109 len 1428 csum 0x9ed4], length 1428
10:18:05.760246 IP 112.26.1.8.46387 > 112.26.1.1.43445: Flags [.], ack 406981, win 24209, options [nop,nop,TS val 4294914414 ecr 157807,nop,nop,sack 2 {438397:445537}{425545:428401},mptcp dss ack 3868162083], length 0
10:18:05.802018 IP 112.26.1.1.43445 > 112.26.1.8.46387: Flags [.], seq 448393:449821, ack 1, win 4017, options [nop,nop,TS val 159831 ecr 4294913508,mptcp dss ack 1720219151 seq 3868371999 subseq 448393 len 1428 csum 0xcfc6], length 1428
10:18:05.829456 IP 112.26.1.8.46387 > 112.26.1.1.43445: Flags [.], ack 406981, win 24209, options [nop,nop,TS val 4294913848 ecr 157807,nop,nop,sack 2 {438397:442681}{412693:414121},mptcp dss ack 3868162083], length 0
10:18:05.833792 IP 112.26.1.8.46387 > 112.26.1.1.43445: Flags [.], ack 406981, win 24209, options [nop,nop,TS val 4294913848 ecr 157807,nop,nop,sack 2 {438397:442681}{412693:414121},mptcp dss ack 3868162083], length 0
10:18:05.862441 IP 112.26.1.8.46387 > 112.26.1.1.43445: Flags [.], ack 406981, win 24209, options [nop,nop,TS val 4294913916 ecr 157807,nop,nop,sack 2 {419833:421261}{438397:442681},mptcp dss ack 3868162083], length 0
10:18:05.876581 IP 112.26.1.1.43445 > 112.26.1.8.46387: Flags [.], seq 449821:451249, ack 1, win 4017, options [nop,nop,TS val 159831 ecr 4294913508,mptcp dss ack 1720219151 seq 3868373427 subseq 449821 len 1428 csum 0x7fdb], length 1428
10:18:05.920727 IP 112.26.1.8.46387 > 112.26.1.1.43445: Flags [.], ack 406981, win 24209, options [nop,nop,TS val 4294913916 ecr 157807,nop,nop,sack 2 {419833:421261}{438397:442681},mptcp dss ack 3868162083], length 0
10:18:05.940819 IP 112.26.1.8.46387 > 112.26.1.1.43445: Flags [.], ack 406981, win 24209, options [nop,nop,TS val 4294913971 ecr 157807,nop,nop,sack 2 {438397:444109}{419833:421261},mptcp dss ack 3868162083], length 0
10:18:05.968487 IP 112.26.1.1.43445 > 112.26.1.8.46387: Flags [.], seq 451249:452677, ack 1, win 4017, options [nop,nop,TS val 159831 ecr 4294913508,mptcp dss ack 1720219151 seq 3868374855 subseq 451249 len 1428 csum 0x2671], length 1428
10:18:06.018144 IP 112.26.1.1.43445 > 112.26.1.8.46387: Flags [.], seq 432685:434113, ack 1, win 4017, options [nop,nop,TS val 159754 ecr 4294913376,mptcp dss ack 1720219151 seq 3868249191 subseq 432685 len 1428 csum 0x5aec], length 1428
10:18:06.022222 IP 112.26.1.8.46387 > 112.26.1.1.43445: Flags [.], ack 406981, win 24209, options [nop,nop,TS val 4294913971 ecr 157807,nop,nop,sack 2 {438397:444109}{419833:421261},mptcp dss ack 3868162083], length 0
10:18:06.023764 IP 112.26.1.8.46387 > 112.26.1.1.43445: Flags [.], ack 406981, win 24209, options [nop,nop,TS val 4294914675 ecr 157807,nop,nop,sack 2 {432685:434113}{438397:445537},mptcp dss ack 3868162083], length 0
10:18:06.068112 IP 112.26.1.1.43445 > 112.26.1.8.46387: Flags [.], seq 436969:438397, ack 1, win 4017, options [nop,nop,TS val 159754 ecr 4294913376,mptcp dss ack 1720219151 seq 3868270611 subseq 436969 len 1428 csum 0xf6c7], length 1428
10:18:06.112732 IP 112.26.1.8.46387 > 112.26.1.1.43445: Flags [.], ack 406981, win 24209, options [nop,nop,TS val 4294914195 ecr 157807,nop,nop,sack 2 {425545:426973}{438397:444109},mptcp dss ack 3868162083], length 0
10:18:06.117266 IP 112.26.1.8.46387 > 112.26.1.1.43445: Flags [.], ack 406981, win 24209, options [nop,nop,TS val 4294914195 ecr 157807,nop,nop,sack 2 {425545:426973}{438397:444109},mptcp dss ack 3868162083], length 0
10:18:06.135645 IP 112.26.1.8.46387 > 112.26.1.1.43445: Flags [.], ack 406981, win 24209, options [nop,nop,TS val 4294914725 ecr 157807,nop,nop,sack 2 {436969:445537}{432685:434113},mptcp dss ack 3868162083], length 0
10:18:06.138372 IP 112.26.1.1.43445 > 112.26.1.8.46387: Flags [.], seq 452677:454105, ack 1, win 4017, options [nop,nop,TS val 159831 ecr 4294913508,mptcp dss ack 1720219151 seq 3868376283 subseq 452677 len 1428 csum 0x7ca2], length 1428
10:18:06.181392 IP 112.26.1.1.43445 > 112.26.1.8.46387: Flags [.], seq 445537:446965, ack 1, win 4017, options [nop,nop,TS val 159782 ecr 4294913376,mptcp dss ack 1720219151 seq 3868362003 subseq 445537 len 1428 csum 0x97b1], length 1428
10:18:06.188202 IP 112.26.1.8.46387 > 112.26.1.1.43445: Flags [.], ack 406981, win 24209, options [nop,nop,TS val 4294914838 ecr 157807,nop,nop,sack 2 {436969:446965}{432685:434113},mptcp dss ack 3868162083], length 0
10:18:06.221974 IP 112.26.1.1.43445 > 112.26.1.8.46387: Flags [.], seq 406981:408409, ack 1, win 4017, options [nop,nop,TS val 160064 ecr 4294913733,mptcp dss ack 1720219151 seq 3868162083 subseq 406981 len 1428 csum 0x37f2], length 1428
10:18:06.273020 IP 112.26.1.8.46387 > 112.26.1.1.43445: Flags [.], ack 406981, win 24209, options [nop,nop,TS val 4294914270 ecr 157807,nop,nop,sack 2 {425545:428401}{438397:444109},mptcp dss ack 3868162083], length 0
10:18:06.279166 IP 112.26.1.8.46387 > 112.26.1.1.43445: Flags [.], ack 406981, win 24209, options [nop,nop,TS val 4294914270 ecr 157807,nop,nop,sack 2 {425545:428401}{438397:444109},mptcp dss ack 3868162083], length 0
10:18:06.316646 IP 112.26.1.1.43445 > 112.26.1.8.46387: Flags [.], seq 454105:455533, ack 1, win 4017, options [nop,nop,TS val 160297 ecr 4294913848,mptcp dss ack 1720219151 seq 3868394847 subseq 454105 len 1428 csum 0x79a7], length 1428
10:18:06.377909 IP 112.26.1.1.43445 > 112.26.1.8.46387: Flags [.], seq 446965:448393, ack 1, win 4017, options [nop,nop,TS val 159831 ecr 4294913508,mptcp dss ack 1720219151 seq 3868370571 subseq 446965 len 1428 csum 0xa19c], length 1428
10:18:06.380292 IP 112.26.1.8.46387 > 112.26.1.1.43445: Flags [.], ack 406981, win 24209, options [nop,nop,TS val 4294915034 ecr 157807,nop,nop,sack 2 {436969:448393}{432685:434113},mptcp dss ack 3868162083], length 0
10:18:06.460569 IP 112.26.1.1.43445 > 112.26.1.8.46387: Flags [.], seq 455533:456961, ack 1, win 4017, options [nop,nop,TS val 160374 ecr 4294913916,mptcp dss ack 1720219151 seq 3868396275 subseq 455533 len 1428 csum 0x4f6a], length 1428
10:18:06.474171 IP 112.26.1.8.46387 > 112.26.1.1.43445: Flags [.], ack 406981, win 24209, options [nop,nop,TS val 4294914414 ecr 157807,nop,nop,sack 2 {438397:445537}{425545:428401},mptcp dss ack 3868162083], length 0
10:18:06.476908 IP 112.26.1.8.46387 > 112.26.1.1.43445: Flags [.], ack 406981, win 24209, options [nop,nop,TS val 4294914414 ecr 157807,nop,nop,sack 2 {438397:445537}{425545:428401},mptcp dss ack 3868162083], length 0
10:18:06.534420 IP 112.26.1.1.43445 > 112.26.1.8.46387: Flags [.], seq 456961:458389, ack 1, win 4017, options [nop,nop,TS val 160416 ecr 4294913971,mptcp dss ack 1720219151 seq 3868410555 subseq 456961 len 1428 csum 0x90a9], length 1428
10:18:06.539124 IP 112.26.1.1.43445 > 112.26.1.8.46387: Flags [.], seq 448393:449821, ack 1, win 4017, options [nop,nop,TS val 159831 ecr 4294913508,mptcp dss ack 1720219151 seq 3868371999 subseq 448393 len 1428 csum 0xcfc6], length 1428
10:18:06.540387 IP 112.26.1.8.46387 > 112.26.1.1.43445: Flags [.], ack 406981, win 24209, options [nop,nop,TS val 4294915196 ecr 157807,nop,nop,sack 2 {436969:449821}{432685:434113},mptcp dss ack 3868162083], length 0
10:18:06.633239 IP 112.26.1.1.43445 > 112.26.1.8.46387: Flags [.], seq 458389:459817, ack 1, win 4017, options [nop,nop,TS val 160525 ecr 4294914195,mptcp dss ack 1720219151 seq 3868413411 subseq 458389 len 1428 csum 0x9483], length 1428
10:18:06.645419 IP 112.26.1.1.43445 > 112.26.1.8.46387: Flags [.], seq 449821:451249, ack 1, win 4017, options [nop,nop,TS val 159831 ecr 4294913508,mptcp dss ack 1720219151 seq 3868373427 subseq 449821 len 1428 csum 0x7fdb], length 1428
10:18:06.646808 IP 112.26.1.8.46387 > 112.26.1.1.43445: Flags [.], ack 406981, win 24209, options [nop,nop,TS val 4294915302 ecr 157807,nop,nop,sack 2 {436969:451249}{432685:434113},mptcp dss ack 3868162083], length 0
10:18:06.707369 IP 112.26.1.1.43445 > 112.26.1.8.46387: Flags [.], seq 459817:461245, ack 1, win 4017, options [nop,nop,TS val 160689 ecr 4294914270,mptcp dss ack 1720219151 seq 3868417695 subseq 459817 len 1428 csum 0xd48a], length 1428
10:18:06.742461 IP 112.26.1.1.43445 > 112.26.1.8.46387: Flags [.], seq 451249:452677, ack 1, win 4017, options [nop,nop,TS val 159831 ecr 4294913508,mptcp dss ack 1720219151 seq 3868374855 subseq 451249 len 1428 csum 0x2671], length 1428
10:18:06.744509 IP 112.26.1.8.46387 > 112.26.1.1.43445: Flags [.], ack 406981, win 24209, options [nop,nop,TS val 4294915399 ecr 157807,nop,nop,sack 2 {436969:452677}{432685:434113},mptcp dss ack 3868162083], length 0
10:18:06.796691 IP 112.26.1.8.46387 > 112.26.1.1.43445: Flags [.], ack 406981, win 24209, options [nop,nop,TS val 4294914675 ecr 157807,nop,nop,sack 2 {432685:434113}{438397:445537},mptcp dss ack 3868162083], length 0
10:18:06.802558 IP 112.26.1.8.46387 > 112.26.1.1.43445: Flags [.], ack 406981, win 24209, options [nop,nop,TS val 4294914675 ecr 157807,nop,nop,sack 2 {432685:434113}{438397:445537},mptcp dss ack 3868162083], length 0
10:18:06.804908 IP 112.26.1.1.43445 > 112.26.1.8.46387: Flags [.], seq 461245:462673, ack 1, win 4017, options [nop,nop,TS val 160895 ecr 4294914414,mptcp dss ack 1720219151 seq 3868424835 subseq 461245 len 1428 csum 0xf894], length 1428
10:18:06.896322 IP 112.26.1.8.46387 > 112.26.1.1.43445: Flags [.], ack 406981, win 24209, options [nop,nop,TS val 4294914725 ecr 157807,nop,nop,sack 2 {436969:445537}{432685:434113},mptcp dss ack 3868162083], length 0
10:18:06.898634 IP 112.26.1.8.46387 > 112.26.1.1.43445: Flags [.], ack 406981, win 24209, options [nop,nop,TS val 4294914725 ecr 157807,nop,nop,sack 2 {436969:445537}{432685:434113},mptcp dss ack 3868162083], length 0
10:18:06.911393 IP 112.26.1.1.43445 > 112.26.1.8.46387: Flags [.], seq 462673:464101, ack 1, win 4017, options [nop,nop,TS val 161196 ecr 4294914675,mptcp dss ack 1720219151 seq 3868434831 subseq 462673 len 1428 csum 0x8fa3], length 1428
10:18:06.961797 IP 112.26.1.8.46387 > 112.26.1.1.43445: Flags [.], ack 406981, win 24209, options [nop,nop,TS val 4294914838 ecr 157807,nop,nop,sack 2 {436969:446965}{432685:434113},mptcp dss ack 3868162083], length 0
10:18:06.986116 IP 112.26.1.8.46387 > 112.26.1.1.43445: Flags [.], ack 406981, win 24209, options [nop,nop,TS val 4294914838 ecr 157807,nop,nop,sack 2 {436969:446965}{432685:434113},mptcp dss ack 3868162083], length 0
10:18:06.996782 IP 112.26.1.1.43445 > 112.26.1.8.46387: Flags [.], seq 464101:465529, ack 1, win 4017, options [nop,nop,TS val 161295 ecr 4294914725,mptcp dss ack 1720219151 seq 3868439115 subseq 464101 len 1428 csum 0x8896], length 1428
10:18:07.063279 IP 112.26.1.1.43445 > 112.26.1.8.46387: Flags [.], seq 454105:455533, ack 1, win 4017, options [nop,nop,TS val 160297 ecr 4294913848,mptcp dss ack 1720219151 seq 3868394847 subseq 454105 len 1428 csum 0x79a7], length 1428
10:18:07.064856 IP 112.26.1.8.46387 > 112.26.1.1.43445: Flags [.], ack 406981, win 24209, options [nop,nop,TS val 4294915720 ecr 157807,nop,nop,sack 2 {454105:455533}{436969:452677},mptcp dss ack 3868162083], length 0
10:18:07.104051 IP 112.26.1.1.43445 > 112.26.1.8.46387: Flags [.], seq 465529:466957, ack 1, win 4017, options [nop,nop,TS val 161407 ecr 4294914838,mptcp dss ack 1720219151 seq 3868446255 subseq 465529 len 1428 csum 0xeab8], length 1428
10:18:07.155022 IP 112.26.1.1.43445 > 112.26.1.8.46387: Flags [.], seq 455533:456961, ack 1, win 4017, options [nop,nop,TS val 160374 ecr 4294913916,mptcp dss ack 1720219151 seq 3868396275 subseq 455533 len 1428 csum 0x4f6a], length 1428
10:18:07.157187 IP 112.26.1.8.46387 > 112.26.1.1.43445: Flags [.], ack 406981, win 24209, options [nop,nop,TS val 4294915812 ecr 157807,nop,nop,sack 2 {454105:456961}{436969:452677},mptcp dss ack 3868162083], length 0
10:18:07.219783 IP 112.26.1.1.43445 > 112.26.1.8.46387: Flags [.], seq 456961:458389, ack 1, win 4017, options [nop,nop,TS val 160416 ecr 4294913971,mptcp dss ack 1720219151 seq 3868410555 subseq 456961 len 1428 csum 0x90a9], length 1428
10:18:07.227604 IP 112.26.1.8.46387 > 112.26.1.1.43445: Flags [.], ack 406981, win 24209, options [nop,nop,TS val 4294915876 ecr 157807,nop,nop,sack 2 {454105:458389}{436969:452677},mptcp dss ack 3868162083], length 0
10:18:07.281030 IP 112.26.1.8.46387 > 112.26.1.1.43445: Flags [.], ack 406981, win 24209, options [nop,nop,TS val 4294915196 ecr 157807,nop,nop,sack 2 {436969:449821}{432685:434113},mptcp dss ack 3868162083], length 0
10:18:07.283011 IP 112.26.1.8.46387 > 112.26.1.1.43445: Flags [.], ack 406981, win 24209, options [nop,nop,TS val 4294915196 ecr 157807,nop,nop,sack 2 {436969:449821}{432685:434113},mptcp dss ack 3868162083], length 0
10:18:07.362767 IP 112.26.1.1.43445 > 112.26.1.8.46387: Flags [.], seq 458389:459817, ack 1, win 4017, options [nop,nop,TS val 160525 ecr 4294914195,mptcp dss ack 1720219151 seq 3868413411 subseq 458389 len 1428 csum 0x9483], length 1428
10:18:07.364508 IP 112.26.1.8.46387 > 112.26.1.1.43445: Flags [.], ack 406981, win 24209, options [nop,nop,TS val 4294916019 ecr 157807,nop,nop,sack 2 {454105:459817}{436969:452677},mptcp dss ack 3868162083], length 0
10:18:07.400271 IP 112.26.1.1.43445 > 112.26.1.8.46387: Flags [.], seq 466957:468385, ack 1, win 4017, options [nop,nop,TS val 161770 ecr 4294915196,mptcp dss ack 1720219151 seq 3868464819 subseq 466957 len 1428 csum 0xd0f5], length 1428
10:18:07.455642 IP 112.26.1.1.43445 > 112.26.1.8.46387: Flags [.], seq 459817:461245, ack 1, win 4017, options [nop,nop,TS val 160689 ecr 4294914270,mptcp dss ack 1720219151 seq 3868417695 subseq 459817 len 1428 csum 0xd48a], length 1428
10:18:07.458054 IP 112.26.1.8.46387 > 112.26.1.1.43445: Flags [.], ack 406981, win 24209, options [nop,nop,TS val 4294916112 ecr 157807,nop,nop,sack 2 {454105:461245}{436969:452677},mptcp dss ack 3868162083], length 0
10:18:07.536130 IP 112.26.1.1.43445 > 112.26.1.8.46387: Flags [.], seq 468385:469813, ack 1, win 4017, options [nop,nop,TS val 161770 ecr 4294915196,mptcp dss ack 1720219151 seq 3868466247 subseq 468385 len 1428 csum 0x157a], length 1428
10:18:07.567642 IP 112.26.1.1.43445 > 112.26.1.8.46387: Flags [.], seq 461245:462673, ack 1, win 4017, options [nop,nop,TS val 160895 ecr 4294914414,mptcp dss ack 1720219151 seq 3868424835 subseq 461245 len 1428 csum 0xf894], length 1428
10:18:07.569293 IP 112.26.1.8.46387 > 112.26.1.1.43445: Flags [.], ack 406981, win 24209, options [nop,nop,TS val 4294916224 ecr 157807,nop,nop,sack 2 {454105:462673}{436969:452677},mptcp dss ack 3868162083], length 0
10:18:07.637534 IP 112.26.1.1.43445 > 112.26.1.8.46387: Flags [.], seq 462673:464101, ack 1, win 4017, options [nop,nop,TS val 161196 ecr 4294914675,mptcp dss ack 1720219151 seq 3868434831 subseq 462673 len 1428 csum 0x8fa3], length 1428
10:18:07.640776 IP 112.26.1.8.46387 > 112.26.1.1.43445: Flags [.], ack 406981, win 24209, options [nop,nop,TS val 4294916294 ecr 157807,nop,nop,sack 2 {454105:464101}{436969:452677},mptcp dss ack 3868162083], length 0
10:18:07.744094 IP 112.26.1.1.43445 > 112.26.1.8.46387: Flags [.], seq 464101:465529, ack 1, win 4017, options [nop,nop,TS val 161295 ecr 4294914725,mptcp dss ack 1720219151 seq 3868439115 subseq 464101 len 1428 csum 0x8896], length 1428
10:18:07.745453 IP 112.26.1.8.46387 > 112.26.1.1.43445: Flags [.], ack 406981, win 24209, options [nop,nop,TS val 4294916401 ecr 157807,nop,nop,sack 2 {454105:465529}{436969:452677},mptcp dss ack 3868162083], length 0
10:18:07.821425 IP 112.26.1.8.46387 > 112.26.1.1.43445: Flags [.], ack 406981, win 24209, options [nop,nop,TS val 4294915720 ecr 157807,nop,nop,sack 2 {454105:455533}{436969:452677},mptcp dss ack 3868162083], length 0
10:18:07.824157 IP 112.26.1.8.46387 > 112.26.1.1.43445: Flags [.], ack 406981, win 24209, options [nop,nop,TS val 4294915720 ecr 157807,nop,nop,sack 2 {454105:455533}{436969:452677},mptcp dss ack 3868162083], length 0
10:18:07.841999 IP 112.26.1.1.43445 > 112.26.1.8.46387: Flags [.], seq 406981:408409, ack 1, win 4017, options [nop,nop,TS val 162200 ecr 4294915720,mptcp dss ack 1720219151 seq 3868162083 subseq 406981 len 1428 csum 0x37f2], length 1428
10:18:07.912910 IP 112.26.1.1.43445 > 112.26.1.8.46387: Flags [.], seq 452677:454105, ack 1, win 4017, options [nop,nop,TS val 162200 ecr 4294915720,mptcp dss ack 1720219151 seq 3868376283 subseq 452677 len 1428 csum 0x7ca2], length 1428
10:18:07.934107 IP 112.26.1.8.46387 > 112.26.1.1.43445: Flags [.], ack 406981, win 24209, options [nop,nop,TS val 4294915812 ecr 157807,nop,nop,sack 2 {454105:456961}{436969:452677},mptcp dss ack 3868162083], length 0
10:18:07.941277 IP 112.26.1.8.46387 > 112.26.1.1.43445: Flags [.], ack 406981, win 24209, options [nop,nop,TS val 4294915812 ecr 157807,nop,nop,sack 2 {454105:456961}{436969:452677},mptcp dss ack 3868162083], length 0
10:18:07.992627 IP 112.26.1.8.46387 > 112.26.1.1.43445: Flags [.], ack 406981, win 24209, options [nop,nop,TS val 4294915876 ecr 157807,nop,nop,sack 2 {454105:458389}{436969:452677},mptcp dss ack 3868162083], length 0
10:18:08.023085 IP 112.26.1.1.43445 > 112.26.1.8.46387: Flags [.], seq 469813:471241, ack 1, win 4017, options [nop,nop,TS val 162212 ecr 4294915720,mptcp dss ack 1720219151 seq 3868484811 subseq 469813 len 1428 csum 0xd4f1], length 1428
10:18:08.050626 IP 112.26.1.8.46387 > 112.26.1.1.43445: Flags [.], ack 406981, win 24209, options [nop,nop,TS val 4294916019 ecr 157807,nop,nop,sack 2 {454105:459817}{436969:452677},mptcp dss ack 3868162083], length 0
10:18:08.058966 IP 112.26.1.8.46387 > 112.26.1.1.43445: Flags [.], ack 406981, win 24209, options [nop,nop,TS val 4294915876 ecr 157807,nop,nop,sack 2 {454105:458389}{436969:452677},mptcp dss ack 3868162083], length 0
10:18:08.113958 IP 112.26.1.1.43445 > 112.26.1.8.46387: Flags [.], seq 466957:468385, ack 1, win 4017, options [nop,nop,TS val 161770 ecr 4294915196,mptcp dss ack 1720219151 seq 3868464819 subseq 466957 len 1428 csum 0xd0f5], length 1428
10:18:08.116204 IP 112.26.1.8.46387 > 112.26.1.1.43445: Flags [.], ack 406981, win 24209, options [nop,nop,TS val 4294916770 ecr 157807,nop,nop,sack 2 {466957:468385}{454105:465529},mptcp dss ack 3868162083], length 0
10:18:08.161747 IP 112.26.1.1.43445 > 112.26.1.8.46387: Flags [.], seq 471241:472669, ack 1, win 4017, options [nop,nop,TS val 162377 ecr 4294915812,mptcp dss ack 1720219151 seq 3868490523 subseq 471241 len 1428 csum 0xa46b], length 1428
10:18:08.182086 IP 112.26.1.8.46387 > 112.26.1.1.43445: Flags [.], ack 406981, win 24209, options [nop,nop,TS val 4294916019 ecr 157807,nop,nop,sack 2 {454105:459817}{436969:452677},mptcp dss ack 3868162083], length 0
10:18:08.223414 IP 112.26.1.8.46387 > 112.26.1.1.43445: Flags [.], ack 406981, win 24209, options [nop,nop,TS val 4294916112 ecr 157807,nop,nop,sack 2 {454105:461245}{436969:452677},mptcp dss ack 3868162083], length 0
10:18:08.246044 IP 112.26.1.1.43445 > 112.26.1.8.46387: Flags [.], seq 472669:474097, ack 1, win 4017, options [nop,nop,TS val 162460 ecr 4294915876,mptcp dss ack 1720219151 seq 3868494807 subseq 472669 len 1428 csum 0x21ef], length 1428
10:18:08.266935 IP 112.26.1.8.46387 > 112.26.1.1.43445: Flags [.], ack 406981, win 24209, options [nop,nop,TS val 4294916112 ecr 157807,nop,nop,sack 2 {454105:461245}{436969:452677},mptcp dss ack 3868162083], length 0
10:18:08.311448 IP 112.26.1.1.43445 > 112.26.1.8.46387: Flags [.], seq 468385:469813, ack 1, win 4017, options [nop,nop,TS val 161770 ecr 4294915196,mptcp dss ack 1720219151 seq 3868466247 subseq 468385 len 1428 csum 0x157a], length 1428
10:18:08.313771 IP 112.26.1.8.46387 > 112.26.1.1.43445: Flags [.], ack 406981, win 24209, options [nop,nop,TS val 4294916968 ecr 157807,nop,nop,sack 2 {466957:469813}{454105:465529},mptcp dss ack 3868162083], length 0
10:18:08.339078 IP 112.26.1.1.43445 > 112.26.1.8.46387: Flags [.], seq 474097:475525, ack 1, win 4017, options [nop,nop,TS val 162593 ecr 4294916019,mptcp dss ack 1720219151 seq 3868499091 subseq 474097 len 1428 csum 0x1ba], length 1428
10:18:08.382203 IP 112.26.1.8.46387 > 112.26.1.1.43445: Flags [.], ack 406981, win 24209, options [nop,nop,TS val 4294916224 ecr 157807,nop,nop,sack 2 {454105:462673}{436969:452677},mptcp dss ack 3868162083], length 0
10:18:08.384094 IP 112.26.1.8.46387 > 112.26.1.1.43445: Flags [.], ack 406981, win 24209, options [nop,nop,TS val 4294916224 ecr 157807,nop,nop,sack 2 {454105:462673}{436969:452677},mptcp dss ack 3868162083], length 0
10:18:08.425139 IP 112.26.1.1.43445 > 112.26.1.8.46387: Flags [.], seq 475525:476953, ack 1, win 4017, options [nop,nop,TS val 162711 ecr 4294916112,mptcp dss ack 1720219151 seq 3868503375 subseq 475525 len 1428 csum 0x694e], length 1428
10:18:08.429752 IP 112.26.1.8.46387 > 112.26.1.1.43445: Flags [.], ack 406981, win 24209, options [nop,nop,TS val 4294916294 ecr 157807,nop,nop,sack 2 {454105:464101}{436969:452677},mptcp dss ack 3868162083], length 0
10:18:08.508741 IP 112.26.1.8.46387 > 112.26.1.1.43445: Flags [.], ack 406981, win 24209, options [nop,nop,TS val 4294916294 ecr 157807,nop,nop,sack 2 {454105:464101}{436969:452677},mptcp dss ack 3868162083], length 0
10:18:08.526178 IP 112.26.1.1.43445 > 112.26.1.8.46387: Flags [.], seq 476953:478381, ack 1, win 4017, options [nop,nop,TS val 162770 ecr 4294916224,mptcp dss ack 1720219151 seq 3868507659 subseq 476953 len 1428 csum 0xdc60], length 1428
10:18:08.545172 IP 112.26.1.8.46387 > 112.26.1.1.43445: Flags [.], ack 406981, win 24209, options [nop,nop,TS val 4294916401 ecr 157807,nop,nop,sack 2 {454105:465529}{436969:452677},mptcp dss ack 3868162083], length 0
10:18:08.563673 IP 112.26.1.8.46387 > 112.26.1.1.43445: Flags [.], ack 406981, win 24209, options [nop,nop,TS val 4294916401 ecr 157807,nop,nop,sack 2 {454105:465529}{436969:452677},mptcp dss ack 3868162083], length 0
10:18:08.615776 IP 112.26.1.1.43445 > 112.26.1.8.46387: Flags [.], seq 406981:408409, ack 1, win 4017, options [nop,nop,TS val 162200 ecr 4294915720,mptcp dss ack 1720219151 seq 3868162083 subseq 406981 len 1428 csum 0x37f2], length 1428
10:18:08.617673 IP 112.26.1.8.46387 > 112.26.1.1.43445: Flags [.], ack 452677, win 21693, options [nop,nop,TS val 4294917273 ecr 162200,nop,nop,sack 2 {466957:469813}{454105:465529},mptcp dss ack 3868376283], length 0
10:18:08.661468 IP 112.26.1.1.43445 > 112.26.1.8.46387: Flags [.], seq 478381:479809, ack 1, win 4017, options [nop,nop,TS val 162916 ecr 4294916294,mptcp dss ack 1720219151 seq 3868514799 subseq 478381 len 1428 csum 0x50fa], length 1428
10:18:08.690364 IP 112.26.1.1.43445 > 112.26.1.8.46387: Flags [.], seq 452677:454105, ack 1, win 4017, options [nop,nop,TS val 162200 ecr 4294915720,mptcp dss ack 1720219151 seq 3868376283 subseq 452677 len 1428 csum 0x7ca2], length 1428
10:18:08.713198 IP 112.26.1.8.46387 > 112.26.1.1.43445: Flags [.], ack 465529, win 23901, options [nop,nop,TS val 4294917347 ecr 162200,nop,nop,sack 1 {466957:469813},mptcp dss ack 3868381995], length 0
10:18:08.740442 IP 112.26.1.1.43445 > 112.26.1.8.46387: Flags [.], seq 479809:481237, ack 1, win 4017, options [nop,nop,TS val 162960 ecr 4294916401,mptcp dss ack 1720219151 seq 3868516227 subseq 479809 len 1428 csum 0x26c], length 1428
10:18:08.793506 IP 112.26.1.1.43445 > 112.26.1.8.46387: Flags [.], seq 469813:471241, ack 1, win 4017, options [nop,nop,TS val 162212 ecr 4294915720,mptcp dss ack 1720219151 seq 3868484811 subseq 469813 len 1428 csum 0xd4f1], length 1428
10:18:08.795330 IP 112.26.1.8.46387 > 112.26.1.1.43445: Flags [.], ack 465529, win 23965, options [nop,nop,TS val 4294917450 ecr 162200,nop,nop,sack 1 {466957:471241},mptcp dss ack 3868381995], length 0
10:18:08.854569 IP 112.26.1.8.46387 > 112.26.1.1.43445: Flags [.], ack 406981, win 24209, options [nop,nop,TS val 4294916770 ecr 157807,nop,nop,sack 2 {466957:468385}{454105:465529},mptcp dss ack 3868162083], length 0
10:18:08.856341 IP 112.26.1.8.46387 > 112.26.1.1.43445: Flags [.], ack 406981, win 24209, options [nop,nop,TS val 4294916770 ecr 157807,nop,nop,sack 2 {466957:468385}{454105:465529},mptcp dss ack 3868162083], length 0
10:18:08.877860 IP 112.26.1.1.43445 > 112.26.1.8.46387: Flags [.], seq 465529:466957, ack 1, win 4017, options [nop,nop,TS val 163232 ecr 4294916770,mptcp dss ack 1720219151 seq 3868446255 subseq 465529 len 1428 csum 0xeab8], length 1428
10:18:08.909532 IP 112.26.1.1.43445 > 112.26.1.8.46387: Flags [.], seq 471241:472669, ack 1, win 4017, options [nop,nop,TS val 162377 ecr 4294915812,mptcp dss ack 1720219151 seq 3868490523 subseq 471241 len 1428 csum 0xa46b], length 1428
10:18:08.915149 IP 112.26.1.8.46387 > 112.26.1.1.43445: Flags [.], ack 465529, win 23965, options [nop,nop,TS val 4294917566 ecr 162200,nop,nop,sack 1 {466957:472669},mptcp dss ack 3868381995], length 0
10:18:08.985760 IP 112.26.1.8.46387 > 112.26.1.1.43445: Flags [.], ack 406981, win 24209, options [nop,nop,TS val 4294916968 ecr 157807,nop,nop,sack 2 {466957:469813}{454105:465529},mptcp dss ack 3868162083], length 0
10:18:08.988511 IP 112.26.1.8.46387 > 112.26.1.1.43445: Flags [.], ack 406981, win 24209, options [nop,nop,TS val 4294916968 ecr 157807,nop,nop,sack 2 {466957:469813}{454105:465529},mptcp dss ack 3868162083], length 0
10:18:09.076071 IP 112.26.1.8.46387 > 112.26.1.1.43445: Flags [.], ack 452677, win 21693, options [nop,nop,TS val 4294917273 ecr 162200,nop,nop,sack 2 {466957:469813}{454105:465529},mptcp dss ack 3868376283], length 0
10:18:09.078979 IP 112.26.1.8.46387 > 112.26.1.1.43445: Flags [.], ack 452677, win 21693, options [nop,nop,TS val 4294917273 ecr 162200,nop,nop,sack 2 {466957:469813}{454105:465529},mptcp dss ack 3868376283], length 0
10:18:09.093940 IP 112.26.1.1.43445 > 112.26.1.8.46387: Flags [.], seq 481237:482665, ack 1, win 4017, options [nop,nop,TS val 163455 ecr 4294916968,mptcp dss ack 1720219151 seq 3868524795 subseq 481237 len 1428 csum 0xfa09], length 1428
10:18:09.158556 IP 112.26.1.8.46387 > 112.26.1.1.43445: Flags [.], ack 465529, win 23901, options [nop,nop,TS val 4294917347 ecr 162200,nop,nop,sack 1 {466957:469813},mptcp dss ack 3868381995], length 0
10:18:09.199030 IP 112.26.1.1.43445 > 112.26.1.8.46387: Flags [.], seq 482665:484093, ack 1, win 4017, options [nop,nop,TS val 163455 ecr 4294917273,mptcp dss ack 1720219151 seq 3868526223 subseq 482665 len 1428 csum 0xb4f9], length 1428
10:18:09.213533 IP 112.26.1.8.46387 > 112.26.1.1.43445: Flags [.], ack 465529, win 23901, options [nop,nop,TS val 4294917347 ecr 162200,nop,nop,sack 1 {466957:469813},mptcp dss ack 3868381995], length 0
10:18:09.305296 IP 112.26.1.8.46387 > 112.26.1.1.43445: Flags [.], ack 465529, win 23965, options [nop,nop,TS val 4294917450 ecr 162200,nop,nop,sack 1 {466957:471241},mptcp dss ack 3868381995], length 0
10:18:09.328508 IP 112.26.1.8.46387 > 112.26.1.1.43445: Flags [.], ack 465529, win 23965, options [nop,nop,TS val 4294917450 ecr 162200,nop,nop,sack 1 {466957:471241},mptcp dss ack 3868381995], length 0
10:18:09.427387 IP 112.26.1.8.46387 > 112.26.1.1.43445: Flags [.], ack 465529, win 23965, options [nop,nop,TS val 4294917566 ecr 162200,nop,nop,sack 1 {466957:472669},mptcp dss ack 3868381995], length 0
10:18:09.431310 IP 112.26.1.8.46387 > 112.26.1.1.43445: Flags [.], ack 465529, win 23965, options [nop,nop,TS val 4294917566 ecr 162200,nop,nop,sack 1 {466957:472669},mptcp dss ack 3868381995], length 0
10:18:09.459798 IP 112.26.1.1.43445 > 112.26.1.8.46387: Flags [.], seq 472669:474097, ack 1, win 4017, options [nop,nop,TS val 162460 ecr 4294915876,mptcp dss ack 1720219151 seq 3868494807 subseq 472669 len 1428 csum 0x21ef], length 1428
10:18:09.522459 IP 112.26.1.1.43445 > 112.26.1.8.46387: Flags [.], seq 474097:475525, ack 1, win 4017, options [nop,nop,TS val 162593 ecr 4294916019,mptcp dss ack 1720219151 seq 3868499091 subseq 474097 len 1428 csum 0x1ba], length 1428
10:18:09.552355 IP 112.26.1.1.43445 > 112.26.1.8.46387: Flags [.], seq 475525:476953, ack 1, win 4017, options [nop,nop,TS val 162711 ecr 4294916112,mptcp dss ack 1720219151 seq 3868503375 subseq 475525 len 1428 csum 0x694e], length 1428
10:18:09.595543 IP 112.26.1.1.43445 > 112.26.1.8.46387: Flags [.], seq 476953:478381, ack 1, win 4017, options [nop,nop,TS val 162770 ecr 4294916224,mptcp dss ack 1720219151 seq 3868507659 subseq 476953 len 1428 csum 0xdc60], length 1428
10:18:23.380494 IP 112.26.1.1.43445 > 112.26.1.8.46387: Flags [.], seq 465529:466957, ack 1, win 4017, options [nop,nop,TS val 177664 ecr 4294917566,mptcp dss ack 1720219151 seq 3868446255 subseq 465529 len 1428 csum 0xeab8], length 1428
10:18:23.434412 IP 112.26.1.1.43445 > 112.26.1.8.46387: Flags [.], seq 465529:466957, ack 1, win 4017, options [nop,nop,TS val 177664 ecr 4294917566,mptcp dss ack 1720219151 seq 3868446255 subseq 465529 len 1428 csum 0xeab8], length 1428
10:18:23.504411 IP 112.26.1.8.46387 > 112.26.1.1.43445: Flags [.], ack 472669, win 24224, options [nop,nop,TS val 4294932092 ecr 177664,mptcp dss ack 3868499091], length 0
10:18:23.507098 IP 112.26.1.8.46387 > 112.26.1.1.43445: Flags [.], ack 472669, win 24224, options [nop,nop,TS val 4294932092 ecr 177664,mptcp dss ack 3868499091], length 0
10:18:23.512448 IP 112.26.1.8.46387 > 112.26.1.1.43445: Flags [.], ack 472669, win 24224, options [nop,nop,TS val 4294932092 ecr 177664,mptcp dss ack 3868499091], length 0
10:18:23.666655 IP 112.26.1.1.43445 > 112.26.1.8.46387: Flags [.], seq 484093:485521, ack 1, win 4017, options [nop,nop,TS val 177889 ecr 4294932092,mptcp dss ack 1720219151 seq 3868470531 subseq 484093 len 1428 csum 0x9114], length 1428
10:18:23.666945 IP 112.26.1.1.43445 > 112.26.1.8.46387: Flags [.], seq 484093:485521, ack 1, win 4017, options [nop,nop,TS val 177889 ecr 4294932092,mptcp dss ack 1720219151 seq 3868470531 subseq 484093 len 1428 csum 0x9114], length 1428
10:18:23.681295 IP 112.26.1.8.46387 > 112.26.1.1.43445: Flags [.], ack 472669, win 24224, options [nop,nop,TS val 4294932326 ecr 177664,nop,nop,sack 1 {484093:485521},mptcp dss ack 3868499091], length 0
10:18:23.682820 IP 112.26.1.8.46387 > 112.26.1.1.43445: Flags [.], ack 472669, win 24224, options [nop,nop,TS val 4294932326 ecr 177664,nop,nop,sack 1 {484093:485521},mptcp dss ack 3868499091], length 0
