10:17:05.153887 IP 112.26.0.8.36004 > 112.26.0.1.43445: Flags [S], seq 604036043, win 65535, options [mss 1460,sackOK,TS val 4294851649 ecr 0,nop,wscale 6,mptcp capable csum {0x5fe731cb2a0ffaa8}], length 0
10:17:05.164755 IP 112.26.0.8.36004 > 112.26.0.1.43445: Flags [S], seq 604036043, win 65535, options [mss 1460,sackOK,TS val 4294851649 ecr 0,nop,wscale 6,mptcp capable csum {0x5fe731cb2a0ffaa8}], length 0
10:17:05.176398 IP 112.26.0.1.43445 > 112.26.0.8.36004: Flags [S.], seq 3411350881, ack 604036044, win 65535, options [mss 1460,sackOK,TS val 99544 ecr 4294851649,nop,wscale 6,mptcp capable csum {0x95b44a60aabf03a2}], length 0
10:17:05.355353 IP 112.26.0.1.43445 > 112.26.0.8.36004: Flags [S.], seq 3411350881, ack 604036044, win 65535, options [mss 1460,sackOK,TS val 99544 ecr 4294851649,nop,wscale 6,mptcp capable csum {0x95b44a60aabf03a2}], length 0
10:17:05.456055 IP 112.26.0.1.43445 > 112.26.0.8.36004: Flags [S.], seq 3411350881, ack 604036044, win 65535, options [mss 1460,sackOK,TS val 99544 ecr 4294851649,nop,wscale 6,mptcp capable csum {0x95b44a60aabf03a2}], length 0
10:17:05.470878 IP 112.26.0.8.36004 > 112.26.0.1.43445: Flags [.], ack 1, win 1369, options [nop,nop,TS val 4294854113 ecr 99544,mptcp capable csum {0x5fe731cb2a0ffaa8,0x95b44a60aabf03a2},mptcp dss ack 3866414399], length 0
10:17:05.474944 IP 112.26.0.8.36004 > 112.26.0.1.43445: Flags [.], ack 1, win 1369, options [nop,nop,TS val 4294854113 ecr 99544,mptcp capable csum {0x5fe731cb2a0ffaa8,0x95b44a60aabf03a2},mptcp dss ack 3866414399], length 0
10:17:35.658502 IP 112.26.0.8.36004 > 112.26.0.1.43445: Flags [.], ack 216869, win 21353, options [nop,nop,TS val 4294883551 ecr 128567,mptcp dss ack 3866908299], length 0
10:17:35.658699 IP 112.26.0.8.36004 > 112.26.0.1.43445: Flags [.], ack 216869, win 21353, options [nop,nop,TS val 4294883551 ecr 128567,mptcp dss ack 3866908299], length 0
10:17:35.684905 IP 112.26.0.1.43445 > 112.26.0.8.36004: Flags [.], seq 235433:236861, ack 1, win 4017, options [nop,nop,TS val 130057 ecr 4294883551,mptcp dss ack 1720219151 seq 3867013971 subseq 235433 len 1428 csum 0x1672], length 1428
10:17:35.706482 IP 112.26.0.1.43445 > 112.26.0.8.36004: Flags [.], seq 232577:234005, ack 1, win 4017, options [nop,nop,TS val 129786 ecr 4294883227,mptcp dss ack 1720219151 seq 3867001119 subseq 232577 len 1428 csum 0x9fb2], length 1428
10:17:35.737779 IP 112.26.0.1.43445 > 112.26.0.8.36004: Flags [.], seq 222581:224009, ack 1, win 4017, options [nop,nop,TS val 129118 ecr 4294882651,mptcp dss ack 1720219151 seq 3866973987 subseq 222581 len 1428 csum 0x1eb0], length 1428
10:17:35.789070 IP 112.26.0.1.43445 > 112.26.0.8.36004: Flags [.], seq 234005:235433, ack 1, win 4017, options [nop,nop,TS val 129963 ecr 4294883307,mptcp dss ack 1720219151 seq 3867008259 subseq 234005 len 1428 csum 0x918d], length 1428
10:17:35.832939 IP 112.26.0.1.43445 > 112.26.0.8.36004: Flags [.], seq 224009:225437, ack 1, win 4017, options [nop,nop,TS val 129211 ecr 4294882736,mptcp dss ack 1720219151 seq 3866979699 subseq 224009 len 1428 csum 0x3a9], length 1428
10:17:35.873390 IP 112.26.0.1.43445 > 112.26.0.8.36004: Flags [.], seq 235433:236861, ack 1, win 4017, options [nop,nop,TS val 130057 ecr 4294883551,mptcp dss ack 1720219151 seq 3867013971 subseq 235433 len 1428 csum 0x1672], length 1428
10:17:35.919632 IP 112.26.0.1.43445 > 112.26.0.8.36004: Flags [.], seq 225437:226865, ack 1, win 4017, options [nop,nop,TS val 129398 ecr 4294882887,mptcp dss ack 1720219151 seq 3866985411 subseq 225437 len 1428 csum 0x2896], length 1428
10:17:35.985699 IP 112.26.0.1.43445 > 112.26.0.8.36004: Flags [.], seq 226865:228293, ack 1, win 4017, options [nop,nop,TS val 129398 ecr 4294882887,mptcp dss ack 1720219151 seq 3866986839 subseq 226865 len 1428 csum 0xb4a8], length 1428
10:17:36.079361 IP 112.26.0.8.36004 > 112.26.0.1.43445: Flags [.], ack 216869, win 21718, options [nop,nop,TS val 4294883936 ecr 128567,nop,nop,sack 1 {218297:219725},mptcp dss ack 3866908299], length 0
10:17:36.079493 IP 112.26.0.8.36004 > 112.26.0.1.43445: Flags [.], ack 216869, win 21718, options [nop,nop,TS val 4294883936 ecr 128567,nop,nop,sack 1 {218297:219725},mptcp dss ack 3866908299], length 0
10:17:36.098639 IP 112.26.0.1.43445 > 112.26.0.8.36004: Flags [.], seq 236861:238289, ack 1, win 4017, options [nop,nop,TS val 130471 ecr 4294883936,mptcp dss ack 1720219151 seq 3867029679 subseq 236861 len 1428 csum 0x6434], length 1428
10:17:36.104507 IP 112.26.0.1.43445 > 112.26.0.8.36004: Flags [.], seq 236861:238289, ack 1, win 4017, options [nop,nop,TS val 130471 ecr 4294883936,mptcp dss ack 1720219151 seq 3867029679 subseq 236861 len 1428 csum 0x6434], length 1428
10:17:36.134804 IP 112.26.0.1.43445 > 112.26.0.8.36004: Flags [.], seq 229721:231149, ack 1, win 4017, options [nop,nop,TS val 129609 ecr 4294883116,mptcp dss ack 1720219151 seq 3866996835 subseq 229721 len 1428 csum 0x56dd], length 1428
10:17:36.202812 IP 112.26.0.8.36004 > 112.26.0.1.43445: Flags [.], ack 216869, win 22083, options [nop,nop,TS val 4294884159 ecr 128567,nop,nop,sack 1 {218297:221153},mptcp dss ack 3866952567], length 0
10:17:36.202997 IP 112.26.0.8.36004 > 112.26.0.1.43445: Flags [.], ack 216869, win 22083, options [nop,nop,TS val 4294884159 ecr 128567,nop,nop,sack 1 {218297:221153},mptcp dss ack 3866952567], length 0
10:17:36.222636 IP 112.26.0.1.43445 > 112.26.0.8.36004: Flags [.], seq 238289:239717, ack 1, win 4017, options [nop,nop,TS val 130596 ecr 4294884159,mptcp dss ack 1720219151 seq 3867038247 subseq 238289 len 1428 csum 0x3db], length 1428
10:17:36.224987 IP 112.26.0.1.43445 > 112.26.0.8.36004: Flags [.], seq 238289:239717, ack 1, win 4017, options [nop,nop,TS val 130596 ecr 4294884159,mptcp dss ack 1720219151 seq 3867038247 subseq 238289 len 1428 csum 0x3db], length 1428
10:17:36.260181 IP 112.26.0.1.43445 > 112.26.0.8.36004: Flags [.], seq 231149:232577, ack 1, win 4017, options [nop,nop,TS val 129609 ecr 4294883116,mptcp dss ack 1720219151 seq 3866998263 subseq 231149 len 1428 csum 0xea39], length 1428
10:17:36.347679 IP 112.26.0.8.36004 > 112.26.0.1.43445: Flags [.], ack 216869, win 22174, options [nop,nop,TS val 4294884264 ecr 128567,nop,nop,sack 1 {218297:222581},mptcp dss ack 3866952567], length 0
10:17:36.347893 IP 112.26.0.8.36004 > 112.26.0.1.43445: Flags [.], ack 216869, win 22174, options [nop,nop,TS val 4294884264 ecr 128567,nop,nop,sack 1 {218297:222581},mptcp dss ack 3866952567], length 0
10:17:36.372414 IP 112.26.0.1.43445 > 112.26.0.8.36004: Flags [.], seq 216869:218297, ack 1, win 4017, options [nop,nop,TS val 130725 ecr 4294884264,mptcp dss ack 1720219151 seq 3866952567 subseq 216869 len 1428 csum 0xf797], length 1428
10:17:36.377763 IP 112.26.0.1.43445 > 112.26.0.8.36004: Flags [.], seq 216869:218297, ack 1, win 4017, options [nop,nop,TS val 130725 ecr 4294884264,mptcp dss ack 1720219151 seq 3866952567 subseq 216869 len 1428 csum 0xf797], length 1428
10:17:36.431997 IP 112.26.0.1.43445 > 112.26.0.8.36004: Flags [.], seq 232577:234005, ack 1, win 4017, options [nop,nop,TS val 129786 ecr 4294883227,mptcp dss ack 1720219151 seq 3867001119 subseq 232577 len 1428 csum 0x9fb2], length 1428
10:17:36.503425 IP 112.26.0.1.43445 > 112.26.0.8.36004: Flags [.], seq 234005:235433, ack 1, win 4017, options [nop,nop,TS val 129963 ecr 4294883307,mptcp dss ack 1720219151 seq 3867008259 subseq 234005 len 1428 csum 0x918d], length 1428
10:17:36.579731 IP 112.26.0.1.43445 > 112.26.0.8.36004: Flags [.], seq 235433:236861, ack 1, win 4017, options [nop,nop,TS val 130057 ecr 4294883551,mptcp dss ack 1720219151 seq 3867013971 subseq 235433 len 1428 csum 0x1672], length 1428
10:17:36.654428 IP 112.26.0.8.36004 > 112.26.0.1.43445: Flags [.], ack 216869, win 22585, options [nop,nop,TS val 4294884576 ecr 128567,nop,nop,sack 1 {218297:226865},mptcp dss ack 3866952567], length 0
10:17:36.654561 IP 112.26.0.8.36004 > 112.26.0.1.43445: Flags [.], ack 216869, win 22585, options [nop,nop,TS val 4294884576 ecr 128567,nop,nop,sack 1 {218297:226865},mptcp dss ack 3866952567], length 0
10:17:36.702479 IP 112.26.0.1.43445 > 112.26.0.8.36004: Flags [.], seq 239717:241145, ack 1, win 4017, options [nop,nop,TS val 131074 ecr 4294884576,mptcp dss ack 1720219151 seq 3867055383 subseq 239717 len 1428 csum 0xa48c], length 1428
10:17:36.706833 IP 112.26.0.8.36004 > 112.26.0.1.43445: Flags [.], ack 216869, win 22767, options [nop,nop,TS val 4294884642 ecr 128567,nop,nop,sack 1 {218297:228293},mptcp dss ack 3866952567], length 0
10:17:36.707032 IP 112.26.0.8.36004 > 112.26.0.1.43445: Flags [.], ack 216869, win 22767, options [nop,nop,TS val 4294884642 ecr 128567,nop,nop,sack 1 {218297:228293},mptcp dss ack 3866952567], length 0
10:17:36.712157 IP 112.26.0.1.43445 > 112.26.0.8.36004: Flags [.], seq 239717:241145, ack 1, win 4017, options [nop,nop,TS val 131074 ecr 4294884576,mptcp dss ack 1720219151 seq 3867055383 subseq 239717 len 1428 csum 0xa48c], length 1428
10:17:36.781766 IP 112.26.0.1.43445 > 112.26.0.8.36004: Flags [.], seq 241145:242573, ack 1, win 4017, options [nop,nop,TS val 131074 ecr 4294884576,mptcp dss ack 1720219151 seq 3867056811 subseq 241145 len 1428 csum 0x7795], length 1428
10:17:36.810817 IP 112.26.0.1.43445 > 112.26.0.8.36004: Flags [.], seq 236861:238289, ack 1, win 4017, options [nop,nop,TS val 130471 ecr 4294883936,mptcp dss ack 1720219151 seq 3867029679 subseq 236861 len 1428 csum 0x6434], length 1428
10:17:36.826424 IP 112.26.0.1.43445 > 112.26.0.8.36004: Flags [.], seq 242573:244001, ack 1, win 4017, options [nop,nop,TS val 131152 ecr 4294884642,mptcp dss ack 1720219151 seq 3867061095 subseq 242573 len 1428 csum 0x3c9a], length 1428
10:17:36.891645 IP 112.26.0.1.43445 > 112.26.0.8.36004: Flags [.], seq 238289:239717, ack 1, win 4017, options [nop,nop,TS val 130596 ecr 4294884159,mptcp dss ack 1720219151 seq 3867038247 subseq 238289 len 1428 csum 0x3db], length 1428
10:17:36.917401 IP 112.26.0.1.43445 > 112.26.0.8.36004: Flags [.], seq 241145:242573, ack 1, win 4017, options [nop,nop,TS val 131074 ecr 4294884576,mptcp dss ack 1720219151 seq 3867056811 subseq 241145 len 1428 csum 0x7795], length 1428
10:17:36.982074 IP 112.26.0.1.43445 > 112.26.0.8.36004: Flags [.], seq 242573:244001, ack 1, win 4017, options [nop,nop,TS val 131152 ecr 4294884642,mptcp dss ack 1720219151 seq 3867061095 subseq 242573 len 1428 csum 0x3c9a], length 1428
10:17:37.003552 IP 112.26.0.1.43445 > 112.26.0.8.36004: Flags [.], seq 216869:218297, ack 1, win 4017, options [nop,nop,TS val 130725 ecr 4294884264,mptcp dss ack 1720219151 seq 3866952567 subseq 216869 len 1428 csum 0xf797], length 1428
10:17:37.052755 IP 112.26.0.8.36004 > 112.26.0.1.43445: Flags [.], ack 216869, win 23315, options [nop,nop,TS val 4294885089 ecr 128567,nop,nop,sack 2 {229721:234005}{218297:228293},mptcp dss ack 3866952567], length 0
10:17:37.052951 IP 112.26.0.8.36004 > 112.26.0.1.43445: Flags [.], ack 216869, win 23315, options [nop,nop,TS val 4294885089 ecr 128567,nop,nop,sack 2 {229721:234005}{218297:228293},mptcp dss ack 3866952567], length 0
10:17:37.070668 IP 112.26.0.1.43445 > 112.26.0.8.36004: Flags [.], seq 228293:229721, ack 1, win 4017, options [nop,nop,TS val 131431 ecr 4294885089,mptcp dss ack 1720219151 seq 3866989695 subseq 228293 len 1428 csum 0x7ab1], length 1428
10:17:37.077451 IP 112.26.0.1.43445 > 112.26.0.8.36004: Flags [.], seq 228293:229721, ack 1, win 4017, options [nop,nop,TS val 131431 ecr 4294885089,mptcp dss ack 1720219151 seq 3866989695 subseq 228293 len 1428 csum 0x7ab1], length 1428
10:17:37.136405 IP 112.26.0.8.36004 > 112.26.0.1.43445: Flags [.], ack 216869, win 23497, options [nop,nop,TS val 4294885160 ecr 128567,nop,nop,sack 2 {229721:235433}{218297:228293},mptcp dss ack 3866952567], length 0
10:17:37.136613 IP 112.26.0.8.36004 > 112.26.0.1.43445: Flags [.], ack 216869, win 23497, options [nop,nop,TS val 4294885160 ecr 128567,nop,nop,sack 2 {229721:235433}{218297:228293},mptcp dss ack 3866952567], length 0
10:17:37.188958 IP 112.26.0.1.43445 > 112.26.0.8.36004: Flags [.], seq 244001:245429, ack 1, win 4017, options [nop,nop,TS val 131563 ecr 4294885160,mptcp dss ack 1720219151 seq 3867081087 subseq 244001 len 1428 csum 0x9dcb], length 1428
10:17:37.194770 IP 112.26.0.1.43445 > 112.26.0.8.36004: Flags [.], seq 244001:245429, ack 1, win 4017, options [nop,nop,TS val 131563 ecr 4294885160,mptcp dss ack 1720219151 seq 3867081087 subseq 244001 len 1428 csum 0x9dcb], length 1428
10:17:37.218998 IP 112.26.0.8.36004 > 112.26.0.1.43445: Flags [.], ack 216869, win 23634, options [nop,nop,TS val 4294885236 ecr 128567,nop,nop,sack 2 {229721:236861}{218297:228293},mptcp dss ack 3866952567], length 0
10:17:37.219194 IP 112.26.0.8.36004 > 112.26.0.1.43445: Flags [.], ack 216869, win 23634, options [nop,nop,TS val 4294885236 ecr 128567,nop,nop,sack 2 {229721:236861}{218297:228293},mptcp dss ack 3866952567], length 0
10:17:37.345673 IP 112.26.0.1.43445 > 112.26.0.8.36004: Flags [.], seq 239717:241145, ack 1, win 4017, options [nop,nop,TS val 131074 ecr 4294884576,mptcp dss ack 1720219151 seq 3867055383 subseq 239717 len 1428 csum 0xa48c], length 1428
10:17:37.357957 IP 112.26.0.1.43445 > 112.26.0.8.36004: Flags [.], seq 245429:246857, ack 1, win 4017, options [nop,nop,TS val 131657 ecr 4294885236,mptcp dss ack 1720219151 seq 3867083943 subseq 245429 len 1428 csum 0x1406], length 1428
10:17:37.359868 IP 112.26.0.1.43445 > 112.26.0.8.36004: Flags [.], seq 245429:246857, ack 1, win 4017, options [nop,nop,TS val 131657 ecr 4294885236,mptcp dss ack 1720219151 seq 3867083943 subseq 245429 len 1428 csum 0x1406], length 1428
10:17:37.378583 IP 112.26.0.8.36004 > 112.26.0.1.43445: Flags [.], ack 216869, win 23883, options [nop,nop,TS val 4294885454 ecr 128567,nop,nop,sack 2 {229721:238289}{218297:228293},mptcp dss ack 3866952567], length 0
10:17:37.378781 IP 112.26.0.8.36004 > 112.26.0.1.43445: Flags [.], ack 216869, win 23883, options [nop,nop,TS val 4294885454 ecr 128567,nop,nop,sack 2 {229721:238289}{218297:228293},mptcp dss ack 3866952567], length 0
10:17:37.404125 IP 112.26.0.1.43445 > 112.26.0.8.36004: Flags [.], seq 246857:248285, ack 1, win 4017, options [nop,nop,TS val 131778 ecr 4294885454,mptcp dss ack 1720219151 seq 3867089655 subseq 246857 len 1428 csum 0x6baf], length 1428
10:17:37.445215 IP 112.26.0.1.43445 > 112.26.0.8.36004: Flags [.], seq 246857:248285, ack 1, win 4017, options [nop,nop,TS val 131778 ecr 4294885454,mptcp dss ack 1720219151 seq 3867089655 subseq 246857 len 1428 csum 0x6baf], length 1428
10:17:37.541754 IP 112.26.0.8.36004 > 112.26.0.1.43445: Flags [.], ack 216869, win 23883, options [nop,nop,TS val 4294885549 ecr 128567,nop,nop,sack 2 {229721:239717}{218297:228293},mptcp dss ack 3866952567], length 0
10:17:37.542018 IP 112.26.0.8.36004 > 112.26.0.1.43445: Flags [.], ack 216869, win 23883, options [nop,nop,TS val 4294885549 ecr 128567,nop,nop,sack 2 {229721:239717}{218297:228293},mptcp dss ack 3866952567], length 0
10:17:37.557981 IP 112.26.0.1.43445 > 112.26.0.8.36004: Flags [.], seq 248285:249713, ack 1, win 4017, options [nop,nop,TS val 131932 ecr 4294885549,mptcp dss ack 1720219151 seq 3867096795 subseq 248285 len 1428 csum 0x620f], length 1428
10:17:37.563531 IP 112.26.0.1.43445 > 112.26.0.8.36004: Flags [.], seq 248285:249713, ack 1, win 4017, options [nop,nop,TS val 131932 ecr 4294885549,mptcp dss ack 1720219151 seq 3867096795 subseq 248285 len 1428 csum 0x620f], length 1428
10:17:37.614552 IP 112.26.0.1.43445 > 112.26.0.8.36004: Flags [.], seq 241145:242573, ack 1, win 4017, options [nop,nop,TS val 131074 ecr 4294884576,mptcp dss ack 1720219151 seq 3867056811 subseq 241145 len 1428 csum 0x7795], length 1428
10:17:37.679799 IP 112.26.0.1.43445 > 112.26.0.8.36004: Flags [.], seq 242573:244001, ack 1, win 4017, options [nop,nop,TS val 131152 ecr 4294884642,mptcp dss ack 1720219151 seq 3867061095 subseq 242573 len 1428 csum 0x3c9a], length 1428
10:17:37.758512 IP 112.26.0.8.36004 > 112.26.0.1.43445: Flags [.], ack 228293, win 23720, options [nop,nop,TS val 4294885661 ecr 130725,nop,nop,sack 1 {229721:239717},mptcp dss ack 3866989695], length 0
10:17:37.758723 IP 112.26.0.8.36004 > 112.26.0.1.43445: Flags [.], ack 228293, win 23720, options [nop,nop,TS val 4294885661 ecr 130725,nop,nop,sack 1 {229721:239717},mptcp dss ack 3866989695], length 0
10:17:37.777429 IP 112.26.0.1.43445 > 112.26.0.8.36004: Flags [.], seq 249713:251141, ack 1, win 4017, options [nop,nop,TS val 132138 ecr 4294885661,mptcp dss ack 1720219151 seq 3867102507 subseq 249713 len 1428 csum 0x6828], length 1428
10:17:37.784399 IP 112.26.0.1.43445 > 112.26.0.8.36004: Flags [.], seq 249713:251141, ack 1, win 4017, options [nop,nop,TS val 132138 ecr 4294885661,mptcp dss ack 1720219151 seq 3867102507 subseq 249713 len 1428 csum 0x6828], length 1428
10:17:37.807398 IP 112.26.0.1.43445 > 112.26.0.8.36004: Flags [.], seq 228293:229721, ack 1, win 4017, options [nop,nop,TS val 131431 ecr 4294885089,mptcp dss ack 1720219151 seq 3866989695 subseq 228293 len 1428 csum 0x7ab1], length 1428
10:17:37.877610 IP 112.26.0.1.43445 > 112.26.0.8.36004: Flags [.], seq 244001:245429, ack 1, win 4017, options [nop,nop,TS val 131563 ecr 4294885160,mptcp dss ack 1720219151 seq 3867081087 subseq 244001 len 1428 csum 0x9dcb], length 1428
10:17:38.003605 IP 112.26.0.8.36004 > 112.26.0.1.43445: Flags [.], ack 228293, win 24079, options [nop,nop,TS val 4294885965 ecr 130725,nop,nop,sack 1 {229721:241145},mptcp dss ack 3866989695], length 0
10:17:38.003796 IP 112.26.0.8.36004 > 112.26.0.1.43445: Flags [.], ack 228293, win 24079, options [nop,nop,TS val 4294885965 ecr 130725,nop,nop,sack 1 {229721:241145},mptcp dss ack 3866989695], length 0
10:17:38.043839 IP 112.26.0.1.43445 > 112.26.0.8.36004: Flags [.], seq 251141:252569, ack 1, win 4017, options [nop,nop,TS val 132415 ecr 4294885965,mptcp dss ack 1720219151 seq 3867109647 subseq 251141 len 1428 csum 0xb1cf], length 1428
10:17:38.052888 IP 112.26.0.1.43445 > 112.26.0.8.36004: Flags [.], seq 245429:246857, ack 1, win 4017, options [nop,nop,TS val 131657 ecr 4294885236,mptcp dss ack 1720219151 seq 3867083943 subseq 245429 len 1428 csum 0x1406], length 1428
10:17:38.065431 IP 112.26.0.1.43445 > 112.26.0.8.36004: Flags [.], seq 251141:252569, ack 1, win 4017, options [nop,nop,TS val 132415 ecr 4294885965,mptcp dss ack 1720219151 seq 3867109647 subseq 251141 len 1428 csum 0xb1cf], length 1428
10:17:38.118467 IP 112.26.0.1.43445 > 112.26.0.8.36004: Flags [.], seq 246857:248285, ack 1, win 4017, options [nop,nop,TS val 131778 ecr 4294885454,mptcp dss ack 1720219151 seq 3867089655 subseq 246857 len 1428 csum 0x6baf], length 1428
10:17:38.189479 IP 112.26.0.1.43445 > 112.26.0.8.36004: Flags [.], seq 248285:249713, ack 1, win 4017, options [nop,nop,TS val 131932 ecr 4294885549,mptcp dss ack 1720219151 seq 3867096795 subseq 248285 len 1428 csum 0x620f], length 1428
10:17:38.333508 IP 112.26.0.8.36004 > 112.26.0.1.43445: Flags [.], ack 228293, win 24079, options [nop,nop,TS val 4294886272 ecr 130725,nop,nop,sack 1 {229721:242573},mptcp dss ack 3866989695], length 0
10:17:38.333725 IP 112.26.0.8.36004 > 112.26.0.1.43445: Flags [.], ack 228293, win 24079, options [nop,nop,TS val 4294886272 ecr 130725,nop,nop,sack 1 {229721:242573},mptcp dss ack 3866989695], length 0
10:17:38.380292 IP 112.26.0.1.43445 > 112.26.0.8.36004: Flags [.], seq 252569:253997, ack 1, win 4017, options [nop,nop,TS val 132753 ecr 4294886272,mptcp dss ack 1720219151 seq 3867123927 subseq 252569 len 1428 csum 0x987d], length 1428
10:17:38.390611 IP 112.26.0.1.43445 > 112.26.0.8.36004: Flags [.], seq 252569:253997, ack 1, win 4017, options [nop,nop,TS val 132753 ecr 4294886272,mptcp dss ack 1720219151 seq 3867123927 subseq 252569 len 1428 csum 0x987d], length 1428
10:17:38.397440 IP 112.26.0.8.36004 > 112.26.0.1.43445: Flags [.], ack 228293, win 24079, options [nop,nop,TS val 4294886337 ecr 130725,nop,nop,sack 1 {229721:244001},mptcp dss ack 3866989695], length 0
10:17:38.397649 IP 112.26.0.8.36004 > 112.26.0.1.43445: Flags [.], ack 228293, win 24079, options [nop,nop,TS val 4294886337 ecr 130725,nop,nop,sack 1 {229721:244001},mptcp dss ack 3866989695], length 0
10:17:38.476874 IP 112.26.0.1.43445 > 112.26.0.8.36004: Flags [.], seq 249713:251141, ack 1, win 4017, options [nop,nop,TS val 132138 ecr 4294885661,mptcp dss ack 1720219151 seq 3867102507 subseq 249713 len 1428 csum 0x6828], length 1428
10:17:38.514397 IP 112.26.0.1.43445 > 112.26.0.8.36004: Flags [.], seq 253997:255425, ack 1, win 4017, options [nop,nop,TS val 132804 ecr 4294886337,mptcp dss ack 1720219151 seq 3867129639 subseq 253997 len 1428 csum 0x6ae1], length 1428
10:17:38.516980 IP 112.26.0.1.43445 > 112.26.0.8.36004: Flags [.], seq 253997:255425, ack 1, win 4017, options [nop,nop,TS val 132804 ecr 4294886337,mptcp dss ack 1720219151 seq 3867129639 subseq 253997 len 1428 csum 0x6ae1], length 1428
10:17:38.558540 IP 112.26.0.8.36004 > 112.26.0.1.43445: Flags [.], ack 245429, win 23879, options [nop,nop,TS val 4294886535 ecr 131563,mptcp dss ack 3867002547], length 0
10:17:38.558753 IP 112.26.0.8.36004 > 112.26.0.1.43445: Flags [.], ack 245429, win 23879, options [nop,nop,TS val 4294886535 ecr 131563,mptcp dss ack 3867002547], length 0
10:17:38.608202 IP 112.26.0.1.43445 > 112.26.0.8.36004: Flags [.], seq 255425:256853, ack 1, win 4017, options [nop,nop,TS val 132937 ecr 4294886535,mptcp dss ack 1720219151 seq 3867138207 subseq 255425 len 1428 csum 0x556d], length 1428
10:17:38.621568 IP 112.26.0.1.43445 > 112.26.0.8.36004: Flags [.], seq 255425:256853, ack 1, win 4017, options [nop,nop,TS val 132937 ecr 4294886535,mptcp dss ack 1720219151 seq 3867138207 subseq 255425 len 1428 csum 0x556d], length 1428
10:17:38.635845 IP 112.26.0.8.36004 > 112.26.0.1.43445: Flags [.], ack 246857, win 23879, options [nop,nop,TS val 4294886710 ecr 131657,mptcp dss ack 3867002547], length 0
10:17:38.636033 IP 112.26.0.8.36004 > 112.26.0.1.43445: Flags [.], ack 246857, win 23879, options [nop,nop,TS val 4294886710 ecr 131657,mptcp dss ack 3867002547], length 0
10:17:38.693762 IP 112.26.0.1.43445 > 112.26.0.8.36004: Flags [.], seq 256853:258281, ack 1, win 4017, options [nop,nop,TS val 132937 ecr 4294886535,mptcp dss ack 1720219151 seq 3867139635 subseq 256853 len 1428 csum 0x8051], length 1428
10:17:38.704037 IP 112.26.0.1.43445 > 112.26.0.8.36004: Flags [.], seq 251141:252569, ack 1, win 4017, options [nop,nop,TS val 132415 ecr 4294885965,mptcp dss ack 1720219151 seq 3867109647 subseq 251141 len 1428 csum 0xb1cf], length 1428
10:17:38.709669 IP 112.26.0.1.43445 > 112.26.0.8.36004: Flags [.], seq 256853:258281, ack 1, win 4017, options [nop,nop,TS val 132937 ecr 4294886535,mptcp dss ack 1720219151 seq 3867139635 subseq 256853 len 1428 csum 0x8051], length 1428
10:17:38.785867 IP 112.26.0.1.43445 > 112.26.0.8.36004: Flags [.], seq 258281:259709, ack 1, win 4017, options [nop,nop,TS val 133040 ecr 4294886710,mptcp dss ack 1720219151 seq 3867145347 subseq 258281 len 1428 csum 0x171f], length 1428
10:17:38.792265 IP 112.26.0.8.36004 > 112.26.0.1.43445: Flags [.], ack 248285, win 24136, options [nop,nop,TS val 4294886775 ecr 131778,mptcp dss ack 3867048243], length 0
10:17:38.792466 IP 112.26.0.8.36004 > 112.26.0.1.43445: Flags [.], ack 248285, win 24136, options [nop,nop,TS val 4294886775 ecr 131778,mptcp dss ack 3867048243], length 0
10:17:38.826957 IP 112.26.0.1.43445 > 112.26.0.8.36004: Flags [.], seq 258281:259709, ack 1, win 4017, options [nop,nop,TS val 133040 ecr 4294886710,mptcp dss ack 1720219151 seq 3867145347 subseq 258281 len 1428 csum 0x171f], length 1428
10:17:38.858355 IP 112.26.0.8.36004 > 112.26.0.1.43445: Flags [.], ack 249713, win 24164, options [nop,nop,TS val 4294886846 ecr 131932,mptcp dss ack 3867048243], length 0
10:17:38.858523 IP 112.26.0.8.36004 > 112.26.0.1.43445: Flags [.], ack 249713, win 24164, options [nop,nop,TS val 4294886846 ecr 131932,mptcp dss ack 3867048243], length 0
10:17:38.874869 IP 112.26.0.1.43445 > 112.26.0.8.36004: Flags [.], seq 259709:261137, ack 1, win 4017, options [nop,nop,TS val 133171 ecr 4294886775,mptcp dss ack 1720219151 seq 3867149631 subseq 259709 len 1428 csum 0x48f5], length 1428
10:17:38.909623 IP 112.26.0.1.43445 > 112.26.0.8.36004: Flags [.], seq 259709:261137, ack 1, win 4017, options [nop,nop,TS val 133171 ecr 4294886775,mptcp dss ack 1720219151 seq 3867149631 subseq 259709 len 1428 csum 0x48f5], length 1428
10:17:38.950229 IP 112.26.0.1.43445 > 112.26.0.8.36004: Flags [.], seq 252569:253997, ack 1, win 4017, options [nop,nop,TS val 132753 ecr 4294886272,mptcp dss ack 1720219151 seq 3867123927 subseq 252569 len 1428 csum 0x987d], length 1428
10:17:38.979345 IP 112.26.0.1.43445 > 112.26.0.8.36004: Flags [.], seq 261137:262565, ack 1, win 4017, options [nop,nop,TS val 133171 ecr 4294886775,mptcp dss ack 1720219151 seq 3867151059 subseq 261137 len 1428 csum 0x8d5], length 1428
10:17:38.982143 IP 112.26.0.1.43445 > 112.26.0.8.36004: Flags [.], seq 261137:262565, ack 1, win 4017, options [nop,nop,TS val 133171 ecr 4294886775,mptcp dss ack 1720219151 seq 3867151059 subseq 261137 len 1428 csum 0x8d5], length 1428
10:17:39.043265 IP 112.26.0.1.43445 > 112.26.0.8.36004: Flags [.], seq 262565:263993, ack 1, win 4017, options [nop,nop,TS val 133308 ecr 4294886846,mptcp dss ack 1720219151 seq 3867156771 subseq 262565 len 1428 csum 0x66e1], length 1428
10:17:39.062322 IP 112.26.0.8.36004 > 112.26.0.1.43445: Flags [.], ack 251141, win 24164, options [nop,nop,TS val 4294887133 ecr 132138,mptcp dss ack 3867048243], length 0
10:17:39.062523 IP 112.26.0.8.36004 > 112.26.0.1.43445: Flags [.], ack 251141, win 24164, options [nop,nop,TS val 4294887133 ecr 132138,mptcp dss ack 3867048243], length 0
10:17:39.119073 IP 112.26.0.1.43445 > 112.26.0.8.36004: Flags [.], seq 262565:263993, ack 1, win 4017, options [nop,nop,TS val 133308 ecr 4294886846,mptcp dss ack 1720219151 seq 3867156771 subseq 262565 len 1428 csum 0x66e1], length 1428
10:17:39.134928 IP 112.26.0.1.43445 > 112.26.0.8.36004: Flags [.], seq 263993:265421, ack 1, win 4017, options [nop,nop,TS val 133441 ecr 4294887133,mptcp dss ack 1720219151 seq 3867162483 subseq 263993 len 1428 csum 0xfc4], length 1428
10:17:39.152296 IP 112.26.0.1.43445 > 112.26.0.8.36004: Flags [.], seq 253997:255425, ack 1, win 4017, options [nop,nop,TS val 132804 ecr 4294886337,mptcp dss ack 1720219151 seq 3867129639 subseq 253997 len 1428 csum 0x6ae1], length 1428
10:17:39.178541 IP 112.26.0.1.43445 > 112.26.0.8.36004: Flags [.], seq 255425:256853, ack 1, win 4017, options [nop,nop,TS val 132937 ecr 4294886535,mptcp dss ack 1720219151 seq 3867138207 subseq 255425 len 1428 csum 0x556d], length 1428
10:17:39.216960 IP 112.26.0.1.43445 > 112.26.0.8.36004: Flags [.], seq 263993:265421, ack 1, win 4017, options [nop,nop,TS val 133441 ecr 4294887133,mptcp dss ack 1720219151 seq 3867162483 subseq 263993 len 1428 csum 0xfc4], length 1428
10:17:39.282832 IP 112.26.0.8.36004 > 112.26.0.1.43445: Flags [.], ack 252569, win 24164, options [nop,nop,TS val 4294887341 ecr 132415,mptcp dss ack 3867048243], length 0
10:17:39.282976 IP 112.26.0.8.36004 > 112.26.0.1.43445: Flags [.], ack 252569, win 24164, options [nop,nop,TS val 4294887341 ecr 132415,mptcp dss ack 3867048243], length 0
10:17:39.290393 IP 112.26.0.1.43445 > 112.26.0.8.36004: Flags [.], seq 265421:266849, ack 1, win 4017, options [nop,nop,TS val 133661 ecr 4294887341,mptcp dss ack 1720219151 seq 3867175335 subseq 265421 len 1428 csum 0x9509], length 1428
10:17:39.298928 IP 112.26.0.1.43445 > 112.26.0.8.36004: Flags [.], seq 265421:266849, ack 1, win 4017, options [nop,nop,TS val 133661 ecr 4294887341,mptcp dss ack 1720219151 seq 3867175335 subseq 265421 len 1428 csum 0x9509], length 1428
10:17:39.353114 IP 112.26.0.1.43445 > 112.26.0.8.36004: Flags [.], seq 256853:258281, ack 1, win 4017, options [nop,nop,TS val 132937 ecr 4294886535,mptcp dss ack 1720219151 seq 3867139635 subseq 256853 len 1428 csum 0x8051], length 1428
10:17:39.423908 IP 112.26.0.1.43445 > 112.26.0.8.36004: Flags [.], seq 258281:259709, ack 1, win 4017, options [nop,nop,TS val 133040 ecr 4294886710,mptcp dss ack 1720219151 seq 3867145347 subseq 258281 len 1428 csum 0x171f], length 1428
10:17:39.473270 IP 112.26.0.1.43445 > 112.26.0.8.36004: Flags [.], seq 259709:261137, ack 1, win 4017, options [nop,nop,TS val 133171 ecr 4294886775,mptcp dss ack 1720219151 seq 3867149631 subseq 259709 len 1428 csum 0x48f5], length 1428
10:17:39.563531 IP 112.26.0.8.36004 > 112.26.0.1.43445: Flags [.], ack 253997, win 24193, options [nop,nop,TS val 4294887607 ecr 132753,mptcp dss ack 3867078231], length 0
10:17:39.563739 IP 112.26.0.8.36004 > 112.26.0.1.43445: Flags [.], ack 253997, win 24193, options [nop,nop,TS val 4294887607 ecr 132753,mptcp dss ack 3867078231], length 0
10:17:39.570098 IP 112.26.0.1.43445 > 112.26.0.8.36004: Flags [.], seq 266849:268277, ack 1, win 4017, options [nop,nop,TS val 133942 ecr 4294887607,mptcp dss ack 1720219151 seq 3867185331 subseq 266849 len 1428 csum 0x8062], length 1428
10:17:39.579293 IP 112.26.0.1.43445 > 112.26.0.8.36004: Flags [.], seq 266849:268277, ack 1, win 4017, options [nop,nop,TS val 133942 ecr 4294887607,mptcp dss ack 1720219151 seq 3867185331 subseq 266849 len 1428 csum 0x8062], length 1428
10:17:39.628489 IP 112.26.0.1.43445 > 112.26.0.8.36004: Flags [.], seq 261137:262565, ack 1, win 4017, options [nop,nop,TS val 133171 ecr 4294886775,mptcp dss ack 1720219151 seq 3867151059 subseq 261137 len 1428 csum 0x8d5], length 1428
10:17:39.698421 IP 112.26.0.1.43445 > 112.26.0.8.36004: Flags [.], seq 262565:263993, ack 1, win 4017, options [nop,nop,TS val 133308 ecr 4294886846,mptcp dss ack 1720219151 seq 3867156771 subseq 262565 len 1428 csum 0x66e1], length 1428
10:17:39.764497 IP 112.26.0.8.36004 > 112.26.0.1.43445: Flags [.], ack 255425, win 24193, options [nop,nop,TS val 4294887794 ecr 132804,mptcp dss ack 3867078231], length 0
10:17:39.764670 IP 112.26.0.8.36004 > 112.26.0.1.43445: Flags [.], ack 255425, win 24193, options [nop,nop,TS val 4294887794 ecr 132804,mptcp dss ack 3867078231], length 0
10:17:39.774906 IP 112.26.0.1.43445 > 112.26.0.8.36004: Flags [.], seq 268277:269705, ack 1, win 4017, options [nop,nop,TS val 134143 ecr 4294887794,mptcp dss ack 1720219151 seq 3867191043 subseq 268277 len 1428 csum 0xc5e0], length 1428
10:17:39.778084 IP 112.26.0.1.43445 > 112.26.0.8.36004: Flags [.], seq 268277:269705, ack 1, win 4017, options [nop,nop,TS val 134143 ecr 4294887794,mptcp dss ack 1720219151 seq 3867191043 subseq 268277 len 1428 csum 0xc5e0], length 1428
10:17:39.865483 IP 112.26.0.8.36004 > 112.26.0.1.43445: Flags [.], ack 256853, win 24193, options [nop,nop,TS val 4294887835 ecr 132937,mptcp dss ack 3867078231], length 0
10:17:39.865694 IP 112.26.0.8.36004 > 112.26.0.1.43445: Flags [.], ack 256853, win 24193, options [nop,nop,TS val 4294887835 ecr 132937,mptcp dss ack 3867078231], length 0
10:17:39.871972 IP 112.26.0.1.43445 > 112.26.0.8.36004: Flags [.], seq 269705:271133, ack 1, win 4017, options [nop,nop,TS val 134245 ecr 4294887835,mptcp dss ack 1720219151 seq 3867198183 subseq 269705 len 1428 csum 0xc9d7], length 1428
10:17:39.876517 IP 112.26.0.1.43445 > 112.26.0.8.36004: Flags [.], seq 269705:271133, ack 1, win 4017, options [nop,nop,TS val 134245 ecr 4294887835,mptcp dss ack 1720219151 seq 3867198183 subseq 269705 len 1428 csum 0xc9d7], length 1428
10:17:39.955809 IP 112.26.0.1.43445 > 112.26.0.8.36004: Flags [.], seq 263993:265421, ack 1, win 4017, options [nop,nop,TS val 133441 ecr 4294887133,mptcp dss ack 1720219151 seq 3867162483 subseq 263993 len 1428 csum 0xfc4], length 1428
10:17:40.010280 IP 112.26.0.1.43445 > 112.26.0.8.36004: Flags [.], seq 265421:266849, ack 1, win 4017, options [nop,nop,TS val 133661 ecr 4294887341,mptcp dss ack 1720219151 seq 3867175335 subseq 265421 len 1428 csum 0x9509], length 1428
10:17:40.047914 IP 112.26.0.8.36004 > 112.26.0.1.43445: Flags [.], ack 258281, win 24193, options [nop,nop,TS val 4294888010 ecr 132937,mptcp dss ack 3867078231], length 0
10:17:40.048086 IP 112.26.0.8.36004 > 112.26.0.1.43445: Flags [.], ack 258281, win 24193, options [nop,nop,TS val 4294888010 ecr 132937,mptcp dss ack 3867078231], length 0
10:17:40.075126 IP 112.26.0.1.43445 > 112.26.0.8.36004: Flags [.], seq 271133:272561, ack 1, win 4017, options [nop,nop,TS val 134426 ecr 4294888010,mptcp dss ack 1720219151 seq 3867205323 subseq 271133 len 1428 csum 0xb40d], length 1428
10:17:40.079730 IP 112.26.0.1.43445 > 112.26.0.8.36004: Flags [.], seq 271133:272561, ack 1, win 4017, options [nop,nop,TS val 134426 ecr 4294888010,mptcp dss ack 1720219151 seq 3867205323 subseq 271133 len 1428 csum 0xb40d], length 1428
10:17:40.118901 IP 112.26.0.8.36004 > 112.26.0.1.43445: Flags [.], ack 259709, win 24193, options [nop,nop,TS val 4294888081 ecr 133040,mptcp dss ack 3867078231], length 0
10:17:40.119124 IP 112.26.0.8.36004 > 112.26.0.1.43445: Flags [.], ack 259709, win 24193, options [nop,nop,TS val 4294888081 ecr 133040,mptcp dss ack 3867078231], length 0
10:17:40.157868 IP 112.26.0.8.36004 > 112.26.0.1.43445: Flags [.], ack 261137, win 24193, options [nop,nop,TS val 4294888130 ecr 133171,mptcp dss ack 3867078231], length 0
10:17:40.158002 IP 112.26.0.8.36004 > 112.26.0.1.43445: Flags [.], ack 261137, win 24193, options [nop,nop,TS val 4294888130 ecr 133171,mptcp dss ack 3867078231], length 0
10:17:40.171457 IP 112.26.0.1.43445 > 112.26.0.8.36004: Flags [.], seq 272561:273989, ack 1, win 4017, options [nop,nop,TS val 134512 ecr 4294888081,mptcp dss ack 1720219151 seq 3867212463 subseq 272561 len 1428 csum 0x802], length 1428
10:17:40.173123 IP 112.26.0.1.43445 > 112.26.0.8.36004: Flags [.], seq 272561:273989, ack 1, win 4017, options [nop,nop,TS val 134512 ecr 4294888081,mptcp dss ack 1720219151 seq 3867212463 subseq 272561 len 1428 csum 0x802], length 1428
10:17:40.222767 IP 112.26.0.1.43445 > 112.26.0.8.36004: Flags [.], seq 266849:268277, ack 1, win 4017, options [nop,nop,TS val 133942 ecr 4294887607,mptcp dss ack 1720219151 seq 3867185331 subseq 266849 len 1428 csum 0x8062], length 1428
10:17:40.252592 IP 112.26.0.1.43445 > 112.26.0.8.36004: Flags [.], seq 273989:275417, ack 1, win 4017, options [nop,nop,TS val 134605 ecr 4294888130,mptcp dss ack 1720219151 seq 3867216747 subseq 273989 len 1428 csum 0xddeb], length 1428
10:17:40.254923 IP 112.26.0.1.43445 > 112.26.0.8.36004: Flags [.], seq 273989:275417, ack 1, win 4017, options [nop,nop,TS val 134605 ecr 4294888130,mptcp dss ack 1720219151 seq 3867216747 subseq 273989 len 1428 csum 0xddeb], length 1428
10:17:40.274903 IP 112.26.0.8.36004 > 112.26.0.1.43445: Flags [.], ack 262565, win 24193, options [nop,nop,TS val 4294888285 ecr 133171,mptcp dss ack 3867078231], length 0
10:17:40.275051 IP 112.26.0.8.36004 > 112.26.0.1.43445: Flags [.], ack 262565, win 24193, options [nop,nop,TS val 4294888285 ecr 133171,mptcp dss ack 3867078231], length 0
10:17:40.326000 IP 112.26.0.1.43445 > 112.26.0.8.36004: Flags [.], seq 275417:276845, ack 1, win 4017, options [nop,nop,TS val 134700 ecr 4294888285,mptcp dss ack 1720219151 seq 3867219603 subseq 275417 len 1428 csum 0x5596], length 1428
10:17:40.328562 IP 112.26.0.1.43445 > 112.26.0.8.36004: Flags [.], seq 275417:276845, ack 1, win 4017, options [nop,nop,TS val 134700 ecr 4294888285,mptcp dss ack 1720219151 seq 3867219603 subseq 275417 len 1428 csum 0x5596], length 1428
10:17:40.363845 IP 112.26.0.8.36004 > 112.26.0.1.43445: Flags [.], ack 263993, win 24193, options [nop,nop,TS val 4294888355 ecr 133308,mptcp dss ack 3867078231], length 0
10:17:40.364050 IP 112.26.0.8.36004 > 112.26.0.1.43445: Flags [.], ack 263993, win 24193, options [nop,nop,TS val 4294888355 ecr 133308,mptcp dss ack 3867078231], length 0
10:17:40.446560 IP 112.26.0.1.43445 > 112.26.0.8.36004: Flags [.], seq 268277:269705, ack 1, win 4017, options [nop,nop,TS val 134143 ecr 4294887794,mptcp dss ack 1720219151 seq 3867191043 subseq 268277 len 1428 csum 0xc5e0], length 1428
10:17:40.463386 IP 112.26.0.1.43445 > 112.26.0.8.36004: Flags [.], seq 276845:278273, ack 1, win 4017, options [nop,nop,TS val 134700 ecr 4294888285,mptcp dss ack 1720219151 seq 3867221031 subseq 276845 len 1428 csum 0x3f78], length 1428
10:17:40.466371 IP 112.26.0.1.43445 > 112.26.0.8.36004: Flags [.], seq 276845:278273, ack 1, win 4017, options [nop,nop,TS val 134700 ecr 4294888285,mptcp dss ack 1720219151 seq 3867221031 subseq 276845 len 1428 csum 0x3f78], length 1428
10:17:40.499627 IP 112.26.0.1.43445 > 112.26.0.8.36004: Flags [.], seq 269705:271133, ack 1, win 4017, options [nop,nop,TS val 134245 ecr 4294887835,mptcp dss ack 1720219151 seq 3867198183 subseq 269705 len 1428 csum 0xc9d7], length 1428
10:17:40.541403 IP 112.26.0.1.43445 > 112.26.0.8.36004: Flags [.], seq 278273:279701, ack 1, win 4017, options [nop,nop,TS val 134799 ecr 4294888355,mptcp dss ack 1720219151 seq 3867228171 subseq 278273 len 1428 csum 0x9ab5], length 1428
10:17:40.562880 IP 112.26.0.8.36004 > 112.26.0.1.43445: Flags [.], ack 265421, win 24193, options [nop,nop,TS val 4294888594 ecr 133441,mptcp dss ack 3867078231], length 0
10:17:40.563020 IP 112.26.0.8.36004 > 112.26.0.1.43445: Flags [.], ack 265421, win 24193, options [nop,nop,TS val 4294888594 ecr 133441,mptcp dss ack 3867078231], length 0
10:17:40.594295 IP 112.26.0.1.43445 > 112.26.0.8.36004: Flags [.], seq 279701:281129, ack 1, win 4017, options [nop,nop,TS val 134942 ecr 4294888594,mptcp dss ack 1720219151 seq 3867231027 subseq 279701 len 1428 csum 0x99f8], length 1428
10:17:40.604397 IP 112.26.0.1.43445 > 112.26.0.8.36004: Flags [.], seq 278273:279701, ack 1, win 4017, options [nop,nop,TS val 134799 ecr 4294888355,mptcp dss ack 1720219151 seq 3867228171 subseq 278273 len 1428 csum 0x9ab5], length 1428
10:17:40.630692 IP 112.26.0.8.36004 > 112.26.0.1.43445: Flags [.], ack 266849, win 24193, options [nop,nop,TS val 4294888708 ecr 133661,mptcp dss ack 3867078231], length 0
10:17:40.630870 IP 112.26.0.8.36004 > 112.26.0.1.43445: Flags [.], ack 266849, win 24193, options [nop,nop,TS val 4294888708 ecr 133661,mptcp dss ack 3867078231], length 0
10:17:40.678870 IP 112.26.0.1.43445 > 112.26.0.8.36004: Flags [.], seq 281129:282557, ack 1, win 4017, options [nop,nop,TS val 135050 ecr 4294888708,mptcp dss ack 1720219151 seq 3867233883 subseq 281129 len 1428 csum 0xcdbc], length 1428
10:17:40.701513 IP 112.26.0.1.43445 > 112.26.0.8.36004: Flags [.], seq 279701:281129, ack 1, win 4017, options [nop,nop,TS val 134942 ecr 4294888594,mptcp dss ack 1720219151 seq 3867231027 subseq 279701 len 1428 csum 0x99f8], length 1428
10:17:40.716619 IP 112.26.0.1.43445 > 112.26.0.8.36004: Flags [.], seq 271133:272561, ack 1, win 4017, options [nop,nop,TS val 134426 ecr 4294888010,mptcp dss ack 1720219151 seq 3867205323 subseq 271133 len 1428 csum 0xb40d], length 1428
10:17:40.745617 IP 112.26.0.1.43445 > 112.26.0.8.36004: Flags [.], seq 281129:282557, ack 1, win 4017, options [nop,nop,TS val 135050 ecr 4294888708,mptcp dss ack 1720219151 seq 3867233883 subseq 281129 len 1428 csum 0xcdbc], length 1428
10:17:40.780568 IP 112.26.0.1.43445 > 112.26.0.8.36004: Flags [.], seq 272561:273989, ack 1, win 4017, options [nop,nop,TS val 134512 ecr 4294888081,mptcp dss ack 1720219151 seq 3867212463 subseq 272561 len 1428 csum 0x802], length 1428
10:17:40.883232 IP 112.26.0.1.43445 > 112.26.0.8.36004: Flags [.], seq 273989:275417, ack 1, win 4017, options [nop,nop,TS val 134605 ecr 4294888130,mptcp dss ack 1720219151 seq 3867216747 subseq 273989 len 1428 csum 0xddeb], length 1428
10:17:40.914753 IP 112.26.0.8.36004 > 112.26.0.1.43445: Flags [.], ack 268277, win 24193, options [nop,nop,TS val 4294888968 ecr 133942,mptcp dss ack 3867078231], length 0
10:17:40.914926 IP 112.26.0.8.36004 > 112.26.0.1.43445: Flags [.], ack 268277, win 24193, options [nop,nop,TS val 4294888968 ecr 133942,mptcp dss ack 3867078231], length 0
10:17:40.921381 IP 112.26.0.1.43445 > 112.26.0.8.36004: Flags [.], seq 282557:283985, ack 1, win 4017, options [nop,nop,TS val 135293 ecr 4294888968,mptcp dss ack 1720219151 seq 3867246735 subseq 282557 len 1428 csum 0x3f2b], length 1428
