10:17:23.895686 IP 112.26.2.8.39903 > 112.26.2.1.43445: Flags [S], seq 672498423, win 65535, options [mss 1460,sackOK,TS val 4294872457 ecr 0,nop,wscale 6,mptcp join id 4 token 0x1271d1f5 nonce 0xad08927e], length 0
10:17:23.935318 IP 112.26.2.8.39903 > 112.26.2.1.43445: Flags [S], seq 672498423, win 65535, options [mss 1460,sackOK,TS val 4294872457 ecr 0,nop,wscale 6,mptcp join id 4 token 0x1271d1f5 nonce 0xad08927e], length 0
10:17:24.003501 IP 112.26.2.8.39903 > 112.26.2.1.43445: Flags [S], seq 672498423, win 65535, options [mss 1460,sackOK,TS val 4294872457 ecr 0,nop,wscale 6,mptcp join id 4 token 0x1271d1f5 nonce 0xad08927e], length 0
10:17:24.124358 IP 112.26.2.1.43445 > 112.26.2.8.39903: Flags [S.], seq 1340884807, ack 672498424, win 65535, options [mss 1460,sackOK,TS val 118380 ecr 4294872457,nop,wscale 6,mptcp join id 6 hmac 0xdf78a7e315d0df0 nonce 0x6a59e05e], length 0
10:17:24.181095 IP 112.26.2.1.43445 > 112.26.2.8.39903: Flags [S.], seq 1340884807, ack 672498424, win 65535, options [mss 1460,sackOK,TS val 118380 ecr 4294872457,nop,wscale 6,mptcp join id 6 hmac 0xdf78a7e315d0df0 nonce 0x6a59e05e], length 0
10:17:24.225781 IP 112.26.2.8.39903 > 112.26.2.1.43445: Flags [.], ack 1, win 6479, options [nop,nop,TS val 4294872838 ecr 118380,mptcp join hmac 0x06c6c92732455c5a9bc8c60b0e48efa7c6236428], length 0
10:17:24.250878 IP 112.26.2.8.39903 > 112.26.2.1.43445: Flags [.], ack 1, win 6479, options [nop,nop,TS val 4294872838 ecr 118380,mptcp join hmac 0x06c6c92732455c5a9bc8c60b0e48efa7c6236428], length 0
10:17:58.490822 IP 112.26.2.8.39903 > 112.26.2.1.43445: Flags [.], ack 307021, win 24409, options [nop,nop,TS val 4294907144 ecr 152146,mptcp dss ack 3867986439], length 0
10:17:58.493160 IP 112.26.2.8.39903 > 112.26.2.1.43445: Flags [.], ack 307021, win 24409, options [nop,nop,TS val 4294907144 ecr 152146,mptcp dss ack 3867986439], length 0
10:17:58.529366 IP 112.26.2.1.43445 > 112.26.2.8.39903: Flags [.], seq 307021:308449, ack 1, win 4017, options [nop,nop,TS val 152146 ecr 4294905727,mptcp dss ack 1720219151 seq 3868005003 subseq 307021 len 1428 csum 0x5d30], length 1428
10:17:58.532251 IP 112.26.2.1.43445 > 112.26.2.8.39903: Flags [.], seq 307021:308449, ack 1, win 4017, options [nop,nop,TS val 152146 ecr 4294905727,mptcp dss ack 1720219151 seq 3868005003 subseq 307021 len 1428 csum 0x5d30], length 1428
10:17:58.610383 IP 112.26.2.1.43445 > 112.26.2.8.39903: Flags [.], seq 309877:311305, ack 1, win 4017, options [nop,nop,TS val 152376 ecr 4294905914,mptcp dss ack 1720219151 seq 3868014999 subseq 309877 len 1428 csum 0x94a8], length 1428
10:17:58.612349 IP 112.26.2.1.43445 > 112.26.2.8.39903: Flags [.], seq 309877:311305, ack 1, win 4017, options [nop,nop,TS val 152376 ecr 4294905914,mptcp dss ack 1720219151 seq 3868014999 subseq 309877 len 1428 csum 0x94a8], length 1428
10:17:58.617965 IP 112.26.2.8.39903 > 112.26.2.1.43445: Flags [.], ack 308449, win 24409, options [nop,nop,TS val 4294907269 ecr 152146,nop,nop,sack 1 {309877:311305},mptcp dss ack 3867986439], length 0
10:17:58.668428 IP 112.26.2.8.39903 > 112.26.2.1.43445: Flags [.], ack 308449, win 24409, options [nop,nop,TS val 4294907269 ecr 152146,nop,nop,sack 1 {309877:311305},mptcp dss ack 3867986439], length 0
10:17:58.720017 IP 112.26.2.8.39903 > 112.26.2.1.43445: Flags [.], ack 305593, win 24210, options [nop,nop,TS val 4294906663 ecr 151499,mptcp dss ack 3867935031], length 0
10:17:58.792551 IP 112.26.2.1.43445 > 112.26.2.8.39903: Flags [.], seq 311305:312733, ack 1, win 4017, options [nop,nop,TS val 152439 ecr 4294906088,mptcp dss ack 1720219151 seq 3868017855 subseq 311305 len 1428 csum 0xb4b6], length 1428
10:17:58.794766 IP 112.26.2.1.43445 > 112.26.2.8.39903: Flags [.], seq 311305:312733, ack 1, win 4017, options [nop,nop,TS val 152439 ecr 4294906088,mptcp dss ack 1720219151 seq 3868017855 subseq 311305 len 1428 csum 0xb4b6], length 1428
10:17:58.798754 IP 112.26.2.8.39903 > 112.26.2.1.43445: Flags [.], ack 308449, win 24409, options [nop,nop,TS val 4294907451 ecr 152146,nop,nop,sack 1 {309877:312733},mptcp dss ack 3867986439], length 0
10:17:58.800423 IP 112.26.2.8.39903 > 112.26.2.1.43445: Flags [.], ack 308449, win 24409, options [nop,nop,TS val 4294907451 ecr 152146,nop,nop,sack 1 {309877:312733},mptcp dss ack 3867986439], length 0
10:17:58.897707 IP 112.26.2.1.43445 > 112.26.2.8.39903: Flags [.], seq 312733:314161, ack 1, win 4017, options [nop,nop,TS val 152439 ecr 4294906088,mptcp dss ack 1720219151 seq 3868019283 subseq 312733 len 1428 csum 0xcd0b], length 1428
10:17:58.899901 IP 112.26.2.1.43445 > 112.26.2.8.39903: Flags [.], seq 312733:314161, ack 1, win 4017, options [nop,nop,TS val 152439 ecr 4294906088,mptcp dss ack 1720219151 seq 3868019283 subseq 312733 len 1428 csum 0xcd0b], length 1428
10:17:58.903061 IP 112.26.2.8.39903 > 112.26.2.1.43445: Flags [.], ack 308449, win 24409, options [nop,nop,TS val 4294907556 ecr 152146,nop,nop,sack 1 {309877:314161},mptcp dss ack 3867986439], length 0
10:17:58.925042 IP 112.26.2.8.39903 > 112.26.2.1.43445: Flags [.], ack 308449, win 24409, options [nop,nop,TS val 4294907556 ecr 152146,nop,nop,sack 1 {309877:314161},mptcp dss ack 3867986439], length 0
10:17:58.988152 IP 112.26.2.1.43445 > 112.26.2.8.39903: Flags [.], seq 314161:315589, ack 1, win 4017, options [nop,nop,TS val 152439 ecr 4294906088,mptcp dss ack 1720219151 seq 3868020711 subseq 314161 len 1428 csum 0xd55d], length 1428
10:17:58.992096 IP 112.26.2.1.43445 > 112.26.2.8.39903: Flags [.], seq 314161:315589, ack 1, win 4017, options [nop,nop,TS val 152439 ecr 4294906088,mptcp dss ack 1720219151 seq 3868020711 subseq 314161 len 1428 csum 0xd55d], length 1428
10:17:58.997139 IP 112.26.2.8.39903 > 112.26.2.1.43445: Flags [.], ack 308449, win 24409, options [nop,nop,TS val 4294907648 ecr 152146,nop,nop,sack 1 {309877:315589},mptcp dss ack 3867986439], length 0
10:17:59.009517 IP 112.26.2.8.39903 > 112.26.2.1.43445: Flags [.], ack 308449, win 24409, options [nop,nop,TS val 4294907648 ecr 152146,nop,nop,sack 1 {309877:315589},mptcp dss ack 3867986439], length 0
10:17:59.070561 IP 112.26.2.1.43445 > 112.26.2.8.39903: Flags [.], seq 315589:317017, ack 1, win 4017, options [nop,nop,TS val 152543 ecr 4294906190,mptcp dss ack 1720219151 seq 3868034991 subseq 315589 len 1428 csum 0x8d03], length 1428
10:17:59.073663 IP 112.26.2.1.43445 > 112.26.2.8.39903: Flags [.], seq 315589:317017, ack 1, win 4017, options [nop,nop,TS val 152543 ecr 4294906190,mptcp dss ack 1720219151 seq 3868034991 subseq 315589 len 1428 csum 0x8d03], length 1428
10:17:59.082737 IP 112.26.2.8.39903 > 112.26.2.1.43445: Flags [.], ack 308449, win 24409, options [nop,nop,TS val 4294907730 ecr 152146,nop,nop,sack 1 {309877:317017},mptcp dss ack 3867986439], length 0
10:17:59.086002 IP 112.26.2.8.39903 > 112.26.2.1.43445: Flags [.], ack 308449, win 24409, options [nop,nop,TS val 4294907730 ecr 152146,nop,nop,sack 1 {309877:317017},mptcp dss ack 3867986439], length 0
10:17:59.172970 IP 112.26.2.1.43445 > 112.26.2.8.39903: Flags [.], seq 317017:318445, ack 1, win 4017, options [nop,nop,TS val 152648 ecr 4294906287,mptcp dss ack 1720219151 seq 3868039275 subseq 317017 len 1428 csum 0x4530], length 1428
10:17:59.178478 IP 112.26.2.1.43445 > 112.26.2.8.39903: Flags [.], seq 317017:318445, ack 1, win 4017, options [nop,nop,TS val 152648 ecr 4294906287,mptcp dss ack 1720219151 seq 3868039275 subseq 317017 len 1428 csum 0x4530], length 1428
10:17:59.180017 IP 112.26.2.8.39903 > 112.26.2.1.43445: Flags [.], ack 308449, win 24409, options [nop,nop,TS val 4294907835 ecr 152146,nop,nop,sack 1 {309877:318445},mptcp dss ack 3867986439], length 0
10:17:59.200441 IP 112.26.2.8.39903 > 112.26.2.1.43445: Flags [.], ack 308449, win 24409, options [nop,nop,TS val 4294907835 ecr 152146,nop,nop,sack 1 {309877:318445},mptcp dss ack 3867986439], length 0
10:17:59.242489 IP 112.26.2.1.43445 > 112.26.2.8.39903: Flags [.], seq 318445:319873, ack 1, win 4017, options [nop,nop,TS val 152705 ecr 4294906361,mptcp dss ack 1720219151 seq 3868040703 subseq 318445 len 1428 csum 0x4d99], length 1428
10:17:59.244892 IP 112.26.2.1.43445 > 112.26.2.8.39903: Flags [.], seq 318445:319873, ack 1, win 4017, options [nop,nop,TS val 152705 ecr 4294906361,mptcp dss ack 1720219151 seq 3868040703 subseq 318445 len 1428 csum 0x4d99], length 1428
10:17:59.282359 IP 112.26.2.8.39903 > 112.26.2.1.43445: Flags [.], ack 308449, win 24409, options [nop,nop,TS val 4294907901 ecr 152146,nop,nop,sack 1 {309877:319873},mptcp dss ack 3867986439], length 0
10:17:59.284704 IP 112.26.2.8.39903 > 112.26.2.1.43445: Flags [.], ack 308449, win 24409, options [nop,nop,TS val 4294907901 ecr 152146,nop,nop,sack 1 {309877:319873},mptcp dss ack 3867986439], length 0
10:17:59.336950 IP 112.26.2.8.39903 > 112.26.2.1.43445: Flags [.], ack 308449, win 24409, options [nop,nop,TS val 4294907269 ecr 152146,nop,nop,sack 1 {309877:311305},mptcp dss ack 3867986439], length 0
10:17:59.385933 IP 112.26.2.1.43445 > 112.26.2.8.39903: Flags [.], seq 319873:321301, ack 1, win 4017, options [nop,nop,TS val 153096 ecr 4294906663,mptcp dss ack 1720219151 seq 3868063551 subseq 319873 len 1428 csum 0x38ad], length 1428
10:17:59.387599 IP 112.26.2.1.43445 > 112.26.2.8.39903: Flags [.], seq 319873:321301, ack 1, win 4017, options [nop,nop,TS val 153096 ecr 4294906663,mptcp dss ack 1720219151 seq 3868063551 subseq 319873 len 1428 csum 0x38ad], length 1428
10:17:59.389215 IP 112.26.2.8.39903 > 112.26.2.1.43445: Flags [.], ack 308449, win 24409, options [nop,nop,TS val 4294908044 ecr 152146,nop,nop,sack 1 {309877:321301},mptcp dss ack 3867986439], length 0
10:17:59.390533 IP 112.26.2.8.39903 > 112.26.2.1.43445: Flags [.], ack 308449, win 24409, options [nop,nop,TS val 4294908044 ecr 152146,nop,nop,sack 1 {309877:321301},mptcp dss ack 3867986439], length 0
10:17:59.520975 IP 112.26.2.1.43445 > 112.26.2.8.39903: Flags [.], seq 321301:322729, ack 1, win 4017, options [nop,nop,TS val 153096 ecr 4294906663,mptcp dss ack 1720219151 seq 3868064979 subseq 321301 len 1428 csum 0xe372], length 1428
10:17:59.525396 IP 112.26.2.1.43445 > 112.26.2.8.39903: Flags [.], seq 321301:322729, ack 1, win 4017, options [nop,nop,TS val 153096 ecr 4294906663,mptcp dss ack 1720219151 seq 3868064979 subseq 321301 len 1428 csum 0xe372], length 1428
10:17:59.528010 IP 112.26.2.8.39903 > 112.26.2.1.43445: Flags [.], ack 308449, win 24409, options [nop,nop,TS val 4294908182 ecr 152146,nop,nop,sack 1 {309877:322729},mptcp dss ack 3867986439], length 0
10:17:59.530466 IP 112.26.2.8.39903 > 112.26.2.1.43445: Flags [.], ack 308449, win 24409, options [nop,nop,TS val 4294908182 ecr 152146,nop,nop,sack 1 {309877:322729},mptcp dss ack 3867986439], length 0
10:17:59.644895 IP 112.26.2.8.39903 > 112.26.2.1.43445: Flags [.], ack 308449, win 24409, options [nop,nop,TS val 4294907556 ecr 152146,nop,nop,sack 1 {309877:314161},mptcp dss ack 3867986439], length 0
10:17:59.693117 IP 112.26.2.8.39903 > 112.26.2.1.43445: Flags [.], ack 308449, win 24409, options [nop,nop,TS val 4294907648 ecr 152146,nop,nop,sack 1 {309877:315589},mptcp dss ack 3867986439], length 0
10:17:59.781798 IP 112.26.2.8.39903 > 112.26.2.1.43445: Flags [.], ack 308449, win 24409, options [nop,nop,TS val 4294907730 ecr 152146,nop,nop,sack 1 {309877:317017},mptcp dss ack 3867986439], length 0
10:17:59.842369 IP 112.26.2.8.39903 > 112.26.2.1.43445: Flags [.], ack 308449, win 24409, options [nop,nop,TS val 4294907835 ecr 152146,nop,nop,sack 1 {309877:318445},mptcp dss ack 3867986439], length 0
10:17:59.871694 IP 112.26.2.8.39903 > 112.26.2.1.43445: Flags [.], ack 308449, win 24409, options [nop,nop,TS val 4294907901 ecr 152146,nop,nop,sack 1 {309877:319873},mptcp dss ack 3867986439], length 0
10:17:59.950424 IP 112.26.2.1.43445 > 112.26.2.8.39903: Flags [.], seq 322729:324157, ack 1, win 4017, options [nop,nop,TS val 153713 ecr 4294907269,mptcp dss ack 1720219151 seq 3868083543 subseq 322729 len 1428 csum 0xc864], length 1428
10:17:59.952294 IP 112.26.2.1.43445 > 112.26.2.8.39903: Flags [.], seq 322729:324157, ack 1, win 4017, options [nop,nop,TS val 153713 ecr 4294907269,mptcp dss ack 1720219151 seq 3868083543 subseq 322729 len 1428 csum 0xc864], length 1428
10:17:59.963765 IP 112.26.2.8.39903 > 112.26.2.1.43445: Flags [.], ack 308449, win 24409, options [nop,nop,TS val 4294908609 ecr 152146,nop,nop,sack 1 {309877:324157},mptcp dss ack 3867986439], length 0
10:17:59.965706 IP 112.26.2.8.39903 > 112.26.2.1.43445: Flags [.], ack 308449, win 24409, options [nop,nop,TS val 4294908609 ecr 152146,nop,nop,sack 1 {309877:324157},mptcp dss ack 3867986439], length 0
10:18:00.025625 IP 112.26.2.1.43445 > 112.26.2.8.39903: Flags [.], seq 324157:325585, ack 1, win 4017, options [nop,nop,TS val 153713 ecr 4294907269,mptcp dss ack 1720219151 seq 3868084971 subseq 324157 len 1428 csum 0x77f4], length 1428
10:18:00.071011 IP 112.26.2.1.43445 > 112.26.2.8.39903: Flags [.], seq 324157:325585, ack 1, win 4017, options [nop,nop,TS val 153713 ecr 4294907269,mptcp dss ack 1720219151 seq 3868084971 subseq 324157 len 1428 csum 0x77f4], length 1428
10:18:00.072317 IP 112.26.2.8.39903 > 112.26.2.1.43445: Flags [.], ack 308449, win 24276, options [nop,nop,TS val 4294908728 ecr 152146,nop,nop,sack 1 {309877:325585},mptcp dss ack 3867995007], length 0
10:18:00.074285 IP 112.26.2.8.39903 > 112.26.2.1.43445: Flags [.], ack 308449, win 24276, options [nop,nop,TS val 4294908728 ecr 152146,nop,nop,sack 1 {309877:325585},mptcp dss ack 3867995007], length 0
10:18:00.105366 IP 112.26.2.8.39903 > 112.26.2.1.43445: Flags [.], ack 308449, win 24409, options [nop,nop,TS val 4294908044 ecr 152146,nop,nop,sack 1 {309877:321301},mptcp dss ack 3867986439], length 0
10:18:00.167687 IP 112.26.2.1.43445 > 112.26.2.8.39903: Flags [.], seq 325585:327013, ack 1, win 4017, options [nop,nop,TS val 153713 ecr 4294907269,mptcp dss ack 1720219151 seq 3868086399 subseq 325585 len 1428 csum 0x423f], length 1428
10:18:00.171154 IP 112.26.2.1.43445 > 112.26.2.8.39903: Flags [.], seq 325585:327013, ack 1, win 4017, options [nop,nop,TS val 153713 ecr 4294907269,mptcp dss ack 1720219151 seq 3868086399 subseq 325585 len 1428 csum 0x423f], length 1428
10:18:00.172971 IP 112.26.2.8.39903 > 112.26.2.1.43445: Flags [.], ack 308449, win 24098, options [nop,nop,TS val 4294908828 ecr 152146,nop,nop,sack 1 {309877:327013},mptcp dss ack 3868006431], length 0
10:18:00.183123 IP 112.26.2.8.39903 > 112.26.2.1.43445: Flags [.], ack 308449, win 24098, options [nop,nop,TS val 4294908828 ecr 152146,nop,nop,sack 1 {309877:327013},mptcp dss ack 3868006431], length 0
10:18:00.258868 IP 112.26.2.8.39903 > 112.26.2.1.43445: Flags [.], ack 308449, win 24409, options [nop,nop,TS val 4294908182 ecr 152146,nop,nop,sack 1 {309877:322729},mptcp dss ack 3867986439], length 0
10:18:00.328744 IP 112.26.2.1.43445 > 112.26.2.8.39903: Flags [.], seq 308449:309877, ack 1, win 4017, options [nop,nop,TS val 154021 ecr 4294907556,mptcp dss ack 1720219151 seq 3868006431 subseq 308449 len 1428 csum 0xb0b6], length 1428
10:18:00.332976 IP 112.26.2.1.43445 > 112.26.2.8.39903: Flags [.], seq 308449:309877, ack 1, win 4017, options [nop,nop,TS val 154021 ecr 4294907556,mptcp dss ack 1720219151 seq 3868006431 subseq 308449 len 1428 csum 0xb0b6], length 1428
10:18:00.334644 IP 112.26.2.8.39903 > 112.26.2.1.43445: Flags [.], ack 327013, win 23764, options [nop,nop,TS val 4294908989 ecr 154021,mptcp dss ack 3868032135], length 0
10:18:00.339840 IP 112.26.2.8.39903 > 112.26.2.1.43445: Flags [.], ack 327013, win 23764, options [nop,nop,TS val 4294908989 ecr 154021,mptcp dss ack 3868032135], length 0
10:18:00.431182 IP 112.26.2.1.43445 > 112.26.2.8.39903: Flags [.], seq 328441:329869, ack 1, win 4017, options [nop,nop,TS val 154069 ecr 4294907556,mptcp dss ack 1720219151 seq 3868099251 subseq 328441 len 1428 csum 0x8aa5], length 1428
10:18:00.433438 IP 112.26.2.1.43445 > 112.26.2.8.39903: Flags [.], seq 328441:329869, ack 1, win 4017, options [nop,nop,TS val 154069 ecr 4294907556,mptcp dss ack 1720219151 seq 3868099251 subseq 328441 len 1428 csum 0x8aa5], length 1428
10:18:00.435439 IP 112.26.2.8.39903 > 112.26.2.1.43445: Flags [.], ack 327013, win 24030, options [nop,nop,TS val 4294909090 ecr 154021,nop,nop,sack 1 {328441:329869},mptcp dss ack 3868032135], length 0
10:18:00.443406 IP 112.26.2.8.39903 > 112.26.2.1.43445: Flags [.], ack 327013, win 24030, options [nop,nop,TS val 4294909090 ecr 154021,nop,nop,sack 1 {328441:329869},mptcp dss ack 3868032135], length 0
10:18:00.543818 IP 112.26.2.1.43445 > 112.26.2.8.39903: Flags [.], seq 329869:331297, ack 1, win 4017, options [nop,nop,TS val 154078 ecr 4294907648,mptcp dss ack 1720219151 seq 3868100679 subseq 329869 len 1428 csum 0x2bf9], length 1428
10:18:00.547670 IP 112.26.2.1.43445 > 112.26.2.8.39903: Flags [.], seq 329869:331297, ack 1, win 4017, options [nop,nop,TS val 154078 ecr 4294907648,mptcp dss ack 1720219151 seq 3868100679 subseq 329869 len 1428 csum 0x2bf9], length 1428
10:18:00.549902 IP 112.26.2.8.39903 > 112.26.2.1.43445: Flags [.], ack 327013, win 24030, options [nop,nop,TS val 4294909204 ecr 154021,nop,nop,sack 1 {328441:331297},mptcp dss ack 3868032135], length 0
10:18:00.559136 IP 112.26.2.8.39903 > 112.26.2.1.43445: Flags [.], ack 327013, win 24030, options [nop,nop,TS val 4294909204 ecr 154021,nop,nop,sack 1 {328441:331297},mptcp dss ack 3868032135], length 0
10:18:00.632319 IP 112.26.2.1.43445 > 112.26.2.8.39903: Flags [.], seq 331297:332725, ack 1, win 4017, options [nop,nop,TS val 154248 ecr 4294907835,mptcp dss ack 1720219151 seq 3868106391 subseq 331297 len 1428 csum 0x5d13], length 1428
10:18:00.636267 IP 112.26.2.1.43445 > 112.26.2.8.39903: Flags [.], seq 331297:332725, ack 1, win 4017, options [nop,nop,TS val 154248 ecr 4294907835,mptcp dss ack 1720219151 seq 3868106391 subseq 331297 len 1428 csum 0x5d13], length 1428
10:18:00.640053 IP 112.26.2.8.39903 > 112.26.2.1.43445: Flags [.], ack 327013, win 24030, options [nop,nop,TS val 4294909293 ecr 154021,nop,nop,sack 1 {328441:332725},mptcp dss ack 3868032135], length 0
10:18:00.646808 IP 112.26.2.8.39903 > 112.26.2.1.43445: Flags [.], ack 327013, win 24030, options [nop,nop,TS val 4294909293 ecr 154021,nop,nop,sack 1 {328441:332725},mptcp dss ack 3868032135], length 0
10:18:00.714976 IP 112.26.2.1.43445 > 112.26.2.8.39903: Flags [.], seq 332725:334153, ack 1, win 4017, options [nop,nop,TS val 154289 ecr 4294907901,mptcp dss ack 1720219151 seq 3868107819 subseq 332725 len 1428 csum 0xffb9], length 1428
10:18:00.750472 IP 112.26.2.1.43445 > 112.26.2.8.39903: Flags [.], seq 332725:334153, ack 1, win 4017, options [nop,nop,TS val 154289 ecr 4294907901,mptcp dss ack 1720219151 seq 3868107819 subseq 332725 len 1428 csum 0xffb9], length 1428
10:18:00.752266 IP 112.26.2.8.39903 > 112.26.2.1.43445: Flags [.], ack 327013, win 24009, options [nop,nop,TS val 4294909407 ecr 154021,nop,nop,sack 1 {328441:334153},mptcp dss ack 3868047843], length 0
10:18:00.765289 IP 112.26.2.8.39903 > 112.26.2.1.43445: Flags [.], ack 327013, win 24009, options [nop,nop,TS val 4294909407 ecr 154021,nop,nop,sack 1 {328441:334153},mptcp dss ack 3868047843], length 0
10:18:00.784850 IP 112.26.2.8.39903 > 112.26.2.1.43445: Flags [.], ack 308449, win 24276, options [nop,nop,TS val 4294908728 ecr 152146,nop,nop,sack 1 {309877:325585},mptcp dss ack 3867995007], length 0
10:18:00.837891 IP 112.26.2.8.39903 > 112.26.2.1.43445: Flags [.], ack 308449, win 24098, options [nop,nop,TS val 4294908828 ecr 152146,nop,nop,sack 1 {309877:327013},mptcp dss ack 3868006431], length 0
10:18:00.932607 IP 112.26.2.8.39903 > 112.26.2.1.43445: Flags [.], ack 327013, win 23764, options [nop,nop,TS val 4294908989 ecr 154021,mptcp dss ack 3868032135], length 0
10:18:01.012832 IP 112.26.2.8.39903 > 112.26.2.1.43445: Flags [.], ack 327013, win 24030, options [nop,nop,TS val 4294909090 ecr 154021,nop,nop,sack 1 {328441:329869},mptcp dss ack 3868032135], length 0
10:18:01.037948 IP 112.26.2.8.39903 > 112.26.2.1.43445: Flags [.], ack 327013, win 24030, options [nop,nop,TS val 4294909204 ecr 154021,nop,nop,sack 1 {328441:331297},mptcp dss ack 3868032135], length 0
10:18:01.098387 IP 112.26.2.8.39903 > 112.26.2.1.43445: Flags [.], ack 327013, win 24030, options [nop,nop,TS val 4294909293 ecr 154021,nop,nop,sack 1 {328441:332725},mptcp dss ack 3868032135], length 0
10:18:01.188196 IP 112.26.2.8.39903 > 112.26.2.1.43445: Flags [.], ack 327013, win 24009, options [nop,nop,TS val 4294909407 ecr 154021,nop,nop,sack 1 {328441:334153},mptcp dss ack 3868047843], length 0
10:18:01.234106 IP 112.26.2.1.43445 > 112.26.2.8.39903: Flags [.], seq 334153:335581, ack 1, win 4017, options [nop,nop,TS val 155172 ecr 4294908728,mptcp dss ack 1720219151 seq 3868152087 subseq 334153 len 1428 csum 0x116d], length 1428
10:18:01.237258 IP 112.26.2.1.43445 > 112.26.2.8.39903: Flags [.], seq 334153:335581, ack 1, win 4017, options [nop,nop,TS val 155172 ecr 4294908728,mptcp dss ack 1720219151 seq 3868152087 subseq 334153 len 1428 csum 0x116d], length 1428
10:18:01.249267 IP 112.26.2.8.39903 > 112.26.2.1.43445: Flags [.], ack 327013, win 24107, options [nop,nop,TS val 4294909893 ecr 154021,nop,nop,sack 1 {328441:335581},mptcp dss ack 3868073547], length 0
10:18:01.252652 IP 112.26.2.8.39903 > 112.26.2.1.43445: Flags [.], ack 327013, win 24107, options [nop,nop,TS val 4294909893 ecr 154021,nop,nop,sack 1 {328441:335581},mptcp dss ack 3868073547], length 0
10:18:01.346204 IP 112.26.2.1.43445 > 112.26.2.8.39903: Flags [.], seq 335581:337009, ack 1, win 4017, options [nop,nop,TS val 155172 ecr 4294908728,mptcp dss ack 1720219151 seq 3868153515 subseq 335581 len 1428 csum 0x62], length 1428
10:18:01.349501 IP 112.26.2.1.43445 > 112.26.2.8.39903: Flags [.], seq 335581:337009, ack 1, win 4017, options [nop,nop,TS val 155172 ecr 4294908728,mptcp dss ack 1720219151 seq 3868153515 subseq 335581 len 1428 csum 0x62], length 1428
10:18:01.351187 IP 112.26.2.8.39903 > 112.26.2.1.43445: Flags [.], ack 327013, win 24107, options [nop,nop,TS val 4294910006 ecr 154021,nop,nop,sack 1 {328441:337009},mptcp dss ack 3868073547], length 0
10:18:01.353533 IP 112.26.2.8.39903 > 112.26.2.1.43445: Flags [.], ack 327013, win 24107, options [nop,nop,TS val 4294910006 ecr 154021,nop,nop,sack 1 {328441:337009},mptcp dss ack 3868073547], length 0
10:18:01.434738 IP 112.26.2.1.43445 > 112.26.2.8.39903: Flags [.], seq 337009:338437, ack 1, win 4017, options [nop,nop,TS val 155278 ecr 4294908828,mptcp dss ack 1720219151 seq 3868166367 subseq 337009 len 1428 csum 0xa5e2], length 1428
10:18:01.454672 IP 112.26.2.1.43445 > 112.26.2.8.39903: Flags [.], seq 337009:338437, ack 1, win 4017, options [nop,nop,TS val 155278 ecr 4294908828,mptcp dss ack 1720219151 seq 3868166367 subseq 337009 len 1428 csum 0xa5e2], length 1428
10:18:01.457054 IP 112.26.2.8.39903 > 112.26.2.1.43445: Flags [.], ack 327013, win 24110, options [nop,nop,TS val 4294910111 ecr 154021,nop,nop,sack 1 {328441:338437},mptcp dss ack 3868087827], length 0
10:18:01.467044 IP 112.26.2.8.39903 > 112.26.2.1.43445: Flags [.], ack 327013, win 24110, options [nop,nop,TS val 4294910111 ecr 154021,nop,nop,sack 1 {328441:338437},mptcp dss ack 3868087827], length 0
10:18:01.513308 IP 112.26.2.1.43445 > 112.26.2.8.39903: Flags [.], seq 327013:328441, ack 1, win 4017, options [nop,nop,TS val 155309 ecr 4294908989,mptcp dss ack 1720219151 seq 3868087827 subseq 327013 len 1428 csum 0x9456], length 1428
10:18:01.564669 IP 112.26.2.1.43445 > 112.26.2.8.39903: Flags [.], seq 327013:328441, ack 1, win 4017, options [nop,nop,TS val 155309 ecr 4294908989,mptcp dss ack 1720219151 seq 3868087827 subseq 327013 len 1428 csum 0x9456], length 1428
10:18:01.567127 IP 112.26.2.8.39903 > 112.26.2.1.43445: Flags [.], ack 338437, win 23972, options [nop,nop,TS val 4294910221 ecr 155309,mptcp dss ack 3868133523], length 0
10:18:01.571506 IP 112.26.2.8.39903 > 112.26.2.1.43445: Flags [.], ack 338437, win 23972, options [nop,nop,TS val 4294910221 ecr 155309,mptcp dss ack 3868133523], length 0
10:18:01.622649 IP 112.26.2.1.43445 > 112.26.2.8.39903: Flags [.], seq 338437:339865, ack 1, win 4017, options [nop,nop,TS val 155309 ecr 4294908989,mptcp dss ack 1720219151 seq 3868169223 subseq 338437 len 1428 csum 0x94e8], length 1428
10:18:01.662978 IP 112.26.2.1.43445 > 112.26.2.8.39903: Flags [.], seq 338437:339865, ack 1, win 4017, options [nop,nop,TS val 155309 ecr 4294908989,mptcp dss ack 1720219151 seq 3868169223 subseq 338437 len 1428 csum 0x94e8], length 1428
10:18:01.664405 IP 112.26.2.8.39903 > 112.26.2.1.43445: Flags [.], ack 339865, win 24455, options [nop,nop,TS val 4294910320 ecr 155309,mptcp dss ack 3868134951], length 0
10:18:01.670951 IP 112.26.2.8.39903 > 112.26.2.1.43445: Flags [.], ack 339865, win 24455, options [nop,nop,TS val 4294910320 ecr 155309,mptcp dss ack 3868134951], length 0
10:18:01.692334 IP 112.26.2.1.43445 > 112.26.2.8.39903: Flags [.], seq 339865:341293, ack 1, win 4017, options [nop,nop,TS val 155414 ecr 4294909090,mptcp dss ack 1720219151 seq 3868172079 subseq 339865 len 1428 csum 0x131c], length 1428
10:18:01.731918 IP 112.26.2.1.43445 > 112.26.2.8.39903: Flags [.], seq 339865:341293, ack 1, win 4017, options [nop,nop,TS val 155414 ecr 4294909090,mptcp dss ack 1720219151 seq 3868172079 subseq 339865 len 1428 csum 0x131c], length 1428
10:18:01.771271 IP 112.26.2.1.43445 > 112.26.2.8.39903: Flags [.], seq 341293:342721, ack 1, win 4017, options [nop,nop,TS val 155438 ecr 4294909204,mptcp dss ack 1720219151 seq 3868173507 subseq 341293 len 1428 csum 0x9ef8], length 1428
10:18:01.783230 IP 112.26.2.8.39903 > 112.26.2.1.43445: Flags [.], ack 341293, win 24455, options [nop,nop,TS val 4294910388 ecr 155414,mptcp dss ack 3868134951], length 0
10:18:01.785052 IP 112.26.2.8.39903 > 112.26.2.1.43445: Flags [.], ack 341293, win 24455, options [nop,nop,TS val 4294910388 ecr 155414,mptcp dss ack 3868134951], length 0
10:18:01.834331 IP 112.26.2.1.43445 > 112.26.2.8.39903: Flags [.], seq 341293:342721, ack 1, win 4017, options [nop,nop,TS val 155438 ecr 4294909204,mptcp dss ack 1720219151 seq 3868173507 subseq 341293 len 1428 csum 0x9ef8], length 1428
10:18:01.861159 IP 112.26.2.1.43445 > 112.26.2.8.39903: Flags [.], seq 342721:344149, ack 1, win 4017, options [nop,nop,TS val 155484 ecr 4294909293,mptcp dss ack 1720219151 seq 3868182075 subseq 342721 len 1428 csum 0x2b14], length 1428
10:18:01.888850 IP 112.26.2.8.39903 > 112.26.2.1.43445: Flags [.], ack 342721, win 24455, options [nop,nop,TS val 4294910491 ecr 155438,mptcp dss ack 3868134951], length 0
10:18:01.890566 IP 112.26.2.8.39903 > 112.26.2.1.43445: Flags [.], ack 342721, win 24455, options [nop,nop,TS val 4294910491 ecr 155438,mptcp dss ack 3868134951], length 0
10:18:01.907714 IP 112.26.2.8.39903 > 112.26.2.1.43445: Flags [.], ack 327013, win 24107, options [nop,nop,TS val 4294909893 ecr 154021,nop,nop,sack 1 {328441:335581},mptcp dss ack 3868073547], length 0
10:18:01.937525 IP 112.26.2.1.43445 > 112.26.2.8.39903: Flags [.], seq 342721:344149, ack 1, win 4017, options [nop,nop,TS val 155484 ecr 4294909293,mptcp dss ack 1720219151 seq 3868182075 subseq 342721 len 1428 csum 0x2b14], length 1428
10:18:01.961260 IP 112.26.2.8.39903 > 112.26.2.1.43445: Flags [.], ack 344149, win 24455, options [nop,nop,TS val 4294910594 ecr 155484,mptcp dss ack 3868134951], length 0
10:18:01.967453 IP 112.26.2.8.39903 > 112.26.2.1.43445: Flags [.], ack 344149, win 24455, options [nop,nop,TS val 4294910594 ecr 155484,mptcp dss ack 3868134951], length 0
10:18:02.010760 IP 112.26.2.1.43445 > 112.26.2.8.39903: Flags [.], seq 344149:345577, ack 1, win 4017, options [nop,nop,TS val 155571 ecr 4294909407,mptcp dss ack 1720219151 seq 3868186359 subseq 344149 len 1428 csum 0xeb82], length 1428
10:18:02.020850 IP 112.26.2.1.43445 > 112.26.2.8.39903: Flags [.], seq 344149:345577, ack 1, win 4017, options [nop,nop,TS val 155571 ecr 4294909407,mptcp dss ack 1720219151 seq 3868186359 subseq 344149 len 1428 csum 0xeb82], length 1428
10:18:02.022706 IP 112.26.2.8.39903 > 112.26.2.1.43445: Flags [.], ack 345577, win 24455, options [nop,nop,TS val 4294910678 ecr 155571,mptcp dss ack 3868134951], length 0
10:18:02.058753 IP 112.26.2.8.39903 > 112.26.2.1.43445: Flags [.], ack 345577, win 24455, options [nop,nop,TS val 4294910678 ecr 155571,mptcp dss ack 3868134951], length 0
10:18:02.145704 IP 112.26.2.8.39903 > 112.26.2.1.43445: Flags [.], ack 327013, win 24107, options [nop,nop,TS val 4294910006 ecr 154021,nop,nop,sack 1 {328441:337009},mptcp dss ack 3868073547], length 0
10:18:02.197727 IP 112.26.2.8.39903 > 112.26.2.1.43445: Flags [.], ack 327013, win 24110, options [nop,nop,TS val 4294910111 ecr 154021,nop,nop,sack 1 {328441:338437},mptcp dss ack 3868087827], length 0
10:18:02.271486 IP 112.26.2.8.39903 > 112.26.2.1.43445: Flags [.], ack 338437, win 23972, options [nop,nop,TS val 4294910221 ecr 155309,mptcp dss ack 3868133523], length 0
10:18:02.375549 IP 112.26.2.8.39903 > 112.26.2.1.43445: Flags [.], ack 339865, win 24455, options [nop,nop,TS val 4294910320 ecr 155309,mptcp dss ack 3868134951], length 0
10:18:02.450585 IP 112.26.2.8.39903 > 112.26.2.1.43445: Flags [.], ack 341293, win 24455, options [nop,nop,TS val 4294910388 ecr 155414,mptcp dss ack 3868134951], length 0
10:18:02.493323 IP 112.26.2.8.39903 > 112.26.2.1.43445: Flags [.], ack 342721, win 24455, options [nop,nop,TS val 4294910491 ecr 155438,mptcp dss ack 3868134951], length 0
10:18:02.580688 IP 112.26.2.1.43445 > 112.26.2.8.39903: Flags [.], seq 345577:347005, ack 1, win 4017, options [nop,nop,TS val 156322 ecr 4294909893,mptcp dss ack 1720219151 seq 3868209207 subseq 345577 len 1428 csum 0xe9f3], length 1428
10:18:02.584713 IP 112.26.2.1.43445 > 112.26.2.8.39903: Flags [.], seq 345577:347005, ack 1, win 4017, options [nop,nop,TS val 156322 ecr 4294909893,mptcp dss ack 1720219151 seq 3868209207 subseq 345577 len 1428 csum 0xe9f3], length 1428
10:18:02.593643 IP 112.26.2.8.39903 > 112.26.2.1.43445: Flags [.], ack 347005, win 24231, options [nop,nop,TS val 4294911241 ecr 156322,mptcp dss ack 3868160655], length 0
10:18:02.613798 IP 112.26.2.8.39903 > 112.26.2.1.43445: Flags [.], ack 347005, win 24231, options [nop,nop,TS val 4294911241 ecr 156322,mptcp dss ack 3868160655], length 0
10:18:02.675128 IP 112.26.2.8.39903 > 112.26.2.1.43445: Flags [.], ack 344149, win 24455, options [nop,nop,TS val 4294910594 ecr 155484,mptcp dss ack 3868134951], length 0
10:18:02.764115 IP 112.26.2.8.39903 > 112.26.2.1.43445: Flags [.], ack 345577, win 24455, options [nop,nop,TS val 4294910678 ecr 155571,mptcp dss ack 3868134951], length 0
10:18:02.822441 IP 112.26.2.1.43445 > 112.26.2.8.39903: Flags [.], seq 347005:348433, ack 1, win 4017, options [nop,nop,TS val 156553 ecr 4294910006,mptcp dss ack 1720219151 seq 3868222059 subseq 347005 len 1428 csum 0x6d70], length 1428
10:18:02.825617 IP 112.26.2.1.43445 > 112.26.2.8.39903: Flags [.], seq 347005:348433, ack 1, win 4017, options [nop,nop,TS val 156553 ecr 4294910006,mptcp dss ack 1720219151 seq 3868222059 subseq 347005 len 1428 csum 0x6d70], length 1428
10:18:02.827075 IP 112.26.2.8.39903 > 112.26.2.1.43445: Flags [.], ack 348433, win 24231, options [nop,nop,TS val 4294911482 ecr 156553,mptcp dss ack 3868160655], length 0
10:18:02.828632 IP 112.26.2.8.39903 > 112.26.2.1.43445: Flags [.], ack 348433, win 24231, options [nop,nop,TS val 4294911482 ecr 156553,mptcp dss ack 3868160655], length 0
10:18:02.937984 IP 112.26.2.1.43445 > 112.26.2.8.39903: Flags [.], seq 348433:349861, ack 1, win 4017, options [nop,nop,TS val 156648 ecr 4294910111,mptcp dss ack 1720219151 seq 3868224915 subseq 348433 len 1428 csum 0x336b], length 1428
10:18:02.941578 IP 112.26.2.1.43445 > 112.26.2.8.39903: Flags [.], seq 348433:349861, ack 1, win 4017, options [nop,nop,TS val 156648 ecr 4294910111,mptcp dss ack 1720219151 seq 3868224915 subseq 348433 len 1428 csum 0x336b], length 1428
10:18:02.949014 IP 112.26.2.8.39903 > 112.26.2.1.43445: Flags [.], ack 349861, win 24231, options [nop,nop,TS val 4294911598 ecr 156648,mptcp dss ack 3868160655], length 0
10:18:02.950815 IP 112.26.2.8.39903 > 112.26.2.1.43445: Flags [.], ack 349861, win 24231, options [nop,nop,TS val 4294911598 ecr 156648,mptcp dss ack 3868160655], length 0
10:18:03.016924 IP 112.26.2.1.43445 > 112.26.2.8.39903: Flags [.], seq 349861:351289, ack 1, win 4017, options [nop,nop,TS val 156648 ecr 4294910221,mptcp dss ack 1720219151 seq 3868226343 subseq 349861 len 1428 csum 0xd803], length 1428
10:18:03.044207 IP 112.26.2.1.43445 > 112.26.2.8.39903: Flags [.], seq 349861:351289, ack 1, win 4017, options [nop,nop,TS val 156648 ecr 4294910221,mptcp dss ack 1720219151 seq 3868226343 subseq 349861 len 1428 csum 0xd803], length 1428
10:18:03.049767 IP 112.26.2.8.39903 > 112.26.2.1.43445: Flags [.], ack 351289, win 24231, options [nop,nop,TS val 4294911701 ecr 156648,mptcp dss ack 3868160655], length 0
10:18:03.050884 IP 112.26.2.8.39903 > 112.26.2.1.43445: Flags [.], ack 351289, win 24231, options [nop,nop,TS val 4294911701 ecr 156648,mptcp dss ack 3868160655], length 0
10:18:03.110043 IP 112.26.2.1.43445 > 112.26.2.8.39903: Flags [.], seq 351289:352717, ack 1, win 4017, options [nop,nop,TS val 156752 ecr 4294910320,mptcp dss ack 1720219151 seq 3868239195 subseq 351289 len 1428 csum 0xf333], length 1428
10:18:03.114228 IP 112.26.2.1.43445 > 112.26.2.8.39903: Flags [.], seq 351289:352717, ack 1, win 4017, options [nop,nop,TS val 156752 ecr 4294910320,mptcp dss ack 1720219151 seq 3868239195 subseq 351289 len 1428 csum 0xf333], length 1428
10:18:03.146332 IP 112.26.2.8.39903 > 112.26.2.1.43445: Flags [.], ack 352717, win 24231, options [nop,nop,TS val 4294911771 ecr 156752,mptcp dss ack 3868160655], length 0
10:18:03.148811 IP 112.26.2.8.39903 > 112.26.2.1.43445: Flags [.], ack 352717, win 24231, options [nop,nop,TS val 4294911771 ecr 156752,mptcp dss ack 3868160655], length 0
10:18:03.218068 IP 112.26.2.1.43445 > 112.26.2.8.39903: Flags [.], seq 352717:354145, ack 1, win 4017, options [nop,nop,TS val 156752 ecr 4294910320,mptcp dss ack 1720219151 seq 3868240623 subseq 352717 len 1428 csum 0x41ff], length 1428
10:18:03.223740 IP 112.26.2.1.43445 > 112.26.2.8.39903: Flags [.], seq 352717:354145, ack 1, win 4017, options [nop,nop,TS val 156752 ecr 4294910320,mptcp dss ack 1720219151 seq 3868240623 subseq 352717 len 1428 csum 0x41ff], length 1428
10:18:03.245362 IP 112.26.2.8.39903 > 112.26.2.1.43445: Flags [.], ack 354145, win 24231, options [nop,nop,TS val 4294911880 ecr 156752,mptcp dss ack 3868160655], length 0
10:18:03.247166 IP 112.26.2.8.39903 > 112.26.2.1.43445: Flags [.], ack 354145, win 24231, options [nop,nop,TS val 4294911880 ecr 156752,mptcp dss ack 3868160655], length 0
10:18:03.278013 IP 112.26.2.8.39903 > 112.26.2.1.43445: Flags [.], ack 347005, win 24231, options [nop,nop,TS val 4294911241 ecr 156322,mptcp dss ack 3868160655], length 0
10:18:03.373984 IP 112.26.2.1.43445 > 112.26.2.8.39903: Flags [.], seq 354145:355573, ack 1, win 4017, options [nop,nop,TS val 156827 ecr 4294910388,mptcp dss ack 1720219151 seq 3868243479 subseq 354145 len 1428 csum 0x9fa6], length 1428
10:18:03.377283 IP 112.26.2.1.43445 > 112.26.2.8.39903: Flags [.], seq 354145:355573, ack 1, win 4017, options [nop,nop,TS val 156827 ecr 4294910388,mptcp dss ack 1720219151 seq 3868243479 subseq 354145 len 1428 csum 0x9fa6], length 1428
10:18:03.381192 IP 112.26.2.8.39903 > 112.26.2.1.43445: Flags [.], ack 355573, win 24231, options [nop,nop,TS val 4294912034 ecr 156827,mptcp dss ack 3868160655], length 0
10:18:03.389821 IP 112.26.2.8.39903 > 112.26.2.1.43445: Flags [.], ack 355573, win 24231, options [nop,nop,TS val 4294912034 ecr 156827,mptcp dss ack 3868160655], length 0
10:18:03.460497 IP 112.26.2.1.43445 > 112.26.2.8.39903: Flags [.], seq 357001:358429, ack 1, win 4017, options [nop,nop,TS val 157051 ecr 4294910594,mptcp dss ack 1720219151 seq 3868257759 subseq 357001 len 1428 csum 0xe044], length 1428
10:18:03.465036 IP 112.26.2.1.43445 > 112.26.2.8.39903: Flags [.], seq 357001:358429, ack 1, win 4017, options [nop,nop,TS val 157051 ecr 4294910594,mptcp dss ack 1720219151 seq 3868257759 subseq 357001 len 1428 csum 0xe044], length 1428
10:18:03.467953 IP 112.26.2.8.39903 > 112.26.2.1.43445: Flags [.], ack 355573, win 24231, options [nop,nop,TS val 4294912122 ecr 156827,nop,nop,sack 1 {357001:358429},mptcp dss ack 3868160655], length 0
10:18:03.472089 IP 112.26.2.8.39903 > 112.26.2.1.43445: Flags [.], ack 355573, win 24231, options [nop,nop,TS val 4294912122 ecr 156827,nop,nop,sack 1 {357001:358429},mptcp dss ack 3868160655], length 0
10:18:03.562970 IP 112.26.2.1.43445 > 112.26.2.8.39903: Flags [.], seq 358429:359857, ack 1, win 4017, options [nop,nop,TS val 157051 ecr 4294910594,mptcp dss ack 1720219151 seq 3868259187 subseq 358429 len 1428 csum 0xf087], length 1428
10:18:03.565109 IP 112.26.2.1.43445 > 112.26.2.8.39903: Flags [.], seq 358429:359857, ack 1, win 4017, options [nop,nop,TS val 157051 ecr 4294910594,mptcp dss ack 1720219151 seq 3868259187 subseq 358429 len 1428 csum 0xf087], length 1428
10:18:03.573022 IP 112.26.2.8.39903 > 112.26.2.1.43445: Flags [.], ack 355573, win 24231, options [nop,nop,TS val 4294912222 ecr 156827,nop,nop,sack 1 {357001:359857},mptcp dss ack 3868160655], length 0
10:18:03.584767 IP 112.26.2.8.39903 > 112.26.2.1.43445: Flags [.], ack 355573, win 24231, options [nop,nop,TS val 4294912222 ecr 156827,nop,nop,sack 1 {357001:359857},mptcp dss ack 3868160655], length 0
10:18:03.634278 IP 112.26.2.8.39903 > 112.26.2.1.43445: Flags [.], ack 348433, win 24231, options [nop,nop,TS val 4294911482 ecr 156553,mptcp dss ack 3868160655], length 0
10:18:03.695236 IP 112.26.2.8.39903 > 112.26.2.1.43445: Flags [.], ack 349861, win 24231, options [nop,nop,TS val 4294911598 ecr 156648,mptcp dss ack 3868160655], length 0
10:18:03.734202 IP 112.26.2.8.39903 > 112.26.2.1.43445: Flags [.], ack 351289, win 24231, options [nop,nop,TS val 4294911701 ecr 156648,mptcp dss ack 3868160655], length 0
10:18:03.777484 IP 112.26.2.8.39903 > 112.26.2.1.43445: Flags [.], ack 352717, win 24231, options [nop,nop,TS val 4294911771 ecr 156752,mptcp dss ack 3868160655], length 0
10:18:03.831880 IP 112.26.2.8.39903 > 112.26.2.1.43445: Flags [.], ack 354145, win 24231, options [nop,nop,TS val 4294911880 ecr 156752,mptcp dss ack 3868160655], length 0
10:18:03.909014 IP 112.26.2.1.43445 > 112.26.2.8.39903: Flags [.], seq 361285:362713, ack 1, win 4017, options [nop,nop,TS val 157654 ecr 4294911241,mptcp dss ack 1720219151 seq 3868286319 subseq 361285 len 1428 csum 0xa3d2], length 1428
10:18:03.924655 IP 112.26.2.1.43445 > 112.26.2.8.39903: Flags [.], seq 361285:362713, ack 1, win 4017, options [nop,nop,TS val 157654 ecr 4294911241,mptcp dss ack 1720219151 seq 3868286319 subseq 361285 len 1428 csum 0xa3d2], length 1428
10:18:03.927373 IP 112.26.2.8.39903 > 112.26.2.1.43445: Flags [.], ack 355573, win 24231, options [nop,nop,TS val 4294912581 ecr 156827,nop,nop,sack 2 {361285:362713}{357001:359857},mptcp dss ack 3868160655], length 0
10:18:03.928684 IP 112.26.2.8.39903 > 112.26.2.1.43445: Flags [.], ack 355573, win 24231, options [nop,nop,TS val 4294912581 ecr 156827,nop,nop,sack 2 {361285:362713}{357001:359857},mptcp dss ack 3868160655], length 0
10:18:04.014511 IP 112.26.2.8.39903 > 112.26.2.1.43445: Flags [.], ack 355573, win 24231, options [nop,nop,TS val 4294912034 ecr 156827,mptcp dss ack 3868160655], length 0
10:18:04.069249 IP 112.26.2.8.39903 > 112.26.2.1.43445: Flags [.], ack 355573, win 24231, options [nop,nop,TS val 4294912122 ecr 156827,nop,nop,sack 1 {357001:358429},mptcp dss ack 3868160655], length 0
10:18:04.170527 IP 112.26.2.8.39903 > 112.26.2.1.43445: Flags [.], ack 355573, win 24231, options [nop,nop,TS val 4294912222 ecr 156827,nop,nop,sack 1 {357001:359857},mptcp dss ack 3868160655], length 0
10:18:04.206309 IP 112.26.2.1.43445 > 112.26.2.8.39903: Flags [.], seq 362713:364141, ack 1, win 4017, options [nop,nop,TS val 158010 ecr 4294911482,mptcp dss ack 1720219151 seq 3868292031 subseq 362713 len 1428 csum 0xe8a8], length 1428
