10:17:23.900236 IP 112.26.3.8.34701 > 112.26.3.1.43445: Flags [S], seq 1370810105, win 65535, options [mss 1460,sackOK,TS val 4294872456 ecr 0,nop,wscale 6,mptcp join id 5 token 0x1271d1f5 nonce 0x25c1fb65], length 0
10:17:23.972797 IP 112.26.3.8.34701 > 112.26.3.1.43445: Flags [S], seq 1370810105, win 65535, options [mss 1460,sackOK,TS val 4294872456 ecr 0,nop,wscale 6,mptcp join id 5 token 0x1271d1f5 nonce 0x25c1fb65], length 0
10:17:24.039830 IP 112.26.3.8.34701 > 112.26.3.1.43445: Flags [S], seq 1370810105, win 65535, options [mss 1460,sackOK,TS val 4294872456 ecr 0,nop,wscale 6,mptcp join id 5 token 0x1271d1f5 nonce 0x25c1fb65], length 0
10:17:24.239689 IP 112.26.3.8.34701 > 112.26.3.1.43445: Flags [.], ack 3026531370, win 7848, options [nop,nop,TS val 4294872867 ecr 118416,mptcp join hmac 0x791756dfc3e442c8c54dbd511ad3c1190c151802], length 0
10:17:24.239984 IP 112.26.3.8.34701 > 112.26.3.1.43445: Flags [.], ack 1, win 7848, options [nop,nop,TS val 4294872867 ecr 118416,mptcp join hmac 0x791756dfc3e442c8c54dbd511ad3c1190c151802], length 0
10:17:24.311254 IP 112.26.3.8.34701 > 112.26.3.1.43445: Flags [.], ack 1, win 7848, options [nop,nop,TS val 4294872867 ecr 118416,mptcp join hmac 0x791756dfc3e442c8c54dbd511ad3c1190c151802], length 0
10:17:24.480793 IP 112.26.3.8.34701 > 112.26.3.1.43445: Flags [.], ack 1429, win 8076, options [nop,nop,TS val 4294873136 ecr 118686,mptcp dss ack 3866525595], length 0
10:18:04.106823 IP 112.26.3.8.34701 > 112.26.3.1.43445: Flags [.], ack 539785, win 24231, options [nop,nop,TS val 4294912302 ecr 157399,mptcp dss ack 3868160655], length 0
10:18:04.130648 IP 112.26.3.8.34701 > 112.26.3.1.43445: Flags [.], ack 546925, win 24231, options [nop,nop,TS val 4294912784 ecr 157823,mptcp dss ack 3868160655], length 0
10:18:04.130963 IP 112.26.3.8.34701 > 112.26.3.1.43445: Flags [.], ack 546925, win 24231, options [nop,nop,TS val 4294912784 ecr 157823,mptcp dss ack 3868160655], length 0
10:18:04.244031 IP 112.26.3.8.34701 > 112.26.3.1.43445: Flags [.], ack 541213, win 24231, options [nop,nop,TS val 4294912462 ecr 157517,mptcp dss ack 3868160655], length 0
10:18:04.301306 IP 112.26.3.8.34701 > 112.26.3.1.43445: Flags [.], ack 544069, win 24231, options [nop,nop,TS val 4294912576 ecr 157597,mptcp dss ack 3868160655], length 0
10:18:04.369167 IP 112.26.3.8.34701 > 112.26.3.1.43445: Flags [.], ack 551209, win 24231, options [nop,nop,TS val 4294913016 ecr 158060,mptcp dss ack 3868160655], length 0
10:18:04.369376 IP 112.26.3.8.34701 > 112.26.3.1.43445: Flags [.], ack 551209, win 24231, options [nop,nop,TS val 4294913016 ecr 158060,mptcp dss ack 3868160655], length 0
10:18:04.388082 IP 112.26.3.8.34701 > 112.26.3.1.43445: Flags [.], ack 546925, win 24231, options [nop,nop,TS val 4294912784 ecr 157823,mptcp dss ack 3868160655], length 0
10:18:04.498127 IP 112.26.3.8.34701 > 112.26.3.1.43445: Flags [.], ack 551209, win 24231, options [nop,nop,TS val 4294913016 ecr 158060,mptcp dss ack 3868160655], length 0
10:18:04.650476 IP 112.26.3.8.34701 > 112.26.3.1.43445: Flags [.], ack 556921, win 24231, options [nop,nop,TS val 4294913305 ecr 158397,mptcp dss ack 3868160655], length 0
10:18:04.650779 IP 112.26.3.8.34701 > 112.26.3.1.43445: Flags [.], ack 556921, win 24231, options [nop,nop,TS val 4294913305 ecr 158397,mptcp dss ack 3868160655], length 0
10:18:04.665034 IP 112.26.3.8.34701 > 112.26.3.1.43445: Flags [.], ack 556921, win 24231, options [nop,nop,TS val 4294913305 ecr 158397,mptcp dss ack 3868160655], length 0
10:18:04.853661 IP 112.26.3.8.34701 > 112.26.3.1.43445: Flags [.], ack 559777, win 24209, options [nop,nop,TS val 4294913508 ecr 158677,mptcp dss ack 3868162083], length 0
10:18:04.853981 IP 112.26.3.8.34701 > 112.26.3.1.43445: Flags [.], ack 559777, win 24209, options [nop,nop,TS val 4294913508 ecr 158677,mptcp dss ack 3868162083], length 0
10:18:04.858485 IP 112.26.3.8.34701 > 112.26.3.1.43445: Flags [.], ack 559777, win 24209, options [nop,nop,TS val 4294913508 ecr 158677,mptcp dss ack 3868162083], length 0
10:18:05.072201 IP 112.26.3.8.34701 > 112.26.3.1.43445: Flags [.], ack 562633, win 24209, options [nop,nop,TS val 4294913728 ecr 158764,mptcp dss ack 3868162083], length 0
10:18:05.072525 IP 112.26.3.8.34701 > 112.26.3.1.43445: Flags [.], ack 562633, win 24209, options [nop,nop,TS val 4294913728 ecr 158764,mptcp dss ack 3868162083], length 0
10:18:05.080109 IP 112.26.3.8.34701 > 112.26.3.1.43445: Flags [.], ack 562633, win 24209, options [nop,nop,TS val 4294913728 ecr 158764,mptcp dss ack 3868162083], length 0
10:18:05.402066 IP 112.26.3.8.34701 > 112.26.3.1.43445: Flags [.], ack 568345, win 24209, options [nop,nop,TS val 4294914056 ecr 158874,mptcp dss ack 3868162083], length 0
10:18:05.402378 IP 112.26.3.8.34701 > 112.26.3.1.43445: Flags [.], ack 568345, win 24209, options [nop,nop,TS val 4294914056 ecr 158874,mptcp dss ack 3868162083], length 0
10:18:05.417534 IP 112.26.3.8.34701 > 112.26.3.1.43445: Flags [.], ack 568345, win 24209, options [nop,nop,TS val 4294914056 ecr 158874,mptcp dss ack 3868162083], length 0
10:18:05.698023 IP 112.26.3.8.34701 > 112.26.3.1.43445: Flags [.], ack 571201, win 24209, options [nop,nop,TS val 4294914352 ecr 159040,mptcp dss ack 3868162083], length 0
10:18:05.698335 IP 112.26.3.8.34701 > 112.26.3.1.43445: Flags [.], ack 571201, win 24209, options [nop,nop,TS val 4294914352 ecr 159040,mptcp dss ack 3868162083], length 0
10:18:05.726192 IP 112.26.3.8.34701 > 112.26.3.1.43445: Flags [.], ack 571201, win 24209, options [nop,nop,TS val 4294914352 ecr 159040,mptcp dss ack 3868162083], length 0
10:18:05.991103 IP 112.26.3.8.34701 > 112.26.3.1.43445: Flags [.], ack 576913, win 24209, options [nop,nop,TS val 4294914646 ecr 159040,mptcp dss ack 3868162083], length 0
10:18:05.991426 IP 112.26.3.8.34701 > 112.26.3.1.43445: Flags [.], ack 576913, win 24209, options [nop,nop,TS val 4294914646 ecr 159040,mptcp dss ack 3868162083], length 0
10:18:05.998621 IP 112.26.3.8.34701 > 112.26.3.1.43445: Flags [.], ack 576913, win 24209, options [nop,nop,TS val 4294914646 ecr 159040,mptcp dss ack 3868162083], length 0
10:18:06.111413 IP 112.26.3.8.34701 > 112.26.3.1.43445: Flags [.], ack 576913, win 24209, options [nop,nop,TS val 4294914766 ecr 159040,nop,nop,sack 1 {578341:579769},mptcp dss ack 3868162083], length 0
10:18:06.111665 IP 112.26.3.8.34701 > 112.26.3.1.43445: Flags [.], ack 576913, win 24209, options [nop,nop,TS val 4294914766 ecr 159040,nop,nop,sack 1 {578341:579769},mptcp dss ack 3868162083], length 0
10:18:06.149799 IP 112.26.3.8.34701 > 112.26.3.1.43445: Flags [.], ack 576913, win 24209, options [nop,nop,TS val 4294914766 ecr 159040,nop,nop,sack 1 {578341:579769},mptcp dss ack 3868162083], length 0
10:18:06.214610 IP 112.26.3.8.34701 > 112.26.3.1.43445: Flags [.], ack 576913, win 24209, options [nop,nop,TS val 4294914869 ecr 159040,nop,nop,sack 1 {578341:581197},mptcp dss ack 3868162083], length 0
10:18:06.214929 IP 112.26.3.8.34701 > 112.26.3.1.43445: Flags [.], ack 576913, win 24209, options [nop,nop,TS val 4294914869 ecr 159040,nop,nop,sack 1 {578341:581197},mptcp dss ack 3868162083], length 0
10:18:06.267890 IP 112.26.3.8.34701 > 112.26.3.1.43445: Flags [.], ack 576913, win 24209, options [nop,nop,TS val 4294914869 ecr 159040,nop,nop,sack 1 {578341:581197},mptcp dss ack 3868162083], length 0
10:18:06.329748 IP 112.26.3.8.34701 > 112.26.3.1.43445: Flags [.], ack 576913, win 24209, options [nop,nop,TS val 4294914984 ecr 159040,nop,nop,sack 1 {578341:582625},mptcp dss ack 3868162083], length 0
10:18:06.330013 IP 112.26.3.8.34701 > 112.26.3.1.43445: Flags [.], ack 576913, win 24209, options [nop,nop,TS val 4294914984 ecr 159040,nop,nop,sack 1 {578341:582625},mptcp dss ack 3868162083], length 0
10:18:06.426980 IP 112.26.3.8.34701 > 112.26.3.1.43445: Flags [.], ack 576913, win 24209, options [nop,nop,TS val 4294914984 ecr 159040,nop,nop,sack 1 {578341:582625},mptcp dss ack 3868162083], length 0
10:18:06.455913 IP 112.26.3.8.34701 > 112.26.3.1.43445: Flags [.], ack 576913, win 24209, options [nop,nop,TS val 4294915109 ecr 159040,nop,nop,sack 2 {584053:585481}{578341:582625},mptcp dss ack 3868162083], length 0
10:18:06.456241 IP 112.26.3.8.34701 > 112.26.3.1.43445: Flags [.], ack 576913, win 24209, options [nop,nop,TS val 4294915109 ecr 159040,nop,nop,sack 2 {584053:585481}{578341:582625},mptcp dss ack 3868162083], length 0
10:18:06.519873 IP 112.26.3.8.34701 > 112.26.3.1.43445: Flags [.], ack 576913, win 24209, options [nop,nop,TS val 4294915109 ecr 159040,nop,nop,sack 2 {584053:585481}{578341:582625},mptcp dss ack 3868162083], length 0
10:18:06.553994 IP 112.26.3.8.34701 > 112.26.3.1.43445: Flags [.], ack 576913, win 24209, options [nop,nop,TS val 4294915208 ecr 159040,nop,nop,sack 2 {584053:586909}{578341:582625},mptcp dss ack 3868162083], length 0
10:18:06.554299 IP 112.26.3.8.34701 > 112.26.3.1.43445: Flags [.], ack 576913, win 24209, options [nop,nop,TS val 4294915208 ecr 159040,nop,nop,sack 2 {584053:586909}{578341:582625},mptcp dss ack 3868162083], length 0
10:18:06.595968 IP 112.26.3.8.34701 > 112.26.3.1.43445: Flags [.], ack 576913, win 24209, options [nop,nop,TS val 4294915208 ecr 159040,nop,nop,sack 2 {584053:586909}{578341:582625},mptcp dss ack 3868162083], length 0
10:18:06.639277 IP 112.26.3.8.34701 > 112.26.3.1.43445: Flags [.], ack 576913, win 24209, options [nop,nop,TS val 4294915294 ecr 159040,nop,nop,sack 2 {584053:588337}{578341:582625},mptcp dss ack 3868162083], length 0
10:18:06.639617 IP 112.26.3.8.34701 > 112.26.3.1.43445: Flags [.], ack 576913, win 24209, options [nop,nop,TS val 4294915294 ecr 159040,nop,nop,sack 2 {584053:588337}{578341:582625},mptcp dss ack 3868162083], length 0
10:18:06.712566 IP 112.26.3.8.34701 > 112.26.3.1.43445: Flags [.], ack 576913, win 24209, options [nop,nop,TS val 4294915294 ecr 159040,nop,nop,sack 2 {584053:588337}{578341:582625},mptcp dss ack 3868162083], length 0
10:18:06.741902 IP 112.26.3.8.34701 > 112.26.3.1.43445: Flags [.], ack 576913, win 24209, options [nop,nop,TS val 4294915365 ecr 159040,nop,nop,sack 2 {584053:589765}{578341:582625},mptcp dss ack 3868162083], length 0
10:18:06.742232 IP 112.26.3.8.34701 > 112.26.3.1.43445: Flags [.], ack 576913, win 24209, options [nop,nop,TS val 4294915365 ecr 159040,nop,nop,sack 2 {584053:589765}{578341:582625},mptcp dss ack 3868162083], length 0
10:18:06.786174 IP 112.26.3.8.34701 > 112.26.3.1.43445: Flags [.], ack 576913, win 24209, options [nop,nop,TS val 4294915441 ecr 159040,nop,nop,sack 2 {584053:591193}{578341:582625},mptcp dss ack 3868162083], length 0
10:18:06.786497 IP 112.26.3.8.34701 > 112.26.3.1.43445: Flags [.], ack 576913, win 24209, options [nop,nop,TS val 4294915441 ecr 159040,nop,nop,sack 2 {584053:591193}{578341:582625},mptcp dss ack 3868162083], length 0
10:18:06.820366 IP 112.26.3.8.34701 > 112.26.3.1.43445: Flags [.], ack 576913, win 24209, options [nop,nop,TS val 4294915365 ecr 159040,nop,nop,sack 2 {584053:589765}{578341:582625},mptcp dss ack 3868162083], length 0
10:18:06.857009 IP 112.26.3.8.34701 > 112.26.3.1.43445: Flags [.], ack 576913, win 24209, options [nop,nop,TS val 4294915441 ecr 159040,nop,nop,sack 2 {584053:591193}{578341:582625},mptcp dss ack 3868162083], length 0
10:18:06.882894 IP 112.26.3.8.34701 > 112.26.3.1.43445: Flags [.], ack 576913, win 24209, options [nop,nop,TS val 4294915538 ecr 159040,nop,nop,sack 2 {584053:592621}{578341:582625},mptcp dss ack 3868162083], length 0
10:18:06.883220 IP 112.26.3.8.34701 > 112.26.3.1.43445: Flags [.], ack 576913, win 24209, options [nop,nop,TS val 4294915538 ecr 159040,nop,nop,sack 2 {584053:592621}{578341:582625},mptcp dss ack 3868162083], length 0
10:18:06.979157 IP 112.26.3.8.34701 > 112.26.3.1.43445: Flags [.], ack 576913, win 24209, options [nop,nop,TS val 4294915634 ecr 159040,nop,nop,sack 2 {584053:594049}{578341:582625},mptcp dss ack 3868162083], length 0
10:18:06.979418 IP 112.26.3.8.34701 > 112.26.3.1.43445: Flags [.], ack 576913, win 24209, options [nop,nop,TS val 4294915634 ecr 159040,nop,nop,sack 2 {584053:594049}{578341:582625},mptcp dss ack 3868162083], length 0
10:18:07.031206 IP 112.26.3.8.34701 > 112.26.3.1.43445: Flags [.], ack 576913, win 24209, options [nop,nop,TS val 4294915538 ecr 159040,nop,nop,sack 2 {584053:592621}{578341:582625},mptcp dss ack 3868162083], length 0
10:18:07.073011 IP 112.26.3.8.34701 > 112.26.3.1.43445: Flags [.], ack 576913, win 24209, options [nop,nop,TS val 4294915701 ecr 159040,nop,nop,sack 2 {584053:595477}{578341:582625},mptcp dss ack 3868162083], length 0
10:18:07.073319 IP 112.26.3.8.34701 > 112.26.3.1.43445: Flags [.], ack 576913, win 24209, options [nop,nop,TS val 4294915701 ecr 159040,nop,nop,sack 2 {584053:595477}{578341:582625},mptcp dss ack 3868162083], length 0
10:18:07.112018 IP 112.26.3.8.34701 > 112.26.3.1.43445: Flags [.], ack 576913, win 24209, options [nop,nop,TS val 4294915634 ecr 159040,nop,nop,sack 2 {584053:594049}{578341:582625},mptcp dss ack 3868162083], length 0
10:18:07.153242 IP 112.26.3.8.34701 > 112.26.3.1.43445: Flags [.], ack 576913, win 24209, options [nop,nop,TS val 4294915801 ecr 159040,nop,nop,sack 2 {584053:596905}{578341:582625},mptcp dss ack 3868162083], length 0
10:18:07.153534 IP 112.26.3.8.34701 > 112.26.3.1.43445: Flags [.], ack 576913, win 24209, options [nop,nop,TS val 4294915801 ecr 159040,nop,nop,sack 2 {584053:596905}{578341:582625},mptcp dss ack 3868162083], length 0
10:18:07.226896 IP 112.26.3.8.34701 > 112.26.3.1.43445: Flags [.], ack 576913, win 24209, options [nop,nop,TS val 4294915701 ecr 159040,nop,nop,sack 2 {584053:595477}{578341:582625},mptcp dss ack 3868162083], length 0
10:18:07.247024 IP 112.26.3.8.34701 > 112.26.3.1.43445: Flags [.], ack 582625, win 24209, options [nop,nop,TS val 4294915902 ecr 160802,nop,nop,sack 1 {584053:596905},mptcp dss ack 3868162083], length 0
10:18:07.247348 IP 112.26.3.8.34701 > 112.26.3.1.43445: Flags [.], ack 582625, win 24209, options [nop,nop,TS val 4294915902 ecr 160802,nop,nop,sack 1 {584053:596905},mptcp dss ack 3868162083], length 0
10:18:07.375582 IP 112.26.3.8.34701 > 112.26.3.1.43445: Flags [.], ack 596905, win 24209, options [nop,nop,TS val 4294916031 ecr 160895,mptcp dss ack 3868162083], length 0
10:18:07.375910 IP 112.26.3.8.34701 > 112.26.3.1.43445: Flags [.], ack 596905, win 24209, options [nop,nop,TS val 4294916031 ecr 160895,mptcp dss ack 3868162083], length 0
10:18:07.394366 IP 112.26.3.8.34701 > 112.26.3.1.43445: Flags [.], ack 576913, win 24209, options [nop,nop,TS val 4294915801 ecr 159040,nop,nop,sack 2 {584053:596905}{578341:582625},mptcp dss ack 3868162083], length 0
10:18:07.452025 IP 112.26.3.8.34701 > 112.26.3.1.43445: Flags [.], ack 598333, win 24209, options [nop,nop,TS val 4294916106 ecr 161232,mptcp dss ack 3868162083], length 0
10:18:07.452332 IP 112.26.3.8.34701 > 112.26.3.1.43445: Flags [.], ack 598333, win 24209, options [nop,nop,TS val 4294916106 ecr 161232,mptcp dss ack 3868162083], length 0
10:18:07.461442 IP 112.26.3.8.34701 > 112.26.3.1.43445: Flags [.], ack 582625, win 24209, options [nop,nop,TS val 4294915902 ecr 160802,nop,nop,sack 1 {584053:596905},mptcp dss ack 3868162083], length 0
10:18:07.588970 IP 112.26.3.8.34701 > 112.26.3.1.43445: Flags [.], ack 599761, win 24209, options [nop,nop,TS val 4294916244 ecr 161274,mptcp dss ack 3868162083], length 0
10:18:07.589207 IP 112.26.3.8.34701 > 112.26.3.1.43445: Flags [.], ack 599761, win 24209, options [nop,nop,TS val 4294916244 ecr 161274,mptcp dss ack 3868162083], length 0
10:18:07.629620 IP 112.26.3.8.34701 > 112.26.3.1.43445: Flags [.], ack 596905, win 24209, options [nop,nop,TS val 4294916031 ecr 160895,mptcp dss ack 3868162083], length 0
10:18:07.688097 IP 112.26.3.8.34701 > 112.26.3.1.43445: Flags [.], ack 601189, win 24209, options [nop,nop,TS val 4294916343 ecr 161488,mptcp dss ack 3868162083], length 0
10:18:07.688409 IP 112.26.3.8.34701 > 112.26.3.1.43445: Flags [.], ack 601189, win 24209, options [nop,nop,TS val 4294916343 ecr 161488,mptcp dss ack 3868162083], length 0
10:18:07.721166 IP 112.26.3.8.34701 > 112.26.3.1.43445: Flags [.], ack 598333, win 24209, options [nop,nop,TS val 4294916106 ecr 161232,mptcp dss ack 3868162083], length 0
10:18:07.779781 IP 112.26.3.8.34701 > 112.26.3.1.43445: Flags [.], ack 602617, win 24209, options [nop,nop,TS val 4294916435 ecr 161550,mptcp dss ack 3868162083], length 0
10:18:07.780072 IP 112.26.3.8.34701 > 112.26.3.1.43445: Flags [.], ack 602617, win 24209, options [nop,nop,TS val 4294916435 ecr 161550,mptcp dss ack 3868162083], length 0
10:18:07.836328 IP 112.26.3.8.34701 > 112.26.3.1.43445: Flags [.], ack 599761, win 24209, options [nop,nop,TS val 4294916244 ecr 161274,mptcp dss ack 3868162083], length 0
10:18:07.888824 IP 112.26.3.8.34701 > 112.26.3.1.43445: Flags [.], ack 604045, win 24209, options [nop,nop,TS val 4294916518 ecr 161610,mptcp dss ack 3868162083], length 0
10:18:07.889146 IP 112.26.3.8.34701 > 112.26.3.1.43445: Flags [.], ack 604045, win 24209, options [nop,nop,TS val 4294916518 ecr 161610,mptcp dss ack 3868162083], length 0
10:18:07.925878 IP 112.26.3.8.34701 > 112.26.3.1.43445: Flags [.], ack 601189, win 24209, options [nop,nop,TS val 4294916343 ecr 161488,mptcp dss ack 3868162083], length 0
10:18:07.982178 IP 112.26.3.8.34701 > 112.26.3.1.43445: Flags [.], ack 605473, win 24209, options [nop,nop,TS val 4294916636 ecr 161837,mptcp dss ack 3868162083], length 0
10:18:07.982455 IP 112.26.3.8.34701 > 112.26.3.1.43445: Flags [.], ack 605473, win 24209, options [nop,nop,TS val 4294916636 ecr 161837,mptcp dss ack 3868162083], length 0
10:18:08.040731 IP 112.26.3.8.34701 > 112.26.3.1.43445: Flags [.], ack 602617, win 24209, options [nop,nop,TS val 4294916435 ecr 161550,mptcp dss ack 3868162083], length 0
10:18:08.075678 IP 112.26.3.8.34701 > 112.26.3.1.43445: Flags [.], ack 606901, win 24209, options [nop,nop,TS val 4294916707 ecr 161837,mptcp dss ack 3868162083], length 0
10:18:08.075922 IP 112.26.3.8.34701 > 112.26.3.1.43445: Flags [.], ack 606901, win 24209, options [nop,nop,TS val 4294916707 ecr 161837,mptcp dss ack 3868162083], length 0
10:18:08.159265 IP 112.26.3.8.34701 > 112.26.3.1.43445: Flags [.], ack 608329, win 24209, options [nop,nop,TS val 4294916781 ecr 162005,mptcp dss ack 3868162083], length 0
10:18:08.159558 IP 112.26.3.8.34701 > 112.26.3.1.43445: Flags [.], ack 608329, win 24209, options [nop,nop,TS val 4294916781 ecr 162005,mptcp dss ack 3868162083], length 0
10:18:08.217860 IP 112.26.3.8.34701 > 112.26.3.1.43445: Flags [.], ack 604045, win 24209, options [nop,nop,TS val 4294916518 ecr 161610,mptcp dss ack 3868162083], length 0
10:18:08.244809 IP 112.26.3.8.34701 > 112.26.3.1.43445: Flags [.], ack 609757, win 24209, options [nop,nop,TS val 4294916899 ecr 162097,mptcp dss ack 3868162083], length 0
10:18:08.245128 IP 112.26.3.8.34701 > 112.26.3.1.43445: Flags [.], ack 609757, win 24209, options [nop,nop,TS val 4294916899 ecr 162097,mptcp dss ack 3868162083], length 0
10:18:08.343909 IP 112.26.3.8.34701 > 112.26.3.1.43445: Flags [.], ack 605473, win 24209, options [nop,nop,TS val 4294916636 ecr 161837,mptcp dss ack 3868162083], length 0
10:18:08.471039 IP 112.26.3.8.34701 > 112.26.3.1.43445: Flags [.], ack 606901, win 24209, options [nop,nop,TS val 4294916707 ecr 161837,mptcp dss ack 3868162083], length 0
10:18:08.480635 IP 112.26.3.1.43445 > 112.26.3.8.34701: Flags [.], seq 609757:611185, ack 0, win 4017, options [nop,nop,TS val 162212 ecr 4294916244,mptcp dss ack 1720219151 seq 3868486239 subseq 609757 len 1428 csum 0xb1bd], length 1428
10:18:08.566959 IP 112.26.3.1.43445 > 112.26.3.8.34701: Flags [.], seq 611185:612613, ack 0, win 4017, options [nop,nop,TS val 162302 ecr 4294916343,mptcp dss ack 1720219151 seq 3868487667 subseq 611185 len 1428 csum 0x54ab], length 1428
10:18:08.585038 IP 112.26.3.8.34701 > 112.26.3.1.43445: Flags [.], ack 608329, win 24209, options [nop,nop,TS val 4294916781 ecr 162005,mptcp dss ack 3868162083], length 0
10:18:08.657990 IP 112.26.3.1.43445 > 112.26.3.8.34701: Flags [.], seq 609757:611185, ack 0, win 4017, options [nop,nop,TS val 162212 ecr 4294916244,mptcp dss ack 1720219151 seq 3868486239 subseq 609757 len 1428 csum 0xb1bd], length 1428
10:18:08.723037 IP 112.26.3.8.34701 > 112.26.3.1.43445: Flags [.], ack 609757, win 24209, options [nop,nop,TS val 4294916899 ecr 162097,mptcp dss ack 3868162083], length 0
10:18:08.755340 IP 112.26.3.1.43445 > 112.26.3.8.34701: Flags [.], seq 612613:614041, ack 0, win 4017, options [nop,nop,TS val 162302 ecr 4294916343,mptcp dss ack 1720219151 seq 3868489095 subseq 612613 len 1428 csum 0x5d99], length 1428
10:18:08.899621 IP 112.26.3.1.43445 > 112.26.3.8.34701: Flags [.], seq 621181:622609, ack 0, win 4017, options [nop,nop,TS val 162960 ecr 4294916781,mptcp dss ack 1720219151 seq 3868517655 subseq 621181 len 1428 csum 0x1345], length 1428
10:18:08.937669 IP 112.26.3.1.43445 > 112.26.3.8.34701: Flags [.], seq 611185:612613, ack 0, win 4017, options [nop,nop,TS val 162302 ecr 4294916343,mptcp dss ack 1720219151 seq 3868487667 subseq 611185 len 1428 csum 0x54ab], length 1428
10:18:09.070924 IP 112.26.3.1.43445 > 112.26.3.8.34701: Flags [.], seq 614041:615469, ack 0, win 4017, options [nop,nop,TS val 162416 ecr 4294916435,mptcp dss ack 1720219151 seq 3868493379 subseq 614041 len 1428 csum 0x61cb], length 1428
10:18:09.153800 IP 112.26.3.1.43445 > 112.26.3.8.34701: Flags [.], seq 622609:624037, ack 0, win 4017, options [nop,nop,TS val 163099 ecr 4294916899,mptcp dss ack 1720219151 seq 3868521939 subseq 622609 len 1428 csum 0x48c3], length 1428
10:18:09.203036 IP 112.26.3.1.43445 > 112.26.3.8.34701: Flags [.], seq 609757:611185, ack 0, win 4017, options [nop,nop,TS val 162212 ecr 4294916244,mptcp dss ack 1720219151 seq 3868486239 subseq 609757 len 1428 csum 0xb1bd], length 1428
10:18:09.409687 IP 112.26.3.1.43445 > 112.26.3.8.34701: Flags [.], seq 619753:621181, ack 0, win 4017, options [nop,nop,TS val 162846 ecr 4294916707,mptcp dss ack 1720219151 seq 3868513371 subseq 619753 len 1428 csum 0x271d], length 1428
10:18:09.455505 IP 112.26.3.1.43445 > 112.26.3.8.34701: Flags [.], seq 615469:616897, ack 0, win 4017, options [nop,nop,TS val 162593 ecr 4294916518,mptcp dss ack 1720219151 seq 3868500519 subseq 615469 len 1428 csum 0x9357], length 1428
10:18:19.716042 IP 112.26.3.1.43445 > 112.26.3.8.34701: Flags [.], seq 609757:611185, ack 0, win 4017, options [nop,nop,TS val 174080 ecr 4294916899,mptcp dss ack 1720219151 seq 3868486239 subseq 609757 len 1428 csum 0xb1bd], length 1428
10:18:19.789905 IP 112.26.3.8.34701 > 112.26.3.1.43445: Flags [.], ack 611185, win 24393, options [nop,nop,TS val 4294928373 ecr 174080,mptcp dss ack 3868446255], length 0
10:18:19.796403 IP 112.26.3.8.34701 > 112.26.3.1.43445: Flags [.], ack 611185, win 24393, options [nop,nop,TS val 4294928373 ecr 174080,mptcp dss ack 3868446255], length 0
10:18:19.816017 IP 112.26.3.8.34701 > 112.26.3.1.43445: Flags [.], ack 611185, win 24393, options [nop,nop,TS val 4294928373 ecr 174080,mptcp dss ack 3868446255], length 0
10:18:19.843600 IP 112.26.3.1.43445 > 112.26.3.8.34701: Flags [.], seq 611185:612613, ack 0, win 4017, options [nop,nop,TS val 174192 ecr 4294928373,mptcp dss ack 1720219151 seq 3868487667 subseq 611185 len 1428 csum 0x54ab], length 1428
10:18:19.845352 IP 112.26.3.8.34701 > 112.26.3.1.43445: Flags [.], ack 612613, win 24393, options [nop,nop,TS val 4294928500 ecr 174192,mptcp dss ack 3868446255], length 0
10:18:19.845698 IP 112.26.3.8.34701 > 112.26.3.1.43445: Flags [.], ack 612613, win 24393, options [nop,nop,TS val 4294928500 ecr 174192,mptcp dss ack 3868446255], length 0
10:18:19.902309 IP 112.26.3.8.34701 > 112.26.3.1.43445: Flags [.], ack 612613, win 24393, options [nop,nop,TS val 4294928500 ecr 174192,mptcp dss ack 3868446255], length 0
10:18:19.945442 IP 112.26.3.1.43445 > 112.26.3.8.34701: Flags [.], seq 612613:614041, ack 0, win 4017, options [nop,nop,TS val 174192 ecr 4294928373,mptcp dss ack 1720219151 seq 3868489095 subseq 612613 len 1428 csum 0x5d99], length 1428
10:18:19.947046 IP 112.26.3.8.34701 > 112.26.3.1.43445: Flags [.], ack 614041, win 24321, options [nop,nop,TS val 4294928602 ecr 174192,mptcp dss ack 3868464819], length 0
10:18:19.947325 IP 112.26.3.8.34701 > 112.26.3.1.43445: Flags [.], ack 614041, win 24321, options [nop,nop,TS val 4294928602 ecr 174192,mptcp dss ack 3868464819], length 0
10:18:19.961677 IP 112.26.3.8.34701 > 112.26.3.1.43445: Flags [.], ack 614041, win 24321, options [nop,nop,TS val 4294928602 ecr 174192,mptcp dss ack 3868464819], length 0
10:18:20.032780 IP 112.26.3.1.43445 > 112.26.3.8.34701: Flags [.], seq 614041:615469, ack 0, win 4017, options [nop,nop,TS val 174279 ecr 4294928500,mptcp dss ack 1720219151 seq 3868493379 subseq 614041 len 1428 csum 0x61cb], length 1428
10:18:20.034612 IP 112.26.3.8.34701 > 112.26.3.1.43445: Flags [.], ack 615469, win 24321, options [nop,nop,TS val 4294928689 ecr 174279,mptcp dss ack 3868464819], length 0
10:18:20.034870 IP 112.26.3.8.34701 > 112.26.3.1.43445: Flags [.], ack 615469, win 24321, options [nop,nop,TS val 4294928689 ecr 174279,mptcp dss ack 3868464819], length 0
10:18:20.041543 IP 112.26.3.8.34701 > 112.26.3.1.43445: Flags [.], ack 615469, win 24321, options [nop,nop,TS val 4294928689 ecr 174279,mptcp dss ack 3868464819], length 0
10:18:20.111852 IP 112.26.3.1.43445 > 112.26.3.8.34701: Flags [.], seq 615469:616897, ack 0, win 4017, options [nop,nop,TS val 174279 ecr 4294928500,mptcp dss ack 1720219151 seq 3868500519 subseq 615469 len 1428 csum 0x9357], length 1428
10:18:20.116880 IP 112.26.3.8.34701 > 112.26.3.1.43445: Flags [.], ack 616897, win 24321, options [nop,nop,TS val 4294928768 ecr 174279,mptcp dss ack 3868464819], length 0
10:18:20.117194 IP 112.26.3.8.34701 > 112.26.3.1.43445: Flags [.], ack 616897, win 24321, options [nop,nop,TS val 4294928768 ecr 174279,mptcp dss ack 3868464819], length 0
10:18:20.120110 IP 112.26.3.8.34701 > 112.26.3.1.43445: Flags [.], ack 616897, win 24321, options [nop,nop,TS val 4294928768 ecr 174279,mptcp dss ack 3868464819], length 0
10:18:20.166360 IP 112.26.3.1.43445 > 112.26.3.8.34701: Flags [.], seq 616897:618325, ack 0, win 4017, options [nop,nop,TS val 174338 ecr 4294928602,mptcp dss ack 1720219151 seq 3868501947 subseq 616897 len 1428 csum 0x36d2], length 1428
10:18:20.168255 IP 112.26.3.8.34701 > 112.26.3.1.43445: Flags [.], ack 618325, win 24299, options [nop,nop,TS val 4294928823 ecr 174338,mptcp dss ack 3868466247], length 0
10:18:20.168623 IP 112.26.3.8.34701 > 112.26.3.1.43445: Flags [.], ack 618325, win 24299, options [nop,nop,TS val 4294928823 ecr 174338,mptcp dss ack 3868466247], length 0
10:18:20.190364 IP 112.26.3.8.34701 > 112.26.3.1.43445: Flags [.], ack 618325, win 24299, options [nop,nop,TS val 4294928823 ecr 174338,mptcp dss ack 3868466247], length 0
10:18:20.260096 IP 112.26.3.1.43445 > 112.26.3.8.34701: Flags [.], seq 618325:619753, ack 0, win 4017, options [nop,nop,TS val 174338 ecr 4294928602,mptcp dss ack 1720219151 seq 3868506231 subseq 618325 len 1428 csum 0x25d4], length 1428
10:18:20.261733 IP 112.26.3.8.34701 > 112.26.3.1.43445: Flags [.], ack 619753, win 24303, options [nop,nop,TS val 4294928916 ecr 174338,mptcp dss ack 3868471959], length 0
10:18:20.262011 IP 112.26.3.8.34701 > 112.26.3.1.43445: Flags [.], ack 619753, win 24303, options [nop,nop,TS val 4294928916 ecr 174338,mptcp dss ack 3868471959], length 0
10:18:20.267006 IP 112.26.3.8.34701 > 112.26.3.1.43445: Flags [.], ack 619753, win 24303, options [nop,nop,TS val 4294928916 ecr 174338,mptcp dss ack 3868471959], length 0
10:18:20.322109 IP 112.26.3.1.43445 > 112.26.3.8.34701: Flags [.], seq 619753:621181, ack 0, win 4017, options [nop,nop,TS val 174414 ecr 4294928689,mptcp dss ack 1720219151 seq 3868513371 subseq 619753 len 1428 csum 0x271d], length 1428
10:18:20.323723 IP 112.26.3.8.34701 > 112.26.3.1.43445: Flags [.], ack 621181, win 24303, options [nop,nop,TS val 4294928979 ecr 174414,mptcp dss ack 3868471959], length 0
10:18:20.324048 IP 112.26.3.8.34701 > 112.26.3.1.43445: Flags [.], ack 621181, win 24303, options [nop,nop,TS val 4294928979 ecr 174414,mptcp dss ack 3868471959], length 0
10:18:20.347766 IP 112.26.3.8.34701 > 112.26.3.1.43445: Flags [.], ack 621181, win 24303, options [nop,nop,TS val 4294928979 ecr 174414,mptcp dss ack 3868471959], length 0
10:18:20.408290 IP 112.26.3.1.43445 > 112.26.3.8.34701: Flags [.], seq 621181:622609, ack 0, win 4017, options [nop,nop,TS val 174414 ecr 4294928689,mptcp dss ack 1720219151 seq 3868517655 subseq 621181 len 1428 csum 0x1345], length 1428
10:18:20.410898 IP 112.26.3.8.34701 > 112.26.3.1.43445: Flags [.], ack 622609, win 24303, options [nop,nop,TS val 4294929065 ecr 174414,mptcp dss ack 3868471959], length 0
10:18:20.411172 IP 112.26.3.8.34701 > 112.26.3.1.43445: Flags [.], ack 622609, win 24303, options [nop,nop,TS val 4294929065 ecr 174414,mptcp dss ack 3868471959], length 0
10:18:20.417676 IP 112.26.3.8.34701 > 112.26.3.1.43445: Flags [.], ack 622609, win 24303, options [nop,nop,TS val 4294929065 ecr 174414,mptcp dss ack 3868471959], length 0
10:18:20.478424 IP 112.26.3.1.43445 > 112.26.3.8.34701: Flags [.], seq 622609:624037, ack 0, win 4017, options [nop,nop,TS val 174496 ecr 4294928768,mptcp dss ack 1720219151 seq 3868521939 subseq 622609 len 1428 csum 0x48c3], length 1428
10:18:20.479761 IP 112.26.3.8.34701 > 112.26.3.1.43445: Flags [.], ack 624037, win 24303, options [nop,nop,TS val 4294929135 ecr 174496,mptcp dss ack 3868471959], length 0
10:18:20.480025 IP 112.26.3.8.34701 > 112.26.3.1.43445: Flags [.], ack 624037, win 24303, options [nop,nop,TS val 4294929135 ecr 174496,mptcp dss ack 3868471959], length 0
10:18:20.485643 IP 112.26.3.8.34701 > 112.26.3.1.43445: Flags [.], ack 624037, win 24303, options [nop,nop,TS val 4294929135 ecr 174496,mptcp dss ack 3868471959], length 0
10:18:20.569200 IP 112.26.3.1.43445 > 112.26.3.8.34701: Flags [.], seq 624037:625465, ack 0, win 4017, options [nop,nop,TS val 174938 ecr 4294929135,mptcp dss ack 1720219151 seq 3868500519 subseq 624037 len 1428 csum 0x71df], length 1428
10:18:20.570759 IP 112.26.3.8.34701 > 112.26.3.1.43445: Flags [.], ack 625465, win 24303, options [nop,nop,TS val 4294929226 ecr 174938,mptcp dss ack 3868471959], length 0
10:18:20.571031 IP 112.26.3.8.34701 > 112.26.3.1.43445: Flags [.], ack 625465, win 24303, options [nop,nop,TS val 4294929226 ecr 174938,mptcp dss ack 3868471959], length 0
10:18:20.585705 IP 112.26.3.8.34701 > 112.26.3.1.43445: Flags [.], ack 625465, win 24303, options [nop,nop,TS val 4294929226 ecr 174938,mptcp dss ack 3868471959], length 0
10:18:20.632428 IP 112.26.3.1.43445 > 112.26.3.8.34701: Flags [.], seq 625465:626893, ack 0, win 4017, options [nop,nop,TS val 174938 ecr 4294929135,mptcp dss ack 1720219151 seq 3868501947 subseq 625465 len 1428 csum 0x155a], length 1428
10:18:20.633680 IP 112.26.3.8.34701 > 112.26.3.1.43445: Flags [.], ack 626893, win 24303, options [nop,nop,TS val 4294929289 ecr 174938,mptcp dss ack 3868471959], length 0
10:18:20.633957 IP 112.26.3.8.34701 > 112.26.3.1.43445: Flags [.], ack 626893, win 24303, options [nop,nop,TS val 4294929289 ecr 174938,mptcp dss ack 3868471959], length 0
10:18:20.658111 IP 112.26.3.8.34701 > 112.26.3.1.43445: Flags [.], ack 626893, win 24303, options [nop,nop,TS val 4294929289 ecr 174938,mptcp dss ack 3868471959], length 0
10:18:20.708525 IP 112.26.3.1.43445 > 112.26.3.8.34701: Flags [.], seq 626893:628321, ack 0, win 4017, options [nop,nop,TS val 174938 ecr 4294929135,mptcp dss ack 1720219151 seq 3868503375 subseq 626893 len 1428 csum 0x1a04], length 1428
10:18:20.711891 IP 112.26.3.8.34701 > 112.26.3.1.43445: Flags [.], ack 628321, win 24303, options [nop,nop,TS val 4294929365 ecr 174938,mptcp dss ack 3868471959], length 0
10:18:20.712153 IP 112.26.3.8.34701 > 112.26.3.1.43445: Flags [.], ack 628321, win 24303, options [nop,nop,TS val 4294929365 ecr 174938,mptcp dss ack 3868471959], length 0
10:18:20.752486 IP 112.26.3.8.34701 > 112.26.3.1.43445: Flags [.], ack 628321, win 24303, options [nop,nop,TS val 4294929365 ecr 174938,mptcp dss ack 3868471959], length 0
10:18:20.756005 IP 112.26.3.1.43445 > 112.26.3.8.34701: Flags [.], seq 628321:629749, ack 0, win 4017, options [nop,nop,TS val 174938 ecr 4294929135,mptcp dss ack 1720219151 seq 3868507659 subseq 628321 len 1428 csum 0x8d16], length 1428
10:18:20.758114 IP 112.26.3.8.34701 > 112.26.3.1.43445: Flags [.], ack 629749, win 24303, options [nop,nop,TS val 4294929413 ecr 174938,mptcp dss ack 3868471959], length 0
10:18:20.758388 IP 112.26.3.8.34701 > 112.26.3.1.43445: Flags [.], ack 629749, win 24303, options [nop,nop,TS val 4294929413 ecr 174938,mptcp dss ack 3868471959], length 0
10:18:20.823765 IP 112.26.3.8.34701 > 112.26.3.1.43445: Flags [.], ack 629749, win 24303, options [nop,nop,TS val 4294929413 ecr 174938,mptcp dss ack 3868471959], length 0
10:18:20.833393 IP 112.26.3.1.43445 > 112.26.3.8.34701: Flags [.], seq 629749:631177, ack 0, win 4017, options [nop,nop,TS val 174938 ecr 4294929135,mptcp dss ack 1720219151 seq 3868509087 subseq 629749 len 1428 csum 0xc4e], length 1428
10:18:20.835084 IP 112.26.3.8.34701 > 112.26.3.1.43445: Flags [.], ack 631177, win 24303, options [nop,nop,TS val 4294929490 ecr 174938,mptcp dss ack 3868471959], length 0
10:18:20.835400 IP 112.26.3.8.34701 > 112.26.3.1.43445: Flags [.], ack 631177, win 24303, options [nop,nop,TS val 4294929490 ecr 174938,mptcp dss ack 3868471959], length 0
10:18:20.890832 IP 112.26.3.1.43445 > 112.26.3.8.34701: Flags [.], seq 631177:632605, ack 0, win 4017, options [nop,nop,TS val 174938 ecr 4294929135,mptcp dss ack 1720219151 seq 3868510515 subseq 631177 len 1428 csum 0xa138], length 1428
10:18:20.892090 IP 112.26.3.8.34701 > 112.26.3.1.43445: Flags [.], ack 632605, win 24303, options [nop,nop,TS val 4294929547 ecr 174938,mptcp dss ack 3868471959], length 0
10:18:20.892356 IP 112.26.3.8.34701 > 112.26.3.1.43445: Flags [.], ack 632605, win 24303, options [nop,nop,TS val 4294929547 ecr 174938,mptcp dss ack 3868471959], length 0
10:18:20.942115 IP 112.26.3.8.34701 > 112.26.3.1.43445: Flags [.], ack 631177, win 24303, options [nop,nop,TS val 4294929490 ecr 174938,mptcp dss ack 3868471959], length 0
10:18:20.964595 IP 112.26.3.1.43445 > 112.26.3.8.34701: Flags [.], seq 632605:634033, ack 0, win 4017, options [nop,nop,TS val 174938 ecr 4294929135,mptcp dss ack 1720219151 seq 3868511943 subseq 632605 len 1428 csum 0xb464], length 1428
10:18:21.006027 IP 112.26.3.8.34701 > 112.26.3.1.43445: Flags [.], ack 634033, win 24303, options [nop,nop,TS val 4294929662 ecr 174938,mptcp dss ack 3868471959], length 0
10:18:21.006346 IP 112.26.3.8.34701 > 112.26.3.1.43445: Flags [.], ack 634033, win 24303, options [nop,nop,TS val 4294929662 ecr 174938,mptcp dss ack 3868471959], length 0
10:18:21.017328 IP 112.26.3.8.34701 > 112.26.3.1.43445: Flags [.], ack 632605, win 24303, options [nop,nop,TS val 4294929547 ecr 174938,mptcp dss ack 3868471959], length 0
10:18:21.050998 IP 112.26.3.1.43445 > 112.26.3.8.34701: Flags [.], seq 634033:635461, ack 0, win 4017, options [nop,nop,TS val 174977 ecr 4294929226,mptcp dss ack 1720219151 seq 3868513371 subseq 634033 len 1428 csum 0xef54], length 1428
10:18:21.099683 IP 112.26.3.8.34701 > 112.26.3.1.43445: Flags [.], ack 634033, win 24303, options [nop,nop,TS val 4294929662 ecr 174938,mptcp dss ack 3868471959], length 0
10:18:21.126268 IP 112.26.3.1.43445 > 112.26.3.8.34701: Flags [.], seq 635461:636889, ack 0, win 4017, options [nop,nop,TS val 175079 ecr 4294929289,mptcp dss ack 1720219151 seq 3868517655 subseq 635461 len 1428 csum 0xdb7c], length 1428
10:18:21.127514 IP 112.26.3.8.34701 > 112.26.3.1.43445: Flags [.], ack 636889, win 24303, options [nop,nop,TS val 4294929783 ecr 174977,mptcp dss ack 3868471959], length 0
10:18:21.127846 IP 112.26.3.8.34701 > 112.26.3.1.43445: Flags [.], ack 636889, win 24303, options [nop,nop,TS val 4294929783 ecr 174977,mptcp dss ack 3868471959], length 0
10:18:21.151223 IP 112.26.3.8.34701 > 112.26.3.1.43445: Flags [.], ack 636889, win 24303, options [nop,nop,TS val 4294929783 ecr 174977,mptcp dss ack 3868471959], length 0
10:18:21.195851 IP 112.26.3.1.43445 > 112.26.3.8.34701: Flags [.], seq 636889:638317, ack 0, win 4017, options [nop,nop,TS val 175184 ecr 4294929365,mptcp dss ack 1720219151 seq 3868521939 subseq 636889 len 1428 csum 0x10fb], length 1428
10:18:21.255982 IP 112.26.3.1.43445 > 112.26.3.8.34701: Flags [.], seq 638317:639745, ack 0, win 4017, options [nop,nop,TS val 175194 ecr 4294929413,mptcp dss ack 1720219151 seq 3868524795 subseq 638317 len 1428 csum 0x946f], length 1428
10:18:21.325395 IP 112.26.3.1.43445 > 112.26.3.8.34701: Flags [.], seq 639745:641173, ack 0, win 4017, options [nop,nop,TS val 175317 ecr 4294929490,mptcp dss ack 1720219151 seq 3868527651 subseq 639745 len 1428 csum 0x6ce6], length 1428
10:18:21.327188 IP 112.26.3.8.34701 > 112.26.3.1.43445: Flags [.], ack 641173, win 24303, options [nop,nop,TS val 4294929982 ecr 175184,mptcp dss ack 3868471959], length 0
10:18:21.327485 IP 112.26.3.8.34701 > 112.26.3.1.43445: Flags [.], ack 641173, win 24303, options [nop,nop,TS val 4294929982 ecr 175184,mptcp dss ack 3868471959], length 0
10:18:21.348215 IP 112.26.3.8.34701 > 112.26.3.1.43445: Flags [.], ack 641173, win 24303, options [nop,nop,TS val 4294929982 ecr 175184,mptcp dss ack 3868471959], length 0
10:18:21.414034 IP 112.26.3.1.43445 > 112.26.3.8.34701: Flags [.], seq 641173:642601, ack 0, win 4017, options [nop,nop,TS val 175388 ecr 4294929547,mptcp dss ack 1720219151 seq 3868530507 subseq 641173 len 1428 csum 0xcde0], length 1428
10:18:21.508862 IP 112.26.3.1.43445 > 112.26.3.8.34701: Flags [.], seq 642601:644029, ack 0, win 4017, options [nop,nop,TS val 175475 ecr 4294929662,mptcp dss ack 1720219151 seq 3868533363 subseq 642601 len 1428 csum 0x3295], length 1428
10:18:21.572434 IP 112.26.3.8.34701 > 112.26.3.1.43445: Flags [.], ack 644029, win 24290, options [nop,nop,TS val 4294930224 ecr 175388,mptcp dss ack 3868494807], length 0
10:18:21.572680 IP 112.26.3.8.34701 > 112.26.3.1.43445: Flags [.], ack 644029, win 24290, options [nop,nop,TS val 4294930224 ecr 175388,mptcp dss ack 3868494807], length 0
10:18:21.584594 IP 112.26.3.8.34701 > 112.26.3.1.43445: Flags [.], ack 644029, win 24290, options [nop,nop,TS val 4294930224 ecr 175388,mptcp dss ack 3868494807], length 0
10:18:21.616679 IP 112.26.3.1.43445 > 112.26.3.8.34701: Flags [.], seq 644029:645457, ack 0, win 4017, options [nop,nop,TS val 175527 ecr 4294929783,mptcp dss ack 1720219151 seq 3868536219 subseq 644029 len 1428 csum 0x200a], length 1428
10:18:21.706446 IP 112.26.3.1.43445 > 112.26.3.8.34701: Flags [.], seq 645457:646885, ack 0, win 4017, options [nop,nop,TS val 175527 ecr 4294929783,mptcp dss ack 1720219151 seq 3868537647 subseq 645457 len 1428 csum 0x7d81], length 1428
10:18:21.779349 IP 112.26.3.1.43445 > 112.26.3.8.34701: Flags [.], seq 646885:648313, ack 0, win 4017, options [nop,nop,TS val 175724 ecr 4294929982,mptcp dss ack 1720219151 seq 3868541931 subseq 646885 len 1428 csum 0x899d], length 1428
10:18:21.872259 IP 112.26.3.1.43445 > 112.26.3.8.34701: Flags [.], seq 648313:649741, ack 0, win 4017, options [nop,nop,TS val 175724 ecr 4294929982,mptcp dss ack 1720219151 seq 3868543359 subseq 648313 len 1428 csum 0xbf2d], length 1428
10:18:21.873850 IP 112.26.3.8.34701 > 112.26.3.1.43445: Flags [.], ack 649741, win 24290, options [nop,nop,TS val 4294930529 ecr 175527,mptcp dss ack 3868494807], length 0
10:18:21.874132 IP 112.26.3.8.34701 > 112.26.3.1.43445: Flags [.], ack 649741, win 24290, options [nop,nop,TS val 4294930529 ecr 175527,mptcp dss ack 3868494807], length 0
10:18:21.877922 IP 112.26.3.8.34701 > 112.26.3.1.43445: Flags [.], ack 649741, win 24290, options [nop,nop,TS val 4294930529 ecr 175527,mptcp dss ack 3868494807], length 0
10:18:21.952551 IP 112.26.3.1.43445 > 112.26.3.8.34701: Flags [.], seq 649741:651169, ack 0, win 4017, options [nop,nop,TS val 175724 ecr 4294929982,mptcp dss ack 1720219151 seq 3868544787 subseq 649741 len 1428 csum 0xaf01], length 1428
