10:17:05.053101 IP 112.26.0.8.36004 > 112.26.0.1.43445: Flags [S], seq 604036043, win 65535, options [mss 1460,sackOK,TS val 4294851649 ecr 0,nop,wscale 6,mptcp capable csum {0x5fe731cb2a0ffaa8}], length 0
10:17:05.149746 IP 112.26.0.8.36004 > 112.26.0.1.43445: Flags [S], seq 604036043, win 65535, options [mss 1460,sackOK,TS val 4294851649 ecr 0,nop,wscale 6,mptcp capable csum {0x5fe731cb2a0ffaa8}], length 0
10:17:05.165896 IP 112.26.0.8.36004 > 112.26.0.1.43445: Flags [S], seq 604036043, win 65535, options [mss 1460,sackOK,TS val 4294851649 ecr 0,nop,wscale 6,mptcp capable csum {0x5fe731cb2a0ffaa8}], length 0
10:17:05.355637 IP 112.26.0.1.43445 > 112.26.0.8.36004: Flags [S.], seq 3411350881, ack 604036044, win 65535, options [mss 1460,sackOK,TS val 99544 ecr 4294851649,nop,wscale 6,mptcp capable csum {0x95b44a60aabf03a2}], length 0
10:17:05.456238 IP 112.26.0.1.43445 > 112.26.0.8.36004: Flags [S.], seq 3411350881, ack 604036044, win 65535, options [mss 1460,sackOK,TS val 99544 ecr 4294851649,nop,wscale 6,mptcp capable csum {0x95b44a60aabf03a2}], length 0
10:17:05.465766 IP 112.26.0.8.36004 > 112.26.0.1.43445: Flags [.], ack 1, win 1369, options [nop,nop,TS val 4294854113 ecr 99544,mptcp capable csum {0x5fe731cb2a0ffaa8,0x95b44a60aabf03a2},mptcp dss ack 3866414399], length 0
10:17:05.470987 IP 112.26.0.8.36004 > 112.26.0.1.43445: Flags [.], ack 1, win 1369, options [nop,nop,TS val 4294854113 ecr 99544,mptcp capable csum {0x5fe731cb2a0ffaa8,0x95b44a60aabf03a2},mptcp dss ack 3866414399], length 0
10:17:35.658638 IP 112.26.0.8.36004 > 112.26.0.1.43445: Flags [.], ack 216869, win 21353, options [nop,nop,TS val 4294883551 ecr 128567,mptcp dss ack 3866908299], length 0
10:17:35.681088 IP 112.26.0.8.36004 > 112.26.0.1.43445: Flags [.], ack 216869, win 21353, options [nop,nop,TS val 4294883551 ecr 128567,mptcp dss ack 3866908299], length 0
10:17:35.706729 IP 112.26.0.1.43445 > 112.26.0.8.36004: Flags [.], seq 232577:234005, ack 1, win 4017, options [nop,nop,TS val 129786 ecr 4294883227,mptcp dss ack 1720219151 seq 3867001119 subseq 232577 len 1428 csum 0x9fb2], length 1428
10:17:35.737895 IP 112.26.0.1.43445 > 112.26.0.8.36004: Flags [.], seq 222581:224009, ack 1, win 4017, options [nop,nop,TS val 129118 ecr 4294882651,mptcp dss ack 1720219151 seq 3866973987 subseq 222581 len 1428 csum 0x1eb0], length 1428
10:17:35.739612 IP 112.26.0.8.36004 > 112.26.0.1.43445: Flags [.], ack 216869, win 22357, options [nop,nop,TS val 4294884394 ecr 128567,nop,nop,sack 1 {218297:224009},mptcp dss ack 3866952567], length 0
10:17:35.789289 IP 112.26.0.1.43445 > 112.26.0.8.36004: Flags [.], seq 234005:235433, ack 1, win 4017, options [nop,nop,TS val 129963 ecr 4294883307,mptcp dss ack 1720219151 seq 3867008259 subseq 234005 len 1428 csum 0x918d], length 1428
10:17:35.833101 IP 112.26.0.1.43445 > 112.26.0.8.36004: Flags [.], seq 224009:225437, ack 1, win 4017, options [nop,nop,TS val 129211 ecr 4294882736,mptcp dss ack 1720219151 seq 3866979699 subseq 224009 len 1428 csum 0x3a9], length 1428
10:17:35.835286 IP 112.26.0.8.36004 > 112.26.0.1.43445: Flags [.], ack 216869, win 22539, options [nop,nop,TS val 4294884490 ecr 128567,nop,nop,sack 1 {218297:225437},mptcp dss ack 3866952567], length 0
10:17:35.877386 IP 112.26.0.1.43445 > 112.26.0.8.36004: Flags [.], seq 235433:236861, ack 1, win 4017, options [nop,nop,TS val 130057 ecr 4294883551,mptcp dss ack 1720219151 seq 3867013971 subseq 235433 len 1428 csum 0x1672], length 1428
10:17:35.919748 IP 112.26.0.1.43445 > 112.26.0.8.36004: Flags [.], seq 225437:226865, ack 1, win 4017, options [nop,nop,TS val 129398 ecr 4294882887,mptcp dss ack 1720219151 seq 3866985411 subseq 225437 len 1428 csum 0x2896], length 1428
10:17:35.936489 IP 112.26.0.8.36004 > 112.26.0.1.43445: Flags [.], ack 216869, win 22585, options [nop,nop,TS val 4294884576 ecr 128567,nop,nop,sack 1 {218297:226865},mptcp dss ack 3866952567], length 0
10:17:35.985814 IP 112.26.0.1.43445 > 112.26.0.8.36004: Flags [.], seq 226865:228293, ack 1, win 4017, options [nop,nop,TS val 129398 ecr 4294882887,mptcp dss ack 1720219151 seq 3866986839 subseq 226865 len 1428 csum 0xb4a8], length 1428
10:17:35.999584 IP 112.26.0.8.36004 > 112.26.0.1.43445: Flags [.], ack 216869, win 22767, options [nop,nop,TS val 4294884642 ecr 128567,nop,nop,sack 1 {218297:228293},mptcp dss ack 3866952567], length 0
10:17:36.079481 IP 112.26.0.8.36004 > 112.26.0.1.43445: Flags [.], ack 216869, win 21718, options [nop,nop,TS val 4294883936 ecr 128567,nop,nop,sack 1 {218297:219725},mptcp dss ack 3866908299], length 0
10:17:36.080988 IP 112.26.0.8.36004 > 112.26.0.1.43445: Flags [.], ack 216869, win 21718, options [nop,nop,TS val 4294883936 ecr 128567,nop,nop,sack 1 {218297:219725},mptcp dss ack 3866908299], length 0
10:17:36.104735 IP 112.26.0.1.43445 > 112.26.0.8.36004: Flags [.], seq 236861:238289, ack 1, win 4017, options [nop,nop,TS val 130471 ecr 4294883936,mptcp dss ack 1720219151 seq 3867029679 subseq 236861 len 1428 csum 0x6434], length 1428
10:17:36.134919 IP 112.26.0.1.43445 > 112.26.0.8.36004: Flags [.], seq 229721:231149, ack 1, win 4017, options [nop,nop,TS val 129609 ecr 4294883116,mptcp dss ack 1720219151 seq 3866996835 subseq 229721 len 1428 csum 0x56dd], length 1428
10:17:36.136186 IP 112.26.0.8.36004 > 112.26.0.1.43445: Flags [.], ack 216869, win 22904, options [nop,nop,TS val 4294884791 ecr 128567,nop,nop,sack 2 {229721:231149}{218297:228293},mptcp dss ack 3866952567], length 0
10:17:36.202932 IP 112.26.0.8.36004 > 112.26.0.1.43445: Flags [.], ack 216869, win 22083, options [nop,nop,TS val 4294884159 ecr 128567,nop,nop,sack 1 {218297:221153},mptcp dss ack 3866952567], length 0
10:17:36.204743 IP 112.26.0.8.36004 > 112.26.0.1.43445: Flags [.], ack 216869, win 22083, options [nop,nop,TS val 4294884159 ecr 128567,nop,nop,sack 1 {218297:221153},mptcp dss ack 3866952567], length 0
10:17:36.225203 IP 112.26.0.1.43445 > 112.26.0.8.36004: Flags [.], seq 238289:239717, ack 1, win 4017, options [nop,nop,TS val 130596 ecr 4294884159,mptcp dss ack 1720219151 seq 3867038247 subseq 238289 len 1428 csum 0x3db], length 1428
10:17:36.251243 IP 112.26.0.1.43445 > 112.26.0.8.36004: Flags [.], seq 231149:232577, ack 1, win 4017, options [nop,nop,TS val 129609 ecr 4294883116,mptcp dss ack 1720219151 seq 3866998263 subseq 231149 len 1428 csum 0xea39], length 1428
10:17:36.252978 IP 112.26.0.8.36004 > 112.26.0.1.43445: Flags [.], ack 216869, win 23087, options [nop,nop,TS val 4294884908 ecr 128567,nop,nop,sack 2 {229721:232577}{218297:228293},mptcp dss ack 3866952567], length 0
10:17:36.347801 IP 112.26.0.8.36004 > 112.26.0.1.43445: Flags [.], ack 216869, win 22174, options [nop,nop,TS val 4294884264 ecr 128567,nop,nop,sack 1 {218297:222581},mptcp dss ack 3866952567], length 0
10:17:36.349452 IP 112.26.0.8.36004 > 112.26.0.1.43445: Flags [.], ack 216869, win 22174, options [nop,nop,TS val 4294884264 ecr 128567,nop,nop,sack 1 {218297:222581},mptcp dss ack 3866952567], length 0
10:17:36.377980 IP 112.26.0.1.43445 > 112.26.0.8.36004: Flags [.], seq 216869:218297, ack 1, win 4017, options [nop,nop,TS val 130725 ecr 4294884264,mptcp dss ack 1720219151 seq 3866952567 subseq 216869 len 1428 csum 0xf797], length 1428
10:17:36.432111 IP 112.26.0.1.43445 > 112.26.0.8.36004: Flags [.], seq 232577:234005, ack 1, win 4017, options [nop,nop,TS val 129786 ecr 4294883227,mptcp dss ack 1720219151 seq 3867001119 subseq 232577 len 1428 csum 0x9fb2], length 1428
10:17:36.433805 IP 112.26.0.8.36004 > 112.26.0.1.43445: Flags [.], ack 216869, win 23315, options [nop,nop,TS val 4294885089 ecr 128567,nop,nop,sack 2 {229721:234005}{218297:228293},mptcp dss ack 3866952567], length 0
10:17:36.503547 IP 112.26.0.1.43445 > 112.26.0.8.36004: Flags [.], seq 234005:235433, ack 1, win 4017, options [nop,nop,TS val 129963 ecr 4294883307,mptcp dss ack 1720219151 seq 3867008259 subseq 234005 len 1428 csum 0x918d], length 1428
10:17:36.517137 IP 112.26.0.8.36004 > 112.26.0.1.43445: Flags [.], ack 216869, win 23497, options [nop,nop,TS val 4294885160 ecr 128567,nop,nop,sack 2 {229721:235433}{218297:228293},mptcp dss ack 3866952567], length 0
10:17:36.579846 IP 112.26.0.1.43445 > 112.26.0.8.36004: Flags [.], seq 235433:236861, ack 1, win 4017, options [nop,nop,TS val 130057 ecr 4294883551,mptcp dss ack 1720219151 seq 3867013971 subseq 235433 len 1428 csum 0x1672], length 1428
10:17:36.583781 IP 112.26.0.8.36004 > 112.26.0.1.43445: Flags [.], ack 216869, win 23634, options [nop,nop,TS val 4294885236 ecr 128567,nop,nop,sack 2 {229721:236861}{218297:228293},mptcp dss ack 3866952567], length 0
10:17:36.654547 IP 112.26.0.8.36004 > 112.26.0.1.43445: Flags [.], ack 216869, win 22585, options [nop,nop,TS val 4294884576 ecr 128567,nop,nop,sack 1 {218297:226865},mptcp dss ack 3866952567], length 0
10:17:36.656407 IP 112.26.0.8.36004 > 112.26.0.1.43445: Flags [.], ack 216869, win 22585, options [nop,nop,TS val 4294884576 ecr 128567,nop,nop,sack 1 {218297:226865},mptcp dss ack 3866952567], length 0
10:17:36.706950 IP 112.26.0.8.36004 > 112.26.0.1.43445: Flags [.], ack 216869, win 22767, options [nop,nop,TS val 4294884642 ecr 128567,nop,nop,sack 1 {218297:228293},mptcp dss ack 3866952567], length 0
10:17:36.709164 IP 112.26.0.8.36004 > 112.26.0.1.43445: Flags [.], ack 216869, win 22767, options [nop,nop,TS val 4294884642 ecr 128567,nop,nop,sack 1 {218297:228293},mptcp dss ack 3866952567], length 0
10:17:36.712322 IP 112.26.0.1.43445 > 112.26.0.8.36004: Flags [.], seq 239717:241145, ack 1, win 4017, options [nop,nop,TS val 131074 ecr 4294884576,mptcp dss ack 1720219151 seq 3867055383 subseq 239717 len 1428 csum 0xa48c], length 1428
10:17:36.796662 IP 112.26.0.1.43445 > 112.26.0.8.36004: Flags [.], seq 236861:238289, ack 1, win 4017, options [nop,nop,TS val 130471 ecr 4294883936,mptcp dss ack 1720219151 seq 3867029679 subseq 236861 len 1428 csum 0x6434], length 1428
10:17:36.801261 IP 112.26.0.8.36004 > 112.26.0.1.43445: Flags [.], ack 216869, win 23883, options [nop,nop,TS val 4294885454 ecr 128567,nop,nop,sack 2 {229721:238289}{218297:228293},mptcp dss ack 3866952567], length 0
10:17:36.891760 IP 112.26.0.1.43445 > 112.26.0.8.36004: Flags [.], seq 238289:239717, ack 1, win 4017, options [nop,nop,TS val 130596 ecr 4294884159,mptcp dss ack 1720219151 seq 3867038247 subseq 238289 len 1428 csum 0x3db], length 1428
10:17:36.895307 IP 112.26.0.8.36004 > 112.26.0.1.43445: Flags [.], ack 216869, win 23883, options [nop,nop,TS val 4294885549 ecr 128567,nop,nop,sack 2 {229721:239717}{218297:228293},mptcp dss ack 3866952567], length 0
10:17:36.934267 IP 112.26.0.1.43445 > 112.26.0.8.36004: Flags [.], seq 241145:242573, ack 1, win 4017, options [nop,nop,TS val 131074 ecr 4294884576,mptcp dss ack 1720219151 seq 3867056811 subseq 241145 len 1428 csum 0x7795], length 1428
10:17:36.982293 IP 112.26.0.1.43445 > 112.26.0.8.36004: Flags [.], seq 242573:244001, ack 1, win 4017, options [nop,nop,TS val 131152 ecr 4294884642,mptcp dss ack 1720219151 seq 3867061095 subseq 242573 len 1428 csum 0x3c9a], length 1428
10:17:37.003679 IP 112.26.0.1.43445 > 112.26.0.8.36004: Flags [.], seq 216869:218297, ack 1, win 4017, options [nop,nop,TS val 130725 ecr 4294884264,mptcp dss ack 1720219151 seq 3866952567 subseq 216869 len 1428 csum 0xf797], length 1428
10:17:37.005654 IP 112.26.0.8.36004 > 112.26.0.1.43445: Flags [.], ack 228293, win 23720, options [nop,nop,TS val 4294885661 ecr 130725,nop,nop,sack 1 {229721:239717},mptcp dss ack 3866989695], length 0
10:17:37.052872 IP 112.26.0.8.36004 > 112.26.0.1.43445: Flags [.], ack 216869, win 23315, options [nop,nop,TS val 4294885089 ecr 128567,nop,nop,sack 2 {229721:234005}{218297:228293},mptcp dss ack 3866952567], length 0
10:17:37.054866 IP 112.26.0.8.36004 > 112.26.0.1.43445: Flags [.], ack 216869, win 23315, options [nop,nop,TS val 4294885089 ecr 128567,nop,nop,sack 2 {229721:234005}{218297:228293},mptcp dss ack 3866952567], length 0
10:17:37.083737 IP 112.26.0.1.43445 > 112.26.0.8.36004: Flags [.], seq 228293:229721, ack 1, win 4017, options [nop,nop,TS val 131431 ecr 4294885089,mptcp dss ack 1720219151 seq 3866989695 subseq 228293 len 1428 csum 0x7ab1], length 1428
10:17:37.136521 IP 112.26.0.8.36004 > 112.26.0.1.43445: Flags [.], ack 216869, win 23497, options [nop,nop,TS val 4294885160 ecr 128567,nop,nop,sack 2 {229721:235433}{218297:228293},mptcp dss ack 3866952567], length 0
10:17:37.152085 IP 112.26.0.8.36004 > 112.26.0.1.43445: Flags [.], ack 216869, win 23497, options [nop,nop,TS val 4294885160 ecr 128567,nop,nop,sack 2 {229721:235433}{218297:228293},mptcp dss ack 3866952567], length 0
10:17:37.194988 IP 112.26.0.1.43445 > 112.26.0.8.36004: Flags [.], seq 244001:245429, ack 1, win 4017, options [nop,nop,TS val 131563 ecr 4294885160,mptcp dss ack 1720219151 seq 3867081087 subseq 244001 len 1428 csum 0x9dcb], length 1428
10:17:37.219115 IP 112.26.0.8.36004 > 112.26.0.1.43445: Flags [.], ack 216869, win 23634, options [nop,nop,TS val 4294885236 ecr 128567,nop,nop,sack 2 {229721:236861}{218297:228293},mptcp dss ack 3866952567], length 0
10:17:37.225669 IP 112.26.0.8.36004 > 112.26.0.1.43445: Flags [.], ack 216869, win 23634, options [nop,nop,TS val 4294885236 ecr 128567,nop,nop,sack 2 {229721:236861}{218297:228293},mptcp dss ack 3866952567], length 0
10:17:37.307662 IP 112.26.0.1.43445 > 112.26.0.8.36004: Flags [.], seq 239717:241145, ack 1, win 4017, options [nop,nop,TS val 131074 ecr 4294884576,mptcp dss ack 1720219151 seq 3867055383 subseq 239717 len 1428 csum 0xa48c], length 1428
10:17:37.309260 IP 112.26.0.8.36004 > 112.26.0.1.43445: Flags [.], ack 228293, win 24079, options [nop,nop,TS val 4294885965 ecr 130725,nop,nop,sack 1 {229721:241145},mptcp dss ack 3866989695], length 0
10:17:37.362365 IP 112.26.0.1.43445 > 112.26.0.8.36004: Flags [.], seq 245429:246857, ack 1, win 4017, options [nop,nop,TS val 131657 ecr 4294885236,mptcp dss ack 1720219151 seq 3867083943 subseq 245429 len 1428 csum 0x1406], length 1428
10:17:37.378703 IP 112.26.0.8.36004 > 112.26.0.1.43445: Flags [.], ack 216869, win 23883, options [nop,nop,TS val 4294885454 ecr 128567,nop,nop,sack 2 {229721:238289}{218297:228293},mptcp dss ack 3866952567], length 0
10:17:37.379930 IP 112.26.0.8.36004 > 112.26.0.1.43445: Flags [.], ack 216869, win 23883, options [nop,nop,TS val 4294885454 ecr 128567,nop,nop,sack 2 {229721:238289}{218297:228293},mptcp dss ack 3866952567], length 0
10:17:37.445431 IP 112.26.0.1.43445 > 112.26.0.8.36004: Flags [.], seq 246857:248285, ack 1, win 4017, options [nop,nop,TS val 131778 ecr 4294885454,mptcp dss ack 1720219151 seq 3867089655 subseq 246857 len 1428 csum 0x6baf], length 1428
10:17:37.541924 IP 112.26.0.8.36004 > 112.26.0.1.43445: Flags [.], ack 216869, win 23883, options [nop,nop,TS val 4294885549 ecr 128567,nop,nop,sack 2 {229721:239717}{218297:228293},mptcp dss ack 3866952567], length 0
10:17:37.545630 IP 112.26.0.8.36004 > 112.26.0.1.43445: Flags [.], ack 216869, win 23883, options [nop,nop,TS val 4294885549 ecr 128567,nop,nop,sack 2 {229721:239717}{218297:228293},mptcp dss ack 3866952567], length 0
10:17:37.563760 IP 112.26.0.1.43445 > 112.26.0.8.36004: Flags [.], seq 248285:249713, ack 1, win 4017, options [nop,nop,TS val 131932 ecr 4294885549,mptcp dss ack 1720219151 seq 3867096795 subseq 248285 len 1428 csum 0x620f], length 1428
10:17:37.614676 IP 112.26.0.1.43445 > 112.26.0.8.36004: Flags [.], seq 241145:242573, ack 1, win 4017, options [nop,nop,TS val 131074 ecr 4294884576,mptcp dss ack 1720219151 seq 3867056811 subseq 241145 len 1428 csum 0x7795], length 1428
10:17:37.616409 IP 112.26.0.8.36004 > 112.26.0.1.43445: Flags [.], ack 228293, win 24079, options [nop,nop,TS val 4294886272 ecr 130725,nop,nop,sack 1 {229721:242573},mptcp dss ack 3866989695], length 0
10:17:37.679914 IP 112.26.0.1.43445 > 112.26.0.8.36004: Flags [.], seq 242573:244001, ack 1, win 4017, options [nop,nop,TS val 131152 ecr 4294884642,mptcp dss ack 1720219151 seq 3867061095 subseq 242573 len 1428 csum 0x3c9a], length 1428
10:17:37.681173 IP 112.26.0.8.36004 > 112.26.0.1.43445: Flags [.], ack 228293, win 24079, options [nop,nop,TS val 4294886337 ecr 130725,nop,nop,sack 1 {229721:244001},mptcp dss ack 3866989695], length 0
10:17:37.758642 IP 112.26.0.8.36004 > 112.26.0.1.43445: Flags [.], ack 228293, win 23720, options [nop,nop,TS val 4294885661 ecr 130725,nop,nop,sack 1 {229721:239717},mptcp dss ack 3866989695], length 0
10:17:37.761643 IP 112.26.0.8.36004 > 112.26.0.1.43445: Flags [.], ack 228293, win 23720, options [nop,nop,TS val 4294885661 ecr 130725,nop,nop,sack 1 {229721:239717},mptcp dss ack 3866989695], length 0
10:17:37.784628 IP 112.26.0.1.43445 > 112.26.0.8.36004: Flags [.], seq 249713:251141, ack 1, win 4017, options [nop,nop,TS val 132138 ecr 4294885661,mptcp dss ack 1720219151 seq 3867102507 subseq 249713 len 1428 csum 0x6828], length 1428
10:17:37.807512 IP 112.26.0.1.43445 > 112.26.0.8.36004: Flags [.], seq 228293:229721, ack 1, win 4017, options [nop,nop,TS val 131431 ecr 4294885089,mptcp dss ack 1720219151 seq 3866989695 subseq 228293 len 1428 csum 0x7ab1], length 1428
10:17:37.808797 IP 112.26.0.8.36004 > 112.26.0.1.43445: Flags [.], ack 244001, win 23879, options [nop,nop,TS val 4294886464 ecr 131431,mptcp dss ack 3867002547], length 0
10:17:37.877726 IP 112.26.0.1.43445 > 112.26.0.8.36004: Flags [.], seq 244001:245429, ack 1, win 4017, options [nop,nop,TS val 131563 ecr 4294885160,mptcp dss ack 1720219151 seq 3867081087 subseq 244001 len 1428 csum 0x9dcb], length 1428
10:17:37.894419 IP 112.26.0.8.36004 > 112.26.0.1.43445: Flags [.], ack 245429, win 23879, options [nop,nop,TS val 4294886535 ecr 131563,mptcp dss ack 3867002547], length 0
10:17:38.006963 IP 112.26.0.8.36004 > 112.26.0.1.43445: Flags [.], ack 228293, win 24079, options [nop,nop,TS val 4294885965 ecr 130725,nop,nop,sack 1 {229721:241145},mptcp dss ack 3866989695], length 0
10:17:38.009514 IP 112.26.0.8.36004 > 112.26.0.1.43445: Flags [.], ack 228293, win 24079, options [nop,nop,TS val 4294885965 ecr 130725,nop,nop,sack 1 {229721:241145},mptcp dss ack 3866989695], length 0
10:17:38.053020 IP 112.26.0.1.43445 > 112.26.0.8.36004: Flags [.], seq 245429:246857, ack 1, win 4017, options [nop,nop,TS val 131657 ecr 4294885236,mptcp dss ack 1720219151 seq 3867083943 subseq 245429 len 1428 csum 0x1406], length 1428
10:17:38.056062 IP 112.26.0.8.36004 > 112.26.0.1.43445: Flags [.], ack 246857, win 23879, options [nop,nop,TS val 4294886710 ecr 131657,mptcp dss ack 3867002547], length 0
10:17:38.077680 IP 112.26.0.1.43445 > 112.26.0.8.36004: Flags [.], seq 251141:252569, ack 1, win 4017, options [nop,nop,TS val 132415 ecr 4294885965,mptcp dss ack 1720219151 seq 3867109647 subseq 251141 len 1428 csum 0xb1cf], length 1428
10:17:38.118591 IP 112.26.0.1.43445 > 112.26.0.8.36004: Flags [.], seq 246857:248285, ack 1, win 4017, options [nop,nop,TS val 131778 ecr 4294885454,mptcp dss ack 1720219151 seq 3867089655 subseq 246857 len 1428 csum 0x6baf], length 1428
10:17:38.121885 IP 112.26.0.8.36004 > 112.26.0.1.43445: Flags [.], ack 248285, win 24136, options [nop,nop,TS val 4294886775 ecr 131778,mptcp dss ack 3867048243], length 0
10:17:38.189604 IP 112.26.0.1.43445 > 112.26.0.8.36004: Flags [.], seq 248285:249713, ack 1, win 4017, options [nop,nop,TS val 131932 ecr 4294885549,mptcp dss ack 1720219151 seq 3867096795 subseq 248285 len 1428 csum 0x620f], length 1428
10:17:38.208020 IP 112.26.0.8.36004 > 112.26.0.1.43445: Flags [.], ack 249713, win 24164, options [nop,nop,TS val 4294886846 ecr 131932,mptcp dss ack 3867048243], length 0
10:17:38.333637 IP 112.26.0.8.36004 > 112.26.0.1.43445: Flags [.], ack 228293, win 24079, options [nop,nop,TS val 4294886272 ecr 130725,nop,nop,sack 1 {229721:242573},mptcp dss ack 3866989695], length 0
10:17:38.344075 IP 112.26.0.8.36004 > 112.26.0.1.43445: Flags [.], ack 228293, win 24079, options [nop,nop,TS val 4294886272 ecr 130725,nop,nop,sack 1 {229721:242573},mptcp dss ack 3866989695], length 0
10:17:38.390829 IP 112.26.0.1.43445 > 112.26.0.8.36004: Flags [.], seq 252569:253997, ack 1, win 4017, options [nop,nop,TS val 132753 ecr 4294886272,mptcp dss ack 1720219151 seq 3867123927 subseq 252569 len 1428 csum 0x987d], length 1428
10:17:38.397558 IP 112.26.0.8.36004 > 112.26.0.1.43445: Flags [.], ack 228293, win 24079, options [nop,nop,TS val 4294886337 ecr 130725,nop,nop,sack 1 {229721:244001},mptcp dss ack 3866989695], length 0
10:17:38.408950 IP 112.26.0.8.36004 > 112.26.0.1.43445: Flags [.], ack 228293, win 24079, options [nop,nop,TS val 4294886337 ecr 130725,nop,nop,sack 1 {229721:244001},mptcp dss ack 3866989695], length 0
10:17:38.476988 IP 112.26.0.1.43445 > 112.26.0.8.36004: Flags [.], seq 249713:251141, ack 1, win 4017, options [nop,nop,TS val 132138 ecr 4294885661,mptcp dss ack 1720219151 seq 3867102507 subseq 249713 len 1428 csum 0x6828], length 1428
10:17:38.485640 IP 112.26.0.8.36004 > 112.26.0.1.43445: Flags [.], ack 251141, win 24164, options [nop,nop,TS val 4294887133 ecr 132138,mptcp dss ack 3867048243], length 0
10:17:38.517196 IP 112.26.0.1.43445 > 112.26.0.8.36004: Flags [.], seq 253997:255425, ack 1, win 4017, options [nop,nop,TS val 132804 ecr 4294886337,mptcp dss ack 1720219151 seq 3867129639 subseq 253997 len 1428 csum 0x6ae1], length 1428
10:17:38.554073 IP 112.26.0.8.36004 > 112.26.0.1.43445: Flags [.], ack 245429, win 23879, options [nop,nop,TS val 4294886535 ecr 131563,mptcp dss ack 3867002547], length 0
10:17:38.560219 IP 112.26.0.8.36004 > 112.26.0.1.43445: Flags [.], ack 245429, win 23879, options [nop,nop,TS val 4294886535 ecr 131563,mptcp dss ack 3867002547], length 0
10:17:38.621795 IP 112.26.0.1.43445 > 112.26.0.8.36004: Flags [.], seq 255425:256853, ack 1, win 4017, options [nop,nop,TS val 132937 ecr 4294886535,mptcp dss ack 1720219151 seq 3867138207 subseq 255425 len 1428 csum 0x556d], length 1428
10:17:38.635963 IP 112.26.0.8.36004 > 112.26.0.1.43445: Flags [.], ack 246857, win 23879, options [nop,nop,TS val 4294886710 ecr 131657,mptcp dss ack 3867002547], length 0
10:17:38.663925 IP 112.26.0.8.36004 > 112.26.0.1.43445: Flags [.], ack 246857, win 23879, options [nop,nop,TS val 4294886710 ecr 131657,mptcp dss ack 3867002547], length 0
10:17:38.685305 IP 112.26.0.1.43445 > 112.26.0.8.36004: Flags [.], seq 251141:252569, ack 1, win 4017, options [nop,nop,TS val 132415 ecr 4294885965,mptcp dss ack 1720219151 seq 3867109647 subseq 251141 len 1428 csum 0xb1cf], length 1428
10:17:38.687657 IP 112.26.0.8.36004 > 112.26.0.1.43445: Flags [.], ack 252569, win 24164, options [nop,nop,TS val 4294887341 ecr 132415,mptcp dss ack 3867048243], length 0
10:17:38.709885 IP 112.26.0.1.43445 > 112.26.0.8.36004: Flags [.], seq 256853:258281, ack 1, win 4017, options [nop,nop,TS val 132937 ecr 4294886535,mptcp dss ack 1720219151 seq 3867139635 subseq 256853 len 1428 csum 0x8051], length 1428
10:17:38.790491 IP 112.26.0.8.36004 > 112.26.0.1.43445: Flags [.], ack 248285, win 24136, options [nop,nop,TS val 4294886775 ecr 131778,mptcp dss ack 3867048243], length 0
10:17:38.794400 IP 112.26.0.8.36004 > 112.26.0.1.43445: Flags [.], ack 248285, win 24136, options [nop,nop,TS val 4294886775 ecr 131778,mptcp dss ack 3867048243], length 0
10:17:38.827174 IP 112.26.0.1.43445 > 112.26.0.8.36004: Flags [.], seq 258281:259709, ack 1, win 4017, options [nop,nop,TS val 133040 ecr 4294886710,mptcp dss ack 1720219151 seq 3867145347 subseq 258281 len 1428 csum 0x171f], length 1428
10:17:38.858470 IP 112.26.0.8.36004 > 112.26.0.1.43445: Flags [.], ack 249713, win 24164, options [nop,nop,TS val 4294886846 ecr 131932,mptcp dss ack 3867048243], length 0
10:17:38.909917 IP 112.26.0.1.43445 > 112.26.0.8.36004: Flags [.], seq 259709:261137, ack 1, win 4017, options [nop,nop,TS val 133171 ecr 4294886775,mptcp dss ack 1720219151 seq 3867149631 subseq 259709 len 1428 csum 0x48f5], length 1428
10:17:38.931525 IP 112.26.0.8.36004 > 112.26.0.1.43445: Flags [.], ack 249713, win 24164, options [nop,nop,TS val 4294886846 ecr 131932,mptcp dss ack 3867048243], length 0
10:17:38.950344 IP 112.26.0.1.43445 > 112.26.0.8.36004: Flags [.], seq 252569:253997, ack 1, win 4017, options [nop,nop,TS val 132753 ecr 4294886272,mptcp dss ack 1720219151 seq 3867123927 subseq 252569 len 1428 csum 0x987d], length 1428
10:17:38.952677 IP 112.26.0.8.36004 > 112.26.0.1.43445: Flags [.], ack 253997, win 24193, options [nop,nop,TS val 4294887607 ecr 132753,mptcp dss ack 3867078231], length 0
10:17:38.982359 IP 112.26.0.1.43445 > 112.26.0.8.36004: Flags [.], seq 261137:262565, ack 1, win 4017, options [nop,nop,TS val 133171 ecr 4294886775,mptcp dss ack 1720219151 seq 3867151059 subseq 261137 len 1428 csum 0x8d5], length 1428
10:17:39.059677 IP 112.26.0.8.36004 > 112.26.0.1.43445: Flags [.], ack 251141, win 24164, options [nop,nop,TS val 4294887133 ecr 132138,mptcp dss ack 3867048243], length 0
10:17:39.064506 IP 112.26.0.8.36004 > 112.26.0.1.43445: Flags [.], ack 251141, win 24164, options [nop,nop,TS val 4294887133 ecr 132138,mptcp dss ack 3867048243], length 0
10:17:39.119297 IP 112.26.0.1.43445 > 112.26.0.8.36004: Flags [.], seq 262565:263993, ack 1, win 4017, options [nop,nop,TS val 133308 ecr 4294886846,mptcp dss ack 1720219151 seq 3867156771 subseq 262565 len 1428 csum 0x66e1], length 1428
10:17:39.137664 IP 112.26.0.1.43445 > 112.26.0.8.36004: Flags [.], seq 253997:255425, ack 1, win 4017, options [nop,nop,TS val 132804 ecr 4294886337,mptcp dss ack 1720219151 seq 3867129639 subseq 253997 len 1428 csum 0x6ae1], length 1428
10:17:39.147828 IP 112.26.0.8.36004 > 112.26.0.1.43445: Flags [.], ack 255425, win 24193, options [nop,nop,TS val 4294887794 ecr 132804,mptcp dss ack 3867078231], length 0
10:17:39.178665 IP 112.26.0.1.43445 > 112.26.0.8.36004: Flags [.], seq 255425:256853, ack 1, win 4017, options [nop,nop,TS val 132937 ecr 4294886535,mptcp dss ack 1720219151 seq 3867138207 subseq 255425 len 1428 csum 0x556d], length 1428
10:17:39.218506 IP 112.26.0.8.36004 > 112.26.0.1.43445: Flags [.], ack 256853, win 24193, options [nop,nop,TS val 4294887835 ecr 132937,mptcp dss ack 3867078231], length 0
10:17:39.222068 IP 112.26.0.1.43445 > 112.26.0.8.36004: Flags [.], seq 263993:265421, ack 1, win 4017, options [nop,nop,TS val 133441 ecr 4294887133,mptcp dss ack 1720219151 seq 3867162483 subseq 263993 len 1428 csum 0xfc4], length 1428
10:17:39.282950 IP 112.26.0.8.36004 > 112.26.0.1.43445: Flags [.], ack 252569, win 24164, options [nop,nop,TS val 4294887341 ecr 132415,mptcp dss ack 3867048243], length 0
10:17:39.299144 IP 112.26.0.1.43445 > 112.26.0.8.36004: Flags [.], seq 265421:266849, ack 1, win 4017, options [nop,nop,TS val 133661 ecr 4294887341,mptcp dss ack 1720219151 seq 3867175335 subseq 265421 len 1428 csum 0x9509], length 1428
10:17:39.300319 IP 112.26.0.8.36004 > 112.26.0.1.43445: Flags [.], ack 252569, win 24164, options [nop,nop,TS val 4294887341 ecr 132415,mptcp dss ack 3867048243], length 0
10:17:39.353229 IP 112.26.0.1.43445 > 112.26.0.8.36004: Flags [.], seq 256853:258281, ack 1, win 4017, options [nop,nop,TS val 132937 ecr 4294886535,mptcp dss ack 1720219151 seq 3867139635 subseq 256853 len 1428 csum 0x8051], length 1428
10:17:39.355148 IP 112.26.0.8.36004 > 112.26.0.1.43445: Flags [.], ack 258281, win 24193, options [nop,nop,TS val 4294888010 ecr 132937,mptcp dss ack 3867078231], length 0
10:17:39.424024 IP 112.26.0.1.43445 > 112.26.0.8.36004: Flags [.], seq 258281:259709, ack 1, win 4017, options [nop,nop,TS val 133040 ecr 4294886710,mptcp dss ack 1720219151 seq 3867145347 subseq 258281 len 1428 csum 0x171f], length 1428
10:17:39.428598 IP 112.26.0.8.36004 > 112.26.0.1.43445: Flags [.], ack 259709, win 24193, options [nop,nop,TS val 4294888081 ecr 133040,mptcp dss ack 3867078231], length 0
10:17:39.473385 IP 112.26.0.1.43445 > 112.26.0.8.36004: Flags [.], seq 259709:261137, ack 1, win 4017, options [nop,nop,TS val 133171 ecr 4294886775,mptcp dss ack 1720219151 seq 3867149631 subseq 259709 len 1428 csum 0x48f5], length 1428
10:17:39.475163 IP 112.26.0.8.36004 > 112.26.0.1.43445: Flags [.], ack 261137, win 24193, options [nop,nop,TS val 4294888130 ecr 133171,mptcp dss ack 3867078231], length 0
10:17:39.563662 IP 112.26.0.8.36004 > 112.26.0.1.43445: Flags [.], ack 253997, win 24193, options [nop,nop,TS val 4294887607 ecr 132753,mptcp dss ack 3867078231], length 0
10:17:39.566122 IP 112.26.0.8.36004 > 112.26.0.1.43445: Flags [.], ack 253997, win 24193, options [nop,nop,TS val 4294887607 ecr 132753,mptcp dss ack 3867078231], length 0
10:17:39.579510 IP 112.26.0.1.43445 > 112.26.0.8.36004: Flags [.], seq 266849:268277, ack 1, win 4017, options [nop,nop,TS val 133942 ecr 4294887607,mptcp dss ack 1720219151 seq 3867185331 subseq 266849 len 1428 csum 0x8062], length 1428
10:17:39.628614 IP 112.26.0.1.43445 > 112.26.0.8.36004: Flags [.], seq 261137:262565, ack 1, win 4017, options [nop,nop,TS val 133171 ecr 4294886775,mptcp dss ack 1720219151 seq 3867151059 subseq 261137 len 1428 csum 0x8d5], length 1428
10:17:39.629696 IP 112.26.0.8.36004 > 112.26.0.1.43445: Flags [.], ack 262565, win 24193, options [nop,nop,TS val 4294888285 ecr 133171,mptcp dss ack 3867078231], length 0
10:17:39.698535 IP 112.26.0.1.43445 > 112.26.0.8.36004: Flags [.], seq 262565:263993, ack 1, win 4017, options [nop,nop,TS val 133308 ecr 4294886846,mptcp dss ack 1720219151 seq 3867156771 subseq 262565 len 1428 csum 0x66e1], length 1428
10:17:39.699819 IP 112.26.0.8.36004 > 112.26.0.1.43445: Flags [.], ack 263993, win 24193, options [nop,nop,TS val 4294888355 ecr 133308,mptcp dss ack 3867078231], length 0
10:17:39.764627 IP 112.26.0.8.36004 > 112.26.0.1.43445: Flags [.], ack 255425, win 24193, options [nop,nop,TS val 4294887794 ecr 132804,mptcp dss ack 3867078231], length 0
10:17:39.766999 IP 112.26.0.8.36004 > 112.26.0.1.43445: Flags [.], ack 255425, win 24193, options [nop,nop,TS val 4294887794 ecr 132804,mptcp dss ack 3867078231], length 0
10:17:39.778300 IP 112.26.0.1.43445 > 112.26.0.8.36004: Flags [.], seq 268277:269705, ack 1, win 4017, options [nop,nop,TS val 134143 ecr 4294887794,mptcp dss ack 1720219151 seq 3867191043 subseq 268277 len 1428 csum 0xc5e0], length 1428
10:17:39.865615 IP 112.26.0.8.36004 > 112.26.0.1.43445: Flags [.], ack 256853, win 24193, options [nop,nop,TS val 4294887835 ecr 132937,mptcp dss ack 3867078231], length 0
10:17:39.868306 IP 112.26.0.8.36004 > 112.26.0.1.43445: Flags [.], ack 256853, win 24193, options [nop,nop,TS val 4294887835 ecr 132937,mptcp dss ack 3867078231], length 0
10:17:39.876745 IP 112.26.0.1.43445 > 112.26.0.8.36004: Flags [.], seq 269705:271133, ack 1, win 4017, options [nop,nop,TS val 134245 ecr 4294887835,mptcp dss ack 1720219151 seq 3867198183 subseq 269705 len 1428 csum 0xc9d7], length 1428
10:17:39.937307 IP 112.26.0.1.43445 > 112.26.0.8.36004: Flags [.], seq 263993:265421, ack 1, win 4017, options [nop,nop,TS val 133441 ecr 4294887133,mptcp dss ack 1720219151 seq 3867162483 subseq 263993 len 1428 csum 0xfc4], length 1428
10:17:39.938478 IP 112.26.0.8.36004 > 112.26.0.1.43445: Flags [.], ack 265421, win 24193, options [nop,nop,TS val 4294888594 ecr 133441,mptcp dss ack 3867078231], length 0
10:17:40.010396 IP 112.26.0.1.43445 > 112.26.0.8.36004: Flags [.], seq 265421:266849, ack 1, win 4017, options [nop,nop,TS val 133661 ecr 4294887341,mptcp dss ack 1720219151 seq 3867175335 subseq 265421 len 1428 csum 0x9509], length 1428
10:17:40.048032 IP 112.26.0.8.36004 > 112.26.0.1.43445: Flags [.], ack 258281, win 24193, options [nop,nop,TS val 4294888010 ecr 132937,mptcp dss ack 3867078231], length 0
10:17:40.049718 IP 112.26.0.8.36004 > 112.26.0.1.43445: Flags [.], ack 258281, win 24193, options [nop,nop,TS val 4294888010 ecr 132937,mptcp dss ack 3867078231], length 0
10:17:40.056592 IP 112.26.0.8.36004 > 112.26.0.1.43445: Flags [.], ack 266849, win 24193, options [nop,nop,TS val 4294888708 ecr 133661,mptcp dss ack 3867078231], length 0
10:17:40.080016 IP 112.26.0.1.43445 > 112.26.0.8.36004: Flags [.], seq 271133:272561, ack 1, win 4017, options [nop,nop,TS val 134426 ecr 4294888010,mptcp dss ack 1720219151 seq 3867205323 subseq 271133 len 1428 csum 0xb40d], length 1428
10:17:40.117088 IP 112.26.0.8.36004 > 112.26.0.1.43445: Flags [.], ack 259709, win 24193, options [nop,nop,TS val 4294888081 ecr 133040,mptcp dss ack 3867078231], length 0
10:17:40.135681 IP 112.26.0.8.36004 > 112.26.0.1.43445: Flags [.], ack 259709, win 24193, options [nop,nop,TS val 4294888081 ecr 133040,mptcp dss ack 3867078231], length 0
10:17:40.157985 IP 112.26.0.8.36004 > 112.26.0.1.43445: Flags [.], ack 261137, win 24193, options [nop,nop,TS val 4294888130 ecr 133171,mptcp dss ack 3867078231], length 0
10:17:40.173340 IP 112.26.0.1.43445 > 112.26.0.8.36004: Flags [.], seq 272561:273989, ack 1, win 4017, options [nop,nop,TS val 134512 ecr 4294888081,mptcp dss ack 1720219151 seq 3867212463 subseq 272561 len 1428 csum 0x802], length 1428
10:17:40.222918 IP 112.26.0.1.43445 > 112.26.0.8.36004: Flags [.], seq 266849:268277, ack 1, win 4017, options [nop,nop,TS val 133942 ecr 4294887607,mptcp dss ack 1720219151 seq 3867185331 subseq 266849 len 1428 csum 0x8062], length 1428
10:17:40.228794 IP 112.26.0.8.36004 > 112.26.0.1.43445: Flags [.], ack 261137, win 24193, options [nop,nop,TS val 4294888130 ecr 133171,mptcp dss ack 3867078231], length 0
10:17:40.255139 IP 112.26.0.1.43445 > 112.26.0.8.36004: Flags [.], seq 273989:275417, ack 1, win 4017, options [nop,nop,TS val 134605 ecr 4294888130,mptcp dss ack 1720219151 seq 3867216747 subseq 273989 len 1428 csum 0xddeb], length 1428
10:17:40.275018 IP 112.26.0.8.36004 > 112.26.0.1.43445: Flags [.], ack 262565, win 24193, options [nop,nop,TS val 4294888285 ecr 133171,mptcp dss ack 3867078231], length 0
10:17:40.316473 IP 112.26.0.8.36004 > 112.26.0.1.43445: Flags [.], ack 268277, win 24193, options [nop,nop,TS val 4294888968 ecr 133942,mptcp dss ack 3867078231], length 0
10:17:40.323516 IP 112.26.0.8.36004 > 112.26.0.1.43445: Flags [.], ack 262565, win 24193, options [nop,nop,TS val 4294888285 ecr 133171,mptcp dss ack 3867078231], length 0
10:17:40.328790 IP 112.26.0.1.43445 > 112.26.0.8.36004: Flags [.], seq 275417:276845, ack 1, win 4017, options [nop,nop,TS val 134700 ecr 4294888285,mptcp dss ack 1720219151 seq 3867219603 subseq 275417 len 1428 csum 0x5596], length 1428
10:17:40.363964 IP 112.26.0.8.36004 > 112.26.0.1.43445: Flags [.], ack 263993, win 24193, options [nop,nop,TS val 4294888355 ecr 133308,mptcp dss ack 3867078231], length 0
10:17:40.422454 IP 112.26.0.8.36004 > 112.26.0.1.43445: Flags [.], ack 263993, win 24193, options [nop,nop,TS val 4294888355 ecr 133308,mptcp dss ack 3867078231], length 0
10:17:40.446686 IP 112.26.0.1.43445 > 112.26.0.8.36004: Flags [.], seq 268277:269705, ack 1, win 4017, options [nop,nop,TS val 134143 ecr 4294887794,mptcp dss ack 1720219151 seq 3867191043 subseq 268277 len 1428 csum 0xc5e0], length 1428
10:17:40.466597 IP 112.26.0.1.43445 > 112.26.0.8.36004: Flags [.], seq 276845:278273, ack 1, win 4017, options [nop,nop,TS val 134700 ecr 4294888285,mptcp dss ack 1720219151 seq 3867221031 subseq 276845 len 1428 csum 0x3f78], length 1428
10:17:40.487149 IP 112.26.0.1.43445 > 112.26.0.8.36004: Flags [.], seq 269705:271133, ack 1, win 4017, options [nop,nop,TS val 134245 ecr 4294887835,mptcp dss ack 1720219151 seq 3867198183 subseq 269705 len 1428 csum 0xc9d7], length 1428
10:17:40.563002 IP 112.26.0.8.36004 > 112.26.0.1.43445: Flags [.], ack 265421, win 24193, options [nop,nop,TS val 4294888594 ecr 133441,mptcp dss ack 3867078231], length 0
10:17:40.565146 IP 112.26.0.8.36004 > 112.26.0.1.43445: Flags [.], ack 265421, win 24193, options [nop,nop,TS val 4294888594 ecr 133441,mptcp dss ack 3867078231], length 0
10:17:40.604625 IP 112.26.0.1.43445 > 112.26.0.8.36004: Flags [.], seq 278273:279701, ack 1, win 4017, options [nop,nop,TS val 134799 ecr 4294888355,mptcp dss ack 1720219151 seq 3867228171 subseq 278273 len 1428 csum 0x9ab5], length 1428
10:17:40.611908 IP 112.26.0.8.36004 > 112.26.0.1.43445: Flags [.], ack 271133, win 24193, options [nop,nop,TS val 4294889264 ecr 134143,mptcp dss ack 3867078231], length 0
10:17:40.630810 IP 112.26.0.8.36004 > 112.26.0.1.43445: Flags [.], ack 266849, win 24193, options [nop,nop,TS val 4294888708 ecr 133661,mptcp dss ack 3867078231], length 0
10:17:40.673866 IP 112.26.0.8.36004 > 112.26.0.1.43445: Flags [.], ack 266849, win 24193, options [nop,nop,TS val 4294888708 ecr 133661,mptcp dss ack 3867078231], length 0
10:17:40.701741 IP 112.26.0.1.43445 > 112.26.0.8.36004: Flags [.], seq 279701:281129, ack 1, win 4017, options [nop,nop,TS val 134942 ecr 4294888594,mptcp dss ack 1720219151 seq 3867231027 subseq 279701 len 1428 csum 0x99f8], length 1428
10:17:40.712642 IP 112.26.0.1.43445 > 112.26.0.8.36004: Flags [.], seq 271133:272561, ack 1, win 4017, options [nop,nop,TS val 134426 ecr 4294888010,mptcp dss ack 1720219151 seq 3867205323 subseq 271133 len 1428 csum 0xb40d], length 1428
10:17:40.745836 IP 112.26.0.1.43445 > 112.26.0.8.36004: Flags [.], seq 281129:282557, ack 1, win 4017, options [nop,nop,TS val 135050 ecr 4294888708,mptcp dss ack 1720219151 seq 3867233883 subseq 281129 len 1428 csum 0xcdbc], length 1428
10:17:40.780696 IP 112.26.0.1.43445 > 112.26.0.8.36004: Flags [.], seq 272561:273989, ack 1, win 4017, options [nop,nop,TS val 134512 ecr 4294888081,mptcp dss ack 1720219151 seq 3867212463 subseq 272561 len 1428 csum 0x802], length 1428
10:17:40.883347 IP 112.26.0.1.43445 > 112.26.0.8.36004: Flags [.], seq 273989:275417, ack 1, win 4017, options [nop,nop,TS val 134605 ecr 4294888130,mptcp dss ack 1720219151 seq 3867216747 subseq 273989 len 1428 csum 0xddeb], length 1428
10:17:40.914872 IP 112.26.0.8.36004 > 112.26.0.1.43445: Flags [.], ack 268277, win 24193, options [nop,nop,TS val 4294888968 ecr 133942,mptcp dss ack 3867078231], length 0
10:17:40.917187 IP 112.26.0.8.36004 > 112.26.0.1.43445: Flags [.], ack 268277, win 24193, options [nop,nop,TS val 4294888968 ecr 133942,mptcp dss ack 3867078231], length 0
10:17:40.937513 IP 112.26.0.1.43445 > 112.26.0.8.36004: Flags [.], seq 282557:283985, ack 1, win 4017, options [nop,nop,TS val 135293 ecr 4294888968,mptcp dss ack 1720219151 seq 3867246735 subseq 282557 len 1428 csum 0x3f2b], length 1428
10:17:40.956141 IP 112.26.0.8.36004 > 112.26.0.1.43445: Flags [.], ack 275417, win 23009, options [nop,nop,TS val 4294889605 ecr 134426,mptcp dss ack 3867219603], length 0
10:17:41.022263 IP 112.26.0.1.43445 > 112.26.0.8.36004: Flags [.], seq 275417:276845, ack 1, win 4017, options [nop,nop,TS val 134700 ecr 4294888285,mptcp dss ack 1720219151 seq 3867219603 subseq 275417 len 1428 csum 0x5596], length 1428
10:17:41.025981 IP 112.26.0.8.36004 > 112.26.0.1.43445: Flags [.], ack 276845, win 24319, options [nop,nop,TS val 4294889679 ecr 134700,mptcp dss ack 3867221031], length 0
10:17:41.079548 IP 112.26.0.1.43445 > 112.26.0.8.36004: Flags [.], seq 276845:278273, ack 1, win 4017, options [nop,nop,TS val 134700 ecr 4294888285,mptcp dss ack 1720219151 seq 3867221031 subseq 276845 len 1428 csum 0x3f78], length 1428
10:17:41.139361 IP 112.26.0.8.36004 > 112.26.0.1.43445: Flags [.], ack 278273, win 24455, options [nop,nop,TS val 4294889736 ecr 134700,mptcp dss ack 3867226743], length 0
10:17:41.162421 IP 112.26.0.1.43445 > 112.26.0.8.36004: Flags [.], seq 278273:279701, ack 1, win 4017, options [nop,nop,TS val 134799 ecr 4294888355,mptcp dss ack 1720219151 seq 3867228171 subseq 278273 len 1428 csum 0x9ab5], length 1428
10:17:41.210908 IP 112.26.0.8.36004 > 112.26.0.1.43445: Flags [.], ack 271133, win 24193, options [nop,nop,TS val 4294889264 ecr 134143,mptcp dss ack 3867078231], length 0
10:17:41.213249 IP 112.26.0.8.36004 > 112.26.0.1.43445: Flags [.], ack 271133, win 24193, options [nop,nop,TS val 4294889264 ecr 134143,mptcp dss ack 3867078231], length 0
10:17:41.271603 IP 112.26.0.8.36004 > 112.26.0.1.43445: Flags [.], ack 279701, win 24547, options [nop,nop,TS val 4294889860 ecr 134799,mptcp dss ack 3867231027], length 0
