10:17:05.053326 IP 112.26.0.8.36004 > 112.26.0.1.43445: Flags [S], seq 604036043, win 65535, options [mss 1460,sackOK,TS val 4294851649 ecr 0,nop,wscale 6,mptcp capable csum {0x5fe731cb2a0ffaa8}], length 0
10:17:05.153511 IP 112.26.0.8.36004 > 112.26.0.1.43445: Flags [S], seq 604036043, win 65535, options [mss 1460,sackOK,TS val 4294851649 ecr 0,nop,wscale 6,mptcp capable csum {0x5fe731cb2a0ffaa8}], length 0
10:17:05.165781 IP 112.26.0.8.36004 > 112.26.0.1.43445: Flags [S], seq 604036043, win 65535, options [mss 1460,sackOK,TS val 4294851649 ecr 0,nop,wscale 6,mptcp capable csum {0x5fe731cb2a0ffaa8}], length 0
10:17:05.355815 IP 112.26.0.1.43445 > 112.26.0.8.36004: Flags [S.], seq 3411350881, ack 604036044, win 65535, options [mss 1460,sackOK,TS val 99544 ecr 4294851649,nop,wscale 6,mptcp capable csum {0x95b44a60aabf03a2}], length 0
10:17:05.454224 IP 112.26.0.1.43445 > 112.26.0.8.36004: Flags [S.], seq 3411350881, ack 604036044, win 65535, options [mss 1460,sackOK,TS val 99544 ecr 4294851649,nop,wscale 6,mptcp capable csum {0x95b44a60aabf03a2}], length 0
10:17:05.465874 IP 112.26.0.8.36004 > 112.26.0.1.43445: Flags [.], ack 1, win 1369, options [nop,nop,TS val 4294854113 ecr 99544,mptcp capable csum {0x5fe731cb2a0ffaa8,0x95b44a60aabf03a2},mptcp dss ack 3866414399], length 0
10:17:05.466112 IP 112.26.0.8.36004 > 112.26.0.1.43445: Flags [.], ack 1, win 1369, options [nop,nop,TS val 4294854113 ecr 99544,mptcp capable csum {0x5fe731cb2a0ffaa8,0x95b44a60aabf03a2},mptcp dss ack 3866414399], length 0
10:17:35.680863 IP 112.26.0.8.36004 > 112.26.0.1.43445: Flags [.], ack 216869, win 21353, options [nop,nop,TS val 4294883551 ecr 128567,mptcp dss ack 3866908299], length 0
10:17:35.706842 IP 112.26.0.1.43445 > 112.26.0.8.36004: Flags [.], seq 232577:234005, ack 1, win 4017, options [nop,nop,TS val 129786 ecr 4294883227,mptcp dss ack 1720219151 seq 3867001119 subseq 232577 len 1428 csum 0x9fb2], length 1428
10:17:35.707061 IP 112.26.0.1.43445 > 112.26.0.8.36004: Flags [.], seq 232577:234005, ack 1, win 4017, options [nop,nop,TS val 129786 ecr 4294883227,mptcp dss ack 1720219151 seq 3867001119 subseq 232577 len 1428 csum 0x9fb2], length 1428
10:17:35.739729 IP 112.26.0.8.36004 > 112.26.0.1.43445: Flags [.], ack 216869, win 22357, options [nop,nop,TS val 4294884394 ecr 128567,nop,nop,sack 1 {218297:224009},mptcp dss ack 3866952567], length 0
10:17:35.739928 IP 112.26.0.8.36004 > 112.26.0.1.43445: Flags [.], ack 216869, win 22357, options [nop,nop,TS val 4294884394 ecr 128567,nop,nop,sack 1 {218297:224009},mptcp dss ack 3866952567], length 0
10:17:35.789400 IP 112.26.0.1.43445 > 112.26.0.8.36004: Flags [.], seq 234005:235433, ack 1, win 4017, options [nop,nop,TS val 129963 ecr 4294883307,mptcp dss ack 1720219151 seq 3867008259 subseq 234005 len 1428 csum 0x918d], length 1428
10:17:35.789623 IP 112.26.0.1.43445 > 112.26.0.8.36004: Flags [.], seq 234005:235433, ack 1, win 4017, options [nop,nop,TS val 129963 ecr 4294883307,mptcp dss ack 1720219151 seq 3867008259 subseq 234005 len 1428 csum 0x918d], length 1428
10:17:35.835401 IP 112.26.0.8.36004 > 112.26.0.1.43445: Flags [.], ack 216869, win 22539, options [nop,nop,TS val 4294884490 ecr 128567,nop,nop,sack 1 {218297:225437},mptcp dss ack 3866952567], length 0
10:17:35.835581 IP 112.26.0.8.36004 > 112.26.0.1.43445: Flags [.], ack 216869, win 22539, options [nop,nop,TS val 4294884490 ecr 128567,nop,nop,sack 1 {218297:225437},mptcp dss ack 3866952567], length 0
10:17:35.877499 IP 112.26.0.1.43445 > 112.26.0.8.36004: Flags [.], seq 235433:236861, ack 1, win 4017, options [nop,nop,TS val 130057 ecr 4294883551,mptcp dss ack 1720219151 seq 3867013971 subseq 235433 len 1428 csum 0x1672], length 1428
10:17:35.877692 IP 112.26.0.1.43445 > 112.26.0.8.36004: Flags [.], seq 235433:236861, ack 1, win 4017, options [nop,nop,TS val 130057 ecr 4294883551,mptcp dss ack 1720219151 seq 3867013971 subseq 235433 len 1428 csum 0x1672], length 1428
10:17:35.936617 IP 112.26.0.8.36004 > 112.26.0.1.43445: Flags [.], ack 216869, win 22585, options [nop,nop,TS val 4294884576 ecr 128567,nop,nop,sack 1 {218297:226865},mptcp dss ack 3866952567], length 0
10:17:35.936826 IP 112.26.0.8.36004 > 112.26.0.1.43445: Flags [.], ack 216869, win 22585, options [nop,nop,TS val 4294884576 ecr 128567,nop,nop,sack 1 {218297:226865},mptcp dss ack 3866952567], length 0
10:17:35.999701 IP 112.26.0.8.36004 > 112.26.0.1.43445: Flags [.], ack 216869, win 22767, options [nop,nop,TS val 4294884642 ecr 128567,nop,nop,sack 1 {218297:228293},mptcp dss ack 3866952567], length 0
10:17:35.999901 IP 112.26.0.8.36004 > 112.26.0.1.43445: Flags [.], ack 216869, win 22767, options [nop,nop,TS val 4294884642 ecr 128567,nop,nop,sack 1 {218297:228293},mptcp dss ack 3866952567], length 0
10:17:36.080767 IP 112.26.0.8.36004 > 112.26.0.1.43445: Flags [.], ack 216869, win 21718, options [nop,nop,TS val 4294883936 ecr 128567,nop,nop,sack 1 {218297:219725},mptcp dss ack 3866908299], length 0
10:17:36.104846 IP 112.26.0.1.43445 > 112.26.0.8.36004: Flags [.], seq 236861:238289, ack 1, win 4017, options [nop,nop,TS val 130471 ecr 4294883936,mptcp dss ack 1720219151 seq 3867029679 subseq 236861 len 1428 csum 0x6434], length 1428
10:17:36.105053 IP 112.26.0.1.43445 > 112.26.0.8.36004: Flags [.], seq 236861:238289, ack 1, win 4017, options [nop,nop,TS val 130471 ecr 4294883936,mptcp dss ack 1720219151 seq 3867029679 subseq 236861 len 1428 csum 0x6434], length 1428
10:17:36.136299 IP 112.26.0.8.36004 > 112.26.0.1.43445: Flags [.], ack 216869, win 22904, options [nop,nop,TS val 4294884791 ecr 128567,nop,nop,sack 2 {229721:231149}{218297:228293},mptcp dss ack 3866952567], length 0
10:17:36.136504 IP 112.26.0.8.36004 > 112.26.0.1.43445: Flags [.], ack 216869, win 22904, options [nop,nop,TS val 4294884791 ecr 128567,nop,nop,sack 2 {229721:231149}{218297:228293},mptcp dss ack 3866952567], length 0
10:17:36.204511 IP 112.26.0.8.36004 > 112.26.0.1.43445: Flags [.], ack 216869, win 22083, options [nop,nop,TS val 4294884159 ecr 128567,nop,nop,sack 1 {218297:221153},mptcp dss ack 3866952567], length 0
10:17:36.225615 IP 112.26.0.1.43445 > 112.26.0.8.36004: Flags [.], seq 238289:239717, ack 1, win 4017, options [nop,nop,TS val 130596 ecr 4294884159,mptcp dss ack 1720219151 seq 3867038247 subseq 238289 len 1428 csum 0x3db], length 1428
10:17:36.225831 IP 112.26.0.1.43445 > 112.26.0.8.36004: Flags [.], seq 238289:239717, ack 1, win 4017, options [nop,nop,TS val 130596 ecr 4294884159,mptcp dss ack 1720219151 seq 3867038247 subseq 238289 len 1428 csum 0x3db], length 1428
10:17:36.253093 IP 112.26.0.8.36004 > 112.26.0.1.43445: Flags [.], ack 216869, win 23087, options [nop,nop,TS val 4294884908 ecr 128567,nop,nop,sack 2 {229721:232577}{218297:228293},mptcp dss ack 3866952567], length 0
10:17:36.253277 IP 112.26.0.8.36004 > 112.26.0.1.43445: Flags [.], ack 216869, win 23087, options [nop,nop,TS val 4294884908 ecr 128567,nop,nop,sack 2 {229721:232577}{218297:228293},mptcp dss ack 3866952567], length 0
10:17:36.349229 IP 112.26.0.8.36004 > 112.26.0.1.43445: Flags [.], ack 216869, win 22174, options [nop,nop,TS val 4294884264 ecr 128567,nop,nop,sack 1 {218297:222581},mptcp dss ack 3866952567], length 0
10:17:36.378092 IP 112.26.0.1.43445 > 112.26.0.8.36004: Flags [.], seq 216869:218297, ack 1, win 4017, options [nop,nop,TS val 130725 ecr 4294884264,mptcp dss ack 1720219151 seq 3866952567 subseq 216869 len 1428 csum 0xf797], length 1428
10:17:36.378297 IP 112.26.0.1.43445 > 112.26.0.8.36004: Flags [.], seq 216869:218297, ack 1, win 4017, options [nop,nop,TS val 130725 ecr 4294884264,mptcp dss ack 1720219151 seq 3866952567 subseq 216869 len 1428 csum 0xf797], length 1428
10:17:36.433920 IP 112.26.0.8.36004 > 112.26.0.1.43445: Flags [.], ack 216869, win 23315, options [nop,nop,TS val 4294885089 ecr 128567,nop,nop,sack 2 {229721:234005}{218297:228293},mptcp dss ack 3866952567], length 0
10:17:36.434087 IP 112.26.0.8.36004 > 112.26.0.1.43445: Flags [.], ack 216869, win 23315, options [nop,nop,TS val 4294885089 ecr 128567,nop,nop,sack 2 {229721:234005}{218297:228293},mptcp dss ack 3866952567], length 0
10:17:36.517251 IP 112.26.0.8.36004 > 112.26.0.1.43445: Flags [.], ack 216869, win 23497, options [nop,nop,TS val 4294885160 ecr 128567,nop,nop,sack 2 {229721:235433}{218297:228293},mptcp dss ack 3866952567], length 0
10:17:36.517448 IP 112.26.0.8.36004 > 112.26.0.1.43445: Flags [.], ack 216869, win 23497, options [nop,nop,TS val 4294885160 ecr 128567,nop,nop,sack 2 {229721:235433}{218297:228293},mptcp dss ack 3866952567], length 0
10:17:36.583894 IP 112.26.0.8.36004 > 112.26.0.1.43445: Flags [.], ack 216869, win 23634, options [nop,nop,TS val 4294885236 ecr 128567,nop,nop,sack 2 {229721:236861}{218297:228293},mptcp dss ack 3866952567], length 0
10:17:36.584061 IP 112.26.0.8.36004 > 112.26.0.1.43445: Flags [.], ack 216869, win 23634, options [nop,nop,TS val 4294885236 ecr 128567,nop,nop,sack 2 {229721:236861}{218297:228293},mptcp dss ack 3866952567], length 0
10:17:36.656188 IP 112.26.0.8.36004 > 112.26.0.1.43445: Flags [.], ack 216869, win 22585, options [nop,nop,TS val 4294884576 ecr 128567,nop,nop,sack 1 {218297:226865},mptcp dss ack 3866952567], length 0
10:17:36.708944 IP 112.26.0.8.36004 > 112.26.0.1.43445: Flags [.], ack 216869, win 22767, options [nop,nop,TS val 4294884642 ecr 128567,nop,nop,sack 1 {218297:228293},mptcp dss ack 3866952567], length 0
10:17:36.712457 IP 112.26.0.1.43445 > 112.26.0.8.36004: Flags [.], seq 239717:241145, ack 1, win 4017, options [nop,nop,TS val 131074 ecr 4294884576,mptcp dss ack 1720219151 seq 3867055383 subseq 239717 len 1428 csum 0xa48c], length 1428
10:17:36.712677 IP 112.26.0.1.43445 > 112.26.0.8.36004: Flags [.], seq 239717:241145, ack 1, win 4017, options [nop,nop,TS val 131074 ecr 4294884576,mptcp dss ack 1720219151 seq 3867055383 subseq 239717 len 1428 csum 0xa48c], length 1428
10:17:36.801376 IP 112.26.0.8.36004 > 112.26.0.1.43445: Flags [.], ack 216869, win 23883, options [nop,nop,TS val 4294885454 ecr 128567,nop,nop,sack 2 {229721:238289}{218297:228293},mptcp dss ack 3866952567], length 0
10:17:36.801545 IP 112.26.0.8.36004 > 112.26.0.1.43445: Flags [.], ack 216869, win 23883, options [nop,nop,TS val 4294885454 ecr 128567,nop,nop,sack 2 {229721:238289}{218297:228293},mptcp dss ack 3866952567], length 0
10:17:36.895420 IP 112.26.0.8.36004 > 112.26.0.1.43445: Flags [.], ack 216869, win 23883, options [nop,nop,TS val 4294885549 ecr 128567,nop,nop,sack 2 {229721:239717}{218297:228293},mptcp dss ack 3866952567], length 0
10:17:36.895611 IP 112.26.0.8.36004 > 112.26.0.1.43445: Flags [.], ack 216869, win 23883, options [nop,nop,TS val 4294885549 ecr 128567,nop,nop,sack 2 {229721:239717}{218297:228293},mptcp dss ack 3866952567], length 0
10:17:36.934421 IP 112.26.0.1.43445 > 112.26.0.8.36004: Flags [.], seq 241145:242573, ack 1, win 4017, options [nop,nop,TS val 131074 ecr 4294884576,mptcp dss ack 1720219151 seq 3867056811 subseq 241145 len 1428 csum 0x7795], length 1428
10:17:36.934700 IP 112.26.0.1.43445 > 112.26.0.8.36004: Flags [.], seq 241145:242573, ack 1, win 4017, options [nop,nop,TS val 131074 ecr 4294884576,mptcp dss ack 1720219151 seq 3867056811 subseq 241145 len 1428 csum 0x7795], length 1428
10:17:36.982404 IP 112.26.0.1.43445 > 112.26.0.8.36004: Flags [.], seq 242573:244001, ack 1, win 4017, options [nop,nop,TS val 131152 ecr 4294884642,mptcp dss ack 1720219151 seq 3867061095 subseq 242573 len 1428 csum 0x3c9a], length 1428
10:17:36.982552 IP 112.26.0.1.43445 > 112.26.0.8.36004: Flags [.], seq 242573:244001, ack 1, win 4017, options [nop,nop,TS val 131152 ecr 4294884642,mptcp dss ack 1720219151 seq 3867061095 subseq 242573 len 1428 csum 0x3c9a], length 1428
10:17:37.005768 IP 112.26.0.8.36004 > 112.26.0.1.43445: Flags [.], ack 228293, win 23720, options [nop,nop,TS val 4294885661 ecr 130725,nop,nop,sack 1 {229721:239717},mptcp dss ack 3866989695], length 0
10:17:37.005949 IP 112.26.0.8.36004 > 112.26.0.1.43445: Flags [.], ack 228293, win 23720, options [nop,nop,TS val 4294885661 ecr 130725,nop,nop,sack 1 {229721:239717},mptcp dss ack 3866989695], length 0
10:17:37.054645 IP 112.26.0.8.36004 > 112.26.0.1.43445: Flags [.], ack 216869, win 23315, options [nop,nop,TS val 4294885089 ecr 128567,nop,nop,sack 2 {229721:234005}{218297:228293},mptcp dss ack 3866952567], length 0
10:17:37.083850 IP 112.26.0.1.43445 > 112.26.0.8.36004: Flags [.], seq 228293:229721, ack 1, win 4017, options [nop,nop,TS val 131431 ecr 4294885089,mptcp dss ack 1720219151 seq 3866989695 subseq 228293 len 1428 csum 0x7ab1], length 1428
10:17:37.084031 IP 112.26.0.1.43445 > 112.26.0.8.36004: Flags [.], seq 228293:229721, ack 1, win 4017, options [nop,nop,TS val 131431 ecr 4294885089,mptcp dss ack 1720219151 seq 3866989695 subseq 228293 len 1428 csum 0x7ab1], length 1428
10:17:37.151866 IP 112.26.0.8.36004 > 112.26.0.1.43445: Flags [.], ack 216869, win 23497, options [nop,nop,TS val 4294885160 ecr 128567,nop,nop,sack 2 {229721:235433}{218297:228293},mptcp dss ack 3866952567], length 0
10:17:37.195100 IP 112.26.0.1.43445 > 112.26.0.8.36004: Flags [.], seq 244001:245429, ack 1, win 4017, options [nop,nop,TS val 131563 ecr 4294885160,mptcp dss ack 1720219151 seq 3867081087 subseq 244001 len 1428 csum 0x9dcb], length 1428
10:17:37.195245 IP 112.26.0.1.43445 > 112.26.0.8.36004: Flags [.], seq 244001:245429, ack 1, win 4017, options [nop,nop,TS val 131563 ecr 4294885160,mptcp dss ack 1720219151 seq 3867081087 subseq 244001 len 1428 csum 0x9dcb], length 1428
10:17:37.225435 IP 112.26.0.8.36004 > 112.26.0.1.43445: Flags [.], ack 216869, win 23634, options [nop,nop,TS val 4294885236 ecr 128567,nop,nop,sack 2 {229721:236861}{218297:228293},mptcp dss ack 3866952567], length 0
10:17:37.309371 IP 112.26.0.8.36004 > 112.26.0.1.43445: Flags [.], ack 228293, win 24079, options [nop,nop,TS val 4294885965 ecr 130725,nop,nop,sack 1 {229721:241145},mptcp dss ack 3866989695], length 0
10:17:37.309545 IP 112.26.0.8.36004 > 112.26.0.1.43445: Flags [.], ack 228293, win 24079, options [nop,nop,TS val 4294885965 ecr 130725,nop,nop,sack 1 {229721:241145},mptcp dss ack 3866989695], length 0
10:17:37.362477 IP 112.26.0.1.43445 > 112.26.0.8.36004: Flags [.], seq 245429:246857, ack 1, win 4017, options [nop,nop,TS val 131657 ecr 4294885236,mptcp dss ack 1720219151 seq 3867083943 subseq 245429 len 1428 csum 0x1406], length 1428
10:17:37.362666 IP 112.26.0.1.43445 > 112.26.0.8.36004: Flags [.], seq 245429:246857, ack 1, win 4017, options [nop,nop,TS val 131657 ecr 4294885236,mptcp dss ack 1720219151 seq 3867083943 subseq 245429 len 1428 csum 0x1406], length 1428
10:17:37.379710 IP 112.26.0.8.36004 > 112.26.0.1.43445: Flags [.], ack 216869, win 23883, options [nop,nop,TS val 4294885454 ecr 128567,nop,nop,sack 2 {229721:238289}{218297:228293},mptcp dss ack 3866952567], length 0
10:17:37.445542 IP 112.26.0.1.43445 > 112.26.0.8.36004: Flags [.], seq 246857:248285, ack 1, win 4017, options [nop,nop,TS val 131778 ecr 4294885454,mptcp dss ack 1720219151 seq 3867089655 subseq 246857 len 1428 csum 0x6baf], length 1428
10:17:37.445700 IP 112.26.0.1.43445 > 112.26.0.8.36004: Flags [.], seq 246857:248285, ack 1, win 4017, options [nop,nop,TS val 131778 ecr 4294885454,mptcp dss ack 1720219151 seq 3867089655 subseq 246857 len 1428 csum 0x6baf], length 1428
10:17:37.545400 IP 112.26.0.8.36004 > 112.26.0.1.43445: Flags [.], ack 216869, win 23883, options [nop,nop,TS val 4294885549 ecr 128567,nop,nop,sack 2 {229721:239717}{218297:228293},mptcp dss ack 3866952567], length 0
10:17:37.563872 IP 112.26.0.1.43445 > 112.26.0.8.36004: Flags [.], seq 248285:249713, ack 1, win 4017, options [nop,nop,TS val 131932 ecr 4294885549,mptcp dss ack 1720219151 seq 3867096795 subseq 248285 len 1428 csum 0x620f], length 1428
10:17:37.564057 IP 112.26.0.1.43445 > 112.26.0.8.36004: Flags [.], seq 248285:249713, ack 1, win 4017, options [nop,nop,TS val 131932 ecr 4294885549,mptcp dss ack 1720219151 seq 3867096795 subseq 248285 len 1428 csum 0x620f], length 1428
10:17:37.616523 IP 112.26.0.8.36004 > 112.26.0.1.43445: Flags [.], ack 228293, win 24079, options [nop,nop,TS val 4294886272 ecr 130725,nop,nop,sack 1 {229721:242573},mptcp dss ack 3866989695], length 0
10:17:37.616707 IP 112.26.0.8.36004 > 112.26.0.1.43445: Flags [.], ack 228293, win 24079, options [nop,nop,TS val 4294886272 ecr 130725,nop,nop,sack 1 {229721:242573},mptcp dss ack 3866989695], length 0
10:17:37.681286 IP 112.26.0.8.36004 > 112.26.0.1.43445: Flags [.], ack 228293, win 24079, options [nop,nop,TS val 4294886337 ecr 130725,nop,nop,sack 1 {229721:244001},mptcp dss ack 3866989695], length 0
10:17:37.681460 IP 112.26.0.8.36004 > 112.26.0.1.43445: Flags [.], ack 228293, win 24079, options [nop,nop,TS val 4294886337 ecr 130725,nop,nop,sack 1 {229721:244001},mptcp dss ack 3866989695], length 0
10:17:37.761410 IP 112.26.0.8.36004 > 112.26.0.1.43445: Flags [.], ack 228293, win 23720, options [nop,nop,TS val 4294885661 ecr 130725,nop,nop,sack 1 {229721:239717},mptcp dss ack 3866989695], length 0
10:17:37.784829 IP 112.26.0.1.43445 > 112.26.0.8.36004: Flags [.], seq 249713:251141, ack 1, win 4017, options [nop,nop,TS val 132138 ecr 4294885661,mptcp dss ack 1720219151 seq 3867102507 subseq 249713 len 1428 csum 0x6828], length 1428
10:17:37.785011 IP 112.26.0.1.43445 > 112.26.0.8.36004: Flags [.], seq 249713:251141, ack 1, win 4017, options [nop,nop,TS val 132138 ecr 4294885661,mptcp dss ack 1720219151 seq 3867102507 subseq 249713 len 1428 csum 0x6828], length 1428
10:17:37.808910 IP 112.26.0.8.36004 > 112.26.0.1.43445: Flags [.], ack 244001, win 23879, options [nop,nop,TS val 4294886464 ecr 131431,mptcp dss ack 3867002547], length 0
10:17:37.809081 IP 112.26.0.8.36004 > 112.26.0.1.43445: Flags [.], ack 244001, win 23879, options [nop,nop,TS val 4294886464 ecr 131431,mptcp dss ack 3867002547], length 0
10:17:37.894533 IP 112.26.0.8.36004 > 112.26.0.1.43445: Flags [.], ack 245429, win 23879, options [nop,nop,TS val 4294886535 ecr 131563,mptcp dss ack 3867002547], length 0
10:17:37.894716 IP 112.26.0.8.36004 > 112.26.0.1.43445: Flags [.], ack 245429, win 23879, options [nop,nop,TS val 4294886535 ecr 131563,mptcp dss ack 3867002547], length 0
10:17:38.005615 IP 112.26.0.8.36004 > 112.26.0.1.43445: Flags [.], ack 228293, win 24079, options [nop,nop,TS val 4294885965 ecr 130725,nop,nop,sack 1 {229721:241145},mptcp dss ack 3866989695], length 0
10:17:38.056175 IP 112.26.0.8.36004 > 112.26.0.1.43445: Flags [.], ack 246857, win 23879, options [nop,nop,TS val 4294886710 ecr 131657,mptcp dss ack 3867002547], length 0
10:17:38.056346 IP 112.26.0.8.36004 > 112.26.0.1.43445: Flags [.], ack 246857, win 23879, options [nop,nop,TS val 4294886710 ecr 131657,mptcp dss ack 3867002547], length 0
10:17:38.077793 IP 112.26.0.1.43445 > 112.26.0.8.36004: Flags [.], seq 251141:252569, ack 1, win 4017, options [nop,nop,TS val 132415 ecr 4294885965,mptcp dss ack 1720219151 seq 3867109647 subseq 251141 len 1428 csum 0xb1cf], length 1428
10:17:38.077938 IP 112.26.0.1.43445 > 112.26.0.8.36004: Flags [.], seq 251141:252569, ack 1, win 4017, options [nop,nop,TS val 132415 ecr 4294885965,mptcp dss ack 1720219151 seq 3867109647 subseq 251141 len 1428 csum 0xb1cf], length 1428
10:17:38.121998 IP 112.26.0.8.36004 > 112.26.0.1.43445: Flags [.], ack 248285, win 24136, options [nop,nop,TS val 4294886775 ecr 131778,mptcp dss ack 3867048243], length 0
10:17:38.122199 IP 112.26.0.8.36004 > 112.26.0.1.43445: Flags [.], ack 248285, win 24136, options [nop,nop,TS val 4294886775 ecr 131778,mptcp dss ack 3867048243], length 0
10:17:38.208133 IP 112.26.0.8.36004 > 112.26.0.1.43445: Flags [.], ack 249713, win 24164, options [nop,nop,TS val 4294886846 ecr 131932,mptcp dss ack 3867048243], length 0
10:17:38.208333 IP 112.26.0.8.36004 > 112.26.0.1.43445: Flags [.], ack 249713, win 24164, options [nop,nop,TS val 4294886846 ecr 131932,mptcp dss ack 3867048243], length 0
10:17:38.343853 IP 112.26.0.8.36004 > 112.26.0.1.43445: Flags [.], ack 228293, win 24079, options [nop,nop,TS val 4294886272 ecr 130725,nop,nop,sack 1 {229721:242573},mptcp dss ack 3866989695], length 0
10:17:38.390939 IP 112.26.0.1.43445 > 112.26.0.8.36004: Flags [.], seq 252569:253997, ack 1, win 4017, options [nop,nop,TS val 132753 ecr 4294886272,mptcp dss ack 1720219151 seq 3867123927 subseq 252569 len 1428 csum 0x987d], length 1428
10:17:38.391152 IP 112.26.0.1.43445 > 112.26.0.8.36004: Flags [.], seq 252569:253997, ack 1, win 4017, options [nop,nop,TS val 132753 ecr 4294886272,mptcp dss ack 1720219151 seq 3867123927 subseq 252569 len 1428 csum 0x987d], length 1428
10:17:38.408730 IP 112.26.0.8.36004 > 112.26.0.1.43445: Flags [.], ack 228293, win 24079, options [nop,nop,TS val 4294886337 ecr 130725,nop,nop,sack 1 {229721:244001},mptcp dss ack 3866989695], length 0
10:17:38.485753 IP 112.26.0.8.36004 > 112.26.0.1.43445: Flags [.], ack 251141, win 24164, options [nop,nop,TS val 4294887133 ecr 132138,mptcp dss ack 3867048243], length 0
10:17:38.485926 IP 112.26.0.8.36004 > 112.26.0.1.43445: Flags [.], ack 251141, win 24164, options [nop,nop,TS val 4294887133 ecr 132138,mptcp dss ack 3867048243], length 0
10:17:38.517418 IP 112.26.0.1.43445 > 112.26.0.8.36004: Flags [.], seq 253997:255425, ack 1, win 4017, options [nop,nop,TS val 132804 ecr 4294886337,mptcp dss ack 1720219151 seq 3867129639 subseq 253997 len 1428 csum 0x6ae1], length 1428
10:17:38.517610 IP 112.26.0.1.43445 > 112.26.0.8.36004: Flags [.], seq 253997:255425, ack 1, win 4017, options [nop,nop,TS val 132804 ecr 4294886337,mptcp dss ack 1720219151 seq 3867129639 subseq 253997 len 1428 csum 0x6ae1], length 1428
10:17:38.559998 IP 112.26.0.8.36004 > 112.26.0.1.43445: Flags [.], ack 245429, win 23879, options [nop,nop,TS val 4294886535 ecr 131563,mptcp dss ack 3867002547], length 0
10:17:38.621905 IP 112.26.0.1.43445 > 112.26.0.8.36004: Flags [.], seq 255425:256853, ack 1, win 4017, options [nop,nop,TS val 132937 ecr 4294886535,mptcp dss ack 1720219151 seq 3867138207 subseq 255425 len 1428 csum 0x556d], length 1428
10:17:38.622090 IP 112.26.0.1.43445 > 112.26.0.8.36004: Flags [.], seq 255425:256853, ack 1, win 4017, options [nop,nop,TS val 132937 ecr 4294886535,mptcp dss ack 1720219151 seq 3867138207 subseq 255425 len 1428 csum 0x556d], length 1428
10:17:38.663705 IP 112.26.0.8.36004 > 112.26.0.1.43445: Flags [.], ack 246857, win 23879, options [nop,nop,TS val 4294886710 ecr 131657,mptcp dss ack 3867002547], length 0
10:17:38.687773 IP 112.26.0.8.36004 > 112.26.0.1.43445: Flags [.], ack 252569, win 24164, options [nop,nop,TS val 4294887341 ecr 132415,mptcp dss ack 3867048243], length 0
10:17:38.687919 IP 112.26.0.8.36004 > 112.26.0.1.43445: Flags [.], ack 252569, win 24164, options [nop,nop,TS val 4294887341 ecr 132415,mptcp dss ack 3867048243], length 0
10:17:38.709995 IP 112.26.0.1.43445 > 112.26.0.8.36004: Flags [.], seq 256853:258281, ack 1, win 4017, options [nop,nop,TS val 132937 ecr 4294886535,mptcp dss ack 1720219151 seq 3867139635 subseq 256853 len 1428 csum 0x8051], length 1428
10:17:38.710176 IP 112.26.0.1.43445 > 112.26.0.8.36004: Flags [.], seq 256853:258281, ack 1, win 4017, options [nop,nop,TS val 132937 ecr 4294886535,mptcp dss ack 1720219151 seq 3867139635 subseq 256853 len 1428 csum 0x8051], length 1428
10:17:38.794177 IP 112.26.0.8.36004 > 112.26.0.1.43445: Flags [.], ack 248285, win 24136, options [nop,nop,TS val 4294886775 ecr 131778,mptcp dss ack 3867048243], length 0
10:17:38.827286 IP 112.26.0.1.43445 > 112.26.0.8.36004: Flags [.], seq 258281:259709, ack 1, win 4017, options [nop,nop,TS val 133040 ecr 4294886710,mptcp dss ack 1720219151 seq 3867145347 subseq 258281 len 1428 csum 0x171f], length 1428
10:17:38.827464 IP 112.26.0.1.43445 > 112.26.0.8.36004: Flags [.], seq 258281:259709, ack 1, win 4017, options [nop,nop,TS val 133040 ecr 4294886710,mptcp dss ack 1720219151 seq 3867145347 subseq 258281 len 1428 csum 0x171f], length 1428
10:17:38.910065 IP 112.26.0.1.43445 > 112.26.0.8.36004: Flags [.], seq 259709:261137, ack 1, win 4017, options [nop,nop,TS val 133171 ecr 4294886775,mptcp dss ack 1720219151 seq 3867149631 subseq 259709 len 1428 csum 0x48f5], length 1428
10:17:38.910292 IP 112.26.0.1.43445 > 112.26.0.8.36004: Flags [.], seq 259709:261137, ack 1, win 4017, options [nop,nop,TS val 133171 ecr 4294886775,mptcp dss ack 1720219151 seq 3867149631 subseq 259709 len 1428 csum 0x48f5], length 1428
10:17:38.931304 IP 112.26.0.8.36004 > 112.26.0.1.43445: Flags [.], ack 249713, win 24164, options [nop,nop,TS val 4294886846 ecr 131932,mptcp dss ack 3867048243], length 0
10:17:38.952791 IP 112.26.0.8.36004 > 112.26.0.1.43445: Flags [.], ack 253997, win 24193, options [nop,nop,TS val 4294887607 ecr 132753,mptcp dss ack 3867078231], length 0
10:17:38.953001 IP 112.26.0.8.36004 > 112.26.0.1.43445: Flags [.], ack 253997, win 24193, options [nop,nop,TS val 4294887607 ecr 132753,mptcp dss ack 3867078231], length 0
10:17:38.982469 IP 112.26.0.1.43445 > 112.26.0.8.36004: Flags [.], seq 261137:262565, ack 1, win 4017, options [nop,nop,TS val 133171 ecr 4294886775,mptcp dss ack 1720219151 seq 3867151059 subseq 261137 len 1428 csum 0x8d5], length 1428
10:17:38.982689 IP 112.26.0.1.43445 > 112.26.0.8.36004: Flags [.], seq 261137:262565, ack 1, win 4017, options [nop,nop,TS val 133171 ecr 4294886775,mptcp dss ack 1720219151 seq 3867151059 subseq 261137 len 1428 csum 0x8d5], length 1428
10:17:39.064284 IP 112.26.0.8.36004 > 112.26.0.1.43445: Flags [.], ack 251141, win 24164, options [nop,nop,TS val 4294887133 ecr 132138,mptcp dss ack 3867048243], length 0
10:17:39.119408 IP 112.26.0.1.43445 > 112.26.0.8.36004: Flags [.], seq 262565:263993, ack 1, win 4017, options [nop,nop,TS val 133308 ecr 4294886846,mptcp dss ack 1720219151 seq 3867156771 subseq 262565 len 1428 csum 0x66e1], length 1428
10:17:39.119609 IP 112.26.0.1.43445 > 112.26.0.8.36004: Flags [.], seq 262565:263993, ack 1, win 4017, options [nop,nop,TS val 133308 ecr 4294886846,mptcp dss ack 1720219151 seq 3867156771 subseq 262565 len 1428 csum 0x66e1], length 1428
10:17:39.147943 IP 112.26.0.8.36004 > 112.26.0.1.43445: Flags [.], ack 255425, win 24193, options [nop,nop,TS val 4294887794 ecr 132804,mptcp dss ack 3867078231], length 0
10:17:39.148111 IP 112.26.0.8.36004 > 112.26.0.1.43445: Flags [.], ack 255425, win 24193, options [nop,nop,TS val 4294887794 ecr 132804,mptcp dss ack 3867078231], length 0
10:17:39.218674 IP 112.26.0.8.36004 > 112.26.0.1.43445: Flags [.], ack 256853, win 24193, options [nop,nop,TS val 4294887835 ecr 132937,mptcp dss ack 3867078231], length 0
10:17:39.218904 IP 112.26.0.8.36004 > 112.26.0.1.43445: Flags [.], ack 256853, win 24193, options [nop,nop,TS val 4294887835 ecr 132937,mptcp dss ack 3867078231], length 0
10:17:39.222180 IP 112.26.0.1.43445 > 112.26.0.8.36004: Flags [.], seq 263993:265421, ack 1, win 4017, options [nop,nop,TS val 133441 ecr 4294887133,mptcp dss ack 1720219151 seq 3867162483 subseq 263993 len 1428 csum 0xfc4], length 1428
10:17:39.222361 IP 112.26.0.1.43445 > 112.26.0.8.36004: Flags [.], seq 263993:265421, ack 1, win 4017, options [nop,nop,TS val 133441 ecr 4294887133,mptcp dss ack 1720219151 seq 3867162483 subseq 263993 len 1428 csum 0xfc4], length 1428
10:17:39.299254 IP 112.26.0.1.43445 > 112.26.0.8.36004: Flags [.], seq 265421:266849, ack 1, win 4017, options [nop,nop,TS val 133661 ecr 4294887341,mptcp dss ack 1720219151 seq 3867175335 subseq 265421 len 1428 csum 0x9509], length 1428
10:17:39.299466 IP 112.26.0.1.43445 > 112.26.0.8.36004: Flags [.], seq 265421:266849, ack 1, win 4017, options [nop,nop,TS val 133661 ecr 4294887341,mptcp dss ack 1720219151 seq 3867175335 subseq 265421 len 1428 csum 0x9509], length 1428
10:17:39.300153 IP 112.26.0.8.36004 > 112.26.0.1.43445: Flags [.], ack 252569, win 24164, options [nop,nop,TS val 4294887341 ecr 132415,mptcp dss ack 3867048243], length 0
10:17:39.355263 IP 112.26.0.8.36004 > 112.26.0.1.43445: Flags [.], ack 258281, win 24193, options [nop,nop,TS val 4294888010 ecr 132937,mptcp dss ack 3867078231], length 0
10:17:39.355462 IP 112.26.0.8.36004 > 112.26.0.1.43445: Flags [.], ack 258281, win 24193, options [nop,nop,TS val 4294888010 ecr 132937,mptcp dss ack 3867078231], length 0
10:17:39.428833 IP 112.26.0.8.36004 > 112.26.0.1.43445: Flags [.], ack 259709, win 24193, options [nop,nop,TS val 4294888081 ecr 133040,mptcp dss ack 3867078231], length 0
10:17:39.429034 IP 112.26.0.8.36004 > 112.26.0.1.43445: Flags [.], ack 259709, win 24193, options [nop,nop,TS val 4294888081 ecr 133040,mptcp dss ack 3867078231], length 0
10:17:39.475277 IP 112.26.0.8.36004 > 112.26.0.1.43445: Flags [.], ack 261137, win 24193, options [nop,nop,TS val 4294888130 ecr 133171,mptcp dss ack 3867078231], length 0
10:17:39.475479 IP 112.26.0.8.36004 > 112.26.0.1.43445: Flags [.], ack 261137, win 24193, options [nop,nop,TS val 4294888130 ecr 133171,mptcp dss ack 3867078231], length 0
10:17:39.565901 IP 112.26.0.8.36004 > 112.26.0.1.43445: Flags [.], ack 253997, win 24193, options [nop,nop,TS val 4294887607 ecr 132753,mptcp dss ack 3867078231], length 0
10:17:39.579631 IP 112.26.0.1.43445 > 112.26.0.8.36004: Flags [.], seq 266849:268277, ack 1, win 4017, options [nop,nop,TS val 133942 ecr 4294887607,mptcp dss ack 1720219151 seq 3867185331 subseq 266849 len 1428 csum 0x8062], length 1428
10:17:39.579840 IP 112.26.0.1.43445 > 112.26.0.8.36004: Flags [.], seq 266849:268277, ack 1, win 4017, options [nop,nop,TS val 133942 ecr 4294887607,mptcp dss ack 1720219151 seq 3867185331 subseq 266849 len 1428 csum 0x8062], length 1428
10:17:39.629810 IP 112.26.0.8.36004 > 112.26.0.1.43445: Flags [.], ack 262565, win 24193, options [nop,nop,TS val 4294888285 ecr 133171,mptcp dss ack 3867078231], length 0
10:17:39.629975 IP 112.26.0.8.36004 > 112.26.0.1.43445: Flags [.], ack 262565, win 24193, options [nop,nop,TS val 4294888285 ecr 133171,mptcp dss ack 3867078231], length 0
10:17:39.699933 IP 112.26.0.8.36004 > 112.26.0.1.43445: Flags [.], ack 263993, win 24193, options [nop,nop,TS val 4294888355 ecr 133308,mptcp dss ack 3867078231], length 0
10:17:39.700132 IP 112.26.0.8.36004 > 112.26.0.1.43445: Flags [.], ack 263993, win 24193, options [nop,nop,TS val 4294888355 ecr 133308,mptcp dss ack 3867078231], length 0
10:17:39.766779 IP 112.26.0.8.36004 > 112.26.0.1.43445: Flags [.], ack 255425, win 24193, options [nop,nop,TS val 4294887794 ecr 132804,mptcp dss ack 3867078231], length 0
10:17:39.778411 IP 112.26.0.1.43445 > 112.26.0.8.36004: Flags [.], seq 268277:269705, ack 1, win 4017, options [nop,nop,TS val 134143 ecr 4294887794,mptcp dss ack 1720219151 seq 3867191043 subseq 268277 len 1428 csum 0xc5e0], length 1428
10:17:39.778627 IP 112.26.0.1.43445 > 112.26.0.8.36004: Flags [.], seq 268277:269705, ack 1, win 4017, options [nop,nop,TS val 134143 ecr 4294887794,mptcp dss ack 1720219151 seq 3867191043 subseq 268277 len 1428 csum 0xc5e0], length 1428
10:17:39.867972 IP 112.26.0.8.36004 > 112.26.0.1.43445: Flags [.], ack 256853, win 24193, options [nop,nop,TS val 4294887835 ecr 132937,mptcp dss ack 3867078231], length 0
10:17:39.876857 IP 112.26.0.1.43445 > 112.26.0.8.36004: Flags [.], seq 269705:271133, ack 1, win 4017, options [nop,nop,TS val 134245 ecr 4294887835,mptcp dss ack 1720219151 seq 3867198183 subseq 269705 len 1428 csum 0xc9d7], length 1428
10:17:39.877032 IP 112.26.0.1.43445 > 112.26.0.8.36004: Flags [.], seq 269705:271133, ack 1, win 4017, options [nop,nop,TS val 134245 ecr 4294887835,mptcp dss ack 1720219151 seq 3867198183 subseq 269705 len 1428 csum 0xc9d7], length 1428
10:17:39.938602 IP 112.26.0.8.36004 > 112.26.0.1.43445: Flags [.], ack 265421, win 24193, options [nop,nop,TS val 4294888594 ecr 133441,mptcp dss ack 3867078231], length 0
10:17:39.938755 IP 112.26.0.8.36004 > 112.26.0.1.43445: Flags [.], ack 265421, win 24193, options [nop,nop,TS val 4294888594 ecr 133441,mptcp dss ack 3867078231], length 0
10:17:40.049485 IP 112.26.0.8.36004 > 112.26.0.1.43445: Flags [.], ack 258281, win 24193, options [nop,nop,TS val 4294888010 ecr 132937,mptcp dss ack 3867078231], length 0
10:17:40.056713 IP 112.26.0.8.36004 > 112.26.0.1.43445: Flags [.], ack 266849, win 24193, options [nop,nop,TS val 4294888708 ecr 133661,mptcp dss ack 3867078231], length 0
10:17:40.056912 IP 112.26.0.8.36004 > 112.26.0.1.43445: Flags [.], ack 266849, win 24193, options [nop,nop,TS val 4294888708 ecr 133661,mptcp dss ack 3867078231], length 0
10:17:40.080164 IP 112.26.0.1.43445 > 112.26.0.8.36004: Flags [.], seq 271133:272561, ack 1, win 4017, options [nop,nop,TS val 134426 ecr 4294888010,mptcp dss ack 1720219151 seq 3867205323 subseq 271133 len 1428 csum 0xb40d], length 1428
10:17:40.080428 IP 112.26.0.1.43445 > 112.26.0.8.36004: Flags [.], seq 271133:272561, ack 1, win 4017, options [nop,nop,TS val 134426 ecr 4294888010,mptcp dss ack 1720219151 seq 3867205323 subseq 271133 len 1428 csum 0xb40d], length 1428
10:17:40.135450 IP 112.26.0.8.36004 > 112.26.0.1.43445: Flags [.], ack 259709, win 24193, options [nop,nop,TS val 4294888081 ecr 133040,mptcp dss ack 3867078231], length 0
10:17:40.173452 IP 112.26.0.1.43445 > 112.26.0.8.36004: Flags [.], seq 272561:273989, ack 1, win 4017, options [nop,nop,TS val 134512 ecr 4294888081,mptcp dss ack 1720219151 seq 3867212463 subseq 272561 len 1428 csum 0x802], length 1428
10:17:40.173670 IP 112.26.0.1.43445 > 112.26.0.8.36004: Flags [.], seq 272561:273989, ack 1, win 4017, options [nop,nop,TS val 134512 ecr 4294888081,mptcp dss ack 1720219151 seq 3867212463 subseq 272561 len 1428 csum 0x802], length 1428
10:17:40.228562 IP 112.26.0.8.36004 > 112.26.0.1.43445: Flags [.], ack 261137, win 24193, options [nop,nop,TS val 4294888130 ecr 133171,mptcp dss ack 3867078231], length 0
10:17:40.255249 IP 112.26.0.1.43445 > 112.26.0.8.36004: Flags [.], seq 273989:275417, ack 1, win 4017, options [nop,nop,TS val 134605 ecr 4294888130,mptcp dss ack 1720219151 seq 3867216747 subseq 273989 len 1428 csum 0xddeb], length 1428
10:17:40.255426 IP 112.26.0.1.43445 > 112.26.0.8.36004: Flags [.], seq 273989:275417, ack 1, win 4017, options [nop,nop,TS val 134605 ecr 4294888130,mptcp dss ack 1720219151 seq 3867216747 subseq 273989 len 1428 csum 0xddeb], length 1428
10:17:40.316595 IP 112.26.0.8.36004 > 112.26.0.1.43445: Flags [.], ack 268277, win 24193, options [nop,nop,TS val 4294888968 ecr 133942,mptcp dss ack 3867078231], length 0
10:17:40.316730 IP 112.26.0.8.36004 > 112.26.0.1.43445: Flags [.], ack 268277, win 24193, options [nop,nop,TS val 4294888968 ecr 133942,mptcp dss ack 3867078231], length 0
10:17:40.323298 IP 112.26.0.8.36004 > 112.26.0.1.43445: Flags [.], ack 262565, win 24193, options [nop,nop,TS val 4294888285 ecr 133171,mptcp dss ack 3867078231], length 0
10:17:40.328901 IP 112.26.0.1.43445 > 112.26.0.8.36004: Flags [.], seq 275417:276845, ack 1, win 4017, options [nop,nop,TS val 134700 ecr 4294888285,mptcp dss ack 1720219151 seq 3867219603 subseq 275417 len 1428 csum 0x5596], length 1428
10:17:40.329109 IP 112.26.0.1.43445 > 112.26.0.8.36004: Flags [.], seq 275417:276845, ack 1, win 4017, options [nop,nop,TS val 134700 ecr 4294888285,mptcp dss ack 1720219151 seq 3867219603 subseq 275417 len 1428 csum 0x5596], length 1428
10:17:40.422234 IP 112.26.0.8.36004 > 112.26.0.1.43445: Flags [.], ack 263993, win 24193, options [nop,nop,TS val 4294888355 ecr 133308,mptcp dss ack 3867078231], length 0
10:17:40.466709 IP 112.26.0.1.43445 > 112.26.0.8.36004: Flags [.], seq 276845:278273, ack 1, win 4017, options [nop,nop,TS val 134700 ecr 4294888285,mptcp dss ack 1720219151 seq 3867221031 subseq 276845 len 1428 csum 0x3f78], length 1428
10:17:40.466889 IP 112.26.0.1.43445 > 112.26.0.8.36004: Flags [.], seq 276845:278273, ack 1, win 4017, options [nop,nop,TS val 134700 ecr 4294888285,mptcp dss ack 1720219151 seq 3867221031 subseq 276845 len 1428 csum 0x3f78], length 1428
10:17:40.564925 IP 112.26.0.8.36004 > 112.26.0.1.43445: Flags [.], ack 265421, win 24193, options [nop,nop,TS val 4294888594 ecr 133441,mptcp dss ack 3867078231], length 0
10:17:40.604738 IP 112.26.0.1.43445 > 112.26.0.8.36004: Flags [.], seq 278273:279701, ack 1, win 4017, options [nop,nop,TS val 134799 ecr 4294888355,mptcp dss ack 1720219151 seq 3867228171 subseq 278273 len 1428 csum 0x9ab5], length 1428
10:17:40.604926 IP 112.26.0.1.43445 > 112.26.0.8.36004: Flags [.], seq 278273:279701, ack 1, win 4017, options [nop,nop,TS val 134799 ecr 4294888355,mptcp dss ack 1720219151 seq 3867228171 subseq 278273 len 1428 csum 0x9ab5], length 1428
10:17:40.612023 IP 112.26.0.8.36004 > 112.26.0.1.43445: Flags [.], ack 271133, win 24193, options [nop,nop,TS val 4294889264 ecr 134143,mptcp dss ack 3867078231], length 0
10:17:40.612231 IP 112.26.0.8.36004 > 112.26.0.1.43445: Flags [.], ack 271133, win 24193, options [nop,nop,TS val 4294889264 ecr 134143,mptcp dss ack 3867078231], length 0
10:17:40.673645 IP 112.26.0.8.36004 > 112.26.0.1.43445: Flags [.], ack 266849, win 24193, options [nop,nop,TS val 4294888708 ecr 133661,mptcp dss ack 3867078231], length 0
10:17:40.701853 IP 112.26.0.1.43445 > 112.26.0.8.36004: Flags [.], seq 279701:281129, ack 1, win 4017, options [nop,nop,TS val 134942 ecr 4294888594,mptcp dss ack 1720219151 seq 3867231027 subseq 279701 len 1428 csum 0x99f8], length 1428
10:17:40.702071 IP 112.26.0.1.43445 > 112.26.0.8.36004: Flags [.], seq 279701:281129, ack 1, win 4017, options [nop,nop,TS val 134942 ecr 4294888594,mptcp dss ack 1720219151 seq 3867231027 subseq 279701 len 1428 csum 0x99f8], length 1428
10:17:40.745948 IP 112.26.0.1.43445 > 112.26.0.8.36004: Flags [.], seq 281129:282557, ack 1, win 4017, options [nop,nop,TS val 135050 ecr 4294888708,mptcp dss ack 1720219151 seq 3867233883 subseq 281129 len 1428 csum 0xcdbc], length 1428
10:17:40.746132 IP 112.26.0.1.43445 > 112.26.0.8.36004: Flags [.], seq 281129:282557, ack 1, win 4017, options [nop,nop,TS val 135050 ecr 4294888708,mptcp dss ack 1720219151 seq 3867233883 subseq 281129 len 1428 csum 0xcdbc], length 1428
10:17:40.916967 IP 112.26.0.8.36004 > 112.26.0.1.43445: Flags [.], ack 268277, win 24193, options [nop,nop,TS val 4294888968 ecr 133942,mptcp dss ack 3867078231], length 0
10:17:40.937678 IP 112.26.0.1.43445 > 112.26.0.8.36004: Flags [.], seq 282557:283985, ack 1, win 4017, options [nop,nop,TS val 135293 ecr 4294888968,mptcp dss ack 1720219151 seq 3867246735 subseq 282557 len 1428 csum 0x3f2b], length 1428
10:17:40.937951 IP 112.26.0.1.43445 > 112.26.0.8.36004: Flags [.], seq 282557:283985, ack 1, win 4017, options [nop,nop,TS val 135293 ecr 4294888968,mptcp dss ack 1720219151 seq 3867246735 subseq 282557 len 1428 csum 0x3f2b], length 1428
10:17:40.956255 IP 112.26.0.8.36004 > 112.26.0.1.43445: Flags [.], ack 275417, win 23009, options [nop,nop,TS val 4294889605 ecr 134426,mptcp dss ack 3867219603], length 0
10:17:40.956460 IP 112.26.0.8.36004 > 112.26.0.1.43445: Flags [.], ack 275417, win 23009, options [nop,nop,TS val 4294889605 ecr 134426,mptcp dss ack 3867219603], length 0
10:17:41.026096 IP 112.26.0.8.36004 > 112.26.0.1.43445: Flags [.], ack 276845, win 24319, options [nop,nop,TS val 4294889679 ecr 134700,mptcp dss ack 3867221031], length 0
10:17:41.026304 IP 112.26.0.8.36004 > 112.26.0.1.43445: Flags [.], ack 276845, win 24319, options [nop,nop,TS val 4294889679 ecr 134700,mptcp dss ack 3867221031], length 0
10:17:41.139476 IP 112.26.0.8.36004 > 112.26.0.1.43445: Flags [.], ack 278273, win 24455, options [nop,nop,TS val 4294889736 ecr 134700,mptcp dss ack 3867226743], length 0
10:17:41.139687 IP 112.26.0.8.36004 > 112.26.0.1.43445: Flags [.], ack 278273, win 24455, options [nop,nop,TS val 4294889736 ecr 134700,mptcp dss ack 3867226743], length 0
10:17:41.213031 IP 112.26.0.8.36004 > 112.26.0.1.43445: Flags [.], ack 271133, win 24193, options [nop,nop,TS val 4294889264 ecr 134143,mptcp dss ack 3867078231], length 0
10:17:41.271771 IP 112.26.0.8.36004 > 112.26.0.1.43445: Flags [.], ack 279701, win 24547, options [nop,nop,TS val 4294889860 ecr 134799,mptcp dss ack 3867231027], length 0
10:17:41.272036 IP 112.26.0.8.36004 > 112.26.0.1.43445: Flags [.], ack 279701, win 24547, options [nop,nop,TS val 4294889860 ecr 134799,mptcp dss ack 3867231027], length 0
