10:17:05.152107 IP 112.26.0.8.36004 > 112.26.0.1.43445: Flags [S], seq 604036043, win 65535, options [mss 1460,sackOK,TS val 4294851649 ecr 0,nop,wscale 6,mptcp capable csum {0x5fe731cb2a0ffaa8}], length 0
10:17:05.176521 IP 112.26.0.1.43445 > 112.26.0.8.36004: Flags [S.], seq 3411350881, ack 604036044, win 65535, options [mss 1460,sackOK,TS val 99544 ecr 4294851649,nop,wscale 6,mptcp capable csum {0x95b44a60aabf03a2}], length 0
10:17:05.353998 IP 112.26.0.1.43445 > 112.26.0.8.36004: Flags [S.], seq 3411350881, ack 604036044, win 65535, options [mss 1460,sackOK,TS val 99544 ecr 4294851649,nop,wscale 6,mptcp capable csum {0x95b44a60aabf03a2}], length 0
10:17:05.472541 IP 112.26.0.8.36004 > 112.26.0.1.43445: Flags [.], ack 1, win 1369, options [nop,nop,TS val 4294854113 ecr 99544,mptcp capable csum {0x5fe731cb2a0ffaa8,0x95b44a60aabf03a2},mptcp dss ack 3866414399], length 0
10:17:05.475920 IP 112.26.0.1.43445 > 112.26.0.8.36004: Flags [.], ack 1, win 1339, options [nop,nop,TS val 99849 ecr 4294854113,mptcp add-addr id 3 112.26.1.1,mptcp dss ack 1720219151], length 0
10:17:05.489833 IP 112.26.0.1.43445 > 112.26.0.8.36004: Flags [.], ack 1, win 1339, options [nop,nop,TS val 99849 ecr 4294854113,mptcp add-addr id 5 112.26.3.1,mptcp dss ack 1720219151], length 0
10:17:05.564018 IP 112.26.0.1.43445 > 112.26.0.8.36004: Flags [.], ack 1, win 1339, options [nop,nop,TS val 99849 ecr 4294854113,mptcp add-addr id 6 112.26.2.1,mptcp dss ack 1720219151], length 0
10:17:35.685015 IP 112.26.0.1.43445 > 112.26.0.8.36004: Flags [.], seq 235433:236861, ack 1, win 4017, options [nop,nop,TS val 130057 ecr 4294883551,mptcp dss ack 1720219151 seq 3867013971 subseq 235433 len 1428 csum 0x1672], length 1428
10:17:35.706605 IP 112.26.0.1.43445 > 112.26.0.8.36004: Flags [.], seq 232577:234005, ack 1, win 4017, options [nop,nop,TS val 129786 ecr 4294883227,mptcp dss ack 1720219151 seq 3867001119 subseq 232577 len 1428 csum 0x9fb2], length 1428
10:17:35.789183 IP 112.26.0.1.43445 > 112.26.0.8.36004: Flags [.], seq 234005:235433, ack 1, win 4017, options [nop,nop,TS val 129963 ecr 4294883307,mptcp dss ack 1720219151 seq 3867008259 subseq 234005 len 1428 csum 0x918d], length 1428
10:17:35.873509 IP 112.26.0.1.43445 > 112.26.0.8.36004: Flags [.], seq 235433:236861, ack 1, win 4017, options [nop,nop,TS val 130057 ecr 4294883551,mptcp dss ack 1720219151 seq 3867013971 subseq 235433 len 1428 csum 0x1672], length 1428
10:17:56.227135 IP 112.26.0.1.43445 > 112.26.0.8.36004: Flags [.], seq 448205:449633, ack 1, win 4017, options [nop,nop,TS val 150473 ecr 4294903964,mptcp dss ack 1720219151 seq 3867933603 subseq 448205 len 1428 csum 0x841d], length 1428
10:18:18.385613 IP 112.26.0.1.43445 > 112.26.0.8.36004: Flags [.], seq 586721:588149, ack 1, win 4017, options [nop,nop,TS val 172736 ecr 4294918589,mptcp dss ack 1720219151 seq 3868431975 subseq 586721 len 1428 csum 0x59f0], length 1428
10:18:31.220200 IP 112.26.0.1.43445 > 112.26.0.8.36004: Flags [.], seq 739517:740945, ack 1, win 4017, options [nop,nop,TS val 185292 ecr 4294938884,mptcp dss ack 1720219151 seq 3868916067 subseq 739517 len 1428 csum 0x88d8], length 1428
10:18:31.247354 IP 112.26.0.1.43445 > 112.26.0.8.36004: Flags [.], seq 738089:739517, ack 1, win 4017, options [nop,nop,TS val 185222 ecr 4294938815,mptcp dss ack 1720219151 seq 3868913211 subseq 738089 len 1428 csum 0x62da], length 1428
10:18:31.318719 IP 112.26.0.1.43445 > 112.26.0.8.36004: Flags [.], seq 740945:742373, ack 1, win 4017, options [nop,nop,TS val 185469 ecr 4294939001,mptcp dss ack 1720219151 seq 3868921779 subseq 740945 len 1428 csum 0x99b4], length 1428
10:18:31.342718 IP 112.26.0.1.43445 > 112.26.0.8.36004: Flags [.], seq 739517:740945, ack 1, win 4017, options [nop,nop,TS val 185292 ecr 4294938884,mptcp dss ack 1720219151 seq 3868916067 subseq 739517 len 1428 csum 0x88d8], length 1428
10:18:31.380586 IP 112.26.0.1.43445 > 112.26.0.8.36004: Flags [.], seq 742373:743801, ack 1, win 4017, options [nop,nop,TS val 185681 ecr 4294939239,mptcp dss ack 1720219151 seq 3868927491 subseq 742373 len 1428 csum 0x6765], length 1428
10:18:31.459703 IP 112.26.0.1.43445 > 112.26.0.8.36004: Flags [.], seq 740945:742373, ack 1, win 4017, options [nop,nop,TS val 185469 ecr 4294939001,mptcp dss ack 1720219151 seq 3868921779 subseq 740945 len 1428 csum 0x99b4], length 1428
10:18:31.576529 IP 112.26.0.1.43445 > 112.26.0.8.36004: Flags [.], seq 742373:743801, ack 1, win 4017, options [nop,nop,TS val 185681 ecr 4294939239,mptcp dss ack 1720219151 seq 3868927491 subseq 742373 len 1428 csum 0x6765], length 1428
10:18:31.593278 IP 112.26.0.1.43445 > 112.26.0.8.36004: Flags [.], seq 743801:745229, ack 1, win 4017, options [nop,nop,TS val 185964 ecr 4294939665,mptcp dss ack 1720219151 seq 3868940343 subseq 743801 len 1428 csum 0x4a72], length 1428
10:18:31.699189 IP 112.26.0.1.43445 > 112.26.0.8.36004: Flags [.], seq 743801:745229, ack 1, win 4017, options [nop,nop,TS val 185964 ecr 4294939665,mptcp dss ack 1720219151 seq 3868940343 subseq 743801 len 1428 csum 0x4a72], length 1428
10:18:31.713762 IP 112.26.0.1.43445 > 112.26.0.8.36004: Flags [.], seq 745229:746657, ack 1, win 4017, options [nop,nop,TS val 186020 ecr 4294939810,mptcp dss ack 1720219151 seq 3868944627 subseq 745229 len 1428 csum 0xf6f], length 1428
10:18:31.803348 IP 112.26.0.1.43445 > 112.26.0.8.36004: Flags [.], seq 745229:746657, ack 1, win 4017, options [nop,nop,TS val 186020 ecr 4294939810,mptcp dss ack 1720219151 seq 3868944627 subseq 745229 len 1428 csum 0xf6f], length 1428
10:18:31.831215 IP 112.26.0.1.43445 > 112.26.0.8.36004: Flags [.], seq 746657:748085, ack 1, win 4017, options [nop,nop,TS val 186203 ecr 4294939983,mptcp dss ack 1720219151 seq 3868954623 subseq 746657 len 1428 csum 0xba46], length 1428
10:18:31.920046 IP 112.26.0.1.43445 > 112.26.0.8.36004: Flags [.], seq 746657:748085, ack 1, win 4017, options [nop,nop,TS val 186203 ecr 4294939983,mptcp dss ack 1720219151 seq 3868954623 subseq 746657 len 1428 csum 0xba46], length 1428
10:18:32.052532 IP 112.26.0.1.43445 > 112.26.0.8.36004: Flags [.], seq 748085:749513, ack 1, win 4017, options [nop,nop,TS val 186426 ecr 4294940064,mptcp dss ack 1720219151 seq 3868961763 subseq 748085 len 1428 csum 0xe162], length 1428
10:18:32.074392 IP 112.26.0.1.43445 > 112.26.0.8.36004: Flags [.], seq 748085:749513, ack 1, win 4017, options [nop,nop,TS val 186426 ecr 4294940064,mptcp dss ack 1720219151 seq 3868961763 subseq 748085 len 1428 csum 0xe162], length 1428
10:18:32.161253 IP 112.26.0.1.43445 > 112.26.0.8.36004: Flags [.], seq 749513:750941, ack 1, win 4017, options [nop,nop,TS val 186426 ecr 4294940064,mptcp dss ack 1720219151 seq 3868963191 subseq 749513 len 1428 csum 0x43ef], length 1428
10:18:32.165758 IP 112.26.0.1.43445 > 112.26.0.8.36004: Flags [.], seq 749513:750941, ack 1, win 4017, options [nop,nop,TS val 186426 ecr 4294940064,mptcp dss ack 1720219151 seq 3868963191 subseq 749513 len 1428 csum 0x43ef], length 1428
10:18:32.234290 IP 112.26.0.1.43445 > 112.26.0.8.36004: Flags [.], seq 750941:752369, ack 1, win 4017, options [nop,nop,TS val 186607 ecr 4294940162,mptcp dss ack 1720219151 seq 3868970331 subseq 750941 len 1428 csum 0x8861], length 1428
10:18:32.267702 IP 112.26.0.1.43445 > 112.26.0.8.36004: Flags [.], seq 750941:752369, ack 1, win 4017, options [nop,nop,TS val 186607 ecr 4294940162,mptcp dss ack 1720219151 seq 3868970331 subseq 750941 len 1428 csum 0x8861], length 1428
10:18:32.328616 IP 112.26.0.1.43445 > 112.26.0.8.36004: Flags [.], seq 752369:753797, ack 1, win 4017, options [nop,nop,TS val 186607 ecr 4294940162,mptcp dss ack 1720219151 seq 3868971759 subseq 752369 len 1428 csum 0x3157], length 1428
10:18:32.380065 IP 112.26.0.1.43445 > 112.26.0.8.36004: Flags [.], seq 752369:753797, ack 1, win 4017, options [nop,nop,TS val 186607 ecr 4294940162,mptcp dss ack 1720219151 seq 3868971759 subseq 752369 len 1428 csum 0x3157], length 1428
10:18:32.423016 IP 112.26.0.1.43445 > 112.26.0.8.36004: Flags [.], seq 753797:755225, ack 1, win 4017, options [nop,nop,TS val 186740 ecr 4294940341,mptcp dss ack 1720219151 seq 3868974615 subseq 753797 len 1428 csum 0x9954], length 1428
10:18:32.478931 IP 112.26.0.1.43445 > 112.26.0.8.36004: Flags [.], seq 753797:755225, ack 1, win 4017, options [nop,nop,TS val 186740 ecr 4294940341,mptcp dss ack 1720219151 seq 3868974615 subseq 753797 len 1428 csum 0x9954], length 1428
10:18:32.510352 IP 112.26.0.1.43445 > 112.26.0.8.36004: Flags [.], seq 755225:756653, ack 1, win 4017, options [nop,nop,TS val 186883 ecr 4294940397,mptcp dss ack 1720219151 seq 3868978899 subseq 755225 len 1428 csum 0xb978], length 1428
10:18:32.599323 IP 112.26.0.1.43445 > 112.26.0.8.36004: Flags [.], seq 756653:758081, ack 1, win 4017, options [nop,nop,TS val 186972 ecr 4294940563,mptcp dss ack 1720219151 seq 3868981755 subseq 756653 len 1428 csum 0x306d], length 1428
10:18:32.624831 IP 112.26.0.1.43445 > 112.26.0.8.36004: Flags [.], seq 755225:756653, ack 1, win 4017, options [nop,nop,TS val 186883 ecr 4294940397,mptcp dss ack 1720219151 seq 3868978899 subseq 755225 len 1428 csum 0xb978], length 1428
10:18:32.682969 IP 112.26.0.1.43445 > 112.26.0.8.36004: Flags [.], seq 758081:759509, ack 1, win 4017, options [nop,nop,TS val 186972 ecr 4294940563,mptcp dss ack 1720219151 seq 3868983183 subseq 758081 len 1428 csum 0xc905], length 1428
10:18:32.746138 IP 112.26.0.1.43445 > 112.26.0.8.36004: Flags [.], seq 756653:758081, ack 1, win 4017, options [nop,nop,TS val 186972 ecr 4294940563,mptcp dss ack 1720219151 seq 3868981755 subseq 756653 len 1428 csum 0x306d], length 1428
10:18:32.803688 IP 112.26.0.1.43445 > 112.26.0.8.36004: Flags [.], seq 758081:759509, ack 1, win 4017, options [nop,nop,TS val 186972 ecr 4294940563,mptcp dss ack 1720219151 seq 3868983183 subseq 758081 len 1428 csum 0xc905], length 1428
10:18:33.124490 IP 112.26.0.1.43445 > 112.26.0.8.36004: Flags [.], seq 759509:760937, ack 1, win 4017, options [nop,nop,TS val 187497 ecr 4294941042,mptcp dss ack 1720219151 seq 3869013171 subseq 759509 len 1428 csum 0xe65e], length 1428
10:18:33.136911 IP 112.26.0.1.43445 > 112.26.0.8.36004: Flags [.], seq 759509:760937, ack 1, win 4017, options [nop,nop,TS val 187497 ecr 4294941042,mptcp dss ack 1720219151 seq 3869013171 subseq 759509 len 1428 csum 0xe65e], length 1428
10:18:33.236559 IP 112.26.0.1.43445 > 112.26.0.8.36004: Flags [.], seq 760937:762365, ack 1, win 4017, options [nop,nop,TS val 187497 ecr 4294941042,mptcp dss ack 1720219151 seq 3869014599 subseq 760937 len 1428 csum 0x99f3], length 1428
10:18:33.243207 IP 112.26.0.1.43445 > 112.26.0.8.36004: Flags [.], seq 760937:762365, ack 1, win 4017, options [nop,nop,TS val 187497 ecr 4294941042,mptcp dss ack 1720219151 seq 3869014599 subseq 760937 len 1428 csum 0x99f3], length 1428
10:18:33.326297 IP 112.26.0.1.43445 > 112.26.0.8.36004: Flags [.], seq 762365:763793, ack 1, win 4017, options [nop,nop,TS val 187611 ecr 4294941198,mptcp dss ack 1720219151 seq 3869021739 subseq 762365 len 1428 csum 0x461b], length 1428
10:18:33.354898 IP 112.26.0.1.43445 > 112.26.0.8.36004: Flags [.], seq 762365:763793, ack 1, win 4017, options [nop,nop,TS val 187611 ecr 4294941198,mptcp dss ack 1720219151 seq 3869021739 subseq 762365 len 1428 csum 0x461b], length 1428
10:18:33.529959 IP 112.26.0.1.43445 > 112.26.0.8.36004: Flags [.], seq 763793:765221, ack 1, win 4017, options [nop,nop,TS val 187903 ecr 4294941322,mptcp dss ack 1720219151 seq 3869031735 subseq 763793 len 1428 csum 0xa524], length 1428
10:18:33.539104 IP 112.26.0.1.43445 > 112.26.0.8.36004: Flags [.], seq 763793:765221, ack 1, win 4017, options [nop,nop,TS val 187903 ecr 4294941322,mptcp dss ack 1720219151 seq 3869031735 subseq 763793 len 1428 csum 0xa524], length 1428
10:18:33.630802 IP 112.26.0.1.43445 > 112.26.0.8.36004: Flags [.], seq 765221:766649, ack 1, win 4017, options [nop,nop,TS val 187995 ecr 4294941581,mptcp dss ack 1720219151 seq 3869037447 subseq 765221 len 1428 csum 0x3544], length 1428
10:18:33.642480 IP 112.26.0.1.43445 > 112.26.0.8.36004: Flags [.], seq 765221:766649, ack 1, win 4017, options [nop,nop,TS val 187995 ecr 4294941581,mptcp dss ack 1720219151 seq 3869037447 subseq 765221 len 1428 csum 0x3544], length 1428
10:18:33.685178 IP 112.26.0.1.43445 > 112.26.0.8.36004: Flags [.], seq 766649:768077, ack 1, win 4017, options [nop,nop,TS val 187995 ecr 4294941581,mptcp dss ack 1720219151 seq 3869038875 subseq 766649 len 1428 csum 0x3e25], length 1428
10:18:33.742890 IP 112.26.0.1.43445 > 112.26.0.8.36004: Flags [.], seq 766649:768077, ack 1, win 4017, options [nop,nop,TS val 187995 ecr 4294941581,mptcp dss ack 1720219151 seq 3869038875 subseq 766649 len 1428 csum 0x3e25], length 1428
10:18:33.812124 IP 112.26.0.1.43445 > 112.26.0.8.36004: Flags [.], seq 768077:769505, ack 1, win 4017, options [nop,nop,TS val 188185 ecr 4294941648,mptcp dss ack 1720219151 seq 3869048871 subseq 768077 len 1428 csum 0x3c1a], length 1428
10:18:33.851632 IP 112.26.0.1.43445 > 112.26.0.8.36004: Flags [.], seq 768077:769505, ack 1, win 4017, options [nop,nop,TS val 188185 ecr 4294941648,mptcp dss ack 1720219151 seq 3869048871 subseq 768077 len 1428 csum 0x3c1a], length 1428
10:18:33.943818 IP 112.26.0.1.43445 > 112.26.0.8.36004: Flags [.], seq 769505:770933, ack 1, win 4017, options [nop,nop,TS val 188318 ecr 4294941725,mptcp dss ack 1720219151 seq 3869056011 subseq 769505 len 1428 csum 0xc242], length 1428
10:18:33.946710 IP 112.26.0.1.43445 > 112.26.0.8.36004: Flags [.], seq 769505:770933, ack 1, win 4017, options [nop,nop,TS val 188318 ecr 4294941725,mptcp dss ack 1720219151 seq 3869056011 subseq 769505 len 1428 csum 0xc242], length 1428
10:18:34.078392 IP 112.26.0.1.43445 > 112.26.0.8.36004: Flags [.], seq 770933:772361, ack 1, win 4017, options [nop,nop,TS val 188449 ecr 4294941955,mptcp dss ack 1720219151 seq 3869060295 subseq 770933 len 1428 csum 0x6a28], length 1428
10:18:34.100624 IP 112.26.0.1.43445 > 112.26.0.8.36004: Flags [.], seq 770933:772361, ack 1, win 4017, options [nop,nop,TS val 188449 ecr 4294941955,mptcp dss ack 1720219151 seq 3869060295 subseq 770933 len 1428 csum 0x6a28], length 1428
10:18:34.162431 IP 112.26.0.1.43445 > 112.26.0.8.36004: Flags [.], seq 742373:743801, ack 1, win 4017, options [nop,nop,TS val 188526 ecr 4294942151,mptcp dss ack 1720219151 seq 3868927491 subseq 742373 len 1428 csum 0x6765], length 1428
10:18:34.204583 IP 112.26.0.1.43445 > 112.26.0.8.36004: Flags [.], seq 742373:743801, ack 1, win 4017, options [nop,nop,TS val 188526 ecr 4294942151,mptcp dss ack 1720219151 seq 3868927491 subseq 742373 len 1428 csum 0x6765], length 1428
10:18:34.545457 IP 112.26.0.1.43445 > 112.26.0.8.36004: Flags [.], seq 753797:755225, ack 1, win 4017, options [nop,nop,TS val 188918 ecr 4294942651,mptcp dss ack 1720219151 seq 3868974615 subseq 753797 len 1428 csum 0x9954], length 1428
10:18:34.558655 IP 112.26.0.1.43445 > 112.26.0.8.36004: Flags [.], seq 753797:755225, ack 1, win 4017, options [nop,nop,TS val 188918 ecr 4294942651,mptcp dss ack 1720219151 seq 3868974615 subseq 753797 len 1428 csum 0x9954], length 1428
10:18:34.651211 IP 112.26.0.1.43445 > 112.26.0.8.36004: Flags [.], seq 756653:758081, ack 1, win 4017, options [nop,nop,TS val 188993 ecr 4294942731,mptcp dss ack 1720219151 seq 3868981755 subseq 756653 len 1428 csum 0x306d], length 1428
10:18:34.654328 IP 112.26.0.1.43445 > 112.26.0.8.36004: Flags [.], seq 756653:758081, ack 1, win 4017, options [nop,nop,TS val 188993 ecr 4294942731,mptcp dss ack 1720219151 seq 3868981755 subseq 756653 len 1428 csum 0x306d], length 1428
10:18:34.892538 IP 112.26.0.1.43445 > 112.26.0.8.36004: Flags [.], seq 772361:773789, ack 1, win 4017, options [nop,nop,TS val 189266 ecr 4294942849,mptcp dss ack 1720219151 seq 3869111703 subseq 772361 len 1428 csum 0xe82], length 1428
10:18:34.903858 IP 112.26.0.1.43445 > 112.26.0.8.36004: Flags [.], seq 772361:773789, ack 1, win 4017, options [nop,nop,TS val 189266 ecr 4294942849,mptcp dss ack 1720219151 seq 3869111703 subseq 772361 len 1428 csum 0xe82], length 1428
10:18:34.952925 IP 112.26.0.1.43445 > 112.26.0.8.36004: Flags [.], seq 773789:775217, ack 1, win 4017, options [nop,nop,TS val 189325 ecr 4294942922,mptcp dss ack 1720219151 seq 3869113131 subseq 773789 len 1428 csum 0x1aeb], length 1428
10:18:35.017260 IP 112.26.0.1.43445 > 112.26.0.8.36004: Flags [.], seq 773789:775217, ack 1, win 4017, options [nop,nop,TS val 189325 ecr 4294942922,mptcp dss ack 1720219151 seq 3869113131 subseq 773789 len 1428 csum 0x1aeb], length 1428
10:18:35.058725 IP 112.26.0.1.43445 > 112.26.0.8.36004: Flags [.], seq 775217:776645, ack 1, win 4017, options [nop,nop,TS val 189415 ecr 4294942962,mptcp dss ack 1720219151 seq 3869118843 subseq 775217 len 1428 csum 0x6f0e], length 1428
10:18:35.090502 IP 112.26.0.1.43445 > 112.26.0.8.36004: Flags [.], seq 775217:776645, ack 1, win 4017, options [nop,nop,TS val 189415 ecr 4294942962,mptcp dss ack 1720219151 seq 3869118843 subseq 775217 len 1428 csum 0x6f0e], length 1428
10:18:35.244802 IP 112.26.0.1.43445 > 112.26.0.8.36004: Flags [.], seq 776645:778073, ack 1, win 4017, options [nop,nop,TS val 189455 ecr 4294943027,mptcp dss ack 1720219151 seq 3869120271 subseq 776645 len 1428 csum 0xb0c3], length 1428
10:18:35.255660 IP 112.26.0.1.43445 > 112.26.0.8.36004: Flags [.], seq 776645:778073, ack 1, win 4017, options [nop,nop,TS val 189455 ecr 4294943027,mptcp dss ack 1720219151 seq 3869120271 subseq 776645 len 1428 csum 0xb0c3], length 1428
10:18:35.333982 IP 112.26.0.1.43445 > 112.26.0.8.36004: Flags [.], seq 778073:779501, ack 1, win 4017, options [nop,nop,TS val 189638 ecr 4294943126,mptcp dss ack 1720219151 seq 3869133123 subseq 778073 len 1428 csum 0xc27a], length 1428
10:18:35.387470 IP 112.26.0.1.43445 > 112.26.0.8.36004: Flags [.], seq 778073:779501, ack 1, win 4017, options [nop,nop,TS val 189638 ecr 4294943126,mptcp dss ack 1720219151 seq 3869133123 subseq 778073 len 1428 csum 0xc27a], length 1428
10:18:35.418970 IP 112.26.0.1.43445 > 112.26.0.8.36004: Flags [P.], seq 779501:780929, ack 1, win 4017, options [nop,nop,TS val 189779 ecr 4294943347,mptcp dss ack 1720219151 seq 3869135979 subseq 779501 len 1428 csum 0x49a0], length 1428
10:18:35.449591 IP 112.26.0.1.43445 > 112.26.0.8.36004: Flags [P.], seq 779501:780929, ack 1, win 4017, options [nop,nop,TS val 189779 ecr 4294943347,mptcp dss ack 1720219151 seq 3869135979 subseq 779501 len 1428 csum 0x49a0], length 1428
10:18:35.503678 IP 112.26.0.1.43445 > 112.26.0.8.36004: Flags [.], seq 780929:782357, ack 1, win 4017, options [nop,nop,TS val 189860 ecr 4294943406,mptcp dss ack 1720219151 seq 3869140263 subseq 780929 len 1428 csum 0xe41b], length 1428
10:18:35.549202 IP 112.26.0.1.43445 > 112.26.0.8.36004: Flags [.], seq 780929:782357, ack 1, win 4017, options [nop,nop,TS val 189860 ecr 4294943406,mptcp dss ack 1720219151 seq 3869140263 subseq 780929 len 1428 csum 0xe41b], length 1428
10:18:35.773778 IP 112.26.0.1.43445 > 112.26.0.8.36004: Flags [.], seq 782357:783785, ack 1, win 4017, options [nop,nop,TS val 190146 ecr 4294943890,mptcp dss ack 1720219151 seq 3869163111 subseq 782357 len 1428 csum 0x9f7e], length 1428
10:18:35.777619 IP 112.26.0.1.43445 > 112.26.0.8.36004: Flags [.], seq 782357:783785, ack 1, win 4017, options [nop,nop,TS val 190146 ecr 4294943890,mptcp dss ack 1720219151 seq 3869163111 subseq 782357 len 1428 csum 0x9f7e], length 1428
10:18:35.900079 IP 112.26.0.1.43445 > 112.26.0.8.36004: Flags [.], seq 783785:785213, ack 1, win 4017, options [nop,nop,TS val 190273 ecr 4294943957,mptcp dss ack 1720219151 seq 3869174535 subseq 783785 len 1428 csum 0xb664], length 1428
10:18:35.913404 IP 112.26.0.1.43445 > 112.26.0.8.36004: Flags [.], seq 783785:785213, ack 1, win 4017, options [nop,nop,TS val 190273 ecr 4294943957,mptcp dss ack 1720219151 seq 3869174535 subseq 783785 len 1428 csum 0xb664], length 1428
10:18:36.120844 IP 112.26.0.1.43445 > 112.26.0.8.36004: Flags [.], seq 785213:786641, ack 1, win 4017, options [nop,nop,TS val 190495 ecr 4294944183,mptcp dss ack 1720219151 seq 3869177391 subseq 785213 len 1428 csum 0x1e82], length 1428
10:18:36.132287 IP 112.26.0.1.43445 > 112.26.0.8.36004: Flags [.], seq 785213:786641, ack 1, win 4017, options [nop,nop,TS val 190495 ecr 4294944183,mptcp dss ack 1720219151 seq 3869177391 subseq 785213 len 1428 csum 0x1e82], length 1428
10:18:36.263703 IP 112.26.0.1.43445 > 112.26.0.8.36004: Flags [.], seq 786641:788069, ack 1, win 4017, options [nop,nop,TS val 190636 ecr 4294944287,mptcp dss ack 1720219151 seq 3869180247 subseq 786641 len 1428 csum 0x7c51], length 1428
10:18:36.276642 IP 112.26.0.1.43445 > 112.26.0.8.36004: Flags [.], seq 786641:788069, ack 1, win 4017, options [nop,nop,TS val 190636 ecr 4294944287,mptcp dss ack 1720219151 seq 3869180247 subseq 786641 len 1428 csum 0x7c51], length 1428
10:18:36.398769 IP 112.26.0.1.43445 > 112.26.0.8.36004: Flags [.], seq 788069:789497, ack 1, win 4017, options [nop,nop,TS val 190714 ecr 4294944352,mptcp dss ack 1720219151 seq 3869183103 subseq 788069 len 1428 csum 0xfd41], length 1428
10:18:36.416412 IP 112.26.0.1.43445 > 112.26.0.8.36004: Flags [.], seq 788069:789497, ack 1, win 4017, options [nop,nop,TS val 190714 ecr 4294944352,mptcp dss ack 1720219151 seq 3869183103 subseq 788069 len 1428 csum 0xfd41], length 1428
10:18:36.489483 IP 112.26.0.1.43445 > 112.26.0.8.36004: Flags [.], seq 789497:790925, ack 1, win 4017, options [nop,nop,TS val 190714 ecr 4294944352,mptcp dss ack 1720219151 seq 3869184531 subseq 789497 len 1428 csum 0xfdc6], length 1428
10:18:36.512766 IP 112.26.0.1.43445 > 112.26.0.8.36004: Flags [.], seq 789497:790925, ack 1, win 4017, options [nop,nop,TS val 190714 ecr 4294944352,mptcp dss ack 1720219151 seq 3869184531 subseq 789497 len 1428 csum 0xfdc6], length 1428
10:18:36.618646 IP 112.26.0.1.43445 > 112.26.0.8.36004: Flags [.], seq 790925:792353, ack 1, win 4017, options [nop,nop,TS val 190881 ecr 4294944486,mptcp dss ack 1720219151 seq 3869187387 subseq 790925 len 1428 csum 0x7ade], length 1428
10:18:36.620332 IP 112.26.0.1.43445 > 112.26.0.8.36004: Flags [.], seq 790925:792353, ack 1, win 4017, options [nop,nop,TS val 190881 ecr 4294944486,mptcp dss ack 1720219151 seq 3869187387 subseq 790925 len 1428 csum 0x7ade], length 1428
10:18:36.711704 IP 112.26.0.1.43445 > 112.26.0.8.36004: Flags [.], seq 792353:793781, ack 1, win 4017, options [nop,nop,TS val 191055 ecr 4294944625,mptcp dss ack 1720219151 seq 3869193099 subseq 792353 len 1428 csum 0x4dfe], length 1428
10:18:36.722777 IP 112.26.0.1.43445 > 112.26.0.8.36004: Flags [.], seq 792353:793781, ack 1, win 4017, options [nop,nop,TS val 191055 ecr 4294944625,mptcp dss ack 1720219151 seq 3869193099 subseq 792353 len 1428 csum 0x4dfe], length 1428
10:18:36.791525 IP 112.26.0.1.43445 > 112.26.0.8.36004: Flags [.], seq 793781:795209, ack 1, win 4017, options [nop,nop,TS val 191150 ecr 4294944688,mptcp dss ack 1720219151 seq 3869203095 subseq 793781 len 1428 csum 0x2e71], length 1428
10:18:36.847738 IP 112.26.0.1.43445 > 112.26.0.8.36004: Flags [.], seq 793781:795209, ack 1, win 4017, options [nop,nop,TS val 191150 ecr 4294944688,mptcp dss ack 1720219151 seq 3869203095 subseq 793781 len 1428 csum 0x2e71], length 1428
10:18:36.955734 IP 112.26.0.1.43445 > 112.26.0.8.36004: Flags [.], seq 795209:796637, ack 1, win 4017, options [nop,nop,TS val 191328 ecr 4294944837,mptcp dss ack 1720219151 seq 3869210235 subseq 795209 len 1428 csum 0x816f], length 1428
10:18:36.979728 IP 112.26.0.1.43445 > 112.26.0.8.36004: Flags [.], seq 795209:796637, ack 1, win 4017, options [nop,nop,TS val 191328 ecr 4294944837,mptcp dss ack 1720219151 seq 3869210235 subseq 795209 len 1428 csum 0x816f], length 1428
10:18:37.100723 IP 112.26.0.1.43445 > 112.26.0.8.36004: Flags [.], seq 796637:798065, ack 1, win 4017, options [nop,nop,TS val 191471 ecr 4294945029,mptcp dss ack 1720219151 seq 3869221659 subseq 796637 len 1428 csum 0xa45b], length 1428
10:18:37.111075 IP 112.26.0.1.43445 > 112.26.0.8.36004: Flags [.], seq 796637:798065, ack 1, win 4017, options [nop,nop,TS val 191471 ecr 4294945029,mptcp dss ack 1720219151 seq 3869221659 subseq 796637 len 1428 csum 0xa45b], length 1428
10:18:37.307567 IP 112.26.0.1.43445 > 112.26.0.8.36004: Flags [.], seq 798065:799493, ack 1, win 4017, options [nop,nop,TS val 191682 ecr 4294945246,mptcp dss ack 1720219151 seq 3869227371 subseq 798065 len 1428 csum 0x20d5], length 1428
10:18:37.330327 IP 112.26.0.1.43445 > 112.26.0.8.36004: Flags [.], seq 798065:799493, ack 1, win 4017, options [nop,nop,TS val 191682 ecr 4294945246,mptcp dss ack 1720219151 seq 3869227371 subseq 798065 len 1428 csum 0x20d5], length 1428
10:18:37.568119 IP 112.26.0.1.43445 > 112.26.0.8.36004: Flags [.], seq 799493:800921, ack 1, win 4017, options [nop,nop,TS val 191942 ecr 4294945525,mptcp dss ack 1720219151 seq 3869237367 subseq 799493 len 1428 csum 0xcb5a], length 1428
10:18:37.580693 IP 112.26.0.1.43445 > 112.26.0.8.36004: Flags [.], seq 799493:800921, ack 1, win 4017, options [nop,nop,TS val 191942 ecr 4294945525,mptcp dss ack 1720219151 seq 3869237367 subseq 799493 len 1428 csum 0xcb5a], length 1428
10:18:37.700063 IP 112.26.0.1.43445 > 112.26.0.8.36004: Flags [.], seq 800921:802349, ack 1, win 4017, options [nop,nop,TS val 192073 ecr 4294945709,mptcp dss ack 1720219151 seq 3869240223 subseq 800921 len 1428 csum 0xfc42], length 1428
10:18:37.714264 IP 112.26.0.1.43445 > 112.26.0.8.36004: Flags [.], seq 800921:802349, ack 1, win 4017, options [nop,nop,TS val 192073 ecr 4294945709,mptcp dss ack 1720219151 seq 3869240223 subseq 800921 len 1428 csum 0xfc42], length 1428
10:18:37.809663 IP 112.26.0.1.43445 > 112.26.0.8.36004: Flags [.], seq 802349:803777, ack 1, win 4017, options [nop,nop,TS val 192182 ecr 4294945823,mptcp dss ack 1720219151 seq 3869243079 subseq 802349 len 1428 csum 0x4134], length 1428
10:18:37.832523 IP 112.26.0.1.43445 > 112.26.0.8.36004: Flags [.], seq 802349:803777, ack 1, win 4017, options [nop,nop,TS val 192182 ecr 4294945823,mptcp dss ack 1720219151 seq 3869243079 subseq 802349 len 1428 csum 0x4134], length 1428
10:18:37.917264 IP 112.26.0.1.43445 > 112.26.0.8.36004: Flags [.], seq 803777:805205, ack 1, win 4017, options [nop,nop,TS val 192290 ecr 4294945927,mptcp dss ack 1720219151 seq 3869245935 subseq 803777 len 1428 csum 0xebad], length 1428
10:18:37.948017 IP 112.26.0.1.43445 > 112.26.0.8.36004: Flags [.], seq 803777:805205, ack 1, win 4017, options [nop,nop,TS val 192290 ecr 4294945927,mptcp dss ack 1720219151 seq 3869245935 subseq 803777 len 1428 csum 0xebad], length 1428
10:18:38.035164 IP 112.26.0.1.43445 > 112.26.0.8.36004: Flags [.], seq 805205:806633, ack 1, win 4017, options [nop,nop,TS val 192290 ecr 4294945927,mptcp dss ack 1720219151 seq 3869247363 subseq 805205 len 1428 csum 0xa433], length 1428
10:18:38.040135 IP 112.26.0.1.43445 > 112.26.0.8.36004: Flags [.], seq 805205:806633, ack 1, win 4017, options [nop,nop,TS val 192290 ecr 4294945927,mptcp dss ack 1720219151 seq 3869247363 subseq 805205 len 1428 csum 0xa433], length 1428
10:18:38.114058 IP 112.26.0.1.43445 > 112.26.0.8.36004: Flags [.], seq 806633:808061, ack 1, win 4017, options [nop,nop,TS val 192422 ecr 4294946124,mptcp dss ack 1720219151 seq 3869257359 subseq 806633 len 1428 csum 0x291], length 1428
10:18:38.150828 IP 112.26.0.1.43445 > 112.26.0.8.36004: Flags [.], seq 806633:808061, ack 1, win 4017, options [nop,nop,TS val 192422 ecr 4294946124,mptcp dss ack 1720219151 seq 3869257359 subseq 806633 len 1428 csum 0x291], length 1428
10:18:38.217578 IP 112.26.0.1.43445 > 112.26.0.8.36004: Flags [.], seq 808061:809489, ack 1, win 4017, options [nop,nop,TS val 192422 ecr 4294946124,mptcp dss ack 1720219151 seq 3869258787 subseq 808061 len 1428 csum 0xb92f], length 1428
10:18:38.259277 IP 112.26.0.1.43445 > 112.26.0.8.36004: Flags [.], seq 809489:810917, ack 1, win 4017, options [nop,nop,TS val 192573 ecr 4294946320,mptcp dss ack 1720219151 seq 3869261643 subseq 809489 len 1428 csum 0xba24], length 1428
10:18:38.263704 IP 112.26.0.1.43445 > 112.26.0.8.36004: Flags [.], seq 808061:809489, ack 1, win 4017, options [nop,nop,TS val 192422 ecr 4294946124,mptcp dss ack 1720219151 seq 3869258787 subseq 808061 len 1428 csum 0xb92f], length 1428
10:18:38.332629 IP 112.26.0.1.43445 > 112.26.0.8.36004: Flags [.], seq 810917:812345, ack 1, win 4017, options [nop,nop,TS val 192573 ecr 4294946320,mptcp dss ack 1720219151 seq 3869263071 subseq 810917 len 1428 csum 0xd6bc], length 1428
10:18:38.371242 IP 112.26.0.1.43445 > 112.26.0.8.36004: Flags [.], seq 809489:810917, ack 1, win 4017, options [nop,nop,TS val 192573 ecr 4294946320,mptcp dss ack 1720219151 seq 3869261643 subseq 809489 len 1428 csum 0xba24], length 1428
10:18:38.457257 IP 112.26.0.1.43445 > 112.26.0.8.36004: Flags [.], seq 810917:812345, ack 1, win 4017, options [nop,nop,TS val 192573 ecr 4294946320,mptcp dss ack 1720219151 seq 3869263071 subseq 810917 len 1428 csum 0xd6bc], length 1428
10:18:38.491735 IP 112.26.0.1.43445 > 112.26.0.8.36004: Flags [.], seq 812345:813773, ack 1, win 4017, options [nop,nop,TS val 192863 ecr 4294946752,mptcp dss ack 1720219151 seq 3869280207 subseq 812345 len 1428 csum 0xc2db], length 1428
10:18:38.565738 IP 112.26.0.1.43445 > 112.26.0.8.36004: Flags [.], seq 813773:815201, ack 1, win 4017, options [nop,nop,TS val 192863 ecr 4294946752,mptcp dss ack 1720219151 seq 3869281635 subseq 813773 len 1428 csum 0x7ba3], length 1428
10:18:38.568462 IP 112.26.0.1.43445 > 112.26.0.8.36004: Flags [.], seq 812345:813773, ack 1, win 4017, options [nop,nop,TS val 192863 ecr 4294946752,mptcp dss ack 1720219151 seq 3869280207 subseq 812345 len 1428 csum 0xc2db], length 1428
10:18:38.705265 IP 112.26.0.1.43445 > 112.26.0.8.36004: Flags [.], seq 813773:815201, ack 1, win 4017, options [nop,nop,TS val 192863 ecr 4294946752,mptcp dss ack 1720219151 seq 3869281635 subseq 813773 len 1428 csum 0x7ba3], length 1428
10:18:38.835785 IP 112.26.0.1.43445 > 112.26.0.8.36004: Flags [.], seq 815201:816629, ack 1, win 4017, options [nop,nop,TS val 193208 ecr 4294947192,mptcp dss ack 1720219151 seq 3869300199 subseq 815201 len 1428 csum 0xf201], length 1428
10:18:38.848062 IP 112.26.0.1.43445 > 112.26.0.8.36004: Flags [.], seq 815201:816629, ack 1, win 4017, options [nop,nop,TS val 193208 ecr 4294947192,mptcp dss ack 1720219151 seq 3869300199 subseq 815201 len 1428 csum 0xf201], length 1428
10:18:38.924537 IP 112.26.0.1.43445 > 112.26.0.8.36004: Flags [.], seq 816629:818057, ack 1, win 4017, options [nop,nop,TS val 193208 ecr 4294947192,mptcp dss ack 1720219151 seq 3869301627 subseq 816629 len 1428 csum 0x9bde], length 1428
10:18:38.954874 IP 112.26.0.1.43445 > 112.26.0.8.36004: Flags [.], seq 816629:818057, ack 1, win 4017, options [nop,nop,TS val 193208 ecr 4294947192,mptcp dss ack 1720219151 seq 3869301627 subseq 816629 len 1428 csum 0x9bde], length 1428
10:18:38.999160 IP 112.26.0.1.43445 > 112.26.0.8.36004: Flags [.], seq 818057:819485, ack 1, win 4017, options [nop,nop,TS val 193208 ecr 4294947192,mptcp dss ack 1720219151 seq 3869303055 subseq 818057 len 1428 csum 0xea63], length 1428
10:18:39.062781 IP 112.26.0.1.43445 > 112.26.0.8.36004: Flags [.], seq 818057:819485, ack 1, win 4017, options [nop,nop,TS val 193208 ecr 4294947192,mptcp dss ack 1720219151 seq 3869303055 subseq 818057 len 1428 csum 0xea63], length 1428
10:18:39.066774 IP 112.26.0.1.43445 > 112.26.0.8.36004: Flags [.], seq 819485:820913, ack 1, win 4017, options [nop,nop,TS val 193208 ecr 4294947192,mptcp dss ack 1720219151 seq 3869304483 subseq 819485 len 1428 csum 0x5b66], length 1428
10:18:39.128975 IP 112.26.0.1.43445 > 112.26.0.8.36004: Flags [.], seq 820913:822341, ack 1, win 4017, options [nop,nop,TS val 193208 ecr 4294947192,mptcp dss ack 1720219151 seq 3869305911 subseq 820913 len 1428 csum 0xbecf], length 1428
10:18:39.194913 IP 112.26.0.1.43445 > 112.26.0.8.36004: Flags [.], seq 822341:823769, ack 1, win 4017, options [nop,nop,TS val 193208 ecr 4294947192,mptcp dss ack 1720219151 seq 3869307339 subseq 822341 len 1428 csum 0xb0e6], length 1428
10:18:39.229939 IP 112.26.0.1.43445 > 112.26.0.8.36004: Flags [.], seq 819485:820913, ack 1, win 4017, options [nop,nop,TS val 193208 ecr 4294947192,mptcp dss ack 1720219151 seq 3869304483 subseq 819485 len 1428 csum 0x5b66], length 1428
10:18:39.249514 IP 112.26.0.1.43445 > 112.26.0.8.36004: Flags [.], seq 823769:825197, ack 1, win 4017, options [nop,nop,TS val 193432 ecr 4294947336,mptcp dss ack 1720219151 seq 3869321619 subseq 823769 len 1428 csum 0xd50c], length 1428
10:18:39.308848 IP 112.26.0.1.43445 > 112.26.0.8.36004: Flags [.], seq 820913:822341, ack 1, win 4017, options [nop,nop,TS val 193208 ecr 4294947192,mptcp dss ack 1720219151 seq 3869305911 subseq 820913 len 1428 csum 0xbecf], length 1428
10:18:39.358062 IP 112.26.0.1.43445 > 112.26.0.8.36004: Flags [.], seq 825197:826625, ack 1, win 4017, options [nop,nop,TS val 193432 ecr 4294947336,mptcp dss ack 1720219151 seq 3869323047 subseq 825197 len 1428 csum 0x9a3], length 1428
10:18:39.416548 IP 112.26.0.1.43445 > 112.26.0.8.36004: Flags [.], seq 822341:823769, ack 1, win 4017, options [nop,nop,TS val 193208 ecr 4294947192,mptcp dss ack 1720219151 seq 3869307339 subseq 822341 len 1428 csum 0xb0e6], length 1428
10:18:39.426905 IP 112.26.0.1.43445 > 112.26.0.8.36004: Flags [.], seq 826625:828053, ack 1, win 4017, options [nop,nop,TS val 193663 ecr 4294947560,mptcp dss ack 1720219151 seq 3869340183 subseq 826625 len 1428 csum 0x1d1c], length 1428
10:18:39.464561 IP 112.26.0.1.43445 > 112.26.0.8.36004: Flags [P.], seq 828053:829481, ack 1, win 4017, options [nop,nop,TS val 193663 ecr 4294947560,mptcp dss ack 1720219151 seq 3869341611 subseq 828053 len 1428 csum 0xc76f], length 1428
10:18:39.516517 IP 112.26.0.1.43445 > 112.26.0.8.36004: Flags [.], seq 823769:825197, ack 1, win 4017, options [nop,nop,TS val 193432 ecr 4294947336,mptcp dss ack 1720219151 seq 3869321619 subseq 823769 len 1428 csum 0xd50c], length 1428
10:18:39.536337 IP 112.26.0.1.43445 > 112.26.0.8.36004: Flags [.], seq 829481:830909, ack 1, win 4017, options [nop,nop,TS val 193879 ecr 4294947841,mptcp dss ack 1720219151 seq 3869347323 subseq 829481 len 1428 csum 0x7d1d], length 1428
10:18:39.586712 IP 112.26.0.1.43445 > 112.26.0.8.36004: Flags [.], seq 825197:826625, ack 1, win 4017, options [nop,nop,TS val 193432 ecr 4294947336,mptcp dss ack 1720219151 seq 3869323047 subseq 825197 len 1428 csum 0x9a3], length 1428
10:18:39.589026 IP 112.26.0.1.43445 > 112.26.0.8.36004: Flags [.], seq 830909:832337, ack 1, win 4017, options [nop,nop,TS val 193879 ecr 4294947841,mptcp dss ack 1720219151 seq 3869348751 subseq 830909 len 1428 csum 0x274e], length 1428
10:18:39.678689 IP 112.26.0.1.43445 > 112.26.0.8.36004: Flags [.], seq 832337:833765, ack 1, win 4017, options [nop,nop,TS val 193879 ecr 4294947841,mptcp dss ack 1720219151 seq 3869350179 subseq 832337 len 1428 csum 0xd57b], length 1428
10:18:39.722970 IP 112.26.0.1.43445 > 112.26.0.8.36004: Flags [.], seq 826625:828053, ack 1, win 4017, options [nop,nop,TS val 193663 ecr 4294947560,mptcp dss ack 1720219151 seq 3869340183 subseq 826625 len 1428 csum 0x1d1c], length 1428
10:18:39.761550 IP 112.26.0.1.43445 > 112.26.0.8.36004: Flags [.], seq 833765:835193, ack 1, win 4017, options [nop,nop,TS val 194064 ecr 4294948038,mptcp dss ack 1720219151 seq 3869365887 subseq 833765 len 1428 csum 0x15d9], length 1428
10:18:39.789242 IP 112.26.0.1.43445 > 112.26.0.8.36004: Flags [P.], seq 828053:829481, ack 1, win 4017, options [nop,nop,TS val 193663 ecr 4294947560,mptcp dss ack 1720219151 seq 3869341611 subseq 828053 len 1428 csum 0xc76f], length 1428
10:18:39.808627 IP 112.26.0.1.43445 > 112.26.0.8.36004: Flags [.], seq 835193:836621, ack 1, win 4017, options [nop,nop,TS val 194064 ecr 4294948038,mptcp dss ack 1720219151 seq 3869367315 subseq 835193 len 1428 csum 0xd1b2], length 1428
10:18:39.877566 IP 112.26.0.1.43445 > 112.26.0.8.36004: Flags [.], seq 829481:830909, ack 1, win 4017, options [nop,nop,TS val 193879 ecr 4294947841,mptcp dss ack 1720219151 seq 3869347323 subseq 829481 len 1428 csum 0x7d1d], length 1428
10:18:39.956981 IP 112.26.0.1.43445 > 112.26.0.8.36004: Flags [.], seq 830909:832337, ack 1, win 4017, options [nop,nop,TS val 193879 ecr 4294947841,mptcp dss ack 1720219151 seq 3869348751 subseq 830909 len 1428 csum 0x274e], length 1428
10:18:39.985078 IP 112.26.0.1.43445 > 112.26.0.8.36004: Flags [.], seq 836621:838049, ack 1, win 4017, options [nop,nop,TS val 194358 ecr 4294948360,mptcp dss ack 1720219151 seq 3869377311 subseq 836621 len 1428 csum 0x8cf2], length 1428
10:18:40.065694 IP 112.26.0.1.43445 > 112.26.0.8.36004: Flags [.], seq 838049:839477, ack 1, win 4017, options [nop,nop,TS val 194358 ecr 4294948360,mptcp dss ack 1720219151 seq 3869378739 subseq 838049 len 1428 csum 0xe166], length 1428
10:18:40.092985 IP 112.26.0.1.43445 > 112.26.0.8.36004: Flags [.], seq 832337:833765, ack 1, win 4017, options [nop,nop,TS val 193879 ecr 4294947841,mptcp dss ack 1720219151 seq 3869350179 subseq 832337 len 1428 csum 0xd57b], length 1428
10:18:40.145821 IP 112.26.0.1.43445 > 112.26.0.8.36004: Flags [.], seq 839477:840905, ack 1, win 4017, options [nop,nop,TS val 194358 ecr 4294948360,mptcp dss ack 1720219151 seq 3869380167 subseq 839477 len 1428 csum 0xe151], length 1428
10:18:40.209707 IP 112.26.0.1.43445 > 112.26.0.8.36004: Flags [.], seq 833765:835193, ack 1, win 4017, options [nop,nop,TS val 194064 ecr 4294948038,mptcp dss ack 1720219151 seq 3869365887 subseq 833765 len 1428 csum 0x15d9], length 1428
10:18:40.239207 IP 112.26.0.1.43445 > 112.26.0.8.36004: Flags [.], seq 840905:842333, ack 1, win 4017, options [nop,nop,TS val 194358 ecr 4294948360,mptcp dss ack 1720219151 seq 3869381595 subseq 840905 len 1428 csum 0x2457], length 1428
10:18:40.316957 IP 112.26.0.1.43445 > 112.26.0.8.36004: Flags [.], seq 835193:836621, ack 1, win 4017, options [nop,nop,TS val 194064 ecr 4294948038,mptcp dss ack 1720219151 seq 3869367315 subseq 835193 len 1428 csum 0xd1b2], length 1428
10:18:40.357948 IP 112.26.0.1.43445 > 112.26.0.8.36004: Flags [.], seq 842333:843761, ack 1, win 4017, options [nop,nop,TS val 194731 ecr 4294948695,mptcp dss ack 1720219151 seq 3869400159 subseq 842333 len 1428 csum 0x3a39], length 1428
10:18:40.410519 IP 112.26.0.1.43445 > 112.26.0.8.36004: Flags [.], seq 836621:838049, ack 1, win 4017, options [nop,nop,TS val 194358 ecr 4294948360,mptcp dss ack 1720219151 seq 3869377311 subseq 836621 len 1428 csum 0x8cf2], length 1428
10:18:40.430400 IP 112.26.0.1.43445 > 112.26.0.8.36004: Flags [.], seq 843761:845189, ack 1, win 4017, options [nop,nop,TS val 194731 ecr 4294948695,mptcp dss ack 1720219151 seq 3869401587 subseq 843761 len 1428 csum 0x4a52], length 1428
10:18:40.508511 IP 112.26.0.1.43445 > 112.26.0.8.36004: Flags [.], seq 845189:846617, ack 1, win 4017, options [nop,nop,TS val 194731 ecr 4294948695,mptcp dss ack 1720219151 seq 3869403015 subseq 845189 len 1428 csum 0xc7], length 1428
10:18:40.536005 IP 112.26.0.1.43445 > 112.26.0.8.36004: Flags [.], seq 838049:839477, ack 1, win 4017, options [nop,nop,TS val 194358 ecr 4294948360,mptcp dss ack 1720219151 seq 3869378739 subseq 838049 len 1428 csum 0xe166], length 1428
10:18:40.582242 IP 112.26.0.1.43445 > 112.26.0.8.36004: Flags [.], seq 846617:848045, ack 1, win 4017, options [nop,nop,TS val 194731 ecr 4294948695,mptcp dss ack 1720219151 seq 3869404443 subseq 846617 len 1428 csum 0x7a89], length 1428
10:18:40.644390 IP 112.26.0.1.43445 > 112.26.0.8.36004: Flags [.], seq 848045:849473, ack 1, win 4017, options [nop,nop,TS val 194731 ecr 4294948695,mptcp dss ack 1720219151 seq 3869405871 subseq 848045 len 1428 csum 0xef06], length 1428
10:18:40.664741 IP 112.26.0.1.43445 > 112.26.0.8.36004: Flags [.], seq 839477:840905, ack 1, win 4017, options [nop,nop,TS val 194358 ecr 4294948360,mptcp dss ack 1720219151 seq 3869380167 subseq 839477 len 1428 csum 0xe151], length 1428
