09:49:04.137661 IP 112.26.0.8.60272 > 112.26.0.1.43359: Flags [S], seq 3441072221, win 65535, options [mss 1460,sackOK,TS val 443219 ecr 0,nop,wscale 6], length 0
09:49:04.138003 IP 112.26.0.8.60272 > 112.26.0.1.43359: Flags [S], seq 3441072221, win 65535, options [mss 1460,sackOK,TS val 443219 ecr 0,nop,wscale 6], length 0
09:49:04.145127 IP 112.26.0.8.60272 > 112.26.0.1.43359: Flags [S], seq 3441072221, win 65535, options [mss 1460,sackOK,TS val 443219 ecr 0,nop,wscale 6], length 0
09:49:04.240800 IP 112.26.0.1.43359 > 112.26.0.8.60272: Flags [S.], seq 2422673350, ack 3441072222, win 28960, options [mss 1460,sackOK,TS val 664086 ecr 443219,nop,wscale 7], length 0
09:49:04.246413 IP 112.26.0.8.60272 > 112.26.0.1.43359: Flags [.], ack 1, win 1369, options [nop,nop,TS val 443352 ecr 664086], length 0
09:49:04.246899 IP 112.26.0.8.60272 > 112.26.0.1.43359: Flags [.], ack 1, win 1369, options [nop,nop,TS val 443352 ecr 664086], length 0
09:49:04.268243 IP 112.26.0.8.60272 > 112.26.0.1.43359: Flags [.], ack 1, win 1369, options [nop,nop,TS val 443352 ecr 664086], length 0
09:49:44.701216 IP 112.26.0.8.60272 > 112.26.0.1.43359: Flags [.], ack 625289, win 8543, options [nop,nop,TS val 483407 ecr 703444,nop,nop,sack 3 {629633:631081}{652801:654249}{649905:651353}], length 0
09:49:44.711310 IP 112.26.0.1.43359 > 112.26.0.8.60272: Flags [.], seq 642665:644113, ack 1, win 227, options [nop,nop,TS val 704258 ecr 482999], length 1448
09:49:44.714947 IP 112.26.0.8.60272 > 112.26.0.1.43359: Flags [.], ack 625289, win 8543, options [nop,nop,TS val 483822 ecr 703444,nop,nop,sack 3 {642665:644113}{655697:657145}{632529:633977}], length 0
09:49:44.715267 IP 112.26.0.8.60272 > 112.26.0.1.43359: Flags [.], ack 625289, win 8543, options [nop,nop,TS val 483822 ecr 703444,nop,nop,sack 3 {642665:644113}{655697:657145}{632529:633977}], length 0
09:49:44.794404 IP 112.26.0.1.43359 > 112.26.0.8.60272: Flags [.], seq 657145:658593, ack 1, win 227, options [nop,nop,TS val 704339 ecr 483092], length 1448
09:49:44.803930 IP 112.26.0.8.60272 > 112.26.0.1.43359: Flags [.], ack 625289, win 8543, options [nop,nop,TS val 483905 ecr 703444,nop,nop,sack 3 {655697:658593}{642665:644113}{632529:633977}], length 0
09:49:44.804222 IP 112.26.0.8.60272 > 112.26.0.1.43359: Flags [.], ack 625289, win 8543, options [nop,nop,TS val 483905 ecr 703444,nop,nop,sack 3 {655697:658593}{642665:644113}{632529:633977}], length 0
09:49:44.813559 IP 112.26.0.1.43359 > 112.26.0.8.60272: Flags [.], seq 644113:645561, ack 1, win 227, options [nop,nop,TS val 704349 ecr 483120], length 1448
09:49:44.890762 IP 112.26.0.8.60272 > 112.26.0.1.43359: Flags [.], ack 625289, win 8543, options [nop,nop,TS val 483998 ecr 703444,nop,nop,sack 3 {642665:645561}{655697:658593}{632529:633977}], length 0
09:49:44.891109 IP 112.26.0.8.60272 > 112.26.0.1.43359: Flags [.], ack 625289, win 8543, options [nop,nop,TS val 483998 ecr 703444,nop,nop,sack 3 {642665:645561}{655697:658593}{632529:633977}], length 0
09:49:44.900738 IP 112.26.0.1.43359 > 112.26.0.8.60272: Flags [P.], seq 648457:649905, ack 1, win 227, options [nop,nop,TS val 704359 ecr 483203], length 1448
09:49:44.912222 IP 112.26.0.8.60272 > 112.26.0.1.43359: Flags [.], ack 625289, win 8543, options [nop,nop,TS val 484020 ecr 703444,nop,nop,sack 3 {648457:649905}{642665:645561}{655697:658593}], length 0
09:49:44.912519 IP 112.26.0.8.60272 > 112.26.0.1.43359: Flags [.], ack 625289, win 8543, options [nop,nop,TS val 484020 ecr 703444,nop,nop,sack 3 {648457:649905}{642665:645561}{655697:658593}], length 0
09:49:44.920734 IP 112.26.0.1.43359 > 112.26.0.8.60272: Flags [.], seq 651353:652801, ack 1, win 227, options [nop,nop,TS val 704442 ecr 483292], length 1448
09:49:44.995087 IP 112.26.0.1.43359 > 112.26.0.8.60272: Flags [.], seq 658593:660041, ack 1, win 227, options [nop,nop,TS val 704442 ecr 483292], length 1448
09:49:45.001751 IP 112.26.0.8.60272 > 112.26.0.1.43359: Flags [.], ack 625289, win 8543, options [nop,nop,TS val 484109 ecr 703444,nop,nop,sack 3 {651353:652801}{648457:649905}{642665:645561}], length 0
09:49:45.002028 IP 112.26.0.8.60272 > 112.26.0.1.43359: Flags [.], ack 625289, win 8543, options [nop,nop,TS val 484109 ecr 703444,nop,nop,sack 3 {651353:652801}{648457:649905}{642665:645561}], length 0
09:49:45.015797 IP 112.26.0.1.43359 > 112.26.0.8.60272: Flags [.], seq 660041:661489, ack 1, win 227, options [nop,nop,TS val 704442 ecr 483292], length 1448
09:49:45.097047 IP 112.26.0.8.60272 > 112.26.0.1.43359: Flags [.], ack 625289, win 8543, options [nop,nop,TS val 484129 ecr 703444,nop,nop,sack 3 {655697:660041}{651353:652801}{648457:649905}], length 0
09:49:45.097328 IP 112.26.0.8.60272 > 112.26.0.1.43359: Flags [.], ack 625289, win 8543, options [nop,nop,TS val 484129 ecr 703444,nop,nop,sack 3 {655697:660041}{651353:652801}{648457:649905}], length 0
09:49:45.109514 IP 112.26.0.8.60272 > 112.26.0.1.43359: Flags [.], ack 625289, win 8543, options [nop,nop,TS val 483704 ecr 703444,nop,nop,sack 3 {632529:633977}{629633:631081}{652801:654249}], length 0
09:49:45.126351 IP 112.26.0.8.60272 > 112.26.0.1.43359: Flags [.], ack 625289, win 8543, options [nop,nop,TS val 484232 ecr 703444,nop,nop,sack 3 {655697:661489}{651353:652801}{648457:649905}], length 0
09:49:45.126663 IP 112.26.0.8.60272 > 112.26.0.1.43359: Flags [.], ack 625289, win 8543, options [nop,nop,TS val 484232 ecr 703444,nop,nop,sack 3 {655697:661489}{651353:652801}{648457:649905}], length 0
09:49:45.190941 IP 112.26.0.8.60272 > 112.26.0.1.43359: Flags [.], ack 625289, win 8543, options [nop,nop,TS val 483733 ecr 703444,nop,nop,sack 3 {655697:657145}{632529:633977}{629633:631081}], length 0
09:49:45.205164 IP 112.26.0.8.60272 > 112.26.0.1.43359: Flags [.], ack 625289, win 8543, options [nop,nop,TS val 483822 ecr 703444,nop,nop,sack 3 {642665:644113}{655697:657145}{632529:633977}], length 0
09:49:45.215970 IP 112.26.0.8.60272 > 112.26.0.1.43359: Flags [.], ack 625289, win 8543, options [nop,nop,TS val 483905 ecr 703444,nop,nop,sack 3 {655697:658593}{642665:644113}{632529:633977}], length 0
09:49:45.301423 IP 112.26.0.8.60272 > 112.26.0.1.43359: Flags [.], ack 625289, win 8543, options [nop,nop,TS val 483998 ecr 703444,nop,nop,sack 3 {642665:645561}{655697:658593}{632529:633977}], length 0
09:49:45.309270 IP 112.26.0.8.60272 > 112.26.0.1.43359: Flags [.], ack 625289, win 8543, options [nop,nop,TS val 484020 ecr 703444,nop,nop,sack 3 {648457:649905}{642665:645561}{655697:658593}], length 0
09:49:45.396566 IP 112.26.0.8.60272 > 112.26.0.1.43359: Flags [.], ack 625289, win 8543, options [nop,nop,TS val 484109 ecr 703444,nop,nop,sack 3 {651353:652801}{648457:649905}{642665:645561}], length 0
09:49:45.408754 IP 112.26.0.8.60272 > 112.26.0.1.43359: Flags [.], ack 625289, win 8543, options [nop,nop,TS val 484129 ecr 703444,nop,nop,sack 3 {655697:660041}{651353:652801}{648457:649905}], length 0
09:49:45.419227 IP 112.26.0.1.43359 > 112.26.0.8.60272: Flags [.], seq 654249:655697, ack 1, win 227, options [nop,nop,TS val 705052 ecr 483704], length 1448
09:49:45.423913 IP 112.26.0.8.60272 > 112.26.0.1.43359: Flags [.], ack 625289, win 8543, options [nop,nop,TS val 484530 ecr 703444,nop,nop,sack 3 {654249:661489}{651353:652801}{648457:649905}], length 0
09:49:45.424203 IP 112.26.0.8.60272 > 112.26.0.1.43359: Flags [.], ack 625289, win 8543, options [nop,nop,TS val 484530 ecr 703444,nop,nop,sack 3 {654249:661489}{651353:652801}{648457:649905}], length 0
09:49:45.509216 IP 112.26.0.8.60272 > 112.26.0.1.43359: Flags [.], ack 625289, win 8543, options [nop,nop,TS val 484232 ecr 703444,nop,nop,sack 3 {655697:661489}{651353:652801}{648457:649905}], length 0
09:49:45.515905 IP 112.26.0.1.43359 > 112.26.0.8.60272: Flags [.], seq 662937:664385, ack 1, win 227, options [nop,nop,TS val 705133 ecr 483733], length 1448
09:49:45.518652 IP 112.26.0.8.60272 > 112.26.0.1.43359: Flags [.], ack 625289, win 8543, options [nop,nop,TS val 484627 ecr 703444,nop,nop,sack 3 {662937:664385}{654249:661489}{651353:652801}], length 0
09:49:45.518900 IP 112.26.0.8.60272 > 112.26.0.1.43359: Flags [.], ack 625289, win 8543, options [nop,nop,TS val 484627 ecr 703444,nop,nop,sack 3 {662937:664385}{654249:661489}{651353:652801}], length 0
09:49:45.614404 IP 112.26.0.1.43359 > 112.26.0.8.60272: Flags [.], seq 664385:665833, ack 1, win 227, options [nop,nop,TS val 705148 ecr 483822], length 1448
09:49:45.620264 IP 112.26.0.8.60272 > 112.26.0.1.43359: Flags [.], ack 625289, win 8543, options [nop,nop,TS val 484725 ecr 703444,nop,nop,sack 3 {662937:665833}{654249:661489}{651353:652801}], length 0
09:49:45.620589 IP 112.26.0.8.60272 > 112.26.0.1.43359: Flags [.], ack 625289, win 8543, options [nop,nop,TS val 484725 ecr 703444,nop,nop,sack 3 {662937:665833}{654249:661489}{651353:652801}], length 0
09:49:45.694101 IP 112.26.0.1.43359 > 112.26.0.8.60272: Flags [.], seq 665833:667281, ack 1, win 227, options [nop,nop,TS val 705158 ecr 483905], length 1448
09:49:45.697552 IP 112.26.0.8.60272 > 112.26.0.1.43359: Flags [.], ack 625289, win 8543, options [nop,nop,TS val 484805 ecr 703444,nop,nop,sack 3 {662937:667281}{654249:661489}{651353:652801}], length 0
09:49:45.697824 IP 112.26.0.8.60272 > 112.26.0.1.43359: Flags [.], ack 625289, win 8543, options [nop,nop,TS val 484805 ecr 703444,nop,nop,sack 3 {662937:667281}{654249:661489}{651353:652801}], length 0
09:49:45.715037 IP 112.26.0.1.43359 > 112.26.0.8.60272: Flags [.], seq 667281:668729, ack 1, win 227, options [nop,nop,TS val 705244 ecr 483998], length 1448
09:49:45.719942 IP 112.26.0.8.60272 > 112.26.0.1.43359: Flags [.], ack 625289, win 8543, options [nop,nop,TS val 484826 ecr 703444,nop,nop,sack 3 {662937:668729}{654249:661489}{651353:652801}], length 0
09:49:45.720223 IP 112.26.0.8.60272 > 112.26.0.1.43359: Flags [.], ack 625289, win 8543, options [nop,nop,TS val 484826 ecr 703444,nop,nop,sack 3 {662937:668729}{654249:661489}{651353:652801}], length 0
09:49:45.804185 IP 112.26.0.1.43359 > 112.26.0.8.60272: Flags [.], seq 668729:670177, ack 1, win 227, options [nop,nop,TS val 705252 ecr 484020], length 1448
09:49:45.810318 IP 112.26.0.8.60272 > 112.26.0.1.43359: Flags [.], ack 625289, win 8543, options [nop,nop,TS val 484915 ecr 703444,nop,nop,sack 3 {662937:670177}{654249:661489}{651353:652801}], length 0
09:49:45.810648 IP 112.26.0.8.60272 > 112.26.0.1.43359: Flags [.], ack 625289, win 8543, options [nop,nop,TS val 484915 ecr 703444,nop,nop,sack 3 {662937:670177}{654249:661489}{651353:652801}], length 0
09:49:45.893497 IP 112.26.0.1.43359 > 112.26.0.8.60272: Flags [.], seq 670177:671625, ack 1, win 227, options [nop,nop,TS val 705339 ecr 484109], length 1448
09:49:45.897620 IP 112.26.0.8.60272 > 112.26.0.1.43359: Flags [.], ack 625289, win 8543, options [nop,nop,TS val 485005 ecr 703444,nop,nop,sack 3 {662937:671625}{654249:661489}{651353:652801}], length 0
09:49:45.897932 IP 112.26.0.8.60272 > 112.26.0.1.43359: Flags [.], ack 625289, win 8543, options [nop,nop,TS val 485005 ecr 703444,nop,nop,sack 3 {662937:671625}{654249:661489}{651353:652801}], length 0
09:49:45.915409 IP 112.26.0.8.60272 > 112.26.0.1.43359: Flags [.], ack 625289, win 8543, options [nop,nop,TS val 484530 ecr 703444,nop,nop,sack 3 {654249:661489}{651353:652801}{648457:649905}], length 0
09:49:46.007348 IP 112.26.0.1.43359 > 112.26.0.8.60272: Flags [.], seq 671625:673073, ack 1, win 227, options [nop,nop,TS val 705351 ecr 484129], length 1448
09:49:46.019353 IP 112.26.0.8.60272 > 112.26.0.1.43359: Flags [.], ack 625289, win 8543, options [nop,nop,TS val 485118 ecr 703444,nop,nop,sack 3 {662937:673073}{654249:661489}{651353:652801}], length 0
09:49:46.019655 IP 112.26.0.8.60272 > 112.26.0.1.43359: Flags [.], ack 625289, win 8543, options [nop,nop,TS val 485118 ecr 703444,nop,nop,sack 3 {662937:673073}{654249:661489}{651353:652801}], length 0
09:49:46.027295 IP 112.26.0.1.43359 > 112.26.0.8.60272: Flags [.], seq 673073:674521, ack 1, win 227, options [nop,nop,TS val 705452 ecr 484232], length 1448
09:49:46.095965 IP 112.26.0.8.60272 > 112.26.0.1.43359: Flags [.], ack 625289, win 8543, options [nop,nop,TS val 485146 ecr 703444,nop,nop,sack 3 {662937:674521}{654249:661489}{651353:652801}], length 0
09:49:46.096286 IP 112.26.0.8.60272 > 112.26.0.1.43359: Flags [.], ack 625289, win 8543, options [nop,nop,TS val 485146 ecr 703444,nop,nop,sack 3 {662937:674521}{654249:661489}{651353:652801}], length 0
09:49:46.113766 IP 112.26.0.8.60272 > 112.26.0.1.43359: Flags [.], ack 625289, win 8543, options [nop,nop,TS val 484725 ecr 703444,nop,nop,sack 3 {662937:665833}{654249:661489}{651353:652801}], length 0
09:49:46.125615 IP 112.26.0.8.60272 > 112.26.0.1.43359: Flags [.], ack 625289, win 8543, options [nop,nop,TS val 484805 ecr 703444,nop,nop,sack 3 {662937:667281}{654249:661489}{651353:652801}], length 0
09:49:46.199423 IP 112.26.0.8.60272 > 112.26.0.1.43359: Flags [.], ack 625289, win 8543, options [nop,nop,TS val 484826 ecr 703444,nop,nop,sack 3 {662937:668729}{654249:661489}{651353:652801}], length 0
09:49:46.209330 IP 112.26.0.8.60272 > 112.26.0.1.43359: Flags [.], ack 625289, win 8543, options [nop,nop,TS val 484915 ecr 703444,nop,nop,sack 3 {662937:670177}{654249:661489}{651353:652801}], length 0
09:49:46.301680 IP 112.26.0.8.60272 > 112.26.0.1.43359: Flags [.], ack 625289, win 8543, options [nop,nop,TS val 485005 ecr 703444,nop,nop,sack 3 {662937:671625}{654249:661489}{651353:652801}], length 0
09:49:46.315555 IP 112.26.0.1.43359 > 112.26.0.8.60272: Flags [.], seq 625289:626737, ack 1, win 227, options [nop,nop,TS val 705858 ecr 484530], length 1448
09:49:46.319215 IP 112.26.0.8.60272 > 112.26.0.1.43359: Flags [.], ack 661489, win 8093, options [nop,nop,TS val 485426 ecr 705858,nop,nop,sack 1 {662937:674521}], length 0
09:49:46.319475 IP 112.26.0.8.60272 > 112.26.0.1.43359: Flags [.], ack 661489, win 8093, options [nop,nop,TS val 485426 ecr 705858,nop,nop,sack 1 {662937:674521}], length 0
09:49:46.407084 IP 112.26.0.8.60272 > 112.26.0.1.43359: Flags [.], ack 625289, win 8543, options [nop,nop,TS val 485118 ecr 703444,nop,nop,sack 3 {662937:673073}{654249:661489}{651353:652801}], length 0
09:49:46.418040 IP 112.26.0.8.60272 > 112.26.0.1.43359: Flags [.], ack 625289, win 8543, options [nop,nop,TS val 485146 ecr 703444,nop,nop,sack 3 {662937:674521}{654249:661489}{651353:652801}], length 0
09:49:46.508376 IP 112.26.0.1.43359 > 112.26.0.8.60272: Flags [.], seq 661489:662937, ack 1, win 227, options [nop,nop,TS val 706056 ecr 484725], length 1448
09:49:46.511613 IP 112.26.0.8.60272 > 112.26.0.1.43359: Flags [.], ack 674521, win 8469, options [nop,nop,TS val 485619 ecr 706056], length 0
09:49:46.511825 IP 112.26.0.8.60272 > 112.26.0.1.43359: Flags [.], ack 674521, win 8469, options [nop,nop,TS val 485619 ecr 706056], length 0
09:49:46.598204 IP 112.26.0.1.43359 > 112.26.0.8.60272: Flags [.], seq 674521:675969, ack 1, win 227, options [nop,nop,TS val 706056 ecr 484725], length 1448
09:49:46.604568 IP 112.26.0.8.60272 > 112.26.0.1.43359: Flags [.], ack 675969, win 8588, options [nop,nop,TS val 485710 ecr 706056], length 0
09:49:46.604903 IP 112.26.0.8.60272 > 112.26.0.1.43359: Flags [.], ack 675969, win 8588, options [nop,nop,TS val 485710 ecr 706056], length 0
09:49:46.618901 IP 112.26.0.1.43359 > 112.26.0.8.60272: Flags [.], seq 675969:677417, ack 1, win 227, options [nop,nop,TS val 706068 ecr 484805], length 1448
09:49:46.628814 IP 112.26.0.8.60272 > 112.26.0.1.43359: Flags [.], ack 677417, win 8588, options [nop,nop,TS val 485734 ecr 706068], length 0
09:49:46.629119 IP 112.26.0.8.60272 > 112.26.0.1.43359: Flags [.], ack 677417, win 8588, options [nop,nop,TS val 485734 ecr 706068], length 0
09:49:46.696990 IP 112.26.0.1.43359 > 112.26.0.8.60272: Flags [.], seq 677417:678865, ack 1, win 227, options [nop,nop,TS val 706141 ecr 484826], length 1448
09:49:46.710200 IP 112.26.0.8.60272 > 112.26.0.1.43359: Flags [.], ack 678865, win 8588, options [nop,nop,TS val 485808 ecr 706141], length 0
09:49:46.710446 IP 112.26.0.8.60272 > 112.26.0.1.43359: Flags [.], ack 678865, win 8588, options [nop,nop,TS val 485808 ecr 706141], length 0
09:49:46.717542 IP 112.26.0.1.43359 > 112.26.0.8.60272: Flags [.], seq 678865:680313, ack 1, win 227, options [nop,nop,TS val 706151 ecr 484915], length 1448
09:49:46.733648 IP 112.26.0.8.60272 > 112.26.0.1.43359: Flags [.], ack 661489, win 8093, options [nop,nop,TS val 485426 ecr 705858,nop,nop,sack 1 {662937:674521}], length 0
09:49:46.734801 IP 112.26.0.8.60272 > 112.26.0.1.43359: Flags [.], ack 680313, win 8588, options [nop,nop,TS val 485831 ecr 706151], length 0
09:49:46.735106 IP 112.26.0.8.60272 > 112.26.0.1.43359: Flags [.], ack 680313, win 8588, options [nop,nop,TS val 485831 ecr 706151], length 0
09:49:46.812954 IP 112.26.0.1.43359 > 112.26.0.8.60272: Flags [.], seq 680313:681761, ack 1, win 227, options [nop,nop,TS val 706243 ecr 485005], length 1448
09:49:46.819420 IP 112.26.0.8.60272 > 112.26.0.1.43359: Flags [.], ack 681761, win 8588, options [nop,nop,TS val 485924 ecr 706243], length 0
09:49:46.819747 IP 112.26.0.8.60272 > 112.26.0.1.43359: Flags [.], ack 681761, win 8588, options [nop,nop,TS val 485924 ecr 706243], length 0
09:49:46.896098 IP 112.26.0.1.43359 > 112.26.0.8.60272: Flags [.], seq 681761:683209, ack 1, win 227, options [nop,nop,TS val 706349 ecr 485118], length 1448
09:49:46.909946 IP 112.26.0.8.60272 > 112.26.0.1.43359: Flags [.], ack 683209, win 8588, options [nop,nop,TS val 486017 ecr 706349], length 0
09:49:46.910225 IP 112.26.0.8.60272 > 112.26.0.1.43359: Flags [.], ack 683209, win 8588, options [nop,nop,TS val 486017 ecr 706349], length 0
09:49:46.920467 IP 112.26.0.1.43359 > 112.26.0.8.60272: Flags [.], seq 683209:684657, ack 1, win 227, options [nop,nop,TS val 706360 ecr 485146], length 1448
09:49:46.930256 IP 112.26.0.8.60272 > 112.26.0.1.43359: Flags [.], ack 684657, win 8588, options [nop,nop,TS val 486038 ecr 706360], length 0
09:49:46.930635 IP 112.26.0.8.60272 > 112.26.0.1.43359: Flags [.], ack 684657, win 8588, options [nop,nop,TS val 486038 ecr 706360], length 0
09:49:47.008069 IP 112.26.0.8.60272 > 112.26.0.1.43359: Flags [.], ack 674521, win 8469, options [nop,nop,TS val 485619 ecr 706056], length 0
09:49:47.025094 IP 112.26.0.8.60272 > 112.26.0.1.43359: Flags [.], ack 675969, win 8588, options [nop,nop,TS val 485710 ecr 706056], length 0
09:49:47.104123 IP 112.26.0.8.60272 > 112.26.0.1.43359: Flags [.], ack 677417, win 8588, options [nop,nop,TS val 485734 ecr 706068], length 0
09:49:47.118640 IP 112.26.0.8.60272 > 112.26.0.1.43359: Flags [.], ack 678865, win 8588, options [nop,nop,TS val 485808 ecr 706141], length 0
09:49:47.206239 IP 112.26.0.1.43359 > 112.26.0.8.60272: Flags [.], seq 684657:686105, ack 1, win 227, options [nop,nop,TS val 706675 ecr 485426], length 1448
09:49:47.210494 IP 112.26.0.8.60272 > 112.26.0.1.43359: Flags [.], ack 686105, win 8588, options [nop,nop,TS val 486318 ecr 706675], length 0
09:49:47.210832 IP 112.26.0.8.60272 > 112.26.0.1.43359: Flags [.], ack 686105, win 8588, options [nop,nop,TS val 486318 ecr 706675], length 0
09:49:47.238407 IP 112.26.0.8.60272 > 112.26.0.1.43359: Flags [.], ack 680313, win 8588, options [nop,nop,TS val 485831 ecr 706151], length 0
09:49:47.311807 IP 112.26.0.8.60272 > 112.26.0.1.43359: Flags [.], ack 681761, win 8588, options [nop,nop,TS val 485924 ecr 706243], length 0
09:49:47.322177 IP 112.26.0.8.60272 > 112.26.0.1.43359: Flags [.], ack 683209, win 8588, options [nop,nop,TS val 486017 ecr 706349], length 0
09:49:47.409317 IP 112.26.0.8.60272 > 112.26.0.1.43359: Flags [.], ack 684657, win 8588, options [nop,nop,TS val 486038 ecr 706360], length 0
09:49:47.421264 IP 112.26.0.1.43359 > 112.26.0.8.60272: Flags [P.], seq 686105:687553, ack 1, win 227, options [nop,nop,TS val 706950 ecr 485619], length 1448
09:49:47.424744 IP 112.26.0.8.60272 > 112.26.0.1.43359: Flags [.], ack 687553, win 8588, options [nop,nop,TS val 486532 ecr 706950], length 0
09:49:47.425052 IP 112.26.0.8.60272 > 112.26.0.1.43359: Flags [.], ack 687553, win 8588, options [nop,nop,TS val 486532 ecr 706950], length 0
09:49:47.511925 IP 112.26.0.1.43359 > 112.26.0.8.60272: Flags [.], seq 687553:689001, ack 1, win 227, options [nop,nop,TS val 706967 ecr 485710], length 1448
09:49:47.517414 IP 112.26.0.8.60272 > 112.26.0.1.43359: Flags [.], ack 689001, win 8588, options [nop,nop,TS val 486623 ecr 706967], length 0
09:49:47.517642 IP 112.26.0.8.60272 > 112.26.0.1.43359: Flags [.], ack 689001, win 8588, options [nop,nop,TS val 486623 ecr 706967], length 0
09:49:47.532272 IP 112.26.0.1.43359 > 112.26.0.8.60272: Flags [.], seq 689001:690449, ack 1, win 227, options [nop,nop,TS val 707047 ecr 485734], length 1448
09:49:47.603298 IP 112.26.0.8.60272 > 112.26.0.1.43359: Flags [.], ack 690449, win 8588, options [nop,nop,TS val 486643 ecr 707047], length 0
09:49:47.603651 IP 112.26.0.8.60272 > 112.26.0.1.43359: Flags [.], ack 690449, win 8588, options [nop,nop,TS val 486643 ecr 707047], length 0
09:49:47.621108 IP 112.26.0.1.43359 > 112.26.0.8.60272: Flags [.], seq 690449:691897, ack 1, win 227, options [nop,nop,TS val 707061 ecr 485808], length 1448
09:49:47.624322 IP 112.26.0.8.60272 > 112.26.0.1.43359: Flags [.], ack 691897, win 8588, options [nop,nop,TS val 486732 ecr 707061], length 0
09:49:47.624721 IP 112.26.0.8.60272 > 112.26.0.1.43359: Flags [.], ack 691897, win 8588, options [nop,nop,TS val 486732 ecr 707061], length 0
09:49:47.719424 IP 112.26.0.1.43359 > 112.26.0.8.60272: Flags [.], seq 691897:693345, ack 1, win 227, options [nop,nop,TS val 707181 ecr 485831], length 1448
09:49:47.722718 IP 112.26.0.8.60272 > 112.26.0.1.43359: Flags [.], ack 693345, win 8588, options [nop,nop,TS val 486830 ecr 707181], length 0
09:49:47.723008 IP 112.26.0.8.60272 > 112.26.0.1.43359: Flags [.], ack 693345, win 8588, options [nop,nop,TS val 486830 ecr 707181], length 0
09:49:47.739160 IP 112.26.0.1.43359 > 112.26.0.8.60272: Flags [.], seq 693345:694793, ack 1, win 227, options [nop,nop,TS val 707254 ecr 485924], length 1448
09:49:47.803715 IP 112.26.0.8.60272 > 112.26.0.1.43359: Flags [.], ack 694793, win 8588, options [nop,nop,TS val 486912 ecr 707254], length 0
09:49:47.804026 IP 112.26.0.8.60272 > 112.26.0.1.43359: Flags [.], ack 694793, win 8588, options [nop,nop,TS val 486912 ecr 707254], length 0
09:49:47.826842 IP 112.26.0.1.43359 > 112.26.0.8.60272: Flags [.], seq 694793:696241, ack 1, win 227, options [nop,nop,TS val 707265 ecr 486017], length 1448
09:49:47.845541 IP 112.26.0.1.43359 > 112.26.0.8.60272: Flags [.], seq 696241:697689, ack 1, win 227, options [nop,nop,TS val 707352 ecr 486038], length 1448
09:49:47.912501 IP 112.26.0.8.60272 > 112.26.0.1.43359: Flags [.], ack 687553, win 8588, options [nop,nop,TS val 486532 ecr 706950], length 0
09:49:47.935023 IP 112.26.0.8.60272 > 112.26.0.1.43359: Flags [.], ack 697689, win 8588, options [nop,nop,TS val 487043 ecr 707265], length 0
09:49:47.935331 IP 112.26.0.8.60272 > 112.26.0.1.43359: Flags [.], ack 697689, win 8588, options [nop,nop,TS val 487043 ecr 707265], length 0
09:49:48.019550 IP 112.26.0.8.60272 > 112.26.0.1.43359: Flags [.], ack 689001, win 8588, options [nop,nop,TS val 486623 ecr 706967], length 0
09:49:48.039420 IP 112.26.0.8.60272 > 112.26.0.1.43359: Flags [.], ack 690449, win 8588, options [nop,nop,TS val 486643 ecr 707047], length 0
09:49:48.048922 IP 112.26.0.8.60272 > 112.26.0.1.43359: Flags [.], ack 691897, win 8588, options [nop,nop,TS val 486732 ecr 707061], length 0
09:49:48.119953 IP 112.26.0.8.60272 > 112.26.0.1.43359: Flags [.], ack 693345, win 8588, options [nop,nop,TS val 486830 ecr 707181], length 0
09:49:48.128778 IP 112.26.0.8.60272 > 112.26.0.1.43359: Flags [.], ack 694793, win 8588, options [nop,nop,TS val 486912 ecr 707254], length 0
09:49:48.209526 IP 112.26.0.1.43359 > 112.26.0.8.60272: Flags [.], seq 697689:699137, ack 1, win 227, options [nop,nop,TS val 707855 ecr 486532], length 1448
09:49:48.232206 IP 112.26.0.1.43359 > 112.26.0.8.60272: Flags [.], seq 699137:700585, ack 1, win 227, options [nop,nop,TS val 707855 ecr 486532], length 1448
09:49:48.236834 IP 112.26.0.8.60272 > 112.26.0.1.43359: Flags [.], ack 700585, win 8588, options [nop,nop,TS val 487343 ecr 707855], length 0
09:49:48.237130 IP 112.26.0.8.60272 > 112.26.0.1.43359: Flags [.], ack 700585, win 8588, options [nop,nop,TS val 487343 ecr 707855], length 0
09:49:48.320582 IP 112.26.0.8.60272 > 112.26.0.1.43359: Flags [.], ack 697689, win 8588, options [nop,nop,TS val 487043 ecr 707265], length 0
09:49:48.415444 IP 112.26.0.1.43359 > 112.26.0.8.60272: Flags [.], seq 700585:702033, ack 1, win 227, options [nop,nop,TS val 707962 ecr 486623], length 1448
09:49:48.428304 IP 112.26.0.1.43359 > 112.26.0.8.60272: Flags [.], seq 702033:703481, ack 1, win 227, options [nop,nop,TS val 707962 ecr 486623], length 1448
09:49:48.511167 IP 112.26.0.8.60272 > 112.26.0.1.43359: Flags [.], ack 702033, win 8588, options [nop,nop,TS val 487570 ecr 707962], length 0
09:49:48.511443 IP 112.26.0.8.60272 > 112.26.0.1.43359: Flags [.], ack 702033, win 8588, options [nop,nop,TS val 487570 ecr 707962], length 0
09:49:48.526554 IP 112.26.0.1.43359 > 112.26.0.8.60272: Flags [.], seq 703481:704929, ack 1, win 227, options [nop,nop,TS val 707982 ecr 486643], length 1448
09:49:48.536770 IP 112.26.0.8.60272 > 112.26.0.1.43359: Flags [.], ack 704929, win 8588, options [nop,nop,TS val 487644 ecr 707962], length 0
09:49:48.537017 IP 112.26.0.8.60272 > 112.26.0.1.43359: Flags [.], ack 704929, win 8588, options [nop,nop,TS val 487644 ecr 707962], length 0
09:49:48.545985 IP 112.26.0.1.43359 > 112.26.0.8.60272: Flags [.], seq 704929:706377, ack 1, win 227, options [nop,nop,TS val 707991 ecr 486732], length 1448
09:49:48.622055 IP 112.26.0.1.43359 > 112.26.0.8.60272: Flags [.], seq 706377:707825, ack 1, win 227, options [nop,nop,TS val 708062 ecr 486830], length 1448
09:49:48.628971 IP 112.26.0.1.43359 > 112.26.0.8.60272: Flags [.], seq 707825:709273, ack 1, win 227, options [nop,nop,TS val 708071 ecr 486912], length 1448
09:49:48.634728 IP 112.26.0.8.60272 > 112.26.0.1.43359: Flags [.], ack 707825, win 8588, options [nop,nop,TS val 487742 ecr 707991], length 0
09:49:48.634966 IP 112.26.0.8.60272 > 112.26.0.1.43359: Flags [.], ack 707825, win 8588, options [nop,nop,TS val 487742 ecr 707991], length 0
09:49:48.723194 IP 112.26.0.8.60272 > 112.26.0.1.43359: Flags [.], ack 700585, win 8588, options [nop,nop,TS val 487343 ecr 707855], length 0
09:49:48.739121 IP 112.26.0.1.43359 > 112.26.0.8.60272: Flags [.], seq 709273:710721, ack 1, win 227, options [nop,nop,TS val 708263 ecr 487043], length 1448
09:49:48.746191 IP 112.26.0.8.60272 > 112.26.0.1.43359: Flags [.], ack 710721, win 8588, options [nop,nop,TS val 487854 ecr 708071], length 0
09:49:48.746510 IP 112.26.0.8.60272 > 112.26.0.1.43359: Flags [.], ack 710721, win 8588, options [nop,nop,TS val 487854 ecr 708071], length 0
09:49:48.820604 IP 112.26.0.1.43359 > 112.26.0.8.60272: Flags [.], seq 710721:712169, ack 1, win 227, options [nop,nop,TS val 708263 ecr 487043], length 1448
09:49:48.832996 IP 112.26.0.8.60272 > 112.26.0.1.43359: Flags [.], ack 702033, win 8588, options [nop,nop,TS val 487570 ecr 707962], length 0
09:49:48.908760 IP 112.26.0.8.60272 > 112.26.0.1.43359: Flags [.], ack 712169, win 8588, options [nop,nop,TS val 487987 ecr 708263], length 0
09:49:48.909094 IP 112.26.0.8.60272 > 112.26.0.1.43359: Flags [.], ack 712169, win 8588, options [nop,nop,TS val 487987 ecr 708263], length 0
09:49:48.924833 IP 112.26.0.8.60272 > 112.26.0.1.43359: Flags [.], ack 704929, win 8588, options [nop,nop,TS val 487644 ecr 707962], length 0
09:49:48.943346 IP 112.26.0.8.60272 > 112.26.0.1.43359: Flags [.], ack 707825, win 8588, options [nop,nop,TS val 487742 ecr 707991], length 0
09:49:49.022677 IP 112.26.0.1.43359 > 112.26.0.8.60272: Flags [.], seq 712169:713617, ack 1, win 227, options [nop,nop,TS val 708666 ecr 487343], length 1448
09:49:49.118266 IP 112.26.0.1.43359 > 112.26.0.8.60272: Flags [.], seq 713617:715065, ack 1, win 227, options [nop,nop,TS val 708666 ecr 487343], length 1448
09:49:49.123906 IP 112.26.0.8.60272 > 112.26.0.1.43359: Flags [.], ack 715065, win 8588, options [nop,nop,TS val 488230 ecr 708666], length 0
09:49:49.124195 IP 112.26.0.8.60272 > 112.26.0.1.43359: Flags [.], ack 715065, win 8588, options [nop,nop,TS val 488230 ecr 708666], length 0
09:49:49.142957 IP 112.26.0.8.60272 > 112.26.0.1.43359: Flags [.], ack 710721, win 8588, options [nop,nop,TS val 487854 ecr 708071], length 0
09:49:49.223716 IP 112.26.0.1.43359 > 112.26.0.8.60272: Flags [.], seq 715065:716513, ack 1, win 227, options [nop,nop,TS val 708776 ecr 487570], length 1448
09:49:49.318899 IP 112.26.0.8.60272 > 112.26.0.1.43359: Flags [.], ack 712169, win 8588, options [nop,nop,TS val 487987 ecr 708263], length 0
09:49:49.324452 IP 112.26.0.8.60272 > 112.26.0.1.43359: Flags [.], ack 716513, win 8588, options [nop,nop,TS val 488432 ecr 708776], length 0
09:49:49.324787 IP 112.26.0.8.60272 > 112.26.0.1.43359: Flags [.], ack 716513, win 8588, options [nop,nop,TS val 488432 ecr 708776], length 0
09:49:49.341741 IP 112.26.0.1.43359 > 112.26.0.8.60272: Flags [.], seq 716513:717961, ack 1, win 227, options [nop,nop,TS val 708867 ecr 487644], length 1448
09:49:49.419273 IP 112.26.0.1.43359 > 112.26.0.8.60272: Flags [.], seq 717961:719409, ack 1, win 227, options [nop,nop,TS val 708867 ecr 487644], length 1448
09:49:49.423562 IP 112.26.0.8.60272 > 112.26.0.1.43359: Flags [.], ack 719409, win 8588, options [nop,nop,TS val 488530 ecr 708867], length 0
09:49:49.423822 IP 112.26.0.8.60272 > 112.26.0.1.43359: Flags [.], ack 719409, win 8588, options [nop,nop,TS val 488530 ecr 708867], length 0
09:49:49.440034 IP 112.26.0.1.43359 > 112.26.0.8.60272: Flags [.], seq 719409:720857, ack 1, win 227, options [nop,nop,TS val 708867 ecr 487644], length 1448
09:49:49.520437 IP 112.26.0.1.43359 > 112.26.0.8.60272: Flags [.], seq 720857:722305, ack 1, win 227, options [nop,nop,TS val 708886 ecr 487742], length 1448
09:49:49.528503 IP 112.26.0.8.60272 > 112.26.0.1.43359: Flags [.], ack 722305, win 8588, options [nop,nop,TS val 488635 ecr 708867], length 0
09:49:49.528799 IP 112.26.0.8.60272 > 112.26.0.1.43359: Flags [.], ack 722305, win 8588, options [nop,nop,TS val 488635 ecr 708867], length 0
09:49:49.540751 IP 112.26.0.1.43359 > 112.26.0.8.60272: Flags [.], seq 722305:723753, ack 1, win 227, options [nop,nop,TS val 708886 ecr 487742], length 1448
09:49:49.618449 IP 112.26.0.8.60272 > 112.26.0.1.43359: Flags [.], ack 715065, win 8588, options [nop,nop,TS val 488230 ecr 708666], length 0
09:49:49.639853 IP 112.26.0.1.43359 > 112.26.0.8.60272: Flags [P.], seq 723753:725201, ack 1, win 227, options [nop,nop,TS val 709085 ecr 487854], length 1448
09:49:49.646735 IP 112.26.0.8.60272 > 112.26.0.1.43359: Flags [.], ack 725201, win 8588, options [nop,nop,TS val 488752 ecr 708886], length 0
09:49:49.647026 IP 112.26.0.8.60272 > 112.26.0.1.43359: Flags [.], ack 725201, win 8588, options [nop,nop,TS val 488752 ecr 708886], length 0
09:49:49.723338 IP 112.26.0.1.43359 > 112.26.0.8.60272: Flags [.], seq 725201:726649, ack 1, win 227, options [nop,nop,TS val 709085 ecr 487854], length 1448
09:49:49.733789 IP 112.26.0.1.43359 > 112.26.0.8.60272: Flags [.], seq 726649:728097, ack 1, win 227, options [nop,nop,TS val 709261 ecr 487987], length 1448
09:49:49.742727 IP 112.26.0.8.60272 > 112.26.0.1.43359: Flags [.], ack 728097, win 8588, options [nop,nop,TS val 488848 ecr 709085], length 0
09:49:49.743021 IP 112.26.0.8.60272 > 112.26.0.1.43359: Flags [.], ack 728097, win 8588, options [nop,nop,TS val 488848 ecr 709085], length 0
09:49:49.832852 IP 112.26.0.8.60272 > 112.26.0.1.43359: Flags [.], ack 719409, win 8588, options [nop,nop,TS val 488530 ecr 708867], length 0
09:49:49.923619 IP 112.26.0.8.60272 > 112.26.0.1.43359: Flags [.], ack 722305, win 8588, options [nop,nop,TS val 488635 ecr 708867], length 0
09:49:49.935432 IP 112.26.0.1.43359 > 112.26.0.8.60272: Flags [.], seq 728097:729545, ack 1, win 227, options [nop,nop,TS val 709560 ecr 488230], length 1448
09:49:50.028217 IP 112.26.0.8.60272 > 112.26.0.1.43359: Flags [.], ack 729545, win 8588, options [nop,nop,TS val 489136 ecr 709560], length 0
09:49:50.028466 IP 112.26.0.8.60272 > 112.26.0.1.43359: Flags [.], ack 729545, win 8588, options [nop,nop,TS val 489136 ecr 709560], length 0
09:49:50.038706 IP 112.26.0.1.43359 > 112.26.0.8.60272: Flags [.], seq 729545:730993, ack 1, win 227, options [nop,nop,TS val 709560 ecr 488230], length 1448
09:49:50.125345 IP 112.26.0.8.60272 > 112.26.0.1.43359: Flags [.], ack 725201, win 8588, options [nop,nop,TS val 488752 ecr 708886], length 0
09:49:50.137641 IP 112.26.0.8.60272 > 112.26.0.1.43359: Flags [.], ack 728097, win 8588, options [nop,nop,TS val 488848 ecr 709085], length 0
09:49:50.225166 IP 112.26.0.8.60272 > 112.26.0.1.43359: Flags [.], ack 730993, win 8588, options [nop,nop,TS val 489288 ecr 709560], length 0
09:49:50.225469 IP 112.26.0.8.60272 > 112.26.0.1.43359: Flags [.], ack 730993, win 8588, options [nop,nop,TS val 489288 ecr 709560], length 0
09:49:50.238943 IP 112.26.0.1.43359 > 112.26.0.8.60272: Flags [.], seq 730993:732441, ack 1, win 227, options [nop,nop,TS val 709775 ecr 488530], length 1448
09:49:50.327802 IP 112.26.0.1.43359 > 112.26.0.8.60272: Flags [.], seq 732441:733889, ack 1, win 227, options [nop,nop,TS val 709775 ecr 488530], length 1448
09:49:50.332395 IP 112.26.0.8.60272 > 112.26.0.1.43359: Flags [.], ack 733889, win 8588, options [nop,nop,TS val 489439 ecr 709775], length 0
09:49:50.332658 IP 112.26.0.8.60272 > 112.26.0.1.43359: Flags [.], ack 733889, win 8588, options [nop,nop,TS val 489439 ecr 709775], length 0
09:49:50.355395 IP 112.26.0.1.43359 > 112.26.0.8.60272: Flags [.], seq 733889:735337, ack 1, win 227, options [nop,nop,TS val 709775 ecr 488530], length 1448
09:49:50.432840 IP 112.26.0.1.43359 > 112.26.0.8.60272: Flags [.], seq 735337:736785, ack 1, win 227, options [nop,nop,TS val 709867 ecr 488635], length 1448
09:49:50.439403 IP 112.26.0.8.60272 > 112.26.0.1.43359: Flags [.], ack 736785, win 8588, options [nop,nop,TS val 489544 ecr 709775], length 0
09:49:50.439726 IP 112.26.0.8.60272 > 112.26.0.1.43359: Flags [.], ack 736785, win 8588, options [nop,nop,TS val 489544 ecr 709775], length 0
09:49:50.520340 IP 112.26.0.8.60272 > 112.26.0.1.43359: Flags [.], ack 729545, win 8588, options [nop,nop,TS val 489136 ecr 709560], length 0
09:49:50.534821 IP 112.26.0.1.43359 > 112.26.0.8.60272: Flags [.], seq 736785:738233, ack 1, win 227, options [nop,nop,TS val 709867 ecr 488635], length 1448
09:49:50.545121 IP 112.26.0.1.43359 > 112.26.0.8.60272: Flags [.], seq 738233:739681, ack 1, win 227, options [nop,nop,TS val 710067 ecr 488752], length 1448
09:49:50.621486 IP 112.26.0.8.60272 > 112.26.0.1.43359: Flags [.], ack 739681, win 8588, options [nop,nop,TS val 489729 ecr 709867], length 0
09:49:50.621827 IP 112.26.0.8.60272 > 112.26.0.1.43359: Flags [.], ack 739681, win 8588, options [nop,nop,TS val 489729 ecr 709867], length 0
09:49:50.638729 IP 112.26.0.1.43359 > 112.26.0.8.60272: Flags [.], seq 739681:741129, ack 1, win 227, options [nop,nop,TS val 710067 ecr 488752], length 1448
09:49:50.651422 IP 112.26.0.8.60272 > 112.26.0.1.43359: Flags [.], ack 730993, win 8588, options [nop,nop,TS val 489288 ecr 709560], length 0
09:49:50.731500 IP 112.26.0.1.43359 > 112.26.0.8.60272: Flags [.], seq 741129:742577, ack 1, win 227, options [nop,nop,TS val 710067 ecr 488752], length 1448
09:49:50.736710 IP 112.26.0.8.60272 > 112.26.0.1.43359: Flags [.], ack 742577, win 8588, options [nop,nop,TS val 489842 ecr 710067], length 0
09:49:50.737064 IP 112.26.0.8.60272 > 112.26.0.1.43359: Flags [.], ack 742577, win 8588, options [nop,nop,TS val 489842 ecr 710067], length 0
09:49:50.822121 IP 112.26.0.8.60272 > 112.26.0.1.43359: Flags [.], ack 733889, win 8588, options [nop,nop,TS val 489439 ecr 709775], length 0
09:49:50.838441 IP 112.26.0.1.43359 > 112.26.0.8.60272: Flags [P.], seq 744025:745473, ack 1, win 227, options [nop,nop,TS val 710080 ecr 488848], length 1448
09:49:50.843190 IP 112.26.0.8.60272 > 112.26.0.1.43359: Flags [.], ack 742577, win 8588, options [nop,nop,TS val 489949 ecr 710067,nop,nop,sack 1 {744025:745473}], length 0
09:49:50.843437 IP 112.26.0.8.60272 > 112.26.0.1.43359: Flags [.], ack 742577, win 8588, options [nop,nop,TS val 489949 ecr 710067,nop,nop,sack 1 {744025:745473}], length 0
09:49:50.927715 IP 112.26.0.8.60272 > 112.26.0.1.43359: Flags [.], ack 736785, win 8588, options [nop,nop,TS val 489544 ecr 709775], length 0
09:49:50.939887 IP 112.26.0.1.43359 > 112.26.0.8.60272: Flags [.], seq 745473:746921, ack 1, win 227, options [nop,nop,TS val 710463 ecr 489136], length 1448
09:49:50.945322 IP 112.26.0.8.60272 > 112.26.0.1.43359: Flags [.], ack 742577, win 8588, options [nop,nop,TS val 490051 ecr 710067,nop,nop,sack 1 {744025:746921}], length 0
09:49:50.945587 IP 112.26.0.8.60272 > 112.26.0.1.43359: Flags [.], ack 742577, win 8588, options [nop,nop,TS val 490051 ecr 710067,nop,nop,sack 1 {744025:746921}], length 0
09:49:51.046420 IP 112.26.0.8.60272 > 112.26.0.1.43359: Flags [.], ack 739681, win 8588, options [nop,nop,TS val 489729 ecr 709867], length 0
09:49:51.057750 IP 112.26.0.1.43359 > 112.26.0.8.60272: Flags [.], seq 746921:748369, ack 1, win 227, options [nop,nop,TS val 710594 ecr 489288], length 1448
09:49:51.061787 IP 112.26.0.8.60272 > 112.26.0.1.43359: Flags [.], ack 742577, win 8588, options [nop,nop,TS val 490169 ecr 710067,nop,nop,sack 1 {744025:748369}], length 0
09:49:51.062067 IP 112.26.0.8.60272 > 112.26.0.1.43359: Flags [.], ack 742577, win 8588, options [nop,nop,TS val 490169 ecr 710067,nop,nop,sack 1 {744025:748369}], length 0
09:49:51.142399 IP 112.26.0.1.43359 > 112.26.0.8.60272: Flags [.], seq 748369:749817, ack 1, win 227, options [nop,nop,TS val 710594 ecr 489288], length 1448
09:49:51.151878 IP 112.26.0.8.60272 > 112.26.0.1.43359: Flags [.], ack 742577, win 8588, options [nop,nop,TS val 490258 ecr 710067,nop,nop,sack 1 {744025:749817}], length 0
09:49:51.152162 IP 112.26.0.8.60272 > 112.26.0.1.43359: Flags [.], ack 742577, win 8588, options [nop,nop,TS val 490258 ecr 710067,nop,nop,sack 1 {744025:749817}], length 0
09:49:51.166882 IP 112.26.0.8.60272 > 112.26.0.1.43359: Flags [.], ack 742577, win 8588, options [nop,nop,TS val 489842 ecr 710067], length 0
09:49:51.236146 IP 112.26.0.1.43359 > 112.26.0.8.60272: Flags [.], seq 749817:751265, ack 1, win 227, options [nop,nop,TS val 710764 ecr 489439], length 1448
09:49:51.240025 IP 112.26.0.8.60272 > 112.26.0.1.43359: Flags [.], ack 742577, win 8588, options [nop,nop,TS val 490347 ecr 710067,nop,nop,sack 1 {744025:751265}], length 0
09:49:51.240260 IP 112.26.0.8.60272 > 112.26.0.1.43359: Flags [.], ack 742577, win 8588, options [nop,nop,TS val 490347 ecr 710067,nop,nop,sack 1 {744025:751265}], length 0
09:49:51.328113 IP 112.26.0.1.43359 > 112.26.0.8.60272: Flags [.], seq 751265:752713, ack 1, win 227, options [nop,nop,TS val 710764 ecr 489439], length 1448
09:49:51.341782 IP 112.26.0.8.60272 > 112.26.0.1.43359: Flags [.], ack 742577, win 8588, options [nop,nop,TS val 490439 ecr 710067,nop,nop,sack 1 {744025:752713}], length 0
09:49:51.342023 IP 112.26.0.8.60272 > 112.26.0.1.43359: Flags [.], ack 742577, win 8588, options [nop,nop,TS val 490439 ecr 710067,nop,nop,sack 1 {744025:752713}], length 0
09:49:51.352740 IP 112.26.0.8.60272 > 112.26.0.1.43359: Flags [.], ack 742577, win 8588, options [nop,nop,TS val 489949 ecr 710067,nop,nop,sack 1 {744025:745473}], length 0
09:49:51.362696 IP 112.26.0.1.43359 > 112.26.0.8.60272: Flags [.], seq 752713:754161, ack 1, win 227, options [nop,nop,TS val 710870 ecr 489544], length 1448
09:49:51.366163 IP 112.26.0.8.60272 > 112.26.0.1.43359: Flags [.], ack 742577, win 8588, options [nop,nop,TS val 490474 ecr 710067,nop,nop,sack 1 {744025:754161}], length 0
09:49:51.366403 IP 112.26.0.8.60272 > 112.26.0.1.43359: Flags [.], ack 742577, win 8588, options [nop,nop,TS val 490474 ecr 710067,nop,nop,sack 1 {744025:754161}], length 0
