09:49:04.137812 IP 112.26.0.8.60272 > 112.26.0.1.43359: Flags [S], seq 3441072221, win 65535, options [mss 1460,sackOK,TS val 443219 ecr 0,nop,wscale 6], length 0
09:49:04.145231 IP 112.26.0.8.60272 > 112.26.0.1.43359: Flags [S], seq 3441072221, win 65535, options [mss 1460,sackOK,TS val 443219 ecr 0,nop,wscale 6], length 0
09:49:04.240974 IP 112.26.0.1.43359 > 112.26.0.8.60272: Flags [S.], seq 2422673350, ack 3441072222, win 28960, options [mss 1460,sackOK,TS val 664086 ecr 443219,nop,wscale 7], length 0
09:49:04.241463 IP 112.26.0.1.43359 > 112.26.0.8.60272: Flags [S.], seq 2422673350, ack 3441072222, win 28960, options [mss 1460,sackOK,TS val 664086 ecr 443219,nop,wscale 7], length 0
09:49:04.246612 IP 112.26.0.8.60272 > 112.26.0.1.43359: Flags [.], ack 1, win 1369, options [nop,nop,TS val 443352 ecr 664086], length 0
09:49:04.267266 IP 112.26.0.8.60272 > 112.26.0.1.43359: Flags [.], ack 1, win 1369, options [nop,nop,TS val 443352 ecr 664086], length 0
09:49:04.352507 IP 112.26.0.1.43359 > 112.26.0.8.60272: Flags [.], seq 1:1449, ack 1, win 227, options [nop,nop,TS val 664216 ecr 443352], length 1448
09:49:44.701329 IP 112.26.0.8.60272 > 112.26.0.1.43359: Flags [.], ack 625289, win 8543, options [nop,nop,TS val 483407 ecr 703444,nop,nop,sack 3 {629633:631081}{652801:654249}{649905:651353}], length 0
09:49:44.711420 IP 112.26.0.1.43359 > 112.26.0.8.60272: Flags [.], seq 642665:644113, ack 1, win 227, options [nop,nop,TS val 704258 ecr 482999], length 1448
09:49:44.711722 IP 112.26.0.1.43359 > 112.26.0.8.60272: Flags [.], seq 642665:644113, ack 1, win 227, options [nop,nop,TS val 704258 ecr 482999], length 1448
09:49:44.715063 IP 112.26.0.8.60272 > 112.26.0.1.43359: Flags [.], ack 625289, win 8543, options [nop,nop,TS val 483822 ecr 703444,nop,nop,sack 3 {642665:644113}{655697:657145}{632529:633977}], length 0
09:49:44.794594 IP 112.26.0.1.43359 > 112.26.0.8.60272: Flags [.], seq 657145:658593, ack 1, win 227, options [nop,nop,TS val 704339 ecr 483092], length 1448
09:49:44.794927 IP 112.26.0.1.43359 > 112.26.0.8.60272: Flags [.], seq 657145:658593, ack 1, win 227, options [nop,nop,TS val 704339 ecr 483092], length 1448
09:49:44.804047 IP 112.26.0.8.60272 > 112.26.0.1.43359: Flags [.], ack 625289, win 8543, options [nop,nop,TS val 483905 ecr 703444,nop,nop,sack 3 {655697:658593}{642665:644113}{632529:633977}], length 0
09:49:44.813681 IP 112.26.0.1.43359 > 112.26.0.8.60272: Flags [.], seq 644113:645561, ack 1, win 227, options [nop,nop,TS val 704349 ecr 483120], length 1448
09:49:44.813942 IP 112.26.0.1.43359 > 112.26.0.8.60272: Flags [.], seq 644113:645561, ack 1, win 227, options [nop,nop,TS val 704349 ecr 483120], length 1448
09:49:44.890918 IP 112.26.0.8.60272 > 112.26.0.1.43359: Flags [.], ack 625289, win 8543, options [nop,nop,TS val 483998 ecr 703444,nop,nop,sack 3 {642665:645561}{655697:658593}{632529:633977}], length 0
09:49:44.900851 IP 112.26.0.1.43359 > 112.26.0.8.60272: Flags [P.], seq 648457:649905, ack 1, win 227, options [nop,nop,TS val 704359 ecr 483203], length 1448
09:49:44.901129 IP 112.26.0.1.43359 > 112.26.0.8.60272: Flags [P.], seq 648457:649905, ack 1, win 227, options [nop,nop,TS val 704359 ecr 483203], length 1448
09:49:44.912337 IP 112.26.0.8.60272 > 112.26.0.1.43359: Flags [.], ack 625289, win 8543, options [nop,nop,TS val 484020 ecr 703444,nop,nop,sack 3 {648457:649905}{642665:645561}{655697:658593}], length 0
09:49:44.920842 IP 112.26.0.1.43359 > 112.26.0.8.60272: Flags [.], seq 651353:652801, ack 1, win 227, options [nop,nop,TS val 704442 ecr 483292], length 1448
09:49:44.921111 IP 112.26.0.1.43359 > 112.26.0.8.60272: Flags [.], seq 651353:652801, ack 1, win 227, options [nop,nop,TS val 704442 ecr 483292], length 1448
09:49:44.995195 IP 112.26.0.1.43359 > 112.26.0.8.60272: Flags [.], seq 658593:660041, ack 1, win 227, options [nop,nop,TS val 704442 ecr 483292], length 1448
09:49:44.995455 IP 112.26.0.1.43359 > 112.26.0.8.60272: Flags [.], seq 658593:660041, ack 1, win 227, options [nop,nop,TS val 704442 ecr 483292], length 1448
09:49:45.001866 IP 112.26.0.8.60272 > 112.26.0.1.43359: Flags [.], ack 625289, win 8543, options [nop,nop,TS val 484109 ecr 703444,nop,nop,sack 3 {651353:652801}{648457:649905}{642665:645561}], length 0
09:49:45.015906 IP 112.26.0.1.43359 > 112.26.0.8.60272: Flags [.], seq 660041:661489, ack 1, win 227, options [nop,nop,TS val 704442 ecr 483292], length 1448
09:49:45.016141 IP 112.26.0.1.43359 > 112.26.0.8.60272: Flags [.], seq 660041:661489, ack 1, win 227, options [nop,nop,TS val 704442 ecr 483292], length 1448
09:49:45.097277 IP 112.26.0.8.60272 > 112.26.0.1.43359: Flags [.], ack 625289, win 8543, options [nop,nop,TS val 484129 ecr 703444,nop,nop,sack 3 {655697:660041}{651353:652801}{648457:649905}], length 0
09:49:45.109639 IP 112.26.0.8.60272 > 112.26.0.1.43359: Flags [.], ack 625289, win 8543, options [nop,nop,TS val 483704 ecr 703444,nop,nop,sack 3 {632529:633977}{629633:631081}{652801:654249}], length 0
09:49:45.124364 IP 112.26.0.8.60272 > 112.26.0.1.43359: Flags [.], ack 625289, win 8543, options [nop,nop,TS val 484232 ecr 703444,nop,nop,sack 3 {655697:661489}{651353:652801}{648457:649905}], length 0
09:49:45.191136 IP 112.26.0.8.60272 > 112.26.0.1.43359: Flags [.], ack 625289, win 8543, options [nop,nop,TS val 483733 ecr 703444,nop,nop,sack 3 {655697:657145}{632529:633977}{629633:631081}], length 0
09:49:45.205275 IP 112.26.0.8.60272 > 112.26.0.1.43359: Flags [.], ack 625289, win 8543, options [nop,nop,TS val 483822 ecr 703444,nop,nop,sack 3 {642665:644113}{655697:657145}{632529:633977}], length 0
09:49:45.216081 IP 112.26.0.8.60272 > 112.26.0.1.43359: Flags [.], ack 625289, win 8543, options [nop,nop,TS val 483905 ecr 703444,nop,nop,sack 3 {655697:658593}{642665:644113}{632529:633977}], length 0
09:49:45.301582 IP 112.26.0.8.60272 > 112.26.0.1.43359: Flags [.], ack 625289, win 8543, options [nop,nop,TS val 483998 ecr 703444,nop,nop,sack 3 {642665:645561}{655697:658593}{632529:633977}], length 0
09:49:45.309381 IP 112.26.0.8.60272 > 112.26.0.1.43359: Flags [.], ack 625289, win 8543, options [nop,nop,TS val 484020 ecr 703444,nop,nop,sack 3 {648457:649905}{642665:645561}{655697:658593}], length 0
09:49:45.396762 IP 112.26.0.8.60272 > 112.26.0.1.43359: Flags [.], ack 625289, win 8543, options [nop,nop,TS val 484109 ecr 703444,nop,nop,sack 3 {651353:652801}{648457:649905}{642665:645561}], length 0
09:49:45.408866 IP 112.26.0.8.60272 > 112.26.0.1.43359: Flags [.], ack 625289, win 8543, options [nop,nop,TS val 484129 ecr 703444,nop,nop,sack 3 {655697:660041}{651353:652801}{648457:649905}], length 0
09:49:45.419338 IP 112.26.0.1.43359 > 112.26.0.8.60272: Flags [.], seq 654249:655697, ack 1, win 227, options [nop,nop,TS val 705052 ecr 483704], length 1448
09:49:45.419640 IP 112.26.0.1.43359 > 112.26.0.8.60272: Flags [.], seq 654249:655697, ack 1, win 227, options [nop,nop,TS val 705052 ecr 483704], length 1448
09:49:45.424028 IP 112.26.0.8.60272 > 112.26.0.1.43359: Flags [.], ack 625289, win 8543, options [nop,nop,TS val 484530 ecr 703444,nop,nop,sack 3 {654249:661489}{651353:652801}{648457:649905}], length 0
09:49:45.509326 IP 112.26.0.8.60272 > 112.26.0.1.43359: Flags [.], ack 625289, win 8543, options [nop,nop,TS val 484232 ecr 703444,nop,nop,sack 3 {655697:661489}{651353:652801}{648457:649905}], length 0
09:49:45.516012 IP 112.26.0.1.43359 > 112.26.0.8.60272: Flags [.], seq 662937:664385, ack 1, win 227, options [nop,nop,TS val 705133 ecr 483733], length 1448
09:49:45.516293 IP 112.26.0.1.43359 > 112.26.0.8.60272: Flags [.], seq 662937:664385, ack 1, win 227, options [nop,nop,TS val 705133 ecr 483733], length 1448
09:49:45.518768 IP 112.26.0.8.60272 > 112.26.0.1.43359: Flags [.], ack 625289, win 8543, options [nop,nop,TS val 484627 ecr 703444,nop,nop,sack 3 {662937:664385}{654249:661489}{651353:652801}], length 0
09:49:45.614513 IP 112.26.0.1.43359 > 112.26.0.8.60272: Flags [.], seq 664385:665833, ack 1, win 227, options [nop,nop,TS val 705148 ecr 483822], length 1448
09:49:45.614753 IP 112.26.0.1.43359 > 112.26.0.8.60272: Flags [.], seq 664385:665833, ack 1, win 227, options [nop,nop,TS val 705148 ecr 483822], length 1448
09:49:45.620378 IP 112.26.0.8.60272 > 112.26.0.1.43359: Flags [.], ack 625289, win 8543, options [nop,nop,TS val 484725 ecr 703444,nop,nop,sack 3 {662937:665833}{654249:661489}{651353:652801}], length 0
09:49:45.694245 IP 112.26.0.1.43359 > 112.26.0.8.60272: Flags [.], seq 665833:667281, ack 1, win 227, options [nop,nop,TS val 705158 ecr 483905], length 1448
09:49:45.694530 IP 112.26.0.1.43359 > 112.26.0.8.60272: Flags [.], seq 665833:667281, ack 1, win 227, options [nop,nop,TS val 705158 ecr 483905], length 1448
09:49:45.700357 IP 112.26.0.8.60272 > 112.26.0.1.43359: Flags [.], ack 625289, win 8543, options [nop,nop,TS val 484805 ecr 703444,nop,nop,sack 3 {662937:667281}{654249:661489}{651353:652801}], length 0
09:49:45.715146 IP 112.26.0.1.43359 > 112.26.0.8.60272: Flags [.], seq 667281:668729, ack 1, win 227, options [nop,nop,TS val 705244 ecr 483998], length 1448
09:49:45.715412 IP 112.26.0.1.43359 > 112.26.0.8.60272: Flags [.], seq 667281:668729, ack 1, win 227, options [nop,nop,TS val 705244 ecr 483998], length 1448
09:49:45.720056 IP 112.26.0.8.60272 > 112.26.0.1.43359: Flags [.], ack 625289, win 8543, options [nop,nop,TS val 484826 ecr 703444,nop,nop,sack 3 {662937:668729}{654249:661489}{651353:652801}], length 0
09:49:45.804294 IP 112.26.0.1.43359 > 112.26.0.8.60272: Flags [.], seq 668729:670177, ack 1, win 227, options [nop,nop,TS val 705252 ecr 484020], length 1448
09:49:45.804564 IP 112.26.0.1.43359 > 112.26.0.8.60272: Flags [.], seq 668729:670177, ack 1, win 227, options [nop,nop,TS val 705252 ecr 484020], length 1448
09:49:45.810432 IP 112.26.0.8.60272 > 112.26.0.1.43359: Flags [.], ack 625289, win 8543, options [nop,nop,TS val 484915 ecr 703444,nop,nop,sack 3 {662937:670177}{654249:661489}{651353:652801}], length 0
09:49:45.893695 IP 112.26.0.1.43359 > 112.26.0.8.60272: Flags [.], seq 670177:671625, ack 1, win 227, options [nop,nop,TS val 705339 ecr 484109], length 1448
09:49:45.894027 IP 112.26.0.1.43359 > 112.26.0.8.60272: Flags [.], seq 670177:671625, ack 1, win 227, options [nop,nop,TS val 705339 ecr 484109], length 1448
09:49:45.902092 IP 112.26.0.8.60272 > 112.26.0.1.43359: Flags [.], ack 625289, win 8543, options [nop,nop,TS val 485005 ecr 703444,nop,nop,sack 3 {662937:671625}{654249:661489}{651353:652801}], length 0
09:49:45.915518 IP 112.26.0.8.60272 > 112.26.0.1.43359: Flags [.], ack 625289, win 8543, options [nop,nop,TS val 484530 ecr 703444,nop,nop,sack 3 {654249:661489}{651353:652801}{648457:649905}], length 0
09:49:46.007456 IP 112.26.0.1.43359 > 112.26.0.8.60272: Flags [.], seq 671625:673073, ack 1, win 227, options [nop,nop,TS val 705351 ecr 484129], length 1448
09:49:46.007733 IP 112.26.0.1.43359 > 112.26.0.8.60272: Flags [.], seq 671625:673073, ack 1, win 227, options [nop,nop,TS val 705351 ecr 484129], length 1448
09:49:46.019466 IP 112.26.0.8.60272 > 112.26.0.1.43359: Flags [.], ack 625289, win 8543, options [nop,nop,TS val 485118 ecr 703444,nop,nop,sack 3 {662937:673073}{654249:661489}{651353:652801}], length 0
09:49:46.027402 IP 112.26.0.1.43359 > 112.26.0.8.60272: Flags [.], seq 673073:674521, ack 1, win 227, options [nop,nop,TS val 705452 ecr 484232], length 1448
09:49:46.027685 IP 112.26.0.1.43359 > 112.26.0.8.60272: Flags [.], seq 673073:674521, ack 1, win 227, options [nop,nop,TS val 705452 ecr 484232], length 1448
09:49:46.096121 IP 112.26.0.8.60272 > 112.26.0.1.43359: Flags [.], ack 625289, win 8543, options [nop,nop,TS val 485146 ecr 703444,nop,nop,sack 3 {662937:674521}{654249:661489}{651353:652801}], length 0
09:49:46.113879 IP 112.26.0.8.60272 > 112.26.0.1.43359: Flags [.], ack 625289, win 8543, options [nop,nop,TS val 484725 ecr 703444,nop,nop,sack 3 {662937:665833}{654249:661489}{651353:652801}], length 0
09:49:46.125725 IP 112.26.0.8.60272 > 112.26.0.1.43359: Flags [.], ack 625289, win 8543, options [nop,nop,TS val 484805 ecr 703444,nop,nop,sack 3 {662937:667281}{654249:661489}{651353:652801}], length 0
09:49:46.199630 IP 112.26.0.8.60272 > 112.26.0.1.43359: Flags [.], ack 625289, win 8543, options [nop,nop,TS val 484826 ecr 703444,nop,nop,sack 3 {662937:668729}{654249:661489}{651353:652801}], length 0
09:49:46.209440 IP 112.26.0.8.60272 > 112.26.0.1.43359: Flags [.], ack 625289, win 8543, options [nop,nop,TS val 484915 ecr 703444,nop,nop,sack 3 {662937:670177}{654249:661489}{651353:652801}], length 0
09:49:46.301852 IP 112.26.0.8.60272 > 112.26.0.1.43359: Flags [.], ack 625289, win 8543, options [nop,nop,TS val 485005 ecr 703444,nop,nop,sack 3 {662937:671625}{654249:661489}{651353:652801}], length 0
09:49:46.315675 IP 112.26.0.1.43359 > 112.26.0.8.60272: Flags [.], seq 625289:626737, ack 1, win 227, options [nop,nop,TS val 705858 ecr 484530], length 1448
09:49:46.315938 IP 112.26.0.1.43359 > 112.26.0.8.60272: Flags [.], seq 625289:626737, ack 1, win 227, options [nop,nop,TS val 705858 ecr 484530], length 1448
09:49:46.319337 IP 112.26.0.8.60272 > 112.26.0.1.43359: Flags [.], ack 661489, win 8093, options [nop,nop,TS val 485426 ecr 705858,nop,nop,sack 1 {662937:674521}], length 0
09:49:46.407235 IP 112.26.0.8.60272 > 112.26.0.1.43359: Flags [.], ack 625289, win 8543, options [nop,nop,TS val 485118 ecr 703444,nop,nop,sack 3 {662937:673073}{654249:661489}{651353:652801}], length 0
09:49:46.418151 IP 112.26.0.8.60272 > 112.26.0.1.43359: Flags [.], ack 625289, win 8543, options [nop,nop,TS val 485146 ecr 703444,nop,nop,sack 3 {662937:674521}{654249:661489}{651353:652801}], length 0
09:49:46.508487 IP 112.26.0.1.43359 > 112.26.0.8.60272: Flags [.], seq 661489:662937, ack 1, win 227, options [nop,nop,TS val 706056 ecr 484725], length 1448
09:49:46.508772 IP 112.26.0.1.43359 > 112.26.0.8.60272: Flags [.], seq 661489:662937, ack 1, win 227, options [nop,nop,TS val 706056 ecr 484725], length 1448
09:49:46.511731 IP 112.26.0.8.60272 > 112.26.0.1.43359: Flags [.], ack 674521, win 8469, options [nop,nop,TS val 485619 ecr 706056], length 0
09:49:46.598353 IP 112.26.0.1.43359 > 112.26.0.8.60272: Flags [.], seq 674521:675969, ack 1, win 227, options [nop,nop,TS val 706056 ecr 484725], length 1448
09:49:46.598666 IP 112.26.0.1.43359 > 112.26.0.8.60272: Flags [.], seq 674521:675969, ack 1, win 227, options [nop,nop,TS val 706056 ecr 484725], length 1448
09:49:46.604758 IP 112.26.0.8.60272 > 112.26.0.1.43359: Flags [.], ack 675969, win 8588, options [nop,nop,TS val 485710 ecr 706056], length 0
09:49:46.619012 IP 112.26.0.1.43359 > 112.26.0.8.60272: Flags [.], seq 675969:677417, ack 1, win 227, options [nop,nop,TS val 706068 ecr 484805], length 1448
09:49:46.619295 IP 112.26.0.1.43359 > 112.26.0.8.60272: Flags [.], seq 675969:677417, ack 1, win 227, options [nop,nop,TS val 706068 ecr 484805], length 1448
09:49:46.628930 IP 112.26.0.8.60272 > 112.26.0.1.43359: Flags [.], ack 677417, win 8588, options [nop,nop,TS val 485734 ecr 706068], length 0
09:49:46.697138 IP 112.26.0.1.43359 > 112.26.0.8.60272: Flags [.], seq 677417:678865, ack 1, win 227, options [nop,nop,TS val 706141 ecr 484826], length 1448
09:49:46.697448 IP 112.26.0.1.43359 > 112.26.0.8.60272: Flags [.], seq 677417:678865, ack 1, win 227, options [nop,nop,TS val 706141 ecr 484826], length 1448
09:49:46.710316 IP 112.26.0.8.60272 > 112.26.0.1.43359: Flags [.], ack 678865, win 8588, options [nop,nop,TS val 485808 ecr 706141], length 0
09:49:46.717664 IP 112.26.0.1.43359 > 112.26.0.8.60272: Flags [.], seq 678865:680313, ack 1, win 227, options [nop,nop,TS val 706151 ecr 484915], length 1448
09:49:46.717970 IP 112.26.0.1.43359 > 112.26.0.8.60272: Flags [.], seq 678865:680313, ack 1, win 227, options [nop,nop,TS val 706151 ecr 484915], length 1448
09:49:46.733758 IP 112.26.0.8.60272 > 112.26.0.1.43359: Flags [.], ack 661489, win 8093, options [nop,nop,TS val 485426 ecr 705858,nop,nop,sack 1 {662937:674521}], length 0
09:49:46.734914 IP 112.26.0.8.60272 > 112.26.0.1.43359: Flags [.], ack 680313, win 8588, options [nop,nop,TS val 485831 ecr 706151], length 0
09:49:46.813065 IP 112.26.0.1.43359 > 112.26.0.8.60272: Flags [.], seq 680313:681761, ack 1, win 227, options [nop,nop,TS val 706243 ecr 485005], length 1448
09:49:46.813352 IP 112.26.0.1.43359 > 112.26.0.8.60272: Flags [.], seq 680313:681761, ack 1, win 227, options [nop,nop,TS val 706243 ecr 485005], length 1448
09:49:46.819535 IP 112.26.0.8.60272 > 112.26.0.1.43359: Flags [.], ack 681761, win 8588, options [nop,nop,TS val 485924 ecr 706243], length 0
09:49:46.896278 IP 112.26.0.1.43359 > 112.26.0.8.60272: Flags [.], seq 681761:683209, ack 1, win 227, options [nop,nop,TS val 706349 ecr 485118], length 1448
09:49:46.896612 IP 112.26.0.1.43359 > 112.26.0.8.60272: Flags [.], seq 681761:683209, ack 1, win 227, options [nop,nop,TS val 706349 ecr 485118], length 1448
09:49:46.910061 IP 112.26.0.8.60272 > 112.26.0.1.43359: Flags [.], ack 683209, win 8588, options [nop,nop,TS val 486017 ecr 706349], length 0
09:49:46.920589 IP 112.26.0.1.43359 > 112.26.0.8.60272: Flags [.], seq 683209:684657, ack 1, win 227, options [nop,nop,TS val 706360 ecr 485146], length 1448
09:49:46.920855 IP 112.26.0.1.43359 > 112.26.0.8.60272: Flags [.], seq 683209:684657, ack 1, win 227, options [nop,nop,TS val 706360 ecr 485146], length 1448
09:49:46.930371 IP 112.26.0.8.60272 > 112.26.0.1.43359: Flags [.], ack 684657, win 8588, options [nop,nop,TS val 486038 ecr 706360], length 0
09:49:47.008184 IP 112.26.0.8.60272 > 112.26.0.1.43359: Flags [.], ack 674521, win 8469, options [nop,nop,TS val 485619 ecr 706056], length 0
09:49:47.025206 IP 112.26.0.8.60272 > 112.26.0.1.43359: Flags [.], ack 675969, win 8588, options [nop,nop,TS val 485710 ecr 706056], length 0
09:49:47.104271 IP 112.26.0.8.60272 > 112.26.0.1.43359: Flags [.], ack 677417, win 8588, options [nop,nop,TS val 485734 ecr 706068], length 0
09:49:47.118751 IP 112.26.0.8.60272 > 112.26.0.1.43359: Flags [.], ack 678865, win 8588, options [nop,nop,TS val 485808 ecr 706141], length 0
09:49:47.206408 IP 112.26.0.1.43359 > 112.26.0.8.60272: Flags [.], seq 684657:686105, ack 1, win 227, options [nop,nop,TS val 706675 ecr 485426], length 1448
09:49:47.206761 IP 112.26.0.1.43359 > 112.26.0.8.60272: Flags [.], seq 684657:686105, ack 1, win 227, options [nop,nop,TS val 706675 ecr 485426], length 1448
09:49:47.210689 IP 112.26.0.8.60272 > 112.26.0.1.43359: Flags [.], ack 686105, win 8588, options [nop,nop,TS val 486318 ecr 706675], length 0
09:49:47.238521 IP 112.26.0.8.60272 > 112.26.0.1.43359: Flags [.], ack 680313, win 8588, options [nop,nop,TS val 485831 ecr 706151], length 0
09:49:47.311956 IP 112.26.0.8.60272 > 112.26.0.1.43359: Flags [.], ack 681761, win 8588, options [nop,nop,TS val 485924 ecr 706243], length 0
09:49:47.322289 IP 112.26.0.8.60272 > 112.26.0.1.43359: Flags [.], ack 683209, win 8588, options [nop,nop,TS val 486017 ecr 706349], length 0
09:49:47.409465 IP 112.26.0.8.60272 > 112.26.0.1.43359: Flags [.], ack 684657, win 8588, options [nop,nop,TS val 486038 ecr 706360], length 0
09:49:47.421375 IP 112.26.0.1.43359 > 112.26.0.8.60272: Flags [P.], seq 686105:687553, ack 1, win 227, options [nop,nop,TS val 706950 ecr 485619], length 1448
09:49:47.421705 IP 112.26.0.1.43359 > 112.26.0.8.60272: Flags [P.], seq 686105:687553, ack 1, win 227, options [nop,nop,TS val 706950 ecr 485619], length 1448
09:49:47.424860 IP 112.26.0.8.60272 > 112.26.0.1.43359: Flags [.], ack 687553, win 8588, options [nop,nop,TS val 486532 ecr 706950], length 0
09:49:47.512074 IP 112.26.0.1.43359 > 112.26.0.8.60272: Flags [.], seq 687553:689001, ack 1, win 227, options [nop,nop,TS val 706967 ecr 485710], length 1448
09:49:47.512354 IP 112.26.0.1.43359 > 112.26.0.8.60272: Flags [.], seq 687553:689001, ack 1, win 227, options [nop,nop,TS val 706967 ecr 485710], length 1448
09:49:47.517529 IP 112.26.0.8.60272 > 112.26.0.1.43359: Flags [.], ack 689001, win 8588, options [nop,nop,TS val 486623 ecr 706967], length 0
09:49:47.532384 IP 112.26.0.1.43359 > 112.26.0.8.60272: Flags [.], seq 689001:690449, ack 1, win 227, options [nop,nop,TS val 707047 ecr 485734], length 1448
09:49:47.532721 IP 112.26.0.1.43359 > 112.26.0.8.60272: Flags [.], seq 689001:690449, ack 1, win 227, options [nop,nop,TS val 707047 ecr 485734], length 1448
09:49:47.603443 IP 112.26.0.8.60272 > 112.26.0.1.43359: Flags [.], ack 690449, win 8588, options [nop,nop,TS val 486643 ecr 707047], length 0
09:49:47.621221 IP 112.26.0.1.43359 > 112.26.0.8.60272: Flags [.], seq 690449:691897, ack 1, win 227, options [nop,nop,TS val 707061 ecr 485808], length 1448
09:49:47.621469 IP 112.26.0.1.43359 > 112.26.0.8.60272: Flags [.], seq 690449:691897, ack 1, win 227, options [nop,nop,TS val 707061 ecr 485808], length 1448
09:49:47.624436 IP 112.26.0.8.60272 > 112.26.0.1.43359: Flags [.], ack 691897, win 8588, options [nop,nop,TS val 486732 ecr 707061], length 0
09:49:47.719537 IP 112.26.0.1.43359 > 112.26.0.8.60272: Flags [.], seq 691897:693345, ack 1, win 227, options [nop,nop,TS val 707181 ecr 485831], length 1448
09:49:47.719806 IP 112.26.0.1.43359 > 112.26.0.8.60272: Flags [.], seq 691897:693345, ack 1, win 227, options [nop,nop,TS val 707181 ecr 485831], length 1448
09:49:47.722833 IP 112.26.0.8.60272 > 112.26.0.1.43359: Flags [.], ack 693345, win 8588, options [nop,nop,TS val 486830 ecr 707181], length 0
09:49:47.739271 IP 112.26.0.1.43359 > 112.26.0.8.60272: Flags [.], seq 693345:694793, ack 1, win 227, options [nop,nop,TS val 707254 ecr 485924], length 1448
09:49:47.739548 IP 112.26.0.1.43359 > 112.26.0.8.60272: Flags [.], seq 693345:694793, ack 1, win 227, options [nop,nop,TS val 707254 ecr 485924], length 1448
09:49:47.815422 IP 112.26.0.8.60272 > 112.26.0.1.43359: Flags [.], ack 694793, win 8588, options [nop,nop,TS val 486912 ecr 707254], length 0
09:49:47.826954 IP 112.26.0.1.43359 > 112.26.0.8.60272: Flags [.], seq 694793:696241, ack 1, win 227, options [nop,nop,TS val 707265 ecr 486017], length 1448
09:49:47.827258 IP 112.26.0.1.43359 > 112.26.0.8.60272: Flags [.], seq 694793:696241, ack 1, win 227, options [nop,nop,TS val 707265 ecr 486017], length 1448
09:49:47.845663 IP 112.26.0.1.43359 > 112.26.0.8.60272: Flags [.], seq 696241:697689, ack 1, win 227, options [nop,nop,TS val 707352 ecr 486038], length 1448
09:49:47.845962 IP 112.26.0.1.43359 > 112.26.0.8.60272: Flags [.], seq 696241:697689, ack 1, win 227, options [nop,nop,TS val 707352 ecr 486038], length 1448
09:49:47.912638 IP 112.26.0.8.60272 > 112.26.0.1.43359: Flags [.], ack 687553, win 8588, options [nop,nop,TS val 486532 ecr 706950], length 0
09:49:47.935138 IP 112.26.0.8.60272 > 112.26.0.1.43359: Flags [.], ack 697689, win 8588, options [nop,nop,TS val 487043 ecr 707265], length 0
09:49:48.019675 IP 112.26.0.8.60272 > 112.26.0.1.43359: Flags [.], ack 689001, win 8588, options [nop,nop,TS val 486623 ecr 706967], length 0
09:49:48.039530 IP 112.26.0.8.60272 > 112.26.0.1.43359: Flags [.], ack 690449, win 8588, options [nop,nop,TS val 486643 ecr 707047], length 0
09:49:48.049033 IP 112.26.0.8.60272 > 112.26.0.1.43359: Flags [.], ack 691897, win 8588, options [nop,nop,TS val 486732 ecr 707061], length 0
09:49:48.120064 IP 112.26.0.8.60272 > 112.26.0.1.43359: Flags [.], ack 693345, win 8588, options [nop,nop,TS val 486830 ecr 707181], length 0
09:49:48.127428 IP 112.26.0.8.60272 > 112.26.0.1.43359: Flags [.], ack 694793, win 8588, options [nop,nop,TS val 486912 ecr 707254], length 0
09:49:48.209686 IP 112.26.0.1.43359 > 112.26.0.8.60272: Flags [.], seq 697689:699137, ack 1, win 227, options [nop,nop,TS val 707855 ecr 486532], length 1448
09:49:48.209962 IP 112.26.0.1.43359 > 112.26.0.8.60272: Flags [.], seq 697689:699137, ack 1, win 227, options [nop,nop,TS val 707855 ecr 486532], length 1448
09:49:48.232316 IP 112.26.0.1.43359 > 112.26.0.8.60272: Flags [.], seq 699137:700585, ack 1, win 227, options [nop,nop,TS val 707855 ecr 486532], length 1448
09:49:48.232668 IP 112.26.0.1.43359 > 112.26.0.8.60272: Flags [.], seq 699137:700585, ack 1, win 227, options [nop,nop,TS val 707855 ecr 486532], length 1448
09:49:48.236949 IP 112.26.0.8.60272 > 112.26.0.1.43359: Flags [.], ack 700585, win 8588, options [nop,nop,TS val 487343 ecr 707855], length 0
09:49:48.320699 IP 112.26.0.8.60272 > 112.26.0.1.43359: Flags [.], ack 697689, win 8588, options [nop,nop,TS val 487043 ecr 707265], length 0
09:49:48.415641 IP 112.26.0.1.43359 > 112.26.0.8.60272: Flags [.], seq 700585:702033, ack 1, win 227, options [nop,nop,TS val 707962 ecr 486623], length 1448
09:49:48.415986 IP 112.26.0.1.43359 > 112.26.0.8.60272: Flags [.], seq 700585:702033, ack 1, win 227, options [nop,nop,TS val 707962 ecr 486623], length 1448
09:49:48.428413 IP 112.26.0.1.43359 > 112.26.0.8.60272: Flags [.], seq 702033:703481, ack 1, win 227, options [nop,nop,TS val 707962 ecr 486623], length 1448
09:49:48.428679 IP 112.26.0.1.43359 > 112.26.0.8.60272: Flags [.], seq 702033:703481, ack 1, win 227, options [nop,nop,TS val 707962 ecr 486623], length 1448
09:49:48.511322 IP 112.26.0.8.60272 > 112.26.0.1.43359: Flags [.], ack 702033, win 8588, options [nop,nop,TS val 487570 ecr 707962], length 0
09:49:48.526676 IP 112.26.0.1.43359 > 112.26.0.8.60272: Flags [.], seq 703481:704929, ack 1, win 227, options [nop,nop,TS val 707982 ecr 486643], length 1448
09:49:48.526972 IP 112.26.0.1.43359 > 112.26.0.8.60272: Flags [.], seq 703481:704929, ack 1, win 227, options [nop,nop,TS val 707982 ecr 486643], length 1448
09:49:48.536886 IP 112.26.0.8.60272 > 112.26.0.1.43359: Flags [.], ack 704929, win 8588, options [nop,nop,TS val 487644 ecr 707962], length 0
09:49:48.546096 IP 112.26.0.1.43359 > 112.26.0.8.60272: Flags [.], seq 704929:706377, ack 1, win 227, options [nop,nop,TS val 707991 ecr 486732], length 1448
09:49:48.546404 IP 112.26.0.1.43359 > 112.26.0.8.60272: Flags [.], seq 704929:706377, ack 1, win 227, options [nop,nop,TS val 707991 ecr 486732], length 1448
09:49:48.622166 IP 112.26.0.1.43359 > 112.26.0.8.60272: Flags [.], seq 706377:707825, ack 1, win 227, options [nop,nop,TS val 708062 ecr 486830], length 1448
09:49:48.622477 IP 112.26.0.1.43359 > 112.26.0.8.60272: Flags [.], seq 706377:707825, ack 1, win 227, options [nop,nop,TS val 708062 ecr 486830], length 1448
09:49:48.629081 IP 112.26.0.1.43359 > 112.26.0.8.60272: Flags [.], seq 707825:709273, ack 1, win 227, options [nop,nop,TS val 708071 ecr 486912], length 1448
09:49:48.629379 IP 112.26.0.1.43359 > 112.26.0.8.60272: Flags [.], seq 707825:709273, ack 1, win 227, options [nop,nop,TS val 708071 ecr 486912], length 1448
09:49:48.634843 IP 112.26.0.8.60272 > 112.26.0.1.43359: Flags [.], ack 707825, win 8588, options [nop,nop,TS val 487742 ecr 707991], length 0
09:49:48.723308 IP 112.26.0.8.60272 > 112.26.0.1.43359: Flags [.], ack 700585, win 8588, options [nop,nop,TS val 487343 ecr 707855], length 0
09:49:48.739230 IP 112.26.0.1.43359 > 112.26.0.8.60272: Flags [.], seq 709273:710721, ack 1, win 227, options [nop,nop,TS val 708263 ecr 487043], length 1448
09:49:48.739536 IP 112.26.0.1.43359 > 112.26.0.8.60272: Flags [.], seq 709273:710721, ack 1, win 227, options [nop,nop,TS val 708263 ecr 487043], length 1448
09:49:48.746306 IP 112.26.0.8.60272 > 112.26.0.1.43359: Flags [.], ack 710721, win 8588, options [nop,nop,TS val 487854 ecr 708071], length 0
09:49:48.820720 IP 112.26.0.1.43359 > 112.26.0.8.60272: Flags [.], seq 710721:712169, ack 1, win 227, options [nop,nop,TS val 708263 ecr 487043], length 1448
09:49:48.820971 IP 112.26.0.1.43359 > 112.26.0.8.60272: Flags [.], seq 710721:712169, ack 1, win 227, options [nop,nop,TS val 708263 ecr 487043], length 1448
09:49:48.833108 IP 112.26.0.8.60272 > 112.26.0.1.43359: Flags [.], ack 702033, win 8588, options [nop,nop,TS val 487570 ecr 707962], length 0
09:49:48.908940 IP 112.26.0.8.60272 > 112.26.0.1.43359: Flags [.], ack 712169, win 8588, options [nop,nop,TS val 487987 ecr 708263], length 0
09:49:48.924947 IP 112.26.0.8.60272 > 112.26.0.1.43359: Flags [.], ack 704929, win 8588, options [nop,nop,TS val 487644 ecr 707962], length 0
09:49:48.943457 IP 112.26.0.8.60272 > 112.26.0.1.43359: Flags [.], ack 707825, win 8588, options [nop,nop,TS val 487742 ecr 707991], length 0
09:49:49.022810 IP 112.26.0.1.43359 > 112.26.0.8.60272: Flags [.], seq 712169:713617, ack 1, win 227, options [nop,nop,TS val 708666 ecr 487343], length 1448
09:49:49.023054 IP 112.26.0.1.43359 > 112.26.0.8.60272: Flags [.], seq 712169:713617, ack 1, win 227, options [nop,nop,TS val 708666 ecr 487343], length 1448
09:49:49.118437 IP 112.26.0.1.43359 > 112.26.0.8.60272: Flags [.], seq 713617:715065, ack 1, win 227, options [nop,nop,TS val 708666 ecr 487343], length 1448
09:49:49.118767 IP 112.26.0.1.43359 > 112.26.0.8.60272: Flags [.], seq 713617:715065, ack 1, win 227, options [nop,nop,TS val 708666 ecr 487343], length 1448
09:49:49.124025 IP 112.26.0.8.60272 > 112.26.0.1.43359: Flags [.], ack 715065, win 8588, options [nop,nop,TS val 488230 ecr 708666], length 0
09:49:49.143069 IP 112.26.0.8.60272 > 112.26.0.1.43359: Flags [.], ack 710721, win 8588, options [nop,nop,TS val 487854 ecr 708071], length 0
09:49:49.223826 IP 112.26.0.1.43359 > 112.26.0.8.60272: Flags [.], seq 715065:716513, ack 1, win 227, options [nop,nop,TS val 708776 ecr 487570], length 1448
09:49:49.224098 IP 112.26.0.1.43359 > 112.26.0.8.60272: Flags [.], seq 715065:716513, ack 1, win 227, options [nop,nop,TS val 708776 ecr 487570], length 1448
09:49:49.319078 IP 112.26.0.8.60272 > 112.26.0.1.43359: Flags [.], ack 712169, win 8588, options [nop,nop,TS val 487987 ecr 708263], length 0
09:49:49.324653 IP 112.26.0.8.60272 > 112.26.0.1.43359: Flags [.], ack 716513, win 8588, options [nop,nop,TS val 488432 ecr 708776], length 0
09:49:49.341854 IP 112.26.0.1.43359 > 112.26.0.8.60272: Flags [.], seq 716513:717961, ack 1, win 227, options [nop,nop,TS val 708867 ecr 487644], length 1448
09:49:49.342102 IP 112.26.0.1.43359 > 112.26.0.8.60272: Flags [.], seq 716513:717961, ack 1, win 227, options [nop,nop,TS val 708867 ecr 487644], length 1448
09:49:49.419420 IP 112.26.0.1.43359 > 112.26.0.8.60272: Flags [.], seq 717961:719409, ack 1, win 227, options [nop,nop,TS val 708867 ecr 487644], length 1448
09:49:49.419735 IP 112.26.0.1.43359 > 112.26.0.8.60272: Flags [.], seq 717961:719409, ack 1, win 227, options [nop,nop,TS val 708867 ecr 487644], length 1448
09:49:49.423730 IP 112.26.0.8.60272 > 112.26.0.1.43359: Flags [.], ack 719409, win 8588, options [nop,nop,TS val 488530 ecr 708867], length 0
09:49:49.440147 IP 112.26.0.1.43359 > 112.26.0.8.60272: Flags [.], seq 719409:720857, ack 1, win 227, options [nop,nop,TS val 708867 ecr 487644], length 1448
09:49:49.440443 IP 112.26.0.1.43359 > 112.26.0.8.60272: Flags [.], seq 719409:720857, ack 1, win 227, options [nop,nop,TS val 708867 ecr 487644], length 1448
09:49:49.520607 IP 112.26.0.1.43359 > 112.26.0.8.60272: Flags [.], seq 720857:722305, ack 1, win 227, options [nop,nop,TS val 708886 ecr 487742], length 1448
09:49:49.520892 IP 112.26.0.1.43359 > 112.26.0.8.60272: Flags [.], seq 720857:722305, ack 1, win 227, options [nop,nop,TS val 708886 ecr 487742], length 1448
09:49:49.528630 IP 112.26.0.8.60272 > 112.26.0.1.43359: Flags [.], ack 722305, win 8588, options [nop,nop,TS val 488635 ecr 708867], length 0
09:49:49.540863 IP 112.26.0.1.43359 > 112.26.0.8.60272: Flags [.], seq 722305:723753, ack 1, win 227, options [nop,nop,TS val 708886 ecr 487742], length 1448
09:49:49.541129 IP 112.26.0.1.43359 > 112.26.0.8.60272: Flags [.], seq 722305:723753, ack 1, win 227, options [nop,nop,TS val 708886 ecr 487742], length 1448
09:49:49.618660 IP 112.26.0.8.60272 > 112.26.0.1.43359: Flags [.], ack 715065, win 8588, options [nop,nop,TS val 488230 ecr 708666], length 0
09:49:49.639962 IP 112.26.0.1.43359 > 112.26.0.8.60272: Flags [P.], seq 723753:725201, ack 1, win 227, options [nop,nop,TS val 709085 ecr 487854], length 1448
09:49:49.640239 IP 112.26.0.1.43359 > 112.26.0.8.60272: Flags [P.], seq 723753:725201, ack 1, win 227, options [nop,nop,TS val 709085 ecr 487854], length 1448
09:49:49.646859 IP 112.26.0.8.60272 > 112.26.0.1.43359: Flags [.], ack 725201, win 8588, options [nop,nop,TS val 488752 ecr 708886], length 0
09:49:49.723488 IP 112.26.0.1.43359 > 112.26.0.8.60272: Flags [.], seq 725201:726649, ack 1, win 227, options [nop,nop,TS val 709085 ecr 487854], length 1448
09:49:49.723823 IP 112.26.0.1.43359 > 112.26.0.8.60272: Flags [.], seq 725201:726649, ack 1, win 227, options [nop,nop,TS val 709085 ecr 487854], length 1448
09:49:49.733900 IP 112.26.0.1.43359 > 112.26.0.8.60272: Flags [.], seq 726649:728097, ack 1, win 227, options [nop,nop,TS val 709261 ecr 487987], length 1448
09:49:49.734259 IP 112.26.0.1.43359 > 112.26.0.8.60272: Flags [.], seq 726649:728097, ack 1, win 227, options [nop,nop,TS val 709261 ecr 487987], length 1448
09:49:49.742842 IP 112.26.0.8.60272 > 112.26.0.1.43359: Flags [.], ack 728097, win 8588, options [nop,nop,TS val 488848 ecr 709085], length 0
09:49:49.832967 IP 112.26.0.8.60272 > 112.26.0.1.43359: Flags [.], ack 719409, win 8588, options [nop,nop,TS val 488530 ecr 708867], length 0
09:49:49.923770 IP 112.26.0.8.60272 > 112.26.0.1.43359: Flags [.], ack 722305, win 8588, options [nop,nop,TS val 488635 ecr 708867], length 0
09:49:49.935543 IP 112.26.0.1.43359 > 112.26.0.8.60272: Flags [.], seq 728097:729545, ack 1, win 227, options [nop,nop,TS val 709560 ecr 488230], length 1448
09:49:49.935793 IP 112.26.0.1.43359 > 112.26.0.8.60272: Flags [.], seq 728097:729545, ack 1, win 227, options [nop,nop,TS val 709560 ecr 488230], length 1448
09:49:50.028334 IP 112.26.0.8.60272 > 112.26.0.1.43359: Flags [.], ack 729545, win 8588, options [nop,nop,TS val 489136 ecr 709560], length 0
09:49:50.038819 IP 112.26.0.1.43359 > 112.26.0.8.60272: Flags [.], seq 729545:730993, ack 1, win 227, options [nop,nop,TS val 709560 ecr 488230], length 1448
09:49:50.039127 IP 112.26.0.1.43359 > 112.26.0.8.60272: Flags [.], seq 729545:730993, ack 1, win 227, options [nop,nop,TS val 709560 ecr 488230], length 1448
09:49:50.125526 IP 112.26.0.8.60272 > 112.26.0.1.43359: Flags [.], ack 725201, win 8588, options [nop,nop,TS val 488752 ecr 708886], length 0
09:49:50.137753 IP 112.26.0.8.60272 > 112.26.0.1.43359: Flags [.], ack 728097, win 8588, options [nop,nop,TS val 488848 ecr 709085], length 0
09:49:50.222531 IP 112.26.0.8.60272 > 112.26.0.1.43359: Flags [.], ack 730993, win 8588, options [nop,nop,TS val 489288 ecr 709560], length 0
09:49:50.239055 IP 112.26.0.1.43359 > 112.26.0.8.60272: Flags [.], seq 730993:732441, ack 1, win 227, options [nop,nop,TS val 709775 ecr 488530], length 1448
09:49:50.239364 IP 112.26.0.1.43359 > 112.26.0.8.60272: Flags [.], seq 730993:732441, ack 1, win 227, options [nop,nop,TS val 709775 ecr 488530], length 1448
09:49:50.327979 IP 112.26.0.1.43359 > 112.26.0.8.60272: Flags [.], seq 732441:733889, ack 1, win 227, options [nop,nop,TS val 709775 ecr 488530], length 1448
09:49:50.328329 IP 112.26.0.1.43359 > 112.26.0.8.60272: Flags [.], seq 732441:733889, ack 1, win 227, options [nop,nop,TS val 709775 ecr 488530], length 1448
09:49:50.332510 IP 112.26.0.8.60272 > 112.26.0.1.43359: Flags [.], ack 733889, win 8588, options [nop,nop,TS val 489439 ecr 709775], length 0
09:49:50.355507 IP 112.26.0.1.43359 > 112.26.0.8.60272: Flags [.], seq 733889:735337, ack 1, win 227, options [nop,nop,TS val 709775 ecr 488530], length 1448
09:49:50.355812 IP 112.26.0.1.43359 > 112.26.0.8.60272: Flags [.], seq 733889:735337, ack 1, win 227, options [nop,nop,TS val 709775 ecr 488530], length 1448
09:49:50.432950 IP 112.26.0.1.43359 > 112.26.0.8.60272: Flags [.], seq 735337:736785, ack 1, win 227, options [nop,nop,TS val 709867 ecr 488635], length 1448
09:49:50.433262 IP 112.26.0.1.43359 > 112.26.0.8.60272: Flags [.], seq 735337:736785, ack 1, win 227, options [nop,nop,TS val 709867 ecr 488635], length 1448
09:49:50.439519 IP 112.26.0.8.60272 > 112.26.0.1.43359: Flags [.], ack 736785, win 8588, options [nop,nop,TS val 489544 ecr 709775], length 0
09:49:50.520464 IP 112.26.0.8.60272 > 112.26.0.1.43359: Flags [.], ack 729545, win 8588, options [nop,nop,TS val 489136 ecr 709560], length 0
09:49:50.534930 IP 112.26.0.1.43359 > 112.26.0.8.60272: Flags [.], seq 736785:738233, ack 1, win 227, options [nop,nop,TS val 709867 ecr 488635], length 1448
09:49:50.535210 IP 112.26.0.1.43359 > 112.26.0.8.60272: Flags [.], seq 736785:738233, ack 1, win 227, options [nop,nop,TS val 709867 ecr 488635], length 1448
09:49:50.545231 IP 112.26.0.1.43359 > 112.26.0.8.60272: Flags [.], seq 738233:739681, ack 1, win 227, options [nop,nop,TS val 710067 ecr 488752], length 1448
09:49:50.545508 IP 112.26.0.1.43359 > 112.26.0.8.60272: Flags [.], seq 738233:739681, ack 1, win 227, options [nop,nop,TS val 710067 ecr 488752], length 1448
09:49:50.626537 IP 112.26.0.8.60272 > 112.26.0.1.43359: Flags [.], ack 739681, win 8588, options [nop,nop,TS val 489729 ecr 709867], length 0
09:49:50.638840 IP 112.26.0.1.43359 > 112.26.0.8.60272: Flags [.], seq 739681:741129, ack 1, win 227, options [nop,nop,TS val 710067 ecr 488752], length 1448
09:49:50.639094 IP 112.26.0.1.43359 > 112.26.0.8.60272: Flags [.], seq 739681:741129, ack 1, win 227, options [nop,nop,TS val 710067 ecr 488752], length 1448
09:49:50.651533 IP 112.26.0.8.60272 > 112.26.0.1.43359: Flags [.], ack 730993, win 8588, options [nop,nop,TS val 489288 ecr 709560], length 0
09:49:50.731621 IP 112.26.0.1.43359 > 112.26.0.8.60272: Flags [.], seq 741129:742577, ack 1, win 227, options [nop,nop,TS val 710067 ecr 488752], length 1448
09:49:50.731931 IP 112.26.0.1.43359 > 112.26.0.8.60272: Flags [.], seq 741129:742577, ack 1, win 227, options [nop,nop,TS val 710067 ecr 488752], length 1448
09:49:50.736824 IP 112.26.0.8.60272 > 112.26.0.1.43359: Flags [.], ack 742577, win 8588, options [nop,nop,TS val 489842 ecr 710067], length 0
09:49:50.822264 IP 112.26.0.8.60272 > 112.26.0.1.43359: Flags [.], ack 733889, win 8588, options [nop,nop,TS val 489439 ecr 709775], length 0
09:49:50.838550 IP 112.26.0.1.43359 > 112.26.0.8.60272: Flags [P.], seq 744025:745473, ack 1, win 227, options [nop,nop,TS val 710080 ecr 488848], length 1448
09:49:50.838846 IP 112.26.0.1.43359 > 112.26.0.8.60272: Flags [P.], seq 744025:745473, ack 1, win 227, options [nop,nop,TS val 710080 ecr 488848], length 1448
09:49:50.843306 IP 112.26.0.8.60272 > 112.26.0.1.43359: Flags [.], ack 742577, win 8588, options [nop,nop,TS val 489949 ecr 710067,nop,nop,sack 1 {744025:745473}], length 0
09:49:50.927880 IP 112.26.0.8.60272 > 112.26.0.1.43359: Flags [.], ack 736785, win 8588, options [nop,nop,TS val 489544 ecr 709775], length 0
09:49:50.939997 IP 112.26.0.1.43359 > 112.26.0.8.60272: Flags [.], seq 745473:746921, ack 1, win 227, options [nop,nop,TS val 710463 ecr 489136], length 1448
09:49:50.940302 IP 112.26.0.1.43359 > 112.26.0.8.60272: Flags [.], seq 745473:746921, ack 1, win 227, options [nop,nop,TS val 710463 ecr 489136], length 1448
09:49:50.945437 IP 112.26.0.8.60272 > 112.26.0.1.43359: Flags [.], ack 742577, win 8588, options [nop,nop,TS val 490051 ecr 710067,nop,nop,sack 1 {744025:746921}], length 0
09:49:51.046534 IP 112.26.0.8.60272 > 112.26.0.1.43359: Flags [.], ack 739681, win 8588, options [nop,nop,TS val 489729 ecr 709867], length 0
09:49:51.057861 IP 112.26.0.1.43359 > 112.26.0.8.60272: Flags [.], seq 746921:748369, ack 1, win 227, options [nop,nop,TS val 710594 ecr 489288], length 1448
09:49:51.058168 IP 112.26.0.1.43359 > 112.26.0.8.60272: Flags [.], seq 746921:748369, ack 1, win 227, options [nop,nop,TS val 710594 ecr 489288], length 1448
09:49:51.061900 IP 112.26.0.8.60272 > 112.26.0.1.43359: Flags [.], ack 742577, win 8588, options [nop,nop,TS val 490169 ecr 710067,nop,nop,sack 1 {744025:748369}], length 0
09:49:51.142512 IP 112.26.0.1.43359 > 112.26.0.8.60272: Flags [.], seq 748369:749817, ack 1, win 227, options [nop,nop,TS val 710594 ecr 489288], length 1448
09:49:51.142836 IP 112.26.0.1.43359 > 112.26.0.8.60272: Flags [.], seq 748369:749817, ack 1, win 227, options [nop,nop,TS val 710594 ecr 489288], length 1448
