09:49:04.110307 IP 112.26.0.8.60272 > 112.26.0.1.43359: Flags [S], seq 3441072221, win 65535, options [mss 1460,sackOK,TS val 443219 ecr 0,nop,wscale 6], length 0
09:49:04.141635 IP 112.26.0.8.60272 > 112.26.0.1.43359: Flags [S], seq 3441072221, win 65535, options [mss 1460,sackOK,TS val 443219 ecr 0,nop,wscale 6], length 0
09:49:04.243325 IP 112.26.0.1.43359 > 112.26.0.8.60272: Flags [S.], seq 2422673350, ack 3441072222, win 28960, options [mss 1460,sackOK,TS val 664086 ecr 443219,nop,wscale 7], length 0
09:49:04.243915 IP 112.26.0.8.60272 > 112.26.0.1.43359: Flags [.], ack 1, win 1369, options [nop,nop,TS val 443352 ecr 664086], length 0
09:49:04.265794 IP 112.26.0.8.60272 > 112.26.0.1.43359: Flags [.], ack 1, win 1369, options [nop,nop,TS val 443352 ecr 664086], length 0
09:49:04.353957 IP 112.26.0.1.43359 > 112.26.0.8.60272: Flags [.], seq 1:1449, ack 1, win 227, options [nop,nop,TS val 664216 ecr 443352], length 1448
09:49:04.354311 IP 112.26.0.8.60272 > 112.26.0.1.43359: Flags [.], ack 1449, win 1414, options [nop,nop,TS val 443463 ecr 664216], length 0
09:49:44.712885 IP 112.26.0.1.43359 > 112.26.0.8.60272: Flags [.], seq 642665:644113, ack 1, win 227, options [nop,nop,TS val 704258 ecr 482999], length 1448
09:49:44.713263 IP 112.26.0.8.60272 > 112.26.0.1.43359: Flags [.], ack 625289, win 8543, options [nop,nop,TS val 483822 ecr 703444,nop,nop,sack 3 {642665:644113}{655697:657145}{632529:633977}], length 0
09:49:44.716233 IP 112.26.0.8.60272 > 112.26.0.1.43359: Flags [.], ack 625289, win 8543, options [nop,nop,TS val 483822 ecr 703444,nop,nop,sack 3 {642665:644113}{655697:657145}{632529:633977}], length 0
09:49:44.796393 IP 112.26.0.1.43359 > 112.26.0.8.60272: Flags [.], seq 657145:658593, ack 1, win 227, options [nop,nop,TS val 704339 ecr 483092], length 1448
09:49:44.796769 IP 112.26.0.8.60272 > 112.26.0.1.43359: Flags [.], ack 625289, win 8543, options [nop,nop,TS val 483905 ecr 703444,nop,nop,sack 3 {655697:658593}{642665:644113}{632529:633977}], length 0
09:49:44.806237 IP 112.26.0.8.60272 > 112.26.0.1.43359: Flags [.], ack 625289, win 8543, options [nop,nop,TS val 483905 ecr 703444,nop,nop,sack 3 {655697:658593}{642665:644113}{632529:633977}], length 0
09:49:44.888759 IP 112.26.0.1.43359 > 112.26.0.8.60272: Flags [.], seq 644113:645561, ack 1, win 227, options [nop,nop,TS val 704349 ecr 483120], length 1448
09:49:44.889113 IP 112.26.0.8.60272 > 112.26.0.1.43359: Flags [.], ack 625289, win 8543, options [nop,nop,TS val 483998 ecr 703444,nop,nop,sack 3 {642665:645561}{655697:658593}{632529:633977}], length 0
09:49:44.892335 IP 112.26.0.8.60272 > 112.26.0.1.43359: Flags [.], ack 625289, win 8543, options [nop,nop,TS val 483998 ecr 703444,nop,nop,sack 3 {642665:645561}{655697:658593}{632529:633977}], length 0
09:49:44.910771 IP 112.26.0.1.43359 > 112.26.0.8.60272: Flags [P.], seq 648457:649905, ack 1, win 227, options [nop,nop,TS val 704359 ecr 483203], length 1448
09:49:44.911122 IP 112.26.0.8.60272 > 112.26.0.1.43359: Flags [.], ack 625289, win 8543, options [nop,nop,TS val 484020 ecr 703444,nop,nop,sack 3 {648457:649905}{642665:645561}{655697:658593}], length 0
09:49:44.915740 IP 112.26.0.8.60272 > 112.26.0.1.43359: Flags [.], ack 625289, win 8543, options [nop,nop,TS val 484020 ecr 703444,nop,nop,sack 3 {648457:649905}{642665:645561}{655697:658593}], length 0
09:49:45.000275 IP 112.26.0.1.43359 > 112.26.0.8.60272: Flags [.], seq 651353:652801, ack 1, win 227, options [nop,nop,TS val 704442 ecr 483292], length 1448
09:49:45.000654 IP 112.26.0.8.60272 > 112.26.0.1.43359: Flags [.], ack 625289, win 8543, options [nop,nop,TS val 484109 ecr 703444,nop,nop,sack 3 {651353:652801}{648457:649905}{642665:645561}], length 0
09:49:45.007259 IP 112.26.0.8.60272 > 112.26.0.1.43359: Flags [.], ack 625289, win 8543, options [nop,nop,TS val 484109 ecr 703444,nop,nop,sack 3 {651353:652801}{648457:649905}{642665:645561}], length 0
09:49:45.020531 IP 112.26.0.1.43359 > 112.26.0.8.60272: Flags [.], seq 658593:660041, ack 1, win 227, options [nop,nop,TS val 704442 ecr 483292], length 1448
09:49:45.020884 IP 112.26.0.8.60272 > 112.26.0.1.43359: Flags [.], ack 625289, win 8543, options [nop,nop,TS val 484129 ecr 703444,nop,nop,sack 3 {655697:660041}{651353:652801}{648457:649905}], length 0
09:49:45.101544 IP 112.26.0.8.60272 > 112.26.0.1.43359: Flags [.], ack 625289, win 8543, options [nop,nop,TS val 484129 ecr 703444,nop,nop,sack 3 {655697:660041}{651353:652801}{648457:649905}], length 0
09:49:45.123102 IP 112.26.0.1.43359 > 112.26.0.8.60272: Flags [.], seq 660041:661489, ack 1, win 227, options [nop,nop,TS val 704442 ecr 483292], length 1448
09:49:45.123405 IP 112.26.0.8.60272 > 112.26.0.1.43359: Flags [.], ack 625289, win 8543, options [nop,nop,TS val 484232 ecr 703444,nop,nop,sack 3 {655697:661489}{651353:652801}{648457:649905}], length 0
09:49:45.127833 IP 112.26.0.8.60272 > 112.26.0.1.43359: Flags [.], ack 625289, win 8543, options [nop,nop,TS val 484232 ecr 703444,nop,nop,sack 3 {655697:661489}{651353:652801}{648457:649905}], length 0
09:49:45.421254 IP 112.26.0.1.43359 > 112.26.0.8.60272: Flags [.], seq 654249:655697, ack 1, win 227, options [nop,nop,TS val 705052 ecr 483704], length 1448
09:49:45.421628 IP 112.26.0.8.60272 > 112.26.0.1.43359: Flags [.], ack 625289, win 8543, options [nop,nop,TS val 484530 ecr 703444,nop,nop,sack 3 {654249:661489}{651353:652801}{648457:649905}], length 0
09:49:45.429157 IP 112.26.0.8.60272 > 112.26.0.1.43359: Flags [.], ack 625289, win 8543, options [nop,nop,TS val 484530 ecr 703444,nop,nop,sack 3 {654249:661489}{651353:652801}{648457:649905}], length 0
09:49:45.517445 IP 112.26.0.1.43359 > 112.26.0.8.60272: Flags [.], seq 662937:664385, ack 1, win 227, options [nop,nop,TS val 705133 ecr 483733], length 1448
09:49:45.517712 IP 112.26.0.8.60272 > 112.26.0.1.43359: Flags [.], ack 625289, win 8543, options [nop,nop,TS val 484627 ecr 703444,nop,nop,sack 3 {662937:664385}{654249:661489}{651353:652801}], length 0
09:49:45.596837 IP 112.26.0.8.60272 > 112.26.0.1.43359: Flags [.], ack 625289, win 8543, options [nop,nop,TS val 484627 ecr 703444,nop,nop,sack 3 {662937:664385}{654249:661489}{651353:652801}], length 0
09:49:45.615961 IP 112.26.0.1.43359 > 112.26.0.8.60272: Flags [.], seq 664385:665833, ack 1, win 227, options [nop,nop,TS val 705148 ecr 483822], length 1448
09:49:45.616298 IP 112.26.0.8.60272 > 112.26.0.1.43359: Flags [.], ack 625289, win 8543, options [nop,nop,TS val 484725 ecr 703444,nop,nop,sack 3 {662937:665833}{654249:661489}{651353:652801}], length 0
09:49:45.623205 IP 112.26.0.8.60272 > 112.26.0.1.43359: Flags [.], ack 625289, win 8543, options [nop,nop,TS val 484725 ecr 703444,nop,nop,sack 3 {662937:665833}{654249:661489}{651353:652801}], length 0
09:49:45.696160 IP 112.26.0.1.43359 > 112.26.0.8.60272: Flags [.], seq 665833:667281, ack 1, win 227, options [nop,nop,TS val 705158 ecr 483905], length 1448
09:49:45.696416 IP 112.26.0.8.60272 > 112.26.0.1.43359: Flags [.], ack 625289, win 8543, options [nop,nop,TS val 484805 ecr 703444,nop,nop,sack 3 {662937:667281}{654249:661489}{651353:652801}], length 0
09:49:45.699446 IP 112.26.0.8.60272 > 112.26.0.1.43359: Flags [.], ack 625289, win 8543, options [nop,nop,TS val 484805 ecr 703444,nop,nop,sack 3 {662937:667281}{654249:661489}{651353:652801}], length 0
09:49:45.716594 IP 112.26.0.1.43359 > 112.26.0.8.60272: Flags [.], seq 667281:668729, ack 1, win 227, options [nop,nop,TS val 705244 ecr 483998], length 1448
09:49:45.716999 IP 112.26.0.8.60272 > 112.26.0.1.43359: Flags [.], ack 625289, win 8543, options [nop,nop,TS val 484826 ecr 703444,nop,nop,sack 3 {662937:668729}{654249:661489}{651353:652801}], length 0
09:49:45.794832 IP 112.26.0.8.60272 > 112.26.0.1.43359: Flags [.], ack 625289, win 8543, options [nop,nop,TS val 484826 ecr 703444,nop,nop,sack 3 {662937:668729}{654249:661489}{651353:652801}], length 0
09:49:45.805730 IP 112.26.0.1.43359 > 112.26.0.8.60272: Flags [.], seq 668729:670177, ack 1, win 227, options [nop,nop,TS val 705252 ecr 484020], length 1448
09:49:45.806062 IP 112.26.0.8.60272 > 112.26.0.1.43359: Flags [.], ack 625289, win 8543, options [nop,nop,TS val 484915 ecr 703444,nop,nop,sack 3 {662937:670177}{654249:661489}{651353:652801}], length 0
09:49:45.813226 IP 112.26.0.8.60272 > 112.26.0.1.43359: Flags [.], ack 625289, win 8543, options [nop,nop,TS val 484915 ecr 703444,nop,nop,sack 3 {662937:670177}{654249:661489}{651353:652801}], length 0
09:49:45.895936 IP 112.26.0.1.43359 > 112.26.0.8.60272: Flags [.], seq 670177:671625, ack 1, win 227, options [nop,nop,TS val 705339 ecr 484109], length 1448
09:49:45.896297 IP 112.26.0.8.60272 > 112.26.0.1.43359: Flags [.], ack 625289, win 8543, options [nop,nop,TS val 485005 ecr 703444,nop,nop,sack 3 {662937:671625}{654249:661489}{651353:652801}], length 0
09:49:45.902948 IP 112.26.0.8.60272 > 112.26.0.1.43359: Flags [.], ack 625289, win 8543, options [nop,nop,TS val 485005 ecr 703444,nop,nop,sack 3 {662937:671625}{654249:661489}{651353:652801}], length 0
09:49:46.008888 IP 112.26.0.1.43359 > 112.26.0.8.60272: Flags [.], seq 671625:673073, ack 1, win 227, options [nop,nop,TS val 705351 ecr 484129], length 1448
09:49:46.009198 IP 112.26.0.8.60272 > 112.26.0.1.43359: Flags [.], ack 625289, win 8543, options [nop,nop,TS val 485118 ecr 703444,nop,nop,sack 3 {662937:673073}{654249:661489}{651353:652801}], length 0
09:49:46.030453 IP 112.26.0.8.60272 > 112.26.0.1.43359: Flags [.], ack 625289, win 8543, options [nop,nop,TS val 485118 ecr 703444,nop,nop,sack 3 {662937:673073}{654249:661489}{651353:652801}], length 0
09:49:46.037362 IP 112.26.0.1.43359 > 112.26.0.8.60272: Flags [.], seq 673073:674521, ack 1, win 227, options [nop,nop,TS val 705452 ecr 484232], length 1448
09:49:46.037632 IP 112.26.0.8.60272 > 112.26.0.1.43359: Flags [.], ack 625289, win 8543, options [nop,nop,TS val 485146 ecr 703444,nop,nop,sack 3 {662937:674521}{654249:661489}{651353:652801}], length 0
09:49:46.105925 IP 112.26.0.8.60272 > 112.26.0.1.43359: Flags [.], ack 625289, win 8543, options [nop,nop,TS val 485146 ecr 703444,nop,nop,sack 3 {662937:674521}{654249:661489}{651353:652801}], length 0
09:49:46.317124 IP 112.26.0.1.43359 > 112.26.0.8.60272: Flags [.], seq 625289:626737, ack 1, win 227, options [nop,nop,TS val 705858 ecr 484530], length 1448
09:49:46.317450 IP 112.26.0.8.60272 > 112.26.0.1.43359: Flags [.], ack 661489, win 8093, options [nop,nop,TS val 485426 ecr 705858,nop,nop,sack 1 {662937:674521}], length 0
09:49:46.322487 IP 112.26.0.8.60272 > 112.26.0.1.43359: Flags [.], ack 661489, win 8093, options [nop,nop,TS val 485426 ecr 705858,nop,nop,sack 1 {662937:674521}], length 0
09:49:46.509928 IP 112.26.0.1.43359 > 112.26.0.8.60272: Flags [.], seq 661489:662937, ack 1, win 227, options [nop,nop,TS val 706056 ecr 484725], length 1448
09:49:46.510245 IP 112.26.0.8.60272 > 112.26.0.1.43359: Flags [.], ack 674521, win 8469, options [nop,nop,TS val 485619 ecr 706056], length 0
09:49:46.515208 IP 112.26.0.8.60272 > 112.26.0.1.43359: Flags [.], ack 674521, win 8469, options [nop,nop,TS val 485619 ecr 706056], length 0
09:49:46.600536 IP 112.26.0.1.43359 > 112.26.0.8.60272: Flags [.], seq 674521:675969, ack 1, win 227, options [nop,nop,TS val 706056 ecr 484725], length 1448
09:49:46.600884 IP 112.26.0.8.60272 > 112.26.0.1.43359: Flags [.], ack 675969, win 8588, options [nop,nop,TS val 485710 ecr 706056], length 0
09:49:46.606254 IP 112.26.0.8.60272 > 112.26.0.1.43359: Flags [.], ack 675969, win 8588, options [nop,nop,TS val 485710 ecr 706056], length 0
09:49:46.624613 IP 112.26.0.1.43359 > 112.26.0.8.60272: Flags [.], seq 675969:677417, ack 1, win 227, options [nop,nop,TS val 706068 ecr 484805], length 1448
09:49:46.624895 IP 112.26.0.8.60272 > 112.26.0.1.43359: Flags [.], ack 677417, win 8588, options [nop,nop,TS val 485734 ecr 706068], length 0
09:49:46.630580 IP 112.26.0.8.60272 > 112.26.0.1.43359: Flags [.], ack 677417, win 8588, options [nop,nop,TS val 485734 ecr 706068], length 0
09:49:46.699035 IP 112.26.0.1.43359 > 112.26.0.8.60272: Flags [.], seq 677417:678865, ack 1, win 227, options [nop,nop,TS val 706141 ecr 484826], length 1448
09:49:46.699379 IP 112.26.0.8.60272 > 112.26.0.1.43359: Flags [.], ack 678865, win 8588, options [nop,nop,TS val 485808 ecr 706141], length 0
09:49:46.713105 IP 112.26.0.8.60272 > 112.26.0.1.43359: Flags [.], ack 678865, win 8588, options [nop,nop,TS val 485808 ecr 706141], length 0
09:49:46.722324 IP 112.26.0.1.43359 > 112.26.0.8.60272: Flags [.], seq 678865:680313, ack 1, win 227, options [nop,nop,TS val 706151 ecr 484915], length 1448
09:49:46.722679 IP 112.26.0.8.60272 > 112.26.0.1.43359: Flags [.], ack 680313, win 8588, options [nop,nop,TS val 485831 ecr 706151], length 0
09:49:46.736418 IP 112.26.0.8.60272 > 112.26.0.1.43359: Flags [.], ack 680313, win 8588, options [nop,nop,TS val 485831 ecr 706151], length 0
09:49:46.814977 IP 112.26.0.1.43359 > 112.26.0.8.60272: Flags [.], seq 680313:681761, ack 1, win 227, options [nop,nop,TS val 706243 ecr 485005], length 1448
09:49:46.815317 IP 112.26.0.8.60272 > 112.26.0.1.43359: Flags [.], ack 681761, win 8588, options [nop,nop,TS val 485924 ecr 706243], length 0
09:49:46.821167 IP 112.26.0.8.60272 > 112.26.0.1.43359: Flags [.], ack 681761, win 8588, options [nop,nop,TS val 485924 ecr 706243], length 0
09:49:46.908494 IP 112.26.0.1.43359 > 112.26.0.8.60272: Flags [.], seq 681761:683209, ack 1, win 227, options [nop,nop,TS val 706349 ecr 485118], length 1448
09:49:46.908859 IP 112.26.0.8.60272 > 112.26.0.1.43359: Flags [.], ack 683209, win 8588, options [nop,nop,TS val 486017 ecr 706349], length 0
09:49:46.913461 IP 112.26.0.8.60272 > 112.26.0.1.43359: Flags [.], ack 683209, win 8588, options [nop,nop,TS val 486017 ecr 706349], length 0
09:49:46.928817 IP 112.26.0.1.43359 > 112.26.0.8.60272: Flags [.], seq 683209:684657, ack 1, win 227, options [nop,nop,TS val 706360 ecr 485146], length 1448
09:49:46.929162 IP 112.26.0.8.60272 > 112.26.0.1.43359: Flags [.], ack 684657, win 8588, options [nop,nop,TS val 486038 ecr 706360], length 0
09:49:46.997402 IP 112.26.0.8.60272 > 112.26.0.1.43359: Flags [.], ack 684657, win 8588, options [nop,nop,TS val 486038 ecr 706360], length 0
09:49:47.208644 IP 112.26.0.1.43359 > 112.26.0.8.60272: Flags [.], seq 684657:686105, ack 1, win 227, options [nop,nop,TS val 706675 ecr 485426], length 1448
09:49:47.209006 IP 112.26.0.8.60272 > 112.26.0.1.43359: Flags [.], ack 686105, win 8588, options [nop,nop,TS val 486318 ecr 706675], length 0
09:49:47.213817 IP 112.26.0.8.60272 > 112.26.0.1.43359: Flags [.], ack 686105, win 8588, options [nop,nop,TS val 486318 ecr 706675], length 0
09:49:47.423270 IP 112.26.0.1.43359 > 112.26.0.8.60272: Flags [P.], seq 686105:687553, ack 1, win 227, options [nop,nop,TS val 706950 ecr 485619], length 1448
09:49:47.423638 IP 112.26.0.8.60272 > 112.26.0.1.43359: Flags [.], ack 687553, win 8588, options [nop,nop,TS val 486532 ecr 706950], length 0
09:49:47.425909 IP 112.26.0.8.60272 > 112.26.0.1.43359: Flags [.], ack 687553, win 8588, options [nop,nop,TS val 486532 ecr 706950], length 0
09:49:47.513953 IP 112.26.0.1.43359 > 112.26.0.8.60272: Flags [.], seq 687553:689001, ack 1, win 227, options [nop,nop,TS val 706967 ecr 485710], length 1448
09:49:47.514287 IP 112.26.0.8.60272 > 112.26.0.1.43359: Flags [.], ack 689001, win 8588, options [nop,nop,TS val 486623 ecr 706967], length 0
09:49:47.519719 IP 112.26.0.8.60272 > 112.26.0.1.43359: Flags [.], ack 689001, win 8588, options [nop,nop,TS val 486623 ecr 706967], length 0
09:49:47.534298 IP 112.26.0.1.43359 > 112.26.0.8.60272: Flags [.], seq 689001:690449, ack 1, win 227, options [nop,nop,TS val 707047 ecr 485734], length 1448
09:49:47.534602 IP 112.26.0.8.60272 > 112.26.0.1.43359: Flags [.], ack 690449, win 8588, options [nop,nop,TS val 486643 ecr 707047], length 0
09:49:47.607417 IP 112.26.0.8.60272 > 112.26.0.1.43359: Flags [.], ack 690449, win 8588, options [nop,nop,TS val 486643 ecr 707047], length 0
09:49:47.622651 IP 112.26.0.1.43359 > 112.26.0.8.60272: Flags [.], seq 690449:691897, ack 1, win 227, options [nop,nop,TS val 707061 ecr 485808], length 1448
09:49:47.622991 IP 112.26.0.8.60272 > 112.26.0.1.43359: Flags [.], ack 691897, win 8588, options [nop,nop,TS val 486732 ecr 707061], length 0
09:49:47.629700 IP 112.26.0.8.60272 > 112.26.0.1.43359: Flags [.], ack 691897, win 8588, options [nop,nop,TS val 486732 ecr 707061], length 0
09:49:47.720963 IP 112.26.0.1.43359 > 112.26.0.8.60272: Flags [.], seq 691897:693345, ack 1, win 227, options [nop,nop,TS val 707181 ecr 485831], length 1448
09:49:47.721291 IP 112.26.0.8.60272 > 112.26.0.1.43359: Flags [.], ack 693345, win 8588, options [nop,nop,TS val 486830 ecr 707181], length 0
09:49:47.726364 IP 112.26.0.8.60272 > 112.26.0.1.43359: Flags [.], ack 693345, win 8588, options [nop,nop,TS val 486830 ecr 707181], length 0
09:49:47.802364 IP 112.26.0.1.43359 > 112.26.0.8.60272: Flags [.], seq 693345:694793, ack 1, win 227, options [nop,nop,TS val 707254 ecr 485924], length 1448
09:49:47.802729 IP 112.26.0.8.60272 > 112.26.0.1.43359: Flags [.], ack 694793, win 8588, options [nop,nop,TS val 486912 ecr 707254], length 0
09:49:47.810676 IP 112.26.0.8.60272 > 112.26.0.1.43359: Flags [.], ack 694793, win 8588, options [nop,nop,TS val 486912 ecr 707254], length 0
09:49:47.920351 IP 112.26.0.1.43359 > 112.26.0.8.60272: Flags [.], seq 694793:696241, ack 1, win 227, options [nop,nop,TS val 707265 ecr 486017], length 1448
09:49:47.933317 IP 112.26.0.1.43359 > 112.26.0.8.60272: Flags [.], seq 696241:697689, ack 1, win 227, options [nop,nop,TS val 707352 ecr 486038], length 1448
09:49:47.933712 IP 112.26.0.8.60272 > 112.26.0.1.43359: Flags [.], ack 697689, win 8588, options [nop,nop,TS val 487043 ecr 707265], length 0
09:49:47.936778 IP 112.26.0.8.60272 > 112.26.0.1.43359: Flags [.], ack 697689, win 8588, options [nop,nop,TS val 487043 ecr 707265], length 0
09:49:48.211592 IP 112.26.0.1.43359 > 112.26.0.8.60272: Flags [.], seq 697689:699137, ack 1, win 227, options [nop,nop,TS val 707855 ecr 486532], length 1448
09:49:48.234263 IP 112.26.0.1.43359 > 112.26.0.8.60272: Flags [.], seq 699137:700585, ack 1, win 227, options [nop,nop,TS val 707855 ecr 486532], length 1448
09:49:48.234621 IP 112.26.0.8.60272 > 112.26.0.1.43359: Flags [.], ack 700585, win 8588, options [nop,nop,TS val 487343 ecr 707855], length 0
09:49:48.238099 IP 112.26.0.8.60272 > 112.26.0.1.43359: Flags [.], ack 700585, win 8588, options [nop,nop,TS val 487343 ecr 707855], length 0
09:49:48.417810 IP 112.26.0.1.43359 > 112.26.0.8.60272: Flags [.], seq 700585:702033, ack 1, win 227, options [nop,nop,TS val 707962 ecr 486623], length 1448
09:49:48.461127 IP 112.26.0.8.60272 > 112.26.0.1.43359: Flags [.], ack 702033, win 8588, options [nop,nop,TS val 487570 ecr 707962], length 0
09:49:48.509039 IP 112.26.0.1.43359 > 112.26.0.8.60272: Flags [.], seq 702033:703481, ack 1, win 227, options [nop,nop,TS val 707962 ecr 486623], length 1448
09:49:48.512748 IP 112.26.0.8.60272 > 112.26.0.1.43359: Flags [.], ack 702033, win 8588, options [nop,nop,TS val 487570 ecr 707962], length 0
09:49:48.535316 IP 112.26.0.1.43359 > 112.26.0.8.60272: Flags [.], seq 703481:704929, ack 1, win 227, options [nop,nop,TS val 707982 ecr 486643], length 1448
09:49:48.535681 IP 112.26.0.8.60272 > 112.26.0.1.43359: Flags [.], ack 704929, win 8588, options [nop,nop,TS val 487644 ecr 707962], length 0
09:49:48.542090 IP 112.26.0.8.60272 > 112.26.0.1.43359: Flags [.], ack 704929, win 8588, options [nop,nop,TS val 487644 ecr 707962], length 0
09:49:48.611354 IP 112.26.0.1.43359 > 112.26.0.8.60272: Flags [.], seq 704929:706377, ack 1, win 227, options [nop,nop,TS val 707991 ecr 486732], length 1448
09:49:48.633275 IP 112.26.0.1.43359 > 112.26.0.8.60272: Flags [.], seq 706377:707825, ack 1, win 227, options [nop,nop,TS val 708062 ecr 486830], length 1448
09:49:48.633645 IP 112.26.0.8.60272 > 112.26.0.1.43359: Flags [.], ack 707825, win 8588, options [nop,nop,TS val 487742 ecr 707991], length 0
09:49:48.637008 IP 112.26.0.8.60272 > 112.26.0.1.43359: Flags [.], ack 707825, win 8588, options [nop,nop,TS val 487742 ecr 707991], length 0
09:49:48.726586 IP 112.26.0.1.43359 > 112.26.0.8.60272: Flags [.], seq 707825:709273, ack 1, win 227, options [nop,nop,TS val 708071 ecr 486912], length 1448
09:49:48.745011 IP 112.26.0.1.43359 > 112.26.0.8.60272: Flags [.], seq 709273:710721, ack 1, win 227, options [nop,nop,TS val 708263 ecr 487043], length 1448
09:49:48.745293 IP 112.26.0.8.60272 > 112.26.0.1.43359: Flags [.], ack 710721, win 8588, options [nop,nop,TS val 487854 ecr 708071], length 0
09:49:48.811250 IP 112.26.0.8.60272 > 112.26.0.1.43359: Flags [.], ack 710721, win 8588, options [nop,nop,TS val 487854 ecr 708071], length 0
09:49:48.828365 IP 112.26.0.1.43359 > 112.26.0.8.60272: Flags [.], seq 710721:712169, ack 1, win 227, options [nop,nop,TS val 708263 ecr 487043], length 1448
09:49:48.877713 IP 112.26.0.8.60272 > 112.26.0.1.43359: Flags [.], ack 712169, win 8588, options [nop,nop,TS val 487987 ecr 708263], length 0
09:49:48.914144 IP 112.26.0.8.60272 > 112.26.0.1.43359: Flags [.], ack 712169, win 8588, options [nop,nop,TS val 487987 ecr 708263], length 0
09:49:49.024531 IP 112.26.0.1.43359 > 112.26.0.8.60272: Flags [.], seq 712169:713617, ack 1, win 227, options [nop,nop,TS val 708666 ecr 487343], length 1448
09:49:49.120610 IP 112.26.0.1.43359 > 112.26.0.8.60272: Flags [.], seq 713617:715065, ack 1, win 227, options [nop,nop,TS val 708666 ecr 487343], length 1448
09:49:49.120957 IP 112.26.0.8.60272 > 112.26.0.1.43359: Flags [.], ack 715065, win 8588, options [nop,nop,TS val 488230 ecr 708666], length 0
09:49:49.126293 IP 112.26.0.8.60272 > 112.26.0.1.43359: Flags [.], ack 715065, win 8588, options [nop,nop,TS val 488230 ecr 708666], length 0
09:49:49.225283 IP 112.26.0.1.43359 > 112.26.0.8.60272: Flags [.], seq 715065:716513, ack 1, win 227, options [nop,nop,TS val 708776 ecr 487570], length 1448
09:49:49.322918 IP 112.26.0.8.60272 > 112.26.0.1.43359: Flags [.], ack 716513, win 8588, options [nop,nop,TS val 488432 ecr 708776], length 0
09:49:49.326236 IP 112.26.0.8.60272 > 112.26.0.1.43359: Flags [.], ack 716513, win 8588, options [nop,nop,TS val 488432 ecr 708776], length 0
09:49:49.344471 IP 112.26.0.1.43359 > 112.26.0.8.60272: Flags [.], seq 716513:717961, ack 1, win 227, options [nop,nop,TS val 708867 ecr 487644], length 1448
09:49:49.421351 IP 112.26.0.1.43359 > 112.26.0.8.60272: Flags [.], seq 717961:719409, ack 1, win 227, options [nop,nop,TS val 708867 ecr 487644], length 1448
09:49:49.421729 IP 112.26.0.8.60272 > 112.26.0.1.43359: Flags [.], ack 719409, win 8588, options [nop,nop,TS val 488530 ecr 708867], length 0
09:49:49.427950 IP 112.26.0.8.60272 > 112.26.0.1.43359: Flags [.], ack 719409, win 8588, options [nop,nop,TS val 488530 ecr 708867], length 0
09:49:49.445560 IP 112.26.0.1.43359 > 112.26.0.8.60272: Flags [.], seq 719409:720857, ack 1, win 227, options [nop,nop,TS val 708867 ecr 487644], length 1448
09:49:49.526501 IP 112.26.0.1.43359 > 112.26.0.8.60272: Flags [.], seq 720857:722305, ack 1, win 227, options [nop,nop,TS val 708886 ecr 487742], length 1448
09:49:49.526867 IP 112.26.0.8.60272 > 112.26.0.1.43359: Flags [.], ack 722305, win 8588, options [nop,nop,TS val 488635 ecr 708867], length 0
09:49:49.531472 IP 112.26.0.8.60272 > 112.26.0.1.43359: Flags [.], ack 722305, win 8588, options [nop,nop,TS val 488635 ecr 708867], length 0
09:49:49.622812 IP 112.26.0.1.43359 > 112.26.0.8.60272: Flags [.], seq 722305:723753, ack 1, win 227, options [nop,nop,TS val 708886 ecr 487742], length 1448
09:49:49.643079 IP 112.26.0.1.43359 > 112.26.0.8.60272: Flags [P.], seq 723753:725201, ack 1, win 227, options [nop,nop,TS val 709085 ecr 487854], length 1448
09:49:49.643410 IP 112.26.0.8.60272 > 112.26.0.1.43359: Flags [.], ack 725201, win 8588, options [nop,nop,TS val 488752 ecr 708886], length 0
09:49:49.652515 IP 112.26.0.8.60272 > 112.26.0.1.43359: Flags [.], ack 725201, win 8588, options [nop,nop,TS val 488752 ecr 708886], length 0
09:49:49.729030 IP 112.26.0.1.43359 > 112.26.0.8.60272: Flags [.], seq 725201:726649, ack 1, win 227, options [nop,nop,TS val 709085 ecr 487854], length 1448
09:49:49.738811 IP 112.26.0.1.43359 > 112.26.0.8.60272: Flags [.], seq 726649:728097, ack 1, win 227, options [nop,nop,TS val 709261 ecr 487987], length 1448
09:49:49.739140 IP 112.26.0.8.60272 > 112.26.0.1.43359: Flags [.], ack 728097, win 8588, options [nop,nop,TS val 488848 ecr 709085], length 0
09:49:49.743878 IP 112.26.0.8.60272 > 112.26.0.1.43359: Flags [.], ack 728097, win 8588, options [nop,nop,TS val 488848 ecr 709085], length 0
09:49:49.936959 IP 112.26.0.1.43359 > 112.26.0.8.60272: Flags [.], seq 728097:729545, ack 1, win 227, options [nop,nop,TS val 709560 ecr 488230], length 1448
09:49:50.027145 IP 112.26.0.8.60272 > 112.26.0.1.43359: Flags [.], ack 729545, win 8588, options [nop,nop,TS val 489136 ecr 709560], length 0
09:49:50.029580 IP 112.26.0.8.60272 > 112.26.0.1.43359: Flags [.], ack 729545, win 8588, options [nop,nop,TS val 489136 ecr 709560], length 0
09:49:50.042429 IP 112.26.0.1.43359 > 112.26.0.8.60272: Flags [.], seq 729545:730993, ack 1, win 227, options [nop,nop,TS val 709560 ecr 488230], length 1448
09:49:50.179196 IP 112.26.0.8.60272 > 112.26.0.1.43359: Flags [.], ack 730993, win 8588, options [nop,nop,TS val 489288 ecr 709560], length 0
09:49:50.227165 IP 112.26.0.8.60272 > 112.26.0.1.43359: Flags [.], ack 730993, win 8588, options [nop,nop,TS val 489288 ecr 709560], length 0
09:49:50.240942 IP 112.26.0.1.43359 > 112.26.0.8.60272: Flags [.], seq 730993:732441, ack 1, win 227, options [nop,nop,TS val 709775 ecr 488530], length 1448
09:49:50.330163 IP 112.26.0.1.43359 > 112.26.0.8.60272: Flags [.], seq 732441:733889, ack 1, win 227, options [nop,nop,TS val 709775 ecr 488530], length 1448
09:49:50.330494 IP 112.26.0.8.60272 > 112.26.0.1.43359: Flags [.], ack 733889, win 8588, options [nop,nop,TS val 489439 ecr 709775], length 0
09:49:50.333588 IP 112.26.0.8.60272 > 112.26.0.1.43359: Flags [.], ack 733889, win 8588, options [nop,nop,TS val 489439 ecr 709775], length 0
09:49:50.357415 IP 112.26.0.1.43359 > 112.26.0.8.60272: Flags [.], seq 733889:735337, ack 1, win 227, options [nop,nop,TS val 709775 ecr 488530], length 1448
09:49:50.434884 IP 112.26.0.1.43359 > 112.26.0.8.60272: Flags [.], seq 735337:736785, ack 1, win 227, options [nop,nop,TS val 709867 ecr 488635], length 1448
09:49:50.435198 IP 112.26.0.8.60272 > 112.26.0.1.43359: Flags [.], ack 736785, win 8588, options [nop,nop,TS val 489544 ecr 709775], length 0
09:49:50.441718 IP 112.26.0.8.60272 > 112.26.0.1.43359: Flags [.], ack 736785, win 8588, options [nop,nop,TS val 489544 ecr 709775], length 0
09:49:50.536350 IP 112.26.0.1.43359 > 112.26.0.8.60272: Flags [.], seq 736785:738233, ack 1, win 227, options [nop,nop,TS val 709867 ecr 488635], length 1448
09:49:50.619968 IP 112.26.0.1.43359 > 112.26.0.8.60272: Flags [.], seq 738233:739681, ack 1, win 227, options [nop,nop,TS val 710067 ecr 488752], length 1448
09:49:50.620295 IP 112.26.0.8.60272 > 112.26.0.1.43359: Flags [.], ack 739681, win 8588, options [nop,nop,TS val 489729 ecr 709867], length 0
09:49:50.623409 IP 112.26.0.8.60272 > 112.26.0.1.43359: Flags [.], ack 739681, win 8588, options [nop,nop,TS val 489729 ecr 709867], length 0
09:49:50.642795 IP 112.26.0.1.43359 > 112.26.0.8.60272: Flags [.], seq 739681:741129, ack 1, win 227, options [nop,nop,TS val 710067 ecr 488752], length 1448
09:49:50.733087 IP 112.26.0.1.43359 > 112.26.0.8.60272: Flags [.], seq 741129:742577, ack 1, win 227, options [nop,nop,TS val 710067 ecr 488752], length 1448
09:49:50.733407 IP 112.26.0.8.60272 > 112.26.0.1.43359: Flags [.], ack 742577, win 8588, options [nop,nop,TS val 489842 ecr 710067], length 0
09:49:50.741927 IP 112.26.0.8.60272 > 112.26.0.1.43359: Flags [.], ack 742577, win 8588, options [nop,nop,TS val 489842 ecr 710067], length 0
09:49:50.840458 IP 112.26.0.1.43359 > 112.26.0.8.60272: Flags [P.], seq 744025:745473, ack 1, win 227, options [nop,nop,TS val 710080 ecr 488848], length 1448
09:49:50.840795 IP 112.26.0.8.60272 > 112.26.0.1.43359: Flags [.], ack 742577, win 8588, options [nop,nop,TS val 489949 ecr 710067,nop,nop,sack 1 {744025:745473}], length 0
09:49:50.845459 IP 112.26.0.8.60272 > 112.26.0.1.43359: Flags [.], ack 742577, win 8588, options [nop,nop,TS val 489949 ecr 710067,nop,nop,sack 1 {744025:745473}], length 0
09:49:50.941889 IP 112.26.0.1.43359 > 112.26.0.8.60272: Flags [.], seq 745473:746921, ack 1, win 227, options [nop,nop,TS val 710463 ecr 489136], length 1448
09:49:50.942227 IP 112.26.0.8.60272 > 112.26.0.1.43359: Flags [.], ack 742577, win 8588, options [nop,nop,TS val 490051 ecr 710067,nop,nop,sack 1 {744025:746921}], length 0
09:49:50.948227 IP 112.26.0.8.60272 > 112.26.0.1.43359: Flags [.], ack 742577, win 8588, options [nop,nop,TS val 490051 ecr 710067,nop,nop,sack 1 {744025:746921}], length 0
09:49:51.059784 IP 112.26.0.1.43359 > 112.26.0.8.60272: Flags [.], seq 746921:748369, ack 1, win 227, options [nop,nop,TS val 710594 ecr 489288], length 1448
09:49:51.060118 IP 112.26.0.8.60272 > 112.26.0.1.43359: Flags [.], ack 742577, win 8588, options [nop,nop,TS val 490169 ecr 710067,nop,nop,sack 1 {744025:748369}], length 0
09:49:51.063009 IP 112.26.0.8.60272 > 112.26.0.1.43359: Flags [.], ack 742577, win 8588, options [nop,nop,TS val 490169 ecr 710067,nop,nop,sack 1 {744025:748369}], length 0
09:49:51.149783 IP 112.26.0.1.43359 > 112.26.0.8.60272: Flags [.], seq 748369:749817, ack 1, win 227, options [nop,nop,TS val 710594 ecr 489288], length 1448
09:49:51.150137 IP 112.26.0.8.60272 > 112.26.0.1.43359: Flags [.], ack 742577, win 8588, options [nop,nop,TS val 490258 ecr 710067,nop,nop,sack 1 {744025:749817}], length 0
09:49:51.156679 IP 112.26.0.8.60272 > 112.26.0.1.43359: Flags [.], ack 742577, win 8588, options [nop,nop,TS val 490258 ecr 710067,nop,nop,sack 1 {744025:749817}], length 0
09:49:51.237887 IP 112.26.0.1.43359 > 112.26.0.8.60272: Flags [.], seq 749817:751265, ack 1, win 227, options [nop,nop,TS val 710764 ecr 489439], length 1448
09:49:51.238174 IP 112.26.0.8.60272 > 112.26.0.1.43359: Flags [.], ack 742577, win 8588, options [nop,nop,TS val 490347 ecr 710067,nop,nop,sack 1 {744025:751265}], length 0
09:49:51.241212 IP 112.26.0.8.60272 > 112.26.0.1.43359: Flags [.], ack 742577, win 8588, options [nop,nop,TS val 490347 ecr 710067,nop,nop,sack 1 {744025:751265}], length 0
09:49:51.330634 IP 112.26.0.1.43359 > 112.26.0.8.60272: Flags [.], seq 751265:752713, ack 1, win 227, options [nop,nop,TS val 710764 ecr 489439], length 1448
09:49:51.330995 IP 112.26.0.8.60272 > 112.26.0.1.43359: Flags [.], ack 742577, win 8588, options [nop,nop,TS val 490439 ecr 710067,nop,nop,sack 1 {744025:752713}], length 0
09:49:51.344080 IP 112.26.0.8.60272 > 112.26.0.1.43359: Flags [.], ack 742577, win 8588, options [nop,nop,TS val 490439 ecr 710067,nop,nop,sack 1 {744025:752713}], length 0
09:49:51.364699 IP 112.26.0.1.43359 > 112.26.0.8.60272: Flags [.], seq 752713:754161, ack 1, win 227, options [nop,nop,TS val 710870 ecr 489544], length 1448
09:49:51.364994 IP 112.26.0.8.60272 > 112.26.0.1.43359: Flags [.], ack 742577, win 8588, options [nop,nop,TS val 490474 ecr 710067,nop,nop,sack 1 {744025:754161}], length 0
09:49:51.369299 IP 112.26.0.8.60272 > 112.26.0.1.43359: Flags [.], ack 742577, win 8588, options [nop,nop,TS val 490474 ecr 710067,nop,nop,sack 1 {744025:754161}], length 0
09:49:51.537115 IP 112.26.0.1.43359 > 112.26.0.8.60272: Flags [.], seq 755609:757057, ack 1, win 227, options [nop,nop,TS val 710870 ecr 489544], length 1448
09:49:51.537476 IP 112.26.0.8.60272 > 112.26.0.1.43359: Flags [.], ack 742577, win 8588, options [nop,nop,TS val 490646 ecr 710067,nop,nop,sack 2 {755609:757057}{744025:754161}], length 0
09:49:51.545162 IP 112.26.0.8.60272 > 112.26.0.1.43359: Flags [.], ack 742577, win 8588, options [nop,nop,TS val 490646 ecr 710067,nop,nop,sack 2 {755609:757057}{744025:754161}], length 0
09:49:51.627210 IP 112.26.0.1.43359 > 112.26.0.8.60272: Flags [.], seq 758505:759953, ack 1, win 227, options [nop,nop,TS val 710989 ecr 489729], length 1448
09:49:51.627601 IP 112.26.0.8.60272 > 112.26.0.1.43359: Flags [.], ack 742577, win 8588, options [nop,nop,TS val 490736 ecr 710067,nop,nop,sack 3 {758505:759953}{755609:757057}{744025:754161}], length 0
09:49:51.631931 IP 112.26.0.8.60272 > 112.26.0.1.43359: Flags [.], ack 742577, win 8588, options [nop,nop,TS val 490736 ecr 710067,nop,nop,sack 3 {758505:759953}{755609:757057}{744025:754161}], length 0
09:49:51.739509 IP 112.26.0.1.43359 > 112.26.0.8.60272: Flags [.], seq 761401:762849, ack 1, win 227, options [nop,nop,TS val 711109 ecr 489842], length 1448
09:49:51.739875 IP 112.26.0.8.60272 > 112.26.0.1.43359: Flags [.], ack 742577, win 8588, options [nop,nop,TS val 490849 ecr 710067,nop,nop,sack 3 {761401:762849}{758505:759953}{755609:757057}], length 0
09:49:51.744329 IP 112.26.0.8.60272 > 112.26.0.1.43359: Flags [.], ack 742577, win 8588, options [nop,nop,TS val 490849 ecr 710067,nop,nop,sack 3 {761401:762849}{758505:759953}{755609:757057}], length 0
09:49:51.839971 IP 112.26.0.1.43359 > 112.26.0.8.60272: Flags [.], seq 764297:765745, ack 1, win 227, options [nop,nop,TS val 711295 ecr 489949], length 1448
09:49:51.840283 IP 112.26.0.8.60272 > 112.26.0.1.43359: Flags [.], ack 742577, win 8588, options [nop,nop,TS val 490949 ecr 710067,nop,nop,sack 3 {764297:765745}{761401:762849}{758505:759953}], length 0
09:49:51.846162 IP 112.26.0.8.60272 > 112.26.0.1.43359: Flags [.], ack 742577, win 8588, options [nop,nop,TS val 490949 ecr 710067,nop,nop,sack 3 {764297:765745}{761401:762849}{758505:759953}], length 0
09:49:51.930890 IP 112.26.0.1.43359 > 112.26.0.8.60272: Flags [.], seq 765745:767193, ack 1, win 227, options [nop,nop,TS val 711391 ecr 490051], length 1448
09:49:51.931259 IP 112.26.0.8.60272 > 112.26.0.1.43359: Flags [.], ack 742577, win 8588, options [nop,nop,TS val 491040 ecr 710067,nop,nop,sack 3 {764297:767193}{761401:762849}{758505:759953}], length 0
09:49:51.939771 IP 112.26.0.8.60272 > 112.26.0.1.43359: Flags [.], ack 742577, win 8588, options [nop,nop,TS val 491040 ecr 710067,nop,nop,sack 3 {764297:767193}{761401:762849}{758505:759953}], length 0
09:49:52.038767 IP 112.26.0.1.43359 > 112.26.0.8.60272: Flags [.], seq 767193:768641, ack 1, win 227, options [nop,nop,TS val 711495 ecr 490169], length 1448
09:49:52.039021 IP 112.26.0.8.60272 > 112.26.0.1.43359: Flags [.], ack 742577, win 8588, options [nop,nop,TS val 491148 ecr 710067,nop,nop,sack 3 {764297:768641}{761401:762849}{758505:759953}], length 0
09:49:52.043141 IP 112.26.0.8.60272 > 112.26.0.1.43359: Flags [.], ack 742577, win 8588, options [nop,nop,TS val 491148 ecr 710067,nop,nop,sack 3 {764297:768641}{761401:762849}{758505:759953}], length 0
09:49:52.136888 IP 112.26.0.1.43359 > 112.26.0.8.60272: Flags [.], seq 768641:770089, ack 1, win 227, options [nop,nop,TS val 711495 ecr 490169], length 1448
09:49:52.137234 IP 112.26.0.8.60272 > 112.26.0.1.43359: Flags [.], ack 742577, win 8588, options [nop,nop,TS val 491246 ecr 710067,nop,nop,sack 3 {764297:770089}{761401:762849}{758505:759953}], length 0
09:49:52.139716 IP 112.26.0.8.60272 > 112.26.0.1.43359: Flags [.], ack 742577, win 8588, options [nop,nop,TS val 491246 ecr 710067,nop,nop,sack 3 {764297:770089}{761401:762849}{758505:759953}], length 0
09:49:52.161230 IP 112.26.0.1.43359 > 112.26.0.8.60272: Flags [.], seq 742577:744025, ack 1, win 227, options [nop,nop,TS val 711576 ecr 490169], length 1448
09:49:52.161603 IP 112.26.0.8.60272 > 112.26.0.1.43359: Flags [.], ack 754161, win 8407, options [nop,nop,TS val 491270 ecr 711576,nop,nop,sack 3 {764297:770089}{761401:762849}{758505:759953}], length 0
09:49:52.234005 IP 112.26.0.8.60272 > 112.26.0.1.43359: Flags [.], ack 754161, win 8407, options [nop,nop,TS val 491270 ecr 711576,nop,nop,sack 3 {764297:770089}{761401:762849}{758505:759953}], length 0
09:49:52.253202 IP 112.26.0.1.43359 > 112.26.0.8.60272: Flags [.], seq 772985:774433, ack 1, win 227, options [nop,nop,TS val 711706 ecr 490439], length 1448
09:49:52.253544 IP 112.26.0.8.60272 > 112.26.0.1.43359: Flags [.], ack 754161, win 8476, options [nop,nop,TS val 491362 ecr 711576,nop,nop,sack 3 {772985:774433}{764297:770089}{761401:762849}], length 0
09:49:52.257601 IP 112.26.0.8.60272 > 112.26.0.1.43359: Flags [.], ack 754161, win 8476, options [nop,nop,TS val 491362 ecr 711576,nop,nop,sack 3 {772985:774433}{764297:770089}{761401:762849}], length 0
09:49:52.437420 IP 112.26.0.1.43359 > 112.26.0.8.60272: Flags [.], seq 774433:775881, ack 1, win 227, options [nop,nop,TS val 711896 ecr 490646], length 1448
09:49:52.437774 IP 112.26.0.8.60272 > 112.26.0.1.43359: Flags [.], ack 754161, win 8476, options [nop,nop,TS val 491546 ecr 711576,nop,nop,sack 3 {772985:775881}{764297:770089}{761401:762849}], length 0
09:49:52.440465 IP 112.26.0.8.60272 > 112.26.0.1.43359: Flags [.], ack 754161, win 8476, options [nop,nop,TS val 491546 ecr 711576,nop,nop,sack 3 {772985:775881}{764297:770089}{761401:762849}], length 0
09:49:52.538244 IP 112.26.0.1.43359 > 112.26.0.8.60272: Flags [.], seq 754161:755609, ack 1, win 227, options [nop,nop,TS val 711999 ecr 490736], length 1448
09:49:52.538619 IP 112.26.0.8.60272 > 112.26.0.1.43359: Flags [.], ack 757057, win 8445, options [nop,nop,TS val 491647 ecr 711999,nop,nop,sack 3 {772985:775881}{764297:770089}{761401:762849}], length 0
09:49:52.543717 IP 112.26.0.8.60272 > 112.26.0.1.43359: Flags [.], ack 757057, win 8445, options [nop,nop,TS val 491647 ecr 711999,nop,nop,sack 3 {772985:775881}{764297:770089}{761401:762849}], length 0
09:49:52.652669 IP 112.26.0.1.43359 > 112.26.0.8.60272: Flags [.], seq 757057:758505, ack 1, win 227, options [nop,nop,TS val 712277 ecr 490949], length 1448
09:49:52.653061 IP 112.26.0.8.60272 > 112.26.0.1.43359: Flags [.], ack 759953, win 8463, options [nop,nop,TS val 491761 ecr 712277,nop,nop,sack 3 {772985:775881}{764297:770089}{761401:762849}], length 0
09:49:52.655312 IP 112.26.0.8.60272 > 112.26.0.1.43359: Flags [.], ack 759953, win 8463, options [nop,nop,TS val 491761 ecr 712277,nop,nop,sack 3 {772985:775881}{764297:770089}{761401:762849}], length 0
09:49:52.748799 IP 112.26.0.1.43359 > 112.26.0.8.60272: Flags [.], seq 759953:761401, ack 1, win 227, options [nop,nop,TS val 712293 ecr 491040], length 1448
09:49:52.749061 IP 112.26.0.8.60272 > 112.26.0.1.43359: Flags [.], ack 762849, win 8480, options [nop,nop,TS val 491857 ecr 712293,nop,nop,sack 2 {772985:775881}{764297:770089}], length 0
09:49:52.761552 IP 112.26.0.8.60272 > 112.26.0.1.43359: Flags [.], ack 762849, win 8480, options [nop,nop,TS val 491857 ecr 712293,nop,nop,sack 2 {772985:775881}{764297:770089}], length 0
09:49:52.847920 IP 112.26.0.1.43359 > 112.26.0.8.60272: Flags [.], seq 762849:764297, ack 1, win 227, options [nop,nop,TS val 712401 ecr 491148], length 1448
09:49:52.848274 IP 112.26.0.8.60272 > 112.26.0.1.43359: Flags [.], ack 770089, win 8498, options [nop,nop,TS val 491957 ecr 712401,nop,nop,sack 1 {772985:775881}], length 0
09:49:52.853329 IP 112.26.0.8.60272 > 112.26.0.1.43359: Flags [.], ack 770089, win 8498, options [nop,nop,TS val 491957 ecr 712401,nop,nop,sack 1 {772985:775881}], length 0
09:49:52.951502 IP 112.26.0.1.43359 > 112.26.0.8.60272: Flags [.], seq 775881:777329, ack 1, win 227, options [nop,nop,TS val 712500 ecr 491246], length 1448
09:49:52.951766 IP 112.26.0.8.60272 > 112.26.0.1.43359: Flags [.], ack 770089, win 8562, options [nop,nop,TS val 492061 ecr 712401,nop,nop,sack 1 {772985:777329}], length 0
09:49:52.960762 IP 112.26.0.8.60272 > 112.26.0.1.43359: Flags [.], ack 770089, win 8562, options [nop,nop,TS val 492061 ecr 712401,nop,nop,sack 1 {772985:777329}], length 0
09:49:53.045773 IP 112.26.0.1.43359 > 112.26.0.8.60272: Flags [.], seq 777329:778777, ack 1, win 227, options [nop,nop,TS val 712510 ecr 491270], length 1448
09:49:53.046068 IP 112.26.0.8.60272 > 112.26.0.1.43359: Flags [.], ack 770089, win 8562, options [nop,nop,TS val 492155 ecr 712401,nop,nop,sack 1 {772985:778777}], length 0
