09:49:04.141281 IP 112.26.0.8.60272 > 112.26.0.1.43359: Flags [S], seq 3441072221, win 65535, options [mss 1460,sackOK,TS val 443219 ecr 0,nop,wscale 6], length 0
09:49:04.142874 IP 112.26.0.8.60272 > 112.26.0.1.43359: Flags [S], seq 3441072221, win 65535, options [mss 1460,sackOK,TS val 443219 ecr 0,nop,wscale 6], length 0
09:49:04.143927 IP 112.26.0.1.43359 > 112.26.0.8.60272: Flags [S.], seq 2422673350, ack 3441072222, win 28960, options [mss 1460,sackOK,TS val 664086 ecr 443219,nop,wscale 7], length 0
09:49:04.240257 IP 112.26.0.1.43359 > 112.26.0.8.60272: Flags [S.], seq 2422673350, ack 3441072222, win 28960, options [mss 1460,sackOK,TS val 664086 ecr 443219,nop,wscale 7], length 0
09:49:04.265458 IP 112.26.0.8.60272 > 112.26.0.1.43359: Flags [.], ack 1, win 1369, options [nop,nop,TS val 443352 ecr 664086], length 0
09:49:04.267981 IP 112.26.0.8.60272 > 112.26.0.1.43359: Flags [.], ack 1, win 1369, options [nop,nop,TS val 443352 ecr 664086], length 0
09:49:04.274478 IP 112.26.0.1.43359 > 112.26.0.8.60272: Flags [.], seq 1:1449, ack 1, win 227, options [nop,nop,TS val 664216 ecr 443352], length 1448
09:49:44.700727 IP 112.26.0.8.60272 > 112.26.0.1.43359: Flags [.], ack 625289, win 8543, options [nop,nop,TS val 483407 ecr 703444,nop,nop,sack 3 {629633:631081}{652801:654249}{649905:651353}], length 0
09:49:44.702004 IP 112.26.0.1.43359 > 112.26.0.8.60272: Flags [.], seq 625289:626737, ack 1, win 227, options [nop,nop,TS val 704644 ecr 483407], length 1448
09:49:44.710978 IP 112.26.0.1.43359 > 112.26.0.8.60272: Flags [.], seq 642665:644113, ack 1, win 227, options [nop,nop,TS val 704258 ecr 482999], length 1448
09:49:44.718129 IP 112.26.0.8.60272 > 112.26.0.1.43359: Flags [.], ack 625289, win 8543, options [nop,nop,TS val 483822 ecr 703444,nop,nop,sack 3 {642665:644113}{655697:657145}{632529:633977}], length 0
09:49:44.793937 IP 112.26.0.1.43359 > 112.26.0.8.60272: Flags [.], seq 657145:658593, ack 1, win 227, options [nop,nop,TS val 704339 ecr 483092], length 1448
09:49:44.805053 IP 112.26.0.8.60272 > 112.26.0.1.43359: Flags [.], ack 625289, win 8543, options [nop,nop,TS val 483905 ecr 703444,nop,nop,sack 3 {655697:658593}{642665:644113}{632529:633977}], length 0
09:49:44.813228 IP 112.26.0.1.43359 > 112.26.0.8.60272: Flags [.], seq 644113:645561, ack 1, win 227, options [nop,nop,TS val 704349 ecr 483120], length 1448
09:49:44.895068 IP 112.26.0.1.43359 > 112.26.0.8.60272: Flags [P.], seq 648457:649905, ack 1, win 227, options [nop,nop,TS val 704359 ecr 483203], length 1448
09:49:44.896203 IP 112.26.0.8.60272 > 112.26.0.1.43359: Flags [.], ack 625289, win 8543, options [nop,nop,TS val 483998 ecr 703444,nop,nop,sack 3 {642665:645561}{655697:658593}{632529:633977}], length 0
09:49:44.913485 IP 112.26.0.8.60272 > 112.26.0.1.43359: Flags [.], ack 625289, win 8543, options [nop,nop,TS val 484020 ecr 703444,nop,nop,sack 3 {648457:649905}{642665:645561}{655697:658593}], length 0
09:49:44.920391 IP 112.26.0.1.43359 > 112.26.0.8.60272: Flags [.], seq 651353:652801, ack 1, win 227, options [nop,nop,TS val 704442 ecr 483292], length 1448
09:49:44.994758 IP 112.26.0.1.43359 > 112.26.0.8.60272: Flags [.], seq 658593:660041, ack 1, win 227, options [nop,nop,TS val 704442 ecr 483292], length 1448
09:49:45.002950 IP 112.26.0.8.60272 > 112.26.0.1.43359: Flags [.], ack 625289, win 8543, options [nop,nop,TS val 484109 ecr 703444,nop,nop,sack 3 {651353:652801}{648457:649905}{642665:645561}], length 0
09:49:45.014783 IP 112.26.0.1.43359 > 112.26.0.8.60272: Flags [.], seq 660041:661489, ack 1, win 227, options [nop,nop,TS val 704442 ecr 483292], length 1448
09:49:45.101206 IP 112.26.0.8.60272 > 112.26.0.1.43359: Flags [.], ack 625289, win 8543, options [nop,nop,TS val 484129 ecr 703444,nop,nop,sack 3 {655697:660041}{651353:652801}{648457:649905}], length 0
09:49:45.109040 IP 112.26.0.8.60272 > 112.26.0.1.43359: Flags [.], ack 625289, win 8543, options [nop,nop,TS val 483704 ecr 703444,nop,nop,sack 3 {632529:633977}{629633:631081}{652801:654249}], length 0
09:49:45.110321 IP 112.26.0.1.43359 > 112.26.0.8.60272: Flags [.], seq 654249:655697, ack 1, win 227, options [nop,nop,TS val 705052 ecr 483704], length 1448
09:49:45.128429 IP 112.26.0.8.60272 > 112.26.0.1.43359: Flags [.], ack 625289, win 8543, options [nop,nop,TS val 484232 ecr 703444,nop,nop,sack 3 {655697:661489}{651353:652801}{648457:649905}], length 0
09:49:45.190289 IP 112.26.0.8.60272 > 112.26.0.1.43359: Flags [.], ack 625289, win 8543, options [nop,nop,TS val 483733 ecr 703444,nop,nop,sack 3 {655697:657145}{632529:633977}{629633:631081}], length 0
09:49:45.192242 IP 112.26.0.1.43359 > 112.26.0.8.60272: Flags [.], seq 662937:664385, ack 1, win 227, options [nop,nop,TS val 705133 ecr 483733], length 1448
09:49:45.204713 IP 112.26.0.8.60272 > 112.26.0.1.43359: Flags [.], ack 625289, win 8543, options [nop,nop,TS val 483822 ecr 703444,nop,nop,sack 3 {642665:644113}{655697:657145}{632529:633977}], length 0
09:49:45.208954 IP 112.26.0.1.43359 > 112.26.0.8.60272: Flags [.], seq 664385:665833, ack 1, win 227, options [nop,nop,TS val 705148 ecr 483822], length 1448
09:49:45.215311 IP 112.26.0.8.60272 > 112.26.0.1.43359: Flags [.], ack 625289, win 8543, options [nop,nop,TS val 483905 ecr 703444,nop,nop,sack 3 {655697:658593}{642665:644113}{632529:633977}], length 0
09:49:45.291352 IP 112.26.0.1.43359 > 112.26.0.8.60272: Flags [.], seq 665833:667281, ack 1, win 227, options [nop,nop,TS val 705158 ecr 483905], length 1448
09:49:45.300819 IP 112.26.0.8.60272 > 112.26.0.1.43359: Flags [.], ack 625289, win 8543, options [nop,nop,TS val 483998 ecr 703444,nop,nop,sack 3 {642665:645561}{655697:658593}{632529:633977}], length 0
09:49:45.308821 IP 112.26.0.8.60272 > 112.26.0.1.43359: Flags [.], ack 625289, win 8543, options [nop,nop,TS val 484020 ecr 703444,nop,nop,sack 3 {648457:649905}{642665:645561}{655697:658593}], length 0
09:49:45.313102 IP 112.26.0.1.43359 > 112.26.0.8.60272: Flags [.], seq 667281:668729, ack 1, win 227, options [nop,nop,TS val 705244 ecr 483998], length 1448
09:49:45.395845 IP 112.26.0.8.60272 > 112.26.0.1.43359: Flags [.], ack 625289, win 8543, options [nop,nop,TS val 484109 ecr 703444,nop,nop,sack 3 {651353:652801}{648457:649905}{642665:645561}], length 0
09:49:45.404777 IP 112.26.0.1.43359 > 112.26.0.8.60272: Flags [.], seq 668729:670177, ack 1, win 227, options [nop,nop,TS val 705252 ecr 484020], length 1448
09:49:45.408297 IP 112.26.0.8.60272 > 112.26.0.1.43359: Flags [.], ack 625289, win 8543, options [nop,nop,TS val 484129 ecr 703444,nop,nop,sack 3 {655697:660041}{651353:652801}{648457:649905}], length 0
09:49:45.415369 IP 112.26.0.1.43359 > 112.26.0.8.60272: Flags [.], seq 670177:671625, ack 1, win 227, options [nop,nop,TS val 705339 ecr 484109], length 1448
09:49:45.418897 IP 112.26.0.1.43359 > 112.26.0.8.60272: Flags [.], seq 654249:655697, ack 1, win 227, options [nop,nop,TS val 705052 ecr 483704], length 1448
09:49:45.425220 IP 112.26.0.8.60272 > 112.26.0.1.43359: Flags [.], ack 625289, win 8543, options [nop,nop,TS val 484530 ecr 703444,nop,nop,sack 3 {654249:661489}{651353:652801}{648457:649905}], length 0
09:49:45.502426 IP 112.26.0.1.43359 > 112.26.0.8.60272: Flags [.], seq 671625:673073, ack 1, win 227, options [nop,nop,TS val 705351 ecr 484129], length 1448
09:49:45.508765 IP 112.26.0.8.60272 > 112.26.0.1.43359: Flags [.], ack 625289, win 8543, options [nop,nop,TS val 484232 ecr 703444,nop,nop,sack 3 {655697:661489}{651353:652801}{648457:649905}], length 0
09:49:45.515564 IP 112.26.0.1.43359 > 112.26.0.8.60272: Flags [.], seq 662937:664385, ack 1, win 227, options [nop,nop,TS val 705133 ecr 483733], length 1448
09:49:45.600796 IP 112.26.0.1.43359 > 112.26.0.8.60272: Flags [.], seq 673073:674521, ack 1, win 227, options [nop,nop,TS val 705452 ecr 484232], length 1448
09:49:45.601614 IP 112.26.0.8.60272 > 112.26.0.1.43359: Flags [.], ack 625289, win 8543, options [nop,nop,TS val 484627 ecr 703444,nop,nop,sack 3 {662937:664385}{654249:661489}{651353:652801}], length 0
09:49:45.614074 IP 112.26.0.1.43359 > 112.26.0.8.60272: Flags [.], seq 664385:665833, ack 1, win 227, options [nop,nop,TS val 705148 ecr 483822], length 1448
09:49:45.621396 IP 112.26.0.8.60272 > 112.26.0.1.43359: Flags [.], ack 625289, win 8543, options [nop,nop,TS val 484725 ecr 703444,nop,nop,sack 3 {662937:665833}{654249:661489}{651353:652801}], length 0
09:49:45.693659 IP 112.26.0.1.43359 > 112.26.0.8.60272: Flags [.], seq 665833:667281, ack 1, win 227, options [nop,nop,TS val 705158 ecr 483905], length 1448
09:49:45.698997 IP 112.26.0.8.60272 > 112.26.0.1.43359: Flags [.], ack 625289, win 8543, options [nop,nop,TS val 484805 ecr 703444,nop,nop,sack 3 {662937:667281}{654249:661489}{651353:652801}], length 0
09:49:45.714707 IP 112.26.0.1.43359 > 112.26.0.8.60272: Flags [.], seq 667281:668729, ack 1, win 227, options [nop,nop,TS val 705244 ecr 483998], length 1448
09:49:45.721070 IP 112.26.0.8.60272 > 112.26.0.1.43359: Flags [.], ack 625289, win 8543, options [nop,nop,TS val 484826 ecr 703444,nop,nop,sack 3 {662937:668729}{654249:661489}{651353:652801}], length 0
09:49:45.803855 IP 112.26.0.1.43359 > 112.26.0.8.60272: Flags [.], seq 668729:670177, ack 1, win 227, options [nop,nop,TS val 705252 ecr 484020], length 1448
09:49:45.811446 IP 112.26.0.8.60272 > 112.26.0.1.43359: Flags [.], ack 625289, win 8543, options [nop,nop,TS val 484915 ecr 703444,nop,nop,sack 3 {662937:670177}{654249:661489}{651353:652801}], length 0
09:49:45.893035 IP 112.26.0.1.43359 > 112.26.0.8.60272: Flags [.], seq 670177:671625, ack 1, win 227, options [nop,nop,TS val 705339 ecr 484109], length 1448
09:49:45.901204 IP 112.26.0.8.60272 > 112.26.0.1.43359: Flags [.], ack 625289, win 8543, options [nop,nop,TS val 485005 ecr 703444,nop,nop,sack 3 {662937:671625}{654249:661489}{651353:652801}], length 0
09:49:45.914934 IP 112.26.0.8.60272 > 112.26.0.1.43359: Flags [.], ack 625289, win 8543, options [nop,nop,TS val 484530 ecr 703444,nop,nop,sack 3 {654249:661489}{651353:652801}{648457:649905}], length 0
09:49:45.916545 IP 112.26.0.1.43359 > 112.26.0.8.60272: Flags [.], seq 625289:626737, ack 1, win 227, options [nop,nop,TS val 705858 ecr 484530], length 1448
09:49:46.007017 IP 112.26.0.1.43359 > 112.26.0.8.60272: Flags [.], seq 671625:673073, ack 1, win 227, options [nop,nop,TS val 705351 ecr 484129], length 1448
09:49:46.020547 IP 112.26.0.8.60272 > 112.26.0.1.43359: Flags [.], ack 625289, win 8543, options [nop,nop,TS val 485118 ecr 703444,nop,nop,sack 3 {662937:673073}{654249:661489}{651353:652801}], length 0
09:49:46.026964 IP 112.26.0.1.43359 > 112.26.0.8.60272: Flags [.], seq 673073:674521, ack 1, win 227, options [nop,nop,TS val 705452 ecr 484232], length 1448
09:49:46.101188 IP 112.26.0.8.60272 > 112.26.0.1.43359: Flags [.], ack 625289, win 8543, options [nop,nop,TS val 485146 ecr 703444,nop,nop,sack 3 {662937:674521}{654249:661489}{651353:652801}], length 0
09:49:46.113177 IP 112.26.0.8.60272 > 112.26.0.1.43359: Flags [.], ack 625289, win 8543, options [nop,nop,TS val 484725 ecr 703444,nop,nop,sack 3 {662937:665833}{654249:661489}{651353:652801}], length 0
09:49:46.115376 IP 112.26.0.1.43359 > 112.26.0.8.60272: Flags [.], seq 661489:662937, ack 1, win 227, options [nop,nop,TS val 706056 ecr 484725], length 1448
09:49:46.125155 IP 112.26.0.8.60272 > 112.26.0.1.43359: Flags [.], ack 625289, win 8543, options [nop,nop,TS val 484805 ecr 703444,nop,nop,sack 3 {662937:667281}{654249:661489}{651353:652801}], length 0
09:49:46.131564 IP 112.26.0.1.43359 > 112.26.0.8.60272: Flags [.], seq 674521:675969, ack 1, win 227, options [nop,nop,TS val 706056 ecr 484725], length 1448
09:49:46.198692 IP 112.26.0.8.60272 > 112.26.0.1.43359: Flags [.], ack 625289, win 8543, options [nop,nop,TS val 484826 ecr 703444,nop,nop,sack 3 {662937:668729}{654249:661489}{651353:652801}], length 0
09:49:46.208881 IP 112.26.0.8.60272 > 112.26.0.1.43359: Flags [.], ack 625289, win 8543, options [nop,nop,TS val 484915 ecr 703444,nop,nop,sack 3 {662937:670177}{654249:661489}{651353:652801}], length 0
09:49:46.213108 IP 112.26.0.1.43359 > 112.26.0.8.60272: Flags [.], seq 675969:677417, ack 1, win 227, options [nop,nop,TS val 706068 ecr 484805], length 1448
09:49:46.219097 IP 112.26.0.1.43359 > 112.26.0.8.60272: Flags [.], seq 677417:678865, ack 1, win 227, options [nop,nop,TS val 706141 ecr 484826], length 1448
09:49:46.300969 IP 112.26.0.8.60272 > 112.26.0.1.43359: Flags [.], ack 625289, win 8543, options [nop,nop,TS val 485005 ecr 703444,nop,nop,sack 3 {662937:671625}{654249:661489}{651353:652801}], length 0
09:49:46.310305 IP 112.26.0.1.43359 > 112.26.0.8.60272: Flags [.], seq 678865:680313, ack 1, win 227, options [nop,nop,TS val 706151 ecr 484915], length 1448
09:49:46.315223 IP 112.26.0.1.43359 > 112.26.0.8.60272: Flags [.], seq 625289:626737, ack 1, win 227, options [nop,nop,TS val 705858 ecr 484530], length 1448
09:49:46.321236 IP 112.26.0.8.60272 > 112.26.0.1.43359: Flags [.], ack 661489, win 8093, options [nop,nop,TS val 485426 ecr 705858,nop,nop,sack 1 {662937:674521}], length 0
09:49:46.325115 IP 112.26.0.1.43359 > 112.26.0.8.60272: Flags [.], seq 680313:681761, ack 1, win 227, options [nop,nop,TS val 706243 ecr 485005], length 1448
09:49:46.406432 IP 112.26.0.8.60272 > 112.26.0.1.43359: Flags [.], ack 625289, win 8543, options [nop,nop,TS val 485118 ecr 703444,nop,nop,sack 3 {662937:673073}{654249:661489}{651353:652801}], length 0
09:49:46.409227 IP 112.26.0.1.43359 > 112.26.0.8.60272: Flags [.], seq 681761:683209, ack 1, win 227, options [nop,nop,TS val 706349 ecr 485118], length 1448
09:49:46.417591 IP 112.26.0.8.60272 > 112.26.0.1.43359: Flags [.], ack 625289, win 8543, options [nop,nop,TS val 485146 ecr 703444,nop,nop,sack 3 {662937:674521}{654249:661489}{651353:652801}], length 0
09:49:46.499555 IP 112.26.0.1.43359 > 112.26.0.8.60272: Flags [.], seq 683209:684657, ack 1, win 227, options [nop,nop,TS val 706360 ecr 485146], length 1448
09:49:46.508045 IP 112.26.0.1.43359 > 112.26.0.8.60272: Flags [.], seq 661489:662937, ack 1, win 227, options [nop,nop,TS val 706056 ecr 484725], length 1448
09:49:46.512778 IP 112.26.0.8.60272 > 112.26.0.1.43359: Flags [.], ack 674521, win 8469, options [nop,nop,TS val 485619 ecr 706056], length 0
09:49:46.597761 IP 112.26.0.1.43359 > 112.26.0.8.60272: Flags [.], seq 674521:675969, ack 1, win 227, options [nop,nop,TS val 706056 ecr 484725], length 1448
09:49:46.607684 IP 112.26.0.8.60272 > 112.26.0.1.43359: Flags [.], ack 675969, win 8588, options [nop,nop,TS val 485710 ecr 706056], length 0
09:49:46.618559 IP 112.26.0.1.43359 > 112.26.0.8.60272: Flags [.], seq 675969:677417, ack 1, win 227, options [nop,nop,TS val 706068 ecr 484805], length 1448
09:49:46.630235 IP 112.26.0.8.60272 > 112.26.0.1.43359: Flags [.], ack 677417, win 8588, options [nop,nop,TS val 485734 ecr 706068], length 0
09:49:46.696532 IP 112.26.0.1.43359 > 112.26.0.8.60272: Flags [.], seq 677417:678865, ack 1, win 227, options [nop,nop,TS val 706141 ecr 484826], length 1448
09:49:46.711362 IP 112.26.0.8.60272 > 112.26.0.1.43359: Flags [.], ack 678865, win 8588, options [nop,nop,TS val 485808 ecr 706141], length 0
09:49:46.717212 IP 112.26.0.1.43359 > 112.26.0.8.60272: Flags [.], seq 678865:680313, ack 1, win 227, options [nop,nop,TS val 706151 ecr 484915], length 1448
09:49:46.732216 IP 112.26.0.8.60272 > 112.26.0.1.43359: Flags [.], ack 661489, win 8093, options [nop,nop,TS val 485426 ecr 705858,nop,nop,sack 1 {662937:674521}], length 0
09:49:46.735166 IP 112.26.0.1.43359 > 112.26.0.8.60272: Flags [.], seq 684657:686105, ack 1, win 227, options [nop,nop,TS val 706675 ecr 485426], length 1448
09:49:46.736077 IP 112.26.0.8.60272 > 112.26.0.1.43359: Flags [.], ack 680313, win 8588, options [nop,nop,TS val 485831 ecr 706151], length 0
09:49:46.812623 IP 112.26.0.1.43359 > 112.26.0.8.60272: Flags [.], seq 680313:681761, ack 1, win 227, options [nop,nop,TS val 706243 ecr 485005], length 1448
09:49:46.820829 IP 112.26.0.8.60272 > 112.26.0.1.43359: Flags [.], ack 681761, win 8588, options [nop,nop,TS val 485924 ecr 706243], length 0
09:49:46.895530 IP 112.26.0.1.43359 > 112.26.0.8.60272: Flags [.], seq 681761:683209, ack 1, win 227, options [nop,nop,TS val 706349 ecr 485118], length 1448
09:49:46.911070 IP 112.26.0.8.60272 > 112.26.0.1.43359: Flags [.], ack 683209, win 8588, options [nop,nop,TS val 486017 ecr 706349], length 0
09:49:46.920136 IP 112.26.0.1.43359 > 112.26.0.8.60272: Flags [.], seq 683209:684657, ack 1, win 227, options [nop,nop,TS val 706360 ecr 485146], length 1448
09:49:46.996970 IP 112.26.0.8.60272 > 112.26.0.1.43359: Flags [.], ack 684657, win 8588, options [nop,nop,TS val 486038 ecr 706360], length 0
09:49:47.007549 IP 112.26.0.8.60272 > 112.26.0.1.43359: Flags [.], ack 674521, win 8469, options [nop,nop,TS val 485619 ecr 706056], length 0
09:49:47.009220 IP 112.26.0.1.43359 > 112.26.0.8.60272: Flags [P.], seq 686105:687553, ack 1, win 227, options [nop,nop,TS val 706950 ecr 485619], length 1448
09:49:47.024644 IP 112.26.0.8.60272 > 112.26.0.1.43359: Flags [.], ack 675969, win 8588, options [nop,nop,TS val 485710 ecr 706056], length 0
09:49:47.029744 IP 112.26.0.1.43359 > 112.26.0.8.60272: Flags [.], seq 687553:689001, ack 1, win 227, options [nop,nop,TS val 706967 ecr 485710], length 1448
09:49:47.103508 IP 112.26.0.8.60272 > 112.26.0.1.43359: Flags [.], ack 677417, win 8588, options [nop,nop,TS val 485734 ecr 706068], length 0
09:49:47.109127 IP 112.26.0.1.43359 > 112.26.0.8.60272: Flags [.], seq 689001:690449, ack 1, win 227, options [nop,nop,TS val 707047 ecr 485734], length 1448
09:49:47.118157 IP 112.26.0.8.60272 > 112.26.0.1.43359: Flags [.], ack 678865, win 8588, options [nop,nop,TS val 485808 ecr 706141], length 0
09:49:47.119410 IP 112.26.0.1.43359 > 112.26.0.8.60272: Flags [.], seq 690449:691897, ack 1, win 227, options [nop,nop,TS val 707061 ecr 485808], length 1448
09:49:47.205728 IP 112.26.0.1.43359 > 112.26.0.8.60272: Flags [.], seq 684657:686105, ack 1, win 227, options [nop,nop,TS val 706675 ecr 485426], length 1448
09:49:47.213465 IP 112.26.0.8.60272 > 112.26.0.1.43359: Flags [.], ack 686105, win 8588, options [nop,nop,TS val 486318 ecr 706675], length 0
09:49:47.237935 IP 112.26.0.8.60272 > 112.26.0.1.43359: Flags [.], ack 680313, win 8588, options [nop,nop,TS val 485831 ecr 706151], length 0
09:49:47.239993 IP 112.26.0.1.43359 > 112.26.0.8.60272: Flags [.], seq 691897:693345, ack 1, win 227, options [nop,nop,TS val 707181 ecr 485831], length 1448
09:49:47.311152 IP 112.26.0.8.60272 > 112.26.0.1.43359: Flags [.], ack 681761, win 8588, options [nop,nop,TS val 485924 ecr 706243], length 0
09:49:47.312852 IP 112.26.0.1.43359 > 112.26.0.8.60272: Flags [.], seq 693345:694793, ack 1, win 227, options [nop,nop,TS val 707254 ecr 485924], length 1448
09:49:47.321727 IP 112.26.0.8.60272 > 112.26.0.1.43359: Flags [.], ack 683209, win 8588, options [nop,nop,TS val 486017 ecr 706349], length 0
09:49:47.327357 IP 112.26.0.1.43359 > 112.26.0.8.60272: Flags [.], seq 694793:696241, ack 1, win 227, options [nop,nop,TS val 707265 ecr 486017], length 1448
09:49:47.408710 IP 112.26.0.8.60272 > 112.26.0.1.43359: Flags [.], ack 684657, win 8588, options [nop,nop,TS val 486038 ecr 706360], length 0
09:49:47.411166 IP 112.26.0.1.43359 > 112.26.0.8.60272: Flags [.], seq 696241:697689, ack 1, win 227, options [nop,nop,TS val 707352 ecr 486038], length 1448
09:49:47.420932 IP 112.26.0.1.43359 > 112.26.0.8.60272: Flags [P.], seq 686105:687553, ack 1, win 227, options [nop,nop,TS val 706950 ecr 485619], length 1448
09:49:47.427446 IP 112.26.0.8.60272 > 112.26.0.1.43359: Flags [.], ack 687553, win 8588, options [nop,nop,TS val 486532 ecr 706950], length 0
09:49:47.511467 IP 112.26.0.1.43359 > 112.26.0.8.60272: Flags [.], seq 687553:689001, ack 1, win 227, options [nop,nop,TS val 706967 ecr 485710], length 1448
09:49:47.518519 IP 112.26.0.8.60272 > 112.26.0.1.43359: Flags [.], ack 689001, win 8588, options [nop,nop,TS val 486623 ecr 706967], length 0
09:49:47.531942 IP 112.26.0.1.43359 > 112.26.0.8.60272: Flags [.], seq 689001:690449, ack 1, win 227, options [nop,nop,TS val 707047 ecr 485734], length 1448
09:49:47.604851 IP 112.26.0.8.60272 > 112.26.0.1.43359: Flags [.], ack 690449, win 8588, options [nop,nop,TS val 486643 ecr 707047], length 0
09:49:47.620777 IP 112.26.0.1.43359 > 112.26.0.8.60272: Flags [.], seq 690449:691897, ack 1, win 227, options [nop,nop,TS val 707061 ecr 485808], length 1448
09:49:47.625435 IP 112.26.0.8.60272 > 112.26.0.1.43359: Flags [.], ack 691897, win 8588, options [nop,nop,TS val 486732 ecr 707061], length 0
09:49:47.719093 IP 112.26.0.1.43359 > 112.26.0.8.60272: Flags [.], seq 691897:693345, ack 1, win 227, options [nop,nop,TS val 707181 ecr 485831], length 1448
09:49:47.725176 IP 112.26.0.8.60272 > 112.26.0.1.43359: Flags [.], ack 693345, win 8588, options [nop,nop,TS val 486830 ecr 707181], length 0
09:49:47.738830 IP 112.26.0.1.43359 > 112.26.0.8.60272: Flags [.], seq 693345:694793, ack 1, win 227, options [nop,nop,TS val 707254 ecr 485924], length 1448
09:49:47.810208 IP 112.26.0.8.60272 > 112.26.0.1.43359: Flags [.], ack 694793, win 8588, options [nop,nop,TS val 486912 ecr 707254], length 0
09:49:47.826500 IP 112.26.0.1.43359 > 112.26.0.8.60272: Flags [.], seq 694793:696241, ack 1, win 227, options [nop,nop,TS val 707265 ecr 486017], length 1448
09:49:47.845211 IP 112.26.0.1.43359 > 112.26.0.8.60272: Flags [.], seq 696241:697689, ack 1, win 227, options [nop,nop,TS val 707352 ecr 486038], length 1448
09:49:47.911854 IP 112.26.0.8.60272 > 112.26.0.1.43359: Flags [.], ack 687553, win 8588, options [nop,nop,TS val 486532 ecr 706950], length 0
09:49:47.914293 IP 112.26.0.1.43359 > 112.26.0.8.60272: Flags [.], seq 697689:699137, ack 1, win 227, options [nop,nop,TS val 707855 ecr 486532], length 1448
09:49:47.925256 IP 112.26.0.1.43359 > 112.26.0.8.60272: Flags [.], seq 699137:700585, ack 1, win 227, options [nop,nop,TS val 707855 ecr 486532], length 1448
09:49:47.936429 IP 112.26.0.8.60272 > 112.26.0.1.43359: Flags [.], ack 697689, win 8588, options [nop,nop,TS val 487043 ecr 707265], length 0
09:49:48.018934 IP 112.26.0.8.60272 > 112.26.0.1.43359: Flags [.], ack 689001, win 8588, options [nop,nop,TS val 486623 ecr 706967], length 0
09:49:48.020340 IP 112.26.0.1.43359 > 112.26.0.8.60272: Flags [.], seq 700585:702033, ack 1, win 227, options [nop,nop,TS val 707962 ecr 486623], length 1448
09:49:48.037164 IP 112.26.0.1.43359 > 112.26.0.8.60272: Flags [.], seq 702033:703481, ack 1, win 227, options [nop,nop,TS val 707962 ecr 486623], length 1448
09:49:48.038974 IP 112.26.0.8.60272 > 112.26.0.1.43359: Flags [.], ack 690449, win 8588, options [nop,nop,TS val 486643 ecr 707047], length 0
09:49:48.048464 IP 112.26.0.8.60272 > 112.26.0.1.43359: Flags [.], ack 691897, win 8588, options [nop,nop,TS val 486732 ecr 707061], length 0
09:49:48.115283 IP 112.26.0.1.43359 > 112.26.0.8.60272: Flags [.], seq 703481:704929, ack 1, win 227, options [nop,nop,TS val 707982 ecr 486643], length 1448
09:49:48.119487 IP 112.26.0.8.60272 > 112.26.0.1.43359: Flags [.], ack 693345, win 8588, options [nop,nop,TS val 486830 ecr 707181], length 0
09:49:48.128371 IP 112.26.0.8.60272 > 112.26.0.1.43359: Flags [.], ack 694793, win 8588, options [nop,nop,TS val 486912 ecr 707254], length 0
09:49:48.131837 IP 112.26.0.1.43359 > 112.26.0.8.60272: Flags [.], seq 704929:706377, ack 1, win 227, options [nop,nop,TS val 707991 ecr 486732], length 1448
09:49:48.209086 IP 112.26.0.1.43359 > 112.26.0.8.60272: Flags [.], seq 697689:699137, ack 1, win 227, options [nop,nop,TS val 707855 ecr 486532], length 1448
09:49:48.220606 IP 112.26.0.1.43359 > 112.26.0.8.60272: Flags [.], seq 706377:707825, ack 1, win 227, options [nop,nop,TS val 708062 ecr 486830], length 1448
09:49:48.227673 IP 112.26.0.1.43359 > 112.26.0.8.60272: Flags [.], seq 707825:709273, ack 1, win 227, options [nop,nop,TS val 708071 ecr 486912], length 1448
09:49:48.231862 IP 112.26.0.1.43359 > 112.26.0.8.60272: Flags [.], seq 699137:700585, ack 1, win 227, options [nop,nop,TS val 707855 ecr 486532], length 1448
09:49:48.239546 IP 112.26.0.8.60272 > 112.26.0.1.43359: Flags [.], ack 700585, win 8588, options [nop,nop,TS val 487343 ecr 707855], length 0
09:49:48.319988 IP 112.26.0.8.60272 > 112.26.0.1.43359: Flags [.], ack 697689, win 8588, options [nop,nop,TS val 487043 ecr 707265], length 0
09:49:48.321358 IP 112.26.0.1.43359 > 112.26.0.8.60272: Flags [.], seq 709273:710721, ack 1, win 227, options [nop,nop,TS val 708263 ecr 487043], length 1448
09:49:48.336178 IP 112.26.0.1.43359 > 112.26.0.8.60272: Flags [.], seq 710721:712169, ack 1, win 227, options [nop,nop,TS val 708263 ecr 487043], length 1448
09:49:48.414958 IP 112.26.0.1.43359 > 112.26.0.8.60272: Flags [.], seq 700585:702033, ack 1, win 227, options [nop,nop,TS val 707962 ecr 486623], length 1448
09:49:48.427975 IP 112.26.0.1.43359 > 112.26.0.8.60272: Flags [.], seq 702033:703481, ack 1, win 227, options [nop,nop,TS val 707962 ecr 486623], length 1448
09:49:48.516007 IP 112.26.0.8.60272 > 112.26.0.1.43359: Flags [.], ack 702033, win 8588, options [nop,nop,TS val 487570 ecr 707962], length 0
09:49:48.526224 IP 112.26.0.1.43359 > 112.26.0.8.60272: Flags [.], seq 703481:704929, ack 1, win 227, options [nop,nop,TS val 707982 ecr 486643], length 1448
09:49:48.537949 IP 112.26.0.8.60272 > 112.26.0.1.43359: Flags [.], ack 704929, win 8588, options [nop,nop,TS val 487644 ecr 707962], length 0
09:49:48.545653 IP 112.26.0.1.43359 > 112.26.0.8.60272: Flags [.], seq 704929:706377, ack 1, win 227, options [nop,nop,TS val 707991 ecr 486732], length 1448
09:49:48.621723 IP 112.26.0.1.43359 > 112.26.0.8.60272: Flags [.], seq 706377:707825, ack 1, win 227, options [nop,nop,TS val 708062 ecr 486830], length 1448
09:49:48.628639 IP 112.26.0.1.43359 > 112.26.0.8.60272: Flags [.], seq 707825:709273, ack 1, win 227, options [nop,nop,TS val 708071 ecr 486912], length 1448
09:49:48.635906 IP 112.26.0.8.60272 > 112.26.0.1.43359: Flags [.], ack 707825, win 8588, options [nop,nop,TS val 487742 ecr 707991], length 0
09:49:48.722584 IP 112.26.0.8.60272 > 112.26.0.1.43359: Flags [.], ack 700585, win 8588, options [nop,nop,TS val 487343 ecr 707855], length 0
09:49:48.724344 IP 112.26.0.1.43359 > 112.26.0.8.60272: Flags [.], seq 712169:713617, ack 1, win 227, options [nop,nop,TS val 708666 ecr 487343], length 1448
09:49:48.738791 IP 112.26.0.1.43359 > 112.26.0.8.60272: Flags [.], seq 709273:710721, ack 1, win 227, options [nop,nop,TS val 708263 ecr 487043], length 1448
09:49:48.743422 IP 112.26.0.1.43359 > 112.26.0.8.60272: Flags [.], seq 713617:715065, ack 1, win 227, options [nop,nop,TS val 708666 ecr 487343], length 1448
09:49:48.748468 IP 112.26.0.8.60272 > 112.26.0.1.43359: Flags [.], ack 710721, win 8588, options [nop,nop,TS val 487854 ecr 708071], length 0
09:49:48.820257 IP 112.26.0.1.43359 > 112.26.0.8.60272: Flags [.], seq 710721:712169, ack 1, win 227, options [nop,nop,TS val 708263 ecr 487043], length 1448
09:49:48.832506 IP 112.26.0.8.60272 > 112.26.0.1.43359: Flags [.], ack 702033, win 8588, options [nop,nop,TS val 487570 ecr 707962], length 0
09:49:48.833796 IP 112.26.0.1.43359 > 112.26.0.8.60272: Flags [.], seq 715065:716513, ack 1, win 227, options [nop,nop,TS val 708776 ecr 487570], length 1448
09:49:48.910537 IP 112.26.0.8.60272 > 112.26.0.1.43359: Flags [.], ack 712169, win 8588, options [nop,nop,TS val 487987 ecr 708263], length 0
09:49:48.924139 IP 112.26.0.8.60272 > 112.26.0.1.43359: Flags [.], ack 704929, win 8588, options [nop,nop,TS val 487644 ecr 707962], length 0
09:49:48.925617 IP 112.26.0.1.43359 > 112.26.0.8.60272: Flags [.], seq 716513:717961, ack 1, win 227, options [nop,nop,TS val 708867 ecr 487644], length 1448
09:49:48.935189 IP 112.26.0.1.43359 > 112.26.0.8.60272: Flags [.], seq 717961:719409, ack 1, win 227, options [nop,nop,TS val 708867 ecr 487644], length 1448
09:49:48.940374 IP 112.26.0.1.43359 > 112.26.0.8.60272: Flags [.], seq 719409:720857, ack 1, win 227, options [nop,nop,TS val 708867 ecr 487644], length 1448
09:49:48.942805 IP 112.26.0.8.60272 > 112.26.0.1.43359: Flags [.], ack 707825, win 8588, options [nop,nop,TS val 487742 ecr 707991], length 0
09:49:49.018070 IP 112.26.0.1.43359 > 112.26.0.8.60272: Flags [.], seq 720857:722305, ack 1, win 227, options [nop,nop,TS val 708886 ecr 487742], length 1448
09:49:49.022272 IP 112.26.0.1.43359 > 112.26.0.8.60272: Flags [.], seq 712169:713617, ack 1, win 227, options [nop,nop,TS val 708666 ecr 487343], length 1448
09:49:49.032463 IP 112.26.0.1.43359 > 112.26.0.8.60272: Flags [.], seq 722305:723753, ack 1, win 227, options [nop,nop,TS val 708886 ecr 487742], length 1448
09:49:49.117800 IP 112.26.0.1.43359 > 112.26.0.8.60272: Flags [.], seq 713617:715065, ack 1, win 227, options [nop,nop,TS val 708666 ecr 487343], length 1448
09:49:49.125040 IP 112.26.0.8.60272 > 112.26.0.1.43359: Flags [.], ack 715065, win 8588, options [nop,nop,TS val 488230 ecr 708666], length 0
09:49:49.142370 IP 112.26.0.8.60272 > 112.26.0.1.43359: Flags [.], ack 710721, win 8588, options [nop,nop,TS val 487854 ecr 708071], length 0
09:49:49.143747 IP 112.26.0.1.43359 > 112.26.0.8.60272: Flags [P.], seq 723753:725201, ack 1, win 227, options [nop,nop,TS val 709085 ecr 487854], length 1448
09:49:49.215758 IP 112.26.0.1.43359 > 112.26.0.8.60272: Flags [.], seq 725201:726649, ack 1, win 227, options [nop,nop,TS val 709085 ecr 487854], length 1448
09:49:49.223273 IP 112.26.0.1.43359 > 112.26.0.8.60272: Flags [.], seq 715065:716513, ack 1, win 227, options [nop,nop,TS val 708776 ecr 487570], length 1448
09:49:49.318152 IP 112.26.0.8.60272 > 112.26.0.1.43359: Flags [.], ack 712169, win 8588, options [nop,nop,TS val 487987 ecr 708263], length 0
09:49:49.320091 IP 112.26.0.1.43359 > 112.26.0.8.60272: Flags [.], seq 726649:728097, ack 1, win 227, options [nop,nop,TS val 709261 ecr 487987], length 1448
09:49:49.325892 IP 112.26.0.8.60272 > 112.26.0.1.43359: Flags [.], ack 716513, win 8588, options [nop,nop,TS val 488432 ecr 708776], length 0
09:49:49.341397 IP 112.26.0.1.43359 > 112.26.0.8.60272: Flags [.], seq 716513:717961, ack 1, win 227, options [nop,nop,TS val 708867 ecr 487644], length 1448
09:49:49.418830 IP 112.26.0.1.43359 > 112.26.0.8.60272: Flags [.], seq 717961:719409, ack 1, win 227, options [nop,nop,TS val 708867 ecr 487644], length 1448
09:49:49.425150 IP 112.26.0.8.60272 > 112.26.0.1.43359: Flags [.], ack 719409, win 8588, options [nop,nop,TS val 488530 ecr 708867], length 0
09:49:49.438034 IP 112.26.0.1.43359 > 112.26.0.8.60272: Flags [.], seq 719409:720857, ack 1, win 227, options [nop,nop,TS val 708867 ecr 487644], length 1448
09:49:49.519965 IP 112.26.0.1.43359 > 112.26.0.8.60272: Flags [.], seq 720857:722305, ack 1, win 227, options [nop,nop,TS val 708886 ecr 487742], length 1448
09:49:49.529659 IP 112.26.0.8.60272 > 112.26.0.1.43359: Flags [.], ack 722305, win 8588, options [nop,nop,TS val 488635 ecr 708867], length 0
09:49:49.540408 IP 112.26.0.1.43359 > 112.26.0.8.60272: Flags [.], seq 722305:723753, ack 1, win 227, options [nop,nop,TS val 708886 ecr 487742], length 1448
09:49:49.617489 IP 112.26.0.8.60272 > 112.26.0.1.43359: Flags [.], ack 715065, win 8588, options [nop,nop,TS val 488230 ecr 708666], length 0
09:49:49.620707 IP 112.26.0.1.43359 > 112.26.0.8.60272: Flags [.], seq 728097:729545, ack 1, win 227, options [nop,nop,TS val 709560 ecr 488230], length 1448
09:49:49.635916 IP 112.26.0.1.43359 > 112.26.0.8.60272: Flags [.], seq 729545:730993, ack 1, win 227, options [nop,nop,TS val 709560 ecr 488230], length 1448
09:49:49.639508 IP 112.26.0.1.43359 > 112.26.0.8.60272: Flags [P.], seq 723753:725201, ack 1, win 227, options [nop,nop,TS val 709085 ecr 487854], length 1448
09:49:49.648652 IP 112.26.0.8.60272 > 112.26.0.1.43359: Flags [.], ack 725201, win 8588, options [nop,nop,TS val 488752 ecr 708886], length 0
09:49:49.719913 IP 112.26.0.1.43359 > 112.26.0.8.60272: Flags [.], seq 725201:726649, ack 1, win 227, options [nop,nop,TS val 709085 ecr 487854], length 1448
09:49:49.733448 IP 112.26.0.1.43359 > 112.26.0.8.60272: Flags [.], seq 726649:728097, ack 1, win 227, options [nop,nop,TS val 709261 ecr 487987], length 1448
09:49:49.744838 IP 112.26.0.8.60272 > 112.26.0.1.43359: Flags [.], ack 728097, win 8588, options [nop,nop,TS val 488848 ecr 709085], length 0
09:49:49.832012 IP 112.26.0.8.60272 > 112.26.0.1.43359: Flags [.], ack 719409, win 8588, options [nop,nop,TS val 488530 ecr 708867], length 0
09:49:49.834546 IP 112.26.0.1.43359 > 112.26.0.8.60272: Flags [.], seq 730993:732441, ack 1, win 227, options [nop,nop,TS val 709775 ecr 488530], length 1448
09:49:49.917726 IP 112.26.0.1.43359 > 112.26.0.8.60272: Flags [.], seq 732441:733889, ack 1, win 227, options [nop,nop,TS val 709775 ecr 488530], length 1448
09:49:49.924754 IP 112.26.0.8.60272 > 112.26.0.1.43359: Flags [.], ack 722305, win 8588, options [nop,nop,TS val 488635 ecr 708867], length 0
09:49:49.931522 IP 112.26.0.1.43359 > 112.26.0.8.60272: Flags [.], seq 733889:735337, ack 1, win 227, options [nop,nop,TS val 709775 ecr 488530], length 1448
09:49:49.935103 IP 112.26.0.1.43359 > 112.26.0.8.60272: Flags [.], seq 728097:729545, ack 1, win 227, options [nop,nop,TS val 709560 ecr 488230], length 1448
09:49:50.026501 IP 112.26.0.1.43359 > 112.26.0.8.60272: Flags [.], seq 735337:736785, ack 1, win 227, options [nop,nop,TS val 709867 ecr 488635], length 1448
09:49:50.029229 IP 112.26.0.8.60272 > 112.26.0.1.43359: Flags [.], ack 729545, win 8588, options [nop,nop,TS val 489136 ecr 709560], length 0
09:49:50.038359 IP 112.26.0.1.43359 > 112.26.0.8.60272: Flags [.], seq 729545:730993, ack 1, win 227, options [nop,nop,TS val 709560 ecr 488230], length 1448
09:49:50.051050 IP 112.26.0.1.43359 > 112.26.0.8.60272: Flags [.], seq 736785:738233, ack 1, win 227, options [nop,nop,TS val 709867 ecr 488635], length 1448
09:49:50.124363 IP 112.26.0.8.60272 > 112.26.0.1.43359: Flags [.], ack 725201, win 8588, options [nop,nop,TS val 488752 ecr 708886], length 0
09:49:50.129893 IP 112.26.0.1.43359 > 112.26.0.8.60272: Flags [.], seq 738233:739681, ack 1, win 227, options [nop,nop,TS val 710067 ecr 488752], length 1448
09:49:50.137086 IP 112.26.0.8.60272 > 112.26.0.1.43359: Flags [.], ack 728097, win 8588, options [nop,nop,TS val 488848 ecr 709085], length 0
09:49:50.141419 IP 112.26.0.1.43359 > 112.26.0.8.60272: Flags [.], seq 739681:741129, ack 1, win 227, options [nop,nop,TS val 710067 ecr 488752], length 1448
09:49:50.229479 IP 112.26.0.8.60272 > 112.26.0.1.43359: Flags [.], ack 730993, win 8588, options [nop,nop,TS val 489288 ecr 709560], length 0
09:49:50.238609 IP 112.26.0.1.43359 > 112.26.0.8.60272: Flags [.], seq 730993:732441, ack 1, win 227, options [nop,nop,TS val 709775 ecr 488530], length 1448
09:49:50.246501 IP 112.26.0.1.43359 > 112.26.0.8.60272: Flags [.], seq 741129:742577, ack 1, win 227, options [nop,nop,TS val 710067 ecr 488752], length 1448
09:49:50.323504 IP 112.26.0.1.43359 > 112.26.0.8.60272: Flags [.], seq 742577:744025, ack 1, win 227, options [nop,nop,TS val 710080 ecr 488848], length 1448
09:49:50.327284 IP 112.26.0.1.43359 > 112.26.0.8.60272: Flags [.], seq 732441:733889, ack 1, win 227, options [nop,nop,TS val 709775 ecr 488530], length 1448
09:49:50.340277 IP 112.26.0.8.60272 > 112.26.0.1.43359: Flags [.], ack 733889, win 8588, options [nop,nop,TS val 489439 ecr 709775], length 0
09:49:50.349738 IP 112.26.0.1.43359 > 112.26.0.8.60272: Flags [P.], seq 744025:745473, ack 1, win 227, options [nop,nop,TS val 710080 ecr 488848], length 1448
09:49:50.355065 IP 112.26.0.1.43359 > 112.26.0.8.60272: Flags [.], seq 733889:735337, ack 1, win 227, options [nop,nop,TS val 709775 ecr 488530], length 1448
09:49:50.432496 IP 112.26.0.1.43359 > 112.26.0.8.60272: Flags [.], seq 735337:736785, ack 1, win 227, options [nop,nop,TS val 709867 ecr 488635], length 1448
09:49:50.440530 IP 112.26.0.8.60272 > 112.26.0.1.43359: Flags [.], ack 736785, win 8588, options [nop,nop,TS val 489544 ecr 709775], length 0
09:49:50.520006 IP 112.26.0.8.60272 > 112.26.0.1.43359: Flags [.], ack 729545, win 8588, options [nop,nop,TS val 489136 ecr 709560], length 0
09:49:50.524029 IP 112.26.0.1.43359 > 112.26.0.8.60272: Flags [.], seq 745473:746921, ack 1, win 227, options [nop,nop,TS val 710463 ecr 489136], length 1448
09:49:50.534479 IP 112.26.0.1.43359 > 112.26.0.8.60272: Flags [.], seq 736785:738233, ack 1, win 227, options [nop,nop,TS val 709867 ecr 488635], length 1448
09:49:50.544791 IP 112.26.0.1.43359 > 112.26.0.8.60272: Flags [.], seq 738233:739681, ack 1, win 227, options [nop,nop,TS val 710067 ecr 488752], length 1448
09:49:50.622891 IP 112.26.0.8.60272 > 112.26.0.1.43359: Flags [.], ack 739681, win 8588, options [nop,nop,TS val 489729 ecr 709867], length 0
09:49:50.638387 IP 112.26.0.1.43359 > 112.26.0.8.60272: Flags [.], seq 739681:741129, ack 1, win 227, options [nop,nop,TS val 710067 ecr 488752], length 1448
09:49:50.650847 IP 112.26.0.8.60272 > 112.26.0.1.43359: Flags [.], ack 730993, win 8588, options [nop,nop,TS val 489288 ecr 709560], length 0
09:49:50.652202 IP 112.26.0.1.43359 > 112.26.0.8.60272: Flags [.], seq 746921:748369, ack 1, win 227, options [nop,nop,TS val 710594 ecr 489288], length 1448
09:49:50.726706 IP 112.26.0.1.43359 > 112.26.0.8.60272: Flags [.], seq 748369:749817, ack 1, win 227, options [nop,nop,TS val 710594 ecr 489288], length 1448
09:49:50.731171 IP 112.26.0.1.43359 > 112.26.0.8.60272: Flags [.], seq 741129:742577, ack 1, win 227, options [nop,nop,TS val 710067 ecr 488752], length 1448
09:49:50.737834 IP 112.26.0.8.60272 > 112.26.0.1.43359: Flags [.], ack 742577, win 8588, options [nop,nop,TS val 489842 ecr 710067], length 0
09:49:50.821379 IP 112.26.0.8.60272 > 112.26.0.1.43359: Flags [.], ack 733889, win 8588, options [nop,nop,TS val 489439 ecr 709775], length 0
09:49:50.823250 IP 112.26.0.1.43359 > 112.26.0.8.60272: Flags [.], seq 749817:751265, ack 1, win 227, options [nop,nop,TS val 710764 ecr 489439], length 1448
09:49:50.834014 IP 112.26.0.1.43359 > 112.26.0.8.60272: Flags [.], seq 751265:752713, ack 1, win 227, options [nop,nop,TS val 710764 ecr 489439], length 1448
09:49:50.838113 IP 112.26.0.1.43359 > 112.26.0.8.60272: Flags [P.], seq 744025:745473, ack 1, win 227, options [nop,nop,TS val 710080 ecr 488848], length 1448
09:49:50.844365 IP 112.26.0.8.60272 > 112.26.0.1.43359: Flags [.], ack 742577, win 8588, options [nop,nop,TS val 489949 ecr 710067,nop,nop,sack 1 {744025:745473}], length 0
09:49:50.926795 IP 112.26.0.8.60272 > 112.26.0.1.43359: Flags [.], ack 736785, win 8588, options [nop,nop,TS val 489544 ecr 709775], length 0
09:49:50.928813 IP 112.26.0.1.43359 > 112.26.0.8.60272: Flags [.], seq 752713:754161, ack 1, win 227, options [nop,nop,TS val 710870 ecr 489544], length 1448
09:49:50.939544 IP 112.26.0.1.43359 > 112.26.0.8.60272: Flags [.], seq 745473:746921, ack 1, win 227, options [nop,nop,TS val 710463 ecr 489136], length 1448
09:49:50.946433 IP 112.26.0.8.60272 > 112.26.0.1.43359: Flags [.], ack 742577, win 8588, options [nop,nop,TS val 490051 ecr 710067,nop,nop,sack 1 {744025:746921}], length 0
09:49:51.031759 IP 112.26.0.1.43359 > 112.26.0.8.60272: Flags [.], seq 754161:755609, ack 1, win 227, options [nop,nop,TS val 710870 ecr 489544], length 1448
09:49:51.045868 IP 112.26.0.8.60272 > 112.26.0.1.43359: Flags [.], ack 739681, win 8588, options [nop,nop,TS val 489729 ecr 709867], length 0
09:49:51.051888 IP 112.26.0.1.43359 > 112.26.0.8.60272: Flags [.], seq 755609:757057, ack 1, win 227, options [nop,nop,TS val 710870 ecr 489544], length 1448
09:49:51.057404 IP 112.26.0.1.43359 > 112.26.0.8.60272: Flags [.], seq 746921:748369, ack 1, win 227, options [nop,nop,TS val 710594 ecr 489288], length 1448
09:49:51.066444 IP 112.26.0.8.60272 > 112.26.0.1.43359: Flags [.], ack 742577, win 8588, options [nop,nop,TS val 490169 ecr 710067,nop,nop,sack 1 {744025:748369}], length 0
09:49:51.124957 IP 112.26.0.1.43359 > 112.26.0.8.60272: Flags [.], seq 757057:758505, ack 1, win 227, options [nop,nop,TS val 710989 ecr 489729], length 1448
