09:49:04.142982 IP 112.26.0.8.60272 > 112.26.0.1.43359: Flags [S], seq 3441072221, win 65535, options [mss 1460,sackOK,TS val 443219 ecr 0,nop,wscale 6], length 0
09:49:04.144033 IP 112.26.0.1.43359 > 112.26.0.8.60272: Flags [S.], seq 2422673350, ack 3441072222, win 28960, options [mss 1460,sackOK,TS val 664086 ecr 443219,nop,wscale 7], length 0
09:49:04.240433 IP 112.26.0.1.43359 > 112.26.0.8.60272: Flags [S.], seq 2422673350, ack 3441072222, win 28960, options [mss 1460,sackOK,TS val 664086 ecr 443219,nop,wscale 7], length 0
09:49:04.244495 IP 112.26.0.1.43359 > 112.26.0.8.60272: Flags [S.], seq 2422673350, ack 3441072222, win 28960, options [mss 1460,sackOK,TS val 664086 ecr 443219,nop,wscale 7], length 0
09:49:04.267106 IP 112.26.0.8.60272 > 112.26.0.1.43359: Flags [.], ack 1, win 1369, options [nop,nop,TS val 443352 ecr 664086], length 0
09:49:04.274608 IP 112.26.0.1.43359 > 112.26.0.8.60272: Flags [.], seq 1:1449, ack 1, win 227, options [nop,nop,TS val 664216 ecr 443352], length 1448
09:49:04.345752 IP 112.26.0.1.43359 > 112.26.0.8.60272: Flags [.], seq 1449:2897, ack 1, win 227, options [nop,nop,TS val 664216 ecr 443352], length 1448
09:49:44.700839 IP 112.26.0.8.60272 > 112.26.0.1.43359: Flags [.], ack 625289, win 8543, options [nop,nop,TS val 483407 ecr 703444,nop,nop,sack 3 {629633:631081}{652801:654249}{649905:651353}], length 0
09:49:44.702115 IP 112.26.0.1.43359 > 112.26.0.8.60272: Flags [.], seq 625289:626737, ack 1, win 227, options [nop,nop,TS val 704644 ecr 483407], length 1448
09:49:44.711089 IP 112.26.0.1.43359 > 112.26.0.8.60272: Flags [.], seq 642665:644113, ack 1, win 227, options [nop,nop,TS val 704258 ecr 482999], length 1448
09:49:44.718257 IP 112.26.0.1.43359 > 112.26.0.8.60272: Flags [.], seq 642665:644113, ack 1, win 227, options [nop,nop,TS val 704258 ecr 482999], length 1448
09:49:44.794077 IP 112.26.0.1.43359 > 112.26.0.8.60272: Flags [.], seq 657145:658593, ack 1, win 227, options [nop,nop,TS val 704339 ecr 483092], length 1448
09:49:44.797174 IP 112.26.0.1.43359 > 112.26.0.8.60272: Flags [.], seq 657145:658593, ack 1, win 227, options [nop,nop,TS val 704339 ecr 483092], length 1448
09:49:44.813338 IP 112.26.0.1.43359 > 112.26.0.8.60272: Flags [.], seq 644113:645561, ack 1, win 227, options [nop,nop,TS val 704349 ecr 483120], length 1448
09:49:44.888130 IP 112.26.0.1.43359 > 112.26.0.8.60272: Flags [.], seq 644113:645561, ack 1, win 227, options [nop,nop,TS val 704349 ecr 483120], length 1448
09:49:44.895232 IP 112.26.0.1.43359 > 112.26.0.8.60272: Flags [P.], seq 648457:649905, ack 1, win 227, options [nop,nop,TS val 704359 ecr 483203], length 1448
09:49:44.910422 IP 112.26.0.1.43359 > 112.26.0.8.60272: Flags [P.], seq 648457:649905, ack 1, win 227, options [nop,nop,TS val 704359 ecr 483203], length 1448
09:49:44.920501 IP 112.26.0.1.43359 > 112.26.0.8.60272: Flags [.], seq 651353:652801, ack 1, win 227, options [nop,nop,TS val 704442 ecr 483292], length 1448
09:49:44.994868 IP 112.26.0.1.43359 > 112.26.0.8.60272: Flags [.], seq 658593:660041, ack 1, win 227, options [nop,nop,TS val 704442 ecr 483292], length 1448
09:49:44.999938 IP 112.26.0.1.43359 > 112.26.0.8.60272: Flags [.], seq 651353:652801, ack 1, win 227, options [nop,nop,TS val 704442 ecr 483292], length 1448
09:49:45.014901 IP 112.26.0.1.43359 > 112.26.0.8.60272: Flags [.], seq 660041:661489, ack 1, win 227, options [nop,nop,TS val 704442 ecr 483292], length 1448
09:49:45.020194 IP 112.26.0.1.43359 > 112.26.0.8.60272: Flags [.], seq 658593:660041, ack 1, win 227, options [nop,nop,TS val 704442 ecr 483292], length 1448
09:49:45.109151 IP 112.26.0.8.60272 > 112.26.0.1.43359: Flags [.], ack 625289, win 8543, options [nop,nop,TS val 483704 ecr 703444,nop,nop,sack 3 {632529:633977}{629633:631081}{652801:654249}], length 0
09:49:45.110432 IP 112.26.0.1.43359 > 112.26.0.8.60272: Flags [.], seq 654249:655697, ack 1, win 227, options [nop,nop,TS val 705052 ecr 483704], length 1448
09:49:45.125524 IP 112.26.0.1.43359 > 112.26.0.8.60272: Flags [.], seq 660041:661489, ack 1, win 227, options [nop,nop,TS val 704442 ecr 483292], length 1448
09:49:45.190436 IP 112.26.0.8.60272 > 112.26.0.1.43359: Flags [.], ack 625289, win 8543, options [nop,nop,TS val 483733 ecr 703444,nop,nop,sack 3 {655697:657145}{632529:633977}{629633:631081}], length 0
09:49:45.192421 IP 112.26.0.1.43359 > 112.26.0.8.60272: Flags [.], seq 662937:664385, ack 1, win 227, options [nop,nop,TS val 705133 ecr 483733], length 1448
09:49:45.204823 IP 112.26.0.8.60272 > 112.26.0.1.43359: Flags [.], ack 625289, win 8543, options [nop,nop,TS val 483822 ecr 703444,nop,nop,sack 3 {642665:644113}{655697:657145}{632529:633977}], length 0
09:49:45.209064 IP 112.26.0.1.43359 > 112.26.0.8.60272: Flags [.], seq 664385:665833, ack 1, win 227, options [nop,nop,TS val 705148 ecr 483822], length 1448
09:49:45.215420 IP 112.26.0.8.60272 > 112.26.0.1.43359: Flags [.], ack 625289, win 8543, options [nop,nop,TS val 483905 ecr 703444,nop,nop,sack 3 {655697:658593}{642665:644113}{632529:633977}], length 0
09:49:45.291517 IP 112.26.0.1.43359 > 112.26.0.8.60272: Flags [.], seq 665833:667281, ack 1, win 227, options [nop,nop,TS val 705158 ecr 483905], length 1448
09:49:45.300966 IP 112.26.0.8.60272 > 112.26.0.1.43359: Flags [.], ack 625289, win 8543, options [nop,nop,TS val 483998 ecr 703444,nop,nop,sack 3 {642665:645561}{655697:658593}{632529:633977}], length 0
09:49:45.308930 IP 112.26.0.8.60272 > 112.26.0.1.43359: Flags [.], ack 625289, win 8543, options [nop,nop,TS val 484020 ecr 703444,nop,nop,sack 3 {648457:649905}{642665:645561}{655697:658593}], length 0
09:49:45.313213 IP 112.26.0.1.43359 > 112.26.0.8.60272: Flags [.], seq 667281:668729, ack 1, win 227, options [nop,nop,TS val 705244 ecr 483998], length 1448
09:49:45.396020 IP 112.26.0.8.60272 > 112.26.0.1.43359: Flags [.], ack 625289, win 8543, options [nop,nop,TS val 484109 ecr 703444,nop,nop,sack 3 {651353:652801}{648457:649905}{642665:645561}], length 0
09:49:45.404888 IP 112.26.0.1.43359 > 112.26.0.8.60272: Flags [.], seq 668729:670177, ack 1, win 227, options [nop,nop,TS val 705252 ecr 484020], length 1448
09:49:45.408406 IP 112.26.0.8.60272 > 112.26.0.1.43359: Flags [.], ack 625289, win 8543, options [nop,nop,TS val 484129 ecr 703444,nop,nop,sack 3 {655697:660041}{651353:652801}{648457:649905}], length 0
09:49:45.415480 IP 112.26.0.1.43359 > 112.26.0.8.60272: Flags [.], seq 670177:671625, ack 1, win 227, options [nop,nop,TS val 705339 ecr 484109], length 1448
09:49:45.419007 IP 112.26.0.1.43359 > 112.26.0.8.60272: Flags [.], seq 654249:655697, ack 1, win 227, options [nop,nop,TS val 705052 ecr 483704], length 1448
09:49:45.420914 IP 112.26.0.1.43359 > 112.26.0.8.60272: Flags [.], seq 654249:655697, ack 1, win 227, options [nop,nop,TS val 705052 ecr 483704], length 1448
09:49:45.502557 IP 112.26.0.1.43359 > 112.26.0.8.60272: Flags [.], seq 671625:673073, ack 1, win 227, options [nop,nop,TS val 705351 ecr 484129], length 1448
09:49:45.508875 IP 112.26.0.8.60272 > 112.26.0.1.43359: Flags [.], ack 625289, win 8543, options [nop,nop,TS val 484232 ecr 703444,nop,nop,sack 3 {655697:661489}{651353:652801}{648457:649905}], length 0
09:49:45.515684 IP 112.26.0.1.43359 > 112.26.0.8.60272: Flags [.], seq 662937:664385, ack 1, win 227, options [nop,nop,TS val 705133 ecr 483733], length 1448
09:49:45.600908 IP 112.26.0.1.43359 > 112.26.0.8.60272: Flags [.], seq 673073:674521, ack 1, win 227, options [nop,nop,TS val 705452 ecr 484232], length 1448
09:49:45.605761 IP 112.26.0.1.43359 > 112.26.0.8.60272: Flags [.], seq 662937:664385, ack 1, win 227, options [nop,nop,TS val 705133 ecr 483733], length 1448
09:49:45.614184 IP 112.26.0.1.43359 > 112.26.0.8.60272: Flags [.], seq 664385:665833, ack 1, win 227, options [nop,nop,TS val 705148 ecr 483822], length 1448
09:49:45.617295 IP 112.26.0.1.43359 > 112.26.0.8.60272: Flags [.], seq 664385:665833, ack 1, win 227, options [nop,nop,TS val 705148 ecr 483822], length 1448
09:49:45.693807 IP 112.26.0.1.43359 > 112.26.0.8.60272: Flags [.], seq 665833:667281, ack 1, win 227, options [nop,nop,TS val 705158 ecr 483905], length 1448
09:49:45.697832 IP 112.26.0.1.43359 > 112.26.0.8.60272: Flags [.], seq 665833:667281, ack 1, win 227, options [nop,nop,TS val 705158 ecr 483905], length 1448
09:49:45.714817 IP 112.26.0.1.43359 > 112.26.0.8.60272: Flags [.], seq 667281:668729, ack 1, win 227, options [nop,nop,TS val 705244 ecr 483998], length 1448
09:49:45.717736 IP 112.26.0.1.43359 > 112.26.0.8.60272: Flags [.], seq 667281:668729, ack 1, win 227, options [nop,nop,TS val 705244 ecr 483998], length 1448
09:49:45.803965 IP 112.26.0.1.43359 > 112.26.0.8.60272: Flags [.], seq 668729:670177, ack 1, win 227, options [nop,nop,TS val 705252 ecr 484020], length 1448
09:49:45.806433 IP 112.26.0.1.43359 > 112.26.0.8.60272: Flags [.], seq 668729:670177, ack 1, win 227, options [nop,nop,TS val 705252 ecr 484020], length 1448
09:49:45.893205 IP 112.26.0.1.43359 > 112.26.0.8.60272: Flags [.], seq 670177:671625, ack 1, win 227, options [nop,nop,TS val 705339 ecr 484109], length 1448
09:49:45.897846 IP 112.26.0.1.43359 > 112.26.0.8.60272: Flags [.], seq 670177:671625, ack 1, win 227, options [nop,nop,TS val 705339 ecr 484109], length 1448
09:49:45.915044 IP 112.26.0.8.60272 > 112.26.0.1.43359: Flags [.], ack 625289, win 8543, options [nop,nop,TS val 484530 ecr 703444,nop,nop,sack 3 {654249:661489}{651353:652801}{648457:649905}], length 0
09:49:45.918818 IP 112.26.0.1.43359 > 112.26.0.8.60272: Flags [.], seq 625289:626737, ack 1, win 227, options [nop,nop,TS val 705858 ecr 484530], length 1448
09:49:46.007128 IP 112.26.0.1.43359 > 112.26.0.8.60272: Flags [.], seq 671625:673073, ack 1, win 227, options [nop,nop,TS val 705351 ecr 484129], length 1448
09:49:46.009605 IP 112.26.0.1.43359 > 112.26.0.8.60272: Flags [.], seq 671625:673073, ack 1, win 227, options [nop,nop,TS val 705351 ecr 484129], length 1448
09:49:46.027075 IP 112.26.0.1.43359 > 112.26.0.8.60272: Flags [.], seq 673073:674521, ack 1, win 227, options [nop,nop,TS val 705452 ecr 484232], length 1448
09:49:46.037026 IP 112.26.0.1.43359 > 112.26.0.8.60272: Flags [.], seq 673073:674521, ack 1, win 227, options [nop,nop,TS val 705452 ecr 484232], length 1448
09:49:46.113287 IP 112.26.0.8.60272 > 112.26.0.1.43359: Flags [.], ack 625289, win 8543, options [nop,nop,TS val 484725 ecr 703444,nop,nop,sack 3 {662937:665833}{654249:661489}{651353:652801}], length 0
09:49:46.115486 IP 112.26.0.1.43359 > 112.26.0.8.60272: Flags [.], seq 661489:662937, ack 1, win 227, options [nop,nop,TS val 706056 ecr 484725], length 1448
09:49:46.125265 IP 112.26.0.8.60272 > 112.26.0.1.43359: Flags [.], ack 625289, win 8543, options [nop,nop,TS val 484805 ecr 703444,nop,nop,sack 3 {662937:667281}{654249:661489}{651353:652801}], length 0
09:49:46.131686 IP 112.26.0.1.43359 > 112.26.0.8.60272: Flags [.], seq 674521:675969, ack 1, win 227, options [nop,nop,TS val 706056 ecr 484725], length 1448
09:49:46.198851 IP 112.26.0.8.60272 > 112.26.0.1.43359: Flags [.], ack 625289, win 8543, options [nop,nop,TS val 484826 ecr 703444,nop,nop,sack 3 {662937:668729}{654249:661489}{651353:652801}], length 0
09:49:46.208991 IP 112.26.0.8.60272 > 112.26.0.1.43359: Flags [.], ack 625289, win 8543, options [nop,nop,TS val 484915 ecr 703444,nop,nop,sack 3 {662937:670177}{654249:661489}{651353:652801}], length 0
09:49:46.213218 IP 112.26.0.1.43359 > 112.26.0.8.60272: Flags [.], seq 675969:677417, ack 1, win 227, options [nop,nop,TS val 706068 ecr 484805], length 1448
09:49:46.219207 IP 112.26.0.1.43359 > 112.26.0.8.60272: Flags [.], seq 677417:678865, ack 1, win 227, options [nop,nop,TS val 706141 ecr 484826], length 1448
09:49:46.301138 IP 112.26.0.8.60272 > 112.26.0.1.43359: Flags [.], ack 625289, win 8543, options [nop,nop,TS val 485005 ecr 703444,nop,nop,sack 3 {662937:671625}{654249:661489}{651353:652801}], length 0
09:49:46.310416 IP 112.26.0.1.43359 > 112.26.0.8.60272: Flags [.], seq 678865:680313, ack 1, win 227, options [nop,nop,TS val 706151 ecr 484915], length 1448
09:49:46.315334 IP 112.26.0.1.43359 > 112.26.0.8.60272: Flags [.], seq 625289:626737, ack 1, win 227, options [nop,nop,TS val 705858 ecr 484530], length 1448
09:49:46.317841 IP 112.26.0.1.43359 > 112.26.0.8.60272: Flags [.], seq 625289:626737, ack 1, win 227, options [nop,nop,TS val 705858 ecr 484530], length 1448
09:49:46.325238 IP 112.26.0.1.43359 > 112.26.0.8.60272: Flags [.], seq 680313:681761, ack 1, win 227, options [nop,nop,TS val 706243 ecr 485005], length 1448
09:49:46.406591 IP 112.26.0.8.60272 > 112.26.0.1.43359: Flags [.], ack 625289, win 8543, options [nop,nop,TS val 485118 ecr 703444,nop,nop,sack 3 {662937:673073}{654249:661489}{651353:652801}], length 0
09:49:46.409374 IP 112.26.0.1.43359 > 112.26.0.8.60272: Flags [.], seq 681761:683209, ack 1, win 227, options [nop,nop,TS val 706349 ecr 485118], length 1448
09:49:46.417701 IP 112.26.0.8.60272 > 112.26.0.1.43359: Flags [.], ack 625289, win 8543, options [nop,nop,TS val 485146 ecr 703444,nop,nop,sack 3 {662937:674521}{654249:661489}{651353:652801}], length 0
09:49:46.499734 IP 112.26.0.1.43359 > 112.26.0.8.60272: Flags [.], seq 683209:684657, ack 1, win 227, options [nop,nop,TS val 706360 ecr 485146], length 1448
09:49:46.508155 IP 112.26.0.1.43359 > 112.26.0.8.60272: Flags [.], seq 661489:662937, ack 1, win 227, options [nop,nop,TS val 706056 ecr 484725], length 1448
09:49:46.510653 IP 112.26.0.1.43359 > 112.26.0.8.60272: Flags [.], seq 661489:662937, ack 1, win 227, options [nop,nop,TS val 706056 ecr 484725], length 1448
09:49:46.597909 IP 112.26.0.1.43359 > 112.26.0.8.60272: Flags [.], seq 674521:675969, ack 1, win 227, options [nop,nop,TS val 706056 ecr 484725], length 1448
09:49:46.608178 IP 112.26.0.1.43359 > 112.26.0.8.60272: Flags [.], seq 674521:675969, ack 1, win 227, options [nop,nop,TS val 706056 ecr 484725], length 1448
09:49:46.618680 IP 112.26.0.1.43359 > 112.26.0.8.60272: Flags [.], seq 675969:677417, ack 1, win 227, options [nop,nop,TS val 706068 ecr 484805], length 1448
09:49:46.624265 IP 112.26.0.1.43359 > 112.26.0.8.60272: Flags [.], seq 675969:677417, ack 1, win 227, options [nop,nop,TS val 706068 ecr 484805], length 1448
09:49:46.696696 IP 112.26.0.1.43359 > 112.26.0.8.60272: Flags [.], seq 677417:678865, ack 1, win 227, options [nop,nop,TS val 706141 ecr 484826], length 1448
09:49:46.700009 IP 112.26.0.1.43359 > 112.26.0.8.60272: Flags [.], seq 677417:678865, ack 1, win 227, options [nop,nop,TS val 706141 ecr 484826], length 1448
09:49:46.717322 IP 112.26.0.1.43359 > 112.26.0.8.60272: Flags [.], seq 678865:680313, ack 1, win 227, options [nop,nop,TS val 706151 ecr 484915], length 1448
09:49:46.721987 IP 112.26.0.1.43359 > 112.26.0.8.60272: Flags [.], seq 678865:680313, ack 1, win 227, options [nop,nop,TS val 706151 ecr 484915], length 1448
09:49:46.732327 IP 112.26.0.8.60272 > 112.26.0.1.43359: Flags [.], ack 661489, win 8093, options [nop,nop,TS val 485426 ecr 705858,nop,nop,sack 1 {662937:674521}], length 0
09:49:46.735289 IP 112.26.0.1.43359 > 112.26.0.8.60272: Flags [.], seq 684657:686105, ack 1, win 227, options [nop,nop,TS val 706675 ecr 485426], length 1448
09:49:46.812734 IP 112.26.0.1.43359 > 112.26.0.8.60272: Flags [.], seq 680313:681761, ack 1, win 227, options [nop,nop,TS val 706243 ecr 485005], length 1448
09:49:46.814623 IP 112.26.0.1.43359 > 112.26.0.8.60272: Flags [.], seq 680313:681761, ack 1, win 227, options [nop,nop,TS val 706243 ecr 485005], length 1448
09:49:46.895749 IP 112.26.0.1.43359 > 112.26.0.8.60272: Flags [.], seq 681761:683209, ack 1, win 227, options [nop,nop,TS val 706349 ecr 485118], length 1448
09:49:46.908157 IP 112.26.0.1.43359 > 112.26.0.8.60272: Flags [.], seq 681761:683209, ack 1, win 227, options [nop,nop,TS val 706349 ecr 485118], length 1448
09:49:46.920246 IP 112.26.0.1.43359 > 112.26.0.8.60272: Flags [.], seq 683209:684657, ack 1, win 227, options [nop,nop,TS val 706360 ecr 485146], length 1448
09:49:46.928469 IP 112.26.0.1.43359 > 112.26.0.8.60272: Flags [.], seq 683209:684657, ack 1, win 227, options [nop,nop,TS val 706360 ecr 485146], length 1448
09:49:47.007671 IP 112.26.0.8.60272 > 112.26.0.1.43359: Flags [.], ack 674521, win 8469, options [nop,nop,TS val 485619 ecr 706056], length 0
09:49:47.011884 IP 112.26.0.1.43359 > 112.26.0.8.60272: Flags [P.], seq 686105:687553, ack 1, win 227, options [nop,nop,TS val 706950 ecr 485619], length 1448
09:49:47.024755 IP 112.26.0.8.60272 > 112.26.0.1.43359: Flags [.], ack 675969, win 8588, options [nop,nop,TS val 485710 ecr 706056], length 0
09:49:47.029854 IP 112.26.0.1.43359 > 112.26.0.8.60272: Flags [.], seq 687553:689001, ack 1, win 227, options [nop,nop,TS val 706967 ecr 485710], length 1448
09:49:47.103670 IP 112.26.0.8.60272 > 112.26.0.1.43359: Flags [.], ack 677417, win 8588, options [nop,nop,TS val 485734 ecr 706068], length 0
09:49:47.109275 IP 112.26.0.1.43359 > 112.26.0.8.60272: Flags [.], seq 689001:690449, ack 1, win 227, options [nop,nop,TS val 707047 ecr 485734], length 1448
09:49:47.118267 IP 112.26.0.8.60272 > 112.26.0.1.43359: Flags [.], ack 678865, win 8588, options [nop,nop,TS val 485808 ecr 706141], length 0
09:49:47.119521 IP 112.26.0.1.43359 > 112.26.0.8.60272: Flags [.], seq 690449:691897, ack 1, win 227, options [nop,nop,TS val 707061 ecr 485808], length 1448
09:49:47.205900 IP 112.26.0.1.43359 > 112.26.0.8.60272: Flags [.], seq 684657:686105, ack 1, win 227, options [nop,nop,TS val 706675 ecr 485426], length 1448
09:49:47.216849 IP 112.26.0.1.43359 > 112.26.0.8.60272: Flags [.], seq 684657:686105, ack 1, win 227, options [nop,nop,TS val 706675 ecr 485426], length 1448
09:49:47.238045 IP 112.26.0.8.60272 > 112.26.0.1.43359: Flags [.], ack 680313, win 8588, options [nop,nop,TS val 485831 ecr 706151], length 0
09:49:47.240104 IP 112.26.0.1.43359 > 112.26.0.8.60272: Flags [.], seq 691897:693345, ack 1, win 227, options [nop,nop,TS val 707181 ecr 485831], length 1448
09:49:47.311299 IP 112.26.0.8.60272 > 112.26.0.1.43359: Flags [.], ack 681761, win 8588, options [nop,nop,TS val 485924 ecr 706243], length 0
09:49:47.312999 IP 112.26.0.1.43359 > 112.26.0.8.60272: Flags [.], seq 693345:694793, ack 1, win 227, options [nop,nop,TS val 707254 ecr 485924], length 1448
09:49:47.321837 IP 112.26.0.8.60272 > 112.26.0.1.43359: Flags [.], ack 683209, win 8588, options [nop,nop,TS val 486017 ecr 706349], length 0
09:49:47.327474 IP 112.26.0.1.43359 > 112.26.0.8.60272: Flags [.], seq 694793:696241, ack 1, win 227, options [nop,nop,TS val 707265 ecr 486017], length 1448
09:49:47.408858 IP 112.26.0.8.60272 > 112.26.0.1.43359: Flags [.], ack 684657, win 8588, options [nop,nop,TS val 486038 ecr 706360], length 0
09:49:47.411313 IP 112.26.0.1.43359 > 112.26.0.8.60272: Flags [.], seq 696241:697689, ack 1, win 227, options [nop,nop,TS val 707352 ecr 486038], length 1448
09:49:47.421043 IP 112.26.0.1.43359 > 112.26.0.8.60272: Flags [P.], seq 686105:687553, ack 1, win 227, options [nop,nop,TS val 706950 ecr 485619], length 1448
09:49:47.422931 IP 112.26.0.1.43359 > 112.26.0.8.60272: Flags [P.], seq 686105:687553, ack 1, win 227, options [nop,nop,TS val 706950 ecr 485619], length 1448
09:49:47.511629 IP 112.26.0.1.43359 > 112.26.0.8.60272: Flags [.], seq 687553:689001, ack 1, win 227, options [nop,nop,TS val 706967 ecr 485710], length 1448
09:49:47.516463 IP 112.26.0.1.43359 > 112.26.0.8.60272: Flags [.], seq 687553:689001, ack 1, win 227, options [nop,nop,TS val 706967 ecr 485710], length 1448
09:49:47.532051 IP 112.26.0.1.43359 > 112.26.0.8.60272: Flags [.], seq 689001:690449, ack 1, win 227, options [nop,nop,TS val 707047 ecr 485734], length 1448
09:49:47.533961 IP 112.26.0.1.43359 > 112.26.0.8.60272: Flags [.], seq 689001:690449, ack 1, win 227, options [nop,nop,TS val 707047 ecr 485734], length 1448
09:49:47.620887 IP 112.26.0.1.43359 > 112.26.0.8.60272: Flags [.], seq 690449:691897, ack 1, win 227, options [nop,nop,TS val 707061 ecr 485808], length 1448
09:49:47.623364 IP 112.26.0.1.43359 > 112.26.0.8.60272: Flags [.], seq 690449:691897, ack 1, win 227, options [nop,nop,TS val 707061 ecr 485808], length 1448
09:49:47.719204 IP 112.26.0.1.43359 > 112.26.0.8.60272: Flags [.], seq 691897:693345, ack 1, win 227, options [nop,nop,TS val 707181 ecr 485831], length 1448
09:49:47.721751 IP 112.26.0.1.43359 > 112.26.0.8.60272: Flags [.], seq 691897:693345, ack 1, win 227, options [nop,nop,TS val 707181 ecr 485831], length 1448
09:49:47.738940 IP 112.26.0.1.43359 > 112.26.0.8.60272: Flags [.], seq 693345:694793, ack 1, win 227, options [nop,nop,TS val 707254 ecr 485924], length 1448
09:49:47.801908 IP 112.26.0.1.43359 > 112.26.0.8.60272: Flags [.], seq 693345:694793, ack 1, win 227, options [nop,nop,TS val 707254 ecr 485924], length 1448
09:49:47.826621 IP 112.26.0.1.43359 > 112.26.0.8.60272: Flags [.], seq 694793:696241, ack 1, win 227, options [nop,nop,TS val 707265 ecr 486017], length 1448
09:49:47.845321 IP 112.26.0.1.43359 > 112.26.0.8.60272: Flags [.], seq 696241:697689, ack 1, win 227, options [nop,nop,TS val 707352 ecr 486038], length 1448
09:49:47.911978 IP 112.26.0.8.60272 > 112.26.0.1.43359: Flags [.], ack 687553, win 8588, options [nop,nop,TS val 486532 ecr 706950], length 0
09:49:47.914415 IP 112.26.0.1.43359 > 112.26.0.8.60272: Flags [.], seq 697689:699137, ack 1, win 227, options [nop,nop,TS val 707855 ecr 486532], length 1448
09:49:47.921069 IP 112.26.0.1.43359 > 112.26.0.8.60272: Flags [.], seq 694793:696241, ack 1, win 227, options [nop,nop,TS val 707265 ecr 486017], length 1448
09:49:47.927366 IP 112.26.0.1.43359 > 112.26.0.8.60272: Flags [.], seq 699137:700585, ack 1, win 227, options [nop,nop,TS val 707855 ecr 486532], length 1448
09:49:47.934125 IP 112.26.0.1.43359 > 112.26.0.8.60272: Flags [.], seq 696241:697689, ack 1, win 227, options [nop,nop,TS val 707352 ecr 486038], length 1448
09:49:48.019074 IP 112.26.0.8.60272 > 112.26.0.1.43359: Flags [.], ack 689001, win 8588, options [nop,nop,TS val 486623 ecr 706967], length 0
09:49:48.020450 IP 112.26.0.1.43359 > 112.26.0.8.60272: Flags [.], seq 700585:702033, ack 1, win 227, options [nop,nop,TS val 707962 ecr 486623], length 1448
09:49:48.036494 IP 112.26.0.1.43359 > 112.26.0.8.60272: Flags [.], seq 702033:703481, ack 1, win 227, options [nop,nop,TS val 707962 ecr 486623], length 1448
09:49:48.039083 IP 112.26.0.8.60272 > 112.26.0.1.43359: Flags [.], ack 690449, win 8588, options [nop,nop,TS val 486643 ecr 707047], length 0
09:49:48.048581 IP 112.26.0.8.60272 > 112.26.0.1.43359: Flags [.], ack 691897, win 8588, options [nop,nop,TS val 486732 ecr 707061], length 0
09:49:48.115488 IP 112.26.0.1.43359 > 112.26.0.8.60272: Flags [.], seq 703481:704929, ack 1, win 227, options [nop,nop,TS val 707982 ecr 486643], length 1448
09:49:48.119612 IP 112.26.0.8.60272 > 112.26.0.1.43359: Flags [.], ack 693345, win 8588, options [nop,nop,TS val 486830 ecr 707181], length 0
09:49:48.127236 IP 112.26.0.8.60272 > 112.26.0.1.43359: Flags [.], ack 694793, win 8588, options [nop,nop,TS val 486912 ecr 707254], length 0
09:49:48.131947 IP 112.26.0.1.43359 > 112.26.0.8.60272: Flags [.], seq 704929:706377, ack 1, win 227, options [nop,nop,TS val 707991 ecr 486732], length 1448
09:49:48.209233 IP 112.26.0.1.43359 > 112.26.0.8.60272: Flags [.], seq 697689:699137, ack 1, win 227, options [nop,nop,TS val 707855 ecr 486532], length 1448
09:49:48.212385 IP 112.26.0.1.43359 > 112.26.0.8.60272: Flags [.], seq 697689:699137, ack 1, win 227, options [nop,nop,TS val 707855 ecr 486532], length 1448
09:49:48.220718 IP 112.26.0.1.43359 > 112.26.0.8.60272: Flags [.], seq 706377:707825, ack 1, win 227, options [nop,nop,TS val 708062 ecr 486830], length 1448
09:49:48.227786 IP 112.26.0.1.43359 > 112.26.0.8.60272: Flags [.], seq 707825:709273, ack 1, win 227, options [nop,nop,TS val 708071 ecr 486912], length 1448
09:49:48.231973 IP 112.26.0.1.43359 > 112.26.0.8.60272: Flags [.], seq 699137:700585, ack 1, win 227, options [nop,nop,TS val 707855 ecr 486532], length 1448
09:49:48.233926 IP 112.26.0.1.43359 > 112.26.0.8.60272: Flags [.], seq 699137:700585, ack 1, win 227, options [nop,nop,TS val 707855 ecr 486532], length 1448
09:49:48.320098 IP 112.26.0.8.60272 > 112.26.0.1.43359: Flags [.], ack 697689, win 8588, options [nop,nop,TS val 487043 ecr 707265], length 0
09:49:48.321467 IP 112.26.0.1.43359 > 112.26.0.8.60272: Flags [.], seq 709273:710721, ack 1, win 227, options [nop,nop,TS val 708263 ecr 487043], length 1448
09:49:48.336288 IP 112.26.0.1.43359 > 112.26.0.8.60272: Flags [.], seq 710721:712169, ack 1, win 227, options [nop,nop,TS val 708263 ecr 487043], length 1448
09:49:48.415122 IP 112.26.0.1.43359 > 112.26.0.8.60272: Flags [.], seq 700585:702033, ack 1, win 227, options [nop,nop,TS val 707962 ecr 486623], length 1448
09:49:48.419809 IP 112.26.0.1.43359 > 112.26.0.8.60272: Flags [.], seq 700585:702033, ack 1, win 227, options [nop,nop,TS val 707962 ecr 486623], length 1448
09:49:48.428084 IP 112.26.0.1.43359 > 112.26.0.8.60272: Flags [.], seq 702033:703481, ack 1, win 227, options [nop,nop,TS val 707962 ecr 486623], length 1448
09:49:48.509883 IP 112.26.0.1.43359 > 112.26.0.8.60272: Flags [.], seq 702033:703481, ack 1, win 227, options [nop,nop,TS val 707962 ecr 486623], length 1448
09:49:48.526334 IP 112.26.0.1.43359 > 112.26.0.8.60272: Flags [.], seq 703481:704929, ack 1, win 227, options [nop,nop,TS val 707982 ecr 486643], length 1448
09:49:48.534979 IP 112.26.0.1.43359 > 112.26.0.8.60272: Flags [.], seq 703481:704929, ack 1, win 227, options [nop,nop,TS val 707982 ecr 486643], length 1448
09:49:48.545763 IP 112.26.0.1.43359 > 112.26.0.8.60272: Flags [.], seq 704929:706377, ack 1, win 227, options [nop,nop,TS val 707991 ecr 486732], length 1448
09:49:48.610841 IP 112.26.0.1.43359 > 112.26.0.8.60272: Flags [.], seq 704929:706377, ack 1, win 227, options [nop,nop,TS val 707991 ecr 486732], length 1448
09:49:48.621834 IP 112.26.0.1.43359 > 112.26.0.8.60272: Flags [.], seq 706377:707825, ack 1, win 227, options [nop,nop,TS val 708062 ecr 486830], length 1448
09:49:48.628751 IP 112.26.0.1.43359 > 112.26.0.8.60272: Flags [.], seq 707825:709273, ack 1, win 227, options [nop,nop,TS val 708071 ecr 486912], length 1448
09:49:48.632939 IP 112.26.0.1.43359 > 112.26.0.8.60272: Flags [.], seq 706377:707825, ack 1, win 227, options [nop,nop,TS val 708062 ecr 486830], length 1448
09:49:48.722696 IP 112.26.0.8.60272 > 112.26.0.1.43359: Flags [.], ack 700585, win 8588, options [nop,nop,TS val 487343 ecr 707855], length 0
09:49:48.729644 IP 112.26.0.1.43359 > 112.26.0.8.60272: Flags [.], seq 707825:709273, ack 1, win 227, options [nop,nop,TS val 708071 ecr 486912], length 1448
09:49:48.734979 IP 112.26.0.1.43359 > 112.26.0.8.60272: Flags [.], seq 712169:713617, ack 1, win 227, options [nop,nop,TS val 708666 ecr 487343], length 1448
09:49:48.738901 IP 112.26.0.1.43359 > 112.26.0.8.60272: Flags [.], seq 709273:710721, ack 1, win 227, options [nop,nop,TS val 708263 ecr 487043], length 1448
09:49:48.747432 IP 112.26.0.1.43359 > 112.26.0.8.60272: Flags [.], seq 713617:715065, ack 1, win 227, options [nop,nop,TS val 708666 ecr 487343], length 1448
09:49:48.748983 IP 112.26.0.1.43359 > 112.26.0.8.60272: Flags [.], seq 709273:710721, ack 1, win 227, options [nop,nop,TS val 708263 ecr 487043], length 1448
09:49:48.820368 IP 112.26.0.1.43359 > 112.26.0.8.60272: Flags [.], seq 710721:712169, ack 1, win 227, options [nop,nop,TS val 708263 ecr 487043], length 1448
09:49:48.828028 IP 112.26.0.1.43359 > 112.26.0.8.60272: Flags [.], seq 710721:712169, ack 1, win 227, options [nop,nop,TS val 708263 ecr 487043], length 1448
09:49:48.832630 IP 112.26.0.8.60272 > 112.26.0.1.43359: Flags [.], ack 702033, win 8588, options [nop,nop,TS val 487570 ecr 707962], length 0
09:49:48.833906 IP 112.26.0.1.43359 > 112.26.0.8.60272: Flags [.], seq 715065:716513, ack 1, win 227, options [nop,nop,TS val 708776 ecr 487570], length 1448
09:49:48.924249 IP 112.26.0.8.60272 > 112.26.0.1.43359: Flags [.], ack 704929, win 8588, options [nop,nop,TS val 487644 ecr 707962], length 0
09:49:48.925729 IP 112.26.0.1.43359 > 112.26.0.8.60272: Flags [.], seq 716513:717961, ack 1, win 227, options [nop,nop,TS val 708867 ecr 487644], length 1448
09:49:48.935300 IP 112.26.0.1.43359 > 112.26.0.8.60272: Flags [.], seq 717961:719409, ack 1, win 227, options [nop,nop,TS val 708867 ecr 487644], length 1448
09:49:48.940484 IP 112.26.0.1.43359 > 112.26.0.8.60272: Flags [.], seq 719409:720857, ack 1, win 227, options [nop,nop,TS val 708867 ecr 487644], length 1448
09:49:48.942915 IP 112.26.0.8.60272 > 112.26.0.1.43359: Flags [.], ack 707825, win 8588, options [nop,nop,TS val 487742 ecr 707991], length 0
09:49:49.018202 IP 112.26.0.1.43359 > 112.26.0.8.60272: Flags [.], seq 720857:722305, ack 1, win 227, options [nop,nop,TS val 708886 ecr 487742], length 1448
09:49:49.022402 IP 112.26.0.1.43359 > 112.26.0.8.60272: Flags [.], seq 712169:713617, ack 1, win 227, options [nop,nop,TS val 708666 ecr 487343], length 1448
09:49:49.028233 IP 112.26.0.1.43359 > 112.26.0.8.60272: Flags [.], seq 712169:713617, ack 1, win 227, options [nop,nop,TS val 708666 ecr 487343], length 1448
09:49:49.032582 IP 112.26.0.1.43359 > 112.26.0.8.60272: Flags [.], seq 722305:723753, ack 1, win 227, options [nop,nop,TS val 708886 ecr 487742], length 1448
09:49:49.117962 IP 112.26.0.1.43359 > 112.26.0.8.60272: Flags [.], seq 713617:715065, ack 1, win 227, options [nop,nop,TS val 708666 ecr 487343], length 1448
09:49:49.125205 IP 112.26.0.1.43359 > 112.26.0.8.60272: Flags [.], seq 713617:715065, ack 1, win 227, options [nop,nop,TS val 708666 ecr 487343], length 1448
09:49:49.142480 IP 112.26.0.8.60272 > 112.26.0.1.43359: Flags [.], ack 710721, win 8588, options [nop,nop,TS val 487854 ecr 708071], length 0
09:49:49.143856 IP 112.26.0.1.43359 > 112.26.0.8.60272: Flags [P.], seq 723753:725201, ack 1, win 227, options [nop,nop,TS val 709085 ecr 487854], length 1448
09:49:49.215921 IP 112.26.0.1.43359 > 112.26.0.8.60272: Flags [.], seq 725201:726649, ack 1, win 227, options [nop,nop,TS val 709085 ecr 487854], length 1448
09:49:49.223420 IP 112.26.0.1.43359 > 112.26.0.8.60272: Flags [.], seq 715065:716513, ack 1, win 227, options [nop,nop,TS val 708776 ecr 487570], length 1448
09:49:49.227128 IP 112.26.0.1.43359 > 112.26.0.8.60272: Flags [.], seq 715065:716513, ack 1, win 227, options [nop,nop,TS val 708776 ecr 487570], length 1448
09:49:49.318329 IP 112.26.0.8.60272 > 112.26.0.1.43359: Flags [.], ack 712169, win 8588, options [nop,nop,TS val 487987 ecr 708263], length 0
09:49:49.320249 IP 112.26.0.1.43359 > 112.26.0.8.60272: Flags [.], seq 726649:728097, ack 1, win 227, options [nop,nop,TS val 709261 ecr 487987], length 1448
09:49:49.341508 IP 112.26.0.1.43359 > 112.26.0.8.60272: Flags [.], seq 716513:717961, ack 1, win 227, options [nop,nop,TS val 708867 ecr 487644], length 1448
09:49:49.344134 IP 112.26.0.1.43359 > 112.26.0.8.60272: Flags [.], seq 716513:717961, ack 1, win 227, options [nop,nop,TS val 708867 ecr 487644], length 1448
09:49:49.418979 IP 112.26.0.1.43359 > 112.26.0.8.60272: Flags [.], seq 717961:719409, ack 1, win 227, options [nop,nop,TS val 708867 ecr 487644], length 1448
09:49:49.422309 IP 112.26.0.1.43359 > 112.26.0.8.60272: Flags [.], seq 717961:719409, ack 1, win 227, options [nop,nop,TS val 708867 ecr 487644], length 1448
09:49:49.438158 IP 112.26.0.1.43359 > 112.26.0.8.60272: Flags [.], seq 719409:720857, ack 1, win 227, options [nop,nop,TS val 708867 ecr 487644], length 1448
09:49:49.445224 IP 112.26.0.1.43359 > 112.26.0.8.60272: Flags [.], seq 719409:720857, ack 1, win 227, options [nop,nop,TS val 708867 ecr 487644], length 1448
09:49:49.520122 IP 112.26.0.1.43359 > 112.26.0.8.60272: Flags [.], seq 720857:722305, ack 1, win 227, options [nop,nop,TS val 708886 ecr 487742], length 1448
09:49:49.526165 IP 112.26.0.1.43359 > 112.26.0.8.60272: Flags [.], seq 720857:722305, ack 1, win 227, options [nop,nop,TS val 708886 ecr 487742], length 1448
09:49:49.540518 IP 112.26.0.1.43359 > 112.26.0.8.60272: Flags [.], seq 722305:723753, ack 1, win 227, options [nop,nop,TS val 708886 ecr 487742], length 1448
09:49:49.617679 IP 112.26.0.8.60272 > 112.26.0.1.43359: Flags [.], ack 715065, win 8588, options [nop,nop,TS val 488230 ecr 708666], length 0
09:49:49.626250 IP 112.26.0.1.43359 > 112.26.0.8.60272: Flags [.], seq 722305:723753, ack 1, win 227, options [nop,nop,TS val 708886 ecr 487742], length 1448
09:49:49.627241 IP 112.26.0.1.43359 > 112.26.0.8.60272: Flags [.], seq 728097:729545, ack 1, win 227, options [nop,nop,TS val 709560 ecr 488230], length 1448
09:49:49.636026 IP 112.26.0.1.43359 > 112.26.0.8.60272: Flags [.], seq 729545:730993, ack 1, win 227, options [nop,nop,TS val 709560 ecr 488230], length 1448
09:49:49.639630 IP 112.26.0.1.43359 > 112.26.0.8.60272: Flags [P.], seq 723753:725201, ack 1, win 227, options [nop,nop,TS val 709085 ecr 487854], length 1448
09:49:49.642743 IP 112.26.0.1.43359 > 112.26.0.8.60272: Flags [P.], seq 723753:725201, ack 1, win 227, options [nop,nop,TS val 709085 ecr 487854], length 1448
09:49:49.720072 IP 112.26.0.1.43359 > 112.26.0.8.60272: Flags [.], seq 725201:726649, ack 1, win 227, options [nop,nop,TS val 709085 ecr 487854], length 1448
09:49:49.727866 IP 112.26.0.1.43359 > 112.26.0.8.60272: Flags [.], seq 725201:726649, ack 1, win 227, options [nop,nop,TS val 709085 ecr 487854], length 1448
09:49:49.733558 IP 112.26.0.1.43359 > 112.26.0.8.60272: Flags [.], seq 726649:728097, ack 1, win 227, options [nop,nop,TS val 709261 ecr 487987], length 1448
09:49:49.738464 IP 112.26.0.1.43359 > 112.26.0.8.60272: Flags [.], seq 726649:728097, ack 1, win 227, options [nop,nop,TS val 709261 ecr 487987], length 1448
09:49:49.832172 IP 112.26.0.8.60272 > 112.26.0.1.43359: Flags [.], ack 719409, win 8588, options [nop,nop,TS val 488530 ecr 708867], length 0
09:49:49.834669 IP 112.26.0.1.43359 > 112.26.0.8.60272: Flags [.], seq 730993:732441, ack 1, win 227, options [nop,nop,TS val 709775 ecr 488530], length 1448
09:49:49.917877 IP 112.26.0.1.43359 > 112.26.0.8.60272: Flags [.], seq 732441:733889, ack 1, win 227, options [nop,nop,TS val 709775 ecr 488530], length 1448
09:49:49.924864 IP 112.26.0.8.60272 > 112.26.0.1.43359: Flags [.], ack 722305, win 8588, options [nop,nop,TS val 488635 ecr 708867], length 0
09:49:49.931645 IP 112.26.0.1.43359 > 112.26.0.8.60272: Flags [.], seq 733889:735337, ack 1, win 227, options [nop,nop,TS val 709775 ecr 488530], length 1448
09:49:49.935213 IP 112.26.0.1.43359 > 112.26.0.8.60272: Flags [.], seq 728097:729545, ack 1, win 227, options [nop,nop,TS val 709560 ecr 488230], length 1448
09:49:49.938521 IP 112.26.0.1.43359 > 112.26.0.8.60272: Flags [.], seq 728097:729545, ack 1, win 227, options [nop,nop,TS val 709560 ecr 488230], length 1448
09:49:50.026664 IP 112.26.0.1.43359 > 112.26.0.8.60272: Flags [.], seq 735337:736785, ack 1, win 227, options [nop,nop,TS val 709867 ecr 488635], length 1448
09:49:50.038471 IP 112.26.0.1.43359 > 112.26.0.8.60272: Flags [.], seq 729545:730993, ack 1, win 227, options [nop,nop,TS val 709560 ecr 488230], length 1448
09:49:50.041297 IP 112.26.0.1.43359 > 112.26.0.8.60272: Flags [.], seq 729545:730993, ack 1, win 227, options [nop,nop,TS val 709560 ecr 488230], length 1448
09:49:50.051160 IP 112.26.0.1.43359 > 112.26.0.8.60272: Flags [.], seq 736785:738233, ack 1, win 227, options [nop,nop,TS val 709867 ecr 488635], length 1448
09:49:50.124538 IP 112.26.0.8.60272 > 112.26.0.1.43359: Flags [.], ack 725201, win 8588, options [nop,nop,TS val 488752 ecr 708886], length 0
09:49:50.130003 IP 112.26.0.1.43359 > 112.26.0.8.60272: Flags [.], seq 738233:739681, ack 1, win 227, options [nop,nop,TS val 710067 ecr 488752], length 1448
09:49:50.137196 IP 112.26.0.8.60272 > 112.26.0.1.43359: Flags [.], ack 728097, win 8588, options [nop,nop,TS val 488848 ecr 709085], length 0
09:49:50.141530 IP 112.26.0.1.43359 > 112.26.0.8.60272: Flags [.], seq 739681:741129, ack 1, win 227, options [nop,nop,TS val 710067 ecr 488752], length 1448
09:49:50.238721 IP 112.26.0.1.43359 > 112.26.0.8.60272: Flags [.], seq 730993:732441, ack 1, win 227, options [nop,nop,TS val 709775 ecr 488530], length 1448
09:49:50.240603 IP 112.26.0.1.43359 > 112.26.0.8.60272: Flags [.], seq 730993:732441, ack 1, win 227, options [nop,nop,TS val 709775 ecr 488530], length 1448
09:49:50.246626 IP 112.26.0.1.43359 > 112.26.0.8.60272: Flags [.], seq 741129:742577, ack 1, win 227, options [nop,nop,TS val 710067 ecr 488752], length 1448
09:49:50.323682 IP 112.26.0.1.43359 > 112.26.0.8.60272: Flags [.], seq 742577:744025, ack 1, win 227, options [nop,nop,TS val 710080 ecr 488848], length 1448
09:49:50.327433 IP 112.26.0.1.43359 > 112.26.0.8.60272: Flags [.], seq 732441:733889, ack 1, win 227, options [nop,nop,TS val 709775 ecr 488530], length 1448
09:49:50.341263 IP 112.26.0.1.43359 > 112.26.0.8.60272: Flags [.], seq 732441:733889, ack 1, win 227, options [nop,nop,TS val 709775 ecr 488530], length 1448
09:49:50.349060 IP 112.26.0.1.43359 > 112.26.0.8.60272: Flags [P.], seq 744025:745473, ack 1, win 227, options [nop,nop,TS val 710080 ecr 488848], length 1448
09:49:50.355175 IP 112.26.0.1.43359 > 112.26.0.8.60272: Flags [.], seq 733889:735337, ack 1, win 227, options [nop,nop,TS val 709775 ecr 488530], length 1448
09:49:50.357079 IP 112.26.0.1.43359 > 112.26.0.8.60272: Flags [.], seq 733889:735337, ack 1, win 227, options [nop,nop,TS val 709775 ecr 488530], length 1448
09:49:50.432617 IP 112.26.0.1.43359 > 112.26.0.8.60272: Flags [.], seq 735337:736785, ack 1, win 227, options [nop,nop,TS val 709867 ecr 488635], length 1448
09:49:50.434534 IP 112.26.0.1.43359 > 112.26.0.8.60272: Flags [.], seq 735337:736785, ack 1, win 227, options [nop,nop,TS val 709867 ecr 488635], length 1448
09:49:50.520118 IP 112.26.0.8.60272 > 112.26.0.1.43359: Flags [.], ack 729545, win 8588, options [nop,nop,TS val 489136 ecr 709560], length 0
09:49:50.526333 IP 112.26.0.1.43359 > 112.26.0.8.60272: Flags [.], seq 745473:746921, ack 1, win 227, options [nop,nop,TS val 710463 ecr 489136], length 1448
09:49:50.534600 IP 112.26.0.1.43359 > 112.26.0.8.60272: Flags [.], seq 736785:738233, ack 1, win 227, options [nop,nop,TS val 709867 ecr 488635], length 1448
09:49:50.537803 IP 112.26.0.1.43359 > 112.26.0.8.60272: Flags [.], seq 736785:738233, ack 1, win 227, options [nop,nop,TS val 709867 ecr 488635], length 1448
09:49:50.544900 IP 112.26.0.1.43359 > 112.26.0.8.60272: Flags [.], seq 738233:739681, ack 1, win 227, options [nop,nop,TS val 710067 ecr 488752], length 1448
09:49:50.619416 IP 112.26.0.1.43359 > 112.26.0.8.60272: Flags [.], seq 738233:739681, ack 1, win 227, options [nop,nop,TS val 710067 ecr 488752], length 1448
09:49:50.638497 IP 112.26.0.1.43359 > 112.26.0.8.60272: Flags [.], seq 739681:741129, ack 1, win 227, options [nop,nop,TS val 710067 ecr 488752], length 1448
09:49:50.642447 IP 112.26.0.1.43359 > 112.26.0.8.60272: Flags [.], seq 739681:741129, ack 1, win 227, options [nop,nop,TS val 710067 ecr 488752], length 1448
09:49:50.650957 IP 112.26.0.8.60272 > 112.26.0.1.43359: Flags [.], ack 730993, win 8588, options [nop,nop,TS val 489288 ecr 709560], length 0
09:49:50.652312 IP 112.26.0.1.43359 > 112.26.0.8.60272: Flags [.], seq 746921:748369, ack 1, win 227, options [nop,nop,TS val 710594 ecr 489288], length 1448
09:49:50.726866 IP 112.26.0.1.43359 > 112.26.0.8.60272: Flags [.], seq 748369:749817, ack 1, win 227, options [nop,nop,TS val 710594 ecr 489288], length 1448
09:49:50.731281 IP 112.26.0.1.43359 > 112.26.0.8.60272: Flags [.], seq 741129:742577, ack 1, win 227, options [nop,nop,TS val 710067 ecr 488752], length 1448
09:49:50.735138 IP 112.26.0.1.43359 > 112.26.0.8.60272: Flags [.], seq 741129:742577, ack 1, win 227, options [nop,nop,TS val 710067 ecr 488752], length 1448
09:49:50.821517 IP 112.26.0.8.60272 > 112.26.0.1.43359: Flags [.], ack 733889, win 8588, options [nop,nop,TS val 489439 ecr 709775], length 0
09:49:50.823388 IP 112.26.0.1.43359 > 112.26.0.8.60272: Flags [.], seq 749817:751265, ack 1, win 227, options [nop,nop,TS val 710764 ecr 489439], length 1448
