10:52:44.098617 IP 112.26.1.8.37887 > 112.26.1.1.37753: Flags [S], seq 1087380066, win 65535, options [mss 1460,sackOK,TS val 4294873966 ecr 0,nop,wscale 6,mptcp join id 3 token 0xd15e4cde nonce 0x9c43d22d], length 0
10:52:44.159030 IP 112.26.1.8.37887 > 112.26.1.1.37753: Flags [S], seq 1087380066, win 65535, options [mss 1460,sackOK,TS val 4294873966 ecr 0,nop,wscale 6,mptcp join id 3 token 0xd15e4cde nonce 0x9c43d22d], length 0
10:52:44.252005 IP 112.26.1.8.37887 > 112.26.1.1.37753: Flags [S], seq 1087380066, win 65535, options [mss 1460,sackOK,TS val 4294873966 ecr 0,nop,wscale 6,mptcp join id 3 token 0xd15e4cde nonce 0x9c43d22d], length 0
10:52:44.540233 IP 112.26.1.8.37887 > 112.26.1.1.37753: Flags [.], ack 1073520418, win 7027, options [nop,nop,TS val 4294874344 ecr 120893,mptcp join hmac 0x5931aad495df313330019ba94d2f4c13f575bb46], length 0
10:52:44.616020 IP 112.26.1.8.37887 > 112.26.1.1.37753: Flags [.], ack 1, win 7027, options [nop,nop,TS val 4294874344 ecr 120893,mptcp join hmac 0x5931aad495df313330019ba94d2f4c13f575bb46], length 0
10:52:44.620076 IP 112.26.1.8.37887 > 112.26.1.1.37753: Flags [.], ack 1, win 7027, options [nop,nop,TS val 4294874344 ecr 120893,mptcp join hmac 0x5931aad495df313330019ba94d2f4c13f575bb46], length 0
10:52:44.827404 IP 112.26.1.8.37887 > 112.26.1.1.37753: Flags [.], ack 1429, win 7300, options [nop,nop,TS val 4294874719 ecr 121261,mptcp dss ack 3912793866], length 0
10:53:14.637262 IP 112.26.1.8.37887 > 112.26.1.1.37753: Flags [.], ack 299881, win 23958, options [nop,nop,TS val 4294904529 ecr 150510,mptcp dss ack 3913980534], length 0
10:53:14.715998 IP 112.26.1.8.37887 > 112.26.1.1.37753: Flags [.], ack 299881, win 23958, options [nop,nop,TS val 4294904529 ecr 150510,mptcp dss ack 3913980534], length 0
10:53:14.749240 IP 112.26.1.8.37887 > 112.26.1.1.37753: Flags [.], ack 297025, win 24129, options [nop,nop,TS val 4294904286 ecr 150404,mptcp dss ack 3913959114], length 0
10:53:14.777628 IP 112.26.1.8.37887 > 112.26.1.1.37753: Flags [.], ack 301309, win 24112, options [nop,nop,TS val 4294904662 ecr 150687,mptcp dss ack 3914007666], length 0
10:53:14.789496 IP 112.26.1.8.37887 > 112.26.1.1.37753: Flags [.], ack 301309, win 24112, options [nop,nop,TS val 4294904662 ecr 150687,mptcp dss ack 3914007666], length 0
10:53:14.902973 IP 112.26.1.8.37887 > 112.26.1.1.37753: Flags [.], ack 302737, win 24112, options [nop,nop,TS val 4294904794 ecr 150897,mptcp dss ack 3914007666], length 0
10:53:14.920166 IP 112.26.1.8.37887 > 112.26.1.1.37753: Flags [.], ack 298453, win 23958, options [nop,nop,TS val 4294904407 ecr 150404,mptcp dss ack 3913980534], length 0
10:53:14.950445 IP 112.26.1.8.37887 > 112.26.1.1.37753: Flags [.], ack 302737, win 24112, options [nop,nop,TS val 4294904794 ecr 150897,mptcp dss ack 3914007666], length 0
10:53:15.017974 IP 112.26.1.8.37887 > 112.26.1.1.37753: Flags [.], ack 304165, win 24112, options [nop,nop,TS val 4294904881 ecr 151093,mptcp dss ack 3914007666], length 0
10:53:15.019899 IP 112.26.1.8.37887 > 112.26.1.1.37753: Flags [.], ack 304165, win 24112, options [nop,nop,TS val 4294904881 ecr 151093,mptcp dss ack 3914007666], length 0
10:53:15.036932 IP 112.26.1.8.37887 > 112.26.1.1.37753: Flags [.], ack 299881, win 23958, options [nop,nop,TS val 4294904529 ecr 150510,mptcp dss ack 3913980534], length 0
10:53:15.120342 IP 112.26.1.8.37887 > 112.26.1.1.37753: Flags [.], ack 301309, win 24112, options [nop,nop,TS val 4294904662 ecr 150687,mptcp dss ack 3914007666], length 0
10:53:15.198305 IP 112.26.1.8.37887 > 112.26.1.1.37753: Flags [.], ack 305593, win 24112, options [nop,nop,TS val 4294905090 ecr 151228,mptcp dss ack 3914007666], length 0
10:53:15.200389 IP 112.26.1.8.37887 > 112.26.1.1.37753: Flags [.], ack 305593, win 24112, options [nop,nop,TS val 4294905090 ecr 151228,mptcp dss ack 3914007666], length 0
10:53:15.243929 IP 112.26.1.8.37887 > 112.26.1.1.37753: Flags [.], ack 302737, win 24112, options [nop,nop,TS val 4294904794 ecr 150897,mptcp dss ack 3914007666], length 0
10:53:15.389802 IP 112.26.1.8.37887 > 112.26.1.1.37753: Flags [.], ack 304165, win 24112, options [nop,nop,TS val 4294904881 ecr 151093,mptcp dss ack 3914007666], length 0
10:53:15.415158 IP 112.26.1.8.37887 > 112.26.1.1.37753: Flags [.], ack 307021, win 24241, options [nop,nop,TS val 4294905304 ecr 151390,mptcp dss ack 3914040510], length 0
10:53:15.419034 IP 112.26.1.8.37887 > 112.26.1.1.37753: Flags [.], ack 307021, win 24241, options [nop,nop,TS val 4294905304 ecr 151390,mptcp dss ack 3914040510], length 0
10:53:15.531399 IP 112.26.1.8.37887 > 112.26.1.1.37753: Flags [.], ack 305593, win 24112, options [nop,nop,TS val 4294905090 ecr 151228,mptcp dss ack 3914007666], length 0
10:53:15.673224 IP 112.26.1.8.37887 > 112.26.1.1.37753: Flags [.], ack 311305, win 24241, options [nop,nop,TS val 4294905565 ecr 151561,mptcp dss ack 3914040510], length 0
10:53:15.675912 IP 112.26.1.8.37887 > 112.26.1.1.37753: Flags [.], ack 311305, win 24241, options [nop,nop,TS val 4294905565 ecr 151561,mptcp dss ack 3914040510], length 0
10:53:15.717461 IP 112.26.1.8.37887 > 112.26.1.1.37753: Flags [.], ack 307021, win 24241, options [nop,nop,TS val 4294905304 ecr 151390,mptcp dss ack 3914040510], length 0
10:53:15.865443 IP 112.26.1.8.37887 > 112.26.1.1.37753: Flags [.], ack 311305, win 24241, options [nop,nop,TS val 4294905565 ecr 151561,mptcp dss ack 3914040510], length 0
10:53:16.067254 IP 112.26.1.8.37887 > 112.26.1.1.37753: Flags [.], ack 314161, win 23973, options [nop,nop,TS val 4294905890 ecr 151761,mptcp dss ack 3914063358], length 0
10:53:16.069740 IP 112.26.1.8.37887 > 112.26.1.1.37753: Flags [.], ack 314161, win 23973, options [nop,nop,TS val 4294905890 ecr 151761,mptcp dss ack 3914063358], length 0
10:53:16.096720 IP 112.26.1.8.37887 > 112.26.1.1.37753: Flags [.], ack 314161, win 23973, options [nop,nop,TS val 4294905890 ecr 151761,mptcp dss ack 3914063358], length 0
10:53:16.171943 IP 112.26.1.8.37887 > 112.26.1.1.37753: Flags [.], ack 317017, win 24224, options [nop,nop,TS val 4294906062 ecr 152030,mptcp dss ack 3914063358], length 0
10:53:16.182009 IP 112.26.1.8.37887 > 112.26.1.1.37753: Flags [.], ack 317017, win 24224, options [nop,nop,TS val 4294906062 ecr 152030,mptcp dss ack 3914063358], length 0
10:53:16.194332 IP 112.26.1.8.37887 > 112.26.1.1.37753: Flags [.], ack 317017, win 24224, options [nop,nop,TS val 4294906062 ecr 152030,mptcp dss ack 3914063358], length 0
10:53:16.563924 IP 112.26.1.8.37887 > 112.26.1.1.37753: Flags [.], ack 321301, win 24224, options [nop,nop,TS val 4294906456 ecr 152358,mptcp dss ack 3914063358], length 0
10:53:16.576029 IP 112.26.1.8.37887 > 112.26.1.1.37753: Flags [.], ack 321301, win 24224, options [nop,nop,TS val 4294906456 ecr 152358,mptcp dss ack 3914063358], length 0
10:53:16.582978 IP 112.26.1.8.37887 > 112.26.1.1.37753: Flags [.], ack 321301, win 24224, options [nop,nop,TS val 4294906456 ecr 152358,mptcp dss ack 3914063358], length 0
10:53:16.953043 IP 112.26.1.8.37887 > 112.26.1.1.37753: Flags [.], ack 324157, win 24033, options [nop,nop,TS val 4294906844 ecr 152506,mptcp dss ack 3914091918], length 0
10:53:16.967677 IP 112.26.1.8.37887 > 112.26.1.1.37753: Flags [.], ack 324157, win 24033, options [nop,nop,TS val 4294906844 ecr 152506,mptcp dss ack 3914091918], length 0
10:53:16.975588 IP 112.26.1.8.37887 > 112.26.1.1.37753: Flags [.], ack 324157, win 24033, options [nop,nop,TS val 4294906844 ecr 152506,mptcp dss ack 3914091918], length 0
10:53:17.115534 IP 112.26.1.8.37887 > 112.26.1.1.37753: Flags [.], ack 327013, win 24216, options [nop,nop,TS val 4294907007 ecr 152737,mptcp dss ack 3914106198], length 0
10:53:17.118058 IP 112.26.1.8.37887 > 112.26.1.1.37753: Flags [.], ack 327013, win 24216, options [nop,nop,TS val 4294907007 ecr 152737,mptcp dss ack 3914106198], length 0
10:53:17.124412 IP 112.26.1.8.37887 > 112.26.1.1.37753: Flags [.], ack 327013, win 24216, options [nop,nop,TS val 4294907007 ecr 152737,mptcp dss ack 3914106198], length 0
10:53:17.523141 IP 112.26.1.8.37887 > 112.26.1.1.37753: Flags [.], ack 331297, win 24216, options [nop,nop,TS val 4294907416 ecr 152825,mptcp dss ack 3914106198], length 0
10:53:17.530013 IP 112.26.1.8.37887 > 112.26.1.1.37753: Flags [.], ack 331297, win 24216, options [nop,nop,TS val 4294907416 ecr 152825,mptcp dss ack 3914106198], length 0
10:53:17.533140 IP 112.26.1.8.37887 > 112.26.1.1.37753: Flags [.], ack 331297, win 24216, options [nop,nop,TS val 4294907416 ecr 152825,mptcp dss ack 3914106198], length 0
10:53:17.918860 IP 112.26.1.8.37887 > 112.26.1.1.37753: Flags [.], ack 338437, win 24216, options [nop,nop,TS val 4294907810 ecr 153223,mptcp dss ack 3914106198], length 0
10:53:17.926888 IP 112.26.1.8.37887 > 112.26.1.1.37753: Flags [.], ack 338437, win 24216, options [nop,nop,TS val 4294907810 ecr 153223,mptcp dss ack 3914106198], length 0
10:53:17.930070 IP 112.26.1.8.37887 > 112.26.1.1.37753: Flags [.], ack 338437, win 24216, options [nop,nop,TS val 4294907810 ecr 153223,mptcp dss ack 3914106198], length 0
10:53:18.323791 IP 112.26.1.8.37887 > 112.26.1.1.37753: Flags [.], ack 341293, win 24295, options [nop,nop,TS val 4294908216 ecr 153764,mptcp dss ack 3914167602], length 0
10:53:18.325566 IP 112.26.1.8.37887 > 112.26.1.1.37753: Flags [.], ack 341293, win 24295, options [nop,nop,TS val 4294908216 ecr 153764,mptcp dss ack 3914167602], length 0
10:53:18.332253 IP 112.26.1.8.37887 > 112.26.1.1.37753: Flags [.], ack 341293, win 24295, options [nop,nop,TS val 4294908216 ecr 153764,mptcp dss ack 3914167602], length 0
10:53:18.514059 IP 112.26.1.8.37887 > 112.26.1.1.37753: Flags [.], ack 344149, win 24003, options [nop,nop,TS val 4294908403 ecr 154173,mptcp dss ack 3914211870], length 0
10:53:18.517194 IP 112.26.1.8.37887 > 112.26.1.1.37753: Flags [.], ack 344149, win 24003, options [nop,nop,TS val 4294908403 ecr 154173,mptcp dss ack 3914211870], length 0
10:53:18.524542 IP 112.26.1.8.37887 > 112.26.1.1.37753: Flags [.], ack 344149, win 24003, options [nop,nop,TS val 4294908403 ecr 154173,mptcp dss ack 3914211870], length 0
10:53:18.741455 IP 112.26.1.8.37887 > 112.26.1.1.37753: Flags [.], ack 345577, win 24467, options [nop,nop,TS val 4294908631 ecr 154173,nop,nop,sack 1 {347005:348433},mptcp dss ack 3914213298], length 0
10:53:18.748165 IP 112.26.1.8.37887 > 112.26.1.1.37753: Flags [.], ack 345577, win 24467, options [nop,nop,TS val 4294908631 ecr 154173,nop,nop,sack 1 {347005:348433},mptcp dss ack 3914213298], length 0
10:53:18.755275 IP 112.26.1.8.37887 > 112.26.1.1.37753: Flags [.], ack 345577, win 24467, options [nop,nop,TS val 4294908631 ecr 154173,nop,nop,sack 1 {347005:348433},mptcp dss ack 3914213298], length 0
10:53:18.900128 IP 112.26.1.8.37887 > 112.26.1.1.37753: Flags [.], ack 345577, win 24467, options [nop,nop,TS val 4294908768 ecr 154173,nop,nop,sack 1 {347005:349861},mptcp dss ack 3914213298], length 0
10:53:18.909602 IP 112.26.1.8.37887 > 112.26.1.1.37753: Flags [.], ack 345577, win 24467, options [nop,nop,TS val 4294908768 ecr 154173,nop,nop,sack 1 {347005:349861},mptcp dss ack 3914213298], length 0
10:53:18.925724 IP 112.26.1.8.37887 > 112.26.1.1.37753: Flags [.], ack 345577, win 24467, options [nop,nop,TS val 4294908768 ecr 154173,nop,nop,sack 1 {347005:349861},mptcp dss ack 3914213298], length 0
10:53:19.042888 IP 112.26.1.8.37887 > 112.26.1.1.37753: Flags [.], ack 345577, win 24467, options [nop,nop,TS val 4294908934 ecr 154173,nop,nop,sack 1 {347005:351289},mptcp dss ack 3914213298], length 0
10:53:19.048602 IP 112.26.1.8.37887 > 112.26.1.1.37753: Flags [.], ack 345577, win 24467, options [nop,nop,TS val 4294908934 ecr 154173,nop,nop,sack 1 {347005:351289},mptcp dss ack 3914213298], length 0
10:53:19.121998 IP 112.26.1.8.37887 > 112.26.1.1.37753: Flags [.], ack 345577, win 24467, options [nop,nop,TS val 4294908934 ecr 154173,nop,nop,sack 1 {347005:351289},mptcp dss ack 3914213298], length 0
10:53:19.169446 IP 112.26.1.8.37887 > 112.26.1.1.37753: Flags [.], ack 345577, win 24467, options [nop,nop,TS val 4294909061 ecr 154173,nop,nop,sack 1 {347005:352717},mptcp dss ack 3914213298], length 0
10:53:19.259334 IP 112.26.1.8.37887 > 112.26.1.1.37753: Flags [.], ack 345577, win 24467, options [nop,nop,TS val 4294909061 ecr 154173,nop,nop,sack 1 {347005:352717},mptcp dss ack 3914213298], length 0
10:53:19.305009 IP 112.26.1.8.37887 > 112.26.1.1.37753: Flags [.], ack 345577, win 24467, options [nop,nop,TS val 4294909061 ecr 154173,nop,nop,sack 1 {347005:352717},mptcp dss ack 3914213298], length 0
10:53:19.379709 IP 112.26.1.8.37887 > 112.26.1.1.37753: Flags [.], ack 345577, win 24467, options [nop,nop,TS val 4294909267 ecr 154173,nop,nop,sack 2 {355573:357001}{347005:352717},mptcp dss ack 3914213298], length 0
10:53:19.380968 IP 112.26.1.8.37887 > 112.26.1.1.37753: Flags [.], ack 345577, win 24467, options [nop,nop,TS val 4294909267 ecr 154173,nop,nop,sack 2 {355573:357001}{347005:352717},mptcp dss ack 3914213298], length 0
10:53:19.448484 IP 112.26.1.8.37887 > 112.26.1.1.37753: Flags [.], ack 345577, win 24467, options [nop,nop,TS val 4294909267 ecr 154173,nop,nop,sack 2 {355573:357001}{347005:352717},mptcp dss ack 3914213298], length 0
10:53:19.517060 IP 112.26.1.8.37887 > 112.26.1.1.37753: Flags [.], ack 345577, win 24467, options [nop,nop,TS val 4294909406 ecr 154173,nop,nop,sack 2 {355573:358429}{347005:352717},mptcp dss ack 3914213298], length 0
10:53:19.539211 IP 112.26.1.8.37887 > 112.26.1.1.37753: Flags [.], ack 345577, win 24467, options [nop,nop,TS val 4294909406 ecr 154173,nop,nop,sack 2 {355573:358429}{347005:352717},mptcp dss ack 3914213298], length 0
10:53:19.579190 IP 112.26.1.8.37887 > 112.26.1.1.37753: Flags [.], ack 345577, win 24467, options [nop,nop,TS val 4294909406 ecr 154173,nop,nop,sack 2 {355573:358429}{347005:352717},mptcp dss ack 3914213298], length 0
10:53:19.632883 IP 112.26.1.8.37887 > 112.26.1.1.37753: Flags [.], ack 345577, win 24467, options [nop,nop,TS val 4294909522 ecr 154173,nop,nop,sack 2 {355573:359857}{347005:352717},mptcp dss ack 3914213298], length 0
10:53:19.672666 IP 112.26.1.8.37887 > 112.26.1.1.37753: Flags [.], ack 345577, win 24467, options [nop,nop,TS val 4294909522 ecr 154173,nop,nop,sack 2 {355573:359857}{347005:352717},mptcp dss ack 3914213298], length 0
10:53:19.726191 IP 112.26.1.8.37887 > 112.26.1.1.37753: Flags [.], ack 345577, win 24467, options [nop,nop,TS val 4294909522 ecr 154173,nop,nop,sack 2 {355573:359857}{347005:352717},mptcp dss ack 3914213298], length 0
10:53:19.776435 IP 112.26.1.8.37887 > 112.26.1.1.37753: Flags [.], ack 345577, win 24467, options [nop,nop,TS val 4294909668 ecr 154173,nop,nop,sack 2 {355573:361285}{347005:352717},mptcp dss ack 3914213298], length 0
10:53:19.782769 IP 112.26.1.8.37887 > 112.26.1.1.37753: Flags [.], ack 345577, win 24467, options [nop,nop,TS val 4294909668 ecr 154173,nop,nop,sack 2 {355573:361285}{347005:352717},mptcp dss ack 3914213298], length 0
10:53:19.881143 IP 112.26.1.8.37887 > 112.26.1.1.37753: Flags [.], ack 345577, win 24467, options [nop,nop,TS val 4294909773 ecr 154173,nop,nop,sack 2 {355573:362713}{347005:352717},mptcp dss ack 3914213298], length 0
10:53:19.895388 IP 112.26.1.8.37887 > 112.26.1.1.37753: Flags [.], ack 345577, win 24467, options [nop,nop,TS val 4294909668 ecr 154173,nop,nop,sack 2 {355573:361285}{347005:352717},mptcp dss ack 3914213298], length 0
10:53:19.929670 IP 112.26.1.8.37887 > 112.26.1.1.37753: Flags [.], ack 345577, win 24467, options [nop,nop,TS val 4294909773 ecr 154173,nop,nop,sack 2 {355573:362713}{347005:352717},mptcp dss ack 3914213298], length 0
10:53:19.951425 IP 112.26.1.8.37887 > 112.26.1.1.37753: Flags [.], ack 345577, win 24467, options [nop,nop,TS val 4294909773 ecr 154173,nop,nop,sack 2 {355573:362713}{347005:352717},mptcp dss ack 3914213298], length 0
10:53:19.997067 IP 112.26.1.8.37887 > 112.26.1.1.37753: Flags [.], ack 345577, win 24467, options [nop,nop,TS val 4294909889 ecr 154173,nop,nop,sack 2 {355573:364141}{347005:352717},mptcp dss ack 3914213298], length 0
10:53:20.096380 IP 112.26.1.8.37887 > 112.26.1.1.37753: Flags [.], ack 345577, win 24467, options [nop,nop,TS val 4294909889 ecr 154173,nop,nop,sack 2 {355573:364141}{347005:352717},mptcp dss ack 3914213298], length 0
10:53:20.101679 IP 112.26.1.8.37887 > 112.26.1.1.37753: Flags [.], ack 345577, win 24467, options [nop,nop,TS val 4294909889 ecr 154173,nop,nop,sack 2 {355573:364141}{347005:352717},mptcp dss ack 3914213298], length 0
10:53:20.169153 IP 112.26.1.8.37887 > 112.26.1.1.37753: Flags [.], ack 345577, win 24467, options [nop,nop,TS val 4294910060 ecr 154173,nop,nop,sack 2 {365569:366997}{355573:364141},mptcp dss ack 3914213298], length 0
10:53:20.290727 IP 112.26.1.8.37887 > 112.26.1.1.37753: Flags [.], ack 345577, win 24467, options [nop,nop,TS val 4294910060 ecr 154173,nop,nop,sack 2 {365569:366997}{355573:364141},mptcp dss ack 3914213298], length 0
10:53:20.330931 IP 112.26.1.8.37887 > 112.26.1.1.37753: Flags [.], ack 345577, win 24467, options [nop,nop,TS val 4294910223 ecr 154173,nop,nop,sack 2 {365569:368425}{355573:364141},mptcp dss ack 3914213298], length 0
10:53:20.357993 IP 112.26.1.8.37887 > 112.26.1.1.37753: Flags [.], ack 345577, win 24467, options [nop,nop,TS val 4294910223 ecr 154173,nop,nop,sack 2 {365569:368425}{355573:364141},mptcp dss ack 3914213298], length 0
10:53:20.386971 IP 112.26.1.8.37887 > 112.26.1.1.37753: Flags [.], ack 345577, win 24467, options [nop,nop,TS val 4294910060 ecr 154173,nop,nop,sack 2 {365569:366997}{355573:364141},mptcp dss ack 3914213298], length 0
10:53:20.463606 IP 112.26.1.8.37887 > 112.26.1.1.37753: Flags [.], ack 352717, win 24267, options [nop,nop,TS val 4294910352 ecr 155762,nop,nop,sack 2 {365569:368425}{355573:364141},mptcp dss ack 3914226150], length 0
10:53:20.516661 IP 112.26.1.8.37887 > 112.26.1.1.37753: Flags [.], ack 352717, win 24267, options [nop,nop,TS val 4294910352 ecr 155762,nop,nop,sack 2 {365569:368425}{355573:364141},mptcp dss ack 3914226150], length 0
10:53:20.547792 IP 112.26.1.8.37887 > 112.26.1.1.37753: Flags [.], ack 345577, win 24467, options [nop,nop,TS val 4294910223 ecr 154173,nop,nop,sack 2 {365569:368425}{355573:364141},mptcp dss ack 3914213298], length 0
10:53:20.581217 IP 112.26.1.8.37887 > 112.26.1.1.37753: Flags [.], ack 352717, win 24267, options [nop,nop,TS val 4294910469 ecr 155762,nop,nop,sack 2 {365569:369853}{355573:364141},mptcp dss ack 3914226150], length 0
10:53:20.657536 IP 112.26.1.8.37887 > 112.26.1.1.37753: Flags [.], ack 352717, win 24267, options [nop,nop,TS val 4294910352 ecr 155762,nop,nop,sack 2 {365569:368425}{355573:364141},mptcp dss ack 3914226150], length 0
10:53:20.694923 IP 112.26.1.8.37887 > 112.26.1.1.37753: Flags [.], ack 352717, win 24267, options [nop,nop,TS val 4294910469 ecr 155762,nop,nop,sack 2 {365569:369853}{355573:364141},mptcp dss ack 3914226150], length 0
10:53:20.715794 IP 112.26.1.8.37887 > 112.26.1.1.37753: Flags [.], ack 352717, win 24267, options [nop,nop,TS val 4294910469 ecr 155762,nop,nop,sack 2 {365569:369853}{355573:364141},mptcp dss ack 3914226150], length 0
10:53:20.762569 IP 112.26.1.8.37887 > 112.26.1.1.37753: Flags [.], ack 352717, win 24267, options [nop,nop,TS val 4294910653 ecr 155762,nop,nop,sack 2 {354145:364141}{365569:369853},mptcp dss ack 3914226150], length 0
10:53:20.773497 IP 112.26.1.8.37887 > 112.26.1.1.37753: Flags [.], ack 352717, win 24267, options [nop,nop,TS val 4294910653 ecr 155762,nop,nop,sack 2 {354145:364141}{365569:369853},mptcp dss ack 3914226150], length 0
10:53:20.859806 IP 112.26.1.8.37887 > 112.26.1.1.37753: Flags [.], ack 352717, win 24267, options [nop,nop,TS val 4294910653 ecr 155762,nop,nop,sack 2 {354145:364141}{365569:369853},mptcp dss ack 3914226150], length 0
10:53:20.911992 IP 112.26.1.8.37887 > 112.26.1.1.37753: Flags [.], ack 352717, win 24267, options [nop,nop,TS val 4294910799 ecr 155762,nop,nop,sack 2 {365569:371281}{354145:364141},mptcp dss ack 3914226150], length 0
10:53:20.935897 IP 112.26.1.8.37887 > 112.26.1.1.37753: Flags [.], ack 352717, win 24267, options [nop,nop,TS val 4294910799 ecr 155762,nop,nop,sack 2 {365569:371281}{354145:364141},mptcp dss ack 3914226150], length 0
10:53:21.037638 IP 112.26.1.8.37887 > 112.26.1.1.37753: Flags [.], ack 352717, win 24267, options [nop,nop,TS val 4294910922 ecr 155762,nop,nop,sack 1 {354145:371281},mptcp dss ack 3914226150], length 0
10:53:21.038667 IP 112.26.1.8.37887 > 112.26.1.1.37753: Flags [.], ack 352717, win 24267, options [nop,nop,TS val 4294910922 ecr 155762,nop,nop,sack 1 {354145:371281},mptcp dss ack 3914226150], length 0
10:53:21.072627 IP 112.26.1.8.37887 > 112.26.1.1.37753: Flags [.], ack 352717, win 24267, options [nop,nop,TS val 4294910799 ecr 155762,nop,nop,sack 2 {365569:371281}{354145:364141},mptcp dss ack 3914226150], length 0
10:53:21.131245 IP 112.26.1.8.37887 > 112.26.1.1.37753: Flags [.], ack 352717, win 24267, options [nop,nop,TS val 4294910922 ecr 155762,nop,nop,sack 1 {354145:371281},mptcp dss ack 3914226150], length 0
10:53:21.181186 IP 112.26.1.8.37887 > 112.26.1.1.37753: Flags [.], ack 352717, win 24267, options [nop,nop,TS val 4294911071 ecr 155762,nop,nop,sack 2 {372709:374137}{354145:371281},mptcp dss ack 3914226150], length 0
10:53:21.189600 IP 112.26.1.8.37887 > 112.26.1.1.37753: Flags [.], ack 352717, win 24267, options [nop,nop,TS val 4294911071 ecr 155762,nop,nop,sack 2 {372709:374137}{354145:371281},mptcp dss ack 3914226150], length 0
10:53:21.192887 IP 112.26.1.8.37887 > 112.26.1.1.37753: Flags [.], ack 352717, win 24267, options [nop,nop,TS val 4294911071 ecr 155762,nop,nop,sack 2 {372709:374137}{354145:371281},mptcp dss ack 3914226150], length 0
10:53:21.306903 IP 112.26.1.8.37887 > 112.26.1.1.37753: Flags [.], ack 352717, win 24267, options [nop,nop,TS val 4294911197 ecr 155762,nop,nop,sack 2 {372709:375565}{354145:371281},mptcp dss ack 3914226150], length 0
10:53:21.312935 IP 112.26.1.8.37887 > 112.26.1.1.37753: Flags [.], ack 352717, win 24267, options [nop,nop,TS val 4294911197 ecr 155762,nop,nop,sack 2 {372709:375565}{354145:371281},mptcp dss ack 3914226150], length 0
10:53:21.329928 IP 112.26.1.8.37887 > 112.26.1.1.37753: Flags [.], ack 352717, win 24267, options [nop,nop,TS val 4294911197 ecr 155762,nop,nop,sack 2 {372709:375565}{354145:371281},mptcp dss ack 3914226150], length 0
10:53:21.471322 IP 112.26.1.8.37887 > 112.26.1.1.37753: Flags [.], ack 352717, win 24267, options [nop,nop,TS val 4294911362 ecr 155762,nop,nop,sack 2 {372709:376993}{354145:371281},mptcp dss ack 3914226150], length 0
10:53:21.473111 IP 112.26.1.8.37887 > 112.26.1.1.37753: Flags [.], ack 352717, win 24267, options [nop,nop,TS val 4294911362 ecr 155762,nop,nop,sack 2 {372709:376993}{354145:371281},mptcp dss ack 3914226150], length 0
10:53:21.478569 IP 112.26.1.8.37887 > 112.26.1.1.37753: Flags [.], ack 352717, win 24267, options [nop,nop,TS val 4294911362 ecr 155762,nop,nop,sack 2 {372709:376993}{354145:371281},mptcp dss ack 3914226150], length 0
10:53:21.625210 IP 112.26.1.8.37887 > 112.26.1.1.37753: Flags [.], ack 371281, win 23379, options [nop,nop,TS val 4294911517 ecr 157500,nop,nop,sack 1 {372709:376993},mptcp dss ack 3914290410], length 0
10:53:21.627831 IP 112.26.1.8.37887 > 112.26.1.1.37753: Flags [.], ack 371281, win 23379, options [nop,nop,TS val 4294911517 ecr 157500,nop,nop,sack 1 {372709:376993},mptcp dss ack 3914290410], length 0
10:53:21.648431 IP 112.26.1.8.37887 > 112.26.1.1.37753: Flags [.], ack 371281, win 23379, options [nop,nop,TS val 4294911517 ecr 157500,nop,nop,sack 1 {372709:376993},mptcp dss ack 3914290410], length 0
10:53:21.717663 IP 112.26.1.8.37887 > 112.26.1.1.37753: Flags [.], ack 371281, win 24257, options [nop,nop,TS val 4294911609 ecr 157500,nop,nop,sack 1 {372709:378421},mptcp dss ack 3914317542], length 0
10:53:21.801662 IP 112.26.1.8.37887 > 112.26.1.1.37753: Flags [.], ack 371281, win 24257, options [nop,nop,TS val 4294911609 ecr 157500,nop,nop,sack 1 {372709:378421},mptcp dss ack 3914317542], length 0
10:53:21.810695 IP 112.26.1.8.37887 > 112.26.1.1.37753: Flags [.], ack 371281, win 24257, options [nop,nop,TS val 4294911609 ecr 157500,nop,nop,sack 1 {372709:378421},mptcp dss ack 3914317542], length 0
10:53:21.847807 IP 112.26.1.8.37887 > 112.26.1.1.37753: Flags [.], ack 378421, win 24148, options [nop,nop,TS val 4294911720 ecr 157772,mptcp dss ack 3914351814], length 0
10:53:21.917323 IP 112.26.1.8.37887 > 112.26.1.1.37753: Flags [.], ack 378421, win 24148, options [nop,nop,TS val 4294911720 ecr 157772,mptcp dss ack 3914351814], length 0
10:53:21.946951 IP 112.26.1.8.37887 > 112.26.1.1.37753: Flags [.], ack 379849, win 24525, options [nop,nop,TS val 4294911797 ecr 157879,mptcp dss ack 3914357526], length 0
10:53:21.980437 IP 112.26.1.8.37887 > 112.26.1.1.37753: Flags [.], ack 378421, win 24148, options [nop,nop,TS val 4294911720 ecr 157772,mptcp dss ack 3914351814], length 0
10:53:22.030203 IP 112.26.1.8.37887 > 112.26.1.1.37753: Flags [.], ack 381277, win 24522, options [nop,nop,TS val 4294911922 ecr 157983,mptcp dss ack 3914363238], length 0
10:53:22.060122 IP 112.26.1.8.37887 > 112.26.1.1.37753: Flags [.], ack 379849, win 24525, options [nop,nop,TS val 4294911797 ecr 157879,mptcp dss ack 3914357526], length 0
10:53:22.075131 IP 112.26.1.8.37887 > 112.26.1.1.37753: Flags [.], ack 379849, win 24525, options [nop,nop,TS val 4294911797 ecr 157879,mptcp dss ack 3914357526], length 0
10:53:22.140249 IP 112.26.1.8.37887 > 112.26.1.1.37753: Flags [.], ack 382705, win 24522, options [nop,nop,TS val 4294912031 ecr 158153,mptcp dss ack 3914363238], length 0
10:53:22.162357 IP 112.26.1.8.37887 > 112.26.1.1.37753: Flags [.], ack 381277, win 24522, options [nop,nop,TS val 4294911922 ecr 157983,mptcp dss ack 3914363238], length 0
10:53:22.229250 IP 112.26.1.8.37887 > 112.26.1.1.37753: Flags [.], ack 384133, win 24476, options [nop,nop,TS val 4294912107 ecr 158289,mptcp dss ack 3914368950], length 0
10:53:22.235524 IP 112.26.1.8.37887 > 112.26.1.1.37753: Flags [.], ack 381277, win 24522, options [nop,nop,TS val 4294911922 ecr 157983,mptcp dss ack 3914363238], length 0
10:53:22.251038 IP 112.26.1.8.37887 > 112.26.1.1.37753: Flags [.], ack 382705, win 24522, options [nop,nop,TS val 4294912031 ecr 158153,mptcp dss ack 3914363238], length 0
10:53:22.320634 IP 112.26.1.8.37887 > 112.26.1.1.37753: Flags [.], ack 385561, win 24473, options [nop,nop,TS val 4294912205 ecr 158485,mptcp dss ack 3914373234], length 0
10:53:22.360418 IP 112.26.1.8.37887 > 112.26.1.1.37753: Flags [.], ack 384133, win 24476, options [nop,nop,TS val 4294912107 ecr 158289,mptcp dss ack 3914368950], length 0
10:53:22.379562 IP 112.26.1.8.37887 > 112.26.1.1.37753: Flags [.], ack 382705, win 24522, options [nop,nop,TS val 4294912031 ecr 158153,mptcp dss ack 3914363238], length 0
10:53:22.428746 IP 112.26.1.8.37887 > 112.26.1.1.37753: Flags [.], ack 386989, win 24458, options [nop,nop,TS val 4294912320 ecr 158621,mptcp dss ack 3914378946], length 0
10:53:22.480126 IP 112.26.1.8.37887 > 112.26.1.1.37753: Flags [.], ack 385561, win 24473, options [nop,nop,TS val 4294912205 ecr 158485,mptcp dss ack 3914373234], length 0
10:53:22.514819 IP 112.26.1.8.37887 > 112.26.1.1.37753: Flags [.], ack 384133, win 24476, options [nop,nop,TS val 4294912107 ecr 158289,mptcp dss ack 3914368950], length 0
10:53:22.553641 IP 112.26.1.8.37887 > 112.26.1.1.37753: Flags [.], ack 386989, win 24458, options [nop,nop,TS val 4294912320 ecr 158621,mptcp dss ack 3914378946], length 0
10:53:22.598006 IP 112.26.1.8.37887 > 112.26.1.1.37753: Flags [.], ack 388417, win 24507, options [nop,nop,TS val 4294912490 ecr 158716,mptcp dss ack 3914388942], length 0
10:53:22.682526 IP 112.26.1.8.37887 > 112.26.1.1.37753: Flags [.], ack 388417, win 24507, options [nop,nop,TS val 4294912490 ecr 158716,mptcp dss ack 3914388942], length 0
10:53:22.697671 IP 112.26.1.8.37887 > 112.26.1.1.37753: Flags [.], ack 385561, win 24473, options [nop,nop,TS val 4294912205 ecr 158485,mptcp dss ack 3914373234], length 0
10:53:22.720912 IP 112.26.1.8.37887 > 112.26.1.1.37753: Flags [.], ack 389845, win 24507, options [nop,nop,TS val 4294912612 ecr 158876,mptcp dss ack 3914393226], length 0
10:53:22.801099 IP 112.26.1.8.37887 > 112.26.1.1.37753: Flags [.], ack 389845, win 24507, options [nop,nop,TS val 4294912612 ecr 158876,mptcp dss ack 3914393226], length 0
10:53:22.832586 IP 112.26.1.8.37887 > 112.26.1.1.37753: Flags [.], ack 391273, win 24507, options [nop,nop,TS val 4294912676 ecr 159020,mptcp dss ack 3914393226], length 0
10:53:22.855976 IP 112.26.1.8.37887 > 112.26.1.1.37753: Flags [.], ack 386989, win 24458, options [nop,nop,TS val 4294912320 ecr 158621,mptcp dss ack 3914378946], length 0
10:53:22.913049 IP 112.26.1.8.37887 > 112.26.1.1.37753: Flags [.], ack 392701, win 24504, options [nop,nop,TS val 4294912804 ecr 159155,mptcp dss ack 3914398938], length 0
10:53:22.979072 IP 112.26.1.8.37887 > 112.26.1.1.37753: Flags [.], ack 391273, win 24507, options [nop,nop,TS val 4294912676 ecr 159020,mptcp dss ack 3914393226], length 0
10:53:22.989764 IP 112.26.1.8.37887 > 112.26.1.1.37753: Flags [.], ack 388417, win 24507, options [nop,nop,TS val 4294912490 ecr 158716,mptcp dss ack 3914388942], length 0
10:53:23.029789 IP 112.26.1.8.37887 > 112.26.1.1.37753: Flags [.], ack 394129, win 24504, options [nop,nop,TS val 4294912921 ecr 159338,mptcp dss ack 3914398938], length 0
10:53:23.135622 IP 112.26.1.8.37887 > 112.26.1.1.37753: Flags [.], ack 392701, win 24504, options [nop,nop,TS val 4294912804 ecr 159155,mptcp dss ack 3914398938], length 0
10:53:23.139370 IP 112.26.1.8.37887 > 112.26.1.1.37753: Flags [.], ack 389845, win 24507, options [nop,nop,TS val 4294912612 ecr 158876,mptcp dss ack 3914393226], length 0
10:53:23.178329 IP 112.26.1.8.37887 > 112.26.1.1.37753: Flags [.], ack 395557, win 24504, options [nop,nop,TS val 4294913070 ecr 159496,mptcp dss ack 3914398938], length 0
10:53:23.187072 IP 112.26.1.8.37887 > 112.26.1.1.37753: Flags [.], ack 394129, win 24504, options [nop,nop,TS val 4294912921 ecr 159338,mptcp dss ack 3914398938], length 0
10:53:23.272334 IP 112.26.1.8.37887 > 112.26.1.1.37753: Flags [.], ack 391273, win 24507, options [nop,nop,TS val 4294912676 ecr 159020,mptcp dss ack 3914393226], length 0
10:53:23.301455 IP 112.26.1.8.37887 > 112.26.1.1.37753: Flags [.], ack 395557, win 24504, options [nop,nop,TS val 4294913070 ecr 159496,mptcp dss ack 3914398938], length 0
10:53:23.307001 IP 112.26.1.8.37887 > 112.26.1.1.37753: Flags [.], ack 396985, win 24504, options [nop,nop,TS val 4294913199 ecr 159630,mptcp dss ack 3914398938], length 0
10:53:23.390862 IP 112.26.1.8.37887 > 112.26.1.1.37753: Flags [.], ack 396985, win 24504, options [nop,nop,TS val 4294913199 ecr 159630,mptcp dss ack 3914398938], length 0
10:53:23.445035 IP 112.26.1.8.37887 > 112.26.1.1.37753: Flags [.], ack 392701, win 24504, options [nop,nop,TS val 4294912804 ecr 159155,mptcp dss ack 3914398938], length 0
10:53:23.464676 IP 112.26.1.8.37887 > 112.26.1.1.37753: Flags [.], ack 398413, win 24373, options [nop,nop,TS val 4294913356 ecr 159770,mptcp dss ack 3914417502], length 0
10:53:23.470148 IP 112.26.1.8.37887 > 112.26.1.1.37753: Flags [.], ack 398413, win 24373, options [nop,nop,TS val 4294913356 ecr 159770,mptcp dss ack 3914417502], length 0
10:53:23.590364 IP 112.26.1.8.37887 > 112.26.1.1.37753: Flags [.], ack 394129, win 24504, options [nop,nop,TS val 4294912921 ecr 159338,mptcp dss ack 3914398938], length 0
10:53:23.624825 IP 112.26.1.8.37887 > 112.26.1.1.37753: Flags [.], ack 399841, win 24442, options [nop,nop,TS val 4294913517 ecr 159770,mptcp dss ack 3914430354], length 0
10:53:23.625639 IP 112.26.1.8.37887 > 112.26.1.1.37753: Flags [.], ack 399841, win 24442, options [nop,nop,TS val 4294913517 ecr 159770,mptcp dss ack 3914430354], length 0
10:53:23.736072 IP 112.26.1.8.37887 > 112.26.1.1.37753: Flags [.], ack 395557, win 24504, options [nop,nop,TS val 4294913070 ecr 159496,mptcp dss ack 3914398938], length 0
10:53:23.763422 IP 112.26.1.8.37887 > 112.26.1.1.37753: Flags [.], ack 401269, win 24455, options [nop,nop,TS val 4294913656 ecr 159913,mptcp dss ack 3914440350], length 0
10:53:23.764836 IP 112.26.1.8.37887 > 112.26.1.1.37753: Flags [.], ack 401269, win 24455, options [nop,nop,TS val 4294913656 ecr 159913,mptcp dss ack 3914440350], length 0
10:53:23.862384 IP 112.26.1.8.37887 > 112.26.1.1.37753: Flags [.], ack 404125, win 24433, options [nop,nop,TS val 4294913754 ecr 160085,mptcp dss ack 3914441778], length 0
10:53:23.926627 IP 112.26.1.8.37887 > 112.26.1.1.37753: Flags [.], ack 404125, win 24433, options [nop,nop,TS val 4294913754 ecr 160085,mptcp dss ack 3914441778], length 0
10:53:23.933790 IP 112.26.1.8.37887 > 112.26.1.1.37753: Flags [.], ack 396985, win 24504, options [nop,nop,TS val 4294913199 ecr 159630,mptcp dss ack 3914398938], length 0
10:53:24.019514 IP 112.26.1.8.37887 > 112.26.1.1.37753: Flags [.], ack 405553, win 24393, options [nop,nop,TS val 4294913912 ecr 160377,mptcp dss ack 3914448918], length 0
10:53:24.027464 IP 112.26.1.8.37887 > 112.26.1.1.37753: Flags [.], ack 405553, win 24393, options [nop,nop,TS val 4294913912 ecr 160377,mptcp dss ack 3914448918], length 0
10:53:24.059107 IP 112.26.1.8.37887 > 112.26.1.1.37753: Flags [.], ack 398413, win 24373, options [nop,nop,TS val 4294913356 ecr 159770,mptcp dss ack 3914417502], length 0
10:53:24.139800 IP 112.26.1.8.37887 > 112.26.1.1.37753: Flags [.], ack 408409, win 24422, options [nop,nop,TS val 4294914032 ecr 160574,mptcp dss ack 3914456058], length 0
10:53:24.150357 IP 112.26.1.8.37887 > 112.26.1.1.37753: Flags [.], ack 408409, win 24422, options [nop,nop,TS val 4294914032 ecr 160574,mptcp dss ack 3914456058], length 0
10:53:24.178538 IP 112.26.1.8.37887 > 112.26.1.1.37753: Flags [.], ack 399841, win 24442, options [nop,nop,TS val 4294913517 ecr 159770,mptcp dss ack 3914430354], length 0
10:53:24.248773 IP 112.26.1.8.37887 > 112.26.1.1.37753: Flags [.], ack 401269, win 24455, options [nop,nop,TS val 4294913656 ecr 159913,mptcp dss ack 3914440350], length 0
10:53:24.387438 IP 112.26.1.8.37887 > 112.26.1.1.37753: Flags [.], ack 411265, win 24473, options [nop,nop,TS val 4294914280 ecr 160819,mptcp dss ack 3914473194], length 0
10:53:24.392940 IP 112.26.1.8.37887 > 112.26.1.1.37753: Flags [.], ack 411265, win 24473, options [nop,nop,TS val 4294914280 ecr 160819,mptcp dss ack 3914473194], length 0
10:53:24.418261 IP 112.26.1.8.37887 > 112.26.1.1.37753: Flags [.], ack 404125, win 24433, options [nop,nop,TS val 4294913754 ecr 160085,mptcp dss ack 3914441778], length 0
10:53:24.552031 IP 112.26.1.8.37887 > 112.26.1.1.37753: Flags [.], ack 405553, win 24393, options [nop,nop,TS val 4294913912 ecr 160377,mptcp dss ack 3914448918], length 0
10:53:24.634119 IP 112.26.1.8.37887 > 112.26.1.1.37753: Flags [.], ack 408409, win 24422, options [nop,nop,TS val 4294914032 ecr 160574,mptcp dss ack 3914456058], length 0
10:53:24.693546 IP 112.26.1.8.37887 > 112.26.1.1.37753: Flags [.], ack 411265, win 24473, options [nop,nop,TS val 4294914280 ecr 160819,mptcp dss ack 3914473194], length 0
10:53:24.754823 IP 112.26.1.8.37887 > 112.26.1.1.37753: Flags [.], ack 414121, win 24388, options [nop,nop,TS val 4294914647 ecr 161059,mptcp dss ack 3914491758], length 0
10:53:24.760201 IP 112.26.1.8.37887 > 112.26.1.1.37753: Flags [.], ack 414121, win 24388, options [nop,nop,TS val 4294914647 ecr 161059,mptcp dss ack 3914491758], length 0
10:53:24.869053 IP 112.26.1.8.37887 > 112.26.1.1.37753: Flags [.], ack 414121, win 24388, options [nop,nop,TS val 4294914647 ecr 161059,mptcp dss ack 3914491758], length 0
10:53:24.944957 IP 112.26.1.8.37887 > 112.26.1.1.37753: Flags [.], ack 416977, win 24397, options [nop,nop,TS val 4294914837 ecr 161193,mptcp dss ack 3914493186], length 0
10:53:24.946821 IP 112.26.1.8.37887 > 112.26.1.1.37753: Flags [.], ack 416977, win 24397, options [nop,nop,TS val 4294914837 ecr 161193,mptcp dss ack 3914493186], length 0
10:53:24.957211 IP 112.26.1.8.37887 > 112.26.1.1.37753: Flags [.], ack 416977, win 24397, options [nop,nop,TS val 4294914837 ecr 161193,mptcp dss ack 3914493186], length 0
10:53:25.116196 IP 112.26.1.8.37887 > 112.26.1.1.37753: Flags [.], ack 419833, win 24442, options [nop,nop,TS val 4294915008 ecr 161275,mptcp dss ack 3914504610], length 0
10:53:25.118383 IP 112.26.1.8.37887 > 112.26.1.1.37753: Flags [.], ack 419833, win 24442, options [nop,nop,TS val 4294915008 ecr 161275,mptcp dss ack 3914504610], length 0
10:53:25.132497 IP 112.26.1.8.37887 > 112.26.1.1.37753: Flags [.], ack 419833, win 24442, options [nop,nop,TS val 4294915008 ecr 161275,mptcp dss ack 3914504610], length 0
10:53:25.377797 IP 112.26.1.8.37887 > 112.26.1.1.37753: Flags [.], ack 422689, win 24378, options [nop,nop,TS val 4294915269 ecr 161334,mptcp dss ack 3914516034], length 0
10:53:25.379541 IP 112.26.1.8.37887 > 112.26.1.1.37753: Flags [.], ack 422689, win 24378, options [nop,nop,TS val 4294915269 ecr 161334,mptcp dss ack 3914516034], length 0
10:53:25.389244 IP 112.26.1.8.37887 > 112.26.1.1.37753: Flags [.], ack 422689, win 24378, options [nop,nop,TS val 4294915269 ecr 161334,mptcp dss ack 3914516034], length 0
10:53:25.581487 IP 112.26.1.8.37887 > 112.26.1.1.37753: Flags [.], ack 425545, win 24393, options [nop,nop,TS val 4294915474 ecr 161509,mptcp dss ack 3914528886], length 0
10:53:25.587073 IP 112.26.1.8.37887 > 112.26.1.1.37753: Flags [.], ack 425545, win 24393, options [nop,nop,TS val 4294915474 ecr 161509,mptcp dss ack 3914528886], length 0
10:53:25.598769 IP 112.26.1.8.37887 > 112.26.1.1.37753: Flags [.], ack 425545, win 24393, options [nop,nop,TS val 4294915474 ecr 161509,mptcp dss ack 3914528886], length 0
10:53:25.776506 IP 112.26.1.8.37887 > 112.26.1.1.37753: Flags [.], ack 428401, win 24349, options [nop,nop,TS val 4294915668 ecr 161598,mptcp dss ack 3914531742], length 0
10:53:25.778041 IP 112.26.1.8.37887 > 112.26.1.1.37753: Flags [.], ack 428401, win 24349, options [nop,nop,TS val 4294915668 ecr 161598,mptcp dss ack 3914531742], length 0
10:53:25.788448 IP 112.26.1.8.37887 > 112.26.1.1.37753: Flags [.], ack 428401, win 24349, options [nop,nop,TS val 4294915668 ecr 161598,mptcp dss ack 3914531742], length 0
10:53:25.952473 IP 112.26.1.8.37887 > 112.26.1.1.37753: Flags [.], ack 431257, win 24360, options [nop,nop,TS val 4294915844 ecr 161770,mptcp dss ack 3914547450], length 0
10:53:25.957368 IP 112.26.1.8.37887 > 112.26.1.1.37753: Flags [.], ack 431257, win 24360, options [nop,nop,TS val 4294915844 ecr 161770,mptcp dss ack 3914547450], length 0
10:53:25.959737 IP 112.26.1.8.37887 > 112.26.1.1.37753: Flags [.], ack 431257, win 24360, options [nop,nop,TS val 4294915844 ecr 161770,mptcp dss ack 3914547450], length 0
10:53:26.174239 IP 112.26.1.8.37887 > 112.26.1.1.37753: Flags [.], ack 434113, win 24418, options [nop,nop,TS val 4294916065 ecr 162024,mptcp dss ack 3914563158], length 0
10:53:26.178297 IP 112.26.1.8.37887 > 112.26.1.1.37753: Flags [.], ack 434113, win 24418, options [nop,nop,TS val 4294916065 ecr 162024,mptcp dss ack 3914563158], length 0
10:53:26.191384 IP 112.26.1.8.37887 > 112.26.1.1.37753: Flags [.], ack 434113, win 24418, options [nop,nop,TS val 4294916065 ecr 162024,mptcp dss ack 3914563158], length 0
10:53:26.502963 IP 112.26.1.8.37887 > 112.26.1.1.37753: Flags [.], ack 438397, win 24418, options [nop,nop,TS val 4294916395 ecr 162024,mptcp dss ack 3914563158], length 0
10:53:26.509026 IP 112.26.1.8.37887 > 112.26.1.1.37753: Flags [.], ack 438397, win 24418, options [nop,nop,TS val 4294916395 ecr 162024,mptcp dss ack 3914563158], length 0
10:53:26.514952 IP 112.26.1.8.37887 > 112.26.1.1.37753: Flags [.], ack 438397, win 24418, options [nop,nop,TS val 4294916395 ecr 162024,mptcp dss ack 3914563158], length 0
10:53:26.862232 IP 112.26.1.8.37887 > 112.26.1.1.37753: Flags [.], ack 441253, win 24418, options [nop,nop,TS val 4294916752 ecr 162429,mptcp dss ack 3914563158], length 0
10:53:26.863633 IP 112.26.1.8.37887 > 112.26.1.1.37753: Flags [.], ack 441253, win 24418, options [nop,nop,TS val 4294916752 ecr 162429,mptcp dss ack 3914563158], length 0
