10:52:44.097786 IP 112.26.3.8.41425 > 112.26.3.1.37753: Flags [S], seq 2395078999, win 65535, options [mss 1460,sackOK,TS val 4294873967 ecr 0,nop,wscale 6,mptcp join id 5 token 0xd15e4cde nonce 0x2a8bb6e7], length 0
10:52:44.144500 IP 112.26.3.8.41425 > 112.26.3.1.37753: Flags [S], seq 2395078999, win 65535, options [mss 1460,sackOK,TS val 4294873967 ecr 0,nop,wscale 6,mptcp join id 5 token 0xd15e4cde nonce 0x2a8bb6e7], length 0
10:52:44.377085 IP 112.26.3.1.37753 > 112.26.3.8.41425: Flags [S.], seq 2893757763, ack 2395079000, win 28560, options [mss 1460,sackOK,TS val 120848 ecr 4294873967,nop,wscale 7,mptcp join id 5 hmac 0x81ff6e68fa33c134 nonce 0x1be19e41], length 0
10:52:44.448029 IP 112.26.3.1.37753 > 112.26.3.8.41425: Flags [S.], seq 2893757763, ack 2395079000, win 28560, options [mss 1460,sackOK,TS val 120848 ecr 4294873967,nop,wscale 7,mptcp join id 5 hmac 0x81ff6e68fa33c134 nonce 0x1be19e41], length 0
10:52:44.545853 IP 112.26.3.8.41425 > 112.26.3.1.37753: Flags [.], ack 1, win 7027, options [nop,nop,TS val 4294874346 ecr 120848,mptcp join hmac 0x8ee215a13a2dbfbe7ea6ce9b5e39c59ddf8153af], length 0
10:52:44.591484 IP 112.26.3.8.41425 > 112.26.3.1.37753: Flags [.], ack 1, win 7027, options [nop,nop,TS val 4294874346 ecr 120848,mptcp join hmac 0x8ee215a13a2dbfbe7ea6ce9b5e39c59ddf8153af], length 0
10:52:44.601619 IP 112.26.3.1.37753 > 112.26.3.8.41425: Flags [.], ack 1, win 670, options [nop,nop,TS val 121235 ecr 4294874346,mptcp dss ack 2295998090], length 0
10:53:19.799597 IP 112.26.3.1.37753 > 112.26.3.8.41425: Flags [.], seq 369853:371281, ack 1, win 893, options [nop,nop,TS val 156012 ecr 4294909198,mptcp dss ack 2295998090 seq 3914251854 subseq 369853 len 1428 csum 0xc94c], length 1428
10:53:19.799952 IP 112.26.3.1.37753 > 112.26.3.8.41425: Flags [.], seq 369853:371281, ack 1, win 893, options [nop,nop,TS val 156012 ecr 4294909198,mptcp dss ack 2295998090 seq 3914251854 subseq 369853 len 1428 csum 0xc94c], length 1428
10:53:19.852853 IP 112.26.3.8.41425 > 112.26.3.1.37753: Flags [.], ack 374137, win 24467, options [nop,nop,TS val 4294909744 ecr 156012,nop,nop,sack 1 {375565:381277},mptcp dss ack 3914213298], length 0
10:53:19.892200 IP 112.26.3.8.41425 > 112.26.3.1.37753: Flags [.], ack 374137, win 24467, options [nop,nop,TS val 4294909744 ecr 156012,nop,nop,sack 1 {375565:381277},mptcp dss ack 3914213298], length 0
10:53:19.965580 IP 112.26.3.1.37753 > 112.26.3.8.41425: Flags [.], seq 374137:375565, ack 1, win 893, options [nop,nop,TS val 156122 ecr 4294909356,mptcp dss ack 2295998090 seq 3914274702 subseq 374137 len 1428 csum 0xe686], length 1428
10:53:19.965904 IP 112.26.3.1.37753 > 112.26.3.8.41425: Flags [.], seq 374137:375565, ack 1, win 893, options [nop,nop,TS val 156122 ecr 4294909356,mptcp dss ack 2295998090 seq 3914274702 subseq 374137 len 1428 csum 0xe686], length 1428
10:53:19.985194 IP 112.26.3.8.41425 > 112.26.3.1.37753: Flags [.], ack 381277, win 24467, options [nop,nop,TS val 4294909862 ecr 156122,mptcp dss ack 3914213298], length 0
10:53:20.009030 IP 112.26.3.8.41425 > 112.26.3.1.37753: Flags [.], ack 381277, win 24467, options [nop,nop,TS val 4294909862 ecr 156122,mptcp dss ack 3914213298], length 0
10:53:20.105957 IP 112.26.3.1.37753 > 112.26.3.8.41425: Flags [.], seq 381277:382705, ack 1, win 893, options [nop,nop,TS val 156287 ecr 4294909462,mptcp dss ack 2295998090 seq 3914297550 subseq 381277 len 1428 csum 0xb9c7], length 1428
10:53:20.106297 IP 112.26.3.1.37753 > 112.26.3.8.41425: Flags [.], seq 381277:382705, ack 1, win 893, options [nop,nop,TS val 156287 ecr 4294909462,mptcp dss ack 2295998090 seq 3914297550 subseq 381277 len 1428 csum 0xb9c7], length 1428
10:53:20.119469 IP 112.26.3.8.41425 > 112.26.3.1.37753: Flags [.], ack 382705, win 24467, options [nop,nop,TS val 4294910003 ecr 156287,mptcp dss ack 3914213298], length 0
10:53:20.137129 IP 112.26.3.8.41425 > 112.26.3.1.37753: Flags [.], ack 382705, win 24467, options [nop,nop,TS val 4294910003 ecr 156287,mptcp dss ack 3914213298], length 0
10:53:20.176416 IP 112.26.3.1.37753 > 112.26.3.8.41425: Flags [.], seq 382705:384133, ack 1, win 893, options [nop,nop,TS val 156404 ecr 4294909613,mptcp dss ack 2295998090 seq 3914301834 subseq 382705 len 1428 csum 0x1fef], length 1428
10:53:20.176798 IP 112.26.3.1.37753 > 112.26.3.8.41425: Flags [.], seq 382705:384133, ack 1, win 893, options [nop,nop,TS val 156404 ecr 4294909613,mptcp dss ack 2295998090 seq 3914301834 subseq 382705 len 1428 csum 0x1fef], length 1428
10:53:20.274017 IP 112.26.3.8.41425 > 112.26.3.1.37753: Flags [.], ack 384133, win 24467, options [nop,nop,TS val 4294910160 ecr 156404,mptcp dss ack 3914213298], length 0
10:53:20.275229 IP 112.26.3.8.41425 > 112.26.3.1.37753: Flags [.], ack 384133, win 24467, options [nop,nop,TS val 4294910160 ecr 156404,mptcp dss ack 3914213298], length 0
10:53:20.303395 IP 112.26.3.1.37753 > 112.26.3.8.41425: Flags [.], seq 384133:385561, ack 1, win 893, options [nop,nop,TS val 156536 ecr 4294909744,mptcp dss ack 2295998090 seq 3914306118 subseq 384133 len 1428 csum 0x3cf], length 1428
10:53:20.303659 IP 112.26.3.1.37753 > 112.26.3.8.41425: Flags [.], seq 384133:385561, ack 1, win 893, options [nop,nop,TS val 156536 ecr 4294909744,mptcp dss ack 2295998090 seq 3914306118 subseq 384133 len 1428 csum 0x3cf], length 1428
10:53:20.378546 IP 112.26.3.8.41425 > 112.26.3.1.37753: Flags [.], ack 385561, win 24467, options [nop,nop,TS val 4294910263 ecr 156536,mptcp dss ack 3914213298], length 0
10:53:20.393535 IP 112.26.3.8.41425 > 112.26.3.1.37753: Flags [.], ack 385561, win 24467, options [nop,nop,TS val 4294910263 ecr 156536,mptcp dss ack 3914213298], length 0
10:53:20.456568 IP 112.26.3.1.37753 > 112.26.3.8.41425: Flags [.], seq 385561:386989, ack 1, win 893, options [nop,nop,TS val 156652 ecr 4294909862,mptcp dss ack 2295998090 seq 3914313258 subseq 385561 len 1428 csum 0x42a3], length 1428
10:53:20.456891 IP 112.26.3.1.37753 > 112.26.3.8.41425: Flags [.], seq 385561:386989, ack 1, win 893, options [nop,nop,TS val 156652 ecr 4294909862,mptcp dss ack 2295998090 seq 3914313258 subseq 385561 len 1428 csum 0x42a3], length 1428
10:53:20.491464 IP 112.26.3.8.41425 > 112.26.3.1.37753: Flags [.], ack 386989, win 24267, options [nop,nop,TS val 4294910384 ecr 156652,mptcp dss ack 3914226150], length 0
10:53:20.507834 IP 112.26.3.8.41425 > 112.26.3.1.37753: Flags [.], ack 386989, win 24267, options [nop,nop,TS val 4294910384 ecr 156652,mptcp dss ack 3914226150], length 0
10:53:20.590665 IP 112.26.3.1.37753 > 112.26.3.8.41425: Flags [.], seq 386989:388417, ack 1, win 893, options [nop,nop,TS val 156780 ecr 4294910003,mptcp dss ack 2295998090 seq 3914318970 subseq 386989 len 1428 csum 0xf83b], length 1428
10:53:20.590948 IP 112.26.3.1.37753 > 112.26.3.8.41425: Flags [.], seq 386989:388417, ack 1, win 893, options [nop,nop,TS val 156780 ecr 4294910003,mptcp dss ack 2295998090 seq 3914318970 subseq 386989 len 1428 csum 0xf83b], length 1428
10:53:20.600453 IP 112.26.3.8.41425 > 112.26.3.1.37753: Flags [.], ack 388417, win 24267, options [nop,nop,TS val 4294910489 ecr 156780,mptcp dss ack 3914226150], length 0
10:53:20.601673 IP 112.26.3.8.41425 > 112.26.3.1.37753: Flags [.], ack 388417, win 24267, options [nop,nop,TS val 4294910489 ecr 156780,mptcp dss ack 3914226150], length 0
10:53:20.777505 IP 112.26.3.1.37753 > 112.26.3.8.41425: Flags [.], seq 388417:389845, ack 1, win 893, options [nop,nop,TS val 156919 ecr 4294910160,mptcp dss ack 2295998090 seq 3914324682 subseq 388417 len 1428 csum 0xbe65], length 1428
10:53:20.777848 IP 112.26.3.1.37753 > 112.26.3.8.41425: Flags [.], seq 388417:389845, ack 1, win 893, options [nop,nop,TS val 156919 ecr 4294910160,mptcp dss ack 2295998090 seq 3914324682 subseq 388417 len 1428 csum 0xbe65], length 1428
10:53:20.783797 IP 112.26.3.8.41425 > 112.26.3.1.37753: Flags [.], ack 389845, win 24267, options [nop,nop,TS val 4294910675 ecr 156919,mptcp dss ack 3914226150], length 0
10:53:20.794164 IP 112.26.3.8.41425 > 112.26.3.1.37753: Flags [.], ack 389845, win 24267, options [nop,nop,TS val 4294910675 ecr 156919,mptcp dss ack 3914226150], length 0
10:53:20.909499 IP 112.26.3.1.37753 > 112.26.3.8.41425: Flags [.], seq 389845:391273, ack 1, win 893, options [nop,nop,TS val 157041 ecr 4294910263,mptcp dss ack 2295998090 seq 3914327538 subseq 389845 len 1428 csum 0xb50d], length 1428
10:53:20.909878 IP 112.26.3.1.37753 > 112.26.3.8.41425: Flags [.], seq 389845:391273, ack 1, win 893, options [nop,nop,TS val 157041 ecr 4294910263,mptcp dss ack 2295998090 seq 3914327538 subseq 389845 len 1428 csum 0xb50d], length 1428
10:53:20.913895 IP 112.26.3.8.41425 > 112.26.3.1.37753: Flags [.], ack 391273, win 24267, options [nop,nop,TS val 4294910806 ecr 157041,mptcp dss ack 3914226150], length 0
10:53:20.920554 IP 112.26.3.8.41425 > 112.26.3.1.37753: Flags [.], ack 391273, win 24267, options [nop,nop,TS val 4294910806 ecr 157041,mptcp dss ack 3914226150], length 0
10:53:21.042678 IP 112.26.3.1.37753 > 112.26.3.8.41425: Flags [.], seq 391273:392701, ack 1, win 893, options [nop,nop,TS val 157041 ecr 4294910263,mptcp dss ack 2295998090 seq 3914328966 subseq 391273 len 1428 csum 0xcb49], length 1428
10:53:21.043010 IP 112.26.3.1.37753 > 112.26.3.8.41425: Flags [.], seq 391273:392701, ack 1, win 893, options [nop,nop,TS val 157041 ecr 4294910263,mptcp dss ack 2295998090 seq 3914328966 subseq 391273 len 1428 csum 0xcb49], length 1428
10:53:21.051866 IP 112.26.3.8.41425 > 112.26.3.1.37753: Flags [.], ack 392701, win 24267, options [nop,nop,TS val 4294910942 ecr 157041,mptcp dss ack 3914226150], length 0
10:53:21.055640 IP 112.26.3.8.41425 > 112.26.3.1.37753: Flags [.], ack 392701, win 24267, options [nop,nop,TS val 4294910942 ecr 157041,mptcp dss ack 3914226150], length 0
10:53:21.168922 IP 112.26.3.1.37753 > 112.26.3.8.41425: Flags [.], seq 392701:394129, ack 1, win 893, options [nop,nop,TS val 157152 ecr 4294910384,mptcp dss ack 2295998090 seq 3914333250 subseq 392701 len 1428 csum 0x57f7], length 1428
10:53:21.169257 IP 112.26.3.1.37753 > 112.26.3.8.41425: Flags [.], seq 392701:394129, ack 1, win 893, options [nop,nop,TS val 157152 ecr 4294910384,mptcp dss ack 2295998090 seq 3914333250 subseq 392701 len 1428 csum 0x57f7], length 1428
10:53:21.179119 IP 112.26.3.8.41425 > 112.26.3.1.37753: Flags [.], ack 394129, win 24267, options [nop,nop,TS val 4294911067 ecr 157152,mptcp dss ack 3914226150], length 0
10:53:21.185235 IP 112.26.3.8.41425 > 112.26.3.1.37753: Flags [.], ack 394129, win 24267, options [nop,nop,TS val 4294911067 ecr 157152,mptcp dss ack 3914226150], length 0
10:53:21.312478 IP 112.26.3.1.37753 > 112.26.3.8.41425: Flags [.], seq 394129:395557, ack 1, win 893, options [nop,nop,TS val 157247 ecr 4294910489,mptcp dss ack 2295998090 seq 3914337534 subseq 394129 len 1428 csum 0xd0db], length 1428
10:53:21.312824 IP 112.26.3.1.37753 > 112.26.3.8.41425: Flags [.], seq 394129:395557, ack 1, win 893, options [nop,nop,TS val 157247 ecr 4294910489,mptcp dss ack 2295998090 seq 3914337534 subseq 394129 len 1428 csum 0xd0db], length 1428
10:53:21.319420 IP 112.26.3.8.41425 > 112.26.3.1.37753: Flags [.], ack 395557, win 24267, options [nop,nop,TS val 4294911210 ecr 157247,mptcp dss ack 3914226150], length 0
10:53:21.334987 IP 112.26.3.8.41425 > 112.26.3.1.37753: Flags [.], ack 395557, win 24267, options [nop,nop,TS val 4294911210 ecr 157247,mptcp dss ack 3914226150], length 0
10:53:21.451624 IP 112.26.3.1.37753 > 112.26.3.8.41425: Flags [.], seq 395557:396985, ack 1, win 893, options [nop,nop,TS val 157441 ecr 4294910675,mptcp dss ack 2295998090 seq 3914344674 subseq 395557 len 1428 csum 0xfeda], length 1428
10:53:21.451986 IP 112.26.3.1.37753 > 112.26.3.8.41425: Flags [.], seq 395557:396985, ack 1, win 893, options [nop,nop,TS val 157441 ecr 4294910675,mptcp dss ack 2295998090 seq 3914344674 subseq 395557 len 1428 csum 0xfeda], length 1428
10:53:21.454829 IP 112.26.3.8.41425 > 112.26.3.1.37753: Flags [.], ack 396985, win 24267, options [nop,nop,TS val 4294911347 ecr 157441,mptcp dss ack 3914226150], length 0
10:53:21.461661 IP 112.26.3.8.41425 > 112.26.3.1.37753: Flags [.], ack 396985, win 24267, options [nop,nop,TS val 4294911347 ecr 157441,mptcp dss ack 3914226150], length 0
10:53:21.601539 IP 112.26.3.1.37753 > 112.26.3.8.41425: Flags [.], seq 396985:398413, ack 1, win 893, options [nop,nop,TS val 157566 ecr 4294910806,mptcp dss ack 2295998090 seq 3914348958 subseq 396985 len 1428 csum 0x3def], length 1428
10:53:21.601823 IP 112.26.3.1.37753 > 112.26.3.8.41425: Flags [.], seq 396985:398413, ack 1, win 893, options [nop,nop,TS val 157566 ecr 4294910806,mptcp dss ack 2295998090 seq 3914348958 subseq 396985 len 1428 csum 0x3def], length 1428
10:53:21.607541 IP 112.26.3.8.41425 > 112.26.3.1.37753: Flags [.], ack 398413, win 24267, options [nop,nop,TS val 4294911499 ecr 157566,mptcp dss ack 3914226150], length 0
10:53:21.611900 IP 112.26.3.8.41425 > 112.26.3.1.37753: Flags [.], ack 398413, win 24267, options [nop,nop,TS val 4294911499 ecr 157566,mptcp dss ack 3914226150], length 0
10:53:21.714005 IP 112.26.3.1.37753 > 112.26.3.8.41425: Flags [.], seq 398413:399841, ack 1, win 893, options [nop,nop,TS val 157699 ecr 4294910942,mptcp dss ack 2295998090 seq 3914353242 subseq 398413 len 1428 csum 0x258e], length 1428
10:53:21.714346 IP 112.26.3.1.37753 > 112.26.3.8.41425: Flags [.], seq 398413:399841, ack 1, win 893, options [nop,nop,TS val 157699 ecr 4294910942,mptcp dss ack 2295998090 seq 3914353242 subseq 398413 len 1428 csum 0x258e], length 1428
10:53:21.730149 IP 112.26.3.8.41425 > 112.26.3.1.37753: Flags [.], ack 399841, win 24257, options [nop,nop,TS val 4294911622 ecr 157699,mptcp dss ack 3914317542], length 0
10:53:21.761661 IP 112.26.3.8.41425 > 112.26.3.1.37753: Flags [.], ack 399841, win 24257, options [nop,nop,TS val 4294911622 ecr 157699,mptcp dss ack 3914317542], length 0
10:53:21.828297 IP 112.26.3.1.37753 > 112.26.3.8.41425: Flags [.], seq 399841:401269, ack 1, win 893, options [nop,nop,TS val 157829 ecr 4294911067,mptcp dss ack 2295998090 seq 3914358954 subseq 399841 len 1428 csum 0xf904], length 1428
10:53:21.828596 IP 112.26.3.1.37753 > 112.26.3.8.41425: Flags [.], seq 399841:401269, ack 1, win 893, options [nop,nop,TS val 157829 ecr 4294911067,mptcp dss ack 2295998090 seq 3914358954 subseq 399841 len 1428 csum 0xf904], length 1428
10:53:21.925297 IP 112.26.3.8.41425 > 112.26.3.1.37753: Flags [.], ack 401269, win 24525, options [nop,nop,TS val 4294911815 ecr 157829,mptcp dss ack 3914357526], length 0
10:53:21.927142 IP 112.26.3.1.37753 > 112.26.3.8.41425: Flags [.], seq 401269:402697, ack 1, win 893, options [nop,nop,TS val 157983 ecr 4294911210,mptcp dss ack 2295998090 seq 3914366094 subseq 401269 len 1428 csum 0x6a82], length 1428
10:53:21.927472 IP 112.26.3.1.37753 > 112.26.3.8.41425: Flags [.], seq 401269:402697, ack 1, win 893, options [nop,nop,TS val 157983 ecr 4294911210,mptcp dss ack 2295998090 seq 3914366094 subseq 401269 len 1428 csum 0x6a82], length 1428
10:53:21.929268 IP 112.26.3.8.41425 > 112.26.3.1.37753: Flags [.], ack 401269, win 24525, options [nop,nop,TS val 4294911815 ecr 157829,mptcp dss ack 3914357526], length 0
10:53:22.053702 IP 112.26.3.1.37753 > 112.26.3.8.41425: Flags [.], seq 402697:404125, ack 1, win 893, options [nop,nop,TS val 158111 ecr 4294911347,mptcp dss ack 2295998090 seq 3914370378 subseq 402697 len 1428 csum 0x9727], length 1428
10:53:22.054022 IP 112.26.3.1.37753 > 112.26.3.8.41425: Flags [.], seq 402697:404125, ack 1, win 893, options [nop,nop,TS val 158111 ecr 4294911347,mptcp dss ack 2295998090 seq 3914370378 subseq 402697 len 1428 csum 0x9727], length 1428
10:53:22.093586 IP 112.26.3.8.41425 > 112.26.3.1.37753: Flags [.], ack 404125, win 24522, options [nop,nop,TS val 4294911950 ecr 157983,mptcp dss ack 3914363238], length 0
10:53:22.097255 IP 112.26.3.8.41425 > 112.26.3.1.37753: Flags [.], ack 404125, win 24522, options [nop,nop,TS val 4294911950 ecr 157983,mptcp dss ack 3914363238], length 0
10:53:22.185028 IP 112.26.3.1.37753 > 112.26.3.8.41425: Flags [.], seq 404125:405553, ack 1, win 893, options [nop,nop,TS val 158256 ecr 4294911499,mptcp dss ack 2295998090 seq 3914376090 subseq 404125 len 1428 csum 0x5b9d], length 1428
10:53:22.185355 IP 112.26.3.1.37753 > 112.26.3.8.41425: Flags [.], seq 404125:405553, ack 1, win 893, options [nop,nop,TS val 158256 ecr 4294911499,mptcp dss ack 2295998090 seq 3914376090 subseq 404125 len 1428 csum 0x5b9d], length 1428
10:53:22.276448 IP 112.26.3.1.37753 > 112.26.3.8.41425: Flags [.], seq 405553:406981, ack 1, win 893, options [nop,nop,TS val 158406 ecr 4294911622,mptcp dss ack 2295998090 seq 3914383230 subseq 405553 len 1428 csum 0xdf8d], length 1428
10:53:22.276744 IP 112.26.3.1.37753 > 112.26.3.8.41425: Flags [.], seq 405553:406981, ack 1, win 893, options [nop,nop,TS val 158406 ecr 4294911622,mptcp dss ack 2295998090 seq 3914383230 subseq 405553 len 1428 csum 0xdf8d], length 1428
10:53:22.302856 IP 112.26.3.8.41425 > 112.26.3.1.37753: Flags [.], ack 406981, win 24473, options [nop,nop,TS val 4294912195 ecr 158256,mptcp dss ack 3914373234], length 0
10:53:22.309138 IP 112.26.3.8.41425 > 112.26.3.1.37753: Flags [.], ack 406981, win 24473, options [nop,nop,TS val 4294912195 ecr 158256,mptcp dss ack 3914373234], length 0
10:53:22.404123 IP 112.26.3.1.37753 > 112.26.3.8.41425: Flags [.], seq 406981:408409, ack 1, win 893, options [nop,nop,TS val 158576 ecr 4294911815,mptcp dss ack 2295998090 seq 3914390370 subseq 406981 len 1428 csum 0xb78f], length 1428
10:53:22.404368 IP 112.26.3.1.37753 > 112.26.3.8.41425: Flags [.], seq 406981:408409, ack 1, win 893, options [nop,nop,TS val 158576 ecr 4294911815,mptcp dss ack 2295998090 seq 3914390370 subseq 406981 len 1428 csum 0xb78f], length 1428
10:53:22.491505 IP 112.26.3.1.37753 > 112.26.3.8.41425: Flags [.], seq 409837:411265, ack 1, win 893, options [nop,nop,TS val 158741 ecr 4294911950,mptcp dss ack 2295998090 seq 3914400366 subseq 409837 len 1428 csum 0xd595], length 1428
10:53:22.491857 IP 112.26.3.1.37753 > 112.26.3.8.41425: Flags [.], seq 409837:411265, ack 1, win 893, options [nop,nop,TS val 158741 ecr 4294911950,mptcp dss ack 2295998090 seq 3914400366 subseq 409837 len 1428 csum 0xd595], length 1428
10:53:22.532053 IP 112.26.3.8.41425 > 112.26.3.1.37753: Flags [.], ack 408409, win 24458, options [nop,nop,TS val 4294912424 ecr 158576,mptcp dss ack 3914381802], length 0
10:53:22.534772 IP 112.26.3.8.41425 > 112.26.3.1.37753: Flags [.], ack 408409, win 24458, options [nop,nop,TS val 4294912424 ecr 158576,mptcp dss ack 3914381802], length 0
10:53:22.630623 IP 112.26.3.1.37753 > 112.26.3.8.41425: Flags [.], seq 411265:412693, ack 1, win 893, options [nop,nop,TS val 158953 ecr 4294912195,mptcp dss ack 2295998090 seq 3914406078 subseq 411265 len 1428 csum 0x2a61], length 1428
10:53:22.630946 IP 112.26.3.1.37753 > 112.26.3.8.41425: Flags [.], seq 411265:412693, ack 1, win 893, options [nop,nop,TS val 158953 ecr 4294912195,mptcp dss ack 2295998090 seq 3914406078 subseq 411265 len 1428 csum 0x2a61], length 1428
10:53:22.645117 IP 112.26.3.8.41425 > 112.26.3.1.37753: Flags [.], ack 408409, win 24458, options [nop,nop,TS val 4294912438 ecr 158576,nop,nop,sack 1 {409837:411265},mptcp dss ack 3914381802], length 0
10:53:22.658760 IP 112.26.3.8.41425 > 112.26.3.1.37753: Flags [.], ack 408409, win 24458, options [nop,nop,TS val 4294912438 ecr 158576,nop,nop,sack 1 {409837:411265},mptcp dss ack 3914381802], length 0
10:53:22.755303 IP 112.26.3.8.41425 > 112.26.3.1.37753: Flags [.], ack 408409, win 24507, options [nop,nop,TS val 4294912527 ecr 158576,nop,nop,sack 1 {409837:412693},mptcp dss ack 3914388942], length 0
10:53:22.757458 IP 112.26.3.8.41425 > 112.26.3.1.37753: Flags [.], ack 408409, win 24507, options [nop,nop,TS val 4294912527 ecr 158576,nop,nop,sack 1 {409837:412693},mptcp dss ack 3914388942], length 0
10:53:22.792420 IP 112.26.3.1.37753 > 112.26.3.8.41425: Flags [.], seq 412693:414121, ack 1, win 893, options [nop,nop,TS val 158953 ecr 4294912195,mptcp dss ack 2295998090 seq 3914407506 subseq 412693 len 1428 csum 0x1706], length 1428
10:53:22.792778 IP 112.26.3.1.37753 > 112.26.3.8.41425: Flags [.], seq 412693:414121, ack 1, win 893, options [nop,nop,TS val 158953 ecr 4294912195,mptcp dss ack 2295998090 seq 3914407506 subseq 412693 len 1428 csum 0x1706], length 1428
10:53:22.843562 IP 112.26.3.8.41425 > 112.26.3.1.37753: Flags [.], ack 408409, win 24507, options [nop,nop,TS val 4294912689 ecr 158576,nop,nop,sack 1 {409837:414121},mptcp dss ack 3914393226], length 0
10:53:22.895555 IP 112.26.3.8.41425 > 112.26.3.1.37753: Flags [.], ack 408409, win 24507, options [nop,nop,TS val 4294912689 ecr 158576,nop,nop,sack 1 {409837:414121},mptcp dss ack 3914393226], length 0
10:53:22.916554 IP 112.26.3.1.37753 > 112.26.3.8.41425: Flags [.], seq 414121:415549, ack 1, win 893, options [nop,nop,TS val 158953 ecr 4294912195,mptcp dss ack 2295998090 seq 3914408934 subseq 414121 len 1428 csum 0x39ac], length 1428
10:53:22.916893 IP 112.26.3.1.37753 > 112.26.3.8.41425: Flags [.], seq 414121:415549, ack 1, win 893, options [nop,nop,TS val 158953 ecr 4294912195,mptcp dss ack 2295998090 seq 3914408934 subseq 414121 len 1428 csum 0x39ac], length 1428
10:53:22.945631 IP 112.26.3.8.41425 > 112.26.3.1.37753: Flags [.], ack 408409, win 24504, options [nop,nop,TS val 4294912813 ecr 158576,nop,nop,sack 1 {409837:415549},mptcp dss ack 3914398938], length 0
10:53:22.998263 IP 112.26.3.8.41425 > 112.26.3.1.37753: Flags [.], ack 408409, win 24504, options [nop,nop,TS val 4294912813 ecr 158576,nop,nop,sack 1 {409837:415549},mptcp dss ack 3914398938], length 0
10:53:23.061108 IP 112.26.3.1.37753 > 112.26.3.8.41425: Flags [.], seq 415549:416977, ack 1, win 893, options [nop,nop,TS val 159178 ecr 4294912424,mptcp dss ack 2295998090 seq 3914420358 subseq 415549 len 1428 csum 0xf06b], length 1428
10:53:23.061442 IP 112.26.3.1.37753 > 112.26.3.8.41425: Flags [.], seq 415549:416977, ack 1, win 893, options [nop,nop,TS val 159178 ecr 4294912424,mptcp dss ack 2295998090 seq 3914420358 subseq 415549 len 1428 csum 0xf06b], length 1428
10:53:23.070268 IP 112.26.3.8.41425 > 112.26.3.1.37753: Flags [.], ack 408409, win 24504, options [nop,nop,TS val 4294912958 ecr 158576,nop,nop,sack 1 {409837:416977},mptcp dss ack 3914398938], length 0
10:53:23.081144 IP 112.26.3.8.41425 > 112.26.3.1.37753: Flags [.], ack 408409, win 24504, options [nop,nop,TS val 4294912958 ecr 158576,nop,nop,sack 1 {409837:416977},mptcp dss ack 3914398938], length 0
10:53:23.153474 IP 112.26.3.1.37753 > 112.26.3.8.41425: Flags [.], seq 416977:418405, ack 1, win 893, options [nop,nop,TS val 159338 ecr 4294912438,mptcp dss ack 2295998090 seq 3914427498 subseq 416977 len 1428 csum 0x5c0d], length 1428
10:53:23.153833 IP 112.26.3.1.37753 > 112.26.3.8.41425: Flags [.], seq 416977:418405, ack 1, win 893, options [nop,nop,TS val 159338 ecr 4294912438,mptcp dss ack 2295998090 seq 3914427498 subseq 416977 len 1428 csum 0x5c0d], length 1428
10:53:23.170098 IP 112.26.3.8.41425 > 112.26.3.1.37753: Flags [.], ack 408409, win 24504, options [nop,nop,TS val 4294913051 ecr 158576,nop,nop,sack 1 {409837:418405},mptcp dss ack 3914398938], length 0
10:53:23.202594 IP 112.26.3.8.41425 > 112.26.3.1.37753: Flags [.], ack 408409, win 24504, options [nop,nop,TS val 4294913051 ecr 158576,nop,nop,sack 1 {409837:418405},mptcp dss ack 3914398938], length 0
10:53:23.263581 IP 112.26.3.1.37753 > 112.26.3.8.41425: Flags [.], seq 418405:419833, ack 1, win 893, options [nop,nop,TS val 159450 ecr 4294912527,mptcp dss ack 2295998090 seq 3914431782 subseq 418405 len 1428 csum 0xffe3], length 1428
10:53:23.263867 IP 112.26.3.1.37753 > 112.26.3.8.41425: Flags [.], seq 418405:419833, ack 1, win 893, options [nop,nop,TS val 159450 ecr 4294912527,mptcp dss ack 2295998090 seq 3914431782 subseq 418405 len 1428 csum 0xffe3], length 1428
10:53:23.274956 IP 112.26.3.8.41425 > 112.26.3.1.37753: Flags [.], ack 408409, win 24504, options [nop,nop,TS val 4294913162 ecr 158576,nop,nop,sack 1 {409837:419833},mptcp dss ack 3914398938], length 0
10:53:23.360883 IP 112.26.3.8.41425 > 112.26.3.1.37753: Flags [.], ack 408409, win 24504, options [nop,nop,TS val 4294913162 ecr 158576,nop,nop,sack 1 {409837:419833},mptcp dss ack 3914398938], length 0
10:53:23.369067 IP 112.26.3.1.37753 > 112.26.3.8.41425: Flags [.], seq 408409:409837, ack 1, win 893, options [nop,nop,TS val 159592 ecr 4294912689,mptcp dss ack 2295998090 seq 3914398938 subseq 408409 len 1428 csum 0x63ad], length 1428
10:53:23.369363 IP 112.26.3.1.37753 > 112.26.3.8.41425: Flags [.], seq 408409:409837, ack 1, win 893, options [nop,nop,TS val 159592 ecr 4294912689,mptcp dss ack 2295998090 seq 3914398938 subseq 408409 len 1428 csum 0x63ad], length 1428
10:53:23.379849 IP 112.26.3.8.41425 > 112.26.3.1.37753: Flags [.], ack 419833, win 24214, options [nop,nop,TS val 4294913268 ecr 159592,mptcp dss ack 3914417502], length 0
10:53:23.456956 IP 112.26.3.8.41425 > 112.26.3.1.37753: Flags [.], ack 419833, win 24214, options [nop,nop,TS val 4294913268 ecr 159592,mptcp dss ack 3914417502], length 0
10:53:23.493527 IP 112.26.3.1.37753 > 112.26.3.8.41425: Flags [.], seq 419833:421261, ack 1, win 893, options [nop,nop,TS val 159770 ecr 4294912958,mptcp dss ack 2295998090 seq 3914443206 subseq 419833 len 1428 csum 0xc735], length 1428
10:53:23.493861 IP 112.26.3.1.37753 > 112.26.3.8.41425: Flags [.], seq 419833:421261, ack 1, win 893, options [nop,nop,TS val 159770 ecr 4294912958,mptcp dss ack 2295998090 seq 3914443206 subseq 419833 len 1428 csum 0xc735], length 1428
10:53:23.547647 IP 112.26.3.8.41425 > 112.26.3.1.37753: Flags [.], ack 421261, win 24455, options [nop,nop,TS val 4294913440 ecr 159770,mptcp dss ack 3914426070], length 0
10:53:23.572057 IP 112.26.3.1.37753 > 112.26.3.8.41425: Flags [.], seq 421261:422689, ack 1, win 893, options [nop,nop,TS val 159860 ecr 4294913051,mptcp dss ack 2295998090 seq 3914447490 subseq 421261 len 1428 csum 0x4fae], length 1428
10:53:23.572332 IP 112.26.3.1.37753 > 112.26.3.8.41425: Flags [.], seq 421261:422689, ack 1, win 893, options [nop,nop,TS val 159860 ecr 4294913051,mptcp dss ack 2295998090 seq 3914447490 subseq 421261 len 1428 csum 0x4fae], length 1428
10:53:23.616199 IP 112.26.3.8.41425 > 112.26.3.1.37753: Flags [.], ack 421261, win 24455, options [nop,nop,TS val 4294913440 ecr 159770,mptcp dss ack 3914426070], length 0
10:53:23.647624 IP 112.26.3.8.41425 > 112.26.3.1.37753: Flags [.], ack 422689, win 24442, options [nop,nop,TS val 4294913539 ecr 159860,mptcp dss ack 3914430354], length 0
10:53:23.709776 IP 112.26.3.1.37753 > 112.26.3.8.41425: Flags [.], seq 422689:424117, ack 1, win 893, options [nop,nop,TS val 160085 ecr 4294913162,mptcp dss ack 2295998090 seq 3914460342 subseq 422689 len 1428 csum 0x9798], length 1428
10:53:23.710112 IP 112.26.3.1.37753 > 112.26.3.8.41425: Flags [.], seq 422689:424117, ack 1, win 893, options [nop,nop,TS val 160085 ecr 4294913162,mptcp dss ack 2295998090 seq 3914460342 subseq 422689 len 1428 csum 0x9798], length 1428
10:53:23.748527 IP 112.26.3.8.41425 > 112.26.3.1.37753: Flags [.], ack 424117, win 24440, options [nop,nop,TS val 4294913639 ecr 160085,mptcp dss ack 3914436066], length 0
10:53:23.753783 IP 112.26.3.8.41425 > 112.26.3.1.37753: Flags [.], ack 422689, win 24442, options [nop,nop,TS val 4294913539 ecr 159860,mptcp dss ack 3914430354], length 0
10:53:23.829207 IP 112.26.3.8.41425 > 112.26.3.1.37753: Flags [.], ack 424117, win 24440, options [nop,nop,TS val 4294913639 ecr 160085,mptcp dss ack 3914436066], length 0
10:53:23.851512 IP 112.26.3.1.37753 > 112.26.3.8.41425: Flags [.], seq 424117:425545, ack 1, win 893, options [nop,nop,TS val 160125 ecr 4294913268,mptcp dss ack 2295998090 seq 3914463198 subseq 424117 len 1428 csum 0x8a60], length 1428
10:53:23.851861 IP 112.26.3.1.37753 > 112.26.3.8.41425: Flags [.], seq 424117:425545, ack 1, win 893, options [nop,nop,TS val 160125 ecr 4294913268,mptcp dss ack 2295998090 seq 3914463198 subseq 424117 len 1428 csum 0x8a60], length 1428
10:53:23.888338 IP 112.26.3.8.41425 > 112.26.3.1.37753: Flags [.], ack 425545, win 24433, options [nop,nop,TS val 4294913779 ecr 160125,mptcp dss ack 3914441778], length 0
10:53:23.917305 IP 112.26.3.8.41425 > 112.26.3.1.37753: Flags [.], ack 425545, win 24433, options [nop,nop,TS val 4294913779 ecr 160125,mptcp dss ack 3914441778], length 0
10:53:23.982881 IP 112.26.3.1.37753 > 112.26.3.8.41425: Flags [.], seq 425545:426973, ack 1, win 893, options [nop,nop,TS val 160260 ecr 4294913440,mptcp dss ack 2295998090 seq 3914470338 subseq 425545 len 1428 csum 0x2faf], length 1428
10:53:23.983142 IP 112.26.3.1.37753 > 112.26.3.8.41425: Flags [.], seq 425545:426973, ack 1, win 893, options [nop,nop,TS val 160260 ecr 4294913440,mptcp dss ack 2295998090 seq 3914470338 subseq 425545 len 1428 csum 0x2faf], length 1428
10:53:24.008622 IP 112.26.3.8.41425 > 112.26.3.1.37753: Flags [.], ack 426973, win 24393, options [nop,nop,TS val 4294913900 ecr 160260,mptcp dss ack 3914448918], length 0
10:53:24.023019 IP 112.26.3.8.41425 > 112.26.3.1.37753: Flags [.], ack 426973, win 24393, options [nop,nop,TS val 4294913900 ecr 160260,mptcp dss ack 3914448918], length 0
10:53:24.109832 IP 112.26.3.1.37753 > 112.26.3.8.41425: Flags [.], seq 426973:428401, ack 1, win 893, options [nop,nop,TS val 160260 ecr 4294913440,mptcp dss ack 2295998090 seq 3914471766 subseq 426973 len 1428 csum 0xa543], length 1428
10:53:24.110144 IP 112.26.3.1.37753 > 112.26.3.8.41425: Flags [.], seq 426973:428401, ack 1, win 893, options [nop,nop,TS val 160260 ecr 4294913440,mptcp dss ack 2295998090 seq 3914471766 subseq 426973 len 1428 csum 0xa543], length 1428
10:53:24.146530 IP 112.26.3.8.41425 > 112.26.3.1.37753: Flags [.], ack 428401, win 24424, options [nop,nop,TS val 4294914037 ecr 160260,mptcp dss ack 3914458914], length 0
10:53:24.152660 IP 112.26.3.8.41425 > 112.26.3.1.37753: Flags [.], ack 428401, win 24424, options [nop,nop,TS val 4294914037 ecr 160260,mptcp dss ack 3914458914], length 0
10:53:24.217168 IP 112.26.3.1.37753 > 112.26.3.8.41425: Flags [.], seq 428401:429829, ack 1, win 893, options [nop,nop,TS val 160399 ecr 4294913539,mptcp dss ack 2295998090 seq 3914481762 subseq 428401 len 1428 csum 0x69e5], length 1428
10:53:24.217471 IP 112.26.3.1.37753 > 112.26.3.8.41425: Flags [.], seq 428401:429829, ack 1, win 893, options [nop,nop,TS val 160399 ecr 4294913539,mptcp dss ack 2295998090 seq 3914481762 subseq 428401 len 1428 csum 0x69e5], length 1428
10:53:24.261884 IP 112.26.3.8.41425 > 112.26.3.1.37753: Flags [.], ack 429829, win 24458, options [nop,nop,TS val 4294914154 ecr 160399,mptcp dss ack 3914466054], length 0
10:53:24.263359 IP 112.26.3.8.41425 > 112.26.3.1.37753: Flags [.], ack 429829, win 24458, options [nop,nop,TS val 4294914154 ecr 160399,mptcp dss ack 3914466054], length 0
10:53:24.356237 IP 112.26.3.1.37753 > 112.26.3.8.41425: Flags [.], seq 429829:431257, ack 1, win 893, options [nop,nop,TS val 160511 ecr 4294913639,mptcp dss ack 2295998090 seq 3914483190 subseq 429829 len 1428 csum 0x1d69], length 1428
10:53:24.356568 IP 112.26.3.1.37753 > 112.26.3.8.41425: Flags [.], seq 429829:431257, ack 1, win 893, options [nop,nop,TS val 160511 ecr 4294913639,mptcp dss ack 2295998090 seq 3914483190 subseq 429829 len 1428 csum 0x1d69], length 1428
10:53:24.365704 IP 112.26.3.8.41425 > 112.26.3.1.37753: Flags [.], ack 431257, win 24473, options [nop,nop,TS val 4294914258 ecr 160511,mptcp dss ack 3914473194], length 0
10:53:24.422731 IP 112.26.3.8.41425 > 112.26.3.1.37753: Flags [.], ack 431257, win 24473, options [nop,nop,TS val 4294914258 ecr 160511,mptcp dss ack 3914473194], length 0
10:53:24.477006 IP 112.26.3.1.37753 > 112.26.3.8.41425: Flags [.], seq 431257:432685, ack 1, win 893, options [nop,nop,TS val 160607 ecr 4294913779,mptcp dss ack 2295998090 seq 3914488902 subseq 431257 len 1428 csum 0xdcb3], length 1428
10:53:24.477324 IP 112.26.3.1.37753 > 112.26.3.8.41425: Flags [.], seq 431257:432685, ack 1, win 893, options [nop,nop,TS val 160607 ecr 4294913779,mptcp dss ack 2295998090 seq 3914488902 subseq 431257 len 1428 csum 0xdcb3], length 1428
10:53:24.497200 IP 112.26.3.8.41425 > 112.26.3.1.37753: Flags [.], ack 432685, win 24451, options [nop,nop,TS val 4294914385 ecr 160607,mptcp dss ack 3914474622], length 0
10:53:24.498964 IP 112.26.3.8.41425 > 112.26.3.1.37753: Flags [.], ack 432685, win 24451, options [nop,nop,TS val 4294914385 ecr 160607,mptcp dss ack 3914474622], length 0
10:53:24.582749 IP 112.26.3.1.37753 > 112.26.3.8.41425: Flags [P.], seq 432685:434113, ack 1, win 893, options [nop,nop,TS val 160682 ecr 4294913900,mptcp dss ack 2295998090 seq 3914494614 subseq 432685 len 1428 csum 0x3ed0], length 1428
10:53:24.583032 IP 112.26.3.1.37753 > 112.26.3.8.41425: Flags [P.], seq 432685:434113, ack 1, win 893, options [nop,nop,TS val 160682 ecr 4294913900,mptcp dss ack 2295998090 seq 3914494614 subseq 432685 len 1428 csum 0x3ed0], length 1428
10:53:24.605614 IP 112.26.3.8.41425 > 112.26.3.1.37753: Flags [.], ack 434113, win 24422, options [nop,nop,TS val 4294914497 ecr 160682,mptcp dss ack 3914478906], length 0
10:53:24.607044 IP 112.26.3.8.41425 > 112.26.3.1.37753: Flags [.], ack 434113, win 24422, options [nop,nop,TS val 4294914497 ecr 160682,mptcp dss ack 3914478906], length 0
10:53:24.656124 IP 112.26.3.1.37753 > 112.26.3.8.41425: Flags [.], seq 434113:435541, ack 1, win 893, options [nop,nop,TS val 160797 ecr 4294914037,mptcp dss ack 2295998090 seq 3914500326 subseq 434113 len 1428 csum 0x7c9d], length 1428
10:53:24.656399 IP 112.26.3.1.37753 > 112.26.3.8.41425: Flags [.], seq 434113:435541, ack 1, win 893, options [nop,nop,TS val 160797 ecr 4294914037,mptcp dss ack 2295998090 seq 3914500326 subseq 434113 len 1428 csum 0x7c9d], length 1428
10:53:24.726893 IP 112.26.3.8.41425 > 112.26.3.1.37753: Flags [.], ack 435541, win 24422, options [nop,nop,TS val 4294914619 ecr 160797,mptcp dss ack 3914486046], length 0
10:53:24.728519 IP 112.26.3.8.41425 > 112.26.3.1.37753: Flags [.], ack 435541, win 24422, options [nop,nop,TS val 4294914619 ecr 160797,mptcp dss ack 3914486046], length 0
10:53:24.764298 IP 112.26.3.1.37753 > 112.26.3.8.41425: Flags [.], seq 435541:436969, ack 1, win 893, options [nop,nop,TS val 160797 ecr 4294914037,mptcp dss ack 2295998090 seq 3914501754 subseq 435541 len 1428 csum 0x5f0c], length 1428
10:53:24.764650 IP 112.26.3.1.37753 > 112.26.3.8.41425: Flags [.], seq 435541:436969, ack 1, win 893, options [nop,nop,TS val 160797 ecr 4294914037,mptcp dss ack 2295998090 seq 3914501754 subseq 435541 len 1428 csum 0x5f0c], length 1428
10:53:24.836302 IP 112.26.3.1.37753 > 112.26.3.8.41425: Flags [.], seq 436969:438397, ack 1, win 893, options [nop,nop,TS val 160907 ecr 4294914154,mptcp dss ack 2295998090 seq 3914508894 subseq 436969 len 1428 csum 0x5bb3], length 1428
10:53:24.836656 IP 112.26.3.1.37753 > 112.26.3.8.41425: Flags [.], seq 436969:438397, ack 1, win 893, options [nop,nop,TS val 160907 ecr 4294914154,mptcp dss ack 2295998090 seq 3914508894 subseq 436969 len 1428 csum 0x5bb3], length 1428
10:53:24.860205 IP 112.26.3.8.41425 > 112.26.3.1.37753: Flags [.], ack 436969, win 24419, options [nop,nop,TS val 4294914752 ecr 160797,mptcp dss ack 3914491758], length 0
10:53:24.862766 IP 112.26.3.8.41425 > 112.26.3.1.37753: Flags [.], ack 436969, win 24419, options [nop,nop,TS val 4294914752 ecr 160797,mptcp dss ack 3914491758], length 0
10:53:24.951488 IP 112.26.3.1.37753 > 112.26.3.8.41425: Flags [.], seq 438397:439825, ack 1, win 893, options [nop,nop,TS val 161067 ecr 4294914258,mptcp dss ack 2295998090 seq 3914521746 subseq 438397 len 1428 csum 0xbbc4], length 1428
10:53:24.951830 IP 112.26.3.1.37753 > 112.26.3.8.41425: Flags [.], seq 438397:439825, ack 1, win 893, options [nop,nop,TS val 161067 ecr 4294914258,mptcp dss ack 2295998090 seq 3914521746 subseq 438397 len 1428 csum 0xbbc4], length 1428
10:53:24.966927 IP 112.26.3.8.41425 > 112.26.3.1.37753: Flags [.], ack 438397, win 24397, options [nop,nop,TS val 4294914859 ecr 160907,mptcp dss ack 3914493186], length 0
10:53:24.974043 IP 112.26.3.8.41425 > 112.26.3.1.37753: Flags [.], ack 438397, win 24397, options [nop,nop,TS val 4294914859 ecr 160907,mptcp dss ack 3914493186], length 0
10:53:25.041017 IP 112.26.3.1.37753 > 112.26.3.8.41425: Flags [.], seq 439825:441253, ack 1, win 893, options [nop,nop,TS val 161169 ecr 4294914385,mptcp dss ack 2295998090 seq 3914523174 subseq 439825 len 1428 csum 0x1b7c], length 1428
10:53:25.041276 IP 112.26.3.1.37753 > 112.26.3.8.41425: Flags [.], seq 439825:441253, ack 1, win 893, options [nop,nop,TS val 161169 ecr 4294914385,mptcp dss ack 2295998090 seq 3914523174 subseq 439825 len 1428 csum 0x1b7c], length 1428
10:53:25.066382 IP 112.26.3.8.41425 > 112.26.3.1.37753: Flags [.], ack 439825, win 24442, options [nop,nop,TS val 4294914955 ecr 161067,mptcp dss ack 3914504610], length 0
10:53:25.108116 IP 112.26.3.8.41425 > 112.26.3.1.37753: Flags [.], ack 439825, win 24442, options [nop,nop,TS val 4294914955 ecr 161067,mptcp dss ack 3914504610], length 0
10:53:25.151220 IP 112.26.3.1.37753 > 112.26.3.8.41425: Flags [.], seq 441253:442681, ack 1, win 893, options [nop,nop,TS val 161259 ecr 4294914497,mptcp dss ack 2295998090 seq 3914533170 subseq 441253 len 1428 csum 0xbb95], length 1428
10:53:25.151525 IP 112.26.3.1.37753 > 112.26.3.8.41425: Flags [.], seq 441253:442681, ack 1, win 893, options [nop,nop,TS val 161259 ecr 4294914497,mptcp dss ack 2295998090 seq 3914533170 subseq 441253 len 1428 csum 0xbb95], length 1428
10:53:25.214034 IP 112.26.3.8.41425 > 112.26.3.1.37753: Flags [.], ack 441253, win 24420, options [nop,nop,TS val 4294915105 ecr 161169,mptcp dss ack 3914506038], length 0
10:53:25.216923 IP 112.26.3.8.41425 > 112.26.3.1.37753: Flags [.], ack 441253, win 24420, options [nop,nop,TS val 4294915105 ecr 161169,mptcp dss ack 3914506038], length 0
10:53:25.271566 IP 112.26.3.1.37753 > 112.26.3.8.41425: Flags [.], seq 442681:444109, ack 1, win 893, options [nop,nop,TS val 161387 ecr 4294914619,mptcp dss ack 2295998090 seq 3914540310 subseq 442681 len 1428 csum 0x178e], length 1428
10:53:25.271859 IP 112.26.3.1.37753 > 112.26.3.8.41425: Flags [.], seq 442681:444109, ack 1, win 893, options [nop,nop,TS val 161387 ecr 4294914619,mptcp dss ack 2295998090 seq 3914540310 subseq 442681 len 1428 csum 0x178e], length 1428
10:53:25.341925 IP 112.26.3.8.41425 > 112.26.3.1.37753: Flags [.], ack 444109, win 24396, options [nop,nop,TS val 4294915215 ecr 161259,mptcp dss ack 3914514606], length 0
10:53:25.344189 IP 112.26.3.8.41425 > 112.26.3.1.37753: Flags [.], ack 444109, win 24396, options [nop,nop,TS val 4294915215 ecr 161259,mptcp dss ack 3914514606], length 0
10:53:25.395751 IP 112.26.3.1.37753 > 112.26.3.8.41425: Flags [.], seq 444109:445537, ack 1, win 893, options [nop,nop,TS val 161519 ecr 4294914752,mptcp dss ack 2295998090 seq 3914553162 subseq 444109 len 1428 csum 0x95af], length 1428
10:53:25.396098 IP 112.26.3.1.37753 > 112.26.3.8.41425: Flags [.], seq 444109:445537, ack 1, win 893, options [nop,nop,TS val 161519 ecr 4294914752,mptcp dss ack 2295998090 seq 3914553162 subseq 444109 len 1428 csum 0x95af], length 1428
10:53:25.504076 IP 112.26.3.1.37753 > 112.26.3.8.41425: Flags [.], seq 445537:446965, ack 1, win 893, options [nop,nop,TS val 161617 ecr 4294914859,mptcp dss ack 2295998090 seq 3914557446 subseq 445537 len 1428 csum 0xea58], length 1428
10:53:25.504311 IP 112.26.3.1.37753 > 112.26.3.8.41425: Flags [.], seq 445537:446965, ack 1, win 893, options [nop,nop,TS val 161617 ecr 4294914859,mptcp dss ack 2295998090 seq 3914557446 subseq 445537 len 1428 csum 0xea58], length 1428
10:53:25.529025 IP 112.26.3.8.41425 > 112.26.3.1.37753: Flags [.], ack 446965, win 24356, options [nop,nop,TS val 4294915418 ecr 161519,mptcp dss ack 3914517462], length 0
10:53:25.530280 IP 112.26.3.8.41425 > 112.26.3.1.37753: Flags [.], ack 446965, win 24356, options [nop,nop,TS val 4294915418 ecr 161519,mptcp dss ack 3914517462], length 0
