10:52:36.312994 IP 112.26.0.8.47540 > 112.26.0.1.37753: Flags [S], seq 1638377377, win 65535, options [mss 1460,sackOK,TS val 4294864994 ecr 0,nop,wscale 6,mptcp capable csum {0x387d1706caeff15f}], length 0
10:52:36.326130 IP 112.26.0.8.47540 > 112.26.0.1.37753: Flags [S], seq 1638377377, win 65535, options [mss 1460,sackOK,TS val 4294864994 ecr 0,nop,wscale 6,mptcp capable csum {0x387d1706caeff15f}], length 0
10:52:36.422499 IP 112.26.0.8.47540 > 112.26.0.1.37753: Flags [S], seq 1638377377, win 65535, options [mss 1460,sackOK,TS val 4294864994 ecr 0,nop,wscale 6,mptcp capable csum {0x387d1706caeff15f}], length 0
10:52:36.623520 IP 112.26.0.1.37753 > 112.26.0.8.47540: Flags [S.], seq 328085945, ack 1638377378, win 28560, options [mss 1460,sackOK,TS val 113064 ecr 4294864994,nop,wscale 7,mptcp capable csum {0xa9600d5f0da32383}], length 0
10:52:36.630708 IP 112.26.0.1.37753 > 112.26.0.8.47540: Flags [S.], seq 328085945, ack 1638377378, win 28560, options [mss 1460,sackOK,TS val 113064 ecr 4294864994,nop,wscale 7,mptcp capable csum {0xa9600d5f0da32383}], length 0
10:52:36.633174 IP 112.26.0.8.47540 > 112.26.0.1.37753: Flags [.], ack 1, win 1369, options [nop,nop,TS val 4294866524 ecr 113064,mptcp capable csum {0x387d1706caeff15f,0xa9600d5f0da32383},mptcp dss ack 3912698378], length 0
10:52:36.641189 IP 112.26.0.8.47540 > 112.26.0.1.37753: Flags [.], ack 1, win 1369, options [nop,nop,TS val 4294866524 ecr 113064,mptcp add-addr id 3 112.26.1.8,mptcp dss ack 3912698378], length 0
10:53:01.188736 IP 112.26.0.1.37753 > 112.26.0.8.47540: Flags [.], seq 262565:263993, ack 1, win 893, options [nop,nop,TS val 137359 ecr 4294889836,mptcp dss ack 2295998090 seq 3913470738 subseq 262565 len 1428 csum 0xc11], length 1428
10:53:01.201218 IP 112.26.0.1.37753 > 112.26.0.8.47540: Flags [.], seq 265421:266849, ack 1, win 893, options [nop,nop,TS val 137494 ecr 4294889951,mptcp dss ack 2295998090 seq 3913480734 subseq 265421 len 1428 csum 0xaf11], length 1428
10:53:01.212384 IP 112.26.0.8.47540 > 112.26.0.1.37753: Flags [.], ack 263993, win 24422, options [nop,nop,TS val 4294891083 ecr 137359,mptcp dss ack 3913399338], length 0
10:53:01.212682 IP 112.26.0.8.47540 > 112.26.0.1.37753: Flags [.], ack 263993, win 24422, options [nop,nop,TS val 4294891083 ecr 137359,mptcp dss ack 3913399338], length 0
10:53:01.246109 IP 112.26.0.8.47540 > 112.26.0.1.37753: Flags [.], ack 256853, win 24422, options [nop,nop,TS val 4294890339 ecr 136572,mptcp dss ack 3913399338], length 0
10:53:01.319619 IP 112.26.0.1.37753 > 112.26.0.8.47540: Flags [.], seq 266849:268277, ack 1, win 893, options [nop,nop,TS val 137620 ecr 4294890064,mptcp dss ack 2295998090 seq 3913487874 subseq 266849 len 1428 csum 0xedbd], length 1428
10:53:14.642005 IP 112.26.0.1.37753 > 112.26.0.8.47540: Flags [.], seq 402509:403937, ack 1, win 893, options [nop,nop,TS val 150553 ecr 4294903460,mptcp dss ack 2295998090 seq 3913980534 subseq 402509 len 1428 csum 0x5289], length 1428
10:53:14.688751 IP 112.26.0.8.47540 > 112.26.0.1.37753: Flags [.], ack 391085, win 24151, options [nop,nop,TS val 4294904104 ecr 147969,nop,nop,sack 2 {411077:413933}{403937:409649},mptcp dss ack 3913957686], length 0
10:53:14.701131 IP 112.26.0.1.37753 > 112.26.0.8.47540: Flags [.], seq 402509:403937, ack 1, win 893, options [nop,nop,TS val 150553 ecr 4294903460,mptcp dss ack 2295998090 seq 3913980534 subseq 402509 len 1428 csum 0x5289], length 1428
10:53:14.704334 IP 112.26.0.8.47540 > 112.26.0.1.37753: Flags [.], ack 409649, win 23828, options [nop,nop,TS val 4294904595 ecr 150553,nop,nop,sack 1 {411077:415361},mptcp dss ack 3914007666], length 0
10:53:14.704534 IP 112.26.0.8.47540 > 112.26.0.1.37753: Flags [.], ack 409649, win 23828, options [nop,nop,TS val 4294904595 ecr 150553,nop,nop,sack 1 {411077:415361},mptcp dss ack 3914007666], length 0
10:53:14.762736 IP 112.26.0.8.47540 > 112.26.0.1.37753: Flags [.], ack 392513, win 24129, options [nop,nop,TS val 4294904224 ecr 149574,nop,nop,sack 2 {411077:413933}{403937:409649},mptcp dss ack 3913959114], length 0
10:53:14.880639 IP 112.26.0.8.47540 > 112.26.0.1.37753: Flags [.], ack 409649, win 24112, options [nop,nop,TS val 4294904759 ecr 150553,nop,nop,sack 2 {416789:418217}{411077:415361},mptcp dss ack 3914007666], length 0
10:53:14.880872 IP 112.26.0.8.47540 > 112.26.0.1.37753: Flags [.], ack 409649, win 24112, options [nop,nop,TS val 4294904759 ecr 150553,nop,nop,sack 2 {416789:418217}{411077:415361},mptcp dss ack 3914007666], length 0
10:53:14.885685 IP 112.26.0.1.37753 > 112.26.0.8.47540: Flags [.], seq 416789:418217, ack 1, win 893, options [nop,nop,TS val 150757 ecr 4294903622,mptcp dss ack 2295998090 seq 3914070498 subseq 416789 len 1428 csum 0x2121], length 1428
10:53:14.921388 IP 112.26.0.1.37753 > 112.26.0.8.47540: Flags [.], seq 416789:418217, ack 1, win 893, options [nop,nop,TS val 150757 ecr 4294903622,mptcp dss ack 2295998090 seq 3914070498 subseq 416789 len 1428 csum 0x2121], length 1428
10:53:14.955867 IP 112.26.0.8.47540 > 112.26.0.1.37753: Flags [.], ack 402509, win 23795, options [nop,nop,TS val 4294904320 ecr 149707,nop,nop,sack 2 {411077:413933}{403937:409649},mptcp dss ack 3913980534], length 0
10:53:14.984799 IP 112.26.0.8.47540 > 112.26.0.1.37753: Flags [.], ack 402509, win 23958, options [nop,nop,TS val 4294904456 ecr 149707,nop,nop,sack 2 {411077:415361}{403937:409649},mptcp dss ack 3913980534], length 0
10:53:15.003993 IP 112.26.0.1.37753 > 112.26.0.8.47540: Flags [.], seq 418217:419645, ack 1, win 893, options [nop,nop,TS val 151055 ecr 4294903718,mptcp dss ack 2295998090 seq 3914079066 subseq 418217 len 1428 csum 0xbc67], length 1428
10:53:15.021866 IP 112.26.0.1.37753 > 112.26.0.8.47540: Flags [.], seq 418217:419645, ack 1, win 893, options [nop,nop,TS val 151055 ecr 4294903718,mptcp dss ack 2295998090 seq 3914079066 subseq 418217 len 1428 csum 0xbc67], length 1428
10:53:15.023994 IP 112.26.0.8.47540 > 112.26.0.1.37753: Flags [.], ack 409649, win 24112, options [nop,nop,TS val 4294904915 ecr 150553,nop,nop,sack 2 {416789:419645}{411077:415361},mptcp dss ack 3914007666], length 0
10:53:15.024172 IP 112.26.0.8.47540 > 112.26.0.1.37753: Flags [.], ack 409649, win 24112, options [nop,nop,TS val 4294904915 ecr 150553,nop,nop,sack 2 {416789:419645}{411077:415361},mptcp dss ack 3914007666], length 0
10:53:15.112351 IP 112.26.0.8.47540 > 112.26.0.1.37753: Flags [.], ack 409649, win 23828, options [nop,nop,TS val 4294904595 ecr 150553,nop,nop,sack 1 {411077:415361},mptcp dss ack 3914007666], length 0
10:53:15.205860 IP 112.26.0.8.47540 > 112.26.0.1.37753: Flags [.], ack 409649, win 24112, options [nop,nop,TS val 4294904759 ecr 150553,nop,nop,sack 2 {416789:418217}{411077:415361},mptcp dss ack 3914007666], length 0
10:53:15.291120 IP 112.26.0.1.37753 > 112.26.0.8.47540: Flags [.], seq 409649:411077, ack 1, win 893, options [nop,nop,TS val 151197 ecr 4294903992,mptcp dss ack 2295998090 seq 3914007666 subseq 409649 len 1428 csum 0xba26], length 1428
10:53:15.294962 IP 112.26.0.1.37753 > 112.26.0.8.47540: Flags [.], seq 409649:411077, ack 1, win 893, options [nop,nop,TS val 151197 ecr 4294903992,mptcp dss ack 2295998090 seq 3914007666 subseq 409649 len 1428 csum 0xba26], length 1428
10:53:15.298804 IP 112.26.0.8.47540 > 112.26.0.1.37753: Flags [.], ack 415361, win 23880, options [nop,nop,TS val 4294905188 ecr 151197,nop,nop,sack 1 {416789:419645},mptcp dss ack 3914040510], length 0
10:53:15.298983 IP 112.26.0.8.47540 > 112.26.0.1.37753: Flags [.], ack 415361, win 23880, options [nop,nop,TS val 4294905188 ecr 151197,nop,nop,sack 1 {416789:419645},mptcp dss ack 3914040510], length 0
10:53:15.376001 IP 112.26.0.8.47540 > 112.26.0.1.37753: Flags [.], ack 409649, win 24112, options [nop,nop,TS val 4294904915 ecr 150553,nop,nop,sack 2 {416789:419645}{411077:415361},mptcp dss ack 3914007666], length 0
10:53:15.405811 IP 112.26.0.1.37753 > 112.26.0.8.47540: Flags [.], seq 419645:421073, ack 1, win 893, options [nop,nop,TS val 151341 ecr 4294904104,mptcp dss ack 2295998090 seq 3914089062 subseq 419645 len 1428 csum 0xa78e], length 1428
10:53:15.413948 IP 112.26.0.8.47540 > 112.26.0.1.37753: Flags [.], ack 415361, win 24241, options [nop,nop,TS val 4294905300 ecr 151197,nop,nop,sack 1 {416789:421073},mptcp dss ack 3914040510], length 0
10:53:15.414129 IP 112.26.0.8.47540 > 112.26.0.1.37753: Flags [.], ack 415361, win 24241, options [nop,nop,TS val 4294905300 ecr 151197,nop,nop,sack 1 {416789:421073},mptcp dss ack 3914040510], length 0
10:53:15.420844 IP 112.26.0.1.37753 > 112.26.0.8.47540: Flags [.], seq 419645:421073, ack 1, win 893, options [nop,nop,TS val 151341 ecr 4294904104,mptcp dss ack 2295998090 seq 3914089062 subseq 419645 len 1428 csum 0xa78e], length 1428
10:53:15.524190 IP 112.26.0.8.47540 > 112.26.0.1.37753: Flags [.], ack 415361, win 23880, options [nop,nop,TS val 4294905188 ecr 151197,nop,nop,sack 1 {416789:419645},mptcp dss ack 3914040510], length 0
10:53:15.563186 IP 112.26.0.1.37753 > 112.26.0.8.47540: Flags [.], seq 421073:422501, ack 1, win 893, options [nop,nop,TS val 151404 ecr 4294904224,mptcp dss ack 2295998090 seq 3914096202 subseq 421073 len 1428 csum 0xe122], length 1428
10:53:15.581065 IP 112.26.0.8.47540 > 112.26.0.1.37753: Flags [.], ack 415361, win 24241, options [nop,nop,TS val 4294905457 ecr 151197,nop,nop,sack 1 {416789:422501},mptcp dss ack 3914040510], length 0
10:53:15.581248 IP 112.26.0.8.47540 > 112.26.0.1.37753: Flags [.], ack 415361, win 24241, options [nop,nop,TS val 4294905457 ecr 151197,nop,nop,sack 1 {416789:422501},mptcp dss ack 3914040510], length 0
10:53:15.583878 IP 112.26.0.1.37753 > 112.26.0.8.47540: Flags [.], seq 421073:422501, ack 1, win 893, options [nop,nop,TS val 151404 ecr 4294904224,mptcp dss ack 2295998090 seq 3914096202 subseq 421073 len 1428 csum 0xe122], length 1428
10:53:15.603494 IP 112.26.0.8.47540 > 112.26.0.1.37753: Flags [.], ack 415361, win 24241, options [nop,nop,TS val 4294905300 ecr 151197,nop,nop,sack 1 {416789:421073},mptcp dss ack 3914040510], length 0
10:53:15.623125 IP 112.26.0.1.37753 > 112.26.0.8.47540: Flags [.], seq 422501:423929, ack 1, win 893, options [nop,nop,TS val 151505 ecr 4294904320,mptcp dss ack 2295998090 seq 3914100486 subseq 422501 len 1428 csum 0xb463], length 1428
10:53:15.699842 IP 112.26.0.1.37753 > 112.26.0.8.47540: Flags [.], seq 422501:423929, ack 1, win 893, options [nop,nop,TS val 151505 ecr 4294904320,mptcp dss ack 2295998090 seq 3914100486 subseq 422501 len 1428 csum 0xb463], length 1428
10:53:15.701455 IP 112.26.0.8.47540 > 112.26.0.1.37753: Flags [.], ack 415361, win 24241, options [nop,nop,TS val 4294905593 ecr 151197,nop,nop,sack 1 {416789:423929},mptcp dss ack 3914040510], length 0
10:53:15.701645 IP 112.26.0.8.47540 > 112.26.0.1.37753: Flags [.], ack 415361, win 24241, options [nop,nop,TS val 4294905593 ecr 151197,nop,nop,sack 1 {416789:423929},mptcp dss ack 3914040510], length 0
10:53:15.767976 IP 112.26.0.8.47540 > 112.26.0.1.37753: Flags [.], ack 415361, win 24241, options [nop,nop,TS val 4294905457 ecr 151197,nop,nop,sack 1 {416789:422501},mptcp dss ack 3914040510], length 0
10:53:15.788908 IP 112.26.0.1.37753 > 112.26.0.8.47540: Flags [.], seq 423929:425357, ack 1, win 893, options [nop,nop,TS val 151657 ecr 4294904456,mptcp dss ack 2295998090 seq 3914107626 subseq 423929 len 1428 csum 0x14c1], length 1428
10:53:15.796763 IP 112.26.0.8.47540 > 112.26.0.1.37753: Flags [.], ack 415361, win 24241, options [nop,nop,TS val 4294905688 ecr 151197,nop,nop,sack 1 {416789:425357},mptcp dss ack 3914040510], length 0
10:53:15.796957 IP 112.26.0.8.47540 > 112.26.0.1.37753: Flags [.], ack 415361, win 24241, options [nop,nop,TS val 4294905688 ecr 151197,nop,nop,sack 1 {416789:425357},mptcp dss ack 3914040510], length 0
10:53:15.804969 IP 112.26.0.1.37753 > 112.26.0.8.47540: Flags [.], seq 423929:425357, ack 1, win 893, options [nop,nop,TS val 151657 ecr 4294904456,mptcp dss ack 2295998090 seq 3914107626 subseq 423929 len 1428 csum 0x14c1], length 1428
10:53:15.891673 IP 112.26.0.8.47540 > 112.26.0.1.37753: Flags [.], ack 415361, win 24241, options [nop,nop,TS val 4294905593 ecr 151197,nop,nop,sack 1 {416789:423929},mptcp dss ack 3914040510], length 0
10:53:15.975970 IP 112.26.0.8.47540 > 112.26.0.1.37753: Flags [.], ack 415361, win 24241, options [nop,nop,TS val 4294905688 ecr 151197,nop,nop,sack 1 {416789:425357},mptcp dss ack 3914040510], length 0
10:53:15.993363 IP 112.26.0.1.37753 > 112.26.0.8.47540: Flags [.], seq 415361:416789, ack 1, win 893, options [nop,nop,TS val 151754 ecr 4294904595,mptcp dss ack 2295998090 seq 3914040510 subseq 415361 len 1428 csum 0xe1af], length 1428
10:53:16.002199 IP 112.26.0.8.47540 > 112.26.0.1.37753: Flags [.], ack 425357, win 23973, options [nop,nop,TS val 4294905890 ecr 151754,mptcp dss ack 3914063358], length 0
10:53:16.002376 IP 112.26.0.8.47540 > 112.26.0.1.37753: Flags [.], ack 425357, win 23973, options [nop,nop,TS val 4294905890 ecr 151754,mptcp dss ack 3914063358], length 0
10:53:16.006058 IP 112.26.0.1.37753 > 112.26.0.8.47540: Flags [.], seq 415361:416789, ack 1, win 893, options [nop,nop,TS val 151754 ecr 4294904595,mptcp dss ack 2295998090 seq 3914040510 subseq 415361 len 1428 csum 0xe1af], length 1428
10:53:16.140546 IP 112.26.0.1.37753 > 112.26.0.8.47540: Flags [.], seq 425357:426785, ack 1, win 893, options [nop,nop,TS val 151754 ecr 4294904595,mptcp dss ack 2295998090 seq 3914113338 subseq 425357 len 1428 csum 0x7e85], length 1428
10:53:16.200282 IP 112.26.0.8.47540 > 112.26.0.1.37753: Flags [.], ack 425357, win 23973, options [nop,nop,TS val 4294905890 ecr 151754,mptcp dss ack 3914063358], length 0
10:53:16.235261 IP 112.26.0.1.37753 > 112.26.0.8.47540: Flags [.], seq 425357:426785, ack 1, win 893, options [nop,nop,TS val 151754 ecr 4294904595,mptcp dss ack 2295998090 seq 3914113338 subseq 425357 len 1428 csum 0x7e85], length 1428
10:53:16.240795 IP 112.26.0.8.47540 > 112.26.0.1.37753: Flags [.], ack 426785, win 24224, options [nop,nop,TS val 4294906129 ecr 151754,mptcp dss ack 3914063358], length 0
10:53:16.240971 IP 112.26.0.8.47540 > 112.26.0.1.37753: Flags [.], ack 426785, win 24224, options [nop,nop,TS val 4294906129 ecr 151754,mptcp dss ack 3914063358], length 0
10:53:16.273918 IP 112.26.0.1.37753 > 112.26.0.8.47540: Flags [.], seq 426785:428213, ack 1, win 893, options [nop,nop,TS val 151754 ecr 4294904595,mptcp dss ack 2295998090 seq 3914114766 subseq 426785 len 1428 csum 0x6f5c], length 1428
10:53:16.311620 IP 112.26.0.8.47540 > 112.26.0.1.37753: Flags [.], ack 426785, win 24224, options [nop,nop,TS val 4294906129 ecr 151754,mptcp dss ack 3914063358], length 0
10:53:16.337579 IP 112.26.0.1.37753 > 112.26.0.8.47540: Flags [.], seq 426785:428213, ack 1, win 893, options [nop,nop,TS val 151754 ecr 4294904595,mptcp dss ack 2295998090 seq 3914114766 subseq 426785 len 1428 csum 0x6f5c], length 1428
10:53:16.338347 IP 112.26.0.8.47540 > 112.26.0.1.37753: Flags [.], ack 428213, win 24224, options [nop,nop,TS val 4294906225 ecr 151754,mptcp dss ack 3914063358], length 0
10:53:16.338531 IP 112.26.0.8.47540 > 112.26.0.1.37753: Flags [.], ack 428213, win 24224, options [nop,nop,TS val 4294906225 ecr 151754,mptcp dss ack 3914063358], length 0
10:53:16.358250 IP 112.26.0.1.37753 > 112.26.0.8.47540: Flags [.], seq 428213:429641, ack 1, win 893, options [nop,nop,TS val 151884 ecr 4294904759,mptcp dss ack 2295998090 seq 3914120478 subseq 428213 len 1428 csum 0xa805], length 1428
10:53:16.412955 IP 112.26.0.1.37753 > 112.26.0.8.47540: Flags [.], seq 428213:429641, ack 1, win 893, options [nop,nop,TS val 151884 ecr 4294904759,mptcp dss ack 2295998090 seq 3914120478 subseq 428213 len 1428 csum 0xa805], length 1428
10:53:16.434207 IP 112.26.0.8.47540 > 112.26.0.1.37753: Flags [.], ack 429641, win 24224, options [nop,nop,TS val 4294906306 ecr 151884,mptcp dss ack 3914063358], length 0
10:53:16.434387 IP 112.26.0.8.47540 > 112.26.0.1.37753: Flags [.], ack 429641, win 24224, options [nop,nop,TS val 4294906306 ecr 151884,mptcp dss ack 3914063358], length 0
10:53:16.447030 IP 112.26.0.1.37753 > 112.26.0.8.47540: Flags [.], seq 429641:431069, ack 1, win 893, options [nop,nop,TS val 152030 ecr 4294904915,mptcp dss ack 2295998090 seq 3914129046 subseq 429641 len 1428 csum 0x7708], length 1428
10:53:16.479630 IP 112.26.0.8.47540 > 112.26.0.1.37753: Flags [.], ack 428213, win 24224, options [nop,nop,TS val 4294906225 ecr 151754,mptcp dss ack 3914063358], length 0
10:53:16.509190 IP 112.26.0.1.37753 > 112.26.0.8.47540: Flags [.], seq 431069:432497, ack 1, win 893, options [nop,nop,TS val 152165 ecr 4294905188,mptcp dss ack 2295998090 seq 3914134758 subseq 431069 len 1428 csum 0x6d51], length 1428
10:53:16.554152 IP 112.26.0.1.37753 > 112.26.0.8.47540: Flags [.], seq 429641:431069, ack 1, win 893, options [nop,nop,TS val 152030 ecr 4294904915,mptcp dss ack 2295998090 seq 3914129046 subseq 429641 len 1428 csum 0x7708], length 1428
10:53:16.568432 IP 112.26.0.8.47540 > 112.26.0.1.37753: Flags [.], ack 431069, win 24224, options [nop,nop,TS val 4294906447 ecr 152030,mptcp dss ack 3914063358], length 0
10:53:16.568613 IP 112.26.0.8.47540 > 112.26.0.1.37753: Flags [.], ack 431069, win 24224, options [nop,nop,TS val 4294906447 ecr 152030,mptcp dss ack 3914063358], length 0
10:53:16.572865 IP 112.26.0.8.47540 > 112.26.0.1.37753: Flags [.], ack 429641, win 24224, options [nop,nop,TS val 4294906306 ecr 151884,mptcp dss ack 3914063358], length 0
10:53:16.630425 IP 112.26.0.1.37753 > 112.26.0.8.47540: Flags [.], seq 431069:432497, ack 1, win 893, options [nop,nop,TS val 152165 ecr 4294905188,mptcp dss ack 2295998090 seq 3914134758 subseq 431069 len 1428 csum 0x6d51], length 1428
10:53:16.657554 IP 112.26.0.8.47540 > 112.26.0.1.37753: Flags [.], ack 432497, win 24224, options [nop,nop,TS val 4294906524 ecr 152165,mptcp dss ack 3914063358], length 0
10:53:16.657755 IP 112.26.0.8.47540 > 112.26.0.1.37753: Flags [.], ack 432497, win 24224, options [nop,nop,TS val 4294906524 ecr 152165,mptcp dss ack 3914063358], length 0
10:53:16.661648 IP 112.26.0.1.37753 > 112.26.0.8.47540: Flags [.], seq 432497:433925, ack 1, win 893, options [nop,nop,TS val 152298 ecr 4294905300,mptcp dss ack 2295998090 seq 3914137614 subseq 432497 len 1428 csum 0x69fc], length 1428
10:53:16.668070 IP 112.26.0.8.47540 > 112.26.0.1.37753: Flags [.], ack 431069, win 24224, options [nop,nop,TS val 4294906447 ecr 152030,mptcp dss ack 3914063358], length 0
10:53:16.737155 IP 112.26.0.8.47540 > 112.26.0.1.37753: Flags [.], ack 432497, win 24224, options [nop,nop,TS val 4294906524 ecr 152165,mptcp dss ack 3914063358], length 0
10:53:16.745353 IP 112.26.0.1.37753 > 112.26.0.8.47540: Flags [.], seq 432497:433925, ack 1, win 893, options [nop,nop,TS val 152298 ecr 4294905300,mptcp dss ack 2295998090 seq 3914137614 subseq 432497 len 1428 csum 0x69fc], length 1428
10:53:16.749373 IP 112.26.0.8.47540 > 112.26.0.1.37753: Flags [.], ack 433925, win 24224, options [nop,nop,TS val 4294906639 ecr 152298,mptcp dss ack 3914063358], length 0
10:53:16.749589 IP 112.26.0.8.47540 > 112.26.0.1.37753: Flags [.], ack 433925, win 24224, options [nop,nop,TS val 4294906639 ecr 152298,mptcp dss ack 3914063358], length 0
10:53:16.820242 IP 112.26.0.1.37753 > 112.26.0.8.47540: Flags [.], seq 435353:436781, ack 1, win 893, options [nop,nop,TS val 152712 ecr 4294905688,mptcp dss ack 2295998090 seq 3914153322 subseq 435353 len 1428 csum 0xbbf5], length 1428
10:53:16.835975 IP 112.26.0.8.47540 > 112.26.0.1.37753: Flags [.], ack 433925, win 24224, options [nop,nop,TS val 4294906639 ecr 152298,mptcp dss ack 3914063358], length 0
10:53:16.853988 IP 112.26.0.1.37753 > 112.26.0.8.47540: Flags [.], seq 435353:436781, ack 1, win 893, options [nop,nop,TS val 152712 ecr 4294905688,mptcp dss ack 2295998090 seq 3914153322 subseq 435353 len 1428 csum 0xbbf5], length 1428
10:53:16.874151 IP 112.26.0.8.47540 > 112.26.0.1.37753: Flags [.], ack 433925, win 24092, options [nop,nop,TS val 4294906747 ecr 152298,nop,nop,sack 1 {435353:436781},mptcp dss ack 3914080494], length 0
10:53:16.874320 IP 112.26.0.8.47540 > 112.26.0.1.37753: Flags [.], ack 433925, win 24092, options [nop,nop,TS val 4294906747 ecr 152298,nop,nop,sack 1 {435353:436781},mptcp dss ack 3914080494], length 0
10:53:16.895484 IP 112.26.0.8.47540 > 112.26.0.1.37753: Flags [.], ack 433925, win 24092, options [nop,nop,TS val 4294906747 ecr 152298,nop,nop,sack 1 {435353:436781},mptcp dss ack 3914080494], length 0
10:53:16.941410 IP 112.26.0.1.37753 > 112.26.0.8.47540: Flags [.], seq 436781:438209, ack 1, win 893, options [nop,nop,TS val 152841 ecr 4294905890,mptcp dss ack 2295998090 seq 3914160462 subseq 436781 len 1428 csum 0xcde2], length 1428
10:53:16.957501 IP 112.26.0.1.37753 > 112.26.0.8.47540: Flags [.], seq 436781:438209, ack 1, win 893, options [nop,nop,TS val 152841 ecr 4294905890,mptcp dss ack 2295998090 seq 3914160462 subseq 436781 len 1428 csum 0xcde2], length 1428
10:53:16.991258 IP 112.26.0.8.47540 > 112.26.0.1.37753: Flags [.], ack 433925, win 24159, options [nop,nop,TS val 4294906852 ecr 152298,nop,nop,sack 1 {435353:438209},mptcp dss ack 3914091918], length 0
10:53:16.991459 IP 112.26.0.8.47540 > 112.26.0.1.37753: Flags [.], ack 433925, win 24159, options [nop,nop,TS val 4294906852 ecr 152298,nop,nop,sack 1 {435353:438209},mptcp dss ack 3914091918], length 0
10:53:17.015512 IP 112.26.0.8.47540 > 112.26.0.1.37753: Flags [.], ack 433925, win 24159, options [nop,nop,TS val 4294906852 ecr 152298,nop,nop,sack 1 {435353:438209},mptcp dss ack 3914091918], length 0
10:53:17.054170 IP 112.26.0.1.37753 > 112.26.0.8.47540: Flags [.], seq 438209:439637, ack 1, win 893, options [nop,nop,TS val 153200 ecr 4294906306,mptcp dss ack 2295998090 seq 3914166174 subseq 438209 len 1428 csum 0x391d], length 1428
10:53:17.104037 IP 112.26.0.1.37753 > 112.26.0.8.47540: Flags [.], seq 438209:439637, ack 1, win 893, options [nop,nop,TS val 153200 ecr 4294906306,mptcp dss ack 2295998090 seq 3914166174 subseq 438209 len 1428 csum 0x391d], length 1428
10:53:17.110581 IP 112.26.0.8.47540 > 112.26.0.1.37753: Flags [.], ack 433925, win 24216, options [nop,nop,TS val 4294906998 ecr 152298,nop,nop,sack 1 {435353:439637},mptcp dss ack 3914106198], length 0
10:53:17.110759 IP 112.26.0.8.47540 > 112.26.0.1.37753: Flags [.], ack 433925, win 24216, options [nop,nop,TS val 4294906998 ecr 152298,nop,nop,sack 1 {435353:439637},mptcp dss ack 3914106198], length 0
10:53:17.124885 IP 112.26.0.8.47540 > 112.26.0.1.37753: Flags [.], ack 433925, win 24216, options [nop,nop,TS val 4294906998 ecr 152298,nop,nop,sack 1 {435353:439637},mptcp dss ack 3914106198], length 0
10:53:17.190968 IP 112.26.0.1.37753 > 112.26.0.8.47540: Flags [.], seq 439637:441065, ack 1, win 893, options [nop,nop,TS val 153309 ecr 4294906447,mptcp dss ack 2295998090 seq 3914174742 subseq 439637 len 1428 csum 0x1cc4], length 1428
10:53:17.252787 IP 112.26.0.1.37753 > 112.26.0.8.47540: Flags [.], seq 439637:441065, ack 1, win 893, options [nop,nop,TS val 153309 ecr 4294906447,mptcp dss ack 2295998090 seq 3914174742 subseq 439637 len 1428 csum 0x1cc4], length 1428
10:53:17.254463 IP 112.26.0.8.47540 > 112.26.0.1.37753: Flags [.], ack 433925, win 24216, options [nop,nop,TS val 4294907147 ecr 152298,nop,nop,sack 1 {435353:441065},mptcp dss ack 3914106198], length 0
10:53:17.254665 IP 112.26.0.8.47540 > 112.26.0.1.37753: Flags [.], ack 433925, win 24216, options [nop,nop,TS val 4294907147 ecr 152298,nop,nop,sack 1 {435353:441065},mptcp dss ack 3914106198], length 0
10:53:17.270006 IP 112.26.0.8.47540 > 112.26.0.1.37753: Flags [.], ack 433925, win 24216, options [nop,nop,TS val 4294907147 ecr 152298,nop,nop,sack 1 {435353:441065},mptcp dss ack 3914106198], length 0
10:53:17.292927 IP 112.26.0.1.37753 > 112.26.0.8.47540: Flags [.], seq 441065:442493, ack 1, win 893, options [nop,nop,TS val 153378 ecr 4294906524,mptcp dss ack 2295998090 seq 3914177598 subseq 441065 len 1428 csum 0xa2ba], length 1428
10:53:17.357837 IP 112.26.0.1.37753 > 112.26.0.8.47540: Flags [.], seq 441065:442493, ack 1, win 893, options [nop,nop,TS val 153378 ecr 4294906524,mptcp dss ack 2295998090 seq 3914177598 subseq 441065 len 1428 csum 0xa2ba], length 1428
10:53:17.377136 IP 112.26.0.8.47540 > 112.26.0.1.37753: Flags [.], ack 433925, win 24216, options [nop,nop,TS val 4294907247 ecr 152298,nop,nop,sack 1 {435353:442493},mptcp dss ack 3914106198], length 0
10:53:17.377337 IP 112.26.0.8.47540 > 112.26.0.1.37753: Flags [.], ack 433925, win 24216, options [nop,nop,TS val 4294907247 ecr 152298,nop,nop,sack 1 {435353:442493},mptcp dss ack 3914106198], length 0
10:53:17.404279 IP 112.26.0.8.47540 > 112.26.0.1.37753: Flags [.], ack 433925, win 24216, options [nop,nop,TS val 4294907247 ecr 152298,nop,nop,sack 1 {435353:442493},mptcp dss ack 3914106198], length 0
10:53:17.432320 IP 112.26.0.1.37753 > 112.26.0.8.47540: Flags [.], seq 442493:443921, ack 1, win 893, options [nop,nop,TS val 153477 ecr 4294906639,mptcp dss ack 2295998090 seq 3914180454 subseq 442493 len 1428 csum 0xe2ec], length 1428
10:53:17.439859 IP 112.26.0.1.37753 > 112.26.0.8.47540: Flags [.], seq 442493:443921, ack 1, win 893, options [nop,nop,TS val 153477 ecr 4294906639,mptcp dss ack 2295998090 seq 3914180454 subseq 442493 len 1428 csum 0xe2ec], length 1428
10:53:17.471717 IP 112.26.0.8.47540 > 112.26.0.1.37753: Flags [.], ack 433925, win 24216, options [nop,nop,TS val 4294907334 ecr 152298,nop,nop,sack 1 {435353:443921},mptcp dss ack 3914106198], length 0
10:53:17.471851 IP 112.26.0.8.47540 > 112.26.0.1.37753: Flags [.], ack 433925, win 24216, options [nop,nop,TS val 4294907334 ecr 152298,nop,nop,sack 1 {435353:443921},mptcp dss ack 3914106198], length 0
10:53:17.516764 IP 112.26.0.1.37753 > 112.26.0.8.47540: Flags [.], seq 443921:445349, ack 1, win 893, options [nop,nop,TS val 153564 ecr 4294906747,mptcp dss ack 2295998090 seq 3914184738 subseq 443921 len 1428 csum 0xac1c], length 1428
10:53:17.552498 IP 112.26.0.8.47540 > 112.26.0.1.37753: Flags [.], ack 433925, win 24216, options [nop,nop,TS val 4294907334 ecr 152298,nop,nop,sack 1 {435353:443921},mptcp dss ack 3914106198], length 0
10:53:17.591207 IP 112.26.0.1.37753 > 112.26.0.8.47540: Flags [.], seq 443921:445349, ack 1, win 893, options [nop,nop,TS val 153564 ecr 4294906747,mptcp dss ack 2295998090 seq 3914184738 subseq 443921 len 1428 csum 0xac1c], length 1428
10:53:17.593980 IP 112.26.0.8.47540 > 112.26.0.1.37753: Flags [.], ack 433925, win 24216, options [nop,nop,TS val 4294907485 ecr 152298,nop,nop,sack 1 {435353:445349},mptcp dss ack 3914106198], length 0
10:53:17.594190 IP 112.26.0.8.47540 > 112.26.0.1.37753: Flags [.], ack 433925, win 24216, options [nop,nop,TS val 4294907485 ecr 152298,nop,nop,sack 1 {435353:445349},mptcp dss ack 3914106198], length 0
10:53:17.635603 IP 112.26.0.1.37753 > 112.26.0.8.47540: Flags [.], seq 445349:446777, ack 1, win 893, options [nop,nop,TS val 153684 ecr 4294906852,mptcp dss ack 2295998090 seq 3914190450 subseq 445349 len 1428 csum 0x4805], length 1428
10:53:17.701331 IP 112.26.0.1.37753 > 112.26.0.8.47540: Flags [.], seq 433925:435353, ack 1, win 893, options [nop,nop,TS val 153757 ecr 4294906998,mptcp dss ack 2295998090 seq 3914141898 subseq 433925 len 1428 csum 0x4f3c], length 1428
10:53:17.706171 IP 112.26.0.1.37753 > 112.26.0.8.47540: Flags [.], seq 445349:446777, ack 1, win 893, options [nop,nop,TS val 153684 ecr 4294906852,mptcp dss ack 2295998090 seq 3914190450 subseq 445349 len 1428 csum 0x4805], length 1428
10:53:17.725272 IP 112.26.0.8.47540 > 112.26.0.1.37753: Flags [.], ack 433925, win 24216, options [nop,nop,TS val 4294907600 ecr 152298,nop,nop,sack 1 {435353:446777},mptcp dss ack 3914106198], length 0
10:53:17.725440 IP 112.26.0.8.47540 > 112.26.0.1.37753: Flags [.], ack 433925, win 24216, options [nop,nop,TS val 4294907600 ecr 152298,nop,nop,sack 1 {435353:446777},mptcp dss ack 3914106198], length 0
10:53:17.788886 IP 112.26.0.1.37753 > 112.26.0.8.47540: Flags [.], seq 433925:435353, ack 1, win 893, options [nop,nop,TS val 153757 ecr 4294906998,mptcp dss ack 2295998090 seq 3914141898 subseq 433925 len 1428 csum 0x4f3c], length 1428
10:53:17.794393 IP 112.26.0.8.47540 > 112.26.0.1.37753: Flags [.], ack 446777, win 24216, options [nop,nop,TS val 4294907683 ecr 153757,mptcp dss ack 3914106198], length 0
10:53:17.794537 IP 112.26.0.8.47540 > 112.26.0.1.37753: Flags [.], ack 446777, win 24216, options [nop,nop,TS val 4294907683 ecr 153757,mptcp dss ack 3914106198], length 0
10:53:17.828151 IP 112.26.0.1.37753 > 112.26.0.8.47540: Flags [.], seq 446777:448205, ack 1, win 893, options [nop,nop,TS val 153910 ecr 4294907147,mptcp dss ack 2295998090 seq 3914200446 subseq 446777 len 1428 csum 0x749c], length 1428
10:53:17.863800 IP 112.26.0.8.47540 > 112.26.0.1.37753: Flags [.], ack 433925, win 24216, options [nop,nop,TS val 4294907485 ecr 152298,nop,nop,sack 1 {435353:445349},mptcp dss ack 3914106198], length 0
10:53:17.896879 IP 112.26.0.1.37753 > 112.26.0.8.47540: Flags [.], seq 446777:448205, ack 1, win 893, options [nop,nop,TS val 153910 ecr 4294907147,mptcp dss ack 2295998090 seq 3914200446 subseq 446777 len 1428 csum 0x749c], length 1428
10:53:17.899701 IP 112.26.0.8.47540 > 112.26.0.1.37753: Flags [.], ack 448205, win 24216, options [nop,nop,TS val 4294907791 ecr 153910,mptcp dss ack 3914106198], length 0
10:53:17.899915 IP 112.26.0.8.47540 > 112.26.0.1.37753: Flags [.], ack 448205, win 24216, options [nop,nop,TS val 4294907791 ecr 153910,mptcp dss ack 3914106198], length 0
10:53:17.948721 IP 112.26.0.1.37753 > 112.26.0.8.47540: Flags [.], seq 448205:449633, ack 1, win 893, options [nop,nop,TS val 154526 ecr 4294907485,mptcp dss ack 2295998090 seq 3914219010 subseq 448205 len 1428 csum 0x26e3], length 1428
10:53:17.974078 IP 112.26.0.8.47540 > 112.26.0.1.37753: Flags [.], ack 433925, win 24216, options [nop,nop,TS val 4294907600 ecr 152298,nop,nop,sack 1 {435353:446777},mptcp dss ack 3914106198], length 0
10:53:18.048972 IP 112.26.0.1.37753 > 112.26.0.8.47540: Flags [.], seq 448205:449633, ack 1, win 893, options [nop,nop,TS val 154526 ecr 4294907485,mptcp dss ack 2295998090 seq 3914219010 subseq 448205 len 1428 csum 0x26e3], length 1428
10:53:18.051707 IP 112.26.0.8.47540 > 112.26.0.1.37753: Flags [.], ack 449633, win 24295, options [nop,nop,TS val 4294907943 ecr 154526,mptcp dss ack 3914167602], length 0
10:53:18.051904 IP 112.26.0.8.47540 > 112.26.0.1.37753: Flags [.], ack 449633, win 24295, options [nop,nop,TS val 4294907943 ecr 154526,mptcp dss ack 3914167602], length 0
10:53:18.106561 IP 112.26.0.8.47540 > 112.26.0.1.37753: Flags [.], ack 446777, win 24216, options [nop,nop,TS val 4294907683 ecr 153757,mptcp dss ack 3914106198], length 0
10:53:18.109316 IP 112.26.0.1.37753 > 112.26.0.8.47540: Flags [.], seq 449633:451061, ack 1, win 893, options [nop,nop,TS val 154624 ecr 4294907600,mptcp dss ack 2295998090 seq 3914229006 subseq 449633 len 1428 csum 0x8ce1], length 1428
10:53:18.156130 IP 112.26.0.1.37753 > 112.26.0.8.47540: Flags [.], seq 449633:451061, ack 1, win 893, options [nop,nop,TS val 154624 ecr 4294907600,mptcp dss ack 2295998090 seq 3914229006 subseq 449633 len 1428 csum 0x8ce1], length 1428
10:53:18.157557 IP 112.26.0.8.47540 > 112.26.0.1.37753: Flags [.], ack 451061, win 24295, options [nop,nop,TS val 4294908050 ecr 154624,mptcp dss ack 3914167602], length 0
10:53:18.157732 IP 112.26.0.8.47540 > 112.26.0.1.37753: Flags [.], ack 451061, win 24295, options [nop,nop,TS val 4294908050 ecr 154624,mptcp dss ack 3914167602], length 0
10:53:18.223174 IP 112.26.0.1.37753 > 112.26.0.8.47540: Flags [.], seq 451061:452489, ack 1, win 893, options [nop,nop,TS val 154748 ecr 4294907683,mptcp dss ack 2295998090 seq 3914234718 subseq 451061 len 1428 csum 0xdae2], length 1428
10:53:18.240345 IP 112.26.0.1.37753 > 112.26.0.8.47540: Flags [.], seq 451061:452489, ack 1, win 893, options [nop,nop,TS val 154748 ecr 4294907683,mptcp dss ack 2295998090 seq 3914234718 subseq 451061 len 1428 csum 0xdae2], length 1428
10:53:18.247403 IP 112.26.0.8.47540 > 112.26.0.1.37753: Flags [.], ack 452489, win 24295, options [nop,nop,TS val 4294908134 ecr 154748,mptcp dss ack 3914167602], length 0
10:53:18.247582 IP 112.26.0.8.47540 > 112.26.0.1.37753: Flags [.], ack 452489, win 24295, options [nop,nop,TS val 4294908134 ecr 154748,mptcp dss ack 3914167602], length 0
10:53:18.264331 IP 112.26.0.8.47540 > 112.26.0.1.37753: Flags [.], ack 448205, win 24216, options [nop,nop,TS val 4294907791 ecr 153910,mptcp dss ack 3914106198], length 0
10:53:18.419694 IP 112.26.0.1.37753 > 112.26.0.8.47540: Flags [.], seq 453917:455345, ack 1, win 893, options [nop,nop,TS val 155024 ecr 4294907943,mptcp dss ack 2295998090 seq 3914248998 subseq 453917 len 1428 csum 0xdff0], length 1428
10:53:18.432030 IP 112.26.0.8.47540 > 112.26.0.1.37753: Flags [.], ack 452489, win 24295, options [nop,nop,TS val 4294908313 ecr 154748,nop,nop,sack 1 {453917:455345},mptcp dss ack 3914167602], length 0
10:53:18.432240 IP 112.26.0.8.47540 > 112.26.0.1.37753: Flags [.], ack 452489, win 24295, options [nop,nop,TS val 4294908313 ecr 154748,nop,nop,sack 1 {453917:455345},mptcp dss ack 3914167602], length 0
10:53:18.445242 IP 112.26.0.8.47540 > 112.26.0.1.37753: Flags [.], ack 449633, win 24295, options [nop,nop,TS val 4294907943 ecr 154526,mptcp dss ack 3914167602], length 0
10:53:18.461166 IP 112.26.0.1.37753 > 112.26.0.8.47540: Flags [.], seq 453917:455345, ack 1, win 893, options [nop,nop,TS val 155024 ecr 4294907943,mptcp dss ack 2295998090 seq 3914248998 subseq 453917 len 1428 csum 0xdff0], length 1428
10:53:18.544060 IP 112.26.0.8.47540 > 112.26.0.1.37753: Flags [.], ack 451061, win 24295, options [nop,nop,TS val 4294908050 ecr 154624,mptcp dss ack 3914167602], length 0
10:53:18.564426 IP 112.26.0.1.37753 > 112.26.0.8.47540: Flags [.], seq 455345:456773, ack 1, win 893, options [nop,nop,TS val 155185 ecr 4294908050,mptcp dss ack 2295998090 seq 3914258994 subseq 455345 len 1428 csum 0xc0b], length 1428
10:53:18.571689 IP 112.26.0.1.37753 > 112.26.0.8.47540: Flags [.], seq 455345:456773, ack 1, win 893, options [nop,nop,TS val 155185 ecr 4294908050,mptcp dss ack 2295998090 seq 3914258994 subseq 455345 len 1428 csum 0xc0b], length 1428
10:53:18.607015 IP 112.26.0.8.47540 > 112.26.0.1.37753: Flags [.], ack 452489, win 24489, options [nop,nop,TS val 4294908465 ecr 154748,nop,nop,sack 1 {453917:456773},mptcp dss ack 3914211870], length 0
10:53:18.607217 IP 112.26.0.8.47540 > 112.26.0.1.37753: Flags [.], ack 452489, win 24489, options [nop,nop,TS val 4294908465 ecr 154748,nop,nop,sack 1 {453917:456773},mptcp dss ack 3914211870], length 0
10:53:18.655940 IP 112.26.0.8.47540 > 112.26.0.1.37753: Flags [.], ack 452489, win 24295, options [nop,nop,TS val 4294908134 ecr 154748,mptcp dss ack 3914167602], length 0
10:53:18.711381 IP 112.26.0.1.37753 > 112.26.0.8.47540: Flags [.], seq 456773:458201, ack 1, win 893, options [nop,nop,TS val 155185 ecr 4294908050,mptcp dss ack 2295998090 seq 3914260422 subseq 456773 len 1428 csum 0x44e3], length 1428
10:53:18.713697 IP 112.26.0.1.37753 > 112.26.0.8.47540: Flags [.], seq 456773:458201, ack 1, win 893, options [nop,nop,TS val 155185 ecr 4294908050,mptcp dss ack 2295998090 seq 3914260422 subseq 456773 len 1428 csum 0x44e3], length 1428
10:53:18.722459 IP 112.26.0.8.47540 > 112.26.0.1.37753: Flags [.], ack 452489, win 24467, options [nop,nop,TS val 4294908607 ecr 154748,nop,nop,sack 1 {453917:458201},mptcp dss ack 3914213298], length 0
10:53:18.722676 IP 112.26.0.8.47540 > 112.26.0.1.37753: Flags [.], ack 452489, win 24467, options [nop,nop,TS val 4294908607 ecr 154748,nop,nop,sack 1 {453917:458201},mptcp dss ack 3914213298], length 0
10:53:18.741902 IP 112.26.0.8.47540 > 112.26.0.1.37753: Flags [.], ack 452489, win 24295, options [nop,nop,TS val 4294908313 ecr 154748,nop,nop,sack 1 {453917:455345},mptcp dss ack 3914167602], length 0
10:53:18.832285 IP 112.26.0.1.37753 > 112.26.0.8.47540: Flags [.], seq 458201:459629, ack 1, win 893, options [nop,nop,TS val 155297 ecr 4294908134,mptcp dss ack 2295998090 seq 3914266134 subseq 458201 len 1428 csum 0x4180], length 1428
10:53:18.859984 IP 112.26.0.8.47540 > 112.26.0.1.37753: Flags [.], ack 452489, win 24489, options [nop,nop,TS val 4294908465 ecr 154748,nop,nop,sack 1 {453917:456773},mptcp dss ack 3914211870], length 0
10:53:18.877770 IP 112.26.0.8.47540 > 112.26.0.1.37753: Flags [.], ack 452489, win 24467, options [nop,nop,TS val 4294908770 ecr 154748,nop,nop,sack 1 {453917:459629},mptcp dss ack 3914213298], length 0
10:53:18.877973 IP 112.26.0.8.47540 > 112.26.0.1.37753: Flags [.], ack 452489, win 24467, options [nop,nop,TS val 4294908770 ecr 154748,nop,nop,sack 1 {453917:459629},mptcp dss ack 3914213298], length 0
10:53:18.882304 IP 112.26.0.1.37753 > 112.26.0.8.47540: Flags [.], seq 458201:459629, ack 1, win 893, options [nop,nop,TS val 155297 ecr 4294908134,mptcp dss ack 2295998090 seq 3914266134 subseq 458201 len 1428 csum 0x4180], length 1428
10:53:18.941949 IP 112.26.0.8.47540 > 112.26.0.1.37753: Flags [.], ack 452489, win 24467, options [nop,nop,TS val 4294908607 ecr 154748,nop,nop,sack 1 {453917:458201},mptcp dss ack 3914213298], length 0
10:53:18.965015 IP 112.26.0.1.37753 > 112.26.0.8.47540: Flags [.], seq 459629:461057, ack 1, win 893, options [nop,nop,TS val 155396 ecr 4294908313,mptcp dss ack 2295998090 seq 3914268990 subseq 459629 len 1428 csum 0xfe94], length 1428
10:53:19.018096 IP 112.26.0.1.37753 > 112.26.0.8.47540: Flags [.], seq 459629:461057, ack 1, win 893, options [nop,nop,TS val 155396 ecr 4294908313,mptcp dss ack 2295998090 seq 3914268990 subseq 459629 len 1428 csum 0xfe94], length 1428
10:53:19.019357 IP 112.26.0.8.47540 > 112.26.0.1.37753: Flags [.], ack 452489, win 24467, options [nop,nop,TS val 4294908911 ecr 154748,nop,nop,sack 1 {453917:461057},mptcp dss ack 3914213298], length 0
10:53:19.019564 IP 112.26.0.8.47540 > 112.26.0.1.37753: Flags [.], ack 452489, win 24467, options [nop,nop,TS val 4294908911 ecr 154748,nop,nop,sack 1 {453917:461057},mptcp dss ack 3914213298], length 0
10:53:19.077150 IP 112.26.0.8.47540 > 112.26.0.1.37753: Flags [.], ack 452489, win 24467, options [nop,nop,TS val 4294908770 ecr 154748,nop,nop,sack 1 {453917:459629},mptcp dss ack 3914213298], length 0
10:53:19.085944 IP 112.26.0.1.37753 > 112.26.0.8.47540: Flags [.], seq 461057:462485, ack 1, win 893, options [nop,nop,TS val 155538 ecr 4294908465,mptcp dss ack 2295998090 seq 3914277558 subseq 461057 len 1428 csum 0xe6c6], length 1428
10:53:19.163196 IP 112.26.0.1.37753 > 112.26.0.8.47540: Flags [.], seq 461057:462485, ack 1, win 893, options [nop,nop,TS val 155538 ecr 4294908465,mptcp dss ack 2295998090 seq 3914277558 subseq 461057 len 1428 csum 0xe6c6], length 1428
10:53:19.210539 IP 112.26.0.8.47540 > 112.26.0.1.37753: Flags [.], ack 452489, win 24467, options [nop,nop,TS val 4294908911 ecr 154748,nop,nop,sack 1 {453917:461057},mptcp dss ack 3914213298], length 0
10:53:19.235327 IP 112.26.0.1.37753 > 112.26.0.8.47540: Flags [.], seq 452489:453917, ack 1, win 893, options [nop,nop,TS val 155583 ecr 4294908607,mptcp dss ack 2295998090 seq 3914240430 subseq 452489 len 1428 csum 0xbc00], length 1428
10:53:19.274667 IP 112.26.0.8.47540 > 112.26.0.1.37753: Flags [.], ack 452489, win 24467, options [nop,nop,TS val 4294909057 ecr 154748,nop,nop,sack 1 {453917:462485},mptcp dss ack 3914213298], length 0
10:53:19.274871 IP 112.26.0.8.47540 > 112.26.0.1.37753: Flags [.], ack 452489, win 24467, options [nop,nop,TS val 4294909057 ecr 154748,nop,nop,sack 1 {453917:462485},mptcp dss ack 3914213298], length 0
10:53:19.356063 IP 112.26.0.1.37753 > 112.26.0.8.47540: Flags [.], seq 462485:463913, ack 1, win 893, options [nop,nop,TS val 155860 ecr 4294908911,mptcp dss ack 2295998090 seq 3914288982 subseq 462485 len 1428 csum 0x8007], length 1428
10:53:19.385365 IP 112.26.0.1.37753 > 112.26.0.8.47540: Flags [.], seq 452489:453917, ack 1, win 893, options [nop,nop,TS val 155583 ecr 4294908607,mptcp dss ack 2295998090 seq 3914240430 subseq 452489 len 1428 csum 0xbc00], length 1428
