10:52:36.313190 IP 112.26.0.8.47540 > 112.26.0.1.37753: Flags [S], seq 1638377377, win 65535, options [mss 1460,sackOK,TS val 4294864994 ecr 0,nop,wscale 6,mptcp capable csum {0x387d1706caeff15f}], length 0
10:52:36.324722 IP 112.26.0.8.47540 > 112.26.0.1.37753: Flags [S], seq 1638377377, win 65535, options [mss 1460,sackOK,TS val 4294864994 ecr 0,nop,wscale 6,mptcp capable csum {0x387d1706caeff15f}], length 0
10:52:36.422225 IP 112.26.0.8.47540 > 112.26.0.1.37753: Flags [S], seq 1638377377, win 65535, options [mss 1460,sackOK,TS val 4294864994 ecr 0,nop,wscale 6,mptcp capable csum {0x387d1706caeff15f}], length 0
10:52:36.623637 IP 112.26.0.1.37753 > 112.26.0.8.47540: Flags [S.], seq 328085945, ack 1638377378, win 28560, options [mss 1460,sackOK,TS val 113064 ecr 4294864994,nop,wscale 7,mptcp capable csum {0xa9600d5f0da32383}], length 0
10:52:36.623905 IP 112.26.0.1.37753 > 112.26.0.8.47540: Flags [S.], seq 328085945, ack 1638377378, win 28560, options [mss 1460,sackOK,TS val 113064 ecr 4294864994,nop,wscale 7,mptcp capable csum {0xa9600d5f0da32383}], length 0
10:52:36.633282 IP 112.26.0.8.47540 > 112.26.0.1.37753: Flags [.], ack 1, win 1369, options [nop,nop,TS val 4294866524 ecr 113064,mptcp capable csum {0x387d1706caeff15f,0xa9600d5f0da32383},mptcp dss ack 3912698378], length 0
10:52:36.633671 IP 112.26.0.8.47540 > 112.26.0.1.37753: Flags [.], ack 1, win 1369, options [nop,nop,TS val 4294866524 ecr 113064,mptcp capable csum {0x387d1706caeff15f,0xa9600d5f0da32383},mptcp dss ack 3912698378], length 0
10:53:01.200978 IP 112.26.0.1.37753 > 112.26.0.8.47540: Flags [.], seq 265421:266849, ack 1, win 893, options [nop,nop,TS val 137494 ecr 4294889951,mptcp dss ack 2295998090 seq 3913480734 subseq 265421 len 1428 csum 0xaf11], length 1428
10:53:01.201283 IP 112.26.0.1.37753 > 112.26.0.8.47540: Flags [.], seq 265421:266849, ack 1, win 893, options [nop,nop,TS val 137494 ecr 4294889951,mptcp dss ack 2295998090 seq 3913480734 subseq 265421 len 1428 csum 0xaf11], length 1428
10:53:01.212499 IP 112.26.0.8.47540 > 112.26.0.1.37753: Flags [.], ack 263993, win 24422, options [nop,nop,TS val 4294891083 ecr 137359,mptcp dss ack 3913399338], length 0
10:53:01.298590 IP 112.26.0.8.47540 > 112.26.0.1.37753: Flags [.], ack 258281, win 24422, options [nop,nop,TS val 4294890617 ecr 136946,mptcp dss ack 3913399338], length 0
10:53:01.314223 IP 112.26.0.1.37753 > 112.26.0.8.47540: Flags [.], seq 266849:268277, ack 1, win 893, options [nop,nop,TS val 137620 ecr 4294890064,mptcp dss ack 2295998090 seq 3913487874 subseq 266849 len 1428 csum 0xedbd], length 1428
10:53:01.314486 IP 112.26.0.1.37753 > 112.26.0.8.47540: Flags [.], seq 266849:268277, ack 1, win 893, options [nop,nop,TS val 137620 ecr 4294890064,mptcp dss ack 2295998090 seq 3913487874 subseq 266849 len 1428 csum 0xedbd], length 1428
10:53:01.332227 IP 112.26.0.8.47540 > 112.26.0.1.37753: Flags [.], ack 263993, win 24422, options [nop,nop,TS val 4294891224 ecr 137359,nop,nop,sack 1 {265421:266849},mptcp dss ack 3913399338], length 0
10:53:01.418951 IP 112.26.0.1.37753 > 112.26.0.8.47540: Flags [.], seq 268277:269705, ack 1, win 893, options [nop,nop,TS val 137620 ecr 4294890064,mptcp dss ack 2295998090 seq 3913489302 subseq 268277 len 1428 csum 0x4157], length 1428
10:53:01.419277 IP 112.26.0.1.37753 > 112.26.0.8.47540: Flags [.], seq 268277:269705, ack 1, win 893, options [nop,nop,TS val 137620 ecr 4294890064,mptcp dss ack 2295998090 seq 3913489302 subseq 268277 len 1428 csum 0x4157], length 1428
10:53:01.468642 IP 112.26.0.8.47540 > 112.26.0.1.37753: Flags [.], ack 259709, win 24422, options [nop,nop,TS val 4294890804 ecr 137064,mptcp dss ack 3913399338], length 0
10:53:01.516123 IP 112.26.0.8.47540 > 112.26.0.1.37753: Flags [.], ack 263993, win 24422, options [nop,nop,TS val 4294891409 ecr 137359,nop,nop,sack 1 {265421:268277},mptcp dss ack 3913399338], length 0
10:53:01.587077 IP 112.26.0.8.47540 > 112.26.0.1.37753: Flags [.], ack 261137, win 24422, options [nop,nop,TS val 4294890911 ecr 137205,mptcp dss ack 3913399338], length 0
10:53:01.593327 IP 112.26.0.1.37753 > 112.26.0.8.47540: Flags [.], seq 269705:271133, ack 1, win 893, options [nop,nop,TS val 137758 ecr 4294890153,mptcp dss ack 2295998090 seq 3913493586 subseq 269705 len 1428 csum 0x6254], length 1428
10:53:01.593632 IP 112.26.0.1.37753 > 112.26.0.8.47540: Flags [.], seq 269705:271133, ack 1, win 893, options [nop,nop,TS val 137758 ecr 4294890153,mptcp dss ack 2295998090 seq 3913493586 subseq 269705 len 1428 csum 0x6254], length 1428
10:53:01.661173 IP 112.26.0.8.47540 > 112.26.0.1.37753: Flags [.], ack 263993, win 24422, options [nop,nop,TS val 4294891499 ecr 137359,nop,nop,sack 1 {265421:269705},mptcp dss ack 3913399338], length 0
10:53:01.686814 IP 112.26.0.8.47540 > 112.26.0.1.37753: Flags [.], ack 262565, win 24422, options [nop,nop,TS val 4294891014 ecr 137217,mptcp dss ack 3913399338], length 0
10:53:01.740396 IP 112.26.0.8.47540 > 112.26.0.1.37753: Flags [.], ack 263993, win 24422, options [nop,nop,TS val 4294891083 ecr 137359,mptcp dss ack 3913399338], length 0
10:53:01.751207 IP 112.26.0.1.37753 > 112.26.0.8.47540: Flags [.], seq 271133:272561, ack 1, win 893, options [nop,nop,TS val 137887 ecr 4294890339,mptcp dss ack 2295998090 seq 3913496442 subseq 271133 len 1428 csum 0x8fb7], length 1428
10:53:01.751462 IP 112.26.0.1.37753 > 112.26.0.8.47540: Flags [.], seq 271133:272561, ack 1, win 893, options [nop,nop,TS val 137887 ecr 4294890339,mptcp dss ack 2295998090 seq 3913496442 subseq 271133 len 1428 csum 0x8fb7], length 1428
10:53:01.768309 IP 112.26.0.8.47540 > 112.26.0.1.37753: Flags [.], ack 263993, win 24422, options [nop,nop,TS val 4294891660 ecr 137359,nop,nop,sack 1 {265421:271133},mptcp dss ack 3913399338], length 0
10:53:01.864535 IP 112.26.0.8.47540 > 112.26.0.1.37753: Flags [.], ack 263993, win 24422, options [nop,nop,TS val 4294891224 ecr 137359,nop,nop,sack 1 {265421:266849},mptcp dss ack 3913399338], length 0
10:53:01.870178 IP 112.26.0.1.37753 > 112.26.0.8.47540: Flags [.], seq 272561:273989, ack 1, win 893, options [nop,nop,TS val 137980 ecr 4294890617,mptcp dss ack 2295998090 seq 3913500726 subseq 272561 len 1428 csum 0x65a1], length 1428
10:53:01.870546 IP 112.26.0.1.37753 > 112.26.0.8.47540: Flags [.], seq 272561:273989, ack 1, win 893, options [nop,nop,TS val 137980 ecr 4294890617,mptcp dss ack 2295998090 seq 3913500726 subseq 272561 len 1428 csum 0x65a1], length 1428
10:53:01.906799 IP 112.26.0.8.47540 > 112.26.0.1.37753: Flags [.], ack 263993, win 24244, options [nop,nop,TS val 4294891799 ecr 137359,nop,nop,sack 1 {265421:272561},mptcp dss ack 3913410762], length 0
10:53:01.962484 IP 112.26.0.1.37753 > 112.26.0.8.47540: Flags [.], seq 273989:275417, ack 1, win 893, options [nop,nop,TS val 137980 ecr 4294890617,mptcp dss ack 2295998090 seq 3913502154 subseq 273989 len 1428 csum 0x62a2], length 1428
10:53:01.962787 IP 112.26.0.1.37753 > 112.26.0.8.47540: Flags [.], seq 273989:275417, ack 1, win 893, options [nop,nop,TS val 137980 ecr 4294890617,mptcp dss ack 2295998090 seq 3913502154 subseq 273989 len 1428 csum 0x62a2], length 1428
10:53:02.010863 IP 112.26.0.8.47540 > 112.26.0.1.37753: Flags [.], ack 263993, win 24422, options [nop,nop,TS val 4294891409 ecr 137359,nop,nop,sack 1 {265421:268277},mptcp dss ack 3913399338], length 0
10:53:02.017828 IP 112.26.0.8.47540 > 112.26.0.1.37753: Flags [.], ack 263993, win 24064, options [nop,nop,TS val 4294891910 ecr 137359,nop,nop,sack 1 {265421:273989},mptcp dss ack 3913429326], length 0
10:53:02.156259 IP 112.26.0.8.47540 > 112.26.0.1.37753: Flags [.], ack 263993, win 24064, options [nop,nop,TS val 4294891982 ecr 137359,nop,nop,sack 1 {265421:275417},mptcp dss ack 3913429326], length 0
10:53:02.170261 IP 112.26.0.8.47540 > 112.26.0.1.37753: Flags [.], ack 263993, win 24422, options [nop,nop,TS val 4294891499 ecr 137359,nop,nop,sack 1 {265421:269705},mptcp dss ack 3913399338], length 0
10:53:02.229965 IP 112.26.0.8.47540 > 112.26.0.1.37753: Flags [.], ack 263993, win 24422, options [nop,nop,TS val 4294891660 ecr 137359,nop,nop,sack 1 {265421:271133},mptcp dss ack 3913399338], length 0
10:53:02.253834 IP 112.26.0.1.37753 > 112.26.0.8.47540: Flags [.], seq 275417:276845, ack 1, win 893, options [nop,nop,TS val 138112 ecr 4294890804,mptcp dss ack 2295998090 seq 3913506438 subseq 275417 len 1428 csum 0xfad4], length 1428
10:53:02.254090 IP 112.26.0.1.37753 > 112.26.0.8.47540: Flags [.], seq 275417:276845, ack 1, win 893, options [nop,nop,TS val 138112 ecr 4294890804,mptcp dss ack 2295998090 seq 3913506438 subseq 275417 len 1428 csum 0xfad4], length 1428
10:53:02.301619 IP 112.26.0.8.47540 > 112.26.0.1.37753: Flags [.], ack 263993, win 24064, options [nop,nop,TS val 4294892193 ecr 137359,nop,nop,sack 1 {265421:276845},mptcp dss ack 3913429326], length 0
10:53:02.336028 IP 112.26.0.8.47540 > 112.26.0.1.37753: Flags [.], ack 263993, win 24244, options [nop,nop,TS val 4294891799 ecr 137359,nop,nop,sack 1 {265421:272561},mptcp dss ack 3913410762], length 0
10:53:02.381888 IP 112.26.0.1.37753 > 112.26.0.8.47540: Flags [.], seq 276845:278273, ack 1, win 893, options [nop,nop,TS val 138231 ecr 4294890911,mptcp dss ack 2295998090 seq 3913513578 subseq 276845 len 1428 csum 0x7c2d], length 1428
10:53:02.382161 IP 112.26.0.1.37753 > 112.26.0.8.47540: Flags [.], seq 276845:278273, ack 1, win 893, options [nop,nop,TS val 138231 ecr 4294890911,mptcp dss ack 2295998090 seq 3913513578 subseq 276845 len 1428 csum 0x7c2d], length 1428
10:53:02.403686 IP 112.26.0.8.47540 > 112.26.0.1.37753: Flags [.], ack 263993, win 24064, options [nop,nop,TS val 4294892285 ecr 137359,nop,nop,sack 1 {265421:278273},mptcp dss ack 3913429326], length 0
10:53:02.418784 IP 112.26.0.8.47540 > 112.26.0.1.37753: Flags [.], ack 263993, win 24064, options [nop,nop,TS val 4294891910 ecr 137359,nop,nop,sack 1 {265421:273989},mptcp dss ack 3913429326], length 0
10:53:02.476360 IP 112.26.0.1.37753 > 112.26.0.8.47540: Flags [.], seq 278273:279701, ack 1, win 893, options [nop,nop,TS val 138350 ecr 4294891014,mptcp dss ack 2295998090 seq 3913516434 subseq 278273 len 1428 csum 0xb2e3], length 1428
10:53:02.476694 IP 112.26.0.1.37753 > 112.26.0.8.47540: Flags [.], seq 278273:279701, ack 1, win 893, options [nop,nop,TS val 138350 ecr 4294891014,mptcp dss ack 2295998090 seq 3913516434 subseq 278273 len 1428 csum 0xb2e3], length 1428
10:53:02.512431 IP 112.26.0.8.47540 > 112.26.0.1.37753: Flags [.], ack 263993, win 24064, options [nop,nop,TS val 4294892390 ecr 137359,nop,nop,sack 1 {265421:279701},mptcp dss ack 3913429326], length 0
10:53:02.558460 IP 112.26.0.8.47540 > 112.26.0.1.37753: Flags [.], ack 263993, win 24064, options [nop,nop,TS val 4294891982 ecr 137359,nop,nop,sack 1 {265421:275417},mptcp dss ack 3913429326], length 0
10:53:02.592712 IP 112.26.0.1.37753 > 112.26.0.8.47540: Flags [.], seq 279701:281129, ack 1, win 893, options [nop,nop,TS val 138415 ecr 4294891083,mptcp dss ack 2295998090 seq 3913520718 subseq 279701 len 1428 csum 0x3fab], length 1428
10:53:02.592990 IP 112.26.0.1.37753 > 112.26.0.8.47540: Flags [.], seq 279701:281129, ack 1, win 893, options [nop,nop,TS val 138415 ecr 4294891083,mptcp dss ack 2295998090 seq 3913520718 subseq 279701 len 1428 csum 0x3fab], length 1428
10:53:02.602832 IP 112.26.0.8.47540 > 112.26.0.1.37753: Flags [.], ack 263993, win 24064, options [nop,nop,TS val 4294892491 ecr 137359,nop,nop,sack 1 {265421:281129},mptcp dss ack 3913429326], length 0
10:53:02.677886 IP 112.26.0.8.47540 > 112.26.0.1.37753: Flags [.], ack 263993, win 24064, options [nop,nop,TS val 4294892193 ecr 137359,nop,nop,sack 1 {265421:276845},mptcp dss ack 3913429326], length 0
10:53:02.709310 IP 112.26.0.1.37753 > 112.26.0.8.47540: Flags [.], seq 281129:282557, ack 1, win 893, options [nop,nop,TS val 138519 ecr 4294891224,mptcp dss ack 2295998090 seq 3913525002 subseq 281129 len 1428 csum 0xed55], length 1428
10:53:02.709644 IP 112.26.0.1.37753 > 112.26.0.8.47540: Flags [.], seq 281129:282557, ack 1, win 893, options [nop,nop,TS val 138519 ecr 4294891224,mptcp dss ack 2295998090 seq 3913525002 subseq 281129 len 1428 csum 0xed55], length 1428
10:53:02.754805 IP 112.26.0.8.47540 > 112.26.0.1.37753: Flags [.], ack 263993, win 24064, options [nop,nop,TS val 4294892646 ecr 137359,nop,nop,sack 1 {265421:282557},mptcp dss ack 3913429326], length 0
10:53:02.808919 IP 112.26.0.8.47540 > 112.26.0.1.37753: Flags [.], ack 263993, win 24064, options [nop,nop,TS val 4294892285 ecr 137359,nop,nop,sack 1 {265421:278273},mptcp dss ack 3913429326], length 0
10:53:02.887923 IP 112.26.0.1.37753 > 112.26.0.8.47540: Flags [.], seq 282557:283985, ack 1, win 893, options [nop,nop,TS val 138700 ecr 4294891409,mptcp dss ack 2295998090 seq 3913530714 subseq 282557 len 1428 csum 0xc14c], length 1428
10:53:02.888234 IP 112.26.0.1.37753 > 112.26.0.8.47540: Flags [.], seq 282557:283985, ack 1, win 893, options [nop,nop,TS val 138700 ecr 4294891409,mptcp dss ack 2295998090 seq 3913530714 subseq 282557 len 1428 csum 0xc14c], length 1428
10:53:02.893081 IP 112.26.0.8.47540 > 112.26.0.1.37753: Flags [.], ack 263993, win 24064, options [nop,nop,TS val 4294892785 ecr 137359,nop,nop,sack 1 {265421:283985},mptcp dss ack 3913429326], length 0
10:53:02.954090 IP 112.26.0.8.47540 > 112.26.0.1.37753: Flags [.], ack 263993, win 24064, options [nop,nop,TS val 4294892390 ecr 137359,nop,nop,sack 1 {265421:279701},mptcp dss ack 3913429326], length 0
10:53:02.970096 IP 112.26.0.1.37753 > 112.26.0.8.47540: Flags [.], seq 263993:265421, ack 1, win 893, options [nop,nop,TS val 138832 ecr 4294891499,mptcp dss ack 2295998090 seq 3913472166 subseq 263993 len 1428 csum 0x5905], length 1428
10:53:02.970396 IP 112.26.0.1.37753 > 112.26.0.8.47540: Flags [.], seq 263993:265421, ack 1, win 893, options [nop,nop,TS val 138832 ecr 4294891499,mptcp dss ack 2295998090 seq 3913472166 subseq 263993 len 1428 csum 0x5905], length 1428
10:53:03.021569 IP 112.26.0.8.47540 > 112.26.0.1.37753: Flags [.], ack 263993, win 24064, options [nop,nop,TS val 4294892491 ecr 137359,nop,nop,sack 1 {265421:281129},mptcp dss ack 3913429326], length 0
10:53:03.032456 IP 112.26.0.8.47540 > 112.26.0.1.37753: Flags [.], ack 283985, win 24064, options [nop,nop,TS val 4294892912 ecr 138832,mptcp dss ack 3913429326], length 0
10:53:03.084651 IP 112.26.0.1.37753 > 112.26.0.8.47540: Flags [.], seq 283985:285413, ack 1, win 893, options [nop,nop,TS val 139006 ecr 4294891660,mptcp dss ack 2295998090 seq 3913539282 subseq 283985 len 1428 csum 0x65d2], length 1428
10:53:03.084932 IP 112.26.0.1.37753 > 112.26.0.8.47540: Flags [.], seq 283985:285413, ack 1, win 893, options [nop,nop,TS val 139006 ecr 4294891660,mptcp dss ack 2295998090 seq 3913539282 subseq 283985 len 1428 csum 0x65d2], length 1428
10:53:03.152763 IP 112.26.0.8.47540 > 112.26.0.1.37753: Flags [.], ack 285413, win 24064, options [nop,nop,TS val 4294893044 ecr 139006,mptcp dss ack 3913429326], length 0
10:53:03.178912 IP 112.26.0.8.47540 > 112.26.0.1.37753: Flags [.], ack 263993, win 24064, options [nop,nop,TS val 4294892646 ecr 137359,nop,nop,sack 1 {265421:282557},mptcp dss ack 3913429326], length 0
10:53:03.285954 IP 112.26.0.1.37753 > 112.26.0.8.47540: Flags [.], seq 285413:286841, ack 1, win 893, options [nop,nop,TS val 139147 ecr 4294891910,mptcp dss ack 2295998090 seq 3913542138 subseq 285413 len 1428 csum 0xbd3d], length 1428
10:53:03.286248 IP 112.26.0.1.37753 > 112.26.0.8.47540: Flags [.], seq 285413:286841, ack 1, win 893, options [nop,nop,TS val 139147 ecr 4294891910,mptcp dss ack 2295998090 seq 3913542138 subseq 285413 len 1428 csum 0xbd3d], length 1428
10:53:03.294837 IP 112.26.0.8.47540 > 112.26.0.1.37753: Flags [.], ack 286841, win 24489, options [nop,nop,TS val 4294893183 ecr 139147,mptcp dss ack 3913544994], length 0
10:53:03.317026 IP 112.26.0.8.47540 > 112.26.0.1.37753: Flags [.], ack 263993, win 24064, options [nop,nop,TS val 4294892785 ecr 137359,nop,nop,sack 1 {265421:283985},mptcp dss ack 3913429326], length 0
10:53:03.364193 IP 112.26.0.8.47540 > 112.26.0.1.37753: Flags [.], ack 283985, win 24064, options [nop,nop,TS val 4294892912 ecr 138832,mptcp dss ack 3913429326], length 0
10:53:03.439602 IP 112.26.0.1.37753 > 112.26.0.8.47540: Flags [.], seq 286841:288269, ack 1, win 893, options [nop,nop,TS val 139255 ecr 4294891982,mptcp dss ack 2295998090 seq 3913546422 subseq 286841 len 1428 csum 0x5c70], length 1428
10:53:03.439906 IP 112.26.0.1.37753 > 112.26.0.8.47540: Flags [.], seq 286841:288269, ack 1, win 893, options [nop,nop,TS val 139255 ecr 4294891982,mptcp dss ack 2295998090 seq 3913546422 subseq 286841 len 1428 csum 0x5c70], length 1428
10:53:03.450295 IP 112.26.0.8.47540 > 112.26.0.1.37753: Flags [.], ack 288269, win 24458, options [nop,nop,TS val 4294893338 ecr 139255,mptcp dss ack 3913549278], length 0
10:53:03.485656 IP 112.26.0.8.47540 > 112.26.0.1.37753: Flags [.], ack 285413, win 24064, options [nop,nop,TS val 4294893044 ecr 139006,mptcp dss ack 3913429326], length 0
10:53:03.549760 IP 112.26.0.8.47540 > 112.26.0.1.37753: Flags [.], ack 286841, win 24489, options [nop,nop,TS val 4294893183 ecr 139147,mptcp dss ack 3913544994], length 0
10:53:03.589113 IP 112.26.0.1.37753 > 112.26.0.8.47540: Flags [.], seq 288269:289697, ack 1, win 893, options [nop,nop,TS val 139614 ecr 4294892390,mptcp dss ack 2295998090 seq 3913560702 subseq 288269 len 1428 csum 0x8260], length 1428
10:53:03.589465 IP 112.26.0.1.37753 > 112.26.0.8.47540: Flags [.], seq 288269:289697, ack 1, win 893, options [nop,nop,TS val 139614 ecr 4294892390,mptcp dss ack 2295998090 seq 3913560702 subseq 288269 len 1428 csum 0x8260], length 1428
10:53:03.598097 IP 112.26.0.8.47540 > 112.26.0.1.37753: Flags [.], ack 289697, win 24509, options [nop,nop,TS val 4294893486 ecr 139614,mptcp dss ack 3913556418], length 0
10:53:03.647822 IP 112.26.0.8.47540 > 112.26.0.1.37753: Flags [.], ack 288269, win 24458, options [nop,nop,TS val 4294893338 ecr 139255,mptcp dss ack 3913549278], length 0
10:53:03.689132 IP 112.26.0.8.47540 > 112.26.0.1.37753: Flags [.], ack 289697, win 24509, options [nop,nop,TS val 4294893486 ecr 139614,mptcp dss ack 3913556418], length 0
10:53:03.811388 IP 112.26.0.1.37753 > 112.26.0.8.47540: Flags [.], seq 289697:291125, ack 1, win 893, options [nop,nop,TS val 139736 ecr 4294892491,mptcp dss ack 2295998090 seq 3913564986 subseq 289697 len 1428 csum 0xd3d], length 1428
10:53:03.811646 IP 112.26.0.1.37753 > 112.26.0.8.47540: Flags [.], seq 289697:291125, ack 1, win 893, options [nop,nop,TS val 139736 ecr 4294892491,mptcp dss ack 2295998090 seq 3913564986 subseq 289697 len 1428 csum 0xd3d], length 1428
10:53:03.815898 IP 112.26.0.8.47540 > 112.26.0.1.37753: Flags [.], ack 291125, win 24543, options [nop,nop,TS val 4294893708 ecr 139736,mptcp dss ack 3913563558], length 0
10:53:03.907958 IP 112.26.0.8.47540 > 112.26.0.1.37753: Flags [.], ack 291125, win 24543, options [nop,nop,TS val 4294893708 ecr 139736,mptcp dss ack 3913563558], length 0
10:53:03.931189 IP 112.26.0.1.37753 > 112.26.0.8.47540: Flags [.], seq 291125:292553, ack 1, win 893, options [nop,nop,TS val 139853 ecr 4294892646,mptcp dss ack 2295998090 seq 3913574982 subseq 291125 len 1428 csum 0xec17], length 1428
10:53:03.931492 IP 112.26.0.1.37753 > 112.26.0.8.47540: Flags [.], seq 291125:292553, ack 1, win 893, options [nop,nop,TS val 139853 ecr 4294892646,mptcp dss ack 2295998090 seq 3913574982 subseq 291125 len 1428 csum 0xec17], length 1428
10:53:03.955514 IP 112.26.0.8.47540 > 112.26.0.1.37753: Flags [.], ack 292553, win 24527, options [nop,nop,TS val 4294893829 ecr 139853,mptcp dss ack 3913566414], length 0
10:53:04.035344 IP 112.26.0.8.47540 > 112.26.0.1.37753: Flags [.], ack 292553, win 24527, options [nop,nop,TS val 4294893829 ecr 139853,mptcp dss ack 3913566414], length 0
10:53:04.097785 IP 112.26.0.1.37753 > 112.26.0.8.47540: Flags [.], seq 292553:293981, ack 1, win 893, options [nop,nop,TS val 139987 ecr 4294892785,mptcp dss ack 2295998090 seq 3913579266 subseq 292553 len 1428 csum 0x86b3], length 1428
10:53:04.098112 IP 112.26.0.1.37753 > 112.26.0.8.47540: Flags [.], seq 292553:293981, ack 1, win 893, options [nop,nop,TS val 139987 ecr 4294892785,mptcp dss ack 2295998090 seq 3913579266 subseq 292553 len 1428 csum 0x86b3], length 1428
10:53:04.104643 IP 112.26.0.8.47540 > 112.26.0.1.37753: Flags [.], ack 293981, win 24527, options [nop,nop,TS val 4294893997 ecr 139987,mptcp dss ack 3913566414], length 0
10:53:04.168343 IP 112.26.0.8.47540 > 112.26.0.1.37753: Flags [.], ack 293981, win 24527, options [nop,nop,TS val 4294893997 ecr 139987,mptcp dss ack 3913566414], length 0
10:53:04.232905 IP 112.26.0.1.37753 > 112.26.0.8.47540: Flags [.], seq 293981:295409, ack 1, win 893, options [nop,nop,TS val 140070 ecr 4294892912,mptcp dss ack 2295998090 seq 3913586406 subseq 293981 len 1428 csum 0x7f93], length 1428
10:53:04.233179 IP 112.26.0.1.37753 > 112.26.0.8.47540: Flags [.], seq 293981:295409, ack 1, win 893, options [nop,nop,TS val 140070 ecr 4294892912,mptcp dss ack 2295998090 seq 3913586406 subseq 293981 len 1428 csum 0x7f93], length 1428
10:53:04.237830 IP 112.26.0.8.47540 > 112.26.0.1.37753: Flags [.], ack 295409, win 24527, options [nop,nop,TS val 4294894130 ecr 140070,mptcp dss ack 3913566414], length 0
10:53:04.244502 IP 112.26.0.8.47540 > 112.26.0.1.37753: Flags [.], ack 295409, win 24527, options [nop,nop,TS val 4294894130 ecr 140070,mptcp dss ack 3913566414], length 0
10:53:04.297477 IP 112.26.0.1.37753 > 112.26.0.8.47540: Flags [.], seq 295409:296837, ack 1, win 893, options [nop,nop,TS val 140161 ecr 4294893044,mptcp dss ack 2295998090 seq 3913589262 subseq 295409 len 1428 csum 0xa4ca], length 1428
10:53:04.297781 IP 112.26.0.1.37753 > 112.26.0.8.47540: Flags [.], seq 295409:296837, ack 1, win 893, options [nop,nop,TS val 140161 ecr 4294893044,mptcp dss ack 2295998090 seq 3913589262 subseq 295409 len 1428 csum 0xa4ca], length 1428
10:53:04.386080 IP 112.26.0.8.47540 > 112.26.0.1.37753: Flags [.], ack 296837, win 24527, options [nop,nop,TS val 4294894278 ecr 140161,mptcp dss ack 3913566414], length 0
10:53:04.387533 IP 112.26.0.8.47540 > 112.26.0.1.37753: Flags [.], ack 296837, win 24527, options [nop,nop,TS val 4294894278 ecr 140161,mptcp dss ack 3913566414], length 0
10:53:04.462493 IP 112.26.0.1.37753 > 112.26.0.8.47540: Flags [.], seq 296837:298265, ack 1, win 893, options [nop,nop,TS val 140249 ecr 4294893183,mptcp dss ack 2295998090 seq 3913594974 subseq 296837 len 1428 csum 0xde8d], length 1428
10:53:04.462755 IP 112.26.0.1.37753 > 112.26.0.8.47540: Flags [.], seq 296837:298265, ack 1, win 893, options [nop,nop,TS val 140249 ecr 4294893183,mptcp dss ack 2295998090 seq 3913594974 subseq 296837 len 1428 csum 0xde8d], length 1428
10:53:04.495969 IP 112.26.0.8.47540 > 112.26.0.1.37753: Flags [.], ack 298265, win 24527, options [nop,nop,TS val 4294894372 ecr 140249,mptcp dss ack 3913566414], length 0
10:53:04.567646 IP 112.26.0.8.47540 > 112.26.0.1.37753: Flags [.], ack 298265, win 24527, options [nop,nop,TS val 4294894372 ecr 140249,mptcp dss ack 3913566414], length 0
10:53:04.617749 IP 112.26.0.1.37753 > 112.26.0.8.47540: Flags [.], seq 298265:299693, ack 1, win 893, options [nop,nop,TS val 140346 ecr 4294893338,mptcp dss ack 2295998090 seq 3913600686 subseq 298265 len 1428 csum 0xe684], length 1428
10:53:04.618060 IP 112.26.0.1.37753 > 112.26.0.8.47540: Flags [.], seq 298265:299693, ack 1, win 893, options [nop,nop,TS val 140346 ecr 4294893338,mptcp dss ack 2295998090 seq 3913600686 subseq 298265 len 1428 csum 0xe684], length 1428
10:53:04.639303 IP 112.26.0.8.47540 > 112.26.0.1.37753: Flags [.], ack 299693, win 24476, options [nop,nop,TS val 4294894515 ecr 140346,mptcp dss ack 3913597830], length 0
10:53:04.661090 IP 112.26.0.8.47540 > 112.26.0.1.37753: Flags [.], ack 299693, win 24476, options [nop,nop,TS val 4294894515 ecr 140346,mptcp dss ack 3913597830], length 0
10:53:04.784404 IP 112.26.0.1.37753 > 112.26.0.8.47540: Flags [.], seq 299693:301121, ack 1, win 893, options [nop,nop,TS val 140346 ecr 4294893338,mptcp dss ack 2295998090 seq 3913602114 subseq 299693 len 1428 csum 0xe444], length 1428
10:53:04.784729 IP 112.26.0.1.37753 > 112.26.0.8.47540: Flags [.], seq 299693:301121, ack 1, win 893, options [nop,nop,TS val 140346 ecr 4294893338,mptcp dss ack 2295998090 seq 3913602114 subseq 299693 len 1428 csum 0xe444], length 1428
10:53:04.790317 IP 112.26.0.8.47540 > 112.26.0.1.37753: Flags [.], ack 301121, win 24460, options [nop,nop,TS val 4294894681 ecr 140346,mptcp dss ack 3913609254], length 0
10:53:04.811782 IP 112.26.0.8.47540 > 112.26.0.1.37753: Flags [.], ack 301121, win 24460, options [nop,nop,TS val 4294894681 ecr 140346,mptcp dss ack 3913609254], length 0
10:53:04.847837 IP 112.26.0.1.37753 > 112.26.0.8.47540: Flags [.], seq 301121:302549, ack 1, win 893, options [nop,nop,TS val 140467 ecr 4294893486,mptcp dss ack 2295998090 seq 3913612110 subseq 301121 len 1428 csum 0xf6f1], length 1428
10:53:04.848140 IP 112.26.0.1.37753 > 112.26.0.8.47540: Flags [.], seq 301121:302549, ack 1, win 893, options [nop,nop,TS val 140467 ecr 4294893486,mptcp dss ack 2295998090 seq 3913612110 subseq 301121 len 1428 csum 0xf6f1], length 1428
10:53:04.938191 IP 112.26.0.8.47540 > 112.26.0.1.37753: Flags [.], ack 302549, win 24522, options [nop,nop,TS val 4294894830 ecr 140467,mptcp dss ack 3913610682], length 0
10:53:04.939842 IP 112.26.0.8.47540 > 112.26.0.1.37753: Flags [.], ack 302549, win 24522, options [nop,nop,TS val 4294894830 ecr 140467,mptcp dss ack 3913610682], length 0
10:53:04.976517 IP 112.26.0.1.37753 > 112.26.0.8.47540: Flags [.], seq 302549:303977, ack 1, win 893, options [nop,nop,TS val 140554 ecr 4294893708,mptcp dss ack 2295998090 seq 3913616394 subseq 302549 len 1428 csum 0x4949], length 1428
10:53:04.976826 IP 112.26.0.1.37753 > 112.26.0.8.47540: Flags [.], seq 302549:303977, ack 1, win 893, options [nop,nop,TS val 140554 ecr 4294893708,mptcp dss ack 2295998090 seq 3913616394 subseq 302549 len 1428 csum 0x4949], length 1428
10:53:05.044413 IP 112.26.0.8.47540 > 112.26.0.1.37753: Flags [.], ack 303977, win 24504, options [nop,nop,TS val 4294894937 ecr 140554,mptcp dss ack 3913617822], length 0
10:53:05.078978 IP 112.26.0.8.47540 > 112.26.0.1.37753: Flags [.], ack 303977, win 24504, options [nop,nop,TS val 4294894937 ecr 140554,mptcp dss ack 3913617822], length 0
10:53:05.106095 IP 112.26.0.1.37753 > 112.26.0.8.47540: Flags [.], seq 303977:305405, ack 1, win 893, options [nop,nop,TS val 140681 ecr 4294893829,mptcp dss ack 2295998090 seq 3913622106 subseq 303977 len 1428 csum 0x28a9], length 1428
10:53:05.106364 IP 112.26.0.1.37753 > 112.26.0.8.47540: Flags [.], seq 303977:305405, ack 1, win 893, options [nop,nop,TS val 140681 ecr 4294893829,mptcp dss ack 2295998090 seq 3913622106 subseq 303977 len 1428 csum 0x28a9], length 1428
10:53:05.164182 IP 112.26.0.1.37753 > 112.26.0.8.47540: Flags [.], seq 305405:306833, ack 1, win 893, options [nop,nop,TS val 140812 ecr 4294893997,mptcp dss ack 2295998090 seq 3913626390 subseq 305405 len 1428 csum 0x3b95], length 1428
10:53:05.164432 IP 112.26.0.1.37753 > 112.26.0.8.47540: Flags [.], seq 305405:306833, ack 1, win 893, options [nop,nop,TS val 140812 ecr 4294893997,mptcp dss ack 2295998090 seq 3913626390 subseq 305405 len 1428 csum 0x3b95], length 1428
10:53:05.235646 IP 112.26.0.1.37753 > 112.26.0.8.47540: Flags [.], seq 306833:308261, ack 1, win 893, options [nop,nop,TS val 140900 ecr 4294894130,mptcp dss ack 2295998090 seq 3913629246 subseq 306833 len 1428 csum 0x6e14], length 1428
10:53:05.235886 IP 112.26.0.1.37753 > 112.26.0.8.47540: Flags [.], seq 306833:308261, ack 1, win 893, options [nop,nop,TS val 140900 ecr 4294894130,mptcp dss ack 2295998090 seq 3913629246 subseq 306833 len 1428 csum 0x6e14], length 1428
10:53:05.243181 IP 112.26.0.8.47540 > 112.26.0.1.37753: Flags [.], ack 305405, win 24486, options [nop,nop,TS val 4294895136 ecr 140681,mptcp dss ack 3913623534], length 0
10:53:05.245195 IP 112.26.0.8.47540 > 112.26.0.1.37753: Flags [.], ack 305405, win 24486, options [nop,nop,TS val 4294895136 ecr 140681,mptcp dss ack 3913623534], length 0
10:53:05.369304 IP 112.26.0.8.47540 > 112.26.0.1.37753: Flags [.], ack 308261, win 24468, options [nop,nop,TS val 4294895261 ecr 140812,mptcp dss ack 3913632102], length 0
10:53:05.376035 IP 112.26.0.8.47540 > 112.26.0.1.37753: Flags [.], ack 308261, win 24468, options [nop,nop,TS val 4294895261 ecr 140812,mptcp dss ack 3913632102], length 0
10:53:05.408037 IP 112.26.0.1.37753 > 112.26.0.8.47540: Flags [.], seq 308261:309689, ack 1, win 893, options [nop,nop,TS val 141031 ecr 4294894278,mptcp dss ack 2295998090 seq 3913637814 subseq 308261 len 1428 csum 0x41b], length 1428
10:53:05.408317 IP 112.26.0.1.37753 > 112.26.0.8.47540: Flags [.], seq 308261:309689, ack 1, win 893, options [nop,nop,TS val 141031 ecr 4294894278,mptcp dss ack 2295998090 seq 3913637814 subseq 308261 len 1428 csum 0x41b], length 1428
10:53:05.481781 IP 112.26.0.1.37753 > 112.26.0.8.47540: Flags [.], seq 309689:311117, ack 1, win 893, options [nop,nop,TS val 141218 ecr 4294894372,mptcp dss ack 2295998090 seq 3913643526 subseq 309689 len 1428 csum 0xea7f], length 1428
10:53:05.482041 IP 112.26.0.1.37753 > 112.26.0.8.47540: Flags [.], seq 309689:311117, ack 1, win 893, options [nop,nop,TS val 141218 ecr 4294894372,mptcp dss ack 2295998090 seq 3913643526 subseq 309689 len 1428 csum 0xea7f], length 1428
10:53:05.569591 IP 112.26.0.1.37753 > 112.26.0.8.47540: Flags [.], seq 311117:312545, ack 1, win 893, options [nop,nop,TS val 141315 ecr 4294894515,mptcp dss ack 2295998090 seq 3913654950 subseq 311117 len 1428 csum 0xb653], length 1428
10:53:05.569913 IP 112.26.0.1.37753 > 112.26.0.8.47540: Flags [.], seq 311117:312545, ack 1, win 893, options [nop,nop,TS val 141315 ecr 4294894515,mptcp dss ack 2295998090 seq 3913654950 subseq 311117 len 1428 csum 0xb653], length 1428
10:53:05.608001 IP 112.26.0.8.47540 > 112.26.0.1.37753: Flags [.], ack 311117, win 24486, options [nop,nop,TS val 4294895500 ecr 141031,mptcp dss ack 3913639242], length 0
10:53:05.610285 IP 112.26.0.8.47540 > 112.26.0.1.37753: Flags [.], ack 311117, win 24486, options [nop,nop,TS val 4294895500 ecr 141031,mptcp dss ack 3913639242], length 0
10:53:05.700647 IP 112.26.0.1.37753 > 112.26.0.8.47540: Flags [.], seq 312545:313973, ack 1, win 893, options [nop,nop,TS val 141456 ecr 4294894681,mptcp dss ack 2295998090 seq 3913660662 subseq 312545 len 1428 csum 0x1507], length 1428
10:53:05.700956 IP 112.26.0.1.37753 > 112.26.0.8.47540: Flags [.], seq 312545:313973, ack 1, win 893, options [nop,nop,TS val 141456 ecr 4294894681,mptcp dss ack 2295998090 seq 3913660662 subseq 312545 len 1428 csum 0x1507], length 1428
10:53:05.811274 IP 112.26.0.1.37753 > 112.26.0.8.47540: Flags [.], seq 313973:315401, ack 1, win 893, options [nop,nop,TS val 141456 ecr 4294894681,mptcp dss ack 2295998090 seq 3913662090 subseq 313973 len 1428 csum 0xdae8], length 1428
10:53:05.811600 IP 112.26.0.1.37753 > 112.26.0.8.47540: Flags [.], seq 313973:315401, ack 1, win 893, options [nop,nop,TS val 141456 ecr 4294894681,mptcp dss ack 2295998090 seq 3913662090 subseq 313973 len 1428 csum 0xdae8], length 1428
10:53:05.862469 IP 112.26.0.8.47540 > 112.26.0.1.37753: Flags [.], ack 313973, win 24486, options [nop,nop,TS val 4294895745 ecr 141315,mptcp dss ack 3913639242], length 0
10:53:05.863819 IP 112.26.0.8.47540 > 112.26.0.1.37753: Flags [.], ack 313973, win 24486, options [nop,nop,TS val 4294895745 ecr 141315,mptcp dss ack 3913639242], length 0
10:53:05.903901 IP 112.26.0.1.37753 > 112.26.0.8.47540: Flags [.], seq 315401:316829, ack 1, win 893, options [nop,nop,TS val 141585 ecr 4294894830,mptcp dss ack 2295998090 seq 3913670658 subseq 315401 len 1428 csum 0x9351], length 1428
10:53:05.904193 IP 112.26.0.1.37753 > 112.26.0.8.47540: Flags [.], seq 315401:316829, ack 1, win 893, options [nop,nop,TS val 141585 ecr 4294894830,mptcp dss ack 2295998090 seq 3913670658 subseq 315401 len 1428 csum 0x9351], length 1428
10:53:05.998403 IP 112.26.0.1.37753 > 112.26.0.8.47540: Flags [.], seq 316829:318257, ack 1, win 893, options [nop,nop,TS val 141722 ecr 4294894937,mptcp dss ack 2295998090 seq 3913676370 subseq 316829 len 1428 csum 0x374e], length 1428
10:53:05.998734 IP 112.26.0.1.37753 > 112.26.0.8.47540: Flags [.], seq 316829:318257, ack 1, win 893, options [nop,nop,TS val 141722 ecr 4294894937,mptcp dss ack 2295998090 seq 3913676370 subseq 316829 len 1428 csum 0x374e], length 1428
10:53:06.076785 IP 112.26.0.1.37753 > 112.26.0.8.47540: Flags [.], seq 318257:319685, ack 1, win 893, options [nop,nop,TS val 141893 ecr 4294895136,mptcp dss ack 2295998090 seq 3913686366 subseq 318257 len 1428 csum 0xd9c2], length 1428
10:53:06.077093 IP 112.26.0.1.37753 > 112.26.0.8.47540: Flags [.], seq 318257:319685, ack 1, win 893, options [nop,nop,TS val 141893 ecr 4294895136,mptcp dss ack 2295998090 seq 3913686366 subseq 318257 len 1428 csum 0xd9c2], length 1428
10:53:06.126991 IP 112.26.0.8.47540 > 112.26.0.1.37753: Flags [.], ack 318257, win 24486, options [nop,nop,TS val 4294896011 ecr 141456,mptcp dss ack 3913639242], length 0
10:53:06.128448 IP 112.26.0.8.47540 > 112.26.0.1.37753: Flags [.], ack 318257, win 24486, options [nop,nop,TS val 4294896011 ecr 141456,mptcp dss ack 3913639242], length 0
10:53:06.170851 IP 112.26.0.1.37753 > 112.26.0.8.47540: Flags [.], seq 319685:321113, ack 1, win 893, options [nop,nop,TS val 142033 ecr 4294895261,mptcp dss ack 2295998090 seq 3913694934 subseq 319685 len 1428 csum 0xfc0b], length 1428
10:53:06.171165 IP 112.26.0.1.37753 > 112.26.0.8.47540: Flags [.], seq 319685:321113, ack 1, win 893, options [nop,nop,TS val 142033 ecr 4294895261,mptcp dss ack 2295998090 seq 3913694934 subseq 319685 len 1428 csum 0xfc0b], length 1428
10:53:06.337148 IP 112.26.0.1.37753 > 112.26.0.8.47540: Flags [.], seq 321113:322541, ack 1, win 893, options [nop,nop,TS val 142033 ecr 4294895261,mptcp dss ack 2295998090 seq 3913696362 subseq 321113 len 1428 csum 0x1db5], length 1428
10:53:06.337341 IP 112.26.0.1.37753 > 112.26.0.8.47540: Flags [.], seq 321113:322541, ack 1, win 893, options [nop,nop,TS val 142033 ecr 4294895261,mptcp dss ack 2295998090 seq 3913696362 subseq 321113 len 1428 csum 0x1db5], length 1428
10:53:06.468135 IP 112.26.0.1.37753 > 112.26.0.8.47540: Flags [.], seq 322541:323969, ack 1, win 893, options [nop,nop,TS val 142254 ecr 4294895500,mptcp dss ack 2295998090 seq 3913703502 subseq 322541 len 1428 csum 0x20f5], length 1428
10:53:06.468402 IP 112.26.0.1.37753 > 112.26.0.8.47540: Flags [.], seq 322541:323969, ack 1, win 893, options [nop,nop,TS val 142254 ecr 4294895500,mptcp dss ack 2295998090 seq 3913703502 subseq 322541 len 1428 csum 0x20f5], length 1428
10:53:06.501533 IP 112.26.0.8.47540 > 112.26.0.1.37753: Flags [.], ack 322541, win 24486, options [nop,nop,TS val 4294896392 ecr 141893,mptcp dss ack 3913639242], length 0
10:53:06.503660 IP 112.26.0.8.47540 > 112.26.0.1.37753: Flags [.], ack 322541, win 24486, options [nop,nop,TS val 4294896392 ecr 141893,mptcp dss ack 3913639242], length 0
10:53:06.574247 IP 112.26.0.1.37753 > 112.26.0.8.47540: Flags [.], seq 325397:326825, ack 1, win 893, options [nop,nop,TS val 142507 ecr 4294895745,mptcp dss ack 2295998090 seq 3913719210 subseq 325397 len 1428 csum 0x7ad9], length 1428
10:53:06.574596 IP 112.26.0.1.37753 > 112.26.0.8.47540: Flags [.], seq 325397:326825, ack 1, win 893, options [nop,nop,TS val 142507 ecr 4294895745,mptcp dss ack 2295998090 seq 3913719210 subseq 325397 len 1428 csum 0x7ad9], length 1428
10:53:06.636602 IP 112.26.0.8.47540 > 112.26.0.1.37753: Flags [.], ack 323969, win 24486, options [nop,nop,TS val 4294896529 ecr 142254,nop,nop,sack 1 {325397:326825},mptcp dss ack 3913639242], length 0
10:53:06.646088 IP 112.26.0.1.37753 > 112.26.0.8.47540: Flags [.], seq 326825:328253, ack 1, win 893, options [nop,nop,TS val 142507 ecr 4294895745,mptcp dss ack 2295998090 seq 3913720638 subseq 326825 len 1428 csum 0xf92c], length 1428
10:53:06.646338 IP 112.26.0.1.37753 > 112.26.0.8.47540: Flags [.], seq 326825:328253, ack 1, win 893, options [nop,nop,TS val 142507 ecr 4294895745,mptcp dss ack 2295998090 seq 3913720638 subseq 326825 len 1428 csum 0xf92c], length 1428
10:53:06.739305 IP 112.26.0.8.47540 > 112.26.0.1.37753: Flags [.], ack 323969, win 24486, options [nop,nop,TS val 4294896529 ecr 142254,nop,nop,sack 1 {325397:326825},mptcp dss ack 3913639242], length 0
10:53:06.762642 IP 112.26.0.8.47540 > 112.26.0.1.37753: Flags [.], ack 323969, win 24486, options [nop,nop,TS val 4294896653 ecr 142254,nop,nop,sack 1 {325397:328253},mptcp dss ack 3913639242], length 0
10:53:06.798200 IP 112.26.0.1.37753 > 112.26.0.8.47540: Flags [.], seq 328253:329681, ack 1, win 893, options [nop,nop,TS val 142773 ecr 4294896011,mptcp dss ack 2295998090 seq 3913726350 subseq 328253 len 1428 csum 0x7e06], length 1428
10:53:06.798468 IP 112.26.0.1.37753 > 112.26.0.8.47540: Flags [.], seq 328253:329681, ack 1, win 893, options [nop,nop,TS val 142773 ecr 4294896011,mptcp dss ack 2295998090 seq 3913726350 subseq 328253 len 1428 csum 0x7e06], length 1428
10:53:06.886835 IP 112.26.0.1.37753 > 112.26.0.8.47540: Flags [.], seq 329681:331109, ack 1, win 893, options [nop,nop,TS val 142773 ecr 4294896011,mptcp dss ack 2295998090 seq 3913727778 subseq 329681 len 1428 csum 0x36c6], length 1428
10:53:06.887108 IP 112.26.0.1.37753 > 112.26.0.8.47540: Flags [.], seq 329681:331109, ack 1, win 893, options [nop,nop,TS val 142773 ecr 4294896011,mptcp dss ack 2295998090 seq 3913727778 subseq 329681 len 1428 csum 0x36c6], length 1428
10:53:06.918094 IP 112.26.0.8.47540 > 112.26.0.1.37753: Flags [.], ack 323969, win 24219, options [nop,nop,TS val 4294896810 ecr 142254,nop,nop,sack 1 {325397:329681},mptcp dss ack 3913656378], length 0
10:53:06.945923 IP 112.26.0.1.37753 > 112.26.0.8.47540: Flags [.], seq 331109:332537, ack 1, win 893, options [nop,nop,TS val 142773 ecr 4294896011,mptcp dss ack 2295998090 seq 3913729206 subseq 331109 len 1428 csum 0xe5ed], length 1428
10:53:06.946180 IP 112.26.0.1.37753 > 112.26.0.8.47540: Flags [.], seq 331109:332537, ack 1, win 893, options [nop,nop,TS val 142773 ecr 4294896011,mptcp dss ack 2295998090 seq 3913729206 subseq 331109 len 1428 csum 0xe5ed], length 1428
10:53:06.976418 IP 112.26.0.8.47540 > 112.26.0.1.37753: Flags [.], ack 323969, win 24486, options [nop,nop,TS val 4294896653 ecr 142254,nop,nop,sack 1 {325397:328253},mptcp dss ack 3913639242], length 0
10:53:06.994503 IP 112.26.0.8.47540 > 112.26.0.1.37753: Flags [.], ack 323969, win 24219, options [nop,nop,TS val 4294896886 ecr 142254,nop,nop,sack 1 {325397:331109},mptcp dss ack 3913656378], length 0
10:53:07.064312 IP 112.26.0.1.37753 > 112.26.0.8.47540: Flags [.], seq 332537:333965, ack 1, win 893, options [nop,nop,TS val 142773 ecr 4294896011,mptcp dss ack 2295998090 seq 3913730634 subseq 332537 len 1428 csum 0x33e7], length 1428
10:53:07.064663 IP 112.26.0.1.37753 > 112.26.0.8.47540: Flags [.], seq 332537:333965, ack 1, win 893, options [nop,nop,TS val 142773 ecr 4294896011,mptcp dss ack 2295998090 seq 3913730634 subseq 332537 len 1428 csum 0x33e7], length 1428
10:53:07.103950 IP 112.26.0.8.47540 > 112.26.0.1.37753: Flags [.], ack 323969, win 24175, options [nop,nop,TS val 4294896996 ecr 142254,nop,nop,sack 1 {325397:332537},mptcp dss ack 3913659234], length 0
10:53:07.128999 IP 112.26.0.8.47540 > 112.26.0.1.37753: Flags [.], ack 323969, win 24219, options [nop,nop,TS val 4294896810 ecr 142254,nop,nop,sack 1 {325397:329681},mptcp dss ack 3913656378], length 0
10:53:07.140673 IP 112.26.0.1.37753 > 112.26.0.8.47540: Flags [.], seq 333965:335393, ack 1, win 893, options [nop,nop,TS val 143149 ecr 4294896392,mptcp dss ack 2295998090 seq 3913742058 subseq 333965 len 1428 csum 0x385f], length 1428
10:53:07.140983 IP 112.26.0.1.37753 > 112.26.0.8.47540: Flags [.], seq 333965:335393, ack 1, win 893, options [nop,nop,TS val 143149 ecr 4294896392,mptcp dss ack 2295998090 seq 3913742058 subseq 333965 len 1428 csum 0x385f], length 1428
