10:52:36.313381 IP 112.26.0.8.47540 > 112.26.0.1.37753: Flags [S], seq 1638377377, win 65535, options [mss 1460,sackOK,TS val 4294864994 ecr 0,nop,wscale 6,mptcp capable csum {0x387d1706caeff15f}], length 0
10:52:36.622683 IP 112.26.0.1.37753 > 112.26.0.8.47540: Flags [S.], seq 328085945, ack 1638377378, win 28560, options [mss 1460,sackOK,TS val 113064 ecr 4294864994,nop,wscale 7,mptcp capable csum {0xa9600d5f0da32383}], length 0
10:52:36.633395 IP 112.26.0.8.47540 > 112.26.0.1.37753: Flags [.], ack 1, win 1369, options [nop,nop,TS val 4294866524 ecr 113064,mptcp capable csum {0x387d1706caeff15f,0xa9600d5f0da32383},mptcp dss ack 3912698378], length 0
10:52:36.641410 IP 112.26.0.8.47540 > 112.26.0.1.37753: Flags [.], ack 1, win 1369, options [nop,nop,TS val 4294866524 ecr 113064,mptcp add-addr id 3 112.26.1.8,mptcp dss ack 3912698378], length 0
10:52:36.720669 IP 112.26.0.8.47540 > 112.26.0.1.37753: Flags [.], ack 1, win 1369, options [nop,nop,TS val 4294866524 ecr 113064,mptcp add-addr id 4 112.26.2.8,mptcp dss ack 3912698378], length 0
10:52:36.738530 IP 112.26.0.8.47540 > 112.26.0.1.37753: Flags [.], ack 1, win 1369, options [nop,nop,TS val 4294866524 ecr 113064,mptcp add-addr id 5 112.26.3.8,mptcp dss ack 3912698378], length 0
10:52:36.850320 IP 112.26.0.1.37753 > 112.26.0.8.47540: Flags [.], ack 1, win 224, options [nop,nop,TS val 113370 ecr 4294866524,mptcp add-addr id 3 112.26.1.1,mptcp dss ack 2295998090], length 0
10:53:01.212626 IP 112.26.0.8.47540 > 112.26.0.1.37753: Flags [.], ack 263993, win 24422, options [nop,nop,TS val 4294891083 ecr 137359,mptcp dss ack 3913399338], length 0
10:53:01.245888 IP 112.26.0.8.47540 > 112.26.0.1.37753: Flags [.], ack 256853, win 24422, options [nop,nop,TS val 4294890339 ecr 136572,mptcp dss ack 3913399338], length 0
10:53:01.298707 IP 112.26.0.8.47540 > 112.26.0.1.37753: Flags [.], ack 258281, win 24422, options [nop,nop,TS val 4294890617 ecr 136946,mptcp dss ack 3913399338], length 0
10:53:14.681704 IP 112.26.0.8.47540 > 112.26.0.1.37753: Flags [.], ack 391085, win 24151, options [nop,nop,TS val 4294904104 ecr 147969,nop,nop,sack 2 {411077:413933}{403937:409649},mptcp dss ack 3913957686], length 0
10:53:31.682152 IP 112.26.0.8.47540 > 112.26.0.1.37753: Flags [.], ack 595289, win 24275, options [nop,nop,TS val 4294921574 ecr 166328,nop,nop,sack 1 {596717:609569},mptcp dss ack 3914707386], length 0
10:53:49.909686 IP 112.26.0.8.47540 > 112.26.0.1.37753: Flags [.], ack 803777, win 24471, options [nop,nop,TS val 4294939801 ecr 185594,mptcp dss ack 3915655578], length 0
10:54:01.716641 IP 112.26.0.8.47540 > 112.26.0.1.37753: Flags [.], ack 925157, win 24289, options [nop,nop,TS val 4294951606 ecr 195580,nop,nop,sack 2 {939437:940865}{936581:938009},mptcp dss ack 3916128246], length 0
10:54:01.780911 IP 112.26.0.8.47540 > 112.26.0.1.37753: Flags [.], ack 925157, win 24289, options [nop,nop,TS val 4294951606 ecr 195580,nop,nop,sack 2 {939437:940865}{936581:938009},mptcp dss ack 3916128246], length 0
10:54:01.787524 IP 112.26.0.8.47540 > 112.26.0.1.37753: Flags [.], ack 925157, win 24289, options [nop,nop,TS val 4294951606 ecr 195580,nop,nop,sack 2 {939437:940865}{936581:938009},mptcp dss ack 3916128246], length 0
10:54:01.918443 IP 112.26.0.8.47540 > 112.26.0.1.37753: Flags [.], ack 925157, win 24289, options [nop,nop,TS val 4294951809 ecr 195580,nop,nop,sack 2 {942293:943721}{939437:940865},mptcp dss ack 3916128246], length 0
10:54:01.921589 IP 112.26.0.8.47540 > 112.26.0.1.37753: Flags [.], ack 925157, win 24289, options [nop,nop,TS val 4294951809 ecr 195580,nop,nop,sack 2 {942293:943721}{939437:940865},mptcp dss ack 3916128246], length 0
10:54:01.928453 IP 112.26.0.8.47540 > 112.26.0.1.37753: Flags [.], ack 925157, win 24289, options [nop,nop,TS val 4294951809 ecr 195580,nop,nop,sack 2 {942293:943721}{939437:940865},mptcp dss ack 3916128246], length 0
10:54:02.054588 IP 112.26.0.8.47540 > 112.26.0.1.37753: Flags [.], ack 925157, win 24289, options [nop,nop,TS val 4294951945 ecr 195580,nop,nop,sack 2 {945149:946577}{942293:943721},mptcp dss ack 3916128246], length 0
10:54:02.074683 IP 112.26.0.8.47540 > 112.26.0.1.37753: Flags [.], ack 925157, win 24289, options [nop,nop,TS val 4294951945 ecr 195580,nop,nop,sack 2 {945149:946577}{942293:943721},mptcp dss ack 3916128246], length 0
10:54:02.076396 IP 112.26.0.8.47540 > 112.26.0.1.37753: Flags [.], ack 925157, win 24289, options [nop,nop,TS val 4294951945 ecr 195580,nop,nop,sack 2 {945149:946577}{942293:943721},mptcp dss ack 3916128246], length 0
10:54:02.185645 IP 112.26.0.8.47540 > 112.26.0.1.37753: Flags [.], ack 925157, win 24289, options [nop,nop,TS val 4294952078 ecr 195580,nop,nop,sack 2 {945149:948005}{942293:943721},mptcp dss ack 3916128246], length 0
10:54:02.187115 IP 112.26.0.8.47540 > 112.26.0.1.37753: Flags [.], ack 925157, win 24289, options [nop,nop,TS val 4294952078 ecr 195580,nop,nop,sack 2 {945149:948005}{942293:943721},mptcp dss ack 3916128246], length 0
10:54:02.190244 IP 112.26.0.8.47540 > 112.26.0.1.37753: Flags [.], ack 925157, win 24289, options [nop,nop,TS val 4294952078 ecr 195580,nop,nop,sack 2 {945149:948005}{942293:943721},mptcp dss ack 3916128246], length 0
10:54:02.301951 IP 112.26.0.8.47540 > 112.26.0.1.37753: Flags [.], ack 925157, win 24289, options [nop,nop,TS val 4294952194 ecr 195580,nop,nop,sack 2 {945149:949433}{942293:943721},mptcp dss ack 3916128246], length 0
10:54:02.303466 IP 112.26.0.8.47540 > 112.26.0.1.37753: Flags [.], ack 925157, win 24289, options [nop,nop,TS val 4294952194 ecr 195580,nop,nop,sack 2 {945149:949433}{942293:943721},mptcp dss ack 3916128246], length 0
10:54:02.307706 IP 112.26.0.8.47540 > 112.26.0.1.37753: Flags [.], ack 925157, win 24289, options [nop,nop,TS val 4294952194 ecr 195580,nop,nop,sack 2 {945149:949433}{942293:943721},mptcp dss ack 3916128246], length 0
10:54:02.426333 IP 112.26.0.8.47540 > 112.26.0.1.37753: Flags [.], ack 925157, win 24289, options [nop,nop,TS val 4294952318 ecr 195580,nop,nop,sack 2 {952289:953717}{945149:949433},mptcp dss ack 3916128246], length 0
10:54:02.465054 IP 112.26.0.8.47540 > 112.26.0.1.37753: Flags [.], ack 925157, win 24289, options [nop,nop,TS val 4294952318 ecr 195580,nop,nop,sack 2 {952289:953717}{945149:949433},mptcp dss ack 3916128246], length 0
10:54:02.467006 IP 112.26.0.8.47540 > 112.26.0.1.37753: Flags [.], ack 925157, win 24289, options [nop,nop,TS val 4294952318 ecr 195580,nop,nop,sack 2 {952289:953717}{945149:949433},mptcp dss ack 3916128246], length 0
10:54:02.537590 IP 112.26.0.8.47540 > 112.26.0.1.37753: Flags [.], ack 925157, win 24289, options [nop,nop,TS val 4294952429 ecr 195580,nop,nop,sack 2 {952289:955145}{945149:949433},mptcp dss ack 3916128246], length 0
10:54:02.539783 IP 112.26.0.8.47540 > 112.26.0.1.37753: Flags [.], ack 925157, win 24289, options [nop,nop,TS val 4294952429 ecr 195580,nop,nop,sack 2 {952289:955145}{945149:949433},mptcp dss ack 3916128246], length 0
10:54:02.564999 IP 112.26.0.8.47540 > 112.26.0.1.37753: Flags [.], ack 925157, win 24289, options [nop,nop,TS val 4294952429 ecr 195580,nop,nop,sack 2 {952289:955145}{945149:949433},mptcp dss ack 3916128246], length 0
10:54:02.683162 IP 112.26.0.8.47540 > 112.26.0.1.37753: Flags [.], ack 935153, win 23509, options [nop,nop,TS val 4294952570 ecr 197697,nop,nop,sack 2 {952289:955145}{945149:949433},mptcp dss ack 3916178226], length 0
10:54:02.696713 IP 112.26.0.8.47540 > 112.26.0.1.37753: Flags [.], ack 935153, win 23509, options [nop,nop,TS val 4294952570 ecr 197697,nop,nop,sack 2 {952289:955145}{945149:949433},mptcp dss ack 3916178226], length 0
10:54:02.700145 IP 112.26.0.8.47540 > 112.26.0.1.37753: Flags [.], ack 935153, win 23509, options [nop,nop,TS val 4294952570 ecr 197697,nop,nop,sack 2 {952289:955145}{945149:949433},mptcp dss ack 3916178226], length 0
10:54:02.831693 IP 112.26.0.8.47540 > 112.26.0.1.37753: Flags [.], ack 935153, win 23976, options [nop,nop,TS val 4294952723 ecr 197697,nop,nop,sack 2 {956573:958001}{952289:955145},mptcp dss ack 3916178226], length 0
10:54:02.834143 IP 112.26.0.8.47540 > 112.26.0.1.37753: Flags [.], ack 935153, win 23976, options [nop,nop,TS val 4294952723 ecr 197697,nop,nop,sack 2 {956573:958001}{952289:955145},mptcp dss ack 3916178226], length 0
10:54:02.836920 IP 112.26.0.8.47540 > 112.26.0.1.37753: Flags [.], ack 935153, win 23976, options [nop,nop,TS val 4294952723 ecr 197697,nop,nop,sack 2 {956573:958001}{952289:955145},mptcp dss ack 3916178226], length 0
10:54:02.969112 IP 112.26.0.8.47540 > 112.26.0.1.37753: Flags [.], ack 938009, win 23932, options [nop,nop,TS val 4294952859 ecr 198288,nop,nop,sack 2 {956573:958001}{952289:955145},mptcp dss ack 3916181082], length 0
10:54:02.972784 IP 112.26.0.8.47540 > 112.26.0.1.37753: Flags [.], ack 938009, win 23932, options [nop,nop,TS val 4294952859 ecr 198288,nop,nop,sack 2 {956573:958001}{952289:955145},mptcp dss ack 3916181082], length 0
10:54:02.990304 IP 112.26.0.8.47540 > 112.26.0.1.37753: Flags [.], ack 938009, win 23932, options [nop,nop,TS val 4294952859 ecr 198288,nop,nop,sack 2 {956573:958001}{952289:955145},mptcp dss ack 3916181082], length 0
10:54:03.071621 IP 112.26.0.8.47540 > 112.26.0.1.37753: Flags [.], ack 940865, win 23888, options [nop,nop,TS val 4294952963 ecr 198429,nop,nop,sack 2 {956573:958001}{952289:955145},mptcp dss ack 3916183938], length 0
10:54:03.109176 IP 112.26.0.8.47540 > 112.26.0.1.37753: Flags [.], ack 940865, win 23888, options [nop,nop,TS val 4294952963 ecr 198429,nop,nop,sack 2 {956573:958001}{952289:955145},mptcp dss ack 3916183938], length 0
10:54:03.110744 IP 112.26.0.8.47540 > 112.26.0.1.37753: Flags [.], ack 940865, win 23888, options [nop,nop,TS val 4294952963 ecr 198429,nop,nop,sack 2 {956573:958001}{952289:955145},mptcp dss ack 3916183938], length 0
10:54:03.209275 IP 112.26.0.8.47540 > 112.26.0.1.37753: Flags [.], ack 943721, win 23790, options [nop,nop,TS val 4294953101 ecr 198718,nop,nop,sack 2 {956573:958001}{952289:955145},mptcp dss ack 3916192506], length 0
10:54:03.214099 IP 112.26.0.8.47540 > 112.26.0.1.37753: Flags [.], ack 943721, win 23790, options [nop,nop,TS val 4294953101 ecr 198718,nop,nop,sack 2 {956573:958001}{952289:955145},mptcp dss ack 3916192506], length 0
10:54:03.216626 IP 112.26.0.8.47540 > 112.26.0.1.37753: Flags [.], ack 943721, win 23790, options [nop,nop,TS val 4294953101 ecr 198718,nop,nop,sack 2 {956573:958001}{952289:955145},mptcp dss ack 3916192506], length 0
10:54:03.376579 IP 112.26.0.8.47540 > 112.26.0.1.37753: Flags [.], ack 943721, win 23886, options [nop,nop,TS val 4294953267 ecr 198718,nop,nop,sack 2 {959429:960857}{956573:958001},mptcp dss ack 3916192506], length 0
10:54:03.393302 IP 112.26.0.8.47540 > 112.26.0.1.37753: Flags [.], ack 943721, win 23886, options [nop,nop,TS val 4294953267 ecr 198718,nop,nop,sack 2 {959429:960857}{956573:958001},mptcp dss ack 3916192506], length 0
10:54:03.396281 IP 112.26.0.8.47540 > 112.26.0.1.37753: Flags [.], ack 943721, win 23886, options [nop,nop,TS val 4294953267 ecr 198718,nop,nop,sack 2 {959429:960857}{956573:958001},mptcp dss ack 3916192506], length 0
10:54:03.520465 IP 112.26.0.8.47540 > 112.26.0.1.37753: Flags [.], ack 943721, win 23886, options [nop,nop,TS val 4294953409 ecr 198718,nop,nop,sack 2 {945149:950861}{959429:960857},mptcp dss ack 3916192506], length 0
10:54:03.539389 IP 112.26.0.8.47540 > 112.26.0.1.37753: Flags [.], ack 943721, win 23886, options [nop,nop,TS val 4294953409 ecr 198718,nop,nop,sack 2 {945149:950861}{959429:960857},mptcp dss ack 3916192506], length 0
10:54:03.542178 IP 112.26.0.8.47540 > 112.26.0.1.37753: Flags [.], ack 943721, win 23886, options [nop,nop,TS val 4294953409 ecr 198718,nop,nop,sack 2 {945149:950861}{959429:960857},mptcp dss ack 3916192506], length 0
10:54:03.626440 IP 112.26.0.8.47540 > 112.26.0.1.37753: Flags [.], ack 943721, win 23886, options [nop,nop,TS val 4294953518 ecr 198718,nop,nop,sack 2 {945149:955145}{959429:960857},mptcp dss ack 3916192506], length 0
10:54:03.671205 IP 112.26.0.8.47540 > 112.26.0.1.37753: Flags [.], ack 943721, win 23886, options [nop,nop,TS val 4294953518 ecr 198718,nop,nop,sack 2 {945149:955145}{959429:960857},mptcp dss ack 3916192506], length 0
10:54:03.673306 IP 112.26.0.8.47540 > 112.26.0.1.37753: Flags [.], ack 943721, win 23886, options [nop,nop,TS val 4294953518 ecr 198718,nop,nop,sack 2 {945149:955145}{959429:960857},mptcp dss ack 3916192506], length 0
10:54:03.738151 IP 112.26.0.8.47540 > 112.26.0.1.37753: Flags [.], ack 943721, win 23886, options [nop,nop,TS val 4294953624 ecr 198718,nop,nop,sack 2 {945149:958001}{959429:960857},mptcp dss ack 3916192506], length 0
10:54:03.832806 IP 112.26.0.8.47540 > 112.26.0.1.37753: Flags [.], ack 943721, win 23886, options [nop,nop,TS val 4294953724 ecr 198718,nop,nop,sack 2 {962285:963713}{945149:958001},mptcp dss ack 3916192506], length 0
10:54:03.857062 IP 112.26.0.8.47540 > 112.26.0.1.37753: Flags [.], ack 943721, win 23886, options [nop,nop,TS val 4294953624 ecr 198718,nop,nop,sack 2 {945149:958001}{959429:960857},mptcp dss ack 3916192506], length 0
10:54:03.897241 IP 112.26.0.8.47540 > 112.26.0.1.37753: Flags [.], ack 943721, win 23886, options [nop,nop,TS val 4294953624 ecr 198718,nop,nop,sack 2 {945149:958001}{959429:960857},mptcp dss ack 3916192506], length 0
10:54:03.948814 IP 112.26.0.8.47540 > 112.26.0.1.37753: Flags [.], ack 943721, win 23886, options [nop,nop,TS val 4294953841 ecr 198718,nop,nop,sack 2 {962285:965141}{945149:958001},mptcp dss ack 3916192506], length 0
10:54:03.973611 IP 112.26.0.8.47540 > 112.26.0.1.37753: Flags [.], ack 943721, win 23886, options [nop,nop,TS val 4294953724 ecr 198718,nop,nop,sack 2 {962285:963713}{945149:958001},mptcp dss ack 3916192506], length 0
10:54:03.978560 IP 112.26.0.8.47540 > 112.26.0.1.37753: Flags [.], ack 943721, win 23886, options [nop,nop,TS val 4294953724 ecr 198718,nop,nop,sack 2 {962285:963713}{945149:958001},mptcp dss ack 3916192506], length 0
10:54:04.096097 IP 112.26.0.8.47540 > 112.26.0.1.37753: Flags [.], ack 943721, win 23886, options [nop,nop,TS val 4294953841 ecr 198718,nop,nop,sack 2 {962285:965141}{945149:958001},mptcp dss ack 3916192506], length 0
10:54:04.100671 IP 112.26.0.8.47540 > 112.26.0.1.37753: Flags [.], ack 943721, win 23886, options [nop,nop,TS val 4294953841 ecr 198718,nop,nop,sack 2 {962285:965141}{945149:958001},mptcp dss ack 3916192506], length 0
10:54:04.128378 IP 112.26.0.8.47540 > 112.26.0.1.37753: Flags [.], ack 943721, win 23886, options [nop,nop,TS val 4294954020 ecr 198718,nop,nop,sack 2 {962285:966569}{945149:958001},mptcp dss ack 3916192506], length 0
10:54:04.166637 IP 112.26.0.8.47540 > 112.26.0.1.37753: Flags [.], ack 943721, win 23886, options [nop,nop,TS val 4294954020 ecr 198718,nop,nop,sack 2 {962285:966569}{945149:958001},mptcp dss ack 3916192506], length 0
10:54:04.241518 IP 112.26.0.8.47540 > 112.26.0.1.37753: Flags [.], ack 943721, win 23886, options [nop,nop,TS val 4294954020 ecr 198718,nop,nop,sack 2 {962285:966569}{945149:958001},mptcp dss ack 3916192506], length 0
10:54:04.265820 IP 112.26.0.8.47540 > 112.26.0.1.37753: Flags [.], ack 943721, win 23886, options [nop,nop,TS val 4294954158 ecr 198718,nop,nop,sack 2 {967997:969425}{962285:966569},mptcp dss ack 3916192506], length 0
10:54:04.298362 IP 112.26.0.8.47540 > 112.26.0.1.37753: Flags [.], ack 943721, win 23886, options [nop,nop,TS val 4294954158 ecr 198718,nop,nop,sack 2 {967997:969425}{962285:966569},mptcp dss ack 3916192506], length 0
10:54:04.299987 IP 112.26.0.8.47540 > 112.26.0.1.37753: Flags [.], ack 943721, win 23886, options [nop,nop,TS val 4294954158 ecr 198718,nop,nop,sack 2 {967997:969425}{962285:966569},mptcp dss ack 3916192506], length 0
10:54:04.362710 IP 112.26.0.8.47540 > 112.26.0.1.37753: Flags [.], ack 943721, win 23886, options [nop,nop,TS val 4294954250 ecr 198718,nop,nop,sack 2 {967997:970853}{962285:966569},mptcp dss ack 3916192506], length 0
10:54:04.381184 IP 112.26.0.8.47540 > 112.26.0.1.37753: Flags [.], ack 943721, win 23886, options [nop,nop,TS val 4294954250 ecr 198718,nop,nop,sack 2 {967997:970853}{962285:966569},mptcp dss ack 3916192506], length 0
10:54:04.476863 IP 112.26.0.8.47540 > 112.26.0.1.37753: Flags [.], ack 943721, win 23886, options [nop,nop,TS val 4294954250 ecr 198718,nop,nop,sack 2 {967997:970853}{962285:966569},mptcp dss ack 3916192506], length 0
10:54:04.526919 IP 112.26.0.8.47540 > 112.26.0.1.37753: Flags [.], ack 943721, win 23886, options [nop,nop,TS val 4294954418 ecr 198718,nop,nop,sack 2 {967997:972281}{962285:966569},mptcp dss ack 3916192506], length 0
10:54:04.528592 IP 112.26.0.8.47540 > 112.26.0.1.37753: Flags [.], ack 943721, win 23886, options [nop,nop,TS val 4294954418 ecr 198718,nop,nop,sack 2 {967997:972281}{962285:966569},mptcp dss ack 3916192506], length 0
10:54:04.533750 IP 112.26.0.8.47540 > 112.26.0.1.37753: Flags [.], ack 943721, win 23886, options [nop,nop,TS val 4294954418 ecr 198718,nop,nop,sack 2 {967997:972281}{962285:966569},mptcp dss ack 3916192506], length 0
10:54:04.647942 IP 112.26.0.8.47540 > 112.26.0.1.37753: Flags [.], ack 958001, win 23095, options [nop,nop,TS val 4294954535 ecr 200038,nop,nop,sack 2 {967997:972281}{962285:966569},mptcp dss ack 3916252482], length 0
10:54:04.649948 IP 112.26.0.8.47540 > 112.26.0.1.37753: Flags [.], ack 958001, win 23095, options [nop,nop,TS val 4294954535 ecr 200038,nop,nop,sack 2 {967997:972281}{962285:966569},mptcp dss ack 3916252482], length 0
10:54:04.651787 IP 112.26.0.8.47540 > 112.26.0.1.37753: Flags [.], ack 958001, win 23095, options [nop,nop,TS val 4294954535 ecr 200038,nop,nop,sack 2 {967997:972281}{962285:966569},mptcp dss ack 3916252482], length 0
10:54:04.761742 IP 112.26.0.8.47540 > 112.26.0.1.37753: Flags [.], ack 958001, win 23736, options [nop,nop,TS val 4294954653 ecr 200038,nop,nop,sack 2 {967997:973709}{962285:966569},mptcp dss ack 3916252482], length 0
10:54:04.768473 IP 112.26.0.8.47540 > 112.26.0.1.37753: Flags [.], ack 958001, win 23736, options [nop,nop,TS val 4294954653 ecr 200038,nop,nop,sack 2 {967997:973709}{962285:966569},mptcp dss ack 3916252482], length 0
10:54:04.770517 IP 112.26.0.8.47540 > 112.26.0.1.37753: Flags [.], ack 958001, win 23736, options [nop,nop,TS val 4294954653 ecr 200038,nop,nop,sack 2 {967997:973709}{962285:966569},mptcp dss ack 3916252482], length 0
10:54:04.870385 IP 112.26.0.8.47540 > 112.26.0.1.37753: Flags [.], ack 958001, win 23736, options [nop,nop,TS val 4294954743 ecr 200038,nop,nop,sack 2 {967997:975137}{962285:966569},mptcp dss ack 3916252482], length 0
10:54:04.914751 IP 112.26.0.8.47540 > 112.26.0.1.37753: Flags [.], ack 958001, win 23736, options [nop,nop,TS val 4294954743 ecr 200038,nop,nop,sack 2 {967997:975137}{962285:966569},mptcp dss ack 3916252482], length 0
10:54:04.916245 IP 112.26.0.8.47540 > 112.26.0.1.37753: Flags [.], ack 958001, win 23736, options [nop,nop,TS val 4294954743 ecr 200038,nop,nop,sack 2 {967997:975137}{962285:966569},mptcp dss ack 3916252482], length 0
10:54:04.947979 IP 112.26.0.8.47540 > 112.26.0.1.37753: Flags [.], ack 958001, win 23736, options [nop,nop,TS val 4294954835 ecr 200038,nop,nop,sack 2 {967997:976565}{962285:966569},mptcp dss ack 3916252482], length 0
10:54:05.004844 IP 112.26.0.8.47540 > 112.26.0.1.37753: Flags [.], ack 958001, win 23736, options [nop,nop,TS val 4294954835 ecr 200038,nop,nop,sack 2 {967997:976565}{962285:966569},mptcp dss ack 3916252482], length 0
10:54:05.007213 IP 112.26.0.8.47540 > 112.26.0.1.37753: Flags [.], ack 958001, win 23736, options [nop,nop,TS val 4294954835 ecr 200038,nop,nop,sack 2 {967997:976565}{962285:966569},mptcp dss ack 3916252482], length 0
10:54:05.062515 IP 112.26.0.8.47540 > 112.26.0.1.37753: Flags [.], ack 958001, win 23736, options [nop,nop,TS val 4294954945 ecr 200038,nop,nop,sack 2 {967997:977993}{962285:966569},mptcp dss ack 3916252482], length 0
10:54:05.108485 IP 112.26.0.8.47540 > 112.26.0.1.37753: Flags [.], ack 958001, win 23736, options [nop,nop,TS val 4294954945 ecr 200038,nop,nop,sack 2 {967997:977993}{962285:966569},mptcp dss ack 3916252482], length 0
10:54:05.111314 IP 112.26.0.8.47540 > 112.26.0.1.37753: Flags [.], ack 958001, win 23736, options [nop,nop,TS val 4294954945 ecr 200038,nop,nop,sack 2 {967997:977993}{962285:966569},mptcp dss ack 3916252482], length 0
10:54:05.139779 IP 112.26.0.8.47540 > 112.26.0.1.37753: Flags [.], ack 958001, win 23736, options [nop,nop,TS val 4294955031 ecr 200038,nop,nop,sack 2 {967997:979421}{962285:966569},mptcp dss ack 3916252482], length 0
10:54:05.237075 IP 112.26.0.8.47540 > 112.26.0.1.37753: Flags [.], ack 958001, win 23736, options [nop,nop,TS val 4294955031 ecr 200038,nop,nop,sack 2 {967997:979421}{962285:966569},mptcp dss ack 3916252482], length 0
10:54:05.238997 IP 112.26.0.8.47540 > 112.26.0.1.37753: Flags [.], ack 958001, win 23736, options [nop,nop,TS val 4294955031 ecr 200038,nop,nop,sack 2 {967997:979421}{962285:966569},mptcp dss ack 3916252482], length 0
10:54:05.269151 IP 112.26.0.8.47540 > 112.26.0.1.37753: Flags [.], ack 960857, win 23550, options [nop,nop,TS val 4294955160 ecr 200941,nop,nop,sack 2 {967997:979421}{962285:966569},mptcp dss ack 3916295322], length 0
10:54:05.375246 IP 112.26.0.8.47540 > 112.26.0.1.37753: Flags [.], ack 960857, win 23550, options [nop,nop,TS val 4294955160 ecr 200941,nop,nop,sack 2 {967997:979421}{962285:966569},mptcp dss ack 3916295322], length 0
10:54:05.377316 IP 112.26.0.8.47540 > 112.26.0.1.37753: Flags [.], ack 960857, win 23550, options [nop,nop,TS val 4294955160 ecr 200941,nop,nop,sack 2 {967997:979421}{962285:966569},mptcp dss ack 3916295322], length 0
10:54:05.408647 IP 112.26.0.8.47540 > 112.26.0.1.37753: Flags [.], ack 960857, win 24004, options [nop,nop,TS val 4294955255 ecr 200941,nop,nop,sack 1 {962285:979421},mptcp dss ack 3916295322], length 0
10:54:05.446449 IP 112.26.0.8.47540 > 112.26.0.1.37753: Flags [.], ack 960857, win 24004, options [nop,nop,TS val 4294955255 ecr 200941,nop,nop,sack 1 {962285:979421},mptcp dss ack 3916295322], length 0
10:54:05.448234 IP 112.26.0.8.47540 > 112.26.0.1.37753: Flags [.], ack 960857, win 24004, options [nop,nop,TS val 4294955255 ecr 200941,nop,nop,sack 1 {962285:979421},mptcp dss ack 3916295322], length 0
10:54:05.503774 IP 112.26.0.8.47540 > 112.26.0.1.37753: Flags [.], ack 960857, win 24004, options [nop,nop,TS val 4294955357 ecr 200941,nop,nop,sack 1 {962285:980849},mptcp dss ack 3916295322], length 0
10:54:05.536794 IP 112.26.0.8.47540 > 112.26.0.1.37753: Flags [.], ack 960857, win 24004, options [nop,nop,TS val 4294955357 ecr 200941,nop,nop,sack 1 {962285:980849},mptcp dss ack 3916295322], length 0
10:54:05.538401 IP 112.26.0.8.47540 > 112.26.0.1.37753: Flags [.], ack 960857, win 24004, options [nop,nop,TS val 4294955357 ecr 200941,nop,nop,sack 1 {962285:980849},mptcp dss ack 3916295322], length 0
10:54:05.550587 IP 112.26.0.8.47540 > 112.26.0.1.37753: Flags [.], ack 960857, win 24004, options [nop,nop,TS val 4294955417 ecr 200941,nop,nop,sack 1 {962285:982277},mptcp dss ack 3916295322], length 0
10:54:05.614986 IP 112.26.0.8.47540 > 112.26.0.1.37753: Flags [.], ack 982277, win 23632, options [nop,nop,TS val 4294955507 ecr 201753,mptcp dss ack 3916335306], length 0
10:54:05.633287 IP 112.26.0.8.47540 > 112.26.0.1.37753: Flags [.], ack 960857, win 24004, options [nop,nop,TS val 4294955417 ecr 200941,nop,nop,sack 1 {962285:982277},mptcp dss ack 3916295322], length 0
10:54:05.635392 IP 112.26.0.8.47540 > 112.26.0.1.37753: Flags [.], ack 960857, win 24004, options [nop,nop,TS val 4294955417 ecr 200941,nop,nop,sack 1 {962285:982277},mptcp dss ack 3916295322], length 0
10:54:05.687671 IP 112.26.0.8.47540 > 112.26.0.1.37753: Flags [.], ack 982277, win 23632, options [nop,nop,TS val 4294955507 ecr 201753,mptcp dss ack 3916335306], length 0
10:54:05.689543 IP 112.26.0.8.47540 > 112.26.0.1.37753: Flags [.], ack 982277, win 23632, options [nop,nop,TS val 4294955507 ecr 201753,mptcp dss ack 3916335306], length 0
10:54:05.799322 IP 112.26.0.8.47540 > 112.26.0.1.37753: Flags [.], ack 982278, win 24576, options [nop,nop,TS val 4294955692 ecr 202385,mptcp dss ack 3916393019], length 0
10:54:05.803128 IP 112.26.0.8.47540 > 112.26.0.1.37753: Flags [.], ack 982278, win 24576, options [nop,nop,TS val 4294955692 ecr 202385,mptcp dss ack 3916393019], length 0
10:54:05.807028 IP 112.26.0.8.47540 > 112.26.0.1.37753: Flags [.], ack 982278, win 24576, options [nop,nop,TS val 4294955692 ecr 202385,mptcp dss ack 3916393019], length 0
10:54:05.944202 IP 112.26.0.8.47540 > 112.26.0.1.37753: Flags [F.], seq 1, ack 982278, win 24576, options [nop,nop,TS val 4294955779 ecr 202385,mptcp dss ack 3916393019], length 0
10:54:05.945915 IP 112.26.0.8.47540 > 112.26.0.1.37753: Flags [F.], seq 1, ack 982278, win 24576, options [nop,nop,TS val 4294955779 ecr 202385,mptcp dss ack 3916393019], length 0
10:54:05.958334 IP 112.26.0.8.47540 > 112.26.0.1.37753: Flags [F.], seq 1, ack 982278, win 24576, options [nop,nop,TS val 4294955779 ecr 202385,mptcp dss ack 3916393019], length 0

