10:52:44.093223 IP 112.26.2.8.44397 > 112.26.2.1.37753: Flags [S], seq 2791519187, win 65535, options [mss 1460,sackOK,TS val 4294873967 ecr 0,nop,wscale 6,mptcp join id 4 token 0xd15e4cde nonce 0x156fce22], length 0
10:52:44.170824 IP 112.26.2.8.44397 > 112.26.2.1.37753: Flags [S], seq 2791519187, win 65535, options [mss 1460,sackOK,TS val 4294873967 ecr 0,nop,wscale 6,mptcp join id 4 token 0xd15e4cde nonce 0x156fce22], length 0
10:52:44.409363 IP 112.26.2.1.37753 > 112.26.2.8.44397: Flags [S.], seq 1823757429, ack 2791519188, win 28560, options [mss 1460,sackOK,TS val 120874 ecr 4294873967,nop,wscale 7,mptcp join id 6 hmac 0x9180a648a613b37a nonce 0x4f6f39cd], length 0
10:52:44.409663 IP 112.26.2.8.44397 > 112.26.2.1.37753: Flags [.], ack 1, win 5612, options [nop,nop,TS val 4294874303 ecr 120874,mptcp join hmac 0xaeeb9b2491d3cee2f82d2bbe89c74c4650f6fe81], length 0
10:52:44.485374 IP 112.26.2.8.44397 > 112.26.2.1.37753: Flags [.], ack 1, win 5612, options [nop,nop,TS val 4294874303 ecr 120874,mptcp join hmac 0xaeeb9b2491d3cee2f82d2bbe89c74c4650f6fe81], length 0
10:52:44.513314 IP 112.26.2.1.37753 > 112.26.2.8.44397: Flags [.], ack 1, win 447, options [nop,nop,TS val 121129 ecr 4294874303,mptcp dss ack 2295998090], length 0
10:52:44.616873 IP 112.26.2.1.37753 > 112.26.2.8.44397: Flags [.], seq 1:1429, ack 1, win 447, options [nop,nop,TS val 121129 ecr 4294874303,mptcp dss ack 2295998090 seq 3912803862 subseq 1 len 1428 csum 0xa4a], length 1428
10:53:26.844335 IP 112.26.2.1.37753 > 112.26.2.8.44397: Flags [.], seq 459817:461245, ack 1, win 893, options [nop,nop,TS val 162253 ecr 4294915486,mptcp dss ack 2295998090 seq 3914603142 subseq 459817 len 1428 csum 0x96d8], length 1428
10:53:26.844550 IP 112.26.2.8.44397 > 112.26.2.1.37753: Flags [.], ack 448393, win 24418, options [nop,nop,TS val 4294916738 ecr 161681,nop,nop,sack 2 {456961:461245}{449821:455533},mptcp dss ack 3914563158], length 0
10:53:26.855397 IP 112.26.2.8.44397 > 112.26.2.1.37753: Flags [.], ack 448393, win 24418, options [nop,nop,TS val 4294916738 ecr 161681,nop,nop,sack 2 {456961:461245}{449821:455533},mptcp dss ack 3914563158], length 0
10:53:26.959744 IP 112.26.2.1.37753 > 112.26.2.8.44397: Flags [.], seq 461245:462673, ack 1, win 893, options [nop,nop,TS val 162253 ecr 4294915486,mptcp dss ack 2295998090 seq 3914604570 subseq 461245 len 1428 csum 0xcf6f], length 1428
10:53:26.959968 IP 112.26.2.8.44397 > 112.26.2.1.37753: Flags [.], ack 448393, win 24418, options [nop,nop,TS val 4294916853 ecr 161681,nop,nop,sack 2 {456961:462673}{449821:455533},mptcp dss ack 3914563158], length 0
10:53:26.963747 IP 112.26.2.8.44397 > 112.26.2.1.37753: Flags [.], ack 448393, win 24418, options [nop,nop,TS val 4294916853 ecr 161681,nop,nop,sack 2 {456961:462673}{449821:455533},mptcp dss ack 3914563158], length 0
10:53:27.060314 IP 112.26.2.1.37753 > 112.26.2.8.44397: Flags [.], seq 462673:464101, ack 1, win 893, options [nop,nop,TS val 162505 ecr 4294915745,mptcp dss ack 2295998090 seq 3914617422 subseq 462673 len 1428 csum 0x657e], length 1428
10:53:27.060536 IP 112.26.2.8.44397 > 112.26.2.1.37753: Flags [.], ack 448393, win 24418, options [nop,nop,TS val 4294916953 ecr 161681,nop,nop,sack 2 {456961:464101}{449821:455533},mptcp dss ack 3914563158], length 0
10:53:27.090237 IP 112.26.2.8.44397 > 112.26.2.1.37753: Flags [.], ack 448393, win 24418, options [nop,nop,TS val 4294916953 ecr 161681,nop,nop,sack 2 {456961:464101}{449821:455533},mptcp dss ack 3914563158], length 0
10:53:27.142212 IP 112.26.2.1.37753 > 112.26.2.8.44397: Flags [.], seq 464101:465529, ack 1, win 893, options [nop,nop,TS val 162505 ecr 4294915745,mptcp dss ack 2295998090 seq 3914618850 subseq 464101 len 1428 csum 0xfd50], length 1428
10:53:27.142437 IP 112.26.2.8.44397 > 112.26.2.1.37753: Flags [.], ack 448393, win 24418, options [nop,nop,TS val 4294917035 ecr 161681,nop,nop,sack 2 {456961:465529}{449821:455533},mptcp dss ack 3914563158], length 0
10:53:27.200775 IP 112.26.2.8.44397 > 112.26.2.1.37753: Flags [.], ack 448393, win 24418, options [nop,nop,TS val 4294917035 ecr 161681,nop,nop,sack 2 {456961:465529}{449821:455533},mptcp dss ack 3914563158], length 0
10:53:27.276726 IP 112.26.2.1.37753 > 112.26.2.8.44397: Flags [.], seq 465529:466957, ack 1, win 893, options [nop,nop,TS val 162505 ecr 4294915745,mptcp dss ack 2295998090 seq 3914620278 subseq 465529 len 1428 csum 0x527f], length 1428
10:53:27.276917 IP 112.26.2.8.44397 > 112.26.2.1.37753: Flags [.], ack 448393, win 24418, options [nop,nop,TS val 4294917170 ecr 161681,nop,nop,sack 2 {456961:466957}{449821:455533},mptcp dss ack 3914563158], length 0
10:53:27.315721 IP 112.26.2.8.44397 > 112.26.2.1.37753: Flags [.], ack 448393, win 24418, options [nop,nop,TS val 4294917170 ecr 161681,nop,nop,sack 2 {456961:466957}{449821:455533},mptcp dss ack 3914563158], length 0
10:53:27.397899 IP 112.26.2.1.37753 > 112.26.2.8.44397: Flags [.], seq 468385:469813, ack 1, win 893, options [nop,nop,TS val 162731 ecr 4294915969,mptcp dss ack 2295998090 seq 3914637414 subseq 468385 len 1428 csum 0x6c38], length 1428
10:53:27.398133 IP 112.26.2.8.44397 > 112.26.2.1.37753: Flags [.], ack 448393, win 24418, options [nop,nop,TS val 4294917292 ecr 161681,nop,nop,sack 2 {468385:469813}{456961:466957},mptcp dss ack 3914563158], length 0
10:53:27.409457 IP 112.26.2.8.44397 > 112.26.2.1.37753: Flags [.], ack 448393, win 24418, options [nop,nop,TS val 4294917292 ecr 161681,nop,nop,sack 2 {468385:469813}{456961:466957},mptcp dss ack 3914563158], length 0
10:53:27.534530 IP 112.26.2.1.37753 > 112.26.2.8.44397: Flags [.], seq 469813:471241, ack 1, win 893, options [nop,nop,TS val 162731 ecr 4294915969,mptcp dss ack 2295998090 seq 3914638842 subseq 469813 len 1428 csum 0xf372], length 1428
10:53:27.534762 IP 112.26.2.8.44397 > 112.26.2.1.37753: Flags [.], ack 448393, win 24418, options [nop,nop,TS val 4294917428 ecr 161681,nop,nop,sack 2 {468385:471241}{456961:466957},mptcp dss ack 3914563158], length 0
10:53:27.542218 IP 112.26.2.8.44397 > 112.26.2.1.37753: Flags [.], ack 448393, win 24418, options [nop,nop,TS val 4294917428 ecr 161681,nop,nop,sack 2 {468385:471241}{456961:466957},mptcp dss ack 3914563158], length 0
10:53:27.648922 IP 112.26.2.1.37753 > 112.26.2.8.44397: Flags [.], seq 472669:474097, ack 1, win 893, options [nop,nop,TS val 163017 ecr 4294916219,mptcp dss ack 2295998090 seq 3914651694 subseq 472669 len 1428 csum 0x7976], length 1428
10:53:27.649140 IP 112.26.2.8.44397 > 112.26.2.1.37753: Flags [.], ack 448393, win 24418, options [nop,nop,TS val 4294917543 ecr 161681,nop,nop,sack 2 {472669:474097}{468385:471241},mptcp dss ack 3914563158], length 0
10:53:27.652462 IP 112.26.2.8.44397 > 112.26.2.1.37753: Flags [.], ack 448393, win 24418, options [nop,nop,TS val 4294917543 ecr 161681,nop,nop,sack 2 {472669:474097}{468385:471241},mptcp dss ack 3914563158], length 0
10:53:27.754890 IP 112.26.2.1.37753 > 112.26.2.8.44397: Flags [.], seq 448393:449821, ack 1, win 893, options [nop,nop,TS val 163113 ecr 4294916348,mptcp dss ack 2295998090 seq 3914571726 subseq 448393 len 1428 csum 0x8b08], length 1428
10:53:27.755115 IP 112.26.2.8.44397 > 112.26.2.1.37753: Flags [.], ack 455533, win 24418, options [nop,nop,TS val 4294917649 ecr 163113,nop,nop,sack 2 {472669:474097}{468385:471241},mptcp dss ack 3914563158], length 0
10:53:27.761515 IP 112.26.2.8.44397 > 112.26.2.1.37753: Flags [.], ack 455533, win 24418, options [nop,nop,TS val 4294917649 ecr 163113,nop,nop,sack 2 {472669:474097}{468385:471241},mptcp dss ack 3914563158], length 0
10:53:27.901760 IP 112.26.2.1.37753 > 112.26.2.8.44397: Flags [.], seq 474097:475525, ack 1, win 893, options [nop,nop,TS val 163274 ecr 4294916421,mptcp dss ack 2295998090 seq 3914665974 subseq 474097 len 1428 csum 0x39e9], length 1428
10:53:27.901954 IP 112.26.2.8.44397 > 112.26.2.1.37753: Flags [.], ack 455533, win 24078, options [nop,nop,TS val 4294917795 ecr 163113,nop,nop,sack 2 {472669:475525}{468385:471241},mptcp dss ack 3914590290], length 0
10:53:27.930069 IP 112.26.2.8.44397 > 112.26.2.1.37753: Flags [.], ack 455533, win 24078, options [nop,nop,TS val 4294917795 ecr 163113,nop,nop,sack 2 {472669:475525}{468385:471241},mptcp dss ack 3914590290], length 0
10:53:28.047820 IP 112.26.2.1.37753 > 112.26.2.8.44397: Flags [.], seq 475525:476953, ack 1, win 893, options [nop,nop,TS val 163569 ecr 4294916738,mptcp dss ack 2295998090 seq 3914675970 subseq 475525 len 1428 csum 0x4b52], length 1428
10:53:28.048037 IP 112.26.2.8.44397 > 112.26.2.1.37753: Flags [.], ack 455533, win 24078, options [nop,nop,TS val 4294917941 ecr 163113,nop,nop,sack 2 {472669:476953}{468385:471241},mptcp dss ack 3914590290], length 0
10:53:28.053540 IP 112.26.2.8.44397 > 112.26.2.1.37753: Flags [.], ack 455533, win 24078, options [nop,nop,TS val 4294917941 ecr 163113,nop,nop,sack 2 {472669:476953}{468385:471241},mptcp dss ack 3914590290], length 0
10:53:28.152464 IP 112.26.2.1.37753 > 112.26.2.8.44397: Flags [.], seq 476953:478381, ack 1, win 893, options [nop,nop,TS val 163685 ecr 4294916853,mptcp dss ack 2295998090 seq 3914678826 subseq 476953 len 1428 csum 0xa288], length 1428
10:53:28.152692 IP 112.26.2.8.44397 > 112.26.2.1.37753: Flags [.], ack 455533, win 24078, options [nop,nop,TS val 4294918046 ecr 163113,nop,nop,sack 2 {472669:478381}{468385:471241},mptcp dss ack 3914590290], length 0
10:53:28.174310 IP 112.26.2.8.44397 > 112.26.2.1.37753: Flags [.], ack 455533, win 24078, options [nop,nop,TS val 4294918046 ecr 163113,nop,nop,sack 2 {472669:478381}{468385:471241},mptcp dss ack 3914590290], length 0
10:53:28.314663 IP 112.26.2.1.37753 > 112.26.2.8.44397: Flags [.], seq 466957:468385, ack 1, win 893, options [nop,nop,TS val 164057 ecr 4294917292,mptcp dss ack 2295998090 seq 3914635986 subseq 466957 len 1428 csum 0x5fe6], length 1428
10:53:28.314855 IP 112.26.2.8.44397 > 112.26.2.1.37753: Flags [.], ack 455533, win 24078, options [nop,nop,TS val 4294918208 ecr 163113,nop,nop,sack 2 {456961:471241}{472669:478381},mptcp dss ack 3914590290], length 0
10:53:28.366993 IP 112.26.2.8.44397 > 112.26.2.1.37753: Flags [.], ack 455533, win 24078, options [nop,nop,TS val 4294918208 ecr 163113,nop,nop,sack 2 {456961:471241}{472669:478381},mptcp dss ack 3914590290], length 0
10:53:28.417103 IP 112.26.2.1.37753 > 112.26.2.8.44397: Flags [.], seq 479809:481237, ack 1, win 893, options [nop,nop,TS val 164235 ecr 4294917428,mptcp dss ack 2295998090 seq 3914711670 subseq 479809 len 1428 csum 0xd389], length 1428
10:53:28.417322 IP 112.26.2.8.44397 > 112.26.2.1.37753: Flags [.], ack 455533, win 24078, options [nop,nop,TS val 4294918311 ecr 163113,nop,nop,sack 2 {479809:481237}{456961:471241},mptcp dss ack 3914590290], length 0
10:53:28.471006 IP 112.26.2.8.44397 > 112.26.2.1.37753: Flags [.], ack 455533, win 24078, options [nop,nop,TS val 4294918311 ecr 163113,nop,nop,sack 2 {479809:481237}{456961:471241},mptcp dss ack 3914590290], length 0
10:53:28.555705 IP 112.26.2.1.37753 > 112.26.2.8.44397: Flags [.], seq 481237:482665, ack 1, win 893, options [nop,nop,TS val 164407 ecr 4294917649,mptcp dss ack 2295998090 seq 3914714526 subseq 481237 len 1428 csum 0xf3b9], length 1428
10:53:28.555937 IP 112.26.2.8.44397 > 112.26.2.1.37753: Flags [.], ack 455533, win 24078, options [nop,nop,TS val 4294918449 ecr 163113,nop,nop,sack 2 {479809:482665}{456961:471241},mptcp dss ack 3914590290], length 0
10:53:28.594451 IP 112.26.2.8.44397 > 112.26.2.1.37753: Flags [.], ack 455533, win 24078, options [nop,nop,TS val 4294918449 ecr 163113,nop,nop,sack 2 {479809:482665}{456961:471241},mptcp dss ack 3914590290], length 0
10:53:28.655521 IP 112.26.2.1.37753 > 112.26.2.8.44397: Flags [.], seq 482665:484093, ack 1, win 893, options [nop,nop,TS val 164407 ecr 4294917649,mptcp dss ack 2295998090 seq 3914715954 subseq 482665 len 1428 csum 0x728b], length 1428
10:53:28.655749 IP 112.26.2.8.44397 > 112.26.2.1.37753: Flags [.], ack 455533, win 24078, options [nop,nop,TS val 4294918549 ecr 163113,nop,nop,sack 2 {479809:484093}{456961:471241},mptcp dss ack 3914590290], length 0
10:53:28.687617 IP 112.26.2.8.44397 > 112.26.2.1.37753: Flags [.], ack 455533, win 24078, options [nop,nop,TS val 4294918549 ecr 163113,nop,nop,sack 2 {479809:484093}{456961:471241},mptcp dss ack 3914590290], length 0
10:53:28.759785 IP 112.26.2.1.37753 > 112.26.2.8.44397: Flags [.], seq 484093:485521, ack 1, win 893, options [nop,nop,TS val 164407 ecr 4294917649,mptcp dss ack 2295998090 seq 3914717382 subseq 484093 len 1428 csum 0xcb1e], length 1428
10:53:28.760007 IP 112.26.2.8.44397 > 112.26.2.1.37753: Flags [.], ack 455533, win 24078, options [nop,nop,TS val 4294918653 ecr 163113,nop,nop,sack 2 {479809:485521}{456961:471241},mptcp dss ack 3914590290], length 0
10:53:28.809238 IP 112.26.2.8.44397 > 112.26.2.1.37753: Flags [.], ack 455533, win 24078, options [nop,nop,TS val 4294918653 ecr 163113,nop,nop,sack 2 {479809:485521}{456961:471241},mptcp dss ack 3914590290], length 0
10:53:28.894685 IP 112.26.2.1.37753 > 112.26.2.8.44397: Flags [.], seq 485521:486949, ack 1, win 893, options [nop,nop,TS val 164596 ecr 4294917795,mptcp dss ack 2295998090 seq 3914734518 subseq 485521 len 1428 csum 0x3449], length 1428
10:53:28.894902 IP 112.26.2.8.44397 > 112.26.2.1.37753: Flags [.], ack 455533, win 24078, options [nop,nop,TS val 4294918788 ecr 163113,nop,nop,sack 2 {479809:486949}{456961:471241},mptcp dss ack 3914590290], length 0
10:53:28.915267 IP 112.26.2.8.44397 > 112.26.2.1.37753: Flags [.], ack 455533, win 24078, options [nop,nop,TS val 4294918788 ecr 163113,nop,nop,sack 2 {479809:486949}{456961:471241},mptcp dss ack 3914590290], length 0
10:53:28.975443 IP 112.26.2.1.37753 > 112.26.2.8.44397: Flags [.], seq 455533:456961, ack 1, win 893, options [nop,nop,TS val 164704 ecr 4294917941,mptcp dss ack 2295998090 seq 3914590290 subseq 455533 len 1428 csum 0x6510], length 1428
10:53:28.975663 IP 112.26.2.8.44397 > 112.26.2.1.37753: Flags [.], ack 471241, win 23265, options [nop,nop,TS val 4294918869 ecr 164704,nop,nop,sack 2 {479809:486949}{472669:478381},mptcp dss ack 3914645982], length 0
10:53:28.979594 IP 112.26.2.8.44397 > 112.26.2.1.37753: Flags [.], ack 471241, win 23265, options [nop,nop,TS val 4294918869 ecr 164704,nop,nop,sack 2 {479809:486949}{472669:478381},mptcp dss ack 3914645982], length 0
10:53:29.086197 IP 112.26.2.1.37753 > 112.26.2.8.44397: Flags [.], seq 486949:488377, ack 1, win 893, options [nop,nop,TS val 164839 ecr 4294918046,mptcp dss ack 2295998090 seq 3914741658 subseq 486949 len 1428 csum 0x71dd], length 1428
10:53:29.086416 IP 112.26.2.8.44397 > 112.26.2.1.37753: Flags [.], ack 471241, win 23862, options [nop,nop,TS val 4294918979 ecr 164704,nop,nop,sack 2 {479809:488377}{472669:478381},mptcp dss ack 3914645982], length 0
10:53:29.098810 IP 112.26.2.8.44397 > 112.26.2.1.37753: Flags [.], ack 471241, win 23862, options [nop,nop,TS val 4294918979 ecr 164704,nop,nop,sack 2 {479809:488377}{472669:478381},mptcp dss ack 3914645982], length 0
10:53:29.185191 IP 112.26.2.1.37753 > 112.26.2.8.44397: Flags [.], seq 478381:479809, ack 1, win 893, options [nop,nop,TS val 165011 ecr 4294918208,mptcp dss ack 2295998090 seq 3914701674 subseq 478381 len 1428 csum 0xe28], length 1428
10:53:29.185410 IP 112.26.2.8.44397 > 112.26.2.1.37753: Flags [.], ack 471241, win 23862, options [nop,nop,TS val 4294919078 ecr 164704,nop,nop,sack 1 {472669:488377},mptcp dss ack 3914645982], length 0
10:53:29.219774 IP 112.26.2.8.44397 > 112.26.2.1.37753: Flags [.], ack 471241, win 23862, options [nop,nop,TS val 4294919078 ecr 164704,nop,nop,sack 1 {472669:488377},mptcp dss ack 3914645982], length 0
10:53:29.318304 IP 112.26.2.1.37753 > 112.26.2.8.44397: Flags [.], seq 488377:489805, ack 1, win 893, options [nop,nop,TS val 165159 ecr 4294918311,mptcp dss ack 2295998090 seq 3914760222 subseq 488377 len 1428 csum 0xae92], length 1428
10:53:29.318492 IP 112.26.2.8.44397 > 112.26.2.1.37753: Flags [.], ack 471241, win 23862, options [nop,nop,TS val 4294919211 ecr 164704,nop,nop,sack 1 {472669:489805},mptcp dss ack 3914645982], length 0
10:53:29.321944 IP 112.26.2.8.44397 > 112.26.2.1.37753: Flags [.], ack 471241, win 23862, options [nop,nop,TS val 4294919211 ecr 164704,nop,nop,sack 1 {472669:489805},mptcp dss ack 3914645982], length 0
10:53:29.432042 IP 112.26.2.1.37753 > 112.26.2.8.44397: Flags [.], seq 471241:472669, ack 1, win 893, options [nop,nop,TS val 165250 ecr 4294918449,mptcp dss ack 2295998090 seq 3914645982 subseq 471241 len 1428 csum 0xb56a], length 1428
10:53:29.432285 IP 112.26.2.8.44397 > 112.26.2.1.37753: Flags [.], ack 489805, win 23616, options [nop,nop,TS val 4294919325 ecr 165250,mptcp dss ack 3914707386], length 0
10:53:29.440119 IP 112.26.2.8.44397 > 112.26.2.1.37753: Flags [.], ack 489805, win 23616, options [nop,nop,TS val 4294919325 ecr 165250,mptcp dss ack 3914707386], length 0
10:53:29.574651 IP 112.26.2.1.37753 > 112.26.2.8.44397: Flags [.], seq 489805:491233, ack 1, win 893, options [nop,nop,TS val 165369 ecr 4294918549,mptcp dss ack 2295998090 seq 3914773074 subseq 489805 len 1428 csum 0xbf74], length 1428
10:53:29.574868 IP 112.26.2.8.44397 > 112.26.2.1.37753: Flags [.], ack 491233, win 24275, options [nop,nop,TS val 4294919468 ecr 165369,mptcp dss ack 3914707386], length 0
10:53:29.580351 IP 112.26.2.8.44397 > 112.26.2.1.37753: Flags [.], ack 491233, win 24275, options [nop,nop,TS val 4294919468 ecr 165369,mptcp dss ack 3914707386], length 0
10:53:29.666333 IP 112.26.2.1.37753 > 112.26.2.8.44397: Flags [.], seq 491233:492661, ack 1, win 893, options [nop,nop,TS val 165491 ecr 4294918653,mptcp dss ack 2295998090 seq 3914781642 subseq 491233 len 1428 csum 0x9e06], length 1428
10:53:29.666546 IP 112.26.2.8.44397 > 112.26.2.1.37753: Flags [.], ack 492661, win 24275, options [nop,nop,TS val 4294919560 ecr 165491,mptcp dss ack 3914707386], length 0
10:53:29.679103 IP 112.26.2.8.44397 > 112.26.2.1.37753: Flags [.], ack 492661, win 24275, options [nop,nop,TS val 4294919560 ecr 165491,mptcp dss ack 3914707386], length 0
10:53:29.802922 IP 112.26.2.1.37753 > 112.26.2.8.44397: Flags [.], seq 492661:494089, ack 1, win 893, options [nop,nop,TS val 165602 ecr 4294918788,mptcp dss ack 2295998090 seq 3914788782 subseq 492661 len 1428 csum 0x17ac], length 1428
10:53:29.803152 IP 112.26.2.8.44397 > 112.26.2.1.37753: Flags [.], ack 494089, win 24275, options [nop,nop,TS val 4294919697 ecr 165602,mptcp dss ack 3914707386], length 0
10:53:29.810379 IP 112.26.2.8.44397 > 112.26.2.1.37753: Flags [.], ack 494089, win 24275, options [nop,nop,TS val 4294919697 ecr 165602,mptcp dss ack 3914707386], length 0
10:53:29.933352 IP 112.26.2.1.37753 > 112.26.2.8.44397: Flags [.], seq 495517:496945, ack 1, win 893, options [nop,nop,TS val 165623 ecr 4294918869,mptcp dss ack 2295998090 seq 3914794494 subseq 495517 len 1428 csum 0x3548], length 1428
10:53:29.933587 IP 112.26.2.8.44397 > 112.26.2.1.37753: Flags [.], ack 494089, win 24275, options [nop,nop,TS val 4294919827 ecr 165602,nop,nop,sack 1 {495517:496945},mptcp dss ack 3914707386], length 0
10:53:29.950585 IP 112.26.2.8.44397 > 112.26.2.1.37753: Flags [.], ack 494089, win 24275, options [nop,nop,TS val 4294919827 ecr 165602,nop,nop,sack 1 {495517:496945},mptcp dss ack 3914707386], length 0
10:53:30.084668 IP 112.26.2.1.37753 > 112.26.2.8.44397: Flags [.], seq 496945:498373, ack 1, win 893, options [nop,nop,TS val 165623 ecr 4294918869,mptcp dss ack 2295998090 seq 3914795922 subseq 496945 len 1428 csum 0x4874], length 1428
10:53:30.084899 IP 112.26.2.8.44397 > 112.26.2.1.37753: Flags [.], ack 494089, win 24275, options [nop,nop,TS val 4294919978 ecr 165602,nop,nop,sack 1 {495517:498373},mptcp dss ack 3914707386], length 0
10:53:30.088275 IP 112.26.2.8.44397 > 112.26.2.1.37753: Flags [.], ack 494089, win 24275, options [nop,nop,TS val 4294919978 ecr 165602,nop,nop,sack 1 {495517:498373},mptcp dss ack 3914707386], length 0
10:53:30.172685 IP 112.26.2.1.37753 > 112.26.2.8.44397: Flags [.], seq 499801:501229, ack 1, win 893, options [nop,nop,TS val 165897 ecr 4294919078,mptcp dss ack 2295998090 seq 3914804490 subseq 499801 len 1428 csum 0xa64d], length 1428
10:53:30.172879 IP 112.26.2.8.44397 > 112.26.2.1.37753: Flags [.], ack 494089, win 24275, options [nop,nop,TS val 4294920066 ecr 165602,nop,nop,sack 2 {499801:501229}{495517:498373},mptcp dss ack 3914707386], length 0
10:53:30.188127 IP 112.26.2.8.44397 > 112.26.2.1.37753: Flags [.], ack 494089, win 24275, options [nop,nop,TS val 4294920066 ecr 165602,nop,nop,sack 2 {499801:501229}{495517:498373},mptcp dss ack 3914707386], length 0
10:53:30.269821 IP 112.26.2.1.37753 > 112.26.2.8.44397: Flags [.], seq 501229:502657, ack 1, win 893, options [nop,nop,TS val 166084 ecr 4294919211,mptcp dss ack 2295998090 seq 3914814486 subseq 501229 len 1428 csum 0x72ac], length 1428
10:53:30.270083 IP 112.26.2.8.44397 > 112.26.2.1.37753: Flags [.], ack 494089, win 24275, options [nop,nop,TS val 4294920164 ecr 165602,nop,nop,sack 2 {499801:502657}{495517:498373},mptcp dss ack 3914707386], length 0
10:53:30.273194 IP 112.26.2.8.44397 > 112.26.2.1.37753: Flags [.], ack 494089, win 24275, options [nop,nop,TS val 4294920164 ecr 165602,nop,nop,sack 2 {499801:502657}{495517:498373},mptcp dss ack 3914707386], length 0
10:53:30.402753 IP 112.26.2.1.37753 > 112.26.2.8.44397: Flags [.], seq 502657:504085, ack 1, win 893, options [nop,nop,TS val 166084 ecr 4294919325,mptcp dss ack 2295998090 seq 3914815914 subseq 502657 len 1428 csum 0x4a46], length 1428
10:53:30.402955 IP 112.26.2.8.44397 > 112.26.2.1.37753: Flags [.], ack 494089, win 24275, options [nop,nop,TS val 4294920296 ecr 165602,nop,nop,sack 2 {499801:504085}{495517:498373},mptcp dss ack 3914707386], length 0
10:53:30.406825 IP 112.26.2.8.44397 > 112.26.2.1.37753: Flags [.], ack 494089, win 24275, options [nop,nop,TS val 4294920296 ecr 165602,nop,nop,sack 2 {499801:504085}{495517:498373},mptcp dss ack 3914707386], length 0
10:53:30.537742 IP 112.26.2.1.37753 > 112.26.2.8.44397: Flags [.], seq 504085:505513, ack 1, win 893, options [nop,nop,TS val 166084 ecr 4294919325,mptcp dss ack 2295998090 seq 3914817342 subseq 504085 len 1428 csum 0xd1cc], length 1428
10:53:30.537984 IP 112.26.2.8.44397 > 112.26.2.1.37753: Flags [.], ack 494089, win 24275, options [nop,nop,TS val 4294920431 ecr 165602,nop,nop,sack 2 {499801:505513}{495517:498373},mptcp dss ack 3914707386], length 0
10:53:30.547533 IP 112.26.2.8.44397 > 112.26.2.1.37753: Flags [.], ack 494089, win 24275, options [nop,nop,TS val 4294920431 ecr 165602,nop,nop,sack 2 {499801:505513}{495517:498373},mptcp dss ack 3914707386], length 0
10:53:30.674826 IP 112.26.2.1.37753 > 112.26.2.8.44397: Flags [.], seq 505513:506941, ack 1, win 893, options [nop,nop,TS val 166225 ecr 4294919468,mptcp dss ack 2295998090 seq 3914823054 subseq 505513 len 1428 csum 0xc274], length 1428
10:53:30.675012 IP 112.26.2.8.44397 > 112.26.2.1.37753: Flags [.], ack 494089, win 24275, options [nop,nop,TS val 4294920568 ecr 165602,nop,nop,sack 2 {499801:506941}{495517:498373},mptcp dss ack 3914707386], length 0
10:53:30.702119 IP 112.26.2.8.44397 > 112.26.2.1.37753: Flags [.], ack 494089, win 24275, options [nop,nop,TS val 4294920568 ecr 165602,nop,nop,sack 2 {499801:506941}{495517:498373},mptcp dss ack 3914707386], length 0
10:53:30.817786 IP 112.26.2.1.37753 > 112.26.2.8.44397: Flags [.], seq 508369:509797, ack 1, win 893, options [nop,nop,TS val 166324 ecr 4294919560,mptcp dss ack 2295998090 seq 3914825910 subseq 508369 len 1428 csum 0x28d5], length 1428
10:53:30.818026 IP 112.26.2.8.44397 > 112.26.2.1.37753: Flags [.], ack 494089, win 24275, options [nop,nop,TS val 4294920711 ecr 165602,nop,nop,sack 2 {508369:509797}{499801:506941},mptcp dss ack 3914707386], length 0
10:53:30.829969 IP 112.26.2.8.44397 > 112.26.2.1.37753: Flags [.], ack 494089, win 24275, options [nop,nop,TS val 4294920711 ecr 165602,nop,nop,sack 2 {508369:509797}{499801:506941},mptcp dss ack 3914707386], length 0
10:53:30.956800 IP 112.26.2.1.37753 > 112.26.2.8.44397: Flags [.], seq 509797:511225, ack 1, win 893, options [nop,nop,TS val 166456 ecr 4294919697,mptcp dss ack 2295998090 seq 3914828766 subseq 509797 len 1428 csum 0x53cd], length 1428
10:53:30.957013 IP 112.26.2.8.44397 > 112.26.2.1.37753: Flags [.], ack 494089, win 24275, options [nop,nop,TS val 4294920850 ecr 165602,nop,nop,sack 2 {508369:511225}{499801:506941},mptcp dss ack 3914707386], length 0
10:53:30.960176 IP 112.26.2.8.44397 > 112.26.2.1.37753: Flags [.], ack 494089, win 24275, options [nop,nop,TS val 4294920850 ecr 165602,nop,nop,sack 2 {508369:511225}{499801:506941},mptcp dss ack 3914707386], length 0
10:53:31.092959 IP 112.26.2.1.37753 > 112.26.2.8.44397: Flags [.], seq 511225:512653, ack 1, win 893, options [nop,nop,TS val 166608 ecr 4294919827,mptcp dss ack 2295998090 seq 3914831622 subseq 511225 len 1428 csum 0x66a0], length 1428
10:53:31.093176 IP 112.26.2.8.44397 > 112.26.2.1.37753: Flags [.], ack 494089, win 24275, options [nop,nop,TS val 4294920986 ecr 165602,nop,nop,sack 2 {508369:512653}{499801:506941},mptcp dss ack 3914707386], length 0
10:53:31.096610 IP 112.26.2.8.44397 > 112.26.2.1.37753: Flags [.], ack 494089, win 24275, options [nop,nop,TS val 4294920986 ecr 165602,nop,nop,sack 2 {508369:512653}{499801:506941},mptcp dss ack 3914707386], length 0
10:53:31.246603 IP 112.26.2.1.37753 > 112.26.2.8.44397: Flags [.], seq 494089:495517, ack 1, win 893, options [nop,nop,TS val 166821 ecr 4294920066,mptcp dss ack 2295998090 seq 3914793066 subseq 494089 len 1428 csum 0xa05d], length 1428
10:53:31.246828 IP 112.26.2.8.44397 > 112.26.2.1.37753: Flags [.], ack 498373, win 24275, options [nop,nop,TS val 4294921140 ecr 166821,nop,nop,sack 2 {508369:512653}{499801:506941},mptcp dss ack 3914707386], length 0
10:53:31.255529 IP 112.26.2.8.44397 > 112.26.2.1.37753: Flags [.], ack 498373, win 24275, options [nop,nop,TS val 4294921140 ecr 166821,nop,nop,sack 2 {508369:512653}{499801:506941},mptcp dss ack 3914707386], length 0
10:53:31.332814 IP 112.26.2.1.37753 > 112.26.2.8.44397: Flags [.], seq 498373:499801, ack 1, win 893, options [nop,nop,TS val 166921 ecr 4294920164,mptcp dss ack 2295998090 seq 3914800206 subseq 498373 len 1428 csum 0x3c09], length 1428
10:53:31.333010 IP 112.26.2.8.44397 > 112.26.2.1.37753: Flags [.], ack 506941, win 24275, options [nop,nop,TS val 4294921226 ecr 166921,nop,nop,sack 1 {508369:512653},mptcp dss ack 3914707386], length 0
10:53:31.428890 IP 112.26.2.8.44397 > 112.26.2.1.37753: Flags [.], ack 506941, win 24275, options [nop,nop,TS val 4294921226 ecr 166921,nop,nop,sack 1 {508369:512653},mptcp dss ack 3914707386], length 0
10:53:31.468842 IP 112.26.2.1.37753 > 112.26.2.8.44397: Flags [.], seq 514081:515509, ack 1, win 893, options [nop,nop,TS val 167375 ecr 4294920568,mptcp dss ack 2295998090 seq 3914861610 subseq 514081 len 1428 csum 0xfba1], length 1428
10:53:31.469038 IP 112.26.2.8.44397 > 112.26.2.1.37753: Flags [.], ack 506941, win 24275, options [nop,nop,TS val 4294921362 ecr 166921,nop,nop,sack 2 {514081:515509}{508369:512653},mptcp dss ack 3914707386], length 0
10:53:31.507080 IP 112.26.2.8.44397 > 112.26.2.1.37753: Flags [.], ack 506941, win 24275, options [nop,nop,TS val 4294921362 ecr 166921,nop,nop,sack 2 {514081:515509}{508369:512653},mptcp dss ack 3914707386], length 0
10:53:31.615745 IP 112.26.2.1.37753 > 112.26.2.8.44397: Flags [.], seq 506941:508369, ack 1, win 893, options [nop,nop,TS val 167480 ecr 4294920711,mptcp dss ack 2295998090 seq 3914824482 subseq 506941 len 1428 csum 0x4ba9], length 1428
10:53:31.616002 IP 112.26.2.8.44397 > 112.26.2.1.37753: Flags [.], ack 512653, win 24275, options [nop,nop,TS val 4294921509 ecr 167480,nop,nop,sack 1 {514081:515509},mptcp dss ack 3914707386], length 0
10:53:31.631320 IP 112.26.2.8.44397 > 112.26.2.1.37753: Flags [.], ack 512653, win 24275, options [nop,nop,TS val 4294921509 ecr 167480,nop,nop,sack 1 {514081:515509},mptcp dss ack 3914707386], length 0
10:53:31.746976 IP 112.26.2.1.37753 > 112.26.2.8.44397: Flags [.], seq 515509:516937, ack 1, win 893, options [nop,nop,TS val 167638 ecr 4294920850,mptcp dss ack 2295998090 seq 3914867322 subseq 515509 len 1428 csum 0x3472], length 1428
10:53:31.747166 IP 112.26.2.8.44397 > 112.26.2.1.37753: Flags [.], ack 512653, win 24275, options [nop,nop,TS val 4294921641 ecr 167480,nop,nop,sack 1 {514081:516937},mptcp dss ack 3914707386], length 0
10:53:31.751009 IP 112.26.2.8.44397 > 112.26.2.1.37753: Flags [.], ack 512653, win 24275, options [nop,nop,TS val 4294921641 ecr 167480,nop,nop,sack 1 {514081:516937},mptcp dss ack 3914707386], length 0
10:53:31.931726 IP 112.26.2.1.37753 > 112.26.2.8.44397: Flags [.], seq 516937:518365, ack 1, win 893, options [nop,nop,TS val 167767 ecr 4294920986,mptcp dss ack 2295998090 seq 3914871606 subseq 516937 len 1428 csum 0xd0df], length 1428
10:53:31.931937 IP 112.26.2.8.44397 > 112.26.2.1.37753: Flags [.], ack 512653, win 23918, options [nop,nop,TS val 4294921825 ecr 167480,nop,nop,sack 1 {514081:518365},mptcp dss ack 3914730234], length 0
10:53:31.946652 IP 112.26.2.8.44397 > 112.26.2.1.37753: Flags [.], ack 512653, win 23918, options [nop,nop,TS val 4294921825 ecr 167480,nop,nop,sack 1 {514081:518365},mptcp dss ack 3914730234], length 0
10:53:32.054540 IP 112.26.2.1.37753 > 112.26.2.8.44397: Flags [.], seq 512653:514081, ack 1, win 893, options [nop,nop,TS val 167893 ecr 4294921140,mptcp dss ack 2295998090 seq 3914843046 subseq 512653 len 1428 csum 0xfe64], length 1428
10:53:32.054773 IP 112.26.2.8.44397 > 112.26.2.1.37753: Flags [.], ack 518365, win 24154, options [nop,nop,TS val 4294921948 ecr 167893,mptcp dss ack 3914787354], length 0
10:53:32.082866 IP 112.26.2.8.44397 > 112.26.2.1.37753: Flags [.], ack 518365, win 24154, options [nop,nop,TS val 4294921948 ecr 167893,mptcp dss ack 3914787354], length 0
10:53:32.171146 IP 112.26.2.1.37753 > 112.26.2.8.44397: Flags [.], seq 518365:519793, ack 1, win 893, options [nop,nop,TS val 167893 ecr 4294921140,mptcp dss ack 2295998090 seq 3914877318 subseq 518365 len 1428 csum 0x908f], length 1428
10:53:32.171337 IP 112.26.2.8.44397 > 112.26.2.1.37753: Flags [.], ack 519793, win 24154, options [nop,nop,TS val 4294922064 ecr 167893,mptcp dss ack 3914787354], length 0
10:53:32.195283 IP 112.26.2.8.44397 > 112.26.2.1.37753: Flags [.], ack 519793, win 24154, options [nop,nop,TS val 4294922064 ecr 167893,mptcp dss ack 3914787354], length 0
10:53:32.316840 IP 112.26.2.1.37753 > 112.26.2.8.44397: Flags [.], seq 519793:521221, ack 1, win 893, options [nop,nop,TS val 167893 ecr 4294921140,mptcp dss ack 2295998090 seq 3914878746 subseq 519793 len 1428 csum 0xb773], length 1428
10:53:32.317063 IP 112.26.2.8.44397 > 112.26.2.1.37753: Flags [.], ack 521221, win 24154, options [nop,nop,TS val 4294922210 ecr 167893,mptcp dss ack 3914787354], length 0
10:53:32.324430 IP 112.26.2.8.44397 > 112.26.2.1.37753: Flags [.], ack 521221, win 24154, options [nop,nop,TS val 4294922210 ecr 167893,mptcp dss ack 3914787354], length 0
10:53:32.453266 IP 112.26.2.1.37753 > 112.26.2.8.44397: Flags [.], seq 521221:522649, ack 1, win 893, options [nop,nop,TS val 168072 ecr 4294921226,mptcp dss ack 2295998090 seq 3914884458 subseq 521221 len 1428 csum 0xa95e], length 1428
10:53:32.453461 IP 112.26.2.8.44397 > 112.26.2.1.37753: Flags [.], ack 522649, win 24154, options [nop,nop,TS val 4294922347 ecr 168072,mptcp dss ack 3914787354], length 0
10:53:32.460482 IP 112.26.2.8.44397 > 112.26.2.1.37753: Flags [.], ack 522649, win 24154, options [nop,nop,TS val 4294922347 ecr 168072,mptcp dss ack 3914787354], length 0
10:53:32.630398 IP 112.26.2.1.37753 > 112.26.2.8.44397: Flags [.], seq 522649:524077, ack 1, win 893, options [nop,nop,TS val 168189 ecr 4294921362,mptcp dss ack 2295998090 seq 3914887314 subseq 522649 len 1428 csum 0x693d], length 1428
10:53:32.630657 IP 112.26.2.8.44397 > 112.26.2.1.37753: Flags [.], ack 524077, win 24151, options [nop,nop,TS val 4294922524 ecr 168189,mptcp dss ack 3914833050], length 0
10:53:32.642119 IP 112.26.2.8.44397 > 112.26.2.1.37753: Flags [.], ack 524077, win 24151, options [nop,nop,TS val 4294922524 ecr 168189,mptcp dss ack 3914833050], length 0
10:53:32.735717 IP 112.26.2.1.37753 > 112.26.2.8.44397: Flags [.], seq 524077:525505, ack 1, win 893, options [nop,nop,TS val 168296 ecr 4294921509,mptcp dss ack 2295998090 seq 3914891598 subseq 524077 len 1428 csum 0xf530], length 1428
10:53:32.735930 IP 112.26.2.8.44397 > 112.26.2.1.37753: Flags [.], ack 525505, win 24151, options [nop,nop,TS val 4294922629 ecr 168296,mptcp dss ack 3914833050], length 0
10:53:32.742878 IP 112.26.2.8.44397 > 112.26.2.1.37753: Flags [.], ack 525505, win 24151, options [nop,nop,TS val 4294922629 ecr 168296,mptcp dss ack 3914833050], length 0
10:53:32.874942 IP 112.26.2.1.37753 > 112.26.2.8.44397: Flags [.], seq 525505:526933, ack 1, win 893, options [nop,nop,TS val 168462 ecr 4294921641,mptcp dss ack 2295998090 seq 3914895882 subseq 525505 len 1428 csum 0x4926], length 1428
10:53:32.875148 IP 112.26.2.8.44397 > 112.26.2.1.37753: Flags [.], ack 526933, win 24151, options [nop,nop,TS val 4294922768 ecr 168462,mptcp dss ack 3914833050], length 0
10:53:32.886661 IP 112.26.2.8.44397 > 112.26.2.1.37753: Flags [.], ack 526933, win 24151, options [nop,nop,TS val 4294922768 ecr 168462,mptcp dss ack 3914833050], length 0
10:53:33.032957 IP 112.26.2.1.37753 > 112.26.2.8.44397: Flags [.], seq 526933:528361, ack 1, win 893, options [nop,nop,TS val 168640 ecr 4294921825,mptcp dss ack 2295998090 seq 3914901594 subseq 526933 len 1428 csum 0xc40c], length 1428
10:53:33.033197 IP 112.26.2.8.44397 > 112.26.2.1.37753: Flags [.], ack 528361, win 24151, options [nop,nop,TS val 4294922926 ecr 168640,mptcp dss ack 3914833050], length 0
10:53:33.035607 IP 112.26.2.8.44397 > 112.26.2.1.37753: Flags [.], ack 528361, win 24151, options [nop,nop,TS val 4294922926 ecr 168640,mptcp dss ack 3914833050], length 0
10:53:33.147175 IP 112.26.2.1.37753 > 112.26.2.8.44397: Flags [.], seq 529789:531217, ack 1, win 893, options [nop,nop,TS val 168839 ecr 4294922064,mptcp dss ack 2295998090 seq 3914918730 subseq 529789 len 1428 csum 0x97a1], length 1428
10:53:33.147410 IP 112.26.2.8.44397 > 112.26.2.1.37753: Flags [.], ack 528361, win 24129, options [nop,nop,TS val 4294923040 ecr 168640,nop,nop,sack 1 {529789:531217},mptcp dss ack 3914834478], length 0
10:53:33.162292 IP 112.26.2.8.44397 > 112.26.2.1.37753: Flags [.], ack 528361, win 24129, options [nop,nop,TS val 4294923040 ecr 168640,nop,nop,sack 1 {529789:531217},mptcp dss ack 3914834478], length 0
10:53:33.305072 IP 112.26.2.1.37753 > 112.26.2.8.44397: Flags [.], seq 531217:532645, ack 1, win 893, options [nop,nop,TS val 168971 ecr 4294922210,mptcp dss ack 2295998090 seq 3914925870 subseq 531217 len 1428 csum 0x6f02], length 1428
10:53:33.305250 IP 112.26.2.8.44397 > 112.26.2.1.37753: Flags [.], ack 528361, win 24129, options [nop,nop,TS val 4294923198 ecr 168640,nop,nop,sack 1 {529789:532645},mptcp dss ack 3914834478], length 0
10:53:33.308625 IP 112.26.2.8.44397 > 112.26.2.1.37753: Flags [.], ack 528361, win 24129, options [nop,nop,TS val 4294923198 ecr 168640,nop,nop,sack 1 {529789:532645},mptcp dss ack 3914834478], length 0
10:53:33.425211 IP 112.26.2.1.37753 > 112.26.2.8.44397: Flags [.], seq 532645:534073, ack 1, win 893, options [nop,nop,TS val 169110 ecr 4294922347,mptcp dss ack 2295998090 seq 3914931582 subseq 532645 len 1428 csum 0xfa8a], length 1428
10:53:33.425442 IP 112.26.2.8.44397 > 112.26.2.1.37753: Flags [.], ack 528361, win 24129, options [nop,nop,TS val 4294923318 ecr 168640,nop,nop,sack 1 {529789:534073},mptcp dss ack 3914834478], length 0
10:53:33.468889 IP 112.26.2.8.44397 > 112.26.2.1.37753: Flags [.], ack 528361, win 24129, options [nop,nop,TS val 4294923318 ecr 168640,nop,nop,sack 1 {529789:534073},mptcp dss ack 3914834478], length 0
10:53:33.533225 IP 112.26.2.1.37753 > 112.26.2.8.44397: Flags [.], seq 535501:536929, ack 1, win 893, options [nop,nop,TS val 169285 ecr 4294922524,mptcp dss ack 2295998090 seq 3914943006 subseq 535501 len 1428 csum 0x278e], length 1428
10:53:33.533451 IP 112.26.2.8.44397 > 112.26.2.1.37753: Flags [.], ack 528361, win 24129, options [nop,nop,TS val 4294923426 ecr 168640,nop,nop,sack 2 {535501:536929}{529789:534073},mptcp dss ack 3914834478], length 0
10:53:33.593738 IP 112.26.2.8.44397 > 112.26.2.1.37753: Flags [.], ack 528361, win 24129, options [nop,nop,TS val 4294923426 ecr 168640,nop,nop,sack 2 {535501:536929}{529789:534073},mptcp dss ack 3914834478], length 0
10:53:33.701498 IP 112.26.2.1.37753 > 112.26.2.8.44397: Flags [.], seq 536929:538357, ack 1, win 893, options [nop,nop,TS val 169388 ecr 4294922629,mptcp dss ack 2295998090 seq 3914945862 subseq 536929 len 1428 csum 0x6f63], length 1428
10:53:33.701733 IP 112.26.2.8.44397 > 112.26.2.1.37753: Flags [.], ack 528361, win 24129, options [nop,nop,TS val 4294923595 ecr 168640,nop,nop,sack 2 {535501:538357}{529789:534073},mptcp dss ack 3914834478], length 0
10:53:33.705284 IP 112.26.2.8.44397 > 112.26.2.1.37753: Flags [.], ack 528361, win 24129, options [nop,nop,TS val 4294923595 ecr 168640,nop,nop,sack 2 {535501:538357}{529789:534073},mptcp dss ack 3914834478], length 0
10:53:33.819313 IP 112.26.2.1.37753 > 112.26.2.8.44397: Flags [.], seq 538357:539785, ack 1, win 893, options [nop,nop,TS val 169535 ecr 4294922768,mptcp dss ack 2295998090 seq 3914951574 subseq 538357 len 1428 csum 0x784f], length 1428
10:53:33.819511 IP 112.26.2.8.44397 > 112.26.2.1.37753: Flags [.], ack 528361, win 24129, options [nop,nop,TS val 4294923713 ecr 168640,nop,nop,sack 2 {535501:539785}{529789:534073},mptcp dss ack 3914834478], length 0
10:53:33.826607 IP 112.26.2.8.44397 > 112.26.2.1.37753: Flags [.], ack 528361, win 24129, options [nop,nop,TS val 4294923713 ecr 168640,nop,nop,sack 2 {535501:539785}{529789:534073},mptcp dss ack 3914834478], length 0
10:53:33.923861 IP 112.26.2.1.37753 > 112.26.2.8.44397: Flags [.], seq 539785:541213, ack 1, win 893, options [nop,nop,TS val 169679 ecr 4294922926,mptcp dss ack 2295998090 seq 3914958714 subseq 539785 len 1428 csum 0xcc8d], length 1428
10:53:33.924029 IP 112.26.2.8.44397 > 112.26.2.1.37753: Flags [.], ack 528361, win 24129, options [nop,nop,TS val 4294923818 ecr 168640,nop,nop,sack 2 {535501:541213}{529789:534073},mptcp dss ack 3914834478], length 0
10:53:34.000873 IP 112.26.2.8.44397 > 112.26.2.1.37753: Flags [.], ack 528361, win 24129, options [nop,nop,TS val 4294923818 ecr 168640,nop,nop,sack 2 {535501:541213}{529789:534073},mptcp dss ack 3914834478], length 0
10:53:34.024756 IP 112.26.2.1.37753 > 112.26.2.8.44397: Flags [.], seq 541213:542641, ack 1, win 893, options [nop,nop,TS val 169859 ecr 4294923040,mptcp dss ack 2295998090 seq 3914964426 subseq 541213 len 1428 csum 0x5b48], length 1428
10:53:34.024991 IP 112.26.2.8.44397 > 112.26.2.1.37753: Flags [.], ack 528361, win 24129, options [nop,nop,TS val 4294923918 ecr 168640,nop,nop,sack 2 {535501:542641}{529789:534073},mptcp dss ack 3914834478], length 0
10:53:34.102950 IP 112.26.2.8.44397 > 112.26.2.1.37753: Flags [.], ack 528361, win 24129, options [nop,nop,TS val 4294923918 ecr 168640,nop,nop,sack 2 {535501:542641}{529789:534073},mptcp dss ack 3914834478], length 0
10:53:34.182667 IP 112.26.2.1.37753 > 112.26.2.8.44397: Flags [.], seq 542641:544069, ack 1, win 893, options [nop,nop,TS val 170040 ecr 4294923198,mptcp dss ack 2295998090 seq 3914970138 subseq 542641 len 1428 csum 0x6419], length 1428
10:53:34.182896 IP 112.26.2.8.44397 > 112.26.2.1.37753: Flags [.], ack 528361, win 24129, options [nop,nop,TS val 4294924076 ecr 168640,nop,nop,sack 2 {535501:544069}{529789:534073},mptcp dss ack 3914834478], length 0
10:53:34.260155 IP 112.26.2.8.44397 > 112.26.2.1.37753: Flags [.], ack 528361, win 24129, options [nop,nop,TS val 4294924076 ecr 168640,nop,nop,sack 2 {535501:544069}{529789:534073},mptcp dss ack 3914834478], length 0
10:53:34.304094 IP 112.26.2.1.37753 > 112.26.2.8.44397: Flags [.], seq 528361:529789, ack 1, win 893, options [nop,nop,TS val 170114 ecr 4294923318,mptcp dss ack 2295998090 seq 3914908734 subseq 528361 len 1428 csum 0xc8b2], length 1428
