10:52:44.159241 IP 112.26.1.8.37887 > 112.26.1.1.37753: Flags [S], seq 1087380066, win 65535, options [mss 1460,sackOK,TS val 4294873966 ecr 0,nop,wscale 6,mptcp join id 3 token 0xd15e4cde nonce 0x9c43d22d], length 0
10:52:44.251465 IP 112.26.1.8.37887 > 112.26.1.1.37753: Flags [S], seq 1087380066, win 65535, options [mss 1460,sackOK,TS val 4294873966 ecr 0,nop,wscale 6,mptcp join id 3 token 0xd15e4cde nonce 0x9c43d22d], length 0
10:52:44.291224 IP 112.26.1.1.37753 > 112.26.1.8.37887: Flags [S.], seq 1073520417, ack 1087380067, win 28560, options [mss 1460,sackOK,TS val 120893 ecr 4294873966,nop,wscale 7,mptcp join id 3 hmac 0xe14596f7a3c5554 nonce 0xc4d21e11], length 0
10:52:44.390041 IP 112.26.1.1.37753 > 112.26.1.8.37887: Flags [S.], seq 1073520417, ack 1087380067, win 28560, options [mss 1460,sackOK,TS val 120893 ecr 4294873966,nop,wscale 7,mptcp join id 3 hmac 0xe14596f7a3c5554 nonce 0xc4d21e11], length 0
10:52:44.450315 IP 112.26.1.1.37753 > 112.26.1.8.37887: Flags [S.], seq 1073520417, ack 1087380067, win 28560, options [mss 1460,sackOK,TS val 120893 ecr 4294873966,nop,wscale 7,mptcp join id 3 hmac 0xe14596f7a3c5554 nonce 0xc4d21e11], length 0
10:52:44.616356 IP 112.26.1.8.37887 > 112.26.1.1.37753: Flags [.], ack 1, win 7027, options [nop,nop,TS val 4294874344 ecr 120893,mptcp join hmac 0x5931aad495df313330019ba94d2f4c13f575bb46], length 0
10:52:44.619647 IP 112.26.1.8.37887 > 112.26.1.1.37753: Flags [.], ack 1, win 7027, options [nop,nop,TS val 4294874344 ecr 120893,mptcp join hmac 0x5931aad495df313330019ba94d2f4c13f575bb46], length 0
10:53:14.646082 IP 112.26.1.1.37753 > 112.26.1.8.37887: Flags [.], seq 298453:299881, ack 1, win 893, options [nop,nop,TS val 150510 ecr 4294903671,mptcp dss ack 2295998090 seq 3914057646 subseq 298453 len 1428 csum 0x501f], length 1428
10:53:14.716214 IP 112.26.1.8.37887 > 112.26.1.1.37753: Flags [.], ack 299881, win 23958, options [nop,nop,TS val 4294904529 ecr 150510,mptcp dss ack 3913980534], length 0
10:53:14.748651 IP 112.26.1.8.37887 > 112.26.1.1.37753: Flags [.], ack 297025, win 24129, options [nop,nop,TS val 4294904286 ecr 150404,mptcp dss ack 3913959114], length 0
10:53:14.751539 IP 112.26.1.1.37753 > 112.26.1.8.37887: Flags [.], seq 305593:307021, ack 1, win 893, options [nop,nop,TS val 151390 ecr 4294904286,mptcp dss ack 2295998090 seq 3914094774 subseq 305593 len 1428 csum 0xfe5f], length 1428
10:53:14.751918 IP 112.26.1.1.37753 > 112.26.1.8.37887: Flags [.], seq 305593:307021, ack 1, win 893, options [nop,nop,TS val 151390 ecr 4294904286,mptcp dss ack 2295998090 seq 3914094774 subseq 305593 len 1428 csum 0xfe5f], length 1428
10:53:14.768505 IP 112.26.1.1.37753 > 112.26.1.8.37887: Flags [.], seq 299881:301309, ack 1, win 893, options [nop,nop,TS val 150687 ecr 4294903823,mptcp dss ack 2295998090 seq 3914067642 subseq 299881 len 1428 csum 0x623], length 1428
10:53:14.789725 IP 112.26.1.8.37887 > 112.26.1.1.37753: Flags [.], ack 301309, win 24112, options [nop,nop,TS val 4294904662 ecr 150687,mptcp dss ack 3914007666], length 0
10:53:14.900189 IP 112.26.1.1.37753 > 112.26.1.8.37887: Flags [.], seq 301309:302737, ack 1, win 893, options [nop,nop,TS val 150897 ecr 4294903948,mptcp dss ack 2295998090 seq 3914076210 subseq 301309 len 1428 csum 0x7658], length 1428
10:53:14.919458 IP 112.26.1.8.37887 > 112.26.1.1.37753: Flags [.], ack 298453, win 23958, options [nop,nop,TS val 4294904407 ecr 150404,mptcp dss ack 3913980534], length 0
10:53:14.924297 IP 112.26.1.1.37753 > 112.26.1.8.37887: Flags [.], seq 307021:308449, ack 1, win 893, options [nop,nop,TS val 151561 ecr 4294904407,mptcp dss ack 2295998090 seq 3914101914 subseq 307021 len 1428 csum 0xf1f0], length 1428
10:53:14.924658 IP 112.26.1.1.37753 > 112.26.1.8.37887: Flags [.], seq 307021:308449, ack 1, win 893, options [nop,nop,TS val 151561 ecr 4294904407,mptcp dss ack 2295998090 seq 3914101914 subseq 307021 len 1428 csum 0xf1f0], length 1428
10:53:14.950777 IP 112.26.1.8.37887 > 112.26.1.1.37753: Flags [.], ack 302737, win 24112, options [nop,nop,TS val 4294904794 ecr 150897,mptcp dss ack 3914007666], length 0
10:53:14.987762 IP 112.26.1.1.37753 > 112.26.1.8.37887: Flags [.], seq 302737:304165, ack 1, win 893, options [nop,nop,TS val 151093 ecr 4294904070,mptcp dss ack 2295998090 seq 3914083350 subseq 302737 len 1428 csum 0x17ef], length 1428
10:53:15.015469 IP 112.26.1.8.37887 > 112.26.1.1.37753: Flags [.], ack 299881, win 23958, options [nop,nop,TS val 4294904529 ecr 150510,mptcp dss ack 3913980534], length 0
10:53:15.029395 IP 112.26.1.8.37887 > 112.26.1.1.37753: Flags [.], ack 304165, win 24112, options [nop,nop,TS val 4294904881 ecr 151093,mptcp dss ack 3914007666], length 0
10:53:15.033944 IP 112.26.1.1.37753 > 112.26.1.8.37887: Flags [.], seq 308449:309877, ack 1, win 893, options [nop,nop,TS val 151561 ecr 4294904407,mptcp dss ack 2295998090 seq 3914103342 subseq 308449 len 1428 csum 0x834f], length 1428
10:53:15.034193 IP 112.26.1.1.37753 > 112.26.1.8.37887: Flags [.], seq 308449:309877, ack 1, win 893, options [nop,nop,TS val 151561 ecr 4294904407,mptcp dss ack 2295998090 seq 3914103342 subseq 308449 len 1428 csum 0x834f], length 1428
10:53:15.119779 IP 112.26.1.8.37887 > 112.26.1.1.37753: Flags [.], ack 301309, win 24112, options [nop,nop,TS val 4294904662 ecr 150687,mptcp dss ack 3914007666], length 0
10:53:15.127315 IP 112.26.1.1.37753 > 112.26.1.8.37887: Flags [.], seq 309877:311305, ack 1, win 893, options [nop,nop,TS val 151657 ecr 4294904529,mptcp dss ack 2295998090 seq 3914109054 subseq 309877 len 1428 csum 0xafb5], length 1428
10:53:15.127591 IP 112.26.1.1.37753 > 112.26.1.8.37887: Flags [.], seq 309877:311305, ack 1, win 893, options [nop,nop,TS val 151657 ecr 4294904529,mptcp dss ack 2295998090 seq 3914109054 subseq 309877 len 1428 csum 0xafb5], length 1428
10:53:15.155385 IP 112.26.1.1.37753 > 112.26.1.8.37887: Flags [.], seq 304165:305593, ack 1, win 893, options [nop,nop,TS val 151228 ecr 4294904204,mptcp dss ack 2295998090 seq 3914086206 subseq 304165 len 1428 csum 0x5d4e], length 1428
10:53:15.200619 IP 112.26.1.8.37887 > 112.26.1.1.37753: Flags [.], ack 305593, win 24112, options [nop,nop,TS val 4294905090 ecr 151228,mptcp dss ack 3914007666], length 0
10:53:15.231808 IP 112.26.1.1.37753 > 112.26.1.8.37887: Flags [.], seq 311305:312733, ack 1, win 893, options [nop,nop,TS val 151761 ecr 4294904662,mptcp dss ack 2295998090 seq 3914116194 subseq 311305 len 1428 csum 0x4947], length 1428
10:53:15.232066 IP 112.26.1.1.37753 > 112.26.1.8.37887: Flags [.], seq 311305:312733, ack 1, win 893, options [nop,nop,TS val 151761 ecr 4294904662,mptcp dss ack 2295998090 seq 3914116194 subseq 311305 len 1428 csum 0x4947], length 1428
10:53:15.243246 IP 112.26.1.8.37887 > 112.26.1.1.37753: Flags [.], ack 302737, win 24112, options [nop,nop,TS val 4294904794 ecr 150897,mptcp dss ack 3914007666], length 0
10:53:15.285351 IP 112.26.1.1.37753 > 112.26.1.8.37887: Flags [.], seq 312733:314161, ack 1, win 893, options [nop,nop,TS val 151884 ecr 4294904794,mptcp dss ack 2295998090 seq 3914121906 subseq 312733 len 1428 csum 0xe2a5], length 1428
10:53:15.285675 IP 112.26.1.1.37753 > 112.26.1.8.37887: Flags [.], seq 312733:314161, ack 1, win 893, options [nop,nop,TS val 151884 ecr 4294904794,mptcp dss ack 2295998090 seq 3914121906 subseq 312733 len 1428 csum 0xe2a5], length 1428
10:53:15.334807 IP 112.26.1.1.37753 > 112.26.1.8.37887: Flags [.], seq 305593:307021, ack 1, win 893, options [nop,nop,TS val 151390 ecr 4294904286,mptcp dss ack 2295998090 seq 3914094774 subseq 305593 len 1428 csum 0xfe5f], length 1428
10:53:15.389109 IP 112.26.1.8.37887 > 112.26.1.1.37753: Flags [.], ack 304165, win 24112, options [nop,nop,TS val 4294904881 ecr 151093,mptcp dss ack 3914007666], length 0
10:53:15.392197 IP 112.26.1.1.37753 > 112.26.1.8.37887: Flags [.], seq 314161:315589, ack 1, win 893, options [nop,nop,TS val 152030 ecr 4294904881,mptcp dss ack 2295998090 seq 3914130474 subseq 314161 len 1428 csum 0xde77], length 1428
10:53:15.392481 IP 112.26.1.1.37753 > 112.26.1.8.37887: Flags [.], seq 314161:315589, ack 1, win 893, options [nop,nop,TS val 152030 ecr 4294904881,mptcp dss ack 2295998090 seq 3914130474 subseq 314161 len 1428 csum 0xde77], length 1428
10:53:15.419255 IP 112.26.1.8.37887 > 112.26.1.1.37753: Flags [.], ack 307021, win 24241, options [nop,nop,TS val 4294905304 ecr 151390,mptcp dss ack 3914040510], length 0
10:53:15.481600 IP 112.26.1.1.37753 > 112.26.1.8.37887: Flags [.], seq 307021:308449, ack 1, win 893, options [nop,nop,TS val 151561 ecr 4294904407,mptcp dss ack 2295998090 seq 3914101914 subseq 307021 len 1428 csum 0xf1f0], length 1428
10:53:15.530812 IP 112.26.1.8.37887 > 112.26.1.1.37753: Flags [.], ack 305593, win 24112, options [nop,nop,TS val 4294905090 ecr 151228,mptcp dss ack 3914007666], length 0
10:53:15.540554 IP 112.26.1.1.37753 > 112.26.1.8.37887: Flags [.], seq 315589:317017, ack 1, win 893, options [nop,nop,TS val 152172 ecr 4294905090,mptcp dss ack 2295998090 seq 3914136186 subseq 315589 len 1428 csum 0x8b6c], length 1428
10:53:15.540780 IP 112.26.1.1.37753 > 112.26.1.8.37887: Flags [.], seq 315589:317017, ack 1, win 893, options [nop,nop,TS val 152172 ecr 4294905090,mptcp dss ack 2295998090 seq 3914136186 subseq 315589 len 1428 csum 0x8b6c], length 1428
10:53:15.588687 IP 112.26.1.1.37753 > 112.26.1.8.37887: Flags [.], seq 308449:309877, ack 1, win 893, options [nop,nop,TS val 151561 ecr 4294904407,mptcp dss ack 2295998090 seq 3914103342 subseq 308449 len 1428 csum 0x834f], length 1428
10:53:15.676132 IP 112.26.1.8.37887 > 112.26.1.1.37753: Flags [.], ack 311305, win 24241, options [nop,nop,TS val 4294905565 ecr 151561,mptcp dss ack 3914040510], length 0
10:53:15.681910 IP 112.26.1.1.37753 > 112.26.1.8.37887: Flags [.], seq 309877:311305, ack 1, win 893, options [nop,nop,TS val 151657 ecr 4294904529,mptcp dss ack 2295998090 seq 3914109054 subseq 309877 len 1428 csum 0xafb5], length 1428
10:53:15.716877 IP 112.26.1.8.37887 > 112.26.1.1.37753: Flags [.], ack 307021, win 24241, options [nop,nop,TS val 4294905304 ecr 151390,mptcp dss ack 3914040510], length 0
10:53:15.727090 IP 112.26.1.1.37753 > 112.26.1.8.37887: Flags [.], seq 317017:318445, ack 1, win 893, options [nop,nop,TS val 152358 ecr 4294905304,mptcp dss ack 2295998090 seq 3914140470 subseq 317017 len 1428 csum 0x96c5], length 1428
10:53:15.727314 IP 112.26.1.1.37753 > 112.26.1.8.37887: Flags [.], seq 317017:318445, ack 1, win 893, options [nop,nop,TS val 152358 ecr 4294905304,mptcp dss ack 2295998090 seq 3914140470 subseq 317017 len 1428 csum 0x96c5], length 1428
10:53:15.819706 IP 112.26.1.1.37753 > 112.26.1.8.37887: Flags [.], seq 311305:312733, ack 1, win 893, options [nop,nop,TS val 151761 ecr 4294904662,mptcp dss ack 2295998090 seq 3914116194 subseq 311305 len 1428 csum 0x4947], length 1428
10:53:15.864532 IP 112.26.1.8.37887 > 112.26.1.1.37753: Flags [.], ack 311305, win 24241, options [nop,nop,TS val 4294905565 ecr 151561,mptcp dss ack 3914040510], length 0
10:53:15.871754 IP 112.26.1.1.37753 > 112.26.1.8.37887: Flags [.], seq 318445:319873, ack 1, win 893, options [nop,nop,TS val 152506 ecr 4294905565,mptcp dss ack 2295998090 seq 3914146182 subseq 318445 len 1428 csum 0x8ef3], length 1428
10:53:15.872099 IP 112.26.1.1.37753 > 112.26.1.8.37887: Flags [.], seq 318445:319873, ack 1, win 893, options [nop,nop,TS val 152506 ecr 4294905565,mptcp dss ack 2295998090 seq 3914146182 subseq 318445 len 1428 csum 0x8ef3], length 1428
10:53:15.922527 IP 112.26.1.1.37753 > 112.26.1.8.37887: Flags [.], seq 312733:314161, ack 1, win 893, options [nop,nop,TS val 151884 ecr 4294904794,mptcp dss ack 2295998090 seq 3914121906 subseq 312733 len 1428 csum 0xe2a5], length 1428
10:53:16.039892 IP 112.26.1.1.37753 > 112.26.1.8.37887: Flags [.], seq 314161:315589, ack 1, win 893, options [nop,nop,TS val 152030 ecr 4294904881,mptcp dss ack 2295998090 seq 3914130474 subseq 314161 len 1428 csum 0xde77], length 1428
10:53:16.064290 IP 112.26.1.1.37753 > 112.26.1.8.37887: Flags [.], seq 319873:321301, ack 1, win 893, options [nop,nop,TS val 152506 ecr 4294905565,mptcp dss ack 2295998090 seq 3914147610 subseq 319873 len 1428 csum 0xbbc1], length 1428
10:53:16.064642 IP 112.26.1.1.37753 > 112.26.1.8.37887: Flags [.], seq 319873:321301, ack 1, win 893, options [nop,nop,TS val 152506 ecr 4294905565,mptcp dss ack 2295998090 seq 3914147610 subseq 319873 len 1428 csum 0xbbc1], length 1428
10:53:16.093790 IP 112.26.1.8.37887 > 112.26.1.1.37753: Flags [.], ack 314161, win 23973, options [nop,nop,TS val 4294905890 ecr 151761,mptcp dss ack 3914063358], length 0
10:53:16.096054 IP 112.26.1.8.37887 > 112.26.1.1.37753: Flags [.], ack 314161, win 23973, options [nop,nop,TS val 4294905890 ecr 151761,mptcp dss ack 3914063358], length 0
10:53:16.149266 IP 112.26.1.1.37753 > 112.26.1.8.37887: Flags [.], seq 321301:322729, ack 1, win 893, options [nop,nop,TS val 152506 ecr 4294905565,mptcp dss ack 2295998090 seq 3914149038 subseq 321301 len 1428 csum 0x98ee], length 1428
10:53:16.149627 IP 112.26.1.1.37753 > 112.26.1.8.37887: Flags [.], seq 321301:322729, ack 1, win 893, options [nop,nop,TS val 152506 ecr 4294905565,mptcp dss ack 2295998090 seq 3914149038 subseq 321301 len 1428 csum 0x98ee], length 1428
10:53:16.176886 IP 112.26.1.1.37753 > 112.26.1.8.37887: Flags [.], seq 315589:317017, ack 1, win 893, options [nop,nop,TS val 152172 ecr 4294905090,mptcp dss ack 2295998090 seq 3914136186 subseq 315589 len 1428 csum 0x8b6c], length 1428
10:53:16.182228 IP 112.26.1.8.37887 > 112.26.1.1.37753: Flags [.], ack 317017, win 24224, options [nop,nop,TS val 4294906062 ecr 152030,mptcp dss ack 3914063358], length 0
10:53:16.184333 IP 112.26.1.8.37887 > 112.26.1.1.37753: Flags [.], ack 317017, win 24224, options [nop,nop,TS val 4294906062 ecr 152030,mptcp dss ack 3914063358], length 0
10:53:16.226498 IP 112.26.1.1.37753 > 112.26.1.8.37887: Flags [.], seq 322729:324157, ack 1, win 893, options [nop,nop,TS val 152737 ecr 4294905890,mptcp dss ack 2295998090 seq 3914154750 subseq 322729 len 1428 csum 0xf430], length 1428
10:53:16.226851 IP 112.26.1.1.37753 > 112.26.1.8.37887: Flags [.], seq 322729:324157, ack 1, win 893, options [nop,nop,TS val 152737 ecr 4294905890,mptcp dss ack 2295998090 seq 3914154750 subseq 322729 len 1428 csum 0xf430], length 1428
10:53:16.301698 IP 112.26.1.1.37753 > 112.26.1.8.37887: Flags [.], seq 317017:318445, ack 1, win 893, options [nop,nop,TS val 152358 ecr 4294905304,mptcp dss ack 2295998090 seq 3914140470 subseq 317017 len 1428 csum 0x96c5], length 1428
10:53:16.331700 IP 112.26.1.1.37753 > 112.26.1.8.37887: Flags [.], seq 324157:325585, ack 1, win 893, options [nop,nop,TS val 152737 ecr 4294905890,mptcp dss ack 2295998090 seq 3914156178 subseq 324157 len 1428 csum 0x7198], length 1428
10:53:16.331939 IP 112.26.1.1.37753 > 112.26.1.8.37887: Flags [.], seq 324157:325585, ack 1, win 893, options [nop,nop,TS val 152737 ecr 4294905890,mptcp dss ack 2295998090 seq 3914156178 subseq 324157 len 1428 csum 0x7198], length 1428
10:53:16.399713 IP 112.26.1.1.37753 > 112.26.1.8.37887: Flags [.], seq 325585:327013, ack 1, win 893, options [nop,nop,TS val 152825 ecr 4294906062,mptcp dss ack 2295998090 seq 3914157606 subseq 325585 len 1428 csum 0x239d], length 1428
10:53:16.400030 IP 112.26.1.1.37753 > 112.26.1.8.37887: Flags [.], seq 325585:327013, ack 1, win 893, options [nop,nop,TS val 152825 ecr 4294906062,mptcp dss ack 2295998090 seq 3914157606 subseq 325585 len 1428 csum 0x239d], length 1428
10:53:16.442044 IP 112.26.1.1.37753 > 112.26.1.8.37887: Flags [.], seq 318445:319873, ack 1, win 893, options [nop,nop,TS val 152506 ecr 4294905565,mptcp dss ack 2295998090 seq 3914146182 subseq 318445 len 1428 csum 0x8ef3], length 1428
10:53:16.492798 IP 112.26.1.1.37753 > 112.26.1.8.37887: Flags [.], seq 327013:328441, ack 1, win 893, options [nop,nop,TS val 152825 ecr 4294906062,mptcp dss ack 2295998090 seq 3914159034 subseq 327013 len 1428 csum 0x58e4], length 1428
10:53:16.493097 IP 112.26.1.1.37753 > 112.26.1.8.37887: Flags [.], seq 327013:328441, ack 1, win 893, options [nop,nop,TS val 152825 ecr 4294906062,mptcp dss ack 2295998090 seq 3914159034 subseq 327013 len 1428 csum 0x58e4], length 1428
10:53:16.561870 IP 112.26.1.1.37753 > 112.26.1.8.37887: Flags [.], seq 319873:321301, ack 1, win 893, options [nop,nop,TS val 152506 ecr 4294905565,mptcp dss ack 2295998090 seq 3914147610 subseq 319873 len 1428 csum 0xbbc1], length 1428
10:53:16.576249 IP 112.26.1.8.37887 > 112.26.1.1.37753: Flags [.], ack 321301, win 24224, options [nop,nop,TS val 4294906456 ecr 152358,mptcp dss ack 3914063358], length 0
10:53:16.581976 IP 112.26.1.8.37887 > 112.26.1.1.37753: Flags [.], ack 321301, win 24224, options [nop,nop,TS val 4294906456 ecr 152358,mptcp dss ack 3914063358], length 0
10:53:16.602379 IP 112.26.1.1.37753 > 112.26.1.8.37887: Flags [.], seq 328441:329869, ack 1, win 893, options [nop,nop,TS val 153223 ecr 4294906456,mptcp dss ack 2295998090 seq 3914169030 subseq 328441 len 1428 csum 0x3b82], length 1428
10:53:16.602726 IP 112.26.1.1.37753 > 112.26.1.8.37887: Flags [.], seq 328441:329869, ack 1, win 893, options [nop,nop,TS val 153223 ecr 4294906456,mptcp dss ack 2295998090 seq 3914169030 subseq 328441 len 1428 csum 0x3b82], length 1428
10:53:16.652406 IP 112.26.1.1.37753 > 112.26.1.8.37887: Flags [.], seq 329869:331297, ack 1, win 893, options [nop,nop,TS val 153223 ecr 4294906456,mptcp dss ack 2295998090 seq 3914170458 subseq 329869 len 1428 csum 0x4182], length 1428
10:53:16.652764 IP 112.26.1.1.37753 > 112.26.1.8.37887: Flags [.], seq 329869:331297, ack 1, win 893, options [nop,nop,TS val 153223 ecr 4294906456,mptcp dss ack 2295998090 seq 3914170458 subseq 329869 len 1428 csum 0x4182], length 1428
10:53:16.695993 IP 112.26.1.1.37753 > 112.26.1.8.37887: Flags [.], seq 321301:322729, ack 1, win 893, options [nop,nop,TS val 152506 ecr 4294905565,mptcp dss ack 2295998090 seq 3914149038 subseq 321301 len 1428 csum 0x98ee], length 1428
10:53:16.762490 IP 112.26.1.1.37753 > 112.26.1.8.37887: Flags [.], seq 331297:332725, ack 1, win 893, options [nop,nop,TS val 153223 ecr 4294906456,mptcp dss ack 2295998090 seq 3914171886 subseq 331297 len 1428 csum 0xf905], length 1428
10:53:16.762835 IP 112.26.1.1.37753 > 112.26.1.8.37887: Flags [.], seq 331297:332725, ack 1, win 893, options [nop,nop,TS val 153223 ecr 4294906456,mptcp dss ack 2295998090 seq 3914171886 subseq 331297 len 1428 csum 0xf905], length 1428
10:53:16.832353 IP 112.26.1.1.37753 > 112.26.1.8.37887: Flags [.], seq 322729:324157, ack 1, win 893, options [nop,nop,TS val 152737 ecr 4294905890,mptcp dss ack 2295998090 seq 3914154750 subseq 322729 len 1428 csum 0xf430], length 1428
10:53:16.858797 IP 112.26.1.1.37753 > 112.26.1.8.37887: Flags [.], seq 332725:334153, ack 1, win 893, options [nop,nop,TS val 153223 ecr 4294906456,mptcp dss ack 2295998090 seq 3914173314 subseq 332725 len 1428 csum 0xcb79], length 1428
10:53:16.859132 IP 112.26.1.1.37753 > 112.26.1.8.37887: Flags [.], seq 332725:334153, ack 1, win 893, options [nop,nop,TS val 153223 ecr 4294906456,mptcp dss ack 2295998090 seq 3914173314 subseq 332725 len 1428 csum 0xcb79], length 1428
10:53:16.961936 IP 112.26.1.1.37753 > 112.26.1.8.37887: Flags [.], seq 324157:325585, ack 1, win 893, options [nop,nop,TS val 152737 ecr 4294905890,mptcp dss ack 2295998090 seq 3914156178 subseq 324157 len 1428 csum 0x7198], length 1428
10:53:16.967896 IP 112.26.1.8.37887 > 112.26.1.1.37753: Flags [.], ack 324157, win 24033, options [nop,nop,TS val 4294906844 ecr 152506,mptcp dss ack 3914091918], length 0
10:53:16.972816 IP 112.26.1.8.37887 > 112.26.1.1.37753: Flags [.], ack 324157, win 24033, options [nop,nop,TS val 4294906844 ecr 152506,mptcp dss ack 3914091918], length 0
10:53:17.011018 IP 112.26.1.1.37753 > 112.26.1.8.37887: Flags [.], seq 334153:335581, ack 1, win 893, options [nop,nop,TS val 153614 ecr 4294906844,mptcp dss ack 2295998090 seq 3914186166 subseq 334153 len 1428 csum 0x79b4], length 1428
10:53:17.011296 IP 112.26.1.1.37753 > 112.26.1.8.37887: Flags [.], seq 334153:335581, ack 1, win 893, options [nop,nop,TS val 153614 ecr 4294906844,mptcp dss ack 2295998090 seq 3914186166 subseq 334153 len 1428 csum 0x79b4], length 1428
10:53:17.112914 IP 112.26.1.1.37753 > 112.26.1.8.37887: Flags [.], seq 325585:327013, ack 1, win 893, options [nop,nop,TS val 152825 ecr 4294906062,mptcp dss ack 2295998090 seq 3914157606 subseq 325585 len 1428 csum 0x239d], length 1428
10:53:17.118276 IP 112.26.1.8.37887 > 112.26.1.1.37753: Flags [.], ack 327013, win 24216, options [nop,nop,TS val 4294907007 ecr 152737,mptcp dss ack 3914106198], length 0
10:53:17.123757 IP 112.26.1.8.37887 > 112.26.1.1.37753: Flags [.], ack 327013, win 24216, options [nop,nop,TS val 4294907007 ecr 152737,mptcp dss ack 3914106198], length 0
10:53:17.148138 IP 112.26.1.1.37753 > 112.26.1.8.37887: Flags [.], seq 335581:337009, ack 1, win 893, options [nop,nop,TS val 153614 ecr 4294906844,mptcp dss ack 2295998090 seq 3914187594 subseq 335581 len 1428 csum 0x2953], length 1428
10:53:17.148485 IP 112.26.1.1.37753 > 112.26.1.8.37887: Flags [.], seq 335581:337009, ack 1, win 893, options [nop,nop,TS val 153614 ecr 4294906844,mptcp dss ack 2295998090 seq 3914187594 subseq 335581 len 1428 csum 0x2953], length 1428
10:53:17.233013 IP 112.26.1.1.37753 > 112.26.1.8.37887: Flags [.], seq 337009:338437, ack 1, win 893, options [nop,nop,TS val 153614 ecr 4294906844,mptcp dss ack 2295998090 seq 3914189022 subseq 337009 len 1428 csum 0x4088], length 1428
10:53:17.233360 IP 112.26.1.1.37753 > 112.26.1.8.37887: Flags [.], seq 337009:338437, ack 1, win 893, options [nop,nop,TS val 153614 ecr 4294906844,mptcp dss ack 2295998090 seq 3914189022 subseq 337009 len 1428 csum 0x4088], length 1428
10:53:17.243476 IP 112.26.1.1.37753 > 112.26.1.8.37887: Flags [.], seq 327013:328441, ack 1, win 893, options [nop,nop,TS val 152825 ecr 4294906062,mptcp dss ack 2295998090 seq 3914159034 subseq 327013 len 1428 csum 0x58e4], length 1428
10:53:17.342341 IP 112.26.1.1.37753 > 112.26.1.8.37887: Flags [.], seq 328441:329869, ack 1, win 893, options [nop,nop,TS val 153223 ecr 4294906456,mptcp dss ack 2295998090 seq 3914169030 subseq 328441 len 1428 csum 0x3b82], length 1428
10:53:17.349999 IP 112.26.1.1.37753 > 112.26.1.8.37887: Flags [.], seq 338437:339865, ack 1, win 893, options [nop,nop,TS val 153764 ecr 4294907007,mptcp dss ack 2295998090 seq 3914194734 subseq 338437 len 1428 csum 0x801c], length 1428
10:53:17.350213 IP 112.26.1.1.37753 > 112.26.1.8.37887: Flags [.], seq 338437:339865, ack 1, win 893, options [nop,nop,TS val 153764 ecr 4294907007,mptcp dss ack 2295998090 seq 3914194734 subseq 338437 len 1428 csum 0x801c], length 1428
10:53:17.387026 IP 112.26.1.1.37753 > 112.26.1.8.37887: Flags [.], seq 339865:341293, ack 1, win 893, options [nop,nop,TS val 153764 ecr 4294907007,mptcp dss ack 2295998090 seq 3914196162 subseq 339865 len 1428 csum 0xb592], length 1428
10:53:17.387307 IP 112.26.1.1.37753 > 112.26.1.8.37887: Flags [.], seq 339865:341293, ack 1, win 893, options [nop,nop,TS val 153764 ecr 4294907007,mptcp dss ack 2295998090 seq 3914196162 subseq 339865 len 1428 csum 0xb592], length 1428
10:53:17.428410 IP 112.26.1.1.37753 > 112.26.1.8.37887: Flags [.], seq 329869:331297, ack 1, win 893, options [nop,nop,TS val 153223 ecr 4294906456,mptcp dss ack 2295998090 seq 3914170458 subseq 329869 len 1428 csum 0x4182], length 1428
10:53:17.530231 IP 112.26.1.8.37887 > 112.26.1.1.37753: Flags [.], ack 331297, win 24216, options [nop,nop,TS val 4294907416 ecr 152825,mptcp dss ack 3914106198], length 0
10:53:17.531847 IP 112.26.1.8.37887 > 112.26.1.1.37753: Flags [.], ack 331297, win 24216, options [nop,nop,TS val 4294907416 ecr 152825,mptcp dss ack 3914106198], length 0
10:53:17.556612 IP 112.26.1.1.37753 > 112.26.1.8.37887: Flags [.], seq 341293:342721, ack 1, win 893, options [nop,nop,TS val 154173 ecr 4294907416,mptcp dss ack 2295998090 seq 3914209014 subseq 341293 len 1428 csum 0x2189], length 1428
10:53:17.556920 IP 112.26.1.1.37753 > 112.26.1.8.37887: Flags [.], seq 341293:342721, ack 1, win 893, options [nop,nop,TS val 154173 ecr 4294907416,mptcp dss ack 2295998090 seq 3914209014 subseq 341293 len 1428 csum 0x2189], length 1428
10:53:17.586182 IP 112.26.1.1.37753 > 112.26.1.8.37887: Flags [.], seq 331297:332725, ack 1, win 893, options [nop,nop,TS val 153223 ecr 4294906456,mptcp dss ack 2295998090 seq 3914171886 subseq 331297 len 1428 csum 0xf905], length 1428
10:53:17.643580 IP 112.26.1.1.37753 > 112.26.1.8.37887: Flags [.], seq 342721:344149, ack 1, win 893, options [nop,nop,TS val 154173 ecr 4294907416,mptcp dss ack 2295998090 seq 3914210442 subseq 342721 len 1428 csum 0x121e], length 1428
10:53:17.643884 IP 112.26.1.1.37753 > 112.26.1.8.37887: Flags [.], seq 342721:344149, ack 1, win 893, options [nop,nop,TS val 154173 ecr 4294907416,mptcp dss ack 2295998090 seq 3914210442 subseq 342721 len 1428 csum 0x121e], length 1428
10:53:17.704937 IP 112.26.1.1.37753 > 112.26.1.8.37887: Flags [.], seq 332725:334153, ack 1, win 893, options [nop,nop,TS val 153223 ecr 4294906456,mptcp dss ack 2295998090 seq 3914173314 subseq 332725 len 1428 csum 0xcb79], length 1428
10:53:17.736407 IP 112.26.1.1.37753 > 112.26.1.8.37887: Flags [.], seq 344149:345577, ack 1, win 893, options [nop,nop,TS val 154173 ecr 4294907416,mptcp dss ack 2295998090 seq 3914211870 subseq 344149 len 1428 csum 0xa649], length 1428
10:53:17.736765 IP 112.26.1.1.37753 > 112.26.1.8.37887: Flags [.], seq 344149:345577, ack 1, win 893, options [nop,nop,TS val 154173 ecr 4294907416,mptcp dss ack 2295998090 seq 3914211870 subseq 344149 len 1428 csum 0xa649], length 1428
10:53:17.762584 IP 112.26.1.1.37753 > 112.26.1.8.37887: Flags [.], seq 334153:335581, ack 1, win 893, options [nop,nop,TS val 153614 ecr 4294906844,mptcp dss ack 2295998090 seq 3914186166 subseq 334153 len 1428 csum 0x79b4], length 1428
10:53:17.791016 IP 112.26.1.1.37753 > 112.26.1.8.37887: Flags [.], seq 345577:347005, ack 1, win 893, options [nop,nop,TS val 154173 ecr 4294907416,mptcp dss ack 2295998090 seq 3914213298 subseq 345577 len 1428 csum 0x8133], length 1428
10:53:17.791259 IP 112.26.1.1.37753 > 112.26.1.8.37887: Flags [.], seq 345577:347005, ack 1, win 893, options [nop,nop,TS val 154173 ecr 4294907416,mptcp dss ack 2295998090 seq 3914213298 subseq 345577 len 1428 csum 0x8133], length 1428
10:53:17.821406 IP 112.26.1.1.37753 > 112.26.1.8.37887: Flags [.], seq 335581:337009, ack 1, win 893, options [nop,nop,TS val 153614 ecr 4294906844,mptcp dss ack 2295998090 seq 3914187594 subseq 335581 len 1428 csum 0x2953], length 1428
10:53:17.871076 IP 112.26.1.1.37753 > 112.26.1.8.37887: Flags [.], seq 347005:348433, ack 1, win 893, options [nop,nop,TS val 154173 ecr 4294907416,mptcp dss ack 2295998090 seq 3914214726 subseq 347005 len 1428 csum 0x5bf6], length 1428
10:53:17.871382 IP 112.26.1.1.37753 > 112.26.1.8.37887: Flags [.], seq 347005:348433, ack 1, win 893, options [nop,nop,TS val 154173 ecr 4294907416,mptcp dss ack 2295998090 seq 3914214726 subseq 347005 len 1428 csum 0x5bf6], length 1428
10:53:17.916074 IP 112.26.1.1.37753 > 112.26.1.8.37887: Flags [.], seq 337009:338437, ack 1, win 893, options [nop,nop,TS val 153614 ecr 4294906844,mptcp dss ack 2295998090 seq 3914189022 subseq 337009 len 1428 csum 0x4088], length 1428
10:53:17.927106 IP 112.26.1.8.37887 > 112.26.1.1.37753: Flags [.], ack 338437, win 24216, options [nop,nop,TS val 4294907810 ecr 153223,mptcp dss ack 3914106198], length 0
10:53:17.928976 IP 112.26.1.8.37887 > 112.26.1.1.37753: Flags [.], ack 338437, win 24216, options [nop,nop,TS val 4294907810 ecr 153223,mptcp dss ack 3914106198], length 0
10:53:17.980998 IP 112.26.1.1.37753 > 112.26.1.8.37887: Flags [.], seq 348433:349861, ack 1, win 893, options [nop,nop,TS val 154570 ecr 4294907810,mptcp dss ack 2295998090 seq 3914221866 subseq 348433 len 1428 csum 0xc17b], length 1428
10:53:17.981244 IP 112.26.1.1.37753 > 112.26.1.8.37887: Flags [.], seq 348433:349861, ack 1, win 893, options [nop,nop,TS val 154570 ecr 4294907810,mptcp dss ack 2295998090 seq 3914221866 subseq 348433 len 1428 csum 0xc17b], length 1428
10:53:18.073512 IP 112.26.1.1.37753 > 112.26.1.8.37887: Flags [.], seq 338437:339865, ack 1, win 893, options [nop,nop,TS val 153764 ecr 4294907007,mptcp dss ack 2295998090 seq 3914194734 subseq 338437 len 1428 csum 0x801c], length 1428
10:53:18.104387 IP 112.26.1.1.37753 > 112.26.1.8.37887: Flags [.], seq 349861:351289, ack 1, win 893, options [nop,nop,TS val 154570 ecr 4294907810,mptcp dss ack 2295998090 seq 3914223294 subseq 349861 len 1428 csum 0xaf8a], length 1428
10:53:18.104687 IP 112.26.1.1.37753 > 112.26.1.8.37887: Flags [.], seq 349861:351289, ack 1, win 893, options [nop,nop,TS val 154570 ecr 4294907810,mptcp dss ack 2295998090 seq 3914223294 subseq 349861 len 1428 csum 0xaf8a], length 1428
10:53:18.183020 IP 112.26.1.1.37753 > 112.26.1.8.37887: Flags [.], seq 351289:352717, ack 1, win 893, options [nop,nop,TS val 154570 ecr 4294907810,mptcp dss ack 2295998090 seq 3914224722 subseq 351289 len 1428 csum 0x848f], length 1428
10:53:18.183250 IP 112.26.1.1.37753 > 112.26.1.8.37887: Flags [.], seq 351289:352717, ack 1, win 893, options [nop,nop,TS val 154570 ecr 4294907810,mptcp dss ack 2295998090 seq 3914224722 subseq 351289 len 1428 csum 0x848f], length 1428
10:53:18.226832 IP 112.26.1.1.37753 > 112.26.1.8.37887: Flags [.], seq 339865:341293, ack 1, win 893, options [nop,nop,TS val 153764 ecr 4294907007,mptcp dss ack 2295998090 seq 3914196162 subseq 339865 len 1428 csum 0xb592], length 1428
10:53:18.264593 IP 112.26.1.1.37753 > 112.26.1.8.37887: Flags [.], seq 352717:354145, ack 1, win 893, options [nop,nop,TS val 154570 ecr 4294907810,mptcp dss ack 2295998090 seq 3914226150 subseq 352717 len 1428 csum 0xb9f2], length 1428
10:53:18.264883 IP 112.26.1.1.37753 > 112.26.1.8.37887: Flags [.], seq 352717:354145, ack 1, win 893, options [nop,nop,TS val 154570 ecr 4294907810,mptcp dss ack 2295998090 seq 3914226150 subseq 352717 len 1428 csum 0xb9f2], length 1428
10:53:18.316774 IP 112.26.1.1.37753 > 112.26.1.8.37887: Flags [.], seq 354145:355573, ack 1, win 893, options [nop,nop,TS val 154570 ecr 4294907810,mptcp dss ack 2295998090 seq 3914227578 subseq 354145 len 1428 csum 0x4f05], length 1428
10:53:18.317080 IP 112.26.1.1.37753 > 112.26.1.8.37887: Flags [.], seq 354145:355573, ack 1, win 893, options [nop,nop,TS val 154570 ecr 4294907810,mptcp dss ack 2295998090 seq 3914227578 subseq 354145 len 1428 csum 0x4f05], length 1428
10:53:18.329737 IP 112.26.1.8.37887 > 112.26.1.1.37753: Flags [.], ack 341293, win 24295, options [nop,nop,TS val 4294908216 ecr 153764,mptcp dss ack 3914167602], length 0
10:53:18.331487 IP 112.26.1.8.37887 > 112.26.1.1.37753: Flags [.], ack 341293, win 24295, options [nop,nop,TS val 4294908216 ecr 153764,mptcp dss ack 3914167602], length 0
10:53:18.444746 IP 112.26.1.1.37753 > 112.26.1.8.37887: Flags [.], seq 355573:357001, ack 1, win 893, options [nop,nop,TS val 154973 ecr 4294908216,mptcp dss ack 2295998090 seq 3914246142 subseq 355573 len 1428 csum 0x5159], length 1428
10:53:18.445038 IP 112.26.1.1.37753 > 112.26.1.8.37887: Flags [.], seq 355573:357001, ack 1, win 893, options [nop,nop,TS val 154973 ecr 4294908216,mptcp dss ack 2295998090 seq 3914246142 subseq 355573 len 1428 csum 0x5159], length 1428
10:53:18.458554 IP 112.26.1.1.37753 > 112.26.1.8.37887: Flags [.], seq 341293:342721, ack 1, win 893, options [nop,nop,TS val 154173 ecr 4294907416,mptcp dss ack 2295998090 seq 3914209014 subseq 341293 len 1428 csum 0x2189], length 1428
10:53:18.493985 IP 112.26.1.1.37753 > 112.26.1.8.37887: Flags [.], seq 342721:344149, ack 1, win 893, options [nop,nop,TS val 154173 ecr 4294907416,mptcp dss ack 2295998090 seq 3914210442 subseq 342721 len 1428 csum 0x121e], length 1428
10:53:18.504235 IP 112.26.1.1.37753 > 112.26.1.8.37887: Flags [.], seq 357001:358429, ack 1, win 893, options [nop,nop,TS val 154973 ecr 4294908216,mptcp dss ack 2295998090 seq 3914247570 subseq 357001 len 1428 csum 0x2342], length 1428
10:53:18.504384 IP 112.26.1.1.37753 > 112.26.1.8.37887: Flags [.], seq 357001:358429, ack 1, win 893, options [nop,nop,TS val 154973 ecr 4294908216,mptcp dss ack 2295998090 seq 3914247570 subseq 357001 len 1428 csum 0x2342], length 1428
10:53:18.521408 IP 112.26.1.8.37887 > 112.26.1.1.37753: Flags [.], ack 344149, win 24003, options [nop,nop,TS val 4294908403 ecr 154173,mptcp dss ack 3914211870], length 0
10:53:18.523783 IP 112.26.1.8.37887 > 112.26.1.1.37753: Flags [.], ack 344149, win 24003, options [nop,nop,TS val 4294908403 ecr 154173,mptcp dss ack 3914211870], length 0
10:53:18.617310 IP 112.26.1.1.37753 > 112.26.1.8.37887: Flags [.], seq 344149:345577, ack 1, win 893, options [nop,nop,TS val 154173 ecr 4294907416,mptcp dss ack 2295998090 seq 3914211870 subseq 344149 len 1428 csum 0xa649], length 1428
10:53:18.656158 IP 112.26.1.1.37753 > 112.26.1.8.37887: Flags [.], seq 358429:359857, ack 1, win 893, options [nop,nop,TS val 155165 ecr 4294908403,mptcp dss ack 2295998090 seq 3914254710 subseq 358429 len 1428 csum 0x5a6a], length 1428
10:53:18.656505 IP 112.26.1.1.37753 > 112.26.1.8.37887: Flags [.], seq 358429:359857, ack 1, win 893, options [nop,nop,TS val 155165 ecr 4294908403,mptcp dss ack 2295998090 seq 3914254710 subseq 358429 len 1428 csum 0x5a6a], length 1428
10:53:18.713350 IP 112.26.1.1.37753 > 112.26.1.8.37887: Flags [.], seq 359857:361285, ack 1, win 893, options [nop,nop,TS val 155165 ecr 4294908403,mptcp dss ack 2295998090 seq 3914256138 subseq 359857 len 1428 csum 0x57b9], length 1428
10:53:18.713716 IP 112.26.1.1.37753 > 112.26.1.8.37887: Flags [.], seq 359857:361285, ack 1, win 893, options [nop,nop,TS val 155165 ecr 4294908403,mptcp dss ack 2295998090 seq 3914256138 subseq 359857 len 1428 csum 0x57b9], length 1428
10:53:18.748384 IP 112.26.1.8.37887 > 112.26.1.1.37753: Flags [.], ack 345577, win 24467, options [nop,nop,TS val 4294908631 ecr 154173,nop,nop,sack 1 {347005:348433},mptcp dss ack 3914213298], length 0
10:53:18.751394 IP 112.26.1.1.37753 > 112.26.1.8.37887: Flags [.], seq 347005:348433, ack 1, win 893, options [nop,nop,TS val 154173 ecr 4294907416,mptcp dss ack 2295998090 seq 3914214726 subseq 347005 len 1428 csum 0x5bf6], length 1428
10:53:18.754405 IP 112.26.1.8.37887 > 112.26.1.1.37753: Flags [.], ack 345577, win 24467, options [nop,nop,TS val 4294908631 ecr 154173,nop,nop,sack 1 {347005:348433},mptcp dss ack 3914213298], length 0
10:53:18.850373 IP 112.26.1.1.37753 > 112.26.1.8.37887: Flags [.], seq 361285:362713, ack 1, win 893, options [nop,nop,TS val 155165 ecr 4294908403,mptcp dss ack 2295998090 seq 3914257566 subseq 361285 len 1428 csum 0x880], length 1428
10:53:18.850733 IP 112.26.1.1.37753 > 112.26.1.8.37887: Flags [.], seq 361285:362713, ack 1, win 893, options [nop,nop,TS val 155165 ecr 4294908403,mptcp dss ack 2295998090 seq 3914257566 subseq 361285 len 1428 csum 0x880], length 1428
10:53:18.874773 IP 112.26.1.1.37753 > 112.26.1.8.37887: Flags [.], seq 348433:349861, ack 1, win 893, options [nop,nop,TS val 154570 ecr 4294907810,mptcp dss ack 2295998090 seq 3914221866 subseq 348433 len 1428 csum 0xc17b], length 1428
10:53:18.909822 IP 112.26.1.8.37887 > 112.26.1.1.37753: Flags [.], ack 345577, win 24467, options [nop,nop,TS val 4294908768 ecr 154173,nop,nop,sack 1 {347005:349861},mptcp dss ack 3914213298], length 0
10:53:18.925275 IP 112.26.1.8.37887 > 112.26.1.1.37753: Flags [.], ack 345577, win 24467, options [nop,nop,TS val 4294908768 ecr 154173,nop,nop,sack 1 {347005:349861},mptcp dss ack 3914213298], length 0
10:53:19.008801 IP 112.26.1.1.37753 > 112.26.1.8.37887: Flags [.], seq 362713:364141, ack 1, win 893, options [nop,nop,TS val 155396 ecr 4294908631,mptcp dss ack 2295998090 seq 3914270418 subseq 362713 len 1428 csum 0x9e48], length 1428
10:53:19.009158 IP 112.26.1.1.37753 > 112.26.1.8.37887: Flags [.], seq 362713:364141, ack 1, win 893, options [nop,nop,TS val 155396 ecr 4294908631,mptcp dss ack 2295998090 seq 3914270418 subseq 362713 len 1428 csum 0x9e48], length 1428
10:53:19.040484 IP 112.26.1.1.37753 > 112.26.1.8.37887: Flags [.], seq 349861:351289, ack 1, win 893, options [nop,nop,TS val 154570 ecr 4294907810,mptcp dss ack 2295998090 seq 3914223294 subseq 349861 len 1428 csum 0xaf8a], length 1428
10:53:19.049019 IP 112.26.1.8.37887 > 112.26.1.1.37753: Flags [.], ack 345577, win 24467, options [nop,nop,TS val 4294908934 ecr 154173,nop,nop,sack 1 {347005:351289},mptcp dss ack 3914213298], length 0
10:53:19.107381 IP 112.26.1.1.37753 > 112.26.1.8.37887: Flags [.], seq 364141:365569, ack 1, win 893, options [nop,nop,TS val 155396 ecr 4294908631,mptcp dss ack 2295998090 seq 3914271846 subseq 364141 len 1428 csum 0x1121], length 1428
10:53:19.107645 IP 112.26.1.1.37753 > 112.26.1.8.37887: Flags [.], seq 364141:365569, ack 1, win 893, options [nop,nop,TS val 155396 ecr 4294908631,mptcp dss ack 2295998090 seq 3914271846 subseq 364141 len 1428 csum 0x1121], length 1428
10:53:19.121327 IP 112.26.1.8.37887 > 112.26.1.1.37753: Flags [.], ack 345577, win 24467, options [nop,nop,TS val 4294908934 ecr 154173,nop,nop,sack 1 {347005:351289},mptcp dss ack 3914213298], length 0
10:53:19.167110 IP 112.26.1.1.37753 > 112.26.1.8.37887: Flags [.], seq 351289:352717, ack 1, win 893, options [nop,nop,TS val 154570 ecr 4294907810,mptcp dss ack 2295998090 seq 3914224722 subseq 351289 len 1428 csum 0x848f], length 1428
10:53:19.241103 IP 112.26.1.1.37753 > 112.26.1.8.37887: Flags [.], seq 365569:366997, ack 1, win 893, options [nop,nop,TS val 155396 ecr 4294908631,mptcp dss ack 2295998090 seq 3914273274 subseq 365569 len 1428 csum 0x8ba5], length 1428
10:53:19.241442 IP 112.26.1.1.37753 > 112.26.1.8.37887: Flags [.], seq 365569:366997, ack 1, win 893, options [nop,nop,TS val 155396 ecr 4294908631,mptcp dss ack 2295998090 seq 3914273274 subseq 365569 len 1428 csum 0x8ba5], length 1428
10:53:19.259568 IP 112.26.1.8.37887 > 112.26.1.1.37753: Flags [.], ack 345577, win 24467, options [nop,nop,TS val 4294909061 ecr 154173,nop,nop,sack 1 {347005:352717},mptcp dss ack 3914213298], length 0
10:53:19.304159 IP 112.26.1.8.37887 > 112.26.1.1.37753: Flags [.], ack 345577, win 24467, options [nop,nop,TS val 4294909061 ecr 154173,nop,nop,sack 1 {347005:352717},mptcp dss ack 3914213298], length 0
10:53:19.347804 IP 112.26.1.1.37753 > 112.26.1.8.37887: Flags [.], seq 366997:368425, ack 1, win 893, options [nop,nop,TS val 155578 ecr 4294908768,mptcp dss ack 2295998090 seq 3914280414 subseq 366997 len 1428 csum 0xd6a], length 1428
10:53:19.348150 IP 112.26.1.1.37753 > 112.26.1.8.37887: Flags [.], seq 366997:368425, ack 1, win 893, options [nop,nop,TS val 155578 ecr 4294908768,mptcp dss ack 2295998090 seq 3914280414 subseq 366997 len 1428 csum 0xd6a], length 1428
10:53:19.372797 IP 112.26.1.1.37753 > 112.26.1.8.37887: Flags [.], seq 355573:357001, ack 1, win 893, options [nop,nop,TS val 154973 ecr 4294908216,mptcp dss ack 2295998090 seq 3914246142 subseq 355573 len 1428 csum 0x5159], length 1428
10:53:19.384080 IP 112.26.1.8.37887 > 112.26.1.1.37753: Flags [.], ack 345577, win 24467, options [nop,nop,TS val 4294909267 ecr 154173,nop,nop,sack 2 {355573:357001}{347005:352717},mptcp dss ack 3914213298], length 0
10:53:19.448048 IP 112.26.1.8.37887 > 112.26.1.1.37753: Flags [.], ack 345577, win 24467, options [nop,nop,TS val 4294909267 ecr 154173,nop,nop,sack 2 {355573:357001}{347005:352717},mptcp dss ack 3914213298], length 0
10:53:19.500299 IP 112.26.1.1.37753 > 112.26.1.8.37887: Flags [.], seq 345577:347005, ack 1, win 893, options [nop,nop,TS val 155762 ecr 4294908934,mptcp dss ack 2295998090 seq 3914213298 subseq 345577 len 1428 csum 0x8133], length 1428
10:53:19.500530 IP 112.26.1.1.37753 > 112.26.1.8.37887: Flags [.], seq 345577:347005, ack 1, win 893, options [nop,nop,TS val 155762 ecr 4294908934,mptcp dss ack 2295998090 seq 3914213298 subseq 345577 len 1428 csum 0x8133], length 1428
