10:52:36.311248 IP 112.26.0.8.47540 > 112.26.0.1.37753: Flags [S], seq 1638377377, win 65535, options [mss 1460,sackOK,TS val 4294864994 ecr 0,nop,wscale 6,mptcp capable csum {0x387d1706caeff15f}], length 0
10:52:36.326349 IP 112.26.0.8.47540 > 112.26.0.1.37753: Flags [S], seq 1638377377, win 65535, options [mss 1460,sackOK,TS val 4294864994 ecr 0,nop,wscale 6,mptcp capable csum {0x387d1706caeff15f}], length 0
10:52:36.630920 IP 112.26.0.1.37753 > 112.26.0.8.47540: Flags [S.], seq 328085945, ack 1638377378, win 28560, options [mss 1460,sackOK,TS val 113064 ecr 4294864994,nop,wscale 7,mptcp capable csum {0xa9600d5f0da32383}], length 0
10:52:36.631228 IP 112.26.0.8.47540 > 112.26.0.1.37753: Flags [.], ack 1, win 1369, options [nop,nop,TS val 4294866524 ecr 113064,mptcp capable csum {0x387d1706caeff15f,0xa9600d5f0da32383},mptcp dss ack 3912698378], length 0
10:52:36.631282 IP 112.26.0.8.47540 > 112.26.0.1.37753: Flags [.], ack 1, win 1369, options [nop,nop,TS val 4294866524 ecr 113064,mptcp add-addr id 3 112.26.1.8,mptcp dss ack 3912698378], length 0
10:52:36.631313 IP 112.26.0.8.47540 > 112.26.0.1.37753: Flags [.], ack 1, win 1369, options [nop,nop,TS val 4294866524 ecr 113064,mptcp add-addr id 4 112.26.2.8,mptcp dss ack 3912698378], length 0
10:52:36.631345 IP 112.26.0.8.47540 > 112.26.0.1.37753: Flags [.], ack 1, win 1369, options [nop,nop,TS val 4294866524 ecr 113064,mptcp add-addr id 5 112.26.3.8,mptcp dss ack 3912698378], length 0
10:53:01.188954 IP 112.26.0.1.37753 > 112.26.0.8.47540: Flags [.], seq 262565:263993, ack 1, win 893, options [nop,nop,TS val 137359 ecr 4294889836,mptcp dss ack 2295998090 seq 3913470738 subseq 262565 len 1428 csum 0xc11], length 1428
10:53:01.189168 IP 112.26.0.8.47540 > 112.26.0.1.37753: Flags [.], ack 263993, win 24422, options [nop,nop,TS val 4294891083 ecr 137359,mptcp dss ack 3913399338], length 0
10:53:01.298814 IP 112.26.0.8.47540 > 112.26.0.1.37753: Flags [.], ack 258281, win 24422, options [nop,nop,TS val 4294890617 ecr 136946,mptcp dss ack 3913399338], length 0
10:53:01.329933 IP 112.26.0.1.37753 > 112.26.0.8.47540: Flags [.], seq 265421:266849, ack 1, win 893, options [nop,nop,TS val 137494 ecr 4294889951,mptcp dss ack 2295998090 seq 3913480734 subseq 265421 len 1428 csum 0xaf11], length 1428
10:53:16.413176 IP 112.26.0.1.37753 > 112.26.0.8.47540: Flags [.], seq 428213:429641, ack 1, win 893, options [nop,nop,TS val 151884 ecr 4294904759,mptcp dss ack 2295998090 seq 3914120478 subseq 428213 len 1428 csum 0xa805], length 1428
10:53:31.680726 IP 112.26.0.1.37753 > 112.26.0.8.47540: Flags [.], seq 608141:609569, ack 1, win 893, options [nop,nop,TS val 167458 ecr 4294920635,mptcp dss ack 2295998090 seq 3914863038 subseq 608141 len 1428 csum 0xc477], length 1428
10:53:49.908006 IP 112.26.0.1.37753 > 112.26.0.8.47540: Flags [.], seq 802349:803777, ack 1, win 893, options [nop,nop,TS val 185594 ecr 4294938832,mptcp dss ack 2295998090 seq 3915659862 subseq 802349 len 1428 csum 0x6c4f], length 1428
10:53:49.908224 IP 112.26.0.8.47540 > 112.26.0.1.37753: Flags [.], ack 803777, win 24471, options [nop,nop,TS val 4294939801 ecr 185594,mptcp dss ack 3915655578], length 0
10:53:49.931650 IP 112.26.0.8.47540 > 112.26.0.1.37753: Flags [.], ack 803777, win 24471, options [nop,nop,TS val 4294939801 ecr 185594,mptcp dss ack 3915655578], length 0
10:53:50.077373 IP 112.26.0.1.37753 > 112.26.0.8.47540: Flags [.], seq 803777:805205, ack 1, win 893, options [nop,nop,TS val 185594 ecr 4294938832,mptcp dss ack 2295998090 seq 3915661290 subseq 803777 len 1428 csum 0x8f60], length 1428
10:53:50.181890 IP 112.26.0.1.37753 > 112.26.0.8.47540: Flags [.], seq 805205:806633, ack 1, win 893, options [nop,nop,TS val 185594 ecr 4294938832,mptcp dss ack 2295998090 seq 3915662718 subseq 805205 len 1428 csum 0xe3d4], length 1428
10:53:50.182198 IP 112.26.0.8.47540 > 112.26.0.1.37753: Flags [.], ack 806633, win 24427, options [nop,nop,TS val 4294940076 ecr 185594,mptcp dss ack 3915664146], length 0
10:53:50.200777 IP 112.26.0.8.47540 > 112.26.0.1.37753: Flags [.], ack 806633, win 24427, options [nop,nop,TS val 4294940076 ecr 185594,mptcp dss ack 3915664146], length 0
10:53:50.339742 IP 112.26.0.1.37753 > 112.26.0.8.47540: Flags [.], seq 806633:808061, ack 1, win 893, options [nop,nop,TS val 185594 ecr 4294938832,mptcp dss ack 2295998090 seq 3915664146 subseq 806633 len 1428 csum 0xe3bf], length 1428
10:53:50.468009 IP 112.26.0.1.37753 > 112.26.0.8.47540: Flags [.], seq 808061:809489, ack 1, win 893, options [nop,nop,TS val 186022 ecr 4294939225,mptcp dss ack 2295998090 seq 3915679854 subseq 808061 len 1428 csum 0x61ea], length 1428
10:53:50.468233 IP 112.26.0.8.47540 > 112.26.0.1.37753: Flags [.], ack 809489, win 24468, options [nop,nop,TS val 4294940362 ecr 185594,mptcp dss ack 3915681282], length 0
10:53:50.478158 IP 112.26.0.8.47540 > 112.26.0.1.37753: Flags [.], ack 809489, win 24468, options [nop,nop,TS val 4294940362 ecr 185594,mptcp dss ack 3915681282], length 0
10:53:50.573431 IP 112.26.0.1.37753 > 112.26.0.8.47540: Flags [.], seq 809489:810917, ack 1, win 893, options [nop,nop,TS val 186022 ecr 4294939225,mptcp dss ack 2295998090 seq 3915681282 subseq 809489 len 1428 csum 0x91d], length 1428
10:53:50.751233 IP 112.26.0.1.37753 > 112.26.0.8.47540: Flags [.], seq 810917:812345, ack 1, win 893, options [nop,nop,TS val 186022 ecr 4294939225,mptcp dss ack 2295998090 seq 3915682710 subseq 810917 len 1428 csum 0x31b7], length 1428
10:53:50.751428 IP 112.26.0.8.47540 > 112.26.0.1.37753: Flags [.], ack 812345, win 24378, options [nop,nop,TS val 4294940645 ecr 186022,mptcp dss ack 3915692706], length 0
10:53:50.757642 IP 112.26.0.8.47540 > 112.26.0.1.37753: Flags [.], ack 812345, win 24378, options [nop,nop,TS val 4294940645 ecr 186022,mptcp dss ack 3915692706], length 0
10:53:50.935219 IP 112.26.0.1.37753 > 112.26.0.8.47540: Flags [.], seq 812345:813773, ack 1, win 893, options [nop,nop,TS val 186296 ecr 4294939541,mptcp dss ack 2295998090 seq 3915692706 subseq 812345 len 1428 csum 0x4485], length 1428
10:53:51.068936 IP 112.26.0.1.37753 > 112.26.0.8.47540: Flags [.], seq 813773:815201, ack 1, win 893, options [nop,nop,TS val 186296 ecr 4294939541,mptcp dss ack 2295998090 seq 3915694134 subseq 813773 len 1428 csum 0x4f6b], length 1428
10:53:51.069241 IP 112.26.0.8.47540 > 112.26.0.1.37753: Flags [.], ack 815201, win 24362, options [nop,nop,TS val 4294940963 ecr 186296,mptcp dss ack 3915705558], length 0
10:53:51.083071 IP 112.26.0.8.47540 > 112.26.0.1.37753: Flags [.], ack 815201, win 24362, options [nop,nop,TS val 4294940963 ecr 186296,mptcp dss ack 3915705558], length 0
10:53:51.194267 IP 112.26.0.1.37753 > 112.26.0.8.47540: Flags [.], seq 816629:818057, ack 1, win 893, options [nop,nop,TS val 186578 ecr 4294939801,mptcp dss ack 2295998090 seq 3915706986 subseq 816629 len 1428 csum 0xe303], length 1428
10:53:51.194485 IP 112.26.0.8.47540 > 112.26.0.1.37753: Flags [.], ack 815201, win 24471, options [nop,nop,TS val 4294941088 ecr 186296,nop,nop,sack 1 {816629:818057},mptcp dss ack 3915705558], length 0
10:53:51.367688 IP 112.26.0.8.47540 > 112.26.0.1.37753: Flags [.], ack 815201, win 24471, options [nop,nop,TS val 4294941088 ecr 186296,nop,nop,sack 1 {816629:818057},mptcp dss ack 3915705558], length 0
10:53:51.480329 IP 112.26.0.1.37753 > 112.26.0.8.47540: Flags [.], seq 818057:819485, ack 1, win 893, options [nop,nop,TS val 186578 ecr 4294939801,mptcp dss ack 2295998090 seq 3915708414 subseq 818057 len 1428 csum 0xbed6], length 1428
10:53:51.480547 IP 112.26.0.8.47540 > 112.26.0.1.37753: Flags [.], ack 815201, win 24471, options [nop,nop,TS val 4294941374 ecr 186296,nop,nop,sack 1 {816629:819485},mptcp dss ack 3915705558], length 0
10:53:51.515261 IP 112.26.0.8.47540 > 112.26.0.1.37753: Flags [.], ack 815201, win 24471, options [nop,nop,TS val 4294941374 ecr 186296,nop,nop,sack 1 {816629:819485},mptcp dss ack 3915705558], length 0
10:53:51.641199 IP 112.26.0.1.37753 > 112.26.0.8.47540: Flags [.], seq 819485:820913, ack 1, win 893, options [nop,nop,TS val 186836 ecr 4294940076,mptcp dss ack 2295998090 seq 3915721266 subseq 819485 len 1428 csum 0xd1d4], length 1428
10:53:51.641495 IP 112.26.0.8.47540 > 112.26.0.1.37753: Flags [.], ack 815201, win 24471, options [nop,nop,TS val 4294941534 ecr 186296,nop,nop,sack 1 {816629:820913},mptcp dss ack 3915705558], length 0
10:53:51.665492 IP 112.26.0.8.47540 > 112.26.0.1.37753: Flags [.], ack 815201, win 24471, options [nop,nop,TS val 4294941534 ecr 186296,nop,nop,sack 1 {816629:820913},mptcp dss ack 3915705558], length 0
10:53:51.768345 IP 112.26.0.1.37753 > 112.26.0.8.47540: Flags [.], seq 820913:822341, ack 1, win 893, options [nop,nop,TS val 186836 ecr 4294940076,mptcp dss ack 2295998090 seq 3915722694 subseq 820913 len 1428 csum 0x12f], length 1428
10:53:51.768561 IP 112.26.0.8.47540 > 112.26.0.1.37753: Flags [.], ack 815201, win 24471, options [nop,nop,TS val 4294941662 ecr 186296,nop,nop,sack 1 {816629:822341},mptcp dss ack 3915705558], length 0
10:53:51.776522 IP 112.26.0.8.47540 > 112.26.0.1.37753: Flags [.], ack 815201, win 24471, options [nop,nop,TS val 4294941662 ecr 186296,nop,nop,sack 1 {816629:822341},mptcp dss ack 3915705558], length 0
10:53:51.866307 IP 112.26.0.1.37753 > 112.26.0.8.47540: Flags [.], seq 823769:825197, ack 1, win 893, options [nop,nop,TS val 187122 ecr 4294940362,mptcp dss ack 2295998090 seq 3915741258 subseq 823769 len 1428 csum 0xcfc9], length 1428
10:53:51.866523 IP 112.26.0.8.47540 > 112.26.0.1.37753: Flags [.], ack 815201, win 24471, options [nop,nop,TS val 4294941760 ecr 186296,nop,nop,sack 2 {823769:825197}{816629:822341},mptcp dss ack 3915705558], length 0
10:53:51.933737 IP 112.26.0.8.47540 > 112.26.0.1.37753: Flags [.], ack 815201, win 24471, options [nop,nop,TS val 4294941760 ecr 186296,nop,nop,sack 2 {823769:825197}{816629:822341},mptcp dss ack 3915705558], length 0
10:53:52.006170 IP 112.26.0.1.37753 > 112.26.0.8.47540: Flags [.], seq 826625:828053, ack 1, win 893, options [nop,nop,TS val 187434 ecr 4294940645,mptcp dss ack 2295998090 seq 3915754110 subseq 826625 len 1428 csum 0xa2b1], length 1428
10:53:52.006476 IP 112.26.0.8.47540 > 112.26.0.1.37753: Flags [.], ack 815201, win 24471, options [nop,nop,TS val 4294941900 ecr 186296,nop,nop,sack 2 {826625:828053}{823769:825197},mptcp dss ack 3915705558], length 0
10:53:52.034554 IP 112.26.0.8.47540 > 112.26.0.1.37753: Flags [.], ack 815201, win 24471, options [nop,nop,TS val 4294941900 ecr 186296,nop,nop,sack 2 {826625:828053}{823769:825197},mptcp dss ack 3915705558], length 0
10:53:52.100517 IP 112.26.0.1.37753 > 112.26.0.8.47540: Flags [.], seq 828053:829481, ack 1, win 893, options [nop,nop,TS val 187434 ecr 4294940645,mptcp dss ack 2295998090 seq 3915755538 subseq 828053 len 1428 csum 0x4f85], length 1428
10:53:52.100758 IP 112.26.0.8.47540 > 112.26.0.1.37753: Flags [.], ack 815201, win 24471, options [nop,nop,TS val 4294941994 ecr 186296,nop,nop,sack 2 {826625:829481}{823769:825197},mptcp dss ack 3915705558], length 0
10:53:52.186847 IP 112.26.0.8.47540 > 112.26.0.1.37753: Flags [.], ack 815201, win 24471, options [nop,nop,TS val 4294941994 ecr 186296,nop,nop,sack 2 {826625:829481}{823769:825197},mptcp dss ack 3915705558], length 0
10:53:52.198153 IP 112.26.0.1.37753 > 112.26.0.8.47540: Flags [.], seq 829481:830909, ack 1, win 893, options [nop,nop,TS val 187434 ecr 4294940645,mptcp dss ack 2295998090 seq 3915756966 subseq 829481 len 1428 csum 0xbadc], length 1428
10:53:52.198399 IP 112.26.0.8.47540 > 112.26.0.1.37753: Flags [.], ack 815201, win 24471, options [nop,nop,TS val 4294942091 ecr 186296,nop,nop,sack 2 {826625:830909}{823769:825197},mptcp dss ack 3915705558], length 0
10:53:52.284738 IP 112.26.0.1.37753 > 112.26.0.8.47540: Flags [.], seq 832337:833765, ack 1, win 893, options [nop,nop,TS val 187733 ecr 4294940963,mptcp dss ack 2295998090 seq 3915769818 subseq 832337 len 1428 csum 0xf62f], length 1428
10:53:52.284955 IP 112.26.0.8.47540 > 112.26.0.1.37753: Flags [.], ack 815201, win 24471, options [nop,nop,TS val 4294942178 ecr 186296,nop,nop,sack 2 {832337:833765}{826625:830909},mptcp dss ack 3915705558], length 0
10:53:52.330717 IP 112.26.0.8.47540 > 112.26.0.1.37753: Flags [.], ack 815201, win 24471, options [nop,nop,TS val 4294942091 ecr 186296,nop,nop,sack 2 {826625:830909}{823769:825197},mptcp dss ack 3915705558], length 0
10:53:52.469761 IP 112.26.0.8.47540 > 112.26.0.1.37753: Flags [.], ack 815201, win 24471, options [nop,nop,TS val 4294942178 ecr 186296,nop,nop,sack 2 {832337:833765}{826625:830909},mptcp dss ack 3915705558], length 0
10:53:52.512815 IP 112.26.0.1.37753 > 112.26.0.8.47540: Flags [.], seq 835193:836621, ack 1, win 893, options [nop,nop,TS val 188110 ecr 4294941088,mptcp dss ack 2295998090 seq 3915785526 subseq 835193 len 1428 csum 0x2834], length 1428
10:53:52.513041 IP 112.26.0.8.47540 > 112.26.0.1.37753: Flags [.], ack 815201, win 24471, options [nop,nop,TS val 4294942406 ecr 186296,nop,nop,sack 2 {835193:836621}{832337:833765},mptcp dss ack 3915705558], length 0
10:53:52.611551 IP 112.26.0.1.37753 > 112.26.0.8.47540: Flags [.], seq 836621:838049, ack 1, win 893, options [nop,nop,TS val 188201 ecr 4294941374,mptcp dss ack 2295998090 seq 3915789810 subseq 836621 len 1428 csum 0x26ff], length 1428
10:53:52.611745 IP 112.26.0.8.47540 > 112.26.0.1.37753: Flags [.], ack 815201, win 24471, options [nop,nop,TS val 4294942505 ecr 186296,nop,nop,sack 2 {835193:838049}{832337:833765},mptcp dss ack 3915705558], length 0
10:53:52.720299 IP 112.26.0.1.37753 > 112.26.0.8.47540: Flags [.], seq 815201:816629, ack 1, win 893, options [nop,nop,TS val 188309 ecr 4294941534,mptcp dss ack 2295998090 seq 3915705558 subseq 815201 len 1428 csum 0x90c1], length 1428
10:53:52.720508 IP 112.26.0.8.47540 > 112.26.0.1.37753: Flags [.], ack 822341, win 24181, options [nop,nop,TS val 4294942613 ecr 188309,nop,nop,sack 2 {835193:838049}{832337:833765},mptcp dss ack 3915724122], length 0
10:53:52.791702 IP 112.26.0.8.47540 > 112.26.0.1.37753: Flags [.], ack 815201, win 24471, options [nop,nop,TS val 4294942406 ecr 186296,nop,nop,sack 2 {835193:836621}{832337:833765},mptcp dss ack 3915705558], length 0
10:53:52.838953 IP 112.26.0.8.47540 > 112.26.0.1.37753: Flags [.], ack 815201, win 24471, options [nop,nop,TS val 4294942505 ecr 186296,nop,nop,sack 2 {835193:838049}{832337:833765},mptcp dss ack 3915705558], length 0
10:53:52.873973 IP 112.26.0.1.37753 > 112.26.0.8.47540: Flags [.], seq 822341:823769, ack 1, win 893, options [nop,nop,TS val 188834 ecr 4294941994,mptcp dss ack 2295998090 seq 3915724122 subseq 822341 len 1428 csum 0xac15], length 1428
10:53:52.874205 IP 112.26.0.8.47540 > 112.26.0.1.37753: Flags [.], ack 825197, win 23960, options [nop,nop,TS val 4294942767 ecr 188834,nop,nop,sack 2 {835193:838049}{832337:833765},mptcp dss ack 3915742686], length 0
10:53:52.947987 IP 112.26.0.8.47540 > 112.26.0.1.37753: Flags [.], ack 822341, win 24181, options [nop,nop,TS val 4294942613 ecr 188309,nop,nop,sack 2 {835193:838049}{832337:833765},mptcp dss ack 3915724122], length 0
10:53:53.042392 IP 112.26.0.1.37753 > 112.26.0.8.47540: Flags [.], seq 825197:826625, ack 1, win 893, options [nop,nop,TS val 188977 ecr 4294942091,mptcp dss ack 2295998090 seq 3915742686 subseq 825197 len 1428 csum 0x99ad], length 1428
10:53:53.042637 IP 112.26.0.8.47540 > 112.26.0.1.37753: Flags [.], ack 830909, win 24079, options [nop,nop,TS val 4294942936 ecr 188977,nop,nop,sack 2 {835193:838049}{832337:833765},mptcp dss ack 3915764106], length 0
10:53:53.067403 IP 112.26.0.8.47540 > 112.26.0.1.37753: Flags [.], ack 825197, win 23960, options [nop,nop,TS val 4294942767 ecr 188834,nop,nop,sack 2 {835193:838049}{832337:833765},mptcp dss ack 3915742686], length 0
10:53:53.186164 IP 112.26.0.1.37753 > 112.26.0.8.47540: Flags [.], seq 830909:832337, ack 1, win 893, options [nop,nop,TS val 189132 ecr 4294942178,mptcp dss ack 2295998090 seq 3915768390 subseq 830909 len 1428 csum 0x9868], length 1428
10:53:53.186363 IP 112.26.0.8.47540 > 112.26.0.1.37753: Flags [.], ack 833765, win 24298, options [nop,nop,TS val 4294943080 ecr 189132,nop,nop,sack 1 {835193:838049},mptcp dss ack 3915764106], length 0
10:53:53.228880 IP 112.26.0.8.47540 > 112.26.0.1.37753: Flags [.], ack 830909, win 24079, options [nop,nop,TS val 4294942936 ecr 188977,nop,nop,sack 2 {835193:838049}{832337:833765},mptcp dss ack 3915764106], length 0
10:53:53.244461 IP 112.26.0.1.37753 > 112.26.0.8.47540: Flags [.], seq 833765:835193, ack 1, win 893, options [nop,nop,TS val 189435 ecr 4294942406,mptcp dss ack 2295998090 seq 3915771246 subseq 833765 len 1428 csum 0xb3e6], length 1428
10:53:53.244660 IP 112.26.0.8.47540 > 112.26.0.1.37753: Flags [.], ack 838049, win 24298, options [nop,nop,TS val 4294943138 ecr 189435,mptcp dss ack 3915764106], length 0
10:53:53.361219 IP 112.26.0.8.47540 > 112.26.0.1.37753: Flags [.], ack 833765, win 24298, options [nop,nop,TS val 4294943080 ecr 189132,nop,nop,sack 1 {835193:838049},mptcp dss ack 3915764106], length 0
10:53:53.397014 IP 112.26.0.1.37753 > 112.26.0.8.47540: Flags [.], seq 839477:840905, ack 1, win 893, options [nop,nop,TS val 189522 ecr 4294942505,mptcp dss ack 2295998090 seq 3915835506 subseq 839477 len 1428 csum 0x1520], length 1428
10:53:53.397313 IP 112.26.0.8.47540 > 112.26.0.1.37753: Flags [.], ack 838049, win 24298, options [nop,nop,TS val 4294943291 ecr 189435,nop,nop,sack 1 {839477:840905},mptcp dss ack 3915764106], length 0
10:53:53.474885 IP 112.26.0.8.47540 > 112.26.0.1.37753: Flags [.], ack 838049, win 24298, options [nop,nop,TS val 4294943138 ecr 189435,mptcp dss ack 3915764106], length 0
10:53:53.551397 IP 112.26.0.1.37753 > 112.26.0.8.47540: Flags [.], seq 840905:842333, ack 1, win 893, options [nop,nop,TS val 189647 ecr 4294942613,mptcp dss ack 2295998090 seq 3915841218 subseq 840905 len 1428 csum 0xc0e2], length 1428
10:53:53.551755 IP 112.26.0.8.47540 > 112.26.0.1.37753: Flags [.], ack 838049, win 24298, options [nop,nop,TS val 4294943445 ecr 189435,nop,nop,sack 1 {839477:842333},mptcp dss ack 3915764106], length 0
10:53:53.680234 IP 112.26.0.1.37753 > 112.26.0.8.47540: Flags [.], seq 842333:843761, ack 1, win 893, options [nop,nop,TS val 189647 ecr 4294942613,mptcp dss ack 2295998090 seq 3915842646 subseq 842333 len 1428 csum 0x22d8], length 1428
10:53:53.680611 IP 112.26.0.8.47540 > 112.26.0.1.37753: Flags [.], ack 838049, win 24298, options [nop,nop,TS val 4294943574 ecr 189435,nop,nop,sack 1 {839477:843761},mptcp dss ack 3915764106], length 0
10:53:53.705642 IP 112.26.0.8.47540 > 112.26.0.1.37753: Flags [.], ack 838049, win 24298, options [nop,nop,TS val 4294943291 ecr 189435,nop,nop,sack 1 {839477:840905},mptcp dss ack 3915764106], length 0
10:53:53.813500 IP 112.26.0.1.37753 > 112.26.0.8.47540: Flags [.], seq 843761:845189, ack 1, win 893, options [nop,nop,TS val 189647 ecr 4294942613,mptcp dss ack 2295998090 seq 3915844074 subseq 843761 len 1428 csum 0x352], length 1428
10:53:53.813858 IP 112.26.0.8.47540 > 112.26.0.1.37753: Flags [.], ack 838049, win 24298, options [nop,nop,TS val 4294943707 ecr 189435,nop,nop,sack 1 {839477:845189},mptcp dss ack 3915764106], length 0
10:53:53.825188 IP 112.26.0.8.47540 > 112.26.0.1.37753: Flags [.], ack 838049, win 24298, options [nop,nop,TS val 4294943445 ecr 189435,nop,nop,sack 1 {839477:842333},mptcp dss ack 3915764106], length 0
10:53:53.891510 IP 112.26.0.1.37753 > 112.26.0.8.47540: Flags [.], seq 838049:839477, ack 1, win 893, options [nop,nop,TS val 189721 ecr 4294942767,mptcp dss ack 2295998090 seq 3915796950 subseq 838049 len 1428 csum 0x743f], length 1428
10:53:53.891882 IP 112.26.0.8.47540 > 112.26.0.1.37753: Flags [.], ack 845189, win 24298, options [nop,nop,TS val 4294943785 ecr 189721,mptcp dss ack 3915764106], length 0
10:53:53.980312 IP 112.26.0.8.47540 > 112.26.0.1.37753: Flags [.], ack 838049, win 24298, options [nop,nop,TS val 4294943574 ecr 189435,nop,nop,sack 1 {839477:843761},mptcp dss ack 3915764106], length 0
10:53:54.018793 IP 112.26.0.1.37753 > 112.26.0.8.47540: Flags [.], seq 845189:846617, ack 1, win 893, options [nop,nop,TS val 189721 ecr 4294942767,mptcp dss ack 2295998090 seq 3915846930 subseq 845189 len 1428 csum 0x7632], length 1428
10:53:54.019150 IP 112.26.0.8.47540 > 112.26.0.1.37753: Flags [.], ack 846617, win 24298, options [nop,nop,TS val 4294943912 ecr 189721,mptcp dss ack 3915764106], length 0
10:53:54.077030 IP 112.26.0.8.47540 > 112.26.0.1.37753: Flags [.], ack 838049, win 24298, options [nop,nop,TS val 4294943707 ecr 189435,nop,nop,sack 1 {839477:845189},mptcp dss ack 3915764106], length 0
10:53:54.164624 IP 112.26.0.1.37753 > 112.26.0.8.47540: Flags [.], seq 846617:848045, ack 1, win 893, options [nop,nop,TS val 189872 ecr 4294942936,mptcp dss ack 2295998090 seq 3915852642 subseq 846617 len 1428 csum 0xbdac], length 1428
10:53:54.164966 IP 112.26.0.8.47540 > 112.26.0.1.37753: Flags [.], ack 848045, win 24298, options [nop,nop,TS val 4294944058 ecr 189872,mptcp dss ack 3915764106], length 0
10:53:54.201082 IP 112.26.0.8.47540 > 112.26.0.1.37753: Flags [.], ack 845189, win 24298, options [nop,nop,TS val 4294943785 ecr 189721,mptcp dss ack 3915764106], length 0
10:53:54.266086 IP 112.26.0.1.37753 > 112.26.0.8.47540: Flags [.], seq 848045:849473, ack 1, win 893, options [nop,nop,TS val 190010 ecr 4294943080,mptcp dss ack 2295998090 seq 3915854070 subseq 848045 len 1428 csum 0x3e97], length 1428
10:53:54.266398 IP 112.26.0.8.47540 > 112.26.0.1.37753: Flags [.], ack 849473, win 24298, options [nop,nop,TS val 4294944159 ecr 190010,mptcp dss ack 3915764106], length 0
10:53:54.315779 IP 112.26.0.8.47540 > 112.26.0.1.37753: Flags [.], ack 846617, win 24298, options [nop,nop,TS val 4294943912 ecr 189721,mptcp dss ack 3915764106], length 0
10:53:54.381957 IP 112.26.0.1.37753 > 112.26.0.8.47540: Flags [.], seq 849473:850901, ack 1, win 893, options [nop,nop,TS val 190118 ecr 4294943138,mptcp dss ack 2295998090 seq 3915862638 subseq 849473 len 1428 csum 0xf741], length 1428
10:53:54.382315 IP 112.26.0.8.47540 > 112.26.0.1.37753: Flags [.], ack 850901, win 24298, options [nop,nop,TS val 4294944275 ecr 190118,mptcp dss ack 3915764106], length 0
10:53:54.425404 IP 112.26.0.8.47540 > 112.26.0.1.37753: Flags [.], ack 848045, win 24298, options [nop,nop,TS val 4294944058 ecr 189872,mptcp dss ack 3915764106], length 0
10:53:54.501943 IP 112.26.0.1.37753 > 112.26.0.8.47540: Flags [.], seq 850901:852329, ack 1, win 893, options [nop,nop,TS val 190420 ecr 4294943291,mptcp dss ack 2295998090 seq 3915874062 subseq 850901 len 1428 csum 0xed77], length 1428
10:53:54.502291 IP 112.26.0.8.47540 > 112.26.0.1.37753: Flags [.], ack 852329, win 24476, options [nop,nop,TS val 4294944396 ecr 190420,mptcp dss ack 3915858354], length 0
10:53:54.578825 IP 112.26.0.8.47540 > 112.26.0.1.37753: Flags [.], ack 849473, win 24298, options [nop,nop,TS val 4294944159 ecr 190010,mptcp dss ack 3915764106], length 0
10:53:54.616073 IP 112.26.0.1.37753 > 112.26.0.8.47540: Flags [.], seq 852329:853757, ack 1, win 893, options [nop,nop,TS val 190649 ecr 4294943574,mptcp dss ack 2295998090 seq 3915882630 subseq 852329 len 1428 csum 0xb8b7], length 1428
10:53:54.616453 IP 112.26.0.8.47540 > 112.26.0.1.37753: Flags [.], ack 853757, win 24454, options [nop,nop,TS val 4294944510 ecr 190649,mptcp dss ack 3915859782], length 0
10:53:54.707928 IP 112.26.0.8.47540 > 112.26.0.1.37753: Flags [.], ack 850901, win 24298, options [nop,nop,TS val 4294944275 ecr 190118,mptcp dss ack 3915764106], length 0
10:53:54.747300 IP 112.26.0.1.37753 > 112.26.0.8.47540: Flags [.], seq 853757:855185, ack 1, win 893, options [nop,nop,TS val 190748 ecr 4294943707,mptcp dss ack 2295998090 seq 3915886914 subseq 853757 len 1428 csum 0x3e2], length 1428
10:53:54.747630 IP 112.26.0.8.47540 > 112.26.0.1.37753: Flags [.], ack 855185, win 24432, options [nop,nop,TS val 4294944641 ecr 190748,mptcp dss ack 3915861210], length 0
10:53:54.809693 IP 112.26.0.8.47540 > 112.26.0.1.37753: Flags [.], ack 852329, win 24476, options [nop,nop,TS val 4294944396 ecr 190420,mptcp dss ack 3915858354], length 0
10:53:54.894945 IP 112.26.0.1.37753 > 112.26.0.8.47540: Flags [.], seq 855185:856613, ack 1, win 893, options [nop,nop,TS val 191069 ecr 4294944058,mptcp dss ack 2295998090 seq 3915904050 subseq 855185 len 1428 csum 0xb69f], length 1428
10:53:54.895305 IP 112.26.0.8.47540 > 112.26.0.1.37753: Flags [.], ack 856613, win 24386, options [nop,nop,TS val 4294944788 ecr 191069,mptcp dss ack 3915869778], length 0
10:53:54.909854 IP 112.26.0.8.47540 > 112.26.0.1.37753: Flags [.], ack 853757, win 24454, options [nop,nop,TS val 4294944510 ecr 190649,mptcp dss ack 3915859782], length 0
10:53:54.988975 IP 112.26.0.8.47540 > 112.26.0.1.37753: Flags [.], ack 855185, win 24432, options [nop,nop,TS val 4294944641 ecr 190748,mptcp dss ack 3915861210], length 0
10:53:55.027811 IP 112.26.0.1.37753 > 112.26.0.8.47540: Flags [.], seq 856613:858041, ack 1, win 893, options [nop,nop,TS val 191223 ecr 4294944159,mptcp dss ack 2295998090 seq 3915912618 subseq 856613 len 1428 csum 0x41bb], length 1428
10:53:55.028171 IP 112.26.0.8.47540 > 112.26.0.1.37753: Flags [.], ack 858041, win 24364, options [nop,nop,TS val 4294944921 ecr 191223,mptcp dss ack 3915871206], length 0
10:53:55.092187 IP 112.26.0.8.47540 > 112.26.0.1.37753: Flags [.], ack 856613, win 24386, options [nop,nop,TS val 4294944788 ecr 191069,mptcp dss ack 3915869778], length 0
10:53:55.112523 IP 112.26.0.1.37753 > 112.26.0.8.47540: Flags [.], seq 858041:859469, ack 1, win 893, options [nop,nop,TS val 191351 ecr 4294944275,mptcp dss ack 2295998090 seq 3915919758 subseq 858041 len 1428 csum 0x7eef], length 1428
10:53:55.112888 IP 112.26.0.8.47540 > 112.26.0.1.37753: Flags [.], ack 859469, win 24364, options [nop,nop,TS val 4294945006 ecr 191351,mptcp dss ack 3915871206], length 0
10:53:55.212533 IP 112.26.0.1.37753 > 112.26.0.8.47540: Flags [.], seq 859469:860897, ack 1, win 893, options [nop,nop,TS val 191453 ecr 4294944396,mptcp dss ack 2295998090 seq 3915931182 subseq 859469 len 1428 csum 0x570a], length 1428
10:53:55.212884 IP 112.26.0.8.47540 > 112.26.0.1.37753: Flags [.], ack 860897, win 24364, options [nop,nop,TS val 4294945106 ecr 191453,mptcp dss ack 3915871206], length 0
10:53:55.234592 IP 112.26.0.8.47540 > 112.26.0.1.37753: Flags [.], ack 858041, win 24364, options [nop,nop,TS val 4294944921 ecr 191223,mptcp dss ack 3915871206], length 0
10:53:55.285506 IP 112.26.0.1.37753 > 112.26.0.8.47540: Flags [.], seq 860897:862325, ack 1, win 893, options [nop,nop,TS val 191557 ecr 4294944510,mptcp dss ack 2295998090 seq 3915932610 subseq 860897 len 1428 csum 0xefc2], length 1428
10:53:55.285888 IP 112.26.0.8.47540 > 112.26.0.1.37753: Flags [.], ack 862325, win 24364, options [nop,nop,TS val 4294945179 ecr 191557,mptcp dss ack 3915871206], length 0
10:53:55.348491 IP 112.26.0.8.47540 > 112.26.0.1.37753: Flags [.], ack 859469, win 24364, options [nop,nop,TS val 4294945006 ecr 191351,mptcp dss ack 3915871206], length 0
10:53:55.435923 IP 112.26.0.1.37753 > 112.26.0.8.47540: Flags [.], seq 862325:863753, ack 1, win 893, options [nop,nop,TS val 191642 ecr 4294944641,mptcp dss ack 2295998090 seq 3915938322 subseq 862325 len 1428 csum 0xe5c], length 1428
10:53:55.436264 IP 112.26.0.8.47540 > 112.26.0.1.37753: Flags [.], ack 863753, win 24364, options [nop,nop,TS val 4294945330 ecr 191642,mptcp dss ack 3915871206], length 0
10:53:55.497151 IP 112.26.0.8.47540 > 112.26.0.1.37753: Flags [.], ack 860897, win 24364, options [nop,nop,TS val 4294945106 ecr 191453,mptcp dss ack 3915871206], length 0
10:53:55.545210 IP 112.26.0.1.37753 > 112.26.0.8.47540: Flags [.], seq 863753:865181, ack 1, win 893, options [nop,nop,TS val 191750 ecr 4294944788,mptcp dss ack 2295998090 seq 3915948318 subseq 863753 len 1428 csum 0xd4a0], length 1428
10:53:55.545511 IP 112.26.0.8.47540 > 112.26.0.1.37753: Flags [.], ack 865181, win 24364, options [nop,nop,TS val 4294945439 ecr 191750,mptcp dss ack 3915871206], length 0
10:53:55.668362 IP 112.26.0.8.47540 > 112.26.0.1.37753: Flags [.], ack 862325, win 24364, options [nop,nop,TS val 4294945179 ecr 191557,mptcp dss ack 3915871206], length 0
10:53:55.684670 IP 112.26.0.1.37753 > 112.26.0.8.47540: Flags [.], seq 865181:866609, ack 1, win 893, options [nop,nop,TS val 191750 ecr 4294944788,mptcp dss ack 2295998090 seq 3915949746 subseq 865181 len 1428 csum 0x1651], length 1428
10:53:55.725175 IP 112.26.0.8.47540 > 112.26.0.1.37753: Flags [.], ack 866609, win 24364, options [nop,nop,TS val 4294945619 ecr 191750,mptcp dss ack 3915871206], length 0
10:53:55.744129 IP 112.26.0.8.47540 > 112.26.0.1.37753: Flags [.], ack 863753, win 24364, options [nop,nop,TS val 4294945330 ecr 191642,mptcp dss ack 3915871206], length 0
10:53:55.845236 IP 112.26.0.1.37753 > 112.26.0.8.47540: Flags [.], seq 866609:868037, ack 1, win 893, options [nop,nop,TS val 191878 ecr 4294944921,mptcp dss ack 2295998090 seq 3915954030 subseq 866609 len 1428 csum 0xcb67], length 1428
10:53:55.881402 IP 112.26.0.8.47540 > 112.26.0.1.37753: Flags [.], ack 865181, win 24364, options [nop,nop,TS val 4294945439 ecr 191750,mptcp dss ack 3915871206], length 0
10:53:55.929898 IP 112.26.0.1.37753 > 112.26.0.8.47540: Flags [.], seq 868037:869465, ack 1, win 893, options [nop,nop,TS val 191993 ecr 4294945006,mptcp dss ack 2295998090 seq 3915956886 subseq 868037 len 1428 csum 0x6c95], length 1428
10:53:55.930283 IP 112.26.0.8.47540 > 112.26.0.1.37753: Flags [.], ack 868037, win 24364, options [nop,nop,TS val 4294945824 ecr 191878,mptcp dss ack 3915871206], length 0
10:53:55.984875 IP 112.26.0.8.47540 > 112.26.0.1.37753: Flags [.], ack 866609, win 24364, options [nop,nop,TS val 4294945619 ecr 191750,mptcp dss ack 3915871206], length 0
10:53:56.060244 IP 112.26.0.1.37753 > 112.26.0.8.47540: Flags [.], seq 869465:870893, ack 1, win 893, options [nop,nop,TS val 192142 ecr 4294945106,mptcp dss ack 2295998090 seq 3915966882 subseq 869465 len 1428 csum 0x591], length 1428
10:53:56.060627 IP 112.26.0.8.47540 > 112.26.0.1.37753: Flags [.], ack 870893, win 24364, options [nop,nop,TS val 4294945954 ecr 191993,mptcp dss ack 3915871206], length 0
10:53:56.102941 IP 112.26.0.8.47540 > 112.26.0.1.37753: Flags [.], ack 868037, win 24364, options [nop,nop,TS val 4294945824 ecr 191878,mptcp dss ack 3915871206], length 0
10:53:56.206249 IP 112.26.0.1.37753 > 112.26.0.8.47540: Flags [.], seq 870893:872321, ack 1, win 893, options [nop,nop,TS val 192312 ecr 4294945179,mptcp dss ack 2295998090 seq 3915971166 subseq 870893 len 1428 csum 0xedd4], length 1428
10:53:56.221170 IP 112.26.0.8.47540 > 112.26.0.1.37753: Flags [.], ack 870893, win 24364, options [nop,nop,TS val 4294945954 ecr 191993,mptcp dss ack 3915871206], length 0
10:53:56.293738 IP 112.26.0.1.37753 > 112.26.0.8.47540: Flags [.], seq 872321:873749, ack 1, win 893, options [nop,nop,TS val 192405 ecr 4294945330,mptcp dss ack 2295998090 seq 3915978306 subseq 872321 len 1428 csum 0xcb07], length 1428
10:53:56.406462 IP 112.26.0.1.37753 > 112.26.0.8.47540: Flags [.], seq 873749:875177, ack 1, win 893, options [nop,nop,TS val 192524 ecr 4294945439,mptcp dss ack 2295998090 seq 3915981162 subseq 873749 len 1428 csum 0x455], length 1428
10:53:56.406810 IP 112.26.0.8.47540 > 112.26.0.1.37753: Flags [.], ack 875177, win 24364, options [nop,nop,TS val 4294946300 ecr 192312,mptcp dss ack 3915871206], length 0
10:53:56.419816 IP 112.26.0.8.47540 > 112.26.0.1.37753: Flags [.], ack 875177, win 24364, options [nop,nop,TS val 4294946300 ecr 192312,mptcp dss ack 3915871206], length 0
10:53:56.531684 IP 112.26.0.1.37753 > 112.26.0.8.47540: Flags [.], seq 875177:876605, ack 1, win 893, options [nop,nop,TS val 192644 ecr 4294945619,mptcp dss ack 2295998090 seq 3915984018 subseq 875177 len 1428 csum 0xbf62], length 1428
10:53:56.732288 IP 112.26.0.1.37753 > 112.26.0.8.47540: Flags [.], seq 876605:878033, ack 1, win 893, options [nop,nop,TS val 192749 ecr 4294945824,mptcp dss ack 2295998090 seq 3915989730 subseq 876605 len 1428 csum 0x7fa], length 1428
10:53:56.732667 IP 112.26.0.8.47540 > 112.26.0.1.37753: Flags [.], ack 878033, win 24364, options [nop,nop,TS val 4294946625 ecr 192644,mptcp dss ack 3915871206], length 0
10:53:56.744118 IP 112.26.0.8.47540 > 112.26.0.1.37753: Flags [.], ack 878033, win 24364, options [nop,nop,TS val 4294946625 ecr 192644,mptcp dss ack 3915871206], length 0
10:53:56.883472 IP 112.26.0.1.37753 > 112.26.0.8.47540: Flags [.], seq 878033:879461, ack 1, win 893, options [nop,nop,TS val 192867 ecr 4294945954,mptcp dss ack 2295998090 seq 3915999726 subseq 878033 len 1428 csum 0xa85b], length 1428
10:53:57.013688 IP 112.26.0.1.37753 > 112.26.0.8.47540: Flags [.], seq 879461:880889, ack 1, win 893, options [nop,nop,TS val 192867 ecr 4294945954,mptcp dss ack 2295998090 seq 3916001154 subseq 879461 len 1428 csum 0xcbdc], length 1428
10:53:57.054302 IP 112.26.0.1.37753 > 112.26.0.8.47540: Flags [.], seq 880889:882317, ack 1, win 893, options [nop,nop,TS val 193064 ecr 4294946300,mptcp dss ack 2295998090 seq 3916006866 subseq 880889 len 1428 csum 0x25e1], length 1428
10:53:57.098824 IP 112.26.0.8.47540 > 112.26.0.1.37753: Flags [.], ack 882317, win 23673, options [nop,nop,TS val 4294946992 ecr 192867,mptcp dss ack 3915915474], length 0
10:53:57.102078 IP 112.26.0.8.47540 > 112.26.0.1.37753: Flags [.], ack 882317, win 23673, options [nop,nop,TS val 4294946992 ecr 192867,mptcp dss ack 3915915474], length 0
10:53:57.241334 IP 112.26.0.1.37753 > 112.26.0.8.47540: Flags [.], seq 882317:883745, ack 1, win 893, options [nop,nop,TS val 193064 ecr 4294946300,mptcp dss ack 2295998090 seq 3916008294 subseq 882317 len 1428 csum 0xa435], length 1428
10:53:57.356278 IP 112.26.0.1.37753 > 112.26.0.8.47540: Flags [.], seq 883745:885173, ack 1, win 893, options [nop,nop,TS val 193064 ecr 4294946300,mptcp dss ack 2295998090 seq 3916009722 subseq 883745 len 1428 csum 0xe25], length 1428
10:53:57.356658 IP 112.26.0.8.47540 > 112.26.0.1.37753: Flags [.], ack 885173, win 23860, options [nop,nop,TS val 4294947250 ecr 193064,mptcp dss ack 3915915474], length 0
10:53:57.363019 IP 112.26.0.8.47540 > 112.26.0.1.37753: Flags [.], ack 885173, win 23860, options [nop,nop,TS val 4294947250 ecr 193064,mptcp dss ack 3915915474], length 0
10:53:57.463483 IP 112.26.0.1.37753 > 112.26.0.8.47540: Flags [.], seq 885173:886601, ack 1, win 893, options [nop,nop,TS val 193381 ecr 4294946625,mptcp dss ack 2295998090 seq 3916021146 subseq 885173 len 1428 csum 0x5167], length 1428
10:53:57.573919 IP 112.26.0.1.37753 > 112.26.0.8.47540: Flags [.], seq 886601:888029, ack 1, win 893, options [nop,nop,TS val 193381 ecr 4294946625,mptcp dss ack 2295998090 seq 3916022574 subseq 886601 len 1428 csum 0xd736], length 1428
10:53:57.674724 IP 112.26.0.8.47540 > 112.26.0.1.37753: Flags [.], ack 888029, win 23860, options [nop,nop,TS val 4294947568 ecr 193381,mptcp dss ack 3915915474], length 0
10:53:57.770119 IP 112.26.0.8.47540 > 112.26.0.1.37753: Flags [.], ack 888029, win 23860, options [nop,nop,TS val 4294947568 ecr 193381,mptcp dss ack 3915915474], length 0
10:53:57.800273 IP 112.26.0.1.37753 > 112.26.0.8.47540: Flags [.], seq 888029:889457, ack 1, win 893, options [nop,nop,TS val 193749 ecr 4294946992,mptcp dss ack 2295998090 seq 3916045422 subseq 888029 len 1428 csum 0xf2f2], length 1428
10:53:57.931136 IP 112.26.0.1.37753 > 112.26.0.8.47540: Flags [.], seq 889457:890885, ack 1, win 893, options [nop,nop,TS val 193749 ecr 4294946992,mptcp dss ack 2295998090 seq 3916046850 subseq 889457 len 1428 csum 0x1b70], length 1428
10:53:58.005768 IP 112.26.0.1.37753 > 112.26.0.8.47540: Flags [.], seq 890885:892313, ack 1, win 893, options [nop,nop,TS val 193749 ecr 4294946992,mptcp dss ack 2295998090 seq 3916048278 subseq 890885 len 1428 csum 0xda52], length 1428
10:53:58.052356 IP 112.26.0.1.37753 > 112.26.0.8.47540: Flags [.], seq 892313:893741, ack 1, win 893, options [nop,nop,TS val 193749 ecr 4294946992,mptcp dss ack 2295998090 seq 3916049706 subseq 892313 len 1428 csum 0x6bc4], length 1428
10:53:58.156034 IP 112.26.0.1.37753 > 112.26.0.8.47540: Flags [.], seq 893741:895169, ack 1, win 893, options [nop,nop,TS val 194006 ecr 4294947250,mptcp dss ack 2295998090 seq 3916055418 subseq 893741 len 1428 csum 0x9279], length 1428
10:53:58.226122 IP 112.26.0.8.47540 > 112.26.0.1.37753: Flags [.], ack 895169, win 23860, options [nop,nop,TS val 4294948120 ecr 193749,mptcp dss ack 3915915474], length 0
10:53:58.242064 IP 112.26.0.8.47540 > 112.26.0.1.37753: Flags [.], ack 895169, win 23860, options [nop,nop,TS val 4294948120 ecr 193749,mptcp dss ack 3915915474], length 0
10:53:58.272788 IP 112.26.0.1.37753 > 112.26.0.8.47540: Flags [.], seq 895169:896597, ack 1, win 893, options [nop,nop,TS val 194006 ecr 4294947250,mptcp dss ack 2295998090 seq 3916056846 subseq 895169 len 1428 csum 0x71c6], length 1428
10:53:58.395558 IP 112.26.0.1.37753 > 112.26.0.8.47540: Flags [.], seq 896597:898025, ack 1, win 893, options [nop,nop,TS val 194542 ecr 4294947568,mptcp dss ack 2295998090 seq 3916073982 subseq 896597 len 1428 csum 0x8737], length 1428
10:53:58.457015 IP 112.26.0.8.47540 > 112.26.0.1.37753: Flags [.], ack 898025, win 23291, options [nop,nop,TS val 4294948350 ecr 194006,mptcp dss ack 3916005438], length 0
10:53:58.469364 IP 112.26.0.8.47540 > 112.26.0.1.37753: Flags [.], ack 898025, win 23291, options [nop,nop,TS val 4294948350 ecr 194006,mptcp dss ack 3916005438], length 0
10:53:58.519507 IP 112.26.0.1.37753 > 112.26.0.8.47540: Flags [.], seq 898025:899453, ack 1, win 893, options [nop,nop,TS val 194542 ecr 4294947568,mptcp dss ack 2295998090 seq 3916075410 subseq 898025 len 1428 csum 0x2239], length 1428
10:53:58.639327 IP 112.26.0.1.37753 > 112.26.0.8.47540: Flags [.], seq 899453:900881, ack 1, win 893, options [nop,nop,TS val 194542 ecr 4294947568,mptcp dss ack 2295998090 seq 3916076838 subseq 899453 len 1428 csum 0xae2], length 1428
10:53:58.639631 IP 112.26.0.8.47540 > 112.26.0.1.37753: Flags [.], ack 900881, win 24208, options [nop,nop,TS val 4294948533 ecr 194542,mptcp dss ack 3916012578], length 0
10:53:58.648779 IP 112.26.0.8.47540 > 112.26.0.1.37753: Flags [.], ack 900881, win 24208, options [nop,nop,TS val 4294948533 ecr 194542,mptcp dss ack 3916012578], length 0
10:53:58.726761 IP 112.26.0.1.37753 > 112.26.0.8.47540: Flags [.], seq 900881:902309, ack 1, win 893, options [nop,nop,TS val 194542 ecr 4294947568,mptcp dss ack 2295998090 seq 3916078266 subseq 900881 len 1428 csum 0x8325], length 1428
10:53:58.834414 IP 112.26.0.1.37753 > 112.26.0.8.47540: Flags [.], seq 902309:903737, ack 1, win 893, options [nop,nop,TS val 194886 ecr 4294948120,mptcp dss ack 2295998090 seq 3916086834 subseq 902309 len 1428 csum 0xb6c7], length 1428
10:53:58.928218 IP 112.26.0.1.37753 > 112.26.0.8.47540: Flags [.], seq 903737:905165, ack 1, win 893, options [nop,nop,TS val 194886 ecr 4294948120,mptcp dss ack 2295998090 seq 3916088262 subseq 903737 len 1428 csum 0xad7e], length 1428
10:53:58.928557 IP 112.26.0.8.47540 > 112.26.0.1.37753: Flags [.], ack 905165, win 24208, options [nop,nop,TS val 4294948822 ecr 194542,mptcp dss ack 3916012578], length 0
10:53:58.935782 IP 112.26.0.8.47540 > 112.26.0.1.37753: Flags [.], ack 905165, win 24208, options [nop,nop,TS val 4294948822 ecr 194542,mptcp dss ack 3916012578], length 0
10:53:59.055298 IP 112.26.0.1.37753 > 112.26.0.8.47540: Flags [.], seq 905165:906593, ack 1, win 893, options [nop,nop,TS val 194886 ecr 4294948120,mptcp dss ack 2295998090 seq 3916089690 subseq 905165 len 1428 csum 0x71d9], length 1428
10:53:59.217238 IP 112.26.0.1.37753 > 112.26.0.8.47540: Flags [.], seq 906593:908021, ack 1, win 893, options [nop,nop,TS val 194886 ecr 4294948120,mptcp dss ack 2295998090 seq 3916091118 subseq 906593 len 1428 csum 0xe590], length 1428
10:53:59.217618 IP 112.26.0.8.47540 > 112.26.0.1.37753: Flags [.], ack 908021, win 24208, options [nop,nop,TS val 4294949111 ecr 194886,mptcp dss ack 3916012578], length 0
10:53:59.231582 IP 112.26.0.8.47540 > 112.26.0.1.37753: Flags [.], ack 908021, win 24208, options [nop,nop,TS val 4294949111 ecr 194886,mptcp dss ack 3916012578], length 0
10:53:59.358352 IP 112.26.0.1.37753 > 112.26.0.8.47540: Flags [.], seq 908021:909449, ack 1, win 893, options [nop,nop,TS val 194886 ecr 4294948120,mptcp dss ack 2295998090 seq 3916092546 subseq 908021 len 1428 csum 0x377d], length 1428
10:53:59.424780 IP 112.26.0.1.37753 > 112.26.0.8.47540: Flags [.], seq 909449:910877, ack 1, win 893, options [nop,nop,TS val 194886 ecr 4294948120,mptcp dss ack 2295998090 seq 3916093974 subseq 909449 len 1428 csum 0x6dec], length 1428
10:53:59.553969 IP 112.26.0.1.37753 > 112.26.0.8.47540: Flags [.], seq 910877:912305, ack 1, win 893, options [nop,nop,TS val 194886 ecr 4294948120,mptcp dss ack 2295998090 seq 3916095402 subseq 910877 len 1428 csum 0xb8bc], length 1428
10:53:59.634566 IP 112.26.0.8.47540 > 112.26.0.1.37753: Flags [.], ack 912305, win 24208, options [nop,nop,TS val 4294949528 ecr 194886,mptcp dss ack 3916012578], length 0
10:53:59.638375 IP 112.26.0.8.47540 > 112.26.0.1.37753: Flags [.], ack 912305, win 24208, options [nop,nop,TS val 4294949528 ecr 194886,mptcp dss ack 3916012578], length 0
10:53:59.701454 IP 112.26.0.1.37753 > 112.26.0.8.47540: Flags [.], seq 912305:913733, ack 1, win 893, options [nop,nop,TS val 195112 ecr 4294948350,mptcp dss ack 2295998090 seq 3916102542 subseq 912305 len 1428 csum 0x53b9], length 1428
10:53:59.831591 IP 112.26.0.1.37753 > 112.26.0.8.47540: Flags [.], seq 913733:915161, ack 1, win 893, options [nop,nop,TS val 195112 ecr 4294948350,mptcp dss ack 2295998090 seq 3916103970 subseq 913733 len 1428 csum 0x9795], length 1428
10:53:59.923078 IP 112.26.0.1.37753 > 112.26.0.8.47540: Flags [.], seq 915161:916589, ack 1, win 893, options [nop,nop,TS val 195292 ecr 4294948533,mptcp dss ack 2295998090 seq 3916111110 subseq 915161 len 1428 csum 0xa95e], length 1428
10:54:00.037705 IP 112.26.0.1.37753 > 112.26.0.8.47540: Flags [.], seq 916589:918017, ack 1, win 893, options [nop,nop,TS val 195292 ecr 4294948533,mptcp dss ack 2295998090 seq 3916112538 subseq 916589 len 1428 csum 0xa1a8], length 1428
10:54:00.038044 IP 112.26.0.8.47540 > 112.26.0.1.37753: Flags [.], ack 918017, win 24208, options [nop,nop,TS val 4294949932 ecr 195112,mptcp dss ack 3916012578], length 0
10:54:00.052142 IP 112.26.0.8.47540 > 112.26.0.1.37753: Flags [.], ack 918017, win 24208, options [nop,nop,TS val 4294949932 ecr 195112,mptcp dss ack 3916012578], length 0
10:54:00.213442 IP 112.26.0.1.37753 > 112.26.0.8.47540: Flags [.], seq 918017:919445, ack 1, win 893, options [nop,nop,TS val 195292 ecr 4294948533,mptcp dss ack 2295998090 seq 3916113966 subseq 918017 len 1428 csum 0x79fb], length 1428
10:54:00.283775 IP 112.26.0.1.37753 > 112.26.0.8.47540: Flags [.], seq 919445:920873, ack 1, win 893, options [nop,nop,TS val 195580 ecr 4294948822,mptcp dss ack 2295998090 seq 3916122534 subseq 919445 len 1428 csum 0x7ff], length 1428
10:54:00.284141 IP 112.26.0.8.47540 > 112.26.0.1.37753: Flags [.], ack 920873, win 24352, options [nop,nop,TS val 4294950177 ecr 195292,mptcp dss ack 3916123962], length 0
10:54:00.308351 IP 112.26.0.8.47540 > 112.26.0.1.37753: Flags [.], ack 920873, win 24352, options [nop,nop,TS val 4294950177 ecr 195292,mptcp dss ack 3916123962], length 0
10:54:00.413519 IP 112.26.0.1.37753 > 112.26.0.8.47540: Flags [.], seq 920873:922301, ack 1, win 893, options [nop,nop,TS val 195580 ecr 4294948822,mptcp dss ack 2295998090 seq 3916123962 subseq 920873 len 1428 csum 0x23f0], length 1428
10:54:00.523416 IP 112.26.0.1.37753 > 112.26.0.8.47540: Flags [.], seq 922301:923729, ack 1, win 893, options [nop,nop,TS val 195580 ecr 4294948822,mptcp dss ack 2295998090 seq 3916125390 subseq 922301 len 1428 csum 0x7237], length 1428
10:54:00.523790 IP 112.26.0.8.47540 > 112.26.0.1.37753: Flags [.], ack 923729, win 24311, options [nop,nop,TS val 4294950417 ecr 195580,mptcp dss ack 3916126818], length 0
10:54:00.535203 IP 112.26.0.8.47540 > 112.26.0.1.37753: Flags [.], ack 923729, win 24311, options [nop,nop,TS val 4294950417 ecr 195580,mptcp dss ack 3916126818], length 0
10:54:00.626686 IP 112.26.0.1.37753 > 112.26.0.8.47540: Flags [.], seq 923729:925157, ack 1, win 893, options [nop,nop,TS val 195580 ecr 4294948822,mptcp dss ack 2295998090 seq 3916126818 subseq 923729 len 1428 csum 0x8a35], length 1428
10:54:00.768735 IP 112.26.0.1.37753 > 112.26.0.8.47540: Flags [.], seq 926585:928013, ack 1, win 893, options [nop,nop,TS val 195880 ecr 4294949111,mptcp dss ack 2295998090 seq 3916138242 subseq 926585 len 1428 csum 0x729e], length 1428
10:54:00.769102 IP 112.26.0.8.47540 > 112.26.0.1.37753: Flags [.], ack 925157, win 24289, options [nop,nop,TS val 4294950662 ecr 195580,nop,nop,sack 1 {926585:928013},mptcp dss ack 3916128246], length 0
10:54:00.774114 IP 112.26.0.8.47540 > 112.26.0.1.37753: Flags [.], ack 925157, win 24289, options [nop,nop,TS val 4294950662 ecr 195580,nop,nop,sack 1 {926585:928013},mptcp dss ack 3916128246], length 0
10:54:00.869515 IP 112.26.0.1.37753 > 112.26.0.8.47540: Flags [.], seq 928013:929441, ack 1, win 893, options [nop,nop,TS val 195880 ecr 4294949111,mptcp dss ack 2295998090 seq 3916139670 subseq 928013 len 1428 csum 0x7d8d], length 1428
10:54:00.869890 IP 112.26.0.8.47540 > 112.26.0.1.37753: Flags [.], ack 925157, win 24289, options [nop,nop,TS val 4294950763 ecr 195580,nop,nop,sack 1 {926585:929441},mptcp dss ack 3916128246], length 0
10:54:00.925624 IP 112.26.0.8.47540 > 112.26.0.1.37753: Flags [.], ack 925157, win 24289, options [nop,nop,TS val 4294950763 ecr 195580,nop,nop,sack 1 {926585:929441},mptcp dss ack 3916128246], length 0
10:54:01.004809 IP 112.26.0.1.37753 > 112.26.0.8.47540: Flags [.], seq 929441:930869, ack 1, win 893, options [nop,nop,TS val 196282 ecr 4294949528,mptcp dss ack 2295998090 seq 3916153950 subseq 929441 len 1428 csum 0x44c6], length 1428
10:54:01.005157 IP 112.26.0.8.47540 > 112.26.0.1.37753: Flags [.], ack 925157, win 24289, options [nop,nop,TS val 4294950898 ecr 195580,nop,nop,sack 1 {926585:930869},mptcp dss ack 3916128246], length 0
10:54:01.040397 IP 112.26.0.8.47540 > 112.26.0.1.37753: Flags [.], ack 925157, win 24289, options [nop,nop,TS val 4294950898 ecr 195580,nop,nop,sack 1 {926585:930869},mptcp dss ack 3916128246], length 0
10:54:01.127554 IP 112.26.0.1.37753 > 112.26.0.8.47540: Flags [.], seq 930869:932297, ack 1, win 893, options [nop,nop,TS val 196282 ecr 4294949528,mptcp dss ack 2295998090 seq 3916155378 subseq 930869 len 1428 csum 0x7017], length 1428
10:54:01.127883 IP 112.26.0.8.47540 > 112.26.0.1.37753: Flags [.], ack 925157, win 24289, options [nop,nop,TS val 4294951021 ecr 195580,nop,nop,sack 1 {926585:932297},mptcp dss ack 3916128246], length 0
10:54:01.203027 IP 112.26.0.8.47540 > 112.26.0.1.37753: Flags [.], ack 925157, win 24289, options [nop,nop,TS val 4294951021 ecr 195580,nop,nop,sack 1 {926585:932297},mptcp dss ack 3916128246], length 0
10:54:01.277645 IP 112.26.0.1.37753 > 112.26.0.8.47540: Flags [.], seq 932297:933725, ack 1, win 893, options [nop,nop,TS val 196282 ecr 4294949528,mptcp dss ack 2295998090 seq 3916156806 subseq 932297 len 1428 csum 0x1144], length 1428
10:54:01.278035 IP 112.26.0.8.47540 > 112.26.0.1.37753: Flags [.], ack 925157, win 24289, options [nop,nop,TS val 4294951171 ecr 195580,nop,nop,sack 1 {926585:933725},mptcp dss ack 3916128246], length 0
10:54:01.356956 IP 112.26.0.8.47540 > 112.26.0.1.37753: Flags [.], ack 925157, win 24289, options [nop,nop,TS val 4294951171 ecr 195580,nop,nop,sack 1 {926585:933725},mptcp dss ack 3916128246], length 0
10:54:01.432453 IP 112.26.0.1.37753 > 112.26.0.8.47540: Flags [.], seq 933725:935153, ack 1, win 893, options [nop,nop,TS val 196282 ecr 4294949528,mptcp dss ack 2295998090 seq 3916158234 subseq 933725 len 1428 csum 0xe84f], length 1428
10:54:01.432754 IP 112.26.0.8.47540 > 112.26.0.1.37753: Flags [.], ack 925157, win 24289, options [nop,nop,TS val 4294951326 ecr 195580,nop,nop,sack 1 {926585:935153},mptcp dss ack 3916128246], length 0
10:54:01.512024 IP 112.26.0.8.47540 > 112.26.0.1.37753: Flags [.], ack 925157, win 24289, options [nop,nop,TS val 4294951326 ecr 195580,nop,nop,sack 1 {926585:935153},mptcp dss ack 3916128246], length 0
10:54:01.573563 IP 112.26.0.1.37753 > 112.26.0.8.47540: Flags [.], seq 936581:938009, ack 1, win 893, options [nop,nop,TS val 196701 ecr 4294949932,mptcp dss ack 2295998090 seq 3916179654 subseq 936581 len 1428 csum 0x4d7c], length 1428
10:54:01.573917 IP 112.26.0.8.47540 > 112.26.0.1.37753: Flags [.], ack 925157, win 24289, options [nop,nop,TS val 4294951467 ecr 195580,nop,nop,sack 2 {936581:938009}{926585:935153},mptcp dss ack 3916128246], length 0
10:54:01.640255 IP 112.26.0.8.47540 > 112.26.0.1.37753: Flags [.], ack 925157, win 24289, options [nop,nop,TS val 4294951467 ecr 195580,nop,nop,sack 2 {936581:938009}{926585:935153},mptcp dss ack 3916128246], length 0
10:54:01.712905 IP 112.26.0.1.37753 > 112.26.0.8.47540: Flags [.], seq 939437:940865, ack 1, win 893, options [nop,nop,TS val 196701 ecr 4294949932,mptcp dss ack 2295998090 seq 3916182510 subseq 939437 len 1428 csum 0x83df], length 1428
10:54:01.713123 IP 112.26.0.8.47540 > 112.26.0.1.37753: Flags [.], ack 925157, win 24289, options [nop,nop,TS val 4294951606 ecr 195580,nop,nop,sack 2 {939437:940865}{936581:938009},mptcp dss ack 3916128246], length 0
10:54:01.781023 IP 112.26.0.8.47540 > 112.26.0.1.37753: Flags [.], ack 925157, win 24289, options [nop,nop,TS val 4294951606 ecr 195580,nop,nop,sack 2 {939437:940865}{936581:938009},mptcp dss ack 3916128246], length 0
10:54:01.915823 IP 112.26.0.1.37753 > 112.26.0.8.47540: Flags [.], seq 942293:943721, ack 1, win 893, options [nop,nop,TS val 196701 ecr 4294949932,mptcp dss ack 2295998090 seq 3916185366 subseq 942293 len 1428 csum 0x6846], length 1428
10:54:01.916129 IP 112.26.0.8.47540 > 112.26.0.1.37753: Flags [.], ack 925157, win 24289, options [nop,nop,TS val 4294951809 ecr 195580,nop,nop,sack 2 {942293:943721}{939437:940865},mptcp dss ack 3916128246], length 0
10:54:01.921706 IP 112.26.0.8.47540 > 112.26.0.1.37753: Flags [.], ack 925157, win 24289, options [nop,nop,TS val 4294951809 ecr 195580,nop,nop,sack 2 {942293:943721}{939437:940865},mptcp dss ack 3916128246], length 0
10:54:02.052050 IP 112.26.0.1.37753 > 112.26.0.8.47540: Flags [.], seq 945149:946577, ack 1, win 893, options [nop,nop,TS val 196952 ecr 4294950177,mptcp dss ack 2295998090 seq 3916193934 subseq 945149 len 1428 csum 0xa2a6], length 1428
10:54:02.052477 IP 112.26.0.8.47540 > 112.26.0.1.37753: Flags [.], ack 925157, win 24289, options [nop,nop,TS val 4294951945 ecr 195580,nop,nop,sack 2 {945149:946577}{942293:943721},mptcp dss ack 3916128246], length 0
10:54:02.074795 IP 112.26.0.8.47540 > 112.26.0.1.37753: Flags [.], ack 925157, win 24289, options [nop,nop,TS val 4294951945 ecr 195580,nop,nop,sack 2 {945149:946577}{942293:943721},mptcp dss ack 3916128246], length 0
10:54:02.184110 IP 112.26.0.1.37753 > 112.26.0.8.47540: Flags [.], seq 946577:948005, ack 1, win 893, options [nop,nop,TS val 196952 ecr 4294950177,mptcp dss ack 2295998090 seq 3916195362 subseq 946577 len 1428 csum 0x7c4b], length 1428
10:54:02.184480 IP 112.26.0.8.47540 > 112.26.0.1.37753: Flags [.], ack 925157, win 24289, options [nop,nop,TS val 4294952078 ecr 195580,nop,nop,sack 2 {945149:948005}{942293:943721},mptcp dss ack 3916128246], length 0
10:54:02.187223 IP 112.26.0.8.47540 > 112.26.0.1.37753: Flags [.], ack 925157, win 24289, options [nop,nop,TS val 4294952078 ecr 195580,nop,nop,sack 2 {945149:948005}{942293:943721},mptcp dss ack 3916128246], length 0
10:54:02.300037 IP 112.26.0.1.37753 > 112.26.0.8.47540: Flags [.], seq 948005:949433, ack 1, win 893, options [nop,nop,TS val 197181 ecr 4294950417,mptcp dss ack 2295998090 seq 3916206786 subseq 948005 len 1428 csum 0x908e], length 1428
10:54:02.300337 IP 112.26.0.8.47540 > 112.26.0.1.37753: Flags [.], ack 925157, win 24289, options [nop,nop,TS val 4294952194 ecr 195580,nop,nop,sack 2 {945149:949433}{942293:943721},mptcp dss ack 3916128246], length 0
10:54:02.303583 IP 112.26.0.8.47540 > 112.26.0.1.37753: Flags [.], ack 925157, win 24289, options [nop,nop,TS val 4294952194 ecr 195580,nop,nop,sack 2 {945149:949433}{942293:943721},mptcp dss ack 3916128246], length 0
10:54:02.424233 IP 112.26.0.1.37753 > 112.26.0.8.47540: Flags [.], seq 952289:953717, ack 1, win 893, options [nop,nop,TS val 197427 ecr 4294950662,mptcp dss ack 2295998090 seq 3916221066 subseq 952289 len 1428 csum 0x315a], length 1428
10:54:02.424610 IP 112.26.0.8.47540 > 112.26.0.1.37753: Flags [.], ack 925157, win 24289, options [nop,nop,TS val 4294952318 ecr 195580,nop,nop,sack 2 {952289:953717}{945149:949433},mptcp dss ack 3916128246], length 0
10:54:02.465163 IP 112.26.0.8.47540 > 112.26.0.1.37753: Flags [.], ack 925157, win 24289, options [nop,nop,TS val 4294952318 ecr 195580,nop,nop,sack 2 {952289:953717}{945149:949433},mptcp dss ack 3916128246], length 0
10:54:02.535616 IP 112.26.0.1.37753 > 112.26.0.8.47540: Flags [.], seq 953717:955145, ack 1, win 893, options [nop,nop,TS val 197427 ecr 4294950662,mptcp dss ack 2295998090 seq 3916222494 subseq 953717 len 1428 csum 0xeb3d], length 1428
10:54:02.535950 IP 112.26.0.8.47540 > 112.26.0.1.37753: Flags [.], ack 925157, win 24289, options [nop,nop,TS val 4294952429 ecr 195580,nop,nop,sack 2 {952289:955145}{945149:949433},mptcp dss ack 3916128246], length 0
10:54:02.539892 IP 112.26.0.8.47540 > 112.26.0.1.37753: Flags [.], ack 925157, win 24289, options [nop,nop,TS val 4294952429 ecr 195580,nop,nop,sack 2 {952289:955145}{945149:949433},mptcp dss ack 3916128246], length 0
10:54:02.676268 IP 112.26.0.1.37753 > 112.26.0.8.47540: Flags [.], seq 925157:926585, ack 1, win 893, options [nop,nop,TS val 197697 ecr 4294950898,mptcp dss ack 2295998090 seq 3916128246 subseq 925157 len 1428 csum 0x57c7], length 1428
10:54:02.676679 IP 112.26.0.8.47540 > 112.26.0.1.37753: Flags [.], ack 935153, win 23509, options [nop,nop,TS val 4294952570 ecr 197697,nop,nop,sack 2 {952289:955145}{945149:949433},mptcp dss ack 3916178226], length 0
10:54:02.696822 IP 112.26.0.8.47540 > 112.26.0.1.37753: Flags [.], ack 935153, win 23509, options [nop,nop,TS val 4294952570 ecr 197697,nop,nop,sack 2 {952289:955145}{945149:949433},mptcp dss ack 3916178226], length 0
10:54:02.829953 IP 112.26.0.1.37753 > 112.26.0.8.47540: Flags [.], seq 956573:958001, ack 1, win 893, options [nop,nop,TS val 197914 ecr 4294951021,mptcp dss ack 2295998090 seq 3916246770 subseq 956573 len 1428 csum 0xaa14], length 1428
10:54:02.830293 IP 112.26.0.8.47540 > 112.26.0.1.37753: Flags [.], ack 935153, win 23976, options [nop,nop,TS val 4294952723 ecr 197697,nop,nop,sack 2 {956573:958001}{952289:955145},mptcp dss ack 3916178226], length 0
10:54:02.834252 IP 112.26.0.8.47540 > 112.26.0.1.37753: Flags [.], ack 935153, win 23976, options [nop,nop,TS val 4294952723 ecr 197697,nop,nop,sack 2 {956573:958001}{952289:955145},mptcp dss ack 3916178226], length 0
10:54:02.966097 IP 112.26.0.1.37753 > 112.26.0.8.47540: Flags [.], seq 935153:936581, ack 1, win 893, options [nop,nop,TS val 198288 ecr 4294951467,mptcp dss ack 2295998090 seq 3916178226 subseq 935153 len 1428 csum 0xed6e], length 1428
10:54:02.966466 IP 112.26.0.8.47540 > 112.26.0.1.37753: Flags [.], ack 938009, win 23932, options [nop,nop,TS val 4294952859 ecr 198288,nop,nop,sack 2 {956573:958001}{952289:955145},mptcp dss ack 3916181082], length 0
10:54:02.972894 IP 112.26.0.8.47540 > 112.26.0.1.37753: Flags [.], ack 938009, win 23932, options [nop,nop,TS val 4294952859 ecr 198288,nop,nop,sack 2 {956573:958001}{952289:955145},mptcp dss ack 3916181082], length 0
10:54:03.069213 IP 112.26.0.1.37753 > 112.26.0.8.47540: Flags [.], seq 938009:939437, ack 1, win 893, options [nop,nop,TS val 198429 ecr 4294951606,mptcp dss ack 2295998090 seq 3916181082 subseq 938009 len 1428 csum 0xed3], length 1428
10:54:03.069618 IP 112.26.0.8.47540 > 112.26.0.1.37753: Flags [.], ack 940865, win 23888, options [nop,nop,TS val 4294952963 ecr 198429,nop,nop,sack 2 {956573:958001}{952289:955145},mptcp dss ack 3916183938], length 0
10:54:03.109284 IP 112.26.0.8.47540 > 112.26.0.1.37753: Flags [.], ack 940865, win 23888, options [nop,nop,TS val 4294952963 ecr 198429,nop,nop,sack 2 {956573:958001}{952289:955145},mptcp dss ack 3916183938], length 0
10:54:03.207659 IP 112.26.0.1.37753 > 112.26.0.8.47540: Flags [.], seq 940865:942293, ack 1, win 893, options [nop,nop,TS val 198718 ecr 4294951945,mptcp dss ack 2295998090 seq 3916183938 subseq 940865 len 1428 csum 0xe38f], length 1428
10:54:03.208065 IP 112.26.0.8.47540 > 112.26.0.1.37753: Flags [.], ack 943721, win 23790, options [nop,nop,TS val 4294953101 ecr 198718,nop,nop,sack 2 {956573:958001}{952289:955145},mptcp dss ack 3916192506], length 0
10:54:03.214208 IP 112.26.0.8.47540 > 112.26.0.1.37753: Flags [.], ack 943721, win 23790, options [nop,nop,TS val 4294953101 ecr 198718,nop,nop,sack 2 {956573:958001}{952289:955145},mptcp dss ack 3916192506], length 0
10:54:03.373324 IP 112.26.0.1.37753 > 112.26.0.8.47540: Flags [.], seq 959429:960857, ack 1, win 893, options [nop,nop,TS val 198963 ecr 4294952194,mptcp dss ack 2295998090 seq 3916276758 subseq 959429 len 1428 csum 0xc7d], length 1428
10:54:03.373702 IP 112.26.0.8.47540 > 112.26.0.1.37753: Flags [.], ack 943721, win 23886, options [nop,nop,TS val 4294953267 ecr 198718,nop,nop,sack 2 {959429:960857}{956573:958001},mptcp dss ack 3916192506], length 0
10:54:03.393411 IP 112.26.0.8.47540 > 112.26.0.1.37753: Flags [.], ack 943721, win 23886, options [nop,nop,TS val 4294953267 ecr 198718,nop,nop,sack 2 {959429:960857}{956573:958001},mptcp dss ack 3916192506], length 0
10:54:03.516232 IP 112.26.0.1.37753 > 112.26.0.8.47540: Flags [.], seq 949433:950861, ack 1, win 893, options [nop,nop,TS val 199108 ecr 4294952318,mptcp dss ack 2295998090 seq 3916208214 subseq 949433 len 1428 csum 0xa2ca], length 1428
10:54:03.516669 IP 112.26.0.8.47540 > 112.26.0.1.37753: Flags [.], ack 943721, win 23886, options [nop,nop,TS val 4294953409 ecr 198718,nop,nop,sack 2 {945149:950861}{959429:960857},mptcp dss ack 3916192506], length 0
10:54:03.539498 IP 112.26.0.8.47540 > 112.26.0.1.37753: Flags [.], ack 943721, win 23886, options [nop,nop,TS val 4294953409 ecr 198718,nop,nop,sack 2 {945149:950861}{959429:960857},mptcp dss ack 3916192506], length 0
10:54:03.624997 IP 112.26.0.1.37753 > 112.26.0.8.47540: Flags [.], seq 950861:952289, ack 1, win 893, options [nop,nop,TS val 199214 ecr 4294952429,mptcp dss ack 2295998090 seq 3916209642 subseq 950861 len 1428 csum 0x840d], length 1428
10:54:03.625300 IP 112.26.0.8.47540 > 112.26.0.1.37753: Flags [.], ack 943721, win 23886, options [nop,nop,TS val 4294953518 ecr 198718,nop,nop,sack 2 {945149:955145}{959429:960857},mptcp dss ack 3916192506], length 0
10:54:03.671314 IP 112.26.0.8.47540 > 112.26.0.1.37753: Flags [.], ack 943721, win 23886, options [nop,nop,TS val 4294953518 ecr 198718,nop,nop,sack 2 {945149:955145}{959429:960857},mptcp dss ack 3916192506], length 0
10:54:03.731414 IP 112.26.0.1.37753 > 112.26.0.8.47540: Flags [.], seq 955145:956573, ack 1, win 893, options [nop,nop,TS val 199341 ecr 4294952570,mptcp dss ack 2295998090 seq 3916235346 subseq 955145 len 1428 csum 0x3b63], length 1428
10:54:03.731771 IP 112.26.0.8.47540 > 112.26.0.1.37753: Flags [.], ack 943721, win 23886, options [nop,nop,TS val 4294953624 ecr 198718,nop,nop,sack 2 {945149:958001}{959429:960857},mptcp dss ack 3916192506], length 0
10:54:03.829982 IP 112.26.0.1.37753 > 112.26.0.8.47540: Flags [.], seq 962285:963713, ack 1, win 893, options [nop,nop,TS val 199341 ecr 4294952570,mptcp dss ack 2295998090 seq 3916296750 subseq 962285 len 1428 csum 0xf649], length 1428
10:54:03.830327 IP 112.26.0.8.47540 > 112.26.0.1.37753: Flags [.], ack 943721, win 23886, options [nop,nop,TS val 4294953724 ecr 198718,nop,nop,sack 2 {962285:963713}{945149:958001},mptcp dss ack 3916192506], length 0
10:54:03.857171 IP 112.26.0.8.47540 > 112.26.0.1.37753: Flags [.], ack 943721, win 23886, options [nop,nop,TS val 4294953624 ecr 198718,nop,nop,sack 2 {945149:958001}{959429:960857},mptcp dss ack 3916192506], length 0
10:54:03.947209 IP 112.26.0.1.37753 > 112.26.0.8.47540: Flags [.], seq 963713:965141, ack 1, win 893, options [nop,nop,TS val 199341 ecr 4294952570,mptcp dss ack 2295998090 seq 3916298178 subseq 963713 len 1428 csum 0x7dae], length 1428
10:54:03.947508 IP 112.26.0.8.47540 > 112.26.0.1.37753: Flags [.], ack 943721, win 23886, options [nop,nop,TS val 4294953841 ecr 198718,nop,nop,sack 2 {962285:965141}{945149:958001},mptcp dss ack 3916192506], length 0
10:54:03.973724 IP 112.26.0.8.47540 > 112.26.0.1.37753: Flags [.], ack 943721, win 23886, options [nop,nop,TS val 4294953724 ecr 198718,nop,nop,sack 2 {962285:963713}{945149:958001},mptcp dss ack 3916192506], length 0
10:54:04.096206 IP 112.26.0.8.47540 > 112.26.0.1.37753: Flags [.], ack 943721, win 23886, options [nop,nop,TS val 4294953841 ecr 198718,nop,nop,sack 2 {962285:965141}{945149:958001},mptcp dss ack 3916192506], length 0
10:54:04.126771 IP 112.26.0.1.37753 > 112.26.0.8.47540: Flags [.], seq 965141:966569, ack 1, win 893, options [nop,nop,TS val 199512 ecr 4294952723,mptcp dss ack 2295998090 seq 3916302462 subseq 965141 len 1428 csum 0x3ff3], length 1428
10:54:04.127131 IP 112.26.0.8.47540 > 112.26.0.1.37753: Flags [.], ack 943721, win 23886, options [nop,nop,TS val 4294954020 ecr 198718,nop,nop,sack 2 {962285:966569}{945149:958001},mptcp dss ack 3916192506], length 0
10:54:04.166748 IP 112.26.0.8.47540 > 112.26.0.1.37753: Flags [.], ack 943721, win 23886, options [nop,nop,TS val 4294954020 ecr 198718,nop,nop,sack 2 {962285:966569}{945149:958001},mptcp dss ack 3916192506], length 0
10:54:04.264545 IP 112.26.0.1.37753 > 112.26.0.8.47540: Flags [.], seq 967997:969425, ack 1, win 893, options [nop,nop,TS val 199752 ecr 4294952963,mptcp dss ack 2295998090 seq 3916316742 subseq 967997 len 1428 csum 0xe0d2], length 1428
10:54:04.264888 IP 112.26.0.8.47540 > 112.26.0.1.37753: Flags [.], ack 943721, win 23886, options [nop,nop,TS val 4294954158 ecr 198718,nop,nop,sack 2 {967997:969425}{962285:966569},mptcp dss ack 3916192506], length 0
10:54:04.298471 IP 112.26.0.8.47540 > 112.26.0.1.37753: Flags [.], ack 943721, win 23886, options [nop,nop,TS val 4294954158 ecr 198718,nop,nop,sack 2 {967997:969425}{962285:966569},mptcp dss ack 3916192506], length 0
10:54:04.356847 IP 112.26.0.1.37753 > 112.26.0.8.47540: Flags [.], seq 969425:970853, ack 1, win 893, options [nop,nop,TS val 199752 ecr 4294952963,mptcp dss ack 2295998090 seq 3916318170 subseq 969425 len 1428 csum 0xc9ca], length 1428
10:54:04.357033 IP 112.26.0.8.47540 > 112.26.0.1.37753: Flags [.], ack 943721, win 23886, options [nop,nop,TS val 4294954250 ecr 198718,nop,nop,sack 2 {967997:970853}{962285:966569},mptcp dss ack 3916192506], length 0
10:54:04.381293 IP 112.26.0.8.47540 > 112.26.0.1.37753: Flags [.], ack 943721, win 23886, options [nop,nop,TS val 4294954250 ecr 198718,nop,nop,sack 2 {967997:970853}{962285:966569},mptcp dss ack 3916192506], length 0
10:54:04.524791 IP 112.26.0.1.37753 > 112.26.0.8.47540: Flags [.], seq 970853:972281, ack 1, win 893, options [nop,nop,TS val 199874 ecr 4294953101,mptcp dss ack 2295998090 seq 3916323882 subseq 970853 len 1428 csum 0x6de5], length 1428
10:54:04.525147 IP 112.26.0.8.47540 > 112.26.0.1.37753: Flags [.], ack 943721, win 23886, options [nop,nop,TS val 4294954418 ecr 198718,nop,nop,sack 2 {967997:972281}{962285:966569},mptcp dss ack 3916192506], length 0
10:54:04.528701 IP 112.26.0.8.47540 > 112.26.0.1.37753: Flags [.], ack 943721, win 23886, options [nop,nop,TS val 4294954418 ecr 198718,nop,nop,sack 2 {967997:972281}{962285:966569},mptcp dss ack 3916192506], length 0
10:54:04.641832 IP 112.26.0.1.37753 > 112.26.0.8.47540: Flags [.], seq 943721:945149, ack 1, win 893, options [nop,nop,TS val 200038 ecr 4294953267,mptcp dss ack 2295998090 seq 3916192506 subseq 943721 len 1428 csum 0x3f91], length 1428
10:54:04.642224 IP 112.26.0.8.47540 > 112.26.0.1.37753: Flags [.], ack 958001, win 23095, options [nop,nop,TS val 4294954535 ecr 200038,nop,nop,sack 2 {967997:972281}{962285:966569},mptcp dss ack 3916252482], length 0
10:54:04.650057 IP 112.26.0.8.47540 > 112.26.0.1.37753: Flags [.], ack 958001, win 23095, options [nop,nop,TS val 4294954535 ecr 200038,nop,nop,sack 2 {967997:972281}{962285:966569},mptcp dss ack 3916252482], length 0
10:54:04.758926 IP 112.26.0.1.37753 > 112.26.0.8.47540: Flags [.], seq 972281:973709, ack 1, win 893, options [nop,nop,TS val 200188 ecr 4294953409,mptcp dss ack 2295998090 seq 3916339590 subseq 972281 len 1428 csum 0x5d54], length 1428
10:54:04.759239 IP 112.26.0.8.47540 > 112.26.0.1.37753: Flags [.], ack 958001, win 23736, options [nop,nop,TS val 4294954653 ecr 200038,nop,nop,sack 2 {967997:973709}{962285:966569},mptcp dss ack 3916252482], length 0
10:54:04.768591 IP 112.26.0.8.47540 > 112.26.0.1.37753: Flags [.], ack 958001, win 23736, options [nop,nop,TS val 4294954653 ecr 200038,nop,nop,sack 2 {967997:973709}{962285:966569},mptcp dss ack 3916252482], length 0
10:54:04.849098 IP 112.26.0.1.37753 > 112.26.0.8.47540: Flags [.], seq 973709:975137, ack 1, win 893, options [nop,nop,TS val 200340 ecr 4294953518,mptcp dss ack 2295998090 seq 3916348158 subseq 973709 len 1428 csum 0x66a3], length 1428
10:54:04.849385 IP 112.26.0.8.47540 > 112.26.0.1.37753: Flags [.], ack 958001, win 23736, options [nop,nop,TS val 4294954743 ecr 200038,nop,nop,sack 2 {967997:975137}{962285:966569},mptcp dss ack 3916252482], length 0
10:54:04.914859 IP 112.26.0.8.47540 > 112.26.0.1.37753: Flags [.], ack 958001, win 23736, options [nop,nop,TS val 4294954743 ecr 200038,nop,nop,sack 2 {967997:975137}{962285:966569},mptcp dss ack 3916252482], length 0
10:54:04.941396 IP 112.26.0.1.37753 > 112.26.0.8.47540: Flags [.], seq 975137:976565, ack 1, win 893, options [nop,nop,TS val 200620 ecr 4294953624,mptcp dss ack 2295998090 seq 3916355298 subseq 975137 len 1428 csum 0x452f], length 1428
10:54:04.941767 IP 112.26.0.8.47540 > 112.26.0.1.37753: Flags [.], ack 958001, win 23736, options [nop,nop,TS val 4294954835 ecr 200038,nop,nop,sack 2 {967997:976565}{962285:966569},mptcp dss ack 3916252482], length 0
10:54:05.004953 IP 112.26.0.8.47540 > 112.26.0.1.37753: Flags [.], ack 958001, win 23736, options [nop,nop,TS val 4294954835 ecr 200038,nop,nop,sack 2 {967997:976565}{962285:966569},mptcp dss ack 3916252482], length 0
10:54:05.050952 IP 112.26.0.1.37753 > 112.26.0.8.47540: Flags [.], seq 976565:977993, ack 1, win 893, options [nop,nop,TS val 200758 ecr 4294953841,mptcp dss ack 2295998090 seq 3916362438 subseq 976565 len 1428 csum 0x4ea9], length 1428
10:54:05.051357 IP 112.26.0.8.47540 > 112.26.0.1.37753: Flags [.], ack 958001, win 23736, options [nop,nop,TS val 4294954945 ecr 200038,nop,nop,sack 2 {967997:977993}{962285:966569},mptcp dss ack 3916252482], length 0
10:54:05.108604 IP 112.26.0.8.47540 > 112.26.0.1.37753: Flags [.], ack 958001, win 23736, options [nop,nop,TS val 4294954945 ecr 200038,nop,nop,sack 2 {967997:977993}{962285:966569},mptcp dss ack 3916252482], length 0
10:54:05.137666 IP 112.26.0.1.37753 > 112.26.0.8.47540: Flags [.], seq 977993:979421, ack 1, win 893, options [nop,nop,TS val 200941 ecr 4294954020,mptcp dss ack 2295998090 seq 3916372434 subseq 977993 len 1428 csum 0xcb7e], length 1428
10:54:05.138017 IP 112.26.0.8.47540 > 112.26.0.1.37753: Flags [.], ack 958001, win 23736, options [nop,nop,TS val 4294955031 ecr 200038,nop,nop,sack 2 {967997:979421}{962285:966569},mptcp dss ack 3916252482], length 0
10:54:05.237185 IP 112.26.0.8.47540 > 112.26.0.1.37753: Flags [.], ack 958001, win 23736, options [nop,nop,TS val 4294955031 ecr 200038,nop,nop,sack 2 {967997:979421}{962285:966569},mptcp dss ack 3916252482], length 0
10:54:05.266627 IP 112.26.0.1.37753 > 112.26.0.8.47540: Flags [.], seq 958001:959429, ack 1, win 893, options [nop,nop,TS val 200941 ecr 4294954158,mptcp dss ack 2295998090 seq 3916252482 subseq 958001 len 1428 csum 0xde09], length 1428
10:54:05.267001 IP 112.26.0.8.47540 > 112.26.0.1.37753: Flags [.], ack 960857, win 23550, options [nop,nop,TS val 4294955160 ecr 200941,nop,nop,sack 2 {967997:979421}{962285:966569},mptcp dss ack 3916295322], length 0
10:54:05.362014 IP 112.26.0.1.37753 > 112.26.0.8.47540: Flags [.], seq 966569:967997, ack 1, win 893, options [nop,nop,TS val 201118 ecr 4294954250,mptcp dss ack 2295998090 seq 3916311030 subseq 966569 len 1428 csum 0xd2b7], length 1428
10:54:05.362368 IP 112.26.0.8.47540 > 112.26.0.1.37753: Flags [.], ack 960857, win 24004, options [nop,nop,TS val 4294955255 ecr 200941,nop,nop,sack 1 {962285:979421},mptcp dss ack 3916295322], length 0
10:54:05.375354 IP 112.26.0.8.47540 > 112.26.0.1.37753: Flags [.], ack 960857, win 23550, options [nop,nop,TS val 4294955160 ecr 200941,nop,nop,sack 2 {967997:979421}{962285:966569},mptcp dss ack 3916295322], length 0
10:54:05.446558 IP 112.26.0.8.47540 > 112.26.0.1.37753: Flags [.], ack 960857, win 24004, options [nop,nop,TS val 4294955255 ecr 200941,nop,nop,sack 1 {962285:979421},mptcp dss ack 3916295322], length 0
10:54:05.463534 IP 112.26.0.1.37753 > 112.26.0.8.47540: Flags [.], seq 979421:980849, ack 1, win 893, options [nop,nop,TS val 201207 ecr 4294954418,mptcp dss ack 2295998090 seq 3916382430 subseq 979421 len 1428 csum 0xcc5e], length 1428
10:54:05.463919 IP 112.26.0.8.47540 > 112.26.0.1.37753: Flags [.], ack 960857, win 24004, options [nop,nop,TS val 4294955357 ecr 200941,nop,nop,sack 1 {962285:980849},mptcp dss ack 3916295322], length 0
10:54:05.523817 IP 112.26.0.1.37753 > 112.26.0.8.47540: Flags [.], seq 980849:982277, ack 1, win 893, options [nop,nop,TS val 201293 ecr 4294954535,mptcp dss ack 2295998090 seq 3916386714 subseq 980849 len 1428 csum 0xc9bb], length 1428
10:54:05.524178 IP 112.26.0.8.47540 > 112.26.0.1.37753: Flags [.], ack 960857, win 24004, options [nop,nop,TS val 4294955417 ecr 200941,nop,nop,sack 1 {962285:982277},mptcp dss ack 3916295322], length 0
10:54:05.536903 IP 112.26.0.8.47540 > 112.26.0.1.37753: Flags [.], ack 960857, win 24004, options [nop,nop,TS val 4294955357 ecr 200941,nop,nop,sack 1 {962285:980849},mptcp dss ack 3916295322], length 0
10:54:05.613043 IP 112.26.0.1.37753 > 112.26.0.8.47540: Flags [.], seq 960857:962285, ack 1, win 893, options [nop,nop,TS val 201753 ecr 4294954945,mptcp dss ack 2295998090 seq 3916295322 subseq 960857 len 1428 csum 0xb517], length 1428
10:54:05.613422 IP 112.26.0.8.47540 > 112.26.0.1.37753: Flags [.], ack 982277, win 23632, options [nop,nop,TS val 4294955507 ecr 201753,mptcp dss ack 3916335306], length 0
10:54:05.633395 IP 112.26.0.8.47540 > 112.26.0.1.37753: Flags [.], ack 960857, win 24004, options [nop,nop,TS val 4294955417 ecr 200941,nop,nop,sack 1 {962285:982277},mptcp dss ack 3916295322], length 0
10:54:05.687780 IP 112.26.0.8.47540 > 112.26.0.1.37753: Flags [.], ack 982277, win 23632, options [nop,nop,TS val 4294955507 ecr 201753,mptcp dss ack 3916335306], length 0
10:54:05.757742 IP 112.26.0.1.37753 > 112.26.0.8.47540: Flags [F.], seq 982277, ack 1, win 893, options [nop,nop,TS val 202385 ecr 4294955507,mptcp dss ack 2295998090], length 0
10:54:05.798116 IP 112.26.0.8.47540 > 112.26.0.1.37753: Flags [.], ack 982278, win 24576, options [nop,nop,TS val 4294955692 ecr 202385,mptcp dss ack 3916393019], length 0
10:54:05.803237 IP 112.26.0.8.47540 > 112.26.0.1.37753: Flags [.], ack 982278, win 24576, options [nop,nop,TS val 4294955692 ecr 202385,mptcp dss ack 3916393019], length 0
10:54:05.886655 IP 112.26.0.8.47540 > 112.26.0.1.37753: Flags [F.], seq 1, ack 982278, win 24576, options [nop,nop,TS val 4294955779 ecr 202385,mptcp dss ack 3916393019], length 0
10:54:05.946025 IP 112.26.0.8.47540 > 112.26.0.1.37753: Flags [F.], seq 1, ack 982278, win 24576, options [nop,nop,TS val 4294955779 ecr 202385,mptcp dss ack 3916393019], length 0
10:54:05.965020 IP 112.26.0.1.37753 > 112.26.0.8.47540: Flags [.], ack 2, win 893, options [nop,nop,TS val 202590 ecr 4294955779,mptcp dss ack 2295998091], length 0

