10:52:44.097937 IP 112.26.3.8.41425 > 112.26.3.1.37753: Flags [S], seq 2395078999, win 65535, options [mss 1460,sackOK,TS val 4294873967 ecr 0,nop,wscale 6,mptcp join id 5 token 0xd15e4cde nonce 0x2a8bb6e7], length 0
10:52:44.144617 IP 112.26.3.8.41425 > 112.26.3.1.37753: Flags [S], seq 2395078999, win 65535, options [mss 1460,sackOK,TS val 4294873967 ecr 0,nop,wscale 6,mptcp join id 5 token 0xd15e4cde nonce 0x2a8bb6e7], length 0
10:52:44.206260 IP 112.26.3.8.41425 > 112.26.3.1.37753: Flags [S], seq 2395078999, win 65535, options [mss 1460,sackOK,TS val 4294873967 ecr 0,nop,wscale 6,mptcp join id 5 token 0xd15e4cde nonce 0x2a8bb6e7], length 0
10:52:44.545959 IP 112.26.3.8.41425 > 112.26.3.1.37753: Flags [.], ack 2893757764, win 7027, options [nop,nop,TS val 4294874346 ecr 120848,mptcp join hmac 0x8ee215a13a2dbfbe7ea6ce9b5e39c59ddf8153af], length 0
10:52:44.591602 IP 112.26.3.8.41425 > 112.26.3.1.37753: Flags [.], ack 1, win 7027, options [nop,nop,TS val 4294874346 ecr 120848,mptcp join hmac 0x8ee215a13a2dbfbe7ea6ce9b5e39c59ddf8153af], length 0
10:52:44.593539 IP 112.26.3.8.41425 > 112.26.3.1.37753: Flags [.], ack 1, win 7027, options [nop,nop,TS val 4294874346 ecr 120848,mptcp join hmac 0x8ee215a13a2dbfbe7ea6ce9b5e39c59ddf8153af], length 0
10:52:44.790611 IP 112.26.3.8.41425 > 112.26.3.1.37753: Flags [.], ack 1429, win 7255, options [nop,nop,TS val 4294874682 ecr 121235,mptcp dss ack 3912793866], length 0
10:53:19.852965 IP 112.26.3.8.41425 > 112.26.3.1.37753: Flags [.], ack 374137, win 24467, options [nop,nop,TS val 4294909744 ecr 156012,nop,nop,sack 1 {375565:381277},mptcp dss ack 3914213298], length 0
10:53:19.892308 IP 112.26.3.8.41425 > 112.26.3.1.37753: Flags [.], ack 374137, win 24467, options [nop,nop,TS val 4294909744 ecr 156012,nop,nop,sack 1 {375565:381277},mptcp dss ack 3914213298], length 0
10:53:19.894003 IP 112.26.3.8.41425 > 112.26.3.1.37753: Flags [.], ack 374137, win 24467, options [nop,nop,TS val 4294909744 ecr 156012,nop,nop,sack 1 {375565:381277},mptcp dss ack 3914213298], length 0
10:53:19.980330 IP 112.26.3.8.41425 > 112.26.3.1.37753: Flags [.], ack 381277, win 24467, options [nop,nop,TS val 4294909862 ecr 156122,mptcp dss ack 3914213298], length 0
10:53:20.009139 IP 112.26.3.8.41425 > 112.26.3.1.37753: Flags [.], ack 381277, win 24467, options [nop,nop,TS val 4294909862 ecr 156122,mptcp dss ack 3914213298], length 0
10:53:20.010906 IP 112.26.3.8.41425 > 112.26.3.1.37753: Flags [.], ack 381277, win 24467, options [nop,nop,TS val 4294909862 ecr 156122,mptcp dss ack 3914213298], length 0
10:53:20.111588 IP 112.26.3.8.41425 > 112.26.3.1.37753: Flags [.], ack 382705, win 24467, options [nop,nop,TS val 4294910003 ecr 156287,mptcp dss ack 3914213298], length 0
10:53:20.137238 IP 112.26.3.8.41425 > 112.26.3.1.37753: Flags [.], ack 382705, win 24467, options [nop,nop,TS val 4294910003 ecr 156287,mptcp dss ack 3914213298], length 0
10:53:20.138791 IP 112.26.3.8.41425 > 112.26.3.1.37753: Flags [.], ack 382705, win 24467, options [nop,nop,TS val 4294910003 ecr 156287,mptcp dss ack 3914213298], length 0
10:53:20.268173 IP 112.26.3.8.41425 > 112.26.3.1.37753: Flags [.], ack 384133, win 24467, options [nop,nop,TS val 4294910160 ecr 156404,mptcp dss ack 3914213298], length 0
10:53:20.275338 IP 112.26.3.8.41425 > 112.26.3.1.37753: Flags [.], ack 384133, win 24467, options [nop,nop,TS val 4294910160 ecr 156404,mptcp dss ack 3914213298], length 0
10:53:20.287618 IP 112.26.3.8.41425 > 112.26.3.1.37753: Flags [.], ack 384133, win 24467, options [nop,nop,TS val 4294910160 ecr 156404,mptcp dss ack 3914213298], length 0
10:53:20.378668 IP 112.26.3.8.41425 > 112.26.3.1.37753: Flags [.], ack 385561, win 24467, options [nop,nop,TS val 4294910263 ecr 156536,mptcp dss ack 3914213298], length 0
10:53:20.393657 IP 112.26.3.8.41425 > 112.26.3.1.37753: Flags [.], ack 385561, win 24467, options [nop,nop,TS val 4294910263 ecr 156536,mptcp dss ack 3914213298], length 0
10:53:20.399640 IP 112.26.3.8.41425 > 112.26.3.1.37753: Flags [.], ack 385561, win 24467, options [nop,nop,TS val 4294910263 ecr 156536,mptcp dss ack 3914213298], length 0
10:53:20.491584 IP 112.26.3.8.41425 > 112.26.3.1.37753: Flags [.], ack 386989, win 24267, options [nop,nop,TS val 4294910384 ecr 156652,mptcp dss ack 3914226150], length 0
10:53:20.507943 IP 112.26.3.8.41425 > 112.26.3.1.37753: Flags [.], ack 386989, win 24267, options [nop,nop,TS val 4294910384 ecr 156652,mptcp dss ack 3914226150], length 0
10:53:20.510112 IP 112.26.3.8.41425 > 112.26.3.1.37753: Flags [.], ack 386989, win 24267, options [nop,nop,TS val 4294910384 ecr 156652,mptcp dss ack 3914226150], length 0
10:53:20.597295 IP 112.26.3.8.41425 > 112.26.3.1.37753: Flags [.], ack 388417, win 24267, options [nop,nop,TS val 4294910489 ecr 156780,mptcp dss ack 3914226150], length 0
10:53:20.601782 IP 112.26.3.8.41425 > 112.26.3.1.37753: Flags [.], ack 388417, win 24267, options [nop,nop,TS val 4294910489 ecr 156780,mptcp dss ack 3914226150], length 0
10:53:20.604941 IP 112.26.3.8.41425 > 112.26.3.1.37753: Flags [.], ack 388417, win 24267, options [nop,nop,TS val 4294910489 ecr 156780,mptcp dss ack 3914226150], length 0
10:53:20.783910 IP 112.26.3.8.41425 > 112.26.3.1.37753: Flags [.], ack 389845, win 24267, options [nop,nop,TS val 4294910675 ecr 156919,mptcp dss ack 3914226150], length 0
10:53:20.794272 IP 112.26.3.8.41425 > 112.26.3.1.37753: Flags [.], ack 389845, win 24267, options [nop,nop,TS val 4294910675 ecr 156919,mptcp dss ack 3914226150], length 0
10:53:20.799286 IP 112.26.3.8.41425 > 112.26.3.1.37753: Flags [.], ack 389845, win 24267, options [nop,nop,TS val 4294910675 ecr 156919,mptcp dss ack 3914226150], length 0
10:53:20.914007 IP 112.26.3.8.41425 > 112.26.3.1.37753: Flags [.], ack 391273, win 24267, options [nop,nop,TS val 4294910806 ecr 157041,mptcp dss ack 3914226150], length 0
10:53:20.920675 IP 112.26.3.8.41425 > 112.26.3.1.37753: Flags [.], ack 391273, win 24267, options [nop,nop,TS val 4294910806 ecr 157041,mptcp dss ack 3914226150], length 0
10:53:20.922413 IP 112.26.3.8.41425 > 112.26.3.1.37753: Flags [.], ack 391273, win 24267, options [nop,nop,TS val 4294910806 ecr 157041,mptcp dss ack 3914226150], length 0
10:53:21.051978 IP 112.26.3.8.41425 > 112.26.3.1.37753: Flags [.], ack 392701, win 24267, options [nop,nop,TS val 4294910942 ecr 157041,mptcp dss ack 3914226150], length 0
10:53:21.055750 IP 112.26.3.8.41425 > 112.26.3.1.37753: Flags [.], ack 392701, win 24267, options [nop,nop,TS val 4294910942 ecr 157041,mptcp dss ack 3914226150], length 0
10:53:21.057664 IP 112.26.3.8.41425 > 112.26.3.1.37753: Flags [.], ack 392701, win 24267, options [nop,nop,TS val 4294910942 ecr 157041,mptcp dss ack 3914226150], length 0
10:53:21.175678 IP 112.26.3.8.41425 > 112.26.3.1.37753: Flags [.], ack 394129, win 24267, options [nop,nop,TS val 4294911067 ecr 157152,mptcp dss ack 3914226150], length 0
10:53:21.185344 IP 112.26.3.8.41425 > 112.26.3.1.37753: Flags [.], ack 394129, win 24267, options [nop,nop,TS val 4294911067 ecr 157152,mptcp dss ack 3914226150], length 0
10:53:21.187360 IP 112.26.3.8.41425 > 112.26.3.1.37753: Flags [.], ack 394129, win 24267, options [nop,nop,TS val 4294911067 ecr 157152,mptcp dss ack 3914226150], length 0
10:53:21.319543 IP 112.26.3.8.41425 > 112.26.3.1.37753: Flags [.], ack 395557, win 24267, options [nop,nop,TS val 4294911210 ecr 157247,mptcp dss ack 3914226150], length 0
10:53:21.335096 IP 112.26.3.8.41425 > 112.26.3.1.37753: Flags [.], ack 395557, win 24267, options [nop,nop,TS val 4294911210 ecr 157247,mptcp dss ack 3914226150], length 0
10:53:21.337788 IP 112.26.3.8.41425 > 112.26.3.1.37753: Flags [.], ack 395557, win 24267, options [nop,nop,TS val 4294911210 ecr 157247,mptcp dss ack 3914226150], length 0
10:53:21.454942 IP 112.26.3.8.41425 > 112.26.3.1.37753: Flags [.], ack 396985, win 24267, options [nop,nop,TS val 4294911347 ecr 157441,mptcp dss ack 3914226150], length 0
10:53:21.461772 IP 112.26.3.8.41425 > 112.26.3.1.37753: Flags [.], ack 396985, win 24267, options [nop,nop,TS val 4294911347 ecr 157441,mptcp dss ack 3914226150], length 0
10:53:21.463256 IP 112.26.3.8.41425 > 112.26.3.1.37753: Flags [.], ack 396985, win 24267, options [nop,nop,TS val 4294911347 ecr 157441,mptcp dss ack 3914226150], length 0
10:53:21.607665 IP 112.26.3.8.41425 > 112.26.3.1.37753: Flags [.], ack 398413, win 24267, options [nop,nop,TS val 4294911499 ecr 157566,mptcp dss ack 3914226150], length 0
10:53:21.612009 IP 112.26.3.8.41425 > 112.26.3.1.37753: Flags [.], ack 398413, win 24267, options [nop,nop,TS val 4294911499 ecr 157566,mptcp dss ack 3914226150], length 0
10:53:21.621079 IP 112.26.3.8.41425 > 112.26.3.1.37753: Flags [.], ack 398413, win 24267, options [nop,nop,TS val 4294911499 ecr 157566,mptcp dss ack 3914226150], length 0
10:53:21.730260 IP 112.26.3.8.41425 > 112.26.3.1.37753: Flags [.], ack 399841, win 24257, options [nop,nop,TS val 4294911622 ecr 157699,mptcp dss ack 3914317542], length 0
10:53:21.761771 IP 112.26.3.8.41425 > 112.26.3.1.37753: Flags [.], ack 399841, win 24257, options [nop,nop,TS val 4294911622 ecr 157699,mptcp dss ack 3914317542], length 0
10:53:21.771662 IP 112.26.3.8.41425 > 112.26.3.1.37753: Flags [.], ack 399841, win 24257, options [nop,nop,TS val 4294911622 ecr 157699,mptcp dss ack 3914317542], length 0
10:53:21.922245 IP 112.26.3.8.41425 > 112.26.3.1.37753: Flags [.], ack 401269, win 24525, options [nop,nop,TS val 4294911815 ecr 157829,mptcp dss ack 3914357526], length 0
10:53:21.929392 IP 112.26.3.8.41425 > 112.26.3.1.37753: Flags [.], ack 401269, win 24525, options [nop,nop,TS val 4294911815 ecr 157829,mptcp dss ack 3914357526], length 0
10:53:21.934905 IP 112.26.3.8.41425 > 112.26.3.1.37753: Flags [.], ack 401269, win 24525, options [nop,nop,TS val 4294911815 ecr 157829,mptcp dss ack 3914357526], length 0
10:53:22.059665 IP 112.26.3.8.41425 > 112.26.3.1.37753: Flags [.], ack 404125, win 24522, options [nop,nop,TS val 4294911950 ecr 157983,mptcp dss ack 3914363238], length 0
10:53:22.097364 IP 112.26.3.8.41425 > 112.26.3.1.37753: Flags [.], ack 404125, win 24522, options [nop,nop,TS val 4294911950 ecr 157983,mptcp dss ack 3914363238], length 0
10:53:22.100066 IP 112.26.3.8.41425 > 112.26.3.1.37753: Flags [.], ack 404125, win 24522, options [nop,nop,TS val 4294911950 ecr 157983,mptcp dss ack 3914363238], length 0
10:53:22.303016 IP 112.26.3.8.41425 > 112.26.3.1.37753: Flags [.], ack 406981, win 24473, options [nop,nop,TS val 4294912195 ecr 158256,mptcp dss ack 3914373234], length 0
10:53:22.309247 IP 112.26.3.8.41425 > 112.26.3.1.37753: Flags [.], ack 406981, win 24473, options [nop,nop,TS val 4294912195 ecr 158256,mptcp dss ack 3914373234], length 0
10:53:22.320957 IP 112.26.3.8.41425 > 112.26.3.1.37753: Flags [.], ack 406981, win 24473, options [nop,nop,TS val 4294912195 ecr 158256,mptcp dss ack 3914373234], length 0
10:53:22.532165 IP 112.26.3.8.41425 > 112.26.3.1.37753: Flags [.], ack 408409, win 24458, options [nop,nop,TS val 4294912424 ecr 158576,mptcp dss ack 3914381802], length 0
10:53:22.534881 IP 112.26.3.8.41425 > 112.26.3.1.37753: Flags [.], ack 408409, win 24458, options [nop,nop,TS val 4294912424 ecr 158576,mptcp dss ack 3914381802], length 0
10:53:22.542420 IP 112.26.3.8.41425 > 112.26.3.1.37753: Flags [.], ack 408409, win 24458, options [nop,nop,TS val 4294912424 ecr 158576,mptcp dss ack 3914381802], length 0
10:53:22.645228 IP 112.26.3.8.41425 > 112.26.3.1.37753: Flags [.], ack 408409, win 24458, options [nop,nop,TS val 4294912438 ecr 158576,nop,nop,sack 1 {409837:411265},mptcp dss ack 3914381802], length 0
10:53:22.658899 IP 112.26.3.8.41425 > 112.26.3.1.37753: Flags [.], ack 408409, win 24458, options [nop,nop,TS val 4294912438 ecr 158576,nop,nop,sack 1 {409837:411265},mptcp dss ack 3914381802], length 0
10:53:22.661791 IP 112.26.3.8.41425 > 112.26.3.1.37753: Flags [.], ack 408409, win 24458, options [nop,nop,TS val 4294912438 ecr 158576,nop,nop,sack 1 {409837:411265},mptcp dss ack 3914381802], length 0
10:53:22.755413 IP 112.26.3.8.41425 > 112.26.3.1.37753: Flags [.], ack 408409, win 24507, options [nop,nop,TS val 4294912527 ecr 158576,nop,nop,sack 1 {409837:412693},mptcp dss ack 3914388942], length 0
10:53:22.757578 IP 112.26.3.8.41425 > 112.26.3.1.37753: Flags [.], ack 408409, win 24507, options [nop,nop,TS val 4294912527 ecr 158576,nop,nop,sack 1 {409837:412693},mptcp dss ack 3914388942], length 0
10:53:22.803664 IP 112.26.3.8.41425 > 112.26.3.1.37753: Flags [.], ack 408409, win 24507, options [nop,nop,TS val 4294912527 ecr 158576,nop,nop,sack 1 {409837:412693},mptcp dss ack 3914388942], length 0
10:53:22.843684 IP 112.26.3.8.41425 > 112.26.3.1.37753: Flags [.], ack 408409, win 24507, options [nop,nop,TS val 4294912689 ecr 158576,nop,nop,sack 1 {409837:414121},mptcp dss ack 3914393226], length 0
10:53:22.895680 IP 112.26.3.8.41425 > 112.26.3.1.37753: Flags [.], ack 408409, win 24507, options [nop,nop,TS val 4294912689 ecr 158576,nop,nop,sack 1 {409837:414121},mptcp dss ack 3914393226], length 0
10:53:22.951430 IP 112.26.3.8.41425 > 112.26.3.1.37753: Flags [.], ack 408409, win 24507, options [nop,nop,TS val 4294912689 ecr 158576,nop,nop,sack 1 {409837:414121},mptcp dss ack 3914393226], length 0
10:53:22.958425 IP 112.26.3.8.41425 > 112.26.3.1.37753: Flags [.], ack 408409, win 24504, options [nop,nop,TS val 4294912813 ecr 158576,nop,nop,sack 1 {409837:415549},mptcp dss ack 3914398938], length 0
10:53:22.998374 IP 112.26.3.8.41425 > 112.26.3.1.37753: Flags [.], ack 408409, win 24504, options [nop,nop,TS val 4294912813 ecr 158576,nop,nop,sack 1 {409837:415549},mptcp dss ack 3914398938], length 0
10:53:23.037420 IP 112.26.3.8.41425 > 112.26.3.1.37753: Flags [.], ack 408409, win 24504, options [nop,nop,TS val 4294912813 ecr 158576,nop,nop,sack 1 {409837:415549},mptcp dss ack 3914398938], length 0
10:53:23.067900 IP 112.26.3.8.41425 > 112.26.3.1.37753: Flags [.], ack 408409, win 24504, options [nop,nop,TS val 4294912958 ecr 158576,nop,nop,sack 1 {409837:416977},mptcp dss ack 3914398938], length 0
10:53:23.081253 IP 112.26.3.8.41425 > 112.26.3.1.37753: Flags [.], ack 408409, win 24504, options [nop,nop,TS val 4294912958 ecr 158576,nop,nop,sack 1 {409837:416977},mptcp dss ack 3914398938], length 0
10:53:23.119290 IP 112.26.3.8.41425 > 112.26.3.1.37753: Flags [.], ack 408409, win 24504, options [nop,nop,TS val 4294912958 ecr 158576,nop,nop,sack 1 {409837:416977},mptcp dss ack 3914398938], length 0
10:53:23.170209 IP 112.26.3.8.41425 > 112.26.3.1.37753: Flags [.], ack 408409, win 24504, options [nop,nop,TS val 4294913051 ecr 158576,nop,nop,sack 1 {409837:418405},mptcp dss ack 3914398938], length 0
10:53:23.202703 IP 112.26.3.8.41425 > 112.26.3.1.37753: Flags [.], ack 408409, win 24504, options [nop,nop,TS val 4294913051 ecr 158576,nop,nop,sack 1 {409837:418405},mptcp dss ack 3914398938], length 0
10:53:23.204302 IP 112.26.3.8.41425 > 112.26.3.1.37753: Flags [.], ack 408409, win 24504, options [nop,nop,TS val 4294913051 ecr 158576,nop,nop,sack 1 {409837:418405},mptcp dss ack 3914398938], length 0
10:53:23.270197 IP 112.26.3.8.41425 > 112.26.3.1.37753: Flags [.], ack 408409, win 24504, options [nop,nop,TS val 4294913162 ecr 158576,nop,nop,sack 1 {409837:419833},mptcp dss ack 3914398938], length 0
10:53:23.360992 IP 112.26.3.8.41425 > 112.26.3.1.37753: Flags [.], ack 408409, win 24504, options [nop,nop,TS val 4294913162 ecr 158576,nop,nop,sack 1 {409837:419833},mptcp dss ack 3914398938], length 0
10:53:23.363346 IP 112.26.3.8.41425 > 112.26.3.1.37753: Flags [.], ack 408409, win 24504, options [nop,nop,TS val 4294913162 ecr 158576,nop,nop,sack 1 {409837:419833},mptcp dss ack 3914398938], length 0
10:53:23.376550 IP 112.26.3.8.41425 > 112.26.3.1.37753: Flags [.], ack 419833, win 24214, options [nop,nop,TS val 4294913268 ecr 159592,mptcp dss ack 3914417502], length 0
10:53:23.457070 IP 112.26.3.8.41425 > 112.26.3.1.37753: Flags [.], ack 419833, win 24214, options [nop,nop,TS val 4294913268 ecr 159592,mptcp dss ack 3914417502], length 0
10:53:23.483777 IP 112.26.3.8.41425 > 112.26.3.1.37753: Flags [.], ack 419833, win 24214, options [nop,nop,TS val 4294913268 ecr 159592,mptcp dss ack 3914417502], length 0
10:53:23.547761 IP 112.26.3.8.41425 > 112.26.3.1.37753: Flags [.], ack 421261, win 24455, options [nop,nop,TS val 4294913440 ecr 159770,mptcp dss ack 3914426070], length 0
10:53:23.616312 IP 112.26.3.8.41425 > 112.26.3.1.37753: Flags [.], ack 421261, win 24455, options [nop,nop,TS val 4294913440 ecr 159770,mptcp dss ack 3914426070], length 0
10:53:23.618372 IP 112.26.3.8.41425 > 112.26.3.1.37753: Flags [.], ack 421261, win 24455, options [nop,nop,TS val 4294913440 ecr 159770,mptcp dss ack 3914426070], length 0
10:53:23.647736 IP 112.26.3.8.41425 > 112.26.3.1.37753: Flags [.], ack 422689, win 24442, options [nop,nop,TS val 4294913539 ecr 159860,mptcp dss ack 3914430354], length 0
10:53:23.748650 IP 112.26.3.8.41425 > 112.26.3.1.37753: Flags [.], ack 424117, win 24440, options [nop,nop,TS val 4294913639 ecr 160085,mptcp dss ack 3914436066], length 0
10:53:23.753892 IP 112.26.3.8.41425 > 112.26.3.1.37753: Flags [.], ack 422689, win 24442, options [nop,nop,TS val 4294913539 ecr 159860,mptcp dss ack 3914430354], length 0
10:53:23.757291 IP 112.26.3.8.41425 > 112.26.3.1.37753: Flags [.], ack 422689, win 24442, options [nop,nop,TS val 4294913539 ecr 159860,mptcp dss ack 3914430354], length 0
10:53:23.829316 IP 112.26.3.8.41425 > 112.26.3.1.37753: Flags [.], ack 424117, win 24440, options [nop,nop,TS val 4294913639 ecr 160085,mptcp dss ack 3914436066], length 0
10:53:23.869794 IP 112.26.3.8.41425 > 112.26.3.1.37753: Flags [.], ack 424117, win 24440, options [nop,nop,TS val 4294913639 ecr 160085,mptcp dss ack 3914436066], length 0
10:53:23.888452 IP 112.26.3.8.41425 > 112.26.3.1.37753: Flags [.], ack 425545, win 24433, options [nop,nop,TS val 4294913779 ecr 160125,mptcp dss ack 3914441778], length 0
10:53:23.917417 IP 112.26.3.8.41425 > 112.26.3.1.37753: Flags [.], ack 425545, win 24433, options [nop,nop,TS val 4294913779 ecr 160125,mptcp dss ack 3914441778], length 0
10:53:23.965220 IP 112.26.3.8.41425 > 112.26.3.1.37753: Flags [.], ack 425545, win 24433, options [nop,nop,TS val 4294913779 ecr 160125,mptcp dss ack 3914441778], length 0
10:53:24.008736 IP 112.26.3.8.41425 > 112.26.3.1.37753: Flags [.], ack 426973, win 24393, options [nop,nop,TS val 4294913900 ecr 160260,mptcp dss ack 3914448918], length 0
10:53:24.023133 IP 112.26.3.8.41425 > 112.26.3.1.37753: Flags [.], ack 426973, win 24393, options [nop,nop,TS val 4294913900 ecr 160260,mptcp dss ack 3914448918], length 0
10:53:24.036080 IP 112.26.3.8.41425 > 112.26.3.1.37753: Flags [.], ack 426973, win 24393, options [nop,nop,TS val 4294913900 ecr 160260,mptcp dss ack 3914448918], length 0
10:53:24.146654 IP 112.26.3.8.41425 > 112.26.3.1.37753: Flags [.], ack 428401, win 24424, options [nop,nop,TS val 4294914037 ecr 160260,mptcp dss ack 3914458914], length 0
10:53:24.152769 IP 112.26.3.8.41425 > 112.26.3.1.37753: Flags [.], ack 428401, win 24424, options [nop,nop,TS val 4294914037 ecr 160260,mptcp dss ack 3914458914], length 0
10:53:24.155021 IP 112.26.3.8.41425 > 112.26.3.1.37753: Flags [.], ack 428401, win 24424, options [nop,nop,TS val 4294914037 ecr 160260,mptcp dss ack 3914458914], length 0
10:53:24.261996 IP 112.26.3.8.41425 > 112.26.3.1.37753: Flags [.], ack 429829, win 24458, options [nop,nop,TS val 4294914154 ecr 160399,mptcp dss ack 3914466054], length 0
10:53:24.263468 IP 112.26.3.8.41425 > 112.26.3.1.37753: Flags [.], ack 429829, win 24458, options [nop,nop,TS val 4294914154 ecr 160399,mptcp dss ack 3914466054], length 0
10:53:24.270791 IP 112.26.3.8.41425 > 112.26.3.1.37753: Flags [.], ack 429829, win 24458, options [nop,nop,TS val 4294914154 ecr 160399,mptcp dss ack 3914466054], length 0
10:53:24.365817 IP 112.26.3.8.41425 > 112.26.3.1.37753: Flags [.], ack 431257, win 24473, options [nop,nop,TS val 4294914258 ecr 160511,mptcp dss ack 3914473194], length 0
10:53:24.422839 IP 112.26.3.8.41425 > 112.26.3.1.37753: Flags [.], ack 431257, win 24473, options [nop,nop,TS val 4294914258 ecr 160511,mptcp dss ack 3914473194], length 0
10:53:24.425035 IP 112.26.3.8.41425 > 112.26.3.1.37753: Flags [.], ack 431257, win 24473, options [nop,nop,TS val 4294914258 ecr 160511,mptcp dss ack 3914473194], length 0
10:53:24.493939 IP 112.26.3.8.41425 > 112.26.3.1.37753: Flags [.], ack 432685, win 24451, options [nop,nop,TS val 4294914385 ecr 160607,mptcp dss ack 3914474622], length 0
10:53:24.499101 IP 112.26.3.8.41425 > 112.26.3.1.37753: Flags [.], ack 432685, win 24451, options [nop,nop,TS val 4294914385 ecr 160607,mptcp dss ack 3914474622], length 0
10:53:24.527462 IP 112.26.3.8.41425 > 112.26.3.1.37753: Flags [.], ack 432685, win 24451, options [nop,nop,TS val 4294914385 ecr 160607,mptcp dss ack 3914474622], length 0
10:53:24.605727 IP 112.26.3.8.41425 > 112.26.3.1.37753: Flags [.], ack 434113, win 24422, options [nop,nop,TS val 4294914497 ecr 160682,mptcp dss ack 3914478906], length 0
10:53:24.607157 IP 112.26.3.8.41425 > 112.26.3.1.37753: Flags [.], ack 434113, win 24422, options [nop,nop,TS val 4294914497 ecr 160682,mptcp dss ack 3914478906], length 0
10:53:24.617569 IP 112.26.3.8.41425 > 112.26.3.1.37753: Flags [.], ack 434113, win 24422, options [nop,nop,TS val 4294914497 ecr 160682,mptcp dss ack 3914478906], length 0
10:53:24.727004 IP 112.26.3.8.41425 > 112.26.3.1.37753: Flags [.], ack 435541, win 24422, options [nop,nop,TS val 4294914619 ecr 160797,mptcp dss ack 3914486046], length 0
10:53:24.728650 IP 112.26.3.8.41425 > 112.26.3.1.37753: Flags [.], ack 435541, win 24422, options [nop,nop,TS val 4294914619 ecr 160797,mptcp dss ack 3914486046], length 0
10:53:24.745737 IP 112.26.3.8.41425 > 112.26.3.1.37753: Flags [.], ack 435541, win 24422, options [nop,nop,TS val 4294914619 ecr 160797,mptcp dss ack 3914486046], length 0
10:53:24.860345 IP 112.26.3.8.41425 > 112.26.3.1.37753: Flags [.], ack 436969, win 24419, options [nop,nop,TS val 4294914752 ecr 160797,mptcp dss ack 3914491758], length 0
10:53:24.862878 IP 112.26.3.8.41425 > 112.26.3.1.37753: Flags [.], ack 436969, win 24419, options [nop,nop,TS val 4294914752 ecr 160797,mptcp dss ack 3914491758], length 0
10:53:24.877106 IP 112.26.3.8.41425 > 112.26.3.1.37753: Flags [.], ack 436969, win 24419, options [nop,nop,TS val 4294914752 ecr 160797,mptcp dss ack 3914491758], length 0
10:53:24.967038 IP 112.26.3.8.41425 > 112.26.3.1.37753: Flags [.], ack 438397, win 24397, options [nop,nop,TS val 4294914859 ecr 160907,mptcp dss ack 3914493186], length 0
10:53:24.974152 IP 112.26.3.8.41425 > 112.26.3.1.37753: Flags [.], ack 438397, win 24397, options [nop,nop,TS val 4294914859 ecr 160907,mptcp dss ack 3914493186], length 0
10:53:24.975884 IP 112.26.3.8.41425 > 112.26.3.1.37753: Flags [.], ack 438397, win 24397, options [nop,nop,TS val 4294914859 ecr 160907,mptcp dss ack 3914493186], length 0
10:53:25.063304 IP 112.26.3.8.41425 > 112.26.3.1.37753: Flags [.], ack 439825, win 24442, options [nop,nop,TS val 4294914955 ecr 161067,mptcp dss ack 3914504610], length 0
10:53:25.108226 IP 112.26.3.8.41425 > 112.26.3.1.37753: Flags [.], ack 439825, win 24442, options [nop,nop,TS val 4294914955 ecr 161067,mptcp dss ack 3914504610], length 0
10:53:25.110038 IP 112.26.3.8.41425 > 112.26.3.1.37753: Flags [.], ack 439825, win 24442, options [nop,nop,TS val 4294914955 ecr 161067,mptcp dss ack 3914504610], length 0
10:53:25.212203 IP 112.26.3.8.41425 > 112.26.3.1.37753: Flags [.], ack 441253, win 24420, options [nop,nop,TS val 4294915105 ecr 161169,mptcp dss ack 3914506038], length 0
10:53:25.217032 IP 112.26.3.8.41425 > 112.26.3.1.37753: Flags [.], ack 441253, win 24420, options [nop,nop,TS val 4294915105 ecr 161169,mptcp dss ack 3914506038], length 0
10:53:25.227620 IP 112.26.3.8.41425 > 112.26.3.1.37753: Flags [.], ack 441253, win 24420, options [nop,nop,TS val 4294915105 ecr 161169,mptcp dss ack 3914506038], length 0
10:53:25.338853 IP 112.26.3.8.41425 > 112.26.3.1.37753: Flags [.], ack 444109, win 24396, options [nop,nop,TS val 4294915215 ecr 161259,mptcp dss ack 3914514606], length 0
10:53:25.344299 IP 112.26.3.8.41425 > 112.26.3.1.37753: Flags [.], ack 444109, win 24396, options [nop,nop,TS val 4294915215 ecr 161259,mptcp dss ack 3914514606], length 0
10:53:25.346066 IP 112.26.3.8.41425 > 112.26.3.1.37753: Flags [.], ack 444109, win 24396, options [nop,nop,TS val 4294915215 ecr 161259,mptcp dss ack 3914514606], length 0
10:53:25.529138 IP 112.26.3.8.41425 > 112.26.3.1.37753: Flags [.], ack 446965, win 24356, options [nop,nop,TS val 4294915418 ecr 161519,mptcp dss ack 3914517462], length 0
10:53:25.530389 IP 112.26.3.8.41425 > 112.26.3.1.37753: Flags [.], ack 446965, win 24356, options [nop,nop,TS val 4294915418 ecr 161519,mptcp dss ack 3914517462], length 0
10:53:25.545660 IP 112.26.3.8.41425 > 112.26.3.1.37753: Flags [.], ack 446965, win 24356, options [nop,nop,TS val 4294915418 ecr 161519,mptcp dss ack 3914517462], length 0
10:53:25.776274 IP 112.26.3.8.41425 > 112.26.3.1.37753: Flags [.], ack 449821, win 24349, options [nop,nop,TS val 4294915668 ecr 161751,mptcp dss ack 3914531742], length 0
10:53:25.780424 IP 112.26.3.8.41425 > 112.26.3.1.37753: Flags [.], ack 449821, win 24349, options [nop,nop,TS val 4294915668 ecr 161751,mptcp dss ack 3914531742], length 0
10:53:25.782135 IP 112.26.3.8.41425 > 112.26.3.1.37753: Flags [.], ack 449821, win 24349, options [nop,nop,TS val 4294915668 ecr 161751,mptcp dss ack 3914531742], length 0
10:53:25.899115 IP 112.26.3.8.41425 > 112.26.3.1.37753: Flags [.], ack 452677, win 24375, options [nop,nop,TS val 4294915791 ecr 161987,mptcp dss ack 3914546022], length 0
10:53:25.900560 IP 112.26.3.8.41425 > 112.26.3.1.37753: Flags [.], ack 452677, win 24375, options [nop,nop,TS val 4294915791 ecr 161987,mptcp dss ack 3914546022], length 0
10:53:25.911182 IP 112.26.3.8.41425 > 112.26.3.1.37753: Flags [.], ack 452677, win 24375, options [nop,nop,TS val 4294915791 ecr 161987,mptcp dss ack 3914546022], length 0
10:53:26.107176 IP 112.26.3.8.41425 > 112.26.3.1.37753: Flags [.], ack 455533, win 24440, options [nop,nop,TS val 4294915999 ecr 162173,mptcp dss ack 3914561730], length 0
10:53:26.111126 IP 112.26.3.8.41425 > 112.26.3.1.37753: Flags [.], ack 455533, win 24440, options [nop,nop,TS val 4294915999 ecr 162173,mptcp dss ack 3914561730], length 0
10:53:26.120449 IP 112.26.3.8.41425 > 112.26.3.1.37753: Flags [.], ack 455533, win 24440, options [nop,nop,TS val 4294915999 ecr 162173,mptcp dss ack 3914561730], length 0
10:53:26.377795 IP 112.26.3.8.41425 > 112.26.3.1.37753: Flags [.], ack 459817, win 24418, options [nop,nop,TS val 4294916269 ecr 162423,mptcp dss ack 3914563158], length 0
10:53:26.379560 IP 112.26.3.8.41425 > 112.26.3.1.37753: Flags [.], ack 459817, win 24418, options [nop,nop,TS val 4294916269 ecr 162423,mptcp dss ack 3914563158], length 0
10:53:26.381566 IP 112.26.3.8.41425 > 112.26.3.1.37753: Flags [.], ack 459817, win 24418, options [nop,nop,TS val 4294916269 ecr 162423,mptcp dss ack 3914563158], length 0
10:53:26.699031 IP 112.26.3.8.41425 > 112.26.3.1.37753: Flags [.], ack 462673, win 24418, options [nop,nop,TS val 4294916592 ecr 162550,mptcp dss ack 3914563158], length 0
10:53:26.703840 IP 112.26.3.8.41425 > 112.26.3.1.37753: Flags [.], ack 462673, win 24418, options [nop,nop,TS val 4294916592 ecr 162550,mptcp dss ack 3914563158], length 0
10:53:26.705604 IP 112.26.3.8.41425 > 112.26.3.1.37753: Flags [.], ack 462673, win 24418, options [nop,nop,TS val 4294916592 ecr 162550,mptcp dss ack 3914563158], length 0
10:53:27.069897 IP 112.26.3.8.41425 > 112.26.3.1.37753: Flags [.], ack 468385, win 24418, options [nop,nop,TS val 4294916962 ecr 162752,mptcp dss ack 3914563158], length 0
10:53:27.072654 IP 112.26.3.8.41425 > 112.26.3.1.37753: Flags [.], ack 468385, win 24418, options [nop,nop,TS val 4294916962 ecr 162752,mptcp dss ack 3914563158], length 0
10:53:27.074424 IP 112.26.3.8.41425 > 112.26.3.1.37753: Flags [.], ack 468385, win 24418, options [nop,nop,TS val 4294916962 ecr 162752,mptcp dss ack 3914563158], length 0
10:53:27.401964 IP 112.26.3.8.41425 > 112.26.3.1.37753: Flags [.], ack 472669, win 24418, options [nop,nop,TS val 4294917294 ecr 163023,mptcp dss ack 3914563158], length 0
10:53:27.404547 IP 112.26.3.8.41425 > 112.26.3.1.37753: Flags [.], ack 472669, win 24418, options [nop,nop,TS val 4294917294 ecr 163023,mptcp dss ack 3914563158], length 0
10:53:27.407421 IP 112.26.3.8.41425 > 112.26.3.1.37753: Flags [.], ack 472669, win 24418, options [nop,nop,TS val 4294917294 ecr 163023,mptcp dss ack 3914563158], length 0
10:53:27.786508 IP 112.26.3.8.41425 > 112.26.3.1.37753: Flags [.], ack 476953, win 23995, options [nop,nop,TS val 4294917679 ecr 163715,mptcp dss ack 3914590290], length 0
10:53:27.794088 IP 112.26.3.8.41425 > 112.26.3.1.37753: Flags [.], ack 476953, win 23995, options [nop,nop,TS val 4294917679 ecr 163715,mptcp dss ack 3914590290], length 0
10:53:27.809738 IP 112.26.3.8.41425 > 112.26.3.1.37753: Flags [.], ack 476953, win 23995, options [nop,nop,TS val 4294917679 ecr 163715,mptcp dss ack 3914590290], length 0
10:53:27.906526 IP 112.26.3.8.41425 > 112.26.3.1.37753: Flags [.], ack 479809, win 24078, options [nop,nop,TS val 4294917798 ecr 163715,mptcp dss ack 3914590290], length 0
10:53:27.952412 IP 112.26.3.8.41425 > 112.26.3.1.37753: Flags [.], ack 479809, win 24078, options [nop,nop,TS val 4294917798 ecr 163715,mptcp dss ack 3914590290], length 0
10:53:27.954568 IP 112.26.3.8.41425 > 112.26.3.1.37753: Flags [.], ack 479809, win 24078, options [nop,nop,TS val 4294917798 ecr 163715,mptcp dss ack 3914590290], length 0
10:53:28.188169 IP 112.26.3.8.41425 > 112.26.3.1.37753: Flags [.], ack 482665, win 24078, options [nop,nop,TS val 4294918080 ecr 163715,mptcp dss ack 3914590290], length 0
10:53:28.191825 IP 112.26.3.8.41425 > 112.26.3.1.37753: Flags [.], ack 482665, win 24078, options [nop,nop,TS val 4294918080 ecr 163715,mptcp dss ack 3914590290], length 0
10:53:28.204753 IP 112.26.3.8.41425 > 112.26.3.1.37753: Flags [.], ack 482665, win 24078, options [nop,nop,TS val 4294918080 ecr 163715,mptcp dss ack 3914590290], length 0
10:53:28.501668 IP 112.26.3.8.41425 > 112.26.3.1.37753: Flags [.], ack 488377, win 24078, options [nop,nop,TS val 4294918393 ecr 164049,mptcp dss ack 3914590290], length 0
10:53:28.516295 IP 112.26.3.8.41425 > 112.26.3.1.37753: Flags [.], ack 488377, win 24078, options [nop,nop,TS val 4294918393 ecr 164049,mptcp dss ack 3914590290], length 0
10:53:28.518170 IP 112.26.3.8.41425 > 112.26.3.1.37753: Flags [.], ack 488377, win 24078, options [nop,nop,TS val 4294918393 ecr 164049,mptcp dss ack 3914590290], length 0
10:53:28.859148 IP 112.26.3.8.41425 > 112.26.3.1.37753: Flags [.], ack 491233, win 24078, options [nop,nop,TS val 4294918752 ecr 164456,mptcp dss ack 3914590290], length 0
10:53:28.866288 IP 112.26.3.8.41425 > 112.26.3.1.37753: Flags [.], ack 491233, win 24078, options [nop,nop,TS val 4294918752 ecr 164456,mptcp dss ack 3914590290], length 0
10:53:28.868748 IP 112.26.3.8.41425 > 112.26.3.1.37753: Flags [.], ack 491233, win 24078, options [nop,nop,TS val 4294918752 ecr 164456,mptcp dss ack 3914590290], length 0
10:53:29.243395 IP 112.26.3.8.41425 > 112.26.3.1.37753: Flags [.], ack 496945, win 23862, options [nop,nop,TS val 4294919136 ecr 164596,mptcp dss ack 3914645982], length 0
10:53:29.244992 IP 112.26.3.8.41425 > 112.26.3.1.37753: Flags [.], ack 496945, win 23862, options [nop,nop,TS val 4294919136 ecr 164596,mptcp dss ack 3914645982], length 0
10:53:29.258096 IP 112.26.3.8.41425 > 112.26.3.1.37753: Flags [.], ack 496945, win 23862, options [nop,nop,TS val 4294919136 ecr 164596,mptcp dss ack 3914645982], length 0
10:53:29.456121 IP 112.26.3.8.41425 > 112.26.3.1.37753: Flags [.], ack 499801, win 24275, options [nop,nop,TS val 4294919348 ecr 164850,mptcp dss ack 3914707386], length 0
10:53:29.462783 IP 112.26.3.8.41425 > 112.26.3.1.37753: Flags [.], ack 499801, win 24275, options [nop,nop,TS val 4294919348 ecr 164850,mptcp dss ack 3914707386], length 0
10:53:29.464735 IP 112.26.3.8.41425 > 112.26.3.1.37753: Flags [.], ack 499801, win 24275, options [nop,nop,TS val 4294919348 ecr 164850,mptcp dss ack 3914707386], length 0
10:53:29.957858 IP 112.26.3.8.41425 > 112.26.3.1.37753: Flags [.], ack 505513, win 24275, options [nop,nop,TS val 4294919848 ecr 165159,mptcp dss ack 3914707386], length 0
10:53:29.963952 IP 112.26.3.8.41425 > 112.26.3.1.37753: Flags [.], ack 505513, win 24275, options [nop,nop,TS val 4294919848 ecr 165159,mptcp dss ack 3914707386], length 0
10:53:29.966295 IP 112.26.3.8.41425 > 112.26.3.1.37753: Flags [.], ack 505513, win 24275, options [nop,nop,TS val 4294919848 ecr 165159,mptcp dss ack 3914707386], length 0
10:53:30.366838 IP 112.26.3.8.41425 > 112.26.3.1.37753: Flags [.], ack 508369, win 24275, options [nop,nop,TS val 4294920208 ecr 165159,mptcp dss ack 3914707386], length 0
10:53:30.377337 IP 112.26.3.8.41425 > 112.26.3.1.37753: Flags [.], ack 508369, win 24275, options [nop,nop,TS val 4294920208 ecr 165159,mptcp dss ack 3914707386], length 0
10:53:30.380411 IP 112.26.3.8.41425 > 112.26.3.1.37753: Flags [.], ack 508369, win 24275, options [nop,nop,TS val 4294920208 ecr 165159,mptcp dss ack 3914707386], length 0
10:53:30.476198 IP 112.26.3.8.41425 > 112.26.3.1.37753: Flags [.], ack 509797, win 24275, options [nop,nop,TS val 4294920368 ecr 165519,nop,nop,sack 1 {512653:514081},mptcp dss ack 3914707386], length 0
10:53:30.478295 IP 112.26.3.8.41425 > 112.26.3.1.37753: Flags [.], ack 509797, win 24275, options [nop,nop,TS val 4294920368 ecr 165519,nop,nop,sack 1 {512653:514081},mptcp dss ack 3914707386], length 0
10:53:30.519616 IP 112.26.3.8.41425 > 112.26.3.1.37753: Flags [.], ack 509797, win 24275, options [nop,nop,TS val 4294920368 ecr 165519,nop,nop,sack 1 {512653:514081},mptcp dss ack 3914707386], length 0
10:53:30.597943 IP 112.26.3.8.41425 > 112.26.3.1.37753: Flags [.], ack 509797, win 24275, options [nop,nop,TS val 4294920489 ecr 165519,nop,nop,sack 1 {512653:515509},mptcp dss ack 3914707386], length 0
10:53:30.602655 IP 112.26.3.8.41425 > 112.26.3.1.37753: Flags [.], ack 509797, win 24275, options [nop,nop,TS val 4294920489 ecr 165519,nop,nop,sack 1 {512653:515509},mptcp dss ack 3914707386], length 0
10:53:30.618663 IP 112.26.3.8.41425 > 112.26.3.1.37753: Flags [.], ack 509797, win 24275, options [nop,nop,TS val 4294920489 ecr 165519,nop,nop,sack 1 {512653:515509},mptcp dss ack 3914707386], length 0
10:53:30.717772 IP 112.26.3.8.41425 > 112.26.3.1.37753: Flags [.], ack 509797, win 24275, options [nop,nop,TS val 4294920610 ecr 165519,nop,nop,sack 1 {512653:516937},mptcp dss ack 3914707386], length 0
10:53:30.719676 IP 112.26.3.8.41425 > 112.26.3.1.37753: Flags [.], ack 509797, win 24275, options [nop,nop,TS val 4294920610 ecr 165519,nop,nop,sack 1 {512653:516937},mptcp dss ack 3914707386], length 0
10:53:30.733844 IP 112.26.3.8.41425 > 112.26.3.1.37753: Flags [.], ack 509797, win 24275, options [nop,nop,TS val 4294920610 ecr 165519,nop,nop,sack 1 {512653:516937},mptcp dss ack 3914707386], length 0
10:53:30.846336 IP 112.26.3.8.41425 > 112.26.3.1.37753: Flags [.], ack 509797, win 24275, options [nop,nop,TS val 4294920737 ecr 165519,nop,nop,sack 1 {512653:518365},mptcp dss ack 3914707386], length 0
10:53:30.874129 IP 112.26.3.8.41425 > 112.26.3.1.37753: Flags [.], ack 509797, win 24275, options [nop,nop,TS val 4294920737 ecr 165519,nop,nop,sack 1 {512653:518365},mptcp dss ack 3914707386], length 0
10:53:30.888514 IP 112.26.3.8.41425 > 112.26.3.1.37753: Flags [.], ack 509797, win 24275, options [nop,nop,TS val 4294920737 ecr 165519,nop,nop,sack 1 {512653:518365},mptcp dss ack 3914707386], length 0
10:53:30.989832 IP 112.26.3.8.41425 > 112.26.3.1.37753: Flags [.], ack 509797, win 24275, options [nop,nop,TS val 4294920881 ecr 165519,nop,nop,sack 1 {512653:519793},mptcp dss ack 3914707386], length 0
10:53:30.994811 IP 112.26.3.8.41425 > 112.26.3.1.37753: Flags [.], ack 509797, win 24275, options [nop,nop,TS val 4294920881 ecr 165519,nop,nop,sack 1 {512653:519793},mptcp dss ack 3914707386], length 0
10:53:30.997061 IP 112.26.3.8.41425 > 112.26.3.1.37753: Flags [.], ack 509797, win 24275, options [nop,nop,TS val 4294920881 ecr 165519,nop,nop,sack 1 {512653:519793},mptcp dss ack 3914707386], length 0
10:53:31.103109 IP 112.26.3.8.41425 > 112.26.3.1.37753: Flags [.], ack 509797, win 24275, options [nop,nop,TS val 4294920994 ecr 165519,nop,nop,sack 1 {512653:521221},mptcp dss ack 3914707386], length 0
10:53:31.105409 IP 112.26.3.8.41425 > 112.26.3.1.37753: Flags [.], ack 509797, win 24275, options [nop,nop,TS val 4294920994 ecr 165519,nop,nop,sack 1 {512653:521221},mptcp dss ack 3914707386], length 0
10:53:31.114068 IP 112.26.3.8.41425 > 112.26.3.1.37753: Flags [.], ack 509797, win 24275, options [nop,nop,TS val 4294920994 ecr 165519,nop,nop,sack 1 {512653:521221},mptcp dss ack 3914707386], length 0
10:53:31.221303 IP 112.26.3.8.41425 > 112.26.3.1.37753: Flags [.], ack 509797, win 24275, options [nop,nop,TS val 4294921114 ecr 165519,nop,nop,sack 1 {512653:522649},mptcp dss ack 3914707386], length 0
10:53:31.232482 IP 112.26.3.8.41425 > 112.26.3.1.37753: Flags [.], ack 509797, win 24275, options [nop,nop,TS val 4294921114 ecr 165519,nop,nop,sack 1 {512653:522649},mptcp dss ack 3914707386], length 0
10:53:31.322505 IP 112.26.3.8.41425 > 112.26.3.1.37753: Flags [.], ack 509797, win 24275, options [nop,nop,TS val 4294921194 ecr 165519,nop,nop,sack 1 {512653:524077},mptcp dss ack 3914707386], length 0
10:53:31.346415 IP 112.26.3.8.41425 > 112.26.3.1.37753: Flags [.], ack 509797, win 24275, options [nop,nop,TS val 4294921194 ecr 165519,nop,nop,sack 1 {512653:524077},mptcp dss ack 3914707386], length 0
10:53:31.349127 IP 112.26.3.8.41425 > 112.26.3.1.37753: Flags [.], ack 509797, win 24275, options [nop,nop,TS val 4294921194 ecr 165519,nop,nop,sack 1 {512653:524077},mptcp dss ack 3914707386], length 0
10:53:31.459598 IP 112.26.3.8.41425 > 112.26.3.1.37753: Flags [.], ack 509797, win 24275, options [nop,nop,TS val 4294921350 ecr 165519,nop,nop,sack 2 {526933:528361}{512653:524077},mptcp dss ack 3914707386], length 0
10:53:31.498175 IP 112.26.3.8.41425 > 112.26.3.1.37753: Flags [.], ack 509797, win 24275, options [nop,nop,TS val 4294921350 ecr 165519,nop,nop,sack 2 {526933:528361}{512653:524077},mptcp dss ack 3914707386], length 0
10:53:31.500458 IP 112.26.3.8.41425 > 112.26.3.1.37753: Flags [.], ack 509797, win 24275, options [nop,nop,TS val 4294921350 ecr 165519,nop,nop,sack 2 {526933:528361}{512653:524077},mptcp dss ack 3914707386], length 0
10:53:31.599994 IP 112.26.3.8.41425 > 112.26.3.1.37753: Flags [.], ack 509797, win 24275, options [nop,nop,TS val 4294921490 ecr 165519,nop,nop,sack 2 {526933:529789}{512653:524077},mptcp dss ack 3914707386], length 0
10:53:31.613023 IP 112.26.3.8.41425 > 112.26.3.1.37753: Flags [.], ack 509797, win 24275, options [nop,nop,TS val 4294921490 ecr 165519,nop,nop,sack 2 {526933:529789}{512653:524077},mptcp dss ack 3914707386], length 0
10:53:31.620517 IP 112.26.3.8.41425 > 112.26.3.1.37753: Flags [.], ack 509797, win 24275, options [nop,nop,TS val 4294921490 ecr 165519,nop,nop,sack 2 {526933:529789}{512653:524077},mptcp dss ack 3914707386], length 0
10:53:31.723330 IP 112.26.3.8.41425 > 112.26.3.1.37753: Flags [.], ack 509797, win 24275, options [nop,nop,TS val 4294921616 ecr 165519,nop,nop,sack 2 {526933:531217}{512653:524077},mptcp dss ack 3914707386], length 0
10:53:31.727368 IP 112.26.3.8.41425 > 112.26.3.1.37753: Flags [.], ack 509797, win 24275, options [nop,nop,TS val 4294921616 ecr 165519,nop,nop,sack 2 {526933:531217}{512653:524077},mptcp dss ack 3914707386], length 0
10:53:31.737514 IP 112.26.3.8.41425 > 112.26.3.1.37753: Flags [.], ack 509797, win 24275, options [nop,nop,TS val 4294921616 ecr 165519,nop,nop,sack 2 {526933:531217}{512653:524077},mptcp dss ack 3914707386], length 0
10:53:31.852893 IP 112.26.3.8.41425 > 112.26.3.1.37753: Flags [.], ack 509797, win 24275, options [nop,nop,TS val 4294921745 ecr 165519,nop,nop,sack 2 {532645:534073}{526933:531217},mptcp dss ack 3914707386], length 0
