10:52:44.170484 IP 112.26.2.8.44397 > 112.26.2.1.37753: Flags [S], seq 2791519187, win 65535, options [mss 1460,sackOK,TS val 4294873967 ecr 0,nop,wscale 6,mptcp join id 4 token 0xd15e4cde nonce 0x156fce22], length 0
10:52:44.232753 IP 112.26.2.8.44397 > 112.26.2.1.37753: Flags [S], seq 2791519187, win 65535, options [mss 1460,sackOK,TS val 4294873967 ecr 0,nop,wscale 6,mptcp join id 4 token 0xd15e4cde nonce 0x156fce22], length 0
10:52:44.266637 IP 112.26.2.1.37753 > 112.26.2.8.44397: Flags [S.], seq 1823757429, ack 2791519188, win 28560, options [mss 1460,sackOK,TS val 120874 ecr 4294873967,nop,wscale 7,mptcp join id 6 hmac 0x9180a648a613b37a nonce 0x4f6f39cd], length 0
10:52:44.363512 IP 112.26.2.1.37753 > 112.26.2.8.44397: Flags [S.], seq 1823757429, ack 2791519188, win 28560, options [mss 1460,sackOK,TS val 120874 ecr 4294873967,nop,wscale 7,mptcp join id 6 hmac 0x9180a648a613b37a nonce 0x4f6f39cd], length 0
10:52:44.408309 IP 112.26.2.1.37753 > 112.26.2.8.44397: Flags [S.], seq 1823757429, ack 2791519188, win 28560, options [mss 1460,sackOK,TS val 120874 ecr 4294873967,nop,wscale 7,mptcp join id 6 hmac 0x9180a648a613b37a nonce 0x4f6f39cd], length 0
10:52:44.485055 IP 112.26.2.8.44397 > 112.26.2.1.37753: Flags [.], ack 1, win 5612, options [nop,nop,TS val 4294874303 ecr 120874,mptcp join hmac 0xaeeb9b2491d3cee2f82d2bbe89c74c4650f6fe81], length 0
10:52:44.487456 IP 112.26.2.8.44397 > 112.26.2.1.37753: Flags [.], ack 1, win 5612, options [nop,nop,TS val 4294874303 ecr 120874,mptcp join hmac 0xaeeb9b2491d3cee2f82d2bbe89c74c4650f6fe81], length 0
10:53:26.839195 IP 112.26.2.1.37753 > 112.26.2.8.44397: Flags [.], seq 459817:461245, ack 1, win 893, options [nop,nop,TS val 162253 ecr 4294915486,mptcp dss ack 2295998090 seq 3914603142 subseq 459817 len 1428 csum 0x96d8], length 1428
10:53:26.855070 IP 112.26.2.8.44397 > 112.26.2.1.37753: Flags [.], ack 448393, win 24418, options [nop,nop,TS val 4294916738 ecr 161681,nop,nop,sack 2 {456961:461245}{449821:455533},mptcp dss ack 3914563158], length 0
10:53:26.878543 IP 112.26.2.1.37753 > 112.26.2.8.44397: Flags [.], seq 472669:474097, ack 1, win 893, options [nop,nop,TS val 163017 ecr 4294916219,mptcp dss ack 2295998090 seq 3914651694 subseq 472669 len 1428 csum 0x7976], length 1428
10:53:26.905657 IP 112.26.2.8.44397 > 112.26.2.1.37753: Flags [.], ack 448393, win 24418, options [nop,nop,TS val 4294916738 ecr 161681,nop,nop,sack 2 {456961:461245}{449821:455533},mptcp dss ack 3914563158], length 0
10:53:26.913539 IP 112.26.2.1.37753 > 112.26.2.8.44397: Flags [.], seq 461245:462673, ack 1, win 893, options [nop,nop,TS val 162253 ecr 4294915486,mptcp dss ack 2295998090 seq 3914604570 subseq 461245 len 1428 csum 0xcf6f], length 1428
10:53:26.939176 IP 112.26.2.1.37753 > 112.26.2.8.44397: Flags [.], seq 459817:461245, ack 1, win 893, options [nop,nop,TS val 162253 ecr 4294915486,mptcp dss ack 2295998090 seq 3914603142 subseq 459817 len 1428 csum 0x96d8], length 1428
10:53:26.951258 IP 112.26.2.1.37753 > 112.26.2.8.44397: Flags [.], seq 448393:449821, ack 1, win 893, options [nop,nop,TS val 163113 ecr 4294916348,mptcp dss ack 2295998090 seq 3914571726 subseq 448393 len 1428 csum 0x8b08], length 1428
10:53:26.963408 IP 112.26.2.8.44397 > 112.26.2.1.37753: Flags [.], ack 448393, win 24418, options [nop,nop,TS val 4294916853 ecr 161681,nop,nop,sack 2 {456961:462673}{449821:455533},mptcp dss ack 3914563158], length 0
10:53:26.970969 IP 112.26.2.8.44397 > 112.26.2.1.37753: Flags [.], ack 448393, win 24418, options [nop,nop,TS val 4294916853 ecr 161681,nop,nop,sack 2 {456961:462673}{449821:455533},mptcp dss ack 3914563158], length 0
10:53:26.979536 IP 112.26.2.1.37753 > 112.26.2.8.44397: Flags [.], seq 461245:462673, ack 1, win 893, options [nop,nop,TS val 162253 ecr 4294915486,mptcp dss ack 2295998090 seq 3914604570 subseq 461245 len 1428 csum 0xcf6f], length 1428
10:53:27.037903 IP 112.26.2.1.37753 > 112.26.2.8.44397: Flags [.], seq 462673:464101, ack 1, win 893, options [nop,nop,TS val 162505 ecr 4294915745,mptcp dss ack 2295998090 seq 3914617422 subseq 462673 len 1428 csum 0x657e], length 1428
10:53:27.070817 IP 112.26.2.1.37753 > 112.26.2.8.44397: Flags [.], seq 474097:475525, ack 1, win 893, options [nop,nop,TS val 163274 ecr 4294916421,mptcp dss ack 2295998090 seq 3914665974 subseq 474097 len 1428 csum 0x39e9], length 1428
10:53:27.076480 IP 112.26.2.1.37753 > 112.26.2.8.44397: Flags [.], seq 462673:464101, ack 1, win 893, options [nop,nop,TS val 162505 ecr 4294915745,mptcp dss ack 2295998090 seq 3914617422 subseq 462673 len 1428 csum 0x657e], length 1428
10:53:27.089905 IP 112.26.2.8.44397 > 112.26.2.1.37753: Flags [.], ack 448393, win 24418, options [nop,nop,TS val 4294916953 ecr 161681,nop,nop,sack 2 {456961:464101}{449821:455533},mptcp dss ack 3914563158], length 0
10:53:27.092042 IP 112.26.2.8.44397 > 112.26.2.1.37753: Flags [.], ack 448393, win 24418, options [nop,nop,TS val 4294916953 ecr 161681,nop,nop,sack 2 {456961:464101}{449821:455533},mptcp dss ack 3914563158], length 0
10:53:27.147673 IP 112.26.2.1.37753 > 112.26.2.8.44397: Flags [.], seq 464101:465529, ack 1, win 893, options [nop,nop,TS val 162505 ecr 4294915745,mptcp dss ack 2295998090 seq 3914618850 subseq 464101 len 1428 csum 0xfd50], length 1428
10:53:27.160040 IP 112.26.2.1.37753 > 112.26.2.8.44397: Flags [.], seq 455533:456961, ack 1, win 893, options [nop,nop,TS val 163318 ecr 4294916508,mptcp dss ack 2295998090 seq 3914590290 subseq 455533 len 1428 csum 0x6510], length 1428
10:53:27.203152 IP 112.26.2.8.44397 > 112.26.2.1.37753: Flags [.], ack 448393, win 24418, options [nop,nop,TS val 4294917035 ecr 161681,nop,nop,sack 2 {456961:465529}{449821:455533},mptcp dss ack 3914563158], length 0
10:53:27.208520 IP 112.26.2.8.44397 > 112.26.2.1.37753: Flags [.], ack 448393, win 24418, options [nop,nop,TS val 4294917035 ecr 161681,nop,nop,sack 2 {456961:465529}{449821:455533},mptcp dss ack 3914563158], length 0
10:53:27.243555 IP 112.26.2.1.37753 > 112.26.2.8.44397: Flags [.], seq 475525:476953, ack 1, win 893, options [nop,nop,TS val 163569 ecr 4294916738,mptcp dss ack 2295998090 seq 3914675970 subseq 475525 len 1428 csum 0x4b52], length 1428
10:53:27.272272 IP 112.26.2.1.37753 > 112.26.2.8.44397: Flags [.], seq 465529:466957, ack 1, win 893, options [nop,nop,TS val 162505 ecr 4294915745,mptcp dss ack 2295998090 seq 3914620278 subseq 465529 len 1428 csum 0x527f], length 1428
10:53:27.279667 IP 112.26.2.1.37753 > 112.26.2.8.44397: Flags [.], seq 465529:466957, ack 1, win 893, options [nop,nop,TS val 162505 ecr 4294915745,mptcp dss ack 2295998090 seq 3914620278 subseq 465529 len 1428 csum 0x527f], length 1428
10:53:27.315377 IP 112.26.2.8.44397 > 112.26.2.1.37753: Flags [.], ack 448393, win 24418, options [nop,nop,TS val 4294917170 ecr 161681,nop,nop,sack 2 {456961:466957}{449821:455533},mptcp dss ack 3914563158], length 0
10:53:27.317118 IP 112.26.2.8.44397 > 112.26.2.1.37753: Flags [.], ack 448393, win 24418, options [nop,nop,TS val 4294917170 ecr 161681,nop,nop,sack 2 {456961:466957}{449821:455533},mptcp dss ack 3914563158], length 0
10:53:27.351187 IP 112.26.2.1.37753 > 112.26.2.8.44397: Flags [.], seq 476953:478381, ack 1, win 893, options [nop,nop,TS val 163685 ecr 4294916853,mptcp dss ack 2295998090 seq 3914678826 subseq 476953 len 1428 csum 0xa288], length 1428
10:53:27.392877 IP 112.26.2.1.37753 > 112.26.2.8.44397: Flags [.], seq 468385:469813, ack 1, win 893, options [nop,nop,TS val 162731 ecr 4294915969,mptcp dss ack 2295998090 seq 3914637414 subseq 468385 len 1428 csum 0x6c38], length 1428
10:53:27.397790 IP 112.26.2.1.37753 > 112.26.2.8.44397: Flags [.], seq 468385:469813, ack 1, win 893, options [nop,nop,TS val 162731 ecr 4294915969,mptcp dss ack 2295998090 seq 3914637414 subseq 468385 len 1428 csum 0x6c38], length 1428
10:53:27.409115 IP 112.26.2.8.44397 > 112.26.2.1.37753: Flags [.], ack 448393, win 24418, options [nop,nop,TS val 4294917292 ecr 161681,nop,nop,sack 2 {468385:469813}{456961:466957},mptcp dss ack 3914563158], length 0
10:53:27.421266 IP 112.26.2.8.44397 > 112.26.2.1.37753: Flags [.], ack 448393, win 24418, options [nop,nop,TS val 4294917292 ecr 161681,nop,nop,sack 2 {468385:469813}{456961:466957},mptcp dss ack 3914563158], length 0
10:53:27.454541 IP 112.26.2.1.37753 > 112.26.2.8.44397: Flags [.], seq 478381:479809, ack 1, win 893, options [nop,nop,TS val 164021 ecr 4294917170,mptcp dss ack 2295998090 seq 3914701674 subseq 478381 len 1428 csum 0xe28], length 1428
10:53:27.514431 IP 112.26.2.1.37753 > 112.26.2.8.44397: Flags [.], seq 469813:471241, ack 1, win 893, options [nop,nop,TS val 162731 ecr 4294915969,mptcp dss ack 2295998090 seq 3914638842 subseq 469813 len 1428 csum 0xf372], length 1428
10:53:27.534421 IP 112.26.2.1.37753 > 112.26.2.8.44397: Flags [.], seq 469813:471241, ack 1, win 893, options [nop,nop,TS val 162731 ecr 4294915969,mptcp dss ack 2295998090 seq 3914638842 subseq 469813 len 1428 csum 0xf372], length 1428
10:53:27.541888 IP 112.26.2.8.44397 > 112.26.2.1.37753: Flags [.], ack 448393, win 24418, options [nop,nop,TS val 4294917428 ecr 161681,nop,nop,sack 2 {468385:471241}{456961:466957},mptcp dss ack 3914563158], length 0
10:53:27.550867 IP 112.26.2.1.37753 > 112.26.2.8.44397: Flags [.], seq 466957:468385, ack 1, win 893, options [nop,nop,TS val 164057 ecr 4294917292,mptcp dss ack 2295998090 seq 3914635986 subseq 466957 len 1428 csum 0x5fe6], length 1428
10:53:27.564078 IP 112.26.2.8.44397 > 112.26.2.1.37753: Flags [.], ack 448393, win 24418, options [nop,nop,TS val 4294917428 ecr 161681,nop,nop,sack 2 {468385:471241}{456961:466957},mptcp dss ack 3914563158], length 0
10:53:27.625188 IP 112.26.2.1.37753 > 112.26.2.8.44397: Flags [.], seq 479809:481237, ack 1, win 893, options [nop,nop,TS val 164235 ecr 4294917428,mptcp dss ack 2295998090 seq 3914711670 subseq 479809 len 1428 csum 0xd389], length 1428
10:53:27.644813 IP 112.26.2.1.37753 > 112.26.2.8.44397: Flags [.], seq 472669:474097, ack 1, win 893, options [nop,nop,TS val 163017 ecr 4294916219,mptcp dss ack 2295998090 seq 3914651694 subseq 472669 len 1428 csum 0x7976], length 1428
10:53:27.652132 IP 112.26.2.8.44397 > 112.26.2.1.37753: Flags [.], ack 448393, win 24418, options [nop,nop,TS val 4294917543 ecr 161681,nop,nop,sack 2 {472669:474097}{468385:471241},mptcp dss ack 3914563158], length 0
10:53:27.661436 IP 112.26.2.8.44397 > 112.26.2.1.37753: Flags [.], ack 448393, win 24418, options [nop,nop,TS val 4294917543 ecr 161681,nop,nop,sack 2 {472669:474097}{468385:471241},mptcp dss ack 3914563158], length 0
10:53:27.663793 IP 112.26.2.1.37753 > 112.26.2.8.44397: Flags [.], seq 472669:474097, ack 1, win 893, options [nop,nop,TS val 163017 ecr 4294916219,mptcp dss ack 2295998090 seq 3914651694 subseq 472669 len 1428 csum 0x7976], length 1428
10:53:27.721109 IP 112.26.2.1.37753 > 112.26.2.8.44397: Flags [.], seq 471241:472669, ack 1, win 893, options [nop,nop,TS val 164303 ecr 4294917543,mptcp dss ack 2295998090 seq 3914645982 subseq 471241 len 1428 csum 0xb56a], length 1428
10:53:27.752468 IP 112.26.2.1.37753 > 112.26.2.8.44397: Flags [.], seq 448393:449821, ack 1, win 893, options [nop,nop,TS val 163113 ecr 4294916348,mptcp dss ack 2295998090 seq 3914571726 subseq 448393 len 1428 csum 0x8b08], length 1428
10:53:27.754781 IP 112.26.2.1.37753 > 112.26.2.8.44397: Flags [.], seq 448393:449821, ack 1, win 893, options [nop,nop,TS val 163113 ecr 4294916348,mptcp dss ack 2295998090 seq 3914571726 subseq 448393 len 1428 csum 0x8b08], length 1428
10:53:27.761184 IP 112.26.2.8.44397 > 112.26.2.1.37753: Flags [.], ack 455533, win 24418, options [nop,nop,TS val 4294917649 ecr 163113,nop,nop,sack 2 {472669:474097}{468385:471241},mptcp dss ack 3914563158], length 0
10:53:27.765025 IP 112.26.2.8.44397 > 112.26.2.1.37753: Flags [.], ack 455533, win 24418, options [nop,nop,TS val 4294917649 ecr 163113,nop,nop,sack 2 {472669:474097}{468385:471241},mptcp dss ack 3914563158], length 0
10:53:27.783614 IP 112.26.2.1.37753 > 112.26.2.8.44397: Flags [.], seq 481237:482665, ack 1, win 893, options [nop,nop,TS val 164407 ecr 4294917649,mptcp dss ack 2295998090 seq 3914714526 subseq 481237 len 1428 csum 0xf3b9], length 1428
10:53:27.869660 IP 112.26.2.1.37753 > 112.26.2.8.44397: Flags [.], seq 482665:484093, ack 1, win 893, options [nop,nop,TS val 164407 ecr 4294917649,mptcp dss ack 2295998090 seq 3914715954 subseq 482665 len 1428 csum 0x728b], length 1428
10:53:27.898790 IP 112.26.2.1.37753 > 112.26.2.8.44397: Flags [.], seq 474097:475525, ack 1, win 893, options [nop,nop,TS val 163274 ecr 4294916421,mptcp dss ack 2295998090 seq 3914665974 subseq 474097 len 1428 csum 0x39e9], length 1428
10:53:27.901651 IP 112.26.2.1.37753 > 112.26.2.8.44397: Flags [.], seq 474097:475525, ack 1, win 893, options [nop,nop,TS val 163274 ecr 4294916421,mptcp dss ack 2295998090 seq 3914665974 subseq 474097 len 1428 csum 0x39e9], length 1428
10:53:27.933017 IP 112.26.2.8.44397 > 112.26.2.1.37753: Flags [.], ack 455533, win 24078, options [nop,nop,TS val 4294917795 ecr 163113,nop,nop,sack 2 {472669:475525}{468385:471241},mptcp dss ack 3914590290], length 0
10:53:27.939880 IP 112.26.2.8.44397 > 112.26.2.1.37753: Flags [.], ack 455533, win 24078, options [nop,nop,TS val 4294917795 ecr 163113,nop,nop,sack 2 {472669:475525}{468385:471241},mptcp dss ack 3914590290], length 0
10:53:27.952888 IP 112.26.2.1.37753 > 112.26.2.8.44397: Flags [.], seq 484093:485521, ack 1, win 893, options [nop,nop,TS val 164407 ecr 4294917649,mptcp dss ack 2295998090 seq 3914717382 subseq 484093 len 1428 csum 0xcb1e], length 1428
10:53:28.004550 IP 112.26.2.1.37753 > 112.26.2.8.44397: Flags [.], seq 485521:486949, ack 1, win 893, options [nop,nop,TS val 164596 ecr 4294917795,mptcp dss ack 2295998090 seq 3914734518 subseq 485521 len 1428 csum 0x3449], length 1428
10:53:28.042944 IP 112.26.2.1.37753 > 112.26.2.8.44397: Flags [.], seq 475525:476953, ack 1, win 893, options [nop,nop,TS val 163569 ecr 4294916738,mptcp dss ack 2295998090 seq 3914675970 subseq 475525 len 1428 csum 0x4b52], length 1428
10:53:28.047712 IP 112.26.2.1.37753 > 112.26.2.8.44397: Flags [.], seq 475525:476953, ack 1, win 893, options [nop,nop,TS val 163569 ecr 4294916738,mptcp dss ack 2295998090 seq 3914675970 subseq 475525 len 1428 csum 0x4b52], length 1428
10:53:28.053209 IP 112.26.2.8.44397 > 112.26.2.1.37753: Flags [.], ack 455533, win 24078, options [nop,nop,TS val 4294917941 ecr 163113,nop,nop,sack 2 {472669:476953}{468385:471241},mptcp dss ack 3914590290], length 0
10:53:28.066216 IP 112.26.2.8.44397 > 112.26.2.1.37753: Flags [.], ack 455533, win 24078, options [nop,nop,TS val 4294917941 ecr 163113,nop,nop,sack 2 {472669:476953}{468385:471241},mptcp dss ack 3914590290], length 0
10:53:28.115458 IP 112.26.2.1.37753 > 112.26.2.8.44397: Flags [.], seq 455533:456961, ack 1, win 893, options [nop,nop,TS val 164704 ecr 4294917941,mptcp dss ack 2295998090 seq 3914590290 subseq 455533 len 1428 csum 0x6510], length 1428
10:53:28.148941 IP 112.26.2.1.37753 > 112.26.2.8.44397: Flags [.], seq 476953:478381, ack 1, win 893, options [nop,nop,TS val 163685 ecr 4294916853,mptcp dss ack 2295998090 seq 3914678826 subseq 476953 len 1428 csum 0xa288], length 1428
10:53:28.152356 IP 112.26.2.1.37753 > 112.26.2.8.44397: Flags [.], seq 476953:478381, ack 1, win 893, options [nop,nop,TS val 163685 ecr 4294916853,mptcp dss ack 2295998090 seq 3914678826 subseq 476953 len 1428 csum 0xa288], length 1428
10:53:28.173921 IP 112.26.2.8.44397 > 112.26.2.1.37753: Flags [.], ack 455533, win 24078, options [nop,nop,TS val 4294918046 ecr 163113,nop,nop,sack 2 {472669:478381}{468385:471241},mptcp dss ack 3914590290], length 0
10:53:28.194386 IP 112.26.2.8.44397 > 112.26.2.1.37753: Flags [.], ack 455533, win 24078, options [nop,nop,TS val 4294918046 ecr 163113,nop,nop,sack 2 {472669:478381}{468385:471241},mptcp dss ack 3914590290], length 0
10:53:28.231215 IP 112.26.2.1.37753 > 112.26.2.8.44397: Flags [.], seq 486949:488377, ack 1, win 893, options [nop,nop,TS val 164839 ecr 4294918046,mptcp dss ack 2295998090 seq 3914741658 subseq 486949 len 1428 csum 0x71dd], length 1428
10:53:28.310232 IP 112.26.2.1.37753 > 112.26.2.8.44397: Flags [.], seq 466957:468385, ack 1, win 893, options [nop,nop,TS val 164057 ecr 4294917292,mptcp dss ack 2295998090 seq 3914635986 subseq 466957 len 1428 csum 0x5fe6], length 1428
10:53:28.314542 IP 112.26.2.1.37753 > 112.26.2.8.44397: Flags [.], seq 466957:468385, ack 1, win 893, options [nop,nop,TS val 164057 ecr 4294917292,mptcp dss ack 2295998090 seq 3914635986 subseq 466957 len 1428 csum 0x5fe6], length 1428
10:53:28.366663 IP 112.26.2.8.44397 > 112.26.2.1.37753: Flags [.], ack 455533, win 24078, options [nop,nop,TS val 4294918208 ecr 163113,nop,nop,sack 2 {456961:471241}{472669:478381},mptcp dss ack 3914590290], length 0
10:53:28.374757 IP 112.26.2.8.44397 > 112.26.2.1.37753: Flags [.], ack 455533, win 24078, options [nop,nop,TS val 4294918208 ecr 163113,nop,nop,sack 2 {456961:471241}{472669:478381},mptcp dss ack 3914590290], length 0
10:53:28.383705 IP 112.26.2.1.37753 > 112.26.2.8.44397: Flags [.], seq 478381:479809, ack 1, win 893, options [nop,nop,TS val 165011 ecr 4294918208,mptcp dss ack 2295998090 seq 3914701674 subseq 478381 len 1428 csum 0xe28], length 1428
10:53:28.410281 IP 112.26.2.1.37753 > 112.26.2.8.44397: Flags [.], seq 479809:481237, ack 1, win 893, options [nop,nop,TS val 164235 ecr 4294917428,mptcp dss ack 2295998090 seq 3914711670 subseq 479809 len 1428 csum 0xd389], length 1428
10:53:28.428522 IP 112.26.2.1.37753 > 112.26.2.8.44397: Flags [.], seq 479809:481237, ack 1, win 893, options [nop,nop,TS val 164235 ecr 4294917428,mptcp dss ack 2295998090 seq 3914711670 subseq 479809 len 1428 csum 0xd389], length 1428
10:53:28.470675 IP 112.26.2.8.44397 > 112.26.2.1.37753: Flags [.], ack 455533, win 24078, options [nop,nop,TS val 4294918311 ecr 163113,nop,nop,sack 2 {479809:481237}{456961:471241},mptcp dss ack 3914590290], length 0
10:53:28.478641 IP 112.26.2.8.44397 > 112.26.2.1.37753: Flags [.], ack 455533, win 24078, options [nop,nop,TS val 4294918311 ecr 163113,nop,nop,sack 2 {479809:481237}{456961:471241},mptcp dss ack 3914590290], length 0
10:53:28.522484 IP 112.26.2.1.37753 > 112.26.2.8.44397: Flags [.], seq 488377:489805, ack 1, win 893, options [nop,nop,TS val 165159 ecr 4294918311,mptcp dss ack 2295998090 seq 3914760222 subseq 488377 len 1428 csum 0xae92], length 1428
10:53:28.550180 IP 112.26.2.1.37753 > 112.26.2.8.44397: Flags [.], seq 481237:482665, ack 1, win 893, options [nop,nop,TS val 164407 ecr 4294917649,mptcp dss ack 2295998090 seq 3914714526 subseq 481237 len 1428 csum 0xf3b9], length 1428
10:53:28.563550 IP 112.26.2.1.37753 > 112.26.2.8.44397: Flags [.], seq 481237:482665, ack 1, win 893, options [nop,nop,TS val 164407 ecr 4294917649,mptcp dss ack 2295998090 seq 3914714526 subseq 481237 len 1428 csum 0xf3b9], length 1428
10:53:28.594123 IP 112.26.2.8.44397 > 112.26.2.1.37753: Flags [.], ack 455533, win 24078, options [nop,nop,TS val 4294918449 ecr 163113,nop,nop,sack 2 {479809:482665}{456961:471241},mptcp dss ack 3914590290], length 0
10:53:28.608264 IP 112.26.2.8.44397 > 112.26.2.1.37753: Flags [.], ack 455533, win 24078, options [nop,nop,TS val 4294918449 ecr 163113,nop,nop,sack 2 {479809:482665}{456961:471241},mptcp dss ack 3914590290], length 0
10:53:28.613796 IP 112.26.2.1.37753 > 112.26.2.8.44397: Flags [.], seq 471241:472669, ack 1, win 893, options [nop,nop,TS val 165250 ecr 4294918449,mptcp dss ack 2295998090 seq 3914645982 subseq 471241 len 1428 csum 0xb56a], length 1428
10:53:28.655413 IP 112.26.2.1.37753 > 112.26.2.8.44397: Flags [.], seq 482665:484093, ack 1, win 893, options [nop,nop,TS val 164407 ecr 4294917649,mptcp dss ack 2295998090 seq 3914715954 subseq 482665 len 1428 csum 0x728b], length 1428
10:53:28.659171 IP 112.26.2.1.37753 > 112.26.2.8.44397: Flags [.], seq 482665:484093, ack 1, win 893, options [nop,nop,TS val 164407 ecr 4294917649,mptcp dss ack 2295998090 seq 3914715954 subseq 482665 len 1428 csum 0x728b], length 1428
10:53:28.687277 IP 112.26.2.8.44397 > 112.26.2.1.37753: Flags [.], ack 455533, win 24078, options [nop,nop,TS val 4294918549 ecr 163113,nop,nop,sack 2 {479809:484093}{456961:471241},mptcp dss ack 3914590290], length 0
10:53:28.689600 IP 112.26.2.8.44397 > 112.26.2.1.37753: Flags [.], ack 455533, win 24078, options [nop,nop,TS val 4294918549 ecr 163113,nop,nop,sack 2 {479809:484093}{456961:471241},mptcp dss ack 3914590290], length 0
10:53:28.727728 IP 112.26.2.1.37753 > 112.26.2.8.44397: Flags [.], seq 484093:485521, ack 1, win 893, options [nop,nop,TS val 164407 ecr 4294917649,mptcp dss ack 2295998090 seq 3914717382 subseq 484093 len 1428 csum 0xcb1e], length 1428
10:53:28.730899 IP 112.26.2.1.37753 > 112.26.2.8.44397: Flags [.], seq 489805:491233, ack 1, win 893, options [nop,nop,TS val 165369 ecr 4294918549,mptcp dss ack 2295998090 seq 3914773074 subseq 489805 len 1428 csum 0xbf74], length 1428
10:53:28.759672 IP 112.26.2.1.37753 > 112.26.2.8.44397: Flags [.], seq 484093:485521, ack 1, win 893, options [nop,nop,TS val 164407 ecr 4294917649,mptcp dss ack 2295998090 seq 3914717382 subseq 484093 len 1428 csum 0xcb1e], length 1428
10:53:28.785343 IP 112.26.2.1.37753 > 112.26.2.8.44397: Flags [.], seq 485521:486949, ack 1, win 893, options [nop,nop,TS val 164596 ecr 4294917795,mptcp dss ack 2295998090 seq 3914734518 subseq 485521 len 1428 csum 0x3449], length 1428
10:53:28.808908 IP 112.26.2.8.44397 > 112.26.2.1.37753: Flags [.], ack 455533, win 24078, options [nop,nop,TS val 4294918653 ecr 163113,nop,nop,sack 2 {479809:485521}{456961:471241},mptcp dss ack 3914590290], length 0
10:53:28.810995 IP 112.26.2.8.44397 > 112.26.2.1.37753: Flags [.], ack 455533, win 24078, options [nop,nop,TS val 4294918653 ecr 163113,nop,nop,sack 2 {479809:485521}{456961:471241},mptcp dss ack 3914590290], length 0
10:53:28.852088 IP 112.26.2.1.37753 > 112.26.2.8.44397: Flags [.], seq 491233:492661, ack 1, win 893, options [nop,nop,TS val 165491 ecr 4294918653,mptcp dss ack 2295998090 seq 3914781642 subseq 491233 len 1428 csum 0x9e06], length 1428
10:53:28.876071 IP 112.26.2.1.37753 > 112.26.2.8.44397: Flags [.], seq 455533:456961, ack 1, win 893, options [nop,nop,TS val 164704 ecr 4294917941,mptcp dss ack 2295998090 seq 3914590290 subseq 455533 len 1428 csum 0x6510], length 1428
10:53:28.894565 IP 112.26.2.1.37753 > 112.26.2.8.44397: Flags [.], seq 485521:486949, ack 1, win 893, options [nop,nop,TS val 164596 ecr 4294917795,mptcp dss ack 2295998090 seq 3914734518 subseq 485521 len 1428 csum 0x3449], length 1428
10:53:28.919791 IP 112.26.2.8.44397 > 112.26.2.1.37753: Flags [.], ack 455533, win 24078, options [nop,nop,TS val 4294918788 ecr 163113,nop,nop,sack 2 {479809:486949}{456961:471241},mptcp dss ack 3914590290], length 0
10:53:28.926341 IP 112.26.2.8.44397 > 112.26.2.1.37753: Flags [.], ack 455533, win 24078, options [nop,nop,TS val 4294918788 ecr 163113,nop,nop,sack 2 {479809:486949}{456961:471241},mptcp dss ack 3914590290], length 0
10:53:28.963054 IP 112.26.2.1.37753 > 112.26.2.8.44397: Flags [.], seq 492661:494089, ack 1, win 893, options [nop,nop,TS val 165602 ecr 4294918788,mptcp dss ack 2295998090 seq 3914788782 subseq 492661 len 1428 csum 0x17ac], length 1428
10:53:28.979244 IP 112.26.2.8.44397 > 112.26.2.1.37753: Flags [.], ack 471241, win 23265, options [nop,nop,TS val 4294918869 ecr 164704,nop,nop,sack 2 {479809:486949}{472669:478381},mptcp dss ack 3914645982], length 0
10:53:28.981366 IP 112.26.2.8.44397 > 112.26.2.1.37753: Flags [.], ack 471241, win 23265, options [nop,nop,TS val 4294918869 ecr 164704,nop,nop,sack 2 {479809:486949}{472669:478381},mptcp dss ack 3914645982], length 0
10:53:29.022270 IP 112.26.2.1.37753 > 112.26.2.8.44397: Flags [.], seq 455533:456961, ack 1, win 893, options [nop,nop,TS val 164704 ecr 4294917941,mptcp dss ack 2295998090 seq 3914590290 subseq 455533 len 1428 csum 0x6510], length 1428
10:53:29.048416 IP 112.26.2.1.37753 > 112.26.2.8.44397: Flags [.], seq 494089:495517, ack 1, win 893, options [nop,nop,TS val 165623 ecr 4294918869,mptcp dss ack 2295998090 seq 3914793066 subseq 494089 len 1428 csum 0xa05d], length 1428
10:53:29.050067 IP 112.26.2.1.37753 > 112.26.2.8.44397: Flags [.], seq 486949:488377, ack 1, win 893, options [nop,nop,TS val 164839 ecr 4294918046,mptcp dss ack 2295998090 seq 3914741658 subseq 486949 len 1428 csum 0x71dd], length 1428
10:53:29.086088 IP 112.26.2.1.37753 > 112.26.2.8.44397: Flags [.], seq 486949:488377, ack 1, win 893, options [nop,nop,TS val 164839 ecr 4294918046,mptcp dss ack 2295998090 seq 3914741658 subseq 486949 len 1428 csum 0x71dd], length 1428
10:53:29.098467 IP 112.26.2.8.44397 > 112.26.2.1.37753: Flags [.], ack 471241, win 23862, options [nop,nop,TS val 4294918979 ecr 164704,nop,nop,sack 2 {479809:488377}{472669:478381},mptcp dss ack 3914645982], length 0
10:53:29.116885 IP 112.26.2.1.37753 > 112.26.2.8.44397: Flags [.], seq 495517:496945, ack 1, win 893, options [nop,nop,TS val 165623 ecr 4294918869,mptcp dss ack 2295998090 seq 3914794494 subseq 495517 len 1428 csum 0x3548], length 1428
10:53:29.132758 IP 112.26.2.8.44397 > 112.26.2.1.37753: Flags [.], ack 471241, win 23862, options [nop,nop,TS val 4294918979 ecr 164704,nop,nop,sack 2 {479809:488377}{472669:478381},mptcp dss ack 3914645982], length 0
10:53:29.181721 IP 112.26.2.1.37753 > 112.26.2.8.44397: Flags [.], seq 478381:479809, ack 1, win 893, options [nop,nop,TS val 165011 ecr 4294918208,mptcp dss ack 2295998090 seq 3914701674 subseq 478381 len 1428 csum 0xe28], length 1428
10:53:29.185082 IP 112.26.2.1.37753 > 112.26.2.8.44397: Flags [.], seq 478381:479809, ack 1, win 893, options [nop,nop,TS val 165011 ecr 4294918208,mptcp dss ack 2295998090 seq 3914701674 subseq 478381 len 1428 csum 0xe28], length 1428
10:53:29.214492 IP 112.26.2.1.37753 > 112.26.2.8.44397: Flags [.], seq 496945:498373, ack 1, win 893, options [nop,nop,TS val 165623 ecr 4294918869,mptcp dss ack 2295998090 seq 3914795922 subseq 496945 len 1428 csum 0x4874], length 1428
10:53:29.219429 IP 112.26.2.8.44397 > 112.26.2.1.37753: Flags [.], ack 471241, win 23862, options [nop,nop,TS val 4294919078 ecr 164704,nop,nop,sack 1 {472669:488377},mptcp dss ack 3914645982], length 0
10:53:29.230797 IP 112.26.2.8.44397 > 112.26.2.1.37753: Flags [.], ack 471241, win 23862, options [nop,nop,TS val 4294919078 ecr 164704,nop,nop,sack 1 {472669:488377},mptcp dss ack 3914645982], length 0
10:53:29.286674 IP 112.26.2.1.37753 > 112.26.2.8.44397: Flags [.], seq 498373:499801, ack 1, win 893, options [nop,nop,TS val 165800 ecr 4294918979,mptcp dss ack 2295998090 seq 3914800206 subseq 498373 len 1428 csum 0x3c09], length 1428
10:53:29.313714 IP 112.26.2.1.37753 > 112.26.2.8.44397: Flags [.], seq 488377:489805, ack 1, win 893, options [nop,nop,TS val 165159 ecr 4294918311,mptcp dss ack 2295998090 seq 3914760222 subseq 488377 len 1428 csum 0xae92], length 1428
10:53:29.318195 IP 112.26.2.1.37753 > 112.26.2.8.44397: Flags [.], seq 488377:489805, ack 1, win 893, options [nop,nop,TS val 165159 ecr 4294918311,mptcp dss ack 2295998090 seq 3914760222 subseq 488377 len 1428 csum 0xae92], length 1428
10:53:29.334898 IP 112.26.2.8.44397 > 112.26.2.1.37753: Flags [.], ack 471241, win 23862, options [nop,nop,TS val 4294919211 ecr 164704,nop,nop,sack 1 {472669:489805},mptcp dss ack 3914645982], length 0
10:53:29.336675 IP 112.26.2.8.44397 > 112.26.2.1.37753: Flags [.], ack 471241, win 23862, options [nop,nop,TS val 4294919211 ecr 164704,nop,nop,sack 1 {472669:489805},mptcp dss ack 3914645982], length 0
10:53:29.405285 IP 112.26.2.1.37753 > 112.26.2.8.44397: Flags [.], seq 499801:501229, ack 1, win 893, options [nop,nop,TS val 165897 ecr 4294919078,mptcp dss ack 2295998090 seq 3914804490 subseq 499801 len 1428 csum 0xa64d], length 1428
10:53:29.425437 IP 112.26.2.1.37753 > 112.26.2.8.44397: Flags [.], seq 471241:472669, ack 1, win 893, options [nop,nop,TS val 165250 ecr 4294918449,mptcp dss ack 2295998090 seq 3914645982 subseq 471241 len 1428 csum 0xb56a], length 1428
10:53:29.431932 IP 112.26.2.1.37753 > 112.26.2.8.44397: Flags [.], seq 471241:472669, ack 1, win 893, options [nop,nop,TS val 165250 ecr 4294918449,mptcp dss ack 2295998090 seq 3914645982 subseq 471241 len 1428 csum 0xb56a], length 1428
10:53:29.439788 IP 112.26.2.8.44397 > 112.26.2.1.37753: Flags [.], ack 489805, win 23616, options [nop,nop,TS val 4294919325 ecr 165250,mptcp dss ack 3914707386], length 0
10:53:29.472081 IP 112.26.2.8.44397 > 112.26.2.1.37753: Flags [.], ack 489805, win 23616, options [nop,nop,TS val 4294919325 ecr 165250,mptcp dss ack 3914707386], length 0
10:53:29.523899 IP 112.26.2.1.37753 > 112.26.2.8.44397: Flags [.], seq 501229:502657, ack 1, win 893, options [nop,nop,TS val 166084 ecr 4294919211,mptcp dss ack 2295998090 seq 3914814486 subseq 501229 len 1428 csum 0x72ac], length 1428
10:53:29.568038 IP 112.26.2.1.37753 > 112.26.2.8.44397: Flags [.], seq 489805:491233, ack 1, win 893, options [nop,nop,TS val 165369 ecr 4294918549,mptcp dss ack 2295998090 seq 3914773074 subseq 489805 len 1428 csum 0xbf74], length 1428
10:53:29.574531 IP 112.26.2.1.37753 > 112.26.2.8.44397: Flags [.], seq 489805:491233, ack 1, win 893, options [nop,nop,TS val 165369 ecr 4294918549,mptcp dss ack 2295998090 seq 3914773074 subseq 489805 len 1428 csum 0xbf74], length 1428
10:53:29.580020 IP 112.26.2.8.44397 > 112.26.2.1.37753: Flags [.], ack 491233, win 24275, options [nop,nop,TS val 4294919468 ecr 165369,mptcp dss ack 3914707386], length 0
10:53:29.588834 IP 112.26.2.8.44397 > 112.26.2.1.37753: Flags [.], ack 491233, win 24275, options [nop,nop,TS val 4294919468 ecr 165369,mptcp dss ack 3914707386], length 0
10:53:29.646981 IP 112.26.2.1.37753 > 112.26.2.8.44397: Flags [.], seq 502657:504085, ack 1, win 893, options [nop,nop,TS val 166084 ecr 4294919325,mptcp dss ack 2295998090 seq 3914815914 subseq 502657 len 1428 csum 0x4a46], length 1428
10:53:29.663113 IP 112.26.2.1.37753 > 112.26.2.8.44397: Flags [.], seq 491233:492661, ack 1, win 893, options [nop,nop,TS val 165491 ecr 4294918653,mptcp dss ack 2295998090 seq 3914781642 subseq 491233 len 1428 csum 0x9e06], length 1428
10:53:29.673055 IP 112.26.2.1.37753 > 112.26.2.8.44397: Flags [.], seq 491233:492661, ack 1, win 893, options [nop,nop,TS val 165491 ecr 4294918653,mptcp dss ack 2295998090 seq 3914781642 subseq 491233 len 1428 csum 0x9e06], length 1428
10:53:29.678774 IP 112.26.2.8.44397 > 112.26.2.1.37753: Flags [.], ack 492661, win 24275, options [nop,nop,TS val 4294919560 ecr 165491,mptcp dss ack 3914707386], length 0
10:53:29.685702 IP 112.26.2.8.44397 > 112.26.2.1.37753: Flags [.], ack 492661, win 24275, options [nop,nop,TS val 4294919560 ecr 165491,mptcp dss ack 3914707386], length 0
10:53:29.745677 IP 112.26.2.1.37753 > 112.26.2.8.44397: Flags [.], seq 504085:505513, ack 1, win 893, options [nop,nop,TS val 166084 ecr 4294919325,mptcp dss ack 2295998090 seq 3914817342 subseq 504085 len 1428 csum 0xd1cc], length 1428
10:53:29.798531 IP 112.26.2.1.37753 > 112.26.2.8.44397: Flags [.], seq 505513:506941, ack 1, win 893, options [nop,nop,TS val 166225 ecr 4294919468,mptcp dss ack 2295998090 seq 3914823054 subseq 505513 len 1428 csum 0xc274], length 1428
10:53:29.799758 IP 112.26.2.1.37753 > 112.26.2.8.44397: Flags [.], seq 492661:494089, ack 1, win 893, options [nop,nop,TS val 165602 ecr 4294918788,mptcp dss ack 2295998090 seq 3914788782 subseq 492661 len 1428 csum 0x17ac], length 1428
10:53:29.805773 IP 112.26.2.1.37753 > 112.26.2.8.44397: Flags [.], seq 492661:494089, ack 1, win 893, options [nop,nop,TS val 165602 ecr 4294918788,mptcp dss ack 2295998090 seq 3914788782 subseq 492661 len 1428 csum 0x17ac], length 1428
10:53:29.810052 IP 112.26.2.8.44397 > 112.26.2.1.37753: Flags [.], ack 494089, win 24275, options [nop,nop,TS val 4294919697 ecr 165602,mptcp dss ack 3914707386], length 0
10:53:29.814653 IP 112.26.2.8.44397 > 112.26.2.1.37753: Flags [.], ack 494089, win 24275, options [nop,nop,TS val 4294919697 ecr 165602,mptcp dss ack 3914707386], length 0
10:53:29.878565 IP 112.26.2.1.37753 > 112.26.2.8.44397: Flags [.], seq 506941:508369, ack 1, win 893, options [nop,nop,TS val 166324 ecr 4294919560,mptcp dss ack 2295998090 seq 3914824482 subseq 506941 len 1428 csum 0x4ba9], length 1428
10:53:29.930089 IP 112.26.2.1.37753 > 112.26.2.8.44397: Flags [.], seq 495517:496945, ack 1, win 893, options [nop,nop,TS val 165623 ecr 4294918869,mptcp dss ack 2295998090 seq 3914794494 subseq 495517 len 1428 csum 0x3548], length 1428
10:53:29.933243 IP 112.26.2.1.37753 > 112.26.2.8.44397: Flags [.], seq 495517:496945, ack 1, win 893, options [nop,nop,TS val 165623 ecr 4294918869,mptcp dss ack 2295998090 seq 3914794494 subseq 495517 len 1428 csum 0x3548], length 1428
10:53:29.952288 IP 112.26.2.8.44397 > 112.26.2.1.37753: Flags [.], ack 494089, win 24275, options [nop,nop,TS val 4294919827 ecr 165602,nop,nop,sack 1 {495517:496945},mptcp dss ack 3914707386], length 0
10:53:29.954730 IP 112.26.2.8.44397 > 112.26.2.1.37753: Flags [.], ack 494089, win 24275, options [nop,nop,TS val 4294919827 ecr 165602,nop,nop,sack 1 {495517:496945},mptcp dss ack 3914707386], length 0
10:53:29.959276 IP 112.26.2.1.37753 > 112.26.2.8.44397: Flags [.], seq 508369:509797, ack 1, win 893, options [nop,nop,TS val 166324 ecr 4294919560,mptcp dss ack 2295998090 seq 3914825910 subseq 508369 len 1428 csum 0x28d5], length 1428
10:53:30.033400 IP 112.26.2.1.37753 > 112.26.2.8.44397: Flags [.], seq 509797:511225, ack 1, win 893, options [nop,nop,TS val 166456 ecr 4294919697,mptcp dss ack 2295998090 seq 3914828766 subseq 509797 len 1428 csum 0x53cd], length 1428
10:53:30.046276 IP 112.26.2.1.37753 > 112.26.2.8.44397: Flags [.], seq 496945:498373, ack 1, win 893, options [nop,nop,TS val 165623 ecr 4294918869,mptcp dss ack 2295998090 seq 3914795922 subseq 496945 len 1428 csum 0x4874], length 1428
10:53:30.087945 IP 112.26.2.8.44397 > 112.26.2.1.37753: Flags [.], ack 494089, win 24275, options [nop,nop,TS val 4294919978 ecr 165602,nop,nop,sack 1 {495517:498373},mptcp dss ack 3914707386], length 0
10:53:30.096027 IP 112.26.2.1.37753 > 112.26.2.8.44397: Flags [.], seq 496945:498373, ack 1, win 893, options [nop,nop,TS val 165623 ecr 4294918869,mptcp dss ack 2295998090 seq 3914795922 subseq 496945 len 1428 csum 0x4874], length 1428
10:53:30.097079 IP 112.26.2.8.44397 > 112.26.2.1.37753: Flags [.], ack 494089, win 24275, options [nop,nop,TS val 4294919978 ecr 165602,nop,nop,sack 1 {495517:498373},mptcp dss ack 3914707386], length 0
10:53:30.132263 IP 112.26.2.1.37753 > 112.26.2.8.44397: Flags [.], seq 511225:512653, ack 1, win 893, options [nop,nop,TS val 166608 ecr 4294919827,mptcp dss ack 2295998090 seq 3914831622 subseq 511225 len 1428 csum 0x66a0], length 1428
10:53:30.170671 IP 112.26.2.1.37753 > 112.26.2.8.44397: Flags [.], seq 499801:501229, ack 1, win 893, options [nop,nop,TS val 165897 ecr 4294919078,mptcp dss ack 2295998090 seq 3914804490 subseq 499801 len 1428 csum 0xa64d], length 1428
10:53:30.172565 IP 112.26.2.1.37753 > 112.26.2.8.44397: Flags [.], seq 499801:501229, ack 1, win 893, options [nop,nop,TS val 165897 ecr 4294919078,mptcp dss ack 2295998090 seq 3914804490 subseq 499801 len 1428 csum 0xa64d], length 1428
10:53:30.187854 IP 112.26.2.8.44397 > 112.26.2.1.37753: Flags [.], ack 494089, win 24275, options [nop,nop,TS val 4294920066 ecr 165602,nop,nop,sack 2 {499801:501229}{495517:498373},mptcp dss ack 3914707386], length 0
10:53:30.207252 IP 112.26.2.8.44397 > 112.26.2.1.37753: Flags [.], ack 494089, win 24275, options [nop,nop,TS val 4294920066 ecr 165602,nop,nop,sack 2 {499801:501229}{495517:498373},mptcp dss ack 3914707386], length 0
10:53:30.246942 IP 112.26.2.1.37753 > 112.26.2.8.44397: Flags [.], seq 512653:514081, ack 1, win 893, options [nop,nop,TS val 166786 ecr 4294919978,mptcp dss ack 2295998090 seq 3914843046 subseq 512653 len 1428 csum 0xfe64], length 1428
10:53:30.269710 IP 112.26.2.1.37753 > 112.26.2.8.44397: Flags [.], seq 501229:502657, ack 1, win 893, options [nop,nop,TS val 166084 ecr 4294919211,mptcp dss ack 2295998090 seq 3914814486 subseq 501229 len 1428 csum 0x72ac], length 1428
10:53:30.272867 IP 112.26.2.8.44397 > 112.26.2.1.37753: Flags [.], ack 494089, win 24275, options [nop,nop,TS val 4294920164 ecr 165602,nop,nop,sack 2 {499801:502657}{495517:498373},mptcp dss ack 3914707386], length 0
10:53:30.283899 IP 112.26.2.1.37753 > 112.26.2.8.44397: Flags [.], seq 501229:502657, ack 1, win 893, options [nop,nop,TS val 166084 ecr 4294919211,mptcp dss ack 2295998090 seq 3914814486 subseq 501229 len 1428 csum 0x72ac], length 1428
10:53:30.285683 IP 112.26.2.8.44397 > 112.26.2.1.37753: Flags [.], ack 494089, win 24275, options [nop,nop,TS val 4294920164 ecr 165602,nop,nop,sack 2 {499801:502657}{495517:498373},mptcp dss ack 3914707386], length 0
10:53:30.350937 IP 112.26.2.1.37753 > 112.26.2.8.44397: Flags [.], seq 494089:495517, ack 1, win 893, options [nop,nop,TS val 166821 ecr 4294920066,mptcp dss ack 2295998090 seq 3914793066 subseq 494089 len 1428 csum 0xa05d], length 1428
10:53:30.397767 IP 112.26.2.1.37753 > 112.26.2.8.44397: Flags [.], seq 502657:504085, ack 1, win 893, options [nop,nop,TS val 166084 ecr 4294919325,mptcp dss ack 2295998090 seq 3914815914 subseq 502657 len 1428 csum 0x4a46], length 1428
10:53:30.402644 IP 112.26.2.1.37753 > 112.26.2.8.44397: Flags [.], seq 502657:504085, ack 1, win 893, options [nop,nop,TS val 166084 ecr 4294919325,mptcp dss ack 2295998090 seq 3914815914 subseq 502657 len 1428 csum 0x4a46], length 1428
10:53:30.434660 IP 112.26.2.8.44397 > 112.26.2.1.37753: Flags [.], ack 494089, win 24275, options [nop,nop,TS val 4294920296 ecr 165602,nop,nop,sack 2 {499801:504085}{495517:498373},mptcp dss ack 3914707386], length 0
10:53:30.436789 IP 112.26.2.8.44397 > 112.26.2.1.37753: Flags [.], ack 494089, win 24275, options [nop,nop,TS val 4294920296 ecr 165602,nop,nop,sack 2 {499801:504085}{495517:498373},mptcp dss ack 3914707386], length 0
10:53:30.451397 IP 112.26.2.1.37753 > 112.26.2.8.44397: Flags [.], seq 498373:499801, ack 1, win 893, options [nop,nop,TS val 166921 ecr 4294920164,mptcp dss ack 2295998090 seq 3914800206 subseq 498373 len 1428 csum 0x3c09], length 1428
10:53:30.534668 IP 112.26.2.1.37753 > 112.26.2.8.44397: Flags [.], seq 504085:505513, ack 1, win 893, options [nop,nop,TS val 166084 ecr 4294919325,mptcp dss ack 2295998090 seq 3914817342 subseq 504085 len 1428 csum 0xd1cc], length 1428
10:53:30.537630 IP 112.26.2.1.37753 > 112.26.2.8.44397: Flags [.], seq 504085:505513, ack 1, win 893, options [nop,nop,TS val 166084 ecr 4294919325,mptcp dss ack 2295998090 seq 3914817342 subseq 504085 len 1428 csum 0xd1cc], length 1428
10:53:30.547204 IP 112.26.2.8.44397 > 112.26.2.1.37753: Flags [.], ack 494089, win 24275, options [nop,nop,TS val 4294920431 ecr 165602,nop,nop,sack 2 {499801:505513}{495517:498373},mptcp dss ack 3914707386], length 0
10:53:30.554608 IP 112.26.2.8.44397 > 112.26.2.1.37753: Flags [.], ack 494089, win 24275, options [nop,nop,TS val 4294920431 ecr 165602,nop,nop,sack 2 {499801:505513}{495517:498373},mptcp dss ack 3914707386], length 0
10:53:30.664364 IP 112.26.2.1.37753 > 112.26.2.8.44397: Flags [.], seq 505513:506941, ack 1, win 893, options [nop,nop,TS val 166225 ecr 4294919468,mptcp dss ack 2295998090 seq 3914823054 subseq 505513 len 1428 csum 0xc274], length 1428
10:53:30.674717 IP 112.26.2.1.37753 > 112.26.2.8.44397: Flags [.], seq 505513:506941, ack 1, win 893, options [nop,nop,TS val 166225 ecr 4294919468,mptcp dss ack 2295998090 seq 3914823054 subseq 505513 len 1428 csum 0xc274], length 1428
10:53:30.701786 IP 112.26.2.8.44397 > 112.26.2.1.37753: Flags [.], ack 494089, win 24275, options [nop,nop,TS val 4294920568 ecr 165602,nop,nop,sack 2 {499801:506941}{495517:498373},mptcp dss ack 3914707386], length 0
10:53:30.705891 IP 112.26.2.8.44397 > 112.26.2.1.37753: Flags [.], ack 494089, win 24275, options [nop,nop,TS val 4294920568 ecr 165602,nop,nop,sack 2 {499801:506941}{495517:498373},mptcp dss ack 3914707386], length 0
