10:52:36.434322 IP 112.26.0.1.37753 > 112.26.0.8.47540: Flags [S.], seq 328085945, ack 1638377378, win 28560, options [mss 1460,sackOK,TS val 113064 ecr 4294864994,nop,wscale 7,mptcp capable csum {0xa9600d5f0da32383}], length 0
10:52:36.622483 IP 112.26.0.1.37753 > 112.26.0.8.47540: Flags [S.], seq 328085945, ack 1638377378, win 28560, options [mss 1460,sackOK,TS val 113064 ecr 4294864994,nop,wscale 7,mptcp capable csum {0xa9600d5f0da32383}], length 0
10:52:36.729872 IP 112.26.0.1.37753 > 112.26.0.8.47540: Flags [.], ack 1, win 224, options [nop,nop,TS val 113370 ecr 4294866524,mptcp add-addr id 3 112.26.1.1,mptcp dss ack 2295998090], length 0
10:52:36.749343 IP 112.26.0.1.37753 > 112.26.0.8.47540: Flags [.], ack 1, win 224, options [nop,nop,TS val 113370 ecr 4294866524,mptcp add-addr id 5 112.26.3.1,mptcp dss ack 2295998090], length 0
10:52:36.837703 IP 112.26.0.1.37753 > 112.26.0.8.47540: Flags [.], ack 1, win 224, options [nop,nop,TS val 113370 ecr 4294866524,mptcp add-addr id 6 112.26.2.1,mptcp dss ack 2295998090], length 0
10:52:36.851725 IP 112.26.0.1.37753 > 112.26.0.8.47540: Flags [.], ack 1, win 224, options [nop,nop,TS val 113370 ecr 4294866524,mptcp add-addr id 3 112.26.1.1,mptcp dss ack 2295998090], length 0
10:52:36.863120 IP 112.26.0.1.37753 > 112.26.0.8.47540: Flags [.], seq 1:1429, ack 1, win 224, options [nop,nop,TS val 113376 ecr 4294866524,mptcp dss ack 2295998090 seq 3912698378 subseq 1 len 1428 csum 0x2382], length 1428
10:53:08.851465 IP 112.26.0.8.47540 > 112.26.0.1.37753: Flags [.], ack 346817, win 24112, options [nop,nop,TS val 4294898208 ecr 144187,mptcp dss ack 3913716354], length 0
10:53:08.851641 IP 112.26.0.8.47540 > 112.26.0.1.37753: Flags [.], ack 346817, win 24112, options [nop,nop,TS val 4294898208 ecr 144187,mptcp dss ack 3913716354], length 0
10:53:26.730035 IP 112.26.0.1.37753 > 112.26.0.8.47540: Flags [.], seq 563873:565301, ack 1, win 893, options [nop,nop,TS val 162909 ecr 4294916130,mptcp dss ack 2295998090 seq 3914648838 subseq 563873 len 1428 csum 0x66a3], length 1428
10:53:45.735997 IP 112.26.0.1.37753 > 112.26.0.8.47540: Flags [.], seq 762365:763793, ack 1, win 893, options [nop,nop,TS val 182277 ecr 4294935509,mptcp dss ack 2295998090 seq 3915518490 subseq 762365 len 1428 csum 0x7eb8], length 1428
10:54:01.169389 IP 112.26.0.1.37753 > 112.26.0.8.47540: Flags [.], seq 945149:946577, ack 1, win 893, options [nop,nop,TS val 196952 ecr 4294950177,mptcp dss ack 2295998090 seq 3916193934 subseq 945149 len 1428 csum 0xa2a6], length 1428
10:54:01.203251 IP 112.26.0.8.47540 > 112.26.0.1.37753: Flags [.], ack 925157, win 24289, options [nop,nop,TS val 4294951021 ecr 195580,nop,nop,sack 1 {926585:932297},mptcp dss ack 3916128246], length 0
10:54:01.203502 IP 112.26.0.8.47540 > 112.26.0.1.37753: Flags [.], ack 925157, win 24289, options [nop,nop,TS val 4294951021 ecr 195580,nop,nop,sack 1 {926585:932297},mptcp dss ack 3916128246], length 0
10:54:01.309376 IP 112.26.0.1.37753 > 112.26.0.8.47540: Flags [.], seq 946577:948005, ack 1, win 893, options [nop,nop,TS val 196952 ecr 4294950177,mptcp dss ack 2295998090 seq 3916195362 subseq 946577 len 1428 csum 0x7c4b], length 1428
10:54:01.357177 IP 112.26.0.8.47540 > 112.26.0.1.37753: Flags [.], ack 925157, win 24289, options [nop,nop,TS val 4294951171 ecr 195580,nop,nop,sack 1 {926585:933725},mptcp dss ack 3916128246], length 0
10:54:01.357498 IP 112.26.0.8.47540 > 112.26.0.1.37753: Flags [.], ack 925157, win 24289, options [nop,nop,TS val 4294951171 ecr 195580,nop,nop,sack 1 {926585:933725},mptcp dss ack 3916128246], length 0
10:54:01.401095 IP 112.26.0.1.37753 > 112.26.0.8.47540: Flags [.], seq 948005:949433, ack 1, win 893, options [nop,nop,TS val 197181 ecr 4294950417,mptcp dss ack 2295998090 seq 3916206786 subseq 948005 len 1428 csum 0x908e], length 1428
10:54:01.506957 IP 112.26.0.1.37753 > 112.26.0.8.47540: Flags [.], seq 949433:950861, ack 1, win 893, options [nop,nop,TS val 197181 ecr 4294950417,mptcp dss ack 2295998090 seq 3916208214 subseq 949433 len 1428 csum 0xa2ca], length 1428
10:54:01.514940 IP 112.26.0.8.47540 > 112.26.0.1.37753: Flags [.], ack 925157, win 24289, options [nop,nop,TS val 4294951326 ecr 195580,nop,nop,sack 1 {926585:935153},mptcp dss ack 3916128246], length 0
10:54:01.515251 IP 112.26.0.8.47540 > 112.26.0.1.37753: Flags [.], ack 925157, win 24289, options [nop,nop,TS val 4294951326 ecr 195580,nop,nop,sack 1 {926585:935153},mptcp dss ack 3916128246], length 0
10:54:01.593191 IP 112.26.0.1.37753 > 112.26.0.8.47540: Flags [.], seq 952289:953717, ack 1, win 893, options [nop,nop,TS val 197427 ecr 4294950662,mptcp dss ack 2295998090 seq 3916221066 subseq 952289 len 1428 csum 0x315a], length 1428
10:54:01.643952 IP 112.26.0.8.47540 > 112.26.0.1.37753: Flags [.], ack 925157, win 24289, options [nop,nop,TS val 4294951467 ecr 195580,nop,nop,sack 2 {936581:938009}{926585:935153},mptcp dss ack 3916128246], length 0
10:54:01.644160 IP 112.26.0.8.47540 > 112.26.0.1.37753: Flags [.], ack 925157, win 24289, options [nop,nop,TS val 4294951467 ecr 195580,nop,nop,sack 2 {936581:938009}{926585:935153},mptcp dss ack 3916128246], length 0
10:54:01.665391 IP 112.26.0.1.37753 > 112.26.0.8.47540: Flags [.], seq 953717:955145, ack 1, win 893, options [nop,nop,TS val 197427 ecr 4294950662,mptcp dss ack 2295998090 seq 3916222494 subseq 953717 len 1428 csum 0xeb3d], length 1428
10:54:01.747361 IP 112.26.0.1.37753 > 112.26.0.8.47540: Flags [.], seq 955145:956573, ack 1, win 893, options [nop,nop,TS val 197595 ecr 4294950763,mptcp dss ack 2295998090 seq 3916235346 subseq 955145 len 1428 csum 0x3b63], length 1428
10:54:01.784238 IP 112.26.0.8.47540 > 112.26.0.1.37753: Flags [.], ack 925157, win 24289, options [nop,nop,TS val 4294951606 ecr 195580,nop,nop,sack 2 {939437:940865}{936581:938009},mptcp dss ack 3916128246], length 0
10:54:01.784427 IP 112.26.0.8.47540 > 112.26.0.1.37753: Flags [.], ack 925157, win 24289, options [nop,nop,TS val 4294951606 ecr 195580,nop,nop,sack 2 {939437:940865}{936581:938009},mptcp dss ack 3916128246], length 0
10:54:01.819780 IP 112.26.0.1.37753 > 112.26.0.8.47540: Flags [.], seq 925157:926585, ack 1, win 893, options [nop,nop,TS val 197697 ecr 4294950898,mptcp dss ack 2295998090 seq 3916128246 subseq 925157 len 1428 csum 0x57c7], length 1428
10:54:01.916308 IP 112.26.0.1.37753 > 112.26.0.8.47540: Flags [.], seq 956573:958001, ack 1, win 893, options [nop,nop,TS val 197914 ecr 4294951021,mptcp dss ack 2295998090 seq 3916246770 subseq 956573 len 1428 csum 0xaa14], length 1428
10:54:01.921927 IP 112.26.0.8.47540 > 112.26.0.1.37753: Flags [.], ack 925157, win 24289, options [nop,nop,TS val 4294951809 ecr 195580,nop,nop,sack 2 {942293:943721}{939437:940865},mptcp dss ack 3916128246], length 0
10:54:01.922226 IP 112.26.0.8.47540 > 112.26.0.1.37753: Flags [.], ack 925157, win 24289, options [nop,nop,TS val 4294951809 ecr 195580,nop,nop,sack 2 {942293:943721}{939437:940865},mptcp dss ack 3916128246], length 0
10:54:02.065097 IP 112.26.0.1.37753 > 112.26.0.8.47540: Flags [.], seq 958001:959429, ack 1, win 893, options [nop,nop,TS val 198004 ecr 4294951171,mptcp dss ack 2295998090 seq 3916252482 subseq 958001 len 1428 csum 0xde09], length 1428
10:54:02.075014 IP 112.26.0.8.47540 > 112.26.0.1.37753: Flags [.], ack 925157, win 24289, options [nop,nop,TS val 4294951945 ecr 195580,nop,nop,sack 2 {945149:946577}{942293:943721},mptcp dss ack 3916128246], length 0
10:54:02.075320 IP 112.26.0.8.47540 > 112.26.0.1.37753: Flags [.], ack 925157, win 24289, options [nop,nop,TS val 4294951945 ecr 195580,nop,nop,sack 2 {945149:946577}{942293:943721},mptcp dss ack 3916128246], length 0
10:54:02.116016 IP 112.26.0.1.37753 > 112.26.0.8.47540: Flags [.], seq 935153:936581, ack 1, win 893, options [nop,nop,TS val 198288 ecr 4294951467,mptcp dss ack 2295998090 seq 3916178226 subseq 935153 len 1428 csum 0xed6e], length 1428
10:54:02.187442 IP 112.26.0.8.47540 > 112.26.0.1.37753: Flags [.], ack 925157, win 24289, options [nop,nop,TS val 4294952078 ecr 195580,nop,nop,sack 2 {945149:948005}{942293:943721},mptcp dss ack 3916128246], length 0
10:54:02.187766 IP 112.26.0.8.47540 > 112.26.0.1.37753: Flags [.], ack 925157, win 24289, options [nop,nop,TS val 4294952078 ecr 195580,nop,nop,sack 2 {945149:948005}{942293:943721},mptcp dss ack 3916128246], length 0
10:54:02.249716 IP 112.26.0.1.37753 > 112.26.0.8.47540: Flags [.], seq 938009:939437, ack 1, win 893, options [nop,nop,TS val 198429 ecr 4294951606,mptcp dss ack 2295998090 seq 3916181082 subseq 938009 len 1428 csum 0xed3], length 1428
10:54:02.303805 IP 112.26.0.8.47540 > 112.26.0.1.37753: Flags [.], ack 925157, win 24289, options [nop,nop,TS val 4294952194 ecr 195580,nop,nop,sack 2 {945149:949433}{942293:943721},mptcp dss ack 3916128246], length 0
10:54:02.304152 IP 112.26.0.8.47540 > 112.26.0.1.37753: Flags [.], ack 925157, win 24289, options [nop,nop,TS val 4294952194 ecr 195580,nop,nop,sack 2 {945149:949433}{942293:943721},mptcp dss ack 3916128246], length 0
10:54:02.342709 IP 112.26.0.1.37753 > 112.26.0.8.47540: Flags [.], seq 940865:942293, ack 1, win 893, options [nop,nop,TS val 198718 ecr 4294951945,mptcp dss ack 2295998090 seq 3916183938 subseq 940865 len 1428 csum 0xe38f], length 1428
10:54:02.413681 IP 112.26.0.1.37753 > 112.26.0.8.47540: Flags [.], seq 943721:945149, ack 1, win 893, options [nop,nop,TS val 198832 ecr 4294952078,mptcp dss ack 2295998090 seq 3916192506 subseq 943721 len 1428 csum 0x3f91], length 1428
10:54:02.465383 IP 112.26.0.8.47540 > 112.26.0.1.37753: Flags [.], ack 925157, win 24289, options [nop,nop,TS val 4294952318 ecr 195580,nop,nop,sack 2 {952289:953717}{945149:949433},mptcp dss ack 3916128246], length 0
10:54:02.465638 IP 112.26.0.8.47540 > 112.26.0.1.37753: Flags [.], ack 925157, win 24289, options [nop,nop,TS val 4294952318 ecr 195580,nop,nop,sack 2 {952289:953717}{945149:949433},mptcp dss ack 3916128246], length 0
10:54:02.530816 IP 112.26.0.1.37753 > 112.26.0.8.47540: Flags [.], seq 959429:960857, ack 1, win 893, options [nop,nop,TS val 198963 ecr 4294952194,mptcp dss ack 2295998090 seq 3916276758 subseq 959429 len 1428 csum 0xc7d], length 1428
10:54:02.540110 IP 112.26.0.8.47540 > 112.26.0.1.37753: Flags [.], ack 925157, win 24289, options [nop,nop,TS val 4294952429 ecr 195580,nop,nop,sack 2 {952289:955145}{945149:949433},mptcp dss ack 3916128246], length 0
10:54:02.540429 IP 112.26.0.8.47540 > 112.26.0.1.37753: Flags [.], ack 925157, win 24289, options [nop,nop,TS val 4294952429 ecr 195580,nop,nop,sack 2 {952289:955145}{945149:949433},mptcp dss ack 3916128246], length 0
10:54:02.635125 IP 112.26.0.1.37753 > 112.26.0.8.47540: Flags [.], seq 949433:950861, ack 1, win 893, options [nop,nop,TS val 199108 ecr 4294952318,mptcp dss ack 2295998090 seq 3916208214 subseq 949433 len 1428 csum 0xa2ca], length 1428
10:54:02.697042 IP 112.26.0.8.47540 > 112.26.0.1.37753: Flags [.], ack 935153, win 23509, options [nop,nop,TS val 4294952570 ecr 197697,nop,nop,sack 2 {952289:955145}{945149:949433},mptcp dss ack 3916178226], length 0
10:54:02.697357 IP 112.26.0.8.47540 > 112.26.0.1.37753: Flags [.], ack 935153, win 23509, options [nop,nop,TS val 4294952570 ecr 197697,nop,nop,sack 2 {952289:955145}{945149:949433},mptcp dss ack 3916178226], length 0
10:54:02.733619 IP 112.26.0.1.37753 > 112.26.0.8.47540: Flags [.], seq 950861:952289, ack 1, win 893, options [nop,nop,TS val 199214 ecr 4294952429,mptcp dss ack 2295998090 seq 3916209642 subseq 950861 len 1428 csum 0x840d], length 1428
10:54:02.810854 IP 112.26.0.1.37753 > 112.26.0.8.47540: Flags [.], seq 955145:956573, ack 1, win 893, options [nop,nop,TS val 199341 ecr 4294952570,mptcp dss ack 2295998090 seq 3916235346 subseq 955145 len 1428 csum 0x3b63], length 1428
10:54:02.834472 IP 112.26.0.8.47540 > 112.26.0.1.37753: Flags [.], ack 935153, win 23976, options [nop,nop,TS val 4294952723 ecr 197697,nop,nop,sack 2 {956573:958001}{952289:955145},mptcp dss ack 3916178226], length 0
10:54:02.834811 IP 112.26.0.8.47540 > 112.26.0.1.37753: Flags [.], ack 935153, win 23976, options [nop,nop,TS val 4294952723 ecr 197697,nop,nop,sack 2 {956573:958001}{952289:955145},mptcp dss ack 3916178226], length 0
10:54:02.890964 IP 112.26.0.1.37753 > 112.26.0.8.47540: Flags [.], seq 960857:962285, ack 1, win 893, options [nop,nop,TS val 199341 ecr 4294952570,mptcp dss ack 2295998090 seq 3916295322 subseq 960857 len 1428 csum 0xb517], length 1428
10:54:02.968467 IP 112.26.0.1.37753 > 112.26.0.8.47540: Flags [.], seq 962285:963713, ack 1, win 893, options [nop,nop,TS val 199341 ecr 4294952570,mptcp dss ack 2295998090 seq 3916296750 subseq 962285 len 1428 csum 0xf649], length 1428
10:54:02.983793 IP 112.26.0.8.47540 > 112.26.0.1.37753: Flags [.], ack 938009, win 23932, options [nop,nop,TS val 4294952859 ecr 198288,nop,nop,sack 2 {956573:958001}{952289:955145},mptcp dss ack 3916181082], length 0
10:54:02.984009 IP 112.26.0.8.47540 > 112.26.0.1.37753: Flags [.], ack 938009, win 23932, options [nop,nop,TS val 4294952859 ecr 198288,nop,nop,sack 2 {956573:958001}{952289:955145},mptcp dss ack 3916181082], length 0
10:54:03.067758 IP 112.26.0.1.37753 > 112.26.0.8.47540: Flags [.], seq 963713:965141, ack 1, win 893, options [nop,nop,TS val 199341 ecr 4294952570,mptcp dss ack 2295998090 seq 3916298178 subseq 963713 len 1428 csum 0x7dae], length 1428
10:54:03.109503 IP 112.26.0.8.47540 > 112.26.0.1.37753: Flags [.], ack 940865, win 23888, options [nop,nop,TS val 4294952963 ecr 198429,nop,nop,sack 2 {956573:958001}{952289:955145},mptcp dss ack 3916183938], length 0
10:54:03.109825 IP 112.26.0.8.47540 > 112.26.0.1.37753: Flags [.], ack 940865, win 23888, options [nop,nop,TS val 4294952963 ecr 198429,nop,nop,sack 2 {956573:958001}{952289:955145},mptcp dss ack 3916183938], length 0
10:54:03.136790 IP 112.26.0.1.37753 > 112.26.0.8.47540: Flags [.], seq 965141:966569, ack 1, win 893, options [nop,nop,TS val 199512 ecr 4294952723,mptcp dss ack 2295998090 seq 3916302462 subseq 965141 len 1428 csum 0x3ff3], length 1428
10:54:03.195539 IP 112.26.0.1.37753 > 112.26.0.8.47540: Flags [.], seq 958001:959429, ack 1, win 893, options [nop,nop,TS val 199628 ecr 4294952859,mptcp dss ack 2295998090 seq 3916252482 subseq 958001 len 1428 csum 0xde09], length 1428
10:54:03.214429 IP 112.26.0.8.47540 > 112.26.0.1.37753: Flags [.], ack 943721, win 23790, options [nop,nop,TS val 4294953101 ecr 198718,nop,nop,sack 2 {956573:958001}{952289:955145},mptcp dss ack 3916192506], length 0
10:54:03.214774 IP 112.26.0.8.47540 > 112.26.0.1.37753: Flags [.], ack 943721, win 23790, options [nop,nop,TS val 4294953101 ecr 198718,nop,nop,sack 2 {956573:958001}{952289:955145},mptcp dss ack 3916192506], length 0
10:54:03.260798 IP 112.26.0.1.37753 > 112.26.0.8.47540: Flags [.], seq 966569:967997, ack 1, win 893, options [nop,nop,TS val 199628 ecr 4294952859,mptcp dss ack 2295998090 seq 3916311030 subseq 966569 len 1428 csum 0xd2b7], length 1428
10:54:03.393639 IP 112.26.0.8.47540 > 112.26.0.1.37753: Flags [.], ack 943721, win 23886, options [nop,nop,TS val 4294953267 ecr 198718,nop,nop,sack 2 {959429:960857}{956573:958001},mptcp dss ack 3916192506], length 0
10:54:03.393915 IP 112.26.0.8.47540 > 112.26.0.1.37753: Flags [.], ack 943721, win 23886, options [nop,nop,TS val 4294953267 ecr 198718,nop,nop,sack 2 {959429:960857}{956573:958001},mptcp dss ack 3916192506], length 0
10:54:03.404054 IP 112.26.0.1.37753 > 112.26.0.8.47540: Flags [.], seq 967997:969425, ack 1, win 893, options [nop,nop,TS val 199752 ecr 4294952963,mptcp dss ack 2295998090 seq 3916316742 subseq 967997 len 1428 csum 0xe0d2], length 1428
10:54:03.473322 IP 112.26.0.1.37753 > 112.26.0.8.47540: Flags [.], seq 969425:970853, ack 1, win 893, options [nop,nop,TS val 199752 ecr 4294952963,mptcp dss ack 2295998090 seq 3916318170 subseq 969425 len 1428 csum 0xc9ca], length 1428
10:54:03.539730 IP 112.26.0.8.47540 > 112.26.0.1.37753: Flags [.], ack 943721, win 23886, options [nop,nop,TS val 4294953409 ecr 198718,nop,nop,sack 2 {945149:950861}{959429:960857},mptcp dss ack 3916192506], length 0
10:54:03.539953 IP 112.26.0.8.47540 > 112.26.0.1.37753: Flags [.], ack 943721, win 23886, options [nop,nop,TS val 4294953409 ecr 198718,nop,nop,sack 2 {945149:950861}{959429:960857},mptcp dss ack 3916192506], length 0
10:54:03.572110 IP 112.26.0.1.37753 > 112.26.0.8.47540: Flags [.], seq 970853:972281, ack 1, win 893, options [nop,nop,TS val 199874 ecr 4294953101,mptcp dss ack 2295998090 seq 3916323882 subseq 970853 len 1428 csum 0x6de5], length 1428
10:54:03.671532 IP 112.26.0.8.47540 > 112.26.0.1.37753: Flags [.], ack 943721, win 23886, options [nop,nop,TS val 4294953518 ecr 198718,nop,nop,sack 2 {945149:955145}{959429:960857},mptcp dss ack 3916192506], length 0
10:54:03.671880 IP 112.26.0.8.47540 > 112.26.0.1.37753: Flags [.], ack 943721, win 23886, options [nop,nop,TS val 4294953518 ecr 198718,nop,nop,sack 2 {945149:955145}{959429:960857},mptcp dss ack 3916192506], length 0
10:54:03.730743 IP 112.26.0.1.37753 > 112.26.0.8.47540: Flags [.], seq 943721:945149, ack 1, win 893, options [nop,nop,TS val 200038 ecr 4294953267,mptcp dss ack 2295998090 seq 3916192506 subseq 943721 len 1428 csum 0x3f91], length 1428
10:54:03.799795 IP 112.26.0.1.37753 > 112.26.0.8.47540: Flags [.], seq 972281:973709, ack 1, win 893, options [nop,nop,TS val 200188 ecr 4294953409,mptcp dss ack 2295998090 seq 3916339590 subseq 972281 len 1428 csum 0x5d54], length 1428
10:54:03.857390 IP 112.26.0.8.47540 > 112.26.0.1.37753: Flags [.], ack 943721, win 23886, options [nop,nop,TS val 4294953624 ecr 198718,nop,nop,sack 2 {945149:958001}{959429:960857},mptcp dss ack 3916192506], length 0
10:54:03.857731 IP 112.26.0.8.47540 > 112.26.0.1.37753: Flags [.], ack 943721, win 23886, options [nop,nop,TS val 4294953624 ecr 198718,nop,nop,sack 2 {945149:958001}{959429:960857},mptcp dss ack 3916192506], length 0
10:54:03.913791 IP 112.26.0.1.37753 > 112.26.0.8.47540: Flags [.], seq 973709:975137, ack 1, win 893, options [nop,nop,TS val 200340 ecr 4294953518,mptcp dss ack 2295998090 seq 3916348158 subseq 973709 len 1428 csum 0x66a3], length 1428
10:54:03.973943 IP 112.26.0.8.47540 > 112.26.0.1.37753: Flags [.], ack 943721, win 23886, options [nop,nop,TS val 4294953724 ecr 198718,nop,nop,sack 2 {962285:963713}{945149:958001},mptcp dss ack 3916192506], length 0
10:54:03.974217 IP 112.26.0.8.47540 > 112.26.0.1.37753: Flags [.], ack 943721, win 23886, options [nop,nop,TS val 4294953724 ecr 198718,nop,nop,sack 2 {962285:963713}{945149:958001},mptcp dss ack 3916192506], length 0
10:54:03.986842 IP 112.26.0.1.37753 > 112.26.0.8.47540: Flags [.], seq 975137:976565, ack 1, win 893, options [nop,nop,TS val 200620 ecr 4294953624,mptcp dss ack 2295998090 seq 3916355298 subseq 975137 len 1428 csum 0x452f], length 1428
10:54:04.062964 IP 112.26.0.1.37753 > 112.26.0.8.47540: Flags [.], seq 960857:962285, ack 1, win 893, options [nop,nop,TS val 200620 ecr 4294953724,mptcp dss ack 2295998090 seq 3916295322 subseq 960857 len 1428 csum 0xb517], length 1428
10:54:04.096427 IP 112.26.0.8.47540 > 112.26.0.1.37753: Flags [.], ack 943721, win 23886, options [nop,nop,TS val 4294953841 ecr 198718,nop,nop,sack 2 {962285:965141}{945149:958001},mptcp dss ack 3916192506], length 0
10:54:04.096750 IP 112.26.0.8.47540 > 112.26.0.1.37753: Flags [.], ack 943721, win 23886, options [nop,nop,TS val 4294953841 ecr 198718,nop,nop,sack 2 {962285:965141}{945149:958001},mptcp dss ack 3916192506], length 0
10:54:04.141867 IP 112.26.0.1.37753 > 112.26.0.8.47540: Flags [.], seq 976565:977993, ack 1, win 893, options [nop,nop,TS val 200758 ecr 4294953841,mptcp dss ack 2295998090 seq 3916362438 subseq 976565 len 1428 csum 0x4ea9], length 1428
10:54:04.174187 IP 112.26.0.8.47540 > 112.26.0.1.37753: Flags [.], ack 943721, win 23886, options [nop,nop,TS val 4294954020 ecr 198718,nop,nop,sack 2 {962285:966569}{945149:958001},mptcp dss ack 3916192506], length 0
10:54:04.174513 IP 112.26.0.8.47540 > 112.26.0.1.37753: Flags [.], ack 943721, win 23886, options [nop,nop,TS val 4294954020 ecr 198718,nop,nop,sack 2 {962285:966569}{945149:958001},mptcp dss ack 3916192506], length 0
10:54:04.298732 IP 112.26.0.8.47540 > 112.26.0.1.37753: Flags [.], ack 943721, win 23886, options [nop,nop,TS val 4294954158 ecr 198718,nop,nop,sack 2 {967997:969425}{962285:966569},mptcp dss ack 3916192506], length 0
10:54:04.299059 IP 112.26.0.8.47540 > 112.26.0.1.37753: Flags [.], ack 943721, win 23886, options [nop,nop,TS val 4294954158 ecr 198718,nop,nop,sack 2 {967997:969425}{962285:966569},mptcp dss ack 3916192506], length 0
10:54:04.309667 IP 112.26.0.1.37753 > 112.26.0.8.47540: Flags [.], seq 977993:979421, ack 1, win 893, options [nop,nop,TS val 200941 ecr 4294954020,mptcp dss ack 2295998090 seq 3916372434 subseq 977993 len 1428 csum 0xcb7e], length 1428
10:54:04.416958 IP 112.26.0.1.37753 > 112.26.0.8.47540: Flags [.], seq 958001:959429, ack 1, win 893, options [nop,nop,TS val 200941 ecr 4294954158,mptcp dss ack 2295998090 seq 3916252482 subseq 958001 len 1428 csum 0xde09], length 1428
10:54:04.474516 IP 112.26.0.8.47540 > 112.26.0.1.37753: Flags [.], ack 943721, win 23886, options [nop,nop,TS val 4294954250 ecr 198718,nop,nop,sack 2 {967997:970853}{962285:966569},mptcp dss ack 3916192506], length 0
10:54:04.474873 IP 112.26.0.8.47540 > 112.26.0.1.37753: Flags [.], ack 943721, win 23886, options [nop,nop,TS val 4294954250 ecr 198718,nop,nop,sack 2 {967997:970853}{962285:966569},mptcp dss ack 3916192506], length 0
10:54:04.511077 IP 112.26.0.1.37753 > 112.26.0.8.47540: Flags [.], seq 966569:967997, ack 1, win 893, options [nop,nop,TS val 201118 ecr 4294954250,mptcp dss ack 2295998090 seq 3916311030 subseq 966569 len 1428 csum 0xd2b7], length 1428
10:54:04.528922 IP 112.26.0.8.47540 > 112.26.0.1.37753: Flags [.], ack 943721, win 23886, options [nop,nop,TS val 4294954418 ecr 198718,nop,nop,sack 2 {967997:972281}{962285:966569},mptcp dss ack 3916192506], length 0
10:54:04.529250 IP 112.26.0.8.47540 > 112.26.0.1.37753: Flags [.], ack 943721, win 23886, options [nop,nop,TS val 4294954418 ecr 198718,nop,nop,sack 2 {967997:972281}{962285:966569},mptcp dss ack 3916192506], length 0
10:54:04.629688 IP 112.26.0.1.37753 > 112.26.0.8.47540: Flags [.], seq 979421:980849, ack 1, win 893, options [nop,nop,TS val 201207 ecr 4294954418,mptcp dss ack 2295998090 seq 3916382430 subseq 979421 len 1428 csum 0xcc5e], length 1428
10:54:04.650277 IP 112.26.0.8.47540 > 112.26.0.1.37753: Flags [.], ack 958001, win 23095, options [nop,nop,TS val 4294954535 ecr 200038,nop,nop,sack 2 {967997:972281}{962285:966569},mptcp dss ack 3916252482], length 0
10:54:04.650619 IP 112.26.0.8.47540 > 112.26.0.1.37753: Flags [.], ack 958001, win 23095, options [nop,nop,TS val 4294954535 ecr 200038,nop,nop,sack 2 {967997:972281}{962285:966569},mptcp dss ack 3916252482], length 0
10:54:04.727548 IP 112.26.0.1.37753 > 112.26.0.8.47540: Flags [.], seq 980849:982277, ack 1, win 893, options [nop,nop,TS val 201293 ecr 4294954535,mptcp dss ack 2295998090 seq 3916386714 subseq 980849 len 1428 csum 0xc9bb], length 1428
10:54:04.768814 IP 112.26.0.8.47540 > 112.26.0.1.37753: Flags [.], ack 958001, win 23736, options [nop,nop,TS val 4294954653 ecr 200038,nop,nop,sack 2 {967997:973709}{962285:966569},mptcp dss ack 3916252482], length 0
10:54:04.769129 IP 112.26.0.8.47540 > 112.26.0.1.37753: Flags [.], ack 958001, win 23736, options [nop,nop,TS val 4294954653 ecr 200038,nop,nop,sack 2 {967997:973709}{962285:966569},mptcp dss ack 3916252482], length 0
10:54:04.915078 IP 112.26.0.8.47540 > 112.26.0.1.37753: Flags [.], ack 958001, win 23736, options [nop,nop,TS val 4294954743 ecr 200038,nop,nop,sack 2 {967997:975137}{962285:966569},mptcp dss ack 3916252482], length 0
10:54:04.915402 IP 112.26.0.8.47540 > 112.26.0.1.37753: Flags [.], ack 958001, win 23736, options [nop,nop,TS val 4294954743 ecr 200038,nop,nop,sack 2 {967997:975137}{962285:966569},mptcp dss ack 3916252482], length 0
10:54:05.005173 IP 112.26.0.8.47540 > 112.26.0.1.37753: Flags [.], ack 958001, win 23736, options [nop,nop,TS val 4294954835 ecr 200038,nop,nop,sack 2 {967997:976565}{962285:966569},mptcp dss ack 3916252482], length 0
10:54:05.005497 IP 112.26.0.8.47540 > 112.26.0.1.37753: Flags [.], ack 958001, win 23736, options [nop,nop,TS val 4294954835 ecr 200038,nop,nop,sack 2 {967997:976565}{962285:966569},mptcp dss ack 3916252482], length 0
10:54:05.108825 IP 112.26.0.8.47540 > 112.26.0.1.37753: Flags [.], ack 958001, win 23736, options [nop,nop,TS val 4294954945 ecr 200038,nop,nop,sack 2 {967997:977993}{962285:966569},mptcp dss ack 3916252482], length 0
10:54:05.109129 IP 112.26.0.8.47540 > 112.26.0.1.37753: Flags [.], ack 958001, win 23736, options [nop,nop,TS val 4294954945 ecr 200038,nop,nop,sack 2 {967997:977993}{962285:966569},mptcp dss ack 3916252482], length 0
10:54:05.113467 IP 112.26.0.1.37753 > 112.26.0.8.47540: Flags [.], seq 960857:962285, ack 1, win 893, options [nop,nop,TS val 201753 ecr 4294954945,mptcp dss ack 2295998090 seq 3916295322 subseq 960857 len 1428 csum 0xb517], length 1428
10:54:05.237409 IP 112.26.0.8.47540 > 112.26.0.1.37753: Flags [.], ack 958001, win 23736, options [nop,nop,TS val 4294955031 ecr 200038,nop,nop,sack 2 {967997:979421}{962285:966569},mptcp dss ack 3916252482], length 0
10:54:05.237744 IP 112.26.0.8.47540 > 112.26.0.1.37753: Flags [.], ack 958001, win 23736, options [nop,nop,TS val 4294955031 ecr 200038,nop,nop,sack 2 {967997:979421}{962285:966569},mptcp dss ack 3916252482], length 0
10:54:05.375581 IP 112.26.0.8.47540 > 112.26.0.1.37753: Flags [.], ack 960857, win 23550, options [nop,nop,TS val 4294955160 ecr 200941,nop,nop,sack 2 {967997:979421}{962285:966569},mptcp dss ack 3916295322], length 0
10:54:05.375924 IP 112.26.0.8.47540 > 112.26.0.1.37753: Flags [.], ack 960857, win 23550, options [nop,nop,TS val 4294955160 ecr 200941,nop,nop,sack 2 {967997:979421}{962285:966569},mptcp dss ack 3916295322], length 0
10:54:05.446785 IP 112.26.0.8.47540 > 112.26.0.1.37753: Flags [.], ack 960857, win 24004, options [nop,nop,TS val 4294955255 ecr 200941,nop,nop,sack 1 {962285:979421},mptcp dss ack 3916295322], length 0
10:54:05.447100 IP 112.26.0.8.47540 > 112.26.0.1.37753: Flags [.], ack 960857, win 24004, options [nop,nop,TS val 4294955255 ecr 200941,nop,nop,sack 1 {962285:979421},mptcp dss ack 3916295322], length 0
10:54:05.537121 IP 112.26.0.8.47540 > 112.26.0.1.37753: Flags [.], ack 960857, win 24004, options [nop,nop,TS val 4294955357 ecr 200941,nop,nop,sack 1 {962285:980849},mptcp dss ack 3916295322], length 0
10:54:05.537390 IP 112.26.0.8.47540 > 112.26.0.1.37753: Flags [.], ack 960857, win 24004, options [nop,nop,TS val 4294955357 ecr 200941,nop,nop,sack 1 {962285:980849},mptcp dss ack 3916295322], length 0
10:54:05.633626 IP 112.26.0.8.47540 > 112.26.0.1.37753: Flags [.], ack 960857, win 24004, options [nop,nop,TS val 4294955417 ecr 200941,nop,nop,sack 1 {962285:982277},mptcp dss ack 3916295322], length 0
10:54:05.633955 IP 112.26.0.8.47540 > 112.26.0.1.37753: Flags [.], ack 960857, win 24004, options [nop,nop,TS val 4294955417 ecr 200941,nop,nop,sack 1 {962285:982277},mptcp dss ack 3916295322], length 0
10:54:05.687997 IP 112.26.0.8.47540 > 112.26.0.1.37753: Flags [.], ack 982277, win 23632, options [nop,nop,TS val 4294955507 ecr 201753,mptcp dss ack 3916335306], length 0
10:54:05.688343 IP 112.26.0.8.47540 > 112.26.0.1.37753: Flags [.], ack 982277, win 23632, options [nop,nop,TS val 4294955507 ecr 201753,mptcp dss ack 3916335306], length 0
10:54:05.746825 IP 112.26.0.1.37753 > 112.26.0.8.47540: Flags [F.], seq 982277, ack 1, win 893, options [nop,nop,TS val 202385 ecr 4294955507,mptcp dss ack 2295998090], length 0
10:54:05.803457 IP 112.26.0.8.47540 > 112.26.0.1.37753: Flags [.], ack 982278, win 24576, options [nop,nop,TS val 4294955692 ecr 202385,mptcp dss ack 3916393019], length 0
10:54:05.803762 IP 112.26.0.8.47540 > 112.26.0.1.37753: Flags [.], ack 982278, win 24576, options [nop,nop,TS val 4294955692 ecr 202385,mptcp dss ack 3916393019], length 0
10:54:05.946357 IP 112.26.0.8.47540 > 112.26.0.1.37753: Flags [F.], seq 1, ack 982278, win 24576, options [nop,nop,TS val 4294955779 ecr 202385,mptcp dss ack 3916393019], length 0
10:54:05.946755 IP 112.26.0.8.47540 > 112.26.0.1.37753: Flags [F.], seq 1, ack 982278, win 24576, options [nop,nop,TS val 4294955779 ecr 202385,mptcp dss ack 3916393019], length 0
10:54:05.951425 IP 112.26.0.1.37753 > 112.26.0.8.47540: Flags [.], ack 2, win 893, options [nop,nop,TS val 202590 ecr 4294955779,mptcp dss ack 2295998091], length 0

