10:52:44.171144 IP 112.26.2.8.44397 > 112.26.2.1.37753: Flags [S], seq 2791519187, win 65535, options [mss 1460,sackOK,TS val 4294873967 ecr 0,nop,wscale 6,mptcp join id 4 token 0xd15e4cde nonce 0x156fce22], length 0
10:52:44.231798 IP 112.26.2.8.44397 > 112.26.2.1.37753: Flags [S], seq 2791519187, win 65535, options [mss 1460,sackOK,TS val 4294873967 ecr 0,nop,wscale 6,mptcp join id 4 token 0xd15e4cde nonce 0x156fce22], length 0
10:52:44.266860 IP 112.26.2.1.37753 > 112.26.2.8.44397: Flags [S.], seq 1823757429, ack 2791519188, win 28560, options [mss 1460,sackOK,TS val 120874 ecr 4294873967,nop,wscale 7,mptcp join id 6 hmac 0x9180a648a613b37a nonce 0x4f6f39cd], length 0
10:52:44.485596 IP 112.26.2.8.44397 > 112.26.2.1.37753: Flags [.], ack 1, win 5612, options [nop,nop,TS val 4294874303 ecr 120874,mptcp join hmac 0xaeeb9b2491d3cee2f82d2bbe89c74c4650f6fe81], length 0
10:52:44.485823 IP 112.26.2.8.44397 > 112.26.2.1.37753: Flags [.], ack 1, win 5612, options [nop,nop,TS val 4294874303 ecr 120874,mptcp join hmac 0xaeeb9b2491d3cee2f82d2bbe89c74c4650f6fe81], length 0
10:52:44.506164 IP 112.26.2.1.37753 > 112.26.2.8.44397: Flags [.], ack 1, win 447, options [nop,nop,TS val 121129 ecr 4294874303,mptcp dss ack 2295998090], length 0
10:52:44.563093 IP 112.26.2.1.37753 > 112.26.2.8.44397: Flags [.], seq 1:1429, ack 1, win 447, options [nop,nop,TS val 121129 ecr 4294874303,mptcp dss ack 2295998090 seq 3912803862 subseq 1 len 1428 csum 0xa4a], length 1428
10:53:26.855625 IP 112.26.2.8.44397 > 112.26.2.1.37753: Flags [.], ack 448393, win 24418, options [nop,nop,TS val 4294916738 ecr 161681,nop,nop,sack 2 {456961:461245}{449821:455533},mptcp dss ack 3914563158], length 0
10:53:26.855944 IP 112.26.2.8.44397 > 112.26.2.1.37753: Flags [.], ack 448393, win 24418, options [nop,nop,TS val 4294916738 ecr 161681,nop,nop,sack 2 {456961:461245}{449821:455533},mptcp dss ack 3914563158], length 0
10:53:26.878801 IP 112.26.2.1.37753 > 112.26.2.8.44397: Flags [.], seq 472669:474097, ack 1, win 893, options [nop,nop,TS val 163017 ecr 4294916219,mptcp dss ack 2295998090 seq 3914651694 subseq 472669 len 1428 csum 0x7976], length 1428
10:53:26.951489 IP 112.26.2.1.37753 > 112.26.2.8.44397: Flags [.], seq 448393:449821, ack 1, win 893, options [nop,nop,TS val 163113 ecr 4294916348,mptcp dss ack 2295998090 seq 3914571726 subseq 448393 len 1428 csum 0x8b08], length 1428
10:53:26.963965 IP 112.26.2.8.44397 > 112.26.2.1.37753: Flags [.], ack 448393, win 24418, options [nop,nop,TS val 4294916853 ecr 161681,nop,nop,sack 2 {456961:462673}{449821:455533},mptcp dss ack 3914563158], length 0
10:53:26.964275 IP 112.26.2.8.44397 > 112.26.2.1.37753: Flags [.], ack 448393, win 24418, options [nop,nop,TS val 4294916853 ecr 161681,nop,nop,sack 2 {456961:462673}{449821:455533},mptcp dss ack 3914563158], length 0
10:53:27.057199 IP 112.26.2.1.37753 > 112.26.2.8.44397: Flags [.], seq 474097:475525, ack 1, win 893, options [nop,nop,TS val 163274 ecr 4294916421,mptcp dss ack 2295998090 seq 3914665974 subseq 474097 len 1428 csum 0x39e9], length 1428
10:53:27.090454 IP 112.26.2.8.44397 > 112.26.2.1.37753: Flags [.], ack 448393, win 24418, options [nop,nop,TS val 4294916953 ecr 161681,nop,nop,sack 2 {456961:464101}{449821:455533},mptcp dss ack 3914563158], length 0
10:53:27.090766 IP 112.26.2.8.44397 > 112.26.2.1.37753: Flags [.], ack 448393, win 24418, options [nop,nop,TS val 4294916953 ecr 161681,nop,nop,sack 2 {456961:464101}{449821:455533},mptcp dss ack 3914563158], length 0
10:53:27.141052 IP 112.26.2.1.37753 > 112.26.2.8.44397: Flags [.], seq 455533:456961, ack 1, win 893, options [nop,nop,TS val 163318 ecr 4294916508,mptcp dss ack 2295998090 seq 3914590290 subseq 455533 len 1428 csum 0x6510], length 1428
10:53:27.203533 IP 112.26.2.8.44397 > 112.26.2.1.37753: Flags [.], ack 448393, win 24418, options [nop,nop,TS val 4294917035 ecr 161681,nop,nop,sack 2 {456961:465529}{449821:455533},mptcp dss ack 3914563158], length 0
10:53:27.203768 IP 112.26.2.8.44397 > 112.26.2.1.37753: Flags [.], ack 448393, win 24418, options [nop,nop,TS val 4294917035 ecr 161681,nop,nop,sack 2 {456961:465529}{449821:455533},mptcp dss ack 3914563158], length 0
10:53:27.235807 IP 112.26.2.1.37753 > 112.26.2.8.44397: Flags [.], seq 475525:476953, ack 1, win 893, options [nop,nop,TS val 163569 ecr 4294916738,mptcp dss ack 2295998090 seq 3914675970 subseq 475525 len 1428 csum 0x4b52], length 1428
10:53:27.315940 IP 112.26.2.8.44397 > 112.26.2.1.37753: Flags [.], ack 448393, win 24418, options [nop,nop,TS val 4294917170 ecr 161681,nop,nop,sack 2 {456961:466957}{449821:455533},mptcp dss ack 3914563158], length 0
10:53:27.316252 IP 112.26.2.8.44397 > 112.26.2.1.37753: Flags [.], ack 448393, win 24418, options [nop,nop,TS val 4294917170 ecr 161681,nop,nop,sack 2 {456961:466957}{449821:455533},mptcp dss ack 3914563158], length 0
10:53:27.351492 IP 112.26.2.1.37753 > 112.26.2.8.44397: Flags [.], seq 476953:478381, ack 1, win 893, options [nop,nop,TS val 163685 ecr 4294916853,mptcp dss ack 2295998090 seq 3914678826 subseq 476953 len 1428 csum 0xa288], length 1428
10:53:27.409684 IP 112.26.2.8.44397 > 112.26.2.1.37753: Flags [.], ack 448393, win 24418, options [nop,nop,TS val 4294917292 ecr 161681,nop,nop,sack 2 {468385:469813}{456961:466957},mptcp dss ack 3914563158], length 0
10:53:27.410002 IP 112.26.2.8.44397 > 112.26.2.1.37753: Flags [.], ack 448393, win 24418, options [nop,nop,TS val 4294917292 ecr 161681,nop,nop,sack 2 {468385:469813}{456961:466957},mptcp dss ack 3914563158], length 0
10:53:27.454784 IP 112.26.2.1.37753 > 112.26.2.8.44397: Flags [.], seq 478381:479809, ack 1, win 893, options [nop,nop,TS val 164021 ecr 4294917170,mptcp dss ack 2295998090 seq 3914701674 subseq 478381 len 1428 csum 0xe28], length 1428
10:53:27.542436 IP 112.26.2.8.44397 > 112.26.2.1.37753: Flags [.], ack 448393, win 24418, options [nop,nop,TS val 4294917428 ecr 161681,nop,nop,sack 2 {468385:471241}{456961:466957},mptcp dss ack 3914563158], length 0
10:53:27.542775 IP 112.26.2.8.44397 > 112.26.2.1.37753: Flags [.], ack 448393, win 24418, options [nop,nop,TS val 4294917428 ecr 161681,nop,nop,sack 2 {468385:471241}{456961:466957},mptcp dss ack 3914563158], length 0
10:53:27.551128 IP 112.26.2.1.37753 > 112.26.2.8.44397: Flags [.], seq 466957:468385, ack 1, win 893, options [nop,nop,TS val 164057 ecr 4294917292,mptcp dss ack 2295998090 seq 3914635986 subseq 466957 len 1428 csum 0x5fe6], length 1428
10:53:27.625544 IP 112.26.2.1.37753 > 112.26.2.8.44397: Flags [.], seq 479809:481237, ack 1, win 893, options [nop,nop,TS val 164235 ecr 4294917428,mptcp dss ack 2295998090 seq 3914711670 subseq 479809 len 1428 csum 0xd389], length 1428
10:53:27.652692 IP 112.26.2.8.44397 > 112.26.2.1.37753: Flags [.], ack 448393, win 24418, options [nop,nop,TS val 4294917543 ecr 161681,nop,nop,sack 2 {472669:474097}{468385:471241},mptcp dss ack 3914563158], length 0
10:53:27.653002 IP 112.26.2.8.44397 > 112.26.2.1.37753: Flags [.], ack 448393, win 24418, options [nop,nop,TS val 4294917543 ecr 161681,nop,nop,sack 2 {472669:474097}{468385:471241},mptcp dss ack 3914563158], length 0
10:53:27.719709 IP 112.26.2.1.37753 > 112.26.2.8.44397: Flags [.], seq 471241:472669, ack 1, win 893, options [nop,nop,TS val 164303 ecr 4294917543,mptcp dss ack 2295998090 seq 3914645982 subseq 471241 len 1428 csum 0xb56a], length 1428
10:53:27.761746 IP 112.26.2.8.44397 > 112.26.2.1.37753: Flags [.], ack 455533, win 24418, options [nop,nop,TS val 4294917649 ecr 163113,nop,nop,sack 2 {472669:474097}{468385:471241},mptcp dss ack 3914563158], length 0
10:53:27.762018 IP 112.26.2.8.44397 > 112.26.2.1.37753: Flags [.], ack 455533, win 24418, options [nop,nop,TS val 4294917649 ecr 163113,nop,nop,sack 2 {472669:474097}{468385:471241},mptcp dss ack 3914563158], length 0
10:53:27.772096 IP 112.26.2.1.37753 > 112.26.2.8.44397: Flags [.], seq 481237:482665, ack 1, win 893, options [nop,nop,TS val 164407 ecr 4294917649,mptcp dss ack 2295998090 seq 3914714526 subseq 481237 len 1428 csum 0xf3b9], length 1428
10:53:27.869892 IP 112.26.2.1.37753 > 112.26.2.8.44397: Flags [.], seq 482665:484093, ack 1, win 893, options [nop,nop,TS val 164407 ecr 4294917649,mptcp dss ack 2295998090 seq 3914715954 subseq 482665 len 1428 csum 0x728b], length 1428
10:53:27.933390 IP 112.26.2.8.44397 > 112.26.2.1.37753: Flags [.], ack 455533, win 24078, options [nop,nop,TS val 4294917795 ecr 163113,nop,nop,sack 2 {472669:475525}{468385:471241},mptcp dss ack 3914590290], length 0
10:53:27.933719 IP 112.26.2.8.44397 > 112.26.2.1.37753: Flags [.], ack 455533, win 24078, options [nop,nop,TS val 4294917795 ecr 163113,nop,nop,sack 2 {472669:475525}{468385:471241},mptcp dss ack 3914590290], length 0
10:53:27.943629 IP 112.26.2.1.37753 > 112.26.2.8.44397: Flags [.], seq 484093:485521, ack 1, win 893, options [nop,nop,TS val 164407 ecr 4294917649,mptcp dss ack 2295998090 seq 3914717382 subseq 484093 len 1428 csum 0xcb1e], length 1428
10:53:28.004790 IP 112.26.2.1.37753 > 112.26.2.8.44397: Flags [.], seq 485521:486949, ack 1, win 893, options [nop,nop,TS val 164596 ecr 4294917795,mptcp dss ack 2295998090 seq 3914734518 subseq 485521 len 1428 csum 0x3449], length 1428
10:53:28.053768 IP 112.26.2.8.44397 > 112.26.2.1.37753: Flags [.], ack 455533, win 24078, options [nop,nop,TS val 4294917941 ecr 163113,nop,nop,sack 2 {472669:476953}{468385:471241},mptcp dss ack 3914590290], length 0
10:53:28.054024 IP 112.26.2.8.44397 > 112.26.2.1.37753: Flags [.], ack 455533, win 24078, options [nop,nop,TS val 4294917941 ecr 163113,nop,nop,sack 2 {472669:476953}{468385:471241},mptcp dss ack 3914590290], length 0
10:53:28.115697 IP 112.26.2.1.37753 > 112.26.2.8.44397: Flags [.], seq 455533:456961, ack 1, win 893, options [nop,nop,TS val 164704 ecr 4294917941,mptcp dss ack 2295998090 seq 3914590290 subseq 455533 len 1428 csum 0x6510], length 1428
10:53:28.174566 IP 112.26.2.8.44397 > 112.26.2.1.37753: Flags [.], ack 455533, win 24078, options [nop,nop,TS val 4294918046 ecr 163113,nop,nop,sack 2 {472669:478381}{468385:471241},mptcp dss ack 3914590290], length 0
10:53:28.174917 IP 112.26.2.8.44397 > 112.26.2.1.37753: Flags [.], ack 455533, win 24078, options [nop,nop,TS val 4294918046 ecr 163113,nop,nop,sack 2 {472669:478381}{468385:471241},mptcp dss ack 3914590290], length 0
10:53:28.231443 IP 112.26.2.1.37753 > 112.26.2.8.44397: Flags [.], seq 486949:488377, ack 1, win 893, options [nop,nop,TS val 164839 ecr 4294918046,mptcp dss ack 2295998090 seq 3914741658 subseq 486949 len 1428 csum 0x71dd], length 1428
10:53:28.367210 IP 112.26.2.8.44397 > 112.26.2.1.37753: Flags [.], ack 455533, win 24078, options [nop,nop,TS val 4294918208 ecr 163113,nop,nop,sack 2 {456961:471241}{472669:478381},mptcp dss ack 3914590290], length 0
10:53:28.367501 IP 112.26.2.8.44397 > 112.26.2.1.37753: Flags [.], ack 455533, win 24078, options [nop,nop,TS val 4294918208 ecr 163113,nop,nop,sack 2 {456961:471241}{472669:478381},mptcp dss ack 3914590290], length 0
10:53:28.383934 IP 112.26.2.1.37753 > 112.26.2.8.44397: Flags [.], seq 478381:479809, ack 1, win 893, options [nop,nop,TS val 165011 ecr 4294918208,mptcp dss ack 2295998090 seq 3914701674 subseq 478381 len 1428 csum 0xe28], length 1428
10:53:28.471221 IP 112.26.2.8.44397 > 112.26.2.1.37753: Flags [.], ack 455533, win 24078, options [nop,nop,TS val 4294918311 ecr 163113,nop,nop,sack 2 {479809:481237}{456961:471241},mptcp dss ack 3914590290], length 0
10:53:28.471507 IP 112.26.2.8.44397 > 112.26.2.1.37753: Flags [.], ack 455533, win 24078, options [nop,nop,TS val 4294918311 ecr 163113,nop,nop,sack 2 {479809:481237}{456961:471241},mptcp dss ack 3914590290], length 0
10:53:28.523016 IP 112.26.2.1.37753 > 112.26.2.8.44397: Flags [.], seq 488377:489805, ack 1, win 893, options [nop,nop,TS val 165159 ecr 4294918311,mptcp dss ack 2295998090 seq 3914760222 subseq 488377 len 1428 csum 0xae92], length 1428
10:53:28.594677 IP 112.26.2.8.44397 > 112.26.2.1.37753: Flags [.], ack 455533, win 24078, options [nop,nop,TS val 4294918449 ecr 163113,nop,nop,sack 2 {479809:482665}{456961:471241},mptcp dss ack 3914590290], length 0
10:53:28.595010 IP 112.26.2.8.44397 > 112.26.2.1.37753: Flags [.], ack 455533, win 24078, options [nop,nop,TS val 4294918449 ecr 163113,nop,nop,sack 2 {479809:482665}{456961:471241},mptcp dss ack 3914590290], length 0
10:53:28.614024 IP 112.26.2.1.37753 > 112.26.2.8.44397: Flags [.], seq 471241:472669, ack 1, win 893, options [nop,nop,TS val 165250 ecr 4294918449,mptcp dss ack 2295998090 seq 3914645982 subseq 471241 len 1428 csum 0xb56a], length 1428
10:53:28.687835 IP 112.26.2.8.44397 > 112.26.2.1.37753: Flags [.], ack 455533, win 24078, options [nop,nop,TS val 4294918549 ecr 163113,nop,nop,sack 2 {479809:484093}{456961:471241},mptcp dss ack 3914590290], length 0
10:53:28.688159 IP 112.26.2.8.44397 > 112.26.2.1.37753: Flags [.], ack 455533, win 24078, options [nop,nop,TS val 4294918549 ecr 163113,nop,nop,sack 2 {479809:484093}{456961:471241},mptcp dss ack 3914590290], length 0
10:53:28.731129 IP 112.26.2.1.37753 > 112.26.2.8.44397: Flags [.], seq 489805:491233, ack 1, win 893, options [nop,nop,TS val 165369 ecr 4294918549,mptcp dss ack 2295998090 seq 3914773074 subseq 489805 len 1428 csum 0xbf74], length 1428
10:53:28.809472 IP 112.26.2.8.44397 > 112.26.2.1.37753: Flags [.], ack 455533, win 24078, options [nop,nop,TS val 4294918653 ecr 163113,nop,nop,sack 2 {479809:485521}{456961:471241},mptcp dss ack 3914590290], length 0
10:53:28.809739 IP 112.26.2.8.44397 > 112.26.2.1.37753: Flags [.], ack 455533, win 24078, options [nop,nop,TS val 4294918653 ecr 163113,nop,nop,sack 2 {479809:485521}{456961:471241},mptcp dss ack 3914590290], length 0
10:53:28.852466 IP 112.26.2.1.37753 > 112.26.2.8.44397: Flags [.], seq 491233:492661, ack 1, win 893, options [nop,nop,TS val 165491 ecr 4294918653,mptcp dss ack 2295998090 seq 3914781642 subseq 491233 len 1428 csum 0x9e06], length 1428
10:53:28.920165 IP 112.26.2.8.44397 > 112.26.2.1.37753: Flags [.], ack 455533, win 24078, options [nop,nop,TS val 4294918788 ecr 163113,nop,nop,sack 2 {479809:486949}{456961:471241},mptcp dss ack 3914590290], length 0
10:53:28.920433 IP 112.26.2.8.44397 > 112.26.2.1.37753: Flags [.], ack 455533, win 24078, options [nop,nop,TS val 4294918788 ecr 163113,nop,nop,sack 2 {479809:486949}{456961:471241},mptcp dss ack 3914590290], length 0
10:53:28.963280 IP 112.26.2.1.37753 > 112.26.2.8.44397: Flags [.], seq 492661:494089, ack 1, win 893, options [nop,nop,TS val 165602 ecr 4294918788,mptcp dss ack 2295998090 seq 3914788782 subseq 492661 len 1428 csum 0x17ac], length 1428
10:53:28.979815 IP 112.26.2.8.44397 > 112.26.2.1.37753: Flags [.], ack 471241, win 23265, options [nop,nop,TS val 4294918869 ecr 164704,nop,nop,sack 2 {479809:486949}{472669:478381},mptcp dss ack 3914645982], length 0
10:53:28.980119 IP 112.26.2.8.44397 > 112.26.2.1.37753: Flags [.], ack 471241, win 23265, options [nop,nop,TS val 4294918869 ecr 164704,nop,nop,sack 2 {479809:486949}{472669:478381},mptcp dss ack 3914645982], length 0
10:53:29.048670 IP 112.26.2.1.37753 > 112.26.2.8.44397: Flags [.], seq 494089:495517, ack 1, win 893, options [nop,nop,TS val 165623 ecr 4294918869,mptcp dss ack 2295998090 seq 3914793066 subseq 494089 len 1428 csum 0xa05d], length 1428
10:53:29.099026 IP 112.26.2.8.44397 > 112.26.2.1.37753: Flags [.], ack 471241, win 23862, options [nop,nop,TS val 4294918979 ecr 164704,nop,nop,sack 2 {479809:488377}{472669:478381},mptcp dss ack 3914645982], length 0
10:53:29.099353 IP 112.26.2.8.44397 > 112.26.2.1.37753: Flags [.], ack 471241, win 23862, options [nop,nop,TS val 4294918979 ecr 164704,nop,nop,sack 2 {479809:488377}{472669:478381},mptcp dss ack 3914645982], length 0
10:53:29.117116 IP 112.26.2.1.37753 > 112.26.2.8.44397: Flags [.], seq 495517:496945, ack 1, win 893, options [nop,nop,TS val 165623 ecr 4294918869,mptcp dss ack 2295998090 seq 3914794494 subseq 495517 len 1428 csum 0x3548], length 1428
10:53:29.211345 IP 112.26.2.1.37753 > 112.26.2.8.44397: Flags [.], seq 496945:498373, ack 1, win 893, options [nop,nop,TS val 165623 ecr 4294918869,mptcp dss ack 2295998090 seq 3914795922 subseq 496945 len 1428 csum 0x4874], length 1428
10:53:29.219995 IP 112.26.2.8.44397 > 112.26.2.1.37753: Flags [.], ack 471241, win 23862, options [nop,nop,TS val 4294919078 ecr 164704,nop,nop,sack 1 {472669:488377},mptcp dss ack 3914645982], length 0
10:53:29.220323 IP 112.26.2.8.44397 > 112.26.2.1.37753: Flags [.], ack 471241, win 23862, options [nop,nop,TS val 4294919078 ecr 164704,nop,nop,sack 1 {472669:488377},mptcp dss ack 3914645982], length 0
10:53:29.286905 IP 112.26.2.1.37753 > 112.26.2.8.44397: Flags [.], seq 498373:499801, ack 1, win 893, options [nop,nop,TS val 165800 ecr 4294918979,mptcp dss ack 2295998090 seq 3914800206 subseq 498373 len 1428 csum 0x3c09], length 1428
10:53:29.335271 IP 112.26.2.8.44397 > 112.26.2.1.37753: Flags [.], ack 471241, win 23862, options [nop,nop,TS val 4294919211 ecr 164704,nop,nop,sack 1 {472669:489805},mptcp dss ack 3914645982], length 0
10:53:29.335624 IP 112.26.2.8.44397 > 112.26.2.1.37753: Flags [.], ack 471241, win 23862, options [nop,nop,TS val 4294919211 ecr 164704,nop,nop,sack 1 {472669:489805},mptcp dss ack 3914645982], length 0
10:53:29.400885 IP 112.26.2.1.37753 > 112.26.2.8.44397: Flags [.], seq 499801:501229, ack 1, win 893, options [nop,nop,TS val 165897 ecr 4294919078,mptcp dss ack 2295998090 seq 3914804490 subseq 499801 len 1428 csum 0xa64d], length 1428
10:53:29.440337 IP 112.26.2.8.44397 > 112.26.2.1.37753: Flags [.], ack 489805, win 23616, options [nop,nop,TS val 4294919325 ecr 165250,mptcp dss ack 3914707386], length 0
10:53:29.440682 IP 112.26.2.8.44397 > 112.26.2.1.37753: Flags [.], ack 489805, win 23616, options [nop,nop,TS val 4294919325 ecr 165250,mptcp dss ack 3914707386], length 0
10:53:29.524129 IP 112.26.2.1.37753 > 112.26.2.8.44397: Flags [.], seq 501229:502657, ack 1, win 893, options [nop,nop,TS val 166084 ecr 4294919211,mptcp dss ack 2295998090 seq 3914814486 subseq 501229 len 1428 csum 0x72ac], length 1428
10:53:29.580569 IP 112.26.2.8.44397 > 112.26.2.1.37753: Flags [.], ack 491233, win 24275, options [nop,nop,TS val 4294919468 ecr 165369,mptcp dss ack 3914707386], length 0
10:53:29.580744 IP 112.26.2.8.44397 > 112.26.2.1.37753: Flags [.], ack 491233, win 24275, options [nop,nop,TS val 4294919468 ecr 165369,mptcp dss ack 3914707386], length 0
10:53:29.647225 IP 112.26.2.1.37753 > 112.26.2.8.44397: Flags [.], seq 502657:504085, ack 1, win 893, options [nop,nop,TS val 166084 ecr 4294919325,mptcp dss ack 2295998090 seq 3914815914 subseq 502657 len 1428 csum 0x4a46], length 1428
10:53:29.679321 IP 112.26.2.8.44397 > 112.26.2.1.37753: Flags [.], ack 492661, win 24275, options [nop,nop,TS val 4294919560 ecr 165491,mptcp dss ack 3914707386], length 0
10:53:29.679547 IP 112.26.2.8.44397 > 112.26.2.1.37753: Flags [.], ack 492661, win 24275, options [nop,nop,TS val 4294919560 ecr 165491,mptcp dss ack 3914707386], length 0
10:53:29.745908 IP 112.26.2.1.37753 > 112.26.2.8.44397: Flags [.], seq 504085:505513, ack 1, win 893, options [nop,nop,TS val 166084 ecr 4294919325,mptcp dss ack 2295998090 seq 3914817342 subseq 504085 len 1428 csum 0xd1cc], length 1428
10:53:29.798776 IP 112.26.2.1.37753 > 112.26.2.8.44397: Flags [.], seq 505513:506941, ack 1, win 893, options [nop,nop,TS val 166225 ecr 4294919468,mptcp dss ack 2295998090 seq 3914823054 subseq 505513 len 1428 csum 0xc274], length 1428
10:53:29.810604 IP 112.26.2.8.44397 > 112.26.2.1.37753: Flags [.], ack 494089, win 24275, options [nop,nop,TS val 4294919697 ecr 165602,mptcp dss ack 3914707386], length 0
10:53:29.810951 IP 112.26.2.8.44397 > 112.26.2.1.37753: Flags [.], ack 494089, win 24275, options [nop,nop,TS val 4294919697 ecr 165602,mptcp dss ack 3914707386], length 0
10:53:29.878802 IP 112.26.2.1.37753 > 112.26.2.8.44397: Flags [.], seq 506941:508369, ack 1, win 893, options [nop,nop,TS val 166324 ecr 4294919560,mptcp dss ack 2295998090 seq 3914824482 subseq 506941 len 1428 csum 0x4ba9], length 1428
10:53:29.946300 IP 112.26.2.1.37753 > 112.26.2.8.44397: Flags [.], seq 508369:509797, ack 1, win 893, options [nop,nop,TS val 166324 ecr 4294919560,mptcp dss ack 2295998090 seq 3914825910 subseq 508369 len 1428 csum 0x28d5], length 1428
10:53:29.952672 IP 112.26.2.8.44397 > 112.26.2.1.37753: Flags [.], ack 494089, win 24275, options [nop,nop,TS val 4294919827 ecr 165602,nop,nop,sack 1 {495517:496945},mptcp dss ack 3914707386], length 0
10:53:29.952923 IP 112.26.2.8.44397 > 112.26.2.1.37753: Flags [.], ack 494089, win 24275, options [nop,nop,TS val 4294919827 ecr 165602,nop,nop,sack 1 {495517:496945},mptcp dss ack 3914707386], length 0
10:53:30.033642 IP 112.26.2.1.37753 > 112.26.2.8.44397: Flags [.], seq 509797:511225, ack 1, win 893, options [nop,nop,TS val 166456 ecr 4294919697,mptcp dss ack 2295998090 seq 3914828766 subseq 509797 len 1428 csum 0x53cd], length 1428
10:53:30.088493 IP 112.26.2.8.44397 > 112.26.2.1.37753: Flags [.], ack 494089, win 24275, options [nop,nop,TS val 4294919978 ecr 165602,nop,nop,sack 1 {495517:498373},mptcp dss ack 3914707386], length 0
10:53:30.088863 IP 112.26.2.8.44397 > 112.26.2.1.37753: Flags [.], ack 494089, win 24275, options [nop,nop,TS val 4294919978 ecr 165602,nop,nop,sack 1 {495517:498373},mptcp dss ack 3914707386], length 0
10:53:30.132492 IP 112.26.2.1.37753 > 112.26.2.8.44397: Flags [.], seq 511225:512653, ack 1, win 893, options [nop,nop,TS val 166608 ecr 4294919827,mptcp dss ack 2295998090 seq 3914831622 subseq 511225 len 1428 csum 0x66a0], length 1428
10:53:30.178302 IP 112.26.2.8.44397 > 112.26.2.1.37753: Flags [.], ack 494089, win 24275, options [nop,nop,TS val 4294920066 ecr 165602,nop,nop,sack 2 {499801:501229}{495517:498373},mptcp dss ack 3914707386], length 0
10:53:30.178630 IP 112.26.2.8.44397 > 112.26.2.1.37753: Flags [.], ack 494089, win 24275, options [nop,nop,TS val 4294920066 ecr 165602,nop,nop,sack 2 {499801:501229}{495517:498373},mptcp dss ack 3914707386], length 0
10:53:30.236726 IP 112.26.2.1.37753 > 112.26.2.8.44397: Flags [.], seq 512653:514081, ack 1, win 893, options [nop,nop,TS val 166786 ecr 4294919978,mptcp dss ack 2295998090 seq 3914843046 subseq 512653 len 1428 csum 0xfe64], length 1428
10:53:30.273410 IP 112.26.2.8.44397 > 112.26.2.1.37753: Flags [.], ack 494089, win 24275, options [nop,nop,TS val 4294920164 ecr 165602,nop,nop,sack 2 {499801:502657}{495517:498373},mptcp dss ack 3914707386], length 0
10:53:30.273705 IP 112.26.2.8.44397 > 112.26.2.1.37753: Flags [.], ack 494089, win 24275, options [nop,nop,TS val 4294920164 ecr 165602,nop,nop,sack 2 {499801:502657}{495517:498373},mptcp dss ack 3914707386], length 0
10:53:30.351169 IP 112.26.2.1.37753 > 112.26.2.8.44397: Flags [.], seq 494089:495517, ack 1, win 893, options [nop,nop,TS val 166821 ecr 4294920066,mptcp dss ack 2295998090 seq 3914793066 subseq 494089 len 1428 csum 0xa05d], length 1428
10:53:30.435035 IP 112.26.2.8.44397 > 112.26.2.1.37753: Flags [.], ack 494089, win 24275, options [nop,nop,TS val 4294920296 ecr 165602,nop,nop,sack 2 {499801:504085}{495517:498373},mptcp dss ack 3914707386], length 0
10:53:30.435309 IP 112.26.2.8.44397 > 112.26.2.1.37753: Flags [.], ack 494089, win 24275, options [nop,nop,TS val 4294920296 ecr 165602,nop,nop,sack 2 {499801:504085}{495517:498373},mptcp dss ack 3914707386], length 0
10:53:30.446180 IP 112.26.2.1.37753 > 112.26.2.8.44397: Flags [.], seq 498373:499801, ack 1, win 893, options [nop,nop,TS val 166921 ecr 4294920164,mptcp dss ack 2295998090 seq 3914800206 subseq 498373 len 1428 csum 0x3c09], length 1428
10:53:30.547763 IP 112.26.2.8.44397 > 112.26.2.1.37753: Flags [.], ack 494089, win 24275, options [nop,nop,TS val 4294920431 ecr 165602,nop,nop,sack 2 {499801:505513}{495517:498373},mptcp dss ack 3914707386], length 0
10:53:30.548017 IP 112.26.2.8.44397 > 112.26.2.1.37753: Flags [.], ack 494089, win 24275, options [nop,nop,TS val 4294920431 ecr 165602,nop,nop,sack 2 {499801:505513}{495517:498373},mptcp dss ack 3914707386], length 0
10:53:30.702336 IP 112.26.2.8.44397 > 112.26.2.1.37753: Flags [.], ack 494089, win 24275, options [nop,nop,TS val 4294920568 ecr 165602,nop,nop,sack 2 {499801:506941}{495517:498373},mptcp dss ack 3914707386], length 0
10:53:30.702625 IP 112.26.2.8.44397 > 112.26.2.1.37753: Flags [.], ack 494089, win 24275, options [nop,nop,TS val 4294920568 ecr 165602,nop,nop,sack 2 {499801:506941}{495517:498373},mptcp dss ack 3914707386], length 0
10:53:30.737169 IP 112.26.2.1.37753 > 112.26.2.8.44397: Flags [.], seq 514081:515509, ack 1, win 893, options [nop,nop,TS val 167375 ecr 4294920568,mptcp dss ack 2295998090 seq 3914861610 subseq 514081 len 1428 csum 0xfba1], length 1428
10:53:30.830186 IP 112.26.2.8.44397 > 112.26.2.1.37753: Flags [.], ack 494089, win 24275, options [nop,nop,TS val 4294920711 ecr 165602,nop,nop,sack 2 {508369:509797}{499801:506941},mptcp dss ack 3914707386], length 0
10:53:30.830500 IP 112.26.2.8.44397 > 112.26.2.1.37753: Flags [.], ack 494089, win 24275, options [nop,nop,TS val 4294920711 ecr 165602,nop,nop,sack 2 {508369:509797}{499801:506941},mptcp dss ack 3914707386], length 0
10:53:30.852826 IP 112.26.2.1.37753 > 112.26.2.8.44397: Flags [.], seq 506941:508369, ack 1, win 893, options [nop,nop,TS val 167480 ecr 4294920711,mptcp dss ack 2295998090 seq 3914824482 subseq 506941 len 1428 csum 0x4ba9], length 1428
10:53:30.960393 IP 112.26.2.8.44397 > 112.26.2.1.37753: Flags [.], ack 494089, win 24275, options [nop,nop,TS val 4294920850 ecr 165602,nop,nop,sack 2 {508369:511225}{499801:506941},mptcp dss ack 3914707386], length 0
10:53:30.960709 IP 112.26.2.8.44397 > 112.26.2.1.37753: Flags [.], ack 494089, win 24275, options [nop,nop,TS val 4294920850 ecr 165602,nop,nop,sack 2 {508369:511225}{499801:506941},mptcp dss ack 3914707386], length 0
10:53:31.012993 IP 112.26.2.1.37753 > 112.26.2.8.44397: Flags [.], seq 515509:516937, ack 1, win 893, options [nop,nop,TS val 167638 ecr 4294920850,mptcp dss ack 2295998090 seq 3914867322 subseq 515509 len 1428 csum 0x3472], length 1428
10:53:31.096829 IP 112.26.2.8.44397 > 112.26.2.1.37753: Flags [.], ack 494089, win 24275, options [nop,nop,TS val 4294920986 ecr 165602,nop,nop,sack 2 {508369:512653}{499801:506941},mptcp dss ack 3914707386], length 0
10:53:31.097056 IP 112.26.2.8.44397 > 112.26.2.1.37753: Flags [.], ack 494089, win 24275, options [nop,nop,TS val 4294920986 ecr 165602,nop,nop,sack 2 {508369:512653}{499801:506941},mptcp dss ack 3914707386], length 0
10:53:31.128997 IP 112.26.2.1.37753 > 112.26.2.8.44397: Flags [.], seq 516937:518365, ack 1, win 893, options [nop,nop,TS val 167767 ecr 4294920986,mptcp dss ack 2295998090 seq 3914871606 subseq 516937 len 1428 csum 0xd0df], length 1428
10:53:31.250077 IP 112.26.2.8.44397 > 112.26.2.1.37753: Flags [.], ack 498373, win 24275, options [nop,nop,TS val 4294921140 ecr 166821,nop,nop,sack 2 {508369:512653}{499801:506941},mptcp dss ack 3914707386], length 0
10:53:31.250399 IP 112.26.2.8.44397 > 112.26.2.1.37753: Flags [.], ack 498373, win 24275, options [nop,nop,TS val 4294921140 ecr 166821,nop,nop,sack 2 {508369:512653}{499801:506941},mptcp dss ack 3914707386], length 0
10:53:31.262593 IP 112.26.2.1.37753 > 112.26.2.8.44397: Flags [.], seq 512653:514081, ack 1, win 893, options [nop,nop,TS val 167893 ecr 4294921140,mptcp dss ack 2295998090 seq 3914843046 subseq 512653 len 1428 csum 0xfe64], length 1428
10:53:31.352756 IP 112.26.2.1.37753 > 112.26.2.8.44397: Flags [.], seq 518365:519793, ack 1, win 893, options [nop,nop,TS val 167893 ecr 4294921140,mptcp dss ack 2295998090 seq 3914877318 subseq 518365 len 1428 csum 0x908f], length 1428
10:53:31.429108 IP 112.26.2.8.44397 > 112.26.2.1.37753: Flags [.], ack 506941, win 24275, options [nop,nop,TS val 4294921226 ecr 166921,nop,nop,sack 1 {508369:512653},mptcp dss ack 3914707386], length 0
10:53:31.429440 IP 112.26.2.8.44397 > 112.26.2.1.37753: Flags [.], ack 506941, win 24275, options [nop,nop,TS val 4294921226 ecr 166921,nop,nop,sack 1 {508369:512653},mptcp dss ack 3914707386], length 0
10:53:31.487183 IP 112.26.2.1.37753 > 112.26.2.8.44397: Flags [.], seq 519793:521221, ack 1, win 893, options [nop,nop,TS val 167893 ecr 4294921140,mptcp dss ack 2295998090 seq 3914878746 subseq 519793 len 1428 csum 0xb773], length 1428
10:53:31.507300 IP 112.26.2.8.44397 > 112.26.2.1.37753: Flags [.], ack 506941, win 24275, options [nop,nop,TS val 4294921362 ecr 166921,nop,nop,sack 2 {514081:515509}{508369:512653},mptcp dss ack 3914707386], length 0
10:53:31.507512 IP 112.26.2.8.44397 > 112.26.2.1.37753: Flags [.], ack 506941, win 24275, options [nop,nop,TS val 4294921362 ecr 166921,nop,nop,sack 2 {514081:515509}{508369:512653},mptcp dss ack 3914707386], length 0
10:53:31.641430 IP 112.26.2.1.37753 > 112.26.2.8.44397: Flags [.], seq 521221:522649, ack 1, win 893, options [nop,nop,TS val 168072 ecr 4294921226,mptcp dss ack 2295998090 seq 3914884458 subseq 521221 len 1428 csum 0xa95e], length 1428
10:53:31.652823 IP 112.26.2.8.44397 > 112.26.2.1.37753: Flags [.], ack 512653, win 24275, options [nop,nop,TS val 4294921509 ecr 167480,nop,nop,sack 1 {514081:515509},mptcp dss ack 3914707386], length 0
10:53:31.653134 IP 112.26.2.8.44397 > 112.26.2.1.37753: Flags [.], ack 512653, win 24275, options [nop,nop,TS val 4294921509 ecr 167480,nop,nop,sack 1 {514081:515509},mptcp dss ack 3914707386], length 0
10:53:31.716716 IP 112.26.2.1.37753 > 112.26.2.8.44397: Flags [.], seq 522649:524077, ack 1, win 893, options [nop,nop,TS val 168189 ecr 4294921362,mptcp dss ack 2295998090 seq 3914887314 subseq 522649 len 1428 csum 0x693d], length 1428
10:53:31.751227 IP 112.26.2.8.44397 > 112.26.2.1.37753: Flags [.], ack 512653, win 24275, options [nop,nop,TS val 4294921641 ecr 167480,nop,nop,sack 1 {514081:516937},mptcp dss ack 3914707386], length 0
10:53:31.751548 IP 112.26.2.8.44397 > 112.26.2.1.37753: Flags [.], ack 512653, win 24275, options [nop,nop,TS val 4294921641 ecr 167480,nop,nop,sack 1 {514081:516937},mptcp dss ack 3914707386], length 0
10:53:31.814851 IP 112.26.2.1.37753 > 112.26.2.8.44397: Flags [.], seq 524077:525505, ack 1, win 893, options [nop,nop,TS val 168296 ecr 4294921509,mptcp dss ack 2295998090 seq 3914891598 subseq 524077 len 1428 csum 0xf530], length 1428
10:53:31.906211 IP 112.26.2.1.37753 > 112.26.2.8.44397: Flags [.], seq 525505:526933, ack 1, win 893, options [nop,nop,TS val 168462 ecr 4294921641,mptcp dss ack 2295998090 seq 3914895882 subseq 525505 len 1428 csum 0x4926], length 1428
10:53:31.946870 IP 112.26.2.8.44397 > 112.26.2.1.37753: Flags [.], ack 512653, win 23918, options [nop,nop,TS val 4294921825 ecr 167480,nop,nop,sack 1 {514081:518365},mptcp dss ack 3914730234], length 0
10:53:31.947196 IP 112.26.2.8.44397 > 112.26.2.1.37753: Flags [.], ack 512653, win 23918, options [nop,nop,TS val 4294921825 ecr 167480,nop,nop,sack 1 {514081:518365},mptcp dss ack 3914730234], length 0
10:53:32.006267 IP 112.26.2.1.37753 > 112.26.2.8.44397: Flags [.], seq 526933:528361, ack 1, win 893, options [nop,nop,TS val 168640 ecr 4294921825,mptcp dss ack 2295998090 seq 3914901594 subseq 526933 len 1428 csum 0xc40c], length 1428
10:53:32.083083 IP 112.26.2.8.44397 > 112.26.2.1.37753: Flags [.], ack 518365, win 24154, options [nop,nop,TS val 4294921948 ecr 167893,mptcp dss ack 3914787354], length 0
10:53:32.083316 IP 112.26.2.8.44397 > 112.26.2.1.37753: Flags [.], ack 518365, win 24154, options [nop,nop,TS val 4294921948 ecr 167893,mptcp dss ack 3914787354], length 0
10:53:32.121730 IP 112.26.2.1.37753 > 112.26.2.8.44397: Flags [.], seq 528361:529789, ack 1, win 893, options [nop,nop,TS val 168726 ecr 4294921948,mptcp dss ack 2295998090 seq 3914908734 subseq 528361 len 1428 csum 0xc8b2], length 1428
10:53:32.195590 IP 112.26.2.8.44397 > 112.26.2.1.37753: Flags [.], ack 519793, win 24154, options [nop,nop,TS val 4294922064 ecr 167893,mptcp dss ack 3914787354], length 0
10:53:32.195914 IP 112.26.2.8.44397 > 112.26.2.1.37753: Flags [.], ack 519793, win 24154, options [nop,nop,TS val 4294922064 ecr 167893,mptcp dss ack 3914787354], length 0
10:53:32.253450 IP 112.26.2.1.37753 > 112.26.2.8.44397: Flags [.], seq 529789:531217, ack 1, win 893, options [nop,nop,TS val 168839 ecr 4294922064,mptcp dss ack 2295998090 seq 3914918730 subseq 529789 len 1428 csum 0x97a1], length 1428
10:53:32.324542 IP 112.26.2.8.44397 > 112.26.2.1.37753: Flags [.], ack 521221, win 24154, options [nop,nop,TS val 4294922210 ecr 167893,mptcp dss ack 3914787354], length 0
10:53:32.324866 IP 112.26.2.8.44397 > 112.26.2.1.37753: Flags [.], ack 521221, win 24154, options [nop,nop,TS val 4294922210 ecr 167893,mptcp dss ack 3914787354], length 0
10:53:32.342107 IP 112.26.2.1.37753 > 112.26.2.8.44397: Flags [.], seq 531217:532645, ack 1, win 893, options [nop,nop,TS val 168971 ecr 4294922210,mptcp dss ack 2295998090 seq 3914925870 subseq 531217 len 1428 csum 0x6f02], length 1428
10:53:32.460712 IP 112.26.2.8.44397 > 112.26.2.1.37753: Flags [.], ack 522649, win 24154, options [nop,nop,TS val 4294922347 ecr 168072,mptcp dss ack 3914787354], length 0
10:53:32.460987 IP 112.26.2.8.44397 > 112.26.2.1.37753: Flags [.], ack 522649, win 24154, options [nop,nop,TS val 4294922347 ecr 168072,mptcp dss ack 3914787354], length 0
10:53:32.477362 IP 112.26.2.1.37753 > 112.26.2.8.44397: Flags [.], seq 532645:534073, ack 1, win 893, options [nop,nop,TS val 169110 ecr 4294922347,mptcp dss ack 2295998090 seq 3914931582 subseq 532645 len 1428 csum 0xfa8a], length 1428
10:53:32.548042 IP 112.26.2.1.37753 > 112.26.2.8.44397: Flags [.], seq 534073:535501, ack 1, win 893, options [nop,nop,TS val 169110 ecr 4294922347,mptcp dss ack 2295998090 seq 3914933010 subseq 534073 len 1428 csum 0xdafd], length 1428
10:53:32.642338 IP 112.26.2.8.44397 > 112.26.2.1.37753: Flags [.], ack 524077, win 24151, options [nop,nop,TS val 4294922524 ecr 168189,mptcp dss ack 3914833050], length 0
10:53:32.642630 IP 112.26.2.8.44397 > 112.26.2.1.37753: Flags [.], ack 524077, win 24151, options [nop,nop,TS val 4294922524 ecr 168189,mptcp dss ack 3914833050], length 0
10:53:32.647701 IP 112.26.2.1.37753 > 112.26.2.8.44397: Flags [.], seq 535501:536929, ack 1, win 893, options [nop,nop,TS val 169285 ecr 4294922524,mptcp dss ack 2295998090 seq 3914943006 subseq 535501 len 1428 csum 0x278e], length 1428
10:53:32.743096 IP 112.26.2.8.44397 > 112.26.2.1.37753: Flags [.], ack 525505, win 24151, options [nop,nop,TS val 4294922629 ecr 168296,mptcp dss ack 3914833050], length 0
10:53:32.743373 IP 112.26.2.8.44397 > 112.26.2.1.37753: Flags [.], ack 525505, win 24151, options [nop,nop,TS val 4294922629 ecr 168296,mptcp dss ack 3914833050], length 0
10:53:32.751851 IP 112.26.2.1.37753 > 112.26.2.8.44397: Flags [.], seq 536929:538357, ack 1, win 893, options [nop,nop,TS val 169388 ecr 4294922629,mptcp dss ack 2295998090 seq 3914945862 subseq 536929 len 1428 csum 0x6f63], length 1428
10:53:32.886881 IP 112.26.2.8.44397 > 112.26.2.1.37753: Flags [.], ack 526933, win 24151, options [nop,nop,TS val 4294922768 ecr 168462,mptcp dss ack 3914833050], length 0
10:53:32.887217 IP 112.26.2.8.44397 > 112.26.2.1.37753: Flags [.], ack 526933, win 24151, options [nop,nop,TS val 4294922768 ecr 168462,mptcp dss ack 3914833050], length 0
10:53:32.931799 IP 112.26.2.1.37753 > 112.26.2.8.44397: Flags [.], seq 538357:539785, ack 1, win 893, options [nop,nop,TS val 169535 ecr 4294922768,mptcp dss ack 2295998090 seq 3914951574 subseq 538357 len 1428 csum 0x784f], length 1428
10:53:33.035826 IP 112.26.2.8.44397 > 112.26.2.1.37753: Flags [.], ack 528361, win 24151, options [nop,nop,TS val 4294922926 ecr 168640,mptcp dss ack 3914833050], length 0
10:53:33.036144 IP 112.26.2.8.44397 > 112.26.2.1.37753: Flags [.], ack 528361, win 24151, options [nop,nop,TS val 4294922926 ecr 168640,mptcp dss ack 3914833050], length 0
10:53:33.069902 IP 112.26.2.1.37753 > 112.26.2.8.44397: Flags [.], seq 539785:541213, ack 1, win 893, options [nop,nop,TS val 169679 ecr 4294922926,mptcp dss ack 2295998090 seq 3914958714 subseq 539785 len 1428 csum 0xcc8d], length 1428
10:53:33.162509 IP 112.26.2.8.44397 > 112.26.2.1.37753: Flags [.], ack 528361, win 24129, options [nop,nop,TS val 4294923040 ecr 168640,nop,nop,sack 1 {529789:531217},mptcp dss ack 3914834478], length 0
10:53:33.162835 IP 112.26.2.8.44397 > 112.26.2.1.37753: Flags [.], ack 528361, win 24129, options [nop,nop,TS val 4294923040 ecr 168640,nop,nop,sack 1 {529789:531217},mptcp dss ack 3914834478], length 0
10:53:33.222393 IP 112.26.2.1.37753 > 112.26.2.8.44397: Flags [.], seq 541213:542641, ack 1, win 893, options [nop,nop,TS val 169859 ecr 4294923040,mptcp dss ack 2295998090 seq 3914964426 subseq 541213 len 1428 csum 0x5b48], length 1428
10:53:33.308737 IP 112.26.2.8.44397 > 112.26.2.1.37753: Flags [.], ack 528361, win 24129, options [nop,nop,TS val 4294923198 ecr 168640,nop,nop,sack 1 {529789:532645},mptcp dss ack 3914834478], length 0
10:53:33.309038 IP 112.26.2.8.44397 > 112.26.2.1.37753: Flags [.], ack 528361, win 24129, options [nop,nop,TS val 4294923198 ecr 168640,nop,nop,sack 1 {529789:532645},mptcp dss ack 3914834478], length 0
10:53:33.401171 IP 112.26.2.1.37753 > 112.26.2.8.44397: Flags [.], seq 542641:544069, ack 1, win 893, options [nop,nop,TS val 170040 ecr 4294923198,mptcp dss ack 2295998090 seq 3914970138 subseq 542641 len 1428 csum 0x6419], length 1428
10:53:33.469108 IP 112.26.2.8.44397 > 112.26.2.1.37753: Flags [.], ack 528361, win 24129, options [nop,nop,TS val 4294923318 ecr 168640,nop,nop,sack 1 {529789:534073},mptcp dss ack 3914834478], length 0
10:53:33.469379 IP 112.26.2.8.44397 > 112.26.2.1.37753: Flags [.], ack 528361, win 24129, options [nop,nop,TS val 4294923318 ecr 168640,nop,nop,sack 1 {529789:534073},mptcp dss ack 3914834478], length 0
10:53:33.503389 IP 112.26.2.1.37753 > 112.26.2.8.44397: Flags [.], seq 528361:529789, ack 1, win 893, options [nop,nop,TS val 170114 ecr 4294923318,mptcp dss ack 2295998090 seq 3914908734 subseq 528361 len 1428 csum 0xc8b2], length 1428
10:53:33.593956 IP 112.26.2.8.44397 > 112.26.2.1.37753: Flags [.], ack 528361, win 24129, options [nop,nop,TS val 4294923426 ecr 168640,nop,nop,sack 2 {535501:536929}{529789:534073},mptcp dss ack 3914834478], length 0
10:53:33.594285 IP 112.26.2.8.44397 > 112.26.2.1.37753: Flags [.], ack 528361, win 24129, options [nop,nop,TS val 4294923426 ecr 168640,nop,nop,sack 2 {535501:536929}{529789:534073},mptcp dss ack 3914834478], length 0
10:53:33.705502 IP 112.26.2.8.44397 > 112.26.2.1.37753: Flags [.], ack 528361, win 24129, options [nop,nop,TS val 4294923595 ecr 168640,nop,nop,sack 2 {535501:538357}{529789:534073},mptcp dss ack 3914834478], length 0
10:53:33.705778 IP 112.26.2.8.44397 > 112.26.2.1.37753: Flags [.], ack 528361, win 24129, options [nop,nop,TS val 4294923595 ecr 168640,nop,nop,sack 2 {535501:538357}{529789:534073},mptcp dss ack 3914834478], length 0
10:53:33.719746 IP 112.26.2.1.37753 > 112.26.2.8.44397: Flags [.], seq 534073:535501, ack 1, win 893, options [nop,nop,TS val 170349 ecr 4294923595,mptcp dss ack 2295998090 seq 3914933010 subseq 534073 len 1428 csum 0xdafd], length 1428
10:53:33.826827 IP 112.26.2.8.44397 > 112.26.2.1.37753: Flags [.], ack 528361, win 24129, options [nop,nop,TS val 4294923713 ecr 168640,nop,nop,sack 2 {535501:539785}{529789:534073},mptcp dss ack 3914834478], length 0
10:53:33.827156 IP 112.26.2.8.44397 > 112.26.2.1.37753: Flags [.], ack 528361, win 24129, options [nop,nop,TS val 4294923713 ecr 168640,nop,nop,sack 2 {535501:539785}{529789:534073},mptcp dss ack 3914834478], length 0
10:53:33.889495 IP 112.26.2.1.37753 > 112.26.2.8.44397: Flags [.], seq 544069:545497, ack 1, win 893, options [nop,nop,TS val 170524 ecr 4294923713,mptcp dss ack 2295998090 seq 3914980134 subseq 544069 len 1428 csum 0xe548], length 1428
10:53:34.001090 IP 112.26.2.8.44397 > 112.26.2.1.37753: Flags [.], ack 528361, win 24129, options [nop,nop,TS val 4294923818 ecr 168640,nop,nop,sack 2 {535501:541213}{529789:534073},mptcp dss ack 3914834478], length 0
