10:52:44.097030 IP 112.26.2.8.44397 > 112.26.2.1.37753: Flags [S], seq 2791519187, win 65535, options [mss 1460,sackOK,TS val 4294873967 ecr 0,nop,wscale 6,mptcp join id 4 token 0xd15e4cde nonce 0x156fce22], length 0
10:52:44.168820 IP 112.26.2.8.44397 > 112.26.2.1.37753: Flags [S], seq 2791519187, win 65535, options [mss 1460,sackOK,TS val 4294873967 ecr 0,nop,wscale 6,mptcp join id 4 token 0xd15e4cde nonce 0x156fce22], length 0
10:52:44.233088 IP 112.26.2.8.44397 > 112.26.2.1.37753: Flags [S], seq 2791519187, win 65535, options [mss 1460,sackOK,TS val 4294873967 ecr 0,nop,wscale 6,mptcp join id 4 token 0xd15e4cde nonce 0x156fce22], length 0
10:52:44.363856 IP 112.26.2.1.37753 > 112.26.2.8.44397: Flags [S.], seq 1823757429, ack 2791519188, win 28560, options [mss 1460,sackOK,TS val 120874 ecr 4294873967,nop,wscale 7,mptcp join id 6 hmac 0x9180a648a613b37a nonce 0x4f6f39cd], length 0
10:52:44.409203 IP 112.26.2.1.37753 > 112.26.2.8.44397: Flags [S.], seq 1823757429, ack 2791519188, win 28560, options [mss 1460,sackOK,TS val 120874 ecr 4294873967,nop,wscale 7,mptcp join id 6 hmac 0x9180a648a613b37a nonce 0x4f6f39cd], length 0
10:52:44.433676 IP 112.26.2.8.44397 > 112.26.2.1.37753: Flags [.], ack 1, win 5612, options [nop,nop,TS val 4294874303 ecr 120874,mptcp join hmac 0xaeeb9b2491d3cee2f82d2bbe89c74c4650f6fe81], length 0
10:52:44.433970 IP 112.26.2.8.44397 > 112.26.2.1.37753: Flags [.], ack 1, win 5612, options [nop,nop,TS val 4294874303 ecr 120874,mptcp join hmac 0xaeeb9b2491d3cee2f82d2bbe89c74c4650f6fe81], length 0
10:53:26.839556 IP 112.26.2.1.37753 > 112.26.2.8.44397: Flags [.], seq 459817:461245, ack 1, win 893, options [nop,nop,TS val 162253 ecr 4294915486,mptcp dss ack 2295998090 seq 3914603142 subseq 459817 len 1428 csum 0x96d8], length 1428
10:53:26.844215 IP 112.26.2.1.37753 > 112.26.2.8.44397: Flags [.], seq 459817:461245, ack 1, win 893, options [nop,nop,TS val 162253 ecr 4294915486,mptcp dss ack 2295998090 seq 3914603142 subseq 459817 len 1428 csum 0x96d8], length 1428
10:53:26.845541 IP 112.26.2.8.44397 > 112.26.2.1.37753: Flags [.], ack 448393, win 24418, options [nop,nop,TS val 4294916738 ecr 161681,nop,nop,sack 2 {456961:461245}{449821:455533},mptcp dss ack 3914563158], length 0
10:53:26.845849 IP 112.26.2.8.44397 > 112.26.2.1.37753: Flags [.], ack 448393, win 24418, options [nop,nop,TS val 4294916738 ecr 161681,nop,nop,sack 2 {456961:461245}{449821:455533},mptcp dss ack 3914563158], length 0
10:53:26.905874 IP 112.26.2.8.44397 > 112.26.2.1.37753: Flags [.], ack 448393, win 24418, options [nop,nop,TS val 4294916738 ecr 161681,nop,nop,sack 2 {456961:461245}{449821:455533},mptcp dss ack 3914563158], length 0
10:53:26.913894 IP 112.26.2.1.37753 > 112.26.2.8.44397: Flags [.], seq 461245:462673, ack 1, win 893, options [nop,nop,TS val 162253 ecr 4294915486,mptcp dss ack 2295998090 seq 3914604570 subseq 461245 len 1428 csum 0xcf6f], length 1428
10:53:26.959533 IP 112.26.2.1.37753 > 112.26.2.8.44397: Flags [.], seq 461245:462673, ack 1, win 893, options [nop,nop,TS val 162253 ecr 4294915486,mptcp dss ack 2295998090 seq 3914604570 subseq 461245 len 1428 csum 0xcf6f], length 1428
10:53:26.961029 IP 112.26.2.8.44397 > 112.26.2.1.37753: Flags [.], ack 448393, win 24418, options [nop,nop,TS val 4294916853 ecr 161681,nop,nop,sack 2 {456961:462673}{449821:455533},mptcp dss ack 3914563158], length 0
10:53:26.961386 IP 112.26.2.8.44397 > 112.26.2.1.37753: Flags [.], ack 448393, win 24418, options [nop,nop,TS val 4294916853 ecr 161681,nop,nop,sack 2 {456961:462673}{449821:455533},mptcp dss ack 3914563158], length 0
10:53:26.977739 IP 112.26.2.8.44397 > 112.26.2.1.37753: Flags [.], ack 448393, win 24418, options [nop,nop,TS val 4294916853 ecr 161681,nop,nop,sack 2 {456961:462673}{449821:455533},mptcp dss ack 3914563158], length 0
10:53:27.038243 IP 112.26.2.1.37753 > 112.26.2.8.44397: Flags [.], seq 462673:464101, ack 1, win 893, options [nop,nop,TS val 162505 ecr 4294915745,mptcp dss ack 2295998090 seq 3914617422 subseq 462673 len 1428 csum 0x657e], length 1428
10:53:27.060196 IP 112.26.2.1.37753 > 112.26.2.8.44397: Flags [.], seq 462673:464101, ack 1, win 893, options [nop,nop,TS val 162505 ecr 4294915745,mptcp dss ack 2295998090 seq 3914617422 subseq 462673 len 1428 csum 0x657e], length 1428
10:53:27.062267 IP 112.26.2.8.44397 > 112.26.2.1.37753: Flags [.], ack 448393, win 24418, options [nop,nop,TS val 4294916953 ecr 161681,nop,nop,sack 2 {456961:464101}{449821:455533},mptcp dss ack 3914563158], length 0
10:53:27.062584 IP 112.26.2.8.44397 > 112.26.2.1.37753: Flags [.], ack 448393, win 24418, options [nop,nop,TS val 4294916953 ecr 161681,nop,nop,sack 2 {456961:464101}{449821:455533},mptcp dss ack 3914563158], length 0
10:53:27.092373 IP 112.26.2.8.44397 > 112.26.2.1.37753: Flags [.], ack 448393, win 24418, options [nop,nop,TS val 4294916953 ecr 161681,nop,nop,sack 2 {456961:464101}{449821:455533},mptcp dss ack 3914563158], length 0
10:53:27.141954 IP 112.26.2.1.37753 > 112.26.2.8.44397: Flags [.], seq 464101:465529, ack 1, win 893, options [nop,nop,TS val 162505 ecr 4294915745,mptcp dss ack 2295998090 seq 3914618850 subseq 464101 len 1428 csum 0xfd50], length 1428
10:53:27.147946 IP 112.26.2.1.37753 > 112.26.2.8.44397: Flags [.], seq 464101:465529, ack 1, win 893, options [nop,nop,TS val 162505 ecr 4294915745,mptcp dss ack 2295998090 seq 3914618850 subseq 464101 len 1428 csum 0xfd50], length 1428
10:53:27.159651 IP 112.26.2.8.44397 > 112.26.2.1.37753: Flags [.], ack 448393, win 24418, options [nop,nop,TS val 4294917035 ecr 161681,nop,nop,sack 2 {456961:465529}{449821:455533},mptcp dss ack 3914563158], length 0
10:53:27.159973 IP 112.26.2.8.44397 > 112.26.2.1.37753: Flags [.], ack 448393, win 24418, options [nop,nop,TS val 4294917035 ecr 161681,nop,nop,sack 2 {456961:465529}{449821:455533},mptcp dss ack 3914563158], length 0
10:53:27.208747 IP 112.26.2.8.44397 > 112.26.2.1.37753: Flags [.], ack 448393, win 24418, options [nop,nop,TS val 4294917035 ecr 161681,nop,nop,sack 2 {456961:465529}{449821:455533},mptcp dss ack 3914563158], length 0
10:53:27.272625 IP 112.26.2.1.37753 > 112.26.2.8.44397: Flags [.], seq 465529:466957, ack 1, win 893, options [nop,nop,TS val 162505 ecr 4294915745,mptcp dss ack 2295998090 seq 3914620278 subseq 465529 len 1428 csum 0x527f], length 1428
10:53:27.276513 IP 112.26.2.1.37753 > 112.26.2.8.44397: Flags [.], seq 465529:466957, ack 1, win 893, options [nop,nop,TS val 162505 ecr 4294915745,mptcp dss ack 2295998090 seq 3914620278 subseq 465529 len 1428 csum 0x527f], length 1428
10:53:27.281760 IP 112.26.2.8.44397 > 112.26.2.1.37753: Flags [.], ack 448393, win 24418, options [nop,nop,TS val 4294917170 ecr 161681,nop,nop,sack 2 {456961:466957}{449821:455533},mptcp dss ack 3914563158], length 0
10:53:27.282058 IP 112.26.2.8.44397 > 112.26.2.1.37753: Flags [.], ack 448393, win 24418, options [nop,nop,TS val 4294917170 ecr 161681,nop,nop,sack 2 {456961:466957}{449821:455533},mptcp dss ack 3914563158], length 0
10:53:27.317452 IP 112.26.2.8.44397 > 112.26.2.1.37753: Flags [.], ack 448393, win 24418, options [nop,nop,TS val 4294917170 ecr 161681,nop,nop,sack 2 {456961:466957}{449821:455533},mptcp dss ack 3914563158], length 0
10:53:27.393218 IP 112.26.2.1.37753 > 112.26.2.8.44397: Flags [.], seq 468385:469813, ack 1, win 893, options [nop,nop,TS val 162731 ecr 4294915969,mptcp dss ack 2295998090 seq 3914637414 subseq 468385 len 1428 csum 0x6c38], length 1428
10:53:27.397680 IP 112.26.2.1.37753 > 112.26.2.8.44397: Flags [.], seq 468385:469813, ack 1, win 893, options [nop,nop,TS val 162731 ecr 4294915969,mptcp dss ack 2295998090 seq 3914637414 subseq 468385 len 1428 csum 0x6c38], length 1428
10:53:27.406482 IP 112.26.2.8.44397 > 112.26.2.1.37753: Flags [.], ack 448393, win 24418, options [nop,nop,TS val 4294917292 ecr 161681,nop,nop,sack 2 {468385:469813}{456961:466957},mptcp dss ack 3914563158], length 0
10:53:27.406810 IP 112.26.2.8.44397 > 112.26.2.1.37753: Flags [.], ack 448393, win 24418, options [nop,nop,TS val 4294917292 ecr 161681,nop,nop,sack 2 {468385:469813}{456961:466957},mptcp dss ack 3914563158], length 0
10:53:27.421482 IP 112.26.2.8.44397 > 112.26.2.1.37753: Flags [.], ack 448393, win 24418, options [nop,nop,TS val 4294917292 ecr 161681,nop,nop,sack 2 {468385:469813}{456961:466957},mptcp dss ack 3914563158], length 0
10:53:27.514871 IP 112.26.2.1.37753 > 112.26.2.8.44397: Flags [.], seq 469813:471241, ack 1, win 893, options [nop,nop,TS val 162731 ecr 4294915969,mptcp dss ack 2295998090 seq 3914638842 subseq 469813 len 1428 csum 0xf372], length 1428
10:53:27.534311 IP 112.26.2.1.37753 > 112.26.2.8.44397: Flags [.], seq 469813:471241, ack 1, win 893, options [nop,nop,TS val 162731 ecr 4294915969,mptcp dss ack 2295998090 seq 3914638842 subseq 469813 len 1428 csum 0xf372], length 1428
10:53:27.540006 IP 112.26.2.8.44397 > 112.26.2.1.37753: Flags [.], ack 448393, win 24418, options [nop,nop,TS val 4294917428 ecr 161681,nop,nop,sack 2 {468385:471241}{456961:466957},mptcp dss ack 3914563158], length 0
10:53:27.540303 IP 112.26.2.8.44397 > 112.26.2.1.37753: Flags [.], ack 448393, win 24418, options [nop,nop,TS val 4294917428 ecr 161681,nop,nop,sack 2 {468385:471241}{456961:466957},mptcp dss ack 3914563158], length 0
10:53:27.564294 IP 112.26.2.8.44397 > 112.26.2.1.37753: Flags [.], ack 448393, win 24418, options [nop,nop,TS val 4294917428 ecr 161681,nop,nop,sack 2 {468385:471241}{456961:466957},mptcp dss ack 3914563158], length 0
10:53:27.645160 IP 112.26.2.1.37753 > 112.26.2.8.44397: Flags [.], seq 472669:474097, ack 1, win 893, options [nop,nop,TS val 163017 ecr 4294916219,mptcp dss ack 2295998090 seq 3914651694 subseq 472669 len 1428 csum 0x7976], length 1428
10:53:27.648803 IP 112.26.2.1.37753 > 112.26.2.8.44397: Flags [.], seq 472669:474097, ack 1, win 893, options [nop,nop,TS val 163017 ecr 4294916219,mptcp dss ack 2295998090 seq 3914651694 subseq 472669 len 1428 csum 0x7976], length 1428
10:53:27.650714 IP 112.26.2.8.44397 > 112.26.2.1.37753: Flags [.], ack 448393, win 24418, options [nop,nop,TS val 4294917543 ecr 161681,nop,nop,sack 2 {472669:474097}{468385:471241},mptcp dss ack 3914563158], length 0
10:53:27.651024 IP 112.26.2.8.44397 > 112.26.2.1.37753: Flags [.], ack 448393, win 24418, options [nop,nop,TS val 4294917543 ecr 161681,nop,nop,sack 2 {472669:474097}{468385:471241},mptcp dss ack 3914563158], length 0
10:53:27.661726 IP 112.26.2.8.44397 > 112.26.2.1.37753: Flags [.], ack 448393, win 24418, options [nop,nop,TS val 4294917543 ecr 161681,nop,nop,sack 2 {472669:474097}{468385:471241},mptcp dss ack 3914563158], length 0
10:53:27.752816 IP 112.26.2.1.37753 > 112.26.2.8.44397: Flags [.], seq 448393:449821, ack 1, win 893, options [nop,nop,TS val 163113 ecr 4294916348,mptcp dss ack 2295998090 seq 3914571726 subseq 448393 len 1428 csum 0x8b08], length 1428
10:53:27.754672 IP 112.26.2.1.37753 > 112.26.2.8.44397: Flags [.], seq 448393:449821, ack 1, win 893, options [nop,nop,TS val 163113 ecr 4294916348,mptcp dss ack 2295998090 seq 3914571726 subseq 448393 len 1428 csum 0x8b08], length 1428
10:53:27.757670 IP 112.26.2.8.44397 > 112.26.2.1.37753: Flags [.], ack 455533, win 24418, options [nop,nop,TS val 4294917649 ecr 163113,nop,nop,sack 2 {472669:474097}{468385:471241},mptcp dss ack 3914563158], length 0
10:53:27.758001 IP 112.26.2.8.44397 > 112.26.2.1.37753: Flags [.], ack 455533, win 24418, options [nop,nop,TS val 4294917649 ecr 163113,nop,nop,sack 2 {472669:474097}{468385:471241},mptcp dss ack 3914563158], length 0
10:53:27.765305 IP 112.26.2.8.44397 > 112.26.2.1.37753: Flags [.], ack 455533, win 24418, options [nop,nop,TS val 4294917649 ecr 163113,nop,nop,sack 2 {472669:474097}{468385:471241},mptcp dss ack 3914563158], length 0
10:53:27.899131 IP 112.26.2.1.37753 > 112.26.2.8.44397: Flags [.], seq 474097:475525, ack 1, win 893, options [nop,nop,TS val 163274 ecr 4294916421,mptcp dss ack 2295998090 seq 3914665974 subseq 474097 len 1428 csum 0x39e9], length 1428
10:53:27.901388 IP 112.26.2.1.37753 > 112.26.2.8.44397: Flags [.], seq 474097:475525, ack 1, win 893, options [nop,nop,TS val 163274 ecr 4294916421,mptcp dss ack 2295998090 seq 3914665974 subseq 474097 len 1428 csum 0x39e9], length 1428
10:53:27.928022 IP 112.26.2.8.44397 > 112.26.2.1.37753: Flags [.], ack 455533, win 24078, options [nop,nop,TS val 4294917795 ecr 163113,nop,nop,sack 2 {472669:475525}{468385:471241},mptcp dss ack 3914590290], length 0
10:53:27.928321 IP 112.26.2.8.44397 > 112.26.2.1.37753: Flags [.], ack 455533, win 24078, options [nop,nop,TS val 4294917795 ecr 163113,nop,nop,sack 2 {472669:475525}{468385:471241},mptcp dss ack 3914590290], length 0
10:53:27.940218 IP 112.26.2.8.44397 > 112.26.2.1.37753: Flags [.], ack 455533, win 24078, options [nop,nop,TS val 4294917795 ecr 163113,nop,nop,sack 2 {472669:475525}{468385:471241},mptcp dss ack 3914590290], length 0
10:53:28.043285 IP 112.26.2.1.37753 > 112.26.2.8.44397: Flags [.], seq 475525:476953, ack 1, win 893, options [nop,nop,TS val 163569 ecr 4294916738,mptcp dss ack 2295998090 seq 3914675970 subseq 475525 len 1428 csum 0x4b52], length 1428
10:53:28.047600 IP 112.26.2.1.37753 > 112.26.2.8.44397: Flags [.], seq 475525:476953, ack 1, win 893, options [nop,nop,TS val 163569 ecr 4294916738,mptcp dss ack 2295998090 seq 3914675970 subseq 475525 len 1428 csum 0x4b52], length 1428
10:53:28.051420 IP 112.26.2.8.44397 > 112.26.2.1.37753: Flags [.], ack 455533, win 24078, options [nop,nop,TS val 4294917941 ecr 163113,nop,nop,sack 2 {472669:476953}{468385:471241},mptcp dss ack 3914590290], length 0
10:53:28.051733 IP 112.26.2.8.44397 > 112.26.2.1.37753: Flags [.], ack 455533, win 24078, options [nop,nop,TS val 4294917941 ecr 163113,nop,nop,sack 2 {472669:476953}{468385:471241},mptcp dss ack 3914590290], length 0
10:53:28.066431 IP 112.26.2.8.44397 > 112.26.2.1.37753: Flags [.], ack 455533, win 24078, options [nop,nop,TS val 4294917941 ecr 163113,nop,nop,sack 2 {472669:476953}{468385:471241},mptcp dss ack 3914590290], length 0
10:53:28.149282 IP 112.26.2.1.37753 > 112.26.2.8.44397: Flags [.], seq 476953:478381, ack 1, win 893, options [nop,nop,TS val 163685 ecr 4294916853,mptcp dss ack 2295998090 seq 3914678826 subseq 476953 len 1428 csum 0xa288], length 1428
10:53:28.152247 IP 112.26.2.1.37753 > 112.26.2.8.44397: Flags [.], seq 476953:478381, ack 1, win 893, options [nop,nop,TS val 163685 ecr 4294916853,mptcp dss ack 2295998090 seq 3914678826 subseq 476953 len 1428 csum 0xa288], length 1428
10:53:28.154322 IP 112.26.2.8.44397 > 112.26.2.1.37753: Flags [.], ack 455533, win 24078, options [nop,nop,TS val 4294918046 ecr 163113,nop,nop,sack 2 {472669:478381}{468385:471241},mptcp dss ack 3914590290], length 0
10:53:28.154687 IP 112.26.2.8.44397 > 112.26.2.1.37753: Flags [.], ack 455533, win 24078, options [nop,nop,TS val 4294918046 ecr 163113,nop,nop,sack 2 {472669:478381}{468385:471241},mptcp dss ack 3914590290], length 0
10:53:28.210461 IP 112.26.2.8.44397 > 112.26.2.1.37753: Flags [.], ack 455533, win 24078, options [nop,nop,TS val 4294918046 ecr 163113,nop,nop,sack 2 {472669:478381}{468385:471241},mptcp dss ack 3914590290], length 0
10:53:28.310581 IP 112.26.2.1.37753 > 112.26.2.8.44397: Flags [.], seq 466957:468385, ack 1, win 893, options [nop,nop,TS val 164057 ecr 4294917292,mptcp dss ack 2295998090 seq 3914635986 subseq 466957 len 1428 csum 0x5fe6], length 1428
10:53:28.314431 IP 112.26.2.1.37753 > 112.26.2.8.44397: Flags [.], seq 466957:468385, ack 1, win 893, options [nop,nop,TS val 164057 ecr 4294917292,mptcp dss ack 2295998090 seq 3914635986 subseq 466957 len 1428 csum 0x5fe6], length 1428
10:53:28.341721 IP 112.26.2.8.44397 > 112.26.2.1.37753: Flags [.], ack 455533, win 24078, options [nop,nop,TS val 4294918208 ecr 163113,nop,nop,sack 2 {456961:471241}{472669:478381},mptcp dss ack 3914590290], length 0
10:53:28.341938 IP 112.26.2.8.44397 > 112.26.2.1.37753: Flags [.], ack 455533, win 24078, options [nop,nop,TS val 4294918208 ecr 163113,nop,nop,sack 2 {456961:471241}{472669:478381},mptcp dss ack 3914590290], length 0
10:53:28.374973 IP 112.26.2.8.44397 > 112.26.2.1.37753: Flags [.], ack 455533, win 24078, options [nop,nop,TS val 4294918208 ecr 163113,nop,nop,sack 2 {456961:471241}{472669:478381},mptcp dss ack 3914590290], length 0
10:53:28.410630 IP 112.26.2.1.37753 > 112.26.2.8.44397: Flags [.], seq 479809:481237, ack 1, win 893, options [nop,nop,TS val 164235 ecr 4294917428,mptcp dss ack 2295998090 seq 3914711670 subseq 479809 len 1428 csum 0xd389], length 1428
10:53:28.418784 IP 112.26.2.8.44397 > 112.26.2.1.37753: Flags [.], ack 455533, win 24078, options [nop,nop,TS val 4294918311 ecr 163113,nop,nop,sack 2 {479809:481237}{456961:471241},mptcp dss ack 3914590290], length 0
10:53:28.419091 IP 112.26.2.8.44397 > 112.26.2.1.37753: Flags [.], ack 455533, win 24078, options [nop,nop,TS val 4294918311 ecr 163113,nop,nop,sack 2 {479809:481237}{456961:471241},mptcp dss ack 3914590290], length 0
10:53:28.428409 IP 112.26.2.1.37753 > 112.26.2.8.44397: Flags [.], seq 479809:481237, ack 1, win 893, options [nop,nop,TS val 164235 ecr 4294917428,mptcp dss ack 2295998090 seq 3914711670 subseq 479809 len 1428 csum 0xd389], length 1428
10:53:28.478920 IP 112.26.2.8.44397 > 112.26.2.1.37753: Flags [.], ack 455533, win 24078, options [nop,nop,TS val 4294918311 ecr 163113,nop,nop,sack 2 {479809:481237}{456961:471241},mptcp dss ack 3914590290], length 0
10:53:28.550528 IP 112.26.2.1.37753 > 112.26.2.8.44397: Flags [.], seq 481237:482665, ack 1, win 893, options [nop,nop,TS val 164407 ecr 4294917649,mptcp dss ack 2295998090 seq 3914714526 subseq 481237 len 1428 csum 0xf3b9], length 1428
10:53:28.555503 IP 112.26.2.1.37753 > 112.26.2.8.44397: Flags [.], seq 481237:482665, ack 1, win 893, options [nop,nop,TS val 164407 ecr 4294917649,mptcp dss ack 2295998090 seq 3914714526 subseq 481237 len 1428 csum 0xf3b9], length 1428
10:53:28.557427 IP 112.26.2.8.44397 > 112.26.2.1.37753: Flags [.], ack 455533, win 24078, options [nop,nop,TS val 4294918449 ecr 163113,nop,nop,sack 2 {479809:482665}{456961:471241},mptcp dss ack 3914590290], length 0
10:53:28.557752 IP 112.26.2.8.44397 > 112.26.2.1.37753: Flags [.], ack 455533, win 24078, options [nop,nop,TS val 4294918449 ecr 163113,nop,nop,sack 2 {479809:482665}{456961:471241},mptcp dss ack 3914590290], length 0
10:53:28.608542 IP 112.26.2.8.44397 > 112.26.2.1.37753: Flags [.], ack 455533, win 24078, options [nop,nop,TS val 4294918449 ecr 163113,nop,nop,sack 2 {479809:482665}{456961:471241},mptcp dss ack 3914590290], length 0
10:53:28.655302 IP 112.26.2.1.37753 > 112.26.2.8.44397: Flags [.], seq 482665:484093, ack 1, win 893, options [nop,nop,TS val 164407 ecr 4294917649,mptcp dss ack 2295998090 seq 3914715954 subseq 482665 len 1428 csum 0x728b], length 1428
10:53:28.656850 IP 112.26.2.8.44397 > 112.26.2.1.37753: Flags [.], ack 455533, win 24078, options [nop,nop,TS val 4294918549 ecr 163113,nop,nop,sack 2 {479809:484093}{456961:471241},mptcp dss ack 3914590290], length 0
10:53:28.657152 IP 112.26.2.8.44397 > 112.26.2.1.37753: Flags [.], ack 455533, win 24078, options [nop,nop,TS val 4294918549 ecr 163113,nop,nop,sack 2 {479809:484093}{456961:471241},mptcp dss ack 3914590290], length 0
10:53:28.674778 IP 112.26.2.1.37753 > 112.26.2.8.44397: Flags [.], seq 482665:484093, ack 1, win 893, options [nop,nop,TS val 164407 ecr 4294917649,mptcp dss ack 2295998090 seq 3914715954 subseq 482665 len 1428 csum 0x728b], length 1428
10:53:28.691031 IP 112.26.2.8.44397 > 112.26.2.1.37753: Flags [.], ack 455533, win 24078, options [nop,nop,TS val 4294918549 ecr 163113,nop,nop,sack 2 {479809:484093}{456961:471241},mptcp dss ack 3914590290], length 0
10:53:28.728213 IP 112.26.2.1.37753 > 112.26.2.8.44397: Flags [.], seq 484093:485521, ack 1, win 893, options [nop,nop,TS val 164407 ecr 4294917649,mptcp dss ack 2295998090 seq 3914717382 subseq 484093 len 1428 csum 0xcb1e], length 1428
10:53:28.759551 IP 112.26.2.1.37753 > 112.26.2.8.44397: Flags [.], seq 484093:485521, ack 1, win 893, options [nop,nop,TS val 164407 ecr 4294917649,mptcp dss ack 2295998090 seq 3914717382 subseq 484093 len 1428 csum 0xcb1e], length 1428
10:53:28.764256 IP 112.26.2.8.44397 > 112.26.2.1.37753: Flags [.], ack 455533, win 24078, options [nop,nop,TS val 4294918653 ecr 163113,nop,nop,sack 2 {479809:485521}{456961:471241},mptcp dss ack 3914590290], length 0
10:53:28.764526 IP 112.26.2.8.44397 > 112.26.2.1.37753: Flags [.], ack 455533, win 24078, options [nop,nop,TS val 4294918653 ecr 163113,nop,nop,sack 2 {479809:485521}{456961:471241},mptcp dss ack 3914590290], length 0
10:53:28.785692 IP 112.26.2.1.37753 > 112.26.2.8.44397: Flags [.], seq 485521:486949, ack 1, win 893, options [nop,nop,TS val 164596 ecr 4294917795,mptcp dss ack 2295998090 seq 3914734518 subseq 485521 len 1428 csum 0x3449], length 1428
10:53:28.811329 IP 112.26.2.8.44397 > 112.26.2.1.37753: Flags [.], ack 455533, win 24078, options [nop,nop,TS val 4294918653 ecr 163113,nop,nop,sack 2 {479809:485521}{456961:471241},mptcp dss ack 3914590290], length 0
10:53:28.876410 IP 112.26.2.1.37753 > 112.26.2.8.44397: Flags [.], seq 455533:456961, ack 1, win 893, options [nop,nop,TS val 164704 ecr 4294917941,mptcp dss ack 2295998090 seq 3914590290 subseq 455533 len 1428 csum 0x6510], length 1428
10:53:28.894456 IP 112.26.2.1.37753 > 112.26.2.8.44397: Flags [.], seq 485521:486949, ack 1, win 893, options [nop,nop,TS val 164596 ecr 4294917795,mptcp dss ack 2295998090 seq 3914734518 subseq 485521 len 1428 csum 0x3449], length 1428
10:53:28.903954 IP 112.26.2.8.44397 > 112.26.2.1.37753: Flags [.], ack 455533, win 24078, options [nop,nop,TS val 4294918788 ecr 163113,nop,nop,sack 2 {479809:486949}{456961:471241},mptcp dss ack 3914590290], length 0
10:53:28.904262 IP 112.26.2.8.44397 > 112.26.2.1.37753: Flags [.], ack 455533, win 24078, options [nop,nop,TS val 4294918788 ecr 163113,nop,nop,sack 2 {479809:486949}{456961:471241},mptcp dss ack 3914590290], length 0
10:53:28.926556 IP 112.26.2.8.44397 > 112.26.2.1.37753: Flags [.], ack 455533, win 24078, options [nop,nop,TS val 4294918788 ecr 163113,nop,nop,sack 2 {479809:486949}{456961:471241},mptcp dss ack 3914590290], length 0
10:53:28.975326 IP 112.26.2.1.37753 > 112.26.2.8.44397: Flags [.], seq 455533:456961, ack 1, win 893, options [nop,nop,TS val 164704 ecr 4294917941,mptcp dss ack 2295998090 seq 3914590290 subseq 455533 len 1428 csum 0x6510], length 1428
10:53:28.977698 IP 112.26.2.8.44397 > 112.26.2.1.37753: Flags [.], ack 471241, win 23265, options [nop,nop,TS val 4294918869 ecr 164704,nop,nop,sack 2 {479809:486949}{472669:478381},mptcp dss ack 3914645982], length 0
10:53:28.978017 IP 112.26.2.8.44397 > 112.26.2.1.37753: Flags [.], ack 471241, win 23265, options [nop,nop,TS val 4294918869 ecr 164704,nop,nop,sack 2 {479809:486949}{472669:478381},mptcp dss ack 3914645982], length 0
10:53:28.981711 IP 112.26.2.8.44397 > 112.26.2.1.37753: Flags [.], ack 471241, win 23265, options [nop,nop,TS val 4294918869 ecr 164704,nop,nop,sack 2 {479809:486949}{472669:478381},mptcp dss ack 3914645982], length 0
10:53:29.050344 IP 112.26.2.1.37753 > 112.26.2.8.44397: Flags [.], seq 486949:488377, ack 1, win 893, options [nop,nop,TS val 164839 ecr 4294918046,mptcp dss ack 2295998090 seq 3914741658 subseq 486949 len 1428 csum 0x71dd], length 1428
10:53:29.085977 IP 112.26.2.1.37753 > 112.26.2.8.44397: Flags [.], seq 486949:488377, ack 1, win 893, options [nop,nop,TS val 164839 ecr 4294918046,mptcp dss ack 2295998090 seq 3914741658 subseq 486949 len 1428 csum 0x71dd], length 1428
10:53:29.093667 IP 112.26.2.8.44397 > 112.26.2.1.37753: Flags [.], ack 471241, win 23862, options [nop,nop,TS val 4294918979 ecr 164704,nop,nop,sack 2 {479809:488377}{472669:478381},mptcp dss ack 3914645982], length 0
10:53:29.093937 IP 112.26.2.8.44397 > 112.26.2.1.37753: Flags [.], ack 471241, win 23862, options [nop,nop,TS val 4294918979 ecr 164704,nop,nop,sack 2 {479809:488377}{472669:478381},mptcp dss ack 3914645982], length 0
10:53:29.133091 IP 112.26.2.8.44397 > 112.26.2.1.37753: Flags [.], ack 471241, win 23862, options [nop,nop,TS val 4294918979 ecr 164704,nop,nop,sack 2 {479809:488377}{472669:478381},mptcp dss ack 3914645982], length 0
10:53:29.182060 IP 112.26.2.1.37753 > 112.26.2.8.44397: Flags [.], seq 478381:479809, ack 1, win 893, options [nop,nop,TS val 165011 ecr 4294918208,mptcp dss ack 2295998090 seq 3914701674 subseq 478381 len 1428 csum 0xe28], length 1428
10:53:29.184972 IP 112.26.2.1.37753 > 112.26.2.8.44397: Flags [.], seq 478381:479809, ack 1, win 893, options [nop,nop,TS val 165011 ecr 4294918208,mptcp dss ack 2295998090 seq 3914701674 subseq 478381 len 1428 csum 0xe28], length 1428
10:53:29.218395 IP 112.26.2.8.44397 > 112.26.2.1.37753: Flags [.], ack 471241, win 23862, options [nop,nop,TS val 4294919078 ecr 164704,nop,nop,sack 1 {472669:488377},mptcp dss ack 3914645982], length 0
10:53:29.218637 IP 112.26.2.8.44397 > 112.26.2.1.37753: Flags [.], ack 471241, win 23862, options [nop,nop,TS val 4294919078 ecr 164704,nop,nop,sack 1 {472669:488377},mptcp dss ack 3914645982], length 0
10:53:29.231133 IP 112.26.2.8.44397 > 112.26.2.1.37753: Flags [.], ack 471241, win 23862, options [nop,nop,TS val 4294919078 ecr 164704,nop,nop,sack 1 {472669:488377},mptcp dss ack 3914645982], length 0
10:53:29.314057 IP 112.26.2.1.37753 > 112.26.2.8.44397: Flags [.], seq 488377:489805, ack 1, win 893, options [nop,nop,TS val 165159 ecr 4294918311,mptcp dss ack 2295998090 seq 3914760222 subseq 488377 len 1428 csum 0xae92], length 1428
10:53:29.318087 IP 112.26.2.1.37753 > 112.26.2.8.44397: Flags [.], seq 488377:489805, ack 1, win 893, options [nop,nop,TS val 165159 ecr 4294918311,mptcp dss ack 2295998090 seq 3914760222 subseq 488377 len 1428 csum 0xae92], length 1428
10:53:29.320132 IP 112.26.2.8.44397 > 112.26.2.1.37753: Flags [.], ack 471241, win 23862, options [nop,nop,TS val 4294919211 ecr 164704,nop,nop,sack 1 {472669:489805},mptcp dss ack 3914645982], length 0
10:53:29.320487 IP 112.26.2.8.44397 > 112.26.2.1.37753: Flags [.], ack 471241, win 23862, options [nop,nop,TS val 4294919211 ecr 164704,nop,nop,sack 1 {472669:489805},mptcp dss ack 3914645982], length 0
10:53:29.337005 IP 112.26.2.8.44397 > 112.26.2.1.37753: Flags [.], ack 471241, win 23862, options [nop,nop,TS val 4294919211 ecr 164704,nop,nop,sack 1 {472669:489805},mptcp dss ack 3914645982], length 0
10:53:29.425784 IP 112.26.2.1.37753 > 112.26.2.8.44397: Flags [.], seq 471241:472669, ack 1, win 893, options [nop,nop,TS val 165250 ecr 4294918449,mptcp dss ack 2295998090 seq 3914645982 subseq 471241 len 1428 csum 0xb56a], length 1428
10:53:29.431822 IP 112.26.2.1.37753 > 112.26.2.8.44397: Flags [.], seq 471241:472669, ack 1, win 893, options [nop,nop,TS val 165250 ecr 4294918449,mptcp dss ack 2295998090 seq 3914645982 subseq 471241 len 1428 csum 0xb56a], length 1428
10:53:29.437485 IP 112.26.2.8.44397 > 112.26.2.1.37753: Flags [.], ack 489805, win 23616, options [nop,nop,TS val 4294919325 ecr 165250,mptcp dss ack 3914707386], length 0
10:53:29.437846 IP 112.26.2.8.44397 > 112.26.2.1.37753: Flags [.], ack 489805, win 23616, options [nop,nop,TS val 4294919325 ecr 165250,mptcp dss ack 3914707386], length 0
10:53:29.472297 IP 112.26.2.8.44397 > 112.26.2.1.37753: Flags [.], ack 489805, win 23616, options [nop,nop,TS val 4294919325 ecr 165250,mptcp dss ack 3914707386], length 0
10:53:29.568379 IP 112.26.2.1.37753 > 112.26.2.8.44397: Flags [.], seq 489805:491233, ack 1, win 893, options [nop,nop,TS val 165369 ecr 4294918549,mptcp dss ack 2295998090 seq 3914773074 subseq 489805 len 1428 csum 0xbf74], length 1428
10:53:29.574421 IP 112.26.2.1.37753 > 112.26.2.8.44397: Flags [.], seq 489805:491233, ack 1, win 893, options [nop,nop,TS val 165369 ecr 4294918549,mptcp dss ack 2295998090 seq 3914773074 subseq 489805 len 1428 csum 0xbf74], length 1428
10:53:29.577974 IP 112.26.2.8.44397 > 112.26.2.1.37753: Flags [.], ack 491233, win 24275, options [nop,nop,TS val 4294919468 ecr 165369,mptcp dss ack 3914707386], length 0
10:53:29.578147 IP 112.26.2.8.44397 > 112.26.2.1.37753: Flags [.], ack 491233, win 24275, options [nop,nop,TS val 4294919468 ecr 165369,mptcp dss ack 3914707386], length 0
10:53:29.589051 IP 112.26.2.8.44397 > 112.26.2.1.37753: Flags [.], ack 491233, win 24275, options [nop,nop,TS val 4294919468 ecr 165369,mptcp dss ack 3914707386], length 0
10:53:29.663448 IP 112.26.2.1.37753 > 112.26.2.8.44397: Flags [.], seq 491233:492661, ack 1, win 893, options [nop,nop,TS val 165491 ecr 4294918653,mptcp dss ack 2295998090 seq 3914781642 subseq 491233 len 1428 csum 0x9e06], length 1428
10:53:29.666134 IP 112.26.2.1.37753 > 112.26.2.8.44397: Flags [.], seq 491233:492661, ack 1, win 893, options [nop,nop,TS val 165491 ecr 4294918653,mptcp dss ack 2295998090 seq 3914781642 subseq 491233 len 1428 csum 0x9e06], length 1428
10:53:29.667936 IP 112.26.2.8.44397 > 112.26.2.1.37753: Flags [.], ack 492661, win 24275, options [nop,nop,TS val 4294919560 ecr 165491,mptcp dss ack 3914707386], length 0
10:53:29.668256 IP 112.26.2.8.44397 > 112.26.2.1.37753: Flags [.], ack 492661, win 24275, options [nop,nop,TS val 4294919560 ecr 165491,mptcp dss ack 3914707386], length 0
10:53:29.685916 IP 112.26.2.8.44397 > 112.26.2.1.37753: Flags [.], ack 492661, win 24275, options [nop,nop,TS val 4294919560 ecr 165491,mptcp dss ack 3914707386], length 0
10:53:29.800096 IP 112.26.2.1.37753 > 112.26.2.8.44397: Flags [.], seq 492661:494089, ack 1, win 893, options [nop,nop,TS val 165602 ecr 4294918788,mptcp dss ack 2295998090 seq 3914788782 subseq 492661 len 1428 csum 0x17ac], length 1428
10:53:29.802723 IP 112.26.2.1.37753 > 112.26.2.8.44397: Flags [.], seq 492661:494089, ack 1, win 893, options [nop,nop,TS val 165602 ecr 4294918788,mptcp dss ack 2295998090 seq 3914788782 subseq 492661 len 1428 csum 0x17ac], length 1428
10:53:29.807254 IP 112.26.2.8.44397 > 112.26.2.1.37753: Flags [.], ack 494089, win 24275, options [nop,nop,TS val 4294919697 ecr 165602,mptcp dss ack 3914707386], length 0
10:53:29.807588 IP 112.26.2.8.44397 > 112.26.2.1.37753: Flags [.], ack 494089, win 24275, options [nop,nop,TS val 4294919697 ecr 165602,mptcp dss ack 3914707386], length 0
10:53:29.814989 IP 112.26.2.8.44397 > 112.26.2.1.37753: Flags [.], ack 494089, win 24275, options [nop,nop,TS val 4294919697 ecr 165602,mptcp dss ack 3914707386], length 0
10:53:29.930427 IP 112.26.2.1.37753 > 112.26.2.8.44397: Flags [.], seq 495517:496945, ack 1, win 893, options [nop,nop,TS val 165623 ecr 4294918869,mptcp dss ack 2295998090 seq 3914794494 subseq 495517 len 1428 csum 0x3548], length 1428
10:53:29.933133 IP 112.26.2.1.37753 > 112.26.2.8.44397: Flags [.], seq 495517:496945, ack 1, win 893, options [nop,nop,TS val 165623 ecr 4294918869,mptcp dss ack 2295998090 seq 3914794494 subseq 495517 len 1428 csum 0x3548], length 1428
10:53:29.947268 IP 112.26.2.8.44397 > 112.26.2.1.37753: Flags [.], ack 494089, win 24275, options [nop,nop,TS val 4294919827 ecr 165602,nop,nop,sack 1 {495517:496945},mptcp dss ack 3914707386], length 0
10:53:29.947606 IP 112.26.2.8.44397 > 112.26.2.1.37753: Flags [.], ack 494089, win 24275, options [nop,nop,TS val 4294919827 ecr 165602,nop,nop,sack 1 {495517:496945},mptcp dss ack 3914707386], length 0
10:53:29.955062 IP 112.26.2.8.44397 > 112.26.2.1.37753: Flags [.], ack 494089, win 24275, options [nop,nop,TS val 4294919827 ecr 165602,nop,nop,sack 1 {495517:496945},mptcp dss ack 3914707386], length 0
10:53:30.046623 IP 112.26.2.1.37753 > 112.26.2.8.44397: Flags [.], seq 496945:498373, ack 1, win 893, options [nop,nop,TS val 165623 ecr 4294918869,mptcp dss ack 2295998090 seq 3914795922 subseq 496945 len 1428 csum 0x4874], length 1428
10:53:30.084453 IP 112.26.2.1.37753 > 112.26.2.8.44397: Flags [.], seq 496945:498373, ack 1, win 893, options [nop,nop,TS val 165623 ecr 4294918869,mptcp dss ack 2295998090 seq 3914795922 subseq 496945 len 1428 csum 0x4874], length 1428
10:53:30.086632 IP 112.26.2.8.44397 > 112.26.2.1.37753: Flags [.], ack 494089, win 24275, options [nop,nop,TS val 4294919978 ecr 165602,nop,nop,sack 1 {495517:498373},mptcp dss ack 3914707386], length 0
10:53:30.086957 IP 112.26.2.8.44397 > 112.26.2.1.37753: Flags [.], ack 494089, win 24275, options [nop,nop,TS val 4294919978 ecr 165602,nop,nop,sack 1 {495517:498373},mptcp dss ack 3914707386], length 0
10:53:30.097610 IP 112.26.2.8.44397 > 112.26.2.1.37753: Flags [.], ack 494089, win 24275, options [nop,nop,TS val 4294919978 ecr 165602,nop,nop,sack 1 {495517:498373},mptcp dss ack 3914707386], length 0
10:53:30.171012 IP 112.26.2.1.37753 > 112.26.2.8.44397: Flags [.], seq 499801:501229, ack 1, win 893, options [nop,nop,TS val 165897 ecr 4294919078,mptcp dss ack 2295998090 seq 3914804490 subseq 499801 len 1428 csum 0xa64d], length 1428
10:53:30.172455 IP 112.26.2.1.37753 > 112.26.2.8.44397: Flags [.], seq 499801:501229, ack 1, win 893, options [nop,nop,TS val 165897 ecr 4294919078,mptcp dss ack 2295998090 seq 3914804490 subseq 499801 len 1428 csum 0xa64d], length 1428
10:53:30.176199 IP 112.26.2.8.44397 > 112.26.2.1.37753: Flags [.], ack 494089, win 24275, options [nop,nop,TS val 4294920066 ecr 165602,nop,nop,sack 2 {499801:501229}{495517:498373},mptcp dss ack 3914707386], length 0
10:53:30.176508 IP 112.26.2.8.44397 > 112.26.2.1.37753: Flags [.], ack 494089, win 24275, options [nop,nop,TS val 4294920066 ecr 165602,nop,nop,sack 2 {499801:501229}{495517:498373},mptcp dss ack 3914707386], length 0
10:53:30.207467 IP 112.26.2.8.44397 > 112.26.2.1.37753: Flags [.], ack 494089, win 24275, options [nop,nop,TS val 4294920066 ecr 165602,nop,nop,sack 2 {499801:501229}{495517:498373},mptcp dss ack 3914707386], length 0
10:53:30.269480 IP 112.26.2.1.37753 > 112.26.2.8.44397: Flags [.], seq 501229:502657, ack 1, win 893, options [nop,nop,TS val 166084 ecr 4294919211,mptcp dss ack 2295998090 seq 3914814486 subseq 501229 len 1428 csum 0x72ac], length 1428
10:53:30.271223 IP 112.26.2.8.44397 > 112.26.2.1.37753: Flags [.], ack 494089, win 24275, options [nop,nop,TS val 4294920164 ecr 165602,nop,nop,sack 2 {499801:502657}{495517:498373},mptcp dss ack 3914707386], length 0
10:53:30.271544 IP 112.26.2.8.44397 > 112.26.2.1.37753: Flags [.], ack 494089, win 24275, options [nop,nop,TS val 4294920164 ecr 165602,nop,nop,sack 2 {499801:502657}{495517:498373},mptcp dss ack 3914707386], length 0
10:53:30.284305 IP 112.26.2.1.37753 > 112.26.2.8.44397: Flags [.], seq 501229:502657, ack 1, win 893, options [nop,nop,TS val 166084 ecr 4294919211,mptcp dss ack 2295998090 seq 3914814486 subseq 501229 len 1428 csum 0x72ac], length 1428
10:53:30.285897 IP 112.26.2.8.44397 > 112.26.2.1.37753: Flags [.], ack 494089, win 24275, options [nop,nop,TS val 4294920164 ecr 165602,nop,nop,sack 2 {499801:502657}{495517:498373},mptcp dss ack 3914707386], length 0
10:53:30.398105 IP 112.26.2.1.37753 > 112.26.2.8.44397: Flags [.], seq 502657:504085, ack 1, win 893, options [nop,nop,TS val 166084 ecr 4294919325,mptcp dss ack 2295998090 seq 3914815914 subseq 502657 len 1428 csum 0x4a46], length 1428
10:53:30.402522 IP 112.26.2.1.37753 > 112.26.2.8.44397: Flags [.], seq 502657:504085, ack 1, win 893, options [nop,nop,TS val 166084 ecr 4294919325,mptcp dss ack 2295998090 seq 3914815914 subseq 502657 len 1428 csum 0x4a46], length 1428
10:53:30.404416 IP 112.26.2.8.44397 > 112.26.2.1.37753: Flags [.], ack 494089, win 24275, options [nop,nop,TS val 4294920296 ecr 165602,nop,nop,sack 2 {499801:504085}{495517:498373},mptcp dss ack 3914707386], length 0
10:53:30.404699 IP 112.26.2.8.44397 > 112.26.2.1.37753: Flags [.], ack 494089, win 24275, options [nop,nop,TS val 4294920296 ecr 165602,nop,nop,sack 2 {499801:504085}{495517:498373},mptcp dss ack 3914707386], length 0
10:53:30.437121 IP 112.26.2.8.44397 > 112.26.2.1.37753: Flags [.], ack 494089, win 24275, options [nop,nop,TS val 4294920296 ecr 165602,nop,nop,sack 2 {499801:504085}{495517:498373},mptcp dss ack 3914707386], length 0
10:53:30.535007 IP 112.26.2.1.37753 > 112.26.2.8.44397: Flags [.], seq 504085:505513, ack 1, win 893, options [nop,nop,TS val 166084 ecr 4294919325,mptcp dss ack 2295998090 seq 3914817342 subseq 504085 len 1428 csum 0xd1cc], length 1428
10:53:30.537399 IP 112.26.2.1.37753 > 112.26.2.8.44397: Flags [.], seq 504085:505513, ack 1, win 893, options [nop,nop,TS val 166084 ecr 4294919325,mptcp dss ack 2295998090 seq 3914817342 subseq 504085 len 1428 csum 0xd1cc], length 1428
10:53:30.542639 IP 112.26.2.8.44397 > 112.26.2.1.37753: Flags [.], ack 494089, win 24275, options [nop,nop,TS val 4294920431 ecr 165602,nop,nop,sack 2 {499801:505513}{495517:498373},mptcp dss ack 3914707386], length 0
10:53:30.542901 IP 112.26.2.8.44397 > 112.26.2.1.37753: Flags [.], ack 494089, win 24275, options [nop,nop,TS val 4294920431 ecr 165602,nop,nop,sack 2 {499801:505513}{495517:498373},mptcp dss ack 3914707386], length 0
10:53:30.588711 IP 112.26.2.8.44397 > 112.26.2.1.37753: Flags [.], ack 494089, win 24275, options [nop,nop,TS val 4294920431 ecr 165602,nop,nop,sack 2 {499801:505513}{495517:498373},mptcp dss ack 3914707386], length 0
10:53:30.664711 IP 112.26.2.1.37753 > 112.26.2.8.44397: Flags [.], seq 505513:506941, ack 1, win 893, options [nop,nop,TS val 166225 ecr 4294919468,mptcp dss ack 2295998090 seq 3914823054 subseq 505513 len 1428 csum 0xc274], length 1428
10:53:30.674605 IP 112.26.2.1.37753 > 112.26.2.8.44397: Flags [.], seq 505513:506941, ack 1, win 893, options [nop,nop,TS val 166225 ecr 4294919468,mptcp dss ack 2295998090 seq 3914823054 subseq 505513 len 1428 csum 0xc274], length 1428
10:53:30.676298 IP 112.26.2.8.44397 > 112.26.2.1.37753: Flags [.], ack 494089, win 24275, options [nop,nop,TS val 4294920568 ecr 165602,nop,nop,sack 2 {499801:506941}{495517:498373},mptcp dss ack 3914707386], length 0
10:53:30.676675 IP 112.26.2.8.44397 > 112.26.2.1.37753: Flags [.], ack 494089, win 24275, options [nop,nop,TS val 4294920568 ecr 165602,nop,nop,sack 2 {499801:506941}{495517:498373},mptcp dss ack 3914707386], length 0
10:53:30.713884 IP 112.26.2.8.44397 > 112.26.2.1.37753: Flags [.], ack 494089, win 24275, options [nop,nop,TS val 4294920568 ecr 165602,nop,nop,sack 2 {499801:506941}{495517:498373},mptcp dss ack 3914707386], length 0
10:53:30.810299 IP 112.26.2.1.37753 > 112.26.2.8.44397: Flags [.], seq 508369:509797, ack 1, win 893, options [nop,nop,TS val 166324 ecr 4294919560,mptcp dss ack 2295998090 seq 3914825910 subseq 508369 len 1428 csum 0x28d5], length 1428
10:53:30.821174 IP 112.26.2.1.37753 > 112.26.2.8.44397: Flags [.], seq 508369:509797, ack 1, win 893, options [nop,nop,TS val 166324 ecr 4294919560,mptcp dss ack 2295998090 seq 3914825910 subseq 508369 len 1428 csum 0x28d5], length 1428
10:53:30.821913 IP 112.26.2.8.44397 > 112.26.2.1.37753: Flags [.], ack 494089, win 24275, options [nop,nop,TS val 4294920711 ecr 165602,nop,nop,sack 2 {508369:509797}{499801:506941},mptcp dss ack 3914707386], length 0
10:53:30.822247 IP 112.26.2.8.44397 > 112.26.2.1.37753: Flags [.], ack 494089, win 24275, options [nop,nop,TS val 4294920711 ecr 165602,nop,nop,sack 2 {508369:509797}{499801:506941},mptcp dss ack 3914707386], length 0
10:53:30.855778 IP 112.26.2.8.44397 > 112.26.2.1.37753: Flags [.], ack 494089, win 24275, options [nop,nop,TS val 4294920711 ecr 165602,nop,nop,sack 2 {508369:509797}{499801:506941},mptcp dss ack 3914707386], length 0
10:53:30.953987 IP 112.26.2.1.37753 > 112.26.2.8.44397: Flags [.], seq 509797:511225, ack 1, win 893, options [nop,nop,TS val 166456 ecr 4294919697,mptcp dss ack 2295998090 seq 3914828766 subseq 509797 len 1428 csum 0x53cd], length 1428
10:53:30.956579 IP 112.26.2.1.37753 > 112.26.2.8.44397: Flags [.], seq 509797:511225, ack 1, win 893, options [nop,nop,TS val 166456 ecr 4294919697,mptcp dss ack 2295998090 seq 3914828766 subseq 509797 len 1428 csum 0x53cd], length 1428
10:53:30.957714 IP 112.26.2.8.44397 > 112.26.2.1.37753: Flags [.], ack 494089, win 24275, options [nop,nop,TS val 4294920850 ecr 165602,nop,nop,sack 2 {508369:511225}{499801:506941},mptcp dss ack 3914707386], length 0
