10:52:36.422331 IP 112.26.0.8.47540 > 112.26.0.1.37753: Flags [S], seq 1638377377, win 65535, options [mss 1460,sackOK,TS val 4294864994 ecr 0,nop,wscale 6,mptcp capable csum {0x387d1706caeff15f}], length 0
10:52:36.432270 IP 112.26.0.1.37753 > 112.26.0.8.47540: Flags [S.], seq 328085945, ack 1638377378, win 28560, options [mss 1460,sackOK,TS val 113064 ecr 4294864994,nop,wscale 7,mptcp capable csum {0xa9600d5f0da32383}], length 0
10:52:36.622289 IP 112.26.0.1.37753 > 112.26.0.8.47540: Flags [S.], seq 328085945, ack 1638377378, win 28560, options [mss 1460,sackOK,TS val 113064 ecr 4294864994,nop,wscale 7,mptcp capable csum {0xa9600d5f0da32383}], length 0
10:52:36.728483 IP 112.26.0.8.47540 > 112.26.0.1.37753: Flags [.], ack 1, win 1369, options [nop,nop,TS val 4294866524 ecr 113064,mptcp capable csum {0x387d1706caeff15f,0xa9600d5f0da32383},mptcp dss ack 3912698378], length 0
10:52:36.728747 IP 112.26.0.1.37753 > 112.26.0.8.47540: Flags [.], ack 1, win 224, options [nop,nop,TS val 113370 ecr 4294866524,mptcp add-addr id 3 112.26.1.1,mptcp dss ack 2295998090], length 0
10:52:36.728782 IP 112.26.0.1.37753 > 112.26.0.8.47540: Flags [.], ack 1, win 224, options [nop,nop,TS val 113370 ecr 4294866524,mptcp add-addr id 5 112.26.3.1,mptcp dss ack 2295998090], length 0
10:52:36.728807 IP 112.26.0.1.37753 > 112.26.0.8.47540: Flags [.], ack 1, win 224, options [nop,nop,TS val 113370 ecr 4294866524,mptcp add-addr id 6 112.26.2.1,mptcp dss ack 2295998090], length 0
10:53:01.201111 IP 112.26.0.1.37753 > 112.26.0.8.47540: Flags [.], seq 265421:266849, ack 1, win 893, options [nop,nop,TS val 137494 ecr 4294889951,mptcp dss ack 2295998090 seq 3913480734 subseq 265421 len 1428 csum 0xaf11], length 1428
10:53:01.245994 IP 112.26.0.8.47540 > 112.26.0.1.37753: Flags [.], ack 256853, win 24422, options [nop,nop,TS val 4294890339 ecr 136572,mptcp dss ack 3913399338], length 0
10:53:01.246219 IP 112.26.0.1.37753 > 112.26.0.8.47540: Flags [.], seq 271133:272561, ack 1, win 893, options [nop,nop,TS val 137887 ecr 4294890339,mptcp dss ack 2295998090 seq 3913496442 subseq 271133 len 1428 csum 0x8fb7], length 1428
10:53:01.319501 IP 112.26.0.1.37753 > 112.26.0.8.47540: Flags [.], seq 266849:268277, ack 1, win 893, options [nop,nop,TS val 137620 ecr 4294890064,mptcp dss ack 2295998090 seq 3913487874 subseq 266849 len 1428 csum 0xedbd], length 1428
10:53:26.798058 IP 112.26.0.1.37753 > 112.26.0.8.47540: Flags [.], seq 551021:552449, ack 1, win 893, options [nop,nop,TS val 162327 ecr 4294915575,mptcp dss ack 2295998090 seq 3914605998 subseq 551021 len 1428 csum 0x80ba], length 1428
10:53:45.673849 IP 112.26.0.1.37753 > 112.26.0.8.47540: Flags [.], seq 758081:759509, ack 1, win 893, options [nop,nop,TS val 182023 ecr 4294935270,mptcp dss ack 2295998090 seq 3915502782 subseq 758081 len 1428 csum 0x91ce], length 1428
10:54:01.206182 IP 112.26.0.8.47540 > 112.26.0.1.37753: Flags [.], ack 925157, win 24289, options [nop,nop,TS val 4294951021 ecr 195580,nop,nop,sack 1 {926585:932297},mptcp dss ack 3916128246], length 0
10:54:01.271697 IP 112.26.0.1.37753 > 112.26.0.8.47540: Flags [.], seq 932297:933725, ack 1, win 893, options [nop,nop,TS val 196282 ecr 4294949528,mptcp dss ack 2295998090 seq 3916156806 subseq 932297 len 1428 csum 0x1144], length 1428
10:54:01.272787 IP 112.26.0.1.37753 > 112.26.0.8.47540: Flags [.], seq 956573:958001, ack 1, win 893, options [nop,nop,TS val 197914 ecr 4294951021,mptcp dss ack 2295998090 seq 3916246770 subseq 956573 len 1428 csum 0xaa14], length 1428
10:54:01.359418 IP 112.26.0.8.47540 > 112.26.0.1.37753: Flags [.], ack 925157, win 24289, options [nop,nop,TS val 4294951171 ecr 195580,nop,nop,sack 1 {926585:933725},mptcp dss ack 3916128246], length 0
10:54:01.362452 IP 112.26.0.1.37753 > 112.26.0.8.47540: Flags [.], seq 958001:959429, ack 1, win 893, options [nop,nop,TS val 198004 ecr 4294951171,mptcp dss ack 2295998090 seq 3916252482 subseq 958001 len 1428 csum 0xde09], length 1428
10:54:01.429312 IP 112.26.0.1.37753 > 112.26.0.8.47540: Flags [.], seq 933725:935153, ack 1, win 893, options [nop,nop,TS val 196282 ecr 4294949528,mptcp dss ack 2295998090 seq 3916158234 subseq 933725 len 1428 csum 0xe84f], length 1428
10:54:01.517146 IP 112.26.0.8.47540 > 112.26.0.1.37753: Flags [.], ack 925157, win 24289, options [nop,nop,TS val 4294951326 ecr 195580,nop,nop,sack 1 {926585:935153},mptcp dss ack 3916128246], length 0
10:54:01.571182 IP 112.26.0.1.37753 > 112.26.0.8.47540: Flags [.], seq 936581:938009, ack 1, win 893, options [nop,nop,TS val 196701 ecr 4294949932,mptcp dss ack 2295998090 seq 3916179654 subseq 936581 len 1428 csum 0x4d7c], length 1428
10:54:01.646242 IP 112.26.0.8.47540 > 112.26.0.1.37753: Flags [.], ack 925157, win 24289, options [nop,nop,TS val 4294951467 ecr 195580,nop,nop,sack 2 {936581:938009}{926585:935153},mptcp dss ack 3916128246], length 0
10:54:01.646843 IP 112.26.0.1.37753 > 112.26.0.8.47540: Flags [.], seq 935153:936581, ack 1, win 893, options [nop,nop,TS val 198288 ecr 4294951467,mptcp dss ack 2295998090 seq 3916178226 subseq 935153 len 1428 csum 0xed6e], length 1428
10:54:01.717866 IP 112.26.0.1.37753 > 112.26.0.8.47540: Flags [.], seq 939437:940865, ack 1, win 893, options [nop,nop,TS val 196701 ecr 4294949932,mptcp dss ack 2295998090 seq 3916182510 subseq 939437 len 1428 csum 0x83df], length 1428
10:54:01.787676 IP 112.26.0.8.47540 > 112.26.0.1.37753: Flags [.], ack 925157, win 24289, options [nop,nop,TS val 4294951606 ecr 195580,nop,nop,sack 2 {939437:940865}{936581:938009},mptcp dss ack 3916128246], length 0
10:54:01.787962 IP 112.26.0.1.37753 > 112.26.0.8.47540: Flags [.], seq 938009:939437, ack 1, win 893, options [nop,nop,TS val 198429 ecr 4294951606,mptcp dss ack 2295998090 seq 3916181082 subseq 938009 len 1428 csum 0xed3], length 1428
10:54:01.892797 IP 112.26.0.1.37753 > 112.26.0.8.47540: Flags [.], seq 942293:943721, ack 1, win 893, options [nop,nop,TS val 196701 ecr 4294949932,mptcp dss ack 2295998090 seq 3916185366 subseq 942293 len 1428 csum 0x6846], length 1428
10:54:01.928569 IP 112.26.0.8.47540 > 112.26.0.1.37753: Flags [.], ack 925157, win 24289, options [nop,nop,TS val 4294951809 ecr 195580,nop,nop,sack 2 {942293:943721}{939437:940865},mptcp dss ack 3916128246], length 0
10:54:02.034167 IP 112.26.0.1.37753 > 112.26.0.8.47540: Flags [.], seq 945149:946577, ack 1, win 893, options [nop,nop,TS val 196952 ecr 4294950177,mptcp dss ack 2295998090 seq 3916193934 subseq 945149 len 1428 csum 0xa2a6], length 1428
10:54:02.076506 IP 112.26.0.8.47540 > 112.26.0.1.37753: Flags [.], ack 925157, win 24289, options [nop,nop,TS val 4294951945 ecr 195580,nop,nop,sack 2 {945149:946577}{942293:943721},mptcp dss ack 3916128246], length 0
10:54:02.077100 IP 112.26.0.1.37753 > 112.26.0.8.47540: Flags [.], seq 940865:942293, ack 1, win 893, options [nop,nop,TS val 198718 ecr 4294951945,mptcp dss ack 2295998090 seq 3916183938 subseq 940865 len 1428 csum 0xe38f], length 1428
10:54:02.142994 IP 112.26.0.1.37753 > 112.26.0.8.47540: Flags [.], seq 946577:948005, ack 1, win 893, options [nop,nop,TS val 196952 ecr 4294950177,mptcp dss ack 2295998090 seq 3916195362 subseq 946577 len 1428 csum 0x7c4b], length 1428
10:54:02.190363 IP 112.26.0.8.47540 > 112.26.0.1.37753: Flags [.], ack 925157, win 24289, options [nop,nop,TS val 4294952078 ecr 195580,nop,nop,sack 2 {945149:948005}{942293:943721},mptcp dss ack 3916128246], length 0
10:54:02.190737 IP 112.26.0.1.37753 > 112.26.0.8.47540: Flags [.], seq 943721:945149, ack 1, win 893, options [nop,nop,TS val 198832 ecr 4294952078,mptcp dss ack 2295998090 seq 3916192506 subseq 943721 len 1428 csum 0x3f91], length 1428
10:54:02.267322 IP 112.26.0.1.37753 > 112.26.0.8.47540: Flags [.], seq 948005:949433, ack 1, win 893, options [nop,nop,TS val 197181 ecr 4294950417,mptcp dss ack 2295998090 seq 3916206786 subseq 948005 len 1428 csum 0x908e], length 1428
10:54:02.305881 IP 112.26.0.8.47540 > 112.26.0.1.37753: Flags [.], ack 925157, win 24289, options [nop,nop,TS val 4294952194 ecr 195580,nop,nop,sack 2 {945149:949433}{942293:943721},mptcp dss ack 3916128246], length 0
10:54:02.321901 IP 112.26.0.1.37753 > 112.26.0.8.47540: Flags [.], seq 959429:960857, ack 1, win 893, options [nop,nop,TS val 198963 ecr 4294952194,mptcp dss ack 2295998090 seq 3916276758 subseq 959429 len 1428 csum 0xc7d], length 1428
10:54:02.421546 IP 112.26.0.1.37753 > 112.26.0.8.47540: Flags [.], seq 952289:953717, ack 1, win 893, options [nop,nop,TS val 197427 ecr 4294950662,mptcp dss ack 2295998090 seq 3916221066 subseq 952289 len 1428 csum 0x315a], length 1428
10:54:02.467115 IP 112.26.0.8.47540 > 112.26.0.1.37753: Flags [.], ack 925157, win 24289, options [nop,nop,TS val 4294952318 ecr 195580,nop,nop,sack 2 {952289:953717}{945149:949433},mptcp dss ack 3916128246], length 0
10:54:02.467648 IP 112.26.0.1.37753 > 112.26.0.8.47540: Flags [.], seq 949433:950861, ack 1, win 893, options [nop,nop,TS val 199108 ecr 4294952318,mptcp dss ack 2295998090 seq 3916208214 subseq 949433 len 1428 csum 0xa2ca], length 1428
10:54:02.527366 IP 112.26.0.1.37753 > 112.26.0.8.47540: Flags [.], seq 953717:955145, ack 1, win 893, options [nop,nop,TS val 197427 ecr 4294950662,mptcp dss ack 2295998090 seq 3916222494 subseq 953717 len 1428 csum 0xeb3d], length 1428
10:54:02.572595 IP 112.26.0.8.47540 > 112.26.0.1.37753: Flags [.], ack 925157, win 24289, options [nop,nop,TS val 4294952429 ecr 195580,nop,nop,sack 2 {952289:955145}{945149:949433},mptcp dss ack 3916128246], length 0
10:54:02.573104 IP 112.26.0.1.37753 > 112.26.0.8.47540: Flags [.], seq 950861:952289, ack 1, win 893, options [nop,nop,TS val 199214 ecr 4294952429,mptcp dss ack 2295998090 seq 3916209642 subseq 950861 len 1428 csum 0x840d], length 1428
10:54:02.673850 IP 112.26.0.1.37753 > 112.26.0.8.47540: Flags [.], seq 925157:926585, ack 1, win 893, options [nop,nop,TS val 197697 ecr 4294950898,mptcp dss ack 2295998090 seq 3916128246 subseq 925157 len 1428 csum 0x57c7], length 1428
10:54:02.700263 IP 112.26.0.8.47540 > 112.26.0.1.37753: Flags [.], ack 935153, win 23509, options [nop,nop,TS val 4294952570 ecr 197697,nop,nop,sack 2 {952289:955145}{945149:949433},mptcp dss ack 3916178226], length 0
10:54:02.700529 IP 112.26.0.1.37753 > 112.26.0.8.47540: Flags [.], seq 955145:956573, ack 1, win 893, options [nop,nop,TS val 199341 ecr 4294952570,mptcp dss ack 2295998090 seq 3916235346 subseq 955145 len 1428 csum 0x3b63], length 1428
10:54:02.700629 IP 112.26.0.1.37753 > 112.26.0.8.47540: Flags [.], seq 960857:962285, ack 1, win 893, options [nop,nop,TS val 199341 ecr 4294952570,mptcp dss ack 2295998090 seq 3916295322 subseq 960857 len 1428 csum 0xb517], length 1428
10:54:02.700796 IP 112.26.0.1.37753 > 112.26.0.8.47540: Flags [.], seq 962285:963713, ack 1, win 893, options [nop,nop,TS val 199341 ecr 4294952570,mptcp dss ack 2295998090 seq 3916296750 subseq 962285 len 1428 csum 0xf649], length 1428
10:54:02.700900 IP 112.26.0.1.37753 > 112.26.0.8.47540: Flags [.], seq 963713:965141, ack 1, win 893, options [nop,nop,TS val 199341 ecr 4294952570,mptcp dss ack 2295998090 seq 3916298178 subseq 963713 len 1428 csum 0x7dae], length 1428
10:54:02.769597 IP 112.26.0.1.37753 > 112.26.0.8.47540: Flags [.], seq 956573:958001, ack 1, win 893, options [nop,nop,TS val 197914 ecr 4294951021,mptcp dss ack 2295998090 seq 3916246770 subseq 956573 len 1428 csum 0xaa14], length 1428
10:54:02.837031 IP 112.26.0.8.47540 > 112.26.0.1.37753: Flags [.], ack 935153, win 23976, options [nop,nop,TS val 4294952723 ecr 197697,nop,nop,sack 2 {956573:958001}{952289:955145},mptcp dss ack 3916178226], length 0
10:54:02.871846 IP 112.26.0.1.37753 > 112.26.0.8.47540: Flags [.], seq 965141:966569, ack 1, win 893, options [nop,nop,TS val 199512 ecr 4294952723,mptcp dss ack 2295998090 seq 3916302462 subseq 965141 len 1428 csum 0x3ff3], length 1428
10:54:02.907535 IP 112.26.0.1.37753 > 112.26.0.8.47540: Flags [.], seq 935153:936581, ack 1, win 893, options [nop,nop,TS val 198288 ecr 4294951467,mptcp dss ack 2295998090 seq 3916178226 subseq 935153 len 1428 csum 0xed6e], length 1428
10:54:02.986864 IP 112.26.0.8.47540 > 112.26.0.1.37753: Flags [.], ack 938009, win 23932, options [nop,nop,TS val 4294952859 ecr 198288,nop,nop,sack 2 {956573:958001}{952289:955145},mptcp dss ack 3916181082], length 0
10:54:02.987277 IP 112.26.0.1.37753 > 112.26.0.8.47540: Flags [.], seq 958001:959429, ack 1, win 893, options [nop,nop,TS val 199628 ecr 4294952859,mptcp dss ack 2295998090 seq 3916252482 subseq 958001 len 1428 csum 0xde09], length 1428
10:54:02.987377 IP 112.26.0.1.37753 > 112.26.0.8.47540: Flags [.], seq 966569:967997, ack 1, win 893, options [nop,nop,TS val 199628 ecr 4294952859,mptcp dss ack 2295998090 seq 3916311030 subseq 966569 len 1428 csum 0xd2b7], length 1428
10:54:03.052425 IP 112.26.0.1.37753 > 112.26.0.8.47540: Flags [.], seq 938009:939437, ack 1, win 893, options [nop,nop,TS val 198429 ecr 4294951606,mptcp dss ack 2295998090 seq 3916181082 subseq 938009 len 1428 csum 0xed3], length 1428
10:54:03.110853 IP 112.26.0.8.47540 > 112.26.0.1.37753: Flags [.], ack 940865, win 23888, options [nop,nop,TS val 4294952963 ecr 198429,nop,nop,sack 2 {956573:958001}{952289:955145},mptcp dss ack 3916183938], length 0
10:54:03.111304 IP 112.26.0.1.37753 > 112.26.0.8.47540: Flags [.], seq 967997:969425, ack 1, win 893, options [nop,nop,TS val 199752 ecr 4294952963,mptcp dss ack 2295998090 seq 3916316742 subseq 967997 len 1428 csum 0xe0d2], length 1428
10:54:03.111388 IP 112.26.0.1.37753 > 112.26.0.8.47540: Flags [.], seq 969425:970853, ack 1, win 893, options [nop,nop,TS val 199752 ecr 4294952963,mptcp dss ack 2295998090 seq 3916318170 subseq 969425 len 1428 csum 0xc9ca], length 1428
10:54:03.205154 IP 112.26.0.1.37753 > 112.26.0.8.47540: Flags [.], seq 940865:942293, ack 1, win 893, options [nop,nop,TS val 198718 ecr 4294951945,mptcp dss ack 2295998090 seq 3916183938 subseq 940865 len 1428 csum 0xe38f], length 1428
10:54:03.232803 IP 112.26.0.8.47540 > 112.26.0.1.37753: Flags [.], ack 943721, win 23790, options [nop,nop,TS val 4294953101 ecr 198718,nop,nop,sack 2 {956573:958001}{952289:955145},mptcp dss ack 3916192506], length 0
10:54:03.233352 IP 112.26.0.1.37753 > 112.26.0.8.47540: Flags [.], seq 970853:972281, ack 1, win 893, options [nop,nop,TS val 199874 ecr 4294953101,mptcp dss ack 2295998090 seq 3916323882 subseq 970853 len 1428 csum 0x6de5], length 1428
10:54:03.365908 IP 112.26.0.1.37753 > 112.26.0.8.47540: Flags [.], seq 959429:960857, ack 1, win 893, options [nop,nop,TS val 198963 ecr 4294952194,mptcp dss ack 2295998090 seq 3916276758 subseq 959429 len 1428 csum 0xc7d], length 1428
10:54:03.396390 IP 112.26.0.8.47540 > 112.26.0.1.37753: Flags [.], ack 943721, win 23886, options [nop,nop,TS val 4294953267 ecr 198718,nop,nop,sack 2 {959429:960857}{956573:958001},mptcp dss ack 3916192506], length 0
10:54:03.396663 IP 112.26.0.1.37753 > 112.26.0.8.47540: Flags [.], seq 943721:945149, ack 1, win 893, options [nop,nop,TS val 200038 ecr 4294953267,mptcp dss ack 2295998090 seq 3916192506 subseq 943721 len 1428 csum 0x3f91], length 1428
10:54:03.513787 IP 112.26.0.1.37753 > 112.26.0.8.47540: Flags [.], seq 949433:950861, ack 1, win 893, options [nop,nop,TS val 199108 ecr 4294952318,mptcp dss ack 2295998090 seq 3916208214 subseq 949433 len 1428 csum 0xa2ca], length 1428
10:54:03.542291 IP 112.26.0.8.47540 > 112.26.0.1.37753: Flags [.], ack 943721, win 23886, options [nop,nop,TS val 4294953409 ecr 198718,nop,nop,sack 2 {945149:950861}{959429:960857},mptcp dss ack 3916192506], length 0
10:54:03.546457 IP 112.26.0.1.37753 > 112.26.0.8.47540: Flags [.], seq 972281:973709, ack 1, win 893, options [nop,nop,TS val 200188 ecr 4294953409,mptcp dss ack 2295998090 seq 3916339590 subseq 972281 len 1428 csum 0x5d54], length 1428
10:54:03.586553 IP 112.26.0.1.37753 > 112.26.0.8.47540: Flags [.], seq 950861:952289, ack 1, win 893, options [nop,nop,TS val 199214 ecr 4294952429,mptcp dss ack 2295998090 seq 3916209642 subseq 950861 len 1428 csum 0x840d], length 1428
10:54:03.666989 IP 112.26.0.1.37753 > 112.26.0.8.47540: Flags [.], seq 955145:956573, ack 1, win 893, options [nop,nop,TS val 199341 ecr 4294952570,mptcp dss ack 2295998090 seq 3916235346 subseq 955145 len 1428 csum 0x3b63], length 1428
10:54:03.673415 IP 112.26.0.8.47540 > 112.26.0.1.37753: Flags [.], ack 943721, win 23886, options [nop,nop,TS val 4294953518 ecr 198718,nop,nop,sack 2 {945149:955145}{959429:960857},mptcp dss ack 3916192506], length 0
10:54:03.699362 IP 112.26.0.1.37753 > 112.26.0.8.47540: Flags [.], seq 973709:975137, ack 1, win 893, options [nop,nop,TS val 200340 ecr 4294953518,mptcp dss ack 2295998090 seq 3916348158 subseq 973709 len 1428 csum 0x66a3], length 1428
10:54:03.845559 IP 112.26.0.1.37753 > 112.26.0.8.47540: Flags [.], seq 962285:963713, ack 1, win 893, options [nop,nop,TS val 199341 ecr 4294952570,mptcp dss ack 2295998090 seq 3916296750 subseq 962285 len 1428 csum 0xf649], length 1428
10:54:03.897350 IP 112.26.0.8.47540 > 112.26.0.1.37753: Flags [.], ack 943721, win 23886, options [nop,nop,TS val 4294953624 ecr 198718,nop,nop,sack 2 {945149:958001}{959429:960857},mptcp dss ack 3916192506], length 0
10:54:03.943964 IP 112.26.0.1.37753 > 112.26.0.8.47540: Flags [.], seq 963713:965141, ack 1, win 893, options [nop,nop,TS val 199341 ecr 4294952570,mptcp dss ack 2295998090 seq 3916298178 subseq 963713 len 1428 csum 0x7dae], length 1428
10:54:03.978709 IP 112.26.0.8.47540 > 112.26.0.1.37753: Flags [.], ack 943721, win 23886, options [nop,nop,TS val 4294953724 ecr 198718,nop,nop,sack 2 {962285:963713}{945149:958001},mptcp dss ack 3916192506], length 0
10:54:03.979056 IP 112.26.0.1.37753 > 112.26.0.8.47540: Flags [.], seq 975137:976565, ack 1, win 893, options [nop,nop,TS val 200620 ecr 4294953624,mptcp dss ack 2295998090 seq 3916355298 subseq 975137 len 1428 csum 0x452f], length 1428
10:54:03.979180 IP 112.26.0.1.37753 > 112.26.0.8.47540: Flags [.], seq 960857:962285, ack 1, win 893, options [nop,nop,TS val 200620 ecr 4294953724,mptcp dss ack 2295998090 seq 3916295322 subseq 960857 len 1428 csum 0xb517], length 1428
10:54:04.027303 IP 112.26.0.1.37753 > 112.26.0.8.47540: Flags [.], seq 965141:966569, ack 1, win 893, options [nop,nop,TS val 199512 ecr 4294952723,mptcp dss ack 2295998090 seq 3916302462 subseq 965141 len 1428 csum 0x3ff3], length 1428
10:54:04.100781 IP 112.26.0.8.47540 > 112.26.0.1.37753: Flags [.], ack 943721, win 23886, options [nop,nop,TS val 4294953841 ecr 198718,nop,nop,sack 2 {962285:965141}{945149:958001},mptcp dss ack 3916192506], length 0
10:54:04.117421 IP 112.26.0.1.37753 > 112.26.0.8.47540: Flags [.], seq 976565:977993, ack 1, win 893, options [nop,nop,TS val 200758 ecr 4294953841,mptcp dss ack 2295998090 seq 3916362438 subseq 976565 len 1428 csum 0x4ea9], length 1428
10:54:04.188693 IP 112.26.0.1.37753 > 112.26.0.8.47540: Flags [.], seq 967997:969425, ack 1, win 893, options [nop,nop,TS val 199752 ecr 4294952963,mptcp dss ack 2295998090 seq 3916316742 subseq 967997 len 1428 csum 0xe0d2], length 1428
10:54:04.241638 IP 112.26.0.8.47540 > 112.26.0.1.37753: Flags [.], ack 943721, win 23886, options [nop,nop,TS val 4294954020 ecr 198718,nop,nop,sack 2 {962285:966569}{945149:958001},mptcp dss ack 3916192506], length 0
10:54:04.300097 IP 112.26.0.8.47540 > 112.26.0.1.37753: Flags [.], ack 943721, win 23886, options [nop,nop,TS val 4294954158 ecr 198718,nop,nop,sack 2 {967997:969425}{962285:966569},mptcp dss ack 3916192506], length 0
10:54:04.300430 IP 112.26.0.1.37753 > 112.26.0.8.47540: Flags [.], seq 977993:979421, ack 1, win 893, options [nop,nop,TS val 200941 ecr 4294954020,mptcp dss ack 2295998090 seq 3916372434 subseq 977993 len 1428 csum 0xcb7e], length 1428
10:54:04.300520 IP 112.26.0.1.37753 > 112.26.0.8.47540: Flags [.], seq 958001:959429, ack 1, win 893, options [nop,nop,TS val 200941 ecr 4294954158,mptcp dss ack 2295998090 seq 3916252482 subseq 958001 len 1428 csum 0xde09], length 1428
10:54:04.353355 IP 112.26.0.1.37753 > 112.26.0.8.47540: Flags [.], seq 969425:970853, ack 1, win 893, options [nop,nop,TS val 199752 ecr 4294952963,mptcp dss ack 2295998090 seq 3916318170 subseq 969425 len 1428 csum 0xc9ca], length 1428
10:54:04.457802 IP 112.26.0.1.37753 > 112.26.0.8.47540: Flags [.], seq 970853:972281, ack 1, win 893, options [nop,nop,TS val 199874 ecr 4294953101,mptcp dss ack 2295998090 seq 3916323882 subseq 970853 len 1428 csum 0x6de5], length 1428
10:54:04.476973 IP 112.26.0.8.47540 > 112.26.0.1.37753: Flags [.], ack 943721, win 23886, options [nop,nop,TS val 4294954250 ecr 198718,nop,nop,sack 2 {967997:970853}{962285:966569},mptcp dss ack 3916192506], length 0
10:54:04.477329 IP 112.26.0.1.37753 > 112.26.0.8.47540: Flags [.], seq 966569:967997, ack 1, win 893, options [nop,nop,TS val 201118 ecr 4294954250,mptcp dss ack 2295998090 seq 3916311030 subseq 966569 len 1428 csum 0xd2b7], length 1428
10:54:04.533862 IP 112.26.0.8.47540 > 112.26.0.1.37753: Flags [.], ack 943721, win 23886, options [nop,nop,TS val 4294954418 ecr 198718,nop,nop,sack 2 {967997:972281}{962285:966569},mptcp dss ack 3916192506], length 0
10:54:04.551504 IP 112.26.0.1.37753 > 112.26.0.8.47540: Flags [.], seq 943721:945149, ack 1, win 893, options [nop,nop,TS val 200038 ecr 4294953267,mptcp dss ack 2295998090 seq 3916192506 subseq 943721 len 1428 csum 0x3f91], length 1428
10:54:04.566536 IP 112.26.0.1.37753 > 112.26.0.8.47540: Flags [.], seq 979421:980849, ack 1, win 893, options [nop,nop,TS val 201207 ecr 4294954418,mptcp dss ack 2295998090 seq 3916382430 subseq 979421 len 1428 csum 0xcc5e], length 1428
10:54:04.651900 IP 112.26.0.8.47540 > 112.26.0.1.37753: Flags [.], ack 958001, win 23095, options [nop,nop,TS val 4294954535 ecr 200038,nop,nop,sack 2 {967997:972281}{962285:966569},mptcp dss ack 3916252482], length 0
10:54:04.652272 IP 112.26.0.1.37753 > 112.26.0.8.47540: Flags [.], seq 980849:982277, ack 1, win 893, options [nop,nop,TS val 201293 ecr 4294954535,mptcp dss ack 2295998090 seq 3916386714 subseq 980849 len 1428 csum 0xc9bb], length 1428
10:54:04.660184 IP 112.26.0.1.37753 > 112.26.0.8.47540: Flags [.], seq 972281:973709, ack 1, win 893, options [nop,nop,TS val 200188 ecr 4294953409,mptcp dss ack 2295998090 seq 3916339590 subseq 972281 len 1428 csum 0x5d54], length 1428
10:54:04.763032 IP 112.26.0.1.37753 > 112.26.0.8.47540: Flags [.], seq 973709:975137, ack 1, win 893, options [nop,nop,TS val 200340 ecr 4294953518,mptcp dss ack 2295998090 seq 3916348158 subseq 973709 len 1428 csum 0x66a3], length 1428
10:54:04.774681 IP 112.26.0.8.47540 > 112.26.0.1.37753: Flags [.], ack 958001, win 23736, options [nop,nop,TS val 4294954653 ecr 200038,nop,nop,sack 2 {967997:973709}{962285:966569},mptcp dss ack 3916252482], length 0
10:54:04.881109 IP 112.26.0.1.37753 > 112.26.0.8.47540: Flags [.], seq 975137:976565, ack 1, win 893, options [nop,nop,TS val 200620 ecr 4294953624,mptcp dss ack 2295998090 seq 3916355298 subseq 975137 len 1428 csum 0x452f], length 1428
10:54:04.916354 IP 112.26.0.8.47540 > 112.26.0.1.37753: Flags [.], ack 958001, win 23736, options [nop,nop,TS val 4294954743 ecr 200038,nop,nop,sack 2 {967997:975137}{962285:966569},mptcp dss ack 3916252482], length 0
10:54:05.007322 IP 112.26.0.8.47540 > 112.26.0.1.37753: Flags [.], ack 958001, win 23736, options [nop,nop,TS val 4294954835 ecr 200038,nop,nop,sack 2 {967997:976565}{962285:966569},mptcp dss ack 3916252482], length 0
10:54:05.022701 IP 112.26.0.1.37753 > 112.26.0.8.47540: Flags [.], seq 976565:977993, ack 1, win 893, options [nop,nop,TS val 200758 ecr 4294953841,mptcp dss ack 2295998090 seq 3916362438 subseq 976565 len 1428 csum 0x4ea9], length 1428
10:54:05.111422 IP 112.26.0.8.47540 > 112.26.0.1.37753: Flags [.], ack 958001, win 23736, options [nop,nop,TS val 4294954945 ecr 200038,nop,nop,sack 2 {967997:977993}{962285:966569},mptcp dss ack 3916252482], length 0
10:54:05.111796 IP 112.26.0.1.37753 > 112.26.0.8.47540: Flags [.], seq 960857:962285, ack 1, win 893, options [nop,nop,TS val 201753 ecr 4294954945,mptcp dss ack 2295998090 seq 3916295322 subseq 960857 len 1428 csum 0xb517], length 1428
10:54:05.134792 IP 112.26.0.1.37753 > 112.26.0.8.47540: Flags [.], seq 977993:979421, ack 1, win 893, options [nop,nop,TS val 200941 ecr 4294954020,mptcp dss ack 2295998090 seq 3916372434 subseq 977993 len 1428 csum 0xcb7e], length 1428
10:54:05.239107 IP 112.26.0.8.47540 > 112.26.0.1.37753: Flags [.], ack 958001, win 23736, options [nop,nop,TS val 4294955031 ecr 200038,nop,nop,sack 2 {967997:979421}{962285:966569},mptcp dss ack 3916252482], length 0
10:54:05.270216 IP 112.26.0.1.37753 > 112.26.0.8.47540: Flags [.], seq 958001:959429, ack 1, win 893, options [nop,nop,TS val 200941 ecr 4294954158,mptcp dss ack 2295998090 seq 3916252482 subseq 958001 len 1428 csum 0xde09], length 1428
10:54:05.355341 IP 112.26.0.1.37753 > 112.26.0.8.47540: Flags [.], seq 966569:967997, ack 1, win 893, options [nop,nop,TS val 201118 ecr 4294954250,mptcp dss ack 2295998090 seq 3916311030 subseq 966569 len 1428 csum 0xd2b7], length 1428
10:54:05.377428 IP 112.26.0.8.47540 > 112.26.0.1.37753: Flags [.], ack 960857, win 23550, options [nop,nop,TS val 4294955160 ecr 200941,nop,nop,sack 2 {967997:979421}{962285:966569},mptcp dss ack 3916295322], length 0
10:54:05.422224 IP 112.26.0.1.37753 > 112.26.0.8.47540: Flags [.], seq 979421:980849, ack 1, win 893, options [nop,nop,TS val 201207 ecr 4294954418,mptcp dss ack 2295998090 seq 3916382430 subseq 979421 len 1428 csum 0xcc5e], length 1428
10:54:05.448343 IP 112.26.0.8.47540 > 112.26.0.1.37753: Flags [.], ack 960857, win 24004, options [nop,nop,TS val 4294955255 ecr 200941,nop,nop,sack 1 {962285:979421},mptcp dss ack 3916295322], length 0
10:54:05.510065 IP 112.26.0.1.37753 > 112.26.0.8.47540: Flags [.], seq 980849:982277, ack 1, win 893, options [nop,nop,TS val 201293 ecr 4294954535,mptcp dss ack 2295998090 seq 3916386714 subseq 980849 len 1428 csum 0xc9bb], length 1428
10:54:05.538511 IP 112.26.0.8.47540 > 112.26.0.1.37753: Flags [.], ack 960857, win 24004, options [nop,nop,TS val 4294955357 ecr 200941,nop,nop,sack 1 {962285:980849},mptcp dss ack 3916295322], length 0
10:54:05.564845 IP 112.26.0.1.37753 > 112.26.0.8.47540: Flags [.], seq 960857:962285, ack 1, win 893, options [nop,nop,TS val 201753 ecr 4294954945,mptcp dss ack 2295998090 seq 3916295322 subseq 960857 len 1428 csum 0xb517], length 1428
10:54:05.635502 IP 112.26.0.8.47540 > 112.26.0.1.37753: Flags [.], ack 960857, win 24004, options [nop,nop,TS val 4294955417 ecr 200941,nop,nop,sack 1 {962285:982277},mptcp dss ack 3916295322], length 0
10:54:05.689662 IP 112.26.0.8.47540 > 112.26.0.1.37753: Flags [.], ack 982277, win 23632, options [nop,nop,TS val 4294955507 ecr 201753,mptcp dss ack 3916335306], length 0
10:54:05.743968 IP 112.26.0.1.37753 > 112.26.0.8.47540: Flags [F.], seq 982277, ack 1, win 893, options [nop,nop,TS val 202385 ecr 4294955507,mptcp dss ack 2295998090], length 0
10:54:05.753368 IP 112.26.0.1.37753 > 112.26.0.8.47540: Flags [F.], seq 982277, ack 1, win 893, options [nop,nop,TS val 202385 ecr 4294955507,mptcp dss ack 2295998090], length 0
10:54:05.807146 IP 112.26.0.8.47540 > 112.26.0.1.37753: Flags [.], ack 982278, win 24576, options [nop,nop,TS val 4294955692 ecr 202385,mptcp dss ack 3916393019], length 0
10:54:05.948380 IP 112.26.0.8.47540 > 112.26.0.1.37753: Flags [F.], seq 1, ack 982278, win 24576, options [nop,nop,TS val 4294955779 ecr 202385,mptcp dss ack 3916393019], length 0
10:54:05.948656 IP 112.26.0.1.37753 > 112.26.0.8.47540: Flags [.], ack 2, win 893, options [nop,nop,TS val 202590 ecr 4294955779,mptcp dss ack 2295998091], length 0
10:54:05.954785 IP 112.26.0.1.37753 > 112.26.0.8.47540: Flags [.], ack 2, win 893, options [nop,nop,TS val 202590 ecr 4294955779,mptcp dss ack 2295998091], length 0

