10:52:44.158806 IP 112.26.1.8.37887 > 112.26.1.1.37753: Flags [S], seq 1087380066, win 65535, options [mss 1460,sackOK,TS val 4294873966 ecr 0,nop,wscale 6,mptcp join id 3 token 0xd15e4cde nonce 0x9c43d22d], length 0
10:52:44.248756 IP 112.26.1.8.37887 > 112.26.1.1.37753: Flags [S], seq 1087380066, win 65535, options [mss 1460,sackOK,TS val 4294873966 ecr 0,nop,wscale 6,mptcp join id 3 token 0xd15e4cde nonce 0x9c43d22d], length 0
10:52:44.291116 IP 112.26.1.1.37753 > 112.26.1.8.37887: Flags [S.], seq 1073520417, ack 1087380067, win 28560, options [mss 1460,sackOK,TS val 120893 ecr 4294873966,nop,wscale 7,mptcp join id 3 hmac 0xe14596f7a3c5554 nonce 0xc4d21e11], length 0
10:52:44.391748 IP 112.26.1.1.37753 > 112.26.1.8.37887: Flags [S.], seq 1073520417, ack 1087380067, win 28560, options [mss 1460,sackOK,TS val 120893 ecr 4294873966,nop,wscale 7,mptcp join id 3 hmac 0xe14596f7a3c5554 nonce 0xc4d21e11], length 0
10:52:44.450528 IP 112.26.1.1.37753 > 112.26.1.8.37887: Flags [S.], seq 1073520417, ack 1087380067, win 28560, options [mss 1460,sackOK,TS val 120893 ecr 4294873966,nop,wscale 7,mptcp join id 3 hmac 0xe14596f7a3c5554 nonce 0xc4d21e11], length 0
10:52:44.615801 IP 112.26.1.8.37887 > 112.26.1.1.37753: Flags [.], ack 1, win 7027, options [nop,nop,TS val 4294874344 ecr 120893,mptcp join hmac 0x5931aad495df313330019ba94d2f4c13f575bb46], length 0
10:52:44.616017 IP 112.26.1.8.37887 > 112.26.1.1.37753: Flags [.], ack 1, win 7027, options [nop,nop,TS val 4294874344 ecr 120893,mptcp join hmac 0x5931aad495df313330019ba94d2f4c13f575bb46], length 0
10:53:14.646248 IP 112.26.1.1.37753 > 112.26.1.8.37887: Flags [.], seq 298453:299881, ack 1, win 893, options [nop,nop,TS val 150510 ecr 4294903671,mptcp dss ack 2295998090 seq 3914057646 subseq 298453 len 1428 csum 0x501f], length 1428
10:53:14.715774 IP 112.26.1.8.37887 > 112.26.1.1.37753: Flags [.], ack 299881, win 23958, options [nop,nop,TS val 4294904529 ecr 150510,mptcp dss ack 3913980534], length 0
10:53:14.716165 IP 112.26.1.8.37887 > 112.26.1.1.37753: Flags [.], ack 299881, win 23958, options [nop,nop,TS val 4294904529 ecr 150510,mptcp dss ack 3913980534], length 0
10:53:14.734629 IP 112.26.1.1.37753 > 112.26.1.8.37887: Flags [.], seq 299881:301309, ack 1, win 893, options [nop,nop,TS val 150687 ecr 4294903823,mptcp dss ack 2295998090 seq 3914067642 subseq 299881 len 1428 csum 0x623], length 1428
10:53:14.751429 IP 112.26.1.1.37753 > 112.26.1.8.37887: Flags [.], seq 305593:307021, ack 1, win 893, options [nop,nop,TS val 151390 ecr 4294904286,mptcp dss ack 2295998090 seq 3914094774 subseq 305593 len 1428 csum 0xfe5f], length 1428
10:53:14.768742 IP 112.26.1.1.37753 > 112.26.1.8.37887: Flags [.], seq 299881:301309, ack 1, win 893, options [nop,nop,TS val 150687 ecr 4294903823,mptcp dss ack 2295998090 seq 3914067642 subseq 299881 len 1428 csum 0x623], length 1428
10:53:14.789270 IP 112.26.1.8.37887 > 112.26.1.1.37753: Flags [.], ack 301309, win 24112, options [nop,nop,TS val 4294904662 ecr 150687,mptcp dss ack 3914007666], length 0
10:53:14.789634 IP 112.26.1.8.37887 > 112.26.1.1.37753: Flags [.], ack 301309, win 24112, options [nop,nop,TS val 4294904662 ecr 150687,mptcp dss ack 3914007666], length 0
10:53:14.838609 IP 112.26.1.1.37753 > 112.26.1.8.37887: Flags [.], seq 301309:302737, ack 1, win 893, options [nop,nop,TS val 150897 ecr 4294903948,mptcp dss ack 2295998090 seq 3914076210 subseq 301309 len 1428 csum 0x7658], length 1428
10:53:14.900411 IP 112.26.1.1.37753 > 112.26.1.8.37887: Flags [.], seq 301309:302737, ack 1, win 893, options [nop,nop,TS val 150897 ecr 4294903948,mptcp dss ack 2295998090 seq 3914076210 subseq 301309 len 1428 csum 0x7658], length 1428
10:53:14.924187 IP 112.26.1.1.37753 > 112.26.1.8.37887: Flags [.], seq 307021:308449, ack 1, win 893, options [nop,nop,TS val 151561 ecr 4294904407,mptcp dss ack 2295998090 seq 3914101914 subseq 307021 len 1428 csum 0xf1f0], length 1428
10:53:14.950216 IP 112.26.1.8.37887 > 112.26.1.1.37753: Flags [.], ack 302737, win 24112, options [nop,nop,TS val 4294904794 ecr 150897,mptcp dss ack 3914007666], length 0
10:53:14.950449 IP 112.26.1.8.37887 > 112.26.1.1.37753: Flags [.], ack 302737, win 24112, options [nop,nop,TS val 4294904794 ecr 150897,mptcp dss ack 3914007666], length 0
10:53:14.983310 IP 112.26.1.1.37753 > 112.26.1.8.37887: Flags [.], seq 302737:304165, ack 1, win 893, options [nop,nop,TS val 151093 ecr 4294904070,mptcp dss ack 2295998090 seq 3914083350 subseq 302737 len 1428 csum 0x17ef], length 1428
10:53:14.987986 IP 112.26.1.1.37753 > 112.26.1.8.37887: Flags [.], seq 302737:304165, ack 1, win 893, options [nop,nop,TS val 151093 ecr 4294904070,mptcp dss ack 2295998090 seq 3914083350 subseq 302737 len 1428 csum 0x17ef], length 1428
10:53:15.029127 IP 112.26.1.8.37887 > 112.26.1.1.37753: Flags [.], ack 304165, win 24112, options [nop,nop,TS val 4294904881 ecr 151093,mptcp dss ack 3914007666], length 0
10:53:15.029376 IP 112.26.1.8.37887 > 112.26.1.1.37753: Flags [.], ack 304165, win 24112, options [nop,nop,TS val 4294904881 ecr 151093,mptcp dss ack 3914007666], length 0
10:53:15.033827 IP 112.26.1.1.37753 > 112.26.1.8.37887: Flags [.], seq 308449:309877, ack 1, win 893, options [nop,nop,TS val 151561 ecr 4294904407,mptcp dss ack 2295998090 seq 3914103342 subseq 308449 len 1428 csum 0x834f], length 1428
10:53:15.127202 IP 112.26.1.1.37753 > 112.26.1.8.37887: Flags [.], seq 309877:311305, ack 1, win 893, options [nop,nop,TS val 151657 ecr 4294904529,mptcp dss ack 2295998090 seq 3914109054 subseq 309877 len 1428 csum 0xafb5], length 1428
10:53:15.150999 IP 112.26.1.1.37753 > 112.26.1.8.37887: Flags [.], seq 304165:305593, ack 1, win 893, options [nop,nop,TS val 151228 ecr 4294904204,mptcp dss ack 2295998090 seq 3914086206 subseq 304165 len 1428 csum 0x5d4e], length 1428
10:53:15.155697 IP 112.26.1.1.37753 > 112.26.1.8.37887: Flags [.], seq 304165:305593, ack 1, win 893, options [nop,nop,TS val 151228 ecr 4294904204,mptcp dss ack 2295998090 seq 3914086206 subseq 304165 len 1428 csum 0x5d4e], length 1428
10:53:15.200163 IP 112.26.1.8.37887 > 112.26.1.1.37753: Flags [.], ack 305593, win 24112, options [nop,nop,TS val 4294905090 ecr 151228,mptcp dss ack 3914007666], length 0
10:53:15.200462 IP 112.26.1.8.37887 > 112.26.1.1.37753: Flags [.], ack 305593, win 24112, options [nop,nop,TS val 4294905090 ecr 151228,mptcp dss ack 3914007666], length 0
10:53:15.231686 IP 112.26.1.1.37753 > 112.26.1.8.37887: Flags [.], seq 311305:312733, ack 1, win 893, options [nop,nop,TS val 151761 ecr 4294904662,mptcp dss ack 2295998090 seq 3914116194 subseq 311305 len 1428 csum 0x4947], length 1428
10:53:15.285187 IP 112.26.1.1.37753 > 112.26.1.8.37887: Flags [.], seq 312733:314161, ack 1, win 893, options [nop,nop,TS val 151884 ecr 4294904794,mptcp dss ack 2295998090 seq 3914121906 subseq 312733 len 1428 csum 0xe2a5], length 1428
10:53:15.321375 IP 112.26.1.1.37753 > 112.26.1.8.37887: Flags [.], seq 305593:307021, ack 1, win 893, options [nop,nop,TS val 151390 ecr 4294904286,mptcp dss ack 2295998090 seq 3914094774 subseq 305593 len 1428 csum 0xfe5f], length 1428
10:53:15.334973 IP 112.26.1.1.37753 > 112.26.1.8.37887: Flags [.], seq 305593:307021, ack 1, win 893, options [nop,nop,TS val 151390 ecr 4294904286,mptcp dss ack 2295998090 seq 3914094774 subseq 305593 len 1428 csum 0xfe5f], length 1428
10:53:15.392085 IP 112.26.1.1.37753 > 112.26.1.8.37887: Flags [.], seq 314161:315589, ack 1, win 893, options [nop,nop,TS val 152030 ecr 4294904881,mptcp dss ack 2295998090 seq 3914130474 subseq 314161 len 1428 csum 0xde77], length 1428
10:53:15.418809 IP 112.26.1.8.37887 > 112.26.1.1.37753: Flags [.], ack 307021, win 24241, options [nop,nop,TS val 4294905304 ecr 151390,mptcp dss ack 3914040510], length 0
10:53:15.419095 IP 112.26.1.8.37887 > 112.26.1.1.37753: Flags [.], ack 307021, win 24241, options [nop,nop,TS val 4294905304 ecr 151390,mptcp dss ack 3914040510], length 0
10:53:15.453118 IP 112.26.1.1.37753 > 112.26.1.8.37887: Flags [.], seq 307021:308449, ack 1, win 893, options [nop,nop,TS val 151561 ecr 4294904407,mptcp dss ack 2295998090 seq 3914101914 subseq 307021 len 1428 csum 0xf1f0], length 1428
10:53:15.481841 IP 112.26.1.1.37753 > 112.26.1.8.37887: Flags [.], seq 307021:308449, ack 1, win 893, options [nop,nop,TS val 151561 ecr 4294904407,mptcp dss ack 2295998090 seq 3914101914 subseq 307021 len 1428 csum 0xf1f0], length 1428
10:53:15.540440 IP 112.26.1.1.37753 > 112.26.1.8.37887: Flags [.], seq 315589:317017, ack 1, win 893, options [nop,nop,TS val 152172 ecr 4294905090,mptcp dss ack 2295998090 seq 3914136186 subseq 315589 len 1428 csum 0x8b6c], length 1428
10:53:15.583991 IP 112.26.1.1.37753 > 112.26.1.8.37887: Flags [.], seq 308449:309877, ack 1, win 893, options [nop,nop,TS val 151561 ecr 4294904407,mptcp dss ack 2295998090 seq 3914103342 subseq 308449 len 1428 csum 0x834f], length 1428
10:53:15.588911 IP 112.26.1.1.37753 > 112.26.1.8.37887: Flags [.], seq 308449:309877, ack 1, win 893, options [nop,nop,TS val 151561 ecr 4294904407,mptcp dss ack 2295998090 seq 3914103342 subseq 308449 len 1428 csum 0x834f], length 1428
10:53:15.667507 IP 112.26.1.1.37753 > 112.26.1.8.37887: Flags [.], seq 309877:311305, ack 1, win 893, options [nop,nop,TS val 151657 ecr 4294904529,mptcp dss ack 2295998090 seq 3914109054 subseq 309877 len 1428 csum 0xafb5], length 1428
10:53:15.675687 IP 112.26.1.8.37887 > 112.26.1.1.37753: Flags [.], ack 311305, win 24241, options [nop,nop,TS val 4294905565 ecr 151561,mptcp dss ack 3914040510], length 0
10:53:15.676002 IP 112.26.1.8.37887 > 112.26.1.1.37753: Flags [.], ack 311305, win 24241, options [nop,nop,TS val 4294905565 ecr 151561,mptcp dss ack 3914040510], length 0
10:53:15.682132 IP 112.26.1.1.37753 > 112.26.1.8.37887: Flags [.], seq 309877:311305, ack 1, win 893, options [nop,nop,TS val 151657 ecr 4294904529,mptcp dss ack 2295998090 seq 3914109054 subseq 309877 len 1428 csum 0xafb5], length 1428
10:53:15.726979 IP 112.26.1.1.37753 > 112.26.1.8.37887: Flags [.], seq 317017:318445, ack 1, win 893, options [nop,nop,TS val 152358 ecr 4294905304,mptcp dss ack 2295998090 seq 3914140470 subseq 317017 len 1428 csum 0x96c5], length 1428
10:53:15.789017 IP 112.26.1.1.37753 > 112.26.1.8.37887: Flags [.], seq 311305:312733, ack 1, win 893, options [nop,nop,TS val 151761 ecr 4294904662,mptcp dss ack 2295998090 seq 3914116194 subseq 311305 len 1428 csum 0x4947], length 1428
10:53:15.819875 IP 112.26.1.1.37753 > 112.26.1.8.37887: Flags [.], seq 311305:312733, ack 1, win 893, options [nop,nop,TS val 151761 ecr 4294904662,mptcp dss ack 2295998090 seq 3914116194 subseq 311305 len 1428 csum 0x4947], length 1428
10:53:15.871641 IP 112.26.1.1.37753 > 112.26.1.8.37887: Flags [.], seq 318445:319873, ack 1, win 893, options [nop,nop,TS val 152506 ecr 4294905565,mptcp dss ack 2295998090 seq 3914146182 subseq 318445 len 1428 csum 0x8ef3], length 1428
10:53:15.919468 IP 112.26.1.1.37753 > 112.26.1.8.37887: Flags [.], seq 312733:314161, ack 1, win 893, options [nop,nop,TS val 151884 ecr 4294904794,mptcp dss ack 2295998090 seq 3914121906 subseq 312733 len 1428 csum 0xe2a5], length 1428
10:53:15.922767 IP 112.26.1.1.37753 > 112.26.1.8.37887: Flags [.], seq 312733:314161, ack 1, win 893, options [nop,nop,TS val 151884 ecr 4294904794,mptcp dss ack 2295998090 seq 3914121906 subseq 312733 len 1428 csum 0xe2a5], length 1428
10:53:16.032025 IP 112.26.1.1.37753 > 112.26.1.8.37887: Flags [.], seq 314161:315589, ack 1, win 893, options [nop,nop,TS val 152030 ecr 4294904881,mptcp dss ack 2295998090 seq 3914130474 subseq 314161 len 1428 csum 0xde77], length 1428
10:53:16.040112 IP 112.26.1.1.37753 > 112.26.1.8.37887: Flags [.], seq 314161:315589, ack 1, win 893, options [nop,nop,TS val 152030 ecr 4294904881,mptcp dss ack 2295998090 seq 3914130474 subseq 314161 len 1428 csum 0xde77], length 1428
10:53:16.064162 IP 112.26.1.1.37753 > 112.26.1.8.37887: Flags [.], seq 319873:321301, ack 1, win 893, options [nop,nop,TS val 152506 ecr 4294905565,mptcp dss ack 2295998090 seq 3914147610 subseq 319873 len 1428 csum 0xbbc1], length 1428
10:53:16.093508 IP 112.26.1.8.37887 > 112.26.1.1.37753: Flags [.], ack 314161, win 23973, options [nop,nop,TS val 4294905890 ecr 151761,mptcp dss ack 3914063358], length 0
10:53:16.093851 IP 112.26.1.8.37887 > 112.26.1.1.37753: Flags [.], ack 314161, win 23973, options [nop,nop,TS val 4294905890 ecr 151761,mptcp dss ack 3914063358], length 0
10:53:16.149152 IP 112.26.1.1.37753 > 112.26.1.8.37887: Flags [.], seq 321301:322729, ack 1, win 893, options [nop,nop,TS val 152506 ecr 4294905565,mptcp dss ack 2295998090 seq 3914149038 subseq 321301 len 1428 csum 0x98ee], length 1428
10:53:16.165943 IP 112.26.1.1.37753 > 112.26.1.8.37887: Flags [.], seq 315589:317017, ack 1, win 893, options [nop,nop,TS val 152172 ecr 4294905090,mptcp dss ack 2295998090 seq 3914136186 subseq 315589 len 1428 csum 0x8b6c], length 1428
10:53:16.177110 IP 112.26.1.1.37753 > 112.26.1.8.37887: Flags [.], seq 315589:317017, ack 1, win 893, options [nop,nop,TS val 152172 ecr 4294905090,mptcp dss ack 2295998090 seq 3914136186 subseq 315589 len 1428 csum 0x8b6c], length 1428
10:53:16.181786 IP 112.26.1.8.37887 > 112.26.1.1.37753: Flags [.], ack 317017, win 24224, options [nop,nop,TS val 4294906062 ecr 152030,mptcp dss ack 3914063358], length 0
10:53:16.182110 IP 112.26.1.8.37887 > 112.26.1.1.37753: Flags [.], ack 317017, win 24224, options [nop,nop,TS val 4294906062 ecr 152030,mptcp dss ack 3914063358], length 0
10:53:16.226379 IP 112.26.1.1.37753 > 112.26.1.8.37887: Flags [.], seq 322729:324157, ack 1, win 893, options [nop,nop,TS val 152737 ecr 4294905890,mptcp dss ack 2295998090 seq 3914154750 subseq 322729 len 1428 csum 0xf430], length 1428
10:53:16.298667 IP 112.26.1.1.37753 > 112.26.1.8.37887: Flags [.], seq 317017:318445, ack 1, win 893, options [nop,nop,TS val 152358 ecr 4294905304,mptcp dss ack 2295998090 seq 3914140470 subseq 317017 len 1428 csum 0x96c5], length 1428
10:53:16.301922 IP 112.26.1.1.37753 > 112.26.1.8.37887: Flags [.], seq 317017:318445, ack 1, win 893, options [nop,nop,TS val 152358 ecr 4294905304,mptcp dss ack 2295998090 seq 3914140470 subseq 317017 len 1428 csum 0x96c5], length 1428
10:53:16.331587 IP 112.26.1.1.37753 > 112.26.1.8.37887: Flags [.], seq 324157:325585, ack 1, win 893, options [nop,nop,TS val 152737 ecr 4294905890,mptcp dss ack 2295998090 seq 3914156178 subseq 324157 len 1428 csum 0x7198], length 1428
10:53:16.399597 IP 112.26.1.1.37753 > 112.26.1.8.37887: Flags [.], seq 325585:327013, ack 1, win 893, options [nop,nop,TS val 152825 ecr 4294906062,mptcp dss ack 2295998090 seq 3914157606 subseq 325585 len 1428 csum 0x239d], length 1428
10:53:16.423710 IP 112.26.1.1.37753 > 112.26.1.8.37887: Flags [.], seq 318445:319873, ack 1, win 893, options [nop,nop,TS val 152506 ecr 4294905565,mptcp dss ack 2295998090 seq 3914146182 subseq 318445 len 1428 csum 0x8ef3], length 1428
10:53:16.442213 IP 112.26.1.1.37753 > 112.26.1.8.37887: Flags [.], seq 318445:319873, ack 1, win 893, options [nop,nop,TS val 152506 ecr 4294905565,mptcp dss ack 2295998090 seq 3914146182 subseq 318445 len 1428 csum 0x8ef3], length 1428
10:53:16.492686 IP 112.26.1.1.37753 > 112.26.1.8.37887: Flags [.], seq 327013:328441, ack 1, win 893, options [nop,nop,TS val 152825 ecr 4294906062,mptcp dss ack 2295998090 seq 3914159034 subseq 327013 len 1428 csum 0x58e4], length 1428
10:53:16.556379 IP 112.26.1.1.37753 > 112.26.1.8.37887: Flags [.], seq 319873:321301, ack 1, win 893, options [nop,nop,TS val 152506 ecr 4294905565,mptcp dss ack 2295998090 seq 3914147610 subseq 319873 len 1428 csum 0xbbc1], length 1428
10:53:16.562092 IP 112.26.1.1.37753 > 112.26.1.8.37887: Flags [.], seq 319873:321301, ack 1, win 893, options [nop,nop,TS val 152506 ecr 4294905565,mptcp dss ack 2295998090 seq 3914147610 subseq 319873 len 1428 csum 0xbbc1], length 1428
10:53:16.575801 IP 112.26.1.8.37887 > 112.26.1.1.37753: Flags [.], ack 321301, win 24224, options [nop,nop,TS val 4294906456 ecr 152358,mptcp dss ack 3914063358], length 0
10:53:16.576106 IP 112.26.1.8.37887 > 112.26.1.1.37753: Flags [.], ack 321301, win 24224, options [nop,nop,TS val 4294906456 ecr 152358,mptcp dss ack 3914063358], length 0
10:53:16.602265 IP 112.26.1.1.37753 > 112.26.1.8.37887: Flags [.], seq 328441:329869, ack 1, win 893, options [nop,nop,TS val 153223 ecr 4294906456,mptcp dss ack 2295998090 seq 3914169030 subseq 328441 len 1428 csum 0x3b82], length 1428
10:53:16.652293 IP 112.26.1.1.37753 > 112.26.1.8.37887: Flags [.], seq 329869:331297, ack 1, win 893, options [nop,nop,TS val 153223 ecr 4294906456,mptcp dss ack 2295998090 seq 3914170458 subseq 329869 len 1428 csum 0x4182], length 1428
10:53:16.688162 IP 112.26.1.1.37753 > 112.26.1.8.37887: Flags [.], seq 321301:322729, ack 1, win 893, options [nop,nop,TS val 152506 ecr 4294905565,mptcp dss ack 2295998090 seq 3914149038 subseq 321301 len 1428 csum 0x98ee], length 1428
10:53:16.696161 IP 112.26.1.1.37753 > 112.26.1.8.37887: Flags [.], seq 321301:322729, ack 1, win 893, options [nop,nop,TS val 152506 ecr 4294905565,mptcp dss ack 2295998090 seq 3914149038 subseq 321301 len 1428 csum 0x98ee], length 1428
10:53:16.762377 IP 112.26.1.1.37753 > 112.26.1.8.37887: Flags [.], seq 331297:332725, ack 1, win 893, options [nop,nop,TS val 153223 ecr 4294906456,mptcp dss ack 2295998090 seq 3914171886 subseq 331297 len 1428 csum 0xf905], length 1428
10:53:16.821837 IP 112.26.1.1.37753 > 112.26.1.8.37887: Flags [.], seq 322729:324157, ack 1, win 893, options [nop,nop,TS val 152737 ecr 4294905890,mptcp dss ack 2295998090 seq 3914154750 subseq 322729 len 1428 csum 0xf430], length 1428
10:53:16.832522 IP 112.26.1.1.37753 > 112.26.1.8.37887: Flags [.], seq 322729:324157, ack 1, win 893, options [nop,nop,TS val 152737 ecr 4294905890,mptcp dss ack 2295998090 seq 3914154750 subseq 322729 len 1428 csum 0xf430], length 1428
10:53:16.858685 IP 112.26.1.1.37753 > 112.26.1.8.37887: Flags [.], seq 332725:334153, ack 1, win 893, options [nop,nop,TS val 153223 ecr 4294906456,mptcp dss ack 2295998090 seq 3914173314 subseq 332725 len 1428 csum 0xcb79], length 1428
10:53:16.951196 IP 112.26.1.1.37753 > 112.26.1.8.37887: Flags [.], seq 324157:325585, ack 1, win 893, options [nop,nop,TS val 152737 ecr 4294905890,mptcp dss ack 2295998090 seq 3914156178 subseq 324157 len 1428 csum 0x7198], length 1428
10:53:16.962160 IP 112.26.1.1.37753 > 112.26.1.8.37887: Flags [.], seq 324157:325585, ack 1, win 893, options [nop,nop,TS val 152737 ecr 4294905890,mptcp dss ack 2295998090 seq 3914156178 subseq 324157 len 1428 csum 0x7198], length 1428
10:53:16.967440 IP 112.26.1.8.37887 > 112.26.1.1.37753: Flags [.], ack 324157, win 24033, options [nop,nop,TS val 4294906844 ecr 152506,mptcp dss ack 3914091918], length 0
10:53:16.967744 IP 112.26.1.8.37887 > 112.26.1.1.37753: Flags [.], ack 324157, win 24033, options [nop,nop,TS val 4294906844 ecr 152506,mptcp dss ack 3914091918], length 0
10:53:17.010890 IP 112.26.1.1.37753 > 112.26.1.8.37887: Flags [.], seq 334153:335581, ack 1, win 893, options [nop,nop,TS val 153614 ecr 4294906844,mptcp dss ack 2295998090 seq 3914186166 subseq 334153 len 1428 csum 0x79b4], length 1428
10:53:17.073299 IP 112.26.1.1.37753 > 112.26.1.8.37887: Flags [.], seq 325585:327013, ack 1, win 893, options [nop,nop,TS val 152825 ecr 4294906062,mptcp dss ack 2295998090 seq 3914157606 subseq 325585 len 1428 csum 0x239d], length 1428
10:53:17.113137 IP 112.26.1.1.37753 > 112.26.1.8.37887: Flags [.], seq 325585:327013, ack 1, win 893, options [nop,nop,TS val 152825 ecr 4294906062,mptcp dss ack 2295998090 seq 3914157606 subseq 325585 len 1428 csum 0x239d], length 1428
10:53:17.117832 IP 112.26.1.8.37887 > 112.26.1.1.37753: Flags [.], ack 327013, win 24216, options [nop,nop,TS val 4294907007 ecr 152737,mptcp dss ack 3914106198], length 0
10:53:17.118163 IP 112.26.1.8.37887 > 112.26.1.1.37753: Flags [.], ack 327013, win 24216, options [nop,nop,TS val 4294907007 ecr 152737,mptcp dss ack 3914106198], length 0
10:53:17.147961 IP 112.26.1.1.37753 > 112.26.1.8.37887: Flags [.], seq 335581:337009, ack 1, win 893, options [nop,nop,TS val 153614 ecr 4294906844,mptcp dss ack 2295998090 seq 3914187594 subseq 335581 len 1428 csum 0x2953], length 1428
10:53:17.199037 IP 112.26.1.1.37753 > 112.26.1.8.37887: Flags [.], seq 327013:328441, ack 1, win 893, options [nop,nop,TS val 152825 ecr 4294906062,mptcp dss ack 2295998090 seq 3914159034 subseq 327013 len 1428 csum 0x58e4], length 1428
10:53:17.232900 IP 112.26.1.1.37753 > 112.26.1.8.37887: Flags [.], seq 337009:338437, ack 1, win 893, options [nop,nop,TS val 153614 ecr 4294906844,mptcp dss ack 2295998090 seq 3914189022 subseq 337009 len 1428 csum 0x4088], length 1428
10:53:17.243713 IP 112.26.1.1.37753 > 112.26.1.8.37887: Flags [.], seq 327013:328441, ack 1, win 893, options [nop,nop,TS val 152825 ecr 4294906062,mptcp dss ack 2295998090 seq 3914159034 subseq 327013 len 1428 csum 0x58e4], length 1428
10:53:17.296266 IP 112.26.1.1.37753 > 112.26.1.8.37887: Flags [.], seq 328441:329869, ack 1, win 893, options [nop,nop,TS val 153223 ecr 4294906456,mptcp dss ack 2295998090 seq 3914169030 subseq 328441 len 1428 csum 0x3b82], length 1428
10:53:17.342566 IP 112.26.1.1.37753 > 112.26.1.8.37887: Flags [.], seq 328441:329869, ack 1, win 893, options [nop,nop,TS val 153223 ecr 4294906456,mptcp dss ack 2295998090 seq 3914169030 subseq 328441 len 1428 csum 0x3b82], length 1428
10:53:17.349889 IP 112.26.1.1.37753 > 112.26.1.8.37887: Flags [.], seq 338437:339865, ack 1, win 893, options [nop,nop,TS val 153764 ecr 4294907007,mptcp dss ack 2295998090 seq 3914194734 subseq 338437 len 1428 csum 0x801c], length 1428
10:53:17.386913 IP 112.26.1.1.37753 > 112.26.1.8.37887: Flags [.], seq 339865:341293, ack 1, win 893, options [nop,nop,TS val 153764 ecr 4294907007,mptcp dss ack 2295998090 seq 3914196162 subseq 339865 len 1428 csum 0xb592], length 1428
10:53:17.424832 IP 112.26.1.1.37753 > 112.26.1.8.37887: Flags [.], seq 329869:331297, ack 1, win 893, options [nop,nop,TS val 153223 ecr 4294906456,mptcp dss ack 2295998090 seq 3914170458 subseq 329869 len 1428 csum 0x4182], length 1428
10:53:17.428642 IP 112.26.1.1.37753 > 112.26.1.8.37887: Flags [.], seq 329869:331297, ack 1, win 893, options [nop,nop,TS val 153223 ecr 4294906456,mptcp dss ack 2295998090 seq 3914170458 subseq 329869 len 1428 csum 0x4182], length 1428
10:53:17.509046 IP 112.26.1.1.37753 > 112.26.1.8.37887: Flags [.], seq 331297:332725, ack 1, win 893, options [nop,nop,TS val 153223 ecr 4294906456,mptcp dss ack 2295998090 seq 3914171886 subseq 331297 len 1428 csum 0xf905], length 1428
10:53:17.529787 IP 112.26.1.8.37887 > 112.26.1.1.37753: Flags [.], ack 331297, win 24216, options [nop,nop,TS val 4294907416 ecr 152825,mptcp dss ack 3914106198], length 0
10:53:17.530079 IP 112.26.1.8.37887 > 112.26.1.1.37753: Flags [.], ack 331297, win 24216, options [nop,nop,TS val 4294907416 ecr 152825,mptcp dss ack 3914106198], length 0
10:53:17.556479 IP 112.26.1.1.37753 > 112.26.1.8.37887: Flags [.], seq 341293:342721, ack 1, win 893, options [nop,nop,TS val 154173 ecr 4294907416,mptcp dss ack 2295998090 seq 3914209014 subseq 341293 len 1428 csum 0x2189], length 1428
10:53:17.568422 IP 112.26.1.1.37753 > 112.26.1.8.37887: Flags [.], seq 332725:334153, ack 1, win 893, options [nop,nop,TS val 153223 ecr 4294906456,mptcp dss ack 2295998090 seq 3914173314 subseq 332725 len 1428 csum 0xcb79], length 1428
10:53:17.586409 IP 112.26.1.1.37753 > 112.26.1.8.37887: Flags [.], seq 331297:332725, ack 1, win 893, options [nop,nop,TS val 153223 ecr 4294906456,mptcp dss ack 2295998090 seq 3914171886 subseq 331297 len 1428 csum 0xf905], length 1428
10:53:17.643459 IP 112.26.1.1.37753 > 112.26.1.8.37887: Flags [.], seq 342721:344149, ack 1, win 893, options [nop,nop,TS val 154173 ecr 4294907416,mptcp dss ack 2295998090 seq 3914210442 subseq 342721 len 1428 csum 0x121e], length 1428
10:53:17.662968 IP 112.26.1.1.37753 > 112.26.1.8.37887: Flags [.], seq 334153:335581, ack 1, win 893, options [nop,nop,TS val 153614 ecr 4294906844,mptcp dss ack 2295998090 seq 3914186166 subseq 334153 len 1428 csum 0x79b4], length 1428
10:53:17.705161 IP 112.26.1.1.37753 > 112.26.1.8.37887: Flags [.], seq 332725:334153, ack 1, win 893, options [nop,nop,TS val 153223 ecr 4294906456,mptcp dss ack 2295998090 seq 3914173314 subseq 332725 len 1428 csum 0xcb79], length 1428
10:53:17.736294 IP 112.26.1.1.37753 > 112.26.1.8.37887: Flags [.], seq 344149:345577, ack 1, win 893, options [nop,nop,TS val 154173 ecr 4294907416,mptcp dss ack 2295998090 seq 3914211870 subseq 344149 len 1428 csum 0xa649], length 1428
10:53:17.762812 IP 112.26.1.1.37753 > 112.26.1.8.37887: Flags [.], seq 334153:335581, ack 1, win 893, options [nop,nop,TS val 153614 ecr 4294906844,mptcp dss ack 2295998090 seq 3914186166 subseq 334153 len 1428 csum 0x79b4], length 1428
10:53:17.786971 IP 112.26.1.1.37753 > 112.26.1.8.37887: Flags [.], seq 335581:337009, ack 1, win 893, options [nop,nop,TS val 153614 ecr 4294906844,mptcp dss ack 2295998090 seq 3914187594 subseq 335581 len 1428 csum 0x2953], length 1428
10:53:17.790904 IP 112.26.1.1.37753 > 112.26.1.8.37887: Flags [.], seq 345577:347005, ack 1, win 893, options [nop,nop,TS val 154173 ecr 4294907416,mptcp dss ack 2295998090 seq 3914213298 subseq 345577 len 1428 csum 0x8133], length 1428
10:53:17.821644 IP 112.26.1.1.37753 > 112.26.1.8.37887: Flags [.], seq 335581:337009, ack 1, win 893, options [nop,nop,TS val 153614 ecr 4294906844,mptcp dss ack 2295998090 seq 3914187594 subseq 335581 len 1428 csum 0x2953], length 1428
10:53:17.870964 IP 112.26.1.1.37753 > 112.26.1.8.37887: Flags [.], seq 347005:348433, ack 1, win 893, options [nop,nop,TS val 154173 ecr 4294907416,mptcp dss ack 2295998090 seq 3914214726 subseq 347005 len 1428 csum 0x5bf6], length 1428
10:53:17.914062 IP 112.26.1.1.37753 > 112.26.1.8.37887: Flags [.], seq 337009:338437, ack 1, win 893, options [nop,nop,TS val 153614 ecr 4294906844,mptcp dss ack 2295998090 seq 3914189022 subseq 337009 len 1428 csum 0x4088], length 1428
10:53:17.916298 IP 112.26.1.1.37753 > 112.26.1.8.37887: Flags [.], seq 337009:338437, ack 1, win 893, options [nop,nop,TS val 153614 ecr 4294906844,mptcp dss ack 2295998090 seq 3914189022 subseq 337009 len 1428 csum 0x4088], length 1428
10:53:17.926661 IP 112.26.1.8.37887 > 112.26.1.1.37753: Flags [.], ack 338437, win 24216, options [nop,nop,TS val 4294907810 ecr 153223,mptcp dss ack 3914106198], length 0
10:53:17.926970 IP 112.26.1.8.37887 > 112.26.1.1.37753: Flags [.], ack 338437, win 24216, options [nop,nop,TS val 4294907810 ecr 153223,mptcp dss ack 3914106198], length 0
10:53:17.980881 IP 112.26.1.1.37753 > 112.26.1.8.37887: Flags [.], seq 348433:349861, ack 1, win 893, options [nop,nop,TS val 154570 ecr 4294907810,mptcp dss ack 2295998090 seq 3914221866 subseq 348433 len 1428 csum 0xc17b], length 1428
10:53:18.070450 IP 112.26.1.1.37753 > 112.26.1.8.37887: Flags [.], seq 338437:339865, ack 1, win 893, options [nop,nop,TS val 153764 ecr 4294907007,mptcp dss ack 2295998090 seq 3914194734 subseq 338437 len 1428 csum 0x801c], length 1428
10:53:18.073748 IP 112.26.1.1.37753 > 112.26.1.8.37887: Flags [.], seq 338437:339865, ack 1, win 893, options [nop,nop,TS val 153764 ecr 4294907007,mptcp dss ack 2295998090 seq 3914194734 subseq 338437 len 1428 csum 0x801c], length 1428
10:53:18.104275 IP 112.26.1.1.37753 > 112.26.1.8.37887: Flags [.], seq 349861:351289, ack 1, win 893, options [nop,nop,TS val 154570 ecr 4294907810,mptcp dss ack 2295998090 seq 3914223294 subseq 349861 len 1428 csum 0xaf8a], length 1428
10:53:18.182907 IP 112.26.1.1.37753 > 112.26.1.8.37887: Flags [.], seq 351289:352717, ack 1, win 893, options [nop,nop,TS val 154570 ecr 4294907810,mptcp dss ack 2295998090 seq 3914224722 subseq 351289 len 1428 csum 0x848f], length 1428
10:53:18.224405 IP 112.26.1.1.37753 > 112.26.1.8.37887: Flags [.], seq 339865:341293, ack 1, win 893, options [nop,nop,TS val 153764 ecr 4294907007,mptcp dss ack 2295998090 seq 3914196162 subseq 339865 len 1428 csum 0xb592], length 1428
10:53:18.227065 IP 112.26.1.1.37753 > 112.26.1.8.37887: Flags [.], seq 339865:341293, ack 1, win 893, options [nop,nop,TS val 153764 ecr 4294907007,mptcp dss ack 2295998090 seq 3914196162 subseq 339865 len 1428 csum 0xb592], length 1428
10:53:18.264473 IP 112.26.1.1.37753 > 112.26.1.8.37887: Flags [.], seq 352717:354145, ack 1, win 893, options [nop,nop,TS val 154570 ecr 4294907810,mptcp dss ack 2295998090 seq 3914226150 subseq 352717 len 1428 csum 0xb9f2], length 1428
10:53:18.316659 IP 112.26.1.1.37753 > 112.26.1.8.37887: Flags [.], seq 354145:355573, ack 1, win 893, options [nop,nop,TS val 154570 ecr 4294907810,mptcp dss ack 2295998090 seq 3914227578 subseq 354145 len 1428 csum 0x4f05], length 1428
10:53:18.329451 IP 112.26.1.8.37887 > 112.26.1.1.37753: Flags [.], ack 341293, win 24295, options [nop,nop,TS val 4294908216 ecr 153764,mptcp dss ack 3914167602], length 0
10:53:18.329785 IP 112.26.1.8.37887 > 112.26.1.1.37753: Flags [.], ack 341293, win 24295, options [nop,nop,TS val 4294908216 ecr 153764,mptcp dss ack 3914167602], length 0
10:53:18.372404 IP 112.26.1.1.37753 > 112.26.1.8.37887: Flags [.], seq 341293:342721, ack 1, win 893, options [nop,nop,TS val 154173 ecr 4294907416,mptcp dss ack 2295998090 seq 3914209014 subseq 341293 len 1428 csum 0x2189], length 1428
10:53:18.444632 IP 112.26.1.1.37753 > 112.26.1.8.37887: Flags [.], seq 355573:357001, ack 1, win 893, options [nop,nop,TS val 154973 ecr 4294908216,mptcp dss ack 2295998090 seq 3914246142 subseq 355573 len 1428 csum 0x5159], length 1428
10:53:18.458731 IP 112.26.1.1.37753 > 112.26.1.8.37887: Flags [.], seq 341293:342721, ack 1, win 893, options [nop,nop,TS val 154173 ecr 4294907416,mptcp dss ack 2295998090 seq 3914209014 subseq 341293 len 1428 csum 0x2189], length 1428
10:53:18.491849 IP 112.26.1.1.37753 > 112.26.1.8.37887: Flags [.], seq 342721:344149, ack 1, win 893, options [nop,nop,TS val 154173 ecr 4294907416,mptcp dss ack 2295998090 seq 3914210442 subseq 342721 len 1428 csum 0x121e], length 1428
10:53:18.494307 IP 112.26.1.1.37753 > 112.26.1.8.37887: Flags [.], seq 342721:344149, ack 1, win 893, options [nop,nop,TS val 154173 ecr 4294907416,mptcp dss ack 2295998090 seq 3914210442 subseq 342721 len 1428 csum 0x121e], length 1428
10:53:18.504121 IP 112.26.1.1.37753 > 112.26.1.8.37887: Flags [.], seq 357001:358429, ack 1, win 893, options [nop,nop,TS val 154973 ecr 4294908216,mptcp dss ack 2295998090 seq 3914247570 subseq 357001 len 1428 csum 0x2342], length 1428
10:53:18.521136 IP 112.26.1.8.37887 > 112.26.1.1.37753: Flags [.], ack 344149, win 24003, options [nop,nop,TS val 4294908403 ecr 154173,mptcp dss ack 3914211870], length 0
10:53:18.521324 IP 112.26.1.8.37887 > 112.26.1.1.37753: Flags [.], ack 344149, win 24003, options [nop,nop,TS val 4294908403 ecr 154173,mptcp dss ack 3914211870], length 0
10:53:18.568444 IP 112.26.1.1.37753 > 112.26.1.8.37887: Flags [.], seq 344149:345577, ack 1, win 893, options [nop,nop,TS val 154173 ecr 4294907416,mptcp dss ack 2295998090 seq 3914211870 subseq 344149 len 1428 csum 0xa649], length 1428
10:53:18.617533 IP 112.26.1.1.37753 > 112.26.1.8.37887: Flags [.], seq 344149:345577, ack 1, win 893, options [nop,nop,TS val 154173 ecr 4294907416,mptcp dss ack 2295998090 seq 3914211870 subseq 344149 len 1428 csum 0xa649], length 1428
10:53:18.656049 IP 112.26.1.1.37753 > 112.26.1.8.37887: Flags [.], seq 358429:359857, ack 1, win 893, options [nop,nop,TS val 155165 ecr 4294908403,mptcp dss ack 2295998090 seq 3914254710 subseq 358429 len 1428 csum 0x5a6a], length 1428
10:53:18.713238 IP 112.26.1.1.37753 > 112.26.1.8.37887: Flags [.], seq 359857:361285, ack 1, win 893, options [nop,nop,TS val 155165 ecr 4294908403,mptcp dss ack 2295998090 seq 3914256138 subseq 359857 len 1428 csum 0x57b9], length 1428
10:53:18.733682 IP 112.26.1.1.37753 > 112.26.1.8.37887: Flags [.], seq 347005:348433, ack 1, win 893, options [nop,nop,TS val 154173 ecr 4294907416,mptcp dss ack 2295998090 seq 3914214726 subseq 347005 len 1428 csum 0x5bf6], length 1428
10:53:18.747940 IP 112.26.1.8.37887 > 112.26.1.1.37753: Flags [.], ack 345577, win 24467, options [nop,nop,TS val 4294908631 ecr 154173,nop,nop,sack 1 {347005:348433},mptcp dss ack 3914213298], length 0
10:53:18.748232 IP 112.26.1.8.37887 > 112.26.1.1.37753: Flags [.], ack 345577, win 24467, options [nop,nop,TS val 4294908631 ecr 154173,nop,nop,sack 1 {347005:348433},mptcp dss ack 3914213298], length 0
10:53:18.751896 IP 112.26.1.1.37753 > 112.26.1.8.37887: Flags [.], seq 347005:348433, ack 1, win 893, options [nop,nop,TS val 154173 ecr 4294907416,mptcp dss ack 2295998090 seq 3914214726 subseq 347005 len 1428 csum 0x5bf6], length 1428
10:53:18.850258 IP 112.26.1.1.37753 > 112.26.1.8.37887: Flags [.], seq 361285:362713, ack 1, win 893, options [nop,nop,TS val 155165 ecr 4294908403,mptcp dss ack 2295998090 seq 3914257566 subseq 361285 len 1428 csum 0x880], length 1428
10:53:18.871094 IP 112.26.1.1.37753 > 112.26.1.8.37887: Flags [.], seq 348433:349861, ack 1, win 893, options [nop,nop,TS val 154570 ecr 4294907810,mptcp dss ack 2295998090 seq 3914221866 subseq 348433 len 1428 csum 0xc17b], length 1428
10:53:18.874998 IP 112.26.1.1.37753 > 112.26.1.8.37887: Flags [.], seq 348433:349861, ack 1, win 893, options [nop,nop,TS val 154570 ecr 4294907810,mptcp dss ack 2295998090 seq 3914221866 subseq 348433 len 1428 csum 0xc17b], length 1428
10:53:18.909358 IP 112.26.1.8.37887 > 112.26.1.1.37753: Flags [.], ack 345577, win 24467, options [nop,nop,TS val 4294908768 ecr 154173,nop,nop,sack 1 {347005:349861},mptcp dss ack 3914213298], length 0
10:53:18.909659 IP 112.26.1.8.37887 > 112.26.1.1.37753: Flags [.], ack 345577, win 24467, options [nop,nop,TS val 4294908768 ecr 154173,nop,nop,sack 1 {347005:349861},mptcp dss ack 3914213298], length 0
10:53:19.008684 IP 112.26.1.1.37753 > 112.26.1.8.37887: Flags [.], seq 362713:364141, ack 1, win 893, options [nop,nop,TS val 155396 ecr 4294908631,mptcp dss ack 2295998090 seq 3914270418 subseq 362713 len 1428 csum 0x9e48], length 1428
10:53:19.037965 IP 112.26.1.1.37753 > 112.26.1.8.37887: Flags [.], seq 349861:351289, ack 1, win 893, options [nop,nop,TS val 154570 ecr 4294907810,mptcp dss ack 2295998090 seq 3914223294 subseq 349861 len 1428 csum 0xaf8a], length 1428
10:53:19.040719 IP 112.26.1.1.37753 > 112.26.1.8.37887: Flags [.], seq 349861:351289, ack 1, win 893, options [nop,nop,TS val 154570 ecr 4294907810,mptcp dss ack 2295998090 seq 3914223294 subseq 349861 len 1428 csum 0xaf8a], length 1428
10:53:19.048357 IP 112.26.1.8.37887 > 112.26.1.1.37753: Flags [.], ack 345577, win 24467, options [nop,nop,TS val 4294908934 ecr 154173,nop,nop,sack 1 {347005:351289},mptcp dss ack 3914213298], length 0
10:53:19.048638 IP 112.26.1.8.37887 > 112.26.1.1.37753: Flags [.], ack 345577, win 24467, options [nop,nop,TS val 4294908934 ecr 154173,nop,nop,sack 1 {347005:351289},mptcp dss ack 3914213298], length 0
10:53:19.107264 IP 112.26.1.1.37753 > 112.26.1.8.37887: Flags [.], seq 364141:365569, ack 1, win 893, options [nop,nop,TS val 155396 ecr 4294908631,mptcp dss ack 2295998090 seq 3914271846 subseq 364141 len 1428 csum 0x1121], length 1428
10:53:19.152985 IP 112.26.1.1.37753 > 112.26.1.8.37887: Flags [.], seq 351289:352717, ack 1, win 893, options [nop,nop,TS val 154570 ecr 4294907810,mptcp dss ack 2295998090 seq 3914224722 subseq 351289 len 1428 csum 0x848f], length 1428
10:53:19.167333 IP 112.26.1.1.37753 > 112.26.1.8.37887: Flags [.], seq 351289:352717, ack 1, win 893, options [nop,nop,TS val 154570 ecr 4294907810,mptcp dss ack 2295998090 seq 3914224722 subseq 351289 len 1428 csum 0x848f], length 1428
10:53:19.240989 IP 112.26.1.1.37753 > 112.26.1.8.37887: Flags [.], seq 365569:366997, ack 1, win 893, options [nop,nop,TS val 155396 ecr 4294908631,mptcp dss ack 2295998090 seq 3914273274 subseq 365569 len 1428 csum 0x8ba5], length 1428
10:53:19.259106 IP 112.26.1.8.37887 > 112.26.1.1.37753: Flags [.], ack 345577, win 24467, options [nop,nop,TS val 4294909061 ecr 154173,nop,nop,sack 1 {347005:352717},mptcp dss ack 3914213298], length 0
10:53:19.259450 IP 112.26.1.8.37887 > 112.26.1.1.37753: Flags [.], ack 345577, win 24467, options [nop,nop,TS val 4294909061 ecr 154173,nop,nop,sack 1 {347005:352717},mptcp dss ack 3914213298], length 0
10:53:19.347689 IP 112.26.1.1.37753 > 112.26.1.8.37887: Flags [.], seq 366997:368425, ack 1, win 893, options [nop,nop,TS val 155578 ecr 4294908768,mptcp dss ack 2295998090 seq 3914280414 subseq 366997 len 1428 csum 0xd6a], length 1428
10:53:19.369670 IP 112.26.1.1.37753 > 112.26.1.8.37887: Flags [.], seq 355573:357001, ack 1, win 893, options [nop,nop,TS val 154973 ecr 4294908216,mptcp dss ack 2295998090 seq 3914246142 subseq 355573 len 1428 csum 0x5159], length 1428
10:53:19.373023 IP 112.26.1.1.37753 > 112.26.1.8.37887: Flags [.], seq 355573:357001, ack 1, win 893, options [nop,nop,TS val 154973 ecr 4294908216,mptcp dss ack 2295998090 seq 3914246142 subseq 355573 len 1428 csum 0x5159], length 1428
10:53:19.383810 IP 112.26.1.8.37887 > 112.26.1.1.37753: Flags [.], ack 345577, win 24467, options [nop,nop,TS val 4294909267 ecr 154173,nop,nop,sack 2 {355573:357001}{347005:352717},mptcp dss ack 3914213298], length 0
10:53:19.384075 IP 112.26.1.8.37887 > 112.26.1.1.37753: Flags [.], ack 345577, win 24467, options [nop,nop,TS val 4294909267 ecr 154173,nop,nop,sack 2 {355573:357001}{347005:352717},mptcp dss ack 3914213298], length 0
10:53:19.476099 IP 112.26.1.1.37753 > 112.26.1.8.37887: Flags [.], seq 357001:358429, ack 1, win 893, options [nop,nop,TS val 154973 ecr 4294908216,mptcp dss ack 2295998090 seq 3914247570 subseq 357001 len 1428 csum 0x2342], length 1428
10:53:19.500185 IP 112.26.1.1.37753 > 112.26.1.8.37887: Flags [.], seq 345577:347005, ack 1, win 893, options [nop,nop,TS val 155762 ecr 4294908934,mptcp dss ack 2295998090 seq 3914213298 subseq 345577 len 1428 csum 0x8133], length 1428
10:53:19.531995 IP 112.26.1.1.37753 > 112.26.1.8.37887: Flags [.], seq 357001:358429, ack 1, win 893, options [nop,nop,TS val 154973 ecr 4294908216,mptcp dss ack 2295998090 seq 3914247570 subseq 357001 len 1428 csum 0x2342], length 1428
10:53:19.538983 IP 112.26.1.8.37887 > 112.26.1.1.37753: Flags [.], ack 345577, win 24467, options [nop,nop,TS val 4294909406 ecr 154173,nop,nop,sack 2 {355573:358429}{347005:352717},mptcp dss ack 3914213298], length 0
10:53:19.539294 IP 112.26.1.8.37887 > 112.26.1.1.37753: Flags [.], ack 345577, win 24467, options [nop,nop,TS val 4294909406 ecr 154173,nop,nop,sack 2 {355573:358429}{347005:352717},mptcp dss ack 3914213298], length 0
10:53:19.607593 IP 112.26.1.1.37753 > 112.26.1.8.37887: Flags [.], seq 368425:369853, ack 1, win 893, options [nop,nop,TS val 156012 ecr 4294909061,mptcp dss ack 2295998090 seq 3914293266 subseq 368425 len 1428 csum 0x3209], length 1428
10:53:19.623882 IP 112.26.1.1.37753 > 112.26.1.8.37887: Flags [.], seq 358429:359857, ack 1, win 893, options [nop,nop,TS val 155165 ecr 4294908403,mptcp dss ack 2295998090 seq 3914254710 subseq 358429 len 1428 csum 0x5a6a], length 1428
10:53:19.646624 IP 112.26.1.1.37753 > 112.26.1.8.37887: Flags [.], seq 358429:359857, ack 1, win 893, options [nop,nop,TS val 155165 ecr 4294908403,mptcp dss ack 2295998090 seq 3914254710 subseq 358429 len 1428 csum 0x5a6a], length 1428
10:53:19.672428 IP 112.26.1.8.37887 > 112.26.1.1.37753: Flags [.], ack 345577, win 24467, options [nop,nop,TS val 4294909522 ecr 154173,nop,nop,sack 2 {355573:359857}{347005:352717},mptcp dss ack 3914213298], length 0
10:53:19.672673 IP 112.26.1.8.37887 > 112.26.1.1.37753: Flags [.], ack 345577, win 24467, options [nop,nop,TS val 4294909522 ecr 154173,nop,nop,sack 2 {355573:359857}{347005:352717},mptcp dss ack 3914213298], length 0
10:53:19.698492 IP 112.26.1.1.37753 > 112.26.1.8.37887: Flags [.], seq 359857:361285, ack 1, win 893, options [nop,nop,TS val 155165 ecr 4294908403,mptcp dss ack 2295998090 seq 3914256138 subseq 359857 len 1428 csum 0x57b9], length 1428
