10:52:44.159364 IP 112.26.1.8.37887 > 112.26.1.1.37753: Flags [S], seq 1087380066, win 65535, options [mss 1460,sackOK,TS val 4294873966 ecr 0,nop,wscale 6,mptcp join id 3 token 0xd15e4cde nonce 0x9c43d22d], length 0
10:52:44.251579 IP 112.26.1.8.37887 > 112.26.1.1.37753: Flags [S], seq 1087380066, win 65535, options [mss 1460,sackOK,TS val 4294873966 ecr 0,nop,wscale 6,mptcp join id 3 token 0xd15e4cde nonce 0x9c43d22d], length 0
10:52:44.291336 IP 112.26.1.1.37753 > 112.26.1.8.37887: Flags [S.], seq 1073520417, ack 1087380067, win 28560, options [mss 1460,sackOK,TS val 120893 ecr 4294873966,nop,wscale 7,mptcp join id 3 hmac 0xe14596f7a3c5554 nonce 0xc4d21e11], length 0
10:52:44.616464 IP 112.26.1.8.37887 > 112.26.1.1.37753: Flags [.], ack 1, win 7027, options [nop,nop,TS val 4294874344 ecr 120893,mptcp join hmac 0x5931aad495df313330019ba94d2f4c13f575bb46], length 0
10:52:44.619753 IP 112.26.1.8.37887 > 112.26.1.1.37753: Flags [.], ack 1, win 7027, options [nop,nop,TS val 4294874344 ecr 120893,mptcp join hmac 0x5931aad495df313330019ba94d2f4c13f575bb46], length 0
10:52:44.627076 IP 112.26.1.1.37753 > 112.26.1.8.37887: Flags [.], ack 1, win 893, options [nop,nop,TS val 121261 ecr 4294874344,mptcp dss ack 2295998090], length 0
10:52:44.709657 IP 112.26.1.1.37753 > 112.26.1.8.37887: Flags [.], seq 1:1429, ack 1, win 893, options [nop,nop,TS val 121261 ecr 4294874344,mptcp dss ack 2295998090 seq 3912833850 subseq 1 len 1428 csum 0x94ea], length 1428
10:53:14.716327 IP 112.26.1.8.37887 > 112.26.1.1.37753: Flags [.], ack 299881, win 23958, options [nop,nop,TS val 4294904529 ecr 150510,mptcp dss ack 3913980534], length 0
10:53:14.748762 IP 112.26.1.8.37887 > 112.26.1.1.37753: Flags [.], ack 297025, win 24129, options [nop,nop,TS val 4294904286 ecr 150404,mptcp dss ack 3913959114], length 0
10:53:14.751667 IP 112.26.1.1.37753 > 112.26.1.8.37887: Flags [.], seq 305593:307021, ack 1, win 893, options [nop,nop,TS val 151390 ecr 4294904286,mptcp dss ack 2295998090 seq 3914094774 subseq 305593 len 1428 csum 0xfe5f], length 1428
10:53:14.789845 IP 112.26.1.8.37887 > 112.26.1.1.37753: Flags [.], ack 301309, win 24112, options [nop,nop,TS val 4294904662 ecr 150687,mptcp dss ack 3914007666], length 0
10:53:14.919567 IP 112.26.1.8.37887 > 112.26.1.1.37753: Flags [.], ack 298453, win 23958, options [nop,nop,TS val 4294904407 ecr 150404,mptcp dss ack 3913980534], length 0
10:53:14.924411 IP 112.26.1.1.37753 > 112.26.1.8.37887: Flags [.], seq 307021:308449, ack 1, win 893, options [nop,nop,TS val 151561 ecr 4294904407,mptcp dss ack 2295998090 seq 3914101914 subseq 307021 len 1428 csum 0xf1f0], length 1428
10:53:14.950893 IP 112.26.1.8.37887 > 112.26.1.1.37753: Flags [.], ack 302737, win 24112, options [nop,nop,TS val 4294904794 ecr 150897,mptcp dss ack 3914007666], length 0
10:53:15.015597 IP 112.26.1.8.37887 > 112.26.1.1.37753: Flags [.], ack 299881, win 23958, options [nop,nop,TS val 4294904529 ecr 150510,mptcp dss ack 3913980534], length 0
10:53:15.029506 IP 112.26.1.8.37887 > 112.26.1.1.37753: Flags [.], ack 304165, win 24112, options [nop,nop,TS val 4294904881 ecr 151093,mptcp dss ack 3914007666], length 0
10:53:15.034068 IP 112.26.1.1.37753 > 112.26.1.8.37887: Flags [.], seq 308449:309877, ack 1, win 893, options [nop,nop,TS val 151561 ecr 4294904407,mptcp dss ack 2295998090 seq 3914103342 subseq 308449 len 1428 csum 0x834f], length 1428
10:53:15.119892 IP 112.26.1.8.37887 > 112.26.1.1.37753: Flags [.], ack 301309, win 24112, options [nop,nop,TS val 4294904662 ecr 150687,mptcp dss ack 3914007666], length 0
10:53:15.127429 IP 112.26.1.1.37753 > 112.26.1.8.37887: Flags [.], seq 309877:311305, ack 1, win 893, options [nop,nop,TS val 151657 ecr 4294904529,mptcp dss ack 2295998090 seq 3914109054 subseq 309877 len 1428 csum 0xafb5], length 1428
10:53:15.200739 IP 112.26.1.8.37887 > 112.26.1.1.37753: Flags [.], ack 305593, win 24112, options [nop,nop,TS val 4294905090 ecr 151228,mptcp dss ack 3914007666], length 0
10:53:15.228362 IP 112.26.1.1.37753 > 112.26.1.8.37887: Flags [.], seq 311305:312733, ack 1, win 893, options [nop,nop,TS val 151761 ecr 4294904662,mptcp dss ack 2295998090 seq 3914116194 subseq 311305 len 1428 csum 0x4947], length 1428
10:53:15.243359 IP 112.26.1.8.37887 > 112.26.1.1.37753: Flags [.], ack 302737, win 24112, options [nop,nop,TS val 4294904794 ecr 150897,mptcp dss ack 3914007666], length 0
10:53:15.285496 IP 112.26.1.1.37753 > 112.26.1.8.37887: Flags [.], seq 312733:314161, ack 1, win 893, options [nop,nop,TS val 151884 ecr 4294904794,mptcp dss ack 2295998090 seq 3914121906 subseq 312733 len 1428 csum 0xe2a5], length 1428
10:53:15.389217 IP 112.26.1.8.37887 > 112.26.1.1.37753: Flags [.], ack 304165, win 24112, options [nop,nop,TS val 4294904881 ecr 151093,mptcp dss ack 3914007666], length 0
10:53:15.392313 IP 112.26.1.1.37753 > 112.26.1.8.37887: Flags [.], seq 314161:315589, ack 1, win 893, options [nop,nop,TS val 152030 ecr 4294904881,mptcp dss ack 2295998090 seq 3914130474 subseq 314161 len 1428 csum 0xde77], length 1428
10:53:15.419377 IP 112.26.1.8.37887 > 112.26.1.1.37753: Flags [.], ack 307021, win 24241, options [nop,nop,TS val 4294905304 ecr 151390,mptcp dss ack 3914040510], length 0
10:53:15.530922 IP 112.26.1.8.37887 > 112.26.1.1.37753: Flags [.], ack 305593, win 24112, options [nop,nop,TS val 4294905090 ecr 151228,mptcp dss ack 3914007666], length 0
10:53:15.536201 IP 112.26.1.1.37753 > 112.26.1.8.37887: Flags [.], seq 315589:317017, ack 1, win 893, options [nop,nop,TS val 152172 ecr 4294905090,mptcp dss ack 2295998090 seq 3914136186 subseq 315589 len 1428 csum 0x8b6c], length 1428
10:53:15.676253 IP 112.26.1.8.37887 > 112.26.1.1.37753: Flags [.], ack 311305, win 24241, options [nop,nop,TS val 4294905565 ecr 151561,mptcp dss ack 3914040510], length 0
10:53:15.716988 IP 112.26.1.8.37887 > 112.26.1.1.37753: Flags [.], ack 307021, win 24241, options [nop,nop,TS val 4294905304 ecr 151390,mptcp dss ack 3914040510], length 0
10:53:15.727204 IP 112.26.1.1.37753 > 112.26.1.8.37887: Flags [.], seq 317017:318445, ack 1, win 893, options [nop,nop,TS val 152358 ecr 4294905304,mptcp dss ack 2295998090 seq 3914140470 subseq 317017 len 1428 csum 0x96c5], length 1428
10:53:15.864653 IP 112.26.1.8.37887 > 112.26.1.1.37753: Flags [.], ack 311305, win 24241, options [nop,nop,TS val 4294905565 ecr 151561,mptcp dss ack 3914040510], length 0
10:53:15.871869 IP 112.26.1.1.37753 > 112.26.1.8.37887: Flags [.], seq 318445:319873, ack 1, win 893, options [nop,nop,TS val 152506 ecr 4294905565,mptcp dss ack 2295998090 seq 3914146182 subseq 318445 len 1428 csum 0x8ef3], length 1428
10:53:16.037627 IP 112.26.1.1.37753 > 112.26.1.8.37887: Flags [.], seq 319873:321301, ack 1, win 893, options [nop,nop,TS val 152506 ecr 4294905565,mptcp dss ack 2295998090 seq 3914147610 subseq 319873 len 1428 csum 0xbbc1], length 1428
10:53:16.093901 IP 112.26.1.8.37887 > 112.26.1.1.37753: Flags [.], ack 314161, win 23973, options [nop,nop,TS val 4294905890 ecr 151761,mptcp dss ack 3914063358], length 0
10:53:16.096163 IP 112.26.1.8.37887 > 112.26.1.1.37753: Flags [.], ack 314161, win 23973, options [nop,nop,TS val 4294905890 ecr 151761,mptcp dss ack 3914063358], length 0
10:53:16.113974 IP 112.26.1.1.37753 > 112.26.1.8.37887: Flags [.], seq 321301:322729, ack 1, win 893, options [nop,nop,TS val 152506 ecr 4294905565,mptcp dss ack 2295998090 seq 3914149038 subseq 321301 len 1428 csum 0x98ee], length 1428
10:53:16.182347 IP 112.26.1.8.37887 > 112.26.1.1.37753: Flags [.], ack 317017, win 24224, options [nop,nop,TS val 4294906062 ecr 152030,mptcp dss ack 3914063358], length 0
10:53:16.184444 IP 112.26.1.8.37887 > 112.26.1.1.37753: Flags [.], ack 317017, win 24224, options [nop,nop,TS val 4294906062 ecr 152030,mptcp dss ack 3914063358], length 0
10:53:16.204278 IP 112.26.1.1.37753 > 112.26.1.8.37887: Flags [.], seq 322729:324157, ack 1, win 893, options [nop,nop,TS val 152737 ecr 4294905890,mptcp dss ack 2295998090 seq 3914154750 subseq 322729 len 1428 csum 0xf430], length 1428
10:53:16.322847 IP 112.26.1.1.37753 > 112.26.1.8.37887: Flags [.], seq 324157:325585, ack 1, win 893, options [nop,nop,TS val 152737 ecr 4294905890,mptcp dss ack 2295998090 seq 3914156178 subseq 324157 len 1428 csum 0x7198], length 1428
10:53:16.399832 IP 112.26.1.1.37753 > 112.26.1.8.37887: Flags [.], seq 325585:327013, ack 1, win 893, options [nop,nop,TS val 152825 ecr 4294906062,mptcp dss ack 2295998090 seq 3914157606 subseq 325585 len 1428 csum 0x239d], length 1428
10:53:16.492913 IP 112.26.1.1.37753 > 112.26.1.8.37887: Flags [.], seq 327013:328441, ack 1, win 893, options [nop,nop,TS val 152825 ecr 4294906062,mptcp dss ack 2295998090 seq 3914159034 subseq 327013 len 1428 csum 0x58e4], length 1428
10:53:16.576369 IP 112.26.1.8.37887 > 112.26.1.1.37753: Flags [.], ack 321301, win 24224, options [nop,nop,TS val 4294906456 ecr 152358,mptcp dss ack 3914063358], length 0
10:53:16.582084 IP 112.26.1.8.37887 > 112.26.1.1.37753: Flags [.], ack 321301, win 24224, options [nop,nop,TS val 4294906456 ecr 152358,mptcp dss ack 3914063358], length 0
10:53:16.599604 IP 112.26.1.1.37753 > 112.26.1.8.37887: Flags [.], seq 328441:329869, ack 1, win 893, options [nop,nop,TS val 153223 ecr 4294906456,mptcp dss ack 2295998090 seq 3914169030 subseq 328441 len 1428 csum 0x3b82], length 1428
10:53:16.652522 IP 112.26.1.1.37753 > 112.26.1.8.37887: Flags [.], seq 329869:331297, ack 1, win 893, options [nop,nop,TS val 153223 ecr 4294906456,mptcp dss ack 2295998090 seq 3914170458 subseq 329869 len 1428 csum 0x4182], length 1428
10:53:16.762615 IP 112.26.1.1.37753 > 112.26.1.8.37887: Flags [.], seq 331297:332725, ack 1, win 893, options [nop,nop,TS val 153223 ecr 4294906456,mptcp dss ack 2295998090 seq 3914171886 subseq 331297 len 1428 csum 0xf905], length 1428
10:53:16.858912 IP 112.26.1.1.37753 > 112.26.1.8.37887: Flags [.], seq 332725:334153, ack 1, win 893, options [nop,nop,TS val 153223 ecr 4294906456,mptcp dss ack 2295998090 seq 3914173314 subseq 332725 len 1428 csum 0xcb79], length 1428
10:53:16.968017 IP 112.26.1.8.37887 > 112.26.1.1.37753: Flags [.], ack 324157, win 24033, options [nop,nop,TS val 4294906844 ecr 152506,mptcp dss ack 3914091918], length 0
10:53:16.972933 IP 112.26.1.8.37887 > 112.26.1.1.37753: Flags [.], ack 324157, win 24033, options [nop,nop,TS val 4294906844 ecr 152506,mptcp dss ack 3914091918], length 0
10:53:16.983214 IP 112.26.1.1.37753 > 112.26.1.8.37887: Flags [.], seq 334153:335581, ack 1, win 893, options [nop,nop,TS val 153614 ecr 4294906844,mptcp dss ack 2295998090 seq 3914186166 subseq 334153 len 1428 csum 0x79b4], length 1428
10:53:17.118396 IP 112.26.1.8.37887 > 112.26.1.1.37753: Flags [.], ack 327013, win 24216, options [nop,nop,TS val 4294907007 ecr 152737,mptcp dss ack 3914106198], length 0
10:53:17.123866 IP 112.26.1.8.37887 > 112.26.1.1.37753: Flags [.], ack 327013, win 24216, options [nop,nop,TS val 4294907007 ecr 152737,mptcp dss ack 3914106198], length 0
10:53:17.148293 IP 112.26.1.1.37753 > 112.26.1.8.37887: Flags [.], seq 335581:337009, ack 1, win 893, options [nop,nop,TS val 153614 ecr 4294906844,mptcp dss ack 2295998090 seq 3914187594 subseq 335581 len 1428 csum 0x2953], length 1428
10:53:17.233130 IP 112.26.1.1.37753 > 112.26.1.8.37887: Flags [.], seq 337009:338437, ack 1, win 893, options [nop,nop,TS val 153614 ecr 4294906844,mptcp dss ack 2295998090 seq 3914189022 subseq 337009 len 1428 csum 0x4088], length 1428
10:53:17.347505 IP 112.26.1.1.37753 > 112.26.1.8.37887: Flags [.], seq 338437:339865, ack 1, win 893, options [nop,nop,TS val 153764 ecr 4294907007,mptcp dss ack 2295998090 seq 3914194734 subseq 338437 len 1428 csum 0x801c], length 1428
10:53:17.387143 IP 112.26.1.1.37753 > 112.26.1.8.37887: Flags [.], seq 339865:341293, ack 1, win 893, options [nop,nop,TS val 153764 ecr 4294907007,mptcp dss ack 2295998090 seq 3914196162 subseq 339865 len 1428 csum 0xb592], length 1428
10:53:17.530352 IP 112.26.1.8.37887 > 112.26.1.1.37753: Flags [.], ack 331297, win 24216, options [nop,nop,TS val 4294907416 ecr 152825,mptcp dss ack 3914106198], length 0
10:53:17.531955 IP 112.26.1.8.37887 > 112.26.1.1.37753: Flags [.], ack 331297, win 24216, options [nop,nop,TS val 4294907416 ecr 152825,mptcp dss ack 3914106198], length 0
10:53:17.547205 IP 112.26.1.1.37753 > 112.26.1.8.37887: Flags [.], seq 341293:342721, ack 1, win 893, options [nop,nop,TS val 154173 ecr 4294907416,mptcp dss ack 2295998090 seq 3914209014 subseq 341293 len 1428 csum 0x2189], length 1428
10:53:17.643698 IP 112.26.1.1.37753 > 112.26.1.8.37887: Flags [.], seq 342721:344149, ack 1, win 893, options [nop,nop,TS val 154173 ecr 4294907416,mptcp dss ack 2295998090 seq 3914210442 subseq 342721 len 1428 csum 0x121e], length 1428
10:53:17.736521 IP 112.26.1.1.37753 > 112.26.1.8.37887: Flags [.], seq 344149:345577, ack 1, win 893, options [nop,nop,TS val 154173 ecr 4294907416,mptcp dss ack 2295998090 seq 3914211870 subseq 344149 len 1428 csum 0xa649], length 1428
10:53:17.775420 IP 112.26.1.1.37753 > 112.26.1.8.37887: Flags [.], seq 345577:347005, ack 1, win 893, options [nop,nop,TS val 154173 ecr 4294907416,mptcp dss ack 2295998090 seq 3914213298 subseq 345577 len 1428 csum 0x8133], length 1428
10:53:17.871191 IP 112.26.1.1.37753 > 112.26.1.8.37887: Flags [.], seq 347005:348433, ack 1, win 893, options [nop,nop,TS val 154173 ecr 4294907416,mptcp dss ack 2295998090 seq 3914214726 subseq 347005 len 1428 csum 0x5bf6], length 1428
10:53:17.927226 IP 112.26.1.8.37887 > 112.26.1.1.37753: Flags [.], ack 338437, win 24216, options [nop,nop,TS val 4294907810 ecr 153223,mptcp dss ack 3914106198], length 0
10:53:17.929084 IP 112.26.1.8.37887 > 112.26.1.1.37753: Flags [.], ack 338437, win 24216, options [nop,nop,TS val 4294907810 ecr 153223,mptcp dss ack 3914106198], length 0
10:53:17.981112 IP 112.26.1.1.37753 > 112.26.1.8.37887: Flags [.], seq 348433:349861, ack 1, win 893, options [nop,nop,TS val 154570 ecr 4294907810,mptcp dss ack 2295998090 seq 3914221866 subseq 348433 len 1428 csum 0xc17b], length 1428
10:53:18.104502 IP 112.26.1.1.37753 > 112.26.1.8.37887: Flags [.], seq 349861:351289, ack 1, win 893, options [nop,nop,TS val 154570 ecr 4294907810,mptcp dss ack 2295998090 seq 3914223294 subseq 349861 len 1428 csum 0xaf8a], length 1428
10:53:18.183139 IP 112.26.1.1.37753 > 112.26.1.8.37887: Flags [.], seq 351289:352717, ack 1, win 893, options [nop,nop,TS val 154570 ecr 4294907810,mptcp dss ack 2295998090 seq 3914224722 subseq 351289 len 1428 csum 0x848f], length 1428
10:53:18.253389 IP 112.26.1.1.37753 > 112.26.1.8.37887: Flags [.], seq 352717:354145, ack 1, win 893, options [nop,nop,TS val 154570 ecr 4294907810,mptcp dss ack 2295998090 seq 3914226150 subseq 352717 len 1428 csum 0xb9f2], length 1428
10:53:18.316891 IP 112.26.1.1.37753 > 112.26.1.8.37887: Flags [.], seq 354145:355573, ack 1, win 893, options [nop,nop,TS val 154570 ecr 4294907810,mptcp dss ack 2295998090 seq 3914227578 subseq 354145 len 1428 csum 0x4f05], length 1428
10:53:18.329848 IP 112.26.1.8.37887 > 112.26.1.1.37753: Flags [.], ack 341293, win 24295, options [nop,nop,TS val 4294908216 ecr 153764,mptcp dss ack 3914167602], length 0
10:53:18.331606 IP 112.26.1.8.37887 > 112.26.1.1.37753: Flags [.], ack 341293, win 24295, options [nop,nop,TS val 4294908216 ecr 153764,mptcp dss ack 3914167602], length 0
10:53:18.378409 IP 112.26.1.1.37753 > 112.26.1.8.37887: Flags [.], seq 355573:357001, ack 1, win 893, options [nop,nop,TS val 154973 ecr 4294908216,mptcp dss ack 2295998090 seq 3914246142 subseq 355573 len 1428 csum 0x5159], length 1428
10:53:18.503121 IP 112.26.1.1.37753 > 112.26.1.8.37887: Flags [.], seq 357001:358429, ack 1, win 893, options [nop,nop,TS val 154973 ecr 4294908216,mptcp dss ack 2295998090 seq 3914247570 subseq 357001 len 1428 csum 0x2342], length 1428
10:53:18.521530 IP 112.26.1.8.37887 > 112.26.1.1.37753: Flags [.], ack 344149, win 24003, options [nop,nop,TS val 4294908403 ecr 154173,mptcp dss ack 3914211870], length 0
10:53:18.523892 IP 112.26.1.8.37887 > 112.26.1.1.37753: Flags [.], ack 344149, win 24003, options [nop,nop,TS val 4294908403 ecr 154173,mptcp dss ack 3914211870], length 0
10:53:18.656282 IP 112.26.1.1.37753 > 112.26.1.8.37887: Flags [.], seq 358429:359857, ack 1, win 893, options [nop,nop,TS val 155165 ecr 4294908403,mptcp dss ack 2295998090 seq 3914254710 subseq 358429 len 1428 csum 0x5a6a], length 1428
10:53:18.713466 IP 112.26.1.1.37753 > 112.26.1.8.37887: Flags [.], seq 359857:361285, ack 1, win 893, options [nop,nop,TS val 155165 ecr 4294908403,mptcp dss ack 2295998090 seq 3914256138 subseq 359857 len 1428 csum 0x57b9], length 1428
10:53:18.748506 IP 112.26.1.8.37887 > 112.26.1.1.37753: Flags [.], ack 345577, win 24467, options [nop,nop,TS val 4294908631 ecr 154173,nop,nop,sack 1 {347005:348433},mptcp dss ack 3914213298], length 0
10:53:18.754515 IP 112.26.1.8.37887 > 112.26.1.1.37753: Flags [.], ack 345577, win 24467, options [nop,nop,TS val 4294908631 ecr 154173,nop,nop,sack 1 {347005:348433},mptcp dss ack 3914213298], length 0
10:53:18.850490 IP 112.26.1.1.37753 > 112.26.1.8.37887: Flags [.], seq 361285:362713, ack 1, win 893, options [nop,nop,TS val 155165 ecr 4294908403,mptcp dss ack 2295998090 seq 3914257566 subseq 361285 len 1428 csum 0x880], length 1428
10:53:18.909942 IP 112.26.1.8.37887 > 112.26.1.1.37753: Flags [.], ack 345577, win 24467, options [nop,nop,TS val 4294908768 ecr 154173,nop,nop,sack 1 {347005:349861},mptcp dss ack 3914213298], length 0
10:53:18.925386 IP 112.26.1.8.37887 > 112.26.1.1.37753: Flags [.], ack 345577, win 24467, options [nop,nop,TS val 4294908768 ecr 154173,nop,nop,sack 1 {347005:349861},mptcp dss ack 3914213298], length 0
10:53:18.994731 IP 112.26.1.1.37753 > 112.26.1.8.37887: Flags [.], seq 362713:364141, ack 1, win 893, options [nop,nop,TS val 155396 ecr 4294908631,mptcp dss ack 2295998090 seq 3914270418 subseq 362713 len 1428 csum 0x9e48], length 1428
10:53:19.049131 IP 112.26.1.8.37887 > 112.26.1.1.37753: Flags [.], ack 345577, win 24467, options [nop,nop,TS val 4294908934 ecr 154173,nop,nop,sack 1 {347005:351289},mptcp dss ack 3914213298], length 0
10:53:19.107496 IP 112.26.1.1.37753 > 112.26.1.8.37887: Flags [.], seq 364141:365569, ack 1, win 893, options [nop,nop,TS val 155396 ecr 4294908631,mptcp dss ack 2295998090 seq 3914271846 subseq 364141 len 1428 csum 0x1121], length 1428
10:53:19.121439 IP 112.26.1.8.37887 > 112.26.1.1.37753: Flags [.], ack 345577, win 24467, options [nop,nop,TS val 4294908934 ecr 154173,nop,nop,sack 1 {347005:351289},mptcp dss ack 3914213298], length 0
10:53:19.241217 IP 112.26.1.1.37753 > 112.26.1.8.37887: Flags [.], seq 365569:366997, ack 1, win 893, options [nop,nop,TS val 155396 ecr 4294908631,mptcp dss ack 2295998090 seq 3914273274 subseq 365569 len 1428 csum 0x8ba5], length 1428
10:53:19.259703 IP 112.26.1.8.37887 > 112.26.1.1.37753: Flags [.], ack 345577, win 24467, options [nop,nop,TS val 4294909061 ecr 154173,nop,nop,sack 1 {347005:352717},mptcp dss ack 3914213298], length 0
10:53:19.304266 IP 112.26.1.8.37887 > 112.26.1.1.37753: Flags [.], ack 345577, win 24467, options [nop,nop,TS val 4294909061 ecr 154173,nop,nop,sack 1 {347005:352717},mptcp dss ack 3914213298], length 0
10:53:19.347919 IP 112.26.1.1.37753 > 112.26.1.8.37887: Flags [.], seq 366997:368425, ack 1, win 893, options [nop,nop,TS val 155578 ecr 4294908768,mptcp dss ack 2295998090 seq 3914280414 subseq 366997 len 1428 csum 0xd6a], length 1428
10:53:19.384189 IP 112.26.1.8.37887 > 112.26.1.1.37753: Flags [.], ack 345577, win 24467, options [nop,nop,TS val 4294909267 ecr 154173,nop,nop,sack 2 {355573:357001}{347005:352717},mptcp dss ack 3914213298], length 0
10:53:19.448157 IP 112.26.1.8.37887 > 112.26.1.1.37753: Flags [.], ack 345577, win 24467, options [nop,nop,TS val 4294909267 ecr 154173,nop,nop,sack 2 {355573:357001}{347005:352717},mptcp dss ack 3914213298], length 0
10:53:19.500415 IP 112.26.1.1.37753 > 112.26.1.8.37887: Flags [.], seq 345577:347005, ack 1, win 893, options [nop,nop,TS val 155762 ecr 4294908934,mptcp dss ack 2295998090 seq 3914213298 subseq 345577 len 1428 csum 0x8133], length 1428
10:53:19.539565 IP 112.26.1.8.37887 > 112.26.1.1.37753: Flags [.], ack 345577, win 24467, options [nop,nop,TS val 4294909406 ecr 154173,nop,nop,sack 2 {355573:358429}{347005:352717},mptcp dss ack 3914213298], length 0
10:53:19.578865 IP 112.26.1.8.37887 > 112.26.1.1.37753: Flags [.], ack 345577, win 24467, options [nop,nop,TS val 4294909406 ecr 154173,nop,nop,sack 2 {355573:358429}{347005:352717},mptcp dss ack 3914213298], length 0
10:53:19.607827 IP 112.26.1.1.37753 > 112.26.1.8.37887: Flags [.], seq 368425:369853, ack 1, win 893, options [nop,nop,TS val 156012 ecr 4294909061,mptcp dss ack 2295998090 seq 3914293266 subseq 368425 len 1428 csum 0x3209], length 1428
10:53:19.673103 IP 112.26.1.8.37887 > 112.26.1.1.37753: Flags [.], ack 345577, win 24467, options [nop,nop,TS val 4294909522 ecr 154173,nop,nop,sack 2 {355573:359857}{347005:352717},mptcp dss ack 3914213298], length 0
10:53:19.725417 IP 112.26.1.8.37887 > 112.26.1.1.37753: Flags [.], ack 345577, win 24467, options [nop,nop,TS val 4294909522 ecr 154173,nop,nop,sack 2 {355573:359857}{347005:352717},mptcp dss ack 3914213298], length 0
10:53:19.750298 IP 112.26.1.1.37753 > 112.26.1.8.37887: Flags [.], seq 352717:354145, ack 1, win 893, options [nop,nop,TS val 156367 ecr 4294909522,mptcp dss ack 2295998090 seq 3914226150 subseq 352717 len 1428 csum 0xb9f2], length 1428
10:53:19.783108 IP 112.26.1.8.37887 > 112.26.1.1.37753: Flags [.], ack 345577, win 24467, options [nop,nop,TS val 4294909668 ecr 154173,nop,nop,sack 2 {355573:361285}{347005:352717},mptcp dss ack 3914213298], length 0
10:53:19.884889 IP 112.26.1.8.37887 > 112.26.1.1.37753: Flags [.], ack 345577, win 24467, options [nop,nop,TS val 4294909668 ecr 154173,nop,nop,sack 2 {355573:361285}{347005:352717},mptcp dss ack 3914213298], length 0
10:53:19.893098 IP 112.26.1.1.37753 > 112.26.1.8.37887: Flags [.], seq 354145:355573, ack 1, win 893, options [nop,nop,TS val 156526 ecr 4294909668,mptcp dss ack 2295998090 seq 3914227578 subseq 354145 len 1428 csum 0x4f05], length 1428
10:53:19.930013 IP 112.26.1.8.37887 > 112.26.1.1.37753: Flags [.], ack 345577, win 24467, options [nop,nop,TS val 4294909773 ecr 154173,nop,nop,sack 2 {355573:362713}{347005:352717},mptcp dss ack 3914213298], length 0
10:53:19.951101 IP 112.26.1.8.37887 > 112.26.1.1.37753: Flags [.], ack 345577, win 24467, options [nop,nop,TS val 4294909773 ecr 154173,nop,nop,sack 2 {355573:362713}{347005:352717},mptcp dss ack 3914213298], length 0
10:53:20.015625 IP 112.26.1.1.37753 > 112.26.1.8.37887: Flags [.], seq 369853:371281, ack 1, win 893, options [nop,nop,TS val 156652 ecr 4294909773,mptcp dss ack 2295998090 seq 3914311830 subseq 369853 len 1428 csum 0x8ef], length 1428
10:53:20.099465 IP 112.26.1.8.37887 > 112.26.1.1.37753: Flags [.], ack 345577, win 24467, options [nop,nop,TS val 4294909889 ecr 154173,nop,nop,sack 2 {355573:364141}{347005:352717},mptcp dss ack 3914213298], length 0
10:53:20.101342 IP 112.26.1.8.37887 > 112.26.1.1.37753: Flags [.], ack 345577, win 24467, options [nop,nop,TS val 4294909889 ecr 154173,nop,nop,sack 2 {355573:364141}{347005:352717},mptcp dss ack 3914213298], length 0
10:53:20.166022 IP 112.26.1.1.37753 > 112.26.1.8.37887: Flags [.], seq 371281:372709, ack 1, win 893, options [nop,nop,TS val 156780 ecr 4294909889,mptcp dss ack 2295998090 seq 3914317542 subseq 371281 len 1428 csum 0xf52f], length 1428
10:53:20.291068 IP 112.26.1.8.37887 > 112.26.1.1.37753: Flags [.], ack 345577, win 24467, options [nop,nop,TS val 4294910060 ecr 154173,nop,nop,sack 2 {365569:366997}{355573:364141},mptcp dss ack 3914213298], length 0
10:53:20.358331 IP 112.26.1.8.37887 > 112.26.1.1.37753: Flags [.], ack 345577, win 24467, options [nop,nop,TS val 4294910223 ecr 154173,nop,nop,sack 2 {365569:368425}{355573:364141},mptcp dss ack 3914213298], length 0
10:53:20.386376 IP 112.26.1.8.37887 > 112.26.1.1.37753: Flags [.], ack 345577, win 24467, options [nop,nop,TS val 4294910060 ecr 154173,nop,nop,sack 2 {365569:366997}{355573:364141},mptcp dss ack 3914213298], length 0
10:53:20.390160 IP 112.26.1.1.37753 > 112.26.1.8.37887: Flags [.], seq 364141:365569, ack 1, win 893, options [nop,nop,TS val 157028 ecr 4294910060,mptcp dss ack 2295998090 seq 3914271846 subseq 364141 len 1428 csum 0x1121], length 1428
10:53:20.517095 IP 112.26.1.8.37887 > 112.26.1.1.37753: Flags [.], ack 352717, win 24267, options [nop,nop,TS val 4294910352 ecr 155762,nop,nop,sack 2 {365569:368425}{355573:364141},mptcp dss ack 3914226150], length 0
10:53:20.547457 IP 112.26.1.8.37887 > 112.26.1.1.37753: Flags [.], ack 345577, win 24467, options [nop,nop,TS val 4294910223 ecr 154173,nop,nop,sack 2 {365569:368425}{355573:364141},mptcp dss ack 3914213298], length 0
10:53:20.609207 IP 112.26.1.1.37753 > 112.26.1.8.37887: Flags [.], seq 372709:374137, ack 1, win 893, options [nop,nop,TS val 157247 ecr 4294910223,mptcp dss ack 2295998090 seq 3914336106 subseq 372709 len 1428 csum 0x9024], length 1428
10:53:20.657085 IP 112.26.1.8.37887 > 112.26.1.1.37753: Flags [.], ack 352717, win 24267, options [nop,nop,TS val 4294910352 ecr 155762,nop,nop,sack 2 {365569:368425}{355573:364141},mptcp dss ack 3914226150], length 0
10:53:20.695262 IP 112.26.1.8.37887 > 112.26.1.1.37753: Flags [.], ack 352717, win 24267, options [nop,nop,TS val 4294910469 ecr 155762,nop,nop,sack 2 {365569:369853}{355573:364141},mptcp dss ack 3914226150], length 0
10:53:20.715454 IP 112.26.1.8.37887 > 112.26.1.1.37753: Flags [.], ack 352717, win 24267, options [nop,nop,TS val 4294910469 ecr 155762,nop,nop,sack 2 {365569:369853}{355573:364141},mptcp dss ack 3914226150], length 0
10:53:20.738719 IP 112.26.1.1.37753 > 112.26.1.8.37887: Flags [.], seq 374137:375565, ack 1, win 893, options [nop,nop,TS val 157298 ecr 4294910352,mptcp dss ack 2295998090 seq 3914340390 subseq 374137 len 1428 csum 0x450b], length 1428
10:53:20.776317 IP 112.26.1.8.37887 > 112.26.1.1.37753: Flags [.], ack 352717, win 24267, options [nop,nop,TS val 4294910653 ecr 155762,nop,nop,sack 2 {354145:364141}{365569:369853},mptcp dss ack 3914226150], length 0
10:53:20.831959 IP 112.26.1.1.37753 > 112.26.1.8.37887: Flags [.], seq 375565:376993, ack 1, win 893, options [nop,nop,TS val 157377 ecr 4294910469,mptcp dss ack 2295998090 seq 3914341818 subseq 375565 len 1428 csum 0x454d], length 1428
10:53:20.859331 IP 112.26.1.8.37887 > 112.26.1.1.37753: Flags [.], ack 352717, win 24267, options [nop,nop,TS val 4294910653 ecr 155762,nop,nop,sack 2 {354145:364141}{365569:369853},mptcp dss ack 3914226150], length 0
10:53:20.932127 IP 112.26.1.1.37753 > 112.26.1.8.37887: Flags [.], seq 352717:354145, ack 1, win 893, options [nop,nop,TS val 157500 ecr 4294910653,mptcp dss ack 2295998090 seq 3914226150 subseq 352717 len 1428 csum 0xb9f2], length 1428
10:53:20.940350 IP 112.26.1.8.37887 > 112.26.1.1.37753: Flags [.], ack 352717, win 24267, options [nop,nop,TS val 4294910799 ecr 155762,nop,nop,sack 2 {365569:371281}{354145:364141},mptcp dss ack 3914226150], length 0
10:53:21.039008 IP 112.26.1.8.37887 > 112.26.1.1.37753: Flags [.], ack 352717, win 24267, options [nop,nop,TS val 4294910922 ecr 155762,nop,nop,sack 1 {354145:371281},mptcp dss ack 3914226150], length 0
10:53:21.072289 IP 112.26.1.8.37887 > 112.26.1.1.37753: Flags [.], ack 352717, win 24267, options [nop,nop,TS val 4294910799 ecr 155762,nop,nop,sack 2 {365569:371281}{354145:364141},mptcp dss ack 3914226150], length 0
10:53:21.130794 IP 112.26.1.8.37887 > 112.26.1.1.37753: Flags [.], ack 352717, win 24267, options [nop,nop,TS val 4294910922 ecr 155762,nop,nop,sack 1 {354145:371281},mptcp dss ack 3914226150], length 0
10:53:21.148379 IP 112.26.1.1.37753 > 112.26.1.8.37887: Flags [.], seq 376993:378421, ack 1, win 893, options [nop,nop,TS val 157766 ecr 4294910799,mptcp dss ack 2295998090 seq 3914354670 subseq 376993 len 1428 csum 0x93f0], length 1428
10:53:21.189941 IP 112.26.1.8.37887 > 112.26.1.1.37753: Flags [.], ack 352717, win 24267, options [nop,nop,TS val 4294911071 ecr 155762,nop,nop,sack 2 {372709:374137}{354145:371281},mptcp dss ack 3914226150], length 0
10:53:21.192549 IP 112.26.1.8.37887 > 112.26.1.1.37753: Flags [.], ack 352717, win 24267, options [nop,nop,TS val 4294911071 ecr 155762,nop,nop,sack 2 {372709:374137}{354145:371281},mptcp dss ack 3914226150], length 0
10:53:21.286395 IP 112.26.1.1.37753 > 112.26.1.8.37887: Flags [.], seq 371281:372709, ack 1, win 893, options [nop,nop,TS val 157772 ecr 4294910922,mptcp dss ack 2295998090 seq 3914317542 subseq 371281 len 1428 csum 0xf52f], length 1428
10:53:21.325818 IP 112.26.1.8.37887 > 112.26.1.1.37753: Flags [.], ack 352717, win 24267, options [nop,nop,TS val 4294911197 ecr 155762,nop,nop,sack 2 {372709:375565}{354145:371281},mptcp dss ack 3914226150], length 0
10:53:21.329256 IP 112.26.1.8.37887 > 112.26.1.1.37753: Flags [.], ack 352717, win 24267, options [nop,nop,TS val 4294911197 ecr 155762,nop,nop,sack 2 {372709:375565}{354145:371281},mptcp dss ack 3914226150], length 0
10:53:21.351559 IP 112.26.1.1.37753 > 112.26.1.8.37887: Flags [.], seq 378421:379849, ack 1, win 893, options [nop,nop,TS val 157879 ecr 4294911071,mptcp dss ack 2295998090 seq 3914360382 subseq 378421 len 1428 csum 0x11d1], length 1428
10:53:21.473450 IP 112.26.1.8.37887 > 112.26.1.1.37753: Flags [.], ack 352717, win 24267, options [nop,nop,TS val 4294911362 ecr 155762,nop,nop,sack 2 {372709:376993}{354145:371281},mptcp dss ack 3914226150], length 0
10:53:21.478243 IP 112.26.1.8.37887 > 112.26.1.1.37753: Flags [.], ack 352717, win 24267, options [nop,nop,TS val 4294911362 ecr 155762,nop,nop,sack 2 {372709:376993}{354145:371281},mptcp dss ack 3914226150], length 0
10:53:21.530912 IP 112.26.1.1.37753 > 112.26.1.8.37887: Flags [.], seq 379849:381277, ack 1, win 893, options [nop,nop,TS val 157983 ecr 4294911197,mptcp dss ack 2295998090 seq 3914364666 subseq 379849 len 1428 csum 0xdd00], length 1428
10:53:21.608978 IP 112.26.1.1.37753 > 112.26.1.8.37887: Flags [.], seq 381277:382705, ack 1, win 893, options [nop,nop,TS val 158153 ecr 4294911362,mptcp dss ack 2295998090 seq 3914371806 subseq 381277 len 1428 csum 0x427f], length 1428
10:53:21.636955 IP 112.26.1.8.37887 > 112.26.1.1.37753: Flags [.], ack 371281, win 23379, options [nop,nop,TS val 4294911517 ecr 157500,nop,nop,sack 1 {372709:376993},mptcp dss ack 3914290410], length 0
10:53:21.647982 IP 112.26.1.8.37887 > 112.26.1.1.37753: Flags [.], ack 371281, win 23379, options [nop,nop,TS val 4294911517 ecr 157500,nop,nop,sack 1 {372709:376993},mptcp dss ack 3914290410], length 0
10:53:21.687363 IP 112.26.1.1.37753 > 112.26.1.8.37887: Flags [.], seq 382705:384133, ack 1, win 893, options [nop,nop,TS val 158289 ecr 4294911517,mptcp dss ack 2295998090 seq 3914377518 subseq 382705 len 1428 csum 0x3ded], length 1428
10:53:21.802101 IP 112.26.1.8.37887 > 112.26.1.1.37753: Flags [.], ack 371281, win 24257, options [nop,nop,TS val 4294911609 ecr 157500,nop,nop,sack 1 {372709:378421},mptcp dss ack 3914317542], length 0
10:53:21.810354 IP 112.26.1.8.37887 > 112.26.1.1.37753: Flags [.], ack 371281, win 24257, options [nop,nop,TS val 4294911609 ecr 157500,nop,nop,sack 1 {372709:378421},mptcp dss ack 3914317542], length 0
10:53:21.849309 IP 112.26.1.1.37753 > 112.26.1.8.37887: Flags [.], seq 384133:385561, ack 1, win 893, options [nop,nop,TS val 158485 ecr 4294911609,mptcp dss ack 2295998090 seq 3914384658 subseq 384133 len 1428 csum 0xda21], length 1428
10:53:21.917674 IP 112.26.1.8.37887 > 112.26.1.1.37753: Flags [.], ack 378421, win 24148, options [nop,nop,TS val 4294911720 ecr 157772,mptcp dss ack 3914351814], length 0
10:53:21.979961 IP 112.26.1.8.37887 > 112.26.1.1.37753: Flags [.], ack 378421, win 24148, options [nop,nop,TS val 4294911720 ecr 157772,mptcp dss ack 3914351814], length 0
10:53:21.983950 IP 112.26.1.1.37753 > 112.26.1.8.37887: Flags [.], seq 385561:386989, ack 1, win 893, options [nop,nop,TS val 158621 ecr 4294911720,mptcp dss ack 2295998090 seq 3914391798 subseq 385561 len 1428 csum 0xb376], length 1428
10:53:22.060461 IP 112.26.1.8.37887 > 112.26.1.1.37753: Flags [.], ack 379849, win 24525, options [nop,nop,TS val 4294911797 ecr 157879,mptcp dss ack 3914357526], length 0
10:53:22.074658 IP 112.26.1.8.37887 > 112.26.1.1.37753: Flags [.], ack 379849, win 24525, options [nop,nop,TS val 4294911797 ecr 157879,mptcp dss ack 3914357526], length 0
10:53:22.079117 IP 112.26.1.1.37753 > 112.26.1.8.37887: Flags [.], seq 386989:388417, ack 1, win 893, options [nop,nop,TS val 158716 ecr 4294911797,mptcp dss ack 2295998090 seq 3914397510 subseq 386989 len 1428 csum 0x363], length 1428
10:53:22.162706 IP 112.26.1.8.37887 > 112.26.1.1.37753: Flags [.], ack 381277, win 24522, options [nop,nop,TS val 4294911922 ecr 157983,mptcp dss ack 3914363238], length 0
10:53:22.235051 IP 112.26.1.8.37887 > 112.26.1.1.37753: Flags [.], ack 381277, win 24522, options [nop,nop,TS val 4294911922 ecr 157983,mptcp dss ack 3914363238], length 0
10:53:22.237648 IP 112.26.1.1.37753 > 112.26.1.8.37887: Flags [.], seq 388417:389845, ack 1, win 893, options [nop,nop,TS val 158876 ecr 4294911922,mptcp dss ack 2295998090 seq 3914403222 subseq 388417 len 1428 csum 0x69ac], length 1428
10:53:22.251596 IP 112.26.1.8.37887 > 112.26.1.1.37753: Flags [.], ack 382705, win 24522, options [nop,nop,TS val 4294912031 ecr 158153,mptcp dss ack 3914363238], length 0
10:53:22.360771 IP 112.26.1.8.37887 > 112.26.1.1.37753: Flags [.], ack 384133, win 24476, options [nop,nop,TS val 4294912107 ecr 158289,mptcp dss ack 3914368950], length 0
10:53:22.379075 IP 112.26.1.8.37887 > 112.26.1.1.37753: Flags [.], ack 382705, win 24522, options [nop,nop,TS val 4294912031 ecr 158153,mptcp dss ack 3914363238], length 0
10:53:22.390233 IP 112.26.1.1.37753 > 112.26.1.8.37887: Flags [.], seq 389845:391273, ack 1, win 893, options [nop,nop,TS val 159020 ecr 4294912031,mptcp dss ack 2295998090 seq 3914413218 subseq 389845 len 1428 csum 0xa16f], length 1428
10:53:22.480761 IP 112.26.1.8.37887 > 112.26.1.1.37753: Flags [.], ack 385561, win 24473, options [nop,nop,TS val 4294912205 ecr 158485,mptcp dss ack 3914373234], length 0
10:53:22.514330 IP 112.26.1.8.37887 > 112.26.1.1.37753: Flags [.], ack 384133, win 24476, options [nop,nop,TS val 4294912107 ecr 158289,mptcp dss ack 3914368950], length 0
10:53:22.518244 IP 112.26.1.1.37753 > 112.26.1.8.37887: Flags [.], seq 391273:392701, ack 1, win 893, options [nop,nop,TS val 159155 ecr 4294912107,mptcp dss ack 2295998090 seq 3914418930 subseq 391273 len 1428 csum 0x8a4b], length 1428
10:53:22.553982 IP 112.26.1.8.37887 > 112.26.1.1.37753: Flags [.], ack 386989, win 24458, options [nop,nop,TS val 4294912320 ecr 158621,mptcp dss ack 3914378946], length 0
10:53:22.682874 IP 112.26.1.8.37887 > 112.26.1.1.37753: Flags [.], ack 388417, win 24507, options [nop,nop,TS val 4294912490 ecr 158716,mptcp dss ack 3914388942], length 0
10:53:22.697077 IP 112.26.1.8.37887 > 112.26.1.1.37753: Flags [.], ack 385561, win 24473, options [nop,nop,TS val 4294912205 ecr 158485,mptcp dss ack 3914373234], length 0
10:53:22.700416 IP 112.26.1.1.37753 > 112.26.1.8.37887: Flags [.], seq 392701:394129, ack 1, win 893, options [nop,nop,TS val 159338 ecr 4294912205,mptcp dss ack 2295998090 seq 3914428926 subseq 392701 len 1428 csum 0x57dd], length 1428
10:53:22.801657 IP 112.26.1.8.37887 > 112.26.1.1.37753: Flags [.], ack 389845, win 24507, options [nop,nop,TS val 4294912612 ecr 158876,mptcp dss ack 3914393226], length 0
10:53:22.855393 IP 112.26.1.8.37887 > 112.26.1.1.37753: Flags [.], ack 386989, win 24458, options [nop,nop,TS val 4294912320 ecr 158621,mptcp dss ack 3914378946], length 0
10:53:22.875008 IP 112.26.1.1.37753 > 112.26.1.8.37887: Flags [.], seq 394129:395557, ack 1, win 893, options [nop,nop,TS val 159496 ecr 4294912320,mptcp dss ack 2295998090 seq 3914437494 subseq 394129 len 1428 csum 0x9dce], length 1428
10:53:22.982344 IP 112.26.1.8.37887 > 112.26.1.1.37753: Flags [.], ack 391273, win 24507, options [nop,nop,TS val 4294912676 ecr 159020,mptcp dss ack 3914393226], length 0
10:53:22.989160 IP 112.26.1.8.37887 > 112.26.1.1.37753: Flags [.], ack 388417, win 24507, options [nop,nop,TS val 4294912490 ecr 158716,mptcp dss ack 3914388942], length 0
10:53:23.000171 IP 112.26.1.1.37753 > 112.26.1.8.37887: Flags [.], seq 395557:396985, ack 1, win 893, options [nop,nop,TS val 159630 ecr 4294912490,mptcp dss ack 2295998090 seq 3914438922 subseq 395557 len 1428 csum 0xb0f], length 1428
10:53:23.129626 IP 112.26.1.8.37887 > 112.26.1.1.37753: Flags [.], ack 389845, win 24507, options [nop,nop,TS val 4294912612 ecr 158876,mptcp dss ack 3914393226], length 0
10:53:23.141296 IP 112.26.1.8.37887 > 112.26.1.1.37753: Flags [.], ack 392701, win 24504, options [nop,nop,TS val 4294912804 ecr 159155,mptcp dss ack 3914398938], length 0
10:53:23.146709 IP 112.26.1.1.37753 > 112.26.1.8.37887: Flags [.], seq 396985:398413, ack 1, win 893, options [nop,nop,TS val 159770 ecr 4294912612,mptcp dss ack 2295998090 seq 3914444634 subseq 396985 len 1428 csum 0x492e], length 1428
10:53:23.187411 IP 112.26.1.8.37887 > 112.26.1.1.37753: Flags [.], ack 394129, win 24504, options [nop,nop,TS val 4294912921 ecr 159338,mptcp dss ack 3914398938], length 0
10:53:23.271881 IP 112.26.1.8.37887 > 112.26.1.1.37753: Flags [.], ack 391273, win 24507, options [nop,nop,TS val 4294912676 ecr 159020,mptcp dss ack 3914393226], length 0
10:53:23.285232 IP 112.26.1.1.37753 > 112.26.1.8.37887: Flags [.], seq 398413:399841, ack 1, win 893, options [nop,nop,TS val 159770 ecr 4294912612,mptcp dss ack 2295998090 seq 3914446062 subseq 398413 len 1428 csum 0xdb8b], length 1428
10:53:23.301809 IP 112.26.1.8.37887 > 112.26.1.1.37753: Flags [.], ack 395557, win 24504, options [nop,nop,TS val 4294913070 ecr 159496,mptcp dss ack 3914398938], length 0
10:53:23.379620 IP 112.26.1.1.37753 > 112.26.1.8.37887: Flags [.], seq 399841:401269, ack 1, win 893, options [nop,nop,TS val 159913 ecr 4294912676,mptcp dss ack 2295998090 seq 3914457486 subseq 399841 len 1428 csum 0x3c65], length 1428
10:53:23.391202 IP 112.26.1.8.37887 > 112.26.1.1.37753: Flags [.], ack 396985, win 24504, options [nop,nop,TS val 4294913199 ecr 159630,mptcp dss ack 3914398938], length 0
10:53:23.444254 IP 112.26.1.8.37887 > 112.26.1.1.37753: Flags [.], ack 392701, win 24504, options [nop,nop,TS val 4294912804 ecr 159155,mptcp dss ack 3914398938], length 0
10:53:23.470588 IP 112.26.1.8.37887 > 112.26.1.1.37753: Flags [.], ack 398413, win 24373, options [nop,nop,TS val 4294913356 ecr 159770,mptcp dss ack 3914417502], length 0
10:53:23.495002 IP 112.26.1.1.37753 > 112.26.1.8.37887: Flags [.], seq 401269:402697, ack 1, win 893, options [nop,nop,TS val 160085 ecr 4294912804,mptcp dss ack 2295998090 seq 3914461770 subseq 401269 len 1428 csum 0xe5e6], length 1428
10:53:23.589887 IP 112.26.1.8.37887 > 112.26.1.1.37753: Flags [.], ack 394129, win 24504, options [nop,nop,TS val 4294912921 ecr 159338,mptcp dss ack 3914398938], length 0
10:53:23.593168 IP 112.26.1.1.37753 > 112.26.1.8.37887: Flags [.], seq 402697:404125, ack 1, win 893, options [nop,nop,TS val 160231 ecr 4294912921,mptcp dss ack 2295998090 seq 3914468910 subseq 402697 len 1428 csum 0x2f77], length 1428
10:53:23.628069 IP 112.26.1.8.37887 > 112.26.1.1.37753: Flags [.], ack 399841, win 24442, options [nop,nop,TS val 4294913517 ecr 159770,mptcp dss ack 3914430354], length 0
10:53:23.735591 IP 112.26.1.8.37887 > 112.26.1.1.37753: Flags [.], ack 395557, win 24504, options [nop,nop,TS val 4294913070 ecr 159496,mptcp dss ack 3914398938], length 0
10:53:23.737578 IP 112.26.1.1.37753 > 112.26.1.8.37887: Flags [.], seq 404125:405553, ack 1, win 893, options [nop,nop,TS val 160377 ecr 4294913070,mptcp dss ack 2295998090 seq 3914480334 subseq 404125 len 1428 csum 0xcfdb], length 1428
10:53:23.765179 IP 112.26.1.8.37887 > 112.26.1.1.37753: Flags [.], ack 401269, win 24455, options [nop,nop,TS val 4294913656 ecr 159913,mptcp dss ack 3914440350], length 0
