10:52:44.098455 IP 112.26.1.8.37887 > 112.26.1.1.37753: Flags [S], seq 1087380066, win 65535, options [mss 1460,sackOK,TS val 4294873966 ecr 0,nop,wscale 6,mptcp join id 3 token 0xd15e4cde nonce 0x9c43d22d], length 0
10:52:44.158924 IP 112.26.1.8.37887 > 112.26.1.1.37753: Flags [S], seq 1087380066, win 65535, options [mss 1460,sackOK,TS val 4294873966 ecr 0,nop,wscale 6,mptcp join id 3 token 0xd15e4cde nonce 0x9c43d22d], length 0
10:52:44.251896 IP 112.26.1.8.37887 > 112.26.1.1.37753: Flags [S], seq 1087380066, win 65535, options [mss 1460,sackOK,TS val 4294873966 ecr 0,nop,wscale 6,mptcp join id 3 token 0xd15e4cde nonce 0x9c43d22d], length 0
10:52:44.391857 IP 112.26.1.1.37753 > 112.26.1.8.37887: Flags [S.], seq 1073520417, ack 1087380067, win 28560, options [mss 1460,sackOK,TS val 120893 ecr 4294873966,nop,wscale 7,mptcp join id 3 hmac 0xe14596f7a3c5554 nonce 0xc4d21e11], length 0
10:52:44.448738 IP 112.26.1.1.37753 > 112.26.1.8.37887: Flags [S.], seq 1073520417, ack 1087380067, win 28560, options [mss 1460,sackOK,TS val 120893 ecr 4294873966,nop,wscale 7,mptcp join id 3 hmac 0xe14596f7a3c5554 nonce 0xc4d21e11], length 0
10:52:44.540114 IP 112.26.1.8.37887 > 112.26.1.1.37753: Flags [.], ack 1, win 7027, options [nop,nop,TS val 4294874344 ecr 120893,mptcp join hmac 0x5931aad495df313330019ba94d2f4c13f575bb46], length 0
10:52:44.615915 IP 112.26.1.8.37887 > 112.26.1.1.37753: Flags [.], ack 1, win 7027, options [nop,nop,TS val 4294874344 ecr 120893,mptcp join hmac 0x5931aad495df313330019ba94d2f4c13f575bb46], length 0
10:53:14.616299 IP 112.26.1.1.37753 > 112.26.1.8.37887: Flags [.], seq 298453:299881, ack 1, win 893, options [nop,nop,TS val 150510 ecr 4294903671,mptcp dss ack 2295998090 seq 3914057646 subseq 298453 len 1428 csum 0x501f], length 1428
10:53:14.637150 IP 112.26.1.8.37887 > 112.26.1.1.37753: Flags [.], ack 299881, win 23958, options [nop,nop,TS val 4294904529 ecr 150510,mptcp dss ack 3913980534], length 0
10:53:14.715887 IP 112.26.1.8.37887 > 112.26.1.1.37753: Flags [.], ack 299881, win 23958, options [nop,nop,TS val 4294904529 ecr 150510,mptcp dss ack 3913980534], length 0
10:53:14.734742 IP 112.26.1.1.37753 > 112.26.1.8.37887: Flags [.], seq 299881:301309, ack 1, win 893, options [nop,nop,TS val 150687 ecr 4294903823,mptcp dss ack 2295998090 seq 3914067642 subseq 299881 len 1428 csum 0x623], length 1428
10:53:14.735052 IP 112.26.1.1.37753 > 112.26.1.8.37887: Flags [.], seq 299881:301309, ack 1, win 893, options [nop,nop,TS val 150687 ecr 4294903823,mptcp dss ack 2295998090 seq 3914067642 subseq 299881 len 1428 csum 0x623], length 1428
10:53:14.749125 IP 112.26.1.8.37887 > 112.26.1.1.37753: Flags [.], ack 297025, win 24129, options [nop,nop,TS val 4294904286 ecr 150404,mptcp dss ack 3913959114], length 0
10:53:14.784247 IP 112.26.1.8.37887 > 112.26.1.1.37753: Flags [.], ack 301309, win 24112, options [nop,nop,TS val 4294904662 ecr 150687,mptcp dss ack 3914007666], length 0
10:53:14.789385 IP 112.26.1.8.37887 > 112.26.1.1.37753: Flags [.], ack 301309, win 24112, options [nop,nop,TS val 4294904662 ecr 150687,mptcp dss ack 3914007666], length 0
10:53:14.838724 IP 112.26.1.1.37753 > 112.26.1.8.37887: Flags [.], seq 301309:302737, ack 1, win 893, options [nop,nop,TS val 150897 ecr 4294903948,mptcp dss ack 2295998090 seq 3914076210 subseq 301309 len 1428 csum 0x7658], length 1428
10:53:14.839048 IP 112.26.1.1.37753 > 112.26.1.8.37887: Flags [.], seq 301309:302737, ack 1, win 893, options [nop,nop,TS val 150897 ecr 4294903948,mptcp dss ack 2295998090 seq 3914076210 subseq 301309 len 1428 csum 0x7658], length 1428
10:53:14.902851 IP 112.26.1.8.37887 > 112.26.1.1.37753: Flags [.], ack 302737, win 24112, options [nop,nop,TS val 4294904794 ecr 150897,mptcp dss ack 3914007666], length 0
10:53:14.920054 IP 112.26.1.8.37887 > 112.26.1.1.37753: Flags [.], ack 298453, win 23958, options [nop,nop,TS val 4294904407 ecr 150404,mptcp dss ack 3913980534], length 0
10:53:14.950335 IP 112.26.1.8.37887 > 112.26.1.1.37753: Flags [.], ack 302737, win 24112, options [nop,nop,TS val 4294904794 ecr 150897,mptcp dss ack 3914007666], length 0
10:53:14.983418 IP 112.26.1.1.37753 > 112.26.1.8.37887: Flags [.], seq 302737:304165, ack 1, win 893, options [nop,nop,TS val 151093 ecr 4294904070,mptcp dss ack 2295998090 seq 3914083350 subseq 302737 len 1428 csum 0x17ef], length 1428
10:53:14.983721 IP 112.26.1.1.37753 > 112.26.1.8.37887: Flags [.], seq 302737:304165, ack 1, win 893, options [nop,nop,TS val 151093 ecr 4294904070,mptcp dss ack 2295998090 seq 3914083350 subseq 302737 len 1428 csum 0x17ef], length 1428
10:53:15.017862 IP 112.26.1.8.37887 > 112.26.1.1.37753: Flags [.], ack 304165, win 24112, options [nop,nop,TS val 4294904881 ecr 151093,mptcp dss ack 3914007666], length 0
10:53:15.019785 IP 112.26.1.8.37887 > 112.26.1.1.37753: Flags [.], ack 304165, win 24112, options [nop,nop,TS val 4294904881 ecr 151093,mptcp dss ack 3914007666], length 0
10:53:15.036823 IP 112.26.1.8.37887 > 112.26.1.1.37753: Flags [.], ack 299881, win 23958, options [nop,nop,TS val 4294904529 ecr 150510,mptcp dss ack 3913980534], length 0
10:53:15.120231 IP 112.26.1.8.37887 > 112.26.1.1.37753: Flags [.], ack 301309, win 24112, options [nop,nop,TS val 4294904662 ecr 150687,mptcp dss ack 3914007666], length 0
10:53:15.151111 IP 112.26.1.1.37753 > 112.26.1.8.37887: Flags [.], seq 304165:305593, ack 1, win 893, options [nop,nop,TS val 151228 ecr 4294904204,mptcp dss ack 2295998090 seq 3914086206 subseq 304165 len 1428 csum 0x5d4e], length 1428
10:53:15.151430 IP 112.26.1.1.37753 > 112.26.1.8.37887: Flags [.], seq 304165:305593, ack 1, win 893, options [nop,nop,TS val 151228 ecr 4294904204,mptcp dss ack 2295998090 seq 3914086206 subseq 304165 len 1428 csum 0x5d4e], length 1428
10:53:15.198193 IP 112.26.1.8.37887 > 112.26.1.1.37753: Flags [.], ack 305593, win 24112, options [nop,nop,TS val 4294905090 ecr 151228,mptcp dss ack 3914007666], length 0
10:53:15.200280 IP 112.26.1.8.37887 > 112.26.1.1.37753: Flags [.], ack 305593, win 24112, options [nop,nop,TS val 4294905090 ecr 151228,mptcp dss ack 3914007666], length 0
10:53:15.243817 IP 112.26.1.8.37887 > 112.26.1.1.37753: Flags [.], ack 302737, win 24112, options [nop,nop,TS val 4294904794 ecr 150897,mptcp dss ack 3914007666], length 0
10:53:15.321487 IP 112.26.1.1.37753 > 112.26.1.8.37887: Flags [.], seq 305593:307021, ack 1, win 893, options [nop,nop,TS val 151390 ecr 4294904286,mptcp dss ack 2295998090 seq 3914094774 subseq 305593 len 1428 csum 0xfe5f], length 1428
10:53:15.321761 IP 112.26.1.1.37753 > 112.26.1.8.37887: Flags [.], seq 305593:307021, ack 1, win 893, options [nop,nop,TS val 151390 ecr 4294904286,mptcp dss ack 2295998090 seq 3914094774 subseq 305593 len 1428 csum 0xfe5f], length 1428
10:53:15.389687 IP 112.26.1.8.37887 > 112.26.1.1.37753: Flags [.], ack 304165, win 24112, options [nop,nop,TS val 4294904881 ecr 151093,mptcp dss ack 3914007666], length 0
10:53:15.417046 IP 112.26.1.8.37887 > 112.26.1.1.37753: Flags [.], ack 307021, win 24241, options [nop,nop,TS val 4294905304 ecr 151390,mptcp dss ack 3914040510], length 0
10:53:15.418925 IP 112.26.1.8.37887 > 112.26.1.1.37753: Flags [.], ack 307021, win 24241, options [nop,nop,TS val 4294905304 ecr 151390,mptcp dss ack 3914040510], length 0
10:53:15.475055 IP 112.26.1.1.37753 > 112.26.1.8.37887: Flags [.], seq 307021:308449, ack 1, win 893, options [nop,nop,TS val 151561 ecr 4294904407,mptcp dss ack 2295998090 seq 3914101914 subseq 307021 len 1428 csum 0xf1f0], length 1428
10:53:15.475375 IP 112.26.1.1.37753 > 112.26.1.8.37887: Flags [.], seq 307021:308449, ack 1, win 893, options [nop,nop,TS val 151561 ecr 4294904407,mptcp dss ack 2295998090 seq 3914101914 subseq 307021 len 1428 csum 0xf1f0], length 1428
10:53:15.531285 IP 112.26.1.8.37887 > 112.26.1.1.37753: Flags [.], ack 305593, win 24112, options [nop,nop,TS val 4294905090 ecr 151228,mptcp dss ack 3914007666], length 0
10:53:15.584100 IP 112.26.1.1.37753 > 112.26.1.8.37887: Flags [.], seq 308449:309877, ack 1, win 893, options [nop,nop,TS val 151561 ecr 4294904407,mptcp dss ack 2295998090 seq 3914103342 subseq 308449 len 1428 csum 0x834f], length 1428
10:53:15.584406 IP 112.26.1.1.37753 > 112.26.1.8.37887: Flags [.], seq 308449:309877, ack 1, win 893, options [nop,nop,TS val 151561 ecr 4294904407,mptcp dss ack 2295998090 seq 3914103342 subseq 308449 len 1428 csum 0x834f], length 1428
10:53:15.667631 IP 112.26.1.1.37753 > 112.26.1.8.37887: Flags [.], seq 309877:311305, ack 1, win 893, options [nop,nop,TS val 151657 ecr 4294904529,mptcp dss ack 2295998090 seq 3914109054 subseq 309877 len 1428 csum 0xafb5], length 1428
10:53:15.667900 IP 112.26.1.1.37753 > 112.26.1.8.37887: Flags [.], seq 309877:311305, ack 1, win 893, options [nop,nop,TS val 151657 ecr 4294904529,mptcp dss ack 2295998090 seq 3914109054 subseq 309877 len 1428 csum 0xafb5], length 1428
10:53:15.673113 IP 112.26.1.8.37887 > 112.26.1.1.37753: Flags [.], ack 311305, win 24241, options [nop,nop,TS val 4294905565 ecr 151561,mptcp dss ack 3914040510], length 0
10:53:15.675803 IP 112.26.1.8.37887 > 112.26.1.1.37753: Flags [.], ack 311305, win 24241, options [nop,nop,TS val 4294905565 ecr 151561,mptcp dss ack 3914040510], length 0
10:53:15.717351 IP 112.26.1.8.37887 > 112.26.1.1.37753: Flags [.], ack 307021, win 24241, options [nop,nop,TS val 4294905304 ecr 151390,mptcp dss ack 3914040510], length 0
10:53:15.789128 IP 112.26.1.1.37753 > 112.26.1.8.37887: Flags [.], seq 311305:312733, ack 1, win 893, options [nop,nop,TS val 151761 ecr 4294904662,mptcp dss ack 2295998090 seq 3914116194 subseq 311305 len 1428 csum 0x4947], length 1428
10:53:15.789338 IP 112.26.1.1.37753 > 112.26.1.8.37887: Flags [.], seq 311305:312733, ack 1, win 893, options [nop,nop,TS val 151761 ecr 4294904662,mptcp dss ack 2295998090 seq 3914116194 subseq 311305 len 1428 csum 0x4947], length 1428
10:53:15.865328 IP 112.26.1.8.37887 > 112.26.1.1.37753: Flags [.], ack 311305, win 24241, options [nop,nop,TS val 4294905565 ecr 151561,mptcp dss ack 3914040510], length 0
10:53:15.919589 IP 112.26.1.1.37753 > 112.26.1.8.37887: Flags [.], seq 312733:314161, ack 1, win 893, options [nop,nop,TS val 151884 ecr 4294904794,mptcp dss ack 2295998090 seq 3914121906 subseq 312733 len 1428 csum 0xe2a5], length 1428
10:53:15.919900 IP 112.26.1.1.37753 > 112.26.1.8.37887: Flags [.], seq 312733:314161, ack 1, win 893, options [nop,nop,TS val 151884 ecr 4294904794,mptcp dss ack 2295998090 seq 3914121906 subseq 312733 len 1428 csum 0xe2a5], length 1428
10:53:16.032179 IP 112.26.1.1.37753 > 112.26.1.8.37887: Flags [.], seq 314161:315589, ack 1, win 893, options [nop,nop,TS val 152030 ecr 4294904881,mptcp dss ack 2295998090 seq 3914130474 subseq 314161 len 1428 csum 0xde77], length 1428
10:53:16.032513 IP 112.26.1.1.37753 > 112.26.1.8.37887: Flags [.], seq 314161:315589, ack 1, win 893, options [nop,nop,TS val 152030 ecr 4294904881,mptcp dss ack 2295998090 seq 3914130474 subseq 314161 len 1428 csum 0xde77], length 1428
10:53:16.067142 IP 112.26.1.8.37887 > 112.26.1.1.37753: Flags [.], ack 314161, win 23973, options [nop,nop,TS val 4294905890 ecr 151761,mptcp dss ack 3914063358], length 0
10:53:16.069627 IP 112.26.1.8.37887 > 112.26.1.1.37753: Flags [.], ack 314161, win 23973, options [nop,nop,TS val 4294905890 ecr 151761,mptcp dss ack 3914063358], length 0
10:53:16.096607 IP 112.26.1.8.37887 > 112.26.1.1.37753: Flags [.], ack 314161, win 23973, options [nop,nop,TS val 4294905890 ecr 151761,mptcp dss ack 3914063358], length 0
10:53:16.166056 IP 112.26.1.1.37753 > 112.26.1.8.37887: Flags [.], seq 315589:317017, ack 1, win 893, options [nop,nop,TS val 152172 ecr 4294905090,mptcp dss ack 2295998090 seq 3914136186 subseq 315589 len 1428 csum 0x8b6c], length 1428
10:53:16.166305 IP 112.26.1.1.37753 > 112.26.1.8.37887: Flags [.], seq 315589:317017, ack 1, win 893, options [nop,nop,TS val 152172 ecr 4294905090,mptcp dss ack 2295998090 seq 3914136186 subseq 315589 len 1428 csum 0x8b6c], length 1428
10:53:16.179092 IP 112.26.1.8.37887 > 112.26.1.1.37753: Flags [.], ack 317017, win 24224, options [nop,nop,TS val 4294906062 ecr 152030,mptcp dss ack 3914063358], length 0
10:53:16.181901 IP 112.26.1.8.37887 > 112.26.1.1.37753: Flags [.], ack 317017, win 24224, options [nop,nop,TS val 4294906062 ecr 152030,mptcp dss ack 3914063358], length 0
10:53:16.194224 IP 112.26.1.8.37887 > 112.26.1.1.37753: Flags [.], ack 317017, win 24224, options [nop,nop,TS val 4294906062 ecr 152030,mptcp dss ack 3914063358], length 0
10:53:16.298781 IP 112.26.1.1.37753 > 112.26.1.8.37887: Flags [.], seq 317017:318445, ack 1, win 893, options [nop,nop,TS val 152358 ecr 4294905304,mptcp dss ack 2295998090 seq 3914140470 subseq 317017 len 1428 csum 0x96c5], length 1428
10:53:16.299117 IP 112.26.1.1.37753 > 112.26.1.8.37887: Flags [.], seq 317017:318445, ack 1, win 893, options [nop,nop,TS val 152358 ecr 4294905304,mptcp dss ack 2295998090 seq 3914140470 subseq 317017 len 1428 csum 0x96c5], length 1428
10:53:16.423823 IP 112.26.1.1.37753 > 112.26.1.8.37887: Flags [.], seq 318445:319873, ack 1, win 893, options [nop,nop,TS val 152506 ecr 4294905565,mptcp dss ack 2295998090 seq 3914146182 subseq 318445 len 1428 csum 0x8ef3], length 1428
10:53:16.424142 IP 112.26.1.1.37753 > 112.26.1.8.37887: Flags [.], seq 318445:319873, ack 1, win 893, options [nop,nop,TS val 152506 ecr 4294905565,mptcp dss ack 2295998090 seq 3914146182 subseq 318445 len 1428 csum 0x8ef3], length 1428
10:53:16.556491 IP 112.26.1.1.37753 > 112.26.1.8.37887: Flags [.], seq 319873:321301, ack 1, win 893, options [nop,nop,TS val 152506 ecr 4294905565,mptcp dss ack 2295998090 seq 3914147610 subseq 319873 len 1428 csum 0xbbc1], length 1428
10:53:16.556735 IP 112.26.1.1.37753 > 112.26.1.8.37887: Flags [.], seq 319873:321301, ack 1, win 893, options [nop,nop,TS val 152506 ecr 4294905565,mptcp dss ack 2295998090 seq 3914147610 subseq 319873 len 1428 csum 0xbbc1], length 1428
10:53:16.568934 IP 112.26.1.8.37887 > 112.26.1.1.37753: Flags [.], ack 321301, win 24224, options [nop,nop,TS val 4294906456 ecr 152358,mptcp dss ack 3914063358], length 0
10:53:16.575919 IP 112.26.1.8.37887 > 112.26.1.1.37753: Flags [.], ack 321301, win 24224, options [nop,nop,TS val 4294906456 ecr 152358,mptcp dss ack 3914063358], length 0
10:53:16.582866 IP 112.26.1.8.37887 > 112.26.1.1.37753: Flags [.], ack 321301, win 24224, options [nop,nop,TS val 4294906456 ecr 152358,mptcp dss ack 3914063358], length 0
10:53:16.688275 IP 112.26.1.1.37753 > 112.26.1.8.37887: Flags [.], seq 321301:322729, ack 1, win 893, options [nop,nop,TS val 152506 ecr 4294905565,mptcp dss ack 2295998090 seq 3914149038 subseq 321301 len 1428 csum 0x98ee], length 1428
10:53:16.688602 IP 112.26.1.1.37753 > 112.26.1.8.37887: Flags [.], seq 321301:322729, ack 1, win 893, options [nop,nop,TS val 152506 ecr 4294905565,mptcp dss ack 2295998090 seq 3914149038 subseq 321301 len 1428 csum 0x98ee], length 1428
10:53:16.821950 IP 112.26.1.1.37753 > 112.26.1.8.37887: Flags [.], seq 322729:324157, ack 1, win 893, options [nop,nop,TS val 152737 ecr 4294905890,mptcp dss ack 2295998090 seq 3914154750 subseq 322729 len 1428 csum 0xf430], length 1428
10:53:16.822253 IP 112.26.1.1.37753 > 112.26.1.8.37887: Flags [.], seq 322729:324157, ack 1, win 893, options [nop,nop,TS val 152737 ecr 4294905890,mptcp dss ack 2295998090 seq 3914154750 subseq 322729 len 1428 csum 0xf430], length 1428
10:53:16.951307 IP 112.26.1.1.37753 > 112.26.1.8.37887: Flags [.], seq 324157:325585, ack 1, win 893, options [nop,nop,TS val 152737 ecr 4294905890,mptcp dss ack 2295998090 seq 3914156178 subseq 324157 len 1428 csum 0x7198], length 1428
10:53:16.951546 IP 112.26.1.1.37753 > 112.26.1.8.37887: Flags [.], seq 324157:325585, ack 1, win 893, options [nop,nop,TS val 152737 ecr 4294905890,mptcp dss ack 2295998090 seq 3914156178 subseq 324157 len 1428 csum 0x7198], length 1428
10:53:16.952931 IP 112.26.1.8.37887 > 112.26.1.1.37753: Flags [.], ack 324157, win 24033, options [nop,nop,TS val 4294906844 ecr 152506,mptcp dss ack 3914091918], length 0
10:53:16.967556 IP 112.26.1.8.37887 > 112.26.1.1.37753: Flags [.], ack 324157, win 24033, options [nop,nop,TS val 4294906844 ecr 152506,mptcp dss ack 3914091918], length 0
10:53:16.975470 IP 112.26.1.8.37887 > 112.26.1.1.37753: Flags [.], ack 324157, win 24033, options [nop,nop,TS val 4294906844 ecr 152506,mptcp dss ack 3914091918], length 0
10:53:17.073411 IP 112.26.1.1.37753 > 112.26.1.8.37887: Flags [.], seq 325585:327013, ack 1, win 893, options [nop,nop,TS val 152825 ecr 4294906062,mptcp dss ack 2295998090 seq 3914157606 subseq 325585 len 1428 csum 0x239d], length 1428
10:53:17.073758 IP 112.26.1.1.37753 > 112.26.1.8.37887: Flags [.], seq 325585:327013, ack 1, win 893, options [nop,nop,TS val 152825 ecr 4294906062,mptcp dss ack 2295998090 seq 3914157606 subseq 325585 len 1428 csum 0x239d], length 1428
10:53:17.115421 IP 112.26.1.8.37887 > 112.26.1.1.37753: Flags [.], ack 327013, win 24216, options [nop,nop,TS val 4294907007 ecr 152737,mptcp dss ack 3914106198], length 0
10:53:17.117949 IP 112.26.1.8.37887 > 112.26.1.1.37753: Flags [.], ack 327013, win 24216, options [nop,nop,TS val 4294907007 ecr 152737,mptcp dss ack 3914106198], length 0
10:53:17.124301 IP 112.26.1.8.37887 > 112.26.1.1.37753: Flags [.], ack 327013, win 24216, options [nop,nop,TS val 4294907007 ecr 152737,mptcp dss ack 3914106198], length 0
10:53:17.207288 IP 112.26.1.1.37753 > 112.26.1.8.37887: Flags [.], seq 327013:328441, ack 1, win 893, options [nop,nop,TS val 152825 ecr 4294906062,mptcp dss ack 2295998090 seq 3914159034 subseq 327013 len 1428 csum 0x58e4], length 1428
10:53:17.207618 IP 112.26.1.1.37753 > 112.26.1.8.37887: Flags [.], seq 327013:328441, ack 1, win 893, options [nop,nop,TS val 152825 ecr 4294906062,mptcp dss ack 2295998090 seq 3914159034 subseq 327013 len 1428 csum 0x58e4], length 1428
10:53:17.296377 IP 112.26.1.1.37753 > 112.26.1.8.37887: Flags [.], seq 328441:329869, ack 1, win 893, options [nop,nop,TS val 153223 ecr 4294906456,mptcp dss ack 2295998090 seq 3914169030 subseq 328441 len 1428 csum 0x3b82], length 1428
10:53:17.296686 IP 112.26.1.1.37753 > 112.26.1.8.37887: Flags [.], seq 328441:329869, ack 1, win 893, options [nop,nop,TS val 153223 ecr 4294906456,mptcp dss ack 2295998090 seq 3914169030 subseq 328441 len 1428 csum 0x3b82], length 1428
10:53:17.424947 IP 112.26.1.1.37753 > 112.26.1.8.37887: Flags [.], seq 329869:331297, ack 1, win 893, options [nop,nop,TS val 153223 ecr 4294906456,mptcp dss ack 2295998090 seq 3914170458 subseq 329869 len 1428 csum 0x4182], length 1428
10:53:17.425272 IP 112.26.1.1.37753 > 112.26.1.8.37887: Flags [.], seq 329869:331297, ack 1, win 893, options [nop,nop,TS val 153223 ecr 4294906456,mptcp dss ack 2295998090 seq 3914170458 subseq 329869 len 1428 csum 0x4182], length 1428
10:53:17.509199 IP 112.26.1.1.37753 > 112.26.1.8.37887: Flags [.], seq 331297:332725, ack 1, win 893, options [nop,nop,TS val 153223 ecr 4294906456,mptcp dss ack 2295998090 seq 3914171886 subseq 331297 len 1428 csum 0xf905], length 1428
10:53:17.509481 IP 112.26.1.1.37753 > 112.26.1.8.37887: Flags [.], seq 331297:332725, ack 1, win 893, options [nop,nop,TS val 153223 ecr 4294906456,mptcp dss ack 2295998090 seq 3914171886 subseq 331297 len 1428 csum 0xf905], length 1428
10:53:17.528927 IP 112.26.1.8.37887 > 112.26.1.1.37753: Flags [.], ack 331297, win 24216, options [nop,nop,TS val 4294907416 ecr 152825,mptcp dss ack 3914106198], length 0
10:53:17.529904 IP 112.26.1.8.37887 > 112.26.1.1.37753: Flags [.], ack 331297, win 24216, options [nop,nop,TS val 4294907416 ecr 152825,mptcp dss ack 3914106198], length 0
10:53:17.533026 IP 112.26.1.8.37887 > 112.26.1.1.37753: Flags [.], ack 331297, win 24216, options [nop,nop,TS val 4294907416 ecr 152825,mptcp dss ack 3914106198], length 0
10:53:17.568535 IP 112.26.1.1.37753 > 112.26.1.8.37887: Flags [.], seq 332725:334153, ack 1, win 893, options [nop,nop,TS val 153223 ecr 4294906456,mptcp dss ack 2295998090 seq 3914173314 subseq 332725 len 1428 csum 0xcb79], length 1428
10:53:17.568843 IP 112.26.1.1.37753 > 112.26.1.8.37887: Flags [.], seq 332725:334153, ack 1, win 893, options [nop,nop,TS val 153223 ecr 4294906456,mptcp dss ack 2295998090 seq 3914173314 subseq 332725 len 1428 csum 0xcb79], length 1428
10:53:17.663082 IP 112.26.1.1.37753 > 112.26.1.8.37887: Flags [.], seq 334153:335581, ack 1, win 893, options [nop,nop,TS val 153614 ecr 4294906844,mptcp dss ack 2295998090 seq 3914186166 subseq 334153 len 1428 csum 0x79b4], length 1428
10:53:17.663369 IP 112.26.1.1.37753 > 112.26.1.8.37887: Flags [.], seq 334153:335581, ack 1, win 893, options [nop,nop,TS val 153614 ecr 4294906844,mptcp dss ack 2295998090 seq 3914186166 subseq 334153 len 1428 csum 0x79b4], length 1428
10:53:17.787086 IP 112.26.1.1.37753 > 112.26.1.8.37887: Flags [.], seq 335581:337009, ack 1, win 893, options [nop,nop,TS val 153614 ecr 4294906844,mptcp dss ack 2295998090 seq 3914187594 subseq 335581 len 1428 csum 0x2953], length 1428
10:53:17.787389 IP 112.26.1.1.37753 > 112.26.1.8.37887: Flags [.], seq 335581:337009, ack 1, win 893, options [nop,nop,TS val 153614 ecr 4294906844,mptcp dss ack 2295998090 seq 3914187594 subseq 335581 len 1428 csum 0x2953], length 1428
10:53:17.914177 IP 112.26.1.1.37753 > 112.26.1.8.37887: Flags [.], seq 337009:338437, ack 1, win 893, options [nop,nop,TS val 153614 ecr 4294906844,mptcp dss ack 2295998090 seq 3914189022 subseq 337009 len 1428 csum 0x4088], length 1428
10:53:17.914485 IP 112.26.1.1.37753 > 112.26.1.8.37887: Flags [.], seq 337009:338437, ack 1, win 893, options [nop,nop,TS val 153614 ecr 4294906844,mptcp dss ack 2295998090 seq 3914189022 subseq 337009 len 1428 csum 0x4088], length 1428
10:53:17.918748 IP 112.26.1.8.37887 > 112.26.1.1.37753: Flags [.], ack 338437, win 24216, options [nop,nop,TS val 4294907810 ecr 153223,mptcp dss ack 3914106198], length 0
10:53:17.926778 IP 112.26.1.8.37887 > 112.26.1.1.37753: Flags [.], ack 338437, win 24216, options [nop,nop,TS val 4294907810 ecr 153223,mptcp dss ack 3914106198], length 0
10:53:17.929956 IP 112.26.1.8.37887 > 112.26.1.1.37753: Flags [.], ack 338437, win 24216, options [nop,nop,TS val 4294907810 ecr 153223,mptcp dss ack 3914106198], length 0
10:53:18.070563 IP 112.26.1.1.37753 > 112.26.1.8.37887: Flags [.], seq 338437:339865, ack 1, win 893, options [nop,nop,TS val 153764 ecr 4294907007,mptcp dss ack 2295998090 seq 3914194734 subseq 338437 len 1428 csum 0x801c], length 1428
10:53:18.070824 IP 112.26.1.1.37753 > 112.26.1.8.37887: Flags [.], seq 338437:339865, ack 1, win 893, options [nop,nop,TS val 153764 ecr 4294907007,mptcp dss ack 2295998090 seq 3914194734 subseq 338437 len 1428 csum 0x801c], length 1428
10:53:18.224527 IP 112.26.1.1.37753 > 112.26.1.8.37887: Flags [.], seq 339865:341293, ack 1, win 893, options [nop,nop,TS val 153764 ecr 4294907007,mptcp dss ack 2295998090 seq 3914196162 subseq 339865 len 1428 csum 0xb592], length 1428
10:53:18.224730 IP 112.26.1.1.37753 > 112.26.1.8.37887: Flags [.], seq 339865:341293, ack 1, win 893, options [nop,nop,TS val 153764 ecr 4294907007,mptcp dss ack 2295998090 seq 3914196162 subseq 339865 len 1428 csum 0xb592], length 1428
10:53:18.323678 IP 112.26.1.8.37887 > 112.26.1.1.37753: Flags [.], ack 341293, win 24295, options [nop,nop,TS val 4294908216 ecr 153764,mptcp dss ack 3914167602], length 0
10:53:18.325455 IP 112.26.1.8.37887 > 112.26.1.1.37753: Flags [.], ack 341293, win 24295, options [nop,nop,TS val 4294908216 ecr 153764,mptcp dss ack 3914167602], length 0
10:53:18.332142 IP 112.26.1.8.37887 > 112.26.1.1.37753: Flags [.], ack 341293, win 24295, options [nop,nop,TS val 4294908216 ecr 153764,mptcp dss ack 3914167602], length 0
10:53:18.372519 IP 112.26.1.1.37753 > 112.26.1.8.37887: Flags [.], seq 341293:342721, ack 1, win 893, options [nop,nop,TS val 154173 ecr 4294907416,mptcp dss ack 2295998090 seq 3914209014 subseq 341293 len 1428 csum 0x2189], length 1428
10:53:18.372862 IP 112.26.1.1.37753 > 112.26.1.8.37887: Flags [.], seq 341293:342721, ack 1, win 893, options [nop,nop,TS val 154173 ecr 4294907416,mptcp dss ack 2295998090 seq 3914209014 subseq 341293 len 1428 csum 0x2189], length 1428
10:53:18.491962 IP 112.26.1.1.37753 > 112.26.1.8.37887: Flags [.], seq 342721:344149, ack 1, win 893, options [nop,nop,TS val 154173 ecr 4294907416,mptcp dss ack 2295998090 seq 3914210442 subseq 342721 len 1428 csum 0x121e], length 1428
10:53:18.492274 IP 112.26.1.1.37753 > 112.26.1.8.37887: Flags [.], seq 342721:344149, ack 1, win 893, options [nop,nop,TS val 154173 ecr 4294907416,mptcp dss ack 2295998090 seq 3914210442 subseq 342721 len 1428 csum 0x121e], length 1428
10:53:18.513946 IP 112.26.1.8.37887 > 112.26.1.1.37753: Flags [.], ack 344149, win 24003, options [nop,nop,TS val 4294908403 ecr 154173,mptcp dss ack 3914211870], length 0
10:53:18.517081 IP 112.26.1.8.37887 > 112.26.1.1.37753: Flags [.], ack 344149, win 24003, options [nop,nop,TS val 4294908403 ecr 154173,mptcp dss ack 3914211870], length 0
10:53:18.524430 IP 112.26.1.8.37887 > 112.26.1.1.37753: Flags [.], ack 344149, win 24003, options [nop,nop,TS val 4294908403 ecr 154173,mptcp dss ack 3914211870], length 0
10:53:18.573101 IP 112.26.1.1.37753 > 112.26.1.8.37887: Flags [.], seq 344149:345577, ack 1, win 893, options [nop,nop,TS val 154173 ecr 4294907416,mptcp dss ack 2295998090 seq 3914211870 subseq 344149 len 1428 csum 0xa649], length 1428
10:53:18.573419 IP 112.26.1.1.37753 > 112.26.1.8.37887: Flags [.], seq 344149:345577, ack 1, win 893, options [nop,nop,TS val 154173 ecr 4294907416,mptcp dss ack 2295998090 seq 3914211870 subseq 344149 len 1428 csum 0xa649], length 1428
10:53:18.733793 IP 112.26.1.1.37753 > 112.26.1.8.37887: Flags [.], seq 347005:348433, ack 1, win 893, options [nop,nop,TS val 154173 ecr 4294907416,mptcp dss ack 2295998090 seq 3914214726 subseq 347005 len 1428 csum 0x5bf6], length 1428
10:53:18.734046 IP 112.26.1.1.37753 > 112.26.1.8.37887: Flags [.], seq 347005:348433, ack 1, win 893, options [nop,nop,TS val 154173 ecr 4294907416,mptcp dss ack 2295998090 seq 3914214726 subseq 347005 len 1428 csum 0x5bf6], length 1428
10:53:18.746101 IP 112.26.1.8.37887 > 112.26.1.1.37753: Flags [.], ack 345577, win 24467, options [nop,nop,TS val 4294908631 ecr 154173,nop,nop,sack 1 {347005:348433},mptcp dss ack 3914213298], length 0
10:53:18.748057 IP 112.26.1.8.37887 > 112.26.1.1.37753: Flags [.], ack 345577, win 24467, options [nop,nop,TS val 4294908631 ecr 154173,nop,nop,sack 1 {347005:348433},mptcp dss ack 3914213298], length 0
10:53:18.755164 IP 112.26.1.8.37887 > 112.26.1.1.37753: Flags [.], ack 345577, win 24467, options [nop,nop,TS val 4294908631 ecr 154173,nop,nop,sack 1 {347005:348433},mptcp dss ack 3914213298], length 0
10:53:18.871206 IP 112.26.1.1.37753 > 112.26.1.8.37887: Flags [.], seq 348433:349861, ack 1, win 893, options [nop,nop,TS val 154570 ecr 4294907810,mptcp dss ack 2295998090 seq 3914221866 subseq 348433 len 1428 csum 0xc17b], length 1428
10:53:18.871490 IP 112.26.1.1.37753 > 112.26.1.8.37887: Flags [.], seq 348433:349861, ack 1, win 893, options [nop,nop,TS val 154570 ecr 4294907810,mptcp dss ack 2295998090 seq 3914221866 subseq 348433 len 1428 csum 0xc17b], length 1428
10:53:18.900016 IP 112.26.1.8.37887 > 112.26.1.1.37753: Flags [.], ack 345577, win 24467, options [nop,nop,TS val 4294908768 ecr 154173,nop,nop,sack 1 {347005:349861},mptcp dss ack 3914213298], length 0
10:53:18.909482 IP 112.26.1.8.37887 > 112.26.1.1.37753: Flags [.], ack 345577, win 24467, options [nop,nop,TS val 4294908768 ecr 154173,nop,nop,sack 1 {347005:349861},mptcp dss ack 3914213298], length 0
10:53:18.925615 IP 112.26.1.8.37887 > 112.26.1.1.37753: Flags [.], ack 345577, win 24467, options [nop,nop,TS val 4294908768 ecr 154173,nop,nop,sack 1 {347005:349861},mptcp dss ack 3914213298], length 0
10:53:19.038079 IP 112.26.1.1.37753 > 112.26.1.8.37887: Flags [.], seq 349861:351289, ack 1, win 893, options [nop,nop,TS val 154570 ecr 4294907810,mptcp dss ack 2295998090 seq 3914223294 subseq 349861 len 1428 csum 0xaf8a], length 1428
10:53:19.038315 IP 112.26.1.1.37753 > 112.26.1.8.37887: Flags [.], seq 349861:351289, ack 1, win 893, options [nop,nop,TS val 154570 ecr 4294907810,mptcp dss ack 2295998090 seq 3914223294 subseq 349861 len 1428 csum 0xaf8a], length 1428
10:53:19.045232 IP 112.26.1.8.37887 > 112.26.1.1.37753: Flags [.], ack 345577, win 24467, options [nop,nop,TS val 4294908934 ecr 154173,nop,nop,sack 1 {347005:351289},mptcp dss ack 3914213298], length 0
10:53:19.048482 IP 112.26.1.8.37887 > 112.26.1.1.37753: Flags [.], ack 345577, win 24467, options [nop,nop,TS val 4294908934 ecr 154173,nop,nop,sack 1 {347005:351289},mptcp dss ack 3914213298], length 0
10:53:19.121886 IP 112.26.1.8.37887 > 112.26.1.1.37753: Flags [.], ack 345577, win 24467, options [nop,nop,TS val 4294908934 ecr 154173,nop,nop,sack 1 {347005:351289},mptcp dss ack 3914213298], length 0
10:53:19.153099 IP 112.26.1.1.37753 > 112.26.1.8.37887: Flags [.], seq 351289:352717, ack 1, win 893, options [nop,nop,TS val 154570 ecr 4294907810,mptcp dss ack 2295998090 seq 3914224722 subseq 351289 len 1428 csum 0x848f], length 1428
10:53:19.153373 IP 112.26.1.1.37753 > 112.26.1.8.37887: Flags [.], seq 351289:352717, ack 1, win 893, options [nop,nop,TS val 154570 ecr 4294907810,mptcp dss ack 2295998090 seq 3914224722 subseq 351289 len 1428 csum 0x848f], length 1428
10:53:19.175430 IP 112.26.1.8.37887 > 112.26.1.1.37753: Flags [.], ack 345577, win 24467, options [nop,nop,TS val 4294909061 ecr 154173,nop,nop,sack 1 {347005:352717},mptcp dss ack 3914213298], length 0
10:53:19.259224 IP 112.26.1.8.37887 > 112.26.1.1.37753: Flags [.], ack 345577, win 24467, options [nop,nop,TS val 4294909061 ecr 154173,nop,nop,sack 1 {347005:352717},mptcp dss ack 3914213298], length 0
10:53:19.304897 IP 112.26.1.8.37887 > 112.26.1.1.37753: Flags [.], ack 345577, win 24467, options [nop,nop,TS val 4294909061 ecr 154173,nop,nop,sack 1 {347005:352717},mptcp dss ack 3914213298], length 0
10:53:19.369783 IP 112.26.1.1.37753 > 112.26.1.8.37887: Flags [.], seq 355573:357001, ack 1, win 893, options [nop,nop,TS val 154973 ecr 4294908216,mptcp dss ack 2295998090 seq 3914246142 subseq 355573 len 1428 csum 0x5159], length 1428
10:53:19.370077 IP 112.26.1.1.37753 > 112.26.1.8.37887: Flags [.], seq 355573:357001, ack 1, win 893, options [nop,nop,TS val 154973 ecr 4294908216,mptcp dss ack 2295998090 seq 3914246142 subseq 355573 len 1428 csum 0x5159], length 1428
10:53:19.379590 IP 112.26.1.8.37887 > 112.26.1.1.37753: Flags [.], ack 345577, win 24467, options [nop,nop,TS val 4294909267 ecr 154173,nop,nop,sack 2 {355573:357001}{347005:352717},mptcp dss ack 3914213298], length 0
10:53:19.380855 IP 112.26.1.8.37887 > 112.26.1.1.37753: Flags [.], ack 345577, win 24467, options [nop,nop,TS val 4294909267 ecr 154173,nop,nop,sack 2 {355573:357001}{347005:352717},mptcp dss ack 3914213298], length 0
10:53:19.448375 IP 112.26.1.8.37887 > 112.26.1.1.37753: Flags [.], ack 345577, win 24467, options [nop,nop,TS val 4294909267 ecr 154173,nop,nop,sack 2 {355573:357001}{347005:352717},mptcp dss ack 3914213298], length 0
10:53:19.476215 IP 112.26.1.1.37753 > 112.26.1.8.37887: Flags [.], seq 357001:358429, ack 1, win 893, options [nop,nop,TS val 154973 ecr 4294908216,mptcp dss ack 2295998090 seq 3914247570 subseq 357001 len 1428 csum 0x2342], length 1428
10:53:19.476473 IP 112.26.1.1.37753 > 112.26.1.8.37887: Flags [.], seq 357001:358429, ack 1, win 893, options [nop,nop,TS val 154973 ecr 4294908216,mptcp dss ack 2295998090 seq 3914247570 subseq 357001 len 1428 csum 0x2342], length 1428
10:53:19.520353 IP 112.26.1.8.37887 > 112.26.1.1.37753: Flags [.], ack 345577, win 24467, options [nop,nop,TS val 4294909406 ecr 154173,nop,nop,sack 2 {355573:358429}{347005:352717},mptcp dss ack 3914213298], length 0
10:53:19.539101 IP 112.26.1.8.37887 > 112.26.1.1.37753: Flags [.], ack 345577, win 24467, options [nop,nop,TS val 4294909406 ecr 154173,nop,nop,sack 2 {355573:358429}{347005:352717},mptcp dss ack 3914213298], length 0
10:53:19.579082 IP 112.26.1.8.37887 > 112.26.1.1.37753: Flags [.], ack 345577, win 24467, options [nop,nop,TS val 4294909406 ecr 154173,nop,nop,sack 2 {355573:358429}{347005:352717},mptcp dss ack 3914213298], length 0
10:53:19.624028 IP 112.26.1.1.37753 > 112.26.1.8.37887: Flags [.], seq 358429:359857, ack 1, win 893, options [nop,nop,TS val 155165 ecr 4294908403,mptcp dss ack 2295998090 seq 3914254710 subseq 358429 len 1428 csum 0x5a6a], length 1428
10:53:19.624261 IP 112.26.1.1.37753 > 112.26.1.8.37887: Flags [.], seq 358429:359857, ack 1, win 893, options [nop,nop,TS val 155165 ecr 4294908403,mptcp dss ack 2295998090 seq 3914254710 subseq 358429 len 1428 csum 0x5a6a], length 1428
10:53:19.632743 IP 112.26.1.8.37887 > 112.26.1.1.37753: Flags [.], ack 345577, win 24467, options [nop,nop,TS val 4294909522 ecr 154173,nop,nop,sack 2 {355573:359857}{347005:352717},mptcp dss ack 3914213298], length 0
10:53:19.672545 IP 112.26.1.8.37887 > 112.26.1.1.37753: Flags [.], ack 345577, win 24467, options [nop,nop,TS val 4294909522 ecr 154173,nop,nop,sack 2 {355573:359857}{347005:352717},mptcp dss ack 3914213298], length 0
10:53:19.698616 IP 112.26.1.1.37753 > 112.26.1.8.37887: Flags [.], seq 359857:361285, ack 1, win 893, options [nop,nop,TS val 155165 ecr 4294908403,mptcp dss ack 2295998090 seq 3914256138 subseq 359857 len 1428 csum 0x57b9], length 1428
10:53:19.698939 IP 112.26.1.1.37753 > 112.26.1.8.37887: Flags [.], seq 359857:361285, ack 1, win 893, options [nop,nop,TS val 155165 ecr 4294908403,mptcp dss ack 2295998090 seq 3914256138 subseq 359857 len 1428 csum 0x57b9], length 1428
10:53:19.726075 IP 112.26.1.8.37887 > 112.26.1.1.37753: Flags [.], ack 345577, win 24467, options [nop,nop,TS val 4294909522 ecr 154173,nop,nop,sack 2 {355573:359857}{347005:352717},mptcp dss ack 3914213298], length 0
10:53:19.779125 IP 112.26.1.8.37887 > 112.26.1.1.37753: Flags [.], ack 345577, win 24467, options [nop,nop,TS val 4294909668 ecr 154173,nop,nop,sack 2 {355573:361285}{347005:352717},mptcp dss ack 3914213298], length 0
10:53:19.782659 IP 112.26.1.8.37887 > 112.26.1.1.37753: Flags [.], ack 345577, win 24467, options [nop,nop,TS val 4294909668 ecr 154173,nop,nop,sack 2 {355573:361285}{347005:352717},mptcp dss ack 3914213298], length 0
10:53:19.854090 IP 112.26.1.1.37753 > 112.26.1.8.37887: Flags [.], seq 361285:362713, ack 1, win 893, options [nop,nop,TS val 155165 ecr 4294908403,mptcp dss ack 2295998090 seq 3914257566 subseq 361285 len 1428 csum 0x880], length 1428
10:53:19.854408 IP 112.26.1.1.37753 > 112.26.1.8.37887: Flags [.], seq 361285:362713, ack 1, win 893, options [nop,nop,TS val 155165 ecr 4294908403,mptcp dss ack 2295998090 seq 3914257566 subseq 361285 len 1428 csum 0x880], length 1428
10:53:19.881032 IP 112.26.1.8.37887 > 112.26.1.1.37753: Flags [.], ack 345577, win 24467, options [nop,nop,TS val 4294909773 ecr 154173,nop,nop,sack 2 {355573:362713}{347005:352717},mptcp dss ack 3914213298], length 0
10:53:19.895280 IP 112.26.1.8.37887 > 112.26.1.1.37753: Flags [.], ack 345577, win 24467, options [nop,nop,TS val 4294909668 ecr 154173,nop,nop,sack 2 {355573:361285}{347005:352717},mptcp dss ack 3914213298], length 0
10:53:19.929550 IP 112.26.1.8.37887 > 112.26.1.1.37753: Flags [.], ack 345577, win 24467, options [nop,nop,TS val 4294909773 ecr 154173,nop,nop,sack 2 {355573:362713}{347005:352717},mptcp dss ack 3914213298], length 0
10:53:19.951317 IP 112.26.1.8.37887 > 112.26.1.1.37753: Flags [.], ack 345577, win 24467, options [nop,nop,TS val 4294909773 ecr 154173,nop,nop,sack 2 {355573:362713}{347005:352717},mptcp dss ack 3914213298], length 0
10:53:19.973080 IP 112.26.1.1.37753 > 112.26.1.8.37887: Flags [.], seq 362713:364141, ack 1, win 893, options [nop,nop,TS val 155396 ecr 4294908631,mptcp dss ack 2295998090 seq 3914270418 subseq 362713 len 1428 csum 0x9e48], length 1428
10:53:19.973319 IP 112.26.1.1.37753 > 112.26.1.8.37887: Flags [.], seq 362713:364141, ack 1, win 893, options [nop,nop,TS val 155396 ecr 4294908631,mptcp dss ack 2295998090 seq 3914270418 subseq 362713 len 1428 csum 0x9e48], length 1428
10:53:19.996955 IP 112.26.1.8.37887 > 112.26.1.1.37753: Flags [.], ack 345577, win 24467, options [nop,nop,TS val 4294909889 ecr 154173,nop,nop,sack 2 {355573:364141}{347005:352717},mptcp dss ack 3914213298], length 0
10:53:20.096268 IP 112.26.1.8.37887 > 112.26.1.1.37753: Flags [.], ack 345577, win 24467, options [nop,nop,TS val 4294909889 ecr 154173,nop,nop,sack 2 {355573:364141}{347005:352717},mptcp dss ack 3914213298], length 0
10:53:20.101560 IP 112.26.1.8.37887 > 112.26.1.1.37753: Flags [.], ack 345577, win 24467, options [nop,nop,TS val 4294909889 ecr 154173,nop,nop,sack 2 {355573:364141}{347005:352717},mptcp dss ack 3914213298], length 0
10:53:20.161498 IP 112.26.1.1.37753 > 112.26.1.8.37887: Flags [.], seq 365569:366997, ack 1, win 893, options [nop,nop,TS val 155396 ecr 4294908631,mptcp dss ack 2295998090 seq 3914273274 subseq 365569 len 1428 csum 0x8ba5], length 1428
10:53:20.161811 IP 112.26.1.1.37753 > 112.26.1.8.37887: Flags [.], seq 365569:366997, ack 1, win 893, options [nop,nop,TS val 155396 ecr 4294908631,mptcp dss ack 2295998090 seq 3914273274 subseq 365569 len 1428 csum 0x8ba5], length 1428
10:53:20.169041 IP 112.26.1.8.37887 > 112.26.1.1.37753: Flags [.], ack 345577, win 24467, options [nop,nop,TS val 4294910060 ecr 154173,nop,nop,sack 2 {365569:366997}{355573:364141},mptcp dss ack 3914213298], length 0
10:53:20.290616 IP 112.26.1.8.37887 > 112.26.1.1.37753: Flags [.], ack 345577, win 24467, options [nop,nop,TS val 4294910060 ecr 154173,nop,nop,sack 2 {365569:366997}{355573:364141},mptcp dss ack 3914213298], length 0
10:53:20.320028 IP 112.26.1.1.37753 > 112.26.1.8.37887: Flags [.], seq 366997:368425, ack 1, win 893, options [nop,nop,TS val 155578 ecr 4294908768,mptcp dss ack 2295998090 seq 3914280414 subseq 366997 len 1428 csum 0xd6a], length 1428
10:53:20.320331 IP 112.26.1.1.37753 > 112.26.1.8.37887: Flags [.], seq 366997:368425, ack 1, win 893, options [nop,nop,TS val 155578 ecr 4294908768,mptcp dss ack 2295998090 seq 3914280414 subseq 366997 len 1428 csum 0xd6a], length 1428
10:53:20.330821 IP 112.26.1.8.37887 > 112.26.1.1.37753: Flags [.], ack 345577, win 24467, options [nop,nop,TS val 4294910223 ecr 154173,nop,nop,sack 2 {365569:368425}{355573:364141},mptcp dss ack 3914213298], length 0
10:53:20.357884 IP 112.26.1.8.37887 > 112.26.1.1.37753: Flags [.], ack 345577, win 24467, options [nop,nop,TS val 4294910223 ecr 154173,nop,nop,sack 2 {365569:368425}{355573:364141},mptcp dss ack 3914213298], length 0
10:53:20.386859 IP 112.26.1.8.37887 > 112.26.1.1.37753: Flags [.], ack 345577, win 24467, options [nop,nop,TS val 4294910060 ecr 154173,nop,nop,sack 2 {365569:366997}{355573:364141},mptcp dss ack 3914213298], length 0
10:53:20.428822 IP 112.26.1.1.37753 > 112.26.1.8.37887: Flags [.], seq 345577:347005, ack 1, win 893, options [nop,nop,TS val 155762 ecr 4294908934,mptcp dss ack 2295998090 seq 3914213298 subseq 345577 len 1428 csum 0x8133], length 1428
10:53:20.429146 IP 112.26.1.1.37753 > 112.26.1.8.37887: Flags [.], seq 345577:347005, ack 1, win 893, options [nop,nop,TS val 155762 ecr 4294908934,mptcp dss ack 2295998090 seq 3914213298 subseq 345577 len 1428 csum 0x8133], length 1428
10:53:20.463484 IP 112.26.1.8.37887 > 112.26.1.1.37753: Flags [.], ack 352717, win 24267, options [nop,nop,TS val 4294910352 ecr 155762,nop,nop,sack 2 {365569:368425}{355573:364141},mptcp dss ack 3914226150], length 0
10:53:20.516540 IP 112.26.1.8.37887 > 112.26.1.1.37753: Flags [.], ack 352717, win 24267, options [nop,nop,TS val 4294910352 ecr 155762,nop,nop,sack 2 {365569:368425}{355573:364141},mptcp dss ack 3914226150], length 0
10:53:20.547684 IP 112.26.1.8.37887 > 112.26.1.1.37753: Flags [.], ack 345577, win 24467, options [nop,nop,TS val 4294910223 ecr 154173,nop,nop,sack 2 {365569:368425}{355573:364141},mptcp dss ack 3914213298], length 0
