10:52:44.097627 IP 112.26.3.8.41425 > 112.26.3.1.37753: Flags [S], seq 2395078999, win 65535, options [mss 1460,sackOK,TS val 4294873967 ecr 0,nop,wscale 6,mptcp join id 5 token 0xd15e4cde nonce 0x2a8bb6e7], length 0
10:52:44.143287 IP 112.26.3.8.41425 > 112.26.3.1.37753: Flags [S], seq 2395078999, win 65535, options [mss 1460,sackOK,TS val 4294873967 ecr 0,nop,wscale 6,mptcp join id 5 token 0xd15e4cde nonce 0x2a8bb6e7], length 0
10:52:44.206486 IP 112.26.3.8.41425 > 112.26.3.1.37753: Flags [S], seq 2395078999, win 65535, options [mss 1460,sackOK,TS val 4294873967 ecr 0,nop,wscale 6,mptcp join id 5 token 0xd15e4cde nonce 0x2a8bb6e7], length 0
10:52:44.377301 IP 112.26.3.1.37753 > 112.26.3.8.41425: Flags [S.], seq 2893757763, ack 2395079000, win 28560, options [mss 1460,sackOK,TS val 120848 ecr 4294873967,nop,wscale 7,mptcp join id 5 hmac 0x81ff6e68fa33c134 nonce 0x1be19e41], length 0
10:52:44.452194 IP 112.26.3.1.37753 > 112.26.3.8.41425: Flags [S.], seq 2893757763, ack 2395079000, win 28560, options [mss 1460,sackOK,TS val 120848 ecr 4294873967,nop,wscale 7,mptcp join id 5 hmac 0x81ff6e68fa33c134 nonce 0x1be19e41], length 0
10:52:44.545737 IP 112.26.3.8.41425 > 112.26.3.1.37753: Flags [.], ack 1, win 7027, options [nop,nop,TS val 4294874346 ecr 120848,mptcp join hmac 0x8ee215a13a2dbfbe7ea6ce9b5e39c59ddf8153af], length 0
10:52:44.545977 IP 112.26.3.8.41425 > 112.26.3.1.37753: Flags [.], ack 1, win 7027, options [nop,nop,TS val 4294874346 ecr 120848,mptcp join hmac 0x8ee215a13a2dbfbe7ea6ce9b5e39c59ddf8153af], length 0
10:53:19.818210 IP 112.26.3.1.37753 > 112.26.3.8.41425: Flags [.], seq 369853:371281, ack 1, win 893, options [nop,nop,TS val 156012 ecr 4294909198,mptcp dss ack 2295998090 seq 3914251854 subseq 369853 len 1428 csum 0xc94c], length 1428
10:53:19.850216 IP 112.26.3.1.37753 > 112.26.3.8.41425: Flags [.], seq 369853:371281, ack 1, win 893, options [nop,nop,TS val 156012 ecr 4294909198,mptcp dss ack 2295998090 seq 3914251854 subseq 369853 len 1428 csum 0xc94c], length 1428
10:53:19.852736 IP 112.26.3.8.41425 > 112.26.3.1.37753: Flags [.], ack 374137, win 24467, options [nop,nop,TS val 4294909744 ecr 156012,nop,nop,sack 1 {375565:381277},mptcp dss ack 3914213298], length 0
10:53:19.852913 IP 112.26.3.8.41425 > 112.26.3.1.37753: Flags [.], ack 374137, win 24467, options [nop,nop,TS val 4294909744 ecr 156012,nop,nop,sack 1 {375565:381277},mptcp dss ack 3914213298], length 0
10:53:19.894221 IP 112.26.3.8.41425 > 112.26.3.1.37753: Flags [.], ack 374137, win 24467, options [nop,nop,TS val 4294909744 ecr 156012,nop,nop,sack 1 {375565:381277},mptcp dss ack 3914213298], length 0
10:53:19.965809 IP 112.26.3.1.37753 > 112.26.3.8.41425: Flags [.], seq 374137:375565, ack 1, win 893, options [nop,nop,TS val 156122 ecr 4294909356,mptcp dss ack 2295998090 seq 3914274702 subseq 374137 len 1428 csum 0xe686], length 1428
10:53:19.968092 IP 112.26.3.1.37753 > 112.26.3.8.41425: Flags [.], seq 374137:375565, ack 1, win 893, options [nop,nop,TS val 156122 ecr 4294909356,mptcp dss ack 2295998090 seq 3914274702 subseq 374137 len 1428 csum 0xe686], length 1428
10:53:19.985076 IP 112.26.3.8.41425 > 112.26.3.1.37753: Flags [.], ack 381277, win 24467, options [nop,nop,TS val 4294909862 ecr 156122,mptcp dss ack 3914213298], length 0
10:53:19.985282 IP 112.26.3.8.41425 > 112.26.3.1.37753: Flags [.], ack 381277, win 24467, options [nop,nop,TS val 4294909862 ecr 156122,mptcp dss ack 3914213298], length 0
10:53:20.011126 IP 112.26.3.8.41425 > 112.26.3.1.37753: Flags [.], ack 381277, win 24467, options [nop,nop,TS val 4294909862 ecr 156122,mptcp dss ack 3914213298], length 0
10:53:20.109688 IP 112.26.3.1.37753 > 112.26.3.8.41425: Flags [.], seq 381277:382705, ack 1, win 893, options [nop,nop,TS val 156287 ecr 4294909462,mptcp dss ack 2295998090 seq 3914297550 subseq 381277 len 1428 csum 0xb9c7], length 1428
10:53:20.119336 IP 112.26.3.8.41425 > 112.26.3.1.37753: Flags [.], ack 382705, win 24467, options [nop,nop,TS val 4294910003 ecr 156287,mptcp dss ack 3914213298], length 0
10:53:20.119535 IP 112.26.3.8.41425 > 112.26.3.1.37753: Flags [.], ack 382705, win 24467, options [nop,nop,TS val 4294910003 ecr 156287,mptcp dss ack 3914213298], length 0
10:53:20.124394 IP 112.26.3.1.37753 > 112.26.3.8.41425: Flags [.], seq 381277:382705, ack 1, win 893, options [nop,nop,TS val 156287 ecr 4294909462,mptcp dss ack 2295998090 seq 3914297550 subseq 381277 len 1428 csum 0xb9c7], length 1428
10:53:20.139014 IP 112.26.3.8.41425 > 112.26.3.1.37753: Flags [.], ack 382705, win 24467, options [nop,nop,TS val 4294910003 ecr 156287,mptcp dss ack 3914213298], length 0
10:53:20.176654 IP 112.26.3.1.37753 > 112.26.3.8.41425: Flags [.], seq 382705:384133, ack 1, win 893, options [nop,nop,TS val 156404 ecr 4294909613,mptcp dss ack 2295998090 seq 3914301834 subseq 382705 len 1428 csum 0x1fef], length 1428
10:53:20.266844 IP 112.26.3.1.37753 > 112.26.3.8.41425: Flags [.], seq 382705:384133, ack 1, win 893, options [nop,nop,TS val 156404 ecr 4294909613,mptcp dss ack 2295998090 seq 3914301834 subseq 382705 len 1428 csum 0x1fef], length 1428
10:53:20.273901 IP 112.26.3.8.41425 > 112.26.3.1.37753: Flags [.], ack 384133, win 24467, options [nop,nop,TS val 4294910160 ecr 156404,mptcp dss ack 3914213298], length 0
10:53:20.274071 IP 112.26.3.8.41425 > 112.26.3.1.37753: Flags [.], ack 384133, win 24467, options [nop,nop,TS val 4294910160 ecr 156404,mptcp dss ack 3914213298], length 0
10:53:20.287780 IP 112.26.3.8.41425 > 112.26.3.1.37753: Flags [.], ack 384133, win 24467, options [nop,nop,TS val 4294910160 ecr 156404,mptcp dss ack 3914213298], length 0
10:53:20.303630 IP 112.26.3.1.37753 > 112.26.3.8.41425: Flags [.], seq 384133:385561, ack 1, win 893, options [nop,nop,TS val 156536 ecr 4294909744,mptcp dss ack 2295998090 seq 3914306118 subseq 384133 len 1428 csum 0x3cf], length 1428
10:53:20.369203 IP 112.26.3.1.37753 > 112.26.3.8.41425: Flags [.], seq 384133:385561, ack 1, win 893, options [nop,nop,TS val 156536 ecr 4294909744,mptcp dss ack 2295998090 seq 3914306118 subseq 384133 len 1428 csum 0x3cf], length 1428
10:53:20.378430 IP 112.26.3.8.41425 > 112.26.3.1.37753: Flags [.], ack 385561, win 24467, options [nop,nop,TS val 4294910263 ecr 156536,mptcp dss ack 3914213298], length 0
10:53:20.378636 IP 112.26.3.8.41425 > 112.26.3.1.37753: Flags [.], ack 385561, win 24467, options [nop,nop,TS val 4294910263 ecr 156536,mptcp dss ack 3914213298], length 0
10:53:20.399955 IP 112.26.3.8.41425 > 112.26.3.1.37753: Flags [.], ack 385561, win 24467, options [nop,nop,TS val 4294910263 ecr 156536,mptcp dss ack 3914213298], length 0
10:53:20.464819 IP 112.26.3.1.37753 > 112.26.3.8.41425: Flags [.], seq 385561:386989, ack 1, win 893, options [nop,nop,TS val 156652 ecr 4294909862,mptcp dss ack 2295998090 seq 3914313258 subseq 385561 len 1428 csum 0x42a3], length 1428
10:53:20.489999 IP 112.26.3.1.37753 > 112.26.3.8.41425: Flags [.], seq 385561:386989, ack 1, win 893, options [nop,nop,TS val 156652 ecr 4294909862,mptcp dss ack 2295998090 seq 3914313258 subseq 385561 len 1428 csum 0x42a3], length 1428
10:53:20.491348 IP 112.26.3.8.41425 > 112.26.3.1.37753: Flags [.], ack 386989, win 24267, options [nop,nop,TS val 4294910384 ecr 156652,mptcp dss ack 3914226150], length 0
10:53:20.491509 IP 112.26.3.8.41425 > 112.26.3.1.37753: Flags [.], ack 386989, win 24267, options [nop,nop,TS val 4294910384 ecr 156652,mptcp dss ack 3914226150], length 0
10:53:20.510333 IP 112.26.3.8.41425 > 112.26.3.1.37753: Flags [.], ack 386989, win 24267, options [nop,nop,TS val 4294910384 ecr 156652,mptcp dss ack 3914226150], length 0
10:53:20.590893 IP 112.26.3.1.37753 > 112.26.3.8.41425: Flags [.], seq 386989:388417, ack 1, win 893, options [nop,nop,TS val 156780 ecr 4294910003,mptcp dss ack 2295998090 seq 3914318970 subseq 386989 len 1428 csum 0xf83b], length 1428
10:53:20.600336 IP 112.26.3.8.41425 > 112.26.3.1.37753: Flags [.], ack 388417, win 24267, options [nop,nop,TS val 4294910489 ecr 156780,mptcp dss ack 3914226150], length 0
10:53:20.600536 IP 112.26.3.8.41425 > 112.26.3.1.37753: Flags [.], ack 388417, win 24267, options [nop,nop,TS val 4294910489 ecr 156780,mptcp dss ack 3914226150], length 0
10:53:20.645147 IP 112.26.3.1.37753 > 112.26.3.8.41425: Flags [.], seq 386989:388417, ack 1, win 893, options [nop,nop,TS val 156780 ecr 4294910003,mptcp dss ack 2295998090 seq 3914318970 subseq 386989 len 1428 csum 0xf83b], length 1428
10:53:20.663236 IP 112.26.3.8.41425 > 112.26.3.1.37753: Flags [.], ack 388417, win 24267, options [nop,nop,TS val 4294910489 ecr 156780,mptcp dss ack 3914226150], length 0
10:53:20.777744 IP 112.26.3.1.37753 > 112.26.3.8.41425: Flags [.], seq 388417:389845, ack 1, win 893, options [nop,nop,TS val 156919 ecr 4294910160,mptcp dss ack 2295998090 seq 3914324682 subseq 388417 len 1428 csum 0xbe65], length 1428
10:53:20.781747 IP 112.26.3.1.37753 > 112.26.3.8.41425: Flags [.], seq 388417:389845, ack 1, win 893, options [nop,nop,TS val 156919 ecr 4294910160,mptcp dss ack 2295998090 seq 3914324682 subseq 388417 len 1428 csum 0xbe65], length 1428
10:53:20.783679 IP 112.26.3.8.41425 > 112.26.3.1.37753: Flags [.], ack 389845, win 24267, options [nop,nop,TS val 4294910675 ecr 156919,mptcp dss ack 3914226150], length 0
10:53:20.783879 IP 112.26.3.8.41425 > 112.26.3.1.37753: Flags [.], ack 389845, win 24267, options [nop,nop,TS val 4294910675 ecr 156919,mptcp dss ack 3914226150], length 0
10:53:20.799523 IP 112.26.3.8.41425 > 112.26.3.1.37753: Flags [.], ack 389845, win 24267, options [nop,nop,TS val 4294910675 ecr 156919,mptcp dss ack 3914226150], length 0
10:53:20.909738 IP 112.26.3.1.37753 > 112.26.3.8.41425: Flags [.], seq 389845:391273, ack 1, win 893, options [nop,nop,TS val 157041 ecr 4294910263,mptcp dss ack 2295998090 seq 3914327538 subseq 389845 len 1428 csum 0xb50d], length 1428
10:53:20.912594 IP 112.26.3.1.37753 > 112.26.3.8.41425: Flags [.], seq 389845:391273, ack 1, win 893, options [nop,nop,TS val 157041 ecr 4294910263,mptcp dss ack 2295998090 seq 3914327538 subseq 389845 len 1428 csum 0xb50d], length 1428
10:53:20.913779 IP 112.26.3.8.41425 > 112.26.3.1.37753: Flags [.], ack 391273, win 24267, options [nop,nop,TS val 4294910806 ecr 157041,mptcp dss ack 3914226150], length 0
10:53:20.913977 IP 112.26.3.8.41425 > 112.26.3.1.37753: Flags [.], ack 391273, win 24267, options [nop,nop,TS val 4294910806 ecr 157041,mptcp dss ack 3914226150], length 0
10:53:20.959311 IP 112.26.3.8.41425 > 112.26.3.1.37753: Flags [.], ack 391273, win 24267, options [nop,nop,TS val 4294910806 ecr 157041,mptcp dss ack 3914226150], length 0
10:53:21.042904 IP 112.26.3.1.37753 > 112.26.3.8.41425: Flags [.], seq 391273:392701, ack 1, win 893, options [nop,nop,TS val 157041 ecr 4294910263,mptcp dss ack 2295998090 seq 3914328966 subseq 391273 len 1428 csum 0xcb49], length 1428
10:53:21.048691 IP 112.26.3.1.37753 > 112.26.3.8.41425: Flags [.], seq 391273:392701, ack 1, win 893, options [nop,nop,TS val 157041 ecr 4294910263,mptcp dss ack 2295998090 seq 3914328966 subseq 391273 len 1428 csum 0xcb49], length 1428
10:53:21.051749 IP 112.26.3.8.41425 > 112.26.3.1.37753: Flags [.], ack 392701, win 24267, options [nop,nop,TS val 4294910942 ecr 157041,mptcp dss ack 3914226150], length 0
10:53:21.051912 IP 112.26.3.8.41425 > 112.26.3.1.37753: Flags [.], ack 392701, win 24267, options [nop,nop,TS val 4294910942 ecr 157041,mptcp dss ack 3914226150], length 0
10:53:21.057889 IP 112.26.3.8.41425 > 112.26.3.1.37753: Flags [.], ack 392701, win 24267, options [nop,nop,TS val 4294910942 ecr 157041,mptcp dss ack 3914226150], length 0
10:53:21.169148 IP 112.26.3.1.37753 > 112.26.3.8.41425: Flags [.], seq 392701:394129, ack 1, win 893, options [nop,nop,TS val 157152 ecr 4294910384,mptcp dss ack 2295998090 seq 3914333250 subseq 392701 len 1428 csum 0x57f7], length 1428
10:53:21.173087 IP 112.26.3.1.37753 > 112.26.3.8.41425: Flags [.], seq 392701:394129, ack 1, win 893, options [nop,nop,TS val 157152 ecr 4294910384,mptcp dss ack 2295998090 seq 3914333250 subseq 392701 len 1428 csum 0x57f7], length 1428
10:53:21.178999 IP 112.26.3.8.41425 > 112.26.3.1.37753: Flags [.], ack 394129, win 24267, options [nop,nop,TS val 4294911067 ecr 157152,mptcp dss ack 3914226150], length 0
10:53:21.179203 IP 112.26.3.8.41425 > 112.26.3.1.37753: Flags [.], ack 394129, win 24267, options [nop,nop,TS val 4294911067 ecr 157152,mptcp dss ack 3914226150], length 0
10:53:21.187589 IP 112.26.3.8.41425 > 112.26.3.1.37753: Flags [.], ack 394129, win 24267, options [nop,nop,TS val 4294911067 ecr 157152,mptcp dss ack 3914226150], length 0
10:53:21.312716 IP 112.26.3.1.37753 > 112.26.3.8.41425: Flags [.], seq 394129:395557, ack 1, win 893, options [nop,nop,TS val 157247 ecr 4294910489,mptcp dss ack 2295998090 seq 3914337534 subseq 394129 len 1428 csum 0xd0db], length 1428
10:53:21.316266 IP 112.26.3.1.37753 > 112.26.3.8.41425: Flags [.], seq 394129:395557, ack 1, win 893, options [nop,nop,TS val 157247 ecr 4294910489,mptcp dss ack 2295998090 seq 3914337534 subseq 394129 len 1428 csum 0xd0db], length 1428
10:53:21.323424 IP 112.26.3.8.41425 > 112.26.3.1.37753: Flags [.], ack 395557, win 24267, options [nop,nop,TS val 4294911210 ecr 157247,mptcp dss ack 3914226150], length 0
10:53:21.323631 IP 112.26.3.8.41425 > 112.26.3.1.37753: Flags [.], ack 395557, win 24267, options [nop,nop,TS val 4294911210 ecr 157247,mptcp dss ack 3914226150], length 0
10:53:21.341512 IP 112.26.3.8.41425 > 112.26.3.1.37753: Flags [.], ack 395557, win 24267, options [nop,nop,TS val 4294911210 ecr 157247,mptcp dss ack 3914226150], length 0
10:53:21.451852 IP 112.26.3.1.37753 > 112.26.3.8.41425: Flags [.], seq 395557:396985, ack 1, win 893, options [nop,nop,TS val 157441 ecr 4294910675,mptcp dss ack 2295998090 seq 3914344674 subseq 395557 len 1428 csum 0xfeda], length 1428
10:53:21.453007 IP 112.26.3.1.37753 > 112.26.3.8.41425: Flags [.], seq 395557:396985, ack 1, win 893, options [nop,nop,TS val 157441 ecr 4294910675,mptcp dss ack 2295998090 seq 3914344674 subseq 395557 len 1428 csum 0xfeda], length 1428
10:53:21.454714 IP 112.26.3.8.41425 > 112.26.3.1.37753: Flags [.], ack 396985, win 24267, options [nop,nop,TS val 4294911347 ecr 157441,mptcp dss ack 3914226150], length 0
10:53:21.454919 IP 112.26.3.8.41425 > 112.26.3.1.37753: Flags [.], ack 396985, win 24267, options [nop,nop,TS val 4294911347 ecr 157441,mptcp dss ack 3914226150], length 0
10:53:21.469587 IP 112.26.3.8.41425 > 112.26.3.1.37753: Flags [.], ack 396985, win 24267, options [nop,nop,TS val 4294911347 ecr 157441,mptcp dss ack 3914226150], length 0
10:53:21.601781 IP 112.26.3.1.37753 > 112.26.3.8.41425: Flags [.], seq 396985:398413, ack 1, win 893, options [nop,nop,TS val 157566 ecr 4294910806,mptcp dss ack 2295998090 seq 3914348958 subseq 396985 len 1428 csum 0x3def], length 1428
10:53:21.605528 IP 112.26.3.1.37753 > 112.26.3.8.41425: Flags [.], seq 396985:398413, ack 1, win 893, options [nop,nop,TS val 157566 ecr 4294910806,mptcp dss ack 2295998090 seq 3914348958 subseq 396985 len 1428 csum 0x3def], length 1428
10:53:21.607426 IP 112.26.3.8.41425 > 112.26.3.1.37753: Flags [.], ack 398413, win 24267, options [nop,nop,TS val 4294911499 ecr 157566,mptcp dss ack 3914226150], length 0
10:53:21.607617 IP 112.26.3.8.41425 > 112.26.3.1.37753: Flags [.], ack 398413, win 24267, options [nop,nop,TS val 4294911499 ecr 157566,mptcp dss ack 3914226150], length 0
10:53:21.633131 IP 112.26.3.8.41425 > 112.26.3.1.37753: Flags [.], ack 398413, win 24267, options [nop,nop,TS val 4294911499 ecr 157566,mptcp dss ack 3914226150], length 0
10:53:21.714175 IP 112.26.3.1.37753 > 112.26.3.8.41425: Flags [.], seq 398413:399841, ack 1, win 893, options [nop,nop,TS val 157699 ecr 4294910942,mptcp dss ack 2295998090 seq 3914353242 subseq 398413 len 1428 csum 0x258e], length 1428
10:53:21.727866 IP 112.26.3.1.37753 > 112.26.3.8.41425: Flags [.], seq 398413:399841, ack 1, win 893, options [nop,nop,TS val 157699 ecr 4294910942,mptcp dss ack 2295998090 seq 3914353242 subseq 398413 len 1428 csum 0x258e], length 1428
10:53:21.730032 IP 112.26.3.8.41425 > 112.26.3.1.37753: Flags [.], ack 399841, win 24257, options [nop,nop,TS val 4294911622 ecr 157699,mptcp dss ack 3914317542], length 0
10:53:21.730215 IP 112.26.3.8.41425 > 112.26.3.1.37753: Flags [.], ack 399841, win 24257, options [nop,nop,TS val 4294911622 ecr 157699,mptcp dss ack 3914317542], length 0
10:53:21.790029 IP 112.26.3.8.41425 > 112.26.3.1.37753: Flags [.], ack 399841, win 24257, options [nop,nop,TS val 4294911622 ecr 157699,mptcp dss ack 3914317542], length 0
10:53:21.828469 IP 112.26.3.1.37753 > 112.26.3.8.41425: Flags [.], seq 399841:401269, ack 1, win 893, options [nop,nop,TS val 157829 ecr 4294911067,mptcp dss ack 2295998090 seq 3914358954 subseq 399841 len 1428 csum 0xf904], length 1428
10:53:21.880745 IP 112.26.3.1.37753 > 112.26.3.8.41425: Flags [.], seq 399841:401269, ack 1, win 893, options [nop,nop,TS val 157829 ecr 4294911067,mptcp dss ack 2295998090 seq 3914358954 subseq 399841 len 1428 csum 0xf904], length 1428
10:53:21.925176 IP 112.26.3.8.41425 > 112.26.3.1.37753: Flags [.], ack 401269, win 24525, options [nop,nop,TS val 4294911815 ecr 157829,mptcp dss ack 3914357526], length 0
10:53:21.925345 IP 112.26.3.8.41425 > 112.26.3.1.37753: Flags [.], ack 401269, win 24525, options [nop,nop,TS val 4294911815 ecr 157829,mptcp dss ack 3914357526], length 0
10:53:21.927312 IP 112.26.3.1.37753 > 112.26.3.8.41425: Flags [.], seq 401269:402697, ack 1, win 893, options [nop,nop,TS val 157983 ecr 4294911210,mptcp dss ack 2295998090 seq 3914366094 subseq 401269 len 1428 csum 0x6a82], length 1428
10:53:21.964414 IP 112.26.3.8.41425 > 112.26.3.1.37753: Flags [.], ack 401269, win 24525, options [nop,nop,TS val 4294911815 ecr 157829,mptcp dss ack 3914357526], length 0
10:53:21.987100 IP 112.26.3.1.37753 > 112.26.3.8.41425: Flags [.], seq 401269:402697, ack 1, win 893, options [nop,nop,TS val 157983 ecr 4294911210,mptcp dss ack 2295998090 seq 3914366094 subseq 401269 len 1428 csum 0x6a82], length 1428
10:53:22.053928 IP 112.26.3.1.37753 > 112.26.3.8.41425: Flags [.], seq 402697:404125, ack 1, win 893, options [nop,nop,TS val 158111 ecr 4294911347,mptcp dss ack 2295998090 seq 3914370378 subseq 402697 len 1428 csum 0x9727], length 1428
10:53:22.056247 IP 112.26.3.1.37753 > 112.26.3.8.41425: Flags [.], seq 402697:404125, ack 1, win 893, options [nop,nop,TS val 158111 ecr 4294911347,mptcp dss ack 2295998090 seq 3914370378 subseq 402697 len 1428 csum 0x9727], length 1428
10:53:22.093460 IP 112.26.3.8.41425 > 112.26.3.1.37753: Flags [.], ack 404125, win 24522, options [nop,nop,TS val 4294911950 ecr 157983,mptcp dss ack 3914363238], length 0
10:53:22.093646 IP 112.26.3.8.41425 > 112.26.3.1.37753: Flags [.], ack 404125, win 24522, options [nop,nop,TS val 4294911950 ecr 157983,mptcp dss ack 3914363238], length 0
10:53:22.100288 IP 112.26.3.8.41425 > 112.26.3.1.37753: Flags [.], ack 404125, win 24522, options [nop,nop,TS val 4294911950 ecr 157983,mptcp dss ack 3914363238], length 0
10:53:22.185254 IP 112.26.3.1.37753 > 112.26.3.8.41425: Flags [.], seq 404125:405553, ack 1, win 893, options [nop,nop,TS val 158256 ecr 4294911499,mptcp dss ack 2295998090 seq 3914376090 subseq 404125 len 1428 csum 0x5b9d], length 1428
10:53:22.191480 IP 112.26.3.1.37753 > 112.26.3.8.41425: Flags [.], seq 404125:405553, ack 1, win 893, options [nop,nop,TS val 158256 ecr 4294911499,mptcp dss ack 2295998090 seq 3914376090 subseq 404125 len 1428 csum 0x5b9d], length 1428
10:53:22.276686 IP 112.26.3.1.37753 > 112.26.3.8.41425: Flags [.], seq 405553:406981, ack 1, win 893, options [nop,nop,TS val 158406 ecr 4294911622,mptcp dss ack 2295998090 seq 3914383230 subseq 405553 len 1428 csum 0xdf8d], length 1428
10:53:22.300910 IP 112.26.3.1.37753 > 112.26.3.8.41425: Flags [.], seq 405553:406981, ack 1, win 893, options [nop,nop,TS val 158406 ecr 4294911622,mptcp dss ack 2295998090 seq 3914383230 subseq 405553 len 1428 csum 0xdf8d], length 1428
10:53:22.302700 IP 112.26.3.8.41425 > 112.26.3.1.37753: Flags [.], ack 406981, win 24473, options [nop,nop,TS val 4294912195 ecr 158256,mptcp dss ack 3914373234], length 0
10:53:22.302970 IP 112.26.3.8.41425 > 112.26.3.1.37753: Flags [.], ack 406981, win 24473, options [nop,nop,TS val 4294912195 ecr 158256,mptcp dss ack 3914373234], length 0
10:53:22.321117 IP 112.26.3.8.41425 > 112.26.3.1.37753: Flags [.], ack 406981, win 24473, options [nop,nop,TS val 4294912195 ecr 158256,mptcp dss ack 3914373234], length 0
10:53:22.404352 IP 112.26.3.1.37753 > 112.26.3.8.41425: Flags [.], seq 406981:408409, ack 1, win 893, options [nop,nop,TS val 158576 ecr 4294911815,mptcp dss ack 2295998090 seq 3914390370 subseq 406981 len 1428 csum 0xb78f], length 1428
10:53:22.423045 IP 112.26.3.1.37753 > 112.26.3.8.41425: Flags [.], seq 406981:408409, ack 1, win 893, options [nop,nop,TS val 158576 ecr 4294911815,mptcp dss ack 2295998090 seq 3914390370 subseq 406981 len 1428 csum 0xb78f], length 1428
10:53:22.491746 IP 112.26.3.1.37753 > 112.26.3.8.41425: Flags [.], seq 409837:411265, ack 1, win 893, options [nop,nop,TS val 158741 ecr 4294911950,mptcp dss ack 2295998090 seq 3914400366 subseq 409837 len 1428 csum 0xd595], length 1428
10:53:22.531827 IP 112.26.3.8.41425 > 112.26.3.1.37753: Flags [.], ack 408409, win 24458, options [nop,nop,TS val 4294912424 ecr 158576,mptcp dss ack 3914381802], length 0
10:53:22.532033 IP 112.26.3.8.41425 > 112.26.3.1.37753: Flags [.], ack 408409, win 24458, options [nop,nop,TS val 4294912424 ecr 158576,mptcp dss ack 3914381802], length 0
10:53:22.542592 IP 112.26.3.8.41425 > 112.26.3.1.37753: Flags [.], ack 408409, win 24458, options [nop,nop,TS val 4294912424 ecr 158576,mptcp dss ack 3914381802], length 0
10:53:22.544181 IP 112.26.3.1.37753 > 112.26.3.8.41425: Flags [.], seq 409837:411265, ack 1, win 893, options [nop,nop,TS val 158741 ecr 4294911950,mptcp dss ack 2295998090 seq 3914400366 subseq 409837 len 1428 csum 0xd595], length 1428
10:53:22.630852 IP 112.26.3.1.37753 > 112.26.3.8.41425: Flags [.], seq 411265:412693, ack 1, win 893, options [nop,nop,TS val 158953 ecr 4294912195,mptcp dss ack 2295998090 seq 3914406078 subseq 411265 len 1428 csum 0x2a61], length 1428
10:53:22.633520 IP 112.26.3.1.37753 > 112.26.3.8.41425: Flags [.], seq 411265:412693, ack 1, win 893, options [nop,nop,TS val 158953 ecr 4294912195,mptcp dss ack 2295998090 seq 3914406078 subseq 411265 len 1428 csum 0x2a61], length 1428
10:53:22.644999 IP 112.26.3.8.41425 > 112.26.3.1.37753: Flags [.], ack 408409, win 24458, options [nop,nop,TS val 4294912438 ecr 158576,nop,nop,sack 1 {409837:411265},mptcp dss ack 3914381802], length 0
10:53:22.645198 IP 112.26.3.8.41425 > 112.26.3.1.37753: Flags [.], ack 408409, win 24458, options [nop,nop,TS val 4294912438 ecr 158576,nop,nop,sack 1 {409837:411265},mptcp dss ack 3914381802], length 0
10:53:22.682067 IP 112.26.3.8.41425 > 112.26.3.1.37753: Flags [.], ack 408409, win 24458, options [nop,nop,TS val 4294912438 ecr 158576,nop,nop,sack 1 {409837:411265},mptcp dss ack 3914381802], length 0
10:53:22.755187 IP 112.26.3.8.41425 > 112.26.3.1.37753: Flags [.], ack 408409, win 24507, options [nop,nop,TS val 4294912527 ecr 158576,nop,nop,sack 1 {409837:412693},mptcp dss ack 3914388942], length 0
10:53:22.755386 IP 112.26.3.8.41425 > 112.26.3.1.37753: Flags [.], ack 408409, win 24507, options [nop,nop,TS val 4294912527 ecr 158576,nop,nop,sack 1 {409837:412693},mptcp dss ack 3914388942], length 0
10:53:22.792658 IP 112.26.3.1.37753 > 112.26.3.8.41425: Flags [.], seq 412693:414121, ack 1, win 893, options [nop,nop,TS val 158953 ecr 4294912195,mptcp dss ack 2295998090 seq 3914407506 subseq 412693 len 1428 csum 0x1706], length 1428
10:53:22.795140 IP 112.26.3.1.37753 > 112.26.3.8.41425: Flags [.], seq 412693:414121, ack 1, win 893, options [nop,nop,TS val 158953 ecr 4294912195,mptcp dss ack 2295998090 seq 3914407506 subseq 412693 len 1428 csum 0x1706], length 1428
10:53:22.807418 IP 112.26.3.8.41425 > 112.26.3.1.37753: Flags [.], ack 408409, win 24507, options [nop,nop,TS val 4294912527 ecr 158576,nop,nop,sack 1 {409837:412693},mptcp dss ack 3914388942], length 0
10:53:22.843445 IP 112.26.3.8.41425 > 112.26.3.1.37753: Flags [.], ack 408409, win 24507, options [nop,nop,TS val 4294912689 ecr 158576,nop,nop,sack 1 {409837:414121},mptcp dss ack 3914393226], length 0
10:53:22.843662 IP 112.26.3.8.41425 > 112.26.3.1.37753: Flags [.], ack 408409, win 24507, options [nop,nop,TS val 4294912689 ecr 158576,nop,nop,sack 1 {409837:414121},mptcp dss ack 3914393226], length 0
10:53:22.916790 IP 112.26.3.1.37753 > 112.26.3.8.41425: Flags [.], seq 414121:415549, ack 1, win 893, options [nop,nop,TS val 158953 ecr 4294912195,mptcp dss ack 2295998090 seq 3914408934 subseq 414121 len 1428 csum 0x39ac], length 1428
10:53:22.919472 IP 112.26.3.1.37753 > 112.26.3.8.41425: Flags [.], seq 414121:415549, ack 1, win 893, options [nop,nop,TS val 158953 ecr 4294912195,mptcp dss ack 2295998090 seq 3914408934 subseq 414121 len 1428 csum 0x39ac], length 1428
10:53:22.954239 IP 112.26.3.8.41425 > 112.26.3.1.37753: Flags [.], ack 408409, win 24507, options [nop,nop,TS val 4294912689 ecr 158576,nop,nop,sack 1 {409837:414121},mptcp dss ack 3914393226], length 0
10:53:22.958256 IP 112.26.3.8.41425 > 112.26.3.1.37753: Flags [.], ack 408409, win 24504, options [nop,nop,TS val 4294912813 ecr 158576,nop,nop,sack 1 {409837:415549},mptcp dss ack 3914398938], length 0
10:53:22.958455 IP 112.26.3.8.41425 > 112.26.3.1.37753: Flags [.], ack 408409, win 24504, options [nop,nop,TS val 4294912813 ecr 158576,nop,nop,sack 1 {409837:415549},mptcp dss ack 3914398938], length 0
10:53:23.037651 IP 112.26.3.8.41425 > 112.26.3.1.37753: Flags [.], ack 408409, win 24504, options [nop,nop,TS val 4294912813 ecr 158576,nop,nop,sack 1 {409837:415549},mptcp dss ack 3914398938], length 0
10:53:23.065076 IP 112.26.3.1.37753 > 112.26.3.8.41425: Flags [.], seq 415549:416977, ack 1, win 893, options [nop,nop,TS val 159178 ecr 4294912424,mptcp dss ack 2295998090 seq 3914420358 subseq 415549 len 1428 csum 0xf06b], length 1428
10:53:23.070152 IP 112.26.3.8.41425 > 112.26.3.1.37753: Flags [.], ack 408409, win 24504, options [nop,nop,TS val 4294912958 ecr 158576,nop,nop,sack 1 {409837:416977},mptcp dss ack 3914398938], length 0
10:53:23.070316 IP 112.26.3.8.41425 > 112.26.3.1.37753: Flags [.], ack 408409, win 24504, options [nop,nop,TS val 4294912958 ecr 158576,nop,nop,sack 1 {409837:416977},mptcp dss ack 3914398938], length 0
10:53:23.103752 IP 112.26.3.1.37753 > 112.26.3.8.41425: Flags [.], seq 415549:416977, ack 1, win 893, options [nop,nop,TS val 159178 ecr 4294912424,mptcp dss ack 2295998090 seq 3914420358 subseq 415549 len 1428 csum 0xf06b], length 1428
10:53:23.122305 IP 112.26.3.8.41425 > 112.26.3.1.37753: Flags [.], ack 408409, win 24504, options [nop,nop,TS val 4294912958 ecr 158576,nop,nop,sack 1 {409837:416977},mptcp dss ack 3914398938], length 0
10:53:23.153712 IP 112.26.3.1.37753 > 112.26.3.8.41425: Flags [.], seq 416977:418405, ack 1, win 893, options [nop,nop,TS val 159338 ecr 4294912438,mptcp dss ack 2295998090 seq 3914427498 subseq 416977 len 1428 csum 0x5c0d], length 1428
10:53:23.165615 IP 112.26.3.1.37753 > 112.26.3.8.41425: Flags [.], seq 416977:418405, ack 1, win 893, options [nop,nop,TS val 159338 ecr 4294912438,mptcp dss ack 2295998090 seq 3914427498 subseq 416977 len 1428 csum 0x5c0d], length 1428
10:53:23.169983 IP 112.26.3.8.41425 > 112.26.3.1.37753: Flags [.], ack 408409, win 24504, options [nop,nop,TS val 4294913051 ecr 158576,nop,nop,sack 1 {409837:418405},mptcp dss ack 3914398938], length 0
10:53:23.170197 IP 112.26.3.8.41425 > 112.26.3.1.37753: Flags [.], ack 408409, win 24504, options [nop,nop,TS val 4294913051 ecr 158576,nop,nop,sack 1 {409837:418405},mptcp dss ack 3914398938], length 0
10:53:23.204524 IP 112.26.3.8.41425 > 112.26.3.1.37753: Flags [.], ack 408409, win 24504, options [nop,nop,TS val 4294913051 ecr 158576,nop,nop,sack 1 {409837:418405},mptcp dss ack 3914398938], length 0
10:53:23.263808 IP 112.26.3.1.37753 > 112.26.3.8.41425: Flags [.], seq 418405:419833, ack 1, win 893, options [nop,nop,TS val 159450 ecr 4294912527,mptcp dss ack 2295998090 seq 3914431782 subseq 418405 len 1428 csum 0xffe3], length 1428
10:53:23.268274 IP 112.26.3.1.37753 > 112.26.3.8.41425: Flags [.], seq 418405:419833, ack 1, win 893, options [nop,nop,TS val 159450 ecr 4294912527,mptcp dss ack 2295998090 seq 3914431782 subseq 418405 len 1428 csum 0xffe3], length 1428
10:53:23.274841 IP 112.26.3.8.41425 > 112.26.3.1.37753: Flags [.], ack 408409, win 24504, options [nop,nop,TS val 4294913162 ecr 158576,nop,nop,sack 1 {409837:419833},mptcp dss ack 3914398938], length 0
10:53:23.275045 IP 112.26.3.8.41425 > 112.26.3.1.37753: Flags [.], ack 408409, win 24504, options [nop,nop,TS val 4294913162 ecr 158576,nop,nop,sack 1 {409837:419833},mptcp dss ack 3914398938], length 0
10:53:23.363578 IP 112.26.3.8.41425 > 112.26.3.1.37753: Flags [.], ack 408409, win 24504, options [nop,nop,TS val 4294913162 ecr 158576,nop,nop,sack 1 {409837:419833},mptcp dss ack 3914398938], length 0
10:53:23.369302 IP 112.26.3.1.37753 > 112.26.3.8.41425: Flags [.], seq 408409:409837, ack 1, win 893, options [nop,nop,TS val 159592 ecr 4294912689,mptcp dss ack 2295998090 seq 3914398938 subseq 408409 len 1428 csum 0x63ad], length 1428
10:53:23.373681 IP 112.26.3.1.37753 > 112.26.3.8.41425: Flags [.], seq 408409:409837, ack 1, win 893, options [nop,nop,TS val 159592 ecr 4294912689,mptcp dss ack 2295998090 seq 3914398938 subseq 408409 len 1428 csum 0x63ad], length 1428
10:53:23.379731 IP 112.26.3.8.41425 > 112.26.3.1.37753: Flags [.], ack 419833, win 24214, options [nop,nop,TS val 4294913268 ecr 159592,mptcp dss ack 3914417502], length 0
10:53:23.379881 IP 112.26.3.8.41425 > 112.26.3.1.37753: Flags [.], ack 419833, win 24214, options [nop,nop,TS val 4294913268 ecr 159592,mptcp dss ack 3914417502], length 0
10:53:23.484000 IP 112.26.3.8.41425 > 112.26.3.1.37753: Flags [.], ack 419833, win 24214, options [nop,nop,TS val 4294913268 ecr 159592,mptcp dss ack 3914417502], length 0
10:53:23.493763 IP 112.26.3.1.37753 > 112.26.3.8.41425: Flags [.], seq 419833:421261, ack 1, win 893, options [nop,nop,TS val 159770 ecr 4294912958,mptcp dss ack 2295998090 seq 3914443206 subseq 419833 len 1428 csum 0xc735], length 1428
10:53:23.546150 IP 112.26.3.1.37753 > 112.26.3.8.41425: Flags [.], seq 419833:421261, ack 1, win 893, options [nop,nop,TS val 159770 ecr 4294912958,mptcp dss ack 2295998090 seq 3914443206 subseq 419833 len 1428 csum 0xc735], length 1428
10:53:23.547516 IP 112.26.3.8.41425 > 112.26.3.1.37753: Flags [.], ack 421261, win 24455, options [nop,nop,TS val 4294913440 ecr 159770,mptcp dss ack 3914426070], length 0
10:53:23.547750 IP 112.26.3.8.41425 > 112.26.3.1.37753: Flags [.], ack 421261, win 24455, options [nop,nop,TS val 4294913440 ecr 159770,mptcp dss ack 3914426070], length 0
10:53:23.572283 IP 112.26.3.1.37753 > 112.26.3.8.41425: Flags [.], seq 421261:422689, ack 1, win 893, options [nop,nop,TS val 159860 ecr 4294913051,mptcp dss ack 2295998090 seq 3914447490 subseq 421261 len 1428 csum 0x4fae], length 1428
10:53:23.618605 IP 112.26.3.8.41425 > 112.26.3.1.37753: Flags [.], ack 421261, win 24455, options [nop,nop,TS val 4294913440 ecr 159770,mptcp dss ack 3914426070], length 0
10:53:23.645400 IP 112.26.3.1.37753 > 112.26.3.8.41425: Flags [.], seq 421261:422689, ack 1, win 893, options [nop,nop,TS val 159860 ecr 4294913051,mptcp dss ack 2295998090 seq 3914447490 subseq 421261 len 1428 csum 0x4fae], length 1428
10:53:23.647496 IP 112.26.3.8.41425 > 112.26.3.1.37753: Flags [.], ack 422689, win 24442, options [nop,nop,TS val 4294913539 ecr 159860,mptcp dss ack 3914430354], length 0
10:53:23.647679 IP 112.26.3.8.41425 > 112.26.3.1.37753: Flags [.], ack 422689, win 24442, options [nop,nop,TS val 4294913539 ecr 159860,mptcp dss ack 3914430354], length 0
10:53:23.710004 IP 112.26.3.1.37753 > 112.26.3.8.41425: Flags [.], seq 422689:424117, ack 1, win 893, options [nop,nop,TS val 160085 ecr 4294913162,mptcp dss ack 2295998090 seq 3914460342 subseq 422689 len 1428 csum 0x9798], length 1428
10:53:23.745197 IP 112.26.3.1.37753 > 112.26.3.8.41425: Flags [.], seq 422689:424117, ack 1, win 893, options [nop,nop,TS val 160085 ecr 4294913162,mptcp dss ack 2295998090 seq 3914460342 subseq 422689 len 1428 csum 0x9798], length 1428
10:53:23.748409 IP 112.26.3.8.41425 > 112.26.3.1.37753: Flags [.], ack 424117, win 24440, options [nop,nop,TS val 4294913639 ecr 160085,mptcp dss ack 3914436066], length 0
10:53:23.748543 IP 112.26.3.8.41425 > 112.26.3.1.37753: Flags [.], ack 424117, win 24440, options [nop,nop,TS val 4294913639 ecr 160085,mptcp dss ack 3914436066], length 0
10:53:23.765956 IP 112.26.3.8.41425 > 112.26.3.1.37753: Flags [.], ack 422689, win 24442, options [nop,nop,TS val 4294913539 ecr 159860,mptcp dss ack 3914430354], length 0
10:53:23.851749 IP 112.26.3.1.37753 > 112.26.3.8.41425: Flags [.], seq 424117:425545, ack 1, win 893, options [nop,nop,TS val 160125 ecr 4294913268,mptcp dss ack 2295998090 seq 3914463198 subseq 424117 len 1428 csum 0x8a60], length 1428
10:53:23.870018 IP 112.26.3.8.41425 > 112.26.3.1.37753: Flags [.], ack 424117, win 24440, options [nop,nop,TS val 4294913639 ecr 160085,mptcp dss ack 3914436066], length 0
10:53:23.885154 IP 112.26.3.1.37753 > 112.26.3.8.41425: Flags [.], seq 424117:425545, ack 1, win 893, options [nop,nop,TS val 160125 ecr 4294913268,mptcp dss ack 2295998090 seq 3914463198 subseq 424117 len 1428 csum 0x8a60], length 1428
10:53:23.888219 IP 112.26.3.8.41425 > 112.26.3.1.37753: Flags [.], ack 425545, win 24433, options [nop,nop,TS val 4294913779 ecr 160125,mptcp dss ack 3914441778], length 0
10:53:23.888386 IP 112.26.3.8.41425 > 112.26.3.1.37753: Flags [.], ack 425545, win 24433, options [nop,nop,TS val 4294913779 ecr 160125,mptcp dss ack 3914441778], length 0
10:53:23.965519 IP 112.26.3.8.41425 > 112.26.3.1.37753: Flags [.], ack 425545, win 24433, options [nop,nop,TS val 4294913779 ecr 160125,mptcp dss ack 3914441778], length 0
10:53:23.983232 IP 112.26.3.1.37753 > 112.26.3.8.41425: Flags [.], seq 425545:426973, ack 1, win 893, options [nop,nop,TS val 160260 ecr 4294913440,mptcp dss ack 2295998090 seq 3914470338 subseq 425545 len 1428 csum 0x2faf], length 1428
10:53:24.006277 IP 112.26.3.1.37753 > 112.26.3.8.41425: Flags [.], seq 425545:426973, ack 1, win 893, options [nop,nop,TS val 160260 ecr 4294913440,mptcp dss ack 2295998090 seq 3914470338 subseq 425545 len 1428 csum 0x2faf], length 1428
10:53:24.008489 IP 112.26.3.8.41425 > 112.26.3.1.37753: Flags [.], ack 426973, win 24393, options [nop,nop,TS val 4294913900 ecr 160260,mptcp dss ack 3914448918], length 0
10:53:24.008688 IP 112.26.3.8.41425 > 112.26.3.1.37753: Flags [.], ack 426973, win 24393, options [nop,nop,TS val 4294913900 ecr 160260,mptcp dss ack 3914448918], length 0
10:53:24.047364 IP 112.26.3.8.41425 > 112.26.3.1.37753: Flags [.], ack 426973, win 24393, options [nop,nop,TS val 4294913900 ecr 160260,mptcp dss ack 3914448918], length 0
10:53:24.110060 IP 112.26.3.1.37753 > 112.26.3.8.41425: Flags [.], seq 426973:428401, ack 1, win 893, options [nop,nop,TS val 160260 ecr 4294913440,mptcp dss ack 2295998090 seq 3914471766 subseq 426973 len 1428 csum 0xa543], length 1428
10:53:24.143498 IP 112.26.3.1.37753 > 112.26.3.8.41425: Flags [.], seq 426973:428401, ack 1, win 893, options [nop,nop,TS val 160260 ecr 4294913440,mptcp dss ack 2295998090 seq 3914471766 subseq 426973 len 1428 csum 0xa543], length 1428
10:53:24.146414 IP 112.26.3.8.41425 > 112.26.3.1.37753: Flags [.], ack 428401, win 24424, options [nop,nop,TS val 4294914037 ecr 160260,mptcp dss ack 3914458914], length 0
10:53:24.146630 IP 112.26.3.8.41425 > 112.26.3.1.37753: Flags [.], ack 428401, win 24424, options [nop,nop,TS val 4294914037 ecr 160260,mptcp dss ack 3914458914], length 0
10:53:24.155362 IP 112.26.3.8.41425 > 112.26.3.1.37753: Flags [.], ack 428401, win 24424, options [nop,nop,TS val 4294914037 ecr 160260,mptcp dss ack 3914458914], length 0
10:53:24.217393 IP 112.26.3.1.37753 > 112.26.3.8.41425: Flags [.], seq 428401:429829, ack 1, win 893, options [nop,nop,TS val 160399 ecr 4294913539,mptcp dss ack 2295998090 seq 3914481762 subseq 428401 len 1428 csum 0x69e5], length 1428
10:53:24.260465 IP 112.26.3.1.37753 > 112.26.3.8.41425: Flags [.], seq 428401:429829, ack 1, win 893, options [nop,nop,TS val 160399 ecr 4294913539,mptcp dss ack 2295998090 seq 3914481762 subseq 428401 len 1428 csum 0x69e5], length 1428
10:53:24.261769 IP 112.26.3.8.41425 > 112.26.3.1.37753: Flags [.], ack 429829, win 24458, options [nop,nop,TS val 4294914154 ecr 160399,mptcp dss ack 3914466054], length 0
10:53:24.261966 IP 112.26.3.8.41425 > 112.26.3.1.37753: Flags [.], ack 429829, win 24458, options [nop,nop,TS val 4294914154 ecr 160399,mptcp dss ack 3914466054], length 0
10:53:24.270955 IP 112.26.3.8.41425 > 112.26.3.1.37753: Flags [.], ack 429829, win 24458, options [nop,nop,TS val 4294914154 ecr 160399,mptcp dss ack 3914466054], length 0
10:53:24.356464 IP 112.26.3.1.37753 > 112.26.3.8.41425: Flags [.], seq 429829:431257, ack 1, win 893, options [nop,nop,TS val 160511 ecr 4294913639,mptcp dss ack 2295998090 seq 3914483190 subseq 429829 len 1428 csum 0x1d69], length 1428
10:53:24.364066 IP 112.26.3.1.37753 > 112.26.3.8.41425: Flags [.], seq 429829:431257, ack 1, win 893, options [nop,nop,TS val 160511 ecr 4294913639,mptcp dss ack 2295998090 seq 3914483190 subseq 429829 len 1428 csum 0x1d69], length 1428
10:53:24.365581 IP 112.26.3.8.41425 > 112.26.3.1.37753: Flags [.], ack 431257, win 24473, options [nop,nop,TS val 4294914258 ecr 160511,mptcp dss ack 3914473194], length 0
10:53:24.365805 IP 112.26.3.8.41425 > 112.26.3.1.37753: Flags [.], ack 431257, win 24473, options [nop,nop,TS val 4294914258 ecr 160511,mptcp dss ack 3914473194], length 0
10:53:24.425257 IP 112.26.3.8.41425 > 112.26.3.1.37753: Flags [.], ack 431257, win 24473, options [nop,nop,TS val 4294914258 ecr 160511,mptcp dss ack 3914473194], length 0
10:53:24.477232 IP 112.26.3.1.37753 > 112.26.3.8.41425: Flags [.], seq 431257:432685, ack 1, win 893, options [nop,nop,TS val 160607 ecr 4294913779,mptcp dss ack 2295998090 seq 3914488902 subseq 431257 len 1428 csum 0xdcb3], length 1428
10:53:24.491602 IP 112.26.3.1.37753 > 112.26.3.8.41425: Flags [.], seq 431257:432685, ack 1, win 893, options [nop,nop,TS val 160607 ecr 4294913779,mptcp dss ack 2295998090 seq 3914488902 subseq 431257 len 1428 csum 0xdcb3], length 1428
10:53:24.497044 IP 112.26.3.8.41425 > 112.26.3.1.37753: Flags [.], ack 432685, win 24451, options [nop,nop,TS val 4294914385 ecr 160607,mptcp dss ack 3914474622], length 0
10:53:24.497312 IP 112.26.3.8.41425 > 112.26.3.1.37753: Flags [.], ack 432685, win 24451, options [nop,nop,TS val 4294914385 ecr 160607,mptcp dss ack 3914474622], length 0
10:53:24.527697 IP 112.26.3.8.41425 > 112.26.3.1.37753: Flags [.], ack 432685, win 24451, options [nop,nop,TS val 4294914385 ecr 160607,mptcp dss ack 3914474622], length 0
10:53:24.582975 IP 112.26.3.1.37753 > 112.26.3.8.41425: Flags [P.], seq 432685:434113, ack 1, win 893, options [nop,nop,TS val 160682 ecr 4294913900,mptcp dss ack 2295998090 seq 3914494614 subseq 432685 len 1428 csum 0x3ed0], length 1428
10:53:24.603236 IP 112.26.3.1.37753 > 112.26.3.8.41425: Flags [P.], seq 432685:434113, ack 1, win 893, options [nop,nop,TS val 160682 ecr 4294913900,mptcp dss ack 2295998090 seq 3914494614 subseq 432685 len 1428 csum 0x3ed0], length 1428
10:53:24.605484 IP 112.26.3.8.41425 > 112.26.3.1.37753: Flags [.], ack 434113, win 24422, options [nop,nop,TS val 4294914497 ecr 160682,mptcp dss ack 3914478906], length 0
10:53:24.605797 IP 112.26.3.8.41425 > 112.26.3.1.37753: Flags [.], ack 434113, win 24422, options [nop,nop,TS val 4294914497 ecr 160682,mptcp dss ack 3914478906], length 0
10:53:24.617804 IP 112.26.3.8.41425 > 112.26.3.1.37753: Flags [.], ack 434113, win 24422, options [nop,nop,TS val 4294914497 ecr 160682,mptcp dss ack 3914478906], length 0
