10:52:44.144828 IP 112.26.3.8.41425 > 112.26.3.1.37753: Flags [S], seq 2395078999, win 65535, options [mss 1460,sackOK,TS val 4294873967 ecr 0,nop,wscale 6,mptcp join id 5 token 0xd15e4cde nonce 0x2a8bb6e7], length 0
10:52:44.242114 IP 112.26.3.1.37753 > 112.26.3.8.41425: Flags [S.], seq 2893757763, ack 2395079000, win 28560, options [mss 1460,sackOK,TS val 120848 ecr 4294873967,nop,wscale 7,mptcp join id 5 hmac 0x81ff6e68fa33c134 nonce 0x1be19e41], length 0
10:52:44.375994 IP 112.26.3.1.37753 > 112.26.3.8.41425: Flags [S.], seq 2893757763, ack 2395079000, win 28560, options [mss 1460,sackOK,TS val 120848 ecr 4294873967,nop,wscale 7,mptcp join id 5 hmac 0x81ff6e68fa33c134 nonce 0x1be19e41], length 0
10:52:44.452086 IP 112.26.3.1.37753 > 112.26.3.8.41425: Flags [S.], seq 2893757763, ack 2395079000, win 28560, options [mss 1460,sackOK,TS val 120848 ecr 4294873967,nop,wscale 7,mptcp join id 5 hmac 0x81ff6e68fa33c134 nonce 0x1be19e41], length 0
10:52:44.591815 IP 112.26.3.8.41425 > 112.26.3.1.37753: Flags [.], ack 1, win 7027, options [nop,nop,TS val 4294874346 ecr 120848,mptcp join hmac 0x8ee215a13a2dbfbe7ea6ce9b5e39c59ddf8153af], length 0
10:52:44.599977 IP 112.26.3.1.37753 > 112.26.3.8.41425: Flags [.], ack 1, win 670, options [nop,nop,TS val 121235 ecr 4294874346,mptcp dss ack 2295998090], length 0
10:52:44.600350 IP 112.26.3.1.37753 > 112.26.3.8.41425: Flags [.], ack 1, win 670, options [nop,nop,TS val 121235 ecr 4294874346,mptcp dss ack 2295998090], length 0
10:53:19.767611 IP 112.26.3.1.37753 > 112.26.3.8.41425: Flags [.], seq 382705:384133, ack 1, win 893, options [nop,nop,TS val 156404 ecr 4294909613,mptcp dss ack 2295998090 seq 3914301834 subseq 382705 len 1428 csum 0x1fef], length 1428
10:53:19.767977 IP 112.26.3.1.37753 > 112.26.3.8.41425: Flags [.], seq 382705:384133, ack 1, win 893, options [nop,nop,TS val 156404 ecr 4294909613,mptcp dss ack 2295998090 seq 3914301834 subseq 382705 len 1428 csum 0x1fef], length 1428
10:53:19.850103 IP 112.26.3.1.37753 > 112.26.3.8.41425: Flags [.], seq 369853:371281, ack 1, win 893, options [nop,nop,TS val 156012 ecr 4294909198,mptcp dss ack 2295998090 seq 3914251854 subseq 369853 len 1428 csum 0xc94c], length 1428
10:53:19.892521 IP 112.26.3.8.41425 > 112.26.3.1.37753: Flags [.], ack 374137, win 24467, options [nop,nop,TS val 4294909744 ecr 156012,nop,nop,sack 1 {375565:381277},mptcp dss ack 3914213298], length 0
10:53:19.903126 IP 112.26.3.1.37753 > 112.26.3.8.41425: Flags [.], seq 384133:385561, ack 1, win 893, options [nop,nop,TS val 156536 ecr 4294909744,mptcp dss ack 2295998090 seq 3914306118 subseq 384133 len 1428 csum 0x3cf], length 1428
10:53:19.903520 IP 112.26.3.1.37753 > 112.26.3.8.41425: Flags [.], seq 384133:385561, ack 1, win 893, options [nop,nop,TS val 156536 ecr 4294909744,mptcp dss ack 2295998090 seq 3914306118 subseq 384133 len 1428 csum 0x3cf], length 1428
10:53:19.967976 IP 112.26.3.1.37753 > 112.26.3.8.41425: Flags [.], seq 374137:375565, ack 1, win 893, options [nop,nop,TS val 156122 ecr 4294909356,mptcp dss ack 2295998090 seq 3914274702 subseq 374137 len 1428 csum 0xe686], length 1428
10:53:20.009358 IP 112.26.3.8.41425 > 112.26.3.1.37753: Flags [.], ack 381277, win 24467, options [nop,nop,TS val 4294909862 ecr 156122,mptcp dss ack 3914213298], length 0
10:53:20.039878 IP 112.26.3.1.37753 > 112.26.3.8.41425: Flags [.], seq 385561:386989, ack 1, win 893, options [nop,nop,TS val 156652 ecr 4294909862,mptcp dss ack 2295998090 seq 3914313258 subseq 385561 len 1428 csum 0x42a3], length 1428
10:53:20.040153 IP 112.26.3.1.37753 > 112.26.3.8.41425: Flags [.], seq 385561:386989, ack 1, win 893, options [nop,nop,TS val 156652 ecr 4294909862,mptcp dss ack 2295998090 seq 3914313258 subseq 385561 len 1428 csum 0x42a3], length 1428
10:53:20.109560 IP 112.26.3.1.37753 > 112.26.3.8.41425: Flags [.], seq 381277:382705, ack 1, win 893, options [nop,nop,TS val 156287 ecr 4294909462,mptcp dss ack 2295998090 seq 3914297550 subseq 381277 len 1428 csum 0xb9c7], length 1428
10:53:20.137453 IP 112.26.3.8.41425 > 112.26.3.1.37753: Flags [.], ack 382705, win 24467, options [nop,nop,TS val 4294910003 ecr 156287,mptcp dss ack 3914213298], length 0
10:53:20.186302 IP 112.26.3.1.37753 > 112.26.3.8.41425: Flags [.], seq 386989:388417, ack 1, win 893, options [nop,nop,TS val 156780 ecr 4294910003,mptcp dss ack 2295998090 seq 3914318970 subseq 386989 len 1428 csum 0xf83b], length 1428
10:53:20.186652 IP 112.26.3.1.37753 > 112.26.3.8.41425: Flags [.], seq 386989:388417, ack 1, win 893, options [nop,nop,TS val 156780 ecr 4294910003,mptcp dss ack 2295998090 seq 3914318970 subseq 386989 len 1428 csum 0xf83b], length 1428
10:53:20.266728 IP 112.26.3.1.37753 > 112.26.3.8.41425: Flags [.], seq 382705:384133, ack 1, win 893, options [nop,nop,TS val 156404 ecr 4294909613,mptcp dss ack 2295998090 seq 3914301834 subseq 382705 len 1428 csum 0x1fef], length 1428
10:53:20.275553 IP 112.26.3.8.41425 > 112.26.3.1.37753: Flags [.], ack 384133, win 24467, options [nop,nop,TS val 4294910160 ecr 156404,mptcp dss ack 3914213298], length 0
10:53:20.307275 IP 112.26.3.1.37753 > 112.26.3.8.41425: Flags [.], seq 388417:389845, ack 1, win 893, options [nop,nop,TS val 156919 ecr 4294910160,mptcp dss ack 2295998090 seq 3914324682 subseq 388417 len 1428 csum 0xbe65], length 1428
10:53:20.307603 IP 112.26.3.1.37753 > 112.26.3.8.41425: Flags [.], seq 388417:389845, ack 1, win 893, options [nop,nop,TS val 156919 ecr 4294910160,mptcp dss ack 2295998090 seq 3914324682 subseq 388417 len 1428 csum 0xbe65], length 1428
10:53:20.369089 IP 112.26.3.1.37753 > 112.26.3.8.41425: Flags [.], seq 384133:385561, ack 1, win 893, options [nop,nop,TS val 156536 ecr 4294909744,mptcp dss ack 2295998090 seq 3914306118 subseq 384133 len 1428 csum 0x3cf], length 1428
10:53:20.393874 IP 112.26.3.8.41425 > 112.26.3.1.37753: Flags [.], ack 385561, win 24467, options [nop,nop,TS val 4294910263 ecr 156536,mptcp dss ack 3914213298], length 0
10:53:20.403290 IP 112.26.3.1.37753 > 112.26.3.8.41425: Flags [.], seq 389845:391273, ack 1, win 893, options [nop,nop,TS val 157041 ecr 4294910263,mptcp dss ack 2295998090 seq 3914327538 subseq 389845 len 1428 csum 0xb50d], length 1428
10:53:20.403616 IP 112.26.3.1.37753 > 112.26.3.8.41425: Flags [.], seq 389845:391273, ack 1, win 893, options [nop,nop,TS val 157041 ecr 4294910263,mptcp dss ack 2295998090 seq 3914327538 subseq 389845 len 1428 csum 0xb50d], length 1428
10:53:20.489885 IP 112.26.3.1.37753 > 112.26.3.8.41425: Flags [.], seq 385561:386989, ack 1, win 893, options [nop,nop,TS val 156652 ecr 4294909862,mptcp dss ack 2295998090 seq 3914313258 subseq 385561 len 1428 csum 0x42a3], length 1428
10:53:20.508158 IP 112.26.3.8.41425 > 112.26.3.1.37753: Flags [.], ack 386989, win 24267, options [nop,nop,TS val 4294910384 ecr 156652,mptcp dss ack 3914226150], length 0
10:53:20.554507 IP 112.26.3.1.37753 > 112.26.3.8.41425: Flags [.], seq 391273:392701, ack 1, win 893, options [nop,nop,TS val 157041 ecr 4294910263,mptcp dss ack 2295998090 seq 3914328966 subseq 391273 len 1428 csum 0xcb49], length 1428
10:53:20.554803 IP 112.26.3.1.37753 > 112.26.3.8.41425: Flags [.], seq 391273:392701, ack 1, win 893, options [nop,nop,TS val 157041 ecr 4294910263,mptcp dss ack 2295998090 seq 3914328966 subseq 391273 len 1428 csum 0xcb49], length 1428
10:53:20.595542 IP 112.26.3.1.37753 > 112.26.3.8.41425: Flags [.], seq 386989:388417, ack 1, win 893, options [nop,nop,TS val 156780 ecr 4294910003,mptcp dss ack 2295998090 seq 3914318970 subseq 386989 len 1428 csum 0xf83b], length 1428
10:53:20.601997 IP 112.26.3.8.41425 > 112.26.3.1.37753: Flags [.], ack 388417, win 24267, options [nop,nop,TS val 4294910489 ecr 156780,mptcp dss ack 3914226150], length 0
10:53:20.661650 IP 112.26.3.1.37753 > 112.26.3.8.41425: Flags [.], seq 392701:394129, ack 1, win 893, options [nop,nop,TS val 157152 ecr 4294910384,mptcp dss ack 2295998090 seq 3914333250 subseq 392701 len 1428 csum 0x57f7], length 1428
10:53:20.661960 IP 112.26.3.1.37753 > 112.26.3.8.41425: Flags [.], seq 392701:394129, ack 1, win 893, options [nop,nop,TS val 157152 ecr 4294910384,mptcp dss ack 2295998090 seq 3914333250 subseq 392701 len 1428 csum 0x57f7], length 1428
10:53:20.737175 IP 112.26.3.1.37753 > 112.26.3.8.41425: Flags [.], seq 394129:395557, ack 1, win 893, options [nop,nop,TS val 157247 ecr 4294910489,mptcp dss ack 2295998090 seq 3914337534 subseq 394129 len 1428 csum 0xd0db], length 1428
10:53:20.737524 IP 112.26.3.1.37753 > 112.26.3.8.41425: Flags [.], seq 394129:395557, ack 1, win 893, options [nop,nop,TS val 157247 ecr 4294910489,mptcp dss ack 2295998090 seq 3914337534 subseq 394129 len 1428 csum 0xd0db], length 1428
10:53:20.781632 IP 112.26.3.1.37753 > 112.26.3.8.41425: Flags [.], seq 388417:389845, ack 1, win 893, options [nop,nop,TS val 156919 ecr 4294910160,mptcp dss ack 2295998090 seq 3914324682 subseq 388417 len 1428 csum 0xbe65], length 1428
10:53:20.794487 IP 112.26.3.8.41425 > 112.26.3.1.37753: Flags [.], ack 389845, win 24267, options [nop,nop,TS val 4294910675 ecr 156919,mptcp dss ack 3914226150], length 0
10:53:20.851962 IP 112.26.3.1.37753 > 112.26.3.8.41425: Flags [.], seq 395557:396985, ack 1, win 893, options [nop,nop,TS val 157441 ecr 4294910675,mptcp dss ack 2295998090 seq 3914344674 subseq 395557 len 1428 csum 0xfeda], length 1428
10:53:20.852295 IP 112.26.3.1.37753 > 112.26.3.8.41425: Flags [.], seq 395557:396985, ack 1, win 893, options [nop,nop,TS val 157441 ecr 4294910675,mptcp dss ack 2295998090 seq 3914344674 subseq 395557 len 1428 csum 0xfeda], length 1428
10:53:20.918085 IP 112.26.3.1.37753 > 112.26.3.8.41425: Flags [.], seq 389845:391273, ack 1, win 893, options [nop,nop,TS val 157041 ecr 4294910263,mptcp dss ack 2295998090 seq 3914327538 subseq 389845 len 1428 csum 0xb50d], length 1428
10:53:20.920891 IP 112.26.3.8.41425 > 112.26.3.1.37753: Flags [.], ack 391273, win 24267, options [nop,nop,TS val 4294910806 ecr 157041,mptcp dss ack 3914226150], length 0
10:53:20.944349 IP 112.26.3.1.37753 > 112.26.3.8.41425: Flags [.], seq 396985:398413, ack 1, win 893, options [nop,nop,TS val 157566 ecr 4294910806,mptcp dss ack 2295998090 seq 3914348958 subseq 396985 len 1428 csum 0x3def], length 1428
10:53:20.944724 IP 112.26.3.1.37753 > 112.26.3.8.41425: Flags [.], seq 396985:398413, ack 1, win 893, options [nop,nop,TS val 157566 ecr 4294910806,mptcp dss ack 2295998090 seq 3914348958 subseq 396985 len 1428 csum 0x3def], length 1428
10:53:21.048566 IP 112.26.3.1.37753 > 112.26.3.8.41425: Flags [.], seq 391273:392701, ack 1, win 893, options [nop,nop,TS val 157041 ecr 4294910263,mptcp dss ack 2295998090 seq 3914328966 subseq 391273 len 1428 csum 0xcb49], length 1428
10:53:21.055966 IP 112.26.3.8.41425 > 112.26.3.1.37753: Flags [.], ack 392701, win 24267, options [nop,nop,TS val 4294910942 ecr 157041,mptcp dss ack 3914226150], length 0
10:53:21.095052 IP 112.26.3.1.37753 > 112.26.3.8.41425: Flags [.], seq 398413:399841, ack 1, win 893, options [nop,nop,TS val 157699 ecr 4294910942,mptcp dss ack 2295998090 seq 3914353242 subseq 398413 len 1428 csum 0x258e], length 1428
10:53:21.095400 IP 112.26.3.1.37753 > 112.26.3.8.41425: Flags [.], seq 398413:399841, ack 1, win 893, options [nop,nop,TS val 157699 ecr 4294910942,mptcp dss ack 2295998090 seq 3914353242 subseq 398413 len 1428 csum 0x258e], length 1428
10:53:21.172971 IP 112.26.3.1.37753 > 112.26.3.8.41425: Flags [.], seq 392701:394129, ack 1, win 893, options [nop,nop,TS val 157152 ecr 4294910384,mptcp dss ack 2295998090 seq 3914333250 subseq 392701 len 1428 csum 0x57f7], length 1428
10:53:21.185559 IP 112.26.3.8.41425 > 112.26.3.1.37753: Flags [.], ack 394129, win 24267, options [nop,nop,TS val 4294911067 ecr 157152,mptcp dss ack 3914226150], length 0
10:53:21.227269 IP 112.26.3.1.37753 > 112.26.3.8.41425: Flags [.], seq 399841:401269, ack 1, win 893, options [nop,nop,TS val 157829 ecr 4294911067,mptcp dss ack 2295998090 seq 3914358954 subseq 399841 len 1428 csum 0xf904], length 1428
10:53:21.227656 IP 112.26.3.1.37753 > 112.26.3.8.41425: Flags [.], seq 399841:401269, ack 1, win 893, options [nop,nop,TS val 157829 ecr 4294911067,mptcp dss ack 2295998090 seq 3914358954 subseq 399841 len 1428 csum 0xf904], length 1428
10:53:21.316152 IP 112.26.3.1.37753 > 112.26.3.8.41425: Flags [.], seq 394129:395557, ack 1, win 893, options [nop,nop,TS val 157247 ecr 4294910489,mptcp dss ack 2295998090 seq 3914337534 subseq 394129 len 1428 csum 0xd0db], length 1428
10:53:21.335310 IP 112.26.3.8.41425 > 112.26.3.1.37753: Flags [.], ack 395557, win 24267, options [nop,nop,TS val 4294911210 ecr 157247,mptcp dss ack 3914226150], length 0
10:53:21.366052 IP 112.26.3.1.37753 > 112.26.3.8.41425: Flags [.], seq 401269:402697, ack 1, win 893, options [nop,nop,TS val 157983 ecr 4294911210,mptcp dss ack 2295998090 seq 3914366094 subseq 401269 len 1428 csum 0x6a82], length 1428
10:53:21.366385 IP 112.26.3.1.37753 > 112.26.3.8.41425: Flags [.], seq 401269:402697, ack 1, win 893, options [nop,nop,TS val 157983 ecr 4294911210,mptcp dss ack 2295998090 seq 3914366094 subseq 401269 len 1428 csum 0x6a82], length 1428
10:53:21.452891 IP 112.26.3.1.37753 > 112.26.3.8.41425: Flags [.], seq 395557:396985, ack 1, win 893, options [nop,nop,TS val 157441 ecr 4294910675,mptcp dss ack 2295998090 seq 3914344674 subseq 395557 len 1428 csum 0xfeda], length 1428
10:53:21.462089 IP 112.26.3.8.41425 > 112.26.3.1.37753: Flags [.], ack 396985, win 24267, options [nop,nop,TS val 4294911347 ecr 157441,mptcp dss ack 3914226150], length 0
10:53:21.491448 IP 112.26.3.1.37753 > 112.26.3.8.41425: Flags [.], seq 402697:404125, ack 1, win 893, options [nop,nop,TS val 158111 ecr 4294911347,mptcp dss ack 2295998090 seq 3914370378 subseq 402697 len 1428 csum 0x9727], length 1428
10:53:21.491829 IP 112.26.3.1.37753 > 112.26.3.8.41425: Flags [.], seq 402697:404125, ack 1, win 893, options [nop,nop,TS val 158111 ecr 4294911347,mptcp dss ack 2295998090 seq 3914370378 subseq 402697 len 1428 csum 0x9727], length 1428
10:53:21.605412 IP 112.26.3.1.37753 > 112.26.3.8.41425: Flags [.], seq 396985:398413, ack 1, win 893, options [nop,nop,TS val 157566 ecr 4294910806,mptcp dss ack 2295998090 seq 3914348958 subseq 396985 len 1428 csum 0x3def], length 1428
10:53:21.612227 IP 112.26.3.8.41425 > 112.26.3.1.37753: Flags [.], ack 398413, win 24267, options [nop,nop,TS val 4294911499 ecr 157566,mptcp dss ack 3914226150], length 0
10:53:21.684680 IP 112.26.3.1.37753 > 112.26.3.8.41425: Flags [.], seq 404125:405553, ack 1, win 893, options [nop,nop,TS val 158256 ecr 4294911499,mptcp dss ack 2295998090 seq 3914376090 subseq 404125 len 1428 csum 0x5b9d], length 1428
10:53:21.685034 IP 112.26.3.1.37753 > 112.26.3.8.41425: Flags [.], seq 404125:405553, ack 1, win 893, options [nop,nop,TS val 158256 ecr 4294911499,mptcp dss ack 2295998090 seq 3914376090 subseq 404125 len 1428 csum 0x5b9d], length 1428
10:53:21.727750 IP 112.26.3.1.37753 > 112.26.3.8.41425: Flags [.], seq 398413:399841, ack 1, win 893, options [nop,nop,TS val 157699 ecr 4294910942,mptcp dss ack 2295998090 seq 3914353242 subseq 398413 len 1428 csum 0x258e], length 1428
10:53:21.762100 IP 112.26.3.8.41425 > 112.26.3.1.37753: Flags [.], ack 399841, win 24257, options [nop,nop,TS val 4294911622 ecr 157699,mptcp dss ack 3914317542], length 0
10:53:21.787689 IP 112.26.3.1.37753 > 112.26.3.8.41425: Flags [.], seq 405553:406981, ack 1, win 893, options [nop,nop,TS val 158406 ecr 4294911622,mptcp dss ack 2295998090 seq 3914383230 subseq 405553 len 1428 csum 0xdf8d], length 1428
10:53:21.788046 IP 112.26.3.1.37753 > 112.26.3.8.41425: Flags [.], seq 405553:406981, ack 1, win 893, options [nop,nop,TS val 158406 ecr 4294911622,mptcp dss ack 2295998090 seq 3914383230 subseq 405553 len 1428 csum 0xdf8d], length 1428
10:53:21.880627 IP 112.26.3.1.37753 > 112.26.3.8.41425: Flags [.], seq 399841:401269, ack 1, win 893, options [nop,nop,TS val 157829 ecr 4294911067,mptcp dss ack 2295998090 seq 3914358954 subseq 399841 len 1428 csum 0xf904], length 1428
10:53:21.929625 IP 112.26.3.8.41425 > 112.26.3.1.37753: Flags [.], ack 401269, win 24525, options [nop,nop,TS val 4294911815 ecr 157829,mptcp dss ack 3914357526], length 0
10:53:21.946215 IP 112.26.3.1.37753 > 112.26.3.8.41425: Flags [.], seq 406981:408409, ack 1, win 893, options [nop,nop,TS val 158576 ecr 4294911815,mptcp dss ack 2295998090 seq 3914390370 subseq 406981 len 1428 csum 0xb78f], length 1428
10:53:21.946563 IP 112.26.3.1.37753 > 112.26.3.8.41425: Flags [.], seq 406981:408409, ack 1, win 893, options [nop,nop,TS val 158576 ecr 4294911815,mptcp dss ack 2295998090 seq 3914390370 subseq 406981 len 1428 csum 0xb78f], length 1428
10:53:21.986986 IP 112.26.3.1.37753 > 112.26.3.8.41425: Flags [.], seq 401269:402697, ack 1, win 893, options [nop,nop,TS val 157983 ecr 4294911210,mptcp dss ack 2295998090 seq 3914366094 subseq 401269 len 1428 csum 0x6a82], length 1428
10:53:22.056133 IP 112.26.3.1.37753 > 112.26.3.8.41425: Flags [.], seq 402697:404125, ack 1, win 893, options [nop,nop,TS val 158111 ecr 4294911347,mptcp dss ack 2295998090 seq 3914370378 subseq 402697 len 1428 csum 0x9727], length 1428
10:53:22.097591 IP 112.26.3.8.41425 > 112.26.3.1.37753: Flags [.], ack 404125, win 24522, options [nop,nop,TS val 4294911950 ecr 157983,mptcp dss ack 3914363238], length 0
10:53:22.198406 IP 112.26.3.1.37753 > 112.26.3.8.41425: Flags [.], seq 404125:405553, ack 1, win 893, options [nop,nop,TS val 158256 ecr 4294911499,mptcp dss ack 2295998090 seq 3914376090 subseq 404125 len 1428 csum 0x5b9d], length 1428
10:53:22.216942 IP 112.26.3.1.37753 > 112.26.3.8.41425: Flags [.], seq 409837:411265, ack 1, win 893, options [nop,nop,TS val 158741 ecr 4294911950,mptcp dss ack 2295998090 seq 3914400366 subseq 409837 len 1428 csum 0xd595], length 1428
10:53:22.217286 IP 112.26.3.1.37753 > 112.26.3.8.41425: Flags [.], seq 409837:411265, ack 1, win 893, options [nop,nop,TS val 158741 ecr 4294911950,mptcp dss ack 2295998090 seq 3914400366 subseq 409837 len 1428 csum 0xd595], length 1428
10:53:22.300740 IP 112.26.3.1.37753 > 112.26.3.8.41425: Flags [.], seq 405553:406981, ack 1, win 893, options [nop,nop,TS val 158406 ecr 4294911622,mptcp dss ack 2295998090 seq 3914383230 subseq 405553 len 1428 csum 0xdf8d], length 1428
10:53:22.309477 IP 112.26.3.8.41425 > 112.26.3.1.37753: Flags [.], ack 406981, win 24473, options [nop,nop,TS val 4294912195 ecr 158256,mptcp dss ack 3914373234], length 0
10:53:22.417635 IP 112.26.3.1.37753 > 112.26.3.8.41425: Flags [.], seq 406981:408409, ack 1, win 893, options [nop,nop,TS val 158576 ecr 4294911815,mptcp dss ack 2295998090 seq 3914390370 subseq 406981 len 1428 csum 0xb78f], length 1428
10:53:22.444215 IP 112.26.3.1.37753 > 112.26.3.8.41425: Flags [.], seq 411265:412693, ack 1, win 893, options [nop,nop,TS val 158953 ecr 4294912195,mptcp dss ack 2295998090 seq 3914406078 subseq 411265 len 1428 csum 0x2a61], length 1428
10:53:22.444548 IP 112.26.3.1.37753 > 112.26.3.8.41425: Flags [.], seq 411265:412693, ack 1, win 893, options [nop,nop,TS val 158953 ecr 4294912195,mptcp dss ack 2295998090 seq 3914406078 subseq 411265 len 1428 csum 0x2a61], length 1428
10:53:22.448003 IP 112.26.3.1.37753 > 112.26.3.8.41425: Flags [.], seq 412693:414121, ack 1, win 893, options [nop,nop,TS val 158953 ecr 4294912195,mptcp dss ack 2295998090 seq 3914407506 subseq 412693 len 1428 csum 0x1706], length 1428
10:53:22.448342 IP 112.26.3.1.37753 > 112.26.3.8.41425: Flags [.], seq 412693:414121, ack 1, win 893, options [nop,nop,TS val 158953 ecr 4294912195,mptcp dss ack 2295998090 seq 3914407506 subseq 412693 len 1428 csum 0x1706], length 1428
10:53:22.535096 IP 112.26.3.8.41425 > 112.26.3.1.37753: Flags [.], ack 408409, win 24458, options [nop,nop,TS val 4294912424 ecr 158576,mptcp dss ack 3914381802], length 0
10:53:22.544068 IP 112.26.3.1.37753 > 112.26.3.8.41425: Flags [.], seq 409837:411265, ack 1, win 893, options [nop,nop,TS val 158741 ecr 4294911950,mptcp dss ack 2295998090 seq 3914400366 subseq 409837 len 1428 csum 0xd595], length 1428
10:53:22.570229 IP 112.26.3.1.37753 > 112.26.3.8.41425: Flags [.], seq 414121:415549, ack 1, win 893, options [nop,nop,TS val 158953 ecr 4294912195,mptcp dss ack 2295998090 seq 3914408934 subseq 414121 len 1428 csum 0x39ac], length 1428
10:53:22.570547 IP 112.26.3.1.37753 > 112.26.3.8.41425: Flags [.], seq 414121:415549, ack 1, win 893, options [nop,nop,TS val 158953 ecr 4294912195,mptcp dss ack 2295998090 seq 3914408934 subseq 414121 len 1428 csum 0x39ac], length 1428
10:53:22.633406 IP 112.26.3.1.37753 > 112.26.3.8.41425: Flags [.], seq 411265:412693, ack 1, win 893, options [nop,nop,TS val 158953 ecr 4294912195,mptcp dss ack 2295998090 seq 3914406078 subseq 411265 len 1428 csum 0x2a61], length 1428
10:53:22.659210 IP 112.26.3.8.41425 > 112.26.3.1.37753: Flags [.], ack 408409, win 24458, options [nop,nop,TS val 4294912438 ecr 158576,nop,nop,sack 1 {409837:411265},mptcp dss ack 3914381802], length 0
10:53:22.671639 IP 112.26.3.1.37753 > 112.26.3.8.41425: Flags [.], seq 415549:416977, ack 1, win 893, options [nop,nop,TS val 159178 ecr 4294912424,mptcp dss ack 2295998090 seq 3914420358 subseq 415549 len 1428 csum 0xf06b], length 1428
10:53:22.671901 IP 112.26.3.1.37753 > 112.26.3.8.41425: Flags [.], seq 415549:416977, ack 1, win 893, options [nop,nop,TS val 159178 ecr 4294912424,mptcp dss ack 2295998090 seq 3914420358 subseq 415549 len 1428 csum 0xf06b], length 1428
10:53:22.759317 IP 112.26.3.8.41425 > 112.26.3.1.37753: Flags [.], ack 408409, win 24507, options [nop,nop,TS val 4294912527 ecr 158576,nop,nop,sack 1 {409837:412693},mptcp dss ack 3914388942], length 0
10:53:22.762568 IP 112.26.3.1.37753 > 112.26.3.8.41425: Flags [.], seq 416977:418405, ack 1, win 893, options [nop,nop,TS val 159338 ecr 4294912438,mptcp dss ack 2295998090 seq 3914427498 subseq 416977 len 1428 csum 0x5c0d], length 1428
10:53:22.762877 IP 112.26.3.1.37753 > 112.26.3.8.41425: Flags [.], seq 416977:418405, ack 1, win 893, options [nop,nop,TS val 159338 ecr 4294912438,mptcp dss ack 2295998090 seq 3914427498 subseq 416977 len 1428 csum 0x5c0d], length 1428
10:53:22.795026 IP 112.26.3.1.37753 > 112.26.3.8.41425: Flags [.], seq 412693:414121, ack 1, win 893, options [nop,nop,TS val 158953 ecr 4294912195,mptcp dss ack 2295998090 seq 3914407506 subseq 412693 len 1428 csum 0x1706], length 1428
10:53:22.902379 IP 112.26.3.1.37753 > 112.26.3.8.41425: Flags [.], seq 418405:419833, ack 1, win 893, options [nop,nop,TS val 159450 ecr 4294912527,mptcp dss ack 2295998090 seq 3914431782 subseq 418405 len 1428 csum 0xffe3], length 1428
10:53:22.902747 IP 112.26.3.1.37753 > 112.26.3.8.41425: Flags [.], seq 418405:419833, ack 1, win 893, options [nop,nop,TS val 159450 ecr 4294912527,mptcp dss ack 2295998090 seq 3914431782 subseq 418405 len 1428 csum 0xffe3], length 1428
10:53:22.903932 IP 112.26.3.8.41425 > 112.26.3.1.37753: Flags [.], ack 408409, win 24507, options [nop,nop,TS val 4294912689 ecr 158576,nop,nop,sack 1 {409837:414121},mptcp dss ack 3914393226], length 0
10:53:22.919350 IP 112.26.3.1.37753 > 112.26.3.8.41425: Flags [.], seq 414121:415549, ack 1, win 893, options [nop,nop,TS val 158953 ecr 4294912195,mptcp dss ack 2295998090 seq 3914408934 subseq 414121 len 1428 csum 0x39ac], length 1428
10:53:22.971531 IP 112.26.3.1.37753 > 112.26.3.8.41425: Flags [.], seq 408409:409837, ack 1, win 893, options [nop,nop,TS val 159592 ecr 4294912689,mptcp dss ack 2295998090 seq 3914398938 subseq 408409 len 1428 csum 0x63ad], length 1428
10:53:22.971852 IP 112.26.3.1.37753 > 112.26.3.8.41425: Flags [.], seq 408409:409837, ack 1, win 893, options [nop,nop,TS val 159592 ecr 4294912689,mptcp dss ack 2295998090 seq 3914398938 subseq 408409 len 1428 csum 0x63ad], length 1428
10:53:22.998601 IP 112.26.3.8.41425 > 112.26.3.1.37753: Flags [.], ack 408409, win 24504, options [nop,nop,TS val 4294912813 ecr 158576,nop,nop,sack 1 {409837:415549},mptcp dss ack 3914398938], length 0
10:53:23.064924 IP 112.26.3.1.37753 > 112.26.3.8.41425: Flags [.], seq 415549:416977, ack 1, win 893, options [nop,nop,TS val 159178 ecr 4294912424,mptcp dss ack 2295998090 seq 3914420358 subseq 415549 len 1428 csum 0xf06b], length 1428
10:53:23.081469 IP 112.26.3.8.41425 > 112.26.3.1.37753: Flags [.], ack 408409, win 24504, options [nop,nop,TS val 4294912958 ecr 158576,nop,nop,sack 1 {409837:416977},mptcp dss ack 3914398938], length 0
10:53:23.131746 IP 112.26.3.1.37753 > 112.26.3.8.41425: Flags [.], seq 419833:421261, ack 1, win 893, options [nop,nop,TS val 159770 ecr 4294912958,mptcp dss ack 2295998090 seq 3914443206 subseq 419833 len 1428 csum 0xc735], length 1428
10:53:23.132068 IP 112.26.3.1.37753 > 112.26.3.8.41425: Flags [.], seq 419833:421261, ack 1, win 893, options [nop,nop,TS val 159770 ecr 4294912958,mptcp dss ack 2295998090 seq 3914443206 subseq 419833 len 1428 csum 0xc735], length 1428
10:53:23.165489 IP 112.26.3.1.37753 > 112.26.3.8.41425: Flags [.], seq 416977:418405, ack 1, win 893, options [nop,nop,TS val 159338 ecr 4294912438,mptcp dss ack 2295998090 seq 3914427498 subseq 416977 len 1428 csum 0x5c0d], length 1428
10:53:23.202920 IP 112.26.3.8.41425 > 112.26.3.1.37753: Flags [.], ack 408409, win 24504, options [nop,nop,TS val 4294913051 ecr 158576,nop,nop,sack 1 {409837:418405},mptcp dss ack 3914398938], length 0
10:53:23.226336 IP 112.26.3.1.37753 > 112.26.3.8.41425: Flags [.], seq 421261:422689, ack 1, win 893, options [nop,nop,TS val 159860 ecr 4294913051,mptcp dss ack 2295998090 seq 3914447490 subseq 421261 len 1428 csum 0x4fae], length 1428
10:53:23.226599 IP 112.26.3.1.37753 > 112.26.3.8.41425: Flags [.], seq 421261:422689, ack 1, win 893, options [nop,nop,TS val 159860 ecr 4294913051,mptcp dss ack 2295998090 seq 3914447490 subseq 421261 len 1428 csum 0x4fae], length 1428
10:53:23.268158 IP 112.26.3.1.37753 > 112.26.3.8.41425: Flags [.], seq 418405:419833, ack 1, win 893, options [nop,nop,TS val 159450 ecr 4294912527,mptcp dss ack 2295998090 seq 3914431782 subseq 418405 len 1428 csum 0xffe3], length 1428
10:53:23.361211 IP 112.26.3.8.41425 > 112.26.3.1.37753: Flags [.], ack 408409, win 24504, options [nop,nop,TS val 4294913162 ecr 158576,nop,nop,sack 1 {409837:419833},mptcp dss ack 3914398938], length 0
10:53:23.373559 IP 112.26.3.1.37753 > 112.26.3.8.41425: Flags [.], seq 408409:409837, ack 1, win 893, options [nop,nop,TS val 159592 ecr 4294912689,mptcp dss ack 2295998090 seq 3914398938 subseq 408409 len 1428 csum 0x63ad], length 1428
10:53:23.447167 IP 112.26.3.1.37753 > 112.26.3.8.41425: Flags [.], seq 422689:424117, ack 1, win 893, options [nop,nop,TS val 160085 ecr 4294913162,mptcp dss ack 2295998090 seq 3914460342 subseq 422689 len 1428 csum 0x9798], length 1428
10:53:23.447511 IP 112.26.3.1.37753 > 112.26.3.8.41425: Flags [.], seq 422689:424117, ack 1, win 893, options [nop,nop,TS val 160085 ecr 4294913162,mptcp dss ack 2295998090 seq 3914460342 subseq 422689 len 1428 csum 0x9798], length 1428
10:53:23.461504 IP 112.26.3.8.41425 > 112.26.3.1.37753: Flags [.], ack 419833, win 24214, options [nop,nop,TS val 4294913268 ecr 159592,mptcp dss ack 3914417502], length 0
10:53:23.546038 IP 112.26.3.1.37753 > 112.26.3.8.41425: Flags [.], seq 419833:421261, ack 1, win 893, options [nop,nop,TS val 159770 ecr 4294912958,mptcp dss ack 2295998090 seq 3914443206 subseq 419833 len 1428 csum 0xc735], length 1428
10:53:23.559229 IP 112.26.3.1.37753 > 112.26.3.8.41425: Flags [.], seq 424117:425545, ack 1, win 893, options [nop,nop,TS val 160125 ecr 4294913268,mptcp dss ack 2295998090 seq 3914463198 subseq 424117 len 1428 csum 0x8a60], length 1428
10:53:23.559435 IP 112.26.3.1.37753 > 112.26.3.8.41425: Flags [.], seq 424117:425545, ack 1, win 893, options [nop,nop,TS val 160125 ecr 4294913268,mptcp dss ack 2295998090 seq 3914463198 subseq 424117 len 1428 csum 0x8a60], length 1428
10:53:23.616531 IP 112.26.3.8.41425 > 112.26.3.1.37753: Flags [.], ack 421261, win 24455, options [nop,nop,TS val 4294913440 ecr 159770,mptcp dss ack 3914426070], length 0
10:53:23.648173 IP 112.26.3.1.37753 > 112.26.3.8.41425: Flags [.], seq 425545:426973, ack 1, win 893, options [nop,nop,TS val 160260 ecr 4294913440,mptcp dss ack 2295998090 seq 3914470338 subseq 425545 len 1428 csum 0x2faf], length 1428
10:53:23.648499 IP 112.26.3.1.37753 > 112.26.3.8.41425: Flags [.], seq 425545:426973, ack 1, win 893, options [nop,nop,TS val 160260 ecr 4294913440,mptcp dss ack 2295998090 seq 3914470338 subseq 425545 len 1428 csum 0x2faf], length 1428
10:53:23.663123 IP 112.26.3.1.37753 > 112.26.3.8.41425: Flags [.], seq 421261:422689, ack 1, win 893, options [nop,nop,TS val 159860 ecr 4294913051,mptcp dss ack 2295998090 seq 3914447490 subseq 421261 len 1428 csum 0x4fae], length 1428
10:53:23.754109 IP 112.26.3.8.41425 > 112.26.3.1.37753: Flags [.], ack 422689, win 24442, options [nop,nop,TS val 4294913539 ecr 159860,mptcp dss ack 3914430354], length 0
10:53:23.758812 IP 112.26.3.1.37753 > 112.26.3.8.41425: Flags [.], seq 422689:424117, ack 1, win 893, options [nop,nop,TS val 160085 ecr 4294913162,mptcp dss ack 2295998090 seq 3914460342 subseq 422689 len 1428 csum 0x9798], length 1428
10:53:23.769701 IP 112.26.3.1.37753 > 112.26.3.8.41425: Flags [.], seq 426973:428401, ack 1, win 893, options [nop,nop,TS val 160260 ecr 4294913440,mptcp dss ack 2295998090 seq 3914471766 subseq 426973 len 1428 csum 0xa543], length 1428
10:53:23.770094 IP 112.26.3.1.37753 > 112.26.3.8.41425: Flags [.], seq 426973:428401, ack 1, win 893, options [nop,nop,TS val 160260 ecr 4294913440,mptcp dss ack 2295998090 seq 3914471766 subseq 426973 len 1428 csum 0xa543], length 1428
10:53:23.829551 IP 112.26.3.8.41425 > 112.26.3.1.37753: Flags [.], ack 424117, win 24440, options [nop,nop,TS val 4294913639 ecr 160085,mptcp dss ack 3914436066], length 0
10:53:23.843433 IP 112.26.3.1.37753 > 112.26.3.8.41425: Flags [.], seq 428401:429829, ack 1, win 893, options [nop,nop,TS val 160399 ecr 4294913539,mptcp dss ack 2295998090 seq 3914481762 subseq 428401 len 1428 csum 0x69e5], length 1428
10:53:23.843739 IP 112.26.3.1.37753 > 112.26.3.8.41425: Flags [.], seq 428401:429829, ack 1, win 893, options [nop,nop,TS val 160399 ecr 4294913539,mptcp dss ack 2295998090 seq 3914481762 subseq 428401 len 1428 csum 0x69e5], length 1428
10:53:23.885039 IP 112.26.3.1.37753 > 112.26.3.8.41425: Flags [.], seq 424117:425545, ack 1, win 893, options [nop,nop,TS val 160125 ecr 4294913268,mptcp dss ack 2295998090 seq 3914463198 subseq 424117 len 1428 csum 0x8a60], length 1428
10:53:23.910874 IP 112.26.3.1.37753 > 112.26.3.8.41425: Flags [.], seq 429829:431257, ack 1, win 893, options [nop,nop,TS val 160511 ecr 4294913639,mptcp dss ack 2295998090 seq 3914483190 subseq 429829 len 1428 csum 0x1d69], length 1428
10:53:23.911160 IP 112.26.3.1.37753 > 112.26.3.8.41425: Flags [.], seq 429829:431257, ack 1, win 893, options [nop,nop,TS val 160511 ecr 4294913639,mptcp dss ack 2295998090 seq 3914483190 subseq 429829 len 1428 csum 0x1d69], length 1428
10:53:23.921308 IP 112.26.3.8.41425 > 112.26.3.1.37753: Flags [.], ack 425545, win 24433, options [nop,nop,TS val 4294913779 ecr 160125,mptcp dss ack 3914441778], length 0
10:53:23.993336 IP 112.26.3.1.37753 > 112.26.3.8.41425: Flags [.], seq 431257:432685, ack 1, win 893, options [nop,nop,TS val 160607 ecr 4294913779,mptcp dss ack 2295998090 seq 3914488902 subseq 431257 len 1428 csum 0xdcb3], length 1428
10:53:23.993681 IP 112.26.3.1.37753 > 112.26.3.8.41425: Flags [.], seq 431257:432685, ack 1, win 893, options [nop,nop,TS val 160607 ecr 4294913779,mptcp dss ack 2295998090 seq 3914488902 subseq 431257 len 1428 csum 0xdcb3], length 1428
10:53:24.006163 IP 112.26.3.1.37753 > 112.26.3.8.41425: Flags [.], seq 425545:426973, ack 1, win 893, options [nop,nop,TS val 160260 ecr 4294913440,mptcp dss ack 2295998090 seq 3914470338 subseq 425545 len 1428 csum 0x2faf], length 1428
10:53:24.032533 IP 112.26.3.8.41425 > 112.26.3.1.37753: Flags [.], ack 426973, win 24393, options [nop,nop,TS val 4294913900 ecr 160260,mptcp dss ack 3914448918], length 0
10:53:24.077200 IP 112.26.3.1.37753 > 112.26.3.8.41425: Flags [P.], seq 432685:434113, ack 1, win 893, options [nop,nop,TS val 160682 ecr 4294913900,mptcp dss ack 2295998090 seq 3914494614 subseq 432685 len 1428 csum 0x3ed0], length 1428
10:53:24.077567 IP 112.26.3.1.37753 > 112.26.3.8.41425: Flags [P.], seq 432685:434113, ack 1, win 893, options [nop,nop,TS val 160682 ecr 4294913900,mptcp dss ack 2295998090 seq 3914494614 subseq 432685 len 1428 csum 0x3ed0], length 1428
10:53:24.151250 IP 112.26.3.1.37753 > 112.26.3.8.41425: Flags [.], seq 426973:428401, ack 1, win 893, options [nop,nop,TS val 160260 ecr 4294913440,mptcp dss ack 2295998090 seq 3914471766 subseq 426973 len 1428 csum 0xa543], length 1428
10:53:24.152988 IP 112.26.3.8.41425 > 112.26.3.1.37753: Flags [.], ack 428401, win 24424, options [nop,nop,TS val 4294914037 ecr 160260,mptcp dss ack 3914458914], length 0
10:53:24.198497 IP 112.26.3.1.37753 > 112.26.3.8.41425: Flags [.], seq 434113:435541, ack 1, win 893, options [nop,nop,TS val 160797 ecr 4294914037,mptcp dss ack 2295998090 seq 3914500326 subseq 434113 len 1428 csum 0x7c9d], length 1428
10:53:24.198841 IP 112.26.3.1.37753 > 112.26.3.8.41425: Flags [.], seq 434113:435541, ack 1, win 893, options [nop,nop,TS val 160797 ecr 4294914037,mptcp dss ack 2295998090 seq 3914500326 subseq 434113 len 1428 csum 0x7c9d], length 1428
10:53:24.260351 IP 112.26.3.1.37753 > 112.26.3.8.41425: Flags [.], seq 428401:429829, ack 1, win 893, options [nop,nop,TS val 160399 ecr 4294913539,mptcp dss ack 2295998090 seq 3914481762 subseq 428401 len 1428 csum 0x69e5], length 1428
10:53:24.263696 IP 112.26.3.8.41425 > 112.26.3.1.37753: Flags [.], ack 429829, win 24458, options [nop,nop,TS val 4294914154 ecr 160399,mptcp dss ack 3914466054], length 0
10:53:24.329034 IP 112.26.3.1.37753 > 112.26.3.8.41425: Flags [.], seq 435541:436969, ack 1, win 893, options [nop,nop,TS val 160797 ecr 4294914037,mptcp dss ack 2295998090 seq 3914501754 subseq 435541 len 1428 csum 0x5f0c], length 1428
10:53:24.329399 IP 112.26.3.1.37753 > 112.26.3.8.41425: Flags [.], seq 435541:436969, ack 1, win 893, options [nop,nop,TS val 160797 ecr 4294914037,mptcp dss ack 2295998090 seq 3914501754 subseq 435541 len 1428 csum 0x5f0c], length 1428
10:53:24.363949 IP 112.26.3.1.37753 > 112.26.3.8.41425: Flags [.], seq 429829:431257, ack 1, win 893, options [nop,nop,TS val 160511 ecr 4294913639,mptcp dss ack 2295998090 seq 3914483190 subseq 429829 len 1428 csum 0x1d69], length 1428
10:53:24.394529 IP 112.26.3.1.37753 > 112.26.3.8.41425: Flags [.], seq 436969:438397, ack 1, win 893, options [nop,nop,TS val 160907 ecr 4294914154,mptcp dss ack 2295998090 seq 3914508894 subseq 436969 len 1428 csum 0x5bb3], length 1428
10:53:24.394822 IP 112.26.3.1.37753 > 112.26.3.8.41425: Flags [.], seq 436969:438397, ack 1, win 893, options [nop,nop,TS val 160907 ecr 4294914154,mptcp dss ack 2295998090 seq 3914508894 subseq 436969 len 1428 csum 0x5bb3], length 1428
10:53:24.423056 IP 112.26.3.8.41425 > 112.26.3.1.37753: Flags [.], ack 431257, win 24473, options [nop,nop,TS val 4294914258 ecr 160511,mptcp dss ack 3914473194], length 0
10:53:24.466019 IP 112.26.3.1.37753 > 112.26.3.8.41425: Flags [.], seq 438397:439825, ack 1, win 893, options [nop,nop,TS val 161067 ecr 4294914258,mptcp dss ack 2295998090 seq 3914521746 subseq 438397 len 1428 csum 0xbbc4], length 1428
10:53:24.466359 IP 112.26.3.1.37753 > 112.26.3.8.41425: Flags [.], seq 438397:439825, ack 1, win 893, options [nop,nop,TS val 161067 ecr 4294914258,mptcp dss ack 2295998090 seq 3914521746 subseq 438397 len 1428 csum 0xbbc4], length 1428
10:53:24.499385 IP 112.26.3.8.41425 > 112.26.3.1.37753: Flags [.], ack 432685, win 24451, options [nop,nop,TS val 4294914385 ecr 160607,mptcp dss ack 3914474622], length 0
10:53:24.501588 IP 112.26.3.1.37753 > 112.26.3.8.41425: Flags [.], seq 431257:432685, ack 1, win 893, options [nop,nop,TS val 160607 ecr 4294913779,mptcp dss ack 2295998090 seq 3914488902 subseq 431257 len 1428 csum 0xdcb3], length 1428
10:53:24.598298 IP 112.26.3.1.37753 > 112.26.3.8.41425: Flags [.], seq 439825:441253, ack 1, win 893, options [nop,nop,TS val 161169 ecr 4294914385,mptcp dss ack 2295998090 seq 3914523174 subseq 439825 len 1428 csum 0x1b7c], length 1428
10:53:24.598672 IP 112.26.3.1.37753 > 112.26.3.8.41425: Flags [.], seq 439825:441253, ack 1, win 893, options [nop,nop,TS val 161169 ecr 4294914385,mptcp dss ack 2295998090 seq 3914523174 subseq 439825 len 1428 csum 0x1b7c], length 1428
10:53:24.610299 IP 112.26.3.1.37753 > 112.26.3.8.41425: Flags [P.], seq 432685:434113, ack 1, win 893, options [nop,nop,TS val 160682 ecr 4294913900,mptcp dss ack 2295998090 seq 3914494614 subseq 432685 len 1428 csum 0x3ed0], length 1428
10:53:24.616294 IP 112.26.3.8.41425 > 112.26.3.1.37753: Flags [.], ack 434113, win 24422, options [nop,nop,TS val 4294914497 ecr 160682,mptcp dss ack 3914478906], length 0
10:53:24.732434 IP 112.26.3.1.37753 > 112.26.3.8.41425: Flags [.], seq 434113:435541, ack 1, win 893, options [nop,nop,TS val 160797 ecr 4294914037,mptcp dss ack 2295998090 seq 3914500326 subseq 434113 len 1428 csum 0x7c9d], length 1428
10:53:24.740915 IP 112.26.3.8.41425 > 112.26.3.1.37753: Flags [.], ack 435541, win 24422, options [nop,nop,TS val 4294914619 ecr 160797,mptcp dss ack 3914486046], length 0
10:53:24.757514 IP 112.26.3.1.37753 > 112.26.3.8.41425: Flags [.], seq 441253:442681, ack 1, win 893, options [nop,nop,TS val 161259 ecr 4294914497,mptcp dss ack 2295998090 seq 3914533170 subseq 441253 len 1428 csum 0xbb95], length 1428
10:53:24.757857 IP 112.26.3.1.37753 > 112.26.3.8.41425: Flags [.], seq 441253:442681, ack 1, win 893, options [nop,nop,TS val 161259 ecr 4294914497,mptcp dss ack 2295998090 seq 3914533170 subseq 441253 len 1428 csum 0xbb95], length 1428
10:53:24.875429 IP 112.26.3.8.41425 > 112.26.3.1.37753: Flags [.], ack 436969, win 24419, options [nop,nop,TS val 4294914752 ecr 160797,mptcp dss ack 3914491758], length 0
10:53:24.902199 IP 112.26.3.1.37753 > 112.26.3.8.41425: Flags [.], seq 435541:436969, ack 1, win 893, options [nop,nop,TS val 160797 ecr 4294914037,mptcp dss ack 2295998090 seq 3914501754 subseq 435541 len 1428 csum 0x5f0c], length 1428
10:53:24.929002 IP 112.26.3.1.37753 > 112.26.3.8.41425: Flags [.], seq 442681:444109, ack 1, win 893, options [nop,nop,TS val 161387 ecr 4294914619,mptcp dss ack 2295998090 seq 3914540310 subseq 442681 len 1428 csum 0x178e], length 1428
10:53:24.929392 IP 112.26.3.1.37753 > 112.26.3.8.41425: Flags [.], seq 442681:444109, ack 1, win 893, options [nop,nop,TS val 161387 ecr 4294914619,mptcp dss ack 2295998090 seq 3914540310 subseq 442681 len 1428 csum 0x178e], length 1428
10:53:24.942365 IP 112.26.3.1.37753 > 112.26.3.8.41425: Flags [.], seq 444109:445537, ack 1, win 893, options [nop,nop,TS val 161519 ecr 4294914752,mptcp dss ack 2295998090 seq 3914553162 subseq 444109 len 1428 csum 0x95af], length 1428
10:53:24.942732 IP 112.26.3.1.37753 > 112.26.3.8.41425: Flags [.], seq 444109:445537, ack 1, win 893, options [nop,nop,TS val 161519 ecr 4294914752,mptcp dss ack 2295998090 seq 3914553162 subseq 444109 len 1428 csum 0x95af], length 1428
10:53:24.965025 IP 112.26.3.1.37753 > 112.26.3.8.41425: Flags [.], seq 436969:438397, ack 1, win 893, options [nop,nop,TS val 160907 ecr 4294914154,mptcp dss ack 2295998090 seq 3914508894 subseq 436969 len 1428 csum 0x5bb3], length 1428
10:53:24.974369 IP 112.26.3.8.41425 > 112.26.3.1.37753: Flags [.], ack 438397, win 24397, options [nop,nop,TS val 4294914859 ecr 160907,mptcp dss ack 3914493186], length 0
10:53:25.061221 IP 112.26.3.1.37753 > 112.26.3.8.41425: Flags [.], seq 438397:439825, ack 1, win 893, options [nop,nop,TS val 161067 ecr 4294914258,mptcp dss ack 2295998090 seq 3914521746 subseq 438397 len 1428 csum 0xbbc4], length 1428
10:53:25.092210 IP 112.26.3.1.37753 > 112.26.3.8.41425: Flags [.], seq 445537:446965, ack 1, win 893, options [nop,nop,TS val 161617 ecr 4294914859,mptcp dss ack 2295998090 seq 3914557446 subseq 445537 len 1428 csum 0xea58], length 1428
