10:52:44.144940 IP 112.26.3.8.41425 > 112.26.3.1.37753: Flags [S], seq 2395078999, win 65535, options [mss 1460,sackOK,TS val 4294873967 ecr 0,nop,wscale 6,mptcp join id 5 token 0xd15e4cde nonce 0x2a8bb6e7], length 0
10:52:44.204893 IP 112.26.3.8.41425 > 112.26.3.1.37753: Flags [S], seq 2395078999, win 65535, options [mss 1460,sackOK,TS val 4294873967 ecr 0,nop,wscale 6,mptcp join id 5 token 0xd15e4cde nonce 0x2a8bb6e7], length 0
10:52:44.242225 IP 112.26.3.1.37753 > 112.26.3.8.41425: Flags [S.], seq 2893757763, ack 2395079000, win 28560, options [mss 1460,sackOK,TS val 120848 ecr 4294873967,nop,wscale 7,mptcp join id 5 hmac 0x81ff6e68fa33c134 nonce 0x1be19e41], length 0
10:52:44.591920 IP 112.26.3.8.41425 > 112.26.3.1.37753: Flags [.], ack 1, win 7027, options [nop,nop,TS val 4294874346 ecr 120848,mptcp join hmac 0x8ee215a13a2dbfbe7ea6ce9b5e39c59ddf8153af], length 0
10:52:44.592185 IP 112.26.3.8.41425 > 112.26.3.1.37753: Flags [.], ack 1, win 7027, options [nop,nop,TS val 4294874346 ecr 120848,mptcp join hmac 0x8ee215a13a2dbfbe7ea6ce9b5e39c59ddf8153af], length 0
10:52:44.600088 IP 112.26.3.1.37753 > 112.26.3.8.41425: Flags [.], ack 1, win 670, options [nop,nop,TS val 121235 ecr 4294874346,mptcp dss ack 2295998090], length 0
10:52:44.697996 IP 112.26.3.1.37753 > 112.26.3.8.41425: Flags [.], seq 1:1429, ack 1, win 670, options [nop,nop,TS val 121235 ecr 4294874346,mptcp dss ack 2295998090 seq 3912818142 subseq 1 len 1428 csum 0x3607], length 1428
10:53:19.767729 IP 112.26.3.1.37753 > 112.26.3.8.41425: Flags [.], seq 382705:384133, ack 1, win 893, options [nop,nop,TS val 156404 ecr 4294909613,mptcp dss ack 2295998090 seq 3914301834 subseq 382705 len 1428 csum 0x1fef], length 1428
10:53:19.892639 IP 112.26.3.8.41425 > 112.26.3.1.37753: Flags [.], ack 374137, win 24467, options [nop,nop,TS val 4294909744 ecr 156012,nop,nop,sack 1 {375565:381277},mptcp dss ack 3914213298], length 0
10:53:19.892861 IP 112.26.3.8.41425 > 112.26.3.1.37753: Flags [.], ack 374137, win 24467, options [nop,nop,TS val 4294909744 ecr 156012,nop,nop,sack 1 {375565:381277},mptcp dss ack 3914213298], length 0
10:53:19.903240 IP 112.26.3.1.37753 > 112.26.3.8.41425: Flags [.], seq 384133:385561, ack 1, win 893, options [nop,nop,TS val 156536 ecr 4294909744,mptcp dss ack 2295998090 seq 3914306118 subseq 384133 len 1428 csum 0x3cf], length 1428
10:53:20.009479 IP 112.26.3.8.41425 > 112.26.3.1.37753: Flags [.], ack 381277, win 24467, options [nop,nop,TS val 4294909862 ecr 156122,mptcp dss ack 3914213298], length 0
10:53:20.009701 IP 112.26.3.8.41425 > 112.26.3.1.37753: Flags [.], ack 381277, win 24467, options [nop,nop,TS val 4294909862 ecr 156122,mptcp dss ack 3914213298], length 0
10:53:20.033496 IP 112.26.3.1.37753 > 112.26.3.8.41425: Flags [.], seq 385561:386989, ack 1, win 893, options [nop,nop,TS val 156652 ecr 4294909862,mptcp dss ack 2295998090 seq 3914313258 subseq 385561 len 1428 csum 0x42a3], length 1428
10:53:20.137562 IP 112.26.3.8.41425 > 112.26.3.1.37753: Flags [.], ack 382705, win 24467, options [nop,nop,TS val 4294910003 ecr 156287,mptcp dss ack 3914213298], length 0
10:53:20.137793 IP 112.26.3.8.41425 > 112.26.3.1.37753: Flags [.], ack 382705, win 24467, options [nop,nop,TS val 4294910003 ecr 156287,mptcp dss ack 3914213298], length 0
10:53:20.143546 IP 112.26.3.1.37753 > 112.26.3.8.41425: Flags [.], seq 386989:388417, ack 1, win 893, options [nop,nop,TS val 156780 ecr 4294910003,mptcp dss ack 2295998090 seq 3914318970 subseq 386989 len 1428 csum 0xf83b], length 1428
10:53:20.275672 IP 112.26.3.8.41425 > 112.26.3.1.37753: Flags [.], ack 384133, win 24467, options [nop,nop,TS val 4294910160 ecr 156404,mptcp dss ack 3914213298], length 0
10:53:20.275938 IP 112.26.3.8.41425 > 112.26.3.1.37753: Flags [.], ack 384133, win 24467, options [nop,nop,TS val 4294910160 ecr 156404,mptcp dss ack 3914213298], length 0
10:53:20.284400 IP 112.26.3.1.37753 > 112.26.3.8.41425: Flags [.], seq 388417:389845, ack 1, win 893, options [nop,nop,TS val 156919 ecr 4294910160,mptcp dss ack 2295998090 seq 3914324682 subseq 388417 len 1428 csum 0xbe65], length 1428
10:53:20.393982 IP 112.26.3.8.41425 > 112.26.3.1.37753: Flags [.], ack 385561, win 24467, options [nop,nop,TS val 4294910263 ecr 156536,mptcp dss ack 3914213298], length 0
10:53:20.394262 IP 112.26.3.8.41425 > 112.26.3.1.37753: Flags [.], ack 385561, win 24467, options [nop,nop,TS val 4294910263 ecr 156536,mptcp dss ack 3914213298], length 0
10:53:20.403407 IP 112.26.3.1.37753 > 112.26.3.8.41425: Flags [.], seq 389845:391273, ack 1, win 893, options [nop,nop,TS val 157041 ecr 4294910263,mptcp dss ack 2295998090 seq 3914327538 subseq 389845 len 1428 csum 0xb50d], length 1428
10:53:20.508266 IP 112.26.3.8.41425 > 112.26.3.1.37753: Flags [.], ack 386989, win 24267, options [nop,nop,TS val 4294910384 ecr 156652,mptcp dss ack 3914226150], length 0
10:53:20.508484 IP 112.26.3.8.41425 > 112.26.3.1.37753: Flags [.], ack 386989, win 24267, options [nop,nop,TS val 4294910384 ecr 156652,mptcp dss ack 3914226150], length 0
10:53:20.547956 IP 112.26.3.1.37753 > 112.26.3.8.41425: Flags [.], seq 391273:392701, ack 1, win 893, options [nop,nop,TS val 157041 ecr 4294910263,mptcp dss ack 2295998090 seq 3914328966 subseq 391273 len 1428 csum 0xcb49], length 1428
10:53:20.602105 IP 112.26.3.8.41425 > 112.26.3.1.37753: Flags [.], ack 388417, win 24267, options [nop,nop,TS val 4294910489 ecr 156780,mptcp dss ack 3914226150], length 0
10:53:20.602389 IP 112.26.3.8.41425 > 112.26.3.1.37753: Flags [.], ack 388417, win 24267, options [nop,nop,TS val 4294910489 ecr 156780,mptcp dss ack 3914226150], length 0
10:53:20.661780 IP 112.26.3.1.37753 > 112.26.3.8.41425: Flags [.], seq 392701:394129, ack 1, win 893, options [nop,nop,TS val 157152 ecr 4294910384,mptcp dss ack 2295998090 seq 3914333250 subseq 392701 len 1428 csum 0x57f7], length 1428
10:53:20.737292 IP 112.26.3.1.37753 > 112.26.3.8.41425: Flags [.], seq 394129:395557, ack 1, win 893, options [nop,nop,TS val 157247 ecr 4294910489,mptcp dss ack 2295998090 seq 3914337534 subseq 394129 len 1428 csum 0xd0db], length 1428
10:53:20.794606 IP 112.26.3.8.41425 > 112.26.3.1.37753: Flags [.], ack 389845, win 24267, options [nop,nop,TS val 4294910675 ecr 156919,mptcp dss ack 3914226150], length 0
10:53:20.794888 IP 112.26.3.8.41425 > 112.26.3.1.37753: Flags [.], ack 389845, win 24267, options [nop,nop,TS val 4294910675 ecr 156919,mptcp dss ack 3914226150], length 0
10:53:20.852078 IP 112.26.3.1.37753 > 112.26.3.8.41425: Flags [.], seq 395557:396985, ack 1, win 893, options [nop,nop,TS val 157441 ecr 4294910675,mptcp dss ack 2295998090 seq 3914344674 subseq 395557 len 1428 csum 0xfeda], length 1428
10:53:20.920998 IP 112.26.3.8.41425 > 112.26.3.1.37753: Flags [.], ack 391273, win 24267, options [nop,nop,TS val 4294910806 ecr 157041,mptcp dss ack 3914226150], length 0
10:53:20.921290 IP 112.26.3.8.41425 > 112.26.3.1.37753: Flags [.], ack 391273, win 24267, options [nop,nop,TS val 4294910806 ecr 157041,mptcp dss ack 3914226150], length 0
10:53:20.944476 IP 112.26.3.1.37753 > 112.26.3.8.41425: Flags [.], seq 396985:398413, ack 1, win 893, options [nop,nop,TS val 157566 ecr 4294910806,mptcp dss ack 2295998090 seq 3914348958 subseq 396985 len 1428 csum 0x3def], length 1428
10:53:21.056074 IP 112.26.3.8.41425 > 112.26.3.1.37753: Flags [.], ack 392701, win 24267, options [nop,nop,TS val 4294910942 ecr 157041,mptcp dss ack 3914226150], length 0
10:53:21.056350 IP 112.26.3.8.41425 > 112.26.3.1.37753: Flags [.], ack 392701, win 24267, options [nop,nop,TS val 4294910942 ecr 157041,mptcp dss ack 3914226150], length 0
10:53:21.061678 IP 112.26.3.1.37753 > 112.26.3.8.41425: Flags [.], seq 398413:399841, ack 1, win 893, options [nop,nop,TS val 157699 ecr 4294910942,mptcp dss ack 2295998090 seq 3914353242 subseq 398413 len 1428 csum 0x258e], length 1428
10:53:21.185678 IP 112.26.3.8.41425 > 112.26.3.1.37753: Flags [.], ack 394129, win 24267, options [nop,nop,TS val 4294911067 ecr 157152,mptcp dss ack 3914226150], length 0
10:53:21.185894 IP 112.26.3.8.41425 > 112.26.3.1.37753: Flags [.], ack 394129, win 24267, options [nop,nop,TS val 4294911067 ecr 157152,mptcp dss ack 3914226150], length 0
10:53:21.210478 IP 112.26.3.1.37753 > 112.26.3.8.41425: Flags [.], seq 399841:401269, ack 1, win 893, options [nop,nop,TS val 157829 ecr 4294911067,mptcp dss ack 2295998090 seq 3914358954 subseq 399841 len 1428 csum 0xf904], length 1428
10:53:21.335418 IP 112.26.3.8.41425 > 112.26.3.1.37753: Flags [.], ack 395557, win 24267, options [nop,nop,TS val 4294911210 ecr 157247,mptcp dss ack 3914226150], length 0
10:53:21.335699 IP 112.26.3.8.41425 > 112.26.3.1.37753: Flags [.], ack 395557, win 24267, options [nop,nop,TS val 4294911210 ecr 157247,mptcp dss ack 3914226150], length 0
10:53:21.347210 IP 112.26.3.1.37753 > 112.26.3.8.41425: Flags [.], seq 401269:402697, ack 1, win 893, options [nop,nop,TS val 157983 ecr 4294911210,mptcp dss ack 2295998090 seq 3914366094 subseq 401269 len 1428 csum 0x6a82], length 1428
10:53:21.462201 IP 112.26.3.8.41425 > 112.26.3.1.37753: Flags [.], ack 396985, win 24267, options [nop,nop,TS val 4294911347 ecr 157441,mptcp dss ack 3914226150], length 0
10:53:21.462446 IP 112.26.3.8.41425 > 112.26.3.1.37753: Flags [.], ack 396985, win 24267, options [nop,nop,TS val 4294911347 ecr 157441,mptcp dss ack 3914226150], length 0
10:53:21.485337 IP 112.26.3.1.37753 > 112.26.3.8.41425: Flags [.], seq 402697:404125, ack 1, win 893, options [nop,nop,TS val 158111 ecr 4294911347,mptcp dss ack 2295998090 seq 3914370378 subseq 402697 len 1428 csum 0x9727], length 1428
10:53:21.612336 IP 112.26.3.8.41425 > 112.26.3.1.37753: Flags [.], ack 398413, win 24267, options [nop,nop,TS val 4294911499 ecr 157566,mptcp dss ack 3914226150], length 0
10:53:21.612639 IP 112.26.3.8.41425 > 112.26.3.1.37753: Flags [.], ack 398413, win 24267, options [nop,nop,TS val 4294911499 ecr 157566,mptcp dss ack 3914226150], length 0
10:53:21.618772 IP 112.26.3.1.37753 > 112.26.3.8.41425: Flags [.], seq 404125:405553, ack 1, win 893, options [nop,nop,TS val 158256 ecr 4294911499,mptcp dss ack 2295998090 seq 3914376090 subseq 404125 len 1428 csum 0x5b9d], length 1428
10:53:21.762211 IP 112.26.3.8.41425 > 112.26.3.1.37753: Flags [.], ack 399841, win 24257, options [nop,nop,TS val 4294911622 ecr 157699,mptcp dss ack 3914317542], length 0
10:53:21.762490 IP 112.26.3.8.41425 > 112.26.3.1.37753: Flags [.], ack 399841, win 24257, options [nop,nop,TS val 4294911622 ecr 157699,mptcp dss ack 3914317542], length 0
10:53:21.787836 IP 112.26.3.1.37753 > 112.26.3.8.41425: Flags [.], seq 405553:406981, ack 1, win 893, options [nop,nop,TS val 158406 ecr 4294911622,mptcp dss ack 2295998090 seq 3914383230 subseq 405553 len 1428 csum 0xdf8d], length 1428
10:53:21.929735 IP 112.26.3.8.41425 > 112.26.3.1.37753: Flags [.], ack 401269, win 24525, options [nop,nop,TS val 4294911815 ecr 157829,mptcp dss ack 3914357526], length 0
10:53:21.930006 IP 112.26.3.8.41425 > 112.26.3.1.37753: Flags [.], ack 401269, win 24525, options [nop,nop,TS val 4294911815 ecr 157829,mptcp dss ack 3914357526], length 0
10:53:21.938673 IP 112.26.3.1.37753 > 112.26.3.8.41425: Flags [.], seq 406981:408409, ack 1, win 893, options [nop,nop,TS val 158576 ecr 4294911815,mptcp dss ack 2295998090 seq 3914390370 subseq 406981 len 1428 csum 0xb78f], length 1428
10:53:22.097701 IP 112.26.3.8.41425 > 112.26.3.1.37753: Flags [.], ack 404125, win 24522, options [nop,nop,TS val 4294911950 ecr 157983,mptcp dss ack 3914363238], length 0
10:53:22.097954 IP 112.26.3.8.41425 > 112.26.3.1.37753: Flags [.], ack 404125, win 24522, options [nop,nop,TS val 4294911950 ecr 157983,mptcp dss ack 3914363238], length 0
10:53:22.154753 IP 112.26.3.1.37753 > 112.26.3.8.41425: Flags [.], seq 408409:409837, ack 1, win 893, options [nop,nop,TS val 158741 ecr 4294911950,mptcp dss ack 2295998090 seq 3914398938 subseq 408409 len 1428 csum 0x63ad], length 1428
10:53:22.217057 IP 112.26.3.1.37753 > 112.26.3.8.41425: Flags [.], seq 409837:411265, ack 1, win 893, options [nop,nop,TS val 158741 ecr 4294911950,mptcp dss ack 2295998090 seq 3914400366 subseq 409837 len 1428 csum 0xd595], length 1428
10:53:22.309597 IP 112.26.3.8.41425 > 112.26.3.1.37753: Flags [.], ack 406981, win 24473, options [nop,nop,TS val 4294912195 ecr 158256,mptcp dss ack 3914373234], length 0
10:53:22.309895 IP 112.26.3.8.41425 > 112.26.3.1.37753: Flags [.], ack 406981, win 24473, options [nop,nop,TS val 4294912195 ecr 158256,mptcp dss ack 3914373234], length 0
10:53:22.315453 IP 112.26.3.1.37753 > 112.26.3.8.41425: Flags [.], seq 411265:412693, ack 1, win 893, options [nop,nop,TS val 158953 ecr 4294912195,mptcp dss ack 2295998090 seq 3914406078 subseq 411265 len 1428 csum 0x2a61], length 1428
10:53:22.448119 IP 112.26.3.1.37753 > 112.26.3.8.41425: Flags [.], seq 412693:414121, ack 1, win 893, options [nop,nop,TS val 158953 ecr 4294912195,mptcp dss ack 2295998090 seq 3914407506 subseq 412693 len 1428 csum 0x1706], length 1428
10:53:22.535215 IP 112.26.3.8.41425 > 112.26.3.1.37753: Flags [.], ack 408409, win 24458, options [nop,nop,TS val 4294912424 ecr 158576,mptcp dss ack 3914381802], length 0
10:53:22.535493 IP 112.26.3.8.41425 > 112.26.3.1.37753: Flags [.], ack 408409, win 24458, options [nop,nop,TS val 4294912424 ecr 158576,mptcp dss ack 3914381802], length 0
10:53:22.555198 IP 112.26.3.1.37753 > 112.26.3.8.41425: Flags [.], seq 414121:415549, ack 1, win 893, options [nop,nop,TS val 158953 ecr 4294912195,mptcp dss ack 2295998090 seq 3914408934 subseq 414121 len 1428 csum 0x39ac], length 1428
10:53:22.659349 IP 112.26.3.8.41425 > 112.26.3.1.37753: Flags [.], ack 408409, win 24458, options [nop,nop,TS val 4294912438 ecr 158576,nop,nop,sack 1 {409837:411265},mptcp dss ack 3914381802], length 0
10:53:22.659562 IP 112.26.3.8.41425 > 112.26.3.1.37753: Flags [.], ack 408409, win 24458, options [nop,nop,TS val 4294912438 ecr 158576,nop,nop,sack 1 {409837:411265},mptcp dss ack 3914381802], length 0
10:53:22.671769 IP 112.26.3.1.37753 > 112.26.3.8.41425: Flags [.], seq 415549:416977, ack 1, win 893, options [nop,nop,TS val 159178 ecr 4294912424,mptcp dss ack 2295998090 seq 3914420358 subseq 415549 len 1428 csum 0xf06b], length 1428
10:53:22.759442 IP 112.26.3.8.41425 > 112.26.3.1.37753: Flags [.], ack 408409, win 24507, options [nop,nop,TS val 4294912527 ecr 158576,nop,nop,sack 1 {409837:412693},mptcp dss ack 3914388942], length 0
10:53:22.759734 IP 112.26.3.8.41425 > 112.26.3.1.37753: Flags [.], ack 408409, win 24507, options [nop,nop,TS val 4294912527 ecr 158576,nop,nop,sack 1 {409837:412693},mptcp dss ack 3914388942], length 0
10:53:22.762707 IP 112.26.3.1.37753 > 112.26.3.8.41425: Flags [.], seq 416977:418405, ack 1, win 893, options [nop,nop,TS val 159338 ecr 4294912438,mptcp dss ack 2295998090 seq 3914427498 subseq 416977 len 1428 csum 0x5c0d], length 1428
10:53:22.902515 IP 112.26.3.1.37753 > 112.26.3.8.41425: Flags [.], seq 418405:419833, ack 1, win 893, options [nop,nop,TS val 159450 ecr 4294912527,mptcp dss ack 2295998090 seq 3914431782 subseq 418405 len 1428 csum 0xffe3], length 1428
10:53:22.904043 IP 112.26.3.8.41425 > 112.26.3.1.37753: Flags [.], ack 408409, win 24507, options [nop,nop,TS val 4294912689 ecr 158576,nop,nop,sack 1 {409837:414121},mptcp dss ack 3914393226], length 0
10:53:22.904330 IP 112.26.3.8.41425 > 112.26.3.1.37753: Flags [.], ack 408409, win 24507, options [nop,nop,TS val 4294912689 ecr 158576,nop,nop,sack 1 {409837:414121},mptcp dss ack 3914393226], length 0
10:53:22.971665 IP 112.26.3.1.37753 > 112.26.3.8.41425: Flags [.], seq 408409:409837, ack 1, win 893, options [nop,nop,TS val 159592 ecr 4294912689,mptcp dss ack 2295998090 seq 3914398938 subseq 408409 len 1428 csum 0x63ad], length 1428
10:53:22.998714 IP 112.26.3.8.41425 > 112.26.3.1.37753: Flags [.], ack 408409, win 24504, options [nop,nop,TS val 4294912813 ecr 158576,nop,nop,sack 1 {409837:415549},mptcp dss ack 3914398938], length 0
10:53:22.998941 IP 112.26.3.8.41425 > 112.26.3.1.37753: Flags [.], ack 408409, win 24504, options [nop,nop,TS val 4294912813 ecr 158576,nop,nop,sack 1 {409837:415549},mptcp dss ack 3914398938], length 0
10:53:23.081588 IP 112.26.3.8.41425 > 112.26.3.1.37753: Flags [.], ack 408409, win 24504, options [nop,nop,TS val 4294912958 ecr 158576,nop,nop,sack 1 {409837:416977},mptcp dss ack 3914398938], length 0
10:53:23.081869 IP 112.26.3.8.41425 > 112.26.3.1.37753: Flags [.], ack 408409, win 24504, options [nop,nop,TS val 4294912958 ecr 158576,nop,nop,sack 1 {409837:416977},mptcp dss ack 3914398938], length 0
10:53:23.131860 IP 112.26.3.1.37753 > 112.26.3.8.41425: Flags [.], seq 419833:421261, ack 1, win 893, options [nop,nop,TS val 159770 ecr 4294912958,mptcp dss ack 2295998090 seq 3914443206 subseq 419833 len 1428 csum 0xc735], length 1428
10:53:23.203028 IP 112.26.3.8.41425 > 112.26.3.1.37753: Flags [.], ack 408409, win 24504, options [nop,nop,TS val 4294913051 ecr 158576,nop,nop,sack 1 {409837:418405},mptcp dss ack 3914398938], length 0
10:53:23.203341 IP 112.26.3.8.41425 > 112.26.3.1.37753: Flags [.], ack 408409, win 24504, options [nop,nop,TS val 4294913051 ecr 158576,nop,nop,sack 1 {409837:418405},mptcp dss ack 3914398938], length 0
10:53:23.222818 IP 112.26.3.1.37753 > 112.26.3.8.41425: Flags [.], seq 421261:422689, ack 1, win 893, options [nop,nop,TS val 159860 ecr 4294913051,mptcp dss ack 2295998090 seq 3914447490 subseq 421261 len 1428 csum 0x4fae], length 1428
10:53:23.361320 IP 112.26.3.8.41425 > 112.26.3.1.37753: Flags [.], ack 408409, win 24504, options [nop,nop,TS val 4294913162 ecr 158576,nop,nop,sack 1 {409837:419833},mptcp dss ack 3914398938], length 0
10:53:23.361587 IP 112.26.3.8.41425 > 112.26.3.1.37753: Flags [.], ack 408409, win 24504, options [nop,nop,TS val 4294913162 ecr 158576,nop,nop,sack 1 {409837:419833},mptcp dss ack 3914398938], length 0
10:53:23.447282 IP 112.26.3.1.37753 > 112.26.3.8.41425: Flags [.], seq 422689:424117, ack 1, win 893, options [nop,nop,TS val 160085 ecr 4294913162,mptcp dss ack 2295998090 seq 3914460342 subseq 422689 len 1428 csum 0x9798], length 1428
10:53:23.461626 IP 112.26.3.8.41425 > 112.26.3.1.37753: Flags [.], ack 419833, win 24214, options [nop,nop,TS val 4294913268 ecr 159592,mptcp dss ack 3914417502], length 0
10:53:23.461909 IP 112.26.3.8.41425 > 112.26.3.1.37753: Flags [.], ack 419833, win 24214, options [nop,nop,TS val 4294913268 ecr 159592,mptcp dss ack 3914417502], length 0
10:53:23.556768 IP 112.26.3.1.37753 > 112.26.3.8.41425: Flags [.], seq 424117:425545, ack 1, win 893, options [nop,nop,TS val 160125 ecr 4294913268,mptcp dss ack 2295998090 seq 3914463198 subseq 424117 len 1428 csum 0x8a60], length 1428
10:53:23.616653 IP 112.26.3.8.41425 > 112.26.3.1.37753: Flags [.], ack 421261, win 24455, options [nop,nop,TS val 4294913440 ecr 159770,mptcp dss ack 3914426070], length 0
10:53:23.616866 IP 112.26.3.8.41425 > 112.26.3.1.37753: Flags [.], ack 421261, win 24455, options [nop,nop,TS val 4294913440 ecr 159770,mptcp dss ack 3914426070], length 0
10:53:23.642853 IP 112.26.3.1.37753 > 112.26.3.8.41425: Flags [.], seq 425545:426973, ack 1, win 893, options [nop,nop,TS val 160260 ecr 4294913440,mptcp dss ack 2295998090 seq 3914470338 subseq 425545 len 1428 csum 0x2faf], length 1428
10:53:23.740829 IP 112.26.3.1.37753 > 112.26.3.8.41425: Flags [.], seq 426973:428401, ack 1, win 893, options [nop,nop,TS val 160260 ecr 4294913440,mptcp dss ack 2295998090 seq 3914471766 subseq 426973 len 1428 csum 0xa543], length 1428
10:53:23.754217 IP 112.26.3.8.41425 > 112.26.3.1.37753: Flags [.], ack 422689, win 24442, options [nop,nop,TS val 4294913539 ecr 159860,mptcp dss ack 3914430354], length 0
10:53:23.754488 IP 112.26.3.8.41425 > 112.26.3.1.37753: Flags [.], ack 422689, win 24442, options [nop,nop,TS val 4294913539 ecr 159860,mptcp dss ack 3914430354], length 0
10:53:23.829674 IP 112.26.3.8.41425 > 112.26.3.1.37753: Flags [.], ack 424117, win 24440, options [nop,nop,TS val 4294913639 ecr 160085,mptcp dss ack 3914436066], length 0
10:53:23.829959 IP 112.26.3.8.41425 > 112.26.3.1.37753: Flags [.], ack 424117, win 24440, options [nop,nop,TS val 4294913639 ecr 160085,mptcp dss ack 3914436066], length 0
10:53:23.841021 IP 112.26.3.1.37753 > 112.26.3.8.41425: Flags [.], seq 428401:429829, ack 1, win 893, options [nop,nop,TS val 160399 ecr 4294913539,mptcp dss ack 2295998090 seq 3914481762 subseq 428401 len 1428 csum 0x69e5], length 1428
10:53:23.907324 IP 112.26.3.1.37753 > 112.26.3.8.41425: Flags [.], seq 429829:431257, ack 1, win 893, options [nop,nop,TS val 160511 ecr 4294913639,mptcp dss ack 2295998090 seq 3914483190 subseq 429829 len 1428 csum 0x1d69], length 1428
10:53:23.921418 IP 112.26.3.8.41425 > 112.26.3.1.37753: Flags [.], ack 425545, win 24433, options [nop,nop,TS val 4294913779 ecr 160125,mptcp dss ack 3914441778], length 0
10:53:23.921704 IP 112.26.3.8.41425 > 112.26.3.1.37753: Flags [.], ack 425545, win 24433, options [nop,nop,TS val 4294913779 ecr 160125,mptcp dss ack 3914441778], length 0
10:53:23.993450 IP 112.26.3.1.37753 > 112.26.3.8.41425: Flags [.], seq 431257:432685, ack 1, win 893, options [nop,nop,TS val 160607 ecr 4294913779,mptcp dss ack 2295998090 seq 3914488902 subseq 431257 len 1428 csum 0xdcb3], length 1428
10:53:24.032652 IP 112.26.3.8.41425 > 112.26.3.1.37753: Flags [.], ack 426973, win 24393, options [nop,nop,TS val 4294913900 ecr 160260,mptcp dss ack 3914448918], length 0
10:53:24.032930 IP 112.26.3.8.41425 > 112.26.3.1.37753: Flags [.], ack 426973, win 24393, options [nop,nop,TS val 4294913900 ecr 160260,mptcp dss ack 3914448918], length 0
10:53:24.077315 IP 112.26.3.1.37753 > 112.26.3.8.41425: Flags [P.], seq 432685:434113, ack 1, win 893, options [nop,nop,TS val 160682 ecr 4294913900,mptcp dss ack 2295998090 seq 3914494614 subseq 432685 len 1428 csum 0x3ed0], length 1428
10:53:24.153096 IP 112.26.3.8.41425 > 112.26.3.1.37753: Flags [.], ack 428401, win 24424, options [nop,nop,TS val 4294914037 ecr 160260,mptcp dss ack 3914458914], length 0
10:53:24.153356 IP 112.26.3.8.41425 > 112.26.3.1.37753: Flags [.], ack 428401, win 24424, options [nop,nop,TS val 4294914037 ecr 160260,mptcp dss ack 3914458914], length 0
10:53:24.195719 IP 112.26.3.1.37753 > 112.26.3.8.41425: Flags [.], seq 434113:435541, ack 1, win 893, options [nop,nop,TS val 160797 ecr 4294914037,mptcp dss ack 2295998090 seq 3914500326 subseq 434113 len 1428 csum 0x7c9d], length 1428
10:53:24.263805 IP 112.26.3.8.41425 > 112.26.3.1.37753: Flags [.], ack 429829, win 24458, options [nop,nop,TS val 4294914154 ecr 160399,mptcp dss ack 3914466054], length 0
10:53:24.264033 IP 112.26.3.8.41425 > 112.26.3.1.37753: Flags [.], ack 429829, win 24458, options [nop,nop,TS val 4294914154 ecr 160399,mptcp dss ack 3914466054], length 0
10:53:24.329186 IP 112.26.3.1.37753 > 112.26.3.8.41425: Flags [.], seq 435541:436969, ack 1, win 893, options [nop,nop,TS val 160797 ecr 4294914037,mptcp dss ack 2295998090 seq 3914501754 subseq 435541 len 1428 csum 0x5f0c], length 1428
10:53:24.394655 IP 112.26.3.1.37753 > 112.26.3.8.41425: Flags [.], seq 436969:438397, ack 1, win 893, options [nop,nop,TS val 160907 ecr 4294914154,mptcp dss ack 2295998090 seq 3914508894 subseq 436969 len 1428 csum 0x5bb3], length 1428
10:53:24.423165 IP 112.26.3.8.41425 > 112.26.3.1.37753: Flags [.], ack 431257, win 24473, options [nop,nop,TS val 4294914258 ecr 160511,mptcp dss ack 3914473194], length 0
10:53:24.423387 IP 112.26.3.8.41425 > 112.26.3.1.37753: Flags [.], ack 431257, win 24473, options [nop,nop,TS val 4294914258 ecr 160511,mptcp dss ack 3914473194], length 0
10:53:24.466133 IP 112.26.3.1.37753 > 112.26.3.8.41425: Flags [.], seq 438397:439825, ack 1, win 893, options [nop,nop,TS val 161067 ecr 4294914258,mptcp dss ack 2295998090 seq 3914521746 subseq 438397 len 1428 csum 0xbbc4], length 1428
10:53:24.499531 IP 112.26.3.8.41425 > 112.26.3.1.37753: Flags [.], ack 432685, win 24451, options [nop,nop,TS val 4294914385 ecr 160607,mptcp dss ack 3914474622], length 0
10:53:24.499746 IP 112.26.3.8.41425 > 112.26.3.1.37753: Flags [.], ack 432685, win 24451, options [nop,nop,TS val 4294914385 ecr 160607,mptcp dss ack 3914474622], length 0
10:53:24.598413 IP 112.26.3.1.37753 > 112.26.3.8.41425: Flags [.], seq 439825:441253, ack 1, win 893, options [nop,nop,TS val 161169 ecr 4294914385,mptcp dss ack 2295998090 seq 3914523174 subseq 439825 len 1428 csum 0x1b7c], length 1428
10:53:24.616401 IP 112.26.3.8.41425 > 112.26.3.1.37753: Flags [.], ack 434113, win 24422, options [nop,nop,TS val 4294914497 ecr 160682,mptcp dss ack 3914478906], length 0
10:53:24.616701 IP 112.26.3.8.41425 > 112.26.3.1.37753: Flags [.], ack 434113, win 24422, options [nop,nop,TS val 4294914497 ecr 160682,mptcp dss ack 3914478906], length 0
10:53:24.719822 IP 112.26.3.1.37753 > 112.26.3.8.41425: Flags [.], seq 441253:442681, ack 1, win 893, options [nop,nop,TS val 161259 ecr 4294914497,mptcp dss ack 2295998090 seq 3914533170 subseq 441253 len 1428 csum 0xbb95], length 1428
10:53:24.741023 IP 112.26.3.8.41425 > 112.26.3.1.37753: Flags [.], ack 435541, win 24422, options [nop,nop,TS val 4294914619 ecr 160797,mptcp dss ack 3914486046], length 0
10:53:24.741302 IP 112.26.3.8.41425 > 112.26.3.1.37753: Flags [.], ack 435541, win 24422, options [nop,nop,TS val 4294914619 ecr 160797,mptcp dss ack 3914486046], length 0
10:53:24.873744 IP 112.26.3.1.37753 > 112.26.3.8.41425: Flags [.], seq 442681:444109, ack 1, win 893, options [nop,nop,TS val 161387 ecr 4294914619,mptcp dss ack 2295998090 seq 3914540310 subseq 442681 len 1428 csum 0x178e], length 1428
10:53:24.875541 IP 112.26.3.8.41425 > 112.26.3.1.37753: Flags [.], ack 436969, win 24419, options [nop,nop,TS val 4294914752 ecr 160797,mptcp dss ack 3914491758], length 0
10:53:24.875775 IP 112.26.3.8.41425 > 112.26.3.1.37753: Flags [.], ack 436969, win 24419, options [nop,nop,TS val 4294914752 ecr 160797,mptcp dss ack 3914491758], length 0
10:53:24.934000 IP 112.26.3.1.37753 > 112.26.3.8.41425: Flags [.], seq 444109:445537, ack 1, win 893, options [nop,nop,TS val 161519 ecr 4294914752,mptcp dss ack 2295998090 seq 3914553162 subseq 444109 len 1428 csum 0x95af], length 1428
10:53:24.974477 IP 112.26.3.8.41425 > 112.26.3.1.37753: Flags [.], ack 438397, win 24397, options [nop,nop,TS val 4294914859 ecr 160907,mptcp dss ack 3914493186], length 0
10:53:24.974765 IP 112.26.3.8.41425 > 112.26.3.1.37753: Flags [.], ack 438397, win 24397, options [nop,nop,TS val 4294914859 ecr 160907,mptcp dss ack 3914493186], length 0
10:53:25.092324 IP 112.26.3.1.37753 > 112.26.3.8.41425: Flags [.], seq 445537:446965, ack 1, win 893, options [nop,nop,TS val 161617 ecr 4294914859,mptcp dss ack 2295998090 seq 3914557446 subseq 445537 len 1428 csum 0xea58], length 1428
10:53:25.108555 IP 112.26.3.8.41425 > 112.26.3.1.37753: Flags [.], ack 439825, win 24442, options [nop,nop,TS val 4294914955 ecr 161067,mptcp dss ack 3914504610], length 0
10:53:25.108824 IP 112.26.3.8.41425 > 112.26.3.1.37753: Flags [.], ack 439825, win 24442, options [nop,nop,TS val 4294914955 ecr 161067,mptcp dss ack 3914504610], length 0
10:53:25.200904 IP 112.26.3.1.37753 > 112.26.3.8.41425: Flags [.], seq 446965:448393, ack 1, win 893, options [nop,nop,TS val 161751 ecr 4294914955,mptcp dss ack 2295998090 seq 3914566014 subseq 446965 len 1428 csum 0xa0fb], length 1428
10:53:25.217359 IP 112.26.3.8.41425 > 112.26.3.1.37753: Flags [.], ack 441253, win 24420, options [nop,nop,TS val 4294915105 ecr 161169,mptcp dss ack 3914506038], length 0
10:53:25.217656 IP 112.26.3.8.41425 > 112.26.3.1.37753: Flags [.], ack 441253, win 24420, options [nop,nop,TS val 4294915105 ecr 161169,mptcp dss ack 3914506038], length 0
10:53:25.290566 IP 112.26.3.1.37753 > 112.26.3.8.41425: Flags [.], seq 448393:449821, ack 1, win 893, options [nop,nop,TS val 161861 ecr 4294915105,mptcp dss ack 2295998090 seq 3914570298 subseq 448393 len 1428 csum 0xd1ae], length 1428
10:53:25.344637 IP 112.26.3.8.41425 > 112.26.3.1.37753: Flags [.], ack 444109, win 24396, options [nop,nop,TS val 4294915215 ecr 161259,mptcp dss ack 3914514606], length 0
10:53:25.344911 IP 112.26.3.8.41425 > 112.26.3.1.37753: Flags [.], ack 444109, win 24396, options [nop,nop,TS val 4294915215 ecr 161259,mptcp dss ack 3914514606], length 0
10:53:25.402141 IP 112.26.3.1.37753 > 112.26.3.8.41425: Flags [.], seq 449821:451249, ack 1, win 893, options [nop,nop,TS val 161987 ecr 4294915215,mptcp dss ack 2295998090 seq 3914581722 subseq 449821 len 1428 csum 0x1a88], length 1428
10:53:25.482635 IP 112.26.3.1.37753 > 112.26.3.8.41425: Flags [.], seq 451249:452677, ack 1, win 893, options [nop,nop,TS val 161987 ecr 4294915215,mptcp dss ack 2295998090 seq 3914583150 subseq 451249 len 1428 csum 0xc68c], length 1428
10:53:25.530725 IP 112.26.3.8.41425 > 112.26.3.1.37753: Flags [.], ack 446965, win 24356, options [nop,nop,TS val 4294915418 ecr 161519,mptcp dss ack 3914517462], length 0
10:53:25.530955 IP 112.26.3.8.41425 > 112.26.3.1.37753: Flags [.], ack 446965, win 24356, options [nop,nop,TS val 4294915418 ecr 161519,mptcp dss ack 3914517462], length 0
10:53:25.565870 IP 112.26.3.1.37753 > 112.26.3.8.41425: Flags [.], seq 452677:454105, ack 1, win 893, options [nop,nop,TS val 162173 ecr 4294915418,mptcp dss ack 2295998090 seq 3914594574 subseq 452677 len 1428 csum 0x6083], length 1428
10:53:25.640593 IP 112.26.3.1.37753 > 112.26.3.8.41425: Flags [.], seq 454105:455533, ack 1, win 893, options [nop,nop,TS val 162173 ecr 4294915418,mptcp dss ack 2295998090 seq 3914596002 subseq 454105 len 1428 csum 0xf378], length 1428
10:53:25.780763 IP 112.26.3.8.41425 > 112.26.3.1.37753: Flags [.], ack 449821, win 24349, options [nop,nop,TS val 4294915668 ecr 161751,mptcp dss ack 3914531742], length 0
10:53:25.781044 IP 112.26.3.8.41425 > 112.26.3.1.37753: Flags [.], ack 449821, win 24349, options [nop,nop,TS val 4294915668 ecr 161751,mptcp dss ack 3914531742], length 0
10:53:25.803525 IP 112.26.3.1.37753 > 112.26.3.8.41425: Flags [.], seq 455533:456961, ack 1, win 893, options [nop,nop,TS val 162423 ecr 4294915668,mptcp dss ack 2295998090 seq 3914610282 subseq 455533 len 1428 csum 0xa434], length 1428
10:53:25.879709 IP 112.26.3.1.37753 > 112.26.3.8.41425: Flags [.], seq 456961:458389, ack 1, win 893, options [nop,nop,TS val 162423 ecr 4294915668,mptcp dss ack 2295998090 seq 3914611710 subseq 456961 len 1428 csum 0xe9db], length 1428
10:53:25.906779 IP 112.26.3.8.41425 > 112.26.3.1.37753: Flags [.], ack 452677, win 24375, options [nop,nop,TS val 4294915791 ecr 161987,mptcp dss ack 3914546022], length 0
10:53:25.907045 IP 112.26.3.8.41425 > 112.26.3.1.37753: Flags [.], ack 452677, win 24375, options [nop,nop,TS val 4294915791 ecr 161987,mptcp dss ack 3914546022], length 0
10:53:25.982989 IP 112.26.3.1.37753 > 112.26.3.8.41425: Flags [.], seq 458389:459817, ack 1, win 893, options [nop,nop,TS val 162550 ecr 4294915791,mptcp dss ack 2295998090 seq 3914625990 subseq 458389 len 1428 csum 0x821c], length 1428
10:53:26.059068 IP 112.26.3.1.37753 > 112.26.3.8.41425: Flags [.], seq 459817:461245, ack 1, win 893, options [nop,nop,TS val 162550 ecr 4294915791,mptcp dss ack 2295998090 seq 3914627418 subseq 459817 len 1428 csum 0xc5], length 1428
10:53:26.109003 IP 112.26.3.8.41425 > 112.26.3.1.37753: Flags [.], ack 455533, win 24440, options [nop,nop,TS val 4294915999 ecr 162173,mptcp dss ack 3914561730], length 0
10:53:26.109276 IP 112.26.3.8.41425 > 112.26.3.1.37753: Flags [.], ack 455533, win 24440, options [nop,nop,TS val 4294915999 ecr 162173,mptcp dss ack 3914561730], length 0
10:53:26.177222 IP 112.26.3.1.37753 > 112.26.3.8.41425: Flags [.], seq 461245:462673, ack 1, win 893, options [nop,nop,TS val 162752 ecr 4294915999,mptcp dss ack 2295998090 seq 3914640270 subseq 461245 len 1428 csum 0xfe1], length 1428
10:53:26.249520 IP 112.26.3.1.37753 > 112.26.3.8.41425: Flags [.], seq 462673:464101, ack 1, win 893, options [nop,nop,TS val 162752 ecr 4294915999,mptcp dss ack 2295998090 seq 3914641698 subseq 462673 len 1428 csum 0xbdd5], length 1428
10:53:26.379898 IP 112.26.3.8.41425 > 112.26.3.1.37753: Flags [.], ack 459817, win 24418, options [nop,nop,TS val 4294916269 ecr 162423,mptcp dss ack 3914563158], length 0
10:53:26.380163 IP 112.26.3.8.41425 > 112.26.3.1.37753: Flags [.], ack 459817, win 24418, options [nop,nop,TS val 4294916269 ecr 162423,mptcp dss ack 3914563158], length 0
10:53:26.394794 IP 112.26.3.1.37753 > 112.26.3.8.41425: Flags [.], seq 464101:465529, ack 1, win 893, options [nop,nop,TS val 163023 ecr 4294916269,mptcp dss ack 2295998090 seq 3914654550 subseq 464101 len 1428 csum 0xe0cd], length 1428
10:53:26.449281 IP 112.26.3.1.37753 > 112.26.3.8.41425: Flags [.], seq 465529:466957, ack 1, win 893, options [nop,nop,TS val 163023 ecr 4294916269,mptcp dss ack 2295998090 seq 3914655978 subseq 465529 len 1428 csum 0xef8], length 1428
10:53:26.569072 IP 112.26.3.1.37753 > 112.26.3.8.41425: Flags [.], seq 466957:468385, ack 1, win 893, options [nop,nop,TS val 163023 ecr 4294916269,mptcp dss ack 2295998090 seq 3914657406 subseq 466957 len 1428 csum 0xbf0c], length 1428
10:53:26.655770 IP 112.26.3.1.37753 > 112.26.3.8.41425: Flags [.], seq 468385:469813, ack 1, win 893, options [nop,nop,TS val 163023 ecr 4294916269,mptcp dss ack 2295998090 seq 3914658834 subseq 468385 len 1428 csum 0x65a2], length 1428
10:53:26.704168 IP 112.26.3.8.41425 > 112.26.3.1.37753: Flags [.], ack 462673, win 24418, options [nop,nop,TS val 4294916592 ecr 162550,mptcp dss ack 3914563158], length 0
10:53:26.704455 IP 112.26.3.8.41425 > 112.26.3.1.37753: Flags [.], ack 462673, win 24418, options [nop,nop,TS val 4294916592 ecr 162550,mptcp dss ack 3914563158], length 0
10:53:26.715143 IP 112.26.3.1.37753 > 112.26.3.8.41425: Flags [.], seq 469813:471241, ack 1, win 893, options [nop,nop,TS val 163347 ecr 4294916592,mptcp dss ack 2295998090 seq 3914668830 subseq 469813 len 1428 csum 0x7d71], length 1428
10:53:26.813412 IP 112.26.3.1.37753 > 112.26.3.8.41425: Flags [.], seq 471241:472669, ack 1, win 893, options [nop,nop,TS val 163347 ecr 4294916592,mptcp dss ack 2295998090 seq 3914670258 subseq 471241 len 1428 csum 0x6aec], length 1428
10:53:27.072980 IP 112.26.3.8.41425 > 112.26.3.1.37753: Flags [.], ack 468385, win 24418, options [nop,nop,TS val 4294916962 ecr 162752,mptcp dss ack 3914563158], length 0
10:53:27.073265 IP 112.26.3.8.41425 > 112.26.3.1.37753: Flags [.], ack 468385, win 24418, options [nop,nop,TS val 4294916962 ecr 162752,mptcp dss ack 3914563158], length 0
10:53:27.077987 IP 112.26.3.1.37753 > 112.26.3.8.41425: Flags [.], seq 472669:474097, ack 1, win 893, options [nop,nop,TS val 163715 ecr 4294916962,mptcp dss ack 2295998090 seq 3914680254 subseq 472669 len 1428 csum 0x8e9b], length 1428
10:53:27.180600 IP 112.26.3.1.37753 > 112.26.3.8.41425: Flags [.], seq 474097:475525, ack 1, win 893, options [nop,nop,TS val 163715 ecr 4294916962,mptcp dss ack 2295998090 seq 3914681682 subseq 474097 len 1428 csum 0xcf39], length 1428
10:53:27.264949 IP 112.26.3.1.37753 > 112.26.3.8.41425: Flags [.], seq 475525:476953, ack 1, win 893, options [nop,nop,TS val 163715 ecr 4294916962,mptcp dss ack 2295998090 seq 3914683110 subseq 475525 len 1428 csum 0x4ab0], length 1428
10:53:27.371273 IP 112.26.3.1.37753 > 112.26.3.8.41425: Flags [.], seq 476953:478381, ack 1, win 893, options [nop,nop,TS val 163715 ecr 4294916962,mptcp dss ack 2295998090 seq 3914684538 subseq 476953 len 1428 csum 0x4e95], length 1428
10:53:27.404885 IP 112.26.3.8.41425 > 112.26.3.1.37753: Flags [.], ack 472669, win 24418, options [nop,nop,TS val 4294917294 ecr 163023,mptcp dss ack 3914563158], length 0
10:53:27.405153 IP 112.26.3.8.41425 > 112.26.3.1.37753: Flags [.], ack 472669, win 24418, options [nop,nop,TS val 4294917294 ecr 163023,mptcp dss ack 3914563158], length 0
10:53:27.478663 IP 112.26.3.1.37753 > 112.26.3.8.41425: Flags [.], seq 478381:479809, ack 1, win 893, options [nop,nop,TS val 163715 ecr 4294916962,mptcp dss ack 2295998090 seq 3914685966 subseq 478381 len 1428 csum 0x4a77], length 1428
10:53:27.583257 IP 112.26.3.1.37753 > 112.26.3.8.41425: Flags [.], seq 479809:481237, ack 1, win 893, options [nop,nop,TS val 163715 ecr 4294916962,mptcp dss ack 2295998090 seq 3914687394 subseq 479809 len 1428 csum 0x7edd], length 1428
10:53:27.699802 IP 112.26.3.1.37753 > 112.26.3.8.41425: Flags [.], seq 481237:482665, ack 1, win 893, options [nop,nop,TS val 163715 ecr 4294916962,mptcp dss ack 2295998090 seq 3914688822 subseq 481237 len 1428 csum 0x8686], length 1428
10:53:27.764227 IP 112.26.3.1.37753 > 112.26.3.8.41425: Flags [.], seq 482665:484093, ack 1, win 893, options [nop,nop,TS val 164049 ecr 4294917294,mptcp dss ack 2295998090 seq 3914703102 subseq 482665 len 1428 csum 0x17d1], length 1428
10:53:27.802695 IP 112.26.3.8.41425 > 112.26.3.1.37753: Flags [.], ack 476953, win 23995, options [nop,nop,TS val 4294917679 ecr 163715,mptcp dss ack 3914590290], length 0
10:53:27.802976 IP 112.26.3.8.41425 > 112.26.3.1.37753: Flags [.], ack 476953, win 23995, options [nop,nop,TS val 4294917679 ecr 163715,mptcp dss ack 3914590290], length 0
10:53:27.872645 IP 112.26.3.1.37753 > 112.26.3.8.41425: Flags [P.], seq 484093:485521, ack 1, win 893, options [nop,nop,TS val 164049 ecr 4294917294,mptcp dss ack 2295998090 seq 3914704530 subseq 484093 len 1428 csum 0x6bfd], length 1428
10:53:27.952749 IP 112.26.3.8.41425 > 112.26.3.1.37753: Flags [.], ack 479809, win 24078, options [nop,nop,TS val 4294917798 ecr 163715,mptcp dss ack 3914590290], length 0
10:53:27.953026 IP 112.26.3.8.41425 > 112.26.3.1.37753: Flags [.], ack 479809, win 24078, options [nop,nop,TS val 4294917798 ecr 163715,mptcp dss ack 3914590290], length 0
10:53:27.996607 IP 112.26.3.1.37753 > 112.26.3.8.41425: Flags [.], seq 485521:486949, ack 1, win 893, options [nop,nop,TS val 164049 ecr 4294917294,mptcp dss ack 2295998090 seq 3914705958 subseq 485521 len 1428 csum 0xc648], length 1428
10:53:28.080077 IP 112.26.3.1.37753 > 112.26.3.8.41425: Flags [.], seq 486949:488377, ack 1, win 893, options [nop,nop,TS val 164456 ecr 4294917679,mptcp dss ack 2295998090 seq 3914721666 subseq 486949 len 1428 csum 0x8525], length 1428
10:53:28.146585 IP 112.26.3.1.37753 > 112.26.3.8.41425: Flags [.], seq 488377:489805, ack 1, win 893, options [nop,nop,TS val 164456 ecr 4294917679,mptcp dss ack 2295998090 seq 3914723094 subseq 488377 len 1428 csum 0xabe3], length 1428
10:53:28.201233 IP 112.26.3.8.41425 > 112.26.3.1.37753: Flags [.], ack 482665, win 24078, options [nop,nop,TS val 4294918080 ecr 163715,mptcp dss ack 3914590290], length 0
10:53:28.201491 IP 112.26.3.8.41425 > 112.26.3.1.37753: Flags [.], ack 482665, win 24078, options [nop,nop,TS val 4294918080 ecr 163715,mptcp dss ack 3914590290], length 0
10:53:28.284599 IP 112.26.3.1.37753 > 112.26.3.8.41425: Flags [.], seq 489805:491233, ack 1, win 893, options [nop,nop,TS val 164456 ecr 4294917679,mptcp dss ack 2295998090 seq 3914724522 subseq 489805 len 1428 csum 0xcd04], length 1428
10:53:28.363374 IP 112.26.3.1.37753 > 112.26.3.8.41425: Flags [.], seq 491233:492661, ack 1, win 893, options [nop,nop,TS val 164596 ecr 4294917798,mptcp dss ack 2295998090 seq 3914735946 subseq 491233 len 1428 csum 0x3edd], length 1428
10:53:28.442705 IP 112.26.3.1.37753 > 112.26.3.8.41425: Flags [.], seq 492661:494089, ack 1, win 893, options [nop,nop,TS val 164596 ecr 4294917798,mptcp dss ack 2295998090 seq 3914737374 subseq 492661 len 1428 csum 0xb6b7], length 1428
10:53:28.516635 IP 112.26.3.8.41425 > 112.26.3.1.37753: Flags [.], ack 488377, win 24078, options [nop,nop,TS val 4294918393 ecr 164049,mptcp dss ack 3914590290], length 0
10:53:28.516886 IP 112.26.3.8.41425 > 112.26.3.1.37753: Flags [.], ack 488377, win 24078, options [nop,nop,TS val 4294918393 ecr 164049,mptcp dss ack 3914590290], length 0
10:53:28.580954 IP 112.26.3.1.37753 > 112.26.3.8.41425: Flags [.], seq 494089:495517, ack 1, win 893, options [nop,nop,TS val 164850 ecr 4294918080,mptcp dss ack 2295998090 seq 3914747370 subseq 494089 len 1428 csum 0x4ae9], length 1428
