10:52:44.206366 IP 112.26.3.8.41425 > 112.26.3.1.37753: Flags [S], seq 2395078999, win 65535, options [mss 1460,sackOK,TS val 4294873967 ecr 0,nop,wscale 6,mptcp join id 5 token 0xd15e4cde nonce 0x2a8bb6e7], length 0
10:52:44.240497 IP 112.26.3.1.37753 > 112.26.3.8.41425: Flags [S.], seq 2893757763, ack 2395079000, win 28560, options [mss 1460,sackOK,TS val 120848 ecr 4294873967,nop,wscale 7,mptcp join id 5 hmac 0x81ff6e68fa33c134 nonce 0x1be19e41], length 0
10:52:44.377195 IP 112.26.3.1.37753 > 112.26.3.8.41425: Flags [S.], seq 2893757763, ack 2395079000, win 28560, options [mss 1460,sackOK,TS val 120848 ecr 4294873967,nop,wscale 7,mptcp join id 5 hmac 0x81ff6e68fa33c134 nonce 0x1be19e41], length 0
10:52:44.593655 IP 112.26.3.8.41425 > 112.26.3.1.37753: Flags [.], ack 1, win 7027, options [nop,nop,TS val 4294874346 ecr 120848,mptcp join hmac 0x8ee215a13a2dbfbe7ea6ce9b5e39c59ddf8153af], length 0
10:52:44.593887 IP 112.26.3.1.37753 > 112.26.3.8.41425: Flags [.], ack 1, win 670, options [nop,nop,TS val 121235 ecr 4294874346,mptcp dss ack 2295998090], length 0
10:52:44.594106 IP 112.26.3.1.37753 > 112.26.3.8.41425: Flags [.], seq 1:1429, ack 1, win 670, options [nop,nop,TS val 121235 ecr 4294874346,mptcp dss ack 2295998090 seq 3912818142 subseq 1 len 1428 csum 0x3607], length 1428
10:52:44.594175 IP 112.26.3.1.37753 > 112.26.3.8.41425: Flags [.], seq 1429:2857, ack 1, win 670, options [nop,nop,TS val 121235 ecr 4294874346,mptcp dss ack 2295998090 seq 3912819570 subseq 1429 len 1428 csum 0x78cd], length 1428
10:53:19.762720 IP 112.26.3.1.37753 > 112.26.3.8.41425: Flags [.], seq 382705:384133, ack 1, win 893, options [nop,nop,TS val 156404 ecr 4294909613,mptcp dss ack 2295998090 seq 3914301834 subseq 382705 len 1428 csum 0x1fef], length 1428
10:53:19.818069 IP 112.26.3.1.37753 > 112.26.3.8.41425: Flags [.], seq 369853:371281, ack 1, win 893, options [nop,nop,TS val 156012 ecr 4294909198,mptcp dss ack 2295998090 seq 3914251854 subseq 369853 len 1428 csum 0xc94c], length 1428
10:53:19.894109 IP 112.26.3.8.41425 > 112.26.3.1.37753: Flags [.], ack 374137, win 24467, options [nop,nop,TS val 4294909744 ecr 156012,nop,nop,sack 1 {375565:381277},mptcp dss ack 3914213298], length 0
10:53:19.894326 IP 112.26.3.1.37753 > 112.26.3.8.41425: Flags [.], seq 384133:385561, ack 1, win 893, options [nop,nop,TS val 156536 ecr 4294909744,mptcp dss ack 2295998090 seq 3914306118 subseq 384133 len 1428 csum 0x3cf], length 1428
10:53:19.965697 IP 112.26.3.1.37753 > 112.26.3.8.41425: Flags [.], seq 374137:375565, ack 1, win 893, options [nop,nop,TS val 156122 ecr 4294909356,mptcp dss ack 2295998090 seq 3914274702 subseq 374137 len 1428 csum 0xe686], length 1428
10:53:20.011012 IP 112.26.3.8.41425 > 112.26.3.1.37753: Flags [.], ack 381277, win 24467, options [nop,nop,TS val 4294909862 ecr 156122,mptcp dss ack 3914213298], length 0
10:53:20.011356 IP 112.26.3.1.37753 > 112.26.3.8.41425: Flags [.], seq 385561:386989, ack 1, win 893, options [nop,nop,TS val 156652 ecr 4294909862,mptcp dss ack 2295998090 seq 3914313258 subseq 385561 len 1428 csum 0x42a3], length 1428
10:53:20.114118 IP 112.26.3.1.37753 > 112.26.3.8.41425: Flags [.], seq 381277:382705, ack 1, win 893, options [nop,nop,TS val 156287 ecr 4294909462,mptcp dss ack 2295998090 seq 3914297550 subseq 381277 len 1428 csum 0xb9c7], length 1428
10:53:20.138898 IP 112.26.3.8.41425 > 112.26.3.1.37753: Flags [.], ack 382705, win 24467, options [nop,nop,TS val 4294910003 ecr 156287,mptcp dss ack 3914213298], length 0
10:53:20.139172 IP 112.26.3.1.37753 > 112.26.3.8.41425: Flags [.], seq 386989:388417, ack 1, win 893, options [nop,nop,TS val 156780 ecr 4294910003,mptcp dss ack 2295998090 seq 3914318970 subseq 386989 len 1428 csum 0xf83b], length 1428
10:53:20.176531 IP 112.26.3.1.37753 > 112.26.3.8.41425: Flags [.], seq 382705:384133, ack 1, win 893, options [nop,nop,TS val 156404 ecr 4294909613,mptcp dss ack 2295998090 seq 3914301834 subseq 382705 len 1428 csum 0x1fef], length 1428
10:53:20.277837 IP 112.26.3.8.41425 > 112.26.3.1.37753: Flags [.], ack 384133, win 24467, options [nop,nop,TS val 4294910160 ecr 156404,mptcp dss ack 3914213298], length 0
10:53:20.278056 IP 112.26.3.1.37753 > 112.26.3.8.41425: Flags [.], seq 388417:389845, ack 1, win 893, options [nop,nop,TS val 156919 ecr 4294910160,mptcp dss ack 2295998090 seq 3914324682 subseq 388417 len 1428 csum 0xbe65], length 1428
10:53:20.303509 IP 112.26.3.1.37753 > 112.26.3.8.41425: Flags [.], seq 384133:385561, ack 1, win 893, options [nop,nop,TS val 156536 ecr 4294909744,mptcp dss ack 2295998090 seq 3914306118 subseq 384133 len 1428 csum 0x3cf], length 1428
10:53:20.399839 IP 112.26.3.8.41425 > 112.26.3.1.37753: Flags [.], ack 385561, win 24467, options [nop,nop,TS val 4294910263 ecr 156536,mptcp dss ack 3914213298], length 0
10:53:20.400050 IP 112.26.3.1.37753 > 112.26.3.8.41425: Flags [.], seq 389845:391273, ack 1, win 893, options [nop,nop,TS val 157041 ecr 4294910263,mptcp dss ack 2295998090 seq 3914327538 subseq 389845 len 1428 csum 0xb50d], length 1428
10:53:20.400094 IP 112.26.3.1.37753 > 112.26.3.8.41425: Flags [.], seq 391273:392701, ack 1, win 893, options [nop,nop,TS val 157041 ecr 4294910263,mptcp dss ack 2295998090 seq 3914328966 subseq 391273 len 1428 csum 0xcb49], length 1428
10:53:20.452543 IP 112.26.3.1.37753 > 112.26.3.8.41425: Flags [.], seq 385561:386989, ack 1, win 893, options [nop,nop,TS val 156652 ecr 4294909862,mptcp dss ack 2295998090 seq 3914313258 subseq 385561 len 1428 csum 0x42a3], length 1428
10:53:20.510219 IP 112.26.3.8.41425 > 112.26.3.1.37753: Flags [.], ack 386989, win 24267, options [nop,nop,TS val 4294910384 ecr 156652,mptcp dss ack 3914226150], length 0
10:53:20.510413 IP 112.26.3.1.37753 > 112.26.3.8.41425: Flags [.], seq 392701:394129, ack 1, win 893, options [nop,nop,TS val 157152 ecr 4294910384,mptcp dss ack 2295998090 seq 3914333250 subseq 392701 len 1428 csum 0x57f7], length 1428
10:53:20.590782 IP 112.26.3.1.37753 > 112.26.3.8.41425: Flags [.], seq 386989:388417, ack 1, win 893, options [nop,nop,TS val 156780 ecr 4294910003,mptcp dss ack 2295998090 seq 3914318970 subseq 386989 len 1428 csum 0xf83b], length 1428
10:53:20.605141 IP 112.26.3.8.41425 > 112.26.3.1.37753: Flags [.], ack 388417, win 24267, options [nop,nop,TS val 4294910489 ecr 156780,mptcp dss ack 3914226150], length 0
10:53:20.605448 IP 112.26.3.1.37753 > 112.26.3.8.41425: Flags [.], seq 394129:395557, ack 1, win 893, options [nop,nop,TS val 157247 ecr 4294910489,mptcp dss ack 2295998090 seq 3914337534 subseq 394129 len 1428 csum 0xd0db], length 1428
10:53:20.777632 IP 112.26.3.1.37753 > 112.26.3.8.41425: Flags [.], seq 388417:389845, ack 1, win 893, options [nop,nop,TS val 156919 ecr 4294910160,mptcp dss ack 2295998090 seq 3914324682 subseq 388417 len 1428 csum 0xbe65], length 1428
10:53:20.799408 IP 112.26.3.8.41425 > 112.26.3.1.37753: Flags [.], ack 389845, win 24267, options [nop,nop,TS val 4294910675 ecr 156919,mptcp dss ack 3914226150], length 0
10:53:20.799639 IP 112.26.3.1.37753 > 112.26.3.8.41425: Flags [.], seq 395557:396985, ack 1, win 893, options [nop,nop,TS val 157441 ecr 4294910675,mptcp dss ack 2295998090 seq 3914344674 subseq 395557 len 1428 csum 0xfeda], length 1428
10:53:20.909625 IP 112.26.3.1.37753 > 112.26.3.8.41425: Flags [.], seq 389845:391273, ack 1, win 893, options [nop,nop,TS val 157041 ecr 4294910263,mptcp dss ack 2295998090 seq 3914327538 subseq 389845 len 1428 csum 0xb50d], length 1428
10:53:20.925033 IP 112.26.3.8.41425 > 112.26.3.1.37753: Flags [.], ack 391273, win 24267, options [nop,nop,TS val 4294910806 ecr 157041,mptcp dss ack 3914226150], length 0
10:53:20.925341 IP 112.26.3.1.37753 > 112.26.3.8.41425: Flags [.], seq 396985:398413, ack 1, win 893, options [nop,nop,TS val 157566 ecr 4294910806,mptcp dss ack 2295998090 seq 3914348958 subseq 396985 len 1428 csum 0x3def], length 1428
10:53:21.042793 IP 112.26.3.1.37753 > 112.26.3.8.41425: Flags [.], seq 391273:392701, ack 1, win 893, options [nop,nop,TS val 157041 ecr 4294910263,mptcp dss ack 2295998090 seq 3914328966 subseq 391273 len 1428 csum 0xcb49], length 1428
10:53:21.057772 IP 112.26.3.8.41425 > 112.26.3.1.37753: Flags [.], ack 392701, win 24267, options [nop,nop,TS val 4294910942 ecr 157041,mptcp dss ack 3914226150], length 0
10:53:21.058046 IP 112.26.3.1.37753 > 112.26.3.8.41425: Flags [.], seq 398413:399841, ack 1, win 893, options [nop,nop,TS val 157699 ecr 4294910942,mptcp dss ack 2295998090 seq 3914353242 subseq 398413 len 1428 csum 0x258e], length 1428
10:53:21.169036 IP 112.26.3.1.37753 > 112.26.3.8.41425: Flags [.], seq 392701:394129, ack 1, win 893, options [nop,nop,TS val 157152 ecr 4294910384,mptcp dss ack 2295998090 seq 3914333250 subseq 392701 len 1428 csum 0x57f7], length 1428
10:53:21.187465 IP 112.26.3.8.41425 > 112.26.3.1.37753: Flags [.], ack 394129, win 24267, options [nop,nop,TS val 4294911067 ecr 157152,mptcp dss ack 3914226150], length 0
10:53:21.187748 IP 112.26.3.1.37753 > 112.26.3.8.41425: Flags [.], seq 399841:401269, ack 1, win 893, options [nop,nop,TS val 157829 ecr 4294911067,mptcp dss ack 2295998090 seq 3914358954 subseq 399841 len 1428 csum 0xf904], length 1428
10:53:21.312603 IP 112.26.3.1.37753 > 112.26.3.8.41425: Flags [.], seq 394129:395557, ack 1, win 893, options [nop,nop,TS val 157247 ecr 4294910489,mptcp dss ack 2295998090 seq 3914337534 subseq 394129 len 1428 csum 0xd0db], length 1428
10:53:21.341397 IP 112.26.3.8.41425 > 112.26.3.1.37753: Flags [.], ack 395557, win 24267, options [nop,nop,TS val 4294911210 ecr 157247,mptcp dss ack 3914226150], length 0
10:53:21.341688 IP 112.26.3.1.37753 > 112.26.3.8.41425: Flags [.], seq 401269:402697, ack 1, win 893, options [nop,nop,TS val 157983 ecr 4294911210,mptcp dss ack 2295998090 seq 3914366094 subseq 401269 len 1428 csum 0x6a82], length 1428
10:53:21.451739 IP 112.26.3.1.37753 > 112.26.3.8.41425: Flags [.], seq 395557:396985, ack 1, win 893, options [nop,nop,TS val 157441 ecr 4294910675,mptcp dss ack 2295998090 seq 3914344674 subseq 395557 len 1428 csum 0xfeda], length 1428
10:53:21.469459 IP 112.26.3.8.41425 > 112.26.3.1.37753: Flags [.], ack 396985, win 24267, options [nop,nop,TS val 4294911347 ecr 157441,mptcp dss ack 3914226150], length 0
10:53:21.469744 IP 112.26.3.1.37753 > 112.26.3.8.41425: Flags [.], seq 402697:404125, ack 1, win 893, options [nop,nop,TS val 158111 ecr 4294911347,mptcp dss ack 2295998090 seq 3914370378 subseq 402697 len 1428 csum 0x9727], length 1428
10:53:21.601667 IP 112.26.3.1.37753 > 112.26.3.8.41425: Flags [.], seq 396985:398413, ack 1, win 893, options [nop,nop,TS val 157566 ecr 4294910806,mptcp dss ack 2295998090 seq 3914348958 subseq 396985 len 1428 csum 0x3def], length 1428
10:53:21.614553 IP 112.26.3.8.41425 > 112.26.3.1.37753: Flags [.], ack 398413, win 24267, options [nop,nop,TS val 4294911499 ecr 157566,mptcp dss ack 3914226150], length 0
10:53:21.614786 IP 112.26.3.1.37753 > 112.26.3.8.41425: Flags [.], seq 404125:405553, ack 1, win 893, options [nop,nop,TS val 158256 ecr 4294911499,mptcp dss ack 2295998090 seq 3914376090 subseq 404125 len 1428 csum 0x5b9d], length 1428
10:53:21.710834 IP 112.26.3.1.37753 > 112.26.3.8.41425: Flags [.], seq 398413:399841, ack 1, win 893, options [nop,nop,TS val 157699 ecr 4294910942,mptcp dss ack 2295998090 seq 3914353242 subseq 398413 len 1428 csum 0x258e], length 1428
10:53:21.764794 IP 112.26.3.8.41425 > 112.26.3.1.37753: Flags [.], ack 399841, win 24257, options [nop,nop,TS val 4294911622 ecr 157699,mptcp dss ack 3914317542], length 0
10:53:21.764990 IP 112.26.3.1.37753 > 112.26.3.8.41425: Flags [.], seq 405553:406981, ack 1, win 893, options [nop,nop,TS val 158406 ecr 4294911622,mptcp dss ack 2295998090 seq 3914383230 subseq 405553 len 1428 csum 0xdf8d], length 1428
10:53:21.825454 IP 112.26.3.1.37753 > 112.26.3.8.41425: Flags [.], seq 399841:401269, ack 1, win 893, options [nop,nop,TS val 157829 ecr 4294911067,mptcp dss ack 2295998090 seq 3914358954 subseq 399841 len 1428 csum 0xf904], length 1428
10:53:21.923607 IP 112.26.3.1.37753 > 112.26.3.8.41425: Flags [.], seq 401269:402697, ack 1, win 893, options [nop,nop,TS val 157983 ecr 4294911210,mptcp dss ack 2295998090 seq 3914366094 subseq 401269 len 1428 csum 0x6a82], length 1428
10:53:21.935015 IP 112.26.3.8.41425 > 112.26.3.1.37753: Flags [.], ack 401269, win 24525, options [nop,nop,TS val 4294911815 ecr 157829,mptcp dss ack 3914357526], length 0
10:53:21.935221 IP 112.26.3.1.37753 > 112.26.3.8.41425: Flags [.], seq 406981:408409, ack 1, win 893, options [nop,nop,TS val 158576 ecr 4294911815,mptcp dss ack 2295998090 seq 3914390370 subseq 406981 len 1428 csum 0xb78f], length 1428
10:53:22.053817 IP 112.26.3.1.37753 > 112.26.3.8.41425: Flags [.], seq 402697:404125, ack 1, win 893, options [nop,nop,TS val 158111 ecr 4294911347,mptcp dss ack 2295998090 seq 3914370378 subseq 402697 len 1428 csum 0x9727], length 1428
10:53:22.100173 IP 112.26.3.8.41425 > 112.26.3.1.37753: Flags [.], ack 404125, win 24522, options [nop,nop,TS val 4294911950 ecr 157983,mptcp dss ack 3914363238], length 0
10:53:22.100401 IP 112.26.3.1.37753 > 112.26.3.8.41425: Flags [.], seq 408409:409837, ack 1, win 893, options [nop,nop,TS val 158741 ecr 4294911950,mptcp dss ack 2295998090 seq 3914398938 subseq 408409 len 1428 csum 0x63ad], length 1428
10:53:22.100447 IP 112.26.3.1.37753 > 112.26.3.8.41425: Flags [.], seq 409837:411265, ack 1, win 893, options [nop,nop,TS val 158741 ecr 4294911950,mptcp dss ack 2295998090 seq 3914400366 subseq 409837 len 1428 csum 0xd595], length 1428
10:53:22.185143 IP 112.26.3.1.37753 > 112.26.3.8.41425: Flags [.], seq 404125:405553, ack 1, win 893, options [nop,nop,TS val 158256 ecr 4294911499,mptcp dss ack 2295998090 seq 3914376090 subseq 404125 len 1428 csum 0x5b9d], length 1428
10:53:22.276565 IP 112.26.3.1.37753 > 112.26.3.8.41425: Flags [.], seq 405553:406981, ack 1, win 893, options [nop,nop,TS val 158406 ecr 4294911622,mptcp dss ack 2295998090 seq 3914383230 subseq 405553 len 1428 csum 0xdf8d], length 1428
10:53:22.312020 IP 112.26.3.8.41425 > 112.26.3.1.37753: Flags [.], ack 406981, win 24473, options [nop,nop,TS val 4294912195 ecr 158256,mptcp dss ack 3914373234], length 0
10:53:22.312218 IP 112.26.3.1.37753 > 112.26.3.8.41425: Flags [.], seq 411265:412693, ack 1, win 893, options [nop,nop,TS val 158953 ecr 4294912195,mptcp dss ack 2295998090 seq 3914406078 subseq 411265 len 1428 csum 0x2a61], length 1428
10:53:22.312264 IP 112.26.3.1.37753 > 112.26.3.8.41425: Flags [.], seq 412693:414121, ack 1, win 893, options [nop,nop,TS val 158953 ecr 4294912195,mptcp dss ack 2295998090 seq 3914407506 subseq 412693 len 1428 csum 0x1706], length 1428
10:53:22.312370 IP 112.26.3.1.37753 > 112.26.3.8.41425: Flags [.], seq 414121:415549, ack 1, win 893, options [nop,nop,TS val 158953 ecr 4294912195,mptcp dss ack 2295998090 seq 3914408934 subseq 414121 len 1428 csum 0x39ac], length 1428
10:53:22.404240 IP 112.26.3.1.37753 > 112.26.3.8.41425: Flags [.], seq 406981:408409, ack 1, win 893, options [nop,nop,TS val 158576 ecr 4294911815,mptcp dss ack 2295998090 seq 3914390370 subseq 406981 len 1428 csum 0xb78f], length 1428
10:53:22.491634 IP 112.26.3.1.37753 > 112.26.3.8.41425: Flags [.], seq 409837:411265, ack 1, win 893, options [nop,nop,TS val 158741 ecr 4294911950,mptcp dss ack 2295998090 seq 3914400366 subseq 409837 len 1428 csum 0xd595], length 1428
10:53:22.537183 IP 112.26.3.8.41425 > 112.26.3.1.37753: Flags [.], ack 408409, win 24458, options [nop,nop,TS val 4294912424 ecr 158576,mptcp dss ack 3914381802], length 0
10:53:22.537384 IP 112.26.3.1.37753 > 112.26.3.8.41425: Flags [.], seq 415549:416977, ack 1, win 893, options [nop,nop,TS val 159178 ecr 4294912424,mptcp dss ack 2295998090 seq 3914420358 subseq 415549 len 1428 csum 0xf06b], length 1428
10:53:22.630740 IP 112.26.3.1.37753 > 112.26.3.8.41425: Flags [.], seq 411265:412693, ack 1, win 893, options [nop,nop,TS val 158953 ecr 4294912195,mptcp dss ack 2295998090 seq 3914406078 subseq 411265 len 1428 csum 0x2a61], length 1428
10:53:22.661937 IP 112.26.3.8.41425 > 112.26.3.1.37753: Flags [.], ack 408409, win 24458, options [nop,nop,TS val 4294912438 ecr 158576,nop,nop,sack 1 {409837:411265},mptcp dss ack 3914381802], length 0
10:53:22.697006 IP 112.26.3.1.37753 > 112.26.3.8.41425: Flags [.], seq 416977:418405, ack 1, win 893, options [nop,nop,TS val 159338 ecr 4294912438,mptcp dss ack 2295998090 seq 3914427498 subseq 416977 len 1428 csum 0x5c0d], length 1428
10:53:22.792536 IP 112.26.3.1.37753 > 112.26.3.8.41425: Flags [.], seq 412693:414121, ack 1, win 893, options [nop,nop,TS val 158953 ecr 4294912195,mptcp dss ack 2295998090 seq 3914407506 subseq 412693 len 1428 csum 0x1706], length 1428
10:53:22.803774 IP 112.26.3.8.41425 > 112.26.3.1.37753: Flags [.], ack 408409, win 24507, options [nop,nop,TS val 4294912527 ecr 158576,nop,nop,sack 1 {409837:412693},mptcp dss ack 3914388942], length 0
10:53:22.809221 IP 112.26.3.1.37753 > 112.26.3.8.41425: Flags [.], seq 418405:419833, ack 1, win 893, options [nop,nop,TS val 159450 ecr 4294912527,mptcp dss ack 2295998090 seq 3914431782 subseq 418405 len 1428 csum 0xffe3], length 1428
10:53:22.916680 IP 112.26.3.1.37753 > 112.26.3.8.41425: Flags [.], seq 414121:415549, ack 1, win 893, options [nop,nop,TS val 158953 ecr 4294912195,mptcp dss ack 2295998090 seq 3914408934 subseq 414121 len 1428 csum 0x39ac], length 1428
10:53:22.951540 IP 112.26.3.8.41425 > 112.26.3.1.37753: Flags [.], ack 408409, win 24507, options [nop,nop,TS val 4294912689 ecr 158576,nop,nop,sack 1 {409837:414121},mptcp dss ack 3914393226], length 0
10:53:22.951738 IP 112.26.3.1.37753 > 112.26.3.8.41425: Flags [.], seq 408409:409837, ack 1, win 893, options [nop,nop,TS val 159592 ecr 4294912689,mptcp dss ack 2295998090 seq 3914398938 subseq 408409 len 1428 csum 0x63ad], length 1428
10:53:23.037527 IP 112.26.3.8.41425 > 112.26.3.1.37753: Flags [.], ack 408409, win 24504, options [nop,nop,TS val 4294912813 ecr 158576,nop,nop,sack 1 {409837:415549},mptcp dss ack 3914398938], length 0
10:53:23.069947 IP 112.26.3.1.37753 > 112.26.3.8.41425: Flags [.], seq 415549:416977, ack 1, win 893, options [nop,nop,TS val 159178 ecr 4294912424,mptcp dss ack 2295998090 seq 3914420358 subseq 415549 len 1428 csum 0xf06b], length 1428
10:53:23.122190 IP 112.26.3.8.41425 > 112.26.3.1.37753: Flags [.], ack 408409, win 24504, options [nop,nop,TS val 4294912958 ecr 158576,nop,nop,sack 1 {409837:416977},mptcp dss ack 3914398938], length 0
10:53:23.129591 IP 112.26.3.1.37753 > 112.26.3.8.41425: Flags [.], seq 419833:421261, ack 1, win 893, options [nop,nop,TS val 159770 ecr 4294912958,mptcp dss ack 2295998090 seq 3914443206 subseq 419833 len 1428 csum 0xc735], length 1428
10:53:23.153600 IP 112.26.3.1.37753 > 112.26.3.8.41425: Flags [.], seq 416977:418405, ack 1, win 893, options [nop,nop,TS val 159338 ecr 4294912438,mptcp dss ack 2295998090 seq 3914427498 subseq 416977 len 1428 csum 0x5c0d], length 1428
10:53:23.204411 IP 112.26.3.8.41425 > 112.26.3.1.37753: Flags [.], ack 408409, win 24504, options [nop,nop,TS val 4294913051 ecr 158576,nop,nop,sack 1 {409837:418405},mptcp dss ack 3914398938], length 0
10:53:23.219915 IP 112.26.3.1.37753 > 112.26.3.8.41425: Flags [.], seq 421261:422689, ack 1, win 893, options [nop,nop,TS val 159860 ecr 4294913051,mptcp dss ack 2295998090 seq 3914447490 subseq 421261 len 1428 csum 0x4fae], length 1428
10:53:23.263698 IP 112.26.3.1.37753 > 112.26.3.8.41425: Flags [.], seq 418405:419833, ack 1, win 893, options [nop,nop,TS val 159450 ecr 4294912527,mptcp dss ack 2295998090 seq 3914431782 subseq 418405 len 1428 csum 0xffe3], length 1428
10:53:23.363456 IP 112.26.3.8.41425 > 112.26.3.1.37753: Flags [.], ack 408409, win 24504, options [nop,nop,TS val 4294913162 ecr 158576,nop,nop,sack 1 {409837:419833},mptcp dss ack 3914398938], length 0
10:53:23.369181 IP 112.26.3.1.37753 > 112.26.3.8.41425: Flags [.], seq 408409:409837, ack 1, win 893, options [nop,nop,TS val 159592 ecr 4294912689,mptcp dss ack 2295998090 seq 3914398938 subseq 408409 len 1428 csum 0x63ad], length 1428
10:53:23.444174 IP 112.26.3.1.37753 > 112.26.3.8.41425: Flags [.], seq 422689:424117, ack 1, win 893, options [nop,nop,TS val 160085 ecr 4294913162,mptcp dss ack 2295998090 seq 3914460342 subseq 422689 len 1428 csum 0x9798], length 1428
10:53:23.483886 IP 112.26.3.8.41425 > 112.26.3.1.37753: Flags [.], ack 419833, win 24214, options [nop,nop,TS val 4294913268 ecr 159592,mptcp dss ack 3914417502], length 0
10:53:23.484120 IP 112.26.3.1.37753 > 112.26.3.8.41425: Flags [.], seq 424117:425545, ack 1, win 893, options [nop,nop,TS val 160125 ecr 4294913268,mptcp dss ack 2295998090 seq 3914463198 subseq 424117 len 1428 csum 0x8a60], length 1428
10:53:23.493652 IP 112.26.3.1.37753 > 112.26.3.8.41425: Flags [.], seq 419833:421261, ack 1, win 893, options [nop,nop,TS val 159770 ecr 4294912958,mptcp dss ack 2295998090 seq 3914443206 subseq 419833 len 1428 csum 0xc735], length 1428
10:53:23.572172 IP 112.26.3.1.37753 > 112.26.3.8.41425: Flags [.], seq 421261:422689, ack 1, win 893, options [nop,nop,TS val 159860 ecr 4294913051,mptcp dss ack 2295998090 seq 3914447490 subseq 421261 len 1428 csum 0x4fae], length 1428
10:53:23.618480 IP 112.26.3.8.41425 > 112.26.3.1.37753: Flags [.], ack 421261, win 24455, options [nop,nop,TS val 4294913440 ecr 159770,mptcp dss ack 3914426070], length 0
10:53:23.618678 IP 112.26.3.1.37753 > 112.26.3.8.41425: Flags [.], seq 425545:426973, ack 1, win 893, options [nop,nop,TS val 160260 ecr 4294913440,mptcp dss ack 2295998090 seq 3914470338 subseq 425545 len 1428 csum 0x2faf], length 1428
10:53:23.618726 IP 112.26.3.1.37753 > 112.26.3.8.41425: Flags [.], seq 426973:428401, ack 1, win 893, options [nop,nop,TS val 160260 ecr 4294913440,mptcp dss ack 2295998090 seq 3914471766 subseq 426973 len 1428 csum 0xa543], length 1428
10:53:23.709892 IP 112.26.3.1.37753 > 112.26.3.8.41425: Flags [.], seq 422689:424117, ack 1, win 893, options [nop,nop,TS val 160085 ecr 4294913162,mptcp dss ack 2295998090 seq 3914460342 subseq 422689 len 1428 csum 0x9798], length 1428
10:53:23.757403 IP 112.26.3.8.41425 > 112.26.3.1.37753: Flags [.], ack 422689, win 24442, options [nop,nop,TS val 4294913539 ecr 159860,mptcp dss ack 3914430354], length 0
10:53:23.757638 IP 112.26.3.1.37753 > 112.26.3.8.41425: Flags [.], seq 428401:429829, ack 1, win 893, options [nop,nop,TS val 160399 ecr 4294913539,mptcp dss ack 2295998090 seq 3914481762 subseq 428401 len 1428 csum 0x69e5], length 1428
10:53:23.851638 IP 112.26.3.1.37753 > 112.26.3.8.41425: Flags [.], seq 424117:425545, ack 1, win 893, options [nop,nop,TS val 160125 ecr 4294913268,mptcp dss ack 2295998090 seq 3914463198 subseq 424117 len 1428 csum 0x8a60], length 1428
10:53:23.869903 IP 112.26.3.8.41425 > 112.26.3.1.37753: Flags [.], ack 424117, win 24440, options [nop,nop,TS val 4294913639 ecr 160085,mptcp dss ack 3914436066], length 0
10:53:23.870134 IP 112.26.3.1.37753 > 112.26.3.8.41425: Flags [.], seq 429829:431257, ack 1, win 893, options [nop,nop,TS val 160511 ecr 4294913639,mptcp dss ack 2295998090 seq 3914483190 subseq 429829 len 1428 csum 0x1d69], length 1428
10:53:23.965365 IP 112.26.3.8.41425 > 112.26.3.1.37753: Flags [.], ack 425545, win 24433, options [nop,nop,TS val 4294913779 ecr 160125,mptcp dss ack 3914441778], length 0
10:53:23.965669 IP 112.26.3.1.37753 > 112.26.3.8.41425: Flags [.], seq 431257:432685, ack 1, win 893, options [nop,nop,TS val 160607 ecr 4294913779,mptcp dss ack 2295998090 seq 3914488902 subseq 431257 len 1428 csum 0xdcb3], length 1428
10:53:23.983118 IP 112.26.3.1.37753 > 112.26.3.8.41425: Flags [.], seq 425545:426973, ack 1, win 893, options [nop,nop,TS val 160260 ecr 4294913440,mptcp dss ack 2295998090 seq 3914470338 subseq 425545 len 1428 csum 0x2faf], length 1428
10:53:24.040225 IP 112.26.3.8.41425 > 112.26.3.1.37753: Flags [.], ack 426973, win 24393, options [nop,nop,TS val 4294913900 ecr 160260,mptcp dss ack 3914448918], length 0
10:53:24.040410 IP 112.26.3.1.37753 > 112.26.3.8.41425: Flags [P.], seq 432685:434113, ack 1, win 893, options [nop,nop,TS val 160682 ecr 4294913900,mptcp dss ack 2295998090 seq 3914494614 subseq 432685 len 1428 csum 0x3ed0], length 1428
10:53:24.109948 IP 112.26.3.1.37753 > 112.26.3.8.41425: Flags [.], seq 426973:428401, ack 1, win 893, options [nop,nop,TS val 160260 ecr 4294913440,mptcp dss ack 2295998090 seq 3914471766 subseq 426973 len 1428 csum 0xa543], length 1428
10:53:24.155188 IP 112.26.3.8.41425 > 112.26.3.1.37753: Flags [.], ack 428401, win 24424, options [nop,nop,TS val 4294914037 ecr 160260,mptcp dss ack 3914458914], length 0
10:53:24.155418 IP 112.26.3.1.37753 > 112.26.3.8.41425: Flags [.], seq 434113:435541, ack 1, win 893, options [nop,nop,TS val 160797 ecr 4294914037,mptcp dss ack 2295998090 seq 3914500326 subseq 434113 len 1428 csum 0x7c9d], length 1428
10:53:24.155463 IP 112.26.3.1.37753 > 112.26.3.8.41425: Flags [.], seq 435541:436969, ack 1, win 893, options [nop,nop,TS val 160797 ecr 4294914037,mptcp dss ack 2295998090 seq 3914501754 subseq 435541 len 1428 csum 0x5f0c], length 1428
10:53:24.217282 IP 112.26.3.1.37753 > 112.26.3.8.41425: Flags [.], seq 428401:429829, ack 1, win 893, options [nop,nop,TS val 160399 ecr 4294913539,mptcp dss ack 2295998090 seq 3914481762 subseq 428401 len 1428 csum 0x69e5], length 1428
10:53:24.265433 IP 112.26.3.8.41425 > 112.26.3.1.37753: Flags [.], ack 429829, win 24458, options [nop,nop,TS val 4294914154 ecr 160399,mptcp dss ack 3914466054], length 0
10:53:24.265672 IP 112.26.3.1.37753 > 112.26.3.8.41425: Flags [.], seq 436969:438397, ack 1, win 893, options [nop,nop,TS val 160907 ecr 4294914154,mptcp dss ack 2295998090 seq 3914508894 subseq 436969 len 1428 csum 0x5bb3], length 1428
10:53:24.356352 IP 112.26.3.1.37753 > 112.26.3.8.41425: Flags [.], seq 429829:431257, ack 1, win 893, options [nop,nop,TS val 160511 ecr 4294913639,mptcp dss ack 2295998090 seq 3914483190 subseq 429829 len 1428 csum 0x1d69], length 1428
10:53:24.425144 IP 112.26.3.8.41425 > 112.26.3.1.37753: Flags [.], ack 431257, win 24473, options [nop,nop,TS val 4294914258 ecr 160511,mptcp dss ack 3914473194], length 0
10:53:24.425339 IP 112.26.3.1.37753 > 112.26.3.8.41425: Flags [.], seq 438397:439825, ack 1, win 893, options [nop,nop,TS val 161067 ecr 4294914258,mptcp dss ack 2295998090 seq 3914521746 subseq 438397 len 1428 csum 0xbbc4], length 1428
10:53:24.477120 IP 112.26.3.1.37753 > 112.26.3.8.41425: Flags [.], seq 431257:432685, ack 1, win 893, options [nop,nop,TS val 160607 ecr 4294913779,mptcp dss ack 2295998090 seq 3914488902 subseq 431257 len 1428 csum 0xdcb3], length 1428
10:53:24.527579 IP 112.26.3.8.41425 > 112.26.3.1.37753: Flags [.], ack 432685, win 24451, options [nop,nop,TS val 4294914385 ecr 160607,mptcp dss ack 3914474622], length 0
10:53:24.527796 IP 112.26.3.1.37753 > 112.26.3.8.41425: Flags [.], seq 439825:441253, ack 1, win 893, options [nop,nop,TS val 161169 ecr 4294914385,mptcp dss ack 2295998090 seq 3914523174 subseq 439825 len 1428 csum 0x1b7c], length 1428
10:53:24.582865 IP 112.26.3.1.37753 > 112.26.3.8.41425: Flags [P.], seq 432685:434113, ack 1, win 893, options [nop,nop,TS val 160682 ecr 4294913900,mptcp dss ack 2295998090 seq 3914494614 subseq 432685 len 1428 csum 0x3ed0], length 1428
10:53:24.617690 IP 112.26.3.8.41425 > 112.26.3.1.37753: Flags [.], ack 434113, win 24422, options [nop,nop,TS val 4294914497 ecr 160682,mptcp dss ack 3914478906], length 0
10:53:24.617882 IP 112.26.3.1.37753 > 112.26.3.8.41425: Flags [.], seq 441253:442681, ack 1, win 893, options [nop,nop,TS val 161259 ecr 4294914497,mptcp dss ack 2295998090 seq 3914533170 subseq 441253 len 1428 csum 0xbb95], length 1428
10:53:24.656239 IP 112.26.3.1.37753 > 112.26.3.8.41425: Flags [.], seq 434113:435541, ack 1, win 893, options [nop,nop,TS val 160797 ecr 4294914037,mptcp dss ack 2295998090 seq 3914500326 subseq 434113 len 1428 csum 0x7c9d], length 1428
10:53:24.745846 IP 112.26.3.8.41425 > 112.26.3.1.37753: Flags [.], ack 435541, win 24422, options [nop,nop,TS val 4294914619 ecr 160797,mptcp dss ack 3914486046], length 0
10:53:24.746090 IP 112.26.3.1.37753 > 112.26.3.8.41425: Flags [.], seq 442681:444109, ack 1, win 893, options [nop,nop,TS val 161387 ecr 4294914619,mptcp dss ack 2295998090 seq 3914540310 subseq 442681 len 1428 csum 0x178e], length 1428
10:53:24.764413 IP 112.26.3.1.37753 > 112.26.3.8.41425: Flags [.], seq 435541:436969, ack 1, win 893, options [nop,nop,TS val 160797 ecr 4294914037,mptcp dss ack 2295998090 seq 3914501754 subseq 435541 len 1428 csum 0x5f0c], length 1428
10:53:24.836419 IP 112.26.3.1.37753 > 112.26.3.8.41425: Flags [.], seq 436969:438397, ack 1, win 893, options [nop,nop,TS val 160907 ecr 4294914154,mptcp dss ack 2295998090 seq 3914508894 subseq 436969 len 1428 csum 0x5bb3], length 1428
10:53:24.877316 IP 112.26.3.8.41425 > 112.26.3.1.37753: Flags [.], ack 436969, win 24419, options [nop,nop,TS val 4294914752 ecr 160797,mptcp dss ack 3914491758], length 0
10:53:24.877537 IP 112.26.3.1.37753 > 112.26.3.8.41425: Flags [.], seq 444109:445537, ack 1, win 893, options [nop,nop,TS val 161519 ecr 4294914752,mptcp dss ack 2295998090 seq 3914553162 subseq 444109 len 1428 csum 0x95af], length 1428
10:53:24.951614 IP 112.26.3.1.37753 > 112.26.3.8.41425: Flags [.], seq 438397:439825, ack 1, win 893, options [nop,nop,TS val 161067 ecr 4294914258,mptcp dss ack 2295998090 seq 3914521746 subseq 438397 len 1428 csum 0xbbc4], length 1428
10:53:24.975993 IP 112.26.3.8.41425 > 112.26.3.1.37753: Flags [.], ack 438397, win 24397, options [nop,nop,TS val 4294914859 ecr 160907,mptcp dss ack 3914493186], length 0
10:53:24.976242 IP 112.26.3.1.37753 > 112.26.3.8.41425: Flags [.], seq 445537:446965, ack 1, win 893, options [nop,nop,TS val 161617 ecr 4294914859,mptcp dss ack 2295998090 seq 3914557446 subseq 445537 len 1428 csum 0xea58], length 1428
10:53:25.041435 IP 112.26.3.1.37753 > 112.26.3.8.41425: Flags [.], seq 439825:441253, ack 1, win 893, options [nop,nop,TS val 161169 ecr 4294914385,mptcp dss ack 2295998090 seq 3914523174 subseq 439825 len 1428 csum 0x1b7c], length 1428
10:53:25.110147 IP 112.26.3.8.41425 > 112.26.3.1.37753: Flags [.], ack 439825, win 24442, options [nop,nop,TS val 4294914955 ecr 161067,mptcp dss ack 3914504610], length 0
10:53:25.110366 IP 112.26.3.1.37753 > 112.26.3.8.41425: Flags [.], seq 446965:448393, ack 1, win 893, options [nop,nop,TS val 161751 ecr 4294914955,mptcp dss ack 2295998090 seq 3914566014 subseq 446965 len 1428 csum 0xa0fb], length 1428
10:53:25.151335 IP 112.26.3.1.37753 > 112.26.3.8.41425: Flags [.], seq 441253:442681, ack 1, win 893, options [nop,nop,TS val 161259 ecr 4294914497,mptcp dss ack 2295998090 seq 3914533170 subseq 441253 len 1428 csum 0xbb95], length 1428
10:53:25.219851 IP 112.26.3.8.41425 > 112.26.3.1.37753: Flags [.], ack 441253, win 24420, options [nop,nop,TS val 4294915105 ecr 161169,mptcp dss ack 3914506038], length 0
10:53:25.220075 IP 112.26.3.1.37753 > 112.26.3.8.41425: Flags [.], seq 448393:449821, ack 1, win 893, options [nop,nop,TS val 161861 ecr 4294915105,mptcp dss ack 2295998090 seq 3914570298 subseq 448393 len 1428 csum 0xd1ae], length 1428
10:53:25.271693 IP 112.26.3.1.37753 > 112.26.3.8.41425: Flags [.], seq 442681:444109, ack 1, win 893, options [nop,nop,TS val 161387 ecr 4294914619,mptcp dss ack 2295998090 seq 3914540310 subseq 442681 len 1428 csum 0x178e], length 1428
10:53:25.346173 IP 112.26.3.8.41425 > 112.26.3.1.37753: Flags [.], ack 444109, win 24396, options [nop,nop,TS val 4294915215 ecr 161259,mptcp dss ack 3914514606], length 0
10:53:25.346394 IP 112.26.3.1.37753 > 112.26.3.8.41425: Flags [.], seq 449821:451249, ack 1, win 893, options [nop,nop,TS val 161987 ecr 4294915215,mptcp dss ack 2295998090 seq 3914581722 subseq 449821 len 1428 csum 0x1a88], length 1428
10:53:25.346439 IP 112.26.3.1.37753 > 112.26.3.8.41425: Flags [.], seq 451249:452677, ack 1, win 893, options [nop,nop,TS val 161987 ecr 4294915215,mptcp dss ack 2295998090 seq 3914583150 subseq 451249 len 1428 csum 0xc68c], length 1428
10:53:25.399455 IP 112.26.3.1.37753 > 112.26.3.8.41425: Flags [.], seq 444109:445537, ack 1, win 893, options [nop,nop,TS val 161519 ecr 4294914752,mptcp dss ack 2295998090 seq 3914553162 subseq 444109 len 1428 csum 0x95af], length 1428
10:53:25.499854 IP 112.26.3.1.37753 > 112.26.3.8.41425: Flags [.], seq 445537:446965, ack 1, win 893, options [nop,nop,TS val 161617 ecr 4294914859,mptcp dss ack 2295998090 seq 3914557446 subseq 445537 len 1428 csum 0xea58], length 1428
10:53:25.532104 IP 112.26.3.8.41425 > 112.26.3.1.37753: Flags [.], ack 446965, win 24356, options [nop,nop,TS val 4294915418 ecr 161519,mptcp dss ack 3914517462], length 0
10:53:25.532327 IP 112.26.3.1.37753 > 112.26.3.8.41425: Flags [.], seq 452677:454105, ack 1, win 893, options [nop,nop,TS val 162173 ecr 4294915418,mptcp dss ack 2295998090 seq 3914594574 subseq 452677 len 1428 csum 0x6083], length 1428
10:53:25.532371 IP 112.26.3.1.37753 > 112.26.3.8.41425: Flags [.], seq 454105:455533, ack 1, win 893, options [nop,nop,TS val 162173 ecr 4294915418,mptcp dss ack 2295998090 seq 3914596002 subseq 454105 len 1428 csum 0xf378], length 1428
10:53:25.618466 IP 112.26.3.1.37753 > 112.26.3.8.41425: Flags [.], seq 446965:448393, ack 1, win 893, options [nop,nop,TS val 161751 ecr 4294914955,mptcp dss ack 2295998090 seq 3914566014 subseq 446965 len 1428 csum 0xa0fb], length 1428
10:53:25.717216 IP 112.26.3.1.37753 > 112.26.3.8.41425: Flags [.], seq 448393:449821, ack 1, win 893, options [nop,nop,TS val 161861 ecr 4294915105,mptcp dss ack 2295998090 seq 3914570298 subseq 448393 len 1428 csum 0xd1ae], length 1428
10:53:25.760751 IP 112.26.3.1.37753 > 112.26.3.8.41425: Flags [.], seq 449821:451249, ack 1, win 893, options [nop,nop,TS val 161987 ecr 4294915215,mptcp dss ack 2295998090 seq 3914581722 subseq 449821 len 1428 csum 0x1a88], length 1428
10:53:25.782245 IP 112.26.3.8.41425 > 112.26.3.1.37753: Flags [.], ack 449821, win 24349, options [nop,nop,TS val 4294915668 ecr 161751,mptcp dss ack 3914531742], length 0
10:53:25.782461 IP 112.26.3.1.37753 > 112.26.3.8.41425: Flags [.], seq 455533:456961, ack 1, win 893, options [nop,nop,TS val 162423 ecr 4294915668,mptcp dss ack 2295998090 seq 3914610282 subseq 455533 len 1428 csum 0xa434], length 1428
10:53:25.782509 IP 112.26.3.1.37753 > 112.26.3.8.41425: Flags [.], seq 456961:458389, ack 1, win 893, options [nop,nop,TS val 162423 ecr 4294915668,mptcp dss ack 2295998090 seq 3914611710 subseq 456961 len 1428 csum 0xe9db], length 1428
10:53:25.896011 IP 112.26.3.1.37753 > 112.26.3.8.41425: Flags [.], seq 451249:452677, ack 1, win 893, options [nop,nop,TS val 161987 ecr 4294915215,mptcp dss ack 2295998090 seq 3914583150 subseq 451249 len 1428 csum 0xc68c], length 1428
10:53:25.908446 IP 112.26.3.8.41425 > 112.26.3.1.37753: Flags [.], ack 452677, win 24375, options [nop,nop,TS val 4294915791 ecr 161987,mptcp dss ack 3914546022], length 0
10:53:25.908683 IP 112.26.3.1.37753 > 112.26.3.8.41425: Flags [.], seq 458389:459817, ack 1, win 893, options [nop,nop,TS val 162550 ecr 4294915791,mptcp dss ack 2295998090 seq 3914625990 subseq 458389 len 1428 csum 0x821c], length 1428
10:53:25.908738 IP 112.26.3.1.37753 > 112.26.3.8.41425: Flags [.], seq 459817:461245, ack 1, win 893, options [nop,nop,TS val 162550 ecr 4294915791,mptcp dss ack 2295998090 seq 3914627418 subseq 459817 len 1428 csum 0xc5], length 1428
10:53:26.004742 IP 112.26.3.1.37753 > 112.26.3.8.41425: Flags [.], seq 452677:454105, ack 1, win 893, options [nop,nop,TS val 162173 ecr 4294915418,mptcp dss ack 2295998090 seq 3914594574 subseq 452677 len 1428 csum 0x6083], length 1428
10:53:26.097141 IP 112.26.3.1.37753 > 112.26.3.8.41425: Flags [.], seq 454105:455533, ack 1, win 893, options [nop,nop,TS val 162173 ecr 4294915418,mptcp dss ack 2295998090 seq 3914596002 subseq 454105 len 1428 csum 0xf378], length 1428
10:53:26.111234 IP 112.26.3.8.41425 > 112.26.3.1.37753: Flags [.], ack 455533, win 24440, options [nop,nop,TS val 4294915999 ecr 162173,mptcp dss ack 3914561730], length 0
10:53:26.111452 IP 112.26.3.1.37753 > 112.26.3.8.41425: Flags [.], seq 461245:462673, ack 1, win 893, options [nop,nop,TS val 162752 ecr 4294915999,mptcp dss ack 2295998090 seq 3914640270 subseq 461245 len 1428 csum 0xfe1], length 1428
10:53:26.111497 IP 112.26.3.1.37753 > 112.26.3.8.41425: Flags [.], seq 462673:464101, ack 1, win 893, options [nop,nop,TS val 162752 ecr 4294915999,mptcp dss ack 2295998090 seq 3914641698 subseq 462673 len 1428 csum 0xbdd5], length 1428
10:53:26.194757 IP 112.26.3.1.37753 > 112.26.3.8.41425: Flags [.], seq 455533:456961, ack 1, win 893, options [nop,nop,TS val 162423 ecr 4294915668,mptcp dss ack 2295998090 seq 3914610282 subseq 455533 len 1428 csum 0xa434], length 1428
10:53:26.269785 IP 112.26.3.1.37753 > 112.26.3.8.41425: Flags [.], seq 456961:458389, ack 1, win 893, options [nop,nop,TS val 162423 ecr 4294915668,mptcp dss ack 2295998090 seq 3914611710 subseq 456961 len 1428 csum 0xe9db], length 1428
10:53:26.358173 IP 112.26.3.1.37753 > 112.26.3.8.41425: Flags [.], seq 458389:459817, ack 1, win 893, options [nop,nop,TS val 162550 ecr 4294915791,mptcp dss ack 2295998090 seq 3914625990 subseq 458389 len 1428 csum 0x821c], length 1428
10:53:26.381689 IP 112.26.3.8.41425 > 112.26.3.1.37753: Flags [.], ack 459817, win 24418, options [nop,nop,TS val 4294916269 ecr 162423,mptcp dss ack 3914563158], length 0
10:53:26.381957 IP 112.26.3.1.37753 > 112.26.3.8.41425: Flags [.], seq 464101:465529, ack 1, win 893, options [nop,nop,TS val 163023 ecr 4294916269,mptcp dss ack 2295998090 seq 3914654550 subseq 464101 len 1428 csum 0xe0cd], length 1428
10:53:26.381993 IP 112.26.3.1.37753 > 112.26.3.8.41425: Flags [.], seq 465529:466957, ack 1, win 893, options [nop,nop,TS val 163023 ecr 4294916269,mptcp dss ack 2295998090 seq 3914655978 subseq 465529 len 1428 csum 0xef8], length 1428
10:53:26.382096 IP 112.26.3.1.37753 > 112.26.3.8.41425: Flags [.], seq 466957:468385, ack 1, win 893, options [nop,nop,TS val 163023 ecr 4294916269,mptcp dss ack 2295998090 seq 3914657406 subseq 466957 len 1428 csum 0xbf0c], length 1428
10:53:26.382159 IP 112.26.3.1.37753 > 112.26.3.8.41425: Flags [.], seq 468385:469813, ack 1, win 893, options [nop,nop,TS val 163023 ecr 4294916269,mptcp dss ack 2295998090 seq 3914658834 subseq 468385 len 1428 csum 0x65a2], length 1428
10:53:26.485350 IP 112.26.3.1.37753 > 112.26.3.8.41425: Flags [.], seq 459817:461245, ack 1, win 893, options [nop,nop,TS val 162550 ecr 4294915791,mptcp dss ack 2295998090 seq 3914627418 subseq 459817 len 1428 csum 0xc5], length 1428
10:53:26.559641 IP 112.26.3.1.37753 > 112.26.3.8.41425: Flags [.], seq 461245:462673, ack 1, win 893, options [nop,nop,TS val 162752 ecr 4294915999,mptcp dss ack 2295998090 seq 3914640270 subseq 461245 len 1428 csum 0xfe1], length 1428
10:53:26.705715 IP 112.26.3.8.41425 > 112.26.3.1.37753: Flags [.], ack 462673, win 24418, options [nop,nop,TS val 4294916592 ecr 162550,mptcp dss ack 3914563158], length 0
10:53:26.705905 IP 112.26.3.1.37753 > 112.26.3.8.41425: Flags [.], seq 469813:471241, ack 1, win 893, options [nop,nop,TS val 163347 ecr 4294916592,mptcp dss ack 2295998090 seq 3914668830 subseq 469813 len 1428 csum 0x7d71], length 1428
10:53:26.705948 IP 112.26.3.1.37753 > 112.26.3.8.41425: Flags [.], seq 471241:472669, ack 1, win 893, options [nop,nop,TS val 163347 ecr 4294916592,mptcp dss ack 2295998090 seq 3914670258 subseq 471241 len 1428 csum 0x6aec], length 1428
10:53:26.733392 IP 112.26.3.1.37753 > 112.26.3.8.41425: Flags [.], seq 462673:464101, ack 1, win 893, options [nop,nop,TS val 162752 ecr 4294915999,mptcp dss ack 2295998090 seq 3914641698 subseq 462673 len 1428 csum 0xbdd5], length 1428
10:53:26.841109 IP 112.26.3.1.37753 > 112.26.3.8.41425: Flags [.], seq 464101:465529, ack 1, win 893, options [nop,nop,TS val 163023 ecr 4294916269,mptcp dss ack 2295998090 seq 3914654550 subseq 464101 len 1428 csum 0xe0cd], length 1428
